A1: 序号 | B1: 转债代码 | C1: 转债名称 | D1: 股票代码 | E1: 股票名称 | F1: 行业 | G1: 子行业 | H1: 转债价格 | I1: 涨跌 | J1: 日内套利 | K1: 股价 | L1: 涨跌 | M1: 剩余本息 | N1: 转股价格 | O1: 转股溢价率 | P1: 转股价值 | Q1: 距离转股日 | R1: 剩余年限 | S1: 回售年限 | T1: 转债余额 | U1: 转债成交额 | V1: 转债换手率 | W1: 余额/市值 | X1: 余额/股本 | Y1: 股票市值 | Z1: P/B | AA1: 税前收益率 | AB1: 税后收益率 | AC1: 税前回售收益 | AD1: 税后回售收益 | AE1: 回售价值 | AF1: 纯债价值 | AG1: 弹性 | AH1: 信用 | AI1: 折现率 | AJ1: 双低 | AK1: 老式双低 | AL1: 老式排名 | AM1: 新式双低 | AN1: 新式排名 | AO1: MA20乖离 | AP1: 热门度 | AQ1: 转债名称
A2: 215 | B2: 128062 | C2: 亚药转债! | D2: 2370. | E2: 亚太药业 | F2: 医药 | G2: 化学制药 | H2: 73.39 | I2: -3.7000000000000002e-003 | J2: 3.7000000000000002e-003 | K2: 4.44 | L2: 0. | M2: 119.8 | N2: 16.25 | O2: 1.6899999999999999 | P2: 27.32 | Q2: 转股中 | R2: 4.36年 | S2: 2.36年 | T2: 9.64 | U2: 5.7 | V2: 8.0000000000000002e-003 | W2: 0.40500000000000003 | X2: 0.111 | Y2: 24 | Z2: 7.4 | AA2: 0.122 | AB2: 0.11199999999999999 | AC2: 0.14599999999999999 | AD2: 0.14300000000000002 | AE2: 81.94 | AF2: 80.67 | AG2: 0 | AH2: A- | AI2: 9.69e-002 | AJ2: =H2+100*O2 -> 242.38999999999999 | AK2: 119.5 | AL2: 11 | AM2: 37.5 | AN2: 106 | AO2: -3.2000000000000001e-002 | AP2: 86 | AQ2: 亚药转债!
A3: 69 | B3: 127018 | C3: 本钢转债! | D3: 761. | E3: 本钢板材 | F3: 钢铁 | G3: 炼钢 | H3: 84.38 | I3: 5.0000000000000001e-004 | J3: 1.9e-003 | K3: 3.36 | L3: 1.2e-002 | M3: 128.6 | N3: 5.03 | O3: 0.26300000000000001 | P3: 66.8 | Q3: 45天 | R3: 5.61年 | S3: 3.61年 | T3: 68 | U3: 43 | V3: 6.9999999999999993e-003 | W3: 0.52200000000000002 | X3: 0.34899999999999998 | Y3: 130 | Z3: 0.66 | AA3: 8.0600000000000005e-002 | AB3: 7.1199999999999999e-002 | AC3: 6.4500000000000002e-002 | AD3: 6.08e-002 | AE3: 88.34 | AF3: 97.91 | AG3: 0.2 | AH3: AAA | AI3: 5.1399999999999994e-002 | AJ3: =H3+100*O3 -> 110.67999999999999 | AK3: 102 | AL3: 1 | AM3: 4 | AN3: 1 | AO3: 1.6e-002 | AP3: 37 | AQ3: 本钢转债!
A4: 235 | B4: 113527 | C4: 维格转债! | D4: 603518 | E4: 锦泓集团 | F4: 服装纺织 | G4: 服装行业 | H4: 90.49 | I4: -4.0000000000000002e-004 | J4: 4.0000000000000002e-004 | K4: 5.81 | L4: 0. | M4: 120.2 | N4: 9.85 | O4: 0.53400000000000003 | P4: 58.98 | Q4: 转股中 | R4: 4.18年 | S4: 2.18年 | T4: 7.46 | U4: 3.2 | V4: 5.0000000000000001e-003 | W4: 0.50900000000000001 | X4: 0.29999999999999999 | Y4: 15 | Z4: 0.93 | AA4: 7.2000000000000008e-002 | AB4: 6.2800000000000009e-002 | AC4: 5.9900000000000002e-002 | AD4: 5.6600000000000004e-002 | AE4: 91.48 | AF4: 96.63 | AG4: 0.09 | AH4: AA | AI4: 5.4900000000000004e-002 | AJ4: =H4+100*O4 -> 143.88999999999999 | AK4: 122 | AL4: 22 | AM4: 25.4 | AN4: 12 | AO4: -5.5999999999999994e-002 | AP4: 100 | AQ4: 维格转债!
A5: 291 | B5: 128023 | C5: 亚太转债! | D5: 2284. | E5: 亚太股份 | F5: 汽车 | G5: 零部件制 | H5: 96.339 | I5: 6.1999999999999998e-003 | J5: -4.0000000000000001e-003 | K5: 5.96 | L5: 6.2400000000000004e-002 | M5: 112.3 | N5: 10.34 | O5: 0.67099999999999993 | P5: 57.64 | Q5: 转股中 | R5: 3年14天 | S5: 1年14天 | T5: 9.99 | U5: 51 | V5: 5.2000000000000005e-002 | W5: 0.22699999999999998 | X5: 0.13100000000000001 | Y5: 44 | Z5: 1.81 | AA5: 5.3099999999999994e-002 | AB5: 4.4999999999999998e-002 | AC5: 5.5999999999999994e-002 | AD5: 5.1100000000000007e-002 | AE5: 97.56 | AF5: 98.59 | AG5: 0.03 | AH5: AA | AI5: 4.4900000000000002e-002 | AJ5: =H5+100*O5 -> 163.43899999999999 | AK5: 135 | AL5: 170 | AM5: 36.5 | AN5: 95 | AO5: 9.6000000000000002e-002 | AP5: 65 | AQ5: 亚太转债!
A6: 58 | B6: 127019 | C6: 国城转债! | D6: 688. | E6: 国城矿业 | F6: 有色金属 | G6: 锌铅镍锡 | H6: 90.4 | I6: 0. | J6: 1.e-003 | K6: 11.07 | L6: 1.1899999999999999e-002 | M6: 115.1 | N6: 21.07 | O6: 0.72099999999999997 | P6: 52.54 | Q6: 2月2天 | R6: 5.65年 | S6: 3.65年 | T6: 8.5 | U6: 6 | V6: 8.0000000000000002e-003 | W6: 6.8000000000000005e-002 | X6: 3.5000000000000003e-002 | Y6: 126 | Z6: 5.69 | AA6: 4.4500000000000005e-002 | AB6: 3.9399999999999998e-002 | AC6: 3.6699999999999997e-002 | AD6: 3.4700000000000002e-002 | AE6: 87.26 | AF6: 89.5 | AG6: 0.09 | AH6: AA | AI6: 4.6399999999999997e-002 | AJ6: =H6+100*O6 -> 162.5 | AK6: 128.3 | AL6: 96 | AM6: 38.8 | AN6: 119 | AO6: 1.8000000000000002e-002 | AP6: 26 | AQ6: 国城转债!
A7: 303 | B7: 128015 | C7: 久其转债! | D7: 2279. | E7: 久其软件 | F7: 计算机及 | G7: 软件开发 | H7: 99.602 | I7: -8.9999999999999998e-004 | J7: 8.9999999999999998e-004 | K7: 5.42 | L7: 5.6000000000000008e-003 | M7: 110.8 | N7: 9.48 | O7: 0.74199999999999999 | P7: 57.17 | Q7: 转股中 | R7: 2.55年 | S7: 0.55年 | T7: 7.8 | U7: 4.8 | V7: 6.0000000000000001e-003 | W7: 0.20199999999999999 | X7: 0.11599999999999999 | Y7: 39 | Z7: 5.46 | AA7: 4.3400000000000001e-002 | AB7: 3.5099999999999999e-002 | AC7: 2.76e-002 | AD7: 2.3099999999999999e-002 | AE7: 96.37 | AF7: 92.16 | AG7: 0 | AH7: A+ | AI7: 7.6200000000000004e-002 | AJ7: =H7+100*O7 -> 173.80200000000002 | AK7: 142 | AL7: 217 | AM7: 45.7 | AN7: 181 | AO7: -1.1000000000000001e-002 | AP7: 54 | AQ7: 久其转债!
A8: 213 | B8: 128063 | C8: 未来转债 | D8: 2631. | E8: 德尔未来 | F8: 其他 | G8: 家居用品 | H8: 107.05 | I8: 5.0000000000000001e-004 | J8: -1.4000000000000002e-003 | K8: 7.03 | L8: -2.8000000000000004e-003 | M8: 128.2 | N8: 8.61 | O8: 0.311 | P8: 81.65 | Q8: 转股中 | R8: 4.37年 | S8: 3.37年 | T8: 6.3 | U8: 1.2 | V8: 2.e-003 | W8: 0.13400000000000001 | X8: 0.109 | Y8: 47 | Z8: 2.67 | AA8: 4.3400000000000001e-002 | AB8: 3.2199999999999999e-002 | AC8: 4.8999999999999998e-003 | AD8: 1.e-004 | AE8: 87.36 | AF8: 97.83 | AG8: 0.33 | AH8: AA- | AI8: 6.59e-002 | AJ8: =H8+100*O8 -> 138.15000000000001 | AK8: 132.5 | AL8: 139 | AM8: 34.6 | AN8: 70 | AO8: 1.2e-002 | AP8: 34 | AQ8: 未来转债
A9: 272 | B9: 128037 | C9: 岩土转债! | D9: 2542. | E9: 中化岩土 | F9: 建筑 | G9: 建筑工程 | H9: 98.15 | I9: 7.000000000000001e-004 | J9: -7.000000000000001e-004 | K9: 3.47 | L9: 5.7999999999999996e-003 | M9: 112.3 | N9: 7.99 | O9: 1.26 | P9: 43.43 | Q9: 转股中 | R9: 3.32年 | S9: 1.32年 | T9: 5.99 | U9: 1.1 | V9: 2.e-003 | W9: 9.6000000000000002e-002 | X9: 4.2000000000000003e-002 | Y9: 63 | Z9: 1.54 | AA9: 4.24e-002 | AB9: 3.5099999999999999e-002 | AC9: 3.2000000000000001e-002 | AD9: 2.8199999999999999e-002 | AE9: 96.38 | AF9: 97.38 | AG9: 0 | AH9: AA | AI9: 4.4900000000000002e-002 | AJ9: =H9+100*O9 -> 224.15000000000001 | AK9: 152.9 | AL9: 260 | AM9: 55.5 | AN9: 231 | AO9: 1.7000000000000001e-002 | AP9: 47 | AQ9: 岩土转债!
A10: 282 | B10: 113017 | C10: 吉视转债! | D10: 601929 | E10: 吉视传媒 | F10: 传媒娱乐 | G10: 影视娱乐 | H10: 97.76 | I10: -1.4000000000000002e-003 | J10: 1.4000000000000002e-003 | K10: 2.09 | L10: 0. | M10: 109.8 | N10: 2.95 | O10: 0.38 | P10: 70.85 | Q10: 转股中 | R10: 3年37天 | S10: 1年37天 | T10: 15.6 | U10: 3.8 | V10: 2.e-003 | W10: 0.23999999999999999 | X10: 0.17000000000000001 | Y10: 65 | Z10: 0.98 | AA10: 3.9e-002 | AB10: 3.27e-002 | AC10: 3.8900000000000004e-002 | AD10: 3.4700000000000002e-002 | AE10: 97.29 | AF10: 96.66 | AG10: 0.12 | AH10: AA+ | AI10: 4.2900000000000001e-002 | AJ10: =H10+100*O10 -> 135.75999999999999 | AK10: 124.7 | AL10: 51 | AM10: 27.4 | AN10: 16 | AO10: -6.0000000000000001e-003 | AP10: 52 | AQ10: 吉视转债!
A11: 100 | B11: 113573 | C11: 纵横转债! | D11: 603602 | E11: 纵横通信 | F11: 通信互联 | G11: 通信设备 | H11: 102.78 | I11: -1.1999999999999999e-003 | J11: 1.7000000000000001e-003 | K11: 11.68 | L11: 2.5999999999999999e-003 | M11: 124.7 | N11: 18.81 | O11: 0.65500000000000003 | P11: 62.09 | Q11: 转股中 | R11: 5.41年 | S11: 3.41年 | T11: 2.7 | U11: 3.5 | V11: 1.2e-002 | W11: 0.113 | X11: 7.0000000000000007e-002 | Y11: 24 | Z11: 3.53 | AA11: 3.73e-002 | AB11: 2.92e-002 | AC11: 5.0000000000000001e-003 | AD11: 2.5000000000000001e-003 | AE11: 80.18 | AF11: 83.75 | AG11: 0.22 | AH11: A+ | AI11: 7.8399999999999997e-002 | AJ11: =H11+100*O11 -> 168.28 | AK11: 143.5 | AL11: 231 | AM11: 59.7 | AN11: 252 | AO11: -2.2000000000000002e-002 | AP11: 17 | AQ11: 纵横转债!
A12: 218 | B12: 113530 | C12: 大丰转债! | D12: 603081 | E12: 大丰实业 | F12: 建筑 | G12: 装饰工程 | H12: 104.12 | I12: -8.9999999999999998e-004 | J12: 8.9999999999999998e-004 | K12: 11.72 | L12: 0. | M12: 121.6 | N12: 16.64 | O12: 0.47799999999999998 | P12: 70.43 | Q12: 转股中 | R12: 4.35年 | S12: 2.35年 | T12: 6.3 | U12: 1 | V12: 1.e-003 | W12: 0.13400000000000001 | X12: 9.4e-002 | Y12: 47 | Z12: 2.29 | AA12: 3.7100000000000001e-002 | AB12: 2.8199999999999999e-002 | AC12: -2.3e-003 | AD12: -5.1000000000000004e-003 | AE12: 92.8 | AF12: 100.87 | AG12: 0.15 | AH12: AA | AI12: 4.4900000000000002e-002 | AJ12: =H12+100*O12 -> 151.92000000000002 | AK12: 137.8 | AL12: 188 | AM12: 36.9 | AN12: 100 | AO12: 1.9e-002 | AP12: 34 | AQ12: 大丰转债!
A13: 263 | B13: 110045 | C13: 海澜转债! | D13: 600398 | E13: 海澜之家 | F13: 服装纺织 | G13: 服装行业 | H13: 97.49 | I13: -5.6999999999999993e-003 | J13: 6.3e-003 | K13: 6.9 | L13: 1.0200000000000001e-002 | M13: 111.1 | N13: 11.75 | O13: 0.66000000000000003 | P13: 58.72 | Q13: 转股中 | R13: 3.64年 | S13: 1.64年 | T13: 29.5 | U13: 4.7 | V13: 2.e-003 | W13: 9.9000000000000005e-002 | X13: 5.7999999999999996e-002 | Y13: 298 | Z13: 2.35 | AA13: 3.7000000000000005e-002 | AB13: 3.1099999999999999e-002 | AC13: 2.5499999999999998e-002 | AD13: 2.3300000000000001e-002 | AE13: 94.59 | AF13: 95.54 | AG13: 0.05 | AH13: AA+ | AI13: 4.2900000000000001e-002 | AJ13: =H13+100*O13 -> 163.49000000000001 | AK13: 136.3 | AL13: 179 | AM13: 40.7 | AN13: 132 | AO13: 1.e-003 | AP13: 59 | AQ13: 海澜转债!
A14: 128 | B14: 113569 | C14: 科达转债! | D14: 603660 | E14: 苏州科达 | F14: 通信互联 | G14: 物联网 | H14: 101.06 | I14: 2.0999999999999999e-003 | J14: -2.3999999999999998e-003 | K14: 8.49 | L14: -2.3999999999999998e-003 | M14: 120.7 | N14: 14.84 | O14: 0.7659999999999999 | P14: 57.21 | Q14: 转股中 | R14: 5.30年 | S14: 3.30年 | T14: 5.16 | U14: 0.7 | V14: 1.e-003 | W14: 0.122 | X14: 7.0000000000000007e-002 | Y14: 42 | Z14: 2.48 | AA14: 3.4799999999999998e-002 | AB14: 2.7799999999999998e-002 | AC14: 8.5000000000000006e-003 | AD14: 6.1999999999999998e-003 | AE14: 83.22 | AF14: 86.09 | AG14: 0.15 | AH14: AA- | AI14: 6.7400000000000002e-002 | AJ14: =H14+100*O14 -> 177.66 | AK14: 144.9 | AL14: 239 | AM14: 58.8 | AN14: 245 | AO14: -1.1000000000000001e-002 | AP14: 23 | AQ14: 科达转债!
A15: 229 | B15: 110052 | C15: 贵广转债! | D15: 600996 | E15: 贵广网络 | F15: 传媒娱乐 | G15: 影视娱乐 | H15: 102.78 | I15: -6.8999999999999999e-003 | J15: 5.6000000000000008e-003 | K15: 6.28 | L15: -4.7999999999999996e-003 | M15: 118.5 | N15: 7.94 | O15: 0.29899999999999999 | P15: 79.09 | Q15: 转股中 | R15: 4.29年 | S15: 2.29年 | T15: 15.3 | U15: 12 | V15: 8.0000000000000002e-003 | W15: 0.23100000000000001 | X15: 0.183 | Y15: 66 | Z15: 1.46 | AA15: 3.4599999999999999e-002 | AB15: 2.6600000000000002e-002 | AC15: 4.1999999999999997e-003 | AD15: 1.1000000000000001e-003 | AE15: 93.79 | AF15: 99.39 | AG15: 0.26 | AH15: AA+ | AI15: 4.2900000000000001e-002 | AJ15: =H15+100*O15 -> 132.68000000000001 | AK15: 126.5 | AL15: 70 | AM15: 27.1 | AN15: 15 | AO15: -3.1e-002 | AP15: 19 | AQ15: 贵广转债!
A16: 67 | B16: 113591 | C16: 胜达转债! | D16: 603687 | E16: 大胜达 | F16: 造纸包装 | G16: 包装用纸 | H16: 101.4 | I16: -5.6999999999999993e-003 | J16: 7.8000000000000005e-003 | K16: 10.84 | L16: 5.6000000000000008e-003 | M16: 122.2 | N16: 14.73 | O16: 0.37799999999999995 | P16: 73.59 | Q16: 49天 | R16: 5.61年 | S16: 3.61年 | T16: 5.5 | U16: 7.5 | V16: 1.3000000000000001e-002 | W16: 0.124 | X16: 9.0999999999999998e-002 | Y16: 45 | Z16: 2.87 | AA16: 3.4500000000000003e-002 | AB16: 2.75e-002 | AC16: 7.0999999999999995e-003 | AD16: 5.0000000000000001e-003 | AE16: 81.61 | AF16: 85.42 | AG16: 0.38 | AH16: AA- | AI16: 6.7400000000000002e-002 | AJ16: =H16+100*O16 -> 139.19999999999999 | AK16: 129.2 | AL16: 106 | AM16: 43.8 | AN16: 162 | AO16: -2.e-003 | AP16: 18 | AQ16: 胜达转债!
A17: 203 | B17: 113535 | C17: 大业转债! | D17: 603278 | E17: 大业股份 | F17: 汽车 | G17: 零部件制 | H17: 101.16 | I17: 1.1999999999999999e-003 | J17: 1.2999999999999999e-003 | K17: 8.6 | L17: 1.6500000000000001e-002 | M17: 113.1 | N17: 12.4 | O17: 0.45899999999999996 | P17: 69.35 | Q17: 转股中 | R17: 3.47年 | S17: 1.47年 | T17: 5 | U17: 4.9 | V17: 1.e-002 | W17: 0.20100000000000001 | X17: 0.13900000000000001 | Y17: 25 | Z17: 1.52 | AA17: 3.32e-002 | AB17: 2.6000000000000002e-002 | AC17: 4.1999999999999997e-003 | AD17: 1.9e-003 | AE17: 94.84 | AF17: 97.33 | AG17: 0.15 | AH17: AA | AI17: 4.4900000000000002e-002 | AJ17: =H17+100*O17 -> 147.06 | AK17: 133 | AL17: 147 | AM17: 35.6 | AN17: 80 | AO17: 3.5000000000000003e-002 | AP17: 48 | AQ17: 大业转债!
A18: 71 | B18: 113589 | C18: 天创转债! | D18: 603608 | E18: 天创时尚 | F18: 服装纺织 | G18: 鞋服行业 | H18: 96.38 | I18: -1.1999999999999999e-003 | J18: 1.e-004 | K18: 7.64 | L18: -6.5000000000000006e-003 | M18: 115.3 | N18: 12.44 | O18: 0.56899999999999995 | P18: 61.41 | Q18: 43天 | R18: 5.59年 | S18: 3.59年 | T18: 6 | U18: 2.7 | V18: 5.0000000000000001e-003 | W18: 0.183 | X18: 0.11199999999999999 | Y18: 33 | Z18: 1.54 | AA18: 3.32e-002 | AB18: 2.81e-002 | AC18: 2.0099999999999996e-002 | AD18: 1.8100000000000002e-002 | AE18: 87.68 | AF18: 89.92 | AG18: 0.17 | AH18: AA | AI18: 4.6399999999999997e-002 | AJ18: =H18+100*O18 -> 153.27999999999997 | AK18: 131.3 | AL18: 133 | AM18: 41.4 | AN18: 141 | AO18: -4.4999999999999998e-002 | AP18: 10 | AQ18: 天创转债!
A19: 144 | B19: 128093 | C19: 百川转债! | D19: 2455. | E19: 百川股份 | F19: 化工 | G19: 化工 | H19: 111.14 | I19: 1.1899999999999999e-002 | J19: 8.8999999999999999e-003 | K19: 5.65 | L19: 3.6699999999999997e-002 | M19: 130.3 | N19: 5.87 | O19: 0.155 | P19: 96.25 | Q19: 转股中 | R19: 5年44天 | S19: 3年44天 | T19: 5.2 | U19: 19 | V19: 3.2000000000000001e-002 | W19: 0.17800000000000002 | X19: 0.17100000000000001 | Y19: 29 | Z19: 2.26 | AA19: 3.27e-002 | AB19: 2.2700000000000001e-002 | AC19: -1.06e-002 | AD19: -1.4800000000000001e-002 | AE19: 87.04 | AF19: 94.45 | AG19: 0.57 | AH19: AA- | AI19: 6.7400000000000002e-002 | AJ19: =H19+100*O19 -> 126.64 | AK19: 126 | AL19: 65 | AM19: 31.6 | AN19: 36 | AO19: 8.9999999999999997e-002 | AP19: 45 | AQ19: 百川转债!
A20: 176 | B20: 110059 | C20: 浦发转债! | D20: 600000 | E20: 浦发银行 | F20: 金融 | G20: 银行行业 | H20: 100.98 | I20: -2.5999999999999999e-003 | J20: 1.2999999999999999e-003 | K20: 9.67 | L20: -7.1999999999999998e-003 | M20: 117.6 | N20: 14.45 | O20: 0.50900000000000001 | P20: 66.92 | Q20: 转股中 | R20: 4.94年 | S20: 无权 | T20: 500 | U20: 359 | V20: 6.9999999999999993e-003 | W20: 0.17600000000000002 | X20: 0.11800000000000001 | Y20: 2838. | Z20: 0.56 | AA20: 3.2199999999999999e-002 | AB20: 2.5600000000000001e-002 | AC20: 无权 | AD20: 无权 | AE20: 无权 | AF20: 97.45 | AG20: 0.17 | AH20: AAA | AI20: 3.9900000000000005e-002 | AJ20: =H20+100*O20 -> 151.88 | AK20: 135 | AL20: 171 | AM20: 37.6 | AN20: 108 | AO20: 2.3e-002 | AP20: 76 | AQ20: 浦发转债!
A21: 261 | B21: 123011 | C21: 德尔转债! | D21: 300473 | E21: 德尔股份 | F21: 汽车 | G21: 零部件制 | H21: 103.898 | I21: -2.8999999999999998e-003 | J21: 3.0000000000000001e-003 | K21: 25.69 | L21: 4.0000000000000002e-004 | M21: 116.3 | N21: 34.54 | O21: 0.39700000000000002 | P21: 74.38 | Q21: 转股中 | R21: 3.66年 | S21: 1.66年 | T21: 2.51 | U21: 10 | V21: 4.0000000000000001e-002 | W21: 8.5999999999999993e-002 | X21: 6.4000000000000001e-002 | Y21: 29 | Z21: 1.31 | AA21: 3.1899999999999998e-002 | AB21: 2.3700000000000002e-002 | AC21: -5.8999999999999999e-003 | AD21: -8.8000000000000005e-003 | AE21: 91.59 | AF21: 92.5 | AG21: 0.26 | AH21: AA- | AI21: 6.59e-002 | AJ21: =H21+100*O21 -> 143.59800000000001 | AK21: 133.4 | AL21: 152 | AM21: 40.9 | AN21: 135 | AO21: -5.7000000000000002e-002 | AP21: 39 | AQ21: 德尔转债!
A22: 20 | B22: 128132 | C22: 交建转债! | D22: 2941. | E22: 新疆交建 | F22: 建筑 | G22: 建筑工程 | H22: 98.455 | I22: -1.8e-003 | J22: -1.7000000000000001e-003 | K22: 13.64 | L22: -1.1599999999999999e-002 | M22: 117.3 | N22: 18.57 | O22: 0.34000000000000002 | P22: 73.45 | Q22: 4月2天 | R22: 5.82年 | S22: 3.82年 | T22: 8.5 | U22: 7.5 | V22: 9.0000000000000011e-003 | W22: 9.6999999999999989e-002 | X22: 7.0999999999999994e-002 | Y22: 88 | Z22: 3.63 | AA22: 3.1099999999999999e-002 | AB22: 2.5600000000000001e-002 | AC22: 1.3500000000000002e-002 | AD22: 1.1599999999999999e-002 | AE22: 86.78 | AF22: 90.53 | AG22: 0.3 | AH22: AA | AI22: 4.6399999999999997e-002 | AJ22: =H22+100*O22 -> 132.45499999999998 | AK22: 123.5 | AL22: 37 | AM22: 32.9 | AN22: 50 | AO22: 1.4999999999999999e-002 | AP22: 8 | AQ22: 交建转债!
A23: 154 | B23: 110064 | C23: 建工转债! | D23: 600939 | E23: 重庆建工 | F23: 建筑 | G23: 建筑工程 | H23: 103.36 | I23: -2.3999999999999998e-003 | J23: 1.4000000000000002e-003 | K23: 3.9 | L23: -2.5999999999999999e-003 | M23: 120.2 | N23: 4.57 | O23: 0.21100000000000002 | P23: 85.34 | Q23: 转股中 | R23: 5年30天 | S23: 3年30天 | T23: 16.6 | U23: 4.2 | V23: 2.e-003 | W23: 0.23499999999999999 | X23: 0.20000000000000001 | Y23: 71 | Z23: 1.03 | AA23: 3.0899999999999997e-002 | AB23: 2.3700000000000002e-002 | AC23: 3.4999999999999996e-003 | AD23: 8.0000000000000004e-004 | AE23: 90.93 | AF23: 96.92 | AG23: 0.39 | AH23: AA+ | AI23: 4.4400000000000002e-002 | AJ23: =H23+100*O23 -> 124.46000000000001 | AK23: 121.4 | AL23: 17 | AM23: 24.5 | AN23: 11 | AO23: 1.7000000000000001e-002 | AP23: 48 | AQ23: 建工转债!
A24: 33 | B24: 113600 | C24: 新星转债! | D24: 603978 | E24: 深圳新星 | F24: 有色金属 | G24: 有色行业 | H24: 106.42 | I24: 4.5999999999999999e-003 | J24: 6.3e-003 | K24: 19.91 | L24: 2.3099999999999999e-002 | M24: 126 | N24: 23.85 | O24: 0.27500000000000002 | P24: 83.48 | Q24: 3月1天 | R24: 5.73年 | S24: 3.73年 | T24: 5.95 | U24: 2.9 | V24: 5.0000000000000001e-003 | W24: 0.187 | X24: 0.156 | Y24: 32 | Z24: 2.09 | AA24: 3.0499999999999999e-002 | AB24: 2.2700000000000001e-002 | AC24: -6.0999999999999995e-003 | AD24: -8.1000000000000013e-003 | AE24: 80.8 | AF24: 87.34 | AG24: 0.47 | AH24: AA- | AI24: 6.7400000000000002e-002 | AJ24: =H24+100*O24 -> 133.92000000000002 | AK24: 129.4 | AL24: 108 | AM24: 42 | AN24: 146 | AO24: 2.7999999999999997e-002 | AP24: 11 | AQ24: 新星转债!
A25: 254 | B25: 128044 | C25: 岭南转债! | D25: 2717. | E25: 岭南股份 | F25: 城市公用 | G25: 生态环境 | H25: 99.99 | I25: 2.0000000000000001e-004 | J25: 1.e-003 | K25: 4.14 | L25: 7.3000000000000001e-003 | M25: 111.3 | N25: 5.91 | O25: 0.42700000000000005 | P25: 70.05 | Q25: 转股中 | R25: 3.73年 | S25: 1.73年 | T25: 6.59 | U25: 2.9 | V25: 4.0000000000000001e-003 | W25: 0.10400000000000001 | X25: 7.2999999999999995e-002 | Y25: 63 | Z25: 1.29 | AA25: 2.9700000000000001e-002 | AB25: 2.3900000000000001e-002 | AC25: 1.4800000000000001e-002 | AD25: 1.1899999999999999e-002 | AE25: 94.64 | AF25: 94.77 | AG25: 0.17 | AH25: AA | AI25: 4.4900000000000002e-002 | AJ25: =H25+100*O25 -> 142.69 | AK25: 129.9 | AL25: 118 | AM25: 35.2 | AN25: 75 | AO25: 3.5000000000000003e-002 | AP25: 31 | AQ25: 岭南转债!
A26: 230 | B26: 113021 | C26: 中信转债! | D26: 601998 | E26: 中信银行 | F26: 金融 | G26: 银行行业 | H26: 105.48 | I26: -2.8999999999999998e-003 | J26: 1.7000000000000001e-003 | K26: 5.15 | L26: -5.7999999999999996e-003 | M26: 118.8 | N26: 6.98 | O26: 0.42999999999999999 | P26: 73.78 | Q26: 转股中 | R26: 4.29年 | S26: 无权 | T26: 400 | U26: 14 | V26: 0. | W26: 0.159 | X26: 0.11699999999999999 | Y26: 2520. | Z26: 0.55 | AA26: 2.9100000000000001e-002 | AB26: 2.1000000000000001e-002 | AC26: 无权 | AD26: 无权 | AE26: 无权 | AF26: 100.99 | AG26: 0.21 | AH26: AAA | AI26: 3.9900000000000005e-002 | AJ26: =H26+100*O26 -> 148.48000000000002 | AK26: 137.2 | AL26: 183 | AM26: 36.2 | AN26: 92 | AO26: 5.0000000000000001e-003 | AP26: 53 | AQ26: 中信转债!
A27: 305 | B27: 128014 | C27: 永东转债! | D27: 2753. | E27: 永东股份 | F27: 化工 | G27: 化工 | H27: 104.099 | I27: 5.6000000000000008e-003 | J27: -4.3e-003 | K27: 8.7 | L27: 3.0800000000000001e-002 | M27: 111.3 | N27: 12.6 | O27: 0.50800000000000001 | P27: 69.05 | Q27: 转股中 | R27: 2.41年 | S27: 0.41年 | T27: 3.37 | U27: 3.5 | V27: 1.e-002 | W27: 0.10300000000000001 | X27: 7.0999999999999994e-002 | Y27: 33 | Z27: 1.85 | AA27: 2.87e-002 | AB27: 1.9799999999999998e-002 | AC27: -3.8399999999999997e-002 | AD27: -4.4400000000000002e-002 | AE27: 98.2 | AF27: 95.89 | AG27: 0.04 | AH27: AA- | AI27: 6.5199999999999994e-002 | AJ27: =H27+100*O27 -> 154.899 | AK27: 139.2 | AL27: 198 | AM27: 40.9 | AN27: 136 | AO27: 5.2999999999999999e-002 | AP27: 39 | AQ27: 永东转债!
A28: 252 | B28: 113519 | C28: 长久转债! | D28: 603569 | E28: 长久物流 | F28: 交通运输 | G28: 物流业 | H28: 106.89 | I28: 1.e-003 | J28: 8.9999999999999998e-004 | K28: 8.81 | L28: 8.0000000000000002e-003 | M28: 119.3 | N28: 11.15 | O28: 0.35299999999999998 | P28: 79.01 | Q28: 转股中 | R28: 3.96年 | S28: 1.96年 | T28: 6.97 | U28: 1.1 | V28: 2.e-003 | W28: 0.14099999999999999 | X28: 0.11199999999999999 | Y28: 49 | Z28: 2.32 | AA28: 2.86e-002 | AB28: 1.9900000000000001e-002 | AC28: -1.83e-002 | AD28: -2.0799999999999999e-002 | AE28: 93.67 | AF28: 100.53 | AG28: 0.24 | AH28: AA | AI28: 4.4900000000000002e-002 | AJ28: =H28+100*O28 -> 142.19 | AK28: 134.8 | AL28: 165 | AM28: 34.2 | AN28: 65 | AO28: -5.2999999999999999e-002 | AP28: 16 | AQ28: 长久转债!
A29: 104 | B29: 110070 | C29: 凌钢转债! | D29: 600231 | E29: 凌钢股份 | F29: 钢铁 | G29: 炼钢 | H29: 101.53 | I29: 1.e-004 | J29: 5.6000000000000008e-003 | K29: 2.37 | L29: 1.2800000000000001e-002 | M29: 117.8 | N29: 2.75 | O29: 0.17800000000000002 | P29: 86.18 | Q29: 转股中 | R29: 5.39年 | S29: 3.39年 | T29: 4.4 | U29: 4.7 | V29: 1.e-002 | W29: 6.7000000000000004e-002 | X29: 5.7999999999999996e-002 | Y29: 66 | Z29: 0.82 | AA29: 2.86e-002 | AB29: 2.2499999999999999e-002 | AC29: 7.1999999999999998e-003 | AD29: 4.8999999999999998e-003 | AE29: 88.77 | AF29: 92.73 | AG29: 0.44 | AH29: AA | AI29: 4.6399999999999997e-002 | AJ29: =H29+100*O29 -> 119.33 | AK29: 116.9 | AL29: 4 | AM29: 24.2 | AN29: 10 | AO29: 5.9000000000000004e-002 | AP29: 16 | AQ29: 凌钢转债!
A30: 51 | B30: 113595 | C30: 花王转债 | D30: 603007 | E30: 花王股份 | F30: 城市公用 | G30: 生态环境 | H30: 107.39 | I30: 3.4999999999999996e-003 | J30: -6.1999999999999998e-003 | K30: 6.57 | L30: -4.5000000000000005e-003 | M30: 125.3 | N30: 6.94 | O30: 0.13400000000000001 | P30: 94.67 | Q30: 2月8天 | R30: 5.67年 | S30: 3.67年 | T30: 3.3 | U30: 13 | V30: 3.7000000000000005e-002 | W30: 0.14999999999999999 | X30: 0.14199999999999999 | Y30: 22 | Z30: 1.98 | AA30: 2.8199999999999999e-002 | AB30: 2.0499999999999997e-002 | AC30: -7.9000000000000008e-003 | AD30: -1.e-002 | AE30: 81.41 | AF30: 87.28 | AG30: 0.61 | AH30: AA- | AI30: 6.7400000000000002e-002 | AJ30: =H30+100*O30 -> 120.79000000000001 | AK30: 120.1 | AL30: 13 | AM30: 32.8 | AN30: 49 | AO30: -6.5000000000000002e-002 | AP30: 27 | AQ30: 花王转债
A31: 123 | B31: 128100 | C31: 搜特转债! | D31: 2503. | E31: 搜于特 | F31: 服装纺织 | G31: 服装行业 | H31: 101.602 | I31: -1.e-003 | J31: 1.e-003 | K31: 2.33 | L31: 0. | M31: 117.3 | N31: 2.9 | O31: 0.26500000000000001 | P31: 80.34 | Q31: 转股中 | R31: 5.31年 | S31: 3.31年 | T31: 8 | U31: 2.7 | V31: 3.0000000000000001e-003 | W31: 0.111 | X31: 8.900000000000001e-002 | Y31: 72 | Z31: 1.31 | AA31: 2.7999999999999997e-002 | AB31: 2.2000000000000002e-002 | AC31: 6.1999999999999998e-003 | AD31: 4.0999999999999995e-003 | AE31: 88.82 | AF31: 92.66 | AG31: 0.37 | AH31: AA | AI31: 4.6399999999999997e-002 | AJ31: =H31+100*O31 -> 128.102 | AK31: 122.9 | AL31: 24 | AM31: 30.2 | AN31: 29 | AO31: -1.e-002 | AP31: 42 | AQ31: 搜特转债!
A32: 40 | B32: 113597 | C32: 佳力转债! | D32: 603912 | E32: 佳力图 | F32: 机械装备 | G32: 专用设备 | H32: 106.95 | I32: -3.4000000000000002e-003 | J32: 8.9999999999999998e-004 | K32: 17.28 | L32: -6.8999999999999999e-003 | M32: 124.5 | N32: 23.4 | O32: 0.44799999999999995 | P32: 73.85 | Q32: 2月17天 | R32: 5.69年 | S32: 3.69年 | T32: 3 | U32: 0.8 | V32: 3.0000000000000001e-003 | W32: 8.0000000000000002e-002 | X32: 5.9000000000000004e-002 | Y32: 37 | Z32: 4.32 | AA32: 2.76e-002 | AB32: 2.0199999999999999e-002 | AC32: -6.3e-003 | AD32: -8.5000000000000006e-003 | AE32: 81.43 | AF32: 86.6 | AG32: 0.36 | AH32: AA- | AI32: 6.7400000000000002e-002 | AJ32: =H32+100*O32 -> 151.75 | AK32: 140.1 | AL32: 206 | AM32: 53.5 | AN32: 220 | AO32: -4.5999999999999999e-002 | AP32: 7 | AQ32: 佳力转债!
A33: 281 | B33: 128033 | C33: 迪龙转债! | D33: 2658. | E33: 雪迪龙 | F33: 城市公用 | G33: 三废处理 | H33: 101.284 | I33: 2.9999999999999997e-004 | J33: -2.9999999999999997e-004 | K33: 6.25 | L33: 0. | M33: 109.8 | N33: 8.83 | O33: 0.43099999999999999 | P33: 70.78 | Q33: 转股中 | R33: 3年37天 | S33: 1年37天 | T33: 5.2 | U33: 1.1 | V33: 2.e-003 | W33: 0.13800000000000001 | X33: 9.6999999999999989e-002 | Y33: 38 | Z33: 1.87 | AA33: 2.7000000000000003e-002 | AB33: 2.0799999999999999e-002 | AC33: 1.e-002 | AD33: 5.8999999999999999e-003 | AE33: 97.05 | AF33: 96.1 | AG33: 0.13 | AH33: AA | AI33: 4.4900000000000002e-002 | AJ33: =H33+100*O33 -> 144.38400000000001 | AK33: 131.8 | AL33: 136 | AM33: 34.7 | AN33: 71 | AO33: 2.1000000000000001e-002 | AP33: 37 | AQ33: 迪龙转债!
A34: 284 | B34: 128032 | C34: 双环转债! | D34: 2472. | E34: 双环传动 | F34: 机械装备 | G34: 通用设备 | H34: 101.925 | I34: -4.5999999999999999e-003 | J34: 7.1999999999999998e-003 | K34: 7.32 | L34: 1.5300000000000001e-002 | M34: 110.3 | N34: 9.89 | O34: 0.377 | P34: 74.01 | Q34: 转股中 | R34: 3年35天 | S34: 1年35天 | T34: 10 | U34: 7.5 | V34: 6.9999999999999993e-003 | W34: 0.19899999999999998 | X34: 0.14699999999999999 | Y34: 50 | Z34: 1.5 | AA34: 2.6499999999999999e-002 | AB34: 2.e-002 | AC34: 6.8999999999999999e-003 | AD34: 2.5000000000000001e-003 | AE34: 97.31 | AF34: 96.59 | AG34: 0.17 | AH34: AA | AI34: 4.4900000000000002e-002 | AJ34: =H34+100*O34 -> 139.625 | AK34: 129.8 | AL34: 115 | AM34: 32.5 | AN34: 48 | AO34: 0.106 | AP34: 45 | AQ34: 双环转债!
A35: 159 | B35: 128085 | C35: 鸿达转债 | D35: 2002. | E35: 鸿达兴业 | F35: 化工 | G35: 化工 | H35: 110.1 | I35: 4.3e-003 | J35: 1.3100000000000001e-002 | K35: 4.04 | L35: 3.0600000000000002e-002 | M35: 124.8 | N35: 3.92 | O35: 6.8000000000000005e-002 | P35: 103.06 | Q35: 转股中 | R35: 5年26天 | S35: 3年26天 | T35: 24.3 | U35: 53 | V35: 2.e-002 | W35: 0.23199999999999998 | X35: 0.23899999999999999 | Y35: 105 | Z35: 1.47 | AA35: 2.5600000000000001e-002 | AB35: 1.72e-002 | AC35: -1.6799999999999999e-002 | AD35: -1.9299999999999998e-002 | AE35: 90.22 | AF35: 99.68 | AG35: 0.57 | AH35: AA | AI35: 4.6399999999999997e-002 | AJ35: =H35+100*O35 -> 116.89999999999999 | AK35: 117.1 | AL35: 6 | AM35: 17.5 | AN35: 5 | AO35: 7.2000000000000008e-002 | AP35: 86 | AQ35: 鸿达转债
A36: 65 | B36: 128117 | C36: 道恩转债 | D36: 2838. | E36: 道恩股份 | F36: 化工 | G36: 橡胶塑料 | H36: 107.502 | I36: -8.9999999999999998e-004 | J36: -2.e-003 | K36: 25.32 | L36: -5.5000000000000005e-003 | M36: 123.5 | N36: 29.07 | O36: 0.23399999999999999 | P36: 87.1 | Q36: 49天 | R36: 5.61年 | S36: 3.61年 | T36: 3.6 | U36: 10 | V36: 2.7000000000000003e-002 | W36: 3.5000000000000003e-002 | X36: 2.9999999999999999e-002 | Y36: 103 | Z36: 5.99 | AA36: 2.5499999999999998e-002 | AB36: 1.8200000000000001e-002 | AC36: -9.1999999999999998e-003 | AD36: -1.1200000000000002e-002 | AE36: 81.35 | AF36: 86.24 | AG36: 0.54 | AH36: AA- | AI36: 6.7400000000000002e-002 | AJ36: =H36+100*O36 -> 130.90199999999999 | AK36: 127.9 | AL36: 90 | AM36: 41.7 | AN36: 144 | AO36: -7.0000000000000007e-002 | AP36: 16 | AQ36: 道恩转债
A37: 196 | B37: 128069 | C37: 华森转债! | D37: 2907. | E37: 华森制药 | F37: 医药 | G37: 化学制药 | H37: 107.333 | I37: -3.0000000000000001e-003 | J37: 4.0000000000000002e-004 | K37: 16.08 | L37: -5.0000000000000001e-003 | M37: 120 | N37: 18.04 | O37: 0.20399999999999999 | P37: 89.14 | Q37: 转股中 | R37: 4.59年 | S37: 2.59年 | T37: 3 | U37: 10 | V37: 3.2000000000000001e-002 | W37: 4.5999999999999999e-002 | X37: 4.0999999999999995e-002 | Y37: 65 | Z37: 6.01 | AA37: 2.5099999999999997e-002 | AB37: 1.7299999999999999e-002 | AC37: -1.32e-002 | AD37: -1.5600000000000001e-002 | AE37: 86.96 | AF37: 90.05 | AG37: 0.51 | AH37: AA- | AI37: 6.59e-002 | AJ37: =H37+100*O37 -> 127.733 | AK37: 125.5 | AL37: 61 | AM37: 35.5 | AN37: 79 | AO37: 2.e-003 | AP37: 43 | AQ37: 华森转债!
A38: 11 | B38: 123069 | C38: 金诺转债 | D38: 300505 | E38: 川金诺 | F38: 化工 | G38: 农化 | H38: 109.238 | I38: 1.2999999999999999e-003 | J38: -3.2000000000000002e-003 | K38: 17.46 | L38: -3.4000000000000002e-003 | M38: 126 | N38: 19.15 | O38: 0.19800000000000001 | P38: 91.17 | Q38: 5月3天 | R38: 5.90年 | S38: 3.90年 | T38: 3.68 | U38: 7.5 | V38: 1.9e-002 | W38: 0.161 | X38: 0.14699999999999999 | Y38: 23 | Z38: 2.37 | AA38: 2.4900000000000002e-002 | AB38: 1.7399999999999999e-002 | AC38: -1.23e-002 | AD38: -1.41e-002 | AE38: 79.88 | AF38: 86.34 | AG38: 0.57 | AH38: AA- | AI38: 6.7400000000000002e-002 | AJ38: =H38+100*O38 -> 129.03800000000001 | AK38: 127.3 | AL38: 81 | AM38: 41 | AN38: 137 | AO38: -0.10800000000000001 | AP38: 6 | AQ38: 金诺转债
A39: 207 | B39: 127013 | C39: 创维转债! | D39: 810. | E39: 创维数字 | F39: 电子 | G39: 电子产品 | H39: 106.09 | I39: -9.0000000000000011e-003 | J39: 8.6999999999999994e-003 | K39: 8.98 | L39: -1.1000000000000001e-003 | M39: 117.9 | N39: 11.39 | O39: 0.34600000000000003 | P39: 78.84 | Q39: 转股中 | R39: 4.40年 | S39: 2.40年 | T39: 9.78 | U39: 4.3 | V39: 4.0000000000000001e-003 | W39: 0.10199999999999999 | X39: 8.1000000000000003e-002 | Y39: 95 | Z39: 2.46 | AA39: 2.4799999999999999e-002 | AB39: 1.7399999999999999e-002 | AC39: -1.01e-002 | AD39: -1.26e-002 | AE39: 92.49 | AF39: 97.56 | AG39: 0.27 | AH39: AA | AI39: 4.4900000000000002e-002 | AJ39: =H39+100*O39 -> 140.69 | AK39: 133.3 | AL39: 151 | AM39: 35.8 | AN39: 86 | AO39: -1.3999999999999999e-002 | AP39: 23 | AQ39: 创维转债!
A40: 3 | B40: 123073 | C40: 同和转债 | D40: 300636 | E40: 同和药业 | F40: 医药 | G40: 原料药 | H40: 106.152 | I40: -7.9000000000000008e-003 | J40: 1.77e-002 | K40: 29.06 | L40: 1.8200000000000001e-002 | M40: 122.4 | N40: 36.34 | O40: 0.32700000000000001 | P40: 79.97 | Q40: 5月14天 | R40: 5.93年 | S40: 3.93年 | T40: 3.6 | U40: 38 | V40: 9.9000000000000005e-002 | W40: 9.6000000000000002e-002 | X40: 7.6999999999999999e-002 | Y40: 37 | Z40: 4.94 | AA40: 2.4799999999999999e-002 | AB40: 1.8200000000000001e-002 | AC40: -3.7000000000000002e-003 | AD40: -5.7999999999999996e-003 | AE40: 77.02 | AF40: 79.01 | AG40: 0.54 | AH40: A+ | AI40: 7.8399999999999997e-002 | AJ40: =H40+100*O40 -> 138.852 | AK40: 132.3 | AL40: 138 | AM40: 53.3 | AN40: 219 | AO40: -5.9000000000000004e-002 | AP40: 2 | AQ40: 同和转债
A41: 129 | B41: 113568 | C41: 新春转债 | D41: 603667 | E41: 五洲新春 | F41: 机械装备 | G41: 通用设备 | H41: 110.05 | I41: 3.0999999999999999e-003 | J41: 2.8000000000000004e-003 | K41: 8.8 | L41: 9.1999999999999998e-003 | M41: 124.8 | N41: 8.91 | O41: 0.114 | P41: 98.77 | Q41: 转股中 | R41: 5.29年 | S41: 3.29年 | T41: 3.3 | U41: 4.1 | V41: 1.1000000000000001e-002 | W41: 0.128 | X41: 0.127 | Y41: 26 | Z41: 1.49 | AA41: 2.46e-002 | AB41: 1.66e-002 | AC41: -1.4499999999999999e-002 | AD41: -1.7000000000000001e-002 | AE41: 83.84 | AF41: 89.15 | AG41: 0.64 | AH41: AA- | AI41: 6.7400000000000002e-002 | AJ41: =H41+100*O41 -> 121.45 | AK41: 121.3 | AL41: 16 | AM41: 32.2 | AN41: 46 | AO41: -1.e-003 | AP41: 47 | AQ41: 新春转债
A42: 64 | B42: 128118 | C42: 瀛通转债 | D42: 2861. | E42: 瀛通通讯 | F42: 电子 | G42: 电子产品 | H42: 107.2 | I42: -5.0000000000000001e-004 | J42: 1.1999999999999999e-003 | K42: 23.32 | L42: 1.2999999999999999e-003 | M42: 122.1 | N42: 27.53 | O42: 0.26600000000000001 | P42: 84.71 | Q42: 49天 | R42: 5.61年 | S42: 3.61年 | T42: 3 | U42: 2.4 | V42: 8.0000000000000002e-003 | W42: 0.106 | X42: 8.900000000000001e-002 | Y42: 28 | Z42: 2.67 | AA42: 2.4e-002 | AB42: 1.7100000000000001e-002 | AC42: -6.5000000000000006e-003 | AD42: -8.8999999999999999e-003 | AE42: 81.97 | AF42: 85.39 | AG42: 0.53 | AH42: AA- | AI42: 6.7400000000000002e-002 | AJ42: =H42+100*O42 -> 133.80000000000001 | AK42: 129.7 | AL42: 112 | AM42: 44.3 | AN42: 165 | AO42: -1.e-002 | AP42: 7 | AQ42: 瀛通转债
A43: 231 | B43: 113528 | C43: 长城转债! | D43: 603897 | E43: 长城科技 | F43: 机械装备 | G43: 专用设备 | H43: 106.71 | I43: 5.5000000000000005e-003 | J43: 8.9999999999999998e-004 | K43: 20.62 | L43: 1.2800000000000001e-002 | M43: 117.6 | N43: 23.45 | O43: 0.214 | P43: 87.93 | Q43: 转股中 | R43: 4.28年 | S43: 2.28年 | T43: 6.34 | U43: 1.6 | V43: 2.e-003 | W43: 0.17199999999999999 | X43: 0.152 | Y43: 37 | Z43: 2.01 | AA43: 2.3599999999999999e-002 | AB43: 1.61e-002 | AC43: -1.09e-002 | AD43: -1.3999999999999999e-002 | AE43: 89.12 | AF43: 90.13 | AG43: 0.5 | AH43: AA- | AI43: 6.59e-002 | AJ43: =H43+100*O43 -> 128.10999999999999 | AK43: 125.5 | AL43: 59 | AM43: 35.4 | AN43: 78 | AO43: 1.8000000000000002e-002 | AP43: 45 | AQ43: 长城转债!
A44: 178 | B44: 113546 | C44: 迪贝转债! | D44: 603320 | E44: 迪贝电气 | F44: 家电 | G44: 零部件制 | H44: 107.78 | I44: 7.000000000000001e-004 | J44: -1.1999999999999999e-003 | K44: 12.97 | L44: -8.0000000000000004e-004 | M44: 120.6 | N44: 14.1 | O44: 0.17199999999999999 | P44: 91.99 | Q44: 转股中 | R44: 4.92年 | S44: 2.92年 | T44: 2.3 | U44: 4.9 | V44: 2.e-002 | W44: 0.13600000000000001 | X44: 0.125 | Y44: 17 | Z44: 2.53 | AA44: 2.3599999999999999e-002 | AB44: 1.6200000000000003e-002 | AC44: -1.18e-002 | AD44: -1.4199999999999999e-002 | AE44: 82.88 | AF44: 84.41 | AG44: 0.61 | AH44: A+ | AI44: 7.690000000000001e-002 | AJ44: =H44+100*O44 -> 124.98 | AK44: 123.6 | AL44: 38 | AM44: 39.2 | AN44: 122 | AO44: 1.7000000000000001e-002 | AP44: 43 | AQ44: 迪贝转债!
A45: 28 | B45: 113601 | C45: 塞力转债 | D45: 603716 | E45: 塞力斯 | F45: 医药 | G45: 医药商业 | H45: 106.6 | I45: -2.3e-003 | J45: 4.0000000000000002e-004 | K45: 15.83 | L45: -3.0999999999999999e-003 | M45: 121.3 | N45: 16.98 | O45: 0.14300000000000002 | P45: 93.23 | Q45: 3月9天 | R45: 5.75年 | S45: 3.75年 | T45: 5.43 | U45: 7 | V45: 1.2e-002 | W45: 0.16699999999999998 | X45: 0.156 | Y45: 32 | Z45: 2.13 | AA45: 2.3199999999999998e-002 | AB45: 1.67e-002 | AC45: -5.7999999999999996e-003 | AD45: -7.9000000000000008e-003 | AE45: 80.96 | AF45: 84.05 | AG45: 0.63 | AH45: AA- | AI45: 6.7400000000000002e-002 | AJ45: =H45+100*O45 -> 120.89999999999999 | AK45: 120 | AL45: 12 | AM45: 35.9 | AN45: 88 | AO45: 1.3000000000000001e-002 | AP45: 18 | AQ45: 塞力转债
A46: 275 | B46: 113505 | C46: 杭电转债! | D46: 603618 | E46: 杭电股份 | F46: 能源电力 | G46: 电力设备 | H46: 104.35 | I46: -3.0999999999999999e-003 | J46: 2.5000000000000001e-003 | K46: 5.94 | L46: -1.7000000000000001e-003 | M46: 112.3 | N46: 7.14 | O46: 0.254 | P46: 83.19 | Q46: 转股中 | R46: 3.29年 | S46: 1.29年 | T46: 7.5 | U46: 2.7 | V46: 3.0000000000000001e-003 | W46: 0.183 | X46: 0.152 | Y46: 41 | Z46: 1.62 | AA46: 2.3e-002 | AB46: 1.6e-002 | AC46: -1.03e-002 | AD46: -1.3999999999999999e-002 | AE46: 96.49 | AF46: 97.49 | AG46: 0.31 | AH46: AA | AI46: 4.4900000000000002e-002 | AJ46: =H46+100*O46 -> 129.75 | AK46: 125.5 | AL46: 60 | AM46: 28 | AN46: 17 | AO46: 4.2000000000000003e-002 | AP46: 38 | AQ46: 杭电转债!
A47: 158 | B47: 128087 | C47: 孚日转债! | D47: 2083. | E47: 孚日股份 | F47: 服装纺织 | G47: 家纺 | H47: 101.2 | I47: -8.8000000000000005e-003 | J47: 1.4000000000000002e-003 | K47: 5.03 | L47: -1.95e-002 | M47: 113.3 | N47: 6.3 | O47: 0.26800000000000002 | P47: 79.84 | Q47: 转股中 | R47: 5年27天 | S47: 3年27天 | T47: 6.5 | U47: 7.1 | V47: 1.1000000000000001e-002 | W47: 0.14199999999999999 | X47: 0.114 | Y47: 46 | Z47: 1.21 | AA47: 2.3e-002 | AB47: 1.8000000000000002e-002 | AC47: 8.0000000000000002e-003 | AD47: 5.6000000000000008e-003 | AE47: 89.78 | AF47: 90.47 | AG47: 0.38 | AH47: AA | AI47: 4.6399999999999997e-002 | AJ47: =H47+100*O47 -> 128. | AK47: 122.6 | AL47: 23 | AM47: 32.1 | AN47: 44 | AO47: 8.0000000000000002e-003 | AP47: 51 | AQ47: 孚日转债!
A48: 296 | B48: 113502 | C48: 嘉澳转债! | D48: 603822 | E48: 嘉澳环保 | F48: 化工 | G48: 化工 | H48: 104.17 | I48: 3.4000000000000002e-003 | J48: -3.0999999999999999e-003 | K48: 25.7 | L48: 5.1100000000000007e-002 | M48: 111.3 | N48: 44.79 | O48: 0.81499999999999995 | P48: 57.38 | Q48: 转股中 | R48: 2.97年 | S48: 0.97年 | T48: 1.85 | U48: 21 | V48: 0.109 | W48: 9.8000000000000004e-002 | X48: 5.5999999999999994e-002 | Y48: 19 | Z48: 2.5 | AA48: 2.29e-002 | AB48: 1.5700000000000002e-002 | AC48: -2.e-002 | AD48: -2.3099999999999999e-002 | AE48: 94.75 | AF48: 92.51 | AG48: 0.01 | AH48: AA- | AI48: 6.5199999999999994e-002 | AJ48: =H48+100*O48 -> 185.67000000000002 | AK48: 151 | AL48: 258 | AM48: 56.2 | AN48: 236 | AO48: 7.4999999999999997e-002 | AP48: 29 | AQ48: 嘉澳转债!
A49: 115 | B49: 113574 | C49: 华体转债! | D49: 603679 | E49: 华体科技 | F49: 城市公用 | G49: 城市公用 | H49: 103.91 | I49: -1.7000000000000001e-003 | J49: 1.7000000000000001e-003 | K49: 22.25 | L49: 0. | M49: 116.4 | N49: 33.99 | O49: 0.58700000000000008 | P49: 65.46 | Q49: 转股中 | R49: 5.36年 | S49: 3.36年 | T49: 2.09 | U49: 4.7 | V49: 2.2000000000000002e-002 | W49: 6.6000000000000003e-002 | X49: 4.2999999999999997e-002 | Y49: 32 | Z49: 4.34 | AA49: 2.1899999999999999e-002 | AB49: 1.6299999999999999e-002 | AC49: 1.8e-003 | AD49: -7.000000000000001e-004 | AE49: 80.42 | AF49: 78.49 | AG49: 0.3 | AH49: A+ | AI49: 7.8399999999999997e-002 | AJ49: =H49+100*O49 -> 162.61000000000001 | AK49: 142.4 | AL49: 222 | AM49: 61.9 | AN49: 258 | AO49: 9.0000000000000011e-003 | AP49: 14 | AQ49: 华体转债!
A50: 36 | B50: 113599 | C50: 嘉友转债 | D50: 603871 | E50: 嘉友国际 | F50: 交通运输 | G50: 物流业 | H50: 111.62 | I50: 2.9999999999999997e-004 | J50: -6.8999999999999999e-003 | K50: 23.92 | L50: -1.0800000000000001e-002 | M50: 126 | N50: 24.82 | O50: 0.158 | P50: 96.37 | Q50: 3月0天 | R50: 5.71年 | S50: 3.71年 | T50: 7.2 | U50: 16 | V50: 1.9e-002 | W50: 0.13699999999999998 | X50: 0.13200000000000001 | Y50: 53 | Z50: 2.64 | AA50: 2.1899999999999999e-002 | AB50: 1.4199999999999999e-002 | AC50: -1.8500000000000003e-002 | AD50: -2.0400000000000001e-002 | AE50: 80.92 | AF50: 87.46 | AG50: 0.62 | AH50: AA- | AI50: 6.7400000000000002e-002 | AJ50: =H50+100*O50 -> 127.42 | AK50: 126.9 | AL50: 76 | AM50: 39.4 | AN50: 124 | AO50: -2.7999999999999997e-002 | AP50: 14 | AQ50: 嘉友转债
A51: 157 | B51: 113557 | C51: 森特转债 | D51: 603098 | E51: 森特股份 | F51: 建筑 | G51: 建筑工程 | H51: 108.5 | I51: -5.3e-003 | J51: -4.5999999999999999e-003 | K51: 9.46 | L51: -1.66e-002 | M51: 120.7 | N51: 10.11 | O51: 0.16 | P51: 93.57 | Q51: 转股中 | R51: 5年29天 | S51: 3年29天 | T51: 6 | U51: 1.2 | V51: 2.e-003 | W51: 0.13200000000000001 | X51: 0.124 | Y51: 45 | Z51: 2.19 | AA51: 2.1700000000000001e-002 | AB51: 1.4499999999999999e-002 | AC51: -1.3000000000000001e-002 | AD51: -1.54e-002 | AE51: 84.43 | AF51: 87.33 | AG51: 0.6 | AH51: AA- | AI51: 6.7400000000000002e-002 | AJ51: =H51+100*O51 -> 124.5 | AK51: 123.4 | AL51: 36 | AM51: 36.1 | AN51: 90 | AO51: 0. | AP51: 35 | AQ51: 森特转债
A52: 309 | B52: 127003 | C52: 海印转债! | D52: 861. | E52: 海印股份 | F52: 商业零售 | G52: 商场 | H52: 108.316 | I52: 1.7000000000000001e-003 | J52: -8.9999999999999998e-004 | K52: 2.65 | L52: 3.8e-003 | M52: 111.8 | N52: 3 | O52: 0.22600000000000001 | P52: 88.33 | Q52: 转股中 | R52: 1.55年 | S52: 回售中 | T52: 6.74 | U52: 3.9 | V52: 5.0000000000000001e-003 | W52: 0.109 | X52: 9.6999999999999989e-002 | Y52: 62 | Z52: 1.56 | AA52: 2.0899999999999998e-002 | AB52: 6.7000000000000002e-003 | AC52: 回售中 | AD52: 回售中 | AE52: 100.3 | AF52: 104.63 | AG52: 0.2 | AH52: AA | AI52: 4.4199999999999996e-002 | AJ52: =H52+100*O52 -> 130.916 | AK52: 128.3 | AL52: 98 | AM52: 23.7 | AN52: 7 | AO52: 3.9e-002 | AP52: 74 | AQ52: 海印转债!
A53: 134 | B53: 113566 | C53: 翔港转债 | D53: 603499 | E53: 翔港科技 | F53: 造纸包装 | G53: 包装材料 | H53: 112.07 | I53: -6.1999999999999998e-003 | J53: 6.8000000000000005e-003 | K53: 9.95 | L53: 1.e-003 | M53: 124.5 | N53: 10.77 | O53: 0.21299999999999999 | P53: 92.39 | Q53: 转股中 | R53: 5.27年 | S53: 3.27年 | T53: 1.61 | U53: 9.4 | V53: 5.2000000000000005e-002 | W53: 8.0000000000000002e-002 | X53: 7.400000000000001e-002 | Y53: 20 | Z53: 3.5 | AA53: 2.06e-002 | AB53: 1.26e-002 | AC53: -1.9900000000000001e-002 | AD53: -2.2499999999999999e-002 | AE53: 81.04 | AF53: 84.46 | AG53: 0.61 | AH53: A+ | AI53: 7.8399999999999997e-002 | AJ53: =H53+100*O53 -> 133.37 | AK53: 131.8 | AL53: 135 | AM53: 47.3 | AN53: 194 | AO53: 2.e-002 | AP53: 27 | AQ53: 翔港转债
A54: 30 | B54: 128127 | C54: 文科转债 | D54: 2775. | E54: 文科园林 | F54: 城市公用 | G54: 生态环境 | H54: 108.196 | I54: 1.6000000000000001e-003 | J54: 8.9999999999999998e-004 | K54: 5.32 | L54: 3.8e-003 | M54: 121.3 | N54: 5.37 | O54: 9.1999999999999998e-002 | P54: 99.07 | Q54: 3月11天 | R54: 5.75年 | S54: 3.75年 | T54: 9.5 | U54: 7.2 | V54: 6.9999999999999993e-003 | W54: 0.34799999999999998 | X54: 0.34499999999999997 | Y54: 27 | Z54: 1.03 | AA54: 2.0499999999999997e-002 | AB54: 1.3999999999999999e-002 | AC54: -9.5999999999999992e-003 | AD54: -1.1699999999999999e-002 | AE54: 80.97 | AF54: 84.06 | AG54: 0.67 | AH54: AA- | AI54: 6.7400000000000002e-002 | AJ54: =H54+100*O54 -> 117.396 | AK54: 117.3 | AL54: 7 | AM54: 33.3 | AN54: 55 | AO54: -2.e-002 | AP54: 21 | AQ54: 文科转债
A55: 240 | B55: 113524 | C55: 奇精转债! | D55: 603677 | E55: 奇精机械 | F55: 家电 | G55: 零部件制 | H55: 108.81 | I55: 0. | J55: -3.0000000000000001e-003 | K55: 12.19 | L55: -8.1000000000000013e-003 | M55: 117.9 | N55: 14.08 | O55: 0.25700000000000001 | P55: 86.58 | Q55: 转股中 | R55: 4年24天 | S55: 2年24天 | T55: 3.3 | U55: 1.1 | V55: 3.0000000000000001e-003 | W55: 0.14099999999999999 | X55: 0.122 | Y55: 23 | Z55: 2.45 | AA55: 2.0400000000000001e-002 | AB55: 1.24e-002 | AC55: -2.2799999999999997e-002 | AD55: -2.5699999999999997e-002 | AE55: 93.85 | AF55: 99 | AG55: 0.37 | AH55: AA | AI55: 4.4900000000000002e-002 | AJ55: =H55+100*O55 -> 134.50999999999999 | AK55: 131 | AL55: 129 | AM55: 32 | AN55: 43 | AO55: -3.9e-002 | AP55: 45 | AQ55: 奇精转债!
A56: 189 | B56: 128072 | C56: 翔鹭转债! | D56: 2842. | E56: 翔鹭钨业 | F56: 有色金属 | G56: 小金属 | H56: 105 | I56: 1.7000000000000001e-003 | J56: 7.3000000000000001e-003 | K56: 10.97 | L56: 2.81e-002 | M56: 115.1 | N56: 15.34 | O56: 0.46799999999999997 | P56: 71.51 | Q56: 转股中 | R56: 4.75年 | S56: 2.75年 | T56: 3.02 | U56: 5 | V56: 1.6e-002 | W56: 0.10099999999999999 | X56: 7.2000000000000008e-002 | Y56: 30 | Z56: 3.3 | AA56: 1.9900000000000001e-002 | AB56: 1.41e-002 | AC56: -5.1999999999999998e-003 | AD56: -7.4999999999999997e-003 | AE56: 86.03 | AF56: 85.53 | AG56: 0.32 | AH56: AA- | AI56: 6.59e-002 | AJ56: =H56+100*O56 -> 151.80000000000001 | AK56: 138.5 | AL56: 193 | AM56: 52.5 | AN56: 217 | AO56: 8.3000000000000004e-002 | AP56: 27 | AQ56: 翔鹭转债!
A57: 289 | B57: 128026 | C57: 众兴转债! | D57: 2772. | E57: 众兴菌业 | F57: 农业 | G57: 种植业 | H57: 104.091 | I57: 8.9999999999999998e-004 | J57: 3.2000000000000002e-003 | K57: 9.28 | L57: 1.3100000000000001e-002 | M57: 110.3 | N57: 11.45 | O57: 0.28399999999999997 | P57: 81.05 | Q57: 转股中 | R57: 3年23天 | S57: 1年23天 | T57: 9.19 | U57: 2.5 | V57: 3.0000000000000001e-003 | W57: 0.26899999999999996 | X57: 0.218 | Y57: 34 | Z57: 1.39 | AA57: 1.9599999999999999e-002 | AB57: 1.3100000000000001e-002 | AC57: -1.0200000000000001e-002 | AD57: -1.46e-002 | AE57: 95.13 | AF57: 91.15 | AG57: 0.31 | AH57: AA- | AI57: 6.59e-002 | AJ57: =H57+100*O57 -> 132.49099999999999 | AK57: 127.1 | AL57: 78 | AM57: 32 | AN57: 41 | AO57: 1.2e-002 | AP57: 57 | AQ57: 众兴转债!
A58: 225 | B58: 110053 | C58: 苏银转债! | D58: 600919 | E58: 江苏银行 | F58: 金融 | G58: 银行行业 | H58: 109.9 | I58: -1.1699999999999999e-002 | J58: 1.01e-002 | K58: 6.07 | L58: -4.8999999999999998e-003 | M58: 119.1 | N58: 7.28 | O58: 0.318 | P58: 83.38 | Q58: 转股中 | R58: 4.31年 | S58: 无权 | T58: 200 | U58: 144 | V58: 6.9999999999999993e-003 | W58: 0.28499999999999998 | X58: 0.23800000000000002 | Y58: 701 | Z58: 0.59 | AA58: 1.9400000000000001e-002 | AB58: 1.1399999999999999e-002 | AC58: 无权 | AD58: 无权 | AE58: 无权 | AF58: 101.15 | AG58: 0.33 | AH58: AAA | AI58: 3.9900000000000005e-002 | AJ58: =H58+100*O58 -> 141.70000000000002 | AK58: 136.4 | AL58: 180 | AM58: 35.3 | AN58: 77 | AO58: -1.e-003 | AP58: 46 | AQ58: 苏银转债!
A59: 111 | B59: 127016 | C59: 鲁泰转债 | D59: 726. | E59: 鲁 泰Ａ | F59: 服装纺织 | G59: 纺织行业 | H59: 105.2 | I59: 1.9e-003 | J59: -3.8e-003 | K59: 6.85 | L59: -5.7999999999999996e-003 | M59: 116.2 | N59: 8.91 | O59: 0.36799999999999999 | P59: 76.88 | Q59: 转股中 | R59: 5.38年 | S59: 3.38年 | T59: 14 | U59: 1.8 | V59: 1.e-003 | W59: 0.23800000000000002 | X59: 0.183 | Y59: 59 | Z59: 0.77 | AA59: 1.9e-002 | AB59: 1.3500000000000002e-002 | AC59: -4.0999999999999995e-003 | AD59: -6.0999999999999995e-003 | AE59: 89.01 | AF59: 92.39 | AG59: 0.32 | AH59: AA+ | AI59: 4.4400000000000002e-002 | AJ59: =H59+100*O59 -> 142. | AK59: 133.5 | AL59: 153 | AM59: 41.1 | AN59: 139 | AO59: -1.7000000000000001e-002 | AP59: 21 | AQ59: 鲁泰转债
A60: 63 | B60: 113036 | C60: 宁建转债! | D60: 601789 | E60: 宁波建工 | F60: 建筑 | G60: 建筑工程 | H60: 105.8 | I60: -6.9999999999999993e-003 | J60: 2.5000000000000001e-003 | K60: 4.31 | L60: -9.1999999999999998e-003 | M60: 117.3 | N60: 4.86 | O60: 0.193 | P60: 88.68 | Q60: 52天 | R60: 5.62年 | S60: 3.62年 | T60: 5.4 | U60: 1.9 | V60: 3.0000000000000001e-003 | W60: 0.128 | X60: 0.114 | Y60: 42 | Z60: 1.41 | AA60: 1.89e-002 | AB60: 1.3300000000000001e-002 | AC60: -5.1000000000000004e-003 | AD60: -6.9999999999999993e-003 | AE60: 87.55 | AF60: 91.34 | AG60: 0.49 | AH60: AA | AI60: 4.6399999999999997e-002 | AJ60: =H60+100*O60 -> 125.09999999999999 | AK60: 122.9 | AL60: 25 | AM60: 31.6 | AN60: 37 | AO60: 5.0000000000000001e-003 | AP60: 7 | AQ60: 宁建转债!
A61: 87 | B61: 113584 | C61: 家悦转债! | D61: 603708 | E61: 家家悦 | F61: 商业零售 | G61: 超市 | H61: 104.35 | I61: -8.199999999999999e-003 | J61: 7.4000000000000003e-003 | K61: 24.2 | L61: -4.0999999999999995e-003 | M61: 115.3 | N61: 37.97 | O61: 0.63700000000000001 | P61: 63.73 | Q61: 22天 | R61: 5.54年 | S61: 3.54年 | T61: 6.45 | U61: 5.4 | V61: 8.0000000000000002e-003 | W61: 4.4000000000000004e-002 | X61: 2.7999999999999997e-002 | Y61: 147 | Z61: 4.9 | AA61: 1.8500000000000003e-002 | AB61: 1.3500000000000002e-002 | AC61: -1.4000000000000002e-003 | AD61: -3.4000000000000002e-003 | AE61: 87.89 | AF61: 90.13 | AG61: 0.18 | AH61: AA | AI61: 4.6399999999999997e-002 | AJ61: =H61+100*O61 -> 168.05000000000001 | AK61: 145 | AL61: 240 | AM61: 54.8 | AN61: 227 | AO61: -0.10800000000000001 | AP61: 5 | AQ61: 家悦转债!
A62: 2 | B62: 123074 | C62: 隆利转债 | D62: 300752 | E62: 隆利科技 | F62: 电子 | G62: 液晶显示 | H62: 111.9 | I62: -8.0000000000000002e-003 | J62: 1.09e-002 | K62: 29.52 | L62: 4.4000000000000003e-003 | M62: 124 | N62: 29.53 | O62: 0.11900000000000001 | P62: 99.97 | Q62: 5月15天 | R62: 5.94年 | S62: 3.94年 | T62: 3.25 | U62: 250 | V62: 0.68700000000000006 | W62: 9.1999999999999998e-002 | X62: 9.1999999999999998e-002 | Y62: 35 | Z62: 4.08 | AA62: 1.77e-002 | AB62: 1.09e-002 | AC62: -1.8000000000000002e-002 | AD62: -1.9799999999999998e-002 | AE62: 79.7 | AF62: 84.79 | AG62: 0.66 | AH62: AA- | AI62: 6.7400000000000002e-002 | AJ62: =H62+100*O62 -> 123.80000000000001 | AK62: 123.8 | AL62: 41 | AM62: 39 | AN62: 120 | AO62: -4.4999999999999998e-002 | AP62: 2 | AQ62: 隆利转债
A63: 208 | B63: 113026 | C63: 核能转债! | D63: 601985 | E63: 中国核电 | F63: 能源电力 | G63: 核电 | H63: 101.83 | I63: 1.2999999999999999e-003 | J63: -1.2999999999999999e-003 | K63: 4.68 | L63: 0. | M63: 109.8 | N63: 6.08 | O63: 0.32299999999999995 | P63: 76.97 | Q63: 转股中 | R63: 4.40年 | S63: 2.40年 | T63: 78 | U63: 84 | V63: 1.1000000000000001e-002 | W63: 0.107 | X63: 8.199999999999999e-002 | Y63: 728 | Z63: 1.4 | AA63: 1.7600000000000001e-002 | AB63: 1.3300000000000001e-002 | AC63: 5.6999999999999993e-003 | AD63: 3.0999999999999999e-003 | AE63: 93.52 | AF63: 92.77 | AG63: 0.28 | AH63: AAA | AI63: 3.9900000000000005e-002 | AJ63: =H63+100*O63 -> 134.13 | AK63: 126.7 | AL63: 73 | AM63: 33.2 | AN63: 54 | AO63: 1.8000000000000002e-002 | AP63: 51 | AQ63: 核能转债!
A64: 167 | B64: 128081 | C64: 海亮转债! | D64: 2203. | E64: 海亮股份 | F64: 有色金属 | G64: 铜金属 | H64: 105.78 | I64: 1.e-004 | J64: 8.8999999999999999e-003 | K64: 8.31 | L64: 2.0899999999999998e-002 | M64: 115.2 | N64: 9.76 | O64: 0.24199999999999999 | P64: 85.14 | Q64: 转股中 | R64: 5年1.1天 | S64: 3年1.1天 | T64: 31.5 | U64: 4.9 | V64: 1.e-003 | W64: 0.19399999999999998 | X64: 0.16500000000000001 | Y64: 162 | Z64: 1.8 | AA64: 1.7600000000000001e-002 | AB64: 1.2e-002 | AC64: -6.3e-003 | AD64: -8.6e-003 | AE64: 89.97 | AF64: 92.25 | AG64: 0.43 | AH64: AA | AI64: 4.6399999999999997e-002 | AJ64: =H64+100*O64 -> 129.97999999999999 | AK64: 126.4 | AL64: 69 | AM64: 34.2 | AN64: 64 | AO64: 2.9999999999999999e-002 | AP64: 49 | AQ64: 海亮转债!
A65: 214 | B65: 113532 | C65: 海环转债! | D65: 603817 | E65: 海峡环保 | F65: 城市公用 | G65: 三废处理 | H65: 105.09 | I65: 8.0000000000000004e-004 | J65: -1.4000000000000002e-003 | K65: 6.34 | L65: -1.6000000000000001e-003 | M65: 112.9 | N65: 7.69 | O65: 0.27500000000000002 | P65: 82.44 | Q65: 转股中 | R65: 4.36年 | S65: 2.36年 | T65: 4.6 | U65: 0.9 | V65: 2.e-003 | W65: 0.161 | X65: 0.13300000000000001 | Y65: 29 | Z65: 1.67 | AA65: 1.6899999999999998e-002 | AB65: 1.1399999999999999e-002 | AC65: -6.5000000000000006e-003 | AD65: -9.0000000000000011e-003 | AE65: 92.63 | AF65: 93.59 | AG65: 0.38 | AH65: AA | AI65: 4.4900000000000002e-002 | AJ65: =H65+100*O65 -> 132.59 | AK65: 127.7 | AL65: 85 | AM65: 34.1 | AN65: 63 | AO65: 0. | AP65: 26 | AQ65: 海环转债!
A66: 48 | B66: 113037 | C66: 紫银转债 | D66: 601860 | E66: 紫金银行 | F66: 金融 | G66: 银行行业 | H66: 105.73 | I66: -3.5999999999999999e-003 | J66: -8.0000000000000004e-004 | K66: 4.03 | L66: -9.7999999999999997e-003 | M66: 115.8 | N66: 4.75 | O66: 0.24600000000000002 | P66: 84.84 | Q66: 2月10天 | R66: 5.67年 | S66: 无权 | T66: 45 | U66: 23 | V66: 5.0000000000000001e-003 | W66: 0.30499999999999999 | X66: 0.25900000000000001 | Y66: 148 | Z66: 1.04 | AA66: 1.6500000000000001e-002 | AB66: 1.1399999999999999e-002 | AC66: 无权 | AD66: 无权 | AE66: 无权 | AF66: 90.96 | AG66: 0.45 | AH66: AA+ | AI66: 4.4400000000000002e-002 | AJ66: =H66+100*O66 -> 130.33000000000001 | AK66: 126.6 | AL66: 71 | AM66: 35.7 | AN66: 83 | AO66: 3.0000000000000001e-003 | AP66: 16 | AQ66: 紫银转债
A67: 211 | B67: 113024 | C67: 核建转债! | D67: 601611 | E67: 中国核建 | F67: 建筑 | G67: 建筑工程 | H67: 102.59 | I67: -1.e-004 | J67: -1.6000000000000001e-003 | K67: 7.27 | L67: -6.8000000000000005e-003 | M67: 109.7 | N67: 9.76 | O67: 0.377 | P67: 74.49 | Q67: 转股中 | R67: 4.38年 | S67: 2.38年 | T67: 30 | U67: 3.5 | V67: 1.e-003 | W67: 0.155 | X67: 0.11599999999999999 | Y67: 193 | Z67: 1.79 | AA67: 1.5700000000000002e-002 | AB67: 1.15e-002 | AC67: 2.3999999999999998e-003 | AD67: -1.e-004 | AE67: 93.49 | AF67: 92.74 | AG67: 0.25 | AH67: AAA | AI67: 3.9900000000000005e-002 | AJ67: =H67+100*O67 -> 140.29000000000002 | AK67: 130.7 | AL67: 126 | AM67: 37.2 | AN67: 103 | AO67: -2.2000000000000002e-002 | AP67: 44 | AQ67: 核建转债!
A68: 27 | B68: 113039 | C68: 嘉泽转债! | D68: 601619 | E68: 嘉泽新能 | F68: 能源电力 | G68: 风能 | H68: 103.61 | I68: 1.6000000000000001e-003 | J68: 5.1999999999999998e-003 | K68: 3.16 | L68: 1.2800000000000001e-002 | M68: 113.1 | N68: 3.57 | O68: 0.17100000000000001 | P68: 88.52 | Q68: 3月11天 | R68: 5.76年 | S68: 3.76年 | T68: 13 | U68: 3.6 | V68: 3.0000000000000001e-003 | W68: 0.19800000000000001 | X68: 0.17600000000000002 | Y68: 66 | Z68: 1.91 | AA68: 1.5600000000000001e-002 | AB68: 1.1399999999999999e-002 | AC68: 0. | AD68: -1.8e-003 | AE68: 86.83 | AF68: 87.51 | AG68: 0.53 | AH68: AA | AI68: 4.6399999999999997e-002 | AJ68: =H68+100*O68 -> 120.71000000000001 | AK68: 118.7 | AL68: 9 | AM68: 31.2 | AN68: 34 | AO68: 9.0000000000000011e-003 | AP68: 13 | AQ68: 嘉泽转债!
A69: 265 | B69: 127007 | C69: 湖广转债! | D69: 665. | E69: 湖北广电 | F69: 传媒娱乐 | G69: 影视娱乐 | H69: 106.4 | I69: -1.7000000000000001e-003 | J69: 8.9999999999999998e-004 | K69: 5.01 | L69: -2.e-003 | M69: 112.3 | N69: 5.58 | O69: 0.185 | P69: 89.78 | Q69: 转股中 | R69: 3.60年 | S69: 1.60年 | T69: 12.2 | U69: 2.8 | V69: 2.e-003 | W69: 0.247 | X69: 0.222 | Y69: 49 | Z69: 0.76 | AA69: 1.54e-002 | AB69: 9.0000000000000011e-003 | AC69: -1.9400000000000001e-002 | AD69: -2.2400000000000003e-002 | AE69: 95.49 | AF69: 96.81 | AG69: 0.43 | AH69: AA+ | AI69: 4.2900000000000001e-002 | AJ69: =H69+100*O69 -> 124.90000000000001 | AK69: 123 | AL69: 28 | AM69: 26.2 | AN69: 14 | AO69: -2.e-002 | AP69: 18 | AQ69: 湖广转债!
A70: 256 | B70: 113516 | C70: 苏农转债! | D70: 603323 | E70: 苏农银行 | F70: 金融 | G70: 银行行业 | H70: 108.16 | I70: -7.7000000000000002e-003 | J70: 2.8999999999999998e-003 | K70: 4.91 | L70: -1.21e-002 | M70: 114.3 | N70: 5.52 | O70: 0.21600000000000003 | P70: 88.95 | Q70: 转股中 | R70: 3.70年 | S70: 无权 | T70: 12.9 | U70: 6.8 | V70: 5.0000000000000001e-003 | W70: 0.14599999999999999 | X70: 0.13 | Y70: 89 | Z70: 0.75 | AA70: 1.5300000000000001e-002 | AB70: 8.199999999999999e-003 | AC70: 无权 | AD70: 无权 | AE70: 无权 | AF70: 98.14 | AG70: 0.4 | AH70: AA+ | AI70: 4.2900000000000001e-002 | AJ70: =H70+100*O70 -> 129.75999999999999 | AK70: 127.4 | AL70: 82 | AM70: 29.2 | AN70: 25 | AO70: 2.4e-002 | AP70: 36 | AQ70: 苏农转债!
A71: 308 | B71: 128013 | C71: 洪涛转债! | D71: 2325. | E71: 洪涛股份 | F71: 建筑 | G71: 装饰工程 | H71: 107.088 | I71: 1.9e-003 | J71: -1.9e-003 | K71: 3.01 | L71: 0. | M71: 109.8 | N71: 3.1 | O71: 0.10300000000000001 | P71: 97.1 | Q71: 转股中 | R71: 1.69年 | S71: 回售中 | T71: 12 | U71: 8.7 | V71: 6.9999999999999993e-003 | W71: 0.31900000000000001 | X71: 0.309 | Y71: 38 | Z71: 1.26 | AA71: 1.5100000000000001e-002 | AB71: 4.1999999999999997e-003 | AC71: 回售中 | AD71: 回售中 | AE71: 100.3 | AF71: 98.8 | AG71: 0.47 | AH71: AA- | AI71: 6.5199999999999994e-002 | AJ71: =H71+100*O71 -> 117.38799999999999 | AK71: 117.1 | AL71: 5 | AM71: 16.8 | AN71: 4 | AO71: 1.7000000000000001e-002 | AP71: 92 | AQ71: 洪涛转债!
A72: 258 | B72: 128042 | C72: 凯中转债! | D72: 2823. | E72: 凯中精密 | F72: 能源电力 | G72: 电力设备 | H72: 110.244 | I72: -2.3e-003 | J72: 4.0000000000000002e-004 | K72: 12.6 | L72: -4.0000000000000001e-003 | M72: 116.3 | N72: 12.96 | O72: 0.13400000000000001 | P72: 97.22 | Q72: 转股中 | R72: 3.69年 | S72: 1.69年 | T72: 4.16 | U72: 36 | V72: 7.8e-002 | W72: 0.115 | X72: 0.11199999999999999 | Y72: 36 | Z72: 2.68 | AA72: 1.49e-002 | AB72: 6.8999999999999999e-003 | AC72: -3.7200000000000004e-002 | AD72: -4.0000000000000001e-002 | AE72: 94.81 | AF72: 99.19 | AG72: 0.49 | AH72: AA | AI72: 4.4900000000000002e-002 | AJ72: =H72+100*O72 -> 123.64400000000001 | AK72: 123.3 | AL72: 32 | AM72: 24.1 | AN72: 9 | AO72: 5.2000000000000005e-002 | AP72: 28 | AQ72: 凯中转债!
A73: 163 | B73: 128083 | C73: 新北转债! | D73: 2376. | E73: 新北洋 | F73: 电子 | G73: 电子产品 | H73: 107.2 | I73: 0. | J73: -1.1999999999999999e-003 | K73: 9.43 | L73: -3.2000000000000002e-003 | M73: 115.2 | N73: 11.7 | O73: 0.33000000000000002 | P73: 80.6 | Q73: 转股中 | R73: 5年22天 | S73: 3年22天 | T73: 8.77 | U73: 2.7 | V73: 3.0000000000000001e-003 | W73: 0.14000000000000001 | X73: 0.113 | Y73: 63 | Z73: 1.86 | AA73: 1.46e-002 | AB73: 9.1000000000000004e-003 | AC73: -1.03e-002 | AD73: -1.2500000000000001e-002 | AE73: 89.73 | AF73: 92.01 | AG73: 0.38 | AH73: AA | AI73: 4.6399999999999997e-002 | AJ73: =H73+100*O73 -> 140.19999999999999 | AK73: 133.8 | AL73: 156 | AM73: 41.8 | AN73: 145 | AO73: 2.e-003 | AP73: 17 | AQ73: 新北转债!
A74: 18 | B74: 123067 | C74: 斯莱转债 | D74: 300382 | E74: 斯莱克 | F74: 机械装备 | G74: 专用设备 | H74: 111.69 | I74: 1.e-003 | J74: -2.0000000000000001e-004 | K74: 9.1 | L74: 1.1000000000000001e-003 | M74: 121.2 | N74: 9.38 | O74: 0.151 | P74: 97.01 | Q74: 4月3天 | R74: 5.82年 | S74: 3.82年 | T74: 3.88 | U74: 13 | V74: 2.9999999999999999e-002 | W74: 7.5999999999999998e-002 | X74: 7.2999999999999995e-002 | Y74: 51 | Z74: 5.04 | AA74: 1.44e-002 | AB74: 8.1000000000000013e-003 | AC74: -1.7600000000000001e-002 | AD74: -1.95e-002 | AE74: 80.48 | AF74: 83.55 | AG74: 0.67 | AH74: AA- | AI74: 6.7400000000000002e-002 | AJ74: =H74+100*O74 -> 126.78999999999999 | AK74: 126.4 | AL74: 68 | AM74: 42.8 | AN74: 153 | AO74: -6.4000000000000001e-002 | AP74: 11 | AQ74: 斯莱转债
A75: 181 | B75: 128076 | C75: 金轮转债! | D75: 2722. | E75: 金轮股份 | F75: 机械装备 | G75: 专用设备 | H75: 107.3 | I75: 1.8e-003 | J75: -1.e-003 | K75: 12.82 | L75: 1.6000000000000001e-003 | M75: 114.9 | N75: 14.76 | O75: 0.23499999999999999 | P75: 86.86 | Q75: 转股中 | R75: 4.90年 | S75: 2.90年 | T75: 2.14 | U75: 14 | V75: 5.9000000000000004e-002 | W75: 9.5000000000000001e-002 | X75: 8.3000000000000004e-002 | Y75: 22 | Z75: 1.22 | AA75: 1.43e-002 | AB75: 8.8000000000000005e-003 | AC75: -1.21e-002 | AD75: -1.4199999999999999e-002 | AE75: 85.18 | AF75: 84.56 | AG75: 0.54 | AH75: AA- | AI75: 6.59e-002 | AJ75: =H75+100*O75 -> 130.80000000000001 | AK75: 127.7 | AL75: 86 | AM75: 42.6 | AN75: 151 | AO75: 2.e-002 | AP75: 43 | AQ75: 金轮转债!
A76: 288 | B76: 123004 | C76: 铁汉转债! | D76: 300197 | E76: 铁汉生态 | F76: 城市公用 | G76: 生态环境 | H76: 105.42 | I76: -1.1000000000000001e-003 | J76: -6.5000000000000006e-003 | K76: 3.4 | L76: -2.3e-002 | M76: 109.8 | N76: 3.98 | O76: 0.23399999999999999 | P76: 85.43 | Q76: 转股中 | R76: 3年28天 | S76: 1年28天 | T76: 8.03 | U76: 3.8 | V76: 4.0000000000000001e-003 | W76: 0.10000000000000001 | X76: 8.5999999999999993e-002 | Y76: 80 | Z76: 1.55 | AA76: 1.3600000000000001e-002 | AB76: 7.4999999999999997e-003 | AC76: -2.2200000000000001e-002 | AD76: -2.6099999999999998e-002 | AE76: 97.16 | AF76: 96.21 | AG76: 0.33 | AH76: AA | AI76: 4.4900000000000002e-002 | AJ76: =H76+100*O76 -> 128.81999999999999 | AK76: 125.4 | AL76: 58 | AM76: 28.3 | AN76: 19 | AO76: -6.5000000000000002e-002 | AP76: 40 | AQ76: 铁汉转债!
A77: 165 | B77: 128082 | C77: 华锋转债! | D77: 2806. | E77: 华锋股份 | F77: 电子 | G77: 元器件制 | H77: 114.198 | I77: 1.06e-002 | J77: 1.29e-002 | K77: 12.47 | L77: 3.1400000000000004e-002 | M77: 122 | N77: 11.71 | O77: 7.2000000000000008e-002 | P77: 106.49 | Q77: 转股中 | R77: 5年14天 | S77: 3年14天 | T77: 3.52 | U77: 21 | V77: 5.2999999999999999e-002 | W77: 0.16 | X77: 0.17100000000000001 | Y77: 22 | Z77: 1.76 | AA77: 1.3600000000000001e-002 | AB77: 6.0000000000000001e-003 | AC77: -2.6000000000000002e-002 | AD77: -2.8900000000000002e-002 | AE77: 82.86 | AF77: 84.35 | AG77: 0.75 | AH77: A+ | AI77: 7.8399999999999997e-002 | AJ77: =H77+100*O77 -> 121.398 | AK77: 121.9 | AL77: 21 | AM77: 37.6 | AN77: 107 | AO77: 4.5999999999999999e-002 | AP77: 57 | AQ77: 华锋转债!
A78: 114 | B78: 113033 | C78: 利群转债! | D78: 601366 | E78: 利群股份 | F78: 商业零售 | G78: 商场 | H78: 107.42 | I78: 1.6000000000000001e-003 | J78: -7.000000000000001e-004 | K78: 6.53 | L78: 1.5e-003 | M78: 115.3 | N78: 7.01 | O78: 0.153 | P78: 93.15 | Q78: 转股中 | R78: 5.36年 | S78: 3.36年 | T78: 18 | U78: 5.3 | V78: 3.0000000000000001e-003 | W78: 0.32000000000000001 | X78: 0.29799999999999999 | Y78: 56 | Z78: 1.26 | AA78: 1.3600000000000001e-002 | AB78: 8.3999999999999995e-003 | AC78: -9.7999999999999997e-003 | AD78: -1.18e-002 | AE78: 88.6 | AF78: 90.86 | AG78: 0.55 | AH78: AA | AI78: 4.6399999999999997e-002 | AJ78: =H78+100*O78 -> 122.72 | AK78: 121.7 | AL78: 19 | AM78: 30.8 | AN78: 33 | AO78: -6.9999999999999993e-003 | AP78: 36 | AQ78: 利群转债!
A79: 81 | B79: 123054 | C79: 思特转债 | D79: 300608 | E79: 思特奇 | F79: 通信互联 | G79: 通信设备 | H79: 113.402 | I79: -2.e-003 | J79: -1.e-004 | K79: 16.79 | L79: -3.0000000000000001e-003 | M79: 121.7 | N79: 16.49 | O79: 0.114 | P79: 101.82 | Q79: 26天 | R79: 5.55年 | S79: 3.55年 | T79: 2.71 | U79: 12 | V79: 3.9e-002 | W79: 0.10199999999999999 | X79: 0.10400000000000001 | Y79: 26 | Z79: 3.49 | AA79: 1.3100000000000001e-002 | AB79: 6.3e-003 | AC79: -2.1700000000000001e-002 | AD79: -2.4e-002 | AE79: 82.33 | AF79: 85.46 | AG79: 0.7 | AH79: AA- | AI79: 6.7400000000000002e-002 | AJ79: =H79+100*O79 -> 124.80200000000001 | AK79: 125 | AL79: 53 | AM79: 39.5 | AN79: 125 | AO79: -6.9000000000000006e-002 | AP79: 15 | AQ79: 思特转债
A80: 32 | B80: 110072 | C80: 广汇转债! | D80: 600297 | E80: 广汇汽车 | F80: 汽车 | G80: 分销、售 | H80: 106.35 | I80: 7.6e-003 | J80: 5.5000000000000005e-003 | K80: 3.57 | L80: 2.5899999999999999e-002 | M80: 114.5 | N80: 4.03 | O80: 0.20100000000000001 | P80: 88.59 | Q80: 3月6天 | R80: 5.74年 | S80: 3.74年 | T80: 33.7 | U80: 68 | V80: 1.9e-002 | W80: 0.11599999999999999 | X80: 0.10300000000000001 | Y80: 290 | Z80: 0.73 | AA80: 1.3100000000000001e-002 | AB80: 8.5000000000000006e-003 | AC80: -8.199999999999999e-003 | AD80: -9.7000000000000003e-003 | AE80: 87 | AF80: 89.54 | AG80: 0.5 | AH80: AA+ | AI80: 4.4400000000000002e-002 | AJ80: =H80+100*O80 -> 126.44999999999999 | AK80: 124.1 | AL80: 44 | AM80: 34.6 | AN80: 69 | AO80: -1.7000000000000001e-002 | AP80: 18 | AQ80: 广汇转债!
A81: 43 | B81: 113596 | C81: 城地转债! | D81: 603887 | E81: 城地香江 | F81: 通信互联 | G81: 通信设备 | H81: 105.9 | I81: -4.0999999999999995e-003 | J81: 8.3999999999999995e-003 | K81: 20.99 | L81: 1.06e-002 | M81: 113.5 | N81: 29.21 | O81: 0.47399999999999998 | P81: 71.86 | Q81: 2月16天 | R81: 5.69年 | S81: 3.69年 | T81: 12 | U81: 2.7 | V81: 2.e-003 | W81: 0.152 | X81: 0.109 | Y81: 79 | Z81: 2.18 | AA81: 1.2500000000000001e-002 | AB81: 8.1000000000000013e-003 | AC81: -5.1999999999999998e-003 | AD81: -7.0999999999999995e-003 | AE81: 80.97 | AF81: 78.94 | AG81: 0.4 | AH81: AA- | AI81: 6.7400000000000002e-002 | AJ81: =H81+100*O81 -> 153.30000000000001 | AK81: 139.9 | AL81: 205 | AM81: 59 | AN81: 246 | AO81: -4.9000000000000002e-002 | AP81: 9 | AQ81: 城地转债!
A82: 210 | B82: 113534 | C82: 鼎胜转债! | D82: 603876 | E82: 鼎胜新材 | F82: 有色金属 | G82: 小金属 | H82: 109.12 | I82: 5.9999999999999995e-004 | J82: 5.1000000000000004e-003 | K82: 14.29 | L82: 1.1299999999999999e-002 | M82: 114.9 | N82: 15.18 | O82: 0.159 | P82: 94.14 | Q82: 转股中 | R82: 4.38年 | S82: 2.38年 | T82: 12 | U82: 2.1 | V82: 2.e-003 | W82: 0.193 | X82: 0.182 | Y82: 62 | Z82: 1.73 | AA82: 1.21e-002 | AB82: 5.8999999999999999e-003 | AC82: -2.1099999999999997e-002 | AD82: -2.3599999999999999e-002 | AE82: 92.55 | AF82: 95.16 | AG82: 0.51 | AH82: AA | AI82: 4.4900000000000002e-002 | AJ82: =H82+100*O82 -> 125.02000000000001 | AK82: 124.1 | AL82: 43 | AM82: 28.9 | AN82: 23 | AO82: 8.900000000000001e-002 | AP82: 31 | AQ82: 鼎胜转债!
A83: 17 | B83: 128133 | C83: 奇正转债! | D83: 2287. | E83: 奇正藏药 | F83: 医药 | G83: 中药 | H83: 109.451 | I83: -5.4000000000000003e-003 | J83: 5.8999999999999999e-003 | K83: 24.98 | L83: 1.1999999999999999e-003 | M83: 117.3 | N83: 30.12 | O83: 0.32000000000000001 | P83: 82.93 | Q83: 4月8天 | R83: 5.84年 | S83: 3.84年 | T83: 8 | U83: 31 | V83: 3.5000000000000003e-002 | W83: 5.9999999999999998e-002 | X83: 5.0000000000000003e-002 | Y83: 132 | Z83: 5.51 | AA83: 1.21e-002 | AB83: 6.8999999999999999e-003 | AC83: -1.3300000000000001e-002 | AD83: -1.5100000000000001e-002 | AE83: 86.71 | AF83: 90.45 | AG83: 0.44 | AH83: AA | AI83: 4.6399999999999997e-002 | AJ83: =H83+100*O83 -> 141.45099999999999 | AK83: 136 | AL83: 174 | AM83: 45.5 | AN83: 179 | AO83: -2.2000000000000002e-002 | AP83: 6 | AQ83: 奇正转债!
A84: 151 | B84: 113030 | C84: 东风转债 | D84: 601515 | E84: 东风股份 | F84: 造纸包装 | G84: 包装材料 | H84: 110.54 | I84: -2.3e-003 | J84: 8.0000000000000004e-004 | K84: 6.1 | L84: -3.3e-003 | M84: 117.3 | N84: 6.75 | O84: 0.223 | P84: 90.37 | Q84: 转股中 | R84: 5年34天 | S84: 3年34天 | T84: 2.95 | U84: 0.5 | V84: 2.e-003 | W84: 3.6000000000000004e-002 | X84: 3.3000000000000002e-002 | Y84: 81 | Z84: 1.95 | AA84: 1.2e-002 | AB84: 5.8999999999999999e-003 | AC84: -1.9299999999999998e-002 | AD84: -2.1499999999999998e-002 | AE84: 89.7 | AF84: 93.56 | AG84: 0.48 | AH84: AA | AI84: 4.6399999999999997e-002 | AJ84: =H84+100*O84 -> 132.84 | AK84: 130.7 | AL84: 127 | AM84: 37.1 | AN84: 101 | AO84: 0. | AP84: 15 | AQ84: 东风转债
A85: 41 | B85: 123063 | C85: 大禹转债 | D85: 300021 | E85: 大禹节水 | F85: 化工 | G85: 橡胶塑料 | H85: 118.934 | I85: -9.1999999999999998e-003 | J85: -3.0000000000000001e-003 | K85: 5.6 | L85: -1.5800000000000002e-002 | M85: 126.5 | N85: 4.94 | O85: 4.9000000000000002e-002 | P85: 113.36 | Q85: 2月15天 | R85: 5.69年 | S85: 4.69年 | T85: 6.38 | U85: 17 | V85: 2.2000000000000002e-002 | W85: 0.14300000000000002 | X85: 0.16200000000000001 | Y85: 45 | Z85: 3.09 | AA85: 1.11e-002 | AB85: 3.4000000000000002e-003 | AC85: -2.1899999999999999e-002 | AD85: -2.4500000000000001e-002 | AE85: 78.41 | AF85: 87.99 | AG85: 0.77 | AH85: AA- | AI85: 6.7400000000000002e-002 | AJ85: =H85+100*O85 -> 123.834 | AK85: 124.5 | AL85: 46 | AM85: 36.5 | AN85: 96 | AO85: -1.6e-002 | AP85: 15 | AQ85: 大禹转债
A86: 141 | B86: 128094 | C86: 星帅转债 | D86: 2860. | E86: 星帅尔 | F86: 家电 | G86: 零部件制 | H86: 115 | I86: -5.3e-003 | J86: 1.7000000000000001e-003 | K86: 14.21 | L86: -4.8999999999999998e-003 | M86: 121.5 | N86: 13.95 | O86: 0.129 | P86: 101.86 | Q86: 转股中 | R86: 5年57天 | S86: 3年57天 | T86: 2.8 | U86: 54 | V86: 0.16899999999999998 | W86: 9.9000000000000005e-002 | X86: 0.10099999999999999 | Y86: 28 | Z86: 3.04 | AA86: 1.1000000000000001e-002 | AB86: 3.8e-003 | AC86: -2.8500000000000001e-002 | AD86: -3.1099999999999999e-002 | AE86: 81.69 | AF86: 83.16 | AG86: 0.73 | AH86: A+ | AI86: 7.8399999999999997e-002 | AJ86: =H86+100*O86 -> 127.90000000000001 | AK86: 128.1 | AL86: 94 | AM86: 45 | AN86: 176 | AO86: 4.5999999999999999e-002 | AP86: 31 | AQ86: 星帅转债
A87: 52 | B87: 113594 | C87: 淳中转债 | D87: 603516 | E87: 淳中科技 | F87: 电子 | G87: 电子产品 | H87: 114.3 | I87: -2.5999999999999999e-003 | J87: -2.3e-003 | K87: 34.01 | L87: -8.199999999999999e-003 | M87: 121.4 | N87: 39.37 | O87: 0.32299999999999995 | P87: 86.39 | Q87: 2月8天 | R87: 5.67年 | S87: 3.67年 | T87: 3 | U87: 0.5 | V87: 2.e-003 | W87: 6.6000000000000003e-002 | X87: 5.7000000000000002e-002 | Y87: 45 | Z87: 5.04 | AA87: 1.09e-002 | AB87: 4.4000000000000003e-003 | AC87: -2.3199999999999998e-002 | AD87: -2.5399999999999999e-002 | AE87: 78.58 | AF87: 79.95 | AG87: 0.61 | AH87: A+ | AI87: 7.8399999999999997e-002 | AJ87: =H87+100*O87 -> 146.59999999999999 | AK87: 142.2 | AL87: 219 | AM87: 62.3 | AN87: 260 | AO87: -5.5999999999999994e-002 | AP87: 5 | AQ87: 淳中转债
A88: 127 | B88: 113570 | C88: 百达转债 | D88: 603331 | E88: 百达精工 | F88: 机械装备 | G88: 机械装备 | H88: 109.03 | I88: -5.9999999999999995e-004 | J88: 3.2000000000000002e-003 | K88: 10.74 | L88: 3.7000000000000002e-003 | M88: 115.3 | N88: 11.54 | O88: 0.17199999999999999 | P88: 93.07 | Q88: 转股中 | R88: 5.30年 | S88: 3.30年 | T88: 2.8 | U88: 0.8 | V88: 2.e-003 | W88: 0.14599999999999999 | X88: 0.13600000000000001 | Y88: 19 | Z88: 2.48 | AA88: 1.0800000000000001e-002 | AB88: 5.6000000000000008e-003 | AC88: -1.4199999999999999e-002 | AD88: -1.6299999999999999e-002 | AE88: 80.11 | AF88: 77.94 | AG88: 0.69 | AH88: A+ | AI88: 7.8399999999999997e-002 | AJ88: =H88+100*O88 -> 126.23 | AK88: 125 | AL88: 54 | AM88: 44.9 | AN88: 175 | AO88: -3.0000000000000001e-003 | AP88: 33 | AQ88: 百达转债
A89: 68 | B89: 128116 | C89: 瑞达转债 | D89: 2961. | E89: 瑞达期货 | F89: 金融 | G89: 期货行业 | H89: 108.701 | I89: -2.2000000000000001e-003 | J89: -6.0000000000000001e-003 | K89: 27.95 | L89: -1.4800000000000001e-002 | M89: 115.3 | N89: 29.82 | O89: 0.16 | P89: 93.73 | Q89: 45天 | R89: 5.61年 | S89: 3.61年 | T89: 6.5 | U89: 3.6 | V89: 5.0000000000000001e-003 | W89: 5.2000000000000005e-002 | X89: 4.9000000000000002e-002 | Y89: 124 | Z89: 7.07 | AA89: 1.0800000000000001e-002 | AB89: 5.7999999999999996e-003 | AC89: -1.2500000000000001e-002 | AD89: -1.43e-002 | AE89: 87.55 | AF89: 89.85 | AG89: 0.55 | AH89: AA | AI89: 4.6399999999999997e-002 | AJ89: =H89+100*O89 -> 124.70099999999999 | AK89: 123.7 | AL89: 39 | AM89: 33.8 | AN89: 61 | AO89: 8.0000000000000002e-003 | AP89: 11 | AQ89: 瑞达转债
A90: 103 | B90: 123049 | C90: 维尔转债 | D90: 300190 | E90: 维尔利 | F90: 城市公用 | G90: 三废处理 | H90: 118.05 | I90: -4.4000000000000003e-003 | J90: -1.8e-003 | K90: 8.37 | L90: -8.3000000000000001e-003 | M90: 124.8 | N90: 7.48 | O90: 5.5e-002 | P90: 111.9 | Q90: 转股中 | R90: 5.39年 | S90: 3.39年 | T90: 9.17 | U90: 14 | V90: 1.3000000000000001e-002 | W90: 0.14000000000000001 | X90: 0.157 | Y90: 65 | Z90: 1.55 | AA90: 1.06e-002 | AB90: 2.8000000000000004e-003 | AC90: -3.3500000000000002e-002 | AD90: -3.5900000000000001e-002 | AE90: 83.27 | AF90: 88.55 | AG90: 0.75 | AH90: AA- | AI90: 6.7400000000000002e-002 | AJ90: =H90+100*O90 -> 123.55 | AK90: 124.2 | AL90: 45 | AM90: 35.7 | AN90: 82 | AO90: -6.0000000000000001e-003 | AP90: 13 | AQ90: 维尔转债
A91: 31 | B91: 110074 | C91: 精达转债 | D91: 600577 | E91: 精达股份 | F91: 电子 | G91: 电子产品 | H91: 110.69 | I91: 1.e-002 | J91: -5.4000000000000003e-003 | K91: 3.41 | L91: 8.8999999999999999e-003 | M91: 117.3 | N91: 3.75 | O91: 0.217 | P91: 90.93 | Q91: 3月7天 | R91: 5.75年 | S91: 3.75年 | T91: 7.87 | U91: 5.7 | V91: 6.9999999999999993e-003 | W91: 0.12 | X91: 0.109 | Y91: 66 | Z91: 1.85 | AA91: 1.03e-002 | AB91: 5.0000000000000001e-003 | AC91: -1.6399999999999998e-002 | AD91: -1.83e-002 | AE91: 87.07 | AF91: 90.84 | AG91: 0.52 | AH91: AA | AI91: 4.6399999999999997e-002 | AJ91: =H91+100*O91 -> 132.38999999999999 | AK91: 130.4 | AL91: 124 | AM91: 39.6 | AN91: 126 | AO91: 3.1e-002 | AP91: 8 | AQ91: 精达转债
A92: 55 | B92: 128120 | C92: 联诚转债 | D92: 2921. | E92: 联诚精密 | F92: 汽车 | G92: 零部件制 | H92: 111.95 | I92: -2.2000000000000001e-003 | J92: -1.2800000000000001e-002 | K92: 24.55 | L92: -1.9199999999999998e-002 | M92: 118.4 | N92: 24.37 | O92: 0.111 | P92: 100.74 | Q92: 2月6天 | R92: 5.65年 | S92: 3.65年 | T92: 2.6 | U92: 16 | V92: 5.4000000000000006e-002 | W92: 0.13 | X92: 0.13100000000000001 | Y92: 20 | Z92: 2.68 | AA92: 1.0200000000000001e-002 | AB92: 4.4000000000000003e-003 | AC92: -1.7899999999999999e-002 | AD92: -2.0099999999999996e-002 | AE92: 75.95 | AF92: 74.2 | AG92: 0.78 | AH92: A | AI92: 8.8399999999999992e-002 | AJ92: =H92+100*O92 -> 123.05 | AK92: 123.2 | AL92: 29 | AM92: 47.2 | AN92: 193 | AO92: 4.0000000000000001e-002 | AP92: 14 | AQ92: 联诚转债
A93: 177 | B93: 127014 | C93: 北方转债 | D93: 65. | E93: 北方国际 | F93: 建筑 | G93: 建筑工程 | H93: 109.71 | I93: 1.6000000000000001e-003 | J93: -3.9000000000000003e-003 | K93: 7.8 | L93: -5.1000000000000004e-003 | M93: 115.1 | N93: 8.75 | O93: 0.23100000000000001 | P93: 89.14 | Q93: 转股中 | R93: 4.93年 | S93: 2.93年 | T93: 5.78 | U93: 0.4 | V93: 1.e-003 | W93: 9.6000000000000002e-002 | X93: 8.5999999999999993e-002 | Y93: 60 | Z93: 1.13 | AA93: 1.e-002 | AB93: 4.4000000000000003e-003 | AC93: -1.8500000000000003e-002 | AD93: -2.07e-002 | AE93: 91.1 | AF93: 93.97 | AG93: 0.46 | AH93: AA+ | AI93: 4.2900000000000001e-002 | AJ93: =H93+100*O93 -> 132.81 | AK93: 130.3 | AL93: 122 | AM93: 36.3 | AN93: 93 | AO93: 2.7000000000000003e-002 | AP93: 17 | AQ93: 北方转债
A94: 85 | B94: 123053 | C94: 宝通转债 | D94: 300031 | E94: 宝通科技 | F94: 通信互联 | G94: 互联网 | H94: 114.927 | I94: -5.0000000000000001e-003 | J94: 7.000000000000001e-004 | K94: 20.82 | L94: -6.1999999999999998e-003 | M94: 121.3 | N94: 20.8 | O94: 0.14800000000000002 | P94: 100.1 | Q94: 21天 | R94: 5.54年 | S94: 3.54年 | T94: 5 | U94: 3 | V94: 5.0000000000000001e-003 | W94: 6.0999999999999999e-002 | X94: 6.0999999999999999e-002 | Y94: 83 | Z94: 2.87 | AA94: 1.e-002 | AB94: 3.4000000000000002e-003 | AC94: -2.63e-002 | AD94: -2.8399999999999998e-002 | AE94: 82.08 | AF94: 85.21 | AG94: 0.68 | AH94: AA- | AI94: 6.7400000000000002e-002 | AJ94: =H94+100*O94 -> 129.727 | AK94: 129.8 | AL94: 114 | AM94: 44.5 | AN94: 171 | AO94: -2.1000000000000001e-002 | AP94: 6 | AQ94: 宝通转债
A95: 57 | B95: 123059 | C95: 银信转债 | D95: 300231 | E95: 银信科技 | F95: 计算机及 | G95: 软件开发 | H95: 117.699 | I95: 3.3e-003 | J95: -7.9000000000000008e-003 | K95: 10.18 | L95: -6.8000000000000005e-003 | M95: 124.1 | N95: 9.91 | O95: 0.14599999999999999 | P95: 102.72 | Q95: 2月2天 | R95: 5.65年 | S95: 3.65年 | T95: 3.91 | U95: 7.7 | V95: 1.7000000000000001e-002 | W95: 8.6999999999999994e-002 | X95: 8.900000000000001e-002 | Y95: 45 | Z95: 3.42 | AA95: 9.5999999999999992e-003 | AB95: 2.3999999999999998e-003 | AC95: -3.2199999999999999e-002 | AD95: -3.4099999999999998e-002 | AE95: 81.31 | AF95: 86.5 | AG95: 0.68 | AH95: AA- | AI95: 6.7400000000000002e-002 | AJ95: =H95+100*O95 -> 132.29900000000001 | AK95: 132.7 | AL95: 145 | AM95: 46.2 | AN95: 186 | AO95: -6.7000000000000004e-002 | AP95: 11 | AQ95: 银信转债
A96: 47 | B96: 128122 | C96: 兴森转债 | D96: 2436. | E96: 兴森科技 | F96: 电子 | G96: 元器件制 | H96: 108.63 | I96: -5.3e-003 | J96: 3.2000000000000002e-003 | K96: 10.63 | L96: -7.4999999999999997e-003 | M96: 113.3 | N96: 14.18 | O96: 0.44900000000000001 | P96: 74.96 | Q96: 2月10天 | R96: 4.67年 | S96: 3.67年 | T96: 2.69 | U96: 4 | V96: 1.3999999999999999e-002 | W96: 1.7000000000000001e-002 | X96: 1.3000000000000001e-002 | Y96: 158 | Z96: 5.01 | AA96: 9.1999999999999998e-003 | AB96: 4.0000000000000001e-003 | AC96: -1.23e-002 | AD96: -1.41e-002 | AE96: 87.68 | AF96: 92.51 | AG96: 0.28 | AH96: AA | AI96: 4.4900000000000002e-002 | AJ96: =H96+100*O96 -> 153.53 | AK96: 142.3 | AL96: 220 | AM96: 49.8 | AN96: 207 | AO96: -2.3e-002 | AP96: 8 | AQ96: 兴森转债
A97: 1 | B97: 113606 | C97: N荣泰转 | D97: 603579 | E97: 荣泰健康 | F97: 机械装备 | G97: 专用设备 | H97: 115.03 | I97: 0.14999999999999999 | J97: 0. | K97: 33.65 | L97: -1.78e-002 | M97: 121.2 | N97: 33.32 | O97: 0.13900000000000001 | P97: 100.99 | Q97: 5月16天 | R97: 5.94年 | S97: 3.94年 | T97: 6 | U97: 528 | V97: 0.75900000000000001 | W97: 0.127 | X97: 0.129 | Y97: 47 | Z97: 2.98 | AA97: 9.0000000000000011e-003 | AB97: 2.8000000000000004e-003 | AC97: -2.4199999999999999e-002 | AD97: -2.6000000000000002e-002 | AE97: 79.87 | AF97: 82.92 | AG97: 0.71 | AH97: AA- | AI97: 6.7400000000000002e-002 | AJ97: =H97+100*O97 -> 128.93000000000001 | AK97: 129.1 | AL97: 105 | AM97: 46.2 | AN97: 185 | AO97: 1.4999999999999999e-002 | AP97: 1 | AQ97: N荣泰转
A98: 270 | B98: 113508 | C98: 新凤转债! | D98: 603225 | E98: 新凤鸣 | F98: 服装纺织 | G98: 纺织行业 | H98: 108.99 | I98: 5.9999999999999995e-004 | J98: 9.1999999999999998e-003 | K98: 13.1 | L98: 3.0699999999999998e-002 | M98: 112.3 | N98: 15.78 | O98: 0.313 | P98: 83.02 | Q98: 转股中 | R98: 3.43年 | S98: 1.43年 | T98: 21.5 | U98: 19 | V98: 8.0000000000000002e-003 | W98: 0.11800000000000001 | X98: 9.8000000000000004e-002 | Y98: 183 | Z98: 1.62 | AA98: 8.8999999999999999e-003 | AB98: 2.3e-003 | AC98: -3.6299999999999999e-002 | AD98: -3.95e-002 | AE98: 95.9 | AF98: 96.89 | AG98: 0.32 | AH98: AA | AI98: 4.4900000000000002e-002 | AJ98: =H98+100*O98 -> 140.28999999999999 | AK98: 135 | AL98: 167 | AM98: 38.1 | AN98: 114 | AO98: 0.19899999999999998 | AP98: 26 | AQ98: 新凤转债!
A99: 61 | B99: 110071 | C99: 湖盐转债 | D99: 600929 | E99: 雪天盐业 | F99: 食品饮料 | G99: 食品饮料 | H99: 109.74 | I99: 0. | J99: 1.8e-003 | K99: 6.21 | L99: 3.2000000000000002e-003 | M99: 115.2 | N99: 6.6 | O99: 0.16600000000000001 | P99: 94.09 | Q99: 59天 | R99: 5.64年 | S99: 3.64年 | T99: 7.2 | U99: 0.7 | V99: 1.e-003 | W99: 0.126 | X99: 0.11900000000000001 | Y99: 57 | Z99: 2.24 | AA99: 8.8000000000000005e-003 | AB99: 3.9000000000000003e-003 | AC99: -1.49e-002 | AD99: -1.67e-002 | AE99: 87.41 | AF99: 89.64 | AG99: 0.57 | AH99: AA | AI99: 4.6399999999999997e-002 | AJ99: =H99+100*O99 -> 126.34 | AK99: 125.4 | AL99: 57 | AM99: 35.7 | AN99: 84 | AO99: -1.e-002 | AP99: 12 | AQ99: 湖盐转债
A100: 23 | B100: 123064 | C100: 万孚转债 | D100: 300482 | E100: 万孚生物 | F100: 医药 | G100: 医疗器械 | H100: 109.89 | I100: 5.1999999999999998e-003 | J100: -6.5000000000000006e-003 | K100: 67.46 | L100: -4.3e-003 | M100: 115.1 | N100: 93.55 | O100: 0.52400000000000002 | P100: 72.11 | Q100: 3月18天 | R100: 5.78年 | S100: 3.78年 | T100: 6 | U100: 14 | V100: 2.1000000000000001e-002 | W100: 2.6000000000000002e-002 | X100: 1.9e-002 | Y100: 231 | Z100: 8.54 | AA100: 8.199999999999999e-003 | AB100: 3.4999999999999996e-003 | AC100: -1.49e-002 | AD100: -1.67e-002 | AE100: 86.74 | AF100: 88.96 | AG100: 0.31 | AH100: AA | AI100: 4.6399999999999997e-002 | AJ100: =H100+100*O100 -> 162.29000000000002 | AK100: 147.7 | AL100: 251 | AM100: 58.7 | AN100: 244 | AO100: -9.0999999999999998e-002 | AP100: 7 | AQ100: 万孚转债
A101: 184 | B101: 128074 | C101: 游族转债!! | D101: 2174. | E101: 游族网络 | F101: 通信互联 | G101: 互联网 | H101: 115.605 | I101: -7.7000000000000002e-003 | J101: 7.7000000000000002e-003 | K101: 16.74 | L101: -4.1999999999999997e-003 | M101: 119.9 | N101: 16.97 | O101: 0.17199999999999999 | P101: 98.64 | Q101: 转股中 | R101: 4.84年 | S101: 2.84年 | T101: 6.83 | U101: 6.4 | V101: 8.0000000000000002e-003 | W101: 4.4999999999999998e-002 | X101: 4.4000000000000004e-002 | Y101: 153 | Z101: 2.71 | AA101: 7.7000000000000002e-003 | AB101: 5.9999999999999995e-004 | AC101: -3.6699999999999997e-002 | AD101: -3.8800000000000001e-002 | AE101: 90.71 | AF101: 97.31 | AG101: 0 | AH101: AA | AI101: 4.4900000000000002e-002 | AJ101: =H101+100*O101 -> 132.80500000000001 | AK101: 132.6 | AL101: 143 | AM101: 35.3 | AN101: 76 | AO101: 2.8999999999999998e-002 | AP101: 21 | AQ101: 游族转债!!
A102: 239 | B102: 113525 | C102: 台华转债! | D102: 603055 | E102: 台华新材 | F102: 服装纺织 | G102: 纺织行业 | H102: 111.5 | I102: -5.4000000000000003e-003 | J102: 4.1999999999999997e-003 | K102: 7.48 | L102: -2.7000000000000001e-003 | M102: 114.9 | N102: 8.03 | O102: 0.19699999999999998 | P102: 93.15 | Q102: 转股中 | R102: 4年27天 | S102: 2年27天 | T102: 4.69 | U102: 1.3 | V102: 2.e-003 | W102: 8.1000000000000003e-002 | X102: 7.4999999999999997e-002 | Y102: 58 | Z102: 2.19 | AA102: 7.6e-003 | AB102: 8.9999999999999998e-004 | AC102: -3.3500000000000002e-002 | AD102: -3.6299999999999999e-002 | AE102: 93.82 | AF102: 96.46 | AG102: 0.48 | AH102: AA | AI102: 4.4900000000000002e-002 | AJ102: =H102+100*O102 -> 131.19999999999999 | AK102: 129.8 | AL102: 116 | AM102: 33.4 | AN102: 56 | AO102: -3.9e-002 | AP102: 22 | AQ102: 台华转债!
A103: 173 | B103: 123033 | C103: 金力转债! | D103: 300748 | E103: 金力永磁 | F103: 电子 | G103: 元器件制 | H103: 117.26 | I103: 1.6000000000000001e-003 | J103: 2.3999999999999998e-003 | K103: 39.83 | L103: 6.3e-003 | M103: 121.5 | N103: 40.97 | O103: 0.20600000000000002 | P103: 97.22 | Q103: 转股中 | R103: 4.95年 | S103: 2.95年 | T103: 4.35 | U103: 33 | V103: 6.6000000000000003e-002 | W103: 2.6000000000000002e-002 | X103: 2.6000000000000002e-002 | Y103: 166 | Z103: 12.33 | AA103: 7.4000000000000003e-003 | AB103: -1.e-004 | AC103: -3.5299999999999998e-002 | AD103: -3.8199999999999998e-002 | AE103: 86.31 | AF103: 89.37 | AG103: 0.63 | AH103: AA- | AI103: 6.59e-002 | AJ103: =H103+100*O103 -> 137.86000000000001 | AK103: 137.3 | AL103: 185 | AM103: 47.9 | AN103: 198 | AO103: -5.0000000000000001e-003 | AP103: 28 | AQ103: 金力转债!
A104: 298 | B104: 128018 | C104: 时达转债! | D104: 2527. | E104: 新时达 | F104: 机械装备 | G104: 机器人及 | H104: 107.01 | I104: 1.5e-003 | J104: 4.0000000000000002e-004 | K104: 6.59 | L104: 4.5999999999999999e-003 | M104: 109.3 | N104: 7.42 | O104: 0.20499999999999999 | P104: 88.81 | Q104: 转股中 | R104: 2.96年 | S104: 0.96年 | T104: 8.8 | U104: 6.9 | V104: 6.9999999999999993e-003 | W104: 0.215 | X104: 0.191 | Y104: 41 | Z104: 1.6 | AA104: 7.3000000000000001e-003 | AB104: 1.4000000000000002e-003 | AC104: -4.3400000000000001e-002 | AD104: -4.6399999999999997e-002 | AE104: 96.96 | AF104: 96.35 | AG104: 0.4 | AH104: AA | AI104: 4.4199999999999996e-002 | AJ104: =H104+100*O104 -> 127.51000000000001 | AK104: 125.2 | AL104: 56 | AM104: 28.2 | AN104: 18 | AO104: 7.8e-002 | AP104: 41 | AQ104: 时达转债!
A105: 290 | B105: 128025 | C105: 特一转债! | D105: 2728. | E105: 特一药业 | F105: 医药 | G105: 化学制药 | H105: 107.49 | I105: 3.4999999999999996e-003 | J105: 3.0000000000000001e-003 | K105: 13.47 | L105: 1.2800000000000001e-002 | M105: 109.8 | N105: 14.7 | O105: 0.17300000000000001 | P105: 91.63 | Q105: 转股中 | R105: 3年16天 | S105: 1年16天 | T105: 2.99 | U105: 4.3 | V105: 1.3999999999999999e-002 | W105: 0.109 | X105: 0.10000000000000001 | Y105: 27 | Z105: 2.71 | AA105: 7.1999999999999998e-003 | AB105: 1.1000000000000001e-003 | AC105: -3.85e-002 | AD105: -4.24e-002 | AE105: 95.01 | AF105: 90.82 | AG105: 0.5 | AH105: AA- | AI105: 6.59e-002 | AJ105: =H105+100*O105 -> 124.78999999999999 | AK105: 123.3 | AL105: 33 | AM105: 28.3 | AN105: 20 | AO105: 2.1000000000000001e-002 | AP105: 47 | AQ105: 特一转债!
A106: 131 | B106: 113567 | C106: 君禾转债 | D106: 603617 | E106: 君禾股份 | F106: 机械装备 | G106: 通用设备 | H106: 114.96 | I106: -1.1000000000000001e-003 | J106: 6.8999999999999999e-003 | K106: 12.26 | L106: 7.4000000000000003e-003 | M106: 119.3 | N106: 11.46 | O106: 7.4999999999999997e-002 | P106: 106.98 | Q106: 转股中 | R106: 5.29年 | S106: 3.29年 | T106: 2.1 | U106: 3.6 | V106: 1.4999999999999999e-002 | W106: 8.5999999999999993e-002 | X106: 9.1999999999999998e-002 | Y106: 24 | Z106: 3.8 | AA106: 7.1999999999999998e-003 | AB106: 8.0000000000000004e-004 | AC106: -2.7699999999999999e-002 | AD106: -3.0099999999999998e-002 | AE106: 80.8 | AF106: 80.88 | AG106: 0.77 | AH106: A+ | AI106: 7.8399999999999997e-002 | AJ106: =H106+100*O106 -> 122.45999999999999 | AK106: 122.9 | AL106: 26 | AM106: 42.1 | AN106: 148 | AO106: -1.6e-002 | AP106: 33 | AQ106: 君禾转债
A107: 149 | B107: 123039 | C107: 开润转债! | D107: 300577 | E107: 开润股份 | F107: 服装纺织 | G107: 纺织行业 | H107: 117.283 | I107: -2.2000000000000001e-003 | J107: -8.0000000000000004e-004 | K107: 33.09 | L107: -4.1999999999999997e-003 | M107: 121.5 | N107: 33.22 | O107: 0.17699999999999999 | P107: 99.61 | Q107: 转股中 | R107: 5年36天 | S107: 3年36天 | T107: 2.22 | U107: 3.6 | V107: 1.3999999999999999e-002 | W107: 2.7999999999999997e-002 | X107: 2.7999999999999997e-002 | Y107: 79 | Z107: 8.62 | AA107: 7.0999999999999995e-003 | AB107: -1.e-004 | AC107: -3.5000000000000003e-002 | AD107: -3.7499999999999999e-002 | AE107: 82.05 | AF107: 83.52 | AG107: 0.72 | AH107: A+ | AI107: 7.8399999999999997e-002 | AJ107: =H107+100*O107 -> 134.983 | AK107: 135 | AL107: 166 | AM107: 51.4 | AN107: 214 | AO107: 9.0000000000000011e-003 | AP107: 25 | AQ107: 开润转债!
A108: 219 | B108: 127012 | C108: 招路转债! | D108: 1965. | E108: 招商公路 | F108: 机场高速 | G108: 高速 | H108: 105.2 | I108: -4.4000000000000003e-003 | J108: 2.e-003 | K108: 7.2 | L108: -6.8999999999999999e-003 | M108: 108.2 | N108: 8.81 | O108: 0.28699999999999998 | P108: 81.73 | Q108: 转股中 | R108: 4.33年 | S108: 2.33年 | T108: 50 | U108: 19 | V108: 4.0000000000000001e-003 | W108: 0.11199999999999999 | X108: 9.1999999999999998e-002 | Y108: 445 | Z108: 0.92 | AA108: 6.6e-003 | AB108: 3.0000000000000001e-003 | AC108: -1.2500000000000001e-002 | AD108: -1.3999999999999999e-002 | AE108: 92.5 | AF108: 91.52 | AG108: 0.35 | AH108: AAA | AI108: 3.9900000000000005e-002 | AJ108: =H108+100*O108 -> 133.90000000000001 | AK108: 128.7 | AL108: 100 | AM108: 36.2 | AN108: 91 | AO108: 2.5000000000000001e-002 | AP108: 37 | AQ108: 招路转债!
A109: 204 | B109: 128066 | C109: 亚泰转债! | D109: 2811. | E109: 郑中设计 | F109: 建筑 | G109: 装饰工程 | H109: 114.32 | I109: -3.0000000000000001e-003 | J109: 5.7999999999999996e-003 | K109: 10.59 | L109: 3.8e-003 | M109: 117.5 | N109: 9.67 | O109: 4.4000000000000004e-002 | P109: 109.51 | Q109: 转股中 | R109: 4.41年 | S109: 2.41年 | T109: 4.8 | U109: 4.5 | V109: 8.0000000000000002e-003 | W109: 0.16800000000000001 | X109: 0.184 | Y109: 29 | Z109: 1.94 | AA109: 6.4000000000000003e-003 | AB109: -5.9999999999999995e-004 | AC109: -3.7200000000000004e-002 | AD109: -3.9900000000000005e-002 | AE109: 88.31 | AF109: 89.31 | AG109: 0.75 | AH109: AA- | AI109: 6.59e-002 | AJ109: =H109+100*O109 -> 118.72 | AK109: 119.1 | AL109: 10 | AM109: 29.8 | AN109: 27 | AO109: 1.e-002 | AP109: 59 | AQ109: 亚泰转债!
A110: 25 | B110: 128129 | C110: 青农转债 | D110: 2958. | E110: 青农商行 | F110: 金融 | G110: 银行行业 | H110: 108.2 | I110: -3.4000000000000002e-003 | J110: -2.9999999999999997e-004 | K110: 4.81 | L110: -8.199999999999999e-003 | M110: 112.2 | N110: 5.74 | O110: 0.29100000000000004 | P110: 83.8 | Q110: 3月11天 | R110: 5.76年 | S110: 无权 | T110: 50 | U110: 23 | V110: 4.0000000000000001e-003 | W110: 0.187 | X110: 0.157 | Y110: 267 | Z110: 1.04 | AA110: 6.4000000000000003e-003 | AB110: 2.5000000000000001e-003 | AC110: 无权 | AD110: 无权 | AE110: 无权 | AF110: 89.11 | AG110: 0.45 | AH110: AAA | AI110: 4.1399999999999999e-002 | AJ110: =H110+100*O110 -> 137.30000000000001 | AK110: 132.6 | AL110: 144 | AM110: 43.5 | AN110: 158 | AO110: -8.0000000000000002e-003 | AP110: 11 | AQ110: 青农转债
A111: 169 | B111: 113549 | C111: 白电转债 | D111: 603861 | E111: 白云电器 | F111: 能源电力 | G111: 电力设备 | H111: 111.31 | I111: 1.1999999999999999e-003 | J111: -3.2000000000000002e-003 | K111: 8.76 | L111: -3.4000000000000002e-003 | M111: 114.8 | N111: 8.88 | O111: 0.128 | P111: 98.65 | Q111: 转股中 | R111: 4.99年 | S111: 2.99年 | T111: 8.8 | U111: 1.6 | V111: 2.e-003 | W111: 0.22699999999999998 | X111: 0.22399999999999998 | Y111: 39 | Z111: 1.65 | AA111: 6.3e-003 | AB111: 1.e-003 | AC111: -2.3599999999999999e-002 | AD111: -2.5499999999999998e-002 | AE111: 90.04 | AF111: 92.58 | AG111: 0.59 | AH111: AA | AI111: 4.4900000000000002e-002 | AJ111: =H111+100*O111 -> 124.11 | AK111: 124 | AL111: 42 | AM111: 31.4 | AN111: 35 | AO111: 4.4000000000000004e-002 | AP111: 31 | AQ111: 白电转债
A112: 99 | B112: 113578 | C112: 全筑转债 | D112: 603030 | E112: 全筑股份 | F112: 建筑 | G112: 装饰工程 | H112: 114.8 | I112: 2.3e-003 | J112: -2.3e-003 | K112: 5.59 | L112: 0. | M112: 118.3 | N112: 5.43 | O112: 0.115 | P112: 102.95 | Q112: 转股中 | R112: 5.41年 | S112: 3.41年 | T112: 3.84 | U112: 4.3 | V112: 1.e-002 | W112: 0.128 | X112: 0.13100000000000001 | Y112: 30 | Z112: 1.35 | AA112: 5.6999999999999993e-003 | AB112: -2.9999999999999997e-004 | AC112: -2.7999999999999997e-002 | AD112: -2.9999999999999999e-002 | AE112: 88.39 | AF112: 93 | AG112: 0.63 | AH112: AA | AI112: 4.6399999999999997e-002 | AJ112: =H112+100*O112 -> 126.3 | AK112: 126.7 | AL112: 72 | AM112: 33.7 | AN112: 59 | AO112: 2.3e-002 | AP112: 11 | AQ112: 全筑转债
A113: 12 | B113: 123068 | C113: 弘信转债 | D113: 300657 | E113: 弘信电子 | F113: 电子 | G113: 元器件制 | H113: 117.303 | I113: -5.1000000000000004e-003 | J113: -2.9999999999999997e-004 | K113: 19.76 | L113: -6.9999999999999993e-003 | M113: 121.2 | N113: 18.45 | O113: 9.5000000000000001e-002 | P113: 107.1 | Q113: 5月2天 | R113: 5.90年 | S113: 3.90年 | T113: 5.7 | U113: 21 | V113: 3.1e-002 | W113: 8.4000000000000005e-002 | X113: 8.9999999999999997e-002 | Y113: 68 | Z113: 4.62 | AA113: 5.6999999999999993e-003 | AB113: -5.0000000000000001e-004 | AC113: -2.92e-002 | AD113: -3.1e-002 | AE113: 80.07 | AF113: 83.13 | AG113: 0.76 | AH113: AA- | AI113: 6.7400000000000002e-002 | AJ113: =H113+100*O113 -> 126.803 | AK113: 127.5 | AL113: 84 | AM113: 44.4 | AN113: 166 | AO113: 0.127 | AP113: 3 | AQ113: 弘信转债
A114: 244 | B114: 128049 | C114: 华源转债! | D114: 2787. | E114: 华源控股 | F114: 造纸包装 | G114: 包装材料 | H114: 112.789 | I114: 1.7000000000000001e-003 | J114: 5.1999999999999998e-003 | K114: 7.25 | L114: 1.1200000000000002e-002 | M114: 115.2 | N114: 7.42 | O114: 0.154 | P114: 97.71 | Q114: 转股中 | R114: 4年7天 | S114: 2年7天 | T114: 3.63 | U114: 0.8 | V114: 2.e-003 | W114: 0.158 | X114: 0.155 | Y114: 23 | Z114: 1.53 | AA114: 5.4000000000000003e-003 | AB114: -1.4000000000000002e-003 | AC114: -3.8900000000000004e-002 | AD114: -4.1799999999999997e-002 | AE114: 90.22 | AF114: 89.7 | AG114: 0.62 | AH114: AA- | AI114: 6.59e-002 | AJ114: =H114+100*O114 -> 128.18899999999999 | AK114: 127.9 | AL114: 88 | AM114: 37.6 | AN114: 110 | AO114: -3.0000000000000001e-003 | AP114: 52 | AQ114: 华源转债!
A115: 136 | B115: 113565 | C115: 宏辉转债 | D115: 603336 | E115: 宏辉果蔬 | F115: 农业 | G115: 农产品加 | H115: 114.96 | I115: 8.3999999999999995e-003 | J115: 1.5900000000000001e-002 | K115: 10.67 | L115: 3.1899999999999998e-002 | M115: 118.2 | N115: 10 | O115: 7.6999999999999999e-002 | P115: 106.7 | Q115: 转股中 | R115: 5.27年 | S115: 3.27年 | T115: 3.09 | U115: 28 | V115: 7.8e-002 | W115: 8.8000000000000009e-002 | X115: 9.4e-002 | Y115: 35 | Z115: 3.79 | AA115: 5.4000000000000003e-003 | AB115: -7.000000000000001e-004 | AC115: -2.8799999999999999e-002 | AD115: -3.1e-002 | AE115: 83.46 | AF115: 84.51 | AG115: 0.76 | AH115: AA- | AI115: 6.7400000000000002e-002 | AJ115: =H115+100*O115 -> 122.66 | AK115: 123.2 | AL115: 31 | AM115: 38.7 | AN115: 118 | AO115: 2.9999999999999999e-002 | AP115: 20 | AQ115: 宏辉转债
A116: 197 | B116: 123028 | C116: 清水转债 | D116: 300437 | E116: 清水源 | F116: 城市公用 | G116: 三废处理 | H116: 118.985 | I116: -1.34e-002 | J116: -1.41e-002 | K116: 13.52 | L116: -3.7000000000000005e-002 | M116: 121.8 | N116: 11.84 | O116: 4.2000000000000003e-002 | P116: 114.19 | Q116: 转股中 | R116: 4.58年 | S116: 2.58年 | T116: 4.56 | U116: 17 | V116: 3.1e-002 | W116: 0.154 | X116: 0.17600000000000002 | Y116: 30 | Z116: 1.92 | AA116: 5.3e-003 | AB116: -2.8999999999999998e-003 | AC116: -4.5999999999999999e-002 | AD116: -4.9100000000000005e-002 | AE116: 88.11 | AF116: 91.66 | AG116: 0.74 | AH116: AA- | AI116: 6.59e-002 | AJ116: =H116+100*O116 -> 123.185 | AK116: 123.8 | AL116: 40 | AM116: 32.1 | AN116: 45 | AO116: 1.3999999999999999e-002 | AP116: 51 | AQ116: 清水转债
A117: 29 | B117: 128128 | C117: 齐翔转2 | D117: 2408. | E117: 齐翔腾达 | F117: 化工 | G117: 化工 | H117: 112 | I117: 3.8e-003 | J117: 5.8999999999999999e-003 | K117: 9.24 | L117: 1.32e-002 | M117: 115.3 | N117: 8.22 | O117: -4.0000000000000001e-003 | P117: 112.41 | Q117: 3月8天 | R117: 5.75年 | S117: 3.75年 | T117: 29.9 | U117: 120 | V117: 3.6000000000000004e-002 | W117: 0.182 | X117: 0.20499999999999999 | Y117: 164 | Z117: 2 | AA117: 5.1999999999999998e-003 | AB117: 4.0000000000000002e-004 | AC117: -1.9599999999999999e-002 | AD117: -2.1400000000000002e-002 | AE117: 86.98 | AF117: 89.27 | AG117: 0.74 | AH117: AA | AI117: 4.6399999999999997e-002 | AJ117: =H117+100*O117 -> 111.59999999999999 | AK117: 111.6 | AL117: 2 | AM117: 22.3 | AN117: 6 | AO117: 9.5000000000000001e-002 | AP117: 29 | AQ117: 齐翔转2
A118: 220 | B118: 123024 | C118: 岱勒转债! | D118: 300700 | E118: 岱勒新材 | F118: 机械装备 | G118: 专用设备 | H118: 111.12 | I118: -1.49e-002 | J118: 1.e-004 | K118: 22.34 | L118: -2.9100000000000001e-002 | M118: 113 | N118: 24.9 | O118: 0.23899999999999999 | P118: 89.72 | Q118: 转股中 | R118: 3.33年 | S118: 1.33年 | T118: 2.1 | U118: 27 | V118: 0.115 | W118: 0.114 | X118: 0.10199999999999999 | Y118: 18 | Z118: 3.73 | AA118: 5.1000000000000004e-003 | AB118: -2.e-003 | AC118: -5.74e-002 | AD118: -5.9500000000000004e-002 | AE118: 91.11 | AF118: 88.58 | AG118: 0.51 | AH118: A+ | AI118: 7.690000000000001e-002 | AJ118: =H118+100*O118 -> 135.02000000000001 | AK118: 132.5 | AL118: 140 | AM118: 41.4 | AN118: 140 | AO118: -9.0999999999999998e-002 | AP118: 35 | AQ118: 岱勒转债!
A119: 21 | B119: 128131 | C119: 崇达转2 | D119: 2815. | E119: 崇达技术 | F119: 电子 | G119: 元器件制 | H119: 112.1 | I119: -3.4999999999999996e-003 | J119: 3.7000000000000002e-003 | K119: 16.38 | L119: 5.9999999999999995e-004 | M119: 115.2 | N119: 19.54 | O119: 0.33700000000000002 | P119: 83.83 | Q119: 3月21天 | R119: 5.80年 | S119: 3.80年 | T119: 14 | U119: 3.3 | V119: 2.e-003 | W119: 9.6999999999999989e-002 | X119: 8.1000000000000003e-002 | Y119: 145 | Z119: 3.61 | AA119: 4.7999999999999996e-003 | AB119: 1.e-004 | AC119: -1.9599999999999999e-002 | AD119: -2.1400000000000002e-002 | AE119: 86.77 | AF119: 88.99 | AG119: 0.46 | AH119: AA | AI119: 4.6399999999999997e-002 | AJ119: =H119+100*O119 -> 145.80000000000001 | AK119: 140.4 | AL119: 209 | AM119: 51.4 | AN119: 213 | AO119: -1.4999999999999999e-002 | AP119: 4 | AQ119: 崇达转2
A120: 222 | B120: 110056 | C120: 亨通转债! | D120: 600487 | E120: 亨通光电 | F120: 通信互联 | G120: 通信设备 | H120: 112.6 | I120: -1.7000000000000001e-003 | J120: 6.7000000000000002e-003 | K120: 15.13 | L120: 9.300000000000001e-003 | M120: 114.8 | N120: 15.58 | O120: 0.159 | P120: 97.11 | Q120: 转股中 | R120: 4.33年 | S120: 2.33年 | T120: 17.1 | U120: 2.7 | V120: 1.e-003 | W120: 5.7999999999999996e-002 | X120: 5.5999999999999994e-002 | Y120: 295 | Z120: 1.96 | AA120: 4.5999999999999999e-003 | AB120: -1.6000000000000001e-003 | AC120: -3.4300000000000004e-002 | AD120: -3.6699999999999997e-002 | AE120: 93.13 | AF120: 96.08 | AG120: 0.54 | AH120: AA+ | AI120: 4.2900000000000001e-002 | AJ120: =H120+100*O120 -> 128.5 | AK120: 128.1 | AL120: 93 | AM120: 32 | AN120: 42 | AO120: 8.0000000000000002e-003 | AP120: 29 | AQ120: 亨通转债!
A121: 245 | B121: 110047 | C121: 山鹰转债 | D121: 600567 | E121: 山鹰国际 | F121: 造纸包装 | G121: 包装用纸 | H121: 116.12 | I121: 6.4000000000000003e-003 | J121: 1.e-004 | K121: 3.4 | L121: 1.1899999999999999e-002 | M121: 118.1 | N121: 3.34 | O121: 0.14099999999999999 | P121: 101.8 | Q121: 转股中 | R121: 4年1.1天 | S121: 2年1.1天 | T121: 23 | U121: 9.9 | V121: 4.0000000000000001e-003 | W121: 0.14699999999999999 | X121: 0.14999999999999999 | Y121: 156 | Z121: 1.06 | AA121: 4.3e-003 | AB121: -3.5999999999999999e-003 | AC121: -5.2499999999999998e-002 | AD121: -5.5300000000000002e-002 | AE121: 94.53 | AF121: 100.2 | AG121: 0.54 | AH121: AA+ | AI121: 4.2900000000000001e-002 | AJ121: =H121+100*O121 -> 130.22 | AK121: 130.4 | AL121: 123 | AM121: 30.2 | AN121: 30 | AO121: 6.4000000000000001e-002 | AP121: 34 | AQ121: 山鹰转债
A122: 45 | B122: 128123 | C122: 国光转债 | D122: 2749. | E122: 国光股份 | F122: 化工 | G122: 农化 | H122: 113.44 | I122: -2.3e-003 | J122: -1.2999999999999999e-003 | K122: 12.27 | L122: -5.6999999999999993e-003 | M122: 116.2 | N122: 13.7 | O122: 0.26700000000000002 | P122: 89.56 | Q122: 2月13天 | R122: 5.68年 | S122: 3.68年 | T122: 3.2 | U122: 0.6 | V122: 2.e-003 | W122: 6.0999999999999999e-002 | X122: 5.4000000000000006e-002 | Y122: 53 | Z122: 4.3 | AA122: 4.3e-003 | AB122: -8.0000000000000004e-004 | AC122: -2.23e-002 | AD122: -2.4199999999999999e-002 | AE122: 81.23 | AF122: 80.89 | AG122: 0.63 | AH122: AA- | AI122: 6.7400000000000002e-002 | AJ122: =H122+100*O122 -> 140.13999999999999 | AK122: 137.3 | AL122: 186 | AM122: 56.1 | AN122: 235 | AO122: -3.6000000000000004e-002 | AP122: 7 | AQ122: 国光转债
A123: 264 | B123: 123010 | C123: 博世转债! | D123: 300422 | E123: 博世科 | F123: 城市公用 | G123: 三废处理 | H123: 110.63 | I123: 1.1000000000000001e-003 | J123: 9.7000000000000003e-003 | K123: 12.13 | L123: 1.6799999999999999e-002 | M123: 112.3 | N123: 12.2 | O123: 0.113 | P123: 99.43 | Q123: 转股中 | R123: 3.62年 | S123: 1.62年 | T123: 4.3 | U123: 2.9 | V123: 6.0000000000000001e-003 | W123: 8.6999999999999994e-002 | X123: 8.6999999999999994e-002 | Y123: 49 | Z123: 2.08 | AA123: 4.1999999999999997e-003 | AB123: -2.e-003 | AC123: -4.0500000000000001e-002 | AD123: -4.3400000000000001e-002 | AE123: 91.79 | AF123: 89.53 | AG123: 0.64 | AH123: AA- | AI123: 6.59e-002 | AJ123: =H123+100*O123 -> 121.92999999999999 | AK123: 121.8 | AL123: 20 | AM123: 30 | AN123: 28 | AO123: 5.9000000000000004e-002 | AP123: 27 | AQ123: 博世转债!
A124: 39 | B124: 128125 | C124: 华阳转债 | D124: 2949. | E124: 华阳国际 | F124: 建筑 | G124: 建筑工程 | H124: 116 | I124: -6.0000000000000001e-003 | J124: -8.0000000000000004e-004 | K124: 23.27 | L124: -1.1000000000000001e-002 | M124: 118.5 | N124: 25.79 | O124: 0.28600000000000003 | P124: 90.23 | Q124: 2月17天 | R124: 5.69年 | S124: 3.69年 | T124: 4.5 | U124: 4.7 | V124: 9.0000000000000011e-003 | W124: 9.9000000000000005e-002 | X124: 8.900000000000001e-002 | Y124: 46 | Z124: 3.74 | AA124: 3.8e-003 | AB124: -1.9e-003 | AC124: -2.86e-002 | AD124: -3.04e-002 | AE124: 80.94 | AF124: 82.36 | AG124: 0.61 | AH124: AA- | AI124: 6.7400000000000002e-002 | AJ124: =H124+100*O124 -> 144.59999999999999 | AK124: 141.8 | AL124: 215 | AM124: 59.4 | AN124: 249 | AO124: -7.0000000000000007e-002 | AP124: 3 | AQ124: 华阳转债
A125: 107 | B125: 113576 | C125: 起步转债!! | D125: 603557 | E125: 起步股份 | F125: 服装纺织 | G125: 鞋服行业 | H125: 119.48 | I125: -1.2199999999999999e-002 | J125: -6.1200000000000004e-002 | K125: 11.26 | L125: -9.9900000000000003e-002 | M125: 121.8 | N125: 10.55 | O125: 0.11900000000000001 | P125: 106.73 | Q125: 转股中 | R125: 5.39年 | S125: 3.39年 | T125: 2.67 | U125: 126 | V125: 0.39399999999999996 | W125: 4.8000000000000001e-002 | X125: 5.2000000000000005e-002 | Y125: 55 | Z125: 3.32 | AA125: 3.7000000000000002e-003 | AB125: -3.3e-003 | AC125: -3.6900000000000002e-002 | AD125: -3.9300000000000002e-002 | AE125: 83.32 | AF125: 86.48 | AG125: 0.73 | AH125: AA- | AI125: 6.7400000000000002e-002 | AJ125: =H125+100*O125 -> 131.38 | AK125: 132.2 | AL125: 137 | AM125: 45.7 | AN125: 183 | AO125: -0.23499999999999999 | AP125: 28 | AQ125: 起步转债!!
A126: 42 | B126: 128124 | C126: 科华转债! | D126: 2022. | E126: 科华生物 | F126: 医药 | G126: 生物制药 | H126: 108.15 | I126: -2.3999999999999998e-003 | J126: 4.8999999999999998e-003 | K126: 18.62 | L126: 4.8999999999999998e-003 | M126: 110.3 | N126: 21.5 | O126: 0.249 | P126: 86.6 | Q126: 2月15天 | R126: 5.69年 | S126: 3.69年 | T126: 7.38 | U126: 4.9 | V126: 6.0000000000000001e-003 | W126: 7.6999999999999999e-002 | X126: 6.7000000000000004e-002 | Y126: 96 | Z126: 3.33 | AA126: 3.4999999999999996e-003 | AB126: 1.e-004 | AC126: -1.26e-002 | AD126: -1.41e-002 | AE126: 86.65 | AF126: 85.59 | AG126: 0.52 | AH126: AA | AI126: 4.6399999999999997e-002 | AJ126: =H126+100*O126 -> 133.05000000000001 | AK126: 129.7 | AL126: 113 | AM126: 43 | AN126: 156 | AO126: -3.2000000000000001e-002 | AP126: 11 | AQ126: 科华转债!
A127: 212 | B127: 128064 | C127: 司尔转债! | D127: 2538. | E127: 司尔特 | F127: 化工 | G127: 农化 | H127: 113.423 | I127: -8.0000000000000004e-004 | J127: 1.7000000000000001e-003 | K127: 6.14 | L127: 1.6000000000000001e-003 | M127: 114.9 | N127: 6.07 | O127: 0.121 | P127: 101.15 | Q127: 转股中 | R127: 4.38年 | S127: 2.38年 | T127: 8 | U127: 7.2 | V127: 8.0000000000000002e-003 | W127: 0.18100000000000002 | X127: 0.184 | Y127: 44 | Z127: 1.15 | AA127: 3.0000000000000001e-003 | AB127: -3.0999999999999999e-003 | AC127: -3.6000000000000004e-002 | AD127: -3.85e-002 | AE127: 92.56 | AF127: 95.17 | AG127: 0.6 | AH127: AA | AI127: 4.4900000000000002e-002 | AJ127: =H127+100*O127 -> 125.523 | AK127: 125.7 | AL127: 62 | AM127: 30.5 | AN127: 31 | AO127: 5.2999999999999999e-002 | AP127: 56 | AQ127: 司尔转债!
A128: 280 | B128: 123007 | C128: 道氏转债!! | D128: 300409 | E128: 道氏技术 | F128: 建筑 | G128: 建筑行业 | H128: 110.33 | I128: 1.4000000000000002e-003 | J128: 8.0000000000000004e-004 | K128: 13.74 | L128: 4.4000000000000003e-003 | M128: 111.3 | N128: 14.95 | O128: 0.20000000000000001 | P128: 91.91 | Q128: 转股中 | R128: 3年38天 | S128: 1年38天 | T128: 3.04 | U128: 15 | V128: 4.4000000000000004e-002 | W128: 4.8000000000000001e-002 | X128: 4.4000000000000004e-002 | Y128: 63 | Z128: 2.61 | AA128: 2.8999999999999998e-003 | AB128: -3.9000000000000003e-003 | AC128: -5.4400000000000004e-002 | AD128: -5.8400000000000001e-002 | AE128: 94.91 | AF128: 91.74 | AG128: 0.51 | AH128: AA- | AI128: 6.59e-002 | AJ128: =H128+100*O128 -> 130.32999999999998 | AK128: 128.8 | AL128: 101 | AM128: 33.8 | AN128: 62 | AO128: -5.2999999999999999e-002 | AP128: 20 | AQ128: 道氏转债!!
A129: 117 | B129: 110068 | C129: 龙净转债! | D129: 600388 | E129: 龙净环保 | F129: 城市公用 | G129: 三废处理 | H129: 113.4 | I129: 6.1999999999999998e-003 | J129: 8.199999999999999e-003 | K129: 10.6 | L129: 2.4199999999999999e-002 | M129: 115 | N129: 10.73 | O129: 0.14800000000000002 | P129: 98.79 | Q129: 转股中 | R129: 5.34年 | S129: 3.34年 | T129: 20 | U129: 13 | V129: 6.0000000000000001e-003 | W129: 0.17600000000000002 | X129: 0.17399999999999999 | Y129: 113 | Z129: 1.96 | AA129: 2.7000000000000001e-003 | AB129: -2.3999999999999998e-003 | AC129: -2.5899999999999999e-002 | AD129: -2.7799999999999998e-002 | AE129: 88.99 | AF129: 91.58 | AG129: 0.6 | AH129: AA+ | AI129: 4.4400000000000002e-002 | AJ129: =H129+100*O129 -> 128.20000000000002 | AK129: 128 | AL129: 92 | AM129: 36.4 | AN129: 94 | AO129: 4.2999999999999997e-002 | AP129: 29 | AQ129: 龙净转债!
A130: 221 | B130: 123023 | C130: 迪森转债! | D130: 300335 | E130: 迪森股份 | F130: 能源电力 | G130: 电力供应 | H130: 113.64 | I130: -2.3e-003 | J130: 4.7999999999999996e-003 | K130: 7.48 | L130: 4.0000000000000001e-003 | M130: 114.9 | N130: 7.04 | O130: 7.0000000000000007e-002 | P130: 106.25 | Q130: 转股中 | R130: 4.33年 | S130: 3.33年 | T130: 5.3 | U130: 109 | V130: 0.17999999999999999 | W130: 0.19500000000000001 | X130: 0.20699999999999999 | Y130: 27 | Z130: 2.01 | AA130: 2.5999999999999999e-003 | AB130: -3.5999999999999999e-003 | AC130: -2.2099999999999998e-002 | AD130: -2.4799999999999999e-002 | AE130: 90.49 | AF130: 95.39 | AG130: 0.63 | AH130: AA | AI130: 4.4900000000000002e-002 | AJ130: =H130+100*O130 -> 120.64 | AK130: 121 | AL130: 15 | AM130: 25.6 | AN130: 13 | AO130: 6.0999999999999999e-002 | AP130: 57 | AQ130: 迪森转债!
A131: 9 | B131: 128135 | C131: 洽洽转债 | D131: 2557. | E131: 洽洽食品 | F131: 食品饮料 | G131: 休闲食品 | H131: 118.5 | I131: 1.2800000000000001e-002 | J131: 4.4000000000000003e-003 | K131: 56.34 | L131: 3.2799999999999996e-002 | M131: 120.2 | N131: 60.83 | O131: 0.27899999999999997 | P131: 92.62 | Q131: 5月7天 | R131: 5.92年 | S131: 3.92年 | T131: 13.4 | U131: 269 | V131: 0.16899999999999998 | W131: 4.7e-002 | X131: 4.2999999999999997e-002 | Y131: 286 | Z131: 7.45 | AA131: 2.5000000000000001e-003 | AB131: -3.4000000000000002e-003 | AC131: -3.2400000000000005e-002 | AD131: -3.4099999999999998e-002 | AE131: 86.31 | AF131: 92.34 | AG131: 0.52 | AH131: AA | AI131: 4.6399999999999997e-002 | AJ131: =H131+100*O131 -> 146.40000000000001 | AK131: 144.4 | AL131: 237 | AM131: 52 | AN131: 216 | AO131: -3.0000000000000001e-003 | AP131: 3 | AQ131: 洽洽转债
A132: 34 | B132: 127021 | C132: 特发转2! | D132: 70. | E132: 特发信息 | F132: 通信互联 | G132: 通信设备 | H132: 112.154 | I132: 1.4000000000000002e-003 | J132: -1.8e-003 | K132: 10.34 | L132: -1.e-003 | M132: 113.3 | N132: 12.33 | O132: 0.33700000000000002 | P132: 83.86 | Q132: 2月25天 | R132: 4.71年 | S132: 2.71年 | T132: 5.5 | U132: 4.4 | V132: 6.9999999999999993e-003 | W132: 6.5000000000000002e-002 | X132: 5.5e-002 | Y132: 84 | Z132: 2.98 | AA132: 2.2000000000000001e-003 | AB132: -2.8999999999999998e-003 | AC132: -3.2400000000000005e-002 | AD132: -3.3700000000000001e-002 | AE132: 89.98 | AF132: 92.34 | AG132: 0.4 | AH132: AA | AI132: 4.4900000000000002e-002 | AJ132: =H132+100*O132 -> 145.85399999999998 | AK132: 140.4 | AL132: 210 | AM132: 48.1 | AN132: 200 | AO132: 2.e-002 | AP132: 6 | AQ132: 特发转2!
A133: 273 | B133: 127006 | C133: 敖东转债! | D133: 623. | E133: 吉林敖东 | F133: 金融 | G133: 证券行业 | H133: 107.292 | I133: -1.9e-003 | J133: 1.7000000000000001e-003 | K133: 17.42 | L133: -5.9999999999999995e-004 | M133: 108 | N133: 20.42 | O133: 0.25800000000000001 | P133: 85.31 | Q133: 转股中 | R133: 3.31年 | S133: 1.31年 | T133: 24.1 | U133: 1 | V133: 0. | W133: 0.11900000000000001 | X133: 0.10099999999999999 | Y133: 203 | Z133: 0.89 | AA133: 2.e-003 | AB133: -2.5000000000000001e-003 | AC133: -3.6000000000000004e-002 | AD133: -3.8100000000000002e-002 | AE133: 95.59 | AF133: 94.16 | AG133: 0.36 | AH133: AA+ | AI133: 4.2900000000000001e-002 | AJ133: =H133+100*O133 -> 133.09200000000001 | AK133: 129.3 | AL133: 107 | AM133: 33.7 | AN133: 60 | AO133: 1.1000000000000001e-002 | AP133: 26 | AQ133: 敖东转债!
A134: 148 | B134: 128090 | C134: 汽模转2 | D134: 2510. | E134: 天汽模 | F134: 汽车 | G134: 零部件制 | H134: 114.1 | I134: 6.0000000000000001e-003 | J134: 7.3000000000000001e-003 | K134: 4.24 | L134: 2.1700000000000001e-002 | M134: 115.2 | N134: 4.21 | O134: 0.13300000000000001 | P134: 100.71 | Q134: 转股中 | R134: 5年37天 | S134: 3年37天 | T134: 4.67 | U134: 73 | V134: 0.13600000000000001 | W134: 0.121 | X134: 0.121 | Y134: 39 | Z134: 1.46 | AA134: 1.9e-003 | AB134: -3.4000000000000002e-003 | AC134: -2.9100000000000001e-002 | AD134: -3.1200000000000002e-002 | AE134: 89.56 | AF134: 91.84 | AG134: 0.61 | AH134: AA | AI134: 4.6399999999999997e-002 | AJ134: =H134+100*O134 -> 127.39999999999999 | AK134: 127.5 | AL134: 83 | AM134: 35.6 | AN134: 81 | AO134: 3.2000000000000001e-002 | AP134: 26 | AQ134: 汽模转2
A135: 121 | B135: 128101 | C135: 联创转债! | D135: 2036. | E135: 联创电子 | F135: 电子 | G135: 液晶显示 | H135: 114.29 | I135: -2.3999999999999998e-003 | J135: 4.7999999999999996e-003 | K135: 12.11 | L135: 5.0000000000000001e-003 | M135: 115.1 | N135: 13.86 | O135: 0.308 | P135: 87.37 | Q135: 转股中 | R135: 5.32年 | S135: 3.32年 | T135: 3 | U135: 2.9 | V135: 8.0000000000000002e-003 | W135: 2.4e-002 | X135: 2.1000000000000001e-002 | Y135: 127 | Z135: 4.31 | AA135: 1.4000000000000002e-003 | AB135: -3.7000000000000002e-003 | AC135: -2.7999999999999997e-002 | AD135: -2.9900000000000003e-002 | AE135: 88.58 | AF135: 90.85 | AG135: 0.48 | AH135: AA | AI135: 4.6399999999999997e-002 | AJ135: =H135+100*O135 -> 145.09 | AK135: 141.2 | AL135: 212 | AM135: 50.4 | AN135: 210 | AO135: 6.4000000000000001e-002 | AP135: 15 | AQ135: 联创转债!
A136: 153 | B136: 113559 | C136: 永创转债! | D136: 603901 | E136: 永创智能 | F136: 机械装备 | G136: 专用设备 | H136: 118.2 | I136: 1.7000000000000001e-003 | J136: 1.7000000000000001e-003 | K136: 10.58 | L136: 4.6999999999999993e-003 | M136: 118.9 | N136: 10.32 | O136: 0.153 | P136: 102.52 | Q136: 转股中 | R136: 5年33天 | S136: 3年33天 | T136: 5.1 | U136: 0.8 | V136: 1.e-003 | W136: 0.11 | X136: 0.11199999999999999 | Y136: 46 | Z136: 3.36 | AA136: 1.1999999999999999e-003 | AB136: -5.3e-003 | AC136: -3.6299999999999999e-002 | AD136: -3.9100000000000003e-002 | AE136: 85.2 | AF136: 86.14 | AG136: 0.71 | AH136: AA- | AI136: 6.7400000000000002e-002 | AJ136: =H136+100*O136 -> 133.5 | AK136: 133.9 | AL136: 157 | AM136: 47.7 | AN136: 195 | AO136: 3.7000000000000005e-002 | AP136: 22 | AQ136: 永创转债!
A137: 98 | B137: 128107 | C137: 交科转债 | D137: 2061. | E137: 浙江交科 | F137: 建筑 | G137: 建筑工程 | H137: 114.756 | I137: -2.0000000000000001e-004 | J137: -4.4000000000000003e-003 | K137: 5.7 | L137: -6.9999999999999993e-003 | M137: 115.3 | N137: 5.36 | O137: 7.9000000000000001e-002 | P137: 106.34 | Q137: 转股中 | R137: 5.42年 | S137: 3.42年 | T137: 25 | U137: 14 | V137: 5.0000000000000001e-003 | W137: 0.31900000000000001 | X137: 0.33899999999999997 | Y137: 78 | Z137: 0.98 | AA137: 8.9999999999999998e-004 | AB137: -4.0999999999999995e-003 | AC137: -2.7900000000000001e-002 | AD137: -2.98e-002 | AE137: 88.97 | AF137: 91.55 | AG137: 0.67 | AH137: AA+ | AI137: 4.4400000000000002e-002 | AJ137: =H137+100*O137 -> 122.65600000000001 | AK137: 123.2 | AL137: 30 | AM137: 31.6 | AN137: 39 | AO137: 3.7999999999999999e-002 | AP137: 14 | AQ137: 交科转债
A138: 241 | B138: 128051 | C138: 光华转债! | D138: 2741. | E138: 光华科技 | F138: 电子 | G138: 元器件制 | H138: 115.25 | I138: -3.2000000000000002e-003 | J138: 3.7000000000000002e-003 | K138: 13.48 | L138: 7.000000000000001e-004 | M138: 115.5 | N138: 12.72 | O138: 8.8000000000000009e-002 | P138: 105.97 | Q138: 转股中 | R138: 4年24天 | S138: 2年24天 | T138: 2.5 | U138: 12 | V138: 4.0000000000000001e-002 | W138: 5.0000000000000003e-002 | X138: 5.2999999999999999e-002 | Y138: 50 | Z138: 4.17 | AA138: 5.0000000000000001e-004 | AB138: -6.3e-003 | AC138: -4.6199999999999998e-002 | AD138: -4.9299999999999997e-002 | AE138: 90.22 | AF138: 89.7 | AG138: 0.72 | AH138: AA- | AI138: 6.59e-002 | AJ138: =H138+100*O138 -> 124.05 | AK138: 124.5 | AL138: 48 | AM138: 34.3 | AN138: 67 | AO138: -1.7000000000000001e-002 | AP138: 23 | AQ138: 光华转债!
A139: 54 | B139: 113593 | C139: 沪工转债 | D139: 603131 | E139: 上海沪工 | F139: 机械装备 | G139: 通用设备 | H139: 121.26 | I139: 5.7999999999999996e-003 | J139: 8.6e-003 | K139: 25.16 | L139: 1.7000000000000001e-002 | M139: 121.6 | N139: 21.32 | O139: 2.7999999999999997e-002 | P139: 118.01 | Q139: 2月6天 | R139: 5.66年 | S139: 3.66年 | T139: 4 | U139: 33 | V139: 6.8000000000000005e-002 | W139: 5.0000000000000003e-002 | X139: 5.9000000000000004e-002 | Y139: 80 | Z139: 6.49 | AA139: 5.0000000000000001e-004 | AB139: -6.0000000000000001e-003 | AC139: -3.8199999999999998e-002 | AD139: -4.0399999999999998e-002 | AE139: 78.59 | AF139: 80.08 | AG139: 0.85 | AH139: A+ | AI139: 7.8399999999999997e-002 | AJ139: =H139+100*O139 -> 124.06 | AK139: 124.5 | AL139: 47 | AM139: 44.4 | AN139: 168 | AO139: 0.14400000000000002 | AP139: 6 | AQ139: 沪工转债
A140: 19 | B140: 123066 | C140: 赛意转债 | D140: 300687 | E140: 赛意信息 | F140: 计算机及 | G140: 软件开发 | H140: 121.08 | I140: -8.3999999999999995e-003 | J140: -4.1999999999999997e-003 | K140: 25.55 | L140: -1.54e-002 | M140: 121.4 | N140: 22.58 | O140: 7.0000000000000007e-002 | P140: 113.15 | Q140: 4月2天 | R140: 5.82年 | S140: 3.82年 | T140: 3.2 | U140: 11 | V140: 2.8999999999999998e-002 | W140: 5.7999999999999996e-002 | X140: 6.5000000000000002e-002 | Y140: 55 | Z140: 5.86 | AA140: 5.0000000000000001e-004 | AB140: -5.7999999999999996e-003 | AC140: -3.7000000000000005e-002 | AD140: -3.9e-002 | AE140: 77.44 | AF140: 78.97 | AG140: 0.81 | AH140: A+ | AI140: 7.8399999999999997e-002 | AJ140: =H140+100*O140 -> 128.08000000000001 | AK140: 129 | AL140: 104 | AM140: 50 | AN140: 208 | AO140: -4.9000000000000002e-002 | AP140: 4 | AQ140: 赛意转债
A141: 242 | B141: 128050 | C141: 钧达转债! | D141: 2865. | E141: 钧达股份 | F141: 汽车 | G141: 零部件制 | H141: 123.5 | I141: 9.4999999999999998e-003 | J141: -1.1200000000000002e-002 | K141: 17.54 | L141: -2.3e-003 | M141: 123.5 | N141: 14.85 | O141: 4.5999999999999999e-002 | P141: 118.11 | Q141: 转股中 | R141: 4年20天 | S141: 2年20天 | T141: 2.51 | U141: 256 | V141: 0.81799999999999995 | W141: 0.11900000000000001 | X141: 0.14000000000000001 | Y141: 21 | Z141: 2.45 | AA141: 0. | AB141: -9.7000000000000003e-003 | AC141: -7.6100000000000001e-002 | AD141: -7.9000000000000001e-002 | AE141: 90.31 | AF141: 95.96 | AG141: 0.74 | AH141: AA- | AI141: 6.59e-002 | AJ141: =H141+100*O141 -> 128.09999999999999 | AK141: 128.9 | AL141: 103 | AM141: 32.9 | AN141: 51 | AO141: 1.9e-002 | AP141: 62 | AQ141: 钧达转债!
A142: 162 | B142: 110063 | C142: 鹰19转债 | D142: 600567 | E142: 山鹰国际 | F142: 造纸包装 | G142: 包装用纸 | H142: 116.23 | I142: 1.1000000000000001e-003 | J142: 6.3e-003 | K142: 3.4 | L142: 1.1899999999999999e-002 | M142: 116.2 | N142: 3.3 | O142: 0.128 | P142: 103.03 | Q142: 转股中 | R142: 5年23天 | S142: 3年23天 | T142: 18.6 | U142: 2.6 | V142: 1.e-003 | W142: 0.11900000000000001 | X142: 0.12300000000000001 | Y142: 156 | Z142: 1.06 | AA142: -1.e-004 | AB142: -5.6999999999999993e-003 | AC142: -3.5499999999999997e-002 | AD142: -3.7499999999999999e-002 | AE142: 90.11 | AF142: 93.66 | AG142: 0.62 | AH142: AA+ | AI142: 4.4400000000000002e-002 | AJ142: =H142+100*O142 -> 129.03 | AK142: 129.4 | AL142: 110 | AM142: 35.8 | AN142: 85 | AO142: 6.4000000000000001e-002 | AP142: 39 | AQ142: 鹰19转债
A143: 16 | B143: 113603 | C143: 东缆转债 | D143: 603606 | E143: 东方电缆 | F143: 能源电力 | G143: 电力设备 | H143: 115.15 | I143: 1.6500000000000001e-002 | J143: -3.3e-003 | K143: 21.75 | L143: 2.4e-002 | M143: 115.1 | N143: 23.88 | O143: 0.26400000000000001 | P143: 91.08 | Q143: 4月10天 | R143: 5.84年 | S143: 3.84年 | T143: 8 | U143: 33 | V143: 3.6000000000000004e-002 | W143: 5.5999999999999994e-002 | X143: 5.0999999999999997e-002 | Y143: 142 | Z143: 5.25 | AA143: -1.e-004 | AB143: -4.6999999999999993e-003 | AC143: -2.6200000000000001e-002 | AD143: -2.7900000000000001e-002 | AE143: 86.5 | AF143: 88.71 | AG143: 0.55 | AH143: AA | AI143: 4.6399999999999997e-002 | AJ143: =H143+100*O143 -> 141.55000000000001 | AK143: 139.2 | AL143: 202 | AM143: 50.5 | AN143: 211 | AO143: 1.1000000000000001e-002 | AP143: 4 | AQ143: 东缆转债
A144: 232 | B144: 128056 | C144: 今飞转债! | D144: 2863. | E144: 今飞凯达 | F144: 汽车 | G144: 零部件制 | H144: 121.22 | I144: -1.6000000000000001e-003 | J144: -3.4000000000000002e-003 | K144: 8.05 | L144: -6.1999999999999998e-003 | M144: 121 | N144: 6.76 | O144: 1.8000000000000002e-002 | P144: 119.08 | Q144: 转股中 | R144: 4.27年 | S144: 2.27年 | T144: 2.37 | U144: 107 | V144: 0.36499999999999999 | W144: 7.4999999999999997e-002 | X144: 8.900000000000001e-002 | Y144: 32 | Z144: 2.72 | AA144: -4.0000000000000002e-004 | AB144: -8.8000000000000005e-003 | AC144: -6.0999999999999999e-002 | AD144: -6.4000000000000001e-002 | AE144: 87.16 | AF144: 88.89 | AG144: 0.82 | AH144: A+ | AI144: 7.690000000000001e-002 | AJ144: =H144+100*O144 -> 123.02 | AK144: 123.4 | AL144: 34 | AM144: 34.5 | AN144: 68 | AO144: -3.0000000000000001e-003 | AP144: 60 | AQ144: 今飞转债!
A145: 279 | B145: 128034 | C145: 江银转债! | D145: 2807. | E145: 江阴银行 | F145: 金融 | G145: 银行行业 | H145: 109.3 | I145: -4.5999999999999999e-003 | J145: 2.3999999999999998e-003 | K145: 4.11 | L145: -4.7999999999999996e-003 | M145: 109.1 | N145: 4.5 | O145: 0.19699999999999998 | P145: 91.33 | Q145: 转股中 | R145: 3.18年 | S145: 无权 | T145: 17.6 | U145: 1.1 | V145: 1.e-003 | W145: 0.19699999999999998 | X145: 0.17999999999999999 | Y145: 89 | Z145: 0.78 | AA145: -5.9999999999999995e-004 | AB145: -5.8999999999999999e-003 | AC145: 无权 | AD145: 无权 | AE145: 无权 | AF145: 95.66 | AG145: 0.45 | AH145: AA+ | AI145: 4.2900000000000001e-002 | AJ145: =H145+100*O145 -> 129. | AK145: 127.3 | AL145: 80 | AM145: 31.6 | AN145: 38 | AO145: 1.e-003 | AP145: 27 | AQ145: 江银转债!
A146: 118 | B146: 123047 | C146: 久吾转债 | D146: 300631 | E146: 久吾高科 | F146: 机械装备 | G146: 专用设备 | H146: 131.699 | I146: -8.3000000000000001e-003 | J146: -1.e-003 | K146: 21.06 | L146: -1.1699999999999999e-002 | M146: 130.1 | N146: 17.61 | O146: 0.10099999999999999 | P146: 119.59 | Q146: 转股中 | R146: 5.33年 | S146: 3.33年 | T146: 1.99 | U146: 41 | V146: 0.155 | W146: 8.9999999999999997e-002 | X146: 0.107 | Y146: 22 | Z146: 3.15 | AA146: -2.3999999999999998e-003 | AB146: -1.1399999999999999e-002 | AC146: -6.0700000000000004e-002 | AD146: -6.3700000000000007e-002 | AE146: 81.81 | AF146: 88.06 | AG146: 0.79 | AH146: A+ | AI146: 7.8399999999999997e-002 | AJ146: =H146+100*O146 -> 141.79900000000001 | AK146: 143.8 | AL146: 234 | AM146: 55.7 | AN146: 233 | AO146: -8.9999999999999997e-002 | AP146: 22 | AQ146: 久吾转债
A147: 109 | B147: 128105 | C147: 长集转债 | D147: 2616. | E147: 长青集团 | F147: 城市公用 | G147: 三废处理 | H147: 116.882 | I147: 1.7000000000000001e-003 | J147: 2.3e-003 | K147: 8.68 | L147: 5.7999999999999996e-003 | M147: 115.3 | N147: 8.11 | O147: 9.1999999999999998e-002 | P147: 107.03 | Q147: 转股中 | R147: 5.38年 | S147: 3.38年 | T147: 8 | U147: 4.6 | V147: 5.0000000000000001e-003 | W147: 0.124 | X147: 0.13300000000000001 | Y147: 64 | Z147: 2.56 | AA147: -2.5999999999999999e-003 | AB147: -7.6e-003 | AC147: -3.32e-002 | AD147: -3.5099999999999999e-002 | AE147: 88.51 | AF147: 90.77 | AG147: 0.68 | AH147: AA | AI147: 4.6399999999999997e-002 | AJ147: =H147+100*O147 -> 126.08200000000001 | AK147: 126.7 | AL147: 74 | AM147: 36 | AN147: 89 | AO147: -1.9e-002 | AP147: 7 | AQ147: 长集转债
A148: 15 | B148: 128134 | C148: 鸿路转债 | D148: 2541. | E148: 鸿路钢构 | F148: 建筑 | G148: 其他 | H148: 117 | I148: 2.2700000000000001e-002 | J148: -2.1099999999999997e-002 | K148: 38.14 | L148: 3.2000000000000002e-003 | M148: 115.1 | N148: 43.74 | O148: 0.34200000000000003 | P148: 87.2 | Q148: 4月26天 | R148: 5.89年 | S148: 3.89年 | T148: 18.8 | U148: 51 | V148: 2.3e-002 | W148: 9.4e-002 | X148: 8.199999999999999e-002 | Y148: 200 | Z148: 3.73 | AA148: -2.8000000000000004e-003 | AB148: -7.4000000000000003e-003 | AC148: -2.98e-002 | AD148: -3.1400000000000004e-002 | AE148: 86.33 | AF148: 88.54 | AG148: 0.5 | AH148: AA | AI148: 4.6399999999999997e-002 | AJ148: =H148+100*O148 -> 151.19999999999999 | AK148: 146.8 | AL148: 249 | AM148: 58.3 | AN148: 240 | AO148: -1.1000000000000001e-002 | AP148: 2 | AQ148: 鸿路转债
A149: 14 | B149: 113604 | C149: 多伦转债 | D149: 603528 | E149: 多伦科技 | F149: 计算机及 | G149: 软件开发 | H149: 119.21 | I149: 1.2999999999999999e-003 | J149: 2.8999999999999998e-003 | K149: 11.89 | L149: 5.1000000000000004e-003 | M149: 117.3 | N149: 10.44 | O149: 4.7e-002 | P149: 113.89 | Q149: 5月0天 | R149: 5.90年 | S149: 3.90年 | T149: 6.4 | U149: 54 | V149: 7.0999999999999994e-002 | W149: 8.5999999999999993e-002 | X149: 9.8000000000000004e-002 | Y149: 75 | Z149: 4.61 | AA149: -2.8000000000000004e-003 | AB149: -7.9000000000000008e-003 | AC149: -3.3799999999999997e-002 | AD149: -3.5499999999999997e-002 | AE149: 79.84 | AF149: 80.44 | AG149: 0.82 | AH149: AA- | AI149: 6.7400000000000002e-002 | AJ149: =H149+100*O149 -> 123.91 | AK149: 124.5 | AL149: 49 | AM149: 44.1 | AN149: 163 | AO149: -6.9999999999999993e-003 | AP149: 2 | AQ149: 多伦转债
A150: 24 | B150: 128130 | C150: 景兴转债 | D150: 2067. | E150: 景兴纸业 | F150: 造纸包装 | G150: 包装用纸 | H150: 117.05 | I150: -5.5000000000000005e-003 | J150: 7.4000000000000003e-003 | K150: 3.67 | L150: 2.7000000000000001e-003 | M150: 115.1 | N150: 3.4 | O150: 8.4000000000000005e-002 | P150: 107.94 | Q150: 3月14天 | R150: 5.78年 | S150: 3.78年 | T150: 12.8 | U150: 10 | V150: 6.9999999999999993e-003 | W150: 0.314 | X150: 0.33899999999999997 | Y150: 41 | Z150: 0.9 | AA150: -3.0000000000000001e-003 | AB150: -7.6e-003 | AC150: -3.0699999999999998e-002 | AD150: -3.2400000000000005e-002 | AE150: 86.75 | AF150: 88.97 | AG150: 0.69 | AH150: AA | AI150: 4.6399999999999997e-002 | AJ150: =H150+100*O150 -> 125.45 | AK150: 126.2 | AL150: 67 | AM150: 37.2 | AN150: 102 | AO150: 8.0000000000000002e-002 | AP150: 10 | AQ150: 景兴转债
A151: 228 | B151: 128057 | C151: 博彦转债 | D151: 2649. | E151: 博彦科技 | F151: 计算机及 | G151: 软件开发 | H151: 118.7 | I151: -7.1999999999999998e-003 | J151: 1.7000000000000001e-003 | K151: 9.84 | L151: -7.0999999999999995e-003 | M151: 117.1 | N151: 8.72 | O151: 5.2000000000000005e-002 | P151: 112.84 | Q151: 转股中 | R151: 4.29年 | S151: 2.29年 | T151: 5.29 | U151: 3.5 | V151: 6.0000000000000001e-003 | W151: 0.10099999999999999 | X151: 0.114 | Y151: 52 | Z151: 1.84 | AA151: -3.2000000000000002e-003 | AB151: -1.0200000000000001e-002 | AC151: -5.4600000000000003e-002 | AD151: -5.7099999999999998e-002 | AE151: 88.76 | AF151: 89.63 | AG151: 0.78 | AH151: AA- | AI151: 6.59e-002 | AJ151: =H151+100*O151 -> 123.90000000000001 | AK151: 124.6 | AL151: 50 | AM151: 34.9 | AN151: 73 | AO151: -3.7999999999999999e-002 | AP151: 28 | AQ151: 博彦转债
A152: 102 | B152: 123050 | C152: 聚飞转债 | D152: 300303 | E152: 聚飞光电 | F152: 电子 | G152: LED制 | H152: 126.858 | I152: -5.0000000000000001e-003 | J152: -6.4000000000000003e-003 | K152: 6.25 | L152: -1.4199999999999999e-002 | M152: 124.2 | N152: 5.18 | O152: 5.0999999999999997e-002 | P152: 120.66 | Q152: 转股中 | R152: 5.40年 | S152: 3.40年 | T152: 7.05 | U152: 7.6 | V152: 8.0000000000000002e-003 | W152: 8.8000000000000009e-002 | X152: 0.106 | Y152: 80 | Z152: 3.44 | AA152: -4.0000000000000001e-003 | AB152: -1.1399999999999999e-002 | AC152: -5.45e-002 | AD152: -5.6500000000000002e-002 | AE152: 82.75 | AF152: 88.02 | AG152: 0.81 | AH152: AA- | AI152: 6.7400000000000002e-002 | AJ152: =H152+100*O152 -> 131.958 | AK152: 133.1 | AL152: 150 | AM152: 45 | AN152: 177 | AO152: 1.8000000000000002e-002 | AP152: 12 | AQ152: 聚飞转债
A153: 187 | B153: 128073 | C153: 哈尔转债! | D153: 2615. | E153: 哈尔斯 | F153: 其他 | G153: 家居用品 | H153: 117.15 | I153: -1.06e-002 | J153: -8.0000000000000004e-004 | K153: 5.5 | L153: -1.9599999999999999e-002 | M153: 115.3 | N153: 5.72 | O153: 0.218 | P153: 96.15 | Q153: 转股中 | R153: 3.75年 | S153: 1.75年 | T153: 2.99 | U153: 121 | V153: 0.34600000000000003 | W153: 0.13200000000000001 | X153: 0.127 | Y153: 23 | Z153: 2.84 | AA153: -4.3e-003 | AB153: -1.15e-002 | AC153: -6.9699999999999998e-002 | AD153: -7.1599999999999997e-002 | AE153: 90.34 | AF153: 91.04 | AG153: 0.58 | AH153: AA- | AI153: 6.59e-002 | AJ153: =H153+100*O153 -> 138.95000000000002 | AK153: 138.1 | AL153: 191 | AM153: 47.1 | AN153: 190 | AO153: -6.9999999999999993e-003 | AP153: 39 | AQ153: 哈尔转债!
A154: 8 | B154: 123070 | C154: 鹏辉转债 | D154: 300438 | E154: 鹏辉能源 | F154: 汽车 | G154: 零部件制 | H154: 118.02 | I154: 1.3100000000000001e-002 | J154: 2.3e-003 | K154: 19.91 | L154: 2.4199999999999999e-002 | M154: 115.1 | N154: 20.16 | O154: 0.19500000000000001 | P154: 98.76 | Q154: 5月7天 | R154: 5.92年 | S154: 3.92年 | T154: 8.9 | U154: 31 | V154: 2.9999999999999999e-002 | W154: 0.107 | X154: 0.105 | Y154: 84 | Z154: 3.38 | AA154: -4.3e-003 | AB154: -8.8000000000000005e-003 | AC154: -3.1600000000000003e-002 | AD154: -3.3300000000000003e-002 | AE154: 86.22 | AF154: 88.42 | AG154: 0.64 | AH154: AA | AI154: 4.6399999999999997e-002 | AJ154: =H154+100*O154 -> 137.51999999999998 | AK154: 137.3 | AL154: 184 | AM154: 48.9 | AN154: 202 | AO154: -2.6000000000000002e-002 | AP154: 3 | AQ154: 鹏辉转债
A155: 4 | B155: 127023 | C155: 华菱转2 | D155: 932. | E155: 华菱钢铁 | F155: 钢铁 | G155: 炼钢 | H155: 113 | I155: 9.3999999999999986e-003 | J155: 2.3e-003 | K155: 5.62 | L155: 1.6299999999999999e-002 | M155: 110.1 | N155: 5.18 | O155: 4.2000000000000003e-002 | P155: 108.49 | Q155: 5月10天 | R155: 5.92年 | S155: 4.92年 | T155: 40 | U155: 1019. | V155: 0.22699999999999998 | W155: 0.11599999999999999 | X155: 0.126 | Y155: 344 | Z155: 1.09 | AA155: -4.4000000000000003e-003 | AB155: -7.6e-003 | AC155: -1.55e-002 | AD155: -1.7100000000000001e-002 | AE155: 85.13 | AF155: 86.87 | AG155: 0.72 | AH155: AAA | AI155: 4.1399999999999999e-002 | AJ155: =H155+100*O155 -> 117.2 | AK155: 117.5 | AL155: 8 | AM155: 30.6 | AN155: 32 | AO155: 3.3000000000000002e-002 | AP155: 5 | AQ155: 华菱转2
A156: 243 | B156: 110048 | C156: 福能转债! | D156: 600483 | E156: 福能股份 | F156: 能源电力 | G156: 电力供应 | H156: 115.94 | I156: -2.5000000000000001e-003 | J156: -2.0000000000000001e-004 | K156: 7.81 | L156: -5.1000000000000004e-003 | M156: 113.9 | N156: 8.12 | O156: 0.20499999999999999 | P156: 96.18 | Q156: 转股中 | R156: 4年17天 | S156: 2年17天 | T156: 28.3 | U156: 8.3 | V156: 3.0000000000000001e-003 | W156: 0.20600000000000002 | X156: 0.19800000000000001 | Y156: 137 | Z156: 0.98 | AA156: -4.5000000000000005e-003 | AB156: -1.06e-002 | AC156: -5.0999999999999997e-002 | AD156: -5.3699999999999998e-002 | AE156: 94.33 | AF156: 96.47 | AG156: 0.53 | AH156: AA+ | AI156: 4.2900000000000001e-002 | AJ156: =H156+100*O156 -> 136.44 | AK156: 135.7 | AL156: 172 | AM156: 39.2 | AN156: 123 | AO156: 1.3999999999999999e-002 | AP156: 8 | AQ156: 福能转债!
A157: 66 | B157: 123057 | C157: 美联转债 | D157: 300586 | E157: 美联新材 | F157: 化工 | G157: 橡胶塑料 | H157: 121.39 | I157: 4.8999999999999998e-003 | J157: -4.1999999999999997e-003 | K157: 10.4 | L157: 1.e-003 | M157: 118.2 | N157: 9.91 | O157: 0.157 | P157: 104.94 | Q157: 48天 | R157: 5.61年 | S157: 3.61年 | T157: 2.07 | U157: 116 | V157: 0.46399999999999997 | W157: 4.4000000000000004e-002 | X157: 4.5999999999999999e-002 | Y157: 47 | Z157: 6.38 | AA157: -4.7999999999999996e-003 | AB157: -1.04e-002 | AC157: -4.0199999999999993e-002 | AD157: -4.2199999999999994e-002 | AE157: 81.61 | AF157: 82.64 | AG157: 0.75 | AH157: AA- | AI157: 6.7400000000000002e-002 | AJ157: =H157+100*O157 -> 137.09 | AK157: 137.8 | AL157: 189 | AM157: 55.2 | AN157: 228 | AO157: -8.3000000000000004e-002 | AP157: 10 | AQ157: 美联转债
A158: 53 | B158: 127020 | C158: 中金转债 | D158: 60. | E158: 中金岭南 | F158: 有色金属 | G158: 有色行业 | H158: 117.3 | I158: 1.38e-002 | J158: 9.7000000000000003e-003 | K158: 4.92 | L158: 3.5799999999999998e-002 | M158: 113.7 | N158: 4.71 | O158: 0.12300000000000001 | P158: 104.46 | Q158: 2月6天 | R158: 5.66年 | S158: 3.66年 | T158: 38 | U158: 63 | V158: 1.3999999999999999e-002 | W158: 0.21600000000000003 | X158: 0.22600000000000001 | Y158: 176 | Z158: 1.56 | AA158: -5.6000000000000008e-003 | AB158: -9.8999999999999991e-003 | AC158: -3.49e-002 | AD158: -3.61e-002 | AE158: 86.83 | AF158: 89.18 | AG158: 0.66 | AH158: AA+ | AI158: 4.4400000000000002e-002 | AJ158: =H158+100*O158 -> 129.59999999999999 | AK158: 130.1 | AL158: 121 | AM158: 41 | AN158: 138 | AO158: 0.128 | AP158: 13 | AQ158: 中金转债
A159: 155 | B159: 113556 | C159: 至纯转债! | D159: 603690 | E159: 至纯科技 | F159: 机械装备 | G159: 专用设备 | H159: 130.52 | I159: -3.0000000000000001e-003 | J159: 6.3e-003 | K159: 34.72 | L159: 4.0000000000000001e-003 | M159: 126.8 | N159: 29.37 | O159: 0.10400000000000001 | P159: 118.22 | Q159: 转股中 | R159: 5年30天 | S159: 3年30天 | T159: 2.96 | U159: 12 | V159: 3.1e-002 | W159: 3.3000000000000002e-002 | X159: 3.9e-002 | Y159: 90 | Z159: 5.89 | AA159: -5.7999999999999996e-003 | AB159: -1.44e-002 | AC159: -6.6400000000000001e-002 | AD159: -6.88e-002 | AE159: 82.24 | AF159: 87.25 | AG159: 0.82 | AH159: A+ | AI159: 7.8399999999999997e-002 | AJ159: =H159+100*O159 -> 140.92000000000002 | AK159: 142.8 | AL159: 225 | AM159: 55.6 | AN159: 232 | AO159: 2.e-002 | AP159: 13 | AQ159: 至纯转债!
A160: 72 | B160: 123056 | C160: 雪榕转债 | D160: 300511 | E160: 雪榕生物 | F160: 农业 | G160: 种植业 | H160: 125 | I160: 4.3e-003 | J160: 7.6e-003 | K160: 14.46 | L160: 1.3999999999999999e-002 | M160: 121.1 | N160: 11.89 | O160: 2.7999999999999997e-002 | P160: 121.61 | Q160: 45天 | R160: 5.59年 | S160: 3.59年 | T160: 5.85 | U160: 13 | V160: 1.8000000000000002e-002 | W160: 9.1999999999999998e-002 | X160: 0.111 | Y160: 64 | Z160: 3.34 | AA160: -5.7999999999999996e-003 | AB160: -1.21e-002 | AC160: -4.82e-002 | AD160: -5.0000000000000003e-002 | AE160: 81.62 | AF160: 84.74 | AG160: 0.85 | AH160: AA- | AI160: 6.7400000000000002e-002 | AJ160: =H160+100*O160 -> 127.8 | AK160: 128.4 | AL160: 99 | AM160: 43.6 | AN160: 160 | AO160: -2.5000000000000001e-002 | AP160: 11 | AQ160: 雪榕转债
A161: 38 | B161: 113598 | C161: 法兰转债 | D161: 603966 | E161: 法兰泰克 | F161: 机械装备 | G161: 工程机械 | H161: 125.19 | I161: -2.5000000000000001e-003 | J161: 1.01e-002 | K161: 15.45 | L161: 9.7999999999999997e-003 | M161: 121.2 | N161: 13.88 | O161: 0.125 | P161: 111.31 | Q161: 2月18天 | R161: 5.69年 | S161: 3.69年 | T161: 3.3 | U161: 1.6 | V161: 4.0000000000000001e-003 | W161: 0.10099999999999999 | X161: 0.113 | Y161: 33 | Z161: 2.92 | AA161: -5.7999999999999996e-003 | AB161: -1.21e-002 | AC161: -4.7100000000000003e-002 | AD161: -4.9000000000000002e-002 | AE161: 81.17 | AF161: 84.27 | AG161: 0.77 | AH161: AA- | AI161: 6.7400000000000002e-002 | AJ161: =H161+100*O161 -> 137.69 | AK161: 139.1 | AL161: 196 | AM161: 54.8 | AN161: 226 | AO161: 5.7000000000000002e-002 | AP161: 6 | AQ161: 法兰转债
A162: 96 | B162: 113579 | C162: 健友转债 | D162: 603707 | E162: 健友股份 | F162: 医药 | G162: 原料药 | H162: 117.85 | I162: -1.47e-002 | J162: 1.1599999999999999e-002 | K162: 38.83 | L162: -5.6000000000000008e-003 | M162: 114.2 | N162: 42.05 | O162: 0.27600000000000002 | P162: 92.34 | Q162: 转股中 | R162: 5.42年 | S162: 3.42年 | T162: 5.03 | U162: 16 | V162: 2.7000000000000003e-002 | W162: 1.3999999999999999e-002 | X162: 1.3000000000000001e-002 | Y162: 363 | Z162: 10.58 | AA162: -5.8999999999999999e-003 | AB162: -1.0500000000000001e-002 | AC162: -3.5299999999999998e-002 | AD162: -3.7200000000000004e-002 | AE162: 88.26 | AF162: 89.74 | AG162: 0.56 | AH162: AA | AI162: 4.6399999999999997e-002 | AJ162: =H162+100*O162 -> 145.44999999999999 | AK162: 143.4 | AL162: 230 | AM162: 53.6 | AN162: 222 | AO162: -1.1000000000000001e-002 | AP162: 7 | AQ162: 健友转债
A163: 74 | B163: 113588 | C163: 润达转债 | D163: 603108 | E163: 润达医疗 | F163: 医药 | G163: 医疗器械 | H163: 118.2 | I163: -8.0000000000000004e-004 | J163: -2.e-003 | K163: 13.03 | L163: -4.5999999999999999e-003 | M163: 114.2 | N163: 13.36 | O163: 0.21199999999999999 | P163: 97.53 | Q163: 33天 | R163: 5.57年 | S163: 3.57年 | T163: 5.5 | U163: 0.9 | V163: 1.e-003 | W163: 7.2999999999999995e-002 | X163: 7.0999999999999994e-002 | Y163: 76 | Z163: 2.52 | AA163: -6.3e-003 | AB163: -1.0800000000000001e-002 | AC163: -3.4700000000000002e-002 | AD163: -3.6499999999999998e-002 | AE163: 87.66 | AF163: 89.12 | AG163: 0.61 | AH163: AA | AI163: 4.6399999999999997e-002 | AJ163: =H163+100*O163 -> 139.40000000000001 | AK163: 138.9 | AL163: 195 | AM163: 49.7 | AN163: 206 | AO163: -5.7000000000000002e-002 | AP163: 7 | AQ163: 润达转债
A164: 292 | B164: 128022 | C164: 众信转债! | D164: 2707. | E164: 众信旅游 | F164: 旅游餐饮 | G164: 旅游 | H164: 112.07 | I164: -7.6e-003 | J164: 4.0999999999999995e-003 | K164: 7.12 | L164: -8.3999999999999995e-003 | M164: 109.8 | N164: 7.92 | O164: 0.247 | P164: 89.9 | Q164: 转股中 | R164: 3年11天 | S164: 1年11天 | T164: 4.56 | U164: 33 | V164: 6.4000000000000001e-002 | W164: 7.0999999999999994e-002 | X164: 6.4000000000000001e-002 | Y164: 65 | Z164: 3.03 | AA164: -6.8999999999999999e-003 | AB164: -1.2800000000000001e-002 | AC164: -7.22e-002 | AD164: -7.5999999999999998e-002 | AE164: 97.36 | AF164: 96.4 | AG164: 0.42 | AH164: AA | AI164: 4.4900000000000002e-002 | AJ164: =H164+100*O164 -> 136.76999999999998 | AK164: 134.2 | AL164: 161 | AM164: 36.9 | AN164: 98 | AO164: 0.13400000000000001 | AP164: 23 | AQ164: 众信转债!
A165: 89 | B165: 123051 | C165: 今天转债 | D165: 300532 | E165: 今天国际 | F165: 计算机及 | G165: 软件开发 | H165: 127.48 | I165: -2.5000000000000001e-003 | J165: 1.3500000000000002e-002 | K165: 11.1 | L165: 1.2800000000000001e-002 | M165: 122.8 | N165: 8.8 | O165: 1.1000000000000001e-002 | P165: 126.14 | Q165: 20天 | R165: 5.54年 | S165: 3.54年 | T165: 2.8 | U165: 79 | V165: 0.221 | W165: 9.1999999999999998e-002 | X165: 0.11599999999999999 | Y165: 30 | Z165: 3.81 | AA165: -6.8999999999999999e-003 | AB165: -1.37e-002 | AC165: -5.2300000000000006e-002 | AD165: -5.45e-002 | AE165: 79.47 | AF165: 81.7 | AG165: 0.86 | AH165: A+ | AI165: 7.8399999999999997e-002 | AJ165: =H165+100*O165 -> 128.58000000000001 | AK165: 128.8 | AL165: 102 | AM165: 47.1 | AN165: 191 | AO165: -8.0000000000000002e-002 | AP165: 11 | AQ165: 今天转债
A166: 283 | B166: 110041 | C166: 蒙电转债! | D166: 600863 | E166: 内蒙华电 | F166: 能源电力 | G166: 电力供应 | H166: 112.65 | I166: -1.2999999999999999e-003 | J166: 5.4000000000000003e-003 | K166: 2.65 | L166: 7.6e-003 | M166: 110.3 | N166: 2.69 | O166: 0.14400000000000002 | P166: 98.51 | Q166: 转股中 | R166: 3年32天 | S166: 1年32天 | T166: 18.7 | U166: 2 | V166: 1.e-003 | W166: 0.121 | X166: 0.12 | Y166: 154 | Z166: 1.3 | AA166: -6.9999999999999993e-003 | AB166: -1.3100000000000001e-002 | AC166: -7.1099999999999997e-002 | AD166: -7.4999999999999997e-002 | AE166: 97.93 | AF166: 98.03 | AG166: 0.54 | AH166: AAA | AI166: 3.9900000000000005e-002 | AJ166: =H166+100*O166 -> 127.05000000000001 | AK166: 126.8 | AL166: 75 | AM166: 28.8 | AN166: 22 | AO166: 1.4999999999999999e-002 | AP166: 9 | AQ166: 蒙电转债!
A167: 306 | B167: 113012 | C167: 骆驼转债! | D167: 601311 | E167: 骆驼股份 | F167: 汽车 | G167: 零部件制 | H167: 109.74 | I167: 1.e-004 | J167: 9.1000000000000004e-003 | K167: 8.57 | L167: 3.2500000000000001e-002 | M167: 107.8 | N167: 10.06 | O167: 0.28800000000000003 | P167: 85.19 | Q167: 转股中 | R167: 2.34年 | S167: 0.34年 | T167: 5.1 | U167: 12 | V167: 2.2000000000000002e-002 | W167: 5.2999999999999999e-002 | X167: 4.4999999999999998e-002 | Y167: 96 | Z167: 1.43 | AA167: -7.7000000000000002e-003 | AB167: -1.3899999999999999e-002 | AC167: -0.157 | AD167: -0.16300000000000001 | AE167: 99.36 | AF167: 97.59 | AG167: 0.28 | AH167: AA | AI167: 4.4199999999999996e-002 | AJ167: =H167+100*O167 -> 138.53999999999999 | AK167: 134.3 | AL167: 162 | AM167: 34.9 | AN167: 74 | AO167: 1.3000000000000001e-002 | AP167: 17 | AQ167: 骆驼转债!
A168: 26 | B168: 113602 | C168: 景20转债 | D168: 603228 | E168: 景旺电子 | F168: 电子 | G168: 元器件制 | H168: 118.45 | I168: -2.8999999999999998e-003 | J168: 8.0000000000000004e-004 | K168: 32.15 | L168: -3.7000000000000002e-003 | M168: 113.3 | N168: 35.28 | O168: 0.29999999999999999 | P168: 91.13 | Q168: 3月11天 | R168: 5.76年 | S168: 3.76年 | T168: 17.8 | U168: 3.8 | V168: 2.e-003 | W168: 6.5000000000000002e-002 | X168: 5.9000000000000004e-002 | Y168: 274 | Z168: 4.58 | AA168: -7.8000000000000005e-003 | AB168: -1.1899999999999999e-002 | AC168: -3.3399999999999999e-002 | AD168: -3.5099999999999999e-002 | AE168: 87.02 | AF168: 87.7 | AG168: 0.57 | AH168: AA | AI168: 4.6399999999999997e-002 | AJ168: =H168+100*O168 -> 148.44999999999999 | AK168: 145.8 | AL168: 246 | AM168: 58.1 | AN168: 239 | AO168: -2.e-003 | AP168: 6 | AQ168: 景20转债
A169: 314 | B169: 110031 | C169: 航信转债!! | D169: 600271 | E169: 航天信息 | F169: 计算机及 | G169: 软件开发 | H169: 107.5 | I169: -1.e-004 | J169: 1.e-004 | K169: 13.95 | L169: 7.000000000000001e-004 | M169: 107 | N169: 21.56 | O169: 0.66099999999999992 | P169: 64.7 | Q169: 转股中 | R169: 0.56年 | S169: 回售中 | T169: 24 | U169: 1.5 | V169: 1.e-003 | W169: 9.3000000000000013e-002 | X169: 5.9999999999999998e-002 | Y169: 259 | Z169: 2.25 | AA169: -8.3000000000000001e-003 | AB169: -3.1400000000000004e-002 | AC169: 回售中 | AD169: 回售中 | AE169: 100.27 | AF169: 104.82 | AG169: 0 | AH169: AAA | AI169: 3.7499999999999999e-002 | AJ169: =H169+100*O169 -> 173.59999999999999 | AK169: 150.3 | AL169: 257 | AM169: 45.5 | AN169: 178 | AO169: -3.5000000000000003e-002 | AP169: 14 | AQ169: 航信转债!!
A170: 146 | B170: 113561 | C170: 正裕转债! | D170: 603089 | E170: 正裕工业 | F170: 汽车 | G170: 零部件制 | H170: 123.58 | I170: 4.5999999999999999e-003 | J170: 4.3e-003 | K170: 12.5 | L170: 1.0500000000000001e-002 | M170: 118.5 | N170: 10.23 | O170: 1.1000000000000001e-002 | P170: 122.19 | Q170: 转股中 | R170: 5年41天 | S170: 3年41天 | T170: 1.59 | U170: 35 | V170: 0.17699999999999999 | W170: 5.7999999999999996e-002 | X170: 7.0000000000000007e-002 | Y170: 28 | Z170: 2.99 | AA170: -8.3999999999999995e-003 | AB170: -1.46e-002 | AC170: -5.0099999999999999e-002 | AD170: -5.2600000000000001e-002 | AE170: 82.04 | AF170: 81.42 | AG170: 0.85 | AH170: A+ | AI170: 7.8399999999999997e-002 | AJ170: =H170+100*O170 -> 124.67999999999999 | AK170: 125 | AL170: 52 | AM170: 42.9 | AN170: 154 | AO170: 5.7000000000000002e-002 | AP170: 33 | AQ170: 正裕转债!
A171: 50 | B171: 123060 | C171: 苏试转债 | D171: 300416 | E171: 苏试试验 | F171: 机械装备 | G171: 专用设备 | H171: 123.3 | I171: -7.000000000000001e-004 | J171: 7.000000000000001e-004 | K171: 23.45 | L171: 0. | M171: 117.6 | N171: 23.86 | O171: 0.255 | P171: 98.28 | Q171: 2月8天 | R171: 5.67年 | S171: 3.67年 | T171: 3.1 | U171: 7.1 | V171: 1.9e-002 | W171: 6.5000000000000002e-002 | X171: 6.4000000000000001e-002 | Y171: 48 | Z171: 4.81 | AA171: -8.5000000000000006e-003 | AB171: -1.38e-002 | AC171: -4.4000000000000004e-002 | AD171: -4.58e-002 | AE171: 81.16 | AF171: 81.89 | AG171: 0.7 | AH171: AA- | AI171: 6.7400000000000002e-002 | AJ171: =H171+100*O171 -> 148.80000000000001 | AK171: 148.3 | AL171: 252 | AM171: 66.4 | AN171: 267 | AO171: -3.3000000000000002e-002 | AP171: 7 | AQ171: 苏试转债
A172: 76 | B172: 128114 | C172: 正邦转债 | D172: 2157. | E172: 正邦科技 | F172: 农业 | G172: 畜牧业 | H172: 120.87 | I172: -1.e-003 | J172: -9.7000000000000003e-003 | K172: 18.04 | L172: -1.47e-002 | M172: 115.3 | N172: 16.09 | O172: 7.8e-002 | P172: 112.12 | Q172: 33天 | R172: 5.57年 | S172: 3.57年 | T172: 16 | U172: 32 | V172: 1.6e-002 | W172: 3.5000000000000003e-002 | X172: 3.9e-002 | Y172: 455 | Z172: 3.03 | AA172: -8.6e-003 | AB172: -1.34e-002 | AC172: -4.0300000000000002e-002 | AD172: -4.2099999999999999e-002 | AE172: 88.38 | AF172: 90.94 | AG172: 0.72 | AH172: AA+ | AI172: 4.4400000000000002e-002 | AJ172: =H172+100*O172 -> 128.67000000000002 | AK172: 129.6 | AL172: 111 | AM172: 38.7 | AN172: 117 | AO172: 4.2999999999999997e-002 | AP172: 10 | AQ172: 正邦转债
A173: 217 | B173: 123025 | C173: 精测转债!! | D173: 300567 | E173: 精测电子 | F173: 电子 | G173: 液晶显示 | H173: 121.814 | I173: -7.000000000000001e-004 | J173: 8.0000000000000002e-003 | K173: 50.42 | L173: 1.1000000000000001e-002 | M173: 117.3 | N173: 49.95 | O173: 0.20699999999999999 | P173: 100.94 | Q173: 转股中 | R173: 4.35年 | S173: 2.35年 | T173: 3.09 | U173: 4.9 | V173: 1.3000000000000001e-002 | W173: 2.5000000000000001e-002 | X173: 2.5000000000000001e-002 | Y173: 124 | Z173: 8.01 | AA173: -8.8000000000000005e-003 | AB173: -1.5700000000000002e-002 | AC173: -6.2800000000000009e-002 | AD173: -6.5299999999999997e-002 | AE173: 88.42 | AF173: 89.42 | AG173: 0.66 | AH173: AA- | AI173: 6.59e-002 | AJ173: =H173+100*O173 -> 142.51399999999998 | AK173: 142.7 | AL173: 223 | AM173: 53.3 | AN173: 218 | AO173: -1.2e-002 | AP173: 18 | AQ173: 精测转债!!
A174: 301 | B174: 113014 | C174: 林洋转债! | D174: 601222 | E174: 林洋能源 | F174: 能源电力 | G174: 电力设备 | H174: 112.34 | I174: -1.1999999999999999e-003 | J174: 4.5999999999999999e-003 | K174: 7.42 | L174: 9.4999999999999998e-003 | M174: 109.3 | N174: 8.54 | O174: 0.29299999999999998 | P174: 86.89 | Q174: 转股中 | R174: 2.93年 | S174: 0.93年 | T174: 30 | U174: 16 | V174: 5.0000000000000001e-003 | W174: 0.23100000000000001 | X174: 0.20100000000000001 | Y174: 130 | Z174: 1.24 | AA174: -9.3999999999999986e-003 | AB174: -1.5300000000000001e-002 | AC174: -8.5800000000000001e-002 | AD174: -8.8699999999999987e-002 | AE174: 97.08 | AF174: 96.46 | AG174: 0.36 | AH174: AA | AI174: 4.4199999999999996e-002 | AJ174: =H174+100*O174 -> 141.63999999999999 | AK174: 137.8 | AL174: 187 | AM174: 40.7 | AN174: 131 | AO174: -5.0999999999999997e-002 | AP174: 22 | AQ174: 林洋转债!
A175: 216 | B175: 110057 | C175: 现代转债 | D175: 600420 | E175: 现代制药 | F175: 医药 | G175: 化学制药 | H175: 115.42 | I175: 2.0000000000000001e-004 | J175: -8.0000000000000004e-004 | K175: 10.67 | L175: -8.9999999999999998e-004 | M175: 110.8 | N175: 9.89 | O175: 7.0000000000000007e-002 | P175: 107.89 | Q175: 转股中 | R175: 4.36年 | S175: 2.36年 | T175: 16.2 | U175: 18 | V175: 9.0000000000000011e-003 | W175: 0.14699999999999999 | X175: 0.159 | Y175: 110 | Z175: 1.39 | AA175: -9.4999999999999998e-003 | AB175: -1.3999999999999999e-002 | AC175: -4.3299999999999998e-002 | AD175: -4.5700000000000005e-002 | AE175: 93.66 | AF175: 93.75 | AG175: 0.69 | AH175: AAA | AI175: 3.9900000000000005e-002 | AJ175: =H175+100*O175 -> 122.42 | AK175: 123 | AL175: 27 | AM175: 29.2 | AN175: 24 | AO175: 4.7e-002 | AP175: 22 | AQ175: 现代转债
A176: 194 | B176: 113541 | C176: 荣晟转债! | D176: 603165 | E176: 荣晟环保 | F176: 造纸包装 | G176: 包装用纸 | H176: 120.28 | I176: 0. | J176: -3.0000000000000001e-003 | K176: 13.52 | L176: -3.7000000000000002e-003 | M176: 115 | N176: 11.54 | O176: 2.7000000000000003e-002 | P176: 117.16 | Q176: 转股中 | R176: 4.67年 | S176: 2.67年 | T176: 2.75 | U176: 4.3 | V176: 1.3000000000000001e-002 | W176: 8.1000000000000003e-002 | X176: 9.5000000000000001e-002 | Y176: 34 | Z176: 2.23 | AA176: -9.7000000000000003e-003 | AB176: -1.54e-002 | AC176: -5.21e-002 | AD176: -5.4199999999999998e-002 | AE176: 86.52 | AF176: 85.89 | AG176: 0.8 | AH176: AA- | AI176: 6.59e-002 | AJ176: =H176+100*O176 -> 122.98 | AK176: 123.4 | AL176: 35 | AM176: 36.9 | AN176: 99 | AO176: 8.0000000000000002e-003 | AP176: 49 | AQ176: 荣晟转债!
A177: 92 | B177: 128108 | C177: 蓝帆转债 | D177: 2382. | E177: 蓝帆医疗 | F177: 医药 | G177: 医疗器械 | H177: 119.519 | I177: 8.8999999999999999e-003 | J177: -1.4000000000000002e-003 | K177: 21.01 | L177: 9.5999999999999992e-003 | M177: 113.3 | N177: 17.79 | O177: 1.2e-002 | P177: 118.1 | Q177: 13天 | R177: 5.52年 | S177: 4.52年 | T177: 31.4 | U177: 246 | V177: 6.5000000000000002e-002 | W177: 0.155 | X177: 0.183 | Y177: 203 | Z177: 2.12 | AA177: -9.7999999999999997e-003 | AB177: -1.41e-002 | AC177: -2.64e-002 | AD177: -2.86e-002 | AE177: 85.71 | AF177: 88.67 | AG177: 0.78 | AH177: AA | AI177: 4.6399999999999997e-002 | AJ177: =H177+100*O177 -> 120.71900000000001 | AK177: 120.9 | AL177: 14 | AM177: 32.3 | AN177: 47 | AO177: -5.9999999999999998e-002 | AP177: 23 | AQ177: 蓝帆转债
A178: 46 | B178: 110073 | C178: 国投转债 | D178: 600061 | E178: 国投资本 | F178: 金融 | G178: 证券行业 | H178: 116.87 | I178: -3.0999999999999999e-003 | J178: -8.9999999999999998e-004 | K178: 14.55 | L178: -6.8000000000000005e-003 | M178: 110.5 | N178: 15.25 | O178: 0.22500000000000001 | P178: 95.41 | Q178: 2月13天 | R178: 5.67年 | S178: 无权 | T178: 80 | U178: 122 | V178: 1.3000000000000001e-002 | W178: 0.13 | X178: 0.124 | Y178: 615 | Z178: 1.47 | AA178: -9.8999999999999991e-003 | AB178: -1.3300000000000001e-002 | AC178: 无权 | AD178: 无权 | AE178: 无权 | AF178: 88.03 | AG178: 0.59 | AH178: AAA | AI178: 4.1399999999999999e-002 | AJ178: =H178+100*O178 -> 139.37 | AK178: 138.3 | AL178: 192 | AM178: 50.3 | AN178: 209 | AO178: 1.e-002 | AP178: 21 | AQ178: 国投转债
A179: 140 | B179: 113563 | C179: 柳药转债 | D179: 603368 | E179: 柳药股份 | F179: 医药 | G179: 医药商业 | H179: 119.1 | I179: -8.9999999999999998e-004 | J179: -4.0999999999999995e-003 | K179: 25.05 | L179: -7.4999999999999997e-003 | M179: 113.2 | N179: 24.47 | O179: 0.16300000000000001 | P179: 102.37 | Q179: 转股中 | R179: 5年57天 | S179: 3年57天 | T179: 8.02 | U179: 1.9 | V179: 2.e-003 | W179: 8.8000000000000009e-002 | X179: 8.9999999999999997e-002 | Y179: 91 | Z179: 1.89 | AA179: -1.e-002 | AB179: -1.46e-002 | AC179: -4.1200000000000001e-002 | AD179: -4.3200000000000002e-002 | AE179: 89.34 | AF179: 90.03 | AG179: 0.67 | AH179: AA | AI179: 4.6399999999999997e-002 | AJ179: =H179+100*O179 -> 135.40000000000001 | AK179: 135.8 | AL179: 173 | AM179: 45.8 | AN179: 184 | AO179: 3.7000000000000005e-002 | AP179: 15 | AQ179: 柳药转债
A180: 277 | B180: 128035 | C180: 大族转债! | D180: 2008. | E180: 大族激光 | F180: 机械装备 | G180: 专用设备 | H180: 111.711 | I180: 3.5999999999999999e-003 | J180: -3.0999999999999999e-003 | K180: 41.9 | L180: 2.3999999999999998e-003 | M180: 108 | N180: 52.1 | O180: 0.38900000000000001 | P180: 80.42 | Q180: 转股中 | R180: 3.21年 | S180: 1.21年 | T180: 23 | U180: 7.7 | V180: 3.0000000000000001e-003 | W180: 5.0999999999999997e-002 | X180: 4.0999999999999995e-002 | Y180: 447 | Z180: 4.87 | AA180: -1.06e-002 | AB180: -1.52e-002 | AC180: -4.8099999999999997e-002 | AD180: -5.3899999999999997e-002 | AE180: 98.55 | AF180: 94.55 | AG180: 0.23 | AH180: AA+ | AI180: 4.2900000000000001e-002 | AJ180: =H180+100*O180 -> 150.61099999999999 | AK180: 143 | AL180: 227 | AM180: 44.4 | AN180: 169 | AO180: 1.3999999999999999e-002 | AP180: 20 | AQ180: 大族转债!
A181: 161 | B181: 113553 | C181: 金牌转债! | D181: 603180 | E181: 金牌厨柜 | F181: 其他 | G181: 家居用品 | H181: 131.51 | I181: 1.1200000000000002e-002 | J181: -1.e-003 | K181: 58.25 | L181: 1.0200000000000001e-002 | M181: 124.6 | N181: 44.14 | O181: -3.0000000000000001e-003 | P181: 131.97 | Q181: 转股中 | R181: 5年23天 | S181: 3年23天 | T181: 1.62 | U181: 24 | V181: 0.114 | W181: 2.8999999999999998e-002 | X181: 3.7999999999999999e-002 | Y181: 57 | Z181: 4.15 | AA181: -1.0800000000000001e-002 | AB181: -1.8799999999999997e-002 | AC181: -7.0599999999999996e-002 | AD181: -7.2700000000000001e-002 | AE181: 84.56 | AF181: 90.25 | AG181: 1 | AH181: AA- | AI181: 6.7400000000000002e-002 | AJ181: =H181+100*O181 -> 131.20999999999998 | AK181: 131.1 | AL181: 130 | AM181: 40.8 | AN181: 133 | AO181: 0. | AP181: 15 | AQ181: 金牌转债!
A182: 193 | B182: 113542 | C182: 好客转债 | D182: 603898 | E182: 好莱客 | F182: 其他 | G182: 家居用品 | H182: 121.01 | I182: 1.54e-002 | J182: 0. | K182: 17.25 | L182: 2.3700000000000002e-002 | M182: 114.9 | N182: 16.27 | O182: 0.14099999999999999 | P182: 106.02 | Q182: 转股中 | R182: 4.70年 | S182: 2.70年 | T182: 6.03 | U182: 1.7 | V182: 2.e-003 | W182: 0.11199999999999999 | X182: 0.11900000000000001 | Y182: 54 | Z182: 2.19 | AA182: -1.1200000000000002e-002 | AB182: -1.67e-002 | AC182: -5.3899999999999997e-002 | AD182: -5.5999999999999994e-002 | AE182: 91.29 | AF182: 93.86 | AG182: 0.65 | AH182: AA | AI182: 4.4900000000000002e-002 | AJ182: =H182+100*O182 -> 135.11000000000001 | AK182: 136 | AL182: 175 | AM182: 42.1 | AN182: 149 | AO182: 5.9999999999999998e-002 | AP182: 18 | AQ182: 好客转债
A183: 175 | B183: 110060 | C183: 天路转债! | D183: 600326 | E183: 西藏天路 | F183: 建筑 | G183: 水泥 | H183: 121.4 | I183: -1.1399999999999999e-002 | J183: 8.6999999999999994e-003 | K183: 8 | L183: -3.7000000000000002e-003 | M183: 114.9 | N183: 7.16 | O183: 8.6999999999999994e-002 | P183: 111.73 | Q183: 转股中 | R183: 4.94年 | S183: 2.94年 | T183: 7.06 | U183: 7.7 | V183: 9.0000000000000011e-003 | W183: 9.6000000000000002e-002 | X183: 0.107 | Y183: 73 | Z183: 1.97 | AA183: -1.1299999999999999e-002 | AB183: -1.66e-002 | AC183: -5.0799999999999998e-002 | AD183: -5.2699999999999997e-002 | AE183: 90.33 | AF183: 92.87 | AG183: 0.72 | AH183: AA | AI183: 4.4900000000000002e-002 | AJ183: =H183+100*O183 -> 130.09999999999999 | AK183: 131.1 | AL183: 131 | AM183: 38.2 | AN183: 115 | AO183: 2.2000000000000002e-002 | AP183: 12 | AQ183: 天路转债!
A184: 22 | B184: 123065 | C184: 宝莱转债! | D184: 300246 | E184: 宝莱特 | F184: 医药 | G184: 医疗器械 | H184: 129.501 | I184: 3.9000000000000003e-003 | J184: 2.0999999999999999e-003 | K184: 29.29 | L184: 1.5600000000000001e-002 | M184: 121.4 | N184: 40.54 | O184: 0.79200000000000004 | P184: 72.25 | Q184: 3月21天 | R184: 5.79年 | S184: 3.79年 | T184: 2.19 | U184: 841 | V184: 2.9399999999999999 | W184: 5.0999999999999997e-002 | X184: 3.7000000000000005e-002 | Y184: 43 | Z184: 5.14 | AA184: -1.1299999999999999e-002 | AB184: -1.7500000000000002e-002 | AC184: -5.3699999999999998e-002 | AD184: -5.5599999999999997e-002 | AE184: 80.81 | AF184: 83.89 | AG184: 0.38 | AH184: AA- | AI184: 6.7400000000000002e-002 | AJ184: =H184+100*O184 -> 208.70100000000002 | AK184: 186.8 | AL184: 291 | AM184: 102.9 | AN184: 293 | AO184: -5.5999999999999994e-002 | AP184: 9 | AQ184: 宝莱转债!
A185: 135 | B185: 113564 | C185: 天目转债 | D185: 603136 | E185: 天目湖 | F185: 旅游餐饮 | G185: 旅游 | H185: 134.57 | I185: 4.6300000000000001e-002 | J185: 3.4999999999999996e-003 | K185: 32.13 | L185: 5.7300000000000004e-002 | M185: 126.7 | N185: 23.8 | O185: -3.0000000000000001e-003 | P185: 135 | Q185: 转股中 | R185: 5.27年 | S185: 3.27年 | T185: 3 | U185: 141 | V185: 0.35700000000000004 | W185: 8.0000000000000002e-002 | X185: 0.109 | Y185: 37 | Z185: 4 | AA185: -1.1599999999999999e-002 | AB185: -1.9699999999999999e-002 | AC185: -7.1399999999999991e-002 | AD185: -7.3700000000000002e-002 | AE185: 83.85 | AF185: 90.57 | AG185: 0.87 | AH185: AA- | AI185: 6.7400000000000002e-002 | AJ185: =H185+100*O185 -> 134.26999999999998 | AK185: 134.1 | AL185: 158 | AM185: 43.6 | AN185: 159 | AO185: 0.14199999999999999 | AP185: 13 | AQ185: 天目转债
A186: 77 | B186: 128113 | C186: 比音转债 | D186: 2832. | E186: 比音勒芬 | F186: 服装纺织 | G186: 服装行业 | H186: 125 | I186: 1.3000000000000001e-002 | J186: 3.4999999999999996e-003 | K186: 17.97 | L186: 2.1000000000000001e-002 | M186: 117.3 | N186: 14.9 | O186: 3.6000000000000004e-002 | P186: 120.6 | Q186: 31天 | R186: 5.57年 | S186: 3.57年 | T186: 6.89 | U186: 8 | V186: 9.0000000000000011e-003 | W186: 7.2999999999999995e-002 | X186: 8.8000000000000009e-002 | Y186: 94 | Z186: 4.38 | AA186: -1.1599999999999999e-002 | AB186: -1.6899999999999998e-002 | AC186: -4.9000000000000002e-002 | AD186: -5.0799999999999998e-002 | AE186: 87.78 | AF186: 91.57 | AG186: 0.79 | AH186: AA | AI186: 4.6399999999999997e-002 | AJ186: =H186+100*O186 -> 128.59999999999999 | AK186: 129.4 | AL186: 109 | AM186: 37.8 | AN186: 112 | AO186: 1.3999999999999999e-002 | AP186: 5 | AQ186: 比音转债
A187: 191 | B187: 128071 | C187: 合兴转债! | D187: 2228. | E187: 合兴包装 | F187: 造纸包装 | G187: 包装材料 | H187: 121.237 | I187: -4.5999999999999999e-003 | J187: 1.8e-003 | K187: 4.66 | L187: -4.3e-003 | M187: 114.8 | N187: 4.28 | O187: 0.114 | P187: 108.88 | Q187: 转股中 | R187: 4.74年 | S187: 2.74年 | T187: 3 | U187: 64 | V187: 0.17699999999999999 | W187: 5.2000000000000005e-002 | X187: 5.7000000000000002e-002 | Y187: 58 | Z187: 1.73 | AA187: -1.1699999999999999e-002 | AB187: -1.7100000000000001e-002 | AC187: -5.4100000000000002e-002 | AD187: -5.6100000000000004e-002 | AE187: 91.03 | AF187: 93.59 | AG187: 0.67 | AH187: AA | AI187: 4.4900000000000002e-002 | AJ187: =H187+100*O187 -> 132.637 | AK187: 133.6 | AL187: 154 | AM187: 40 | AN187: 129 | AO187: 2.8999999999999998e-002 | AP187: 25 | AQ187: 合兴转债!
A188: 101 | B188: 113577 | C188: 春秋转债 | D188: 603890 | E188: 春秋电子 | F188: 电子 | G188: 电子产品 | H188: 126.17 | I188: -9.300000000000001e-003 | J188: 5.6000000000000008e-003 | K188: 13.73 | L188: -4.4000000000000003e-003 | M188: 118.2 | N188: 11.06 | O188: 1.6e-002 | P188: 124.14 | Q188: 转股中 | R188: 5.40年 | S188: 3.40年 | T188: 2.32 | U188: 5 | V188: 1.7000000000000001e-002 | W188: 4.4000000000000004e-002 | X188: 5.5e-002 | Y188: 53 | Z188: 3.14 | AA188: -1.23e-002 | AB188: -1.8000000000000002e-002 | AC188: -5.2999999999999999e-002 | AD188: -5.5e-002 | AE188: 82.76 | AF188: 83.81 | AG188: 0.84 | AH188: AA- | AI188: 6.7400000000000002e-002 | AJ188: =H188+100*O188 -> 127.77 | AK188: 128.2 | AL188: 95 | AM188: 44.4 | AN188: 167 | AO188: -9.0000000000000011e-003 | AP188: 10 | AQ188: 春秋转债
A189: 88 | B189: 128109 | C189: 楚江转债 | D189: 2171. | E189: 楚江新材 | F189: 有色金属 | G189: 铜金属 | H189: 123.35 | I189: -5.1000000000000004e-003 | J189: 1.03e-002 | K189: 9.36 | L189: 7.4999999999999997e-003 | M189: 115.3 | N189: 8.73 | O189: 0.14999999999999999 | P189: 107.22 | Q189: 20天 | R189: 5.54年 | S189: 3.54年 | T189: 18.3 | U189: 30 | V189: 1.3999999999999999e-002 | W189: 0.14699999999999999 | X189: 0.157 | Y189: 125 | Z189: 2.27 | AA189: -1.23e-002 | AB189: -1.72e-002 | AC189: -4.5899999999999996e-002 | AD189: -4.7800000000000002e-002 | AE189: 87.9 | AF189: 90.14 | AG189: 0.69 | AH189: AA | AI189: 4.6399999999999997e-002 | AJ189: =H189+100*O189 -> 138.34999999999999 | AK189: 139.5 | AL189: 203 | AM189: 49.3 | AN189: 205 | AO189: -2.4e-002 | AP189: 6 | AQ189: 楚江转债
A190: 174 | B190: 113548 | C190: 石英转债! | D190: 603688 | E190: 石英股份 | F190: 电子 | G190: 电子产品 | H190: 132.22 | I190: 2.e-003 | J190: -7.000000000000001e-004 | K190: 18.91 | L190: 1.6000000000000001e-003 | M190: 124.4 | N190: 15.1 | O190: 5.5999999999999994e-002 | P190: 125.23 | Q190: 转股中 | R190: 4.94年 | S190: 2.94年 | T190: 1.23 | U190: 4.5 | V190: 2.7999999999999997e-002 | W190: 1.8000000000000002e-002 | X190: 2.3e-002 | Y190: 67 | Z190: 3.54 | AA190: -1.2500000000000001e-002 | AB190: -2.06e-002 | AC190: -7.4200000000000002e-002 | AD190: -7.6600000000000001e-002 | AE190: 85.75 | AF190: 91.42 | AG190: 0.82 | AH190: AA- | AI190: 6.59e-002 | AJ190: =H190+100*O190 -> 137.81999999999999 | AK190: 139.2 | AL190: 201 | AM190: 47.8 | AN190: 196 | AO190: -2.8999999999999998e-002 | AP190: 11 | AQ190: 石英转债!
A191: 80 | B191: 128111 | C191: 中矿转债 | D191: 2738. | E191: 中矿资源 | F191: 有色金属 | G191: 有色行业 | H191: 133.7 | I191: 1.8100000000000002e-002 | J191: 2.0299999999999999e-002 | K191: 21.95 | L191: 4.2800000000000005e-002 | M191: 124.7 | N191: 15.53 | O191: -5.4000000000000006e-002 | P191: 141.34 | Q191: 27天 | R191: 5.56年 | S191: 3.56年 | T191: 8 | U191: 62 | V191: 5.7999999999999996e-002 | W191: 0.13100000000000001 | X191: 0.185 | Y191: 61 | Z191: 2.27 | AA191: -1.2699999999999999e-002 | AB191: -2.e-002 | AC191: -6.4399999999999999e-002 | AD191: -6.6500000000000004e-002 | AE191: 82.31 | AF191: 87.53 | AG191: 0.9 | AH191: AA- | AI191: 6.7400000000000002e-002 | AJ191: =H191+100*O191 -> 128.29999999999998 | AK191: 126.1 | AL191: 66 | AM191: 38.5 | AN191: 116 | AO191: 7.4999999999999997e-002 | AP191: 7 | AQ191: 中矿转债
A192: 90 | B192: 127017 | C192: 万青转债 | D192: 789. | E192: 万年青 | F192: 建筑 | G192: 水泥 | H192: 127.1 | I192: -1.06e-002 | J192: 4.0999999999999995e-003 | K192: 15.79 | L192: -9.3999999999999986e-003 | M192: 118.4 | N192: 14.16 | O192: 0.14000000000000001 | P192: 111.51 | Q192: 19天 | R192: 5.53年 | S192: 3.53年 | T192: 10 | U192: 20 | V192: 1.6e-002 | W192: 7.9000000000000001e-002 | X192: 8.900000000000001e-002 | Y192: 126 | Z192: 2.27 | AA192: -1.3000000000000001e-002 | AB192: -1.8600000000000002e-002 | AC192: -5.3899999999999997e-002 | AD192: -5.5599999999999997e-002 | AE192: 88.47 | AF192: 93.53 | AG192: 0.69 | AH192: AA+ | AI192: 4.4400000000000002e-002 | AJ192: =H192+100*O192 -> 141.09999999999999 | AK192: 142.7 | AL192: 224 | AM192: 49.2 | AN192: 204 | AO192: 5.7000000000000002e-002 | AP192: 7 | AQ192: 万青转债
A193: 250 | B193: 128048 | C193: 张行转债 | D193: 2839. | E193: 张家港行 | F193: 金融 | G193: 银行行业 | H193: 119.32 | I193: -9.0000000000000011e-003 | J193: 2.8999999999999998e-003 | K193: 6.04 | L193: -9.7999999999999997e-003 | M193: 113.3 | N193: 5.76 | O193: 0.13800000000000001 | P193: 104.86 | Q193: 转股中 | R193: 3.98年 | S193: 无权 | T193: 25 | U193: 40 | V193: 1.3000000000000001e-002 | W193: 0.22899999999999998 | X193: 0.23999999999999999 | Y193: 109 | Z193: 1.04 | AA193: -1.3100000000000001e-002 | AB193: -1.9099999999999999e-002 | AC193: 无权 | AD193: 无权 | AE193: 无权 | AF193: 96.14 | AG193: 0.62 | AH193: AA+ | AI193: 4.2900000000000001e-002 | AJ193: =H193+100*O193 -> 133.12 | AK193: 133.8 | AL193: 155 | AM193: 37.6 | AN193: 109 | AO193: 1.1000000000000001e-002 | AP193: 14 | AQ193: 张行转债
A194: 126 | B194: 110067 | C194: 华安转债! | D194: 600909 | E194: 华安证券 | F194: 金融 | G194: 证券行业 | H194: 118.69 | I194: -4.4000000000000003e-003 | J194: 4.4000000000000003e-003 | K194: 8.19 | L194: 0. | M194: 110.5 | N194: 8.67 | O194: 0.25600000000000001 | P194: 94.46 | Q194: 转股中 | R194: 5.31年 | S194: 无权 | T194: 28 | U194: 39 | V194: 1.2e-002 | W194: 9.4e-002 | X194: 8.900000000000001e-002 | Y194: 297 | Z194: 2.14 | AA194: -1.3500000000000002e-002 | AB194: -1.7100000000000001e-002 | AC194: 无权 | AD194: 无权 | AE194: 无权 | AF194: 89.35 | AG194: 0.56 | AH194: AAA | AI194: 4.1399999999999999e-002 | AJ194: =H194+100*O194 -> 144.28999999999999 | AK194: 142.9 | AL194: 226 | AM194: 53.6 | AN194: 221 | AO194: 2.e-003 | AP194: 26 | AQ194: 华安转债!
A195: 313 | B195: 110033 | C195: 国贸转债! | D195: 600755 | E195: 厦门国贸 | F195: 交通运输 | G195: 交通运输 | H195: 111.43 | I195: 1.1999999999999999e-003 | J195: -1.8e-003 | K195: 7.28 | L195: -1.4000000000000002e-003 | M195: 109.7 | N195: 7.19 | O195: 0.10099999999999999 | P195: 101.25 | Q195: 转股中 | R195: 1年46天 | S195: 回售中 | T195: 12.1 | U195: 11 | V195: 8.0000000000000002e-003 | W195: 8.900000000000001e-002 | X195: 8.9999999999999997e-002 | Y195: 136 | Z195: 0.94 | AA195: -1.3999999999999999e-002 | AB195: -2.9600000000000001e-002 | AC195: 回售中 | AD195: 回售中 | AE195: 100.28 | AF195: 105.12 | AG195: 0.42 | AH195: AAA | AI195: 3.9199999999999999e-002 | AJ195: =H195+100*O195 -> 121.53 | AK195: 121.6 | AL195: 18 | AM195: 16.5 | AN195: 3 | AO195: 5.2999999999999999e-002 | AP195: 19 | AQ195: 国贸转债!
A196: 125 | B196: 123044 | C196: 红相转债! | D196: 300427 | E196: 红相股份 | F196: 能源电力 | G196: 电力设备 | H196: 135.001 | I196: 7.4999999999999997e-003 | J196: -1.3999999999999999e-002 | K196: 23.81 | L196: -7.9000000000000008e-003 | M196: 125.5 | N196: 18.8 | O196: 6.6000000000000003e-002 | P196: 126.65 | Q196: 转股中 | R196: 5.31年 | S196: 3.31年 | T196: 5.5 | U196: 69 | V196: 9.1999999999999998e-002 | W196: 6.4000000000000001e-002 | X196: 8.1000000000000003e-002 | Y196: 86 | Z196: 3.76 | AA196: -1.3999999999999999e-002 | AB196: -2.18e-002 | AC196: -7.0699999999999999e-002 | AD196: -7.3099999999999998e-002 | AE196: 83.99 | AF196: 89.6 | AG196: 0.83 | AH196: AA- | AI196: 6.7400000000000002e-002 | AJ196: =H196+100*O196 -> 141.601 | AK196: 143.4 | AL196: 229 | AM196: 53.7 | AN196: 223 | AO196: -3.2000000000000001e-002 | AP196: 16 | AQ196: 红相转债!
A197: 170 | B197: 123035 | C197: 利德转债! | D197: 300296 | E197: 利亚德 | F197: 电子 | G197: LED制 | H197: 123.498 | I197: -5.9999999999999995e-004 | J197: 1.5e-003 | K197: 7.74 | L197: 1.2999999999999999e-003 | M197: 115.1 | N197: 6.98 | O197: 0.114 | P197: 110.89 | Q197: 转股中 | R197: 4.98年 | S197: 2.98年 | T197: 8 | U197: 10 | V197: 1.e-002 | W197: 4.0999999999999995e-002 | X197: 4.4999999999999998e-002 | Y197: 197 | Z197: 2.3 | AA197: -1.43e-002 | AB197: -1.9599999999999999e-002 | AC197: -5.4699999999999999e-002 | AD197: -5.67e-002 | AE197: 90.88 | AF197: 93.75 | AG197: 0.69 | AH197: AA+ | AI197: 4.2900000000000001e-002 | AJ197: =H197+100*O197 -> 134.898 | AK197: 136.1 | AL197: 178 | AM197: 42.4 | AN197: 150 | AO197: 3.7000000000000005e-002 | AP197: 16 | AQ197: 利德转债!
A198: 124 | B198: 113572 | C198: 三祥转债! | D198: 603663 | E198: 三祥新材 | F198: 其他 | G198: 其他 | H198: 122.11 | I198: 3.0299999999999997e-002 | J198: 3.2899999999999999e-002 | K198: 16.65 | L198: 7.2800000000000004e-002 | M198: 113.2 | N198: 14.19 | O198: 4.0999999999999995e-002 | P198: 117.34 | Q198: 转股中 | R198: 5.31年 | S198: 3.31年 | T198: 1.7 | U198: 197 | V198: 0.93000000000000005 | W198: 5.2999999999999999e-002 | X198: 6.2e-002 | Y198: 32 | Z198: 5.38 | AA198: -1.44e-002 | AB198: -1.8799999999999997e-002 | AC198: -4.6399999999999997e-002 | AD198: -4.8300000000000003e-002 | AE198: 80 | AF198: 76.49 | AG198: 0.87 | AH198: A+ | AI198: 7.8399999999999997e-002 | AJ198: =H198+100*O198 -> 126.20999999999999 | AK198: 126.9 | AL198: 77 | AM198: 46.9 | AN198: 189 | AO198: 9.6000000000000002e-002 | AP198: 17 | AQ198: 三祥转债!
A199: 150 | B199: 123038 | C199: 联得转债! | D199: 300545 | E199: 联得装备 | F199: 机械装备 | G199: 专用设备 | H199: 128.066 | I199: -6.6e-003 | J199: 2.7000000000000001e-003 | K199: 28.42 | L199: -4.8999999999999998e-003 | M199: 119.1 | N199: 25.29 | O199: 0.14000000000000001 | P199: 112.38 | Q199: 转股中 | R199: 5年35天 | S199: 3年35天 | T199: 1.47 | U199: 42 | V199: 0.222 | W199: 3.5000000000000003e-002 | X199: 4.0000000000000001e-002 | Y199: 42 | Z199: 5.42 | AA199: -1.4499999999999999e-002 | AB199: -2.0799999999999999e-002 | AC199: -6.1600000000000002e-002 | AD199: -6.3899999999999998e-002 | AE199: 81.87 | AF199: 81.87 | AG199: 0.81 | AH199: A+ | AI199: 7.8399999999999997e-002 | AJ199: =H199+100*O199 -> 142.066 | AK199: 143.8 | AL199: 233 | AM199: 61.9 | AN199: 257 | AO199: -3.6000000000000004e-002 | AP199: 16 | AQ199: 联得转债!
A200: 56 | B200: 128121 | C200: 宏川转债 | D200: 2930. | E200: 宏川智慧 | F200: 交通运输 | G200: 物流业 | H200: 122.902 | I200: 8.0000000000000004e-004 | J200: -3.1099999999999999e-002 | K200: 22.05 | L200: -3.7100000000000001e-002 | M200: 113.3 | N200: 20.25 | O200: 0.129 | P200: 108.89 | Q200: 2月6天 | R200: 5.65年 | S200: 3.65年 | T200: 6.7 | U200: 38 | V200: 4.5999999999999999e-002 | W200: 6.8000000000000005e-002 | X200: 7.4999999999999997e-002 | Y200: 98 | Z200: 5.09 | AA200: -1.4499999999999999e-002 | AB200: -1.8700000000000001e-002 | AC200: -4.36e-002 | AD200: -4.5400000000000003e-002 | AE200: 81.1 | AF200: 78.95 | AG200: 0.81 | AH200: AA- | AI200: 6.7400000000000002e-002 | AJ200: =H200+100*O200 -> 135.80199999999999 | AK200: 136.9 | AL200: 181 | AM200: 55.8 | AN200: 234 | AO200: 6.5000000000000002e-002 | AP200: 4 | AQ200: 宏川转债
A201: 278 | B201: 110043 | C201: 无锡转债! | D201: 600908 | E201: 无锡银行 | F201: 金融 | G201: 银行行业 | H201: 114.3 | I201: -6.0999999999999995e-003 | J201: 1.2999999999999999e-003 | K201: 5.68 | L201: -8.6999999999999994e-003 | M201: 109.1 | N201: 5.79 | O201: 0.16500000000000001 | P201: 98.1 | Q201: 转股中 | R201: 3.19年 | S201: 无权 | T201: 30 | U201: 11 | V201: 3.0000000000000001e-003 | W201: 0.28600000000000003 | X201: 0.28000000000000003 | Y201: 105 | Z201: 0.92 | AA201: -1.47e-002 | AB201: -1.9900000000000001e-002 | AC201: 无权 | AD201: 无权 | AE201: 无权 | AF201: 95.62 | AG201: 0.55 | AH201: AA+ | AI201: 4.2900000000000001e-002 | AJ201: =H201+100*O201 -> 130.80000000000001 | AK201: 130.5 | AL201: 125 | AM201: 34.9 | AN201: 72 | AO201: -4.0000000000000001e-003 | AP201: 31 | AQ201: 无锡转债!
A202: 166 | B202: 110062 | C202: 烽火转债 | D202: 600498 | E202: 烽火通信 | F202: 通信互联 | G202: 通信设备 | H202: 119.6 | I202: -3.3e-003 | J202: 3.5999999999999999e-003 | K202: 25.65 | L202: 4.0000000000000002e-004 | M202: 111 | N202: 25.65 | O202: 0.19600000000000001 | P202: 100 | Q202: 转股中 | R202: 5年12天 | S202: 3年12天 | T202: 30.9 | U202: 12 | V202: 3.0000000000000001e-003 | W202: 0.10300000000000001 | X202: 0.10300000000000001 | Y202: 300 | Z202: 2.82 | AA202: -1.4999999999999999e-002 | AB202: -1.89e-002 | AC202: -4.4600000000000001e-002 | AD202: -4.6500000000000007e-002 | AE202: 91.02 | AF202: 90.87 | AG202: 0.63 | AH202: AAA | AI202: 4.1399999999999999e-002 | AJ202: =H202+100*O202 -> 139.19999999999999 | AK202: 139.2 | AL202: 200 | AM202: 48.2 | AN202: 201 | AO202: 3.7999999999999999e-002 | AP202: 19 | AQ202: 烽火转债
A203: 198 | B203: 113027 | C203: 华钰转债!! | D203: 601020 | E203: 华钰矿业 | F203: 有色金属 | G203: 锌铅镍锡 | H203: 123.01 | I203: 2.e-002 | J203: -9.5999999999999992e-003 | K203: 12.08 | L203: 1.26e-002 | M203: 114.9 | N203: 10.17 | O203: 3.6000000000000004e-002 | P203: 118.78 | Q203: 转股中 | R203: 4.56年 | S203: 2.56年 | T203: 3.26 | U203: 69 | V203: 0.17499999999999999 | W203: 4.9000000000000002e-002 | X203: 5.7999999999999996e-002 | Y203: 67 | Z203: 2.76 | AA203: -1.5100000000000001e-002 | AB203: -2.0799999999999999e-002 | AC203: -6.2199999999999998e-002 | AD203: -6.4299999999999996e-002 | AE203: 87.01 | AF203: 86.38 | AG203: 0.83 | AH203: AA- | AI203: 6.59e-002 | AJ203: =H203+100*O203 -> 126.61 | AK203: 127.2 | AL203: 79 | AM203: 40.2 | AN203: 130 | AO203: 0.111 | AP203: 46 | AQ203: 华钰转债!!
A204: 233 | B204: 110051 | C204: 中天转债! | D204: 600522 | E204: 中天科技 | F204: 通信互联 | G204: 通信设备 | H204: 121.6 | I204: -3.3e-003 | J204: 4.5000000000000005e-003 | K204: 11.12 | L204: 1.8e-003 | M204: 113.9 | N204: 10.09 | O204: 0.10300000000000001 | P204: 110.21 | Q204: 转股中 | R204: 4.27年 | S204: 2.27年 | T204: 39.6 | U204: 23 | V204: 5.0000000000000001e-003 | W204: 0.11599999999999999 | X204: 0.128 | Y204: 341 | Z204: 1.56 | AA204: -1.55e-002 | AB204: -2.12e-002 | AC204: -6.4899999999999999e-002 | AD204: -6.7299999999999999e-002 | AE204: 93.43 | AF204: 95.55 | AG204: 0.69 | AH204: AA+ | AI204: 4.2900000000000001e-002 | AJ204: =H204+100*O204 -> 131.90000000000001 | AK204: 133 | AL204: 149 | AM204: 37.4 | AN204: 105 | AO204: 1.9e-002 | AP204: 27 | AQ204: 中天转债!
A205: 49 | B205: 123061 | C205: 航新转债 | D205: 300424 | E205: 航新科技 | F205: 航空航天 | G205: 航空航天 | H205: 136.699 | I205: -2.5099999999999997e-002 | J205: 5.6000000000000008e-003 | K205: 18.82 | L205: -2.3399999999999997e-002 | M205: 124.8 | N205: 14.86 | O205: 7.9000000000000001e-002 | P205: 126.65 | Q205: 2月9天 | R205: 5.67年 | S205: 3.67年 | T205: 2.5 | U205: 555 | V205: 1.6000000000000001 | W205: 5.5e-002 | X205: 7.0000000000000007e-002 | Y205: 45 | Z205: 4.13 | AA205: -1.6299999999999999e-002 | AB205: -2.3300000000000001e-002 | AC205: -6.7900000000000002e-002 | AD205: -6.9900000000000004e-002 | AE205: 81.8 | AF205: 86.98 | AG205: 0.84 | AH205: AA- | AI205: 6.7400000000000002e-002 | AJ205: =H205+100*O205 -> 144.59900000000002 | AK205: 146.7 | AL205: 248 | AM205: 59.8 | AN205: 253 | AO205: -7.4999999999999997e-002 | AP205: 9 | AQ205: 航新转债
A206: 75 | B206: 123055 | C206: 晨光转债 | D206: 300138 | E206: 晨光生物 | F206: 食品饮料 | G206: 食品加工 | H206: 136.083 | I206: -1.3500000000000002e-002 | J206: 6.3e-003 | K206: 17.4 | L206: -8.0000000000000002e-003 | M206: 124.3 | N206: 12.25 | O206: -4.2000000000000003e-002 | P206: 142.04 | Q206: 33天 | R206: 5.57年 | S206: 3.57年 | T206: 6.3 | U206: 31 | V206: 3.6000000000000004e-002 | W206: 7.0999999999999994e-002 | X206: 0.10000000000000001 | Y206: 89 | Z206: 4.63 | AA206: -1.6399999999999998e-002 | AB206: -2.35e-002 | AC206: -6.9599999999999995e-002 | AD206: -7.1500000000000008e-002 | AE206: 81.91 | AF206: 87.12 | AG206: 0.9 | AH206: AA- | AI206: 6.7400000000000002e-002 | AJ206: =H206+100*O206 -> 131.88300000000001 | AK206: 130.1 | AL206: 120 | AM206: 43 | AN206: 155 | AO206: -1.e-003 | AP206: 8 | AQ206: 晨光转债
A207: 171 | B207: 110061 | C207: 川投转债 | D207: 600674 | E207: 川投能源 | F207: 能源电力 | G207: 水电 | H207: 120.2 | I207: -6.0999999999999995e-003 | J207: 1.0200000000000001e-002 | K207: 10.29 | L207: 5.8999999999999999e-003 | M207: 110.8 | N207: 9.58 | O207: 0.11900000000000001 | P207: 107.41 | Q207: 转股中 | R207: 4.98年 | S207: 2.98年 | T207: 40 | U207: 28 | V207: 6.0000000000000001e-003 | W207: 8.8000000000000009e-002 | X207: 9.5000000000000001e-002 | Y207: 453 | Z207: 1.64 | AA207: -1.6500000000000001e-002 | AB207: -2.0400000000000001e-002 | AC207: -4.7400000000000005e-002 | AD207: -4.9299999999999997e-002 | AE207: 91.44 | AF207: 91.52 | AG207: 0.7 | AH207: AAA | AI207: 3.9900000000000005e-002 | AJ207: =H207+100*O207 -> 132.09999999999999 | AK207: 133 | AL207: 148 | AM207: 41.5 | AN207: 142 | AO207: 1.6e-002 | AP207: 15 | AQ207: 川投转债
A208: 195 | B208: 128070 | C208: 智能转债! | D208: 2877. | E208: 智能自控 | F208: 机械装备 | G208: 通用设备 | H208: 127.002 | I208: -4.0000000000000002e-004 | J208: 3.5999999999999999e-003 | K208: 7.86 | L208: 6.4000000000000003e-003 | M208: 117.6 | N208: 9.51 | O208: 0.53700000000000003 | P208: 82.65 | Q208: 转股中 | R208: 4.61年 | S208: 无权 | T208: 2.3 | U208: 545 | V208: 1.8600000000000001 | W208: 8.8000000000000009e-002 | X208: 7.2999999999999995e-002 | Y208: 26 | Z208: 3.66 | AA208: -1.6899999999999998e-002 | AB208: -2.3399999999999997e-002 | AC208: 无权 | AD208: 无权 | AE208: 无权 | AF208: 84.23 | AG208: 0.51 | AH208: A+ | AI208: 7.690000000000001e-002 | AJ208: =H208+100*O208 -> 180.702 | AK208: 171.4 | AL208: 281 | AM208: 87.1 | AN208: 285 | AO208: 1.3999999999999999e-002 | AP208: 32 | AQ208: 智能转债!
A209: 5 | B209: 113605 | C209: 大参转债 | D209: 603233 | E209: 大参林 | F209: 医药 | G209: 医药商业 | H209: 127.8 | I209: -8.5000000000000006e-003 | J209: 8.5000000000000006e-003 | K209: 88.8 | L209: 0. | M209: 115.2 | N209: 83.85 | O209: 0.20699999999999999 | P209: 105.9 | Q209: 5月9天 | R209: 5.92年 | S209: 3.92年 | T209: 14.1 | U209: 60 | V209: 3.3000000000000002e-002 | W209: 2.4e-002 | X209: 2.6000000000000002e-002 | Y209: 583 | Z209: 11.67 | AA209: -1.77e-002 | AB209: -2.2099999999999998e-002 | AC209: -5.0199999999999995e-002 | AD209: -5.1799999999999999e-002 | AE209: 86.29 | AF209: 88.49 | AG209: 0.7 | AH209: AA | AI209: 4.6399999999999997e-002 | AJ209: =H209+100*O209 -> 148.5 | AK209: 149.7 | AL209: 255 | AM209: 61.2 | AN209: 255 | AO209: -3.7000000000000005e-002 | AP209: 2 | AQ209: 大参转债
A210: 267 | B210: 128040 | C210: 华通转债! | D210: 2758. | E210: 华通医药 | F210: 医药 | G210: 医药商业 | H210: 119.831 | I210: -1.2999999999999999e-003 | J210: -2.8000000000000004e-003 | K210: 11.91 | L210: -5.7999999999999996e-003 | M210: 112.3 | N210: 11.29 | O210: 0.13600000000000001 | P210: 105.49 | Q210: 转股中 | R210: 3.56年 | S210: 1.56年 | T210: 2.22 | U210: 9.4 | V210: 3.5000000000000003e-002 | W210: 8.900000000000001e-002 | X210: 9.4e-002 | Y210: 25 | Z210: 3.94 | AA210: -1.84e-002 | AB210: -2.4500000000000001e-002 | AC210: -8.539999999999999e-002 | AD210: -8.8100000000000012e-002 | AE210: 92.13 | AF210: 89.86 | AG210: 0.7 | AH210: AA- | AI210: 6.59e-002 | AJ210: =H210+100*O210 -> 133.43100000000001 | AK210: 134.2 | AL210: 159 | AM210: 42 | AN210: 147 | AO210: 2.9999999999999999e-002 | AP210: 30 | AQ210: 华通转债!
A211: 268 | B211: 128039 | C211: 三力转债! | D211: 2224. | E211: 三 力 士 | F211: 机械装备 | G211: 专用设备 | H211: 117.205 | I211: -1.01e-002 | J211: 7.7000000000000002e-003 | K211: 6.35 | L211: -3.0999999999999999e-003 | M211: 109.8 | N211: 5.81 | O211: 7.2000000000000008e-002 | P211: 109.29 | Q211: 转股中 | R211: 3.55年 | S211: 1.55年 | T211: 2.03 | U211: 37 | V211: 0.155 | W211: 4.4000000000000004e-002 | X211: 4.8000000000000001e-002 | Y211: 46 | Z211: 1.98 | AA211: -1.8500000000000003e-002 | AB211: -2.35e-002 | AC211: -7.5499999999999998e-002 | AD211: -7.8100000000000003e-002 | AE211: 92 | AF211: 87.92 | AG211: 0.76 | AH211: AA- | AI211: 6.59e-002 | AJ211: =H211+100*O211 -> 124.405 | AK211: 125.1 | AL211: 55 | AM211: 33.1 | AN211: 53 | AO211: 1.e-003 | AP211: 21 | AQ211: 三力转债!
A212: 86 | B212: 123052 | C212: 飞鹿转债 | D212: 300665 | E212: 飞鹿股份 | F212: 化工 | G212: 化工 | H212: 141.14 | I212: -1.37e-002 | J212: 1.18e-002 | K212: 13.77 | L212: -2.2000000000000001e-003 | M212: 127.3 | N212: 9.9 | O212: 1.4999999999999999e-002 | P212: 139.09 | Q212: 21天 | R212: 5.54年 | S212: 3.54年 | T212: 1.77 | U212: 115 | V212: 0.46000000000000002 | W212: 0.106 | X212: 0.14699999999999999 | Y212: 17 | Z212: 3.55 | AA212: -1.89e-002 | AB212: -2.6699999999999998e-002 | AC212: -7.7100000000000002e-002 | AD212: -7.9399999999999998e-002 | AE212: 79.86 | AF212: 84.71 | AG212: 0.89 | AH212: A+ | AI212: 7.8399999999999997e-002 | AJ212: =H212+100*O212 -> 142.63999999999999 | AK212: 143.2 | AL212: 228 | AM212: 58.5 | AN212: 242 | AO212: -2.7000000000000003e-002 | AP212: 13 | AQ212: 飞鹿转债
A213: 183 | B213: 123032 | C213: 万里转债!! | D213: 300591 | E213: 万里马 | F213: 服装纺织 | G213: 服装纺织 | H213: 144.9 | I213: -6.6400000000000001e-002 | J213: 4.8499999999999995e-002 | K213: 8.79 | L213: -1.7899999999999999e-002 | M213: 132 | N213: 6.89 | O213: 0.13600000000000001 | P213: 127.58 | Q213: 转股中 | R213: 4.89年 | S213: 2.89年 | T213: 0.62 | U213: 300 | V213: 3.25 | W213: 2.1000000000000001e-002 | X213: 2.7000000000000003e-002 | Y213: 29 | Z213: 5.79 | AA213: -1.95e-002 | AB213: -2.9600000000000001e-002 | AC213: -9.5799999999999996e-002 | AD213: -9.9399999999999988e-002 | AE213: 85.76 | AF213: 93.09 | AG213: 1 | AH213: A+ | AI213: 7.690000000000001e-002 | AJ213: =H213+100*O213 -> 158.5 | AK213: 162.2 | AL213: 274 | AM213: 69.1 | AN213: 271 | AO213: -0.128 | AP213: 41 | AQ213: 万里转债!!
A214: 209 | B214: 113025 | C214: 明泰转债! | D214: 601677 | E214: 明泰铝业 | F214: 有色金属 | G214: 铝金属 | H214: 125.52 | I214: 1.23e-002 | J214: -5.8999999999999999e-003 | K214: 13.43 | L214: 8.3000000000000001e-003 | M214: 115.1 | N214: 11.2 | O214: 4.7e-002 | P214: 119.91 | Q214: 转股中 | R214: 4.39年 | S214: 2.39年 | T214: 14 | U214: 71 | V214: 4.0999999999999995e-002 | W214: 0.16899999999999998 | X214: 0.20199999999999999 | Y214: 83 | Z214: 1.1 | AA214: -1.9900000000000001e-002 | AB214: -2.5899999999999999e-002 | AC214: -7.3700000000000002e-002 | AD214: -7.5999999999999998e-002 | AE214: 92.57 | AF214: 95.32 | AG214: 0.77 | AH214: AA | AI214: 4.4900000000000002e-002 | AJ214: =H214+100*O214 -> 130.22 | AK214: 131.1 | AL214: 132 | AM214: 35.8 | AN214: 87 | AO214: -3.3000000000000002e-002 | AP214: 32 | AQ214: 明泰转债!
A215: 105 | B215: 128106 | C215: 华统转债 | D215: 2840. | E215: 华统股份 | F215: 农业 | G215: 农产品加 | H215: 125.9 | I215: 1.2999999999999999e-003 | J215: 8.0000000000000004e-004 | K215: 11.84 | L215: 2.5000000000000001e-003 | M215: 113.2 | N215: 9.39 | O215: -2.e-003 | P215: 126.09 | Q215: 转股中 | R215: 5.39年 | S215: 3.39年 | T215: 5.5 | U215: 94 | V215: 0.13600000000000001 | W215: 0.10400000000000001 | X215: 0.13100000000000001 | Y215: 53 | Z215: 3.16 | AA215: -1.9900000000000001e-002 | AB215: -2.4199999999999999e-002 | AC215: -5.3600000000000002e-002 | AD215: -5.5399999999999998e-002 | AE215: 88.4 | AF215: 89.1 | AG215: 0.84 | AH215: AA | AI215: 4.6399999999999997e-002 | AJ215: =H215+100*O215 -> 125.7 | AK215: 125.7 | AL215: 63 | AM215: 36.6 | AN215: 97 | AO215: 0.157 | AP215: 7 | AQ215: 华统转债
A216: 295 | B216: 110038 | C216: 济川转债! | D216: 600566 | E216: 济川药业 | F216: 医药 | G216: 中药 | H216: 112.06 | I216: -8.9999999999999998e-004 | J216: -1.e-003 | K216: 22.45 | L216: -4.4000000000000003e-003 | M216: 107.5 | N216: 23.85 | O216: 0.19 | P216: 94.13 | Q216: 转股中 | R216: 1.98年 | S216: 回售中 | T216: 6.28 | U216: 0.5 | V216: 1.e-003 | W216: 3.1e-002 | X216: 2.9999999999999999e-002 | Y216: 199 | Z216: 2.71 | AA216: -2.0899999999999998e-002 | AB216: -2.7799999999999998e-002 | AC216: 回售中 | AD216: 回售中 | AE216: 100.25 | AF216: 98.73 | AG216: 0.42 | AH216: AA | AI216: 4.4199999999999996e-002 | AJ216: =H216+100*O216 -> 131.06 | AK216: 130 | AL216: 119 | AM216: 29.7 | AN216: 26 | AO216: 4.0000000000000001e-003 | AP216: 20 | AQ216: 济川转债!
A217: 180 | B217: 128078 | C217: 太极转债! | D217: 2368. | E217: 太极股份 | F217: 计算机及 | G217: 软件开发 | H217: 129.5 | I217: 6.5000000000000006e-003 | J217: -5.0000000000000001e-004 | K217: 26.84 | L217: 6.0000000000000001e-003 | M217: 116.9 | N217: 22.4 | O217: 8.1000000000000003e-002 | P217: 119.82 | Q217: 转股中 | R217: 4.92年 | S217: 2.92年 | T217: 9.6 | U217: 11 | V217: 9.0000000000000011e-003 | W217: 6.2e-002 | X217: 7.400000000000001e-002 | Y217: 156 | Z217: 5.06 | AA217: -2.0899999999999998e-002 | AB217: -2.6800000000000001e-002 | AC217: -7.0900000000000005e-002 | AD217: -7.2800000000000004e-002 | AE217: 90.41 | AF217: 94.56 | AG217: 1 | AH217: AA | AI217: 4.4900000000000002e-002 | AJ217: =H217+100*O217 -> 137.59999999999999 | AK217: 139.2 | AL217: 199 | AM217: 44.6 | AN217: 172 | AO217: -1.e-002 | AP217: 12 | AQ217: 太极转债!
A218: 13 | B218: 110075 | C218: 南航转债 | D218: 600029 | E218: 南方航空 | F218: 交通运输 | G218: 航空运输 | H218: 124.53 | I218: -1.0500000000000001e-002 | J218: 9.4999999999999998e-003 | K218: 6.24 | L218: -1.6000000000000001e-003 | M218: 110 | N218: 6.24 | O218: 0.245 | P218: 100 | Q218: 5月2天 | R218: 5.90年 | S218: 3.90年 | T218: 160 | U218: 138 | V218: 6.9999999999999993e-003 | W218: 0.16699999999999998 | X218: 0.16699999999999998 | Y218: 957 | Z218: 1.33 | AA218: -2.1000000000000001e-002 | AB218: -2.4e-002 | AC218: -4.7500000000000001e-002 | AD218: -4.8499999999999995e-002 | AE218: 86.77 | AF218: 86.83 | AG218: 0.64 | AH218: AAA | AI218: 4.1399999999999999e-002 | AJ218: =H218+100*O218 -> 149.03 | AK218: 149.1 | AL218: 253 | AM218: 62.2 | AN218: 259 | AO218: 7.0000000000000007e-002 | AP218: 7 | AQ218: 南航转债
A219: 108 | B219: 113034 | C219: 滨化转债 | D219: 601678 | E219: 滨化股份 | F219: 化工 | G219: 化工 | H219: 129.22 | I219: 3.1600000000000003e-002 | J219: 4.0999999999999995e-003 | K219: 6.11 | L219: 4.2699999999999995e-002 | M219: 115.1 | N219: 4.68 | O219: -1.e-002 | P219: 130.56 | Q219: 转股中 | R219: 5.39年 | S219: 3.39年 | T219: 21.7 | U219: 241 | V219: 8.6999999999999994e-002 | W219: 0.23000000000000001 | X219: 0.29999999999999999 | Y219: 94 | Z219: 1.51 | AA219: -2.1600000000000001e-002 | AB219: -2.64e-002 | AC219: -6.08e-002 | AD219: -6.25e-002 | AE219: 88.31 | AF219: 90.57 | AG219: 0.84 | AH219: AA | AI219: 4.6399999999999997e-002 | AJ219: =H219+100*O219 -> 128.22 | AK219: 127.9 | AL219: 89 | AM219: 37.3 | AN219: 104 | AO219: 8.8000000000000009e-002 | AP219: 28 | AQ219: 滨化转债
A220: 202 | B220: 113536 | C220: 三星转债 | D220: 603578 | E220: 三星新材 | F220: 家电 | G220: 零部件制 | H220: 127.06 | I220: -8.9999999999999998e-004 | J220: 1.1999999999999999e-003 | K220: 24.66 | L220: 4.0000000000000002e-004 | M220: 114.8 | N220: 19.54 | O220: 6.9999999999999993e-003 | P220: 126.2 | Q220: 转股中 | R220: 4.53年 | S220: 2.53年 | T220: 1.49 | U220: 11 | V220: 5.5999999999999994e-002 | W220: 6.6000000000000003e-002 | X220: 8.3000000000000004e-002 | Y220: 23 | Z220: 3.24 | AA220: -2.2599999999999999e-002 | AB220: -2.8199999999999999e-002 | AC220: -7.46e-002 | AD220: -7.6700000000000004e-002 | AE220: 91.88 | AF220: 94.47 | AG220: 0.79 | AH220: AA | AI220: 4.4900000000000002e-002 | AJ220: =H220+100*O220 -> 127.76000000000001 | AK220: 127.9 | AL220: 91 | AM220: 33.5 | AN220: 57 | AO220: 2.4e-002 | AP220: 39 | AQ220: 三星转债
A221: 106 | B221: 123048 | C221: 应急转债! | D221: 300527 | E221: 中船应急 | F221: 机械装备 | G221: 专用设备 | H221: 128.51 | I221: -1.41e-002 | J221: 2.5000000000000001e-003 | K221: 11.08 | L221: -1.4199999999999999e-002 | M221: 113.1 | N221: 8.9 | O221: 3.2000000000000001e-002 | P221: 124.49 | Q221: 转股中 | R221: 5.39年 | S221: 3.39年 | T221: 3.8 | U221: 444 | V221: 0.89500000000000002 | W221: 3.7999999999999999e-002 | X221: 4.7e-002 | Y221: 101 | Z221: 4.28 | AA221: -2.3799999999999998e-002 | AB221: -2.81e-002 | AC221: -5.9299999999999999e-002 | AD221: -6.1100000000000002e-002 | AE221: 88.91 | AF221: 89.91 | AG221: 0.81 | AH221: AA+ | AI221: 4.4400000000000002e-002 | AJ221: =H221+100*O221 -> 131.70999999999998 | AK221: 132.5 | AL221: 141 | AM221: 42.6 | AN221: 152 | AO221: -5.2999999999999999e-002 | AP221: 16 | AQ221: 应急转债!
A222: 152 | B222: 110065 | C222: 淮矿转债! | D222: 600985 | E222: 淮北矿业 | F222: 煤炭 | G222: 煤炭开采 | H222: 125.5 | I222: 5.6000000000000008e-003 | J222: 5.1999999999999998e-003 | K222: 11.3 | L222: 1.3500000000000002e-002 | M222: 111 | N222: 9.33 | O222: 3.6000000000000004e-002 | P222: 121.11 | Q222: 转股中 | R222: 5年33天 | S222: 3年33天 | T222: 27.6 | U222: 21 | V222: 6.0000000000000001e-003 | W222: 0.11199999999999999 | X222: 0.13600000000000001 | Y222: 245 | Z222: 1.19 | AA222: -2.4300000000000002e-002 | AB222: -2.81e-002 | AC222: -5.7999999999999996e-002 | AD222: -5.9800000000000006e-002 | AE222: 90.81 | AF222: 90.66 | AG222: 0.81 | AH222: AAA | AI222: 4.1399999999999999e-002 | AJ222: =H222+100*O222 -> 129.09999999999999 | AK222: 129.9 | AL222: 117 | AM222: 39.1 | AN222: 121 | AO222: 5.9000000000000004e-002 | AP222: 21 | AQ222: 淮矿转债!
A223: 122 | B223: 123045 | C223: 雷迪转债 | D223: 300652 | E223: 雷迪克 | F223: 汽车 | G223: 零部件制 | H223: 136 | I223: -1.9e-002 | J223: 1.4999999999999999e-002 | K223: 26.55 | L223: -4.5000000000000005e-003 | M223: 119.4 | N223: 20.13 | O223: 3.1e-002 | P223: 131.89 | Q223: 转股中 | R223: 5.31年 | S223: 3.31年 | T223: 1.66 | U223: 412 | V223: 1.8 | W223: 6.7000000000000004e-002 | X223: 8.8000000000000009e-002 | Y223: 25 | Z223: 2.93 | AA223: -2.4799999999999999e-002 | AB223: -3.0800000000000001e-002 | AC223: -7.3700000000000002e-002 | AD223: -7.5899999999999995e-002 | AE223: 80.74 | AF223: 80.81 | AG223: 0.89 | AH223: A+ | AI223: 7.8399999999999997e-002 | AJ223: =H223+100*O223 -> 139.09999999999999 | AK223: 140.1 | AL223: 207 | AM223: 59.3 | AN223: 248 | AO223: 3.1e-002 | AP223: 37 | AQ223: 雷迪转债
A224: 145 | B224: 113562 | C224: 璞泰转债!! | D224: 603659 | E224: 璞泰来 | F224: 电子 | G224: 元器件制 | H224: 126.14 | I224: -3.9000000000000003e-003 | J224: -1.1000000000000001e-002 | K224: 103 | L224: -1.4800000000000001e-002 | M224: 113.3 | N224: 82.73 | O224: 1.3000000000000001e-002 | P224: 124.5 | Q224: 转股中 | R224: 4年43天 | S224: 2年43天 | T224: 5.4 | U224: 69 | V224: 0.10000000000000001 | W224: 1.2e-002 | X224: 1.4999999999999999e-002 | Y224: 451 | Z224: 12.3 | AA224: -2.6000000000000002e-002 | AB224: -3.1600000000000003e-002 | AC224: -8.9099999999999999e-002 | AD224: -9.06e-002 | AE224: 92.37 | AF224: 94.78 | AG224: 1 | AH224: AA | AI224: 4.4900000000000002e-002 | AJ224: =H224+100*O224 -> 127.44 | AK224: 127.8 | AL224: 87 | AM224: 33 | AN224: 52 | AO224: -6.4000000000000001e-002 | AP224: 16 | AQ224: 璞泰转债!!
A225: 60 | B225: 128119 | C225: 龙大转债 | D225: 2726. | E225: 龙大肉食 | F225: 食品饮料 | G225: 肉制品 | H225: 139.199 | I225: -2.5000000000000001e-003 | J225: -1.4000000000000002e-003 | K225: 13.1 | L225: -4.5999999999999999e-003 | M225: 120.2 | N225: 9.56 | O225: 1.6e-002 | P225: 137.03 | Q225: 58天 | R225: 5.64年 | S225: 3.64年 | T225: 9.5 | U225: 79 | V225: 5.9999999999999998e-002 | W225: 7.2999999999999995e-002 | X225: 0.10000000000000001 | Y225: 131 | Z225: 4.24 | AA225: -2.6099999999999998e-002 | AB225: -3.2000000000000001e-002 | AC225: -7.4900000000000008e-002 | AD225: -7.6499999999999999e-002 | AE225: 87.38 | AF225: 93.48 | AG225: 0.85 | AH225: AA | AI225: 4.6399999999999997e-002 | AJ225: =H225+100*O225 -> 140.79900000000001 | AK225: 141.4 | AL225: 214 | AM225: 47.9 | AN225: 197 | AO225: 0.13600000000000001 | AP225: 6 | AQ225: 龙大转债
A226: 113 | B226: 110069 | C226: 瀚蓝转债 | D226: 600323 | E226: 瀚蓝环境 | F226: 城市公用 | G226: 三废处理 | H226: 130.73 | I226: 1.0800000000000001e-002 | J226: -1.18e-002 | K226: 24.72 | L226: -1.1999999999999999e-003 | M226: 113.5 | N226: 20.2 | O226: 6.8000000000000005e-002 | P226: 122.38 | Q226: 转股中 | R226: 5.38年 | S226: 3.38年 | T226: 9.83 | U226: 12 | V226: 1.e-002 | W226: 5.2000000000000005e-002 | X226: 6.4000000000000001e-002 | Y226: 189 | Z226: 2.64 | AA226: -2.6200000000000001e-002 | AB226: -3.0600000000000002e-002 | AC226: -6.7299999999999999e-002 | AD226: -6.8400000000000002e-002 | AE226: 87.74 | AF226: 90.12 | AG226: 0.81 | AH226: AA+ | AI226: 4.4400000000000002e-002 | AJ226: =H226+100*O226 -> 137.53 | AK226: 139.1 | AL226: 197 | AM226: 49 | AN226: 203 | AO226: -1.1000000000000001e-002 | AP226: 7 | AQ226: 瀚蓝转债
A227: 147 | B227: 128091 | C227: 新天转债 | D227: 2873. | E227: 新天药业 | F227: 医药 | G227: 中药 | H227: 137.599 | I227: -4.0999999999999995e-003 | J227: 6.4000000000000003e-003 | K227: 18.38 | L227: 2.7000000000000001e-003 | M227: 120 | N227: 16.39 | O227: 0.22699999999999998 | P227: 112.14 | Q227: 转股中 | R227: 5年40天 | S227: 3年40天 | T227: 1.76 | U227: 45 | V227: 0.185 | W227: 8.199999999999999e-002 | X227: 9.1999999999999998e-002 | Y227: 22 | Z227: 2.85 | AA227: -2.7099999999999999e-002 | AB227: -3.3500000000000002e-002 | AC227: -8.0100000000000005e-002 | AD227: -8.2699999999999996e-002 | AE227: 82.42 | AF227: 82.54 | AG227: 0.82 | AH227: A+ | AI227: 7.8399999999999997e-002 | AJ227: =H227+100*O227 -> 160.29899999999998 | AK227: 163.1 | AL227: 276 | AM227: 80.5 | AN227: 281 | AO227: 5.0000000000000001e-003 | AP227: 16 | AQ227: 新天转债
A228: 179 | B228: 128079 | C228: 英联转债! | D228: 2846. | E228: 英联股份 | F228: 造纸包装 | G228: 包装材料 | H228: 135.2 | I228: 6.1999999999999998e-003 | J228: -1.7000000000000001e-003 | K228: 15.55 | L228: 4.5000000000000005e-003 | M228: 117.5 | N228: 13.41 | O228: 0.16600000000000001 | P228: 115.96 | Q228: 转股中 | R228: 4.92年 | S228: 2.92年 | T228: 1.53 | U228: 105 | V228: 0.51000000000000001 | W228: 4.9000000000000002e-002 | X228: 5.7000000000000002e-002 | Y228: 31 | Z228: 4.04 | AA228: -2.86e-002 | AB228: -3.4599999999999999e-002 | AC228: -8.3100000000000007e-002 | AD228: -8.5099999999999995e-002 | AE228: 82.66 | AF228: 82.23 | AG228: 1 | AH228: A+ | AI228: 7.690000000000001e-002 | AJ228: =H228+100*O228 -> 151.79999999999998 | AK228: 154.4 | AL228: 263 | AM228: 71.8 | AN228: 274 | AO228: 5.0000000000000003e-002 | AP228: 19 | AQ228: 英联转债!
A229: 226 | B229: 127011 | C229: 中鼎转2! | D229: 887. | E229: 中鼎股份 | F229: 汽车 | G229: 零部件制 | H229: 130.3 | I229: 3.9900000000000005e-002 | J229: 3.5799999999999998e-002 | K229: 13.95 | L229: 0.10000000000000001 | M229: 115.2 | N229: 11.59 | O229: 8.3000000000000004e-002 | P229: 120.36 | Q229: 转股中 | R229: 4.30年 | S229: 2.30年 | T229: 12 | U229: 188 | V229: 0.121 | W229: 7.0000000000000007e-002 | X229: 8.5000000000000006e-002 | Y229: 170 | Z229: 1.95 | AA229: -2.8799999999999999e-002 | AB229: -3.49e-002 | AC229: -9.01e-002 | AD229: -9.2399999999999996e-002 | AE229: 93.47 | AF229: 96.57 | AG229: 0.76 | AH229: AA+ | AI229: 4.2900000000000001e-002 | AJ229: =H229+100*O229 -> 138.60000000000002 | AK229: 140.2 | AL229: 208 | AM229: 43.7 | AN229: 161 | AO229: 0.19899999999999998 | AP229: 26 | AQ229: 中鼎转2!
A230: 112 | B230: 128104 | C230: 裕同转债! | D230: 2831. | E230: 裕同科技 | F230: 造纸包装 | G230: 包装材料 | H230: 135.856 | I230: 2.0999999999999999e-003 | J230: -2.3999999999999998e-003 | K230: 30.66 | L230: -2.9999999999999997e-004 | M230: 115.3 | N230: 23.24 | O230: 2.9999999999999999e-002 | P230: 131.93 | Q230: 转股中 | R230: 5.38年 | S230: 3.38年 | T230: 13.7 | U230: 21 | V230: 1.1000000000000001e-002 | W230: 5.0999999999999997e-002 | X230: 6.7000000000000004e-002 | Y230: 269 | Z230: 4.01 | AA230: -3.0600000000000002e-002 | AB230: -3.5400000000000001e-002 | AC230: -7.3800000000000004e-002 | AD230: -7.5600000000000001e-002 | AE230: 89.13 | AF230: 91.71 | AG230: 1 | AH230: AA+ | AI230: 4.4400000000000002e-002 | AJ230: =H230+100*O230 -> 138.85599999999999 | AK230: 139.8 | AL230: 204 | AM230: 48.1 | AN230: 199 | AO230: 4.0000000000000001e-003 | AP230: 7 | AQ230: 裕同转债!
A231: 182 | B231: 113545 | C231: 金能转债 | D231: 603113 | E231: 金能科技 | F231: 煤炭 | G231: 炼焦 | H231: 133.6 | I231: 1.9e-002 | J231: 1.4000000000000002e-003 | K231: 14.49 | L231: 2.4e-002 | M231: 114.9 | N231: 10.78 | O231: -6.0000000000000001e-003 | P231: 134.42 | Q231: 转股中 | R231: 4.90年 | S231: 2.90年 | T231: 14.7 | U231: 66 | V231: 3.4000000000000002e-002 | W231: 0.125 | X231: 0.16800000000000001 | Y231: 117 | Z231: 1.61 | AA231: -3.0800000000000001e-002 | AB231: -3.6000000000000004e-002 | AC231: -8.0799999999999997e-002 | AD231: -8.2699999999999996e-002 | AE231: 90.48 | AF231: 93.03 | AG231: 0.85 | AH231: AA | AI231: 4.4900000000000002e-002 | AJ231: =H231+100*O231 -> 133. | AK231: 132.8 | AL231: 146 | AM231: 39.8 | AN231: 127 | AO231: 0.10000000000000001 | AP231: 20 | AQ231: 金能转债
A232: 139 | B232: 128096 | C232: 奥瑞转债!! | D232: 2701. | E232: 奥瑞金 | F232: 造纸包装 | G232: 包装材料 | H232: 136.3 | I232: 1.34e-002 | J232: 8.0000000000000004e-004 | K232: 6.17 | L232: 1.6500000000000001e-002 | M232: 116 | N232: 4.52 | O232: -1.e-003 | P232: 136.5 | Q232: 转股中 | R232: 5.23年 | S232: 3.23年 | T232: 7.35 | U232: 23 | V232: 2.3e-002 | W232: 5.0000000000000003e-002 | X232: 6.8000000000000005e-002 | Y232: 148 | Z232: 2.5 | AA232: -3.1e-002 | AB232: -3.6200000000000003e-002 | AC232: -7.6600000000000001e-002 | AD232: -7.8700000000000006e-002 | AE232: 90.22 | AF232: 92.95 | AG232: 0.86 | AH232: AA+ | AI232: 4.4400000000000002e-002 | AJ232: =H232+100*O232 -> 136.20000000000002 | AK232: 136.1 | AL232: 177 | AM232: 43.1 | AN232: 157 | AO232: 3.7999999999999999e-002 | AP232: 21 | AQ232: 奥瑞转债!!
A233: 294 | B233: 123002 | C233: 国祯转债!! | D233: 300388 | E233: 国祯环保 | F233: 城市公用 | G233: 三废处理 | H233: 120.99 | I233: 0. | J233: 5.1000000000000004e-003 | K233: 9.85 | L233: 5.1000000000000004e-003 | M233: 109.8 | N233: 8.48 | O233: 4.2000000000000003e-002 | P233: 116.16 | Q233: 转股中 | R233: 3年4.1天 | S233: 1年4.1天 | T233: 2.52 | U233: 3.1 | V233: 1.e-002 | W233: 3.7000000000000005e-002 | X233: 4.2999999999999997e-002 | Y233: 69 | Z233: 1.82 | AA233: -3.2400000000000005e-002 | AB233: -3.8100000000000002e-002 | AC233: -0.128 | AD233: -0.13100000000000001 | AE233: 97.44 | AF233: 96.49 | AG233: 1 | AH233: AA | AI233: 4.4900000000000002e-002 | AJ233: =H233+100*O233 -> 125.19 | AK233: 125.8 | AL233: 64 | AM233: 28.4 | AN233: 21 | AO233: 3.5000000000000003e-002 | AP233: 13 | AQ233: 国祯转债!!
A234: 10 | B234: 127022 | C234: 恒逸转债 | D234: 703. | E234: 恒逸石化 | F234: 化工 | G234: 化工 | H234: 132.213 | I234: 6.9999999999999993e-003 | J234: 2.9999999999999997e-004 | K234: 13.66 | L234: 8.8999999999999999e-003 | M234: 108.9 | N234: 11.5 | O234: 0.113 | P234: 118.78 | Q234: 5月3天 | R234: 5.90年 | S234: 3.90年 | T234: 20 | U234: 99 | V234: 3.7000000000000005e-002 | W234: 4.0000000000000001e-002 | X234: 4.7e-002 | Y234: 503 | Z234: 2 | AA234: -3.27e-002 | AB234: -3.5400000000000001e-002 | AC234: -6.0599999999999994e-002 | AD234: -6.1699999999999998e-002 | AE234: 86.09 | AF234: 84.55 | AG234: 0.82 | AH234: AA+ | AI234: 4.4400000000000002e-002 | AJ234: =H234+100*O234 -> 143.51300000000001 | AK234: 145.6 | AL234: 244 | AM234: 59.6 | AN234: 251 | AO234: 8.0000000000000002e-002 | AP234: 3 | AQ234: 恒逸转债
A235: 185 | B235: 128075 | C235: 远东转债! | D235: 2406. | E235: 远东传动 | F235: 汽车 | G235: 零部件制 | H235: 134.685 | I235: 1.7299999999999999e-002 | J235: 1.e-004 | K235: 7.49 | L235: 2.0400000000000001e-002 | M235: 114.9 | N235: 5.54 | O235: -4.0000000000000001e-003 | P235: 135.2 | Q235: 转股中 | R235: 4.84年 | S235: 2.84年 | T235: 6.1 | U235: 48 | V235: 5.9000000000000004e-002 | W235: 0.13800000000000001 | X235: 0.18600000000000003 | Y235: 44 | Z235: 1.49 | AA235: -3.2799999999999996e-002 | AB235: -3.7999999999999999e-002 | AC235: -8.48e-002 | AD235: -8.6699999999999999e-002 | AE235: 90.71 | AF235: 93.26 | AG235: 0.85 | AH235: AA | AI235: 4.4900000000000002e-002 | AJ235: =H235+100*O235 -> 134.285 | AK235: 134.2 | AL235: 160 | AM235: 40.9 | AN235: 134 | AO235: 2.e-003 | AP235: 15 | AQ235: 远东转债!
A236: 82 | B236: 128110 | C236: 永兴转债 | D236: 2756. | E236: 永兴材料 | F236: 钢铁 | G236: 炼钢 | H236: 136 | I236: 3.8199999999999998e-002 | J236: -7.000000000000001e-004 | K236: 23.79 | L236: 4.2500000000000003e-002 | M236: 113.2 | N236: 17.06 | O236: -2.5000000000000001e-002 | P236: 139.45 | Q236: 25天 | R236: 5.55年 | S236: 3.55年 | T236: 7 | U236: 163 | V236: 0.17300000000000001 | W236: 8.1000000000000003e-002 | X236: 0.11199999999999999 | Y236: 87 | Z236: 2.49 | AA236: -3.3099999999999997e-002 | AB236: -3.7100000000000001e-002 | AC236: -7.0900000000000005e-002 | AD236: -7.2599999999999998e-002 | AE236: 87.75 | AF236: 88.44 | AG236: 0.88 | AH236: AA | AI236: 4.6399999999999997e-002 | AJ236: =H236+100*O236 -> 133.5 | AK236: 132.6 | AL236: 142 | AM236: 44.1 | AN236: 164 | AO236: 0.16600000000000001 | AP236: 5 | AQ236: 永兴转债
A237: 293 | B237: 128021 | C237: 兄弟转债!! | D237: 2562. | E237: 兄弟科技 | F237: 医药 | G237: 原料药 | H237: 121.322 | I237: -3.7000000000000002e-003 | J237: 3.7000000000000002e-003 | K237: 5.86 | L237: 0. | M237: 109.8 | N237: 5.25 | O237: 8.6999999999999994e-002 | P237: 111.62 | Q237: 转股中 | R237: 3年8天 | S237: 1年8天 | T237: 2.66 | U237: 2.6 | V237: 8.0000000000000002e-003 | W237: 4.8000000000000001e-002 | X237: 5.2999999999999999e-002 | Y237: 56 | Z237: 2.28 | AA237: -3.32e-002 | AB237: -3.8900000000000004e-002 | AC237: -0.128 | AD237: -0.13100000000000001 | AE237: 97.39 | AF237: 96.44 | AG237: 0.97 | AH237: AA | AI237: 4.4900000000000002e-002 | AJ237: =H237+100*O237 -> 130.02199999999999 | AK237: 131 | AL237: 128 | AM237: 33.6 | AN237: 58 | AO237: -6.0000000000000001e-003 | AP237: 13 | AQ237: 兄弟转债!!
A238: 35 | B238: 128126 | C238: 赣锋转2 | D238: 2460. | E238: 赣锋锂业 | F238: 有色金属 | G238: 小金属 | H238: 134.765 | I238: 1.01e-002 | J238: 2.2799999999999997e-002 | K238: 75.49 | L238: 3.9800000000000002e-002 | M238: 111.1 | N238: 60.27 | O238: 7.5999999999999998e-002 | P238: 125.25 | Q238: 2月24天 | R238: 5.71年 | S238: 3.71年 | T238: 21.1 | U238: 110 | V238: 3.9e-002 | W238: 2.1000000000000001e-002 | X238: 2.6000000000000002e-002 | Y238: 1006. | Z238: 10.84 | AA238: -3.3700000000000001e-002 | AB238: -3.7100000000000001e-002 | AC238: -6.7799999999999999e-002 | AD238: -6.9000000000000006e-002 | AE238: 86.38 | AF238: 86.09 | AG238: 0.83 | AH238: AA | AI238: 4.6399999999999997e-002 | AJ238: =H238+100*O238 -> 142.36499999999998 | AK238: 144.3 | AL238: 236 | AM238: 57.9 | AN238: 238 | AO238: 9.5000000000000001e-002 | AP238: 8 | AQ238: 赣锋转2
A239: 312 | B239: 110034 | C239: 九州转债! | D239: 600998 | E239: 九州通 | F239: 医药 | G239: 医药商业 | H239: 114 | I239: -5.9999999999999995e-004 | J239: -5.0000000000000001e-004 | K239: 18.27 | L239: -2.7000000000000001e-003 | M239: 109.6 | N239: 18.32 | O239: 0.14300000000000002 | P239: 99.73 | Q239: 转股中 | R239: 1年56天 | S239: 回售中 | T239: 15 | U239: 5.1 | V239: 3.0000000000000001e-003 | W239: 4.4000000000000004e-002 | X239: 4.4000000000000004e-002 | Y239: 342 | Z239: 1.82 | AA239: -3.4000000000000002e-002 | AB239: -4.87e-002 | AC239: 回售中 | AD239: 回售中 | AE239: 103 | AF239: 104.56 | AG239: 0.4 | AH239: AA+ | AI239: 4.2199999999999994e-002 | AJ239: =H239+100*O239 -> 128.30000000000001 | AK239: 128.3 | AL239: 97 | AM239: 23.7 | AN239: 8 | AO239: 6.0000000000000001e-003 | AP239: 26 | AQ239: 九州转债!
A240: 143 | B240: 127015 | C240: 希望转债! | D240: 876. | E240: 新 希 望 | F240: 农业 | G240: 畜牧业 | H240: 131.85 | I240: -6.6e-003 | J240: -1.4000000000000002e-003 | K240: 26.09 | L240: -8.0000000000000002e-003 | M240: 110.2 | N240: 19.75 | O240: -2.e-003 | P240: 132.1 | Q240: 转股中 | R240: 5年44天 | S240: 3年44天 | T240: 12.3 | U240: 72 | V240: 4.4000000000000004e-002 | W240: 1.e-002 | X240: 1.3999999999999999e-002 | Y240: 1175. | Z240: 3.25 | AA240: -3.49e-002 | AB240: -3.8399999999999997e-002 | AC240: -7.3200000000000001e-002 | AD240: -7.4700000000000003e-002 | AE240: 90.12 | AF240: 89.83 | AG240: 1 | AH240: AAA | AI240: 4.1399999999999999e-002 | AJ240: =H240+100*O240 -> 131.65000000000001 | AK240: 131.6 | AL240: 134 | AM240: 41.5 | AN240: 143 | AO240: -2.6000000000000002e-002 | AP240: 28 | AQ240: 希望转债!
A241: 110 | B241: 113575 | C241: 东时转债! | D241: 603377 | E241: 东方时尚 | F241: 其他 | G241: 其他 | H241: 136.9 | I241: -7.000000000000001e-004 | J241: -2.0000000000000001e-004 | K241: 20.06 | L241: -1.e-003 | M241: 113.5 | N241: 14.56 | O241: -6.0000000000000001e-003 | P241: 137.77 | Q241: 转股中 | R241: 5.38年 | S241: 3.38年 | T241: 1.87 | U241: 15 | V241: 5.7000000000000002e-002 | W241: 1.6e-002 | X241: 2.2000000000000002e-002 | Y241: 118 | Z241: 6.28 | AA241: -3.49e-002 | AB241: -3.9100000000000003e-002 | AC241: -7.5600000000000001e-002 | AD241: -7.7399999999999997e-002 | AE241: 88.54 | AF241: 89.37 | AG241: 0.89 | AH241: AA | AI241: 4.6399999999999997e-002 | AJ241: =H241+100*O241 -> 136.30000000000001 | AK241: 136 | AL241: 176 | AM241: 46.7 | AN241: 188 | AO241: 1.3999999999999999e-002 | AP241: 15 | AQ241: 东时转债!
A242: 160 | B242: 113029 | C242: 明阳转债!! | D242: 601615 | E242: 明阳智能 | F242: 能源电力 | G242: 风能 | H242: 135.46 | I242: 4.1299999999999996e-002 | J242: 3.4300000000000004e-002 | K242: 16.94 | L242: 8.7300000000000003e-002 | M242: 113.3 | N242: 12.46 | O242: -4.0000000000000001e-003 | P242: 135.96 | Q242: 转股中 | R242: 5年26天 | S242: 3年26天 | T242: 9.81 | U242: 631 | V242: 0.46600000000000003 | W242: 4.0000000000000001e-002 | X242: 5.4000000000000006e-002 | Y242: 247 | Z242: 3.14 | AA242: -3.5299999999999998e-002 | AB242: -3.9699999999999999e-002 | AC242: -7.980000000000001e-002 | AD242: -8.1699999999999995e-002 | AE242: 89.79 | AF242: 90.48 | AG242: 0.87 | AH242: AA | AI242: 4.6399999999999997e-002 | AJ242: =H242+100*O242 -> 135.06 | AK242: 135 | AL242: 168 | AM242: 44.5 | AN242: 170 | AO242: 3.7000000000000005e-002 | AP242: 22 | AQ242: 明阳转债!!
A243: 6 | B243: 113040 | C243: 星宇转债 | D243: 601799 | E243: 星宇股份 | F243: 汽车 | G243: 零部件制 | H243: 138.66 | I243: -2.7000000000000001e-003 | J243: 7.0999999999999995e-003 | K243: 198.7 | L243: 5.4000000000000003e-003 | M243: 111.5 | N243: 158 | O243: 0.10300000000000001 | P243: 125.76 | Q243: 5月9天 | R243: 5.92年 | S243: 3.92年 | T243: 15 | U243: 155 | V243: 7.400000000000001e-002 | W243: 2.7000000000000003e-002 | X243: 3.4000000000000002e-002 | Y243: 549 | Z243: 10.32 | AA243: -3.6499999999999998e-002 | AB243: -3.9900000000000005e-002 | AC243: -7.2099999999999997e-002 | AD243: -7.3099999999999998e-002 | AE243: 85.69 | AF243: 86.47 | AG243: 0.84 | AH243: AA+ | AI243: 4.4400000000000002e-002 | AJ243: =H243+100*O243 -> 148.96000000000001 | AK243: 151.6 | AL243: 259 | AM243: 65.1 | AN243: 264 | AO243: 8.9999999999999997e-002 | AP243: 2 | AQ243: 星宇转债
A244: 205 | B244: 110058 | C244: 永鼎转债! | D244: 600105 | E244: 永鼎股份 | F244: 通信互联 | G244: 通信设备 | H244: 135.34 | I244: 3.3e-003 | J244: -3.3e-003 | K244: 6.84 | L244: 0. | M244: 114.9 | N244: 5.04 | O244: -3.0000000000000001e-003 | P244: 135.71 | Q244: 转股中 | R244: 4.40年 | S244: 2.40年 | T244: 3.53 | U244: 18 | V244: 3.7000000000000005e-002 | W244: 4.0000000000000001e-002 | X244: 5.4000000000000006e-002 | Y244: 89 | Z244: 3.36 | AA244: -3.7200000000000004e-002 | AB244: -4.2900000000000001e-002 | AC244: -0.10000000000000001 | AD244: -0.10199999999999999 | AE244: 92.48 | AF244: 95.08 | AG244: 0.85 | AH244: AA | AI244: 4.4900000000000002e-002 | AJ244: =H244+100*O244 -> 135.03999999999999 | AK244: 135 | AL244: 169 | AM244: 39.9 | AN244: 128 | AO244: 6.3e-002 | AP244: 50 | AQ244: 永鼎转债!
A245: 91 | B245: 113583 | C245: 益丰转债 | D245: 603939 | E245: 益丰药房 | F245: 医药 | G245: 医药商业 | H245: 141.95 | I245: 1.2500000000000001e-002 | J245: -1.4000000000000002e-003 | K245: 99.31 | L245: 1.26e-002 | M245: 115.3 | N245: 71.82 | O245: 2.7000000000000003e-002 | P245: 138.28 | Q245: 17天 | R245: 5.53年 | S245: 3.53年 | T245: 15.8 | U245: 19 | V245: 9.0000000000000011e-003 | W245: 2.9999999999999999e-002 | X245: 4.0999999999999995e-002 | Y245: 527 | Z245: 10.48 | AA245: -3.7599999999999995e-002 | AB245: -4.2199999999999994e-002 | AC245: -8.1900000000000001e-002 | AD245: -8.3599999999999994e-002 | AE245: 87.93 | AF245: 90.18 | AG245: 0.88 | AH245: AA | AI245: 4.6399999999999997e-002 | AJ245: =H245+100*O245 -> 144.64999999999998 | AK245: 145.6 | AL245: 243 | AM245: 55.4 | AN245: 230 | AO245: -1.4999999999999999e-002 | AP245: 9 | AQ245: 益丰转债
A246: 44 | B246: 123062 | C246: 三超转债 | D246: 300554 | E246: 三超新材 | F246: 机械装备 | G246: 通用设备 | H246: 148.4 | I246: 7.4999999999999997e-003 | J246: 1.7399999999999999e-002 | K246: 26.13 | L246: 2.63e-002 | M246: 119.7 | N246: 17.17 | O246: -2.5000000000000001e-002 | P246: 152.18 | Q246: 2月13天 | R246: 5.68年 | S246: 3.68年 | T246: 1.95 | U246: 662 | V246: 2.2999999999999998 | W246: 8.0000000000000002e-002 | X246: 0.121 | Y246: 24 | Z246: 4.68 | AA246: -3.7900000000000003e-002 | AB246: -4.3499999999999997e-002 | AC246: -8.7599999999999997e-002 | AD246: -8.9600000000000013e-002 | AE246: 75.8 | AF246: 74.83 | AG246: 0.95 | AH246: A | AI246: 8.8399999999999992e-002 | AJ246: =H246+100*O246 -> 145.90000000000001 | AK246: 144.6 | AL246: 238 | AM246: 68.8 | AN246: 270 | AO246: 2.7999999999999997e-002 | AP246: 12 | AQ246: 三超转债
A247: 7 | B247: 123072 | C247: 乐歌转债! | D247: 300729 | E247: 乐歌股份 | F247: 其他 | G247: 家居用品 | H247: 162.7 | I247: -1.52e-002 | J247: 2.0099999999999996e-002 | K247: 50.48 | L247: 1.41e-002 | M247: 129.6 | N247: 73.13 | O247: 1.3600000000000001 | P247: 69.03 | Q247: 5月8天 | R247: 5.92年 | S247: 3.92年 | T247: 1.42 | U247: 1039. | V247: 4.4500000000000002 | W247: 2.e-002 | X247: 1.3999999999999999e-002 | Y247: 70 | Z247: 7.36 | AA247: -3.8699999999999998e-002 | AB247: -4.6199999999999998e-002 | AC247: -9.9299999999999999e-002 | AD247: -0.10199999999999999 | AE247: 78.72 | AF247: 84 | AG247: 0.35 | AH247: A+ | AI247: 7.8399999999999997e-002 | AJ247: =H247+100*O247 -> 298.69999999999999 | AK247: 256.4 | AL247: 303 | AM247: 172.4 | AN247: 304 | AO247: -0.16300000000000001 | AP247: 3 | AQ247: 乐歌转债!
A248: 302 | B248: 113013 | C248: 国君转债! | D248: 601211 | E248: 国泰君安 | F248: 金融 | G248: 证券行业 | H248: 120 | I248: -3.3e-003 | J248: 3.9000000000000003e-003 | K248: 18.31 | L248: 1.1000000000000001e-003 | M248: 108.3 | N248: 19.01 | O248: 0.24600000000000002 | P248: 96.32 | Q248: 转股中 | R248: 2.63年 | S248: 无权 | T248: 69.9 | U248: 36 | V248: 4.0000000000000001e-003 | W248: 4.2999999999999997e-002 | X248: 4.0999999999999995e-002 | Y248: 1631. | Z248: 1.31 | AA248: -3.8900000000000004e-002 | AB248: -4.4500000000000005e-002 | AC248: 无权 | AD248: 无权 | AE248: 无权 | AF248: 98.07 | AG248: 0.5 | AH248: AAA | AI248: 3.9199999999999999e-002 | AJ248: =H248+100*O248 -> 144.59999999999999 | AK248: 143.7 | AL248: 232 | AM248: 45.6 | AN248: 180 | AO248: -4.0000000000000001e-003 | AP248: 13 | AQ248: 国君转债!
A249: 78 | B249: 113587 | C249: 泛微转债 | D249: 603039 | E249: 泛微网络 | F249: 计算机及 | G249: 软件开发 | H249: 154.78 | I249: 1.21e-002 | J249: -1.3000000000000001e-002 | K249: 105.4 | L249: -8.9999999999999998e-004 | M249: 124.3 | N249: 64.33 | O249: -5.5e-002 | P249: 163.84 | Q249: 31天 | R249: 5.57年 | S249: 3.57年 | T249: 3.16 | U249: 35 | V249: 7.2000000000000008e-002 | W249: 1.3999999999999999e-002 | X249: 2.3e-002 | Y249: 224 | Z249: 23.21 | AA249: -3.9399999999999998e-002 | AB249: -4.6199999999999998e-002 | AC249: -0.10099999999999999 | AD249: -0.10000000000000001 | AE249: 81.94 | AF249: 87.15 | AG249: 0.94 | AH249: AA- | AI249: 6.7400000000000002e-002 | AJ249: =H249+100*O249 -> 149.28 | AK249: 145.7 | AL249: 245 | AM249: 58.6 | AN249: 243 | AO249: 9.4e-002 | AP249: 5 | AQ249: 泛微转债
A250: 59 | B250: 123058 | C250: 欣旺转债 | D250: 300207 | E250: 欣旺达 | F250: 电子 | G250: 电子产品 | H250: 146.597 | I250: 1.8e-003 | J250: -1.1299999999999999e-002 | K250: 28.13 | L250: -1.1200000000000002e-002 | M250: 116.3 | N250: 21.24 | O250: 0.107 | P250: 132.44 | Q250: 2月1天 | R250: 5.65年 | S250: 3.65年 | T250: 11.2 | U250: 13 | V250: 8.0000000000000002e-003 | W250: 2.5000000000000001e-002 | X250: 3.3000000000000002e-002 | Y250: 443 | Z250: 7 | AA250: -4.0899999999999999e-002 | AB250: -4.5599999999999995e-002 | AC250: -8.7300000000000003e-002 | AD250: -8.8900000000000007e-002 | AE250: 87.46 | AF250: 90.47 | AG250: 0.84 | AH250: AA | AI250: 4.6399999999999997e-002 | AJ250: =H250+100*O250 -> 157.297 | AK250: 160.8 | AL250: 273 | AM250: 70.3 | AN250: 272 | AO250: -2.7000000000000003e-002 | AP250: 6 | AQ250: 欣旺转债
A251: 201 | B251: 123026 | C251: 中环转债! | D251: 300692 | E251: 中环环保 | F251: 城市公用 | G251: 三废处理 | H251: 127.999 | I251: 2.6499999999999999e-002 | J251: -1.1399999999999999e-002 | K251: 14.78 | L251: 1.5100000000000001e-002 | M251: 110.6 | N251: 12.51 | O251: 8.3000000000000004e-002 | P251: 118.15 | Q251: 转股中 | R251: 3.55年 | S251: 1.55年 | T251: 0.59 | U251: 373 | V251: 4.8799999999999999 | W251: 1.8000000000000002e-002 | X251: 2.2000000000000002e-002 | Y251: 32 | Z251: 2.39 | AA251: -4.0999999999999995e-002 | AB251: -4.6199999999999998e-002 | AC251: -0.10400000000000001 | AD251: -0.106 | AE251: 92.15 | AF251: 88.57 | AG251: 1 | AH251: AA- | AI251: 6.59e-002 | AJ251: =H251+100*O251 -> 136.29900000000001 | AK251: 137.9 | AL251: 190 | AM251: 45.7 | AN251: 182 | AO251: -6.9000000000000006e-002 | AP251: 28 | AQ251: 中环转债!
A252: 132 | B252: 110066 | C252: 盛屯转债! | D252: 600711 | E252: 盛屯矿业 | F252: 有色金属 | G252: 有色行业 | H252: 143.2 | I252: 5.1299999999999998e-002 | J252: -1.9e-003 | K252: 7.03 | L252: 5.5599999999999997e-002 | M252: 115.3 | N252: 4.88 | O252: -6.0000000000000001e-003 | P252: 144.06 | Q252: 转股中 | R252: 5.28年 | S252: 3.28年 | T252: 20 | U252: 439 | V252: 0.157 | W252: 0.12300000000000001 | X252: 0.17699999999999999 | Y252: 163 | Z252: 1.76 | AA252: -4.0999999999999995e-002 | AB252: -4.58e-002 | AC252: -8.9900000000000008e-002 | AD252: -9.1700000000000004e-002 | AE252: 88.93 | AF252: 91.2 | AG252: 0.89 | AH252: AA | AI252: 4.6399999999999997e-002 | AJ252: =H252+100*O252 -> 142.59999999999999 | AK252: 142.3 | AL252: 221 | AM252: 51.1 | AN252: 212 | AO252: 0.125 | AP252: 43 | AQ252: 盛屯转债!
A253: 116 | B253: 128103 | C253: 同德转债 | D253: 2360. | E253: 同德化工 | F253: 化工 | G253: 化工 | H253: 151.666 | I253: -8.8000000000000005e-003 | J253: -6.7000000000000002e-003 | K253: 6.74 | L253: -1.7500000000000002e-002 | M253: 121.8 | N253: 5.18 | O253: 0.16600000000000001 | P253: 130.12 | Q253: 转股中 | R253: 5.35年 | S253: 3.35年 | T253: 1.44 | U253: 276 | V253: 1.27 | W253: 5.5e-002 | X253: 7.0999999999999994e-002 | Y253: 26 | Z253: 2.2 | AA253: -4.1100000000000005e-002 | AB253: -4.7500000000000001e-002 | AC253: -0.10099999999999999 | AD253: -0.10099999999999999 | AE253: 80.61 | AF253: 82.19 | AG253: 0.88 | AH253: A+ | AI253: 7.8399999999999997e-002 | AJ253: =H253+100*O253 -> 168.26599999999999 | AK253: 173.2 | AL253: 284 | AM253: 91 | AN253: 287 | AO253: 8.199999999999999e-002 | AP253: 12 | AQ253: 同德转债
A254: 253 | B254: 128046 | C254: 利尔转债! | D254: 2258. | E254: 利尔化学 | F254: 化工 | G254: 农化 | H254: 132 | I254: -1.0500000000000001e-002 | J254: 4.0000000000000002e-004 | K254: 22.71 | L254: -1.26e-002 | M254: 112.3 | N254: 18.62 | O254: 8.199999999999999e-002 | P254: 121.97 | Q254: 转股中 | R254: 3.91年 | S254: 1.91年 | T254: 8.52 | U254: 6.9 | V254: 6.0000000000000001e-003 | W254: 7.2000000000000008e-002 | X254: 8.6999999999999994e-002 | Y254: 119 | Z254: 3.33 | AA254: -4.1200000000000001e-002 | AB254: -4.6500000000000007e-002 | AC254: -0.114 | AD254: -0.11599999999999999 | AE254: 93.91 | AF254: 94.88 | AG254: 0.8 | AH254: AA | AI254: 4.4900000000000002e-002 | AJ254: =H254+100*O254 -> 140.19999999999999 | AK254: 142 | AL254: 218 | AM254: 47.2 | AN254: 192 | AO254: 7.0000000000000007e-002 | AP254: 10 | AQ254: 利尔转债!
A255: 137 | B255: 128097 | C255: 奥佳转债! | D255: 2614. | E255: 奥佳华 | F255: 机械装备 | G255: 专用设备 | H255: 143.375 | I255: 7.4999999999999997e-003 | J255: -6.8999999999999999e-003 | K255: 14.99 | L255: 7.000000000000001e-004 | M255: 115.3 | N255: 10.69 | O255: 2.2000000000000002e-002 | P255: 140.22 | Q255: 转股中 | R255: 5.27年 | S255: 3.27年 | T255: 5.85 | U255: 11 | V255: 1.3000000000000001e-002 | W255: 6.3e-002 | X255: 8.900000000000001e-002 | Y255: 92 | Z255: 2.19 | AA255: -4.1299999999999996e-002 | AB255: -4.6100000000000002e-002 | AC255: -9.0700000000000003e-002 | AD255: -9.2499999999999999e-002 | AE255: 89 | AF255: 91.26 | AG255: 0.87 | AH255: AA | AI255: 4.6399999999999997e-002 | AJ255: =H255+100*O255 -> 145.57499999999999 | AK255: 146.5 | AL255: 247 | AM255: 55.3 | AN255: 229 | AO255: 2.8999999999999998e-002 | AP255: 25 | AQ255: 奥佳转债!
A256: 130 | B256: 123043 | C256: 正元转债 | D256: 300645 | E256: 正元智慧 | F256: 计算机及 | G256: 软件开发 | H256: 152.2 | I256: -7.1999999999999998e-003 | J256: -5.3e-003 | K256: 16.17 | L256: -1.6399999999999998e-002 | M256: 121.4 | N256: 15.41 | O256: 0.45000000000000001 | P256: 104.93 | Q256: 转股中 | R256: 5.29年 | S256: 3.29年 | T256: 1.66 | U256: 565 | V256: 2.23 | W256: 8.1000000000000003e-002 | X256: 8.5000000000000006e-002 | Y256: 20 | Z256: 3.34 | AA256: -4.2699999999999995e-002 | AB256: -4.9200000000000001e-002 | AC256: -0.10199999999999999 | AD256: -0.10400000000000001 | AE256: 80.85 | AF256: 82.27 | AG256: 0.76 | AH256: A+ | AI256: 7.8399999999999997e-002 | AJ256: =H256+100*O256 -> 197.19999999999999 | AK256: 199.5 | AL256: 296 | AM256: 117.2 | AN256: 298 | AO256: -8.1000000000000003e-002 | AP256: 18 | AQ256: 正元转债
A257: 37 | B257: 113038 | C257: 隆20转债 | D257: 601012 | E257: 隆基股份 | F257: 能源电力 | G257: 太阳能 | H257: 143.73 | I257: 1.9400000000000001e-002 | J257: 6.8999999999999999e-003 | K257: 66.89 | L257: 3.1800000000000002e-002 | M257: 111.8 | N257: 52.59 | O257: 0.13 | P257: 127.19 | Q257: 2月18天 | R257: 5.69年 | S257: 3.69年 | T257: 50 | U257: 210 | V257: 2.8999999999999998e-002 | W257: 2.e-002 | X257: 2.5000000000000001e-002 | Y257: 2523. | Z257: 7.78 | AA257: -4.3799999999999999e-002 | AB257: -4.7300000000000002e-002 | AC257: -8.2500000000000004e-002 | AD257: -8.3900000000000002e-002 | AE257: 88.43 | AF257: 89.09 | AG257: 0.83 | AH257: AAA | AI257: 4.1399999999999999e-002 | AJ257: =H257+100*O257 -> 156.72999999999999 | AK257: 160.3 | AL257: 272 | AM257: 71.2 | AN257: 273 | AO257: -5.0000000000000003e-002 | AP257: 11 | AQ257: 隆20转债
A258: 299 | B258: 113016 | C258: 小康转债! | D258: 601127 | E258: 小康股份 | F258: 汽车 | G258: 零部件制 | H258: 124.61 | I258: 0.17899999999999999 | J258: -0.13200000000000001 | K258: 14.75 | L258: 9.9900000000000003e-002 | M258: 109.3 | N258: 15.7 | O258: 0.32600000000000001 | P258: 93.95 | Q258: 转股中 | R258: 2.96年 | S258: 0.96年 | T258: 8.81 | U258: 3425. | V258: 3.2799999999999998 | W258: 4.7e-002 | X258: 4.4999999999999998e-002 | Y258: 186 | Z258: 3.21 | AA258: -4.3899999999999995e-002 | AB258: -4.9400000000000006e-002 | AC258: -0.16 | AD258: -0.16200000000000001 | AE258: 96.96 | AF258: 96.35 | AG258: 0.48 | AH258: AA | AI258: 4.4199999999999996e-002 | AJ258: =H258+100*O258 -> 157.21000000000001 | AK258: 155.3 | AL258: 264 | AM258: 58.3 | AN258: 241 | AO258: 0.48100000000000004 | AP258: 45 | AQ258: 小康转债!
A259: 315 | B259: 113008 | C259: 电气转债! | D259: 601727 | E259: 上海电气 | F259: 能源电力 | G259: 电力设备 | H259: 107.58 | I259: -8.0000000000000004e-004 | J259: 4.1999999999999997e-003 | K259: 5.22 | L259: 1.1599999999999999e-002 | M259: 106.6 | N259: 5.13 | O259: 5.7000000000000002e-002 | P259: 101.75 | Q259: 转股中 | R259: 0.20年 | S259: 回售中 | T259: 44.1 | U259: 48 | V259: 1.e-002 | W259: 5.5999999999999994e-002 | X259: 5.7000000000000002e-002 | Y259: 791 | Z259: 1.22 | AA259: -4.41e-002 | AB259: -0.10099999999999999 | AC259: 回售中 | AD259: 回售中 | AE259: 103 | AF259: 105.81 | AG259: 0.29 | AH259: AAA | AI259: 3.7200000000000004e-002 | AJ259: =H259+100*O259 -> 113.28 | AK259: 113.4 | AL259: 3 | AM259: 7.6 | AN259: 2 | AO259: 2.1000000000000001e-002 | AP259: 31 | AQ259: 电气转债!
A260: 70 | B260: 113590 | C260: 海容转债 | D260: 603187 | E260: 海容冷链 | F260: 机械装备 | G260: 通用设备 | H260: 150.91 | I260: 6.0999999999999995e-003 | J260: -7.9000000000000008e-003 | K260: 55.58 | L260: -2.e-003 | M260: 115.6 | N260: 36.39 | O260: -1.2e-002 | P260: 152.73 | Q260: 45天 | R260: 5.61年 | S260: 3.61年 | T260: 5 | U260: 41 | V260: 5.4000000000000006e-002 | W260: 5.7000000000000002e-002 | X260: 8.6999999999999994e-002 | Y260: 88 | Z260: 5.42 | AA260: -4.7300000000000002e-002 | AB260: -5.1799999999999999e-002 | AC260: -9.4899999999999998e-002 | AD260: -9.6600000000000005e-002 | AE260: 81.48 | AF260: 80.83 | AG260: 0.94 | AH260: AA- | AI260: 6.7400000000000002e-002 | AJ260: =H260+100*O260 -> 149.71000000000001 | AK260: 149.1 | AL260: 254 | AM260: 67.6 | AN260: 269 | AO260: 7.5999999999999998e-002 | AP260: 6 | AQ260: 海容转债
A261: 83 | B261: 113585 | C261: 寿仙转债 | D261: 603896 | E261: 寿仙谷 | F261: 医药 | G261: 中药 | H261: 154.73 | I261: 5.1000000000000004e-003 | J261: 1.1999999999999999e-003 | K261: 47.16 | L261: 6.6e-003 | M261: 117.8 | N261: 28.68 | O261: -5.9000000000000004e-002 | P261: 164.44 | Q261: 25天 | R261: 5.55年 | S261: 3.55年 | T261: 3.6 | U261: 17 | V261: 3.1e-002 | W261: 5.2999999999999999e-002 | X261: 8.6999999999999994e-002 | Y261: 68 | Z261: 5.49 | AA261: -4.8799999999999996e-002 | AB261: -5.4000000000000006e-002 | AC261: -0.10199999999999999 | AD261: -0.10099999999999999 | AE261: 81.96 | AF261: 82.69 | AG261: 0.95 | AH261: AA- | AI261: 6.7400000000000002e-002 | AJ261: =H261+100*O261 -> 148.82999999999998 | AK261: 145 | AL261: 241 | AM261: 62.3 | AN261: 261 | AO261: 4.9000000000000002e-002 | AP261: 9 | AQ261: 寿仙转债
A262: 119 | B262: 123046 | C262: 天铁转债! | D262: 300587 | E262: 天铁股份 | F262: 铁路 | G262: 铁路设备 | H262: 153.98 | I262: -1.29e-002 | J262: 1.29e-002 | K262: 15.36 | L262: 0. | M262: 118.2 | N262: 10.12 | O262: 1.4999999999999999e-002 | P262: 151.78 | Q262: 转股中 | R262: 5.33年 | S262: 3.33年 | T262: 1.17 | U262: 29 | V262: 0.16 | W262: 2.3e-002 | X262: 3.5000000000000003e-002 | Y262: 50 | Z262: 3.77 | AA262: -4.9400000000000006e-002 | AB262: -5.4900000000000004e-002 | AC262: -0.10400000000000001 | AD262: -0.106 | AE262: 83.14 | AF262: 84.2 | AG262: 0.93 | AH262: AA- | AI262: 6.7400000000000002e-002 | AJ262: =H262+100*O262 -> 155.47999999999999 | AK262: 156.2 | AL262: 265 | AM262: 72 | AN262: 275 | AO262: -8.0000000000000002e-003 | AP262: 10 | AQ262: 天铁转债!
A263: 246 | B263: 123017 | C263: 寒锐转债!! | D263: 300618 | E263: 寒锐钴业 | F263: 有色金属 | G263: 小金属 | H263: 135.2 | I263: 0. | J263: 3.8e-003 | K263: 72.51 | L263: 4.3e-003 | M263: 110.8 | N263: 57.4 | O263: 7.0000000000000007e-002 | P263: 126.32 | Q263: 转股中 | R263: 4年0.1天 | S263: 2年0.1天 | T263: 4.03 | U263: 120 | V263: 0.21899999999999997 | W263: 1.8000000000000002e-002 | X263: 2.3e-002 | Y263: 220 | Z263: 5.98 | AA263: -4.9500000000000002e-002 | AB263: -5.4100000000000002e-002 | AC263: -0.11800000000000001 | AD263: -0.12 | AE263: 89.61 | AF263: 86.35 | AG263: 0.89 | AH263: AA- | AI263: 6.59e-002 | AJ263: =H263+100*O263 -> 142.19999999999999 | AK263: 144.1 | AL263: 235 | AM263: 54.5 | AN263: 225 | AO263: 3.4000000000000002e-002 | AP263: 14 | AQ263: 寒锐转债!!
A264: 62 | B264: 113592 | C264: 安20转债 | D264: 603345 | E264: 安井食品 | F264: 食品饮料 | G264: 食品饮料 | H264: 150 | I264: 3.6499999999999998e-002 | J264: -1.0700000000000001e-002 | K264: 177.3 | L264: 2.7799999999999998e-002 | M264: 113.1 | N264: 115.9 | O264: -1.9e-002 | P264: 152.98 | Q264: 55天 | R264: 5.63年 | S264: 3.63年 | T264: 9 | U264: 131 | V264: 9.8000000000000004e-002 | W264: 2.1000000000000001e-002 | X264: 3.3000000000000002e-002 | Y264: 420 | Z264: 13.07 | AA264: -4.9699999999999994e-002 | AB264: -5.3499999999999999e-002 | AC264: -9.35e-002 | AD264: -9.5100000000000004e-002 | AE264: 87.34 | AF264: 88.02 | AG264: 0.93 | AH264: AA | AI264: 4.6399999999999997e-002 | AJ264: =H264+100*O264 -> 148.09999999999999 | AK264: 147 | AL264: 250 | AM264: 59 | AN264: 247 | AO264: 2.5000000000000001e-002 | AP264: 6 | AQ264: 安20转债
A265: 310 | B265: 128010 | C265: 顺昌转债!! | D265: 2245. | E265: 澳洋顺昌 | F265: 交通运输 | G265: 物流业 | H265: 116.3 | I265: 7.4499999999999997e-002 | J265: -4.4999999999999998e-002 | K265: 8.7 | L265: 9.9900000000000003e-002 | M265: 109.6 | N265: 9.25 | O265: 0.23699999999999999 | P265: 94.05 | Q265: 转股中 | R265: 1.17年 | S265: 回售中 | T265: 5.09 | U265: 650 | V265: 1.1200000000000001 | W265: 5.9999999999999998e-002 | X265: 5.5999999999999994e-002 | Y265: 85 | Z265: 3.75 | AA265: -4.99e-002 | AB265: -6.4199999999999993e-002 | AC265: 回售中 | AD265: 回售中 | AE265: 100.27 | AF265: 104.25 | AG265: 0.3 | AH265: AA | AI265: 4.4199999999999996e-002 | AJ265: =H265+100*O265 -> 140. | AK265: 138.5 | AL265: 194 | AM265: 34.3 | AN265: 66 | AO265: 0.217 | AP265: 40 | AQ265: 顺昌转债!!
A266: 274 | B266: 127005 | C266: 长证转债! | D266: 783. | E266: 长江证券 | F266: 金融 | G266: 证券行业 | H266: 129.45 | I266: -3.4000000000000002e-003 | J266: -6.9999999999999993e-003 | K266: 8.58 | L266: -1.38e-002 | M266: 109.3 | N266: 7.28 | O266: 9.8000000000000004e-002 | P266: 117.86 | Q266: 转股中 | R266: 3.31年 | S266: 无权 | T266: 50 | U266: 13 | V266: 2.e-003 | W266: 0.105 | X266: 0.124 | Y266: 474 | Z266: 1.69 | AA266: -5.0900000000000001e-002 | AB266: -5.5599999999999997e-002 | AC266: 无权 | AD266: 无权 | AE266: 无权 | AF266: 96.3 | AG266: 0.75 | AH266: AAA | AI266: 3.9900000000000005e-002 | AJ266: =H266+100*O266 -> 139.25 | AK266: 141 | AL266: 211 | AM266: 44.7 | AN266: 174 | AO266: 4.2999999999999997e-002 | AP266: 15 | AQ266: 长证转债!
A267: 224 | B267: 110055 | C267: 伊力转债! | D267: 600197 | E267: 伊力特 | F267: 食品饮料 | G267: 白酒 | H267: 143.57 | I267: 3.9199999999999999e-002 | J267: -4.0000000000000002e-004 | K267: 24.41 | L267: 4.3200000000000002e-002 | M267: 115 | N267: 16.81 | O267: -1.1000000000000001e-002 | P267: 145.21 | Q267: 转股中 | R267: 4.32年 | S267: 2.32年 | T267: 6.22 | U267: 1010. | V267: 1.1299999999999999 | W267: 5.9000000000000004e-002 | X267: 8.5000000000000006e-002 | Y267: 106 | Z267: 3.97 | AA267: -5.1100000000000007e-002 | AB267: -5.6799999999999996e-002 | AC267: -0.124 | AD267: -0.126 | AE267: 92.93 | AF267: 95.54 | AG267: 0.9 | AH267: AA | AI267: 4.4900000000000002e-002 | AJ267: =H267+100*O267 -> 142.47 | AK267: 141.9 | AL267: 216 | AM267: 46.4 | AN267: 187 | AO267: 0.13500000000000001 | AP267: 25 | AQ267: 伊力转债!
A268: 260 | B268: 123012 | C268: 万顺转债! | D268: 300057 | E268: 万顺新材 | F268: 造纸包装 | G268: 包装材料 | H268: 134.318 | I268: -1.3100000000000001e-002 | J268: 4.0999999999999995e-003 | K268: 6.08 | L268: -1.1399999999999999e-002 | M268: 110.3 | N268: 5.31 | O268: 0.17300000000000001 | P268: 114.5 | Q268: 转股中 | R268: 3.66年 | S268: 1.66年 | T268: 1.29 | U268: 62 | V268: 0.35899999999999999 | W268: 3.1e-002 | X268: 3.6000000000000004e-002 | Y268: 41 | Z268: 1.2 | AA268: -5.33e-002 | AB268: -5.7999999999999996e-002 | AC268: -0.115 | AD268: -0.11699999999999999 | AE268: 91.55 | AF268: 87.71 | AG268: 0.79 | AH268: AA- | AI268: 6.59e-002 | AJ268: =H268+100*O268 -> 151.61800000000002 | AK268: 154.1 | AL268: 262 | AM268: 62.6 | AN268: 262 | AO268: -0.115 | AP268: 18 | AQ268: 万顺转债!
A269: 133 | B269: 113032 | C269: 桐20转债! | D269: 601233 | E269: 桐昆股份 | F269: 服装纺织 | G269: 纺织行业 | H269: 150.54 | I269: 3.5999999999999999e-003 | J269: 9.7000000000000003e-003 | K269: 21.7 | L269: 1.4499999999999999e-002 | M269: 113.1 | N269: 14.35 | O269: -4.0000000000000001e-003 | P269: 151.22 | Q269: 转股中 | R269: 5.28年 | S269: 3.28年 | T269: 22.4 | U269: 251 | V269: 7.4999999999999997e-002 | W269: 5.0999999999999997e-002 | X269: 7.8e-002 | Y269: 437 | Z269: 2.04 | AA269: -5.3600000000000002e-002 | AB269: -5.7699999999999994e-002 | AC269: -0.10099999999999999 | AD269: -0.10300000000000001 | AE269: 89.32 | AF269: 90.32 | AG269: 0.92 | AH269: AA+ | AI269: 4.4400000000000002e-002 | AJ269: =H269+100*O269 -> 150.13999999999999 | AK269: 149.9 | AL269: 256 | AM269: 59.5 | AN269: 250 | AO269: 0.24600000000000002 | AP269: 19 | AQ269: 桐20转债!
A270: 276 | B270: 113504 | C270: 艾华转债!! | D270: 603989 | E270: 艾华集团 | F270: 电子 | G270: 元器件制 | H270: 133 | I270: -4.0000000000000001e-003 | J270: -4.4000000000000003e-003 | K270: 27.8 | L270: -9.5999999999999992e-003 | M270: 110.3 | N270: 21.13 | O270: 1.1000000000000001e-002 | P270: 131.57 | Q270: 转股中 | R270: 3.28年 | S270: 1.28年 | T270: 5.61 | U270: 7.5 | V270: 1.e-002 | W270: 5.0999999999999997e-002 | X270: 6.7000000000000004e-002 | Y270: 110 | Z270: 4.56 | AA270: -5.6500000000000002e-002 | AB270: -6.1799999999999994e-002 | AC270: -0.14899999999999999 | AD270: -0.152 | AE270: 96.53 | AF270: 95.8 | AG270: 0.88 | AH270: AA | AI270: 4.4900000000000002e-002 | AJ270: =H270+100*O270 -> 134.09999999999999 | AK270: 134.4 | AL270: 163 | AM270: 37.9 | AN270: 113 | AO270: 3.6000000000000004e-002 | AP270: 9 | AQ270: 艾华转债!!
A271: 236 | B271: 113526 | C271: 联泰转债! | D271: 603797 | E271: 联泰环保 | F271: 城市公用 | G271: 三废处理 | H271: 141.09 | I271: 2.5999999999999999e-003 | J271: 6.8000000000000005e-003 | K271: 8.37 | L271: 1.09e-002 | M271: 110.8 | N271: 6.11 | O271: 2.9999999999999999e-002 | P271: 136.99 | Q271: 转股中 | R271: 4.18年 | S271: 2.18年 | T271: 1.93 | U271: 6.6 | V271: 2.4e-002 | W271: 5.0999999999999997e-002 | X271: 7.0000000000000007e-002 | Y271: 38 | Z271: 2.44 | AA271: -5.7300000000000004e-002 | AB271: -6.1600000000000002e-002 | AC271: -0.125 | AD271: -0.127 | AE271: 93.72 | AF271: 93.33 | AG271: 0.86 | AH271: AA+ | AI271: 4.2900000000000001e-002 | AJ271: =H271+100*O271 -> 144.09 | AK271: 145.2 | AL271: 242 | AM271: 51.5 | AN271: 215 | AO271: -5.0000000000000001e-003 | AP271: 8 | AQ271: 联泰转债!
A272: 227 | B272: 128058 | C272: 拓邦转债! | D272: 2139. | E272: 拓邦股份 | F272: 电子 | G272: 电子产品 | H272: 157.1 | I272: -1.09e-002 | J272: 1.8e-003 | K272: 8.63 | L272: -9.1999999999999998e-003 | M272: 122.6 | N272: 5.47 | O272: -4.0000000000000001e-003 | P272: 157.77 | Q272: 转股中 | R272: 4.29年 | S272: 2.29年 | T272: 0.41 | U272: 17 | V272: 0.26200000000000001 | W272: 4.0000000000000001e-003 | X272: 6.9999999999999993e-003 | Y272: 97 | Z272: 3.31 | AA272: -5.74e-002 | AB272: -6.5500000000000003e-002 | AC272: -0.113 | AD272: -0.115 | AE272: 93.95 | AF272: 102.03 | AG272: 1 | AH272: AA | AI272: 4.4900000000000002e-002 | AJ272: =H272+100*O272 -> 156.69999999999999 | AK272: 156.4 | AL272: 267 | AM272: 54.4 | AN272: 224 | AO272: -1.2e-002 | AP272: 20 | AQ272: 拓邦转债!
A273: 307 | B273: 113011 | C273: 光大转债 | D273: 601818 | E273: 光大银行 | F273: 金融 | G273: 银行行业 | H273: 124.18 | I273: -6.6e-003 | J273: -1.6399999999999998e-002 | K273: 4.19 | L273: -3.2300000000000002e-002 | M273: 108.3 | N273: 3.76 | O273: 0.114 | P273: 111.44 | Q273: 转股中 | R273: 2.32年 | S273: 无权 | T273: 242 | U273: 282 | V273: 9.0000000000000011e-003 | W273: 0.11 | X273: 0.12300000000000001 | Y273: 2199. | Z273: 0.67 | AA273: -5.8299999999999998e-002 | AB273: -6.4399999999999999e-002 | AC273: 无权 | AD273: 无权 | AE273: 无权 | AF273: 99.23 | AG273: 0.71 | AH273: AAA | AI273: 3.9199999999999999e-002 | AJ273: =H273+100*O273 -> 135.58000000000001 | AK273: 136.9 | AL273: 182 | AM273: 37.7 | AN273: 111 | AO273: 3.4000000000000002e-002 | AP273: 15 | AQ273: 光大转债
A274: 138 | B274: 128095 | C274: 恩捷转债!! | D274: 2812. | E274: 恩捷股份 | F274: 电子 | G274: 元器件制 | H274: 157.7 | I274: 6.5000000000000006e-003 | J274: 4.4000000000000003e-003 | K274: 103.4 | L274: 1.18e-002 | M274: 115.3 | N274: 65.09 | O274: -6.9999999999999993e-003 | P274: 158.86 | Q274: 转股中 | R274: 5.23年 | S274: 3.23年 | T274: 12.2 | U274: 52 | V274: 2.7000000000000003e-002 | W274: 1.3000000000000001e-002 | X274: 2.1000000000000001e-002 | Y274: 909 | Z274: 9.21 | AA274: -5.9200000000000003e-002 | AB274: -6.3899999999999998e-002 | AC274: -0.114 | AD274: -0.11599999999999999 | AE274: 89.15 | AF274: 91.42 | AG274: 0.92 | AH274: AA | AI274: 4.6399999999999997e-002 | AJ274: =H274+100*O274 -> 157. | AK274: 156.5 | AL274: 269 | AM274: 65.1 | AN274: 265 | AO274: 1.9e-002 | AP274: 17 | AQ274: 恩捷转债!!
A275: 271 | B275: 128036 | C275: 金农转债!! | D275: 2548. | E275: 金新农 | F275: 农业 | G275: 畜牧业 | H275: 135.69 | I275: -2.5099999999999997e-002 | J275: 1.8100000000000002e-002 | K275: 8.29 | L275: -7.1999999999999998e-003 | M275: 110.3 | N275: 7.39 | O275: 0.20999999999999999 | P275: 112.18 | Q275: 转股中 | R275: 3.30年 | S275: 1.30年 | T275: 1.46 | U275: 117 | V275: 0.58799999999999997 | W275: 3.1e-002 | X275: 3.5000000000000003e-002 | Y275: 47 | Z275: 2.19 | AA275: -6.2e-002 | AB275: -6.7199999999999996e-002 | AC275: -0.157 | AD275: -0.16 | AE275: 93.71 | AF275: 89.78 | AG275: 0.98 | AH275: AA- | AI275: 6.59e-002 | AJ275: =H275+100*O275 -> 156.69 | AK275: 159.2 | AL275: 270 | AM275: 65.5 | AN275: 266 | AO275: 3.0000000000000001e-003 | AP275: 15 | AQ275: 金农转债!!
A276: 234 | B276: 128053 | C276: 尚荣转债! | D276: 2551. | E276: 尚荣医疗 | F276: 医药 | G276: 医疗器械 | H276: 151.21 | I276: -3.0999999999999999e-003 | J276: 9.0000000000000011e-003 | K276: 6.83 | L276: 5.8999999999999999e-003 | M276: 114.9 | N276: 4.89 | O276: 8.3000000000000004e-002 | P276: 139.67 | Q276: 转股中 | R276: 4.24年 | S276: 2.24年 | T276: 1.91 | U276: 30 | V276: 0.10300000000000001 | W276: 3.4000000000000002e-002 | X276: 4.8000000000000001e-002 | Y276: 56 | Z276: 1.89 | AA276: -6.3899999999999998e-002 | AB276: -6.9599999999999995e-002 | AC276: -0.11 | AD276: -0.111 | AE276: 93.16 | AF276: 95.78 | AG276: 1 | AH276: AA | AI276: 4.4900000000000002e-002 | AJ276: =H276+100*O276 -> 159.51000000000002 | AK276: 162.7 | AL276: 275 | AM276: 67 | AN276: 268 | AO276: -3.1e-002 | AP276: 27 | AQ276: 尚荣转债!
A277: 168 | B277: 113550 | C277: 常汽转债! | D277: 603035 | E277: 常熟汽饰 | F277: 汽车 | G277: 零部件制 | H277: 169.94 | I277: 4.7400000000000005e-002 | J277: -5.0000000000000001e-004 | K277: 16.5 | L277: 4.9599999999999998e-002 | M277: 121.3 | N277: 9.65 | O277: -6.0000000000000001e-003 | P277: 170.98 | Q277: 转股中 | R277: 4.99年 | S277: 2.99年 | T277: 4.25 | U277: 311 | V277: 0.43099999999999999 | W277: 7.5999999999999998e-002 | X277: 0.13 | Y277: 56 | Z277: 1.65 | AA277: -6.6500000000000004e-002 | AB277: -7.2999999999999995e-002 | AC277: -0.14099999999999999 | AD277: -0.14300000000000002 | AE277: 85.37 | AF277: 88.83 | AG277: 0.95 | AH277: AA- | AI277: 6.59e-002 | AJ277: =H277+100*O277 -> 169.34 | AK277: 168.9 | AL277: 280 | AM277: 80.1 | AN277: 280 | AO277: 3.5000000000000003e-002 | AP277: 15 | AQ277: 常汽转债!
A278: 79 | B278: 128112 | C278: 歌尔转2 | D278: 2241. | E278: 歌尔股份 | F278: 电子 | G278: 电子产品 | H278: 168.67 | I278: -1.2500000000000001e-002 | J278: 7.3000000000000001e-003 | K278: 39.85 | L278: -5.5000000000000005e-003 | M278: 114.5 | N278: 23.27 | O278: -1.4999999999999999e-002 | P278: 171.25 | Q278: 28天 | R278: 5.56年 | S278: 3.56年 | T278: 40 | U278: 613 | V278: 8.9999999999999997e-002 | W278: 3.1e-002 | X278: 5.2999999999999999e-002 | Y278: 1293. | Z278: 7.4 | AA278: -6.8099999999999994e-002 | AB278: -7.2300000000000003e-002 | AC278: -0.12 | AD278: -0.121 | AE278: 87.69 | AF278: 90.26 | AG278: 0.94 | AH278: AA+ | AI278: 4.4400000000000002e-002 | AJ278: =H278+100*O278 -> 167.16999999999999 | AK278: 166.1 | AL278: 278 | AM278: 75.8 | AN278: 278 | AO278: -0.10400000000000001 | AP278: 16 | AQ278: 歌尔转2
A279: 142 | B279: 123042 | C279: 银河转债! | D279: 300619 | E279: 金银河 | F279: 机械装备 | G279: 专用设备 | H279: 166 | I279: -4.87e-002 | J279: 1.6899999999999998e-002 | K279: 30.96 | L279: -3.61e-002 | M279: 115.9 | N279: 24.4 | O279: 0.308 | P279: 126.89 | Q279: 转股中 | R279: 5年55天 | S279: 3年55天 | T279: 1.67 | U279: 1735. | V279: 6.2000000000000002 | W279: 7.2000000000000008e-002 | X279: 9.1999999999999998e-002 | Y279: 23 | Z279: 4.73 | AA279: -6.8699999999999997e-002 | AB279: -7.3599999999999999e-002 | AC279: -0.129 | AD279: -0.13100000000000001 | AE279: 81.45 | AF279: 79.36 | AG279: 0.88 | AH279: A+ | AI279: 7.8399999999999997e-002 | AJ279: =H279+100*O279 -> 196.80000000000001 | AK279: 205.1 | AL279: 297 | AM279: 123.7 | AN279: 300 | AO279: 0.10199999999999999 | AP279: 25 | AQ279: 银河转债!
A280: 188 | B280: 123030 | C280: 九洲转债! | D280: 300040 | E280: 九洲集团 | F280: 能源电力 | G280: 电力设备 | H280: 167.39 | I280: -8.8999999999999999e-003 | J280: 5.3e-003 | K280: 8.33 | L280: -3.5999999999999999e-003 | M280: 120 | N280: 5.65 | O280: 0.13500000000000001 | P280: 147.43 | Q280: 转股中 | R280: 4.75年 | S280: 2.75年 | T280: 0.97 | U280: 72 | V280: 0.44400000000000001 | W280: 3.1e-002 | X280: 4.5999999999999999e-002 | Y280: 31 | Z280: 1.45 | AA280: -6.88e-002 | AB280: -7.5300000000000006e-002 | AC280: -0.10099999999999999 | AD280: -0.10199999999999999 | AE280: 86.1 | AF280: 89.16 | AG280: 1 | AH280: AA- | AI280: 6.59e-002 | AJ280: =H280+100*O280 -> 180.88999999999999 | AK280: 187.3 | AL280: 292 | AM280: 98.2 | AN280: 291 | AO280: -0.10099999999999999 | AP280: 28 | AQ280: 九洲转债!
A281: 97 | B281: 113580 | C281: 康隆转债! | D281: 603665 | E281: 康隆达 | F281: 服装纺织 | G281: 服装行业 | H281: 178.08 | I281: 1.7000000000000001e-002 | J281: -1.7299999999999999e-002 | K281: 26.29 | L281: -4.0000000000000002e-004 | M281: 121.2 | N281: 15.51 | O281: 5.0999999999999997e-002 | P281: 169.5 | Q281: 转股中 | R281: 5.42年 | S281: 3.42年 | T281: 0.96 | U281: 116 | V281: 0.67799999999999994 | W281: 2.4e-002 | X281: 4.0999999999999995e-002 | Y281: 40 | Z281: 4.08 | AA281: -6.9699999999999998e-002 | AB281: -7.5700000000000003e-002 | AC281: -0.13500000000000001 | AD281: -0.13699999999999998 | AE281: 82.62 | AF281: 85.77 | AG281: 0.95 | AH281: AA- | AI281: 6.7400000000000002e-002 | AJ281: =H281+100*O281 -> 183.18000000000001 | AK281: 186.7 | AL281: 290 | AM281: 100.9 | AN281: 292 | AO281: -6.9999999999999993e-003 | AP281: 9 | AQ281: 康隆转债!
A282: 164 | B282: 123036 | C282: 先导转债! | D282: 300450 | E282: 先导智能 | F282: 机械装备 | G282: 专用设备 | H282: 166.612 | I282: -4.8999999999999998e-003 | J282: 2.0000000000000001e-004 | K282: 65.2 | L282: -4.6999999999999993e-003 | M282: 115.1 | N282: 38.99 | O282: -4.0000000000000001e-003 | P282: 167.22 | Q282: 转股中 | R282: 5年21天 | S282: 3年21天 | T282: 3.91 | U282: 213 | V282: 0.32000000000000001 | W282: 6.9999999999999993e-003 | X282: 1.1000000000000001e-002 | Y282: 574 | Z282: 12.87 | AA282: -7.17e-002 | AB282: -7.6399999999999996e-002 | AC282: -0.13500000000000001 | AD282: -0.13600000000000001 | AE282: 89.65 | AF282: 91.93 | AG282: 1 | AH282: AA | AI282: 4.6399999999999997e-002 | AJ282: =H282+100*O282 -> 166.21199999999999 | AK282: 166 | AL282: 277 | AM282: 74.1 | AN282: 277 | AO282: 1.7000000000000001e-002 | AP282: 17 | AQ282: 先导转债!
A283: 311 | B283: 113009 | C283: 广汽转债!! | D283: 601238 | E283: 广汽集团 | F283: 汽车 | G283: 乘用车 | H283: 117.59 | I283: 3.0800000000000001e-002 | J283: 1.47e-002 | K283: 14.29 | L283: 0.10000000000000001 | M283: 107.5 | N283: 14.23 | O283: 0.17100000000000001 | P283: 100.42 | Q283: 转股中 | R283: 1.17年 | S283: 回售中 | T283: 25.5 | U283: 560 | V283: 0.18600000000000003 | W283: 1.7000000000000001e-002 | X283: 1.7000000000000001e-002 | Y283: 1463. | Z283: 1.77 | AA283: -7.4499999999999997e-002 | AB283: -8.539999999999999e-002 | AC283: 回售中 | AD283: 回售中 | AE283: 100.25 | AF283: 102.82 | AG283: 0.45 | AH283: AAA | AI283: 3.9199999999999999e-002 | AJ283: =H283+100*O283 -> 134.69 | AK283: 134.8 | AL283: 164 | AM283: 31.9 | AN283: 40 | AO283: 0.11199999999999999 | AP283: 15 | AQ283: 广汽转债!!
A284: 223 | B284: 123022 | C284: 长信转债!! | D284: 300088 | E284: 长信科技 | F284: 通信互联 | G284: 通信设备 | H284: 160.099 | I284: -8.199999999999999e-003 | J284: 1.6000000000000001e-003 | K284: 9.87 | L284: -6.9999999999999993e-003 | M284: 114.9 | N284: 6.15 | O284: -2.e-003 | P284: 160.49 | Q284: 转股中 | R284: 4.32年 | S284: 2.32年 | T284: 2.92 | U284: 36 | V284: 7.8e-002 | W284: 1.2e-002 | X284: 1.9e-002 | Y284: 242 | Z284: 3.5 | AA284: -7.5199999999999989e-002 | AB284: -8.0600000000000005e-002 | AC284: -0.11699999999999999 | AD284: -0.11900000000000001 | AE284: 92.8 | AF284: 95.41 | AG284: 0.93 | AH284: AA | AI284: 4.4900000000000002e-002 | AJ284: =H284+100*O284 -> 159.899 | AK284: 159.7 | AL284: 271 | AM284: 64.3 | AN284: 263 | AO284: -2.e-002 | AP284: 12 | AQ284: 长信转债!!
A285: 120 | B285: 128102 | C285: 海大转债! | D285: 2311. | E285: 海大集团 | F285: 农业 | G285: 畜牧业 | H285: 173.29 | I285: 5.0000000000000001e-004 | J285: -1.e-003 | K285: 60.37 | L285: -5.0000000000000001e-004 | M285: 114.1 | N285: 34.74 | O285: -3.0000000000000001e-003 | P285: 173.78 | Q285: 转股中 | R285: 5.33年 | S285: 4.33年 | T285: 8.04 | U285: 93 | V285: 6.7000000000000004e-002 | W285: 8.0000000000000002e-003 | X285: 1.3999999999999999e-002 | Y285: 972 | Z285: 8.38 | AA285: -7.6399999999999996e-002 | AB285: -8.0600000000000005e-002 | AC285: -0.10199999999999999 | AD285: -0.10300000000000001 | AE285: 86.11 | AF285: 90.85 | AG285: 1 | AH285: AA+ | AI285: 4.4400000000000002e-002 | AJ285: =H285+100*O285 -> 172.98999999999998 | AK285: 172.8 | AL285: 282 | AM285: 82 | AN285: 283 | AO285: 5.0000000000000001e-003 | AP285: 12 | AQ285: 海大转债!
A286: 257 | B286: 123014 | C286: 凯发转债! | D286: 300407 | E286: 凯发电气 | F286: 能源电力 | G286: 电力设备 | H286: 134.812 | I286: -1.95e-002 | J286: 8.3999999999999995e-003 | K286: 9.19 | L286: -1.3899999999999999e-002 | M286: 108.5 | N286: 8.12 | O286: 0.191 | P286: 113.18 | Q286: 转股中 | R286: 2.68年 | S286: 0.68年 | T286: 1.16 | U286: 55 | V286: 0.34700000000000003 | W286: 4.0999999999999995e-002 | X286: 4.7e-002 | Y286: 28 | Z286: 2.08 | AA286: -7.8600000000000003e-002 | AB286: -8.3900000000000002e-002 | AC286: -0.29899999999999999 | AD286: -0.30099999999999999 | AE286: 95.14 | AF286: 89.33 | AG286: 0.8 | AH286: A+ | AI286: 7.6200000000000004e-002 | AJ286: =H286+100*O286 -> 153.91200000000001 | AK286: 156.4 | AL286: 268 | AM286: 61.3 | AN286: 256 | AO286: -7.8e-002 | AP286: 16 | AQ286: 凯发转债!
A287: 249 | B287: 113521 | C287: 科森转债!! | D287: 603626 | E287: 科森科技 | F287: 通信互联 | G287: 通信设备 | H287: 157.89 | I287: -1.37e-002 | J287: 9.3999999999999986e-003 | K287: 13.87 | L287: -4.3e-003 | M287: 114.5 | N287: 8.7 | O287: -1.e-002 | P287: 159.43 | Q287: 转股中 | R287: 3.99年 | S287: 1.99年 | T287: 0.46 | U287: 34 | V287: 0.46799999999999997 | W287: 6.9999999999999993e-003 | X287: 1.1000000000000001e-002 | Y287: 67 | Z287: 3.08 | AA287: -7.8600000000000003e-002 | AB287: -8.43e-002 | AC287: -0.14000000000000001 | AD287: -0.14199999999999999 | AE287: 93.6 | AF287: 96.4 | AG287: 1 | AH287: AA | AI287: 4.4900000000000002e-002 | AJ287: =H287+100*O287 -> 156.88999999999999 | AK287: 156.4 | AL287: 266 | AM287: 60 | AN287: 254 | AO287: -0.11599999999999999 | AP287: 24 | AQ287: 科森转债!!
A288: 199 | B288: 123027 | C288: 蓝晓转债! | D288: 300487 | E288: 蓝晓科技 | F288: 化工 | G288: 化工 | H288: 175.5 | I288: -2.4199999999999999e-002 | J288: 1.6200000000000003e-002 | K288: 46.14 | L288: -8.6e-003 | M288: 119.5 | N288: 29.33 | O288: 0.11599999999999999 | P288: 157.31 | Q288: 转股中 | R288: 4.56年 | S288: 2.56年 | T288: 1.08 | U288: 163 | V288: 0.84900000000000009 | W288: 1.1000000000000001e-002 | X288: 1.7000000000000001e-002 | Y288: 99 | Z288: 6.23 | AA288: -8.2599999999999993e-002 | AB288: -8.900000000000001e-002 | AC288: -0.11900000000000001 | AD288: -0.121 | AE288: 85.56 | AF288: 86.02 | AG288: 0.94 | AH288: A+ | AI288: 7.690000000000001e-002 | AJ288: =H288+100*O288 -> 187.09999999999999 | AK288: 193.7 | AL288: 295 | AM288: 107.7 | AN288: 294 | AO288: -6.0000000000000001e-003 | AP288: 21 | AQ288: 蓝晓转债!
A289: 297 | B289: 128019 | C289: 久立转2! | D289: 2318. | E289: 久立特材 | F289: 石油天然 | G289: 石油天然 | H289: 140.166 | I289: 3.1400000000000004e-002 | J289: -1.32e-002 | K289: 10.59 | L289: 2.0199999999999999e-002 | M289: 108.8 | N289: 7.62 | O289: 9.0000000000000011e-003 | P289: 138.98 | Q289: 转股中 | R289: 2.97年 | S289: 0.97年 | T289: 6.78 | U289: 48 | V289: 5.0999999999999997e-002 | W289: 7.5999999999999998e-002 | X289: 0.106 | Y289: 89 | Z289: 2.54 | AA289: -8.2799999999999999e-002 | AB289: -8.77e-002 | AC289: -0.23999999999999999 | AD289: -0.24100000000000002 | AE289: 96.7 | AF289: 95.86 | AG289: 0.9 | AH289: AA | AI289: 4.4199999999999996e-002 | AJ289: =H289+100*O289 -> 141.066 | AK289: 141.4 | AL289: 213 | AM289: 44.7 | AN289: 173 | AO289: 2.e-002 | AP289: 13 | AQ289: 久立转2!
A290: 200 | B290: 113537 | C290: 文灿转债!! | D290: 603348 | E290: 文灿股份 | F290: 汽车 | G290: 零部件制 | H290: 180.12 | I290: 0.126 | J290: -3.0800000000000001e-002 | K290: 34.18 | L290: 0.10000000000000001 | M290: 121.5 | N290: 19.43 | O290: 2.4e-002 | P290: 175.91 | Q290: 转股中 | R290: 4.55年 | S290: 2.55年 | T290: 2.45 | U290: 1098. | V290: 2.5099999999999998 | W290: 2.8999999999999998e-002 | X290: 5.0000000000000003e-002 | Y290: 86 | Z290: 3.51 | AA290: -8.4499999999999992e-002 | AB290: -9.1600000000000001e-002 | AC290: -0.124 | AD290: -0.126 | AE290: 87.97 | AF290: 91.53 | AG290: 0.95 | AH290: AA- | AI290: 6.59e-002 | AJ290: =H290+100*O290 -> 182.52000000000001 | AK290: 184.3 | AL290: 288 | AM290: 92.8 | AN290: 290 | AO290: 0.16699999999999998 | AP290: 26 | AQ290: 文灿转债!!
A291: 94 | B291: 113582 | C291: 火炬转债 | D291: 603678 | E291: 火炬电子 | F291: 电子 | G291: 元器件制 | H291: 187.54 | I291: -5.9999999999999995e-004 | J291: -3.3e-003 | K291: 49.7 | L291: -4.0000000000000001e-003 | M291: 115.3 | N291: 25.33 | O291: -4.4000000000000004e-002 | P291: 196.21 | Q291: 12天 | R291: 5.52年 | S291: 3.52年 | T291: 6 | U291: 229 | V291: 0.20100000000000001 | W291: 2.7000000000000003e-002 | X291: 5.2000000000000005e-002 | Y291: 225 | Z291: 6.48 | AA291: -8.5800000000000001e-002 | AB291: -8.9999999999999997e-002 | AC291: -0.14300000000000002 | AD291: -0.14499999999999999 | AE291: 87.99 | AF291: 90.23 | AG291: 0.97 | AH291: AA | AI291: 4.6399999999999997e-002 | AJ291: =H291+100*O291 -> 183.13999999999999 | AK291: 178.9 | AL291: 285 | AM291: 88.6 | AN291: 286 | AO291: 4.0000000000000001e-002 | AP291: 5 | AQ291: 火炬转债
A292: 206 | B292: 128065 | C292: 雅化转债!! | D292: 2497. | E292: 雅化集团 | F292: 化工 | G292: 化工 | H292: 167 | I292: 2.7699999999999999e-002 | J292: 1.8e-003 | K292: 15 | L292: 2.9500000000000002e-002 | M292: 110.9 | N292: 8.95 | O292: -4.0000000000000001e-003 | P292: 167.6 | Q292: 转股中 | R292: 4.40年 | S292: 2.40年 | T292: 2.99 | U292: 439 | V292: 0.877 | W292: 2.1000000000000001e-002 | X292: 3.5000000000000003e-002 | Y292: 144 | Z292: 4.95 | AA292: -9.0299999999999991e-002 | AB292: -9.4200000000000006e-002 | AC292: -0.121 | AD292: -0.12300000000000001 | AE292: 92.48 | AF292: 91.78 | AG292: 1 | AH292: AA | AI292: 4.4900000000000002e-002 | AJ292: =H292+100*O292 -> 166.59999999999999 | AK292: 166.4 | AL292: 279 | AM292: 73.9 | AN292: 276 | AO292: 0.105 | AP292: 22 | AQ292: 雅化转债!!
A293: 84 | B293: 113586 | C293: 上机转债 | D293: 603185 | E293: 上机数控 | F293: 机械装备 | G293: 专用设备 | H293: 211.08 | I293: 8.43e-002 | J293: 1.3300000000000001e-002 | K293: 76.23 | L293: 0.10000000000000001 | M293: 120.8 | N293: 33.3 | O293: -7.8e-002 | P293: 228.92 | Q293: 25天 | R293: 5.55年 | S293: 3.55年 | T293: 6.65 | U293: 689 | V293: 0.498 | W293: 3.7999999999999999e-002 | X293: 8.5999999999999993e-002 | Y293: 177 | Z293: 8.81 | AA293: -9.7200000000000009e-002 | AB293: -0.10300000000000001 | AC293: -0.16500000000000001 | AD293: -0.16699999999999998 | AE293: 81.96 | AF293: 84.78 | AG293: 0.98 | AH293: AA- | AI293: 6.7400000000000002e-002 | AJ293: =H293+100*O293 -> 203.28 | AK293: 193.2 | AL293: 294 | AM293: 108.5 | AN293: 295 | AO293: -1.6e-002 | AP293: 7 | AQ293: 上机转债
A294: 192 | B294: 113543 | C294: 欧派转债! | D294: 603833 | E294: 欧派家居 | F294: 其他 | G294: 家居用品 | H294: 186.42 | I294: 1.6500000000000001e-002 | J294: -1.8e-003 | K294: 134.03 | L294: 1.52e-002 | M294: 114.9 | N294: 71.69 | O294: -3.0000000000000001e-003 | P294: 186.96 | Q294: 转股中 | R294: 4.74年 | S294: 3.74年 | T294: 6.4 | U294: 117 | V294: 9.9000000000000005e-002 | W294: 8.0000000000000002e-003 | X294: 1.4999999999999999e-002 | Y294: 799 | Z294: 7.39 | AA294: -9.8599999999999993e-002 | AB294: -0.10300000000000001 | AC294: -0.13100000000000001 | AD294: -0.13300000000000001 | AE294: 88.88 | AF294: 93.69 | AG294: 0.96 | AH294: AA | AI294: 4.4900000000000002e-002 | AJ294: =H294+100*O294 -> 186.11999999999998 | AK294: 185.9 | AL294: 289 | AM294: 92.2 | AN294: 289 | AO294: 5.5999999999999994e-002 | AP294: 14 | AQ294: 欧派转债!
A295: 172 | B295: 123034 | C295: 通光转债! | D295: 300265 | E295: 通光线缆 | F295: 通信互联 | G295: 通信设备 | H295: 201.8 | I295: -2.0400000000000001e-002 | J295: -1.3000000000000001e-002 | K295: 12.95 | L295: -3.5000000000000003e-002 | M295: 118 | N295: 7.97 | O295: 0.24199999999999999 | P295: 162.48 | Q295: 转股中 | R295: 4.96年 | S295: 2.96年 | T295: 0.78 | U295: 557 | V295: 3.46 | W295: 1.7000000000000001e-002 | X295: 2.7000000000000003e-002 | Y295: 47 | Z295: 3.76 | AA295: -0.10400000000000001 | AB295: -0.109 | AC295: -0.11900000000000001 | AD295: -0.11900000000000001 | AE295: 82.31 | AF295: 82.32 | AG295: 0.95 | AH295: A+ | AI295: 7.690000000000001e-002 | AJ295: =H295+100*O295 -> 226. | AK295: 241.1 | AL295: 301 | AM295: 158.8 | AN295: 301 | AO295: 1.3000000000000001e-002 | AP295: 25 | AQ295: 通光转债!
A296: 247 | B296: 113020 | C296: 桐昆转债!! | D296: 601233 | E296: 桐昆股份 | F296: 服装纺织 | G296: 纺织行业 | H296: 174.84 | I296: 1.3500000000000002e-002 | J296: 1.e-003 | K296: 21.7 | L296: 1.4499999999999999e-002 | M296: 112.3 | N296: 12.28 | O296: -1.1000000000000001e-002 | P296: 176.71 | Q296: 转股中 | R296: 3.997年 | S296: 1.997年 | T296: 9.13 | U296: 976 | V296: 0.61799999999999999 | W296: 2.1000000000000001e-002 | X296: 3.7000000000000005e-002 | Y296: 437 | Z296: 2.04 | AA296: -0.106 | AB296: -0.111 | AC296: -0.16600000000000001 | AD296: -0.16699999999999998 | AE296: 93.92 | AF296: 95.22 | AG296: 1 | AH296: AA+ | AI296: 4.2900000000000001e-002 | AJ296: =H296+100*O296 -> 173.74000000000001 | AK296: 173 | AL296: 283 | AM296: 77.7 | AN296: 279 | AO296: 0.24600000000000002 | AP296: 15 | AQ296: 桐昆转债!!
A297: 300 | B297: 128017 | C297: 金禾转债!! | D297: 2597. | E297: 金禾实业 | F297: 化工 | G297: 化工 | H297: 153.5 | I297: 1.7899999999999999e-002 | J297: -5.1000000000000004e-003 | K297: 34.41 | L297: 1.3500000000000002e-002 | M297: 108.8 | N297: 22.42 | O297: 0. | P297: 153.48 | Q297: 转股中 | R297: 2.95年 | S297: 0.95年 | T297: 5.54 | U297: 59 | V297: 6.9000000000000006e-002 | W297: 2.8999999999999998e-002 | X297: 4.4000000000000004e-002 | Y297: 193 | Z297: 4.19 | AA297: -0.111 | AB297: -0.11599999999999999 | AC297: -0.29999999999999999 | AD297: -0.30199999999999999 | AE297: 96.78 | AF297: 95.94 | AG297: 0.94 | AH297: AA | AI297: 4.4199999999999996e-002 | AJ297: =H297+100*O297 -> 153.5 | AK297: 153.5 | AL297: 261 | AM297: 56.7 | AN297: 237 | AO297: 8.9999999999999997e-002 | AP297: 11 | AQ297: 金禾转债!!
A298: 73 | B298: 128115 | C298: 巨星转债 | D298: 2444. | E298: 巨星科技 | F298: 机械装备 | G298: 通用设备 | H298: 221.294 | I298: 1.6000000000000001e-003 | J298: -1.9e-003 | K298: 28.57 | L298: -2.9999999999999997e-004 | M298: 115.3 | N298: 12.28 | O298: -4.9000000000000002e-002 | P298: 232.65 | Q298: 45天 | R298: 5.59年 | S298: 3.59年 | T298: 9.73 | U298: 118 | V298: 5.5e-002 | W298: 3.2000000000000001e-002 | X298: 7.400000000000001e-002 | Y298: 307 | Z298: 3.62 | AA298: -0.11199999999999999 | AB298: -0.11599999999999999 | AC298: -0.16800000000000001 | AD298: -0.17000000000000001 | AE298: 89.96 | AF298: 89.92 | AG298: 0.98 | AH298: AA | AI298: 4.6399999999999997e-002 | AJ298: =H298+100*O298 -> 216.39400000000001 | AK298: 209.9 | AL298: 300 | AM298: 120 | AN298: 299 | AO298: 7.5999999999999998e-002 | AP298: 4 | AQ298: 巨星转债
A299: 93 | B299: 113035 | C299: 福莱转债 | D299: 601865 | E299: 福莱特 | F299: 能源电力 | G299: 太阳能 | H299: 235.44 | I299: 2.5600000000000001e-002 | J299: -1.9099999999999999e-002 | K299: 35.34 | L299: 6.6e-003 | M299: 120.3 | N299: 13.48 | O299: -0.10199999999999999 | P299: 262.17 | Q299: 13天 | R299: 5.52年 | S299: 3.52年 | T299: 14.5 | U299: 520 | V299: 0.153 | W299: 2.1000000000000001e-002 | X299: 5.5e-002 | Y299: 691 | Z299: 12.98 | AA299: -0.11599999999999999 | AB299: -0.122 | AC299: -0.106 | AD299: -0.107 | AE299: 87.99 | AF299: 94.13 | AG299: 0.98 | AH299: AA | AI299: 4.6399999999999997e-002 | AJ299: =H299+100*O299 -> 225.24000000000001 | AK299: 208.7 | AL299: 299 | AM299: 114.6 | AN299: 297 | AO299: -6.8000000000000005e-002 | AP299: 7 | AQ299: 福莱转债
A300: 285 | B300: 128030 | C300: 天康转债!! | D300: 2100. | E300: 天康生物 | F300: 农业 | G300: 畜牧业 | H300: 174 | I300: -1.6399999999999998e-002 | J300: 8.199999999999999e-003 | K300: 13.27 | L300: -8.199999999999999e-003 | M300: 112.3 | N300: 7.85 | O300: 2.8999999999999998e-002 | P300: 169.04 | Q300: 转股中 | R300: 3年32天 | S300: 1年32天 | T300: 0.98 | U300: 27 | V300: 0.155 | W300: 6.9999999999999993e-003 | X300: 1.2e-002 | Y300: 143 | Z300: 2.39 | AA300: -0.13500000000000001 | AB300: -0.14000000000000001 | AC300: -0.31900000000000001 | AD300: -0.32100000000000001 | AE300: 97.35 | AF300: 98.37 | AG300: 1 | AH300: AA | AI300: 4.4900000000000002e-002 | AJ300: =H300+100*O300 -> 176.90000000000001 | AK300: 179 | AL300: 286 | AM300: 80.6 | AN300: 282 | AO300: -2.6000000000000002e-002 | AP300: 11 | AQ300: 天康转债!!
A301: 95 | B301: 113581 | C301: 龙蟠转债! | D301: 603906 | E301: 龙蟠科技 | F301: 化工 | G301: 化工 | H301: 280.43 | I301: 6.8999999999999999e-003 | J301: -3.4999999999999996e-003 | K301: 26.66 | L301: 3.4000000000000002e-003 | M301: 129.6 | N301: 9.48 | O301: -3.0000000000000001e-003 | P301: 281.22 | Q301: 转股中 | R301: 5.42年 | S301: 3.42年 | T301: 0.78 | U301: 195 | V301: 0.89599999999999991 | W301: 9.0000000000000011e-003 | X301: 2.4e-002 | Y301: 90 | Z301: 5.51 | AA301: -0.13600000000000001 | AB301: -0.14300000000000002 | AC301: -0.124 | AD301: -0.125 | AE301: 81.72 | AF301: 87.21 | AG301: 1 | AH301: A+ | AI301: 7.8399999999999997e-002 | AJ301: =H301+100*O301 -> 280.13 | AK301: 279.6 | AL301: 305 | AM301: 192.4 | AN301: 305 | AO301: 8.6999999999999994e-002 | AP301: 14 | AQ301: 龙蟠转债!
A302: 186 | B302: 123031 | C302: 晶瑞转债! | D302: 300655 | E302: 晶瑞股份 | F302: 化工 | G302: 化工 | H302: 244.8 | I302: -8.8999999999999999e-003 | J302: -6.8999999999999999e-003 | K302: 37.04 | L302: -1.6200000000000003e-002 | M302: 115.8 | N302: 18.43 | O302: 0.218 | P302: 200.98 | Q302: 转股中 | R302: 4.77年 | S302: 2.77年 | T302: 0.63 | U302: 113 | V302: 0.73199999999999998 | W302: 9.0000000000000011e-003 | X302: 1.8000000000000002e-002 | Y302: 70 | Z302: 5.44 | AA302: -0.14699999999999999 | AB302: -0.152 | AC302: -0.155 | AD302: -0.156 | AE302: 83.24 | AF302: 81.86 | AG302: 0.97 | AH302: A+ | AI302: 7.690000000000001e-002 | AJ302: =H302+100*O302 -> 266.60000000000002 | AK302: 288.6 | AL302: 306 | AM302: 205.4 | AN302: 306 | AO302: -3.1e-002 | AP302: 15 | AQ302: 晶瑞转债!
A303: 287 | B303: 128028 | C303: 赣锋转债!! | D303: 2460. | E303: 赣锋锂业 | F303: 有色金属 | G303: 小金属 | H303: 180.355 | I303: 3.1200000000000002e-002 | J303: 8.6e-003 | K303: 75.49 | L303: 3.9800000000000002e-002 | M303: 109.3 | N303: 41.68 | O303: -4.0000000000000001e-003 | P303: 181.12 | Q303: 转股中 | R303: 3年31天 | S303: 1年31天 | T303: 9.06 | U303: 543 | V303: 0.33500000000000002 | W303: 9.0000000000000011e-003 | X303: 1.6e-002 | Y303: 1006. | Z303: 10.84 | AA303: -0.152 | AB303: -0.156 | AC303: -0.33899999999999997 | AD303: -0.34100000000000003 | AE303: 96.64 | AF303: 95.69 | AG303: 1 | AH303: AA | AI303: 4.4900000000000002e-002 | AJ303: =H303+100*O303 -> 179.95499999999998 | AK303: 179.6 | AL303: 287 | AM303: 83 | AN303: 284 | AO303: 9.5000000000000001e-002 | AP303: 14 | AQ303: 赣锋转债!!
A304: 238 | B304: 123018 | C304: 溢利转债! | D304: 300381 | E304: 溢多利 | F304: 医药 | G304: 原料药 | H304: 228.9 | I304: 4.0000000000000001e-003 | J304: -6.0999999999999995e-003 | K304: 13.52 | L304: -2.2000000000000001e-003 | M304: 114.9 | N304: 8.32 | O304: 0.40899999999999997 | P304: 162.5 | Q304: 转股中 | R304: 4年30天 | S304: 2年30天 | T304: 0.54 | U304: 41 | V304: 0.33600000000000002 | W304: 8.0000000000000002e-003 | X304: 1.3000000000000001e-002 | Y304: 66 | Z304: 2.28 | AA304: -0.158 | AB304: -0.16300000000000001 | AC304: -0.21199999999999999 | AD304: -0.21299999999999999 | AE304: 89.73 | AF304: 89.08 | AG304: 0.95 | AH304: AA- | AI304: 6.59e-002 | AJ304: =H304+100*O304 -> 269.80000000000001 | AK304: 295.3 | AL304: 307 | AM304: 205.6 | AN304: 307 | AO304: 2.4e-002 | AP304: 13 | AQ304: 溢利转债!
A305: 269 | B305: 113509 | C305: 新泉转债!! | D305: 603179 | E305: 新泉股份 | F305: 汽车 | G305: 零部件制 | H305: 203.69 | I305: -4.5000000000000005e-003 | J305: -1.3300000000000001e-002 | K305: 28.38 | L305: -1.83e-002 | M305: 110.3 | N305: 14.22 | O305: 2.1000000000000001e-002 | P305: 199.58 | Q305: 转股中 | R305: 3.54年 | S305: 1.54年 | T305: 1.22 | U305: 30 | V305: 0.11800000000000001 | W305: 1.3999999999999999e-002 | X305: 2.7000000000000003e-002 | Y305: 90 | Z305: 4.26 | AA305: -0.16200000000000001 | AB305: -0.16600000000000001 | AC305: -0.27000000000000002 | AD305: -0.27100000000000002 | AE305: 95.45 | AF305: 94.73 | AG305: 0.97 | AH305: AA | AI305: 4.4900000000000002e-002 | AJ305: =H305+100*O305 -> 205.78999999999999 | AK305: 207.8 | AL305: 298 | AM305: 112.4 | AN305: 296 | AO305: -0.10199999999999999 | AP305: 10 | AQ305: 新泉转债!!
A306: 304 | B306: 127004 | C306: 模塑转债!! | D306: 700. | E306: 模塑科技 | F306: 汽车 | G306: 零部件制 | H306: 177.5 | I306: 1.66e-002 | J306: -7.0999999999999995e-003 | K306: 6.21 | L306: 3.5000000000000003e-002 | M306: 113.3 | N306: 7.46 | O306: 1.1299999999999999 | P306: 83.24 | Q306: 转股中 | R306: 2.53年 | S306: 0.53年 | T306: 1.33 | U306: 1672. | V306: 6.9699999999999998 | W306: 2.3e-002 | X306: 1.9e-002 | Y306: 57 | Z306: 2.19 | AA306: -0.16500000000000001 | AB306: -0.17199999999999999 | AC306: -0.63100000000000001 | AD306: -0.63400000000000001 | AE306: 98.78 | AF306: 101.56 | AG306: 0.27 | AH306: AA | AI306: 4.4199999999999996e-002 | AJ306: =H306+100*O306 -> 290.5 | AK306: 271.8 | AL306: 304 | AM306: 170.2 | AN306: 303 | AO306: 1.6e-002 | AP306: 37 | AQ306: 模塑转债!!
A307: 262 | B307: 128041 | C307: 盛路转债!! | D307: 2446. | E307: 盛路通信 | F307: 通信互联 | G307: 通信设备 | H307: 226.7 | I307: -2.0799999999999999e-002 | J307: 2.7099999999999999e-002 | K307: 7.89 | L307: 6.4000000000000003e-003 | M307: 114.3 | N307: 6.85 | O307: 0.96799999999999997 | P307: 115.18 | Q307: 转股中 | R307: 3.65年 | S307: 1.65年 | T307: 0.53 | U307: 211 | V307: 1.72 | W307: 6.9999999999999993e-003 | X307: 9.0000000000000011e-003 | Y307: 71 | Z307: 2.38 | AA307: -0.17300000000000001 | AB307: -0.17899999999999999 | AC307: -0.27500000000000002 | AD307: -0.27600000000000002 | AE307: 94.95 | AF307: 97.64 | AG307: 1 | AH307: AA | AI307: 4.4900000000000002e-002 | AJ307: =H307+100*O307 -> 323.5 | AK307: 338.2 | AL307: 309 | AM307: 240.6 | AN307: 309 | AO307: 4.9000000000000002e-002 | AP307: 12 | AQ307: 盛路转债!!
A308: 251 | B308: 113520 | C308: 百合转债! | D308: 603313 | E308: 梦百合 | F308: 其他 | G308: 家居用品 | H308: 250.32 | I308: -1.e-003 | J308: 1.1699999999999999e-002 | K308: 35 | L308: 1.1000000000000001e-002 | M308: 114.5 | N308: 14.28 | O308: 2.1000000000000001e-002 | P308: 245.1 | Q308: 转股中 | R308: 3.97年 | S308: 1.97年 | T308: 0.55 | U308: 124 | V308: 0.90400000000000003 | W308: 5.0000000000000001e-003 | X308: 1.1000000000000001e-002 | Y308: 121 | Z308: 4.33 | AA308: -0.18100000000000002 | AB308: -0.18600000000000003 | AC308: -0.24299999999999999 | AD308: -0.24399999999999999 | AE308: 89.82 | AF308: 89.3 | AG308: 0.98 | AH308: AA- | AI308: 6.59e-002 | AJ308: =H308+100*O308 -> 252.41999999999999 | AK308: 255.5 | AL308: 302 | AM308: 165.7 | AN308: 302 | AO308: 1.8000000000000002e-002 | AP308: 12 | AQ308: 百合转债!
A309: 237 | B309: 128052 | C309: 凯龙转债! | D309: 2783. | E309: 凯龙股份 | F309: 化工 | G309: 化工 | H309: 265 | I309: 3.8e-003 | J309: -3.0000000000000001e-003 | K309: 12.5 | L309: 8.0000000000000004e-004 | M309: 115 | N309: 6.67 | O309: 0.41399999999999998 | P309: 187.41 | Q309: 转股中 | R309: 4年31天 | S309: 2年31天 | T309: 0.32 | U309: 376 | V309: 4.3099999999999996 | W309: 6.9999999999999993e-003 | X309: 1.3000000000000001e-002 | Y309: 47 | Z309: 2.74 | AA309: -0.188 | AB309: -0.192 | AC309: -0.23600000000000002 | AD309: -0.23699999999999999 | AE309: 93.88 | AF309: 96.51 | AG309: 1 | AH309: AA | AI309: 4.4900000000000002e-002 | AJ309: =H309+100*O309 -> 306.39999999999998 | AK309: 342.6 | AL309: 310 | AM309: 246.1 | AN309: 310 | AO309: -6.3e-002 | AP309: 12 | AQ309: 凯龙转债!
A310: 255 | B310: 123015 | C310: 蓝盾转债!! | D310: 300297 | E310: 蓝盾股份 | F310: 计算机及 | G310: 软件开发 | H310: 255.01 | I310: -3.04e-002 | J310: 3.6499999999999998e-002 | K310: 6.41 | L310: 6.3e-003 | M310: 112.3 | N310: 5.79 | O310: 1.3 | P310: 110.71 | Q310: 转股中 | R310: 3.73年 | S310: 1.73年 | T310: 1 | U310: 758 | V310: 2.8900000000000001 | W310: 1.2e-002 | X310: 1.3999999999999999e-002 | Y310: 80 | Z310: 2.08 | AA310: -0.20000000000000001 | AB310: -0.20399999999999999 | AC310: -0.28600000000000003 | AD310: -0.28699999999999998 | AE310: 91.17 | AF310: 88.92 | AG310: 0.97 | AH310: AA- | AI310: 6.59e-002 | AJ310: =H310+100*O310 -> 385.00999999999999 | AK310: 399.3 | AL310: 312 | AM310: 308.1 | AN310: 312 | AO310: -7.6999999999999999e-002 | AP310: 18 | AQ310: 蓝盾转债!!
A311: 266 | B311: 110044 | C311: 广电转债!! | D311: 600831 | E311: 广电网络 | F311: 传媒娱乐 | G311: 影视娱乐 | H311: 248.83 | I311: 1.9e-003 | J311: -7.8000000000000005e-003 | K311: 7.07 | L311: -9.7999999999999997e-003 | M311: 112.3 | N311: 6.9 | O311: 1.4299999999999999 | P311: 102.46 | Q311: 转股中 | R311: 3.60年 | S311: 1.60年 | T311: 0.71 | U311: 152 | V311: 0.85599999999999998 | W311: 1.3999999999999999e-002 | X311: 1.3999999999999999e-002 | Y311: 50 | Z311: 1.36 | AA311: -0.20100000000000001 | AB311: -0.20499999999999999 | AC311: -0.30599999999999999 | AD311: -0.307 | AE311: 95.18 | AF311: 96.17 | AG311: 0.6 | AH311: AA | AI311: 4.4900000000000002e-002 | AJ311: =H311+100*O311 -> 391.83000000000004 | AK311: 395.2 | AL311: 311 | AM311: 299 | AN311: 311 | AO311: -1.3999999999999999e-002 | AP311: 10 | AQ311: 广电转债!!
A312: 156 | B312: 113555 | C312: 振德转债! | D312: 603301 | E312: 振德医疗 | F312: 医药 | G312: 医疗器械 | H312: 421.29 | I312: -3.7000000000000002e-003 | J312: 2.2000000000000001e-003 | K312: 59.26 | L312: -1.5e-003 | M312: 124.8 | N312: 14.01 | O312: -4.0000000000000001e-003 | P312: 422.98 | Q312: 转股中 | R312: 5年29天 | S312: 3年29天 | T312: 0.7 | U312: 111 | V312: 0.374 | W312: 5.0000000000000001e-003 | X312: 2.3e-002 | Y312: 128 | Z312: 3.58 | AA312: -0.21600000000000003 | AB312: -0.222 | AC312: -0.17800000000000002 | AD312: -0.17800000000000002 | AE312: 85.02 | AF312: 90.38 | AG312: 1 | AH312: AA- | AI312: 6.7400000000000002e-002 | AJ312: =H312+100*O312 -> 420.89000000000004 | AK312: 419.6 | AL312: 313 | AM312: 329.2 | AN312: 313 | AO312: -0.125 | AP312: 15 | AQ312: 振德转债!
A313: 248 | B313: 127008 | C313: 特发转债! | D313: 70. | E313: 特发信息 | F313: 通信互联 | G313: 通信设备 | H313: 251.4 | I313: 5.6000000000000008e-003 | J313: -6.6e-003 | K313: 10.34 | L313: -1.e-003 | M313: 110.5 | N313: 5.54 | O313: 0.34700000000000003 | P313: 186.64 | Q313: 转股中 | R313: 2.99年 | S313: 0.99年 | T313: 0.59 | U313: 447 | V313: 2.9500000000000002 | W313: 6.9999999999999993e-003 | X313: 1.3000000000000001e-002 | Y313: 84 | Z313: 2.98 | AA313: -0.24199999999999999 | AB313: -0.247 | AC313: -0.50900000000000001 | AD313: -0.51000000000000001 | AE313: 96.32 | AF313: 97.24 | AG313: 1 | AH313: AA | AI313: 4.4199999999999996e-002 | AJ313: =H313+100*O313 -> 286.10000000000002 | AK313: 316.2 | AL313: 308 | AM313: 218.9 | AN313: 308 | AO313: 2.e-002 | AP313: 15 | AQ313: 特发转债!
A314: 286 | B314: 128029 | C314: 太阳转债!! | D314: 2078. | E314: 太阳纸业 | F314: 造纸包装 | G314: 造纸行业 | H314: 191.498 | I314: 5.1999999999999998e-003 | J314: 1.15e-002 | K314: 16.4 | L314: 1.67e-002 | M314: 107.8 | N314: 8.55 | O314: -2.e-003 | P314: 191.81 | Q314: 转股中 | R314: 2年32天 | S314: 32天 | T314: 9.78 | U314: 72 | V314: 3.9e-002 | W314: 2.3e-002 | X314: 4.4000000000000004e-002 | Y314: 427 | Z314: 2.77 | AA314: -0.24299999999999999 | AB314: -0.248 | AC314: -2.0049999999999999 | AD314: -2.008 | AE314: 99.92 | AF314: 98.99 | AG314: 1 | AH314: AA+ | AI314: 4.2199999999999994e-002 | AJ314: =H314+100*O314 -> 191.298 | AK314: 191.2 | AL314: 293 | AM314: 91.3 | AN314: 288 | AO314: 0.153 | AP314: 8 | AQ314: 太阳转债!!
A315: 259 | B315: 123013 | C315: 横河转债! | D315: 300539 | E315: 横河模具 | F315: 机械装备 | G315: 专用设备 | H315: 344 | I315: -1.38e-002 | J315: 1.4499999999999999e-002 | K315: 9.23 | L315: 1.1000000000000001e-003 | M315: 115.2 | N315: 9.13 | O315: 2.3999999999999999 | P315: 101.1 | Q315: 转股中 | R315: 3.68年 | S315: 1.68年 | T315: 0.38 | U315: 229 | V315: 1.73 | W315: 1.9e-002 | X315: 1.9e-002 | Y315: 20 | Z315: 4.23 | AA315: -0.26100000000000001 | AB315: -0.26500000000000001 | AC315: -0.34700000000000003 | AD315: -0.34700000000000003 | AE315: 90.27 | AF315: 88.27 | AG315: 0.68 | AH315: A+ | AI315: 7.690000000000001e-002 | AJ315: =H315+100*O315 -> 584. | AK315: 586.9 | AL315: 314 | AM315: 496.6 | AN315: 314 | AO315: -9.6999999999999989e-002 | AP315: 16 | AQ315: 横河转债!
A316: 190 | B316: 123029 | C316: 英科转债! | D316: 300677 | E316: 英科医疗 | F316: 医药 | G316: 医疗器械 | H316: 1139.06 | I316: 8.0000000000000002e-003 | J316: 1.3300000000000001e-002 | K316: 117.63 | L316: 2.1400000000000002e-002 | M316: 138.2 | N316: 10.41 | O316: 8.0000000000000002e-003 | P316: 1129.97 | Q316: 转股中 | R316: 4.74年 | S316: 2.74年 | T316: 1.28 | U316: 798 | V316: 0.54000000000000004 | W316: 3.0000000000000001e-003 | X316: 3.7000000000000005e-002 | Y316: 392 | Z316: 4.33 | AA316: -0.36499999999999999 | AB316: -0.37200000000000005 | AC316: -0.252 | AD316: -0.252 | AE316: 89.43 | AF316: 103.21 | AG316: 0.99 | AH316: AA- | AI316: 6.59e-002 | AJ316: =H316+100*O316 -> 1139.8599999999999 | AK316: 1148.0999999999999 | AL316: 315 | AM316: 1044.9000000000001 | AN316: 315 | AO316: 2.5000000000000001e-002 | AP316: 16 | AQ316: 英科转债!