A1: 序号 | B1: 转债名称 | C1: 转债代码 | D1: 进展/上市日期 | E1: 股票名称 | F1: 股票代码 | G1: 行业 | H1: 子行业 | I1: 转债价格 | J1: 涨跌 | K1: 日内套利 | L1: 股价 | M1: 涨跌 | N1: 转债成交额 | O1: 转债换手率 | P1: 剩余本息 | Q1: 转股价格 | R1: P/B | S1: 转股价值 | T1: 转股溢价率 | U1: 距离转股日 | V1: 剩余年限 | W1: 回售年限 | X1: 余额/市值 | Y1: 余额/股本 | Z1: 转债余额 | AA1: 股票市值 | AB1: 税前收益率 | AC1: 税后收益率 | AD1: 税前回售收益 | AE1: 税后回售收益 | AF1: 回售价值 | AG1: 纯债价值 | AH1: 弹性 | AI1: 信用 | AJ1: 折现率 | AK1: 双低 | AL1: 老式双低 | AM1: 老式排名 | AN1: 新式双低 | AO1: 新式排名 | AP1: MA20乖离 | AQ1: 热门度 | AR1: 转债名称
A2: 194 | B2: 亚药转债! | C2: 128062 | D2: 43579. | E2: 亚太药业 | F2: 2370 | G2: 医药 | H2: 化学制药 | I2: 80.578 | J2: 4.0000000000000002e-004 | K2: -4.0000000000000002e-004 | L2: 5.85 | M2: 1.5600000000000001e-002 | N2: 4 | O2: 5.0000000000000001e-003 | P2: 119.8 | Q2: 16.25 | R2: 8.38 | S2: 36 | T2: 1.24 | U2: 转股中 | V2: 4.53年 | W2: 2.53年 | X2: 0.307 | Y2: 0.111 | Z2: 9.6 | AA2: 31 | AB2: 9.3299999999999994e-002 | AC2: 8.4700000000000011e-002 | AD2: 9.7299999999999998e-002 | AE2: 9.4499999999999987e-002 | AF2: 81.09 | AG2: 80.12 | AH2: 0 | AI2: A- | AJ2: 9.4700000000000006e-002 | AK2: =I2+100*T2 -> 204.578 | AL2: 125.2 | AM2: 67 | AN2: 44.1 | AO2: 171 | AP2: -1.3999999999999999e-002 | AQ2: 87 | AR2: 亚药转债!
A3: 214 | B3: 维格转债! | C3: 113527 | D3: 43515. | E3: 锦泓集团 | F3: 603518 | G3: 服装纺织 | H3: 服装行业 | I3: 92.88 | J3: 1.6000000000000001e-003 | K3: -7.000000000000001e-004 | L3: 6.94 | M3: 4.3e-003 | N3: 5.3 | O3: 8.0000000000000002e-003 | P3: 120.2 | Q3: 9.85 | R3: 0.7 | S3: 70.46 | T3: 0.318 | U3: 转股中 | V3: 4.35年 | W3: 2.35年 | X3: 0.42599999999999999 | Y3: 0.29999999999999999 | Z3: 7.5 | AA3: 18 | AB3: 6.25e-002 | AC3: 5.3800000000000001e-002 | AD3: 4.4699999999999997e-002 | AE3: 4.1700000000000001e-002 | AF3: 91.13 | AG3: 96.6 | AH3: 0.2 | AI3: AA | AJ3: 5.2699999999999997e-002 | AK3: =I3+100*T3 -> 124.67999999999999 | AL3: 115.3 | AM3: 3 | AN3: 18.7 | AO3: 5 | AP3: -4.0000000000000001e-003 | AQ3: 100 | AR3: 维格转债!
A4: 44 | B4: 本钢转债! | C4: 127018 | D4: 44047. | E4: 本钢板材 | F4: 761 | G4: 钢铁 | H4: 炼钢 | I4: 97.011 | J4: -1.5e-003 | K4: 4.1999999999999997e-003 | L4: 3.47 | M4: 1.46e-002 | N4: 61 | O4: 9.0000000000000011e-003 | P4: 128.6 | Q4: 5.03 | R4: 0.68 | S4: 68.99 | T4: 0.40600000000000003 | U4: 3月17天 | V4: 5.78年 | W4: 3.78年 | X4: 0.50600000000000001 | Y4: 0.34899999999999998 | Z4: 68 | AA4: 134 | AB4: 5.1500000000000004e-002 | AC4: 4.2800000000000005e-002 | AD4: 2.41e-002 | AE4: 2.0899999999999998e-002 | AF4: 91.48 | AG4: 103.36 | AH4: 0.18 | AI4: AAA | AJ4: 3.9699999999999999e-002 | AK4: =I4+100*T4 -> 137.61099999999999 | AL4: 125 | AM4: 66 | AN4: 21.7 | AO4: 7 | AP4: 8.0000000000000002e-003 | AQ4: 25 | AR4: 本钢转债!
A5: 271 | B5: 亚太转债! | C5: 128023 | D5: 43095. | E5: 亚太股份 | F5: 2284 | G5: 汽车 | H5: 零部件制 | I5: 96.502 | J5: 1.e-003 | K5: -8.9999999999999998e-004 | L5: 5.24 | M5: 3.8e-003 | N5: 1.9 | O5: 2.e-003 | P5: 112.3 | Q5: 10.34 | R5: 1.6 | S5: 50.68 | T5: 0.90400000000000003 | U5: 转股中 | V5: 3.21年 | W5: 1.21年 | X5: 0.25800000000000001 | Y5: 0.13100000000000001 | Z5: 10 | AA5: 39 | AB5: 4.9500000000000002e-002 | AC5: 4.2000000000000003e-002 | AD5: 4.7500000000000001e-002 | AE5: 4.3299999999999998e-002 | AF5: 97.11 | AG5: 98.5 | AH5: 0.01 | AI5: AA | AJ5: 4.2699999999999995e-002 | AK5: =I5+100*T5 -> 186.90199999999999 | AL5: 142.3 | AM5: 217 | AN5: 43.8 | AO5: 169 | AP5: -1.3000000000000001e-002 | AQ5: 64 | AR5: 亚太转债!
A6: 252 | B6: 岩土转债! | C6: 128037 | D6: 43215. | E6: 中化岩土 | F6: 2542 | G6: 建筑 | H6: 建筑工程 | I6: 98.149 | J6: 4.0000000000000002e-004 | K6: -4.0000000000000002e-004 | L6: 3.63 | M6: 8.3000000000000001e-003 | N6: 3.6 | O6: 6.0000000000000001e-003 | P6: 112.3 | Q6: 7.99 | R6: 1.64 | S6: 45.43 | T6: 1.1599999999999999 | U6: 转股中 | V6: 3.49年 | W6: 1.49年 | X6: 9.0999999999999998e-002 | Y6: 4.2000000000000003e-002 | Z6: 6 | AA6: 66 | AB6: 4.0199999999999993e-002 | AC6: 3.3399999999999999e-002 | AD6: 2.87e-002 | AE6: 2.52e-002 | AF6: 96 | AG6: 97.35 | AH6: 0.01 | AI6: AA | AJ6: 4.2699999999999995e-002 | AK6: =I6+100*T6 -> 214.149 | AL6: 150.9 | AM6: 247 | AN6: 53.5 | AO6: 221 | AP6: -2.7000000000000003e-002 | AQ6: 47 | AR6: 岩土转债!
A7: 122 | B7: 百川转债! | C7: 128093 | D7: 43851. | E7: 百川股份 | F7: 2455 | G7: 化工 | H7: 化工 | I7: 108.1 | J7: 2.9999999999999997e-004 | K7: 3.4999999999999996e-003 | L7: 5.21 | M7: 7.7000000000000002e-003 | N7: 5.8 | O7: 1.e-002 | P7: 130.3 | Q7: 5.87 | R7: 2.12 | S7: 88.76 | T7: 0.218 | U7: 转股中 | V7: 5.29年 | W7: 3.29年 | X7: 0.193 | Y7: 0.17100000000000001 | Z7: 5.2 | AA7: 27 | AB7: 3.7200000000000004e-002 | AC7: 2.7400000000000001e-002 | AD7: -2.e-003 | AE7: -6.0000000000000001e-003 | AF7: 86.54 | AG7: 94.17 | AH7: 0.49 | AI7: AA- | AJ7: 6.5700000000000008e-002 | AK7: =I7+100*T7 -> 129.90000000000001 | AL7: 127.4 | AM7: 87 | AN7: 33.3 | AO7: 58 | AP7: -1.9e-002 | AQ7: 45 | AR7: 百川转债!
A8: 197 | B8: 大丰转债! | C8: 113530 | D8: 43573. | E8: 大丰实业 | F8: 603081 | G8: 建筑 | H8: 装饰工程 | I8: 103.5 | J8: 1.e-003 | K8: 2.5000000000000001e-003 | L8: 12.07 | M8: 2.0299999999999999e-002 | N8: 7.1 | O8: 1.1000000000000001e-002 | P8: 121.6 | Q8: 16.64 | R8: 2.47 | S8: 72.54 | T8: 0.42700000000000005 | U8: 转股中 | V8: 4.52年 | W8: 2.52年 | X8: 0.13 | Y8: 9.4e-002 | Z8: 6.3 | AA8: 48 | AB8: 3.7100000000000001e-002 | AC8: 2.8500000000000001e-002 | AD8: 1.e-004 | AE8: -2.5000000000000001e-003 | AF8: 92.63 | AG8: 101.05 | AH8: 0.17 | AI8: AA | AJ8: 4.2699999999999995e-002 | AK8: =I8+100*T8 -> 146.19999999999999 | AL8: 134.5 | AM8: 157 | AN8: 33.4 | AO8: 62 | AP8: -3.4000000000000002e-002 | AQ8: 34 | AR8: 大丰转债!
A9: 192 | B9: 未来转债 | C9: 128063 | D9: 43579. | E9: 德尔未来 | F9: 2631 | G9: 其他 | H9: 家居用品 | I9: 109.2 | J9: 2.7000000000000001e-003 | K9: 3.3e-003 | L9: 7.48 | M9: 1.49e-002 | N9: 0.6 | O9: 1.e-003 | P9: 128.2 | Q9: 8.61 | R9: 2.84 | S9: 86.88 | T9: 0.25700000000000001 | U9: 转股中 | V9: 4.54年 | W9: 3.54年 | X9: 0.126 | Y9: 0.109 | Z9: 6.3 | AA9: 50 | AB9: 3.7000000000000005e-002 | AC9: 2.64e-002 | AD9: -8.0000000000000004e-004 | AE9: -5.3e-003 | AF9: 87.06 | AG9: 97.65 | AH9: 0.41 | AI9: AA- | AJ9: 6.3700000000000007e-002 | AK9: =I9+100*T9 -> 134.90000000000001 | AL9: 131.5 | AM9: 137 | AN9: 33.9 | AO9: 68 | AP9: -2.5000000000000001e-002 | AQ9: 35 | AR9: 未来转债
A10: 75 | B10: 纵横转债! | C10: 113573 | D10: 43973. | E10: 纵横通信 | F10: 603602 | G10: 通信互联 | H10: 通信设备 | I10: 102.67 | J10: 8.0000000000000004e-004 | K10: -5.1999999999999998e-003 | L10: 13.23 | M10: -1.2699999999999999e-002 | N10: 2 | O10: 6.9999999999999993e-003 | P10: 124.7 | Q10: 18.81 | R10: 4 | S10: 70.33 | T10: 0.46000000000000002 | U10: 34天 | V10: 5.58年 | W10: 3.58年 | X10: 0.10000000000000001 | Y10: 7.0000000000000007e-002 | Z10: 2.7 | AA10: 27 | AB10: 3.6299999999999999e-002 | AC10: 2.8500000000000001e-002 | AD10: 5.1000000000000004e-003 | AE10: 2.7000000000000001e-003 | AF10: 79.61 | AG10: 83.39 | AH10: 0.35 | AI10: A+ | AJ10: 7.6700000000000004e-002 | AK10: =I10+100*T10 -> 148.67000000000002 | AL10: 135 | AM10: 160 | AN10: 51.6 | AO10: 214 | AP10: -7.6999999999999999e-002 | AQ10: 13 | AR10: 纵横转债!
A11: 279 | B11: 小康转债! | C11: 113016 | D11: 43060. | E11: 小康股份 | F11: 601127 | G11: 汽车 | H11: 零部件制 | I11: 99.23 | J11: 1.2999999999999999e-003 | K11: -1.e-003 | L11: 8.99 | M11: 1.7000000000000001e-002 | N11: 2.9 | O11: 3.0000000000000001e-003 | P11: 110.3 | Q11: 15.7 | R11: 1.82 | S11: 57.26 | T11: 0.73299999999999998 | U11: 转股中 | V11: 3年48天 | W11: 1年48天 | X11: 7.8e-002 | Y11: 4.4999999999999998e-002 | Z11: 8.8 | AA11: 113 | AB11: 3.5200000000000002e-002 | AC11: 2.87e-002 | AD11: 2.7900000000000001e-002 | AE11: 2.35e-002 | AF11: 97.42 | AG11: 97.06 | AH11: 0.02 | AI11: AA | AJ11: 4.2699999999999995e-002 | AK11: =I11+100*T11 -> 172.53 | AL11: 141.2 | AM11: 211 | AN11: 43.8 | AO11: 168 | AP11: 2.9999999999999999e-002 | AQ11: 45 | AR11: 小康转债!
A12: 243 | B12: 海澜转债! | C12: 110045 | D12: 43312. | E12: 海澜之家 | F12: 600398 | G12: 服装纺织 | H12: 服装行业 | I12: 98.17 | J12: 1.7000000000000001e-003 | K12: -1.5e-003 | L12: 6.68 | M12: 6.0000000000000001e-003 | N12: 5.6 | O12: 2.e-003 | P12: 111.1 | Q12: 11.75 | R12: 2.37 | S12: 56.85 | T12: 0.72699999999999998 | U12: 转股中 | V12: 3.81年 | W12: 1.81年 | X12: 0.10199999999999999 | Y12: 5.7999999999999996e-002 | Z12: 29 | AA12: 289 | AB12: 3.3399999999999999e-002 | AC12: 2.7799999999999998e-002 | AD12: 1.9699999999999999e-002 | AE12: 1.7600000000000001e-002 | AF12: 94.31 | AG12: 95.61 | AH12: 0.05 | AI12: AA+ | AJ12: 4.07e-002 | AK12: =I12+100*T12 -> 170.87 | AL12: 139.5 | AM12: 201 | AN12: 43.9 | AO12: 170 | AP12: -2.7999999999999997e-002 | AQ12: 59 | AR12: 海澜转债!
A13: 105 | B13: 科达转债! | C13: 113569 | D13: 43929. | E13: 苏州科达 | F13: 603660 | G13: 通信互联 | H13: 物联网 | I13: 102.8 | J13: 1.9e-003 | K13: -2.9999999999999997e-004 | L13: 9.24 | M13: 7.6e-003 | N13: 1.9 | O13: 4.0000000000000001e-003 | P13: 120.7 | Q13: 14.84 | R13: 2.73 | S13: 62.26 | T13: 0.65099999999999991 | U13: 转股中 | V13: 5.47年 | W13: 3.47年 | X13: 0.11199999999999999 | Y13: 7.0000000000000007e-002 | Z13: 5.2 | AA13: 46 | AB13: 3.04e-002 | AC13: 2.3599999999999999e-002 | AD13: 3.3e-003 | AE13: 1.1000000000000001e-003 | AF13: 82.77 | AG13: 85.87 | AH13: 0.21 | AI13: AA- | AJ13: 6.5700000000000008e-002 | AK13: =I13+100*T13 -> 167.89999999999998 | AL13: 143.3 | AM13: 221 | AN13: 57.5 | AO13: 237 | AP13: -1.4999999999999999e-002 | AQ13: 22 | AR13: 科达转债!
A14: 181 | B14: 大业转债! | C14: 113535 | D14: 43619. | E14: 大业股份 | F14: 603278 | G14: 汽车 | H14: 零部件制 | I14: 101.66 | J14: 4.5000000000000005e-003 | K14: -6.8999999999999999e-003 | L14: 9.03 | M14: -1.2e-002 | N14: 2 | O14: 4.0000000000000001e-003 | P14: 113.1 | Q14: 12.4 | R14: 1.64 | S14: 72.82 | T14: 0.39600000000000002 | U14: 转股中 | V14: 3.64年 | W14: 1.64年 | X14: 0.191 | Y14: 0.13900000000000001 | Z14: 5 | AA14: 26 | AB14: 3.0099999999999998e-002 | AC14: 2.3399999999999997e-002 | AD14: 1.e-003 | AE14: -1.e-003 | AF14: 94.49 | AG14: 97.34 | AH14: 0.19 | AI14: AA | AJ14: 4.2699999999999995e-002 | AK14: =I14+100*T14 -> 141.25999999999999 | AL14: 130.5 | AM14: 122 | AN14: 33.2 | AO14: 57 | AP14: 0. | AQ14: 49 | AR14: 大业转债!
A15: 210 | B15: 长城转债! | C15: 113528 | D15: 43544. | E15: 长城科技 | F15: 603897 | G15: 机械装备 | H15: 专用设备 | I15: 103.75 | J15: 5.3e-003 | K15: 2.5999999999999999e-003 | L15: 19.52 | M15: 1.8799999999999997e-002 | N15: 2.2 | O15: 3.0000000000000001e-003 | P15: 117.6 | Q15: 23.75 | R15: 1.9 | S15: 82.19 | T15: 0.26200000000000001 | U15: 转股中 | V15: 4.45年 | W15: 2.45年 | X15: 0.182 | Y15: 0.14999999999999999 | Z15: 6.3 | AA15: 35 | AB15: 2.9300000000000003e-002 | AC15: 2.2000000000000002e-002 | AD15: 7.000000000000001e-004 | AE15: -2.3e-003 | AF15: 88.63 | AG15: 89.96 | AH15: 0.42 | AI15: AA- | AJ15: 6.3700000000000007e-002 | AK15: =I15+100*T15 -> 129.94999999999999 | AL15: 125.3 | AM15: 68 | AN15: 35.4 | AO15: 89 | AP15: -1.2e-002 | AQ15: 45 | AR15: 长城转债!
A16: 283 | B16: 久其转债! | C16: 128015 | D16: 42934. | E16: 久其软件 | F16: 2279 | G16: 计算机及 | H16: 软件开发 | I16: 102.6 | J16: 5.5000000000000005e-003 | K16: -4.8999999999999998e-003 | L16: 6.53 | M16: 9.300000000000001e-003 | N16: 1.6 | O16: 2.e-003 | P16: 110.8 | Q16: 9.48 | R16: 6.38 | S16: 68.88 | T16: 0.48999999999999999 | U16: 转股中 | V16: 2.72年 | W16: 0.72年 | X16: 0.16800000000000001 | Y16: 0.11599999999999999 | Z16: 7.8 | AA16: 46 | AB16: 2.9100000000000001e-002 | AC16: 2.1499999999999998e-002 | AD16: -1.1599999999999999e-002 | AE16: -1.4999999999999999e-002 | AF16: 95.4 | AG16: 91.67 | AH16: 0.06 | AI16: A+ | AJ16: 7.3300000000000004e-002 | AK16: =I16+100*T16 -> 151.59999999999999 | AL16: 136.3 | AM16: 173 | AN16: 40.9 | AO16: 150 | AP16: -3.2000000000000001e-002 | AQ16: 56 | AR16: 久其转债!
A17: 290 | B17: 顺昌转债!! | C17: 128010 | D17: 42423. | E17: 澳洋顺昌 | F17: 2245 | G17: 交通运输 | H17: 物流业 | I17: 105.511 | J17: 1.1000000000000001e-003 | K17: -1.1000000000000001e-003 | L17: 5.28 | M17: 6.4500000000000002e-002 | N17: 4.3 | O17: 8.0000000000000002e-003 | P17: 109.6 | Q17: 9.25 | R17: 2.42 | S17: 57.08 | T17: 0.84799999999999998 | U17: 转股中 | V17: 1.34年 | W17: 回售中 | X17: 9.8000000000000004e-002 | Y17: 5.5999999999999994e-002 | Z17: 5.1 | AA17: 52 | AB17: 2.8999999999999998e-002 | AC17: 1.54e-002 | AD17: 回售中 | AE17: 回售中 | AF17: 100.27 | AG17: 103.86 | AH17: 0 | AI17: AA | AJ17: 4.1299999999999996e-002 | AK17: =I17+100*T17 -> 190.31099999999998 | AL17: 153.9 | AM17: 253 | AN17: 50.1 | AO17: 205 | AP17: 3.7000000000000005e-002 | AQ17: 41 | AR17: 顺昌转债!!
A18: 8 | B18: 新星转债 | C18: 113600 | D18: 44085. | E18: 深圳新星 | F18: 603978 | G18: 有色金属 | H18: 有色行业 | I18: 106.95 | J18: 1.1200000000000002e-002 | K18: -7.1999999999999998e-003 | L18: 21.95 | M18: 6.8999999999999999e-003 | N18: 22 | O18: 3.5000000000000003e-002 | P18: 126 | Q18: 23.85 | R18: 2.31 | S18: 92.03 | T18: 0.16200000000000001 | U18: 5月3天 | V18: 5.90年 | W18: 3.90年 | X18: 0.16899999999999998 | Y18: 0.156 | Z18: 6 | AA18: 35 | AB18: 2.87e-002 | AC18: 2.12e-002 | AD18: -7.0999999999999995e-003 | AE18: -9.0000000000000011e-003 | AF18: 80.42 | AG18: 87.17 | AH18: 0.57 | AI18: AA- | AJ18: 6.5700000000000008e-002 | AK18: =I18+100*T18 -> 123.15000000000001 | AL18: 121.9 | AM18: 43 | AN18: 34.7 | AO18: 81 | AP18: -1.8000000000000002e-002 | AQ18: 5 | AR18: 新星转债
A19: 154 | B19: 浦发转债! | C19: 110059 | D19: 43784. | E19: 浦发银行 | F19: 600000 | G19: 金融 | H19: 银行行业 | I19: 102.67 | J19: -2.0999999999999999e-003 | K19: 4.3e-003 | L19: 9.94 | M19: 1.1200000000000002e-002 | N19: 215 | O19: 4.0000000000000001e-003 | P19: 117.8 | Q19: 14.45 | R19: 0.58 | S19: 68.79 | T19: 0.49299999999999999 | U19: 转股中 | V19: 5年39天 | W19: 无权 | X19: 0.17100000000000001 | Y19: 0.11800000000000001 | Z19: 500 | AA19: 2918. | AB19: 2.81e-002 | AC19: 2.1600000000000001e-002 | AD19: 无权 | AE19: 无权 | AF19: 无权 | AG19: 97.09 | AH19: 0.2 | AI19: AAA | AJ19: 3.9699999999999999e-002 | AK19: =I19+100*T19 -> 151.97 | AL19: 136.6 | AM19: 174 | AN19: 39.5 | AO19: 132 | AP19: -2.1000000000000001e-002 | AQ19: 76 | AR19: 浦发转债!
A20: 285 | B20: 永东转债! | C20: 128014 | D20: 42934. | E20: 永东股份 | F20: 2753 | G20: 化工 | H20: 化工 | I20: 103.795 | J20: 1.2999999999999999e-003 | K20: -1.6000000000000001e-003 | L20: 9.23 | M20: -2.2000000000000001e-003 | N20: 1.2 | O20: 3.0000000000000001e-003 | P20: 111.3 | Q20: 12.6 | R20: 2.01 | S20: 73.25 | T20: 0.41700000000000004 | U20: 转股中 | V20: 2.58年 | W20: 0.58年 | X20: 9.6999999999999989e-002 | Y20: 7.0999999999999994e-002 | Z20: 3.4 | AA20: 35 | AB20: 2.7999999999999997e-002 | AC20: 1.9599999999999999e-002 | AD20: -2.5899999999999999e-002 | AE20: -3.0499999999999999e-002 | AF20: 97.35 | AG20: 95.52 | AH20: 0.11 | AI20: AA- | AJ20: 6.2300000000000001e-002 | AK20: =I20+100*T20 -> 145.495 | AL20: 134.3 | AM20: 156 | AN20: 37 | AO20: 103 | AP20: 4.8000000000000001e-002 | AQ20: 39 | AR20: 永东转债!
A21: 276 | B21: 嘉澳转债! | C21: 113502 | D21: 43066. | E21: 嘉澳环保 | F21: 603822 | G21: 化工 | H21: 化工 | I21: 103.2 | J21: 2.2000000000000001e-003 | K21: -2.0999999999999999e-003 | L21: 25.86 | M21: 7.4000000000000003e-003 | N21: 1.8 | O21: 9.0000000000000011e-003 | P21: 112.3 | Q21: 44.79 | R21: 2.56 | S21: 57.74 | T21: 0.78700000000000003 | U21: 转股中 | V21: 3年52天 | W21: 1年52天 | X21: 9.8000000000000004e-002 | Y21: 5.5999999999999994e-002 | Z21: 1.9 | AA21: 19 | AB21: 2.7900000000000001e-002 | AC21: 2.0400000000000001e-002 | AD21: -3.0000000000000001e-003 | AE21: -7.1999999999999998e-003 | AF21: 94.9 | AG21: 92.91 | AH21: 0.02 | AI21: AA- | AJ21: 6.3700000000000007e-002 | AK21: =I21+100*T21 -> 181.90000000000001 | AL21: 148.7 | AM21: 243 | AN21: 53.8 | AO21: 223 | AP21: -4.9000000000000002e-002 | AQ21: 29 | AR21: 嘉澳转债!
A22: 209 | B22: 中信转债! | C22: 113021 | D22: 43543. | E22: 中信银行 | F22: 601998 | G22: 金融 | H22: 银行行业 | I22: 105.7 | J22: -1.8e-003 | K22: 5.6000000000000008e-003 | L22: 5.18 | M22: 1.77e-002 | N22: 79 | O22: 2.e-003 | P22: 118.8 | Q22: 6.98 | R22: 0.56 | S22: 74.21 | T22: 0.42399999999999999 | U22: 转股中 | V22: 4.46年 | W22: 无权 | X22: 0.158 | Y22: 0.11699999999999999 | Z22: 400 | AA22: 2535. | AB22: 2.7400000000000001e-002 | AC22: 1.9699999999999999e-002 | AD22: 无权 | AE22: 无权 | AF22: 无权 | AG22: 101.24 | AH22: 0.21 | AI22: AAA | AJ22: 3.7699999999999997e-002 | AK22: =I22+100*T22 -> 148.09999999999999 | AL22: 137.2 | AM22: 181 | AN22: 35.9 | AO22: 97 | AP22: 2.e-003 | AQ22: 53 | AR22: 中信转债!
A23: 42 | B23: 胜达转债! | C23: 113591 | D23: 44035. | E23: 大胜达 | F23: 603687 | G23: 造纸包装 | H23: 包装用纸 | I23: 105.21 | J23: 3.2000000000000002e-003 | K23: 4.5000000000000005e-003 | L23: 12.95 | M23: 1.41e-002 | N23: 5.6 | O23: 1.e-002 | P23: 122.2 | Q23: 14.73 | R23: 3.46 | S23: 87.92 | T23: 0.19699999999999998 | U23: 3月21天 | V23: 5.78年 | W23: 3.78年 | X23: 0.10300000000000001 | Y23: 9.0999999999999998e-002 | Z23: 5.5 | AA23: 53 | AB23: 2.6800000000000001e-002 | AC23: 2.e-002 | AD23: -2.7000000000000001e-003 | AE23: -4.6999999999999993e-003 | AF23: 81.21 | AG23: 85.24 | AH23: 0.55 | AI23: AA- | AJ23: 6.5700000000000008e-002 | AK23: =I23+100*T23 -> 124.91 | AL23: 122.5 | AM23: 48 | AN23: 37.3 | AO23: 106 | AP23: -3.5000000000000003e-002 | AQ23: 19 | AR23: 胜达转债!
A24: 106 | B24: 新春转债 | C24: 113568 | D24: 43923. | E24: 五洲新春 | F24: 603667 | G24: 机械装备 | H24: 通用设备 | I24: 108.43 | J24: 8.6999999999999994e-003 | K24: 7.000000000000001e-004 | L24: 8.57 | M24: 1.54e-002 | N24: 5.1 | O24: 1.3999999999999999e-002 | P24: 124.8 | Q24: 8.91 | R24: 1.46 | S24: 96.18 | T24: 0.127 | U24: 转股中 | V24: 5.46年 | W24: 3.46年 | X24: 0.13200000000000001 | Y24: 0.127 | Z24: 3.3 | AA24: 25 | AB24: 2.6699999999999998e-002 | AC24: 1.8799999999999997e-002 | AD24: -9.7000000000000003e-003 | AE24: -1.21e-002 | AF24: 83.39 | AG24: 88.92 | AH24: 0.61 | AI24: AA- | AJ24: 6.5700000000000008e-002 | AK24: =I24+100*T24 -> 121.13000000000001 | AL24: 120.7 | AM24: 33 | AN24: 31.8 | AO24: 46 | AP24: -2.4e-002 | AQ24: 40 | AR24: 新春转债
A25: 15 | B25: 佳力转债! | C25: 113597 | D25: 44064. | E25: 佳力图 | F25: 603912 | G25: 机械装备 | H25: 专用设备 | I25: 108.11 | J25: 9.300000000000001e-003 | K25: -7.9000000000000008e-003 | L25: 18.3 | M25: 3.3e-003 | N25: 6 | O25: 1.9e-002 | P25: 124.5 | Q25: 23.4 | R25: 4.85 | S25: 78.21 | T25: 0.38200000000000001 | U25: 4月19天 | V25: 5.86年 | W25: 3.86年 | X25: 7.5999999999999998e-002 | Y25: 5.9000000000000004e-002 | Z25: 3 | AA25: 40 | AB25: 2.4900000000000002e-002 | AC25: 1.77e-002 | AD25: -8.6999999999999994e-003 | AE25: -1.0800000000000001e-002 | AF25: 81.04 | AG25: 86.42 | AH25: 0.43 | AI25: AA- | AJ25: 6.5700000000000008e-002 | AK25: =I25+100*T25 -> 146.31 | AL25: 138 | AM25: 186 | AN25: 51.6 | AO25: 213 | AP25: -3.6000000000000004e-002 | AQ25: 3 | AR25: 佳力转债!
A26: 79 | B26: 凌钢转债! | C26: 110070 | D26: 43964. | E26: 凌钢股份 | F26: 600231 | G26: 钢铁 | H26: 炼钢 | I26: 103.2 | J26: 1.2999999999999999e-003 | K26: 2.3e-003 | L26: 2.3 | M26: 8.8000000000000005e-003 | N26: 2.7 | O26: 6.0000000000000001e-003 | P26: 117.8 | Q26: 2.75 | R26: 0.82 | S26: 83.64 | T26: 0.23399999999999999 | U26: 28天 | V26: 5.56年 | W26: 3.56年 | X26: 6.9000000000000006e-002 | Y26: 5.7999999999999996e-002 | Z26: 4.4 | AA26: 64 | AB26: 2.46e-002 | AC26: 1.8700000000000001e-002 | AD26: 2.3999999999999998e-003 | AE26: 2.9999999999999997e-004 | AF26: 88.61 | AG26: 92.83 | AH26: 0.41 | AI26: AA | AJ26: 4.4699999999999997e-002 | AK26: =I26+100*T26 -> 126.59999999999999 | AL26: 122.8 | AM26: 51 | AN26: 29.9 | AO26: 32 | AP26: -8.0000000000000002e-003 | AQ26: 13 | AR26: 凌钢转债!
A27: 219 | B27: 奇精转债! | C27: 113524 | D27: 43472. | E27: 奇精机械 | F27: 603677 | G27: 家电 | H27: 零部件制 | I27: 106.69 | J27: 2.5000000000000001e-003 | K27: 4.5999999999999999e-003 | L27: 11.97 | M27: 2.0499999999999997e-002 | N27: 0.8 | O27: 2.e-003 | P27: 117.9 | Q27: 14.08 | R27: 2.36 | S27: 85.01 | T27: 0.255 | U27: 转股中 | V27: 4.24年 | W27: 2.24年 | X27: 0.14300000000000002 | Y27: 0.122 | Z27: 3.3 | AA27: 23 | AB27: 2.4399999999999998e-002 | AC27: 1.67e-002 | AD27: -1.3100000000000001e-002 | AE27: -1.5800000000000002e-002 | AF27: 93.62 | AG27: 99.13 | AH27: 0.35 | AI27: AA | AJ27: 4.2699999999999995e-002 | AK27: =I27+100*T27 -> 132.19 | AL27: 128.4 | AM27: 98 | AN27: 29.2 | AO27: 27 | AP27: -1.7000000000000001e-002 | AQ27: 43 | AR27: 奇精转债!
A28: 46 | B28: 天创转债! | C28: 113589 | D28: 44028. | E28: 天创时尚 | F28: 603608 | G28: 服装纺织 | H28: 鞋服行业 | I28: 100.63 | J28: 2.e-003 | K28: 1.5e-003 | L28: 8.91 | M28: 1.2500000000000001e-002 | N28: 2.4 | O28: 4.0000000000000001e-003 | P28: 115.3 | Q28: 12.64 | R28: 1.75 | S28: 70.49 | T28: 0.42799999999999999 | U28: 3月15天 | V28: 5.76年 | W28: 3.76年 | X28: 0.157 | Y28: 0.11 | Z28: 6 | AA28: 38 | AB28: 2.4399999999999998e-002 | AC28: 1.9400000000000001e-002 | AD28: 8.0000000000000002e-003 | AE28: 6.0999999999999995e-003 | AF28: 87.56 | AG28: 90.05 | AH28: 0.28 | AI28: AA | AJ28: 4.4699999999999997e-002 | AK28: =I28+100*T28 -> 143.43000000000001 | AL28: 130.8 | AM28: 127 | AN28: 40.7 | AO28: 148 | AP28: -2.1000000000000001e-002 | AQ28: 7 | AR28: 天创转债!
A29: 6 | B29: 文科转债 | C29: 128127 | D29: 44085. | E29: 文科园林 | F29: 2775 | G29: 城市公用 | H29: 生态环境 | I29: 105.539 | J29: 5.6000000000000008e-003 | K29: 5.1000000000000004e-003 | L29: 5.39 | M29: 1.7000000000000001e-002 | N29: 38 | O29: 3.7999999999999999e-002 | P29: 121.3 | Q29: 5.76 | R29: 1.11 | S29: 93.58 | T29: 0.128 | U29: 5月13天 | V29: 5.92年 | W29: 3.92年 | X29: 0.34399999999999997 | Y29: 0.32200000000000001 | Z29: 9.5 | AA29: 28 | AB29: 2.4300000000000002e-002 | AC29: 1.7899999999999999e-002 | AD29: -3.0999999999999999e-003 | AE29: -5.1000000000000004e-003 | AF29: 80.6 | AG29: 83.91 | AH29: 0.63 | AI29: AA- | AJ29: 6.5700000000000008e-002 | AK29: =I29+100*T29 -> 118.339 | AL29: 117.5 | AM29: 9 | AN29: 33.6 | AO29: 66 | AP29: -6.9999999999999993e-003 | AQ29: 8 | AR29: 文科转债
A30: 241 | B30: 德尔转债! | C30: 123011 | D30: 43326. | E30: 德尔股份 | F30: 300473 | G30: 汽车 | H30: 零部件制 | I30: 106.298 | J30: 3.3e-003 | K30: -2.2000000000000001e-003 | L30: 28.96 | M30: 2.8000000000000004e-003 | N30: 2.2 | O30: 8.0000000000000002e-003 | P30: 116.3 | Q30: 34.54 | R30: 1.48 | S30: 83.84 | T30: 0.26800000000000002 | U30: 转股中 | V30: 3.83年 | W30: 1.83年 | X30: 7.5999999999999998e-002 | Y30: 6.4000000000000001e-002 | Z30: 2.5 | AA30: 33 | AB30: 2.4199999999999999e-002 | AC30: 1.6399999999999998e-002 | AD30: -1.6799999999999999e-002 | AE30: -1.9400000000000001e-002 | AF30: 90.97 | AG30: 92.21 | AH30: 0.4 | AI30: AA- | AJ30: 6.3700000000000007e-002 | AK30: =I30+100*T30 -> 133.09800000000001 | AL30: 128.8 | AM30: 101 | AN30: 36.5 | AO30: 100 | AP30: 0. | AQ30: 35 | AR30: 德尔转债!
A31: 261 | B31: 迪龙转债! | C31: 128033 | D31: 43129. | E31: 雪迪龙 | F31: 2658 | G31: 城市公用 | H31: 三废处理 | I31: 101.721 | J31: 7.1999999999999998e-003 | K31: -6.4000000000000003e-003 | L31: 6.37 | M31: 4.6999999999999993e-003 | N31: 1.2 | O31: 2.e-003 | P31: 109.8 | Q31: 8.83 | R31: 1.95 | S31: 72.14 | T31: 0.40999999999999998 | U31: 转股中 | V31: 3.27年 | W31: 1.27年 | X31: 0.13500000000000001 | Y31: 9.6999999999999989e-002 | Z31: 5.2 | AA31: 39 | AB31: 2.41e-002 | AC31: 1.83e-002 | AD31: 5.6999999999999993e-003 | AE31: 2.2000000000000001e-003 | AF31: 96.62 | AG31: 96.03 | AH31: 0.17 | AI31: AA | AJ31: 4.2699999999999995e-002 | AK31: =I31+100*T31 -> 142.721 | AL31: 131.3 | AM31: 134 | AN31: 34.7 | AO31: 78 | AP31: -2.3e-002 | AQ31: 38 | AR31: 迪龙转债!
A32: 233 | B32: 岭南转债! | C32: 128044 | D32: 43347. | E32: 岭南股份 | F32: 2717 | G32: 城市公用 | H32: 生态环境 | I32: 101.9 | J32: -4.0999999999999995e-003 | K32: 5.6999999999999993e-003 | L32: 4.13 | M32: 9.7999999999999997e-003 | N32: 5.2 | O32: 8.0000000000000002e-003 | P32: 111.3 | Q32: 5.91 | R32: 1.33 | S32: 69.88 | T32: 0.45799999999999996 | U32: 转股中 | V32: 3.90年 | W32: 1.90年 | X32: 0.10400000000000001 | Y32: 7.2999999999999995e-002 | Z32: 6.6 | AA32: 63 | AB32: 2.3300000000000001e-002 | AC32: 1.78e-002 | AD32: 4.3e-003 | AE32: 1.6000000000000001e-003 | AF32: 94.34 | AG32: 94.82 | AH32: 0.17 | AI32: AA | AJ32: 4.2699999999999995e-002 | AK32: =I32+100*T32 -> 147.69999999999999 | AL32: 133.9 | AM32: 152 | AN32: 39.1 | AO32: 126 | AP32: -1.6e-002 | AQ32: 30 | AR32: 岭南转债!
A33: 262 | B33: 吉视转债! | C33: 113017 | D33: 43115. | E33: 吉视传媒 | F33: 601929 | G33: 传媒娱乐 | H33: 影视娱乐 | I33: 102.03 | J33: 2.3e-003 | K33: 7.000000000000001e-004 | L33: 2.29 | M33: 1.3300000000000001e-002 | N33: 2.3 | O33: 1.e-003 | P33: 109.8 | Q33: 2.95 | R33: 1.08 | S33: 77.63 | T33: 0.314 | U33: 转股中 | V33: 3.27年 | W33: 1.27年 | X33: 0.21899999999999997 | Y33: 0.17000000000000001 | Z33: 16 | AA33: 71 | AB33: 2.3199999999999998e-002 | AC33: 1.7399999999999999e-002 | AD33: 3.5999999999999999e-003 | AE33: 1.e-004 | AF33: 96.88 | AG33: 96.62 | AH33: 0.23 | AI33: AA+ | AJ33: 4.07e-002 | AK33: =I33+100*T33 -> 133.43000000000001 | AL33: 126.4 | AM33: 78 | AN33: 29.5 | AO33: 28 | AP33: -5.0000000000000001e-003 | AQ33: 51 | AR33: 吉视转债!
A34: 167 | B34: 翔鹭转债! | C34: 128072 | D34: 43724. | E34: 翔鹭钨业 | F34: 2842 | G34: 有色金属 | H34: 小金属 | I34: 103.459 | J34: 4.0000000000000002e-004 | K34: -2.8000000000000004e-003 | L34: 10.54 | M34: -8.5000000000000006e-003 | N34: 1.9 | O34: 6.0000000000000001e-003 | P34: 115.1 | Q34: 15.31 | R34: 3.22 | S34: 68.84 | T34: 0.503 | U34: 转股中 | V34: 4.92年 | W34: 2.92年 | X34: 0.10400000000000001 | Y34: 7.2000000000000008e-002 | Z34: 3 | AA34: 29 | AB34: 2.23e-002 | AC34: 1.67e-002 | AD34: -1.e-004 | AE34: -2.3e-003 | AF34: 85.64 | AG34: 85.45 | AH34: 0.29 | AI34: AA- | AJ34: 6.3700000000000007e-002 | AK34: =I34+100*T34 -> 153.75900000000001 | AL34: 138.1 | AM34: 187 | AN34: 52.4 | AO34: 217 | AP34: -3.0000000000000001e-003 | AQ34: 27 | AR34: 翔鹭转债!
A35: 132 | B35: 建工转债! | C35: 110064 | D35: 43846. | E35: 重庆建工 | F35: 600939 | G35: 建筑 | H35: 建筑工程 | I35: 107.42 | J35: 2.8000000000000004e-003 | K35: 1.7000000000000001e-003 | L35: 4.17 | M35: 9.7000000000000003e-003 | N35: 2.5 | O35: 1.e-003 | P35: 120.2 | Q35: 4.57 | R35: 1.09 | S35: 91.25 | T35: 0.17699999999999999 | U35: 转股中 | V35: 5.25年 | W35: 3.25年 | X35: 0.21899999999999997 | Y35: 0.20000000000000001 | Z35: 17 | AA35: 76 | AB35: 2.2200000000000001e-002 | AC35: 1.5300000000000001e-002 | AD35: -8.0000000000000002e-003 | AE35: -1.06e-002 | AF35: 90.76 | AG35: 97.01 | AH35: 0.47 | AI35: AA+ | AJ35: 4.2699999999999995e-002 | AK35: =I35+100*T35 -> 125.12 | AL35: 123.6 | AM35: 58 | AN35: 26.6 | AO35: 17 | AP35: 1.e-002 | AQ35: 46 | AR35: 建工转债!
A36: 137 | B36: 鸿达转债 | C36: 128085 | D36: 43838. | E36: 鸿达兴业 | F36: 2002 | G36: 化工 | H36: 化工 | I36: 112 | J36: 2.2000000000000001e-003 | K36: -6.6e-003 | L36: 4.21 | M36: -7.0999999999999995e-003 | N36: 39 | O36: 1.3999999999999999e-002 | P36: 124.8 | Q36: 3.92 | R36: 1.55 | S36: 107.4 | T36: 4.2999999999999997e-002 | U36: 转股中 | V36: 5.24年 | W36: 3.24年 | X36: 0.223 | Y36: 0.23899999999999999 | Z36: 24 | AA36: 109 | AB36: 2.1299999999999999e-002 | AC36: 1.32e-002 | AD36: -2.0899999999999998e-002 | AE36: -2.3300000000000001e-002 | AF36: 90.02 | AG36: 99.74 | AH36: 0.61 | AI36: AA | AJ36: 4.4699999999999997e-002 | AK36: =I36+100*T36 -> 116.3 | AL36: 116.6 | AM36: 7 | AN36: 16.9 | AO36: 3 | AP36: 5.7999999999999996e-002 | AQ36: 82 | AR36: 鸿达转债
A37: 156 | B37: 迪贝转债! | C37: 113546 | D37: 43790. | E37: 迪贝电气 | F37: 603320 | G37: 家电 | H37: 零部件制 | I37: 109.09 | J37: 8.0000000000000002e-003 | K37: -1.6000000000000001e-003 | L37: 13.45 | M37: 9.7999999999999997e-003 | N37: 2.8 | O37: 1.1000000000000001e-002 | P37: 121.1 | Q37: 14.1 | R37: 2.66 | S37: 95.39 | T37: 0.14400000000000002 | U37: 转股中 | V37: 5年34天 | W37: 3年34天 | X37: 0.13200000000000001 | Y37: 0.125 | Z37: 2.3 | AA37: 17 | AB37: 2.12e-002 | AC37: 1.3899999999999999e-002 | AD37: -1.3500000000000002e-002 | AE37: -1.61e-002 | AF37: 82.39 | AG37: 83.92 | AH37: 0.66 | AI37: A+ | AJ37: 7.6700000000000004e-002 | AK37: =I37+100*T37 -> 123.49000000000001 | AL37: 122.8 | AM37: 53 | AN37: 38.9 | AO37: 125 | AP37: -2.7999999999999997e-002 | AQ37: 43 | AR37: 迪贝转债!
A38: 255 | B38: 杭电转债! | C38: 113505 | D38: 43186. | E38: 杭电股份 | F38: 603618 | G38: 能源电力 | H38: 电力设备 | I38: 104.77 | J38: 5.5000000000000005e-003 | K38: -1.6000000000000001e-003 | L38: 5.74 | M38: 1.41e-002 | N38: 1.2 | O38: 1.e-003 | P38: 112.3 | Q38: 7.14 | R38: 1.59 | S38: 80.39 | T38: 0.30299999999999999 | U38: 转股中 | V38: 3.46年 | W38: 1.46年 | X38: 0.18899999999999997 | Y38: 0.152 | Z38: 7.5 | AA38: 40 | AB38: 2.07e-002 | AC38: 1.3999999999999999e-002 | AD38: -1.1699999999999999e-002 | AE38: -1.4999999999999999e-002 | AF38: 96.09 | AG38: 97.45 | AH38: 0.27 | AI38: AA | AJ38: 4.2699999999999995e-002 | AK38: =I38+100*T38 -> 135.06999999999999 | AL38: 129.1 | AM38: 106 | AN38: 31.7 | AO38: 45 | AP38: -5.0999999999999997e-002 | AQ38: 39 | AR38: 杭电转债!
A39: 238 | B39: 凯中转债! | C39: 128042 | D39: 43346. | E39: 凯中精密 | F39: 2823 | G39: 能源电力 | H39: 电力设备 | I39: 107.948 | J39: 9.1000000000000004e-003 | K39: 2.0000000000000001e-004 | L39: 11 | M39: 2.7999999999999997e-002 | N39: 1.2 | O39: 3.0000000000000001e-003 | P39: 116.3 | Q39: 12.94 | R39: 2.5 | S39: 85.01 | T39: 0.27000000000000002 | U39: 转股中 | V39: 3.86年 | W39: 1.86年 | X39: 0.13100000000000001 | Y39: 0.111 | Z39: 4.2 | AA39: 32 | AB39: 1.9799999999999998e-002 | AC39: 1.2199999999999999e-002 | AD39: -2.4e-002 | AE39: -2.6600000000000002e-002 | AF39: 94.5 | AG39: 99.24 | AH39: 0.33 | AI39: AA | AJ39: 4.2699999999999995e-002 | AK39: =I39+100*T39 -> 134.94799999999998 | AL39: 130.9 | AM39: 129 | AN39: 31.6 | AO39: 44 | AP39: -1.6e-002 | AQ39: 23 | AR39: 凯中转债!
A40: 250 | B40: 新凤转债! | C40: 113508 | D40: 43236. | E40: 新凤鸣 | F40: 603225 | G40: 服装纺织 | H40: 纺织行业 | I40: 104.85 | J40: -8.9999999999999998e-004 | K40: 2.3999999999999998e-003 | L40: 10.84 | M40: 1.1200000000000002e-002 | N40: 3.5 | O40: 2.e-003 | P40: 112.3 | Q40: 15.78 | R40: 1.35 | S40: 68.69 | T40: 0.52600000000000002 | U40: 转股中 | V40: 3.60年 | W40: 1.60年 | X40: 0.14199999999999999 | Y40: 9.6999999999999989e-002 | Z40: 21 | AA40: 152 | AB40: 1.9599999999999999e-002 | AC40: 1.32e-002 | AD40: -1.1200000000000002e-002 | AE40: -1.43e-002 | AF40: 95.53 | AG40: 96.89 | AH40: 0.14 | AI40: AA | AJ40: 4.2699999999999995e-002 | AK40: =I40+100*T40 -> 157.44999999999999 | AL40: 141 | AM40: 210 | AN40: 44.1 | AO40: 172 | AP40: -2.7000000000000003e-002 | AQ40: 26 | AR40: 新凤转债!
A41: 136 | B41: 孚日转债! | C41: 128087 | D41: 43846. | E41: 孚日股份 | F41: 2083 | G41: 服装纺织 | H41: 家纺 | I41: 102.601 | J41: 2.8999999999999998e-003 | K41: 2.0000000000000001e-004 | L41: 5.09 | M41: 7.9000000000000008e-003 | N41: 2.7 | O41: 4.0000000000000001e-003 | P41: 113.3 | Q41: 6.3 | R41: 1.21 | S41: 80.79 | T41: 0.27000000000000002 | U41: 转股中 | V41: 5.24年 | W41: 3.24年 | X41: 0.14099999999999999 | Y41: 0.114 | Z41: 6.5 | AA41: 46 | AB41: 1.95e-002 | AC41: 1.47e-002 | AD41: 3.4999999999999996e-003 | AE41: 1.2999999999999999e-003 | AF41: 89.57 | AG41: 90.52 | AH41: 0.4 | AI41: AA | AJ41: 4.4699999999999997e-002 | AK41: =I41+100*T41 -> 129.601 | AL41: 124.4 | AM41: 63 | AN41: 33.9 | AO41: 69 | AP41: -2.1000000000000001e-002 | AQ41: 50 | AR41: 孚日转债!
A42: 30 | B42: 联诚转债 | C42: 128120 | D42: 44060. | E42: 联诚精密 | F42: 2921 | G42: 汽车 | H42: 零部件制 | I42: 106.149 | J42: -2.8000000000000004e-003 | K42: 1.9e-003 | L42: 21.83 | M42: -1.4000000000000002e-003 | N42: 8.5 | O42: 3.1e-002 | P42: 118.4 | Q42: 24.37 | R42: 2.52 | S42: 89.58 | T42: 0.185 | U42: 4月8天 | V42: 5.83年 | W42: 3.83年 | X42: 0.14599999999999999 | Y42: 0.13100000000000001 | Z42: 2.6 | AA42: 18 | AB42: 1.9299999999999998e-002 | AC42: 1.37e-002 | AD42: -3.8e-003 | AE42: -6.0000000000000001e-003 | AF42: 75.33 | AG42: 73.79 | AH42: 0.7 | AI42: A | AJ42: 8.6699999999999999e-002 | AK42: =I42+100*T42 -> 124.649 | AL42: 122.7 | AM42: 50 | AN42: 47.4 | AO42: 192 | AP42: -4.2000000000000003e-002 | AQ42: 7 | AR42: 联诚转债
A43: 175 | B43: 清水转债 | C43: 123028 | D43: 43661. | E43: 清水源 | F43: 300437 | G43: 城市公用 | H43: 三废处理 | I43: 111.545 | J43: -3.8e-003 | K43: -2.e-003 | L43: 12.25 | M43: -8.8999999999999999e-003 | N43: 3.9 | O43: 6.9999999999999993e-003 | P43: 121.8 | Q43: 11.84 | R43: 1.78 | S43: 103.46 | T43: 7.8e-002 | U43: 转股中 | V43: 4.75年 | W43: 2.75年 | X43: 0.183 | Y43: 0.19 | Z43: 4.9 | AA43: 27 | AB43: 1.9199999999999998e-002 | AC43: 1.11e-002 | AD43: -2.1700000000000001e-002 | AE43: -2.4700000000000003e-002 | AF43: 87.67 | AG43: 91.54 | AH43: 0.65 | AI43: AA- | AJ43: 6.3700000000000007e-002 | AK43: =I43+100*T43 -> 119.345 | AL43: 119.6 | AM43: 24 | AN43: 28.1 | AO43: 22 | AP43: 2.e-002 | AQ43: 48 | AR43: 清水转债
A44: 173 | B44: 智能转债! | C44: 128070 | D44: 43669. | E44: 智能自控 | F44: 2877 | G44: 机械装备 | H44: 通用设备 | I44: 107.69 | J44: 4.1999999999999997e-003 | K44: 5.0000000000000001e-004 | L44: 8.2 | M44: 8.6e-003 | N44: 3.4 | O44: 1.3999999999999999e-002 | P44: 117.6 | Q44: 9.51 | R44: 3.89 | S44: 86.23 | T44: 0.249 | U44: 转股中 | V44: 4.78年 | W44: 无权 | X44: 8.4000000000000005e-002 | Y44: 7.2999999999999995e-002 | Z44: 2.3 | AA44: 27 | AB44: 1.9e-002 | AC44: 1.23e-002 | AD44: 无权 | AE44: 无权 | AF44: 无权 | AG44: 83.98 | AH44: 0.55 | AI44: A+ | AJ44: 7.4700000000000003e-002 | AK44: =I44+100*T44 -> 132.59 | AL44: 129.2 | AM44: 107 | AN44: 45.2 | AO44: 177 | AP44: -4.0000000000000001e-003 | AQ44: 33 | AR44: 智能转债!
A45: 4 | B45: 塞力转债 | C45: 113601 | D45: 44089. | E45: 塞力斯 | F45: 603716 | G45: 医药 | H45: 医药商业 | I45: 108.73 | J45: -1.e-003 | K45: -5.4000000000000003e-003 | L45: 16.25 | M45: -9.7999999999999997e-003 | N45: 30 | O45: 5.0000000000000003e-002 | P45: 121.3 | Q45: 16.98 | R45: 2.23 | S45: 95.7 | T45: 0.13600000000000001 | U45: 5月11天 | V45: 5.92年 | W45: 3.92年 | X45: 0.16300000000000001 | Y45: 0.156 | Z45: 5.4 | AA45: 33 | AB45: 1.9e-002 | AC45: 1.2699999999999999e-002 | AD45: -1.04e-002 | AE45: -1.24e-002 | AF45: 80.58 | AG45: 83.89 | AH45: 0.66 | AI45: AA- | AJ45: 6.5700000000000008e-002 | AK45: =I45+100*T45 -> 122.33000000000001 | AL45: 121.8 | AM45: 42 | AN45: 37.9 | AO45: 112 | AP45: -5.2999999999999999e-002 | AQ45: 5 | AR45: 塞力转债
A46: 269 | B46: 众兴转债! | C46: 128026 | D46: 43103. | E46: 众兴菌业 | F46: 2772 | G46: 农业 | H46: 种植业 | I46: 104.06 | J46: 5.9999999999999995e-004 | K46: 3.4000000000000002e-003 | L46: 8.88 | M46: 1.6e-002 | N46: 2 | O46: 2.e-003 | P46: 110.3 | Q46: 11.45 | R46: 1.37 | S46: 77.55 | T46: 0.34200000000000003 | U46: 转股中 | V46: 3.23年 | W46: 1.23年 | X46: 0.28100000000000003 | Y46: 0.218 | Z46: 9.2 | AA46: 33 | AB46: 1.8600000000000002e-002 | AC46: 1.2500000000000001e-002 | AD46: -8.6999999999999994e-003 | AE46: -1.26e-002 | AF46: 94.37 | AG46: 90.76 | AH46: 0.25 | AI46: AA- | AJ46: 6.3700000000000007e-002 | AK46: =I46+100*T46 -> 138.25999999999999 | AL46: 130.6 | AM46: 125 | AN46: 36.2 | AO46: 98 | AP46: -7.5999999999999998e-002 | AQ46: 56 | AR46: 众兴转债!
A47: 135 | B47: 森特转债 | C47: 113557 | D47: 43840. | E47: 森特股份 | F47: 603098 | G47: 建筑 | H47: 建筑工程 | I47: 109.97 | J47: 1.06e-002 | K47: -6.6e-003 | L47: 9.86 | M47: 6.0999999999999995e-003 | N47: 2.2 | O47: 3.0000000000000001e-003 | P47: 120.7 | Q47: 10.11 | R47: 2.35 | S47: 97.53 | T47: 0.128 | U47: 转股中 | V47: 5.25年 | W47: 3.25年 | X47: 0.127 | Y47: 0.124 | Z47: 6 | AA47: 47 | AB47: 1.83e-002 | AC47: 1.1299999999999999e-002 | AD47: -1.6299999999999999e-002 | AE47: -1.8500000000000003e-002 | AF47: 83.95 | AG47: 87.07 | AH47: 0.64 | AI47: AA- | AJ47: 6.5700000000000008e-002 | AK47: =I47+100*T47 -> 122.77 | AL47: 122.4 | AM47: 45 | AN47: 35.3 | AO47: 88 | AP47: -6.9999999999999993e-003 | AQ47: 36 | AR47: 森特转债
A48: 186 | B48: 创维转债! | C48: 127013 | D48: 43601. | E48: 创维数字 | F48: 810 | G48: 电子 | H48: 电子产品 | I48: 108.791 | J48: 8.0000000000000004e-004 | K48: 5.1000000000000004e-003 | L48: 10.28 | M48: 1.38e-002 | N48: 8.8 | O48: 8.0000000000000002e-003 | P48: 117.9 | Q48: 11.39 | R48: 2.91 | S48: 90.25 | T48: 0.20499999999999999 | U48: 转股中 | V48: 4.57年 | W48: 2.57年 | X48: 8.900000000000001e-002 | Y48: 8.1000000000000003e-002 | Z48: 9.8 | AA48: 109 | AB48: 1.8100000000000002e-002 | AC48: 1.11e-002 | AD48: -1.8600000000000002e-002 | AE48: -2.0899999999999998e-002 | AF48: 92.32 | AG48: 97.75 | AH48: 0.43 | AI48: AA | AJ48: 4.2699999999999995e-002 | AK48: =I48+100*T48 -> 129.291 | AL48: 127.3 | AM48: 85 | AN48: 29.6 | AO48: 29 | AP48: -5.0000000000000003e-002 | AQ48: 23 | AR48: 创维转债!
A49: 98 | B49: 搜特转债! | C49: 128100 | D49: 43930. | E49: 搜于特 | F49: 2503 | G49: 服装纺织 | H49: 服装行业 | I49: 106.6 | J49: 3.3e-003 | K49: 2.7000000000000001e-003 | L49: 2.74 | M49: 1.11e-002 | N49: 26 | O49: 2.9999999999999999e-002 | P49: 117.3 | Q49: 2.9 | R49: 1.55 | S49: 94.48 | T49: 0.128 | U49: 转股中 | V49: 5.48年 | W49: 3.48年 | X49: 9.4e-002 | Y49: 8.900000000000001e-002 | Z49: 8 | AA49: 85 | AB49: 1.8000000000000002e-002 | AC49: 1.23e-002 | AD49: -7.3000000000000001e-003 | AE49: -9.300000000000001e-003 | AF49: 88.66 | AG49: 92.75 | AH49: 0.54 | AI49: AA | AJ49: 4.4699999999999997e-002 | AK49: =I49+100*T49 -> 119.39999999999999 | AL49: 118.7 | AM49: 14 | AN49: 26 | AO49: 13 | AP49: 1.e-003 | AQ49: 39 | AR49: 搜特转债!
A50: 26 | B50: 花王转债 | C50: 113595 | D50: 44061. | E50: 花王股份 | F50: 603007 | G50: 城市公用 | H50: 生态环境 | I50: 113.29 | J50: 9.1999999999999998e-003 | K50: 3.7000000000000002e-003 | L50: 7.51 | M50: 1.7600000000000001e-002 | N50: 9.7 | O50: 2.6000000000000002e-002 | P50: 125.3 | Q50: 6.94 | R50: 2.29 | S50: 108.21 | T50: 4.7e-002 | U50: 4月10天 | V50: 5.84年 | W50: 3.84年 | X50: 0.13100000000000001 | Y50: 0.14199999999999999 | Z50: 3.3 | AA50: 25 | AB50: 1.78e-002 | AC50: 1.04e-002 | AD50: -2.0899999999999998e-002 | AE50: -2.2799999999999997e-002 | AF50: 81.02 | AG50: 87.1 | AH50: 0.73 | AI50: AA- | AJ50: 6.5700000000000008e-002 | AK50: =I50+100*T50 -> 117.99000000000001 | AL50: 118.4 | AM50: 12 | AN50: 31.3 | AO50: 43 | AP50: -6.5000000000000002e-002 | AQ50: 19 | AR50: 花王转债
A51: 174 | B51: 华森转债! | C51: 128069 | D51: 43657. | E51: 华森制药 | F51: 2907 | G51: 医药 | H51: 化学制药 | I51: 110.58 | J51: 3.0000000000000001e-003 | K51: 8.0000000000000004e-004 | L51: 16.9 | M51: 6.6e-003 | N51: 2 | O51: 6.0000000000000001e-003 | P51: 120 | Q51: 18.04 | R51: 6.55 | S51: 93.68 | T51: 0.17999999999999999 | U51: 转股中 | V51: 4.76年 | W51: 2.76年 | X51: 4.4000000000000004e-002 | Y51: 4.0999999999999995e-002 | Z51: 3 | AA51: 68 | AB51: 1.7600000000000001e-002 | AC51: 1.03e-002 | AD51: -2.2599999999999999e-002 | AE51: -2.4799999999999999e-002 | AF51: 86.54 | AG51: 89.94 | AH51: 0.57 | AI51: AA- | AJ51: 6.3700000000000007e-002 | AK51: =I51+100*T51 -> 128.57999999999998 | AL51: 127.5 | AM51: 89 | AN51: 37.5 | AO51: 109 | AP51: -4.8000000000000001e-002 | AQ51: 41 | AR51: 华森转债!
A52: 231 | B52: 长久转债! | C52: 113519 | D52: 43434. | E52: 长久物流 | F52: 603569 | G52: 交通运输 | H52: 物流业 | I52: 112.13 | J52: 3.0000000000000001e-003 | K52: -2.2000000000000001e-003 | L52: 9.86 | M52: 2.e-003 | N52: 0.3 | O52: 0. | P52: 120.1 | Q52: 11.15 | R52: 2.64 | S52: 88.43 | T52: 0.26800000000000002 | U52: 转股中 | V52: 4年49天 | W52: 2年49天 | X52: 0.126 | Y52: 0.11199999999999999 | Z52: 7 | AA52: 55 | AB52: 1.7100000000000001e-002 | AC52: 8.6e-003 | AD52: -3.4200000000000001e-002 | AE52: -3.7100000000000001e-002 | AF52: 94.22 | AG52: 101.43 | AH52: 0.36 | AI52: AA | AJ52: 4.2699999999999995e-002 | AK52: =I52+100*T52 -> 138.93000000000001 | AL52: 135.8 | AM52: 169 | AN52: 34.4 | AO52: 75 | AP52: -2.7000000000000003e-002 | AQ52: 17 | AR52: 长久转债!
A53: 200 | B53: 迪森转债! | C53: 123023 | D53: 43571. | E53: 迪森股份 | F53: 300335 | G53: 能源电力 | H53: 电力供应 | I53: 106.61 | J53: -2.3e-003 | K53: -7.4999999999999997e-003 | L53: 6.1 | M53: -2.4e-002 | N53: 35 | O53: 5.4000000000000006e-002 | P53: 114.9 | Q53: 7.04 | R53: 1.71 | S53: 86.65 | T53: 0.23000000000000001 | U53: 转股中 | V53: 4.50年 | W53: 3.50年 | X53: 0.27100000000000002 | Y53: 0.23499999999999999 | Z53: 6 | AA53: 22 | AB53: 1.7100000000000001e-002 | AC53: 1.1000000000000001e-002 | AD53: -3.5999999999999999e-003 | AE53: -6.3e-003 | AF53: 90.5 | AG53: 95.56 | AH53: 0.41 | AI53: AA | AJ53: 4.2699999999999995e-002 | AK53: =I53+100*T53 -> 129.61000000000001 | AL53: 126.6 | AM53: 80 | AN53: 31 | AO53: 39 | AP53: 2.7000000000000003e-002 | AQ53: 52 | AR53: 迪森转债!
A54: 86 | B54: 鲁泰转债 | C54: 127016 | D54: 43964. | E54: 鲁 泰Ａ | F54: 726 | G54: 服装纺织 | H54: 纺织行业 | I54: 106 | J54: -1.e-004 | K54: 2.8999999999999998e-003 | L54: 7.61 | M54: 6.6e-003 | N54: 0.6 | O54: 0. | P54: 116.2 | Q54: 8.91 | R54: 0.84 | S54: 85.41 | T54: 0.24100000000000002 | U54: 26天 | V54: 5.55年 | W54: 3.55年 | X54: 0.214 | Y54: 0.183 | Z54: 14 | AA54: 65 | AB54: 1.7000000000000001e-002 | AC54: 1.1699999999999999e-002 | AD54: -5.8999999999999999e-003 | AE54: -7.8000000000000005e-003 | AF54: 88.89 | AG54: 92.52 | AH54: 0.43 | AI54: AA+ | AJ54: 4.2699999999999995e-002 | AK54: =I54+100*T54 -> 130.09999999999999 | AL54: 126.6 | AM54: 81 | AN54: 34.1 | AO54: 72 | AP54: -1.9e-002 | AQ54: 21 | AR54: 鲁泰转债
A55: 145 | B55: 海亮转债! | C55: 128081 | D55: 43815. | E55: 海亮股份 | F55: 2203 | G55: 有色金属 | H55: 铜金属 | I55: 105.798 | J55: 1.9e-003 | K55: -1.2999999999999999e-003 | L55: 8.39 | M55: 1.1999999999999999e-003 | N55: 5.7 | O55: 2.e-003 | P55: 115.2 | Q55: 9.76 | R55: 1.82 | S55: 85.96 | T55: 0.23100000000000001 | U55: 转股中 | V55: 5.17年 | W55: 3.17年 | X55: 0.192 | Y55: 0.16500000000000001 | Z55: 32 | AA55: 164 | AB55: 1.6899999999999998e-002 | AC55: 1.15e-002 | AD55: -6.0000000000000001e-003 | AE55: -8.199999999999999e-003 | AF55: 89.75 | AG55: 92.3 | AH55: 0.44 | AI55: AA | AJ55: 4.4699999999999997e-002 | AK55: =I55+100*T55 -> 128.898 | AL55: 125.6 | AM55: 73 | AN55: 33.3 | AO55: 60 | AP55: -1.6e-002 | AQ55: 52 | AR55: 海亮转债!
A56: 40 | B56: 道恩转债 | C56: 128117 | D56: 44032. | E56: 道恩股份 | F56: 2838 | G56: 化工 | H56: 橡胶塑料 | I56: 112.408 | J56: 5.0000000000000001e-004 | K56: -1.7000000000000001e-003 | L56: 28.7 | M56: -1.7000000000000001e-003 | N56: 3.9 | O56: 1.e-002 | P56: 123.5 | Q56: 29.32 | R56: 7.19 | S56: 97.89 | T56: 0.14800000000000002 | U56: 3月21天 | V56: 5.78年 | W56: 3.78年 | X56: 3.1e-002 | Y56: 2.9999999999999999e-002 | Z56: 3.6 | AA56: 117 | AB56: 1.67e-002 | AC56: 9.7000000000000003e-003 | AD56: -2.0099999999999996e-002 | AE56: -2.1899999999999999e-002 | AF56: 80.95 | AG56: 86.06 | AH56: 0.65 | AI56: AA- | AJ56: 6.5700000000000008e-002 | AK56: =I56+100*T56 -> 127.208 | AL56: 126.9 | AM56: 84 | AN56: 40.9 | AO56: 149 | AP56: -3.5000000000000003e-002 | AQ56: 8 | AR56: 道恩转债
A57: 159 | B57: 金轮转债! | C57: 128076 | D57: 43777. | E57: 金轮股份 | F57: 2722 | G57: 机械装备 | H57: 专用设备 | I57: 106.368 | J57: 8.6e-003 | K57: 3.0000000000000001e-003 | L57: 13.6 | M57: 1.8700000000000001e-002 | N57: 2.3 | O57: 1.e-002 | P57: 115.3 | Q57: 14.76 | R57: 1.29 | S57: 92.14 | T57: 0.154 | U57: 转股中 | V57: 5年25天 | W57: 3年25天 | X57: 8.9999999999999997e-002 | Y57: 8.3000000000000004e-002 | Z57: 2.1 | AA57: 24 | AB57: 1.6399999999999998e-002 | AC57: 1.0800000000000001e-002 | AD57: -7.6e-003 | AE57: -9.8999999999999991e-003 | AF57: 84.71 | AG57: 84.12 | AH57: 0.62 | AI57: AA- | AJ57: 6.5700000000000008e-002 | AK57: =I57+100*T57 -> 121.768 | AL57: 120.6 | AM57: 31 | AN57: 35.9 | AO57: 96 | AP57: 3.3000000000000002e-002 | AQ57: 41 | AR57: 金轮转债!
A58: 278 | B58: 时达转债! | C58: 128018 | D58: 43073. | E58: 新时达 | F58: 2527 | G58: 机械装备 | H58: 机器人及 | I58: 105.112 | J58: 1.e-004 | K58: 4.8999999999999998e-003 | L58: 5.96 | M58: 1.8799999999999997e-002 | N58: 1.3 | O58: 1.e-003 | P58: 110.3 | Q58: 7.42 | R58: 1.47 | S58: 80.32 | T58: 0.309 | U58: 转股中 | V58: 3年48天 | W58: 1年48天 | X58: 0.23800000000000002 | Y58: 0.191 | Z58: 8.8 | AA58: 37 | AB58: 1.5900000000000001e-002 | AC58: 9.5999999999999992e-003 | AD58: -1.72e-002 | AE58: -2.1299999999999999e-002 | AF58: 97.42 | AG58: 97.06 | AH58: 0.26 | AI58: AA | AJ58: 4.2699999999999995e-002 | AK58: =I58+100*T58 -> 136.012 | AL58: 129.9 | AM58: 116 | AN58: 32.5 | AO58: 53 | AP58: 1.3000000000000001e-002 | AQ58: 41 | AR58: 时达转债!
A59: 143 | B59: 华锋转债! | C59: 128082 | D59: 43836. | E59: 华锋股份 | F59: 2806 | G59: 电子 | H59: 元器件制 | I59: 112.603 | J59: 1.26e-002 | K59: -1.e-003 | L59: 12.4 | M59: 1.5600000000000001e-002 | N59: 2.1 | O59: 5.0000000000000001e-003 | P59: 122 | Q59: 11.71 | R59: 1.74 | S59: 105.89 | T59: 6.3e-002 | U59: 转股中 | V59: 5.21年 | W59: 3.21年 | X59: 0.161 | Y59: 0.17100000000000001 | Z59: 3.5 | AA59: 22 | AB59: 1.5900000000000001e-002 | AC59: 8.6e-003 | AD59: -2.06e-002 | AE59: -2.3399999999999997e-002 | AF59: 82.23 | AG59: 83.94 | AH59: 0.74 | AI59: A+ | AJ59: 7.6700000000000004e-002 | AK59: =I59+100*T59 -> 118.90299999999999 | AL59: 119.3 | AM59: 21 | AN59: 35.4 | AO59: 90 | AP59: -5.0000000000000001e-003 | AQ59: 54 | AR59: 华锋转债!
A60: 90 | B60: 华体转债! | C60: 113574 | D60: 43948. | E60: 华体科技 | F60: 603679 | G60: 城市公用 | H60: 城市公用 | I60: 107.07 | J60: 5.0000000000000001e-004 | K60: 1.5900000000000001e-002 | L60: 24.51 | M60: 3.9399999999999998e-002 | N60: 3.7 | O60: 1.7000000000000001e-002 | P60: 116.4 | Q60: 33.99 | R60: 3.52 | S60: 72.11 | T60: 0.48499999999999999 | U60: 18天 | V60: 5.53年 | W60: 3.53年 | X60: 5.9999999999999998e-002 | Y60: 4.2999999999999997e-002 | Z60: 2.1 | AA60: 35 | AB60: 1.5600000000000001e-002 | AC60: 1.0200000000000001e-002 | AD60: -6.5000000000000006e-003 | AE60: -8.8000000000000005e-003 | AF60: 79.85 | AG60: 78.15 | AH60: 0.42 | AI60: A+ | AJ60: 7.6700000000000004e-002 | AK60: =I60+100*T60 -> 155.56999999999999 | AL60: 142 | AM60: 216 | AN60: 62.2 | AO60: 251 | AP60: -8.199999999999999e-002 | AQ60: 10 | AR60: 华体转债!
A61: 236 | B61: 苏农转债! | C61: 113516 | D61: 43332. | E61: 苏农银行 | F61: 603323 | G61: 金融 | H61: 银行行业 | I61: 107.85 | J61: 0. | K61: 7.9000000000000008e-003 | L61: 4.77 | M61: 2.1400000000000002e-002 | N61: 7.9 | O61: 6.0000000000000001e-003 | P61: 114.3 | Q61: 5.52 | R61: 0.74 | S61: 86.41 | T61: 0.248 | U61: 转股中 | V61: 3.87年 | W61: 无权 | X61: 0.14999999999999999 | Y61: 0.13 | Z61: 13 | AA61: 86 | AB61: 1.54e-002 | AC61: 8.6e-003 | AD61: 无权 | AE61: 无权 | AF61: 无权 | AG61: 98.22 | AH61: 0.37 | AI61: AA+ | AJ61: 4.07e-002 | AK61: =I61+100*T61 -> 132.65000000000001 | AL61: 129.3 | AM61: 110 | AN61: 31.1 | AO61: 41 | AP61: 4.0000000000000001e-003 | AQ61: 36 | AR61: 苏农转债!
A62: 3 | B62: 嘉泽转债 | C62: 113039 | D62: 44091. | E62: 嘉泽新能 | F62: 601619 | G62: 能源电力 | H62: 风能 | I62: 103.7 | J62: -1.6000000000000001e-003 | K62: 6.8000000000000005e-003 | L62: 3.2 | M62: 9.4999999999999998e-003 | N62: 88 | O62: 6.5000000000000002e-002 | P62: 113.1 | Q62: 3.57 | R62: 1.98 | S62: 89.64 | T62: 0.157 | U62: 5月13天 | V62: 5.93年 | W62: 3.93年 | X62: 0.19600000000000001 | Y62: 0.17600000000000002 | Z62: 13 | AA62: 66 | AB62: 1.4999999999999999e-002 | AC62: 1.09e-002 | AD62: -2.0000000000000001e-004 | AE62: -1.9e-003 | AF62: 86.73 | AG62: 87.66 | AH62: 0.55 | AI62: AA | AJ62: 4.4699999999999997e-002 | AK62: =I62+100*T62 -> 119.40000000000001 | AL62: 117.8 | AM62: 10 | AN62: 30.1 | AO62: 34 | AP62: -1.3999999999999999e-002 | AQ62: 2 | AR62: 嘉泽转债
A63: 221 | B63: 钧达转债! | C63: 128050 | D63: 43461. | E63: 钧达股份 | F63: 2865 | G63: 汽车 | H63: 零部件制 | I63: 116.197 | J63: 2.3900000000000001e-002 | K63: 1.2500000000000001e-002 | L63: 16.83 | M63: 5.1900000000000002e-002 | N63: 17 | O63: 4.5999999999999999e-002 | P63: 123.5 | Q63: 14.83 | R63: 2.37 | S63: 113.49 | T63: 2.4e-002 | U63: 转股中 | V63: 4.23年 | W63: 2.23年 | X63: 0.157 | Y63: 0.17800000000000002 | Z63: 3.2 | AA63: 20 | AB63: 1.49e-002 | AC63: 5.4000000000000003e-003 | AD63: -4.6500000000000007e-002 | AE63: -4.9400000000000006e-002 | AF63: 89.77 | AG63: 95.73 | AH63: 0.7 | AI63: AA- | AJ63: 6.3700000000000007e-002 | AK63: =I63+100*T63 -> 118.59700000000001 | AL63: 118.9 | AM63: 15 | AN63: 23.2 | AO63: 10 | AP63: -5.0000000000000001e-003 | AQ63: 63 | AR63: 钧达转债!
A64: 29 | B64: 沪工转债 | C64: 113593 | D64: 44053. | E64: 上海沪工 | F64: 603131 | G64: 机械装备 | H64: 通用设备 | I64: 111.81 | J64: 9.8999999999999991e-003 | K64: 2.9999999999999999e-002 | L64: 20.05 | M64: 5.7999999999999996e-002 | N64: 11 | O64: 2.5000000000000001e-002 | P64: 121.6 | Q64: 21.32 | R64: 5.26 | S64: 94.04 | T64: 0.18899999999999997 | U64: 4月8天 | V64: 5.83年 | W64: 3.83年 | X64: 6.3e-002 | Y64: 5.9000000000000004e-002 | Z64: 4 | AA64: 64 | AB64: 1.4800000000000001e-002 | AC64: 8.3999999999999995e-003 | AD64: -1.67e-002 | AE64: -1.8799999999999997e-002 | AF64: 78.07 | AG64: 79.77 | AH64: 0.69 | AI64: A+ | AJ64: 7.6700000000000004e-002 | AK64: =I64+100*T64 -> 130.71000000000001 | AL64: 129.6 | AM64: 113 | AN64: 49.8 | AO64: 203 | AP64: -5.0000000000000001e-003 | AQ64: 4 | AR64: 沪工转债
A65: 187 | B65: 核能转债! | C65: 113026 | D65: 43593. | E65: 中国核电 | F65: 601985 | G65: 能源电力 | H65: 核电 | I65: 102.98 | J65: 3.7000000000000002e-003 | K65: 1.e-003 | L65: 4.61 | M65: 1.77e-002 | N65: 37 | O65: 5.0000000000000001e-003 | P65: 109.8 | Q65: 6.08 | R65: 1.43 | S65: 75.82 | T65: 0.35799999999999998 | U65: 转股中 | V65: 4.57年 | W65: 2.57年 | X65: 0.109 | Y65: 8.199999999999999e-002 | Z65: 78 | AA65: 718 | AB65: 1.44e-002 | AC65: 1.03e-002 | AD65: 1.1000000000000001e-003 | AE65: -1.1999999999999999e-003 | AF65: 93.44 | AG65: 93.03 | AH65: 0.27 | AI65: AAA | AJ65: 3.7699999999999997e-002 | AK65: =I65+100*T65 -> 138.78 | AL65: 130.1 | AM65: 118 | AN65: 36.7 | AO65: 101 | AP65: -5.0000000000000001e-003 | AQ65: 50 | AR65: 核能转债!
A66: 208 | B66: 贵广转债! | C66: 110052 | D66: 43553. | E66: 贵广网络 | F66: 600996 | G66: 传媒娱乐 | H66: 影视娱乐 | I66: 111.5 | J66: -1.8e-003 | K66: 2.3999999999999998e-003 | L66: 7.21 | M66: 1.4000000000000002e-003 | N66: 2.1 | O66: 1.e-003 | P66: 118.5 | Q66: 7.94 | R66: 1.64 | S66: 90.81 | T66: 0.22800000000000001 | U66: 转股中 | V66: 4.46年 | W66: 2.46年 | X66: 0.20100000000000001 | Y66: 0.183 | Z66: 15 | AA66: 76 | AB66: 1.41e-002 | AC66: 6.7000000000000002e-003 | AD66: -2.7099999999999999e-002 | AE66: -2.98e-002 | AF66: 93.63 | AG66: 99.59 | AH66: 0.42 | AI66: AA+ | AJ66: 4.07e-002 | AK66: =I66+100*T66 -> 134.30000000000001 | AL66: 132.2 | AM66: 141 | AN66: 32.6 | AO66: 55 | AP66: -4.2000000000000003e-002 | AQ66: 18 | AR66: 贵广转债!
A67: 193 | B67: 海环转债! | C67: 113532 | D67: 43579. | E67: 海峡环保 | F67: 603817 | G67: 城市公用 | H67: 三废处理 | I67: 106.2 | J67: 3.4000000000000002e-003 | K67: 4.0000000000000002e-004 | L67: 6.54 | M67: 9.300000000000001e-003 | N67: 2.8 | O67: 6.0000000000000001e-003 | P67: 112.9 | Q67: 7.69 | R67: 1.76 | S67: 85.05 | T67: 0.249 | U67: 转股中 | V67: 4.53年 | W67: 2.53年 | X67: 0.156 | Y67: 0.13300000000000001 | Z67: 4.6 | AA67: 29 | AB67: 1.3899999999999999e-002 | AC67: 8.6e-003 | AD67: -9.8999999999999991e-003 | AE67: -1.24e-002 | AF67: 92.46 | AG67: 93.76 | AH67: 0.41 | AI67: AA | AJ67: 4.2699999999999995e-002 | AK67: =I67+100*T67 -> 131.09999999999999 | AL67: 127.4 | AM67: 86 | AN67: 33.6 | AO67: 65 | AP67: -2.7000000000000003e-002 | AQ67: 26 | AR67: 海环转债!
A68: 39 | B68: 瀛通转债 | C68: 128118 | D68: 44048. | E68: 瀛通通讯 | F68: 2861 | G68: 电子 | H68: 电子产品 | I68: 112.999 | J68: 0. | K68: 7.1999999999999998e-003 | L68: 24.91 | M68: 1.2199999999999999e-002 | N68: 1.4 | O68: 4.0000000000000001e-003 | P68: 122.1 | Q68: 27.53 | R68: 2.88 | S68: 90.48 | T68: 0.249 | U68: 3月21天 | V68: 5.78年 | W68: 3.78年 | X68: 9.9000000000000005e-002 | Y68: 8.900000000000001e-002 | Z68: 3 | AA68: 30 | AB68: 1.38e-002 | AC68: 7.1999999999999998e-003 | AD68: -1.9599999999999999e-002 | AE68: -2.1700000000000001e-002 | AF68: 81.57 | AG68: 85.21 | AH68: 0.59 | AI68: AA- | AJ68: 6.5700000000000008e-002 | AK68: =I68+100*T68 -> 137.899 | AL68: 135.5 | AM68: 167 | AN68: 50.3 | AO68: 208 | AP68: -7.9000000000000001e-002 | AQ68: 4 | AR68: 瀛通转债
A69: 23 | B69: 紫银转债 | C69: 113037 | D69: 44060. | E69: 紫金银行 | F69: 601860 | G69: 金融 | H69: 银行行业 | I69: 107.86 | J69: -7.3000000000000001e-003 | K69: 1.83e-002 | L69: 4.27 | M69: 2.1499999999999998e-002 | N69: 203 | O69: 4.2000000000000003e-002 | P69: 115.8 | Q69: 4.75 | R69: 1.13 | S69: 89.89 | T69: 0.20000000000000001 | U69: 4月12天 | V69: 5.84年 | W69: 无权 | X69: 0.28800000000000003 | Y69: 0.25900000000000001 | Z69: 45 | AA69: 156 | AB69: 1.2500000000000001e-002 | AC69: 7.6e-003 | AD69: 无权 | AE69: 无权 | AF69: 无权 | AG69: 91.13 | AH69: 0.51 | AI69: AA+ | AJ69: 4.2699999999999995e-002 | AK69: =I69+100*T69 -> 127.86 | AL69: 125.8 | AM69: 75 | AN69: 34.7 | AO69: 80 | AP69: -4.0000000000000001e-003 | AQ69: 14 | AR69: 紫银转债
A70: 127 | B70: 开润转债! | C70: 123039 | D70: 43853. | E70: 开润股份 | F70: 300577 | G70: 服装纺织 | H70: 纺织行业 | I70: 114.08 | J70: 4.0000000000000002e-004 | K70: -1.8e-003 | L70: 30.12 | M70: -2.3e-003 | N70: 0.3 | O70: 1.e-003 | P70: 121.5 | Q70: 33.22 | R70: 7.45 | S70: 90.67 | T70: 0.25800000000000001 | U70: 转股中 | V70: 5.27年 | W70: 3.27年 | X70: 3.4000000000000002e-002 | Y70: 3.1e-002 | Z70: 2.2 | AA70: 65 | AB70: 1.23e-002 | AC70: 5.1999999999999998e-003 | AD70: -2.53e-002 | AE70: -2.7799999999999998e-002 | AF70: 81.43 | AG70: 83.13 | AH70: 0.63 | AI70: A+ | AJ70: 7.6700000000000004e-002 | AK70: =I70+100*T70 -> 139.88 | AL70: 137.5 | AM70: 183 | AN70: 54.4 | AO70: 225 | AP70: -6.0000000000000001e-003 | AQ70: 22 | AR70: 开润转债!
A71: 93 | B71: 久吾转债 | C71: 123047 | D71: 43938. | E71: 久吾高科 | F71: 300631 | G71: 机械装备 | H71: 专用设备 | I71: 122 | J71: 8.3000000000000001e-003 | K71: 5.0000000000000001e-004 | L71: 21.22 | M71: 1.1000000000000001e-002 | N71: 12 | O71: 4.0000000000000001e-002 | P71: 130.1 | Q71: 17.61 | R71: 3.23 | S71: 120.5 | T71: 1.2e-002 | U71: 7天 | V71: 5.50年 | W71: 3.50年 | X71: 0.113 | Y71: 0.13699999999999998 | Z71: 2.5 | AA71: 22 | AB71: 1.21e-002 | AC71: 3.0999999999999999e-003 | AD71: -3.78e-002 | AE71: -4.0800000000000003e-002 | AF71: 81.22 | AG71: 87.67 | AH71: 0.8 | AI71: A+ | AJ71: 7.6700000000000004e-002 | AK71: =I71+100*T71 -> 123.2 | AL71: 123.5 | AM71: 57 | AN71: 35.8 | AO71: 95 | AP71: 2.4e-002 | AQ71: 20 | AR71: 久吾转债
A72: 204 | B72: 苏银转债! | C72: 110053 | D72: 43558. | E72: 江苏银行 | F72: 600919 | G72: 金融 | H72: 银行行业 | I72: 113.31 | J72: 1.e-004 | K72: 8.3000000000000001e-003 | L72: 6.58 | M72: 2.0199999999999999e-002 | N72: 57 | O72: 3.0000000000000001e-003 | P72: 119.1 | Q72: 7.28 | R72: 0.66 | S72: 90.38 | T72: 0.254 | U72: 转股中 | V72: 4.48年 | W72: 无权 | X72: 0.26300000000000001 | Y72: 0.23800000000000002 | Z72: 200 | AA72: 760 | AB72: 1.15e-002 | AC72: 3.9000000000000003e-003 | AD72: 无权 | AE72: 无权 | AF72: 无权 | AG72: 101.4 | AH72: 0.41 | AI72: AAA | AJ72: 3.7699999999999997e-002 | AK72: =I72+100*T72 -> 138.71000000000001 | AL72: 136.2 | AM72: 172 | AN72: 34.8 | AO72: 83 | AP72: 2.5000000000000001e-002 | AQ72: 47 | AR72: 苏银转债!
A73: 112 | B73: 翔港转债 | C73: 113566 | D73: 43921. | E73: 翔港科技 | F73: 603499 | G73: 造纸包装 | H73: 包装材料 | I73: 117.32 | J73: 2.3e-003 | K73: 1.21e-002 | L73: 12.08 | M73: 1.8500000000000003e-002 | N73: 9.5 | O73: 5.0000000000000003e-002 | P73: 124.5 | Q73: 10.77 | R73: 3.23 | S73: 112.16 | T73: 4.5999999999999999e-002 | U73: 转股中 | V73: 5.44年 | W73: 3.44年 | X73: 6.8000000000000005e-002 | Y73: 7.5999999999999998e-002 | Z73: 1.6 | AA73: 24 | AB73: 1.1200000000000002e-002 | AC73: 3.5999999999999999e-003 | AD73: -3.15e-002 | AE73: -3.39e-002 | AF73: 80.46 | AG73: 84.08 | AH73: 0.77 | AI73: A+ | AJ73: 7.6700000000000004e-002 | AK73: =I73+100*T73 -> 121.91999999999999 | AL73: 122.5 | AM73: 46 | AN73: 38.4 | AO73: 116 | AP73: -5.2999999999999999e-002 | AQ73: 26 | AR73: 翔港转债
A74: 224 | B74: 山鹰转债 | C74: 110047 | D74: 43444. | E74: 山鹰纸业 | F74: 600567 | G74: 造纸包装 | H74: 包装用纸 | I74: 112.9 | J74: -5.6999999999999993e-003 | K74: 1.01e-002 | L74: 3.18 | M74: 9.4999999999999998e-003 | N74: 14 | O74: 5.0000000000000001e-003 | P74: 118.1 | Q74: 3.34 | R74: 1.03 | S74: 95.21 | T74: 0.18600000000000003 | U74: 转股中 | V74: 4.17年 | W74: 2.17年 | X74: 0.157 | Y74: 0.14999999999999999 | Z74: 23 | AA74: 146 | AB74: 1.11e-002 | AC74: 3.4000000000000002e-003 | AD74: -3.7100000000000001e-002 | AE74: -3.9800000000000002e-002 | AF74: 94.32 | AG74: 100.35 | AH74: 0.46 | AI74: AA+ | AJ74: 4.07e-002 | AK74: =I74+100*T74 -> 131.5 | AL74: 130.6 | AM74: 126 | AN74: 30.2 | AO74: 35 | AP74: -1.2e-002 | AQ74: 34 | AR74: 山鹰转债
A75: 151 | B75: 金力转债! | C75: 123033 | D75: 43794. | E75: 金力永磁 | F75: 300748 | G75: 电子 | H75: 元器件制 | I75: 115.405 | J75: 3.4999999999999996e-003 | K75: 6.8000000000000005e-003 | L75: 38.02 | M75: 1.77e-002 | N75: 9 | O75: 1.8000000000000002e-002 | P75: 121.9 | Q75: 41.09 | R75: 12.39 | S75: 92.53 | T75: 0.247 | U75: 转股中 | V75: 5年43天 | W75: 3年43天 | X75: 2.7999999999999997e-002 | Y75: 2.6000000000000002e-002 | Z75: 4.4 | AA75: 157 | AB75: 1.11e-002 | AC75: 3.5999999999999999e-003 | AD75: -2.7699999999999999e-002 | AE75: -3.0699999999999998e-002 | AF75: 85.82 | AG75: 88.88 | AH75: 0.59 | AI75: AA- | AJ75: 6.5700000000000008e-002 | AK75: =I75+100*T75 -> 140.10499999999999 | AL75: 138.3 | AM75: 191 | AN75: 49.4 | AO75: 202 | AP75: -5.2999999999999999e-002 | AQ75: 26 | AR75: 金力转债!
A76: 264 | B76: 双环转债! | C76: 128032 | D76: 43125. | E76: 双环传动 | F76: 2472 | G76: 机械装备 | H76: 通用设备 | I76: 106.6 | J76: 2.8000000000000004e-003 | K76: -2.8000000000000004e-003 | L76: 6.92 | M76: 0. | N76: 3.7 | O76: 3.0000000000000001e-003 | P76: 110.3 | Q76: 9.89 | R76: 1.44 | S76: 69.97 | T76: 0.52400000000000002 | U76: 转股中 | V76: 3.27年 | W76: 1.27年 | X76: 0.20999999999999999 | Y76: 0.14699999999999999 | Z76: 10 | AA76: 48 | AB76: 1.0700000000000001e-002 | AC76: 4.7999999999999996e-003 | AD76: -2.53e-002 | AE76: -2.8900000000000002e-002 | AF76: 96.88 | AG76: 96.52 | AH76: 0.13 | AI76: AA | AJ76: 4.2699999999999995e-002 | AK76: =I76+100*T76 -> 159. | AL76: 143.2 | AM76: 220 | AN76: 46.4 | AO76: 183 | AP76: 2.e-003 | AQ76: 47 | AR76: 双环转债!
A77: 190 | B77: 核建转债! | C77: 113024 | D77: 43581. | E77: 中国核建 | F77: 601611 | G77: 建筑 | H77: 建筑工程 | I77: 104.68 | J77: 5.6999999999999993e-003 | K77: 4.7999999999999996e-003 | L77: 7.57 | M77: 3.4200000000000001e-002 | N77: 4.8 | O77: 2.e-003 | P77: 109.7 | Q77: 9.76 | R77: 1.94 | S77: 77.56 | T77: 0.34999999999999998 | U77: 转股中 | V77: 4.55年 | W77: 2.55年 | X77: 0.14899999999999999 | Y77: 0.11599999999999999 | Z77: 30 | AA77: 201 | AB77: 1.0500000000000001e-002 | AC77: 6.5000000000000006e-003 | AD77: -5.3e-003 | AE77: -7.4999999999999997e-003 | AF77: 93.4 | AG77: 92.99 | AH77: 0.31 | AI77: AAA | AJ77: 3.7699999999999997e-002 | AK77: =I77+100*T77 -> 139.68000000000001 | AL77: 131.8 | AM77: 138 | AN77: 38.4 | AO77: 115 | AP77: -5.5e-002 | AQ77: 43 | AR77: 核建转债!
A78: 119 | B78: 星帅转债 | C78: 128094 | D78: 43880. | E78: 星帅尔 | F78: 2860 | G78: 家电 | H78: 零部件制 | I78: 115.15 | J78: 1.2999999999999999e-003 | K78: -5.8999999999999999e-003 | L78: 14.78 | M78: -6.0999999999999995e-003 | N78: 2.1 | O78: 6.9999999999999993e-003 | P78: 121.5 | Q78: 13.95 | R78: 3.29 | S78: 105.95 | T78: 8.6999999999999994e-002 | U78: 转股中 | V78: 5.33年 | W78: 3.33年 | X78: 9.5000000000000001e-002 | Y78: 0.10099999999999999 | Z78: 2.8 | AA78: 29 | AB78: 1.04e-002 | AC78: 3.4000000000000002e-003 | AD78: -2.75e-002 | AE78: -2.9900000000000003e-002 | AF78: 81.09 | AG78: 82.77 | AH78: 0.76 | AI78: A+ | AJ78: 7.6700000000000004e-002 | AK78: =I78+100*T78 -> 123.85000000000001 | AL78: 124.4 | AM78: 62 | AN78: 41.6 | AO78: 155 | AP78: -5.0000000000000001e-003 | AQ78: 30 | AR78: 星帅转债
A79: 109 | B79: 君禾转债 | C79: 113567 | D79: 43924. | E79: 君禾股份 | F79: 603617 | G79: 机械装备 | H79: 通用设备 | I79: 112.88 | J79: 1.04e-002 | K79: 3.8e-003 | L79: 12.16 | M79: 1.84e-002 | N79: 3.2 | O79: 1.3000000000000001e-002 | P79: 119.3 | Q79: 11.46 | R79: 3.88 | S79: 106.11 | T79: 6.4000000000000001e-002 | U79: 转股中 | V79: 5.46年 | W79: 3.46年 | X79: 8.6999999999999994e-002 | Y79: 9.1999999999999998e-002 | Z79: 2.1 | AA79: 24 | AB79: 1.04e-002 | AC79: 4.1999999999999997e-003 | AD79: -2.1400000000000002e-002 | AE79: -2.3700000000000002e-002 | AF79: 80.22 | AG79: 80.52 | AH79: 0.77 | AI79: A+ | AJ79: 7.6700000000000004e-002 | AK79: =I79+100*T79 -> 119.28 | AL79: 119.7 | AM79: 25 | AN79: 39.1 | AO79: 127 | AP79: 2.1000000000000001e-002 | AQ79: 29 | AR79: 君禾转债
A80: 16 | B80: 大禹转债 | C80: 123063 | D80: 44063. | E80: 大禹节水 | F80: 300021 | G80: 化工 | H80: 橡胶塑料 | I80: 119.22 | J80: -4.4000000000000003e-003 | K80: -7.7000000000000002e-003 | L80: 5.87 | M80: -1.5100000000000001e-002 | N80: 44 | O80: 5.7999999999999996e-002 | P80: 126.5 | Q80: 4.94 | R80: 3.29 | S80: 118.83 | T80: 3.0000000000000001e-003 | U80: 4月17天 | V80: 5.86年 | W80: 4.86年 | X80: 0.13600000000000001 | Y80: 0.16200000000000001 | Z80: 6.4 | AA80: 47 | AB80: 1.04e-002 | AC80: 2.8999999999999998e-003 | AD80: -2.1600000000000001e-002 | AE80: -2.4199999999999999e-002 | AF80: 78.15 | AG80: 87.82 | AH80: 0.8 | AI80: AA- | AJ80: 6.5700000000000008e-002 | AK80: =I80+100*T80 -> 119.52 | AL80: 119.6 | AM80: 23 | AN80: 31.8 | AO80: 47 | AP80: -3.9e-002 | AQ80: 10 | AR80: 大禹转债
A81: 27 | B81: 淳中转债 | C81: 113594 | D81: 44071. | E81: 淳中科技 | F81: 603516 | G81: 电子 | H81: 电子产品 | I81: 114.5 | J81: -1.e-004 | K81: 7.1999999999999998e-003 | L81: 34.68 | M81: 1.1399999999999999e-002 | N81: 1.5 | O81: 4.0000000000000001e-003 | P81: 121.4 | Q81: 39.37 | R81: 5.45 | S81: 88.09 | T81: 0.29999999999999999 | U81: 4月10天 | V81: 5.84年 | W81: 3.84年 | X81: 6.5000000000000002e-002 | Y81: 5.7000000000000002e-002 | Z81: 3 | AA81: 46 | AB81: 1.03e-002 | AC81: 4.0000000000000001e-003 | AD81: -2.2700000000000001e-002 | AE81: -2.4799999999999999e-002 | AF81: 78.06 | AG81: 79.64 | AH81: 0.62 | AI81: A+ | AJ81: 7.6700000000000004e-002 | AK81: =I81+100*T81 -> 144.5 | AL81: 140.9 | AM81: 209 | AN81: 61.3 | AO81: 247 | AP81: -9.1999999999999998e-002 | AQ81: 3 | AR81: 淳中转债
A82: 5 | B82: 齐翔转2 | C82: 128128 | D82: 44089. | E82: 齐翔腾达 | F82: 2408 | G82: 化工 | H82: 化工 | I82: 108.6 | J82: 1.0500000000000001e-002 | K82: -8.3000000000000001e-003 | L82: 7.95 | M82: 3.8e-003 | N82: 178 | O82: 5.5e-002 | P82: 115.3 | Q82: 8.22 | R82: 1.76 | S82: 96.72 | T82: 0.12300000000000001 | U82: 5月10天 | V82: 5.92年 | W82: 3.92年 | X82: 0.21199999999999999 | Y82: 0.20499999999999999 | Z82: 30 | AA82: 141 | AB82: 1.03e-002 | AC82: 5.6999999999999993e-003 | AD82: -1.1299999999999999e-002 | AE82: -1.3000000000000001e-002 | AF82: 86.88 | AG82: 89.42 | AH82: 0.59 | AI82: AA | AJ82: 4.4699999999999997e-002 | AK82: =I82+100*T82 -> 120.89999999999999 | AL82: 120.5 | AM82: 30 | AN82: 31.1 | AO82: 40 | AP82: -7.5999999999999998e-002 | AQ82: 7 | AR82: 齐翔转2
A83: 211 | B83: 今飞转债! | C83: 128056 | D83: 43546. | E83: 今飞凯达 | F83: 2863 | G83: 汽车 | H83: 零部件制 | I83: 115.9 | J83: 1.9099999999999999e-002 | K83: 1.26e-002 | L83: 7.8 | M83: 4.0000000000000001e-002 | N83: 45 | O83: 0.106 | P83: 121 | Q83: 6.76 | R83: 2.86 | S83: 115.38 | T83: 4.0000000000000001e-003 | U83: 转股中 | V83: 4.44年 | W83: 2.44年 | X83: 0.125 | Y83: 0.14499999999999999 | Z83: 3.7 | AA83: 29 | AB83: 1.e-002 | AC83: 1.8e-003 | AD83: -4.0500000000000001e-002 | AE83: -4.3400000000000001e-002 | AF83: 86.52 | AG83: 88.56 | AH83: 0.79 | AI83: A+ | AJ83: 7.4700000000000003e-002 | AK83: =I83+100*T83 -> 116.30000000000001 | AL83: 116.4 | AM83: 5 | AN83: 27.9 | AO83: 20 | AP83: 8.5000000000000006e-002 | AQ83: 62 | AR83: 今飞转债!
A84: 38 | B84: 宁建转债 | C84: 113036 | D84: 44049. | E84: 宁波建工 | F84: 601789 | G84: 建筑 | H84: 建筑工程 | I84: 110.91 | J84: -1.1999999999999999e-003 | K84: 6.0999999999999995e-003 | L84: 4.63 | M84: 8.6999999999999994e-003 | N84: 2 | O84: 3.0000000000000001e-003 | P84: 117.3 | Q84: 4.86 | R84: 1.55 | S84: 95.27 | T84: 0.16399999999999998 | U84: 3月24天 | V84: 5.79年 | W84: 3.79年 | X84: 0.11900000000000001 | Y84: 0.114 | Z84: 5.4 | AA84: 45 | AB84: 9.8999999999999991e-003 | AC84: 4.5999999999999999e-003 | AD84: -1.67e-002 | AE84: -1.8500000000000003e-002 | AF84: 87.43 | AG84: 91.47 | AH84: 0.57 | AI84: AA | AJ84: 4.4699999999999997e-002 | AK84: =I84+100*T84 -> 127.31 | AL84: 126.6 | AM84: 79 | AN84: 35.1 | AO84: 86 | AP84: -3.2000000000000001e-002 | AQ84: 3 | AR84: 宁建转债
A85: 161 | B85: 万里转债! | C85: 123032 | D85: 43769. | E85: 万里马 | F85: 300591 | G85: 服装纺织 | H85: 服装纺织 | I85: 126.8 | J85: -1.23e-002 | K85: 3.2000000000000002e-003 | L85: 8.16 | M85: -1.21e-002 | N85: 63 | O85: 0.373 | P85: 132.8 | Q85: 6.89 | R85: 5.63 | S85: 118.43 | T85: 7.0999999999999994e-002 | U85: 转股中 | V85: 5年22天 | W85: 3年22天 | X85: 5.0999999999999997e-002 | Y85: 6.0999999999999999e-002 | Z85: 1.3 | AA85: 26 | AB85: 9.4999999999999998e-003 | AC85: -8.9999999999999998e-004 | AD85: -5.0000000000000003e-002 | AE85: -5.4199999999999998e-002 | AF85: 85.53 | AG85: 92.8 | AH85: 0.76 | AI85: A+ | AJ85: 7.6700000000000004e-002 | AK85: =I85+100*T85 -> 133.90000000000001 | AL85: 135.2 | AM85: 161 | AN85: 42.4 | AO85: 159 | AP85: 2.1000000000000001e-002 | AQ85: 43 | AR85: 万里转债!
A86: 104 | B86: 百达转债 | C86: 113570 | D86: 43929. | E86: 百达精工 | F86: 603331 | G86: 机械装备 | H86: 机械装备 | I86: 109.6 | J86: 1.1899999999999999e-002 | K86: -1.2999999999999999e-003 | L86: 11.53 | M86: 1.41e-002 | N86: 4.7 | O86: 1.4999999999999999e-002 | P86: 115.3 | Q86: 11.54 | R86: 1.88 | S86: 99.91 | T86: 9.6999999999999989e-002 | U86: 转股中 | V86: 5.47年 | W86: 3.47年 | X86: 0.13600000000000001 | Y86: 0.13600000000000001 | Z86: 2.8 | AA86: 21 | AB86: 9.4999999999999998e-003 | AC86: 4.4000000000000003e-003 | AD86: -1.4999999999999999e-002 | AE86: -1.6899999999999998e-002 | AF86: 79.54 | AG86: 77.59 | AH86: 0.75 | AI86: A+ | AJ86: 7.6700000000000004e-002 | AK86: =I86+100*T86 -> 119.3 | AL86: 119.3 | AM86: 19 | AN86: 39.7 | AO86: 137 | AP86: -1.3000000000000001e-002 | AQ86: 31 | AR86: 百达转债
A87: 188 | B87: 明泰转债! | C87: 113025 | D87: 43592. | E87: 明泰铝业 | F87: 601677 | G87: 有色金属 | H87: 铝金属 | I87: 110.6 | J87: 1.1999999999999999e-003 | K87: 9.3999999999999986e-003 | L87: 10.69 | M87: 2.e-002 | N87: 10 | O87: 5.0000000000000001e-003 | P87: 115.1 | Q87: 11.2 | R87: 0.93 | S87: 95.45 | T87: 0.159 | U87: 转股中 | V87: 4.56年 | W87: 2.56年 | X87: 0.27899999999999997 | Y87: 0.26700000000000002 | Z87: 18 | AA87: 66 | AB87: 9.0000000000000011e-003 | AC87: 3.0000000000000001e-003 | AD87: -2.4500000000000001e-002 | AE87: -2.69e-002 | AF87: 92.41 | AG87: 95.5 | AH87: 0.53 | AI87: AA | AJ87: 4.2699999999999995e-002 | AK87: =I87+100*T87 -> 126.5 | AL87: 125.8 | AM87: 74 | AN87: 30.3 | AO87: 36 | AP87: -1.9e-002 | AQ87: 31 | AR87: 明泰转债!
A88: 147 | B88: 白电转债 | C88: 113549 | D88: 43810. | E88: 白云电器 | F88: 603861 | G88: 能源电力 | H88: 电力设备 | I88: 110.04 | J88: 3.2000000000000002e-003 | K88: 1.01e-002 | L88: 8.79 | M88: 2.2099999999999998e-002 | N88: 2.4 | O88: 2.e-003 | P88: 115.1 | Q88: 8.88 | R88: 1.72 | S88: 98.99 | T88: 0.11199999999999999 | U88: 转股中 | V88: 5年57天 | W88: 3年57天 | X88: 0.22699999999999998 | Y88: 0.22399999999999998 | Z88: 8.8 | AA88: 39 | AB88: 8.8999999999999999e-003 | AC88: 3.5999999999999999e-003 | AD88: -1.8200000000000001e-002 | AE88: -2.0199999999999999e-002 | AF88: 89.72 | AG88: 92.27 | AH88: 0.6 | AI88: AA | AJ88: 4.4699999999999997e-002 | AK88: =I88+100*T88 -> 121.24000000000001 | AL88: 121.1 | AM88: 37 | AN88: 28.8 | AO88: 23 | AP88: -1.1000000000000001e-002 | AQ88: 32 | AR88: 白电转债
A89: 56 | B89: 思特转债 | C89: 123054 | D89: 44018. | E89: 思特奇 | F89: 300608 | G89: 通信互联 | H89: 通信设备 | I89: 116.05 | J89: 5.6000000000000008e-003 | K89: -1.9e-003 | L89: 18.37 | M89: 4.8999999999999998e-003 | N89: 7.8 | O89: 2.5000000000000001e-002 | P89: 121.7 | Q89: 16.49 | R89: 3.74 | S89: 111.4 | T89: 4.2000000000000003e-002 | U89: 2月28天 | V89: 5.72年 | W89: 3.72年 | X89: 9.4e-002 | Y89: 0.10400000000000001 | Z89: 2.7 | AA89: 29 | AB89: 8.5000000000000006e-003 | AC89: 2.e-003 | AD89: -2.6600000000000002e-002 | AE89: -2.8799999999999999e-002 | AF89: 81.92 | AG89: 85.27 | AH89: 0.77 | AI89: AA- | AJ89: 6.5700000000000008e-002 | AK89: =I89+100*T89 -> 120.25 | AL89: 120.7 | AM89: 34 | AN89: 35.4 | AO89: 91 | AP89: 1.e-002 | AQ89: 9 | AR89: 思特转债
A90: 155 | B90: 北方转债 | C90: 127014 | D90: 43790. | E90: 北方国际 | F90: 65 | G90: 建筑 | H90: 建筑工程 | I90: 111.1 | J90: 3.0000000000000001e-003 | K90: 4.8999999999999998e-003 | L90: 7.74 | M90: 1.7100000000000001e-002 | N90: 0.1 | O90: 0. | P90: 115.6 | Q90: 8.75 | R90: 1.2 | S90: 88.46 | T90: 0.25600000000000001 | U90: 转股中 | V90: 5年35天 | W90: 3年35天 | X90: 9.6999999999999989e-002 | Y90: 8.5999999999999993e-002 | Z90: 5.8 | AA90: 60 | AB90: 8.0000000000000002e-003 | AC90: 2.5000000000000001e-003 | AD90: -2.e-002 | AE90: -2.2400000000000003e-002 | AF90: 91 | AG90: 93.89 | AH90: 0.46 | AI90: AA+ | AJ90: 4.2699999999999995e-002 | AK90: =I90+100*T90 -> 136.69999999999999 | AL90: 133.7 | AM90: 150 | AN90: 39.9 | AO90: 139 | AP90: -2.1000000000000001e-002 | AQ90: 17 | AR90: 北方转债
A91: 1 | B91: N景兴转 | C91: 128130 | D91: 今日上市 | E91: 景兴纸业 | F91: 2067 | G91: 造纸包装 | H91: 包装用纸 | I91: 109.86 | J91: 9.8599999999999993e-002 | K91: 0. | L91: 3.69 | M91: -1.0700000000000001e-002 | N91: 1579. | O91: 1.1299999999999999 | P91: 115.1 | Q91: 3.4 | R91: 0.93 | S91: 108.53 | T91: 1.2e-002 | U91: 5月16天 | V91: 5.95年 | W91: 3.95年 | X91: 0.312 | Y91: 0.33899999999999997 | Z91: 13 | AA91: 41 | AB91: 8.0000000000000002e-003 | AC91: 3.4000000000000002e-003 | AD91: -1.43e-002 | AE91: -1.5900000000000001e-002 | AF91: 86.66 | AG91: 89.13 | AH91: 0.69 | AI91: AA | AJ91: 4.4699999999999997e-002 | AK91: =I91+100*T91 -> 111.06 | AL91: 111.2 | AM91: 1 | AN91: 22.1 | AO91: 8 | AP91: 3.5000000000000003e-002 | AQ91: 2 | AR91: N景兴转
A92: 11 | B92: 嘉友转债 | C92: 113599 | D92: 44081. | E92: 嘉友国际 | F92: 603871 | G92: 交通运输 | H92: 物流业 | I92: 120.48 | J92: 4.3e-003 | K92: -3.7000000000000002e-003 | L92: 30.7 | M92: 7.000000000000001e-004 | N92: 62 | O92: 7.2000000000000008e-002 | P92: 126 | Q92: 24.82 | R92: 3.62 | S92: 123.69 | T92: -2.6000000000000002e-002 | U92: 5月2天 | V92: 5.88年 | W92: 3.88年 | X92: 0.107 | Y92: 0.13200000000000001 | Z92: 7.2 | AA92: 67 | AB92: 7.8000000000000005e-003 | AC92: 5.0000000000000001e-004 | AD92: -3.6200000000000003e-002 | AE92: -3.7999999999999999e-002 | AF92: 80.54 | AG92: 87.29 | AH92: 0.82 | AI92: AA- | AJ92: 6.5700000000000008e-002 | AK92: =I92+100*T92 -> 117.88000000000001 | AL92: 117.3 | AM92: 8 | AN92: 30 | AO92: 33 | AP92: -1.9e-002 | AQ92: 5 | AR92: 嘉友转债
A93: 7 | B93: 广汇转债 | C93: 110072 | D93: 44089. | E93: 广汇汽车 | F93: 600297 | G93: 汽车 | H93: 分销、售 | I93: 109.59 | J93: 2.3300000000000001e-002 | K93: -1.7100000000000001e-002 | L93: 4.04 | M93: 1.e-002 | N93: 448 | O93: 0.122 | P93: 114.5 | Q93: 4.03 | R93: 0.85 | S93: 100.25 | T93: 9.3000000000000013e-002 | U93: 5月8天 | V93: 5.91年 | W93: 3.91年 | X93: 0.10300000000000001 | Y93: 0.10300000000000001 | Z93: 34 | AA93: 328 | AB93: 7.4999999999999997e-003 | AC93: 3.0999999999999999e-003 | AD93: -1.52e-002 | AE93: -1.66e-002 | AF93: 86.93 | AG93: 89.73 | AH93: 0.63 | AI93: AA+ | AJ93: 4.2699999999999995e-002 | AK93: =I93+100*T93 -> 118.89 | AL93: 118.9 | AM93: 16 | AN93: 29.2 | AO93: 26 | AP93: 5.4000000000000006e-002 | AQ93: 10 | AR93: 广汇转债
A94: 199 | B94: 岱勒转债! | C94: 123024 | D94: 43572. | E94: 岱勒新材 | F94: 300700 | G94: 机械装备 | H94: 专用设备 | I94: 110.252 | J94: 8.0000000000000004e-004 | K94: -5.1000000000000004e-003 | L94: 22.82 | M94: -7.8000000000000005e-003 | N94: 11 | O94: 4.5999999999999999e-002 | P94: 113 | Q94: 24.9 | R94: 3.83 | S94: 91.65 | T94: 0.20300000000000001 | U94: 转股中 | V94: 3.50年 | W94: 1.50年 | X94: 0.11199999999999999 | Y94: 0.10199999999999999 | Z94: 2.1 | AA94: 19 | AB94: 7.0999999999999995e-003 | AC94: 4.0000000000000002e-004 | AD94: -4.7199999999999999e-002 | AE94: -4.9100000000000005e-002 | AF94: 90.28 | AG94: 88.09 | AH94: 0.54 | AI94: A+ | AJ94: 7.4700000000000003e-002 | AK94: =I94+100*T94 -> 130.55199999999999 | AL94: 128.9 | AM94: 104 | AN94: 38.6 | AO94: 119 | AP94: 7.2999999999999995e-002 | AQ94: 32 | AR94: 岱勒转债!
A95: 129 | B95: 东风转债 | C95: 113030 | D95: 43850. | E95: 东风股份 | F95: 601515 | G95: 造纸包装 | H95: 包装材料 | I95: 113.29 | J95: 2.0000000000000001e-004 | K95: 4.0000000000000001e-003 | L95: 6.36 | M95: 7.9000000000000008e-003 | N95: 7.7 | O95: 2.3e-002 | P95: 117.3 | Q95: 6.75 | R95: 2.09 | S95: 94.22 | T95: 0.20199999999999999 | U95: 转股中 | V95: 5.26年 | W95: 3.26年 | X95: 3.5000000000000003e-002 | Y95: 3.3000000000000002e-002 | Z95: 3 | AA95: 85 | AB95: 6.8000000000000005e-003 | AC95: 8.9999999999999998e-004 | AD95: -2.5499999999999998e-002 | AE95: -2.75e-002 | AF95: 89.5 | AG95: 93.62 | AH95: 0.53 | AI95: AA | AJ95: 4.4699999999999997e-002 | AK95: =I95+100*T95 -> 133.49000000000001 | AL95: 132.4 | AM95: 143 | AN95: 38.7 | AO95: 124 | AP95: -4.0999999999999995e-002 | AQ95: 14 | AR95: 东风转债
A96: 32 | B96: 银信转债 | C96: 123059 | D96: 44055. | E96: 银信科技 | F96: 300231 | G96: 计算机及 | H96: 软件开发 | I96: 119.55 | J96: 4.5999999999999999e-003 | K96: -1.9e-003 | L96: 11.03 | M96: 3.5999999999999999e-003 | N96: 4.8 | O96: 1.e-002 | P96: 124.1 | Q96: 9.91 | R96: 3.85 | S96: 111.3 | T96: 7.400000000000001e-002 | U96: 4月4天 | V96: 5.82年 | W96: 3.82年 | X96: 8.0000000000000002e-002 | Y96: 8.900000000000001e-002 | Z96: 3.9 | AA96: 49 | AB96: 6.6e-003 | AC96: -4.0000000000000002e-004 | AD96: -3.4599999999999999e-002 | AE96: -3.6400000000000002e-002 | AF96: 80.92 | AG96: 86.32 | AH96: 0.74 | AI96: AA- | AJ96: 6.5700000000000008e-002 | AK96: =I96+100*T96 -> 126.95 | AL96: 127.8 | AM96: 94 | AN96: 41.5 | AO96: 154 | AP96: -1.e-002 | AQ96: 7 | AR96: 银信转债
A97: 89 | B97: 利群转债! | C97: 113033 | D97: 43942. | E97: 利群股份 | F97: 601366 | G97: 商业零售 | H97: 商场 | I97: 111.31 | J97: 1.47e-002 | K97: -1.29e-002 | L97: 6.82 | M97: 2.8999999999999998e-003 | N97: 20 | O97: 1.e-002 | P97: 115.3 | Q97: 7.01 | R97: 1.33 | S97: 97.29 | T97: 0.14400000000000002 | U97: 19天 | V97: 5.53年 | W97: 3.53年 | X97: 0.307 | Y97: 0.29799999999999999 | Z97: 18 | AA97: 59 | AB97: 6.5000000000000006e-003 | AC97: 1.5e-003 | AD97: -1.89e-002 | AE97: -2.0799999999999999e-002 | AF97: 88.44 | AG97: 90.96 | AH97: 0.59 | AI97: AA | AJ97: 4.4699999999999997e-002 | AK97: =I97+100*T97 -> 125.71000000000001 | AL97: 125.3 | AM97: 69 | AN97: 34.4 | AO97: 74 | AP97: -4.4999999999999998e-002 | AQ97: 35 | AR97: 利群转债!
A98: 198 | B98: 招路转债! | C98: 127012 | D98: 43585. | E98: 招商公路 | F98: 1965 | G98: 机场高速 | H98: 高速 | I98: 105.2 | J98: 1.9e-003 | K98: 4.0000000000000002e-004 | L98: 6.99 | M98: 7.1999999999999998e-003 | N98: 3 | O98: 1.e-003 | P98: 108.2 | Q98: 8.81 | R98: 0.91 | S98: 79.34 | T98: 0.32600000000000001 | U98: 转股中 | V98: 4.50年 | W98: 2.50年 | X98: 0.11599999999999999 | Y98: 9.1999999999999998e-002 | Z98: 50 | AA98: 432 | AB98: 6.3e-003 | AC98: 2.8999999999999998e-003 | AD98: -1.1699999999999999e-002 | AE98: -1.32e-002 | AF98: 92.41 | AG98: 91.78 | AH98: 0.32 | AI98: AAA | AJ98: 3.7699999999999997e-002 | AK98: =I98+100*T98 -> 137.80000000000001 | AL98: 131.1 | AM98: 130 | AN98: 38.7 | AO98: 121 | AP98: -8.0000000000000002e-003 | AQ98: 36 | AR98: 招路转债!
A99: 191 | B99: 司尔转债! | C99: 128064 | D99: 43592. | E99: 司尔特 | F99: 2538 | G99: 化工 | H99: 农化 | I99: 111.8 | J99: 1.2699999999999999e-002 | K99: 3.4999999999999996e-003 | L99: 6.26 | M99: 2.6200000000000001e-002 | N99: 4.6 | O99: 5.0000000000000001e-003 | P99: 114.9 | Q99: 6.07 | R99: 1.2 | S99: 103.13 | T99: 8.4000000000000005e-002 | U99: 转股中 | V99: 4.55年 | W99: 2.55年 | X99: 0.17800000000000002 | Y99: 0.184 | Z99: 8 | AA99: 45 | AB99: 6.0999999999999995e-003 | AC99: 2.0000000000000001e-004 | AD99: -2.86e-002 | AE99: -3.0899999999999997e-002 | AF99: 92.4 | AG99: 95.35 | AH99: 0.62 | AI99: AA | AJ99: 4.2699999999999995e-002 | AK99: =I99+100*T99 -> 120.2 | AL99: 120.5 | AM99: 29 | AN99: 25.1 | AO99: 12 | AP99: -6.6000000000000003e-002 | AQ99: 56 | AR99: 司尔转债!
A100: 270 | B100: 特一转债! | C100: 128025 | D100: 43097. | E100: 特一药业 | F100: 2728 | G100: 医药 | H100: 化学制药 | I100: 107.996 | J100: 2.8999999999999998e-003 | K100: 3.4000000000000002e-003 | L100: 14.05 | M100: 1.0800000000000001e-002 | N100: 2.2 | O100: 6.9999999999999993e-003 | P100: 109.8 | Q100: 14.7 | R100: 2.83 | S100: 95.58 | T100: 0.13 | U100: 转股中 | V100: 3.21年 | W100: 1.21年 | X100: 0.105 | Y100: 0.10000000000000001 | Z100: 3 | AA100: 29 | AB100: 5.3e-003 | AC100: -5.0000000000000001e-004 | AD100: -3.7100000000000001e-002 | AE100: -4.0599999999999997e-002 | AF100: 94.25 | AG100: 90.42 | AH100: 0.58 | AI100: AA- | AJ100: 6.3700000000000007e-002 | AK100: =I100+100*T100 -> 120.996 | AL100: 120.4 | AM100: 28 | AN100: 26.2 | AO100: 14 | AP100: -1.1000000000000001e-002 | AQ100: 43 | AR100: 特一转债!
A101: 183 | B101: 亚泰转债! | C101: 128066 | D101: 43599. | E101: 郑中设计 | F101: 2811 | G101: 建筑 | H101: 装饰工程 | I101: 114.8 | J101: 1.6799999999999999e-002 | K101: -2.3999999999999998e-003 | L101: 10.45 | M101: 1.95e-002 | N101: 2.8 | O101: 5.0000000000000001e-003 | P101: 117.5 | Q101: 9.67 | R101: 1.93 | S101: 108.07 | T101: 6.2e-002 | U101: 转股中 | V101: 4.58年 | W101: 2.58年 | X101: 0.17000000000000001 | Y101: 0.184 | Z101: 4.8 | AA101: 28 | AB101: 5.1999999999999998e-003 | AC101: -1.6000000000000001e-003 | AD101: -3.6400000000000002e-002 | AE101: -3.8900000000000004e-002 | AF101: 87.84 | AG101: 89.16 | AH101: 0.74 | AI101: AA- | AJ101: 6.3700000000000007e-002 | AK101: =I101+100*T101 -> 121. | AL101: 121.5 | AM101: 39 | AN101: 32.4 | AO101: 52 | AP101: -1.6e-002 | AQ101: 59 | AR101: 亚泰转债!
A102: 245 | B102: 湖广转债! | C102: 127007 | D102: 43313. | E102: 湖北广电 | F102: 665 | G102: 传媒娱乐 | H102: 影视娱乐 | I102: 110.201 | J102: -2.7000000000000001e-003 | K102: 9.1999999999999998e-003 | L102: 5.23 | M102: 1.3600000000000001e-002 | N102: 2.2 | O102: 2.e-003 | P102: 112.3 | Q102: 5.58 | R102: 0.78 | S102: 93.73 | T102: 0.17600000000000002 | U102: 转股中 | V102: 3.77年 | W102: 1.77年 | X102: 0.23699999999999999 | Y102: 0.222 | Z102: 12 | AA102: 51 | AB102: 5.1000000000000004e-003 | AC102: -8.9999999999999998e-004 | AD102: -3.5400000000000001e-002 | AE102: -3.8100000000000002e-002 | AF102: 95.2 | AG102: 96.88 | AH102: 0.48 | AI102: AA+ | AJ102: 4.07e-002 | AK102: =I102+100*T102 -> 127.80099999999999 | AL102: 126.7 | AM102: 82 | AN102: 29.8 | AO102: 31 | AP102: -3.5000000000000003e-002 | AQ102: 18 | AR102: 湖广转债!
A103: 189 | B103: 鼎胜转债! | C103: 113534 | D103: 43585. | E103: 鼎胜新材 | F103: 603876 | G103: 有色金属 | H103: 小金属 | I103: 112.38 | J103: 1.2999999999999999e-003 | K103: 2.3900000000000001e-002 | L103: 14.5 | M103: 4.7699999999999992e-002 | N103: 8 | O103: 6.0000000000000001e-003 | P103: 114.9 | Q103: 15.18 | R103: 1.75 | S103: 95.52 | T103: 0.17699999999999999 | U103: 转股中 | V103: 4.55年 | W103: 2.55年 | X103: 0.191 | Y103: 0.182 | Z103: 12 | AA103: 63 | AB103: 5.0000000000000001e-003 | AC103: -8.9999999999999998e-004 | AD103: -3.04e-002 | AE103: -3.27e-002 | AF103: 92.39 | AG103: 95.34 | AH103: 0.53 | AI103: AA | AJ103: 4.2699999999999995e-002 | AK103: =I103+100*T103 -> 130.07999999999998 | AL103: 129.2 | AM103: 109 | AN103: 33.9 | AO103: 70 | AP103: -1.2e-002 | AQ103: 31 | AR103: 鼎胜转债!
A104: 2 | B104: N青农转 | C104: 128129 | D104: 今日上市 | E104: 青农商行 | F104: 2958 | G104: 金融 | H104: 银行行业 | I104: 109.07 | J104: 9.0700000000000003e-002 | K104: 0. | L104: 5.47 | M104: 3.6000000000000004e-002 | N104: 4617. | O104: 0.85499999999999998 | P104: 112.2 | Q104: 5.74 | R104: 1.21 | S104: 95.3 | T104: 0.14499999999999999 | U104: 5月13天 | V104: 5.93年 | W104: 无权 | X104: 0.16500000000000001 | Y104: 0.157 | Z104: 50 | AA104: 304 | AB104: 4.7999999999999996e-003 | AC104: 1.1000000000000001e-003 | AD104: 无权 | AE104: 无权 | AF104: 无权 | AG104: 89.35 | AH104: 0.57 | AI104: AAA | AJ104: 3.9699999999999999e-002 | AK104: =I104+100*T104 -> 123.56999999999999 | AL104: 122.8 | AM104: 54 | AN104: 33.5 | AO104: 63 | AP104: 2.8999999999999998e-002 | AQ104: 7 | AR104: N青农转
A105: 120 | B105: 银河转债! | C105: 123042 | D105: 43875. | E105: 金银河 | F105: 300619 | G105: 机械装备 | H105: 专用设备 | I105: 113.169 | J105: 2.3999999999999998e-003 | K105: 1.3000000000000001e-002 | L105: 24.62 | M105: 2.07e-002 | N105: 4.3 | O105: 2.3e-002 | P105: 115.9 | Q105: 24.4 | R105: 3.88 | S105: 100.9 | T105: 0.122 | U105: 转股中 | V105: 5.32年 | W105: 3.32年 | X105: 9.0999999999999998e-002 | Y105: 9.1999999999999998e-002 | Z105: 1.7 | AA105: 18 | AB105: 4.5999999999999999e-003 | AC105: -8.0000000000000004e-004 | AD105: -2.3599999999999999e-002 | AE105: -2.5899999999999999e-002 | AF105: 80.85 | AG105: 78.99 | AH105: 0.74 | AI105: A+ | AJ105: 7.6700000000000004e-002 | AK105: =I105+100*T105 -> 125.369 | AL105: 125.4 | AM105: 71 | AN105: 44.6 | AO105: 173 | AP105: 6.5000000000000002e-002 | AQ105: 24 | AR105: 银河转债!
A106: 55 | B106: 中矿转债 | C106: 128111 | D106: 44019. | E106: 中矿资源 | F106: 2738 | G106: 有色金属 | H106: 有色行业 | I106: 121.515 | J106: 1.1899999999999999e-002 | K106: -5.6999999999999993e-003 | L106: 17.47 | M106: 8.1000000000000013e-003 | N106: 7.4 | O106: 8.0000000000000002e-003 | P106: 124.7 | Q106: 15.53 | R106: 1.79 | S106: 112.49 | T106: 8.0000000000000002e-002 | U106: 2月29天 | V106: 5.73年 | W106: 3.73年 | X106: 0.16500000000000001 | Y106: 0.185 | Z106: 8 | AA106: 49 | AB106: 4.5999999999999999e-003 | AC106: -2.5999999999999999e-003 | AD106: -3.8100000000000002e-002 | AE106: -4.0300000000000002e-002 | AF106: 81.9 | AG106: 87.33 | AH106: 0.77 | AI106: AA- | AJ106: 6.5700000000000008e-002 | AK106: =I106+100*T106 -> 129.51499999999999 | AL106: 130.5 | AM106: 124 | AN106: 43.2 | AO106: 163 | AP106: 8.5000000000000006e-002 | AQ106: 5 | AR106: 中矿转债
A107: 61 | B107: 飞鹿转债 | C107: 123052 | D107: 44015. | E107: 飞鹿股份 | F107: 300665 | G107: 化工 | H107: 化工 | I107: 124.181 | J107: -1.6e-002 | K107: -8.5000000000000006e-003 | L107: 12.78 | M107: -2.8900000000000002e-002 | N107: 37 | O107: 0.16500000000000001 | P107: 127.3 | Q107: 9.9 | R107: 3.4 | S107: 129.09 | T107: -3.7999999999999999e-002 | U107: 2月23天 | V107: 5.71年 | W107: 3.71年 | X107: 0.114 | Y107: 0.14699999999999999 | Z107: 1.8 | AA107: 16 | AB107: 4.5000000000000005e-003 | AC107: -3.4000000000000002e-003 | AD107: -4.2300000000000004e-002 | AE107: -4.4699999999999997e-002 | AF107: 79.31 | AG107: 84.37 | AH107: 0.85 | AI107: A+ | AJ107: 7.6700000000000004e-002 | AK107: =I107+100*T107 -> 120.381 | AL107: 119.3 | AM107: 18 | AN107: 34.9 | AO107: 84 | AP107: 8.5000000000000006e-002 | AQ107: 8 | AR107: 飞鹿转债
A108: 36 | B108: 湖盐转债 | C108: 110071 | D108: 44043. | E108: 湖南盐业 | F108: 600929 | G108: 食品饮料 | H108: 食品饮料 | I108: 112.26 | J108: 4.6999999999999993e-003 | K108: 1.8799999999999997e-002 | L108: 6.85 | M108: 3.4700000000000002e-002 | N108: 4.9 | O108: 6.0000000000000001e-003 | P108: 115.2 | Q108: 6.6 | R108: 2.49 | S108: 103.79 | T108: 8.199999999999999e-002 | U108: 4月1天 | V108: 5.81年 | W108: 3.81年 | X108: 0.115 | Y108: 0.11900000000000001 | Z108: 7.2 | AA108: 63 | AB108: 4.5000000000000005e-003 | AC108: -2.0000000000000001e-004 | AD108: -1.9900000000000001e-002 | AE108: -2.1700000000000001e-002 | AF108: 87.29 | AG108: 89.78 | AH108: 0.68 | AI108: AA | AJ108: 4.4699999999999997e-002 | AK108: =I108+100*T108 -> 120.46000000000001 | AL108: 120.7 | AM108: 35 | AN108: 31 | AO108: 38 | AP108: -1.2e-002 | AQ108: 8 | AR108: 湖盐转债
A109: 141 | B109: 新北转债! | C109: 128083 | D109: 43830. | E109: 新北洋 | F109: 2376 | G109: 电子 | H109: 电子产品 | I109: 112.7 | J109: -2.7000000000000001e-003 | K109: 5.4000000000000003e-003 | L109: 10.13 | M109: 6.0000000000000001e-003 | N109: 4.8 | O109: 5.0000000000000001e-003 | P109: 115.2 | Q109: 11.7 | R109: 2.03 | S109: 86.58 | T109: 0.30199999999999999 | U109: 转股中 | V109: 5.23年 | W109: 3.23年 | X109: 0.13 | Y109: 0.113 | Z109: 8.8 | AA109: 67 | AB109: 4.3e-003 | AC109: -8.9999999999999998e-004 | AD109: -2.4399999999999998e-002 | AE109: -2.6499999999999999e-002 | AF109: 89.53 | AG109: 92.07 | AH109: 0.45 | AI109: AA | AJ109: 4.4699999999999997e-002 | AK109: =I109+100*T109 -> 142.90000000000001 | AL109: 138.8 | AM109: 195 | AN109: 46.7 | AO109: 188 | AP109: -3.7999999999999999e-002 | AQ109: 17 | AR109: 新北转债!
A110: 140 | B110: 鹰19转债 | C110: 110063 | D110: 43833. | E110: 山鹰纸业 | F110: 600567 | G110: 造纸包装 | H110: 包装用纸 | I110: 113.8 | J110: -4.8999999999999998e-003 | K110: 1.01e-002 | L110: 3.18 | M110: 9.4999999999999998e-003 | N110: 17 | O110: 8.0000000000000002e-003 | P110: 116.2 | Q110: 3.3 | R110: 1.03 | S110: 96.36 | T110: 0.18100000000000002 | U110: 转股中 | V110: 5.23年 | W110: 3.23年 | X110: 0.127 | Y110: 0.12300000000000001 | Z110: 19 | AA110: 146 | AB110: 4.0999999999999995e-003 | AC110: -1.4000000000000002e-003 | AD110: -2.7699999999999999e-002 | AE110: -2.9600000000000001e-002 | AF110: 89.94 | AG110: 93.75 | AH110: 0.55 | AI110: AA+ | AJ110: 4.2699999999999995e-002 | AK110: =I110+100*T110 -> 131.90000000000001 | AL110: 131.2 | AM110: 132 | AN110: 37.5 | AO110: 108 | AP110: -1.2e-002 | AQ110: 41 | AR110: 鹰19转债
A111: 18 | B111: 城地转债 | C111: 113596 | D111: 44063. | E111: 城地股份 | F111: 603887 | G111: 通信互联 | H111: 通信设备 | I111: 111.01 | J111: 9.3999999999999986e-003 | K111: 1.06e-002 | L111: 25.55 | M111: 3.27e-002 | N111: 8.2 | O111: 6.0000000000000001e-003 | P111: 113.5 | Q111: 29.21 | R111: 2.75 | S111: 87.47 | T111: 0.26899999999999996 | U111: 4月18天 | V111: 5.86年 | W111: 3.86年 | X111: 0.125 | Y111: 0.109 | Z111: 12 | AA111: 96 | AB111: 3.9000000000000003e-003 | AC111: -2.9999999999999997e-004 | AD111: -1.66e-002 | AE111: -1.84e-002 | AF111: 80.58 | AG111: 78.78 | AH111: 0.61 | AI111: AA- | AJ111: 6.5700000000000008e-002 | AK111: =I111+100*T111 -> 137.91 | AL111: 134.5 | AM111: 158 | AN111: 54 | AO111: 224 | AP111: -5.4000000000000006e-002 | AQ111: 7 | AR111: 城地转债
A112: 201 | B112: 亨通转债! | C112: 110056 | D112: 43571. | E112: 亨通光电 | F112: 600487 | G112: 通信互联 | H112: 通信设备 | I112: 112.94 | J112: 2.5999999999999999e-003 | K112: 1.4000000000000002e-003 | L112: 15.22 | M112: 7.3000000000000001e-003 | N112: 4.3 | O112: 2.e-003 | P112: 114.8 | Q112: 15.58 | R112: 2.04 | S112: 97.69 | T112: 0.156 | U112: 转股中 | V112: 4.50年 | W112: 2.50年 | X112: 5.7999999999999996e-002 | Y112: 5.5999999999999994e-002 | Z112: 17 | AA112: 297 | AB112: 3.7000000000000002e-003 | AC112: -2.2000000000000001e-003 | AD112: -3.32e-002 | AE112: -3.5499999999999997e-002 | AF112: 92.98 | AG112: 96.28 | AH112: 0.54 | AI112: AA+ | AJ112: 4.07e-002 | AK112: =I112+100*T112 -> 128.53999999999999 | AL112: 128.2 | AM112: 97 | AN112: 31.9 | AO112: 48 | AP112: -4.0999999999999995e-002 | AQ112: 29 | AR112: 亨通转债!
A113: 43 | B113: 瑞达转债 | C113: 128116 | D113: 44036. | E113: 瑞达期货 | F113: 2961 | G113: 金融 | H113: 期货行业 | I113: 112.9 | J113: 1.44e-002 | K113: 7.8000000000000005e-003 | L113: 30.15 | M113: 3.5000000000000003e-002 | N113: 4.1 | O113: 6.0000000000000001e-003 | P113: 115.3 | Q113: 29.82 | R113: 7.89 | S113: 101.11 | T113: 0.11699999999999999 | U113: 3月17天 | V113: 5.78年 | W113: 3.78年 | X113: 4.8000000000000001e-002 | Y113: 4.9000000000000002e-002 | Z113: 6.5 | AA113: 134 | AB113: 3.7000000000000002e-003 | AC113: -1.e-003 | AD113: -2.1499999999999998e-002 | AE113: -2.3199999999999998e-002 | AF113: 87.43 | AG113: 89.99 | AH113: 0.63 | AI113: AA | AJ113: 4.4699999999999997e-002 | AK113: =I113+100*T113 -> 124.60000000000001 | AL113: 124.7 | AM113: 65 | AN113: 34.7 | AO113: 82 | AP113: 4.0999999999999995e-002 | AQ113: 7 | AR113: 瑞达转债
A114: 33 | B114: 国城转债 | C114: 127019 | D114: 44053. | E114: 国城矿业 | F114: 688 | G114: 有色金属 | H114: 锌铅镍锡 | I114: 112.799 | J114: 4.4000000000000003e-003 | K114: -7.4999999999999997e-003 | L114: 23.05 | M114: -4.3e-003 | N114: 12 | O114: 1.3000000000000001e-002 | P114: 115.1 | Q114: 21.07 | R114: 11.97 | S114: 109.4 | T114: 3.1e-002 | U114: 4月4天 | V114: 5.82年 | W114: 3.82年 | X114: 3.2000000000000001e-002 | Y114: 3.5000000000000003e-002 | Z114: 8.5 | AA114: 262 | AB114: 3.4999999999999996e-003 | AC114: -1.1000000000000001e-003 | AD114: -2.1299999999999999e-002 | AE114: -2.3e-002 | AF114: 87.15 | AG114: 89.64 | AH114: 0.71 | AI114: AA | AJ114: 4.4699999999999997e-002 | AK114: =I114+100*T114 -> 115.899 | AL114: 116.2 | AM114: 4 | AN114: 26.6 | AO114: 16 | AP114: 2.3e-002 | AQ114: 15 | AR114: 国城转债
A115: 24 | B115: 航新转债 | C115: 123061 | D115: 44061. | E115: 航新科技 | F115: 300424 | G115: 航空航天 | H115: 航空航天 | I115: 122.422 | J115: 1.e-004 | K115: 9.8999999999999991e-003 | L115: 17.25 | M115: 1.29e-002 | N115: 8.7 | O115: 2.7999999999999997e-002 | P115: 124.8 | Q115: 14.86 | R115: 3.85 | S115: 116.08 | T115: 5.5e-002 | U115: 4月11天 | V115: 5.84年 | W115: 3.84年 | X115: 5.9999999999999998e-002 | Y115: 7.0000000000000007e-002 | Z115: 2.5 | AA115: 41 | AB115: 3.4000000000000002e-003 | AC115: -3.7000000000000002e-003 | AD115: -3.8699999999999998e-002 | AE115: -4.0800000000000003e-002 | AF115: 81.41 | AG115: 86.8 | AH115: 0.78 | AI115: AA- | AJ115: 6.5700000000000008e-002 | AK115: =I115+100*T115 -> 127.922 | AL115: 128.8 | AM115: 102 | AN115: 42 | AO115: 157 | AP115: 6.0000000000000001e-003 | AQ115: 5 | AR115: 航新转债
A116: 107 | B116: 正元转债 | C116: 123043 | D116: 43921. | E116: 正元智慧 | F116: 300645 | G116: 计算机及 | H116: 软件开发 | I116: 119.818 | J116: 2.8000000000000004e-003 | K116: 5.1000000000000004e-003 | L116: 18.19 | M116: 9.3999999999999986e-003 | N116: 25 | O116: 0.121 | P116: 121.4 | Q116: 15.41 | R116: 3.79 | S116: 118.04 | T116: 1.4999999999999999e-002 | U116: 转股中 | V116: 5.46年 | W116: 3.46年 | X116: 7.5999999999999998e-002 | Y116: 8.9999999999999997e-002 | Z116: 1.8 | AA116: 23 | AB116: 2.5000000000000001e-003 | AC116: -4.1999999999999997e-003 | AD116: -3.73e-002 | AE116: -3.95e-002 | AF116: 80.27 | AG116: 81.9 | AH116: 0.84 | AI116: A+ | AJ116: 7.6700000000000004e-002 | AK116: =I116+100*T116 -> 121.318 | AL116: 121.6 | AM116: 40 | AN116: 39.7 | AO116: 136 | AP116: 9.1999999999999998e-002 | AQ116: 17 | AR116: 正元转债
A117: 96 | B117: 联创转债! | C117: 128101 | D117: 43934. | E117: 联创电子 | F117: 2036 | G117: 电子 | H117: 液晶显示 | I117: 113.57 | J117: 5.0000000000000001e-004 | K117: 5.1999999999999998e-003 | L117: 11.57 | M117: 1.49e-002 | N117: 0.8 | O117: 2.e-003 | P117: 115.1 | Q117: 14.48 | R117: 4.31 | S117: 79.9 | T117: 0.42100000000000004 | U117: 2.1天 | V117: 5.49年 | W117: 3.49年 | X117: 2.7999999999999997e-002 | Y117: 2.2000000000000002e-002 | Z117: 3 | AA117: 107 | AB117: 2.5000000000000001e-003 | AC117: -2.3999999999999998e-003 | AD117: -2.5000000000000001e-002 | AE117: -2.69e-002 | AF117: 88.42 | AG117: 90.94 | AH117: 0.39 | AI117: AA | AJ117: 4.4699999999999997e-002 | AK117: =I117+100*T117 -> 155.66999999999999 | AL117: 147.2 | AM117: 238 | AN117: 56.3 | AO117: 236 | AP117: -3.5000000000000003e-002 | AQ117: 14 | AR117: 联创转债!
A118: 92 | B118: 龙净转债! | C118: 110068 | D118: 43936. | E118: 龙净环保 | F118: 600388 | G118: 城市公用 | H118: 三废处理 | I118: 113.49 | J118: -5.9999999999999995e-004 | K118: 1.8000000000000002e-002 | L118: 10.27 | M118: 3.1099999999999999e-002 | N118: 3.5 | O118: 2.e-003 | P118: 115 | Q118: 10.73 | R118: 2.03 | S118: 95.71 | T118: 0.18600000000000003 | U118: 11天 | V118: 5.51年 | W118: 3.51年 | X118: 0.182 | Y118: 0.17399999999999999 | Z118: 20 | AA118: 110 | AB118: 2.3999999999999998e-003 | AC118: -2.3999999999999998e-003 | AD118: -2.4900000000000002e-002 | AE118: -2.6699999999999998e-002 | AF118: 88.86 | AG118: 91.71 | AH118: 0.56 | AI118: AA+ | AJ118: 4.2699999999999995e-002 | AK118: =I118+100*T118 -> 132.09 | AL118: 131.3 | AM118: 133 | AN118: 39.6 | AO118: 135 | AP118: -2.8999999999999998e-002 | AQ118: 29 | AR118: 龙净转债!
A119: 165 | B119: 哈尔转债! | C119: 128073 | D119: 43719. | E119: 哈尔斯 | F119: 2615 | G119: 其他 | H119: 家居用品 | I119: 114.31 | J119: -1.29e-002 | K119: -1.5e-003 | L119: 5.9 | M119: -2.1600000000000001e-002 | N119: 31 | O119: 8.9999999999999997e-002 | P119: 115.3 | Q119: 5.72 | R119: 3.13 | S119: 103.15 | T119: 0.10800000000000001 | U119: 转股中 | V119: 3.92年 | W119: 1.92年 | X119: 0.12300000000000001 | Y119: 0.127 | Z119: 3 | AA119: 24 | AB119: 2.2000000000000001e-003 | AC119: -4.6999999999999993e-003 | AD119: -5.3099999999999994e-002 | AE119: -5.4900000000000004e-002 | AF119: 89.75 | AG119: 90.78 | AH119: 0.67 | AI119: AA- | AJ119: 6.3700000000000007e-002 | AK119: =I119+100*T119 -> 125.11 | AL119: 125.5 | AM119: 72 | AN119: 34.7 | AO119: 79 | AP119: -7.400000000000001e-002 | AQ119: 38 | AR119: 哈尔转债!
A120: 28 | B120: 中金转债 | C120: 127020 | D120: 44057. | E120: 中金岭南 | F120: 60 | G120: 有色金属 | H120: 有色行业 | I120: 112.87 | J120: 8.6e-003 | K120: 1.54e-002 | L120: 4.55 | M120: 4.1200000000000001e-002 | N120: 14 | O120: 3.0000000000000001e-003 | P120: 113.7 | Q120: 4.71 | R120: 1.47 | S120: 96.6 | T120: 0.16800000000000001 | U120: 4月8天 | V120: 5.83年 | W120: 3.83年 | X120: 0.23399999999999999 | Y120: 0.22600000000000001 | Z120: 38 | AA120: 162 | AB120: 1.2999999999999999e-003 | AC120: -2.8999999999999998e-003 | AD120: -2.4e-002 | AE120: -2.52e-002 | AF120: 86.75 | AG120: 89.36 | AH120: 0.58 | AI120: AA+ | AJ120: 4.2699999999999995e-002 | AK120: =I120+100*T120 -> 129.67000000000002 | AL120: 129.1 | AM120: 105 | AN120: 39.8 | AO120: 138 | AP120: 2.1000000000000001e-002 | AQ120: 10 | AR120: 中金转债
A121: 17 | B121: 科华转债! | C121: 128124 | D121: 44063. | E121: 科华生物 | F121: 2022 | G121: 医药 | H121: 生物制药 | I121: 109.456 | J121: 2.5000000000000001e-003 | K121: 6.9999999999999993e-003 | L121: 18 | M121: 1.9799999999999998e-002 | N121: 6.2 | O121: 8.0000000000000002e-003 | P121: 110.3 | Q121: 21.5 | R121: 3.62 | S121: 83.72 | T121: 0.307 | U121: 4月17天 | V121: 5.86年 | W121: 3.86年 | X121: 8.0000000000000002e-002 | Y121: 6.7000000000000004e-002 | Z121: 7.4 | AA121: 93 | AB121: 1.2999999999999999e-003 | AC121: -1.9e-003 | AD121: -1.4999999999999999e-002 | AE121: -1.6399999999999998e-002 | AF121: 86.54 | AG121: 85.73 | AH121: 0.48 | AI121: AA | AJ121: 4.4699999999999997e-002 | AK121: =I121+100*T121 -> 140.15600000000001 | AL121: 135.2 | AM121: 162 | AN121: 48.6 | AO121: 199 | AP121: -6.7000000000000004e-002 | AQ121: 8 | AR121: 科华转债!
A122: 131 | B122: 永创转债! | C122: 113559 | D122: 43840. | E122: 永创智能 | F122: 603901 | G122: 机械装备 | H122: 专用设备 | I122: 119.17 | J122: 2.0899999999999998e-002 | K122: -1.7600000000000001e-002 | L122: 10.19 | M122: 4.8999999999999998e-003 | N122: 1.8 | O122: 3.0000000000000001e-003 | P122: 118.9 | Q122: 10.32 | R122: 3.27 | S122: 98.74 | T122: 0.20699999999999999 | U122: 转股中 | V122: 5.26年 | W122: 3.26年 | X122: 0.114 | Y122: 0.11199999999999999 | Z122: 5.1 | AA122: 45 | AB122: -4.0000000000000002e-004 | AC122: -6.7000000000000002e-003 | AD122: -3.6799999999999999e-002 | AE122: -3.9399999999999998e-002 | AF122: 84.72 | AG122: 85.88 | AH122: 0.67 | AI122: AA- | AJ122: 6.5700000000000008e-002 | AK122: =I122+100*T122 -> 139.87 | AL122: 139.6 | AM122: 203 | AN122: 53.7 | AO122: 222 | AP122: -6.3e-002 | AQ122: 24 | AR122: 永创转债!
A123: 257 | B123: 大族转债! | C123: 128035 | D123: 43164. | E123: 大族激光 | F123: 2008 | G123: 机械装备 | H123: 专用设备 | I123: 108.2 | J123: 2.0999999999999999e-003 | K123: -1.6000000000000001e-003 | L123: 35.58 | M123: 7.6e-003 | N123: 16 | O123: 6.0000000000000001e-003 | P123: 108 | Q123: 52.1 | R123: 4.23 | S123: 68.29 | T123: 0.58399999999999996 | U123: 转股中 | V123: 3.38年 | W123: 1.38年 | X123: 6.0999999999999999e-002 | Y123: 4.0999999999999995e-002 | Z123: 23 | AA123: 380 | AB123: -5.9999999999999995e-004 | AC123: -5.0000000000000001e-003 | AD123: -2.29e-002 | AE123: -2.8199999999999999e-002 | AF123: 98.17 | AG123: 94.54 | AH123: 0.07 | AI123: AA+ | AJ123: 4.07e-002 | AK123: =I123+100*T123 -> 166.59999999999999 | AL123: 148.1 | AM123: 241 | AN123: 49.9 | AO123: 204 | AP123: -1.3000000000000001e-002 | AQ123: 19 | AR123: 大族转债!
A124: 113 | B124: 天目转债 | C124: 113564 | D124: 43906. | E124: 天目湖 | F124: 603136 | G124: 旅游餐饮 | H124: 旅游 | I124: 127.4 | J124: 1.4000000000000002e-003 | K124: -5.6000000000000008e-003 | L124: 28.8 | M124: -5.1999999999999998e-003 | N124: 9.8 | O124: 2.6000000000000002e-002 | P124: 126.7 | Q124: 23.8 | R124: 3.75 | S124: 121.01 | T124: 5.2999999999999999e-002 | U124: 转股中 | V124: 5.44年 | W124: 3.44年 | X124: 8.9999999999999997e-002 | Y124: 0.109 | Z124: 3 | AA124: 33 | AB124: -1.e-003 | AC124: -9.0000000000000011e-003 | AD124: -5.3699999999999998e-002 | AE124: -5.5999999999999994e-002 | AF124: 83.4 | AG124: 90.33 | AH124: 0.8 | AI124: AA- | AJ124: 6.5700000000000008e-002 | AK124: =I124+100*T124 -> 132.70000000000002 | AL124: 133.8 | AM124: 151 | AN124: 43.5 | AO124: 166 | AP124: -6.8000000000000005e-002 | AQ124: 11 | AR124: 天目转债
A125: 259 | B125: 江银转债! | C125: 128034 | D125: 43145. | E125: 江阴银行 | F125: 2807 | G125: 金融 | H125: 银行行业 | I125: 109.505 | J125: -8.9999999999999998e-004 | K125: 9.1999999999999998e-003 | L125: 4.25 | M125: 1.67e-002 | N125: 16 | O125: 8.0000000000000002e-003 | P125: 109.1 | Q125: 4.5 | R125: 0.82 | S125: 94.44 | T125: 0.159 | U125: 转股中 | V125: 3.35年 | W125: 无权 | X125: 0.19 | Y125: 0.17999999999999999 | Z125: 18 | AA125: 92 | AB125: -1.1000000000000001e-003 | AC125: -6.1999999999999998e-003 | AD125: 无权 | AE125: 无权 | AF125: 无权 | AG125: 95.65 | AH125: 0.5 | AI125: AA+ | AJ125: 4.07e-002 | AK125: =I125+100*T125 -> 125.405 | AL125: 124.6 | AM125: 64 | AN125: 28.9 | AO125: 25 | AP125: 0. | AQ125: 28 | AR125: 江银转债!
A126: 41 | B126: 美联转债 | C126: 123057 | D126: 44039. | E126: 美联新材 | F126: 300586 | G126: 化工 | H126: 橡胶塑料 | I126: 119 | J126: 3.4799999999999998e-002 | K126: 4.7800000000000002e-002 | L126: 11.33 | M126: 0.10199999999999999 | N126: 209 | O126: 0.84299999999999997 | P126: 118.2 | Q126: 9.91 | R126: 7.08 | S126: 114.33 | T126: 4.0999999999999995e-002 | U126: 3月20天 | V126: 5.78年 | W126: 3.78年 | X126: 4.0000000000000001e-002 | Y126: 4.5999999999999999e-002 | Z126: 2.1 | AA126: 52 | AB126: -1.1999999999999999e-003 | AC126: -6.7000000000000002e-003 | AD126: -3.3599999999999998e-002 | AE126: -3.5499999999999997e-002 | AF126: 81.21 | AG126: 82.47 | AH126: 0.81 | AI126: AA- | AJ126: 6.5700000000000008e-002 | AK126: =I126+100*T126 -> 123.09999999999999 | AL126: 123.7 | AM126: 59 | AN126: 41.2 | AO126: 151 | AP126: 5.2000000000000005e-002 | AQ126: 5 | AR126: 美联转债
A127: 162 | B127: 游族转债!! | C127: 128074 | D127: 43759. | E127: 游族网络 | F127: 2174 | G127: 通信互联 | H127: 互联网 | I127: 121.25 | J127: -2.0999999999999999e-003 | K127: 1.77e-002 | L127: 19.02 | M127: 1.6e-002 | N127: 7.7 | O127: 9.0000000000000011e-003 | P127: 120.3 | Q127: 16.97 | R127: 3.09 | S127: 112.08 | T127: 8.199999999999999e-002 | U127: 转股中 | V127: 5年4.1天 | W127: 3年4.1天 | X127: 3.9e-002 | Y127: 4.4000000000000004e-002 | Z127: 6.8 | AA127: 174 | AB127: -1.6000000000000001e-003 | AC127: -8.5000000000000006e-003 | AD127: -4.8300000000000003e-002 | AE127: -5.04e-002 | AF127: 90.49 | AG127: 97.07 | AH127: 0.98 | AI127: AA | AJ127: 4.4699999999999997e-002 | AK127: =I127+100*T127 -> 129.44999999999999 | AL127: 130.4 | AM127: 121 | AN127: 33.3 | AO127: 61 | AP127: -4.9000000000000002e-002 | AQ127: 22 | AR127: 游族转债!!
A128: 260 | B128: 道氏转债!! | C128: 123007 | D128: 43126. | E128: 道氏技术 | F128: 300409 | G128: 建筑 | H128: 建筑行业 | I128: 111.9 | J128: -4.4000000000000003e-003 | K128: -7.7000000000000002e-003 | L128: 14.1 | M128: -2.1499999999999998e-002 | N128: 5.3 | O128: 1.6e-002 | P128: 111.3 | Q128: 14.95 | R128: 2.72 | S128: 94.31 | T128: 0.18600000000000003 | U128: 转股中 | V128: 3.27年 | W128: 1.27年 | X128: 4.7e-002 | Y128: 4.4000000000000004e-002 | Z128: 3 | AA128: 65 | AB128: -1.7000000000000001e-003 | AC128: -8.0000000000000002e-003 | AD128: -5.74e-002 | AE128: -6.0999999999999999e-002 | AF128: 94.17 | AG128: 91.34 | AH128: 0.56 | AI128: AA- | AJ128: 6.3700000000000007e-002 | AK128: =I128+100*T128 -> 130.5 | AL128: 129.5 | AM128: 112 | AN128: 35.3 | AO128: 87 | AP128: 5.0999999999999997e-002 | AQ128: 15 | AR128: 道氏转债!!
A129: 223 | B129: 华源转债! | C129: 128049 | D129: 43454. | E129: 华源控股 | F129: 2787 | G129: 造纸包装 | H129: 包装材料 | I129: 116.196 | J129: 8.8999999999999999e-003 | K129: 7.8000000000000005e-003 | L129: 8.45 | M129: 2.18e-002 | N129: 4.9 | O129: 1.2e-002 | P129: 115.2 | Q129: 7.42 | R129: 1.83 | S129: 113.88 | T129: 2.e-002 | U129: 转股中 | V129: 4.19年 | W129: 2.19年 | X129: 0.13600000000000001 | Y129: 0.155 | Z129: 3.6 | AA129: 27 | AB129: -2.0999999999999999e-003 | AC129: -8.6e-003 | AD129: -4.8300000000000003e-002 | AE129: -5.0999999999999997e-002 | AF129: 89.68 | AG129: 89.48 | AH129: 0.77 | AI129: AA- | AJ129: 6.3700000000000007e-002 | AK129: =I129+100*T129 -> 118.196 | AL129: 118.5 | AM129: 13 | AN129: 28.8 | AO129: 24 | AP129: -2.2000000000000002e-002 | AQ129: 54 | AR129: 华源转债!
A130: 97 | B130: 雷迪转债 | C130: 123045 | D130: 43934. | E130: 雷迪克 | F130: 300652 | G130: 汽车 | H130: 零部件制 | I130: 120.9 | J130: 2.0299999999999999e-002 | K130: 1.1699999999999999e-002 | L130: 24.52 | M130: 3.7699999999999997e-002 | N130: 29 | O130: 8.5000000000000006e-002 | P130: 119.4 | Q130: 20.13 | R130: 2.7 | S130: 121.81 | T130: -6.9999999999999993e-003 | U130: 转股中 | V130: 5.48年 | W130: 3.48年 | X130: 0.13400000000000001 | Y130: 0.16300000000000001 | Z130: 2.9 | AA130: 22 | AB130: -2.3e-003 | AC130: -8.3999999999999995e-003 | AD130: -3.95e-002 | AE130: -4.1700000000000001e-002 | AF130: 80.16 | AG130: 80.45 | AH130: 0.85 | AI130: A+ | AJ130: 7.6700000000000004e-002 | AK130: =I130+100*T130 -> 120.2 | AL130: 120 | AM130: 26 | AN130: 39.5 | AO130: 134 | AP130: 8.900000000000001e-002 | AQ130: 40 | AR130: 雷迪转债
A131: 22 | B131: 兴森转债 | C131: 128122 | D131: 44060. | E131: 兴森科技 | F131: 2436 | G131: 电子 | H131: 元器件制 | I131: 114.7 | J131: 2.5999999999999999e-003 | K131: -1.e-003 | L131: 11.47 | M131: 4.4000000000000003e-003 | N131: 1.4 | O131: 4.0000000000000001e-003 | P131: 113.3 | Q131: 14.18 | R131: 5.52 | S131: 80.89 | T131: 0.41799999999999998 | U131: 4月12天 | V131: 4.84年 | W131: 3.84年 | X131: 1.6e-002 | Y131: 1.3000000000000001e-002 | Z131: 2.7 | AA131: 171 | AB131: -2.5999999999999999e-003 | AC131: -7.4999999999999997e-003 | AD131: -2.52e-002 | AE131: -2.69e-002 | AF131: 87.76 | AG131: 92.75 | AH131: 0.36 | AI131: AA | AJ131: 4.2699999999999995e-002 | AK131: =I131+100*T131 -> 156.5 | AL131: 148.5 | AM131: 242 | AN131: 55.8 | AO131: 233 | AP131: -4.4000000000000004e-002 | AQ131: 3 | AR131: 兴森转债
A132: 207 | B132: 博彦转债 | C132: 128057 | D132: 43557. | E132: 博彦科技 | F132: 2649 | G132: 计算机及 | H132: 软件开发 | I132: 118.671 | J132: 9.1000000000000004e-003 | K132: 8.6e-003 | L132: 9.99 | M132: 2.2499999999999999e-002 | N132: 6.5 | O132: 1.e-002 | P132: 117.1 | Q132: 8.72 | R132: 1.92 | S132: 114.56 | T132: 3.6000000000000004e-002 | U132: 转股中 | V132: 4.46年 | W132: 2.46年 | X132: 0.10000000000000001 | Y132: 0.115 | Z132: 5.3 | AA132: 53 | AB132: -3.0000000000000001e-003 | AC132: -9.7999999999999997e-003 | AD132: -5.0999999999999997e-002 | AE132: -5.3399999999999996e-002 | AF132: 88.27 | AG132: 89.47 | AH132: 0.79 | AI132: AA- | AJ132: 6.3700000000000007e-002 | AK132: =I132+100*T132 -> 122.271 | AL132: 122.8 | AM132: 52 | AN132: 33.3 | AO132: 59 | AP132: -4.4000000000000004e-002 | AQ132: 30 | AR132: 博彦转债
A133: 78 | B133: 维尔转债 | C133: 123049 | D133: 43963. | E133: 维尔利 | F133: 300190 | G133: 城市公用 | H133: 三废处理 | I133: 127.001 | J133: 2.3099999999999999e-002 | K133: -6.8000000000000005e-003 | L133: 9.25 | M133: 1.9799999999999998e-002 | N133: 8.2 | O133: 6.9999999999999993e-003 | P133: 124.8 | Q133: 7.48 | R133: 1.77 | S133: 123.66 | T133: 2.7000000000000003e-002 | U133: 30天 | V133: 5.56年 | W133: 3.56年 | X133: 0.127 | Y133: 0.157 | Z133: 9.2 | AA133: 72 | AB133: -3.2000000000000002e-003 | AC133: -1.06e-002 | AD133: -5.0999999999999997e-002 | AE133: -5.3200000000000004e-002 | AF133: 82.84 | AG133: 88.33 | AH133: 0.82 | AI133: AA- | AJ133: 6.5700000000000008e-002 | AK133: =I133+100*T133 -> 129.70099999999999 | AL133: 130.3 | AM133: 120 | AN133: 42 | AO133: 158 | AP133: -2.7000000000000003e-002 | AQ133: 11 | AR133: 维尔转债
A134: 52 | B134: 比音转债 | C134: 128113 | D134: 44027. | E134: 比音勒芬 | F134: 2832 | G134: 服装纺织 | H134: 服装行业 | I134: 119.881 | J134: -3.4999999999999996e-003 | K134: -1.1000000000000001e-003 | L134: 15.35 | M134: -7.0999999999999995e-003 | N134: 3.7 | O134: 4.0000000000000001e-003 | P134: 117.3 | Q134: 14.9 | R134: 4.09 | S134: 103.02 | T134: 0.16399999999999998 | U134: 3月3天 | V134: 5.74年 | W134: 3.74年 | X134: 8.5999999999999993e-002 | Y134: 8.8000000000000009e-002 | Z134: 6.9 | AA134: 80 | AB134: -3.9000000000000003e-003 | AC134: -9.1000000000000004e-003 | AD134: -3.6499999999999998e-002 | AE134: -3.8300000000000001e-002 | AF134: 87.65 | AG134: 91.7 | AH134: 0.65 | AI134: AA | AJ134: 4.4699999999999997e-002 | AK134: =I134+100*T134 -> 136.28100000000001 | AL134: 136.7 | AM134: 176 | AN134: 45 | AO134: 175 | AP134: -3.7999999999999999e-002 | AQ134: 4 | AR134: 比音转债
A135: 253 | B135: 敖东转债! | C135: 127006 | D135: 43231. | E135: 吉林敖东 | F135: 623 | G135: 金融 | H135: 证券行业 | I135: 109.502 | J135: 7.4000000000000003e-003 | K135: 4.6999999999999993e-003 | L135: 17.6 | M135: 3.1699999999999999e-002 | N135: 6.1 | O135: 2.e-003 | P135: 108 | Q135: 20.42 | R135: 0.92 | S135: 86.19 | T135: 0.27000000000000002 | U135: 转股中 | V135: 3.48年 | W135: 1.48年 | X135: 0.11800000000000001 | Y135: 0.10099999999999999 | Z135: 24 | AA135: 205 | AB135: -4.0000000000000001e-003 | AC135: -8.3000000000000001e-003 | AD135: -4.4299999999999999e-002 | AE135: -4.6199999999999998e-002 | AF135: 95.23 | AG135: 94.17 | AH135: 0.38 | AI135: AA+ | AJ135: 4.07e-002 | AK135: =I135+100*T135 -> 136.50200000000001 | AL135: 132.8 | AM135: 146 | AN135: 37.6 | AO135: 110 | AP135: 1.8000000000000002e-002 | AQ135: 26 | AR135: 敖东转债!
A136: 20 | B136: 国光转债 | C136: 128123 | D136: 44062. | E136: 国光股份 | F136: 2749 | G136: 化工 | H136: 农化 | I136: 118.99 | J136: 1.9e-003 | K136: 4.0000000000000001e-003 | L136: 13.4 | M136: 8.3000000000000001e-003 | N136: 1.6 | O136: 4.0000000000000001e-003 | P136: 116.2 | Q136: 13.7 | R136: 4.94 | S136: 97.81 | T136: 0.217 | U136: 4月15天 | V136: 5.85年 | W136: 3.85年 | X136: 5.5e-002 | Y136: 5.4000000000000006e-002 | Z136: 3.2 | AA136: 58 | AB136: -4.0999999999999995e-003 | AC136: -9.0000000000000011e-003 | AD136: -3.3000000000000002e-002 | AE136: -3.4799999999999998e-002 | AF136: 80.85 | AG136: 80.72 | AH136: 0.72 | AI136: AA- | AJ136: 6.5700000000000008e-002 | AK136: =I136+100*T136 -> 140.69 | AL136: 140.2 | AM136: 206 | AN136: 59.3 | AO136: 240 | AP136: -1.8000000000000002e-002 | AQ136: 5 | AR136: 国光转债
A137: 19 | B137: 三超转债 | C137: 123062 | D137: 44060. | E137: 三超新材 | F137: 300554 | G137: 机械装备 | H137: 通用设备 | I137: 122.602 | J137: 1.47e-002 | K137: 1.6899999999999998e-002 | L137: 22.43 | M137: 3.4599999999999999e-002 | N137: 53 | O137: 0.222 | P137: 119.7 | Q137: 17.17 | R137: 4.11 | S137: 130.63 | T137: -6.0999999999999999e-002 | U137: 4月15天 | V137: 5.85年 | W137: 3.85年 | X137: 9.3000000000000013e-002 | Y137: 0.121 | Z137: 2 | AA137: 21 | AB137: -4.1999999999999997e-003 | AC137: -9.8999999999999991e-003 | AD137: -3.9100000000000003e-002 | AE137: -4.1100000000000005e-002 | AF137: 75.18 | AG137: 74.42 | AH137: 0.91 | AI137: A | AJ137: 8.6699999999999999e-002 | AK137: =I137+100*T137 -> 116.50200000000001 | AL137: 114.6 | AM137: 2 | AN137: 39.4 | AO137: 131 | AP137: 4.4999999999999998e-002 | AQ137: 8 | AR137: 三超转债
A138: 9 | B138: 特发转2! | C138: 127021 | D138: 44078. | E138: 特发信息 | F138: 70 | G138: 通信互联 | H138: 通信设备 | I138: 115.615 | J138: 3.7000000000000002e-003 | K138: 1.8700000000000001e-002 | L138: 10.75 | M138: 5.0799999999999998e-002 | N138: 44 | O138: 6.8000000000000005e-002 | P138: 113.3 | Q138: 12.33 | R138: 3.12 | S138: 87.19 | T138: 0.32600000000000001 | U138: 4月27天 | V138: 4.88年 | W138: 2.88年 | X138: 6.3e-002 | Y138: 5.5e-002 | Z138: 5.5 | AA138: 88 | AB138: -4.1999999999999997e-003 | AC138: -9.0000000000000011e-003 | AD138: -4.0300000000000002e-002 | AE138: -4.1500000000000002e-002 | AF138: 89.89 | AG138: 92.59 | AH138: 0.44 | AI138: AA | AJ138: 4.2699999999999995e-002 | AK138: =I138+100*T138 -> 148.215 | AL138: 144 | AM138: 225 | AN138: 51.5 | AO138: 211 | AP138: -4.7e-002 | AQ138: 3 | AR138: 特发转2!
A139: 218 | B139: 台华转债! | C139: 113525 | D139: 43476. | E139: 台华新材 | F139: 603055 | G139: 服装纺织 | H139: 纺织行业 | I139: 117.09 | J139: -7.7000000000000002e-003 | K139: 6.8999999999999999e-003 | L139: 9.24 | M139: -1.1000000000000001e-003 | N139: 8 | O139: 1.4999999999999999e-002 | P139: 114.9 | Q139: 8.03 | R139: 2.75 | S139: 115.07 | T139: 1.8000000000000002e-002 | U139: 转股中 | V139: 4.24年 | W139: 2.24年 | X139: 6.6000000000000003e-002 | Y139: 7.4999999999999997e-002 | Z139: 4.7 | AA139: 71 | AB139: -4.5000000000000005e-003 | AC139: -1.0800000000000001e-002 | AD139: -5.0799999999999998e-002 | AE139: -5.33e-002 | AF139: 93.59 | AG139: 96.58 | AH139: 0.72 | AI139: AA | AJ139: 4.2699999999999995e-002 | AK139: =I139+100*T139 -> 118.89 | AL139: 119.1 | AM139: 17 | AN139: 22.5 | AO139: 9 | AP139: 3.9e-002 | AQ139: 22 | AR139: 台华转债!
A140: 291 | B140: 广汽转债!! | C140: 113009 | D140: 42404. | E140: 广汽集团 | F140: 601238 | G140: 汽车 | H140: 乘用车 | I140: 108.18 | J140: -2.0000000000000001e-004 | K140: 1.e-004 | L140: 10.87 | M140: -1.8e-003 | N140: 8 | O140: 3.0000000000000001e-003 | P140: 107.5 | Q140: 14.26 | R140: 1.38 | S140: 76.23 | T140: 0.41899999999999998 | U140: 转股中 | V140: 1.34年 | W140: 回售中 | X140: 2.3e-002 | Y140: 1.7000000000000001e-002 | Z140: 25 | AA140: 1113. | AB140: -4.6999999999999993e-003 | AC140: -1.52e-002 | AD140: 回售中 | AE140: 回售中 | AF140: 100.25 | AG140: 102.53 | AH140: 0.05 | AI140: AAA | AJ140: 3.6299999999999999e-002 | AK140: =I140+100*T140 -> 150.08000000000001 | AL140: 140.1 | AM140: 204 | AN140: 37.6 | AO140: 111 | AP140: 5.5e-002 | AQ140: 14 | AR140: 广汽转债!!
A141: 195 | B141: 现代转债 | C141: 110057 | D141: 43585. | E141: 现代制药 | F141: 600420 | G141: 医药 | H141: 化学制药 | I141: 113.62 | J141: 6.8000000000000005e-003 | K141: 4.1999999999999997e-003 | L141: 9.86 | M141: 1.8600000000000002e-002 | N141: 2.1 | O141: 1.e-003 | P141: 110.8 | Q141: 9.89 | R141: 1.34 | S141: 99.7 | T141: 0.14000000000000001 | U141: 转股中 | V141: 4.53年 | W141: 2.53年 | X141: 0.16 | Y141: 0.159 | Z141: 16 | AA141: 101 | AB141: -5.6000000000000008e-003 | AC141: -1.e-002 | AD141: -3.5000000000000003e-002 | AE141: -3.7200000000000004e-002 | AF141: 93.57 | AG141: 94 | AH141: 0.59 | AI141: AAA | AJ141: 3.7699999999999997e-002 | AK141: =I141+100*T141 -> 127.62 | AL141: 127.5 | AM141: 91 | AN141: 33.5 | AO141: 64 | AP141: -2.3e-002 | AQ141: 22 | AR141: 现代转债
A142: 74 | B142: 全筑转债 | C142: 113578 | D142: 43970. | E142: 全筑股份 | F142: 603030 | G142: 建筑 | H142: 装饰工程 | I142: 122 | J142: 4.0599999999999997e-002 | K142: -1.2699999999999999e-002 | L142: 6.44 | M142: 3.7000000000000005e-002 | N142: 41 | O142: 8.900000000000001e-002 | P142: 118.3 | Q142: 5.43 | R142: 1.56 | S142: 118.6 | T142: 2.8999999999999998e-002 | U142: 37天 | V142: 5.58年 | W142: 3.58年 | X142: 0.111 | Y142: 0.13100000000000001 | Z142: 3.8 | AA142: 35 | AB142: -5.6000000000000008e-003 | AC142: -1.1200000000000002e-002 | AD142: -4.2500000000000003e-002 | AE142: -4.4299999999999999e-002 | AF142: 88.24 | AG142: 93.1 | AH142: 0.75 | AI142: AA | AJ142: 4.4699999999999997e-002 | AK142: =I142+100*T142 -> 124.90000000000001 | AL142: 125.4 | AM142: 70 | AN142: 32.3 | AO142: 51 | AP142: -1.3000000000000001e-002 | AQ142: 7 | AR142: 全筑转债
A143: 180 | B143: 三星转债 | C143: 113536 | D143: 43640. | E143: 三星新材 | F143: 603578 | G143: 家电 | H143: 零部件制 | I143: 117.98 | J143: 4.0999999999999995e-003 | K143: -5.9999999999999995e-004 | L143: 22.26 | M143: 5.0000000000000001e-003 | N143: 3.3 | O143: 1.9e-002 | P143: 114.8 | Q143: 19.54 | R143: 3.17 | S143: 113.92 | T143: 3.6000000000000004e-002 | U143: 转股中 | V143: 4.70年 | W143: 2.70年 | X143: 7.2999999999999995e-002 | Y143: 8.3000000000000004e-002 | Z143: 1.5 | AA143: 20 | AB143: -5.8999999999999999e-003 | AC143: -1.15e-002 | AD143: -4.5700000000000005e-002 | AE143: -4.7800000000000002e-002 | AF143: 91.74 | AG143: 94.68 | AH143: 0.71 | AI143: AA | AJ143: 4.2699999999999995e-002 | AK143: =I143+100*T143 -> 121.58 | AL143: 122 | AM143: 44 | AN143: 27.4 | AO143: 19 | AP143: -4.7e-002 | AQ143: 38 | AR143: 三星转债
A144: 73 | B144: 交科转债 | C144: 128107 | D144: 43973. | E144: 浙江交科 | F144: 2061 | G144: 建筑 | H144: 建筑工程 | I144: 119.119 | J144: 1.9699999999999999e-002 | K144: 1.0200000000000001e-002 | L144: 6.13 | M144: 4.07e-002 | N144: 37 | O144: 1.2e-002 | P144: 115.3 | Q144: 5.36 | R144: 1.08 | S144: 114.37 | T144: 4.2000000000000003e-002 | U144: 39天 | V144: 5.59年 | W144: 3.59年 | X144: 0.29600000000000004 | Y144: 0.33899999999999997 | Z144: 25 | AA144: 84 | AB144: -5.8999999999999999e-003 | AC144: -1.0700000000000001e-002 | AD144: -3.6299999999999999e-002 | AE144: -3.8100000000000002e-002 | AF144: 88.85 | AG144: 91.69 | AH144: 0.73 | AI144: AA+ | AJ144: 4.2699999999999995e-002 | AK144: =I144+100*T144 -> 123.319 | AL144: 123.9 | AM144: 60 | AN144: 32.2 | AO144: 49 | AP144: 5.2000000000000005e-002 | AQ144: 14 | AR144: 交科转债
A145: 126 | B145: 汽模转2 | C145: 128090 | D145: 43853. | E145: 天汽模 | F145: 2510 | G145: 汽车 | H145: 零部件制 | I145: 118.88 | J145: 1.1000000000000001e-003 | K145: 4.0000000000000002e-004 | L145: 4.64 | M145: 2.2000000000000001e-003 | N145: 10 | O145: 1.8000000000000002e-002 | P145: 115.2 | Q145: 4.21 | R145: 1.59 | S145: 110.21 | T145: 7.9000000000000001e-002 | U145: 转股中 | V145: 5.27年 | W145: 3.27年 | X145: 0.11 | Y145: 0.121 | Z145: 4.7 | AA145: 42 | AB145: -6.0999999999999995e-003 | AC145: -1.11e-002 | AD145: -3.9300000000000002e-002 | AE145: -4.1299999999999996e-002 | AF145: 89.37 | AG145: 91.9 | AH145: 0.69 | AI145: AA | AJ145: 4.4699999999999997e-002 | AK145: =I145+100*T145 -> 126.78 | AL145: 127.5 | AM145: 92 | AN145: 35.6 | AO145: 92 | AP145: -4.2999999999999997e-002 | AQ145: 27 | AR145: 汽模转2
A146: 50 | B146: 晨光转债 | C146: 123055 | D146: 44025. | E146: 晨光生物 | F146: 300138 | G146: 食品饮料 | H146: 食品加工 | I146: 128.82 | J146: 6.4000000000000003e-003 | K146: 2.1099999999999997e-002 | L146: 15.14 | M146: 3.27e-002 | N146: 18 | O146: 2.2000000000000002e-002 | P146: 124.3 | Q146: 12.25 | R146: 4.12 | S146: 123.59 | T146: 4.2000000000000003e-002 | U146: 3月5天 | V146: 5.74年 | W146: 3.74年 | X146: 8.1000000000000003e-002 | Y146: 0.10000000000000001 | Z146: 6.3 | AA146: 77 | AB146: -6.3e-003 | AC146: -1.3300000000000001e-002 | AD146: -5.33e-002 | AE146: -5.5199999999999999e-002 | AF146: 81.5 | AG146: 86.93 | AH146: 0.84 | AI146: AA- | AJ146: 6.5700000000000008e-002 | AK146: =I146+100*T146 -> 133.01999999999998 | AL146: 134 | AM146: 154 | AN146: 47.1 | AO146: 190 | AP146: -4.2000000000000003e-002 | AQ146: 5 | AR146: 晨光转债
A147: 222 | B147: 福能转债! | C147: 110048 | D147: 43462. | E147: 福能股份 | F147: 600483 | G147: 能源电力 | H147: 电力供应 | I147: 117.01 | J147: -5.6999999999999993e-003 | K147: 1.2699999999999999e-002 | L147: 8.02 | M147: 1.26e-002 | N147: 26 | O147: 8.0000000000000002e-003 | P147: 113.9 | Q147: 8.12 | R147: 1.03 | S147: 98.77 | T147: 0.185 | U147: 转股中 | V147: 4.22年 | W147: 2.22年 | X147: 0.20000000000000001 | Y147: 0.19800000000000001 | Z147: 28 | AA147: 141 | AB147: -6.5000000000000006e-003 | AC147: -1.24e-002 | AD147: -5.1100000000000007e-002 | AE147: -5.3600000000000002e-002 | AF147: 94.12 | AG147: 96.62 | AH147: 0.55 | AI147: AA+ | AJ147: 4.07e-002 | AK147: =I147+100*T147 -> 135.50999999999999 | AL147: 135.3 | AM147: 165 | AN147: 38.6 | AO147: 120 | AP147: 1.e-003 | AQ147: 8 | AR147: 福能转债!
A148: 184 | B148: 永鼎转债! | C148: 110058 | D148: 43593. | E148: 永鼎股份 | F148: 600105 | G148: 通信互联 | H148: 通信设备 | I148: 118.59 | J148: 4.8999999999999998e-003 | K148: -1.1000000000000001e-003 | L148: 5.93 | M148: 5.1000000000000004e-003 | N148: 19 | O148: 2.4e-002 | P148: 114.9 | Q148: 5.04 | R148: 3.17 | S148: 117.66 | T148: 8.0000000000000002e-003 | U148: 转股中 | V148: 4.57年 | W148: 2.57年 | X148: 9.0999999999999998e-002 | Y148: 0.10800000000000001 | Z148: 6.7 | AA148: 73 | AB148: -6.9999999999999993e-003 | AC148: -1.2800000000000001e-002 | AD148: -4.9200000000000001e-002 | AE148: -5.1500000000000004e-002 | AF148: 92.31 | AG148: 95.26 | AH148: 0.74 | AI148: AA | AJ148: 4.2699999999999995e-002 | AK148: =I148+100*T148 -> 119.39 | AL148: 119.5 | AM148: 22 | AN148: 24.3 | AO148: 11 | AP148: -3.3000000000000002e-002 | AQ148: 55 | AR148: 永鼎转债!
A149: 114 | B149: 宏辉转债 | C149: 113565 | D149: 43906. | E149: 宏辉果蔬 | F149: 603336 | G149: 农业 | H149: 农产品加 | I149: 122.69 | J149: 1.03e-002 | K149: -2.5999999999999999e-003 | L149: 12.29 | M149: 9.0000000000000011e-003 | N149: 39 | O149: 0.10199999999999999 | P149: 118.2 | Q149: 10 | R149: 4.52 | S149: 122.9 | T149: -2.e-003 | U149: 转股中 | V149: 5.44年 | W149: 3.44年 | X149: 7.9000000000000001e-002 | Y149: 9.6999999999999989e-002 | Z149: 3.2 | AA149: 40 | AB149: -6.9999999999999993e-003 | AC149: -1.2699999999999999e-002 | AD149: -4.4999999999999998e-002 | AE149: -4.7e-002 | AF149: 83.01 | AG149: 84.29 | AH149: 0.86 | AI149: AA- | AJ149: 6.5700000000000008e-002 | AK149: =I149+100*T149 -> 122.48999999999999 | AL149: 122.5 | AM149: 47 | AN149: 38.2 | AO149: 114 | AP149: -5.0999999999999997e-002 | AQ149: 18 | AR149: 宏辉转债
A150: 176 | B150: 华钰转债!! | C150: 113027 | D150: 43656. | E150: 华钰矿业 | F150: 601020 | G150: 有色金属 | H150: 锌铅镍锡 | I150: 119 | J150: 1.23e-002 | K150: 1.7299999999999999e-002 | L150: 11.94 | M150: 3.6499999999999998e-002 | N150: 81 | O150: 0.20800000000000002 | P150: 114.9 | Q150: 10.17 | R150: 3.01 | S150: 117.4 | T150: 1.3999999999999999e-002 | U150: 转股中 | V150: 4.73年 | W150: 2.73年 | X150: 4.9000000000000002e-002 | Y150: 5.7999999999999996e-002 | Z150: 3.3 | AA150: 66 | AB150: -7.4999999999999997e-003 | AC150: -1.3100000000000001e-002 | AD150: -4.7699999999999992e-002 | AE150: -4.9800000000000004e-002 | AF150: 86.59 | AG150: 86.27 | AH150: 0.81 | AI150: AA- | AJ150: 6.3700000000000007e-002 | AK150: =I150+100*T150 -> 120.40000000000001 | AL150: 120.6 | AM150: 32 | AN150: 34 | AO150: 71 | AP150: -3.5000000000000003e-002 | AQ150: 47 | AR150: 华钰转债!!
A151: 35 | B151: 龙大转债 | C151: 128119 | D151: 44050. | E151: 龙大肉食 | F151: 2726 | G151: 食品饮料 | H151: 肉制品 | I151: 125.5 | J151: -1.5700000000000002e-002 | K151: 1.7600000000000001e-002 | L151: 10.43 | M151: 2.8999999999999998e-003 | N151: 53 | O151: 4.4999999999999998e-002 | P151: 120.2 | Q151: 9.56 | R151: 4.01 | S151: 109.1 | T151: 0.14999999999999999 | U151: 4月0天 | V151: 5.81年 | W151: 3.81年 | X151: 9.0999999999999998e-002 | Y151: 0.10000000000000001 | Z151: 9.5 | AA151: 104 | AB151: -7.4999999999999997e-003 | AC151: -1.34e-002 | AD151: -4.7199999999999999e-002 | AE151: -4.8799999999999996e-002 | AF151: 87.26 | AG151: 93.63 | AH151: 0.68 | AI151: AA | AJ151: 4.4699999999999997e-002 | AK151: =I151+100*T151 -> 140.5 | AL151: 141.9 | AM151: 215 | AN151: 48.3 | AO151: 197 | AP151: -0.17000000000000001 | AQ151: 5 | AR151: 龙大转债
A152: 281 | B152: 林洋转债! | C152: 113014 | D152: 43052. | E152: 林洋能源 | F152: 601222 | G152: 能源电力 | H152: 电力设备 | I152: 112.88 | J152: -3.3e-003 | K152: 7.1999999999999998e-003 | L152: 7.41 | M152: 1.09e-002 | N152: 12 | O152: 3.0000000000000001e-003 | P152: 110.3 | Q152: 8.54 | R152: 1.28 | S152: 86.77 | T152: 0.30099999999999999 | U152: 转股中 | V152: 3年38天 | W152: 1年38天 | X152: 0.23100000000000001 | Y152: 0.20100000000000001 | Z152: 30 | AA152: 130 | AB152: -7.6e-003 | AC152: -1.37e-002 | AD152: -7.17e-002 | AE152: -7.5499999999999998e-002 | AF152: 97.54 | AG152: 97.17 | AH152: 0.36 | AI152: AA | AJ152: 4.2699999999999995e-002 | AK152: =I152+100*T152 -> 142.97999999999999 | AL152: 139 | AM152: 197 | AN152: 41.5 | AO152: 153 | AP152: 3.4000000000000002e-002 | AQ152: 22 | AR152: 林洋转债!
A153: 160 | B153: 金能转债 | C153: 113545 | D153: 43776. | E153: 金能科技 | F153: 603113 | G153: 煤炭 | H153: 炼焦 | I153: 119.97 | J153: 8.199999999999999e-003 | K153: 7.6e-003 | L153: 12.38 | M153: 2.3099999999999999e-002 | N153: 14 | O153: 8.0000000000000002e-003 | P153: 115.3 | Q153: 11.4 | R153: 1.42 | S153: 108.6 | T153: 0.105 | U153: 转股中 | V153: 5年25天 | W153: 3年25天 | X153: 0.17899999999999999 | Y153: 0.19500000000000001 | Z153: 15 | AA153: 84 | AB153: -8.0000000000000002e-003 | AC153: -1.3300000000000001e-002 | AD153: -4.4199999999999996e-002 | AE153: -4.6300000000000001e-002 | AF153: 90.26 | AG153: 92.82 | AH153: 0.68 | AI153: AA | AJ153: 4.4699999999999997e-002 | AK153: =I153+100*T153 -> 130.47 | AL153: 131.3 | AM153: 135 | AN153: 38.5 | AO153: 118 | AP153: -4.0999999999999995e-002 | AQ153: 21 | AR153: 金能转债
A154: 118 | B154: 柳药转债 | C154: 113563 | D154: 43885. | E154: 柳药股份 | F154: 603368 | G154: 医药 | H154: 医药商业 | I154: 118.18 | J154: -3.2000000000000002e-003 | K154: 1.e-002 | L154: 24.36 | M154: 1.0800000000000001e-002 | N154: 1.7 | O154: 2.e-003 | P154: 113.2 | Q154: 24.47 | R154: 1.92 | S154: 99.55 | T154: 0.187 | U154: 转股中 | V154: 5.33年 | W154: 3.33年 | X154: 9.0999999999999998e-002 | Y154: 8.9999999999999997e-002 | Z154: 8 | AA154: 88 | AB154: -8.199999999999999e-003 | AC154: -1.26e-002 | AD154: -3.7100000000000001e-002 | AE154: -3.9e-002 | AF154: 89.15 | AG154: 90.1 | AH154: 0.63 | AI154: AA | AJ154: 4.4699999999999997e-002 | AK154: =I154+100*T154 -> 136.88 | AL154: 136.8 | AM154: 178 | AN154: 46.7 | AO154: 187 | AP154: -2.7999999999999997e-002 | AQ154: 16 | AR154: 柳药转债
A155: 31 | B155: 宏川转债 | C155: 128121 | D155: 44050. | E155: 宏川智慧 | F155: 2930 | G155: 交通运输 | H155: 物流业 | I155: 118.9 | J155: 9.300000000000001e-003 | K155: 1.6e-002 | L155: 18.74 | M155: 3.7699999999999997e-002 | N155: 24 | O155: 2.8999999999999998e-002 | P155: 113.3 | Q155: 20.25 | R155: 4.52 | S155: 92.54 | T155: 0.28499999999999998 | U155: 4月8天 | V155: 5.83年 | W155: 3.83年 | X155: 8.1000000000000003e-002 | Y155: 7.4999999999999997e-002 | Z155: 6.7 | AA155: 83 | AB155: -8.3999999999999995e-003 | AC155: -1.2500000000000001e-002 | AD155: -3.3700000000000001e-002 | AE155: -3.5499999999999997e-002 | AF155: 80.71 | AG155: 78.79 | AH155: 0.67 | AI155: AA- | AJ155: 6.5700000000000008e-002 | AK155: =I155+100*T155 -> 147.40000000000001 | AL155: 145.3 | AM155: 231 | AN155: 64.5 | AO155: 256 | AP155: -5.5e-002 | AQ155: 3 | AR155: 宏川转债
A156: 286 | B156: 骆驼转债! | C156: 113012 | D156: 42934. | E156: 骆驼股份 | F156: 601311 | G156: 汽车 | H156: 零部件制 | I156: 110.1 | J156: 5.0000000000000001e-003 | K156: -3.2000000000000002e-003 | L156: 8.14 | M156: 8.6999999999999994e-003 | N156: 0.8 | O156: 1.e-003 | P156: 107.8 | Q156: 10.06 | R156: 1.05 | S156: 80.91 | T156: 0.36099999999999999 | U156: 转股中 | V156: 2.51年 | W156: 0.51年 | X156: 5.5999999999999994e-002 | Y156: 4.4999999999999998e-002 | Z156: 5.1 | AA156: 91 | AB156: -8.5000000000000006e-003 | AC156: -1.43e-002 | AD156: -0.12 | AE156: -0.124 | AF156: 98.82 | AG156: 97.54 | AH156: 0.21 | AI156: AA | AJ156: 4.1299999999999996e-002 | AK156: =I156+100*T156 -> 146.19999999999999 | AL156: 139.3 | AM156: 200 | AN156: 40.5 | AO156: 144 | AP156: -1.e-003 | AQ156: 17 | AR156: 骆驼转债!
A157: 60 | B157: 宝通转债 | C157: 123053 | D157: 44013. | E157: 宝通科技 | F157: 300031 | G157: 通信互联 | H157: 互联网 | I157: 127.3 | J157: 0. | K157: 8.1000000000000013e-003 | L157: 22.73 | M157: 1.0700000000000001e-002 | N157: 3.8 | O157: 6.0000000000000001e-003 | P157: 121.3 | Q157: 20.8 | R157: 3.22 | S157: 109.28 | T157: 0.16500000000000001 | U157: 2月23天 | V157: 5.71年 | W157: 3.71年 | X157: 5.5e-002 | Y157: 6.0999999999999999e-002 | Z157: 5 | AA157: 90 | AB157: -8.6e-003 | AC157: -1.4800000000000001e-002 | AD157: -5.0799999999999998e-002 | AE157: -5.2699999999999997e-002 | AF157: 81.67 | AG157: 85.02 | AH157: 0.75 | AI157: AA- | AJ157: 6.5700000000000008e-002 | AK157: =I157+100*T157 -> 143.80000000000001 | AL157: 145.3 | AM157: 232 | AN157: 60.3 | AO157: 243 | AP157: -2.7000000000000003e-002 | AQ157: 4 | AR157: 宝通转债
A158: 220 | B158: 光华转债! | C158: 128051 | D158: 43474. | E158: 光华科技 | F158: 2741 | G158: 电子 | H158: 元器件制 | I158: 119.93 | J158: 4.4000000000000003e-003 | K158: -3.8e-003 | L158: 14.81 | M158: 7.000000000000001e-004 | N158: 3.1 | O158: 1.e-002 | P158: 115.5 | Q158: 12.72 | R158: 4.62 | S158: 116.43 | T158: 2.9999999999999999e-002 | U158: 转股中 | V158: 4.24年 | W158: 2.24年 | X158: 4.4999999999999998e-002 | Y158: 5.2999999999999999e-002 | Z158: 2.5 | AA158: 55 | AB158: -9.0000000000000011e-003 | AC158: -1.55e-002 | AD158: -5.8899999999999994e-002 | AE158: -6.1699999999999998e-002 | AF158: 89.68 | AG158: 89.49 | AH158: 0.8 | AI158: AA- | AJ158: 6.3700000000000007e-002 | AK158: =I158+100*T158 -> 122.93000000000001 | AL158: 123.4 | AM158: 56 | AN158: 33.7 | AO158: 67 | AP158: 6.5000000000000002e-002 | AQ158: 21 | AR158: 光华转债!
A159: 288 | B159: 洪涛转债! | C159: 128013 | D159: 42605. | E159: 洪涛股份 | F159: 2325 | G159: 建筑 | H159: 装饰工程 | I159: 111.68 | J159: 5.3e-003 | K159: 5.9999999999999995e-004 | L159: 3.26 | M159: 9.300000000000001e-003 | N159: 14 | O159: 1.1000000000000001e-002 | P159: 109.8 | Q159: 3.1 | R159: 1.32 | S159: 105.16 | T159: 6.2e-002 | U159: 转股中 | V159: 1.86年 | W159: 回售中 | X159: 0.29399999999999998 | Y159: 0.309 | Z159: 12 | AA159: 41 | AB159: -9.1999999999999998e-003 | AC159: -1.8799999999999997e-002 | AD159: 回售中 | AE159: 回售中 | AF159: 100.3 | AG159: 98.24 | AH159: 0.64 | AI159: AA- | AJ159: 6.2300000000000001e-002 | AK159: =I159+100*T159 -> 117.88000000000001 | AL159: 118.2 | AM159: 11 | AN159: 17.9 | AO159: 4 | AP159: -1.2e-002 | AQ159: 89 | AR159: 洪涛转债!
A160: 205 | B160: 中鼎转2! | C160: 127011 | D160: 43559. | E160: 中鼎股份 | F160: 887 | G160: 汽车 | H160: 零部件制 | I160: 120.02 | J160: -1.e-003 | K160: 6.1999999999999998e-003 | L160: 11.26 | M160: 9.8999999999999991e-003 | N160: 5.2 | O160: 4.0000000000000001e-003 | P160: 115.2 | Q160: 11.59 | R160: 1.56 | S160: 97.15 | T160: 0.23499999999999999 | U160: 转股中 | V160: 4.47年 | W160: 2.47年 | X160: 8.6999999999999994e-002 | Y160: 8.5000000000000006e-002 | Z160: 12 | AA160: 137 | AB160: -9.300000000000001e-003 | AC160: -1.5300000000000001e-002 | AD160: -5.5099999999999996e-002 | AE160: -5.7500000000000002e-002 | AF160: 93.32 | AG160: 96.77 | AH160: 0.53 | AI160: AA+ | AJ160: 4.07e-002 | AK160: =I160+100*T160 -> 143.51999999999998 | AL160: 142.9 | AM160: 219 | AN160: 46.1 | AO160: 181 | AP160: 3.2000000000000001e-002 | AQ160: 28 | AR160: 中鼎转2!
A161: 83 | B161: 滨化转债 | C161: 113034 | D161: 43951. | E161: 滨化股份 | F161: 601678 | G161: 化工 | H161: 化工 | I161: 121.1 | J161: 2.0999999999999999e-003 | K161: 3.4999999999999996e-003 | L161: 5.7 | M161: 7.0999999999999995e-003 | N161: 42 | O161: 1.4999999999999999e-002 | P161: 115.1 | Q161: 4.68 | R161: 1.46 | S161: 121.79 | T161: -6.0000000000000001e-003 | U161: 27天 | V161: 5.56年 | W161: 3.56年 | X161: 0.27300000000000002 | Y161: 0.33200000000000002 | Z161: 24 | AA161: 88 | AB161: -9.300000000000001e-003 | AC161: -1.3999999999999999e-002 | AD161: -4.1399999999999999e-002 | AE161: -4.3099999999999999e-002 | AF161: 88.16 | AG161: 90.67 | AH161: 0.79 | AI161: AA | AJ161: 4.4699999999999997e-002 | AK161: =I161+100*T161 -> 120.5 | AL161: 120.4 | AM161: 27 | AN161: 29.7 | AO161: 30 | AP161: 0.10199999999999999 | AQ161: 28 | AR161: 滨化转债
A162: 81 | B162: 应急转债 | C162: 123048 | D162: 43962. | E162: 中船应急 | F162: 300527 | G162: 机械装备 | H162: 专用设备 | I162: 119.2 | J162: 3.2000000000000002e-003 | K162: 9.4999999999999998e-003 | L162: 10.16 | M162: 1.7000000000000001e-002 | N162: 23 | O162: 2.4e-002 | P162: 113.1 | Q162: 8.9 | R162: 3.99 | S162: 114.16 | T162: 4.4000000000000004e-002 | U162: 27天 | V162: 5.56年 | W162: 3.56年 | X162: 8.8000000000000009e-002 | Y162: 0.10099999999999999 | Z162: 8.2 | AA162: 93 | AB162: -9.5999999999999992e-003 | AC162: -1.38e-002 | AD162: -3.73e-002 | AE162: -3.9e-002 | AF162: 88.78 | AG162: 90.04 | AH162: 0.75 | AI162: AA+ | AJ162: 4.2699999999999995e-002 | AK162: =I162+100*T162 -> 123.60000000000001 | AL162: 124.2 | AM162: 61 | AN162: 34.2 | AO162: 73 | AP162: -4.8000000000000001e-002 | AQ162: 13 | AR162: 应急转债
A163: 57 | B163: 永兴转债 | C163: 128110 | D163: 44020. | E163: 永兴材料 | F163: 2756 | G163: 钢铁 | H163: 炼钢 | I163: 119.48 | J163: 1.38e-002 | K163: -1.38e-002 | L163: 17.39 | M163: 0. | N163: 1.8 | O163: 2.e-003 | P163: 113.2 | Q163: 17.16 | R163: 1.85 | S163: 101.34 | T163: 0.17899999999999999 | U163: 2月27天 | V163: 5.72年 | W163: 3.72年 | X163: 0.11199999999999999 | Y163: 0.113 | Z163: 7 | AA163: 63 | AB163: -9.5999999999999992e-003 | AC163: -1.37e-002 | AD163: -3.61e-002 | AE163: -3.78e-002 | AF163: 87.62 | AG163: 88.56 | AH163: 0.66 | AI163: AA | AJ163: 4.4699999999999997e-002 | AK163: =I163+100*T163 -> 137.38 | AL163: 137.6 | AM163: 185 | AN163: 49.1 | AO163: 201 | AP163: -3.3000000000000002e-002 | AQ163: 4 | AR163: 永兴转债
A164: 244 | B164: 博世转债! | C164: 123010 | D164: 43326. | E164: 博世科 | F164: 300422 | G164: 城市公用 | H164: 三废处理 | I164: 116.6 | J164: 0. | K164: -8.199999999999999e-003 | L164: 12.9 | M164: -1.15e-002 | N164: 5.4 | O164: 1.1000000000000001e-002 | P164: 112.3 | Q164: 12.2 | R164: 2.63 | S164: 105.74 | T164: 0.10300000000000001 | U164: 转股中 | V164: 3.79年 | W164: 1.79年 | X164: 8.199999999999999e-002 | Y164: 8.6999999999999994e-002 | Z164: 4.3 | AA164: 52 | AB164: -1.e-002 | AC164: -1.5800000000000002e-002 | AD164: -6.2699999999999992e-002 | AE164: -6.5199999999999994e-002 | AF164: 91.17 | AG164: 89.25 | AH164: 0.71 | AI164: AA- | AJ164: 6.3700000000000007e-002 | AK164: =I164+100*T164 -> 126.89999999999999 | AL164: 127.5 | AM164: 88 | AN164: 36.3 | AO164: 99 | AP164: 5.0000000000000001e-003 | AQ164: 24 | AR164: 博世转债!
A165: 171 | B165: 好客转债 | C165: 113542 | D165: 43700. | E165: 好莱客 | F165: 603898 | G165: 其他 | H165: 家居用品 | I165: 120.76 | J165: 4.5999999999999999e-003 | K165: -5.0000000000000001e-003 | L165: 17.48 | M165: -5.9999999999999995e-004 | N165: 11 | O165: 1.4999999999999999e-002 | P165: 114.9 | Q165: 16.27 | R165: 2.32 | S165: 107.44 | T165: 0.124 | U165: 转股中 | V165: 4.87年 | W165: 2.87年 | X165: 0.111 | Y165: 0.12 | Z165: 6 | AA165: 54 | AB165: -1.03e-002 | AC165: -1.5700000000000002e-002 | AD165: -5.0300000000000004e-002 | AE165: -5.2300000000000006e-002 | AF165: 91.19 | AG165: 94.1 | AH165: 0.66 | AI165: AA | AJ165: 4.2699999999999995e-002 | AK165: =I165+100*T165 -> 133.16 | AL165: 134.1 | AM165: 155 | AN165: 40 | AO165: 140 | AP165: -4.2000000000000003e-002 | AQ165: 19 | AR165: 好客转债
A166: 80 | B166: 华统转债 | C166: 128106 | D166: 43959. | E166: 华统股份 | F166: 2840 | G166: 农业 | H166: 农产品加 | I166: 119.914 | J166: 3.0000000000000001e-003 | K166: 5.9999999999999995e-004 | L166: 10.51 | M166: 4.7999999999999996e-003 | N166: 3.4 | O166: 5.0000000000000001e-003 | P166: 113.2 | Q166: 9.39 | R166: 1.78 | S166: 111.93 | T166: 7.0999999999999994e-002 | U166: 27天 | V166: 5.56年 | W166: 3.56年 | X166: 0.11699999999999999 | Y166: 0.13100000000000001 | Z166: 5.5 | AA166: 47 | AB166: -1.0500000000000001e-002 | AC166: -1.47e-002 | AD166: -3.8599999999999995e-002 | AE166: -4.0399999999999998e-002 | AF166: 88.25 | AG166: 89.2 | AH166: 0.75 | AI166: AA | AJ166: 4.4699999999999997e-002 | AK166: =I166+100*T166 -> 127.014 | AL166: 127.9 | AM166: 95 | AN166: 38.7 | AO166: 122 | AP166: -8.0000000000000002e-002 | AQ166: 8 | AR166: 华统转债
A167: 62 | B167: 家悦转债 | C167: 113584 | D167: 44006. | E167: 家家悦 | F167: 603708 | G167: 商业零售 | H167: 超市 | I167: 122.37 | J167: -2.0000000000000001e-004 | K167: 1.1999999999999999e-003 | L167: 36.81 | M167: 1.6000000000000001e-003 | N167: 6.2 | O167: 8.0000000000000002e-003 | P167: 115.3 | Q167: 37.97 | R167: 7.72 | S167: 96.94 | T167: 0.26200000000000001 | U167: 2月24天 | V167: 5.71年 | W167: 3.71年 | X167: 2.8999999999999998e-002 | Y167: 2.7999999999999997e-002 | Z167: 6.5 | AA167: 224 | AB167: -1.06e-002 | AC167: -1.52e-002 | AD167: -4.1900000000000007e-002 | AE167: -4.3700000000000003e-002 | AF167: 87.76 | AG167: 90.26 | AH167: 0.6 | AI167: AA | AJ167: 4.4699999999999997e-002 | AK167: =I167+100*T167 -> 148.56999999999999 | AL167: 147.8 | AM167: 240 | AN167: 57.5 | AO167: 238 | AP167: -8.1000000000000003e-002 | AQ167: 3 | AR167: 家悦转债
A168: 263 | B168: 蒙电转债! | C168: 110041 | D168: 43109. | E168: 内蒙华电 | F168: 600863 | G168: 能源电力 | H168: 电力供应 | I168: 114.22 | J168: 2.3999999999999998e-003 | K168: -4.4000000000000003e-003 | L168: 2.69 | M168: -3.7000000000000002e-003 | N168: 1.9 | O168: 1.e-003 | P168: 110.3 | Q168: 2.69 | R168: 1.36 | S168: 100 | T168: 0.14199999999999999 | U168: 转股中 | V168: 3.26年 | W168: 1.26年 | X168: 0.12 | Y168: 0.12 | Z168: 19 | AA168: 156 | AB168: -1.09e-002 | AC168: -1.67e-002 | AD168: -7.1900000000000006e-002 | AE168: -7.5399999999999995e-002 | AF168: 97.57 | AG168: 98.04 | AH168: 0.55 | AI168: AAA | AJ168: 3.7699999999999997e-002 | AK168: =I168+100*T168 -> 128.41999999999999 | AL168: 128.4 | AM168: 99 | AN168: 30.4 | AO168: 37 | AP168: 2.1000000000000001e-002 | AQ168: 8 | AR168: 蒙电转债!
A169: 64 | B169: 今天转债 | C169: 123051 | D169: 44012. | E169: 今天国际 | F169: 300532 | G169: 计算机及 | H169: 软件开发 | I169: 130.57 | J169: -1.0500000000000001e-002 | K169: 9.1000000000000004e-003 | L169: 12.29 | M169: -1.6000000000000001e-003 | N169: 17 | O169: 4.4999999999999998e-002 | P169: 122.8 | Q169: 8.8 | R169: 4.19 | S169: 139.66 | T169: -6.5000000000000002e-002 | U169: 2月22天 | V169: 5.71年 | W169: 3.71年 | X169: 8.3000000000000004e-002 | Y169: 0.11599999999999999 | Z169: 2.8 | AA169: 34 | AB169: -1.09e-002 | AC169: -1.7500000000000002e-002 | AD169: -5.5999999999999994e-002 | AE169: -5.8099999999999999e-002 | AF169: 78.93 | AG169: 81.36 | AH169: 0.9 | AI169: A+ | AJ169: 7.6700000000000004e-002 | AK169: =I169+100*T169 -> 124.06999999999999 | AL169: 121.5 | AM169: 38 | AN169: 40.1 | AO169: 141 | AP169: 2.e-002 | AQ169: 11 | AR169: 今天转债
A170: 10 | B170: 赣锋转2 | C170: 128126 | D170: 44082. | E170: 赣锋锂业 | F170: 2460 | G170: 有色金属 | H170: 小金属 | I170: 118.51 | J170: 8.6e-003 | K170: 1.37e-002 | L170: 55.8 | M170: 4.0099999999999997e-002 | N170: 102 | O170: 4.0999999999999995e-002 | P170: 111.1 | Q170: 61.15 | R170: 8.97 | S170: 91.25 | T170: 0.29899999999999999 | U170: 4月26天 | V170: 5.88年 | W170: 3.88年 | X170: 2.8999999999999998e-002 | Y170: 2.7000000000000003e-002 | Z170: 21 | AA170: 721 | AB170: -1.11e-002 | AC170: -1.4499999999999999e-002 | AD170: -3.4599999999999999e-002 | AE170: -3.5900000000000001e-002 | AF170: 86.28 | AG170: 86.24 | AH170: 0.56 | AI170: AA | AJ170: 4.4699999999999997e-002 | AK170: =I170+100*T170 -> 148.41 | AL170: 145.8 | AM170: 236 | AN170: 59.5 | AO170: 241 | AP170: 9.8000000000000004e-002 | AQ170: 5 | AR170: 赣锋转2
A171: 206 | B171: 拓邦转债 | C171: 128058 | D171: 43563. | E171: 拓邦股份 | F171: 2139 | G171: 电子 | H171: 电子产品 | I171: 128.8 | J171: 7.4000000000000003e-003 | K171: 3.8e-003 | L171: 6.97 | M171: 1.46e-002 | N171: 2.1 | O171: 3.0000000000000001e-003 | P171: 122.6 | Q171: 5.47 | R171: 2.78 | S171: 127.42 | T171: 1.1000000000000001e-002 | U171: 转股中 | V171: 4.46年 | W171: 2.46年 | X171: 7.9000000000000001e-002 | Y171: 0.10099999999999999 | Z171: 5.7 | AA171: 72 | AB171: -1.1299999999999999e-002 | AC171: -1.9699999999999999e-002 | AD171: -7.7199999999999991e-002 | AE171: -8.0100000000000005e-002 | AF171: 93.76 | AG171: 102.21 | AH171: 0.77 | AI171: AA | AJ171: 4.2699999999999995e-002 | AK171: =I171+100*T171 -> 129.90000000000001 | AL171: 130.2 | AM171: 119 | AN171: 28 | AO171: 21 | AP171: 0. | AQ171: 20 | AR171: 拓邦转债
A172: 172 | B172: 荣晟转债! | C172: 113541 | D172: 43690. | E172: 荣晟环保 | F172: 603165 | G172: 造纸包装 | H172: 包装用纸 | I172: 121.43 | J172: 3.5999999999999999e-003 | K172: -1.e-004 | L172: 14.09 | M172: 4.3e-003 | N172: 17 | O172: 4.2000000000000003e-002 | P172: 115 | Q172: 11.54 | R172: 2.43 | S172: 122.1 | T172: -5.0000000000000001e-003 | U172: 转股中 | V172: 4.84年 | W172: 2.84年 | X172: 9.3000000000000013e-002 | Y172: 0.114 | Z172: 3.3 | AA172: 35 | AB172: -1.1399999999999999e-002 | AC172: -1.6799999999999999e-002 | AD172: -5.2199999999999996e-002 | AE172: -5.4199999999999998e-002 | AF172: 86.11 | AG172: 85.79 | AH172: 0.83 | AI172: AA- | AJ172: 6.3700000000000007e-002 | AK172: =I172+100*T172 -> 120.93000000000001 | AL172: 120.8 | AM172: 36 | AN172: 34.7 | AO172: 77 | AP172: 1.7000000000000001e-002 | AQ172: 50 | AR172: 荣晟转债!
A173: 13 | B173: 法兰转债 | C173: 113598 | D173: 44068. | E173: 法兰泰克 | F173: 603966 | G173: 机械装备 | H173: 工程机械 | I173: 129.49 | J173: 1.9099999999999999e-002 | K173: 3.1800000000000002e-002 | L173: 17.07 | M173: 6.0899999999999996e-002 | N173: 20 | O173: 4.7e-002 | P173: 121.2 | Q173: 13.88 | R173: 3.37 | S173: 122.98 | T173: 5.2999999999999999e-002 | U173: 4月20天 | V173: 5.86年 | W173: 3.86年 | X173: 9.1999999999999998e-002 | Y173: 0.113 | Z173: 3.3 | AA173: 36 | AB173: -1.1399999999999999e-002 | AC173: -1.7500000000000002e-002 | AD173: -5.3200000000000004e-002 | AE173: -5.4900000000000004e-002 | AF173: 80.78 | AG173: 84.1 | AH173: 0.84 | AI173: AA- | AJ173: 6.5700000000000008e-002 | AK173: =I173+100*T173 -> 134.79000000000002 | AL173: 136 | AM173: 171 | AN173: 51.9 | AO173: 215 | AP173: -3.1e-002 | AQ173: 4 | AR173: 法兰转债
A174: 21 | B174: 国投转债 | C174: 110073 | D174: 44063. | E174: 国投资本 | F174: 600061 | G174: 金融 | H174: 证券行业 | I174: 118.11 | J174: 1.41e-002 | K174: 1.5600000000000001e-002 | L174: 14.91 | M174: 4.8499999999999995e-002 | N174: 318 | O174: 3.4000000000000002e-002 | P174: 110.5 | Q174: 15.25 | R174: 1.55 | S174: 97.77 | T174: 0.20800000000000002 | U174: 4月15天 | V174: 5.84年 | W174: 无权 | X174: 0.127 | Y174: 0.124 | Z174: 80 | AA174: 630 | AB174: -1.15e-002 | AC174: -1.47e-002 | AD174: 无权 | AE174: 无权 | AF174: 无权 | AG174: 88.25 | AH174: 0.61 | AI174: AAA | AJ174: 3.9699999999999999e-002 | AK174: =I174+100*T174 -> 138.91 | AL174: 138.4 | AM174: 192 | AN174: 50.2 | AO174: 207 | AP174: 6.0000000000000001e-003 | AQ174: 19 | AR174: 国投转债
A175: 247 | B175: 华通转债! | C175: 128040 | D175: 43294. | E175: 华通医药 | F175: 2758 | G175: 医药 | H175: 医药商业 | I175: 117.381 | J175: 2.3999999999999998e-003 | K175: 8.5000000000000006e-003 | L175: 11.24 | M175: 1.72e-002 | N175: 1.5 | O175: 6.0000000000000001e-003 | P175: 112.3 | Q175: 11.29 | R175: 3.8 | S175: 99.56 | T175: 0.17899999999999999 | U175: 转股中 | V175: 3.73年 | W175: 1.73年 | X175: 9.4e-002 | Y175: 9.4e-002 | Z175: 2.2 | AA175: 24 | AB175: -1.2e-002 | AC175: -1.7899999999999999e-002 | AD175: -6.7799999999999999e-002 | AE175: -7.0400000000000004e-002 | AF175: 91.49 | AG175: 89.56 | AH175: 0.63 | AI175: AA- | AJ175: 6.3700000000000007e-002 | AK175: =I175+100*T175 -> 135.28100000000001 | AL175: 135.2 | AM175: 163 | AN175: 43.7 | AO175: 167 | AP175: -1.2e-002 | AQ175: 30 | AR175: 华通转债!
A176: 248 | B176: 三力转债! | C176: 128039 | D176: 43280. | E176: 三 力 士 | F176: 2224 | G176: 机械装备 | H176: 专用设备 | I176: 115.08 | J176: 1.1000000000000001e-003 | K176: 7.3000000000000001e-003 | L176: 6.25 | M176: 1.1299999999999999e-002 | N176: 2.4 | O176: 1.e-002 | P176: 109.8 | Q176: 5.81 | R176: 1.98 | S176: 107.57 | T176: 7.0000000000000007e-002 | U176: 转股中 | V176: 3.72年 | W176: 1.72年 | X176: 4.4999999999999998e-002 | Y176: 4.8000000000000001e-002 | Z176: 2 | AA176: 46 | AB176: -1.2800000000000001e-002 | AC176: -1.7600000000000001e-002 | AD176: -5.9699999999999996e-002 | AE176: -6.2100000000000002e-002 | AF176: 91.36 | AG176: 87.63 | AH176: 0.75 | AI176: AA- | AJ176: 6.3700000000000007e-002 | AK176: =I176+100*T176 -> 122.08 | AL176: 122.6 | AM176: 49 | AN176: 31.2 | AO176: 42 | AP176: -1.7000000000000001e-002 | AQ176: 19 | AR176: 三力转债!
A177: 47 | B177: 雪榕转债 | C177: 123056 | D177: 44036. | E177: 雪榕生物 | F177: 300511 | G177: 农业 | H177: 种植业 | I177: 130.419 | J177: 6.9999999999999993e-003 | K177: -3.0000000000000001e-003 | L177: 15.63 | M177: 4.5000000000000005e-003 | N177: 24 | O177: 3.1e-002 | P177: 121.1 | Q177: 11.89 | R177: 3.73 | S177: 131.46 | T177: -8.0000000000000002e-003 | U177: 3月17天 | V177: 5.76年 | W177: 3.76年 | X177: 8.5000000000000006e-002 | Y177: 0.111 | Z177: 5.9 | AA177: 69 | AB177: -1.3000000000000001e-002 | AC177: -1.9099999999999999e-002 | AD177: -5.6399999999999999e-002 | AE177: -5.8200000000000002e-002 | AF177: 81.22 | AG177: 84.56 | AH177: 0.88 | AI177: AA- | AJ177: 6.5700000000000008e-002 | AK177: =I177+100*T177 -> 129.619 | AL177: 129.4 | AM177: 111 | AN177: 44.8 | AO177: 174 | AP177: -9.6999999999999989e-002 | AQ177: 9 | AR177: 雪榕转债
A178: 14 | B178: 华阳转债 | C178: 128125 | D178: 44064. | E178: 华阳国际 | F178: 2949 | G178: 建筑 | H178: 建筑工程 | I178: 128.11 | J178: 8.6e-003 | K178: -1.7000000000000001e-002 | L178: 28.57 | M178: -1.0700000000000001e-002 | N178: 5.2 | O178: 9.0000000000000011e-003 | P178: 118.5 | Q178: 25.79 | R178: 4.87 | S178: 110.78 | T178: 0.156 | U178: 4月19天 | V178: 5.86年 | W178: 3.86年 | X178: 8.0000000000000002e-002 | Y178: 8.900000000000001e-002 | Z178: 4.5 | AA178: 56 | AB178: -1.34e-002 | AC178: -1.8799999999999997e-002 | AD178: -5.1200000000000002e-002 | AE178: -5.2900000000000003e-002 | AF178: 80.56 | AG178: 82.2 | AH178: 0.78 | AI178: AA- | AJ178: 6.5700000000000008e-002 | AK178: =I178+100*T178 -> 143.71000000000001 | AL178: 145.4 | AM178: 233 | AN178: 63.2 | AO178: 252 | AP178: -9.4e-002 | AQ178: 2 | AR178: 华阳转债
A179: 178 | B179: 文灿转债! | C179: 113537 | D179: 43651. | E179: 文灿股份 | F179: 603348 | G179: 汽车 | H179: 零部件制 | I179: 129.35 | J179: -3.0999999999999999e-003 | K179: -1.24e-002 | L179: 24.98 | M179: -1.8500000000000003e-002 | N179: 22 | O179: 3.2000000000000001e-002 | P179: 121.5 | Q179: 19.43 | R179: 2.54 | S179: 128.56 | T179: 6.0000000000000001e-003 | U179: 转股中 | V179: 4.72年 | W179: 2.72年 | X179: 8.900000000000001e-002 | Y179: 0.114 | Z179: 5.3 | AA179: 60 | AB179: -1.3500000000000002e-002 | AC179: -2.1000000000000001e-002 | AD179: -7.22e-002 | AE179: -7.4800000000000005e-002 | AF179: 87.54 | AG179: 91.41 | AH179: 0.84 | AI179: AA- | AJ179: 6.3700000000000007e-002 | AK179: =I179+100*T179 -> 129.94999999999999 | AL179: 130.1 | AM179: 117 | AN179: 38.7 | AO179: 123 | AP179: 1.7000000000000001e-002 | AQ179: 27 | AR179: 文灿转债!
A180: 49 | B180: 润达转债 | C180: 113588 | D180: 44025. | E180: 润达医疗 | F180: 603108 | G180: 医药 | H180: 医疗器械 | I180: 123.29 | J180: -1.6000000000000001e-003 | K180: 5.0000000000000001e-003 | L180: 13.6 | M180: 5.1999999999999998e-003 | N180: 7.2 | O180: 1.1000000000000001e-002 | P180: 114.2 | Q180: 13.36 | R180: 2.74 | S180: 101.8 | T180: 0.21100000000000002 | U180: 3月5天 | V180: 5.74年 | W180: 3.74年 | X180: 7.0000000000000007e-002 | Y180: 7.0999999999999994e-002 | Z180: 5.5 | AA180: 79 | AB180: -1.3500000000000002e-002 | AC180: -1.78e-002 | AD180: -4.36e-002 | AE180: -4.53e-002 | AF180: 87.53 | AG180: 89.25 | AH180: 0.66 | AI180: AA | AJ180: 4.4699999999999997e-002 | AK180: =I180+100*T180 -> 144.39000000000001 | AL180: 144.8 | AM180: 228 | AN180: 55.5 | AO180: 230 | AP180: -6.7000000000000004e-002 | AQ180: 6 | AR180: 润达转债
A181: 77 | B181: 聚飞转债 | C181: 123050 | D181: 43966. | E181: 聚飞光电 | F181: 300303 | G181: 电子 | H181: LED制 | I181: 133.838 | J181: 4.6999999999999993e-003 | K181: -4.6999999999999993e-003 | L181: 7.07 | M181: 0. | N181: 19 | O181: 2.e-002 | P181: 124.2 | Q181: 5.18 | R181: 3.84 | S181: 136.49 | T181: -1.9e-002 | U181: 31天 | V181: 5.57年 | W181: 3.57年 | X181: 7.8e-002 | Y181: 0.106 | Z181: 7.1 | AA181: 90 | AB181: -1.3600000000000001e-002 | AC181: -2.07e-002 | AD181: -6.5700000000000008e-002 | AE181: -6.7500000000000004e-002 | AF181: 82.32 | AG181: 87.81 | AH181: 0.88 | AI181: AA- | AJ181: 6.5700000000000008e-002 | AK181: =I181+100*T181 -> 131.93799999999999 | AL181: 131.2 | AM181: 131 | AN181: 43.4 | AO181: 165 | AP181: -1.4999999999999999e-002 | AQ181: 11 | AR181: 聚飞转债
A182: 196 | B182: 精测转债!! | C182: 123025 | D182: 43574. | E182: 精测电子 | F182: 300567 | G182: 电子 | H182: 液晶显示 | I182: 124.928 | J182: -3.8e-003 | K182: 1.15e-002 | L182: 54.8 | M182: 1.0500000000000001e-002 | N182: 16 | O182: 4.2000000000000003e-002 | P182: 117.3 | Q182: 49.95 | R182: 9.48 | S182: 109.71 | T182: 0.13900000000000001 | U182: 转股中 | V182: 4.52年 | W182: 2.52年 | X182: 2.3e-002 | Y182: 2.5000000000000001e-002 | Z182: 3.1 | AA182: 135 | AB182: -1.41e-002 | AC182: -2.07e-002 | AD182: -6.7799999999999999e-002 | AE182: -7.0099999999999996e-002 | AF182: 87.94 | AG182: 89.26 | AH182: 0.74 | AI182: AA- | AJ182: 6.3700000000000007e-002 | AK182: =I182+100*T182 -> 138.828 | AL182: 140.1 | AM182: 205 | AN182: 50.9 | AO182: 210 | AP182: -5.4000000000000006e-002 | AQ182: 18 | AR182: 精测转债!!
A183: 128 | B183: 联得转债! | C183: 123038 | D183: 43852. | E183: 联得装备 | F183: 300545 | G183: 机械装备 | H183: 专用设备 | I183: 128.11 | J183: -5.0000000000000001e-004 | K183: 2.0000000000000001e-004 | L183: 32.02 | M183: -2.9999999999999997e-004 | N183: 4.2 | O183: 2.2000000000000002e-002 | P183: 119.1 | Q183: 25.29 | R183: 6.57 | S183: 126.61 | T183: 1.2e-002 | U183: 转股中 | V183: 5.27年 | W183: 3.27年 | X183: 3.2000000000000001e-002 | Y183: 4.0999999999999995e-002 | Z183: 1.5 | AA183: 47 | AB183: -1.41e-002 | AC183: -2.0199999999999999e-002 | AD183: -5.8700000000000002e-002 | AE183: -6.0899999999999996e-002 | AF183: 81.26 | AG183: 81.48 | AH183: 0.88 | AI183: A+ | AJ183: 7.6700000000000004e-002 | AK183: =I183+100*T183 -> 129.31 | AL183: 129.6 | AM183: 114 | AN183: 48.1 | AO183: 194 | AP183: -4.2999999999999997e-002 | AQ183: 14 | AR183: 联得转债!
A184: 268 | B184: 铁汉转债! | C184: 123004 | D184: 43126. | E184: 铁汉生态 | F184: 300197 | G184: 城市公用 | H184: 生态环境 | I184: 114.95 | J184: 7.9000000000000008e-003 | K184: -3.2400000000000005e-002 | L184: 4.25 | M184: -3.6299999999999999e-002 | N184: 124 | O184: 0.13400000000000001 | P184: 109.8 | Q184: 3.98 | R184: 1.91 | S184: 106.78 | T184: 7.5999999999999998e-002 | U184: 转股中 | V184: 3.25年 | W184: 1.25年 | X184: 8.1000000000000003e-002 | Y184: 8.5999999999999993e-002 | Z184: 8 | AA184: 100 | AB184: -1.43e-002 | AC184: -1.9799999999999998e-002 | AD184: -7.8299999999999995e-002 | AE184: -8.14e-002 | AF184: 96.72 | AG184: 96.13 | AH184: 0.68 | AI184: AA | AJ184: 4.2699999999999995e-002 | AK184: =I184+100*T184 -> 122.55 | AL184: 123.1 | AM184: 55 | AN184: 26.4 | AO184: 15 | AP184: 0.151 | AQ184: 35 | AR184: 铁汉转债!
A185: 144 | B185: 烽火转债 | C185: 110062 | D185: 43824. | E185: 烽火通信 | F185: 600498 | G185: 通信互联 | H185: 通信设备 | I185: 119.46 | J185: 4.0999999999999995e-003 | K185: 6.0000000000000001e-003 | L185: 24.72 | M185: 1.7299999999999999e-002 | N185: 4.1 | O185: 1.e-003 | P185: 111 | Q185: 25.65 | R185: 2.78 | S185: 96.37 | T185: 0.23999999999999999 | U185: 转股中 | V185: 5.20年 | W185: 3.20年 | X185: 0.107 | Y185: 0.10300000000000001 | Z185: 31 | AA185: 289 | AB185: -1.43e-002 | AC185: -1.8100000000000002e-002 | AD185: -4.2000000000000003e-002 | AE185: -4.3899999999999995e-002 | AF185: 90.89 | AG185: 91 | AH185: 0.59 | AI185: AAA | AJ185: 3.9699999999999999e-002 | AK185: =I185+100*T185 -> 143.45999999999998 | AL185: 142.5 | AM185: 218 | AN185: 51.5 | AO185: 212 | AP185: -2.6000000000000002e-002 | AQ185: 20 | AR185: 烽火转债
A186: 212 | B186: 中天转债! | C186: 110051 | D186: 43546. | E186: 中天科技 | F186: 600522 | G186: 通信互联 | H186: 通信设备 | I186: 121.54 | J186: 1.1200000000000002e-002 | K186: -3.2000000000000002e-003 | L186: 10.88 | M186: 1.21e-002 | N186: 6.1 | O186: 1.e-003 | P186: 113.9 | Q186: 10.09 | R186: 1.56 | S186: 107.83 | T186: 0.127 | U186: 转股中 | V186: 4.44年 | W186: 2.44年 | X186: 0.11900000000000001 | Y186: 0.128 | Z186: 40 | AA186: 334 | AB186: -1.4800000000000001e-002 | AC186: -2.0299999999999999e-002 | AD186: -6.0599999999999994e-002 | AE186: -6.2899999999999998e-002 | AF186: 93.27 | AG186: 95.74 | AH186: 0.66 | AI186: AA+ | AJ186: 4.07e-002 | AK186: =I186+100*T186 -> 134.24000000000001 | AL186: 135.3 | AM186: 164 | AN186: 39.5 | AO186: 133 | AP186: -1.4999999999999999e-002 | AQ186: 29 | AR186: 中天转债!
A187: 124 | B187: 正裕转债! | C187: 113561 | D187: 43871. | E187: 正裕工业 | F187: 603089 | G187: 汽车 | H187: 零部件制 | I187: 128.33 | J187: -1.3300000000000001e-002 | K187: -5.0000000000000001e-004 | L187: 13.17 | M187: -1.5700000000000002e-002 | N187: 6 | O187: 2.5000000000000001e-002 | P187: 118.5 | Q187: 10.23 | R187: 3.51 | S187: 128.74 | T187: -3.0000000000000001e-003 | U187: 转股中 | V187: 5.28年 | W187: 3.28年 | X187: 6.8000000000000005e-002 | Y187: 8.6999999999999994e-002 | Z187: 1.9 | AA187: 27 | AB187: -1.5300000000000001e-002 | AC187: -2.1299999999999999e-002 | AD187: -5.8099999999999999e-002 | AE187: -6.0400000000000002e-002 | AF187: 81.43 | AG187: 81.03 | AH187: 0.88 | AI187: A+ | AJ187: 7.6700000000000004e-002 | AK187: =I187+100*T187 -> 128.03 | AL187: 127.9 | AM187: 96 | AN187: 46.5 | AO187: 186 | AP187: 1.e-002 | AQ187: 30 | AR187: 正裕转债!
A188: 102 | B188: 华安转债! | C188: 110067 | D188: 43930. | E188: 华安证券 | F188: 600909 | G188: 金融 | H188: 证券行业 | I188: 120.69 | J188: 1.67e-002 | K188: 1.5900000000000001e-002 | L188: 8.41 | M188: 5.5199999999999999e-002 | N188: 37 | O188: 1.1000000000000001e-002 | P188: 110.5 | Q188: 8.67 | R188: 2.25 | S188: 97 | T188: 0.24399999999999999 | U188: 转股中 | V188: 5.48年 | W188: 无权 | X188: 9.1999999999999998e-002 | Y188: 8.900000000000001e-002 | Z188: 28 | AA188: 305 | AB188: -1.6200000000000003e-002 | AC188: -1.9599999999999999e-002 | AD188: 无权 | AE188: 无权 | AF188: 无权 | AG188: 89.52 | AH188: 0.59 | AI188: AAA | AJ188: 3.9699999999999999e-002 | AK188: =I188+100*T188 -> 145.09 | AL188: 144.4 | AM188: 226 | AN188: 54.9 | AO188: 226 | AP188: -1.3999999999999999e-002 | AQ188: 26 | AR188: 华安转债!
A189: 111 | B189: 桐20转债! | C189: 113032 | D189: 43910. | E189: 桐昆股份 | F189: 601233 | G189: 服装纺织 | H189: 纺织行业 | I189: 123.52 | J189: 2.2000000000000001e-003 | K189: 9.8999999999999991e-003 | L189: 15.51 | M189: 1.7000000000000001e-002 | N189: 17 | O189: 6.0000000000000001e-003 | P189: 113.1 | Q189: 14.35 | R189: 1.48 | S189: 108.08 | T189: 0.14300000000000002 | U189: 转股中 | V189: 5.45年 | W189: 3.45年 | X189: 8.0000000000000002e-002 | Y189: 8.6999999999999994e-002 | Z189: 23 | AA189: 287 | AB189: -1.6299999999999999e-002 | AC189: -2.06e-002 | AD189: -4.7800000000000002e-002 | AE189: -4.9599999999999998e-002 | AF189: 89.18 | AG189: 90.44 | AH189: 0.71 | AI189: AA+ | AJ189: 4.2699999999999995e-002 | AK189: =I189+100*T189 -> 137.81999999999999 | AL189: 139 | AM189: 196 | AN189: 48.5 | AO189: 198 | AP189: -2.e-002 | AQ189: 20 | AR189: 桐20转债!
A190: 63 | B190: 楚江转债 | C190: 128109 | D190: 44005. | E190: 楚江新材 | F190: 2171 | G190: 有色金属 | H190: 铜金属 | I190: 126.78 | J190: 2.2400000000000003e-002 | K190: -1.e-004 | L190: 9.99 | M190: 2.9900000000000003e-002 | N190: 56 | O190: 2.4e-002 | P190: 115.3 | Q190: 8.73 | R190: 2.49 | S190: 114.43 | T190: 0.10800000000000001 | U190: 2月22天 | V190: 5.71年 | W190: 3.71年 | X190: 0.13699999999999998 | Y190: 0.157 | Z190: 18 | AA190: 133 | AB190: -1.6799999999999999e-002 | AC190: -2.1400000000000002e-002 | AD190: -5.0700000000000002e-002 | AE190: -5.2499999999999998e-002 | AF190: 87.77 | AG190: 90.27 | AH190: 0.75 | AI190: AA | AJ190: 4.4699999999999997e-002 | AK190: =I190+100*T190 -> 137.58000000000001 | AL190: 139.1 | AM190: 198 | AN190: 48.9 | AO190: 200 | AP190: 7.2999999999999995e-002 | AQ190: 5 | AR190: 楚江转债
A191: 117 | B191: 奥瑞转债! | C191: 128096 | D191: 43906. | E191: 奥瑞金 | F191: 2701 | G191: 造纸包装 | H191: 包装材料 | I191: 126.9 | J191: -1.4000000000000002e-003 | K191: 0. | L191: 5.86 | M191: -1.7000000000000001e-003 | N191: 44 | O191: 3.2000000000000001e-002 | P191: 116 | Q191: 4.64 | R191: 2.39 | S191: 126.29 | T191: 5.0000000000000001e-003 | U191: 转股中 | V191: 5.40年 | W191: 3.40年 | X191: 7.8e-002 | Y191: 9.9000000000000005e-002 | Z191: 11 | AA191: 138 | AB191: -1.6899999999999998e-002 | AC191: -2.2000000000000002e-002 | AD191: -5.4100000000000002e-002 | AE191: -5.62e-002 | AF191: 90.07 | AG191: 93.05 | AH191: 0.81 | AI191: AA+ | AJ191: 4.2699999999999995e-002 | AK191: =I191+100*T191 -> 127.40000000000001 | AL191: 127.5 | AM191: 90 | AN191: 34.5 | AO191: 76 | AP191: 5.4000000000000006e-002 | AQ191: 23 | AR191: 奥瑞转债!
A192: 185 | B192: 雅化转债! | C192: 128065 | D192: 43595. | E192: 雅化集团 | F192: 2497 | G192: 化工 | H192: 化工 | I192: 119.9 | J192: -1.1999999999999999e-003 | K192: -8.9999999999999998e-004 | L192: 9.59 | M192: -3.0999999999999999e-003 | N192: 12 | O192: 1.2e-002 | P192: 110.9 | Q192: 8.95 | R192: 3.24 | S192: 107.15 | T192: 0.11900000000000001 | U192: 转股中 | V192: 4.57年 | W192: 2.57年 | X192: 8.6999999999999994e-002 | Y192: 9.3000000000000013e-002 | Z192: 8 | AA192: 92 | AB192: -1.72e-002 | AC192: -2.1499999999999998e-002 | AD192: -5.3099999999999994e-002 | AE192: -5.5300000000000002e-002 | AF192: 92.31 | AG192: 91.96 | AH192: 0.7 | AI192: AA | AJ192: 4.2699999999999995e-002 | AK192: =I192+100*T192 -> 131.80000000000001 | AL192: 132.6 | AM192: 145 | AN192: 40.3 | AO192: 143 | AP192: 1.4999999999999999e-002 | AQ192: 22 | AR192: 雅化转债!
A193: 51 | B193: 正邦转债 | C193: 128114 | D193: 44027. | E193: 正邦科技 | F193: 2157 | G193: 农业 | H193: 畜牧业 | I193: 127.2 | J193: 6.7000000000000002e-003 | K193: -1.1000000000000001e-003 | L193: 18.81 | M193: 7.4999999999999997e-003 | N193: 62 | O193: 2.9999999999999999e-002 | P193: 115.3 | Q193: 16.09 | R193: 4 | S193: 116.9 | T193: 8.8000000000000009e-002 | U193: 3月5天 | V193: 5.74年 | W193: 3.74年 | X193: 3.4000000000000002e-002 | Y193: 4.0000000000000001e-002 | Z193: 16 | AA193: 473 | AB193: -1.7299999999999999e-002 | AC193: -2.1899999999999999e-002 | AD193: -5.1100000000000007e-002 | AE193: -5.28e-002 | AF193: 88.28 | AG193: 91.1 | AH193: 0.75 | AI193: AA+ | AJ193: 4.2699999999999995e-002 | AK193: =I193+100*T193 -> 136. | AL193: 137.5 | AM193: 184 | AN193: 46.4 | AO193: 185 | AP193: -0.16200000000000001 | AQ193: 8 | AR193: 正邦转债
A194: 76 | B194: 春秋转债 | C194: 113577 | D194: 43964. | E194: 春秋电子 | F194: 603890 | G194: 电子 | H194: 电子产品 | I194: 130.29 | J194: 1.18e-002 | K194: -2.9999999999999997e-004 | L194: 14.59 | M194: 1.32e-002 | N194: 7.8 | O194: 2.5000000000000001e-002 | P194: 118.2 | Q194: 11.06 | R194: 3.46 | S194: 131.92 | T194: -1.2e-002 | U194: 31天 | V194: 5.57年 | W194: 3.57年 | X194: 4.2999999999999997e-002 | Y194: 5.5999999999999994e-002 | Z194: 2.4 | AA194: 56 | AB194: -1.77e-002 | AC194: -2.3199999999999998e-002 | AD194: -5.8899999999999994e-002 | AE194: -6.08e-002 | AF194: 82.33 | AG194: 83.6 | AH194: 0.87 | AI194: AA- | AJ194: 6.5700000000000008e-002 | AK194: =I194+100*T194 -> 129.09 | AL194: 128.7 | AM194: 100 | AN194: 45.1 | AO194: 176 | AP194: -7.2999999999999995e-002 | AQ194: 8 | AR194: 春秋转债
A195: 293 | B195: 国贸转债! | C195: 110033 | D195: 42388. | E195: 厦门国贸 | F195: 600755 | G195: 交通运输 | H195: 交通运输 | I195: 112.25 | J195: 2.2000000000000001e-003 | K195: 5.1999999999999998e-003 | L195: 7.07 | M195: 2.0199999999999999e-002 | N195: 1.8 | O195: 1.e-003 | P195: 109.7 | Q195: 7.19 | R195: 0.93 | S195: 98.33 | T195: 0.14199999999999999 | U195: 转股中 | V195: 1.30年 | W195: 回售中 | X195: 9.3000000000000013e-002 | Y195: 9.0999999999999998e-002 | Z195: 12 | AA195: 131 | AB195: -1.78e-002 | AC195: -3.1300000000000001e-002 | AD195: 回售中 | AE195: 回售中 | AF195: 100.28 | AG195: 104.8 | AH195: 0.37 | AI195: AAA | AJ195: 3.6299999999999999e-002 | AK195: =I195+100*T195 -> 126.45 | AL195: 126.2 | AM195: 77 | AN195: 21.4 | AO195: 6 | AP195: -2.e-003 | AQ195: 18 | AR195: 国贸转债!
A196: 153 | B196: 天路转债! | C196: 110060 | D196: 43797. | E196: 西藏天路 | F196: 600326 | G196: 建筑 | H196: 水泥 | I196: 126.14 | J196: -2.e-003 | K196: 1.03e-002 | L196: 8.47 | M196: 1.0700000000000001e-002 | N196: 14 | O196: 1.6e-002 | P196: 115.3 | Q196: 7.16 | R196: 2.04 | S196: 118.3 | T196: 6.6000000000000003e-002 | U196: 转股中 | V196: 5年39天 | W196: 3年39天 | X196: 9.6000000000000002e-002 | Y196: 0.114 | Z196: 7.1 | AA196: 73 | AB196: -1.78e-002 | AC196: -2.3e-002 | AD196: -5.8400000000000001e-002 | AE196: -6.0400000000000002e-002 | AF196: 90.11 | AG196: 92.67 | AH196: 0.77 | AI196: AA | AJ196: 4.4699999999999997e-002 | AK196: =I196+100*T196 -> 132.74000000000001 | AL196: 134 | AM196: 153 | AN196: 41.3 | AO196: 152 | AP196: -0.111 | AQ196: 12 | AR196: 天路转债!
A197: 157 | B197: 英联转债! | C197: 128079 | D197: 43790. | E197: 英联股份 | F197: 2846 | G197: 造纸包装 | H197: 包装材料 | I197: 129.519 | J197: 4.0000000000000001e-003 | K197: 1.61e-002 | L197: 16.22 | M197: 2.0099999999999996e-002 | N197: 52 | O197: 0.26200000000000001 | P197: 117.9 | Q197: 13.41 | R197: 4.59 | S197: 120.95 | T197: 7.0999999999999994e-002 | U197: 转股中 | V197: 5年32天 | W197: 3年32天 | X197: 4.8000000000000001e-002 | Y197: 5.7999999999999996e-002 | Z197: 1.5 | AA197: 32 | AB197: -1.8700000000000001e-002 | AC197: -2.46e-002 | AD197: -6.5700000000000008e-002 | AE197: -6.7799999999999999e-002 | AF197: 82.07 | AG197: 81.67 | AH197: 1 | AI197: A+ | AJ197: 7.6700000000000004e-002 | AK197: =I197+100*T197 -> 136.619 | AL197: 138.1 | AM197: 188 | AN197: 56 | AO197: 234 | AP197: -4.8000000000000001e-002 | AQ197: 19 | AR197: 英联转债!
A198: 149 | B198: 川投转债 | C198: 110061 | D198: 43801. | E198: 川投能源 | F198: 600674 | G198: 能源电力 | H198: 水电 | I198: 122.14 | J198: 6.6e-003 | K198: -5.0000000000000001e-004 | L198: 10.12 | M198: 9.0000000000000011e-003 | N198: 2.9 | O198: 1.e-003 | P198: 111 | Q198: 9.58 | R198: 1.7 | S198: 105.64 | T198: 0.156 | U198: 转股中 | V198: 5年53天 | W198: 3年53天 | X198: 8.9999999999999997e-002 | Y198: 9.5000000000000001e-002 | Z198: 40 | AA198: 445 | AB198: -1.8700000000000001e-002 | AC198: -2.2499999999999999e-002 | AD198: -4.9200000000000001e-002 | AE198: -5.1100000000000007e-002 | AF198: 91.09 | AG198: 91.2 | AH198: 0.68 | AI198: AAA | AJ198: 3.9699999999999999e-002 | AK198: =I198+100*T198 -> 137.74000000000001 | AL198: 138.6 | AM198: 194 | AN198: 47.4 | AO198: 193 | AP198: 9.0000000000000011e-003 | AQ198: 15 | AR198: 川投转债
A199: 229 | B199: 张行转债 | C199: 128048 | D199: 43433. | E199: 张家港行 | F199: 2839 | G199: 金融 | H199: 银行行业 | I199: 123.01 | J199: 4.1999999999999997e-003 | K199: 1.04e-002 | L199: 6.15 | M199: 2.3300000000000001e-002 | N199: 1.1 | O199: 0. | P199: 113.9 | Q199: 5.76 | R199: 1.07 | S199: 106.77 | T199: 0.152 | U199: 转股中 | V199: 4年54天 | W199: 无权 | X199: 0.22500000000000001 | Y199: 0.23999999999999999 | Z199: 25 | AA199: 111 | AB199: -1.8799999999999997e-002 | AC199: -2.46e-002 | AD199: 无权 | AE199: 无权 | AF199: 无权 | AG199: 96.88 | AH199: 0.63 | AI199: AA+ | AJ199: 4.07e-002 | AK199: =I199+100*T199 -> 138.21000000000001 | AL199: 139.2 | AM199: 199 | AN199: 42.4 | AO199: 160 | AP199: -3.0000000000000001e-003 | AQ199: 14 | AR199: 张行转债
A200: 58 | B200: 寿仙转债 | C200: 113585 | D200: 44019. | E200: 寿仙谷 | F200: 603896 | G200: 医药 | H200: 中药 | I200: 131.3 | J200: 4.4000000000000003e-003 | K200: -4.4000000000000003e-003 | L200: 40.42 | M200: 0. | N200: 7.9 | O200: 1.7000000000000001e-002 | P200: 117.8 | Q200: 28.68 | R200: 4.95 | S200: 140.93 | T200: -6.8000000000000005e-002 | U200: 2月27天 | V200: 5.72年 | W200: 3.72年 | X200: 6.2e-002 | Y200: 8.6999999999999994e-002 | Z200: 3.6 | AA200: 58 | AB200: -1.9199999999999998e-002 | AC200: -2.4399999999999998e-002 | AD200: -5.8499999999999996e-002 | AE200: -6.0299999999999999e-002 | AF200: 81.55 | AG200: 82.51 | AH200: 0.92 | AI200: AA- | AJ200: 6.5700000000000008e-002 | AK200: =I200+100*T200 -> 124.50000000000001 | AL200: 121.7 | AM200: 41 | AN200: 39.2 | AO200: 129 | AP200: 4.0000000000000001e-003 | AQ200: 8 | AR200: 寿仙转债
A201: 139 | B201: 金牌转债! | C201: 113553 | D201: 43837. | E201: 金牌厨柜 | F201: 603180 | G201: 其他 | H201: 家居用品 | I201: 137.79 | J201: 2.1000000000000001e-002 | K201: 7.8000000000000005e-003 | L201: 60.66 | M201: 3.2500000000000001e-002 | N201: 11 | O201: 2.8999999999999998e-002 | P201: 124.6 | Q201: 44.14 | R201: 4.95 | S201: 137.43 | T201: 3.0000000000000001e-003 | U201: 转股中 | V201: 5.23年 | W201: 3.23年 | X201: 4.7e-002 | Y201: 6.5000000000000002e-002 | Z201: 2.8 | AA201: 59 | AB201: -1.9400000000000001e-002 | AC201: -2.7000000000000003e-002 | AD201: -8.0000000000000002e-002 | AE201: -8.199999999999999e-002 | AF201: 84.08 | AG201: 89.98 | AH201: 0.88 | AI201: AA- | AJ201: 6.5700000000000008e-002 | AK201: =I201+100*T201 -> 138.09 | AL201: 138.2 | AM201: 189 | AN201: 48.2 | AO201: 195 | AP201: 5.0000000000000001e-003 | AQ201: 14 | AR201: 金牌转债!
A202: 130 | B202: 淮矿转债! | C202: 110065 | D202: 43843. | E202: 淮北矿业 | F202: 600985 | G202: 煤炭 | H202: 煤炭开采 | I202: 122.82 | J202: 2.8799999999999999e-002 | K202: 2.35e-002 | L202: 10.9 | M202: 6.7599999999999993e-002 | N202: 37 | O202: 1.1000000000000001e-002 | P202: 111 | Q202: 9.33 | R202: 1.22 | S202: 116.83 | T202: 5.0999999999999997e-002 | U202: 转股中 | V202: 5.26年 | W202: 3.26年 | X202: 0.11699999999999999 | Y202: 0.13600000000000001 | Z202: 28 | AA202: 237 | AB202: -1.9400000000000001e-002 | AC202: -2.3099999999999999e-002 | AD202: -4.9100000000000005e-002 | AE202: -5.0900000000000001e-002 | AF202: 90.68 | AG202: 90.8 | AH202: 0.77 | AI202: AAA | AJ202: 3.9699999999999999e-002 | AK202: =I202+100*T202 -> 127.91999999999999 | AL202: 128.8 | AM202: 103 | AN202: 38 | AO202: 113 | AP202: 0.11199999999999999 | AQ202: 22 | AR202: 淮矿转债!
A203: 67 | B203: 蓝帆转债 | C203: 128108 | D203: 44001. | E203: 蓝帆医疗 | F203: 2382 | G203: 医药 | H203: 医疗器械 | I203: 126.877 | J203: 5.6999999999999993e-003 | K203: -1.e-004 | L203: 22.74 | M203: 6.6e-003 | N203: 346 | O203: 8.6999999999999994e-002 | P203: 113.3 | Q203: 17.79 | R203: 2.44 | S203: 127.82 | T203: -6.9999999999999993e-003 | U203: 2月15天 | V203: 5.69年 | W203: 4.69年 | X203: 0.14300000000000002 | Y203: 0.183 | Z203: 31 | AA203: 219 | AB203: -2.0099999999999996e-002 | AC203: -2.41e-002 | AD203: -3.7599999999999995e-002 | AE203: -3.9599999999999996e-002 | AF203: 85.71 | AG203: 88.78 | AH203: 0.83 | AI203: AA | AJ203: 4.4699999999999997e-002 | AK203: =I203+100*T203 -> 126.17699999999999 | AL203: 125.9 | AM203: 76 | AN203: 37.1 | AO203: 105 | AP203: -0.127 | AQ203: 17 | AR203: 蓝帆转债
A204: 258 | B204: 无锡转债! | C204: 110043 | D204: 43173. | E204: 无锡银行 | F204: 600908 | G204: 金融 | H204: 银行行业 | I204: 116.95 | J204: 4.1999999999999997e-003 | K204: 2.0799999999999999e-002 | L204: 5.87 | M204: 4.2599999999999999e-002 | N204: 28 | O204: 8.0000000000000002e-003 | P204: 109.1 | Q204: 5.79 | R204: 0.96 | S204: 101.38 | T204: 0.154 | U204: 转股中 | V204: 3.36年 | W204: 无权 | X204: 0.27600000000000002 | Y204: 0.28000000000000003 | Z204: 30 | AA204: 108 | AB204: -2.07e-002 | AC204: -2.5600000000000001e-002 | AD204: 无权 | AE204: 无权 | AF204: 无权 | AG204: 95.6 | AH204: 0.59 | AI204: AA+ | AJ204: 4.07e-002 | AK204: =I204+100*T204 -> 132.34999999999999 | AL204: 132.5 | AM204: 144 | AN204: 36.9 | AO204: 102 | AP204: 1.6e-002 | AQ204: 32 | AR204: 无锡转债!
A205: 71 | B205: 健友转债 | C205: 113579 | D205: 43973. | E205: 健友股份 | F205: 603707 | G205: 医药 | H205: 原料药 | I205: 128.87 | J205: 1.47e-002 | K205: -9.3999999999999986e-003 | L205: 43.99 | M205: 7.8000000000000005e-003 | N205: 5.8 | O205: 9.0000000000000011e-003 | P205: 114.2 | Q205: 42.05 | R205: 9.8 | S205: 104.61 | T205: 0.23199999999999998 | U205: 41天 | V205: 5.59年 | W205: 3.59年 | X205: 1.2e-002 | Y205: 1.3000000000000001e-002 | Z205: 5 | AA205: 411 | AB205: -2.18e-002 | AC205: -2.6099999999999998e-002 | AD205: -5.6600000000000004e-002 | AE205: -5.8299999999999998e-002 | AF205: 88.11 | AG205: 89.84 | AH205: 0.68 | AI205: AA | AJ205: 4.4699999999999997e-002 | AK205: =I205+100*T205 -> 152.06999999999999 | AL205: 153.1 | AM205: 252 | AN205: 63.3 | AO205: 253 | AP205: -6.4000000000000001e-002 | AQ205: 6 | AR205: 健友转债
A206: 25 | B206: 苏试转债 | C206: 123060 | D206: 44060. | E206: 苏试试验 | F206: 300416 | G206: 机械装备 | H206: 专用设备 | I206: 133.799 | J206: 4.0000000000000002e-004 | K206: 2.0000000000000001e-004 | L206: 26.9 | M206: 7.000000000000001e-004 | N206: 13 | O206: 3.1e-002 | P206: 117.6 | Q206: 23.86 | R206: 6.19 | S206: 112.74 | T206: 0.187 | U206: 4月10天 | V206: 5.84年 | W206: 3.84年 | X206: 5.7000000000000002e-002 | Y206: 6.4000000000000001e-002 | Z206: 3.1 | AA206: 55 | AB206: -2.23e-002 | AC206: -2.7300000000000001e-002 | AD206: -6.1699999999999998e-002 | AE206: -6.3399999999999998e-002 | AF206: 80.77 | AG206: 81.73 | AH206: 0.8 | AI206: AA- | AJ206: 6.5700000000000008e-002 | AK206: =I206+100*T206 -> 152.499 | AL206: 154.9 | AM206: 255 | AN206: 73.1 | AO206: 263 | AP206: -4.0000000000000001e-002 | AQ206: 4 | AR206: 苏试转债
A207: 108 | B207: 康弘转债 | C207: 128098 | D207: 43921. | E207: 康弘药业 | F207: 2773 | G207: 医药 | H207: 化学制药 | I207: 131.3 | J207: 1.1200000000000002e-002 | K207: 2.9999999999999997e-004 | L207: 46.63 | M207: 1.37e-002 | N207: 64 | O207: 3.1e-002 | P207: 116.3 | Q207: 35.3 | R207: 8.65 | S207: 132.1 | T207: -6.0000000000000001e-003 | U207: 转股中 | V207: 5.46年 | W207: 3.46年 | X207: 3.7999999999999999e-002 | Y207: 5.0000000000000003e-002 | Z207: 16 | AA207: 408 | AB207: -2.2400000000000003e-002 | AC207: -2.75e-002 | AD207: -6.3299999999999995e-002 | AE207: -6.5099999999999991e-002 | AF207: 88.73 | AG207: 92.04 | AH207: 0.85 | AI207: AA | AJ207: 4.4699999999999997e-002 | AK207: =I207+100*T207 -> 130.70000000000002 | AL207: 130.5 | AM207: 123 | AN207: 38.5 | AO207: 117 | AP207: -2.4e-002 | AQ207: 24 | AR207: 康弘转债
A208: 148 | B208: 利德转债! | C208: 123035 | D208: 43808. | E208: 利亚德 | F208: 300296 | G208: 电子 | H208: LED制 | I208: 129.689 | J208: 7.8000000000000005e-003 | K208: -2.3999999999999998e-003 | L208: 8.66 | M208: 6.9999999999999993e-003 | N208: 83 | O208: 7.9000000000000001e-002 | P208: 115.6 | Q208: 6.98 | R208: 2.6 | S208: 124.07 | T208: 4.4999999999999998e-002 | U208: 转股中 | V208: 5年56天 | W208: 3年56天 | X208: 3.6000000000000004e-002 | Y208: 4.4999999999999998e-002 | Z208: 8 | AA208: 220 | AB208: -2.2499999999999999e-002 | AC208: -2.7699999999999999e-002 | AD208: -6.480000000000001e-002 | AE208: -6.6900000000000001e-002 | AF208: 90.79 | AG208: 93.67 | AH208: 0.79 | AI208: AA+ | AJ208: 4.2699999999999995e-002 | AK208: =I208+100*T208 -> 134.18899999999999 | AL208: 135.3 | AM208: 166 | AN208: 41.6 | AO208: 156 | AP208: 0.115 | AQ208: 16 | AR208: 利德转债!
A209: 110 | B209: 盛屯转债! | C209: 110066 | D209: 43921. | E209: 盛屯矿业 | F209: 600711 | G209: 有色金属 | H209: 有色行业 | I209: 130.28 | J209: 1.78e-002 | K209: 1.3600000000000001e-002 | L209: 6.28 | M209: 3.7999999999999999e-002 | N209: 29 | O209: 9.0000000000000011e-003 | P209: 115.3 | Q209: 4.88 | R209: 1.6 | S209: 128.69 | T209: 1.2e-002 | U209: 转股中 | V209: 5.45年 | W209: 3.45年 | X209: 0.16200000000000001 | Y209: 0.20899999999999999 | Z209: 24 | AA209: 145 | AB209: -2.2599999999999999e-002 | AC209: -2.7400000000000001e-002 | AD209: -6.1399999999999996e-002 | AE209: -6.3200000000000006e-002 | AF209: 88.76 | AG209: 91.29 | AH209: 0.83 | AI209: AA | AJ209: 4.4699999999999997e-002 | AK209: =I209+100*T209 -> 131.47999999999999 | AL209: 131.9 | AM209: 139 | AN209: 40.6 | AO209: 146 | AP209: 3.9e-002 | AQ209: 46 | AR209: 盛屯转债!
A210: 53 | B210: 泛微转债 | C210: 113587 | D210: 44026. | E210: 泛微网络 | F210: 603039 | G210: 计算机及 | H210: 软件开发 | I210: 141.6 | J210: -3.9000000000000003e-003 | K210: -1.3500000000000002e-002 | L210: 94.01 | M210: -1.9400000000000001e-002 | N210: 8.4 | O210: 1.9e-002 | P210: 124.3 | Q210: 64.33 | R210: 21.34 | S210: 146.14 | T210: -3.1e-002 | U210: 3月3天 | V210: 5.74年 | W210: 3.74年 | X210: 1.6e-002 | Y210: 2.3e-002 | Z210: 3.2 | AA210: 200 | AB210: -2.29e-002 | AC210: -2.9700000000000001e-002 | AD210: -7.6200000000000004e-002 | AE210: -7.8e-002 | AF210: 81.53 | AG210: 86.96 | AH210: 0.9 | AI210: AA- | AJ210: 6.5700000000000008e-002 | AK210: =I210+100*T210 -> 138.5 | AL210: 137.1 | AM210: 180 | AN210: 50.1 | AO210: 206 | AP210: -6.6000000000000003e-002 | AQ210: 4 | AR210: 泛微转债
A211: 203 | B211: 伊力转债! | C211: 110055 | D211: 43559. | E211: 伊力特 | F211: 600197 | G211: 食品饮料 | H211: 白酒 | I211: 127.53 | J211: 5.3e-003 | K211: 2.8000000000000004e-003 | L211: 19.65 | M211: 1.0800000000000001e-002 | N211: 3.5 | O211: 3.0000000000000001e-003 | P211: 115 | Q211: 16.81 | R211: 3.27 | S211: 116.89 | T211: 9.0999999999999998e-002 | U211: 转股中 | V211: 4.49年 | W211: 2.49年 | X211: 0.10199999999999999 | Y211: 0.11900000000000001 | Z211: 8.7 | AA211: 85 | AB211: -2.3199999999999998e-002 | AC211: -2.8999999999999998e-002 | AD211: -7.6399999999999996e-002 | AE211: -7.8700000000000006e-002 | AF211: 92.75 | AG211: 95.71 | AH211: 0.75 | AI211: AA | AJ211: 4.2699999999999995e-002 | AK211: =I211+100*T211 -> 136.63 | AL211: 138.2 | AM211: 190 | AN211: 42.5 | AO211: 161 | AP211: -5.0999999999999997e-002 | AQ211: 25 | AR211: 伊力转债!
A212: 65 | B212: 万青转债 | C212: 127017 | D212: 44014. | E212: 万年青 | F212: 789 | G212: 建筑 | H212: 水泥 | I212: 135.1 | J212: -2.e-003 | K212: 2.5699999999999997e-002 | L212: 16.44 | M212: 3.27e-002 | N212: 23 | O212: 1.7000000000000001e-002 | P212: 118.4 | Q212: 14.16 | R212: 2.52 | S212: 116.1 | T212: 0.16399999999999998 | U212: 2月21天 | V212: 5.70年 | W212: 3.70年 | X212: 7.5999999999999998e-002 | Y212: 8.900000000000001e-002 | Z212: 10 | AA212: 131 | AB212: -2.3300000000000001e-002 | AC212: -2.86e-002 | AD212: -6.6500000000000004e-002 | AE212: -6.8099999999999994e-002 | AF212: 88.36 | AG212: 93.69 | AH212: 0.73 | AI212: AA+ | AJ212: 4.2699999999999995e-002 | AK212: =I212+100*T212 -> 151.5 | AL212: 154.1 | AM212: 254 | AN212: 60.4 | AO212: 244 | AP212: -3.5000000000000003e-002 | AQ212: 6 | AR212: 万青转债
A213: 275 | B213: 济川转债! | C213: 110038 | D213: 43068. | E213: 济川药业 | F213: 600566 | G213: 医药 | H213: 中药 | I213: 113.9 | J213: 3.3e-003 | K213: 3.4000000000000002e-003 | L213: 23.17 | M213: 1.5300000000000001e-002 | N213: 0.7 | O213: 1.e-003 | P213: 108.3 | Q213: 24.27 | R213: 3.32 | S213: 95.47 | T213: 0.193 | U213: 转股中 | V213: 2年55天 | W213: 55天 | X213: 3.3000000000000002e-002 | Y213: 3.2000000000000001e-002 | Z213: 6.3 | AA213: 189 | AB213: -2.35e-002 | AC213: -3.0499999999999999e-002 | AD213: -0.38400000000000001 | AE213: -0.38900000000000001 | AF213: 99.76 | AG213: 99.39 | AH213: 0.44 | AI213: AA | AJ213: 4.1299999999999996e-002 | AK213: =I213+100*T213 -> 133.20000000000002 | AL213: 132.3 | AM213: 142 | AN213: 32.6 | AO213: 54 | AP213: -3.3000000000000002e-002 | AQ213: 19 | AR213: 济川转债!
A214: 138 | B214: 明阳转债! | C214: 113029 | D214: 43837. | E214: 明阳智能 | F214: 601615 | G214: 能源电力 | H214: 风能 | I214: 128.4 | J214: 9.3999999999999986e-003 | K214: 2.1700000000000001e-002 | L214: 16.09 | M214: 3.7400000000000003e-002 | N214: 67 | O214: 3.1e-002 | P214: 113.3 | Q214: 12.46 | R214: 3.11 | S214: 129.13 | T214: -6.0000000000000001e-003 | U214: 转股中 | V214: 5.24年 | W214: 3.24年 | X214: 7.4999999999999997e-002 | Y214: 9.6999999999999989e-002 | Z214: 17 | AA214: 226 | AB214: -2.4e-002 | AC214: -2.8399999999999998e-002 | AD214: -6.1100000000000002e-002 | AE214: -6.3e-002 | AF214: 89.58 | AG214: 90.53 | AH214: 0.83 | AI214: AA | AJ214: 4.4699999999999997e-002 | AK214: =I214+100*T214 -> 127.80000000000001 | AL214: 127.7 | AM214: 93 | AN214: 37.1 | AO214: 104 | AP214: 7.0999999999999994e-002 | AQ214: 23 | AR214: 明阳转债!
A215: 163 | B215: 远东转债! | C215: 128075 | D215: 43769. | E215: 远东传动 | F215: 2406 | G215: 汽车 | H215: 零部件制 | I215: 129.9 | J215: 2.1899999999999999e-002 | K215: -1.1399999999999999e-002 | L215: 6.99 | M215: 1.3000000000000001e-002 | N215: 11 | O215: 1.1000000000000001e-002 | P215: 115.2 | Q215: 5.54 | R215: 1.45 | S215: 126.17 | T215: 2.9999999999999999e-002 | U215: 转股中 | V215: 5年4.1天 | W215: 3年4.1天 | X215: 0.17600000000000002 | Y215: 0.222 | Z215: 7.3 | AA215: 41 | AB215: -2.41e-002 | AC215: -2.9300000000000003e-002 | AD215: -6.9099999999999995e-002 | AE215: -7.1099999999999997e-002 | AF215: 90.39 | AG215: 92.96 | AH215: 0.81 | AI215: AA | AJ215: 4.4699999999999997e-002 | AK215: =I215+100*T215 -> 132.90000000000001 | AL215: 133.6 | AM215: 149 | AN215: 40.7 | AO215: 147 | AP215: -9.0000000000000011e-003 | AQ215: 16 | AR215: 远东转债!
A216: 133 | B216: 至纯转债! | C216: 113556 | D216: 43839. | E216: 至纯科技 | F216: 603690 | G216: 机械装备 | H216: 专用设备 | I216: 143.78 | J216: 6.6e-003 | K216: 4.8999999999999998e-003 | L216: 38.59 | M216: 1.3100000000000001e-002 | N216: 71 | O216: 0.16500000000000001 | P216: 126.8 | Q216: 29.37 | R216: 7.07 | S216: 131.39 | T216: 9.4e-002 | U216: 转股中 | V216: 5.25年 | W216: 3.25年 | X216: 2.9999999999999999e-002 | Y216: 3.9e-002 | Z216: 3 | AA216: 100 | AB216: -2.4199999999999999e-002 | AC216: -3.2199999999999999e-002 | AD216: -8.9600000000000013e-002 | AE216: -9.1799999999999993e-002 | AF216: 81.62 | AG216: 86.83 | AH216: 0.88 | AI216: A+ | AJ216: 7.6700000000000004e-002 | AK216: =I216+100*T216 -> 153.18000000000001 | AL216: 156.2 | AM216: 257 | AN216: 69.3 | AO216: 259 | AP216: -1.7000000000000001e-002 | AQ216: 12 | AR216: 至纯转债!
A217: 101 | B217: 红相转债 | C217: 123044 | D217: 43934. | E217: 红相股份 | F217: 300427 | G217: 能源电力 | H217: 电力设备 | I217: 144.298 | J217: 2.4500000000000001e-002 | K217: -4.0000000000000001e-003 | L217: 27 | M217: 2.3099999999999999e-002 | N217: 148 | O217: 0.17399999999999999 | P217: 125.5 | Q217: 18.8 | R217: 4.39 | S217: 143.62 | T217: 5.0000000000000001e-003 | U217: 转股中 | V217: 5.48年 | W217: 3.48年 | X217: 5.9999999999999998e-002 | Y217: 8.6999999999999994e-002 | Z217: 5.9 | AA217: 97 | AB217: -2.5699999999999997e-002 | AC217: -3.3099999999999997e-002 | AD217: -8.4499999999999992e-002 | AE217: -8.6699999999999999e-002 | AF217: 83.54 | AG217: 89.37 | AH217: 0.89 | AI217: AA- | AJ217: 6.5700000000000008e-002 | AK217: =I217+100*T217 -> 144.798 | AL217: 145 | AM217: 230 | AN217: 55.6 | AO217: 231 | AP217: -5.9000000000000004e-002 | AQ217: 15 | AR217: 红相转债
A218: 158 | B218: 太极转债! | C218: 128078 | D218: 43777. | E218: 太极股份 | F218: 2368 | G218: 计算机及 | H218: 软件开发 | I218: 135 | J218: 8.0000000000000004e-004 | K218: 1.7000000000000001e-003 | L218: 29 | M218: 2.3999999999999998e-003 | N218: 3.2 | O218: 2.e-003 | P218: 117.3 | Q218: 22.4 | R218: 3.89 | S218: 129.46 | T218: 4.2999999999999997e-002 | U218: 转股中 | V218: 5年32天 | W218: 3年32天 | X218: 5.7000000000000002e-002 | Y218: 7.400000000000001e-002 | Z218: 9.6 | AA218: 168 | AB218: -2.7799999999999998e-002 | AC218: -3.3500000000000002e-002 | AD218: -7.8399999999999997e-002 | AE218: -8.0299999999999996e-002 | AF218: 90.19 | AG218: 94.35 | AH218: 1 | AI218: AA | AJ218: 4.4699999999999997e-002 | AK218: =I218+100*T218 -> 139.30000000000001 | AL218: 140.5 | AM218: 207 | AN218: 46.2 | AO218: 182 | AP218: -2.2000000000000002e-002 | AQ218: 12 | AR218: 太极转债!
A219: 292 | B219: 九州转债! | C219: 110034 | D219: 42398. | E219: 九州通 | F219: 600998 | G219: 医药 | H219: 医药商业 | I219: 113.73 | J219: 4.3e-003 | K219: -2.0999999999999999e-003 | L219: 17.58 | M219: 6.8999999999999999e-003 | N219: 4.9 | O219: 3.0000000000000001e-003 | P219: 109.6 | Q219: 18.32 | R219: 1.83 | S219: 95.96 | T219: 0.185 | U219: 转股中 | V219: 1.32年 | W219: 回售中 | X219: 4.4999999999999998e-002 | Y219: 4.4000000000000004e-002 | Z219: 15 | AA219: 330 | AB219: -2.7900000000000001e-002 | AC219: -4.0800000000000003e-002 | AD219: 回售中 | AE219: 回售中 | AF219: 103 | AG219: 104.21 | AH219: 0.33 | AI219: AA+ | AJ219: 3.9300000000000002e-002 | AK219: =I219+100*T219 -> 132.23000000000002 | AL219: 131.5 | AM219: 136 | AN219: 27.3 | AO219: 18 | AP219: 2.1000000000000001e-002 | AQ219: 26 | AR219: 九州转债!
A220: 103 | B220: 永高转债 | C220: 128099 | D220: 43931. | E220: 永高股份 | F220: 2641 | G220: 建筑 | H220: 建筑行业 | I220: 132.511 | J220: 1.15e-002 | K220: -4.1999999999999997e-003 | L220: 8.14 | M220: 8.6999999999999994e-003 | N220: 9.2 | O220: 1.e-002 | P220: 113.2 | Q220: 6.16 | R220: 2.59 | S220: 132.14 | T220: 3.0000000000000001e-003 | U220: 转股中 | V220: 5.47年 | W220: 3.47年 | X220: 7.5999999999999998e-002 | Y220: 0.10099999999999999 | Z220: 7 | AA220: 91 | AB220: -2.8900000000000002e-002 | AC220: -3.3000000000000002e-002 | AD220: -6.5599999999999992e-002 | AE220: -6.7400000000000002e-002 | AF220: 88.57 | AG220: 89.52 | AH220: 0.85 | AI220: AA | AJ220: 4.4699999999999997e-002 | AK220: =I220+100*T220 -> 132.81100000000001 | AL220: 132.9 | AM220: 148 | AN220: 43.4 | AO220: 164 | AP220: -5.9000000000000004e-002 | AQ220: 9 | AR220: 永高转债
A221: 84 | B221: 长集转债 | C221: 128105 | D221: 43964. | E221: 长青集团 | F221: 2616 | G221: 城市公用 | H221: 三废处理 | I221: 135.417 | J221: 3.0000000000000001e-003 | K221: -2.0499999999999997e-002 | L221: 10.87 | M221: -2.07e-002 | N221: 12 | O221: 1.2e-002 | P221: 115.3 | Q221: 8.11 | R221: 3.35 | S221: 134.03 | T221: 1.e-002 | U221: 26天 | V221: 5.55年 | W221: 3.55年 | X221: 9.9000000000000005e-002 | Y221: 0.13300000000000001 | Z221: 8 | AA221: 81 | AB221: -2.9100000000000001e-002 | AC221: -3.3700000000000001e-002 | AD221: -6.9599999999999995e-002 | AE221: -7.1300000000000002e-002 | AF221: 88.36 | AG221: 90.87 | AH221: 0.85 | AI221: AA | AJ221: 4.4699999999999997e-002 | AK221: =I221+100*T221 -> 136.417 | AL221: 136.8 | AM221: 177 | AN221: 45.9 | AO221: 180 | AP221: -2.4e-002 | AQ221: 5 | AR221: 长集转债
A222: 142 | B222: 先导转债 | C222: 123036 | D222: 43840. | E222: 先导智能 | F222: 300450 | G222: 机械装备 | H222: 专用设备 | I222: 134.5 | J222: -7.000000000000001e-004 | K222: 2.5999999999999999e-003 | L222: 47.54 | M222: 2.3e-003 | N222: 15 | O222: 1.1000000000000001e-002 | P222: 115.1 | Q222: 38.99 | R222: 9.97 | S222: 121.93 | T222: 0.10300000000000001 | U222: 转股中 | V222: 5.23年 | W222: 3.23年 | X222: 2.4e-002 | Y222: 2.8999999999999998e-002 | Z222: 10 | AA222: 419 | AB222: -2.9900000000000003e-002 | AC222: -3.4799999999999998e-002 | AD222: -7.4700000000000003e-002 | AE222: -7.6499999999999999e-002 | AF222: 89.44 | AG222: 91.99 | AH222: 0.8 | AI222: AA | AJ222: 4.4699999999999997e-002 | AK222: =I222+100*T222 -> 144.80000000000001 | AL222: 147.1 | AM222: 237 | AN222: 55.1 | AO222: 228 | AP222: 6.8000000000000005e-002 | AQ222: 17 | AR222: 先导转债
A223: 289 | B223: 海印转债! | C223: 127003 | D223: 42552. | E223: 海印股份 | F223: 861 | G223: 商业零售 | H223: 商场 | I223: 117.81 | J223: -9.1999999999999998e-003 | K223: -8.9999999999999998e-004 | L223: 3.49 | M223: -1.41e-002 | N223: 12 | O223: 1.4999999999999999e-002 | P223: 111.8 | Q223: 3 | R223: 2.18 | S223: 116.33 | T223: 1.3000000000000001e-002 | U223: 转股中 | V223: 1.72年 | W223: 回售中 | X223: 8.5999999999999993e-002 | Y223: 0.10000000000000001 | Z223: 6.7 | AA223: 78 | AB223: -3.0299999999999997e-002 | AC223: -4.2300000000000004e-002 | AD223: 回售中 | AE223: 回售中 | AF223: 100.3 | AG223: 104.36 | AH223: 0.71 | AI223: AA | AJ223: 4.1299999999999996e-002 | AK223: =I223+100*T223 -> 119.11 | AL223: 119.3 | AM223: 20 | AN223: 14.9 | AO223: 2 | AP223: -1.7000000000000001e-002 | AQ223: 75 | AR223: 海印转债!
A224: 232 | B224: 利尔转债! | C224: 128046 | D224: 43413. | E224: 利尔化学 | F224: 2258 | G224: 化工 | H224: 农化 | I224: 127.998 | J224: 1.2800000000000001e-002 | K224: -1.0700000000000001e-002 | L224: 22.55 | M224: 2.7000000000000001e-003 | N224: 2.8 | O224: 3.0000000000000001e-003 | P224: 112.9 | Q224: 18.62 | R224: 3.46 | S224: 121.11 | T224: 5.7000000000000002e-002 | U224: 转股中 | V224: 4年28天 | W224: 2年28天 | X224: 7.2000000000000008e-002 | Y224: 8.6999999999999994e-002 | Z224: 8.5 | AA224: 118 | AB224: -3.0899999999999997e-002 | AC224: -3.6400000000000002e-002 | AD224: -9.1700000000000004e-002 | AE224: -9.4200000000000006e-002 | AF224: 94.25 | AG224: 95.57 | AH224: 0.79 | AI224: AA | AJ224: 4.2699999999999995e-002 | AK224: =I224+100*T224 -> 133.69800000000001 | AL224: 134.9 | AM224: 159 | AN224: 39.3 | AO224: 130 | AP224: 6.0000000000000001e-003 | AQ224: 10 | AR224: 利尔转债!
A225: 226 | B225: 桐昆转债! | C225: 113020 | D225: 43446. | E225: 桐昆股份 | F225: 601233 | G225: 服装纺织 | H225: 纺织行业 | I225: 128.55 | J225: 4.3e-003 | K225: 9.7000000000000003e-003 | L225: 15.51 | M225: 1.7000000000000001e-002 | N225: 74 | O225: 1.7000000000000001e-002 | P225: 112.8 | Q225: 12.28 | R225: 1.48 | S225: 126.3 | T225: 1.8000000000000002e-002 | U225: 转股中 | V225: 4.17年 | W225: 2.17年 | X225: 0.12 | Y225: 0.152 | Z225: 34 | AA225: 287 | AB225: -3.15e-002 | AC225: -3.6799999999999999e-002 | AD225: -9.0299999999999991e-002 | AE225: -9.2600000000000002e-002 | AF225: 94.21 | AG225: 95.86 | AH225: 0.82 | AI225: AA+ | AJ225: 4.07e-002 | AK225: =I225+100*T225 -> 130.35000000000002 | AL225: 130.8 | AM225: 128 | AN225: 34.9 | AO225: 85 | AP225: -2.e-002 | AQ225: 15 | AR225: 桐昆转债!
A226: 82 | B226: 起步转债! | C226: 113576 | D226: 43958. | E226: 起步股份 | F226: 603557 | G226: 服装纺织 | H226: 鞋服行业 | I226: 145.94 | J226: 0.17800000000000002 | K226: -9.5100000000000004e-002 | L226: 12.71 | M226: 0.10000000000000001 | N226: 2851. | O226: 3.8900000000000001 | P226: 121.8 | Q226: 10.55 | R226: 3.88 | S226: 120.47 | T226: 0.21100000000000002 | U226: 27天 | V226: 5.56年 | W226: 3.56年 | X226: 8.6999999999999994e-002 | Y226: 0.10400000000000001 | Z226: 5.2 | AA226: 60 | AB226: -3.27e-002 | AC226: -3.9e-002 | AD226: -8.6199999999999999e-002 | AE226: -8.8300000000000003e-002 | AF226: 82.88 | AG226: 86.27 | AH226: 0.82 | AI226: AA- | AJ226: 6.5700000000000008e-002 | AK226: =I226+100*T226 -> 167.03999999999999 | AL226: 171.4 | AM226: 270 | AN226: 85.1 | AO226: 271 | AP226: 0.248 | AQ226: 33 | AR226: 起步转债!
A227: 116 | B227: 恩捷转债! | C227: 128095 | D227: 43889. | E227: 恩捷股份 | F227: 2812 | G227: 电子 | H227: 元器件制 | I227: 137.6 | J227: 4.4000000000000003e-003 | K227: 1.e-004 | L227: 89.98 | M227: 5.3e-003 | N227: 17 | O227: 8.0000000000000002e-003 | P227: 115.3 | Q227: 65.09 | R227: 15.53 | S227: 138.24 | T227: -5.0000000000000001e-003 | U227: 转股中 | V227: 5.40年 | W227: 3.40年 | X227: 2.e-002 | Y227: 2.7999999999999997e-002 | Z227: 16 | AA227: 787 | AB227: -3.2799999999999996e-002 | AC227: -3.7599999999999995e-002 | AD227: -7.6799999999999993e-002 | AE227: -7.85e-002 | AF227: 88.97 | AG227: 91.5 | AH227: 0.86 | AI227: AA | AJ227: 4.4699999999999997e-002 | AK227: =I227+100*T227 -> 137.09999999999999 | AL227: 137 | AM227: 179 | AN227: 45.5 | AO227: 178 | AP227: 9.6000000000000002e-002 | AQ227: 17 | AR227: 恩捷转债!
A228: 273 | B228: 兄弟转债!! | C228: 128021 | D228: 43096. | E228: 兄弟科技 | F228: 2562 | G228: 医药 | H228: 原料药 | I228: 122.52 | J228: 2.0000000000000001e-004 | K228: 6.4000000000000003e-003 | L228: 6.08 | M228: 6.6e-003 | N228: 2.4 | O228: 6.9999999999999993e-003 | P228: 109.8 | Q228: 5.25 | R228: 2.55 | S228: 115.81 | T228: 5.7999999999999996e-002 | U228: 转股中 | V228: 3.19年 | W228: 1.19年 | X228: 4.9000000000000002e-002 | Y228: 5.5999999999999994e-002 | Z228: 2.7 | AA228: 55 | AB228: -3.44e-002 | AC228: -3.9800000000000002e-002 | AD228: -0.115 | AE228: -0.11800000000000001 | AF228: 96.94 | AG228: 96.35 | AH228: 1 | AI228: AA | AJ228: 4.2699999999999995e-002 | AK228: =I228+100*T228 -> 128.31999999999999 | AL228: 129.2 | AM228: 108 | AN228: 32.3 | AO228: 50 | AP228: -5.7000000000000002e-002 | AQ228: 13 | AR228: 兄弟转债!!
A229: 152 | B229: 石英转债! | C229: 113548 | D229: 43791. | E229: 石英股份 | F229: 603688 | G229: 电子 | H229: 电子产品 | I229: 148.62 | J229: 4.7999999999999996e-003 | K229: 5.4000000000000003e-003 | L229: 22.35 | M229: 1.1299999999999999e-002 | N229: 24 | O229: 0.122 | P229: 124.8 | Q229: 15.1 | R229: 4.57 | S229: 148.01 | T229: 4.0000000000000001e-003 | U229: 转股中 | V229: 5年39天 | W229: 3年39天 | X229: 1.7000000000000001e-002 | Y229: 2.5000000000000001e-002 | Z229: 1.3 | AA229: 77 | AB229: -3.44e-002 | AC229: -4.2000000000000003e-002 | AD229: -0.10099999999999999 | AE229: -0.10300000000000001 | AF229: 85.27 | AG229: 90.91 | AH229: 0.9 | AI229: AA- | AJ229: 6.5700000000000008e-002 | AK229: =I229+100*T229 -> 149.02000000000001 | AL229: 149.2 | AM229: 245 | AN229: 58.3 | AO229: 239 | AP229: -5.4000000000000006e-002 | AQ229: 10 | AR229: 石英转债!
A230: 225 | B230: 寒锐转债!! | C230: 123017 | D230: 43458. | E230: 寒锐钴业 | F230: 300618 | G230: 有色金属 | H230: 小金属 | I230: 128.33 | J230: -2.0999999999999999e-003 | K230: 1.1999999999999999e-003 | L230: 69.3 | M230: -1.e-003 | N230: 27 | O230: 5.2000000000000005e-002 | P230: 110.8 | Q230: 57.4 | R230: 10.53 | S230: 120.73 | T230: 6.3e-002 | U230: 转股中 | V230: 4.17年 | W230: 2.17年 | X230: 1.9e-002 | Y230: 2.3e-002 | Z230: 4 | AA230: 210 | AB230: -3.5299999999999998e-002 | AC230: -3.9800000000000002e-002 | AD230: -8.9499999999999996e-002 | AE230: -9.1799999999999993e-002 | AF230: 89.56 | AG230: 86.14 | AH230: 0.86 | AI230: AA- | AJ230: 6.3700000000000007e-002 | AK230: =I230+100*T230 -> 134.63000000000002 | AL230: 135.9 | AM230: 170 | AN230: 46.4 | AO230: 184 | AP230: -3.7000000000000005e-002 | AQ230: 13 | AR230: 寒锐转债!!
A231: 100 | B231: 三祥转债! | C231: 113572 | D231: 43930. | E231: 三祥新材 | F231: 603663 | G231: 其他 | H231: 其他 | I231: 137.49 | J231: 4.7999999999999996e-003 | K231: -1.41e-002 | L231: 19.77 | M231: -1.e-002 | N231: 48 | O231: 0.17100000000000001 | P231: 113.2 | Q231: 14.19 | R231: 6.81 | S231: 139.32 | T231: -1.3000000000000001e-002 | U231: 转股中 | V231: 5.48年 | W231: 3.48年 | X231: 5.5e-002 | Y231: 7.5999999999999998e-002 | Z231: 2.1 | AA231: 38 | AB231: -3.5499999999999997e-002 | AC231: -3.9599999999999996e-002 | AD231: -7.51e-002 | AE231: -7.6799999999999993e-002 | AF231: 79.43 | AG231: 76.16 | AH231: 0.93 | AI231: A+ | AJ231: 7.6700000000000004e-002 | AK231: =I231+100*T231 -> 136.19 | AL231: 135.7 | AM231: 168 | AN231: 56.2 | AO231: 235 | AP231: -1.3000000000000001e-002 | AQ231: 14 | AR231: 三祥转债!
A232: 66 | B232: 益丰转债 | C232: 113583 | D232: 44004. | E232: 益丰药房 | F232: 603939 | G232: 医药 | H232: 医药商业 | I232: 141.6 | J232: 1.6399999999999998e-002 | K232: 3.3e-003 | L232: 98.79 | M232: 2.2599999999999999e-002 | N232: 45 | O232: 2.1000000000000001e-002 | P232: 115.3 | Q232: 71.82 | R232: 10.83 | S232: 137.55 | T232: 2.8999999999999998e-002 | U232: 2月19天 | V232: 5.70年 | W232: 3.70年 | X232: 2.9999999999999999e-002 | Y232: 4.0999999999999995e-002 | Z232: 16 | AA232: 525 | AB232: -3.6000000000000004e-002 | AC232: -4.0500000000000001e-002 | AD232: -7.7800000000000008e-002 | AE232: -7.9500000000000001e-002 | AF232: 87.8 | AG232: 90.3 | AH232: 0.87 | AI232: AA | AJ232: 4.4699999999999997e-002 | AK232: =I232+100*T232 -> 144.5 | AL232: 145.6 | AM232: 235 | AN232: 55.3 | AO232: 229 | AP232: -6.0000000000000001e-003 | AQ232: 8 | AR232: 益丰转债
A233: 45 | B233: 海容转债 | C233: 113590 | D233: 44039. | E233: 海容冷链 | F233: 603187 | G233: 机械装备 | H233: 通用设备 | I233: 143.03 | J233: 7.8000000000000005e-003 | K233: -1.44e-002 | L233: 52.6 | M233: -7.1999999999999998e-003 | N233: 13 | O233: 1.8000000000000002e-002 | P233: 115.6 | Q233: 36.39 | R233: 5.34 | S233: 144.55 | T233: -1.e-002 | U233: 3月17天 | V233: 5.78年 | W233: 3.78年 | X233: 5.9999999999999998e-002 | Y233: 8.6999999999999994e-002 | Z233: 5 | AA233: 83 | AB233: -3.6799999999999999e-002 | AC233: -4.1299999999999996e-002 | AD233: -7.85e-002 | AE233: -8.0100000000000005e-002 | AF233: 81.08 | AG233: 80.65 | AH233: 0.93 | AI233: AA- | AJ233: 6.5700000000000008e-002 | AK233: =I233+100*T233 -> 142.03 | AL233: 141.5 | AM233: 214 | AN233: 60.4 | AO233: 245 | AP233: 3.0000000000000001e-003 | AQ233: 4 | AR233: 海容转债
A234: 169 | B234: 合兴转债! | C234: 128071 | D234: 43724. | E234: 合兴包装 | F234: 2228 | G234: 造纸包装 | H234: 包装材料 | I234: 138.385 | J234: 3.4099999999999998e-002 | K234: 4.5999999999999999e-003 | L234: 6 | M234: 4.53e-002 | N234: 210 | O234: 0.436 | P234: 114.8 | Q234: 4.28 | R234: 2.36 | S234: 140.19 | T234: -1.3000000000000001e-002 | U234: 转股中 | V234: 4.91年 | W234: 2.91年 | X234: 5.0000000000000003e-002 | Y234: 7.0999999999999994e-002 | Z234: 3.5 | AA234: 70 | AB234: -3.7999999999999999e-002 | AC234: -4.2999999999999997e-002 | AD234: -9.1400000000000009e-002 | AE234: -9.3200000000000005e-002 | AF234: 90.94 | AG234: 93.85 | AH234: 0.86 | AI234: AA | AJ234: 4.2699999999999995e-002 | AK234: =I234+100*T234 -> 137.08499999999998 | AL234: 136.6 | AM234: 175 | AN234: 42.7 | AO234: 162 | AP234: 0.151 | AQ234: 26 | AR234: 合兴转债!
A235: 277 | B235: 久立转2! | C235: 128019 | D235: 43070. | E235: 久立特材 | F235: 2318 | G235: 石油天然 | H235: 石油天然 | I235: 123.9 | J235: -8.0000000000000004e-004 | K235: 1.2800000000000001e-002 | L235: 8.76 | M235: 1.6200000000000003e-002 | N235: 8 | O235: 6.0000000000000001e-003 | P235: 109.8 | Q235: 7.62 | R235: 2.29 | S235: 114.96 | T235: 7.8e-002 | U235: 转股中 | V235: 3年50天 | W235: 1年50天 | X235: 0.14099999999999999 | Y235: 0.16200000000000001 | Z235: 10 | AA235: 74 | AB235: -3.85e-002 | AC235: -4.4000000000000004e-002 | AD235: -0.128 | AE235: -0.13100000000000001 | AF235: 97.16 | AG235: 96.57 | AH235: 0.74 | AI235: AA | AJ235: 4.2699999999999995e-002 | AK235: =I235+100*T235 -> 131.70000000000002 | AL235: 132.8 | AM235: 147 | AN235: 35.7 | AO235: 93 | AP235: -1.3000000000000001e-002 | AQ235: 13 | AR235: 久立转2!
A236: 34 | B236: 欣旺转债 | C236: 123058 | D236: 44050. | E236: 欣旺达 | F236: 300207 | G236: 电子 | H236: 电子产品 | I236: 146 | J236: 9.7999999999999997e-003 | K236: 2.0999999999999999e-003 | L236: 29.1 | M236: 1.3899999999999999e-002 | N236: 39 | O236: 2.4e-002 | P236: 116.3 | Q236: 21.28 | R236: 7.87 | S236: 136.75 | T236: 6.8000000000000005e-002 | U236: 4月3天 | V236: 5.82年 | W236: 3.82年 | X236: 2.5000000000000001e-002 | Y236: 3.4000000000000002e-002 | Z236: 11 | AA236: 457 | AB236: -3.9e-002 | AC236: -4.36e-002 | AD236: -8.2699999999999996e-002 | AE236: -8.43e-002 | AF236: 87.35 | AG236: 90.61 | AH236: 0.85 | AI236: AA | AJ236: 4.4699999999999997e-002 | AK236: =I236+100*T236 -> 152.80000000000001 | AL236: 155.3 | AM236: 256 | AN236: 64.6 | AO236: 257 | AP236: 0.13600000000000001 | AQ236: 5 | AR236: 欣旺转债
A237: 85 | B237: 东时转债 | C237: 113575 | D237: 43951. | E237: 东方时尚 | F237: 603377 | G237: 其他 | H237: 其他 | I237: 141.25 | J237: 2.e-002 | K237: -8.0000000000000004e-004 | L237: 22.66 | M237: 2.07e-002 | N237: 22 | O237: 3.6000000000000004e-002 | P237: 113.5 | Q237: 14.56 | R237: 7.35 | S237: 155.63 | T237: -9.1999999999999998e-002 | U237: 26天 | V237: 5.55年 | W237: 3.55年 | X237: 3.2000000000000001e-002 | Y237: 5.0000000000000003e-002 | Z237: 4.3 | AA237: 133 | AB237: -3.9300000000000002e-002 | AC237: -4.3400000000000001e-002 | AD237: -8.0100000000000005e-002 | AE237: -8.1799999999999998e-002 | AF237: 88.39 | AG237: 89.47 | AH237: 0.93 | AI237: AA | AJ237: 4.4699999999999997e-002 | AK237: =I237+100*T237 -> 132.05000000000001 | AL237: 126.9 | AM237: 83 | AN237: 37.4 | AO237: 107 | AP237: -4.0000000000000001e-003 | AQ237: 16 | AR237: 东时转债
A238: 294 | B238: 航信转债!! | C238: 110031 | D238: 42185. | E238: 航天信息 | F238: 600271 | G238: 计算机及 | H238: 软件开发 | I238: 110.18 | J238: 1.9e-003 | K238: -1.7000000000000001e-003 | L238: 16.56 | M238: 1.1599999999999999e-002 | N238: 0.9 | O238: 0. | P238: 107 | Q238: 21.56 | R238: 2.76 | S238: 76.81 | T238: 0.434 | U238: 转股中 | V238: 0.73年 | W238: 回售中 | X238: 7.8e-002 | Y238: 5.9999999999999998e-002 | Z238: 24 | AA238: 308 | AB238: -3.9399999999999998e-002 | AC238: -5.6600000000000004e-002 | AD238: 回售中 | AE238: 回售中 | AF238: 100.27 | AG238: 104.42 | AH238: 0.02 | AI238: AAA | AJ238: 3.4099999999999998e-002 | AK238: =I238+100*T238 -> 153.58000000000001 | AL238: 143.6 | AM238: 222 | AN238: 39.1 | AO238: 128 | AP238: -4.4000000000000004e-002 | AQ238: 14 | AR238: 航信转债!!
A239: 125 | B239: 新天转债 | C239: 128091 | D239: 43847. | E239: 新天药业 | F239: 2873 | G239: 医药 | H239: 中药 | I239: 147.6 | J239: 7.4999999999999997e-003 | K239: 8.3999999999999995e-003 | L239: 18.25 | M239: 1.9599999999999999e-002 | N239: 256 | O239: 0.97999999999999998 | P239: 120 | Q239: 16.39 | R239: 2.93 | S239: 111.35 | T239: 0.32600000000000001 | U239: 转股中 | V239: 5.28年 | W239: 3.28年 | X239: 8.199999999999999e-002 | Y239: 9.1999999999999998e-002 | Z239: 1.8 | AA239: 21 | AB239: -3.9399999999999998e-002 | AC239: -4.5499999999999999e-002 | AD239: -9.5100000000000004e-002 | AE239: -9.7500000000000003e-002 | AF239: 81.8 | AG239: 82.14 | AH239: 0.82 | AI239: A+ | AJ239: 7.6700000000000004e-002 | AK239: =I239+100*T239 -> 180.19999999999999 | AL239: 183.9 | AM239: 274 | AN239: 101.7 | AO239: 276 | AP239: -4.8000000000000001e-002 | AQ239: 16 | AR239: 新天转债
A240: 115 | B240: 奥佳转债! | C240: 128097 | D240: 43908. | E240: 奥佳华 | F240: 2614 | G240: 机械装备 | H240: 专用设备 | I240: 143.7 | J240: 3.3099999999999997e-002 | K240: -5.7999999999999996e-003 | L240: 15.36 | M240: 3.0899999999999997e-002 | N240: 208 | O240: 0.22 | P240: 115.3 | Q240: 10.69 | R240: 2.52 | S240: 143.69 | T240: 0. | U240: 转股中 | V240: 5.44年 | W240: 3.44年 | X240: 7.0999999999999994e-002 | Y240: 0.10199999999999999 | Z240: 6.6 | AA240: 93 | AB240: -4.0399999999999998e-002 | AC240: -4.5100000000000001e-002 | AD240: -8.7100000000000011e-002 | AE240: -8.8900000000000007e-002 | AF240: 88.83 | AG240: 91.34 | AH240: 0.88 | AI240: AA | AJ240: 4.4699999999999997e-002 | AK240: =I240+100*T240 -> 143.69999999999999 | AL240: 143.7 | AM240: 223 | AN240: 52.4 | AO240: 216 | AP240: -5.4000000000000006e-002 | AQ240: 28 | AR240: 奥佳转债!
A241: 72 | B241: 康隆转债 | C241: 113580 | D241: 43971. | E241: 康隆达 | F241: 603665 | G241: 服装纺织 | H241: 服装行业 | I241: 151.98 | J241: 2.9700000000000001e-002 | K241: -4.5999999999999999e-003 | L241: 25.23 | M241: 2.69e-002 | N241: 121 | O241: 0.40299999999999997 | P241: 121.2 | Q241: 15.51 | R241: 4.05 | S241: 162.67 | T241: -6.6000000000000003e-002 | U241: 40天 | V241: 5.59年 | W241: 3.59年 | X241: 5.4000000000000006e-002 | Y241: 8.6999999999999994e-002 | Z241: 2 | AA241: 37 | AB241: -4.0399999999999998e-002 | AC241: -4.6399999999999997e-002 | AD241: -9.6600000000000005e-002 | AE241: -9.8299999999999998e-002 | AF241: 82.19 | AG241: 85.57 | AH241: 0.94 | AI241: AA- | AJ241: 6.5700000000000008e-002 | AK241: =I241+100*T241 -> 145.38 | AL241: 141.3 | AM241: 212 | AN241: 55.7 | AO241: 232 | AP241: 0.10099999999999999 | AQ241: 9 | AR241: 康隆转债
A242: 287 | B242: 光大转债 | C242: 113011 | D242: 42934. | E242: 光大银行 | F242: 601818 | G242: 金融 | H242: 银行行业 | I242: 119.9 | J242: 1.2699999999999999e-002 | K242: 4.0000000000000002e-004 | L242: 3.77 | M242: 2.4500000000000001e-002 | N242: 143 | O242: 4.0000000000000001e-003 | P242: 108.3 | Q242: 3.76 | R242: 0.62 | S242: 100.27 | T242: 0.19600000000000001 | U242: 转股中 | V242: 2.49年 | W242: 无权 | X242: 0.152 | Y242: 0.152 | Z242: 300 | AA242: 1979. | AB242: -4.07e-002 | AC242: -4.6600000000000003e-002 | AD242: 无权 | AE242: 无权 | AF242: 无权 | AG242: 99.26 | AH242: 0.53 | AI242: AAA | AJ242: 3.6299999999999999e-002 | AK242: =I242+100*T242 -> 139.5 | AL242: 139.5 | AM242: 202 | AN242: 40.3 | AO242: 142 | AP242: -6.0000000000000001e-003 | AQ242: 14 | AR242: 光大转债
A243: 37 | B243: 安20转债 | C243: 113592 | D243: 44043. | E243: 安井食品 | F243: 603345 | G243: 食品饮料 | H243: 食品饮料 | I243: 145.15 | J243: 1.2500000000000001e-002 | K243: -9.7999999999999997e-003 | L243: 172.53 | M243: 3.0000000000000001e-003 | N243: 35 | O243: 2.7000000000000003e-002 | P243: 113.1 | Q243: 115.9 | R243: 13.32 | S243: 148.86 | T243: -2.5000000000000001e-002 | U243: 3月27天 | V243: 5.80年 | W243: 3.80年 | X243: 2.2000000000000002e-002 | Y243: 3.3000000000000002e-002 | Z243: 9 | AA243: 408 | AB243: -4.2800000000000005e-002 | AC243: -4.6500000000000007e-002 | AD243: -8.199999999999999e-002 | AE243: -8.3599999999999994e-002 | AF243: 87.22 | AG243: 88.16 | AH243: 0.91 | AI243: AA | AJ243: 4.4699999999999997e-002 | AK243: =I243+100*T243 -> 142.65000000000001 | AL243: 141.4 | AM243: 213 | AN243: 53.3 | AO243: 220 | AP243: -1.3000000000000001e-002 | AQ243: 5 | AR243: 安20转债
A244: 282 | B244: 国君转债! | C244: 113013 | D244: 42940. | E244: 国泰君安 | F244: 601211 | G244: 金融 | H244: 证券行业 | I244: 122.2 | J244: 1.41e-002 | K244: 6.1999999999999998e-003 | L244: 18.8 | M244: 3.8699999999999998e-002 | N244: 34 | O244: 4.0000000000000001e-003 | P244: 108.3 | Q244: 19.01 | R244: 1.38 | S244: 98.9 | T244: 0.23600000000000002 | U244: 转股中 | V244: 2.80年 | W244: 无权 | X244: 4.2000000000000003e-002 | Y244: 4.0999999999999995e-002 | Z244: 70 | AA244: 1675. | AB244: -4.2900000000000001e-002 | AC244: -4.8099999999999997e-002 | AD244: 无权 | AE244: 无权 | AF244: 无权 | AG244: 98.18 | AH244: 0.53 | AI244: AAA | AJ244: 3.6299999999999999e-002 | AK244: =I244+100*T244 -> 145.80000000000001 | AL244: 145.5 | AM244: 234 | AN244: 47.3 | AO244: 191 | AP244: -6.9999999999999993e-003 | AQ244: 13 | AR244: 国君转债!
A245: 123 | B245: 璞泰转债! | C245: 113562 | D245: 43865. | E245: 璞泰来 | F245: 603659 | G245: 电子 | H245: 元器件制 | I245: 136.95 | J245: -6.0999999999999995e-003 | K245: 9.1000000000000004e-003 | L245: 110.18 | M245: 3.4999999999999996e-003 | N245: 8.6 | O245: 6.9999999999999993e-003 | P245: 113.3 | Q245: 82.73 | R245: 14.02 | S245: 133.18 | T245: 2.7999999999999997e-002 | U245: 转股中 | V245: 4.29年 | W245: 2.29年 | X245: 1.8000000000000002e-002 | Y245: 2.4e-002 | Z245: 8.7 | AA245: 480 | AB245: -4.3700000000000003e-002 | AC245: -4.9000000000000002e-002 | AD245: -0.113 | AE245: -0.114 | AF245: 92.15 | AG245: 94.92 | AH245: 0.86 | AI245: AA | AJ245: 4.2699999999999995e-002 | AK245: =I245+100*T245 -> 139.75 | AL245: 140.7 | AM245: 208 | AN245: 45.8 | AO245: 179 | AP245: 7.6999999999999999e-002 | AQ245: 16 | AR245: 璞泰转债!
A246: 166 | B246: 九洲转债! | C246: 123030 | D246: 43720. | E246: 九洲集团 | F246: 300040 | G246: 能源电力 | H246: 电力设备 | I246: 150.5 | J246: 2.9999999999999999e-002 | K246: 7.9000000000000008e-003 | L246: 8.48 | M246: 3.7900000000000003e-002 | N246: 575 | O246: 2.0499999999999998 | P246: 120 | Q246: 5.65 | R246: 1.48 | S246: 150.09 | T246: 3.0000000000000001e-003 | U246: 转股中 | V246: 4.92年 | W246: 2.92年 | X246: 6.0999999999999999e-002 | Y246: 9.0999999999999998e-002 | Z246: 1.9 | AA246: 31 | AB246: -4.5700000000000005e-002 | AC246: -5.2199999999999996e-002 | AD246: -0.113 | AE246: -0.115 | AF246: 85.7 | AG246: 89.08 | AH246: 1 | AI246: AA- | AJ246: 6.3700000000000007e-002 | AK246: =I246+100*T246 -> 150.80000000000001 | AL246: 150.9 | AM246: 248 | AN246: 61.8 | AO246: 248 | AP246: 8.9999999999999997e-002 | AQ246: 30 | AR246: 九洲转债!
A247: 254 | B247: 长证转债! | C247: 127005 | D247: 43201. | E247: 长江证券 | F247: 783 | G247: 金融 | H247: 证券行业 | I247: 128.538 | J247: 6.8999999999999999e-003 | K247: 1.9799999999999998e-002 | L247: 8.19 | M247: 3.7999999999999999e-002 | N247: 81 | O247: 1.3000000000000001e-002 | P247: 109.3 | Q247: 7.28 | R247: 1.67 | S247: 112.5 | T247: 0.14300000000000002 | U247: 转股中 | V247: 3.48年 | W247: 无权 | X247: 0.11 | Y247: 0.124 | Z247: 50 | AA247: 453 | AB247: -4.6399999999999997e-002 | AC247: -5.0999999999999997e-002 | AD247: 无权 | AE247: 无权 | AF247: 无权 | AG247: 96.36 | AH247: 0.7 | AI247: AAA | AJ247: 3.7699999999999997e-002 | AK247: =I247+100*T247 -> 142.83800000000002 | AL247: 144.6 | AM247: 227 | AN247: 48.2 | AO247: 196 | AP247: -1.3000000000000001e-002 | AQ247: 15 | AR247: 长证转债!
A248: 87 | B248: 裕同转债 | C248: 128104 | D248: 43949. | E248: 裕同科技 | F248: 2831 | G248: 造纸包装 | H248: 包装材料 | I248: 150.5 | J248: 1.9e-002 | K248: -2.9999999999999997e-004 | L248: 36.29 | M248: 2.0499999999999997e-002 | N248: 65 | O248: 3.1e-002 | P248: 115.3 | Q248: 23.24 | R248: 4.96 | S248: 156.15 | T248: -3.6000000000000004e-002 | U248: 24天 | V248: 5.55年 | W248: 3.55年 | X248: 4.4000000000000004e-002 | Y248: 6.9000000000000006e-002 | Z248: 14 | AA248: 318 | AB248: -4.7699999999999992e-002 | AC248: -5.2199999999999996e-002 | AD248: -9.5899999999999999e-002 | AE248: -9.7599999999999992e-002 | AF248: 89 | AG248: 91.85 | AH248: 0.91 | AI248: AA+ | AJ248: 4.2699999999999995e-002 | AK248: =I248+100*T248 -> 146.90000000000001 | AL248: 144.8 | AM248: 229 | AN248: 53 | AO248: 219 | AP248: 1.7000000000000001e-002 | AQ248: 7 | AR248: 裕同转债
A249: 91 | B249: 同德转债 | C249: 128103 | D249: 43942. | E249: 同德化工 | F249: 2360 | G249: 化工 | H249: 化工 | I249: 159.389 | J249: -3.2799999999999996e-002 | K249: 2.76e-002 | L249: 6.56 | M249: -6.0999999999999995e-003 | N249: 394 | O249: 1.71 | P249: 121.8 | Q249: 5.18 | R249: 2.23 | S249: 126.64 | T249: 0.25900000000000001 | U249: 20天 | V249: 5.52年 | W249: 3.52年 | X249: 5.5999999999999994e-002 | Y249: 7.0999999999999994e-002 | Z249: 1.4 | AA249: 26 | AB249: -4.8600000000000004e-002 | AC249: -5.4800000000000001e-002 | AD249: -0.106 | AE249: -0.10800000000000001 | AF249: 80.03 | AG249: 81.83 | AH249: 0.87 | AI249: A+ | AJ249: 7.6700000000000004e-002 | AK249: =I249+100*T249 -> 185.28900000000002 | AL249: 192.1 | AM249: 276 | AN249: 110.3 | AO249: 279 | AP249: -7.0999999999999994e-002 | AQ249: 10 | AR249: 同德转债
A250: 150 | B250: 通光转债! | C250: 123034 | D250: 43797. | E250: 通光线缆 | F250: 300265 | G250: 通信互联 | H250: 通信设备 | I250: 152.32 | J250: -7.7000000000000002e-003 | K250: -2.2000000000000001e-003 | L250: 11 | M250: -1.0800000000000001e-002 | N250: 215 | O250: 1.24 | P250: 118.5 | Q250: 7.97 | R250: 3.32 | S250: 138.02 | T250: 0.10400000000000001 | U250: 转股中 | V250: 5年46天 | W250: 3年46天 | X250: 2.7999999999999997e-002 | Y250: 3.9e-002 | Z250: 1.1 | AA250: 40 | AB250: -4.87e-002 | AC250: -5.45e-002 | AD250: -0.10800000000000001 | AE250: -0.11 | AF250: 81.82 | AG250: 81.86 | AH250: 0.91 | AI250: A+ | AJ250: 7.6700000000000004e-002 | AK250: =I250+100*T250 -> 162.72 | AL250: 166.6 | AM250: 267 | AN250: 84.8 | AO250: 270 | AP250: -7.400000000000001e-002 | AQ250: 26 | AR250: 通光转债!
A251: 94 | B251: 天铁转债 | C251: 123046 | D251: 43938. | E251: 天铁股份 | F251: 300587 | G251: 铁路 | H251: 铁路设备 | I251: 155.25 | J251: 1.5100000000000001e-002 | K251: -2.3099999999999999e-002 | L251: 16.49 | M251: -8.3999999999999995e-003 | N251: 22 | O251: 3.6000000000000004e-002 | P251: 118.2 | Q251: 10.12 | R251: 2.77 | S251: 162.94 | T251: -4.7e-002 | U251: 6.1天 | V251: 5.50年 | W251: 3.50年 | X251: 7.8e-002 | Y251: 0.128 | Z251: 4 | AA251: 51 | AB251: -4.9299999999999997e-002 | AC251: -5.4600000000000003e-002 | AD251: -0.10099999999999999 | AE251: -0.10300000000000001 | AF251: 82.7 | AG251: 83.98 | AH251: 0.94 | AI251: AA- | AJ251: 6.5700000000000008e-002 | AK251: =I251+100*T251 -> 150.55000000000001 | AL251: 147.6 | AM251: 239 | AN251: 63.6 | AO251: 254 | AP251: 3.6000000000000004e-002 | AQ251: 9 | AR251: 天铁转债
A252: 274 | B252: 国祯转债!! | C252: 123002 | D252: 43094. | E252: 国祯环保 | F252: 300388 | G252: 城市公用 | H252: 三废处理 | I252: 129.1 | J252: -9.7999999999999997e-003 | K252: -5.5000000000000005e-003 | L252: 10.9 | M252: -1.54e-002 | N252: 11 | O252: 3.4000000000000002e-002 | P252: 109.8 | Q252: 8.48 | R252: 2.11 | S252: 128.54 | T252: 4.0000000000000001e-003 | U252: 转股中 | V252: 3.18年 | W252: 1.18年 | X252: 3.4000000000000002e-002 | Y252: 4.4000000000000004e-002 | Z252: 2.5 | AA252: 74 | AB252: -5.0599999999999999e-002 | AC252: -5.5800000000000002e-002 | AD252: -0.14699999999999999 | AE252: -0.14999999999999999 | AF252: 96.99 | AG252: 96.4 | AH252: 1 | AI252: AA | AJ252: 4.2699999999999995e-002 | AK252: =I252+100*T252 -> 129.5 | AL252: 129.7 | AM252: 115 | AN252: 32.7 | AO252: 56 | AP252: -2.e-003 | AQ252: 11 | AR252: 国祯转债!!
A253: 12 | B253: 隆20转债 | C253: 113038 | D253: 44082. | E253: 隆基股份 | F253: 601012 | G253: 能源电力 | H253: 太阳能 | I253: 151 | J253: -1.1599999999999999e-002 | K253: -1.67e-002 | L253: 72.05 | M253: -3.2899999999999999e-002 | N253: 422 | O253: 5.5999999999999994e-002 | P253: 111.8 | Q253: 52.77 | R253: 8.76 | S253: 136.54 | T253: 0.106 | U253: 4月20天 | V253: 5.86年 | W253: 3.86年 | X253: 1.8000000000000002e-002 | Y253: 2.5000000000000001e-002 | Z253: 50 | AA253: 2718. | AB253: -5.0700000000000002e-002 | AC253: -5.4000000000000006e-002 | AD253: -9.0399999999999994e-002 | AE253: -9.1799999999999993e-002 | AF253: 88.39 | AG253: 89.31 | AH253: 0.86 | AI253: AAA | AJ253: 3.9699999999999999e-002 | AK253: =I253+100*T253 -> 161.59999999999999 | AL253: 165.5 | AM253: 266 | AN253: 76.2 | AO253: 266 | AP253: 0.109 | AQ253: 9 | AR253: 隆20转债
A254: 88 | B254: 瀚蓝转债 | C254: 110069 | D254: 43958. | E254: 瀚蓝环境 | F254: 600323 | G254: 城市公用 | H254: 三废处理 | I254: 151.9 | J254: -1.3600000000000001e-002 | K254: 8.3999999999999995e-003 | L254: 29.04 | M254: -5.7999999999999996e-003 | N254: 8.7 | O254: 6.0000000000000001e-003 | P254: 113.5 | Q254: 20.2 | R254: 3.25 | S254: 143.76 | T254: 5.7000000000000002e-002 | U254: 24天 | V254: 5.55年 | W254: 3.55年 | X254: 4.4999999999999998e-002 | Y254: 6.4000000000000001e-002 | Z254: 9.9 | AA254: 223 | AB254: -5.1699999999999996e-002 | AC254: -5.57e-002 | AD254: -0.10199999999999999 | AE254: -0.10199999999999999 | AF254: 87.62 | AG254: 90.25 | AH254: 0.9 | AI254: AA+ | AJ254: 4.2699999999999995e-002 | AK254: =I254+100*T254 -> 157.59999999999999 | AL254: 160 | AM254: 261 | AN254: 69.8 | AO254: 260 | AP254: -1.1000000000000001e-002 | AQ254: 7 | AR254: 瀚蓝转债
A255: 256 | B255: 艾华转债!! | C255: 113504 | D255: 43182. | E255: 艾华集团 | F255: 603989 | G255: 电子 | H255: 元器件制 | I255: 132.19 | J255: 2.e-003 | K255: 2.3999999999999998e-003 | L255: 27.99 | M255: 5.0000000000000001e-003 | N255: 9.5 | O255: 1.3000000000000001e-002 | P255: 110.3 | Q255: 21.13 | R255: 4.97 | S255: 132.47 | T255: -2.e-003 | U255: 转股中 | V255: 3.45年 | W255: 1.45年 | X255: 5.0999999999999997e-002 | Y255: 6.8000000000000005e-002 | Z255: 5.6 | AA255: 109 | AB255: -5.21e-002 | AC255: -5.7099999999999998e-002 | AD255: -0.128 | AE255: -0.13 | AF255: 96.14 | AG255: 95.77 | AH255: 0.87 | AI255: AA | AJ255: 4.2699999999999995e-002 | AK255: =I255+100*T255 -> 131.99000000000001 | AL255: 131.9 | AM255: 140 | AN255: 35.8 | AO255: 94 | AP255: -3.5000000000000003e-002 | AQ255: 9 | AR255: 艾华转债!!
A256: 146 | B256: 常汽转债! | C256: 113550 | D256: 43811. | E256: 常熟汽饰 | F256: 603035 | G256: 汽车 | H256: 零部件制 | I256: 160.2 | J256: 4.1900000000000007e-002 | K256: 1.0700000000000001e-002 | L256: 15.53 | M256: 5.6500000000000002e-002 | N256: 129 | O256: 0.17600000000000002 | P256: 121.8 | Q256: 9.65 | R256: 1.61 | S256: 160.93 | T256: -5.0000000000000001e-003 | U256: 转股中 | V256: 5.16年 | W256: 3.16年 | X256: 9.5000000000000001e-002 | Y256: 0.153 | Z256: 4.6 | AA256: 48 | AB256: -5.28e-002 | AC256: -5.9400000000000001e-002 | AD256: -0.11800000000000001 | AE256: -0.12 | AF256: 84.99 | AG256: 88.45 | AH256: 0.93 | AI256: AA- | AJ256: 6.5700000000000008e-002 | AK256: =I256+100*T256 -> 159.69999999999999 | AL256: 159.5 | AM256: 260 | AN256: 71 | AO256: 261 | AP256: 3.3000000000000002e-002 | AQ256: 16 | AR256: 常汽转债!
A257: 272 | B257: 众信转债! | C257: 128022 | D257: 43097. | E257: 众信旅游 | F257: 2707 | G257: 旅游餐饮 | H257: 旅游 | I257: 130.49 | J257: 1.6299999999999999e-002 | K257: 2.5600000000000001e-002 | L257: 9.77 | M257: 5.1699999999999996e-002 | N257: 60 | O257: 0.10099999999999999 | P257: 109.8 | Q257: 7.91 | R257: 4.32 | S257: 123.51 | T257: 5.5999999999999994e-002 | U257: 转股中 | V257: 3.20年 | W257: 1.20年 | X257: 5.2000000000000005e-002 | Y257: 6.4000000000000001e-002 | Z257: 4.6 | AA257: 89 | AB257: -5.3499999999999999e-002 | AC257: -5.8700000000000002e-002 | AD257: -0.151 | AE257: -0.153 | AF257: 96.91 | AG257: 96.32 | AH257: 0.81 | AI257: AA | AJ257: 4.2699999999999995e-002 | AK257: =I257+100*T257 -> 136.09 | AL257: 137.5 | AM257: 182 | AN257: 40.6 | AO257: 145 | AP257: 5.7000000000000002e-002 | AQ257: 24 | AR257: 众信转债!
A258: 182 | B258: 一心转债! | C258: 128067 | D258: 43602. | E258: 一心堂 | F258: 2727 | G258: 医药 | H258: 医药商业 | I258: 145.389 | J258: 5.4000000000000003e-003 | K258: -2.0999999999999999e-003 | L258: 39.4 | M258: 3.3e-003 | N258: 105 | O258: 0.245 | P258: 112.9 | Q258: 26.83 | R258: 4.71 | S258: 146.85 | T258: -1.e-002 | U258: 转股中 | V258: 4.58年 | W258: 2.58年 | X258: 1.3000000000000001e-002 | Y258: 1.9e-002 | Z258: 3 | AA258: 226 | AB258: -5.4699999999999999e-002 | AC258: -5.9299999999999999e-002 | AD258: -0.11599999999999999 | AE258: -0.11800000000000001 | AF258: 92.28 | AG258: 93.58 | AH258: 1 | AI258: AA | AJ258: 4.2699999999999995e-002 | AK258: =I258+100*T258 -> 144.38900000000001 | AL258: 143.9 | AM258: 224 | AN258: 50.3 | AO258: 209 | AP258: -6.0000000000000001e-003 | AQ258: 18 | AR258: 一心转债!
A259: 48 | B259: 巨星转债 | C259: 128115 | D259: 44028. | E259: 巨星科技 | F259: 2444 | G259: 机械装备 | H259: 通用设备 | I259: 158.61 | J259: 1.47e-002 | K259: 8.0000000000000002e-003 | L259: 20.29 | M259: 2.4199999999999999e-002 | N259: 24 | O259: 1.4999999999999999e-002 | P259: 115.3 | Q259: 12.28 | R259: 2.69 | S259: 165.23 | T259: -4.0000000000000001e-002 | U259: 3月17天 | V259: 5.76年 | W259: 3.76年 | X259: 4.4999999999999998e-002 | Y259: 7.400000000000001e-002 | Z259: 9.7 | AA259: 218 | AB259: -5.4699999999999999e-002 | AC259: -5.9000000000000004e-002 | AD259: -9.7100000000000006e-002 | AE259: -9.98e-002 | AF259: 89.83 | AG259: 90.05 | AH259: 0.94 | AI259: AA | AJ259: 4.4699999999999997e-002 | AK259: =I259+100*T259 -> 154.61000000000001 | AL259: 152 | AM259: 250 | AN259: 61.9 | AO259: 249 | AP259: -3.4000000000000002e-002 | AQ259: 4 | AR259: 巨星转债
A260: 240 | B260: 万顺转债 | C260: 123012 | D260: 43341. | E260: 万顺新材 | F260: 300057 | G260: 造纸包装 | H260: 包装材料 | I260: 136.5 | J260: -2.1299999999999999e-002 | K260: -2.5999999999999999e-003 | L260: 6.48 | M260: -2.8500000000000001e-002 | N260: 253 | O260: 1.4099999999999999 | P260: 110.3 | Q260: 5.31 | R260: 1.29 | S260: 122.03 | T260: 0.11900000000000001 | U260: 转股中 | V260: 3.83年 | W260: 1.83年 | X260: 2.9999999999999999e-002 | Y260: 3.6000000000000004e-002 | Z260: 1.3 | AA260: 44 | AB260: -5.5e-002 | AC260: -5.9500000000000004e-002 | AD260: -0.10800000000000001 | AE260: -0.11 | AF260: 90.94 | AG260: 87.44 | AH260: 0.84 | AI260: AA- | AJ260: 6.3700000000000007e-002 | AK260: =I260+100*T260 -> 148.40000000000001 | AL260: 151 | AM260: 249 | AN260: 60 | AO260: 242 | AP260: 3.3000000000000002e-002 | AQ260: 16 | AR260: 万顺转债
A261: 179 | B261: 中环转债! | C261: 123026 | D261: 43647. | E261: 中环环保 | F261: 300692 | G261: 城市公用 | H261: 三废处理 | I261: 137.8 | J261: -2.5999999999999999e-003 | K261: 1.67e-002 | L261: 16.8 | M261: 1.5700000000000002e-002 | N261: 55 | O261: 0.252 | P261: 110.6 | Q261: 12.25 | R261: 2.96 | S261: 137.14 | T261: 5.0000000000000001e-003 | U261: 转股中 | V261: 3.72年 | W261: 1.72年 | X261: 5.7000000000000002e-002 | Y261: 7.8e-002 | Z261: 1.6 | AA261: 28 | AB261: -5.8299999999999998e-002 | AC261: -6.3099999999999989e-002 | AD261: -0.12 | AE261: -0.122 | AF261: 91.51 | AG261: 88.27 | AH261: 0.9 | AI261: AA- | AJ261: 6.3700000000000007e-002 | AK261: =I261+100*T261 -> 138.30000000000001 | AL261: 138.5 | AM261: 193 | AN261: 46.9 | AO261: 189 | AP261: -2.9999999999999999e-002 | AQ261: 29 | AR261: 中环转债!
A262: 121 | B262: 希望转债! | C262: 127015 | D262: 43865. | E262: 新 希 望 | F262: 876 | G262: 农业 | H262: 畜牧业 | I262: 150.8 | J262: 3.6499999999999998e-002 | K262: -3.7000000000000002e-003 | L262: 29.59 | M262: 3.2799999999999996e-002 | N262: 312 | O262: 0.113 | P262: 110.2 | Q262: 19.63 | R262: 4.3 | S262: 150.74 | T262: 0. | U262: 转股中 | V262: 5.29年 | W262: 3.29年 | X262: 1.3999999999999999e-002 | Y262: 2.2000000000000002e-002 | Z262: 18 | AA262: 1274. | AB262: -5.8299999999999998e-002 | AC262: -6.1500000000000006e-002 | AD262: -0.10300000000000001 | AE262: -0.10400000000000001 | AF262: 90 | AG262: 89.98 | AH262: 1 | AI262: AAA | AJ262: 3.9699999999999999e-002 | AK262: =I262+100*T262 -> 150.80000000000001 | AL262: 150.9 | AM262: 246 | AN262: 60.9 | AO262: 246 | AP262: -0.16399999999999998 | AQ262: 29 | AR262: 希望转债!
A263: 99 | B263: 博特转债 | C263: 113571 | D263: 43922. | E263: 苏博特 | F263: 603916 | G263: 建筑 | H263: 水泥 | I263: 167.66 | J263: 4.7699999999999992e-002 | K263: -5.5000000000000005e-003 | L263: 32.12 | M263: 4.4600000000000001e-002 | N263: 126 | O263: 0.109 | P263: 120.8 | Q263: 18.88 | R263: 4.04 | S263: 170.13 | T263: -1.4999999999999999e-002 | U263: 转股中 | V263: 5.48年 | W263: 3.48年 | X263: 7.0000000000000007e-002 | Y263: 0.11900000000000001 | Z263: 7 | AA263: 100 | AB263: -5.9200000000000003e-002 | AC263: -6.5000000000000002e-002 | AD263: -0.12 | AE263: -0.121 | AF263: 82.83 | AG263: 85.92 | AH263: 0.95 | AI263: AA- | AJ263: 6.5700000000000008e-002 | AK263: =I263+100*T263 -> 166.16 | AL263: 165.2 | AM263: 265 | AN263: 79.3 | AO263: 267 | AP263: -5.2999999999999999e-002 | AQ263: 14 | AR263: 博特转债
A264: 68 | B264: 福莱转债 | C264: 113035 | D264: 43999. | E264: 福莱特 | F264: 601865 | G264: 能源电力 | H264: 太阳能 | I264: 170.76 | J264: -5.5000000000000005e-003 | K264: -2.0000000000000001e-004 | L264: 25.13 | M264: -5.8999999999999999e-003 | N264: 117 | O264: 4.7e-002 | P264: 120.3 | Q264: 13.56 | R264: 9.83 | S264: 185.32 | T264: -7.9000000000000001e-002 | U264: 2月15天 | V264: 5.69年 | W264: 3.69年 | X264: 2.9999999999999999e-002 | Y264: 5.5e-002 | Z264: 15 | AA264: 491 | AB264: -6.0700000000000004e-002 | AC264: -6.6199999999999995e-002 | AD264: -0.11699999999999999 | AE264: -0.11900000000000001 | AF264: 87.85 | AG264: 94.25 | AH264: 0.95 | AI264: AA | AJ264: 4.4699999999999997e-002 | AK264: =I264+100*T264 -> 162.85999999999999 | AL264: 156.2 | AM264: 258 | AN264: 61.9 | AO264: 250 | AP264: 8.5999999999999993e-002 | AQ264: 5 | AR264: 福莱转债
A265: 170 | B265: 欧派转债! | C265: 113543 | D265: 43712. | E265: 欧派家居 | F265: 603833 | G265: 其他 | H265: 家居用品 | I265: 158.38 | J265: 2.86e-002 | K265: -8.3999999999999995e-003 | L265: 113.59 | M265: 2.1899999999999999e-002 | N265: 76 | O265: 4.5999999999999999e-002 | P265: 114.9 | Q265: 71.69 | R265: 5.14 | S265: 158.45 | T265: 0. | U265: 转股中 | V265: 4.91年 | W265: 3.91年 | X265: 1.6e-002 | Y265: 2.5000000000000001e-002 | Z265: 10 | AA265: 668 | AB265: -6.4299999999999996e-002 | AC265: -6.9199999999999998e-002 | AD265: -9.6600000000000005e-002 | AE265: -9.8599999999999993e-002 | AF265: 88.97 | AG265: 93.94 | AH265: 0.93 | AI265: AA | AJ265: 4.2699999999999995e-002 | AK265: =I265+100*T265 -> 158.38 | AL265: 158.3 | AM265: 259 | AN265: 64.4 | AO265: 255 | AP265: 8.0000000000000002e-002 | AQ265: 15 | AR265: 欧派转债!
A266: 69 | B266: 火炬转债 | C266: 113582 | D266: 44005. | E266: 火炬电子 | F266: 603678 | G266: 电子 | H266: 元器件制 | I266: 168.36 | J266: 3.5900000000000001e-002 | K266: -6.8999999999999999e-003 | L266: 43.45 | M266: 3.0600000000000002e-002 | N266: 165 | O266: 0.16500000000000001 | P266: 115.3 | Q266: 25.33 | R266: 5.93 | S266: 171.54 | T266: -1.9e-002 | U266: 2月14天 | V266: 5.69年 | W266: 3.69年 | X266: 3.1e-002 | Y266: 5.2000000000000005e-002 | Z266: 6 | AA266: 197 | AB266: -6.5500000000000003e-002 | AC266: -6.9699999999999998e-002 | AD266: -0.114 | AE266: -0.11599999999999999 | AF266: 87.85 | AG266: 90.35 | AH266: 0.95 | AI266: AA | AJ266: 4.4699999999999997e-002 | AK266: =I266+100*T266 -> 166.46000000000001 | AL266: 165.2 | AM266: 264 | AN266: 74.8 | AO266: 265 | AP266: 0.10199999999999999 | AQ266: 4 | AR266: 火炬转债
A267: 95 | B267: 海大转债 | C267: 128102 | D267: 43937. | E267: 海大集团 | F267: 2311 | G267: 农业 | H267: 畜牧业 | I267: 167.016 | J267: -4.07e-002 | K267: -5.0000000000000001e-004 | L267: 59.6 | M267: -4.3299999999999998e-002 | N267: 359 | O267: 7.5999999999999998e-002 | P267: 114.1 | Q267: 34.74 | R267: 9.59 | S267: 171.56 | T267: -2.6000000000000002e-002 | U267: 6.1天 | V267: 5.50年 | W267: 4.50年 | X267: 2.9999999999999999e-002 | Y267: 5.2000000000000005e-002 | Z267: 28 | AA267: 942 | AB267: -6.7799999999999999e-002 | AC267: -7.1900000000000006e-002 | AD267: -9.6699999999999994e-002 | AE267: -9.8100000000000007e-002 | AF267: 86.12 | AG267: 90.98 | AH267: 0.95 | AI267: AA+ | AJ267: 4.2699999999999995e-002 | AK267: =I267+100*T267 -> 164.416 | AL267: 162.5 | AM267: 262 | AN267: 71.5 | AO267: 262 | AP267: -0.11800000000000001 | AQ267: 12 | AR267: 海大转债
A268: 54 | B268: 歌尔转2 | C268: 128112 | D268: 44025. | E268: 歌尔股份 | F268: 2241 | G268: 电子 | H268: 电子产品 | I268: 173 | J268: 1.1999999999999999e-003 | K268: 7.9000000000000008e-003 | L268: 40.86 | M268: 9.5999999999999992e-003 | N268: 340 | O268: 4.9000000000000002e-002 | P268: 114.5 | Q268: 23.27 | R268: 8.2 | S268: 175.59 | T268: -1.4999999999999999e-002 | U268: 3月0天 | V268: 5.73年 | W268: 3.73年 | X268: 2.9999999999999999e-002 | Y268: 5.2999999999999999e-002 | Z268: 40 | AA268: 1326. | AB268: -7.0300000000000001e-002 | AC268: -7.4400000000000008e-002 | AD268: -0.12 | AE268: -0.121 | AF268: 87.6 | AG268: 90.42 | AH268: 0.94 | AI268: AA+ | AJ268: 4.2699999999999995e-002 | AK268: =I268+100*T268 -> 171.5 | AL268: 170.4 | AM268: 269 | AN268: 80 | AO268: 268 | AP268: -2.1000000000000001e-002 | AQ268: 16 | AR268: 歌尔转2
A269: 267 | B269: 赣锋转债!! | C269: 128028 | D269: 43119. | E269: 赣锋锂业 | F269: 2460 | G269: 有色金属 | H269: 小金属 | I269: 141 | J269: 2.9100000000000001e-002 | K269: 1.1000000000000001e-002 | L269: 55.8 | M269: 4.0099999999999997e-002 | N269: 59 | O269: 4.5999999999999999e-002 | P269: 109.3 | Q269: 41.98 | R269: 8.97 | S269: 132.92 | T269: 6.0999999999999999e-002 | U269: 转股中 | V269: 3.26年 | W269: 1.26年 | X269: 1.3000000000000001e-002 | Y269: 1.7000000000000001e-002 | Z269: 9.2 | AA269: 721 | AB269: -7.6399999999999996e-002 | AC269: -8.1099999999999992e-002 | AD269: -0.18600000000000003 | AE269: -0.187 | AF269: 96.2 | AG269: 95.62 | AH269: 1 | AI269: AA | AJ269: 4.2699999999999995e-002 | AK269: =I269+100*T269 -> 147.09999999999999 | AL269: 149.1 | AM269: 244 | AN269: 52.9 | AO269: 218 | AP269: 9.8000000000000004e-002 | AQ269: 13 | AR269: 赣锋转债!!
A270: 59 | B270: 上机转债 | C270: 113586 | D270: 44019. | E270: 上机数控 | F270: 603185 | G270: 机械装备 | H270: 专用设备 | I270: 197.76 | J270: 1.3300000000000001e-002 | K270: 3.2000000000000002e-003 | L270: 74.1 | M270: 1.6899999999999998e-002 | N270: 102 | O270: 7.8e-002 | P270: 120.8 | Q270: 33.31 | R270: 9.48 | S270: 222.46 | T270: -0.111 | U270: 2月27天 | V270: 5.72年 | W270: 3.72年 | X270: 3.9e-002 | Y270: 8.5999999999999993e-002 | Z270: 6.7 | AA270: 172 | AB270: -8.3900000000000002e-002 | AC270: -8.929999999999999e-002 | AD270: -0.14499999999999999 | AE270: -0.14699999999999999 | AF270: 81.55 | AG270: 84.6 | AH270: 0.97 | AI270: AA- | AJ270: 6.5700000000000008e-002 | AK270: =I270+100*T270 -> 186.66 | AL270: 173.1 | AM270: 271 | AN270: 88.5 | AO270: 273 | AP270: 0.11800000000000001 | AQ270: 8 | AR270: 上机转债
A271: 251 | B271: 金农转债!! | C271: 128036 | D271: 43192. | E271: 金新农 | F271: 2548 | G271: 农业 | H271: 畜牧业 | I271: 150.6 | J271: 7.4000000000000003e-003 | K271: 1.21e-002 | L271: 8.91 | M271: 1.95e-002 | N271: 746 | O271: 3.3199999999999998 | P271: 110.3 | Q271: 7.39 | R271: 2.53 | S271: 120.57 | T271: 0.249 | U271: 转股中 | V271: 3.47年 | W271: 1.47年 | X271: 2.8999999999999998e-002 | Y271: 3.5000000000000003e-002 | Z271: 1.5 | AA271: 50 | AB271: -8.7300000000000003e-002 | AC271: -9.2100000000000015e-002 | AD271: -0.18100000000000002 | AE271: -0.183 | AF271: 93.01 | AG271: 89.43 | AH271: 1 | AI271: AA- | AJ271: 6.3700000000000007e-002 | AK271: =I271+100*T271 -> 175.5 | AL271: 180.6 | AM271: 273 | AN271: 87.6 | AO271: 272 | AP271: -0.107 | AQ271: 15 | AR271: 金农转债!!
A272: 213 | B272: 尚荣转债! | C272: 128053 | D272: 43531. | E272: 尚荣医疗 | F272: 2551 | G272: 医药 | H272: 医疗器械 | I272: 171.315 | J272: -1.1000000000000001e-003 | K272: 1.09e-002 | L272: 7.2 | M272: 9.7999999999999997e-003 | N272: 99 | O272: 0.30299999999999999 | P272: 114.9 | Q272: 4.89 | R272: 2.02 | S272: 147.24 | T272: 0.16399999999999998 | U272: 转股中 | V272: 4.41年 | W272: 2.41年 | X272: 3.2000000000000001e-002 | Y272: 4.8000000000000001e-002 | Z272: 1.9 | AA272: 59 | AB272: -8.8100000000000012e-002 | AC272: -9.3399999999999997e-002 | AD272: -0.126 | AE272: -0.128 | AF272: 92.96 | AG272: 95.93 | AH272: 1 | AI272: AA | AJ272: 4.2699999999999995e-002 | AK272: =I272+100*T272 -> 187.715 | AL272: 195.4 | AM272: 278 | AN272: 99.5 | AO272: 275 | AP272: -5.5e-002 | AQ272: 27 | AR272: 尚荣转债!
A273: 237 | B273: 凯发转债! | C273: 123014 | D273: 43333. | E273: 凯发电气 | F273: 300407 | G273: 能源电力 | H273: 电力设备 | I273: 141.878 | J273: -8.6999999999999994e-003 | K273: 1.04e-002 | L273: 9.39 | M273: 2.0999999999999999e-003 | N273: 192 | O273: 1.1599999999999999 | P273: 108.5 | Q273: 8.12 | R273: 2.18 | S273: 115.64 | T273: 0.22699999999999998 | U273: 转股中 | V273: 2.85年 | W273: 0.85年 | X273: 4.0000000000000001e-002 | Y273: 4.7e-002 | Z273: 1.2 | AA273: 29 | AB273: -9.0700000000000003e-002 | AC273: -9.5500000000000002e-002 | AD273: -0.28100000000000003 | AE273: -0.28199999999999997 | AF273: 94.22 | AG273: 88.89 | AH273: 0.81 | AI273: A+ | AJ273: 7.3300000000000004e-002 | AK273: =I273+100*T273 -> 164.57799999999997 | AL273: 168.1 | AM273: 268 | AN273: 73.9 | AO273: 264 | AP273: 1.e-002 | AQ273: 14 | AR273: 凯发转债!
A274: 202 | B274: 长信转债!! | C274: 123022 | D274: 43565. | E274: 长信科技 | F274: 300088 | G274: 通信互联 | H274: 通信设备 | I274: 176.1 | J274: 1.21e-002 | K274: 4.0000000000000002e-004 | L274: 10.86 | M274: 1.3100000000000001e-002 | N274: 31 | O274: 5.7999999999999996e-002 | P274: 114.9 | Q274: 6.15 | R274: 4.05 | S274: 176.59 | T274: -3.0000000000000001e-003 | U274: 转股中 | V274: 4.49年 | W274: 2.49年 | X274: 1.1000000000000001e-002 | Y274: 2.e-002 | Z274: 3 | AA274: 265 | AB274: -9.2100000000000015e-002 | AC274: -9.7200000000000009e-002 | AD274: -0.126 | AE274: -0.127 | AF274: 92.62 | AG274: 95.58 | AH274: 0.95 | AI274: AA | AJ274: 4.2699999999999995e-002 | AK274: =I274+100*T274 -> 175.79999999999998 | AL274: 175.6 | AM274: 272 | AN274: 80 | AO274: 269 | AP274: -6.7000000000000004e-002 | AQ274: 12 | AR274: 长信转债!!
A275: 215 | B275: 联泰转债! | C275: 113526 | D275: 43514. | E275: 联泰环保 | F275: 603797 | G275: 城市公用 | H275: 三废处理 | I275: 169.97 | J275: -4.0000000000000001e-003 | K275: 6.9999999999999993e-003 | L275: 9.09 | M275: 3.3e-003 | N275: 20 | O275: 6.2e-002 | P275: 110.8 | Q275: 6.11 | R275: 1.92 | S275: 148.77 | T275: 0.14199999999999999 | U275: 转股中 | V275: 4.35年 | W275: 2.35年 | X275: 4.7e-002 | Y275: 7.0999999999999994e-002 | Z275: 1.9 | AA275: 41 | AB275: -9.5399999999999985e-002 | AC275: -9.9199999999999997e-002 | AD275: -0.129 | AE275: -0.13 | AF275: 93.1 | AG275: 92.74 | AH275: 0.9 | AI275: AA | AJ275: 4.2699999999999995e-002 | AK275: =I275+100*T275 -> 184.16999999999999 | AL275: 191.2 | AM275: 275 | AN275: 98.1 | AO275: 274 | AP275: -4.0000000000000001e-003 | AQ275: 7 | AR275: 联泰转债!
A276: 177 | B276: 蓝晓转债! | C276: 123027 | D276: 43650. | E276: 蓝晓科技 | F276: 300487 | G276: 化工 | H276: 化工 | I276: 194.37 | J276: 2.63e-002 | K276: 7.6e-003 | L276: 57.1 | M276: 3.5200000000000002e-002 | N276: 1012. | O276: 4.6699999999999999 | P276: 119.5 | Q276: 29.33 | R276: 8.63 | S276: 194.68 | T276: -2.e-003 | U276: 转股中 | V276: 4.73年 | W276: 2.73年 | X276: 9.0000000000000011e-003 | Y276: 1.8000000000000002e-002 | Z276: 1.1 | AA276: 120 | AB276: -9.9700000000000011e-002 | AC276: -0.106 | AD276: -0.126 | AE276: -0.127 | AF276: 84.98 | AG276: 85.74 | AH276: 0.97 | AI276: A+ | AJ276: 7.4700000000000003e-002 | AK276: =I276+100*T276 -> 194.17000000000002 | AL276: 194.1 | AM276: 277 | AN276: 108.3 | AO276: 278 | AP276: 0.17100000000000001 | AQ276: 21 | AR276: 蓝晓转债!
A277: 280 | B277: 金禾转债!! | C277: 128017 | D277: 43066. | E277: 金禾实业 | F277: 2597 | G277: 化工 | H277: 化工 | I277: 152.1 | J277: 2.5000000000000001e-003 | K277: 4.4000000000000003e-003 | L277: 34.1 | M277: 7.4000000000000003e-003 | N277: 32 | O277: 3.7999999999999999e-002 | P277: 109.8 | Q277: 22.42 | R277: 4.35 | S277: 152.1 | T277: 0. | U277: 转股中 | V277: 3年43天 | W277: 1年43天 | X277: 2.8999999999999998e-002 | Y277: 4.4000000000000004e-002 | Z277: 5.5 | AA277: 191 | AB277: -0.10099999999999999 | AC277: -0.106 | AD277: -0.247 | AE277: -0.249 | AF277: 97.24 | AG277: 96.65 | AH277: 0.93 | AI277: AA | AJ277: 4.2699999999999995e-002 | AK277: =I277+100*T277 -> 152.09999999999999 | AL277: 152.1 | AM277: 251 | AN277: 54.9 | AO277: 227 | AP277: -1.9e-002 | AQ277: 11 | AR277: 金禾转债!!
A278: 295 | B278: 电气转债! | C278: 113008 | D278: 42051. | E278: 上海电气 | F278: 601727 | G278: 能源电力 | H278: 电力设备 | I278: 110.99 | J278: 6.8999999999999999e-003 | K278: 4.1999999999999997e-003 | L278: 5.41 | M278: 2.2700000000000001e-002 | N278: 23 | O278: 5.0000000000000001e-003 | P278: 106.6 | Q278: 5.13 | R278: 1.26 | S278: 105.46 | T278: 5.2000000000000005e-002 | U278: 转股中 | V278: 0.37年 | W278: 回售中 | X278: 5.4000000000000006e-002 | Y278: 5.7000000000000002e-002 | Z278: 44 | AA278: 820 | AB278: -0.10300000000000001 | AC278: -0.13200000000000001 | AD278: 回售中 | AE278: 回售中 | AF278: 103 | AG278: 105.29 | AH278: 0.49 | AI278: AAA | AJ278: 3.3799999999999997e-002 | AK278: =I278+100*T278 -> 116.19 | AL278: 116.5 | AM278: 6 | AN278: 11.2 | AO278: 1 | AP278: -1.6e-002 | AQ278: 28 | AR278: 电气转债!
A279: 234 | B279: 蓝盾转债!! | C279: 123015 | D279: 43356. | E279: 蓝盾股份 | F279: 300297 | G279: 计算机及 | H279: 软件开发 | I279: 176.719 | J279: 9.7999999999999997e-003 | K279: -4.6999999999999993e-003 | L279: 5.44 | M279: 9.300000000000001e-003 | N279: 968 | O279: 5.3300000000000001 | P279: 112.3 | Q279: 5.79 | R279: 1.81 | S279: 93.96 | T279: 0.88099999999999989 | U279: 转股中 | V279: 3.90年 | W279: 1.90年 | X279: 1.4999999999999999e-002 | Y279: 1.3999999999999999e-002 | Z279: 1 | AA279: 68 | AB279: -0.111 | AC279: -0.11599999999999999 | AD279: -0.17899999999999999 | AE279: -0.17999999999999999 | AF279: 94.35 | AG279: 95.69 | AH279: 0.55 | AI279: AA | AJ279: 4.2699999999999995e-002 | AK279: =I279+100*T279 -> 264.81899999999996 | AL279: 259.5 | AM279: 285 | AN279: 163.8 | AO279: 284 | AP279: 2.6000000000000002e-002 | AQ279: 18 | AR279: 蓝盾转债!!
A280: 228 | B280: 科森转债!! | C280: 113521 | D280: 43441. | E280: 科森科技 | F280: 603626 | G280: 通信互联 | H280: 通信设备 | I280: 196.35 | J280: 1.9299999999999998e-002 | K280: -9.4999999999999998e-003 | L280: 16.72 | M280: 1.03e-002 | N280: 117 | O280: 0.93299999999999994 | P280: 115.2 | Q280: 8.7 | R280: 3.88 | S280: 192.18 | T280: 2.2000000000000002e-002 | U280: 转股中 | V280: 4年58天 | W280: 2年58天 | X280: 8.0000000000000002e-003 | Y280: 1.4999999999999999e-002 | Z280: 0.6 | AA280: 81 | AB280: -0.122 | AC280: -0.128 | AD280: -0.17399999999999999 | AE280: -0.17499999999999999 | AF280: 94.05 | AG280: 97.2 | AH280: 0.96 | AI280: AA | AJ280: 4.2699999999999995e-002 | AK280: =I280+100*T280 -> 198.54999999999998 | AL280: 200.5 | AM280: 279 | AN280: 103.3 | AO280: 277 | AP280: 6.8000000000000005e-002 | AQ280: 25 | AR280: 科森转债!!
A281: 70 | B281: 龙蟠转债 | C281: 113581 | D281: 43970. | E281: 龙蟠科技 | F281: 603906 | G281: 化工 | H281: 化工 | I281: 267.82 | J281: 2.53e-002 | K281: 1.4000000000000002e-003 | L281: 28.07 | M281: 2.75e-002 | N281: 409 | O281: 0.38799999999999996 | P281: 129.6 | Q281: 9.48 | R281: 6.02 | S281: 296.1 | T281: -9.5000000000000001e-002 | U281: 40天 | V281: 5.59年 | W281: 3.59年 | X281: 4.7e-002 | Y281: 0.13900000000000001 | Z281: 4 | AA281: 85 | AB281: -0.124 | AC281: -0.13100000000000001 | AD281: -0.11199999999999999 | AE281: -0.113 | AF281: 81.15 | AG281: 86.83 | AH281: 0.97 | AI281: A+ | AJ281: 7.6700000000000004e-002 | AK281: =I281+100*T281 -> 258.31999999999999 | AL281: 239.5 | AM281: 283 | AN281: 152.7 | AO281: 283 | AP281: -1.e-003 | AQ281: 14 | AR281: 龙蟠转债
A282: 217 | B282: 溢利转债! | C282: 123018 | D282: 43488. | E282: 溢多利 | F282: 300381 | G282: 医药 | H282: 原料药 | I282: 212.8 | J282: 9.9499999999999991e-002 | K282: -8.43e-002 | L282: 14.05 | M282: 1.5900000000000001e-002 | N282: 1186. | O282: 10.18 | P282: 114.9 | Q282: 8.29 | R282: 2.43 | S282: 169.48 | T282: 0.25600000000000001 | U282: 转股中 | V282: 4.25年 | W282: 2.25年 | X282: 8.0000000000000002e-003 | Y282: 1.3999999999999999e-002 | Z282: 0.5 | AA282: 67 | AB282: -0.13699999999999998 | AC282: -0.14199999999999999 | AD282: -0.17999999999999999 | AE282: -0.18100000000000002 | AF282: 89.2 | AG282: 88.87 | AH282: 0.96 | AI282: AA- | AJ282: 6.3700000000000007e-002 | AK282: =I282+100*T282 -> 238.40000000000001 | AL282: 256.1 | AM282: 284 | AN282: 166.9 | AO282: 285 | AP282: -1.2e-002 | AQ282: 13 | AR282: 溢利转债!
A283: 230 | B283: 百合转债! | C283: 113520 | D283: 43430. | E283: 梦百合 | F283: 603313 | G283: 其他 | H283: 家居用品 | I283: 212.26 | J283: 1.2699999999999999e-002 | K283: 1.4000000000000002e-003 | L283: 30.19 | M283: 1.44e-002 | N283: 130 | O283: 0.92900000000000005 | P283: 115.2 | Q283: 14.28 | R283: 4 | S283: 211.41 | T283: 4.0000000000000001e-003 | U283: 转股中 | V283: 4年50天 | W283: 2年50天 | X283: 6.0000000000000001e-003 | Y283: 1.3000000000000001e-002 | Z283: 0.7 | AA283: 104 | AB283: -0.14000000000000001 | AC283: -0.14499999999999999 | AD283: -0.192 | AE283: -0.193 | AF283: 89.97 | AG283: 89.77 | AH283: 0.98 | AI283: AA- | AJ283: 6.3700000000000007e-002 | AK283: =I283+100*T283 -> 212.66 | AL283: 213.1 | AM283: 280 | AN283: 123.1 | AO283: 281 | AP283: -2.9999999999999999e-002 | AQ283: 11 | AR283: 百合转债!
A284: 164 | B284: 晶瑞转债! | C284: 123031 | D284: 43734. | E284: 晶瑞股份 | F284: 300655 | G284: 化工 | H284: 化工 | I284: 253.29 | J284: -1.83e-002 | K284: 1.8000000000000002e-002 | L284: 37.55 | M284: -2.9999999999999997e-004 | N284: 753 | O284: 4.5899999999999999 | P284: 115.8 | Q284: 18.53 | R284: 5.66 | S284: 202.64 | T284: 0.25 | U284: 转股中 | V284: 4.94年 | W284: 2.94年 | X284: 9.0000000000000011e-003 | Y284: 1.8000000000000002e-002 | Z284: 0.6 | AA284: 71 | AB284: -0.14800000000000002 | AC284: -0.153 | AD284: -0.14699999999999999 | AE284: -0.14699999999999999 | AF284: 82.72 | AG284: 81.63 | AH284: 0.97 | AI284: A+ | AJ284: 7.4700000000000003e-002 | AK284: =I284+100*T284 -> 278.28999999999996 | AL284: 303.9 | AM284: 287 | AN284: 221.2 | AO284: 288 | AP284: 1.9e-002 | AQ284: 14 | AR284: 晶瑞转债!
A285: 265 | B285: 天康转债!! | C285: 128030 | D285: 43129. | E285: 天康生物 | F285: 2100 | G285: 农业 | H285: 畜牧业 | I285: 200.805 | J285: 4.0999999999999995e-003 | K285: 1.49e-002 | L285: 14.5 | M285: 1.9e-002 | N285: 65 | O285: 0.32899999999999996 | P285: 112.3 | Q285: 7.85 | R285: 2.95 | S285: 184.71 | T285: 8.6999999999999994e-002 | U285: 转股中 | V285: 3.26年 | W285: 1.26年 | X285: 6.0000000000000001e-003 | Y285: 1.2e-002 | Z285: 1 | AA285: 156 | AB285: -0.16600000000000001 | AC285: -0.17100000000000001 | AD285: -0.32899999999999996 | AE285: -0.33000000000000002 | AF285: 96.91 | AG285: 98.3 | AH285: 1 | AI285: AA | AJ285: 4.2699999999999995e-002 | AK285: =I285+100*T285 -> 209.505 | AL285: 216.9 | AM285: 281 | AN285: 118.6 | AO285: 280 | AP285: -0.13600000000000001 | AQ285: 11 | AR285: 天康转债!!
A286: 284 | B286: 模塑转债!! | C286: 127004 | D286: 42963. | E286: 模塑科技 | F286: 700 | G286: 汽车 | H286: 零部件制 | I286: 186.9 | J286: -1.1000000000000001e-003 | K286: 5.0000000000000001e-003 | L286: 6.9 | M286: 8.8000000000000005e-003 | N286: 621 | O286: 2.4900000000000002 | P286: 113.3 | Q286: 7.46 | R286: 2.37 | S286: 92.49 | T286: 1.02 | U286: 转股中 | V286: 2.70年 | W286: 0.70年 | X286: 2.1000000000000001e-002 | Y286: 1.9e-002 | Z286: 1.3 | AA286: 63 | AB286: -0.17100000000000001 | AC286: -0.17800000000000002 | AD286: -0.53200000000000003 | AE286: -0.53400000000000003 | AF286: 98.29 | AG286: 101.75 | AH286: 0.45 | AI286: AA | AJ286: 4.1299999999999996e-002 | AK286: =I286+100*T286 -> 288.89999999999998 | AL286: 281.3 | AM286: 286 | AN286: 179.6 | AO286: 286 | AP286: -4.4999999999999998e-002 | AQ286: 38 | AR286: 模塑转债!!
A287: 242 | B287: 盛路转债!! | C287: 128041 | D287: 43326. | E287: 盛路通信 | F287: 2446 | G287: 通信互联 | H287: 通信设备 | I287: 233 | J287: 3.56e-002 | K287: -2.9399999999999999e-002 | L287: 8.13 | M287: 6.1999999999999998e-003 | N287: 1960. | O287: 14.699999999999999 | P287: 114.3 | Q287: 6.85 | R287: 2.57 | S287: 118.69 | T287: 0.96299999999999997 | U287: 转股中 | V287: 3.83年 | W287: 1.83年 | X287: 6.9999999999999993e-003 | Y287: 9.0000000000000011e-003 | Z287: 0.5 | AA287: 73 | AB287: -0.17199999999999999 | AC287: -0.17699999999999999 | AD287: -0.251 | AE287: -0.252 | AF287: 94.64 | AG287: 97.69 | AH287: 1 | AI287: AA | AJ287: 4.2699999999999995e-002 | AK287: =I287+100*T287 -> 329.30000000000001 | AL287: 347.3 | AM287: 289 | AN287: 249.6 | AO287: 289 | AP287: 2.3e-002 | AQ287: 12 | AR287: 盛路转债!!
A288: 266 | B288: 太阳转债!! | C288: 128029 | D288: 43116. | E288: 太阳纸业 | F288: 2078 | G288: 造纸包装 | H288: 造纸行业 | I288: 164.7 | J288: 6.1999999999999998e-003 | K288: 5.3e-003 | L288: 14.1 | M288: 1.15e-002 | N288: 38 | O288: 2.e-002 | P288: 107.8 | Q288: 8.55 | R288: 2.38 | S288: 164.91 | T288: -1.e-003 | U288: 转股中 | V288: 2.26年 | W288: 0.26年 | X288: 3.1e-002 | Y288: 5.0999999999999997e-002 | Z288: 11 | AA288: 365 | AB288: -0.17300000000000001 | AC288: -0.17800000000000002 | AD288: -0.96700000000000008 | AE288: -0.96999999999999997 | AF288: 99.33 | AG288: 98.91 | AH288: 1 | AI288: AA+ | AJ288: 3.9300000000000002e-002 | AK288: =I288+100*T288 -> 164.59999999999999 | AL288: 164.5 | AM288: 263 | AN288: 65.2 | AO288: 258 | AP288: 2.4e-002 | AQ288: 8 | AR288: 太阳转债!!
A289: 249 | B289: 新泉转债!! | C289: 113509 | D289: 43273. | E289: 新泉股份 | F289: 603179 | G289: 汽车 | H289: 零部件制 | I289: 235.46 | J289: -1.7000000000000001e-002 | K289: -3.3e-003 | L289: 33.65 | M289: -2.07e-002 | N289: 105 | O289: 0.30199999999999999 | P289: 110.3 | Q289: 14.22 | R289: 5.42 | S289: 236.64 | T289: -5.0000000000000001e-003 | U289: 转股中 | V289: 3.71年 | W289: 1.71年 | X289: 1.3999999999999999e-002 | Y289: 3.4000000000000002e-002 | Z289: 1.5 | AA289: 104 | AB289: -0.187 | AC289: -0.191 | AD289: -0.27300000000000002 | AE289: -0.27399999999999997 | AF289: 95.11 | AG289: 94.74 | AH289: 0.98 | AI289: AA | AJ289: 4.2699999999999995e-002 | AK289: =I289+100*T289 -> 234.96000000000001 | AL289: 234.3 | AM289: 282 | AN289: 139.2 | AO289: 282 | AP289: 8.6999999999999994e-002 | AQ289: 11 | AR289: 新泉转债!!
A290: 235 | B290: 东音转债!! | C290: 128043 | D290: 43339. | E290: 罗欣药业 | F290: 2793 | G290: 医药 | H290: 化学制药 | I290: 276.56 | J290: -6.3e-003 | K290: -5.0000000000000001e-003 | L290: 14.97 | M290: -1.1200000000000002e-002 | N290: 265 | O290: 2.4199999999999999 | P290: 114.5 | Q290: 6.22 | R290: 5.59 | S290: 240.68 | T290: 0.14899999999999999 | U290: 转股中 | V290: 3.87年 | W290: 1.87年 | X290: 2.e-003 | Y290: 4.0000000000000001e-003 | Z290: 0.4 | AA290: 217 | AB290: -0.20600000000000002 | AC290: -0.21100000000000002 | AD290: -0.27600000000000002 | AE290: -0.27600000000000002 | AF290: 94.5 | AG290: 97.68 | AH290: 1 | AI290: AA | AJ290: 4.2699999999999995e-002 | AK290: =I290+100*T290 -> 291.45999999999998 | AL290: 312.4 | AM290: 288 | AN290: 214.8 | AO290: 287 | AP290: -9.5000000000000001e-002 | AQ290: 11 | AR290: 东音转债!!
A291: 216 | B291: 凯龙转债! | C291: 128052 | D291: 43486. | E291: 凯龙股份 | F291: 2783 | G291: 化工 | H291: 化工 | I291: 304 | J291: -0.106 | K291: 0.11 | L291: 13.36 | M291: 4.5000000000000005e-003 | N291: 784 | O291: 7.7199999999999998 | P291: 115 | Q291: 6.67 | R291: 2.94 | S291: 200.3 | T291: 0.51800000000000002 | U291: 转股中 | V291: 4.26年 | W291: 2.26年 | X291: 6.0000000000000001e-003 | Y291: 1.3000000000000001e-002 | Z291: 0.3 | AA291: 50 | AB291: -0.20699999999999999 | AC291: -0.21199999999999999 | AD291: -0.23199999999999998 | AE291: -0.23300000000000001 | AF291: 93.65 | AG291: 96.64 | AH291: 1 | AI291: AA | AJ291: 4.2699999999999995e-002 | AK291: =I291+100*T291 -> 355.80000000000001 | AL291: 407.7 | AM291: 291 | AN291: 311.1 | AO291: 291 | AP291: 2.8999999999999998e-002 | AQ291: 12 | AR291: 凯龙转债!
A292: 246 | B292: 广电转债!! | C292: 110044 | D292: 43305. | E292: 广电网络 | F292: 600831 | G292: 传媒娱乐 | H292: 影视娱乐 | I292: 278.1 | J292: -8.6199999999999999e-002 | K292: 9.2600000000000002e-002 | L292: 7.84 | M292: 9.0000000000000011e-003 | N292: 590 | O292: 2.8700000000000001 | P292: 112.3 | Q292: 6.9 | R292: 1.51 | S292: 113.62 | T292: 1.45 | U292: 转股中 | V292: 3.77年 | W292: 1.77年 | X292: 1.3000000000000001e-002 | Y292: 1.3999999999999999e-002 | Z292: 0.7 | AA292: 56 | AB292: -0.21600000000000003 | AC292: -0.221 | AD292: -0.29399999999999998 | AE292: -0.29499999999999998 | AF292: 94.86 | AG292: 96.2 | AH292: 0.72 | AI292: AA | AJ292: 4.2699999999999995e-002 | AK292: =I292+100*T292 -> 423.10000000000002 | AL292: 442.6 | AM292: 292 | AN292: 346.4 | AO292: 292 | AP292: -5.5999999999999994e-002 | AQ292: 11 | AR292: 广电转债!!
A293: 134 | B293: 振德转债! | C293: 113555 | D293: 43844. | E293: 振德医疗 | F293: 603301 | G293: 医药 | H293: 医疗器械 | I293: 458.04 | J293: 2.0400000000000001e-002 | K293: 1.7000000000000001e-003 | L293: 63.86 | M293: 2.2400000000000003e-002 | N293: 459 | O293: 0.45799999999999996 | P293: 124.8 | Q293: 14.01 | R293: 5.74 | S293: 455.82 | T293: 5.0000000000000001e-003 | U293: 转股中 | V293: 5.25年 | W293: 3.25年 | X293: 1.7000000000000001e-002 | Y293: 7.9000000000000001e-002 | Z293: 2.2 | AA293: 127 | AB293: -0.223 | AC293: -0.22800000000000001 | AD293: -0.16899999999999998 | AE293: -0.17000000000000001 | AF293: 84.53 | AG293: 90.12 | AH293: 0.99 | AI293: AA- | AJ293: 6.5700000000000008e-002 | AK293: =I293+100*T293 -> 458.54000000000002 | AL293: 460.3 | AM293: 293 | AN293: 370.1 | AO293: 293 | AP293: -8.6999999999999994e-002 | AQ293: 16 | AR293: 振德转债!
A294: 239 | B294: 横河转债! | C294: 123013 | D294: 43332. | E294: 横河模具 | F294: 300539 | G294: 机械装备 | H294: 专用设备 | I294: 347 | J294: -3.8800000000000001e-002 | K294: 1.1200000000000002e-002 | L294: 9.07 | M294: -4.1200000000000001e-002 | N294: 288 | O294: 2.1299999999999999 | P294: 115.2 | Q294: 9.13 | R294: 4.11 | S294: 99.34 | T294: 2.4900000000000002 | U294: 转股中 | V294: 3.85年 | W294: 1.85年 | X294: 1.9e-002 | Y294: 1.9e-002 | Z294: 0.4 | AA294: 20 | AB294: -0.252 | AC294: -0.25700000000000001 | AD294: -0.312 | AE294: -0.313 | AF294: 89.5 | AG294: 87.84 | AH294: 0.67 | AI294: A+ | AJ294: 7.4700000000000003e-002 | AK294: =I294+100*T294 -> 596. | AL294: 594.7 | AM294: 294 | AN294: 505.2 | AO294: 294 | AP294: 5.4000000000000006e-002 | AQ294: 15 | AR294: 横河转债!
A295: 227 | B295: 特发转债! | C295: 127008 | D295: 43459. | E295: 特发信息 | F295: 70 | G295: 通信互联 | H295: 通信设备 | I295: 290 | J295: -2.6800000000000001e-002 | K295: 7.7699999999999991e-002 | L295: 10.75 | M295: 5.0799999999999998e-002 | N295: 622 | O295: 3.5099999999999998 | P295: 111.1 | Q295: 5.54 | R295: 3.12 | S295: 194.04 | T295: 0.495 | U295: 转股中 | V295: 3年58天 | W295: 1年58天 | X295: 6.9999999999999993e-003 | Y295: 1.3000000000000001e-002 | Z295: 0.6 | AA295: 88 | AB295: -0.26400000000000001 | AC295: -0.26899999999999996 | AD295: -0.47399999999999998 | AE295: -0.47499999999999998 | AF295: 96.39 | AG295: 97.55 | AH295: 1 | AI295: AA | AJ295: 4.2699999999999995e-002 | AK295: =I295+100*T295 -> 339.5 | AL295: 386 | AM295: 290 | AN295: 288.4 | AO295: 290 | AP295: -4.7e-002 | AQ295: 15 | AR295: 特发转债!
A296: 168 | B296: 英科转债! | C296: 123029 | D296: 43718. | E296: 英科医疗 | F296: 300677 | G296: 医药 | H296: 医疗器械 | I296: 870.953 | J296: 4.3099999999999999e-002 | K296: 1.5e-003 | L296: 136.9 | M296: 4.4999999999999998e-002 | N296: 485 | O296: 0.41600000000000004 | P296: 138.2 | Q296: 16.11 | R296: 8.27 | S296: 849.78 | T296: 2.5000000000000001e-002 | U296: 转股中 | V296: 4.91年 | W296: 2.91年 | X296: 5.0000000000000001e-003 | Y296: 3.7999999999999999e-002 | Z296: 1.4 | AA296: 304 | AB296: -0.318 | AC296: -0.32500000000000001 | AD296: -0.22500000000000001 | AE296: -0.22600000000000001 | AF296: 89.02 | AG296: 103.09 | AH296: 0.99 | AI296: AA- | AJ296: 6.3700000000000007e-002 | AK296: =I296+100*T296 -> 873.45299999999997 | AL296: 892.1 | AM296: 295 | AN296: 789 | AO296: 295 | AP296: -2.3e-002 | AQ296: 15 | AR296: 英科转债!