A1: 序号 | B1: 转债名称 | C1: 转债代码 | D1: 进展/上市日期 | E1: 股票名称 | F1: 股票代码 | G1: 行业 | H1: 子行业 | I1: 转债价格 | J1: 涨跌 | K1: 日内套利 | L1: 股价 | M1: 涨跌 | N1: 转债成交额 | O1: 转债换手率 | P1: 剩余本息 | Q1: 转股价格 | R1: P/B | S1: 转股价值 | T1: 转股溢价率 | U1: 距离转股日 | V1: 剩余年限 | W1: 回售年限 | X1: 余额/市值 | Y1: 余额/股本 | Z1: 转债余额 | AA1: 股票市值 | AB1: 税前收益率 | AC1: 税后收益率 | AD1: 税前回售收益 | AE1: 税后回售收益 | AF1: 回售价值 | AG1: 纯债价值 | AH1: 弹性 | AI1: 信用 | AJ1: 折现率 | AK1: 双低 | AL1: 老式双低 | AM1: 老式排名 | AN1: 新式双低 | AO1: 新式排名 | AP1: MA20乖离 | AQ1: 热门度 | AR1: 转债名称
A2: 192 | B2: 亚药转债! | C2: 128062 | D2: 43579. | E2: 亚太药业 | F2: 2370 | G2: 医药 | H2: 化学制药 | I2: 80.705 | J2: 2.8000000000000004e-003 | K2: -2.8000000000000004e-003 | L2: 5.74 | M2: 2.5000000000000001e-002 | N2: 6.7 | O2: 9.0000000000000011e-003 | P2: 119.8 | Q2: 16.25 | R2: 8.22 | S2: 35.32 | T2: 1.28 | U2: 转股中 | V2: 4.55年 | W2: 2.55年 | X2: 0.313 | Y2: 0.111 | Z2: 9.6 | AA2: 31 | AB2: 9.2600000000000002e-002 | AC2: 8.4100000000000008e-002 | AD2: 9.6099999999999991e-002 | AE2: 9.3299999999999994e-002 | AF2: 80.85 | AG2: 79.79 | AH2: 0 | AI2: A- | AJ2: 9.5399999999999985e-002 | AK2: =I2+100*T2 -> 208.70499999999998 | AL2: 126.1 | AM2: 51 | AN2: 45.2 | AO2: 158 | AP2: -2.6000000000000002e-002 | AQ2: 88 | AR2: 亚药转债!
A3: 212 | B3: 维格转债! | C3: 113527 | D3: 43515. | E3: 锦泓集团 | F3: 603518 | G3: 服装纺织 | H3: 服装行业 | I3: 93.52 | J3: 6.9999999999999993e-003 | K3: -4.0000000000000001e-003 | L3: 6.9 | M3: 1.47e-002 | N3: 9.4 | O3: 1.3999999999999999e-002 | P3: 120.2 | Q3: 9.85 | R3: 0.7 | S3: 70.05 | T3: 0.33500000000000002 | U3: 转股中 | V3: 4.36年 | W3: 2.36年 | X3: 0.42799999999999999 | Y3: 0.29999999999999999 | Z3: 7.5 | AA3: 17 | AB3: 6.0599999999999994e-002 | AC3: 5.1900000000000002e-002 | AD3: 4.1500000000000002e-002 | AE3: 3.8599999999999995e-002 | AF3: 90.91 | AG3: 96.26 | AH3: 0.2 | AI3: AA | AJ3: 5.3399999999999996e-002 | AK3: =I3+100*T3 -> 127.02 | AL3: 117 | AM3: 5 | AN3: 20.7 | AO3: 6 | AP3: -2.3e-002 | AQ3: 100 | AR3: 维格转债!
A4: 38 | B4: 本钢转债! | C4: 127018 | D4: 44047. | E4: 本钢板材 | F4: 761 | G4: 钢铁 | H4: 炼钢 | I4: 97.51 | J4: -1.e-003 | K4: 1.e-003 | L4: 3.4 | M4: 0. | N4: 30 | O4: 4.0000000000000001e-003 | P4: 128.6 | Q4: 5.03 | R4: 0.67 | S4: 67.59 | T4: 0.44299999999999995 | U4: 3月22天 | V4: 5.79年 | W4: 3.79年 | X4: 0.51600000000000001 | Y4: 0.34899999999999998 | Z4: 68 | AA4: 132 | AB4: 5.04e-002 | AC4: 4.1799999999999997e-002 | AD4: 2.2700000000000001e-002 | AE4: 1.95e-002 | AF4: 91.36 | AG4: 103.19 | AH4: 0.18 | AI4: AAA | AJ4: 3.9900000000000005e-002 | AK4: =I4+100*T4 -> 141.81 | AL4: 127.4 | AM4: 63 | AN4: 24.2 | AO4: 8 | AP4: -2.e-002 | AQ4: 24 | AR4: 本钢转债!
A5: 269 | B5: 亚太转债! | C5: 128023 | D5: 43095. | E5: 亚太股份 | F5: 2284 | G5: 汽车 | H5: 零部件制 | I5: 96.835 | J5: -2.3e-003 | K5: 2.2000000000000001e-003 | L5: 5.08 | M5: -9.7000000000000003e-003 | N5: 2.1 | O5: 2.e-003 | P5: 112.3 | Q5: 10.34 | R5: 1.55 | S5: 49.13 | T5: 0.97099999999999997 | U5: 转股中 | V5: 3.22年 | W5: 1.22年 | X5: 0.26700000000000002 | Y5: 0.13100000000000001 | Z5: 10 | AA5: 37 | AB5: 4.82e-002 | AC5: 4.0599999999999997e-002 | AD5: 4.4400000000000002e-002 | AE5: 4.0199999999999993e-002 | AF5: 96.96 | AG5: 98.23 | AH5: 0.01 | AI5: AA | AJ5: 4.3400000000000001e-002 | AK5: =I5+100*T5 -> 193.935 | AL5: 144.5 | AM5: 219 | AN5: 46.3 | AO5: 165 | AP5: -5.9999999999999998e-002 | AQ5: 64 | AR5: 亚太转债!
A6: 250 | B6: 岩土转债! | C6: 128037 | D6: 43215. | E6: 中化岩土 | F6: 2542 | G6: 建筑 | H6: 建筑工程 | I6: 98.35 | J6: 1.5e-003 | K6: -1.5e-003 | L6: 3.7 | M6: 0. | N6: 1.6 | O6: 3.0000000000000001e-003 | P6: 112.3 | Q6: 7.99 | R6: 1.67 | S6: 46.31 | T6: 1.1200000000000001 | U6: 转股中 | V6: 3.50年 | W6: 1.50年 | X6: 8.9999999999999997e-002 | Y6: 4.2000000000000003e-002 | Z6: 6 | AA6: 67 | AB6: 3.9399999999999998e-002 | AC6: 3.2599999999999997e-002 | AD6: 2.7099999999999999e-002 | AE6: 2.3700000000000002e-002 | AF6: 95.83 | AG6: 97.07 | AH6: 0.01 | AI6: AA | AJ6: 4.3400000000000001e-002 | AK6: =I6+100*T6 -> 210.35000000000002 | AL6: 150.4 | AM6: 244 | AN6: 53.3 | AO6: 213 | AP6: -1.e-002 | AQ6: 48 | AR6: 岩土转债!
A7: 190 | B7: 未来转债 | C7: 128063 | D7: 43579. | E7: 德尔未来 | F7: 2631 | G7: 其他 | H7: 家居用品 | I7: 110 | J7: 0. | K7: 2.2000000000000001e-003 | L7: 7.49 | M7: 5.4000000000000003e-003 | N7: 1.3 | O7: 2.e-003 | P7: 128.2 | Q7: 8.61 | R7: 2.84 | S7: 86.99 | T7: 0.26400000000000001 | U7: 转股中 | V7: 4.55年 | W7: 3.55年 | X7: 0.126 | Y7: 0.109 | Z7: 6.3 | AA7: 50 | AB7: 3.5200000000000002e-002 | AC7: 2.46e-002 | AD7: -2.8000000000000004e-003 | AE7: -7.3000000000000001e-003 | AF7: 86.78 | AG7: 97.28 | AH7: 0.41 | AI7: AA- | AJ7: 6.4399999999999999e-002 | AK7: =I7+100*T7 -> 136.40000000000001 | AL7: 133 | AM7: 125 | AN7: 35.7 | AO7: 61 | AP7: -4.2999999999999997e-002 | AQ7: 36 | AR7: 未来转债
A8: 69 | B8: 纵横转债 | C8: 113573 | D8: 43973. | E8: 纵横通信 | F8: 603602 | G8: 通信互联 | H8: 通信设备 | I8: 103.3 | J8: -4.7999999999999996e-003 | K8: -2.0999999999999999e-003 | L8: 13.4 | M8: -1.9e-002 | N8: 2.9 | O8: 1.e-002 | P8: 124.7 | Q8: 18.81 | R8: 4.05 | S8: 71.24 | T8: 0.45000000000000001 | U8: 39天 | V8: 5.59年 | W8: 3.59年 | X8: 9.9000000000000005e-002 | Y8: 7.0000000000000007e-002 | Z8: 2.7 | AA8: 27 | AB8: 3.5000000000000003e-002 | AC8: 2.7300000000000001e-002 | AD8: 3.4000000000000002e-003 | AE8: 1.e-003 | AF8: 79.48 | AG8: 83.22 | AH8: 0.37 | AI8: A+ | AJ8: 7.690000000000001e-002 | AK8: =I8+100*T8 -> 148.30000000000001 | AL8: 135.4 | AM8: 143 | AN8: 52.1 | AO8: 206 | AP8: -0.10199999999999999 | AQ8: 13 | AR8: 纵横转债
A9: 277 | B9: 小康转债! | C9: 113016 | D9: 43060. | E9: 小康股份 | F9: 601127 | G9: 汽车 | H9: 零部件制 | I9: 99.32 | J9: -1.e-004 | K9: 2.0000000000000001e-004 | L9: 8.35 | M9: 7.1999999999999998e-003 | N9: 2.2 | O9: 3.0000000000000001e-003 | P9: 110.3 | Q9: 15.7 | R9: 1.69 | S9: 53.18 | T9: 0.86699999999999999 | U9: 转股中 | V9: 3年53天 | W9: 1年53天 | X9: 8.4000000000000005e-002 | Y9: 4.4999999999999998e-002 | Z9: 8.8 | AA9: 105 | AB9: 3.4700000000000002e-002 | AC9: 2.8300000000000002e-002 | AD9: 2.69e-002 | AE9: 2.2499999999999999e-002 | AF9: 97.28 | AG9: 96.8 | AH9: 0.01 | AI9: AA | AJ9: 4.3400000000000001e-002 | AK9: =I9+100*T9 -> 186.01999999999998 | AL9: 145.5 | AM9: 229 | AN9: 48.2 | AO9: 178 | AP9: -5.7000000000000002e-002 | AQ9: 46 | AR9: 小康转债!
A10: 195 | B10: 大丰转债! | C10: 113530 | D10: 43573. | E10: 大丰实业 | F10: 603081 | G10: 建筑 | H10: 装饰工程 | I10: 105.05 | J10: 1.e-003 | K10: 8.9999999999999998e-004 | L10: 12.25 | M10: 1.0700000000000001e-002 | N10: 3.9 | O10: 6.0000000000000001e-003 | P10: 121.6 | Q10: 16.64 | R10: 2.5 | S10: 73.62 | T10: 0.42700000000000005 | U10: 转股中 | V10: 4.53年 | W10: 2.53年 | X10: 0.128 | Y10: 9.4e-002 | Z10: 6.3 | AA10: 49 | AB10: 3.3500000000000002e-002 | AC10: 2.5000000000000001e-002 | AD10: -5.5000000000000005e-003 | AE10: -8.0000000000000002e-003 | AF10: 92.41 | AG10: 100.69 | AH10: 0.19 | AI10: AA | AJ10: 4.3400000000000001e-002 | AK10: =I10+100*T10 -> 147.75 | AL10: 136.5 | AM10: 157 | AN10: 35.8 | AO10: 62 | AP10: -3.1e-002 | AQ10: 34 | AR10: 大丰转债!
A11: 116 | B11: 百川转债! | C11: 128093 | D11: 43851. | E11: 百川股份 | F11: 2455 | G11: 化工 | H11: 化工 | I11: 110.133 | J11: -2.0000000000000001e-004 | K11: 2.e-003 | L11: 5.18 | M11: 3.9000000000000003e-003 | N11: 2.1 | O11: 4.0000000000000001e-003 | P11: 130.3 | Q11: 5.87 | R11: 2.11 | S11: 88.25 | T11: 0.248 | U11: 转股中 | V11: 5.31年 | W11: 3.31年 | X11: 0.19399999999999998 | Y11: 0.17100000000000001 | Z11: 5.2 | AA11: 27 | AB11: 3.3300000000000003e-002 | AC11: 2.3599999999999999e-002 | AD11: -7.4000000000000003e-003 | AE11: -1.1399999999999999e-002 | AF11: 86.41 | AG11: 93.99 | AH11: 0.48 | AI11: AA- | AJ11: 6.59e-002 | AK11: =I11+100*T11 -> 134.93299999999999 | AL11: 132 | AM11: 113 | AN11: 38 | AO11: 85 | AP11: -2.7000000000000003e-002 | AQ11: 45 | AR11: 百川转债!
A12: 241 | B12: 海澜转债! | C12: 110045 | D12: 43312. | E12: 海澜之家 | F12: 600398 | G12: 服装纺织 | H12: 服装行业 | I12: 98.53 | J12: 1.1999999999999999e-003 | K12: 0. | L12: 6.76 | M12: 2.4199999999999999e-002 | N12: 3.9 | O12: 1.e-003 | P12: 111.1 | Q12: 11.75 | R12: 2.39 | S12: 57.53 | T12: 0.71299999999999997 | U12: 转股中 | V12: 3.83年 | W12: 1.83年 | X12: 0.10099999999999999 | Y12: 5.7999999999999996e-002 | Z12: 29 | AA12: 292 | AB12: 3.2300000000000002e-002 | AC12: 2.6699999999999998e-002 | AD12: 1.77e-002 | AE12: 1.5600000000000001e-002 | AF12: 94.13 | AG12: 95.32 | AH12: 0.05 | AI12: AA+ | AJ12: 4.1399999999999999e-002 | AK12: =I12+100*T12 -> 169.82999999999998 | AL12: 139.5 | AM12: 184 | AN12: 44.2 | AO12: 150 | AP12: -1.4999999999999999e-002 | AQ12: 60 | AR12: 海澜转债!
A13: 99 | B13: 科达转债! | C13: 113569 | D13: 43929. | E13: 苏州科达 | F13: 603660 | G13: 通信互联 | H13: 物联网 | I13: 102.51 | J13: -2.9999999999999997e-004 | K13: 3.2000000000000002e-003 | L13: 9.04 | M13: 1.46e-002 | N13: 2 | O13: 4.0000000000000001e-003 | P13: 120.7 | Q13: 14.84 | R13: 2.67 | S13: 60.92 | T13: 0.68299999999999994 | U13: 转股中 | V13: 5.48年 | W13: 3.48年 | X13: 0.114 | Y13: 7.0000000000000007e-002 | Z13: 5.2 | AA13: 45 | AB13: 3.0899999999999997e-002 | AC13: 2.41e-002 | AD13: 4.0999999999999995e-003 | AE13: 1.9e-003 | AF13: 82.64 | AG13: 85.7 | AH13: 0.2 | AI13: AA- | AJ13: 6.59e-002 | AK13: =I13+100*T13 -> 170.81 | AL13: 144.1 | AM13: 213 | AN13: 58.4 | AO13: 238 | AP13: -6.2e-002 | AQ13: 22 | AR13: 科达转债!
A14: 179 | B14: 大业转债! | C14: 113535 | D14: 43619. | E14: 大业股份 | F14: 603278 | G14: 汽车 | H14: 零部件制 | I14: 102 | J14: -5.6000000000000008e-003 | K14: 1.0200000000000001e-002 | L14: 8.89 | M14: 2.5399999999999999e-002 | N14: 3.7 | O14: 6.9999999999999993e-003 | P14: 113.1 | Q14: 12.4 | R14: 1.61 | S14: 71.69 | T14: 0.42299999999999999 | U14: 转股中 | V14: 3.65年 | W14: 1.65年 | X14: 0.19399999999999998 | Y14: 0.13900000000000001 | Z14: 5 | AA14: 26 | AB14: 2.9100000000000001e-002 | AC14: 2.23e-002 | AD14: -8.0000000000000004e-004 | AE14: -2.8000000000000004e-003 | AF14: 94.32 | AG14: 97.04 | AH14: 0.18 | AI14: AA | AJ14: 4.3400000000000001e-002 | AK14: =I14+100*T14 -> 144.30000000000001 | AL14: 132.3 | AM14: 116 | AN14: 35.3 | AO14: 56 | AP14: -1.4999999999999999e-002 | AQ14: 49 | AR14: 大业转债!
A15: 208 | B15: 长城转债! | C15: 113528 | D15: 43544. | E15: 长城科技 | F15: 603897 | G15: 机械装备 | H15: 专用设备 | I15: 103.85 | J15: -5.0000000000000001e-003 | K15: 1.3999999999999999e-002 | L15: 18.82 | M15: 2.3399999999999997e-002 | N15: 3 | O15: 5.0000000000000001e-003 | P15: 117.6 | Q15: 23.75 | R15: 1.83 | S15: 79.24 | T15: 0.311 | U15: 转股中 | V15: 4.46年 | W15: 2.46年 | X15: 0.18899999999999997 | Y15: 0.14999999999999999 | Z15: 6.3 | AA15: 34 | AB15: 2.8900000000000002e-002 | AC15: 2.1700000000000001e-002 | AD15: 2.9999999999999997e-004 | AE15: -2.5999999999999999e-003 | AF15: 88.4 | AG15: 89.62 | AH15: 0.39 | AI15: AA- | AJ15: 6.4399999999999999e-002 | AK15: =I15+100*T15 -> 134.94999999999999 | AL15: 128.5 | AM15: 70 | AN15: 38.8 | AO15: 98 | AP15: -6.7000000000000004e-002 | AQ15: 44 | AR15: 长城转债!
A16: 281 | B16: 久其转债! | C16: 128015 | D16: 42934. | E16: 久其软件 | F16: 2279 | G16: 计算机及 | H16: 软件开发 | I16: 102.881 | J16: 1.8e-003 | K16: -1.6000000000000001e-003 | L16: 6.47 | M16: 3.0999999999999999e-003 | N16: 5.5 | O16: 6.9999999999999993e-003 | P16: 110.8 | Q16: 9.48 | R16: 6.32 | S16: 68.25 | T16: 0.50700000000000001 | U16: 转股中 | V16: 2.73年 | W16: 0.73年 | X16: 0.16899999999999998 | Y16: 0.11599999999999999 | Z16: 7.8 | AA16: 46 | AB16: 2.7900000000000001e-002 | AC16: 2.0400000000000001e-002 | AD16: -1.44e-002 | AE16: -1.78e-002 | AF16: 95.24 | AG16: 91.4 | AH16: 0.05 | AI16: A+ | AJ16: 7.4099999999999999e-002 | AK16: =I16+100*T16 -> 153.58100000000002 | AL16: 137.5 | AM16: 169 | AN16: 42.3 | AO16: 137 | AP16: -6.4000000000000001e-002 | AQ16: 56 | AR16: 久其转债!
A17: 149 | B17: 浦发转债! | C17: 110059 | D17: 43784. | E17: 浦发银行 | F17: 600000 | G17: 金融 | H17: 银行行业 | I17: 103.08 | J17: 5.0000000000000001e-004 | K17: -1.2999999999999999e-003 | L17: 9.92 | M17: -4.0000000000000001e-003 | N17: 85 | O17: 2.e-003 | P17: 117.8 | Q17: 14.45 | R17: 0.58 | S17: 68.65 | T17: 0.502 | U17: 转股中 | V17: 5年44天 | W17: 无权 | X17: 0.17199999999999999 | Y17: 0.11800000000000001 | Z17: 500 | AA17: 2912. | AB17: 2.7200000000000002e-002 | AC17: 2.07e-002 | AD17: 无权 | AE17: 无权 | AF17: 无权 | AG17: 96.94 | AH17: 0.2 | AI17: AAA | AJ17: 3.9900000000000005e-002 | AK17: =I17+100*T17 -> 153.28 | AL17: 137.5 | AM17: 168 | AN17: 40.6 | AO17: 118 | AP17: -4.0999999999999995e-002 | AQ17: 77 | AR17: 浦发转债!
A18: 207 | B18: 中信转债! | C18: 113021 | D18: 43543. | E18: 中信银行 | F18: 601998 | G18: 金融 | H18: 银行行业 | I18: 105.87 | J18: 5.9999999999999995e-004 | K18: -5.9999999999999995e-004 | L18: 5.1 | M18: 0. | N18: 14 | O18: 0. | P18: 118.8 | Q18: 6.98 | R18: 0.55 | S18: 73.07 | T18: 0.44900000000000001 | U18: 转股中 | V18: 4.47年 | W18: 无权 | X18: 0.16 | Y18: 0.11699999999999999 | Z18: 400 | AA18: 2496. | AB18: 2.69e-002 | AC18: 1.9199999999999998e-002 | AD18: 无权 | AE18: 无权 | AF18: 无权 | AG18: 100.89 | AH18: 0.2 | AI18: AAA | AJ18: 3.8399999999999997e-002 | AK18: =I18+100*T18 -> 150.77000000000001 | AL18: 138.7 | AM18: 175 | AN18: 37.8 | AO18: 81 | AP18: -2.5000000000000001e-002 | AQ18: 54 | AR18: 中信转债!
A19: 274 | B19: 嘉澳转债! | C19: 113502 | D19: 43066. | E19: 嘉澳环保 | F19: 603822 | G19: 化工 | H19: 化工 | I19: 103.64 | J19: -8.1000000000000013e-003 | K19: 8.1000000000000013e-003 | L19: 26.15 | M19: 4.0000000000000002e-004 | N19: 2 | O19: 1.e-002 | P19: 112.3 | Q19: 44.79 | R19: 2.59 | S19: 58.38 | T19: 0.77500000000000002 | U19: 转股中 | V19: 3年57天 | W19: 1年57天 | X19: 9.6000000000000002e-002 | Y19: 5.5999999999999994e-002 | Z19: 1.9 | AA19: 19 | AB19: 2.63e-002 | AC19: 1.89e-002 | AD19: -6.1999999999999998e-003 | AE19: -1.03e-002 | AF19: 94.73 | AG19: 92.64 | AH19: 0.03 | AI19: AA- | AJ19: 6.4399999999999999e-002 | AK19: =I19+100*T19 -> 181.13999999999999 | AL19: 148.9 | AM19: 239 | AN19: 54.2 | AO19: 218 | AP19: -5.7000000000000002e-002 | AQ19: 29 | AR19: 嘉澳转债!
A20: 36 | B20: 胜达转债 | C20: 113591 | D20: 44035. | E20: 大胜达 | F20: 603687 | G20: 造纸包装 | H20: 包装用纸 | I20: 105.94 | J20: -4.0000000000000002e-004 | K20: 8.1000000000000013e-003 | L20: 12.94 | M20: 1.41e-002 | N20: 9.6 | O20: 1.6e-002 | P20: 122.2 | Q20: 14.73 | R20: 3.45 | S20: 87.85 | T20: 0.20600000000000002 | U20: 3月26天 | V20: 5.80年 | W20: 3.80年 | X20: 0.10300000000000001 | Y20: 9.0999999999999998e-002 | Z20: 5.5 | AA20: 53 | AB20: 2.5499999999999998e-002 | AC20: 1.8700000000000001e-002 | AD20: -4.4000000000000003e-003 | AE20: -6.4000000000000003e-003 | AF20: 81.08 | AG20: 85.08 | AH20: 0.55 | AI20: AA- | AJ20: 6.59e-002 | AK20: =I20+100*T20 -> 126.53999999999999 | AL20: 124 | AM20: 42 | AN20: 39 | AO20: 99 | AP20: -4.5999999999999999e-002 | AQ20: 18 | AR20: 胜达转债
A21: 1 | B21: N文科转 | C21: 128127 | D21: 44085. | E21: 文科园林 | F21: 2775 | G21: 城市公用 | H21: 生态环境 | I21: 104.851 | J21: 4.8499999999999995e-002 | K21: 0. | L21: 5.35 | M21: -5.6000000000000008e-003 | N21: 633 | O21: 0.62 | P21: 121.3 | Q21: 5.76 | R21: 1.1 | S21: 92.88 | T21: 0.129 | U21: 5月18天 | V21: 5.93年 | W21: 3.93年 | X21: 0.34600000000000003 | Y21: 0.32200000000000001 | Z21: 9.5 | AA21: 27 | AB21: 2.5399999999999999e-002 | AC21: 1.9e-002 | AD21: -1.5e-003 | AE21: -3.4999999999999996e-003 | AF21: 80.46 | AG21: 83.74 | AH21: 0.62 | AI21: AA- | AJ21: 6.59e-002 | AK21: =I21+100*T21 -> 117.751 | AL21: 116.8 | AM21: 4 | AN21: 33.1 | AO21: 36 | AP21: -2.8999999999999998e-002 | AQ21: 4 | AR21: N文科转
A22: 283 | B22: 永东转债! | C22: 128014 | D22: 42934. | E22: 永东股份 | F22: 2753 | G22: 化工 | H22: 化工 | I22: 104.5 | J22: 2.8000000000000004e-003 | K22: -2.8000000000000004e-003 | L22: 8.8 | M22: 1.1000000000000001e-003 | N22: 1.6 | O22: 4.0000000000000001e-003 | P22: 111.3 | Q22: 12.6 | R22: 1.92 | S22: 69.84 | T22: 0.496 | U22: 转股中 | V22: 2.59年 | W22: 0.59年 | X22: 0.10199999999999999 | Y22: 7.0999999999999994e-002 | Z22: 3.4 | AA22: 33 | AB22: 2.5099999999999997e-002 | AC22: 1.6799999999999999e-002 | AD22: -3.4099999999999998e-002 | AE22: -3.8599999999999995e-002 | AF22: 97.21 | AG22: 95.25 | AH22: 0.06 | AI22: AA- | AJ22: 6.3099999999999989e-002 | AK22: =I22+100*T22 -> 154.09999999999999 | AL22: 139.2 | AM22: 179 | AN22: 42 | AO22: 132 | AP22: 1.1000000000000001e-002 | AQ22: 39 | AR22: 永东转债!
A23: 2 | B23: N新星转 | C23: 113600 | D23: 44085. | E23: 深圳新星 | F23: 603978 | G23: 有色金属 | H23: 有色行业 | I23: 109.38 | J23: 9.3800000000000008e-002 | K23: 0. | L23: 22.1 | M23: 3.32e-002 | N23: 553 | O23: 0.84699999999999998 | P23: 126 | Q23: 23.85 | R23: 2.33 | S23: 92.66 | T23: 0.17999999999999999 | U23: 5月8天 | V23: 5.91年 | W23: 3.91年 | X23: 0.16800000000000001 | Y23: 0.156 | Z23: 6 | AA23: 35 | AB23: 2.46e-002 | AC23: 1.72e-002 | AD23: -1.26e-002 | AE23: -1.44e-002 | AF23: 80.29 | AG23: 87 | AH23: 0.58 | AI23: AA- | AJ23: 6.59e-002 | AK23: =I23+100*T23 -> 127.38 | AL23: 126.1 | AM23: 52 | AN23: 39.1 | AO23: 104 | AP23: -2.6000000000000002e-002 | AQ23: 2 | AR23: N新星转
A24: 288 | B24: 顺昌转债!! | C24: 128010 | D24: 42423. | E24: 澳洋顺昌 | F24: 2245 | G24: 交通运输 | H24: 物流业 | I24: 106.123 | J24: -2.0999999999999999e-003 | K24: 2.0999999999999999e-003 | L24: 4.96 | M24: 4.0000000000000001e-003 | N24: 4.6 | O24: 9.0000000000000011e-003 | P24: 109.6 | Q24: 9.25 | R24: 2.27 | S24: 53.62 | T24: 0.97900000000000009 | U24: 转股中 | V24: 1.36年 | W24: 回售中 | X24: 0.105 | Y24: 5.5999999999999994e-002 | Z24: 5.1 | AA24: 49 | AB24: 2.4300000000000002e-002 | AC24: 1.09e-002 | AD24: 回售中 | AE24: 回售中 | AF24: 100.27 | AG24: 103.7 | AH24: 0 | AI24: AA | AJ24: 4.2099999999999999e-002 | AK24: =I24+100*T24 -> 204.02300000000002 | AL24: 158.6 | AM24: 261 | AN24: 54.9 | AO24: 223 | AP24: -2.4e-002 | AQ24: 41 | AR24: 顺昌转债!!
A25: 40 | B25: 天创转债! | C25: 113589 | D25: 44028. | E25: 天创时尚 | F25: 603608 | G25: 服装纺织 | H25: 鞋服行业 | I25: 100.67 | J25: -8.0000000000000004e-004 | K25: 3.0000000000000001e-003 | L25: 8.49 | M25: 9.4999999999999998e-003 | N25: 2.2 | O25: 4.0000000000000001e-003 | P25: 115.3 | Q25: 12.64 | R25: 1.67 | S25: 67.17 | T25: 0.499 | U25: 3月20天 | V25: 5.78年 | W25: 3.78年 | X25: 0.16399999999999998 | Y25: 0.11 | Z25: 6 | AA25: 37 | AB25: 2.4199999999999999e-002 | AC25: 1.9299999999999998e-002 | AD25: 7.9000000000000008e-003 | AE25: 6.0000000000000001e-003 | AF25: 87.44 | AG25: 89.9 | AH25: 0.24 | AI25: AA | AJ25: 4.4900000000000002e-002 | AK25: =I25+100*T25 -> 150.56999999999999 | AL25: 134.2 | AM25: 133 | AN25: 44.3 | AO25: 152 | AP25: -8.9999999999999997e-002 | AQ25: 7 | AR25: 天创转债!
A26: 132 | B26: 鸿达转债 | C26: 128085 | D26: 43838. | E26: 鸿达兴业 | F26: 2002 | G26: 化工 | H26: 化工 | I26: 110.547 | J26: 9.5999999999999992e-003 | K26: -1.1000000000000001e-002 | L26: 4.01 | M26: -2.5000000000000001e-003 | N26: 27 | O26: 1.e-002 | P26: 124.8 | Q26: 3.92 | R26: 1.48 | S26: 102.3 | T26: 8.1000000000000003e-002 | U26: 转股中 | V26: 5.26年 | W26: 3.26年 | X26: 0.23399999999999999 | Y26: 0.23899999999999999 | Z26: 24 | AA26: 104 | AB26: 2.3900000000000001e-002 | AC26: 1.5800000000000002e-002 | AD26: -1.7000000000000001e-002 | AE26: -1.9400000000000001e-002 | AF26: 89.9 | AG26: 99.58 | AH26: 0.56 | AI26: AA | AJ26: 4.4900000000000002e-002 | AK26: =I26+100*T26 -> 118.64699999999999 | AL26: 118.8 | AM26: 10 | AN26: 19.2 | AO26: 5 | AP26: 1.3999999999999999e-002 | AQ26: 81 | AR26: 鸿达转债
A27: 73 | B27: 凌钢转债! | C27: 110070 | D27: 43964. | E27: 凌钢股份 | F27: 600231 | G27: 钢铁 | H27: 炼钢 | I27: 103.8 | J27: -7.000000000000001e-004 | K27: -2.8999999999999998e-003 | L27: 2.31 | M27: -8.6e-003 | N27: 3.2 | O27: 6.9999999999999993e-003 | P27: 117.8 | Q27: 2.75 | R27: 0.82 | S27: 84 | T27: 0.23600000000000002 | U27: 33天 | V27: 5.58年 | W27: 3.58年 | X27: 6.9000000000000006e-002 | Y27: 5.7999999999999996e-002 | Z27: 4.4 | AA27: 64 | AB27: 2.3399999999999997e-002 | AC27: 1.7600000000000001e-002 | AD27: 8.9999999999999998e-004 | AE27: -1.2999999999999999e-003 | AF27: 88.49 | AG27: 92.68 | AH27: 0.41 | AI27: AA | AJ27: 4.4900000000000002e-002 | AK27: =I27+100*T27 -> 127.40000000000001 | AL27: 123.6 | AM27: 36 | AN27: 30.9 | AO27: 26 | AP27: -1.1000000000000001e-002 | AQ27: 13 | AR27: 凌钢转债!
A28: 198 | B28: 迪森转债! | C28: 123023 | D28: 43571. | E28: 迪森股份 | F28: 300335 | G28: 能源电力 | H28: 电力供应 | I28: 103.75 | J28: 9.1999999999999998e-003 | K28: 8.8999999999999999e-003 | L28: 5.74 | M28: 5.1299999999999998e-002 | N28: 24 | O28: 3.9e-002 | P28: 114.9 | Q28: 7.04 | R28: 1.61 | S28: 81.53 | T28: 0.27200000000000002 | U28: 转股中 | V28: 4.51年 | W28: 3.51年 | X28: 0.28800000000000003 | Y28: 0.23499999999999999 | Z28: 6 | AA28: 21 | AB28: 2.3300000000000001e-002 | AC28: 1.72e-002 | AD28: 3.9000000000000003e-003 | AE28: 1.1999999999999999e-003 | AF28: 90.22 | AG28: 95.22 | AH28: 0.35 | AI28: AA | AJ28: 4.3400000000000001e-002 | AK28: =I28+100*T28 -> 130.94999999999999 | AL28: 126 | AM28: 50 | AN28: 30.7 | AO28: 24 | AP28: 1.2e-002 | AQ28: 51 | AR28: 迪森转债!
A29: 76 | B29: 起步转债! | C29: 113576 | D29: 43958. | E29: 起步股份 | F29: 603557 | G29: 服装纺织 | H29: 鞋服行业 | I29: 107.45 | J29: -4.6999999999999993e-003 | K29: -1.18e-002 | L29: 9.98 | M29: -2.63e-002 | N29: 8.8 | O29: 1.6e-002 | P29: 121.8 | Q29: 10.55 | R29: 3.05 | S29: 94.6 | T29: 0.13600000000000001 | U29: 32天 | V29: 5.57年 | W29: 3.57年 | X29: 0.11 | Y29: 0.10400000000000001 | Z29: 5.2 | AA29: 47 | AB29: 2.3300000000000001e-002 | AC29: 1.6399999999999998e-002 | AD29: -6.9999999999999993e-003 | AE29: -9.3999999999999986e-003 | AF29: 82.75 | AG29: 86.1 | AH29: 0.63 | AI29: AA- | AJ29: 6.59e-002 | AK29: =I29+100*T29 -> 121.05000000000001 | AL29: 120.3 | AM29: 16 | AN29: 34.2 | AO29: 45 | AP29: -1.9e-002 | AQ29: 33 | AR29: 起步转债!
A30: 100 | B30: 新春转债 | C30: 113568 | D30: 43923. | E30: 五洲新春 | F30: 603667 | G30: 机械装备 | H30: 通用设备 | I30: 110.4 | J30: 6.7000000000000002e-003 | K30: 2.0999999999999999e-003 | L30: 8.63 | M30: 1.41e-002 | N30: 5.1 | O30: 1.3999999999999999e-002 | P30: 124.8 | Q30: 8.91 | R30: 1.47 | S30: 96.86 | T30: 0.14000000000000001 | U30: 0.4天 | V30: 5.47年 | W30: 3.47年 | X30: 0.13100000000000001 | Y30: 0.127 | Z30: 3.3 | AA30: 25 | AB30: 2.3199999999999998e-002 | AC30: 1.54e-002 | AD30: -1.46e-002 | AE30: -1.7000000000000001e-002 | AF30: 83.26 | AG30: 88.75 | AH30: 0.62 | AI30: AA- | AJ30: 6.59e-002 | AK30: =I30+100*T30 -> 124.40000000000001 | AL30: 123.9 | AM30: 41 | AN30: 35.2 | AO30: 55 | AP30: -2.7999999999999997e-002 | AQ30: 40 | AR30: 新春转债
A31: 239 | B31: 德尔转债! | C31: 123011 | D31: 43326. | E31: 德尔股份 | F31: 300473 | G31: 汽车 | H31: 零部件制 | I31: 106.73 | J31: 1.06e-002 | K31: -7.6e-003 | L31: 28.27 | M31: 7.8000000000000005e-003 | N31: 4 | O31: 1.4999999999999999e-002 | P31: 116.3 | Q31: 34.54 | R31: 1.45 | S31: 81.85 | T31: 0.30399999999999999 | U31: 转股中 | V31: 3.84年 | W31: 1.84年 | X31: 7.8e-002 | Y31: 6.4000000000000001e-002 | Z31: 2.5 | AA31: 32 | AB31: 2.3e-002 | AC31: 1.5300000000000001e-002 | AD31: -1.8600000000000002e-002 | AE31: -2.1299999999999999e-002 | AF31: 90.77 | AG31: 91.9 | AH31: 0.38 | AI31: AA- | AJ31: 6.4399999999999999e-002 | AK31: =I31+100*T31 -> 137.13 | AL31: 131.6 | AM31: 105 | AN31: 39.7 | AO31: 107 | AP31: -3.1e-002 | AQ31: 36 | AR31: 德尔转债!
A32: 259 | B32: 迪龙转债! | C32: 128033 | D32: 43129. | E32: 雪迪龙 | F32: 2658 | G32: 城市公用 | H32: 三废处理 | I32: 102.191 | J32: -6.9999999999999993e-003 | K32: 8.0000000000000002e-003 | L32: 6.26 | M32: 6.4000000000000003e-003 | N32: 5.4 | O32: 1.e-002 | P32: 109.8 | Q32: 8.83 | R32: 1.92 | S32: 70.89 | T32: 0.441 | U32: 转股中 | V32: 3.29年 | W32: 1.29年 | X32: 0.13699999999999998 | Y32: 9.6999999999999989e-002 | Z32: 5.2 | AA32: 38 | AB32: 2.2599999999999999e-002 | AC32: 1.6799999999999999e-002 | AD32: 2.3999999999999998e-003 | AE32: -1.e-003 | AF32: 96.47 | AG32: 95.77 | AH32: 0.15 | AI32: AA | AJ32: 4.3400000000000001e-002 | AK32: =I32+100*T32 -> 146.291 | AL32: 133.5 | AM32: 129 | AN32: 37 | AO32: 72 | AP32: -5.4000000000000006e-002 | AQ32: 38 | AR32: 迪龙转债!
A33: 9 | B33: 佳力转债! | C33: 113597 | D33: 44064. | E33: 佳力图 | F33: 603912 | G33: 机械装备 | H33: 专用设备 | I33: 109.91 | J33: -8.3000000000000001e-003 | K33: 1.2e-002 | L33: 18.04 | M33: 8.8999999999999999e-003 | N33: 5.5 | O33: 1.7000000000000001e-002 | P33: 124.5 | Q33: 23.4 | R33: 4.78 | S33: 77.09 | T33: 0.42599999999999999 | U33: 4月24天 | V33: 5.87年 | W33: 3.87年 | X33: 7.6999999999999999e-002 | Y33: 5.9000000000000004e-002 | Z33: 3 | AA33: 39 | AB33: 2.1899999999999999e-002 | AC33: 1.47e-002 | AD33: -1.2699999999999999e-002 | AE33: -1.4800000000000001e-002 | AF33: 80.9 | AG33: 86.25 | AH33: 0.42 | AI33: AA- | AJ33: 6.59e-002 | AK33: =I33+100*T33 -> 152.50999999999999 | AL33: 142.7 | AM33: 206 | AN33: 56.5 | AO33: 230 | AP33: -7.0000000000000007e-002 | AQ33: 3 | AR33: 佳力转债!
A34: 217 | B34: 奇精转债! | C34: 113524 | D34: 43472. | E34: 奇精机械 | F34: 603677 | G34: 家电 | H34: 零部件制 | I34: 107.98 | J34: -2.3999999999999998e-003 | K34: 9.7000000000000003e-003 | L34: 12.27 | M34: 2.e-002 | N34: 0.6 | O34: 2.e-003 | P34: 117.9 | Q34: 14.28 | R34: 2.42 | S34: 85.92 | T34: 0.25700000000000001 | U34: 转股中 | V34: 4.25年 | W34: 2.25年 | X34: 0.14000000000000001 | Y34: 0.12 | Z34: 3.3 | AA34: 24 | AB34: 2.1299999999999999e-002 | AC34: 1.37e-002 | AD34: -1.8000000000000002e-002 | AE34: -2.06e-002 | AF34: 93.42 | AG34: 98.79 | AH34: 0.37 | AI34: AA | AJ34: 4.3400000000000001e-002 | AK34: =I34+100*T34 -> 133.68000000000001 | AL34: 130 | AM34: 93 | AN34: 31.2 | AO34: 28 | AP34: -6.0000000000000001e-003 | AQ34: 43 | AR34: 奇精转债!
A35: 164 | B35: 翔鹭转债! | C35: 128072 | D35: 43724. | E35: 翔鹭钨业 | F35: 2842 | G35: 有色金属 | H35: 小金属 | I35: 104.2 | J35: 2.7000000000000001e-003 | K35: 1.49e-002 | L35: 11.03 | M35: 5.1500000000000004e-002 | N35: 12 | O35: 3.7000000000000005e-002 | P35: 115.1 | Q35: 15.31 | R35: 3.37 | S35: 72.04 | T35: 0.44600000000000001 | U35: 转股中 | V35: 4.93年 | W35: 2.93年 | X35: 0.10000000000000001 | Y35: 7.2000000000000008e-002 | Z35: 3 | AA35: 30 | AB35: 2.0799999999999999e-002 | AC35: 1.5100000000000001e-002 | AD35: -2.3999999999999998e-003 | AE35: -4.5999999999999999e-003 | AF35: 85.39 | AG35: 85.11 | AH35: 0.34 | AI35: AA- | AJ35: 6.4399999999999999e-002 | AK35: =I35+100*T35 -> 148.80000000000001 | AL35: 136.4 | AM35: 155 | AN35: 51 | AO35: 195 | AP35: 4.5999999999999999e-002 | AQ35: 27 | AR35: 翔鹭转债!
A36: 127 | B36: 建工转债! | C36: 110064 | D36: 43846. | E36: 重庆建工 | F36: 600939 | G36: 建筑 | H36: 建筑工程 | I36: 108.1 | J36: 3.3e-003 | K36: -1.3000000000000001e-002 | L36: 4.11 | M36: -2.1400000000000002e-002 | N36: 8.3 | O36: 5.0000000000000001e-003 | P36: 120.2 | Q36: 4.57 | R36: 1.07 | S36: 89.93 | T36: 0.20199999999999999 | U36: 转股中 | V36: 5.27年 | W36: 3.27年 | X36: 0.223 | Y36: 0.20000000000000001 | Z36: 17 | AA36: 75 | AB36: 2.0799999999999999e-002 | AC36: 1.3999999999999999e-002 | AD36: -9.7999999999999997e-003 | AE36: -1.23e-002 | AF36: 90.65 | AG36: 96.85 | AH36: 0.45 | AI36: AA+ | AJ36: 4.2900000000000001e-002 | AK36: =I36+100*T36 -> 128.29999999999998 | AL36: 126.3 | AM36: 55 | AN36: 29.4 | AO36: 21 | AP36: -1.2e-002 | AQ36: 46 | AR36: 建工转债!
A37: 152 | B37: 迪贝转债! | C37: 113546 | D37: 43790. | E37: 迪贝电气 | F37: 603320 | G37: 家电 | H37: 零部件制 | I37: 109.47 | J37: 4.8999999999999998e-003 | K37: 7.6e-003 | L37: 13.4 | M37: 1.9e-002 | N37: 4.7 | O37: 1.9e-002 | P37: 121.1 | Q37: 14.1 | R37: 2.65 | S37: 95.04 | T37: 0.152 | U37: 转股中 | V37: 5年39天 | W37: 3年39天 | X37: 0.13200000000000001 | Y37: 0.125 | Z37: 2.3 | AA37: 17 | AB37: 2.0499999999999997e-002 | AC37: 1.32e-002 | AD37: -1.4499999999999999e-002 | AE37: -1.7000000000000001e-002 | AF37: 82.25 | AG37: 83.76 | AH37: 0.65 | AI37: A+ | AJ37: 7.690000000000001e-002 | AK37: =I37+100*T37 -> 124.67 | AL37: 123.9 | AM37: 40 | AN37: 40.1 | AO37: 111 | AP37: -4.0000000000000001e-002 | AQ37: 43 | AR37: 迪贝转债!
A38: 260 | B38: 吉视转债! | C38: 113017 | D38: 43115. | E38: 吉视传媒 | F38: 601929 | G38: 传媒娱乐 | H38: 影视娱乐 | I38: 102.98 | J38: 5.6999999999999993e-003 | K38: 1.6000000000000001e-003 | L38: 2.38 | M38: 2.5899999999999999e-002 | N38: 12 | O38: 6.9999999999999993e-003 | P38: 109.8 | Q38: 2.95 | R38: 1.12 | S38: 80.68 | T38: 0.27600000000000002 | U38: 转股中 | V38: 3.29年 | W38: 1.29年 | X38: 0.21100000000000002 | Y38: 0.17000000000000001 | Z38: 16 | AA38: 74 | AB38: 2.0099999999999996e-002 | AC38: 1.44e-002 | AD38: -2.8999999999999998e-003 | AE38: -6.3e-003 | AF38: 96.74 | AG38: 96.36 | AH38: 0.28 | AI38: AA+ | AJ38: 4.1399999999999999e-002 | AK38: =I38+100*T38 -> 130.58000000000001 | AL38: 125.3 | AM38: 47 | AN38: 28.5 | AO38: 17 | AP38: 3.5000000000000003e-002 | AQ38: 51 | AR38: 吉视转债!
A39: 248 | B39: 新凤转债! | C39: 113508 | D39: 43236. | E39: 新凤鸣 | F39: 603225 | G39: 服装纺织 | H39: 纺织行业 | I39: 104.65 | J39: -6.8000000000000005e-003 | K39: 5.8999999999999999e-003 | L39: 10.56 | M39: -8.5000000000000006e-003 | N39: 6.7 | O39: 3.0000000000000001e-003 | P39: 112.3 | Q39: 15.78 | R39: 1.31 | S39: 66.92 | T39: 0.56399999999999995 | U39: 转股中 | V39: 3.61年 | W39: 1.61年 | X39: 0.14499999999999999 | Y39: 9.6999999999999989e-002 | Z39: 21 | AA39: 148 | AB39: 2.0099999999999996e-002 | AC39: 1.37e-002 | AD39: -1.e-002 | AE39: -1.3100000000000001e-002 | AF39: 95.36 | AG39: 96.6 | AH39: 0.11 | AI39: AA | AJ39: 4.3400000000000001e-002 | AK39: =I39+100*T39 -> 161.05000000000001 | AL39: 142.4 | AM39: 202 | AN39: 45.8 | AO39: 161 | AP39: -8.1000000000000003e-002 | AQ39: 26 | AR39: 新凤转债!
A40: 231 | B40: 岭南转债! | C40: 128044 | D40: 43347. | E40: 岭南股份 | F40: 2717 | G40: 城市公用 | H40: 生态环境 | I40: 103.092 | J40: 5.9999999999999995e-004 | K40: -5.9999999999999995e-004 | L40: 4.16 | M40: 0. | N40: 1.3 | O40: 2.e-003 | P40: 111.3 | Q40: 5.91 | R40: 1.34 | S40: 70.39 | T40: 0.46500000000000002 | U40: 转股中 | V40: 3.92年 | W40: 1.92年 | X40: 0.10400000000000001 | Y40: 7.2999999999999995e-002 | Z40: 6.6 | AA40: 64 | AB40: 2.0099999999999996e-002 | AC40: 1.46e-002 | AD40: -1.4000000000000002e-003 | AE40: -4.0000000000000001e-003 | AF40: 94.15 | AG40: 94.52 | AH40: 0.18 | AI40: AA | AJ40: 4.3400000000000001e-002 | AK40: =I40+100*T40 -> 149.59199999999998 | AL40: 135.8 | AM40: 147 | AN40: 41.3 | AO40: 124 | AP40: -1.6e-002 | AQ40: 30 | AR40: 岭南转债!
A41: 253 | B41: 杭电转债! | C41: 113505 | D41: 43186. | E41: 杭电股份 | F41: 603618 | G41: 能源电力 | H41: 电力设备 | I41: 105.01 | J41: -1.0200000000000001e-002 | K41: 1.32e-002 | L41: 5.76 | M41: 1.0500000000000001e-002 | N41: 7.2 | O41: 9.0000000000000011e-003 | P41: 112.3 | Q41: 7.14 | R41: 1.59 | S41: 80.67 | T41: 0.30199999999999999 | U41: 转股中 | V41: 3.47年 | W41: 1.47年 | X41: 0.188 | Y41: 0.152 | Z41: 7.5 | AA41: 40 | AB41: 1.9900000000000001e-002 | AC41: 1.32e-002 | AD41: -1.3000000000000001e-002 | AE41: -1.6299999999999999e-002 | AF41: 95.93 | AG41: 97.17 | AH41: 0.28 | AI41: AA | AJ41: 4.3400000000000001e-002 | AK41: =I41+100*T41 -> 135.21000000000001 | AL41: 129.3 | AM41: 84 | AN41: 32.2 | AO41: 30 | AP41: -6.9000000000000006e-002 | AQ41: 39 | AR41: 杭电转债!
A42: 172 | B42: 清水转债 | C42: 123028 | D42: 43661. | E42: 清水源 | F42: 300437 | G42: 城市公用 | H42: 三废处理 | I42: 111.15 | J42: 2.0000000000000001e-004 | K42: 2.8999999999999998e-003 | L42: 11.39 | M42: 5.3e-003 | N42: 8.5 | O42: 1.6e-002 | P42: 121.8 | Q42: 11.84 | R42: 1.65 | S42: 96.2 | T42: 0.155 | U42: 转股中 | V42: 4.76年 | W42: 2.76年 | X42: 0.19699999999999998 | Y42: 0.19 | Z42: 4.9 | AA42: 25 | AB42: 1.9900000000000001e-002 | AC42: 1.1899999999999999e-002 | AD42: -2.0400000000000001e-002 | AE42: -2.3399999999999997e-002 | AF42: 87.43 | AG42: 91.18 | AH42: 0.59 | AI42: AA- | AJ42: 6.4399999999999999e-002 | AK42: =I42+100*T42 -> 126.65000000000001 | AL42: 126.1 | AM42: 53 | AN42: 34.9 | AO42: 53 | AP42: -4.0999999999999995e-002 | AQ42: 47 | AR42: 清水转债
A43: 170 | B43: 智能转债! | C43: 128070 | D43: 43669. | E43: 智能自控 | F43: 2877 | G43: 机械装备 | H43: 通用设备 | I43: 107.41 | J43: 7.000000000000001e-004 | K43: 2.7000000000000001e-003 | L43: 8.17 | M43: 6.1999999999999998e-003 | N43: 11 | O43: 4.4999999999999998e-002 | P43: 117.6 | Q43: 9.51 | R43: 3.88 | S43: 85.91 | T43: 0.25 | U43: 转股中 | V43: 4.80年 | W43: 无权 | X43: 8.5000000000000006e-002 | Y43: 7.2999999999999995e-002 | Z43: 2.3 | AA43: 27 | AB43: 1.95e-002 | AC43: 1.29e-002 | AD43: 无权 | AE43: 无权 | AF43: 无权 | AG43: 83.63 | AH43: 0.55 | AI43: A+ | AJ43: 7.5399999999999995e-002 | AK43: =I43+100*T43 -> 132.41 | AL43: 128.9 | AM43: 76 | AN43: 45.3 | AO43: 159 | AP43: -4.0000000000000001e-003 | AQ43: 33 | AR43: 智能转债!
A44: 155 | B44: 金轮转债! | C44: 128076 | D44: 43777. | E44: 金轮股份 | F44: 2722 | G44: 机械装备 | H44: 专用设备 | I44: 105.14 | J44: -1.e-004 | K44: 4.8999999999999998e-003 | L44: 12.73 | M44: 8.6999999999999994e-003 | N44: 2.9 | O44: 1.3000000000000001e-002 | P44: 115.3 | Q44: 14.76 | R44: 1.21 | S44: 86.25 | T44: 0.21899999999999997 | U44: 转股中 | V44: 5年30天 | W44: 3年30天 | X44: 9.6000000000000002e-002 | Y44: 8.3000000000000004e-002 | Z44: 2.1 | AA44: 22 | AB44: 1.8700000000000001e-002 | AC44: 1.32e-002 | AD44: -4.0000000000000001e-003 | AE44: -6.1999999999999998e-003 | AF44: 84.58 | AG44: 83.96 | AH44: 0.54 | AI44: AA- | AJ44: 6.59e-002 | AK44: =I44+100*T44 -> 127.03999999999999 | AL44: 124 | AM44: 43 | AN44: 39.5 | AO44: 105 | AP44: -3.2000000000000001e-002 | AQ44: 40 | AR44: 金轮转债!
A45: 131 | B45: 孚日转债! | C45: 128087 | D45: 43846. | E45: 孚日股份 | F45: 2083 | G45: 服装纺织 | H45: 家纺 | I45: 103 | J45: 1.e-003 | K45: -1.e-003 | L45: 5.11 | M45: 0. | N45: 7.6 | O45: 1.1000000000000001e-002 | P45: 113.3 | Q45: 6.3 | R45: 1.21 | S45: 81.11 | T45: 0.27000000000000002 | U45: 转股中 | V45: 5.26年 | W45: 3.26年 | X45: 0.14000000000000001 | Y45: 0.114 | Z45: 6.5 | AA45: 46 | AB45: 1.8700000000000001e-002 | AC45: 1.3899999999999999e-002 | AD45: 2.3e-003 | AE45: 1.e-004 | AF45: 89.46 | AG45: 90.38 | AH45: 0.4 | AI45: AA | AJ45: 4.4900000000000002e-002 | AK45: =I45+100*T45 -> 130. | AL45: 124.9 | AM45: 46 | AN45: 34.5 | AO45: 49 | AP45: -3.5000000000000003e-002 | AQ45: 51 | AR45: 孚日转债!
A46: 236 | B46: 凯中转债! | C46: 128042 | D46: 43346. | E46: 凯中精密 | F46: 2823 | G46: 能源电力 | H46: 电力设备 | I46: 108.4 | J46: -7.000000000000001e-004 | K46: 1.8e-003 | L46: 10.46 | M46: 3.8e-003 | N46: 2.7 | O46: 6.0000000000000001e-003 | P46: 116.3 | Q46: 12.94 | R46: 2.38 | S46: 80.83 | T46: 0.34100000000000003 | U46: 转股中 | V46: 3.87年 | W46: 1.87年 | X46: 0.13699999999999998 | Y46: 0.111 | Z46: 4.2 | AA46: 30 | AB46: 1.8600000000000002e-002 | AC46: 1.1000000000000001e-002 | AD46: -2.58e-002 | AE46: -2.8399999999999998e-002 | AF46: 94.32 | AG46: 98.93 | AH46: 0.28 | AI46: AA | AJ46: 4.3400000000000001e-002 | AK46: =I46+100*T46 -> 142.5 | AL46: 136 | AM46: 150 | AN46: 37 | AO46: 73 | AP46: -9.6000000000000002e-002 | AQ46: 23 | AR46: 凯中转债!
A47: 92 | B47: 搜特转债! | C47: 128100 | D47: 43930. | E47: 搜于特 | F47: 2503 | G47: 服装纺织 | H47: 服装行业 | I47: 106.265 | J47: -7.000000000000001e-004 | K47: -1.2999999999999999e-003 | L47: 2.69 | M47: -3.7000000000000002e-003 | N47: 20 | O47: 2.4e-002 | P47: 117.3 | Q47: 2.9 | R47: 1.52 | S47: 92.76 | T47: 0.14599999999999999 | U47: 4.4天 | V47: 5.49年 | W47: 3.49年 | X47: 9.6000000000000002e-002 | Y47: 8.900000000000001e-002 | Z47: 8 | AA47: 83 | AB47: 1.8500000000000003e-002 | AC47: 1.2800000000000001e-002 | AD47: -6.5000000000000006e-003 | AE47: -8.5000000000000006e-003 | AF47: 88.54 | AG47: 92.6 | AH47: 0.53 | AI47: AA | AJ47: 4.4900000000000002e-002 | AK47: =I47+100*T47 -> 120.86499999999999 | AL47: 119.8 | AM47: 14 | AN47: 27.2 | AO47: 15 | AP47: -2.4e-002 | AQ47: 38 | AR47: 搜特转债!
A48: 130 | B48: 森特转债 | C48: 113557 | D48: 43840. | E48: 森特股份 | F48: 603098 | G48: 建筑 | H48: 建筑工程 | I48: 109.91 | J48: 7.4999999999999997e-003 | K48: 5.7999999999999996e-003 | L48: 9.77 | M48: 2.0899999999999998e-002 | N48: 7.3 | O48: 1.1000000000000001e-002 | P48: 120.7 | Q48: 10.11 | R48: 2.33 | S48: 96.64 | T48: 0.13699999999999998 | U48: 转股中 | V48: 5.26年 | W48: 3.26年 | X48: 0.128 | Y48: 0.124 | Z48: 6 | AA48: 47 | AB48: 1.83e-002 | AC48: 1.1399999999999999e-002 | AD48: -1.61e-002 | AE48: -1.83e-002 | AF48: 83.82 | AG48: 86.91 | AH48: 0.64 | AI48: AA- | AJ48: 6.59e-002 | AK48: =I48+100*T48 -> 123.61 | AL48: 123.2 | AM48: 33 | AN48: 36.3 | AO48: 65 | AP48: -1.4999999999999999e-002 | AQ48: 36 | AR48: 森特转债
A49: 24 | B49: 联诚转债 | C49: 128120 | D49: 44060. | E49: 联诚精密 | F49: 2921 | G49: 汽车 | H49: 零部件制 | I49: 107 | J49: 4.6999999999999993e-003 | K49: 8.8000000000000005e-003 | L49: 21.32 | M49: 2.0099999999999996e-002 | N49: 4.5 | O49: 1.6e-002 | P49: 118.4 | Q49: 24.37 | R49: 2.46 | S49: 87.48 | T49: 0.223 | U49: 4月13天 | V49: 5.84年 | W49: 3.84年 | X49: 0.14899999999999999 | Y49: 0.13100000000000001 | Z49: 2.6 | AA49: 17 | AB49: 1.7899999999999999e-002 | AC49: 1.2199999999999999e-002 | AD49: -5.7999999999999996e-003 | AE49: -8.0000000000000002e-003 | AF49: 75.18 | AG49: 73.62 | AH49: 0.67 | AI49: A | AJ49: 8.6899999999999991e-002 | AK49: =I49+100*T49 -> 129.30000000000001 | AL49: 126.5 | AM49: 58 | AN49: 51.3 | AO49: 199 | AP49: -7.8e-002 | AQ49: 7 | AR49: 联诚转债
A50: 138 | B50: 华锋转债! | C50: 128082 | D50: 43836. | E50: 华锋股份 | F50: 2806 | G50: 电子 | H50: 元器件制 | I50: 111.98 | J50: 1.6000000000000001e-003 | K50: 8.1000000000000013e-003 | L50: 11.96 | M50: 1.3600000000000001e-002 | N50: 1.9 | O50: 5.0000000000000001e-003 | P50: 122 | Q50: 11.71 | R50: 1.68 | S50: 102.13 | T50: 9.6000000000000002e-002 | U50: 转股中 | V50: 5.22年 | W50: 3.22年 | X50: 0.16699999999999998 | Y50: 0.17100000000000001 | Z50: 3.5 | AA50: 21 | AB50: 1.7000000000000001e-002 | AC50: 9.5999999999999992e-003 | AD50: -1.89e-002 | AE50: -2.1700000000000001e-002 | AF50: 82.1 | AG50: 83.77 | AH50: 0.71 | AI50: A+ | AJ50: 7.690000000000001e-002 | AK50: =I50+100*T50 -> 121.58 | AL50: 121.8 | AM50: 21 | AN50: 38.1 | AO50: 86 | AP50: -5.7000000000000002e-002 | AQ50: 54 | AR50: 华锋转债!
A51: 87 | B51: 久吾转债 | C51: 123047 | D51: 43938. | E51: 久吾高科 | F51: 300631 | G51: 机械装备 | H51: 专用设备 | I51: 119 | J51: 8.3999999999999995e-003 | K51: 6.8000000000000005e-003 | L51: 19.7 | M51: 2.0199999999999999e-002 | N51: 12 | O51: 3.7999999999999999e-002 | P51: 130.1 | Q51: 17.61 | R51: 3 | S51: 111.87 | T51: 6.4000000000000001e-002 | U51: 12天 | V51: 5.51年 | W51: 3.51年 | X51: 0.122 | Y51: 0.13699999999999998 | Z51: 2.5 | AA51: 21 | AB51: 1.6799999999999999e-002 | AC51: 7.8000000000000005e-003 | AD51: -3.1099999999999999e-002 | AE51: -3.4099999999999998e-002 | AF51: 81.08 | AG51: 87.49 | AH51: 0.75 | AI51: A+ | AJ51: 7.690000000000001e-002 | AK51: =I51+100*T51 -> 125.40000000000001 | AL51: 126.1 | AM51: 54 | AN51: 38.6 | AO51: 93 | AP51: -3.3000000000000002e-002 | AQ51: 20 | AR51: 久吾转债
A52: 229 | B52: 长久转债! | C52: 113519 | D52: 43434. | E52: 长久物流 | F52: 603569 | G52: 交通运输 | H52: 物流业 | I52: 112.4 | J52: 5.8999999999999999e-003 | K52: -5.5000000000000005e-003 | L52: 9.94 | M52: 1.e-003 | N52: 16 | O52: 2.e-002 | P52: 120.1 | Q52: 11.15 | R52: 2.66 | S52: 89.15 | T52: 0.26100000000000001 | U52: 转股中 | V52: 4年54天 | W52: 2年54天 | X52: 0.125 | Y52: 0.11199999999999999 | Z52: 7 | AA52: 56 | AB52: 1.6500000000000001e-002 | AC52: 7.9000000000000008e-003 | AD52: -3.5000000000000003e-002 | AE52: -3.7900000000000003e-002 | AF52: 94.02 | AG52: 101.09 | AH52: 0.37 | AI52: AA | AJ52: 4.3400000000000001e-002 | AK52: =I52+100*T52 -> 138.5 | AL52: 135.7 | AM52: 145 | AN52: 34.6 | AO52: 50 | AP52: -2.e-002 | AQ52: 17 | AR52: 长久转债!
A53: 219 | B53: 钧达转债! | C53: 128050 | D53: 43461. | E53: 钧达股份 | F53: 2865 | G53: 汽车 | H53: 零部件制 | I53: 115.438 | J53: 4.4000000000000003e-003 | K53: 2.0000000000000001e-004 | L53: 16.22 | M53: 6.8000000000000005e-003 | N53: 8.2 | O53: 2.2000000000000002e-002 | P53: 123.5 | Q53: 14.83 | R53: 2.29 | S53: 109.37 | T53: 5.5e-002 | U53: 转股中 | V53: 4.24年 | W53: 2.24年 | X53: 0.16300000000000001 | Y53: 0.17800000000000002 | Z53: 3.2 | AA53: 20 | AB53: 1.6399999999999998e-002 | AC53: 6.8999999999999999e-003 | AD53: -4.36e-002 | AE53: -4.6500000000000007e-002 | AF53: 89.55 | AG53: 95.39 | AH53: 0.67 | AI53: AA- | AJ53: 6.4399999999999999e-002 | AK53: =I53+100*T53 -> 120.938 | AL53: 121.5 | AM53: 20 | AN53: 26.1 | AO53: 13 | AP53: -4.5999999999999999e-002 | AQ53: 62 | AR53: 钧达转债!
A54: 23 | B54: 沪工转债 | C54: 113593 | D54: 44053. | E54: 上海沪工 | F54: 603131 | G54: 机械装备 | H54: 通用设备 | I54: 110.82 | J54: -8.8999999999999999e-003 | K54: 2.07e-002 | L54: 18.5 | M54: 1.9299999999999998e-002 | N54: 33 | O54: 7.400000000000001e-002 | P54: 121.6 | Q54: 21.32 | R54: 4.86 | S54: 86.77 | T54: 0.27699999999999997 | U54: 4月13天 | V54: 5.85年 | W54: 3.85年 | X54: 6.8000000000000005e-002 | Y54: 5.9000000000000004e-002 | Z54: 4 | AA54: 59 | AB54: 1.6299999999999999e-002 | AC54: 9.8999999999999991e-003 | AD54: -1.44e-002 | AE54: -1.66e-002 | AF54: 77.93 | AG54: 79.6 | AH54: 0.61 | AI54: A+ | AJ54: 7.690000000000001e-002 | AK54: =I54+100*T54 -> 138.51999999999998 | AL54: 134.9 | AM54: 139 | AN54: 55.3 | AO54: 225 | AP54: -0.13 | AQ54: 4 | AR54: 沪工转债
A55: 267 | B55: 众兴转债! | C55: 128026 | D55: 43103. | E55: 众兴菌业 | F55: 2772 | G55: 农业 | H55: 种植业 | I55: 104.84 | J55: -1.23e-002 | K55: 1.5900000000000001e-002 | L55: 8.91 | M55: 1.37e-002 | N55: 5.3 | O55: 5.0000000000000001e-003 | P55: 110.3 | Q55: 11.45 | R55: 1.37 | S55: 77.82 | T55: 0.34700000000000003 | U55: 转股中 | V55: 3.25年 | W55: 1.25年 | X55: 0.28100000000000003 | Y55: 0.218 | Z55: 9.2 | AA55: 33 | AB55: 1.61e-002 | AC55: 1.01e-002 | AD55: -1.3899999999999999e-002 | AE55: -1.77e-002 | AF55: 94.2 | AG55: 90.49 | AH55: 0.26 | AI55: AA- | AJ55: 6.4399999999999999e-002 | AK55: =I55+100*T55 -> 139.54000000000002 | AL55: 131.9 | AM55: 108 | AN55: 37.7 | AO55: 79 | AP55: -0.10800000000000001 | AQ55: 56 | AR55: 众兴转债!
A56: 209 | B56: 今飞转债! | C56: 128056 | D56: 43546. | E56: 今飞凯达 | F56: 2863 | G56: 汽车 | H56: 零部件制 | I56: 113.1 | J56: 1.34e-002 | K56: -1.04e-002 | L56: 7.34 | M56: 4.0999999999999995e-003 | N56: 26 | O56: 6.4000000000000001e-002 | P56: 121 | Q56: 6.76 | R56: 2.69 | S56: 108.58 | T56: 4.2000000000000003e-002 | U56: 转股中 | V56: 4.46年 | W56: 2.46年 | X56: 0.13300000000000001 | Y56: 0.14499999999999999 | Z56: 3.7 | AA56: 28 | AB56: 1.5600000000000001e-002 | AC56: 7.4000000000000003e-003 | AD56: -3.1200000000000002e-002 | AE56: -3.4099999999999998e-002 | AF56: 86.29 | AG56: 88.22 | AH56: 0.75 | AI56: A+ | AJ56: 7.5399999999999995e-002 | AK56: =I56+100*T56 -> 117.3 | AL56: 117.6 | AM56: 8 | AN56: 29.4 | AO56: 20 | AP56: 4.4000000000000004e-002 | AQ56: 60 | AR56: 今飞转债!
A57: 140 | B57: 海亮转债! | C57: 128081 | D57: 43815. | E57: 海亮股份 | F57: 2203 | G57: 有色金属 | H57: 铜金属 | I57: 106.54 | J57: 5.0000000000000001e-003 | K57: -5.0000000000000001e-003 | L57: 8.2 | M57: 0. | N57: 12 | O57: 3.0000000000000001e-003 | P57: 115.2 | Q57: 9.76 | R57: 1.78 | S57: 84.02 | T57: 0.26800000000000002 | U57: 转股中 | V57: 5.19年 | W57: 3.19年 | X57: 0.19699999999999998 | Y57: 0.16500000000000001 | Z57: 32 | AA57: 160 | AB57: 1.55e-002 | AC57: 1.01e-002 | AD57: -8.1000000000000013e-003 | AE57: -1.0200000000000001e-002 | AF57: 89.64 | AG57: 92.15 | AH57: 0.42 | AI57: AA | AJ57: 4.4900000000000002e-002 | AK57: =I57+100*T57 -> 133.34 | AL57: 129.1 | AM57: 79 | AN57: 36.9 | AO57: 71 | AP57: -5.5e-002 | AQ57: 52 | AR57: 海亮转债!
A58: 171 | B58: 华森转债! | C58: 128069 | D58: 43657. | E58: 华森制药 | F58: 2907 | G58: 医药 | H58: 化学制药 | I58: 111.8 | J58: 6.8000000000000005e-003 | K58: 4.8999999999999998e-003 | L58: 17.17 | M58: 1.9599999999999999e-002 | N58: 3.6 | O58: 1.1000000000000001e-002 | P58: 120 | Q58: 18.04 | R58: 6.65 | S58: 95.18 | T58: 0.17499999999999999 | U58: 转股中 | V58: 4.78年 | W58: 2.78年 | X58: 4.2999999999999997e-002 | Y58: 4.0999999999999995e-002 | Z58: 3 | AA58: 69 | AB58: 1.52e-002 | AC58: 7.9000000000000008e-003 | AD58: -2.6099999999999998e-002 | AE58: -2.8300000000000002e-002 | AF58: 86.29 | AG58: 89.59 | AH58: 0.59 | AI58: AA- | AJ58: 6.4399999999999999e-002 | AK58: =I58+100*T58 -> 129.30000000000001 | AL58: 128.4 | AM58: 69 | AN58: 38.8 | AO58: 97 | AP58: -5.2000000000000005e-002 | AQ58: 42 | AR58: 华森转债!
A59: 20 | B59: 花王转债 | C59: 113595 | D59: 44061. | E59: 花王股份 | F59: 603007 | G59: 城市公用 | H59: 生态环境 | I59: 115 | J59: 4.3e-003 | K59: 1.5600000000000001e-002 | L59: 7.88 | M59: 2.6000000000000002e-002 | N59: 28 | O59: 7.4999999999999997e-002 | P59: 125.3 | Q59: 6.94 | R59: 2.4 | S59: 113.54 | T59: 1.3000000000000001e-002 | U59: 4月15天 | V59: 5.85年 | W59: 3.85年 | X59: 0.125 | Y59: 0.14199999999999999 | Z59: 3.3 | AA59: 26 | AB59: 1.5100000000000001e-002 | AC59: 7.8000000000000005e-003 | AD59: -2.4500000000000001e-002 | AE59: -2.64e-002 | AF59: 80.89 | AG59: 86.93 | AH59: 0.76 | AI59: AA- | AJ59: 6.59e-002 | AK59: =I59+100*T59 -> 116.3 | AL59: 116.5 | AM59: 3 | AN59: 29.5 | AO59: 22 | AP59: -1.7000000000000001e-002 | AQ59: 18 | AR59: 花王转债
A60: 276 | B60: 时达转债! | C60: 128018 | D60: 43073. | E60: 新时达 | F60: 2527 | G60: 机械装备 | H60: 机器人及 | I60: 105.6 | J60: 1.7000000000000001e-003 | K60: -5.0000000000000001e-004 | L60: 5.81 | M60: 5.1999999999999998e-003 | N60: 3.7 | O60: 4.0000000000000001e-003 | P60: 110.3 | Q60: 7.42 | R60: 1.43 | S60: 78.3 | T60: 0.34899999999999998 | U60: 转股中 | V60: 3年53天 | W60: 1年53天 | X60: 0.24399999999999999 | Y60: 0.191 | Z60: 8.8 | AA60: 36 | AB60: 1.43e-002 | AC60: 8.0000000000000002e-003 | AD60: -2.0499999999999997e-002 | AE60: -2.4500000000000001e-002 | AF60: 97.28 | AG60: 96.8 | AH60: 0.23 | AI60: AA | AJ60: 4.3400000000000001e-002 | AK60: =I60+100*T60 -> 140.5 | AL60: 132.9 | AM60: 124 | AN60: 35.6 | AO60: 60 | AP60: -6.0000000000000001e-003 | AQ60: 41 | AR60: 时达转债!
A61: 80 | B61: 鲁泰转债 | C61: 127016 | D61: 43964. | E61: 鲁 泰Ａ | F61: 726 | G61: 服装纺织 | H61: 纺织行业 | I61: 107.562 | J61: 2.e-003 | K61: 2.9999999999999997e-004 | L61: 7.69 | M61: 5.1999999999999998e-003 | N61: 2.3 | O61: 2.e-003 | P61: 116.2 | Q61: 8.91 | R61: 0.85 | S61: 86.31 | T61: 0.24600000000000002 | U61: 31天 | V61: 5.57年 | W61: 3.57年 | X61: 0.21199999999999999 | Y61: 0.183 | Z61: 14 | AA61: 66 | AB61: 1.4199999999999999e-002 | AC61: 9.0000000000000011e-003 | AD61: -9.7999999999999997e-003 | AE61: -1.1699999999999999e-002 | AF61: 88.77 | AG61: 92.37 | AH61: 0.44 | AI61: AA+ | AJ61: 4.2900000000000001e-002 | AK61: =I61+100*T61 -> 132.16200000000001 | AL61: 128.8 | AM61: 74 | AN61: 36.4 | AO61: 68 | AP61: -2.2000000000000002e-002 | AQ61: 21 | AR61: 鲁泰转债
A62: 34 | B62: 道恩转债 | C62: 128117 | D62: 44032. | E62: 道恩股份 | F62: 2838 | G62: 化工 | H62: 橡胶塑料 | I62: 114.03 | J62: 4.5999999999999999e-003 | K62: 6.3e-003 | L62: 28.47 | M62: 1.6799999999999999e-002 | N62: 5.1 | O62: 1.2e-002 | P62: 123.5 | Q62: 29.32 | R62: 7.14 | S62: 97.1 | T62: 0.17399999999999999 | U62: 3月26天 | V62: 5.80年 | W62: 3.80年 | X62: 3.1e-002 | Y62: 2.9999999999999999e-002 | Z62: 3.6 | AA62: 116 | AB62: 1.41e-002 | AC62: 7.1999999999999998e-003 | AD62: -2.3599999999999999e-002 | AE62: -2.53e-002 | AF62: 80.82 | AG62: 85.89 | AH62: 0.65 | AI62: AA- | AJ62: 6.59e-002 | AK62: =I62+100*T62 -> 131.43000000000001 | AL62: 131 | AM62: 97 | AN62: 45.1 | AO62: 156 | AP62: -5.2000000000000005e-002 | AQ62: 8 | AR62: 道恩转债
A63: 185 | B63: 核能转债! | C63: 113026 | D63: 43593. | E63: 中国核电 | F63: 601985 | G63: 能源电力 | H63: 核电 | I63: 103.13 | J63: 1.1999999999999999e-003 | K63: -2.8000000000000004e-003 | L63: 4.54 | M63: -6.6e-003 | N63: 6.4 | O63: 1.e-003 | P63: 109.8 | Q63: 6.08 | R63: 1.41 | S63: 74.67 | T63: 0.38100000000000001 | U63: 转股中 | V63: 4.58年 | W63: 2.58年 | X63: 0.11 | Y63: 8.199999999999999e-002 | Z63: 78 | AA63: 707 | AB63: 1.3999999999999999e-002 | AC63: 9.8999999999999991e-003 | AD63: 5.9999999999999995e-004 | AE63: -1.7000000000000001e-003 | AF63: 93.21 | AG63: 92.7 | AH63: 0.25 | AI63: AAA | AJ63: 3.8399999999999997e-002 | AK63: =I63+100*T63 -> 141.22999999999999 | AL63: 131.6 | AM63: 104 | AN63: 38.4 | AO63: 88 | AP63: -2.2000000000000002e-002 | AQ63: 50 | AR63: 核能转债!
A64: 234 | B64: 苏农转债! | C64: 113516 | D64: 43332. | E64: 苏农银行 | F64: 603323 | G64: 金融 | H64: 银行行业 | I64: 108.45 | J64: 8.199999999999999e-003 | K64: -1.6299999999999999e-002 | L64: 4.69 | M64: -2.29e-002 | N64: 20 | O64: 1.3999999999999999e-002 | P64: 114.3 | Q64: 5.52 | R64: 0.73 | S64: 84.96 | T64: 0.27600000000000002 | U64: 转股中 | V64: 3.88年 | W64: 无权 | X64: 0.152 | Y64: 0.13 | Z64: 13 | AA64: 85 | AB64: 1.3899999999999999e-002 | AC64: 7.0999999999999995e-003 | AD64: 无权 | AE64: 无权 | AF64: 无权 | AG64: 97.91 | AH64: 0.35 | AI64: AA+ | AJ64: 4.1399999999999999e-002 | AK64: =I64+100*T64 -> 136.05000000000001 | AL64: 131.9 | AM64: 110 | AN64: 34 | AO64: 42 | AP64: -2.2000000000000002e-002 | AQ64: 36 | AR64: 苏农转债!
A65: 157 | B65: 万里转债! | C65: 123032 | D65: 43769. | E65: 万里马 | F65: 300591 | G65: 服装纺织 | H65: 服装纺织 | I65: 124.15 | J65: 1.5900000000000001e-002 | K65: -3.1300000000000001e-002 | L65: 7.5 | M65: -2.2200000000000001e-002 | N65: 192 | O65: 1.1599999999999999 | P65: 132.8 | Q65: 6.89 | R65: 5.17 | S65: 108.85 | T65: 0.14099999999999999 | U65: 转股中 | V65: 5年27天 | W65: 3年27天 | X65: 5.7000000000000002e-002 | Y65: 6.2e-002 | Z65: 1.3 | AA65: 23 | AB65: 1.3899999999999999e-002 | AC65: 3.4000000000000002e-003 | AD65: -4.3400000000000001e-002 | AE65: -4.7599999999999996e-002 | AF65: 85.39 | AG65: 92.62 | AH65: 0.69 | AI65: A+ | AJ65: 7.690000000000001e-002 | AK65: =I65+100*T65 -> 138.25 | AL65: 139.4 | AM65: 182 | AN65: 46.8 | AO65: 167 | AP65: -5.0999999999999997e-002 | AQ65: 43 | AR65: 万里转债!
A66: 84 | B66: 华体转债! | C66: 113574 | D66: 43948. | E66: 华体科技 | F66: 603679 | G66: 城市公用 | H66: 城市公用 | I66: 108.18 | J66: -3.0999999999999999e-003 | K66: 1.1000000000000001e-003 | L66: 25.1 | M66: -4.4000000000000003e-003 | N66: 3.7 | O66: 1.7000000000000001e-002 | P66: 116.4 | Q66: 33.99 | R66: 3.6 | S66: 73.85 | T66: 0.46500000000000002 | U66: 23天 | V66: 5.54年 | W66: 3.54年 | X66: 5.7999999999999996e-002 | Y66: 4.2999999999999997e-002 | Z66: 2.1 | AA66: 36 | AB66: 1.3600000000000001e-002 | AC66: 8.199999999999999e-003 | AD66: -9.1999999999999998e-003 | AE66: -1.1599999999999999e-002 | AF66: 79.71 | AG66: 77.99 | AH66: 0.46 | AI66: A+ | AJ66: 7.690000000000001e-002 | AK66: =I66+100*T66 -> 154.68000000000001 | AL66: 142.5 | AM66: 204 | AN66: 62.8 | AO66: 249 | AP66: -0.107 | AQ66: 10 | AR66: 华体转债!
A67: 191 | B67: 海环转债! | C67: 113532 | D67: 43579. | E67: 海峡环保 | F67: 603817 | G67: 城市公用 | H67: 三废处理 | I67: 106.49 | J67: -5.1000000000000004e-003 | K67: 8.8999999999999999e-003 | L67: 6.44 | M67: 9.3999999999999986e-003 | N67: 2.4 | O67: 5.0000000000000001e-003 | P67: 112.9 | Q67: 7.69 | R67: 1.73 | S67: 83.75 | T67: 0.27200000000000002 | U67: 转股中 | V67: 4.55年 | W67: 2.55年 | X67: 0.159 | Y67: 0.13300000000000001 | Z67: 4.6 | AA67: 29 | AB67: 1.32e-002 | AC67: 7.9000000000000008e-003 | AD67: -1.09e-002 | AE67: -1.3300000000000001e-002 | AF67: 92.24 | AG67: 93.43 | AH67: 0.4 | AI67: AA | AJ67: 4.3400000000000001e-002 | AK67: =I67+100*T67 -> 133.69 | AL67: 129.2 | AM67: 83 | AN67: 35.8 | AO67: 63 | AP67: -5.4000000000000006e-002 | AQ67: 26 | AR67: 海环转债!
A68: 120 | B68: 唐人转债! | C68: 128092 | D68: 43852. | E68: 唐人神 | F68: 2567 | G68: 农业 | H68: 畜牧业 | I68: 107.903 | J68: 4.0000000000000002e-004 | K68: 7.6e-003 | L68: 9.33 | M68: 8.6e-003 | N68: 22 | O68: 7.8e-002 | P68: 115.3 | Q68: 8.63 | R68: 2.19 | S68: 108.11 | T68: -2.e-003 | U68: 转股中 | V68: 5.29年 | W68: 3.29年 | X68: 2.9999999999999999e-002 | Y68: 3.2000000000000001e-002 | Z68: 2.6 | AA68: 88 | AB68: 1.29e-002 | AC68: 7.6e-003 | AD68: -1.1299999999999999e-002 | AE68: -1.34e-002 | AF68: 89.32 | AG68: 91.82 | AH68: 0.92 | AI68: AA | AJ68: 4.4900000000000002e-002 | AK68: =I68+100*T68 -> 107.703 | AL68: 107.7 | AM68: 1 | AN68: 15.9 | AO68: 3 | AP68: -0.14999999999999999 | AQ68: 28 | AR68: 唐人转债!
A69: 206 | B69: 贵广转债! | C69: 110052 | D69: 43553. | E69: 贵广网络 | F69: 600996 | G69: 传媒娱乐 | H69: 影视娱乐 | I69: 112.33 | J69: 7.8000000000000005e-003 | K69: -1.8e-003 | L69: 7.24 | M69: 1.3999999999999999e-002 | N69: 8.6 | O69: 5.0000000000000001e-003 | P69: 118.5 | Q69: 7.94 | R69: 1.65 | S69: 91.18 | T69: 0.23199999999999998 | U69: 转股中 | V69: 4.47年 | W69: 2.47年 | X69: 0.20100000000000001 | Y69: 0.183 | Z69: 15 | AA69: 76 | AB69: 1.23e-002 | AC69: 5.0000000000000001e-003 | AD69: -2.9700000000000001e-002 | AE69: -3.2400000000000005e-002 | AF69: 93.41 | AG69: 99.24 | AH69: 0.43 | AI69: AA+ | AJ69: 4.1399999999999999e-002 | AK69: =I69+100*T69 -> 135.53 | AL69: 133.5 | AM69: 128 | AN69: 34.2 | AO69: 46 | AP69: -5.9000000000000004e-002 | AQ69: 18 | AR69: 贵广转债!
A70: 202 | B70: 苏银转债! | C70: 110053 | D70: 43558. | E70: 江苏银行 | F70: 600919 | G70: 金融 | H70: 银行行业 | I70: 113.2 | J70: 2.7000000000000001e-003 | K70: -1.1299999999999999e-002 | L70: 6.33 | M70: -2.3099999999999999e-002 | N70: 80 | O70: 4.0000000000000001e-003 | P70: 119.1 | Q70: 7.28 | R70: 0.64 | S70: 86.95 | T70: 0.30199999999999999 | U70: 转股中 | V70: 4.50年 | W70: 无权 | X70: 0.27399999999999997 | Y70: 0.23800000000000002 | Z70: 200 | AA70: 731 | AB70: 1.1699999999999999e-002 | AC70: 4.1999999999999997e-003 | AD70: 无权 | AE70: 无权 | AF70: 无权 | AG70: 101.05 | AH70: 0.37 | AI70: AAA | AJ70: 3.8399999999999997e-002 | AK70: =I70+100*T70 -> 143.40000000000001 | AL70: 139.4 | AM70: 183 | AN70: 38.4 | AO70: 89 | AP70: -1.7000000000000001e-002 | AQ70: 47 | AR70: 苏银转债!
A71: 103 | B71: 君禾转债 | C71: 113567 | D71: 43924. | E71: 君禾股份 | F71: 603617 | G71: 机械装备 | H71: 通用设备 | I71: 112.25 | J71: 4.7999999999999996e-003 | K71: 1.7399999999999999e-002 | L71: 11.69 | M71: 2.9999999999999999e-002 | N71: 2.7 | O71: 1.2e-002 | P71: 119.3 | Q71: 11.46 | R71: 3.73 | S71: 102.01 | T71: 0.10000000000000001 | U71: 转股中 | V71: 5.47年 | W71: 3.47年 | X71: 8.9999999999999997e-002 | Y71: 9.1999999999999998e-002 | Z71: 2.1 | AA71: 23 | AB71: 1.15e-002 | AC71: 5.1999999999999998e-003 | AD71: -1.9799999999999998e-002 | AE71: -2.2099999999999998e-002 | AF71: 80.09 | AG71: 80.35 | AH71: 0.74 | AI71: A+ | AJ71: 7.690000000000001e-002 | AK71: =I71+100*T71 -> 122.25 | AL71: 122.5 | AM71: 26 | AN71: 42.1 | AO71: 135 | AP71: -8.0000000000000002e-003 | AQ71: 28 | AR71: 君禾转债
A72: 33 | B72: 瀛通转债 | C72: 128118 | D72: 44048. | E72: 瀛通通讯 | F72: 2861 | G72: 电子 | H72: 电子产品 | I72: 114.6 | J72: 0. | K72: 1.3100000000000001e-002 | L72: 25.58 | M72: 2.12e-002 | N72: 8.2 | O72: 2.4e-002 | P72: 122.1 | Q72: 27.53 | R72: 2.96 | S72: 92.92 | T72: 0.23300000000000001 | U72: 3月26天 | V72: 5.80年 | W72: 3.80年 | X72: 9.6000000000000002e-002 | Y72: 8.900000000000001e-002 | Z72: 3 | AA72: 31 | AB72: 1.1200000000000002e-002 | AC72: 4.6999999999999993e-003 | AD72: -2.3e-002 | AE72: -2.5099999999999997e-002 | AF72: 81.44 | AG72: 85.05 | AH72: 0.62 | AI72: AA- | AJ72: 6.59e-002 | AK72: =I72+100*T72 -> 137.90000000000001 | AL72: 136.3 | AM72: 153 | AN72: 51.2 | AO72: 198 | AP72: -7.2999999999999995e-002 | AQ72: 4 | AR72: 瀛通转债
A73: 122 | B73: 开润转债! | C73: 123039 | D73: 43853. | E73: 开润股份 | F73: 300577 | G73: 服装纺织 | H73: 纺织行业 | I73: 114.902 | J73: -1.e-002 | K73: -1.8200000000000001e-002 | L73: 28.45 | M73: -4.9400000000000006e-002 | N73: 2.3 | O73: 9.0000000000000011e-003 | P73: 121.5 | Q73: 33.22 | R73: 7.04 | S73: 85.64 | T73: 0.34200000000000003 | U73: 转股中 | V73: 5.28年 | W73: 3.28年 | X73: 3.6000000000000004e-002 | Y73: 3.1e-002 | Z73: 2.2 | AA73: 62 | AB73: 1.09e-002 | AC73: 3.8e-003 | AD73: -2.7300000000000001e-002 | AE73: -2.9700000000000001e-002 | AF73: 81.29 | AG73: 82.96 | AH73: 0.57 | AI73: A+ | AJ73: 7.690000000000001e-002 | AK73: =I73+100*T73 -> 149.102 | AL73: 144.2 | AM73: 215 | AN73: 61.2 | AO73: 246 | AP73: -7.4999999999999997e-002 | AQ73: 22 | AR73: 开润转债!
A74: 146 | B74: 金力转债! | C74: 123033 | D74: 43794. | E74: 金力永磁 | F74: 300748 | G74: 电子 | H74: 元器件制 | I74: 115.711 | J74: -2.5000000000000001e-003 | K74: 7.1999999999999998e-003 | L74: 37.35 | M74: 8.3999999999999995e-003 | N74: 30 | O74: 5.9999999999999998e-002 | P74: 121.9 | Q74: 41.09 | R74: 12.17 | S74: 90.9 | T74: 0.27300000000000002 | U74: 转股中 | V74: 5年48天 | W74: 3年48天 | X74: 2.7999999999999997e-002 | Y74: 2.6000000000000002e-002 | Z74: 4.4 | AA74: 154 | AB74: 1.0500000000000001e-002 | AC74: 3.0999999999999999e-003 | AD74: -2.8300000000000002e-002 | AE74: -3.1300000000000001e-002 | AF74: 85.69 | AG74: 88.72 | AH74: 0.57 | AI74: AA- | AJ74: 6.59e-002 | AK74: =I74+100*T74 -> 143.011 | AL74: 140.5 | AM74: 193 | AN74: 51.8 | AO74: 203 | AP74: -0.10199999999999999 | AQ74: 26 | AR74: 金力转债!
A75: 113 | B75: 星帅转债 | C75: 128094 | D75: 43880. | E75: 星帅尔 | F75: 2860 | G75: 家电 | H75: 零部件制 | I75: 115.052 | J75: -3.4000000000000002e-003 | K75: 5.0000000000000001e-003 | L75: 14.78 | M75: 2.e-003 | N75: 1.4 | O75: 4.0000000000000001e-003 | P75: 121.5 | Q75: 13.95 | R75: 3.29 | S75: 105.95 | T75: 8.5999999999999993e-002 | U75: 转股中 | V75: 5.34年 | W75: 3.34年 | X75: 9.5000000000000001e-002 | Y75: 0.10099999999999999 | Z75: 2.8 | AA75: 29 | AB75: 1.0500000000000001e-002 | AC75: 3.4999999999999996e-003 | AD75: -2.7200000000000002e-002 | AE75: -2.9600000000000001e-002 | AF75: 80.95 | AG75: 82.61 | AH75: 0.76 | AI75: A+ | AJ75: 7.690000000000001e-002 | AK75: =I75+100*T75 -> 123.652 | AL75: 124.2 | AM75: 44 | AN75: 41.5 | AO75: 128 | AP75: -1.7000000000000001e-002 | AQ75: 30 | AR75: 星帅转债
A76: 262 | B76: 双环转债! | C76: 128032 | D76: 43125. | E76: 双环传动 | F76: 2472 | G76: 机械装备 | H76: 通用设备 | I76: 106.72 | J76: 1.7299999999999999e-002 | K76: -9.8999999999999991e-003 | L76: 7.09 | M76: 5.04e-002 | N76: 4.6 | O76: 4.0000000000000001e-003 | P76: 110.3 | Q76: 9.89 | R76: 1.48 | S76: 71.69 | T76: 0.48899999999999999 | U76: 转股中 | V76: 3.28年 | W76: 1.28年 | X76: 0.20499999999999999 | Y76: 0.14699999999999999 | Z76: 10 | AA76: 49 | AB76: 1.03e-002 | AC76: 4.4000000000000003e-003 | AD76: -2.58e-002 | AE76: -2.9399999999999999e-002 | AF76: 96.73 | AG76: 96.25 | AH76: 0.15 | AI76: AA | AJ76: 4.3400000000000001e-002 | AK76: =I76+100*T76 -> 155.62 | AL76: 141.8 | AM76: 197 | AN76: 45 | AO76: 155 | AP76: 4.8000000000000001e-002 | AQ76: 48 | AR76: 双环转债!
A77: 98 | B77: 百达转债 | C77: 113570 | D77: 43929. | E77: 百达精工 | F77: 603331 | G77: 机械装备 | H77: 机械装备 | I77: 109.28 | J77: -2.3e-003 | K77: -2.8999999999999998e-003 | L77: 11 | M77: -7.1999999999999998e-003 | N77: 2.8 | O77: 9.0000000000000011e-003 | P77: 115.3 | Q77: 11.54 | R77: 1.8 | S77: 95.32 | T77: 0.14599999999999999 | U77: 3.4天 | V77: 5.49年 | W77: 3.49年 | X77: 0.14199999999999999 | Y77: 0.13600000000000001 | Z77: 2.8 | AA77: 20 | AB77: 1.e-002 | AC77: 5.0000000000000001e-003 | AD77: -1.41e-002 | AE77: -1.61e-002 | AF77: 79.4 | AG77: 77.44 | AH77: 0.71 | AI77: A+ | AJ77: 7.690000000000001e-002 | AK77: =I77+100*T77 -> 123.88 | AL77: 123.2 | AM77: 35 | AN77: 43.8 | AO77: 148 | AP77: -7.0999999999999994e-002 | AQ77: 31 | AR77: 百达转债
A78: 184 | B78: 创维转债! | C78: 127013 | D78: 43601. | E78: 创维数字 | F78: 810 | G78: 电子 | H78: 电子产品 | I78: 112.798 | J78: -7.0999999999999995e-003 | K78: 1.5100000000000001e-002 | L78: 10.19 | M78: 1.9e-002 | N78: 11 | O78: 1.e-002 | P78: 117.9 | Q78: 11.39 | R78: 2.88 | S78: 89.46 | T78: 0.26100000000000001 | U78: 转股中 | V78: 4.58年 | W78: 2.58年 | X78: 8.9999999999999997e-002 | Y78: 8.1000000000000003e-002 | Z78: 9.8 | AA78: 108 | AB78: 9.8999999999999991e-003 | AC78: 3.0000000000000001e-003 | AD78: -3.1400000000000004e-002 | AE78: -3.3700000000000001e-002 | AF78: 92.1 | AG78: 97.4 | AH78: 0.42 | AI78: AA | AJ78: 4.3400000000000001e-002 | AK78: =I78+100*T78 -> 138.898 | AL78: 136.1 | AM78: 151 | AN78: 38.7 | AO78: 94 | AP78: -9.1999999999999998e-002 | AQ78: 23 | AR78: 创维转债!
A79: 106 | B79: 翔港转债 | C79: 113566 | D79: 43921. | E79: 翔港科技 | F79: 603499 | G79: 造纸包装 | H79: 包装材料 | I79: 118.24 | J79: -1.61e-002 | K79: -2.9100000000000001e-002 | L79: 12.25 | M79: -5.7699999999999994e-002 | N79: 51 | O79: 0.26200000000000001 | P79: 124.5 | Q79: 10.77 | R79: 3.28 | S79: 113.74 | T79: 4.0000000000000001e-002 | U79: 转股中 | V79: 5.46年 | W79: 3.46年 | X79: 6.7000000000000004e-002 | Y79: 7.5999999999999998e-002 | Z79: 1.6 | AA79: 24 | AB79: 9.7000000000000003e-003 | AC79: 2.0999999999999999e-003 | AD79: -3.3500000000000002e-002 | AE79: -3.5799999999999998e-002 | AF79: 80.32 | AG79: 83.91 | AH79: 0.78 | AI79: A+ | AJ79: 7.690000000000001e-002 | AK79: =I79+100*T79 -> 122.23999999999999 | AL79: 122.7 | AM79: 29 | AN79: 38.8 | AO79: 96 | AP79: -4.4000000000000004e-002 | AQ79: 27 | AR79: 翔港转债
A80: 32 | B80: 宁建转债 | C80: 113036 | D80: 44049. | E80: 宁波建工 | F80: 601789 | G80: 建筑 | H80: 建筑工程 | I80: 111.11 | J80: -7.9000000000000008e-003 | K80: -5.0000000000000001e-004 | L80: 4.64 | M80: -1.49e-002 | N80: 8 | O80: 1.3000000000000001e-002 | P80: 117.3 | Q80: 4.86 | R80: 1.55 | S80: 95.47 | T80: 0.16399999999999998 | U80: 3月29天 | V80: 5.81年 | W80: 3.81年 | X80: 0.11900000000000001 | Y80: 0.114 | Z80: 5.4 | AA80: 45 | AB80: 9.4999999999999998e-003 | AC80: 4.1999999999999997e-003 | AD80: -1.7100000000000001e-002 | AE80: -1.89e-002 | AF80: 87.31 | AG80: 91.32 | AH80: 0.57 | AI80: AA | AJ80: 4.4900000000000002e-002 | AK80: =I80+100*T80 -> 127.50999999999999 | AL80: 126.7 | AM80: 62 | AN80: 35.4 | AO80: 58 | AP80: -5.5e-002 | AQ80: 4 | AR80: 宁建转债
A81: 49 | B81: 中矿转债 | C81: 128111 | D81: 44019. | E81: 中矿资源 | F81: 2738 | G81: 有色金属 | H81: 有色行业 | I81: 118.3 | J81: 5.1000000000000004e-003 | K81: -6.0000000000000001e-003 | L81: 15.58 | M81: -1.2999999999999999e-003 | N81: 5.5 | O81: 6.0000000000000001e-003 | P81: 124.7 | Q81: 15.53 | R81: 1.6 | S81: 100.32 | T81: 0.17899999999999999 | U81: 3月4天 | V81: 5.74年 | W81: 3.74年 | X81: 0.185 | Y81: 0.185 | Z81: 8 | AA81: 43 | AB81: 9.3999999999999986e-003 | AC81: 2.2000000000000001e-003 | AD81: -3.1300000000000001e-002 | AE81: -3.3399999999999999e-002 | AF81: 81.77 | AG81: 87.16 | AH81: 0.68 | AI81: AA- | AJ81: 6.59e-002 | AK81: =I81+100*T81 -> 136.19999999999999 | AL81: 136.3 | AM81: 152 | AN81: 49.1 | AO81: 184 | AP81: -3.7999999999999999e-002 | AQ81: 5 | AR81: 中矿转债
A82: 17 | B82: 紫银转债 | C82: 113037 | D82: 44060. | E82: 紫金银行 | F82: 601860 | G82: 金融 | H82: 银行行业 | I82: 109.79 | J82: -2.8000000000000004e-003 | K82: 5.0000000000000001e-004 | L82: 4.16 | M82: -4.7999999999999996e-003 | N82: 43 | O82: 9.0000000000000011e-003 | P82: 115.8 | Q82: 4.75 | R82: 1.1 | S82: 87.58 | T82: 0.254 | U82: 4月17天 | V82: 5.86年 | W82: 无权 | X82: 0.29499999999999998 | Y82: 0.25900000000000001 | Z82: 45 | AA82: 152 | AB82: 9.300000000000001e-003 | AC82: 4.5000000000000005e-003 | AD82: 无权 | AE82: 无权 | AF82: 无权 | AG82: 90.98 | AH82: 0.48 | AI82: AA+ | AJ82: 4.2900000000000001e-002 | AK82: =I82+100*T82 -> 135.19 | AL82: 132 | AM82: 112 | AN82: 41 | AO82: 120 | AP82: -4.9000000000000002e-002 | AQ82: 14 | AR82: 紫银转债
A83: 186 | B83: 明泰转债! | C83: 113025 | D83: 43592. | E83: 明泰铝业 | F83: 601677 | G83: 有色金属 | H83: 铝金属 | I83: 110.63 | J83: -4.0000000000000002e-004 | K83: 8.0000000000000004e-004 | L83: 10.38 | M83: 1.e-003 | N83: 17 | O83: 8.0000000000000002e-003 | P83: 115.1 | Q83: 11.2 | R83: 0.91 | S83: 92.68 | T83: 0.19399999999999998 | U83: 转股中 | V83: 4.57年 | W83: 2.57年 | X83: 0.28800000000000003 | Y83: 0.26700000000000002 | Z83: 18 | AA83: 64 | AB83: 8.8999999999999999e-003 | AC83: 2.8999999999999998e-003 | AD83: -2.4500000000000001e-002 | AE83: -2.6800000000000001e-002 | AF83: 92.18 | AG83: 95.16 | AH83: 0.49 | AI83: AA | AJ83: 4.3400000000000001e-002 | AK83: =I83+100*T83 -> 130.03 | AL83: 128.6 | AM83: 71 | AN83: 33.4 | AO83: 39 | AP83: -6.7000000000000004e-002 | AQ83: 31 | AR83: 明泰转债!
A84: 188 | B84: 核建转债! | C84: 113024 | D84: 43581. | E84: 中国核建 | F84: 601611 | G84: 建筑 | H84: 建筑工程 | I84: 105.57 | J84: -2.0000000000000001e-004 | K84: 3.7000000000000002e-003 | L84: 7.44 | M84: 1.2199999999999999e-002 | N84: 8 | O84: 3.0000000000000001e-003 | P84: 109.7 | Q84: 9.76 | R84: 1.91 | S84: 76.23 | T84: 0.38500000000000001 | U84: 转股中 | V84: 4.57年 | W84: 2.57年 | X84: 0.152 | Y84: 0.11599999999999999 | Z84: 30 | AA84: 197 | AB84: 8.6e-003 | AC84: 4.5999999999999999e-003 | AD84: -8.3000000000000001e-003 | AE84: -1.06e-002 | AF84: 93.18 | AG84: 92.67 | AH84: 0.29 | AI84: AAA | AJ84: 3.8399999999999997e-002 | AK84: =I84+100*T84 -> 144.06999999999999 | AL84: 134.9 | AM84: 140 | AN84: 41.7 | AO84: 130 | AP84: -0.11699999999999999 | AQ84: 44 | AR84: 核建转债!
A85: 101 | B85: 正元转债 | C85: 123043 | D85: 43921. | E85: 正元智慧 | F85: 300645 | G85: 计算机及 | H85: 软件开发 | I85: 116 | J85: 1.15e-002 | K85: 2.7099999999999999e-002 | L85: 16.22 | M85: 5.0499999999999996e-002 | N85: 32 | O85: 0.158 | P85: 121.4 | Q85: 15.41 | R85: 3.38 | S85: 105.26 | T85: 0.10199999999999999 | U85: 转股中 | V85: 5.47年 | W85: 3.47年 | X85: 8.5000000000000006e-002 | Y85: 8.9999999999999997e-002 | Z85: 1.8 | AA85: 21 | AB85: 8.5000000000000006e-003 | AC85: 1.8e-003 | AD85: -2.8399999999999998e-002 | AE85: -3.0699999999999998e-002 | AF85: 80.13 | AG85: 81.73 | AH85: 0.76 | AI85: A+ | AJ85: 7.690000000000001e-002 | AK85: =I85+100*T85 -> 126.2 | AL85: 126.7 | AM85: 61 | AN85: 45 | AO85: 154 | AP85: -4.0000000000000001e-003 | AQ85: 17 | AR85: 正元转债
A86: 50 | B86: 思特转债 | C86: 123054 | D86: 44018. | E86: 思特奇 | F86: 300608 | G86: 通信互联 | H86: 通信设备 | I86: 116.4 | J86: 3.4999999999999996e-003 | K86: 3.1e-002 | L86: 18.09 | M86: 4.5700000000000005e-002 | N86: 19 | O86: 5.9000000000000004e-002 | P86: 121.7 | Q86: 16.49 | R86: 3.69 | S86: 109.7 | T86: 6.0999999999999999e-002 | U86: 3月3天 | V86: 5.74年 | W86: 3.74年 | X86: 9.5000000000000001e-002 | Y86: 0.10400000000000001 | Z86: 2.7 | AA86: 29 | AB86: 8.0000000000000002e-003 | AC86: 1.5e-003 | AD86: -2.7300000000000001e-002 | AE86: -2.9399999999999999e-002 | AF86: 81.78 | AG86: 85.1 | AH86: 0.76 | AI86: AA- | AJ86: 6.59e-002 | AK86: =I86+100*T86 -> 122.5 | AL86: 123.1 | AM86: 32 | AN86: 38 | AO86: 84 | AP86: 1.3999999999999999e-002 | AQ86: 9 | AR86: 思特转债
A87: 114 | B87: 银河转债! | C87: 123042 | D87: 43875. | E87: 金银河 | F87: 300619 | G87: 机械装备 | H87: 专用设备 | I87: 111.4 | J87: 4.5000000000000005e-003 | K87: 3.0000000000000001e-003 | L87: 22.22 | M87: 1.1399999999999999e-002 | N87: 3.5 | O87: 1.9e-002 | P87: 115.9 | Q87: 24.4 | R87: 3.5 | S87: 91.07 | T87: 0.223 | U87: 转股中 | V87: 5.34年 | W87: 3.34年 | X87: 0.10099999999999999 | Y87: 9.1999999999999998e-002 | Z87: 1.7 | AA87: 17 | AB87: 7.6e-003 | AC87: 2.3e-003 | AD87: -1.9099999999999999e-002 | AE87: -2.1299999999999999e-002 | AF87: 80.71 | AG87: 78.83 | AH87: 0.66 | AI87: A+ | AJ87: 7.690000000000001e-002 | AK87: =I87+100*T87 -> 133.70000000000002 | AL87: 131.7 | AM87: 106 | AN87: 51 | AO87: 197 | AP87: -2.2000000000000002e-002 | AQ87: 24 | AR87: 银河转债!
A88: 83 | B88: 利群转债! | C88: 113033 | D88: 43942. | E88: 利群股份 | F88: 601366 | G88: 商业零售 | H88: 商场 | I88: 110.67 | J88: 1.4000000000000002e-003 | K88: 3.0000000000000001e-003 | L88: 6.84 | M88: 7.4000000000000003e-003 | N88: 2.1 | O88: 1.e-003 | P88: 115.3 | Q88: 7.01 | R88: 1.33 | S88: 97.57 | T88: 0.13400000000000001 | U88: 24天 | V88: 5.55年 | W88: 3.55年 | X88: 0.30599999999999999 | Y88: 0.29799999999999999 | Z88: 18 | AA88: 59 | AB88: 7.6e-003 | AC88: 2.5999999999999999e-003 | AD88: -1.7299999999999999e-002 | AE88: -1.9199999999999998e-002 | AF88: 88.33 | AG88: 90.81 | AH88: 0.59 | AI88: AA | AJ88: 4.4900000000000002e-002 | AK88: =I88+100*T88 -> 124.07000000000001 | AL88: 123.8 | AM88: 38 | AN88: 33 | AO88: 35 | AP88: -7.4999999999999997e-002 | AQ88: 35 | AR88: 利群转债!
A89: 91 | B89: 雷迪转债 | C89: 123045 | D89: 43934. | E89: 雷迪克 | F89: 300652 | G89: 汽车 | H89: 零部件制 | I89: 114.697 | J89: -1.7000000000000001e-003 | K89: 2.8000000000000004e-003 | L89: 21.91 | M89: 1.4000000000000002e-003 | N89: 3.4 | O89: 1.e-002 | P89: 119.4 | Q89: 20.13 | R89: 2.41 | S89: 108.84 | T89: 5.4000000000000006e-002 | U89: 4.4天 | V89: 5.49年 | W89: 3.49年 | X89: 0.14999999999999999 | Y89: 0.16300000000000001 | Z89: 2.9 | AA89: 19 | AB89: 7.4999999999999997e-003 | AC89: 1.2999999999999999e-003 | AD89: -2.52e-002 | AE89: -2.75e-002 | AF89: 80.02 | AG89: 80.29 | AH89: 0.78 | AI89: A+ | AJ89: 7.690000000000001e-002 | AK89: =I89+100*T89 -> 120.09700000000001 | AL89: 120.6 | AM89: 17 | AN89: 40.3 | AO89: 114 | AP89: -4.0000000000000001e-003 | AQ89: 39 | AR89: 雷迪转债
A90: 222 | B90: 山鹰转债 | C90: 110047 | D90: 43444. | E90: 山鹰纸业 | F90: 600567 | G90: 造纸包装 | H90: 包装用纸 | I90: 114.6 | J90: -1.6e-002 | K90: 1.7500000000000002e-002 | L90: 3.22 | M90: 3.0999999999999999e-003 | N90: 3.5 | O90: 1.e-003 | P90: 118.1 | Q90: 3.34 | R90: 1.04 | S90: 96.41 | T90: 0.18899999999999997 | U90: 转股中 | V90: 4.19年 | W90: 2.19年 | X90: 0.155 | Y90: 0.14999999999999999 | Z90: 23 | AA90: 148 | AB90: 7.4000000000000003e-003 | AC90: -2.9999999999999997e-004 | AD90: -4.3099999999999999e-002 | AE90: -4.5700000000000005e-002 | AF90: 94.12 | AG90: 100.02 | AH90: 0.48 | AI90: AA+ | AJ90: 4.1399999999999999e-002 | AK90: =I90+100*T90 -> 133.5 | AL90: 132.8 | AM90: 123 | AN90: 32.8 | AO90: 33 | AP90: 0. | AQ90: 35 | AR90: 山鹰转债
A91: 21 | B91: 淳中转债 | C91: 113594 | D91: 44071. | E91: 淳中科技 | F91: 603516 | G91: 电子 | H91: 电子产品 | I91: 116.43 | J91: 4.6999999999999993e-003 | K91: -5.7999999999999996e-003 | L91: 34.38 | M91: -1.7000000000000001e-003 | N91: 2.1 | O91: 6.0000000000000001e-003 | P91: 121.4 | Q91: 39.37 | R91: 5.4 | S91: 87.33 | T91: 0.33299999999999996 | U91: 4月15天 | V91: 5.85年 | W91: 3.85年 | X91: 6.5000000000000002e-002 | Y91: 5.7000000000000002e-002 | Z91: 3 | AA91: 46 | AB91: 7.3000000000000001e-003 | AC91: 1.e-003 | AD91: -2.6699999999999998e-002 | AE91: -2.8799999999999999e-002 | AF91: 77.92 | AG91: 79.48 | AH91: 0.62 | AI91: A+ | AJ91: 7.690000000000001e-002 | AK91: =I91+100*T91 -> 149.73000000000002 | AL91: 145.5 | AM91: 231 | AN91: 66.1 | AO91: 258 | AP91: -0.13100000000000001 | AQ91: 3 | AR91: 淳中转债
A92: 37 | B92: 瑞达转债 | C92: 128116 | D92: 44036. | E92: 瑞达期货 | F92: 2961 | G92: 金融 | H92: 期货行业 | I92: 110.725 | J92: -1.9e-003 | K92: 1.2199999999999999e-002 | L92: 28.01 | M92: 1.8500000000000003e-002 | N92: 8.6 | O92: 1.2e-002 | P92: 115.3 | Q92: 29.82 | R92: 7.33 | S92: 93.93 | T92: 0.17899999999999999 | U92: 3月22天 | V92: 5.79年 | W92: 3.79年 | X92: 5.2000000000000005e-002 | Y92: 4.9000000000000002e-002 | Z92: 6.5 | AA92: 125 | AB92: 7.0999999999999995e-003 | AC92: 2.3999999999999998e-003 | AD92: -1.6500000000000001e-002 | AE92: -1.83e-002 | AF92: 87.31 | AG92: 89.83 | AH92: 0.55 | AI92: AA | AJ92: 4.4900000000000002e-002 | AK92: =I92+100*T92 -> 128.625 | AL92: 127.5 | AM92: 64 | AN92: 37.7 | AO92: 80 | AP92: -4.7e-002 | AQ92: 7 | AR92: 瑞达转债
A93: 26 | B93: 银信转债 | C93: 123059 | D93: 44055. | E93: 银信科技 | F93: 300231 | G93: 计算机及 | H93: 软件开发 | I93: 119.35 | J93: 1.5300000000000001e-002 | K93: 3.4000000000000002e-003 | L93: 10.53 | M93: 2.63e-002 | N93: 19 | O93: 4.0999999999999995e-002 | P93: 124.1 | Q93: 9.91 | R93: 3.68 | S93: 106.26 | T93: 0.12300000000000001 | U93: 4月9天 | V93: 5.83年 | W93: 3.83年 | X93: 8.4000000000000005e-002 | Y93: 8.900000000000001e-002 | Z93: 3.9 | AA93: 47 | AB93: 6.8000000000000005e-003 | AC93: -1.e-004 | AD93: -3.4099999999999998e-002 | AE93: -3.5900000000000001e-002 | AF93: 80.79 | AG93: 86.15 | AH93: 0.71 | AI93: AA- | AJ93: 6.59e-002 | AK93: =I93+100*T93 -> 131.65000000000001 | AL93: 132.4 | AM93: 119 | AN93: 46.3 | AO93: 164 | AP93: -5.2000000000000005e-002 | AQ93: 7 | AR93: 银信转债
A94: 196 | B94: 招路转债! | C94: 127012 | D94: 43585. | E94: 招商公路 | F94: 1965 | G94: 机场高速 | H94: 高速 | I94: 105.01 | J94: -3.0000000000000001e-003 | K94: 1.1999999999999999e-003 | L94: 7.05 | M94: -5.6000000000000008e-003 | N94: 2.7 | O94: 1.e-003 | P94: 108.2 | Q94: 8.81 | R94: 0.92 | S94: 80.02 | T94: 0.312 | U94: 转股中 | V94: 4.52年 | W94: 2.52年 | X94: 0.115 | Y94: 9.1999999999999998e-002 | Z94: 50 | AA94: 436 | AB94: 6.7000000000000002e-003 | AC94: 3.3e-003 | AD94: -1.1000000000000001e-002 | AE94: -1.24e-002 | AF94: 92.19 | AG94: 91.45 | AH94: 0.33 | AI94: AAA | AJ94: 3.8399999999999997e-002 | AK94: =I94+100*T94 -> 136.21000000000001 | AL94: 130 | AM94: 92 | AN94: 37.8 | AO94: 82 | AP94: -1.3000000000000001e-002 | AQ94: 36 | AR94: 招路转债!
A95: 150 | B95: 北方转债 | C95: 127014 | D95: 43790. | E95: 北方国际 | F95: 65 | G95: 建筑 | H95: 建筑工程 | I95: 112 | J95: -3.5999999999999999e-003 | K95: 1.0700000000000001e-002 | L95: 7.66 | M95: 1.5900000000000001e-002 | N95: 0.4 | O95: 1.e-003 | P95: 115.6 | Q95: 8.75 | R95: 1.18 | S95: 87.54 | T95: 0.27899999999999997 | U95: 转股中 | V95: 5年40天 | W95: 3年40天 | X95: 9.8000000000000004e-002 | Y95: 8.5999999999999993e-002 | Z95: 5.8 | AA95: 59 | AB95: 6.4000000000000003e-003 | AC95: 8.9999999999999998e-004 | AD95: -2.2400000000000003e-002 | AE95: -2.4700000000000003e-002 | AF95: 90.89 | AG95: 93.75 | AH95: 0.45 | AI95: AA+ | AJ95: 4.2900000000000001e-002 | AK95: =I95+100*T95 -> 139.90000000000001 | AL95: 136.5 | AM95: 156 | AN95: 42.7 | AO95: 139 | AP95: -5.2000000000000005e-002 | AQ95: 17 | AR95: 北方转债
A96: 142 | B96: 白电转债 | C96: 113549 | D96: 43810. | E96: 白云电器 | F96: 603861 | G96: 能源电力 | H96: 电力设备 | I96: 111.52 | J96: -3.0999999999999999e-003 | K96: 3.8e-003 | L96: 8.63 | M96: 1.1999999999999999e-003 | N96: 0.9 | O96: 1.e-003 | P96: 115.1 | Q96: 8.88 | R96: 1.69 | S96: 97.18 | T96: 0.14800000000000002 | U96: 转股中 | V96: 5.17年 | W96: 3.17年 | X96: 0.23100000000000001 | Y96: 0.22399999999999998 | Z96: 8.8 | AA96: 38 | AB96: 6.1999999999999998e-003 | AC96: 1.e-003 | AD96: -2.2000000000000002e-002 | AE96: -2.41e-002 | AF96: 89.61 | AG96: 92.13 | AH96: 0.58 | AI96: AA | AJ96: 4.4900000000000002e-002 | AK96: =I96+100*T96 -> 126.31999999999999 | AL96: 125.9 | AM96: 49 | AN96: 33.7 | AO96: 41 | AP96: -4.2999999999999997e-002 | AQ96: 32 | AR96: 白电转债
A97: 124 | B97: 东风转债 | C97: 113030 | D97: 43850. | E97: 东风股份 | F97: 601515 | G97: 造纸包装 | H97: 包装材料 | I97: 113.6 | J97: -1.1299999999999999e-002 | K97: 1.3000000000000001e-002 | L97: 6.33 | M97: 3.2000000000000002e-003 | N97: 0.9 | O97: 3.0000000000000001e-003 | P97: 117.3 | Q97: 6.75 | R97: 2.08 | S97: 93.78 | T97: 0.21100000000000002 | U97: 转股中 | V97: 5.28年 | W97: 3.28年 | X97: 3.5000000000000003e-002 | Y97: 3.3000000000000002e-002 | Z97: 3 | AA97: 84 | AB97: 6.1999999999999998e-003 | AC97: 4.0000000000000002e-004 | AD97: -2.6099999999999998e-002 | AE97: -2.8199999999999999e-002 | AF97: 89.38 | AG97: 93.47 | AH97: 0.53 | AI97: AA | AJ97: 4.4900000000000002e-002 | AK97: =I97+100*T97 -> 134.69999999999999 | AL97: 133.4 | AM97: 126 | AN97: 39.9 | AO97: 108 | AP97: -7.2999999999999995e-002 | AQ97: 15 | AR97: 东风转债
A98: 10 | B98: 大禹转债 | C98: 123063 | D98: 44063. | E98: 大禹节水 | F98: 300021 | G98: 化工 | H98: 橡胶塑料 | I98: 122.421 | J98: 6.8000000000000005e-003 | K98: 1.2800000000000001e-002 | L98: 6.04 | M98: 2.3700000000000002e-002 | N98: 102 | O98: 0.13 | P98: 126.5 | Q98: 4.94 | R98: 3.39 | S98: 122.27 | T98: 1.e-003 | U98: 4月22天 | V98: 5.87年 | W98: 4.87年 | X98: 0.13200000000000001 | Y98: 0.16200000000000001 | Z98: 6.4 | AA98: 48 | AB98: 5.6999999999999993e-003 | AC98: -1.7000000000000001e-003 | AD98: -2.6800000000000001e-002 | AE98: -2.9300000000000003e-002 | AF98: 78.01 | AG98: 87.64 | AH98: 0.82 | AI98: AA- | AJ98: 6.59e-002 | AK98: =I98+100*T98 -> 122.521 | AL98: 122.6 | AM98: 28 | AN98: 34.9 | AO98: 54 | AP98: 1.e-002 | AQ98: 10 | AR98: 大禹转债
A99: 27 | B99: 国城转债 | C99: 127019 | D99: 44053. | E99: 国城矿业 | F99: 688 | G99: 有色金属 | H99: 锌铅镍锡 | I99: 111.5 | J99: 5.4000000000000003e-003 | K99: -8.3999999999999995e-003 | L99: 22.05 | M99: -4.5000000000000005e-003 | N99: 10 | O99: 1.1000000000000001e-002 | P99: 115.1 | Q99: 21.07 | R99: 11.45 | S99: 104.65 | T99: 6.5000000000000002e-002 | U99: 4月9天 | V99: 5.83年 | W99: 3.83年 | X99: 3.4000000000000002e-002 | Y99: 3.5000000000000003e-002 | Z99: 8.5 | AA99: 251 | AB99: 5.6000000000000008e-003 | AC99: 8.9999999999999998e-004 | AD99: -1.83e-002 | AE99: -2.e-002 | AF99: 87.03 | AG99: 89.48 | AH99: 0.67 | AI99: AA | AJ99: 4.4900000000000002e-002 | AK99: =I99+100*T99 -> 118. | AL99: 118.3 | AM99: 9 | AN99: 28.9 | AO99: 18 | AP99: -1.9e-002 | AQ99: 14 | AR99: 国城转债
A100: 197 | B100: 岱勒转债! | C100: 123024 | D100: 43572. | E100: 岱勒新材 | F100: 300700 | G100: 机械装备 | H100: 专用设备 | I100: 110.9 | J100: 2.18e-002 | K100: 1.9900000000000001e-002 | L100: 21.11 | M100: 9.6099999999999991e-002 | N100: 71 | O100: 0.30599999999999999 | P100: 113 | Q100: 24.9 | R100: 3.54 | S100: 84.78 | T100: 0.308 | U100: 转股中 | V100: 3.52年 | W100: 1.52年 | X100: 0.121 | Y100: 0.10199999999999999 | Z100: 2.1 | AA100: 17 | AB100: 5.4000000000000003e-003 | AC100: -1.2999999999999999e-003 | AD100: -5.0099999999999999e-002 | AE100: -5.2000000000000005e-002 | AF100: 90.08 | AG100: 87.8 | AH100: 0.43 | AI100: A+ | AJ100: 7.5399999999999995e-002 | AK100: =I100+100*T100 -> 141.70000000000002 | AL100: 137 | AM100: 163 | AN100: 46.9 | AO100: 170 | AP100: 1.3999999999999999e-002 | AQ100: 32 | AR100: 岱勒转债!
A101: 258 | B101: 道氏转债!! | C101: 123007 | D101: 43126. | E101: 道氏技术 | F101: 300409 | G101: 建筑 | H101: 建筑行业 | I101: 109.437 | J101: 3.0999999999999999e-003 | K101: 1.5e-003 | L101: 12.49 | M101: 1.2199999999999999e-002 | N101: 3.7 | O101: 1.1000000000000001e-002 | P101: 111.3 | Q101: 14.95 | R101: 2.41 | S101: 83.55 | T101: 0.31 | U101: 转股中 | V101: 3.29年 | W101: 1.29年 | X101: 5.2999999999999999e-002 | Y101: 4.4000000000000004e-002 | Z101: 3 | AA101: 57 | AB101: 5.3e-003 | AC101: -1.1000000000000001e-003 | AD101: -4.2199999999999994e-002 | AE101: -4.58e-002 | AF101: 93.99 | AG101: 91.07 | AH101: 0.37 | AI101: AA- | AJ101: 6.4399999999999999e-002 | AK101: =I101+100*T101 -> 140.43700000000001 | AL101: 135.3 | AM101: 142 | AN101: 41.3 | AO101: 126 | AP101: -4.9000000000000002e-002 | AQ101: 15 | AR101: 道氏转债!!
A102: 181 | B102: 亚泰转债! | C102: 128066 | D102: 43599. | E102: 郑中设计 | F102: 2811 | G102: 建筑 | H102: 装饰工程 | I102: 114.749 | J102: 7.4999999999999997e-003 | K102: -9.5999999999999992e-003 | L102: 10.28 | M102: -2.8999999999999998e-003 | N102: 9.5 | O102: 1.7000000000000001e-002 | P102: 117.5 | Q102: 9.67 | R102: 1.9 | S102: 106.31 | T102: 7.9000000000000001e-002 | U102: 转股中 | V102: 4.59年 | W102: 2.59年 | X102: 0.17300000000000001 | Y102: 0.184 | Z102: 4.8 | AA102: 28 | AB102: 5.3e-003 | AC102: -1.5e-003 | AD102: -3.6000000000000004e-002 | AE102: -3.85e-002 | AF102: 87.61 | AG102: 88.82 | AH102: 0.73 | AI102: AA- | AJ102: 6.4399999999999999e-002 | AK102: =I102+100*T102 -> 122.649 | AL102: 123.2 | AM102: 34 | AN102: 34.4 | AO102: 48 | AP102: -4.8000000000000001e-002 | AQ102: 59 | AR102: 亚泰转债!
A103: 187 | B103: 鼎胜转债! | C103: 113534 | D103: 43585. | E103: 鼎胜新材 | F103: 603876 | G103: 有色金属 | H103: 小金属 | I103: 112.35 | J103: -5.6999999999999993e-003 | K103: 1.72e-002 | L103: 13.76 | M103: 2.46e-002 | N103: 39 | O103: 2.8999999999999998e-002 | P103: 114.9 | Q103: 15.18 | R103: 1.66 | S103: 90.65 | T103: 0.23899999999999999 | U103: 转股中 | V103: 4.57年 | W103: 2.57年 | X103: 0.20100000000000001 | Y103: 0.182 | Z103: 12 | AA103: 60 | AB103: 5.0000000000000001e-003 | AC103: -8.9999999999999998e-004 | AD103: -3.0200000000000001e-002 | AE103: -3.2500000000000001e-002 | AF103: 92.16 | AG103: 95 | AH103: 0.47 | AI103: AA | AJ103: 4.3400000000000001e-002 | AK103: =I103+100*T103 -> 136.25 | AL103: 134.1 | AM103: 132 | AN103: 39.1 | AO103: 101 | AP103: -0.10400000000000001 | AQ103: 31 | AR103: 鼎胜转债!
A104: 268 | B104: 特一转债! | C104: 128025 | D104: 43097. | E104: 特一药业 | F104: 2728 | G104: 医药 | H104: 化学制药 | I104: 108.293 | J104: 1.e-004 | K104: 9.1999999999999998e-003 | L104: 13.75 | M104: 1.7000000000000001e-002 | N104: 3.5 | O104: 1.1000000000000001e-002 | P104: 109.8 | Q104: 14.7 | R104: 2.77 | S104: 93.54 | T104: 0.158 | U104: 转股中 | V104: 3.23年 | W104: 1.23年 | X104: 0.107 | Y104: 0.10000000000000001 | Z104: 3 | AA104: 28 | AB104: 4.4000000000000003e-003 | AC104: -1.2999999999999999e-003 | AD104: -3.8699999999999998e-002 | AE104: -4.2000000000000003e-002 | AF104: 94.08 | AG104: 90.15 | AH104: 0.55 | AI104: AA- | AJ104: 6.4399999999999999e-002 | AK104: =I104+100*T104 -> 124.093 | AL104: 123 | AM104: 30 | AN104: 29 | AO104: 19 | AP104: -5.4000000000000006e-002 | AQ104: 42 | AR104: 特一转债!
A105: 136 | B105: 新北转债! | C105: 128083 | D105: 43830. | E105: 新北洋 | F105: 2376 | G105: 电子 | H105: 电子产品 | I105: 113 | J105: 0. | K105: 8.9999999999999998e-004 | L105: 10.06 | M105: 2.e-003 | N105: 5.6 | O105: 6.0000000000000001e-003 | P105: 115.2 | Q105: 11.7 | R105: 2.02 | S105: 85.98 | T105: 0.314 | U105: 转股中 | V105: 5.24年 | W105: 3.24年 | X105: 0.13100000000000001 | Y105: 0.113 | Z105: 8.8 | AA105: 67 | AB105: 3.8e-003 | AC105: -1.4000000000000002e-003 | AD105: -2.5099999999999997e-002 | AE105: -2.7099999999999999e-002 | AF105: 89.41 | AG105: 91.92 | AH105: 0.45 | AI105: AA | AJ105: 4.4900000000000002e-002 | AK105: =I105+100*T105 -> 144.40000000000001 | AL105: 140 | AM105: 187 | AN105: 48.1 | AO105: 177 | AP105: -6.4000000000000001e-002 | AQ105: 17 | AR105: 新北转债!
A106: 30 | B106: 湖盐转债 | C106: 110071 | D106: 44043. | E106: 湖南盐业 | F106: 600929 | G106: 食品饮料 | H106: 食品饮料 | I106: 113.15 | J106: -3.3e-003 | K106: 1.4000000000000002e-003 | L106: 6.48 | M106: -3.0999999999999999e-003 | N106: 6.1 | O106: 6.9999999999999993e-003 | P106: 115.2 | Q106: 6.6 | R106: 2.35 | S106: 98.18 | T106: 0.152 | U106: 4月6天 | V106: 5.82年 | W106: 3.82年 | X106: 0.121 | Y106: 0.11900000000000001 | Z106: 7.2 | AA106: 59 | AB106: 3.0999999999999999e-003 | AC106: -1.5e-003 | AD106: -2.18e-002 | AE106: -2.35e-002 | AF106: 87.17 | AG106: 89.63 | AH106: 0.62 | AI106: AA | AJ106: 4.4900000000000002e-002 | AK106: =I106+100*T106 -> 128.34999999999999 | AL106: 128.1 | AM106: 67 | AN106: 38.5 | AO106: 92 | AP106: -7.6999999999999999e-002 | AQ106: 9 | AR106: 湖盐转债
A107: 22 | B107: 中金转债 | C107: 127020 | D107: 44057. | E107: 中金岭南 | F107: 60 | G107: 有色金属 | H107: 有色行业 | I107: 111.8 | J107: -1.8e-003 | K107: -4.3e-003 | L107: 4.37 | M107: -1.1299999999999999e-002 | N107: 19 | O107: 5.0000000000000001e-003 | P107: 113.7 | Q107: 4.71 | R107: 1.41 | S107: 92.78 | T107: 0.20499999999999999 | U107: 4月13天 | V107: 5.85年 | W107: 3.85年 | X107: 0.24399999999999999 | Y107: 0.22600000000000001 | Z107: 38 | AA107: 156 | AB107: 2.8999999999999998e-003 | AC107: -1.2999999999999999e-003 | AD107: -2.1600000000000001e-002 | AE107: -2.2799999999999997e-002 | AF107: 86.63 | AG107: 89.2 | AH107: 0.54 | AI107: AA+ | AJ107: 4.2900000000000001e-002 | AK107: =I107+100*T107 -> 132.30000000000001 | AL107: 130.8 | AM107: 96 | AN107: 41.6 | AO107: 129 | AP107: -3.1e-002 | AQ107: 10 | AR107: 中金转债
A108: 126 | B108: 永创转债! | C108: 113559 | D108: 43840. | E108: 永创智能 | F108: 603901 | G108: 机械装备 | H108: 专用设备 | I108: 117.2 | J108: 8.9999999999999998e-004 | K108: 1.1200000000000002e-002 | L108: 10.08 | M108: 1.8200000000000001e-002 | N108: 5.6 | O108: 9.0000000000000011e-003 | P108: 118.9 | Q108: 10.32 | R108: 3.24 | S108: 97.67 | T108: 0.20000000000000001 | U108: 转股中 | V108: 5.27年 | W108: 3.27年 | X108: 0.115 | Y108: 0.11199999999999999 | Z108: 5.1 | AA108: 44 | AB108: 2.8000000000000004e-003 | AC108: -3.4999999999999996e-003 | AD108: -3.1899999999999998e-002 | AE108: -3.4599999999999999e-002 | AF108: 84.59 | AG108: 85.72 | AH108: 0.66 | AI108: AA- | AJ108: 6.59e-002 | AK108: =I108+100*T108 -> 137.19999999999999 | AL108: 136.7 | AM108: 159 | AN108: 51 | AO108: 196 | AP108: -8.6999999999999994e-002 | AQ108: 24 | AR108: 永创转债!
A109: 12 | B109: 城地转债 | C109: 113596 | D109: 44063. | E109: 城地股份 | F109: 603887 | G109: 通信互联 | H109: 通信设备 | I109: 112.01 | J109: -1.1000000000000001e-003 | K109: 1.1299999999999999e-002 | L109: 24.4 | M109: 1.7899999999999999e-002 | N109: 11 | O109: 8.0000000000000002e-003 | P109: 113.5 | Q109: 29.21 | R109: 2.63 | S109: 83.53 | T109: 0.34100000000000003 | U109: 4月23天 | V109: 5.87年 | W109: 3.87年 | X109: 0.13100000000000001 | Y109: 0.109 | Z109: 12 | AA109: 92 | AB109: 2.3e-003 | AC109: -1.9e-003 | AD109: -1.8799999999999997e-002 | AE109: -2.0499999999999997e-002 | AF109: 80.45 | AG109: 78.63 | AH109: 0.57 | AI109: AA- | AJ109: 6.59e-002 | AK109: =I109+100*T109 -> 146.11000000000001 | AL109: 140.5 | AM109: 192 | AN109: 60 | AO109: 241 | AP109: -0.14699999999999999 | AQ109: 7 | AR109: 城地转债
A110: 16 | B110: 兴森转债 | C110: 128122 | D110: 44060. | E110: 兴森科技 | F110: 2436 | G110: 电子 | H110: 元器件制 | I110: 112.256 | J110: -4.0000000000000001e-003 | K110: 1.04e-002 | L110: 11.2 | M110: 1.9099999999999999e-002 | N110: 8.9 | O110: 2.9999999999999999e-002 | P110: 113.3 | Q110: 14.18 | R110: 5.39 | S110: 78.98 | T110: 0.42100000000000004 | U110: 4月17天 | V110: 4.86年 | W110: 3.86年 | X110: 1.6e-002 | Y110: 1.3000000000000001e-002 | Z110: 2.7 | AA110: 167 | AB110: 1.9e-003 | AC110: -3.0000000000000001e-003 | AD110: -1.9799999999999998e-002 | AE110: -2.1499999999999998e-002 | AF110: 87.47 | AG110: 92.39 | AH110: 0.34 | AI110: AA | AJ110: 4.3400000000000001e-002 | AK110: =I110+100*T110 -> 154.35599999999999 | AL110: 145.5 | AM110: 230 | AN110: 53.1 | AO110: 212 | AP110: -9.5000000000000001e-002 | AQ110: 3 | AR110: 兴森转债
A111: 18 | B111: 航新转债 | C111: 123061 | D111: 44061. | E111: 航新科技 | F111: 300424 | G111: 航空航天 | H111: 航空航天 | I111: 123.495 | J111: 1.2999999999999999e-003 | K111: -6.3e-003 | L111: 16.14 | M111: -6.8000000000000005e-003 | N111: 7.1 | O111: 2.3e-002 | P111: 124.8 | Q111: 14.86 | R111: 3.6 | S111: 108.61 | T111: 0.13699999999999998 | U111: 4月16天 | V111: 5.85年 | W111: 3.85年 | X111: 6.5000000000000002e-002 | Y111: 7.0000000000000007e-002 | Z111: 2.5 | AA111: 39 | AB111: 1.8e-003 | AC111: -5.1999999999999998e-003 | AD111: -4.0599999999999997e-002 | AE111: -4.2699999999999995e-002 | AF111: 81.27 | AG111: 86.63 | AH111: 0.74 | AI111: AA- | AJ111: 6.59e-002 | AK111: =I111+100*T111 -> 137.19499999999999 | AL111: 138.4 | AM111: 172 | AN111: 51.7 | AO111: 202 | AP111: -6.4000000000000001e-002 | AQ111: 5 | AR111: 航新转债
A112: 86 | B112: 龙净转债! | C112: 110068 | D112: 43936. | E112: 龙净环保 | F112: 600388 | G112: 城市公用 | H112: 三废处理 | I112: 113.93 | J112: -4.6999999999999993e-003 | K112: 7.4000000000000003e-003 | L112: 9.96 | M112: 5.0000000000000001e-003 | N112: 16 | O112: 6.9999999999999993e-003 | P112: 115 | Q112: 10.73 | R112: 1.97 | S112: 92.82 | T112: 0.22699999999999998 | U112: 16天 | V112: 5.52年 | W112: 3.52年 | X112: 0.188 | Y112: 0.17399999999999999 | Z112: 20 | AA112: 106 | AB112: 1.7000000000000001e-003 | AC112: -3.0999999999999999e-003 | AD112: -2.5899999999999999e-002 | AE112: -2.76e-002 | AF112: 88.74 | AG112: 91.56 | AH112: 0.53 | AI112: AA+ | AJ112: 4.2900000000000001e-002 | AK112: =I112+100*T112 -> 136.63 | AL112: 135 | AM112: 141 | AN112: 43.5 | AO112: 145 | AP112: -5.5999999999999994e-002 | AQ112: 29 | AR112: 龙净转债!
A113: 199 | B113: 亨通转债! | C113: 110056 | D113: 43571. | E113: 亨通光电 | F113: 600487 | G113: 通信互联 | H113: 通信设备 | I113: 114 | J113: -1.21e-002 | K113: 9.300000000000001e-003 | L113: 14.91 | M113: -5.3e-003 | N113: 25 | O113: 1.3000000000000001e-002 | P113: 114.8 | Q113: 15.58 | R113: 2 | S113: 95.7 | T113: 0.191 | U113: 转股中 | V113: 4.51年 | W113: 2.51年 | X113: 5.9000000000000004e-002 | Y113: 5.5999999999999994e-002 | Z113: 17 | AA113: 291 | AB113: 1.6000000000000001e-003 | AC113: -4.3e-003 | AD113: -3.6499999999999998e-002 | AE113: -3.8699999999999998e-002 | AF113: 92.76 | AG113: 95.94 | AH113: 0.52 | AI113: AA+ | AJ113: 4.1399999999999999e-002 | AK113: =I113+100*T113 -> 133.09999999999999 | AL113: 132.3 | AM113: 115 | AN113: 36.4 | AO113: 66 | AP113: -8.5000000000000006e-002 | AQ113: 29 | AR113: 亨通转债!
A114: 135 | B114: 鹰19转债 | C114: 110063 | D114: 43833. | E114: 山鹰纸业 | F114: 600567 | G114: 造纸包装 | H114: 包装用纸 | I114: 115.8 | J114: -1.8e-003 | K114: 3.5999999999999999e-003 | L114: 3.22 | M114: 3.0999999999999999e-003 | N114: 2.5 | O114: 1.e-003 | P114: 116.2 | Q114: 3.3 | R114: 1.04 | S114: 97.58 | T114: 0.187 | U114: 转股中 | V114: 5.25年 | W114: 3.25年 | X114: 0.126 | Y114: 0.12300000000000001 | Z114: 19 | AA114: 148 | AB114: 7.000000000000001e-004 | AC114: -4.7999999999999996e-003 | AD114: -3.2599999999999997e-002 | AE114: -3.4500000000000003e-002 | AF114: 89.83 | AG114: 93.6 | AH114: 0.56 | AI114: AA+ | AJ114: 4.2900000000000001e-002 | AK114: =I114+100*T114 -> 134.5 | AL114: 134 | AM114: 131 | AN114: 40.4 | AO114: 116 | AP114: 0. | AQ114: 41 | AR114: 鹰19转债
A115: 72 | B115: 维尔转债 | C115: 123049 | D115: 43963. | E115: 维尔利 | F115: 300190 | G115: 城市公用 | H115: 三废处理 | I115: 124.5 | J115: 3.2000000000000002e-003 | K115: 1.4999999999999999e-002 | L115: 8.96 | M115: 2.2799999999999997e-002 | N115: 17 | O115: 1.4999999999999999e-002 | P115: 124.8 | Q115: 7.48 | R115: 1.71 | S115: 119.79 | T115: 3.9e-002 | U115: 35天 | V115: 5.58年 | W115: 3.58年 | X115: 0.13100000000000001 | Y115: 0.156 | Z115: 9.2 | AA115: 70 | AB115: 4.0000000000000002e-004 | AC115: -6.8999999999999999e-003 | AD115: -4.5700000000000005e-002 | AE115: -4.7899999999999998e-002 | AF115: 82.71 | AG115: 88.16 | AH115: 0.8 | AI115: AA- | AJ115: 6.59e-002 | AK115: =I115+100*T115 -> 128.40000000000001 | AL115: 129.2 | AM115: 82 | AN115: 41.1 | AO115: 121 | AP115: -5.7000000000000002e-002 | AQ115: 11 | AR115: 维尔转债
A116: 266 | B116: 铁汉转债! | C116: 123004 | D116: 43126. | E116: 铁汉生态 | F116: 300197 | G116: 城市公用 | H116: 生态环境 | I116: 109.698 | J116: 2.6699999999999998e-002 | K116: 9.4999999999999998e-003 | L116: 3.65 | M116: 7.9899999999999999e-002 | N116: 290 | O116: 0.33299999999999996 | P116: 109.8 | Q116: 3.98 | R116: 1.64 | S116: 91.71 | T116: 0.19600000000000001 | U116: 转股中 | V116: 3.26年 | W116: 1.26年 | X116: 9.4e-002 | Y116: 8.5999999999999993e-002 | Z116: 8 | AA116: 86 | AB116: 2.9999999999999997e-004 | AC116: -5.3e-003 | AD116: -4.6500000000000007e-002 | AE116: -4.9800000000000004e-002 | AF116: 96.57 | AG116: 95.87 | AH116: 0.45 | AI116: AA | AJ116: 4.3400000000000001e-002 | AK116: =I116+100*T116 -> 129.298 | AL116: 127.7 | AM116: 65 | AN116: 31.1 | AO116: 27 | AP116: 5.9000000000000004e-002 | AQ116: 35 | AR116: 铁汉转债!
A117: 35 | B117: 美联转债 | C117: 123057 | D117: 44039. | E117: 美联新材 | F117: 300586 | G117: 化工 | H117: 橡胶塑料 | I117: 117.998 | J117: -2.7000000000000001e-003 | K117: 1.52e-002 | L117: 10.09 | M117: 1.7100000000000001e-002 | N117: 14 | O117: 5.9000000000000004e-002 | P117: 118.2 | Q117: 9.91 | R117: 6.3 | S117: 101.82 | T117: 0.159 | U117: 3月25天 | V117: 5.80年 | W117: 3.80年 | X117: 4.4999999999999998e-002 | Y117: 4.5999999999999999e-002 | Z117: 2.1 | AA117: 46 | AB117: 2.9999999999999997e-004 | AC117: -5.1999999999999998e-003 | AD117: -3.1400000000000004e-002 | AE117: -3.3300000000000003e-002 | AF117: 81.07 | AG117: 82.31 | AH117: 0.73 | AI117: AA- | AJ117: 6.59e-002 | AK117: =I117+100*T117 -> 133.898 | AL117: 134.2 | AM117: 134 | AN117: 51.9 | AO117: 205 | AP117: -5.9000000000000004e-002 | AQ117: 5 | AR117: 美联转债
A118: 255 | B118: 大族转债! | C118: 128035 | D118: 43164. | E118: 大族激光 | F118: 2008 | G118: 机械装备 | H118: 专用设备 | I118: 108.1 | J118: -3.7000000000000002e-003 | K118: 4.4000000000000003e-003 | L118: 34.34 | M118: 1.9e-002 | N118: 28 | O118: 1.1000000000000001e-002 | P118: 108 | Q118: 52.1 | R118: 4.09 | S118: 65.91 | T118: 0.64000000000000001 | U118: 转股中 | V118: 3.40年 | W118: 1.40年 | X118: 6.3e-002 | Y118: 4.0999999999999995e-002 | Z118: 23 | AA118: 366 | AB118: -2.9999999999999997e-004 | AC118: -4.6999999999999993e-003 | AD118: -2.2099999999999998e-002 | AE118: -2.7400000000000001e-002 | AF118: 98.01 | AG118: 94.28 | AH118: 0.04 | AI118: AA+ | AJ118: 4.1399999999999999e-002 | AK118: =I118+100*T118 -> 172.09999999999999 | AL118: 150.3 | AM118: 243 | AN118: 52.3 | AO118: 207 | AP118: -7.400000000000001e-002 | AQ118: 19 | AR118: 大族转债!
A119: 13 | B119: 三超转债 | C119: 123062 | D119: 44060. | E119: 三超新材 | F119: 300554 | G119: 机械装备 | H119: 通用设备 | I119: 119.9 | J119: 1.9599999999999999e-002 | K119: 3.7100000000000001e-002 | L119: 20.63 | M119: 6.4000000000000001e-002 | N119: 142 | O119: 0.61499999999999999 | P119: 119.7 | Q119: 17.17 | R119: 3.78 | S119: 120.15 | T119: -2.e-003 | U119: 4月20天 | V119: 5.87年 | W119: 3.87年 | X119: 0.10099999999999999 | Y119: 0.121 | Z119: 2 | AA119: 19 | AB119: -2.9999999999999997e-004 | AC119: -6.0999999999999995e-003 | AD119: -3.3599999999999998e-002 | AE119: -3.56e-002 | AF119: 75.04 | AG119: 74.26 | AH119: 0.89 | AI119: A | AJ119: 8.6899999999999991e-002 | AK119: =I119+100*T119 -> 119.7 | AL119: 119.6 | AM119: 13 | AN119: 44.6 | AO119: 153 | AP119: -4.4999999999999998e-002 | AQ119: 7 | AR119: 三超转债
A120: 284 | B120: 骆驼转债! | C120: 113012 | D120: 42934. | E120: 骆驼股份 | F120: 601311 | G120: 汽车 | H120: 零部件制 | I120: 107.96 | J120: 2.3999999999999998e-003 | K120: -1.1999999999999999e-003 | L120: 7.75 | M120: 7.8000000000000005e-003 | N120: 3.6 | O120: 6.9999999999999993e-003 | P120: 107.8 | Q120: 10.06 | R120: 1 | S120: 77.04 | T120: 0.40100000000000002 | U120: 转股中 | V120: 2.52年 | W120: 0.52年 | X120: 5.9000000000000004e-002 | Y120: 4.4999999999999998e-002 | Z120: 5.1 | AA120: 87 | AB120: -5.9999999999999995e-004 | AC120: -6.4000000000000003e-003 | AD120: -8.5000000000000006e-002 | AE120: -8.900000000000001e-002 | AF120: 98.71 | AG120: 97.3 | AH120: 0.15 | AI120: AA | AJ120: 4.2099999999999999e-002 | AK120: =I120+100*T120 -> 148.06 | AL120: 138.9 | AM120: 176 | AN120: 40.2 | AO120: 113 | AP120: -5.0000000000000003e-002 | AQ120: 16 | AR120: 骆驼转债!
A121: 243 | B121: 湖广转债! | C121: 127007 | D121: 43313. | E121: 湖北广电 | F121: 665 | G121: 传媒娱乐 | H121: 影视娱乐 | I121: 112.6 | J121: 9.0000000000000011e-003 | K121: -6.1999999999999998e-003 | L121: 5.24 | M121: 5.7999999999999996e-003 | N121: 3 | O121: 2.e-003 | P121: 112.3 | Q121: 5.58 | R121: 0.78 | S121: 93.91 | T121: 0.19899999999999998 | U121: 转股中 | V121: 3.79年 | W121: 1.79年 | X121: 0.23600000000000002 | Y121: 0.222 | Z121: 12 | AA121: 51 | AB121: -7.000000000000001e-004 | AC121: -6.6e-003 | AD121: -4.58e-002 | AE121: -4.8499999999999995e-002 | AF121: 95.02 | AG121: 96.58 | AH121: 0.49 | AI121: AA+ | AJ121: 4.1399999999999999e-002 | AK121: =I121+100*T121 -> 132.5 | AL121: 131.3 | AM121: 101 | AN121: 34.7 | AO121: 52 | AP121: -5.0000000000000003e-002 | AQ121: 18 | AR121: 湖广转债!
A122: 5 | B122: 嘉友转债 | C122: 113599 | D122: 44081. | E122: 嘉友国际 | F122: 603871 | G122: 交通运输 | H122: 物流业 | I122: 126.52 | J122: -4.0000000000000002e-004 | K122: -2.3e-003 | L122: 31.1 | M122: -3.2000000000000002e-003 | N122: 38 | O122: 4.2000000000000003e-002 | P122: 126 | Q122: 24.82 | R122: 3.66 | S122: 125.3 | T122: 1.e-002 | U122: 5月7天 | V122: 5.89年 | W122: 3.89年 | X122: 0.105 | Y122: 0.13200000000000001 | Z122: 7.2 | AA122: 68 | AB122: -7.000000000000001e-004 | AC122: -7.9000000000000008e-003 | AD122: -4.7699999999999992e-002 | AE122: -4.9400000000000006e-002 | AF122: 80.4 | AG122: 87.12 | AH122: 0.83 | AI122: AA- | AJ122: 6.59e-002 | AK122: =I122+100*T122 -> 127.52 | AL122: 127.7 | AM122: 66 | AN122: 40.6 | AO122: 119 | AP122: 1.4999999999999999e-002 | AQ122: 3 | AR122: 嘉友转债
A123: 251 | B123: 敖东转债! | C123: 127006 | D123: 43231. | E123: 吉林敖东 | F123: 623 | G123: 金融 | H123: 证券行业 | I123: 108.301 | J123: -2.8000000000000004e-003 | K123: 5.6999999999999993e-003 | L123: 17.31 | M123: 8.199999999999999e-003 | N123: 5.8 | O123: 2.e-003 | P123: 108 | Q123: 20.42 | R123: 0.9 | S123: 84.77 | T123: 0.27800000000000002 | U123: 转股中 | V123: 3.49年 | W123: 1.49年 | X123: 0.12 | Y123: 0.10099999999999999 | Z123: 24 | AA123: 201 | AB123: -8.0000000000000004e-004 | AC123: -5.1000000000000004e-003 | AD123: -3.7499999999999999e-002 | AE123: -3.9399999999999998e-002 | AF123: 95.08 | AG123: 93.9 | AH123: 0.36 | AI123: AA+ | AJ123: 4.1399999999999999e-002 | AK123: =I123+100*T123 -> 136.101 | AL123: 131.8 | AM123: 107 | AN123: 36.8 | AO123: 70 | AP123: 1.e-003 | AQ123: 26 | AR123: 敖东转债!
A124: 189 | B124: 司尔转债! | C124: 128064 | D124: 43592. | E124: 司尔特 | F124: 2538 | G124: 化工 | H124: 农化 | I124: 115.951 | J124: 4.7999999999999996e-003 | K124: 8.0000000000000002e-003 | L124: 6.79 | M124: 1.8000000000000002e-002 | N124: 9.8 | O124: 1.1000000000000001e-002 | P124: 114.9 | Q124: 6.07 | R124: 1.3 | S124: 111.86 | T124: 3.7000000000000005e-002 | U124: 转股中 | V124: 4.57年 | W124: 2.57年 | X124: 0.16399999999999998 | Y124: 0.184 | Z124: 8 | AA124: 49 | AB124: -2.e-003 | AC124: -7.8000000000000005e-003 | AD124: -4.1399999999999999e-002 | AE124: -4.3700000000000003e-002 | AF124: 92.17 | AG124: 95.01 | AH124: 0.71 | AI124: AA | AJ124: 4.3400000000000001e-002 | AK124: =I124+100*T124 -> 119.651 | AL124: 120 | AM124: 15 | AN124: 25 | AO124: 11 | AP124: 1.1000000000000001e-002 | AQ124: 56 | AR124: 司尔转债!
A125: 55 | B125: 飞鹿转债 | C125: 123052 | D125: 44015. | E125: 飞鹿股份 | F125: 300665 | G125: 化工 | H125: 化工 | I125: 128.775 | J125: 0. | K125: 0. | L125: 12.5 | M125: 0. | N125: 0 | O125: 0. | P125: 127.3 | Q125: 9.9 | R125: 3.32 | S125: 126.26 | T125: 2.e-002 | U125: 2月28天 | V125: 5.72年 | W125: 3.72年 | X125: 0.11599999999999999 | Y125: 0.14699999999999999 | Z125: 1.8 | AA125: 15 | AB125: -2.0999999999999999e-003 | AC125: -9.7999999999999997e-003 | AD125: -5.1200000000000002e-002 | AE125: -5.3499999999999999e-002 | AF125: 79.17 | AG125: 84.19 | AH125: 0.85 | AI125: A+ | AJ125: 7.690000000000001e-002 | AK125: =I125+100*T125 -> 130.77500000000001 | AL125: 131.3 | AM125: 100 | AN125: 47.1 | AO125: 171 | AP125: 9.1999999999999998e-002 | AQ125: 8 | AR125: 飞鹿转债
A126: 11 | B126: 科华转债 | C126: 128124 | D126: 44063. | E126: 科华生物 | F126: 2022 | G126: 医药 | H126: 生物制药 | I126: 112.021 | J126: 9.1999999999999998e-003 | K126: 9.300000000000001e-003 | L126: 18.06 | M126: 3.7900000000000003e-002 | N126: 13 | O126: 1.6e-002 | P126: 110.3 | Q126: 21.5 | R126: 3.63 | S126: 84 | T126: 0.33399999999999996 | U126: 4月22天 | V126: 5.87年 | W126: 3.87年 | X126: 7.9000000000000001e-002 | Y126: 6.7000000000000004e-002 | Z126: 7.4 | AA126: 93 | AB126: -2.7000000000000001e-003 | AC126: -5.8999999999999999e-003 | AD126: -2.06e-002 | AE126: -2.2000000000000002e-002 | AF126: 86.42 | AG126: 85.58 | AH126: 0.49 | AI126: AA | AJ126: 4.4900000000000002e-002 | AK126: =I126+100*T126 -> 145.42099999999999 | AL126: 140 | AM126: 188 | AN126: 53.6 | AO126: 215 | AP126: -9.9000000000000005e-002 | AQ126: 8 | AR126: 科华转债
A127: 77 | B127: 滨化转债 | C127: 113034 | D127: 43951. | E127: 滨化股份 | F127: 601678 | G127: 化工 | H127: 化工 | I127: 116.88 | J127: -7.000000000000001e-004 | K127: 9.1000000000000004e-003 | L127: 5.18 | M127: 1.1699999999999999e-002 | N127: 9 | O127: 3.0000000000000001e-003 | P127: 115.1 | Q127: 4.68 | R127: 1.33 | S127: 110.68 | T127: 5.5999999999999994e-002 | U127: 32天 | V127: 5.57年 | W127: 3.57年 | X127: 0.29999999999999999 | Y127: 0.33200000000000002 | Z127: 24 | AA127: 80 | AB127: -2.8000000000000004e-003 | AC127: -7.6e-003 | AD127: -3.2000000000000001e-002 | AE127: -3.3799999999999997e-002 | AF127: 88.04 | AG127: 90.52 | AH127: 0.71 | AI127: AA | AJ127: 4.4900000000000002e-002 | AK127: =I127+100*T127 -> 122.47999999999999 | AL127: 123.1 | AM127: 31 | AN127: 32.6 | AO127: 31 | AP127: 1.1000000000000001e-002 | AQ127: 28 | AR127: 滨化转债
A128: 289 | B128: 广汽转债!! | C128: 113009 | D128: 42404. | E128: 广汽集团 | F128: 601238 | G128: 汽车 | H128: 乘用车 | I128: 107.99 | J128: 5.0000000000000001e-004 | K128: -5.9999999999999995e-004 | L128: 10.14 | M128: -8.8000000000000005e-003 | N128: 3.2 | O128: 1.e-003 | P128: 107.5 | Q128: 14.26 | R128: 1.29 | S128: 71.11 | T128: 0.51900000000000002 | U128: 转股中 | V128: 1.36年 | W128: 回售中 | X128: 2.5000000000000001e-002 | Y128: 1.7000000000000001e-002 | Z128: 25 | AA128: 1038. | AB128: -3.4000000000000002e-003 | AC128: -1.37e-002 | AD128: 回售中 | AE128: 回售中 | AF128: 100.25 | AG128: 102.37 | AH128: 0.02 | AI128: AAA | AJ128: 3.7100000000000001e-002 | AK128: =I128+100*T128 -> 159.88999999999999 | AL128: 144.9 | AM128: 224 | AN128: 42.5 | AO128: 138 | AP128: -2.6000000000000002e-002 | AQ128: 15 | AR128: 广汽转债!!
A129: 90 | B129: 联创转债! | C129: 128101 | D129: 43934. | E129: 联创电子 | F129: 2036 | G129: 电子 | H129: 液晶显示 | I129: 117.288 | J129: 2.5000000000000001e-003 | K129: 4.0999999999999995e-003 | L129: 11.36 | M129: 1.7899999999999999e-002 | N129: 4.7 | O129: 1.3000000000000001e-002 | P129: 115.1 | Q129: 14.48 | R129: 4.23 | S129: 78.45 | T129: 0.495 | U129: 7天 | V129: 5.50年 | W129: 3.50年 | X129: 2.7999999999999997e-002 | Y129: 2.2000000000000002e-002 | Z129: 3 | AA129: 106 | AB129: -3.4999999999999996e-003 | AC129: -8.3000000000000001e-003 | AD129: -3.3500000000000002e-002 | AE129: -3.5299999999999998e-002 | AF129: 88.3 | AG129: 90.79 | AH129: 0.37 | AI129: AA | AJ129: 4.4900000000000002e-002 | AK129: =I129+100*T129 -> 166.78800000000001 | AL129: 156.1 | AM129: 259 | AN129: 65.3 | AO129: 255 | AP129: -6.8000000000000005e-002 | AQ129: 14 | AR129: 联创转债!
A130: 162 | B130: 哈尔转债! | C130: 128073 | D130: 43719. | E130: 哈尔斯 | F130: 2615 | G130: 其他 | H130: 家居用品 | I130: 117.1 | J130: 1.43e-002 | K130: 2.5399999999999999e-002 | L130: 6.46 | M130: 5.21e-002 | N130: 55 | O130: 0.157 | P130: 115.3 | Q130: 5.72 | R130: 3.43 | S130: 112.94 | T130: 3.7000000000000005e-002 | U130: 转股中 | V130: 3.94年 | W130: 1.94年 | X130: 0.113 | Y130: 0.127 | Z130: 3 | AA130: 27 | AB130: -4.0000000000000001e-003 | AC130: -1.0800000000000001e-002 | AD130: -6.3600000000000004e-002 | AE130: -6.5299999999999997e-002 | AF130: 89.55 | AG130: 90.47 | AH130: 0.76 | AI130: AA- | AJ130: 6.4399999999999999e-002 | AK130: =I130+100*T130 -> 120.8 | AL130: 121.3 | AM130: 18 | AN130: 30.8 | AO130: 25 | AP130: 3.3000000000000002e-002 | AQ130: 38 | AR130: 哈尔转债!
A131: 46 | B131: 比音转债 | C131: 128113 | D131: 44027. | E131: 比音勒芬 | F131: 2832 | G131: 服装纺织 | H131: 服装行业 | I131: 119.996 | J131: -2.8000000000000004e-003 | K131: 3.0899999999999997e-002 | L131: 15.3 | M131: 4.3700000000000003e-002 | N131: 18 | O131: 2.2000000000000002e-002 | P131: 117.3 | Q131: 14.9 | R131: 4.08 | S131: 102.68 | T131: 0.16899999999999998 | U131: 3月8天 | V131: 5.75年 | W131: 3.75年 | X131: 8.5999999999999993e-002 | Y131: 8.8000000000000009e-002 | Z131: 6.9 | AA131: 80 | AB131: -4.0000000000000001e-003 | AC131: -9.1999999999999998e-003 | AD131: -3.6600000000000001e-002 | AE131: -3.8399999999999997e-002 | AF131: 87.53 | AG131: 91.55 | AH131: 0.64 | AI131: AA | AJ131: 4.4900000000000002e-002 | AK131: =I131+100*T131 -> 136.89599999999999 | AL131: 137.3 | AM131: 167 | AN131: 45.8 | AO131: 160 | AP131: -5.0000000000000003e-002 | AQ131: 4 | AR131: 比音转债
A132: 257 | B132: 江银转债! | C132: 128034 | D132: 43145. | E132: 江阴银行 | F132: 2807 | G132: 金融 | H132: 银行行业 | I132: 110.599 | J132: 8.9999999999999998e-004 | K132: -3.2000000000000002e-003 | L132: 4.16 | M132: -4.7999999999999996e-003 | N132: 2 | O132: 1.e-003 | P132: 109.1 | Q132: 4.5 | R132: 0.8 | S132: 92.44 | T132: 0.19600000000000001 | U132: 转股中 | V132: 3.37年 | W132: 无权 | X132: 0.19500000000000001 | Y132: 0.17999999999999999 | Z132: 18 | AA132: 90 | AB132: -4.0999999999999995e-003 | AC132: -9.1000000000000004e-003 | AD132: 无权 | AE132: 无权 | AF132: 无权 | AG132: 95.38 | AH132: 0.47 | AI132: AA+ | AJ132: 4.1399999999999999e-002 | AK132: =I132+100*T132 -> 130.19900000000001 | AL132: 128.8 | AM132: 72 | AN132: 33.4 | AO132: 38 | AP132: -3.3000000000000002e-002 | AQ132: 29 | AR132: 江银转债!
A133: 221 | B133: 华源转债! | C133: 128049 | D133: 43454. | E133: 华源控股 | F133: 2787 | G133: 造纸包装 | H133: 包装材料 | I133: 117.196 | J133: -4.6999999999999993e-003 | K133: -9.4999999999999998e-003 | L133: 8.22 | M133: -1.9099999999999999e-002 | N133: 8.2 | O133: 1.9e-002 | P133: 115.2 | Q133: 7.42 | R133: 1.78 | S133: 110.78 | T133: 5.7999999999999996e-002 | U133: 转股中 | V133: 4.20年 | W133: 2.20年 | X133: 0.14199999999999999 | Y133: 0.157 | Z133: 3.6 | AA133: 26 | AB133: -4.1999999999999997e-003 | AC133: -1.06e-002 | AD133: -5.1500000000000004e-002 | AE133: -5.4199999999999998e-002 | AF133: 89.46 | AG133: 89.16 | AH133: 0.74 | AI133: AA- | AJ133: 6.4399999999999999e-002 | AK133: =I133+100*T133 -> 122.996 | AL133: 123.6 | AM133: 37 | AN133: 34.1 | AO133: 44 | AP133: -4.9000000000000002e-002 | AQ133: 55 | AR133: 华源转债!
A134: 14 | B134: 国光转债 | C134: 128123 | D134: 44062. | E134: 国光股份 | F134: 2749 | G134: 化工 | H134: 农化 | I134: 119.111 | J134: -4.0999999999999995e-003 | K134: 5.1999999999999998e-003 | L134: 12.8 | M134: 1.6000000000000001e-003 | N134: 3 | O134: 8.0000000000000002e-003 | P134: 116.2 | Q134: 13.7 | R134: 4.72 | S134: 93.43 | T134: 0.27500000000000002 | U134: 4月20天 | V134: 5.87年 | W134: 3.87年 | X134: 5.7999999999999996e-002 | Y134: 5.4000000000000006e-002 | Z134: 3.2 | AA134: 55 | AB134: -4.3e-003 | AC134: -9.1000000000000004e-003 | AD134: -3.3099999999999997e-002 | AE134: -3.5000000000000003e-002 | AF134: 80.71 | AG134: 80.56 | AH134: 0.68 | AI134: AA- | AJ134: 6.59e-002 | AK134: =I134+100*T134 -> 146.61100000000002 | AL134: 144.8 | AM134: 221 | AN134: 64.1 | AO134: 251 | AP134: -8.5999999999999993e-002 | AQ134: 4 | AR134: 国光转债
A135: 67 | B135: 交科转债 | C135: 128107 | D135: 43973. | E135: 浙江交科 | F135: 2061 | G135: 建筑 | H135: 建筑工程 | I135: 118.165 | J135: 5.5000000000000005e-003 | K135: -5.5000000000000005e-003 | L135: 5.73 | M135: 0. | N135: 11 | O135: 4.0000000000000001e-003 | P135: 115.3 | Q135: 5.36 | R135: 1.01 | S135: 106.9 | T135: 0.105 | U135: 44天 | V135: 5.60年 | W135: 3.60年 | X135: 0.317 | Y135: 0.33899999999999997 | Z135: 25 | AA135: 79 | AB135: -4.5000000000000005e-003 | AC135: -9.300000000000001e-003 | AD135: -3.4099999999999998e-002 | AE135: -3.5900000000000001e-002 | AF135: 88.74 | AG135: 91.54 | AH135: 0.67 | AI135: AA+ | AJ135: 4.2900000000000001e-002 | AK135: =I135+100*T135 -> 128.66500000000002 | AL135: 129.4 | AM135: 86 | AN135: 37.9 | AO135: 83 | AP135: -2.5000000000000001e-002 | AQ135: 14 | AR135: 交科转债
A136: 3 | B136: 特发转2 | C136: 127021 | D136: 44078. | E136: 特发信息 | F136: 70 | G136: 通信互联 | H136: 通信设备 | I136: 115.806 | J136: -1.e-004 | K136: 6.4000000000000003e-003 | L136: 10.21 | M136: 1.5900000000000001e-002 | N136: 26 | O136: 4.0999999999999995e-002 | P136: 113.3 | Q136: 12.33 | R136: 2.97 | S136: 82.81 | T136: 0.39899999999999997 | U136: 5月2天 | V136: 4.90年 | W136: 2.90年 | X136: 6.6000000000000003e-002 | Y136: 5.5e-002 | Z136: 5.5 | AA136: 83 | AB136: -4.5000000000000005e-003 | AC136: -9.3999999999999986e-003 | AD136: -4.0599999999999997e-002 | AE136: -4.1799999999999997e-002 | AF136: 89.65 | AG136: 92.23 | AH136: 0.39 | AI136: AA | AJ136: 4.3400000000000001e-002 | AK136: =I136+100*T136 -> 155.70599999999999 | AL136: 148.8 | AM136: 238 | AN136: 56.6 | AO136: 231 | AP136: -0.159 | AQ136: 3 | AR136: 特发转2
A137: 160 | B137: 桃李转债!! | C137: 113544 | D137: 43753. | E137: 桃李面包 | F137: 603866 | G137: 食品饮料 | H137: 休闲食品 | I137: 118.01 | J137: 8.8000000000000005e-003 | K137: -1.1699999999999999e-002 | L137: 55.11 | M137: -2.8999999999999998e-003 | N137: 129 | O137: 0.20100000000000001 | P137: 115.3 | Q137: 46.54 | R137: 10.84 | S137: 118.41 | T137: -3.0000000000000001e-003 | U137: 转股中 | V137: 5年6.4天 | W137: 3年6.4天 | X137: 1.4999999999999999e-002 | Y137: 1.8000000000000002e-002 | Z137: 5.5 | AA137: 363 | AB137: -4.6999999999999993e-003 | AC137: -1.01e-002 | AD137: -3.9900000000000005e-002 | AE137: -4.2099999999999999e-002 | AF137: 90.41 | AG137: 92.94 | AH137: 1 | AI137: AA | AJ137: 4.4900000000000002e-002 | AK137: =I137+100*T137 -> 117.71000000000001 | AL137: 117.6 | AM137: 7 | AN137: 24.7 | AO137: 10 | AP137: -0.11199999999999999 | AQ137: 17 | AR137: 桃李转债!!
A138: 68 | B138: 全筑转债 | C138: 113578 | D138: 43970. | E138: 全筑股份 | F138: 603030 | G138: 建筑 | H138: 装饰工程 | I138: 121.54 | J138: -4.0999999999999995e-003 | K138: 1.1200000000000002e-002 | L138: 6.33 | M138: 9.5999999999999992e-003 | N138: 14 | O138: 2.8999999999999998e-002 | P138: 118.3 | Q138: 5.43 | R138: 1.54 | S138: 116.57 | T138: 4.2999999999999997e-002 | U138: 42天 | V138: 5.60年 | W138: 3.60年 | X138: 0.113 | Y138: 0.13100000000000001 | Z138: 3.8 | AA138: 34 | AB138: -4.8999999999999998e-003 | AC138: -1.0500000000000001e-002 | AD138: -4.1399999999999999e-002 | AE138: -4.3200000000000002e-002 | AF138: 88.12 | AG138: 92.95 | AH138: 0.74 | AI138: AA | AJ138: 4.4900000000000002e-002 | AK138: =I138+100*T138 -> 125.84 | AL138: 126.5 | AM138: 57 | AN138: 33.6 | AO138: 40 | AP138: -5.0999999999999997e-002 | AQ138: 8 | AR138: 全筑转债
A139: 107 | B139: 天目转债 | C139: 113564 | D139: 43906. | E139: 天目湖 | F139: 603136 | G139: 旅游餐饮 | H139: 旅游 | I139: 130.13 | J139: -1.9e-003 | K139: -4.1900000000000007e-002 | L139: 29.5 | M139: -5.33e-002 | N139: 26 | O139: 6.6000000000000003e-002 | P139: 126.7 | Q139: 23.8 | R139: 3.84 | S139: 123.95 | T139: 5.0000000000000003e-002 | U139: 转股中 | V139: 5.46年 | W139: 3.46年 | X139: 8.8000000000000009e-002 | Y139: 0.109 | Z139: 3 | AA139: 34 | AB139: -5.0000000000000001e-003 | AC139: -1.29e-002 | AD139: -5.91e-002 | AE139: -6.13e-002 | AF139: 83.27 | AG139: 90.16 | AH139: 0.82 | AI139: AA- | AJ139: 6.59e-002 | AK139: =I139+100*T139 -> 135.13 | AL139: 136.3 | AM139: 154 | AN139: 46.2 | AO139: 163 | AP139: -5.7999999999999996e-002 | AQ139: 11 | AR139: 天目转债
A140: 218 | B140: 光华转债! | C140: 128051 | D140: 43474. | E140: 光华科技 | F140: 2741 | G140: 电子 | H140: 元器件制 | I140: 118 | J140: 6.8000000000000005e-003 | K140: -1.0500000000000001e-002 | L140: 13.6 | M140: -5.1000000000000004e-003 | N140: 3.4 | O140: 1.1000000000000001e-002 | P140: 115.5 | Q140: 12.72 | R140: 4.24 | S140: 106.92 | T140: 0.10400000000000001 | U140: 转股中 | V140: 4.25年 | W140: 2.25年 | X140: 4.9000000000000002e-002 | Y140: 5.2999999999999999e-002 | Z140: 2.5 | AA140: 51 | AB140: -5.1000000000000004e-003 | AC140: -1.1599999999999999e-002 | AD140: -5.21e-002 | AE140: -5.4900000000000004e-002 | AF140: 89.46 | AG140: 89.17 | AH140: 0.72 | AI140: AA- | AJ140: 6.4399999999999999e-002 | AK140: =I140+100*T140 -> 128.40000000000001 | AL140: 129.1 | AM140: 80 | AN140: 39.6 | AO140: 106 | AP140: -1.4999999999999999e-002 | AQ140: 22 | AR140: 光华转债!
A141: 158 | B141: 游族转债!! | C141: 128074 | D141: 43759. | E141: 游族网络 | F141: 2174 | G141: 通信互联 | H141: 互联网 | I141: 123.636 | J141: 4.4000000000000003e-003 | K141: 6.0000000000000001e-003 | L141: 18.89 | M141: 1.0700000000000001e-002 | N141: 13 | O141: 1.4999999999999999e-002 | P141: 120.3 | Q141: 16.97 | R141: 3.07 | S141: 111.31 | T141: 0.111 | U141: 转股中 | V141: 5年9天 | W141: 3年9天 | X141: 3.9e-002 | Y141: 4.4000000000000004e-002 | Z141: 6.8 | AA141: 173 | AB141: -5.5000000000000005e-003 | AC141: -1.24e-002 | AD141: -5.3899999999999997e-002 | AE141: -5.5999999999999994e-002 | AF141: 90.38 | AG141: 96.92 | AH141: 0.97 | AI141: AA | AJ141: 4.4900000000000002e-002 | AK141: =I141+100*T141 -> 134.73599999999999 | AL141: 136 | AM141: 149 | AN141: 39 | AO141: 100 | AP141: -8.199999999999999e-002 | AQ141: 22 | AR141: 游族转债!!
A142: 205 | B142: 博彦转债 | C142: 128057 | D142: 43557. | E142: 博彦科技 | F142: 2649 | G142: 计算机及 | H142: 软件开发 | I142: 120 | J142: 1.e-002 | K142: -4.4000000000000003e-003 | L142: 9.89 | M142: 7.0999999999999995e-003 | N142: 17 | O142: 2.7999999999999997e-002 | P142: 117.1 | Q142: 8.72 | R142: 1.9 | S142: 113.42 | T142: 5.7999999999999996e-002 | U142: 转股中 | V142: 4.47年 | W142: 2.47年 | X142: 0.10099999999999999 | Y142: 0.115 | Z142: 5.3 | AA142: 52 | AB142: -5.6000000000000008e-003 | AC142: -1.2199999999999999e-002 | AD142: -5.4800000000000001e-002 | AE142: -5.7200000000000001e-002 | AF142: 88.04 | AG142: 89.13 | AH142: 0.78 | AI142: AA- | AJ142: 6.4399999999999999e-002 | AK142: =I142+100*T142 -> 125.8 | AL142: 126.6 | AM142: 59 | AN142: 37.5 | AO142: 76 | AP142: -7.400000000000001e-002 | AQ142: 30 | AR142: 博彦转债
A143: 176 | B143: 文灿转债! | C143: 113537 | D143: 43651. | E143: 文灿股份 | F143: 603348 | G143: 汽车 | H143: 零部件制 | I143: 124.8 | J143: -5.3e-003 | K143: -1.7000000000000001e-003 | L143: 24 | M143: -8.6999999999999994e-003 | N143: 24 | O143: 3.6000000000000004e-002 | P143: 121.5 | Q143: 19.78 | R143: 2.44 | S143: 121.33 | T143: 2.8999999999999998e-002 | U143: 转股中 | V143: 4.74年 | W143: 2.74年 | X143: 9.1999999999999998e-002 | Y143: 0.11199999999999999 | Z143: 5.3 | AA143: 57 | AB143: -5.7999999999999996e-003 | AC143: -1.34e-002 | AD143: -6.0199999999999997e-002 | AE143: -6.2800000000000009e-002 | AF143: 87.29 | AG143: 91.05 | AH143: 0.8 | AI143: AA- | AJ143: 6.4399999999999999e-002 | AK143: =I143+100*T143 -> 127.7 | AL143: 128.3 | AM143: 68 | AN143: 37.2 | AO143: 74 | AP143: 1.2e-002 | AQ143: 27 | AR143: 文灿转债!
A144: 279 | B144: 林洋转债! | C144: 113014 | D144: 43052. | E144: 林洋能源 | F144: 601222 | G144: 能源电力 | H144: 电力设备 | I144: 112.4 | J144: 5.8999999999999999e-003 | K144: 1.26e-002 | L144: 7.1 | M144: 5.9699999999999996e-002 | N144: 30 | O144: 9.0000000000000011e-003 | P144: 110.3 | Q144: 8.54 | R144: 1.23 | S144: 83.14 | T144: 0.35200000000000004 | U144: 转股中 | V144: 3年43天 | W144: 1年43天 | X144: 0.24199999999999999 | Y144: 0.20100000000000001 | Z144: 30 | AA144: 124 | AB144: -6.1999999999999998e-003 | AC144: -1.2199999999999999e-002 | AD144: -6.7799999999999999e-002 | AE144: -7.1599999999999997e-002 | AF144: 97.39 | AG144: 96.92 | AH144: 0.31 | AI144: AA | AJ144: 4.3400000000000001e-002 | AK144: =I144+100*T144 -> 147.60000000000002 | AL144: 141.7 | AM144: 195 | AN144: 44.3 | AO144: 151 | AP144: -1.3000000000000001e-002 | AQ144: 23 | AR144: 林洋转债!
A145: 156 | B145: 金能转债 | C145: 113545 | D145: 43776. | E145: 金能科技 | F145: 603113 | G145: 煤炭 | H145: 炼焦 | I145: 118.95 | J145: 8.3000000000000001e-003 | K145: 3.9000000000000003e-003 | L145: 12.13 | M145: 1.8500000000000003e-002 | N145: 38 | O145: 2.1000000000000001e-002 | P145: 115.3 | Q145: 11.4 | R145: 1.39 | S145: 106.4 | T145: 0.11800000000000001 | U145: 转股中 | V145: 5年30天 | W145: 3年30天 | X145: 0.183 | Y145: 0.19500000000000001 | Z145: 15 | AA145: 82 | AB145: -6.1999999999999998e-003 | AC145: -1.15e-002 | AD145: -4.1500000000000002e-002 | AE145: -4.36e-002 | AF145: 90.15 | AG145: 92.68 | AH145: 0.66 | AI145: AA | AJ145: 4.4900000000000002e-002 | AK145: =I145+100*T145 -> 130.75 | AL145: 131.5 | AM145: 103 | AN145: 38.8 | AO145: 95 | AP145: -8.3000000000000004e-002 | AQ145: 21 | AR145: 金能转债
A146: 193 | B146: 现代转债 | C146: 110057 | D146: 43585. | E146: 现代制药 | F146: 600420 | G146: 医药 | H146: 化学制药 | I146: 113.97 | J146: -6.5000000000000006e-003 | K146: 1.4499999999999999e-002 | L146: 9.77 | M146: 1.3500000000000002e-002 | N146: 17 | O146: 9.0000000000000011e-003 | P146: 110.8 | Q146: 9.89 | R146: 1.33 | S146: 98.79 | T146: 0.154 | U146: 转股中 | V146: 4.55年 | W146: 2.55年 | X146: 0.161 | Y146: 0.159 | Z146: 16 | AA146: 100 | AB146: -6.3e-003 | AC146: -1.06e-002 | AD146: -3.5900000000000001e-002 | AE146: -3.8100000000000002e-002 | AF146: 93.35 | AG146: 93.67 | AH146: 0.59 | AI146: AAA | AJ146: 3.8399999999999997e-002 | AK146: =I146+100*T146 -> 129.37 | AL146: 129.2 | AM146: 81 | AN146: 35.5 | AO146: 59 | AP146: -5.2000000000000005e-002 | AQ146: 22 | AR146: 现代转债
A147: 4 | B147: 赣锋转2 | C147: 128126 | D147: 44082. | E147: 赣锋锂业 | F147: 2460 | G147: 有色金属 | H147: 小金属 | I147: 115.422 | J147: 2.8000000000000004e-003 | K147: 0. | L147: 47.17 | M147: 6.8000000000000005e-003 | N147: 92 | O147: 3.7999999999999999e-002 | P147: 111.1 | Q147: 61.15 | R147: 7.58 | S147: 77.14 | T147: 0.496 | U147: 5月1天 | V147: 5.89年 | W147: 3.89年 | X147: 3.5000000000000003e-002 | Y147: 2.7000000000000003e-002 | Z147: 21 | AA147: 610 | AB147: -6.5000000000000006e-003 | AC147: -1.e-002 | AD147: -2.8199999999999999e-002 | AE147: -2.9500000000000002e-002 | AF147: 86.16 | AG147: 86.09 | AH147: 0.41 | AI147: AA | AJ147: 4.4900000000000002e-002 | AK147: =I147+100*T147 -> 165.02199999999999 | AL147: 153.7 | AM147: 253 | AN147: 67.5 | AO147: 259 | AP147: -8.6999999999999994e-002 | AQ147: 5 | AR147: 赣锋转2
A148: 169 | B148: 荣晟转债! | C148: 113541 | D148: 43690. | E148: 荣晟环保 | F148: 603165 | G148: 造纸包装 | H148: 包装用纸 | I148: 118.71 | J148: 1.21e-002 | K148: 1.2999999999999999e-003 | L148: 13.29 | M148: 1.6799999999999999e-002 | N148: 3.7 | O148: 1.e-002 | P148: 115 | Q148: 11.54 | R148: 2.3 | S148: 115.16 | T148: 3.1e-002 | U148: 转股中 | V148: 4.86年 | W148: 2.86年 | X148: 9.9000000000000005e-002 | Y148: 0.114 | Z148: 3.3 | AA148: 33 | AB148: -6.6e-003 | AC148: -1.21e-002 | AD148: -4.4699999999999997e-002 | AE148: -4.6799999999999994e-002 | AF148: 85.87 | AG148: 85.45 | AH148: 0.8 | AI148: AA- | AJ148: 6.4399999999999999e-002 | AK148: =I148+100*T148 -> 121.80999999999999 | AL148: 122.3 | AM148: 24 | AN148: 36.4 | AO148: 67 | AP148: -4.0000000000000001e-002 | AQ148: 51 | AR148: 荣晟转债!
A149: 108 | B149: 宏辉转债 | C149: 113565 | D149: 43906. | E149: 宏辉果蔬 | F149: 603336 | G149: 农业 | H149: 农产品加 | I149: 122.72 | J149: 6.6e-003 | K149: 1.9e-003 | L149: 12.29 | M149: 9.8999999999999991e-003 | N149: 47 | O149: 0.121 | P149: 118.2 | Q149: 10 | R149: 4.52 | S149: 122.9 | T149: -1.e-003 | U149: 转股中 | V149: 5.45年 | W149: 3.45年 | X149: 7.9000000000000001e-002 | Y149: 9.6999999999999989e-002 | Z149: 3.2 | AA149: 40 | AB149: -6.9999999999999993e-003 | AC149: -1.2800000000000001e-002 | AD149: -4.4900000000000002e-002 | AE149: -4.6900000000000004e-002 | AF149: 82.88 | AG149: 84.13 | AH149: 0.86 | AI149: AA- | AJ149: 6.59e-002 | AK149: =I149+100*T149 -> 122.62 | AL149: 122.5 | AM149: 27 | AN149: 38.4 | AO149: 90 | AP149: -7.4999999999999997e-002 | AQ149: 18 | AR149: 宏辉转债
A150: 121 | B150: 汽模转2 | C150: 128090 | D150: 43853. | E150: 天汽模 | F150: 2510 | G150: 汽车 | H150: 零部件制 | I150: 119.657 | J150: -2.8999999999999998e-003 | K150: 2.29e-002 | L150: 4.61 | M150: 2.8999999999999998e-002 | N150: 39 | O150: 7.0000000000000007e-002 | P150: 115.2 | Q150: 4.21 | R150: 1.58 | S150: 109.5 | T150: 9.3000000000000013e-002 | U150: 转股中 | V150: 5.29年 | W150: 3.29年 | X150: 0.111 | Y150: 0.121 | Z150: 4.7 | AA150: 42 | AB150: -7.3000000000000001e-003 | AC150: -1.24e-002 | AD150: -4.0999999999999995e-002 | AE150: -4.2900000000000001e-002 | AF150: 89.25 | AG150: 91.76 | AH150: 0.69 | AI150: AA | AJ150: 4.4900000000000002e-002 | AK150: =I150+100*T150 -> 128.95699999999999 | AL150: 129.8 | AM150: 90 | AN150: 38.1 | AO150: 87 | AP150: -7.6999999999999999e-002 | AQ150: 27 | AR150: 汽模转2
A151: 54 | B151: 宝通转债 | C151: 123053 | D151: 44013. | E151: 宝通科技 | F151: 300031 | G151: 通信互联 | H151: 互联网 | I151: 126.586 | J151: 4.5999999999999999e-003 | K151: 3.8e-003 | L151: 22.35 | M151: 1.1299999999999999e-002 | N151: 3.3 | O151: 5.0000000000000001e-003 | P151: 121.3 | Q151: 20.8 | R151: 3.16 | S151: 107.45 | T151: 0.17800000000000002 | U151: 2月28天 | V151: 5.72年 | W151: 3.72年 | X151: 5.5999999999999994e-002 | Y151: 6.0999999999999999e-002 | Z151: 5 | AA151: 89 | AB151: -7.6e-003 | AC151: -1.38e-002 | AD151: -4.9200000000000001e-002 | AE151: -5.1100000000000007e-002 | AF151: 81.54 | AG151: 84.86 | AH151: 0.75 | AI151: AA- | AJ151: 6.59e-002 | AK151: =I151+100*T151 -> 144.386 | AL151: 145.7 | AM151: 233 | AN151: 60.9 | AO151: 243 | AP151: -4.4999999999999998e-002 | AQ151: 4 | AR151: 宝通转债
A152: 203 | B152: 中鼎转2! | C152: 127011 | D152: 43559. | E152: 中鼎股份 | F152: 887 | G152: 汽车 | H152: 零部件制 | I152: 119.3 | J152: -2.8999999999999998e-003 | K152: 6.6e-003 | L152: 10.14 | M152: 9.0000000000000011e-003 | N152: 11 | O152: 6.9999999999999993e-003 | P152: 115.2 | Q152: 11.59 | R152: 1.4 | S152: 87.49 | T152: 0.36399999999999999 | U152: 转股中 | V152: 4.48年 | W152: 2.48年 | X152: 9.6999999999999989e-002 | Y152: 8.5000000000000006e-002 | Z152: 12 | AA152: 124 | AB152: -7.9000000000000008e-003 | AC152: -1.3899999999999999e-002 | AD152: -5.2699999999999997e-002 | AE152: -5.5e-002 | AF152: 93.1 | AG152: 96.43 | AH152: 0.41 | AI152: AA+ | AJ152: 4.1399999999999999e-002 | AK152: =I152+100*T152 -> 155.69999999999999 | AL152: 151.1 | AM152: 246 | AN152: 54.7 | AO152: 221 | AP152: -0.10000000000000001 | AQ152: 28 | AR152: 中鼎转2!
A153: 178 | B153: 三星转债 | C153: 113536 | D153: 43640. | E153: 三星新材 | F153: 603578 | G153: 家电 | H153: 零部件制 | I153: 119.1 | J153: 5.7999999999999996e-003 | K153: 1.18e-002 | L153: 22.22 | M153: 2.4900000000000002e-002 | N153: 2.6 | O153: 1.4999999999999999e-002 | P153: 114.8 | Q153: 19.54 | R153: 3.17 | S153: 113.72 | T153: 4.7e-002 | U153: 转股中 | V153: 4.71年 | W153: 2.71年 | X153: 7.2999999999999995e-002 | Y153: 8.3000000000000004e-002 | Z153: 1.5 | AA153: 20 | AB153: -7.9000000000000008e-003 | AC153: -1.3500000000000002e-002 | AD153: -4.8600000000000004e-002 | AE153: -5.0700000000000002e-002 | AF153: 91.51 | AG153: 94.33 | AH153: 0.71 | AI153: AA | AJ153: 4.3400000000000001e-002 | AK153: =I153+100*T153 -> 123.8 | AL153: 124.5 | AM153: 45 | AN153: 30.2 | AO153: 23 | AP153: -6.0999999999999999e-002 | AQ153: 39 | AR153: 三星转债
A154: 57 | B154: 楚江转债 | C154: 128109 | D154: 44005. | E154: 楚江新材 | F154: 2171 | G154: 有色金属 | H154: 铜金属 | I154: 120.59 | J154: 5.6999999999999993e-003 | K154: 2.e-002 | L154: 8.9 | M154: 3.9699999999999999e-002 | N154: 19 | O154: 9.0000000000000011e-003 | P154: 115.3 | Q154: 8.73 | R154: 2.22 | S154: 101.95 | T154: 0.183 | U154: 2月27天 | V154: 5.72年 | W154: 3.72年 | X154: 0.154 | Y154: 0.157 | Z154: 18 | AA154: 119 | AB154: -8.0000000000000002e-003 | AC154: -1.26e-002 | AD154: -3.8199999999999998e-002 | AE154: -3.9900000000000005e-002 | AF154: 87.65 | AG154: 90.11 | AH154: 0.65 | AI154: AA | AJ154: 4.4900000000000002e-002 | AK154: =I154+100*T154 -> 138.89000000000001 | AL154: 139.2 | AM154: 181 | AN154: 49.1 | AO154: 185 | AP154: -5.2000000000000005e-002 | AQ154: 5 | AR154: 楚江转债
A155: 220 | B155: 福能转债! | C155: 110048 | D155: 43462. | E155: 福能股份 | F155: 600483 | G155: 能源电力 | H155: 电力供应 | I155: 117.85 | J155: -2.3999999999999998e-003 | K155: 1.e-003 | L155: 7.93 | M155: -2.5000000000000001e-003 | N155: 11 | O155: 3.0000000000000001e-003 | P155: 113.9 | Q155: 8.12 | R155: 1.02 | S155: 97.66 | T155: 0.20699999999999999 | U155: 转股中 | V155: 4.23年 | W155: 2.23年 | X155: 0.20300000000000001 | Y155: 0.19800000000000001 | Z155: 28 | AA155: 140 | AB155: -8.199999999999999e-003 | AC155: -1.3999999999999999e-002 | AD155: -5.3600000000000002e-002 | AE155: -5.62e-002 | AF155: 93.92 | AG155: 96.29 | AH155: 0.54 | AI155: AA+ | AJ155: 4.1399999999999999e-002 | AK155: =I155+100*T155 -> 138.54999999999998 | AL155: 138 | AM155: 171 | AN155: 41.7 | AO155: 131 | AP155: -3.7999999999999999e-002 | AQ155: 8 | AR155: 福能转债!
A156: 286 | B156: 洪涛转债! | C156: 128013 | D156: 42605. | E156: 洪涛股份 | F156: 2325 | G156: 建筑 | H156: 装饰工程 | I156: 111.553 | J156: -2.8999999999999998e-003 | K156: -8.9999999999999998e-004 | L156: 3.22 | M156: -6.1999999999999998e-003 | N156: 15 | O156: 1.1000000000000001e-002 | P156: 109.8 | Q156: 3.1 | R156: 1.31 | S156: 103.87 | T156: 7.400000000000001e-002 | U156: 转股中 | V156: 1.87年 | W156: 回售中 | X156: 0.29799999999999999 | Y156: 0.309 | Z156: 12 | AA156: 40 | AB156: -8.5000000000000006e-003 | AC156: -1.8000000000000002e-002 | AD156: 回售中 | AE156: 回售中 | AF156: 100.3 | AG156: 98.02 | AH156: 0.61 | AI156: AA- | AJ156: 6.3099999999999989e-002 | AK156: =I156+100*T156 -> 118.953 | AL156: 119.2 | AM156: 12 | AN156: 18.9 | AO156: 4 | AP156: -4.2000000000000003e-002 | AQ156: 89 | AR156: 洪涛转债!
A157: 44 | B157: 晨光转债 | C157: 123055 | D157: 44025. | E157: 晨光生物 | F157: 300138 | G157: 食品饮料 | H157: 食品加工 | I157: 130.5 | J157: 1.8000000000000002e-002 | K157: -4.4000000000000003e-003 | L157: 14.47 | M157: 1.6899999999999998e-002 | N157: 13 | O157: 1.6e-002 | P157: 124.3 | Q157: 12.25 | R157: 3.94 | S157: 118.12 | T157: 0.105 | U157: 3月10天 | V157: 5.76年 | W157: 3.76年 | X157: 8.5000000000000006e-002 | Y157: 0.10000000000000001 | Z157: 6.3 | AA157: 74 | AB157: -8.6e-003 | AC157: -1.55e-002 | AD157: -5.6299999999999996e-002 | AE157: -5.8099999999999999e-002 | AF157: 81.37 | AG157: 86.76 | AH157: 0.81 | AI157: AA- | AJ157: 6.59e-002 | AK157: =I157+100*T157 -> 141. | AL157: 142.9 | AM157: 208 | AN157: 56.1 | AO157: 227 | AP157: -0.10300000000000001 | AQ157: 5 | AR157: 晨光转债
A158: 51 | B158: 永兴转债 | C158: 128110 | D158: 44020. | E158: 永兴材料 | F158: 2756 | G158: 钢铁 | H158: 炼钢 | I158: 118.998 | J158: 3.3e-003 | K158: -1.0800000000000001e-002 | L158: 17.32 | M158: -1.1399999999999999e-002 | N158: 1.8 | O158: 2.e-003 | P158: 113.2 | Q158: 17.16 | R158: 1.84 | S158: 100.93 | T158: 0.17899999999999999 | U158: 3月2天 | V158: 5.74年 | W158: 3.74年 | X158: 0.11199999999999999 | Y158: 0.113 | Z158: 7 | AA158: 62 | AB158: -8.8000000000000005e-003 | AC158: -1.29e-002 | AD158: -3.49e-002 | AE158: -3.6600000000000001e-002 | AF158: 87.5 | AG158: 88.41 | AH158: 0.66 | AI158: AA | AJ158: 4.4900000000000002e-002 | AK158: =I158+100*T158 -> 136.898 | AL158: 137.1 | AM158: 164 | AN158: 48.7 | AO158: 180 | AP158: -5.0999999999999997e-002 | AQ158: 4 | AR158: 永兴转债
A159: 174 | B159: 华钰转债!! | C159: 113027 | D159: 43656. | E159: 华钰矿业 | F159: 601020 | G159: 有色金属 | H159: 锌铅镍锡 | I159: 120.07 | J159: -1.1399999999999999e-002 | K159: 2.4700000000000003e-002 | L159: 11.54 | M159: 1.67e-002 | N159: 36 | O159: 9.0999999999999998e-002 | P159: 114.9 | Q159: 10.17 | R159: 2.91 | S159: 113.47 | T159: 5.7999999999999996e-002 | U159: 转股中 | V159: 4.75年 | W159: 2.75年 | X159: 5.0999999999999997e-002 | Y159: 5.7999999999999996e-002 | Z159: 3.3 | AA159: 64 | AB159: -9.3999999999999986e-003 | AC159: -1.49e-002 | AD159: -5.04e-002 | AE159: -5.2499999999999998e-002 | AF159: 86.35 | AG159: 85.93 | AH159: 0.79 | AI159: AA- | AJ159: 6.4399999999999999e-002 | AK159: =I159+100*T159 -> 125.86999999999999 | AL159: 126.7 | AM159: 60 | AN159: 40.3 | AO159: 115 | AP159: -0.106 | AQ159: 47 | AR159: 华钰转债!!
A160: 242 | B160: 博世转债! | C160: 123010 | D160: 43326. | E160: 博世科 | F160: 300422 | G160: 城市公用 | H160: 三废处理 | I160: 116.5 | J160: 1.7500000000000002e-002 | K160: -2.e-003 | L160: 12.39 | M160: 2.3099999999999999e-002 | N160: 3.7 | O160: 6.9999999999999993e-003 | P160: 112.3 | Q160: 12.2 | R160: 2.52 | S160: 101.56 | T160: 0.14699999999999999 | U160: 转股中 | V160: 3.81年 | W160: 1.81年 | X160: 8.5999999999999993e-002 | Y160: 8.6999999999999994e-002 | Z160: 4.3 | AA160: 50 | AB160: -9.7999999999999997e-003 | AC160: -1.5600000000000001e-002 | AD160: -6.1799999999999994e-002 | AE160: -6.4399999999999999e-002 | AF160: 90.97 | AG160: 88.95 | AH160: 0.67 | AI160: AA- | AJ160: 6.4399999999999999e-002 | AK160: =I160+100*T160 -> 131.19999999999999 | AL160: 131.4 | AM160: 102 | AN160: 40.5 | AO160: 117 | AP160: -1.3000000000000001e-002 | AQ160: 24 | AR160: 博世转债!
A161: 204 | B161: 拓邦转债 | C161: 128058 | D161: 43563. | E161: 拓邦股份 | F161: 2139 | G161: 电子 | H161: 电子产品 | I161: 128 | J161: 0. | K161: 3.3e-003 | L161: 6.92 | M161: 4.4000000000000003e-003 | N161: 21 | O161: 2.8999999999999998e-002 | P161: 122.6 | Q161: 5.47 | R161: 2.76 | S161: 126.51 | T161: 1.2e-002 | U161: 转股中 | V161: 4.48年 | W161: 2.48年 | X161: 8.0000000000000002e-002 | Y161: 0.10099999999999999 | Z161: 5.7 | AA161: 71 | AB161: -9.7999999999999997e-003 | AC161: -1.8200000000000001e-002 | AD161: -7.46e-002 | AE161: -7.7499999999999999e-002 | AF161: 93.54 | AG161: 101.85 | AH161: 0.76 | AI161: AA | AJ161: 4.3400000000000001e-002 | AK161: =I161+100*T161 -> 129.19999999999999 | AL161: 129.5 | AM161: 88 | AN161: 27.6 | AO161: 16 | AP161: 9.0000000000000011e-003 | AQ161: 21 | AR161: 拓邦转债
A162: 173 | B162: 环境转债! | C162: 113028 | D162: 43654. | E162: 上海环境 | F162: 601200 | G162: 城市公用 | H162: 三废处理 | I162: 116.07 | J162: 8.3000000000000001e-003 | K162: 4.1999999999999997e-003 | L162: 12.07 | M162: 1.26e-002 | N162: 43 | O162: 0.10400000000000001 | P162: 110.8 | Q162: 10.36 | R162: 1.64 | S162: 116.51 | T162: -4.0000000000000001e-003 | U162: 转股中 | V162: 4.76年 | W162: 2.76年 | X162: 2.8999999999999998e-002 | Y162: 3.3000000000000002e-002 | Z162: 3.6 | AA162: 124 | AB162: -9.8999999999999991e-003 | AC162: -1.3999999999999999e-002 | AD162: -3.9399999999999998e-002 | AE162: -4.1399999999999999e-002 | AF162: 91.32 | AG162: 90.86 | AH162: 1 | AI162: AAA | AJ162: 4.3400000000000001e-002 | AK162: =I162+100*T162 -> 115.66999999999999 | AL162: 115.6 | AM162: 2 | AN162: 24.3 | AO162: 9 | AP162: -6.6000000000000003e-002 | AQ162: 10 | AR162: 环境转债!
A163: 15 | B163: 国投转债 | C163: 110073 | D163: 44063. | E163: 国投资本 | F163: 600061 | G163: 金融 | H163: 证券行业 | I163: 117.26 | J163: -4.5000000000000005e-003 | K163: -2.7000000000000001e-003 | L163: 14.66 | M163: -1.21e-002 | N163: 201 | O163: 2.1000000000000001e-002 | P163: 110.5 | Q163: 15.25 | R163: 1.53 | S163: 96.13 | T163: 0.22 | U163: 4月20天 | V163: 5.86年 | W163: 无权 | X163: 0.129 | Y163: 0.124 | Z163: 80 | AA163: 620 | AB163: -1.0200000000000001e-002 | AC163: -1.34e-002 | AD163: 无权 | AE163: 无权 | AF163: 无权 | AG163: 88.1 | AH163: 0.59 | AI163: AAA | AJ163: 3.9900000000000005e-002 | AK163: =I163+100*T163 -> 139.25999999999999 | AL163: 138.4 | AM163: 173 | AN163: 50.3 | AO163: 191 | AP163: -2.1000000000000001e-002 | AQ163: 19 | AR163: 国投转债
A164: 261 | B164: 蒙电转债! | C164: 110041 | D164: 43109. | E164: 内蒙华电 | F164: 600863 | G164: 能源电力 | H164: 电力供应 | I164: 114.13 | J164: 1.1000000000000001e-003 | K164: 5.0000000000000001e-003 | L164: 2.66 | M164: 1.1399999999999999e-002 | N164: 3.3 | O164: 2.e-003 | P164: 110.3 | Q164: 2.69 | R164: 1.35 | S164: 98.88 | T164: 0.154 | U164: 转股中 | V164: 3.27年 | W164: 1.27年 | X164: 0.121 | Y164: 0.12 | Z164: 19 | AA164: 155 | AB164: -1.06e-002 | AC164: -1.6299999999999999e-002 | AD164: -7.0699999999999999e-002 | AE164: -7.4099999999999999e-002 | AF164: 97.43 | AG164: 97.78 | AH164: 0.54 | AI164: AAA | AJ164: 3.8399999999999997e-002 | AK164: =I164+100*T164 -> 129.53 | AL164: 129.4 | AM164: 85 | AN164: 31.6 | AO164: 29 | AP164: 5.0000000000000001e-003 | AQ164: 9 | AR164: 蒙电转债!
A165: 25 | B165: 宏川转债 | C165: 128121 | D165: 44050. | E165: 宏川智慧 | F165: 2930 | G165: 交通运输 | H165: 物流业 | I165: 120.411 | J165: 2.75e-002 | K165: -5.1000000000000004e-003 | L165: 18.56 | M165: 3.3399999999999999e-002 | N165: 14 | O165: 1.8000000000000002e-002 | P165: 113.3 | Q165: 20.25 | R165: 4.47 | S165: 91.65 | T165: 0.314 | U165: 4月13天 | V165: 5.84年 | W165: 3.84年 | X165: 8.1000000000000003e-002 | Y165: 7.4999999999999997e-002 | Z165: 6.7 | AA165: 82 | AB165: -1.06e-002 | AC165: -1.46e-002 | AD165: -3.6699999999999997e-002 | AE165: -3.8399999999999997e-002 | AF165: 80.58 | AG165: 78.63 | AH165: 0.67 | AI165: AA- | AJ165: 6.59e-002 | AK165: =I165+100*T165 -> 151.81100000000001 | AL165: 149.2 | AM165: 240 | AN165: 68.6 | AO165: 260 | AP165: -9.9000000000000005e-002 | AQ165: 3 | AR165: 宏川转债
A166: 112 | B166: 柳药转债 | C166: 113563 | D166: 43885. | E166: 柳药股份 | F166: 603368 | G166: 医药 | H166: 医药商业 | I166: 119.77 | J166: -5.6000000000000008e-003 | K166: 1.1899999999999999e-002 | L166: 23.92 | M166: 1.01e-002 | N166: 1.3 | O166: 1.e-003 | P166: 113.2 | Q166: 24.47 | R166: 1.89 | S166: 97.75 | T166: 0.22500000000000001 | U166: 转股中 | V166: 5.34年 | W166: 3.34年 | X166: 9.1999999999999998e-002 | Y166: 8.9999999999999997e-002 | Z166: 8 | AA166: 87 | AB166: -1.0700000000000001e-002 | AC166: -1.5100000000000001e-002 | AD166: -4.0599999999999997e-002 | AE166: -4.2500000000000003e-002 | AF166: 89.04 | AG166: 89.95 | AH166: 0.61 | AI166: AA | AJ166: 4.4900000000000002e-002 | AK166: =I166+100*T166 -> 142.26999999999998 | AL166: 141.8 | AM166: 198 | AN166: 51.8 | AO166: 204 | AP166: -5.7999999999999996e-002 | AQ166: 16 | AR166: 柳药转债
A167: 75 | B167: 应急转债 | C167: 123048 | D167: 43962. | E167: 中船应急 | F167: 300527 | G167: 机械装备 | H167: 专用设备 | I167: 120.21 | J167: -3.7000000000000002e-003 | K167: -6.4000000000000003e-003 | L167: 9.92 | M167: -1.3899999999999999e-002 | N167: 27 | O167: 2.7000000000000003e-002 | P167: 113.1 | Q167: 8.9 | R167: 3.9 | S167: 111.46 | T167: 7.8e-002 | U167: 32天 | V167: 5.57年 | W167: 3.57年 | X167: 8.9999999999999997e-002 | Y167: 0.10099999999999999 | Z167: 8.2 | AA167: 91 | AB167: -1.11e-002 | AC167: -1.52e-002 | AD167: -3.9300000000000002e-002 | AE167: -4.0999999999999995e-002 | AF167: 88.67 | AG167: 89.89 | AH167: 0.73 | AI167: AA+ | AJ167: 4.2900000000000001e-002 | AK167: =I167+100*T167 -> 128.00999999999999 | AL167: 129 | AM167: 77 | AN167: 39.1 | AO167: 103 | AP167: -8.1000000000000003e-002 | AQ167: 13 | AR167: 应急转债
A168: 8 | B168: 华阳转债 | C168: 128125 | D168: 44064. | E168: 华阳国际 | F168: 2949 | G168: 建筑 | H168: 建筑工程 | I168: 126.5 | J168: -1.6000000000000001e-003 | K168: 3.8e-003 | L168: 27.2 | M168: 2.8999999999999998e-003 | N168: 26 | O168: 4.5999999999999999e-002 | P168: 118.5 | Q168: 25.79 | R168: 4.64 | S168: 105.47 | T168: 0.19899999999999998 | U168: 4月24天 | V168: 5.87年 | W168: 3.87年 | X168: 8.4000000000000005e-002 | Y168: 8.900000000000001e-002 | Z168: 4.5 | AA168: 53 | AB168: -1.1200000000000002e-002 | AC168: -1.66e-002 | AD168: -4.8099999999999997e-002 | AE168: -4.9699999999999994e-002 | AF168: 80.42 | AG168: 82.03 | AH168: 0.76 | AI168: AA- | AJ168: 6.59e-002 | AK168: =I168+100*T168 -> 146.40000000000001 | AL168: 147.5 | AM168: 236 | AN168: 65.5 | AO168: 256 | AP168: -0.17800000000000002 | AQ168: 2 | AR168: 华阳转债
A169: 168 | B169: 好客转债 | C169: 113542 | D169: 43700. | E169: 好莱客 | F169: 603898 | G169: 其他 | H169: 家居用品 | I169: 121.4 | J169: -1.3000000000000001e-002 | K169: 2.2599999999999999e-002 | L169: 17.23 | M169: 1.47e-002 | N169: 20 | O169: 2.7000000000000003e-002 | P169: 114.9 | Q169: 16.27 | R169: 2.29 | S169: 105.9 | T169: 0.14599999999999999 | U169: 转股中 | V169: 4.88年 | W169: 2.88年 | X169: 0.113 | Y169: 0.12 | Z169: 6 | AA169: 53 | AB169: -1.1399999999999999e-002 | AC169: -1.6799999999999999e-002 | AD169: -5.1699999999999996e-002 | AE169: -5.3699999999999998e-002 | AF169: 90.95 | AG169: 93.75 | AH169: 0.65 | AI169: AA | AJ169: 4.3400000000000001e-002 | AK169: =I169+100*T169 -> 136. | AL169: 136.9 | AM169: 161 | AN169: 43.2 | AO169: 141 | AP169: -0.10300000000000001 | AQ169: 19 | AR169: 好客转债
A170: 58 | B170: 今天转债 | C170: 123051 | D170: 44012. | E170: 今天国际 | F170: 300532 | G170: 计算机及 | H170: 软件开发 | I170: 131.21 | J170: -1.3500000000000002e-002 | K170: 1.49e-002 | L170: 12.42 | M170: 1.6000000000000001e-003 | N170: 43 | O170: 0.11599999999999999 | P170: 122.8 | Q170: 8.8 | R170: 4.24 | S170: 141.14 | T170: -7.0000000000000007e-002 | U170: 2月27天 | V170: 5.72年 | W170: 3.72年 | X170: 8.3000000000000004e-002 | Y170: 0.11599999999999999 | Z170: 2.8 | AA170: 34 | AB170: -1.18e-002 | AC170: -1.83e-002 | AD170: -5.7000000000000002e-002 | AE170: -5.9000000000000004e-002 | AF170: 78.79 | AG170: 81.19 | AH170: 0.9 | AI170: A+ | AJ170: 7.690000000000001e-002 | AK170: =I170+100*T170 -> 124.21000000000001 | AL170: 121.3 | AM170: 19 | AN170: 40.1 | AO170: 110 | AP170: 7.2000000000000008e-002 | AQ170: 11 | AR170: 今天转债
A171: 139 | B171: 烽火转债 | C171: 110062 | D171: 43824. | E171: 烽火通信 | F171: 600498 | G171: 通信互联 | H171: 通信设备 | I171: 118.35 | J171: 0. | K171: 9.7999999999999997e-003 | L171: 23.91 | M171: 1.7899999999999999e-002 | N171: 25 | O171: 6.9999999999999993e-003 | P171: 111 | Q171: 25.65 | R171: 2.69 | S171: 93.22 | T171: 0.27000000000000002 | U171: 转股中 | V171: 5.22年 | W171: 3.22年 | X171: 0.11 | Y171: 0.10300000000000001 | Z171: 31 | AA171: 280 | AB171: -1.24e-002 | AC171: -1.6200000000000003e-002 | AD171: -3.9199999999999999e-002 | AE171: -4.0999999999999995e-002 | AF171: 90.78 | AG171: 90.86 | AH171: 0.55 | AI171: AAA | AJ171: 3.9900000000000005e-002 | AK171: =I171+100*T171 -> 145.34999999999999 | AL171: 143.5 | AM171: 210 | AN171: 52.6 | AO171: 209 | AP171: -8.9999999999999997e-002 | AQ171: 20 | AR171: 烽火转债
A172: 123 | B172: 联得转债! | C172: 123038 | D172: 43852. | E172: 联得装备 | F172: 300545 | G172: 机械装备 | H172: 专用设备 | I172: 127 | J172: 9.3999999999999986e-003 | K172: 3.5999999999999999e-003 | L172: 30.86 | M172: 1.5100000000000001e-002 | N172: 19 | O172: 9.8000000000000004e-002 | P172: 119.1 | Q172: 25.29 | R172: 6.33 | S172: 122.02 | T172: 4.0999999999999995e-002 | U172: 转股中 | V172: 5.28年 | W172: 3.28年 | X172: 3.3000000000000002e-002 | Y172: 4.0999999999999995e-002 | Z172: 1.5 | AA172: 45 | AB172: -1.24e-002 | AC172: -1.8500000000000003e-002 | AD172: -5.6100000000000004e-002 | AE172: -5.8200000000000002e-002 | AF172: 81.12 | AG172: 81.32 | AH172: 0.86 | AI172: A+ | AJ172: 7.690000000000001e-002 | AK172: =I172+100*T172 -> 131.09999999999999 | AL172: 132 | AM172: 111 | AN172: 50.7 | AO172: 192 | AP172: -8.8000000000000009e-002 | AQ172: 14 | AR172: 联得转债!
A173: 71 | B173: 聚飞转债 | C173: 123050 | D173: 43966. | E173: 聚飞光电 | F173: 300303 | G173: 电子 | H173: LED制 | I173: 133.088 | J173: 1.0800000000000001e-002 | K173: 1.9099999999999999e-002 | L173: 6.82 | M173: 3.49e-002 | N173: 61 | O173: 6.6000000000000003e-002 | P173: 124.2 | Q173: 5.18 | R173: 3.71 | S173: 131.66 | T173: 1.1000000000000001e-002 | U173: 36天 | V173: 5.58年 | W173: 3.58年 | X173: 8.1000000000000003e-002 | Y173: 0.106 | Z173: 7.1 | AA173: 87 | AB173: -1.2500000000000001e-002 | AC173: -1.9599999999999999e-002 | AD173: -6.4000000000000001e-002 | AE173: -6.59e-002 | AF173: 82.19 | AG173: 87.64 | AH173: 0.86 | AI173: AA- | AJ173: 6.59e-002 | AK173: =I173+100*T173 -> 134.18799999999999 | AL173: 134.5 | AM173: 137 | AN173: 46.9 | AO173: 169 | AP173: -3.2000000000000001e-002 | AQ173: 11 | AR173: 聚飞转债
A174: 56 | B174: 家悦转债 | C174: 113584 | D174: 44006. | E174: 家家悦 | F174: 603708 | G174: 商业零售 | H174: 超市 | I174: 123.92 | J174: -2.0000000000000001e-004 | K174: -5.9999999999999995e-004 | L174: 36.43 | M174: -1.4000000000000002e-003 | N174: 19 | O174: 2.4e-002 | P174: 115.3 | Q174: 37.97 | R174: 7.64 | S174: 95.94 | T174: 0.29199999999999998 | U174: 2月29天 | V174: 5.72年 | W174: 3.72年 | X174: 2.8999999999999998e-002 | Y174: 2.7999999999999997e-002 | Z174: 6.5 | AA174: 222 | AB174: -1.2699999999999999e-002 | AC174: -1.7399999999999999e-002 | AD174: -4.4900000000000002e-002 | AE174: -4.6600000000000003e-002 | AF174: 87.64 | AG174: 90.1 | AH174: 0.59 | AI174: AA | AJ174: 4.4900000000000002e-002 | AK174: =I174+100*T174 -> 153.12 | AL174: 151.9 | AM174: 250 | AN174: 61.8 | AO174: 247 | AP174: -0.126 | AQ174: 3 | AR174: 家悦转债
A175: 246 | B175: 三力转债! | C175: 128039 | D175: 43280. | E175: 三 力 士 | F175: 2224 | G175: 机械装备 | H175: 专用设备 | I175: 115.276 | J175: -2.0000000000000001e-004 | K175: 2.0000000000000001e-004 | L175: 6.2 | M175: 0. | N175: 2.8 | O175: 1.2e-002 | P175: 109.8 | Q175: 5.81 | R175: 1.97 | S175: 106.71 | T175: 8.0000000000000002e-002 | U175: 转股中 | V175: 3.73年 | W175: 1.73年 | X175: 4.4999999999999998e-002 | Y175: 4.8000000000000001e-002 | Z175: 2 | AA175: 45 | AB175: -1.32e-002 | AC175: -1.7899999999999999e-002 | AD175: -6.0100000000000001e-002 | AE175: -6.25e-002 | AF175: 91.17 | AG175: 87.34 | AH175: 0.73 | AI175: AA- | AJ175: 6.4399999999999999e-002 | AK175: =I175+100*T175 -> 123.276 | AL175: 123.8 | AM175: 39 | AN175: 32.7 | AO175: 32 | AP175: -4.2999999999999997e-002 | AQ175: 19 | AR175: 三力转债!
A176: 96 | B176: 华安转债! | C176: 110067 | D176: 43930. | E176: 华安证券 | F176: 600909 | G176: 金融 | H176: 证券行业 | I176: 118.8 | J176: -5.8999999999999999e-003 | K176: 6.5000000000000006e-003 | L176: 8.1 | M176: 1.1999999999999999e-003 | N176: 35 | O176: 1.1000000000000001e-002 | P176: 110.5 | Q176: 8.67 | R176: 2.17 | S176: 93.43 | T176: 0.27200000000000002 | U176: 4.4天 | V176: 5.49年 | W176: 无权 | X176: 9.5000000000000001e-002 | Y176: 8.900000000000001e-002 | Z176: 28 | AA176: 293 | AB176: -1.3300000000000001e-002 | AC176: -1.67e-002 | AD176: 无权 | AE176: 无权 | AF176: 无权 | AG176: 89.38 | AH176: 0.55 | AI176: AAA | AJ176: 3.9900000000000005e-002 | AK176: =I176+100*T176 -> 146. | AL176: 144.2 | AM176: 216 | AN176: 54.8 | AO176: 222 | AP176: -6.9000000000000006e-002 | AQ176: 26 | AR176: 华安转债!
A177: 210 | B177: 中天转债! | C177: 110051 | D177: 43546. | E177: 中天科技 | F177: 600522 | G177: 通信互联 | H177: 通信设备 | I177: 121 | J177: 1.7000000000000001e-003 | K177: 5.6999999999999993e-003 | L177: 10.64 | M177: 1.1399999999999999e-002 | N177: 52 | O177: 1.1000000000000001e-002 | P177: 113.9 | Q177: 10.09 | R177: 1.52 | S177: 105.45 | T177: 0.14699999999999999 | U177: 转股中 | V177: 4.46年 | W177: 2.46年 | X177: 0.122 | Y177: 0.128 | Z177: 40 | AA177: 326 | AB177: -1.37e-002 | AC177: -1.9199999999999998e-002 | AD177: -5.8700000000000002e-002 | AE177: -6.0899999999999996e-002 | AF177: 93.06 | AG177: 95.41 | AH177: 0.64 | AI177: AA+ | AJ177: 4.1399999999999999e-002 | AK177: =I177+100*T177 -> 135.69999999999999 | AL177: 136.5 | AM177: 158 | AN177: 41.1 | AO177: 122 | AP177: -4.9000000000000002e-002 | AQ177: 29 | AR177: 中天转债!
A178: 182 | B178: 永鼎转债! | C178: 110058 | D178: 43593. | E178: 永鼎股份 | F178: 600105 | G178: 通信互联 | H178: 通信设备 | I178: 122.37 | J178: -1.8600000000000002e-002 | K178: -2.2000000000000001e-003 | L178: 6.19 | M178: -2.6699999999999998e-002 | N178: 43 | O178: 5.0999999999999997e-002 | P178: 114.9 | Q178: 5.04 | R178: 3.31 | S178: 122.82 | T178: -4.0000000000000001e-003 | U178: 转股中 | V178: 4.59年 | W178: 2.59年 | X178: 8.900000000000001e-002 | Y178: 0.109 | Z178: 6.8 | AA178: 77 | AB178: -1.3899999999999999e-002 | AC178: -1.9599999999999999e-002 | AD178: -5.9900000000000002e-002 | AE178: -6.2e-002 | AF178: 92.09 | AG178: 94.92 | AH178: 0.78 | AI178: AA | AJ178: 4.3400000000000001e-002 | AK178: =I178+100*T178 -> 121.97 | AL178: 121.9 | AM178: 22 | AN178: 27 | AO178: 14 | AP178: 6.9999999999999993e-003 | AQ178: 56 | AR178: 永鼎转债!
A179: 245 | B179: 华通转债! | C179: 128040 | D179: 43294. | E179: 华通医药 | F179: 2758 | G179: 医药 | H179: 医药商业 | I179: 118.417 | J179: 2.9999999999999997e-004 | K179: 3.5999999999999999e-003 | L179: 11.18 | M179: 6.3e-003 | N179: 3.3 | O179: 1.3000000000000001e-002 | P179: 112.3 | Q179: 11.29 | R179: 3.78 | S179: 99.03 | T179: 0.19600000000000001 | U179: 转股中 | V179: 3.75年 | W179: 1.75年 | X179: 9.4e-002 | Y179: 9.4e-002 | Z179: 2.2 | AA179: 23 | AB179: -1.43e-002 | AC179: -2.0099999999999996e-002 | AD179: -7.1599999999999997e-002 | AE179: -7.4200000000000002e-002 | AF179: 91.3 | AG179: 89.27 | AH179: 0.63 | AI179: AA- | AJ179: 6.4399999999999999e-002 | AK179: =I179+100*T179 -> 138.017 | AL179: 137.8 | AM179: 170 | AN179: 46.5 | AO179: 166 | AP179: -2.2000000000000002e-002 | AQ179: 31 | AR179: 华通转债!
A180: 216 | B180: 台华转债! | C180: 113525 | D180: 43476. | E180: 台华新材 | F180: 603055 | G180: 服装纺织 | H180: 纺织行业 | I180: 122 | J180: 9.5999999999999992e-003 | K180: 2.23e-002 | L180: 9.8 | M180: 4.1399999999999999e-002 | N180: 60 | O180: 0.10400000000000001 | P180: 114.9 | Q180: 8.03 | R180: 2.92 | S180: 122.04 | T180: 0. | U180: 转股中 | V180: 4.26年 | W180: 2.26年 | X180: 6.2e-002 | Y180: 7.5999999999999998e-002 | Z180: 4.7 | AA180: 76 | AB180: -1.43e-002 | AC180: -2.0400000000000001e-002 | AD180: -6.6600000000000006e-002 | AE180: -6.9000000000000006e-002 | AF180: 93.38 | AG180: 96.26 | AH180: 0.77 | AI180: AA | AJ180: 4.3400000000000001e-002 | AK180: =I180+100*T180 -> 122. | AL180: 122 | AM180: 23 | AN180: 25.7 | AO180: 12 | AP180: 0.14300000000000002 | AQ180: 22 | AR180: 台华转债!
A181: 104 | B181: 盛屯转债! | C181: 110066 | D181: 43921. | E181: 盛屯矿业 | F181: 600711 | G181: 有色金属 | H181: 有色行业 | I181: 124.54 | J181: -7.3000000000000001e-003 | K181: -1.0800000000000001e-002 | L181: 5.87 | M181: -2.3300000000000001e-002 | N181: 20 | O181: 6.9999999999999993e-003 | P181: 115.3 | Q181: 4.88 | R181: 1.49 | S181: 120.29 | T181: 3.5000000000000003e-002 | U181: 转股中 | V181: 5.46年 | W181: 3.46年 | X181: 0.17600000000000002 | Y181: 0.21199999999999999 | Z181: 24 | AA181: 135 | AB181: -1.43e-002 | AC181: -1.9099999999999999e-002 | AD181: -4.9400000000000006e-002 | AE181: -5.1200000000000002e-002 | AF181: 88.65 | AG181: 91.14 | AH181: 0.78 | AI181: AA | AJ181: 4.4900000000000002e-002 | AK181: =I181+100*T181 -> 128.04000000000002 | AL181: 128.8 | AM181: 73 | AN181: 37.7 | AO181: 78 | AP181: -4.4999999999999998e-002 | AQ181: 46 | AR181: 盛屯转债!
A182: 111 | B182: 奥瑞转债! | C182: 128096 | D182: 43906. | E182: 奥瑞金 | F182: 2701 | G182: 造纸包装 | H182: 包装材料 | I182: 125.41 | J182: 4.1999999999999997e-003 | K182: -8.3000000000000001e-003 | L182: 5.8 | M182: -5.1000000000000004e-003 | N182: 30 | O182: 2.2000000000000002e-002 | P182: 116 | Q182: 4.64 | R182: 2.36 | S182: 125 | T182: 3.0000000000000001e-003 | U182: 转股中 | V182: 5.41年 | W182: 3.41年 | X182: 7.9000000000000001e-002 | Y182: 9.9000000000000005e-002 | Z182: 11 | AA182: 136 | AB182: -1.46e-002 | AC182: -1.9699999999999999e-002 | AD182: -5.0700000000000002e-002 | AE182: -5.28e-002 | AF182: 89.95 | AG182: 92.91 | AH182: 0.81 | AI182: AA+ | AJ182: 4.2900000000000001e-002 | AK182: =I182+100*T182 -> 125.70999999999999 | AL182: 125.8 | AM182: 48 | AN182: 32.9 | AO182: 34 | AP182: 6.7000000000000004e-002 | AQ182: 23 | AR182: 奥瑞转债!
A183: 128 | B183: 至纯转债! | C183: 113556 | D183: 43839. | E183: 至纯科技 | F183: 603690 | G183: 机械装备 | H183: 专用设备 | I183: 136.84 | J183: 1.9299999999999998e-002 | K183: -9.1999999999999998e-003 | L183: 37.02 | M183: 1.18e-002 | N183: 62 | O183: 0.153 | P183: 126.8 | Q183: 29.37 | R183: 6.79 | S183: 126.05 | T183: 8.5999999999999993e-002 | U183: 转股中 | V183: 5.27年 | W183: 3.27年 | X183: 3.1e-002 | Y183: 3.9e-002 | Z183: 3 | AA183: 96 | AB183: -1.47e-002 | AC183: -2.2799999999999997e-002 | AD183: -7.5800000000000006e-002 | AE183: -7.8100000000000003e-002 | AF183: 81.48 | AG183: 86.66 | AH183: 0.86 | AI183: A+ | AJ183: 7.690000000000001e-002 | AK183: =I183+100*T183 -> 145.44 | AL183: 147.6 | AM183: 237 | AN183: 61 | AO183: 244 | AP183: -8.5999999999999993e-002 | AQ183: 13 | AR183: 至纯转债!
A184: 153 | B184: 英联转债! | C184: 128079 | D184: 43790. | E184: 英联股份 | F184: 2846 | G184: 造纸包装 | H184: 包装材料 | I184: 127.083 | J184: 4.5999999999999999e-003 | K184: 3.1400000000000004e-002 | L184: 16.4 | M184: 3.6000000000000004e-002 | N184: 21 | O184: 0.107 | P184: 117.9 | Q184: 13.41 | R184: 4.64 | S184: 122.3 | T184: 3.9e-002 | U184: 转股中 | V184: 5年37天 | W184: 3年37天 | X184: 4.7e-002 | Y184: 5.7999999999999996e-002 | Z184: 1.5 | AA184: 33 | AB184: -1.49e-002 | AC184: -2.0899999999999998e-002 | AD184: -5.9900000000000002e-002 | AE184: -6.2100000000000002e-002 | AF184: 81.93 | AG184: 81.51 | AH184: 1 | AI184: A+ | AJ184: 7.690000000000001e-002 | AK184: =I184+100*T184 -> 130.983 | AL184: 131.9 | AM184: 109 | AN184: 49.9 | AO184: 189 | AP184: -6.4000000000000001e-002 | AQ184: 19 | AR184: 英联转债!
A185: 74 | B185: 华统转债 | C185: 128106 | D185: 43959. | E185: 华统股份 | F185: 2840 | G185: 农业 | H185: 农产品加 | I185: 123 | J185: 2.41e-002 | K185: 4.0999999999999995e-003 | L185: 10.67 | M185: 3.6900000000000002e-002 | N185: 11 | O185: 1.7000000000000001e-002 | P185: 113.2 | Q185: 9.39 | R185: 1.81 | S185: 113.63 | T185: 8.199999999999999e-002 | U185: 32天 | V185: 5.57年 | W185: 3.57年 | X185: 0.115 | Y185: 0.13100000000000001 | Z185: 5.5 | AA185: 48 | AB185: -1.5100000000000001e-002 | AC185: -1.9199999999999998e-002 | AD185: -4.4999999999999998e-002 | AE185: -4.6799999999999994e-002 | AF185: 88.13 | AG185: 89.05 | AH185: 0.77 | AI185: AA | AJ185: 4.4900000000000002e-002 | AK185: =I185+100*T185 -> 131.19999999999999 | AL185: 132.4 | AM185: 117 | AN185: 43.3 | AO185: 143 | AP185: -0.10400000000000001 | AQ185: 8 | AR185: 华统转债
A186: 43 | B186: 润达转债 | C186: 113588 | D186: 44025. | E186: 润达医疗 | F186: 603108 | G186: 医药 | H186: 医疗器械 | I186: 124.57 | J186: -4.1999999999999997e-003 | K186: 2.46e-002 | L186: 13.7 | M186: 3.0899999999999997e-002 | N186: 4.9 | O186: 6.9999999999999993e-003 | P186: 114.2 | Q186: 13.36 | R186: 2.76 | S186: 102.54 | T186: 0.215 | U186: 3月10天 | V186: 5.76年 | W186: 3.76年 | X186: 6.9000000000000006e-002 | Y186: 7.0999999999999994e-002 | Z186: 5.5 | AA186: 79 | AB186: -1.52e-002 | AC186: -1.95e-002 | AD186: -4.5999999999999999e-002 | AE186: -4.7699999999999992e-002 | AF186: 87.41 | AG186: 89.1 | AH186: 0.66 | AI186: AA | AJ186: 4.4900000000000002e-002 | AK186: =I186+100*T186 -> 146.06999999999999 | AL186: 146.6 | AM186: 234 | AN186: 57.5 | AO186: 235 | AP186: -8.4000000000000005e-002 | AQ186: 6 | AR186: 润达转债
A187: 183 | B187: 雅化转债! | C187: 128065 | D187: 43595. | E187: 雅化集团 | F187: 2497 | G187: 化工 | H187: 化工 | I187: 118.9 | J187: -1.6299999999999999e-002 | K187: 3.8399999999999997e-002 | L187: 9.16 | M187: 3.39e-002 | N187: 7.8 | O187: 8.0000000000000002e-003 | P187: 110.9 | Q187: 8.95 | R187: 3.1 | S187: 102.35 | T187: 0.16200000000000001 | U187: 转股中 | V187: 4.59年 | W187: 2.59年 | X187: 9.0999999999999998e-002 | Y187: 9.3000000000000013e-002 | Z187: 8 | AA187: 88 | AB187: -1.54e-002 | AC187: -1.9599999999999999e-002 | AD187: -4.99e-002 | AE187: -5.21e-002 | AF187: 92.09 | AG187: 91.63 | AH187: 0.65 | AI187: AA | AJ187: 4.3400000000000001e-002 | AK187: =I187+100*T187 -> 135.09999999999999 | AL187: 135.5 | AM187: 144 | AN187: 43.4 | AO187: 144 | AP187: -5.0000000000000003e-002 | AQ187: 22 | AR187: 雅化转债!
A188: 7 | B188: 法兰转债 | C188: 113598 | D188: 44068. | E188: 法兰泰克 | F188: 603966 | G188: 机械装备 | H188: 工程机械 | I188: 132.73 | J188: 3.2599999999999997e-002 | K188: 2.1700000000000001e-002 | L188: 17.86 | M188: 6.3099999999999989e-002 | N188: 48 | O188: 0.111 | P188: 121.2 | Q188: 13.88 | R188: 3.53 | S188: 128.67 | T188: 3.2000000000000001e-002 | U188: 4月25天 | V188: 5.88年 | W188: 3.88年 | X188: 8.8000000000000009e-002 | Y188: 0.113 | Z188: 3.3 | AA188: 38 | AB188: -1.5600000000000001e-002 | AC188: -2.1600000000000001e-002 | AD188: -5.8799999999999998e-002 | AE188: -6.0499999999999998e-002 | AF188: 80.65 | AG188: 83.94 | AH188: 0.86 | AI188: AA- | AJ188: 6.59e-002 | AK188: =I188+100*T188 -> 135.92999999999998 | AL188: 136.8 | AM188: 160 | AN188: 52.8 | AO188: 210 | AP188: 2.6000000000000002e-002 | AQ188: 4 | AR188: 法兰转债
A189: 148 | B189: 天路转债! | C189: 110060 | D189: 43797. | E189: 西藏天路 | F189: 600326 | G189: 建筑 | H189: 水泥 | I189: 124.82 | J189: 5.4000000000000003e-003 | K189: 2.e-003 | L189: 8.16 | M189: 9.8999999999999991e-003 | N189: 16 | O189: 1.8000000000000002e-002 | P189: 115.3 | Q189: 7.16 | R189: 1.97 | S189: 113.97 | T189: 9.5000000000000001e-002 | U189: 转股中 | V189: 5年44天 | W189: 3年44天 | X189: 0.10000000000000001 | Y189: 0.114 | Z189: 7.1 | AA189: 71 | AB189: -1.5700000000000002e-002 | AC189: -2.0899999999999998e-002 | AD189: -5.5099999999999996e-002 | AE189: -5.7099999999999998e-002 | AF189: 90 | AG189: 92.52 | AH189: 0.74 | AI189: AA | AJ189: 4.4900000000000002e-002 | AK189: =I189+100*T189 -> 134.31999999999999 | AL189: 135.7 | AM189: 146 | AN189: 43.2 | AO189: 140 | AP189: -0.20699999999999999 | AQ189: 12 | AR189: 天路转债!
A190: 41 | B190: 雪榕转债 | C190: 123056 | D190: 44036. | E190: 雪榕生物 | F190: 300511 | G190: 农业 | H190: 种植业 | I190: 132.46 | J190: 3.5999999999999999e-003 | K190: 6.0000000000000001e-003 | L190: 16.09 | M190: 1.0700000000000001e-002 | N190: 113 | O190: 0.14599999999999999 | P190: 121.1 | Q190: 11.89 | R190: 3.84 | S190: 135.32 | T190: -2.1000000000000001e-002 | U190: 3月22天 | V190: 5.78年 | W190: 3.78年 | X190: 8.199999999999999e-002 | Y190: 0.111 | Z190: 5.9 | AA190: 71 | AB190: -1.5700000000000002e-002 | AC190: -2.1700000000000001e-002 | AD190: -5.9999999999999998e-002 | AE190: -6.1699999999999998e-002 | AF190: 81.08 | AG190: 84.39 | AH190: 0.9 | AI190: AA- | AJ190: 6.59e-002 | AK190: =I190+100*T190 -> 130.36000000000001 | AL190: 129.6 | AM190: 89 | AN190: 45.2 | AO190: 157 | AP190: -0.10199999999999999 | AQ190: 9 | AR190: 雪榕转债
A191: 133 | B191: 明阳转债! | C191: 113029 | D191: 43837. | E191: 明阳智能 | F191: 601615 | G191: 能源电力 | H191: 风能 | I191: 123.02 | J191: 1.9299999999999998e-002 | K191: 2.6699999999999998e-002 | L191: 14.13 | M191: 6.1600000000000002e-002 | N191: 41 | O191: 2.e-002 | P191: 113.3 | Q191: 12.46 | R191: 2.73 | S191: 113.4 | T191: 8.5000000000000006e-002 | U191: 转股中 | V191: 5.26年 | W191: 3.26年 | X191: 8.5999999999999993e-002 | Y191: 9.6999999999999989e-002 | Z191: 17 | AA191: 198 | AB191: -1.5800000000000002e-002 | AC191: -2.0299999999999999e-002 | AD191: -4.8899999999999999e-002 | AE191: -5.0900000000000001e-002 | AF191: 89.47 | AG191: 90.39 | AH191: 0.75 | AI191: AA | AJ191: 4.4900000000000002e-002 | AK191: =I191+100*T191 -> 131.51999999999998 | AL191: 132.6 | AM191: 120 | AN191: 42.2 | AO191: 136 | AP191: -6.8000000000000005e-002 | AQ191: 23 | AR191: 明阳转债!
A192: 105 | B192: 桐20转债! | C192: 113032 | D192: 43910. | E192: 桐昆股份 | F192: 601233 | G192: 服装纺织 | H192: 纺织行业 | I192: 123.59 | J192: 1.29e-002 | K192: -7.4999999999999997e-003 | L192: 14.62 | M192: 8.3000000000000001e-003 | N192: 6.4 | O192: 2.e-003 | P192: 113.1 | Q192: 14.35 | R192: 1.4 | S192: 101.88 | T192: 0.21299999999999999 | U192: 转股中 | V192: 5.46年 | W192: 3.46年 | X192: 8.5000000000000006e-002 | Y192: 8.6999999999999994e-002 | Z192: 23 | AA192: 270 | AB192: -1.6399999999999998e-002 | AC192: -2.06e-002 | AD192: -4.7800000000000002e-002 | AE192: -4.9599999999999998e-002 | AF192: 89.07 | AG192: 90.3 | AH192: 0.65 | AI192: AA+ | AJ192: 4.2900000000000001e-002 | AK192: =I192+100*T192 -> 144.89000000000001 | AL192: 145.3 | AM192: 227 | AN192: 55 | AO192: 224 | AP192: -9.5000000000000001e-002 | AQ192: 20 | AR192: 桐20转债!
A193: 52 | B193: 寿仙转债 | C193: 113585 | D193: 44019. | E193: 寿仙谷 | F193: 603896 | G193: 医药 | H193: 中药 | I193: 129.75 | J193: 4.0000000000000002e-004 | K193: -6.0999999999999995e-003 | L193: 39.31 | M193: -6.3e-003 | N193: 21 | O193: 4.4999999999999998e-002 | P193: 117.8 | Q193: 28.68 | R193: 4.82 | S193: 137.06 | T193: -5.2999999999999999e-002 | U193: 3月2天 | V193: 5.74年 | W193: 3.74年 | X193: 6.4000000000000001e-002 | Y193: 8.6999999999999994e-002 | Z193: 3.6 | AA193: 56 | AB193: -1.7000000000000001e-002 | AC193: -2.23e-002 | AD193: -5.5399999999999998e-002 | AE193: -5.7200000000000001e-002 | AF193: 81.42 | AG193: 82.35 | AH193: 0.91 | AI193: AA- | AJ193: 6.59e-002 | AK193: =I193+100*T193 -> 124.45 | AL193: 122.4 | AM193: 25 | AN193: 40.1 | AO193: 109 | AP193: -2.3e-002 | AQ193: 8 | AR193: 寿仙转债
A194: 125 | B194: 淮矿转债! | C194: 110065 | D194: 43843. | E194: 淮北矿业 | F194: 600985 | G194: 煤炭 | H194: 煤炭开采 | I194: 121.36 | J194: 1.8000000000000002e-002 | K194: -5.6999999999999993e-003 | L194: 10.27 | M194: 1.6799999999999999e-002 | N194: 23 | O194: 6.9999999999999993e-003 | P194: 111 | Q194: 9.33 | R194: 1.15 | S194: 110.08 | T194: 0.10300000000000001 | U194: 转股中 | V194: 5.27年 | W194: 3.27年 | X194: 0.124 | Y194: 0.13600000000000001 | Z194: 28 | AA194: 223 | AB194: -1.7100000000000001e-002 | AC194: -2.0799999999999999e-002 | AD194: -4.5599999999999995e-002 | AE194: -4.7400000000000005e-002 | AF194: 90.57 | AG194: 90.65 | AH194: 0.73 | AI194: AAA | AJ194: 3.9900000000000005e-002 | AK194: =I194+100*T194 -> 131.66 | AL194: 132.6 | AM194: 121 | AN194: 42 | AO194: 133 | AP194: 6.6000000000000003e-002 | AQ194: 22 | AR194: 淮矿转债!
A195: 70 | B195: 春秋转债 | C195: 113577 | D195: 43964. | E195: 春秋电子 | F195: 603890 | G195: 电子 | H195: 电子产品 | I195: 129.96 | J195: 1.9099999999999999e-002 | K195: 8.3999999999999995e-003 | L195: 14.12 | M195: 3.2199999999999999e-002 | N195: 19 | O195: 6.0999999999999999e-002 | P195: 118.2 | Q195: 11.06 | R195: 3.35 | S195: 127.67 | T195: 1.8000000000000002e-002 | U195: 36天 | V195: 5.58年 | W195: 3.58年 | X195: 4.4000000000000004e-002 | Y195: 5.5999999999999994e-002 | Z195: 2.4 | AA195: 54 | AB195: -1.72e-002 | AC195: -2.2700000000000001e-002 | AD195: -5.7999999999999996e-002 | AE195: -5.9900000000000002e-002 | AF195: 82.19 | AG195: 83.44 | AH195: 0.85 | AI195: AA- | AJ195: 6.59e-002 | AK195: =I195+100*T195 -> 131.76000000000002 | AL195: 132.3 | AM195: 114 | AN195: 48.8 | AO195: 181 | AP195: -0.13600000000000001 | AQ195: 8 | AR195: 春秋转债
A196: 290 | B196: 九州转债! | C196: 110034 | D196: 42398. | E196: 九州通 | F196: 600998 | G196: 医药 | H196: 医药商业 | I196: 112.22 | J196: -1.4199999999999999e-002 | K196: 1.2800000000000001e-002 | L196: 15.97 | M196: -8.6999999999999994e-003 | N196: 14 | O196: 8.0000000000000002e-003 | P196: 109.6 | Q196: 18.32 | R196: 1.67 | S196: 87.17 | T196: 0.28699999999999998 | U196: 转股中 | V196: 1.34年 | W196: 回售中 | X196: 5.0000000000000003e-002 | Y196: 4.4000000000000004e-002 | Z196: 15 | AA196: 300 | AB196: -1.77e-002 | AC196: -3.0699999999999998e-002 | AD196: 回售中 | AE196: 回售中 | AF196: 103 | AG196: 104.04 | AH196: 0.16 | AI196: AA+ | AJ196: 4.0099999999999997e-002 | AK196: =I196+100*T196 -> 140.91999999999999 | AL196: 137.3 | AM196: 166 | AN196: 33.2 | AO196: 37 | AP196: -8.6999999999999994e-002 | AQ196: 26 | AR196: 九州转债!
A197: 227 | B197: 张行转债 | C197: 128048 | D197: 43433. | E197: 张家港行 | F197: 2839 | G197: 金融 | H197: 银行行业 | I197: 122.501 | J197: 0. | K197: -6.0000000000000001e-003 | L197: 6.03 | M197: -9.8999999999999991e-003 | N197: 3.3 | O197: 1.e-003 | P197: 113.9 | Q197: 5.76 | R197: 1.05 | S197: 104.69 | T197: 0.17000000000000001 | U197: 转股中 | V197: 4年59天 | W197: 无权 | X197: 0.22899999999999998 | Y197: 0.23999999999999999 | Z197: 25 | AA197: 109 | AB197: -1.77e-002 | AC197: -2.35e-002 | AD197: 无权 | AE197: 无权 | AF197: 无权 | AG197: 96.56 | AH197: 0.61 | AI197: AA+ | AJ197: 4.1399999999999999e-002 | AK197: =I197+100*T197 -> 139.501 | AL197: 140.3 | AM197: 190 | AN197: 43.8 | AO197: 147 | AP197: -4.2000000000000003e-002 | AQ197: 15 | AR197: 张行转债
A198: 159 | B198: 远东转债! | C198: 128075 | D198: 43769. | E198: 远东传动 | F198: 2406 | G198: 汽车 | H198: 零部件制 | I198: 125.99 | J198: 2.2200000000000001e-002 | K198: -6.8999999999999999e-003 | L198: 6.75 | M198: 1.9599999999999999e-002 | N198: 18 | O198: 2.e-002 | P198: 115.2 | Q198: 5.54 | R198: 1.4 | S198: 121.84 | T198: 3.4000000000000002e-002 | U198: 转股中 | V198: 5年9天 | W198: 3年9天 | X198: 0.182 | Y198: 0.222 | Z198: 7.3 | AA198: 40 | AB198: -1.8000000000000002e-002 | AC198: -2.3199999999999998e-002 | AD198: -5.9800000000000006e-002 | AE198: -6.1799999999999994e-002 | AF198: 90.28 | AG198: 92.81 | AH198: 0.78 | AI198: AA | AJ198: 4.4900000000000002e-002 | AK198: =I198+100*T198 -> 129.38999999999999 | AL198: 130.1 | AM198: 95 | AN198: 37.3 | AO198: 75 | AP198: -7.400000000000001e-002 | AQ198: 16 | AR198: 远东转债!
A199: 256 | B199: 无锡转债! | C199: 110043 | D199: 43173. | E199: 无锡银行 | F199: 600908 | G199: 金融 | H199: 银行行业 | I199: 115.99 | J199: -4.1999999999999997e-003 | K199: -5.1999999999999998e-003 | L199: 5.65 | M199: -1.7399999999999999e-002 | N199: 8.8 | O199: 3.0000000000000001e-003 | P199: 109.1 | Q199: 5.79 | R199: 0.93 | S199: 97.58 | T199: 0.18899999999999997 | U199: 转股中 | V199: 3.38年 | W199: 无权 | X199: 0.28699999999999998 | Y199: 0.28000000000000003 | Z199: 30 | AA199: 104 | AB199: -1.8200000000000001e-002 | AC199: -2.3099999999999999e-002 | AD199: 无权 | AE199: 无权 | AF199: 无权 | AG199: 95.34 | AH199: 0.54 | AI199: AA+ | AJ199: 4.1399999999999999e-002 | AK199: =I199+100*T199 -> 134.88999999999999 | AL199: 134.4 | AM199: 136 | AN199: 39.1 | AO199: 102 | AP199: -3.7999999999999999e-002 | AQ199: 33 | AR199: 无锡转债!
A200: 194 | B200: 精测转债!! | C200: 123025 | D200: 43574. | E200: 精测电子 | F200: 300567 | G200: 电子 | H200: 液晶显示 | I200: 127.285 | J200: -9.7000000000000003e-003 | K200: 3.4200000000000001e-002 | L200: 54.6 | M200: 3.3099999999999997e-002 | N200: 21 | O200: 5.4000000000000006e-002 | P200: 117.3 | Q200: 49.95 | R200: 9.44 | S200: 109.31 | T200: 0.16399999999999998 | U200: 转股中 | V200: 4.54年 | W200: 2.54年 | X200: 2.3e-002 | Y200: 2.5000000000000001e-002 | Z200: 3.1 | AA200: 135 | AB200: -1.8200000000000001e-002 | AC200: -2.4700000000000003e-002 | AD200: -7.3899999999999993e-002 | AE200: -7.6200000000000004e-002 | AF200: 87.71 | AG200: 88.93 | AH200: 0.74 | AI200: AA- | AJ200: 6.4399999999999999e-002 | AK200: =I200+100*T200 -> 143.685 | AL200: 145.3 | AM200: 226 | AN200: 56.3 | AO200: 229 | AP200: -8.9999999999999997e-002 | AQ200: 18 | AR200: 精测转债!!
A201: 134 | B201: 金牌转债! | C201: 113553 | D201: 43837. | E201: 金牌厨柜 | F201: 603180 | G201: 其他 | H201: 家居用品 | I201: 137.58 | J201: 3.6900000000000002e-002 | K201: -1.1999999999999999e-003 | L201: 58.65 | M201: 4.1200000000000001e-002 | N201: 24 | O201: 6.4000000000000001e-002 | P201: 124.6 | Q201: 44.14 | R201: 4.78 | S201: 132.87 | T201: 3.5000000000000003e-002 | U201: 转股中 | V201: 5.25年 | W201: 3.25年 | X201: 5.0000000000000003e-002 | Y201: 6.7000000000000004e-002 | Z201: 2.8 | AA201: 55 | AB201: -1.9099999999999999e-002 | AC201: -2.6600000000000002e-002 | AD201: -7.9299999999999995e-002 | AE201: -8.1199999999999994e-002 | AF201: 83.95 | AG201: 89.82 | AH201: 0.87 | AI201: AA- | AJ201: 6.59e-002 | AK201: =I201+100*T201 -> 141.08000000000001 | AL201: 142.3 | AM201: 201 | AN201: 52.5 | AO201: 208 | AP201: -6.6000000000000003e-002 | AQ201: 15 | AR201: 金牌转债!
A202: 118 | B202: 正裕转债! | C202: 113561 | D202: 43871. | E202: 正裕工业 | F202: 603089 | G202: 汽车 | H202: 零部件制 | I202: 130.96 | J202: 6.0599999999999994e-002 | K202: 3.4000000000000002e-003 | L202: 13.6 | M202: 7.17e-002 | N202: 30 | O202: 0.11699999999999999 | P202: 118.5 | Q202: 10.23 | R202: 3.62 | S202: 132.94 | T202: -1.4999999999999999e-002 | U202: 转股中 | V202: 5.30年 | W202: 3.30年 | X202: 7.0999999999999994e-002 | Y202: 9.5000000000000001e-002 | Z202: 2 | AA202: 28 | AB202: -1.9099999999999999e-002 | AC202: -2.5000000000000001e-002 | AD202: -6.3500000000000001e-002 | AE202: -6.5700000000000008e-002 | AF202: 81.29 | AG202: 80.87 | AH202: 0.89 | AI202: A+ | AJ202: 7.690000000000001e-002 | AK202: =I202+100*T202 -> 129.46000000000001 | AL202: 129 | AM202: 78 | AN202: 47.7 | AO202: 175 | AP202: 5.2000000000000005e-002 | AQ202: 30 | AR202: 正裕转债!
A203: 144 | B203: 川投转债 | C203: 110061 | D203: 43801. | E203: 川投能源 | F203: 600674 | G203: 能源电力 | H203: 水电 | I203: 123.11 | J203: 3.4999999999999996e-003 | K203: -2.2000000000000001e-003 | L203: 9.94 | M203: 2.e-003 | N203: 9.5 | O203: 2.e-003 | P203: 111 | Q203: 9.58 | R203: 1.67 | S203: 103.76 | T203: 0.187 | U203: 转股中 | V203: 5年58天 | W203: 3年58天 | X203: 9.0999999999999998e-002 | Y203: 9.5000000000000001e-002 | Z203: 40 | AA203: 438 | AB203: -2.0199999999999999e-002 | AC203: -2.4e-002 | AD203: -5.1299999999999998e-002 | AE203: -5.3099999999999994e-002 | AF203: 90.98 | AG203: 91.06 | AH203: 0.66 | AI203: AAA | AJ203: 3.9900000000000005e-002 | AK203: =I203+100*T203 -> 141.81 | AL203: 142.5 | AM203: 203 | AN203: 51.4 | AO203: 200 | AP203: -6.0000000000000001e-003 | AQ203: 16 | AR203: 川投转债
A204: 59 | B204: 万青转债 | C204: 127017 | D204: 44014. | E204: 万年青 | F204: 789 | G204: 建筑 | H204: 水泥 | I204: 133.1 | J204: 7.4999999999999997e-003 | K204: 6.8999999999999999e-003 | L204: 16.27 | M204: 2.0099999999999996e-002 | N204: 42 | O204: 3.2000000000000001e-002 | P204: 118.4 | Q204: 14.16 | R204: 2.5 | S204: 114.9 | T204: 0.158 | U204: 2月26天 | V204: 5.72年 | W204: 3.72年 | X204: 7.6999999999999999e-002 | Y204: 8.900000000000001e-002 | Z204: 10 | AA204: 130 | AB204: -2.06e-002 | AC204: -2.6000000000000002e-002 | AD204: -6.2600000000000003e-002 | AE204: -6.4299999999999996e-002 | AF204: 88.25 | AG204: 93.53 | AH204: 0.72 | AI204: AA+ | AJ204: 4.2900000000000001e-002 | AK204: =I204+100*T204 -> 148.90000000000001 | AL204: 151.3 | AM204: 247 | AN204: 57.8 | AO204: 236 | AP204: -7.0999999999999994e-002 | AQ204: 6 | AR204: 万青转债
A205: 29 | B205: 龙大转债 | C205: 128119 | D205: 44050. | E205: 龙大肉食 | F205: 2726 | G205: 食品饮料 | H205: 肉制品 | I205: 135.559 | J205: 1.9199999999999998e-002 | K205: -1.3899999999999999e-002 | L205: 11.03 | M205: 7.3000000000000001e-003 | N205: 47 | O205: 3.7000000000000005e-002 | P205: 120.2 | Q205: 9.56 | R205: 4.24 | S205: 115.38 | T205: 0.17499999999999999 | U205: 4月5天 | V205: 5.83年 | W205: 3.83年 | X205: 8.5999999999999993e-002 | Y205: 0.10000000000000001 | Z205: 9.5 | AA205: 110 | AB205: -2.07e-002 | AC205: -2.6499999999999999e-002 | AD205: -6.5299999999999997e-002 | AE205: -6.6900000000000001e-002 | AF205: 87.14 | AG205: 93.47 | AH205: 0.73 | AI205: AA | AJ205: 4.4900000000000002e-002 | AK205: =I205+100*T205 -> 153.059 | AL205: 155.7 | AM205: 256 | AN205: 62.3 | AO205: 248 | AP205: -0.14400000000000002 | AQ205: 5 | AR205: 龙大转债
A206: 65 | B206: 健友转债 | C206: 113579 | D206: 43973. | E206: 健友股份 | F206: 603707 | G206: 医药 | H206: 原料药 | I206: 128.89 | J206: -8.6e-003 | K206: 1.4000000000000002e-003 | L206: 43.51 | M206: -1.0700000000000001e-002 | N206: 26 | O206: 4.0000000000000001e-002 | P206: 114.2 | Q206: 42.05 | R206: 9.69 | S206: 103.47 | T206: 0.24600000000000002 | U206: 46天 | V206: 5.61年 | W206: 3.61年 | X206: 1.2e-002 | Y206: 1.3000000000000001e-002 | Z206: 5 | AA206: 406 | AB206: -2.1700000000000001e-002 | AC206: -2.6099999999999998e-002 | AD206: -5.6399999999999999e-002 | AE206: -5.8200000000000002e-002 | AF206: 88 | AG206: 89.69 | AH206: 0.67 | AI206: AA | AJ206: 4.4900000000000002e-002 | AK206: =I206+100*T206 -> 153.48999999999998 | AL206: 154.3 | AM206: 254 | AN206: 64.6 | AO206: 253 | AP206: -0.114 | AQ206: 6 | AR206: 健友转债
A207: 143 | B207: 利德转债! | C207: 123035 | D207: 43808. | E207: 利亚德 | F207: 300296 | G207: 电子 | H207: LED制 | I207: 129.35 | J207: 3.6000000000000004e-002 | K207: 4.5199999999999997e-002 | L207: 8.65 | M207: 0.10300000000000001 | N207: 357 | O207: 0.35100000000000003 | P207: 115.6 | Q207: 6.98 | R207: 2.59 | S207: 123.93 | T207: 4.4000000000000004e-002 | U207: 转股中 | V207: 5.17年 | W207: 3.17年 | X207: 3.6000000000000004e-002 | Y207: 4.4999999999999998e-002 | Z207: 8 | AA207: 220 | AB207: -2.2000000000000002e-002 | AC207: -2.7099999999999999e-002 | AD207: -6.3799999999999996e-002 | AE207: -6.59e-002 | AF207: 90.67 | AG207: 93.52 | AH207: 0.79 | AI207: AA+ | AJ207: 4.2900000000000001e-002 | AK207: =I207+100*T207 -> 133.75 | AL207: 134.8 | AM207: 138 | AN207: 41.3 | AO207: 123 | AP207: 0.19 | AQ207: 16 | AR207: 利德转债!
A208: 95 | B208: 红相转债 | C208: 123044 | D208: 43934. | E208: 红相股份 | F208: 300427 | G208: 能源电力 | H208: 电力设备 | I208: 141.6 | J208: 6.0999999999999995e-003 | K208: 4.3e-003 | L208: 26.32 | M208: 1.1899999999999999e-002 | N208: 83 | O208: 0.10099999999999999 | P208: 125.5 | Q208: 18.8 | R208: 4.28 | S208: 140 | T208: 1.1000000000000001e-002 | U208: 4.4天 | V208: 5.49年 | W208: 3.49年 | X208: 6.2e-002 | Y208: 8.6999999999999994e-002 | Z208: 5.9 | AA208: 94 | AB208: -2.2200000000000001e-002 | AC208: -2.9600000000000001e-002 | AD208: -7.9399999999999998e-002 | AE208: -8.1600000000000006e-002 | AF208: 83.41 | AG208: 89.2 | AH208: 0.88 | AI208: AA- | AJ208: 6.59e-002 | AK208: =I208+100*T208 -> 142.69999999999999 | AL208: 143.2 | AM208: 209 | AN208: 54 | AO208: 216 | AP208: -0.12300000000000001 | AQ208: 15 | AR208: 红相转债
A209: 154 | B209: 太极转债! | C209: 128078 | D209: 43777. | E209: 太极股份 | F209: 2368 | G209: 计算机及 | H209: 软件开发 | I209: 131.5 | J209: 3.7000000000000002e-003 | K209: -1.24e-002 | L209: 27.48 | M209: -8.6999999999999994e-003 | N209: 32 | O209: 2.5000000000000001e-002 | P209: 117.3 | Q209: 22.4 | R209: 3.68 | S209: 122.68 | T209: 7.2000000000000008e-002 | U209: 转股中 | V209: 5年37天 | W209: 3年37天 | X209: 5.9999999999999998e-002 | Y209: 7.400000000000001e-002 | Z209: 9.6 | AA209: 159 | AB209: -2.2599999999999999e-002 | AC209: -2.8300000000000002e-002 | AD209: -7.0499999999999993e-002 | AE209: -7.2499999999999995e-002 | AF209: 90.08 | AG209: 94.2 | AH209: 1 | AI209: AA | AJ209: 4.4900000000000002e-002 | AK209: =I209+100*T209 -> 138.69999999999999 | AL209: 140.3 | AM209: 191 | AN209: 46.1 | AO209: 162 | AP209: -0.106 | AQ209: 12 | AR209: 太极转债!
A210: 201 | B210: 伊力转债! | C210: 110055 | D210: 43559. | E210: 伊力特 | F210: 600197 | G210: 食品饮料 | H210: 白酒 | I210: 127.32 | J210: -1.e-004 | K210: 6.8999999999999999e-003 | L210: 18.9 | M210: 9.5999999999999992e-003 | N210: 12 | O210: 1.1000000000000001e-002 | P210: 115 | Q210: 16.81 | R210: 3.14 | S210: 112.43 | T210: 0.13200000000000001 | U210: 转股中 | V210: 4.50年 | W210: 2.50年 | X210: 0.106 | Y210: 0.11900000000000001 | Z210: 8.7 | AA210: 82 | AB210: -2.2799999999999997e-002 | AC210: -2.8500000000000001e-002 | AD210: -7.5499999999999998e-002 | AE210: -7.7699999999999991e-002 | AF210: 92.53 | AG210: 95.37 | AH210: 0.71 | AI210: AA | AJ210: 4.3400000000000001e-002 | AK210: =I210+100*T210 -> 140.51999999999998 | AL210: 142.2 | AM210: 200 | AN210: 46.8 | AO210: 168 | AP210: -9.8000000000000004e-002 | AQ210: 25 | AR210: 伊力转债!
A211: 47 | B211: 泛微转债 | C211: 113587 | D211: 44026. | E211: 泛微网络 | F211: 603039 | G211: 计算机及 | H211: 软件开发 | I211: 141.74 | J211: 7.0999999999999995e-003 | K211: 7.4000000000000003e-003 | L211: 95 | M211: 1.6e-002 | N211: 28 | O211: 6.2e-002 | P211: 124.3 | Q211: 64.33 | R211: 21.56 | S211: 147.68 | T211: -4.0000000000000001e-002 | U211: 3月8天 | V211: 5.75年 | W211: 3.75年 | X211: 1.6e-002 | Y211: 2.3e-002 | Z211: 3.2 | AA211: 202 | AB211: -2.3e-002 | AC211: -2.98e-002 | AD211: -7.6200000000000004e-002 | AE211: -7.8e-002 | AF211: 81.4 | AG211: 86.79 | AH211: 0.91 | AI211: AA- | AJ211: 6.59e-002 | AK211: =I211+100*T211 -> 137.74000000000001 | AL211: 135.8 | AM211: 148 | AN211: 49 | AO211: 183 | AP211: -5.9000000000000004e-002 | AQ211: 3 | AR211: 泛微转债
A212: 291 | B212: 国贸转债! | C212: 110033 | D212: 42388. | E212: 厦门国贸 | F212: 600755 | G212: 交通运输 | H212: 交通运输 | I212: 113.24 | J212: 3.9000000000000003e-003 | K212: -2.9999999999999997e-004 | L212: 7.02 | M212: 1.01e-002 | N212: 5.4 | O212: 4.0000000000000001e-003 | P212: 109.7 | Q212: 7.19 | R212: 0.92 | S212: 97.64 | T212: 0.16 | U212: 转股中 | V212: 1.31年 | W212: 回售中 | X212: 9.3000000000000013e-002 | Y212: 9.0999999999999998e-002 | Z212: 12 | AA212: 130 | AB212: -2.4199999999999999e-002 | AC212: -3.7499999999999999e-002 | AD212: 回售中 | AE212: 回售中 | AF212: 100.28 | AG212: 104.65 | AH212: 0.36 | AI212: AAA | AJ212: 3.7100000000000001e-002 | AK212: =I212+100*T212 -> 129.24000000000001 | AL212: 128.8 | AM212: 75 | AN212: 24.2 | AO212: 7 | AP212: -1.9e-002 | AQ212: 18 | AR212: 国贸转债!
A213: 137 | B213: 先导转债 | C213: 123036 | D213: 43840. | E213: 先导智能 | F213: 300450 | G213: 机械装备 | H213: 专用设备 | I213: 131.662 | J213: 8.8999999999999999e-003 | K213: 1.7600000000000001e-002 | L213: 42.02 | M213: 3.8300000000000001e-002 | N213: 4.4 | O213: 3.0000000000000001e-003 | P213: 115.1 | Q213: 38.99 | R213: 8.82 | S213: 107.77 | T213: 0.222 | U213: 转股中 | V213: 5.24年 | W213: 3.24年 | X213: 2.7000000000000003e-002 | Y213: 2.8999999999999998e-002 | Z213: 10 | AA213: 370 | AB213: -2.58e-002 | AC213: -3.0699999999999998e-002 | AD213: -6.8499999999999991e-002 | AE213: -7.0300000000000001e-002 | AF213: 89.33 | AG213: 91.84 | AH213: 0.69 | AI213: AA | AJ213: 4.4900000000000002e-002 | AK213: =I213+100*T213 -> 153.86199999999999 | AL213: 155.6 | AM213: 255 | AN213: 63.7 | AO213: 250 | AP213: -6.9000000000000006e-002 | AQ213: 17 | AR213: 先导转债
A214: 94 | B214: 三祥转债! | C214: 113572 | D214: 43930. | E214: 三祥新材 | F214: 603663 | G214: 其他 | H214: 其他 | I214: 131.2 | J214: 2.8999999999999998e-002 | K214: 1.5100000000000001e-002 | L214: 19.29 | M214: 4.7800000000000002e-002 | N214: 49 | O214: 0.183 | P214: 113.2 | Q214: 14.19 | R214: 6.64 | S214: 135.94 | T214: -3.5000000000000003e-002 | U214: 4.4天 | V214: 5.49年 | W214: 3.49年 | X214: 5.5999999999999994e-002 | Y214: 7.5999999999999998e-002 | Z214: 2.1 | AA214: 37 | AB214: -2.7000000000000003e-002 | AC214: -3.1099999999999999e-002 | AD214: -6.2800000000000009e-002 | AE214: -6.4500000000000002e-002 | AF214: 79.3 | AG214: 76 | AH214: 0.92 | AI214: A+ | AJ214: 7.690000000000001e-002 | AK214: =I214+100*T214 -> 127.69999999999999 | AL214: 126.5 | AM214: 56 | AN214: 47.2 | AO214: 172 | AP214: -2.2000000000000002e-002 | AQ214: 14 | AR214: 三祥转债!
A215: 287 | B215: 海印转债! | C215: 127003 | D215: 42552. | E215: 海印股份 | F215: 861 | G215: 商业零售 | H215: 商场 | I215: 117.271 | J215: 1.5e-003 | K215: 1.3000000000000001e-002 | L215: 3.46 | M215: 2.06e-002 | N215: 7.2 | O215: 9.0000000000000011e-003 | P215: 111.8 | Q215: 3 | R215: 2.16 | S215: 115.33 | T215: 1.7000000000000001e-002 | U215: 转股中 | V215: 1.73年 | W215: 回售中 | X215: 8.6999999999999994e-002 | Y215: 0.10000000000000001 | Z215: 6.7 | AA215: 78 | AB215: -2.7400000000000001e-002 | AC215: -3.9399999999999998e-002 | AD215: 回售中 | AE215: 回售中 | AF215: 100.3 | AG215: 104.16 | AH215: 0.7 | AI215: AA | AJ215: 4.2099999999999999e-002 | AK215: =I215+100*T215 -> 118.971 | AL215: 119.2 | AM215: 11 | AN215: 15 | AO215: 2 | AP215: -3.1e-002 | AQ215: 76 | AR215: 海印转债!
A216: 147 | B216: 石英转债! | C216: 113548 | D216: 43791. | E216: 石英股份 | F216: 603688 | G216: 电子 | H216: 电子产品 | I216: 143.41 | J216: 2.46e-002 | K216: 0. | L216: 21.44 | M216: 2.7799999999999998e-002 | N216: 37 | O216: 0.19699999999999998 | P216: 124.8 | Q216: 15.1 | R216: 4.39 | S216: 141.99 | T216: 1.e-002 | U216: 转股中 | V216: 5年44天 | W216: 3年44天 | X216: 1.8000000000000002e-002 | Y216: 2.5000000000000001e-002 | Z216: 1.3 | AA216: 74 | AB216: -2.7400000000000001e-002 | AC216: -3.5099999999999999e-002 | AD216: -9.2300000000000007e-002 | AE216: -9.4600000000000004e-002 | AF216: 85.14 | AG216: 90.74 | AH216: 0.88 | AI216: AA- | AJ216: 6.59e-002 | AK216: =I216+100*T216 -> 144.41 | AL216: 144.8 | AM216: 223 | AN216: 54.1 | AO216: 217 | AP216: -0.107 | AQ216: 10 | AR216: 石英转债!
A217: 102 | B217: 康弘转债 | C217: 128098 | D217: 43921. | E217: 康弘药业 | F217: 2773 | G217: 医药 | H217: 化学制药 | I217: 135.001 | J217: 5.4000000000000003e-003 | K217: -1.8e-003 | L217: 48.04 | M217: 4.1999999999999997e-003 | N217: 71 | O217: 3.2000000000000001e-002 | P217: 116.3 | Q217: 35.3 | R217: 8.91 | S217: 136.09 | T217: -8.0000000000000002e-003 | U217: 转股中 | V217: 5.47年 | W217: 3.47年 | X217: 3.9e-002 | Y217: 5.2999999999999999e-002 | Z217: 16 | AA217: 421 | AB217: -2.7400000000000001e-002 | AC217: -3.2400000000000005e-002 | AD217: -7.0300000000000001e-002 | AE217: -7.2000000000000008e-002 | AF217: 88.61 | AG217: 91.89 | AH217: 0.86 | AI217: AA | AJ217: 4.4900000000000002e-002 | AK217: =I217+100*T217 -> 134.20099999999999 | AL217: 133.9 | AM217: 130 | AN217: 42 | AO217: 134 | AP217: 2.2000000000000002e-002 | AQ217: 24 | AR217: 康弘转债
A218: 110 | B218: 恩捷转债! | C218: 128095 | D218: 43889. | E218: 恩捷股份 | F218: 2812 | G218: 电子 | H218: 元器件制 | I218: 133.696 | J218: 2.4500000000000001e-002 | K218: 3.4999999999999996e-003 | L218: 80.1 | M218: 3.5299999999999998e-002 | N218: 20 | O218: 1.e-002 | P218: 115.3 | Q218: 65.09 | R218: 13.82 | S218: 123.06 | T218: 8.5999999999999993e-002 | U218: 转股中 | V218: 5.41年 | W218: 3.41年 | X218: 2.3e-002 | Y218: 2.7999999999999997e-002 | Z218: 16 | AA218: 701 | AB218: -2.75e-002 | AC218: -3.2300000000000002e-002 | AD218: -6.8900000000000003e-002 | AE218: -7.0699999999999999e-002 | AF218: 88.86 | AG218: 91.35 | AH218: 0.79 | AI218: AA | AJ218: 4.4900000000000002e-002 | AK218: =I218+100*T218 -> 142.29599999999999 | AL218: 144.3 | AM218: 217 | AN218: 53 | AO218: 211 | AP218: 1.e-003 | AQ218: 17 | AR218: 恩捷转债!
A219: 85 | B219: 同德转债 | C219: 128103 | D219: 43942. | E219: 同德化工 | F219: 2360 | G219: 化工 | H219: 化工 | I219: 141.9 | J219: 1.44e-002 | K219: 9.7000000000000003e-003 | L219: 6.85 | M219: 2.7000000000000003e-002 | N219: 321 | O219: 1.5700000000000001 | P219: 121.8 | Q219: 5.18 | R219: 2.33 | S219: 132.24 | T219: 7.2999999999999995e-002 | U219: 25天 | V219: 5.53年 | W219: 3.53年 | X219: 5.4000000000000006e-002 | Y219: 7.0999999999999994e-002 | Z219: 1.4 | AA219: 27 | AB219: -2.7799999999999998e-002 | AC219: -3.4200000000000001e-002 | AD219: -7.9699999999999993e-002 | AE219: -8.1799999999999998e-002 | AF219: 79.9 | AG219: 81.67 | AH219: 0.89 | AI219: A+ | AJ219: 7.690000000000001e-002 | AK219: =I219+100*T219 -> 149.20000000000002 | AL219: 151.6 | AM219: 249 | AN219: 69.9 | AO219: 262 | AP219: -7.0999999999999994e-002 | AQ219: 10 | AR219: 同德转债
A220: 19 | B220: 苏试转债 | C220: 123060 | D220: 44060. | E220: 苏试试验 | F220: 300416 | G220: 机械装备 | H220: 专用设备 | I220: 138.5 | J220: 6.0000000000000001e-003 | K220: 2.0999999999999999e-003 | L220: 26.24 | M220: 1.04e-002 | N220: 23 | O220: 5.2999999999999999e-002 | P220: 117.6 | Q220: 23.86 | R220: 6.04 | S220: 109.97 | T220: 0.25900000000000001 | U220: 4月15天 | V220: 5.85年 | W220: 3.85年 | X220: 5.7999999999999996e-002 | Y220: 6.4000000000000001e-002 | Z220: 3.1 | AA220: 53 | AB220: -2.81e-002 | AC220: -3.3099999999999997e-002 | AD220: -6.9599999999999995e-002 | AE220: -7.1199999999999999e-002 | AF220: 80.64 | AG220: 81.56 | AH220: 0.79 | AI220: AA- | AJ220: 6.59e-002 | AK220: =I220+100*T220 -> 164.40000000000001 | AL220: 167 | AM220: 267 | AN220: 85.5 | AO220: 272 | AP220: -8.1000000000000003e-002 | AQ220: 4 | AR220: 苏试转债
A221: 61 | B221: 蓝帆转债 | C221: 128108 | D221: 44001. | E221: 蓝帆医疗 | F221: 2382 | G221: 医药 | H221: 医疗器械 | I221: 133.1 | J221: 1.04e-002 | K221: 4.0999999999999995e-003 | L221: 24.24 | M221: 1.6799999999999999e-002 | N221: 435 | O221: 0.105 | P221: 113.3 | Q221: 17.79 | R221: 2.6 | S221: 136.26 | T221: -2.3e-002 | U221: 2月20天 | V221: 5.70年 | W221: 4.70年 | X221: 0.13500000000000001 | Y221: 0.183 | Z221: 31 | AA221: 234 | AB221: -2.8300000000000002e-002 | AC221: -3.2300000000000002e-002 | AD221: -4.7e-002 | AE221: -4.9000000000000002e-002 | AF221: 85.58 | AG221: 88.63 | AH221: 0.87 | AI221: AA | AJ221: 4.4900000000000002e-002 | AK221: =I221+100*T221 -> 130.79999999999998 | AL221: 129.9 | AM221: 91 | AN221: 41.3 | AO221: 125 | AP221: -0.11800000000000001 | AQ221: 17 | AR221: 蓝帆转债
A222: 45 | B222: 正邦转债 | C222: 128114 | D222: 44027. | E222: 正邦科技 | F222: 2157 | G222: 农业 | H222: 畜牧业 | I222: 136.28 | J222: -1.6000000000000001e-003 | K222: 4.0000000000000001e-003 | L222: 19.51 | M222: 3.0999999999999999e-003 | N222: 44 | O222: 2.e-002 | P222: 115.3 | Q222: 16.09 | R222: 4.14 | S222: 121.26 | T222: 0.124 | U222: 3月10天 | V222: 5.76年 | W222: 3.76年 | X222: 3.3000000000000002e-002 | Y222: 4.0000000000000001e-002 | Z222: 16 | AA222: 489 | AB222: -2.9100000000000001e-002 | AC222: -3.3599999999999998e-002 | AD222: -6.7599999999999993e-002 | AE222: -6.9199999999999998e-002 | AF222: 88.17 | AG222: 90.95 | AH222: 0.78 | AI222: AA+ | AJ222: 4.2900000000000001e-002 | AK222: =I222+100*T222 -> 148.68000000000001 | AL222: 151.3 | AM222: 248 | AN222: 60.4 | AO222: 242 | AP222: -0.17399999999999999 | AQ222: 8 | AR222: 正邦转债
A223: 230 | B223: 利尔转债! | C223: 128046 | D223: 43413. | E223: 利尔化学 | F223: 2258 | G223: 化工 | H223: 农化 | I223: 127.3 | J223: 6.8000000000000005e-003 | K223: 1.95e-002 | L223: 21.62 | M223: 3.49e-002 | N223: 4.6 | O223: 4.0000000000000001e-003 | P223: 112.9 | Q223: 18.62 | R223: 3.32 | S223: 116.11 | T223: 9.6000000000000002e-002 | U223: 转股中 | V223: 4年33天 | W223: 2年33天 | X223: 7.4999999999999997e-002 | Y223: 8.6999999999999994e-002 | Z223: 8.5 | AA223: 113 | AB223: -2.9500000000000002e-002 | AC223: -3.5000000000000003e-002 | AD223: -8.8900000000000007e-002 | AE223: -9.1400000000000009e-002 | AF223: 94.05 | AG223: 95.26 | AH223: 0.75 | AI223: AA | AJ223: 4.3400000000000001e-002 | AK223: =I223+100*T223 -> 136.90000000000001 | AL223: 138.5 | AM223: 174 | AN223: 43.2 | AO223: 142 | AP223: -4.8000000000000001e-002 | AQ223: 10 | AR223: 利尔转债!
A224: 39 | B224: 海容转债 | C224: 113590 | D224: 44039. | E224: 海容冷链 | F224: 603187 | G224: 机械装备 | H224: 通用设备 | I224: 137.02 | J224: -1.5e-003 | K224: 1.e-003 | L224: 48 | M224: -5.9999999999999995e-004 | N224: 17 | O224: 2.4e-002 | P224: 115.6 | Q224: 36.39 | R224: 4.87 | S224: 131.9 | T224: 3.9e-002 | U224: 3月22天 | V224: 5.79年 | W224: 3.79年 | X224: 6.6000000000000003e-002 | Y224: 8.6999999999999994e-002 | Z224: 5 | AA224: 76 | AB224: -2.9500000000000002e-002 | AC224: -3.4000000000000002e-002 | AD224: -6.8000000000000005e-002 | AE224: -6.9699999999999998e-002 | AF224: 80.95 | AG224: 80.5 | AH224: 0.9 | AI224: AA- | AJ224: 6.59e-002 | AK224: =I224+100*T224 -> 140.92000000000002 | AL224: 142.1 | AM224: 199 | AN224: 61.2 | AO224: 245 | AP224: -8.5999999999999993e-002 | AQ224: 4 | AR224: 海容转债
A225: 166 | B225: 合兴转债! | C225: 128071 | D225: 43724. | E225: 合兴包装 | F225: 2228 | G225: 造纸包装 | H225: 包装材料 | I225: 132.78 | J225: 5.21e-002 | K225: 3.3e-003 | L225: 5.76 | M225: 6.6699999999999995e-002 | N225: 161 | O225: 0.249 | P225: 114.8 | Q225: 4.28 | R225: 2.27 | S225: 134.58 | T225: -1.3000000000000001e-002 | U225: 转股中 | V225: 4.92年 | W225: 2.92年 | X225: 7.400000000000001e-002 | Y225: 0.10000000000000001 | Z225: 5 | AA225: 67 | AB225: -2.9600000000000001e-002 | AC225: -3.4700000000000002e-002 | AD225: -7.8600000000000003e-002 | AE225: -8.0399999999999985e-002 | AF225: 90.69 | AG225: 93.49 | AH225: 0.83 | AI225: AA | AJ225: 4.3400000000000001e-002 | AK225: =I225+100*T225 -> 131.47999999999999 | AL225: 131 | AM225: 98 | AN225: 37.5 | AO225: 77 | AP225: 0.18600000000000003 | AQ225: 27 | AR225: 合兴转债!
A226: 78 | B226: 长集转债 | C226: 128105 | D226: 43964. | E226: 长青集团 | F226: 2616 | G226: 城市公用 | H226: 三废处理 | I226: 136 | J226: 7.3000000000000001e-003 | K226: 3.0699999999999998e-002 | L226: 10.57 | M226: 4.5499999999999999e-002 | N226: 20 | O226: 1.8000000000000002e-002 | P226: 115.3 | Q226: 8.11 | R226: 3.26 | S226: 130.33 | T226: 4.2999999999999997e-002 | U226: 31天 | V226: 5.57年 | W226: 3.57年 | X226: 0.10199999999999999 | Y226: 0.13300000000000001 | Z226: 8 | AA226: 78 | AB226: -2.9700000000000001e-002 | AC226: -3.44e-002 | AD226: -7.0400000000000004e-002 | AE226: -7.2099999999999997e-002 | AF226: 88.24 | AG226: 90.72 | AH226: 0.83 | AI226: AA | AJ226: 4.4900000000000002e-002 | AK226: =I226+100*T226 -> 140.30000000000001 | AL226: 141.7 | AM226: 196 | AN226: 50.9 | AO226: 194 | AP226: -5.7000000000000002e-002 | AQ226: 5 | AR226: 长集转债
A227: 224 | B227: 桐昆转债! | C227: 113020 | D227: 43446. | E227: 桐昆股份 | F227: 601233 | G227: 服装纺织 | H227: 纺织行业 | I227: 128.06 | J227: 1.9099999999999999e-002 | K227: -1.2699999999999999e-002 | L227: 14.62 | M227: 8.3000000000000001e-003 | N227: 43 | O227: 1.e-002 | P227: 112.8 | Q227: 12.28 | R227: 1.4 | S227: 119.06 | T227: 7.5999999999999998e-002 | U227: 转股中 | V227: 4.18年 | W227: 2.18年 | X227: 0.128 | Y227: 0.152 | Z227: 34 | AA227: 270 | AB227: -3.0499999999999999e-002 | AC227: -3.5699999999999996e-002 | AD227: -8.8200000000000001e-002 | AE227: -9.06e-002 | AF227: 94.01 | AG227: 95.54 | AH227: 0.77 | AI227: AA+ | AJ227: 4.1399999999999999e-002 | AK227: =I227+100*T227 -> 135.66 | AL227: 137.1 | AM227: 165 | AN227: 41.5 | AO227: 127 | AP227: -9.5000000000000001e-002 | AQ227: 15 | AR227: 桐昆转债!
A228: 292 | B228: 航信转债!! | C228: 110031 | D228: 42185. | E228: 航天信息 | F228: 600271 | G228: 计算机及 | H228: 软件开发 | I228: 109.5 | J228: 4.1999999999999997e-003 | K228: -4.1999999999999997e-003 | L228: 16.43 | M228: 4.3e-003 | N228: 2.3 | O228: 1.e-003 | P228: 107 | Q228: 21.56 | R228: 2.74 | S228: 76.21 | T228: 0.43700000000000006 | U228: 转股中 | V228: 0.74年 | W228: 回售中 | X228: 7.9000000000000001e-002 | Y228: 5.9999999999999998e-002 | Z228: 24 | AA228: 305 | AB228: -3.0600000000000002e-002 | AC228: -4.7599999999999996e-002 | AD228: 回售中 | AE228: 回售中 | AF228: 100.27 | AG228: 104.37 | AH228: 0.01 | AI228: AAA | AJ228: 3.4000000000000002e-002 | AK228: =I228+100*T228 -> 153.19999999999999 | AL228: 142.8 | AM228: 207 | AN228: 38.4 | AO228: 91 | AP228: -7.0999999999999994e-002 | AQ228: 14 | AR228: 航信转债!!
A229: 151 | B229: 索发转债! | C229: 113547 | D229: 43791. | E229: 索通发展 | F229: 603612 | G229: 其他 | H229: 其他 | I229: 139.14 | J229: 8.7300000000000003e-002 | K229: -8.8999999999999999e-003 | L229: 14.59 | M229: 7.8299999999999995e-002 | N229: 227 | O229: 1.3999999999999999 | P229: 119.1 | Q229: 10.52 | R229: 1.98 | S229: 138.69 | T229: 3.0000000000000001e-003 | U229: 转股中 | V229: 5年40天 | W229: 3年40天 | X229: 2.2000000000000002e-002 | Y229: 3.1e-002 | Z229: 1.2 | AA229: 55 | AB229: -3.0600000000000002e-002 | AC229: -3.6799999999999999e-002 | AD229: -8.4900000000000003e-002 | AE229: -8.7100000000000011e-002 | AF229: 90.62 | AG229: 95.68 | AH229: 1 | AI229: AA | AJ229: 4.4900000000000002e-002 | AK229: =I229+100*T229 -> 139.44 | AL229: 139.6 | AM229: 185 | AN229: 43.9 | AO229: 149 | AP229: -1.3999999999999999e-002 | AQ229: 10 | AR229: 索发转债!
A230: 163 | B230: 九洲转债 | C230: 123030 | D230: 43720. | E230: 九洲集团 | F230: 300040 | G230: 能源电力 | H230: 电力设备 | I230: 139.8 | J230: 8.4600000000000009e-002 | K230: 1.6899999999999998e-002 | L230: 7.95 | M230: 0.115 | N230: 1039. | O230: 3.9300000000000002 | P230: 120 | Q230: 5.65 | R230: 1.39 | S230: 140.71 | T230: -6.0000000000000001e-003 | U230: 转股中 | V230: 4.93年 | W230: 2.93年 | X230: 7.2000000000000008e-002 | Y230: 0.10099999999999999 | Z230: 2 | AA230: 27 | AB230: -3.1e-002 | AC230: -3.7599999999999995e-002 | AD230: -9.3200000000000005e-002 | AE230: -9.5100000000000004e-002 | AF230: 85.46 | AG230: 88.72 | AH230: 0.88 | AI230: AA- | AJ230: 6.4399999999999999e-002 | AK230: =I230+100*T230 -> 139.20000000000002 | AL230: 138.9 | AM230: 177 | AN230: 50.2 | AO230: 190 | AP230: 6.8000000000000005e-002 | AQ230: 30 | AR230: 九洲转债
A231: 273 | B231: 济川转债! | C231: 110038 | D231: 43068. | E231: 济川药业 | F231: 600566 | G231: 医药 | H231: 中药 | I231: 115.94 | J231: -3.9000000000000003e-003 | K231: 3.9000000000000003e-003 | L231: 23.69 | M231: 0. | N231: 3.4 | O231: 5.0000000000000001e-003 | P231: 108.3 | Q231: 24.27 | R231: 3.4 | S231: 97.61 | T231: 0.188 | U231: 转股中 | V231: 2.17年 | W231: 0.17年 | X231: 3.3000000000000002e-002 | Y231: 3.2000000000000001e-002 | Z231: 6.3 | AA231: 193 | AB231: -3.1400000000000004e-002 | AC231: -3.8300000000000001e-002 | AD231: -0.41700000000000004 | AE231: -0.42200000000000004 | AF231: 99.68 | AG231: 99.17 | AH231: 0.49 | AI231: AA | AJ231: 4.2099999999999999e-002 | AK231: =I231+100*T231 -> 134.74000000000001 | AL231: 134.3 | AM231: 135 | AN231: 34.6 | AO231: 51 | AP231: -2.4e-002 | AQ231: 19 | AR231: 济川转债!
A232: 66 | B232: 康隆转债 | C232: 113580 | D232: 43971. | E232: 康隆达 | F232: 603665 | G232: 服装纺织 | H232: 服装行业 | I232: 144.77 | J232: 2.4799999999999999e-002 | K232: -3.0200000000000001e-002 | L232: 23.66 | M232: -5.8999999999999999e-003 | N232: 53 | O232: 0.184 | P232: 121.2 | Q232: 15.51 | R232: 3.79 | S232: 152.55 | T232: -5.0999999999999997e-002 | U232: 45天 | V232: 5.61年 | W232: 3.61年 | X232: 5.7000000000000002e-002 | Y232: 8.6999999999999994e-002 | Z232: 2 | AA232: 35 | AB232: -3.1800000000000002e-002 | AC232: -3.7900000000000003e-002 | AD232: -8.4399999999999989e-002 | AE232: -8.6199999999999999e-002 | AF232: 82.06 | AG232: 85.4 | AH232: 0.92 | AI232: AA- | AJ232: 6.59e-002 | AK232: =I232+100*T232 -> 139.67000000000002 | AL232: 137 | AM232: 162 | AN232: 51.6 | AO232: 201 | AP232: 7.6999999999999999e-002 | AQ232: 9 | AR232: 康隆转债
A233: 28 | B233: 欣旺转债 | C233: 123058 | D233: 44050. | E233: 欣旺达 | F233: 300207 | G233: 电子 | H233: 电子产品 | I233: 140.8 | J233: 1.66e-002 | K233: 1.7100000000000001e-002 | L233: 25.95 | M233: 4.2999999999999997e-002 | N233: 42 | O233: 2.7000000000000003e-002 | P233: 116.3 | Q233: 21.28 | R233: 7.02 | S233: 121.95 | T233: 0.155 | U233: 4月8天 | V233: 5.83年 | W233: 3.83年 | X233: 2.7999999999999997e-002 | Y233: 3.4000000000000002e-002 | Z233: 11 | AA233: 407 | AB233: -3.2799999999999996e-002 | AC233: -3.7499999999999999e-002 | AD233: -7.400000000000001e-002 | AE233: -7.5600000000000001e-002 | AF233: 87.23 | AG233: 90.46 | AH233: 0.78 | AI233: AA | AJ233: 4.4900000000000002e-002 | AK233: =I233+100*T233 -> 156.30000000000001 | AL233: 159.7 | AM233: 263 | AN233: 69.2 | AO233: 261 | AP233: 3.5000000000000003e-002 | AQ233: 5 | AR233: 欣旺转债
A234: 60 | B234: 益丰转债 | C234: 113583 | D234: 44004. | E234: 益丰药房 | F234: 603939 | G234: 医药 | H234: 医药商业 | I234: 141.87 | J234: 2.3900000000000001e-002 | K234: 4.6999999999999993e-003 | L234: 100.08 | M234: 3.2500000000000001e-002 | N234: 29 | O234: 1.3000000000000001e-002 | P234: 115.3 | Q234: 71.82 | R234: 10.97 | S234: 139.35 | T234: 1.8000000000000002e-002 | U234: 2月24天 | V234: 5.71年 | W234: 3.71年 | X234: 2.9999999999999999e-002 | Y234: 4.0999999999999995e-002 | Z234: 16 | AA234: 531 | AB234: -3.6299999999999999e-002 | AC234: -4.07e-002 | AD234: -7.8e-002 | AE234: -7.9600000000000004e-002 | AF234: 87.68 | AG234: 90.15 | AH234: 0.88 | AI234: AA | AJ234: 4.4900000000000002e-002 | AK234: =I234+100*T234 -> 143.67000000000002 | AL234: 144.4 | AM234: 218 | AN234: 54.2 | AO234: 220 | AP234: 3.4000000000000002e-002 | AQ234: 8 | AR234: 益丰转债
A235: 119 | B235: 新天转债 | C235: 128091 | D235: 43847. | E235: 新天药业 | F235: 2873 | G235: 医药 | H235: 中药 | I235: 145.619 | J235: -4.0000000000000001e-003 | K235: 2.75e-002 | L235: 18.17 | M235: 2.8900000000000002e-002 | N235: 124 | O235: 0.47799999999999998 | P235: 120 | Q235: 16.39 | R235: 2.92 | S235: 110.86 | T235: 0.314 | U235: 转股中 | V235: 5.29年 | W235: 3.29年 | X235: 8.3000000000000004e-002 | Y235: 9.1999999999999998e-002 | Z235: 1.8 | AA235: 21 | AB235: -3.6799999999999999e-002 | AC235: -4.2900000000000001e-002 | AD235: -9.1199999999999989e-002 | AE235: -9.35e-002 | AF235: 81.66 | AG235: 81.98 | AH235: 0.81 | AI235: A+ | AJ235: 7.690000000000001e-002 | AK235: =I235+100*T235 -> 177.01900000000001 | AL235: 180.4 | AM235: 273 | AN235: 98.4 | AO235: 276 | AP235: -8.0000000000000002e-002 | AQ235: 16 | AR235: 新天转债
A236: 79 | B236: 东时转债 | C236: 113575 | D236: 43951. | E236: 东方时尚 | F236: 603377 | G236: 其他 | H236: 其他 | I236: 139.88 | J236: -1.78e-002 | K236: -3.61e-002 | L236: 21.88 | M236: -5.8899999999999994e-002 | N236: 28 | O236: 4.5999999999999999e-002 | P236: 113.5 | Q236: 14.56 | R236: 7.09 | S236: 150.27 | T236: -6.9000000000000006e-002 | U236: 31天 | V236: 5.57年 | W236: 3.57年 | X236: 3.3000000000000002e-002 | Y236: 5.0000000000000003e-002 | Z236: 4.3 | AA236: 129 | AB236: -3.7499999999999999e-002 | AC236: -4.1599999999999998e-002 | AD236: -7.7300000000000008e-002 | AE236: -7.9000000000000001e-002 | AF236: 88.27 | AG236: 89.32 | AH236: 0.92 | AI236: AA | AJ236: 4.4900000000000002e-002 | AK236: =I236+100*T236 -> 132.97999999999999 | AL236: 129.5 | AM236: 87 | AN236: 40.2 | AO236: 112 | AP236: -4.0000000000000001e-002 | AQ236: 16 | AR236: 东时转债
A237: 238 | B237: 万顺转债 | C237: 123012 | D237: 43341. | E237: 万顺新材 | F237: 300057 | G237: 造纸包装 | H237: 包装材料 | I237: 127.49 | J237: 1.3300000000000001e-002 | K237: 3.0699999999999998e-002 | L237: 6.15 | M237: 5.4900000000000004e-002 | N237: 135 | O237: 0.83200000000000007 | P237: 110.3 | Q237: 5.31 | R237: 1.22 | S237: 115.82 | T237: 0.10099999999999999 | U237: 转股中 | V237: 3.85年 | W237: 1.85年 | X237: 3.1e-002 | Y237: 3.6000000000000004e-002 | Z237: 1.3 | AA237: 41 | AB237: -3.7599999999999995e-002 | AC237: -4.2199999999999994e-002 | AD237: -0.10199999999999999 | AE237: -0.10400000000000001 | AF237: 90.74 | AG237: 87.15 | AH237: 0.8 | AI237: AA- | AJ237: 6.4399999999999999e-002 | AK237: =I237+100*T237 -> 137.59 | AL237: 139.2 | AM237: 180 | AN237: 48.4 | AO237: 179 | AP237: 1.e-002 | AQ237: 15 | AR237: 万顺转债
A238: 97 | B238: 永高转债 | C238: 128099 | D238: 43931. | E238: 永高股份 | F238: 2641 | G238: 建筑 | H238: 建筑行业 | I238: 139.2 | J238: 1.3500000000000002e-002 | K238: 1.2199999999999999e-002 | L238: 8.18 | M238: 3.0200000000000001e-002 | N238: 5.8 | O238: 6.0000000000000001e-003 | P238: 113.2 | Q238: 6.16 | R238: 2.6 | S238: 132.79 | T238: 4.8000000000000001e-002 | U238: 3.4天 | V238: 5.49年 | W238: 3.49年 | X238: 7.5999999999999998e-002 | Y238: 0.10099999999999999 | Z238: 7 | AA238: 92 | AB238: -3.7599999999999995e-002 | AC238: -4.1700000000000001e-002 | AD238: -7.8e-002 | AE238: -7.9699999999999993e-002 | AF238: 88.45 | AG238: 89.37 | AH238: 0.85 | AI238: AA | AJ238: 4.4900000000000002e-002 | AK238: =I238+100*T238 -> 144. | AL238: 145.6 | AM238: 232 | AN238: 56.2 | AO238: 228 | AP238: -7.8e-002 | AQ238: 9 | AR238: 永高转债
A239: 270 | B239: 众信转债! | C239: 128022 | D239: 43097. | E239: 众信旅游 | F239: 2707 | G239: 旅游餐饮 | H239: 旅游 | I239: 124 | J239: 1.7100000000000001e-002 | K239: 3.8e-003 | L239: 9.06 | M239: 2.8399999999999998e-002 | N239: 53 | O239: 9.3000000000000013e-002 | P239: 109.8 | Q239: 7.91 | R239: 4.01 | S239: 114.54 | T239: 8.3000000000000004e-002 | U239: 转股中 | V239: 3.21年 | W239: 1.21年 | X239: 5.5999999999999994e-002 | Y239: 6.4000000000000001e-002 | Z239: 4.6 | AA239: 82 | AB239: -3.78e-002 | AC239: -4.3200000000000002e-002 | AD239: -0.12 | AE239: -0.12300000000000001 | AF239: 96.76 | AG239: 96.06 | AH239: 0.74 | AI239: AA | AJ239: 4.3400000000000001e-002 | AK239: =I239+100*T239 -> 132.30000000000001 | AL239: 133.5 | AM239: 127 | AN239: 36.7 | AO239: 69 | AP239: -2.e-003 | AQ239: 25 | AR239: 众信转债!
A240: 271 | B240: 兄弟转债!! | C240: 128021 | D240: 43096. | E240: 兄弟科技 | F240: 2562 | G240: 医药 | H240: 原料药 | I240: 124.1 | J240: -3.2000000000000002e-003 | K240: -1.e-004 | L240: 6.06 | M240: -3.3e-003 | N240: 9.5 | O240: 2.8999999999999998e-002 | P240: 109.8 | Q240: 5.25 | R240: 2.55 | S240: 115.43 | T240: 7.4999999999999997e-002 | U240: 转股中 | V240: 3.21年 | W240: 1.21年 | X240: 4.9000000000000002e-002 | Y240: 5.5999999999999994e-002 | Z240: 2.7 | AA240: 55 | AB240: -3.8199999999999998e-002 | AC240: -4.3499999999999997e-002 | AD240: -0.121 | AE240: -0.124 | AF240: 96.8 | AG240: 96.09 | AH240: 0.99 | AI240: AA | AJ240: 4.3400000000000001e-002 | AK240: =I240+100*T240 -> 131.59999999999999 | AL240: 132.8 | AM240: 122 | AN240: 36 | AO240: 64 | AP240: -9.4e-002 | AQ240: 13 | AR240: 兄弟转债!!
A241: 88 | B241: 天铁转债 | C241: 123046 | D241: 43938. | E241: 天铁股份 | F241: 300587 | G241: 铁路 | H241: 铁路设备 | I241: 145.88 | J241: 8.8999999999999999e-003 | K241: -1.6000000000000001e-003 | L241: 15.38 | M241: 7.9000000000000008e-003 | N241: 37 | O241: 6.5000000000000002e-002 | P241: 118.2 | Q241: 10.12 | R241: 2.58 | S241: 151.98 | T241: -4.0000000000000001e-002 | U241: 11天 | V241: 5.51年 | W241: 3.51年 | X241: 8.4000000000000005e-002 | Y241: 0.128 | Z241: 4 | AA241: 48 | AB241: -3.8199999999999998e-002 | AC241: -4.36e-002 | AD241: -8.8499999999999995e-002 | AE241: -9.0299999999999991e-002 | AF241: 82.57 | AG241: 83.82 | AH241: 0.93 | AI241: AA- | AJ241: 6.59e-002 | AK241: =I241+100*T241 -> 141.88 | AL241: 139.8 | AM241: 186 | AN241: 56 | AO241: 226 | AP241: -3.3000000000000002e-002 | AQ241: 9 | AR241: 天铁转债
A242: 223 | B242: 寒锐转债!! | C242: 123017 | D242: 43458. | E242: 寒锐钴业 | F242: 300618 | G242: 有色金属 | H242: 小金属 | I242: 130.461 | J242: -1.8e-003 | K242: 1.11e-002 | L242: 70.01 | M242: 1.0700000000000001e-002 | N242: 166 | O242: 0.311 | P242: 110.8 | Q242: 57.4 | R242: 10.63 | S242: 121.97 | T242: 7.0000000000000007e-002 | U242: 转股中 | V242: 4.18年 | W242: 2.18年 | X242: 1.9e-002 | Y242: 2.3e-002 | Z242: 4 | AA242: 212 | AB242: -3.9e-002 | AC242: -4.3499999999999997e-002 | AD242: -9.5399999999999985e-002 | AE242: -9.7699999999999995e-002 | AF242: 89.34 | AG242: 85.83 | AH242: 0.87 | AI242: AA- | AJ242: 6.4399999999999999e-002 | AK242: =I242+100*T242 -> 137.46100000000001 | AL242: 139 | AM242: 178 | AN242: 49.6 | AO242: 188 | AP242: -5.5e-002 | AQ242: 14 | AR242: 寒锐转债!!
A243: 280 | B243: 国君转债! | C243: 113013 | D243: 42940. | E243: 国泰君安 | F243: 601211 | G243: 金融 | H243: 证券行业 | I243: 120.93 | J243: -5.0000000000000001e-003 | K243: 2.8999999999999998e-003 | L243: 18.33 | M243: -4.3e-003 | N243: 36 | O243: 4.0000000000000001e-003 | P243: 108.3 | Q243: 19.01 | R243: 1.35 | S243: 96.42 | T243: 0.254 | U243: 转股中 | V243: 2.81年 | W243: 无权 | X243: 4.2999999999999997e-002 | Y243: 4.0999999999999995e-002 | Z243: 70 | AA243: 1633. | AB243: -3.9100000000000003e-002 | AC243: -4.4299999999999999e-002 | AD243: 无权 | AE243: 无权 | AF243: 无权 | AG243: 97.92 | AH243: 0.5 | AI243: AAA | AJ243: 3.7100000000000001e-002 | AK243: =I243+100*T243 -> 146.33000000000001 | AL243: 145.4 | AM243: 228 | AN243: 47.5 | AO243: 173 | AP243: -4.7e-002 | AQ243: 13 | AR243: 国君转债!
A244: 275 | B244: 久立转2! | C244: 128019 | D244: 43070. | E244: 久立特材 | F244: 2318 | G244: 石油天然 | H244: 石油天然 | I244: 124.202 | J244: 5.6999999999999993e-003 | K244: 3.8e-003 | L244: 8.84 | M244: 1.26e-002 | N244: 3.6 | O244: 3.0000000000000001e-003 | P244: 109.8 | Q244: 7.62 | R244: 2.31 | S244: 116.01 | T244: 7.0999999999999994e-002 | U244: 转股中 | V244: 3年55天 | W244: 1年55天 | X244: 0.14000000000000001 | Y244: 0.16200000000000001 | Z244: 10 | AA244: 74 | AB244: -3.9100000000000003e-002 | AC244: -4.4500000000000005e-002 | AD244: -0.128 | AE244: -0.13100000000000001 | AF244: 97.02 | AG244: 96.32 | AH244: 0.75 | AI244: AA | AJ244: 4.3400000000000001e-002 | AK244: =I244+100*T244 -> 131.30199999999999 | AL244: 132.4 | AM244: 118 | AN244: 35.4 | AO244: 57 | AP244: -6.0000000000000001e-003 | AQ244: 13 | AR244: 久立转2!
A245: 117 | B245: 璞泰转债! | C245: 113562 | D245: 43865. | E245: 璞泰来 | F245: 603659 | G245: 电子 | H245: 元器件制 | I245: 134.41 | J245: 2.5899999999999999e-002 | K245: 3.73e-002 | L245: 103.46 | M245: 7.7699999999999991e-002 | N245: 24 | O245: 2.1000000000000001e-002 | P245: 113.3 | Q245: 82.73 | R245: 13.17 | S245: 125.06 | T245: 7.4999999999999997e-002 | U245: 转股中 | V245: 4.30年 | W245: 2.30年 | X245: 1.9e-002 | Y245: 2.4e-002 | Z245: 8.7 | AA245: 450 | AB245: -3.9399999999999998e-002 | AC245: -4.4600000000000001e-002 | AD245: -0.105 | AE245: -0.107 | AF245: 91.94 | AG245: 94.59 | AH245: 0.81 | AI245: AA | AJ245: 4.3400000000000001e-002 | AK245: =I245+100*T245 -> 141.91 | AL245: 143.8 | AM245: 212 | AN245: 49.2 | AO245: 186 | AP245: 2.9999999999999999e-002 | AQ245: 16 | AR245: 璞泰转债!
A246: 109 | B246: 奥佳转债! | C246: 128097 | D246: 43908. | E246: 奥佳华 | F246: 2614 | G246: 机械装备 | H246: 专用设备 | I246: 142.976 | J246: 1.9799999999999998e-002 | K246: -1.6299999999999999e-002 | L246: 15.11 | M246: 4.0000000000000001e-003 | N246: 135 | O246: 0.14499999999999999 | P246: 115.3 | Q246: 10.69 | R246: 2.48 | S246: 141.35 | T246: 1.2e-002 | U246: 转股中 | V246: 5.45年 | W246: 3.45年 | X246: 7.2000000000000008e-002 | Y246: 0.10199999999999999 | Z246: 6.6 | AA246: 91 | AB246: -3.9399999999999998e-002 | AC246: -4.41e-002 | AD246: -8.5500000000000007e-002 | AE246: -8.72e-002 | AF246: 88.71 | AG246: 91.19 | AH246: 0.88 | AI246: AA | AJ246: 4.4900000000000002e-002 | AK246: =I246+100*T246 -> 144.17599999999999 | AL246: 144.6 | AM246: 220 | AN246: 53.4 | AO246: 214 | AP246: -7.9000000000000001e-002 | AQ246: 28 | AR246: 奥佳转债!
A247: 141 | B247: 常汽转债! | C247: 113550 | D247: 43811. | E247: 常熟汽饰 | F247: 603035 | G247: 汽车 | H247: 零部件制 | I247: 149.59 | J247: 3.04e-002 | K247: -9.4999999999999998e-003 | L247: 14.12 | M247: 2.3199999999999998e-002 | N247: 29 | O247: 4.2000000000000003e-002 | P247: 121.8 | Q247: 9.65 | R247: 1.46 | S247: 146.32 | T247: 2.2000000000000002e-002 | U247: 转股中 | V247: 5.18年 | W247: 3.18年 | X247: 0.10400000000000001 | Y247: 0.153 | Z247: 4.6 | AA247: 44 | AB247: -3.9800000000000002e-002 | AC247: -4.6500000000000007e-002 | AD247: -0.10000000000000001 | AE247: -0.10199999999999999 | AF247: 84.86 | AG247: 88.28 | AH247: 0.9 | AI247: AA- | AJ247: 6.59e-002 | AK247: =I247+100*T247 -> 151.78999999999999 | AL247: 152.9 | AM247: 252 | AN247: 64.6 | AO247: 252 | AP247: -8.199999999999999e-002 | AQ247: 16 | AR247: 常汽转债!
A248: 81 | B248: 裕同转债 | C248: 128104 | D248: 43949. | E248: 裕同科技 | F248: 2831 | G248: 造纸包装 | H248: 包装材料 | I248: 145.08 | J248: 1.8100000000000002e-002 | K248: -7.4000000000000003e-003 | L248: 34.61 | M248: 1.2e-002 | N248: 66 | O248: 3.3000000000000002e-002 | P248: 115.3 | Q248: 23.24 | R248: 4.73 | S248: 148.92 | T248: -2.6000000000000002e-002 | U248: 29天 | V248: 5.56年 | W248: 3.56年 | X248: 4.5999999999999999e-002 | Y248: 6.9000000000000006e-002 | Z248: 14 | AA248: 304 | AB248: -4.1200000000000001e-002 | AC248: -4.5700000000000005e-002 | AD248: -8.6599999999999996e-002 | AE248: -8.8200000000000001e-002 | AF248: 88.89 | AG248: 91.7 | AH248: 0.89 | AI248: AA+ | AJ248: 4.2900000000000001e-002 | AK248: =I248+100*T248 -> 142.48000000000002 | AL248: 141.2 | AM248: 194 | AN248: 49.5 | AO248: 187 | AP248: -2.e-003 | AQ248: 7 | AR248: 裕同转债
A249: 252 | B249: 长证转债! | C249: 127005 | D249: 43201. | E249: 长江证券 | F249: 783 | G249: 金融 | H249: 证券行业 | I249: 126.55 | J249: -1.1999999999999999e-003 | K249: 7.0999999999999995e-003 | L249: 7.97 | M249: 8.8999999999999999e-003 | N249: 27 | O249: 4.0000000000000001e-003 | P249: 109.3 | Q249: 7.28 | R249: 1.63 | S249: 109.48 | T249: 0.156 | U249: 转股中 | V249: 3.49年 | W249: 无权 | X249: 0.113 | Y249: 0.124 | Z249: 50 | AA249: 441 | AB249: -4.1900000000000007e-002 | AC249: -4.6500000000000007e-002 | AD249: 无权 | AE249: 无权 | AF249: 无权 | AG249: 96.08 | AH249: 0.67 | AI249: AAA | AJ249: 3.8399999999999997e-002 | AK249: =I249+100*T249 -> 142.15000000000001 | AL249: 143.6 | AM249: 211 | AN249: 47.5 | AO249: 174 | AP249: -6.0999999999999999e-002 | AQ249: 16 | AR249: 长证转债!
A250: 31 | B250: 安20转债 | C250: 113592 | D250: 44043. | E250: 安井食品 | F250: 603345 | G250: 食品饮料 | H250: 食品饮料 | I250: 145.74 | J250: 2.2700000000000001e-002 | K250: -1.66e-002 | L250: 169.98 | M250: 6.8000000000000005e-003 | N250: 37 | O250: 2.8999999999999998e-002 | P250: 113.1 | Q250: 115.9 | R250: 13.12 | S250: 146.66 | T250: -6.0000000000000001e-003 | U250: 4月2天 | V250: 5.81年 | W250: 3.81年 | X250: 2.2000000000000002e-002 | Y250: 3.3000000000000002e-002 | Z250: 9 | AA250: 402 | AB250: -4.3299999999999998e-002 | AC250: -4.7100000000000003e-002 | AD250: -8.2699999999999996e-002 | AE250: -8.4199999999999997e-002 | AF250: 87.1 | AG250: 88.01 | AH250: 0.91 | AI250: AA | AJ250: 4.4900000000000002e-002 | AK250: =I250+100*T250 -> 145.14000000000001 | AL250: 144.8 | AM250: 222 | AN250: 56.8 | AO250: 232 | AP250: -1.7000000000000001e-002 | AQ250: 5 | AR250: 安20转债
A251: 285 | B251: 光大转债 | C251: 113011 | D251: 42934. | E251: 光大银行 | F251: 601818 | G251: 金融 | H251: 银行行业 | I251: 120.8 | J251: 5.9999999999999995e-004 | K251: -4.6999999999999993e-003 | L251: 3.72 | M251: -8.0000000000000002e-003 | N251: 155 | O251: 4.0000000000000001e-003 | P251: 108.3 | Q251: 3.76 | R251: 0.61 | S251: 98.94 | T251: 0.221 | U251: 转股中 | V251: 2.51年 | W251: 无权 | X251: 0.154 | Y251: 0.152 | Z251: 300 | AA251: 1953. | AB251: -4.3400000000000001e-002 | AC251: -4.9200000000000001e-002 | AD251: 无权 | AE251: 无权 | AF251: 无权 | AG251: 99.02 | AH251: 0.52 | AI251: AAA | AJ251: 3.7100000000000001e-002 | AK251: =I251+100*T251 -> 142.90000000000001 | AL251: 142.7 | AM251: 205 | AN251: 43.6 | AO251: 146 | AP251: -3.6000000000000004e-002 | AQ251: 15 | AR251: 光大转债
A252: 82 | B252: 瀚蓝转债 | C252: 110069 | D252: 43958. | E252: 瀚蓝环境 | F252: 600323 | G252: 城市公用 | H252: 三废处理 | I252: 146 | J252: 2.7000000000000001e-003 | K252: -9.5999999999999992e-003 | L252: 28.77 | M252: -7.6e-003 | N252: 30 | O252: 2.1000000000000001e-002 | P252: 113.5 | Q252: 20.2 | R252: 3.22 | S252: 142.43 | T252: 2.5000000000000001e-002 | U252: 29天 | V252: 5.56年 | W252: 3.56年 | X252: 4.4999999999999998e-002 | Y252: 6.4000000000000001e-002 | Z252: 9.9 | AA252: 220 | AB252: -4.4699999999999997e-002 | AC252: -4.8799999999999996e-002 | AD252: -9.1499999999999998e-002 | AE252: -9.2499999999999999e-002 | AF252: 87.5 | AG252: 90.1 | AH252: 0.9 | AI252: AA+ | AJ252: 4.2900000000000001e-002 | AK252: =I252+100*T252 -> 148.5 | AL252: 149.6 | AM252: 241 | AN252: 59.5 | AO252: 240 | AP252: -1.9e-002 | AQ252: 7 | AR252: 瀚蓝转债
A253: 145 | B253: 通光转债! | C253: 123034 | D253: 43797. | E253: 通光线缆 | F253: 300265 | G253: 通信互联 | H253: 通信设备 | I253: 149.365 | J253: -1.1599999999999999e-002 | K253: -2.3900000000000001e-002 | L253: 10.78 | M253: -3.9199999999999999e-002 | N253: 561 | O253: 3.3599999999999999 | P253: 118.5 | Q253: 7.97 | R253: 3.25 | S253: 135.26 | T253: 0.10400000000000001 | U253: 转股中 | V253: 5年51天 | W253: 3年51天 | X253: 2.8999999999999998e-002 | Y253: 4.0000000000000001e-002 | Z253: 1.1 | AA253: 39 | AB253: -4.4900000000000002e-002 | AC253: -5.0700000000000002e-002 | AD253: -0.10300000000000001 | AE253: -0.105 | AF253: 81.68 | AG253: 81.7 | AH253: 0.91 | AI253: A+ | AJ253: 7.690000000000001e-002 | AK253: =I253+100*T253 -> 159.76500000000001 | AL253: 163.5 | AM253: 265 | AN253: 81.8 | AO253: 269 | AP253: -8.5000000000000006e-002 | AQ253: 26 | AR253: 通光转债!
A254: 254 | B254: 艾华转债!! | C254: 113504 | D254: 43182. | E254: 艾华集团 | F254: 603989 | G254: 电子 | H254: 元器件制 | I254: 130 | J254: 1.72e-002 | K254: 2.3399999999999997e-002 | L254: 27.46 | M254: 4.7300000000000002e-002 | N254: 39 | O254: 5.5e-002 | P254: 110.3 | Q254: 21.13 | R254: 4.88 | S254: 129.96 | T254: 0. | U254: 转股中 | V254: 3.46年 | W254: 1.46年 | X254: 5.2000000000000005e-002 | Y254: 6.8000000000000005e-002 | Z254: 5.6 | AA254: 107 | AB254: -4.7199999999999999e-002 | AC254: -5.2300000000000006e-002 | AD254: -0.11900000000000001 | AE254: -0.121 | AF254: 95.98 | AG254: 95.49 | AH254: 0.86 | AI254: AA | AJ254: 4.3400000000000001e-002 | AK254: =I254+100*T254 -> 130. | AL254: 130 | AM254: 94 | AN254: 34.1 | AO254: 43 | AP254: -8.1000000000000003e-002 | AQ254: 9 | AR254: 艾华转债!!
A255: 63 | B255: 火炬转债 | C255: 113582 | D255: 44005. | E255: 火炬电子 | F255: 603678 | G255: 电子 | H255: 元器件制 | I255: 151.53 | J255: 1.5600000000000001e-002 | K255: -2.3e-003 | L255: 37.26 | M255: 1.47e-002 | N255: 19 | O255: 2.1000000000000001e-002 | P255: 115.3 | Q255: 25.33 | R255: 5.08 | S255: 147.1 | T255: 2.9999999999999999e-002 | U255: 2月19天 | V255: 5.70年 | W255: 3.70年 | X255: 3.6000000000000004e-002 | Y255: 5.2000000000000005e-002 | Z255: 6 | AA255: 169 | AB255: -4.7599999999999996e-002 | AC255: -5.2000000000000005e-002 | AD255: -9.4e-002 | AE255: -9.5500000000000002e-002 | AF255: 87.73 | AG255: 90.2 | AH255: 0.9 | AI255: AA | AJ255: 4.4900000000000002e-002 | AK255: =I255+100*T255 -> 154.53 | AL255: 156 | AM255: 258 | AN255: 65.8 | AO255: 257 | AP255: -7.0000000000000007e-002 | AQ255: 4 | AR255: 火炬转债
A256: 272 | B256: 国祯转债! | C256: 123002 | D256: 43094. | E256: 国祯环保 | F256: 300388 | G256: 城市公用 | H256: 三废处理 | I256: 128.4 | J256: 9.3999999999999986e-003 | K256: 1.4800000000000001e-002 | L256: 10.66 | M256: 2.8999999999999998e-002 | N256: 15 | O256: 4.2000000000000003e-002 | P256: 109.8 | Q256: 8.48 | R256: 2.06 | S256: 125.71 | T256: 2.1000000000000001e-002 | U256: 转股中 | V256: 3.20年 | W256: 1.20年 | X256: 3.9e-002 | Y256: 4.9000000000000002e-002 | Z256: 2.8 | AA256: 73 | AB256: -4.87e-002 | AC256: -5.4000000000000006e-002 | AD256: -0.14199999999999999 | AE256: -0.14499999999999999 | AF256: 96.84 | AG256: 96.14 | AH256: 0.84 | AI256: AA | AJ256: 4.3400000000000001e-002 | AK256: =I256+100*T256 -> 130.5 | AL256: 131.1 | AM256: 99 | AN256: 34.3 | AO256: 47 | AP256: -2.3e-002 | AQ256: 12 | AR256: 国祯转债!
A257: 6 | B257: 隆20转债 | C257: 113038 | D257: 44082. | E257: 隆基股份 | F257: 601012 | G257: 能源电力 | H257: 太阳能 | I257: 149.69 | J257: 6.6900000000000001e-002 | K257: 1.11e-002 | L257: 69.82 | M257: 9.2499999999999999e-002 | N257: 1470. | O257: 0.20199999999999999 | P257: 111.8 | Q257: 52.77 | R257: 8.49 | S257: 132.31 | T257: 0.13100000000000001 | U257: 4月25天 | V257: 5.88年 | W257: 3.88年 | X257: 1.9e-002 | Y257: 2.5000000000000001e-002 | Z257: 50 | AA257: 2634. | AB257: -4.9100000000000005e-002 | AC257: -5.2499999999999998e-002 | AD257: -8.8100000000000012e-002 | AE257: -8.9499999999999996e-002 | AF257: 88.28 | AG257: 89.16 | AH257: 0.84 | AI257: AAA | AJ257: 3.9900000000000005e-002 | AK257: =I257+100*T257 -> 162.78999999999999 | AL257: 167.1 | AM257: 268 | AN257: 77.9 | AO257: 266 | AP257: 0.153 | AQ257: 9 | AR257: 隆20转债
A258: 42 | B258: 巨星转债 | C258: 128115 | D258: 44028. | E258: 巨星科技 | F258: 2444 | G258: 机械装备 | H258: 通用设备 | I258: 153.92 | J258: 2.4399999999999998e-002 | K258: 1.9e-002 | L258: 19.77 | M258: 4.6600000000000003e-002 | N258: 79 | O258: 5.2999999999999999e-002 | P258: 115.3 | Q258: 12.28 | R258: 2.62 | S258: 160.99 | T258: -4.4000000000000004e-002 | U258: 3月22天 | V258: 5.78年 | W258: 3.78年 | X258: 4.5999999999999999e-002 | Y258: 7.400000000000001e-002 | Z258: 9.7 | AA258: 213 | AB258: -4.9599999999999998e-002 | AC258: -5.3899999999999997e-002 | AD258: -8.9900000000000008e-002 | AE258: -9.2600000000000002e-002 | AF258: 89.71 | AG258: 89.9 | AH258: 0.93 | AI258: AA | AJ258: 4.4900000000000002e-002 | AK258: =I258+100*T258 -> 149.51999999999998 | AL258: 146.8 | AM258: 235 | AN258: 56.9 | AO258: 233 | AP258: -8.5999999999999993e-002 | AQ258: 4 | AR258: 巨星转债
A259: 62 | B259: 福莱转债 | C259: 113035 | D259: 43999. | E259: 福莱特 | F259: 601865 | G259: 能源电力 | H259: 太阳能 | I259: 160.2 | J259: 9.1499999999999998e-002 | K259: -4.0000000000000001e-003 | L259: 21.9 | M259: 9.5000000000000001e-002 | N259: 249 | O259: 0.11199999999999999 | P259: 120.3 | Q259: 13.56 | R259: 8.57 | S259: 161.5 | T259: -8.0000000000000002e-003 | U259: 2月20天 | V259: 5.70年 | W259: 3.70年 | X259: 3.4000000000000002e-002 | Y259: 5.5e-002 | Z259: 15 | AA259: 428 | AB259: -4.9800000000000004e-002 | AC259: -5.5399999999999998e-002 | AD259: -0.10300000000000001 | AE259: -0.105 | AF259: 87.73 | AG259: 94.09 | AH259: 0.92 | AI259: AA | AJ259: 4.4900000000000002e-002 | AK259: =I259+100*T259 -> 159.39999999999998 | AL259: 158.9 | AM259: 262 | AN259: 64.8 | AO259: 254 | AP259: -5.4000000000000006e-002 | AQ259: 4 | AR259: 福莱转债
A260: 93 | B260: 博特转债 | C260: 113571 | D260: 43922. | E260: 苏博特 | F260: 603916 | G260: 建筑 | H260: 水泥 | I260: 162.25 | J260: 1.5300000000000001e-002 | K260: -4.7999999999999996e-003 | L260: 31.83 | M260: 1.11e-002 | N260: 26 | O260: 2.4e-002 | P260: 120.8 | Q260: 18.88 | R260: 4 | S260: 168.59 | T260: -3.7999999999999999e-002 | U260: 4.4天 | V260: 5.49年 | W260: 3.49年 | X260: 7.0999999999999994e-002 | Y260: 0.11900000000000001 | Z260: 7 | AA260: 99 | AB260: -5.33e-002 | AC260: -5.9200000000000003e-002 | AD260: -0.11199999999999999 | AE260: -0.113 | AF260: 82.69 | AG260: 85.75 | AH260: 0.95 | AI260: AA- | AJ260: 6.59e-002 | AK260: =I260+100*T260 -> 158.44999999999999 | AL260: 155.9 | AM260: 257 | AN260: 70.2 | AO260: 263 | AP260: -8.5999999999999993e-002 | AQ260: 14 | AR260: 博特转债
A261: 180 | B261: 一心转债! | C261: 128067 | D261: 43602. | E261: 一心堂 | F261: 2727 | G261: 医药 | H261: 医药商业 | I261: 145.201 | J261: 3.7100000000000001e-002 | K261: 3.7000000000000002e-003 | L261: 39.25 | M261: 4.0800000000000003e-002 | N261: 116 | O261: 0.184 | P261: 112.9 | Q261: 26.83 | R261: 4.69 | S261: 146.29 | T261: -6.9999999999999993e-003 | U261: 转股中 | V261: 4.60年 | W261: 2.60年 | X261: 2.e-002 | Y261: 2.8999999999999998e-002 | Z261: 4.4 | AA261: 225 | AB261: -5.4199999999999998e-002 | AC261: -5.8799999999999998e-002 | AD261: -0.115 | AE261: -0.11699999999999999 | AF261: 92.06 | AG261: 93.24 | AH261: 1 | AI261: AA | AJ261: 4.3400000000000001e-002 | AK261: =I261+100*T261 -> 144.501 | AL261: 144.1 | AM261: 214 | AN261: 50.9 | AO261: 193 | AP261: 2.5000000000000001e-002 | AQ261: 18 | AR261: 一心转债!
A262: 167 | B262: 欧派转债! | C262: 113543 | D262: 43712. | E262: 欧派家居 | F262: 603833 | G262: 其他 | H262: 家居用品 | I262: 151.14 | J262: 1.67e-002 | K262: -8.3999999999999995e-003 | L262: 108.48 | M262: 9.1000000000000004e-003 | N262: 135 | O262: 8.4000000000000005e-002 | P262: 114.9 | Q262: 71.69 | R262: 4.91 | S262: 151.32 | T262: -1.e-003 | U262: 转股中 | V262: 4.92年 | W262: 3.92年 | X262: 1.7000000000000001e-002 | Y262: 2.5000000000000001e-002 | Z262: 11 | AA262: 638 | AB262: -5.5099999999999996e-002 | AC262: -5.9999999999999998e-002 | AD262: -8.5800000000000001e-002 | AE262: -8.7799999999999989e-002 | AF262: 88.67 | AG262: 93.58 | AH262: 0.91 | AI262: AA | AJ262: 4.3400000000000001e-002 | AK262: =I262+100*T262 -> 151.03999999999999 | AL262: 151 | AM262: 245 | AN262: 57.4 | AO262: 234 | AP262: 4.2000000000000003e-002 | AQ262: 15 | AR262: 欧派转债!
A263: 265 | B263: 赣锋转债!! | C263: 128028 | D263: 43119. | E263: 赣锋锂业 | F263: 2460 | G263: 有色金属 | H263: 小金属 | I263: 131.3 | J263: 1.e-002 | K263: -3.3e-003 | L263: 47.17 | M263: 6.8000000000000005e-003 | N263: 17 | O263: 1.3999999999999999e-002 | P263: 109.3 | Q263: 41.98 | R263: 7.58 | S263: 112.36 | T263: 0.16899999999999998 | U263: 转股中 | V263: 3.27年 | W263: 1.27年 | X263: 1.4999999999999999e-002 | Y263: 1.7000000000000001e-002 | Z263: 9.2 | AA263: 610 | AB263: -5.5399999999999998e-002 | AC263: -6.0199999999999997e-002 | AD263: -0.14800000000000002 | AE263: -0.14999999999999999 | AF263: 96.05 | AG263: 95.35 | AH263: 0.98 | AI263: AA | AJ263: 4.3400000000000001e-002 | AK263: =I263+100*T263 -> 148.20000000000002 | AL263: 150.2 | AM263: 242 | AN263: 54.2 | AO263: 219 | AP263: -8.6999999999999994e-002 | AQ263: 14 | AR263: 赣锋转债!!
A264: 177 | B264: 中环转债! | C264: 123026 | D264: 43647. | E264: 中环环保 | F264: 300692 | G264: 城市公用 | H264: 三废处理 | I264: 138 | J264: 2.07e-002 | K264: -1.09e-002 | L264: 16.63 | M264: 1.09e-002 | N264: 167 | O264: 0.77099999999999991 | P264: 110.6 | Q264: 12.25 | R264: 2.93 | S264: 135.76 | T264: 1.7000000000000001e-002 | U264: 转股中 | V264: 3.74年 | W264: 1.74年 | X264: 5.7999999999999996e-002 | Y264: 7.8e-002 | Z264: 1.6 | AA264: 28 | AB264: -5.8499999999999996e-002 | AC264: -6.3200000000000006e-002 | AD264: -0.11900000000000001 | AE264: -0.121 | AF264: 91.32 | AG264: 87.98 | AH264: 0.9 | AI264: AA- | AJ264: 6.4399999999999999e-002 | AK264: =I264+100*T264 -> 139.69999999999999 | AL264: 140.2 | AM264: 189 | AN264: 48.9 | AO264: 182 | AP264: -2.1000000000000001e-002 | AQ264: 29 | AR264: 中环转债!
A265: 235 | B265: 凯发转债! | C265: 123014 | D265: 43333. | E265: 凯发电气 | F265: 300407 | G265: 能源电力 | H265: 电力设备 | I265: 130.7 | J265: 5.5000000000000005e-003 | K265: 6.6e-003 | L265: 8.85 | M265: 1.61e-002 | N265: 78 | O265: 0.51500000000000001 | P265: 108.5 | Q265: 8.12 | R265: 2.05 | S265: 108.99 | T265: 0.19899999999999998 | U265: 转股中 | V265: 2.87年 | W265: 0.87年 | X265: 4.2999999999999997e-002 | Y265: 4.7e-002 | Z265: 1.2 | AA265: 27 | AB265: -6.3500000000000001e-002 | AC265: -6.8600000000000008e-002 | AD265: -0.217 | AE265: -0.21899999999999997 | AF265: 94.05 | AG265: 88.61 | AH265: 0.76 | AI265: A+ | AJ265: 7.4099999999999999e-002 | AK265: =I265+100*T265 -> 150.59999999999999 | AL265: 152.4 | AM265: 251 | AN265: 58.4 | AO265: 237 | AP265: -3.9e-002 | AQ265: 14 | AR265: 凯发转债!
A266: 53 | B266: 上机转债 | C266: 113586 | D266: 44019. | E266: 上机数控 | F266: 603185 | G266: 机械装备 | H266: 专用设备 | I266: 180.3 | J266: 7.6100000000000001e-002 | K266: 1.66e-002 | L266: 65.7 | M266: 9.5899999999999999e-002 | N266: 239 | O266: 0.21199999999999999 | P266: 120.8 | Q266: 33.31 | R266: 8.41 | S266: 197.24 | T266: -8.5999999999999993e-002 | U266: 3月2天 | V266: 5.74年 | W266: 3.74年 | X266: 4.4000000000000004e-002 | Y266: 8.5999999999999993e-002 | Z266: 6.7 | AA266: 153 | AB266: -6.8600000000000008e-002 | AC266: -7.4099999999999999e-002 | AD266: -0.127 | AE266: -0.128 | AF266: 81.42 | AG266: 84.43 | AH266: 0.97 | AI266: AA- | AJ266: 6.59e-002 | AK266: =I266+100*T266 -> 171.70000000000002 | AL266: 163.4 | AM266: 264 | AN266: 78.9 | AO266: 267 | AP266: -1.e-003 | AQ266: 7 | AR266: 上机转债
A267: 48 | B267: 歌尔转2 | C267: 128112 | D267: 44025. | E267: 歌尔股份 | F267: 2241 | G267: 电子 | H267: 电子产品 | I267: 175.89 | J267: 5.2499999999999998e-002 | K267: 2.5699999999999997e-002 | L267: 42.2 | M267: 8.2100000000000006e-002 | N267: 860 | O267: 0.125 | P267: 114.5 | Q267: 23.27 | R267: 8.47 | S267: 181.35 | T267: -2.9999999999999999e-002 | U267: 3月5天 | V267: 5.74年 | W267: 3.74年 | X267: 2.8999999999999998e-002 | Y267: 5.2999999999999999e-002 | Z267: 40 | AA267: 1369. | AB267: -7.2900000000000006e-002 | AC267: -7.690000000000001e-002 | AD267: -0.12300000000000001 | AE267: -0.124 | AF267: 87.48 | AG267: 90.27 | AH267: 0.95 | AI267: AA+ | AJ267: 4.2900000000000001e-002 | AK267: =I267+100*T267 -> 172.88999999999999 | AL267: 170.4 | AM267: 270 | AN267: 80.2 | AO267: 268 | AP267: 2.e-002 | AQ267: 16 | AR267: 歌尔转2
A268: 175 | B268: 蓝晓转债! | C268: 123027 | D268: 43650. | E268: 蓝晓科技 | F268: 300487 | G268: 化工 | H268: 化工 | I268: 170.492 | J268: 1.0800000000000001e-002 | K268: 5.5000000000000005e-003 | L268: 49.98 | M268: 1.6299999999999999e-002 | N268: 131 | O268: 0.69099999999999995 | P268: 119.5 | Q268: 29.33 | R268: 7.55 | S268: 170.41 | T268: 1.e-003 | U268: 转股中 | V268: 4.74年 | W268: 2.74年 | X268: 1.1000000000000001e-002 | Y268: 1.8000000000000002e-002 | Z268: 1.1 | AA268: 105 | AB268: -7.3700000000000002e-002 | AC268: -8.0000000000000002e-002 | AD268: -0.10300000000000001 | AE268: -0.105 | AF268: 84.73 | AG268: 85.39 | AH268: 1 | AI268: A+ | AJ268: 7.5399999999999995e-002 | AK268: =I268+100*T268 -> 170.59199999999998 | AL268: 170.6 | AM268: 271 | AN268: 85.2 | AO268: 270 | AP268: 9.8000000000000004e-002 | AQ268: 22 | AR268: 蓝晓转债!
A269: 115 | B269: 希望转债! | C269: 127015 | D269: 43865. | E269: 新 希 望 | F269: 876 | G269: 农业 | H269: 畜牧业 | I269: 164.6 | J269: -2.3e-003 | K269: -2.5999999999999999e-003 | L269: 32.2 | M269: -4.8999999999999998e-003 | N269: 180 | O269: 5.5999999999999994e-002 | P269: 110.2 | Q269: 19.63 | R269: 4.68 | S269: 164.03 | T269: 3.0000000000000001e-003 | U269: 转股中 | V269: 5.31年 | W269: 3.31年 | X269: 1.3999999999999999e-002 | Y269: 2.3e-002 | Z269: 19 | AA269: 1387. | AB269: -7.3800000000000004e-002 | AC269: -7.690000000000001e-002 | AD269: -0.124 | AE269: -0.125 | AF269: 89.89 | AG269: 89.84 | AH269: 1 | AI269: AAA | AJ269: 3.9900000000000005e-002 | AK269: =I269+100*T269 -> 164.90000000000001 | AL269: 165.2 | AM269: 266 | AN269: 75.3 | AO269: 264 | AP269: -0.11800000000000001 | AQ269: 30 | AR269: 希望转债!
A270: 249 | B270: 金农转债!! | C270: 128036 | D270: 43192. | E270: 金新农 | F270: 2548 | G270: 农业 | H270: 畜牧业 | I270: 145.491 | J270: -1.83e-002 | K270: 2.6099999999999998e-002 | L270: 9.07 | M270: 7.8000000000000005e-003 | N270: 471 | O270: 2.2000000000000002 | P270: 110.3 | Q270: 7.39 | R270: 2.58 | S270: 122.73 | T270: 0.185 | U270: 转股中 | V270: 3.48年 | W270: 1.48年 | X270: 2.8999999999999998e-002 | Y270: 3.5000000000000003e-002 | Z270: 1.5 | AA270: 51 | AB270: -7.7800000000000008e-002 | AC270: -8.2500000000000004e-002 | AD270: -0.16500000000000001 | AE270: -0.16699999999999998 | AF270: 92.82 | AG270: 89.15 | AH270: 1 | AI270: AA- | AJ270: 6.4399999999999999e-002 | AK270: =I270+100*T270 -> 163.99100000000001 | AL270: 168.2 | AM270: 269 | AN270: 75.4 | AO270: 265 | AP270: -0.14699999999999999 | AQ270: 16 | AR270: 金农转债!!
A271: 89 | B271: 海大转债 | C271: 128102 | D271: 43937. | E271: 海大集团 | F271: 2311 | G271: 农业 | H271: 畜牧业 | I271: 179.52 | J271: 2.12e-002 | K271: -1.6299999999999999e-002 | L271: 62.97 | M271: 5.1000000000000004e-003 | N271: 199 | O271: 4.0000000000000001e-002 | P271: 114.1 | Q271: 34.74 | R271: 10.13 | S271: 181.26 | T271: -1.e-002 | U271: 11天 | V271: 5.51年 | W271: 4.51年 | X271: 2.7999999999999997e-002 | Y271: 5.2000000000000005e-002 | Z271: 28 | AA271: 995 | AB271: -7.9899999999999999e-002 | AC271: -8.3900000000000002e-002 | AD271: -0.10300000000000001 | AE271: -0.10400000000000001 | AF271: 85.99 | AG271: 90.83 | AH271: 0.96 | AI271: AA+ | AJ271: 4.2900000000000001e-002 | AK271: =I271+100*T271 -> 178.52000000000001 | AL271: 177.8 | AM271: 272 | AN271: 87 | AO271: 273 | AP271: -8.6999999999999994e-002 | AQ271: 12 | AR271: 海大转债
A272: 278 | B272: 金禾转债!! | C272: 128017 | D272: 43066. | E272: 金禾实业 | F272: 2597 | G272: 化工 | H272: 化工 | I272: 144.321 | J272: 1.2800000000000001e-002 | K272: -9.1000000000000004e-003 | L272: 32.2 | M272: 4.0999999999999995e-003 | N272: 58 | O272: 7.2000000000000008e-002 | P272: 109.8 | Q272: 22.42 | R272: 4.1 | S272: 143.62 | T272: 5.0000000000000001e-003 | U272: 转股中 | V272: 3年48天 | W272: 1年48天 | X272: 3.1e-002 | Y272: 4.4999999999999998e-002 | Z272: 5.6 | AA272: 180 | AB272: -8.5099999999999995e-002 | AC272: -9.01e-002 | AD272: -0.217 | AE272: -0.21899999999999997 | AF272: 97.1 | AG272: 96.39 | AH272: 0.91 | AI272: AA | AJ272: 4.3400000000000001e-002 | AK272: =I272+100*T272 -> 144.821 | AL272: 145 | AM272: 225 | AN272: 47.9 | AO272: 176 | AP272: -8.3000000000000004e-002 | AQ272: 11 | AR272: 金禾转债!!
A273: 211 | B273: 尚荣转债! | C273: 128053 | D273: 43531. | E273: 尚荣医疗 | F273: 2551 | G273: 医药 | H273: 医疗器械 | I273: 169.52 | J273: -1.34e-002 | K273: 2.3300000000000001e-002 | L273: 7.1 | M273: 1.e-002 | N273: 137 | O273: 0.41999999999999998 | P273: 114.9 | Q273: 4.89 | R273: 1.99 | S273: 145.19 | T273: 0.16800000000000001 | U273: 转股中 | V273: 4.42年 | W273: 2.42年 | X273: 3.3000000000000002e-002 | Y273: 4.8000000000000001e-002 | Z273: 1.9 | AA273: 58 | AB273: -8.5699999999999998e-002 | AC273: -9.0899999999999995e-002 | AD273: -0.12300000000000001 | AE273: -0.124 | AF273: 92.75 | AG273: 95.6 | AH273: 1 | AI273: AA | AJ273: 4.3400000000000001e-002 | AK273: =I273+100*T273 -> 186.32000000000002 | AL273: 193.8 | AM273: 276 | AN273: 98.2 | AO273: 275 | AP273: -0.105 | AQ273: 27 | AR273: 尚荣转债!
A274: 293 | B274: 电气转债! | C274: 113008 | D274: 42051. | E274: 上海电气 | F274: 601727 | G274: 能源电力 | H274: 电力设备 | I274: 110.37 | J274: -3.4000000000000002e-003 | K274: 4.1999999999999997e-003 | L274: 5.31 | M274: 1.9e-003 | N274: 48 | O274: 1.e-002 | P274: 106.6 | Q274: 5.13 | R274: 1.24 | S274: 103.51 | T274: 6.6000000000000003e-002 | U274: 转股中 | V274: 0.39年 | W274: 回售中 | X274: 5.5e-002 | Y274: 5.7000000000000002e-002 | Z274: 44 | AA274: 805 | AB274: -8.5800000000000001e-002 | AC274: -0.115 | AD274: 回售中 | AE274: 回售中 | AF274: 103 | AG274: 105.23 | AH274: 0.42 | AI274: AAA | AJ274: 3.4000000000000002e-002 | AK274: =I274+100*T274 -> 116.97 | AL274: 117.2 | AM274: 6 | AN274: 12 | AO274: 1 | AP274: -5.7999999999999996e-002 | AQ274: 28 | AR274: 电气转债!
A275: 232 | B275: 蓝盾转债!! | C275: 123015 | D275: 43356. | E275: 蓝盾股份 | F275: 300297 | G275: 计算机及 | H275: 软件开发 | I275: 164.1 | J275: 1.9199999999999998e-002 | K275: 1.0700000000000001e-002 | L275: 5.09 | M275: 6.93e-002 | N275: 1341. | O275: 8.2300000000000004 | P275: 112.3 | Q275: 5.79 | R275: 1.69 | S275: 87.91 | T275: 0.86699999999999999 | U275: 转股中 | V275: 3.91年 | W275: 1.91年 | X275: 1.6e-002 | Y275: 1.3999999999999999e-002 | Z275: 1 | AA275: 64 | AB275: -9.3699999999999992e-002 | AC275: -9.8699999999999996e-002 | AD275: -0.158 | AE275: -0.159 | AF275: 94.16 | AG275: 95.38 | AH275: 0.43 | AI275: AA | AJ275: 4.3400000000000001e-002 | AK275: =I275+100*T275 -> 250.80000000000001 | AL275: 240.3 | AM275: 283 | AN275: 144.9 | AO275: 283 | AP275: 1.4999999999999999e-002 | AQ275: 18 | AR275: 蓝盾转债!!
A276: 213 | B276: 联泰转债! | C276: 113526 | D276: 43514. | E276: 联泰环保 | F276: 603797 | G276: 城市公用 | H276: 三废处理 | I276: 170.44 | J276: -2.8399999999999998e-002 | K276: 2.53e-002 | L276: 8.62 | M276: -3.4999999999999996e-003 | N276: 31 | O276: 9.3000000000000013e-002 | P276: 110.8 | Q276: 6.11 | R276: 1.82 | S276: 141.08 | T276: 0.20800000000000002 | U276: 转股中 | V276: 4.36年 | W276: 2.36年 | X276: 5.0000000000000003e-002 | Y276: 7.0999999999999994e-002 | Z276: 1.9 | AA276: 39 | AB276: -9.5600000000000004e-002 | AC276: -9.9499999999999991e-002 | AD276: -0.129 | AE276: -0.13 | AF276: 92.88 | AG276: 92.42 | AH276: 0.88 | AI276: AA | AJ276: 4.3400000000000001e-002 | AK276: =I276+100*T276 -> 191.24000000000001 | AL276: 199.8 | AM276: 277 | AN276: 106.9 | AO276: 277 | AP276: -6.4000000000000001e-002 | AQ276: 7 | AR276: 联泰转债!
A277: 200 | B277: 长信转债!! | C277: 123022 | D277: 43565. | E277: 长信科技 | F277: 300088 | G277: 通信互联 | H277: 通信设备 | I277: 179.751 | J277: 1.89e-002 | K277: -1.1999999999999999e-003 | L277: 11 | M277: 1.8500000000000003e-002 | N277: 202 | O277: 0.373 | P277: 114.9 | Q277: 6.15 | R277: 4.1 | S277: 178.86 | T277: 5.0000000000000001e-003 | U277: 转股中 | V277: 4.51年 | W277: 2.51年 | X277: 1.1000000000000001e-002 | Y277: 2.e-002 | Z277: 3.1 | AA277: 268 | AB277: -9.6000000000000002e-002 | AC277: -0.10099999999999999 | AD277: -0.129 | AE277: -0.13 | AF277: 92.4 | AG277: 95.24 | AH277: 0.96 | AI277: AA | AJ277: 4.3400000000000001e-002 | AK277: =I277+100*T277 -> 180.251 | AL277: 180.6 | AM277: 274 | AN277: 85.4 | AO277: 271 | AP277: -6.8000000000000005e-002 | AQ277: 12 | AR277: 长信转债!!
A278: 64 | B278: 龙蟠转债 | C278: 113581 | D278: 43970. | E278: 龙蟠科技 | F278: 603906 | G278: 化工 | H278: 化工 | I278: 241.41 | J278: 1.44e-002 | K278: -2.9600000000000001e-002 | L278: 25.05 | M278: -1.5700000000000002e-002 | N278: 200 | O278: 0.20899999999999999 | P278: 129.6 | Q278: 9.48 | R278: 5.37 | S278: 264.24 | T278: -8.5999999999999993e-002 | U278: 45天 | V278: 5.61年 | W278: 3.61年 | X278: 5.2999999999999999e-002 | Y278: 0.13900000000000001 | Z278: 4 | AA278: 76 | AB278: -0.107 | AC278: -0.115 | AD278: -0.10199999999999999 | AE278: -0.10300000000000001 | AF278: 81.01 | AG278: 86.65 | AH278: 0.97 | AI278: A+ | AJ278: 7.690000000000001e-002 | AK278: =I278+100*T278 -> 232.81 | AL278: 218.6 | AM278: 281 | AN278: 131.9 | AO278: 282 | AP278: -0.122 | AQ278: 14 | AR278: 龙蟠转债
A279: 226 | B279: 科森转债!! | C279: 113521 | D279: 43441. | E279: 科森科技 | F279: 603626 | G279: 通信互联 | H279: 通信设备 | I279: 188.53 | J279: 8.6999999999999994e-002 | K279: -2.5999999999999999e-003 | L279: 16.5 | M279: 8.8399999999999992e-002 | N279: 906 | O279: 6.3799999999999999 | P279: 115.2 | Q279: 8.7 | R279: 3.83 | S279: 189.66 | T279: -6.0000000000000001e-003 | U279: 转股中 | V279: 4.17年 | W279: 2.17年 | X279: 1.e-002 | Y279: 1.8000000000000002e-002 | Z279: 0.8 | AA279: 80 | AB279: -0.113 | AC279: -0.11900000000000001 | AD279: -0.16500000000000001 | AE279: -0.16600000000000001 | AF279: 93.85 | AG279: 96.88 | AH279: 0.96 | AI279: AA | AJ279: 4.3400000000000001e-002 | AK279: =I279+100*T279 -> 187.93000000000001 | AL279: 187.4 | AM279: 275 | AN279: 90.5 | AO279: 274 | AP279: 7.0000000000000007e-002 | AQ279: 25 | AR279: 科森转债!!
A280: 215 | B280: 溢利转债! | C280: 123018 | D280: 43488. | E280: 溢多利 | F280: 300381 | G280: 医药 | H280: 原料药 | I280: 191.505 | J280: 5.3e-003 | K280: 4.4000000000000003e-003 | L280: 13.96 | M280: 1.01e-002 | N280: 21 | O280: 0.20399999999999999 | P280: 114.9 | Q280: 8.29 | R280: 2.42 | S280: 168.4 | T280: 0.13699999999999998 | U280: 转股中 | V280: 4.27年 | W280: 2.27年 | X280: 8.0000000000000002e-003 | Y280: 1.3999999999999999e-002 | Z280: 0.5 | AA280: 67 | AB280: -0.115 | AC280: -0.12 | AD280: -0.159 | AE280: -0.16 | AF280: 88.98 | AG280: 88.55 | AH280: 0.95 | AI280: AA- | AJ280: 6.4399999999999999e-002 | AK280: =I280+100*T280 -> 205.20499999999998 | AL280: 214.6 | AM280: 279 | AN280: 125.6 | AO280: 281 | AP280: -2.3e-002 | AQ280: 13 | AR280: 溢利转债!
A281: 161 | B281: 晶瑞转债! | C281: 123031 | D281: 43734. | E281: 晶瑞股份 | F281: 300655 | G281: 化工 | H281: 化工 | I281: 226.3 | J281: 9.300000000000001e-003 | K281: 9.7000000000000003e-003 | L281: 33.65 | M281: 1.9699999999999999e-002 | N281: 229 | O281: 1.6200000000000001 | P281: 115.8 | Q281: 18.53 | R281: 5.07 | S281: 181.6 | T281: 0.24600000000000002 | U281: 转股中 | V281: 4.96年 | W281: 2.96年 | X281: 1.e-002 | Y281: 1.8000000000000002e-002 | Z281: 0.6 | AA281: 64 | AB281: -0.128 | AC281: -0.13300000000000001 | AD281: -0.13300000000000001 | AE281: -0.13400000000000001 | AF281: 82.47 | AG281: 81.29 | AH281: 0.97 | AI281: A+ | AJ281: 7.5399999999999995e-002 | AK281: =I281+100*T281 -> 250.90000000000001 | AL281: 271 | AM281: 285 | AN281: 188.5 | AO281: 287 | AP281: -9.8000000000000004e-002 | AQ281: 14 | AR281: 晶瑞转债!
A282: 228 | B282: 百合转债! | C282: 113520 | D282: 43430. | E282: 梦百合 | F282: 603313 | G282: 其他 | H282: 家居用品 | I282: 204.21 | J282: 2.2499999999999999e-002 | K282: 7.4999999999999997e-003 | L282: 28.42 | M282: 3.0800000000000001e-002 | N282: 223 | O282: 1.6699999999999999 | P282: 115.2 | Q282: 14.28 | R282: 3.77 | S282: 199.02 | T282: 2.6000000000000002e-002 | U282: 转股中 | V282: 4年55天 | W282: 2年55天 | X282: 6.9999999999999993e-003 | Y282: 1.3000000000000001e-002 | Z282: 0.7 | AA282: 98 | AB282: -0.13100000000000001 | AC282: -0.13600000000000001 | AD282: -0.183 | AE282: -0.184 | AF282: 89.75 | AG282: 89.45 | AH282: 0.97 | AI282: AA- | AJ282: 6.4399999999999999e-002 | AK282: =I282+100*T282 -> 206.81 | AL282: 209.4 | AM282: 278 | AN282: 119.6 | AO282: 278 | AP282: -8.3000000000000004e-002 | AQ282: 11 | AR282: 百合转债!
A283: 240 | B283: 盛路转债!! | C283: 128041 | D283: 43326. | E283: 盛路通信 | F283: 2446 | G283: 通信互联 | H283: 通信设备 | I283: 198 | J283: 3.61e-002 | K283: 1.8200000000000001e-002 | L283: 8.35 | M283: 5.4299999999999994e-002 | N283: 818 | O283: 7.9800000000000004 | P283: 114.3 | Q283: 6.85 | R283: 2.64 | S283: 121.9 | T283: 0.624 | U283: 转股中 | V283: 3.84年 | W283: 1.84年 | X283: 6.9999999999999993e-003 | Y283: 9.0000000000000011e-003 | Z283: 0.5 | AA283: 75 | AB283: -0.13500000000000001 | AC283: -0.14099999999999999 | AD283: -0.214 | AE283: -0.215 | AF283: 94.46 | AG283: 97.38 | AH283: 1 | AI283: AA | AJ283: 4.3400000000000001e-002 | AK283: =I283+100*T283 -> 260.39999999999998 | AL283: 274.1 | AM283: 286 | AN283: 176.7 | AO283: 285 | AP283: 6.4000000000000001e-002 | AQ283: 12 | AR283: 盛路转债!!
A284: 282 | B284: 模塑转债!! | C284: 127004 | D284: 42963. | E284: 模塑科技 | F284: 700 | G284: 汽车 | H284: 零部件制 | I284: 172.7 | J284: 1.8799999999999997e-002 | K284: -1.6799999999999999e-002 | L284: 6.89 | M284: 4.4000000000000003e-003 | N284: 457 | O284: 2.02 | P284: 113.3 | Q284: 7.46 | R284: 2.36 | S284: 92.36 | T284: 0.87 | U284: 转股中 | V284: 2.72年 | W284: 0.72年 | X284: 2.1000000000000001e-002 | Y284: 1.9e-002 | Z284: 1.3 | AA284: 63 | AB284: -0.14599999999999999 | AC284: -0.153 | AD284: -0.47200000000000003 | AE284: -0.47399999999999998 | AF284: 98.17 | AG284: 101.48 | AH284: 0.45 | AI284: AA | AJ284: 4.2099999999999999e-002 | AK284: =I284+100*T284 -> 259.69999999999999 | AL284: 253 | AM284: 284 | AN284: 151.6 | AO284: 284 | AP284: -8.0000000000000002e-002 | AQ284: 38 | AR284: 模塑转债!!
A285: 264 | B285: 太阳转债!! | C285: 128029 | D285: 43116. | E285: 太阳纸业 | F285: 2078 | G285: 造纸包装 | H285: 造纸行业 | I285: 156 | J285: 7.8000000000000005e-003 | K285: -2.3999999999999998e-003 | L285: 13.18 | M285: 5.3e-003 | N285: 39 | O285: 2.2000000000000002e-002 | P285: 107.8 | Q285: 8.55 | R285: 2.22 | S285: 154.15 | T285: 1.2e-002 | U285: 转股中 | V285: 2.27年 | W285: 0.27年 | X285: 3.3000000000000002e-002 | Y285: 5.0999999999999997e-002 | Z285: 11 | AA285: 342 | AB285: -0.151 | AC285: -0.157 | AD285: -0.85199999999999998 | AE285: -0.85499999999999998 | AF285: 99.24 | AG285: 98.68 | AH285: 1 | AI285: AA+ | AJ285: 4.0099999999999997e-002 | AK285: =I285+100*T285 -> 157.19999999999999 | AL285: 157.8 | AM285: 260 | AN285: 58.6 | AO285: 239 | AP285: -2.5000000000000001e-002 | AQ285: 8 | AR285: 太阳转债!!
A286: 247 | B286: 新泉转债!! | C286: 113509 | D286: 43273. | E286: 新泉股份 | F286: 603179 | G286: 汽车 | H286: 零部件制 | I286: 220.05 | J286: -5.0000000000000001e-003 | K286: 1.2999999999999999e-003 | L286: 31.58 | M286: -3.8e-003 | N286: 179 | O286: 0.47899999999999998 | P286: 110.3 | Q286: 14.22 | R286: 5.08 | S286: 222.08 | T286: -9.0000000000000011e-003 | U286: 转股中 | V286: 3.72年 | W286: 1.72年 | X286: 1.7000000000000001e-002 | Y286: 3.9e-002 | Z286: 1.7 | AA286: 98 | AB286: -0.17199999999999999 | AC286: -0.17499999999999999 | AD286: -0.25600000000000001 | AE286: -0.25700000000000001 | AF286: 94.93 | AG286: 94.45 | AH286: 0.98 | AI286: AA | AJ286: 4.3400000000000001e-002 | AK286: =I286+100*T286 -> 219.15000000000001 | AL286: 218 | AM286: 280 | AN286: 123.1 | AO286: 279 | AP286: 5.9000000000000004e-002 | AQ286: 11 | AR286: 新泉转债!!
A287: 263 | B287: 天康转债!! | C287: 128030 | D287: 43129. | E287: 天康生物 | F287: 2100 | G287: 农业 | H287: 畜牧业 | I287: 208 | J287: 0. | K287: 3.3e-003 | L287: 15.14 | M287: 3.3e-003 | N287: 25 | O287: 0.124 | P287: 112.3 | Q287: 7.85 | R287: 3.08 | S287: 192.87 | T287: 7.8e-002 | U287: 转股中 | V287: 3.27年 | W287: 1.27年 | X287: 6.0000000000000001e-003 | Y287: 1.2e-002 | Z287: 1 | AA287: 163 | AB287: -0.17399999999999999 | AC287: -0.17999999999999999 | AD287: -0.33700000000000002 | AE287: -0.33799999999999997 | AF287: 96.76 | AG287: 98.03 | AH287: 1 | AI287: AA | AJ287: 4.3400000000000001e-002 | AK287: =I287+100*T287 -> 215.80000000000001 | AL287: 223.1 | AM287: 282 | AN287: 125.1 | AO287: 280 | AP287: -0.13699999999999998 | AQ287: 11 | AR287: 天康转债!!
A288: 244 | B288: 广电转债!! | C288: 110044 | D288: 43305. | E288: 广电网络 | F288: 600831 | G288: 传媒娱乐 | H288: 影视娱乐 | I288: 234.17 | J288: -3.2199999999999999e-002 | K288: 3.6799999999999999e-002 | L288: 7.78 | M288: 6.5000000000000006e-003 | N288: 380 | O288: 2.2599999999999998 | P288: 112.3 | Q288: 6.9 | R288: 1.5 | S288: 112.75 | T288: 1.0800000000000001 | U288: 转股中 | V288: 3.78年 | W288: 1.78年 | X288: 1.3000000000000001e-002 | Y288: 1.3999999999999999e-002 | Z288: 0.7 | AA288: 55 | AB288: -0.17899999999999999 | AC288: -0.183 | AD288: -0.25900000000000001 | AE288: -0.26000000000000001 | AF288: 94.68 | AG288: 95.9 | AH288: 0.71 | AI288: AA | AJ288: 4.3400000000000001e-002 | AK288: =I288+100*T288 -> 342.16999999999996 | AL288: 355.6 | AM288: 290 | AN288: 259.7 | AO288: 290 | AP288: -7.8e-002 | AQ288: 11 | AR288: 广电转债!!
A289: 214 | B289: 凯龙转债! | C289: 128052 | D289: 43486. | E289: 凯龙股份 | F289: 2783 | G289: 化工 | H289: 化工 | I289: 266 | J289: 1.1399999999999999e-002 | K289: 1.18e-002 | L289: 13.66 | M289: 2.3199999999999998e-002 | N289: 289 | O289: 3.3700000000000001 | P289: 115 | Q289: 6.67 | R289: 3.01 | S289: 204.8 | T289: 0.29899999999999999 | U289: 转股中 | V289: 4.27年 | W289: 2.27年 | X289: 6.0000000000000001e-003 | Y289: 1.3000000000000001e-002 | Z289: 0.3 | AA289: 52 | AB289: -0.18100000000000002 | AC289: -0.18600000000000003 | AD289: -0.21299999999999999 | AE289: -0.214 | AF289: 93.44 | AG289: 96.31 | AH289: 1 | AI289: AA | AJ289: 4.3400000000000001e-002 | AK289: =I289+100*T289 -> 295.89999999999998 | AL289: 327.2 | AM289: 288 | AN289: 230.9 | AO289: 288 | AP289: 5.5999999999999994e-002 | AQ289: 12 | AR289: 凯龙转债!
A290: 233 | B290: 东音转债!! | C290: 128043 | D290: 43339. | E290: 罗欣药业 | F290: 2793 | G290: 医药 | H290: 化学制药 | I290: 265 | J290: -3.8e-003 | K290: 1.2199999999999999e-002 | L290: 15.56 | M290: 8.3999999999999995e-003 | N290: 90 | O290: 0.86599999999999999 | P290: 114.5 | Q290: 6.22 | R290: 5.81 | S290: 250.16 | T290: 5.9000000000000004e-002 | U290: 转股中 | V290: 3.88年 | W290: 1.88年 | X290: 2.e-003 | Y290: 4.0000000000000001e-003 | Z290: 0.4 | AA290: 225 | AB290: -0.19699999999999998 | AC290: -0.20199999999999999 | AD290: -0.26600000000000001 | AE290: -0.26700000000000002 | AF290: 94.31 | AG290: 97.38 | AH290: 1 | AI290: AA | AJ290: 4.3400000000000001e-002 | AK290: =I290+100*T290 -> 270.89999999999998 | AL290: 279.8 | AM290: 287 | AN290: 182.5 | AO290: 286 | AP290: -8.199999999999999e-002 | AQ290: 11 | AR290: 东音转债!!
A291: 129 | B291: 振德转债! | C291: 113555 | D291: 43844. | E291: 振德医疗 | F291: 603301 | G291: 医药 | H291: 医疗器械 | I291: 464.32 | J291: 1.9099999999999999e-002 | K291: -1.4499999999999999e-002 | L291: 63.87 | M291: 4.6999999999999993e-003 | N291: 882 | O291: 0.86199999999999999 | P291: 124.8 | Q291: 14.01 | R291: 5.74 | S291: 455.89 | T291: 1.8000000000000002e-002 | U291: 转股中 | V291: 5.26年 | W291: 3.26年 | X291: 1.7000000000000001e-002 | Y291: 7.9000000000000001e-002 | Z291: 2.2 | AA291: 127 | AB291: -0.22399999999999998 | AC291: -0.23000000000000001 | AD291: -0.16899999999999998 | AE291: -0.16899999999999998 | AF291: 84.4 | AG291: 89.95 | AH291: 0.99 | AI291: AA- | AJ291: 6.59e-002 | AK291: =I291+100*T291 -> 466.12 | AL291: 472.8 | AM291: 291 | AN291: 382.8 | AO291: 291 | AP291: -0.13900000000000001 | AQ291: 16 | AR291: 振德转债!
A292: 225 | B292: 特发转债! | C292: 127008 | D292: 43459. | E292: 特发信息 | F292: 70 | G292: 通信互联 | H292: 通信设备 | I292: 264.499 | J292: -1.9e-003 | K292: 1.78e-002 | L292: 10.21 | M292: 1.5900000000000001e-002 | N292: 97 | O292: 0.60999999999999999 | P292: 111.1 | Q292: 5.54 | R292: 2.97 | S292: 184.3 | T292: 0.435 | U292: 转股中 | V292: 3.17年 | W292: 1.17年 | X292: 6.9999999999999993e-003 | Y292: 1.3000000000000001e-002 | Z292: 0.6 | AA292: 83 | AB292: -0.24199999999999999 | AC292: -0.24600000000000002 | AD292: -0.44400000000000001 | AE292: -0.44400000000000001 | AF292: 96.25 | AG292: 97.29 | AH292: 1 | AI292: AA | AJ292: 4.3400000000000001e-002 | AK292: =I292+100*T292 -> 307.99900000000002 | AL292: 344.7 | AM292: 289 | AN292: 247.4 | AO292: 289 | AP292: -0.159 | AQ292: 15 | AR292: 特发转债!
A293: 237 | B293: 横河转债! | C293: 123013 | D293: 43332. | E293: 横河模具 | F293: 300539 | G293: 机械装备 | H293: 专用设备 | I293: 335.6 | J293: -2.9500000000000002e-002 | K293: 2.5000000000000001e-002 | L293: 8.09 | M293: -8.6e-003 | N293: 318 | O293: 2.4700000000000002 | P293: 115.2 | Q293: 9.13 | R293: 3.67 | S293: 88.61 | T293: 2.79 | U293: 转股中 | V293: 3.86年 | W293: 1.86年 | X293: 2.1000000000000001e-002 | Y293: 1.9e-002 | Z293: 0.4 | AA293: 18 | AB293: -0.245 | AC293: -0.25 | AD293: -0.30499999999999999 | AE293: -0.30599999999999999 | AF293: 89.29 | AG293: 87.53 | AH293: 0.53 | AI293: A+ | AJ293: 7.5399999999999995e-002 | AK293: =I293+100*T293 -> 614.60000000000002 | AL293: 582.6 | AM293: 292 | AN293: 493.3 | AO293: 292 | AP293: -2.4e-002 | AQ293: 15 | AR293: 横河转债!
A294: 165 | B294: 英科转债! | C294: 123029 | D294: 43718. | E294: 英科医疗 | F294: 300677 | G294: 医药 | H294: 医疗器械 | I294: 836.7 | J294: 1.7000000000000001e-003 | K294: -8.1000000000000013e-003 | L294: 132.73 | M294: -6.5000000000000006e-003 | N294: 891 | O294: 0.78000000000000003 | P294: 138.2 | Q294: 16.11 | R294: 8.02 | S294: 823.9 | T294: 1.6e-002 | U294: 转股中 | V294: 4.92年 | W294: 2.92年 | X294: 5.0000000000000001e-003 | Y294: 3.7999999999999999e-002 | Z294: 1.4 | AA294: 295 | AB294: -0.312 | AC294: -0.31900000000000001 | AD294: -0.223 | AE294: -0.223 | AF294: 88.76 | AG294: 102.68 | AH294: 0.99 | AI294: AA- | AJ294: 6.4399999999999999e-002 | AK294: =I294+100*T294 -> 838.30000000000007 | AL294: 849.5 | AM294: 293 | AN294: 746.8 | AO294: 293 | AP294: -8.6999999999999994e-002 | AQ294: 15 | AR294: 英科转债!