A1: 序号 | B1: 转债名称 | C1: 转债代码 | D1: 进展/上市日期 | E1: 股票名称 | F1: 股票代码 | G1: 行业 | H1: 子行业 | I1: 转债价格 | J1: 涨跌 | K1: 日内套利 | L1: 股价 | M1: 涨跌 | N1: 转债成交额 | O1: 转债换手率 | P1: 剩余本息 | Q1: 转股价格 | R1: P/B | S1: 转股价值 | T1: 转股溢价率 | U1: 距离转股日 | V1: 剩余年限 | W1: 回售年限 | X1: 余额/市值 | Y1: 余额/股本 | Z1: 转债余额 | AA1: 股票市值 | AB1: 税前收益率 | AC1: 税后收益率 | AD1: 税前回售收益 | AE1: 税后回售收益 | AF1: 回售价值 | AG1: 纯债价值 | AH1: 弹性 | AI1: 信用 | AJ1: 折现率 | AK1: 双低 | AL1: 老式双低 | AM1: 老式排名 | AN1: 新式双低 | AO1: 新式排名 | AP1: MA20乖离 | AQ1: 热门度 | AR1: 转债名称
A2: 199 | B2: 亚药转债! | C2: 128062 | D2: 43579. | E2: 亚太药业 | F2: 2370 | G2: 医药 | H2: 化学制药 | I2: 78.7 | J2: 3.4000000000000002e-003 | K2: -3.4000000000000002e-003 | L2: 5.22 | M2: 2.5499999999999998e-002 | N2: 3.2 | O2: 4.0000000000000001e-003 | P2: 119.8 | Q2: 16.25 | R2: 7.48 | S2: 32.12 | T2: 1.45 | U2: 转股中 | V2: 4.49年 | W2: 2.49年 | X2: 0.34399999999999997 | Y2: 0.111 | Z2: 9.6 | AA2: 28 | AB2: 0.10000000000000001 | AC2: 9.1499999999999998e-002 | AD2: 0.109 | AE2: 0.106 | AF2: 81.28 | AG2: 80.21 | AH2: 0 | AI2: A- | AJ2: 9.5500000000000002e-002 | AK2: =I2+100*T2 -> 223.69999999999999 | AL2: 125.3 | AM2: 71 | AN2: 44 | AO2: 167 | AP2: -8.8000000000000009e-002 | AQ2: 87 | AR2: 亚药转债!
A3: 219 | B3: 维格转债! | C3: 113527 | D3: 43515. | E3: 锦泓集团 | F3: 603518 | G3: 服装纺织 | H3: 服装行业 | I3: 89.71 | J3: -6.3e-003 | K3: 5.4000000000000003e-003 | L3: 6.43 | M3: -6.1999999999999998e-003 | N3: 18 | O3: 2.6000000000000002e-002 | P3: 120.2 | Q3: 9.85 | R3: 0.65 | S3: 65.28 | T3: 0.374 | U3: 转股中 | V3: 4.30年 | W3: 2.30年 | X3: 0.46000000000000002 | Y3: 0.29999999999999999 | Z3: 7.5 | AA3: 16 | AB3: 7.2000000000000008e-002 | AC3: 6.3099999999999989e-002 | AD3: 6.0499999999999998e-002 | AE3: 5.74e-002 | AF3: 91.18 | AG3: 96.53 | AH3: 0.15 | AI3: AA | AJ3: 5.3499999999999999e-002 | AK3: =I3+100*T3 -> 127.10999999999999 | AL3: 114.1 | AM3: 3 | AN3: 17.6 | AO3: 4 | AP3: -6.2e-002 | AQ3: 100 | AR3: 维格转债!
A4: 49 | B4: 本钢转债! | C4: 127018 | D4: 44047. | E4: 本钢板材 | F4: 761 | G4: 钢铁 | H4: 炼钢 | I4: 96.4 | J4: 2.0999999999999999e-003 | K4: -1.6000000000000001e-003 | L4: 3.46 | M4: 2.8999999999999998e-003 | N4: 56 | O4: 9.0000000000000011e-003 | P4: 128.6 | Q4: 5.03 | R4: 0.68 | S4: 68.79 | T4: 0.40100000000000002 | U4: 3月0天 | V4: 5.73年 | W4: 3.73年 | X4: 0.50700000000000001 | Y4: 0.34899999999999998 | Z4: 68 | AA4: 134 | AB4: 5.3200000000000004e-002 | AC4: 4.4400000000000002e-002 | AD4: 2.6099999999999998e-002 | AE4: 2.2799999999999997e-002 | AF4: 91.51 | AG4: 103.33 | AH4: 0.18 | AI4: AAA | AJ4: 4.0099999999999997e-002 | AK4: =I4+100*T4 -> 136.5 | AL4: 124 | AM4: 61 | AN4: 20.7 | AO4: 7 | AP4: 5.0000000000000001e-003 | AQ4: 27 | AR4: 本钢转债!
A5: 276 | B5: 亚太转债! | C5: 128023 | D5: 43095. | E5: 亚太股份 | F5: 2284 | G5: 汽车 | H5: 零部件制 | I5: 95.9 | J5: 1.e-004 | K5: -1.e-004 | L5: 4.79 | M5: -4.1999999999999997e-003 | N5: 2.7 | O5: 3.0000000000000001e-003 | P5: 112.3 | Q5: 10.34 | R5: 1.46 | S5: 46.32 | T5: 1.0700000000000001 | U5: 转股中 | V5: 3年59天 | W5: 1年59天 | X5: 0.28300000000000003 | Y5: 0.13100000000000001 | Z5: 10 | AA5: 35 | AB5: 5.2400000000000002e-002 | AC5: 4.4699999999999997e-002 | AD5: 5.4299999999999994e-002 | AE5: 4.9800000000000004e-002 | AF5: 97.2 | AG5: 98.46 | AH5: 0.01 | AI5: AA | AJ5: 4.3499999999999997e-002 | AK5: =I5+100*T5 -> 202.90000000000001 | AL5: 145.5 | AM5: 239 | AN5: 47 | AO5: 192 | AP5: -7.8e-002 | AQ5: 64 | AR5: 亚太转债!
A6: 38 | B6: 国城转债 | C6: 127019 | D6: 44053. | E6: 国城矿业 | F6: 688 | G6: 有色金属 | H6: 锌铅镍锡 | I6: 90.288 | J6: -4.5599999999999995e-002 | K6: 5.6999999999999993e-003 | L6: 16.77 | M6: -9.98e-002 | N6: 170 | O6: 0.22 | P6: 115.1 | Q6: 21.07 | R6: 8.71 | S6: 79.59 | T6: 0.13400000000000001 | U6: 3月17天 | V6: 5.77年 | W6: 3.77年 | X6: 4.4999999999999998e-002 | Y6: 3.5000000000000003e-002 | Z6: 8.5 | AA6: 191 | AB6: 4.3700000000000003e-002 | AC6: 3.8699999999999998e-002 | AD6: 3.5799999999999998e-002 | AE6: 3.39e-002 | AF6: 87.2 | AG6: 89.62 | AH6: 0.4 | AI6: AA | AJ6: 4.5100000000000001e-002 | AK6: =I6+100*T6 -> 103.688 | AL6: 101 | AM6: 1 | AN6: 11.4 | AO6: 1 | AP6: -0.25900000000000001 | AQ6: 20 | AR6: 国城转债
A7: 257 | B7: 岩土转债! | C7: 128037 | D7: 43215. | E7: 中化岩土 | F7: 2542 | G7: 建筑 | H7: 建筑工程 | I7: 98.01 | J7: 4.0000000000000002e-004 | K7: -2.9999999999999997e-004 | L7: 3.44 | M7: 8.8000000000000005e-003 | N7: 1.2 | O7: 2.e-003 | P7: 112.3 | Q7: 7.99 | R7: 1.55 | S7: 43.05 | T7: 1.28 | U7: 转股中 | V7: 3.44年 | W7: 1.44年 | X7: 9.6000000000000002e-002 | Y7: 4.2000000000000003e-002 | Z7: 6 | AA7: 62 | AB7: 4.1200000000000001e-002 | AC7: 3.4300000000000004e-002 | AD7: 3.04e-002 | AE7: 2.69e-002 | AF7: 96.07 | AG7: 97.29 | AH7: 0 | AI7: AA | AJ7: 4.3499999999999997e-002 | AK7: =I7+100*T7 -> 226.00999999999999 | AL7: 153 | AM7: 263 | AN7: 55.7 | AO7: 242 | AP7: -5.5e-002 | AQ7: 47 | AR7: 岩土转债!
A8: 284 | B8: 小康转债! | C8: 113016 | D8: 43060. | E8: 小康股份 | F8: 601127 | G8: 汽车 | H8: 零部件制 | I8: 98 | J8: 1.e-004 | K8: -1.e-004 | L8: 8.35 | M8: -2.3999999999999998e-003 | N8: 1.6 | O8: 2.e-003 | P8: 110.3 | Q8: 15.7 | R8: 1.69 | S8: 53.18 | T8: 0.84299999999999997 | U8: 转股中 | V8: 3年31天 | W8: 1年31天 | X8: 8.4000000000000005e-002 | Y8: 4.4999999999999998e-002 | Z8: 8.8 | AA8: 105 | AB8: 4.0000000000000001e-002 | AC8: 3.3399999999999999e-002 | AD8: 3.9399999999999998e-002 | AE8: 3.4700000000000002e-002 | AF8: 97.52 | AG8: 97.03 | AH8: 0.01 | AI8: AA | AJ8: 4.3499999999999997e-002 | AK8: =I8+100*T8 -> 182.30000000000001 | AL8: 142.8 | AM8: 215 | AN8: 45.3 | AO8: 173 | AP8: -3.4000000000000002e-002 | AQ8: 45 | AR8: 小康转债!
A9: 197 | B9: 未来转债 | C9: 128063 | D9: 43579. | E9: 德尔未来 | F9: 2631 | G9: 其他 | H9: 家居用品 | I9: 108.111 | J9: 2.7000000000000001e-003 | K9: -7.3000000000000001e-003 | L9: 6.98 | M9: -1.41e-002 | N9: 0.3 | O9: 0. | P9: 128.2 | Q9: 8.61 | R9: 2.65 | S9: 81.07 | T9: 0.33399999999999996 | U9: 转股中 | V9: 4.49年 | W9: 3.49年 | X9: 0.13500000000000001 | Y9: 0.109 | Z9: 6.3 | AA9: 47 | AB9: 3.9800000000000002e-002 | AC9: 2.8999999999999998e-002 | AD9: 1.9e-003 | AE9: -2.5999999999999999e-003 | AF9: 87.08 | AG9: 97.61 | AH9: 0.33 | AI9: AA- | AJ9: 6.4500000000000002e-002 | AK9: =I9+100*T9 -> 141.511 | AL9: 135.2 | AM9: 163 | AN9: 37.5 | AO9: 104 | AP9: -6.6000000000000003e-002 | AQ9: 35 | AR9: 未来转债
A10: 127 | B10: 百川转债! | C10: 128093 | D10: 43851. | E10: 百川股份 | F10: 2455 | G10: 化工 | H10: 化工 | I10: 107.875 | J10: 1.29e-002 | K10: -1.8100000000000002e-002 | L10: 5.01 | M10: -1.18e-002 | N10: 3.5 | O10: 6.0000000000000001e-003 | P10: 130.3 | Q10: 5.87 | R10: 2.04 | S10: 85.35 | T10: 0.26400000000000001 | U10: 转股中 | V10: 5.24年 | W10: 3.24年 | X10: 0.20100000000000001 | Y10: 0.17100000000000001 | Z10: 5.2 | AA10: 26 | AB10: 3.7999999999999999e-002 | AC10: 2.81e-002 | AD10: -1.4000000000000002e-003 | AE10: -5.5000000000000005e-003 | AF10: 86.69 | AG10: 94.27 | AH10: 0.44 | AI10: AA- | AJ10: 6.6100000000000006e-002 | AK10: =I10+100*T10 -> 134.27500000000001 | AL10: 130.4 | AM10: 113 | AN10: 36.1 | AO10: 83 | AP10: -3.7000000000000005e-002 | AQ10: 45 | AR10: 百川转债!
A11: 80 | B11: 纵横转债! | C11: 113573 | D11: 43973. | E11: 纵横通信 | F11: 603602 | G11: 通信互联 | H11: 通信设备 | I11: 101.98 | J11: 4.0999999999999995e-003 | K11: -1.0500000000000001e-002 | L11: 12.35 | M11: -2.29e-002 | N11: 2 | O11: 6.9999999999999993e-003 | P11: 124.7 | Q11: 18.81 | R11: 3.74 | S11: 65.66 | T11: 0.55299999999999994 | U11: 17天 | V11: 5.53年 | W11: 3.53年 | X11: 0.107 | Y11: 7.0000000000000007e-002 | Z11: 2.7 | AA11: 25 | AB11: 3.7900000000000003e-002 | AC11: 3.0099999999999998e-002 | AD11: 6.9999999999999993e-003 | AE11: 4.5999999999999999e-003 | AF11: 79.78 | AG11: 83.51 | AH11: 0.28 | AI11: A+ | AJ11: 7.7100000000000002e-002 | AK11: =I11+100*T11 -> 157.28 | AL11: 138.3 | AM11: 184 | AN11: 54.8 | AO11: 235 | AP11: -8.4000000000000005e-002 | AQ11: 13 | AR11: 纵横转债!
A12: 202 | B12: 大丰转债! | C12: 113530 | D12: 43573. | E12: 大丰实业 | F12: 603081 | G12: 建筑 | H12: 装饰工程 | I12: 103.65 | J12: 1.5e-003 | K12: -4.0999999999999995e-003 | L12: 11.5 | M12: -1.8799999999999997e-002 | N12: 1.1 | O12: 2.e-003 | P12: 121.6 | Q12: 16.64 | R12: 2.35 | S12: 69.11 | T12: 0.5 | U12: 转股中 | V12: 4.47年 | W12: 2.47年 | X12: 0.13600000000000001 | Y12: 9.4e-002 | Z12: 6.3 | AA12: 46 | AB12: 3.7100000000000001e-002 | AC12: 2.8500000000000001e-002 | AD12: -5.0000000000000001e-004 | AE12: -3.0999999999999999e-003 | AF12: 92.62 | AG12: 100.91 | AH12: 0.14 | AI12: AA | AJ12: 4.3499999999999997e-002 | AK12: =I12+100*T12 -> 153.65000000000001 | AL12: 138.2 | AM12: 182 | AN12: 37.3 | AO12: 100 | AP12: -5.7999999999999996e-002 | AQ12: 34 | AR12: 大丰转债!
A13: 248 | B13: 海澜转债! | C13: 110045 | D13: 43312. | E13: 海澜之家 | F13: 600398 | G13: 服装纺织 | H13: 服装行业 | I13: 97.4 | J13: 4.3e-003 | K13: -5.0000000000000001e-003 | L13: 6.23 | M13: -2.35e-002 | N13: 4.3 | O13: 1.e-003 | P13: 111.1 | Q13: 11.75 | R13: 2.21 | S13: 53.02 | T13: 0.83700000000000008 | U13: 转股中 | V13: 3.77年 | W13: 1.77年 | X13: 0.11 | Y13: 5.7999999999999996e-002 | Z13: 29 | AA13: 269 | AB13: 3.6000000000000004e-002 | AC13: 3.0299999999999997e-002 | AD13: 2.4399999999999998e-002 | AE13: 2.2200000000000001e-002 | AF13: 94.34 | AG13: 95.52 | AH13: 0.03 | AI13: AA+ | AJ13: 4.1500000000000002e-002 | AK13: =I13+100*T13 -> 181.10000000000002 | AL13: 141.8 | AM13: 209 | AN13: 46.3 | AO13: 181 | AP13: -5.7999999999999996e-002 | AQ13: 59 | AR13: 海澜转债!
A14: 288 | B14: 久其转债! | C14: 128015 | D14: 42934. | E14: 久其软件 | F14: 2279 | G14: 计算机及 | H14: 软件开发 | I14: 101.3 | J14: 3.7000000000000002e-003 | K14: -3.7000000000000002e-003 | L14: 6.11 | M14: -3.3e-003 | N14: 2.1 | O14: 3.0000000000000001e-003 | P14: 110.8 | Q14: 9.48 | R14: 5.97 | S14: 64.45 | T14: 0.57200000000000006 | U14: 转股中 | V14: 2.67年 | W14: 0.67年 | X14: 0.17899999999999999 | Y14: 0.11599999999999999 | Z14: 7.8 | AA14: 43 | AB14: 3.4599999999999999e-002 | AC14: 2.6800000000000001e-002 | AD14: 3.0000000000000001e-003 | AE14: -7.000000000000001e-004 | AF14: 95.64 | AG14: 91.75 | AH14: 0 | AI14: A+ | AJ14: 7.4299999999999991e-002 | AK14: =I14+100*T14 -> 158.5 | AL14: 138.1 | AM14: 181 | AN14: 42.5 | AO14: 152 | AP14: -6.2e-002 | AQ14: 55 | AR14: 久其转债!
A15: 186 | B15: 大业转债! | C15: 113535 | D15: 43619. | E15: 大业股份 | F15: 603278 | G15: 汽车 | H15: 零部件制 | I15: 100.26 | J15: -4.0000000000000002e-004 | K15: 1.6000000000000001e-003 | L15: 8.4 | M15: 8.3999999999999995e-003 | N15: 2 | O15: 4.0000000000000001e-003 | P15: 113.1 | Q15: 12.4 | R15: 1.52 | S15: 67.74 | T15: 0.47999999999999998 | U15: 转股中 | V15: 3.59年 | W15: 1.59年 | X15: 0.20499999999999999 | Y15: 0.13900000000000001 | Z15: 5 | AA15: 24 | AB15: 3.4599999999999999e-002 | AC15: 2.7699999999999999e-002 | AD15: 9.0000000000000011e-003 | AE15: 6.8999999999999999e-003 | AF15: 94.55 | AG15: 97.26 | AH15: 0.14 | AI15: AA | AJ15: 4.3499999999999997e-002 | AK15: =I15+100*T15 -> 148.25999999999999 | AL15: 132.8 | AM15: 141 | AN15: 35.5 | AO15: 80 | AP15: -5.2999999999999999e-002 | AQ15: 49 | AR15: 大业转债!
A16: 13 | B16: 新星转债 | C16: 113600 | D16: 44085. | E16: 深圳新星 | F16: 603978 | G16: 有色金属 | H16: 有色行业 | I16: 103.79 | J16: -2.e-003 | K16: -5.9999999999999995e-004 | L16: 20.23 | M16: -5.4000000000000003e-003 | N16: 52 | O16: 8.4000000000000005e-002 | P16: 126 | Q16: 23.85 | R16: 2.13 | S16: 84.82 | T16: 0.22399999999999998 | U16: 4月16天 | V16: 5.85年 | W16: 3.85年 | X16: 0.184 | Y16: 0.156 | Z16: 6 | AA16: 32 | AB16: 3.4300000000000004e-002 | AC16: 2.6699999999999998e-002 | AD16: 2.9999999999999997e-004 | AE16: -1.6000000000000001e-003 | AF16: 80.54 | AG16: 87.24 | AH16: 0.49 | AI16: AA- | AJ16: 6.6100000000000006e-002 | AK16: =I16+100*T16 -> 126.19 | AL16: 122.8 | AM16: 47 | AN16: 35.5 | AO16: 79 | AP16: -7.2000000000000008e-002 | AQ16: 7 | AR16: 新星转债
A17: 281 | B17: 嘉澳转债! | C17: 113502 | D17: 43066. | E17: 嘉澳环保 | F17: 603822 | G17: 化工 | H17: 化工 | I17: 101.6 | J17: 2.0000000000000001e-004 | K17: -2.0000000000000001e-004 | L17: 24.36 | M17: 4.0999999999999995e-003 | N17: 2.4 | O17: 1.3000000000000001e-002 | P17: 112.3 | Q17: 44.79 | R17: 2.41 | S17: 54.39 | T17: 0.86799999999999999 | U17: 转股中 | V17: 3年35天 | W17: 1年35天 | X17: 0.10400000000000001 | Y17: 5.5999999999999994e-002 | Z17: 1.9 | AA17: 18 | AB17: 3.3700000000000001e-002 | AC17: 2.6000000000000002e-002 | AD17: 9.3999999999999986e-003 | AE17: 5.0000000000000001e-003 | AF17: 95.08 | AG17: 92.97 | AH17: 0 | AI17: AA- | AJ17: 6.4500000000000002e-002 | AK17: =I17+100*T17 -> 188.39999999999998 | AL17: 148.8 | AM17: 249 | AN17: 53.7 | AO17: 229 | AP17: -6.0999999999999999e-002 | AQ17: 29 | AR17: 嘉澳转债!
A18: 110 | B18: 科达转债! | C18: 113569 | D18: 43929. | E18: 苏州科达 | F18: 603660 | G18: 通信互联 | H18: 物联网 | I18: 101.6 | J18: 5.0000000000000001e-004 | K18: -1.5e-003 | L18: 8.88 | M18: -5.6000000000000008e-003 | N18: 2.1 | O18: 4.0000000000000001e-003 | P18: 120.7 | Q18: 14.84 | R18: 2.62 | S18: 59.84 | T18: 0.69799999999999995 | U18: 转股中 | V18: 5.42年 | W18: 3.42年 | X18: 0.11599999999999999 | Y18: 7.0000000000000007e-002 | Z18: 5.2 | AA18: 44 | AB18: 3.3000000000000002e-002 | AC18: 2.6099999999999998e-002 | AD18: 6.7000000000000002e-003 | AE18: 4.5000000000000005e-003 | AF18: 82.91 | AG18: 85.95 | AH18: 0.18 | AI18: AA- | AJ18: 6.6100000000000006e-002 | AK18: =I18+100*T18 -> 171.39999999999998 | AL18: 143.4 | AM18: 222 | AN18: 57.4 | AO18: 246 | AP18: -2.7000000000000003e-002 | AQ18: 22 | AR18: 科达转债!
A19: 290 | B19: 永东转债! | C19: 128014 | D19: 42934. | E19: 永东股份 | F19: 2753 | G19: 化工 | H19: 化工 | I19: 102.93 | J19: -5.9999999999999995e-004 | K19: -5.9999999999999995e-004 | L19: 8.83 | M19: -2.3199999999999998e-002 | N19: 0.3 | O19: 1.e-003 | P19: 111.3 | Q19: 12.6 | R19: 1.92 | S19: 70.08 | T19: 0.46899999999999997 | U19: 转股中 | V19: 2.53年 | W19: 0.53年 | X19: 0.10199999999999999 | Y19: 7.0999999999999994e-002 | Z19: 3.4 | AA19: 33 | AB19: 3.2000000000000001e-002 | AC19: 2.3399999999999997e-002 | AD19: -1.5800000000000002e-002 | AE19: -2.0799999999999999e-002 | AF19: 97.56 | AG19: 95.56 | AH19: 0.05 | AI19: AA- | AJ19: 6.3299999999999995e-002 | AK19: =I19+100*T19 -> 149.83000000000001 | AL19: 135.8 | AM19: 167 | AN19: 38.2 | AO19: 117 | AP19: -2.3e-002 | AQ19: 39 | AR19: 永东转债!
A20: 111 | B20: 新春转债 | C20: 113568 | D20: 43923. | E20: 五洲新春 | F20: 603667 | G20: 机械装备 | H20: 通用设备 | I20: 105.85 | J20: 1.4000000000000002e-003 | K20: -8.0000000000000004e-004 | L20: 8 | M20: 1.2999999999999999e-003 | N20: 1.4 | O20: 4.0000000000000001e-003 | P20: 124.8 | Q20: 8.91 | R20: 1.37 | S20: 89.79 | T20: 0.17899999999999999 | U20: 转股中 | V20: 5.41年 | W20: 3.41年 | X20: 0.14099999999999999 | Y20: 0.127 | Z20: 3.3 | AA20: 23 | AB20: 3.1600000000000003e-002 | AC20: 2.3700000000000002e-002 | AD20: -3.0000000000000001e-003 | AE20: -5.6000000000000008e-003 | AF20: 83.53 | AG20: 89 | AH20: 0.53 | AI20: AA- | AJ20: 6.6100000000000006e-002 | AK20: =I20+100*T20 -> 123.75 | AL20: 121.9 | AM20: 41 | AN20: 32.9 | AO20: 58 | AP20: -6.0999999999999999e-002 | AQ20: 40 | AR20: 新春转债
A21: 215 | B21: 长城转债! | C21: 113528 | D21: 43544. | E21: 长城科技 | F21: 603897 | G21: 机械装备 | H21: 专用设备 | I21: 102.94 | J21: -5.0000000000000001e-004 | K21: -1.2999999999999999e-003 | L21: 18.32 | M21: -4.8999999999999998e-003 | N21: 0.7 | O21: 1.e-003 | P21: 117.6 | Q21: 23.45 | R21: 1.78 | S21: 78.12 | T21: 0.318 | U21: 转股中 | V21: 4.40年 | W21: 2.40年 | X21: 0.19399999999999998 | Y21: 0.152 | Z21: 6.3 | AA21: 33 | AB21: 3.15e-002 | AC21: 2.41e-002 | AD21: 3.8e-003 | AE21: 8.0000000000000004e-004 | AF21: 88.72 | AG21: 89.93 | AH21: 0.37 | AI21: AA- | AJ21: 6.4500000000000002e-002 | AK21: =I21+100*T21 -> 134.74000000000001 | AL21: 127.8 | AM21: 89 | AN21: 37.8 | AO21: 108 | AP21: -4.4999999999999998e-002 | AQ21: 44 | AR21: 长城转债!
A22: 47 | B22: 胜达转债! | C22: 113591 | D22: 44035. | E22: 大胜达 | F22: 603687 | G22: 造纸包装 | H22: 包装用纸 | I22: 102.7 | J22: -2.0000000000000001e-004 | K22: -2.5000000000000001e-003 | L22: 11.74 | M22: -5.8999999999999999e-003 | N22: 2.1 | O22: 4.0000000000000001e-003 | P22: 122.2 | Q22: 14.73 | R22: 3.13 | S22: 79.7 | T22: 0.28899999999999998 | U22: 3月4天 | V22: 5.73年 | W22: 3.73年 | X22: 0.114 | Y22: 9.0999999999999998e-002 | Z22: 5.5 | AA22: 48 | AB22: 3.1400000000000004e-002 | AC22: 2.46e-002 | AD22: 3.5999999999999999e-003 | AE22: 1.5e-003 | AF22: 81.34 | AG22: 85.32 | AH22: 0.45 | AI22: AA- | AJ22: 6.6100000000000006e-002 | AK22: =I22+100*T22 -> 131.59999999999999 | AL22: 125.7 | AM22: 77 | AN22: 40.4 | AO22: 140 | AP22: -9.6000000000000002e-002 | AQ22: 19 | AR22: 胜达转债!
A23: 246 | B23: 德尔转债! | C23: 123011 | D23: 43326. | E23: 德尔股份 | F23: 300473 | G23: 汽车 | H23: 零部件制 | I23: 103.99 | J23: -4.7999999999999996e-003 | K23: 8.3999999999999995e-003 | L23: 27.78 | M23: 1.0200000000000001e-002 | N23: 2.5 | O23: 1.e-002 | P23: 116.3 | Q23: 34.54 | R23: 1.42 | S23: 80.43 | T23: 0.29299999999999998 | U23: 转股中 | V23: 3.78年 | W23: 1.78年 | X23: 7.9000000000000001e-002 | Y23: 6.4000000000000001e-002 | Z23: 2.5 | AA23: 32 | AB23: 3.0600000000000002e-002 | AC23: 2.2599999999999999e-002 | AD23: -5.8999999999999999e-003 | AE23: -8.6999999999999994e-003 | AF23: 91.1 | AG23: 92.22 | AH23: 0.35 | AI23: AA- | AJ23: 6.4500000000000002e-002 | AK23: =I23+100*T23 -> 133.28999999999999 | AL23: 127.6 | AM23: 87 | AN23: 35.3 | AO23: 77 | AP23: -5.0999999999999997e-002 | AQ23: 35 | AR23: 德尔转债!
A24: 267 | B24: 吉视转债! | C24: 113017 | D24: 43115. | E24: 吉视传媒 | F24: 601929 | G24: 传媒娱乐 | H24: 影视娱乐 | I24: 100.02 | J24: -3.0999999999999999e-003 | K24: 2.0000000000000001e-004 | L24: 2.16 | M24: -1.8200000000000001e-002 | N24: 13 | O24: 9.0000000000000011e-003 | P24: 109.8 | Q24: 2.95 | R24: 1.01 | S24: 73.22 | T24: 0.36599999999999999 | U24: 转股中 | V24: 3.22年 | W24: 1.22年 | X24: 0.23199999999999998 | Y24: 0.17000000000000001 | Z24: 16 | AA24: 67 | AB24: 2.9999999999999999e-002 | AC24: 2.4e-002 | AD24: 1.83e-002 | AE24: 1.46e-002 | AF24: 96.96 | AG24: 96.57 | AH24: 0.16 | AI24: AA+ | AJ24: 4.1500000000000002e-002 | AK24: =I24+100*T24 -> 136.62 | AL24: 126.8 | AM24: 83 | AN24: 29.9 | AO24: 39 | AP24: -5.5e-002 | AQ24: 51 | AR24: 吉视转债!
A25: 142 | B25: 鸿达转债 | C25: 128085 | D25: 43838. | E25: 鸿达兴业 | F25: 2002 | G25: 化工 | H25: 化工 | I25: 107.473 | J25: -2.0999999999999999e-003 | K25: -8.199999999999999e-003 | L25: 3.8 | M25: -2.06e-002 | N25: 13 | O25: 5.0000000000000001e-003 | P25: 124.8 | Q25: 3.92 | R25: 1.4 | S25: 96.94 | T25: 0.109 | U25: 转股中 | V25: 5.19年 | W25: 3.19年 | X25: 0.247 | Y25: 0.23899999999999999 | Z25: 24 | AA25: 98 | AB25: 2.9900000000000003e-002 | AC25: 2.1600000000000001e-002 | AD25: -9.0000000000000011e-003 | AE25: -1.1399999999999999e-002 | AF25: 90.09 | AG25: 99.75 | AH25: 0.5 | AI25: AA | AJ25: 4.5100000000000001e-002 | AK25: =I25+100*T25 -> 118.373 | AL25: 118 | AM25: 19 | AN25: 18.3 | AO25: 5 | AP25: -5.0999999999999997e-002 | AQ25: 83 | AR25: 鸿达转债
A26: 20 | B26: 佳力转债! | C26: 113597 | D26: 44064. | E26: 佳力图 | F26: 603912 | G26: 机械装备 | H26: 专用设备 | I26: 105.48 | J26: -4.8999999999999998e-003 | K26: -1.e-003 | L26: 16.66 | M26: -1.83e-002 | N26: 0.6 | O26: 2.e-003 | P26: 124.5 | Q26: 23.4 | R26: 4.41 | S26: 71.2 | T26: 0.48200000000000004 | U26: 4月2天 | V26: 5.81年 | W26: 3.81年 | X26: 8.3000000000000004e-002 | Y26: 5.9000000000000004e-002 | Z26: 3 | AA26: 36 | AB26: 2.9500000000000002e-002 | AC26: 2.2200000000000001e-002 | AD26: -2.5999999999999999e-003 | AE26: -4.6999999999999993e-003 | AF26: 81.16 | AG26: 86.5 | AH26: 0.32 | AI26: AA- | AJ26: 6.6100000000000006e-002 | AK26: =I26+100*T26 -> 153.68000000000001 | AL26: 139.8 | AM26: 195 | AN26: 53.3 | AO26: 220 | AP26: -9.3000000000000013e-002 | AQ26: 4 | AR26: 佳力转债!
A27: 159 | B27: 浦发转债! | C27: 110059 | D27: 43784. | E27: 浦发银行 | F27: 600000 | G27: 金融 | H27: 银行行业 | I27: 102.46 | J27: 1.5e-003 | K27: -2.0999999999999999e-003 | L27: 9.39 | M27: -4.1999999999999997e-003 | N27: 143 | O27: 3.0000000000000001e-003 | P27: 117.8 | Q27: 14.45 | R27: 0.55 | S27: 64.98 | T27: 0.57700000000000007 | U27: 转股中 | V27: 5年22天 | W27: 无权 | X27: 0.18100000000000002 | Y27: 0.11800000000000001 | Z27: 500 | AA27: 2756. | AB27: 2.8799999999999999e-002 | AC27: 2.2200000000000001e-002 | AD27: 无权 | AE27: 无权 | AF27: 无权 | AG27: 97.08 | AH27: 0.16 | AI27: AAA | AJ27: 4.0099999999999997e-002 | AK27: =I27+100*T27 -> 160.16 | AL27: 139.9 | AM27: 198 | AN27: 42.9 | AO27: 154 | AP27: -4.4999999999999998e-002 | AQ27: 76 | AR27: 浦发转债!
A28: 226 | B28: 钧达转债! | C28: 128050 | D28: 43461. | E28: 钧达股份 | F28: 2865 | G28: 汽车 | H28: 零部件制 | I28: 110.11 | J28: 8.6e-003 | K28: 9.4999999999999998e-003 | L28: 14.96 | M28: 3.1e-002 | N28: 5.2 | O28: 1.4999999999999999e-002 | P28: 123.5 | Q28: 14.83 | R28: 2.11 | S28: 100.88 | T28: 9.1999999999999998e-002 | U28: 转股中 | V28: 4.18年 | W28: 2.18年 | X28: 0.17699999999999999 | Y28: 0.17800000000000002 | Z28: 3.2 | AA28: 18 | AB28: 2.8500000000000001e-002 | AC28: 1.8700000000000001e-002 | AD28: -2.5099999999999997e-002 | AE28: -2.81e-002 | AF28: 89.87 | AG28: 95.72 | AH28: 0.58 | AI28: AA- | AJ28: 6.4500000000000002e-002 | AK28: =I28+100*T28 -> 119.31 | AL28: 119.3 | AM28: 27 | AN28: 23.6 | AO28: 12 | AP28: -7.5999999999999998e-002 | AQ28: 63 | AR28: 钧达转债!
A29: 214 | B29: 中信转债! | C29: 113021 | D29: 43543. | E29: 中信银行 | F29: 601998 | G29: 金融 | H29: 银行行业 | I29: 105.36 | J29: 8.0000000000000004e-004 | K29: -4.0000000000000002e-004 | L29: 5.05 | M29: 2.e-003 | N29: 37 | O29: 1.e-003 | P29: 118.8 | Q29: 6.98 | R29: 0.55 | S29: 72.35 | T29: 0.45600000000000002 | U29: 转股中 | V29: 4.41年 | W29: 无权 | X29: 0.16200000000000001 | Y29: 0.11699999999999999 | Z29: 400 | AA29: 2471. | AB29: 2.8500000000000001e-002 | AC29: 2.06e-002 | AD29: 无权 | AE29: 无权 | AF29: 无权 | AG29: 101.08 | AH29: 0.19 | AI29: AAA | AJ29: 3.85e-002 | AK29: =I29+100*T29 -> 150.96000000000001 | AL29: 138.4 | AM29: 185 | AN29: 37.3 | AO29: 101 | AP29: -1.2e-002 | AQ29: 53 | AR29: 中信转债!
A30: 161 | B30: 迪贝转债! | C30: 113546 | D30: 43790. | E30: 迪贝电气 | F30: 603320 | G30: 家电 | H30: 零部件制 | I30: 105.5 | J30: 1.4000000000000002e-003 | K30: -5.1000000000000004e-003 | L30: 12.38 | M30: -6.4000000000000003e-003 | N30: 3.5 | O30: 1.3999999999999999e-002 | P30: 121.1 | Q30: 14.1 | R30: 2.45 | S30: 87.8 | T30: 0.20199999999999999 | U30: 转股中 | V30: 5年17天 | W30: 3年17天 | X30: 0.14300000000000002 | Y30: 0.125 | Z30: 2.3 | AA30: 16 | AB30: 2.8399999999999998e-002 | AC30: 2.0899999999999998e-002 | AD30: -3.2000000000000002e-003 | AE30: -5.8999999999999999e-003 | AF30: 82.57 | AG30: 84.06 | AH30: 0.57 | AI30: A+ | AJ30: 7.7100000000000002e-002 | AK30: =I30+100*T30 -> 125.7 | AL30: 123.2 | AM30: 55 | AN30: 39.1 | AO30: 127 | AP30: -7.5999999999999998e-002 | AQ30: 42 | AR30: 迪贝转债!
A31: 224 | B31: 奇精转债! | C31: 113524 | D31: 43472. | E31: 奇精机械 | F31: 603677 | G31: 家电 | H31: 零部件制 | I31: 105.21 | J31: 3.5999999999999999e-003 | K31: 3.8e-003 | L31: 11.95 | M31: 2.1400000000000002e-002 | N31: 0.4 | O31: 1.e-003 | P31: 117.9 | Q31: 14.08 | R31: 2.36 | S31: 84.87 | T31: 0.23999999999999999 | U31: 转股中 | V31: 4.19年 | W31: 2.19年 | X31: 0.14400000000000002 | Y31: 0.122 | Z31: 3.3 | AA31: 23 | AB31: 2.81e-002 | AC31: 2.0400000000000001e-002 | AD31: -7.4000000000000003e-003 | AE31: -1.0200000000000001e-002 | AF31: 93.64 | AG31: 99.01 | AH31: 0.35 | AI31: AA | AJ31: 4.3499999999999997e-002 | AK31: =I31+100*T31 -> 129.20999999999998 | AL31: 125.5 | AM31: 75 | AN31: 26.5 | AO31: 19 | AP31: -1.2e-002 | AQ31: 43 | AR31: 奇精转债!
A32: 84 | B32: 凌钢转债! | C32: 110070 | D32: 43964. | E32: 凌钢股份 | F32: 600231 | G32: 钢铁 | H32: 炼钢 | I32: 101.41 | J32: 2.0000000000000001e-004 | K32: -5.1999999999999998e-003 | L32: 2.19 | M32: -1.3500000000000002e-002 | N32: 0.5 | O32: 1.e-003 | P32: 117.8 | Q32: 2.75 | R32: 0.78 | S32: 79.64 | T32: 0.27300000000000002 | U32: 11天 | V32: 5.52年 | W32: 3.52年 | X32: 7.2999999999999995e-002 | Y32: 5.7999999999999996e-002 | Z32: 4.4 | AA32: 61 | AB32: 2.81e-002 | AC32: 2.2200000000000001e-002 | AD32: 7.3000000000000001e-003 | AE32: 5.1000000000000004e-003 | AF32: 88.67 | AG32: 92.83 | AH32: 0.37 | AI32: AA | AJ32: 4.5100000000000001e-002 | AK32: =I32+100*T32 -> 128.71000000000001 | AL32: 123.2 | AM32: 54 | AN32: 30.4 | AO32: 41 | AP32: -4.4999999999999998e-002 | AQ32: 13 | AR32: 凌钢转债!
A33: 137 | B33: 建工转债! | C33: 110064 | D33: 43846. | E33: 重庆建工 | F33: 600939 | G33: 建筑 | H33: 建筑工程 | I33: 104.83 | J33: 3.2000000000000002e-003 | K33: -3.2000000000000002e-003 | L33: 3.92 | M33: 0. | N33: 9.7 | O33: 6.0000000000000001e-003 | P33: 120.2 | Q33: 4.57 | R33: 1.02 | S33: 85.78 | T33: 0.222 | U33: 转股中 | V33: 5.21年 | W33: 3.21年 | X33: 0.23300000000000001 | Y33: 0.20000000000000001 | Z33: 17 | AA33: 71 | AB33: 2.7300000000000001e-002 | AC33: 2.0299999999999999e-002 | AD33: -8.0000000000000004e-004 | AE33: -3.4000000000000002e-003 | AF33: 90.82 | AG33: 97.01 | AH33: 0.4 | AI33: AA+ | AJ33: 4.3099999999999999e-002 | AK33: =I33+100*T33 -> 127.03 | AL33: 123.9 | AM33: 59 | AN33: 26.9 | AO33: 20 | AP33: -3.9e-002 | AQ33: 46 | AR33: 建工转债!
A34: 51 | B34: 天创转债! | C34: 113589 | D34: 44028. | E34: 天创时尚 | F34: 603608 | G34: 服装纺织 | H34: 鞋服行业 | I34: 99.18 | J34: 8.0000000000000004e-004 | K34: -3.5999999999999999e-003 | L34: 8.14 | M34: -1.3300000000000001e-002 | N34: 0.9 | O34: 2.e-003 | P34: 115.3 | Q34: 12.64 | R34: 1.6 | S34: 64.4 | T34: 0.54000000000000004 | U34: 2月28天 | V34: 5.72年 | W34: 3.72年 | X34: 0.17100000000000001 | Y34: 0.11 | Z34: 6 | AA34: 35 | AB34: 2.7200000000000002e-002 | AC34: 2.2200000000000001e-002 | AD34: 1.1899999999999999e-002 | AE34: 1.e-002 | AF34: 87.61 | AG34: 90.04 | AH34: 0.21 | AI34: AA | AJ34: 4.5100000000000001e-002 | AK34: =I34+100*T34 -> 153.18000000000001 | AL34: 134 | AM34: 154 | AN34: 43.9 | AO34: 165 | AP34: -7.4999999999999997e-002 | AQ34: 7 | AR34: 天创转债!
A35: 260 | B35: 杭电转债! | C35: 113505 | D35: 43186. | E35: 杭电股份 | F35: 603618 | G35: 能源电力 | H35: 电力设备 | I35: 102.68 | J35: 3.7000000000000002e-003 | K35: -4.5000000000000005e-003 | L35: 5.47 | M35: -3.5999999999999999e-003 | N35: 7 | O35: 9.0000000000000011e-003 | P35: 112.3 | Q35: 7.14 | R35: 1.51 | S35: 76.61 | T35: 0.34000000000000002 | U35: 转股中 | V35: 3.41年 | W35: 1.41年 | X35: 0.19800000000000001 | Y35: 0.152 | Z35: 7.5 | AA35: 38 | AB35: 2.7099999999999999e-002 | AC35: 2.0299999999999999e-002 | AD35: 7.000000000000001e-004 | AE35: -2.7000000000000001e-003 | AF35: 96.17 | AG35: 97.4 | AH35: 0.22 | AI35: AA | AJ35: 4.3499999999999997e-002 | AK35: =I35+100*T35 -> 136.68000000000001 | AL35: 128.7 | AM35: 100 | AN35: 31.4 | AO35: 47 | AP35: -5.5e-002 | AQ35: 38 | AR35: 杭电转债!
A36: 238 | B36: 岭南转债! | C36: 128044 | D36: 43347. | E36: 岭南股份 | F36: 2717 | G36: 城市公用 | H36: 生态环境 | I36: 100.601 | J36: 3.2000000000000002e-003 | K36: -3.2000000000000002e-003 | L36: 4.02 | M36: 0. | N36: 0.7 | O36: 1.e-003 | P36: 111.3 | Q36: 5.91 | R36: 1.29 | S36: 68.02 | T36: 0.47899999999999998 | U36: 转股中 | V36: 3.86年 | W36: 1.86年 | X36: 0.107 | Y36: 7.2999999999999995e-002 | Z36: 6.6 | AA36: 61 | AB36: 2.7099999999999999e-002 | AC36: 2.1400000000000002e-002 | AD36: 1.0800000000000001e-002 | AE36: 8.1000000000000013e-003 | AF36: 94.38 | AG36: 94.73 | AH36: 0.15 | AI36: AA | AJ36: 4.3499999999999997e-002 | AK36: =I36+100*T36 -> 148.501 | AL36: 133.2 | AM36: 146 | AN36: 38.4 | AO36: 119 | AP36: -3.1e-002 | AQ36: 30 | AR36: 岭南转债!
A37: 8 | B37: 塞力转债 | C37: 113601 | D37: 44089. | E37: 塞力斯 | F37: 603716 | G37: 医药 | H37: 医药商业 | I37: 104 | J37: 4.4000000000000003e-003 | K37: -1.e-004 | L37: 15.28 | M37: 7.3000000000000001e-003 | N37: 42 | O37: 7.4999999999999997e-002 | P37: 121.3 | Q37: 16.98 | R37: 2.1 | S37: 89.99 | T37: 0.156 | U37: 4月24天 | V37: 5.87年 | W37: 3.87年 | X37: 0.17300000000000001 | Y37: 0.156 | Z37: 5.4 | AA37: 31 | AB37: 2.7099999999999999e-002 | AC37: 2.07e-002 | AD37: 5.0000000000000001e-004 | AE37: -1.5e-003 | AF37: 80.7 | AG37: 83.96 | AH37: 0.59 | AI37: AA- | AJ37: 6.6100000000000006e-002 | AK37: =I37+100*T37 -> 119.59999999999999 | AL37: 118 | AM37: 20 | AN37: 34.1 | AO37: 65 | AP37: -8.5000000000000006e-002 | AQ37: 8 | AR37: 塞力转债
A38: 205 | B38: 迪森转债! | C38: 123023 | D38: 43571. | E38: 迪森股份 | F38: 300335 | G38: 能源电力 | H38: 电力供应 | I38: 102.298 | J38: 0. | K38: 4.7999999999999996e-003 | L38: 5.66 | M38: 1.43e-002 | N38: 4.1 | O38: 6.9999999999999993e-003 | P38: 114.9 | Q38: 7.04 | R38: 1.58 | S38: 80.4 | T38: 0.27200000000000002 | U38: 转股中 | V38: 4.45年 | W38: 3.45年 | X38: 0.29199999999999998 | Y38: 0.23499999999999999 | Z38: 6 | AA38: 21 | AB38: 2.7000000000000003e-002 | AC38: 2.07e-002 | AD38: 8.0000000000000002e-003 | AE38: 5.1000000000000004e-003 | AF38: 90.43 | AG38: 95.43 | AH38: 0.34 | AI38: AA | AJ38: 4.3499999999999997e-002 | AK38: =I38+100*T38 -> 129.49799999999999 | AL38: 124.2 | AM38: 62 | AN38: 28.8 | AO38: 31 | AP38: -6.9000000000000006e-002 | AQ38: 51 | AR38: 迪森转债!
A39: 172 | B39: 翔鹭转债! | C39: 128072 | D39: 43724. | E39: 翔鹭钨业 | F39: 2842 | G39: 有色金属 | H39: 小金属 | I39: 101.411 | J39: 1.1000000000000001e-003 | K39: -2.3999999999999998e-003 | L39: 9.49 | M39: -6.3e-003 | N39: 0.7 | O39: 2.e-003 | P39: 115.1 | Q39: 15.31 | R39: 2.9 | S39: 61.99 | T39: 0.63600000000000001 | U39: 转股中 | V39: 4.87年 | W39: 2.87年 | X39: 0.11599999999999999 | Y39: 7.2000000000000008e-002 | Z39: 3 | AA39: 26 | AB39: 2.6800000000000001e-002 | AC39: 2.1099999999999997e-002 | AD39: 6.6e-003 | AE39: 4.3e-003 | AF39: 85.69 | AG39: 85.39 | AH39: 0.2 | AI39: AA- | AJ39: 6.4500000000000002e-002 | AK39: =I39+100*T39 -> 165.011 | AL39: 140.8 | AM39: 202 | AN39: 55.1 | AO39: 236 | AP39: -8.5000000000000006e-002 | AQ39: 27 | AR39: 翔鹭转债!
A40: 10 | B40: 文科转债 | C40: 128127 | D40: 44085. | E40: 文科园林 | F40: 2775 | G40: 城市公用 | H40: 生态环境 | I40: 104.3 | J40: 3.7000000000000002e-003 | K40: 1.04e-002 | L40: 5.23 | M40: 2.35e-002 | N40: 9.2 | O40: 9.0000000000000011e-003 | P40: 121.3 | Q40: 5.76 | R40: 1.07 | S40: 90.8 | T40: 0.14899999999999999 | U40: 4月26天 | V40: 5.87年 | W40: 3.87年 | X40: 0.35399999999999998 | Y40: 0.32200000000000001 | Z40: 9.5 | AA40: 27 | AB40: 2.6600000000000002e-002 | AC40: 2.0199999999999999e-002 | AD40: -2.0000000000000001e-004 | AE40: -2.2000000000000001e-003 | AF40: 80.72 | AG40: 83.97 | AH40: 0.6 | AI40: AA- | AJ40: 6.6100000000000006e-002 | AK40: =I40+100*T40 -> 119.19999999999999 | AL40: 117.8 | AM40: 18 | AN40: 33.8 | AO40: 64 | AP40: -2.3e-002 | AQ40: 10 | AR40: 文科转债
A41: 178 | B41: 智能转债! | C41: 128070 | D41: 43669. | E41: 智能自控 | F41: 2877 | G41: 机械装备 | H41: 通用设备 | I41: 104.607 | J41: -7.000000000000001e-004 | K41: 1.e-004 | L41: 7.6 | M41: -1.2999999999999999e-003 | N41: 6.1 | O41: 2.5000000000000001e-002 | P41: 117.6 | Q41: 9.51 | R41: 3.61 | S41: 79.92 | T41: 0.309 | U41: 转股中 | V41: 4.74年 | W41: 无权 | X41: 9.0999999999999998e-002 | Y41: 7.2999999999999995e-002 | Z41: 2.3 | AA41: 25 | AB41: 2.5600000000000001e-002 | AC41: 1.8799999999999997e-002 | AD41: 无权 | AE41: 无权 | AF41: 无权 | AG41: 83.97 | AH41: 0.47 | AI41: A+ | AJ41: 7.5499999999999998e-002 | AK41: =I41+100*T41 -> 135.50700000000001 | AL41: 129.3 | AM41: 104 | AN41: 45.3 | AO41: 175 | AP41: -7.5999999999999998e-002 | AQ41: 33 | AR41: 智能转债!
A42: 236 | B42: 长久转债! | C42: 113519 | D42: 43434. | E42: 长久物流 | F42: 603569 | G42: 交通运输 | H42: 物流业 | I42: 108.72 | J42: 5.5000000000000005e-003 | K42: -1.11e-002 | L42: 9.64 | M42: -1.6299999999999999e-002 | N42: 4.8 | O42: 6.0000000000000001e-003 | P42: 120.1 | Q42: 11.15 | R42: 2.58 | S42: 86.46 | T42: 0.25700000000000001 | U42: 转股中 | V42: 4年32天 | W42: 2年32天 | X42: 0.129 | Y42: 0.11199999999999999 | Z42: 7 | AA42: 54 | AB42: 2.52e-002 | AC42: 1.6500000000000001e-002 | AD42: -2.1400000000000002e-002 | AE42: -2.4399999999999998e-002 | AF42: 94.24 | AG42: 101.32 | AH42: 0.34 | AI42: AA | AJ42: 4.3499999999999997e-002 | AK42: =I42+100*T42 -> 134.41999999999999 | AL42: 131 | AM42: 124 | AN42: 29.7 | AO42: 37 | AP42: -4.9000000000000002e-002 | AQ42: 17 | AR42: 长久转债!
A43: 179 | B43: 华森转债! | C43: 128069 | D43: 43657. | E43: 华森制药 | F43: 2907 | G43: 医药 | H43: 化学制药 | I43: 107.14 | J43: 2.9999999999999997e-004 | K43: -1.9e-003 | L43: 16.14 | M43: -3.0999999999999999e-003 | N43: 1.5 | O43: 5.0000000000000001e-003 | P43: 120 | Q43: 18.04 | R43: 6.25 | S43: 89.47 | T43: 0.19800000000000001 | U43: 转股中 | V43: 4.72年 | W43: 2.72年 | X43: 4.5999999999999999e-002 | Y43: 4.0999999999999995e-002 | Z43: 3 | AA43: 65 | AB43: 2.4799999999999999e-002 | AC43: 1.7299999999999999e-002 | AD43: -1.2e-002 | AE43: -1.44e-002 | AF43: 86.6 | AG43: 89.89 | AH43: 0.52 | AI43: AA- | AJ43: 6.4500000000000002e-002 | AK43: =I43+100*T43 -> 126.94 | AL43: 124.8 | AM43: 66 | AN43: 34.9 | AO43: 75 | AP43: -6.2e-002 | AQ43: 41 | AR43: 华森转债!
A44: 141 | B44: 孚日转债! | C44: 128087 | D44: 43846. | E44: 孚日股份 | F44: 2083 | G44: 服装纺织 | H44: 家纺 | I44: 100.006 | J44: -3.0000000000000001e-003 | K44: 3.0000000000000001e-003 | L44: 4.86 | M44: 0. | N44: 5 | O44: 8.0000000000000002e-003 | P44: 113.3 | Q44: 6.3 | R44: 1.15 | S44: 77.14 | T44: 0.29600000000000004 | U44: 转股中 | V44: 5.20年 | W44: 3.20年 | X44: 0.14699999999999999 | Y44: 0.114 | Z44: 6.5 | AA44: 44 | AB44: 2.4799999999999999e-002 | AC44: 2.e-002 | AD44: 1.1299999999999999e-002 | AE44: 9.0000000000000011e-003 | AF44: 89.64 | AG44: 90.53 | AH44: 0.35 | AI44: AA | AJ44: 4.5100000000000001e-002 | AK44: =I44+100*T44 -> 129.60599999999999 | AL44: 122.9 | AM44: 49 | AN44: 32.3 | AO44: 50 | AP44: -4.0000000000000001e-002 | AQ44: 50 | AR44: 孚日转债!
A45: 266 | B45: 迪龙转债! | C45: 128033 | D45: 43129. | E45: 雪迪龙 | F45: 2658 | G45: 城市公用 | H45: 三废处理 | I45: 101.71 | J45: 1.0700000000000001e-002 | K45: -2.1099999999999997e-002 | L45: 6.44 | M45: -5.9900000000000002e-002 | N45: 4 | O45: 8.0000000000000002e-003 | P45: 109.8 | Q45: 8.83 | R45: 1.98 | S45: 72.93 | T45: 0.39500000000000002 | U45: 转股中 | V45: 3.22年 | W45: 1.22年 | X45: 0.13300000000000001 | Y45: 9.6999999999999989e-002 | Z45: 5.2 | AA45: 39 | AB45: 2.4500000000000001e-002 | AC45: 1.8600000000000002e-002 | AD45: 6.0000000000000001e-003 | AE45: 2.3e-003 | AF45: 96.71 | AG45: 95.99 | AH45: 0.17 | AI45: AA | AJ45: 4.3499999999999997e-002 | AK45: =I45+100*T45 -> 141.20999999999998 | AL45: 130.5 | AM45: 115 | AN45: 33.8 | AO45: 62 | AP45: -9.0000000000000011e-003 | AQ45: 37 | AR45: 迪龙转债!
A46: 103 | B46: 搜特转债! | C46: 128100 | D46: 43930. | E46: 搜于特 | F46: 2503 | G46: 服装纺织 | H46: 服装行业 | I46: 103.1 | J46: -3.9000000000000003e-003 | K46: -1.4000000000000002e-003 | L46: 2.53 | M46: -1.1699999999999999e-002 | N46: 12 | O46: 1.3999999999999999e-002 | P46: 117.3 | Q46: 2.9 | R46: 1.43 | S46: 87.24 | T46: 0.182 | U46: 转股中 | V46: 5.43年 | W46: 3.43年 | X46: 0.10199999999999999 | Y46: 8.900000000000001e-002 | Z46: 8 | AA46: 78 | AB46: 2.4500000000000001e-002 | AC46: 1.8700000000000001e-002 | AD46: 1.9e-003 | AE46: -2.0000000000000001e-004 | AF46: 88.72 | AG46: 92.75 | AH46: 0.45 | AI46: AA | AJ46: 4.5100000000000001e-002 | AK46: =I46+100*T46 -> 121.3 | AL46: 119 | AM46: 24 | AN46: 26.2 | AO46: 16 | AP46: -7.0999999999999994e-002 | AQ46: 41 | AR46: 搜特转债!
A47: 274 | B47: 众兴转债! | C47: 128026 | D47: 43103. | E47: 众兴菌业 | F47: 2772 | G47: 农业 | H47: 种植业 | I47: 102.397 | J47: 6.6e-003 | K47: -1.2500000000000001e-002 | L47: 9.1 | M47: -2.2599999999999999e-002 | N47: 24 | O47: 2.5000000000000001e-002 | P47: 110.3 | Q47: 11.45 | R47: 1.4 | S47: 79.48 | T47: 0.28800000000000003 | U47: 转股中 | V47: 3.19年 | W47: 1.19年 | X47: 0.27500000000000002 | Y47: 0.218 | Z47: 9.2 | AA47: 33 | AB47: 2.4199999999999999e-002 | AC47: 1.7899999999999999e-002 | AD47: 2.8999999999999998e-003 | AE47: -1.1000000000000001e-003 | AF47: 94.55 | AG47: 90.81 | AH47: 0.26 | AI47: AA- | AJ47: 6.4500000000000002e-002 | AK47: =I47+100*T47 -> 131.197 | AL47: 125.3 | AM47: 72 | AN47: 30.8 | AO47: 44 | AP47: -1.e-003 | AQ47: 56 | AR47: 众兴转债!
A48: 35 | B48: 联诚转债 | C48: 128120 | D48: 44060. | E48: 联诚精密 | F48: 2921 | G48: 汽车 | H48: 零部件制 | I48: 103.606 | J48: 2.0999999999999999e-003 | K48: -2.0999999999999999e-003 | L48: 20.48 | M48: 0. | N48: 1.8 | O48: 6.9999999999999993e-003 | P48: 118.4 | Q48: 24.37 | R48: 2.37 | S48: 84.04 | T48: 0.23300000000000001 | U48: 3月21天 | V48: 5.78年 | W48: 3.78年 | X48: 0.156 | Y48: 0.13100000000000001 | Z48: 2.6 | AA48: 17 | AB48: 2.3900000000000001e-002 | AC48: 1.8100000000000002e-002 | AD48: 2.3999999999999998e-003 | AE48: 1.e-004 | AF48: 75.51 | AG48: 73.92 | AH48: 0.63 | AI48: A | AJ48: 8.7100000000000011e-002 | AK48: =I48+100*T48 -> 126.90599999999999 | AL48: 123.2 | AM48: 53 | AN48: 47.7 | AO48: 195 | AP48: -5.7000000000000002e-002 | AQ48: 8 | AR48: 联诚转债
A49: 255 | B49: 新凤转债! | C49: 113508 | D49: 43236. | E49: 新凤鸣 | F49: 603225 | G49: 服装纺织 | H49: 纺织行业 | I49: 103.45 | J49: 9.300000000000001e-003 | K49: -8.6999999999999994e-003 | L49: 10.06 | M49: 6.9999999999999993e-003 | N49: 1.3 | O49: 1.e-003 | P49: 112.3 | Q49: 15.78 | R49: 1.25 | S49: 63.75 | T49: 0.623 | U49: 转股中 | V49: 3.55年 | W49: 1.55年 | X49: 0.153 | Y49: 9.8000000000000004e-002 | Z49: 21 | AA49: 140 | AB49: 2.3799999999999998e-002 | AC49: 1.7299999999999999e-002 | AD49: -3.7000000000000002e-003 | AE49: -6.8999999999999999e-003 | AF49: 95.6 | AG49: 96.82 | AH49: 0.09 | AI49: AA | AJ49: 4.3499999999999997e-002 | AK49: =I49+100*T49 -> 165.75 | AL49: 143.1 | AM49: 220 | AN49: 46.3 | AO49: 182 | AP49: -5.9000000000000004e-002 | AQ49: 26 | AR49: 新凤转债!
A50: 9 | B50: 齐翔转2 | C50: 128128 | D50: 44089. | E50: 齐翔腾达 | F50: 2408 | G50: 化工 | H50: 化工 | I50: 100.66 | J50: -2.8000000000000004e-003 | K50: -3.8e-003 | L50: 6.98 | M50: -1.41e-002 | N50: 66 | O50: 2.2000000000000002e-002 | P50: 115.3 | Q50: 8.22 | R50: 1.54 | S50: 84.91 | T50: 0.185 | U50: 4月23天 | V50: 5.87年 | W50: 3.87年 | X50: 0.24100000000000002 | Y50: 0.20499999999999999 | Z50: 30 | AA50: 124 | AB50: 2.3799999999999998e-002 | AC50: 1.9e-002 | AD50: 7.4999999999999997e-003 | AE50: 5.6999999999999993e-003 | AF50: 86.92 | AG50: 89.41 | AH50: 0.46 | AI50: AA | AJ50: 4.5100000000000001e-002 | AK50: =I50+100*T50 -> 119.16 | AL50: 116.4 | AM50: 12 | AN50: 27 | AO50: 22 | AP50: -0.154 | AQ50: 12 | AR50: 齐翔转2
A51: 283 | B51: 时达转债! | C51: 128018 | D51: 43073. | E51: 新时达 | F51: 2527 | G51: 机械装备 | H51: 机器人及 | I51: 102.86 | J51: 1.e-003 | K51: -1.8e-003 | L51: 5.44 | M51: -5.5000000000000005e-003 | N51: 0.3 | O51: 0. | P51: 110.3 | Q51: 7.42 | R51: 1.34 | S51: 73.32 | T51: 0.40299999999999997 | U51: 转股中 | V51: 3年31天 | W51: 1年31天 | X51: 0.26100000000000001 | Y51: 0.191 | Z51: 8.8 | AA51: 34 | AB51: 2.35e-002 | AC51: 1.7000000000000001e-002 | AD51: -5.0000000000000001e-004 | AE51: -4.8999999999999998e-003 | AF51: 97.52 | AG51: 97.03 | AH51: 0.15 | AI51: AA | AJ51: 4.3499999999999997e-002 | AK51: =I51+100*T51 -> 143.16 | AL51: 132.4 | AM51: 138 | AN51: 34.9 | AO51: 74 | AP51: -7.5999999999999998e-002 | AQ51: 40 | AR51: 时达转债!
A52: 117 | B52: 翔港转债 | C52: 113566 | D52: 43921. | E52: 翔港科技 | F52: 603499 | G52: 造纸包装 | H52: 包装材料 | I52: 110.14 | J52: -5.0000000000000001e-004 | K52: -1.1000000000000001e-002 | L52: 10.01 | M52: -1.8600000000000002e-002 | N52: 1.9 | O52: 1.e-002 | P52: 124.5 | Q52: 10.77 | R52: 2.68 | S52: 92.94 | T52: 0.185 | U52: 转股中 | V52: 5.40年 | W52: 3.40年 | X52: 8.1000000000000003e-002 | Y52: 7.4999999999999997e-002 | Z52: 1.6 | AA52: 20 | AB52: 2.35e-002 | AC52: 1.5700000000000002e-002 | AD52: -1.44e-002 | AE52: -1.6899999999999998e-002 | AF52: 80.63 | AG52: 84.21 | AH52: 0.62 | AI52: A+ | AJ52: 7.7100000000000002e-002 | AK52: =I52+100*T52 -> 128.63999999999999 | AL52: 127.3 | AM52: 86 | AN52: 43.1 | AO52: 158 | AP52: -0.18600000000000003 | AQ52: 26 | AR52: 翔港转债
A53: 31 | B53: 花王转债 | C53: 113595 | D53: 44061. | E53: 花王股份 | F53: 603007 | G53: 城市公用 | H53: 生态环境 | I53: 109.81 | J53: 6.5000000000000006e-003 | K53: 5.1999999999999998e-003 | L53: 7.2 | M53: 1.6899999999999998e-002 | N53: 15 | O53: 4.0999999999999995e-002 | P53: 125.3 | Q53: 6.94 | R53: 2.19 | S53: 103.75 | T53: 5.7999999999999996e-002 | U53: 3月23天 | V53: 5.79年 | W53: 3.79年 | X53: 0.13699999999999998 | Y53: 0.14199999999999999 | Z53: 3.3 | AA53: 24 | AB53: 2.35e-002 | AC53: 1.61e-002 | AD53: -1.3300000000000001e-002 | AE53: -1.5300000000000001e-002 | AF53: 81.14 | AG53: 87.18 | AH53: 0.69 | AI53: AA- | AJ53: 6.6100000000000006e-002 | AK53: =I53+100*T53 -> 115.61 | AL53: 115.9 | AM53: 8 | AN53: 28.7 | AO53: 30 | AP53: -6.2e-002 | AQ53: 20 | AR53: 花王转债
A54: 34 | B54: 沪工转债 | C54: 113593 | D54: 44053. | E54: 上海沪工 | F54: 603131 | G54: 机械装备 | H54: 通用设备 | I54: 106.68 | J54: -4.7999999999999996e-003 | K54: -5.6000000000000008e-003 | L54: 18.13 | M54: -1.7299999999999999e-002 | N54: 1.5 | O54: 3.0000000000000001e-003 | P54: 121.6 | Q54: 21.32 | R54: 4.76 | S54: 85.04 | T54: 0.255 | U54: 3月21天 | V54: 5.79年 | W54: 3.79年 | X54: 6.9000000000000006e-002 | Y54: 5.9000000000000004e-002 | Z54: 4 | AA54: 58 | AB54: 2.3399999999999997e-002 | AC54: 1.6799999999999999e-002 | AD54: -5.0000000000000001e-003 | AE54: -7.1999999999999998e-003 | AF54: 78.23 | AG54: 79.88 | AH54: 0.6 | AI54: A+ | AJ54: 7.7100000000000002e-002 | AK54: =I54+100*T54 -> 132.18000000000001 | AL54: 128.3 | AM54: 94 | AN54: 48.4 | AO54: 198 | AP54: -6.5000000000000002e-002 | AQ54: 5 | AR54: 沪工转债
A55: 2 | B55: 宝莱转债 | C55: 123065 | D55: 44098. | E55: 宝莱特 | F55: 300246 | G55: 医药 | H55: 医疗器械 | I55: 106.65 | J55: 3.2000000000000002e-003 | K55: -3.4999999999999996e-003 | L55: 34.88 | M55: -5.9999999999999995e-004 | N55: 15 | O55: 6.6000000000000003e-002 | P55: 121.4 | Q55: 40.54 | R55: 6.72 | S55: 86.04 | T55: 0.23999999999999999 | U55: 5月6天 | V55: 5.91年 | W55: 3.91年 | X55: 4.2999999999999997e-002 | Y55: 3.7000000000000005e-002 | Z55: 2.2 | AA55: 51 | AB55: 2.2599999999999999e-002 | AC55: 1.6200000000000003e-002 | AD55: -5.5000000000000005e-003 | AE55: -7.4999999999999997e-003 | AF55: 80.55 | AG55: 83.8 | AH55: 0.54 | AI55: AA- | AJ55: 6.6100000000000006e-002 | AK55: =I55+100*T55 -> 130.65000000000001 | AL55: 127.3 | AM55: 85 | AN55: 43.5 | AO55: 161 | AP55: -5.7999999999999996e-002 | AQ55: 4 | AR55: 宝莱转债
A56: 45 | B56: 道恩转债 | C56: 128117 | D56: 44032. | E56: 道恩股份 | F56: 2838 | G56: 化工 | H56: 橡胶塑料 | I56: 109.151 | J56: 3.2000000000000002e-003 | K56: -1.9e-003 | L56: 28 | M56: 2.0999999999999999e-003 | N56: 4.9 | O56: 1.2e-002 | P56: 123.5 | Q56: 29.07 | R56: 7.02 | S56: 96.32 | T56: 0.13300000000000001 | U56: 3月4天 | V56: 5.74年 | W56: 3.74年 | X56: 3.2000000000000001e-002 | Y56: 2.9999999999999999e-002 | Z56: 3.6 | AA56: 114 | AB56: 2.2200000000000001e-002 | AC56: 1.5100000000000001e-002 | AD56: -1.2800000000000001e-002 | AE56: -1.47e-002 | AF56: 81.07 | AG56: 86.13 | AH56: 0.64 | AI56: AA- | AJ56: 6.6100000000000006e-002 | AK56: =I56+100*T56 -> 122.45099999999999 | AL56: 122 | AM56: 42 | AN56: 35.8 | AO56: 82 | AP56: -4.2000000000000003e-002 | AQ56: 9 | AR56: 道恩转债
A57: 243 | B57: 凯中转债! | C57: 128042 | D57: 43346. | E57: 凯中精密 | F57: 2823 | G57: 能源电力 | H57: 电力设备 | I57: 107.22 | J57: 2.8999999999999998e-003 | K57: -3.4999999999999996e-003 | L57: 10.7 | M57: -1.9e-003 | N57: 3.9 | O57: 9.0000000000000011e-003 | P57: 116.3 | Q57: 12.96 | R57: 2.43 | S57: 82.56 | T57: 0.29899999999999999 | U57: 转股中 | V57: 3.81年 | W57: 1.81年 | X57: 0.13400000000000001 | Y57: 0.111 | Z57: 4.2 | AA57: 31 | AB57: 2.1899999999999999e-002 | AC57: 1.4199999999999999e-002 | AD57: -2.12e-002 | AE57: -2.3900000000000001e-002 | AF57: 94.54 | AG57: 99.15 | AH57: 0.3 | AI57: AA | AJ57: 4.3499999999999997e-002 | AK57: =I57+100*T57 -> 137.12 | AL57: 131.9 | AM57: 132 | AN57: 32.7 | AO57: 55 | AP57: -2.8999999999999998e-002 | AQ57: 23 | AR57: 凯中转债!
A58: 241 | B58: 苏农转债! | C58: 113516 | D58: 43332. | E58: 苏农银行 | F58: 603323 | G58: 金融 | H58: 银行行业 | I58: 105.4 | J58: 3.4000000000000002e-003 | K58: -8.8999999999999999e-003 | L58: 4.56 | M58: -1.72e-002 | N58: 13 | O58: 9.0000000000000011e-003 | P58: 114.3 | Q58: 5.52 | R58: 0.71 | S58: 82.61 | T58: 0.27600000000000002 | U58: 转股中 | V58: 3.82年 | W58: 无权 | X58: 0.157 | Y58: 0.13 | Z58: 13 | AA58: 82 | AB58: 2.18e-002 | AC58: 1.49e-002 | AD58: 无权 | AE58: 无权 | AF58: 无权 | AG58: 98.12 | AH58: 0.32 | AI58: AA+ | AJ58: 4.1500000000000002e-002 | AK58: =I58+100*T58 -> 133. | AL58: 128.2 | AM58: 92 | AN58: 30.1 | AO58: 40 | AP58: -3.4000000000000002e-002 | AQ58: 36 | AR58: 苏农转债!
A59: 140 | B59: 森特转债 | C59: 113557 | D59: 43840. | E59: 森特股份 | F59: 603098 | G59: 建筑 | H59: 建筑工程 | I59: 108.15 | J59: 3.2000000000000002e-003 | K59: -4.5000000000000005e-003 | L59: 9.31 | M59: -2.0999999999999999e-003 | N59: 2.5 | O59: 4.0000000000000001e-003 | P59: 120.7 | Q59: 10.11 | R59: 2.22 | S59: 92.09 | T59: 0.17399999999999999 | U59: 转股中 | V59: 5.20年 | W59: 3.20年 | X59: 0.13400000000000001 | Y59: 0.124 | Z59: 6 | AA59: 45 | AB59: 2.18e-002 | AC59: 1.4800000000000001e-002 | AD59: -1.1599999999999999e-002 | AE59: -1.3899999999999999e-002 | AF59: 84.09 | AG59: 87.16 | AH59: 0.58 | AI59: AA- | AJ59: 6.6100000000000006e-002 | AK59: =I59+100*T59 -> 125.55000000000001 | AL59: 124.2 | AM59: 63 | AN59: 37 | AO59: 97 | AP59: -5.5e-002 | AQ59: 35 | AR59: 森特转债
A60: 213 | B60: 贵广转债! | C60: 110052 | D60: 43553. | E60: 贵广网络 | F60: 600996 | G60: 传媒娱乐 | H60: 影视娱乐 | I60: 108.16 | J60: -4.0000000000000001e-003 | K60: -4.0000000000000002e-004 | L60: 7.03 | M60: -1.1299999999999999e-002 | N60: 5.9 | O60: 4.0000000000000001e-003 | P60: 118.5 | Q60: 7.94 | R60: 1.6 | S60: 88.54 | T60: 0.222 | U60: 转股中 | V60: 4.41年 | W60: 2.41年 | X60: 0.20699999999999999 | Y60: 0.183 | Z60: 15 | AA60: 74 | AB60: 2.1400000000000002e-002 | AC60: 1.38e-002 | AD60: -1.5900000000000001e-002 | AE60: -1.8700000000000001e-002 | AF60: 93.62 | AG60: 99.45 | AH60: 0.38 | AI60: AA+ | AJ60: 4.1500000000000002e-002 | AK60: =I60+100*T60 -> 130.35999999999999 | AL60: 127.8 | AM60: 90 | AN60: 28.3 | AO60: 27 | AP60: -3.1e-002 | AQ60: 18 | AR60: 贵广转债!
A61: 191 | B61: 创维转债! | C61: 127013 | D61: 43601. | E61: 创维数字 | F61: 810 | G61: 电子 | H61: 电子产品 | I61: 107.61 | J61: 4.7999999999999996e-003 | K61: -7.7000000000000002e-003 | L61: 9.6 | M61: -8.3000000000000001e-003 | N61: 6.3 | O61: 6.0000000000000001e-003 | P61: 117.9 | Q61: 11.39 | R61: 2.71 | S61: 84.28 | T61: 0.27699999999999997 | U61: 转股中 | V61: 4.52年 | W61: 2.52年 | X61: 9.6000000000000002e-002 | Y61: 8.1000000000000003e-002 | Z61: 9.8 | AA61: 102 | AB61: 2.0799999999999999e-002 | AC61: 1.37e-002 | AD61: -1.49e-002 | AE61: -1.7299999999999999e-002 | AF61: 92.32 | AG61: 97.61 | AH61: 0.35 | AI61: AA | AJ61: 4.3499999999999997e-002 | AK61: =I61+100*T61 -> 135.31 | AL61: 130.9 | AM61: 122 | AN61: 33.3 | AO61: 60 | AP61: -6.6000000000000003e-002 | AQ61: 24 | AR61: 创维转债!
A62: 150 | B62: 海亮转债! | C62: 128081 | D62: 43815. | E62: 海亮股份 | F62: 2203 | G62: 有色金属 | H62: 铜金属 | I62: 104.27 | J62: -1.1000000000000001e-003 | K62: -9.3999999999999986e-003 | L62: 7.64 | M62: -3.0499999999999999e-002 | N62: 7.7 | O62: 2.e-003 | P62: 115.2 | Q62: 9.76 | R62: 1.66 | S62: 78.28 | T62: 0.33200000000000002 | U62: 转股中 | V62: 5年46天 | W62: 3年46天 | X62: 0.21100000000000002 | Y62: 0.16500000000000001 | Z62: 32 | AA62: 149 | AB62: 2.e-002 | AC62: 1.46e-002 | AD62: -1.7000000000000001e-003 | AE62: -3.9000000000000003e-003 | AF62: 89.83 | AG62: 92.31 | AH62: 0.34 | AI62: AA | AJ62: 4.5100000000000001e-002 | AK62: =I62+100*T62 -> 137.47 | AL62: 130.3 | AM62: 110 | AN62: 37.9 | AO62: 110 | AP62: -7.4999999999999997e-002 | AQ62: 51 | AR62: 海亮转债!
A63: 164 | B63: 金轮转债! | C63: 128076 | D63: 43777. | E63: 金轮股份 | F63: 2722 | G63: 机械装备 | H63: 专用设备 | I63: 104.98 | J63: -2.9999999999999997e-004 | K63: 2.9999999999999997e-004 | L63: 12.85 | M63: 0. | N63: 1 | O63: 4.0000000000000001e-003 | P63: 115.3 | Q63: 14.76 | R63: 1.22 | S63: 87.06 | T63: 0.20600000000000002 | U63: 转股中 | V63: 5年8天 | W63: 3年8天 | X63: 9.5000000000000001e-002 | Y63: 8.3000000000000004e-002 | Z63: 2.1 | AA63: 23 | AB63: 1.9299999999999998e-002 | AC63: 1.3600000000000001e-002 | AD63: -3.5999999999999999e-003 | AE63: -5.8999999999999999e-003 | AF63: 84.86 | AG63: 84.21 | AH63: 0.56 | AI63: AA- | AJ63: 6.6100000000000006e-002 | AK63: =I63+100*T63 -> 125.58000000000001 | AL63: 122.9 | AM63: 50 | AN63: 38 | AO63: 112 | AP63: -2.3e-002 | AQ63: 41 | AR63: 金轮转债!
A64: 295 | B64: 顺昌转债!! | C64: 128010 | D64: 42423. | E64: 澳洋顺昌 | F64: 2245 | G64: 交通运输 | H64: 物流业 | I64: 106.999 | J64: 8.8000000000000005e-003 | K64: -7.4000000000000003e-003 | L64: 6.49 | M64: 7.0999999999999994e-002 | N64: 11 | O64: 2.e-002 | P64: 109.6 | Q64: 9.25 | R64: 2.97 | S64: 70.16 | T64: 0.52500000000000002 | U64: 转股中 | V64: 1.30年 | W64: 回售中 | X64: 8.0000000000000002e-002 | Y64: 5.5999999999999994e-002 | Z64: 5.1 | AA64: 64 | AB64: 1.89e-002 | AC64: 5.0000000000000001e-003 | AD64: 回售中 | AE64: 回售中 | AF64: 100.27 | AG64: 103.93 | AH64: 0.02 | AI64: AA | AJ64: 4.2300000000000004e-002 | AK64: =I64+100*T64 -> 159.499 | AL64: 143.8 | AM64: 227 | AN64: 39.9 | AO64: 132 | AP64: 0.21899999999999997 | AQ64: 41 | AR64: 顺昌转债!!
A65: 148 | B65: 华锋转债! | C65: 128082 | D65: 43836. | E65: 华锋股份 | F65: 2806 | G65: 电子 | H65: 元器件制 | I65: 111.42 | J65: 8.3999999999999995e-003 | K65: -4.1999999999999997e-003 | L65: 11.92 | M65: 5.8999999999999999e-003 | N65: 3.3 | O65: 8.0000000000000002e-003 | P65: 122 | Q65: 11.71 | R65: 1.67 | S65: 101.79 | T65: 9.5000000000000001e-002 | U65: 转股中 | V65: 5年59天 | W65: 3年59天 | X65: 0.16800000000000001 | Y65: 0.17100000000000001 | Z65: 3.5 | AA65: 21 | AB65: 1.8200000000000001e-002 | AC65: 1.0700000000000001e-002 | AD65: -1.77e-002 | AE65: -2.06e-002 | AF65: 82.42 | AG65: 84.07 | AH65: 0.71 | AI65: A+ | AJ65: 7.7100000000000002e-002 | AK65: =I65+100*T65 -> 120.92 | AL65: 121 | AM65: 36 | AN65: 37 | AO65: 93 | AP65: -3.3000000000000002e-002 | AQ65: 53 | AR65: 华锋转债!
A66: 91 | B66: 鲁泰转债 | C66: 127016 | D66: 43964. | E66: 鲁 泰Ａ | F66: 726 | G66: 服装纺织 | H66: 纺织行业 | I66: 105.4 | J66: 9.5999999999999992e-003 | K66: -1.3600000000000001e-002 | L66: 7.18 | M66: -1.1000000000000001e-002 | N66: 11 | O66: 6.9999999999999993e-003 | P66: 116.2 | Q66: 8.91 | R66: 0.79 | S66: 80.58 | T66: 0.308 | U66: 9天 | V66: 5.51年 | W66: 3.51年 | X66: 0.22699999999999998 | Y66: 0.183 | Z66: 14 | AA66: 62 | AB66: 1.8200000000000001e-002 | AC66: 1.2800000000000001e-002 | AD66: -4.5000000000000005e-003 | AE66: -6.4000000000000003e-003 | AF66: 88.94 | AG66: 92.51 | AH66: 0.37 | AI66: AA+ | AJ66: 4.3099999999999999e-002 | AK66: =I66+100*T66 -> 136.20000000000002 | AL66: 130.2 | AM66: 109 | AN66: 37.7 | AO66: 107 | AP66: -5.2999999999999999e-002 | AQ66: 21 | AR66: 鲁泰转债
A67: 43 | B67: 宁建转债 | C67: 113036 | D67: 44049. | E67: 宁波建工 | F67: 601789 | G67: 建筑 | H67: 建筑工程 | I67: 106 | J67: 6.0999999999999995e-003 | K67: -1.2699999999999999e-002 | L67: 4.28 | M67: -1.38e-002 | N67: 6 | O67: 1.1000000000000001e-002 | P67: 117.3 | Q67: 4.86 | R67: 1.43 | S67: 88.07 | T67: 0.20399999999999999 | U67: 3月7天 | V67: 5.75年 | W67: 3.75年 | X67: 0.129 | Y67: 0.114 | Z67: 5.4 | AA67: 42 | AB67: 1.8100000000000002e-002 | AC67: 1.2699999999999999e-002 | AD67: -5.4000000000000003e-003 | AE67: -7.3000000000000001e-003 | AF67: 87.48 | AG67: 91.46 | AH67: 0.48 | AI67: AA | AJ67: 4.5100000000000001e-002 | AK67: =I67+100*T67 -> 126.40000000000001 | AL67: 123.9 | AM67: 60 | AN67: 32.5 | AO67: 53 | AP67: -7.0999999999999994e-002 | AQ67: 5 | AR67: 宁建转债
A68: 12 | B68: 广汇转债 | C68: 110072 | D68: 44089. | E68: 广汇汽车 | F68: 600297 | G68: 汽车 | H68: 分销、售 | I68: 103.2 | J68: -7.7000000000000002e-003 | K68: -3.2000000000000002e-003 | L68: 3.23 | M68: -2.7099999999999999e-002 | N68: 49 | O68: 1.3999999999999999e-002 | P68: 114.5 | Q68: 4.03 | R68: 0.68 | S68: 80.15 | T68: 0.28800000000000003 | U68: 4月21天 | V68: 5.87年 | W68: 3.87年 | X68: 0.129 | Y68: 0.10300000000000001 | Z68: 34 | AA68: 262 | AB68: 1.8100000000000002e-002 | AC68: 1.3600000000000001e-002 | AD68: -5.0000000000000001e-004 | AE68: -1.9e-003 | AF68: 86.96 | AG68: 89.7 | AH68: 0.4 | AI68: AA+ | AJ68: 4.3099999999999999e-002 | AK68: =I68+100*T68 -> 132. | AL68: 126.3 | AM68: 82 | AN68: 36.5 | AO68: 86 | AP68: -0.13600000000000001 | AQ68: 12 | AR68: 广汇转债
A69: 180 | B69: 清水转债 | C69: 123028 | D69: 43661. | E69: 清水源 | F69: 300437 | G69: 城市公用 | H69: 三废处理 | I69: 112.303 | J69: -9.7000000000000003e-003 | K69: -1.24e-002 | L69: 12.65 | M69: -3.2099999999999997e-002 | N69: 8 | O69: 1.4999999999999999e-002 | P69: 121.8 | Q69: 11.84 | R69: 1.84 | S69: 106.84 | T69: 5.0999999999999997e-002 | U69: 转股中 | V69: 4.70年 | W69: 2.70年 | X69: 0.17699999999999999 | Y69: 0.19 | Z69: 4.9 | AA69: 28 | AB69: 1.7899999999999999e-002 | AC69: 9.7999999999999997e-003 | AD69: -2.4399999999999998e-002 | AE69: -2.7400000000000001e-002 | AF69: 87.74 | AG69: 91.49 | AH69: 0.69 | AI69: AA- | AJ69: 6.4500000000000002e-002 | AK69: =I69+100*T69 -> 117.40299999999999 | AL69: 117.8 | AM69: 17 | AN69: 26.3 | AO69: 18 | AP69: 4.0999999999999995e-002 | AQ69: 48 | AR69: 清水转债
A70: 198 | B70: 海环转债! | C70: 113532 | D70: 43579. | E70: 海峡环保 | F70: 603817 | G70: 城市公用 | H70: 三废处理 | I70: 104.56 | J70: 3.4999999999999996e-003 | K70: -6.8000000000000005e-003 | L70: 6.2 | M70: -9.5999999999999992e-003 | N70: 0.4 | O70: 1.e-003 | P70: 112.9 | Q70: 7.69 | R70: 1.66 | S70: 80.62 | T70: 0.29699999999999999 | U70: 转股中 | V70: 4.49年 | W70: 2.49年 | X70: 0.16500000000000001 | Y70: 0.13300000000000001 | Z70: 4.6 | AA70: 28 | AB70: 1.7600000000000001e-002 | AC70: 1.2199999999999999e-002 | AD70: -4.1999999999999997e-003 | AE70: -6.7000000000000002e-003 | AF70: 92.46 | AG70: 93.63 | AH70: 0.35 | AI70: AA | AJ70: 4.3499999999999997e-002 | AK70: =I70+100*T70 -> 134.25999999999999 | AL70: 128.5 | AM70: 96 | AN70: 34.9 | AO70: 73 | AP70: -4.7e-002 | AQ70: 25 | AR70: 海环转债!
A71: 95 | B71: 华体转债! | C71: 113574 | D71: 43948. | E71: 华体科技 | F71: 603679 | G71: 城市公用 | H71: 城市公用 | I71: 106 | J71: 2.0000000000000001e-004 | K71: 1.6200000000000003e-002 | L71: 24.53 | M71: 3.9399999999999998e-002 | N71: 5.2 | O71: 2.3e-002 | P71: 116.4 | Q71: 33.99 | R71: 3.52 | S71: 72.17 | T71: 0.46899999999999997 | U71: 1.1天 | V71: 5.48年 | W71: 3.48年 | X71: 5.9999999999999998e-002 | Y71: 4.2999999999999997e-002 | Z71: 2.1 | AA71: 35 | AB71: 1.7600000000000001e-002 | AC71: 1.2199999999999999e-002 | AD71: -3.8e-003 | AE71: -6.1999999999999998e-003 | AF71: 80.02 | AG71: 78.26 | AH71: 0.42 | AI71: A+ | AJ71: 7.7100000000000002e-002 | AK71: =I71+100*T71 -> 152.90000000000001 | AL71: 139.8 | AM71: 196 | AN71: 59.8 | AO71: 253 | AP71: -1.6e-002 | AQ71: 10 | AR71: 华体转债!
A72: 192 | B72: 核能转债! | C72: 113026 | D72: 43593. | E72: 中国核电 | F72: 601985 | G72: 能源电力 | H72: 核电 | I72: 101.89 | J72: 1.1999999999999999e-003 | K72: -2.7000000000000001e-003 | L72: 4.39 | M72: -6.8000000000000005e-003 | N72: 9.4 | O72: 1.e-003 | P72: 109.8 | Q72: 6.08 | R72: 1.36 | S72: 72.2 | T72: 0.41100000000000003 | U72: 转股中 | V72: 4.52年 | W72: 2.52年 | X72: 0.114 | Y72: 8.199999999999999e-002 | Z72: 78 | AA72: 683 | AB72: 1.7000000000000001e-002 | AC72: 1.2800000000000001e-002 | AD72: 5.1999999999999998e-003 | AE72: 2.7000000000000001e-003 | AF72: 93.41 | AG72: 92.87 | AH72: 0.22 | AI72: AAA | AJ72: 3.85e-002 | AK72: =I72+100*T72 -> 142.99000000000001 | AL72: 131.6 | AM72: 128 | AN72: 38.2 | AO72: 115 | AP72: -3.7999999999999999e-002 | AQ72: 50 | AR72: 核能转债!
A73: 98 | B73: 久吾转债 | C73: 123047 | D73: 43938. | E73: 久吾高科 | F73: 300631 | G73: 机械装备 | H73: 专用设备 | I73: 118.97 | J73: 9.300000000000001e-003 | K73: 7.000000000000001e-004 | L73: 19.88 | M73: 1.3300000000000001e-002 | N73: 13 | O73: 4.2999999999999997e-002 | P73: 130.1 | Q73: 17.61 | R73: 3.03 | S73: 112.89 | T73: 5.4000000000000006e-002 | U73: 转股中 | V73: 5.45年 | W73: 3.45年 | X73: 0.121 | Y73: 0.13699999999999998 | Z73: 2.5 | AA73: 21 | AB73: 1.7000000000000001e-002 | AC73: 7.9000000000000008e-003 | AD73: -3.15e-002 | AE73: -3.4599999999999999e-002 | AF73: 81.4 | AG73: 87.8 | AH73: 0.76 | AI73: A+ | AJ73: 7.7100000000000002e-002 | AK73: =I73+100*T73 -> 124.37 | AL73: 125 | AM73: 68 | AN73: 37.3 | AO73: 99 | AP73: -4.7e-002 | AQ73: 20 | AR73: 久吾转债
A74: 21 | B74: 大禹转债 | C74: 123063 | D74: 44063. | E74: 大禹节水 | F74: 300021 | G74: 化工 | H74: 橡胶塑料 | I74: 115.19 | J74: 6.0000000000000001e-003 | K74: -1.2800000000000001e-002 | L74: 5.19 | M74: -9.4999999999999998e-003 | N74: 13 | O74: 1.8000000000000002e-002 | P74: 126.5 | Q74: 4.94 | R74: 2.91 | S74: 105.06 | T74: 9.6000000000000002e-002 | U74: 4月0天 | V74: 5.81年 | W74: 4.81年 | X74: 0.154 | Y74: 0.16200000000000001 | Z74: 6.4 | AA74: 41 | AB74: 1.66e-002 | AC74: 8.8999999999999999e-003 | AD74: -1.49e-002 | AE74: -1.7500000000000002e-002 | AF74: 78.24 | AG74: 87.89 | AH74: 0.7 | AI74: AA- | AJ74: 6.6100000000000006e-002 | AK74: =I74+100*T74 -> 124.78999999999999 | AL74: 125.3 | AM74: 73 | AN74: 37.4 | AO74: 103 | AP74: -0.13400000000000001 | AQ74: 12 | AR74: 大禹转债
A75: 7 | B75: 嘉泽转债! | C75: 113039 | D75: 44091. | E75: 嘉泽新能 | F75: 601619 | G75: 能源电力 | H75: 风能 | I75: 102.86 | J75: -1.7000000000000001e-003 | K75: 1.54e-002 | L75: 3.13 | M75: 2.6200000000000001e-002 | N75: 47 | O75: 3.5000000000000003e-002 | P75: 113.1 | Q75: 3.57 | R75: 1.94 | S75: 87.68 | T75: 0.17300000000000001 | U75: 4月26天 | V75: 5.88年 | W75: 3.88年 | X75: 0.20000000000000001 | Y75: 0.17600000000000002 | Z75: 13 | AA75: 65 | AB75: 1.6500000000000001e-002 | AC75: 1.24e-002 | AD75: 1.8e-003 | AE75: 0. | AF75: 86.78 | AG75: 87.65 | AH75: 0.52 | AI75: AA | AJ75: 4.5100000000000001e-002 | AK75: =I75+100*T75 -> 120.16 | AL75: 118 | AM75: 21 | AN75: 30.4 | AO75: 43 | AP75: -1.4999999999999999e-002 | AQ75: 5 | AR75: 嘉泽转债!
A76: 209 | B76: 苏银转债! | C76: 110053 | D76: 43558. | E76: 江苏银行 | F76: 600919 | G76: 金融 | H76: 银行行业 | I76: 111.21 | J76: 5.0000000000000001e-003 | K76: -1.2e-002 | L76: 6.08 | M76: -2.0899999999999998e-002 | N76: 102 | O76: 5.0000000000000001e-003 | P76: 119.1 | Q76: 7.28 | R76: 0.61 | S76: 83.52 | T76: 0.33200000000000002 | U76: 转股中 | V76: 4.44年 | W76: 无权 | X76: 0.28499999999999998 | Y76: 0.23800000000000002 | Z76: 200 | AA76: 702 | AB76: 1.61e-002 | AC76: 8.3000000000000001e-003 | AD76: 无权 | AE76: 无权 | AF76: 无权 | AG76: 101.24 | AH76: 0.33 | AI76: AAA | AJ76: 3.85e-002 | AK76: =I76+100*T76 -> 144.41 | AL76: 138.9 | AM76: 190 | AN76: 37.7 | AO76: 106 | AP76: -5.2000000000000005e-002 | AQ76: 46 | AR76: 苏银转债!
A77: 204 | B77: 岱勒转债! | C77: 123024 | D77: 43572. | E77: 岱勒新材 | F77: 300700 | G77: 机械装备 | H77: 专用设备 | I77: 107.22 | J77: 4.5999999999999999e-003 | K77: -2.4300000000000002e-002 | L77: 20.05 | M77: -5.3800000000000001e-002 | N77: 1.6 | O77: 6.9999999999999993e-003 | P77: 113 | Q77: 24.9 | R77: 3.36 | S77: 80.52 | T77: 0.33200000000000002 | U77: 转股中 | V77: 3.46年 | W77: 1.46年 | X77: 0.127 | Y77: 0.10199999999999999 | Z77: 2.1 | AA77: 17 | AB77: 1.55e-002 | AC77: 8.6e-003 | AD77: -3.1899999999999998e-002 | AE77: -3.39e-002 | AF77: 90.47 | AG77: 88.16 | AH77: 0.37 | AI77: A+ | AJ77: 7.5499999999999998e-002 | AK77: =I77+100*T77 -> 140.42000000000002 | AL77: 133.9 | AM77: 153 | AN77: 43.4 | AO77: 160 | AP77: -8.6999999999999994e-002 | AQ77: 33 | AR77: 岱勒转债!
A78: 125 | B78: 银河转债! | C78: 123042 | D78: 43875. | E78: 金银河 | F78: 300619 | G78: 机械装备 | H78: 专用设备 | I78: 107.286 | J78: 0. | K78: -3.4999999999999996e-003 | L78: 21.66 | M78: -5.5000000000000005e-003 | N78: 2.3 | O78: 1.3000000000000001e-002 | P78: 115.9 | Q78: 24.4 | R78: 3.41 | S78: 88.77 | T78: 0.20899999999999999 | U78: 转股中 | V78: 5.27年 | W78: 3.27年 | X78: 0.10300000000000001 | Y78: 9.1999999999999998e-002 | Z78: 1.7 | AA78: 16 | AB78: 1.5100000000000001e-002 | AC78: 9.5999999999999992e-003 | AD78: -8.5000000000000006e-003 | AE78: -1.0800000000000001e-002 | AF78: 81.03 | AG78: 79.11 | AH78: 0.63 | AI78: A+ | AJ78: 7.7100000000000002e-002 | AK78: =I78+100*T78 -> 128.18600000000001 | AL78: 125.8 | AM78: 78 | AN78: 44.8 | AO78: 170 | AP78: -7.0999999999999994e-002 | AQ78: 23 | AR78: 银河转债!
A79: 61 | B79: 思特转债 | C79: 123054 | D79: 44018. | E79: 思特奇 | F79: 300608 | G79: 通信互联 | H79: 通信设备 | I79: 111.958 | J79: 5.0000000000000001e-004 | K79: -1.4000000000000002e-003 | L79: 17.08 | M79: -1.1999999999999999e-003 | N79: 2.4 | O79: 8.0000000000000002e-003 | P79: 121.7 | Q79: 16.49 | R79: 3.48 | S79: 103.58 | T79: 8.1000000000000003e-002 | U79: 2月11天 | V79: 5.68年 | W79: 3.68年 | X79: 0.10099999999999999 | Y79: 0.10400000000000001 | Z79: 2.7 | AA79: 27 | AB79: 1.5100000000000001e-002 | AC79: 8.5000000000000006e-003 | AD79: -1.77e-002 | AE79: -1.9900000000000001e-002 | AF79: 82.04 | AG79: 85.34 | AH79: 0.71 | AI79: AA- | AJ79: 6.6100000000000006e-002 | AK79: =I79+100*T79 -> 120.05799999999999 | AL79: 120.3 | AM79: 31 | AN79: 35 | AO79: 76 | AP79: -5.9000000000000004e-002 | AQ79: 10 | AR79: 思特转债
A80: 294 | B80: 海印转债! | C80: 127003 | D80: 42552. | E80: 海印股份 | F80: 861 | G80: 商业零售 | H80: 商场 | I80: 109.078 | J80: 1.8200000000000001e-002 | K80: -1.9799999999999998e-002 | L80: 2.65 | M80: -7.4999999999999997e-003 | N80: 11 | O80: 1.4999999999999999e-002 | P80: 111.8 | Q80: 3 | R80: 1.66 | S80: 88.33 | T80: 0.23499999999999999 | U80: 转股中 | V80: 1.67年 | W80: 回售中 | X80: 0.113 | Y80: 0.10000000000000001 | Z80: 6.7 | AA80: 59 | AB80: 1.4999999999999999e-002 | AC80: 2.e-003 | AD80: 回售中 | AE80: 回售中 | AF80: 100.3 | AG80: 104.39 | AH80: 0.21 | AI80: AA | AJ80: 4.2300000000000004e-002 | AK80: =I80+100*T80 -> 132.578 | AL80: 129.8 | AM80: 106 | AN80: 25.4 | AO80: 14 | AP80: -0.22399999999999998 | AQ80: 75 | AR80: 海印转债!
A81: 124 | B81: 星帅转债 | C81: 128094 | D81: 43880. | E81: 星帅尔 | F81: 2860 | G81: 家电 | H81: 零部件制 | I81: 112.5 | J81: 9.0000000000000011e-003 | K81: -1.3000000000000001e-002 | L81: 13.86 | M81: -5.6999999999999993e-003 | N81: 1.9 | O81: 6.0000000000000001e-003 | P81: 121.5 | Q81: 13.95 | R81: 3.08 | S81: 99.35 | T81: 0.13200000000000001 | U81: 转股中 | V81: 5.28年 | W81: 3.28年 | X81: 0.10099999999999999 | Y81: 0.10099999999999999 | Z81: 2.8 | AA81: 28 | AB81: 1.4999999999999999e-002 | AC81: 7.9000000000000008e-003 | AD81: -2.12e-002 | AE81: -2.3700000000000002e-002 | AF81: 81.26 | AG81: 82.9 | AH81: 0.71 | AI81: A+ | AJ81: 7.7100000000000002e-002 | AK81: =I81+100*T81 -> 125.7 | AL81: 125.6 | AM81: 76 | AN81: 42.7 | AO81: 153 | AP81: -4.7e-002 | AQ81: 29 | AR81: 星帅转债
A82: 196 | B82: 司尔转债! | C82: 128064 | D82: 43592. | E82: 司尔特 | F82: 2538 | G82: 化工 | H82: 农化 | I82: 107.708 | J82: -7.4999999999999997e-003 | K82: 1.1999999999999999e-003 | L82: 5.76 | M82: -1.2e-002 | N82: 4.6 | O82: 5.0000000000000001e-003 | P82: 114.9 | Q82: 6.07 | R82: 1.1 | S82: 94.89 | T82: 0.13500000000000001 | U82: 转股中 | V82: 4.50年 | W82: 2.50年 | X82: 0.193 | Y82: 0.184 | Z82: 8 | AA82: 41 | AB82: 1.47e-002 | AC82: 8.6999999999999994e-003 | AD82: -1.5300000000000001e-002 | AE82: -1.77e-002 | AF82: 92.39 | AG82: 95.21 | AH82: 0.52 | AI82: AA | AJ82: 4.3499999999999997e-002 | AK82: =I82+100*T82 -> 121.208 | AL82: 120.5 | AM82: 33 | AN82: 25.3 | AO82: 13 | AP82: -0.11 | AQ82: 56 | AR82: 司尔转债!
A83: 11 | B83: 精达转债 | C83: 110074 | D83: 44095. | E83: 精达股份 | F83: 600577 | G83: 电子 | H83: 电子产品 | I83: 108 | J83: 1.9e-003 | K83: -4.6999999999999993e-003 | L83: 3.28 | M83: -6.0999999999999995e-003 | N83: 31 | O83: 3.6000000000000004e-002 | P83: 117.3 | Q83: 3.75 | R83: 1.79 | S83: 87.47 | T83: 0.23499999999999999 | U83: 4月22天 | V83: 5.87年 | W83: 3.87年 | X83: 0.125 | Y83: 0.109 | Z83: 7.9 | AA83: 63 | AB83: 1.44e-002 | AC83: 9.1000000000000004e-003 | AD83: -9.8999999999999991e-003 | AE83: -1.1699999999999999e-002 | AF83: 87.02 | AG83: 90.98 | AH83: 0.48 | AI83: AA | AJ83: 4.5100000000000001e-002 | AK83: =I83+100*T83 -> 131.5 | AL83: 128.5 | AM83: 97 | AN83: 37.6 | AO83: 105 | AP83: -0.109 | AQ83: 5 | AR83: 精达转债
A84: 269 | B84: 双环转债! | C84: 128032 | D84: 43125. | E84: 双环传动 | F84: 2472 | G84: 机械装备 | H84: 通用设备 | I84: 105.499 | J84: 7.1999999999999998e-003 | K84: -6.8000000000000005e-003 | L84: 6.5 | M84: 4.5999999999999999e-003 | N84: 1.4 | O84: 1.e-003 | P84: 110.3 | Q84: 9.89 | R84: 1.36 | S84: 65.72 | T84: 0.60499999999999998 | U84: 转股中 | V84: 3.22年 | W84: 1.22年 | X84: 0.22399999999999998 | Y84: 0.14699999999999999 | Z84: 10 | AA84: 45 | AB84: 1.4199999999999999e-002 | AC84: 8.1000000000000013e-003 | AD84: -1.8700000000000001e-002 | AE84: -2.2599999999999999e-002 | AF84: 96.97 | AG84: 96.47 | AH84: 0.08 | AI84: AA | AJ84: 4.3499999999999997e-002 | AK84: =I84+100*T84 -> 165.999 | AL84: 145.3 | AM84: 238 | AN84: 48.3 | AO84: 197 | AP84: -6.8000000000000005e-002 | AQ84: 47 | AR84: 双环转债!
A85: 28 | B85: 紫银转债 | C85: 113037 | D85: 44060. | E85: 紫金银行 | F85: 601860 | G85: 金融 | H85: 银行行业 | I85: 106.91 | J85: 1.9e-003 | K85: -1.0700000000000001e-002 | L85: 4.06 | M85: -1.9299999999999998e-002 | N85: 28 | O85: 6.0000000000000001e-003 | P85: 115.8 | Q85: 4.75 | R85: 1.08 | S85: 85.47 | T85: 0.251 | U85: 3月25天 | V85: 5.79年 | W85: 无权 | X85: 0.30299999999999999 | Y85: 0.25900000000000001 | Z85: 45 | AA85: 149 | AB85: 1.41e-002 | AC85: 9.1999999999999998e-003 | AD85: 无权 | AE85: 无权 | AF85: 无权 | AG85: 91.11 | AH85: 0.46 | AI85: AA+ | AJ85: 4.3099999999999999e-002 | AK85: =I85+100*T85 -> 132.00999999999999 | AL85: 128.3 | AM85: 95 | AN85: 37.2 | AO85: 98 | AP85: -3.6000000000000004e-002 | AQ85: 14 | AR85: 紫银转债
A86: 250 | B86: 湖广转债! | C86: 127007 | D86: 43313. | E86: 湖北广电 | F86: 665 | G86: 传媒娱乐 | H86: 影视娱乐 | I86: 106.72 | J86: -8.0000000000000004e-004 | K86: -9.7000000000000003e-003 | L86: 4.91 | M86: -2.58e-002 | N86: 2.5 | O86: 2.e-003 | P86: 112.3 | Q86: 5.58 | R86: 0.73 | S86: 87.99 | T86: 0.21299999999999999 | U86: 转股中 | V86: 3.73年 | W86: 1.73年 | X86: 0.252 | Y86: 0.222 | Z86: 12 | AA86: 48 | AB86: 1.3999999999999999e-002 | AC86: 7.9000000000000008e-003 | AD86: -1.9699999999999999e-002 | AE86: -2.2499999999999999e-002 | AF86: 95.24 | AG86: 96.78 | AH86: 0.4 | AI86: AA+ | AJ86: 4.1500000000000002e-002 | AK86: =I86+100*T86 -> 128.02000000000001 | AL86: 125.4 | AM86: 74 | AN86: 28.7 | AO86: 29 | AP86: -6.3e-002 | AQ86: 17 | AR86: 湖广转债!
A87: 109 | B87: 百达转债 | C87: 113570 | D87: 43929. | E87: 百达精工 | F87: 603331 | G87: 机械装备 | H87: 机械装备 | I87: 107.05 | J87: 6.1999999999999998e-003 | K87: -6.1999999999999998e-003 | L87: 10.47 | M87: 0. | N87: 4.5 | O87: 1.4999999999999999e-002 | P87: 115.3 | Q87: 11.54 | R87: 1.71 | S87: 90.73 | T87: 0.17999999999999999 | U87: 转股中 | V87: 5.43年 | W87: 3.43年 | X87: 0.14899999999999999 | Y87: 0.13600000000000001 | Z87: 2.8 | AA87: 19 | AB87: 1.3999999999999999e-002 | AC87: 8.8999999999999999e-003 | AD87: -8.6e-003 | AE87: -1.06e-002 | AF87: 79.71 | AG87: 77.71 | AH87: 0.67 | AI87: A+ | AJ87: 7.7100000000000002e-002 | AK87: =I87+100*T87 -> 125.05 | AL87: 123.4 | AM87: 57 | AN87: 43.7 | AO87: 163 | AP87: -7.2999999999999995e-002 | AQ87: 31 | AR87: 百达转债
A88: 66 | B88: 飞鹿转债 | C88: 123052 | D88: 44015. | E88: 飞鹿股份 | F88: 300665 | G88: 化工 | H88: 化工 | I88: 118 | J88: 2.7000000000000001e-003 | K88: 4.1999999999999997e-003 | L88: 11.76 | M88: 8.6e-003 | N88: 7 | O88: 3.3000000000000002e-002 | P88: 127.3 | Q88: 9.9 | R88: 3.13 | S88: 118.79 | T88: -6.9999999999999993e-003 | U88: 2月6天 | V88: 5.66年 | W88: 3.66年 | X88: 0.124 | Y88: 0.14699999999999999 | Z88: 1.8 | AA88: 14 | AB88: 1.38e-002 | AC88: 5.7999999999999996e-003 | AD88: -2.9900000000000003e-002 | AE88: -3.2300000000000002e-002 | AF88: 79.48 | AG88: 84.48 | AH88: 0.81 | AI88: A+ | AJ88: 7.7100000000000002e-002 | AK88: =I88+100*T88 -> 117.3 | AL88: 117.2 | AM88: 15 | AN88: 32.7 | AO88: 56 | AP88: -2.9999999999999999e-002 | AQ88: 9 | AR88: 飞鹿转债
A89: 195 | B89: 核建转债! | C89: 113024 | D89: 43581. | E89: 中国核建 | F89: 601611 | G89: 建筑 | H89: 建筑工程 | I89: 103.31 | J89: 3.4999999999999996e-003 | K89: -3.0999999999999999e-003 | L89: 7.28 | M89: 1.4000000000000002e-003 | N89: 11 | O89: 4.0000000000000001e-003 | P89: 109.7 | Q89: 9.76 | R89: 1.86 | S89: 74.59 | T89: 0.38500000000000001 | U89: 转股中 | V89: 4.50年 | W89: 2.50年 | X89: 0.155 | Y89: 0.11599999999999999 | Z89: 30 | AA89: 193 | AB89: 1.37e-002 | AC89: 9.5999999999999992e-003 | AD89: -4.0000000000000002e-004 | AE89: -2.7000000000000001e-003 | AF89: 93.37 | AG89: 92.84 | AH89: 0.26 | AI89: AAA | AJ89: 3.85e-002 | AK89: =I89+100*T89 -> 141.81 | AL89: 132 | AM89: 134 | AN89: 38.7 | AO89: 122 | AP89: -3.4000000000000002e-002 | AQ89: 43 | AR89: 核建转债!
A90: 229 | B90: 山鹰转债 | C90: 110047 | D90: 43444. | E90: 山鹰纸业 | F90: 600567 | G90: 造纸包装 | H90: 包装用纸 | I90: 111.85 | J90: 9.3999999999999986e-003 | K90: -1.4800000000000001e-002 | L90: 3.08 | M90: -1.2800000000000001e-002 | N90: 10 | O90: 4.0000000000000001e-003 | P90: 118.1 | Q90: 3.34 | R90: 1 | S90: 92.22 | T90: 0.21299999999999999 | U90: 转股中 | V90: 4年46天 | W90: 2年46天 | X90: 0.16200000000000001 | Y90: 0.14999999999999999 | Z90: 23 | AA90: 142 | AB90: 1.3600000000000001e-002 | AC90: 5.6999999999999993e-003 | AD90: -3.39e-002 | AE90: -3.6699999999999997e-002 | AF90: 94.33 | AG90: 100.22 | AH90: 0.42 | AI90: AA+ | AJ90: 4.1500000000000002e-002 | AK90: =I90+100*T90 -> 133.15000000000001 | AL90: 131.5 | AM90: 127 | AN90: 31.3 | AO90: 46 | AP90: -3.6000000000000004e-002 | AQ90: 35 | AR90: 山鹰转债
A91: 170 | B91: 哈尔转债! | C91: 128073 | D91: 43719. | E91: 哈尔斯 | F91: 2615 | G91: 其他 | H91: 家居用品 | I91: 109.5 | J91: 1.9e-003 | K91: -8.0000000000000002e-003 | L91: 5.31 | M91: -1.1200000000000002e-002 | N91: 8.8 | O91: 2.7000000000000003e-002 | P91: 115.3 | Q91: 5.72 | R91: 2.82 | S91: 92.83 | T91: 0.17999999999999999 | U91: 转股中 | V91: 3.88年 | W91: 1.88年 | X91: 0.13699999999999998 | Y91: 0.127 | Z91: 3 | AA91: 22 | AB91: 1.3600000000000001e-002 | AC91: 6.5000000000000006e-003 | AD91: -3.4099999999999998e-002 | AE91: -3.5900000000000001e-002 | AF91: 89.87 | AG91: 90.78 | AH91: 0.54 | AI91: AA- | AJ91: 6.4500000000000002e-002 | AK91: =I91+100*T91 -> 127.5 | AL91: 126.2 | AM91: 81 | AN91: 35.4 | AO91: 78 | AP91: -0.129 | AQ91: 38 | AR91: 哈尔转债!
A92: 129 | B92: 正裕转债! | C92: 113561 | D92: 43871. | E92: 正裕工业 | F92: 603089 | G92: 汽车 | H92: 零部件制 | I92: 110.79 | J92: 2.5499999999999998e-002 | K92: 1.7100000000000001e-002 | L92: 10.8 | M92: 5.57e-002 | N92: 90 | O92: 0.48700000000000004 | P92: 118.5 | Q92: 10.23 | R92: 2.88 | S92: 105.57 | T92: 4.9000000000000002e-002 | U92: 转股中 | V92: 5.24年 | W92: 3.24年 | X92: 7.2999999999999995e-002 | Y92: 7.6999999999999999e-002 | Z92: 1.6 | AA92: 23 | AB92: 1.3300000000000001e-002 | AC92: 6.9999999999999993e-003 | AD92: -1.6799999999999999e-002 | AE92: -1.9400000000000001e-002 | AF92: 81.61 | AG92: 81.16 | AH92: 0.77 | AI92: A+ | AJ92: 7.7100000000000002e-002 | AK92: =I92+100*T92 -> 115.69000000000001 | AL92: 116 | AM92: 10 | AN92: 34.4 | AO92: 69 | AP92: -0.16899999999999998 | AQ92: 30 | AR92: 正裕转债!
A93: 156 | B93: 金力转债! | C93: 123033 | D93: 43794. | E93: 金力永磁 | F93: 300748 | G93: 电子 | H93: 元器件制 | I93: 114.5 | J93: 3.4000000000000002e-003 | K93: -3.4000000000000002e-003 | L93: 40.55 | M93: 0. | N93: 88 | O93: 0.17600000000000002 | P93: 121.9 | Q93: 40.97 | R93: 13.21 | S93: 98.97 | T93: 0.157 | U93: 转股中 | V93: 5年26天 | W93: 3年26天 | X93: 2.6000000000000002e-002 | Y93: 2.6000000000000002e-002 | Z93: 4.4 | AA93: 169 | AB93: 1.2800000000000001e-002 | AC93: 5.3e-003 | AD93: -2.5600000000000001e-002 | AE93: -2.87e-002 | AF93: 85.98 | AG93: 88.98 | AH93: 0.66 | AI93: AA- | AJ93: 6.6100000000000006e-002 | AK93: =I93+100*T93 -> 130.19999999999999 | AL93: 130 | AM93: 108 | AN93: 41 | AO93: 142 | AP93: 2.7999999999999997e-002 | AQ93: 25 | AR93: 金力转债!
A94: 152 | B94: 白电转债 | C94: 113549 | D94: 43810. | E94: 白云电器 | F94: 603861 | G94: 能源电力 | H94: 电力设备 | I94: 108.1 | J94: 0. | K94: 1.2999999999999999e-003 | L94: 8.2 | M94: 2.3999999999999998e-003 | N94: 2.2 | O94: 2.e-003 | P94: 115.1 | Q94: 8.88 | R94: 1.6 | S94: 92.34 | T94: 0.17100000000000001 | U94: 转股中 | V94: 5年40天 | W94: 3年40天 | X94: 0.24299999999999999 | Y94: 0.22399999999999998 | Z94: 8.8 | AA94: 36 | AB94: 1.26e-002 | AC94: 7.1999999999999998e-003 | AD94: -1.3000000000000001e-002 | AE94: -1.5100000000000001e-002 | AF94: 89.8 | AG94: 92.28 | AH94: 0.52 | AI94: AA | AJ94: 4.5100000000000001e-002 | AK94: =I94+100*T94 -> 125.19999999999999 | AL94: 123.9 | AM94: 58 | AN94: 31.6 | AO94: 48 | AP94: -5.2000000000000005e-002 | AQ94: 31 | AR94: 白电转债
A95: 44 | B95: 瀛通转债 | C95: 128118 | D95: 44048. | E95: 瀛通通讯 | F95: 2861 | G95: 电子 | H95: 电子产品 | I95: 113.9 | J95: 1.7000000000000001e-002 | K95: -1.6299999999999999e-002 | L95: 24.5 | M95: 1.1999999999999999e-003 | N95: 2.8 | O95: 8.0000000000000002e-003 | P95: 122.1 | Q95: 27.53 | R95: 2.84 | S95: 88.99 | T95: 0.28000000000000003 | U95: 3月4天 | V95: 5.74年 | W95: 3.74年 | X95: 0.10099999999999999 | Y95: 8.900000000000001e-002 | Z95: 3 | AA95: 30 | AB95: 1.2500000000000001e-002 | AC95: 5.7999999999999996e-003 | AD95: -2.18e-002 | AE95: -2.4e-002 | AF95: 81.7 | AG95: 85.29 | AH95: 0.57 | AI95: AA- | AJ95: 6.6100000000000006e-002 | AK95: =I95+100*T95 -> 141.90000000000001 | AL95: 138.8 | AM95: 189 | AN95: 53.5 | AO95: 224 | AP95: -3.4000000000000002e-002 | AQ95: 4 | AR95: 瀛通转债
A96: 160 | B96: 北方转债 | C96: 127014 | D96: 43790. | E96: 北方国际 | F96: 65 | G96: 建筑 | H96: 建筑工程 | I96: 109.1 | J96: 4.5999999999999999e-003 | K96: -4.5999999999999999e-003 | L96: 7.51 | M96: 0. | N96: 0.3 | O96: 1.e-003 | P96: 115.6 | Q96: 8.75 | R96: 1.16 | S96: 85.83 | T96: 0.27100000000000002 | U96: 转股中 | V96: 5年18天 | W96: 3年18天 | X96: 0.10000000000000001 | Y96: 8.5999999999999993e-002 | Z96: 5.8 | AA96: 58 | AB96: 1.18e-002 | AC96: 6.1999999999999998e-003 | AD96: -1.47e-002 | AE96: -1.7100000000000001e-002 | AF96: 91.07 | AG96: 93.9 | AH96: 0.42 | AI96: AA+ | AJ96: 4.3099999999999999e-002 | AK96: =I96+100*T96 -> 136.19999999999999 | AL96: 132.4 | AM96: 137 | AN96: 38.5 | AO96: 120 | AP96: -2.6000000000000002e-002 | AQ96: 17 | AR96: 北方转债
A97: 32 | B97: 淳中转债 | C97: 113594 | D97: 44071. | E97: 淳中科技 | F97: 603516 | G97: 电子 | H97: 电子产品 | I97: 113.6 | J97: -8.0000000000000004e-004 | K97: 1.8100000000000002e-002 | L97: 33.94 | M97: 2.8500000000000001e-002 | N97: 0.5 | O97: 1.e-003 | P97: 121.4 | Q97: 39.37 | R97: 5.33 | S97: 86.21 | T97: 0.318 | U97: 3月23天 | V97: 5.79年 | W97: 3.79年 | X97: 6.6000000000000003e-002 | Y97: 5.7000000000000002e-002 | Z97: 3 | AA97: 45 | AB97: 1.18e-002 | AC97: 5.4000000000000003e-003 | AD97: -2.0899999999999998e-002 | AE97: -2.3099999999999999e-002 | AF97: 78.22 | AG97: 79.75 | AH97: 0.61 | AI97: A+ | AJ97: 7.7100000000000002e-002 | AK97: =I97+100*T97 -> 145.40000000000001 | AL97: 141 | AM97: 203 | AN97: 61.2 | AO97: 258 | AP97: -3.5000000000000003e-002 | AQ97: 3 | AR97: 淳中转债
A98: 194 | B98: 鼎胜转债! | C98: 113534 | D98: 43585. | E98: 鼎胜新材 | F98: 603876 | G98: 有色金属 | H98: 小金属 | I98: 109.36 | J98: 1.78e-002 | K98: -2.3300000000000001e-002 | L98: 13.15 | M98: -1.3500000000000002e-002 | N98: 18 | O98: 1.3999999999999999e-002 | P98: 114.9 | Q98: 15.18 | R98: 1.58 | S98: 86.63 | T98: 0.26200000000000001 | U98: 转股中 | V98: 4.51年 | W98: 2.51年 | X98: 0.20999999999999999 | Y98: 0.182 | Z98: 12 | AA98: 57 | AB98: 1.1200000000000002e-002 | AC98: 5.1999999999999998e-003 | AD98: -2.0899999999999998e-002 | AE98: -2.3300000000000001e-002 | AF98: 92.38 | AG98: 95.2 | AH98: 0.41 | AI98: AA | AJ98: 4.3499999999999997e-002 | AK98: =I98+100*T98 -> 135.56 | AL98: 132.1 | AM98: 135 | AN98: 36.9 | AO98: 89 | AP98: -5.5999999999999994e-002 | AQ98: 31 | AR98: 鼎胜转债!
A99: 16 | B99: 嘉友转债 | C99: 113599 | D99: 44081. | E99: 嘉友国际 | F99: 603871 | G99: 交通运输 | H99: 物流业 | I99: 118.23 | J99: 2.4300000000000002e-002 | K99: -1.4499999999999999e-002 | L99: 30.3 | M99: 1.2e-002 | N99: 41 | O99: 4.8000000000000001e-002 | P99: 126 | Q99: 24.82 | R99: 3.57 | S99: 122.08 | T99: -3.2000000000000001e-002 | U99: 4月15天 | V99: 5.83年 | W99: 3.83年 | X99: 0.10800000000000001 | Y99: 0.13200000000000001 | Z99: 7.2 | AA99: 67 | AB99: 1.1200000000000002e-002 | AC99: 3.7000000000000002e-003 | AD99: -3.2000000000000001e-002 | AE99: -3.3799999999999997e-002 | AF99: 80.66 | AG99: 87.36 | AH99: 0.81 | AI99: AA- | AJ99: 6.6100000000000006e-002 | AK99: =I99+100*T99 -> 115.03 | AL99: 114.4 | AM99: 4 | AN99: 27 | AO99: 23 | AP99: -2.1000000000000001e-002 | AQ99: 7 | AR99: 嘉友转债
A100: 114 | B100: 君禾转债 | C100: 113567 | D100: 43924. | E100: 君禾股份 | F100: 603617 | G100: 机械装备 | H100: 通用设备 | I100: 112.55 | J100: 1.4499999999999999e-002 | K100: 9.0000000000000011e-003 | L100: 12.21 | M100: 3.04e-002 | N100: 6.8 | O100: 2.8999999999999998e-002 | P100: 119.3 | Q100: 11.46 | R100: 3.9 | S100: 106.54 | T100: 5.5999999999999994e-002 | U100: 转股中 | V100: 5.41年 | W100: 3.41年 | X100: 8.5999999999999993e-002 | Y100: 9.1999999999999998e-002 | Z100: 2.1 | AA100: 24 | AB100: 1.11e-002 | AC100: 4.7999999999999996e-003 | AD100: -2.0899999999999998e-002 | AE100: -2.3199999999999998e-002 | AF100: 80.4 | AG100: 80.64 | AH100: 0.77 | AI100: A+ | AJ100: 7.7100000000000002e-002 | AK100: =I100+100*T100 -> 118.14999999999999 | AL100: 118.6 | AM100: 23 | AN100: 37.9 | AO100: 109 | AP100: 2.4e-002 | AQ100: 29 | AR100: 君禾转债
A101: 188 | B101: 亚泰转债! | C101: 128066 | D101: 43599. | E101: 郑中设计 | F101: 2811 | G101: 建筑 | H101: 装饰工程 | I101: 111.97 | J101: 1.1999999999999999e-003 | K101: -4.0000000000000001e-003 | L101: 10.1 | M101: -3.9000000000000003e-003 | N101: 1.2 | O101: 2.e-003 | P101: 117.5 | Q101: 9.67 | R101: 1.86 | S101: 104.45 | T101: 7.2000000000000008e-002 | U101: 转股中 | V101: 4.53年 | W101: 2.53年 | X101: 0.17600000000000002 | Y101: 0.184 | Z101: 4.8 | AA101: 27 | AB101: 1.09e-002 | AC101: 4.0000000000000001e-003 | AD101: -2.7900000000000001e-002 | AE101: -3.0600000000000002e-002 | AF101: 87.92 | AG101: 89.12 | AH101: 0.71 | AI101: AA- | AJ101: 6.4500000000000002e-002 | AK101: =I101+100*T101 -> 119.17 | AL101: 119.5 | AM101: 29 | AN101: 30.4 | AO101: 42 | AP101: -3.3000000000000002e-002 | AQ101: 58 | AR101: 亚泰转债!
A102: 37 | B102: 银信转债 | C102: 123059 | D102: 44055. | E102: 银信科技 | F102: 300231 | G102: 计算机及 | H102: 软件开发 | I102: 116.8 | J102: 1.1999999999999999e-003 | K102: -1.09e-002 | L102: 9.96 | M102: -1.4800000000000001e-002 | N102: 7.5 | O102: 1.6e-002 | P102: 124.1 | Q102: 9.91 | R102: 3.48 | S102: 100.5 | T102: 0.16200000000000001 | U102: 3月17天 | V102: 5.77年 | W102: 3.77年 | X102: 8.900000000000001e-002 | Y102: 8.900000000000001e-002 | Z102: 3.9 | AA102: 44 | AB102: 1.0800000000000001e-002 | AC102: 3.7000000000000002e-003 | AD102: -2.9300000000000003e-002 | AE102: -3.1099999999999999e-002 | AF102: 81.04 | AG102: 86.39 | AH102: 0.66 | AI102: AA- | AJ102: 6.6100000000000006e-002 | AK102: =I102+100*T102 -> 133. | AL102: 133.1 | AM102: 144 | AN102: 46.7 | AO102: 188 | AP102: -9.3000000000000013e-002 | AQ102: 8 | AR102: 银信转债
A103: 166 | B103: 万里转债! | C103: 123032 | D103: 43769. | E103: 万里马 | F103: 300591 | G103: 服装纺织 | H103: 服装纺织 | I103: 126.6 | J103: 0. | K103: -1.8100000000000002e-002 | L103: 8.16 | M103: -2.3900000000000001e-002 | N103: 32 | O103: 0.18899999999999997 | P103: 132.8 | Q103: 6.89 | R103: 5.63 | S103: 118.43 | T103: 6.9000000000000006e-002 | U103: 转股中 | V103: 5年5.1天 | W103: 3年5.1天 | X103: 5.0999999999999997e-002 | Y103: 5.9999999999999998e-002 | Z103: 1.3 | AA103: 26 | AB103: 1.e-002 | AC103: -5.9999999999999995e-004 | AD103: -5.0199999999999995e-002 | AE103: -5.45e-002 | AF103: 85.73 | AG103: 92.96 | AH103: 0.76 | AI103: A+ | AJ103: 7.7100000000000002e-002 | AK103: =I103+100*T103 -> 133.5 | AL103: 134.8 | AM103: 162 | AN103: 41.8 | AO103: 147 | AP103: -1.3999999999999999e-002 | AQ103: 43 | AR103: 万里转债!
A104: 48 | B104: 瑞达转债 | C104: 128116 | D104: 44036. | E104: 瑞达期货 | F104: 2961 | G104: 金融 | H104: 期货行业 | I104: 109.002 | J104: -6.4000000000000003e-003 | K104: 8.3999999999999995e-003 | L104: 28.35 | M104: 3.4999999999999996e-003 | N104: 12 | O104: 1.8000000000000002e-002 | P104: 115.3 | Q104: 29.82 | R104: 7.42 | S104: 95.07 | T104: 0.14699999999999999 | U104: 3月0天 | V104: 5.73年 | W104: 3.73年 | X104: 5.2000000000000005e-002 | Y104: 4.9000000000000002e-002 | Z104: 6.5 | AA104: 126 | AB104: 1.e-002 | AC104: 5.1999999999999998e-003 | AD104: -1.2800000000000001e-002 | AE104: -1.46e-002 | AF104: 87.48 | AG104: 89.98 | AH104: 0.57 | AI104: AA | AJ104: 4.5100000000000001e-002 | AK104: =I104+100*T104 -> 123.702 | AL104: 122.9 | AM104: 51 | AN104: 33 | AO104: 59 | AP104: -1.6e-002 | AQ104: 7 | AR104: 瑞达转债
A105: 265 | B105: 道氏转债!! | C105: 123007 | D105: 43126. | E105: 道氏技术 | F105: 300409 | G105: 建筑 | H105: 建筑行业 | I105: 107.922 | J105: 3.9000000000000003e-003 | K105: -1.21e-002 | L105: 12.39 | M105: -2.3599999999999999e-002 | N105: 2.1 | O105: 6.0000000000000001e-003 | P105: 111.3 | Q105: 14.95 | R105: 2.39 | S105: 82.88 | T105: 0.30199999999999999 | U105: 转股中 | V105: 3.23年 | W105: 1.23年 | X105: 5.2999999999999999e-002 | Y105: 4.4000000000000004e-002 | Z105: 3 | AA105: 57 | AB105: 9.7999999999999997e-003 | AC105: 3.3e-003 | AD105: -3.4300000000000004e-002 | AE105: -3.8100000000000002e-002 | AF105: 94.34 | AG105: 91.39 | AH105: 0.35 | AI105: AA- | AJ105: 6.4500000000000002e-002 | AK105: =I105+100*T105 -> 138.12199999999999 | AL105: 133 | AM105: 142 | AN105: 38.6 | AO105: 121 | AP105: -8.5000000000000006e-002 | AQ105: 15 | AR105: 道氏转债!!
A106: 275 | B106: 特一转债! | C106: 128025 | D106: 43097. | E106: 特一药业 | F106: 2728 | G106: 医药 | H106: 化学制药 | I106: 106.6 | J106: 3.0999999999999999e-003 | K106: -5.1999999999999998e-003 | L106: 13.28 | M106: -4.5000000000000005e-003 | N106: 1 | O106: 3.0000000000000001e-003 | P106: 109.8 | Q106: 14.7 | R106: 2.68 | S106: 90.34 | T106: 0.17999999999999999 | U106: 转股中 | V106: 3.17年 | W106: 1.17年 | X106: 0.111 | Y106: 0.10000000000000001 | Z106: 3 | AA106: 27 | AB106: 9.5999999999999992e-003 | AC106: 3.7000000000000002e-003 | AD106: -2.8900000000000002e-002 | AE106: -3.2500000000000001e-002 | AF106: 94.43 | AG106: 90.47 | AH106: 0.47 | AI106: AA- | AJ106: 6.4500000000000002e-002 | AK106: =I106+100*T106 -> 124.59999999999999 | AL106: 122.9 | AM106: 48 | AN106: 28.4 | AO106: 28 | AP106: -4.4000000000000004e-002 | AQ106: 43 | AR106: 特一转债!
A107: 101 | B107: 联创转债! | C107: 128101 | D107: 43934. | E107: 联创电子 | F107: 2036 | G107: 电子 | H107: 液晶显示 | I107: 109.503 | J107: 1.0200000000000001e-002 | K107: -7.3000000000000001e-003 | L107: 10.82 | M107: 9.300000000000001e-003 | N107: 1.4 | O107: 4.0000000000000001e-003 | P107: 115.1 | Q107: 14.48 | R107: 4.03 | S107: 74.72 | T107: 0.46500000000000002 | U107: 转股中 | V107: 5.44年 | W107: 3.44年 | X107: 2.9999999999999999e-002 | Y107: 2.2000000000000002e-002 | Z107: 3 | AA107: 101 | AB107: 9.3999999999999986e-003 | AC107: 4.3e-003 | AD107: -1.54e-002 | AE107: -1.7299999999999999e-002 | AF107: 88.48 | AG107: 90.94 | AH107: 0.31 | AI107: AA | AJ107: 4.5100000000000001e-002 | AK107: =I107+100*T107 -> 156.00299999999999 | AL107: 144.3 | AM107: 231 | AN107: 53.3 | AO107: 221 | AP107: -5.5e-002 | AQ107: 14 | AR107: 联创转债!
A108: 293 | B108: 洪涛转债! | C108: 128013 | D108: 42605. | E108: 洪涛股份 | F108: 2325 | G108: 建筑 | H108: 装饰工程 | I108: 108.005 | J108: 2.8000000000000004e-003 | K108: -4.5999999999999999e-003 | L108: 3.1 | M108: -3.2000000000000002e-003 | N108: 13 | O108: 1.e-002 | P108: 109.8 | Q108: 3.1 | R108: 1.26 | S108: 100 | T108: 8.0000000000000002e-002 | U108: 转股中 | V108: 1.81年 | W108: 回售中 | X108: 0.309 | Y108: 0.309 | Z108: 12 | AA108: 39 | AB108: 9.1999999999999998e-003 | AC108: -8.0000000000000004e-004 | AD108: 回售中 | AE108: 回售中 | AF108: 100.3 | AG108: 98.35 | AH108: 0.55 | AI108: AA- | AJ108: 6.3299999999999995e-002 | AK108: =I108+100*T108 -> 116.005 | AL108: 116 | AM108: 11 | AN108: 15.7 | AO108: 3 | AP108: -4.4999999999999998e-002 | AQ108: 89 | AR108: 洪涛转债!
A109: 132 | B109: 开润转债! | C109: 123039 | D109: 43853. | E109: 开润股份 | F109: 300577 | G109: 服装纺织 | H109: 纺织行业 | I109: 116 | J109: 0. | K109: -9.1000000000000004e-003 | L109: 31.85 | M109: -1.3300000000000001e-002 | N109: 0.9 | O109: 4.0000000000000001e-003 | P109: 121.5 | Q109: 33.22 | R109: 7.88 | S109: 95.88 | T109: 0.20999999999999999 | U109: 转股中 | V109: 5.22年 | W109: 3.22年 | X109: 3.2000000000000001e-002 | Y109: 3.1e-002 | Z109: 2.2 | AA109: 69 | AB109: 9.1000000000000004e-003 | AC109: 2.e-003 | AD109: -3.0499999999999999e-002 | AE109: -3.3000000000000002e-002 | AF109: 81.61 | AG109: 83.26 | AH109: 0.68 | AI109: A+ | AJ109: 7.7100000000000002e-002 | AK109: =I109+100*T109 -> 137. | AL109: 136.1 | AM109: 170 | AN109: 52.9 | AO109: 217 | AP109: 3.5000000000000003e-002 | AQ109: 21 | AR109: 开润转债!
A110: 112 | B110: 正元转债 | C110: 123043 | D110: 43921. | E110: 正元智慧 | F110: 300645 | G110: 计算机及 | H110: 软件开发 | I110: 115.9 | J110: -1.9e-003 | K110: -1.23e-002 | L110: 17.08 | M110: -1.78e-002 | N110: 8 | O110: 3.9e-002 | P110: 121.4 | Q110: 15.41 | R110: 3.56 | S110: 110.84 | T110: 4.5999999999999999e-002 | U110: 转股中 | V110: 5.41年 | W110: 3.41年 | X110: 8.1000000000000003e-002 | Y110: 8.9999999999999997e-002 | Z110: 1.8 | AA110: 22 | AB110: 8.8000000000000005e-003 | AC110: 2.e-003 | AD110: -2.87e-002 | AE110: -3.1e-002 | AF110: 80.44 | AG110: 82.02 | AH110: 0.8 | AI110: A+ | AJ110: 7.7100000000000002e-002 | AK110: =I110+100*T110 -> 120.5 | AL110: 121 | AM110: 35 | AN110: 38.9 | AO110: 124 | AP110: -1.1000000000000001e-002 | AQ110: 17 | AR110: 正元转债
A111: 94 | B111: 利群转债! | C111: 113033 | D111: 43942. | E111: 利群股份 | F111: 601366 | G111: 商业零售 | H111: 商场 | I111: 110.01 | J111: 1.e-004 | K111: 8.0000000000000004e-004 | L111: 6.86 | M111: 1.5e-003 | N111: 5.8 | O111: 3.0000000000000001e-003 | P111: 115.3 | Q111: 7.01 | R111: 1.34 | S111: 97.86 | T111: 0.124 | U111: 2.1天 | V111: 5.49年 | W111: 3.49年 | X111: 0.30499999999999999 | Y111: 0.29799999999999999 | Z111: 18 | AA111: 59 | AB111: 8.8000000000000005e-003 | AC111: 3.7000000000000002e-003 | AD111: -1.5900000000000001e-002 | AE111: -1.7899999999999999e-002 | AF111: 88.5 | AG111: 90.96 | AH111: 0.59 | AI111: AA | AJ111: 4.5100000000000001e-002 | AK111: =I111+100*T111 -> 122.41000000000001 | AL111: 122.2 | AM111: 44 | AN111: 31.2 | AO111: 45 | AP111: -9.0000000000000011e-003 | AQ111: 34 | AR111: 利群转债!
A112: 206 | B112: 亨通转债! | C112: 110056 | D112: 43571. | E112: 亨通光电 | F112: 600487 | G112: 通信互联 | H112: 通信设备 | I112: 110.55 | J112: -1.4000000000000002e-003 | K112: -1.2999999999999999e-003 | L112: 14.42 | M112: -5.5000000000000005e-003 | N112: 3 | O112: 2.e-003 | P112: 114.8 | Q112: 15.58 | R112: 1.94 | S112: 92.55 | T112: 0.19399999999999998 | U112: 转股中 | V112: 4.45年 | W112: 2.45年 | X112: 6.0999999999999999e-002 | Y112: 5.5999999999999994e-002 | Z112: 17 | AA112: 282 | AB112: 8.6999999999999994e-003 | AC112: 2.7000000000000001e-003 | AD112: -2.58e-002 | AE112: -2.8199999999999999e-002 | AF112: 92.97 | AG112: 96.14 | AH112: 0.48 | AI112: AA+ | AJ112: 4.1500000000000002e-002 | AK112: =I112+100*T112 -> 129.94999999999999 | AL112: 128.5 | AM112: 98 | AN112: 32.4 | AO112: 51 | AP112: -5.5e-002 | AQ112: 28 | AR112: 亨通转债!
A113: 4 | B113: 景兴转债 | C113: 128130 | D113: 44092. | E113: 景兴纸业 | F113: 2067 | G113: 造纸包装 | H113: 包装用纸 | I113: 109.5 | J113: -4.5000000000000005e-003 | K113: -2.5999999999999999e-003 | L113: 3.33 | M113: -1.1899999999999999e-002 | N113: 25 | O113: 1.8000000000000002e-002 | P113: 115.1 | Q113: 3.4 | R113: 0.84 | S113: 97.94 | T113: 0.11800000000000001 | U113: 4月29天 | V113: 5.90年 | W113: 3.90年 | X113: 0.34600000000000003 | Y113: 0.33899999999999997 | Z113: 13 | AA113: 37 | AB113: 8.6e-003 | AC113: 4.0000000000000001e-003 | AD113: -1.3600000000000001e-002 | AE113: -1.5300000000000001e-002 | AF113: 86.7 | AG113: 89.12 | AH113: 0.61 | AI113: AA | AJ113: 4.5100000000000001e-002 | AK113: =I113+100*T113 -> 121.3 | AL113: 121.1 | AM113: 37 | AN113: 31.9 | AO113: 49 | AP113: -7.400000000000001e-002 | AQ113: 7 | AR113: 景兴转债
A114: 273 | B114: 铁汉转债! | C114: 123004 | D114: 43126. | E114: 铁汉生态 | F114: 300197 | G114: 城市公用 | H114: 生态环境 | I114: 107.1 | J114: -1.2699999999999999e-002 | K114: 4.5999999999999999e-003 | L114: 3.81 | M114: -1.55e-002 | N114: 16 | O114: 1.8000000000000002e-002 | P114: 109.8 | Q114: 3.98 | R114: 1.71 | S114: 95.73 | T114: 0.11900000000000001 | U114: 转股中 | V114: 3.20年 | W114: 1.20年 | X114: 8.9999999999999997e-002 | Y114: 8.5999999999999993e-002 | Z114: 8 | AA114: 89 | AB114: 8.0000000000000002e-003 | AC114: 2.2000000000000001e-003 | AD114: -3.1600000000000003e-002 | AE114: -3.5099999999999999e-002 | AF114: 96.81 | AG114: 96.09 | AH114: 0.53 | AI114: AA | AJ114: 4.3499999999999997e-002 | AK114: =I114+100*T114 -> 119. | AL114: 118.5 | AM114: 22 | AN114: 21.7 | AO114: 10 | AP114: -6.3e-002 | AQ114: 36 | AR114: 铁汉转债!
A115: 97 | B115: 龙净转债! | C115: 110068 | D115: 43936. | E115: 龙净环保 | F115: 600388 | G115: 城市公用 | H115: 三废处理 | I115: 110.2 | J115: 1.2999999999999999e-003 | K115: -1.2199999999999999e-002 | L115: 9.49 | M115: -2.2700000000000001e-002 | N115: 4.5 | O115: 2.e-003 | P115: 115 | Q115: 10.73 | R115: 1.88 | S115: 88.44 | T115: 0.24600000000000002 | U115: 转股中 | V115: 5.46年 | W115: 3.46年 | X115: 0.19699999999999998 | Y115: 0.17399999999999999 | Z115: 20 | AA115: 101 | AB115: 8.0000000000000002e-003 | AC115: 3.0000000000000001e-003 | AD115: -1.7299999999999999e-002 | AE115: -1.9099999999999999e-002 | AF115: 88.91 | AG115: 91.7 | AH115: 0.48 | AI115: AA+ | AJ115: 4.3099999999999999e-002 | AK115: =I115+100*T115 -> 134.80000000000001 | AL115: 132 | AM115: 133 | AN115: 40.3 | AO115: 138 | AP115: -7.2999999999999995e-002 | AQ115: 29 | AR115: 龙净转债!
A116: 146 | B116: 新北转债! | C116: 128083 | D116: 43830. | E116: 新北洋 | F116: 2376 | G116: 电子 | H116: 电子产品 | I116: 110.702 | J116: -1.e-004 | K116: -1.1999999999999999e-003 | L116: 9.98 | M116: -3.0000000000000001e-003 | N116: 0.2 | O116: 0. | P116: 115.2 | Q116: 11.7 | R116: 2 | S116: 85.3 | T116: 0.29799999999999999 | U116: 转股中 | V116: 5.18年 | W116: 3.18年 | X116: 0.13200000000000001 | Y116: 0.113 | Z116: 8.8 | AA116: 66 | AB116: 7.9000000000000008e-003 | AC116: 2.5999999999999999e-003 | AD116: -1.95e-002 | AE116: -2.1600000000000001e-002 | AF116: 89.6 | AG116: 92.08 | AH116: 0.44 | AI116: AA | AJ116: 4.5100000000000001e-002 | AK116: =I116+100*T116 -> 140.50200000000001 | AL116: 136.1 | AM116: 169 | AN116: 44 | AO116: 168 | AP116: -2.2000000000000002e-002 | AQ116: 17 | AR116: 新北转债!
A117: 23 | B117: 城地转债! | C117: 113596 | D117: 44063. | E117: 城地股份 | F117: 603887 | G117: 通信互联 | H117: 通信设备 | I117: 108.63 | J117: 7.0999999999999995e-003 | K117: 3.8e-003 | L117: 24.25 | M117: 1.9799999999999998e-002 | N117: 4.9 | O117: 4.0000000000000001e-003 | P117: 113.5 | Q117: 29.21 | R117: 2.61 | S117: 83.02 | T117: 0.308 | U117: 4月1天 | V117: 5.81年 | W117: 3.81年 | X117: 0.13200000000000001 | Y117: 0.109 | Z117: 12 | AA117: 91 | AB117: 7.7000000000000002e-003 | AC117: 3.4999999999999996e-003 | AD117: -1.1399999999999999e-002 | AE117: -1.32e-002 | AF117: 80.7 | AG117: 78.85 | AH117: 0.56 | AI117: AA- | AJ117: 6.6100000000000006e-002 | AK117: =I117+100*T117 -> 139.43000000000001 | AL117: 134.2 | AM117: 156 | AN117: 53.5 | AO117: 225 | AP117: -2.9999999999999999e-002 | AQ117: 7 | AR117: 城地转债!
A118: 60 | B118: 中矿转债 | C118: 128111 | D118: 44019. | E118: 中矿资源 | F118: 2738 | G118: 有色金属 | H118: 有色行业 | I118: 119.627 | J118: 3.5999999999999999e-003 | K118: -7.4999999999999997e-003 | L118: 17.86 | M118: -5.0000000000000001e-003 | N118: 13 | O118: 1.3999999999999999e-002 | P118: 124.7 | Q118: 15.53 | R118: 1.83 | S118: 115 | T118: 4.0000000000000001e-002 | U118: 2月12天 | V118: 5.68年 | W118: 3.68年 | X118: 0.161 | Y118: 0.185 | Z118: 8 | AA118: 50 | AB118: 7.4999999999999997e-003 | AC118: 2.0000000000000001e-004 | AD118: -3.4599999999999999e-002 | AE118: -3.6799999999999999e-002 | AF118: 82.03 | AG118: 87.41 | AH118: 0.79 | AI118: AA- | AJ118: 6.6100000000000006e-002 | AK118: =I118+100*T118 -> 123.627 | AL118: 124.3 | AM118: 64 | AN118: 36.8 | AO118: 88 | AP118: 7.4999999999999997e-002 | AQ118: 5 | AR118: 中矿转债
A119: 193 | B119: 明泰转债! | C119: 113025 | D119: 43592. | E119: 明泰铝业 | F119: 601677 | G119: 有色金属 | H119: 铝金属 | I119: 111.48 | J119: 5.0000000000000001e-003 | K119: -8.0000000000000004e-004 | L119: 11.16 | M119: 7.1999999999999998e-003 | N119: 8.4 | O119: 4.0000000000000001e-003 | P119: 115.1 | Q119: 11.2 | R119: 0.97 | S119: 99.64 | T119: 0.11900000000000001 | U119: 转股中 | V119: 4.51年 | W119: 2.51年 | X119: 0.26800000000000002 | Y119: 0.26700000000000002 | Z119: 18 | AA119: 69 | AB119: 7.3000000000000001e-003 | AC119: 1.1999999999999999e-003 | AD119: -2.7900000000000001e-002 | AE119: -3.0200000000000001e-002 | AF119: 92.4 | AG119: 95.36 | AH119: 0.58 | AI119: AA | AJ119: 4.3499999999999997e-002 | AK119: =I119+100*T119 -> 123.38000000000001 | AL119: 123.3 | AM119: 56 | AN119: 28 | AO119: 25 | AP119: 4.2999999999999997e-002 | AQ119: 31 | AR119: 明泰转债!
A120: 145 | B120: 鹰19转债 | C120: 110063 | D120: 43833. | E120: 山鹰纸业 | F120: 600567 | G120: 造纸包装 | H120: 包装用纸 | I120: 111.99 | J120: 8.8999999999999999e-003 | K120: -1.5600000000000001e-002 | L120: 3.08 | M120: -1.2800000000000001e-002 | N120: 5.4 | O120: 3.0000000000000001e-003 | P120: 116.2 | Q120: 3.3 | R120: 1 | S120: 93.33 | T120: 0.20000000000000001 | U120: 转股中 | V120: 5.19年 | W120: 3.19年 | X120: 0.13100000000000001 | Y120: 0.12300000000000001 | Z120: 19 | AA120: 142 | AB120: 7.3000000000000001e-003 | AC120: 1.7000000000000001e-003 | AD120: -2.3399999999999997e-002 | AE120: -2.53e-002 | AF120: 90 | AG120: 93.75 | AH120: 0.52 | AI120: AA+ | AJ120: 4.3099999999999999e-002 | AK120: =I120+100*T120 -> 131.99000000000001 | AL120: 130.6 | AM120: 119 | AN120: 36.9 | AO120: 90 | AP120: -3.6000000000000004e-002 | AQ120: 40 | AR120: 鹰19转债
A121: 228 | B121: 华源转债! | C121: 128049 | D121: 43454. | E121: 华源控股 | F121: 2787 | G121: 造纸包装 | H121: 包装材料 | I121: 111.95 | J121: 3.5999999999999999e-003 | K121: -2.8000000000000004e-003 | L121: 7.75 | M121: 1.2999999999999999e-003 | N121: 1.9 | O121: 5.0000000000000001e-003 | P121: 115.2 | Q121: 7.42 | R121: 1.68 | S121: 104.45 | T121: 7.2000000000000008e-002 | U121: 转股中 | V121: 4年52天 | W121: 2年52天 | X121: 0.14800000000000002 | Y121: 0.155 | Z121: 3.6 | AA121: 24 | AB121: 7.0999999999999995e-003 | AC121: 5.0000000000000001e-004 | AD121: -3.3700000000000001e-002 | AE121: -3.6499999999999998e-002 | AF121: 89.78 | AG121: 89.47 | AH121: 0.69 | AI121: AA- | AJ121: 6.4500000000000002e-002 | AK121: =I121+100*T121 -> 119.15000000000001 | AL121: 119.5 | AM121: 28 | AN121: 29.7 | AO121: 38 | AP121: -7.400000000000001e-002 | AQ121: 53 | AR121: 华源转债!
A122: 203 | B122: 招路转债! | C122: 127012 | D122: 43585. | E122: 招商公路 | F122: 1965 | G122: 机场高速 | H122: 高速 | I122: 104.9 | J122: 3.4999999999999996e-003 | K122: -3.4999999999999996e-003 | L122: 6.65 | M122: 0. | N122: 6.3 | O122: 1.e-003 | P122: 108.2 | Q122: 8.81 | R122: 0.87 | S122: 75.48 | T122: 0.39000000000000001 | U122: 转股中 | V122: 4.46年 | W122: 2.46年 | X122: 0.122 | Y122: 9.1999999999999998e-002 | Z122: 50 | AA122: 411 | AB122: 7.0999999999999995e-003 | AC122: 3.5999999999999999e-003 | AD122: -1.09e-002 | AE122: -1.23e-002 | AF122: 92.38 | AG122: 91.62 | AH122: 0.26 | AI122: AAA | AJ122: 3.85e-002 | AK122: =I122+100*T122 -> 143.90000000000001 | AL122: 134.3 | AM122: 157 | AN122: 41.9 | AO122: 149 | AP122: -4.0999999999999995e-002 | AQ122: 36 | AR122: 招路转债!
A123: 134 | B123: 东风转债 | C123: 113030 | D123: 43850. | E123: 东风股份 | F123: 601515 | G123: 造纸包装 | H123: 包装材料 | I123: 113.15 | J123: 4.0000000000000002e-004 | K123: -1.1999999999999999e-003 | L123: 6 | M123: -1.7000000000000001e-003 | N123: 0.3 | O123: 1.e-003 | P123: 117.3 | Q123: 6.75 | R123: 1.97 | S123: 88.89 | T123: 0.27300000000000002 | U123: 转股中 | V123: 5.22年 | W123: 3.22年 | X123: 3.7000000000000005e-002 | Y123: 3.3000000000000002e-002 | Z123: 3 | AA123: 80 | AB123: 7.0999999999999995e-003 | AC123: 1.1999999999999999e-003 | AD123: -2.5399999999999999e-002 | AE123: -2.75e-002 | AF123: 89.57 | AG123: 93.63 | AH123: 0.46 | AI123: AA | AJ123: 4.5100000000000001e-002 | AK123: =I123+100*T123 -> 140.45000000000002 | AL123: 137.4 | AM123: 177 | AN123: 43.8 | AO123: 164 | AP123: -5.5e-002 | AQ123: 14 | AR123: 东风转债
A124: 46 | B124: 美联转债 | C124: 123057 | D124: 44039. | E124: 美联新材 | F124: 300586 | G124: 化工 | H124: 橡胶塑料 | I124: 113.599 | J124: 2.2000000000000001e-003 | K124: -1.2699999999999999e-002 | L124: 9.72 | M124: -1.52e-002 | N124: 2.5 | O124: 1.1000000000000001e-002 | P124: 118.2 | Q124: 9.91 | R124: 6.07 | S124: 98.08 | T124: 0.158 | U124: 3月3天 | V124: 5.73年 | W124: 3.73年 | X124: 4.7e-002 | Y124: 4.5999999999999999e-002 | Z124: 2.1 | AA124: 44 | AB124: 7.0999999999999995e-003 | AC124: 1.5e-003 | AD124: -2.23e-002 | AE124: -2.4300000000000002e-002 | AF124: 81.33 | AG124: 82.54 | AH124: 0.69 | AI124: AA- | AJ124: 6.6100000000000006e-002 | AK124: =I124+100*T124 -> 129.399 | AL124: 129.1 | AM124: 103 | AN124: 46.6 | AO124: 184 | AP124: -9.4e-002 | AQ124: 5 | AR124: 美联转债
A125: 41 | B125: 湖盐转债 | C125: 110071 | D125: 44043. | E125: 雪天盐业 | F125: 600929 | G125: 食品饮料 | H125: 食品饮料 | I125: 110.75 | J125: 6.0999999999999995e-003 | K125: 1.e-002 | L125: 6.9 | M125: 2.3700000000000002e-002 | N125: 8.6 | O125: 1.1000000000000001e-002 | P125: 115.2 | Q125: 6.6 | R125: 2.51 | S125: 104.55 | T125: 5.9000000000000004e-002 | U125: 3月14天 | V125: 5.76年 | W125: 3.76年 | X125: 0.114 | Y125: 0.11900000000000001 | Z125: 7.2 | AA125: 63 | AB125: 6.9999999999999993e-003 | AC125: 2.2000000000000001e-003 | AD125: -1.67e-002 | AE125: -1.8500000000000003e-002 | AF125: 87.34 | AG125: 89.77 | AH125: 0.68 | AI125: AA | AJ125: 4.5100000000000001e-002 | AK125: =I125+100*T125 -> 116.65000000000001 | AL125: 117 | AM125: 14 | AN125: 27.2 | AO125: 24 | AP125: 2.e-002 | AQ125: 10 | AR125: 湖盐转债
A126: 102 | B126: 雷迪转债 | C126: 123045 | D126: 43934. | E126: 雷迪克 | F126: 300652 | G126: 汽车 | H126: 零部件制 | I126: 115.11 | J126: 6.1999999999999998e-003 | K126: 7.4999999999999997e-003 | L126: 22.68 | M126: 1.7000000000000001e-002 | N126: 6.3 | O126: 2.e-002 | P126: 119.4 | Q126: 20.13 | R126: 2.5 | S126: 112.67 | T126: 2.2000000000000002e-002 | U126: 转股中 | V126: 5.43年 | W126: 3.43年 | X126: 0.14000000000000001 | Y126: 0.158 | Z126: 2.8 | AA126: 20 | AB126: 6.8999999999999999e-003 | AC126: 7.000000000000001e-004 | AD126: -2.6699999999999998e-002 | AE126: -2.8999999999999998e-002 | AF126: 80.33 | AG126: 80.57 | AH126: 0.81 | AI126: A+ | AJ126: 7.7100000000000002e-002 | AK126: =I126+100*T126 -> 117.31 | AL126: 117.6 | AM126: 16 | AN126: 37 | AO126: 94 | AP126: -2.e-002 | AQ126: 39 | AR126: 雷迪转债
A127: 79 | B127: 全筑转债 | C127: 113578 | D127: 43970. | E127: 全筑股份 | F127: 603030 | G127: 建筑 | H127: 装饰工程 | I127: 114.23 | J127: 6.9999999999999993e-003 | K127: -1.37e-002 | L127: 5.78 | M127: -1.03e-002 | N127: 10 | O127: 2.4e-002 | P127: 118.3 | Q127: 5.43 | R127: 1.4 | S127: 106.45 | T127: 7.2999999999999995e-002 | U127: 20天 | V127: 5.54年 | W127: 3.54年 | X127: 0.12300000000000001 | Y127: 0.13100000000000001 | Z127: 3.8 | AA127: 31 | AB127: 6.5000000000000006e-003 | AC127: 7.000000000000001e-004 | AD127: -2.58e-002 | AE127: -2.7699999999999999e-002 | AF127: 88.3 | AG127: 93.1 | AH127: 0.66 | AI127: AA | AJ127: 4.5100000000000001e-002 | AK127: =I127+100*T127 -> 121.53 | AL127: 122 | AM127: 43 | AN127: 28.9 | AO127: 32 | AP127: -8.8000000000000009e-002 | AQ127: 9 | AR127: 全筑转债
A128: 33 | B128: 中金转债 | C128: 127020 | D128: 44057. | E128: 中金岭南 | F128: 60 | G128: 有色金属 | H128: 有色行业 | I128: 109.731 | J128: 5.0000000000000001e-003 | K128: -1.32e-002 | L128: 4.1 | M128: -1.6799999999999999e-002 | N128: 5.8 | O128: 1.e-003 | P128: 113.7 | Q128: 4.71 | R128: 1.32 | S128: 87.05 | T128: 0.26100000000000001 | U128: 3月21天 | V128: 5.79年 | W128: 3.79年 | X128: 0.26000000000000001 | Y128: 0.22600000000000001 | Z128: 38 | AA128: 146 | AB128: 6.1999999999999998e-003 | AC128: 1.9e-003 | AD128: -1.7299999999999999e-002 | AE128: -1.8500000000000003e-002 | AF128: 86.79 | AG128: 89.33 | AH128: 0.48 | AI128: AA+ | AJ128: 4.3099999999999999e-002 | AK128: =I128+100*T128 -> 135.83099999999999 | AL128: 132.4 | AM128: 139 | AN128: 43.1 | AO128: 156 | AP128: -6.6000000000000003e-002 | AQ128: 11 | AR128: 中金转债
A129: 249 | B129: 博世转债! | C129: 123010 | D129: 43326. | E129: 博世科 | F129: 300422 | G129: 城市公用 | H129: 三废处理 | I129: 109.866 | J129: -2.8999999999999998e-003 | K129: -3.4999999999999996e-003 | L129: 11.45 | M129: -1.1200000000000002e-002 | N129: 1.7 | O129: 3.0000000000000001e-003 | P129: 112.3 | Q129: 12.2 | R129: 2.33 | S129: 93.85 | T129: 0.17100000000000001 | U129: 转股中 | V129: 3.75年 | W129: 1.75年 | X129: 9.3000000000000013e-002 | Y129: 8.6999999999999994e-002 | Z129: 4.3 | AA129: 46 | AB129: 6.0000000000000001e-003 | AC129: -1.e-004 | AD129: -3.44e-002 | AE129: -3.7100000000000001e-002 | AF129: 91.3 | AG129: 89.26 | AH129: 0.57 | AI129: AA- | AJ129: 6.4500000000000002e-002 | AK129: =I129+100*T129 -> 126.96600000000001 | AL129: 125.9 | AM129: 79 | AN129: 34.6 | AO129: 71 | AP129: -9.3000000000000013e-002 | AQ129: 24 | AR129: 博世转债!
A130: 136 | B130: 永创转债! | C130: 113559 | D130: 43840. | E130: 永创智能 | F130: 603901 | G130: 机械装备 | H130: 专用设备 | I130: 115.43 | J130: 7.0999999999999995e-003 | K130: -8.8999999999999999e-003 | L130: 9.25 | M130: -3.2000000000000002e-003 | N130: 1.7 | O130: 3.0000000000000001e-003 | P130: 118.9 | Q130: 10.32 | R130: 2.97 | S130: 89.63 | T130: 0.28800000000000003 | U130: 转股中 | V130: 5.21年 | W130: 3.21年 | X130: 0.125 | Y130: 0.11199999999999999 | Z130: 5.1 | AA130: 41 | AB130: 5.7999999999999996e-003 | AC130: -5.0000000000000001e-004 | AD130: -2.81e-002 | AE130: -3.0800000000000001e-002 | AF130: 84.86 | AG130: 85.97 | AH130: 0.58 | AI130: AA- | AJ130: 6.6100000000000006e-002 | AK130: =I130+100*T130 -> 144.23000000000002 | AL130: 141.2 | AM130: 204 | AN130: 55.3 | AO130: 237 | AP130: -8.900000000000001e-002 | AQ130: 23 | AR130: 永创转债!
A131: 5 | B131: 青农转债 | C131: 128129 | D131: 44092. | E131: 青农商行 | F131: 2958 | G131: 金融 | H131: 银行行业 | I131: 109 | J131: 2.8000000000000004e-003 | K131: -1.2500000000000001e-002 | L131: 5.03 | M131: -1.95e-002 | N131: 108 | O131: 2.e-002 | P131: 112.2 | Q131: 5.74 | R131: 1.12 | S131: 87.63 | T131: 0.24399999999999999 | U131: 4月26天 | V131: 5.89年 | W131: 无权 | X131: 0.17899999999999999 | Y131: 0.157 | Z131: 50 | AA131: 279 | AB131: 5.0000000000000001e-003 | AC131: 1.1999999999999999e-003 | AD131: 无权 | AE131: 无权 | AF131: 无权 | AG131: 89.31 | AH131: 0.5 | AI131: AAA | AJ131: 4.0099999999999997e-002 | AK131: =I131+100*T131 -> 133.40000000000001 | AL131: 130.4 | AM131: 112 | AN131: 41.1 | AO131: 143 | AP131: -4.0000000000000001e-002 | AQ131: 9 | AR131: 青农转债
A132: 1 | B132: 崇达转2 | C132: 128131 | D132: 44102. | E132: 崇达技术 | F132: 2815 | G132: 电子 | H132: 元器件制 | I132: 111.88 | J132: 2.5000000000000001e-003 | K132: -9.4999999999999998e-003 | L132: 17.2 | M132: -1.38e-002 | N132: 190 | O132: 0.121 | P132: 115.2 | Q132: 19.54 | R132: 3.92 | S132: 88.02 | T132: 0.27100000000000002 | U132: 5月6天 | V132: 5.92年 | W132: 3.92年 | X132: 9.1999999999999998e-002 | Y132: 8.1000000000000003e-002 | Z132: 14 | AA132: 152 | AB132: 5.0000000000000001e-003 | AC132: 4.0000000000000002e-004 | AD132: -1.8500000000000003e-002 | AE132: -2.0199999999999999e-002 | AF132: 86.72 | AG132: 89.13 | AH132: 0.51 | AI132: AA | AJ132: 4.5100000000000001e-002 | AK132: =I132+100*T132 -> 138.97999999999999 | AL132: 135.7 | AM132: 166 | AN132: 46.6 | AO132: 185 | AP132: -3.1e-002 | AQ132: 2 | AR132: 崇达转2
A133: 216 | B133: 今飞转债! | C133: 128056 | D133: 43546. | E133: 今飞凯达 | F133: 2863 | G133: 汽车 | H133: 零部件制 | I133: 118.498 | J133: -3.0299999999999997e-002 | K133: 1.2500000000000001e-002 | L133: 8.27 | M133: -2.1299999999999999e-002 | N133: 193 | O133: 0.624 | P133: 121 | Q133: 6.76 | R133: 3.03 | S133: 122.34 | T133: -3.1e-002 | U133: 转股中 | V133: 4.40年 | W133: 2.40年 | X133: 8.3000000000000004e-002 | Y133: 0.10199999999999999 | Z133: 2.6 | AA133: 31 | AB133: 4.8999999999999998e-003 | AC133: -3.3e-003 | AD133: -4.9599999999999998e-002 | AE133: -5.2499999999999998e-002 | AF133: 86.65 | AG133: 88.57 | AH133: 0.83 | AI133: A+ | AJ133: 7.5499999999999998e-002 | AK133: =I133+100*T133 -> 115.39800000000001 | AL133: 114.7 | AM133: 5 | AN133: 26.1 | AO133: 15 | AP133: 8.3000000000000004e-002 | AQ133: 61 | AR133: 今飞转债!
A134: 118 | B134: 天目转债 | C134: 113564 | D134: 43906. | E134: 天目湖 | F134: 603136 | G134: 旅游餐饮 | H134: 旅游 | I134: 123.61 | J134: 1.15e-002 | K134: -1.06e-002 | L134: 27.46 | M134: 1.1000000000000001e-003 | N134: 58 | O134: 0.153 | P134: 126.7 | Q134: 23.8 | R134: 3.57 | S134: 115.38 | T134: 7.0999999999999994e-002 | U134: 转股中 | V134: 5.40年 | W134: 3.40年 | X134: 9.4e-002 | Y134: 0.109 | Z134: 3 | AA134: 32 | AB134: 4.6999999999999993e-003 | AC134: -3.4999999999999996e-003 | AD134: -4.6300000000000001e-002 | AE134: -4.8600000000000004e-002 | AF134: 83.54 | AG134: 90.42 | AH134: 0.77 | AI134: AA- | AJ134: 6.6100000000000006e-002 | AK134: =I134+100*T134 -> 130.71000000000001 | AL134: 131.8 | AM134: 130 | AN134: 41.4 | AO134: 145 | AP134: -7.0000000000000007e-002 | AQ134: 11 | AR134: 天目转债
A135: 212 | B135: 博彦转债 | C135: 128057 | D135: 43557. | E135: 博彦科技 | F135: 2649 | G135: 计算机及 | H135: 软件开发 | I135: 114.8 | J135: 1.1000000000000001e-002 | K135: -1.0200000000000001e-002 | L135: 9.3 | M135: 1.1000000000000001e-003 | N135: 4.8 | O135: 8.0000000000000002e-003 | P135: 117.1 | Q135: 8.72 | R135: 1.79 | S135: 106.65 | T135: 7.5999999999999998e-002 | U135: 转股中 | V135: 4.41年 | W135: 2.41年 | X135: 0.10800000000000001 | Y135: 0.115 | Z135: 5.3 | AA135: 49 | AB135: 4.5999999999999999e-003 | AC135: -2.3e-003 | AD135: -3.95e-002 | AE135: -4.2000000000000003e-002 | AF135: 88.36 | AG135: 89.43 | AH135: 0.73 | AI135: AA- | AJ135: 6.4500000000000002e-002 | AK135: =I135+100*T135 -> 122.39999999999999 | AL135: 122.9 | AM135: 52 | AN135: 33.5 | AO135: 61 | AP135: -6.8000000000000005e-002 | AQ135: 29 | AR135: 博彦转债
A136: 14 | B136: 特发转2! | C136: 127021 | D136: 44078. | E136: 特发信息 | F136: 70 | G136: 通信互联 | H136: 通信设备 | I136: 110.9 | J136: -1.8e-003 | K136: 1.5e-003 | L136: 9.7 | M136: -1.e-003 | N136: 2.9 | O136: 5.0000000000000001e-003 | P136: 113.3 | Q136: 12.33 | R136: 2.82 | S136: 78.67 | T136: 0.40999999999999998 | U136: 4月10天 | V136: 4.84年 | W136: 2.84年 | X136: 6.9000000000000006e-002 | Y136: 5.5e-002 | Z136: 5.5 | AA136: 79 | AB136: 4.5000000000000005e-003 | AC136: -5.0000000000000001e-004 | AD136: -2.7400000000000001e-002 | AE136: -2.87e-002 | AF136: 89.86 | AG136: 92.43 | AH136: 0.33 | AI136: AA | AJ136: 4.3499999999999997e-002 | AK136: =I136+100*T136 -> 151.90000000000001 | AL136: 143.1 | AM136: 219 | AN136: 50.7 | AO136: 203 | AP136: -7.0000000000000007e-002 | AQ136: 4 | AR136: 特发转2!
A137: 264 | B137: 江银转债! | C137: 128034 | D137: 43145. | E137: 江阴银行 | F137: 2807 | G137: 金融 | H137: 银行行业 | I137: 108 | J137: 2.3e-003 | K137: -5.6000000000000008e-003 | L137: 4.11 | M137: -7.1999999999999998e-003 | N137: 9.1 | O137: 5.0000000000000001e-003 | P137: 109.1 | Q137: 4.5 | R137: 0.79 | S137: 91.33 | T137: 0.182 | U137: 转股中 | V137: 3.31年 | W137: 无权 | X137: 0.19699999999999998 | Y137: 0.17999999999999999 | Z137: 18 | AA137: 89 | AB137: 3.0999999999999999e-003 | AC137: -2.e-003 | AD137: 无权 | AE137: 无权 | AF137: 无权 | AG137: 95.58 | AH137: 0.45 | AI137: AA+ | AJ137: 4.1500000000000002e-002 | AK137: =I137+100*T137 -> 126.2 | AL137: 124.7 | AM137: 65 | AN137: 29.1 | AO137: 33 | AP137: -1.9e-002 | AQ137: 28 | AR137: 江银转债!
A138: 22 | B138: 科华转债! | C138: 128124 | D138: 44063. | E138: 科华生物 | F138: 2022 | G138: 医药 | H138: 生物制药 | I138: 108.378 | J138: 8.199999999999999e-003 | K138: -1.1000000000000001e-003 | L138: 18.12 | M138: 1.46e-002 | N138: 9.6 | O138: 1.2e-002 | P138: 110.3 | Q138: 21.5 | R138: 3.65 | S138: 84.28 | T138: 0.28600000000000003 | U138: 4月0天 | V138: 5.81年 | W138: 3.81年 | X138: 7.9000000000000001e-002 | Y138: 6.7000000000000004e-002 | Z138: 7.4 | AA138: 93 | AB138: 3.0999999999999999e-003 | AC138: -2.0000000000000001e-004 | AD138: -1.2699999999999999e-002 | AE138: -1.4199999999999999e-002 | AF138: 86.59 | AG138: 85.72 | AH138: 0.49 | AI138: AA | AJ138: 4.5100000000000001e-002 | AK138: =I138+100*T138 -> 136.97800000000001 | AL138: 132.5 | AM138: 140 | AN138: 45.9 | AO138: 178 | AP138: -1.2e-002 | AQ138: 9 | AR138: 科华转债!
A139: 24 | B139: 三超转债 | C139: 123062 | D139: 44060. | E139: 三超新材 | F139: 300554 | G139: 机械装备 | H139: 通用设备 | I139: 117.66 | J139: -3.3e-003 | K139: -5.6000000000000008e-003 | L139: 20.57 | M139: -1.01e-002 | N139: 11 | O139: 4.5999999999999999e-002 | P139: 119.7 | Q139: 17.17 | R139: 3.76 | S139: 119.8 | T139: -1.8000000000000002e-002 | U139: 3月28天 | V139: 5.81年 | W139: 3.81年 | X139: 0.10099999999999999 | Y139: 0.121 | Z139: 2 | AA139: 19 | AB139: 3.0000000000000001e-003 | AC139: -2.8000000000000004e-003 | AD139: -2.9399999999999999e-002 | AE139: -3.1600000000000003e-002 | AF139: 75.36 | AG139: 74.56 | AH139: 0.88 | AI139: A | AJ139: 8.7100000000000011e-002 | AK139: =I139+100*T139 -> 115.86 | AL139: 115.5 | AM139: 6 | AN139: 40.2 | AO139: 135 | AP139: -4.4999999999999998e-002 | AQ139: 9 | AR139: 三超转债
A140: 119 | B140: 宏辉转债 | C140: 113565 | D140: 43906. | E140: 宏辉果蔬 | F140: 603336 | G140: 农业 | H140: 农产品加 | I140: 116.51 | J140: 4.5999999999999999e-003 | K140: -6.7000000000000002e-003 | L140: 11.17 | M140: -2.7000000000000001e-003 | N140: 22 | O140: 6.2e-002 | P140: 118.2 | Q140: 10 | R140: 4.1 | S140: 111.7 | T140: 4.2999999999999997e-002 | U140: 转股中 | V140: 5.39年 | W140: 3.39年 | X140: 8.5000000000000006e-002 | Y140: 9.5000000000000001e-002 | Z140: 3.1 | AA140: 37 | AB140: 2.7000000000000001e-003 | AC140: -3.2000000000000002e-003 | AD140: -3.15e-002 | AE140: -3.3599999999999998e-002 | AF140: 83.15 | AG140: 84.37 | AH140: 0.8 | AI140: AA- | AJ140: 6.6100000000000006e-002 | AK140: =I140+100*T140 -> 120.81 | AL140: 121.3 | AM140: 39 | AN140: 37 | AO140: 91 | AP140: -8.5000000000000006e-002 | AQ140: 18 | AR140: 宏辉转债
A141: 258 | B141: 敖东转债! | C141: 127006 | D141: 43231. | E141: 吉林敖东 | F141: 623 | G141: 金融 | H141: 证券行业 | I141: 107.112 | J141: 2.8000000000000004e-003 | K141: -7.6e-003 | L141: 16.73 | M141: -1.5300000000000001e-002 | N141: 1.9 | O141: 1.e-003 | P141: 108 | Q141: 20.42 | R141: 0.87 | S141: 81.93 | T141: 0.307 | U141: 转股中 | V141: 3.43年 | W141: 1.43年 | X141: 0.124 | Y141: 0.10099999999999999 | Z141: 24 | AA141: 195 | AB141: 2.3999999999999998e-003 | AC141: -2.e-003 | AD141: -3.2199999999999999e-002 | AE141: -3.4200000000000001e-002 | AF141: 95.3 | AG141: 94.1 | AH141: 0.31 | AI141: AA+ | AJ141: 4.1500000000000002e-002 | AK141: =I141+100*T141 -> 137.81199999999998 | AL141: 132.3 | AM141: 136 | AN141: 37 | AO141: 96 | AP141: -3.6000000000000004e-002 | AQ141: 26 | AR141: 敖东转债!
A142: 27 | B142: 兴森转债 | C142: 128122 | D142: 44060. | E142: 兴森科技 | F142: 2436 | G142: 电子 | H142: 元器件制 | I142: 112.3 | J142: -1.e-004 | K142: 2.7000000000000001e-003 | L142: 11.03 | M142: 8.199999999999999e-003 | N142: 1.9 | O142: 6.0000000000000001e-003 | P142: 113.3 | Q142: 14.18 | R142: 5.31 | S142: 77.79 | T142: 0.44400000000000001 | U142: 3月25天 | V142: 4.79年 | W142: 3.79年 | X142: 1.6e-002 | Y142: 1.3000000000000001e-002 | Z142: 2.7 | AA142: 164 | AB142: 1.9e-003 | AC142: -3.0999999999999999e-003 | AD142: -2.0199999999999999e-002 | AE142: -2.1899999999999999e-002 | AF142: 87.67 | AG142: 92.59 | AH142: 0.32 | AI142: AA | AJ142: 4.3499999999999997e-002 | AK142: =I142+100*T142 -> 156.69999999999999 | AL142: 146.8 | AM142: 242 | AN142: 54.2 | AO142: 232 | AP142: -3.2000000000000001e-002 | AQ142: 4 | AR142: 兴森转债
A143: 69 | B143: 今天转债 | C143: 123051 | D143: 44012. | E143: 今天国际 | F143: 300532 | G143: 计算机及 | H143: 软件开发 | I143: 121.6 | J143: -7.4000000000000003e-003 | K143: -5.4000000000000003e-003 | L143: 11.21 | M143: -1.49e-002 | N143: 8.7 | O143: 2.5000000000000001e-002 | P143: 122.8 | Q143: 8.8 | R143: 3.82 | S143: 127.39 | T143: -4.4999999999999998e-002 | U143: 2月5天 | V143: 5.66年 | W143: 3.66年 | X143: 9.0999999999999998e-002 | Y143: 0.11599999999999999 | Z143: 2.8 | AA143: 31 | AB143: 1.8e-003 | AC143: -5.0000000000000001e-003 | AD143: -3.8699999999999998e-002 | AE143: -4.0899999999999999e-002 | AF143: 79.09 | AG143: 81.48 | AH143: 0.86 | AI143: A+ | AJ143: 7.7100000000000002e-002 | AK143: =I143+100*T143 -> 117.09999999999999 | AL143: 115.8 | AM143: 7 | AN143: 34.3 | AO143: 68 | AP143: -8.5000000000000006e-002 | AQ143: 11 | AR143: 今天转债
A144: 19 | B144: 华阳转债 | C144: 128125 | D144: 44064. | E144: 华阳国际 | F144: 2949 | G144: 建筑 | H144: 建筑工程 | I144: 117.51 | J144: -4.1999999999999997e-003 | K144: -3.2000000000000002e-003 | L144: 25.73 | M144: -1.04e-002 | N144: 13 | O144: 2.5000000000000001e-002 | P144: 118.5 | Q144: 25.79 | R144: 4.39 | S144: 99.77 | T144: 0.17800000000000002 | U144: 4月2天 | V144: 5.81年 | W144: 3.81年 | X144: 8.900000000000001e-002 | Y144: 8.900000000000001e-002 | Z144: 4.5 | AA144: 50 | AB144: 1.5e-003 | AC144: -4.0999999999999995e-003 | AD144: -3.0899999999999997e-002 | AE144: -3.2599999999999997e-002 | AF144: 80.68 | AG144: 82.27 | AH144: 0.7 | AI144: AA- | AJ144: 6.6100000000000006e-002 | AK144: =I144+100*T144 -> 135.31 | AL144: 135.3 | AM144: 164 | AN144: 53 | AO144: 218 | AP144: -0.11 | AQ144: 2 | AR144: 华阳转债
A145: 262 | B145: 大族转债! | C145: 128035 | D145: 43164. | E145: 大族激光 | F145: 2008 | G145: 机械装备 | H145: 专用设备 | I145: 107.5 | J145: 4.7999999999999996e-003 | K145: -4.8999999999999998e-003 | L145: 32.9 | M145: -7.1999999999999998e-003 | N145: 15 | O145: 6.0000000000000001e-003 | P145: 108 | Q145: 52.1 | R145: 3.92 | S145: 63.15 | T145: 0.70200000000000007 | U145: 转股中 | V145: 3.34年 | W145: 1.34年 | X145: 6.6000000000000003e-002 | Y145: 4.0999999999999995e-002 | Z145: 23 | AA145: 351 | AB145: 1.4000000000000002e-003 | AC145: -3.0999999999999999e-003 | AD145: -1.9400000000000001e-002 | AE145: -2.4900000000000002e-002 | AF145: 98.24 | AG145: 94.48 | AH145: 0.02 | AI145: AA+ | AJ145: 4.1500000000000002e-002 | AK145: =I145+100*T145 -> 177.69999999999999 | AL145: 151.9 | AM145: 259 | AN145: 53.6 | AO145: 226 | AP145: -4.5999999999999999e-002 | AQ145: 19 | AR145: 大族转债!
A146: 291 | B146: 骆驼转债! | C146: 113012 | D146: 42934. | E146: 骆驼股份 | F146: 601311 | G146: 汽车 | H146: 零部件制 | I146: 107.6 | J146: 4.7999999999999996e-003 | K146: -3.4999999999999996e-003 | L146: 7.65 | M146: 1.06e-002 | N146: 1.4 | O146: 3.0000000000000001e-003 | P146: 107.8 | Q146: 10.06 | R146: 0.99 | S146: 76.04 | T146: 0.41499999999999998 | U146: 转股中 | V146: 2.46年 | W146: 0.46年 | X146: 5.9000000000000004e-002 | Y146: 4.4999999999999998e-002 | Z146: 5.1 | AA146: 86 | AB146: 8.0000000000000004e-004 | AC146: -5.1999999999999998e-003 | AD146: -8.8000000000000009e-002 | AE146: -9.2399999999999996e-002 | AF146: 98.94 | AG146: 97.5 | AH146: 0.12 | AI146: AA | AJ146: 4.2300000000000004e-002 | AK146: =I146+100*T146 -> 149.09999999999999 | AL146: 139.2 | AM146: 192 | AN146: 40.2 | AO146: 137 | AP146: -2.7000000000000003e-002 | AQ146: 17 | AR146: 骆驼转债!
A147: 25 | B147: 国光转债 | C147: 128123 | D147: 44062. | E147: 国光股份 | F147: 2749 | G147: 化工 | H147: 农化 | I147: 116.02 | J147: 2.3e-003 | K147: -1.8100000000000002e-002 | L147: 12.44 | M147: -2.4300000000000002e-002 | N147: 1.2 | O147: 3.0000000000000001e-003 | P147: 116.2 | Q147: 13.7 | R147: 4.59 | S147: 90.8 | T147: 0.27800000000000002 | U147: 3月28天 | V147: 5.81年 | W147: 3.81年 | X147: 5.9999999999999998e-002 | Y147: 5.4000000000000006e-002 | Z147: 3.2 | AA147: 54 | AB147: 2.9999999999999997e-004 | AC147: -4.6999999999999993e-003 | AD147: -2.7099999999999999e-002 | AE147: -2.8999999999999998e-002 | AF147: 80.97 | AG147: 80.79 | AH147: 0.65 | AI147: AA- | AJ147: 6.6100000000000006e-002 | AK147: =I147+100*T147 -> 143.81999999999999 | AL147: 141.2 | AM147: 205 | AN147: 60.3 | AO147: 255 | AP147: -5.2999999999999999e-002 | AQ147: 5 | AR147: 国光转债
A148: 286 | B148: 林洋转债! | C148: 113014 | D148: 43052. | E148: 林洋能源 | F148: 601222 | G148: 能源电力 | H148: 电力设备 | I148: 110.33 | J148: 3.4999999999999996e-003 | K148: 2.2000000000000001e-003 | L148: 7.08 | M148: 1.8700000000000001e-002 | N148: 3.2 | O148: 1.e-003 | P148: 110.3 | Q148: 8.54 | R148: 1.22 | S148: 82.9 | T148: 0.33100000000000002 | U148: 转股中 | V148: 3年21天 | W148: 1年21天 | X148: 0.24199999999999999 | Y148: 0.20100000000000001 | Z148: 30 | AA148: 124 | AB148: -1.e-004 | AC148: -6.4000000000000003e-003 | AD148: -5.67e-002 | AE148: -6.08e-002 | AF148: 97.64 | AG148: 97.14 | AH148: 0.3 | AI148: AA | AJ148: 4.3499999999999997e-002 | AK148: =I148+100*T148 -> 143.43000000000001 | AL148: 137.8 | AM148: 179 | AN148: 40.1 | AO148: 134 | AP148: -1.2e-002 | AQ148: 22 | AR148: 林洋转债!
A149: 83 | B149: 维尔转债 | C149: 123049 | D149: 43963. | E149: 维尔利 | F149: 300190 | G149: 城市公用 | H149: 三废处理 | I149: 124.926 | J149: 5.7999999999999996e-003 | K149: -1.03e-002 | L149: 8.69 | M149: -5.6999999999999993e-003 | N149: 2.4 | O149: 2.e-003 | P149: 124.8 | Q149: 7.48 | R149: 1.66 | S149: 116.18 | T149: 7.4999999999999997e-002 | U149: 13天 | V149: 5.52年 | W149: 3.52年 | X149: 0.13500000000000001 | Y149: 0.157 | Z149: 9.2 | AA149: 68 | AB149: -2.0000000000000001e-004 | AC149: -7.6e-003 | AD149: -4.7300000000000002e-002 | AE149: -4.9500000000000002e-002 | AF149: 82.97 | AG149: 88.41 | AH149: 0.77 | AI149: AA- | AJ149: 6.6100000000000006e-002 | AK149: =I149+100*T149 -> 132.42599999999999 | AL149: 133.7 | AM149: 150 | AN149: 45.3 | AO149: 172 | AP149: -5.9999999999999998e-002 | AQ149: 11 | AR149: 维尔转债
A150: 87 | B150: 起步转债! | C150: 113576 | D150: 43958. | E150: 起步股份 | F150: 603557 | G150: 服装纺织 | H150: 鞋服行业 | I150: 122.07 | J150: -2.4700000000000003e-002 | K150: -8.0000000000000002e-003 | L150: 13.53 | M150: -3.8399999999999997e-002 | N150: 657 | O150: 1.02 | P150: 121.8 | Q150: 10.55 | R150: 4.13 | S150: 128.25 | T150: -4.8000000000000001e-002 | U150: 10天 | V150: 5.51年 | W150: 3.51年 | X150: 8.1000000000000003e-002 | Y150: 0.10400000000000001 | Z150: 5.2 | AA150: 64 | AB150: -4.0000000000000002e-004 | AC150: -7.0999999999999995e-003 | AD150: -4.1299999999999996e-002 | AE150: -4.36e-002 | AF150: 83.02 | AG150: 86.35 | AH150: 0.85 | AI150: AA- | AJ150: 6.6100000000000006e-002 | AK150: =I150+100*T150 -> 117.27 | AL150: 115.9 | AM150: 9 | AN150: 29.5 | AO150: 35 | AP150: 0.124 | AQ150: 31 | AR150: 起步转债!
A151: 131 | B151: 汽模转2 | C151: 128090 | D151: 43853. | E151: 天汽模 | F151: 2510 | G151: 汽车 | H151: 零部件制 | I151: 115.48 | J151: -1.e-003 | K151: -1.8e-003 | L151: 4.25 | M151: -4.6999999999999993e-003 | N151: 4.2 | O151: 8.0000000000000002e-003 | P151: 115.2 | Q151: 4.21 | R151: 1.46 | S151: 100.95 | T151: 0.14400000000000002 | U151: 转股中 | V151: 5.22年 | W151: 3.22年 | X151: 0.12 | Y151: 0.121 | Z151: 4.7 | AA151: 39 | AB151: -5.0000000000000001e-004 | AC151: -5.6999999999999993e-003 | AD151: -3.15e-002 | AE151: -3.3500000000000002e-002 | AF151: 89.44 | AG151: 91.91 | AH151: 0.62 | AI151: AA | AJ151: 4.5100000000000001e-002 | AK151: =I151+100*T151 -> 129.88 | AL151: 130 | AM151: 107 | AN151: 38.1 | AO151: 113 | AP151: -7.5999999999999998e-002 | AQ151: 26 | AR151: 汽模转2
A152: 296 | B152: 广汽转债!! | C152: 113009 | D152: 42404. | E152: 广汽集团 | F152: 601238 | G152: 汽车 | H152: 乘用车 | I152: 107.58 | J152: 8.0000000000000004e-004 | K152: -8.9999999999999998e-004 | L152: 9.52 | M152: -5.1999999999999998e-003 | N152: 18 | O152: 6.0000000000000001e-003 | P152: 107.5 | Q152: 14.23 | R152: 1.21 | S152: 66.9 | T152: 0.60799999999999998 | U152: 转股中 | V152: 1.30年 | W152: 回售中 | X152: 2.6000000000000002e-002 | Y152: 1.7000000000000001e-002 | Z152: 25 | AA152: 975 | AB152: -5.9999999999999995e-004 | AC152: -1.1399999999999999e-002 | AD152: 回售中 | AE152: 回售中 | AF152: 100.25 | AG152: 102.57 | AH152: 0.01 | AI152: AAA | AJ152: 3.73e-002 | AK152: =I152+100*T152 -> 168.38 | AL152: 148.3 | AM152: 245 | AN152: 45.7 | AO152: 177 | AP152: -6.2e-002 | AQ152: 14 | AR152: 广汽转债!!
A153: 167 | B153: 游族转债!! | C153: 128074 | D153: 43759. | E153: 游族网络 | F153: 2174 | G153: 通信互联 | H153: 互联网 | I153: 120.301 | J153: 2.1600000000000001e-002 | K153: -2.1600000000000001e-002 | L153: 17.48 | M153: -2.5099999999999997e-002 | N153: 15 | O153: 1.9e-002 | P153: 119.9 | Q153: 16.97 | R153: 2.84 | S153: 103.01 | T153: 0.16800000000000001 | U153: 转股中 | V153: 4.96年 | W153: 2.96年 | X153: 4.2999999999999997e-002 | Y153: 4.4000000000000004e-002 | Z153: 6.8 | AA153: 160 | AB153: -7.000000000000001e-004 | AC153: -7.4999999999999997e-003 | AD153: -4.7599999999999996e-002 | AE153: -4.9500000000000002e-002 | AF153: 90.6 | AG153: 97.41 | AH153: 0 | AI153: AA | AJ153: 4.3499999999999997e-002 | AK153: =I153+100*T153 -> 137.101 | AL153: 137.6 | AM153: 178 | AN153: 40.2 | AO153: 136 | AP153: -8.1000000000000003e-002 | AQ153: 21 | AR153: 游族转债!!
A154: 225 | B154: 光华转债! | C154: 128051 | D154: 43474. | E154: 光华科技 | F154: 2741 | G154: 电子 | H154: 元器件制 | I154: 115.918 | J154: -8.199999999999999e-003 | K154: -9.5999999999999992e-003 | L154: 14.35 | M154: -2.3099999999999999e-002 | N154: 7 | O154: 2.4e-002 | P154: 115.5 | Q154: 12.72 | R154: 4.48 | S154: 112.81 | T154: 2.7999999999999997e-002 | U154: 转股中 | V154: 4.19年 | W154: 2.19年 | X154: 4.7e-002 | Y154: 5.2999999999999999e-002 | Z154: 2.5 | AA154: 54 | AB154: -8.9999999999999998e-004 | AC154: -7.4999999999999997e-003 | AD154: -4.6199999999999998e-002 | AE154: -4.9100000000000005e-002 | AF154: 89.78 | AG154: 89.47 | AH154: 0.77 | AI154: AA- | AJ154: 6.4500000000000002e-002 | AK154: =I154+100*T154 -> 118.718 | AL154: 119 | AM154: 25 | AN154: 29.2 | AO154: 34 | AP154: 3.0000000000000001e-003 | AQ154: 21 | AR154: 光华转债!
A155: 181 | B155: 华钰转债!! | C155: 113027 | D155: 43656. | E155: 华钰矿业 | F155: 601020 | G155: 有色金属 | H155: 锌铅镍锡 | I155: 115.43 | J155: 2.7000000000000001e-003 | K155: -1.8000000000000002e-002 | L155: 10.78 | M155: -2.0899999999999998e-002 | N155: 24 | O155: 6.4000000000000001e-002 | P155: 114.9 | Q155: 10.17 | R155: 2.72 | S155: 106 | T155: 8.900000000000001e-002 | U155: 转股中 | V155: 4.69年 | W155: 2.69年 | X155: 5.4000000000000006e-002 | Y155: 5.7999999999999996e-002 | Z155: 3.3 | AA155: 60 | AB155: -1.e-003 | AC155: -6.7000000000000002e-003 | AD155: -3.8199999999999998e-002 | AE155: -4.0300000000000002e-002 | AF155: 86.65 | AG155: 86.22 | AH155: 0.73 | AI155: AA- | AJ155: 6.4500000000000002e-002 | AK155: =I155+100*T155 -> 124.33000000000001 | AL155: 124.9 | AM155: 67 | AN155: 38.2 | AO155: 116 | AP155: -9.3000000000000013e-002 | AQ155: 46 | AR155: 华钰转债!!
A156: 3 | B156: 万孚转债 | C156: 123064 | D156: 44097. | E156: 万孚生物 | F156: 300482 | G156: 医药 | H156: 医疗器械 | I156: 115.802 | J156: 8.9999999999999998e-004 | K156: -8.199999999999999e-003 | L156: 83.05 | M156: -1.4199999999999999e-002 | N156: 26 | O156: 3.7000000000000005e-002 | P156: 115.1 | Q156: 93.55 | R156: 10.98 | S156: 88.78 | T156: 0.30399999999999999 | U156: 5月3天 | V156: 5.90年 | W156: 3.90年 | X156: 2.1000000000000001e-002 | Y156: 1.9e-002 | Z156: 6 | AA156: 285 | AB156: -1.e-003 | AC156: -5.6000000000000008e-003 | AD156: -2.7200000000000002e-002 | AE156: -2.8799999999999999e-002 | AF156: 86.69 | AG156: 89.11 | AH156: 0.52 | AI156: AA | AJ156: 4.5100000000000001e-002 | AK156: =I156+100*T156 -> 146.202 | AL156: 142.8 | AM156: 216 | AN156: 53.7 | AO156: 228 | AP156: -5.9000000000000004e-002 | AQ156: 3 | AR156: 万孚转债
A157: 185 | B157: 三星转债 | C157: 113536 | D157: 43640. | E157: 三星新材 | F157: 603578 | G157: 家电 | H157: 零部件制 | I157: 115.52 | J157: 4.0000000000000001e-003 | K157: -8.3000000000000001e-003 | L157: 21.4 | M157: -6.5000000000000006e-003 | N157: 2.1 | O157: 1.2e-002 | P157: 114.8 | Q157: 19.54 | R157: 3.05 | S157: 109.52 | T157: 5.5e-002 | U157: 转股中 | V157: 4.65年 | W157: 2.65年 | X157: 7.5999999999999998e-002 | Y157: 8.3000000000000004e-002 | Z157: 1.5 | AA157: 20 | AB157: -1.4000000000000002e-003 | AC157: -6.9999999999999993e-003 | AD157: -3.9199999999999999e-002 | AE157: -4.1399999999999999e-002 | AF157: 91.72 | AG157: 94.53 | AH157: 0.67 | AI157: AA | AJ157: 4.3499999999999997e-002 | AK157: =I157+100*T157 -> 121.02 | AL157: 121.5 | AM157: 40 | AN157: 27 | AO157: 21 | AP157: -4.8000000000000001e-002 | AQ157: 38 | AR157: 三星转债
A158: 176 | B158: 好客转债 | C158: 113542 | D158: 43700. | E158: 好莱客 | F158: 603898 | G158: 其他 | H158: 家居用品 | I158: 115.67 | J158: 1.01e-002 | K158: -1.1200000000000002e-002 | L158: 16.42 | M158: -1.8e-003 | N158: 7.8 | O158: 1.1000000000000001e-002 | P158: 114.9 | Q158: 16.27 | R158: 2.18 | S158: 100.92 | T158: 0.14599999999999999 | U158: 转股中 | V158: 4.82年 | W158: 2.82年 | X158: 0.11900000000000001 | Y158: 0.12 | Z158: 6 | AA158: 51 | AB158: -1.4000000000000002e-003 | AC158: -6.8999999999999999e-003 | AD158: -3.7200000000000004e-002 | AE158: -3.9199999999999999e-002 | AF158: 91.16 | AG158: 93.95 | AH158: 0.6 | AI158: AA | AJ158: 4.3499999999999997e-002 | AK158: =I158+100*T158 -> 130.27000000000001 | AL158: 130.4 | AM158: 114 | AN158: 36.5 | AO158: 85 | AP158: -5.4000000000000006e-002 | AQ158: 19 | AR158: 好客转债
A159: 88 | B159: 滨化转债 | C159: 113034 | D159: 43951. | E159: 滨化股份 | F159: 601678 | G159: 化工 | H159: 化工 | I159: 115.98 | J159: -1.8000000000000002e-002 | K159: -1.41e-002 | L159: 4.92 | M159: -4.8399999999999999e-002 | N159: 21 | O159: 6.9999999999999993e-003 | P159: 115.1 | Q159: 4.68 | R159: 1.26 | S159: 105.13 | T159: 0.10300000000000001 | U159: 10天 | V159: 5.51年 | W159: 3.51年 | X159: 0.316 | Y159: 0.33200000000000002 | Z159: 24 | AA159: 76 | AB159: -1.4000000000000002e-003 | AC159: -6.3e-003 | AD159: -3.0499999999999999e-002 | AE159: -3.2300000000000002e-002 | AF159: 88.21 | AG159: 90.67 | AH159: 0.66 | AI159: AA | AJ159: 4.5100000000000001e-002 | AK159: =I159+100*T159 -> 126.28 | AL159: 126.8 | AM159: 84 | AN159: 36.2 | AO159: 84 | AP159: -7.2999999999999995e-002 | AQ159: 26 | AR159: 滨化转债
A160: 298 | B160: 国贸转债! | C160: 110033 | D160: 42388. | E160: 厦门国贸 | F160: 600755 | G160: 交通运输 | H160: 交通运输 | I160: 109.98 | J160: -2.8999999999999998e-003 | K160: 8.9999999999999998e-004 | L160: 6.75 | M160: -7.4000000000000003e-003 | N160: 3.8 | O160: 3.0000000000000001e-003 | P160: 109.7 | Q160: 7.19 | R160: 0.88 | S160: 93.88 | T160: 0.17100000000000001 | U160: 转股中 | V160: 1.25年 | W160: 回售中 | X160: 9.6000000000000002e-002 | Y160: 8.9999999999999997e-002 | Z160: 12 | AA160: 126 | AB160: -2.0999999999999999e-003 | AC160: -1.6299999999999999e-002 | AD160: 回售中 | AE160: 回售中 | AF160: 100.28 | AG160: 104.85 | AH160: 0.27 | AI160: AAA | AJ160: 3.73e-002 | AK160: =I160+100*T160 -> 127.08000000000001 | AL160: 126.1 | AM160: 80 | AN160: 21.2 | AO160: 8 | AP160: -3.4000000000000002e-002 | AQ160: 18 | AR160: 国贸转债!
A161: 210 | B161: 中鼎转2! | C161: 127011 | D161: 43559. | E161: 中鼎股份 | F161: 887 | G161: 汽车 | H161: 零部件制 | I161: 116.4 | J161: -1.e-003 | K161: -6.0000000000000001e-003 | L161: 10.37 | M161: -1.61e-002 | N161: 7.2 | O161: 5.0000000000000001e-003 | P161: 115.2 | Q161: 11.59 | R161: 1.43 | S161: 89.47 | T161: 0.30099999999999999 | U161: 转股中 | V161: 4.42年 | W161: 2.42年 | X161: 9.5000000000000001e-002 | Y161: 8.5000000000000006e-002 | Z161: 12 | AA161: 127 | AB161: -2.3999999999999998e-003 | AC161: -8.5000000000000006e-003 | AD161: -4.4699999999999997e-002 | AE161: -4.7199999999999999e-002 | AF161: 93.31 | AG161: 96.63 | AH161: 0.43 | AI161: AA+ | AJ161: 4.1500000000000002e-002 | AK161: =I161+100*T161 -> 146.5 | AL161: 143.3 | AM161: 221 | AN161: 46.7 | AO161: 187 | AP161: -2.e-002 | AQ161: 28 | AR161: 中鼎转2!
A162: 162 | B162: 英联转债! | C162: 128079 | D162: 43790. | E162: 英联股份 | F162: 2846 | G162: 造纸包装 | H162: 包装材料 | I162: 119.378 | J162: -5.3e-003 | K162: 4.5999999999999999e-003 | L162: 14.91 | M162: -7.000000000000001e-004 | N162: 12 | O162: 6.7000000000000004e-002 | P162: 117.9 | Q162: 13.41 | R162: 4.22 | S162: 111.19 | T162: 7.400000000000001e-002 | U162: 转股中 | V162: 5年15天 | W162: 3年15天 | X162: 5.2000000000000005e-002 | Y162: 5.7000000000000002e-002 | Z162: 1.5 | AA162: 30 | AB162: -2.5000000000000001e-003 | AC162: -8.6999999999999994e-003 | AD162: -4.24e-002 | AE162: -4.4600000000000001e-002 | AF162: 82.26 | AG162: 81.8 | AH162: 0.96 | AI162: A+ | AJ162: 7.7100000000000002e-002 | AK162: =I162+100*T162 -> 126.77800000000001 | AL162: 127.6 | AM162: 88 | AN162: 45.3 | AO162: 174 | AP162: -7.9000000000000001e-002 | AQ162: 18 | AR162: 英联转债!
A163: 105 | B163: 三祥转债! | C163: 113572 | D163: 43930. | E163: 三祥新材 | F163: 603663 | G163: 其他 | H163: 其他 | I163: 115.04 | J163: 3.5999999999999999e-003 | K163: -6.8000000000000005e-003 | L163: 14.9 | M163: -4.0000000000000001e-003 | N163: 3.4 | O163: 1.7000000000000001e-002 | P163: 113.2 | Q163: 14.19 | R163: 5.13 | S163: 105 | T163: 9.6000000000000002e-002 | U163: 转股中 | V163: 5.43年 | W163: 3.43年 | X163: 5.9999999999999998e-002 | Y163: 6.3e-002 | Z163: 1.7 | AA163: 28 | AB163: -3.0000000000000001e-003 | AC163: -7.4000000000000003e-003 | AD163: -2.87e-002 | AE163: -3.0600000000000002e-002 | AF163: 79.6 | AG163: 76.27 | AH163: 0.8 | AI163: A+ | AJ163: 7.7100000000000002e-002 | AK163: =I163+100*T163 -> 124.64 | AL163: 125.1 | AM163: 69 | AN163: 45.5 | AO163: 176 | AP163: -0.19500000000000001 | AQ163: 14 | AR163: 三祥转债!
A164: 189 | B164: 永鼎转债! | C164: 110058 | D164: 43593. | E164: 永鼎股份 | F164: 600105 | G164: 通信互联 | H164: 通信设备 | I164: 116.59 | J164: 2.1400000000000002e-002 | K164: 1.9e-003 | L164: 5.87 | M164: 3.1600000000000003e-002 | N164: 7.9 | O164: 1.e-002 | P164: 114.9 | Q164: 5.04 | R164: 3.14 | S164: 116.47 | T164: 1.e-003 | U164: 转股中 | V164: 4.53年 | W164: 2.53年 | X164: 9.0999999999999998e-002 | Y164: 0.106 | Z164: 6.6 | AA164: 73 | AB164: -3.3e-003 | AC164: -9.1000000000000004e-003 | AD164: -4.4000000000000004e-002 | AE164: -4.6300000000000001e-002 | AF164: 92.3 | AG164: 95.13 | AH164: 0.73 | AI164: AA | AJ164: 4.3499999999999997e-002 | AK164: =I164+100*T164 -> 116.69 | AL164: 116.7 | AM164: 13 | AN164: 21.6 | AO164: 9 | AP164: -2.5000000000000001e-002 | AQ164: 55 | AR164: 永鼎转债!
A165: 223 | B165: 台华转债! | C165: 113525 | D165: 43476. | E165: 台华新材 | F165: 603055 | G165: 服装纺织 | H165: 纺织行业 | I165: 116.51 | J165: -8.8000000000000005e-003 | K165: 3.4999999999999996e-003 | L165: 8.86 | M165: -7.8000000000000005e-003 | N165: 4.7 | O165: 9.0000000000000011e-003 | P165: 114.9 | Q165: 8.03 | R165: 2.64 | S165: 110.34 | T165: 5.5999999999999994e-002 | U165: 转股中 | V165: 4.20年 | W165: 2.20年 | X165: 6.8000000000000005e-002 | Y165: 7.4999999999999997e-002 | Z165: 4.7 | AA165: 69 | AB165: -3.4000000000000002e-003 | AC165: -9.7000000000000003e-003 | AD165: -4.9800000000000004e-002 | AE165: -5.2300000000000006e-002 | AF165: 93.61 | AG165: 96.47 | AH165: 0.67 | AI165: AA | AJ165: 4.3499999999999997e-002 | AK165: =I165+100*T165 -> 122.11 | AL165: 122.7 | AM165: 46 | AN165: 26.2 | AO165: 17 | AP165: -3.6000000000000004e-002 | AQ165: 23 | AR165: 台华转债!
A166: 78 | B166: 交科转债 | C166: 128107 | D166: 43973. | E166: 浙江交科 | F166: 2061 | G166: 建筑 | H166: 建筑工程 | I166: 117.681 | J166: -4.0000000000000001e-003 | K166: -3.0000000000000001e-003 | L166: 5.72 | M166: -1.04e-002 | N166: 11 | O166: 4.0000000000000001e-003 | P166: 115.3 | Q166: 5.36 | R166: 1 | S166: 106.72 | T166: 0.10300000000000001 | U166: 22天 | V166: 5.54年 | W166: 3.54年 | X166: 0.318 | Y166: 0.33899999999999997 | Z166: 25 | AA166: 79 | AB166: -3.8e-003 | AC166: -8.6e-003 | AD166: -3.3599999999999998e-002 | AE166: -3.5400000000000001e-002 | AF166: 88.9 | AG166: 91.68 | AH166: 0.67 | AI166: AA+ | AJ166: 4.3099999999999999e-002 | AK166: =I166+100*T166 -> 127.98099999999999 | AL166: 128.6 | AM166: 99 | AN166: 37 | AO166: 92 | AP166: -1.9e-002 | AQ166: 14 | AR166: 交科转债
A167: 252 | B167: 华通转债! | C167: 128040 | D167: 43294. | E167: 华通医药 | F167: 2758 | G167: 医药 | H167: 医药商业 | I167: 113.901 | J167: -8.5000000000000006e-003 | K167: 2.7000000000000001e-003 | L167: 10.69 | M167: -1.0200000000000001e-002 | N167: 3 | O167: 1.2e-002 | P167: 112.3 | Q167: 11.29 | R167: 3.61 | S167: 94.69 | T167: 0.20300000000000001 | U167: 转股中 | V167: 3.69年 | W167: 1.69年 | X167: 9.9000000000000005e-002 | Y167: 9.4e-002 | Z167: 2.2 | AA167: 22 | AB167: -3.9000000000000003e-003 | AC167: -9.8999999999999991e-003 | AD167: -5.4199999999999998e-002 | AE167: -5.6900000000000006e-002 | AF167: 91.63 | AG167: 89.58 | AH167: 0.58 | AI167: AA- | AJ167: 6.4500000000000002e-002 | AK167: =I167+100*T167 -> 134.20099999999999 | AL167: 133.1 | AM167: 145 | AN167: 41.5 | AO167: 146 | AP167: -5.2000000000000005e-002 | AQ167: 30 | AR167: 华通转债!
A168: 65 | B168: 宝通转债 | C168: 123053 | D168: 44013. | E168: 宝通科技 | F168: 300031 | G168: 通信互联 | H168: 互联网 | I168: 124.5 | J168: 1.0800000000000001e-002 | K168: 2.0799999999999999e-002 | L168: 21.95 | M168: 4.3299999999999998e-002 | N168: 39 | O168: 6.0999999999999999e-002 | P168: 121.3 | Q168: 20.8 | R168: 3.11 | S168: 105.53 | T168: 0.17999999999999999 | U168: 2月6天 | V168: 5.66年 | W168: 3.66年 | X168: 5.7000000000000002e-002 | Y168: 6.0999999999999999e-002 | Z168: 5 | AA168: 87 | AB168: -4.6999999999999993e-003 | AC168: -1.1000000000000001e-002 | AD168: -4.58e-002 | AE168: -4.7800000000000002e-002 | AF168: 81.8 | AG168: 85.1 | AH168: 0.73 | AI168: AA- | AJ168: 6.6100000000000006e-002 | AK168: =I168+100*T168 -> 142.5 | AL168: 143.5 | AM168: 223 | AN168: 58.4 | AO168: 249 | AP168: -2.2000000000000002e-002 | AQ168: 4 | AR168: 宝通转债
A169: 165 | B169: 金能转债 | C169: 113545 | D169: 43776. | E169: 金能科技 | F169: 603113 | G169: 煤炭 | H169: 炼焦 | I169: 118.11 | J169: -3.3e-003 | K169: -3.7000000000000002e-003 | L169: 12 | M169: -1.0700000000000001e-002 | N169: 0.6 | O169: 0. | P169: 115.3 | Q169: 11.4 | R169: 1.37 | S169: 105.26 | T169: 0.122 | U169: 转股中 | V169: 5年8天 | W169: 3年8天 | X169: 0.185 | Y169: 0.19500000000000001 | Z169: 15 | AA169: 81 | AB169: -4.8999999999999998e-003 | AC169: -1.03e-002 | AD169: -4.0099999999999997e-002 | AE169: -4.2300000000000004e-002 | AF169: 90.34 | AG169: 92.84 | AH169: 0.65 | AI169: AA | AJ169: 4.5100000000000001e-002 | AK169: =I169+100*T169 -> 130.31 | AL169: 131 | AM169: 123 | AN169: 38.1 | AO169: 114 | AP169: -3.3000000000000002e-002 | AQ169: 20 | AR169: 金能转债
A170: 200 | B170: 现代转债 | C170: 110057 | D170: 43585. | E170: 现代制药 | F170: 600420 | G170: 医药 | H170: 化学制药 | I170: 113.4 | J170: 2.3e-003 | K170: -7.4999999999999997e-003 | L170: 9.49 | M170: -9.3999999999999986e-003 | N170: 3.1 | O170: 2.e-003 | P170: 110.8 | Q170: 9.89 | R170: 1.29 | S170: 95.96 | T170: 0.182 | U170: 转股中 | V170: 4.49年 | W170: 2.49年 | X170: 0.16600000000000001 | Y170: 0.159 | Z170: 16 | AA170: 97 | AB170: -5.3e-003 | AC170: -9.7000000000000003e-003 | AD170: -3.49e-002 | AE170: -3.7200000000000004e-002 | AF170: 93.54 | AG170: 93.85 | AH170: 0.55 | AI170: AAA | AJ170: 3.85e-002 | AK170: =I170+100*T170 -> 131.59999999999999 | AL170: 130.8 | AM170: 120 | AN170: 37 | AO170: 95 | AP170: -3.7999999999999999e-002 | AQ170: 21 | AR170: 现代转债
A171: 253 | B171: 三力转债! | C171: 128039 | D171: 43280. | E171: 三 力 士 | F171: 2224 | G171: 机械装备 | H171: 专用设备 | I171: 112.02 | J171: 2.e-003 | K171: -3.0999999999999999e-003 | L171: 5.98 | M171: -1.7000000000000001e-003 | N171: 1.5 | O171: 6.9999999999999993e-003 | P171: 109.8 | Q171: 5.81 | R171: 1.9 | S171: 102.93 | T171: 8.8000000000000009e-002 | U171: 转股中 | V171: 3.67年 | W171: 1.67年 | X171: 4.7e-002 | Y171: 4.8000000000000001e-002 | Z171: 2 | AA171: 44 | AB171: -5.5000000000000005e-003 | AC171: -1.04e-002 | AD171: -4.7199999999999999e-002 | AE171: -4.9800000000000004e-002 | AF171: 91.5 | AG171: 87.65 | AH171: 0.7 | AI171: AA- | AJ171: 6.4500000000000002e-002 | AK171: =I171+100*T171 -> 120.81999999999999 | AL171: 121.1 | AM171: 38 | AN171: 29.6 | AO171: 36 | AP171: -4.2999999999999997e-002 | AQ171: 19 | AR171: 三力转债!
A172: 227 | B172: 福能转债! | C172: 110048 | D172: 43462. | E172: 福能股份 | F172: 600483 | G172: 能源电力 | H172: 电力供应 | I172: 116.5 | J172: 4.1999999999999997e-003 | K172: -1.e-004 | L172: 7.93 | M172: 7.6e-003 | N172: 7.5 | O172: 2.e-003 | P172: 113.9 | Q172: 8.12 | R172: 1.02 | S172: 97.66 | T172: 0.193 | U172: 转股中 | V172: 4.17年 | W172: 2.17年 | X172: 0.20300000000000001 | Y172: 0.19800000000000001 | Z172: 28 | AA172: 140 | AB172: -5.5000000000000005e-003 | AC172: -1.15e-002 | AD172: -5.0300000000000004e-002 | AE172: -5.2900000000000003e-002 | AF172: 94.13 | AG172: 96.49 | AH172: 0.54 | AI172: AA+ | AJ172: 4.1500000000000002e-002 | AK172: =I172+100*T172 -> 135.80000000000001 | AL172: 135.3 | AM172: 165 | AN172: 38.8 | AO172: 123 | AP172: -3.0000000000000001e-003 | AQ172: 8 | AR172: 福能转债!
A173: 40 | B173: 龙大转债 | C173: 128119 | D173: 44050. | E173: 龙大肉食 | F173: 2726 | G173: 食品饮料 | H173: 肉制品 | I173: 124.91 | J173: 2.64e-002 | K173: -5.6000000000000008e-003 | L173: 10.44 | M173: 3.0600000000000002e-002 | N173: 100 | O173: 8.4000000000000005e-002 | P173: 120.2 | Q173: 9.56 | R173: 4.01 | S173: 109.21 | T173: 0.14400000000000002 | U173: 3月13天 | V173: 5.77年 | W173: 3.77年 | X173: 9.0999999999999998e-002 | Y173: 0.10000000000000001 | Z173: 9.5 | AA173: 104 | AB173: -6.8000000000000005e-003 | AC173: -1.2699999999999999e-002 | AD173: -4.6600000000000003e-002 | AE173: -4.82e-002 | AF173: 87.31 | AG173: 93.62 | AH173: 0.68 | AI173: AA | AJ173: 4.5100000000000001e-002 | AK173: =I173+100*T173 -> 139.31 | AL173: 140.6 | AM173: 201 | AN173: 47 | AO173: 191 | AP173: -7.2999999999999995e-002 | AQ173: 5 | AR173: 龙大转债
A174: 29 | B174: 航新转债 | C174: 123061 | D174: 44061. | E174: 航新科技 | F174: 300424 | G174: 航空航天 | H174: 航空航天 | I174: 129.822 | J174: 1.4000000000000002e-003 | K174: -2.5699999999999997e-002 | L174: 19.41 | M174: -2.8500000000000001e-002 | N174: 74 | O174: 0.22699999999999998 | P174: 124.8 | Q174: 14.86 | R174: 4.33 | S174: 130.62 | T174: -6.0000000000000001e-003 | U174: 3月24天 | V174: 5.79年 | W174: 3.79年 | X174: 5.4000000000000006e-002 | Y174: 7.0000000000000007e-002 | Z174: 2.5 | AA174: 47 | AB174: -6.8999999999999999e-003 | AC174: -1.3999999999999999e-002 | AD174: -5.3399999999999996e-002 | AE174: -5.5500000000000001e-002 | AF174: 81.53 | AG174: 86.88 | AH174: 0.85 | AI174: AA- | AJ174: 6.6100000000000006e-002 | AK174: =I174+100*T174 -> 129.22200000000001 | AL174: 129 | AM174: 102 | AN174: 42.1 | AO174: 150 | AP174: 8.5999999999999993e-002 | AQ174: 5 | AR174: 航新转债
A175: 82 | B175: 聚飞转债 | C175: 123050 | D175: 43966. | E175: 聚飞光电 | F175: 300303 | G175: 电子 | H175: LED制 | I175: 128.98 | J175: 9.4999999999999998e-003 | K175: -1.8500000000000003e-002 | L175: 6.3 | M175: -1.1000000000000001e-002 | N175: 12 | O175: 1.3000000000000001e-002 | P175: 124.2 | Q175: 5.18 | R175: 3.42 | S175: 121.62 | T175: 6.0999999999999999e-002 | U175: 14天 | V175: 5.52年 | W175: 3.52年 | X175: 8.8000000000000009e-002 | Y175: 0.106 | Z175: 7.1 | AA175: 81 | AB175: -6.9999999999999993e-003 | AC175: -1.4199999999999999e-002 | AD175: -5.7000000000000002e-002 | AE175: -5.8899999999999994e-002 | AF175: 82.45 | AG175: 87.89 | AH175: 0.81 | AI175: AA- | AJ175: 6.6100000000000006e-002 | AK175: =I175+100*T175 -> 135.07999999999998 | AL175: 136.3 | AM175: 172 | AN175: 48.4 | AO175: 199 | AP175: -0.111 | AQ175: 11 | AR175: 聚飞转债
A176: 268 | B176: 蒙电转债! | C176: 110041 | D176: 43109. | E176: 内蒙华电 | F176: 600863 | G176: 能源电力 | H176: 电力供应 | I176: 112.89 | J176: 8.8000000000000005e-003 | K176: -1.26e-002 | L176: 2.56 | M176: -7.8000000000000005e-003 | N176: 1.6 | O176: 1.e-003 | P176: 110.3 | Q176: 2.69 | R176: 1.3 | S176: 95.17 | T176: 0.18600000000000003 | U176: 转股中 | V176: 3.21年 | W176: 1.21年 | X176: 0.126 | Y176: 0.12 | Z176: 19 | AA176: 149 | AB176: -7.4000000000000003e-003 | AC176: -1.32e-002 | AD176: -6.6299999999999998e-002 | AE176: -6.9900000000000004e-002 | AF176: 97.64 | AG176: 97.97 | AH176: 0.49 | AI176: AAA | AJ176: 3.85e-002 | AK176: =I176+100*T176 -> 131.49000000000001 | AL176: 130.6 | AM176: 117 | AN176: 32.6 | AO176: 54 | AP176: -2.5000000000000001e-002 | AQ176: 8 | AR176: 蒙电转债!
A177: 183 | B177: 文灿转债! | C177: 113537 | D177: 43651. | E177: 文灿股份 | F177: 603348 | G177: 汽车 | H177: 零部件制 | I177: 125.83 | J177: 1.34e-002 | K177: -1.3000000000000001e-002 | L177: 23.52 | M177: 4.0000000000000002e-004 | N177: 11 | O177: 1.7000000000000001e-002 | P177: 121.5 | Q177: 19.43 | R177: 2.39 | S177: 121.05 | T177: 3.9e-002 | U177: 转股中 | V177: 4.68年 | W177: 2.68年 | X177: 8.9999999999999997e-002 | Y177: 0.109 | Z177: 5.1 | AA177: 56 | AB177: -7.6e-003 | AC177: -1.54e-002 | AD177: -6.4199999999999993e-002 | AE177: -6.6900000000000001e-002 | AF177: 87.6 | AG177: 91.36 | AH177: 0.8 | AI177: AA- | AJ177: 6.4500000000000002e-002 | AK177: =I177+100*T177 -> 129.72999999999999 | AL177: 130.6 | AM177: 116 | AN177: 39.3 | AO177: 128 | AP177: -3.5000000000000003e-002 | AQ177: 26 | AR177: 文灿转债!
A178: 62 | B178: 永兴转债 | C178: 128110 | D178: 44020. | E178: 永兴材料 | F178: 2756 | G178: 钢铁 | H178: 炼钢 | I178: 118.71 | J178: 1.03e-002 | K178: -1.4999999999999999e-002 | L178: 16.28 | M178: -7.9000000000000008e-003 | N178: 2.4 | O178: 3.0000000000000001e-003 | P178: 113.2 | Q178: 17.06 | R178: 1.73 | S178: 95.43 | T178: 0.24399999999999999 | U178: 2月10天 | V178: 5.67年 | W178: 3.67年 | X178: 0.11900000000000001 | Y178: 0.114 | Z178: 7 | AA178: 59 | AB178: -8.5000000000000006e-003 | AC178: -1.26e-002 | AD178: -3.49e-002 | AE178: -3.6600000000000001e-002 | AF178: 87.67 | AG178: 88.55 | AH178: 0.59 | AI178: AA | AJ178: 4.5100000000000001e-002 | AK178: =I178+100*T178 -> 143.10999999999999 | AL178: 142 | AM178: 212 | AN178: 53.4 | AO178: 223 | AP178: -7.0000000000000007e-002 | AQ178: 4 | AR178: 永兴转债
A179: 123 | B179: 柳药转债 | C179: 113563 | D179: 43885. | E179: 柳药股份 | F179: 603368 | G179: 医药 | H179: 医药商业 | I179: 118.48 | J179: 1.43e-002 | K179: -1.6799999999999999e-002 | L179: 23.29 | M179: -4.3e-003 | N179: 8 | O179: 8.0000000000000002e-003 | P179: 113.2 | Q179: 24.47 | R179: 1.84 | S179: 95.18 | T179: 0.245 | U179: 转股中 | V179: 5.28年 | W179: 3.28年 | X179: 9.5000000000000001e-002 | Y179: 8.9999999999999997e-002 | Z179: 8 | AA179: 84 | AB179: -8.8000000000000005e-003 | AC179: -1.32e-002 | AD179: -3.8300000000000001e-002 | AE179: -4.0199999999999993e-002 | AF179: 89.22 | AG179: 90.11 | AH179: 0.58 | AI179: AA | AJ179: 4.5100000000000001e-002 | AK179: =I179+100*T179 -> 142.98000000000002 | AL179: 141.8 | AM179: 210 | AN179: 51.7 | AO179: 211 | AP179: -4.0999999999999995e-002 | AQ179: 16 | AR179: 柳药转债
A180: 6 | B180: 景20转债 | C180: 113602 | D180: 44096. | E180: 景旺电子 | F180: 603228 | G180: 电子 | H180: 元器件制 | I180: 119.25 | J180: 3.3e-003 | K180: 2.3e-003 | L180: 33.35 | M180: 9.3999999999999986e-003 | N180: 62 | O180: 2.8999999999999998e-002 | P180: 113.3 | Q180: 35.28 | R180: 4.93 | S180: 94.53 | T180: 0.26200000000000001 | U180: 4月26天 | V180: 5.88年 | W180: 3.88年 | X180: 6.3e-002 | Y180: 5.9000000000000004e-002 | Z180: 18 | AA180: 284 | AB180: -8.8000000000000005e-003 | AC180: -1.2800000000000001e-002 | AD180: -3.4000000000000002e-002 | AE180: -3.5699999999999996e-002 | AF180: 86.96 | AG180: 87.84 | AH180: 0.6 | AI180: AA | AJ180: 4.5100000000000001e-002 | AK180: =I180+100*T180 -> 145.44999999999999 | AL180: 144 | AM180: 228 | AN180: 56.1 | AO180: 243 | AP180: -1.9e-002 | AQ180: 3 | AR180: 景20转债
A181: 211 | B181: 拓邦转债 | C181: 128058 | D181: 43563. | E181: 拓邦股份 | F181: 2139 | G181: 电子 | H181: 电子产品 | I181: 127.582 | J181: 1.09e-002 | K181: -7.6e-003 | L181: 6.6 | M181: 4.5999999999999999e-003 | N181: 4.9 | O181: 6.9999999999999993e-003 | P181: 122.6 | Q181: 5.47 | R181: 2.63 | S181: 120.66 | T181: 5.7000000000000002e-002 | U181: 转股中 | V181: 4.42年 | W181: 2.42年 | X181: 8.4000000000000005e-002 | Y181: 0.10099999999999999 | Z181: 5.7 | AA181: 68 | AB181: -9.1999999999999998e-003 | AC181: -1.77e-002 | AD181: -7.51e-002 | AE181: -7.8100000000000003e-002 | AF181: 93.76 | AG181: 102.07 | AH181: 0.72 | AI181: AA | AJ181: 4.3499999999999997e-002 | AK181: =I181+100*T181 -> 133.28199999999998 | AL181: 134.5 | AM181: 159 | AN181: 32.4 | AO181: 52 | AP181: -3.7999999999999999e-002 | AQ181: 20 | AR181: 拓邦转债
A182: 18 | B182: 法兰转债 | C182: 113598 | D182: 44068. | E182: 法兰泰克 | F182: 603966 | G182: 机械装备 | H182: 工程机械 | I182: 127.8 | J182: 2.6499999999999999e-002 | K182: -1.84e-002 | L182: 15.85 | M182: 1.0200000000000001e-002 | N182: 18 | O182: 4.2000000000000003e-002 | P182: 121.2 | Q182: 13.88 | R182: 3.13 | S182: 114.19 | T182: 0.11900000000000001 | U182: 4月3天 | V182: 5.82年 | W182: 3.82年 | X182: 9.9000000000000005e-002 | Y182: 0.113 | Z182: 3.3 | AA182: 33 | AB182: -9.1999999999999998e-003 | AC182: -1.54e-002 | AD182: -5.0599999999999999e-002 | AE182: -5.2400000000000002e-002 | AF182: 80.9 | AG182: 84.17 | AH182: 0.79 | AI182: AA- | AJ182: 6.6100000000000006e-002 | AK182: =I182+100*T182 -> 139.69999999999999 | AL182: 141.4 | AM182: 207 | AN182: 57.2 | AO182: 245 | AP182: -7.4999999999999997e-002 | AQ182: 4 | AR182: 法兰转债
A183: 36 | B183: 宏川转债 | C183: 128121 | D183: 44050. | E183: 宏川智慧 | F183: 2930 | G183: 交通运输 | H183: 物流业 | I183: 119.501 | J183: 8.0000000000000004e-004 | K183: -6.1999999999999998e-003 | L183: 19.24 | M183: -7.7000000000000002e-003 | N183: 3 | O183: 4.0000000000000001e-003 | P183: 113.3 | Q183: 20.25 | R183: 4.64 | S183: 95.01 | T183: 0.25800000000000001 | U183: 3月21天 | V183: 5.78年 | W183: 3.78年 | X183: 7.8e-002 | Y183: 7.4999999999999997e-002 | Z183: 6.7 | AA183: 85 | AB183: -9.300000000000001e-003 | AC183: -1.34e-002 | AD183: -3.5400000000000001e-002 | AE183: -3.7100000000000001e-002 | AF183: 80.83 | AG183: 78.85 | AH183: 0.7 | AI183: AA- | AJ183: 6.6100000000000006e-002 | AK183: =I183+100*T183 -> 145.30100000000002 | AL183: 144 | AM183: 229 | AN183: 63.2 | AO183: 261 | AP183: 1.6e-002 | AQ183: 3 | AR183: 宏川转债
A184: 54 | B184: 润达转债 | C184: 113588 | D184: 44025. | E184: 润达医疗 | F184: 603108 | G184: 医药 | H184: 医疗器械 | I184: 120.48 | J184: -1.e-004 | K184: -6.9999999999999993e-003 | L184: 13.41 | M184: -1.11e-002 | N184: 1.6 | O184: 2.e-003 | P184: 114.2 | Q184: 13.36 | R184: 2.71 | S184: 100.37 | T184: 0.20000000000000001 | U184: 2月18天 | V184: 5.70年 | W184: 3.70年 | X184: 7.0999999999999994e-002 | Y184: 7.0999999999999994e-002 | Z184: 5.5 | AA184: 78 | AB184: -9.4999999999999998e-003 | AC184: -1.3899999999999999e-002 | AD184: -3.8399999999999997e-002 | AE184: -4.0099999999999997e-002 | AF184: 87.58 | AG184: 89.24 | AH184: 0.64 | AI184: AA | AJ184: 4.5100000000000001e-002 | AK184: =I184+100*T184 -> 140.48000000000002 | AL184: 140.6 | AM184: 200 | AN184: 51.3 | AO184: 208 | AP184: -3.1e-002 | AQ184: 7 | AR184: 润达转债
A185: 263 | B185: 无锡转债! | C185: 110043 | D185: 43173. | E185: 无锡银行 | F185: 600908 | G185: 金融 | H185: 银行行业 | I185: 112.6 | J185: -1.3899999999999999e-002 | K185: 4.7999999999999996e-003 | L185: 5.53 | M185: -1.78e-002 | N185: 15 | O185: 5.0000000000000001e-003 | P185: 109.1 | Q185: 5.79 | R185: 0.91 | S185: 95.51 | T185: 0.17899999999999999 | U185: 转股中 | V185: 3.32年 | W185: 无权 | X185: 0.29299999999999998 | Y185: 0.28000000000000003 | Z185: 30 | AA185: 102 | AB185: -9.5999999999999992e-003 | AC185: -1.47e-002 | AD185: 无权 | AE185: 无权 | AF185: 无权 | AG185: 95.54 | AH185: 0.51 | AI185: AA+ | AJ185: 4.1500000000000002e-002 | AK185: =I185+100*T185 -> 130.5 | AL185: 129.7 | AM185: 105 | AN185: 34.1 | AO185: 66 | AP185: -3.3000000000000002e-002 | AQ185: 32 | AR185: 无锡转债!
A186: 158 | B186: 天路转债! | C186: 110060 | D186: 43797. | E186: 西藏天路 | F186: 600326 | G186: 建筑 | H186: 水泥 | I186: 121.12 | J186: 1.72e-002 | K186: -1.3600000000000001e-002 | L186: 7.91 | M186: 5.1000000000000004e-003 | N186: 57 | O186: 6.5000000000000002e-002 | P186: 115.3 | Q186: 7.16 | R186: 1.91 | S186: 110.47 | T186: 9.6000000000000002e-002 | U186: 转股中 | V186: 5年22天 | W186: 3年22天 | X186: 0.10300000000000001 | Y186: 0.114 | Z186: 7.1 | AA186: 68 | AB186: -9.8999999999999991e-003 | AC186: -1.52e-002 | AD186: -4.7199999999999999e-002 | AE186: -4.9299999999999997e-002 | AF186: 90.19 | AG186: 92.68 | AH186: 0.71 | AI186: AA | AJ186: 4.5100000000000001e-002 | AK186: =I186+100*T186 -> 130.72 | AL186: 131.8 | AM186: 129 | AN186: 39.1 | AO186: 125 | AP186: -6.0999999999999999e-002 | AQ186: 12 | AR186: 天路转债!
A187: 85 | B187: 华统转债 | C187: 128106 | D187: 43959. | E187: 华统股份 | F187: 2840 | G187: 农业 | H187: 农产品加 | I187: 119.723 | J187: 1.8100000000000002e-002 | K187: -7.1999999999999998e-003 | L187: 10.37 | M187: 1.47e-002 | N187: 6.5 | O187: 1.e-002 | P187: 113.2 | Q187: 9.39 | R187: 1.76 | S187: 110.44 | T187: 8.4000000000000005e-002 | U187: 10天 | V187: 5.51年 | W187: 3.51年 | X187: 0.11900000000000001 | Y187: 0.13100000000000001 | Z187: 5.5 | AA187: 46 | AB187: -1.03e-002 | AC187: -1.46e-002 | AD187: -3.8599999999999995e-002 | AE187: -4.0500000000000001e-002 | AF187: 88.31 | AG187: 89.2 | AH187: 0.74 | AI187: AA | AJ187: 4.5100000000000001e-002 | AK187: =I187+100*T187 -> 128.12299999999999 | AL187: 129 | AM187: 101 | AN187: 39.8 | AO187: 131 | AP187: -3.2000000000000001e-002 | AQ187: 8 | AR187: 华统转债
A188: 234 | B188: 张行转债 | C188: 128048 | D188: 43433. | E188: 张家港行 | F188: 2839 | G188: 金融 | H188: 银行行业 | I188: 118.9 | J188: -9.1999999999999998e-003 | K188: -6.1999999999999998e-003 | L188: 5.84 | M188: -2.6699999999999998e-002 | N188: 17 | O188: 6.0000000000000001e-003 | P188: 113.9 | Q188: 5.76 | R188: 1.02 | S188: 101.39 | T188: 0.17300000000000001 | U188: 转股中 | V188: 4年37天 | W188: 无权 | X188: 0.23699999999999999 | Y188: 0.23999999999999999 | Z188: 25 | AA188: 106 | AB188: -1.06e-002 | AC188: -1.66e-002 | AD188: 无权 | AE188: 无权 | AF188: 无权 | AG188: 96.76 | AH188: 0.57 | AI188: AA+ | AJ188: 4.1500000000000002e-002 | AK188: =I188+100*T188 -> 136.20000000000002 | AL188: 136.4 | AM188: 173 | AN188: 39.6 | AO188: 129 | AP188: -3.7000000000000005e-002 | AQ188: 14 | AR188: 张行转债
A189: 177 | B189: 荣晟转债! | C189: 113541 | D189: 43690. | E189: 荣晟环保 | F189: 603165 | G189: 造纸包装 | H189: 包装用纸 | I189: 121.05 | J189: 7.3000000000000001e-003 | K189: -2.5999999999999999e-003 | L189: 14.05 | M189: 5.6999999999999993e-003 | N189: 8.3 | O189: 2.2000000000000002e-002 | P189: 115 | Q189: 11.54 | R189: 2.43 | S189: 121.75 | T189: -6.0000000000000001e-003 | U189: 转股中 | V189: 4.79年 | W189: 2.79年 | X189: 8.8000000000000009e-002 | Y189: 0.107 | Z189: 3.1 | AA189: 35 | AB189: -1.0800000000000001e-002 | AC189: -1.6299999999999999e-002 | AD189: -5.2000000000000005e-002 | AE189: -5.4100000000000002e-002 | AF189: 86.17 | AG189: 85.74 | AH189: 0.83 | AI189: AA- | AJ189: 6.4500000000000002e-002 | AK189: =I189+100*T189 -> 120.45 | AL189: 120.3 | AM189: 32 | AN189: 34.2 | AO189: 67 | AP189: 1.4999999999999999e-002 | AQ189: 49 | AR189: 荣晟转债!
A190: 116 | B190: 桐20转债! | C190: 113032 | D190: 43910. | E190: 桐昆股份 | F190: 601233 | G190: 服装纺织 | H190: 纺织行业 | I190: 120.23 | J190: -2.9999999999999997e-004 | K190: -8.8999999999999999e-003 | L190: 13.83 | M190: -1.5700000000000002e-002 | N190: 4.9 | O190: 2.e-003 | P190: 113.1 | Q190: 14.35 | R190: 1.32 | S190: 96.38 | T190: 0.248 | U190: 转股中 | V190: 5.40年 | W190: 3.40年 | X190: 8.9999999999999997e-002 | Y190: 8.6999999999999994e-002 | Z190: 23 | AA190: 256 | AB190: -1.15e-002 | AC190: -1.5800000000000002e-002 | AD190: -4.1200000000000001e-002 | AE190: -4.2999999999999997e-002 | AF190: 89.23 | AG190: 90.44 | AH190: 0.59 | AI190: AA+ | AJ190: 4.3099999999999999e-002 | AK190: =I190+100*T190 -> 145.03 | AL190: 144.1 | AM190: 230 | AN190: 53.6 | AO190: 227 | AP190: -8.5000000000000006e-002 | AQ190: 20 | AR190: 桐20转债!
A191: 67 | B191: 家悦转债 | C191: 113584 | D191: 44006. | E191: 家家悦 | F191: 603708 | G191: 商业零售 | H191: 超市 | I191: 123.09 | J191: 7.000000000000001e-004 | K191: -6.8999999999999999e-003 | L191: 36.07 | M191: -1.0700000000000001e-002 | N191: 6.2 | O191: 8.0000000000000002e-003 | P191: 115.3 | Q191: 37.97 | R191: 7.57 | S191: 95 | T191: 0.29600000000000004 | U191: 2月7天 | V191: 5.66年 | W191: 3.66年 | X191: 2.8999999999999998e-002 | Y191: 2.7999999999999997e-002 | Z191: 6.5 | AA191: 219 | AB191: -1.1699999999999999e-002 | AC191: -1.6399999999999998e-002 | AD191: -4.3899999999999995e-002 | AE191: -4.5700000000000005e-002 | AF191: 87.81 | AG191: 90.25 | AH191: 0.58 | AI191: AA | AJ191: 4.5100000000000001e-002 | AK191: =I191+100*T191 -> 152.69 | AL191: 151.2 | AM191: 256 | AN191: 60.9 | AO191: 257 | AP191: -3.3000000000000002e-002 | AQ191: 4 | AR191: 家悦转债
A192: 55 | B192: 晨光转债 | C192: 123055 | D192: 44025. | E192: 晨光生物 | F192: 300138 | G192: 食品饮料 | H192: 食品加工 | I192: 132.78 | J192: 8.199999999999999e-003 | K192: -6.0000000000000001e-003 | L192: 16.03 | M192: 2.5000000000000001e-003 | N192: 12 | O192: 1.4999999999999999e-002 | P192: 124.3 | Q192: 12.25 | R192: 4.36 | S192: 130.86 | T192: 1.4999999999999999e-002 | U192: 2月18天 | V192: 5.70年 | W192: 3.70年 | X192: 7.6999999999999999e-002 | Y192: 0.10000000000000001 | Z192: 6.3 | AA192: 82 | AB192: -1.1699999999999999e-002 | AC192: -1.8700000000000001e-002 | AD192: -6.1399999999999996e-002 | AE192: -6.3299999999999995e-002 | AF192: 81.63 | AG192: 87.01 | AH192: 0.87 | AI192: AA- | AJ192: 6.6100000000000006e-002 | AK192: =I192+100*T192 -> 134.28 | AL192: 134.7 | AM192: 161 | AN192: 47.7 | AO192: 196 | AP192: 5.7000000000000002e-002 | AQ192: 6 | AR192: 晨光转债
A193: 217 | B193: 中天转债! | C193: 110051 | D193: 43546. | E193: 中天科技 | F193: 600522 | G193: 通信互联 | H193: 通信设备 | I193: 119.9 | J193: -2.8999999999999998e-003 | K193: 3.4999999999999996e-003 | L193: 10.48 | M193: 1.e-003 | N193: 16 | O193: 3.0000000000000001e-003 | P193: 113.9 | Q193: 10.09 | R193: 1.5 | S193: 103.87 | T193: 0.154 | U193: 转股中 | V193: 4.40年 | W193: 2.40年 | X193: 0.12300000000000001 | Y193: 0.128 | Z193: 40 | AA193: 321 | AB193: -1.18e-002 | AC193: -1.7399999999999999e-002 | AD193: -5.6600000000000004e-002 | AE193: -5.9000000000000004e-002 | AF193: 93.26 | AG193: 95.61 | AH193: 0.62 | AI193: AA+ | AJ193: 4.1500000000000002e-002 | AK193: =I193+100*T193 -> 135.30000000000001 | AL193: 135.9 | AM193: 168 | AN193: 40.3 | AO193: 139 | AP193: -3.2000000000000001e-002 | AQ193: 28 | AR193: 中天转债!
A194: 115 | B194: 盛屯转债! | C194: 110066 | D194: 43921. | E194: 盛屯矿业 | F194: 600711 | G194: 有色金属 | H194: 有色行业 | I194: 122.9 | J194: 8.6e-003 | K194: -2.3900000000000001e-002 | L194: 5.25 | M194: -2.23e-002 | N194: 12 | O194: 4.0000000000000001e-003 | P194: 115.3 | Q194: 4.88 | R194: 1.34 | S194: 107.58 | T194: 0.14199999999999999 | U194: 转股中 | V194: 5.40年 | W194: 3.40年 | X194: 0.19399999999999998 | Y194: 0.20899999999999999 | Z194: 24 | AA194: 121 | AB194: -1.2e-002 | AC194: -1.6899999999999998e-002 | AD194: -4.6600000000000003e-002 | AE194: -4.8499999999999995e-002 | AF194: 88.82 | AG194: 91.29 | AH194: 0.68 | AI194: AA | AJ194: 4.5100000000000001e-002 | AK194: =I194+100*T194 -> 137.09999999999999 | AL194: 138.2 | AM194: 183 | AN194: 46.9 | AO194: 189 | AP194: -0.109 | AQ194: 45 | AR194: 盛屯转债!
A195: 57 | B195: 比音转债 | C195: 128113 | D195: 44027. | E195: 比音勒芬 | F195: 2832 | G195: 服装纺织 | H195: 服装行业 | I195: 125.53 | J195: 8.3000000000000001e-003 | K195: -2.2700000000000001e-002 | L195: 16.75 | M195: -1.9900000000000001e-002 | N195: 34 | O195: 4.0000000000000001e-002 | P195: 117.3 | Q195: 14.9 | R195: 4.47 | S195: 112.42 | T195: 0.11699999999999999 | U195: 2月16天 | V195: 5.69年 | W195: 3.69年 | X195: 7.8e-002 | Y195: 8.8000000000000009e-002 | Z195: 6.9 | AA195: 88 | AB195: -1.21e-002 | AC195: -1.7299999999999999e-002 | AD195: -4.8499999999999995e-002 | AE195: -5.0199999999999995e-002 | AF195: 87.7 | AG195: 91.7 | AH195: 0.73 | AI195: AA | AJ195: 4.5100000000000001e-002 | AK195: =I195+100*T195 -> 137.22999999999999 | AL195: 138.6 | AM195: 186 | AN195: 46.9 | AO195: 190 | AP195: 4.4999999999999998e-002 | AQ195: 5 | AR195: 比音转债
A196: 201 | B196: 精测转债!! | C196: 123025 | D196: 43574. | E196: 精测电子 | F196: 300567 | G196: 电子 | H196: 液晶显示 | I196: 124.06 | J196: -8.9999999999999998e-004 | K196: -1.8e-003 | L196: 51.6 | M196: -3.9000000000000003e-003 | N196: 8.3 | O196: 2.1000000000000001e-002 | P196: 117.3 | Q196: 49.95 | R196: 8.92 | S196: 103.3 | T196: 0.20100000000000001 | U196: 转股中 | V196: 4.48年 | W196: 2.48年 | X196: 2.4e-002 | Y196: 2.5000000000000001e-002 | Z196: 3.1 | AA196: 127 | AB196: -1.2699999999999999e-002 | AC196: -1.9299999999999998e-002 | AD196: -6.6500000000000004e-002 | AE196: -6.8900000000000003e-002 | AF196: 88.02 | AG196: 89.23 | AH196: 0.69 | AI196: AA- | AJ196: 6.4500000000000002e-002 | AK196: =I196+100*T196 -> 144.16 | AL196: 144.8 | AM196: 235 | AN196: 55.6 | AO196: 240 | AP196: -5.9999999999999998e-002 | AQ196: 17 | AR196: 精测转债!!
A197: 135 | B197: 淮矿转债! | C197: 110065 | D197: 43843. | E197: 淮北矿业 | F197: 600985 | G197: 煤炭 | H197: 煤炭开采 | I197: 118.52 | J197: 8.3000000000000001e-003 | K197: -2.64e-002 | L197: 9.7 | M197: -2.7099999999999999e-002 | N197: 4 | O197: 1.e-003 | P197: 111 | Q197: 9.33 | R197: 1.08 | S197: 103.97 | T197: 0.14000000000000001 | U197: 转股中 | V197: 5.21年 | W197: 3.21年 | X197: 0.13100000000000001 | Y197: 0.13600000000000001 | Z197: 28 | AA197: 211 | AB197: -1.2699999999999999e-002 | AC197: -1.6500000000000001e-002 | AD197: -3.9599999999999996e-002 | AE197: -4.1500000000000002e-002 | AF197: 90.73 | AG197: 90.78 | AH197: 0.67 | AI197: AAA | AJ197: 4.0099999999999997e-002 | AK197: =I197+100*T197 -> 132.52000000000001 | AL197: 133.1 | AM197: 143 | AN197: 42.3 | AO197: 151 | AP197: -3.3000000000000002e-002 | AQ197: 22 | AR197: 淮矿转债!
A198: 149 | B198: 烽火转债 | C198: 110062 | D198: 43824. | E198: 烽火通信 | F198: 600498 | G198: 通信互联 | H198: 通信设备 | I198: 118.51 | J198: 8.8999999999999999e-003 | K198: -1.09e-002 | L198: 23.76 | M198: -3.8e-003 | N198: 9.8 | O198: 3.0000000000000001e-003 | P198: 111 | Q198: 25.65 | R198: 2.67 | S198: 92.63 | T198: 0.27899999999999997 | U198: 转股中 | V198: 5年57天 | W198: 3年57天 | X198: 0.111 | Y198: 0.10300000000000001 | Z198: 31 | AA198: 278 | AB198: -1.2800000000000001e-002 | AC198: -1.67e-002 | AD198: -4.0300000000000002e-002 | AE198: -4.2199999999999994e-002 | AF198: 90.94 | AG198: 90.99 | AH198: 0.54 | AI198: AAA | AJ198: 4.0099999999999997e-002 | AK198: =I198+100*T198 -> 146.41 | AL198: 144.4 | AM198: 233 | AN198: 53.4 | AO198: 222 | AP198: -2.7999999999999997e-002 | AQ198: 19 | AR198: 烽火转债
A199: 26 | B199: 国投转债 | C199: 110073 | D199: 44063. | E199: 国投资本 | F199: 600061 | G199: 金融 | H199: 证券行业 | I199: 119.07 | J199: 1.03e-002 | K199: 1.34e-002 | L199: 15.3 | M199: 3.73e-002 | N199: 747 | O199: 7.8e-002 | P199: 110.5 | Q199: 15.25 | R199: 1.59 | S199: 100.33 | T199: 0.187 | U199: 3月28天 | V199: 5.80年 | W199: 无权 | X199: 0.124 | Y199: 0.124 | Z199: 80 | AA199: 647 | AB199: -1.29e-002 | AC199: -1.6200000000000003e-002 | AD199: 无权 | AE199: 无权 | AF199: 无权 | AG199: 88.22 | AH199: 0.64 | AI199: AAA | AJ199: 4.0099999999999997e-002 | AK199: =I199+100*T199 -> 137.76999999999998 | AL199: 137.8 | AM199: 180 | AN199: 49.6 | AO199: 201 | AP199: 2.5000000000000001e-002 | AQ199: 20 | AR199: 国投转债
A200: 122 | B200: 奥瑞转债! | C200: 128096 | D200: 43906. | E200: 奥瑞金 | F200: 2701 | G200: 造纸包装 | H200: 包装材料 | I200: 124.31 | J200: 1.8100000000000002e-002 | K200: -1.5300000000000001e-002 | L200: 5.44 | M200: 3.7000000000000002e-003 | N200: 31 | O200: 2.3e-002 | P200: 116 | Q200: 4.64 | R200: 2.21 | S200: 117.24 | T200: 5.9999999999999998e-002 | U200: 转股中 | V200: 5.35年 | W200: 3.35年 | X200: 8.4000000000000005e-002 | Y200: 9.9000000000000005e-002 | Z200: 11 | AA200: 128 | AB200: -1.3100000000000001e-002 | AC200: -1.83e-002 | AD200: -4.9200000000000001e-002 | AE200: -5.1299999999999998e-002 | AF200: 90.12 | AG200: 93.05 | AH200: 0.76 | AI200: AA+ | AJ200: 4.3099999999999999e-002 | AK200: =I200+100*T200 -> 130.31 | AL200: 131.4 | AM200: 126 | AN200: 38.3 | AO200: 118 | AP200: -3.7999999999999999e-002 | AQ200: 22 | AR200: 奥瑞转债!
A201: 153 | B201: 利德转债! | C201: 123035 | D201: 43808. | E201: 利亚德 | F201: 300296 | G201: 电子 | H201: LED制 | I201: 123.511 | J201: -2.3e-003 | K201: -1.e-002 | L201: 7.69 | M201: -1.7899999999999999e-002 | N201: 20 | O201: 2.e-002 | P201: 115.6 | Q201: 6.98 | R201: 2.3 | S201: 110.17 | T201: 0.121 | U201: 转股中 | V201: 5年39天 | W201: 3年39天 | X201: 4.0999999999999995e-002 | Y201: 4.4999999999999998e-002 | Z201: 8 | AA201: 196 | AB201: -1.32e-002 | AC201: -1.8500000000000003e-002 | AD201: -5.1500000000000004e-002 | AE201: -5.3699999999999998e-002 | AF201: 90.85 | AG201: 93.67 | AH201: 0.69 | AI201: AA+ | AJ201: 4.3099999999999999e-002 | AK201: =I201+100*T201 -> 135.61099999999999 | AL201: 136.9 | AM201: 174 | AN201: 43.2 | AO201: 159 | AP201: -7.2999999999999995e-002 | AQ201: 16 | AR201: 利德转债!
A202: 15 | B202: 赣锋转2 | C202: 128126 | D202: 44082. | E202: 赣锋锂业 | F202: 2460 | G202: 有色金属 | H202: 小金属 | I202: 120.3 | J202: 1.01e-002 | K202: -1.54e-002 | L202: 54.19 | M202: -9.8999999999999991e-003 | N202: 41 | O202: 1.6e-002 | P202: 111.1 | Q202: 61.15 | R202: 8.71 | S202: 88.62 | T202: 0.35799999999999998 | U202: 4月9天 | V202: 5.83年 | W202: 3.83年 | X202: 2.8999999999999998e-002 | Y202: 2.6000000000000002e-002 | Z202: 21 | AA202: 722 | AB202: -1.37e-002 | AC202: -1.7100000000000001e-002 | AD202: -3.8699999999999998e-002 | AE202: -4.0000000000000001e-002 | AF202: 86.32 | AG202: 86.23 | AH202: 0.54 | AI202: AA | AJ202: 4.5100000000000001e-002 | AK202: =I202+100*T202 -> 156.09999999999999 | AL202: 152 | AM202: 260 | AN202: 65.7 | AO202: 265 | AP202: 5.0999999999999997e-002 | AQ202: 6 | AR202: 赣锋转2
A203: 68 | B203: 楚江转债 | C203: 128109 | D203: 44005. | E203: 楚江新材 | F203: 2171 | G203: 有色金属 | H203: 铜金属 | I203: 124.8 | J203: 2.0999999999999999e-003 | K203: -2.0999999999999999e-003 | L203: 9.89 | M203: 0. | N203: 13 | O203: 6.0000000000000001e-003 | P203: 115.3 | Q203: 8.73 | R203: 2.46 | S203: 113.29 | T203: 0.10199999999999999 | U203: 2月5天 | V203: 5.66年 | W203: 3.66年 | X203: 0.13900000000000001 | Y203: 0.157 | Z203: 18 | AA203: 132 | AB203: -1.41e-002 | AC203: -1.8799999999999997e-002 | AD203: -4.7400000000000005e-002 | AE203: -4.9200000000000001e-002 | AF203: 87.82 | AG203: 90.26 | AH203: 0.74 | AI203: AA | AJ203: 4.5100000000000001e-002 | AK203: =I203+100*T203 -> 135. | AL203: 136.3 | AM203: 171 | AN203: 46.1 | AO203: 180 | AP203: 3.7999999999999999e-002 | AQ203: 5 | AR203: 楚江转债
A204: 144 | B204: 金牌转债! | C204: 113553 | D204: 43837. | E204: 金牌厨柜 | F204: 603180 | G204: 其他 | H204: 家居用品 | I204: 134.12 | J204: 2.7300000000000001e-002 | K204: -5.8999999999999999e-003 | L204: 56 | M204: 2.5499999999999998e-002 | N204: 53 | O204: 0.13900000000000001 | P204: 124.6 | Q204: 44.14 | R204: 4.57 | S204: 126.87 | T204: 5.7000000000000002e-002 | U204: 转股中 | V204: 5.19年 | W204: 3.19年 | X204: 5.0999999999999997e-002 | Y204: 6.5000000000000002e-002 | Z204: 2.8 | AA204: 54 | AB204: -1.44e-002 | AC204: -2.2099999999999998e-002 | AD204: -7.3599999999999999e-002 | AE204: -7.5600000000000001e-002 | AF204: 84.22 | AG204: 90.08 | AH204: 0.84 | AI204: AA- | AJ204: 6.6100000000000006e-002 | AK204: =I204+100*T204 -> 139.81999999999999 | AL204: 141.4 | AM204: 206 | AN204: 51.3 | AO204: 207 | AP204: -3.7000000000000005e-002 | AQ204: 14 | AR204: 金牌转债!
A205: 133 | B205: 联得转债! | C205: 123038 | D205: 43852. | E205: 联得装备 | F205: 300545 | G205: 机械装备 | H205: 专用设备 | I205: 128.342 | J205: 5.7999999999999996e-003 | K205: -2.2000000000000001e-003 | L205: 31.01 | M205: 4.1999999999999997e-003 | N205: 2.4 | O205: 1.2e-002 | P205: 119.1 | Q205: 25.29 | R205: 6.36 | S205: 122.62 | T205: 4.7e-002 | U205: 转股中 | V205: 5.22年 | W205: 3.22年 | X205: 3.3000000000000002e-002 | Y205: 4.0000000000000001e-002 | Z205: 1.5 | AA205: 45 | AB205: -1.4499999999999999e-002 | AC205: -2.07e-002 | AD205: -5.9999999999999998e-002 | AE205: -6.2199999999999998e-002 | AF205: 81.44 | AG205: 81.61 | AH205: 0.86 | AI205: A+ | AJ205: 7.7100000000000002e-002 | AK205: =I205+100*T205 -> 133.042 | AL205: 134.1 | AM205: 155 | AN205: 52.5 | AO205: 213 | AP205: -5.5e-002 | AQ205: 14 | AR205: 联得转债!
A206: 30 | B206: 苏试转债 | C206: 123060 | D206: 44060. | E206: 苏试试验 | F206: 300416 | G206: 机械装备 | H206: 专用设备 | I206: 128.18 | J206: 1.1000000000000001e-003 | K206: 8.6e-003 | L206: 25.72 | M206: 1.26e-002 | N206: 9.1 | O206: 2.3e-002 | P206: 117.6 | Q206: 23.86 | R206: 5.92 | S206: 107.8 | T206: 0.18899999999999997 | U206: 3月23天 | V206: 5.79年 | W206: 3.79年 | X206: 5.9000000000000004e-002 | Y206: 6.4000000000000001e-002 | Z206: 3.1 | AA206: 52 | AB206: -1.4999999999999999e-002 | AC206: -2.0199999999999999e-002 | AD206: -5.21e-002 | AE206: -5.3800000000000001e-002 | AF206: 80.89 | AG206: 81.79 | AH206: 0.77 | AI206: AA- | AJ206: 6.6100000000000006e-002 | AK206: =I206+100*T206 -> 147.08000000000001 | AL206: 148.6 | AM206: 247 | AN206: 66.8 | AO206: 267 | AP206: -3.7000000000000005e-002 | AQ206: 4 | AR206: 苏试转债
A207: 138 | B207: 至纯转债! | C207: 113556 | D207: 43839. | E207: 至纯科技 | F207: 603690 | G207: 机械装备 | H207: 专用设备 | I207: 137.51 | J207: -1.8500000000000003e-002 | K207: 1.6200000000000003e-002 | L207: 36.24 | M207: -2.8000000000000004e-003 | N207: 42 | O207: 0.10199999999999999 | P207: 126.8 | Q207: 29.37 | R207: 6.64 | S207: 123.39 | T207: 0.114 | U207: 转股中 | V207: 5.21年 | W207: 3.21年 | X207: 3.1e-002 | Y207: 3.9e-002 | Z207: 3 | AA207: 94 | AB207: -1.5800000000000002e-002 | AC207: -2.4e-002 | AD207: -7.85e-002 | AE207: -8.0799999999999997e-002 | AF207: 81.8 | AG207: 86.97 | AH207: 0.85 | AI207: A+ | AJ207: 7.7100000000000002e-002 | AK207: =I207+100*T207 -> 148.91 | AL207: 151.6 | AM207: 258 | AN207: 64.7 | AO207: 262 | AP207: -4.2000000000000003e-002 | AQ207: 13 | AR207: 至纯转债!
A208: 154 | B208: 川投转债 | C208: 110061 | D208: 43801. | E208: 川投能源 | F208: 600674 | G208: 能源电力 | H208: 水电 | I208: 121.03 | J208: -4.6999999999999993e-003 | K208: 1.4000000000000002e-003 | L208: 9.81 | M208: -5.1000000000000004e-003 | N208: 16 | O208: 3.0000000000000001e-003 | P208: 111 | Q208: 9.58 | R208: 1.65 | S208: 102.4 | T208: 0.182 | U208: 转股中 | V208: 5年36天 | W208: 3年36天 | X208: 9.3000000000000013e-002 | Y208: 9.5000000000000001e-002 | Z208: 40 | AA208: 432 | AB208: -1.7100000000000001e-002 | AC208: -2.1000000000000001e-002 | AD208: -4.7199999999999999e-002 | AE208: -4.9100000000000005e-002 | AF208: 91.14 | AG208: 91.19 | AH208: 0.65 | AI208: AAA | AJ208: 4.0099999999999997e-002 | AK208: =I208+100*T208 -> 139.22999999999999 | AL208: 139.7 | AM208: 194 | AN208: 48.5 | AO208: 200 | AP208: -1.8000000000000002e-002 | AQ208: 15 | AR208: 川投转债
A209: 52 | B209: 雪榕转债 | C209: 123056 | D209: 44036. | E209: 雪榕生物 | F209: 300511 | G209: 农业 | H209: 种植业 | I209: 133.49 | J209: 3.7000000000000002e-003 | K209: -1.6299999999999999e-002 | L209: 16.13 | M209: -1.41e-002 | N209: 27 | O209: 3.5000000000000003e-002 | P209: 121.1 | Q209: 11.89 | R209: 3.85 | S209: 135.66 | T209: -1.6e-002 | U209: 3月0天 | V209: 5.72年 | W209: 3.72年 | X209: 8.199999999999999e-002 | Y209: 0.111 | Z209: 5.9 | AA209: 71 | AB209: -1.72e-002 | AC209: -2.3300000000000001e-002 | AD209: -6.2800000000000009e-002 | AE209: -6.4600000000000005e-002 | AF209: 81.34 | AG209: 84.63 | AH209: 0.9 | AI209: AA- | AJ209: 6.6100000000000006e-002 | AK209: =I209+100*T209 -> 131.89000000000001 | AL209: 131.3 | AM209: 125 | AN209: 46.7 | AO209: 186 | AP209: -4.0000000000000001e-003 | AQ209: 9 | AR209: 雪榕转债
A210: 70 | B210: 万青转债 | C210: 127017 | D210: 44014. | E210: 万年青 | F210: 789 | G210: 建筑 | H210: 水泥 | I210: 130.6 | J210: 3.5699999999999996e-002 | K210: -3.6499999999999998e-002 | L210: 15.22 | M210: -1.2999999999999999e-003 | N210: 38 | O210: 2.9999999999999999e-002 | P210: 118.4 | Q210: 14.16 | R210: 2.33 | S210: 107.49 | T210: 0.215 | U210: 2月4天 | V210: 5.66年 | W210: 3.66年 | X210: 8.199999999999999e-002 | Y210: 8.900000000000001e-002 | Z210: 10 | AA210: 121 | AB210: -1.7500000000000002e-002 | AC210: -2.3e-002 | AD210: -5.8899999999999994e-002 | AE210: -6.0599999999999994e-002 | AF210: 88.41 | AG210: 93.67 | AH210: 0.65 | AI210: AA+ | AJ210: 4.3099999999999999e-002 | AK210: =I210+100*T210 -> 152.09999999999999 | AL210: 153.7 | AM210: 264 | AN210: 60 | AO210: 254 | AP210: -5.9000000000000004e-002 | AQ210: 7 | AR210: 万青转债
A211: 208 | B211: 伊力转债! | C211: 110055 | D211: 43559. | E211: 伊力特 | F211: 600197 | G211: 食品饮料 | H211: 白酒 | I211: 124.5 | J211: 2.53e-002 | K211: -2.3e-003 | L211: 18.4 | M211: 3.3700000000000001e-002 | N211: 10 | O211: 9.0000000000000011e-003 | P211: 115 | Q211: 16.81 | R211: 3.06 | S211: 109.46 | T211: 0.13699999999999998 | U211: 转股中 | V211: 4.44年 | W211: 2.44年 | X211: 0.109 | Y211: 0.11900000000000001 | Z211: 8.7 | AA211: 80 | AB211: -1.8100000000000002e-002 | AC211: -2.3900000000000001e-002 | AD211: -6.9099999999999995e-002 | AE211: -7.1399999999999991e-002 | AF211: 92.75 | AG211: 95.58 | AH211: 0.68 | AI211: AA | AJ211: 4.3499999999999997e-002 | AK211: =I211+100*T211 -> 138.19999999999999 | AL211: 139.5 | AM211: 193 | AN211: 44 | AO211: 166 | AP211: -5.7000000000000002e-002 | AQ211: 25 | AR211: 伊力转债!
A212: 280 | B212: 济川转债! | C212: 110038 | D212: 43068. | E212: 济川药业 | F212: 600566 | G212: 医药 | H212: 中药 | I212: 112.5 | J212: 3.0000000000000001e-003 | K212: 1.8e-003 | L212: 22.15 | M212: 1.3300000000000001e-002 | N212: 0.9 | O212: 1.e-003 | P212: 108.3 | Q212: 24.27 | R212: 3.17 | S212: 91.26 | T212: 0.23300000000000001 | U212: 转股中 | V212: 2年38天 | W212: 38天 | X212: 3.5000000000000003e-002 | Y212: 3.2000000000000001e-002 | Z212: 6.3 | AA212: 181 | AB212: -1.8200000000000001e-002 | AC212: -2.5399999999999999e-002 | AD212: -0.40799999999999997 | AE212: -0.41499999999999998 | AF212: 99.93 | AG212: 99.38 | AH212: 0.36 | AI212: AA | AJ212: 4.2300000000000004e-002 | AK212: =I212+100*T212 -> 135.80000000000001 | AL212: 133.7 | AM212: 151 | AN212: 33.8 | AO212: 63 | AP212: -5.0000000000000003e-002 | AQ212: 19 | AR212: 济川转债!
A213: 113 | B213: 康弘转债 | C213: 128098 | D213: 43921. | E213: 康弘药业 | F213: 2773 | G213: 医药 | H213: 化学制药 | I213: 128.478 | J213: 6.0999999999999995e-003 | K213: 2.0000000000000001e-004 | L213: 45.58 | M213: 7.4999999999999997e-003 | N213: 65 | O213: 3.3000000000000002e-002 | P213: 116.3 | Q213: 35.3 | R213: 8.45 | S213: 129.12 | T213: -5.0000000000000001e-003 | U213: 转股中 | V213: 5.41年 | W213: 3.41年 | X213: 3.7999999999999999e-002 | Y213: 4.9000000000000002e-002 | Z213: 15 | AA213: 399 | AB213: -1.8600000000000002e-002 | AC213: -2.3700000000000002e-002 | AD213: -5.8400000000000001e-002 | AE213: -6.0199999999999997e-002 | AF213: 88.79 | AG213: 92.05 | AH213: 0.84 | AI213: AA | AJ213: 4.5100000000000001e-002 | AK213: =I213+100*T213 -> 127.97800000000001 | AL213: 127.8 | AM213: 91 | AN213: 35.8 | AO213: 81 | AP213: -3.7000000000000005e-002 | AQ213: 23 | AR213: 康弘转债
A214: 56 | B214: 正邦转债 | C214: 128114 | D214: 44027. | E214: 正邦科技 | F214: 2157 | G214: 农业 | H214: 畜牧业 | I214: 128.39 | J214: 3.4999999999999996e-003 | K214: -1.1000000000000001e-002 | L214: 18.18 | M214: -1.03e-002 | N214: 23 | O214: 1.1000000000000001e-002 | P214: 115.3 | Q214: 16.08 | R214: 3.86 | S214: 113.06 | T214: 0.13600000000000001 | U214: 2月18天 | V214: 5.70年 | W214: 3.70年 | X214: 3.5000000000000003e-002 | Y214: 3.9e-002 | Z214: 16 | AA214: 458 | AB214: -1.9e-002 | AC214: -2.3700000000000002e-002 | AD214: -5.4000000000000006e-002 | AE214: -5.57e-002 | AF214: 88.33 | AG214: 91.09 | AH214: 0.73 | AI214: AA+ | AJ214: 4.3099999999999999e-002 | AK214: =I214+100*T214 -> 141.98999999999998 | AL214: 143.7 | AM214: 226 | AN214: 52.6 | AO214: 215 | AP214: -8.6999999999999994e-002 | AQ214: 8 | AR214: 正邦转债
A215: 58 | B215: 泛微转债 | C215: 113587 | D215: 44026. | E215: 泛微网络 | F215: 603039 | G215: 计算机及 | H215: 软件开发 | I215: 139 | J215: -2.2000000000000001e-003 | K215: 9.3999999999999986e-003 | L215: 89.48 | M215: 8.199999999999999e-003 | N215: 14 | O215: 2.9999999999999999e-002 | P215: 124.3 | Q215: 64.33 | R215: 20.31 | S215: 139.1 | T215: -1.e-003 | U215: 2月16天 | V215: 5.69年 | W215: 3.69年 | X215: 1.7000000000000001e-002 | Y215: 2.3e-002 | Z215: 3.2 | AA215: 190 | AB215: -1.9799999999999998e-002 | AC215: -2.6699999999999998e-002 | AD215: -7.2700000000000001e-002 | AE215: -7.4499999999999997e-002 | AF215: 81.66 | AG215: 87.04 | AH215: 0.89 | AI215: AA- | AJ215: 6.6100000000000006e-002 | AK215: =I215+100*T215 -> 138.90000000000001 | AL215: 138.9 | AM215: 191 | AN215: 51.9 | AO215: 212 | AP215: -5.9999999999999998e-002 | AQ215: 4 | AR215: 泛微转债
A216: 277 | B216: 众信转债! | C216: 128022 | D216: 43097. | E216: 众信旅游 | F216: 2707 | G216: 旅游餐饮 | H216: 旅游 | I216: 117 | J216: -8.5900000000000004e-002 | K216: 1.1699999999999999e-002 | L216: 9.09 | M216: -0.10000000000000001 | N216: 238 | O216: 0.439 | P216: 109.8 | Q216: 7.91 | R216: 4.02 | S216: 114.92 | T216: 1.8000000000000002e-002 | U216: 转股中 | V216: 3年56天 | W216: 1年56天 | X216: 5.5e-002 | Y216: 6.3e-002 | Z216: 4.6 | AA216: 83 | AB216: -2.0299999999999999e-002 | AC216: -2.5899999999999999e-002 | AD216: -9.5899999999999999e-002 | AE216: -9.9199999999999997e-002 | AF216: 97 | AG216: 96.28 | AH216: 0.74 | AI216: AA | AJ216: 4.3499999999999997e-002 | AK216: =I216+100*T216 -> 118.8 | AL216: 119.1 | AM216: 26 | AN216: 22.1 | AO216: 11 | AP216: -3.3000000000000002e-002 | AQ216: 24 | AR216: 众信转债!
A217: 63 | B217: 寿仙转债 | C217: 113585 | D217: 44019. | E217: 寿仙谷 | F217: 603896 | G217: 医药 | H217: 中药 | I217: 132.1 | J217: 2.e-003 | K217: -1.2800000000000001e-002 | L217: 41.2 | M217: -1.18e-002 | N217: 18 | O217: 3.7000000000000005e-002 | P217: 117.8 | Q217: 28.68 | R217: 5.05 | S217: 143.65 | T217: -8.0000000000000002e-002 | U217: 2月10天 | V217: 5.67年 | W217: 3.67年 | X217: 6.0999999999999999e-002 | Y217: 8.6999999999999994e-002 | Z217: 3.6 | AA217: 59 | AB217: -2.0400000000000001e-002 | AC217: -2.5699999999999997e-002 | AD217: -6.0700000000000004e-002 | AE217: -6.25e-002 | AF217: 81.68 | AG217: 82.58 | AH217: 0.92 | AI217: AA- | AJ217: 6.6100000000000006e-002 | AK217: =I217+100*T217 -> 124.09999999999999 | AL217: 120.5 | AM217: 34 | AN217: 38 | AO217: 111 | AP217: 2.8999999999999998e-002 | AQ217: 9 | AR217: 寿仙转债
A218: 163 | B218: 太极转债! | C218: 128078 | D218: 43777. | E218: 太极股份 | F218: 2368 | G218: 计算机及 | H218: 软件开发 | I218: 130 | J218: 4.5000000000000005e-003 | K218: 5.7999999999999996e-003 | L218: 28.34 | M218: 1.03e-002 | N218: 6.7 | O218: 5.0000000000000001e-003 | P218: 117.3 | Q218: 22.4 | R218: 3.8 | S218: 126.52 | T218: 2.7999999999999997e-002 | U218: 转股中 | V218: 5年15天 | W218: 3年15天 | X218: 5.7999999999999996e-002 | Y218: 7.400000000000001e-002 | Z218: 9.6 | AA218: 164 | AB218: -2.06e-002 | AC218: -2.64e-002 | AD218: -6.8499999999999991e-002 | AE218: -7.0499999999999993e-002 | AF218: 90.26 | AG218: 94.36 | AH218: 1 | AI218: AA | AJ218: 4.5100000000000001e-002 | AK218: =I218+100*T218 -> 132.80000000000001 | AL218: 133.5 | AM218: 147 | AN218: 39.1 | AO218: 126 | AP218: -1.2e-002 | AQ218: 12 | AR218: 太极转债!
A219: 107 | B219: 华安转债! | C219: 110067 | D219: 43930. | E219: 华安证券 | F219: 600909 | G219: 金融 | H219: 证券行业 | I219: 123.65 | J219: 5.3e-003 | K219: -1.5900000000000001e-002 | L219: 8.77 | M219: -1.6799999999999999e-002 | N219: 37 | O219: 1.1000000000000001e-002 | P219: 110.5 | Q219: 8.67 | R219: 2.34 | S219: 101.15 | T219: 0.222 | U219: 转股中 | V219: 5.43年 | W219: 无权 | X219: 8.8000000000000009e-002 | Y219: 8.900000000000001e-002 | Z219: 28 | AA219: 318 | AB219: -2.07e-002 | AC219: -2.4199999999999999e-002 | AD219: 无权 | AE219: 无权 | AF219: 无权 | AG219: 89.5 | AH219: 0.63 | AI219: AAA | AJ219: 4.0099999999999997e-002 | AK219: =I219+100*T219 -> 145.84999999999999 | AL219: 146.1 | AM219: 240 | AN219: 56.6 | AO219: 244 | AP219: 2.5000000000000001e-002 | AQ219: 26 | AR219: 华安转债!
A220: 174 | B220: 合兴转债! | C220: 128071 | D220: 43724. | E220: 合兴包装 | F220: 2228 | G220: 造纸包装 | H220: 包装材料 | I220: 127 | J220: 4.3499999999999997e-002 | K220: -2.86e-002 | L220: 5 | M220: 2.0400000000000001e-002 | N220: 13 | O220: 3.4000000000000002e-002 | P220: 114.8 | Q220: 4.28 | R220: 1.97 | S220: 116.82 | T220: 8.6999999999999994e-002 | U220: 转股中 | V220: 4.86年 | W220: 2.86年 | X220: 5.0999999999999997e-002 | Y220: 5.9999999999999998e-002 | Z220: 3 | AA220: 58 | AB220: -2.0899999999999998e-002 | AC220: -2.6200000000000001e-002 | AD220: -6.6400000000000001e-002 | AE220: -6.83e-002 | AF220: 90.9 | AG220: 93.69 | AH220: 0.73 | AI220: AA | AJ220: 4.3499999999999997e-002 | AK220: =I220+100*T220 -> 135.69999999999999 | AL220: 137.2 | AM220: 175 | AN220: 43.5 | AO220: 162 | AP220: -0.10099999999999999 | AQ220: 26 | AR220: 合兴转债!
A221: 237 | B221: 利尔转债! | C221: 128046 | D221: 43413. | E221: 利尔化学 | F221: 2258 | G221: 化工 | H221: 农化 | I221: 122.8 | J221: -4.1999999999999997e-003 | K221: -8.0000000000000002e-003 | L221: 19.38 | M221: -1.9199999999999998e-002 | N221: 7.9 | O221: 6.9999999999999993e-003 | P221: 112.9 | Q221: 18.62 | R221: 2.98 | S221: 104.08 | T221: 0.17999999999999999 | U221: 转股中 | V221: 4年11天 | W221: 2年11天 | X221: 8.4000000000000005e-002 | Y221: 8.6999999999999994e-002 | Z221: 8.5 | AA221: 102 | AB221: -2.1099999999999997e-002 | AC221: -2.6699999999999998e-002 | AD221: -7.6100000000000001e-002 | AE221: -7.8700000000000006e-002 | AF221: 94.27 | AG221: 95.47 | AH221: 0.64 | AI221: AA | AJ221: 4.3499999999999997e-002 | AK221: =I221+100*T221 -> 140.80000000000001 | AL221: 141.5 | AM221: 208 | AN221: 46 | AO221: 179 | AP221: -0.10199999999999999 | AQ221: 10 | AR221: 利尔转债!
A222: 190 | B222: 雅化转债! | C222: 128065 | D222: 43595. | E222: 雅化集团 | F222: 2497 | G222: 化工 | H222: 化工 | I222: 122.25 | J222: 4.0000000000000002e-004 | K222: -2.35e-002 | L222: 9.47 | M222: -3.3700000000000001e-002 | N222: 11 | O222: 1.2e-002 | P222: 110.9 | Q222: 8.95 | R222: 3.2 | S222: 105.81 | T222: 0.155 | U222: 转股中 | V222: 4.53年 | W222: 2.53年 | X222: 8.8000000000000009e-002 | Y222: 9.3000000000000013e-002 | Z222: 8 | AA222: 91 | AB222: -2.1700000000000001e-002 | AC222: -2.6000000000000002e-002 | AD222: -6.08e-002 | AE222: -6.3e-002 | AF222: 92.3 | AG222: 91.83 | AH222: 0.69 | AI222: AA | AJ222: 4.3499999999999997e-002 | AK222: =I222+100*T222 -> 137.75 | AL222: 138.7 | AM222: 187 | AN222: 46.4 | AO222: 183 | AP222: -1.e-003 | AQ222: 22 | AR222: 雅化转债!
A223: 76 | B223: 健友转债 | C223: 113579 | D223: 43973. | E223: 健友股份 | F223: 603707 | G223: 医药 | H223: 原料药 | I223: 128.9 | J223: 7.4000000000000003e-003 | K223: 9.7999999999999997e-003 | L223: 44.81 | M223: 2.4700000000000003e-002 | N223: 3.4 | O223: 5.0000000000000001e-003 | P223: 114.2 | Q223: 42.05 | R223: 9.98 | S223: 106.56 | T223: 0.20999999999999999 | U223: 24天 | V223: 5.55年 | W223: 3.55年 | X223: 1.2e-002 | Y223: 1.3000000000000001e-002 | Z223: 5 | AA223: 419 | AB223: -2.2000000000000002e-002 | AC223: -2.64e-002 | AD223: -5.74e-002 | AE223: -5.91e-002 | AF223: 88.17 | AG223: 89.84 | AH223: 0.7 | AI223: AA | AJ223: 4.5100000000000001e-002 | AK223: =I223+100*T223 -> 149.90000000000001 | AL223: 151.2 | AM223: 257 | AN223: 61.4 | AO223: 259 | AP223: 6.9999999999999993e-003 | AQ223: 7 | AR223: 健友转债
A224: 106 | B224: 红相转债 | C224: 123044 | D224: 43934. | E224: 红相股份 | F224: 300427 | G224: 能源电力 | H224: 电力设备 | I224: 141.725 | J224: -1.2e-002 | K224: 2.8000000000000004e-003 | L224: 26.55 | M224: -1.04e-002 | N224: 109 | O224: 0.13100000000000001 | P224: 125.5 | Q224: 18.8 | R224: 4.32 | S224: 141.22 | T224: 4.0000000000000001e-003 | U224: 转股中 | V224: 5.43年 | W224: 3.43年 | X224: 6.0999999999999999e-002 | Y224: 8.5999999999999993e-002 | Z224: 5.8 | AA224: 95 | AB224: -2.2700000000000001e-002 | AC224: -3.0099999999999998e-002 | AD224: -8.09e-002 | AE224: -8.3199999999999996e-002 | AF224: 83.68 | AG224: 89.46 | AH224: 0.88 | AI224: AA- | AJ224: 6.6100000000000006e-002 | AK224: =I224+100*T224 -> 142.125 | AL224: 142.2 | AM224: 214 | AN224: 52.8 | AO224: 216 | AP224: -2.e-002 | AQ224: 15 | AR224: 红相转债
A225: 81 | B225: 春秋转债 | C225: 113577 | D225: 43964. | E225: 春秋电子 | F225: 603890 | G225: 电子 | H225: 电子产品 | I225: 133.99 | J225: -1.1000000000000001e-003 | K225: -5.7999999999999996e-003 | L225: 15.16 | M225: -7.9000000000000008e-003 | N225: 13 | O225: 3.9e-002 | P225: 118.2 | Q225: 11.06 | R225: 3.59 | S225: 137.07 | T225: -2.2000000000000002e-002 | U225: 14天 | V225: 5.52年 | W225: 3.52年 | X225: 4.0999999999999995e-002 | Y225: 5.5999999999999994e-002 | Z225: 2.4 | AA225: 58 | AB225: -2.29e-002 | AC225: -2.8399999999999998e-002 | AD225: -6.6799999999999998e-002 | AE225: -6.8699999999999997e-002 | AF225: 82.46 | AG225: 83.68 | AH225: 0.88 | AI225: AA- | AJ225: 6.6100000000000006e-002 | AK225: =I225+100*T225 -> 131.79000000000002 | AL225: 130.9 | AM225: 121 | AN225: 47.2 | AO225: 193 | AP225: 1.2e-002 | AQ225: 8 | AR225: 春秋转债
A226: 299 | B226: 航信转债!! | C226: 110031 | D226: 42185. | E226: 航天信息 | F226: 600271 | G226: 计算机及 | H226: 软件开发 | I226: 108.72 | J226: 2.e-003 | K226: -2.0999999999999999e-003 | L226: 15.77 | M226: -7.6e-003 | N226: 2.5 | O226: 1.e-003 | P226: 107 | Q226: 21.56 | R226: 2.63 | S226: 73.14 | T226: 0.48599999999999999 | U226: 转股中 | V226: 0.68年 | W226: 回售中 | X226: 8.199999999999999e-002 | Y226: 5.9999999999999998e-002 | Z226: 24 | AA226: 293 | AB226: -2.3099999999999999e-002 | AC226: -4.1799999999999997e-002 | AD226: 回售中 | AE226: 回售中 | AF226: 100.27 | AG226: 104.55 | AH226: 0 | AI226: AAA | AJ226: 3.4500000000000003e-002 | AK226: =I226+100*T226 -> 157.31999999999999 | AL226: 144.3 | AM226: 232 | AN226: 39.7 | AO226: 130 | AP226: -5.0999999999999997e-002 | AQ226: 14 | AR226: 航信转债!!
A227: 89 | B227: 长集转债 | C227: 128105 | D227: 43964. | E227: 长青集团 | F227: 2616 | G227: 城市公用 | H227: 三废处理 | I227: 131.03 | J227: 3.9000000000000003e-003 | K227: -7.000000000000001e-004 | L227: 10.4 | M227: 3.9000000000000003e-003 | N227: 9.1 | O227: 9.0000000000000011e-003 | P227: 115.3 | Q227: 8.11 | R227: 3.21 | S227: 128.24 | T227: 2.2000000000000002e-002 | U227: 9天 | V227: 5.51年 | W227: 3.51年 | X227: 0.10400000000000001 | Y227: 0.13300000000000001 | Z227: 8 | AA227: 77 | AB227: -2.3399999999999997e-002 | AC227: -2.81e-002 | AD227: -6.2e-002 | AE227: -6.3799999999999996e-002 | AF227: 88.42 | AG227: 90.87 | AH227: 0.83 | AI227: AA | AJ227: 4.5100000000000001e-002 | AK227: =I227+100*T227 -> 133.22999999999999 | AL227: 133.8 | AM227: 152 | AN227: 43 | AO227: 155 | AP227: -3.5000000000000003e-002 | AQ227: 5 | AR227: 长集转债
A228: 157 | B228: 石英转债! | C228: 113548 | D228: 43791. | E228: 石英股份 | F228: 603688 | G228: 电子 | H228: 电子产品 | I228: 140.57 | J228: 1.01e-002 | K228: -2.53e-002 | L228: 20.78 | M228: -1.7500000000000002e-002 | N228: 15 | O228: 8.5999999999999993e-002 | P228: 124.8 | Q228: 15.1 | R228: 4.25 | S228: 137.62 | T228: 2.1000000000000001e-002 | U228: 转股中 | V228: 5年22天 | W228: 3年22天 | X228: 1.7000000000000001e-002 | Y228: 2.3e-002 | Z228: 1.2 | AA228: 72 | AB228: -2.3799999999999998e-002 | AC228: -3.1600000000000003e-002 | AD228: -8.8200000000000001e-002 | AE228: -9.06e-002 | AF228: 85.42 | AG228: 91.01 | AH228: 0.87 | AI228: AA- | AJ228: 6.6100000000000006e-002 | AK228: =I228+100*T228 -> 142.66999999999999 | AL228: 143.5 | AM228: 225 | AN228: 52.5 | AO228: 214 | AP228: -7.0000000000000007e-002 | AQ228: 10 | AR228: 石英转债!
A229: 168 | B229: 远东转债! | C229: 128075 | D229: 43769. | E229: 远东传动 | F229: 2406 | G229: 汽车 | H229: 零部件制 | I229: 129.5 | J229: 1.1699999999999999e-002 | K229: -3.5999999999999999e-003 | L229: 6.9 | M229: 1.0200000000000001e-002 | N229: 10 | O229: 1.1000000000000001e-002 | P229: 114.9 | Q229: 5.54 | R229: 1.43 | S229: 124.55 | T229: 4.0000000000000001e-002 | U229: 转股中 | V229: 4.96年 | W229: 2.96年 | X229: 0.17800000000000002 | Y229: 0.222 | Z229: 7.3 | AA229: 41 | AB229: -2.4199999999999999e-002 | AC229: -2.9399999999999999e-002 | AD229: -6.9900000000000004e-002 | AE229: -7.1800000000000003e-002 | AF229: 90.6 | AG229: 93.37 | AH229: 0.8 | AI229: AA | AJ229: 4.3499999999999997e-002 | AK229: =I229+100*T229 -> 133.5 | AL229: 134.5 | AM229: 158 | AN229: 41.1 | AO229: 144 | AP229: 4.0000000000000001e-003 | AQ229: 15 | AR229: 远东转债!
A230: 108 | B230: 永高转债 | C230: 128099 | D230: 43931. | E230: 永高股份 | F230: 2641 | G230: 建筑 | H230: 建筑行业 | I230: 129.12 | J230: 5.7999999999999996e-003 | K230: 2.8000000000000004e-003 | L230: 7.61 | M230: 1.06e-002 | N230: 16 | O230: 1.7000000000000001e-002 | P230: 113.2 | Q230: 6.16 | R230: 2.42 | S230: 123.54 | T230: 4.4999999999999998e-002 | U230: 转股中 | V230: 5.43年 | W230: 3.43年 | X230: 8.199999999999999e-002 | Y230: 0.10099999999999999 | Z230: 7 | AA230: 86 | AB230: -2.4399999999999998e-002 | AC230: -2.86e-002 | AD230: -5.9699999999999996e-002 | AE230: -6.1399999999999996e-002 | AF230: 88.63 | AG230: 89.52 | AH230: 0.81 | AI230: AA | AJ230: 4.5100000000000001e-002 | AK230: =I230+100*T230 -> 133.62 | AL230: 134.7 | AM230: 160 | AN230: 45.2 | AO230: 171 | AP230: -6.5000000000000002e-002 | AQ230: 9 | AR230: 永高转债
A231: 151 | B231: 常汽转债! | C231: 113550 | D231: 43811. | E231: 常熟汽饰 | F231: 603035 | G231: 汽车 | H231: 零部件制 | I231: 138.48 | J231: -1.77e-002 | K231: 1.0500000000000001e-002 | L231: 13.22 | M231: -8.3000000000000001e-003 | N231: 55 | O231: 8.5000000000000006e-002 | P231: 121.8 | Q231: 9.65 | R231: 1.37 | S231: 136.99 | T231: 1.1000000000000001e-002 | U231: 转股中 | V231: 5年43天 | W231: 3年43天 | X231: 0.11 | Y231: 0.151 | Z231: 4.6 | AA231: 41 | AB231: -2.53e-002 | AC231: -3.2300000000000002e-002 | AD231: -8.2599999999999993e-002 | AE231: -8.5000000000000006e-002 | AF231: 85.14 | AG231: 88.54 | AH231: 0.88 | AI231: AA- | AJ231: 6.6100000000000006e-002 | AK231: =I231+100*T231 -> 139.57999999999998 | AL231: 140 | AM231: 199 | AN231: 51.4 | AO231: 210 | AP231: -8.9999999999999997e-002 | AQ231: 16 | AR231: 常汽转债!
A232: 96 | B232: 同德转债 | C232: 128103 | D232: 43942. | E232: 同德化工 | F232: 2360 | G232: 化工 | H232: 化工 | I232: 139.99 | J232: -1.41e-002 | K232: 1.8e-003 | L232: 5.9 | M232: -1.4999999999999999e-002 | N232: 302 | O232: 1.48 | P232: 121.8 | Q232: 5.18 | R232: 2 | S232: 113.9 | T232: 0.22899999999999998 | U232: 3.1天 | V232: 5.47年 | W232: 3.47年 | X232: 6.2e-002 | Y232: 7.0999999999999994e-002 | Z232: 1.4 | AA232: 23 | AB232: -2.5699999999999997e-002 | AC232: -3.2199999999999999e-002 | AD232: -7.7499999999999999e-002 | AE232: -7.9699999999999993e-002 | AF232: 80.2 | AG232: 81.95 | AH232: 0.81 | AI232: A+ | AJ232: 7.7100000000000002e-002 | AK232: =I232+100*T232 -> 162.89000000000001 | AL232: 166.1 | AM232: 275 | AN232: 84.1 | AO232: 277 | AP232: -0.114 | AQ232: 10 | AR232: 同德转债
A233: 130 | B233: 新天转债 | C233: 128091 | D233: 43847. | E233: 新天药业 | F233: 2873 | G233: 医药 | H233: 中药 | I233: 137.974 | J233: -9.4999999999999998e-003 | K233: 1.09e-002 | L233: 17.42 | M233: 1.7000000000000001e-003 | N233: 44 | O233: 0.17899999999999999 | P233: 120 | Q233: 16.39 | R233: 2.8 | S233: 106.28 | T233: 0.29799999999999999 | U233: 转股中 | V233: 5.23年 | W233: 3.23年 | X233: 8.5999999999999993e-002 | Y233: 9.1999999999999998e-002 | Z233: 1.8 | AA233: 20 | AB233: -2.7000000000000003e-002 | AC233: -3.3300000000000003e-002 | AD233: -7.8100000000000003e-002 | AE233: -8.0500000000000002e-002 | AF233: 81.98 | AG233: 82.27 | AH233: 0.79 | AI233: A+ | AJ233: 7.7100000000000002e-002 | AK233: =I233+100*T233 -> 167.774 | AL233: 169.7 | AM233: 276 | AN233: 87.4 | AO233: 280 | AP233: -5.0999999999999997e-002 | AQ233: 16 | AR233: 新天转债
A234: 86 | B234: 应急转债 | C234: 123048 | D234: 43962. | E234: 中船应急 | F234: 300527 | G234: 机械装备 | H234: 专用设备 | I234: 131.19 | J234: -6.5099999999999991e-002 | K234: 0.12300000000000001 | L234: 13.53 | M234: 6.3700000000000007e-002 | N234: 4050. | O234: 3.6299999999999999 | P234: 113.1 | Q234: 8.9 | R234: 5.31 | S234: 152.02 | T234: -0.13699999999999998 | U234: 10天 | V234: 5.51年 | W234: 3.51年 | X234: 6.6000000000000003e-002 | Y234: 0.10099999999999999 | Z234: 8.2 | AA234: 124 | AB234: -2.7000000000000003e-002 | AC234: -3.1099999999999999e-002 | AD234: -6.2699999999999992e-002 | AE234: -6.4399999999999999e-002 | AF234: 88.83 | AG234: 90.03 | AH234: 0.91 | AI234: AA+ | AJ234: 4.3099999999999999e-002 | AK234: =I234+100*T234 -> 117.48999999999999 | AL234: 110.4 | AM234: 2 | AN234: 20.3 | AO234: 6 | AP234: 0.24199999999999999 | AQ234: 14 | AR234: 应急转债
A235: 278 | B235: 兄弟转债!! | C235: 128021 | D235: 43096. | E235: 兄弟科技 | F235: 2562 | G235: 医药 | H235: 原料药 | I235: 120 | J235: 7.6e-003 | K235: -2.5999999999999999e-003 | L235: 6.03 | M235: 5.0000000000000001e-003 | N235: 9.7 | O235: 2.9999999999999999e-002 | P235: 109.8 | Q235: 5.25 | R235: 2.53 | S235: 114.86 | T235: 4.4999999999999998e-002 | U235: 转股中 | V235: 3年53天 | W235: 1年53天 | X235: 4.9000000000000002e-002 | Y235: 5.5999999999999994e-002 | Z235: 2.7 | AA235: 54 | AB235: -2.8399999999999998e-002 | AC235: -3.39e-002 | AD235: -0.107 | AE235: -0.11 | AF235: 97.03 | AG235: 96.31 | AH235: 0.99 | AI235: AA | AJ235: 4.3499999999999997e-002 | AK235: =I235+100*T235 -> 124.5 | AL235: 125.1 | AM235: 70 | AN235: 28.1 | AO235: 26 | AP235: -1.4999999999999999e-002 | AQ235: 13 | AR235: 兄弟转债!!
A236: 72 | B236: 蓝帆转债 | C236: 128108 | D236: 44001. | E236: 蓝帆医疗 | F236: 2382 | G236: 医药 | H236: 医疗器械 | I236: 132.991 | J236: 1.1200000000000002e-002 | K236: -3.3e-003 | L236: 24.08 | M236: 9.1999999999999998e-003 | N236: 331 | O236: 7.9000000000000001e-002 | P236: 113.3 | Q236: 17.79 | R236: 2.58 | S236: 135.36 | T236: -1.7000000000000001e-002 | U236: 58天 | V236: 5.64年 | W236: 4.64年 | X236: 0.13500000000000001 | Y236: 0.183 | Z236: 31 | AA236: 232 | AB236: -2.8500000000000001e-002 | AC236: -3.2599999999999997e-002 | AD236: -4.7400000000000005e-002 | AE236: -4.9400000000000006e-002 | AF236: 85.73 | AG236: 88.78 | AH236: 0.86 | AI236: AA | AJ236: 4.5100000000000001e-002 | AK236: =I236+100*T236 -> 131.29100000000003 | AL236: 130.6 | AM236: 118 | AN236: 41.8 | AO236: 148 | AP236: -8.0000000000000002e-003 | AQ236: 18 | AR236: 蓝帆转债
A237: 90 | B237: 东时转债 | C237: 113575 | D237: 43951. | E237: 东方时尚 | F237: 603377 | G237: 其他 | H237: 其他 | I237: 133.15 | J237: -1.23e-002 | K237: -1.11e-002 | L237: 20.98 | M237: -2.6000000000000002e-002 | N237: 41 | O237: 7.0999999999999994e-002 | P237: 113.5 | Q237: 14.56 | R237: 6.8 | S237: 144.09 | T237: -7.5999999999999998e-002 | U237: 9天 | V237: 5.51年 | W237: 3.51年 | X237: 3.5000000000000003e-002 | Y237: 5.0000000000000003e-002 | Z237: 4.3 | AA237: 123 | AB237: -2.9100000000000001e-002 | AC237: -3.3300000000000003e-002 | AD237: -6.6000000000000003e-002 | AE237: -6.7799999999999999e-002 | AF237: 88.44 | AG237: 89.47 | AH237: 0.9 | AI237: AA | AJ237: 4.5100000000000001e-002 | AK237: =I237+100*T237 -> 125.55000000000001 | AL237: 122.2 | AM237: 45 | AN237: 32.7 | AO237: 57 | AP237: -6.6000000000000003e-002 | AQ237: 17 | AR237: 东时转债
A238: 231 | B238: 桐昆转债! | C238: 113020 | D238: 43446. | E238: 桐昆股份 | F238: 601233 | G238: 服装纺织 | H238: 纺织行业 | I238: 127.84 | J238: 3.3e-003 | K238: -1.4499999999999999e-002 | L238: 13.83 | M238: -1.5700000000000002e-002 | N238: 33 | O238: 8.0000000000000002e-003 | P238: 112.8 | Q238: 12.28 | R238: 1.32 | S238: 112.62 | T238: 0.13500000000000001 | U238: 转股中 | V238: 4年44天 | W238: 2年44天 | X238: 0.13500000000000001 | Y238: 0.152 | Z238: 34 | AA238: 256 | AB238: -3.0499999999999999e-002 | AC238: -3.5900000000000001e-002 | AD238: -8.9800000000000005e-002 | AE238: -9.2200000000000004e-002 | AF238: 94.22 | AG238: 95.74 | AH238: 0.71 | AI238: AA+ | AJ238: 4.1500000000000002e-002 | AK238: =I238+100*T238 -> 141.34 | AL238: 143.1 | AM238: 218 | AN238: 47.3 | AO238: 194 | AP238: -8.5000000000000006e-002 | AQ238: 15 | AR238: 桐昆转债!
A239: 230 | B239: 寒锐转债!! | C239: 123017 | D239: 43458. | E239: 寒锐钴业 | F239: 300618 | G239: 有色金属 | H239: 小金属 | I239: 125.848 | J239: 1.e-002 | K239: -1.52e-002 | L239: 61.25 | M239: -6.8000000000000005e-003 | N239: 5.2 | O239: 1.e-002 | P239: 110.8 | Q239: 57.4 | R239: 9.3 | S239: 106.71 | T239: 0.17899999999999999 | U239: 转股中 | V239: 4年45天 | W239: 2年45天 | X239: 2.2000000000000002e-002 | Y239: 2.3e-002 | Z239: 4 | AA239: 186 | AB239: -3.1e-002 | AC239: -3.56e-002 | AD239: -8.3400000000000002e-002 | AE239: -8.5800000000000001e-002 | AF239: 89.66 | AG239: 86.12 | AH239: 0.76 | AI239: AA- | AJ239: 6.4500000000000002e-002 | AK239: =I239+100*T239 -> 143.74799999999999 | AL239: 145 | AM239: 237 | AN239: 55.3 | AO239: 238 | AP239: -8.6999999999999994e-002 | AQ239: 13 | AR239: 寒锐转债!!
A240: 77 | B240: 康隆转债 | C240: 113580 | D240: 43971. | E240: 康隆达 | F240: 603665 | G240: 服装纺织 | H240: 服装行业 | I240: 145.1 | J240: 9.7000000000000003e-003 | K240: -1.6799999999999999e-002 | L240: 24.8 | M240: -7.6e-003 | N240: 89 | O240: 0.30199999999999999 | P240: 121.2 | Q240: 15.51 | R240: 3.98 | S240: 159.9 | T240: -9.3000000000000013e-002 | U240: 23天 | V240: 5.55年 | W240: 3.55年 | X240: 5.4000000000000006e-002 | Y240: 8.6999999999999994e-002 | Z240: 2 | AA240: 37 | AB240: -3.2500000000000001e-002 | AC240: -3.8699999999999998e-002 | AD240: -8.6300000000000002e-002 | AE240: -8.8100000000000012e-002 | AF240: 82.32 | AG240: 85.65 | AH240: 0.93 | AI240: AA- | AJ240: 6.6100000000000006e-002 | AK240: =I240+100*T240 -> 135.79999999999998 | AL240: 130.3 | AM240: 111 | AN240: 44.7 | AO240: 169 | AP240: -2.e-003 | AQ240: 9 | AR240: 康隆转债
A241: 143 | B241: 明阳转债! | C241: 113029 | D241: 43837. | E241: 明阳智能 | F241: 601615 | G241: 能源电力 | H241: 风能 | I241: 134.72 | J241: 5.2499999999999998e-002 | K241: 3.39e-002 | L241: 16.92 | M241: 0.10000000000000001 | N241: 287 | O241: 0.127 | P241: 113.3 | Q241: 12.46 | R241: 3.27 | S241: 135.79 | T241: -8.0000000000000002e-003 | U241: 转股中 | V241: 5.19年 | W241: 3.19年 | X241: 7.0999999999999994e-002 | Y241: 9.6999999999999989e-002 | Z241: 17 | AA241: 237 | AB241: -3.3399999999999999e-002 | AC241: -3.78e-002 | AD241: -7.5399999999999995e-002 | AE241: -7.7300000000000008e-002 | AF241: 89.65 | AG241: 90.54 | AH241: 0.86 | AI241: AA | AJ241: 4.5100000000000001e-002 | AK241: =I241+100*T241 -> 133.91999999999999 | AL241: 133.6 | AM241: 149 | AN241: 43.1 | AO241: 157 | AP241: 0.124 | AQ241: 23 | AR241: 明阳转债!
A242: 104 | B242: 博特转债 | C242: 113571 | D242: 43922. | E242: 苏博特 | F242: 603916 | G242: 建筑 | H242: 水泥 | I242: 145.72 | J242: -2.6800000000000001e-002 | K242: 1.9e-003 | L242: 27.68 | M242: -2.7400000000000001e-002 | N242: 39 | O242: 5.4000000000000006e-002 | P242: 120.8 | Q242: 18.88 | R242: 3.48 | S242: 146.61 | T242: -6.0000000000000001e-003 | U242: 转股中 | V242: 5.43年 | W242: 3.43年 | X242: 5.7999999999999996e-002 | Y242: 8.5000000000000006e-002 | Z242: 5 | AA242: 86 | AB242: -3.4599999999999999e-002 | AC242: -4.0800000000000003e-002 | AD242: -9.01e-002 | AE242: -9.1899999999999996e-002 | AF242: 82.96 | AG242: 86 | AH242: 0.91 | AI242: AA- | AJ242: 6.6100000000000006e-002 | AK242: =I242+100*T242 -> 145.12 | AL242: 144.8 | AM242: 236 | AN242: 58.8 | AO242: 250 | AP242: -0.126 | AQ242: 14 | AR242: 博特转债
A243: 147 | B243: 先导转债 | C243: 123036 | D243: 43840. | E243: 先导智能 | F243: 300450 | G243: 机械装备 | H243: 专用设备 | I243: 138.296 | J243: 1.8500000000000003e-002 | K243: -9.7999999999999997e-003 | L243: 48.39 | M243: 1.0700000000000001e-002 | N243: 26 | O243: 1.9e-002 | P243: 115.1 | Q243: 38.99 | R243: 10.15 | S243: 124.11 | T243: 0.114 | U243: 转股中 | V243: 5.18年 | W243: 3.18年 | X243: 2.3e-002 | Y243: 2.8999999999999998e-002 | Z243: 10 | AA243: 426 | AB243: -3.5400000000000001e-002 | AC243: -4.0300000000000002e-002 | AD243: -8.3400000000000002e-002 | AE243: -8.5199999999999998e-002 | AF243: 89.51 | AG243: 92 | AH243: 0.81 | AI243: AA | AJ243: 4.5100000000000001e-002 | AK243: =I243+100*T243 -> 149.696 | AL243: 152.5 | AM243: 262 | AN243: 60.5 | AO243: 256 | AP243: 7.2000000000000008e-002 | AQ243: 17 | AR243: 先导转债
A244: 245 | B244: 万顺转债 | C244: 123012 | D244: 43341. | E244: 万顺新材 | F244: 300057 | G244: 造纸包装 | H244: 包装材料 | I244: 126.55 | J244: 4.4000000000000003e-003 | K244: -3.0999999999999999e-003 | L244: 5.91 | M244: 1.7000000000000001e-003 | N244: 90 | O244: 0.55200000000000005 | P244: 110.3 | Q244: 5.31 | R244: 1.18 | S244: 111.3 | T244: 0.13699999999999998 | U244: 转股中 | V244: 3.79年 | W244: 1.79年 | X244: 3.2000000000000001e-002 | Y244: 3.6000000000000004e-002 | Z244: 1.3 | AA244: 40 | AB244: -3.6299999999999999e-002 | AC244: -4.0999999999999995e-002 | AD244: -0.10099999999999999 | AE244: -0.10400000000000001 | AF244: 91.07 | AG244: 87.45 | AH244: 0.77 | AI244: AA- | AJ244: 6.4500000000000002e-002 | AK244: =I244+100*T244 -> 140.25 | AL244: 141.8 | AM244: 211 | AN244: 50.7 | AO244: 204 | AP244: -7.9000000000000001e-002 | AQ244: 16 | AR244: 万顺转债
A245: 292 | B245: 光大转债 | C245: 113011 | D245: 42934. | E245: 光大银行 | F245: 601818 | G245: 金融 | H245: 银行行业 | I245: 118.47 | J245: 8.8999999999999999e-003 | K245: -2.0999999999999999e-003 | L245: 3.65 | M245: 1.3899999999999999e-002 | N245: 81 | O245: 2.e-003 | P245: 108.3 | Q245: 3.76 | R245: 0.6 | S245: 97.07 | T245: 0.22 | U245: 转股中 | V245: 2.44年 | W245: 无权 | X245: 0.157 | Y245: 0.152 | Z245: 300 | AA245: 1916. | AB245: -3.6699999999999997e-002 | AC245: -4.2699999999999995e-002 | AD245: 无权 | AE245: 无权 | AF245: 无权 | AG245: 99.19 | AH245: 0.49 | AI245: AAA | AJ245: 3.73e-002 | AK245: =I245+100*T245 -> 140.47 | AL245: 139.9 | AM245: 197 | AN245: 40.7 | AO245: 141 | AP245: -1.8000000000000002e-002 | AQ245: 14 | AR245: 光大转债
A246: 92 | B246: 裕同转债 | C246: 128104 | D246: 43949. | E246: 裕同科技 | F246: 2831 | G246: 造纸包装 | H246: 包装材料 | I246: 141.5 | J246: -2.0799999999999999e-002 | K246: -2.7099999999999999e-002 | L246: 31.75 | M246: -5.62e-002 | N246: 60 | O246: 2.9999999999999999e-002 | P246: 115.3 | Q246: 23.24 | R246: 4.34 | S246: 136.62 | T246: 3.6000000000000004e-002 | U246: 7天 | V246: 5.50年 | W246: 3.50年 | X246: 5.0000000000000003e-002 | Y246: 6.9000000000000006e-002 | Z246: 14 | AA246: 278 | AB246: -3.7200000000000004e-002 | AC246: -4.1799999999999997e-002 | AD246: -8.1699999999999995e-002 | AE246: -8.3400000000000002e-002 | AF246: 89.05 | AG246: 91.84 | AH246: 0.85 | AI246: AA+ | AJ246: 4.3099999999999999e-002 | AK246: =I246+100*T246 -> 145.09999999999999 | AL246: 146.4 | AM246: 241 | AN246: 54.5 | AO246: 234 | AP246: -0.11 | AQ246: 7 | AR246: 裕同转债
A247: 279 | B247: 国祯转债!! | C247: 123002 | D247: 43094. | E247: 国祯环保 | F247: 300388 | G247: 城市公用 | H247: 三废处理 | I247: 123.41 | J247: 3.3e-003 | K247: -1.6399999999999998e-002 | L247: 9.75 | M247: -1.32e-002 | N247: 2 | O247: 6.0000000000000001e-003 | P247: 109.8 | Q247: 8.48 | R247: 1.89 | S247: 114.98 | T247: 7.2999999999999995e-002 | U247: 转股中 | V247: 3年49天 | W247: 1年49天 | X247: 3.7999999999999999e-002 | Y247: 4.4000000000000004e-002 | Z247: 2.5 | AA247: 66 | AB247: -3.73e-002 | AC247: -4.2800000000000005e-002 | AD247: -0.126 | AE247: -0.129 | AF247: 97.08 | AG247: 96.36 | AH247: 0.99 | AI247: AA | AJ247: 4.3499999999999997e-002 | AK247: =I247+100*T247 -> 130.71000000000001 | AL247: 131.8 | AM247: 131 | AN247: 34.8 | AO247: 72 | AP247: -9.1999999999999998e-002 | AQ247: 11 | AR247: 国祯转债!!
A248: 121 | B248: 恩捷转债!! | C248: 128095 | D248: 43889. | E248: 恩捷股份 | F248: 2812 | G248: 电子 | H248: 元器件制 | I248: 141.718 | J248: 1.23e-002 | K248: -1.1699999999999999e-002 | L248: 91.47 | M248: 7.000000000000001e-004 | N248: 85 | O248: 4.2000000000000003e-002 | P248: 115.3 | Q248: 65.09 | R248: 15.79 | S248: 140.53 | T248: 8.0000000000000002e-003 | U248: 转股中 | V248: 5.35年 | W248: 3.35年 | X248: 1.8000000000000002e-002 | Y248: 2.5000000000000001e-002 | Z248: 14 | AA248: 801 | AB248: -3.85e-002 | AC248: -4.3299999999999998e-002 | AD248: -8.5500000000000007e-002 | AE248: -8.7300000000000003e-002 | AF248: 89.04 | AG248: 91.5 | AH248: 0.87 | AI248: AA | AJ248: 4.5100000000000001e-002 | AK248: =I248+100*T248 -> 142.518 | AL248: 142.9 | AM248: 217 | AN248: 51.4 | AO248: 209 | AP248: 6.4000000000000001e-002 | AQ248: 17 | AR248: 恩捷转债!!
A249: 39 | B249: 欣旺转债 | C249: 123058 | D249: 44050. | E249: 欣旺达 | F249: 300207 | G249: 电子 | H249: 电子产品 | I249: 145.3 | J249: 2.8999999999999998e-003 | K249: -1.5300000000000001e-002 | L249: 27.09 | M249: -1.5300000000000001e-002 | N249: 19 | O249: 1.1000000000000001e-002 | P249: 116.3 | Q249: 21.24 | R249: 7.33 | S249: 127.54 | T249: 0.13900000000000001 | U249: 3月16天 | V249: 5.77年 | W249: 3.77年 | X249: 2.6000000000000002e-002 | Y249: 3.3000000000000002e-002 | Z249: 11 | AA249: 427 | AB249: -3.85e-002 | AC249: -4.3099999999999999e-002 | AD249: -8.2500000000000004e-002 | AE249: -8.4100000000000008e-002 | AF249: 87.4 | AG249: 90.6 | AH249: 0.82 | AI249: AA | AJ249: 4.5100000000000001e-002 | AK249: =I249+100*T249 -> 159.20000000000002 | AL249: 163.1 | AM249: 273 | AN249: 72.5 | AO249: 273 | AP249: 1.e-003 | AQ249: 5 | AR249: 欣旺转债
A250: 171 | B250: 九洲转债! | C250: 123030 | D250: 43720. | E250: 九洲集团 | F250: 300040 | G250: 能源电力 | H250: 电力设备 | I250: 145.3 | J250: 5.4400000000000004e-002 | K250: 9.5999999999999992e-003 | L250: 8.31 | M250: 6.4000000000000001e-002 | N250: 946 | O250: 4.8200000000000003 | P250: 120 | Q250: 5.65 | R250: 1.45 | S250: 147.08 | T250: -1.2e-002 | U250: 转股中 | V250: 4.87年 | W250: 2.87年 | X250: 4.4000000000000004e-002 | Y250: 6.5000000000000002e-002 | Z250: 1.3 | AA250: 30 | AB250: -3.9100000000000003e-002 | AC250: -4.58e-002 | AD250: -0.105 | AE250: -0.107 | AF250: 85.76 | AG250: 89.02 | AH250: 1 | AI250: AA- | AJ250: 6.4500000000000002e-002 | AK250: =I250+100*T250 -> 144.10000000000002 | AL250: 143.5 | AM250: 224 | AN250: 54.5 | AO250: 233 | AP250: 3.6000000000000004e-002 | AQ250: 29 | AR250: 九洲转债!
A251: 71 | B251: 益丰转债 | C251: 113583 | D251: 44004. | E251: 益丰药房 | F251: 603939 | G251: 医药 | H251: 医药商业 | I251: 144 | J251: 3.0999999999999999e-003 | K251: 4.0999999999999995e-003 | L251: 99.3 | M251: 8.199999999999999e-003 | N251: 11 | O251: 5.0000000000000001e-003 | P251: 115.3 | Q251: 71.82 | R251: 10.88 | S251: 138.26 | T251: 4.0999999999999995e-002 | U251: 2月2天 | V251: 5.65年 | W251: 3.65年 | X251: 2.9999999999999999e-002 | Y251: 4.0999999999999995e-002 | Z251: 16 | AA251: 527 | AB251: -3.9199999999999999e-002 | AC251: -4.3700000000000003e-002 | AD251: -8.2799999999999999e-002 | AE251: -8.4399999999999989e-002 | AF251: 87.85 | AG251: 90.29 | AH251: 0.88 | AI251: AA | AJ251: 4.5100000000000001e-002 | AK251: =I251+100*T251 -> 148.09999999999999 | AL251: 149.7 | AM251: 255 | AN251: 59.4 | AO251: 252 | AP251: -6.0000000000000001e-003 | AQ251: 8 | AR251: 益丰转债
A252: 50 | B252: 海容转债 | C252: 113590 | D252: 44039. | E252: 海容冷链 | F252: 603187 | G252: 机械装备 | H252: 通用设备 | I252: 144.79 | J252: 3.4000000000000002e-003 | K252: -1.9599999999999999e-002 | L252: 50.99 | M252: -1.7500000000000002e-002 | N252: 5.5 | O252: 8.0000000000000002e-003 | P252: 115.6 | Q252: 36.39 | R252: 5.18 | S252: 140.12 | T252: 3.3000000000000002e-002 | U252: 3月0天 | V252: 5.73年 | W252: 3.73年 | X252: 6.2e-002 | Y252: 8.6999999999999994e-002 | Z252: 5 | AA252: 81 | AB252: -3.9199999999999999e-002 | AC252: -4.3700000000000003e-002 | AD252: -8.2299999999999998e-002 | AE252: -8.3900000000000002e-002 | AF252: 81.21 | AG252: 80.72 | AH252: 0.92 | AI252: AA- | AJ252: 6.6100000000000006e-002 | AK252: =I252+100*T252 -> 148.09 | AL252: 149.5 | AM252: 254 | AN252: 68.3 | AO252: 271 | AP252: -1.3000000000000001e-002 | AQ252: 4 | AR252: 海容转债
A253: 297 | B253: 九州转债! | C253: 110034 | D253: 42398. | E253: 九州通 | F253: 600998 | G253: 医药 | H253: 医药商业 | I253: 115.48 | J253: 1.01e-002 | K253: -1.54e-002 | L253: 16.9 | M253: -2.1400000000000002e-002 | N253: 8.4 | O253: 5.0000000000000001e-003 | P253: 109.6 | Q253: 18.32 | R253: 1.76 | S253: 92.25 | T253: 0.252 | U253: 转股中 | V253: 1.28年 | W253: 回售中 | X253: 4.7e-002 | Y253: 4.4000000000000004e-002 | Z253: 15 | AA253: 317 | AB253: -4.0500000000000001e-002 | AC253: -5.3800000000000001e-002 | AD253: 回售中 | AE253: 回售中 | AF253: 103 | AG253: 104.27 | AH253: 0.24 | AI253: AA+ | AJ253: 4.0300000000000002e-002 | AK253: =I253+100*T253 -> 140.68000000000001 | AL253: 138.7 | AM253: 188 | AN253: 34.4 | AO253: 70 | AP253: -1.2e-002 | AQ253: 25 | AR253: 九州转债!
A254: 282 | B254: 久立转2! | C254: 128019 | D254: 43070. | E254: 久立特材 | F254: 2318 | G254: 石油天然 | H254: 石油天然 | I254: 124.631 | J254: 8.199999999999999e-003 | K254: -1.24e-002 | L254: 8.53 | M254: -5.7999999999999996e-003 | N254: 3.6 | O254: 3.0000000000000001e-003 | P254: 109.8 | Q254: 7.62 | R254: 2.23 | S254: 111.94 | T254: 0.113 | U254: 转股中 | V254: 3年33天 | W254: 1年33天 | X254: 0.14499999999999999 | Y254: 0.16200000000000001 | Z254: 10 | AA254: 72 | AB254: -4.0999999999999995e-002 | AC254: -4.6500000000000007e-002 | AD254: -0.13699999999999998 | AE254: -0.14000000000000001 | AF254: 97.26 | AG254: 96.54 | AH254: 0.72 | AI254: AA | AJ254: 4.3499999999999997e-002 | AK254: =I254+100*T254 -> 135.93100000000001 | AL254: 137.3 | AM254: 176 | AN254: 40.1 | AO254: 133 | AP254: -3.5000000000000003e-002 | AQ254: 13 | AR254: 久立转2!
A255: 93 | B255: 瀚蓝转债 | C255: 110069 | D255: 43958. | E255: 瀚蓝环境 | F255: 600323 | G255: 城市公用 | H255: 三废处理 | I255: 143.55 | J255: 1.5e-003 | K255: -2.1600000000000001e-002 | L255: 28 | M255: -2.2700000000000001e-002 | N255: 12 | O255: 8.0000000000000002e-003 | P255: 113.5 | Q255: 20.2 | R255: 3.13 | S255: 138.61 | T255: 3.6000000000000004e-002 | U255: 7天 | V255: 5.50年 | W255: 3.50年 | X255: 4.5999999999999999e-002 | Y255: 6.4000000000000001e-002 | Z255: 9.9 | AA255: 215 | AB255: -4.2199999999999994e-002 | AC255: -4.6399999999999997e-002 | AD255: -8.8800000000000004e-002 | AE255: -8.9800000000000005e-002 | AF255: 87.66 | AG255: 90.24 | AH255: 0.88 | AI255: AA+ | AJ255: 4.3099999999999999e-002 | AK255: =I255+100*T255 -> 147.15000000000001 | AL255: 148.5 | AM255: 246 | AN255: 58.2 | AO255: 248 | AP255: -3.3000000000000002e-002 | AQ255: 7 | AR255: 瀚蓝转债
A256: 184 | B256: 中环转债! | C256: 123026 | D256: 43647. | E256: 中环环保 | F256: 300692 | G256: 城市公用 | H256: 三废处理 | I256: 129.46 | J256: 1.4499999999999999e-002 | K256: 5.1000000000000004e-003 | L256: 16 | M256: 2.2400000000000003e-002 | N256: 47 | O256: 0.22800000000000001 | P256: 110.6 | Q256: 12.25 | R256: 2.82 | S256: 130.61 | T256: -9.0000000000000011e-003 | U256: 转股中 | V256: 3.68年 | W256: 1.68年 | X256: 5.9999999999999998e-002 | Y256: 7.8e-002 | Z256: 1.6 | AA256: 27 | AB256: -4.2699999999999995e-002 | AC256: -4.7599999999999996e-002 | AD256: -0.11800000000000001 | AE256: -0.10199999999999999 | AF256: 91.65 | AG256: 88.29 | AH256: 0.88 | AI256: AA- | AJ256: 6.4500000000000002e-002 | AK256: =I256+100*T256 -> 128.56 | AL256: 128.3 | AM256: 93 | AN256: 36.7 | AO256: 87 | AP256: -5.4000000000000006e-002 | AQ256: 28 | AR256: 中环转债!
A257: 120 | B257: 奥佳转债! | C257: 128097 | D257: 43908. | E257: 奥佳华 | F257: 2614 | G257: 机械装备 | H257: 专用设备 | I257: 145.549 | J257: 1.8000000000000002e-002 | K257: 2.e-003 | L257: 15.42 | M257: 2.2499999999999999e-002 | N257: 55 | O257: 6.0999999999999999e-002 | P257: 115.3 | Q257: 10.69 | R257: 2.53 | S257: 144.25 | T257: 9.0000000000000011e-003 | U257: 转股中 | V257: 5.39年 | W257: 3.39年 | X257: 6.5000000000000002e-002 | Y257: 9.4e-002 | Z257: 6.2 | AA257: 95 | AB257: -4.3099999999999999e-002 | AC257: -4.7800000000000002e-002 | AD257: -9.1499999999999998e-002 | AE257: -9.3299999999999994e-002 | AF257: 88.89 | AG257: 91.35 | AH257: 0.89 | AI257: AA | AJ257: 4.5100000000000001e-002 | AK257: =I257+100*T257 -> 146.44900000000001 | AL257: 146.9 | AM257: 243 | AN257: 55.5 | AO257: 239 | AP257: -2.6000000000000002e-002 | AQ257: 27 | AR257: 奥佳转债!
A258: 42 | B258: 安20转债 | C258: 113592 | D258: 44043. | E258: 安井食品 | F258: 603345 | G258: 食品饮料 | H258: 食品饮料 | I258: 145.33 | J258: -1.1999999999999999e-003 | K258: -2.2099999999999998e-002 | L258: 172.17 | M258: -2.5499999999999998e-002 | N258: 41 | O258: 3.1e-002 | P258: 113.1 | Q258: 115.9 | R258: 13.29 | S258: 148.55 | T258: -2.2000000000000002e-002 | U258: 3月10天 | V258: 5.75年 | W258: 3.75年 | X258: 2.2000000000000002e-002 | Y258: 3.3000000000000002e-002 | Z258: 9 | AA258: 407 | AB258: -4.3299999999999998e-002 | AC258: -4.7100000000000003e-002 | AD258: -8.3299999999999999e-002 | AE258: -8.48e-002 | AF258: 87.27 | AG258: 88.15 | AH258: 0.91 | AI258: AA | AJ258: 4.5100000000000001e-002 | AK258: =I258+100*T258 -> 143.13000000000002 | AL258: 142.1 | AM258: 213 | AN258: 54 | AO258: 231 | AP258: -1.7000000000000001e-002 | AQ258: 5 | AR258: 安20转债
A259: 287 | B259: 国君转债! | C259: 113013 | D259: 42940. | E259: 国泰君安 | F259: 601211 | G259: 金融 | H259: 证券行业 | I259: 122.65 | J259: -1.1000000000000001e-003 | K259: -3.4000000000000002e-003 | L259: 18.24 | M259: -9.1999999999999998e-003 | N259: 20 | O259: 2.e-003 | P259: 108.3 | Q259: 19.01 | R259: 1.34 | S259: 95.95 | T259: 0.27800000000000002 | U259: 转股中 | V259: 2.75年 | W259: 无权 | X259: 4.2999999999999997e-002 | Y259: 4.0999999999999995e-002 | Z259: 70 | AA259: 1625. | AB259: -4.4900000000000002e-002 | AC259: -5.0199999999999995e-002 | AD259: 无权 | AE259: 无权 | AF259: 无权 | AG259: 98.08 | AH259: 0.49 | AI259: AAA | AJ259: 3.73e-002 | AK259: =I259+100*T259 -> 150.45000000000002 | AL259: 149.4 | AM259: 251 | AN259: 51.3 | AO259: 206 | AP259: -1.7000000000000001e-002 | AQ259: 13 | AR259: 国君转债!
A260: 128 | B260: 璞泰转债! | C260: 113562 | D260: 43865. | E260: 璞泰来 | F260: 603659 | G260: 电子 | H260: 元器件制 | I260: 138.02 | J260: 7.4000000000000003e-003 | K260: -7.000000000000001e-004 | L260: 108.59 | M260: 7.8000000000000005e-003 | N260: 33 | O260: 2.7000000000000003e-002 | P260: 113.3 | Q260: 82.73 | R260: 13.82 | S260: 131.26 | T260: 5.2000000000000005e-002 | U260: 转股中 | V260: 4.24年 | W260: 2.24年 | X260: 1.8000000000000002e-002 | Y260: 2.4e-002 | Z260: 8.7 | AA260: 473 | AB260: -4.5999999999999999e-002 | AC260: -5.1299999999999998e-002 | AD260: -0.11800000000000001 | AE260: -0.11900000000000001 | AF260: 92.16 | AG260: 94.8 | AH260: 0.85 | AI260: AA | AJ260: 4.3499999999999997e-002 | AK260: =I260+100*T260 -> 143.22 | AL260: 144.8 | AM260: 234 | AN260: 50 | AO260: 202 | AP260: 2.7999999999999997e-002 | AQ260: 16 | AR260: 璞泰转债!
A261: 99 | B261: 天铁转债 | C261: 123046 | D261: 43938. | E261: 天铁股份 | F261: 300587 | G261: 铁路 | H261: 铁路设备 | I261: 154 | J261: -6.5000000000000006e-003 | K261: 0. | L261: 15.78 | M261: -6.8999999999999999e-003 | N261: 26 | O261: 7.9000000000000001e-002 | P261: 118.2 | Q261: 10.12 | R261: 2.65 | S261: 155.93 | T261: -1.2e-002 | U261: 转股中 | V261: 5.45年 | W261: 3.45年 | X261: 4.2999999999999997e-002 | Y261: 6.8000000000000005e-002 | Z261: 2.1 | AA261: 49 | AB261: -4.8300000000000003e-002 | AC261: -5.3699999999999998e-002 | AD261: -0.10099999999999999 | AE261: -0.10300000000000001 | AF261: 82.83 | AG261: 84.07 | AH261: 0.93 | AI261: AA- | AJ261: 6.6100000000000006e-002 | AK261: =I261+100*T261 -> 152.80000000000001 | AL261: 152.1 | AM261: 261 | AN261: 68 | AO261: 270 | AP261: -2.e-003 | AQ261: 9 | AR261: 天铁转债
A262: 259 | B262: 长证转债! | C262: 127005 | D262: 43201. | E262: 长江证券 | F262: 783 | G262: 金融 | H262: 证券行业 | I262: 129.8 | J262: -1.5e-003 | K262: -7.7000000000000002e-003 | L262: 8.02 | M262: -1.3500000000000002e-002 | N262: 15 | O262: 2.e-003 | P262: 109.3 | Q262: 7.28 | R262: 1.64 | S262: 110.16 | T262: 0.17800000000000002 | U262: 转股中 | V262: 3.43年 | W262: 无权 | X262: 0.113 | Y262: 0.124 | Z262: 50 | AA262: 443 | AB262: -4.9800000000000004e-002 | AC262: -5.4400000000000004e-002 | AD262: 无权 | AE262: 无权 | AF262: 无权 | AG262: 96.27 | AH262: 0.68 | AI262: AAA | AJ262: 3.85e-002 | AK262: =I262+100*T262 -> 147.60000000000002 | AL262: 149.4 | AM262: 253 | AN262: 53.2 | AO262: 219 | AP262: -1.4999999999999999e-002 | AQ262: 15 | AR262: 长证转债!
A263: 261 | B263: 艾华转债!! | C263: 113504 | D263: 43182. | E263: 艾华集团 | F263: 603989 | G263: 电子 | H263: 元器件制 | I263: 131.09 | J263: 1.2e-002 | K263: 7.1999999999999998e-003 | L263: 27.17 | M263: 2.2599999999999999e-002 | N263: 2.8 | O263: 4.0000000000000001e-003 | P263: 110.3 | Q263: 21.13 | R263: 4.83 | S263: 128.58 | T263: 1.9e-002 | U263: 转股中 | V263: 3.40年 | W263: 1.40年 | X263: 5.2999999999999999e-002 | Y263: 6.8000000000000005e-002 | Z263: 5.6 | AA263: 106 | AB263: -5.04e-002 | AC263: -5.5500000000000001e-002 | AD263: -0.128 | AE263: -0.13100000000000001 | AF263: 96.21 | AG263: 95.71 | AH263: 0.85 | AI263: AA | AJ263: 4.3499999999999997e-002 | AK263: =I263+100*T263 -> 132.99000000000001 | AL263: 133.6 | AM263: 148 | AN263: 37.4 | AO263: 102 | AP263: -2.1000000000000001e-002 | AQ263: 9 | AR263: 艾华转债!!
A264: 126 | B264: 希望转债! | C264: 127015 | D264: 43865. | E264: 新 希 望 | F264: 876 | G264: 农业 | H264: 畜牧业 | I264: 145 | J264: -8.199999999999999e-003 | K264: -5.6999999999999993e-003 | L264: 27.7 | M264: -1.3899999999999999e-002 | N264: 64 | O264: 2.4e-002 | P264: 110.2 | Q264: 19.63 | R264: 4.03 | S264: 141.11 | T264: 2.7999999999999997e-002 | U264: 转股中 | V264: 5.24年 | W264: 3.24年 | X264: 1.4999999999999999e-002 | Y264: 2.2000000000000002e-002 | Z264: 18 | AA264: 1193. | AB264: -5.1699999999999996e-002 | AC264: -5.5e-002 | AD264: -9.64e-002 | AE264: -9.7699999999999995e-002 | AF264: 90.05 | AG264: 89.96 | AH264: 1 | AI264: AAA | AJ264: 4.0099999999999997e-002 | AK264: =I264+100*T264 -> 147.80000000000001 | AL264: 148.9 | AM264: 250 | AN264: 58.8 | AO264: 251 | AP264: -0.13300000000000001 | AQ264: 29 | AR264: 希望转债!
A265: 17 | B265: 隆20转债 | C265: 113038 | D265: 44082. | E265: 隆基股份 | F265: 601012 | G265: 能源电力 | H265: 太阳能 | I265: 153.57 | J265: 7.4999999999999997e-003 | K265: -8.5000000000000006e-003 | L265: 75.01 | M265: -1.1000000000000001e-003 | N265: 351 | O265: 4.4999999999999998e-002 | P265: 111.8 | Q265: 52.77 | R265: 9.12 | S265: 142.15 | T265: 8.0000000000000002e-002 | U265: 4月3天 | V265: 5.82年 | W265: 3.82年 | X265: 1.8000000000000002e-002 | Y265: 2.5000000000000001e-002 | Z265: 50 | AA265: 2829. | AB265: -5.3899999999999997e-002 | AC265: -5.7200000000000001e-002 | AD265: -9.5299999999999996e-002 | AE265: -9.6600000000000005e-002 | AF265: 88.42 | AG265: 89.28 | AH265: 0.88 | AI265: AAA | AJ265: 4.0099999999999997e-002 | AK265: =I265+100*T265 -> 161.56999999999999 | AL265: 165 | AM265: 274 | AN265: 75.7 | AO265: 276 | AP265: 7.4999999999999997e-002 | AQ265: 10 | AR265: 隆20转债
A266: 175 | B266: 欧派转债! | C266: 113543 | D266: 43712. | E266: 欧派家居 | F266: 603833 | G266: 其他 | H266: 家居用品 | I266: 149.88 | J266: 1.1399999999999999e-002 | K266: 1.e-003 | L266: 107.77 | M266: 1.3600000000000001e-002 | N266: 23 | O266: 1.7000000000000001e-002 | P266: 114.9 | Q266: 71.69 | R266: 4.88 | S266: 150.33 | T266: -3.0000000000000001e-003 | U266: 转股中 | V266: 4.86年 | W266: 3.86年 | X266: 1.3999999999999999e-002 | Y266: 2.1000000000000001e-002 | Z266: 9.1 | AA266: 642 | AB266: -5.4100000000000002e-002 | AC266: -5.91e-002 | AD266: -8.5099999999999995e-002 | AE266: -8.72e-002 | AF266: 88.87 | AG266: 93.78 | AH266: 0.91 | AI266: AA | AJ266: 4.3499999999999997e-002 | AK266: =I266+100*T266 -> 149.57999999999998 | AL266: 149.4 | AM266: 252 | AN266: 55.7 | AO266: 241 | AP266: -9.0000000000000011e-003 | AQ266: 15 | AR266: 欧派转债!
A267: 53 | B267: 巨星转债 | C267: 128115 | D267: 44028. | E267: 巨星科技 | F267: 2444 | G267: 机械装备 | H267: 通用设备 | I267: 158 | J267: 2.9999999999999999e-002 | K267: -9.300000000000001e-003 | L267: 19.78 | M267: 2.2200000000000001e-002 | N267: 207 | O267: 0.13300000000000001 | P267: 115.3 | Q267: 12.28 | R267: 2.62 | S267: 161.07 | T267: -1.9e-002 | U267: 3月0天 | V267: 5.72年 | W267: 3.72年 | X267: 4.5999999999999999e-002 | Y267: 7.400000000000001e-002 | Z267: 9.7 | AA267: 213 | AB267: -5.45e-002 | AC267: -5.8799999999999998e-002 | AD267: -9.74e-002 | AE267: -0.10000000000000001 | AF267: 89.88 | AG267: 90.04 | AH267: 0.93 | AI267: AA | AJ267: 4.5100000000000001e-002 | AK267: =I267+100*T267 -> 156.09999999999999 | AL267: 154.9 | AM267: 266 | AN267: 64.9 | AO267: 263 | AP267: -1.3999999999999999e-002 | AQ267: 4 | AR267: 巨星转债
A268: 155 | B268: 通光转债! | C268: 123034 | D268: 43797. | E268: 通光线缆 | F268: 300265 | G268: 通信互联 | H268: 通信设备 | I268: 156.8 | J268: -1.8799999999999997e-002 | K268: -1.1000000000000001e-003 | L268: 12.58 | M268: -2.1000000000000001e-002 | N268: 463 | O268: 2.71 | P268: 118.5 | Q268: 7.97 | R268: 3.8 | S268: 157.84 | T268: -6.9999999999999993e-003 | U268: 转股中 | V268: 5年29天 | W268: 3年29天 | X268: 2.4e-002 | Y268: 3.7000000000000005e-002 | Z268: 1.1 | AA268: 45 | AB268: -5.4699999999999999e-002 | AC268: -6.0499999999999998e-002 | AD268: -0.11800000000000001 | AE268: -0.11900000000000001 | AF268: 82 | AG268: 81.99 | AH268: 0.95 | AI268: A+ | AJ268: 7.7100000000000002e-002 | AK268: =I268+100*T268 -> 156.10000000000002 | AL268: 155.8 | AM268: 267 | AN268: 73.8 | AO268: 274 | AP268: 3.6000000000000004e-002 | AQ268: 26 | AR268: 通光转债!
A269: 187 | B269: 一心转债! | C269: 128067 | D269: 43602. | E269: 一心堂 | F269: 2727 | G269: 医药 | H269: 医药商业 | I269: 146.599 | J269: -9.4999999999999998e-003 | K269: -4.0999999999999995e-003 | L269: 39.16 | M269: -1.3600000000000001e-002 | N269: 19 | O269: 7.6999999999999999e-002 | P269: 112.9 | Q269: 26.83 | R269: 4.68 | S269: 145.96 | T269: 4.0000000000000001e-003 | U269: 转股中 | V269: 4.53年 | W269: 2.53年 | X269: 6.9999999999999993e-003 | Y269: 1.1000000000000001e-002 | Z269: 1.7 | AA269: 230 | AB269: -5.7000000000000002e-002 | AC269: -6.1600000000000002e-002 | AD269: -0.121 | AE269: -0.12300000000000001 | AF269: 92.27 | AG269: 93.44 | AH269: 1 | AI269: AA | AJ269: 4.3499999999999997e-002 | AK269: =I269+100*T269 -> 146.999 | AL269: 147.2 | AM269: 244 | AN269: 53.8 | AO269: 230 | AP269: -2.4e-002 | AQ269: 17 | AR269: 一心转债!
A270: 300 | B270: 电气转债! | C270: 113008 | D270: 42051. | E270: 上海电气 | F270: 601727 | G270: 能源电力 | H270: 电力设备 | I270: 108.73 | J270: 1.6000000000000001e-003 | K270: -3.2000000000000002e-003 | L270: 5.02 | M270: -7.9000000000000008e-003 | N270: 20 | O270: 4.0000000000000001e-003 | P270: 106.6 | Q270: 5.13 | R270: 1.17 | S270: 97.86 | T270: 0.111 | U270: 转股中 | V270: 0.33年 | W270: 回售中 | X270: 5.7999999999999996e-002 | Y270: 5.7000000000000002e-002 | Z270: 44 | AA270: 761 | AB270: -5.8799999999999998e-002 | AC270: -9.4100000000000003e-002 | AD270: 回售中 | AE270: 回售中 | AF270: 103 | AG270: 105.44 | AH270: 0.2 | AI270: AAA | AJ270: 3.4000000000000002e-002 | AK270: =I270+100*T270 -> 119.83 | AL270: 119.6 | AM270: 30 | AN270: 14.2 | AO270: 2 | AP270: -5.9999999999999998e-002 | AQ270: 28 | AR270: 电气转债!
A271: 242 | B271: 凯发转债! | C271: 123014 | D271: 43333. | E271: 凯发电气 | F271: 300407 | G271: 能源电力 | H271: 电力设备 | I271: 129.89 | J271: 1.24e-002 | K271: -2.06e-002 | L271: 8.42 | M271: -1.1699999999999999e-002 | N271: 68 | O271: 0.45500000000000002 | P271: 108.5 | Q271: 8.12 | R271: 1.95 | S271: 103.69 | T271: 0.253 | U271: 转股中 | V271: 2.81年 | W271: 0.81年 | X271: 4.4999999999999998e-002 | Y271: 4.7e-002 | Z271: 1.2 | AA271: 26 | AB271: -6.2800000000000009e-002 | AC271: -6.8000000000000005e-002 | AD271: -0.22800000000000001 | AE271: -0.23000000000000001 | AF271: 94.44 | AG271: 88.95 | AH271: 0.7 | AI271: A+ | AJ271: 7.4299999999999991e-002 | AK271: =I271+100*T271 -> 155.19 | AL271: 156.1 | AM271: 268 | AN271: 61.6 | AO271: 260 | AP271: -9.0999999999999998e-002 | AQ271: 14 | AR271: 凯发转债!
A272: 256 | B272: 金农转债!! | C272: 128036 | D272: 43192. | E272: 金新农 | F272: 2548 | G272: 农业 | H272: 畜牧业 | I272: 137.77 | J272: -2.63e-002 | K272: 1.9299999999999998e-002 | L272: 8.5 | M272: -6.9999999999999993e-003 | N272: 77 | O272: 0.376 | P272: 110.3 | Q272: 7.39 | R272: 2.42 | S272: 115.02 | T272: 0.19800000000000001 | U272: 转股中 | V272: 3.42年 | W272: 1.42年 | X272: 3.1e-002 | Y272: 3.5000000000000003e-002 | Z272: 1.5 | AA272: 48 | AB272: -6.4100000000000004e-002 | AC272: -6.9099999999999995e-002 | AD272: -0.14899999999999999 | AE272: -0.151 | AF272: 93.16 | AG272: 89.46 | AH272: 0.99 | AI272: AA- | AJ272: 6.4500000000000002e-002 | AK272: =I272+100*T272 -> 157.57000000000002 | AL272: 160.5 | AM272: 270 | AN272: 67.4 | AO272: 268 | AP272: -7.0000000000000007e-002 | AQ272: 16 | AR272: 金农转债!!
A273: 220 | B273: 联泰转债! | C273: 113526 | D273: 43514. | E273: 联泰环保 | F273: 603797 | G273: 城市公用 | H273: 三废处理 | I273: 149.96 | J273: -3.5299999999999998e-002 | K273: 2.6200000000000001e-002 | L273: 8.51 | M273: -1.0500000000000001e-002 | N273: 19 | O273: 6.3e-002 | P273: 110.8 | Q273: 6.11 | R273: 1.79 | S273: 139.28 | T273: 7.6999999999999999e-002 | U273: 转股中 | V273: 4.30年 | W273: 2.30年 | X273: 5.0999999999999997e-002 | Y273: 7.0999999999999994e-002 | Z273: 1.9 | AA273: 38 | AB273: -6.9199999999999998e-002 | AC273: -7.3300000000000004e-002 | AD273: -0.10400000000000001 | AE273: -0.105 | AF273: 93.1 | AG273: 92.62 | AH273: 0.87 | AI273: AA | AJ273: 4.3499999999999997e-002 | AK273: =I273+100*T273 -> 157.66 | AL273: 160.6 | AM273: 271 | AN273: 67.5 | AO273: 269 | AP273: -4.9000000000000002e-002 | AQ273: 7 | AR273: 联泰转债!
A274: 59 | B274: 歌尔转2 | C274: 128112 | D274: 44025. | E274: 歌尔股份 | F274: 2241 | G274: 电子 | H274: 电子产品 | I274: 176.35 | J274: 8.6e-003 | K274: -1.3500000000000002e-002 | L274: 40.43 | M274: -5.1999999999999998e-003 | N274: 278 | O274: 3.9e-002 | P274: 114.5 | Q274: 23.27 | R274: 8.12 | S274: 173.74 | T274: 1.4999999999999999e-002 | U274: 2月13天 | V274: 5.68年 | W274: 3.68年 | X274: 2.9999999999999999e-002 | Y274: 5.2999999999999999e-002 | Z274: 40 | AA274: 1312. | AB274: -7.4099999999999999e-002 | AC274: -7.8100000000000003e-002 | AD274: -0.126 | AE274: -0.127 | AF274: 87.64 | AG274: 90.4 | AH274: 0.94 | AI274: AA+ | AJ274: 4.3099999999999999e-002 | AK274: =I274+100*T274 -> 177.84999999999999 | AL274: 179 | AM274: 281 | AN274: 88.6 | AO274: 281 | AP274: -6.9999999999999993e-003 | AQ274: 16 | AR274: 歌尔转2
A275: 74 | B275: 火炬转债 | C275: 113582 | D275: 44005. | E275: 火炬电子 | F275: 603678 | G275: 电子 | H275: 元器件制 | I275: 178.45 | J275: 1.3300000000000001e-002 | K275: -1.7899999999999999e-002 | L275: 46.12 | M275: -4.6999999999999993e-003 | N275: 26 | O275: 2.4e-002 | P275: 115.3 | Q275: 25.33 | R275: 6.29 | S275: 182.08 | T275: -2.e-002 | U275: 57天 | V275: 5.64年 | W275: 3.64年 | X275: 2.8999999999999998e-002 | Y275: 5.2000000000000005e-002 | Z275: 6 | AA275: 209 | AB275: -7.5700000000000003e-002 | AC275: -8.0000000000000002e-002 | AD275: -0.128 | AE275: -0.13 | AF275: 87.9 | AG275: 90.35 | AH275: 0.96 | AI275: AA | AJ275: 4.5100000000000001e-002 | AK275: =I275+100*T275 -> 176.44999999999999 | AL275: 174.8 | AM275: 279 | AN275: 84.5 | AO275: 278 | AP275: 0.115 | AQ275: 4 | AR275: 火炬转债
A276: 207 | B276: 长信转债!! | C276: 123022 | D276: 43565. | E276: 长信科技 | F276: 300088 | G276: 通信互联 | H276: 通信设备 | I276: 162.2 | J276: -1.44e-002 | K276: 4.1999999999999997e-003 | L276: 10.02 | M276: -1.09e-002 | N276: 16 | O276: 3.1e-002 | P276: 114.9 | Q276: 6.15 | R276: 3.74 | S276: 162.93 | T276: -4.0000000000000001e-003 | U276: 转股中 | V276: 4.45年 | W276: 2.45年 | X276: 1.2e-002 | Y276: 2.e-002 | Z276: 3 | AA276: 245 | AB276: -7.5899999999999995e-002 | AC276: -8.1199999999999994e-002 | AD276: -0.11199999999999999 | AE276: -0.114 | AF276: 92.62 | AG276: 95.45 | AH276: 0.94 | AI276: AA | AJ276: 4.3499999999999997e-002 | AK276: =I276+100*T276 -> 161.79999999999998 | AL276: 161.5 | AM276: 272 | AN276: 66 | AO276: 266 | AP276: -9.6000000000000002e-002 | AQ276: 11 | AR276: 长信转债!!
A277: 218 | B277: 尚荣转债! | C277: 128053 | D277: 43531. | E277: 尚荣医疗 | F277: 2551 | G277: 医药 | H277: 医疗器械 | I277: 163 | J277: -1.15e-002 | K277: -4.0999999999999995e-003 | L277: 7.59 | M277: -1.5600000000000001e-002 | N277: 149 | O277: 0.46999999999999997 | P277: 114.9 | Q277: 4.89 | R277: 2.12 | S277: 155.21 | T277: 5.0000000000000003e-002 | U277: 转股中 | V277: 4.36年 | W277: 2.36年 | X277: 3.1e-002 | Y277: 4.8000000000000001e-002 | Z277: 1.9 | AA277: 62 | AB277: -7.8399999999999997e-002 | AC277: -8.3800000000000013e-002 | AD277: -0.11900000000000001 | AE277: -0.12 | AF277: 92.96 | AG277: 95.81 | AH277: 1 | AI277: AA | AJ277: 4.3499999999999997e-002 | AK277: =I277+100*T277 -> 168. | AL277: 170.8 | AM277: 277 | AN277: 75 | AO277: 275 | AP277: 2.3e-002 | AQ277: 27 | AR277: 尚荣转债!
A278: 100 | B278: 海大转债 | C278: 128102 | D278: 43937. | E278: 海大集团 | F278: 2311 | G278: 农业 | H278: 畜牧业 | I278: 177.3 | J278: 2.2499999999999999e-002 | K278: -3.9000000000000003e-003 | L278: 61.33 | M278: 1.9400000000000001e-002 | N278: 181 | O278: 4.9000000000000002e-002 | P278: 114.1 | Q278: 34.74 | R278: 9.86 | S278: 176.54 | T278: 4.0000000000000001e-003 | U278: 转股中 | V278: 5.45年 | W278: 4.45年 | X278: 2.1000000000000001e-002 | Y278: 3.7999999999999999e-002 | Z278: 21 | AA278: 980 | AB278: -7.8600000000000003e-002 | AC278: -8.2699999999999996e-002 | AD278: -0.10300000000000001 | AE278: -0.10400000000000001 | AF278: 86.14 | AG278: 90.97 | AH278: 0.96 | AI278: AA+ | AJ278: 4.3099999999999999e-002 | AK278: =I278+100*T278 -> 177.70000000000002 | AL278: 178.1 | AM278: 280 | AN278: 87.1 | AO278: 279 | AP278: -2.6000000000000002e-002 | AQ278: 13 | AR278: 海大转债
A279: 272 | B279: 赣锋转债!! | C279: 128028 | D279: 43119. | E279: 赣锋锂业 | F279: 2460 | G279: 有色金属 | H279: 小金属 | I279: 141.58 | J279: 1.43e-002 | K279: -2.4199999999999999e-002 | L279: 54.19 | M279: -9.8999999999999991e-003 | N279: 28 | O279: 2.1000000000000001e-002 | P279: 109.3 | Q279: 41.98 | R279: 8.71 | S279: 129.09 | T279: 9.6999999999999989e-002 | U279: 转股中 | V279: 3.21年 | W279: 1.21年 | X279: 1.3000000000000001e-002 | Y279: 1.6e-002 | Z279: 9.2 | AA279: 722 | AB279: -7.8700000000000006e-002 | AC279: -8.3400000000000002e-002 | AD279: -0.19500000000000001 | AE279: -0.19699999999999998 | AF279: 96.29 | AG279: 95.57 | AH279: 1 | AI279: AA | AJ279: 4.3499999999999997e-002 | AK279: =I279+100*T279 -> 151.28 | AL279: 154.1 | AM279: 265 | AN279: 57.8 | AO279: 247 | AP279: 5.0999999999999997e-002 | AQ279: 13 | AR279: 赣锋转债!!
A280: 73 | B280: 福莱转债 | C280: 113035 | D280: 43999. | E280: 福莱特 | F280: 601865 | G280: 能源电力 | H280: 太阳能 | I280: 190.12 | J280: 4.2699999999999995e-002 | K280: 5.45e-002 | L280: 29.92 | M280: 0.10000000000000001 | N280: 1279. | O280: 0.45100000000000001 | P280: 120.3 | Q280: 13.56 | R280: 11.71 | S280: 220.65 | T280: -0.13800000000000001 | U280: 58天 | V280: 5.64年 | W280: 3.64年 | X280: 2.5000000000000001e-002 | Y280: 5.5e-002 | Z280: 15 | AA280: 585 | AB280: -7.9100000000000004e-002 | AC280: -8.4600000000000009e-002 | AD280: -0.14099999999999999 | AE280: -0.14300000000000002 | AF280: 87.9 | AG280: 94.25 | AH280: 0.97 | AI280: AA | AJ280: 4.5100000000000001e-002 | AK280: =I280+100*T280 -> 176.31999999999999 | AL280: 159.6 | AM280: 269 | AN280: 65.3 | AO280: 264 | AP280: 0.24299999999999999 | AQ280: 5 | AR280: 福莱转债
A281: 64 | B281: 上机转债 | C281: 113586 | D281: 44019. | E281: 上机数控 | F281: 603185 | G281: 机械装备 | H281: 专用设备 | I281: 199.9 | J281: 1.54e-002 | K281: 7.9000000000000008e-003 | L281: 72.5 | M281: 2.4e-002 | N281: 80 | O281: 5.9999999999999998e-002 | P281: 120.8 | Q281: 33.3 | R281: 9.28 | S281: 217.72 | T281: -8.199999999999999e-002 | U281: 2月10天 | V281: 5.67年 | W281: 3.67年 | X281: 3.9e-002 | Y281: 8.5999999999999993e-002 | Z281: 6.7 | AA281: 169 | AB281: -8.6300000000000002e-002 | AC281: -9.1799999999999993e-002 | AD281: -0.14899999999999999 | AE281: -0.151 | AF281: 81.68 | AG281: 84.67 | AH281: 0.97 | AI281: AA- | AJ281: 6.6100000000000006e-002 | AK281: =I281+100*T281 -> 191.70000000000002 | AL281: 182.1 | AM281: 282 | AN281: 97.4 | AO281: 283 | AP281: 3.7999999999999999e-002 | AQ281: 8 | AR281: 上机转债
A282: 285 | B282: 金禾转债!! | C282: 128017 | D282: 43066. | E282: 金禾实业 | F282: 2597 | G282: 化工 | H282: 化工 | I282: 144.98 | J282: 4.4000000000000003e-003 | K282: -2.2799999999999997e-002 | L282: 31.7 | M282: -2.0400000000000001e-002 | N282: 31 | O282: 3.7999999999999999e-002 | P282: 109.8 | Q282: 22.42 | R282: 4.04 | S282: 141.39 | T282: 2.5000000000000001e-002 | U282: 转股中 | V282: 3年26天 | W282: 1年26天 | X282: 3.1e-002 | Y282: 4.4000000000000004e-002 | Z282: 5.5 | AA282: 177 | AB282: -8.8100000000000012e-002 | AC282: -9.3200000000000005e-002 | AD282: -0.23199999999999998 | AE282: -0.23399999999999999 | AF282: 97.34 | AG282: 96.62 | AH282: 0.9 | AI282: AA | AJ282: 4.3499999999999997e-002 | AK282: =I282+100*T282 -> 147.47999999999999 | AL282: 148.6 | AM282: 248 | AN282: 51.2 | AO282: 205 | AP282: -5.7999999999999996e-002 | AQ282: 11 | AR282: 金禾转债!!
A283: 182 | B283: 蓝晓转债! | C283: 123027 | D283: 43650. | E283: 蓝晓科技 | F283: 300487 | G283: 化工 | H283: 化工 | I283: 183 | J283: -2.0000000000000001e-004 | K283: 2.7000000000000001e-003 | L283: 53.77 | M283: 2.5999999999999999e-003 | N283: 61 | O283: 0.309 | P283: 119.5 | Q283: 29.33 | R283: 8.12 | S283: 183.33 | T283: -2.e-003 | U283: 转股中 | V283: 4.68年 | W283: 2.68年 | X283: 1.e-002 | Y283: 1.8000000000000002e-002 | Z283: 1.1 | AA283: 113 | AB283: -8.8800000000000004e-002 | AC283: -9.5000000000000001e-002 | AD283: -0.11900000000000001 | AE283: -0.12 | AF283: 85.09 | AG283: 85.74 | AH283: 0.96 | AI283: A+ | AJ283: 7.5499999999999998e-002 | AK283: =I283+100*T283 -> 182.80000000000001 | AL283: 182.7 | AM283: 283 | AN283: 96.9 | AO283: 282 | AP283: 1.3000000000000001e-002 | AQ283: 20 | AR283: 蓝晓转债!
A284: 239 | B284: 蓝盾转债!! | C284: 123015 | D284: 43356. | E284: 蓝盾股份 | F284: 300297 | G284: 计算机及 | H284: 软件开发 | I284: 160.4 | J284: -9.8999999999999991e-003 | K284: 8.3999999999999995e-003 | L284: 4.82 | M284: -4.0999999999999995e-003 | N284: 302 | O284: 1.8899999999999999 | P284: 112.3 | Q284: 5.79 | R284: 1.6 | S284: 83.25 | T284: 0.92700000000000005 | U284: 转股中 | V284: 3.85年 | W284: 1.85年 | X284: 1.7000000000000001e-002 | Y284: 1.3999999999999999e-002 | Z284: 1 | AA284: 60 | AB284: -8.9700000000000002e-002 | AC284: -9.4700000000000006e-002 | AD284: -0.157 | AE284: -0.159 | AF284: 94.39 | AG284: 95.59 | AH284: 0.37 | AI284: AA | AJ284: 4.3499999999999997e-002 | AK284: =I284+100*T284 -> 253.10000000000002 | AL284: 237.6 | AM284: 291 | AN284: 142 | AO284: 291 | AP284: -0.11900000000000001 | AQ284: 18 | AR284: 蓝盾转债!!
A285: 75 | B285: 龙蟠转债 | C285: 113581 | D285: 43970. | E285: 龙蟠科技 | F285: 603906 | G285: 化工 | H285: 化工 | I285: 242.39 | J285: 1.0200000000000001e-002 | K285: 1.1000000000000001e-002 | L285: 26.7 | M285: 2.18e-002 | N285: 380 | O285: 0.38500000000000001 | P285: 129.6 | Q285: 9.48 | R285: 5.73 | S285: 281.65 | T285: -0.13900000000000001 | U285: 23天 | V285: 5.55年 | W285: 3.55年 | X285: 5.0000000000000003e-002 | Y285: 0.13900000000000001 | Z285: 4 | AA285: 81 | AB285: -0.109 | AC285: -0.11599999999999999 | AD285: -0.105 | AE285: -0.106 | AF285: 81.32 | AG285: 86.96 | AH285: 0.97 | AI285: A+ | AJ285: 7.7100000000000002e-002 | AK285: =I285+100*T285 -> 228.48999999999998 | AL285: 203.1 | AM285: 287 | AN285: 116.2 | AO285: 288 | AP285: -2.e-003 | AQ285: 14 | AR285: 龙蟠转债
A286: 233 | B286: 科森转债!! | C286: 113521 | D286: 43441. | E286: 科森科技 | F286: 603626 | G286: 通信互联 | H286: 通信设备 | I286: 184.96 | J286: -2.9600000000000001e-002 | K286: -2.41e-002 | L286: 14.94 | M286: -5.74e-002 | N286: 35 | O286: 0.28999999999999998 | P286: 115.2 | Q286: 8.7 | R286: 3.47 | S286: 171.72 | T286: 7.6999999999999999e-002 | U286: 转股中 | V286: 4年41天 | W286: 2年41天 | X286: 9.0000000000000011e-003 | Y286: 1.4999999999999999e-002 | Z286: 0.6 | AA286: 72 | AB286: -0.111 | AC286: -0.11599999999999999 | AD286: -0.16600000000000001 | AE286: -0.16800000000000001 | AF286: 94.07 | AG286: 97.09 | AH286: 0.94 | AI286: AA | AJ286: 4.3499999999999997e-002 | AK286: =I286+100*T286 -> 192.66 | AL286: 198.2 | AM286: 286 | AN286: 101.1 | AO286: 286 | AP286: -6.6000000000000003e-002 | AQ286: 25 | AR286: 科森转债!!
A287: 235 | B287: 百合转债! | C287: 113520 | D287: 43430. | E287: 梦百合 | F287: 603313 | G287: 其他 | H287: 家居用品 | I287: 189.51 | J287: -2.86e-002 | K287: 1.2800000000000001e-002 | L287: 27.19 | M287: -1.6299999999999999e-002 | N287: 23 | O287: 0.17899999999999999 | P287: 115.2 | Q287: 14.28 | R287: 3.61 | S287: 190.41 | T287: -5.0000000000000001e-003 | U287: 转股中 | V287: 4年33天 | W287: 2年33天 | X287: 6.9999999999999993e-003 | Y287: 1.3000000000000001e-002 | Z287: 0.7 | AA287: 94 | AB287: -0.11699999999999999 | AC287: -0.122 | AD287: -0.17399999999999999 | AE287: -0.17499999999999999 | AF287: 90.08 | AG287: 89.76 | AH287: 0.97 | AI287: AA- | AJ287: 6.4500000000000002e-002 | AK287: =I287+100*T287 -> 189.00999999999999 | AL287: 188.6 | AM287: 284 | AN287: 98.5 | AO287: 285 | AP287: -7.5999999999999998e-002 | AQ287: 11 | AR287: 百合转债!
A288: 222 | B288: 溢利转债! | C288: 123018 | D288: 43488. | E288: 溢多利 | F288: 300381 | G288: 医药 | H288: 原料药 | I288: 195.28 | J288: -4.2699999999999995e-002 | K288: 4.2699999999999995e-002 | L288: 13.5 | M288: 0. | N288: 16 | O288: 0.14499999999999999 | P288: 114.9 | Q288: 8.29 | R288: 2.34 | S288: 162.85 | T288: 0.19899999999999998 | U288: 转股中 | V288: 4.21年 | W288: 2.21年 | X288: 8.0000000000000002e-003 | Y288: 1.3999999999999999e-002 | Z288: 0.5 | AA288: 65 | AB288: -0.12 | AC288: -0.126 | AD288: -0.16899999999999998 | AE288: -0.17000000000000001 | AF288: 89.3 | AG288: 88.86 | AH288: 0.95 | AI288: AA- | AJ288: 6.4500000000000002e-002 | AK288: =I288+100*T288 -> 215.18000000000001 | AL288: 227.7 | AM288: 290 | AN288: 138.4 | AO288: 290 | AP288: -4.8000000000000001e-002 | AQ288: 12 | AR288: 溢利转债!
A289: 289 | B289: 模塑转债!! | C289: 127004 | D289: 42963. | E289: 模塑科技 | F289: 700 | G289: 汽车 | H289: 零部件制 | I289: 164.1 | J289: -1.26e-002 | K289: 1.09e-002 | L289: 6.07 | M289: -8.199999999999999e-003 | N289: 219 | O289: 0.98799999999999999 | P289: 113.3 | Q289: 7.46 | R289: 2.08 | S289: 81.37 | T289: 1.02 | U289: 转股中 | V289: 2.66年 | W289: 0.66年 | X289: 2.4e-002 | Y289: 1.9e-002 | Z289: 1.3 | AA289: 56 | AB289: -0.13200000000000001 | AC289: -0.13900000000000001 | AD289: -0.47200000000000003 | AE289: -0.47399999999999998 | AF289: 98.4 | AG289: 101.04 | AH289: 0.21 | AI289: AA | AJ289: 4.2300000000000004e-002 | AK289: =I289+100*T289 -> 266.10000000000002 | AL289: 246.8 | AM289: 292 | AN289: 145.8 | AO289: 292 | AP289: -0.106 | AQ289: 38 | AR289: 模塑转债!!
A290: 247 | B290: 盛路转债!! | C290: 128041 | D290: 43326. | E290: 盛路通信 | F290: 2446 | G290: 通信互联 | H290: 通信设备 | I290: 194.55 | J290: -2.18e-002 | K290: 1.0700000000000001e-002 | L290: 7.42 | M290: -1.2e-002 | N290: 628 | O290: 5.8799999999999999 | P290: 114.3 | Q290: 6.85 | R290: 2.34 | S290: 108.32 | T290: 0.79599999999999993 | U290: 转股中 | V290: 3.78年 | W290: 1.78年 | X290: 8.0000000000000002e-003 | Y290: 9.0000000000000011e-003 | Z290: 0.5 | AA290: 67 | AB290: -0.13300000000000001 | AC290: -0.13900000000000001 | AD290: -0.218 | AE290: -0.21899999999999997 | AF290: 94.69 | AG290: 97.6 | AH290: 0.93 | AI290: AA | AJ290: 4.3499999999999997e-002 | AK290: =I290+100*T290 -> 274.14999999999998 | AL290: 280.8 | AM290: 294 | AN290: 183.2 | AO290: 294 | AP290: -6.5000000000000002e-002 | AQ290: 12 | AR290: 盛路转债!!
A291: 169 | B291: 晶瑞转债! | C291: 123031 | D291: 43734. | E291: 晶瑞股份 | F291: 300655 | G291: 化工 | H291: 化工 | I291: 237.5 | J291: -9.7599999999999992e-002 | K291: 4.6699999999999998e-002 | L291: 40.63 | M291: -5.2000000000000005e-002 | N291: 579 | O291: 3.6899999999999999 | P291: 115.8 | Q291: 18.53 | R291: 6.13 | S291: 219.27 | T291: 8.3000000000000004e-002 | U291: 转股中 | V291: 4.90年 | W291: 2.90年 | X291: 8.0000000000000002e-003 | Y291: 1.8000000000000002e-002 | Z291: 0.6 | AA291: 77 | AB291: -0.13800000000000001 | AC291: -0.14300000000000002 | AD291: -0.14300000000000002 | AE291: -0.14400000000000002 | AF291: 82.81 | AG291: 81.62 | AH291: 0.98 | AI291: A+ | AJ291: 7.5499999999999998e-002 | AK291: =I291+100*T291 -> 245.80000000000001 | AL291: 255.7 | AM291: 293 | AN291: 172.9 | AO291: 293 | AP291: 9.6999999999999989e-002 | AQ291: 14 | AR291: 晶瑞转债!
A292: 240 | B292: 东音转债!! | C292: 128043 | D292: 43339. | E292: 罗欣药业 | F292: 2793 | G292: 医药 | H292: 化学制药 | I292: 214 | J292: 0. | K292: -3.7000000000000002e-003 | L292: 13.34 | M292: -3.7000000000000002e-003 | N292: 46 | O292: 0.628 | P292: 114.5 | Q292: 6.22 | R292: 4.98 | S292: 214.47 | T292: -2.e-003 | U292: 转股中 | V292: 3.82年 | W292: 1.82年 | X292: 2.e-003 | Y292: 4.0000000000000001e-003 | Z292: 0.3 | AA292: 194 | AB292: -0.153 | AC292: -0.158 | AD292: -0.23399999999999999 | AE292: -0.23499999999999999 | AF292: 94.54 | AG292: 97.59 | AH292: 1 | AI292: AA | AJ292: 4.3499999999999997e-002 | AK292: =I292+100*T292 -> 213.80000000000001 | AL292: 213.5 | AM292: 288 | AN292: 115.9 | AO292: 287 | AP292: -0.126 | AQ292: 11 | AR292: 东音转债!!
A293: 270 | B293: 天康转债!! | C293: 128030 | D293: 43129. | E293: 天康生物 | F293: 2100 | G293: 农业 | H293: 畜牧业 | I293: 189.95 | J293: -8.8000000000000005e-003 | K293: 2.5999999999999999e-003 | L293: 14.41 | M293: -6.1999999999999998e-003 | N293: 12 | O293: 6.3e-002 | P293: 112.3 | Q293: 7.85 | R293: 2.93 | S293: 183.57 | T293: 3.5000000000000003e-002 | U293: 转股中 | V293: 3.21年 | W293: 1.21年 | X293: 6.0000000000000001e-003 | Y293: 1.2e-002 | Z293: 1 | AA293: 155 | AB293: -0.154 | AC293: -0.159 | AD293: -0.32100000000000001 | AE293: -0.32299999999999995 | AF293: 97 | AG293: 98.25 | AH293: 1 | AI293: AA | AJ293: 4.3499999999999997e-002 | AK293: =I293+100*T293 -> 193.44999999999999 | AL293: 196.3 | AM293: 285 | AN293: 98.1 | AO293: 284 | AP293: -5.7000000000000002e-002 | AQ293: 11 | AR293: 天康转债!!
A294: 254 | B294: 新泉转债!! | C294: 113509 | D294: 43273. | E294: 新泉股份 | F294: 603179 | G294: 汽车 | H294: 零部件制 | I294: 219.11 | J294: -2.4e-002 | K294: 2.8999999999999998e-003 | L294: 31.27 | M294: -2.1600000000000001e-002 | N294: 45 | O294: 0.14899999999999999 | P294: 110.3 | Q294: 14.22 | R294: 5.03 | S294: 219.9 | T294: -4.0000000000000001e-003 | U294: 转股中 | V294: 3.66年 | W294: 1.66年 | X294: 1.3999999999999999e-002 | Y294: 2.9999999999999999e-002 | Z294: 1.3 | AA294: 97 | AB294: -0.17300000000000001 | AC294: -0.17699999999999999 | AD294: -0.26600000000000001 | AE294: -0.26700000000000002 | AF294: 95.16 | AG294: 94.67 | AH294: 0.98 | AI294: AA | AJ294: 4.3499999999999997e-002 | AK294: =I294+100*T294 -> 218.71000000000001 | AL294: 218.3 | AM294: 289 | AN294: 123.2 | AO294: 289 | AP294: -2.2000000000000002e-002 | AQ294: 11 | AR294: 新泉转债!!
A295: 271 | B295: 太阳转债!! | C295: 128029 | D295: 43116. | E295: 太阳纸业 | F295: 2078 | G295: 造纸包装 | H295: 造纸行业 | I295: 168.2 | J295: 1.8e-003 | K295: -2.3300000000000001e-002 | L295: 14.1 | M295: -2.1499999999999998e-002 | N295: 36 | O295: 2.e-002 | P295: 107.8 | Q295: 8.55 | R295: 2.38 | S295: 164.91 | T295: 2.e-002 | U295: 转股中 | V295: 2.21年 | W295: 0.21年 | X295: 2.9999999999999999e-002 | Y295: 5.0000000000000003e-002 | Z295: 11 | AA295: 365 | AB295: -0.184 | AC295: -0.18899999999999997 | AD295: -1.1279999999999999 | AE295: -1.1299999999999999 | AF295: 99.48 | AG295: 98.88 | AH295: 1 | AI295: AA+ | AJ295: 4.0300000000000002e-002 | AK295: =I295+100*T295 -> 170.19999999999999 | AL295: 171.5 | AM295: 278 | AN295: 72 | AO295: 272 | AP295: 1.3999999999999999e-002 | AQ295: 8 | AR295: 太阳转债!!
A296: 221 | B296: 凯龙转债! | C296: 128052 | D296: 43486. | E296: 凯龙股份 | F296: 2783 | G296: 化工 | H296: 化工 | I296: 275 | J296: 2.0400000000000001e-002 | K296: -6.3500000000000001e-002 | L296: 11.98 | M296: -4.3099999999999999e-002 | N296: 283 | O296: 3.2400000000000002 | P296: 115 | Q296: 6.67 | R296: 2.64 | S296: 179.61 | T296: 0.53100000000000003 | U296: 转股中 | V296: 4.21年 | W296: 2.21年 | X296: 6.9999999999999993e-003 | Y296: 1.3000000000000001e-002 | Z296: 0.3 | AA296: 45 | AB296: -0.19 | AC296: -0.19500000000000001 | AD296: -0.22500000000000001 | AE296: -0.22600000000000001 | AF296: 93.66 | AG296: 96.52 | AH296: 1 | AI296: AA | AJ296: 4.3499999999999997e-002 | AK296: =I296+100*T296 -> 328.10000000000002 | AL296: 370.4 | AM296: 296 | AN296: 273.9 | AO296: 296 | AP296: -8.3000000000000004e-002 | AQ296: 12 | AR296: 凯龙转债!
A297: 251 | B297: 广电转债!! | C297: 110044 | D297: 43305. | E297: 广电网络 | F297: 600831 | G297: 传媒娱乐 | H297: 影视娱乐 | I297: 267.32 | J297: -4.7100000000000003e-002 | K297: 3.7499999999999999e-002 | L297: 7.35 | M297: -1.47e-002 | N297: 587 | O297: 3.0099999999999998 | P297: 112.3 | Q297: 6.9 | R297: 1.42 | S297: 106.52 | T297: 1.51 | U297: 转股中 | V297: 3.72年 | W297: 1.72年 | X297: 1.3999999999999999e-002 | Y297: 1.3999999999999999e-002 | Z297: 0.7 | AA297: 52 | AB297: -0.20999999999999999 | AC297: -0.215 | AD297: -0.29600000000000004 | AE297: -0.29699999999999999 | AF297: 94.91 | AG297: 96.12 | AH297: 0.65 | AI297: AA | AJ297: 4.3499999999999997e-002 | AK297: =I297+100*T297 -> 418.31999999999999 | AL297: 428.1 | AM297: 297 | AN297: 332 | AO297: 297 | AP297: -7.0000000000000007e-002 | AQ297: 11 | AR297: 广电转债!!
A298: 139 | B298: 振德转债! | C298: 113555 | D298: 43844. | E298: 振德医疗 | F298: 603301 | G298: 医药 | H298: 医疗器械 | I298: 484 | J298: 3.85e-002 | K298: 6.6e-003 | L298: 68.49 | M298: 4.5599999999999995e-002 | N298: 977 | O298: 0.93000000000000005 | P298: 124.8 | Q298: 14.01 | R298: 6.16 | S298: 488.87 | T298: -1.e-002 | U298: 转股中 | V298: 5.20年 | W298: 3.20年 | X298: 1.6e-002 | Y298: 7.8e-002 | Z298: 2.2 | AA298: 136 | AB298: -0.23300000000000001 | AC298: -0.23800000000000002 | AD298: -0.17600000000000002 | AE298: -0.17600000000000002 | AF298: 84.68 | AG298: 90.21 | AH298: 0.99 | AI298: AA- | AJ298: 6.6100000000000006e-002 | AK298: =I298+100*T298 -> 483. | AL298: 479.1 | AM298: 298 | AN298: 388.9 | AO298: 298 | AP298: 3.5000000000000003e-002 | AQ298: 16 | AR298: 振德转债!
A299: 232 | B299: 特发转债! | C299: 127008 | D299: 43459. | E299: 特发信息 | F299: 70 | G299: 通信互联 | H299: 通信设备 | I299: 258.2 | J299: -1.6399999999999998e-002 | K299: 1.54e-002 | L299: 9.7 | M299: -1.e-003 | N299: 140 | O299: 0.88500000000000001 | P299: 111.1 | Q299: 5.54 | R299: 2.82 | S299: 175.09 | T299: 0.47499999999999998 | U299: 转股中 | V299: 3年41天 | W299: 1年41天 | X299: 8.0000000000000002e-003 | Y299: 1.3000000000000001e-002 | Z299: 0.6 | AA299: 79 | AB299: -0.23999999999999999 | AC299: -0.24399999999999999 | AD299: -0.46100000000000002 | AE299: -0.46200000000000002 | AF299: 96.49 | AG299: 97.52 | AH299: 1 | AI299: AA | AJ299: 4.3499999999999997e-002 | AK299: =I299+100*T299 -> 305.69999999999999 | AL299: 341.3 | AM299: 295 | AN299: 243.8 | AO299: 295 | AP299: -7.0000000000000007e-002 | AQ299: 15 | AR299: 特发转债!
A300: 244 | B300: 横河转债! | C300: 123013 | D300: 43332. | E300: 横河模具 | F300: 300539 | G300: 机械装备 | H300: 专用设备 | I300: 327 | J300: 7.5700000000000003e-002 | K300: -6.59e-002 | L300: 8.44 | M300: 1.6899999999999998e-002 | N300: 1996. | O300: 15.73 | P300: 115.2 | Q300: 9.13 | R300: 3.83 | S300: 92.44 | T300: 2.54 | U300: 转股中 | V300: 3.80年 | W300: 1.80年 | X300: 2.e-002 | Y300: 1.9e-002 | Z300: 0.4 | AA300: 19 | AB300: -0.24299999999999999 | AC300: -0.248 | AD300: -0.313 | AE300: -0.314 | AF300: 89.67 | AG300: 87.89 | AH300: 0.58 | AI300: A+ | AJ300: 7.5499999999999998e-002 | AK300: =I300+100*T300 -> 581. | AL300: 561.6 | AM300: 299 | AN300: 471.9 | AO300: 299 | AP300: -5.2000000000000005e-002 | AQ300: 15 | AR300: 横河转债!
A301: 173 | B301: 英科转债! | C301: 123029 | D301: 43718. | E301: 英科医疗 | F301: 300677 | G301: 医药 | H301: 医疗器械 | I301: 958.809 | J301: 3.9900000000000005e-002 | K301: -2.9999999999999997e-004 | L301: 150.8 | M301: 4.0000000000000001e-002 | N301: 714 | O301: 0.55100000000000005 | P301: 138.2 | Q301: 16.11 | R301: 9.11 | S301: 936.06 | T301: 2.4e-002 | U301: 转股中 | V301: 4.86年 | W301: 2.86年 | X301: 4.0000000000000001e-003 | Y301: 3.7999999999999999e-002 | Z301: 1.4 | AA301: 335 | AB301: -0.33399999999999996 | AC301: -0.34100000000000003 | AD301: -0.23300000000000001 | AE301: -0.23399999999999999 | AF301: 89.08 | AG301: 103.03 | AH301: 0.99 | AI301: AA- | AJ301: 6.4500000000000002e-002 | AK301: =I301+100*T301 -> 961.20899999999995 | AL301: 981.6 | AM301: 300 | AN301: 878.5 | AO301: 300 | AP301: 0.106 | AQ301: 15 | AR301: 英科转债!