A1: 序号 | B1: 转债代码 | C1: 转债名称 | D1: 股票代码 | E1: 股票名称 | F1: 行业 | G1: 子行业 | H1: 转债价格 | I1: 涨跌 | J1: 日内套利 | K1: 股价 | L1: 涨跌 | M1: 剩余本息 | N1: 转股价格 | O1: 转股溢价率 | P1: 转股价值 | Q1: 距离转股日 | R1: 剩余年限 | S1: 回售年限 | T1: 转债余额 | U1: 转债成交额 | V1: 转债换手率 | W1: 余额/市值 | X1: 余额/股本 | Y1: 股票市值 | Z1: P/B | AA1: 税前收益率 | AB1: 税后收益率 | AC1: 税前回售收益 | AD1: 税后回售收益 | AE1: 回售价值 | AF1: 纯债价值 | AG1: 弹性 | AH1: 信用 | AI1: 折现率 | AJ1: 双低 | AK1: 老式双低 | AL1: 老式排名 | AM1: 新式双低 | AN1: 新式排名 | AO1: MA20乖离 | AP1: 热门度 | AQ1: 转债名称
A2: 221 | B2: 128062 | C2: 亚药转债! | D2: 2370 | E2: 亚太药业 | F2: 医药 | G2: 化学制药 | H2: 70.349 | I2: -1.8500000000000003e-002 | J2: 1.8500000000000003e-002 | K2: 4.29 | L2: -3.6000000000000004e-002 | M2: 119.8 | N2: 16.25 | O2: 1.6599999999999999 | P2: 26.4 | Q2: 转股中 | R2: 4.31年 | S2: 2.31年 | T2: 9.64 | U2: 10 | V2: 1.4999999999999999e-002 | W2: 0.41899999999999998 | X2: 0.111 | Y2: 23 | Z2: 7.15 | AA2: 0.13500000000000001 | AB2: 0.125 | AC2: 0.17000000000000001 | AD2: 0.16699999999999998 | AE2: 82.47 | AF2: 81.26 | AG2: 0 | AH2: A- | AI2: 9.64e-002 | AJ2: =H2+100*O2 -> 236.34899999999999 | AK2: 114.3 | AL2: 5 | AM2: 31.8 | AN2: 58 | AO2: -4.4999999999999998e-002 | AP2: 85 | AQ2: 亚药转债!
A3: 80 | B3: 127018 | C3: 本钢转债! | D3: 761 | E3: 本钢板材 | F3: 钢铁 | G3: 炼钢 | H3: 82.29 | I3: -7.4999999999999997e-003 | J3: 3.4000000000000002e-003 | K3: 3.26 | L3: -2.4e-002 | M3: 128.6 | N3: 5.03 | O3: 0.27000000000000002 | P3: 64.81 | Q3: 24天 | R3: 5.55年 | S3: 3.55年 | T3: 68 | U3: 47 | V3: 8.0000000000000002e-003 | W3: 0.53799999999999992 | X3: 0.34899999999999998 | Y3: 126 | Z3: 0.64 | AA3: 8.6599999999999996e-002 | AB3: 7.6999999999999999e-002 | AC3: 7.2900000000000006e-002 | AD3: 6.9099999999999995e-002 | AE3: 88.72 | AF3: 98.4 | AG3: 0.17 | AH3: AAA | AI3: 5.0999999999999997e-002 | AJ3: =H3+100*O3 -> 109.29000000000001 | AK3: 99.8 | AL3: 1 | AM3: 1.4 | AN3: 1 | AO3: -2.8999999999999998e-002 | AP3: 39 | AQ3: 本钢转债!
A4: 240 | B4: 113527 | C4: 维格转债! | D4: 603518 | E4: 锦泓集团 | F4: 服装纺织 | G4: 服装行业 | H4: 89.87 | I4: -1.9e-003 | J4: 8.9999999999999998e-004 | K4: 5.79 | L4: -1.1899999999999999e-002 | M4: 120.2 | N4: 9.85 | O4: 0.52900000000000003 | P4: 58.78 | Q4: 转股中 | R4: 4年44天 | S4: 2年44天 | T4: 7.46 | U4: 4.8 | V4: 6.9999999999999993e-003 | W4: 0.51000000000000001 | X4: 0.29999999999999999 | Y4: 15 | Z4: 0.92 | AA4: 7.4900000000000008e-002 | AB4: 6.5500000000000003e-002 | AC4: 6.4699999999999994e-002 | AD4: 6.13e-002 | AE4: 91.86 | AF4: 97.11 | AG4: 0.08 | AH4: AA | AI4: 5.4400000000000004e-002 | AJ4: =H4+100*O4 -> 142.77000000000001 | AK4: 121 | AL4: 21 | AM4: 23.8 | AN4: 11 | AO4: -2.4e-002 | AP4: 100 | AQ4: 维格转债!
A5: 294 | B5: 128023 | C5: 亚太转债! | D5: 2284 | E5: 亚太股份 | F5: 汽车 | G5: 零部件制 | H5: 95.75 | I5: -4.3e-003 | J5: 4.5000000000000005e-003 | K5: 5.74 | L5: 8.8000000000000005e-003 | M5: 111.3 | N5: 10.34 | O5: 0.72499999999999998 | P5: 55.51 | Q5: 转股中 | R5: 2.98年 | S5: 0.98年 | T5: 9.99 | U5: 3.8 | V5: 4.0000000000000001e-003 | W5: 0.23600000000000002 | X5: 0.13100000000000001 | Y5: 42 | Z5: 1.74 | AA5: 5.2600000000000001e-002 | AB5: 4.5100000000000001e-002 | AC5: 5.5e-002 | AD5: 5.1699999999999996e-002 | AE5: 97.01 | AF5: 98.36 | AG5: 0.02 | AH5: AA | AI5: 4.2999999999999997e-002 | AJ5: =H5+100*O5 -> 168.25 | AK5: 136 | AL5: 175 | AM5: 37.6 | AN5: 118 | AO5: -4.0999999999999995e-002 | AP5: 66 | AQ5: 亚太转债!
A6: 306 | B6: 128015 | C6: 久其转债! | D6: 2279 | E6: 久其软件 | F6: 计算机及 | G6: 软件开发 | H6: 98.834 | I6: -4.6999999999999993e-003 | J6: 4.6999999999999993e-003 | K6: 5.21 | L6: -3.5200000000000002e-002 | M6: 110.8 | N6: 9.48 | O6: 0.79799999999999993 | P6: 54.96 | Q6: 转股中 | R6: 2.49年 | S6: 0.49年 | T6: 7.8 | U6: 9.3 | V6: 1.2e-002 | W6: 0.20999999999999999 | X6: 0.11599999999999999 | Y6: 37 | Z6: 5.25 | AA6: 4.7699999999999992e-002 | AB6: 3.9199999999999999e-002 | AC6: 4.2300000000000004e-002 | AD6: 3.7400000000000003e-002 | AE6: 96.85 | AF6: 92.8 | AG6: 0 | AH6: A+ | AI6: 7.4999999999999997e-002 | AJ6: =H6+100*O6 -> 178.63400000000001 | AK6: 142.7 | AL6: 225 | AM6: 45.9 | AN6: 179 | AO6: -3.7999999999999999e-002 | AP6: 56 | AQ6: 久其转债!
A7: 275 | B7: 128037 | C7: 岩土转债! | D7: 2542 | E7: 中化岩土 | F7: 建筑 | G7: 建筑工程 | H7: 96.838 | I7: -8.8000000000000005e-003 | J7: 8.8000000000000005e-003 | K7: 3.2 | L7: -3.0299999999999997e-002 | M7: 112.3 | N7: 7.99 | O7: 1.4199999999999999 | P7: 40.05 | Q7: 转股中 | R7: 3.26年 | S7: 1.26年 | T7: 5.99 | U7: 3.6 | V7: 6.0000000000000001e-003 | W7: 0.10400000000000001 | X7: 4.2000000000000003e-002 | Y7: 58 | Z7: 1.42 | AA7: 4.7599999999999996e-002 | AB7: 4.0099999999999997e-002 | AC7: 4.3299999999999998e-002 | AD7: 3.9199999999999999e-002 | AE7: 96.69 | AF7: 97.78 | AG7: 0 | AH7: AA | AI7: 4.4400000000000002e-002 | AJ7: =H7+100*O7 -> 238.83799999999999 | AK7: 153.6 | AL7: 270 | AM7: 55.8 | AN7: 237 | AO7: -6.9000000000000006e-002 | AP7: 48 | AQ7: 岩土转债!
A8: 69 | B8: 127019 | C8: 国城转债! | D8: 688 | E8: 国城矿业 | F8: 有色金属 | G8: 锌铅镍锡 | H8: 90.8 | I8: 1.e-004 | J8: 5.0000000000000001e-004 | K8: 10.65 | L8: 9.4999999999999998e-003 | M8: 115.1 | N8: 21.07 | O8: 0.79599999999999993 | P8: 50.55 | Q8: 41天 | R8: 5.59年 | S8: 3.59年 | T8: 8.5 | U8: 30 | V8: 3.9e-002 | W8: 7.0000000000000007e-002 | X8: 3.5000000000000003e-002 | Y8: 121 | Z8: 5.48 | AA8: 4.41e-002 | AB8: 3.9e-002 | AC8: 3.6000000000000004e-002 | AD8: 3.4000000000000002e-002 | AE8: 87.61 | AF8: 89.92 | AG8: 0.07 | AH8: AA | AI8: 4.5999999999999999e-002 | AJ8: =H8+100*O8 -> 170.39999999999998 | AK8: 131.1 | AL8: 135 | AM8: 41.1 | AN8: 144 | AO8: -1.3000000000000001e-002 | AP8: 28 | AQ8: 国城转债!
A9: 219 | B9: 128063 | C9: 未来转债 | D9: 2631 | E9: 德尔未来 | F9: 其他 | G9: 家居用品 | H9: 107.4 | I9: -4.0000000000000001e-003 | J9: -2.3999999999999998e-003 | K9: 7.62 | L9: -1.55e-002 | M9: 128.2 | N9: 8.63 | O9: 0.21600000000000003 | P9: 88.3 | Q9: 转股中 | R9: 4.31年 | S9: 3.31年 | T9: 6.3 | U9: 17 | V9: 2.4e-002 | W9: 0.124 | X9: 0.11 | Y9: 51 | Z9: 2.89 | AA9: 4.3200000000000002e-002 | AB9: 3.1899999999999998e-002 | AC9: 4.0000000000000001e-003 | AD9: -8.0000000000000004e-004 | AE9: 87.82 | AF9: 98.38 | AG9: 0.41 | AH9: AA- | AI9: 6.54e-002 | AJ9: =H9+100*O9 -> 129. | AK9: 126.5 | AL9: 81 | AM9: 28.1 | AN9: 28 | AO9: 4.7e-002 | AP9: 34 | AQ9: 未来转债
A10: 82 | B10: 113589 | C10: 天创转债! | D10: 603608 | E10: 天创时尚 | F10: 服装纺织 | G10: 鞋服行业 | H10: 91.72 | I10: 1.1999999999999999e-003 | J10: -2.0000000000000001e-004 | K10: 6.99 | L10: 8.6999999999999994e-003 | M10: 115.3 | N10: 12.44 | O10: 0.63200000000000001 | P10: 56.19 | Q10: 22天 | R10: 5.53年 | S10: 3.53年 | T10: 6 | U10: 3.1 | V10: 6.0000000000000001e-003 | W10: 0.20000000000000001 | X10: 0.11199999999999999 | Y10: 30 | Z10: 1.41 | AA10: 4.3099999999999999e-002 | AB10: 3.78e-002 | AC10: 3.4300000000000004e-002 | AD10: 3.2199999999999999e-002 | AE10: 88.03 | AF10: 90.34 | AG10: 0.11 | AH10: AA | AI10: 4.5999999999999999e-002 | AJ10: =H10+100*O10 -> 154.92000000000002 | AK10: 127.3 | AL10: 92 | AM10: 36.9 | AN10: 109 | AO10: -6.3e-002 | AP10: 13 | AQ10: 天创转债!
A11: 285 | B11: 113017 | C11: 吉视转债! | D11: 601929 | E11: 吉视传媒 | F11: 传媒娱乐 | G11: 影视娱乐 | H11: 96.89 | I11: -3.2000000000000002e-003 | J11: 1.6000000000000001e-003 | K11: 2 | L11: -1.9599999999999999e-002 | M11: 109.8 | N11: 2.95 | O11: 0.42899999999999999 | P11: 67.8 | Q11: 转股中 | R11: 3年16天 | S11: 1年16天 | T11: 15.6 | U11: 6.7 | V11: 4.0000000000000001e-003 | W11: 0.251 | X11: 0.17000000000000001 | Y11: 62 | Z11: 0.94 | AA11: 4.2900000000000001e-002 | AB11: 3.6499999999999998e-002 | AC11: 4.8600000000000004e-002 | AD11: 4.41e-002 | AE11: 97.58 | AF11: 97.04 | AG11: 0.08 | AH11: AA+ | AI11: 4.24e-002 | AJ11: =H11+100*O11 -> 139.78999999999999 | AK11: 126 | AL11: 75 | AM11: 28.4 | AN11: 30 | AO11: -4.2000000000000003e-002 | AP11: 54 | AQ11: 吉视转债!
A12: 224 | B12: 113530 | C12: 大丰转债! | D12: 603081 | E12: 大丰实业 | F12: 建筑 | G12: 装饰工程 | H12: 102.18 | I12: -5.4000000000000003e-003 | J12: 2.3e-003 | K12: 11.92 | L12: -1.9699999999999999e-002 | M12: 121.6 | N12: 16.64 | O12: 0.42599999999999999 | P12: 71.63 | Q12: 转股中 | R12: 4.29年 | S12: 2.29年 | T12: 6.3 | U12: 2.1 | V12: 3.0000000000000001e-003 | W12: 0.13200000000000001 | X12: 9.4e-002 | Y12: 48 | Z12: 2.33 | AA12: 4.2300000000000004e-002 | AB12: 3.32e-002 | AC12: 5.4000000000000003e-003 | AD12: 2.5000000000000001e-003 | AE12: 93.15 | AF12: 101.33 | AG12: 0.15 | AH12: AA | AI12: 4.4400000000000002e-002 | AJ12: =H12+100*O12 -> 144.78 | AK12: 132.7 | AL12: 150 | AM12: 31.4 | AN12: 52 | AO12: 4.0000000000000001e-003 | AP12: 34 | AQ12: 大丰转债!
A13: 291 | B13: 123004 | C13: 铁汉转债! | D13: 300197 | E13: 铁汉生态 | F13: 城市公用 | G13: 生态环境 | H13: 98.118 | I13: -4.8999999999999998e-003 | J13: 5.0000000000000001e-004 | K13: 3.04 | L13: -2.5600000000000001e-002 | M13: 109.8 | N13: 3.98 | O13: 0.28499999999999998 | P13: 76.38 | Q13: 转股中 | R13: 3年7天 | S13: 1年7天 | T13: 8.03 | U13: 12 | V13: 1.4999999999999999e-002 | W13: 0.11199999999999999 | X13: 8.5999999999999993e-002 | Y13: 72 | Z13: 1.38 | AA13: 3.8800000000000001e-002 | AB13: 3.2400000000000005e-002 | AC13: 3.8399999999999997e-002 | AD13: 3.39e-002 | AE13: 97.46 | AF13: 96.59 | AG13: 0.17 | AH13: AA | AI13: 4.4400000000000002e-002 | AJ13: =H13+100*O13 -> 126.61799999999999 | AK13: 119.9 | AL13: 13 | AM13: 22.4 | AN13: 9 | AO13: -9.1999999999999998e-002 | AP13: 42 | AQ13: 铁汉转债!
A14: 138 | B14: 113569 | C14: 科达转债! | D14: 603660 | E14: 苏州科达 | F14: 通信互联 | G14: 物联网 | H14: 99.73 | I14: -4.8999999999999998e-003 | J14: 2.2000000000000001e-003 | K14: 7.74 | L14: -2.8900000000000002e-002 | M14: 120.7 | N14: 14.84 | O14: 0.91200000000000003 | P14: 52.16 | Q14: 转股中 | R14: 5.24年 | S14: 3.24年 | T14: 5.16 | U14: 2.4 | V14: 5.0000000000000001e-003 | W14: 0.13400000000000001 | X14: 7.0000000000000007e-002 | Y14: 39 | Z14: 2.26 | AA14: 3.7900000000000003e-002 | AB14: 3.0699999999999998e-002 | AC14: 1.26e-002 | AD14: 1.03e-002 | AE14: 83.64 | AF14: 86.58 | AG14: 0.09 | AH14: AA- | AI14: 6.7000000000000004e-002 | AJ14: =H14+100*O14 -> 190.93000000000001 | AK14: 147.3 | AL14: 245 | AM14: 60.7 | AN14: 252 | AO14: -7.400000000000001e-002 | AP14: 23 | AQ14: 科达转债!
A15: 78 | B15: 113591 | C15: 胜达转债! | D15: 603687 | E15: 大胜达 | F15: 造纸包装 | G15: 包装用纸 | H15: 99.85 | I15: -2.0999999999999999e-003 | J15: 1.01e-002 | K15: 11.1 | L15: 2.0199999999999999e-002 | M15: 122.2 | N15: 14.73 | O15: 0.32500000000000001 | P15: 75.36 | Q15: 28天 | R15: 5.55年 | S15: 3.55年 | T15: 5.5 | U15: 6.8 | V15: 1.2e-002 | W15: 0.121 | X15: 9.0999999999999998e-002 | Y15: 46 | Z15: 2.93 | AA15: 3.7900000000000003e-002 | AB15: 3.0699999999999998e-002 | AC15: 1.1399999999999999e-002 | AD15: 9.1999999999999998e-003 | AE15: 82.03 | AF15: 85.92 | AG15: 0.4 | AH15: AA- | AI15: 6.7000000000000004e-002 | AJ15: =H15+100*O15 -> 132.34999999999999 | AK15: 124.3 | AL15: 55 | AM15: 38.4 | AN15: 124 | AO15: 4.9000000000000002e-002 | AP15: 19 | AQ15: 胜达转债!
A16: 209 | B16: 113535 | C16: 大业转债! | D16: 603278 | E16: 大业股份 | F16: 汽车 | G16: 零部件制 | H16: 99.89 | I16: -2.0999999999999999e-003 | J16: 4.0000000000000002e-004 | K16: 8.15 | L16: -1.5700000000000002e-002 | M16: 113.1 | N16: 12.4 | O16: 0.52000000000000002 | P16: 65.73 | Q16: 转股中 | R16: 3.41年 | S16: 1.41年 | T16: 5 | U16: 2.6 | V16: 5.0000000000000001e-003 | W16: 0.21199999999999999 | X16: 0.13900000000000001 | Y16: 24 | Z16: 1.44 | AA16: 3.7599999999999995e-002 | AB16: 3.0299999999999997e-002 | AC16: 1.2500000000000001e-002 | AD16: 1.01e-002 | AE16: 95.15 | AF16: 97.73 | AG16: 0.11 | AH16: AA | AI16: 4.4400000000000002e-002 | AJ16: =H16+100*O16 -> 151.88999999999999 | AK16: 134.1 | AL16: 165 | AM16: 36.3 | AN16: 103 | AO16: -4.2999999999999997e-002 | AP16: 48 | AQ16: 大业转债!
A17: 154 | B17: 128093 | C17: 百川转债! | D17: 2455 | E17: 百川股份 | F17: 化工 | G17: 化工 | H17: 108.8 | I17: -7.4999999999999997e-003 | J17: -1.4199999999999999e-002 | K17: 5.41 | L17: -4.2500000000000003e-002 | M17: 130.3 | N17: 5.87 | O17: 0.18100000000000002 | P17: 92.16 | Q17: 转股中 | R17: 5年23天 | S17: 3年23天 | T17: 5.2 | U17: 11 | V17: 2.e-002 | W17: 0.18600000000000003 | X17: 0.17100000000000001 | Y17: 28 | Z17: 2.16 | AA17: 3.7599999999999995e-002 | AB17: 2.7400000000000001e-002 | AC17: -4.0999999999999995e-003 | AD17: -8.3999999999999995e-003 | AE17: 87.47 | AF17: 94.98 | AG17: 0.51 | AH17: AA- | AI17: 6.7000000000000004e-002 | AJ17: =H17+100*O17 -> 126.90000000000001 | AK17: 125.4 | AL17: 69 | AM17: 30.5 | AN17: 42 | AO17: -2.e-002 | AP17: 46 | AQ17: 百川转债!
A18: 266 | B18: 110045 | C18: 海澜转债! | D18: 600398 | E18: 海澜之家 | F18: 服装纺织 | G18: 服装行业 | H18: 97.73 | I18: 2.0000000000000001e-004 | J18: 4.0000000000000002e-004 | K18: 6.72 | L18: 1.5100000000000001e-002 | M18: 111.1 | N18: 11.75 | O18: 0.70900000000000007 | P18: 57.19 | Q18: 转股中 | R18: 3.59年 | S18: 1.59年 | T18: 29.5 | U18: 8.5 | V18: 3.0000000000000001e-003 | W18: 0.10199999999999999 | X18: 5.7999999999999996e-002 | Y18: 290 | Z18: 2.28 | AA18: 3.6900000000000002e-002 | AB18: 3.0899999999999997e-002 | AC18: 2.4900000000000002e-002 | AD18: 2.2599999999999999e-002 | AE18: 94.9 | AF18: 95.93 | AG18: 0.04 | AH18: AA+ | AI18: 4.24e-002 | AJ18: =H18+100*O18 -> 168.63 | AK18: 138.3 | AL18: 194 | AM18: 42.3 | AN18: 155 | AO18: -6.9999999999999993e-003 | AP18: 60 | AQ18: 海澜转债!
A19: 133 | B19: 128100 | C19: 搜特转债! | D19: 2503 | E19: 搜于特 | F19: 服装纺织 | G19: 服装行业 | H19: 97.601 | I19: -1.11e-002 | J19: 2.0999999999999999e-003 | K19: 2.15 | L19: -3.15e-002 | M19: 117.3 | N19: 2.9 | O19: 0.316 | P19: 74.14 | Q19: 转股中 | R19: 5.25年 | S19: 3.25年 | T19: 8 | U19: 4.5 | V19: 6.0000000000000001e-003 | W19: 0.12 | X19: 8.900000000000001e-002 | Y19: 66 | Z19: 1.21 | AA19: 3.6400000000000002e-002 | AB19: 3.0299999999999997e-002 | AC19: 1.84e-002 | AD19: 1.61e-002 | AE19: 89.17 | AF19: 93.09 | AG19: 0.29 | AH19: AA | AI19: 4.5999999999999999e-002 | AJ19: =H19+100*O19 -> 129.20099999999999 | AK19: 121.1 | AL19: 22 | AM19: 28 | AN19: 27 | AO19: -7.0999999999999994e-002 | AP19: 42 | AQ19: 搜特转债!
A20: 44 | B20: 113600 | C20: 新星转债! | D20: 603978 | E20: 深圳新星 | F20: 有色金属 | G20: 有色行业 | H20: 103.64 | I20: -2.0999999999999999e-003 | J20: -8.8000000000000005e-003 | K20: 18.24 | L20: -2.8799999999999999e-002 | M20: 126 | N20: 23.85 | O20: 0.35499999999999998 | P20: 76.48 | Q20: 2月10天 | R20: 5.67年 | S20: 3.67年 | T20: 5.95 | U20: 1.8 | V20: 3.0000000000000001e-003 | W20: 0.20399999999999999 | X20: 0.156 | Y20: 29 | Z20: 1.91 | AA20: 3.5699999999999996e-002 | AB20: 2.7799999999999998e-002 | AC20: 7.000000000000001e-004 | AD20: -1.2999999999999999e-003 | AE20: 81.22 | AF20: 87.85 | AG20: 0.38 | AH20: AA- | AI20: 6.7000000000000004e-002 | AJ20: =H20+100*O20 -> 139.13999999999999 | AK20: 130.8 | AL20: 134 | AM20: 43 | AN20: 162 | AO20: -7.400000000000001e-002 | AP20: 11 | AQ20: 新星转债!
A21: 110 | B21: 113573 | C21: 纵横转债! | D21: 603602 | E21: 纵横通信 | F21: 通信互联 | G21: 通信设备 | H21: 104.08 | I21: -1.04e-002 | J21: 1.41e-002 | K21: 13.59 | L21: 1.04e-002 | M21: 124.7 | N21: 18.81 | O21: 0.441 | P21: 72.25 | Q21: 转股中 | R21: 5.35年 | S21: 3.35年 | T21: 2.7 | U21: 52 | V21: 0.183 | W21: 9.6999999999999989e-002 | X21: 7.0000000000000007e-002 | Y21: 28 | Z21: 4.11 | AA21: 3.5200000000000002e-002 | AB21: 2.7099999999999999e-002 | AC21: 1.5e-003 | AD21: -1.1000000000000001e-003 | AE21: 80.63 | AF21: 84.28 | AG21: 0.36 | AH21: A+ | AI21: 7.8e-002 | AJ21: =H21+100*O21 -> 148.18000000000001 | AK21: 135.9 | AL21: 174 | AM21: 51.6 | AN21: 217 | AO21: 7.9000000000000001e-002 | AP21: 18 | AQ21: 纵横转债!
A22: 245 | B22: 113524 | C22: 奇精转债! | D22: 603677 | E22: 奇精机械 | F22: 家电 | G22: 零部件制 | H22: 103 | I22: -1.8799999999999997e-002 | J22: -8.3000000000000001e-003 | K22: 11.24 | L22: -9.7899999999999987e-002 | M22: 117.9 | N22: 14.08 | O22: 0.28999999999999998 | P22: 79.83 | Q22: 转股中 | R22: 4年3.1天 | S22: 2年3.1天 | T22: 3.3 | U22: 22 | V22: 6.5000000000000002e-002 | W22: 0.153 | X22: 0.122 | Y22: 22 | Z22: 2.26 | AA22: 3.5099999999999999e-002 | AB22: 2.6800000000000001e-002 | AC22: 1.8e-003 | AD22: -1.2999999999999999e-003 | AE22: 94.19 | AF22: 99.44 | AG22: 0.28 | AH22: AA | AI22: 4.4400000000000002e-002 | AJ22: =H22+100*O22 -> 132. | AK22: 126.2 | AL22: 79 | AM22: 26.7 | AN22: 23 | AO22: -0.10099999999999999 | AP22: 46 | AQ22: 奇精转债!
A23: 257 | B23: 128044 | C23: 岭南转债! | D23: 2717 | E23: 岭南股份 | F23: 城市公用 | G23: 生态环境 | H23: 98.33 | I23: -2.7000000000000001e-003 | J23: 2.7000000000000001e-003 | K23: 3.99 | L23: 0. | M23: 111.3 | N23: 5.91 | O23: 0.45600000000000002 | P23: 67.51 | Q23: 转股中 | R23: 3.67年 | S23: 1.67年 | T23: 6.59 | U23: 2.4 | V23: 4.0000000000000001e-003 | W23: 0.10800000000000001 | X23: 7.2999999999999995e-002 | Y23: 61 | Z23: 1.24 | AA23: 3.5000000000000003e-002 | AB23: 2.8999999999999998e-002 | AC23: 2.46e-002 | AD23: 2.1499999999999998e-002 | AE23: 94.96 | AF23: 95.17 | AG23: 0.14 | AH23: AA | AI23: 4.4400000000000002e-002 | AJ23: =H23+100*O23 -> 143.93000000000001 | AK23: 129.1 | AL23: 112 | AM23: 34 | AN23: 79 | AO23: -2.e-002 | AP23: 32 | AQ23: 岭南转债!
A24: 22 | B24: 123069 | C24: 金诺转债 | D24: 300505 | E24: 川金诺 | F24: 化工 | G24: 农化 | H24: 103.8 | I24: -1.9699999999999999e-002 | J24: 0. | K24: 15.4 | L24: -4.53e-002 | M24: 126 | N24: 19.15 | O24: 0.29100000000000004 | P24: 80.42 | Q24: 4月12天 | R24: 5.85年 | S24: 3.85年 | T24: 3.68 | U24: 17 | V24: 4.4999999999999998e-002 | W24: 0.183 | X24: 0.14699999999999999 | Y24: 20 | Z24: 2.09 | AA24: 3.4300000000000004e-002 | AB24: 2.6699999999999998e-002 | AC24: 2.9999999999999997e-004 | AD24: -1.6000000000000001e-003 | AE24: 80.3 | AF24: 86.85 | AG24: 0.44 | AH24: AA- | AI24: 6.7000000000000004e-002 | AJ24: =H24+100*O24 -> 132.90000000000001 | AK24: 127.2 | AL24: 90 | AM24: 40.3 | AN24: 136 | AO24: -8.900000000000001e-002 | AP24: 9 | AQ24: 金诺转债
A25: 31 | B25: 128132 | C25: 交建转债! | D25: 2941 | E25: 新疆交建 | F25: 建筑 | G25: 建筑工程 | H25: 97.462 | I25: -5.6000000000000008e-003 | J25: 2.8999999999999998e-003 | K25: 12.72 | L25: -1.1699999999999999e-002 | M25: 117.3 | N25: 18.57 | O25: 0.42299999999999999 | P25: 68.5 | Q25: 3月11天 | R25: 5.76年 | S25: 3.76年 | T25: 8.5 | U25: 5.7 | V25: 6.9999999999999993e-003 | W25: 0.10400000000000001 | X25: 7.0999999999999994e-002 | Y25: 82 | Z25: 3.39 | AA25: 3.3300000000000003e-002 | AB25: 2.7699999999999999e-002 | AC25: 1.6299999999999999e-002 | AD25: 1.44e-002 | AE25: 87.14 | AF25: 90.97 | AG25: 0.23 | AH25: AA | AI25: 4.5999999999999999e-002 | AJ25: =H25+100*O25 -> 139.762 | AK25: 126.4 | AL25: 80 | AM25: 35.5 | AN25: 97 | AO25: -5.2999999999999999e-002 | AP25: 11 | AQ25: 交建转债!
A26: 236 | B26: 113528 | C26: 长城转债! | D26: 603897 | E26: 长城科技 | F26: 机械装备 | G26: 专用设备 | H26: 102.85 | I26: -5.5000000000000005e-003 | J26: -3.2000000000000002e-003 | K26: 18.04 | L26: -2.5899999999999999e-002 | M26: 117.6 | N26: 23.45 | O26: 0.33700000000000002 | P26: 76.93 | Q26: 转股中 | R26: 4.22年 | S26: 2.22年 | T26: 6.34 | U26: 2.3 | V26: 4.0000000000000001e-003 | W26: 0.19699999999999998 | X26: 0.152 | Y26: 32 | Z26: 1.76 | AA26: 3.3099999999999997e-002 | AB26: 2.5399999999999999e-002 | AC26: 4.5000000000000005e-003 | AD26: 1.1999999999999999e-003 | AE26: 89.55 | AF26: 90.64 | AG26: 0.34 | AH26: AA- | AI26: 6.54e-002 | AJ26: =H26+100*O26 -> 136.55000000000001 | AK26: 128.8 | AL26: 107 | AM26: 38.1 | AN26: 120 | AO26: -0.10099999999999999 | AP26: 44 | AQ26: 长城转债!
A27: 168 | B27: 128085 | C27: 鸿达转债 | D27: 2002 | E27: 鸿达兴业 | F27: 化工 | G27: 化工 | H27: 106.549 | I27: -8.8000000000000005e-003 | J27: 5.0000000000000001e-003 | K27: 3.77 | L27: -7.9000000000000008e-003 | M27: 124.8 | N27: 3.92 | O27: 0.10800000000000001 | P27: 96.17 | Q27: 转股中 | R27: 5年5.1天 | S27: 3年5.1天 | T27: 24.3 | U27: 12 | V27: 5.0000000000000001e-003 | W27: 0.249 | X27: 0.23899999999999999 | Y27: 98 | Z27: 1.37 | AA27: 3.2799999999999996e-002 | AB27: 2.4199999999999999e-002 | AC27: -6.8000000000000005e-003 | AD27: -9.3999999999999986e-003 | AE27: 90.56 | AF27: 100.13 | AG27: 0.48 | AH27: AA | AI27: 4.5999999999999999e-002 | AJ27: =H27+100*O27 -> 117.349 | AK27: 116.9 | AL27: 10 | AM27: 16.8 | AN27: 3 | AO27: -5.5999999999999994e-002 | AP27: 88 | AQ27: 鸿达转债
A28: 278 | B28: 113505 | C28: 杭电转债! | D28: 603618 | E28: 杭电股份 | F28: 能源电力 | G28: 电力设备 | H28: 101.62 | I28: -1.34e-002 | J28: 6.8999999999999999e-003 | K28: 5.6 | L28: -2.7799999999999998e-002 | M28: 112.3 | N28: 7.14 | O28: 0.29600000000000004 | P28: 78.43 | Q28: 转股中 | R28: 3.23年 | S28: 1.23年 | T28: 7.5 | U28: 15 | V28: 2.e-002 | W28: 0.19399999999999998 | X28: 0.152 | Y28: 39 | Z28: 1.53 | AA28: 3.2099999999999997e-002 | AB28: 2.4799999999999999e-002 | AC28: 8.3999999999999995e-003 | AD28: 4.4000000000000003e-003 | AE28: 96.8 | AF28: 97.88 | AG28: 0.23 | AH28: AA | AI28: 4.4400000000000002e-002 | AJ28: =H28+100*O28 -> 131.22 | AK28: 124.8 | AL28: 59 | AM28: 26.9 | AN28: 24 | AO28: -5.9000000000000004e-002 | AP28: 39 | AQ28: 杭电转债!
A29: 284 | B29: 128033 | C29: 迪龙转债! | D29: 2658 | E29: 雪迪龙 | F29: 城市公用 | G29: 三废处理 | H29: 99.996 | I29: -8.8000000000000005e-003 | J29: 6.3e-003 | K29: 6.05 | L29: -2.2599999999999999e-002 | M29: 109.8 | N29: 8.83 | O29: 0.45899999999999996 | P29: 68.52 | Q29: 转股中 | R29: 3年16天 | S29: 1年16天 | T29: 5.2 | U29: 1.7 | V29: 3.0000000000000001e-003 | W29: 0.14199999999999999 | X29: 9.6999999999999989e-002 | Y29: 37 | Z29: 1.81 | AA29: 3.1899999999999998e-002 | AB29: 2.5600000000000001e-002 | AC29: 2.1299999999999999e-002 | AD29: 1.7000000000000001e-002 | AE29: 97.35 | AF29: 96.48 | AG29: 0.11 | AH29: AA | AI29: 4.4400000000000002e-002 | AJ29: =H29+100*O29 -> 145.89599999999999 | AK29: 131.5 | AL29: 139 | AM29: 34.1 | AN29: 80 | AO29: -3.6000000000000004e-002 | AP29: 36 | AQ29: 迪龙转债!
A30: 76 | B30: 128117 | C30: 道恩转债 | D30: 2838 | E30: 道恩股份 | F30: 化工 | G30: 橡胶塑料 | H30: 104.192 | I30: -1.1599999999999999e-002 | J30: 2.2000000000000001e-003 | K30: 23 | L30: -2.2099999999999998e-002 | M30: 123.5 | N30: 29.07 | O30: 0.317 | P30: 79.12 | Q30: 28天 | R30: 5.56年 | S30: 3.56年 | T30: 3.6 | U30: 6 | V30: 1.6e-002 | W30: 3.7999999999999999e-002 | X30: 2.9999999999999999e-002 | Y30: 94 | Z30: 5.44 | AA30: 3.1699999999999999e-002 | AB30: 2.4300000000000002e-002 | AC30: -8.9999999999999998e-004 | AD30: -2.8999999999999998e-003 | AE30: 81.76 | AF30: 86.74 | AG30: 0.43 | AH30: AA- | AI30: 6.7000000000000004e-002 | AJ30: =H30+100*O30 -> 135.892 | AK30: 129.3 | AL30: 115 | AM30: 42.5 | AN30: 156 | AO30: -6.2e-002 | AP30: 17 | AQ30: 道恩转债
A31: 234 | B31: 110052 | C31: 贵广转债! | D31: 600996 | E31: 贵广网络 | F31: 传媒娱乐 | G31: 影视娱乐 | H31: 104.2 | I31: -8.9999999999999998e-004 | J31: -3.2000000000000002e-003 | K31: 5.72 | L31: -2.3900000000000001e-002 | M31: 118.5 | N31: 7.94 | O31: 0.44600000000000001 | P31: 72.04 | Q31: 转股中 | R31: 4.23年 | S31: 2.23年 | T31: 15.3 | U31: 8 | V31: 5.0000000000000001e-003 | W31: 0.254 | X31: 0.183 | Y31: 60 | Z31: 1.33 | AA31: 3.1600000000000003e-002 | AB31: 2.3599999999999999e-002 | AC31: -1.5e-003 | AD31: -4.5999999999999999e-003 | AE31: 94.12 | AF31: 99.83 | AG31: 0.17 | AH31: AA+ | AI31: 4.24e-002 | AJ31: =H31+100*O31 -> 148.80000000000001 | AK31: 136.4 | AL31: 181 | AM31: 36.5 | AN31: 105 | AO31: -8.5999999999999993e-002 | AP31: 20 | AQ31: 贵广转债!
A32: 255 | B32: 113519 | C32: 长久转债! | D32: 603569 | E32: 长久物流 | F32: 交通运输 | G32: 物流业 | H32: 105.95 | I32: -2.3999999999999998e-003 | J32: 1.2999999999999999e-003 | K32: 8.19 | L32: -6.0999999999999995e-003 | M32: 119.3 | N32: 11.15 | O32: 0.442 | P32: 73.45 | Q32: 转股中 | R32: 3.91年 | S32: 1.91年 | T32: 6.97 | U32: 0.5 | V32: 1.e-003 | W32: 0.152 | X32: 0.11199999999999999 | Y32: 46 | Z32: 2.15 | AA32: 3.1400000000000004e-002 | AB32: 2.2499999999999999e-002 | AC32: -1.4499999999999999e-002 | AD32: -1.7100000000000001e-002 | AE32: 94 | AF32: 100.96 | AG32: 0.17 | AH32: AA | AI32: 4.4400000000000002e-002 | AJ32: =H32+100*O32 -> 150.15000000000001 | AK32: 138.4 | AL32: 196 | AM32: 37.5 | AN32: 115 | AO32: -5.4000000000000006e-002 | AP32: 17 | AQ32: 长久转债!
A33: 203 | B33: 123028 | C33: 清水转债 | D33: 300437 | E33: 清水源 | F33: 城市公用 | G33: 三废处理 | H33: 106.287 | I33: -1.04e-002 | J33: -5.5000000000000005e-003 | K33: 10.29 | L33: -3.3799999999999997e-002 | M33: 121.8 | N33: 11.84 | O33: 0.223 | P33: 86.91 | Q33: 转股中 | R33: 4.52年 | S33: 2.52年 | T33: 4.56 | U33: 4.3 | V33: 9.0000000000000011e-003 | W33: 0.20300000000000001 | X33: 0.17600000000000002 | Y33: 22 | Z33: 1.46 | AA33: 3.1400000000000004e-002 | AB33: 2.2799999999999997e-002 | AC33: -5.6000000000000008e-003 | AD33: -9.0000000000000011e-003 | AE33: 88.54 | AF33: 92.19 | AG33: 0.47 | AH33: AA- | AI33: 6.54e-002 | AJ33: =H33+100*O33 -> 128.58700000000002 | AK33: 125.7 | AL33: 72 | AM33: 33.5 | AN33: 73 | AO33: -0.14800000000000002 | AP33: 52 | AQ33: 清水转债
A34: 51 | B34: 113597 | C34: 佳力转债! | D34: 603912 | E34: 佳力图 | F34: 机械装备 | G34: 专用设备 | H34: 104.98 | I34: -1.0200000000000001e-002 | J34: -6.0000000000000001e-003 | K34: 15.49 | L34: -6.3500000000000001e-002 | M34: 124.5 | N34: 23.4 | O34: 0.58599999999999997 | P34: 66.2 | Q34: 56天 | R34: 5.63年 | S34: 3.63年 | T34: 3 | U34: 1.9 | V34: 6.0000000000000001e-003 | W34: 8.900000000000001e-002 | X34: 5.9000000000000004e-002 | Y34: 34 | Z34: 3.87 | AA34: 3.1400000000000004e-002 | AB34: 2.3799999999999998e-002 | AC34: -1.4000000000000002e-003 | AD34: -3.7000000000000002e-003 | AE34: 81.85 | AF34: 87.1 | AG34: 0.25 | AH34: AA- | AI34: 6.7000000000000004e-002 | AJ34: =H34+100*O34 -> 163.57999999999998 | AK34: 143.8 | AL34: 232 | AM34: 56.7 | AN34: 240 | AO34: -0.106 | AP34: 8 | AQ34: 佳力转债!
A35: 183 | B35: 110059 | C35: 浦发转债! | D35: 600000 | E35: 浦发银行 | F35: 金融 | G35: 银行行业 | H35: 101.66 | I35: -4.4000000000000003e-003 | J35: 2.3e-003 | K35: 9.7 | L35: -1.2199999999999999e-002 | M35: 117.6 | N35: 14.45 | O35: 0.51400000000000001 | P35: 67.13 | Q35: 转股中 | R35: 4.88年 | S35: 无权 | T35: 500 | U35: 205 | V35: 4.0000000000000001e-003 | W35: 0.17600000000000002 | X35: 0.11800000000000001 | Y35: 2847. | Z35: 0.56 | AA35: 3.1099999999999999e-002 | AB35: 2.4399999999999998e-002 | AC35: 无权 | AD35: 无权 | AE35: 无权 | AF35: 97.89 | AG35: 0.17 | AH35: AAA | AI35: 3.9399999999999998e-002 | AJ35: =H35+100*O35 -> 153.06 | AK35: 136.2 | AL35: 178 | AM35: 38.3 | AN35: 121 | AO35: -2.e-002 | AP35: 76 | AQ35: 浦发转债!
A36: 264 | B36: 123011 | C36: 德尔转债! | D36: 300473 | E36: 德尔股份 | F36: 汽车 | G36: 零部件制 | H36: 104.41 | I36: -7.1999999999999998e-003 | J36: 5.4000000000000003e-003 | K36: 25.85 | L36: -6.8999999999999999e-003 | M36: 116.3 | N36: 34.54 | O36: 0.39500000000000002 | P36: 74.84 | Q36: 转股中 | R36: 3.60年 | S36: 1.60年 | T36: 2.51 | U36: 34 | V36: 0.129 | W36: 8.5000000000000006e-002 | X36: 6.4000000000000001e-002 | Y36: 29 | Z36: 1.31 | AA36: 3.1e-002 | AB36: 2.2599999999999999e-002 | AC36: -8.8000000000000005e-003 | AD36: -1.1899999999999999e-002 | AE36: 92 | AF36: 92.99 | AG36: 0.26 | AH36: AA- | AI36: 6.54e-002 | AJ36: =H36+100*O36 -> 143.91 | AK36: 134 | AL36: 164 | AM36: 41 | AN36: 142 | AO36: 2.7000000000000003e-002 | AP36: 40 | AQ36: 德尔转债!
A37: 164 | B37: 110064 | C37: 建工转债! | D37: 600939 | E37: 重庆建工 | F37: 建筑 | G37: 建筑工程 | H37: 103.49 | I37: -4.0000000000000001e-003 | J37: 1.2999999999999999e-003 | K37: 3.76 | L37: -7.9000000000000008e-003 | M37: 120.2 | N37: 4.57 | O37: 0.25800000000000001 | P37: 82.28 | Q37: 转股中 | R37: 5年9天 | S37: 3年9天 | T37: 16.6 | U37: 7.1 | V37: 4.0000000000000001e-003 | W37: 0.24299999999999999 | X37: 0.20000000000000001 | Y37: 68 | Z37: 0.99 | AA37: 3.1e-002 | AB37: 2.3700000000000002e-002 | AC37: 3.2000000000000002e-003 | AD37: 4.0000000000000002e-004 | AE37: 91.27 | AF37: 97.34 | AG37: 0.34 | AH37: AA+ | AI37: 4.4000000000000004e-002 | AJ37: =H37+100*O37 -> 129.28999999999999 | AK37: 124.7 | AL37: 57 | AM37: 27.4 | AN37: 25 | AO37: -3.2000000000000001e-002 | AP37: 48 | AQ37: 建工转债!
A38: 166 | B38: 113557 | C38: 森特转债 | D38: 603098 | E38: 森特股份 | F38: 建筑 | G38: 建筑工程 | H38: 103.97 | I38: -1.9199999999999998e-002 | J38: 1.3100000000000001e-002 | K38: 9.28 | L38: -1.0700000000000001e-002 | M38: 120.7 | N38: 10.11 | O38: 0.13300000000000001 | P38: 91.79 | Q38: 转股中 | R38: 5年8天 | S38: 3年8天 | T38: 6 | U38: 32 | V38: 5.0999999999999997e-002 | W38: 0.13500000000000001 | X38: 0.124 | Y38: 45 | Z38: 2.15 | AA38: 3.0899999999999997e-002 | AB38: 2.35e-002 | AC38: 2.0000000000000001e-004 | AD38: -2.3e-003 | AE38: 84.85 | AF38: 87.82 | AG38: 0.57 | AH38: AA- | AI38: 6.7000000000000004e-002 | AJ38: =H38+100*O38 -> 117.27 | AK38: 116.1 | AL38: 7 | AM38: 28.3 | AN38: 29 | AO38: -3.4000000000000002e-002 | AP38: 37 | AQ38: 森特转债
A39: 308 | B39: 128014 | C39: 永东转债! | D39: 2753 | E39: 永东股份 | F39: 化工 | G39: 化工 | H39: 103.78 | I39: -7.9000000000000008e-003 | J39: 7.6e-003 | K39: 8.32 | L39: -2.92e-002 | M39: 111.3 | N39: 12.6 | O39: 0.57200000000000006 | P39: 66.03 | Q39: 转股中 | R39: 2.35年 | S39: 0.35年 | T39: 3.37 | U39: 1.6 | V39: 5.0000000000000001e-003 | W39: 0.10800000000000001 | X39: 7.0999999999999994e-002 | Y39: 31 | Z39: 1.77 | AA39: 3.0800000000000001e-002 | AB39: 2.1600000000000001e-002 | AC39: -3.6900000000000002e-002 | AD39: -4.3499999999999997e-002 | AE39: 98.62 | AF39: 96.48 | AG39: 0.01 | AH39: AA- | AI39: 6.4000000000000001e-002 | AJ39: =H39+100*O39 -> 160.98000000000002 | AK39: 141.5 | AL39: 217 | AM39: 42.9 | AN39: 161 | AO39: -3.9e-002 | AP39: 39 | AQ39: 永东转债!
A40: 13 | B40: 123073 | C40: 同和转债! | D40: 300636 | E40: 同和药业 | F40: 医药 | G40: 原料药 | H40: 102.93 | I40: -2.12e-002 | J40: 8.3000000000000001e-003 | K40: 26.08 | L40: -3.0800000000000001e-002 | M40: 122.4 | N40: 36.34 | O40: 0.434 | P40: 71.77 | Q40: 4月23天 | R40: 5.87年 | S40: 3.87年 | T40: 3.6 | U40: 17 | V40: 4.4000000000000004e-002 | W40: 0.107 | X40: 7.6999999999999999e-002 | Y40: 34 | Z40: 4.44 | AA40: 3.0600000000000002e-002 | AB40: 2.3799999999999998e-002 | AC40: 4.0000000000000001e-003 | AD40: 1.7000000000000001e-003 | AE40: 77.47 | AF40: 79.52 | AG40: 0.42 | AH40: A+ | AI40: 7.8e-002 | AJ40: =H40+100*O40 -> 146.33000000000001 | AK40: 134.1 | AL40: 166 | AM40: 54.6 | AN40: 229 | AO40: -6.0999999999999999e-002 | AP40: 5 | AQ40: 同和转债!
A41: 139 | B41: 113568 | C41: 新春转债 | D41: 603667 | E41: 五洲新春 | F41: 机械装备 | G41: 通用设备 | H41: 107.08 | I41: -9.5999999999999992e-003 | J41: 3.7000000000000002e-003 | K41: 8.05 | L41: -1.11e-002 | M41: 124.8 | N41: 8.91 | O41: 0.185 | P41: 90.35 | Q41: 转股中 | R41: 5.23年 | S41: 3.23年 | T41: 3.3 | U41: 4.1 | V41: 1.2e-002 | W41: 0.14000000000000001 | X41: 0.127 | Y41: 24 | Z41: 1.36 | AA41: 3.04e-002 | AB41: 2.2200000000000001e-002 | AC41: -6.6e-003 | AD41: -9.300000000000001e-003 | AE41: 84.26 | AF41: 89.66 | AG41: 0.53 | AH41: AA- | AI41: 6.7000000000000004e-002 | AJ41: =H41+100*O41 -> 125.58 | AK41: 123.8 | AL41: 47 | AM41: 34.2 | AN41: 81 | AO41: -6.5000000000000002e-002 | AP41: 48 | AQ41: 新春转债
A42: 202 | B42: 128069 | C42: 华森转债! | D42: 2907 | E42: 华森制药 | F42: 医药 | G42: 化学制药 | H42: 105.4 | I42: -1.66e-002 | J42: 8.8000000000000005e-003 | K42: 15.43 | L42: -1.72e-002 | M42: 120 | N42: 18.04 | O42: 0.23199999999999998 | P42: 85.53 | Q42: 转股中 | R42: 4.53年 | S42: 2.53年 | T42: 3 | U42: 7.5 | V42: 2.3e-002 | W42: 4.8000000000000001e-002 | X42: 4.0999999999999995e-002 | Y42: 62 | Z42: 5.77 | AA42: 2.9600000000000001e-002 | AB42: 2.1700000000000001e-002 | AC42: -6.8000000000000005e-003 | AD42: -9.300000000000001e-003 | AE42: 87.39 | AF42: 90.57 | AG42: 0.45 | AH42: AA- | AI42: 6.54e-002 | AJ42: =H42+100*O42 -> 128.59999999999999 | AK42: 125.3 | AL42: 66 | AM42: 34.7 | AN42: 88 | AO42: -2.6000000000000002e-002 | AP42: 45 | AQ42: 华森转债!
A43: 62 | B43: 113595 | C43: 花王转债 | D43: 603007 | E43: 花王股份 | F43: 城市公用 | G43: 生态环境 | H43: 106.95 | I43: -9.3999999999999986e-003 | J43: 3.3e-003 | K43: 6.42 | L43: -1.0800000000000001e-002 | M43: 125.3 | N43: 6.94 | O43: 0.156 | P43: 92.51 | Q43: 47天 | R43: 5.61年 | S43: 3.61年 | T43: 3.3 | U43: 6.4 | V43: 1.8000000000000002e-002 | W43: 0.153 | X43: 0.14199999999999999 | Y43: 22 | Z43: 1.94 | AA43: 2.92e-002 | AB43: 2.1499999999999998e-002 | AC43: -6.8999999999999999e-003 | AD43: -9.1000000000000004e-003 | AE43: 81.83 | AF43: 87.79 | AG43: 0.57 | AH43: AA- | AI43: 6.7000000000000004e-002 | AJ43: =H43+100*O43 -> 122.55 | AK43: 121.4 | AL43: 25 | AM43: 33.6 | AN43: 74 | AO43: -2.2000000000000002e-002 | AP43: 29 | AQ43: 花王转债
A44: 287 | B44: 128032 | C44: 双环转债! | D44: 2472 | E44: 双环传动 | F44: 机械装备 | G44: 通用设备 | H44: 101.357 | I44: -2.3799999999999998e-002 | J44: 2.1700000000000001e-002 | K44: 7.12 | L44: -1.52e-002 | M44: 110.3 | N44: 9.89 | O44: 0.40799999999999997 | P44: 71.99 | Q44: 转股中 | R44: 3年14天 | S44: 1年14天 | T44: 10 | U44: 12 | V44: 1.2e-002 | W44: 0.20499999999999999 | X44: 0.14699999999999999 | Y44: 49 | Z44: 1.46 | AA44: 2.8900000000000002e-002 | AB44: 2.23e-002 | AC44: 1.1899999999999999e-002 | AD44: 7.3000000000000001e-003 | AE44: 97.62 | AF44: 96.97 | AG44: 0.14 | AH44: AA | AI44: 4.4400000000000002e-002 | AJ44: =H44+100*O44 -> 142.15699999999998 | AK44: 130.7 | AL44: 131 | AM44: 33.1 | AN44: 67 | AO44: -2.8999999999999998e-002 | AP44: 46 | AQ44: 双环转债!
A45: 235 | B45: 113021 | C45: 中信转债! | D45: 601998 | E45: 中信银行 | F45: 金融 | G45: 银行行业 | H45: 105.75 | I45: -4.1999999999999997e-003 | J45: 6.1999999999999998e-003 | K45: 5.15 | L45: 9.7999999999999997e-003 | M45: 118.8 | N45: 6.98 | O45: 0.433 | P45: 73.78 | Q45: 转股中 | R45: 4.23年 | S45: 无权 | T45: 400 | U45: 7.8 | V45: 0. | W45: 0.159 | X45: 0.11699999999999999 | Y45: 2520. | Z45: 0.55 | AA45: 2.8799999999999999e-002 | AB45: 2.06e-002 | AC45: 无权 | AD45: 无权 | AE45: 无权 | AF45: 101.42 | AG45: 0.2 | AH45: AAA | AI45: 3.9399999999999998e-002 | AJ45: =H45+100*O45 -> 149.05000000000001 | AK45: 137.7 | AL45: 190 | AM45: 36.3 | AN45: 102 | AO45: -1.1000000000000001e-002 | AP45: 52 | AQ45: 中信转债!
A46: 17 | B46: 123071 | C46: 天能转债! | D46: 300569 | E46: 天能重工 | F46: 能源电力 | G46: 风能 | H46: 103.8 | I46: -2.8999999999999998e-003 | J46: 7.9000000000000008e-003 | K46: 16.62 | L46: 9.7000000000000003e-003 | M46: 121.1 | N46: 20.05 | O46: 0.252 | P46: 82.89 | Q46: 4月17天 | R46: 5.86年 | S46: 3.86年 | T46: 7 | U46: 27 | V46: 3.6000000000000004e-002 | W46: 0.107 | X46: 8.900000000000001e-002 | Y46: 65 | Z46: 2.95 | AA46: 2.7200000000000002e-002 | AB46: 2.0799999999999999e-002 | AC46: 5.0000000000000001e-004 | AD46: -1.4000000000000002e-003 | AE46: 80.31 | AF46: 83.44 | AG46: 0.52 | AH46: AA- | AI46: 6.7000000000000004e-002 | AJ46: =H46+100*O46 -> 129. | AK46: 124.7 | AL46: 58 | AM46: 41.3 | AN46: 146 | AO46: -5.7999999999999996e-002 | AP46: 5 | AQ46: 天能转债!
A47: 301 | B47: 128018 | C47: 时达转债! | D47: 2527 | E47: 新时达 | F47: 机械装备 | G47: 机器人及 | H47: 101.289 | I47: -1.7899999999999999e-002 | J47: 1.21e-002 | K47: 5.84 | L47: -2.6699999999999998e-002 | M47: 109.3 | N47: 7.42 | O47: 0.28699999999999998 | P47: 78.71 | Q47: 转股中 | R47: 2.90年 | S47: 0.90年 | T47: 8.8 | U47: 8.7 | V47: 1.e-002 | W47: 0.24299999999999999 | X47: 0.191 | Y47: 36 | Z47: 1.42 | AA47: 2.7000000000000003e-002 | AB47: 2.0799999999999999e-002 | AC47: 4.6999999999999993e-003 | AD47: 1.4000000000000002e-003 | AE47: 97.32 | AF47: 96.91 | AG47: 0.22 | AH47: AA | AI47: 4.2999999999999997e-002 | AJ47: =H47+100*O47 -> 129.989 | AK47: 123.9 | AL47: 50 | AM47: 26.5 | AN47: 18 | AO47: -8.900000000000001e-002 | AP47: 41 | AQ47: 时达转债!
A48: 167 | B48: 128087 | C48: 孚日转债! | D48: 2083 | E48: 孚日股份 | F48: 服装纺织 | G48: 家纺 | H48: 99.412 | I48: -1.0800000000000001e-002 | J48: 5.5000000000000005e-003 | K48: 4.81 | L48: -1.6399999999999998e-002 | M48: 113.3 | N48: 6.3 | O48: 0.30199999999999999 | P48: 76.35 | Q48: 转股中 | R48: 5年6.1天 | S48: 3年6.1天 | T48: 6.5 | U48: 5.1 | V48: 8.0000000000000002e-003 | W48: 0.14899999999999999 | X48: 0.114 | Y48: 44 | Z48: 1.16 | AA48: 2.7000000000000003e-002 | AB48: 2.2000000000000002e-002 | AC48: 1.38e-002 | AD48: 1.1399999999999999e-002 | AE48: 90.12 | AF48: 90.87 | AG48: 0.33 | AH48: AA | AI48: 4.5999999999999999e-002 | AJ48: =H48+100*O48 -> 129.61199999999999 | AK48: 122.5 | AL48: 34 | AM48: 31.6 | AN48: 55 | AO48: -4.2999999999999997e-002 | AP48: 51 | AQ48: 孚日转债!
A49: 227 | B49: 123023 | C49: 迪森转债! | D49: 300335 | E49: 迪森股份 | F49: 能源电力 | G49: 电力供应 | H49: 102.91 | I49: -1.44e-002 | J49: 1.4000000000000002e-003 | K49: 5.8 | L49: -3.6499999999999998e-002 | M49: 114.9 | N49: 7.04 | O49: 0.249 | P49: 82.39 | Q49: 转股中 | R49: 4.27年 | S49: 3.27年 | T49: 5.29 | U49: 19 | V49: 3.4000000000000002e-002 | W49: 0.251 | X49: 0.20699999999999999 | Y49: 21 | Z49: 1.56 | AA49: 2.6699999999999998e-002 | AB49: 2.0199999999999999e-002 | AC49: 6.6e-003 | AD49: 3.5999999999999999e-003 | AE49: 90.86 | AF49: 95.82 | AG49: 0.35 | AH49: AA | AI49: 4.4400000000000002e-002 | AJ49: =H49+100*O49 -> 127.81 | AK49: 123.4 | AL49: 42 | AM49: 27.6 | AN49: 26 | AO49: -0.109 | AP49: 56 | AQ49: 迪森转债!
A50: 211 | B50: 110058 | C50: 永鼎转债! | D50: 600105 | E50: 永鼎股份 | F50: 通信互联 | G50: 通信设备 | H50: 102.88 | I50: -1.32e-002 | J50: 3.8e-003 | K50: 3.66 | L50: -4.1900000000000007e-002 | M50: 114.9 | N50: 5.04 | O50: 0.41700000000000004 | P50: 72.62 | Q50: 转股中 | R50: 4.35年 | S50: 2.35年 | T50: 2.61 | U50: 11 | V50: 3.9e-002 | W50: 5.2000000000000005e-002 | X50: 3.7999999999999999e-002 | Y50: 50 | Z50: 1.8 | AA50: 2.63e-002 | AB50: 1.9900000000000001e-002 | AC50: 2.e-003 | AD50: -5.9999999999999995e-004 | AE50: 92.82 | AF50: 95.51 | AG50: 0.22 | AH50: AA | AI50: 4.4400000000000002e-002 | AJ50: =H50+100*O50 -> 144.57999999999998 | AK50: 133.1 | AL50: 156 | AM50: 37.6 | AN50: 117 | AO50: -0.34100000000000003 | AP50: 52 | AQ50: 永鼎转债!
A51: 41 | B51: 128127 | C51: 文科转债 | D51: 2775 | E51: 文科园林 | F51: 城市公用 | G51: 生态环境 | H51: 104.992 | I51: -8.6e-003 | J51: 2.3999999999999998e-003 | K51: 5.06 | L51: -9.7999999999999997e-003 | M51: 121.3 | N51: 5.37 | O51: 0.114 | P51: 94.23 | Q51: 2月20天 | R51: 5.69年 | S51: 3.69年 | T51: 9.5 | U51: 2.8 | V51: 3.0000000000000001e-003 | W51: 0.36599999999999999 | X51: 0.34499999999999997 | Y51: 26 | Z51: 0.98 | AA51: 2.63e-002 | AB51: 1.9599999999999999e-002 | AC51: -1.9e-003 | AD51: -4.0999999999999995e-003 | AE51: 81.4 | AF51: 84.56 | AG51: 0.63 | AH51: AA- | AI51: 6.7000000000000004e-002 | AJ51: =H51+100*O51 -> 116.39200000000001 | AK51: 115.8 | AL51: 6 | AM51: 31.2 | AN51: 49 | AO51: -5.2999999999999999e-002 | AP51: 25 | AQ51: 文科转债
A52: 213 | B52: 127013 | C52: 创维转债! | D52: 810 | E52: 创维数字 | F52: 电子 | G52: 电子产品 | H52: 105.66 | I52: -2.3399999999999997e-002 | J52: 1.9400000000000001e-002 | K52: 8.68 | L52: -1.7000000000000001e-002 | M52: 117.9 | N52: 11.39 | O52: 0.38600000000000001 | P52: 76.21 | Q52: 转股中 | R52: 4.34年 | S52: 2.34年 | T52: 9.78 | U52: 8.1 | V52: 8.0000000000000002e-003 | W52: 0.106 | X52: 8.1000000000000003e-002 | Y52: 92 | Z52: 2.38 | AA52: 2.6099999999999998e-002 | AB52: 1.8600000000000002e-002 | AC52: -8.6999999999999994e-003 | AD52: -1.1299999999999999e-002 | AE52: 92.83 | AF52: 98.01 | AG52: 0.23 | AH52: AA | AI52: 4.4400000000000002e-002 | AJ52: =H52+100*O52 -> 144.25999999999999 | AK52: 135.1 | AL52: 170 | AM52: 37.1 | AN52: 111 | AO52: -3.4000000000000002e-002 | AP52: 24 | AQ52: 创维转债!
A53: 117 | B53: 113576 | C53: 起步转债!! | D53: 603557 | E53: 起步股份 | F53: 服装纺织 | G53: 鞋服行业 | H53: 106.52 | I53: 1.66e-002 | J53: -2.9999999999999997e-004 | K53: 9.41 | L53: 2.9500000000000002e-002 | M53: 121.8 | N53: 10.55 | O53: 0.19399999999999998 | P53: 89.19 | Q53: 转股中 | R53: 5.33年 | S53: 3.33年 | T53: 2.67 | U53: 298 | V53: 1.04 | W53: 5.7000000000000002e-002 | X53: 5.0999999999999997e-002 | Y53: 47 | Z53: 2.77 | AA53: 2.6099999999999998e-002 | AB53: 1.89e-002 | AC53: -4.8999999999999998e-003 | AD53: -7.4999999999999997e-003 | AE53: 83.74 | AF53: 86.98 | AG53: 0.55 | AH53: AA- | AI53: 6.7000000000000004e-002 | AJ53: =H53+100*O53 -> 125.91999999999999 | AK53: 123.8 | AL53: 49 | AM53: 36.9 | AN53: 108 | AO53: -0.16699999999999998 | AP53: 28 | AQ53: 起步转债!!
A54: 75 | B54: 128118 | C54: 瀛通转债! | D54: 2861 | E54: 瀛通通讯 | F54: 电子 | G54: 电子产品 | H54: 106.288 | I54: -7.6e-003 | J54: -6.8000000000000005e-003 | K54: 22.72 | L54: -2.9500000000000002e-002 | M54: 122.1 | N54: 27.53 | O54: 0.28800000000000003 | P54: 82.53 | Q54: 28天 | R54: 5.56年 | S54: 3.56年 | T54: 3 | U54: 2.7 | V54: 9.0000000000000011e-003 | W54: 0.10800000000000001 | X54: 8.900000000000001e-002 | Y54: 28 | Z54: 2.6 | AA54: 2.5899999999999999e-002 | AB54: 1.8799999999999997e-002 | AC54: -4.3e-003 | AD54: -6.7000000000000002e-003 | AE54: 82.39 | AF54: 85.89 | AG54: 0.49 | AH54: AA- | AI54: 6.7000000000000004e-002 | AJ54: =H54+100*O54 -> 135.08799999999999 | AK54: 130 | AL54: 122 | AM54: 44.2 | AN54: 169 | AO54: -3.3000000000000002e-002 | AP54: 7 | AQ54: 瀛通转债!
A55: 2 | B55: 113608 | C55: 威派转债 | D55: 603956 | E55: 威派格 | F55: 机械装备 | G55: 专用设备 | H55: 105.01 | I55: -4.4000000000000003e-003 | J55: -7.6e-003 | K55: 16.26 | L55: -1.9900000000000001e-002 | M55: 121.6 | N55: 19.24 | O55: 0.24299999999999999 | P55: 84.51 | Q55: 5月3天 | R55: 5.91年 | S55: 3.91年 | T55: 4.2 | U55: 3.8 | V55: 9.0000000000000011e-003 | W55: 6.0999999999999999e-002 | X55: 5.0999999999999997e-002 | Y55: 69 | Z55: 6.07 | AA55: 2.5699999999999997e-002 | AB55: 1.9199999999999998e-002 | AC55: -1.e-003 | AD55: -3.0999999999999999e-003 | AE55: 77.27 | AF55: 78.79 | AG55: 0.6 | AH55: A+ | AI55: 7.8e-002 | AJ55: =H55+100*O55 -> 129.31 | AK55: 125.5 | AL55: 70 | AM55: 46.7 | AN55: 185 | AO55: -8.8000000000000009e-002 | AP55: 4 | AQ55: 威派转债
A56: 261 | B56: 128042 | C56: 凯中转债! | D56: 2823 | E56: 凯中精密 | F56: 能源电力 | G56: 电力设备 | H56: 106.287 | I56: -1.3999999999999999e-002 | J56: 3.5999999999999999e-003 | K56: 10.86 | L56: -3.3799999999999997e-002 | M56: 116.3 | N56: 12.96 | O56: 0.26800000000000002 | P56: 83.8 | Q56: 转股中 | R56: 3.63年 | S56: 1.63年 | T56: 4.16 | U56: 9.3 | V56: 2.1000000000000001e-002 | W56: 0.13300000000000001 | X56: 0.11199999999999999 | Y56: 31 | Z56: 2.31 | AA56: 2.5600000000000001e-002 | AB56: 1.7399999999999999e-002 | AC56: -1.8500000000000003e-002 | AD56: -2.1499999999999998e-002 | AE56: 95.13 | AF56: 99.61 | AG56: 0.31 | AH56: AA | AI56: 4.4400000000000002e-002 | AJ56: =H56+100*O56 -> 133.08700000000002 | AK56: 128.8 | AL56: 108 | AM56: 29.2 | AN56: 37 | AO56: -9.9000000000000005e-002 | AP56: 29 | AQ56: 凯中转债!
A57: 299 | B57: 113502 | C57: 嘉澳转债! | D57: 603822 | E57: 嘉澳环保 | F57: 化工 | G57: 化工 | H57: 103.53 | I57: -1.09e-002 | J57: 1.09e-002 | K57: 24.29 | L57: -8.6e-003 | M57: 111.3 | N57: 44.79 | O57: 0.90900000000000003 | P57: 54.23 | Q57: 转股中 | R57: 2.92年 | S57: 0.92年 | T57: 1.85 | U57: 6.8 | V57: 3.6000000000000004e-002 | W57: 0.10400000000000001 | X57: 5.5999999999999994e-002 | Y57: 18 | Z57: 2.37 | AA57: 2.5499999999999998e-002 | AB57: 1.8200000000000001e-002 | AC57: -1.55e-002 | AD57: -1.8700000000000001e-002 | AE57: 95.21 | AF57: 93.15 | AG57: 0 | AH57: AA- | AI57: 6.4000000000000001e-002 | AJ57: =H57+100*O57 -> 194.43000000000001 | AK57: 152.8 | AL57: 267 | AM57: 57.6 | AN57: 244 | AO57: -2.4e-002 | AP57: 30 | AQ57: 嘉澳转债!
A58: 144 | B58: 113566 | C58: 翔港转债! | D58: 603499 | E58: 翔港科技 | F58: 造纸包装 | G58: 包装材料 | H58: 109.66 | I58: -1.9e-002 | J58: 1.21e-002 | K58: 9.17 | L58: -1.29e-002 | M58: 124.5 | N58: 10.77 | O58: 0.28800000000000003 | P58: 85.14 | Q58: 转股中 | R58: 5.22年 | S58: 3.22年 | T58: 1.61 | U58: 5.7 | V58: 3.2000000000000001e-002 | W58: 8.6999999999999994e-002 | X58: 7.400000000000001e-002 | Y58: 19 | Z58: 3.23 | AA58: 2.52e-002 | AB58: 1.7100000000000001e-002 | AC58: -1.3899999999999999e-002 | AD58: -1.6500000000000001e-002 | AE58: 81.5 | AF58: 84.99 | AG58: 0.53 | AH58: A+ | AI58: 7.8e-002 | AJ58: =H58+100*O58 -> 138.46000000000001 | AK58: 134.2 | AL58: 167 | AM58: 49.2 | AN58: 193 | AO58: -4.2000000000000003e-002 | AP58: 28 | AQ58: 翔港转债!
A59: 114 | B59: 110070 | C59: 凌钢转债! | D59: 600231 | E59: 凌钢股份 | F59: 钢铁 | G59: 炼钢 | H59: 103.47 | I59: -3.4000000000000002e-003 | J59: -2.3e-003 | K59: 2.43 | L59: -1.2199999999999999e-002 | M59: 117.8 | N59: 2.75 | O59: 0.17100000000000001 | P59: 88.36 | Q59: 转股中 | R59: 5.34年 | S59: 3.34年 | T59: 4.4 | U59: 11 | V59: 2.4e-002 | W59: 6.5000000000000002e-002 | X59: 5.7999999999999996e-002 | Y59: 67 | Z59: 0.84 | AA59: 2.5099999999999997e-002 | AB59: 1.9099999999999999e-002 | AC59: 1.8e-003 | AD59: -5.0000000000000001e-004 | AE59: 89.12 | AF59: 93.15 | AG59: 0.46 | AH59: AA | AI59: 4.5999999999999999e-002 | AJ59: =H59+100*O59 -> 120.56999999999999 | AK59: 118.6 | AL59: 11 | AM59: 25.4 | AN59: 13 | AO59: 2.7000000000000003e-002 | AP59: 17 | AQ59: 凌钢转债!
A60: 268 | B60: 127007 | C60: 湖广转债! | D60: 665 | E60: 湖北广电 | F60: 传媒娱乐 | G60: 影视娱乐 | H60: 103.702 | I60: -1.61e-002 | J60: 8.3000000000000001e-003 | K60: 4.72 | L60: -2.2799999999999997e-002 | M60: 112.3 | N60: 5.58 | O60: 0.22600000000000001 | P60: 84.59 | Q60: 转股中 | R60: 3.55年 | S60: 1.55年 | T60: 12.2 | U60: 9.5 | V60: 8.0000000000000002e-003 | W60: 0.26200000000000001 | X60: 0.222 | Y60: 46 | Z60: 0.71 | AA60: 2.3199999999999998e-002 | AB60: 1.66e-002 | AC60: -5.1000000000000004e-003 | AD60: -8.3000000000000001e-003 | AE60: 95.8 | AF60: 97.21 | AG60: 0.34 | AH60: AA+ | AI60: 4.24e-002 | AJ60: =H60+100*O60 -> 126.30199999999999 | AK60: 122.8 | AL60: 35 | AM60: 25.6 | AN60: 14 | AO60: -5.5e-002 | AP60: 19 | AQ60: 湖广转债!
A61: 185 | B61: 113546 | C61: 迪贝转债! | D61: 603320 | E61: 迪贝电气 | F61: 家电 | G61: 零部件制 | H61: 108.12 | I61: -8.3999999999999995e-003 | J61: 2.0199999999999999e-002 | K61: 13.51 | L61: 1.8100000000000002e-002 | M61: 120.6 | N61: 14.1 | O61: 0.128 | P61: 95.82 | Q61: 转股中 | R61: 4.87年 | S61: 2.87年 | T61: 2.3 | U61: 7.4 | V61: 2.9999999999999999e-002 | W61: 0.13100000000000001 | X61: 0.125 | Y61: 18 | Z61: 2.64 | AA61: 2.3199999999999998e-002 | AB61: 1.5700000000000002e-002 | AC61: -1.3100000000000001e-002 | AD61: -1.55e-002 | AE61: 83.35 | AF61: 84.95 | AG61: 0.65 | AH61: A+ | AI61: 7.6399999999999996e-002 | AJ61: =H61+100*O61 -> 120.92 | AK61: 120.4 | AL61: 17 | AM61: 35.5 | AN61: 98 | AO61: 4.2999999999999997e-002 | AP61: 44 | AQ61: 迪贝转债!
A62: 47 | B62: 113599 | C62: 嘉友转债 | D62: 603871 | E62: 嘉友国际 | F62: 交通运输 | G62: 物流业 | H62: 111.04 | I62: -8.6999999999999994e-003 | J62: -6.1999999999999998e-003 | K62: 22.57 | L62: -2.7200000000000002e-002 | M62: 126 | N62: 24.82 | O62: 0.221 | P62: 90.93 | Q62: 2月9天 | R62: 5.65年 | S62: 3.65年 | T62: 7.2 | U62: 3.1 | V62: 4.0000000000000001e-003 | W62: 0.14499999999999999 | X62: 0.13200000000000001 | Y62: 50 | Z62: 2.49 | AA62: 2.3e-002 | AB62: 1.5300000000000001e-002 | AC62: -1.7399999999999999e-002 | AD62: -1.9299999999999998e-002 | AE62: 81.34 | AF62: 87.97 | AG62: 0.55 | AH62: AA- | AI62: 6.7000000000000004e-002 | AJ62: =H62+100*O62 -> 133.14000000000001 | AK62: 131.1 | AL62: 136 | AM62: 43.2 | AN62: 164 | AO62: -5.9000000000000004e-002 | AP62: 14 | AQ62: 嘉友转债
A63: 195 | B63: 128072 | C63: 翔鹭转债! | D63: 2842 | E63: 翔鹭钨业 | F63: 有色金属 | G63: 小金属 | H63: 103.901 | I63: -5.1999999999999998e-003 | J63: -7.9000000000000008e-003 | K63: 10.92 | L63: -4.2099999999999999e-002 | M63: 115.1 | N63: 15.34 | O63: 0.46000000000000002 | P63: 71.19 | Q63: 转股中 | R63: 4.69年 | S63: 2.69年 | T63: 3.02 | U63: 10 | V63: 3.3000000000000002e-002 | W63: 0.10099999999999999 | X63: 7.2000000000000008e-002 | Y63: 30 | Z63: 3.29 | AA63: 2.2499999999999999e-002 | AB63: 1.6500000000000001e-002 | AC63: -1.6000000000000001e-003 | AD63: -3.9000000000000003e-003 | AE63: 86.46 | AF63: 86.03 | AG63: 0.31 | AH63: AA- | AI63: 6.54e-002 | AJ63: =H63+100*O63 -> 149.90100000000001 | AK63: 136.6 | AL63: 184 | AM63: 50.2 | AN63: 202 | AO63: -2.e-003 | AP63: 28 | AQ63: 翔鹭转债!
A64: 66 | B64: 128120 | C64: 联诚转债 | D64: 2921 | E64: 联诚精密 | F64: 汽车 | G64: 零部件制 | H64: 104.958 | I64: -1.5900000000000001e-002 | J64: 1.0500000000000001e-002 | K64: 21.12 | L64: -8.5000000000000006e-003 | M64: 118.4 | N64: 24.37 | O64: 0.21100000000000002 | P64: 86.66 | Q64: 45天 | R64: 5.60年 | S64: 3.60年 | T64: 2.6 | U64: 8.8 | V64: 3.2000000000000001e-002 | W64: 0.151 | X64: 0.13100000000000001 | Y64: 17 | Z64: 2.3 | AA64: 2.23e-002 | AB64: 1.6299999999999999e-002 | AC64: -1.e-003 | AD64: -3.3e-003 | AE64: 76.43 | AF64: 74.71 | AG64: 0.65 | AH64: A | AI64: 8.8000000000000009e-002 | AJ64: =H64+100*O64 -> 126.05799999999999 | AK64: 123.3 | AL64: 39 | AM64: 46.8 | AN64: 186 | AO64: -8.199999999999999e-002 | AP64: 16 | AQ64: 联诚转债
A65: 244 | B65: 113525 | C65: 台华转债! | D65: 603055 | E65: 台华新材 | F65: 服装纺织 | G65: 纺织行业 | H65: 105.49 | I65: -4.3e-003 | J65: 4.3e-003 | K65: 6.62 | L65: 0. | M65: 114.9 | N65: 8.03 | O65: 0.28000000000000003 | P65: 82.44 | Q65: 转股中 | R65: 4年6.1天 | S65: 2年6.1天 | T65: 4.69 | U65: 0.9 | V65: 2.e-003 | W65: 9.1999999999999998e-002 | X65: 7.4999999999999997e-002 | Y65: 51 | Z65: 1.94 | AA65: 2.2000000000000002e-002 | AB65: 1.5100000000000001e-002 | AC65: -9.1999999999999998e-003 | AD65: -1.2199999999999999e-002 | AE65: 94.16 | AF65: 96.89 | AG65: 0.33 | AH65: AA | AI65: 4.4400000000000002e-002 | AJ65: =H65+100*O65 -> 133.49000000000001 | AK65: 128.5 | AL65: 102 | AM65: 31.7 | AN65: 56 | AO65: -7.6999999999999999e-002 | AP65: 22 | AQ65: 台华转债!
A66: 220 | B66: 113532 | C66: 海环转债! | D66: 603817 | E66: 海峡环保 | F66: 城市公用 | G66: 三废处理 | H66: 103.17 | I66: -6.0000000000000001e-003 | J66: 1.5e-003 | K66: 5.93 | L66: -1.4999999999999999e-002 | M66: 112.9 | N66: 7.69 | O66: 0.33799999999999997 | P66: 77.11 | Q66: 转股中 | R66: 4.31年 | S66: 2.31年 | T66: 4.6 | U66: 2.2 | V66: 5.0000000000000001e-003 | W66: 0.17199999999999999 | X66: 0.13300000000000001 | Y66: 27 | Z66: 1.56 | AA66: 2.1600000000000001e-002 | AB66: 1.6e-002 | AC66: 8.9999999999999998e-004 | AD66: -1.8e-003 | AE66: 92.97 | AF66: 94.01 | AG66: 0.3 | AH66: AA | AI66: 4.4400000000000002e-002 | AJ66: =H66+100*O66 -> 136.97 | AK66: 129.2 | AL66: 113 | AM66: 35.2 | AN66: 93 | AO66: -5.0000000000000003e-002 | AP66: 26 | AQ66: 海环转债!
A67: 92 | B67: 123054 | C67: 思特转债 | D67: 300608 | E67: 思特奇 | F67: 通信互联 | G67: 通信设备 | H67: 108.681 | I67: -2.1000000000000001e-002 | J67: 8.3000000000000001e-003 | K67: 15.23 | L67: -2.12e-002 | M67: 121.7 | N67: 16.49 | O67: 0.17699999999999999 | P67: 92.36 | Q67: 5.1天 | R67: 5.50年 | S67: 3.50年 | T67: 2.71 | U67: 8 | V67: 2.7000000000000003e-002 | W67: 0.113 | X67: 0.10400000000000001 | Y67: 24 | Z67: 3.17 | AA67: 2.1299999999999999e-002 | AB67: 1.43e-002 | AC67: -1.0500000000000001e-002 | AD67: -1.29e-002 | AE67: 82.75 | AF67: 85.95 | AG67: 0.6 | AH67: AA- | AI67: 6.7000000000000004e-002 | AJ67: =H67+100*O67 -> 126.381 | AK67: 125 | AL67: 61 | AM67: 39.1 | AN67: 129 | AO67: -7.2999999999999995e-002 | AP67: 17 | AQ67: 思特转债
A68: 74 | B68: 113036 | C68: 宁建转债! | D68: 601789 | E68: 宁波建工 | F68: 建筑 | G68: 建筑工程 | H68: 104.54 | I68: -1.3899999999999999e-002 | J68: 5.6999999999999993e-003 | K68: 4.09 | L68: -1.9199999999999998e-002 | M68: 117.3 | N68: 4.86 | O68: 0.24199999999999999 | P68: 84.16 | Q68: 31天 | R68: 5.57年 | S68: 3.57年 | T68: 5.4 | U68: 3.7 | V68: 6.0000000000000001e-003 | W68: 0.13500000000000001 | X68: 0.114 | Y68: 40 | Z68: 1.34 | AA68: 2.1299999999999999e-002 | AB68: 1.5700000000000002e-002 | AC68: -1.9e-003 | AD68: -3.9000000000000003e-003 | AE68: 87.9 | AF68: 91.77 | AG68: 0.43 | AH68: AA | AI68: 4.5999999999999999e-002 | AJ68: =H68+100*O68 -> 128.74000000000001 | AK68: 124.9 | AL68: 60 | AM68: 33.2 | AN68: 69 | AO68: -5.0000000000000003e-002 | AP68: 7 | AQ68: 宁建转债!
A69: 29 | B69: 123067 | C69: 斯莱转债 | D69: 300382 | E69: 斯莱克 | F69: 机械装备 | G69: 专用设备 | H69: 107.79 | I69: -2.2000000000000002e-002 | J69: -1.8e-003 | K69: 8.29 | L69: -4.1599999999999998e-002 | M69: 121.2 | N69: 9.38 | O69: 0.22 | P69: 88.38 | Q69: 3月12天 | R69: 5.77年 | S69: 3.77年 | T69: 3.88 | U69: 11 | V69: 2.6000000000000002e-002 | W69: 8.3000000000000004e-002 | X69: 7.2999999999999995e-002 | Y69: 47 | Z69: 4.59 | AA69: 2.1000000000000001e-002 | AB69: 1.4499999999999999e-002 | AC69: -8.8999999999999999e-003 | AD69: -1.09e-002 | AE69: 80.9 | AF69: 84.04 | AG69: 0.57 | AH69: AA- | AI69: 6.7000000000000004e-002 | AJ69: =H69+100*O69 -> 129.79000000000002 | AK69: 127.2 | AL69: 91 | AM69: 43.2 | AN69: 163 | AO69: -7.4999999999999997e-002 | AP69: 12 | AQ69: 斯莱转债
A70: 121 | B70: 127016 | C70: 鲁泰转债! | D70: 726 | E70: 鲁 泰Ａ | F70: 服装纺织 | G70: 纺织行业 | H70: 104.499 | I70: -1.e-003 | J70: 5.0000000000000001e-004 | K70: 6.86 | L70: -1.5e-003 | M70: 116.2 | N70: 8.91 | O70: 0.35700000000000004 | P70: 76.99 | Q70: 转股中 | R70: 5.33年 | S70: 3.33年 | T70: 14 | U70: 1.8 | V70: 1.e-003 | W70: 0.23800000000000002 | X70: 0.183 | Y70: 59 | Z70: 0.77 | AA70: 2.0499999999999997e-002 | AB70: 1.4999999999999999e-002 | AC70: -2.2000000000000001e-003 | AD70: -4.3e-003 | AE70: 89.35 | AF70: 92.8 | AG70: 0.32 | AH70: AA+ | AI70: 4.4000000000000004e-002 | AJ70: =H70+100*O70 -> 140.19900000000001 | AK70: 132 | AL70: 143 | AM70: 39.2 | AN70: 130 | AO70: -1.1000000000000001e-002 | AP70: 21 | AQ70: 鲁泰转债!
A71: 311 | B71: 128013 | C71: 洪涛转债! | D71: 2325 | E71: 洪涛股份 | F71: 建筑 | G71: 装饰工程 | H71: 106.298 | I71: -9.1999999999999998e-003 | J71: 4.0999999999999995e-003 | K71: 2.87 | L71: -1.37e-002 | M71: 109.8 | N71: 3.1 | O71: 0.14800000000000002 | P71: 92.58 | Q71: 转股中 | R71: 1.63年 | S71: 回售中 | T71: 12 | U71: 19 | V71: 1.3999999999999999e-002 | W71: 0.33399999999999996 | X71: 0.309 | Y71: 36 | Z71: 1.2 | AA71: 2.0299999999999999e-002 | AB71: 8.8999999999999999e-003 | AC71: 回售中 | AD71: 回售中 | AE71: 100.3 | AF71: 99.34 | AG71: 0.37 | AH71: AA- | AI71: 6.4000000000000001e-002 | AJ71: =H71+100*O71 -> 121.098 | AK71: 120 | AL71: 14 | AM71: 19.7 | AN71: 6 | AO71: -4.0999999999999995e-002 | AP71: 93 | AQ71: 洪涛转债!
A72: 174 | B72: 128081 | C72: 海亮转债! | D72: 2203 | E72: 海亮股份 | F72: 有色金属 | G72: 铜金属 | H72: 104.498 | I72: -9.7000000000000003e-003 | J72: -4.1999999999999997e-003 | K72: 7.92 | L72: -3.7699999999999997e-002 | M72: 114.9 | N72: 9.76 | O72: 0.28800000000000003 | P72: 81.15 | Q72: 转股中 | R72: 4.95年 | S72: 2.95年 | T72: 31.5 | U72: 8.5 | V72: 3.0000000000000001e-003 | W72: 0.20399999999999999 | X72: 0.16500000000000001 | Y72: 155 | Z72: 1.72 | AA72: 1.9699999999999999e-002 | AB72: 1.4199999999999999e-002 | AC72: -3.4000000000000002e-003 | AD72: -5.5000000000000005e-003 | AE72: 90.43 | AF72: 93.05 | AG72: 0.37 | AH72: AA | AI72: 4.4400000000000002e-002 | AJ72: =H72+100*O72 -> 133.298 | AK72: 127.8 | AL72: 98 | AM72: 34.8 | AN72: 90 | AO72: -5.0000000000000003e-002 | AP72: 49 | AQ72: 海亮转债!
A73: 54 | B73: 113596 | C73: 城地转债! | D73: 603887 | E73: 城地香江 | F73: 通信互联 | G73: 通信设备 | H73: 102.15 | I73: -1.0700000000000001e-002 | J73: 5.6000000000000008e-003 | K73: 18.49 | L73: -1.9099999999999999e-002 | M73: 113.5 | N73: 29.21 | O73: 0.61399999999999999 | P73: 63.3 | Q73: 55天 | R73: 5.63年 | S73: 3.63年 | T73: 12 | U73: 7.8 | V73: 6.0000000000000001e-003 | W73: 0.17300000000000001 | X73: 0.109 | Y73: 69 | Z73: 1.92 | AA73: 1.9299999999999998e-002 | AB73: 1.4800000000000001e-002 | AC73: 4.4000000000000003e-003 | AD73: 2.3999999999999998e-003 | AE73: 81.39 | AF73: 79.4 | AG73: 0.26 | AH73: AA- | AI73: 6.7000000000000004e-002 | AJ73: =H73+100*O73 -> 163.55000000000001 | AK73: 141 | AL73: 212 | AM73: 59.6 | AN73: 250 | AO73: -9.0999999999999998e-002 | AP73: 10 | AQ73: 城地转债!
A74: 39 | B74: 113601 | C74: 塞力转债 | D74: 603716 | E74: 塞力医疗 | F74: 医药 | G74: 医药商业 | H74: 109.04 | I74: 1.2999999999999999e-003 | J74: 2.8000000000000004e-003 | K74: 17.24 | L74: 5.7999999999999996e-003 | M74: 121.3 | N74: 16.98 | O74: 7.400000000000001e-002 | P74: 101.53 | Q74: 2月18天 | R74: 5.69年 | S74: 3.69年 | T74: 5.43 | U74: 12 | V74: 2.1000000000000001e-002 | W74: 0.154 | X74: 0.156 | Y74: 35 | Z74: 2.32 | AA74: 1.9299999999999998e-002 | AB74: 1.2699999999999999e-002 | AC74: -1.18e-002 | AD74: -1.3899999999999999e-002 | AE74: 81.38 | AF74: 84.54 | AG74: 0.7 | AH74: AA- | AI74: 6.7000000000000004e-002 | AJ74: =H74+100*O74 -> 116.44000000000001 | AK74: 116.5 | AL74: 9 | AM74: 32 | AN74: 59 | AO74: 3.1e-002 | AP74: 24 | AQ74: 塞力转债
A75: 171 | B75: 128083 | C75: 新北转债! | D75: 2376 | E75: 新北洋 | F75: 电子 | G75: 电子产品 | H75: 105 | I75: -2.8000000000000004e-003 | J75: 1.7000000000000001e-003 | K75: 9.04 | L75: -3.3e-003 | M75: 115.2 | N75: 11.7 | O75: 0.35899999999999999 | P75: 77.26 | Q75: 转股中 | R75: 5年1.1天 | S75: 3年1.1天 | T75: 8.77 | U75: 1 | V75: 1.e-003 | W75: 0.14599999999999999 | X75: 0.113 | Y75: 60 | Z75: 1.78 | AA75: 1.9099999999999999e-002 | AB75: 1.3500000000000002e-002 | AC75: -4.0000000000000001e-003 | AD75: -6.1999999999999998e-003 | AE75: 90.07 | AF75: 92.43 | AG75: 0.33 | AH75: AA | AI75: 4.5999999999999999e-002 | AJ75: =H75+100*O75 -> 140.90000000000001 | AK75: 132.7 | AL75: 151 | AM75: 40.3 | AN75: 135 | AO75: -2.9999999999999999e-002 | AP75: 18 | AQ75: 新北转债!
A76: 226 | B76: 123024 | C76: 岱勒转债! | D76: 300700 | E76: 岱勒新材 | F76: 机械装备 | G76: 专用设备 | H76: 106.341 | I76: -3.5299999999999998e-002 | J76: 2.0799999999999999e-002 | K76: 19.81 | L76: -4.4400000000000002e-002 | M76: 113 | N76: 24.9 | O76: 0.33700000000000002 | P76: 79.56 | Q76: 转股中 | R76: 3.27年 | S76: 1.27年 | T76: 2.1 | U76: 23 | V76: 0.10300000000000001 | W76: 0.129 | X76: 0.10199999999999999 | Y76: 16 | Z76: 3.31 | AA76: 1.9e-002 | AB76: 1.1599999999999999e-002 | AC76: -3.0299999999999997e-002 | AD76: -3.2599999999999997e-002 | AE76: 91.56 | AF76: 89.09 | AG76: 0.33 | AH76: A+ | AI76: 7.6399999999999996e-002 | AJ76: =H76+100*O76 -> 140.041 | AK76: 133.1 | AL76: 155 | AM76: 41.6 | AN76: 150 | AO76: -9.4e-002 | AP76: 36 | AQ76: 岱勒转债!
A77: 214 | B77: 113026 | C77: 核能转债! | D77: 601985 | E77: 中国核电 | F77: 能源电力 | G77: 核电 | H77: 101.75 | I77: -3.5999999999999999e-003 | J77: 3.5999999999999999e-003 | K77: 4.67 | L77: 0. | M77: 109.8 | N77: 6.08 | O77: 0.32500000000000001 | P77: 76.81 | Q77: 转股中 | R77: 4.34年 | S77: 2.34年 | T77: 78 | U77: 21 | V77: 3.0000000000000001e-003 | W77: 0.107 | X77: 8.199999999999999e-002 | Y77: 727 | Z77: 1.39 | AA77: 1.8100000000000002e-002 | AB77: 1.37e-002 | AC77: 6.0999999999999995e-003 | AD77: 3.4999999999999996e-003 | AE77: 93.84 | AF77: 93.16 | AG77: 0.27 | AH77: AAA | AI77: 3.9399999999999998e-002 | AJ77: =H77+100*O77 -> 134.25 | AK77: 126.7 | AL77: 85 | AM77: 32.8 | AN77: 64 | AO77: -1.8000000000000002e-002 | AP77: 51 | AQ77: 核能转债!
A78: 1 | B78: 123076 | C78: 强力转债 | D78: 300429 | E78: 强力新材 | F78: 化工 | G78: 化工 | H78: 106.8 | I78: -1.11e-002 | J78: -1.24e-002 | K78: 16.38 | L78: -4.0399999999999998e-002 | M78: 118.5 | N78: 18.98 | O78: 0.23800000000000002 | P78: 86.3 | Q78: 5月15天 | R78: 5.94年 | S78: 3.94年 | T78: 8.5 | U78: 48 | V78: 5.2999999999999999e-002 | W78: 0.10099999999999999 | X78: 8.6999999999999994e-002 | Y78: 84 | Z78: 4.88 | AA78: 1.8000000000000002e-002 | AB78: 1.24e-002 | AC78: -6.8999999999999999e-003 | AD78: -8.6999999999999994e-003 | AE78: 79.76 | AF78: 81.21 | AG78: 0.58 | AH78: AA- | AI78: 6.7000000000000004e-002 | AJ78: =H78+100*O78 -> 130.59999999999999 | AK78: 127.3 | AL78: 93 | AM78: 46.1 | AN78: 181 | AO78: -0.111 | AP78: 6 | AQ78: 强力转债
A79: 231 | B79: 110053 | C79: 苏银转债! | D79: 600919 | E79: 江苏银行 | F79: 金融 | G79: 银行行业 | H79: 110.68 | I79: 0. | J79: 0. | K79: 5.93 | L79: 0. | M79: 119.1 | N79: 7.28 | O79: 0.35899999999999999 | P79: 81.46 | Q79: 转股中 | R79: 4.26年 | S79: 无权 | T79: 200 | U79: 0 | V79: 0. | W79: 0.29199999999999998 | X79: 0.23800000000000002 | Y79: 685 | Z79: 0.58 | AA79: 1.7899999999999999e-002 | AB79: 9.8999999999999991e-003 | AC79: 无权 | AD79: 无权 | AE79: 无权 | AF79: 101.58 | AG79: 0.3 | AH79: AAA | AI79: 3.9399999999999998e-002 | AJ79: =H79+100*O79 -> 146.58000000000001 | AK79: 139.9 | AL79: 205 | AM79: 38.3 | AN79: 123 | AO79: -3.2000000000000001e-002 | AP79: 46 | AQ79: 苏银转债!
A80: 63 | B80: 113594 | C80: 淳中转债 | D80: 603516 | E80: 淳中科技 | F80: 电子 | G80: 电子产品 | H80: 110.22 | I80: -9.1999999999999998e-003 | J80: -8.1000000000000013e-003 | K80: 31.72 | L80: -3.2899999999999999e-002 | M80: 121.4 | N80: 39.37 | O80: 0.36799999999999999 | P80: 80.57 | Q80: 47天 | R80: 5.61年 | S80: 3.61年 | T80: 3 | U80: 3.8 | V80: 1.1000000000000001e-002 | W80: 7.0999999999999994e-002 | X80: 5.7000000000000002e-002 | Y80: 42 | Z80: 4.7 | AA80: 1.78e-002 | AB80: 1.11e-002 | AC80: -1.3999999999999999e-002 | AD80: -1.6299999999999999e-002 | AE80: 79.03 | AF80: 80.47 | AG80: 0.53 | AH80: A+ | AI80: 7.8e-002 | AJ80: =H80+100*O80 -> 147.01999999999998 | AK80: 139.9 | AL80: 204 | AM80: 59.4 | AN80: 249 | AO80: -6.0999999999999999e-002 | AP80: 5 | AQ80: 淳中转债
A81: 172 | B81: 128082 | C81: 华锋转债! | D81: 2806 | E81: 华锋股份 | F81: 电子 | G81: 元器件制 | H81: 111.5 | I81: -1.4999999999999999e-002 | J81: -4.0999999999999995e-003 | K81: 11.53 | L81: -2.86e-002 | M81: 121.4 | N81: 11.71 | O81: 0.13200000000000001 | P81: 98.46 | Q81: 转股中 | R81: 4.98年 | S81: 2.98年 | T81: 3.45 | U81: 12 | V81: 3.1e-002 | W81: 0.17000000000000001 | X81: 0.16699999999999998 | Y81: 20 | Z81: 1.63 | AA81: 1.7600000000000001e-002 | AB81: 1.01e-002 | AC81: -2.07e-002 | AD81: -2.3300000000000001e-002 | AE81: 83.1 | AF81: 84.88 | AG81: 0.67 | AH81: A+ | AI81: 7.6399999999999996e-002 | AJ81: =H81+100*O81 -> 124.7 | AK81: 124.5 | AL81: 56 | AM81: 39.7 | AN81: 133 | AO81: -8.0000000000000002e-002 | AP81: 59 | AQ81: 华锋转债!
A82: 68 | B82: 123059 | C82: 银信转债 | D82: 300231 | E82: 银信科技 | F82: 计算机及 | G82: 软件开发 | H82: 112.85 | I82: -2.5499999999999998e-002 | J82: 1.1000000000000001e-002 | K82: 9.42 | L82: -2.3799999999999998e-002 | M82: 124.1 | N82: 9.91 | O82: 0.187 | P82: 95.06 | Q82: 41天 | R82: 5.59年 | S82: 3.59年 | T82: 3.91 | U82: 11 | V82: 2.4e-002 | W82: 9.4e-002 | X82: 8.900000000000001e-002 | Y82: 42 | Z82: 3.17 | AA82: 1.7500000000000002e-002 | AB82: 1.01e-002 | AC82: -2.1700000000000001e-002 | AD82: -2.3700000000000002e-002 | AE82: 81.73 | AF82: 87 | AG82: 0.61 | AH82: AA- | AI82: 6.7000000000000004e-002 | AJ82: =H82+100*O82 -> 131.54999999999998 | AK82: 130.6 | AL82: 130 | AM82: 43.6 | AN82: 167 | AO82: -5.7999999999999996e-002 | AP82: 12 | AQ82: 银信转债
A83: 292 | B83: 128026 | C83: 众兴转债! | D83: 2772 | E83: 众兴菌业 | F83: 农业 | G83: 种植业 | H83: 104.9 | I83: 4.7999999999999996e-003 | J83: 1.03e-002 | K83: 10.08 | L83: 3.49e-002 | M83: 110.3 | N83: 11.45 | O83: 0.192 | P83: 88.03 | Q83: 转股中 | R83: 3年2.1天 | S83: 1年2.1天 | T83: 9.19 | U83: 22 | V83: 2.3e-002 | W83: 0.248 | X83: 0.218 | Y83: 37 | Z83: 1.51 | AA83: 1.7299999999999999e-002 | AB83: 1.0700000000000001e-002 | AC83: -1.7299999999999999e-002 | AD83: -2.1899999999999999e-002 | AE83: 95.53 | AF83: 91.62 | AG83: 0.43 | AH83: AA- | AI83: 6.54e-002 | AJ83: =H83+100*O83 -> 124.10000000000001 | AK83: 121.8 | AL83: 28 | AM83: 26.2 | AN83: 17 | AO83: 7.4999999999999997e-002 | AP83: 58 | AQ83: 众兴转债!
A84: 43 | B84: 110072 | C84: 广汇转债! | D84: 600297 | E84: 广汇汽车 | F84: 汽车 | G84: 分销、售 | H84: 104 | I84: 5.9999999999999995e-004 | J84: -1.04e-002 | K84: 3.28 | L84: -2.3799999999999998e-002 | M84: 114.5 | N84: 4.03 | O84: 0.27800000000000002 | P84: 81.39 | Q84: 2月15天 | R84: 5.69年 | S84: 3.69年 | T84: 33.7 | U84: 30 | V84: 9.0000000000000011e-003 | W84: 0.127 | X84: 0.10300000000000001 | Y84: 266 | Z84: 0.67 | AA84: 1.7299999999999999e-002 | AB84: 1.26e-002 | AC84: -2.5000000000000001e-003 | AD84: -4.0000000000000001e-003 | AE84: 87.34 | AF84: 89.96 | AG84: 0.41 | AH84: AA+ | AI84: 4.4000000000000004e-002 | AJ84: =H84+100*O84 -> 131.80000000000001 | AK84: 126.6 | AL84: 83 | AM84: 36.7 | AN84: 106 | AO84: -5.0000000000000003e-002 | AP84: 18 | AQ84: 广汇转债!
A85: 109 | B85: 113578 | C85: 全筑转债 | D85: 603030 | E85: 全筑股份 | F85: 建筑 | G85: 装饰工程 | H85: 108.18 | I85: -9.1999999999999998e-003 | J85: -1.9e-003 | K85: 5.11 | L85: -2.1099999999999997e-002 | M85: 118.3 | N85: 5.43 | O85: 0.14999999999999999 | P85: 94.11 | Q85: 转股中 | R85: 5.36年 | S85: 3.36年 | T85: 3.84 | U85: 6.8 | V85: 1.6e-002 | W85: 0.14000000000000001 | X85: 0.13100000000000001 | Y85: 27 | Z85: 1.24 | AA85: 1.72e-002 | AB85: 1.11e-002 | AC85: -1.18e-002 | AD85: -1.38e-002 | AE85: 88.74 | AF85: 93.43 | AG85: 0.53 | AH85: AA | AI85: 4.5999999999999999e-002 | AJ85: =H85+100*O85 -> 123.18000000000001 | AK85: 122.3 | AL85: 31 | AM85: 28.8 | AN85: 32 | AO85: -6.2e-002 | AP85: 14 | AQ85: 全筑转债
A86: 38 | B86: 113039 | C86: 嘉泽转债! | D86: 601619 | E86: 嘉泽新能 | F86: 能源电力 | G86: 风能 | H86: 102.9 | I86: -9.7999999999999997e-003 | J86: -5.6000000000000008e-003 | K86: 3.05 | L86: -3.1699999999999999e-002 | M86: 113.1 | N86: 3.57 | O86: 0.20399999999999999 | P86: 85.43 | Q86: 2月20天 | R86: 5.70年 | S86: 3.70年 | T86: 13 | U86: 4.6 | V86: 3.0000000000000001e-003 | W86: 0.20600000000000002 | X86: 0.17600000000000002 | Y86: 63 | Z86: 1.85 | AA86: 1.7000000000000001e-002 | AB86: 1.2699999999999999e-002 | AC86: 1.8e-003 | AD86: -1.e-004 | AE86: 87.18 | AF86: 87.93 | AG86: 0.49 | AH86: AA | AI86: 4.5999999999999999e-002 | AJ86: =H86+100*O86 -> 123.30000000000001 | AK86: 120.4 | AL86: 16 | AM86: 32.4 | AN86: 63 | AO86: -3.7000000000000005e-002 | AP86: 16 | AQ86: 嘉泽转债!
A87: 125 | B87: 113574 | C87: 华体转债! | D87: 603679 | E87: 华体科技 | F87: 城市公用 | G87: 城市公用 | H87: 106.79 | I87: -2.8000000000000004e-003 | J87: -1.8799999999999997e-002 | K87: 22.46 | L87: -7.1099999999999997e-002 | M87: 116.4 | N87: 33.99 | O87: 0.61599999999999999 | P87: 66.08 | Q87: 转股中 | R87: 5.30年 | S87: 3.30年 | T87: 2.09 | U87: 9.4 | V87: 4.2000000000000003e-002 | W87: 6.5000000000000002e-002 | X87: 4.2999999999999997e-002 | Y87: 32 | Z87: 4.38 | AA87: 1.6799999999999999e-002 | AB87: 1.11e-002 | AC87: -6.0999999999999995e-003 | AD87: -8.6e-003 | AE87: 80.87 | AF87: 78.98 | AG87: 0.3 | AH87: A+ | AI87: 7.8e-002 | AJ87: =H87+100*O87 -> 168.39000000000001 | AK87: 147.5 | AL87: 246 | AM87: 66.6 | AN87: 273 | AO87: -4.8000000000000001e-002 | AP87: 15 | AQ87: 华体转债!
A88: 72 | B88: 110071 | C88: 湖盐转债 | D88: 600929 | E88: 雪天盐业 | F88: 食品饮料 | G88: 食品饮料 | H88: 105.16 | I88: -1.2199999999999999e-002 | J88: 6.0999999999999995e-003 | K88: 6.02 | L88: -1.15e-002 | M88: 115.2 | N88: 6.6 | O88: 0.153 | P88: 91.21 | Q88: 38天 | R88: 5.58年 | S88: 3.58年 | T88: 7.2 | U88: 4.7 | V88: 6.0000000000000001e-003 | W88: 0.13 | X88: 0.11900000000000001 | Y88: 55 | Z88: 2.17 | AA88: 1.6799999999999999e-002 | AB88: 1.18e-002 | AC88: -3.8e-003 | AD88: -5.6999999999999993e-003 | AE88: 87.76 | AF88: 90.07 | AG88: 0.54 | AH88: AA | AI88: 4.5999999999999999e-002 | AJ88: =H88+100*O88 -> 120.45999999999999 | AK88: 119.1 | AL88: 12 | AM88: 29 | AN88: 35 | AO88: -2.7999999999999997e-002 | AP88: 14 | AQ88: 湖盐转债
A89: 184 | B89: 127014 | C89: 北方转债 | D89: 65 | E89: 北方国际 | F89: 建筑 | G89: 建筑工程 | H89: 106.35 | I89: -1.0500000000000001e-002 | J89: -4.0000000000000002e-004 | K89: 7.35 | L89: -2.7799999999999998e-002 | M89: 115.1 | N89: 8.75 | O89: 0.26600000000000001 | P89: 84 | Q89: 转股中 | R89: 4.87年 | S89: 2.87年 | T89: 5.78 | U89: 2.5 | V89: 4.0000000000000001e-003 | W89: 0.10199999999999999 | X89: 8.5999999999999993e-002 | Y89: 57 | Z89: 1.06 | AA89: 1.67e-002 | AB89: 1.1000000000000001e-002 | AC89: -8.6999999999999994e-003 | AD89: -1.1000000000000001e-002 | AE89: 91.45 | AF89: 94.42 | AG89: 0.39 | AH89: AA+ | AI89: 4.24e-002 | AJ89: =H89+100*O89 -> 132.94999999999999 | AK89: 128.7 | AL89: 106 | AM89: 34.3 | AN89: 85 | AO89: -6.2e-002 | AP89: 17 | AQ89: 北方转债
A90: 96 | B90: 123053 | C90: 宝通转债 | D90: 300031 | E90: 宝通科技 | F90: 通信互联 | G90: 互联网 | H90: 110.999 | I90: -2.7999999999999997e-002 | J90: -5.1999999999999998e-003 | K90: 17.97 | L90: -6.1600000000000002e-002 | M90: 121.3 | N90: 20.8 | O90: 0.28499999999999998 | P90: 86.39 | Q90: 转股中 | R90: 5.48年 | S90: 3.48年 | T90: 5 | U90: 9.9 | V90: 1.8000000000000002e-002 | W90: 7.0000000000000007e-002 | X90: 6.0999999999999999e-002 | Y90: 71 | Z90: 2.48 | AA90: 1.67e-002 | AB90: 9.8999999999999991e-003 | AC90: -1.7299999999999999e-002 | AD90: -1.95e-002 | AE90: 82.5 | AF90: 85.71 | AG90: 0.54 | AH90: AA- | AI90: 6.7000000000000004e-002 | AJ90: =H90+100*O90 -> 139.499 | AK90: 135.6 | AL90: 173 | AM90: 49.9 | AN90: 200 | AO90: -0.11699999999999999 | AP90: 6 | AQ90: 宝通转债
A91: 217 | B91: 113024 | C91: 核建转债! | D91: 601611 | E91: 中国核建 | F91: 建筑 | G91: 建筑工程 | H91: 102.44 | I91: -4.0999999999999995e-003 | J91: -3.0000000000000001e-003 | K91: 7.1 | L91: -3.1400000000000004e-002 | M91: 109.7 | N91: 9.76 | O91: 0.40799999999999997 | P91: 72.75 | Q91: 转股中 | R91: 4.32年 | S91: 2.32年 | T91: 30 | U91: 6.2 | V91: 2.e-003 | W91: 0.159 | X91: 0.11599999999999999 | Y91: 188 | Z91: 1.75 | AA91: 1.6299999999999999e-002 | AB91: 1.2e-002 | AC91: 3.0000000000000001e-003 | AD91: 5.0000000000000001e-004 | AE91: 93.82 | AF91: 93.13 | AG91: 0.22 | AH91: AAA | AI91: 3.9399999999999998e-002 | AJ91: =H91+100*O91 -> 143.24000000000001 | AK91: 132.1 | AL91: 145 | AM91: 38.3 | AN91: 122 | AO91: -6.2e-002 | AP91: 44 | AQ91: 核建转债!
A92: 188 | B92: 128076 | C92: 金轮转债! | D92: 2722 | E92: 金轮股份 | F92: 机械装备 | G92: 专用设备 | H92: 106.385 | I92: -2.2200000000000001e-002 | J92: 1.09e-002 | K92: 11.96 | L92: -2.4500000000000001e-002 | M92: 114.9 | N92: 14.76 | O92: 0.313 | P92: 81.03 | Q92: 转股中 | R92: 4.84年 | S92: 2.84年 | T92: 2.14 | U92: 16 | V92: 6.9000000000000006e-002 | W92: 0.10199999999999999 | X92: 8.3000000000000004e-002 | Y92: 21 | Z92: 1.14 | AA92: 1.6299999999999999e-002 | AB92: 1.0700000000000001e-002 | AC92: -9.4999999999999998e-003 | AD92: -1.1699999999999999e-002 | AE92: 85.61 | AF92: 85.06 | AG92: 0.46 | AH92: AA- | AI92: 6.54e-002 | AJ92: =H92+100*O92 -> 137.685 | AK92: 131.7 | AL92: 140 | AM92: 46.1 | AN92: 183 | AO92: -5.5e-002 | AP92: 43 | AQ92: 金轮转债!
A93: 295 | B93: 128022 | C93: 众信转债! | D93: 2707 | E93: 众信旅游 | F93: 旅游餐饮 | G93: 旅游 | H93: 103.801 | I93: -9.1999999999999998e-003 | J93: 2.8000000000000004e-003 | K93: 5.84 | L93: -3.7900000000000003e-002 | M93: 108.8 | N93: 7.92 | O93: 0.40799999999999997 | P93: 73.74 | Q93: 转股中 | R93: 2.97年 | S93: 0.97年 | T93: 4.56 | U93: 6.3 | V93: 1.3000000000000001e-002 | W93: 8.5999999999999993e-002 | X93: 6.4000000000000001e-002 | Y93: 53 | Z93: 2.49 | AA93: 1.6200000000000003e-002 | AB93: 1.0500000000000001e-002 | AC93: -1.9099999999999999e-002 | AD93: -2.1700000000000001e-002 | AE93: 96.8 | AF93: 96.16 | AG93: 0.17 | AH93: AA | AI93: 4.2999999999999997e-002 | AJ93: =H93+100*O93 -> 144.601 | AK93: 133.9 | AL93: 163 | AM93: 37.1 | AN93: 110 | AO93: -0.11699999999999999 | AP93: 24 | AQ93: 众信转债!
A94: 249 | B94: 128049 | C94: 华源转债! | D94: 2787 | E94: 华源控股 | F94: 造纸包装 | G94: 包装材料 | H94: 107.612 | I94: -1.1699999999999999e-002 | J94: -1.6000000000000001e-003 | K94: 6.82 | L94: -2.4300000000000002e-002 | M94: 114.5 | N94: 7.42 | O94: 0.17100000000000001 | P94: 91.91 | Q94: 转股中 | R94: 3.96年 | S94: 1.96年 | T94: 3.63 | U94: 2 | V94: 5.0000000000000001e-003 | W94: 0.16800000000000001 | X94: 0.155 | Y94: 22 | Z94: 1.44 | AA94: 1.61e-002 | AB94: 9.3999999999999986e-003 | AC94: -2.1299999999999999e-002 | AD94: -2.3799999999999998e-002 | AE94: 89.94 | AF94: 89.49 | AG94: 0.55 | AH94: AA- | AI94: 6.54e-002 | AJ94: =H94+100*O94 -> 124.71199999999999 | AK94: 123.3 | AL94: 40 | AM94: 33.4 | AN94: 71 | AO94: -4.7e-002 | AP94: 51 | AQ94: 华源转债!
A95: 137 | B95: 113570 | C95: 百达转债 | D95: 603331 | E95: 百达精工 | F95: 机械装备 | G95: 机械装备 | H95: 106.4 | I95: -4.1999999999999997e-003 | J95: -3.9000000000000003e-003 | K95: 10.49 | L95: -1.2199999999999999e-002 | M95: 115.3 | N95: 11.54 | O95: 0.17100000000000001 | P95: 90.9 | Q95: 转股中 | R95: 5.25年 | S95: 3.25年 | T95: 2.8 | U95: 2.3 | V95: 8.0000000000000002e-003 | W95: 0.14899999999999999 | X95: 0.13600000000000001 | Y95: 19 | Z95: 2.42 | AA95: 1.5700000000000002e-002 | AB95: 1.04e-002 | AC95: -7.3000000000000001e-003 | AD95: -9.3999999999999986e-003 | AE95: 80.56 | AF95: 78.43 | AG95: 0.66 | AH95: A+ | AI95: 7.8e-002 | AJ95: =H95+100*O95 -> 123.5 | AK95: 121.9 | AL95: 29 | AM95: 41.3 | AN95: 147 | AO95: -1.3999999999999999e-002 | AP95: 35 | AQ95: 百达转债
A96: 113 | B96: 123049 | C96: 维尔转债 | D96: 300190 | E96: 维尔利 | F96: 城市公用 | G96: 三废处理 | H96: 115.15 | I96: -1.3500000000000002e-002 | J96: 5.0000000000000001e-004 | K96: 7.97 | L96: -1.8500000000000003e-002 | M96: 124.8 | N96: 7.48 | O96: 8.1000000000000003e-002 | P96: 106.55 | Q96: 转股中 | R96: 5.34年 | S96: 3.34年 | T96: 9.17 | U96: 3.1 | V96: 3.0000000000000001e-003 | W96: 0.14699999999999999 | X96: 0.157 | Y96: 62 | Z96: 1.48 | AA96: 1.5600000000000001e-002 | AB96: 7.7000000000000002e-003 | AC96: -2.7099999999999999e-002 | AD96: -2.9500000000000002e-002 | AE96: 83.7 | AF96: 89.05 | AG96: 0.7 | AH96: AA- | AI96: 6.7000000000000004e-002 | AJ96: =H96+100*O96 -> 123.25 | AK96: 123.7 | AL96: 45 | AM96: 34.7 | AN96: 89 | AO96: -4.0000000000000001e-002 | AP96: 14 | AQ96: 维尔转债
A97: 98 | B97: 113584 | C97: 家悦转债! | D97: 603708 | E97: 家家悦 | F97: 商业零售 | G97: 超市 | H97: 106.09 | I97: 8.3999999999999995e-003 | J97: -1.3000000000000001e-002 | K97: 23.05 | L97: -3.2300000000000002e-002 | M97: 115.3 | N97: 37.97 | O97: 0.748 | P97: 60.71 | Q97: 1.1天 | R97: 5.48年 | S97: 3.48年 | T97: 6.45 | U97: 43 | V97: 6.3e-002 | W97: 4.5999999999999999e-002 | X97: 2.7999999999999997e-002 | Y97: 140 | Z97: 4.67 | AA97: 1.5600000000000001e-002 | AB97: 1.0500000000000001e-002 | AC97: -6.0000000000000001e-003 | AD97: -8.0000000000000002e-003 | AE97: 88.24 | AF97: 90.55 | AG97: 0.14 | AH97: AA | AI97: 4.5999999999999999e-002 | AJ97: =H97+100*O97 -> 180.88999999999999 | AK97: 151.5 | AL97: 265 | AM97: 60.9 | AN97: 253 | AO97: -5.0000000000000003e-002 | AP97: 6 | AQ97: 家悦转债!
A98: 52 | B98: 123063 | C98: 大禹转债 | D98: 300021 | E98: 大禹节水 | F98: 化工 | G98: 橡胶塑料 | H98: 116.5 | I98: -9.3999999999999986e-003 | J98: 1.0800000000000001e-002 | K98: 5.32 | L98: 1.9e-003 | M98: 126.5 | N98: 4.94 | O98: 8.199999999999999e-002 | P98: 107.69 | Q98: 54天 | R98: 5.63年 | S98: 4.63年 | T98: 6.38 | U98: 9.1 | V98: 1.2e-002 | W98: 0.14999999999999999 | X98: 0.16200000000000001 | Y98: 42 | Z98: 2.94 | AA98: 1.4999999999999999e-002 | AB98: 7.1999999999999998e-003 | AC98: -1.7899999999999999e-002 | AD98: -2.0499999999999997e-002 | AE98: 78.84 | AF98: 88.5 | AG98: 0.72 | AH98: AA- | AI98: 6.7000000000000004e-002 | AJ98: =H98+100*O98 -> 124.7 | AK98: 125.3 | AL98: 67 | AM98: 36.8 | AN98: 107 | AO98: -4.0000000000000001e-002 | AP98: 15 | AQ98: 大禹转债
A99: 250 | B99: 110047 | C99: 山鹰转债 | D99: 600567 | E99: 山鹰国际 | F99: 造纸包装 | G99: 包装用纸 | H99: 111 | I99: -8.8999999999999999e-003 | J99: 2.0999999999999999e-003 | K99: 3.11 | L99: -1.5800000000000002e-002 | M99: 117.5 | N99: 3.34 | O99: 0.192 | P99: 93.11 | Q99: 转股中 | R99: 3.95年 | S99: 1.95年 | T99: 23 | U99: 4.4 | V99: 2.e-003 | W99: 0.161 | X99: 0.14999999999999999 | Y99: 143 | Z99: 0.97 | AA99: 1.4800000000000001e-002 | AB99: 6.8999999999999999e-003 | AC99: -3.5799999999999998e-002 | AD99: -3.8300000000000001e-002 | AE99: 94.25 | AF99: 100.03 | AG99: 0.43 | AH99: AA+ | AI99: 4.24e-002 | AJ99: =H99+100*O99 -> 130.19999999999999 | AK99: 128.9 | AL99: 110 | AM99: 28.9 | AN99: 33 | AO99: -5.9999999999999998e-002 | AP99: 34 | AQ99: 山鹰转债
A100: 210 | B100: 128066 | C100: 亚泰转债! | D100: 2811 | E100: 郑中设计 | F100: 建筑 | G100: 装饰工程 | H100: 110.5 | I100: -1.6899999999999998e-002 | J100: -1.4000000000000002e-003 | K100: 9.49 | L100: -2.87e-002 | M100: 117.5 | N100: 9.67 | O100: 0.126 | P100: 98.14 | Q100: 转股中 | R100: 4.35年 | S100: 2.35年 | T100: 4.8 | U100: 5.1 | V100: 1.e-002 | W100: 0.187 | X100: 0.184 | Y100: 26 | Z100: 1.74 | AA100: 1.46e-002 | AB100: 7.3000000000000001e-003 | AC100: -2.4799999999999999e-002 | AD100: -2.76e-002 | AE100: 88.74 | AF100: 89.81 | AG100: 0.64 | AH100: AA- | AI100: 6.54e-002 | AJ100: =H100+100*O100 -> 123.09999999999999 | AK100: 122.9 | AL100: 36 | AM100: 33 | AN100: 65 | AO100: -7.2000000000000008e-002 | AP100: 61 | AQ100: 亚泰转债!
A101: 50 | B101: 128125 | C101: 华阳转债 | D101: 2949 | E101: 华阳国际 | F101: 建筑 | G101: 建筑工程 | H101: 109.402 | I101: -1.78e-002 | J101: -1.1999999999999999e-003 | K101: 20.42 | L101: -4.0399999999999998e-002 | M101: 118.5 | N101: 25.79 | O101: 0.38200000000000001 | P101: 79.18 | Q101: 56天 | R101: 5.63年 | S101: 3.63年 | T101: 4.5 | U101: 4 | V101: 8.0000000000000002e-003 | W101: 0.11199999999999999 | X101: 8.900000000000001e-002 | Y101: 40 | Z101: 3.28 | AA101: 1.46e-002 | AB101: 8.6999999999999994e-003 | AC101: -1.38e-002 | AD101: -1.5700000000000002e-002 | AE101: 81.36 | AF101: 82.84 | AG101: 0.47 | AH101: AA- | AI101: 6.7000000000000004e-002 | AJ101: =H101+100*O101 -> 147.602 | AK101: 139.6 | AL101: 203 | AM101: 56.8 | AN101: 241 | AO101: -9.3000000000000013e-002 | AP101: 3 | AQ101: 华阳转债
A102: 124 | B102: 113033 | C102: 利群转债! | D102: 601366 | E102: 利群股份 | F102: 商业零售 | G102: 商场 | H102: 107.01 | I102: -9.300000000000001e-003 | J102: 9.300000000000001e-003 | K102: 6.53 | L102: 0. | M102: 115.3 | N102: 7.01 | O102: 0.14899999999999999 | P102: 93.15 | Q102: 转股中 | R102: 5.30年 | S102: 3.30年 | T102: 18 | U102: 5.2 | V102: 3.0000000000000001e-003 | W102: 0.32000000000000001 | X102: 0.29799999999999999 | Y102: 56 | Z102: 1.26 | AA102: 1.4499999999999999e-002 | AB102: 9.1999999999999998e-003 | AC102: -8.8000000000000005e-003 | AD102: -1.09e-002 | AE102: 88.95 | AF102: 91.28 | AG102: 0.54 | AH102: AA | AI102: 4.5999999999999999e-002 | AJ102: =H102+100*O102 -> 121.91 | AK102: 120.9 | AL102: 20 | AM102: 29.6 | AN102: 39 | AO102: -1.6e-002 | AP102: 39 | AQ102: 利群转债!
A103: 151 | B103: 128094 | C103: 星帅转债 | D103: 2860 | E103: 星帅尔 | F103: 家电 | G103: 零部件制 | H103: 113.32 | I103: -1.29e-002 | J103: 2.53e-002 | K103: 14.04 | L103: 1.7399999999999999e-002 | M103: 121.5 | N103: 13.95 | O103: 0.126 | P103: 100.65 | Q103: 转股中 | R103: 5年36天 | S103: 3年36天 | T103: 2.8 | U103: 54 | V103: 0.16800000000000001 | W103: 0.10000000000000001 | X103: 0.10099999999999999 | Y103: 28 | Z103: 3 | AA103: 1.41e-002 | AB103: 6.8000000000000005e-003 | AC103: -2.46e-002 | AD103: -2.7200000000000002e-002 | AE103: 82.14 | AF103: 83.68 | AG103: 0.71 | AH103: A+ | AI103: 7.8e-002 | AJ103: =H103+100*O103 -> 125.91999999999999 | AK103: 126 | AL103: 76 | AM103: 42.3 | AN103: 154 | AO103: 1.e-002 | AP103: 33 | AQ103: 星帅转债
A104: 40 | B104: 128128 | C104: 齐翔转2 | D104: 2408 | E104: 齐翔腾达 | F104: 化工 | G104: 化工 | H104: 106.7 | I104: -1.2e-002 | J104: 5.9999999999999995e-004 | K104: 8.58 | L104: -1.72e-002 | M104: 115.3 | N104: 8.22 | O104: 2.2000000000000002e-002 | P104: 104.38 | Q104: 2月17天 | R104: 5.69年 | S104: 3.69年 | T104: 29.9 | U104: 39 | V104: 1.2e-002 | W104: 0.19600000000000001 | X104: 0.20499999999999999 | Y104: 152 | Z104: 1.86 | AA104: 1.3999999999999999e-002 | AB104: 9.1000000000000004e-003 | AC104: -7.4000000000000003e-003 | AD104: -9.1999999999999998e-003 | AE104: 87.33 | AF104: 89.69 | AG104: 0.67 | AH104: AA | AI104: 4.5999999999999999e-002 | AJ104: =H104+100*O104 -> 108.90000000000001 | AK104: 109 | AL104: 2 | AM104: 19.3 | AN104: 5 | AO104: -7.2999999999999995e-002 | AP104: 33 | AQ104: 齐翔转2
A105: 23 | B105: 123068 | C105: 弘信转债 | D105: 300657 | E105: 弘信电子 | F105: 电子 | G105: 元器件制 | H105: 112.8 | I105: -1.66e-002 | J105: 1.23e-002 | K105: 16.48 | L105: -7.1999999999999998e-003 | M105: 121.2 | N105: 18.45 | O105: 0.26300000000000001 | P105: 89.32 | Q105: 4月11天 | R105: 5.84年 | S105: 3.84年 | T105: 5.7 | U105: 6.3 | V105: 1.e-002 | W105: 0.10099999999999999 | X105: 8.9999999999999997e-002 | Y105: 56 | Z105: 3.85 | AA105: 1.26e-002 | AB105: 6.3e-003 | AC105: -2.e-002 | AD105: -2.1899999999999999e-002 | AE105: 80.49 | AF105: 83.62 | AG105: 0.59 | AH105: AA- | AI105: 6.7000000000000004e-002 | AJ105: =H105+100*O105 -> 139.09999999999999 | AK105: 136.3 | AL105: 179 | AM105: 52.7 | AN105: 223 | AO105: -9.4e-002 | AP105: 4 | AQ105: 弘信转债
A106: 273 | B106: 113508 | C106: 新凤转债! | D106: 603225 | E106: 新凤鸣 | F106: 服装纺织 | G106: 纺织行业 | H106: 107.82 | I106: 2.5000000000000001e-003 | J106: 1.0700000000000001e-002 | K106: 12.75 | L106: 4.7699999999999992e-002 | M106: 112.3 | N106: 15.78 | O106: 0.33399999999999996 | P106: 80.8 | Q106: 转股中 | R106: 3.37年 | S106: 1.37年 | T106: 21.5 | U106: 26 | V106: 1.1000000000000001e-002 | W106: 0.121 | X106: 9.8000000000000004e-002 | Y106: 178 | Z106: 1.58 | AA106: 1.24e-002 | AB106: 5.6000000000000008e-003 | AC106: -3.0800000000000001e-002 | AD106: -3.4200000000000001e-002 | AE106: 96.21 | AF106: 97.29 | AG106: 0.28 | AH106: AA | AI106: 4.4400000000000002e-002 | AJ106: =H106+100*O106 -> 141.22 | AK106: 134.8 | AL106: 168 | AM106: 37.6 | AN106: 116 | AO106: 1.8000000000000002e-002 | AP106: 26 | AQ106: 新凤转债!
A107: 161 | B107: 113030 | C107: 东风转债 | D107: 601515 | E107: 东风股份 | F107: 造纸包装 | G107: 包装材料 | H107: 110.39 | I107: -1.43e-002 | J107: 2.0999999999999999e-003 | K107: 6.11 | L107: -2.5499999999999998e-002 | M107: 117.3 | N107: 6.75 | O107: 0.22 | P107: 90.52 | Q107: 转股中 | R107: 5年13天 | S107: 3年13天 | T107: 2.95 | U107: 1.3 | V107: 4.0000000000000001e-003 | W107: 3.6000000000000004e-002 | X107: 3.3000000000000002e-002 | Y107: 82 | Z107: 1.96 | AA107: 1.24e-002 | AB107: 6.1999999999999998e-003 | AC107: -1.9299999999999998e-002 | AD107: -2.1499999999999998e-002 | AE107: 90.04 | AF107: 93.99 | AG107: 0.48 | AH107: AA | AI107: 4.5999999999999999e-002 | AJ107: =H107+100*O107 -> 132.38999999999999 | AK107: 130.3 | AL107: 125 | AM107: 36.3 | AN107: 101 | AO107: -9.0000000000000011e-003 | AP107: 16 | AQ107: 东风转债
A108: 176 | B108: 113549 | C108: 白电转债 | D108: 603861 | E108: 白云电器 | F108: 能源电力 | G108: 电力设备 | H108: 108.22 | I108: -5.0000000000000001e-004 | J108: 4.3e-003 | K108: 8.29 | L108: 7.3000000000000001e-003 | M108: 114.8 | N108: 8.88 | O108: 0.159 | P108: 93.36 | Q108: 转股中 | R108: 4.93年 | S108: 2.93年 | T108: 8.8 | U108: 1.4 | V108: 1.e-003 | W108: 0.23999999999999999 | X108: 0.22399999999999998 | Y108: 37 | Z108: 1.56 | AA108: 1.23e-002 | AB108: 6.8000000000000005e-003 | AC108: -1.4999999999999999e-002 | AD108: -1.7100000000000001e-002 | AE108: 90.4 | AF108: 93.02 | AG108: 0.52 | AH108: AA | AI108: 4.4400000000000002e-002 | AJ108: =H108+100*O108 -> 124.12 | AK108: 123.1 | AL108: 37 | AM108: 30.1 | AN108: 40 | AO108: -4.2000000000000003e-002 | AP108: 32 | AQ108: 白电转债
A109: 128 | B109: 123047 | C109: 久吾转债 | D109: 300631 | E109: 久吾高科 | F109: 机械装备 | G109: 专用设备 | H109: 122.17 | I109: -4.7e-002 | J109: 2.5399999999999999e-002 | K109: 18.49 | L109: -3.1400000000000004e-002 | M109: 130.1 | N109: 17.61 | O109: 0.16399999999999998 | P109: 105 | Q109: 转股中 | R109: 5.27年 | S109: 3.27年 | T109: 1.99 | U109: 64 | V109: 0.25700000000000001 | W109: 9.9000000000000005e-002 | X109: 0.10400000000000001 | Y109: 20 | Z109: 2.76 | AA109: 1.23e-002 | AB109: 3.0000000000000001e-003 | AC109: -4.07e-002 | AD109: -4.3899999999999995e-002 | AE109: 82.27 | AF109: 88.61 | AG109: 0.69 | AH109: A+ | AI109: 7.8e-002 | AJ109: =H109+100*O109 -> 138.56999999999999 | AK109: 139.3 | AL109: 202 | AM109: 50.7 | AN109: 206 | AO109: -8.8000000000000009e-002 | AP109: 22 | AQ109: 久吾转债
A110: 42 | B110: 110074 | C110: 精达转债 | D110: 600577 | E110: 精达股份 | F110: 电子 | G110: 电子产品 | H110: 109.6 | I110: -1.7000000000000001e-002 | J110: 1.7000000000000001e-002 | K110: 3.26 | L110: 0. | M110: 117.3 | N110: 3.75 | O110: 0.26100000000000001 | P110: 86.93 | Q110: 2月16天 | R110: 5.69年 | S110: 3.69年 | T110: 7.87 | U110: 8.7 | V110: 1.e-002 | W110: 0.126 | X110: 0.109 | Y110: 63 | Z110: 1.77 | AA110: 1.2199999999999999e-002 | AB110: 6.8000000000000005e-003 | AC110: -1.41e-002 | AD110: -1.6e-002 | AE110: 87.43 | AF110: 91.27 | AG110: 0.46 | AH110: AA | AI110: 4.5999999999999999e-002 | AJ110: =H110+100*O110 -> 135.69999999999999 | AK110: 132.3 | AL110: 146 | AM110: 41 | AN110: 143 | AO110: -3.7000000000000005e-002 | AP110: 7 | AQ110: 精达转债
A111: 259 | B111: 113516 | C111: 苏农转债! | D111: 603323 | E111: 苏农银行 | F111: 金融 | G111: 银行行业 | H111: 109.5 | I111: -1.2699999999999999e-002 | J111: 3.3e-003 | K111: 4.91 | L111: -2.3900000000000001e-002 | M111: 114.3 | N111: 5.52 | O111: 0.23100000000000001 | P111: 88.95 | Q111: 转股中 | R111: 3.64年 | S111: 无权 | T111: 12.9 | U111: 7.3 | V111: 5.0000000000000001e-003 | W111: 0.14599999999999999 | X111: 0.13 | Y111: 89 | Z111: 0.75 | AA111: 1.21e-002 | AB111: 4.8999999999999998e-003 | AC111: 无权 | AD111: 无权 | AE111: 无权 | AF111: 98.54 | AG111: 0.4 | AH111: AA+ | AI111: 4.24e-002 | AJ111: =H111+100*O111 -> 132.59999999999999 | AK111: 130.1 | AL111: 123 | AM111: 31.5 | AN111: 53 | AO111: -2.3e-002 | AP111: 35 | AQ111: 苏农转债!
A112: 79 | B112: 128116 | C112: 瑞达转债 | D112: 2961 | E112: 瑞达期货 | F112: 金融 | G112: 期货行业 | H112: 108 | I112: -3.3e-003 | J112: 1.5700000000000002e-002 | K112: 28.3 | L112: 2.2000000000000002e-002 | M112: 115.3 | N112: 29.82 | O112: 0.13800000000000001 | P112: 94.9 | Q112: 24天 | R112: 5.55年 | S112: 3.55年 | T112: 6.5 | U112: 63 | V112: 8.900000000000001e-002 | W112: 5.2000000000000005e-002 | X112: 4.9000000000000002e-002 | Y112: 126 | Z112: 7.16 | AA112: 1.21e-002 | AB112: 7.0999999999999995e-003 | AC112: -1.09e-002 | AD112: -1.2800000000000001e-002 | AE112: 87.9 | AF112: 90.27 | AG112: 0.56 | AH112: AA | AI112: 4.5999999999999999e-002 | AJ112: =H112+100*O112 -> 121.8 | AK112: 121.1 | AL112: 23 | AM112: 30.8 | AN112: 45 | AO112: 8.0000000000000002e-003 | AP112: 12 | AQ112: 瑞达转债
A113: 28 | B113: 128133 | C113: 奇正转债! | D113: 2287 | E113: 奇正藏药 | F113: 医药 | G113: 中药 | H113: 109.617 | I113: 5.0000000000000001e-003 | J113: 2.29e-002 | K113: 28.04 | L113: 5.0999999999999997e-002 | M113: 117.3 | N113: 30.12 | O113: 0.17699999999999999 | P113: 93.09 | Q113: 3月17天 | R113: 5.78年 | S113: 3.78年 | T113: 8 | U113: 70 | V113: 7.9000000000000001e-002 | W113: 5.4000000000000006e-002 | X113: 5.0000000000000003e-002 | Y113: 149 | Z113: 6.19 | AA113: 1.2e-002 | AB113: 6.7000000000000002e-003 | AC113: -1.38e-002 | AD113: -1.5700000000000002e-002 | AE113: 87.06 | AF113: 90.89 | AG113: 0.55 | AH113: AA | AI113: 4.5999999999999999e-002 | AJ113: =H113+100*O113 -> 127.31700000000001 | AK113: 126.1 | AL113: 78 | AM113: 35.3 | AN113: 94 | AO113: 0.10400000000000001 | AP113: 8 | AQ113: 奇正转债!
A114: 216 | B114: 113534 | C114: 鼎胜转债! | D114: 603876 | E114: 鼎胜新材 | F114: 有色金属 | G114: 小金属 | H114: 109.46 | I114: 1.0800000000000001e-002 | J114: 8.6999999999999994e-003 | K114: 14.37 | L114: 3.8300000000000001e-002 | M114: 114.9 | N114: 15.18 | O114: 0.156 | P114: 94.66 | Q114: 转股中 | R114: 4.33年 | S114: 2.33年 | T114: 12 | U114: 47 | V114: 3.6000000000000004e-002 | W114: 0.192 | X114: 0.182 | Y114: 62 | Z114: 1.74 | AA114: 1.15e-002 | AB114: 5.1999999999999998e-003 | AC114: -2.2799999999999997e-002 | AD114: -2.5399999999999999e-002 | AE114: 92.9 | AF114: 95.59 | AG114: 0.51 | AH114: AA | AI114: 4.4400000000000002e-002 | AJ114: =H114+100*O114 -> 125.05999999999999 | AK114: 124.3 | AL114: 54 | AM114: 28.7 | AN114: 31 | AO114: 3.5000000000000003e-002 | AP114: 32 | AQ114: 鼎胜转债!
A115: 228 | B115: 110056 | C115: 亨通转债! | D115: 600487 | E115: 亨通光电 | F115: 通信互联 | G115: 通信设备 | H115: 109.55 | I115: -2.5000000000000001e-003 | J115: -9.1000000000000004e-003 | K115: 14.1 | L115: -2.6200000000000001e-002 | M115: 114.8 | N115: 15.58 | O115: 0.20999999999999999 | P115: 90.5 | Q115: 转股中 | R115: 4.27年 | S115: 2.27年 | T115: 17.1 | U115: 5.4 | V115: 3.0000000000000001e-003 | W115: 6.2e-002 | X115: 5.5999999999999994e-002 | Y115: 275 | Z115: 1.82 | AA115: 1.1200000000000002e-002 | AB115: 4.8999999999999998e-003 | AC115: -2.41e-002 | AD115: -2.6600000000000002e-002 | AE115: 93.46 | AF115: 96.5 | AG115: 0.44 | AH115: AA+ | AI115: 4.24e-002 | AJ115: =H115+100*O115 -> 130.55000000000001 | AK115: 128.6 | AL115: 105 | AM115: 32.1 | AN115: 62 | AO115: -5.2000000000000005e-002 | AP115: 30 | AQ115: 亨通转债!
A116: 304 | B116: 113014 | C116: 林洋转债! | D116: 601222 | E116: 林洋能源 | F116: 能源电力 | G116: 电力设备 | H116: 106 | I116: -2.3e-002 | J116: 1.8700000000000001e-002 | K116: 6.79 | L116: -1.8799999999999997e-002 | M116: 109.3 | N116: 8.54 | O116: 0.33299999999999996 | P116: 79.51 | Q116: 转股中 | R116: 2.88年 | S116: 0.88年 | T116: 30 | U116: 33 | V116: 1.e-002 | W116: 0.253 | X116: 0.20100000000000001 | Y116: 119 | Z116: 1.14 | AA116: 1.09e-002 | AB116: 4.7999999999999996e-003 | AC116: -3.8100000000000002e-002 | AD116: -4.1299999999999996e-002 | AE116: 97.44 | AF116: 97.02 | AG116: 0.23 | AH116: AA | AI116: 4.2999999999999997e-002 | AJ116: =H116+100*O116 -> 139.30000000000001 | AK116: 132.5 | AL116: 148 | AM116: 35.1 | AN116: 92 | AO116: -8.1000000000000003e-002 | AP116: 22 | AQ116: 林洋转债!
A117: 53 | B117: 128124 | C117: 科华转债! | D117: 2022 | E117: 科华生物 | F117: 医药 | G117: 生物制药 | H117: 103.947 | I117: -9.300000000000001e-003 | J117: -4.5999999999999999e-003 | K117: 16.77 | L117: -3.4500000000000003e-002 | M117: 110.3 | N117: 21.5 | O117: 0.33299999999999996 | P117: 78 | Q117: 54天 | R117: 5.63年 | S117: 3.63年 | T117: 7.38 | U117: 9.6 | V117: 1.2e-002 | W117: 8.5000000000000006e-002 | X117: 6.7000000000000004e-002 | Y117: 86 | Z117: 3 | AA117: 1.0800000000000001e-002 | AB117: 7.3000000000000001e-003 | AC117: -2.3e-003 | AD117: -3.9000000000000003e-003 | AE117: 87 | AF117: 85.99 | AG117: 0.4 | AH117: AA | AI117: 4.5999999999999999e-002 | AJ117: =H117+100*O117 -> 137.24700000000001 | AK117: 129.9 | AL117: 118 | AM117: 42.9 | AN117: 160 | AO117: -8.199999999999999e-002 | AP117: 13 | AQ117: 科华转债!
A118: 11 | B118: 113606 | C118: 荣泰转债 | D118: 603579 | E118: 荣泰健康 | F118: 机械装备 | G118: 专用设备 | H118: 113.89 | I118: -4.5000000000000005e-003 | J118: -1.01e-002 | K118: 31.6 | L118: -2.23e-002 | M118: 121.2 | N118: 33.32 | O118: 0.20100000000000001 | P118: 94.84 | Q118: 4月25天 | R118: 5.89年 | S118: 3.89年 | T118: 6 | U118: 5.5 | V118: 8.0000000000000002e-003 | W118: 0.13600000000000001 | X118: 0.129 | Y118: 44 | Z118: 2.79 | AA118: 1.0800000000000001e-002 | AB118: 4.5999999999999999e-003 | AC118: -2.2099999999999998e-002 | AD118: -2.4e-002 | AE118: 80.29 | AF118: 83.41 | AG118: 0.65 | AH118: AA- | AI118: 6.7000000000000004e-002 | AJ118: =H118+100*O118 -> 133.99000000000001 | AK118: 132.9 | AL118: 154 | AM118: 49.5 | AN118: 196 | AO118: -6.5000000000000002e-002 | AP118: 4 | AQ118: 荣泰转债
A119: 293 | B119: 128025 | C119: 特一转债! | D119: 2728 | E119: 特一药业 | F119: 医药 | G119: 化学制药 | H119: 105.45 | I119: -1.72e-002 | J119: 6.1999999999999998e-003 | K119: 13.2 | L119: -2.4399999999999998e-002 | M119: 108.8 | N119: 14.7 | O119: 0.17399999999999999 | P119: 89.8 | Q119: 转股中 | R119: 2.99年 | S119: 0.99年 | T119: 2.99 | U119: 7.8 | V119: 2.5000000000000001e-002 | W119: 0.111 | X119: 0.10000000000000001 | Y119: 27 | Z119: 2.66 | AA119: 1.0700000000000001e-002 | AB119: 5.1000000000000004e-003 | AC119: -3.2199999999999999e-002 | AD119: -3.4799999999999998e-002 | AE119: 94.55 | AF119: 90.62 | AG119: 0.45 | AH119: AA- | AI119: 6.4000000000000001e-002 | AJ119: =H119+100*O119 -> 122.84999999999999 | AK119: 121.1 | AL119: 24 | AM119: 26.6 | AN119: 19 | AO119: -1.3000000000000001e-002 | AP119: 49 | AQ119: 特一转债!
A120: 59 | B120: 113037 | C120: 紫银转债 | D120: 601860 | E120: 紫金银行 | F120: 金融 | G120: 银行行业 | H120: 109.36 | I120: -1.5e-003 | J120: -6.6e-003 | K120: 4.24 | L120: -1.6200000000000003e-002 | M120: 115.8 | N120: 4.75 | O120: 0.22500000000000001 | P120: 89.26 | Q120: 49天 | R120: 5.61年 | S120: 无权 | T120: 45 | U120: 21 | V120: 4.0000000000000001e-003 | W120: 0.28999999999999998 | X120: 0.25900000000000001 | Y120: 155 | Z120: 1.1 | AA120: 1.04e-002 | AB120: 5.4000000000000003e-003 | AC120: 无权 | AD120: 无权 | AE120: 无权 | AF120: 91.38 | AG120: 0.5 | AH120: AA+ | AI120: 4.4000000000000004e-002 | AJ120: =H120+100*O120 -> 131.86000000000001 | AK120: 129.5 | AL120: 117 | AM120: 38.1 | AN120: 119 | AO120: 0. | AP120: 17 | AQ120: 紫银转债
A121: 58 | B121: 128122 | C121: 兴森转债 | D121: 2436 | E121: 兴森科技 | F121: 电子 | G121: 元器件制 | H121: 108.239 | I121: -1.1399999999999999e-002 | J121: 6.7000000000000002e-003 | K121: 10.37 | L121: -1.89e-002 | M121: 113.3 | N121: 14.18 | O121: 0.47999999999999998 | P121: 73.13 | Q121: 49天 | R121: 4.61年 | S121: 3.61年 | T121: 2.69 | U121: 2.7 | V121: 9.0000000000000011e-003 | W121: 1.7000000000000001e-002 | X121: 1.3000000000000001e-002 | Y121: 154 | Z121: 4.88 | AA121: 1.01e-002 | AB121: 4.7999999999999996e-003 | AC121: -1.15e-002 | AD121: -1.34e-002 | AE121: 88.06 | AF121: 92.94 | AG121: 0.25 | AH121: AA | AI121: 4.4400000000000002e-002 | AJ121: =H121+100*O121 -> 156.239 | AK121: 143.3 | AL121: 228 | AM121: 50.4 | AN121: 204 | AO121: -4.2999999999999997e-002 | AP121: 8 | AQ121: 兴森转债
A122: 267 | B122: 123010 | C122: 博世转债! | D122: 300422 | E122: 博世科 | F122: 城市公用 | G122: 三废处理 | H122: 108.7 | I122: -4.0000000000000002e-004 | J122: -3.5999999999999999e-003 | K122: 11.7 | L122: -6.8000000000000005e-003 | M122: 112.3 | N122: 12.2 | O122: 0.13300000000000001 | P122: 95.9 | Q122: 转股中 | R122: 3.56年 | S122: 1.56年 | T122: 4.3 | U122: 9.2 | V122: 2.e-002 | W122: 9.0999999999999998e-002 | X122: 8.6999999999999994e-002 | Y122: 47 | Z122: 2 | AA122: 9.3999999999999986e-003 | AB122: 3.0000000000000001e-003 | AC122: -3.2000000000000001e-002 | AD122: -3.5000000000000003e-002 | AE122: 92.21 | AF122: 90.01 | AG122: 0.59 | AH122: AA- | AI122: 6.54e-002 | AJ122: =H122+100*O122 -> 122. | AK122: 121.5 | AL122: 26 | AM122: 29.3 | AN122: 38 | AO122: -3.1e-002 | AP122: 30 | AQ122: 博世转债!
A123: 170 | B123: 110063 | C123: 鹰19转债 | D123: 600567 | E123: 山鹰国际 | F123: 造纸包装 | G123: 包装用纸 | H123: 111.09 | I123: -8.1000000000000013e-003 | J123: -2.0000000000000001e-004 | K123: 3.11 | L123: -1.5800000000000002e-002 | M123: 116.2 | N123: 3.3 | O123: 0.17899999999999999 | P123: 94.24 | Q123: 转股中 | R123: 5年2.1天 | S123: 3年2.1天 | T123: 18.6 | U123: 5.9 | V123: 3.0000000000000001e-003 | W123: 0.13 | X123: 0.12300000000000001 | Y123: 143 | Z123: 0.97 | AA123: 9.1999999999999998e-003 | AB123: 3.4000000000000002e-003 | AC123: -2.2200000000000001e-002 | AD123: -2.4300000000000002e-002 | AE123: 90.45 | AF123: 94.07 | AG123: 0.52 | AH123: AA+ | AI123: 4.4000000000000004e-002 | AJ123: =H123+100*O123 -> 128.99000000000001 | AK123: 127.9 | AL123: 99 | AM123: 33.9 | AN123: 78 | AO123: -5.9999999999999998e-002 | AP123: 39 | AQ123: 鹰19转债
A124: 159 | B124: 123039 | C124: 开润转债! | D124: 300577 | E124: 开润股份 | F124: 服装纺织 | G124: 纺织行业 | H124: 116.5 | I124: -1.5e-003 | J124: -2.2200000000000001e-002 | K124: 28.69 | L124: -4.1100000000000005e-002 | M124: 121.5 | N124: 32.87 | O124: 0.33500000000000002 | P124: 87.28 | Q124: 转股中 | R124: 5年15天 | S124: 3年15天 | T124: 2.22 | U124: 7.4 | V124: 2.8999999999999998e-002 | W124: 3.2000000000000001e-002 | X124: 2.7999999999999997e-002 | Y124: 69 | Z124: 7.48 | AA124: 8.6e-003 | AB124: 1.1999999999999999e-003 | AC124: -3.3500000000000002e-002 | AD124: -3.61e-002 | AE124: 82.5 | AF124: 84.04 | AG124: 0.58 | AH124: A+ | AI124: 7.8e-002 | AJ124: =H124+100*O124 -> 150. | AK124: 145.7 | AL124: 239 | AM124: 61.7 | AN124: 255 | AO124: -9.6999999999999989e-002 | AP124: 25 | AQ124: 开润转债!
A125: 127 | B125: 110068 | C125: 龙净转债! | D125: 600388 | E125: 龙净环保 | F125: 城市公用 | G125: 三废处理 | H125: 110.17 | I125: -5.4000000000000003e-003 | J125: -8.6999999999999994e-003 | K125: 9.29 | L125: -3.1300000000000001e-002 | M125: 115 | N125: 10.73 | O125: 0.27200000000000002 | P125: 86.58 | Q125: 转股中 | R125: 5.28年 | S125: 3.28年 | T125: 20 | U125: 4.3 | V125: 2.e-003 | W125: 0.20100000000000001 | X125: 0.17399999999999999 | Y125: 99 | Z125: 1.72 | AA125: 8.3000000000000001e-003 | AB125: 3.2000000000000002e-003 | AC125: -1.8100000000000002e-002 | AD125: -2.e-002 | AE125: 89.33 | AF125: 91.99 | AG125: 0.45 | AH125: AA+ | AI125: 4.4000000000000004e-002 | AJ125: =H125+100*O125 -> 137.37 | AK125: 133.8 | AL125: 161 | AM125: 41.8 | AN125: 151 | AO125: -9.8000000000000004e-002 | AP125: 29 | AQ125: 龙净转债!
A126: 246 | B126: 128051 | C126: 光华转债! | D126: 2741 | E126: 光华科技 | F126: 电子 | G126: 元器件制 | H126: 112.06 | I126: -1.8700000000000001e-002 | J126: 1.32e-002 | K126: 12.73 | L126: -8.6e-003 | M126: 115.5 | N126: 12.72 | O126: 0.12 | P126: 100.08 | Q126: 转股中 | R126: 4年3.1天 | S126: 2年3.1天 | T126: 2.5 | U126: 9.2 | V126: 3.3000000000000002e-002 | W126: 5.2000000000000005e-002 | X126: 5.2999999999999999e-002 | Y126: 48 | Z126: 3.94 | AA126: 7.8000000000000005e-003 | AB126: 8.0000000000000004e-004 | AC126: -3.49e-002 | AD126: -3.8100000000000002e-002 | AE126: 90.64 | AF126: 90.19 | AG126: 0.65 | AH126: AA- | AI126: 6.54e-002 | AJ126: =H126+100*O126 -> 124.06 | AK126: 124 | AL126: 53 | AM126: 33.4 | AN126: 72 | AO126: -4.4000000000000004e-002 | AP126: 25 | AQ126: 光华转债!
A127: 312 | B127: 127003 | C127: 海印转债! | D127: 861 | E127: 海印股份 | F127: 商业零售 | G127: 商场 | H127: 110.55 | I127: 1.8e-003 | J127: 4.4000000000000003e-003 | K127: 2.92 | L127: 1.7399999999999999e-002 | M127: 111.8 | N127: 3 | O127: 0.13600000000000001 | P127: 97.33 | Q127: 转股中 | R127: 1.49年 | S127: 回售中 | T127: 6.74 | U127: 103 | V127: 0.13699999999999998 | W127: 9.9000000000000005e-002 | X127: 9.6999999999999989e-002 | Y127: 68 | Z127: 1.72 | AA127: 7.7000000000000002e-003 | AB127: -6.8000000000000005e-003 | AC127: 回售中 | AD127: 回售中 | AE127: 100.3 | AF127: 105.07 | AG127: 0.36 | AH127: AA | AI127: 4.2999999999999997e-002 | AJ127: =H127+100*O127 -> 124.15000000000001 | AK127: 123.8 | AL127: 46 | AM127: 18.7 | AN127: 4 | AO127: 9.1999999999999998e-002 | AP127: 74 | AQ127: 海印转债!
A128: 32 | B128: 128131 | C128: 崇达转2! | D128: 2815 | E128: 崇达技术 | F128: 电子 | G128: 元器件制 | H128: 110.31 | I128: -6.1999999999999998e-003 | J128: -6.4000000000000003e-003 | K128: 15.5 | L128: -3.2500000000000001e-002 | M128: 115.2 | N128: 19.54 | O128: 0.39100000000000001 | P128: 79.32 | Q128: 3月0天 | R128: 5.74年 | S128: 3.74年 | T128: 14 | U128: 3.1 | V128: 2.e-003 | W128: 0.10199999999999999 | X128: 8.1000000000000003e-002 | Y128: 137 | Z128: 3.42 | AA128: 7.7000000000000002e-003 | AB128: 2.8999999999999998e-003 | AC128: -1.5800000000000002e-002 | AD128: -1.7600000000000001e-002 | AE128: 87.13 | AF128: 89.41 | AG128: 0.39 | AH128: AA | AI128: 4.5999999999999999e-002 | AJ128: =H128+100*O128 -> 149.41 | AK128: 141.3 | AL128: 215 | AM128: 51.9 | AN128: 218 | AO128: -5.7000000000000002e-002 | AP128: 5 | AQ128: 崇达转2!
A129: 131 | B129: 128101 | C129: 联创转债! | D129: 2036 | E129: 联创电子 | F129: 电子 | G129: 液晶显示 | H129: 110.689 | I129: -8.6e-003 | J129: 2.e-003 | K129: 10.76 | L129: -1.9099999999999999e-002 | M129: 115.1 | N129: 13.86 | O129: 0.42599999999999999 | P129: 77.63 | Q129: 转股中 | R129: 5.26年 | S129: 3.26年 | T129: 3 | U129: 11 | V129: 3.4000000000000002e-002 | W129: 2.7000000000000003e-002 | X129: 2.1000000000000001e-002 | Y129: 113 | Z129: 3.83 | AA129: 7.6e-003 | AB129: 2.3999999999999998e-003 | AC129: -1.9299999999999998e-002 | AD129: -2.1299999999999999e-002 | AE129: 88.93 | AF129: 91.27 | AG129: 0.35 | AH129: AA | AI129: 4.5999999999999999e-002 | AJ129: =H129+100*O129 -> 153.28899999999999 | AK129: 143.7 | AL129: 231 | AM129: 52.5 | AN129: 220 | AO129: -9.6999999999999989e-002 | AP129: 16 | AQ129: 联创转债!
A130: 141 | B130: 113567 | C130: 君禾转债 | D130: 603617 | E130: 君禾股份 | F130: 机械装备 | G130: 通用设备 | H130: 114.87 | I130: -1.03e-002 | J130: -1.e-004 | K130: 12.35 | L130: -1.3600000000000001e-002 | M130: 119.3 | N130: 11.46 | O130: 6.6000000000000003e-002 | P130: 107.77 | Q130: 转股中 | R130: 5.23年 | S130: 3.23年 | T130: 2.1 | U130: 5.6 | V130: 2.3e-002 | W130: 8.5000000000000006e-002 | X130: 9.1999999999999998e-002 | Y130: 25 | Z130: 3.82 | AA130: 7.4000000000000003e-003 | AB130: 1.e-003 | AC130: -2.7900000000000001e-002 | AD130: -3.0299999999999997e-002 | AE130: 81.26 | AF130: 81.38 | AG130: 0.77 | AH130: A+ | AI130: 7.8e-002 | AJ130: =H130+100*O130 -> 121.47 | AK130: 122 | AL130: 30 | AM130: 40.6 | AN130: 138 | AO130: 3.0000000000000001e-003 | AP130: 34 | AQ130: 君禾转债
A131: 45 | B131: 127021 | C131: 特发转2! | D131: 70 | E131: 特发信息 | F131: 通信互联 | G131: 通信设备 | H131: 109.595 | I131: -1.e-002 | J131: 1.1000000000000001e-003 | K131: 9.77 | L131: -2.69e-002 | M131: 113.3 | N131: 12.33 | O131: 0.38299999999999995 | P131: 79.24 | Q131: 2月4天 | R131: 4.66年 | S131: 2.66年 | T131: 5.5 | U131: 4.3 | V131: 6.9999999999999993e-003 | W131: 6.9000000000000006e-002 | X131: 5.5e-002 | Y131: 80 | Z131: 2.81 | AA131: 7.3000000000000001e-003 | AB131: 2.0999999999999999e-003 | AC131: -2.5099999999999997e-002 | AD131: -2.6499999999999999e-002 | AE131: 90.33 | AF131: 92.78 | AG131: 0.33 | AH131: AA | AI131: 4.4400000000000002e-002 | AJ131: =H131+100*O131 -> 147.89499999999998 | AK131: 140 | AL131: 206 | AM131: 47.2 | AN131: 187 | AO131: -5.2000000000000005e-002 | AP131: 7 | AQ131: 特发转2!
A132: 283 | B132: 123007 | C132: 道氏转债!! | D132: 300409 | E132: 道氏技术 | F132: 建筑 | G132: 建筑行业 | H132: 109 | I132: -5.0499999999999996e-002 | J132: -7.000000000000001e-004 | K132: 13.55 | L132: -0.105 | M132: 111.3 | N132: 14.95 | O132: 0.20300000000000001 | P132: 90.64 | Q132: 转股中 | R132: 3年17天 | S132: 1年17天 | T132: 3.04 | U132: 65 | V132: 0.192 | W132: 4.9000000000000002e-002 | X132: 4.4000000000000004e-002 | Y132: 62 | Z132: 2.58 | AA132: 6.9999999999999993e-003 | AB132: 1.e-004 | AC132: -4.7300000000000002e-002 | AD132: -5.16e-002 | AE132: 95.32 | AF132: 92.2 | AG132: 0.49 | AH132: AA- | AI132: 6.54e-002 | AJ132: =H132+100*O132 -> 129.30000000000001 | AK132: 127.4 | AL132: 94 | AM132: 32 | AN132: 60 | AO132: -6.3e-002 | AP132: 20 | AQ132: 道氏转债!!
A133: 163 | B133: 113559 | C133: 永创转债! | D133: 603901 | E133: 永创智能 | F133: 机械装备 | G133: 专用设备 | H133: 114.97 | I133: 1.6000000000000001e-003 | J133: -2.3799999999999998e-002 | K133: 9.18 | L133: -3.9699999999999999e-002 | M133: 118.9 | N133: 10.32 | O133: 0.29199999999999998 | P133: 88.95 | Q133: 转股中 | R133: 5年12天 | S133: 3年12天 | T133: 5.1 | U133: 2 | V133: 3.0000000000000001e-003 | W133: 0.126 | X133: 0.11199999999999999 | Y133: 40 | Z133: 2.92 | AA133: 6.8999999999999999e-003 | AB133: 2.9999999999999997e-004 | AC133: -2.8500000000000001e-002 | AD133: -3.1300000000000001e-002 | AE133: 85.63 | AF133: 86.62 | AG133: 0.56 | AH133: AA- | AI133: 6.7000000000000004e-002 | AJ133: =H133+100*O133 -> 144.16999999999999 | AK133: 141 | AL133: 211 | AM133: 54.4 | AN133: 228 | AO133: -9.1999999999999998e-002 | AP133: 22 | AQ133: 永创转债!
A134: 180 | B134: 123033 | C134: 金力转债! | D134: 300748 | E134: 金力永磁 | F134: 电子 | G134: 元器件制 | H134: 117.7 | I134: -6.8000000000000005e-003 | J134: -2.8999999999999998e-003 | K134: 38.08 | L134: -1.6799999999999999e-002 | M134: 121.5 | N134: 40.97 | O134: 0.26600000000000001 | P134: 92.95 | Q134: 转股中 | R134: 4.89年 | S134: 2.89年 | T134: 4.35 | U134: 16 | V134: 3.1e-002 | W134: 2.7000000000000003e-002 | X134: 2.6000000000000002e-002 | Y134: 158 | Z134: 11.79 | AA134: 6.7000000000000002e-003 | AB134: -8.9999999999999998e-004 | AC134: -3.7100000000000001e-002 | AD134: -4.0099999999999997e-002 | AE134: 86.75 | AF134: 89.9 | AG134: 0.58 | AH134: AA- | AI134: 6.54e-002 | AJ134: =H134+100*O134 -> 144.30000000000001 | AK134: 142.5 | AL134: 222 | AM134: 52.6 | AN134: 222 | AO134: -7.4999999999999997e-002 | AP134: 28 | AQ134: 金力转债!
A135: 237 | B135: 128056 | C135: 今飞转债! | D135: 2863 | E135: 今飞凯达 | F135: 汽车 | G135: 零部件制 | H135: 117.9 | I135: -2.3900000000000001e-002 | J135: 1.9599999999999999e-002 | K135: 5.95 | L135: -8.3000000000000001e-003 | M135: 121 | N135: 6.76 | O135: 0.34000000000000002 | P135: 88.02 | Q135: 转股中 | R135: 4.22年 | S135: 2.22年 | T135: 1.72 | U135: 62 | V135: 0.30199999999999999 | W135: 7.2000000000000008e-002 | X135: 6.3e-002 | Y135: 24 | Z135: 2.01 | AA135: 6.3e-003 | AB135: -2.3e-003 | AC135: -5.1299999999999998e-002 | AD135: -5.4400000000000004e-002 | AE135: 87.63 | AF135: 89.44 | AG135: 0.51 | AH135: A+ | AI135: 7.6399999999999996e-002 | AJ135: =H135+100*O135 -> 151.90000000000001 | AK135: 147.8 | AL135: 247 | AM135: 58.3 | AN135: 246 | AO135: -0.28000000000000003 | AP135: 59 | AQ135: 今飞转债!
A136: 218 | B136: 128064 | C136: 司尔转债! | D136: 2538 | E136: 司尔特 | F136: 化工 | G136: 农化 | H136: 111.99 | I136: -1.06e-002 | J136: 1.4499999999999999e-002 | K136: 6.17 | L136: 6.5000000000000006e-003 | M136: 114.9 | N136: 6.07 | O136: 0.10199999999999999 | P136: 101.65 | Q136: 转股中 | R136: 4.32年 | S136: 2.32年 | T136: 8 | U136: 6.7 | V136: 6.9999999999999993e-003 | W136: 0.18100000000000002 | X136: 0.184 | Y136: 44 | Z136: 1.16 | AA136: 6.0999999999999995e-003 | AB136: -1.e-004 | AC136: -3.1899999999999998e-002 | AD136: -3.44e-002 | AE136: 92.91 | AF136: 95.6 | AG136: 0.6 | AH136: AA | AI136: 4.4400000000000002e-002 | AJ136: =H136+100*O136 -> 122.19 | AK136: 122.3 | AL136: 33 | AM136: 26.7 | AN136: 22 | AO136: -1.e-003 | AP136: 55 | AQ136: 司尔转债!
A137: 156 | B137: 113561 | C137: 正裕转债! | D137: 603089 | E137: 正裕工业 | F137: 汽车 | G137: 零部件制 | H137: 115.04 | I137: -1.7899999999999999e-002 | J137: -2.0799999999999999e-002 | K137: 10.58 | L137: -5.2000000000000005e-002 | M137: 118.5 | N137: 10.23 | O137: 0.11199999999999999 | P137: 103.42 | Q137: 转股中 | R137: 5年20天 | S137: 3年20天 | T137: 1.5 | U137: 8.1 | V137: 4.5999999999999999e-002 | W137: 6.4000000000000001e-002 | X137: 6.6000000000000003e-002 | Y137: 23 | Z137: 2.53 | AA137: 6.0000000000000001e-003 | AB137: -4.0000000000000002e-004 | AC137: -2.9300000000000003e-002 | AD137: -3.2000000000000001e-002 | AE137: 82.49 | AF137: 81.92 | AG137: 0.74 | AH137: A+ | AI137: 7.8e-002 | AJ137: =H137+100*O137 -> 126.24000000000001 | AK137: 126.7 | AL137: 84 | AM137: 44.2 | AN137: 170 | AO137: -0.152 | AP137: 33 | AQ137: 正裕转债!
A138: 276 | B138: 127006 | C138: 敖东转债! | D138: 623 | E138: 吉林敖东 | F138: 金融 | G138: 证券行业 | H138: 106.007 | I138: -1.01e-002 | J138: 5.4000000000000003e-003 | K138: 16.65 | L138: -1.6e-002 | M138: 108 | N138: 20.42 | O138: 0.29999999999999999 | P138: 81.54 | Q138: 转股中 | R138: 3.25年 | S138: 1.25年 | T138: 24.1 | U138: 5.1 | V138: 2.e-003 | W138: 0.124 | X138: 0.10099999999999999 | Y138: 194 | Z138: 0.85 | AA138: 5.7999999999999996e-003 | AB138: 1.1999999999999999e-003 | AC138: -2.92e-002 | AD138: -3.1400000000000004e-002 | AE138: 95.88 | AF138: 94.54 | AG138: 0.29 | AH138: AA+ | AI138: 4.24e-002 | AJ138: =H138+100*O138 -> 136.00700000000001 | AK138: 130.5 | AL138: 127 | AM138: 34.6 | AN138: 87 | AO138: -4.4000000000000004e-002 | AP138: 27 | AQ138: 敖东转债!
A139: 108 | B139: 128107 | C139: 交科转债 | D139: 2061 | E139: 浙江交科 | F139: 建筑 | G139: 建筑工程 | H139: 112.26 | I139: -1.e-004 | J139: -7.7000000000000002e-003 | K139: 5.32 | L139: -1.3000000000000001e-002 | M139: 115.3 | N139: 5.36 | O139: 0.13100000000000001 | P139: 99.25 | Q139: 转股中 | R139: 5.36年 | S139: 3.36年 | T139: 25 | U139: 5.3 | V139: 2.e-003 | W139: 0.34200000000000003 | X139: 0.33899999999999997 | Y139: 73 | Z139: 0.91 | AA139: 5.1000000000000004e-003 | AB139: 0. | AC139: -2.2200000000000001e-002 | AD139: -2.4199999999999999e-002 | AE139: 89.31 | AF139: 91.96 | AG139: 0.6 | AH139: AA+ | AI139: 4.4000000000000004e-002 | AJ139: =H139+100*O139 -> 125.36000000000001 | AK139: 125.3 | AL139: 65 | AM139: 33.3 | AN139: 70 | AO139: -4.5999999999999999e-002 | AP139: 15 | AQ139: 交科转债
A140: 190 | B140: 128074 | C140: 游族转债!! | D140: 2174 | E140: 游族网络 | F140: 通信互联 | G140: 互联网 | H140: 117.28 | I140: -6.0000000000000001e-003 | J140: 1.5300000000000001e-002 | K140: 16.18 | L140: 1.5700000000000002e-002 | M140: 119.9 | N140: 16.97 | O140: 0.23000000000000001 | P140: 95.34 | Q140: 转股中 | R140: 4.78年 | S140: 2.78年 | T140: 6.83 | U140: 10 | V140: 1.3000000000000001e-002 | W140: 4.5999999999999999e-002 | X140: 4.4000000000000004e-002 | Y140: 148 | Z140: 2.62 | AA140: 4.6999999999999993e-003 | AB140: -2.5000000000000001e-003 | AC140: -4.2199999999999994e-002 | AD140: -4.4199999999999996e-002 | AE140: 91.07 | AF140: 97.77 | AG140: 0.59 | AH140: AA | AI140: 4.4400000000000002e-002 | AJ140: =H140+100*O140 -> 140.28 | AK140: 139.2 | AL140: 201 | AM140: 41.4 | AN140: 148 | AO140: -3.4000000000000002e-002 | AP140: 21 | AQ140: 游族转债!!
A141: 56 | B141: 128123 | C141: 国光转债 | D141: 2749 | E141: 国光股份 | F141: 化工 | G141: 农化 | H141: 113.452 | I141: -4.0000000000000002e-004 | J141: 6.0999999999999995e-003 | K141: 12.38 | L141: 9.0000000000000011e-003 | M141: 116.2 | N141: 13.7 | O141: 0.255 | P141: 90.36 | Q141: 52天 | R141: 5.62年 | S141: 3.62年 | T141: 3.2 | U141: 2.4 | V141: 6.9999999999999993e-003 | W141: 5.9999999999999998e-002 | X141: 5.4000000000000006e-002 | Y141: 53 | Z141: 4.34 | AA141: 4.4000000000000003e-003 | AB141: -8.0000000000000004e-004 | AC141: -2.2599999999999999e-002 | AD141: -2.46e-002 | AE141: 81.65 | AF141: 81.36 | AG141: 0.64 | AH141: AA- | AI141: 6.7000000000000004e-002 | AJ141: =H141+100*O141 -> 138.952 | AK141: 136.5 | AL141: 182 | AM141: 54.9 | AN141: 233 | AO141: 6.0000000000000001e-003 | AP141: 7 | AQ141: 国光转债
A142: 9 | B142: 123075 | C142: 贝斯转债 | D142: 300580 | E142: 贝斯特 | F142: 汽车 | G142: 零部件制 | H142: 112.6 | I142: -1.3999999999999999e-002 | J142: -3.3e-003 | K142: 21.64 | L142: -2.7000000000000003e-002 | M142: 115.5 | N142: 23.99 | O142: 0.248 | P142: 90.2 | Q142: 4月26天 | R142: 5.89年 | S142: 3.89年 | T142: 6 | U142: 19 | V142: 2.7000000000000003e-002 | W142: 0.13900000000000001 | X142: 0.125 | Y142: 43 | Z142: 2.69 | AA142: 4.4000000000000003e-003 | AB142: -2.9999999999999997e-004 | AC142: -1.9900000000000001e-002 | AD142: -2.1700000000000001e-002 | AE142: 80 | AF142: 79.41 | AG142: 0.64 | AH142: AA- | AI142: 6.7000000000000004e-002 | AJ142: =H142+100*O142 -> 137.40000000000001 | AK142: 135 | AL142: 169 | AM142: 55 | AN142: 234 | AO142: -0.11800000000000001 | AP142: 2 | AQ142: 贝斯转债
A143: 248 | B143: 110048 | C143: 福能转债! | D143: 600483 | E143: 福能股份 | F143: 能源电力 | G143: 电力供应 | H143: 111.51 | I143: -1.3300000000000001e-002 | J143: 1.1000000000000001e-003 | K143: 7.51 | L143: -2.5899999999999999e-002 | M143: 113.3 | N143: 8.12 | O143: 0.20600000000000002 | P143: 92.49 | Q143: 转股中 | R143: 3.99年 | S143: 1.99年 | T143: 28.3 | U143: 52 | V143: 1.7000000000000001e-002 | W143: 0.214 | X143: 0.19800000000000001 | Y143: 132 | Z143: 0.94 | AA143: 4.0999999999999995e-003 | AB143: -2.e-003 | AC143: -3.73e-002 | AD143: -3.9699999999999999e-002 | AE143: 94.05 | AF143: 96.28 | AG143: 0.47 | AH143: AA+ | AI143: 4.24e-002 | AJ143: =H143+100*O143 -> 132.11000000000001 | AK143: 130.5 | AL143: 128 | AM143: 34.3 | AN143: 83 | AO143: -3.7999999999999999e-002 | AP143: 8 | AQ143: 福能转债!
A144: 35 | B144: 128130 | C144: 景兴转债 | D144: 2067 | E144: 景兴纸业 | F144: 造纸包装 | G144: 包装用纸 | H144: 112.5 | I144: -6.6e-003 | J144: -1.1399999999999999e-002 | K144: 3.44 | L144: -2.8199999999999999e-002 | M144: 115.1 | N144: 3.4 | O144: 0.11199999999999999 | P144: 101.18 | Q144: 2月23天 | R144: 5.72年 | S144: 3.72年 | T144: 12.8 | U144: 13 | V144: 9.0000000000000011e-003 | W144: 0.33500000000000002 | X144: 0.33899999999999997 | Y144: 38 | Z144: 0.85 | AA144: 4.0999999999999995e-003 | AB144: -7.000000000000001e-004 | AC144: -2.1099999999999997e-002 | AD144: -2.29e-002 | AE144: 87.11 | AF144: 89.4 | AG144: 0.64 | AH144: AA | AI144: 4.5999999999999999e-002 | AJ144: =H144+100*O144 -> 123.7 | AK144: 123.8 | AL144: 48 | AM144: 34.4 | AN144: 86 | AO144: -4.8000000000000001e-002 | AP144: 10 | AQ144: 景兴转债
A145: 49 | B145: 113598 | C145: 法兰转债 | D145: 603966 | E145: 法兰泰克 | F145: 机械装备 | G145: 工程机械 | H145: 118.71 | I145: -6.4000000000000003e-003 | J145: -7.1999999999999998e-003 | K145: 14.06 | L145: -1.95e-002 | M145: 121.2 | N145: 13.88 | O145: 0.17199999999999999 | P145: 101.3 | Q145: 57天 | R145: 5.64年 | S145: 3.64年 | T145: 3.3 | U145: 1 | V145: 2.e-003 | W145: 0.111 | X145: 0.113 | Y145: 30 | Z145: 2.66 | AA145: 3.8e-003 | AB145: -2.7000000000000001e-003 | AC145: -3.4200000000000001e-002 | AD145: -3.6200000000000003e-002 | AE145: 81.59 | AF145: 84.76 | AG145: 0.69 | AH145: AA- | AI145: 6.7000000000000004e-002 | AJ145: =H145+100*O145 -> 135.91 | AK145: 136.1 | AL145: 177 | AM145: 51.4 | AN145: 213 | AO145: -5.7999999999999996e-002 | AP145: 6 | AQ145: 法兰转债
A146: 88 | B146: 128113 | C146: 比音转债 | D146: 2832 | E146: 比音勒芬 | F146: 服装纺织 | G146: 服装行业 | H146: 115 | I146: -1.1899999999999999e-002 | J146: 5.9999999999999995e-004 | K146: 15.89 | L146: -1.67e-002 | M146: 117.3 | N146: 14.9 | O146: 7.8e-002 | P146: 106.64 | Q146: 10天 | R146: 5.51年 | S146: 3.51年 | T146: 6.89 | U146: 17 | V146: 2.1000000000000001e-002 | W146: 8.3000000000000004e-002 | X146: 8.8000000000000009e-002 | Y146: 83 | Z146: 3.87 | AA146: 3.7000000000000002e-003 | AB146: -1.9e-003 | AC146: -2.7699999999999999e-002 | AD146: -2.9600000000000001e-002 | AE146: 88.13 | AF146: 92 | AG146: 0.67 | AH146: AA | AI146: 4.5999999999999999e-002 | AJ146: =H146+100*O146 -> 122.8 | AK146: 123.4 | AL146: 41 | AM146: 31.4 | AN146: 50 | AO146: -7.0000000000000007e-002 | AP146: 5 | AQ146: 比音转债
A147: 112 | B147: 123050 | C147: 聚飞转债 | D147: 300303 | E147: 聚飞光电 | F147: 电子 | G147: LED制 | H147: 121.959 | I147: -2.6699999999999998e-002 | J147: 1.03e-002 | K147: 5.86 | L147: -2.1700000000000001e-002 | M147: 124.2 | N147: 5.18 | O147: 7.8e-002 | P147: 113.13 | Q147: 转股中 | R147: 5.34年 | S147: 3.34年 | T147: 7.05 | U147: 14 | V147: 1.6e-002 | W147: 9.4e-002 | X147: 0.106 | Y147: 75 | Z147: 3.23 | AA147: 3.4999999999999996e-003 | AB147: -4.0999999999999995e-003 | AC147: -4.4600000000000001e-002 | AD147: -4.6699999999999998e-002 | AE147: 83.17 | AF147: 88.53 | AG147: 0.75 | AH147: AA- | AI147: 6.7000000000000004e-002 | AJ147: =H147+100*O147 -> 129.75900000000001 | AK147: 130.8 | AL147: 133 | AM147: 42.3 | AN147: 153 | AO147: -5.0000000000000003e-002 | AP147: 12 | AQ147: 聚飞转债
A148: 30 | B148: 123066 | C148: 赛意转债 | D148: 300687 | E148: 赛意信息 | F148: 计算机及 | G148: 软件开发 | H148: 119.11 | I148: -1.9699999999999999e-002 | J148: 2.8999999999999998e-003 | K148: 23.8 | L148: -2.18e-002 | M148: 121.4 | N148: 22.58 | O148: 0.13 | P148: 105.4 | Q148: 3月11天 | R148: 5.76年 | S148: 3.76年 | T148: 3.2 | U148: 6.6 | V148: 1.7000000000000001e-002 | W148: 6.2e-002 | X148: 6.5000000000000002e-002 | Y148: 52 | Z148: 5.45 | AA148: 3.4000000000000002e-003 | AB148: -3.0000000000000001e-003 | AC148: -3.3500000000000002e-002 | AD148: -3.5499999999999997e-002 | AE148: 77.89 | AF148: 79.48 | AG148: 0.77 | AH148: A+ | AI148: 7.8e-002 | AJ148: =H148+100*O148 -> 132.11000000000001 | AK148: 132.8 | AL148: 153 | AM148: 53.3 | AN148: 226 | AO148: -5.7000000000000002e-002 | AP148: 5 | AQ148: 赛意转债
A149: 85 | B149: 113588 | C149: 润达转债 | D149: 603108 | E149: 润达医疗 | F149: 医药 | G149: 医疗器械 | H149: 112.33 | I149: -1.9299999999999998e-002 | J149: 1.0800000000000001e-002 | K149: 11.5 | L149: -1.7899999999999999e-002 | M149: 114.2 | N149: 13.36 | O149: 0.30499999999999999 | P149: 86.08 | Q149: 12天 | R149: 5.52年 | S149: 3.52年 | T149: 5.5 | U149: 1.6 | V149: 3.0000000000000001e-003 | W149: 8.3000000000000004e-002 | X149: 7.0999999999999994e-002 | Y149: 67 | Z149: 2.22 | AA149: 3.0999999999999999e-003 | AB149: -1.6000000000000001e-003 | AC149: -2.1700000000000001e-002 | AD149: -2.35e-002 | AE149: 88.01 | AF149: 89.54 | AG149: 0.47 | AH149: AA | AI149: 4.5999999999999999e-002 | AJ149: =H149+100*O149 -> 142.82999999999998 | AK149: 138.6 | AL149: 198 | AM149: 49 | AN149: 192 | AO149: -9.9000000000000005e-002 | AP149: 7 | AQ149: 润达转债
A150: 286 | B150: 110041 | C150: 蒙电转债! | D150: 600863 | E150: 内蒙华电 | F150: 能源电力 | G150: 电力供应 | H150: 109.4 | I150: -1.52e-002 | J150: 1.3300000000000001e-002 | K150: 2.55 | L150: -3.9000000000000003e-003 | M150: 110.3 | N150: 2.69 | O150: 0.154 | P150: 94.8 | Q150: 转股中 | R150: 3年11天 | S150: 1年11天 | T150: 18.7 | U150: 11 | V150: 5.0000000000000001e-003 | W150: 0.126 | X150: 0.12 | Y150: 148 | Z150: 1.25 | AA150: 2.8000000000000004e-003 | AB150: -3.5999999999999999e-003 | AC150: -5.1200000000000002e-002 | AD150: -5.5500000000000001e-002 | AE150: 98.21 | AF150: 98.39 | AG150: 0.48 | AH150: AAA | AI150: 3.9399999999999998e-002 | AJ150: =H150+100*O150 -> 124.80000000000001 | AK150: 124 | AL150: 52 | AM150: 25.6 | AN150: 15 | AO150: -2.6000000000000002e-002 | AP150: 8 | AQ150: 蒙电转债!
A151: 119 | B151: 128105 | C151: 长集转债 | D151: 2616 | E151: 长青集团 | F151: 城市公用 | G151: 三废处理 | H151: 113.799 | I151: -1.21e-002 | J151: -5.0000000000000001e-003 | K151: 8.23 | L151: -2.7200000000000002e-002 | M151: 115.3 | N151: 8.11 | O151: 0.121 | P151: 101.48 | Q151: 转股中 | R151: 5.33年 | S151: 3.33年 | T151: 8 | U151: 9.2 | V151: 1.e-002 | W151: 0.13100000000000001 | X151: 0.13300000000000001 | Y151: 61 | Z151: 2.43 | AA151: 2.5000000000000001e-003 | AB151: -2.5999999999999999e-003 | AC151: -2.6200000000000001e-002 | AD151: -2.8300000000000002e-002 | AE151: 88.86 | AF151: 91.19 | AG151: 0.63 | AH151: AA | AI151: 4.5999999999999999e-002 | AJ151: =H151+100*O151 -> 125.899 | AK151: 126.1 | AL151: 77 | AM151: 34.9 | AN151: 91 | AO151: -3.3000000000000002e-002 | AP151: 8 | AQ151: 长集转债
A152: 199 | B152: 113542 | C152: 好客转债 | D152: 603898 | E152: 好莱客 | F152: 其他 | G152: 家居用品 | H152: 113.8 | I152: -1.5600000000000001e-002 | J152: -6.7000000000000002e-003 | K152: 16.11 | L152: -3.8800000000000001e-002 | M152: 114.9 | N152: 16.27 | O152: 0.14899999999999999 | P152: 99.02 | Q152: 转股中 | R152: 4.64年 | S152: 2.64年 | T152: 6.03 | U152: 5.6 | V152: 8.0000000000000002e-003 | W152: 0.12 | X152: 0.11900000000000001 | Y152: 50 | Z152: 2.05 | AA152: 2.0999999999999999e-003 | AB152: -3.5999999999999999e-003 | AC152: -3.39e-002 | AD152: -3.61e-002 | AE152: 91.65 | AF152: 94.3 | AG152: 0.57 | AH152: AA | AI152: 4.4400000000000002e-002 | AJ152: =H152+100*O152 -> 128.69999999999999 | AK152: 128.6 | AL152: 104 | AM152: 34.3 | AN152: 84 | AO152: -5.5999999999999994e-002 | AP152: 18 | AQ152: 好客转债
A153: 36 | B153: 128129 | C153: 青农转债 | D153: 2958 | E153: 青农商行 | F153: 金融 | G153: 银行行业 | H153: 111.031 | I153: 4.0000000000000001e-003 | J153: 9.5999999999999992e-003 | K153: 5.37 | L153: 2.4799999999999999e-002 | M153: 112.2 | N153: 5.74 | O153: 0.187 | P153: 93.55 | Q153: 2月20天 | R153: 5.70年 | S153: 无权 | T153: 50 | U153: 60 | V153: 1.1000000000000001e-002 | W153: 0.16800000000000001 | X153: 0.157 | Y153: 298 | Z153: 1.16 | AA153: 1.9e-003 | AB153: -2.e-003 | AC153: 无权 | AD153: 无权 | AE153: 无权 | AF153: 89.51 | AG153: 0.55 | AH153: AAA | AI153: 4.0999999999999995e-002 | AJ153: =H153+100*O153 -> 129.73099999999999 | AK153: 128.5 | AL153: 101 | AM153: 39 | AN153: 128 | AO153: 7.2000000000000008e-002 | AP153: 12 | AQ153: 青农转债
A154: 5 | B154: 128137 | C154: 洁美转债 | D154: 2859 | E154: 洁美科技 | F154: 电子 | G154: 元器件制 | H154: 116.048 | I154: -1.2999999999999999e-003 | J154: -2.8999999999999998e-003 | K154: 27.84 | L154: -5.6999999999999993e-003 | M154: 117.3 | N154: 27.77 | O154: 0.158 | P154: 100.25 | Q154: 5月0天 | R154: 5.90年 | S154: 3.90年 | T154: 6 | U154: 38 | V154: 5.4000000000000006e-002 | W154: 5.2000000000000005e-002 | X154: 5.2999999999999999e-002 | Y154: 115 | Z154: 6.54 | AA154: 1.9e-003 | AB154: -3.3e-003 | AC154: -2.7300000000000001e-002 | AD154: -2.8999999999999998e-002 | AE154: 79.94 | AF154: 80.6 | AG154: 0.73 | AH154: AA- | AI154: 6.7000000000000004e-002 | AJ154: =H154+100*O154 -> 131.84800000000001 | AK154: 131.8 | AL154: 141 | AM154: 51.2 | AN154: 211 | AO154: 6.8000000000000005e-002 | AP154: 3 | AQ154: 洁美转债
A155: 111 | B155: 113577 | C155: 春秋转债 | D155: 603890 | E155: 春秋电子 | F155: 电子 | G155: 电子产品 | H155: 117.2 | I155: -4.5000000000000005e-003 | J155: -3.0000000000000001e-003 | K155: 11.48 | L155: -1.03e-002 | M155: 118.2 | N155: 11.06 | O155: 0.129 | P155: 103.8 | Q155: 转股中 | R155: 5.34年 | S155: 3.34年 | T155: 2.32 | U155: 4.2 | V155: 1.4999999999999999e-002 | W155: 5.2999999999999999e-002 | X155: 5.5e-002 | Y155: 44 | Z155: 2.62 | AA155: 1.6000000000000001e-003 | AB155: -4.3e-003 | AC155: -3.3599999999999998e-002 | AD155: -3.5699999999999996e-002 | AE155: 83.18 | AF155: 84.29 | AG155: 0.72 | AH155: AA- | AI155: 6.7000000000000004e-002 | AJ155: =H155+100*O155 -> 130.09999999999999 | AK155: 130.6 | AL155: 129 | AM155: 46.3 | AN155: 184 | AO155: -0.11699999999999999 | AP155: 10 | AQ155: 春秋转债
A156: 34 | B156: 123064 | C156: 万孚转债! | D156: 300482 | E156: 万孚生物 | F156: 医药 | G156: 医疗器械 | H156: 114.12 | I156: -1.e-004 | J156: -8.0000000000000004e-004 | K156: 74.08 | L156: -2.3e-003 | M156: 115.1 | N156: 93.55 | O156: 0.441 | P156: 79.19 | Q156: 2月27天 | R156: 5.72年 | S156: 3.72年 | T156: 6 | U156: 17 | V156: 2.5000000000000001e-002 | W156: 2.4e-002 | X156: 1.9e-002 | Y156: 254 | Z156: 9.37 | AA156: 1.5e-003 | AB156: -3.2000000000000002e-003 | AC156: -2.4700000000000003e-002 | AD156: -2.6499999999999999e-002 | AE156: 87.1 | AF156: 89.39 | AG156: 0.39 | AH156: AA | AI156: 4.5999999999999999e-002 | AJ156: =H156+100*O156 -> 158.22 | AK156: 149.1 | AL156: 254 | AM156: 59.7 | AN156: 251 | AO156: 8.1000000000000003e-002 | AP156: 8 | AQ156: 万孚转债!
A157: 197 | B157: 128071 | C157: 合兴转债! | D157: 2228 | E157: 合兴包装 | F157: 造纸包装 | G157: 包装材料 | H157: 114.162 | I157: -1.34e-002 | J157: -2.e-003 | K157: 4.15 | L157: -2.81e-002 | M157: 114.8 | N157: 4.28 | O157: 0.17699999999999999 | P157: 96.96 | Q157: 转股中 | R157: 4.68年 | S157: 2.68年 | T157: 3 | U157: 3.2 | V157: 9.0000000000000011e-003 | W157: 5.7999999999999996e-002 | X157: 5.7000000000000002e-002 | Y157: 51 | Z157: 1.54 | AA157: 1.1999999999999999e-003 | AB157: -4.4000000000000003e-003 | AC157: -3.4799999999999998e-002 | AD157: -3.6900000000000002e-002 | AE157: 91.38 | AF157: 94.04 | AG157: 0.55 | AH157: AA | AI157: 4.4400000000000002e-002 | AJ157: =H157+100*O157 -> 131.86199999999999 | AK157: 131.4 | AL157: 138 | AM157: 37.3 | AN157: 112 | AO157: -6.4000000000000001e-002 | AP157: 25 | AQ157: 合兴转债!
A158: 280 | B158: 128035 | C158: 大族转债! | D158: 2008 | E158: 大族激光 | F158: 机械装备 | G158: 专用设备 | H158: 107.8 | I158: -7.3000000000000001e-003 | J158: 5.1999999999999998e-003 | K158: 36.99 | L158: -2.6800000000000001e-002 | M158: 108 | N158: 52.1 | O158: 0.51800000000000002 | P158: 71 | Q158: 转股中 | R158: 3年57天 | S158: 1年57天 | T158: 23 | U158: 8.4 | V158: 3.0000000000000001e-003 | W158: 5.7999999999999996e-002 | X158: 4.0999999999999995e-002 | Y158: 395 | Z158: 4.3 | AA158: 5.9999999999999995e-004 | AB158: -4.1999999999999997e-003 | AC158: -2.41e-002 | AD158: -3.0299999999999997e-002 | AE158: 98.85 | AF158: 94.92 | AG158: 0.08 | AH158: AA+ | AI158: 4.24e-002 | AJ158: =H158+100*O158 -> 159.59999999999999 | AK158: 144.6 | AL158: 234 | AM158: 45.7 | AN158: 178 | AO158: -8.8000000000000009e-002 | AP158: 19 | AQ158: 大族转债!
A159: 64 | B159: 127020 | C159: 中金转债 | D159: 60 | E159: 中金岭南 | F159: 有色金属 | G159: 有色行业 | H159: 113.39 | I159: -2.7000000000000001e-003 | J159: -3.5999999999999999e-003 | K159: 4.54 | L159: -1.09e-002 | M159: 113.7 | N159: 4.71 | O159: 0.17600000000000002 | P159: 96.39 | Q159: 45天 | R159: 5.61年 | S159: 3.61年 | T159: 38 | U159: 31 | V159: 6.9999999999999993e-003 | W159: 0.23399999999999999 | X159: 0.22600000000000001 | Y159: 162 | Z159: 1.44 | AA159: 5.0000000000000001e-004 | AB159: -3.9000000000000003e-003 | AC159: -2.6699999999999998e-002 | AD159: -2.7900000000000001e-002 | AE159: 87.17 | AF159: 89.59 | AG159: 0.58 | AH159: AA+ | AI159: 4.4000000000000004e-002 | AJ159: =H159+100*O159 -> 130.99000000000001 | AK159: 130.4 | AL159: 126 | AM159: 40.8 | AN159: 140 | AO159: -6.0999999999999999e-002 | AP159: 13 | AQ159: 中金转债
A160: 27 | B160: 113603 | C160: 东缆转债 | D160: 603606 | E160: 东方电缆 | F160: 能源电力 | G160: 电力设备 | H160: 114.91 | I160: -1.04e-002 | J160: -1.1899999999999999e-002 | K160: 21.08 | L160: -4.4000000000000004e-002 | M160: 115.1 | N160: 23.88 | O160: 0.30199999999999999 | P160: 88.27 | Q160: 3月19天 | R160: 5.79年 | S160: 3.79年 | T160: 8 | U160: 8 | V160: 9.0000000000000011e-003 | W160: 5.7999999999999996e-002 | X160: 5.0999999999999997e-002 | Y160: 138 | Z160: 5.09 | AA160: 2.9999999999999997e-004 | AB160: -4.4000000000000003e-003 | AC160: -2.6099999999999998e-002 | AD160: -2.7699999999999999e-002 | AE160: 86.85 | AF160: 89.13 | AG160: 0.51 | AH160: AA | AI160: 4.5999999999999999e-002 | AJ160: =H160+100*O160 -> 145.10999999999999 | AK160: 141.5 | AL160: 218 | AM160: 52.4 | AN160: 219 | AO160: -2.4e-002 | AP160: 5 | AQ160: 东缆转债
A161: 225 | B161: 127012 | C161: 招路转债! | D161: 1965 | E161: 招商公路 | F161: 机场高速 | G161: 高速 | H161: 108.098 | I161: 3.2000000000000002e-003 | J161: -9.300000000000001e-003 | K161: 7.41 | L161: -1.5900000000000001e-002 | M161: 108.2 | N161: 8.81 | O161: 0.28499999999999998 | P161: 84.11 | Q161: 转股中 | R161: 4.28年 | S161: 2.28年 | T161: 50 | U161: 48 | V161: 9.0000000000000011e-003 | W161: 0.109 | X161: 9.1999999999999998e-002 | Y161: 458 | Z161: 0.94 | AA161: 2.0000000000000001e-004 | AB161: -3.4000000000000002e-003 | AC161: -2.3799999999999998e-002 | AD161: -2.53e-002 | AE161: 92.82 | AF161: 91.92 | AG161: 0.38 | AH161: AAA | AI161: 3.9399999999999998e-002 | AJ161: =H161+100*O161 -> 136.59799999999998 | AK161: 132.1 | AL161: 144 | AM161: 39.3 | AN161: 132 | AO161: 1.9e-002 | AP161: 37 | AQ161: 招路转债!
A162: 26 | B162: 128134 | C162: 鸿路转债 | D162: 2541 | E162: 鸿路钢构 | F162: 建筑 | G162: 其他 | H162: 115 | I162: -1.6299999999999999e-002 | J162: 1.7899999999999999e-002 | K162: 39.22 | L162: 3.0999999999999999e-003 | M162: 115.1 | N162: 43.74 | O162: 0.28300000000000003 | P162: 89.67 | Q162: 4月5天 | R162: 5.83年 | S162: 3.83年 | T162: 18.8 | U162: 46 | V162: 2.1000000000000001e-002 | W162: 9.1999999999999998e-002 | X162: 8.199999999999999e-002 | Y162: 205 | Z162: 3.83 | AA162: 2.0000000000000001e-004 | AB162: -4.5000000000000005e-003 | AC162: -2.6000000000000002e-002 | AD162: -2.7699999999999999e-002 | AE162: 86.69 | AF162: 88.97 | AG162: 0.53 | AH162: AA | AI162: 4.5999999999999999e-002 | AJ162: =H162+100*O162 -> 143.30000000000001 | AK162: 140.3 | AL162: 209 | AM162: 51.4 | AN162: 214 | AO162: 6.8000000000000005e-002 | AP162: 3 | AQ162: 鸿路转债
A163: 150 | B163: 113563 | C163: 柳药转债 | D163: 603368 | E163: 柳药股份 | F163: 医药 | G163: 医药商业 | H163: 113.2 | I163: -3.8e-003 | J163: 1.4000000000000002e-003 | K163: 22.7 | L163: -4.4000000000000003e-003 | M163: 113.2 | N163: 24.47 | O163: 0.22 | P163: 92.77 | Q163: 转股中 | R163: 5年36天 | S163: 3年36天 | T163: 8.02 | U163: 3.2 | V163: 3.0000000000000001e-003 | W163: 9.6999999999999989e-002 | X163: 8.9999999999999997e-002 | Y163: 82 | Z163: 1.71 | AA163: 0. | AB163: -4.6999999999999993e-003 | AC163: -2.6800000000000001e-002 | AD163: -2.8900000000000002e-002 | AE163: 89.69 | AF163: 90.44 | AG163: 0.55 | AH163: AA | AI163: 4.5999999999999999e-002 | AJ163: =H163+100*O163 -> 135.19999999999999 | AK163: 133.6 | AL163: 159 | AM163: 43.2 | AN163: 165 | AO163: -5.9000000000000004e-002 | AP163: 15 | AQ163: 柳药转债
A164: 182 | B164: 110060 | C164: 天路转债! | D164: 600326 | E164: 西藏天路 | F164: 建筑 | G164: 水泥 | H164: 115.08 | I164: -2.3e-002 | J164: 1.37e-002 | K164: 7.38 | L164: -1.47e-002 | M164: 114.9 | N164: 7.16 | O164: 0.11599999999999999 | P164: 103.07 | Q164: 转股中 | R164: 4.88年 | S164: 2.88年 | T164: 7.06 | U164: 5.9 | V164: 6.9999999999999993e-003 | W164: 0.10400000000000001 | X164: 0.107 | Y164: 68 | Z164: 1.82 | AA164: -2.9999999999999997e-004 | AB164: -5.7999999999999996e-003 | AC164: -3.4799999999999998e-002 | AD164: -3.6900000000000002e-002 | AE164: 90.69 | AF164: 93.32 | AG164: 0.63 | AH164: AA | AI164: 4.4400000000000002e-002 | AJ164: =H164+100*O164 -> 126.67999999999999 | AK164: 127.1 | AL164: 89 | AM164: 33.8 | AN164: 75 | AO164: -6.2e-002 | AP164: 12 | AQ164: 天路转债!
A165: 25 | B165: 113604 | C165: 多伦转债 | D165: 603528 | E165: 多伦科技 | F165: 计算机及 | G165: 软件开发 | H165: 117.5 | I165: -6.8000000000000005e-003 | J165: 4.0000000000000001e-003 | K165: 10.56 | L165: -3.8e-003 | M165: 117.3 | N165: 10.44 | O165: 0.16200000000000001 | P165: 101.15 | Q165: 4月9天 | R165: 5.84年 | S165: 3.84年 | T165: 6.4 | U165: 4.9 | V165: 6.9999999999999993e-003 | W165: 9.6999999999999989e-002 | X165: 9.8000000000000004e-002 | Y165: 66 | Z165: 4.1 | AA165: -2.9999999999999997e-004 | AB165: -5.5000000000000005e-003 | AC165: -3.0699999999999998e-002 | AD165: -3.2500000000000001e-002 | AE165: 80.26 | AF165: 80.91 | AG165: 0.73 | AH165: AA- | AI165: 6.7000000000000004e-002 | AJ165: =H165+100*O165 -> 133.69999999999999 | AK165: 133.9 | AL165: 162 | AM165: 52.9 | AN165: 225 | AO165: -7.8e-002 | AP165: 3 | AQ165: 多伦转债
A166: 65 | B166: 113593 | C166: 沪工转债 | D166: 603131 | E166: 上海沪工 | F166: 机械装备 | G166: 通用设备 | H166: 121.9 | I166: -1.7600000000000001e-002 | J166: 8.0000000000000004e-004 | K166: 26.29 | L166: -1.9400000000000001e-002 | M166: 121.6 | N166: 21.32 | O166: -1.1000000000000001e-002 | P166: 123.31 | Q166: 45天 | R166: 5.61年 | S166: 3.61年 | T166: 4 | U166: 24 | V166: 4.8000000000000001e-002 | W166: 4.8000000000000001e-002 | X166: 5.9000000000000004e-002 | Y166: 84 | Z166: 6.78 | AA166: -4.0000000000000002e-004 | AB166: -6.9999999999999993e-003 | AC166: -4.0099999999999997e-002 | AD166: -4.2300000000000004e-002 | AE166: 79.04 | AF166: 80.59 | AG166: 0.86 | AH166: A+ | AI166: 7.8e-002 | AJ166: =H166+100*O166 -> 120.80000000000001 | AK166: 120.5 | AL166: 19 | AM166: 39.9 | AN166: 134 | AO166: 2.7999999999999997e-002 | AP166: 8 | AQ166: 沪工转债
A167: 145 | B167: 113564 | C167: 天目转债 | D167: 603136 | E167: 天目湖 | F167: 旅游餐饮 | G167: 旅游 | H167: 127.04 | I167: -1.52e-002 | J167: -1.1000000000000001e-003 | K167: 27.25 | L167: -2.0799999999999999e-002 | M167: 126.7 | N167: 23.1 | O167: 7.6999999999999999e-002 | P167: 117.97 | Q167: 转股中 | R167: 5.22年 | S167: 3.22年 | T167: 2.87 | U167: 5.3 | V167: 1.4999999999999999e-002 | W167: 8.9999999999999997e-002 | X167: 0.107 | Y167: 32 | Z167: 3.39 | AA167: -5.0000000000000001e-004 | AB167: -8.8999999999999999e-003 | AC167: -5.6500000000000002e-002 | AD167: -5.8799999999999998e-002 | AE167: 84.28 | AF167: 91.08 | AG167: 0.78 | AH167: AA- | AI167: 6.7000000000000004e-002 | AJ167: =H167+100*O167 -> 134.74000000000001 | AK167: 136.1 | AL167: 176 | AM167: 45 | AN167: 175 | AO167: -7.2999999999999995e-002 | AP167: 13 | AQ167: 天目转债
A168: 87 | B168: 128114 | C168: 正邦转债 | D168: 2157 | E168: 正邦科技 | F168: 农业 | G168: 畜牧业 | H168: 116.156 | I168: -1.1699999999999999e-002 | J168: -2.0999999999999999e-003 | K168: 17.24 | L168: -2.0499999999999997e-002 | M168: 115.3 | N168: 16.09 | O168: 8.4000000000000005e-002 | P168: 107.15 | Q168: 12天 | R168: 5.52年 | S168: 3.52年 | T168: 16 | U168: 47 | V168: 2.5000000000000001e-002 | W168: 3.7000000000000005e-002 | X168: 3.9e-002 | Y168: 435 | Z168: 2.89 | AA168: -1.4000000000000002e-003 | AB168: -6.3e-003 | AC168: -3.04e-002 | AD168: -3.2300000000000002e-002 | AE168: 88.72 | AF168: 91.36 | AG168: 0.67 | AH168: AA+ | AI168: 4.4000000000000004e-002 | AJ168: =H168+100*O168 -> 124.55600000000001 | AK168: 125.2 | AL168: 63 | AM168: 33.8 | AN168: 76 | AO168: -5.4000000000000006e-002 | AP168: 11 | AQ168: 正邦转债
A169: 282 | B169: 128034 | C169: 江银转债! | D169: 2807 | E169: 江阴银行 | F169: 金融 | G169: 银行行业 | H169: 109.633 | I169: -8.6999999999999994e-003 | J169: -4.0000000000000002e-004 | K169: 4.24 | L169: -1.8500000000000003e-002 | M169: 109.1 | N169: 4.5 | O169: 0.16399999999999998 | P169: 94.22 | Q169: 转股中 | R169: 3年46天 | S169: 无权 | T169: 17.6 | U169: 3.2 | V169: 2.e-003 | W169: 0.191 | X169: 0.17999999999999999 | Y169: 92 | Z169: 0.81 | AA169: -1.6000000000000001e-003 | AB169: -6.9999999999999993e-003 | AC169: 无权 | AD169: 无权 | AE169: 无权 | AF169: 96.04 | AG169: 0.49 | AH169: AA+ | AI169: 4.24e-002 | AJ169: =H169+100*O169 -> 126.03299999999999 | AK169: 125 | AL169: 62 | AM169: 29 | AN169: 34 | AO169: 3.0000000000000001e-003 | AP169: 27 | AQ169: 江银转债!
A170: 100 | B170: 123051 | C170: 今天转债 | D170: 300532 | E170: 今天国际 | F170: 计算机及 | G170: 软件开发 | H170: 123.897 | I170: -2.2099999999999998e-002 | J170: 1.8200000000000001e-002 | K170: 10.58 | L170: -4.6999999999999993e-003 | M170: 122.8 | N170: 8.8 | O170: 3.1e-002 | P170: 120.23 | Q170: 转股中 | R170: 5.48年 | S170: 3.48年 | T170: 2.8 | U170: 39 | V170: 0.11199999999999999 | W170: 9.6999999999999989e-002 | X170: 0.11599999999999999 | Y170: 29 | Z170: 3.63 | AA170: -1.7000000000000001e-003 | AB170: -8.6999999999999994e-003 | AC170: -4.5599999999999995e-002 | AD170: -4.7899999999999998e-002 | AE170: 79.93 | AF170: 82.21 | AG170: 0.83 | AH170: A+ | AI170: 7.8e-002 | AJ170: =H170+100*O170 -> 126.997 | AK170: 127.6 | AL170: 95 | AM170: 45.4 | AN170: 177 | AO170: -2.7999999999999997e-002 | AP170: 12 | AQ170: 今天转债
A171: 14 | B171: 127023 | C171: 华菱转2 | D171: 932 | E171: 华菱钢铁 | F171: 钢铁 | G171: 炼钢 | H171: 111.402 | I171: -6.0000000000000001e-003 | J171: -1.5300000000000001e-002 | K171: 5.02 | L171: -3.4599999999999999e-002 | M171: 110.1 | N171: 5.18 | O171: 0.14999999999999999 | P171: 96.91 | Q171: 4月19天 | R171: 5.87年 | S171: 4.87年 | T171: 40 | U171: 40 | V171: 9.0000000000000011e-003 | W171: 0.13 | X171: 0.126 | Y171: 308 | Z171: 0.98 | AA171: -2.e-003 | AB171: -5.1999999999999998e-003 | AC171: -1.29e-002 | AD171: -1.4499999999999999e-002 | AE171: 85.49 | AF171: 87.27 | AG171: 0.61 | AH171: AAA | AI171: 4.0999999999999995e-002 | AJ171: =H171+100*O171 -> 126.402 | AK171: 125.9 | AL171: 74 | AM171: 38.6 | AN171: 126 | AO171: -8.199999999999999e-002 | AP171: 5 | AQ171: 华菱转2
A172: 204 | B172: 113027 | C172: 华钰转债!! | D172: 601020 | E172: 华钰矿业 | F172: 有色金属 | G172: 锌铅镍锡 | H172: 116.03 | I172: 6.0999999999999995e-003 | J172: -5.4000000000000003e-003 | K172: 9.65 | L172: 1.e-003 | M172: 114.9 | N172: 10.17 | O172: 0.223 | P172: 94.89 | Q172: 转股中 | R172: 4.51年 | S172: 2.51年 | T172: 3.25 | U172: 52 | V172: 0.13500000000000001 | W172: 6.0999999999999999e-002 | X172: 5.7999999999999996e-002 | Y172: 54 | Z172: 2.2 | AA172: -2.2000000000000001e-003 | AB172: -8.1000000000000013e-003 | AC172: -4.2599999999999999e-002 | AD172: -4.4900000000000002e-002 | AE172: 87.44 | AF172: 86.88 | AG172: 0.62 | AH172: AA- | AI172: 6.54e-002 | AJ172: =H172+100*O172 -> 138.33000000000001 | AK172: 137.2 | AL172: 188 | AM172: 49.7 | AN172: 199 | AO172: -0.125 | AP172: 45 | AQ172: 华钰转债!!
A173: 122 | B173: 128104 | C173: 裕同转债! | D173: 2831 | E173: 裕同科技 | F173: 造纸包装 | G173: 包装材料 | H173: 116.96 | I173: -3.2000000000000002e-003 | J173: 2.3999999999999998e-003 | K173: 27.33 | L173: -7.000000000000001e-004 | M173: 115.3 | N173: 23.24 | O173: -5.0000000000000001e-003 | P173: 117.6 | Q173: 转股中 | R173: 5.32年 | S173: 3.32年 | T173: 8.07 | U173: 57 | V173: 5.9999999999999998e-002 | W173: 3.4000000000000002e-002 | X173: 4.0000000000000001e-002 | Y173: 240 | Z173: 3.57 | AA173: -2.7000000000000001e-003 | AB173: -7.8000000000000005e-003 | AC173: -3.4000000000000002e-002 | AD173: -3.6000000000000004e-002 | AE173: 89.47 | AF173: 92.13 | AG173: 1 | AH173: AA+ | AI173: 4.4000000000000004e-002 | AJ173: =H173+100*O173 -> 116.45999999999999 | AK173: 116.3 | AL173: 8 | AM173: 24.2 | AN173: 12 | AO173: -6.0999999999999999e-002 | AP173: 7 | AQ173: 裕同转债!
A174: 83 | B174: 123056 | C174: 雪榕转债 | D174: 300511 | E174: 雪榕生物 | F174: 农业 | G174: 种植业 | H174: 123.08 | I174: -3.1699999999999999e-002 | J174: -1.6500000000000001e-002 | K174: 13.66 | L174: -5.9900000000000002e-002 | M174: 121.1 | N174: 11.89 | O174: 7.0999999999999994e-002 | P174: 114.89 | Q174: 24天 | R174: 5.53年 | S174: 3.53年 | T174: 5.85 | U174: 44 | V174: 6.0999999999999999e-002 | W174: 9.6999999999999989e-002 | X174: 0.111 | Y174: 60 | Z174: 3.15 | AA174: -3.0000000000000001e-003 | AB174: -9.3999999999999986e-003 | AC174: -4.4900000000000002e-002 | AD174: -4.6799999999999994e-002 | AE174: 82.04 | AF174: 85.23 | AG174: 0.8 | AH174: AA- | AI174: 6.7000000000000004e-002 | AJ174: =H174+100*O174 -> 130.18000000000001 | AK174: 131.3 | AL174: 137 | AM174: 46 | AN174: 180 | AO174: -4.5999999999999999e-002 | AP174: 11 | AQ174: 雪榕转债
A175: 118 | B175: 113034 | C175: 滨化转债 | D175: 601678 | E175: 滨化股份 | F175: 化工 | G175: 化工 | H175: 117.01 | I175: -1.9e-003 | J175: -1.2699999999999999e-002 | K175: 5.02 | L175: -2.1400000000000002e-002 | M175: 115.1 | N175: 4.68 | O175: 9.0999999999999998e-002 | P175: 107.26 | Q175: 转股中 | R175: 5.33年 | S175: 3.33年 | T175: 19.3 | U175: 22 | V175: 1.e-002 | W175: 0.249 | X175: 0.26700000000000002 | Y175: 78 | Z175: 1.24 | AA175: -3.0999999999999999e-003 | AB175: -8.199999999999999e-003 | AC175: -3.4500000000000003e-002 | AD175: -3.6400000000000002e-002 | AE175: 88.66 | AF175: 90.99 | AG175: 0.68 | AH175: AA | AI175: 4.5999999999999999e-002 | AJ175: =H175+100*O175 -> 126.11 | AK175: 126.8 | AL175: 86 | AM175: 35.8 | AN175: 99 | AO175: -0.111 | AP175: 28 | AQ175: 滨化转债
A176: 315 | B176: 110034 | C176: 九州转债! | D176: 600998 | E176: 九州通 | F176: 医药 | G176: 医药商业 | H176: 109.98 | I176: -1.24e-002 | J176: 9.3999999999999986e-003 | K176: 17.11 | L176: -1.2699999999999999e-002 | M176: 109.6 | N176: 18.32 | O176: 0.17800000000000002 | P176: 93.4 | Q176: 转股中 | R176: 1年35天 | S176: 回售中 | T176: 15 | U176: 13 | V176: 8.0000000000000002e-003 | W176: 4.7e-002 | X176: 4.4000000000000004e-002 | Y176: 321 | Z176: 1.71 | AA176: -3.2000000000000002e-003 | AB176: -1.9299999999999998e-002 | AC176: 回售中 | AD176: 回售中 | AE176: 103 | AF176: 104.94 | AG176: 0.24 | AH176: AA+ | AI176: 4.0999999999999995e-002 | AJ176: =H176+100*O176 -> 127.78 | AK176: 126.6 | AL176: 82 | AM176: 21.6 | AN176: 8 | AO176: -4.4999999999999998e-002 | AP176: 26 | AQ176: 九州转债!
A177: 193 | B177: 128073 | C177: 哈尔转债! | D177: 2615 | E177: 哈尔斯 | F177: 其他 | G177: 家居用品 | H177: 116.8 | I177: -2.75e-002 | J177: 1.4199999999999999e-002 | K177: 5.21 | L177: -2.6200000000000001e-002 | M177: 115.3 | N177: 5.72 | O177: 0.28199999999999997 | P177: 91.08 | Q177: 转股中 | R177: 3.70年 | S177: 1.70年 | T177: 2.99 | U177: 101 | V177: 0.28600000000000003 | W177: 0.14000000000000001 | X177: 0.127 | Y177: 21 | Z177: 2.69 | AA177: -3.4999999999999996e-003 | AB177: -1.0800000000000001e-002 | AC177: -7.0300000000000001e-002 | AD177: -7.22e-002 | AE177: 90.76 | AF177: 91.53 | AG177: 0.51 | AH177: AA- | AI177: 6.54e-002 | AJ177: =H177+100*O177 -> 145. | AK177: 142.5 | AL177: 223 | AM177: 51 | AN177: 208 | AO177: -5.5e-002 | AP177: 40 | AQ177: 哈尔转债!
A178: 37 | B178: 113602 | C178: 景20转债 | D178: 603228 | E178: 景旺电子 | F178: 电子 | G178: 元器件制 | H178: 115.72 | I178: -1.5900000000000001e-002 | J178: 1.26e-002 | K178: 29.85 | L178: -6.9999999999999993e-003 | M178: 113.3 | N178: 35.28 | O178: 0.36799999999999999 | P178: 84.61 | Q178: 2月20天 | R178: 5.70年 | S178: 3.70年 | T178: 17.8 | U178: 7.1 | V178: 3.0000000000000001e-003 | W178: 7.0000000000000007e-002 | X178: 5.9000000000000004e-002 | Y178: 254 | Z178: 4.25 | AA178: -3.8e-003 | AB178: -8.0000000000000002e-003 | AC178: -2.7999999999999997e-002 | AD178: -2.98e-002 | AE178: 87.37 | AF178: 88.12 | AG178: 0.47 | AH178: AA | AI178: 4.5999999999999999e-002 | AJ178: =H178+100*O178 -> 152.51999999999998 | AK178: 146.8 | AL178: 242 | AM178: 58.7 | AN178: 247 | AO178: -5.9999999999999998e-002 | AP178: 7 | AQ178: 景20转债
A179: 20 | B179: 128135 | C179: 洽洽转债 | D179: 2557 | E179: 洽洽食品 | F179: 食品饮料 | G179: 休闲食品 | H179: 122.927 | I179: -8.0000000000000004e-004 | J179: -8.9999999999999998e-004 | K179: 58.66 | L179: -3.0999999999999999e-003 | M179: 120.2 | N179: 60.83 | O179: 0.27500000000000002 | P179: 96.43 | Q179: 4月16天 | R179: 5.86年 | S179: 3.86年 | T179: 13.4 | U179: 8.5 | V179: 5.0000000000000001e-003 | W179: 4.4999999999999998e-002 | X179: 4.2999999999999997e-002 | Y179: 297 | Z179: 7.76 | AA179: -3.9000000000000003e-003 | AB179: -9.7000000000000003e-003 | AC179: -4.1700000000000001e-002 | AD179: -4.3299999999999998e-002 | AE179: 86.67 | AF179: 92.78 | AG179: 0.56 | AH179: AA | AI179: 4.5999999999999999e-002 | AJ179: =H179+100*O179 -> 150.42700000000002 | AK179: 149.4 | AL179: 257 | AM179: 56.6 | AN179: 239 | AO179: 4.4999999999999998e-002 | AP179: 5 | AQ179: 洽洽转债
A180: 200 | B180: 113541 | C180: 荣晟转债! | D180: 603165 | E180: 荣晟环保 | F180: 造纸包装 | G180: 包装用纸 | H180: 117.5 | I180: -2.5999999999999999e-003 | J180: 3.2000000000000002e-003 | K180: 13.01 | L180: 8.0000000000000004e-004 | M180: 115 | N180: 11.54 | O180: 4.2000000000000003e-002 | P180: 112.74 | Q180: 转股中 | R180: 4.61年 | S180: 2.61年 | T180: 2.75 | U180: 5.2 | V180: 1.6e-002 | W180: 8.4000000000000005e-002 | X180: 9.5000000000000001e-002 | Y180: 33 | Z180: 2.14 | AA180: -4.6999999999999993e-003 | AB180: -1.0500000000000001e-002 | AC180: -4.4999999999999998e-002 | AD180: -4.7300000000000002e-002 | AE180: 86.95 | AF180: 86.39 | AG180: 0.77 | AH180: AA- | AI180: 6.54e-002 | AJ180: =H180+100*O180 -> 121.7 | AK180: 122.3 | AL180: 32 | AM180: 35.3 | AN180: 96 | AO180: -1.4999999999999999e-002 | AP180: 48 | AQ180: 荣晟转债!
A181: 222 | B181: 110057 | C181: 现代转债 | D181: 600420 | E181: 现代制药 | F181: 医药 | G181: 化学制药 | H181: 113.06 | I181: -6.7000000000000002e-003 | J181: 4.8999999999999998e-003 | K181: 9.98 | L181: -3.0000000000000001e-003 | M181: 110.8 | N181: 9.89 | O181: 0.12 | P181: 100.91 | Q181: 转股中 | R181: 4.30年 | S181: 2.30年 | T181: 16.2 | U181: 7.8 | V181: 4.0000000000000001e-003 | W181: 0.158 | X181: 0.159 | Y181: 102 | Z181: 1.3 | AA181: -4.7999999999999996e-003 | AB181: -9.3999999999999986e-003 | AC181: -3.6200000000000003e-002 | AD181: -3.8699999999999998e-002 | AE181: 93.98 | AF181: 94.15 | AG181: 0.61 | AH181: AAA | AI181: 3.9399999999999998e-002 | AJ181: =H181+100*O181 -> 125.06 | AK181: 125.2 | AL181: 64 | AM181: 31.1 | AN181: 47 | AO181: -3.5000000000000003e-002 | AP181: 22 | AQ181: 现代转债
A182: 165 | B182: 113556 | C182: 至纯转债! | D182: 603690 | E182: 至纯科技 | F182: 机械装备 | G182: 专用设备 | H182: 129.81 | I182: -3.9900000000000005e-002 | J182: -8.0000000000000002e-003 | K182: 35.74 | L182: -5.7500000000000002e-002 | M182: 126.8 | N182: 29.37 | O182: 6.7000000000000004e-002 | P182: 121.69 | Q182: 转股中 | R182: 5年9天 | S182: 3年9天 | T182: 2.96 | U182: 36 | V182: 9.3000000000000013e-002 | W182: 3.2000000000000001e-002 | X182: 3.9e-002 | Y182: 93 | Z182: 6.06 | AA182: -4.7999999999999996e-003 | AB182: -1.34e-002 | AC182: -6.59e-002 | AD182: -6.8400000000000002e-002 | AE182: 82.69 | AF182: 87.79 | AG182: 0.83 | AH182: A+ | AI182: 7.8e-002 | AJ182: =H182+100*O182 -> 136.50999999999999 | AK182: 137.9 | AL182: 192 | AM182: 50.1 | AN182: 201 | AO182: 1.e-003 | AP182: 13 | AQ182: 至纯转债!
A183: 77 | B183: 123057 | C183: 美联转债 | D183: 300586 | E183: 美联新材 | F183: 化工 | G183: 橡胶塑料 | H183: 121.588 | I183: -4.0300000000000002e-002 | J183: 1.6200000000000003e-002 | K183: 10.1 | L183: -3.3500000000000002e-002 | M183: 118.2 | N183: 9.91 | O183: 0.193 | P183: 101.92 | Q183: 27天 | R183: 5.55年 | S183: 3.55年 | T183: 2.07 | U183: 149 | V183: 0.57899999999999996 | W183: 4.4999999999999998e-002 | X183: 4.5999999999999999e-002 | Y183: 46 | Z183: 6.19 | AA183: -5.1999999999999998e-003 | AB183: -1.0800000000000001e-002 | AC183: -4.1299999999999996e-002 | AD183: -4.3200000000000002e-002 | AE183: 82.03 | AF183: 83.12 | AG183: 0.72 | AH183: AA- | AI183: 6.7000000000000004e-002 | AJ183: =H183+100*O183 -> 140.88800000000001 | AK183: 141.3 | AL183: 214 | AM183: 58.1 | AN183: 245 | AO183: -8.5000000000000006e-002 | AP183: 11 | AQ183: 美联转债
A184: 298 | B184: 110038 | C184: 济川转债! | D184: 600566 | E184: 济川药业 | F184: 医药 | G184: 中药 | H184: 108.6 | I184: 2.0000000000000001e-004 | J184: -4.0999999999999995e-003 | K184: 21.56 | L184: -1.1899999999999999e-002 | M184: 107.5 | N184: 23.85 | O184: 0.20100000000000001 | P184: 90.4 | Q184: 转股中 | R184: 1.92年 | S184: 回售中 | T184: 6.28 | U184: 2 | V184: 3.0000000000000001e-003 | W184: 3.3000000000000002e-002 | X184: 2.9999999999999999e-002 | Y184: 192 | Z184: 2.61 | AA184: -5.3e-003 | AB184: -1.26e-002 | AC184: 回售中 | AD184: 回售中 | AE184: 100.25 | AF184: 99.2 | AG184: 0.33 | AH184: AA | AI184: 4.2999999999999997e-002 | AJ184: =H184+100*O184 -> 128.69999999999999 | AK184: 126.8 | AL184: 87 | AM184: 26.6 | AN184: 20 | AO184: -2.5000000000000001e-002 | AP184: 20 | AQ184: 济川转债!
A185: 106 | B185: 113579 | C185: 健友转债 | D185: 603707 | E185: 健友股份 | F185: 医药 | G185: 原料药 | H185: 117.48 | I185: -1.1399999999999999e-002 | J185: 1.1299999999999999e-002 | K185: 38.65 | L185: -2.9999999999999997e-004 | M185: 114.2 | N185: 42.05 | O185: 0.27800000000000002 | P185: 91.91 | Q185: 转股中 | R185: 5.36年 | S185: 3.36年 | T185: 5.03 | U185: 13 | V185: 2.2000000000000002e-002 | W185: 1.3999999999999999e-002 | X185: 1.3000000000000001e-002 | Y185: 361 | Z185: 10.53 | AA185: -5.4000000000000003e-003 | AB185: -1.01e-002 | AC185: -3.5000000000000003e-002 | AD185: -3.6900000000000002e-002 | AE185: 88.61 | AF185: 90.15 | AG185: 0.54 | AH185: AA | AI185: 4.5999999999999999e-002 | AJ185: =H185+100*O185 -> 145.28 | AK185: 143 | AL185: 227 | AM185: 52.9 | AN185: 224 | AO185: 1.4999999999999999e-002 | AP185: 7 | AQ185: 健友转债
A186: 4 | B186: 127024 | C186: 盈峰转债 | D186: 967 | E186: 盈峰环境 | F186: 机械装备 | G186: 专用设备 | H186: 121.03 | I186: -2.5000000000000001e-003 | J186: -4.3e-003 | K186: 8.79 | L186: -1.01e-002 | M186: 116.8 | N186: 8.31 | O186: 0.14400000000000002 | P186: 105.78 | Q186: 5月0天 | R186: 5.90年 | S186: 3.90年 | T186: 14.8 | U186: 18 | V186: 1.e-002 | W186: 5.2999999999999999e-002 | X186: 5.5999999999999994e-002 | Y186: 278 | Z186: 1.72 | AA186: -6.0999999999999995e-003 | AB186: -1.1000000000000001e-002 | AC186: -3.8399999999999997e-002 | AD186: -3.9900000000000005e-002 | AE186: 86.81 | AF186: 90.95 | AG186: 0.67 | AH186: AA+ | AI186: 4.4000000000000004e-002 | AJ186: =H186+100*O186 -> 135.43000000000001 | AK186: 136.3 | AL186: 180 | AM186: 45.3 | AN186: 176 | AO186: -2.1000000000000001e-002 | AP186: 4 | AQ186: 盈峰转债
A187: 61 | B187: 123060 | C187: 苏试转债 | D187: 300416 | E187: 苏试试验 | F187: 机械装备 | G187: 专用设备 | H187: 121.779 | I187: -1.15e-002 | J187: -6.8999999999999999e-003 | K187: 22.64 | L187: -2.7900000000000001e-002 | M187: 117.6 | N187: 23.86 | O187: 0.28300000000000003 | P187: 94.89 | Q187: 47天 | R187: 5.61年 | S187: 3.61年 | T187: 3.1 | U187: 13 | V187: 3.4000000000000002e-002 | W187: 6.7000000000000004e-002 | X187: 6.4000000000000001e-002 | Y187: 46 | Z187: 4.64 | AA187: -6.3e-003 | AB187: -1.18e-002 | AC187: -4.1500000000000002e-002 | AD187: -4.3400000000000001e-002 | AE187: 81.58 | AF187: 82.37 | AG187: 0.66 | AH187: AA- | AI187: 6.7000000000000004e-002 | AJ187: =H187+100*O187 -> 150.07900000000001 | AK187: 148.7 | AL187: 251 | AM187: 66.3 | AN187: 271 | AO187: -2.5000000000000001e-002 | AP187: 8 | AQ187: 苏试转债
A188: 10 | B188: 113607 | C188: 伟20转债 | D188: 603568 | E188: 伟明环保 | F188: 城市公用 | G188: 三废处理 | H188: 119.5 | I188: 1.8e-003 | J188: 1.1000000000000001e-003 | K188: 21.15 | L188: 4.7999999999999996e-003 | M188: 115.1 | N188: 22.01 | O188: 0.24399999999999999 | P188: 96.09 | Q188: 4月26天 | R188: 5.89年 | S188: 3.89年 | T188: 12 | U188: 3.5 | V188: 2.e-003 | W188: 4.4999999999999998e-002 | X188: 4.2999999999999997e-002 | Y188: 266 | Z188: 5.29 | AA188: -6.4000000000000003e-003 | AB188: -1.1000000000000001e-002 | AC188: -3.4799999999999998e-002 | AD188: -3.6400000000000002e-002 | AE188: 86.44 | AF188: 88.71 | AG188: 0.59 | AH188: AA | AI188: 4.5999999999999999e-002 | AJ188: =H188+100*O188 -> 143.90000000000001 | AK188: 142.9 | AL188: 226 | AM188: 54.2 | AN188: 227 | AO188: -8.0000000000000002e-003 | AP188: 3 | AQ188: 伟20转债
A189: 135 | B189: 123044 | C189: 红相转债! | D189: 300427 | E189: 红相股份 | F189: 能源电力 | G189: 电力设备 | H189: 129.8 | I189: -4.9100000000000005e-002 | J189: 2.53e-002 | K189: 22.2 | L189: -3.0600000000000002e-002 | M189: 125.5 | N189: 18.8 | O189: 9.9000000000000005e-002 | P189: 118.09 | Q189: 转股中 | R189: 5.25年 | S189: 3.25年 | T189: 5.5 | U189: 27 | V189: 3.6000000000000004e-002 | W189: 6.9000000000000006e-002 | X189: 8.1000000000000003e-002 | Y189: 80 | Z189: 3.5 | AA189: -6.6e-003 | AB189: -1.4499999999999999e-002 | AC189: -6.0899999999999996e-002 | AD189: -6.3399999999999998e-002 | AE189: 84.41 | AF189: 90.11 | AG189: 0.78 | AH189: AA- | AI189: 6.7000000000000004e-002 | AJ189: =H189+100*O189 -> 139.70000000000002 | AK189: 141.5 | AL189: 216 | AM189: 51.4 | AN189: 215 | AO189: -6.3e-002 | AP189: 16 | AQ189: 红相转债!
A190: 233 | B190: 128057 | C190: 博彦转债 | D190: 2649 | E190: 博彦科技 | F190: 计算机及 | G190: 软件开发 | H190: 120.428 | I190: -7.9000000000000008e-003 | J190: 7.9000000000000008e-003 | K190: 10.39 | L190: 0. | M190: 117.1 | N190: 8.72 | O190: 1.1000000000000001e-002 | P190: 119.15 | Q190: 转股中 | R190: 4.23年 | S190: 2.23年 | T190: 5.29 | U190: 24 | V190: 3.7999999999999999e-002 | W190: 9.6000000000000002e-002 | X190: 0.114 | Y190: 55 | Z190: 1.94 | AA190: -6.7000000000000002e-003 | AB190: -1.38e-002 | AC190: -6.1600000000000002e-002 | AD190: -6.4199999999999993e-002 | AE190: 89.19 | AF190: 90.14 | AG190: 0.82 | AH190: AA- | AI190: 6.54e-002 | AJ190: =H190+100*O190 -> 121.52799999999999 | AK190: 121.7 | AL190: 27 | AM190: 31.6 | AN190: 54 | AO190: 3.7999999999999999e-002 | AP190: 28 | AQ190: 博彦转债
A191: 223 | B191: 123025 | C191: 精测转债!! | D191: 300567 | E191: 精测电子 | F191: 电子 | G191: 液晶显示 | H191: 120.803 | I191: -2.2000000000000002e-002 | J191: -1.e-003 | K191: 47.21 | L191: -3.95e-002 | M191: 117.3 | N191: 49.95 | O191: 0.27800000000000002 | P191: 94.51 | Q191: 转股中 | R191: 4.30年 | S191: 2.30年 | T191: 3.09 | U191: 3.4 | V191: 9.0000000000000011e-003 | W191: 2.7000000000000003e-002 | X191: 2.5000000000000001e-002 | Y191: 116 | Z191: 7.5 | AA191: -6.9999999999999993e-003 | AB191: -1.3999999999999999e-002 | AC191: -6.0999999999999999e-002 | AD191: -6.3600000000000004e-002 | AE191: 88.84 | AF191: 89.93 | AG191: 0.58 | AH191: AA- | AI191: 6.54e-002 | AJ191: =H191+100*O191 -> 148.60300000000001 | AK191: 147.1 | AL191: 244 | AM191: 57.2 | AN191: 243 | AO191: -5.0000000000000003e-002 | AP191: 18 | AQ191: 精测转债!!
A192: 316 | B192: 110033 | C192: 国贸转债! | D192: 600755 | E192: 厦门国贸 | F192: 交通运输 | G192: 交通运输 | H192: 110.53 | I192: -6.8999999999999999e-003 | J192: 4.8999999999999998e-003 | K192: 6.86 | L192: -7.1999999999999998e-003 | M192: 109.7 | N192: 7.19 | O192: 0.158 | P192: 95.41 | Q192: 转股中 | R192: 1年25天 | S192: 回售中 | T192: 12.1 | U192: 5.4 | V192: 4.0000000000000001e-003 | W192: 9.4e-002 | X192: 8.9999999999999997e-002 | Y192: 128 | Z192: 0.88 | AA192: -7.0999999999999995e-003 | AB192: -2.3700000000000002e-002 | AC192: 回售中 | AD192: 回售中 | AE192: 100.28 | AF192: 105.48 | AG192: 0.28 | AH192: AAA | AI192: 3.7999999999999999e-002 | AJ192: =H192+100*O192 -> 126.33 | AK192: 125.6 | AL192: 71 | AM192: 20.2 | AN192: 7 | AO192: -3.7000000000000005e-002 | AP192: 18 | AQ192: 国贸转债!
A193: 101 | B193: 127017 | C193: 万青转债 | D193: 789 | E193: 万年青 | F193: 建筑 | G193: 水泥 | H193: 123 | I193: -1.e-003 | J193: -1.6e-002 | K193: 13.72 | L193: -3.1099999999999999e-002 | M193: 118.4 | N193: 14.16 | O193: 0.26899999999999996 | P193: 96.89 | Q193: 转股中 | R193: 5.48年 | S193: 3.48年 | T193: 10 | U193: 7.5 | V193: 6.0000000000000001e-003 | W193: 9.0999999999999998e-002 | X193: 8.900000000000001e-002 | Y193: 109 | Z193: 1.97 | AA193: -7.0999999999999995e-003 | AB193: -1.2800000000000001e-002 | AC193: -4.6100000000000002e-002 | AD193: -4.7899999999999998e-002 | AE193: 88.81 | AF193: 93.95 | AG193: 0.55 | AH193: AA+ | AI193: 4.4000000000000004e-002 | AJ193: =H193+100*O193 -> 149.90000000000001 | AK193: 149.1 | AL193: 255 | AM193: 55.2 | AN193: 236 | AO193: -9.8000000000000004e-002 | AP193: 7 | AQ193: 万青转债
A194: 33 | B194: 123065 | C194: 宝莱转债! | D194: 300246 | E194: 宝莱特 | F194: 医药 | G194: 医疗器械 | H194: 126.7 | I194: -6.5599999999999992e-002 | J194: 5.1900000000000002e-002 | K194: 26.84 | L194: -4.6500000000000007e-002 | M194: 121.4 | N194: 40.54 | O194: 0.91400000000000003 | P194: 66.21 | Q194: 3月0天 | R194: 5.73年 | S194: 3.73年 | T194: 2.19 | U194: 935 | V194: 3.27 | W194: 5.5999999999999994e-002 | X194: 3.7000000000000005e-002 | Y194: 39 | Z194: 4.71 | AA194: -7.6e-003 | AB194: -1.38e-002 | AC194: -4.9100000000000005e-002 | AD194: -5.0999999999999997e-002 | AE194: 81.23 | AF194: 84.38 | AG194: 0.29 | AH194: AA- | AI194: 6.7000000000000004e-002 | AJ194: =H194+100*O194 -> 218.10000000000002 | AK194: 187.2 | AL194: 297 | AM194: 102.8 | AN194: 298 | AO194: -6.5000000000000002e-002 | AP194: 10 | AQ194: 宝莱转债!
A195: 309 | B195: 113012 | C195: 骆驼转债! | D195: 601311 | E195: 骆驼股份 | F195: 汽车 | G195: 零部件制 | H195: 109.68 | I195: -1.18e-002 | J195: 5.1999999999999998e-003 | K195: 8.71 | L195: -2.2400000000000003e-002 | M195: 107.8 | N195: 10.06 | O195: 0.26700000000000002 | P195: 86.58 | Q195: 转股中 | R195: 2.28年 | S195: 0.28年 | T195: 5.1 | U195: 14 | V195: 2.5000000000000001e-002 | W195: 5.2000000000000005e-002 | X195: 4.4999999999999998e-002 | Y195: 98 | Z195: 1.46 | AA195: -7.7000000000000002e-003 | AB195: -1.41e-002 | AC195: -0.17699999999999999 | AD195: -0.184 | AE195: 99.66 | AF195: 98.09 | AG195: 0.3 | AH195: AA | AI195: 4.2999999999999997e-002 | AJ195: =H195+100*O195 -> 136.38 | AK195: 132.8 | AL195: 152 | AM195: 33.1 | AN195: 68 | AO195: -6.9999999999999993e-003 | AP195: 17 | AQ195: 骆驼转债!
A196: 302 | B196: 113016 | C196: 小康转债! | D196: 601127 | E196: 小康股份 | F196: 汽车 | G196: 零部件制 | H196: 111.8 | I196: 3.9000000000000003e-003 | J196: 5.4000000000000003e-003 | K196: 16.19 | L196: 1.4999999999999999e-002 | M196: 109.3 | N196: 15.7 | O196: 8.4000000000000005e-002 | P196: 103.12 | Q196: 转股中 | R196: 2.90年 | S196: 0.90年 | T196: 6.39 | U196: 775 | V196: 1.0800000000000001 | W196: 3.1e-002 | X196: 3.2000000000000001e-002 | Y196: 204 | Z196: 3.53 | AA196: -7.9000000000000008e-003 | AB196: -1.38e-002 | AC196: -8.4000000000000005e-002 | AD196: -8.6999999999999994e-002 | AE196: 97.32 | AF196: 96.91 | AG196: 0.62 | AH196: AA | AI196: 4.2999999999999997e-002 | AJ196: =H196+100*O196 -> 120.2 | AK196: 120.5 | AL196: 18 | AM196: 23.2 | AN196: 10 | AO196: -3.5000000000000003e-002 | AP196: 46 | AQ196: 小康转债!
A197: 173 | B197: 110062 | C197: 烽火转债 | D197: 600498 | E197: 烽火通信 | F197: 通信互联 | G197: 通信设备 | H197: 115.34 | I197: -1.4999999999999999e-002 | J197: 7.9000000000000008e-003 | K197: 23.25 | L197: -1.3999999999999999e-002 | M197: 110.8 | N197: 25.65 | O197: 0.27200000000000002 | P197: 90.64 | Q197: 转股中 | R197: 4.98年 | S197: 2.98年 | T197: 30.9 | U197: 31 | V197: 9.0000000000000011e-003 | W197: 0.113 | X197: 0.10300000000000001 | Y197: 272 | Z197: 2.56 | AA197: -8.199999999999999e-003 | AB197: -1.21e-002 | AC197: -3.4700000000000002e-002 | AD197: -3.6699999999999997e-002 | AE197: 91.58 | AF197: 91.74 | AG197: 0.51 | AH197: AAA | AI197: 3.9399999999999998e-002 | AJ197: =H197+100*O197 -> 142.54000000000002 | AK197: 140 | AL197: 207 | AM197: 48.3 | AN197: 189 | AO197: -6.9000000000000006e-002 | AP197: 19 | AQ197: 烽火转债
A198: 238 | B198: 110051 | C198: 中天转债! | D198: 600522 | E198: 中天科技 | F198: 通信互联 | G198: 通信设备 | H198: 118.07 | I198: -9.8999999999999991e-003 | J198: -1.e-004 | K198: 10.52 | L198: -1.5900000000000001e-002 | M198: 113.9 | N198: 10.09 | O198: 0.13200000000000001 | P198: 104.26 | Q198: 转股中 | R198: 4.22年 | S198: 2.22年 | T198: 39.6 | U198: 10 | V198: 2.e-003 | W198: 0.12300000000000001 | X198: 0.128 | Y198: 323 | Z198: 1.47 | AA198: -8.6999999999999994e-003 | AB198: -1.4499999999999999e-002 | AC198: -5.4699999999999999e-002 | AD198: -5.7200000000000001e-002 | AE198: 93.76 | AF198: 95.97 | AG198: 0.63 | AH198: AA+ | AI198: 4.24e-002 | AJ198: =H198+100*O198 -> 131.26999999999998 | AK198: 131.9 | AL198: 142 | AM198: 35.9 | AN198: 100 | AO198: -3.6000000000000004e-002 | AP198: 27 | AQ198: 中天转债!
A199: 99 | B199: 128109 | C199: 楚江转债 | D199: 2171 | E199: 楚江新材 | F199: 有色金属 | G199: 铜金属 | H199: 120.9 | I199: -1.8e-003 | J199: -1.1599999999999999e-002 | K199: 8.88 | L199: -2.0899999999999998e-002 | M199: 115.3 | N199: 8.73 | O199: 0.18899999999999997 | P199: 101.72 | Q199: 转股中 | R199: 5.48年 | S199: 3.48年 | T199: 18.3 | U199: 5 | V199: 2.e-003 | W199: 0.155 | X199: 0.157 | Y199: 118 | Z199: 2.15 | AA199: -8.8000000000000005e-003 | AB199: -1.37e-002 | AC199: -4.1299999999999996e-002 | AD199: -4.3200000000000002e-002 | AE199: 88.25 | AF199: 90.56 | AG199: 0.64 | AH199: AA | AI199: 4.5999999999999999e-002 | AJ199: =H199+100*O199 -> 139.80000000000001 | AK199: 140.1 | AL199: 208 | AM199: 49.5 | AN199: 195 | AO199: -7.2999999999999995e-002 | AP199: 6 | AQ199: 楚江转债
A200: 136 | B200: 110067 | C200: 华安转债! | D200: 600909 | E200: 华安证券 | F200: 金融 | G200: 证券行业 | H200: 115.87 | I200: -1.9699999999999999e-002 | J200: 1.7100000000000001e-002 | K200: 7.88 | L200: -5.1000000000000004e-003 | M200: 110.5 | N200: 8.67 | O200: 0.27500000000000002 | P200: 90.89 | Q200: 转股中 | R200: 5.25年 | S200: 无权 | T200: 28 | U200: 79 | V200: 2.4e-002 | W200: 9.8000000000000004e-002 | X200: 8.900000000000001e-002 | Y200: 285 | Z200: 2.06 | AA200: -9.1000000000000004e-003 | AB200: -1.2699999999999999e-002 | AC200: 无权 | AD200: 无权 | AE200: 无权 | AF200: 89.74 | AG200: 0.51 | AH200: AAA | AI200: 4.0999999999999995e-002 | AJ200: =H200+100*O200 -> 143.37 | AK200: 140.9 | AL200: 210 | AM200: 51.1 | AN200: 209 | AO200: -3.7000000000000005e-002 | AP200: 27 | AQ200: 华安转债!
A201: 208 | B201: 113536 | C201: 三星转债 | D201: 603578 | E201: 三星新材 | F201: 家电 | G201: 零部件制 | H201: 119.77 | I201: -1.9199999999999998e-002 | J201: 9.7999999999999997e-003 | K201: 21.99 | L201: -1.3500000000000002e-002 | M201: 114.8 | N201: 19.54 | O201: 6.4000000000000001e-002 | P201: 112.54 | Q201: 转股中 | R201: 4.47年 | S201: 2.47年 | T201: 1.49 | U201: 4.1 | V201: 2.3e-002 | W201: 7.400000000000001e-002 | X201: 8.3000000000000004e-002 | Y201: 20 | Z201: 2.89 | AA201: -9.5999999999999992e-003 | AB201: -1.54e-002 | AC201: -5.5099999999999996e-002 | AD201: -5.7300000000000004e-002 | AE201: 92.23 | AF201: 94.9 | AG201: 0.69 | AH201: AA | AI201: 4.4400000000000002e-002 | AJ201: =H201+100*O201 -> 126.17 | AK201: 127 | AL201: 88 | AM201: 32.1 | AN201: 61 | AO201: -6.7000000000000004e-002 | AP201: 37 | AQ201: 三星转债
A202: 6 | B202: 128136 | C202: 立讯转债 | D202: 2475 | E202: 立讯精密 | F202: 电子 | G202: 元器件制 | H202: 118.835 | I202: -9.300000000000001e-003 | J202: -1.5e-003 | K202: 50.68 | L202: -2.1600000000000001e-002 | M202: 111.9 | N202: 58.62 | O202: 0.375 | P202: 86.46 | Q202: 4月29天 | R202: 5.90年 | S202: 3.90年 | T202: 30 | U202: 365 | V202: 0.10199999999999999 | W202: 8.0000000000000002e-003 | X202: 6.9999999999999993e-003 | Y202: 3546. | Z202: 14.22 | AA202: -1.0200000000000001e-002 | AB202: -1.3899999999999999e-002 | AC202: -3.61e-002 | AD202: -3.7200000000000004e-002 | AE202: 86.01 | AF202: 87.05 | AG202: 0.5 | AH202: AA+ | AI202: 4.4000000000000004e-002 | AJ202: =H202+100*O202 -> 156.33499999999998 | AK202: 151.2 | AL202: 264 | AM202: 64.2 | AN202: 263 | AO202: -2.8999999999999998e-002 | AP202: 6 | AQ202: 立讯转债
A203: 177 | B203: 123035 | C203: 利德转债! | D203: 300296 | E203: 利亚德 | F203: 电子 | G203: LED制 | H203: 121.34 | I203: -7.0999999999999995e-003 | J203: -1.9e-002 | K203: 6.9 | L203: -4.5599999999999995e-002 | M203: 115.1 | N203: 6.98 | O203: 0.22699999999999998 | P203: 98.85 | Q203: 转股中 | R203: 4.93年 | S203: 2.93年 | T203: 8 | U203: 7.2 | V203: 6.9999999999999993e-003 | W203: 4.5999999999999999e-002 | X203: 4.4999999999999998e-002 | Y203: 175 | Z203: 2.05 | AA203: -1.09e-002 | AB203: -1.6200000000000003e-002 | AC203: -5.0300000000000004e-002 | AD203: -5.2400000000000002e-002 | AE203: 91.23 | AF203: 94.19 | AG203: 0.57 | AH203: AA+ | AI203: 4.24e-002 | AJ203: =H203+100*O203 -> 144.03999999999999 | AK203: 143.8 | AL203: 233 | AM203: 49.6 | AN203: 198 | AO203: -8.8000000000000009e-002 | AP203: 16 | AQ203: 利德转债!
A204: 57 | B204: 110073 | C204: 国投转债 | D204: 600061 | E204: 国投资本 | F204: 金融 | G204: 证券行业 | H204: 117.45 | I204: -2.e-003 | J204: -1.8e-003 | K204: 13.95 | L204: -7.0999999999999995e-003 | M204: 110.5 | N204: 15.25 | O204: 0.28399999999999997 | P204: 91.48 | Q204: 52天 | R204: 5.62年 | S204: 无权 | T204: 80 | U204: 52 | V204: 6.0000000000000001e-003 | W204: 0.13600000000000001 | X204: 0.124 | Y204: 590 | Z204: 1.41 | AA204: -1.09e-002 | AB204: -1.43e-002 | AC204: 无权 | AD204: 无权 | AE204: 无权 | AF204: 88.42 | AG204: 0.53 | AH204: AAA | AI204: 4.0999999999999995e-002 | AJ204: =H204+100*O204 -> 145.84999999999999 | AK204: 143.4 | AL204: 229 | AM204: 55 | AN204: 235 | AO204: -5.2000000000000005e-002 | AP204: 21 | AQ204: 国投转债
A205: 134 | B205: 113572 | C205: 三祥转债! | D205: 603663 | E205: 三祥新材 | F205: 其他 | G205: 其他 | H205: 119.9 | I205: -1.5700000000000002e-002 | J205: 1.7299999999999999e-002 | K205: 15.69 | L205: 1.9e-003 | M205: 113.2 | N205: 14.19 | O205: 8.4000000000000005e-002 | P205: 110.57 | Q205: 转股中 | R205: 5.25年 | S205: 3.25年 | T205: 1.7 | U205: 7.8 | V205: 3.7999999999999999e-002 | W205: 5.5999999999999994e-002 | X205: 6.2e-002 | Y205: 30 | Z205: 5.07 | AA205: -1.11e-002 | AB205: -1.5600000000000001e-002 | AC205: -4.2000000000000003e-002 | AD205: -4.3899999999999995e-002 | AE205: 80.45 | AF205: 76.97 | AG205: 0.83 | AH205: A+ | AI205: 7.8e-002 | AJ205: =H205+100*O205 -> 128.30000000000001 | AK205: 129.2 | AL205: 114 | AM205: 48.8 | AN205: 190 | AO205: -5.0999999999999997e-002 | AP205: 18 | AQ205: 三祥转债!
A206: 3 | B206: 127025 | C206: 冀东转债 | D206: 401 | E206: 冀东水泥 | F206: 建筑 | G206: 水泥 | H206: 117.504 | I206: -8.3999999999999995e-003 | J206: 4.4000000000000003e-003 | K206: 15.16 | L206: -6.6e-003 | M206: 110.1 | N206: 15.78 | O206: 0.223 | P206: 96.07 | Q206: 5月1天 | R206: 5.90年 | S206: 3.90年 | T206: 28.2 | U206: 36 | V206: 1.1000000000000001e-002 | W206: 0.13800000000000001 | X206: 0.13300000000000001 | Y206: 204 | Z206: 1.5 | AA206: -1.11e-002 | AB206: -1.4199999999999999e-002 | AC206: -3.2400000000000005e-002 | AD206: -3.3700000000000001e-002 | AE206: 87.42 | AF206: 87.15 | AG206: 0.6 | AH206: AAA | AI206: 4.0999999999999995e-002 | AJ206: =H206+100*O206 -> 139.804 | AK206: 138.9 | AL206: 200 | AM206: 51.5 | AN206: 216 | AO206: -4.9000000000000002e-002 | AP206: 6 | AQ206: 冀东转债
A207: 103 | B207: 128108 | C207: 蓝帆转债 | D207: 2382 | E207: 蓝帆医疗 | F207: 医药 | G207: 医疗器械 | H207: 120.32 | I207: -2.3799999999999998e-002 | J207: -5.9999999999999995e-004 | K207: 21.42 | L207: -3.0800000000000001e-002 | M207: 113.3 | N207: 17.79 | O207: -1.e-003 | P207: 120.4 | Q207: 转股中 | R207: 5.46年 | S207: 4.46年 | T207: 31.1 | U207: 208 | V207: 5.5e-002 | W207: 0.151 | X207: 0.182 | Y207: 206 | Z207: 2.16 | AA207: -1.1200000000000002e-002 | AB207: -1.55e-002 | AC207: -2.8199999999999999e-002 | AD207: -3.0299999999999997e-002 | AE207: 86.08 | AF207: 89.08 | AG207: 0.79 | AH207: AA | AI207: 4.5999999999999999e-002 | AJ207: =H207+100*O207 -> 120.22 | AK207: 120.2 | AL207: 15 | AM207: 31.2 | AN207: 48 | AO207: 3.1e-002 | AP207: 25 | AQ207: 蓝帆转债
A208: 97 | B208: 123052 | C208: 飞鹿转债 | D208: 300665 | E208: 飞鹿股份 | F208: 化工 | G208: 化工 | H208: 135.6 | I208: -8.1300000000000011e-002 | J208: 1.7899999999999999e-002 | K208: 11.9 | L208: -7.8200000000000006e-002 | M208: 127.3 | N208: 9.9 | O208: 0.128 | P208: 120.2 | Q208: 转股中 | R208: 5.48年 | S208: 3.48年 | T208: 1.77 | U208: 375 | V208: 1.5 | W208: 0.122 | X208: 0.14699999999999999 | Y208: 14 | Z208: 3.07 | AA208: -1.1699999999999999e-002 | AB208: -1.9699999999999999e-002 | AC208: -6.8000000000000005e-002 | AD208: -7.0400000000000004e-002 | AE208: 80.31 | AF208: 85.25 | AG208: 0.81 | AH208: A+ | AI208: 7.8e-002 | AJ208: =H208+100*O208 -> 148.40000000000001 | AK208: 151 | AL208: 263 | AM208: 65.7 | AN208: 268 | AO208: -0.10800000000000001 | AP208: 13 | AQ208: 飞鹿转债
A209: 149 | B209: 128096 | C209: 奥瑞转债!! | D209: 2701 | E209: 奥瑞金 | F209: 造纸包装 | G209: 包装材料 | H209: 123.211 | I209: -2.2099999999999998e-002 | J209: 9.4999999999999998e-003 | K209: 5.57 | L209: -1.5900000000000001e-002 | M209: 116 | N209: 4.54 | O209: 4.0000000000000001e-003 | P209: 122.69 | Q209: 转股中 | R209: 5.17年 | S209: 3.17年 | T209: 7.08 | U209: 22 | V209: 2.5000000000000001e-002 | W209: 5.2999999999999999e-002 | X209: 6.5000000000000002e-002 | Y209: 135 | Z209: 2.26 | AA209: -1.1899999999999999e-002 | AB209: -1.72e-002 | AC209: -4.9200000000000001e-002 | AD209: -5.1500000000000004e-002 | AE209: 90.56 | AF209: 93.36 | AG209: 0.79 | AH209: AA+ | AI209: 4.4000000000000004e-002 | AJ209: =H209+100*O209 -> 123.611 | AK209: 123.7 | AL209: 44 | AM209: 30.4 | AN209: 41 | AO209: -6.9000000000000006e-002 | AP209: 21 | AQ209: 奥瑞转债!!
A210: 55 | B210: 123062 | C210: 三超转债 | D210: 300554 | E210: 三超新材 | F210: 机械装备 | G210: 通用设备 | H210: 128.099 | I210: -5.04e-002 | J210: 1.21e-002 | K210: 21.08 | L210: -4.3099999999999999e-002 | M210: 119.7 | N210: 17.17 | O210: 4.2999999999999997e-002 | P210: 122.77 | Q210: 52天 | R210: 5.62年 | S210: 3.62年 | T210: 1.95 | U210: 145 | V210: 0.56899999999999995 | W210: 9.9000000000000005e-002 | X210: 0.121 | Y210: 20 | Z210: 3.78 | AA210: -1.2199999999999999e-002 | AB210: -1.8200000000000001e-002 | AC210: -5.2499999999999998e-002 | AD210: -5.4699999999999999e-002 | AE210: 76.28 | AF210: 75.35 | AG210: 0.89 | AH210: A | AI210: 8.8000000000000009e-002 | AJ210: =H210+100*O210 -> 132.399 | AK210: 133.4 | AL210: 157 | AM210: 57.1 | AN210: 242 | AO210: -0.11 | AP210: 13 | AQ210: 三超转债
A211: 8 | B211: 110076 | C211: 华海转债 | D211: 600521 | E211: 华海药业 | F211: 医药 | G211: 医药行业 | H211: 123.99 | I211: 1.4000000000000002e-003 | J211: -5.0000000000000001e-003 | K211: 33.79 | L211: -5.8999999999999999e-003 | M211: 115.1 | N211: 34.66 | O211: 0.27200000000000002 | P211: 97.49 | Q211: 4月26天 | R211: 5.89年 | S211: 3.89年 | T211: 18.4 | U211: 57 | V211: 2.5000000000000001e-002 | W211: 3.7000000000000005e-002 | X211: 3.7000000000000005e-002 | Y211: 492 | Z211: 7.95 | AA211: -1.2699999999999999e-002 | AB211: -1.72e-002 | AC211: -4.36e-002 | AD211: -4.5199999999999997e-002 | AE211: 86.44 | AF211: 88.71 | AG211: 0.61 | AH211: AA | AI211: 4.5999999999999999e-002 | AJ211: =H211+100*O211 -> 151.19 | AK211: 150.5 | AL211: 258 | AM211: 61.8 | AN211: 256 | AO211: 4.8000000000000001e-002 | AP211: 3 | AQ211: 华海转债
A212: 15 | B212: 113605 | C212: 大参转债 | D212: 603233 | E212: 大参林 | F212: 医药 | G212: 医药商业 | H212: 124.06 | I212: -5.7999999999999996e-003 | J212: -2.1499999999999998e-002 | K212: 78.86 | L212: -4.7500000000000001e-002 | M212: 115.2 | N212: 83.85 | O212: 0.31900000000000001 | P212: 94.05 | Q212: 4月18天 | R212: 5.86年 | S212: 3.86年 | T212: 14.1 | U212: 25 | V212: 1.4999999999999999e-002 | W212: 2.7000000000000003e-002 | X212: 2.6000000000000002e-002 | Y212: 518 | Z212: 10.37 | AA212: -1.2800000000000001e-002 | AB212: -1.7299999999999999e-002 | AC212: -4.3799999999999999e-002 | AD212: -4.5499999999999999e-002 | AE212: 86.64 | AF212: 88.92 | AG212: 0.58 | AH212: AA | AI212: 4.5999999999999999e-002 | AJ212: =H212+100*O212 -> 155.96000000000001 | AK212: 154.1 | AL212: 271 | AM212: 65.2 | AN212: 265 | AO212: -0.10400000000000001 | AP212: 4 | AQ212: 大参转债
A213: 201 | B213: 128070 | C213: 智能转债! | D213: 2877 | E213: 智能自控 | F213: 机械装备 | G213: 通用设备 | H213: 124.6 | I213: -6.3299999999999995e-002 | J213: 5.57e-002 | K213: 7.53 | L213: -1.7000000000000001e-002 | M213: 117.6 | N213: 9.51 | O213: 0.57399999999999995 | P213: 79.18 | Q213: 转股中 | R213: 4.56年 | S213: 无权 | T213: 2.3 | U213: 405 | V213: 1.3799999999999999 | W213: 9.1999999999999998e-002 | X213: 7.2999999999999995e-002 | Y213: 25 | Z213: 3.51 | AA213: -1.29e-002 | AB213: -1.95e-002 | AC213: 无权 | AD213: 无权 | AE213: 无权 | AF213: 84.77 | AG213: 0.45 | AH213: A+ | AI213: 7.6399999999999996e-002 | AJ213: =H213+100*O213 -> 182. | AK213: 170 | AL213: 287 | AM213: 85.3 | AN213: 291 | AO213: -4.9000000000000002e-002 | AP213: 32 | AQ213: 智能转债!
A214: 146 | B214: 113565 | C214: 宏辉转债 | D214: 603336 | E214: 宏辉果蔬 | F214: 农业 | G214: 农产品加 | H214: 126.38 | I214: 1.03e-002 | J214: 1.18e-002 | K214: 12.34 | L214: 2.58e-002 | M214: 118.2 | N214: 10 | O214: 2.4e-002 | P214: 123.4 | Q214: 转股中 | R214: 5.21年 | S214: 3.21年 | T214: 2.3 | U214: 1149. | V214: 3.8900000000000001 | W214: 5.5e-002 | X214: 6.8000000000000005e-002 | Y214: 42 | Z214: 4.38 | AA214: -1.3000000000000001e-002 | AB214: -1.9e-002 | AC214: -5.6399999999999999e-002 | AD214: -5.8499999999999996e-002 | AE214: 83.88 | AF214: 84.99 | AG214: 0.86 | AH214: AA- | AI214: 6.7000000000000004e-002 | AJ214: =H214+100*O214 -> 128.78 | AK214: 129.4 | AL214: 116 | AM214: 44.4 | AN214: 171 | AO214: 7.400000000000001e-002 | AP214: 20 | AQ214: 宏辉转债
A215: 91 | B215: 128111 | C215: 中矿转债 | D215: 2738 | E215: 中矿资源 | F215: 有色金属 | G215: 有色行业 | H215: 133.822 | I215: -8.6999999999999994e-003 | J215: 5.0000000000000001e-003 | K215: 21.48 | L215: -4.1999999999999997e-003 | M215: 124.7 | N215: 15.48 | O215: -3.6000000000000004e-002 | P215: 138.76 | Q215: 6.1天 | R215: 5.50年 | S215: 3.50年 | T215: 8 | U215: 121 | V215: 0.11 | W215: 0.13300000000000001 | X215: 0.184 | Y215: 60 | Z215: 2.22 | AA215: -1.3000000000000001e-002 | AB215: -2.0299999999999999e-002 | AC215: -6.5700000000000008e-002 | AD215: -6.7799999999999999e-002 | AE215: 82.73 | AF215: 88.03 | AG215: 0.89 | AH215: AA- | AI215: 6.7000000000000004e-002 | AJ215: =H215+100*O215 -> 130.22200000000001 | AK215: 128.9 | AL215: 109 | AM215: 40.9 | AN215: 141 | AO215: -2.7000000000000003e-002 | AP215: 9 | AQ215: 中矿转债
A216: 232 | B216: 127011 | C216: 中鼎转2! | D216: 887 | E216: 中鼎股份 | F216: 汽车 | G216: 零部件制 | H216: 121.7 | I216: -8.1000000000000013e-003 | J216: -2.8999999999999998e-003 | K216: 11.77 | L216: -1.9199999999999998e-002 | M216: 115.2 | N216: 11.59 | O216: 0.19800000000000001 | P216: 101.55 | Q216: 转股中 | R216: 4.24年 | S216: 2.24年 | T216: 12 | U216: 2.5 | V216: 2.e-003 | W216: 8.4000000000000005e-002 | X216: 8.5000000000000006e-002 | Y216: 144 | Z216: 1.64 | AA216: -1.3100000000000001e-002 | AB216: -1.9400000000000001e-002 | AC216: -6.5700000000000008e-002 | AD216: -6.83e-002 | AE216: 93.81 | AF216: 97 | AG216: 0.58 | AH216: AA+ | AI216: 4.24e-002 | AJ216: =H216+100*O216 -> 141.5 | AK216: 141.8 | AL216: 221 | AM216: 44.9 | AN216: 174 | AO216: -8.5000000000000006e-002 | AP216: 26 | AQ216: 中鼎转2!
A217: 86 | B217: 123055 | C217: 晨光转债 | D217: 300138 | E217: 晨光生物 | F217: 食品饮料 | G217: 食品加工 | H217: 133.668 | I217: -2.0099999999999996e-002 | J217: 3.4000000000000002e-003 | K217: 16.8 | L217: -1.8700000000000001e-002 | M217: 124.3 | N217: 12.25 | O217: -2.5000000000000001e-002 | P217: 137.14 | Q217: 12天 | R217: 5.52年 | S217: 3.52年 | T217: 6.3 | U217: 31 | V217: 3.6000000000000004e-002 | W217: 7.2999999999999995e-002 | X217: 0.10000000000000001 | Y217: 86 | Z217: 4.47 | AA217: -1.34e-002 | AB217: -2.0499999999999997e-002 | AC217: -6.6100000000000006e-002 | AD217: -6.8000000000000005e-002 | AE217: 82.33 | AF217: 87.62 | AG217: 0.89 | AH217: AA- | AI217: 6.7000000000000004e-002 | AJ217: =H217+100*O217 -> 131.16800000000001 | AK217: 130.2 | AL217: 124 | AM217: 42.6 | AN217: 157 | AO217: -2.3e-002 | AP217: 9 | AQ217: 晨光转债
A218: 270 | B218: 128040 | C218: 华通转债! | D218: 2758 | E218: 华通医药 | F218: 医药 | G218: 医药商业 | H218: 118.1 | I218: -1.09e-002 | J218: 2.0799999999999999e-002 | K218: 11.6 | L218: 1.3100000000000001e-002 | M218: 112.3 | N218: 10.33 | O218: 5.2000000000000005e-002 | P218: 112.29 | Q218: 转股中 | R218: 3.51年 | S218: 1.51年 | T218: 2.22 | U218: 11 | V218: 4.2000000000000003e-002 | W218: 3.9e-002 | X218: 4.4000000000000004e-002 | Y218: 57 | Z218: 3.84 | AA218: -1.4499999999999999e-002 | AB218: -2.0799999999999999e-002 | AC218: -8.0199999999999994e-002 | AD218: -8.3100000000000007e-002 | AE218: 92.54 | AF218: 90.34 | AG218: 0.76 | AH218: AA- | AI218: 6.54e-002 | AJ218: =H218+100*O218 -> 123.3 | AK218: 123.9 | AL218: 51 | AM218: 31.4 | AN218: 51 | AO218: -1.e-002 | AP218: 29 | AQ218: 华通转债!
A219: 191 | B219: 128075 | C219: 远东转债! | D219: 2406 | E219: 远东传动 | F219: 汽车 | G219: 零部件制 | H219: 123.538 | I219: -1.8799999999999997e-002 | J219: 9.7000000000000003e-003 | K219: 6.74 | L219: -1.1699999999999999e-002 | M219: 114.9 | N219: 5.54 | O219: 1.4999999999999999e-002 | P219: 121.66 | Q219: 转股中 | R219: 4.78年 | S219: 2.78年 | T219: 5.53 | U219: 7.1 | V219: 1.e-002 | W219: 0.13200000000000001 | X219: 0.161 | Y219: 42 | Z219: 1.34 | AA219: -1.5300000000000001e-002 | AB219: -2.07e-002 | AC219: -5.9000000000000004e-002 | AD219: -6.0999999999999999e-002 | AE219: 91.07 | AF219: 93.71 | AG219: 0.78 | AH219: AA | AI219: 4.4400000000000002e-002 | AJ219: =H219+100*O219 -> 125.038 | AK219: 125.4 | AL219: 68 | AM219: 31.7 | AN219: 57 | AO219: -7.4999999999999997e-002 | AP219: 16 | AQ219: 远东转债!
A220: 67 | B220: 128121 | C220: 宏川转债 | D220: 2930 | E220: 宏川智慧 | F220: 交通运输 | G220: 物流业 | H220: 123.37 | I220: -9.5999999999999992e-003 | J220: -1.49e-002 | K220: 20.87 | L220: -3.2000000000000001e-002 | M220: 113.3 | N220: 20.25 | O220: 0.19699999999999998 | P220: 103.06 | Q220: 45天 | R220: 5.60年 | S220: 3.60年 | T220: 6.7 | U220: 5 | V220: 6.0000000000000001e-003 | W220: 7.2000000000000008e-002 | X220: 7.4999999999999997e-002 | Y220: 93 | Z220: 4.82 | AA220: -1.54e-002 | AB220: -1.9599999999999999e-002 | AC220: -4.53e-002 | AD220: -4.7e-002 | AE220: 81.52 | AF220: 79.4 | AG220: 0.77 | AH220: AA- | AI220: 6.7000000000000004e-002 | AJ220: =H220+100*O220 -> 143.06999999999999 | AK220: 143.7 | AL220: 230 | AM220: 62.2 | AN220: 258 | AO220: -2.7999999999999997e-002 | AP220: 4 | AQ220: 宏川转债
A221: 178 | B221: 110061 | C221: 川投转债 | D221: 600674 | E221: 川投能源 | F221: 能源电力 | G221: 水电 | H221: 119.5 | I221: -5.6999999999999993e-003 | J221: 9.5999999999999992e-003 | K221: 9.95 | L221: 6.0999999999999995e-003 | M221: 110.8 | N221: 9.58 | O221: 0.151 | P221: 103.86 | Q221: 转股中 | R221: 4.92年 | S221: 2.92年 | T221: 40 | U221: 1.1 | V221: 0. | W221: 9.0999999999999998e-002 | X221: 9.5000000000000001e-002 | Y221: 438 | Z221: 1.58 | AA221: -1.55e-002 | AB221: -1.95e-002 | AC221: -4.6500000000000007e-002 | AD221: -4.8399999999999999e-002 | AE221: 91.78 | AF221: 91.94 | AG221: 0.66 | AH221: AAA | AI221: 3.9399999999999998e-002 | AJ221: =H221+100*O221 -> 134.59999999999999 | AK221: 135.1 | AL221: 171 | AM221: 43.2 | AN221: 166 | AO221: -3.3000000000000002e-002 | AP221: 15 | AQ221: 川投转债
A222: 19 | B222: 123070 | C222: 鹏辉转债 | D222: 300438 | E222: 鹏辉能源 | F222: 汽车 | G222: 零部件制 | H222: 126.14 | I222: 2.5000000000000001e-003 | J222: 2.6800000000000001e-002 | K222: 24.5 | L222: 3.6400000000000002e-002 | M222: 115.1 | N222: 20.16 | O222: 3.7999999999999999e-002 | P222: 121.53 | Q222: 4月16天 | R222: 5.86年 | S222: 3.86年 | T222: 8.9 | U222: 88 | V222: 7.9000000000000001e-002 | W222: 8.6999999999999994e-002 | X222: 0.105 | Y222: 103 | Z222: 4.16 | AA222: -1.5800000000000002e-002 | AB222: -2.0199999999999999e-002 | AC222: -4.8099999999999997e-002 | AD222: -4.9699999999999994e-002 | AE222: 86.57 | AF222: 88.85 | AG222: 0.81 | AH222: AA | AI222: 4.5999999999999999e-002 | AJ222: =H222+100*O222 -> 129.94 | AK222: 130.8 | AL222: 132 | AM222: 41.9 | AN222: 152 | AO222: 0.11199999999999999 | AP222: 4 | AQ222: 鹏辉转债
A223: 317 | B223: 110031 | C223: 航信转债!! | D223: 600271 | E223: 航天信息 | F223: 计算机及 | G223: 软件开发 | H223: 107.89 | I223: 0. | J223: 0. | K223: 12.09 | L223: -7.85e-002 | M223: 107 | N223: 21.56 | O223: 0.92400000000000004 | P223: 56.08 | Q223: 转股中 | R223: 0.50年 | S223: 回售中 | T223: 24 | U223: 7.5 | V223: 3.0000000000000001e-003 | W223: 0.107 | X223: 5.9999999999999998e-002 | Y223: 225 | Z223: 1.95 | AA223: -1.6399999999999998e-002 | AB223: -4.1900000000000007e-002 | AC223: 回售中 | AD223: 回售中 | AE223: 100.27 | AF223: 105.1 | AG223: 0 | AH223: AAA | AI223: 3.6299999999999999e-002 | AJ223: =H223+100*O223 -> 200.29000000000002 | AK223: 159.7 | AL223: 278 | AM223: 54.6 | AN223: 230 | AO223: -0.129 | AP223: 15 | AQ223: 航信转债!!
A224: 215 | B224: 113025 | C224: 明泰转债! | D224: 601677 | E224: 明泰铝业 | F224: 有色金属 | G224: 铝金属 | H224: 123.93 | I224: -2.0000000000000001e-004 | J224: 5.8999999999999999e-003 | K224: 13.2 | L224: 7.6e-003 | M224: 115.1 | N224: 11.2 | O224: 5.2000000000000005e-002 | P224: 117.86 | Q224: 转股中 | R224: 4.33年 | S224: 2.33年 | T224: 13.6 | U224: 18 | V224: 1.1000000000000001e-002 | W224: 0.16699999999999998 | X224: 0.19600000000000001 | Y224: 81 | Z224: 1.08 | AA224: -1.7299999999999999e-002 | AB224: -2.3300000000000001e-002 | AC224: -7.0599999999999996e-002 | AD224: -7.2900000000000006e-002 | AE224: 92.92 | AF224: 95.75 | AG224: 0.76 | AH224: AA | AI224: 4.4400000000000002e-002 | AJ224: =H224+100*O224 -> 129.13 | AK224: 130 | AL224: 121 | AM224: 34.2 | AN224: 82 | AO224: -3.7999999999999999e-002 | AP224: 31 | AQ224: 明泰转债!
A225: 60 | B225: 123061 | C225: 航新转债 | D225: 300424 | E225: 航新科技 | F225: 航空航天 | G225: 航空航天 | H225: 137.4 | I225: -2.8999999999999998e-002 | J225: 1.01e-002 | K225: 18.45 | L225: -2.2799999999999997e-002 | M225: 124.8 | N225: 14.86 | O225: 0.107 | P225: 124.16 | Q225: 48天 | R225: 5.61年 | S225: 3.61年 | T225: 2.5 | U225: 495 | V225: 1.3999999999999999 | W225: 5.5999999999999994e-002 | X225: 7.0000000000000007e-002 | Y225: 44 | Z225: 4.05 | AA225: -1.7399999999999999e-002 | AB225: -2.4500000000000001e-002 | AC225: -7.0099999999999996e-002 | AD225: -7.22e-002 | AE225: 82.22 | AF225: 87.48 | AG225: 0.83 | AH225: AA- | AI225: 6.7000000000000004e-002 | AJ225: =H225+100*O225 -> 148.09999999999999 | AK225: 150.6 | AL225: 260 | AM225: 63.2 | AN225: 260 | AO225: -8.6999999999999994e-002 | AP225: 11 | AQ225: 航新转债
A226: 132 | B226: 123045 | C226: 雷迪转债 | D226: 300652 | E226: 雷迪克 | F226: 汽车 | G226: 零部件制 | H226: 131 | I226: -5.0700000000000002e-002 | J226: 5.8899999999999994e-002 | K226: 23.15 | L226: 1.e-002 | M226: 119.4 | N226: 20.13 | O226: 0.13900000000000001 | P226: 115 | Q226: 转股中 | R226: 5.25年 | S226: 3.25年 | T226: 1.66 | U226: 675 | V226: 3. | W226: 7.5999999999999998e-002 | X226: 8.8000000000000009e-002 | Y226: 22 | Z226: 2.55 | AA226: -1.7899999999999999e-002 | AB226: -2.41e-002 | AC226: -6.4600000000000005e-002 | AD226: -6.6799999999999998e-002 | AE226: 81.19 | AF226: 81.32 | AG226: 0.82 | AH226: A+ | AI226: 7.8e-002 | AJ226: =H226+100*O226 -> 144.90000000000001 | AK226: 147 | AL226: 243 | AM226: 65.7 | AN226: 267 | AO226: -5.2000000000000005e-002 | AP226: 36 | AQ226: 雷迪转债
A227: 186 | B227: 128079 | C227: 英联转债! | D227: 2846 | E227: 英联股份 | F227: 造纸包装 | G227: 包装材料 | H227: 128.35 | I227: -4.9500000000000002e-002 | J227: 2.98e-002 | K227: 14.2 | L227: -2.3399999999999997e-002 | M227: 117.5 | N227: 13.41 | O227: 0.21199999999999999 | P227: 105.89 | Q227: 转股中 | R227: 4.86年 | S227: 2.86年 | T227: 1.53 | U227: 111 | V227: 0.55399999999999994 | W227: 5.4000000000000006e-002 | X227: 5.7000000000000002e-002 | Y227: 28 | Z227: 3.69 | AA227: -1.83e-002 | AB227: -2.4500000000000001e-002 | AC227: -6.8699999999999997e-002 | AD227: -7.0800000000000002e-002 | AE227: 83.13 | AF227: 82.76 | AG227: 0.84 | AH227: A+ | AI227: 7.6399999999999996e-002 | AJ227: =H227+100*O227 -> 149.54999999999998 | AK227: 150.8 | AL227: 261 | AM227: 67.7 | AN227: 276 | AO227: -5.0999999999999997e-002 | AP227: 19 | AQ227: 英联转债!
A228: 115 | B228: 128106 | C228: 华统转债 | D228: 2840 | E228: 华统股份 | F228: 农业 | G228: 农产品加 | H228: 124.721 | I228: -9.3999999999999986e-003 | J228: -4.5999999999999999e-003 | K228: 11.22 | L228: -1.7500000000000002e-002 | M228: 113.2 | N228: 9.39 | O228: 4.4000000000000004e-002 | P228: 119.49 | Q228: 转股中 | R228: 5.33年 | S228: 3.33年 | T228: 5.37 | U228: 3.9 | V228: 6.0000000000000001e-003 | W228: 0.107 | X228: 0.128 | Y228: 50 | Z228: 3 | AA228: -1.84e-002 | AB228: -2.2700000000000001e-002 | AC228: -5.1900000000000002e-002 | AD228: -5.3699999999999998e-002 | AE228: 88.75 | AF228: 89.51 | AG228: 0.8 | AH228: AA | AI228: 4.5999999999999999e-002 | AJ228: =H228+100*O228 -> 129.12100000000001 | AK228: 130 | AL228: 119 | AM228: 40.4 | AN228: 137 | AO228: -4.0999999999999995e-002 | AP228: 8 | AQ228: 华统转债
A229: 271 | B229: 128039 | C229: 三力转债! | D229: 2224 | E229: 三 力 士 | F229: 机械装备 | G229: 专用设备 | H229: 117.138 | I229: -2.63e-002 | J229: 1.03e-002 | K229: 6.12 | L229: -2.2400000000000003e-002 | M229: 109.8 | N229: 5.81 | O229: 0.11199999999999999 | P229: 105.34 | Q229: 转股中 | R229: 3.49年 | S229: 1.49年 | T229: 2.03 | U229: 47 | V229: 0.19699999999999998 | W229: 4.4999999999999998e-002 | X229: 4.8000000000000001e-002 | Y229: 45 | Z229: 1.91 | AA229: -1.8700000000000001e-002 | AB229: -2.3700000000000002e-002 | AC229: -7.7699999999999991e-002 | AD229: -8.0399999999999985e-002 | AE229: 92.41 | AF229: 88.39 | AG229: 0.72 | AH229: AA- | AI229: 6.54e-002 | AJ229: =H229+100*O229 -> 128.33799999999999 | AK229: 128.9 | AL229: 111 | AM229: 36.5 | AN229: 104 | AO229: -3.2000000000000001e-002 | AP229: 23 | AQ229: 三力转债!
A230: 253 | B230: 128048 | C230: 张行转债 | D230: 2839 | E230: 张家港行 | F230: 金融 | G230: 银行行业 | H230: 121.9 | I230: -1.5e-003 | J230: -1.0500000000000001e-002 | K230: 6.11 | L230: -1.9299999999999998e-002 | M230: 113.3 | N230: 5.76 | O230: 0.14899999999999999 | P230: 106.08 | Q230: 转股中 | R230: 3.92年 | S230: 无权 | T230: 25 | U230: 23 | V230: 6.9999999999999993e-003 | W230: 0.22600000000000001 | X230: 0.23999999999999999 | Y230: 110 | Z230: 1.05 | AA230: -1.8799999999999997e-002 | AB230: -2.4700000000000003e-002 | AC230: 无权 | AD230: 无权 | AE230: 无权 | AF230: 96.55 | AG230: 0.62 | AH230: AA+ | AI230: 4.24e-002 | AJ230: =H230+100*O230 -> 136.80000000000001 | AK230: 137.7 | AL230: 191 | AM230: 41.2 | AN230: 145 | AO230: -2.1000000000000001e-002 | AP230: 14 | AQ230: 张行转债
A231: 155 | B231: 113562 | C231: 璞泰转债!! | D231: 603659 | E231: 璞泰来 | F231: 电子 | G231: 元器件制 | H231: 122.68 | I231: -1.8600000000000002e-002 | J231: -3.8e-003 | K231: 97.83 | L231: -2.2400000000000003e-002 | M231: 113.3 | N231: 83.54 | O231: 4.8000000000000001e-002 | P231: 117.11 | Q231: 转股中 | R231: 4年22天 | S231: 2年22天 | T231: 5.07 | U231: 45 | V231: 7.2000000000000008e-002 | W231: 1.1000000000000001e-002 | X231: 1.2e-002 | Y231: 479 | Z231: 11.69 | AA231: -1.9599999999999999e-002 | AB231: -2.5399999999999999e-002 | AC231: -7.980000000000001e-002 | AD231: -8.14e-002 | AE231: 92.7 | AF231: 95.21 | AG231: 1 | AH231: AA | AI231: 4.4400000000000002e-002 | AJ231: =H231+100*O231 -> 127.48 | AK231: 128.3 | AL231: 100 | AM231: 33 | AN231: 66 | AO231: -6.2e-002 | AP231: 16 | AQ231: 璞泰转债!!
A232: 24 | B232: 110075 | C232: 南航转债 | D232: 600029 | E232: 南方航空 | F232: 交通运输 | G232: 航空运输 | H232: 123.37 | I232: -1.7000000000000001e-003 | J232: 2.7000000000000001e-003 | K232: 6.09 | L232: 1.6000000000000001e-003 | M232: 110 | N232: 6.24 | O232: 0.26400000000000001 | P232: 97.6 | Q232: 4月11天 | R232: 5.84年 | S232: 3.84年 | T232: 160 | U232: 64 | V232: 3.0000000000000001e-003 | W232: 0.17100000000000001 | X232: 0.16699999999999998 | Y232: 934 | Z232: 1.29 | AA232: -1.9599999999999999e-002 | AB232: -2.2700000000000001e-002 | AC232: -4.5999999999999999e-002 | AD232: -4.7e-002 | AE232: 87.11 | AF232: 87.22 | AG232: 0.62 | AH232: AAA | AI232: 4.0999999999999995e-002 | AJ232: =H232+100*O232 -> 149.77000000000001 | AK232: 149.1 | AL232: 256 | AM232: 61.9 | AN232: 257 | AO232: -2.8999999999999998e-002 | AP232: 7 | AQ232: 南航转债
A233: 157 | B233: 128091 | C233: 新天转债 | D233: 2873 | E233: 新天药业 | F233: 医药 | G233: 中药 | H233: 132.403 | I233: -3.1400000000000004e-002 | J233: 2.35e-002 | K233: 17.21 | L233: -1.04e-002 | M233: 120 | N233: 16.39 | O233: 0.26100000000000001 | P233: 105 | Q233: 转股中 | R233: 5年19天 | S233: 3年19天 | T233: 1.76 | U233: 80 | V233: 0.33700000000000002 | W233: 8.6999999999999994e-002 | X233: 9.1999999999999998e-002 | Y233: 20 | Z233: 2.67 | AA233: -1.9799999999999998e-002 | AB233: -2.64e-002 | AC233: -7.0300000000000001e-002 | AD233: -7.2999999999999995e-002 | AE233: 82.87 | AF233: 83.05 | AG233: 0.77 | AH233: A+ | AI233: 7.8e-002 | AJ233: =H233+100*O233 -> 158.50299999999999 | AK233: 159.8 | AL233: 279 | AM233: 76.8 | AN233: 286 | AO233: -4.5999999999999999e-002 | AP233: 16 | AQ233: 新天转债
A234: 160 | B234: 123038 | C234: 联得转债! | D234: 300545 | E234: 联得装备 | F234: 机械装备 | G234: 专用设备 | H234: 131.487 | I234: -2.6000000000000002e-002 | J234: 1.7600000000000001e-002 | K234: 28.85 | L234: -1.03e-002 | M234: 119.1 | N234: 25.29 | O234: 0.153 | P234: 114.08 | Q234: 转股中 | R234: 5年14天 | S234: 3年14天 | T234: 1.47 | U234: 91 | V234: 0.46899999999999997 | W234: 3.5000000000000003e-002 | X234: 4.0000000000000001e-002 | Y234: 42 | Z234: 5.5 | AA234: -1.9900000000000001e-002 | AB234: -2.6200000000000001e-002 | AC234: -7.0499999999999993e-002 | AD234: -7.2700000000000001e-002 | AE234: 82.32 | AF234: 82.38 | AG234: 0.82 | AH234: A+ | AI234: 7.8e-002 | AJ234: =H234+100*O234 -> 146.78700000000001 | AK234: 148.9 | AL234: 252 | AM234: 66.5 | AN234: 272 | AO234: -3.2000000000000001e-002 | AP234: 17 | AQ234: 联得转债!
A235: 153 | B235: 127015 | C235: 希望转债! | D235: 876 | E235: 新 希 望 | F235: 农业 | G235: 畜牧业 | H235: 122.25 | I235: -3.2799999999999996e-002 | J235: -8.0000000000000002e-003 | K235: 23.46 | L235: -4.0899999999999999e-002 | M235: 110.2 | N235: 19.75 | O235: 2.8999999999999998e-002 | P235: 118.78 | Q235: 转股中 | R235: 5年23天 | S235: 3年23天 | T235: 9.52 | U235: 79 | V235: 6.7000000000000004e-002 | W235: 9.0000000000000011e-003 | X235: 1.1000000000000001e-002 | Y235: 1057. | Z235: 2.92 | AA235: -2.06e-002 | AB235: -2.4199999999999999e-002 | AC235: -5.2400000000000002e-002 | AD235: -5.4000000000000006e-002 | AE235: 90.44 | AF235: 90.22 | AG235: 1 | AH235: AAA | AI235: 4.0999999999999995e-002 | AJ235: =H235+100*O235 -> 125.15000000000001 | AK235: 125.7 | AL235: 73 | AM235: 35.3 | AN235: 95 | AO235: -9.5000000000000001e-002 | AP235: 29 | AQ235: 希望转债!
A236: 142 | B236: 110066 | C236: 盛屯转债!! | D236: 600711 | E236: 盛屯矿业 | F236: 有色金属 | G236: 有色行业 | H236: 128.57 | I236: -1.72e-002 | J236: 2.6499999999999999e-002 | K236: 6.09 | L236: 1.1599999999999999e-002 | M236: 115.3 | N236: 4.88 | O236: 2.9999999999999999e-002 | P236: 124.8 | Q236: 转股中 | R236: 5.22年 | S236: 3.22年 | T236: 16.8 | U236: 259 | V236: 0.115 | W236: 0.11900000000000001 | X236: 0.14899999999999999 | Y236: 141 | Z236: 1.53 | AA236: -2.1000000000000001e-002 | AB236: -2.6099999999999998e-002 | AC236: -6.1799999999999994e-002 | AD236: -6.3700000000000007e-002 | AE236: 89.28 | AF236: 91.62 | AG236: 0.8 | AH236: AA | AI236: 4.5999999999999999e-002 | AJ236: =H236+100*O236 -> 131.56999999999999 | AK236: 132.3 | AL236: 147 | AM236: 40.7 | AN236: 139 | AO236: -6.5000000000000002e-002 | AP236: 41 | AQ236: 盛屯转债!!
A237: 297 | B237: 123002 | C237: 国祯转债!! | D237: 300388 | E237: 国祯环保 | F237: 城市公用 | G237: 三废处理 | H237: 115.9 | I237: -1.47e-002 | J237: 1.9799999999999998e-002 | K237: 9.18 | L237: 5.5000000000000005e-003 | M237: 108.8 | N237: 8.48 | O237: 7.0999999999999994e-002 | P237: 108.25 | Q237: 转股中 | R237: 2.95年 | S237: 0.95年 | T237: 2.52 | U237: 17 | V237: 5.9000000000000004e-002 | W237: 3.9e-002 | X237: 4.2999999999999997e-002 | Y237: 64 | Z237: 1.69 | AA237: -2.1400000000000002e-002 | AB237: -2.6800000000000001e-002 | AC237: -0.109 | AD237: -0.111 | AE237: 96.88 | AF237: 96.24 | AG237: 0.93 | AH237: AA | AI237: 4.2999999999999997e-002 | AJ237: =H237+100*O237 -> 123. | AK237: 123.5 | AL237: 43 | AM237: 26.7 | AN237: 21 | AO237: -4.2999999999999997e-002 | AP237: 13 | AQ237: 国祯转债!!
A238: 12 | B238: 123074 | C238: 隆利转债 | D238: 300752 | E238: 隆利科技 | F238: 电子 | G238: 液晶显示 | H238: 141.58 | I238: 6.3799999999999996e-002 | J238: 0.124 | K238: 50.77 | L238: 0.20000000000000001 | M238: 124 | N238: 29.53 | O238: -0.17699999999999999 | P238: 171.93 | Q238: 4月24天 | R238: 5.88年 | S238: 3.88年 | T238: 3.25 | U238: 5555. | V238: 11.859999999999999 | W238: 5.2999999999999999e-002 | X238: 9.1999999999999998e-002 | Y238: 61 | Z238: 7.02 | AA238: -2.2700000000000001e-002 | AB238: -2.92e-002 | AC238: -7.4099999999999999e-002 | AD238: -7.5700000000000003e-002 | AE238: 80.12 | AF238: 85.29 | AG238: 0.94 | AH238: AA- | AI238: 6.7000000000000004e-002 | AJ238: =H238+100*O238 -> 123.88000000000001 | AK238: 111.2 | AL238: 3 | AM238: 25.9 | AN238: 16 | AO238: 0.53200000000000003 | AP238: 7 | AQ238: 隆利转债
A239: 281 | B239: 110043 | C239: 无锡转债! | D239: 600908 | E239: 无锡银行 | F239: 金融 | G239: 银行行业 | H239: 117.16 | I239: -5.3e-003 | J239: 4.0000000000000002e-004 | K239: 5.84 | L239: -8.5000000000000006e-003 | M239: 109.1 | N239: 5.79 | O239: 0.16200000000000001 | P239: 100.86 | Q239: 转股中 | R239: 3年50天 | S239: 无权 | T239: 30 | U239: 12 | V239: 4.0000000000000001e-003 | W239: 0.27800000000000002 | X239: 0.28000000000000003 | Y239: 108 | Z239: 0.94 | AA239: -2.2799999999999997e-002 | AB239: -2.81e-002 | AC239: 无权 | AD239: 无权 | AE239: 无权 | AF239: 95.99 | AG239: 0.57 | AH239: AA+ | AI239: 4.24e-002 | AJ239: =H239+100*O239 -> 133.35999999999999 | AK239: 133.5 | AL239: 158 | AM239: 37.5 | AN239: 114 | AO239: -5.0000000000000001e-003 | AP239: 30 | AQ239: 无锡转债!
A240: 123 | B240: 110069 | C240: 瀚蓝转债 | D240: 600323 | E240: 瀚蓝环境 | F240: 城市公用 | G240: 三废处理 | H240: 128.6 | I240: 2.2000000000000001e-003 | J240: -2.2099999999999998e-002 | K240: 22.6 | L240: -2.7099999999999999e-002 | M240: 113.5 | N240: 20.2 | O240: 0.14899999999999999 | P240: 111.88 | Q240: 转股中 | R240: 5.32年 | S240: 3.32年 | T240: 9.83 | U240: 2.7 | V240: 2.e-003 | W240: 5.7000000000000002e-002 | X240: 6.4000000000000001e-002 | Y240: 173 | Z240: 2.42 | AA240: -2.35e-002 | AB240: -2.7900000000000001e-002 | AC240: -6.4000000000000001e-002 | AD240: -6.5099999999999991e-002 | AE240: 88.07 | AF240: 90.52 | AG240: 0.73 | AH240: AA+ | AI240: 4.4000000000000004e-002 | AJ240: =H240+100*O240 -> 143.5 | AK240: 145.3 | AL240: 237 | AM240: 54.8 | AN240: 232 | AO240: -7.2000000000000008e-002 | AP240: 7 | AQ240: 瀚蓝转债
A241: 187 | B241: 128078 | C241: 太极转债! | D241: 2368 | E241: 太极股份 | F241: 计算机及 | G241: 软件开发 | H241: 131.006 | I241: -4.5999999999999999e-003 | J241: 7.000000000000001e-004 | K241: 28.1 | L241: -3.9000000000000003e-003 | M241: 116.9 | N241: 22.4 | O241: 4.4000000000000004e-002 | P241: 125.45 | Q241: 转股中 | R241: 4.86年 | S241: 2.86年 | T241: 9.6 | U241: 3 | V241: 2.e-003 | W241: 5.9000000000000004e-002 | X241: 7.400000000000001e-002 | Y241: 163 | Z241: 5.3 | AA241: -2.3599999999999999e-002 | AB241: -2.9399999999999999e-002 | AC241: -7.5800000000000006e-002 | AD241: -7.7699999999999991e-002 | AE241: 90.77 | AF241: 95.02 | AG241: 1 | AH241: AA | AI241: 4.4400000000000002e-002 | AJ241: =H241+100*O241 -> 135.40600000000001 | AK241: 136.6 | AL241: 183 | AM241: 41.5 | AN241: 149 | AO241: 2.3e-002 | AP241: 12 | AQ241: 太极转债!
A242: 162 | B242: 110065 | C242: 淮矿转债! | D242: 600985 | E242: 淮北矿业 | F242: 煤炭 | G242: 煤炭开采 | H242: 125 | I242: -5.1999999999999998e-003 | J242: -1.9599999999999999e-002 | K242: 11.33 | L242: -3.0800000000000001e-002 | M242: 111 | N242: 9.33 | O242: 2.8999999999999998e-002 | P242: 121.44 | Q242: 转股中 | R242: 5年12天 | S242: 3年12天 | T242: 27.6 | U242: 116 | V242: 3.3000000000000002e-002 | W242: 0.11199999999999999 | X242: 0.13600000000000001 | Y242: 246 | Z242: 1.19 | AA242: -2.3799999999999998e-002 | AB242: -2.76e-002 | AC242: -5.7800000000000004e-002 | AD242: -5.9699999999999996e-002 | AE242: 91.13 | AF242: 91.04 | AG242: 0.81 | AH242: AAA | AI242: 4.0999999999999995e-002 | AJ242: =H242+100*O242 -> 127.90000000000001 | AK242: 128.6 | AL242: 103 | AM242: 37.4 | AN242: 113 | AO242: -2.e-003 | AP242: 21 | AQ242: 淮矿转债!
A243: 147 | B243: 128097 | C243: 奥佳转债! | D243: 2614 | E243: 奥佳华 | F243: 机械装备 | G243: 专用设备 | H243: 130.6 | I243: -1.8100000000000002e-002 | J243: -1.21e-002 | K243: 12.76 | L243: -3.9199999999999999e-002 | M243: 115.3 | N243: 10.69 | O243: 9.4e-002 | P243: 119.36 | Q243: 转股中 | R243: 5.21年 | S243: 3.21年 | T243: 5.85 | U243: 14 | V243: 1.8000000000000002e-002 | W243: 7.400000000000001e-002 | X243: 8.8000000000000009e-002 | Y243: 79 | Z243: 1.86 | AA243: -2.41e-002 | AB243: -2.9100000000000001e-002 | AC243: -6.6500000000000004e-002 | AD243: -6.8400000000000002e-002 | AE243: 89.34 | AF243: 91.68 | AG243: 0.77 | AH243: AA | AI243: 4.5999999999999999e-002 | AJ243: =H243+100*O243 -> 140. | AK243: 141.8 | AL243: 220 | AM243: 50.2 | AN243: 203 | AO243: -0.11 | AP243: 25 | AQ243: 奥佳转债!
A244: 89 | B244: 113587 | C244: 泛微转债 | D244: 603039 | E244: 泛微网络 | F244: 计算机及 | G244: 软件开发 | H244: 142.74 | I244: 3.4000000000000002e-003 | J244: 1.5e-003 | K244: 94.55 | L244: 5.5000000000000005e-003 | M244: 124.3 | N244: 64.33 | O244: -2.8999999999999998e-002 | P244: 146.98 | Q244: 10天 | R244: 5.51年 | S244: 3.51年 | T244: 3.16 | U244: 9.6 | V244: 2.2000000000000002e-002 | W244: 1.6e-002 | X244: 2.3e-002 | Y244: 201 | Z244: 20.82 | AA244: -2.53e-002 | AB244: -3.2300000000000002e-002 | AC244: -8.2799999999999999e-002 | AD244: -8.4700000000000011e-002 | AE244: 82.36 | AF244: 87.65 | AG244: 0.9 | AH244: AA- | AI244: 6.7000000000000004e-002 | AJ244: =H244+100*O244 -> 139.84 | AK244: 138.5 | AL244: 197 | AM244: 50.9 | AN244: 207 | AO244: -3.2000000000000001e-002 | AP244: 6 | AQ244: 泛微转债
A245: 158 | B245: 128090 | C245: 汽模转2 | D245: 2510 | E245: 天汽模 | F245: 汽车 | G245: 零部件制 | H245: 130.94 | I245: -1.0800000000000001e-002 | J245: 3.7200000000000004e-002 | K245: 5.27 | L245: 3.3300000000000003e-002 | M245: 115.2 | N245: 4.21 | O245: 4.5999999999999999e-002 | P245: 125.18 | Q245: 转股中 | R245: 5年16天 | S245: 3年16天 | T245: 3.11 | U245: 1061. | V245: 2.5600000000000001 | W245: 6.5000000000000002e-002 | X245: 8.1000000000000003e-002 | Y245: 48 | Z245: 1.82 | AA245: -2.5499999999999998e-002 | AB245: -3.0699999999999998e-002 | AC245: -7.0800000000000002e-002 | AD245: -7.2700000000000001e-002 | AE245: 89.91 | AF245: 92.26 | AG245: 0.79 | AH245: AA | AI245: 4.5999999999999999e-002 | AJ245: =H245+100*O245 -> 135.53999999999999 | AK245: 136.7 | AL245: 185 | AM245: 44.4 | AN245: 172 | AO245: 6.0999999999999999e-002 | AP245: 26 | AQ245: 汽模转2
A246: 247 | B246: 128050 | C246: 钧达转债! | D246: 2865 | E246: 钧达股份 | F246: 汽车 | G246: 零部件制 | H246: 136.32 | I246: 1.2800000000000001e-002 | J246: 1.8200000000000001e-002 | K246: 19.94 | L246: 3.6900000000000002e-002 | M246: 122.7 | N246: 14.85 | O246: 1.4999999999999999e-002 | P246: 134.28 | Q246: 转股中 | R246: 3.997年 | S246: 1.997年 | T246: 2.02 | U246: 809 | V246: 2.8500000000000001 | W246: 8.4000000000000005e-002 | X246: 0.113 | Y246: 24 | Z246: 2.79 | AA246: -2.64e-002 | AB246: -3.56e-002 | AC246: -0.122 | AD246: -0.124 | AE246: 89.93 | AF246: 95.69 | AG246: 0.84 | AH246: AA- | AI246: 6.54e-002 | AJ246: =H246+100*O246 -> 137.81999999999999 | AK246: 138.4 | AL246: 195 | AM246: 42.7 | AN246: 158 | AO246: 6.9000000000000006e-002 | AP246: 61 | AQ246: 钧达转债!
A247: 116 | B247: 123048 | C247: 应急转债! | D247: 300527 | E247: 中船应急 | F247: 机械装备 | G247: 专用设备 | H247: 131.098 | I247: -1.3100000000000001e-002 | J247: 1.61e-002 | K247: 10.73 | L247: 3.7000000000000002e-003 | M247: 113.1 | N247: 8.9 | O247: 8.6999999999999994e-002 | P247: 120.56 | Q247: 转股中 | R247: 5.33年 | S247: 3.33年 | T247: 3.8 | U247: 465 | V247: 0.91200000000000003 | W247: 3.9e-002 | X247: 4.7e-002 | Y247: 98 | Z247: 4.15 | AA247: -2.7799999999999998e-002 | AB247: -3.2000000000000001e-002 | AC247: -6.5599999999999992e-002 | AD247: -6.7400000000000002e-002 | AE247: 89.25 | AF247: 90.31 | AG247: 0.79 | AH247: AA+ | AI247: 4.4000000000000004e-002 | AJ247: =H247+100*O247 -> 139.798 | AK247: 141.6 | AL247: 219 | AM247: 51.3 | AN247: 212 | AO247: -4.2000000000000003e-002 | AP247: 16 | AQ247: 应急转债!
A248: 143 | B248: 113032 | C248: 桐20转债!! | D248: 601233 | E248: 桐昆股份 | F248: 服装纺织 | G248: 纺织行业 | H248: 130.77 | I248: -1.2199999999999999e-002 | J248: 5.8999999999999999e-003 | K248: 18.88 | L248: -6.3e-003 | M248: 113.1 | N248: 14.35 | O248: -6.0000000000000001e-003 | P248: 131.57 | Q248: 转股中 | R248: 5.22年 | S248: 3.22年 | T248: 18.3 | U248: 207 | V248: 8.5000000000000006e-002 | W248: 4.4999999999999998e-002 | X248: 5.9999999999999998e-002 | Y248: 403 | Z248: 1.77 | AA248: -2.7900000000000001e-002 | AB248: -3.2199999999999999e-002 | AC248: -6.7000000000000004e-002 | AD248: -6.88e-002 | AE248: 89.66 | AF248: 90.73 | AG248: 1 | AH248: AA+ | AI248: 4.4000000000000004e-002 | AJ248: =H248+100*O248 -> 130.17000000000002 | AK248: 130 | AL248: 120 | AM248: 39.2 | AN248: 131 | AO248: -6.8000000000000005e-002 | AP248: 19 | AQ248: 桐20转债!!
A249: 21 | B249: 127022 | C249: 恒逸转债 | D249: 703 | E249: 恒逸石化 | F249: 化工 | G249: 化工 | H249: 128.511 | I249: 0. | J249: 6.7000000000000002e-003 | K249: 12.53 | L249: 8.8999999999999999e-003 | M249: 108.9 | N249: 11.5 | O249: 0.17899999999999999 | P249: 108.96 | Q249: 4月12天 | R249: 5.85年 | S249: 3.85年 | T249: 20 | U249: 37 | V249: 1.3999999999999999e-002 | W249: 4.2999999999999997e-002 | X249: 4.7e-002 | Y249: 461 | Z249: 1.84 | AA249: -2.8300000000000002e-002 | AB249: -3.1e-002 | AC249: -5.4699999999999999e-002 | AD249: -5.5899999999999998e-002 | AE249: 86.44 | AF249: 84.95 | AG249: 0.76 | AH249: AA+ | AI249: 4.4000000000000004e-002 | AJ249: =H249+100*O249 -> 146.411 | AK249: 148.1 | AL249: 248 | AM249: 61.6 | AN249: 254 | AO249: -5.0999999999999997e-002 | AP249: 4 | AQ249: 恒逸转债
A250: 296 | B250: 128021 | C250: 兄弟转债!! | D250: 2562 | E250: 兄弟科技 | F250: 医药 | G250: 原料药 | H250: 118.4 | I250: -2.06e-002 | J250: -4.0000000000000002e-004 | K250: 5.72 | L250: -2.2200000000000001e-002 | M250: 108.8 | N250: 5.25 | O250: 8.6999999999999994e-002 | P250: 108.95 | Q250: 转股中 | R250: 2.96年 | S250: 0.96年 | T250: 2.66 | U250: 8.4 | V250: 2.7000000000000003e-002 | W250: 4.9000000000000002e-002 | X250: 5.2999999999999999e-002 | Y250: 54 | Z250: 2.23 | AA250: -2.8500000000000001e-002 | AB250: -3.3799999999999997e-002 | AC250: -0.124 | AD250: -0.126 | AE250: 96.84 | AF250: 96.19 | AG250: 0.94 | AH250: AA | AI250: 4.2999999999999997e-002 | AJ250: =H250+100*O250 -> 127.10000000000001 | AK250: 127.8 | AL250: 97 | AM250: 31 | AN250: 46 | AO250: -2.8999999999999998e-002 | AP250: 13 | AQ250: 兄弟转债!!
A251: 71 | B251: 128119 | C251: 龙大转债 | D251: 2726 | E251: 龙大肉食 | F251: 食品饮料 | G251: 肉制品 | H251: 141.407 | I251: -1.4000000000000002e-003 | J251: 1.49e-002 | K251: 13.88 | L251: 1.54e-002 | M251: 120.2 | N251: 9.56 | O251: -2.6000000000000002e-002 | P251: 145.19 | Q251: 37天 | R251: 5.59年 | S251: 3.59年 | T251: 9.5 | U251: 24 | V251: 1.8000000000000002e-002 | W251: 6.9000000000000006e-002 | X251: 0.10000000000000001 | Y251: 139 | Z251: 4.49 | AA251: -2.9100000000000001e-002 | AB251: -3.5000000000000003e-002 | AC251: -7.9899999999999999e-002 | AD251: -8.1600000000000006e-002 | AE251: 87.73 | AF251: 93.92 | AG251: 0.88 | AH251: AA | AI251: 4.5999999999999999e-002 | AJ251: =H251+100*O251 -> 138.80700000000002 | AK251: 137.6 | AL251: 189 | AM251: 43.7 | AN251: 168 | AO251: 6.7000000000000004e-002 | AP251: 6 | AQ251: 龙大转债
A252: 102 | B252: 113583 | C252: 益丰转债 | D252: 603939 | E252: 益丰药房 | F252: 医药 | G252: 医药商业 | H252: 135.28 | I252: -1.1299999999999999e-002 | J252: -1.9299999999999998e-002 | K252: 93 | L252: -3.6299999999999999e-002 | M252: 115.3 | N252: 71.82 | O252: 4.4999999999999998e-002 | P252: 129.49 | Q252: 转股中 | R252: 5.47年 | S252: 3.47年 | T252: 15.5 | U252: 39 | V252: 1.9e-002 | W252: 3.1e-002 | X252: 4.0999999999999995e-002 | Y252: 494 | Z252: 9.81 | AA252: -2.9300000000000003e-002 | AB252: -3.4000000000000002e-002 | AC252: -7.0800000000000002e-002 | AD252: -7.2599999999999998e-002 | AE252: 88.28 | AF252: 90.6 | AG252: 0.84 | AH252: AA | AI252: 4.5999999999999999e-002 | AJ252: =H252+100*O252 -> 139.78 | AK252: 141.1 | AL252: 213 | AM252: 50.5 | AN252: 205 | AO252: -7.400000000000001e-002 | AP252: 9 | AQ252: 益丰转债
A253: 120 | B253: 113575 | C253: 东时转债! | D253: 603377 | E253: 东方时尚 | F253: 其他 | G253: 其他 | H253: 132.95 | I253: -1.2199999999999999e-002 | J253: 4.1999999999999997e-003 | K253: 19.4 | L253: -9.1999999999999998e-003 | M253: 113.5 | N253: 14.56 | O253: -2.e-003 | P253: 133.24 | Q253: 转股中 | R253: 5.33年 | S253: 3.33年 | T253: 1.28 | U253: 14 | V253: 8.1000000000000003e-002 | W253: 1.1000000000000001e-002 | X253: 1.4999999999999999e-002 | Y253: 114 | Z253: 6.07 | AA253: -2.98e-002 | AB253: -3.4200000000000001e-002 | AC253: -6.9000000000000006e-002 | AD253: -7.0800000000000002e-002 | AE253: 88.89 | AF253: 89.78 | AG253: 0.87 | AH253: AA | AI253: 4.5999999999999999e-002 | AJ253: =H253+100*O253 -> 132.75 | AK253: 132.7 | AL253: 149 | AM253: 42.9 | AN253: 159 | AO253: -3.9e-002 | AP253: 15 | AQ253: 东时转债!
A254: 189 | B254: 113545 | C254: 金能转债! | D254: 603113 | E254: 金能科技 | F254: 煤炭 | G254: 炼焦 | H254: 133.56 | I254: 9.7999999999999997e-003 | J254: -2.0799999999999999e-002 | K254: 13.9 | L254: -1.3500000000000002e-002 | M254: 114.9 | N254: 10.78 | O254: 3.6000000000000004e-002 | P254: 128.94 | Q254: 转股中 | R254: 4.84年 | S254: 2.84年 | T254: 10.6 | U254: 106 | V254: 7.400000000000001e-002 | W254: 9.5000000000000001e-002 | X254: 0.122 | Y254: 112 | Z254: 1.54 | AA254: -3.1099999999999999e-002 | AB254: -3.6299999999999999e-002 | AC254: -8.2200000000000009e-002 | AD254: -8.4100000000000008e-002 | AE254: 90.84 | AF254: 93.48 | AG254: 0.82 | AH254: AA | AI254: 4.4400000000000002e-002 | AJ254: =H254+100*O254 -> 137.16 | AK254: 138.2 | AL254: 193 | AM254: 44.7 | AN254: 173 | AO254: -6.9000000000000006e-002 | AP254: 20 | AQ254: 金能转债!
A255: 181 | B255: 113548 | C255: 石英转债! | D255: 603688 | E255: 石英股份 | F255: 电子 | G255: 电子产品 | H255: 144.88 | I255: -4.5999999999999999e-003 | J255: 7.9000000000000008e-003 | K255: 20.98 | L255: 3.8e-003 | M255: 124.4 | N255: 15.1 | O255: 4.2999999999999997e-002 | P255: 138.94 | Q255: 转股中 | R255: 4.88年 | S255: 2.88年 | T255: 1.23 | U255: 17 | V255: 9.5000000000000001e-002 | W255: 1.7000000000000001e-002 | X255: 2.3e-002 | Y255: 74 | Z255: 3.93 | AA255: -3.1400000000000004e-002 | AB255: -3.9300000000000002e-002 | AC255: -0.10199999999999999 | AD255: -0.10400000000000001 | AE255: 86.19 | AF255: 91.96 | AG255: 0.87 | AH255: AA- | AI255: 6.54e-002 | AJ255: =H255+100*O255 -> 149.18000000000001 | AK255: 150.8 | AL255: 262 | AM255: 58.9 | AN255: 248 | AO255: 4.0999999999999995e-002 | AP255: 12 | AQ255: 石英转债!
A256: 207 | B256: 123026 | C256: 中环转债! | D256: 300692 | E256: 中环环保 | F256: 城市公用 | G256: 三废处理 | H256: 123.55 | I256: -4.2300000000000004e-002 | J256: 2.0199999999999999e-002 | K256: 15.5 | L256: -2.2099999999999998e-002 | M256: 110.6 | N256: 12.51 | O256: -3.0000000000000001e-003 | P256: 123.9 | Q256: 转股中 | R256: 3.50年 | S256: 1.50年 | T256: 0.59 | U256: 194 | V256: 2.5899999999999999 | W256: 1.7000000000000001e-002 | X256: 2.2000000000000002e-002 | Y256: 34 | Z256: 2.51 | AA256: -3.1800000000000002e-002 | AB256: -3.7100000000000001e-002 | AC256: -0.105 | AD256: -0.10800000000000001 | AE256: 92.56 | AF256: 89.04 | AG256: 1 | AH256: AA- | AI256: 6.54e-002 | AJ256: =H256+100*O256 -> 123.25 | AK256: 123.2 | AL256: 38 | AM256: 30.6 | AN256: 44 | AO256: 5.4000000000000006e-002 | AP256: 28 | AQ256: 中环转债!
A257: 16 | B257: 113040 | C257: 星宇转债 | D257: 601799 | E257: 星宇股份 | F257: 汽车 | G257: 零部件制 | H257: 136.56 | I257: 1.9299999999999998e-002 | J257: -7.7000000000000002e-003 | K257: 190.03 | L257: 1.4499999999999999e-002 | M257: 111.5 | N257: 158 | O257: 0.13500000000000001 | P257: 120.27 | Q257: 4月18天 | R257: 5.86年 | S257: 3.86年 | T257: 15 | U257: 75 | V257: 3.6000000000000004e-002 | W257: 2.8999999999999998e-002 | X257: 3.4000000000000002e-002 | Y257: 525 | Z257: 9.87 | AA257: -3.4300000000000004e-002 | AB257: -3.7699999999999997e-002 | AC257: -6.9599999999999995e-002 | AD257: -7.0499999999999993e-002 | AE257: 86.04 | AF257: 86.88 | AG257: 0.8 | AH257: AA+ | AI257: 4.4000000000000004e-002 | AJ257: =H257+100*O257 -> 150.06 | AK257: 152.8 | AL257: 268 | AM257: 66 | AN257: 269 | AO257: -1.6e-002 | AP257: 3 | AQ257: 星宇转债
A258: 256 | B258: 128046 | C258: 利尔转债! | D258: 2258 | E258: 利尔化学 | F258: 化工 | G258: 农化 | H258: 128.2 | I258: -3.4099999999999998e-002 | J258: 1.03e-002 | K258: 20.77 | L258: -3.3500000000000002e-002 | M258: 112.3 | N258: 18.62 | O258: 0.14899999999999999 | P258: 111.55 | Q258: 转股中 | R258: 3.85年 | S258: 1.85年 | T258: 8.52 | U258: 20 | V258: 1.8000000000000002e-002 | W258: 7.8e-002 | X258: 8.6999999999999994e-002 | Y258: 109 | Z258: 3.05 | AA258: -3.44e-002 | AB258: -3.9900000000000005e-002 | AC258: -0.10400000000000001 | AD258: -0.106 | AE258: 94.24 | AF258: 95.3 | AG258: 0.71 | AH258: AA | AI258: 4.4400000000000002e-002 | AJ258: =H258+100*O258 -> 143.09999999999999 | AK258: 144.9 | AL258: 235 | AM258: 49.6 | AN258: 197 | AO258: -9.8000000000000004e-002 | AP258: 10 | AQ258: 利尔转债!
A259: 140 | B259: 123043 | C259: 正元转债 | D259: 300645 | E259: 正元智慧 | F259: 计算机及 | G259: 软件开发 | H259: 145.299 | I259: -8.3299999999999999e-002 | J259: 8.900000000000001e-002 | K259: 16.56 | L259: 7.3000000000000001e-003 | M259: 121.4 | N259: 15.41 | O259: 0.35200000000000004 | P259: 107.46 | Q259: 转股中 | R259: 5.23年 | S259: 3.23年 | T259: 1.66 | U259: 798 | V259: 3.1699999999999999 | W259: 7.9000000000000001e-002 | X259: 8.5000000000000006e-002 | Y259: 21 | Z259: 3.42 | AA259: -3.4500000000000003e-002 | AB259: -4.1100000000000005e-002 | AC259: -9.3299999999999994e-002 | AD259: -9.5500000000000002e-002 | AE259: 81.31 | AF259: 82.78 | AG259: 0.78 | AH259: A+ | AI259: 7.8e-002 | AJ259: =H259+100*O259 -> 180.49900000000002 | AK259: 183.1 | AL259: 296 | AM259: 100.4 | AN259: 297 | AO259: 3.1e-002 | AP259: 18 | AQ259: 正元转债
A260: 169 | B260: 113029 | C260: 明阳转债!! | D260: 601615 | E260: 明阳智能 | F260: 能源电力 | G260: 风能 | H260: 135.26 | I260: -1.8799999999999997e-002 | J260: -9.7000000000000003e-003 | K260: 17.09 | L260: -3.3399999999999999e-002 | M260: 113.3 | N260: 12.8 | O260: 1.3000000000000001e-002 | P260: 133.52 | Q260: 转股中 | R260: 5年5.1天 | S260: 3年5.1天 | T260: 9.77 | U260: 62 | V260: 4.5999999999999999e-002 | W260: 2.9999999999999999e-002 | X260: 4.0999999999999995e-002 | Y260: 320 | Z260: 3.17 | AA260: -3.5400000000000001e-002 | AB260: -3.9900000000000005e-002 | AC260: -8.0700000000000008e-002 | AD260: -8.2699999999999996e-002 | AE260: 90.13 | AF260: 90.89 | AG260: 0.85 | AH260: AA | AI260: 4.5999999999999999e-002 | AJ260: =H260+100*O260 -> 136.56 | AK260: 137 | AL260: 187 | AM260: 46.1 | AN260: 182 | AO260: 1.3000000000000001e-002 | AP260: 22 | AQ260: 明阳转债!!
A261: 70 | B261: 123058 | C261: 欣旺转债 | D261: 300207 | E261: 欣旺达 | F261: 电子 | G261: 电子产品 | H261: 141.99 | I261: -2.0799999999999999e-002 | J261: -2.e-002 | K261: 26.82 | L261: -5.0300000000000004e-002 | M261: 116.3 | N261: 21.24 | O261: 0.124 | P261: 126.27 | Q261: 40天 | R261: 5.59年 | S261: 3.59年 | T261: 11.2 | U261: 10 | V261: 6.0000000000000001e-003 | W261: 2.7000000000000003e-002 | X261: 3.3000000000000002e-002 | Y261: 422 | Z261: 6.67 | AA261: -3.5699999999999996e-002 | AB261: -4.0500000000000001e-002 | AC261: -8.0700000000000008e-002 | AD261: -8.2400000000000001e-002 | AE261: 87.82 | AF261: 90.9 | AG261: 0.81 | AH261: AA | AI261: 4.5999999999999999e-002 | AJ261: =H261+100*O261 -> 154.39000000000001 | AK261: 157.7 | AL261: 275 | AM261: 66.8 | AN261: 274 | AO261: -5.7999999999999996e-002 | AP261: 6 | AQ261: 欣旺转债
A262: 305 | B262: 113013 | C262: 国君转债! | D262: 601211 | E262: 国泰君安 | F262: 金融 | G262: 证券行业 | H262: 119.98 | I262: -2.7000000000000001e-003 | J262: -2.7000000000000001e-003 | K262: 17.79 | L262: -1.2199999999999999e-002 | M262: 108.3 | N262: 19.01 | O262: 0.28199999999999997 | P262: 93.58 | Q262: 转股中 | R262: 2.57年 | S262: 无权 | T262: 69.9 | U262: 73 | V262: 9.0000000000000011e-003 | W262: 4.4000000000000004e-002 | X262: 4.0999999999999995e-002 | Y262: 1585. | Z262: 1.28 | AA262: -3.9699999999999999e-002 | AB262: -4.5400000000000003e-002 | AC262: 无权 | AD262: 无权 | AE262: 无权 | AF262: 98.57 | AG262: 0.44 | AH262: AAA | AI262: 3.7999999999999999e-002 | AJ262: =H262+100*O262 -> 148.18000000000001 | AK262: 146.4 | AL262: 240 | AM262: 47.8 | AN262: 188 | AO262: -4.2000000000000003e-002 | AP262: 14 | AQ262: 国君转债!
A263: 46 | B263: 128126 | C263: 赣锋转2 | D263: 2460 | E263: 赣锋锂业 | F263: 有色金属 | G263: 小金属 | H263: 139.75 | I263: -1.8e-003 | J263: -1.4000000000000002e-003 | K263: 78.7 | L263: -3.8e-003 | M263: 111.1 | N263: 60.27 | O263: 7.0000000000000007e-002 | P263: 130.58 | Q263: 2月3天 | R263: 5.65年 | S263: 3.65年 | T263: 21.1 | U263: 4.7 | V263: 2.e-003 | W263: 2.e-002 | X263: 2.6000000000000002e-002 | Y263: 1049. | Z263: 11.3 | AA263: -4.0300000000000002e-002 | AB263: -4.3700000000000003e-002 | AC263: -7.7600000000000002e-002 | AD263: -7.8899999999999998e-002 | AE263: 86.73 | AF263: 86.5 | AG263: 0.84 | AH263: AA | AI263: 4.5999999999999999e-002 | AJ263: =H263+100*O263 -> 146.75 | AK263: 148.9 | AL263: 253 | AM263: 62.2 | AN263: 259 | AO263: 1.2e-002 | AP263: 8 | AQ263: 赣锋转2
A264: 18 | B264: 123072 | C264: 乐歌转债! | D264: 300729 | E264: 乐歌股份 | F264: 其他 | G264: 家居用品 | H264: 163.99 | I264: -8.2699999999999996e-002 | J264: 7.2999999999999995e-002 | K264: 44.78 | L264: -4.0300000000000002e-002 | M264: 129.6 | N264: 73.13 | O264: 1.6799999999999999 | P264: 61.23 | Q264: 4月17天 | R264: 5.86年 | S264: 3.86年 | T264: 1.42 | U264: 2299. | V264: 9.4000000000000004 | W264: 2.3e-002 | X264: 1.3999999999999999e-002 | Y264: 62 | Z264: 6.53 | AA264: -4.0399999999999998e-002 | AB264: -4.8000000000000001e-002 | AC264: -0.10199999999999999 | AD264: -0.10099999999999999 | AE264: 79.18 | AF264: 84.55 | AG264: 0.24 | AH264: A+ | AI264: 7.8e-002 | AJ264: =H264+100*O264 -> 331.99000000000001 | AK264: 266.7 | AL264: 307 | AM264: 182.2 | AN264: 308 | AO264: -7.2999999999999995e-002 | AP264: 4 | AQ264: 乐歌转债!
A265: 81 | B265: 113590 | C265: 海容转债 | D265: 603187 | E265: 海容冷链 | F265: 机械装备 | G265: 通用设备 | H265: 148.54 | I265: -1.66e-002 | J265: -5.1999999999999998e-003 | K265: 54.19 | L265: -2.3300000000000001e-002 | M265: 115.6 | N265: 36.39 | O265: -3.0000000000000001e-003 | P265: 148.91 | Q265: 24天 | R265: 5.55年 | S265: 3.55年 | T265: 5 | U265: 83 | V265: 0.11199999999999999 | W265: 5.7999999999999996e-002 | X265: 8.6999999999999994e-002 | Y265: 86 | Z265: 5.28 | AA265: -4.4999999999999998e-002 | AB265: -4.9599999999999998e-002 | AC265: -9.2499999999999999e-002 | AD265: -9.4200000000000006e-002 | AE265: 81.9 | AF265: 81.29 | AG265: 0.94 | AH265: AA- | AI265: 6.7000000000000004e-002 | AJ265: =H265+100*O265 -> 148.23999999999998 | AK265: 148.2 | AL265: 249 | AM265: 66.3 | AN265: 270 | AO265: 2.e-003 | AP265: 6 | AQ265: 海容转债
A266: 313 | B266: 128010 | C266: 顺昌转债!! | D266: 2245 | E266: 澳洋顺昌 | F266: 交通运输 | G266: 物流业 | H266: 115.498 | I266: -1.37e-002 | J266: 3.4000000000000002e-003 | K266: 9 | L266: -2.9100000000000001e-002 | M266: 109.6 | N266: 9.25 | O266: 0.187 | P266: 97.3 | Q266: 转股中 | R266: 1年42天 | S266: 回售中 | T266: 5.09 | U266: 91 | V266: 0.153 | W266: 5.7999999999999996e-002 | X266: 5.5999999999999994e-002 | Y266: 88 | Z266: 3.88 | AA266: -4.6500000000000007e-002 | AB266: -6.1500000000000006e-002 | AC266: 回售中 | AD266: 回售中 | AE266: 100.27 | AF266: 104.64 | AG266: 0.35 | AH266: AA | AI266: 4.2999999999999997e-002 | AJ266: =H266+100*O266 -> 134.19800000000001 | AK266: 133.7 | AL266: 160 | AM266: 29.1 | AN266: 36 | AO266: -5.4000000000000006e-002 | AP266: 41 | AQ266: 顺昌转债!!
A267: 175 | B267: 113550 | C267: 常汽转债! | D267: 603035 | E267: 常熟汽饰 | F267: 汽车 | G267: 零部件制 | H267: 152.74 | I267: -2.8999999999999998e-003 | J267: 1.2500000000000001e-002 | K267: 14.58 | L267: 1.04e-002 | M267: 121.3 | N267: 9.65 | O267: 1.1000000000000001e-002 | P267: 151.09 | Q267: 转股中 | R267: 4.94年 | S267: 2.94年 | T267: 3.83 | U267: 18 | V267: 2.9999999999999999e-002 | W267: 7.8e-002 | X267: 0.11699999999999999 | Y267: 49 | Z267: 1.46 | AA267: -4.6500000000000007e-002 | AB267: -5.33e-002 | AC267: -0.115 | AD267: -0.11699999999999999 | AE267: 85.8 | AF267: 89.36 | AG267: 0.92 | AH267: AA- | AI267: 6.54e-002 | AJ267: =H267+100*O267 -> 153.84 | AK267: 154.4 | AL267: 272 | AM267: 65 | AN267: 264 | AO267: -5.2000000000000005e-002 | AP267: 16 | AQ267: 常汽转债!
A268: 239 | B268: 128053 | C268: 尚荣转债! | D268: 2551 | E268: 尚荣医疗 | F268: 医药 | G268: 医疗器械 | H268: 139.7 | I268: -4.3700000000000003e-002 | J268: 2.0099999999999996e-002 | K268: 6.21 | L268: -2.3599999999999999e-002 | M268: 114.9 | N268: 4.89 | O268: 0.10000000000000001 | P268: 126.99 | Q268: 转股中 | R268: 4.18年 | S268: 2.18年 | T268: 1.91 | U268: 74 | V268: 0.27300000000000002 | W268: 3.7000000000000005e-002 | X268: 4.8000000000000001e-002 | Y268: 51 | Z268: 1.72 | AA268: -4.6600000000000003e-002 | AB268: -5.2499999999999998e-002 | AC268: -0.121 | AD268: -0.12300000000000001 | AE268: 93.5 | AF268: 96.21 | AG268: 1 | AH268: AA | AI268: 4.4400000000000002e-002 | AJ268: =H268+100*O268 -> 149.69999999999999 | AK268: 152.4 | AL268: 266 | AM268: 56.2 | AN268: 238 | AO268: -7.4999999999999997e-002 | AP268: 27 | AQ268: 尚荣转债!
A269: 206 | B269: 113537 | C269: 文灿转债!! | D269: 603348 | E269: 文灿股份 | F269: 汽车 | G269: 零部件制 | H269: 149.82 | I269: -1.1000000000000001e-002 | J269: -3.7000000000000002e-003 | K269: 28.01 | L269: -1.6500000000000001e-002 | M269: 121.5 | N269: 19.43 | O269: 3.9e-002 | P269: 144.16 | Q269: 转股中 | R269: 4.50年 | S269: 2.50年 | T269: 1.95 | U269: 175 | V269: 0.58799999999999997 | W269: 2.7999999999999997e-002 | X269: 4.0000000000000001e-002 | Y269: 70 | Z269: 2.88 | AA269: -4.6600000000000003e-002 | AB269: -5.4100000000000002e-002 | AC269: -0.127 | AD269: -0.129 | AE269: 88.4 | AF269: 92.06 | AG269: 0.89 | AH269: AA- | AI269: 6.54e-002 | AJ269: =H269+100*O269 -> 153.72 | AK269: 155.5 | AL269: 273 | AM269: 63.4 | AN269: 261 | AO269: -0.11 | AP269: 26 | AQ269: 文灿转债!!
A270: 129 | B270: 123046 | C270: 天铁转债! | D270: 300587 | E270: 天铁股份 | F270: 铁路 | G270: 铁路设备 | H270: 152.01 | I270: -4.7899999999999998e-002 | J270: 3.1800000000000002e-002 | K270: 15.28 | L270: -1.7399999999999999e-002 | M270: 118.2 | N270: 10.12 | O270: 6.9999999999999993e-003 | P270: 150.99 | Q270: 转股中 | R270: 5.27年 | S270: 3.27年 | T270: 1.07 | U270: 83 | V270: 0.49099999999999999 | W270: 2.1000000000000001e-002 | X270: 3.1e-002 | Y270: 52 | Z270: 3.75 | AA270: -4.7599999999999996e-002 | AB270: -5.3099999999999994e-002 | AC270: -0.10300000000000001 | AD270: -0.105 | AE270: 83.56 | AF270: 84.68 | AG270: 0.92 | AH270: AA- | AI270: 6.7000000000000004e-002 | AJ270: =H270+100*O270 -> 152.70999999999998 | AK270: 153 | AL270: 269 | AM270: 68.4 | AN270: 277 | AO270: 2.3e-002 | AP270: 10 | AQ270: 天铁转债!
A271: 251 | B271: 123017 | C271: 寒锐转债!! | D271: 300618 | E271: 寒锐钴业 | F271: 有色金属 | G271: 小金属 | H271: 133.4 | I271: -1.2699999999999999e-002 | J271: -1.1000000000000001e-002 | K271: 71.33 | L271: -2.69e-002 | M271: 110.3 | N271: 57.4 | O271: 7.2999999999999995e-002 | P271: 124.27 | Q271: 转股中 | R271: 3.94年 | S271: 1.94年 | T271: 4.03 | U271: 103 | V271: 0.188 | W271: 1.9e-002 | X271: 2.3e-002 | Y271: 216 | Z271: 5.89 | AA271: -4.7899999999999998e-002 | AB271: -5.2300000000000006e-002 | AC271: -0.11699999999999999 | AD271: -0.11900000000000001 | AE271: 90.02 | AF271: 86.32 | AG271: 0.88 | AH271: AA- | AI271: 6.54e-002 | AJ271: =H271+100*O271 -> 140.70000000000002 | AK271: 142.5 | AL271: 224 | AM271: 52.5 | AN271: 221 | AO271: -2.e-003 | AP271: 14 | AQ271: 寒锐转债!!
A272: 94 | B272: 113585 | C272: 寿仙转债 | D272: 603896 | E272: 寿仙谷 | F272: 医药 | G272: 中药 | H272: 154.63 | I272: -9.0000000000000011e-003 | J272: -6.0000000000000001e-003 | K272: 46.07 | L272: -1.5800000000000002e-002 | M272: 117.8 | N272: 28.68 | O272: -3.7000000000000005e-002 | P272: 160.63 | Q272: 4.1天 | R272: 5.49年 | S272: 3.49年 | T272: 3.6 | U272: 35 | V272: 6.2e-002 | W272: 5.4000000000000006e-002 | X272: 8.6999999999999994e-002 | Y272: 66 | Z272: 5.37 | AA272: -4.9200000000000001e-002 | AB272: -5.4400000000000004e-002 | AC272: -0.10099999999999999 | AD272: -0.10199999999999999 | AE272: 82.38 | AF272: 83.17 | AG272: 0.95 | AH272: AA- | AI272: 6.7000000000000004e-002 | AJ272: =H272+100*O272 -> 150.93000000000001 | AK272: 148.6 | AL272: 250 | AM272: 65.5 | AN272: 266 | AO272: -1.1000000000000001e-002 | AP272: 9 | AQ272: 寿仙转债
A273: 277 | B273: 127005 | C273: 长证转债! | D273: 783 | E273: 长江证券 | F273: 金融 | G273: 证券行业 | H273: 128.5 | I273: -3.3e-003 | J273: -6.0000000000000001e-003 | K273: 8.12 | L273: -1.34e-002 | M273: 109.3 | N273: 7.28 | O273: 0.152 | P273: 111.54 | Q273: 转股中 | R273: 3.25年 | S273: 无权 | T273: 50 | U273: 37 | V273: 6.0000000000000001e-003 | W273: 0.111 | X273: 0.124 | Y273: 449 | Z273: 1.6 | AA273: -4.9599999999999998e-002 | AB273: -5.4400000000000004e-002 | AC273: 无权 | AD273: 无权 | AE273: 无权 | AF273: 96.67 | AG273: 0.7 | AH273: AAA | AI273: 3.9399999999999998e-002 | AJ273: =H273+100*O273 -> 143.69999999999999 | AK273: 145.5 | AL273: 238 | AM273: 48.8 | AN273: 191 | AO273: -5.9999999999999998e-002 | AP273: 15 | AQ273: 长证转债!
A274: 126 | B274: 128103 | C274: 同德转债 | D274: 2360 | E274: 同德化工 | F274: 化工 | G274: 化工 | H274: 159 | I274: -2.92e-002 | J274: 5.9999999999999998e-002 | K274: 7.36 | L274: 3.3700000000000001e-002 | M274: 121.8 | N274: 5.18 | O274: 0.11900000000000001 | P274: 142.08 | Q274: 转股中 | R274: 5.29年 | S274: 3.29年 | T274: 1.44 | U274: 630 | V274: 2.7200000000000002 | W274: 5.0000000000000003e-002 | X274: 7.0999999999999994e-002 | Y274: 29 | Z274: 2.4 | AA274: -5.0199999999999995e-002 | AB274: -5.6600000000000004e-002 | AC274: -0.11199999999999999 | AD274: -0.114 | AE274: 81.06 | AF274: 82.71 | AG274: 0.91 | AH274: A+ | AI274: 7.8e-002 | AJ274: =H274+100*O274 -> 170.90000000000001 | AK274: 175.9 | AL274: 291 | AM274: 93.2 | AN274: 296 | AO274: 9.1999999999999998e-002 | AP274: 12 | AQ274: 同德转债
A275: 194 | B275: 123030 | C275: 九洲转债! | D275: 300040 | E275: 九洲集团 | F275: 能源电力 | G275: 电力设备 | H275: 152.5 | I275: -5.28e-002 | J275: 2.e-003 | K275: 7.29 | L275: -5.0799999999999998e-002 | M275: 120 | N275: 5.65 | O275: 0.182 | P275: 129.03 | Q275: 转股中 | R275: 4.69年 | S275: 2.69年 | T275: 0.97 | U275: 242 | V275: 1.5800000000000001 | W275: 3.5000000000000003e-002 | X275: 4.5999999999999999e-002 | Y275: 27 | Z275: 1.27 | AA275: -5.0700000000000002e-002 | AB275: -5.74e-002 | AC275: -0.126 | AD275: -0.128 | AE275: 86.53 | AF275: 89.68 | AG275: 1 | AH275: AA- | AI275: 6.54e-002 | AJ275: =H275+100*O275 -> 170.69999999999999 | AK275: 176 | AL275: 292 | AM275: 86.3 | AN275: 292 | AO275: -0.109 | AP275: 28 | AQ275: 九洲转债!
A276: 48 | B276: 113038 | C276: 隆20转债 | D276: 601012 | E276: 隆基股份 | F276: 能源电力 | G276: 太阳能 | H276: 149.61 | I276: -6.7000000000000002e-003 | J276: -8.6e-003 | K276: 72.8 | L276: -1.7500000000000002e-002 | M276: 111.8 | N276: 52.59 | O276: 8.1000000000000003e-002 | P276: 138.43 | Q276: 57天 | R276: 5.64年 | S276: 3.64年 | T276: 50 | U276: 115 | V276: 1.4999999999999999e-002 | W276: 1.8000000000000002e-002 | X276: 2.5000000000000001e-002 | Y276: 2746. | Z276: 8.46 | AA276: -5.1100000000000007e-002 | AB276: -5.4600000000000003e-002 | AC276: -9.3399999999999997e-002 | AD276: -9.4800000000000009e-002 | AE276: 88.76 | AF276: 89.48 | AG276: 0.87 | AH276: AAA | AI276: 4.0999999999999995e-002 | AJ276: =H276+100*O276 -> 157.71000000000001 | AK276: 160.8 | AL276: 280 | AM276: 71.3 | AN276: 281 | AO276: 6.3e-002 | AP276: 12 | AQ276: 隆20转债
A277: 263 | B277: 123012 | C277: 万顺转债! | D277: 300057 | E277: 万顺新材 | F277: 造纸包装 | G277: 包装材料 | H277: 133.7 | I277: -5.33e-002 | J277: -7.9000000000000008e-003 | K277: 5.45 | L277: -9.0200000000000002e-002 | M277: 110.3 | N277: 5.31 | O277: 0.30299999999999999 | P277: 102.64 | Q277: 转股中 | R277: 3.61年 | S277: 1.61年 | T277: 1.29 | U277: 179 | V277: 1.01 | W277: 3.5000000000000003e-002 | X277: 3.6000000000000004e-002 | Y277: 37 | Z277: 1.08 | AA277: -5.2900000000000003e-002 | AB277: -5.7699999999999994e-002 | AC277: -0.11800000000000001 | AD277: -0.12 | AE277: 91.97 | AF277: 88.18 | AG277: 0.68 | AH277: AA- | AI277: 6.54e-002 | AJ277: =H277+100*O277 -> 164. | AK277: 164.8 | AL277: 283 | AM277: 72.8 | AN277: 284 | AO277: -0.11 | AP277: 18 | AQ277: 万顺转债!
A278: 7 | B278: 113041 | C278: 紫金转债 | D278: 601899 | E278: 紫金矿业 | F278: 有色金属 | G278: 贵金属 | H278: 141.14 | I278: 7.6e-003 | J278: -1.8600000000000002e-002 | K278: 8.43 | L278: -1.3999999999999999e-002 | M278: 108 | N278: 7.01 | O278: 0.17399999999999999 | P278: 120.26 | Q278: 5月0天 | R278: 4.90年 | S278: 2.90年 | T278: 60 | U278: 288 | V278: 3.4000000000000002e-002 | W278: 2.7999999999999997e-002 | X278: 3.4000000000000002e-002 | Y278: 2139. | Z278: 4.46 | AA278: -5.3499999999999999e-002 | AB278: -5.6399999999999999e-002 | AC278: -0.10099999999999999 | AD278: -0.10199999999999999 | AE278: 90.06 | AF278: 89.51 | AG278: 0.78 | AH278: AAA | AI278: 3.9399999999999998e-002 | AJ278: =H278+100*O278 -> 158.53999999999999 | AK278: 162 | AL278: 281 | AM278: 72 | AN278: 282 | AO278: -4.0000000000000001e-002 | AP278: 7 | AQ278: 紫金转债
A279: 152 | B279: 123042 | C279: 银河转债! | D279: 300619 | E279: 金银河 | F279: 机械装备 | G279: 专用设备 | H279: 153.705 | I279: -7.6299999999999993e-002 | J279: 5.2699999999999997e-002 | K279: 23.63 | L279: -3.39e-002 | M279: 115.9 | N279: 24.4 | O279: 0.58700000000000008 | P279: 96.84 | Q279: 转股中 | R279: 5年34天 | S279: 3年34天 | T279: 1.67 | U279: 802 | V279: 3. | W279: 9.5000000000000001e-002 | X279: 9.1999999999999998e-002 | Y279: 18 | Z279: 3.61 | AA279: -5.5099999999999996e-002 | AB279: -6.0100000000000001e-002 | AC279: -0.111 | AD279: -0.113 | AE279: 81.91 | AF279: 79.85 | AG279: 0.7 | AH279: A+ | AI279: 7.8e-002 | AJ279: =H279+100*O279 -> 212.40500000000003 | AK279: 210.6 | AL279: 301 | AM279: 128.7 | AN279: 303 | AO279: -0.155 | AP279: 25 | AQ279: 银河转债!
A280: 310 | B280: 113011 | C280: 光大转债 | D280: 601818 | E280: 光大银行 | F280: 金融 | G280: 银行行业 | H280: 122.92 | I280: -8.1000000000000013e-003 | J280: 3.4000000000000002e-003 | K280: 4.03 | L280: -7.4000000000000003e-003 | M280: 108.3 | N280: 3.76 | O280: 0.14699999999999999 | P280: 107.18 | Q280: 转股中 | R280: 2.26年 | S280: 无权 | T280: 242 | U280: 463 | V280: 1.6e-002 | W280: 0.114 | X280: 0.12300000000000001 | Y280: 2115. | Z280: 0.64 | AA280: -5.5399999999999998e-002 | AB280: -6.1799999999999994e-002 | AC280: 无权 | AD280: 无权 | AE280: 无权 | AF280: 99.7 | AG280: 0.64 | AH280: AAA | AI280: 3.7999999999999999e-002 | AJ280: =H280+100*O280 -> 137.62 | AK280: 138.7 | AL280: 199 | AM280: 39 | AN280: 127 | AO280: -5.2999999999999999e-002 | AP280: 15 | AQ280: 光大转债
A281: 300 | B281: 128019 | C281: 久立转2!! | D281: 2318 | E281: 久立特材 | F281: 石油天然 | G281: 石油天然 | H281: 128.201 | I281: -1.55e-002 | J281: -1.5e-003 | K281: 9.81 | L281: -1.7000000000000001e-002 | M281: 108.8 | N281: 7.62 | O281: -4.0000000000000001e-003 | P281: 128.74 | Q281: 转股中 | R281: 2.91年 | S281: 0.91年 | T281: 3.32 | U281: 23 | V281: 5.2999999999999999e-002 | W281: 3.6000000000000004e-002 | X281: 4.7e-002 | Y281: 91 | Z281: 2.35 | AA281: -5.5500000000000001e-002 | AB281: -6.0700000000000004e-002 | AC281: -0.192 | AD281: -0.19399999999999998 | AE281: 97.06 | AF281: 96.41 | AG281: 1 | AH281: AA | AI281: 4.2999999999999997e-002 | AJ281: =H281+100*O281 -> 127.80099999999999 | AK281: 127.7 | AL281: 96 | AM281: 30.6 | AN281: 43 | AO281: -4.9000000000000002e-002 | AP281: 13 | AQ281: 久立转2!!
A282: 314 | B282: 113009 | C282: 广汽转债!! | D282: 601238 | E282: 广汽集团 | F282: 汽车 | G282: 乘用车 | H282: 114.56 | I282: 2.0000000000000001e-004 | J282: 1.03e-002 | K282: 13.11 | L282: 4.2999999999999997e-002 | M282: 107.5 | N282: 14.23 | O282: 0.24299999999999999 | P282: 92.13 | Q282: 转股中 | R282: 1年42天 | S282: 回售中 | T282: 25.5 | U282: 26 | V282: 9.0000000000000011e-003 | W282: 1.9e-002 | X282: 1.7000000000000001e-002 | Y282: 1342. | Z282: 1.62 | AA282: -5.6100000000000004e-002 | AB282: -6.7900000000000002e-002 | AC282: 回售中 | AD282: 回售中 | AE282: 100.25 | AF282: 103.18 | AG282: 0.24 | AH282: AAA | AI282: 3.7999999999999999e-002 | AJ282: =H282+100*O282 -> 138.86000000000001 | AK282: 137 | AL282: 186 | AM282: 33.8 | AN282: 77 | AO282: -2.5000000000000001e-002 | AP282: 15 | AQ282: 广汽转债!!
A283: 241 | B283: 113526 | C283: 联泰转债! | D283: 603797 | E283: 联泰环保 | F283: 城市公用 | G283: 三废处理 | H283: 140.43 | I283: -2.6099999999999998e-002 | J283: 2.3099999999999999e-002 | K283: 8.29 | L283: -3.5999999999999999e-003 | M283: 110.8 | N283: 6.11 | O283: 3.5000000000000003e-002 | P283: 135.68 | Q283: 转股中 | R283: 4年43天 | S283: 2年43天 | T283: 1.93 | U283: 6.4 | V283: 2.3e-002 | W283: 5.2000000000000005e-002 | X283: 7.0000000000000007e-002 | Y283: 37 | Z283: 2.41 | AA283: -5.7000000000000002e-002 | AB283: -6.1399999999999996e-002 | AC283: -0.126 | AD283: -0.129 | AE283: 94.05 | AF283: 93.74 | AG283: 0.86 | AH283: AA+ | AI283: 4.24e-002 | AJ283: =H283+100*O283 -> 143.93000000000001 | AK283: 145.2 | AL283: 236 | AM283: 51.1 | AN283: 210 | AO283: -1.e-002 | AP283: 9 | AQ283: 联泰转债!
A284: 73 | B284: 113592 | C284: 安20转债 | D284: 603345 | E284: 安井食品 | F284: 食品饮料 | G284: 食品饮料 | H284: 158.25 | I284: 1.06e-002 | J284: -1.3999999999999999e-002 | K284: 186.39 | L284: -3.5999999999999999e-003 | M284: 113.1 | N284: 115.9 | O284: -1.6e-002 | P284: 160.82 | Q284: 34天 | R284: 5.57年 | S284: 3.57年 | T284: 9 | U284: 182 | V284: 0.127 | W284: 2.e-002 | X284: 3.3000000000000002e-002 | Y284: 441 | Z284: 13.74 | AA284: -5.9400000000000001e-002 | AB284: -6.3200000000000006e-002 | AC284: -0.105 | AD284: -0.106 | AE284: 87.69 | AF284: 88.44 | AG284: 0.94 | AH284: AA | AI284: 4.5999999999999999e-002 | AJ284: =H284+100*O284 -> 156.65000000000001 | AK284: 155.7 | AL284: 274 | AM284: 67.2 | AN284: 275 | AO284: 8.0000000000000002e-002 | AP284: 7 | AQ284: 安20转债
A285: 279 | B285: 113504 | C285: 艾华转债!! | D285: 603989 | E285: 艾华集团 | F285: 电子 | G285: 元器件制 | H285: 134.11 | I285: 4.5999999999999999e-003 | J285: -4.3e-003 | K285: 28.08 | L285: 4.0000000000000002e-004 | M285: 110.3 | N285: 21.13 | O285: 9.0000000000000011e-003 | P285: 132.89 | Q285: 转股中 | R285: 3.22年 | S285: 1.22年 | T285: 5.59 | U285: 11 | V285: 1.3999999999999999e-002 | W285: 5.0000000000000003e-002 | X285: 6.7000000000000004e-002 | Y285: 111 | Z285: 4.61 | AA285: -5.9999999999999998e-002 | AB285: -6.54e-002 | AC285: -0.161 | AD285: -0.16399999999999998 | AE285: 96.84 | AF285: 96.19 | AG285: 0.88 | AH285: AA | AI285: 4.4400000000000002e-002 | AJ285: =H285+100*O285 -> 135.01000000000002 | AK285: 135.3 | AL285: 172 | AM285: 38.5 | AN285: 125 | AO285: 2.e-002 | AP285: 9 | AQ285: 艾华转债!!
A286: 90 | B286: 128112 | C286: 歌尔转2 | D286: 2241 | E286: 歌尔股份 | F286: 电子 | G286: 电子产品 | H286: 161.001 | I286: -3.1e-002 | J286: -2.2000000000000001e-003 | K286: 37.8 | L286: -3.5699999999999996e-002 | M286: 114.5 | N286: 23.27 | O286: -9.0000000000000011e-003 | P286: 162.44 | Q286: 7天 | R286: 5.50年 | S286: 3.50年 | T286: 40 | U286: 442 | V286: 6.8000000000000005e-002 | W286: 3.3000000000000002e-002 | X286: 5.2999999999999999e-002 | Y286: 1227. | Z286: 7.02 | AA286: -6.08e-002 | AB286: -6.5099999999999991e-002 | AC286: -0.11199999999999999 | AD286: -0.113 | AE286: 88.04 | AF286: 90.67 | AG286: 0.93 | AH286: AA+ | AI286: 4.4000000000000004e-002 | AJ286: =H286+100*O286 -> 160.101 | AK286: 159.6 | AL286: 277 | AM286: 68.9 | AN286: 278 | AO286: -1.9e-002 | AP286: 16 | AQ286: 歌尔转2
A287: 230 | B287: 110055 | C287: 伊力转债!! | D287: 600197 | E287: 伊力特 | F287: 食品饮料 | G287: 白酒 | H287: 151.78 | I287: 6.6e-003 | J287: -6.3e-003 | K287: 25.71 | L287: 4.0000000000000002e-004 | M287: 115 | N287: 16.81 | O287: -8.0000000000000002e-003 | P287: 152.94 | Q287: 转股中 | R287: 4.26年 | S287: 2.26年 | T287: 3.86 | U287: 1189. | V287: 2. | W287: 3.5000000000000003e-002 | X287: 5.2999999999999999e-002 | Y287: 112 | Z287: 4.18 | AA287: -6.4299999999999996e-002 | AB287: -7.0000000000000007e-002 | AC287: -0.109 | AD287: -0.111 | AE287: 93.27 | AF287: 95.98 | AG287: 0.92 | AH287: AA | AI287: 4.4400000000000002e-002 | AJ287: =H287+100*O287 -> 150.97999999999999 | AK287: 150.6 | AL287: 259 | AM287: 54.6 | AN287: 231 | AO287: 7.8e-002 | AP287: 25 | AQ287: 伊力转债!!
A288: 107 | B288: 113580 | C288: 康隆转债! | D288: 603665 | E288: 康隆达 | F288: 服装纺织 | G288: 服装行业 | H288: 174.23 | I288: -6.0999999999999995e-003 | J288: 7.1999999999999998e-003 | K288: 27.01 | L288: 1.1000000000000001e-003 | M288: 121.2 | N288: 15.51 | O288: 0. | P288: 174.15 | Q288: 转股中 | R288: 5.36年 | S288: 3.36年 | T288: 0.68 | U288: 40 | V288: 0.34000000000000002 | W288: 1.6e-002 | X288: 2.7999999999999997e-002 | Y288: 42 | Z288: 4.19 | AA288: -6.6600000000000006e-002 | AB288: -7.2700000000000001e-002 | AC288: -0.13200000000000001 | AD288: -0.13400000000000001 | AE288: 83.04 | AF288: 86.27 | AG288: 0.95 | AH288: AA- | AI288: 6.7000000000000004e-002 | AJ288: =H288+100*O288 -> 174.22999999999999 | AK288: 174.3 | AL288: 290 | AM288: 88 | AN288: 294 | AO288: 1.1000000000000001e-002 | AP288: 9 | AQ288: 康隆转债!
A289: 274 | B289: 128036 | C289: 金农转债!! | D289: 2548 | E289: 金新农 | F289: 农业 | G289: 畜牧业 | H289: 138 | I289: -1.8500000000000003e-002 | J289: -6.7000000000000002e-003 | K289: 8.3 | L289: -2.58e-002 | M289: 110.3 | N289: 7.39 | O289: 0.22899999999999998 | P289: 112.31 | Q289: 转股中 | R289: 3.24年 | S289: 1.24年 | T289: 1.46 | U289: 274 | V289: 1.3400000000000001 | W289: 3.1e-002 | X289: 3.5000000000000003e-002 | Y289: 47 | Z289: 2.19 | AA289: -6.8099999999999994e-002 | AB289: -7.3300000000000004e-002 | AC289: -0.17399999999999999 | AD289: -0.17600000000000002 | AE289: 94.11 | AF289: 90.24 | AG289: 0.98 | AH289: AA- | AI289: 6.54e-002 | AJ289: =H289+100*O289 -> 160.90000000000001 | AK289: 163.7 | AL289: 282 | AM289: 69.6 | AN289: 280 | AO289: -1.4999999999999999e-002 | AP289: 16 | AQ289: 金农转债!!
A290: 148 | B290: 128095 | C290: 恩捷转债!! | D290: 2812 | E290: 恩捷股份 | F290: 电子 | G290: 元器件制 | H290: 167 | I290: 0. | J290: -1.46e-002 | K290: 107.78 | L290: -1.5700000000000002e-002 | M290: 115.3 | N290: 65.09 | O290: 9.0000000000000011e-003 | P290: 165.59 | Q290: 转股中 | R290: 5.17年 | S290: 3.17年 | T290: 10.3 | U290: 188 | V290: 0.109 | W290: 1.1000000000000001e-002 | X290: 1.8000000000000002e-002 | Y290: 947 | Z290: 9.59 | AA290: -7.0400000000000004e-002 | AB290: -7.4999999999999997e-002 | AC290: -0.13100000000000001 | AD290: -0.13200000000000001 | AE290: 89.5 | AF290: 91.83 | AG290: 0.93 | AH290: AA | AI290: 4.5999999999999999e-002 | AJ290: =H290+100*O290 -> 167.90000000000001 | AK290: 168.4 | AL290: 285 | AM290: 76.6 | AN290: 285 | AO290: 5.0999999999999997e-002 | AP290: 16 | AQ290: 恩捷转债!!
A291: 229 | B291: 123022 | C291: 长信转债!! | D291: 300088 | E291: 长信科技 | F291: 通信互联 | G291: 通信设备 | H291: 157.6 | I291: -2.1899999999999999e-002 | J291: -5.3e-003 | K291: 9.58 | L291: -2.9399999999999999e-002 | M291: 114.9 | N291: 6.15 | O291: 1.2e-002 | P291: 155.77 | Q291: 转股中 | R291: 4.27年 | S291: 2.27年 | T291: 2.63 | U291: 19 | V291: 4.4999999999999998e-002 | W291: 1.1000000000000001e-002 | X291: 1.7000000000000001e-002 | Y291: 234 | Z291: 3.4 | AA291: -7.2700000000000001e-002 | AB291: -7.8200000000000006e-002 | AC291: -0.11800000000000001 | AD291: -0.11900000000000001 | AE291: 93.14 | AF291: 95.84 | AG291: 0.93 | AH291: AA | AI291: 4.4400000000000002e-002 | AJ291: =H291+100*O291 -> 158.79999999999998 | AK291: 159.4 | AL291: 276 | AM291: 63.6 | AN291: 262 | AO291: -4.0999999999999995e-002 | AP291: 12 | AQ291: 长信转债!!
A292: 130 | B292: 128102 | C292: 海大转债! | D292: 2311 | E292: 海大集团 | F292: 农业 | G292: 畜牧业 | H292: 171.6 | I292: -1.1999999999999999e-003 | J292: -1.1999999999999999e-003 | K292: 59.66 | L292: -2.3e-003 | M292: 114.1 | N292: 34.74 | O292: -1.e-003 | P292: 171.73 | Q292: 转股中 | R292: 5.27年 | S292: 4.27年 | T292: 4.07 | U292: 56 | V292: 8.0000000000000002e-002 | W292: 4.0000000000000001e-003 | X292: 6.9999999999999993e-003 | Y292: 975 | Z292: 8.28 | AA292: -7.5499999999999998e-002 | AB292: -7.9699999999999993e-002 | AC292: -0.10099999999999999 | AD292: -0.10300000000000001 | AE292: 86.47 | AF292: 91.26 | AG292: 1 | AH292: AA+ | AI292: 4.4000000000000004e-002 | AJ292: =H292+100*O292 -> 171.5 | AK292: 171.5 | AL292: 288 | AM292: 80.2 | AN292: 287 | AO292: 1.3000000000000001e-002 | AP292: 12 | AQ292: 海大转债!
A293: 93 | B293: 128110 | C293: 永兴转债 | D293: 2756 | E293: 永兴材料 | F293: 钢铁 | G293: 炼钢 | H293: 176.8 | I293: -2.0799999999999999e-002 | J293: -1.7299999999999999e-002 | K293: 30.98 | L293: -4.0000000000000001e-002 | M293: 113.2 | N293: 17.06 | O293: -2.6000000000000002e-002 | P293: 181.59 | Q293: 4.1天 | R293: 5.49年 | S293: 3.49年 | T293: 7 | U293: 195 | V293: 0.158 | W293: 6.2e-002 | X293: 0.11199999999999999 | Y293: 113 | Z293: 3.24 | AA293: -7.9199999999999993e-002 | AB293: -8.3000000000000004e-002 | AC293: -0.13200000000000001 | AD293: -0.13300000000000001 | AE293: 88.1 | AF293: 88.85 | AG293: 0.95 | AH293: AA | AI293: 4.5999999999999999e-002 | AJ293: =H293+100*O293 -> 174.20000000000002 | AK293: 172 | AL293: 289 | AM293: 83.2 | AN293: 289 | AO293: 0.124 | AP293: 5 | AQ293: 永兴转债
A294: 260 | B294: 123014 | C294: 凯发转债! | D294: 300407 | E294: 凯发电气 | F294: 能源电力 | G294: 电力设备 | H294: 134.633 | I294: -4.2500000000000003e-002 | J294: 3.1600000000000003e-002 | K294: 8.23 | L294: -1.67e-002 | M294: 108.5 | N294: 8.12 | O294: 0.32799999999999996 | P294: 101.35 | Q294: 转股中 | R294: 2.62年 | S294: 0.62年 | T294: 1.16 | U294: 597 | V294: 3.6099999999999999 | W294: 4.5999999999999999e-002 | X294: 4.7e-002 | Y294: 25 | Z294: 1.86 | AA294: -7.980000000000001e-002 | AB294: -8.5199999999999998e-002 | AC294: -0.32100000000000001 | AD294: -0.32299999999999995 | AE294: 95.63 | AF294: 89.96 | AG294: 0.65 | AH294: A+ | AI294: 7.4999999999999997e-002 | AJ294: =H294+100*O294 -> 167.43299999999999 | AK294: 167.9 | AL294: 284 | AM294: 72.3 | AN294: 283 | AO294: -7.6999999999999999e-002 | AP294: 16 | AQ294: 凯发转债!
A295: 205 | B295: 123027 | C295: 蓝晓转债! | D295: 300487 | E295: 蓝晓科技 | F295: 化工 | G295: 化工 | H295: 175 | I295: -2.7799999999999998e-002 | J295: 1.04e-002 | K295: 46.13 | L295: -1.8500000000000003e-002 | M295: 119.5 | N295: 29.33 | O295: 0.113 | P295: 157.28 | Q295: 转股中 | R295: 4.50年 | S295: 2.50年 | T295: 1.08 | U295: 747 | V295: 3.7999999999999998 | W295: 1.1000000000000001e-002 | X295: 1.7000000000000001e-002 | Y295: 99 | Z295: 6.23 | AA295: -8.3000000000000004e-002 | AB295: -8.9600000000000013e-002 | AC295: -0.12300000000000001 | AD295: -0.124 | AE295: 86.03 | AF295: 86.56 | AG295: 0.94 | AH295: A+ | AI295: 7.6399999999999996e-002 | AJ295: =H295+100*O295 -> 186.30000000000001 | AK295: 192.7 | AL295: 299 | AM295: 106.2 | AN295: 299 | AO295: -1.9e-002 | AP295: 21 | AQ295: 蓝晓转债!
A296: 198 | B296: 113543 | C296: 欧派转债! | D296: 603833 | E296: 欧派家居 | F296: 其他 | G296: 家居用品 | H296: 175.53 | I296: -1.8200000000000001e-002 | J296: 1.2500000000000001e-002 | K296: 124.53 | L296: -6.0000000000000001e-003 | M296: 114.9 | N296: 71.69 | O296: 1.e-002 | P296: 173.71 | Q296: 转股中 | R296: 4.68年 | S296: 3.68年 | T296: 5.52 | U296: 12 | V296: 1.3000000000000001e-002 | W296: 6.9999999999999993e-003 | X296: 1.3000000000000001e-002 | Y296: 743 | Z296: 6.87 | AA296: -8.8000000000000009e-002 | AB296: -9.2899999999999996e-002 | AC296: -0.121 | AD296: -0.12300000000000001 | AE296: 89.27 | AF296: 94.14 | AG296: 0.95 | AH296: AA | AI296: 4.4400000000000002e-002 | AJ296: =H296+100*O296 -> 176.53 | AK296: 177.4 | AL296: 293 | AM296: 83.2 | AN296: 290 | AO296: -4.9000000000000002e-002 | AP296: 14 | AQ296: 欧派转债!
A297: 303 | B297: 128017 | C297: 金禾转债!! | D297: 2597 | E297: 金禾实业 | F297: 化工 | G297: 化工 | H297: 142.543 | I297: -3.8800000000000001e-002 | J297: 8.6e-003 | K297: 31.09 | L297: -3.3599999999999998e-002 | M297: 108.8 | N297: 22.42 | O297: 2.7999999999999997e-002 | P297: 138.67 | Q297: 转股中 | R297: 2.89年 | S297: 0.89年 | T297: 5.52 | U297: 17 | V297: 2.1000000000000001e-002 | W297: 3.2000000000000001e-002 | X297: 4.4000000000000004e-002 | Y297: 174 | Z297: 3.78 | AA297: -9.0299999999999991e-002 | AB297: -9.5199999999999993e-002 | AC297: -0.27100000000000002 | AD297: -0.27300000000000002 | AE297: 97.14 | AF297: 96.49 | AG297: 0.9 | AH297: AA | AI297: 4.2999999999999997e-002 | AJ297: =H297+100*O297 -> 145.34300000000002 | AK297: 146.4 | AL297: 241 | AM297: 49.3 | AN297: 194 | AO297: -7.0000000000000007e-002 | AP297: 10 | AQ297: 金禾转债!!
A298: 179 | B298: 123034 | C298: 通光转债! | D298: 300265 | E298: 通光线缆 | F298: 通信互联 | G298: 通信设备 | H298: 195 | I298: -8.4499999999999992e-002 | J298: 4.7899999999999998e-002 | K298: 11.41 | L298: -3.9599999999999996e-002 | M298: 118 | N298: 7.97 | O298: 0.36200000000000004 | P298: 143.16 | Q298: 转股中 | R298: 4.90年 | S298: 2.90年 | T298: 0.78 | U298: 857 | V298: 5.3600000000000003 | W298: 1.9e-002 | X298: 2.7000000000000003e-002 | Y298: 42 | Z298: 3.32 | AA298: -9.8900000000000002e-002 | AB298: -0.10400000000000001 | AC298: -0.11699999999999999 | AD298: -0.11800000000000001 | AE298: 82.77 | AF298: 82.86 | AG298: 0.93 | AH298: A+ | AI298: 7.6399999999999996e-002 | AJ298: =H298+100*O298 -> 231.19999999999999 | AK298: 246.8 | AL298: 306 | AM298: 164 | AN298: 306 | AO298: -8.6999999999999994e-002 | AP298: 24 | AQ298: 通光转债!
A299: 84 | B299: 128115 | C299: 巨星转债 | D299: 2444 | E299: 巨星科技 | F299: 机械装备 | G299: 通用设备 | H299: 204.25 | I299: -3.6799999999999999e-002 | J299: -6.1999999999999998e-003 | K299: 25.66 | L299: -4.4299999999999999e-002 | M299: 115.3 | N299: 12.28 | O299: -2.3e-002 | P299: 208.96 | Q299: 24天 | R299: 5.53年 | S299: 3.53年 | T299: 9.73 | U299: 116 | V299: 5.7000000000000002e-002 | W299: 3.5000000000000003e-002 | X299: 7.400000000000001e-002 | Y299: 276 | Z299: 3.25 | AA299: -9.9700000000000011e-002 | AB299: -0.10400000000000001 | AC299: -0.155 | AD299: -0.157 | AE299: 90.32 | AF299: 90.34 | AG299: 0.97 | AH299: AA | AI299: 4.5999999999999999e-002 | AJ299: =H299+100*O299 -> 201.94999999999999 | AK299: 199.5 | AL299: 300 | AM299: 109.2 | AN299: 300 | AO299: -7.0999999999999994e-002 | AP299: 4 | AQ299: 巨星转债
A300: 212 | B300: 128065 | C300: 雅化转债!! | D300: 2497 | E300: 雅化集团 | F300: 化工 | G300: 化工 | H300: 180.99 | I300: -1.32e-002 | J300: -3.0999999999999999e-003 | K300: 16.32 | L300: -1.6299999999999999e-002 | M300: 110.9 | N300: 8.95 | O300: -6.9999999999999993e-003 | P300: 182.35 | Q300: 转股中 | R300: 4.35年 | S300: 2.35年 | T300: 2.47 | U300: 327 | V300: 0.71599999999999997 | W300: 1.6e-002 | X300: 2.8999999999999998e-002 | Y300: 156 | Z300: 5.39 | AA300: -0.10800000000000001 | AB300: -0.11199999999999999 | AC300: -0.14199999999999999 | AD300: -0.14300000000000002 | AE300: 92.82 | AF300: 92.2 | AG300: 1 | AH300: AA | AI300: 4.4400000000000002e-002 | AJ300: =H300+100*O300 -> 180.29000000000002 | AK300: 179.6 | AL300: 295 | AM300: 86.8 | AN300: 293 | AO300: 2.1000000000000001e-002 | AP300: 21 | AQ300: 雅化转债!!
A301: 105 | B301: 113582 | C301: 火炬转债 | D301: 603678 | E301: 火炬电子 | F301: 电子 | G301: 元器件制 | H301: 219.71 | I301: -3.1e-002 | J301: 1.1000000000000001e-003 | K301: 55.96 | L301: -3.0699999999999998e-002 | M301: 115.3 | N301: 25.33 | O301: -5.0000000000000001e-003 | P301: 220.92 | Q301: 转股中 | R301: 5.46年 | S301: 3.46年 | T301: 4.78 | U301: 263 | V301: 0.249 | W301: 1.9e-002 | X301: 4.2000000000000003e-002 | Y301: 253 | Z301: 7.3 | AA301: -0.113 | AB301: -0.11699999999999999 | AC301: -0.10199999999999999 | AD301: -0.10300000000000001 | AE301: 88.34 | AF301: 90.65 | AG301: 0.97 | AH301: AA | AI301: 4.5999999999999999e-002 | AJ301: =H301+100*O301 -> 219.21000000000001 | AK301: 218.5 | AL301: 303 | AM301: 127.8 | AN301: 302 | AO301: 0.10099999999999999 | AP301: 5 | AQ301: 火炬转债
A302: 104 | B302: 113035 | C302: 福莱转债 | D302: 601865 | E302: 福莱特 | F302: 能源电力 | G302: 太阳能 | H302: 240.9 | I302: 1.5900000000000001e-002 | J302: -5.7999999999999996e-003 | K302: 32.55 | L302: 1.0200000000000001e-002 | M302: 120.3 | N302: 13.48 | O302: -2.e-003 | P302: 241.47 | Q302: 转股中 | R302: 5.46年 | S302: 3.46年 | T302: 6.47 | U302: 463 | V302: 0.29799999999999999 | W302: 1.e-002 | X302: 2.5000000000000001e-002 | Y302: 636 | Z302: 11.95 | AA302: -0.121 | AB302: -0.126 | AC302: -0.111 | AD302: -0.11199999999999999 | AE302: 88.34 | AF302: 94.57 | AG302: 0.98 | AH302: AA | AI302: 4.5999999999999999e-002 | AJ302: =H302+100*O302 -> 240.70000000000002 | AK302: 240.3 | AL302: 305 | AM302: 145.8 | AN302: 305 | AO302: -5.9999999999999998e-002 | AP302: 8 | AQ302: 福莱转债
A303: 288 | B303: 128030 | C303: 天康转债!! | D303: 2100 | E303: 天康生物 | F303: 农业 | G303: 畜牧业 | H303: 168.5 | I303: -2.7099999999999999e-002 | J303: -6.4000000000000003e-003 | K303: 12.4 | L303: -3.3500000000000002e-002 | M303: 112.3 | N303: 7.85 | O303: 6.7000000000000004e-002 | P303: 157.96 | Q303: 转股中 | R303: 3年11天 | S303: 1年11天 | T303: 0.98 | U303: 41 | V303: 0.247 | W303: 6.9999999999999993e-003 | X303: 1.2e-002 | Y303: 133 | Z303: 2.23 | AA303: -0.128 | AB303: -0.13400000000000001 | AC303: -0.32100000000000001 | AD303: -0.32299999999999995 | AE303: 97.65 | AF303: 98.76 | AG303: 1 | AH303: AA | AI303: 4.4400000000000002e-002 | AJ303: =H303+100*O303 -> 175.19999999999999 | AK303: 179 | AL303: 294 | AM303: 80.3 | AN303: 288 | AO303: -6.4000000000000001e-002 | AP303: 11 | AQ303: 天康转债!!
A304: 192 | B304: 123031 | C304: 晶瑞转债! | D304: 300655 | E304: 晶瑞股份 | F304: 化工 | G304: 化工 | H304: 244.5 | I304: -1.7299999999999999e-002 | J304: 1.5900000000000001e-002 | K304: 34.04 | L304: -1.5e-003 | M304: 115.8 | N304: 18.43 | O304: 0.32400000000000001 | P304: 184.7 | Q304: 转股中 | R304: 4.72年 | S304: 2.72年 | T304: 0.63 | U304: 421 | V304: 2.6600000000000001 | W304: 1.e-002 | X304: 1.8000000000000002e-002 | Y304: 64 | Z304: 5 | AA304: -0.14899999999999999 | AB304: -0.153 | AC304: -0.16 | AD304: -0.16 | AE304: 83.71 | AF304: 82.38 | AG304: 0.97 | AH304: A+ | AI304: 7.6399999999999996e-002 | AJ304: =H304+100*O304 -> 276.89999999999998 | AK304: 304.3 | AL304: 309 | AM304: 220.6 | AN304: 309 | AO304: -8.6999999999999994e-002 | AP304: 15 | AQ304: 晶瑞转债!
A305: 254 | B305: 113520 | C305: 百合转债! | D305: 603313 | E305: 梦百合 | F305: 其他 | G305: 家居用品 | H305: 226.44 | I305: -5.74e-002 | J305: 3.0099999999999998e-002 | K305: 31.7 | L305: -2.7900000000000001e-002 | M305: 114.5 | N305: 14.28 | O305: 2.e-002 | P305: 221.99 | Q305: 转股中 | R305: 3.91年 | S305: 1.91年 | T305: 0.55 | U305: 77 | V305: 0.60099999999999998 | W305: 5.0000000000000001e-003 | X305: 1.e-002 | Y305: 118 | Z305: 3.92 | AA305: -0.16200000000000001 | AB305: -0.16699999999999998 | AC305: -0.23300000000000001 | AD305: -0.23399999999999999 | AE305: 90.24 | AF305: 89.79 | AG305: 0.98 | AH305: AA- | AI305: 6.54e-002 | AJ305: =H305+100*O305 -> 228.44 | AK305: 230.9 | AL305: 304 | AM305: 140.7 | AN305: 304 | AO305: -7.0999999999999994e-002 | AP305: 12 | AQ305: 百合转债!
A306: 272 | B306: 113509 | C306: 新泉转债!! | D306: 603179 | E306: 新泉股份 | F306: 汽车 | G306: 零部件制 | H306: 203.47 | I306: -3.7400000000000003e-002 | J306: 2.7000000000000003e-002 | K306: 27.82 | L306: -1.0700000000000001e-002 | M306: 110.3 | N306: 14.22 | O306: 4.0000000000000001e-002 | P306: 195.64 | Q306: 转股中 | R306: 3.48年 | S306: 1.48年 | T306: 1.14 | U306: 32 | V306: 0.13600000000000001 | W306: 1.3000000000000001e-002 | X306: 2.5000000000000001e-002 | Y306: 88 | Z306: 4.17 | AA306: -0.16399999999999998 | AB306: -0.16800000000000001 | AC306: -0.28100000000000003 | AD306: -0.28199999999999997 | AE306: 95.76 | AF306: 95.12 | AG306: 0.97 | AH306: AA | AI306: 4.4400000000000002e-002 | AJ306: =H306+100*O306 -> 207.47 | AK306: 211.3 | AL306: 302 | AM306: 115.5 | AN306: 301 | AO306: -7.0000000000000007e-002 | AP306: 10 | AQ306: 新泉转债!!
A307: 95 | B307: 113586 | C307: 上机转债 | D307: 603185 | E307: 上机数控 | F307: 机械装备 | G307: 专用设备 | H307: 321.04 | I307: 3.5999999999999999e-003 | J307: -9.8999999999999991e-003 | K307: 111.69 | L307: -6.4000000000000003e-003 | M307: 120.8 | N307: 33.3 | O307: -4.2999999999999997e-002 | P307: 335.41 | Q307: 4.1天 | R307: 5.49年 | S307: 3.49年 | T307: 6.65 | U307: 2018. | V307: 0.91400000000000003 | W307: 2.6000000000000002e-002 | X307: 8.5999999999999993e-002 | Y307: 260 | Z307: 12.91 | AA307: -0.16500000000000001 | AB307: -0.17000000000000001 | AC307: -0.13200000000000001 | AD307: -0.13300000000000001 | AE307: 82.38 | AF307: 85.27 | AG307: 0.99 | AH307: AA- | AI307: 6.7000000000000004e-002 | AJ307: =H307+100*O307 -> 316.74000000000001 | AK307: 306.7 | AL307: 310 | AM307: 221.4 | AN307: 311 | AO307: 0.26800000000000002 | AP307: 8 | AQ307: 上机转债
A308: 307 | B308: 127004 | C308: 模塑转债!! | D308: 700 | E308: 模塑科技 | F308: 汽车 | G308: 零部件制 | H308: 177.5 | I308: -4.8300000000000003e-002 | J308: 4.4400000000000002e-002 | K308: 5.9 | L308: -2.64e-002 | M308: 113.3 | N308: 7.46 | O308: 1.24 | P308: 79.09 | Q308: 转股中 | R308: 2.47年 | S308: 0.47年 | T308: 1.33 | U308: 595 | V308: 2.4300000000000002 | W308: 2.5000000000000001e-002 | X308: 1.9e-002 | Y308: 54 | Z308: 2.08 | AA308: -0.16800000000000001 | AB308: -0.17600000000000002 | AC308: -0.69200000000000006 | AD308: -0.69499999999999995 | AE308: 99.1 | AF308: 100.43 | AG308: 0.15 | AH308: AA | AI308: 4.2999999999999997e-002 | AJ308: =H308+100*O308 -> 301.5 | AK308: 275.9 | AL308: 308 | AM308: 175.5 | AN308: 307 | AO308: -6.3e-002 | AP308: 37 | AQ308: 模塑转债!!
A309: 290 | B309: 128028 | C309: 赣锋转债!! | D309: 2460 | E309: 赣锋锂业 | F309: 有色金属 | G309: 小金属 | H309: 189.28 | I309: -2.9999999999999997e-004 | J309: -3.4999999999999996e-003 | K309: 78.7 | L309: -3.8e-003 | M309: 109.3 | N309: 41.68 | O309: 2.e-003 | P309: 188.82 | Q309: 转股中 | R309: 3年10天 | S309: 1年10天 | T309: 6.81 | U309: 231 | V309: 0.17999999999999999 | W309: 6.0000000000000001e-003 | X309: 1.2e-002 | Y309: 1049. | Z309: 11.3 | AA309: -0.16800000000000001 | AB309: -0.17199999999999999 | AC309: -0.38 | AD309: -0.38100000000000001 | AE309: 96.94 | AF309: 96.07 | AG309: 1 | AH309: AA | AI309: 4.4400000000000002e-002 | AJ309: =H309+100*O309 -> 189.47999999999999 | AK309: 189.7 | AL309: 298 | AM309: 92.8 | AN309: 295 | AO309: 1.2e-002 | AP309: 13 | AQ309: 赣锋转债!!
A310: 243 | B310: 123018 | C310: 溢利转债! | D310: 300381 | E310: 溢多利 | F310: 医药 | G310: 原料药 | H310: 251.795 | I310: -8.0000000000000004e-004 | J310: -2.0499999999999997e-002 | K310: 12.29 | L310: -2.3099999999999999e-002 | M310: 114.9 | N310: 8.32 | O310: 0.70499999999999996 | P310: 147.72 | Q310: 转股中 | R310: 4年9天 | S310: 2年9天 | T310: 0.54 | U310: 33 | V310: 0.24600000000000002 | W310: 9.0000000000000011e-003 | X310: 1.3000000000000001e-002 | Y310: 60 | Z310: 2.08 | AA310: -0.17999999999999999 | AB310: -0.185 | AC310: -0.23600000000000002 | AD310: -0.23699999999999999 | AE310: 90.16 | AF310: 89.57 | AG310: 0.92 | AH310: AA- | AI310: 6.54e-002 | AJ310: =H310+100*O310 -> 322.29499999999996 | AK310: 355.9 | AL310: 312 | AM310: 265.7 | AN310: 312 | AO310: -5.5e-002 | AP310: 12 | AQ310: 溢利转债!
A311: 318 | B311: 113008 | C311: 电气转债! | D311: 601727 | E311: 上海电气 | F311: 能源电力 | G311: 电力设备 | H311: 109.76 | I311: -1.95e-002 | J311: -6.3e-003 | K311: 5.55 | L311: -4.3099999999999999e-002 | M311: 106.6 | N311: 5.13 | O311: 1.4999999999999999e-002 | P311: 108.19 | Q311: 转股中 | R311: 53天 | S311: 回售中 | T311: 42 | U311: 146 | V311: 3.1e-002 | W311: 5.0000000000000003e-002 | X311: 5.4000000000000006e-002 | Y311: 841 | Z311: 1.3 | AA311: -0.182 | AB311: -0.249 | AC311: 回售中 | AD311: 回售中 | AE311: 103 | AF311: 106.07 | AG311: 0.6 | AH311: AAA | AI311: 3.5200000000000002e-002 | AJ311: =H311+100*O311 -> 111.26000000000001 | AK311: 111.3 | AL311: 4 | AM311: 5.3 | AN311: 2 | AO311: 3.5000000000000003e-002 | AP311: 31 | AQ311: 电气转债!
A312: 265 | B312: 128041 | C312: 盛路转债!! | D312: 2446 | E312: 盛路通信 | F312: 通信互联 | G312: 通信设备 | H312: 249 | I312: -2.35e-002 | J312: 2.35e-002 | K312: 6.72 | L312: -1.9e-002 | M312: 114.3 | N312: 6.82 | O312: 1.53 | P312: 98.53 | Q312: 转股中 | R312: 3.60年 | S312: 1.60年 | T312: 0.53 | U312: 2626. | V312: 18.449999999999999 | W312: 9.0000000000000011e-003 | X312: 9.0000000000000011e-003 | Y312: 61 | Z312: 2.03 | AA312: -0.19699999999999998 | AB312: -0.20199999999999999 | AC312: -0.307 | AD312: -0.308 | AE312: 95.27 | AF312: 98.06 | AG312: 0 | AH312: AA | AI312: 4.4400000000000002e-002 | AJ312: =H312+100*O312 -> 402. | AK312: 399.5 | AL312: 313 | AM312: 301.4 | AN312: 313 | AO312: -0.10400000000000001 | AP312: 12 | AQ312: 盛路转债!!
A313: 289 | B313: 128029 | C313: 太阳转债!! | D313: 2078 | E313: 太阳纸业 | F313: 造纸包装 | G313: 造纸行业 | H313: 169.7 | I313: -2.75e-002 | J313: 1.2999999999999999e-003 | K313: 14.51 | L313: -2.6200000000000001e-002 | M313: 107.8 | N313: 8.55 | O313: 0. | P313: 169.71 | Q313: 转股中 | R313: 2年11天 | S313: 11天 | T313: 9.48 | U313: 33 | V313: 2.e-002 | W313: 2.5000000000000001e-002 | X313: 4.2000000000000003e-002 | Y313: 380 | Z313: 2.45 | AA313: -0.20199999999999999 | AB313: -0.20800000000000002 | AC313: -2.2349999999999999 | AD313: -2.2389999999999999 | AE313: 100.18 | AF313: 99.45 | AG313: 1 | AH313: AA+ | AI313: 4.0999999999999995e-002 | AJ313: =H313+100*O313 -> 169.69999999999999 | AK313: 169.7 | AL313: 286 | AM313: 69.5 | AN313: 279 | AO313: -5.9999999999999998e-002 | AP313: 7 | AQ313: 太阳转债!!
A314: 269 | B314: 110044 | C314: 广电转债!! | D314: 600831 | E314: 广电网络 | F314: 传媒娱乐 | G314: 影视娱乐 | H314: 251.37 | I314: -2.53e-002 | J314: 2.2799999999999997e-002 | K314: 7.07 | L314: -4.1999999999999997e-003 | M314: 112.3 | N314: 6.9 | O314: 1.45 | P314: 102.46 | Q314: 转股中 | R314: 3.54年 | S314: 1.54年 | T314: 0.71 | U314: 410 | V314: 2.23 | W314: 1.3999999999999999e-002 | X314: 1.3999999999999999e-002 | Y314: 50 | Z314: 1.36 | AA314: -0.20600000000000002 | AB314: -0.21100000000000002 | AC314: -0.32100000000000001 | AD314: -0.32200000000000001 | AE314: 95.5 | AF314: 96.57 | AG314: 0.59 | AH314: AA | AI314: 4.4400000000000002e-002 | AJ314: =H314+100*O314 -> 396.37 | AK314: 400.3 | AL314: 314 | AM314: 303.7 | AN314: 314 | AO314: -2.2000000000000002e-002 | AP314: 10 | AQ314: 广电转债!!
A315: 258 | B315: 123015 | C315: 蓝盾转债!! | D315: 300297 | E315: 蓝盾股份 | F315: 计算机及 | G315: 软件开发 | H315: 259 | I315: -6.6699999999999995e-002 | J315: 6.7699999999999996e-002 | K315: 5.72 | L315: 1.4199999999999999e-002 | M315: 112.3 | N315: 5.79 | O315: 1.6200000000000001 | P315: 98.79 | Q315: 转股中 | R315: 3.67年 | S315: 1.67年 | T315: 1 | U315: 2212. | V315: 7.9800000000000004 | W315: 1.3999999999999999e-002 | X315: 1.3999999999999999e-002 | Y315: 71 | Z315: 1.86 | AA315: -0.20600000000000002 | AB315: -0.21100000000000002 | AC315: -0.29999999999999999 | AD315: -0.30099999999999999 | AE315: 91.58 | AF315: 89.4 | AG315: 0.07 | AH315: AA- | AI315: 6.54e-002 | AJ315: =H315+100*O315 -> 421. | AK315: 419.2 | AL315: 316 | AM315: 327.6 | AN315: 316 | AO315: -5.5999999999999994e-002 | AP315: 18 | AQ315: 蓝盾转债!!
A316: 242 | B316: 128052 | C316: 凯龙转债! | D316: 2783 | E316: 凯龙股份 | F316: 化工 | G316: 化工 | H316: 292.1 | I316: 7.0000000000000007e-002 | J316: -7.980000000000001e-002 | K316: 12.03 | L316: -9.8999999999999991e-003 | M316: 115 | N316: 6.67 | O316: 0.62 | P316: 180.36 | Q316: 转股中 | R316: 4年10天 | S316: 2年10天 | T316: 0.32 | U316: 3606. | V316: 36.810000000000002 | W316: 6.9999999999999993e-003 | X316: 1.3000000000000001e-002 | Y316: 45 | Z316: 2.63 | AA316: -0.20999999999999999 | AB316: -0.214 | AC316: -0.25800000000000001 | AD316: -0.25900000000000001 | AE316: 94.21 | AF316: 96.94 | AG316: 1 | AH316: AA | AI316: 4.4400000000000002e-002 | AJ316: =H316+100*O316 -> 354.10000000000002 | AK316: 403.8 | AL316: 315 | AM316: 306.9 | AN316: 315 | AO316: -6.4000000000000001e-002 | AP316: 12 | AQ316: 凯龙转债!
A317: 252 | B317: 127008 | C317: 特发转债! | D317: 70 | E317: 特发信息 | F317: 通信互联 | G317: 通信设备 | H317: 247.4 | I317: -1.24e-002 | J317: -1.4499999999999999e-002 | K317: 9.77 | L317: -2.69e-002 | M317: 110.5 | N317: 5.54 | O317: 0.40299999999999997 | P317: 176.35 | Q317: 转股中 | R317: 2.93年 | S317: 0.93年 | T317: 0.59 | U317: 1627. | V317: 10.58 | W317: 6.9999999999999993e-003 | X317: 1.3000000000000001e-002 | Y317: 80 | Z317: 2.81 | AA317: -0.24199999999999999 | AB317: -0.247 | AC317: -0.53299999999999992 | AD317: -0.53400000000000003 | AE317: 96.68 | AF317: 97.8 | AG317: 1 | AH317: AA | AI317: 4.2999999999999997e-002 | AJ317: =H317+100*O317 -> 287.69999999999999 | AK317: 318.4 | AL317: 311 | AM317: 220.6 | AN317: 310 | AO317: -5.2000000000000005e-002 | AP317: 15 | AQ317: 特发转债!
A318: 262 | B318: 123013 | C318: 横河转债! | D318: 300539 | E318: 横河模具 | F318: 机械装备 | G318: 专用设备 | H318: 421.66 | I318: -4.1700000000000001e-002 | J318: 2.4e-002 | K318: 8.23 | L318: -3.2899999999999999e-002 | M318: 115.2 | N318: 9.13 | O318: 3.6800000000000002 | P318: 90.14 | Q318: 转股中 | R318: 3.62年 | S318: 1.62年 | T318: 0.38 | U318: 3835. | V318: 22.57 | W318: 2.1000000000000001e-002 | X318: 1.9e-002 | Y318: 18 | Z318: 3.77 | AA318: -0.30499999999999999 | AB318: -0.309 | AC318: -0.38900000000000001 | AD318: -0.38900000000000001 | AE318: 90.73 | AF318: 88.79 | AG318: 0.54 | AH318: A+ | AI318: 7.6399999999999996e-002 | AJ318: =H318+100*O318 -> 789.66000000000008 | AK318: 753.2 | AL318: 317 | AM318: 662.5 | AN318: 317 | AO318: -8.5999999999999993e-002 | AP318: 15 | AQ318: 横河转债!
A319: 196 | B319: 123029 | C319: 英科转债! | D319: 300677 | E319: 英科医疗 | F319: 医药 | G319: 医疗器械 | H319: 1425 | I319: 4.7800000000000002e-002 | J319: -3.5999999999999999e-003 | K319: 148.5 | L319: 4.4500000000000005e-002 | M319: 138.2 | N319: 10.41 | O319: -1.e-003 | P319: 1426.51 | Q319: 转股中 | R319: 4.68年 | S319: 2.68年 | T319: 1.27 | U319: 1276. | V319: 0.70999999999999996 | W319: 3.0000000000000001e-003 | X319: 3.7000000000000005e-002 | Y319: 495 | Z319: 5.47 | AA319: -0.39799999999999996 | AB319: -0.40100000000000002 | AC319: -0.26500000000000001 | AD319: -0.26500000000000001 | AE319: 89.88 | AF319: 103.81 | AG319: 0.99 | AH319: AA- | AI319: 6.54e-002 | AJ319: =H319+100*O319 -> 1424.9000000000001 | AK319: 1423.5 | AL319: 318 | AM319: 1319.7 | AN319: 318 | AO319: 0.17800000000000002 | AP319: 16 | AQ319: 英科转债!