A1: 序号 | B1: 转债名称 | C1: 转债代码 | D1: 进展/上市日期 | E1: 股票名称 | F1: 股票代码 | G1: 行业 | H1: 子行业 | I1: 转债价格 | J1: 涨跌 | K1: 日内套利 | L1: 股价 | M1: 涨跌 | N1: 转债成交额 | O1: 转债换手率 | P1: 剩余本息 | Q1: 转股价格 | R1: P/B | S1: 转股价值 | T1: 转股溢价率 | U1: 距离转股日 | V1: 剩余年限 | W1: 回售年限 | X1: 余额/市值 | Y1: 余额/股本 | Z1: 转债余额 | AA1: 股票市值 | AB1: 税前收益率 | AC1: 税后收益率 | AD1: 税前回售收益 | AE1: 税后回售收益 | AF1: 回售价值 | AG1: 纯债价值 | AH1: 弹性 | AI1: 信用 | AJ1: 折现率 | AK1: 双低 | AL1: 老式双低 | AM1: 老式排名 | AN1: 新式双低 | AO1: 新式排名 | AP1: MA20乖离 | AQ1: 热门度 | AR1: 转债名称
A2: 199 | B2: 亚药转债! | C2: 128062 | D2: 43579. | E2: 亚太药业 | F2: 2370 | G2: 医药 | H2: 化学制药 | I2: 79.025 | J2: 4.0999999999999995e-003 | K2: -4.0999999999999995e-003 | L2: 5.22 | M2: 0. | N2: 4.8 | O2: 6.0000000000000001e-003 | P2: 119.8 | Q2: 16.25 | R2: 7.48 | S2: 32.12 | T2: 1.46 | U2: 转股中 | V2: 4.47年 | W2: 2.47年 | X2: 0.34399999999999997 | Y2: 0.111 | Z2: 9.6 | AA2: 28 | AB2: 9.9499999999999991e-002 | AC2: 9.0800000000000006e-002 | AD2: 0.10800000000000001 | AE2: 0.105 | AF2: 81.26 | AG2: 80.11 | AH2: 0 | AI2: A- | AJ2: 9.6099999999999991e-002 | AK2: =I2+100*T2 -> 225.02500000000001 | AL2: 125.9 | AM2: 75 | AN2: 44.7 | AO2: 178 | AP2: -8.1000000000000003e-002 | AQ2: 86 | AR2: 亚药转债!
A3: 219 | B3: 维格转债! | C3: 113527 | D3: 43515. | E3: 锦泓集团 | F3: 603518 | G3: 服装纺织 | H3: 服装行业 | I3: 90.25 | J3: 6.0000000000000001e-003 | K3: -1.9e-003 | L3: 6.59 | M3: 2.4900000000000002e-002 | N3: 6.6 | O3: 1.e-002 | P3: 120.2 | Q3: 9.85 | R3: 0.67 | S3: 66.9 | T3: 0.34899999999999998 | U3: 转股中 | V3: 4.29年 | W3: 2.29年 | X3: 0.44900000000000001 | Y3: 0.29999999999999999 | Z3: 7.5 | AA3: 17 | AB3: 7.0699999999999999e-002 | AC3: 6.1799999999999994e-002 | AD3: 5.8299999999999998e-002 | AE3: 5.5099999999999996e-002 | AF3: 91.11 | AG3: 96.37 | AH3: 0.16 | AI3: AA | AJ3: 5.4100000000000002e-002 | AK3: =I3+100*T3 -> 125.15000000000001 | AL3: 113.6 | AM3: 2 | AN3: 17.2 | AO3: 3 | AP3: -3.4000000000000002e-002 | AQ3: 100 | AR3: 维格转债!
A4: 49 | B4: 本钢转债! | C4: 127018 | D4: 44047. | E4: 本钢板材 | F4: 761 | G4: 钢铁 | H4: 炼钢 | I4: 96.497 | J4: 1.e-003 | K4: 5.9999999999999995e-004 | L4: 3.49 | M4: 8.6999999999999994e-003 | N4: 25 | O4: 4.0000000000000001e-003 | P4: 128.6 | Q4: 5.03 | R4: 0.68 | S4: 69.38 | T4: 0.39100000000000001 | U4: 2月25天 | V4: 5.72年 | W4: 3.72年 | X4: 0.503 | Y4: 0.34899999999999998 | Z4: 68 | AA4: 135 | AB4: 5.3099999999999994e-002 | AC4: 4.4299999999999999e-002 | AD4: 2.5899999999999999e-002 | AE4: 2.2599999999999999e-002 | AF4: 91.4 | AG4: 103.11 | AH4: 0.18 | AI4: AAA | AJ4: 4.0599999999999997e-002 | AK4: =I4+100*T4 -> 135.59700000000001 | AL4: 123.6 | AM4: 56 | AN4: 20.5 | AO4: 5 | AP4: 1.3999999999999999e-002 | AQ4: 28 | AR4: 本钢转债!
A5: 276 | B5: 亚太转债! | C5: 128023 | D5: 43095. | E5: 亚太股份 | F5: 2284 | G5: 汽车 | H5: 零部件制 | I5: 96.218 | J5: 3.3e-003 | K5: -2.7000000000000001e-003 | L5: 5.08 | M5: 6.0499999999999998e-002 | N5: 1.7 | O5: 2.e-003 | P5: 112.3 | Q5: 10.34 | R5: 1.55 | S5: 49.13 | T5: 0.95799999999999996 | U5: 转股中 | V5: 3年54天 | W5: 1年54天 | X5: 0.26700000000000002 | Y5: 0.13100000000000001 | Z5: 10 | AA5: 37 | AB5: 5.1500000000000004e-002 | AC5: 4.3799999999999999e-002 | AD5: 5.2199999999999996e-002 | AE5: 4.7699999999999992e-002 | AF5: 97.19 | AG5: 98.34 | AH5: 0.01 | AI5: AA | AJ5: 4.41e-002 | AK5: =I5+100*T5 -> 192.018 | AL5: 143.3 | AM5: 222 | AN5: 45 | AO5: 181 | AP5: -1.4999999999999999e-002 | AQ5: 64 | AR5: 亚太转债!
A6: 257 | B6: 岩土转债! | C6: 128037 | D6: 43215. | E6: 中化岩土 | F6: 2542 | G6: 建筑 | H6: 建筑工程 | I6: 98.09 | J6: 8.0000000000000004e-004 | K6: -7.000000000000001e-004 | L6: 3.55 | M6: 3.2000000000000001e-002 | N6: 1.8 | O6: 3.0000000000000001e-003 | P6: 112.3 | Q6: 7.99 | R6: 1.6 | S6: 44.43 | T6: 1.21 | U6: 转股中 | V6: 3.43年 | W6: 1.43年 | X6: 9.3000000000000013e-002 | Y6: 4.2000000000000003e-002 | Z6: 6 | AA6: 64 | AB6: 4.1100000000000005e-002 | AC6: 3.4200000000000001e-002 | AD6: 3.0200000000000001e-002 | AE6: 2.6600000000000002e-002 | AF6: 96.03 | AG6: 97.16 | AH6: 0 | AI6: AA | AJ6: 4.41e-002 | AK6: =I6+100*T6 -> 219.09 | AL6: 151.7 | AM6: 256 | AN6: 54.6 | AO6: 225 | AP6: -2.e-002 | AQ6: 47 | AR6: 岩土转债!
A7: 38 | B7: 国城转债 | C7: 127019 | D7: 44053. | E7: 国城矿业 | F7: 688 | G7: 有色金属 | H7: 锌铅镍锡 | I7: 91.9 | J7: 1.7899999999999999e-002 | K7: -4.7899999999999998e-002 | L7: 15.09 | M7: -0.10000000000000001 | N7: 130 | O7: 0.16800000000000001 | P7: 115.1 | Q7: 21.07 | R7: 7.84 | S7: 71.62 | T7: 0.28300000000000003 | U7: 3月12天 | V7: 5.76年 | W7: 3.76年 | X7: 5.0000000000000003e-002 | Y7: 3.5000000000000003e-002 | Z7: 8.5 | AA7: 172 | AB7: 4.0599999999999997e-002 | AC7: 3.56e-002 | AD7: 3.1200000000000002e-002 | AE7: 2.9399999999999999e-002 | AF7: 87.09 | AG7: 89.44 | AH7: 0.3 | AI7: AA | AJ7: 4.5599999999999995e-002 | AK7: =I7+100*T7 -> 120.20000000000002 | AL7: 112.2 | AM7: 1 | AN7: 22.7 | AO7: 9 | AP7: -0.32400000000000001 | AQ7: 21 | AR7: 国城转债
A8: 80 | B8: 纵横转债! | C8: 113573 | D8: 43973. | E8: 纵横通信 | F8: 603602 | G8: 通信互联 | H8: 通信设备 | I8: 100.84 | J8: -1.1200000000000002e-002 | K8: 2.64e-002 | L8: 12.93 | M8: 4.7e-002 | N8: 23 | O8: 8.4000000000000005e-002 | P8: 124.7 | Q8: 18.81 | R8: 3.91 | S8: 68.74 | T8: 0.46700000000000003 | U8: 12天 | V8: 5.52年 | W8: 3.52年 | X8: 0.10199999999999999 | Y8: 7.0000000000000007e-002 | Z8: 2.7 | AA8: 26 | AB8: 4.0199999999999993e-002 | AC8: 3.2300000000000002e-002 | AD8: 1.0200000000000001e-002 | AE8: 7.7000000000000002e-003 | AF8: 79.73 | AG8: 83.39 | AH8: 0.32 | AI8: A+ | AJ8: 7.7600000000000002e-002 | AK8: =I8+100*T8 -> 147.54000000000002 | AL8: 132.9 | AM8: 144 | AN8: 49.6 | AO8: 199 | AP8: -3.3000000000000002e-002 | AQ8: 13 | AR8: 纵横转债!
A9: 284 | B9: 小康转债! | C9: 113016 | D9: 43060. | E9: 小康股份 | F9: 601127 | G9: 汽车 | H9: 零部件制 | I9: 98.19 | J9: 1.9e-003 | K9: -1.7000000000000001e-003 | L9: 8.59 | M9: 2.87e-002 | N9: 1.4 | O9: 2.e-003 | P9: 110.3 | Q9: 15.7 | R9: 1.74 | S9: 54.71 | T9: 0.79500000000000004 | U9: 转股中 | V9: 3年26天 | W9: 1年26天 | X9: 8.1000000000000003e-002 | Y9: 4.4999999999999998e-002 | Z9: 8.8 | AA9: 108 | AB9: 3.9599999999999996e-002 | AC9: 3.2899999999999999e-002 | AD9: 3.8199999999999998e-002 | AE9: 3.3500000000000002e-002 | AF9: 97.51 | AG9: 96.92 | AH9: 0.01 | AI9: AA | AJ9: 4.41e-002 | AK9: =I9+100*T9 -> 177.69 | AL9: 141.7 | AM9: 214 | AN9: 44.2 | AO9: 172 | AP9: -3.0000000000000001e-003 | AQ9: 45 | AR9: 小康转债!
A10: 197 | B10: 未来转债 | C10: 128063 | D10: 43579. | E10: 德尔未来 | F10: 2631 | G10: 其他 | H10: 家居用品 | I10: 108.41 | J10: 2.8000000000000004e-003 | K10: 7.4999999999999997e-003 | L10: 7.18 | M10: 2.87e-002 | N10: 1 | O10: 1.e-003 | P10: 128.2 | Q10: 8.61 | R10: 2.72 | S10: 83.39 | T10: 0.29999999999999999 | U10: 转股中 | V10: 4.48年 | W10: 3.48年 | X10: 0.13100000000000001 | Y10: 0.109 | Z10: 6.3 | AA10: 48 | AB10: 3.9300000000000002e-002 | AC10: 2.8399999999999998e-002 | AD10: 1.1999999999999999e-003 | AE10: -3.4000000000000002e-003 | AF10: 86.98 | AG10: 97.46 | AH10: 0.36 | AI10: AA- | AJ10: 6.5099999999999991e-002 | AK10: =I10+100*T10 -> 138.41 | AL10: 133.4 | AM10: 150 | AN10: 36 | AO10: 86 | AP10: -3.4000000000000002e-002 | AQ10: 35 | AR10: 未来转债
A11: 127 | B11: 百川转债! | C11: 128093 | D11: 43851. | E11: 百川股份 | F11: 2455 | G11: 化工 | H11: 化工 | I11: 108.52 | J11: 6.0000000000000001e-003 | K11: 5.3e-003 | L11: 5.13 | M11: 2.4e-002 | N11: 3.6 | O11: 6.0000000000000001e-003 | P11: 130.3 | Q11: 5.87 | R11: 2.09 | S11: 87.39 | T11: 0.24199999999999999 | U11: 转股中 | V11: 5.23年 | W11: 3.23年 | X11: 0.19600000000000001 | Y11: 0.17100000000000001 | Z11: 5.2 | AA11: 27 | AB11: 3.6900000000000002e-002 | AC11: 2.7000000000000003e-002 | AD11: -3.2000000000000002e-003 | AE11: -7.3000000000000001e-003 | AF11: 86.63 | AG11: 94.13 | AH11: 0.47 | AI11: AA- | AJ11: 6.6600000000000006e-002 | AK11: =I11+100*T11 -> 132.72 | AL11: 129.6 | AM11: 108 | AN11: 35.5 | AO11: 77 | AP11: -1.e-002 | AQ11: 44 | AR11: 百川转债!
A12: 202 | B12: 大丰转债! | C12: 113530 | D12: 43573. | E12: 大丰实业 | F12: 603081 | G12: 建筑 | H12: 装饰工程 | I12: 103.98 | J12: 3.2000000000000002e-003 | K12: 7.000000000000001e-004 | L12: 11.79 | M12: 2.52e-002 | N12: 0.7 | O12: 1.e-003 | P12: 121.6 | Q12: 16.64 | R12: 2.41 | S12: 70.85 | T12: 0.46799999999999997 | U12: 转股中 | V12: 4.46年 | W12: 2.46年 | X12: 0.13300000000000001 | Y12: 9.4e-002 | Z12: 6.3 | AA12: 47 | AB12: 3.6499999999999998e-002 | AC12: 2.7799999999999998e-002 | AD12: -1.7000000000000001e-003 | AE12: -4.3e-003 | AF12: 92.54 | AG12: 100.72 | AH12: 0.16 | AI12: AA | AJ12: 4.41e-002 | AK12: =I12+100*T12 -> 150.78 | AL12: 137.1 | AM12: 177 | AN12: 36.4 | AO12: 91 | AP12: -2.9999999999999999e-002 | AQ12: 34 | AR12: 大丰转债!
A13: 248 | B13: 海澜转债! | C13: 110045 | D13: 43312. | E13: 海澜之家 | F13: 600398 | G13: 服装纺织 | H13: 服装行业 | I13: 97.71 | J13: 3.2000000000000002e-003 | K13: -5.0000000000000001e-004 | L13: 6.63 | M13: 6.4199999999999993e-002 | N13: 2.7 | O13: 1.e-003 | P13: 111.1 | Q13: 11.75 | R13: 2.35 | S13: 56.43 | T13: 0.73199999999999998 | U13: 转股中 | V13: 3.75年 | W13: 1.75年 | X13: 0.10300000000000001 | Y13: 5.7999999999999996e-002 | Z13: 29 | AA13: 286 | AB13: 3.5299999999999998e-002 | AC13: 2.9600000000000001e-002 | AD13: 2.2799999999999997e-002 | AE13: 2.07e-002 | AF13: 94.29 | AG13: 95.37 | AH13: 0.04 | AI13: AA+ | AJ13: 4.2099999999999999e-002 | AK13: =I13+100*T13 -> 170.91 | AL13: 139 | AM13: 191 | AN13: 43.6 | AO13: 163 | AP13: 9.0000000000000011e-003 | AQ13: 59 | AR13: 海澜转债!
A14: 288 | B14: 久其转债! | C14: 128015 | D14: 42934. | E14: 久其软件 | F14: 2279 | G14: 计算机及 | H14: 软件开发 | I14: 101.461 | J14: 1.6000000000000001e-003 | K14: -1.1000000000000001e-003 | L14: 6.24 | M14: 2.1299999999999999e-002 | N14: 1.8 | O14: 2.e-003 | P14: 110.8 | Q14: 9.48 | R14: 6.1 | S14: 65.82 | T14: 0.54100000000000004 | U14: 转股中 | V14: 2.66年 | W14: 0.66年 | X14: 0.17600000000000002 | Y14: 0.11599999999999999 | Z14: 7.8 | AA14: 44 | AB14: 3.4200000000000001e-002 | AC14: 2.64e-002 | AD14: 1.1000000000000001e-003 | AE14: -2.5999999999999999e-003 | AF14: 95.69 | AG14: 91.71 | AH14: 0.02 | AI14: A+ | AJ14: 7.4900000000000008e-002 | AK14: =I14+100*T14 -> 155.56100000000001 | AL14: 137.1 | AM14: 176 | AN14: 41.4 | AO14: 148 | AP14: -3.7000000000000005e-002 | AQ14: 54 | AR14: 久其转债!
A15: 186 | B15: 大业转债! | C15: 113535 | D15: 43619. | E15: 大业股份 | F15: 603278 | G15: 汽车 | H15: 零部件制 | I15: 100.49 | J15: 2.3e-003 | K15: 0. | L15: 8.53 | M15: 1.55e-002 | N15: 3.3 | O15: 6.9999999999999993e-003 | P15: 113.1 | Q15: 12.4 | R15: 1.55 | S15: 68.79 | T15: 0.46100000000000002 | U15: 转股中 | V15: 3.58年 | W15: 1.58年 | X15: 0.20199999999999999 | Y15: 0.13900000000000001 | Z15: 5 | AA15: 25 | AB15: 3.4099999999999998e-002 | AC15: 2.7099999999999999e-002 | AD15: 7.8000000000000005e-003 | AE15: 5.6999999999999993e-003 | AF15: 94.51 | AG15: 97.12 | AH15: 0.15 | AI15: AA | AJ15: 4.41e-002 | AK15: =I15+100*T15 -> 146.59 | AL15: 132.2 | AM15: 131 | AN15: 35.1 | AO15: 72 | AP15: -3.5000000000000003e-002 | AQ15: 49 | AR15: 大业转债!
A16: 281 | B16: 嘉澳转债! | C16: 113502 | D16: 43066. | E16: 嘉澳环保 | F16: 603822 | G16: 化工 | H16: 化工 | I16: 101.65 | J16: 5.0000000000000001e-004 | K16: -4.0000000000000002e-004 | L16: 24.74 | M16: 1.5600000000000001e-002 | N16: 2.4 | O16: 1.3000000000000001e-002 | P16: 112.3 | Q16: 44.79 | R16: 2.45 | S16: 55.24 | T16: 0.83999999999999997 | U16: 转股中 | V16: 3年30天 | W16: 1年30天 | X16: 0.10199999999999999 | Y16: 5.5999999999999994e-002 | Z16: 1.9 | AA16: 18 | AB16: 3.3599999999999998e-002 | AC16: 2.6000000000000002e-002 | AD16: 9.1000000000000004e-003 | AE16: 4.6999999999999993e-003 | AF16: 95.1 | AG16: 92.89 | AH16: 0.01 | AI16: AA- | AJ16: 6.5099999999999991e-002 | AK16: =I16+100*T16 -> 185.65000000000001 | AL16: 148.1 | AM16: 241 | AN16: 53 | AO16: 220 | AP16: -4.0000000000000001e-002 | AQ16: 28 | AR16: 嘉澳转债!
A17: 13 | B17: 新星转债 | C17: 113600 | D17: 44085. | E17: 深圳新星 | F17: 603978 | G17: 有色金属 | H17: 有色行业 | I17: 105 | J17: 1.1699999999999999e-002 | K17: -2.8000000000000004e-003 | L17: 20.58 | M17: 1.7299999999999999e-002 | N17: 8.8 | O17: 1.3999999999999999e-002 | P17: 126 | Q17: 23.85 | R17: 2.17 | S17: 86.29 | T17: 0.217 | U17: 4月11天 | V17: 5.84年 | W17: 3.84年 | X17: 0.18100000000000002 | Y17: 0.156 | Z17: 6 | AA17: 33 | AB17: 3.2300000000000002e-002 | AC17: 2.4700000000000003e-002 | AD17: -2.5999999999999999e-003 | AE17: -4.5000000000000005e-003 | AF17: 80.46 | AG17: 87.08 | AH17: 0.51 | AI17: AA- | AJ17: 6.6600000000000006e-002 | AK17: =I17+100*T17 -> 126.7 | AL17: 123.7 | AM17: 57 | AN17: 36.6 | AO17: 93 | AP17: -5.0000000000000003e-002 | AQ17: 8 | AR17: 新星转债
A18: 110 | B18: 科达转债! | C18: 113569 | D18: 43929. | E18: 苏州科达 | F18: 603660 | G18: 通信互联 | H18: 物联网 | I18: 102.09 | J18: 4.7999999999999996e-003 | K18: 7.000000000000001e-004 | L18: 9.12 | M18: 2.7000000000000003e-002 | N18: 1.1 | O18: 2.e-003 | P18: 120.7 | Q18: 14.84 | R18: 2.69 | S18: 61.46 | T18: 0.66099999999999992 | U18: 转股中 | V18: 5.41年 | W18: 3.41年 | X18: 0.113 | Y18: 7.0000000000000007e-002 | Z18: 5.2 | AA18: 46 | AB18: 3.2099999999999997e-002 | AC18: 2.52e-002 | AD18: 5.3e-003 | AE18: 3.0999999999999999e-003 | AF18: 82.84 | AG18: 85.81 | AH18: 0.2 | AI18: AA- | AJ18: 6.6600000000000006e-002 | AK18: =I18+100*T18 -> 168.19 | AL18: 142.7 | AM18: 220 | AN18: 56.9 | AO18: 236 | AP18: 3.0000000000000001e-003 | AQ18: 21 | AR18: 科达转债!
A19: 290 | B19: 永东转债! | C19: 128014 | D19: 42934. | E19: 永东股份 | F19: 2753 | G19: 化工 | H19: 化工 | I19: 103 | J19: 7.000000000000001e-004 | K19: 1.2999999999999999e-003 | L19: 9.02 | M19: 2.1499999999999998e-002 | N19: 2.6 | O19: 8.0000000000000002e-003 | P19: 111.3 | Q19: 12.6 | R19: 1.96 | S19: 71.59 | T19: 0.439 | U19: 转股中 | V19: 2.52年 | W19: 0.52年 | X19: 0.10000000000000001 | Y19: 7.0999999999999994e-002 | Z19: 3.4 | AA19: 34 | AB19: 3.1899999999999998e-002 | AC19: 2.3199999999999998e-002 | AD19: -1.7100000000000001e-002 | AE19: -2.2200000000000001e-002 | AF19: 97.6 | AG19: 95.51 | AH19: 0.09 | AI19: AA- | AJ19: 6.3899999999999998e-002 | AK19: =I19+100*T19 -> 146.90000000000001 | AL19: 134.4 | AM19: 160 | AN19: 36.8 | AO19: 95 | AP19: -2.e-003 | AQ19: 39 | AR19: 永东转债!
A20: 215 | B20: 长城转债! | C20: 113528 | D20: 43544. | E20: 长城科技 | F20: 603897 | G20: 机械装备 | H20: 专用设备 | I20: 103.25 | J20: 3.0000000000000001e-003 | K20: 6.0000000000000001e-003 | L20: 18.74 | M20: 2.29e-002 | N20: 1.2 | O20: 2.e-003 | P20: 117.6 | Q20: 23.45 | R20: 1.82 | S20: 79.91 | T20: 0.29199999999999998 | U20: 转股中 | V20: 4.39年 | W20: 2.39年 | X20: 0.19 | Y20: 0.152 | Z20: 6.3 | AA20: 33 | AB20: 3.0800000000000001e-002 | AC20: 2.35e-002 | AD20: 2.5999999999999999e-003 | AE20: -4.0000000000000002e-004 | AF20: 88.67 | AG20: 89.79 | AH20: 0.39 | AI20: AA- | AJ20: 6.5099999999999991e-002 | AK20: =I20+100*T20 -> 132.44999999999999 | AL20: 126.6 | AM20: 83 | AN20: 36.8 | AO20: 94 | AP20: -1.8000000000000002e-002 | AQ20: 44 | AR20: 长城转债!
A21: 267 | B21: 吉视转债! | C21: 113017 | D21: 43115. | E21: 吉视传媒 | F21: 601929 | G21: 传媒娱乐 | H21: 影视娱乐 | I21: 100.02 | J21: 0. | K21: 3.4000000000000002e-003 | L21: 2.2 | M21: 1.8500000000000003e-002 | N21: 14 | O21: 9.0000000000000011e-003 | P21: 109.8 | Q21: 2.95 | R21: 1.03 | S21: 74.58 | T21: 0.34100000000000003 | U21: 转股中 | V21: 3.21年 | W21: 1.21年 | X21: 0.22800000000000001 | Y21: 0.17000000000000001 | Z21: 16 | AA21: 68 | AB21: 3.0099999999999998e-002 | AC21: 2.41e-002 | AD21: 1.8500000000000003e-002 | AE21: 1.47e-002 | AF21: 96.94 | AG21: 96.45 | AH21: 0.18 | AI21: AA+ | AJ21: 4.2099999999999999e-002 | AK21: =I21+100*T21 -> 134.12 | AL21: 125.5 | AM21: 71 | AN21: 28.5 | AO21: 25 | AP21: -3.5000000000000003e-002 | AQ21: 50 | AR21: 吉视转债!
A22: 246 | B22: 德尔转债! | C22: 123011 | D22: 43326. | E22: 德尔股份 | F22: 300473 | G22: 汽车 | H22: 零部件制 | I22: 104.33 | J22: 3.3e-003 | K22: 3.0000000000000001e-003 | L22: 28.24 | M22: 1.66e-002 | N22: 2.2 | O22: 8.0000000000000002e-003 | P22: 116.3 | Q22: 34.54 | R22: 1.45 | S22: 81.76 | T22: 0.27600000000000002 | U22: 转股中 | V22: 3.77年 | W22: 1.77年 | X22: 7.8e-002 | Y22: 6.4000000000000001e-002 | Z22: 2.5 | AA22: 32 | AB22: 2.98e-002 | AC22: 2.18e-002 | AD22: -7.7000000000000002e-003 | AE22: -1.0500000000000001e-002 | AF22: 91.08 | AG22: 92.1 | AH22: 0.38 | AI22: AA- | AJ22: 6.5099999999999991e-002 | AK22: =I22+100*T22 -> 131.93000000000001 | AL22: 126.9 | AM22: 88 | AN22: 34.8 | AO22: 67 | AP22: -3.3000000000000002e-002 | AQ22: 34 | AR22: 德尔转债!
A23: 159 | B23: 浦发转债! | C23: 110059 | D23: 43784. | E23: 浦发银行 | F23: 600000 | G23: 金融 | H23: 银行行业 | I23: 102 | J23: -4.5000000000000005e-003 | K23: 5.0000000000000001e-003 | L23: 9.42 | M23: 3.2000000000000002e-003 | N23: 128 | O23: 3.0000000000000001e-003 | P23: 117.8 | Q23: 14.45 | R23: 0.55 | S23: 65.19 | T23: 0.56499999999999995 | U23: 转股中 | V23: 5年17天 | W23: 无权 | X23: 0.18100000000000002 | Y23: 0.11800000000000001 | Z23: 500 | AA23: 2765. | AB23: 2.98e-002 | AC23: 2.3199999999999998e-002 | AD23: 无权 | AE23: 无权 | AF23: 无权 | AG23: 96.91 | AH23: 0.16 | AI23: AAA | AJ23: 4.0599999999999997e-002 | AK23: =I23+100*T23 -> 158.5 | AL23: 138.8 | AM23: 188 | AN23: 41.9 | AO23: 150 | AP23: -3.9e-002 | AQ23: 75 | AR23: 浦发转债!
A24: 47 | B24: 胜达转债! | C24: 113591 | D24: 44035. | E24: 大胜达 | F24: 603687 | G24: 造纸包装 | H24: 包装用纸 | I24: 103.73 | J24: 1.e-002 | K24: 1.9e-003 | L24: 12.03 | M24: 2.4700000000000003e-002 | N24: 3.3 | O24: 6.0000000000000001e-003 | P24: 122.2 | Q24: 14.73 | R24: 3.21 | S24: 81.67 | T24: 0.27000000000000002 | U24: 2月29天 | V24: 5.72年 | W24: 3.72年 | X24: 0.111 | Y24: 9.0999999999999998e-002 | Z24: 5.5 | AA24: 49 | AB24: 2.9700000000000001e-002 | AC24: 2.2799999999999997e-002 | AD24: 1.e-003 | AE24: -1.1000000000000001e-003 | AF24: 81.26 | AG24: 85.17 | AH24: 0.48 | AI24: AA- | AJ24: 6.6600000000000006e-002 | AK24: =I24+100*T24 -> 130.73000000000002 | AL24: 125.8 | AM24: 74 | AN24: 40.6 | AO24: 138 | AP24: -6.5000000000000002e-002 | AQ24: 20 | AR24: 胜达转债!
A25: 111 | B25: 新春转债 | C25: 113568 | D25: 43923. | E25: 五洲新春 | F25: 603667 | G25: 机械装备 | H25: 通用设备 | I25: 107.21 | J25: 1.2800000000000001e-002 | K25: 2.7000000000000001e-003 | L25: 8.22 | M25: 2.75e-002 | N25: 2 | O25: 6.0000000000000001e-003 | P25: 124.8 | Q25: 8.91 | R25: 1.4 | S25: 92.26 | T25: 0.16200000000000001 | U25: 转股中 | V25: 5.40年 | W25: 3.40年 | X25: 0.13699999999999998 | Y25: 0.127 | Z25: 3.3 | AA25: 24 | AB25: 2.92e-002 | AC25: 2.12e-002 | AD25: -6.7000000000000002e-003 | AE25: -9.1999999999999998e-003 | AF25: 83.46 | AG25: 88.86 | AH25: 0.57 | AI25: AA- | AJ25: 6.6600000000000006e-002 | AK25: =I25+100*T25 -> 123.41 | AL25: 122.2 | AM25: 41 | AN25: 33.3 | AO25: 59 | AP25: -2.8999999999999998e-002 | AQ25: 40 | AR25: 新春转债
A26: 214 | B26: 中信转债! | C26: 113021 | D26: 43543. | E26: 中信银行 | F26: 601998 | G26: 金融 | H26: 银行行业 | I26: 105.31 | J26: -5.0000000000000001e-004 | K26: 1.2999999999999999e-003 | L26: 5.07 | M26: 4.0000000000000001e-003 | N26: 15 | O26: 0. | P26: 118.8 | Q26: 6.98 | R26: 0.55 | S26: 72.64 | T26: 0.45000000000000001 | U26: 转股中 | V26: 4.39年 | W26: 无权 | X26: 0.161 | Y26: 0.11699999999999999 | Z26: 400 | AA26: 2481. | AB26: 2.87e-002 | AC26: 2.0799999999999999e-002 | AD26: 无权 | AE26: 无权 | AF26: 无权 | AG26: 100.89 | AH26: 0.2 | AI26: AAA | AJ26: 3.9100000000000003e-002 | AK26: =I26+100*T26 -> 150.31 | AL26: 138 | AM26: 183 | AN26: 37.1 | AO26: 100 | AP26: -6.9999999999999993e-003 | AQ26: 53 | AR26: 中信转债!
A27: 20 | B27: 佳力转债! | C27: 113597 | D27: 44064. | E27: 佳力图 | F27: 603912 | G27: 机械装备 | H27: 专用设备 | I27: 106.31 | J27: 7.9000000000000008e-003 | K27: 5.3e-003 | L27: 17.26 | M27: 3.6000000000000004e-002 | N27: 0.7 | O27: 2.e-003 | P27: 124.5 | Q27: 23.4 | R27: 4.57 | S27: 73.76 | T27: 0.441 | U27: 3月27天 | V27: 5.80年 | W27: 3.80年 | X27: 8.0000000000000002e-002 | Y27: 5.9000000000000004e-002 | Z27: 3 | AA27: 37 | AB27: 2.8199999999999999e-002 | AC27: 2.0899999999999998e-002 | AD27: -4.5999999999999999e-003 | AE27: -6.7000000000000002e-003 | AF27: 81.08 | AG27: 86.34 | AH27: 0.37 | AI27: AA- | AJ27: 6.6600000000000006e-002 | AK27: =I27+100*T27 -> 150.41 | AL27: 138.9 | AM27: 189 | AN27: 52.5 | AO27: 217 | AP27: -5.2000000000000005e-002 | AQ27: 4 | AR27: 佳力转债!
A28: 84 | B28: 凌钢转债! | C28: 110070 | D28: 43964. | E28: 凌钢股份 | F28: 600231 | G28: 钢铁 | H28: 炼钢 | I28: 101.55 | J28: 1.4000000000000002e-003 | K28: 3.9000000000000003e-003 | L28: 2.22 | M28: 1.37e-002 | N28: 1 | O28: 2.e-003 | P28: 117.8 | Q28: 2.75 | R28: 0.79 | S28: 80.73 | T28: 0.25800000000000001 | U28: 6.1天 | V28: 5.50年 | W28: 3.50年 | X28: 7.2000000000000008e-002 | Y28: 5.7999999999999996e-002 | Z28: 4.4 | AA28: 62 | AB28: 2.7900000000000001e-002 | AC28: 2.2000000000000002e-002 | AD28: 6.8999999999999999e-003 | AE28: 4.6999999999999993e-003 | AF28: 88.57 | AG28: 92.65 | AH28: 0.39 | AI28: AA | AJ28: 4.5599999999999995e-002 | AK28: =I28+100*T28 -> 127.34999999999999 | AL28: 122.4 | AM28: 43 | AN28: 29.7 | AO28: 32 | AP28: -2.9999999999999999e-002 | AQ28: 12 | AR28: 凌钢转债!
A29: 137 | B29: 建工转债! | C29: 110064 | D29: 43846. | E29: 重庆建工 | F29: 600939 | G29: 建筑 | H29: 建筑工程 | I29: 104.89 | J29: 5.9999999999999995e-004 | K29: 3.5999999999999999e-003 | L29: 3.96 | M29: 1.0200000000000001e-002 | N29: 5.9 | O29: 3.0000000000000001e-003 | P29: 120.2 | Q29: 4.57 | R29: 1.03 | S29: 86.65 | T29: 0.20999999999999999 | U29: 转股中 | V29: 5.19年 | W29: 3.19年 | X29: 0.23100000000000001 | Y29: 0.20000000000000001 | Z29: 17 | AA29: 72 | AB29: 2.7200000000000002e-002 | AC29: 2.0199999999999999e-002 | AD29: -1.e-003 | AE29: -3.5999999999999999e-003 | AF29: 90.73 | AG29: 96.83 | AH29: 0.41 | AI29: AA+ | AJ29: 4.36e-002 | AK29: =I29+100*T29 -> 125.89 | AL29: 123.1 | AM29: 51 | AN29: 26.3 | AO29: 17 | AP29: -2.7999999999999997e-002 | AQ29: 46 | AR29: 建工转债!
A30: 51 | B30: 天创转债! | C30: 113589 | D30: 44028. | E30: 天创时尚 | F30: 603608 | G30: 服装纺织 | H30: 鞋服行业 | I30: 99.22 | J30: 4.0000000000000002e-004 | K30: 4.1999999999999997e-003 | L30: 8.31 | M30: 2.0899999999999998e-002 | N30: 1.7 | O30: 3.0000000000000001e-003 | P30: 115.3 | Q30: 12.64 | R30: 1.63 | S30: 65.74 | T30: 0.50900000000000001 | U30: 2月23天 | V30: 5.70年 | W30: 3.70年 | X30: 0.16800000000000001 | Y30: 0.11 | Z30: 6 | AA30: 36 | AB30: 2.7200000000000002e-002 | AC30: 2.2200000000000001e-002 | AD30: 1.18e-002 | AE30: 9.8999999999999991e-003 | AF30: 87.5 | AG30: 89.86 | AH30: 0.22 | AI30: AA | AJ30: 4.5599999999999995e-002 | AK30: =I30+100*T30 -> 150.12 | AL30: 132.7 | AM30: 141 | AN30: 42.8 | AO30: 158 | AP30: -5.0999999999999997e-002 | AQ30: 7 | AR30: 天创转债!
A31: 205 | B31: 迪森转债! | C31: 123023 | D31: 43571. | E31: 迪森股份 | F31: 300335 | G31: 能源电力 | H31: 电力供应 | I31: 102.44 | J31: 1.4000000000000002e-003 | K31: 1.6299999999999999e-002 | L31: 5.92 | M31: 4.5899999999999996e-002 | N31: 14 | O31: 2.3e-002 | P31: 114.9 | Q31: 7.04 | R31: 1.66 | S31: 84.09 | T31: 0.218 | U31: 转股中 | V31: 4.44年 | W31: 3.44年 | X31: 0.27899999999999997 | Y31: 0.23499999999999999 | Z31: 6 | AA31: 21 | AB31: 2.6699999999999998e-002 | AC31: 2.0499999999999997e-002 | AD31: 7.6e-003 | AE31: 4.7999999999999996e-003 | AF31: 90.3 | AG31: 95.24 | AH31: 0.38 | AI31: AA | AJ31: 4.41e-002 | AK31: =I31+100*T31 -> 124.23999999999999 | AL31: 120.8 | AM31: 33 | AN31: 25.5 | AO31: 14 | AP31: -2.4e-002 | AQ31: 50 | AR31: 迪森转债!
A32: 142 | B32: 鸿达转债 | C32: 128085 | D32: 43838. | E32: 鸿达兴业 | F32: 2002 | G32: 化工 | H32: 化工 | I32: 109.218 | J32: 1.6200000000000003e-002 | K32: 5.3e-003 | L32: 3.95 | M32: 3.95e-002 | N32: 13 | O32: 5.0000000000000001e-003 | P32: 124.8 | Q32: 3.92 | R32: 1.45 | S32: 100.77 | T32: 8.4000000000000005e-002 | U32: 转股中 | V32: 5.18年 | W32: 3.18年 | X32: 0.23699999999999999 | Y32: 0.23899999999999999 | Z32: 24 | AA32: 102 | AB32: 2.6699999999999998e-002 | AC32: 1.84e-002 | AD32: -1.38e-002 | AE32: -1.6299999999999999e-002 | AF32: 90 | AG32: 99.57 | AH32: 0.55 | AI32: AA | AJ32: 4.5599999999999995e-002 | AK32: =I32+100*T32 -> 117.61800000000001 | AL32: 117.7 | AM32: 11 | AN32: 18.1 | AO32: 4 | AP32: -1.3000000000000001e-002 | AQ32: 83 | AR32: 鸿达转债
A33: 238 | B33: 岭南转债! | C33: 128044 | D33: 43347. | E33: 岭南股份 | F33: 2717 | G33: 城市公用 | H33: 生态环境 | I33: 101 | J33: 4.0000000000000001e-003 | K33: -2.e-003 | L33: 4.07 | M33: 1.24e-002 | N33: 0.7 | O33: 1.e-003 | P33: 111.3 | Q33: 5.91 | R33: 1.31 | S33: 68.87 | T33: 0.46700000000000003 | U33: 转股中 | V33: 3.84年 | W33: 1.84年 | X33: 0.106 | Y33: 7.2999999999999995e-002 | Z33: 6.6 | AA33: 62 | AB33: 2.6099999999999998e-002 | AC33: 2.0400000000000001e-002 | AD33: 8.8999999999999999e-003 | AE33: 6.0999999999999995e-003 | AF33: 94.32 | AG33: 94.58 | AH33: 0.16 | AI33: AA | AJ33: 4.41e-002 | AK33: =I33+100*T33 -> 147.69999999999999 | AL33: 133.1 | AM33: 145 | AN33: 38.5 | AO33: 116 | AP33: -1.6e-002 | AQ33: 30 | AR33: 岭南转债!
A34: 8 | B34: 塞力转债 | C34: 113601 | D34: 44089. | E34: 塞力斯 | F34: 603716 | G34: 医药 | H34: 医药商业 | I34: 104.65 | J34: 6.3e-003 | K34: 8.3000000000000001e-003 | L34: 15.64 | M34: 2.3599999999999999e-002 | N34: 40 | O34: 7.0999999999999994e-002 | P34: 121.3 | Q34: 16.98 | R34: 2.15 | S34: 92.11 | T34: 0.13600000000000001 | U34: 4月19天 | V34: 5.86年 | W34: 3.86年 | X34: 0.16899999999999998 | Y34: 0.156 | Z34: 5.4 | AA34: 32 | AB34: 2.6000000000000002e-002 | AC34: 1.9599999999999999e-002 | AD34: -1.e-003 | AE34: -3.0999999999999999e-003 | AF34: 80.62 | AG34: 83.81 | AH34: 0.62 | AI34: AA- | AJ34: 6.6600000000000006e-002 | AK34: =I34+100*T34 -> 118.25 | AL34: 117.2 | AM34: 9 | AN34: 33.4 | AO34: 60 | AP34: -5.7999999999999996e-002 | AQ34: 9 | AR34: 塞力转债
A35: 161 | B35: 迪贝转债! | C35: 113546 | D35: 43790. | E35: 迪贝电气 | F35: 603320 | G35: 家电 | H35: 零部件制 | I35: 106.82 | J35: 1.2500000000000001e-002 | K35: 5.4000000000000003e-003 | L35: 12.75 | M35: 2.9900000000000003e-002 | N35: 4.4 | O35: 1.8000000000000002e-002 | P35: 121.1 | Q35: 14.1 | R35: 2.52 | S35: 90.43 | T35: 0.18100000000000002 | U35: 转股中 | V35: 5年12天 | W35: 3年12天 | X35: 0.13900000000000001 | Y35: 0.125 | Z35: 2.3 | AA35: 17 | AB35: 2.5899999999999999e-002 | AC35: 1.84e-002 | AD35: -7.0999999999999995e-003 | AE35: -9.7999999999999997e-003 | AF35: 82.54 | AG35: 83.95 | AH35: 0.6 | AI35: A+ | AJ35: 7.7600000000000002e-002 | AK35: =I35+100*T35 -> 124.91999999999999 | AL35: 123.2 | AM35: 53 | AN35: 39.3 | AO35: 122 | AP35: -4.2000000000000003e-002 | AQ35: 42 | AR35: 迪贝转债!
A36: 260 | B36: 杭电转债! | C36: 113505 | D36: 43186. | E36: 杭电股份 | F36: 603618 | G36: 能源电力 | H36: 电力设备 | I36: 103.26 | J36: 5.6000000000000008e-003 | K36: 1.1000000000000001e-003 | L36: 5.62 | M36: 2.7400000000000001e-002 | N36: 3.3 | O36: 4.0000000000000001e-003 | P36: 112.3 | Q36: 7.14 | R36: 1.55 | S36: 78.71 | T36: 0.312 | U36: 转股中 | V36: 3.40年 | W36: 1.40年 | X36: 0.193 | Y36: 0.152 | Z36: 7.5 | AA36: 39 | AB36: 2.5499999999999998e-002 | AC36: 1.8600000000000002e-002 | AD36: -2.8999999999999998e-003 | AE36: -6.4000000000000003e-003 | AF36: 96.14 | AG36: 97.27 | AH36: 0.25 | AI36: AA | AJ36: 4.41e-002 | AK36: =I36+100*T36 -> 134.46000000000001 | AL36: 127.8 | AM36: 97 | AN36: 30.5 | AO36: 39 | AP36: -2.2000000000000002e-002 | AQ36: 38 | AR36: 杭电转债!
A37: 224 | B37: 奇精转债! | C37: 113524 | D37: 43472. | E37: 奇精机械 | F37: 603677 | G37: 家电 | H37: 零部件制 | I37: 106.35 | J37: 1.0800000000000001e-002 | K37: 6.3e-003 | L37: 12.47 | M37: 4.3499999999999997e-002 | N37: 1.7 | O37: 5.0000000000000001e-003 | P37: 117.9 | Q37: 14.08 | R37: 2.46 | S37: 88.57 | T37: 0.20100000000000001 | U37: 转股中 | V37: 4.18年 | W37: 2.18年 | X37: 0.13800000000000001 | Y37: 0.122 | Z37: 3.3 | AA37: 24 | AB37: 2.5499999999999998e-002 | AC37: 1.78e-002 | AD37: -1.21e-002 | AE37: -1.4800000000000001e-002 | AF37: 93.57 | AG37: 98.84 | AH37: 0.39 | AI37: AA | AJ37: 4.41e-002 | AK37: =I37+100*T37 -> 126.44999999999999 | AL37: 124.1 | AM37: 64 | AN37: 25.3 | AO37: 13 | AP37: 3.2000000000000001e-002 | AQ37: 42 | AR37: 奇精转债!
A38: 255 | B38: 新凤转债! | C38: 113508 | D38: 43236. | E38: 新凤鸣 | F38: 603225 | G38: 服装纺织 | H38: 纺织行业 | I38: 102.96 | J38: -4.6999999999999993e-003 | K38: 7.7000000000000002e-003 | L38: 10.35 | M38: 2.8799999999999999e-002 | N38: 3.6 | O38: 2.e-003 | P38: 112.3 | Q38: 15.78 | R38: 1.29 | S38: 65.59 | T38: 0.56999999999999995 | U38: 转股中 | V38: 3.54年 | W38: 1.54年 | X38: 0.14899999999999999 | Y38: 9.8000000000000004e-002 | Z38: 21 | AA38: 144 | AB38: 2.53e-002 | AC38: 1.8700000000000001e-002 | AD38: -8.9999999999999998e-004 | AE38: -4.0999999999999995e-003 | AF38: 95.56 | AG38: 96.68 | AH38: 0.1 | AI38: AA | AJ38: 4.41e-002 | AK38: =I38+100*T38 -> 159.95999999999998 | AL38: 140.3 | AM38: 201 | AN38: 43.6 | AO38: 164 | AP38: -2.6000000000000002e-002 | AQ38: 26 | AR38: 新凤转债!
A39: 10 | B39: 文科转债 | C39: 128127 | D39: 44085. | E39: 文科园林 | F39: 2775 | G39: 城市公用 | H39: 生态环境 | I39: 105.081 | J39: 7.4999999999999997e-003 | K39: 1.5700000000000002e-002 | L39: 5.42 | M39: 3.6299999999999999e-002 | N39: 12 | O39: 1.2e-002 | P39: 121.3 | Q39: 5.76 | R39: 1.11 | S39: 94.1 | T39: 0.11699999999999999 | U39: 4月21天 | V39: 5.86年 | W39: 3.86年 | X39: 0.34200000000000003 | Y39: 0.32200000000000001 | Z39: 9.5 | AA39: 28 | AB39: 2.53e-002 | AC39: 1.89e-002 | AD39: -2.0999999999999999e-003 | AE39: -4.0999999999999995e-003 | AF39: 80.64 | AG39: 83.82 | AH39: 0.64 | AI39: AA- | AJ39: 6.6600000000000006e-002 | AK39: =I39+100*T39 -> 116.78100000000001 | AL39: 116.1 | AM39: 5 | AN39: 32.2 | AO39: 50 | AP39: 1.4999999999999999e-002 | AQ39: 11 | AR39: 文科转债
A40: 172 | B40: 翔鹭转债! | C40: 128072 | D40: 43724. | E40: 翔鹭钨业 | F40: 2842 | G40: 有色金属 | H40: 小金属 | I40: 102.438 | J40: 1.01e-002 | K40: -3.2000000000000002e-003 | L40: 9.78 | M40: 3.0600000000000002e-002 | N40: 4.5 | O40: 1.3999999999999999e-002 | P40: 115.1 | Q40: 15.34 | R40: 2.99 | S40: 63.75 | T40: 0.60699999999999998 | U40: 转股中 | V40: 4.86年 | W40: 2.86年 | X40: 0.11199999999999999 | Y40: 7.2000000000000008e-002 | Z40: 3 | AA40: 27 | AB40: 2.4700000000000003e-002 | AC40: 1.9e-002 | AD40: 3.2000000000000002e-003 | AE40: 1.e-003 | AF40: 85.62 | AG40: 85.24 | AH40: 0.23 | AI40: AA- | AJ40: 6.5099999999999991e-002 | AK40: =I40+100*T40 -> 163.13800000000001 | AL40: 141.1 | AM40: 207 | AN40: 55.5 | AO40: 231 | AP40: -5.2999999999999999e-002 | AQ40: 26 | AR40: 翔鹭转债!
A41: 141 | B41: 孚日转债! | C41: 128087 | D41: 43846. | E41: 孚日股份 | F41: 2083 | G41: 服装纺织 | H41: 家纺 | I41: 100.15 | J41: 1.4000000000000002e-003 | K41: 5.4000000000000003e-003 | L41: 4.95 | M41: 1.8500000000000003e-002 | N41: 5.7 | O41: 9.0000000000000011e-003 | P41: 113.3 | Q41: 6.3 | R41: 1.18 | S41: 78.57 | T41: 0.27500000000000002 | U41: 转股中 | V41: 5.18年 | W41: 3.18年 | X41: 0.14499999999999999 | Y41: 0.114 | Z41: 6.5 | AA41: 45 | AB41: 2.46e-002 | AC41: 1.9699999999999999e-002 | AD41: 1.09e-002 | AE41: 8.6e-003 | AF41: 89.55 | AG41: 90.37 | AH41: 0.37 | AI41: AA | AJ41: 4.5599999999999995e-002 | AK41: =I41+100*T41 -> 127.65000000000001 | AL41: 121.7 | AM41: 38 | AN41: 31.4 | AO41: 46 | AP41: -1.9e-002 | AQ41: 50 | AR41: 孚日转债!
A42: 226 | B42: 钧达转债! | C42: 128050 | D42: 43461. | E42: 钧达股份 | F42: 2865 | G42: 汽车 | H42: 零部件制 | I42: 112.665 | J42: 2.3199999999999998e-002 | K42: 7.3000000000000001e-003 | L42: 15.68 | M42: 4.8099999999999997e-002 | N42: 5 | O42: 1.3999999999999999e-002 | P42: 123.5 | Q42: 14.83 | R42: 2.21 | S42: 105.73 | T42: 6.6000000000000003e-002 | U42: 转股中 | V42: 4.16年 | W42: 2.16年 | X42: 0.16899999999999998 | Y42: 0.17800000000000002 | Z42: 3.2 | AA42: 19 | AB42: 2.2799999999999997e-002 | AC42: 1.3100000000000001e-002 | AD42: -3.49e-002 | AE42: -3.7900000000000003e-002 | AF42: 89.83 | AG42: 95.58 | AH42: 0.63 | AI42: AA- | AJ42: 6.5099999999999991e-002 | AK42: =I42+100*T42 -> 119.265 | AL42: 119.6 | AM42: 25 | AN42: 24 | AO42: 11 | AP42: -2.5000000000000001e-002 | AQ42: 62 | AR42: 钧达转债!
A43: 34 | B43: 沪工转债 | C43: 113593 | D43: 44053. | E43: 上海沪工 | F43: 603131 | G43: 机械装备 | H43: 通用设备 | I43: 107.06 | J43: 3.5999999999999999e-003 | K43: 9.4999999999999998e-003 | L43: 18.52 | M43: 2.1499999999999998e-002 | N43: 2.2 | O43: 5.0000000000000001e-003 | P43: 121.6 | Q43: 21.32 | R43: 4.86 | S43: 86.87 | T43: 0.23199999999999998 | U43: 3月16天 | V43: 5.77年 | W43: 3.77年 | X43: 6.8000000000000005e-002 | Y43: 5.9000000000000004e-002 | Z43: 4 | AA43: 59 | AB43: 2.2799999999999997e-002 | AC43: 1.6200000000000003e-002 | AD43: -5.8999999999999999e-003 | AE43: -8.199999999999999e-003 | AF43: 78.16 | AG43: 79.75 | AH43: 0.61 | AI43: A+ | AJ43: 7.7600000000000002e-002 | AK43: =I43+100*T43 -> 130.25999999999999 | AL43: 127.3 | AM43: 94 | AN43: 47.5 | AO43: 189 | AP43: -3.7000000000000005e-002 | AQ43: 5 | AR43: 沪工转债
A44: 266 | B44: 迪龙转债! | C44: 128033 | D44: 43129. | E44: 雪迪龙 | F44: 2658 | G44: 城市公用 | H44: 三废处理 | I44: 102.331 | J44: 6.0999999999999995e-003 | K44: -7.6e-003 | L44: 6.38 | M44: -9.300000000000001e-003 | N44: 3.2 | O44: 6.0000000000000001e-003 | P44: 109.8 | Q44: 8.83 | R44: 1.96 | S44: 72.25 | T44: 0.41600000000000004 | U44: 转股中 | V44: 3.21年 | W44: 1.21年 | X44: 0.13500000000000001 | Y44: 9.6999999999999989e-002 | Z44: 5.2 | AA44: 39 | AB44: 2.2700000000000001e-002 | AC44: 1.67e-002 | AD44: 1.6000000000000001e-003 | AE44: -2.0999999999999999e-003 | AF44: 96.69 | AG44: 95.87 | AH44: 0.16 | AI44: AA | AJ44: 4.41e-002 | AK44: =I44+100*T44 -> 143.93100000000001 | AL44: 132.4 | AM44: 136 | AN44: 35.7 | AO44: 80 | AP44: -1.6e-002 | AQ44: 37 | AR44: 迪龙转债!
A45: 179 | B45: 华森转债! | C45: 128069 | D45: 43657. | E45: 华森制药 | F45: 2907 | G45: 医药 | H45: 化学制药 | I45: 108.18 | J45: 9.7000000000000003e-003 | K45: 9.1000000000000004e-003 | L45: 16.68 | M45: 3.3500000000000002e-002 | N45: 1.7 | O45: 5.0000000000000001e-003 | P45: 120 | Q45: 18.04 | R45: 6.46 | S45: 92.46 | T45: 0.17000000000000001 | U45: 转股中 | V45: 4.70年 | W45: 2.70年 | X45: 4.4999999999999998e-002 | Y45: 4.0999999999999995e-002 | Z45: 3 | AA45: 67 | AB45: 2.2700000000000001e-002 | AC45: 1.52e-002 | AD45: -1.54e-002 | AE45: -1.78e-002 | AF45: 86.53 | AG45: 89.73 | AH45: 0.56 | AI45: AA- | AJ45: 6.5099999999999991e-002 | AK45: =I45+100*T45 -> 125.18000000000001 | AL45: 123.9 | AM45: 59 | AN45: 34.2 | AO45: 63 | AP45: -2.5000000000000001e-002 | AQ45: 40 | AR45: 华森转债!
A46: 178 | B46: 智能转债! | C46: 128070 | D46: 43669. | E46: 智能自控 | F46: 2877 | G46: 机械装备 | H46: 通用设备 | I46: 106.295 | J46: 1.61e-002 | K46: 2.8199999999999999e-002 | L46: 8.21 | M46: 8.0299999999999996e-002 | N46: 15 | O46: 5.9000000000000004e-002 | P46: 117.6 | Q46: 9.51 | R46: 3.89 | S46: 86.33 | T46: 0.23100000000000001 | U46: 转股中 | V46: 4.72年 | W46: 无权 | X46: 8.4000000000000005e-002 | Y46: 7.2999999999999995e-002 | Z46: 2.3 | AA46: 27 | AB46: 2.2099999999999998e-002 | AC46: 1.5300000000000001e-002 | AD46: 无权 | AE46: 无权 | AF46: 无权 | AG46: 83.84 | AH46: 0.55 | AI46: A+ | AJ46: 7.6100000000000001e-002 | AK46: =I46+100*T46 -> 129.39500000000001 | AL46: 126.3 | AM46: 81 | AN46: 42.4 | AO46: 155 | AP46: 3.0000000000000001e-003 | AQ46: 33 | AR46: 智能转债!
A47: 9 | B47: 齐翔转2 | C47: 128128 | D47: 44089. | E47: 齐翔腾达 | F47: 2408 | G47: 化工 | H47: 化工 | I47: 101.711 | J47: 1.04e-002 | K47: 7.7000000000000002e-003 | L47: 7.23 | M47: 3.5799999999999998e-002 | N47: 79 | O47: 2.6000000000000002e-002 | P47: 115.3 | Q47: 8.22 | R47: 1.6 | S47: 87.96 | T47: 0.156 | U47: 4月18天 | V47: 5.86年 | W47: 3.86年 | X47: 0.23300000000000001 | Y47: 0.20499999999999999 | Z47: 30 | AA47: 128 | AB47: 2.2000000000000002e-002 | AC47: 1.72e-002 | AD47: 4.8999999999999998e-003 | AE47: 3.0999999999999999e-003 | AF47: 86.81 | AG47: 89.22 | AH47: 0.51 | AI47: AA | AJ47: 4.5599999999999995e-002 | AK47: =I47+100*T47 -> 117.31099999999999 | AL47: 115.5 | AM47: 4 | AN47: 26.2 | AO47: 16 | AP47: -0.114 | AQ47: 13 | AR47: 齐翔转2
A48: 274 | B48: 众兴转债! | C48: 128026 | D48: 43103. | E48: 众兴菌业 | F48: 2772 | G48: 农业 | H48: 种植业 | I48: 103.15 | J48: 7.4000000000000003e-003 | K48: 2.3999999999999998e-003 | L48: 9.38 | M48: 3.0800000000000001e-002 | N48: 19 | O48: 2.e-002 | P48: 110.3 | Q48: 11.45 | R48: 1.44 | S48: 81.92 | T48: 0.25900000000000001 | U48: 转股中 | V48: 3.17年 | W48: 1.17年 | X48: 0.26600000000000001 | Y48: 0.218 | Z48: 9.2 | AA48: 34 | AB48: 2.1899999999999999e-002 | AC48: 1.5600000000000001e-002 | AD48: -2.5999999999999999e-003 | AE48: -6.6e-003 | AF48: 94.56 | AG48: 90.73 | AH48: 0.32 | AI48: AA- | AJ48: 6.5099999999999991e-002 | AK48: =I48+100*T48 -> 129.05000000000001 | AL48: 124.4 | AM48: 65 | AN48: 29.8 | AO48: 36 | AP48: 3.4000000000000002e-002 | AQ48: 56 | AR48: 众兴转债!
A49: 35 | B49: 联诚转债 | C49: 128120 | D49: 44060. | E49: 联诚精密 | F49: 2921 | G49: 汽车 | H49: 零部件制 | I49: 104.9 | J49: 1.2500000000000001e-002 | K49: 1.1000000000000001e-003 | L49: 20.91 | M49: 2.1000000000000001e-002 | N49: 3.3 | O49: 1.2e-002 | P49: 118.4 | Q49: 24.37 | R49: 2.42 | S49: 85.8 | T49: 0.223 | U49: 3月16天 | V49: 5.76年 | W49: 3.76年 | X49: 0.152 | Y49: 0.13100000000000001 | Z49: 2.6 | AA49: 17 | AB49: 2.1700000000000001e-002 | AC49: 1.5900000000000001e-002 | AD49: -8.0000000000000004e-004 | AE49: -3.0999999999999999e-003 | AF49: 75.46 | AG49: 73.81 | AH49: 0.65 | AI49: A | AJ49: 8.7599999999999997e-002 | AK49: =I49+100*T49 -> 127.2 | AL49: 124 | AM49: 60 | AN49: 48.5 | AO49: 196 | AP49: -2.8999999999999998e-002 | AQ49: 8 | AR49: 联诚转债
A50: 31 | B50: 花王转债 | C50: 113595 | D50: 44061. | E50: 花王股份 | F50: 603007 | G50: 城市公用 | H50: 生态环境 | I50: 110.96 | J50: 1.0500000000000001e-002 | K50: -8.5000000000000006e-003 | L50: 7.22 | M50: 2.8000000000000004e-003 | N50: 7.1 | O50: 1.9e-002 | P50: 125.3 | Q50: 6.94 | R50: 2.2 | S50: 104.03 | T50: 6.7000000000000004e-002 | U50: 3月18天 | V50: 5.78年 | W50: 3.78年 | X50: 0.13600000000000001 | Y50: 0.14199999999999999 | Z50: 3.3 | AA50: 24 | AB50: 2.1700000000000001e-002 | AC50: 1.4199999999999999e-002 | AD50: -1.5900000000000001e-002 | AE50: -1.8000000000000002e-002 | AF50: 81.06 | AG50: 87.02 | AH50: 0.69 | AI50: AA- | AJ50: 6.6600000000000006e-002 | AK50: =I50+100*T50 -> 117.66 | AL50: 117.9 | AM50: 12 | AN50: 30.9 | AO50: 43 | AP50: -5.4000000000000006e-002 | AQ50: 21 | AR50: 花王转债
A51: 241 | B51: 苏农转债! | C51: 113516 | D51: 43332. | E51: 苏农银行 | F51: 603323 | G51: 金融 | H51: 银行行业 | I51: 105.55 | J51: 1.4000000000000002e-003 | K51: 2.2000000000000001e-003 | L51: 4.61 | M51: 1.1000000000000001e-002 | N51: 4.3 | O51: 3.0000000000000001e-003 | P51: 114.3 | Q51: 5.52 | R51: 0.72 | S51: 83.51 | T51: 0.26400000000000001 | U51: 转股中 | V51: 3.81年 | W51: 无权 | X51: 0.155 | Y51: 0.13 | Z51: 13 | AA51: 83 | AB51: 2.1499999999999998e-002 | AC51: 1.46e-002 | AD51: 无权 | AE51: 无权 | AF51: 无权 | AG51: 97.96 | AH51: 0.33 | AI51: AA+ | AJ51: 4.2099999999999999e-002 | AK51: =I51+100*T51 -> 131.94999999999999 | AL51: 127.6 | AM51: 96 | AN51: 29.6 | AO51: 29 | AP51: -2.2000000000000002e-002 | AQ51: 36 | AR51: 苏农转债!
A52: 103 | B52: 搜特转债! | C52: 128100 | D52: 43930. | E52: 搜于特 | F52: 2503 | G52: 服装纺织 | H52: 服装行业 | I52: 104.84 | J52: 1.6899999999999998e-002 | K52: -3.4000000000000002e-003 | L52: 2.6 | M52: 2.7699999999999999e-002 | N52: 6.9 | O52: 8.0000000000000002e-003 | P52: 117.3 | Q52: 2.9 | R52: 1.47 | S52: 89.66 | T52: 0.16899999999999998 | U52: 转股中 | V52: 5.42年 | W52: 3.42年 | X52: 9.9000000000000005e-002 | Y52: 8.900000000000001e-002 | Z52: 8 | AA52: 80 | AB52: 2.1400000000000002e-002 | AC52: 1.5600000000000001e-002 | AD52: -2.8000000000000004e-003 | AE52: -4.8999999999999998e-003 | AF52: 88.62 | AG52: 92.58 | AH52: 0.49 | AI52: AA | AJ52: 4.5599999999999995e-002 | AK52: =I52+100*T52 -> 121.74000000000001 | AL52: 120 | AM52: 27 | AN52: 27.4 | AO52: 20 | AP52: -4.4000000000000004e-002 | AQ52: 41 | AR52: 搜特转债!
A53: 117 | B53: 翔港转债 | C53: 113566 | D53: 43921. | E53: 翔港科技 | F53: 603499 | G53: 造纸包装 | H53: 包装材料 | I53: 111.51 | J53: 1.24e-002 | K53: 3.1099999999999999e-002 | L53: 10.65 | M53: 6.3899999999999998e-002 | N53: 5.1 | O53: 2.7999999999999997e-002 | P53: 124.5 | Q53: 10.77 | R53: 2.85 | S53: 98.89 | T53: 0.128 | U53: 转股中 | V53: 5.38年 | W53: 3.38年 | X53: 7.5999999999999998e-002 | Y53: 7.4999999999999997e-002 | Z53: 1.6 | AA53: 21 | AB53: 2.12e-002 | AC53: 1.3300000000000001e-002 | AD53: -1.7899999999999999e-002 | AE53: -2.0400000000000001e-002 | AF53: 80.58 | AG53: 84.09 | AH53: 0.68 | AI53: A+ | AJ53: 7.7600000000000002e-002 | AK53: =I53+100*T53 -> 124.31 | AL53: 124.1 | AM53: 63 | AN53: 40 | AO53: 136 | AP53: -0.125 | AQ53: 26 | AR53: 翔港转债
A54: 45 | B54: 道恩转债 | C54: 128117 | D54: 44032. | E54: 道恩股份 | F54: 2838 | G54: 化工 | H54: 橡胶塑料 | I54: 110 | J54: 7.8000000000000005e-003 | K54: 2.e-003 | L54: 28.42 | M54: 1.4999999999999999e-002 | N54: 4.1 | O54: 1.e-002 | P54: 123.5 | Q54: 29.07 | R54: 7.12 | S54: 97.76 | T54: 0.125 | U54: 2月29天 | V54: 5.72年 | W54: 3.72年 | X54: 3.1e-002 | Y54: 2.9999999999999999e-002 | Z54: 3.6 | AA54: 116 | AB54: 2.0799999999999999e-002 | AC54: 1.37e-002 | AD54: -1.49e-002 | AE54: -1.67e-002 | AF54: 81 | AG54: 85.98 | AH54: 0.65 | AI54: AA- | AJ54: 6.6600000000000006e-002 | AK54: =I54+100*T54 -> 122.5 | AL54: 122.2 | AM54: 42 | AN54: 36.3 | AO54: 90 | AP54: -2.2000000000000002e-002 | AQ54: 9 | AR54: 道恩转债
A55: 2 | B55: 宝莱转债 | C55: 123065 | D55: 44098. | E55: 宝莱特 | F55: 300246 | G55: 医药 | H55: 医疗器械 | I55: 107.78 | J55: 1.06e-002 | K55: 1.2199999999999999e-002 | L55: 36.24 | M55: 3.9e-002 | N55: 18 | O55: 7.5999999999999998e-002 | P55: 121.4 | Q55: 40.54 | R55: 6.98 | S55: 89.39 | T55: 0.20600000000000002 | U55: 5月1天 | V55: 5.90年 | W55: 3.90年 | X55: 4.0999999999999995e-002 | Y55: 3.7000000000000005e-002 | Z55: 2.2 | AA55: 53 | AB55: 2.0799999999999999e-002 | AC55: 1.44e-002 | AD55: -8.1000000000000013e-003 | AE55: -1.01e-002 | AF55: 80.47 | AG55: 83.65 | AH55: 0.58 | AI55: AA- | AJ55: 6.6600000000000006e-002 | AK55: =I55+100*T55 -> 128.38 | AL55: 126.2 | AM55: 77 | AN55: 42.5 | AO55: 157 | AP55: -1.2e-002 | AQ55: 4 | AR55: 宝莱转债
A56: 213 | B56: 贵广转债! | C56: 110052 | D56: 43553. | E56: 贵广网络 | F56: 600996 | G56: 传媒娱乐 | H56: 影视娱乐 | I56: 108.93 | J56: 7.0999999999999995e-003 | K56: 4.3e-003 | L56: 7.22 | M56: 2.7000000000000003e-002 | N56: 4.3 | O56: 3.0000000000000001e-003 | P56: 118.5 | Q56: 7.94 | R56: 1.64 | S56: 90.93 | T56: 0.19800000000000001 | U56: 转股中 | V56: 4.40年 | W56: 2.40年 | X56: 0.20100000000000001 | Y56: 0.183 | Z56: 15 | AA56: 76 | AB56: 1.9799999999999998e-002 | AC56: 1.2199999999999999e-002 | AD56: -1.8700000000000001e-002 | AE56: -2.1499999999999998e-002 | AF56: 93.54 | AG56: 99.26 | AH56: 0.42 | AI56: AA+ | AJ56: 4.2099999999999999e-002 | AK56: =I56+100*T56 -> 128.73000000000002 | AL56: 126.9 | AM56: 89 | AN56: 27.7 | AO56: 21 | AP56: -1.e-003 | AQ56: 17 | AR56: 贵广转债!
A57: 283 | B57: 时达转债! | C57: 128018 | D57: 43073. | E57: 新时达 | F57: 2527 | G57: 机械装备 | H57: 机器人及 | I57: 104.3 | J57: 1.3999999999999999e-002 | K57: -5.8999999999999999e-003 | L57: 5.66 | M57: 4.0399999999999998e-002 | N57: 0.8 | O57: 1.e-003 | P57: 110.3 | Q57: 7.42 | R57: 1.39 | S57: 76.28 | T57: 0.36700000000000005 | U57: 转股中 | V57: 3年26天 | W57: 1年26天 | X57: 0.251 | Y57: 0.191 | Z57: 8.8 | AA57: 35 | AB57: 1.8799999999999997e-002 | AC57: 1.24e-002 | AD57: -1.18e-002 | AE57: -1.61e-002 | AF57: 97.51 | AG57: 96.92 | AH57: 0.2 | AI57: AA | AJ57: 4.41e-002 | AK57: =I57+100*T57 -> 141. | AL57: 132.3 | AM57: 133 | AN57: 34.8 | AO57: 68 | AP57: -3.2000000000000001e-002 | AQ57: 40 | AR57: 时达转债!
A58: 236 | B58: 长久转债! | C58: 113519 | D58: 43434. | E58: 长久物流 | F58: 603569 | G58: 交通运输 | H58: 物流业 | I58: 111.5 | J58: 2.5600000000000001e-002 | K58: -1.1000000000000001e-002 | L58: 10.01 | M58: 3.8399999999999997e-002 | N58: 4.8 | O58: 6.0000000000000001e-003 | P58: 120.1 | Q58: 11.15 | R58: 2.68 | S58: 89.78 | T58: 0.24199999999999999 | U58: 转股中 | V58: 4年27天 | W58: 2年27天 | X58: 0.124 | Y58: 0.11199999999999999 | Z58: 7 | AA58: 56 | AB58: 1.8799999999999997e-002 | AC58: 1.01e-002 | AD58: -3.27e-002 | AE58: -3.56e-002 | AF58: 94.18 | AG58: 101.15 | AH58: 0.38 | AI58: AA | AJ58: 4.41e-002 | AK58: =I58+100*T58 -> 135.69999999999999 | AL58: 133.2 | AM58: 147 | AN58: 32.1 | AO58: 49 | AP58: -6.9999999999999993e-003 | AQ58: 17 | AR58: 长久转债!
A59: 191 | B59: 创维转债! | C59: 127013 | D59: 43601. | E59: 创维数字 | F59: 810 | G59: 电子 | H59: 电子产品 | I59: 108.6 | J59: 9.1999999999999998e-003 | K59: 2.e-003 | L59: 9.88 | M59: 2.92e-002 | N59: 4.1 | O59: 4.0000000000000001e-003 | P59: 117.9 | Q59: 11.39 | R59: 2.79 | S59: 86.74 | T59: 0.252 | U59: 转股中 | V59: 4.51年 | W59: 2.51年 | X59: 9.3000000000000013e-002 | Y59: 8.1000000000000003e-002 | Z59: 9.8 | AA59: 105 | AB59: 1.8700000000000001e-002 | AC59: 1.1599999999999999e-002 | AD59: -1.83e-002 | AE59: -2.07e-002 | AF59: 92.23 | AG59: 97.42 | AH59: 0.38 | AI59: AA | AJ59: 4.41e-002 | AK59: =I59+100*T59 -> 133.79999999999998 | AL59: 130.5 | AM59: 117 | AN59: 33 | AO59: 58 | AP59: -3.1e-002 | AQ59: 24 | AR59: 创维转债!
A60: 150 | B60: 海亮转债! | C60: 128081 | D60: 43815. | E60: 海亮股份 | F60: 2203 | G60: 有色金属 | H60: 铜金属 | I60: 104.999 | J60: 6.9999999999999993e-003 | K60: 1.23e-002 | L60: 8.01 | M60: 4.8399999999999999e-002 | N60: 21 | O60: 6.0000000000000001e-003 | P60: 115.2 | Q60: 9.76 | R60: 1.74 | S60: 82.07 | T60: 0.27899999999999997 | U60: 转股中 | V60: 5年41天 | W60: 3年41天 | X60: 0.20100000000000001 | Y60: 0.16500000000000001 | Z60: 32 | AA60: 156 | AB60: 1.8700000000000001e-002 | AC60: 1.32e-002 | AD60: -3.8e-003 | AE60: -6.0000000000000001e-003 | AF60: 89.74 | AG60: 92.15 | AH60: 0.4 | AI60: AA | AJ60: 4.5599999999999995e-002 | AK60: =I60+100*T60 -> 132.899 | AL60: 127.9 | AM60: 98 | AN60: 35.8 | AO60: 82 | AP60: -2.5000000000000001e-002 | AQ60: 50 | AR60: 海亮转债!
A61: 243 | B61: 凯中转债! | C61: 128042 | D61: 43346. | E61: 凯中精密 | F61: 2823 | G61: 能源电力 | H61: 电力设备 | I61: 108.7 | J61: 1.38e-002 | K61: -1.03e-002 | L61: 10.82 | M61: 1.1200000000000002e-002 | N61: 1.6 | O61: 3.0000000000000001e-003 | P61: 116.3 | Q61: 12.96 | R61: 2.46 | S61: 83.49 | T61: 0.30199999999999999 | U61: 转股中 | V61: 3.80年 | W61: 1.80年 | X61: 0.13400000000000001 | Y61: 0.11199999999999999 | Z61: 4.2 | AA61: 31 | AB61: 1.83e-002 | AC61: 1.0500000000000001e-002 | AD61: -2.8199999999999999e-002 | AE61: -3.0800000000000001e-002 | AF61: 94.49 | AG61: 99 | AH61: 0.31 | AI61: AA | AJ61: 4.41e-002 | AK61: =I61+100*T61 -> 138.90000000000001 | AL61: 133.9 | AM61: 154 | AN61: 34.9 | AO61: 70 | AP61: -1.4999999999999999e-002 | AQ61: 23 | AR61: 凯中转债!
A62: 140 | B62: 森特转债 | C62: 113557 | D62: 43840. | E62: 森特股份 | F62: 603098 | G62: 建筑 | H62: 建筑工程 | I62: 110.09 | J62: 1.7899999999999999e-002 | K62: 2.1600000000000001e-002 | L62: 9.88 | M62: 6.1200000000000004e-002 | N62: 2.8 | O62: 4.0000000000000001e-003 | P62: 120.7 | Q62: 10.11 | R62: 2.35 | S62: 97.73 | T62: 0.127 | U62: 转股中 | V62: 5.19年 | W62: 3.19年 | X62: 0.127 | Y62: 0.124 | Z62: 6 | AA62: 47 | AB62: 1.83e-002 | AC62: 1.1299999999999999e-002 | AD62: -1.6899999999999998e-002 | AE62: -1.9199999999999998e-002 | AF62: 84.04 | AG62: 87.03 | AH62: 0.65 | AI62: AA- | AJ62: 6.6600000000000006e-002 | AK62: =I62+100*T62 -> 122.79000000000001 | AL62: 122.5 | AM62: 44 | AN62: 35.4 | AO62: 75 | AP62: 8.0000000000000002e-003 | AQ62: 35 | AR62: 森特转债
A63: 164 | B63: 金轮转债! | C63: 128076 | D63: 43777. | E63: 金轮股份 | F63: 2722 | G63: 机械装备 | H63: 专用设备 | I63: 105.708 | J63: 6.8999999999999999e-003 | K63: 4.7999999999999996e-003 | L63: 13.11 | M63: 2.0199999999999999e-002 | N63: 1.6 | O63: 6.9999999999999993e-003 | P63: 115.3 | Q63: 14.76 | R63: 1.24 | S63: 88.82 | T63: 0.19 | U63: 转股中 | V63: 5年3.1天 | W63: 3年3.1天 | X63: 9.3000000000000013e-002 | Y63: 8.3000000000000004e-002 | Z63: 2.1 | AA63: 23 | AB63: 1.7899999999999999e-002 | AC63: 1.23e-002 | AD63: -5.7999999999999996e-003 | AE63: -8.1000000000000013e-003 | AF63: 84.81 | AG63: 84.09 | AH63: 0.58 | AI63: AA- | AJ63: 6.6600000000000006e-002 | AK63: =I63+100*T63 -> 124.708 | AL63: 122.6 | AM63: 46 | AN63: 37.8 | AO63: 106 | AP63: -3.0000000000000001e-003 | AQ63: 41 | AR63: 金轮转债!
A64: 295 | B64: 顺昌转债!! | C64: 128010 | D64: 42423. | E64: 澳洋顺昌 | F64: 2245 | G64: 交通运输 | H64: 物流业 | I64: 107.218 | J64: 2.e-003 | K64: -1.2999999999999999e-003 | L64: 6.66 | M64: 2.6200000000000001e-002 | N64: 8.6 | O64: 1.6e-002 | P64: 109.6 | Q64: 9.25 | R64: 3.05 | S64: 72 | T64: 0.48899999999999999 | U64: 转股中 | V64: 1.28年 | W64: 回售中 | X64: 7.8e-002 | Y64: 5.5999999999999994e-002 | Z64: 5.1 | AA64: 65 | AB64: 1.7500000000000002e-002 | AC64: 3.4000000000000002e-003 | AD64: 回售中 | AE64: 回售中 | AF64: 100.27 | AG64: 103.92 | AH64: 0.03 | AI64: AA | AJ64: 4.2900000000000001e-002 | AK64: =I64+100*T64 -> 156.11799999999999 | AL64: 142.4 | AM64: 218 | AN64: 38.5 | AO64: 114 | AP64: 0.23399999999999999 | AQ64: 41 | AR64: 顺昌转债!!
A65: 148 | B65: 华锋转债! | C65: 128082 | D65: 43836. | E65: 华锋股份 | F65: 2806 | G65: 电子 | H65: 元器件制 | I65: 112.001 | J65: 5.1999999999999998e-003 | K65: 1.38e-002 | L65: 12.23 | M65: 2.6000000000000002e-002 | N65: 2.9 | O65: 6.9999999999999993e-003 | P65: 122 | Q65: 11.71 | R65: 1.72 | S65: 104.44 | T65: 7.2000000000000008e-002 | U65: 转股中 | V65: 5年54天 | W65: 3年54天 | X65: 0.16399999999999998 | Y65: 0.17100000000000001 | Z65: 3.5 | AA65: 22 | AB65: 1.72e-002 | AC65: 9.7000000000000003e-003 | AD65: -1.9299999999999998e-002 | AE65: -2.2200000000000001e-002 | AF65: 82.38 | AG65: 83.96 | AH65: 0.73 | AI65: A+ | AJ65: 7.7600000000000002e-002 | AK65: =I65+100*T65 -> 119.20100000000001 | AL65: 119.6 | AM65: 24 | AN65: 35.6 | AO65: 78 | AP65: -4.0000000000000001e-003 | AQ65: 53 | AR65: 华锋转债!
A66: 192 | B66: 核能转债! | C66: 113026 | D66: 43593. | E66: 中国核电 | F66: 601985 | G66: 能源电力 | H66: 核电 | I66: 101.89 | J66: 0. | K66: 3.7000000000000002e-003 | L66: 4.46 | M66: 1.5900000000000001e-002 | N66: 6.3 | O66: 1.e-003 | P66: 109.8 | Q66: 6.08 | R66: 1.38 | S66: 73.36 | T66: 0.38900000000000001 | U66: 转股中 | V66: 4.51年 | W66: 2.51年 | X66: 0.11199999999999999 | Y66: 8.199999999999999e-002 | Z66: 78 | AA66: 694 | AB66: 1.7100000000000001e-002 | AC66: 1.29e-002 | AD66: 5.1999999999999998e-003 | AE66: 2.8000000000000004e-003 | AF66: 93.31 | AG66: 92.68 | AH66: 0.23 | AI66: AAA | AJ66: 3.9100000000000003e-002 | AK66: =I66+100*T66 -> 140.78999999999999 | AL66: 130.4 | AM66: 116 | AN66: 37.1 | AO66: 101 | AP66: -2.e-002 | AQ66: 49 | AR66: 核能转债!
A67: 91 | B67: 鲁泰转债 | C67: 127016 | D67: 43964. | E67: 鲁 泰Ａ | F67: 726 | G67: 服装纺织 | H67: 纺织行业 | I67: 106.204 | J67: 7.6e-003 | K67: -3.9000000000000003e-003 | L67: 7.25 | M67: 9.7000000000000003e-003 | N67: 2.9 | O67: 2.e-003 | P67: 116.2 | Q67: 8.91 | R67: 0.8 | S67: 81.37 | T67: 0.30499999999999999 | U67: 4.1天 | V67: 5.49年 | W67: 3.49年 | X67: 0.22500000000000001 | Y67: 0.183 | Z67: 14 | AA67: 62 | AB67: 1.6799999999999999e-002 | AC67: 1.15e-002 | AD67: -6.6e-003 | AE67: -8.5000000000000006e-003 | AF67: 88.83 | AG67: 92.33 | AH67: 0.38 | AI67: AA+ | AJ67: 4.36e-002 | AK67: =I67+100*T67 -> 136.70400000000001 | AL67: 131 | AM67: 121 | AN67: 38.7 | AO67: 119 | AP67: -4.0000000000000001e-002 | AQ67: 21 | AR67: 鲁泰转债
A68: 198 | B68: 海环转债! | C68: 113532 | D68: 43579. | E68: 海峡环保 | F68: 603817 | G68: 城市公用 | H68: 三废处理 | I68: 105.02 | J68: 4.4000000000000003e-003 | K68: 2.2000000000000001e-003 | L68: 6.31 | M68: 1.77e-002 | N68: 0.8 | O68: 2.e-003 | P68: 112.9 | Q68: 7.69 | R68: 1.69 | S68: 82.05 | T68: 0.28000000000000003 | U68: 转股中 | V68: 4.47年 | W68: 2.47年 | X68: 0.16200000000000001 | Y68: 0.13300000000000001 | Z68: 4.6 | AA68: 28 | AB68: 1.66e-002 | AC68: 1.1200000000000002e-002 | AD68: -5.8999999999999999e-003 | AE68: -8.3999999999999995e-003 | AF68: 92.37 | AG68: 93.45 | AH68: 0.37 | AI68: AA | AJ68: 4.41e-002 | AK68: =I68+100*T68 -> 133.02000000000001 | AL68: 128 | AM68: 99 | AN68: 34.5 | AO68: 64 | AP68: -2.5000000000000001e-002 | AQ68: 25 | AR68: 海环转债!
A69: 12 | B69: 广汇转债 | C69: 110072 | D69: 44089. | E69: 广汇汽车 | F69: 600297 | G69: 汽车 | H69: 分销、售 | I69: 104.18 | J69: 9.4999999999999998e-003 | K69: 5.1000000000000004e-003 | L69: 3.34 | M69: 3.4099999999999998e-002 | N69: 52 | O69: 1.4999999999999999e-002 | P69: 114.5 | Q69: 4.03 | R69: 0.7 | S69: 82.88 | T69: 0.25700000000000001 | U69: 4月16天 | V69: 5.85年 | W69: 3.85年 | X69: 0.124 | Y69: 0.10300000000000001 | Z69: 34 | AA69: 271 | AB69: 1.6500000000000001e-002 | AC69: 1.2e-002 | AD69: -2.8000000000000004e-003 | AE69: -4.3e-003 | AF69: 86.85 | AG69: 89.51 | AH69: 0.43 | AI69: AA+ | AJ69: 4.36e-002 | AK69: =I69+100*T69 -> 129.88 | AL69: 125.5 | AM69: 72 | AN69: 36 | AO69: 87 | AP69: -9.8000000000000004e-002 | AQ69: 12 | AR69: 广汇转债
A70: 95 | B70: 华体转债! | C70: 113574 | D70: 43948. | E70: 华体科技 | F70: 603679 | G70: 城市公用 | H70: 城市公用 | I70: 106.77 | J70: 7.3000000000000001e-003 | K70: -7.8000000000000005e-003 | L70: 24.5 | M70: -1.1999999999999999e-003 | N70: 2.7 | O70: 1.2e-002 | P70: 116.4 | Q70: 33.99 | R70: 3.52 | S70: 72.08 | T70: 0.48100000000000004 | U70: 转股中 | V70: 5.47年 | W70: 3.47年 | X70: 5.9999999999999998e-002 | Y70: 4.2999999999999997e-002 | Z70: 2.1 | AA70: 35 | AB70: 1.6299999999999999e-002 | AC70: 1.0800000000000001e-002 | AD70: -5.7999999999999996e-003 | AE70: -8.199999999999999e-003 | AF70: 79.97 | AG70: 78.15 | AH70: 0.41 | AI70: A+ | AJ70: 7.7600000000000002e-002 | AK70: =I70+100*T70 -> 154.87 | AL70: 141.5 | AM70: 210 | AN70: 61.5 | AO70: 255 | AP70: -1.1000000000000001e-002 | AQ70: 11 | AR70: 华体转债!
A71: 98 | B71: 久吾转债 | C71: 123047 | D71: 43938. | E71: 久吾高科 | F71: 300631 | G71: 机械装备 | H71: 专用设备 | I71: 120.27 | J71: 1.09e-002 | K71: 4.0999999999999995e-003 | L71: 20.27 | M71: 1.9599999999999999e-002 | N71: 8.5 | O71: 2.7999999999999997e-002 | P71: 130.1 | Q71: 17.61 | R71: 3.09 | S71: 115.11 | T71: 4.4999999999999998e-002 | U71: 转股中 | V71: 5.44年 | W71: 3.44年 | X71: 0.11900000000000001 | Y71: 0.13699999999999998 | Z71: 2.5 | AA71: 21 | AB71: 1.4999999999999999e-002 | AC71: 5.8999999999999999e-003 | AD71: -3.4599999999999999e-002 | AE71: -3.7599999999999995e-002 | AF71: 81.34 | AG71: 87.67 | AH71: 0.77 | AI71: A+ | AJ71: 7.7600000000000002e-002 | AK71: =I71+100*T71 -> 124.77 | AL71: 125.4 | AM71: 70 | AN71: 37.8 | AO71: 104 | AP71: -2.2000000000000002e-002 | AQ71: 20 | AR71: 久吾转债
A72: 269 | B72: 双环转债! | C72: 128032 | D72: 43125. | E72: 双环传动 | F72: 2472 | G72: 机械装备 | H72: 通用设备 | I72: 105.31 | J72: -1.8e-003 | K72: 8.0000000000000002e-003 | L72: 6.85 | M72: 5.3800000000000001e-002 | N72: 2.4 | O72: 2.e-003 | P72: 110.3 | Q72: 9.89 | R72: 1.43 | S72: 69.26 | T72: 0.52000000000000002 | U72: 转股中 | V72: 3.21年 | W72: 1.21年 | X72: 0.21299999999999999 | Y72: 0.14699999999999999 | Z72: 10 | AA72: 47 | AB72: 1.49e-002 | AC72: 8.8000000000000005e-003 | AD72: -1.7600000000000001e-002 | AE72: -2.1499999999999998e-002 | AF72: 96.95 | AG72: 96.36 | AH72: 0.12 | AI72: AA | AJ72: 4.41e-002 | AK72: =I72+100*T72 -> 157.31 | AL72: 141.4 | AM72: 209 | AN72: 44.4 | AO72: 176 | AP72: -1.3999999999999999e-002 | AQ72: 46 | AR72: 双环转债!
A73: 209 | B73: 苏银转债! | C73: 110053 | D73: 43558. | E73: 江苏银行 | F73: 600919 | G73: 金融 | H73: 银行行业 | I73: 111.76 | J73: 4.8999999999999998e-003 | K73: -3.3e-003 | L73: 6.11 | M73: 4.8999999999999998e-003 | N73: 23 | O73: 1.e-003 | P73: 119.1 | Q73: 7.28 | R73: 0.61 | S73: 83.93 | T73: 0.33200000000000002 | U73: 转股中 | V73: 4.42年 | W73: 无权 | X73: 0.28399999999999997 | Y73: 0.23800000000000002 | Z73: 200 | AA73: 705 | AB73: 1.49e-002 | AC73: 7.1999999999999998e-003 | AD73: 无权 | AE73: 无权 | AF73: 无权 | AG73: 101.04 | AH73: 0.34 | AI73: AAA | AJ73: 3.9100000000000003e-002 | AK73: =I73+100*T73 -> 144.96000000000001 | AL73: 139.6 | AM73: 195 | AN73: 38.5 | AO73: 115 | AP73: -4.4999999999999998e-002 | AQ73: 46 | AR73: 苏银转债!
A74: 43 | B74: 宁建转债 | C74: 113036 | D74: 44049. | E74: 宁波建工 | F74: 601789 | G74: 建筑 | H74: 建筑工程 | I74: 108.28 | J74: 2.1499999999999998e-002 | K74: -8.3999999999999995e-003 | L74: 4.39 | M74: 2.5699999999999997e-002 | N74: 5.5 | O74: 9.0000000000000011e-003 | P74: 117.3 | Q74: 4.86 | R74: 1.47 | S74: 90.33 | T74: 0.19899999999999998 | U74: 3月2天 | V74: 5.73年 | W74: 3.73年 | X74: 0.126 | Y74: 0.114 | Z74: 5.4 | AA74: 43 | AB74: 1.43e-002 | AC74: 8.8999999999999999e-003 | AD74: -1.09e-002 | AE74: -1.2699999999999999e-002 | AF74: 87.37 | AG74: 91.27 | AH74: 0.51 | AI74: AA | AJ74: 4.5599999999999995e-002 | AK74: =I74+100*T74 -> 128.18000000000001 | AL74: 126.2 | AM74: 80 | AN74: 35 | AO74: 71 | AP74: -4.0999999999999995e-002 | AQ74: 5 | AR74: 宁建转债
A75: 28 | B75: 紫银转债 | C75: 113037 | D75: 44060. | E75: 紫金银行 | F75: 601860 | G75: 金融 | H75: 银行行业 | I75: 106.85 | J75: -5.9999999999999995e-004 | K75: 7.6e-003 | L75: 4.12 | M75: 1.4800000000000001e-002 | N75: 23 | O75: 5.0000000000000001e-003 | P75: 115.8 | Q75: 4.75 | R75: 1.09 | S75: 86.74 | T75: 0.23199999999999998 | U75: 3月20天 | V75: 5.78年 | W75: 无权 | X75: 0.29799999999999999 | Y75: 0.25900000000000001 | Z75: 45 | AA75: 151 | AB75: 1.43e-002 | AC75: 9.300000000000001e-003 | AD75: 无权 | AE75: 无权 | AF75: 无权 | AG75: 90.92 | AH75: 0.47 | AI75: AA+ | AJ75: 4.36e-002 | AK75: =I75+100*T75 -> 130.04999999999998 | AL75: 127 | AM75: 91 | AN75: 36 | AO75: 88 | AP75: -1.9e-002 | AQ75: 14 | AR75: 紫银转债
A76: 109 | B76: 百达转债 | C76: 113570 | D76: 43929. | E76: 百达精工 | F76: 603331 | G76: 机械装备 | H76: 机械装备 | I76: 107.1 | J76: 5.0000000000000001e-004 | K76: 1.21e-002 | L76: 10.66 | M76: 1.8100000000000002e-002 | N76: 4.3 | O76: 1.3999999999999999e-002 | P76: 115.3 | Q76: 11.54 | R76: 1.74 | S76: 92.37 | T76: 0.159 | U76: 转股中 | V76: 5.41年 | W76: 3.41年 | X76: 0.14699999999999999 | Y76: 0.13600000000000001 | Z76: 2.8 | AA76: 19 | AB76: 1.3999999999999999e-002 | AC76: 8.8000000000000005e-003 | AD76: -8.8000000000000005e-003 | AE76: -1.0800000000000001e-002 | AF76: 79.66 | AG76: 77.6 | AH76: 0.69 | AI76: A+ | AJ76: 7.7600000000000002e-002 | AK76: =I76+100*T76 -> 123. | AL76: 121.8 | AM76: 39 | AN76: 42.2 | AO76: 152 | AP76: -5.0999999999999997e-002 | AQ76: 31 | AR76: 百达转债
A77: 195 | B77: 核建转债! | C77: 113024 | D77: 43581. | E77: 中国核建 | F77: 601611 | G77: 建筑 | H77: 建筑工程 | I77: 103.41 | J77: 1.e-003 | K77: 6.9999999999999993e-003 | L77: 7.48 | M77: 2.75e-002 | N77: 4.5 | O77: 1.e-003 | P77: 109.7 | Q77: 9.76 | R77: 1.92 | S77: 76.64 | T77: 0.34899999999999998 | U77: 转股中 | V77: 4.49年 | W77: 2.49年 | X77: 0.151 | Y77: 0.11599999999999999 | Z77: 30 | AA77: 198 | AB77: 1.3500000000000002e-002 | AC77: 9.3999999999999986e-003 | AD77: -8.0000000000000004e-004 | AE77: -3.0999999999999999e-003 | AF77: 93.28 | AG77: 92.65 | AH77: 0.29 | AI77: AAA | AJ77: 3.9100000000000003e-002 | AK77: =I77+100*T77 -> 138.31 | AL77: 130.2 | AM77: 115 | AN77: 36.9 | AO77: 96 | AP77: 0. | AQ77: 43 | AR77: 核建转债!
A78: 180 | B78: 清水转债 | C78: 123028 | D78: 43661. | E78: 清水源 | F78: 300437 | G78: 城市公用 | H78: 三废处理 | I78: 114.6 | J78: 2.0499999999999997e-002 | K78: 1.2699999999999999e-002 | L78: 13.23 | M78: 4.58e-002 | N78: 9.6 | O78: 1.7000000000000001e-002 | P78: 121.8 | Q78: 11.84 | R78: 1.92 | S78: 111.74 | T78: 2.6000000000000002e-002 | U78: 转股中 | V78: 4.69年 | W78: 2.69年 | X78: 0.17000000000000001 | Y78: 0.19 | Z78: 4.9 | AA78: 29 | AB78: 1.34e-002 | AC78: 5.3e-003 | AD78: -3.15e-002 | AE78: -3.4500000000000003e-002 | AF78: 87.67 | AG78: 91.33 | AH78: 0.72 | AI78: AA- | AJ78: 6.5099999999999991e-002 | AK78: =I78+100*T78 -> 117.19999999999999 | AL78: 117.5 | AM78: 10 | AN78: 26.1 | AO78: 15 | AP78: 8.8000000000000009e-002 | AQ78: 48 | AR78: 清水转债
A79: 61 | B79: 思特转债 | C79: 123054 | D79: 44018. | E79: 思特奇 | F79: 300608 | G79: 通信互联 | H79: 通信设备 | I79: 113.256 | J79: 1.1599999999999999e-002 | K79: 1.7000000000000001e-003 | L79: 17.39 | M79: 1.8100000000000002e-002 | N79: 3.4 | O79: 1.1000000000000001e-002 | P79: 121.7 | Q79: 16.49 | R79: 3.54 | S79: 105.46 | T79: 7.400000000000001e-002 | U79: 2月6天 | V79: 5.66年 | W79: 3.66年 | X79: 9.9000000000000005e-002 | Y79: 0.10400000000000001 | Z79: 2.7 | AA79: 27 | AB79: 1.3100000000000001e-002 | AC79: 6.4000000000000003e-003 | AD79: -2.07e-002 | AE79: -2.3e-002 | AF79: 81.97 | AG79: 85.2 | AH79: 0.73 | AI79: AA- | AJ79: 6.6600000000000006e-002 | AK79: =I79+100*T79 -> 120.65600000000001 | AL79: 121.1 | AM79: 34 | AN79: 35.9 | AO79: 83 | AP79: -3.9e-002 | AQ79: 10 | AR79: 思特转债
A80: 21 | B80: 大禹转债 | C80: 123063 | D80: 44063. | E80: 大禹节水 | F80: 300021 | G80: 化工 | H80: 橡胶塑料 | I80: 117.701 | J80: 2.18e-002 | K80: 6.8000000000000005e-003 | L80: 5.39 | M80: 3.85e-002 | N80: 14 | O80: 1.9e-002 | P80: 126.5 | Q80: 4.94 | R80: 3.02 | S80: 109.11 | T80: 7.9000000000000001e-002 | U80: 3月25天 | V80: 5.79年 | W80: 4.79年 | X80: 0.14800000000000002 | Y80: 0.16200000000000001 | Z80: 6.4 | AA80: 43 | AB80: 1.2800000000000001e-002 | AC80: 5.1000000000000004e-003 | AD80: -1.9299999999999998e-002 | AE80: -2.1899999999999999e-002 | AF80: 78.13 | AG80: 87.73 | AH80: 0.74 | AI80: AA- | AJ80: 6.6600000000000006e-002 | AK80: =I80+100*T80 -> 125.601 | AL80: 126.3 | AM80: 82 | AN80: 38.6 | AO80: 117 | AP80: -8.9999999999999997e-002 | AQ80: 12 | AR80: 大禹转债
A81: 250 | B81: 湖广转债! | C81: 127007 | D81: 43313. | E81: 湖北广电 | F81: 665 | G81: 传媒娱乐 | H81: 影视娱乐 | I81: 107.254 | J81: 5.0000000000000001e-003 | K81: 1.9e-003 | L81: 4.99 | M81: 1.6299999999999999e-002 | N81: 2 | O81: 2.e-003 | P81: 112.3 | Q81: 5.58 | R81: 0.74 | S81: 89.43 | T81: 0.19899999999999998 | U81: 转股中 | V81: 3.71年 | W81: 1.71年 | X81: 0.248 | Y81: 0.222 | Z81: 12 | AA81: 49 | AB81: 1.2699999999999999e-002 | AC81: 6.5000000000000006e-003 | AD81: -2.2499999999999999e-002 | AE81: -2.53e-002 | AF81: 95.19 | AG81: 96.64 | AH81: 0.42 | AI81: AA+ | AJ81: 4.2099999999999999e-002 | AK81: =I81+100*T81 -> 127.154 | AL81: 125.1 | AM81: 67 | AN81: 28.4 | AO81: 24 | AP81: -4.2000000000000003e-002 | AQ81: 17 | AR81: 湖广转债!
A82: 7 | B82: 嘉泽转债! | C82: 113039 | D82: 44091. | E82: 嘉泽新能 | F82: 601619 | G82: 能源电力 | H82: 风能 | I82: 105.17 | J82: 2.2499999999999999e-002 | K82: 2.7300000000000001e-002 | L82: 3.39 | M82: 8.3100000000000007e-002 | N82: 104 | O82: 7.4999999999999997e-002 | P82: 113.1 | Q82: 3.57 | R82: 2.1 | S82: 94.96 | T82: 0.10800000000000001 | U82: 4月21天 | V82: 5.87年 | W82: 3.87年 | X82: 0.185 | Y82: 0.17600000000000002 | Z82: 13 | AA82: 70 | AB82: 1.2699999999999999e-002 | AC82: 8.5000000000000006e-003 | AD82: -3.7000000000000002e-003 | AE82: -5.5000000000000005e-003 | AF82: 86.66 | AG82: 87.46 | AH82: 0.6 | AI82: AA | AJ82: 4.5599999999999995e-002 | AK82: =I82+100*T82 -> 115.97 | AL82: 115.4 | AM82: 3 | AN82: 27.9 | AO82: 22 | AP82: 6.9000000000000006e-002 | AQ82: 6 | AR82: 嘉泽转债!
A83: 196 | B83: 司尔转债! | C83: 128064 | D83: 43592. | E83: 司尔特 | F83: 2538 | G83: 化工 | H83: 农化 | I83: 108.721 | J83: 9.3999999999999986e-003 | K83: 4.0000000000000001e-003 | L83: 5.9 | M83: 2.4300000000000002e-002 | N83: 13 | O83: 1.4999999999999999e-002 | P83: 114.9 | Q83: 6.07 | R83: 1.13 | S83: 97.2 | T83: 0.11900000000000001 | U83: 转股中 | V83: 4.49年 | W83: 2.49年 | X83: 0.18899999999999997 | Y83: 0.184 | Z83: 8 | AA83: 42 | AB83: 1.26e-002 | AC83: 6.6e-003 | AD83: -1.89e-002 | AE83: -2.1299999999999999e-002 | AF83: 92.3 | AG83: 95.03 | AH83: 0.55 | AI83: AA | AJ83: 4.41e-002 | AK83: =I83+100*T83 -> 120.62100000000001 | AL83: 120.2 | AM83: 28 | AN83: 25.2 | AO83: 12 | AP83: -7.8e-002 | AQ83: 56 | AR83: 司尔转债!
A84: 125 | B84: 银河转债! | C84: 123042 | D84: 43875. | E84: 金银河 | F84: 300619 | G84: 机械装备 | H84: 专用设备 | I84: 108.82 | J84: 1.43e-002 | K84: 5.7999999999999996e-003 | L84: 22.32 | M84: 3.0499999999999999e-002 | N84: 3.2 | O84: 1.7000000000000001e-002 | P84: 115.9 | Q84: 24.4 | R84: 3.52 | S84: 91.48 | T84: 0.19 | U84: 转股中 | V84: 5.26年 | W84: 3.26年 | X84: 0.10000000000000001 | Y84: 9.1999999999999998e-002 | Z84: 1.7 | AA84: 17 | AB84: 1.23e-002 | AC84: 6.8000000000000005e-003 | AD84: -1.2699999999999999e-002 | AE84: -1.4999999999999999e-002 | AF84: 80.98 | AG84: 79 | AH84: 0.66 | AI84: A+ | AJ84: 7.7600000000000002e-002 | AK84: =I84+100*T84 -> 127.81999999999999 | AL84: 126.2 | AM84: 76 | AN84: 45.2 | AO84: 184 | AP84: -3.7999999999999999e-002 | AQ84: 23 | AR84: 银河转债!
A85: 11 | B85: 精达转债 | C85: 110074 | D85: 44095. | E85: 精达股份 | F85: 600577 | G85: 电子 | H85: 电子产品 | I85: 109.35 | J85: 1.2500000000000001e-002 | K85: 4.7999999999999996e-003 | L85: 3.39 | M85: 3.3500000000000002e-002 | N85: 19 | O85: 2.2000000000000002e-002 | P85: 117.3 | Q85: 3.75 | R85: 1.85 | S85: 90.4 | T85: 0.20999999999999999 | U85: 4月17天 | V85: 5.86年 | W85: 3.86年 | X85: 0.121 | Y85: 0.109 | Z85: 7.9 | AA85: 65 | AB85: 1.23e-002 | AC85: 6.9999999999999993e-003 | AD85: -1.3000000000000001e-002 | AE85: -1.4800000000000001e-002 | AF85: 86.9 | AG85: 90.78 | AH85: 0.52 | AI85: AA | AJ85: 4.5599999999999995e-002 | AK85: =I85+100*T85 -> 130.34999999999999 | AL85: 128.3 | AM85: 102 | AN85: 37.5 | AO85: 102 | AP85: -7.2999999999999995e-002 | AQ85: 5 | AR85: 精达转债
A86: 229 | B86: 山鹰转债 | C86: 110047 | D86: 43444. | E86: 山鹰纸业 | F86: 600567 | G86: 造纸包装 | H86: 包装用纸 | I86: 112.65 | J86: 7.1999999999999998e-003 | K86: 1.e-004 | L86: 3.13 | M86: 1.6200000000000003e-002 | N86: 7.7 | O86: 3.0000000000000001e-003 | P86: 118.1 | Q86: 3.34 | R86: 1.01 | S86: 93.71 | T86: 0.20199999999999999 | U86: 转股中 | V86: 4年41天 | W86: 2年41天 | X86: 0.16 | Y86: 0.14999999999999999 | Z86: 23 | AA86: 144 | AB86: 1.18e-002 | AC86: 4.0000000000000001e-003 | AD86: -3.7200000000000004e-002 | AE86: -3.9900000000000005e-002 | AF86: 94.26 | AG86: 100.05 | AH86: 0.45 | AI86: AA+ | AJ86: 4.2099999999999999e-002 | AK86: =I86+100*T86 -> 132.84999999999999 | AL86: 131.6 | AM86: 128 | AN86: 31.5 | AO86: 48 | AP86: -1.8000000000000002e-002 | AQ86: 34 | AR86: 山鹰转债
A87: 156 | B87: 金力转债! | C87: 123033 | D87: 43794. | E87: 金力永磁 | F87: 300748 | G87: 电子 | H87: 元器件制 | I87: 115.199 | J87: 6.0999999999999995e-003 | K87: 1.3300000000000001e-002 | L87: 41.7 | M87: 2.8399999999999998e-002 | N87: 57 | O87: 0.114 | P87: 121.9 | Q87: 40.97 | R87: 13.59 | S87: 101.78 | T87: 0.13200000000000001 | U87: 转股中 | V87: 5年21天 | W87: 3年21天 | X87: 2.5000000000000001e-002 | Y87: 2.6000000000000002e-002 | Z87: 4.4 | AA87: 173 | AB87: 1.1599999999999999e-002 | AC87: 4.0000000000000001e-003 | AD87: -2.76e-002 | AE87: -3.0699999999999998e-002 | AF87: 85.92 | AG87: 88.86 | AH87: 0.68 | AI87: AA- | AJ87: 6.6600000000000006e-002 | AK87: =I87+100*T87 -> 128.399 | AL87: 128.6 | AM87: 104 | AN87: 39.8 | AO87: 133 | AP87: 5.9000000000000004e-002 | AQ87: 25 | AR87: 金力转债!
A88: 124 | B88: 星帅转债 | C88: 128094 | D88: 43880. | E88: 星帅尔 | F88: 2860 | G88: 家电 | H88: 零部件制 | I88: 114.5 | J88: 1.78e-002 | K88: 1.1999999999999999e-003 | L88: 14.22 | M88: 2.6000000000000002e-002 | N88: 8.6 | O88: 2.7000000000000003e-002 | P88: 121.5 | Q88: 13.95 | R88: 3.16 | S88: 101.94 | T88: 0.12300000000000001 | U88: 转股中 | V88: 5.27年 | W88: 3.27年 | X88: 9.9000000000000005e-002 | Y88: 0.10099999999999999 | Z88: 2.8 | AA88: 28 | AB88: 1.1599999999999999e-002 | AC88: 4.5000000000000005e-003 | AD88: -2.64e-002 | AE88: -2.8799999999999999e-002 | AF88: 81.22 | AG88: 82.79 | AH88: 0.73 | AI88: A+ | AJ88: 7.7600000000000002e-002 | AK88: =I88+100*T88 -> 126.8 | AL88: 127.1 | AM88: 93 | AN88: 44.3 | AO88: 174 | AP88: -1.9e-002 | AQ88: 28 | AR88: 星帅转债
A89: 160 | B89: 北方转债 | C89: 127014 | D89: 43790. | E89: 北方国际 | F89: 65 | G89: 建筑 | H89: 建筑工程 | I89: 109.38 | J89: 2.5999999999999999e-003 | K89: 4.5000000000000005e-003 | L89: 7.63 | M89: 1.6e-002 | N89: 0.2 | O89: 0. | P89: 115.6 | Q89: 8.75 | R89: 1.18 | S89: 87.2 | T89: 0.254 | U89: 转股中 | V89: 5年13天 | W89: 3年13天 | X89: 9.8000000000000004e-002 | Y89: 8.5999999999999993e-002 | Z89: 5.8 | AA89: 59 | AB89: 1.1299999999999999e-002 | AC89: 5.6999999999999993e-003 | AD89: -1.55e-002 | AE89: -1.8000000000000002e-002 | AF89: 90.99 | AG89: 93.73 | AH89: 0.44 | AI89: AA+ | AJ89: 4.36e-002 | AK89: =I89+100*T89 -> 134.78 | AL89: 131.6 | AM89: 127 | AN89: 37.8 | AO89: 107 | AP89: -6.9999999999999993e-003 | AQ89: 17 | AR89: 北方转债
A90: 32 | B90: 淳中转债 | C90: 113594 | D90: 44071. | E90: 淳中科技 | F90: 603516 | G90: 电子 | H90: 电子产品 | I90: 114.1 | J90: 4.4000000000000003e-003 | K90: -1.9e-003 | L90: 34.08 | M90: 4.0999999999999995e-003 | N90: 0.6 | O90: 2.e-003 | P90: 121.4 | Q90: 39.37 | R90: 5.36 | S90: 86.56 | T90: 0.318 | U90: 3月18天 | V90: 5.78年 | W90: 3.78年 | X90: 6.6000000000000003e-002 | Y90: 5.7000000000000002e-002 | Z90: 3 | AA90: 45 | AB90: 1.1000000000000001e-002 | AC90: 4.5999999999999999e-003 | AD90: -2.2099999999999998e-002 | AE90: -2.4300000000000002e-002 | AF90: 78.15 | AG90: 79.63 | AH90: 0.61 | AI90: A+ | AJ90: 7.7600000000000002e-002 | AK90: =I90+100*T90 -> 145.90000000000001 | AL90: 141.6 | AM90: 213 | AN90: 62 | AO90: 257 | AP90: -2.2000000000000002e-002 | AQ90: 3 | AR90: 淳中转债
A91: 152 | B91: 白电转债 | C91: 113549 | D91: 43810. | E91: 白云电器 | F91: 603861 | G91: 能源电力 | H91: 电力设备 | I91: 109.24 | J91: 1.0500000000000001e-002 | K91: -5.0000000000000001e-004 | L91: 8.35 | M91: 1.83e-002 | N91: 0.8 | O91: 1.e-003 | P91: 115.1 | Q91: 8.88 | R91: 1.63 | S91: 94.03 | T91: 0.16200000000000001 | U91: 转股中 | V91: 5年35天 | W91: 3年35天 | X91: 0.23899999999999999 | Y91: 0.22399999999999998 | Z91: 8.8 | AA91: 37 | AB91: 1.0500000000000001e-002 | AC91: 5.1000000000000004e-003 | AD91: -1.6299999999999999e-002 | AE91: -1.84e-002 | AF91: 89.71 | AG91: 92.12 | AH91: 0.55 | AI91: AA | AJ91: 4.5599999999999995e-002 | AK91: =I91+100*T91 -> 125.44 | AL91: 124.4 | AM91: 66 | AN91: 32.3 | AO91: 54 | AP91: -3.1e-002 | AQ91: 30 | AR91: 白电转债
A92: 204 | B92: 岱勒转债! | C92: 123024 | D92: 43572. | E92: 岱勒新材 | F92: 300700 | G92: 机械装备 | H92: 专用设备 | I92: 109.252 | J92: 1.9e-002 | K92: 1.21e-002 | L92: 21.42 | M92: 6.83e-002 | N92: 8.5 | O92: 3.7000000000000005e-002 | P92: 113 | Q92: 24.9 | R92: 3.59 | S92: 86.02 | T92: 0.27000000000000002 | U92: 转股中 | V92: 3.44年 | W92: 1.44年 | X92: 0.11900000000000001 | Y92: 0.10199999999999999 | Z92: 2.1 | AA92: 18 | AB92: 1.e-002 | AC92: 3.0999999999999999e-003 | AD92: -4.3499999999999997e-002 | AE92: -4.5499999999999999e-002 | AF92: 90.48 | AG92: 88.08 | AH92: 0.45 | AI92: A+ | AJ92: 7.6100000000000001e-002 | AK92: =I92+100*T92 -> 136.25200000000001 | AL92: 132.5 | AM92: 138 | AN92: 42 | AO92: 151 | AP92: -2.3e-002 | AQ92: 32 | AR92: 岱勒转债!
A93: 44 | B93: 瀛通转债 | C93: 128118 | D93: 44048. | E93: 瀛通通讯 | F93: 2861 | G93: 电子 | H93: 电子产品 | I93: 115.51 | J93: 1.41e-002 | K93: -2.8000000000000004e-003 | L93: 24.97 | M93: 1.9199999999999998e-002 | N93: 4.2 | O93: 1.2e-002 | P93: 122.1 | Q93: 27.53 | R93: 2.89 | S93: 90.7 | T93: 0.27399999999999997 | U93: 2月29天 | V93: 5.72年 | W93: 3.72年 | X93: 9.9000000000000005e-002 | Y93: 8.900000000000001e-002 | Z93: 3 | AA93: 30 | AB93: 1.e-002 | AC93: 3.3e-003 | AD93: -2.5399999999999999e-002 | AE93: -2.76e-002 | AF93: 81.62 | AG93: 85.14 | AH93: 0.59 | AI93: AA- | AJ93: 6.6600000000000006e-002 | AK93: =I93+100*T93 -> 142.91 | AL93: 140.3 | AM93: 200 | AN93: 55.2 | AO93: 229 | AP93: -1.e-002 | AQ93: 4 | AR93: 瀛通转债
A94: 170 | B94: 哈尔转债! | C94: 128073 | D94: 43719. | E94: 哈尔斯 | F94: 2615 | G94: 其他 | H94: 家居用品 | I94: 111.25 | J94: 1.6e-002 | K94: 2.12e-002 | L94: 5.63 | M94: 6.0299999999999999e-002 | N94: 20 | O94: 6.0999999999999999e-002 | P94: 115.3 | Q94: 5.72 | R94: 2.99 | S94: 98.43 | T94: 0.13 | U94: 转股中 | V94: 3.86年 | W94: 1.86年 | X94: 0.129 | Y94: 0.127 | Z94: 3 | AA94: 23 | AB94: 9.3999999999999986e-003 | AC94: 2.3e-003 | AD94: -4.1799999999999997e-002 | AE94: -4.3700000000000003e-002 | AF94: 89.85 | AG94: 90.66 | AH94: 0.62 | AI94: AA- | AJ94: 6.5099999999999991e-002 | AK94: =I94+100*T94 -> 124.25 | AL94: 124.1 | AM94: 61 | AN94: 33.4 | AO94: 61 | AP94: -6.8000000000000005e-002 | AQ94: 38 | AR94: 哈尔转债!
A95: 114 | B95: 君禾转债 | C95: 113567 | D95: 43924. | E95: 君禾股份 | F95: 603617 | G95: 机械装备 | H95: 通用设备 | I95: 113.64 | J95: 9.7000000000000003e-003 | K95: -1.4000000000000002e-003 | L95: 12.34 | M95: 1.06e-002 | N95: 4.6 | O95: 1.9e-002 | P95: 119.3 | Q95: 11.46 | R95: 3.94 | S95: 107.68 | T95: 5.5e-002 | U95: 转股中 | V95: 5.39年 | W95: 3.39年 | X95: 8.5000000000000006e-002 | Y95: 9.1999999999999998e-002 | Z95: 2.1 | AA95: 25 | AB95: 9.300000000000001e-003 | AC95: 3.0000000000000001e-003 | AD95: -2.3599999999999999e-002 | AE95: -2.6000000000000002e-002 | AF95: 80.35 | AG95: 80.52 | AH95: 0.78 | AI95: A+ | AJ95: 7.7600000000000002e-002 | AK95: =I95+100*T95 -> 119.14 | AL95: 119.6 | AM95: 26 | AN95: 39.1 | AO95: 121 | AP95: 3.4000000000000002e-002 | AQ95: 29 | AR95: 君禾转债
A96: 48 | B96: 瑞达转债 | C96: 128116 | D96: 44036. | E96: 瑞达期货 | F96: 2961 | G96: 金融 | H96: 期货行业 | I96: 109.458 | J96: 4.1999999999999997e-003 | K96: 3.8e-003 | L96: 28.74 | M96: 1.38e-002 | N96: 3.2 | O96: 5.0000000000000001e-003 | P96: 115.3 | Q96: 29.82 | R96: 7.52 | S96: 96.38 | T96: 0.13600000000000001 | U96: 2月25天 | V96: 5.72年 | W96: 3.72年 | X96: 5.0999999999999997e-002 | Y96: 4.9000000000000002e-002 | Z96: 6.5 | AA96: 128 | AB96: 9.300000000000001e-003 | AC96: 4.5000000000000005e-003 | AD96: -1.3899999999999999e-002 | AE96: -1.5700000000000002e-002 | AF96: 87.37 | AG96: 89.79 | AH96: 0.58 | AI96: AA | AJ96: 4.5599999999999995e-002 | AK96: =I96+100*T96 -> 123.05799999999999 | AL96: 122.5 | AM96: 45 | AN96: 32.7 | AO96: 57 | AP96: -2.e-003 | AQ96: 7 | AR96: 瑞达转债
A97: 203 | B97: 招路转债! | C97: 127012 | D97: 43585. | E97: 招商公路 | F97: 1965 | G97: 机场高速 | H97: 高速 | I97: 104.011 | J97: -8.5000000000000006e-003 | K97: 1.1299999999999999e-002 | L97: 6.72 | M97: 1.0500000000000001e-002 | N97: 7 | O97: 1.e-003 | P97: 108.2 | Q97: 8.81 | R97: 0.88 | S97: 76.28 | T97: 0.36399999999999999 | U97: 转股中 | V97: 4.44年 | W97: 2.44年 | X97: 0.12 | Y97: 9.1999999999999998e-002 | Z97: 50 | AA97: 415 | AB97: 9.0000000000000011e-003 | AC97: 5.5000000000000005e-003 | AD97: -7.7000000000000002e-003 | AE97: -9.1000000000000004e-003 | AF97: 92.29 | AG97: 91.44 | AH97: 0.27 | AI97: AAA | AJ97: 3.9100000000000003e-002 | AK97: =I97+100*T97 -> 140.411 | AL97: 131.7 | AM97: 129 | AN97: 39.5 | AO97: 126 | AP97: -2.7999999999999997e-002 | AQ97: 35 | AR97: 招路转债!
A98: 118 | B98: 天目转债 | C98: 113564 | D98: 43906. | E98: 天目湖 | F98: 603136 | G98: 旅游餐饮 | H98: 旅游 | I98: 120.87 | J98: -2.2200000000000001e-002 | K98: -1.0200000000000001e-002 | L98: 26.25 | M98: -4.41e-002 | N98: 16 | O98: 4.4999999999999998e-002 | P98: 126.7 | Q98: 23.8 | R98: 3.42 | S98: 110.29 | T98: 9.6000000000000002e-002 | U98: 转股中 | V98: 5.38年 | W98: 3.38年 | X98: 9.9000000000000005e-002 | Y98: 0.109 | Z98: 3 | AA98: 30 | AB98: 9.0000000000000011e-003 | AC98: 8.0000000000000004e-004 | AD98: -4.0300000000000002e-002 | AE98: -4.2699999999999995e-002 | AF98: 83.47 | AG98: 90.28 | AH98: 0.73 | AI98: AA- | AJ98: 6.6600000000000006e-002 | AK98: =I98+100*T98 -> 130.47 | AL98: 131.4 | AM98: 126 | AN98: 41.2 | AO98: 145 | AP98: -0.10300000000000001 | AQ98: 11 | AR98: 天目转债
A99: 188 | B99: 亚泰转债! | C99: 128066 | D99: 43599. | E99: 郑中设计 | F99: 2811 | G99: 建筑 | H99: 装饰工程 | I99: 113 | J99: 9.1999999999999998e-003 | K99: 1.0500000000000001e-002 | L99: 10.37 | M99: 2.6699999999999998e-002 | N99: 1.6 | O99: 3.0000000000000001e-003 | P99: 117.5 | Q99: 9.67 | R99: 1.91 | S99: 107.24 | T99: 5.4000000000000006e-002 | U99: 转股中 | V99: 4.52年 | W99: 2.52年 | X99: 0.17100000000000001 | Y99: 0.184 | Z99: 4.8 | AA99: 28 | AB99: 8.8999999999999999e-003 | AC99: 2.e-003 | AD99: -3.1400000000000004e-002 | AE99: -3.4000000000000002e-002 | AF99: 87.86 | AG99: 88.98 | AH99: 0.74 | AI99: AA- | AJ99: 6.5099999999999991e-002 | AK99: =I99+100*T99 -> 118.40000000000001 | AL99: 118.8 | AM99: 19 | AN99: 29.8 | AO99: 34 | AP99: -4.0000000000000001e-003 | AQ99: 58 | AR99: 亚泰转债!
A100: 132 | B100: 开润转债! | C100: 123039 | D100: 43853. | E100: 开润股份 | F100: 300577 | G100: 服装纺织 | H100: 纺织行业 | I100: 116.395 | J100: 3.4000000000000002e-003 | K100: 1.72e-002 | L100: 32.77 | M100: 2.8900000000000002e-002 | N100: 0.7 | O100: 3.0000000000000001e-003 | P100: 121.5 | Q100: 33.22 | R100: 8.11 | S100: 98.65 | T100: 0.17999999999999999 | U100: 转股中 | V100: 5.21年 | W100: 3.21年 | X100: 3.1e-002 | Y100: 3.1e-002 | Z100: 2.2 | AA100: 71 | AB100: 8.5000000000000006e-003 | AC100: 1.2999999999999999e-003 | AD100: -3.1600000000000003e-002 | AE100: -3.4099999999999998e-002 | AF100: 81.57 | AG100: 83.15 | AH100: 0.71 | AI100: A+ | AJ100: 7.7600000000000002e-002 | AK100: =I100+100*T100 -> 134.39499999999998 | AL100: 134.1 | AM100: 159 | AN100: 51 | AO100: 204 | AP100: 6.2e-002 | AQ100: 21 | AR100: 开润转债!
A101: 129 | B101: 正裕转债! | C101: 113561 | D101: 43871. | E101: 正裕工业 | F101: 603089 | G101: 汽车 | H101: 零部件制 | I101: 113.58 | J101: 2.52e-002 | K101: 1.15e-002 | L101: 11.3 | M101: 4.6300000000000001e-002 | N101: 21 | O101: 0.11199999999999999 | P101: 118.5 | Q101: 10.23 | R101: 3.01 | S101: 110.46 | T101: 2.7999999999999997e-002 | U101: 转股中 | V101: 5.22年 | W101: 3.22年 | X101: 7.0000000000000007e-002 | Y101: 7.6999999999999999e-002 | Z101: 1.6 | AA101: 24 | AB101: 8.3999999999999995e-003 | AC101: 2.0999999999999999e-003 | AD101: -2.4199999999999999e-002 | AE101: -2.6699999999999998e-002 | AF101: 81.56 | AG101: 81.05 | AH101: 0.79 | AI101: A+ | AJ101: 7.7600000000000002e-002 | AK101: =I101+100*T101 -> 116.38 | AL101: 116.7 | AM101: 8 | AN101: 35.1 | AO101: 73 | AP101: -0.121 | AQ101: 30 | AR101: 正裕转债!
A102: 23 | B102: 城地转债! | C102: 113596 | D102: 44063. | E102: 城地股份 | F102: 603887 | G102: 通信互联 | H102: 通信设备 | I102: 108.21 | J102: -3.9000000000000003e-003 | K102: -6.1999999999999998e-003 | L102: 23.79 | M102: -1.9e-002 | N102: 2.7 | O102: 2.e-003 | P102: 113.5 | Q102: 29.21 | R102: 2.56 | S102: 81.44 | T102: 0.32899999999999996 | U102: 3月26天 | V102: 5.79年 | W102: 3.79年 | X102: 0.13400000000000001 | Y102: 0.109 | Z102: 12 | AA102: 89 | AB102: 8.3999999999999995e-003 | AC102: 4.1999999999999997e-003 | AD102: -1.0500000000000001e-002 | AE102: -1.23e-002 | AF102: 80.63 | AG102: 78.71 | AH102: 0.53 | AI102: AA- | AJ102: 6.6600000000000006e-002 | AK102: =I102+100*T102 -> 141.10999999999999 | AL102: 135 | AM102: 163 | AN102: 54.3 | AO102: 224 | AP102: -4.0000000000000001e-002 | AQ102: 7 | AR102: 城地转债!
A103: 4 | B103: 景兴转债 | C103: 128130 | D103: 44092. | E103: 景兴纸业 | F103: 2067 | G103: 造纸包装 | H103: 包装用纸 | I103: 109.979 | J103: 4.4000000000000003e-003 | K103: 1.6899999999999998e-002 | L103: 3.44 | M103: 3.3000000000000002e-002 | N103: 34 | O103: 2.4e-002 | P103: 115.1 | Q103: 3.4 | R103: 0.86 | S103: 101.18 | T103: 8.6999999999999994e-002 | U103: 4月24天 | V103: 5.89年 | W103: 3.89年 | X103: 0.33500000000000002 | Y103: 0.33899999999999997 | Z103: 13 | AA103: 38 | AB103: 7.9000000000000008e-003 | AC103: 3.3e-003 | AD103: -1.47e-002 | AE103: -1.6399999999999998e-002 | AF103: 86.59 | AG103: 88.92 | AH103: 0.64 | AI103: AA | AJ103: 4.5599999999999995e-002 | AK103: =I103+100*T103 -> 118.679 | AL103: 118.8 | AM103: 20 | AN103: 29.9 | AO103: 37 | AP103: -4.2000000000000003e-002 | AQ103: 7 | AR103: 景兴转债
A104: 66 | B104: 飞鹿转债 | C104: 123052 | D104: 44015. | E104: 飞鹿股份 | F104: 300665 | G104: 化工 | H104: 化工 | I104: 122 | J104: 3.39e-002 | K104: 8.0000000000000004e-004 | L104: 12.25 | M104: 4.1700000000000001e-002 | N104: 12 | O104: 5.5e-002 | P104: 127.3 | Q104: 9.9 | R104: 3.26 | S104: 123.74 | T104: -1.3999999999999999e-002 | U104: 2月1天 | V104: 5.65年 | W104: 3.65年 | X104: 0.11900000000000001 | Y104: 0.14699999999999999 | Z104: 1.8 | AA104: 15 | AB104: 7.7000000000000002e-003 | AC104: -2.0000000000000001e-004 | AD104: -3.85e-002 | AE104: -4.0899999999999999e-002 | AF104: 79.42 | AG104: 84.35 | AH104: 0.83 | AI104: A+ | AJ104: 7.7600000000000002e-002 | AK104: =I104+100*T104 -> 120.59999999999999 | AL104: 120.3 | AM104: 29 | AN104: 35.9 | AO104: 84 | AP104: 8.0000000000000002e-003 | AQ104: 10 | AR104: 飞鹿转债
A105: 275 | B105: 特一转债! | C105: 128025 | D105: 43097. | E105: 特一药业 | F105: 2728 | G105: 医药 | H105: 化学制药 | I105: 107.368 | J105: 7.1999999999999998e-003 | K105: 2.0999999999999999e-003 | L105: 13.52 | M105: 1.8100000000000002e-002 | N105: 2.8 | O105: 9.0000000000000011e-003 | P105: 109.8 | Q105: 14.7 | R105: 2.73 | S105: 91.97 | T105: 0.16699999999999998 | U105: 转股中 | V105: 3年56天 | W105: 1年56天 | X105: 0.109 | Y105: 0.10000000000000001 | Z105: 3 | AA105: 28 | AB105: 7.3000000000000001e-003 | AC105: 1.4000000000000002e-003 | AD105: -3.4500000000000003e-002 | AE105: -3.8100000000000002e-002 | AF105: 94.44 | AG105: 90.39 | AH105: 0.52 | AI105: AA- | AJ105: 6.5099999999999991e-002 | AK105: =I105+100*T105 -> 124.068 | AL105: 122.8 | AM105: 47 | AN105: 28.3 | AO105: 23 | AP105: -2.3e-002 | AQ105: 42 | AR105: 特一转债!
A106: 16 | B106: 嘉友转债 | C106: 113599 | D106: 44081. | E106: 嘉友国际 | F106: 603871 | G106: 交通运输 | H106: 物流业 | I106: 120.85 | J106: 2.2200000000000001e-002 | K106: -1.43e-002 | L106: 30.59 | M106: 9.5999999999999992e-003 | N106: 58 | O106: 6.6000000000000003e-002 | P106: 126 | Q106: 24.82 | R106: 3.6 | S106: 123.25 | T106: -1.9e-002 | U106: 4月10天 | V106: 5.82年 | W106: 3.82年 | X106: 0.107 | Y106: 0.13200000000000001 | Z106: 7.2 | AA106: 67 | AB106: 7.3000000000000001e-003 | AC106: -1.e-004 | AD106: -3.7499999999999999e-002 | AE106: -3.9300000000000002e-002 | AF106: 80.58 | AG106: 87.21 | AH106: 0.82 | AI106: AA- | AJ106: 6.6600000000000006e-002 | AK106: =I106+100*T106 -> 118.94999999999999 | AL106: 118.5 | AM106: 17 | AN106: 31.2 | AO106: 45 | AP106: -6.9999999999999993e-003 | AQ106: 7 | AR106: 嘉友转债
A107: 194 | B107: 鼎胜转债! | C107: 113534 | D107: 43585. | E107: 鼎胜新材 | F107: 603876 | G107: 有色金属 | H107: 小金属 | I107: 111.32 | J107: 1.7899999999999999e-002 | K107: -3.0999999999999999e-003 | L107: 13.58 | M107: 3.27e-002 | N107: 5.9 | O107: 4.0000000000000001e-003 | P107: 114.9 | Q107: 15.18 | R107: 1.64 | S107: 89.46 | T107: 0.24399999999999999 | U107: 转股中 | V107: 4.49年 | W107: 2.49年 | X107: 0.20399999999999999 | Y107: 0.182 | Z107: 12 | AA107: 59 | AB107: 7.1999999999999998e-003 | AC107: 1.1999999999999999e-003 | AD107: -2.76e-002 | AE107: -2.9999999999999999e-002 | AF107: 92.29 | AG107: 95.02 | AH107: 0.45 | AI107: AA | AJ107: 4.41e-002 | AK107: =I107+100*T107 -> 135.72 | AL107: 133.2 | AM107: 146 | AN107: 38.2 | AO107: 110 | AP107: -1.9e-002 | AQ107: 30 | AR107: 鼎胜转债!
A108: 146 | B108: 新北转债! | C108: 128083 | D108: 43830. | E108: 新北洋 | F108: 2376 | G108: 电子 | H108: 电子产品 | I108: 111.09 | J108: 3.4999999999999996e-003 | K108: 5.0000000000000001e-004 | L108: 10.07 | M108: 9.0000000000000011e-003 | N108: 0.2 | O108: 0. | P108: 115.2 | Q108: 11.7 | R108: 2.02 | S108: 86.07 | T108: 0.29100000000000004 | U108: 转股中 | V108: 5.17年 | W108: 3.17年 | X108: 0.13100000000000001 | Y108: 0.113 | Z108: 8.8 | AA108: 67 | AB108: 7.1999999999999998e-003 | AC108: 1.9e-003 | AD108: -2.06e-002 | AE108: -2.2700000000000001e-002 | AF108: 89.51 | AG108: 91.91 | AH108: 0.45 | AI108: AA | AJ108: 4.5599999999999995e-002 | AK108: =I108+100*T108 -> 140.19 | AL108: 136.1 | AM108: 172 | AN108: 44.2 | AO108: 173 | AP108: -9.0000000000000011e-003 | AQ108: 17 | AR108: 新北转债!
A109: 94 | B109: 利群转债! | C109: 113033 | D109: 43942. | E109: 利群股份 | F109: 601366 | G109: 商业零售 | H109: 商场 | I109: 111 | J109: 9.0000000000000011e-003 | K109: -2.8000000000000004e-003 | L109: 6.93 | M109: 1.0200000000000001e-002 | N109: 3.7 | O109: 2.e-003 | P109: 115.3 | Q109: 7.01 | R109: 1.35 | S109: 98.86 | T109: 0.12300000000000001 | U109: 转股中 | V109: 5.47年 | W109: 3.47年 | X109: 0.30199999999999999 | Y109: 0.29799999999999999 | Z109: 18 | AA109: 60 | AB109: 7.0999999999999995e-003 | AC109: 2.0999999999999999e-003 | AD109: -1.84e-002 | AE109: -2.0400000000000001e-002 | AF109: 88.4 | AG109: 90.78 | AH109: 0.61 | AI109: AA | AJ109: 4.5599999999999995e-002 | AK109: =I109+100*T109 -> 123.3 | AL109: 123.1 | AM109: 52 | AN109: 32.4 | AO109: 55 | AP109: 3.0000000000000001e-003 | AQ109: 34 | AR109: 利群转债!
A110: 206 | B110: 亨通转债! | C110: 110056 | D110: 43571. | E110: 亨通光电 | F110: 600487 | G110: 通信互联 | H110: 通信设备 | I110: 111.39 | J110: 7.6e-003 | K110: 3.2000000000000002e-003 | L110: 14.73 | M110: 2.1499999999999998e-002 | N110: 3 | O110: 2.e-003 | P110: 114.8 | Q110: 15.58 | R110: 1.98 | S110: 94.54 | T110: 0.17800000000000002 | U110: 转股中 | V110: 4.44年 | W110: 2.44年 | X110: 5.9000000000000004e-002 | Y110: 5.5999999999999994e-002 | Z110: 17 | AA110: 288 | AB110: 6.9999999999999993e-003 | AC110: 8.9999999999999998e-004 | AD110: -2.8799999999999999e-002 | AE110: -3.1200000000000002e-002 | AF110: 92.88 | AG110: 95.95 | AH110: 0.5 | AI110: AA+ | AJ110: 4.2099999999999999e-002 | AK110: =I110+100*T110 -> 129.19 | AL110: 128.2 | AM110: 100 | AN110: 32.3 | AO110: 53 | AP110: -2.8999999999999998e-002 | AQ110: 28 | AR110: 亨通转债!
A111: 37 | B111: 银信转债 | C111: 123059 | D111: 44055. | E111: 银信科技 | F111: 300231 | G111: 计算机及 | H111: 软件开发 | I111: 119.499 | J111: 2.3099999999999999e-002 | K111: 4.8999999999999998e-003 | L111: 10.36 | M111: 4.0199999999999993e-002 | N111: 4.3 | O111: 9.0000000000000011e-003 | P111: 124.1 | Q111: 9.91 | R111: 3.62 | S111: 104.54 | T111: 0.14300000000000002 | U111: 3月12天 | V111: 5.76年 | W111: 3.76年 | X111: 8.5000000000000006e-002 | Y111: 8.900000000000001e-002 | Z111: 3.9 | AA111: 46 | AB111: 6.7000000000000002e-003 | AC111: -2.9999999999999997e-004 | AD111: -3.5000000000000003e-002 | AE111: -3.6900000000000002e-002 | AF111: 80.97 | AG111: 86.24 | AH111: 0.7 | AI111: AA- | AJ111: 6.6600000000000006e-002 | AK111: =I111+100*T111 -> 133.79900000000001 | AL111: 134.5 | AM111: 161 | AN111: 48.2 | AO111: 192 | AP111: -4.8000000000000001e-002 | AQ111: 8 | AR111: 银信转债
A112: 97 | B112: 龙净转债! | C112: 110068 | D112: 43936. | E112: 龙净环保 | F112: 600388 | G112: 城市公用 | H112: 三废处理 | I112: 111 | J112: 7.3000000000000001e-003 | K112: 5.1000000000000004e-003 | L112: 9.72 | M112: 2.4199999999999999e-002 | N112: 10 | O112: 5.0000000000000001e-003 | P112: 115 | Q112: 10.73 | R112: 1.92 | S112: 90.59 | T112: 0.22500000000000001 | U112: 转股中 | V112: 5.45年 | W112: 3.45年 | X112: 0.192 | Y112: 0.17399999999999999 | Z112: 20 | AA112: 104 | AB112: 6.6e-003 | AC112: 1.7000000000000001e-003 | AD112: -1.9299999999999998e-002 | AE112: -2.1099999999999997e-002 | AF112: 88.81 | AG112: 91.51 | AH112: 0.51 | AI112: AA+ | AJ112: 4.36e-002 | AK112: =I112+100*T112 -> 133.5 | AL112: 131.4 | AM112: 125 | AN112: 39.9 | AO112: 134 | AP112: -4.2999999999999997e-002 | AQ112: 28 | AR112: 龙净转债!
A113: 193 | B113: 明泰转债! | C113: 113025 | D113: 43592. | E113: 明泰铝业 | F113: 601677 | G113: 有色金属 | H113: 铝金属 | I113: 111.9 | J113: 3.8e-003 | K113: -2.2000000000000001e-003 | L113: 11.19 | M113: 2.7000000000000001e-003 | N113: 2.3 | O113: 1.e-003 | P113: 115.1 | Q113: 11.2 | R113: 0.98 | S113: 99.91 | T113: 0.12 | U113: 转股中 | V113: 4.50年 | W113: 2.50年 | X113: 0.26700000000000002 | Y113: 0.26700000000000002 | Z113: 18 | AA113: 69 | AB113: 6.4000000000000003e-003 | AC113: 4.0000000000000002e-004 | AD113: -2.9399999999999999e-002 | AE113: -3.1800000000000002e-002 | AF113: 92.31 | AG113: 95.18 | AH113: 0.58 | AI113: AA | AJ113: 4.41e-002 | AK113: =I113+100*T113 -> 123.90000000000001 | AL113: 123.9 | AM113: 58 | AN113: 28.7 | AO113: 26 | AP113: 4.5999999999999999e-002 | AQ113: 31 | AR113: 明泰转债!
A114: 145 | B114: 鹰19转债 | C114: 110063 | D114: 43833. | E114: 山鹰纸业 | F114: 600567 | G114: 造纸包装 | H114: 包装用纸 | I114: 112.49 | J114: 4.5000000000000005e-003 | K114: 4.1999999999999997e-003 | L114: 3.13 | M114: 1.6200000000000003e-002 | N114: 7.3 | O114: 4.0000000000000001e-003 | P114: 116.2 | Q114: 3.3 | R114: 1.01 | S114: 94.85 | T114: 0.18600000000000003 | U114: 转股中 | V114: 5.17年 | W114: 3.17年 | X114: 0.129 | Y114: 0.12300000000000001 | Z114: 19 | AA114: 144 | AB114: 6.4000000000000003e-003 | AC114: 8.0000000000000004e-004 | AD114: -2.4799999999999999e-002 | AE114: -2.6699999999999998e-002 | AF114: 89.91 | AG114: 93.58 | AH114: 0.53 | AI114: AA+ | AJ114: 4.36e-002 | AK114: =I114+100*T114 -> 131.09 | AL114: 130.1 | AM114: 114 | AN114: 36.6 | AO114: 92 | AP114: -1.8000000000000002e-002 | AQ114: 40 | AR114: 鹰19转债
A115: 46 | B115: 美联转债 | C115: 123057 | D115: 44039. | E115: 美联新材 | F115: 300586 | G115: 化工 | H115: 橡胶塑料 | I115: 114.022 | J115: 3.7000000000000002e-003 | K115: 2.e-002 | L115: 10.04 | M115: 3.2899999999999999e-002 | N115: 4.5 | O115: 1.9e-002 | P115: 118.2 | Q115: 9.91 | R115: 6.27 | S115: 101.31 | T115: 0.125 | U115: 2月28天 | V115: 5.72年 | W115: 3.72年 | X115: 4.4999999999999998e-002 | Y115: 4.5999999999999999e-002 | Z115: 2.1 | AA115: 46 | AB115: 6.4000000000000003e-003 | AC115: 8.0000000000000004e-004 | AD115: -2.3300000000000001e-002 | AE115: -2.53e-002 | AF115: 81.26 | AG115: 82.4 | AH115: 0.72 | AI115: AA- | AJ115: 6.6600000000000006e-002 | AK115: =I115+100*T115 -> 126.52200000000001 | AL115: 126.7 | AM115: 86 | AN115: 44.3 | AO115: 175 | AP115: -5.7000000000000002e-002 | AQ115: 5 | AR115: 美联转债
A116: 33 | B116: 中金转债 | C116: 127020 | D116: 44057. | E116: 中金岭南 | F116: 60 | G116: 有色金属 | H116: 有色行业 | I116: 109.83 | J116: 8.9999999999999998e-004 | K116: 1.43e-002 | L116: 4.22 | M116: 2.9300000000000003e-002 | N116: 7.8 | O116: 2.e-003 | P116: 113.7 | Q116: 4.71 | R116: 1.36 | S116: 89.6 | T116: 0.22600000000000001 | U116: 3月16天 | V116: 5.77年 | W116: 3.77年 | X116: 0.252 | Y116: 0.22600000000000001 | Z116: 38 | AA116: 151 | AB116: 6.0999999999999995e-003 | AC116: 1.8e-003 | AD116: -1.7600000000000001e-002 | AE116: -1.8799999999999997e-002 | AF116: 86.67 | AG116: 89.14 | AH116: 0.52 | AI116: AA+ | AJ116: 4.36e-002 | AK116: =I116+100*T116 -> 132.43000000000001 | AL116: 130.1 | AM116: 111 | AN116: 40.9 | AO116: 141 | AP116: -3.4000000000000002e-002 | AQ116: 10 | AR116: 中金转债
A117: 249 | B117: 博世转债! | C117: 123010 | D117: 43326. | E117: 博世科 | F117: 300422 | G117: 城市公用 | H117: 三废处理 | I117: 109.89 | J117: 2.0000000000000001e-004 | K117: 1.52e-002 | L117: 11.74 | M117: 2.53e-002 | N117: 3.1 | O117: 6.9999999999999993e-003 | P117: 112.3 | Q117: 12.2 | R117: 2.39 | S117: 96.23 | T117: 0.14199999999999999 | U117: 转股中 | V117: 3.73年 | W117: 1.73年 | X117: 8.9999999999999997e-002 | Y117: 8.6999999999999994e-002 | Z117: 4.3 | AA117: 48 | AB117: 5.8999999999999999e-003 | AC117: -1.e-004 | AD117: -3.4799999999999998e-002 | AE117: -3.7499999999999999e-002 | AF117: 91.28 | AG117: 89.15 | AH117: 0.61 | AI117: AA- | AJ117: 6.5099999999999991e-002 | AK117: =I117+100*T117 -> 124.09 | AL117: 123.6 | AM117: 55 | AN117: 32.3 | AO117: 52 | AP117: -6.5000000000000002e-002 | AQ117: 23 | AR117: 博世转债!
A118: 166 | B118: 万里转债! | C118: 123032 | D118: 43769. | E118: 万里马 | F118: 300591 | G118: 服装纺织 | H118: 服装纺织 | I118: 129.288 | J118: 2.12e-002 | K118: 2.9900000000000003e-002 | L118: 8.68 | M118: 6.3700000000000007e-002 | N118: 80 | O118: 0.46899999999999997 | P118: 132.8 | Q118: 6.89 | R118: 5.99 | S118: 125.98 | T118: 2.6000000000000002e-002 | U118: 转股中 | V118: 5年0.1天 | W118: 3年0.1天 | X118: 4.8000000000000001e-002 | Y118: 5.9999999999999998e-002 | Z118: 1.3 | AA118: 28 | AB118: 5.6000000000000008e-003 | AC118: -4.8999999999999998e-003 | AD118: -5.6900000000000006e-002 | AE118: -6.1100000000000002e-002 | AF118: 85.7 | AG118: 92.85 | AH118: 0.8 | AI118: A+ | AJ118: 7.7600000000000002e-002 | AK118: =I118+100*T118 -> 131.88800000000001 | AL118: 132.6 | AM118: 140 | AN118: 39.8 | AO118: 132 | AP118: 5.0000000000000003e-002 | AQ118: 43 | AR118: 万里转债!
A119: 134 | B119: 东风转债 | C119: 113030 | D119: 43850. | E119: 东风股份 | F119: 601515 | G119: 造纸包装 | H119: 包装材料 | I119: 114 | J119: 7.4999999999999997e-003 | K119: 3.0999999999999999e-003 | L119: 6.13 | M119: 2.1700000000000001e-002 | N119: 0.4 | O119: 1.e-003 | P119: 117.3 | Q119: 6.75 | R119: 2.01 | S119: 90.81 | T119: 0.255 | U119: 转股中 | V119: 5.20年 | W119: 3.20年 | X119: 3.6000000000000004e-002 | Y119: 3.3000000000000002e-002 | Z119: 3 | AA119: 82 | AB119: 5.6000000000000008e-003 | AC119: -2.9999999999999997e-004 | AD119: -2.7699999999999999e-002 | AE119: -2.98e-002 | AF119: 89.48 | AG119: 93.46 | AH119: 0.49 | AI119: AA | AJ119: 4.5599999999999995e-002 | AK119: =I119+100*T119 -> 139.5 | AL119: 137.2 | AM119: 178 | AN119: 43.7 | AO119: 165 | AP119: -2.9999999999999999e-002 | AQ119: 14 | AR119: 东风转债
A120: 112 | B120: 正元转债 | C120: 123043 | D120: 43921. | E120: 正元智慧 | F120: 300645 | G120: 计算机及 | H120: 软件开发 | I120: 117.909 | J120: 1.7299999999999999e-002 | K120: 1.4499999999999999e-002 | L120: 17.74 | M120: 3.8599999999999995e-002 | N120: 8 | O120: 3.9e-002 | P120: 121.4 | Q120: 15.41 | R120: 3.7 | S120: 115.12 | T120: 2.4e-002 | U120: 转股中 | V120: 5.40年 | W120: 3.40年 | X120: 7.8e-002 | Y120: 8.9999999999999997e-002 | Z120: 1.8 | AA120: 22 | AB120: 5.5000000000000005e-003 | AC120: -1.2999999999999999e-003 | AD120: -3.3500000000000002e-002 | AE120: -3.5799999999999998e-002 | AF120: 80.39 | AG120: 81.91 | AH120: 0.82 | AI120: A+ | AJ120: 7.7600000000000002e-002 | AK120: =I120+100*T120 -> 120.30900000000001 | AL120: 120.7 | AM120: 32 | AN120: 38.8 | AO120: 120 | AP120: 2.6000000000000002e-002 | AQ120: 17 | AR120: 正元转债
A121: 101 | B121: 联创转债! | C121: 128101 | D121: 43934. | E121: 联创电子 | F121: 2036 | G121: 电子 | H121: 液晶显示 | I121: 111.968 | J121: 2.2499999999999999e-002 | K121: -6.5000000000000006e-003 | L121: 11.3 | M121: 4.4400000000000002e-002 | N121: 1.2 | O121: 4.0000000000000001e-003 | P121: 115.1 | Q121: 14.48 | R121: 4.21 | S121: 78.04 | T121: 0.435 | U121: 转股中 | V121: 5.43年 | W121: 3.43年 | X121: 2.8999999999999998e-002 | Y121: 2.2000000000000002e-002 | Z121: 3 | AA121: 105 | AB121: 5.1999999999999998e-003 | AC121: 2.0000000000000001e-004 | AD121: -2.1600000000000001e-002 | AE121: -2.3399999999999997e-002 | AF121: 88.38 | AG121: 90.77 | AH121: 0.36 | AI121: AA | AJ121: 4.5599999999999995e-002 | AK121: =I121+100*T121 -> 155.46800000000002 | AL121: 145.9 | AM121: 234 | AN121: 55.1 | AO121: 227 | AP121: -6.9999999999999993e-003 | AQ121: 14 | AR121: 联创转债!
A122: 5 | B122: 青农转债 | C122: 128129 | D122: 44092. | E122: 青农商行 | F122: 2958 | G122: 金融 | H122: 银行行业 | I122: 108.921 | J122: -7.000000000000001e-004 | K122: 1.e-002 | L122: 5.12 | M122: 1.7899999999999999e-002 | N122: 68 | O122: 1.2e-002 | P122: 112.2 | Q122: 5.74 | R122: 1.14 | S122: 89.2 | T122: 0.221 | U122: 4月21天 | V122: 5.87年 | W122: 无权 | X122: 0.17600000000000002 | Y122: 0.157 | Z122: 50 | AA122: 284 | AB122: 5.1000000000000004e-003 | AC122: 1.2999999999999999e-003 | AD122: 无权 | AE122: 无权 | AF122: 无权 | AG122: 89.11 | AH122: 0.52 | AI122: AAA | AJ122: 4.0599999999999997e-002 | AK122: =I122+100*T122 -> 131.02100000000002 | AL122: 128.6 | AM122: 105 | AN122: 39.5 | AO122: 127 | AP122: -2.1000000000000001e-002 | AQ122: 9 | AR122: 青农转债
A123: 41 | B123: 湖盐转债 | C123: 110071 | D123: 44043. | E123: 雪天盐业 | F123: 600929 | G123: 食品饮料 | H123: 食品饮料 | I123: 112.39 | J123: 1.4800000000000001e-002 | K123: -5.7999999999999996e-003 | L123: 6.99 | M123: 1.3000000000000001e-002 | N123: 8.8 | O123: 1.1000000000000001e-002 | P123: 115.2 | Q123: 6.6 | R123: 2.54 | S123: 105.91 | T123: 6.0999999999999999e-002 | U123: 3月9天 | V123: 5.75年 | W123: 3.75年 | X123: 0.11199999999999999 | Y123: 0.11900000000000001 | Z123: 7.2 | AA123: 64 | AB123: 4.4000000000000003e-003 | AC123: -4.0000000000000002e-004 | AD123: -2.0499999999999997e-002 | AE123: -2.23e-002 | AF123: 87.23 | AG123: 89.58 | AH123: 0.69 | AI123: AA | AJ123: 4.5599999999999995e-002 | AK123: =I123+100*T123 -> 118.48999999999999 | AL123: 118.9 | AM123: 21 | AN123: 29.3 | AO123: 27 | AP123: 3.5000000000000003e-002 | AQ123: 10 | AR123: 湖盐转债
A124: 1 | B124: 崇达转2 | C124: 128131 | D124: 44102. | E124: 崇达技术 | F124: 2815 | G124: 电子 | H124: 元器件制 | I124: 112.3 | J124: 3.8e-003 | K124: 1.2699999999999999e-002 | L124: 17.72 | M124: 3.0200000000000001e-002 | N124: 55 | O124: 3.5000000000000003e-002 | P124: 115.2 | Q124: 19.54 | R124: 4.04 | S124: 90.69 | T124: 0.23800000000000002 | U124: 5月1天 | V124: 5.91年 | W124: 3.91年 | X124: 8.9999999999999997e-002 | Y124: 8.1000000000000003e-002 | Z124: 14 | AA124: 156 | AB124: 4.4000000000000003e-003 | AC124: -2.0000000000000001e-004 | AD124: -1.95e-002 | AE124: -2.12e-002 | AF124: 86.61 | AG124: 88.94 | AH124: 0.54 | AI124: AA | AJ124: 4.5599999999999995e-002 | AK124: =I124+100*T124 -> 136.09999999999999 | AL124: 133.9 | AM124: 155 | AN124: 45 | AO124: 183 | AP124: 4.0000000000000001e-003 | AQ124: 2 | AR124: 崇达转2
A125: 265 | B125: 道氏转债!! | C125: 123007 | D125: 43126. | E125: 道氏技术 | F125: 300409 | G125: 建筑 | H125: 建筑行业 | I125: 109.8 | J125: 1.7399999999999999e-002 | K125: 5.4000000000000003e-003 | L125: 13.04 | M125: 5.2499999999999998e-002 | N125: 4.8 | O125: 1.4999999999999999e-002 | P125: 111.3 | Q125: 14.95 | R125: 2.51 | S125: 87.22 | T125: 0.25900000000000001 | U125: 转股中 | V125: 3.21年 | W125: 1.21年 | X125: 5.0999999999999997e-002 | Y125: 4.4000000000000004e-002 | Z125: 3 | AA125: 60 | AB125: 4.3e-003 | AC125: -2.2000000000000001e-003 | AD125: -4.6799999999999994e-002 | AE125: -5.0499999999999996e-002 | AF125: 94.35 | AG125: 91.31 | AH125: 0.43 | AI125: AA- | AJ125: 6.5099999999999991e-002 | AK125: =I125+100*T125 -> 135.69999999999999 | AL125: 132.4 | AM125: 134 | AN125: 38 | AO125: 108 | AP125: -3.5000000000000003e-002 | AQ125: 15 | AR125: 道氏转债!!
A126: 216 | B126: 今飞转债! | C126: 128056 | D126: 43546. | E126: 今飞凯达 | F126: 2863 | G126: 汽车 | H126: 零部件制 | I126: 118.8 | J126: 2.5000000000000001e-003 | K126: -2.1400000000000002e-002 | L126: 8.08 | M126: -2.3e-002 | N126: 40 | O126: 0.13699999999999998 | P126: 121 | Q126: 6.76 | R126: 2.96 | S126: 119.53 | T126: -6.0000000000000001e-003 | U126: 转股中 | V126: 4.38年 | W126: 2.38年 | X126: 8.1000000000000003e-002 | Y126: 9.6000000000000002e-002 | Z126: 2.5 | AA126: 30 | AB126: 4.3e-003 | AC126: -3.9000000000000003e-003 | AD126: -5.0799999999999998e-002 | AE126: -5.3699999999999998e-002 | AF126: 86.62 | AG126: 88.45 | AH126: 0.82 | AI126: A+ | AJ126: 7.6100000000000001e-002 | AK126: =I126+100*T126 -> 118.2 | AL126: 118.1 | AM126: 15 | AN126: 29.6 | AO126: 30 | AP126: 5.2000000000000005e-002 | AQ126: 61 | AR126: 今飞转债!
A127: 136 | B127: 永创转债! | C127: 113559 | D127: 43840. | E127: 永创智能 | F127: 603901 | G127: 机械装备 | H127: 专用设备 | I127: 116.42 | J127: 8.6e-003 | K127: -9.1999999999999998e-003 | L127: 9.24 | M127: -1.1000000000000001e-003 | N127: 27 | O127: 4.4999999999999998e-002 | P127: 118.9 | Q127: 10.32 | R127: 2.97 | S127: 89.53 | T127: 0.29999999999999999 | U127: 转股中 | V127: 5.20年 | W127: 3.20年 | X127: 0.126 | Y127: 0.11199999999999999 | Z127: 5.1 | AA127: 41 | AB127: 4.1999999999999997e-003 | AC127: -2.2000000000000001e-003 | AD127: -3.0699999999999998e-002 | AE127: -3.3399999999999999e-002 | AF127: 84.81 | AG127: 85.84 | AH127: 0.58 | AI127: AA- | AJ127: 6.6600000000000006e-002 | AK127: =I127+100*T127 -> 146.42000000000002 | AL127: 143.3 | AM127: 221 | AN127: 57.5 | AO127: 240 | AP127: -8.199999999999999e-002 | AQ127: 23 | AR127: 永创转债!
A128: 102 | B128: 雷迪转债 | C128: 123045 | D128: 43934. | E128: 雷迪克 | F128: 300652 | G128: 汽车 | H128: 零部件制 | I128: 116.87 | J128: 1.5300000000000001e-002 | K128: 2.8999999999999998e-003 | L128: 23.18 | M128: 2.2000000000000002e-002 | N128: 4.6 | O128: 1.3999999999999999e-002 | P128: 119.4 | Q128: 20.13 | R128: 2.55 | S128: 115.15 | T128: 1.4999999999999999e-002 | U128: 转股中 | V128: 5.42年 | W128: 3.42年 | X128: 0.13699999999999998 | Y128: 0.158 | Z128: 2.8 | AA128: 20 | AB128: 4.0999999999999995e-003 | AC128: -2.2000000000000001e-003 | AD128: -3.0899999999999997e-002 | AE128: -3.32e-002 | AF128: 80.28 | AG128: 80.46 | AH128: 0.82 | AI128: A+ | AJ128: 7.7600000000000002e-002 | AK128: =I128+100*T128 -> 118.37 | AL128: 118.6 | AM128: 18 | AN128: 38.1 | AO128: 109 | AP128: 1.e-003 | AQ128: 39 | AR128: 雷迪转债
A129: 294 | B129: 海印转债! | C129: 127003 | D129: 42552. | E129: 海印股份 | F129: 861 | G129: 商业零售 | H129: 商场 | I129: 111.085 | J129: 1.84e-002 | K129: 1.2199999999999999e-002 | L129: 2.88 | M129: 8.6800000000000002e-002 | N129: 7.9 | O129: 1.1000000000000001e-002 | P129: 111.8 | Q129: 3 | R129: 1.8 | S129: 96 | T129: 0.157 | U129: 转股中 | V129: 1.66年 | W129: 回售中 | X129: 0.10400000000000001 | Y129: 0.10000000000000001 | Z129: 6.7 | AA129: 65 | AB129: 3.9000000000000003e-003 | AC129: -9.0000000000000011e-003 | AD129: 回售中 | AE129: 回售中 | AF129: 100.3 | AG129: 104.35 | AH129: 0.35 | AI129: AA | AJ129: 4.2900000000000001e-002 | AK129: =I129+100*T129 -> 126.785 | AL129: 126.2 | AM129: 78 | AN129: 21.8 | AO129: 7 | AP129: -0.14400000000000002 | AQ129: 74 | AR129: 海印转债!
A130: 14 | B130: 特发转2! | C130: 127021 | D130: 44078. | E130: 特发信息 | F130: 70 | G130: 通信互联 | H130: 通信设备 | I130: 111.308 | J130: 3.7000000000000002e-003 | K130: 5.1999999999999998e-003 | L130: 9.94 | M130: 2.4700000000000003e-002 | N130: 6.7 | O130: 1.1000000000000001e-002 | P130: 113.3 | Q130: 12.33 | R130: 2.89 | S130: 80.62 | T130: 0.38100000000000001 | U130: 4月5天 | V130: 4.82年 | W130: 2.82年 | X130: 6.8000000000000005e-002 | Y130: 5.5e-002 | Z130: 5.5 | AA130: 81 | AB130: 3.7000000000000002e-003 | AC130: -1.2999999999999999e-003 | AD130: -2.8799999999999999e-002 | AE130: -2.9999999999999999e-002 | AF130: 89.76 | AG130: 92.23 | AH130: 0.36 | AI130: AA | AJ130: 4.41e-002 | AK130: =I130+100*T130 -> 149.40800000000002 | AL130: 142 | AM130: 216 | AN130: 49.8 | AO130: 200 | AP130: -3.7000000000000005e-002 | AQ130: 4 | AR130: 特发转2!
A131: 293 | B131: 洪涛转债! | C131: 128013 | D131: 42605. | E131: 洪涛股份 | F131: 2325 | G131: 建筑 | H131: 装饰工程 | I131: 109.098 | J131: 1.01e-002 | K131: 1.1000000000000001e-003 | L131: 3.16 | M131: 1.9400000000000001e-002 | N131: 7.9 | O131: 6.0000000000000001e-003 | P131: 109.8 | Q131: 3.1 | R131: 1.28 | S131: 101.94 | T131: 7.0000000000000007e-002 | U131: 转股中 | V131: 1.80年 | W131: 回售中 | X131: 0.30399999999999999 | Y131: 0.309 | Z131: 12 | AA131: 39 | AB131: 3.5999999999999999e-003 | AC131: -6.5000000000000006e-003 | AD131: 回售中 | AE131: 回售中 | AF131: 100.3 | AG131: 98.33 | AH131: 0.58 | AI131: AA- | AJ131: 6.3899999999999998e-002 | AK131: =I131+100*T131 -> 116.098 | AL131: 116.3 | AM131: 7 | AN131: 16 | AO131: 2 | AP131: -2.4e-002 | AQ131: 89 | AR131: 洪涛转债!
A132: 296 | B132: 广汽转债!! | C132: 113009 | D132: 42404. | E132: 广汽集团 | F132: 601238 | G132: 汽车 | H132: 乘用车 | I132: 107.02 | J132: -5.1999999999999998e-003 | K132: 5.4000000000000003e-003 | L132: 9.71 | M132: 2.e-002 | N132: 9.3 | O132: 3.0000000000000001e-003 | P132: 107.5 | Q132: 14.23 | R132: 1.24 | S132: 68.24 | T132: 0.56799999999999995 | U132: 转股中 | V132: 1.28年 | W132: 回售中 | X132: 2.6000000000000002e-002 | Y132: 1.7000000000000001e-002 | Z132: 25 | AA132: 994 | AB132: 3.4999999999999996e-003 | AC132: -7.4999999999999997e-003 | AD132: 回售中 | AE132: 回售中 | AF132: 100.25 | AG132: 102.55 | AH132: 0.01 | AI132: AAA | AJ132: 3.7900000000000003e-002 | AK132: =I132+100*T132 -> 163.81999999999999 | AL132: 145.8 | AM132: 233 | AN132: 43.3 | AO132: 161 | AP132: -4.0000000000000001e-002 | AQ132: 14 | AR132: 广汽转债!!
A133: 228 | B133: 华源转债! | C133: 128049 | D133: 43454. | E133: 华源控股 | F133: 2787 | G133: 造纸包装 | H133: 包装材料 | I133: 113.762 | J133: 1.6200000000000003e-002 | K133: 2.9999999999999997e-004 | L133: 7.93 | M133: 2.3199999999999998e-002 | N133: 3.5 | O133: 8.0000000000000002e-003 | P133: 115.2 | Q133: 7.42 | R133: 1.72 | S133: 106.87 | T133: 6.4000000000000001e-002 | U133: 转股中 | V133: 4年47天 | W133: 2年47天 | X133: 0.14499999999999999 | Y133: 0.155 | Z133: 3.6 | AA133: 25 | AB133: 3.0999999999999999e-003 | AC133: -3.4999999999999996e-003 | AD133: -4.07e-002 | AE133: -4.3499999999999997e-002 | AF133: 89.75 | AG133: 89.34 | AH133: 0.71 | AI133: AA- | AJ133: 6.5099999999999991e-002 | AK133: =I133+100*T133 -> 120.16200000000001 | AL133: 120.7 | AM133: 30 | AN133: 30.9 | AO133: 44 | AP133: -4.4999999999999998e-002 | AQ133: 53 | AR133: 华源转债!
A134: 79 | B134: 全筑转债 | C134: 113578 | D134: 43970. | E134: 全筑股份 | F134: 603030 | G134: 建筑 | H134: 装饰工程 | I134: 116.37 | J134: 1.8700000000000001e-002 | K134: -1.1999999999999999e-003 | L134: 5.93 | M134: 2.6000000000000002e-002 | N134: 9.1 | O134: 2.e-002 | P134: 118.3 | Q134: 5.43 | R134: 1.44 | S134: 109.21 | T134: 6.6000000000000003e-002 | U134: 15天 | V134: 5.52年 | W134: 3.52年 | X134: 0.12 | Y134: 0.13100000000000001 | Z134: 3.8 | AA134: 32 | AB134: 3.0000000000000001e-003 | AC134: -2.7000000000000001e-003 | AD134: -3.0800000000000001e-002 | AE134: -3.27e-002 | AF134: 88.2 | AG134: 92.92 | AH134: 0.68 | AI134: AA | AJ134: 4.5599999999999995e-002 | AK134: =I134+100*T134 -> 122.97 | AL134: 123.5 | AM134: 54 | AN134: 30.6 | AO134: 41 | AP134: -5.7999999999999996e-002 | AQ134: 9 | AR134: 全筑转债
A135: 273 | B135: 铁汉转债! | C135: 123004 | D135: 43126. | E135: 铁汉生态 | F135: 300197 | G135: 城市公用 | H135: 生态环境 | I135: 108.812 | J135: 1.6e-002 | K135: -1.2999999999999999e-003 | L135: 3.91 | M135: 2.6200000000000001e-002 | N135: 28 | O135: 3.1e-002 | P135: 109.8 | Q135: 3.98 | R135: 1.75 | S135: 98.24 | T135: 0.10800000000000001 | U135: 转股中 | V135: 3.19年 | W135: 1.19年 | X135: 8.8000000000000009e-002 | Y135: 8.5999999999999993e-002 | Z135: 8 | AA135: 92 | AB135: 2.8999999999999998e-003 | AC135: -2.8999999999999998e-003 | AD135: -4.3299999999999998e-002 | AE135: -4.6699999999999998e-002 | AF135: 96.79 | AG135: 95.97 | AH135: 0.56 | AI135: AA | AJ135: 4.41e-002 | AK135: =I135+100*T135 -> 119.61199999999999 | AL135: 119.4 | AM135: 22 | AN135: 22.6 | AO135: 8 | AP135: -3.7999999999999999e-002 | AQ135: 36 | AR135: 铁汉转债!
A136: 258 | B136: 敖东转债! | C136: 127006 | D136: 43231. | E136: 吉林敖东 | F136: 623 | G136: 金融 | H136: 证券行业 | I136: 107.201 | J136: 8.0000000000000004e-004 | K136: 5.4000000000000003e-003 | L136: 17.05 | M136: 1.9099999999999999e-002 | N136: 4.9 | O136: 2.e-003 | P136: 108 | Q136: 20.42 | R136: 0.89 | S136: 83.5 | T136: 0.28399999999999997 | U136: 转股中 | V136: 3.42年 | W136: 1.42年 | X136: 0.121 | Y136: 0.10099999999999999 | Z136: 24 | AA136: 198 | AB136: 2.2000000000000001e-003 | AC136: -2.2000000000000001e-003 | AD136: -3.3000000000000002e-002 | AE136: -3.5000000000000003e-002 | AF136: 95.26 | AG136: 93.97 | AH136: 0.33 | AI136: AA+ | AJ136: 4.2099999999999999e-002 | AK136: =I136+100*T136 -> 135.601 | AL136: 130.9 | AM136: 120 | AN136: 35.6 | AO136: 79 | AP136: -1.4999999999999999e-002 | AQ136: 26 | AR136: 敖东转债!
A137: 22 | B137: 科华转债! | C137: 128124 | D137: 44063. | E137: 科华生物 | F137: 2022 | G137: 医药 | H137: 生物制药 | I137: 108.99 | J137: 5.6000000000000008e-003 | K137: 9.5999999999999992e-003 | L137: 18.65 | M137: 2.92e-002 | N137: 4.9 | O137: 6.0000000000000001e-003 | P137: 110.3 | Q137: 21.5 | R137: 3.75 | S137: 86.74 | T137: 0.25600000000000001 | U137: 3月25天 | V137: 5.79年 | W137: 3.79年 | X137: 7.6999999999999999e-002 | Y137: 6.7000000000000004e-002 | Z137: 7.4 | AA137: 96 | AB137: 2.0999999999999999e-003 | AC137: -1.1999999999999999e-003 | AD137: -1.41e-002 | AE137: -1.5600000000000001e-002 | AF137: 86.48 | AG137: 85.53 | AH137: 0.52 | AI137: AA | AJ137: 4.5599999999999995e-002 | AK137: =I137+100*T137 -> 134.59 | AL137: 131.2 | AM137: 124 | AN137: 44.8 | AO137: 179 | AP137: 2.3e-002 | AQ137: 9 | AR137: 科华转债!
A138: 27 | B138: 兴森转债 | C138: 128122 | D138: 44060. | E138: 兴森科技 | F138: 2436 | G138: 电子 | H138: 元器件制 | I138: 112.402 | J138: 8.9999999999999998e-004 | K138: 1.1699999999999999e-002 | L138: 11.42 | M138: 3.5400000000000001e-002 | N138: 2.3 | O138: 8.0000000000000002e-003 | P138: 113.3 | Q138: 14.18 | R138: 5.49 | S138: 80.54 | T138: 0.39600000000000002 | U138: 3月20天 | V138: 4.78年 | W138: 3.78年 | X138: 1.6e-002 | Y138: 1.3000000000000001e-002 | Z138: 2.7 | AA138: 170 | AB138: 1.7000000000000001e-003 | AC138: -3.3e-003 | AD138: -2.0499999999999997e-002 | AE138: -2.2200000000000001e-002 | AF138: 87.52 | AG138: 92.39 | AH138: 0.36 | AI138: AA | AJ138: 4.41e-002 | AK138: =I138+100*T138 -> 152.00200000000001 | AL138: 144.3 | AM138: 227 | AN138: 51.9 | AO138: 211 | AP138: 8.0000000000000002e-003 | AQ138: 4 | AR138: 兴森转债
A139: 264 | B139: 江银转债! | C139: 128034 | D139: 43145. | E139: 江阴银行 | F139: 2807 | G139: 金融 | H139: 银行行业 | I139: 108.825 | J139: 7.6e-003 | K139: -1.9e-003 | L139: 4.16 | M139: 1.2199999999999999e-002 | N139: 3.9 | O139: 2.e-003 | P139: 109.1 | Q139: 4.5 | R139: 0.8 | S139: 92.44 | T139: 0.17699999999999999 | U139: 转股中 | V139: 3.29年 | W139: 无权 | X139: 0.19500000000000001 | Y139: 0.17999999999999999 | Z139: 18 | AA139: 90 | AB139: 8.0000000000000004e-004 | AC139: -4.4000000000000003e-003 | AD139: 无权 | AE139: 无权 | AF139: 无权 | AG139: 95.46 | AH139: 0.47 | AI139: AA+ | AJ139: 4.2099999999999999e-002 | AK139: =I139+100*T139 -> 126.52500000000001 | AL139: 125.2 | AM139: 68 | AN139: 29.7 | AO139: 33 | AP139: -5.0000000000000001e-003 | AQ139: 27 | AR139: 江银转债!
A140: 212 | B140: 博彦转债 | C140: 128057 | D140: 43557. | E140: 博彦科技 | F140: 2649 | G140: 计算机及 | H140: 软件开发 | I140: 116.821 | J140: 1.7600000000000001e-002 | K140: 2.7000000000000001e-003 | L140: 9.55 | M140: 2.69e-002 | N140: 2.7 | O140: 4.0000000000000001e-003 | P140: 117.1 | Q140: 8.72 | R140: 1.84 | S140: 109.52 | T140: 6.7000000000000004e-002 | U140: 转股中 | V140: 4.40年 | W140: 2.40年 | X140: 0.105 | Y140: 0.115 | Z140: 5.3 | AA140: 51 | AB140: 5.9999999999999995e-004 | AC140: -6.3e-003 | AD140: -4.6300000000000001e-002 | AE140: -4.8799999999999996e-002 | AF140: 88.31 | AG140: 89.29 | AH140: 0.75 | AI140: AA- | AJ140: 6.5099999999999991e-002 | AK140: =I140+100*T140 -> 123.521 | AL140: 124.1 | AM140: 62 | AN140: 34.8 | AO140: 69 | AP140: -3.4000000000000002e-002 | AQ140: 29 | AR140: 博彦转债
A141: 262 | B141: 大族转债! | C141: 128035 | D141: 43164. | E141: 大族激光 | F141: 2008 | G141: 机械装备 | H141: 专用设备 | I141: 108.179 | J141: 6.3e-003 | K141: -4.6999999999999993e-003 | L141: 34.41 | M141: 4.5899999999999996e-002 | N141: 9.8 | O141: 4.0000000000000001e-003 | P141: 108 | Q141: 52.1 | R141: 4.09 | S141: 66.05 | T141: 0.63800000000000001 | U141: 转股中 | V141: 3.32年 | W141: 1.32年 | X141: 6.3e-002 | Y141: 4.0999999999999995e-002 | Z141: 23 | AA141: 367 | AB141: -5.0000000000000001e-004 | AC141: -5.0000000000000001e-003 | AD141: -2.3700000000000002e-002 | AE141: -2.92e-002 | AF141: 98.21 | AG141: 94.35 | AH141: 0.04 | AI141: AA+ | AJ141: 4.2099999999999999e-002 | AK141: =I141+100*T141 -> 171.97900000000001 | AL141: 150.3 | AM141: 252 | AN141: 52.1 | AO141: 214 | AP141: 3.0000000000000001e-003 | AQ141: 19 | AR141: 大族转债!
A142: 119 | B142: 宏辉转债 | C142: 113565 | D142: 43906. | E142: 宏辉果蔬 | F142: 603336 | G142: 农业 | H142: 农产品加 | I142: 118.5 | J142: 1.7100000000000001e-002 | K142: 7.0999999999999995e-003 | L142: 11.5 | M142: 2.9500000000000002e-002 | N142: 30 | O142: 8.1000000000000003e-002 | P142: 118.2 | Q142: 10 | R142: 4.22 | S142: 115 | T142: 2.9999999999999999e-002 | U142: 转股中 | V142: 5.38年 | W142: 3.38年 | X142: 8.199999999999999e-002 | Y142: 9.5000000000000001e-002 | Z142: 3.1 | AA142: 38 | AB142: -5.0000000000000001e-004 | AC142: -6.4000000000000003e-003 | AD142: -3.6299999999999999e-002 | AE142: -3.8300000000000001e-002 | AF142: 83.08 | AG142: 84.24 | AH142: 0.82 | AI142: AA- | AJ142: 6.6600000000000006e-002 | AK142: =I142+100*T142 -> 121.5 | AL142: 122 | AM142: 40 | AN142: 37.8 | AO142: 105 | AP142: -5.0000000000000003e-002 | AQ142: 18 | AR142: 宏辉转债
A143: 3 | B143: 万孚转债 | C143: 123064 | D143: 44097. | E143: 万孚生物 | F143: 300482 | G143: 医药 | H143: 医疗器械 | I143: 115.7 | J143: -8.9999999999999998e-004 | K143: 9.5999999999999992e-003 | L143: 84.4 | M143: 1.6299999999999999e-002 | N143: 32 | O143: 4.5999999999999999e-002 | P143: 115.1 | Q143: 93.55 | R143: 11.16 | S143: 90.22 | T143: 0.28199999999999997 | U143: 4月28天 | V143: 5.89年 | W143: 3.89年 | X143: 2.1000000000000001e-002 | Y143: 1.9e-002 | Z143: 6 | AA143: 289 | AB143: -8.9999999999999998e-004 | AC143: -5.5000000000000005e-003 | AD143: -2.7099999999999999e-002 | AE143: -2.87e-002 | AF143: 86.58 | AG143: 88.91 | AH143: 0.54 | AI143: AA | AJ143: 4.5599999999999995e-002 | AK143: =I143+100*T143 -> 143.90000000000001 | AL143: 141.2 | AM143: 208 | AN143: 52.3 | AO143: 215 | AP143: -3.4000000000000002e-002 | AQ143: 3 | AR143: 万孚转债
A144: 83 | B144: 维尔转债 | C144: 123049 | D144: 43963. | E144: 维尔利 | F144: 300190 | G144: 城市公用 | H144: 三废处理 | I144: 126.11 | J144: 9.4999999999999998e-003 | K144: 6.0000000000000001e-003 | L144: 8.86 | M144: 1.9599999999999999e-002 | N144: 1.7 | O144: 2.e-003 | P144: 124.8 | Q144: 7.48 | R144: 1.69 | S144: 118.45 | T144: 6.5000000000000002e-002 | U144: 8天 | V144: 5.50年 | W144: 3.50年 | X144: 0.13200000000000001 | Y144: 0.157 | Z144: 9.2 | AA144: 69 | AB144: -1.9e-003 | AC144: -9.3999999999999986e-003 | AD144: -4.99e-002 | AE144: -5.2199999999999996e-002 | AF144: 82.9 | AG144: 88.27 | AH144: 0.79 | AI144: AA- | AJ144: 6.6600000000000006e-002 | AK144: =I144+100*T144 -> 132.61000000000001 | AL144: 133.8 | AM144: 153 | AN144: 45.5 | AO144: 185 | AP144: -3.4000000000000002e-002 | AQ144: 11 | AR144: 维尔转债
A145: 181 | B145: 华钰转债!! | C145: 113027 | D145: 43656. | E145: 华钰矿业 | F145: 601020 | G145: 有色金属 | H145: 锌铅镍锡 | I145: 116.13 | J145: 6.0999999999999995e-003 | K145: 8.0000000000000004e-004 | L145: 10.88 | M145: 9.300000000000001e-003 | N145: 19 | O145: 5.0999999999999997e-002 | P145: 114.9 | Q145: 10.17 | R145: 2.74 | S145: 106.98 | T145: 8.5999999999999993e-002 | U145: 转股中 | V145: 4.67年 | W145: 2.67年 | X145: 5.4000000000000006e-002 | Y145: 5.7999999999999996e-002 | Z145: 3.3 | AA145: 60 | AB145: -2.3e-003 | AC145: -8.0000000000000002e-003 | AD145: -4.0399999999999998e-002 | AE145: -4.2599999999999999e-002 | AF145: 86.59 | AG145: 86.07 | AH145: 0.74 | AI145: AA- | AJ145: 6.5099999999999991e-002 | AK145: =I145+100*T145 -> 124.72999999999999 | AL145: 125.3 | AM145: 69 | AN145: 38.7 | AO145: 118 | AP145: -7.400000000000001e-002 | AQ145: 46 | AR145: 华钰转债!!
A146: 291 | B146: 骆驼转债! | C146: 113012 | D146: 42934. | E146: 骆驼股份 | F146: 601311 | G146: 汽车 | H146: 零部件制 | I146: 108.55 | J146: 8.8000000000000005e-003 | K146: -2.7000000000000001e-003 | L146: 7.93 | M146: 3.6600000000000001e-002 | N146: 4.5 | O146: 8.0000000000000002e-003 | P146: 107.8 | Q146: 10.06 | R146: 1.03 | S146: 78.83 | T146: 0.377 | U146: 转股中 | V146: 2.45年 | W146: 0.45年 | X146: 5.7000000000000002e-002 | Y146: 4.4999999999999998e-002 | Z146: 5.1 | AA146: 89 | AB146: -2.8999999999999998e-003 | AC146: -8.8999999999999999e-003 | AD146: -0.111 | AE146: -0.115 | AF146: 98.96 | AG146: 97.42 | AH146: 0.17 | AI146: AA | AJ146: 4.2900000000000001e-002 | AK146: =I146+100*T146 -> 146.25 | AL146: 138.3 | AM146: 184 | AN146: 39.3 | AO146: 124 | AP146: 1.3000000000000001e-002 | AQ146: 17 | AR146: 骆驼转债!
A147: 131 | B147: 汽模转2 | C147: 128090 | D147: 43853. | E147: 天汽模 | F147: 2510 | G147: 汽车 | H147: 零部件制 | I147: 116.9 | J147: 1.23e-002 | K147: 5.7999999999999996e-003 | L147: 4.37 | M147: 2.8199999999999999e-002 | N147: 5.6 | O147: 1.e-002 | P147: 115.2 | Q147: 4.21 | R147: 1.5 | S147: 103.8 | T147: 0.126 | U147: 转股中 | V147: 5.21年 | W147: 3.21年 | X147: 0.11699999999999999 | Y147: 0.121 | Z147: 4.7 | AA147: 40 | AB147: -2.8999999999999998e-003 | AC147: -8.0000000000000002e-003 | AD147: -3.5200000000000002e-002 | AE147: -3.7200000000000004e-002 | AF147: 89.35 | AG147: 91.74 | AH147: 0.64 | AI147: AA | AJ147: 4.5599999999999995e-002 | AK147: =I147+100*T147 -> 129.5 | AL147: 130 | AM147: 110 | AN147: 38.3 | AO147: 113 | AP147: -4.2000000000000003e-002 | AQ147: 26 | AR147: 汽模转2
A148: 25 | B148: 国光转债 | C148: 128123 | D148: 44062. | E148: 国光股份 | F148: 2749 | G148: 化工 | H148: 农化 | I148: 118.1 | J148: 1.7899999999999999e-002 | K148: 2.9999999999999999e-002 | L148: 13.28 | M148: 6.7500000000000004e-002 | N148: 1.3 | O148: 4.0000000000000001e-003 | P148: 116.2 | Q148: 13.7 | R148: 4.89 | S148: 96.93 | T148: 0.218 | U148: 3月23天 | V148: 5.79年 | W148: 3.79年 | X148: 5.5999999999999994e-002 | Y148: 5.4000000000000006e-002 | Z148: 3.2 | AA148: 57 | AB148: -2.8999999999999998e-003 | AC148: -7.8000000000000005e-003 | AD148: -3.1600000000000003e-002 | AE148: -3.3500000000000002e-002 | AF148: 80.89 | AG148: 80.65 | AH148: 0.71 | AI148: AA- | AJ148: 6.6600000000000006e-002 | AK148: =I148+100*T148 -> 139.90000000000001 | AL148: 139.3 | AM148: 193 | AN148: 58.4 | AO148: 245 | AP148: 1.6e-002 | AQ148: 5 | AR148: 国光转债
A149: 223 | B149: 台华转债! | C149: 113525 | D149: 43476. | E149: 台华新材 | F149: 603055 | G149: 服装纺织 | H149: 纺织行业 | I149: 116.65 | J149: 1.1999999999999999e-003 | K149: -2.e-003 | L149: 8.85 | M149: -1.1000000000000001e-003 | N149: 1.3 | O149: 2.e-003 | P149: 114.9 | Q149: 8.03 | R149: 2.63 | S149: 110.21 | T149: 5.7999999999999996e-002 | U149: 转股中 | V149: 4.18年 | W149: 2.18年 | X149: 6.8000000000000005e-002 | Y149: 7.4999999999999997e-002 | Z149: 4.7 | AA149: 68 | AB149: -3.7000000000000002e-003 | AC149: -1.e-002 | AD149: -5.0499999999999996e-002 | AE149: -5.3099999999999994e-002 | AF149: 93.54 | AG149: 96.3 | AH149: 0.68 | AI149: AA | AJ149: 4.41e-002 | AK149: =I149+100*T149 -> 122.45 | AL149: 123.1 | AM149: 50 | AN149: 26.8 | AO149: 18 | AP149: -3.7000000000000005e-002 | AQ149: 22 | AR149: 台华转债!
A150: 69 | B150: 今天转债 | C150: 123051 | D150: 44012. | E150: 今天国际 | F150: 300532 | G150: 计算机及 | H150: 软件开发 | I150: 125.548 | J150: 3.2500000000000001e-002 | K150: 4.5000000000000005e-003 | L150: 11.68 | M150: 4.1900000000000007e-002 | N150: 22 | O150: 6.2e-002 | P150: 122.8 | Q150: 8.8 | R150: 3.98 | S150: 132.73 | T150: -5.4000000000000006e-002 | U150: 2月0天 | V150: 5.65年 | W150: 3.65年 | X150: 8.8000000000000009e-002 | Y150: 0.11599999999999999 | Z150: 2.8 | AA150: 32 | AB150: -4.0000000000000001e-003 | AC150: -1.0800000000000001e-002 | AD150: -4.7e-002 | AE150: -4.9100000000000005e-002 | AF150: 79.04 | AG150: 81.35 | AH150: 0.88 | AI150: A+ | AJ150: 7.7600000000000002e-002 | AK150: =I150+100*T150 -> 120.148 | AL150: 118.4 | AM150: 16 | AN150: 37 | AO150: 99 | AP150: -4.2999999999999997e-002 | AQ150: 11 | AR150: 今天转债
A151: 24 | B151: 三超转债 | C151: 123062 | D151: 44060. | E151: 三超新材 | F151: 300554 | G151: 机械装备 | H151: 通用设备 | I151: 122.53 | J151: 4.1399999999999999e-002 | K151: 2.76e-002 | L151: 22.13 | M151: 7.5800000000000006e-002 | N151: 79 | O151: 0.32899999999999996 | P151: 119.7 | Q151: 17.17 | R151: 4.05 | S151: 128.89 | T151: -4.9000000000000002e-002 | U151: 3月23天 | V151: 5.79年 | W151: 3.79年 | X151: 9.4e-002 | Y151: 0.121 | Z151: 2 | AA151: 21 | AB151: -4.0999999999999995e-003 | AC151: -9.8999999999999991e-003 | AD151: -3.95e-002 | AE151: -4.1599999999999998e-002 | AF151: 75.31 | AG151: 74.45 | AH151: 0.91 | AI151: A | AJ151: 8.7599999999999997e-002 | AK151: =I151+100*T151 -> 117.63 | AL151: 116.2 | AM151: 6 | AN151: 40.9 | AO151: 140 | AP151: 2.8999999999999998e-002 | AQ151: 9 | AR151: 三超转债
A152: 185 | B152: 三星转债 | C152: 113536 | D152: 43640. | E152: 三星新材 | F152: 603578 | G152: 家电 | H152: 零部件制 | I152: 117.11 | J152: 1.38e-002 | K152: 8.199999999999999e-003 | L152: 22.07 | M152: 3.1300000000000001e-002 | N152: 3.3 | O152: 1.9e-002 | P152: 114.8 | Q152: 19.54 | R152: 3.15 | S152: 112.95 | T152: 3.7000000000000005e-002 | U152: 转股中 | V152: 4.64年 | W152: 2.64年 | X152: 7.400000000000001e-002 | Y152: 8.3000000000000004e-002 | Z152: 1.5 | AA152: 20 | AB152: -4.4000000000000003e-003 | AC152: -1.e-002 | AD152: -4.41e-002 | AE152: -4.6300000000000001e-002 | AF152: 91.63 | AG152: 94.34 | AH152: 0.7 | AI152: AA | AJ152: 4.41e-002 | AK152: =I152+100*T152 -> 120.81 | AL152: 121.3 | AM152: 35 | AN152: 26.9 | AO152: 19 | AP152: -1.1000000000000001e-002 | AQ152: 37 | AR152: 三星转债
A153: 167 | B153: 游族转债!! | C153: 128074 | D153: 43759. | E153: 游族网络 | F153: 2174 | G153: 通信互联 | H153: 互联网 | I153: 122.477 | J153: 1.8100000000000002e-002 | K153: 1.06e-002 | L153: 18.06 | M153: 3.32e-002 | N153: 9.5 | O153: 1.1000000000000001e-002 | P153: 119.9 | Q153: 16.97 | R153: 2.93 | S153: 106.42 | T153: 0.151 | U153: 转股中 | V153: 4.95年 | W153: 2.95年 | X153: 4.0999999999999995e-002 | Y153: 4.4000000000000004e-002 | Z153: 6.8 | AA153: 165 | AB153: -4.4000000000000003e-003 | AC153: -1.1200000000000002e-002 | AD153: -5.33e-002 | AE153: -5.5199999999999999e-002 | AF153: 90.49 | AG153: 97.2 | AH153: 0.86 | AI153: AA | AJ153: 4.41e-002 | AK153: =I153+100*T153 -> 137.577 | AL153: 138.5 | AM153: 187 | AN153: 41.3 | AO153: 147 | AP153: -4.2000000000000003e-002 | AQ153: 21 | AR153: 游族转债!!
A154: 78 | B154: 交科转债 | C154: 128107 | D154: 43973. | E154: 浙江交科 | F154: 2061 | G154: 建筑 | H154: 建筑工程 | I154: 118.16 | J154: 4.0999999999999995e-003 | K154: 1.29e-002 | L154: 5.86 | M154: 2.4500000000000001e-002 | N154: 8 | O154: 3.0000000000000001e-003 | P154: 115.3 | Q154: 5.36 | R154: 1.03 | S154: 109.33 | T154: 8.1000000000000003e-002 | U154: 17天 | V154: 5.53年 | W154: 3.53年 | X154: 0.31 | Y154: 0.33899999999999997 | Z154: 25 | AA154: 81 | AB154: -4.5000000000000005e-003 | AC154: -9.3999999999999986e-003 | AD154: -3.4799999999999998e-002 | AE154: -3.6600000000000001e-002 | AF154: 88.8 | AG154: 91.49 | AH154: 0.69 | AI154: AA+ | AJ154: 4.36e-002 | AK154: =I154+100*T154 -> 126.25999999999999 | AL154: 127 | AM154: 92 | AN154: 35.5 | AO154: 76 | AP154: 6.0000000000000001e-003 | AQ154: 14 | AR154: 交科转债
A155: 19 | B155: 华阳转债 | C155: 128125 | D155: 44064. | E155: 华阳国际 | F155: 2949 | G155: 建筑 | H155: 建筑工程 | I155: 121.897 | J155: 3.73e-002 | K155: 7.000000000000001e-004 | L155: 27.03 | M155: 5.0499999999999996e-002 | N155: 14 | O155: 2.5000000000000001e-002 | P155: 118.5 | Q155: 25.79 | R155: 4.61 | S155: 104.81 | T155: 0.16300000000000001 | U155: 3月27天 | V155: 5.80年 | W155: 3.80年 | X155: 8.5000000000000006e-002 | Y155: 8.900000000000001e-002 | Z155: 4.5 | AA155: 53 | AB155: -4.8999999999999998e-003 | AC155: -1.04e-002 | AD155: -4.0000000000000001e-002 | AE155: -4.1700000000000001e-002 | AF155: 80.6 | AG155: 82.12 | AH155: 0.75 | AI155: AA- | AJ155: 6.6600000000000006e-002 | AK155: =I155+100*T155 -> 138.197 | AL155: 139 | AM155: 190 | AN155: 56.9 | AO155: 235 | AP155: -5.0999999999999997e-002 | AQ155: 2 | AR155: 华阳转债
A156: 88 | B156: 滨化转债 | C156: 113034 | D156: 43951. | E156: 滨化股份 | F156: 601678 | G156: 化工 | H156: 化工 | I156: 118.3 | J156: 2.e-002 | K156: 7.0999999999999995e-003 | L156: 5.11 | M156: 3.8599999999999995e-002 | N156: 19 | O156: 6.9999999999999993e-003 | P156: 115.1 | Q156: 4.68 | R156: 1.31 | S156: 109.19 | T156: 8.3000000000000004e-002 | U156: 5.1天 | V156: 5.50年 | W156: 3.50年 | X156: 0.30399999999999999 | Y156: 0.33200000000000002 | Z156: 24 | AA156: 79 | AB156: -5.1000000000000004e-003 | AC156: -9.8999999999999991e-003 | AD156: -3.5900000000000001e-002 | AE156: -3.7599999999999995e-002 | AF156: 88.11 | AG156: 90.49 | AH156: 0.7 | AI156: AA | AJ156: 4.5599999999999995e-002 | AK156: =I156+100*T156 -> 126.59999999999999 | AL156: 127.4 | AM156: 95 | AN156: 36.9 | AO156: 97 | AP156: -3.6000000000000004e-002 | AQ156: 26 | AR156: 滨化转债
A157: 200 | B157: 现代转债 | C157: 110057 | D157: 43585. | E157: 现代制药 | F157: 600420 | G157: 医药 | H157: 化学制药 | I157: 113.39 | J157: -1.e-004 | K157: 1.4800000000000001e-002 | L157: 9.73 | M157: 2.53e-002 | N157: 3.2 | O157: 2.e-003 | P157: 110.8 | Q157: 9.89 | R157: 1.32 | S157: 98.38 | T157: 0.153 | U157: 转股中 | V157: 4.47年 | W157: 2.47年 | X157: 0.16200000000000001 | Y157: 0.159 | Z157: 16 | AA157: 100 | AB157: -5.3e-003 | AC157: -9.7000000000000003e-003 | AD157: -3.5000000000000003e-002 | AE157: -3.73e-002 | AF157: 93.45 | AG157: 93.66 | AH157: 0.58 | AI157: AAA | AJ157: 3.9100000000000003e-002 | AK157: =I157+100*T157 -> 128.69 | AL157: 128.4 | AM157: 103 | AN157: 34.7 | AO157: 66 | AP157: -9.0000000000000011e-003 | AQ157: 21 | AR157: 现代转债
A158: 105 | B158: 三祥转债! | C158: 113572 | D158: 43930. | E158: 三祥新材 | F158: 603663 | G158: 其他 | H158: 其他 | I158: 116.44 | J158: 1.2199999999999999e-002 | K158: 2.7000000000000003e-002 | L158: 15.6 | M158: 4.7e-002 | N158: 7 | O158: 3.5000000000000003e-002 | P158: 113.2 | Q158: 14.19 | R158: 5.37 | S158: 109.94 | T158: 5.9000000000000004e-002 | U158: 转股中 | V158: 5.42年 | W158: 3.42年 | X158: 5.7000000000000002e-002 | Y158: 6.3e-002 | Z158: 1.7 | AA158: 30 | AB158: -5.3e-003 | AC158: -9.7000000000000003e-003 | AD158: -3.2099999999999997e-002 | AE158: -3.4000000000000002e-002 | AF158: 79.55 | AG158: 76.16 | AH158: 0.83 | AI158: A+ | AJ158: 7.7600000000000002e-002 | AK158: =I158+100*T158 -> 122.34 | AL158: 122.9 | AM158: 49 | AN158: 43.4 | AO158: 162 | AP158: -0.14400000000000002 | AQ158: 14 | AR158: 三祥转债!
A159: 252 | B159: 华通转债! | C159: 128040 | D159: 43294. | E159: 华通医药 | F159: 2758 | G159: 医药 | H159: 医药商业 | I159: 114.555 | J159: 5.6999999999999993e-003 | K159: 4.8999999999999998e-003 | L159: 10.88 | M159: 1.78e-002 | N159: 1.9 | O159: 6.9999999999999993e-003 | P159: 112.3 | Q159: 11.29 | R159: 3.68 | S159: 96.37 | T159: 0.18899999999999997 | U159: 转股中 | V159: 3.67年 | W159: 1.67年 | X159: 9.6999999999999989e-002 | Y159: 9.4e-002 | Z159: 2.2 | AA159: 23 | AB159: -5.5000000000000005e-003 | AC159: -1.15e-002 | AD159: -5.7500000000000002e-002 | AE159: -6.0199999999999997e-002 | AF159: 91.61 | AG159: 89.47 | AH159: 0.6 | AI159: AA- | AJ159: 6.5099999999999991e-002 | AK159: =I159+100*T159 -> 133.45500000000001 | AL159: 132.7 | AM159: 142 | AN159: 41.1 | AO159: 144 | AP159: -2.7999999999999997e-002 | AQ159: 30 | AR159: 华通转债!
A160: 227 | B160: 福能转债! | C160: 110048 | D160: 43462. | E160: 福能股份 | F160: 600483 | G160: 能源电力 | H160: 电力供应 | I160: 116.57 | J160: 5.9999999999999995e-004 | K160: 1.8500000000000003e-002 | L160: 8.19 | M160: 3.2799999999999996e-002 | N160: 7.4 | O160: 2.e-003 | P160: 113.9 | Q160: 8.12 | R160: 1.05 | S160: 100.86 | T160: 0.156 | U160: 转股中 | V160: 4年57天 | W160: 2年57天 | X160: 0.19600000000000001 | Y160: 0.19800000000000001 | Z160: 28 | AA160: 144 | AB160: -5.6999999999999993e-003 | AC160: -1.1599999999999999e-002 | AD160: -5.0799999999999998e-002 | AE160: -5.3399999999999996e-002 | AF160: 94.06 | AG160: 96.32 | AH160: 0.58 | AI160: AA+ | AJ160: 4.2099999999999999e-002 | AK160: =I160+100*T160 -> 132.16999999999999 | AL160: 132.3 | AM160: 132 | AN160: 36 | AO160: 85 | AP160: 2.8999999999999998e-002 | AQ160: 8 | AR160: 福能转债!
A161: 176 | B161: 好客转债 | C161: 113542 | D161: 43700. | E161: 好莱客 | F161: 603898 | G161: 其他 | H161: 家居用品 | I161: 118.12 | J161: 2.12e-002 | K161: 1.3899999999999999e-002 | L161: 17.3 | M161: 5.3600000000000002e-002 | N161: 19 | O161: 2.7000000000000003e-002 | P161: 114.9 | Q161: 16.27 | R161: 2.3 | S161: 106.33 | T161: 0.111 | U161: 转股中 | V161: 4.81年 | W161: 2.81年 | X161: 0.113 | Y161: 0.12 | Z161: 6 | AA161: 54 | AB161: -5.7999999999999996e-003 | AC161: -1.1299999999999999e-002 | AD161: -4.4199999999999996e-002 | AE161: -4.6199999999999998e-002 | AF161: 91.06 | AG161: 93.75 | AH161: 0.65 | AI161: AA | AJ161: 4.41e-002 | AK161: =I161+100*T161 -> 129.22 | AL161: 129.9 | AM161: 109 | AN161: 36.2 | AO161: 89 | AP161: 4.0000000000000001e-003 | AQ161: 19 | AR161: 好客转债
A162: 60 | B162: 中矿转债 | C162: 128111 | D162: 44019. | E162: 中矿资源 | F162: 2738 | G162: 有色金属 | H162: 有色行业 | I162: 128.8 | J162: 7.6700000000000004e-002 | K162: 8.3000000000000001e-003 | L162: 19.65 | M162: 0.10000000000000001 | N162: 150 | O162: 0.14699999999999999 | P162: 124.7 | Q162: 15.53 | R162: 2.01 | S162: 126.53 | T162: 1.8000000000000002e-002 | U162: 2月7天 | V162: 5.67年 | W162: 3.67年 | X162: 0.14599999999999999 | Y162: 0.185 | Z162: 8 | AA162: 55 | AB162: -5.7999999999999996e-003 | AC162: -1.3000000000000001e-002 | AD162: -5.3399999999999996e-002 | AE162: -5.5500000000000001e-002 | AF162: 81.95 | AG162: 87.26 | AH162: 0.85 | AI162: AA- | AJ162: 6.6600000000000006e-002 | AK162: =I162+100*T162 -> 130.60000000000002 | AL162: 131.1 | AM162: 123 | AN162: 43.8 | AO162: 168 | AP162: 0.17800000000000002 | AQ162: 5 | AR162: 中矿转债
A163: 162 | B163: 英联转债! | C163: 128079 | D163: 43790. | E163: 英联股份 | F163: 2846 | G163: 造纸包装 | H163: 包装材料 | I163: 121.63 | J163: 1.89e-002 | K163: 3.5999999999999999e-003 | L163: 15.25 | M163: 2.2799999999999997e-002 | N163: 14 | O163: 7.5999999999999998e-002 | P163: 117.9 | Q163: 13.41 | R163: 4.31 | S163: 113.72 | T163: 7.0000000000000007e-002 | U163: 转股中 | V163: 5年10天 | W163: 3年10天 | X163: 5.0000000000000003e-002 | Y163: 5.7000000000000002e-002 | Z163: 1.5 | AA163: 30 | AB163: -6.3e-003 | AC163: -1.2500000000000001e-002 | AD163: -4.82e-002 | AE163: -5.04e-002 | AF163: 82.22 | AG163: 81.7 | AH163: 0.99 | AI163: A+ | AJ163: 7.7600000000000002e-002 | AK163: =I163+100*T163 -> 128.63 | AL163: 129.5 | AM163: 107 | AN163: 47.3 | AO163: 187 | AP163: -5.0999999999999997e-002 | AQ163: 18 | AR163: 英联转债!
A164: 225 | B164: 光华转债! | C164: 128051 | D164: 43474. | E164: 光华科技 | F164: 2741 | G164: 电子 | H164: 元器件制 | I164: 118.622 | J164: 2.3300000000000001e-002 | K164: 1.15e-002 | L164: 14.97 | M164: 4.3200000000000002e-002 | N164: 7.1 | O164: 2.4e-002 | P164: 115.5 | Q164: 12.72 | R164: 4.67 | S164: 117.69 | T164: 8.0000000000000002e-003 | U164: 转股中 | V164: 4.18年 | W164: 2.18年 | X164: 4.4999999999999998e-002 | Y164: 5.2999999999999999e-002 | Z164: 2.5 | AA164: 56 | AB164: -6.5000000000000006e-003 | AC164: -1.3100000000000001e-002 | AD164: -5.5899999999999998e-002 | AE164: -5.8799999999999998e-002 | AF164: 89.74 | AG164: 89.34 | AH164: 0.81 | AI164: AA- | AJ164: 6.5099999999999991e-002 | AK164: =I164+100*T164 -> 119.422 | AL164: 119.6 | AM164: 23 | AN164: 29.8 | AO164: 35 | AP164: 4.4000000000000004e-002 | AQ164: 21 | AR164: 光华转债!
A165: 65 | B165: 宝通转债 | C165: 123053 | D165: 44013. | E165: 宝通科技 | F165: 300031 | G165: 通信互联 | H165: 互联网 | I165: 125.799 | J165: 1.04e-002 | K165: 4.3e-003 | L165: 22.38 | M165: 1.9599999999999999e-002 | N165: 6 | O165: 9.0000000000000011e-003 | P165: 121.3 | Q165: 20.8 | R165: 3.17 | S165: 107.6 | T165: 0.16899999999999998 | U165: 2月1天 | V165: 5.65年 | W165: 3.65年 | X165: 5.5999999999999994e-002 | Y165: 6.0999999999999999e-002 | Z165: 5 | AA165: 89 | AB165: -6.6e-003 | AC165: -1.29e-002 | AD165: -4.8600000000000004e-002 | AE165: -5.0599999999999999e-002 | AF165: 81.73 | AG165: 84.96 | AH165: 0.75 | AI165: AA- | AJ165: 6.6600000000000006e-002 | AK165: =I165+100*T165 -> 142.69900000000001 | AL165: 144 | AM165: 226 | AN165: 59 | AO165: 247 | AP165: 2.e-003 | AQ165: 4 | AR165: 宝通转债
A166: 298 | B166: 国贸转债! | C166: 110033 | D166: 42388. | E166: 厦门国贸 | F166: 600755 | G166: 交通运输 | H166: 交通运输 | I166: 110.66 | J166: 6.1999999999999998e-003 | K166: -8.0000000000000004e-004 | L166: 6.87 | M166: 1.78e-002 | N166: 4.5 | O166: 3.0000000000000001e-003 | P166: 109.7 | Q166: 7.19 | R166: 0.9 | S166: 95.55 | T166: 0.158 | U166: 转股中 | V166: 1.24年 | W166: 回售中 | X166: 9.4e-002 | Y166: 8.9999999999999997e-002 | Z166: 12 | AA166: 129 | AB166: -7.0999999999999995e-003 | AC166: -2.1499999999999998e-002 | AD166: 回售中 | AE166: 回售中 | AF166: 100.28 | AG166: 104.83 | AH166: 0.3 | AI166: AAA | AJ166: 3.7900000000000003e-002 | AK166: =I166+100*T166 -> 126.45999999999999 | AL166: 125.8 | AM166: 73 | AN166: 20.9 | AO166: 6 | AP166: -1.3000000000000001e-002 | AQ166: 18 | AR166: 国贸转债!
A167: 183 | B167: 文灿转债! | C167: 113537 | D167: 43651. | E167: 文灿股份 | F167: 603348 | G167: 汽车 | H167: 零部件制 | I167: 125.77 | J167: -5.0000000000000001e-004 | K167: 2.4500000000000001e-002 | L167: 24.21 | M167: 2.9300000000000003e-002 | N167: 28 | O167: 4.4000000000000004e-002 | P167: 121.5 | Q167: 19.43 | R167: 2.46 | S167: 124.6 | T167: 9.0000000000000011e-003 | U167: 转股中 | V167: 4.66年 | W167: 2.66年 | X167: 8.8000000000000009e-002 | Y167: 0.109 | Z167: 5.1 | AA167: 58 | AB167: -7.4999999999999997e-003 | AC167: -1.5300000000000001e-002 | AD167: -6.4299999999999996e-002 | AE167: -6.7000000000000004e-002 | AF167: 87.54 | AG167: 91.2 | AH167: 0.82 | AI167: AA- | AJ167: 6.5099999999999991e-002 | AK167: =I167+100*T167 -> 126.67 | AL167: 126.9 | AM167: 90 | AN167: 35.7 | AO167: 81 | AP167: -3.0000000000000001e-003 | AQ167: 26 | AR167: 文灿转债!
A168: 165 | B168: 金能转债 | C168: 113545 | D168: 43776. | E168: 金能科技 | F168: 603113 | G168: 煤炭 | H168: 炼焦 | I168: 119.8 | J168: 1.43e-002 | K168: -2.e-003 | L168: 12.22 | M168: 1.83e-002 | N168: 1.3 | O168: 1.e-003 | P168: 115.3 | Q168: 11.4 | R168: 1.4 | S168: 107.19 | T168: 0.11800000000000001 | U168: 转股中 | V168: 5年3.1天 | W168: 3年3.1天 | X168: 0.182 | Y168: 0.19500000000000001 | Z168: 15 | AA168: 83 | AB168: -7.8000000000000005e-003 | AC168: -1.3100000000000001e-002 | AD168: -4.4600000000000001e-002 | AE168: -4.6799999999999994e-002 | AF168: 90.26 | AG168: 92.68 | AH168: 0.67 | AI168: AA | AJ168: 4.5599999999999995e-002 | AK168: =I168+100*T168 -> 131.59999999999999 | AL168: 132.4 | AM168: 135 | AN168: 39.7 | AO168: 131 | AP168: -8.0000000000000002e-003 | AQ168: 20 | AR168: 金能转债
A169: 189 | B169: 永鼎转债! | C169: 110058 | D169: 43593. | E169: 永鼎股份 | F169: 600105 | G169: 通信互联 | H169: 通信设备 | I169: 119 | J169: 2.07e-002 | K169: 2.7000000000000001e-003 | L169: 6.05 | M169: 3.0699999999999998e-002 | N169: 8.8 | O169: 1.1000000000000001e-002 | P169: 114.9 | Q169: 5.04 | R169: 3.24 | S169: 120.04 | T169: -9.0000000000000011e-003 | U169: 转股中 | V169: 4.51年 | W169: 2.51年 | X169: 8.8000000000000009e-002 | Y169: 0.106 | Z169: 6.6 | AA169: 75 | AB169: -7.9000000000000008e-003 | AC169: -1.37e-002 | AD169: -5.16e-002 | AE169: -5.3800000000000001e-002 | AF169: 92.22 | AG169: 94.94 | AH169: 0.76 | AI169: AA | AJ169: 4.41e-002 | AK169: =I169+100*T169 -> 118.09999999999999 | AL169: 118 | AM169: 13 | AN169: 23 | AO169: 10 | AP169: 6.9999999999999993e-003 | AQ169: 55 | AR169: 永鼎转债!
A170: 268 | B170: 蒙电转债! | C170: 110041 | D170: 43109. | E170: 内蒙华电 | F170: 600863 | G170: 能源电力 | H170: 电力供应 | I170: 113.38 | J170: 4.3e-003 | K170: 3.7000000000000002e-003 | L170: 2.6 | M170: 1.5600000000000001e-002 | N170: 6.2 | O170: 3.0000000000000001e-003 | P170: 110.3 | Q170: 2.69 | R170: 1.32 | S170: 96.65 | T170: 0.17300000000000001 | U170: 转股中 | V170: 3.20年 | W170: 1.20年 | X170: 0.124 | Y170: 0.12 | Z170: 19 | AA170: 151 | AB170: -8.8000000000000005e-003 | AC170: -1.47e-002 | AD170: -6.9900000000000004e-002 | AE170: -7.3599999999999999e-002 | AF170: 97.61 | AG170: 97.84 | AH170: 0.51 | AI170: AAA | AJ170: 3.9100000000000003e-002 | AK170: =I170+100*T170 -> 130.68000000000001 | AL170: 130.1 | AM170: 112 | AN170: 32.3 | AO170: 51 | AP170: -9.0000000000000011e-003 | AQ170: 8 | AR170: 蒙电转债!
A171: 123 | B171: 柳药转债 | C171: 113563 | D171: 43885. | E171: 柳药股份 | F171: 603368 | G171: 医药 | H171: 医药商业 | I171: 118.5 | J171: 2.0000000000000001e-004 | K171: 4.8999999999999998e-003 | L171: 23.49 | M171: 8.6e-003 | N171: 0.2 | O171: 0. | P171: 113.2 | Q171: 24.47 | R171: 1.86 | S171: 96 | T171: 0.23399999999999999 | U171: 转股中 | V171: 5.27年 | W171: 3.27年 | X171: 9.4e-002 | Y171: 8.9999999999999997e-002 | Z171: 8 | AA171: 85 | AB171: -8.8000000000000005e-003 | AC171: -1.3300000000000001e-002 | AD171: -3.85e-002 | AE171: -4.0399999999999998e-002 | AF171: 89.13 | AG171: 89.94 | AH171: 0.6 | AI171: AA | AJ171: 4.5599999999999995e-002 | AK171: =I171+100*T171 -> 141.90000000000001 | AL171: 141 | AM171: 206 | AN171: 51.1 | AO171: 207 | AP171: -2.8999999999999998e-002 | AQ171: 16 | AR171: 柳药转债
A172: 253 | B172: 三力转债! | C172: 128039 | D172: 43280. | E172: 三 力 士 | F172: 2224 | G172: 机械装备 | H172: 专用设备 | I172: 113.442 | J172: 1.2699999999999999e-002 | K172: 4.3e-003 | L172: 6.12 | M172: 2.3399999999999997e-002 | N172: 1 | O172: 4.0000000000000001e-003 | P172: 109.8 | Q172: 5.81 | R172: 1.94 | S172: 105.34 | T172: 7.6999999999999999e-002 | U172: 转股中 | V172: 3.66年 | W172: 1.66年 | X172: 4.4999999999999998e-002 | Y172: 4.8000000000000001e-002 | Z172: 2 | AA172: 45 | AB172: -9.0000000000000011e-003 | AC172: -1.3899999999999999e-002 | AD172: -5.4199999999999998e-002 | AE172: -5.67e-002 | AF172: 91.48 | AG172: 87.55 | AH172: 0.72 | AI172: AA- | AJ172: 6.5099999999999991e-002 | AK172: =I172+100*T172 -> 121.142 | AL172: 121.5 | AM172: 37 | AN172: 30.1 | AO172: 38 | AP172: -1.6e-002 | AQ172: 19 | AR172: 三力转债!
A173: 54 | B173: 润达转债 | C173: 113588 | D173: 44025. | E173: 润达医疗 | F173: 603108 | G173: 医药 | H173: 医疗器械 | I173: 120.6 | J173: 1.e-003 | K173: 8.9999999999999998e-004 | L173: 13.45 | M173: 3.0000000000000001e-003 | N173: 7.2 | O173: 1.1000000000000001e-002 | P173: 114.2 | Q173: 13.36 | R173: 2.71 | S173: 100.67 | T173: 0.19800000000000001 | U173: 2月13天 | V173: 5.68年 | W173: 3.68年 | X173: 7.0999999999999994e-002 | Y173: 7.0999999999999994e-002 | Z173: 5.5 | AA173: 78 | AB173: -9.7000000000000003e-003 | AC173: -1.41e-002 | AD173: -3.8800000000000001e-002 | AE173: -4.0500000000000001e-002 | AF173: 87.48 | AG173: 89.06 | AH173: 0.65 | AI173: AA | AJ173: 4.5599999999999995e-002 | AK173: =I173+100*T173 -> 140.40000000000001 | AL173: 140.5 | AM173: 204 | AN173: 51.5 | AO173: 209 | AP173: -2.2000000000000002e-002 | AQ173: 6 | AR173: 润达转债
A174: 82 | B174: 聚飞转债 | C174: 123050 | D174: 43966. | E174: 聚飞光电 | F174: 300303 | G174: 电子 | H174: LED制 | I174: 131.13 | J174: 1.67e-002 | K174: 1.9199999999999998e-002 | L174: 6.57 | M174: 4.2900000000000001e-002 | N174: 9.4 | O174: 1.e-002 | P174: 124.2 | Q174: 5.18 | R174: 3.57 | S174: 126.83 | T174: 3.4000000000000002e-002 | U174: 9天 | V174: 5.51年 | W174: 3.51年 | X174: 8.4000000000000005e-002 | Y174: 0.106 | Z174: 7.1 | AA174: 84 | AB174: -1.e-002 | AC174: -1.72e-002 | AD174: -6.1500000000000006e-002 | AE174: -6.3399999999999998e-002 | AF174: 82.38 | AG174: 87.75 | AH174: 0.84 | AI174: AA- | AJ174: 6.6600000000000006e-002 | AK174: =I174+100*T174 -> 134.53 | AL174: 135.4 | AM174: 170 | AN174: 47.7 | AO174: 191 | AP174: -6.6000000000000003e-002 | AQ174: 11 | AR174: 聚飞转债
A175: 286 | B175: 林洋转债! | C175: 113014 | D175: 43052. | E175: 林洋能源 | F175: 601222 | G175: 能源电力 | H175: 电力设备 | I175: 113.68 | J175: 3.04e-002 | K175: -7.000000000000001e-004 | L175: 7.6 | M175: 7.3399999999999993e-002 | N175: 40 | O175: 1.2e-002 | P175: 110.3 | Q175: 8.54 | R175: 1.31 | S175: 88.99 | T175: 0.27699999999999997 | U175: 转股中 | V175: 3年16天 | W175: 1年16天 | X175: 0.22600000000000001 | Y175: 0.20100000000000001 | Z175: 30 | AA175: 133 | AB175: -1.01e-002 | AC175: -1.6299999999999999e-002 | AD175: -8.0600000000000005e-002 | AE175: -8.4600000000000009e-002 | AF175: 97.63 | AG175: 97.03 | AH175: 0.4 | AI175: AA | AJ175: 4.41e-002 | AK175: =I175+100*T175 -> 141.38 | AL175: 138.4 | AM175: 186 | AN175: 40.7 | AO175: 139 | AP175: 6.3e-002 | AQ175: 22 | AR175: 林洋转债!
A176: 210 | B176: 中鼎转2! | C176: 127011 | D176: 43559. | E176: 中鼎股份 | F176: 887 | G176: 汽车 | H176: 零部件制 | I176: 120.38 | J176: 3.4200000000000001e-002 | K176: 3.2000000000000002e-003 | L176: 11.12 | M176: 7.2300000000000003e-002 | N176: 23 | O176: 1.6e-002 | P176: 115.2 | Q176: 11.59 | R176: 1.54 | S176: 95.94 | T176: 0.255 | U176: 转股中 | V176: 4.41年 | W176: 2.41年 | X176: 8.8000000000000009e-002 | Y176: 8.5000000000000006e-002 | Z176: 12 | AA176: 136 | AB176: -1.01e-002 | AC176: -1.6200000000000003e-002 | AD176: -5.7500000000000002e-002 | AE176: -5.9900000000000002e-002 | AF176: 93.22 | AG176: 96.44 | AH176: 0.52 | AI176: AA+ | AJ176: 4.2099999999999999e-002 | AK176: =I176+100*T176 -> 145.88 | AL176: 144.8 | AM176: 230 | AN176: 48.4 | AO176: 193 | AP176: 5.4000000000000006e-002 | AQ176: 28 | AR176: 中鼎转2!
A177: 36 | B177: 宏川转债 | C177: 128121 | D177: 44050. | E177: 宏川智慧 | F177: 2930 | G177: 交通运输 | H177: 物流业 | I177: 120.001 | J177: 4.1999999999999997e-003 | K177: 1.4800000000000001e-002 | L177: 19.74 | M177: 2.6000000000000002e-002 | N177: 1.7 | O177: 2.e-003 | P177: 113.3 | Q177: 20.25 | R177: 4.76 | S177: 97.48 | T177: 0.23100000000000001 | U177: 3月16天 | V177: 5.76年 | W177: 3.76年 | X177: 7.5999999999999998e-002 | Y177: 7.4999999999999997e-002 | Z177: 6.7 | AA177: 88 | AB177: -1.01e-002 | AC177: -1.4199999999999999e-002 | AD177: -3.6499999999999998e-002 | AE177: -3.8300000000000001e-002 | AF177: 80.76 | AG177: 78.71 | AH177: 0.73 | AI177: AA- | AJ177: 6.6600000000000006e-002 | AK177: =I177+100*T177 -> 143.101 | AL177: 142.5 | AM177: 219 | AN177: 61.8 | AO177: 256 | AP177: 4.8000000000000001e-002 | AQ177: 3 | AR177: 宏川转债
A178: 211 | B178: 拓邦转债 | C178: 128058 | D178: 43563. | E178: 拓邦股份 | F178: 2139 | G178: 电子 | H178: 电子产品 | I178: 128.1 | J178: 4.0999999999999995e-003 | K178: 1.52e-002 | L178: 6.77 | M178: 2.58e-002 | N178: 28 | O178: 3.7000000000000005e-002 | P178: 122.6 | Q178: 5.47 | R178: 2.7 | S178: 123.77 | T178: 3.5000000000000003e-002 | U178: 转股中 | V178: 4.40年 | W178: 2.40年 | X178: 8.199999999999999e-002 | Y178: 0.10099999999999999 | Z178: 5.7 | AA178: 70 | AB178: -1.0200000000000001e-002 | AC178: -1.8700000000000001e-002 | AD178: -7.6999999999999999e-002 | AE178: -8.0000000000000002e-002 | AF178: 93.68 | AG178: 101.88 | AH178: 0.75 | AI178: AA | AJ178: 4.41e-002 | AK178: =I178+100*T178 -> 131.59999999999999 | AL178: 132.4 | AM178: 137 | AN178: 30.6 | AO178: 40 | AP178: -9.0000000000000011e-003 | AQ178: 20 | AR178: 拓邦转债
A179: 177 | B179: 荣晟转债! | C179: 113541 | D179: 43690. | E179: 荣晟环保 | F179: 603165 | G179: 造纸包装 | H179: 包装用纸 | I179: 120.7 | J179: -2.8999999999999998e-003 | K179: -4.0999999999999995e-003 | L179: 13.93 | M179: -8.5000000000000006e-003 | N179: 6.8 | O179: 1.9e-002 | P179: 115 | Q179: 11.54 | R179: 2.41 | S179: 120.71 | T179: 0. | U179: 转股中 | V179: 4.78年 | W179: 2.78年 | X179: 8.8000000000000009e-002 | Y179: 0.107 | Z179: 3.1 | AA179: 35 | AB179: -1.03e-002 | AC179: -1.5800000000000002e-002 | AD179: -5.1299999999999998e-002 | AE179: -5.3399999999999996e-002 | AF179: 86.1 | AG179: 85.59 | AH179: 0.82 | AI179: AA- | AJ179: 6.5099999999999991e-002 | AK179: =I179+100*T179 -> 120.7 | AL179: 120.7 | AM179: 31 | AN179: 34.6 | AO179: 65 | AP179: 8.0000000000000002e-003 | AQ179: 48 | AR179: 荣晟转债!
A180: 62 | B180: 永兴转债 | C180: 128110 | D180: 44020. | E180: 永兴材料 | F180: 2756 | G180: 钢铁 | H180: 炼钢 | I180: 120.032 | J180: 1.11e-002 | K180: 1.7299999999999999e-002 | L180: 17 | M180: 4.4199999999999996e-002 | N180: 1.2 | O180: 1.e-003 | P180: 113.2 | Q180: 17.06 | R180: 1.8 | S180: 99.65 | T180: 0.20499999999999999 | U180: 2月5天 | V180: 5.66年 | W180: 3.66年 | X180: 0.113 | Y180: 0.11199999999999999 | Z180: 7 | AA180: 62 | AB180: -1.0500000000000001e-002 | AC180: -1.46e-002 | AD180: -3.78e-002 | AE180: -3.95e-002 | AF180: 87.56 | AG180: 88.37 | AH180: 0.64 | AI180: AA | AJ180: 4.5599999999999995e-002 | AK180: =I180+100*T180 -> 140.53199999999998 | AL180: 140.4 | AM180: 202 | AN180: 52 | AO180: 213 | AP180: -2.3e-002 | AQ180: 4 | AR180: 永兴转债
A181: 18 | B181: 法兰转债 | C181: 113598 | D181: 44068. | E181: 法兰泰克 | F181: 603966 | G181: 机械装备 | H181: 工程机械 | I181: 128.68 | J181: 6.8999999999999999e-003 | K181: 9.8999999999999991e-003 | L181: 16.18 | M181: 2.0799999999999999e-002 | N181: 1.9 | O181: 4.0000000000000001e-003 | P181: 121.2 | Q181: 13.88 | R181: 3.2 | S181: 116.57 | T181: 0.10400000000000001 | U181: 3月28天 | V181: 5.80年 | W181: 3.80年 | X181: 9.6999999999999989e-002 | Y181: 0.113 | Z181: 3.3 | AA181: 34 | AB181: -1.0500000000000001e-002 | AC181: -1.66e-002 | AD181: -5.2400000000000002e-002 | AE181: -5.4199999999999998e-002 | AF181: 80.83 | AG181: 84.02 | AH181: 0.81 | AI181: AA- | AJ181: 6.6600000000000006e-002 | AK181: =I181+100*T181 -> 139.08000000000001 | AL181: 140.8 | AM181: 205 | AN181: 56.8 | AO181: 234 | AP181: -4.4000000000000004e-002 | AQ181: 4 | AR181: 法兰转债
A182: 40 | B182: 龙大转债 | C182: 128119 | D182: 44050. | E182: 龙大肉食 | F182: 2726 | G182: 食品饮料 | H182: 肉制品 | I182: 127.86 | J182: 2.3599999999999999e-002 | K182: -1.03e-002 | L182: 10.64 | M182: 1.9199999999999998e-002 | N182: 26 | O182: 2.1000000000000001e-002 | P182: 120.2 | Q182: 9.56 | R182: 4.09 | S182: 111.3 | T182: 0.14899999999999999 | U182: 3月8天 | V182: 5.75年 | W182: 3.75年 | X182: 8.900000000000001e-002 | Y182: 0.10000000000000001 | Z182: 9.5 | AA182: 106 | AB182: -1.09e-002 | AC182: -1.6799999999999999e-002 | AD182: -5.2400000000000002e-002 | AE182: -5.4100000000000002e-002 | AF182: 87.2 | AG182: 93.42 | AH182: 0.7 | AI182: AA | AJ182: 4.5599999999999995e-002 | AK182: =I182+100*T182 -> 142.75999999999999 | AL182: 144.4 | AM182: 228 | AN182: 51 | AO182: 205 | AP182: -3.7000000000000005e-002 | AQ182: 5 | AR182: 龙大转债
A183: 67 | B183: 家悦转债 | C183: 113584 | D183: 44006. | E183: 家家悦 | F183: 603708 | G183: 商业零售 | H183: 超市 | I183: 122.59 | J183: -4.0999999999999995e-003 | K183: 5.9999999999999995e-004 | L183: 35.85 | M183: -6.0999999999999995e-003 | N183: 0.3 | O183: 0. | P183: 115.3 | Q183: 37.97 | R183: 7.52 | S183: 94.42 | T183: 0.29799999999999999 | U183: 2月2天 | V183: 5.65年 | W183: 3.65年 | X183: 2.9999999999999999e-002 | Y183: 2.7999999999999997e-002 | Z183: 6.5 | AA183: 218 | AB183: -1.1000000000000001e-002 | AC183: -1.5700000000000002e-002 | AD183: -4.2999999999999997e-002 | AE183: -4.4800000000000006e-002 | AF183: 87.7 | AG183: 90.06 | AH183: 0.57 | AI183: AA | AJ183: 4.5599999999999995e-002 | AK183: =I183+100*T183 -> 152.38999999999999 | AL183: 150.8 | AM183: 254 | AN183: 60.7 | AO183: 253 | AP183: -3.1e-002 | AQ183: 3 | AR183: 家悦转债
A184: 116 | B184: 桐20转债! | C184: 113032 | D184: 43910. | E184: 桐昆股份 | F184: 601233 | G184: 服装纺织 | H184: 纺织行业 | I184: 120.32 | J184: 7.000000000000001e-004 | K184: 1.7299999999999999e-002 | L184: 14.23 | M184: 2.8900000000000002e-002 | N184: 4.3 | O184: 2.e-003 | P184: 113.1 | Q184: 14.35 | R184: 1.36 | S184: 99.16 | T184: 0.21299999999999999 | U184: 转股中 | V184: 5.39年 | W184: 3.39年 | X184: 8.6999999999999994e-002 | Y184: 8.6999999999999994e-002 | Z184: 23 | AA184: 263 | AB184: -1.1599999999999999e-002 | AC184: -1.5900000000000001e-002 | AD184: -4.1500000000000002e-002 | AE184: -4.3400000000000001e-002 | AF184: 89.13 | AG184: 90.26 | AH184: 0.63 | AI184: AA+ | AJ184: 4.36e-002 | AK184: =I184+100*T184 -> 141.62 | AL184: 141.5 | AM184: 211 | AN184: 51.2 | AO184: 208 | AP184: -4.9000000000000002e-002 | AQ184: 20 | AR184: 桐20转债!
A185: 29 | B185: 航新转债 | C185: 123061 | D185: 44061. | E185: 航新科技 | F185: 300424 | G185: 航空航天 | H185: 航空航天 | I185: 133.35 | J185: 2.7200000000000002e-002 | K185: 3.5900000000000001e-002 | L185: 20.79 | M185: 7.1099999999999997e-002 | N185: 121 | O185: 0.35999999999999999 | P185: 124.8 | Q185: 14.86 | R185: 4.64 | S185: 139.91 | T185: -4.7e-002 | U185: 3月19天 | V185: 5.78年 | W185: 3.78年 | X185: 5.0000000000000003e-002 | Y185: 7.0000000000000007e-002 | Z185: 2.5 | AA185: 50 | AB185: -1.1599999999999999e-002 | AC185: -1.8600000000000002e-002 | AD185: -6.0100000000000001e-002 | AE185: -6.2100000000000002e-002 | AF185: 81.45 | AG185: 86.72 | AH185: 0.89 | AI185: AA- | AJ185: 6.6600000000000006e-002 | AK185: =I185+100*T185 -> 128.65000000000001 | AL185: 126.8 | AM185: 87 | AN185: 40.1 | AO185: 137 | AP185: 0.159 | AQ185: 5 | AR185: 航新转债
A186: 6 | B186: 景20转债 | C186: 113602 | D186: 44096. | E186: 景旺电子 | F186: 603228 | G186: 电子 | H186: 元器件制 | I186: 121.39 | J186: 1.7899999999999999e-002 | K186: -5.6999999999999993e-003 | L186: 34.01 | M186: 1.9799999999999998e-002 | N186: 44 | O186: 2.1000000000000001e-002 | P186: 113.3 | Q186: 35.28 | R186: 5.03 | S186: 96.4 | T186: 0.25900000000000001 | U186: 4月21天 | V186: 5.87年 | W186: 3.87年 | X186: 6.0999999999999999e-002 | Y186: 5.9000000000000004e-002 | Z186: 18 | AA186: 290 | AB186: -1.1899999999999999e-002 | AC186: -1.5900000000000001e-002 | AD186: -3.8399999999999997e-002 | AE186: -4.0099999999999997e-002 | AF186: 86.85 | AG186: 87.65 | AH186: 0.62 | AI186: AA | AJ186: 4.5599999999999995e-002 | AK186: =I186+100*T186 -> 147.28999999999999 | AL186: 146.4 | AM186: 236 | AN186: 58.7 | AO186: 246 | AP186: 3.0000000000000001e-003 | AQ186: 3 | AR186: 景20转债
A187: 263 | B187: 无锡转债! | C187: 110043 | D187: 43173. | E187: 无锡银行 | F187: 600908 | G187: 金融 | H187: 银行行业 | I187: 113.5 | J187: 8.0000000000000002e-003 | K187: -3.2000000000000002e-003 | L187: 5.58 | M187: 9.0000000000000011e-003 | N187: 5.9 | O187: 2.e-003 | P187: 109.1 | Q187: 5.79 | R187: 0.91 | S187: 96.37 | T187: 0.17800000000000002 | U187: 转股中 | V187: 3.30年 | W187: 无权 | X187: 0.29100000000000004 | Y187: 0.28000000000000003 | Z187: 30 | AA187: 103 | AB187: -1.21e-002 | AC187: -1.7100000000000001e-002 | AD187: 无权 | AE187: 无权 | AF187: 无权 | AG187: 95.42 | AH187: 0.53 | AI187: AA+ | AJ187: 4.2099999999999999e-002 | AK187: =I187+100*T187 -> 131.30000000000001 | AL187: 130.6 | AM187: 118 | AN187: 35.2 | AO187: 74 | AP187: -2.2000000000000002e-002 | AQ187: 31 | AR187: 无锡转债!
A188: 115 | B188: 盛屯转债! | C188: 110066 | D188: 43921. | E188: 盛屯矿业 | F188: 600711 | G188: 有色金属 | H188: 有色行业 | I188: 123.1 | J188: 1.6000000000000001e-003 | K188: 3.4599999999999999e-002 | L188: 5.51 | M188: 4.9500000000000002e-002 | N188: 37 | O188: 1.3000000000000001e-002 | P188: 115.3 | Q188: 4.88 | R188: 1.4 | S188: 112.91 | T188: 8.9999999999999997e-002 | U188: 转股中 | V188: 5.39年 | W188: 3.39年 | X188: 0.185 | Y188: 0.20899999999999999 | Z188: 24 | AA188: 127 | AB188: -1.23e-002 | AC188: -1.7299999999999999e-002 | AD188: -4.7300000000000002e-002 | AE188: -4.9200000000000001e-002 | AF188: 88.73 | AG188: 91.12 | AH188: 0.73 | AI188: AA | AJ188: 4.5599999999999995e-002 | AK188: =I188+100*T188 -> 132.09999999999999 | AL188: 133.3 | AM188: 148 | AN188: 42.2 | AO188: 153 | AP188: -5.9000000000000004e-002 | AQ188: 44 | AR188: 盛屯转债!
A189: 85 | B189: 华统转债 | C189: 128106 | D189: 43959. | E189: 华统股份 | F189: 2840 | G189: 农业 | H189: 农产品加 | I189: 121.017 | J189: 1.0800000000000001e-002 | K189: 1.21e-002 | L189: 10.68 | M189: 2.9900000000000003e-002 | N189: 9.1 | O189: 1.3999999999999999e-002 | P189: 113.2 | Q189: 9.39 | R189: 1.81 | S189: 113.74 | T189: 6.4000000000000001e-002 | U189: 5.1天 | V189: 5.50年 | W189: 3.50年 | X189: 0.115 | Y189: 0.13100000000000001 | Z189: 5.5 | AA189: 48 | AB189: -1.23e-002 | AC189: -1.6500000000000001e-002 | AD189: -4.1599999999999998e-002 | AE189: -4.3400000000000001e-002 | AF189: 88.21 | AG189: 89.02 | AH189: 0.77 | AI189: AA | AJ189: 4.5599999999999995e-002 | AK189: =I189+100*T189 -> 127.417 | AL189: 128.3 | AM189: 101 | AN189: 39.3 | AO189: 123 | AP189: 4.0000000000000001e-003 | AQ189: 7 | AR189: 华统转债
A190: 234 | B190: 张行转债 | C190: 128048 | D190: 43433. | E190: 张家港行 | F190: 2839 | G190: 金融 | H190: 银行行业 | I190: 119.95 | J190: 8.8000000000000005e-003 | K190: -3.8e-003 | L190: 5.89 | M190: 8.6e-003 | N190: 2.1 | O190: 1.e-003 | P190: 113.9 | Q190: 5.76 | R190: 1.03 | S190: 102.26 | T190: 0.17300000000000001 | U190: 转股中 | V190: 4年32天 | W190: 无权 | X190: 0.23499999999999999 | Y190: 0.23999999999999999 | Z190: 25 | AA190: 106 | AB190: -1.2800000000000001e-002 | AC190: -1.8799999999999997e-002 | AD190: 无权 | AE190: 无权 | AF190: 无权 | AG190: 96.59 | AH190: 0.59 | AI190: AA+ | AJ190: 4.2099999999999999e-002 | AK190: =I190+100*T190 -> 137.25 | AL190: 137.6 | AM190: 180 | AN190: 41 | AO190: 143 | AP190: -2.6000000000000002e-002 | AQ190: 14 | AR190: 张行转债
A191: 26 | B191: 国投转债 | C191: 110073 | D191: 44063. | E191: 国投资本 | F191: 600061 | G191: 金融 | H191: 证券行业 | I191: 119.21 | J191: 1.1999999999999999e-003 | K191: 8.8999999999999999e-003 | L191: 15.54 | M191: 1.5700000000000002e-002 | N191: 219 | O191: 2.3e-002 | P191: 110.5 | Q191: 15.25 | R191: 1.62 | S191: 101.9 | T191: 0.17000000000000001 | U191: 3月23天 | V191: 5.78年 | W191: 无权 | X191: 0.122 | Y191: 0.124 | Z191: 80 | AA191: 657 | AB191: -1.32e-002 | AC191: -1.6399999999999998e-002 | AD191: 无权 | AE191: 无权 | AF191: 无权 | AG191: 88.02 | AH191: 0.64 | AI191: AAA | AJ191: 4.0599999999999997e-002 | AK191: =I191+100*T191 -> 136.20999999999998 | AL191: 136.5 | AM191: 174 | AN191: 48.5 | AO191: 195 | AP191: 4.0999999999999995e-002 | AQ191: 20 | AR191: 国投转债
A192: 158 | B192: 天路转债! | C192: 110060 | D192: 43797. | E192: 西藏天路 | F192: 600326 | G192: 建筑 | H192: 水泥 | I192: 123.38 | J192: 1.8700000000000001e-002 | K192: 0. | L192: 8.11 | M192: 2.53e-002 | N192: 10 | O192: 1.1000000000000001e-002 | P192: 115.3 | Q192: 7.16 | R192: 1.96 | S192: 113.27 | T192: 8.900000000000001e-002 | U192: 转股中 | V192: 5年17天 | W192: 3年17天 | X192: 0.10099999999999999 | Y192: 0.114 | Z192: 7.1 | AA192: 70 | AB192: -1.3600000000000001e-002 | AC192: -1.89e-002 | AD192: -5.2900000000000003e-002 | AE192: -5.5e-002 | AF192: 90.1 | AG192: 92.52 | AH192: 0.74 | AI192: AA | AJ192: 4.5599999999999995e-002 | AK192: =I192+100*T192 -> 132.28 | AL192: 133.5 | AM192: 151 | AN192: 41 | AO192: 142 | AP192: -2.7999999999999997e-002 | AQ192: 12 | AR192: 天路转债!
A193: 135 | B193: 淮矿转债! | C193: 110065 | D193: 43843. | E193: 淮北矿业 | F193: 600985 | G193: 煤炭 | H193: 煤炭开采 | I193: 119.04 | J193: 4.4000000000000003e-003 | K193: 8.3999999999999995e-003 | L193: 9.88 | M193: 1.8600000000000002e-002 | N193: 32 | O193: 1.e-002 | P193: 111 | Q193: 9.33 | R193: 1.1 | S193: 105.89 | T193: 0.124 | U193: 转股中 | V193: 5.20年 | W193: 3.20年 | X193: 0.129 | Y193: 0.13600000000000001 | Z193: 28 | AA193: 215 | AB193: -1.3600000000000001e-002 | AC193: -1.7399999999999999e-002 | AD193: -4.0999999999999995e-002 | AE193: -4.2900000000000001e-002 | AF193: 90.63 | AG193: 90.61 | AH193: 0.69 | AI193: AAA | AJ193: 4.0599999999999997e-002 | AK193: =I193+100*T193 -> 131.44 | AL193: 132.2 | AM193: 130 | AN193: 41.6 | AO193: 149 | AP193: -1.6e-002 | AQ193: 21 | AR193: 淮矿转债!
A194: 149 | B194: 烽火转债 | C194: 110062 | D194: 43824. | E194: 烽火通信 | F194: 600498 | G194: 通信互联 | H194: 通信设备 | I194: 119.31 | J194: 6.8000000000000005e-003 | K194: 8.5000000000000006e-003 | L194: 24.39 | M194: 2.6499999999999999e-002 | N194: 8.1 | O194: 2.e-003 | P194: 111 | Q194: 25.65 | R194: 2.74 | S194: 95.09 | T194: 0.255 | U194: 转股中 | V194: 5年52天 | W194: 3年52天 | X194: 0.10800000000000001 | Y194: 0.10300000000000001 | Z194: 31 | AA194: 285 | AB194: -1.4199999999999999e-002 | AC194: -1.8000000000000002e-002 | AD194: -4.24e-002 | AE194: -4.4299999999999999e-002 | AF194: 90.84 | AG194: 90.82 | AH194: 0.57 | AI194: AAA | AJ194: 4.0599999999999997e-002 | AK194: =I194+100*T194 -> 144.81 | AL194: 143.5 | AM194: 223 | AN194: 52.7 | AO194: 219 | AP194: 3.0000000000000001e-003 | AQ194: 19 | AR194: 烽火转债
A195: 217 | B195: 中天转债! | C195: 110051 | D195: 43546. | E195: 中天科技 | F195: 600522 | G195: 通信互联 | H195: 通信设备 | I195: 121.31 | J195: 1.18e-002 | K195: 1.24e-002 | L195: 10.86 | M195: 3.6299999999999999e-002 | N195: 33 | O195: 6.9999999999999993e-003 | P195: 113.9 | Q195: 10.09 | R195: 1.55 | S195: 107.63 | T195: 0.127 | U195: 转股中 | V195: 4.38年 | W195: 2.38年 | X195: 0.11900000000000001 | Y195: 0.128 | Z195: 40 | AA195: 333 | AB195: -1.46e-002 | AC195: -2.0099999999999996e-002 | AD195: -6.13e-002 | AE195: -6.3600000000000004e-002 | AF195: 93.18 | AG195: 95.42 | AH195: 0.67 | AI195: AA+ | AJ195: 4.2099999999999999e-002 | AK195: =I195+100*T195 -> 134.00999999999999 | AL195: 135 | AM195: 165 | AN195: 39.6 | AO195: 128 | AP195: 9.0000000000000011e-003 | AQ195: 28 | AR195: 中天转债!
A196: 57 | B196: 比音转债 | C196: 128113 | D196: 44027. | E196: 比音勒芬 | F196: 2832 | G196: 服装纺织 | H196: 服装行业 | I196: 127.621 | J196: 1.67e-002 | K196: 3.6000000000000004e-002 | L196: 17.88 | M196: 6.7500000000000004e-002 | N196: 100 | O196: 0.114 | P196: 117.3 | Q196: 14.9 | R196: 4.77 | S196: 120 | T196: 6.4000000000000001e-002 | U196: 2月11天 | V196: 5.68年 | W196: 3.68年 | X196: 7.400000000000001e-002 | Y196: 8.8000000000000009e-002 | Z196: 6.9 | AA196: 94 | AB196: -1.4999999999999999e-002 | AC196: -2.0199999999999999e-002 | AD196: -5.28e-002 | AE196: -5.45e-002 | AF196: 87.6 | AG196: 91.51 | AH196: 0.78 | AI196: AA | AJ196: 4.5599999999999995e-002 | AK196: =I196+100*T196 -> 134.02099999999999 | AL196: 135.2 | AM196: 168 | AN196: 43.7 | AO196: 166 | AP196: 0.114 | AQ196: 5 | AR196: 比音转债
A197: 55 | B197: 晨光转债 | C197: 123055 | D197: 44025. | E197: 晨光生物 | F197: 300138 | G197: 食品饮料 | H197: 食品加工 | I197: 135.4 | J197: 1.9699999999999999e-002 | K197: -6.0999999999999995e-003 | L197: 16.28 | M197: 1.5600000000000001e-002 | N197: 14 | O197: 1.6e-002 | P197: 124.3 | Q197: 12.25 | R197: 4.43 | S197: 132.9 | T197: 1.9e-002 | U197: 2月13天 | V197: 5.68年 | W197: 3.68年 | X197: 7.5999999999999998e-002 | Y197: 0.10000000000000001 | Z197: 6.3 | AA197: 83 | AB197: -1.52e-002 | AC197: -2.2200000000000001e-002 | AD197: -6.6400000000000001e-002 | AE197: -6.8199999999999997e-002 | AF197: 81.55 | AG197: 86.85 | AH197: 0.88 | AI197: AA- | AJ197: 6.6600000000000006e-002 | AK197: =I197+100*T197 -> 137.30000000000001 | AL197: 137.9 | AM197: 182 | AN197: 51 | AO197: 206 | AP197: 7.6999999999999999e-002 | AQ197: 6 | AR197: 晨光转债
A198: 144 | B198: 金牌转债! | C198: 113553 | D198: 43837. | E198: 金牌厨柜 | F198: 603180 | G198: 其他 | H198: 家居用品 | I198: 134.99 | J198: 6.5000000000000006e-003 | K198: 3.2199999999999999e-002 | L198: 58.5 | M198: 4.4600000000000001e-002 | N198: 9.6 | O198: 2.6000000000000002e-002 | P198: 124.6 | Q198: 44.14 | R198: 4.77 | S198: 132.53 | T198: 1.9e-002 | U198: 转股中 | V198: 5.17年 | W198: 3.17年 | X198: 4.9000000000000002e-002 | Y198: 6.5000000000000002e-002 | Z198: 2.8 | AA198: 57 | AB198: -1.5700000000000002e-002 | AC198: -2.3399999999999997e-002 | AD198: -7.5700000000000003e-002 | AE198: -7.7699999999999991e-002 | AF198: 84.17 | AG198: 89.95 | AH198: 0.87 | AI198: AA- | AJ198: 6.6600000000000006e-002 | AK198: =I198+100*T198 -> 136.89000000000001 | AL198: 137.4 | AM198: 179 | AN198: 47.5 | AO198: 188 | AP198: 1.2e-002 | AQ198: 14 | AR198: 金牌转债!
A199: 68 | B199: 楚江转债 | C199: 128109 | D199: 44005. | E199: 楚江新材 | F199: 2171 | G199: 有色金属 | H199: 铜金属 | I199: 125.998 | J199: 9.5999999999999992e-003 | K199: 1.4999999999999999e-002 | L199: 10.21 | M199: 3.2400000000000005e-002 | N199: 14 | O199: 6.0000000000000001e-003 | P199: 115.3 | Q199: 8.73 | R199: 2.54 | S199: 116.95 | T199: 7.6999999999999999e-002 | U199: 2月0天 | V199: 5.65年 | W199: 3.65年 | X199: 0.13400000000000001 | Y199: 0.157 | Z199: 18 | AA199: 136 | AB199: -1.5900000000000001e-002 | AC199: -2.06e-002 | AD199: -5.0000000000000003e-002 | AE199: -5.1699999999999996e-002 | AF199: 87.71 | AG199: 90.08 | AH199: 0.76 | AI199: AA | AJ199: 4.5599999999999995e-002 | AK199: =I199+100*T199 -> 133.69800000000001 | AL199: 135 | AM199: 166 | AN199: 45 | AO199: 182 | AP199: 6.8000000000000005e-002 | AQ199: 5 | AR199: 楚江转债
A200: 208 | B200: 伊力转债! | C200: 110055 | D200: 43559. | E200: 伊力特 | F200: 600197 | G200: 食品饮料 | H200: 白酒 | I200: 123.81 | J200: -5.5000000000000005e-003 | K200: 4.7999999999999996e-003 | L200: 18.38 | M200: -1.1000000000000001e-003 | N200: 10 | O200: 1.e-002 | P200: 115 | Q200: 16.81 | R200: 3.06 | S200: 109.34 | T200: 0.13200000000000001 | U200: 转股中 | V200: 4.43年 | W200: 2.43年 | X200: 0.109 | Y200: 0.11900000000000001 | Z200: 8.7 | AA200: 80 | AB200: -1.6899999999999998e-002 | AC200: -2.2799999999999997e-002 | AD200: -6.7500000000000004e-002 | AE200: -6.9800000000000001e-002 | AF200: 92.67 | AG200: 95.4 | AH200: 0.68 | AI200: AA | AJ200: 4.41e-002 | AK200: =I200+100*T200 -> 137.00999999999999 | AL200: 138.3 | AM200: 185 | AN200: 42.9 | AO200: 159 | AP200: -5.0999999999999997e-002 | AQ200: 24 | AR200: 伊力转债!
A201: 154 | B201: 川投转债 | C201: 110061 | D201: 43801. | E201: 川投能源 | F201: 600674 | G201: 能源电力 | H201: 水电 | I201: 121.54 | J201: 4.1999999999999997e-003 | K201: -2.8999999999999998e-003 | L201: 9.83 | M201: 2.e-003 | N201: 2.4 | O201: 1.e-003 | P201: 111 | Q201: 9.58 | R201: 1.65 | S201: 102.61 | T201: 0.184 | U201: 转股中 | V201: 5年31天 | W201: 3年31天 | X201: 9.1999999999999998e-002 | Y201: 9.5000000000000001e-002 | Z201: 40 | AA201: 433 | AB201: -1.8000000000000002e-002 | AC201: -2.1899999999999999e-002 | AD201: -4.8600000000000004e-002 | AE201: -5.0499999999999996e-002 | AF201: 91.05 | AG201: 91.02 | AH201: 0.65 | AI201: AAA | AJ201: 4.0599999999999997e-002 | AK201: =I201+100*T201 -> 139.94 | AL201: 140.5 | AM201: 203 | AN201: 49.4 | AO201: 198 | AP201: -1.4999999999999999e-002 | AQ201: 15 | AR201: 川投转债
A202: 153 | B202: 利德转债! | C202: 123035 | D202: 43808. | E202: 利亚德 | F202: 300296 | G202: 电子 | H202: LED制 | I202: 126.63 | J202: 2.53e-002 | K202: -5.6999999999999993e-003 | L202: 7.9 | M202: 2.7300000000000001e-002 | N202: 14 | O202: 1.3999999999999999e-002 | P202: 115.6 | Q202: 6.98 | R202: 2.37 | S202: 113.18 | T202: 0.11900000000000001 | U202: 转股中 | V202: 5年34天 | W202: 3年34天 | X202: 4.0000000000000001e-002 | Y202: 4.4999999999999998e-002 | Z202: 8 | AA202: 201 | AB202: -1.8100000000000002e-002 | AC202: -2.3399999999999997e-002 | AD202: -5.91e-002 | AE202: -6.1200000000000004e-002 | AF202: 90.76 | AG202: 93.5 | AH202: 0.72 | AI202: AA+ | AJ202: 4.36e-002 | AK202: =I202+100*T202 -> 138.53 | AL202: 140.1 | AM202: 199 | AN202: 46.6 | AO202: 186 | AP202: -4.4999999999999998e-002 | AQ202: 16 | AR202: 利德转债!
A203: 70 | B203: 万青转债 | C203: 127017 | D203: 44014. | E203: 万年青 | F203: 789 | G203: 建筑 | H203: 水泥 | I203: 131.115 | J203: 3.9000000000000003e-003 | K203: 7.0999999999999995e-003 | L203: 15.47 | M203: 1.6399999999999998e-002 | N203: 4 | O203: 3.0000000000000001e-003 | P203: 118.4 | Q203: 14.16 | R203: 2.37 | S203: 109.25 | T203: 0.20000000000000001 | U203: 59天 | V203: 5.64年 | W203: 3.64年 | X203: 8.1000000000000003e-002 | Y203: 8.900000000000001e-002 | Z203: 10 | AA203: 123 | AB203: -1.8200000000000001e-002 | AC203: -2.3700000000000002e-002 | AD203: -6.0100000000000001e-002 | AE203: -6.1799999999999994e-002 | AF203: 88.3 | AG203: 93.48 | AH203: 0.67 | AI203: AA+ | AJ203: 4.36e-002 | AK203: =I203+100*T203 -> 151.11500000000001 | AL203: 153 | AM203: 257 | AN203: 59.5 | AO203: 249 | AP203: -3.7000000000000005e-002 | AQ203: 6 | AR203: 万青转债
A204: 30 | B204: 苏试转债 | C204: 123060 | D204: 44060. | E204: 苏试试验 | F204: 300416 | G204: 机械装备 | H204: 专用设备 | I204: 130.48 | J204: 1.7899999999999999e-002 | K204: 3.9000000000000003e-003 | L204: 26.43 | M204: 2.76e-002 | N204: 12 | O204: 2.8999999999999998e-002 | P204: 117.6 | Q204: 23.86 | R204: 6.09 | S204: 110.77 | T204: 0.17800000000000002 | U204: 3月18天 | V204: 5.78年 | W204: 3.78年 | X204: 5.7999999999999996e-002 | Y204: 6.4000000000000001e-002 | Z204: 3.1 | AA204: 54 | AB204: -1.8200000000000001e-002 | AC204: -2.3300000000000001e-002 | AD204: -5.6600000000000004e-002 | AE204: -5.8299999999999998e-002 | AF204: 80.82 | AG204: 81.65 | AH204: 0.79 | AI204: AA- | AJ204: 6.6600000000000006e-002 | AK204: =I204+100*T204 -> 148.28 | AL204: 150.2 | AM204: 250 | AN204: 68.5 | AO204: 263 | AP204: -2.e-003 | AQ204: 4 | AR204: 苏试转债
A205: 138 | B205: 至纯转债! | C205: 113556 | D205: 43839. | E205: 至纯科技 | F205: 603690 | G205: 机械装备 | H205: 专用设备 | I205: 139.51 | J205: 1.4499999999999999e-002 | K205: 3.4999999999999996e-003 | L205: 37 | M205: 2.1000000000000001e-002 | N205: 31 | O205: 7.4999999999999997e-002 | P205: 126.8 | Q205: 29.37 | R205: 6.78 | S205: 125.98 | T205: 0.107 | U205: 转股中 | V205: 5.19年 | W205: 3.19年 | X205: 3.1e-002 | Y205: 3.9e-002 | Z205: 3 | AA205: 96 | AB205: -1.8600000000000002e-002 | AC205: -2.6800000000000001e-002 | AD205: -8.2799999999999999e-002 | AE205: -8.5099999999999995e-002 | AF205: 81.76 | AG205: 86.85 | AH205: 0.86 | AI205: A+ | AJ205: 7.7600000000000002e-002 | AK205: =I205+100*T205 -> 150.20999999999998 | AL205: 153 | AM205: 258 | AN205: 66.2 | AO205: 260 | AP205: -1.7000000000000001e-002 | AQ205: 12 | AR205: 至纯转债!
A206: 201 | B206: 精测转债!! | C206: 123025 | D206: 43574. | E206: 精测电子 | F206: 300567 | G206: 电子 | H206: 液晶显示 | I206: 127.397 | J206: 2.69e-002 | K206: -6.5000000000000006e-003 | L206: 53.07 | M206: 2.8500000000000001e-002 | N206: 9.2 | O206: 2.4e-002 | P206: 117.3 | Q206: 49.95 | R206: 9.18 | S206: 106.25 | T206: 0.19899999999999998 | U206: 转股中 | V206: 4.46年 | W206: 2.46年 | X206: 2.4e-002 | Y206: 2.5000000000000001e-002 | Z206: 3.1 | AA206: 131 | AB206: -1.8700000000000001e-002 | AC206: -2.53e-002 | AD206: -7.6299999999999993e-002 | AE206: -7.8600000000000003e-002 | AF206: 87.97 | AG206: 89.09 | AH206: 0.72 | AI206: AA- | AJ206: 6.5099999999999991e-002 | AK206: =I206+100*T206 -> 147.297 | AL206: 148.5 | AM206: 245 | AN206: 59.5 | AO206: 248 | AP206: -2.5000000000000001e-002 | AQ206: 17 | AR206: 精测转债!!
A207: 277 | B207: 众信转债! | C207: 128022 | D207: 43097. | E207: 众信旅游 | F207: 2707 | G207: 旅游餐饮 | H207: 旅游 | I207: 116.4 | J207: -5.1000000000000004e-003 | K207: -4.4299999999999999e-002 | L207: 8.4 | M207: -7.5899999999999995e-002 | N207: 60 | O207: 0.114 | P207: 109.8 | Q207: 7.91 | R207: 3.72 | S207: 106.19 | T207: 9.6000000000000002e-002 | U207: 转股中 | V207: 3年51天 | W207: 1年51天 | X207: 5.9999999999999998e-002 | Y207: 6.3e-002 | Z207: 4.6 | AA207: 76 | AB207: -1.8799999999999997e-002 | AC207: -2.4399999999999998e-002 | AD207: -9.3299999999999994e-002 | AE207: -9.6600000000000005e-002 | AF207: 96.98 | AG207: 96.17 | AH207: 0.65 | AI207: AA | AJ207: 4.41e-002 | AK207: =I207+100*T207 -> 126. | AL207: 126.6 | AM207: 84 | AN207: 29.6 | AO207: 28 | AP207: -0.105 | AQ207: 24 | AR207: 众信转债!
A208: 133 | B208: 联得转债! | C208: 123038 | D208: 43852. | E208: 联得装备 | F208: 300545 | G208: 机械装备 | H208: 专用设备 | I208: 131.19 | J208: 2.2200000000000001e-002 | K208: 2.7000000000000001e-003 | L208: 31.89 | M208: 2.8399999999999998e-002 | N208: 5.9 | O208: 2.9999999999999999e-002 | P208: 119.1 | Q208: 25.29 | R208: 6.55 | S208: 126.1 | T208: 4.0000000000000001e-002 | U208: 转股中 | V208: 5.21年 | W208: 3.21年 | X208: 3.2000000000000001e-002 | Y208: 4.0000000000000001e-002 | Z208: 1.5 | AA208: 47 | AB208: -1.8799999999999997e-002 | AC208: -2.5000000000000001e-002 | AD208: -6.6400000000000001e-002 | AE208: -6.8600000000000008e-002 | AF208: 81.4 | AG208: 81.5 | AH208: 0.88 | AI208: A+ | AJ208: 7.7600000000000002e-002 | AK208: =I208+100*T208 -> 135.19 | AL208: 136.3 | AM208: 173 | AN208: 54.8 | AO208: 226 | AP208: -2.1000000000000001e-002 | AQ208: 14 | AR208: 联得转债!
A209: 122 | B209: 奥瑞转债! | C209: 128096 | D209: 43906. | E209: 奥瑞金 | F209: 2701 | G209: 造纸包装 | H209: 包装材料 | I209: 128.139 | J209: 3.0800000000000001e-002 | K209: 2.4300000000000002e-002 | L209: 5.81 | M209: 6.8000000000000005e-002 | N209: 15 | O209: 1.1000000000000001e-002 | P209: 116 | Q209: 4.64 | R209: 2.37 | S209: 125.22 | T209: 2.3e-002 | U209: 转股中 | V209: 5.34年 | W209: 3.34年 | X209: 7.9000000000000001e-002 | Y209: 9.9000000000000005e-002 | Z209: 11 | AA209: 137 | AB209: -1.89e-002 | AC209: -2.4e-002 | AD209: -5.7699999999999994e-002 | AE209: -5.9800000000000006e-002 | AF209: 90.03 | AG209: 92.87 | AH209: 0.81 | AI209: AA+ | AJ209: 4.36e-002 | AK209: =I209+100*T209 -> 130.43900000000002 | AL209: 131.1 | AM209: 122 | AN209: 38.2 | AO209: 111 | AP209: 2.9999999999999999e-002 | AQ209: 22 | AR209: 奥瑞转债!
A210: 15 | B210: 赣锋转2 | C210: 128126 | D210: 44082. | E210: 赣锋锂业 | F210: 2460 | G210: 有色金属 | H210: 小金属 | I210: 124.15 | J210: 3.2000000000000001e-002 | K210: -5.6999999999999993e-003 | L210: 56.66 | M210: 4.5599999999999995e-002 | N210: 86 | O210: 3.3000000000000002e-002 | P210: 111.1 | Q210: 61.15 | R210: 9.11 | S210: 92.66 | T210: 0.34000000000000002 | U210: 4月4天 | V210: 5.82年 | W210: 3.82年 | X210: 2.7999999999999997e-002 | Y210: 2.6000000000000002e-002 | Z210: 21 | AA210: 755 | AB210: -1.9199999999999998e-002 | AC210: -2.2499999999999999e-002 | AD210: -4.6399999999999997e-002 | AE210: -4.7699999999999992e-002 | AF210: 86.21 | AG210: 86.04 | AH210: 0.58 | AI210: AA | AJ210: 4.5599999999999995e-002 | AK210: =I210+100*T210 -> 158.15000000000001 | AL210: 155.6 | AM210: 264 | AN210: 69.4 | AO210: 265 | AP210: 9.6999999999999989e-002 | AQ210: 6 | AR210: 赣锋转2
A211: 56 | B211: 正邦转债 | C211: 128114 | D211: 44027. | E211: 正邦科技 | F211: 2157 | G211: 农业 | H211: 畜牧业 | I211: 128.599 | J211: 1.6000000000000001e-003 | K211: 2.e-003 | L211: 18.27 | M211: 5.0000000000000001e-003 | N211: 27 | O211: 1.3000000000000001e-002 | P211: 115.3 | Q211: 16.08 | R211: 3.88 | S211: 113.62 | T211: 0.13200000000000001 | U211: 2月13天 | V211: 5.68年 | W211: 3.68年 | X211: 3.5000000000000003e-002 | Y211: 3.9e-002 | Z211: 16 | AA211: 460 | AB211: -1.9400000000000001e-002 | AC211: -2.4e-002 | AD211: -5.4600000000000003e-002 | AE211: -5.6299999999999996e-002 | AF211: 88.22 | AG211: 90.9 | AH211: 0.73 | AI211: AA+ | AJ211: 4.36e-002 | AK211: =I211+100*T211 -> 141.79899999999998 | AL211: 143.6 | AM211: 224 | AN211: 52.7 | AO211: 218 | AP211: -6.5000000000000002e-002 | AQ211: 8 | AR211: 正邦转债
A212: 107 | B212: 华安转债! | C212: 110067 | D212: 43930. | E212: 华安证券 | F212: 600909 | G212: 金融 | H212: 证券行业 | I212: 123.27 | J212: -3.0999999999999999e-003 | K212: 8.8999999999999999e-003 | L212: 8.85 | M212: 9.1000000000000004e-003 | N212: 18 | O212: 5.0000000000000001e-003 | P212: 110.5 | Q212: 8.67 | R212: 2.37 | S212: 102.08 | T212: 0.20800000000000002 | U212: 转股中 | V212: 5.42年 | W212: 无权 | X212: 8.6999999999999994e-002 | Y212: 8.900000000000001e-002 | Z212: 28 | AA212: 320 | AB212: -2.0199999999999999e-002 | AC212: -2.3700000000000002e-002 | AD212: 无权 | AE212: 无权 | AF212: 无权 | AG212: 89.32 | AH212: 0.63 | AI212: AAA | AJ212: 4.0599999999999997e-002 | AK212: =I212+100*T212 -> 144.06999999999999 | AL212: 144.5 | AM212: 229 | AN212: 55.1 | AO212: 228 | AP212: 3.6000000000000004e-002 | AQ212: 26 | AR212: 华安转债!
A213: 87 | B213: 起步转债! | C213: 113576 | D213: 43958. | E213: 起步股份 | F213: 603557 | G213: 服装纺织 | H213: 鞋服行业 | I213: 135.94 | J213: 0.114 | K213: -2.4500000000000001e-002 | L213: 14.88 | M213: 9.98e-002 | N213: 1729. | O213: 2.54 | P213: 121.8 | Q213: 10.55 | R213: 4.54 | S213: 141.04 | T213: -3.6000000000000004e-002 | U213: 5.1天 | V213: 5.50年 | W213: 3.50年 | X213: 7.400000000000001e-002 | Y213: 0.10400000000000001 | Z213: 5.2 | AA213: 70 | AB213: -2.0199999999999999e-002 | AC213: -2.6699999999999998e-002 | AD213: -6.9500000000000006e-002 | AE213: -7.17e-002 | AF213: 82.95 | AG213: 86.21 | AH213: 0.89 | AI213: AA- | AJ213: 6.6600000000000006e-002 | AK213: =I213+100*T213 -> 132.34 | AL213: 130.8 | AM213: 119 | AN213: 44.6 | AO213: 177 | AP213: 0.217 | AQ213: 30 | AR213: 起步转债!
A214: 58 | B214: 泛微转债 | C214: 113587 | D214: 44026. | E214: 泛微网络 | F214: 603039 | G214: 计算机及 | H214: 软件开发 | I214: 140.2 | J214: 8.6e-003 | K214: -1.3600000000000001e-002 | L214: 88.98 | M214: -5.6000000000000008e-003 | N214: 8.3 | O214: 1.9e-002 | P214: 124.3 | Q214: 64.33 | R214: 20.2 | S214: 138.32 | T214: 1.3999999999999999e-002 | U214: 2月11天 | V214: 5.68年 | W214: 3.68年 | X214: 1.7000000000000001e-002 | Y214: 2.3e-002 | Z214: 3.2 | AA214: 189 | AB214: -2.1400000000000002e-002 | AC214: -2.8300000000000002e-002 | AD214: -7.4999999999999997e-002 | AE214: -7.6799999999999993e-002 | AF214: 81.58 | AG214: 86.89 | AH214: 0.88 | AI214: AA- | AJ214: 6.6600000000000006e-002 | AK214: =I214+100*T214 -> 141.59999999999999 | AL214: 142.1 | AM214: 217 | AN214: 55.2 | AO214: 230 | AP214: -5.7000000000000002e-002 | AQ214: 4 | AR214: 泛微转债
A215: 280 | B215: 济川转债! | C215: 110038 | D215: 43068. | E215: 济川药业 | F215: 600566 | G215: 医药 | H215: 中药 | I215: 113.26 | J215: 6.8000000000000005e-003 | K215: 5.6000000000000008e-003 | L215: 22.81 | M215: 2.98e-002 | N215: 6.6 | O215: 9.0000000000000011e-003 | P215: 108.3 | Q215: 24.27 | R215: 3.27 | S215: 93.98 | T215: 0.20499999999999999 | U215: 转股中 | V215: 2年33天 | W215: 33天 | X215: 3.4000000000000002e-002 | Y215: 3.2000000000000001e-002 | Z215: 6.3 | AA215: 186 | AB215: -2.1499999999999998e-002 | AC215: -2.87e-002 | AD215: -0.45500000000000002 | AE215: -0.46200000000000002 | AF215: 99.97 | AG215: 99.32 | AH215: 0.41 | AI215: AA | AJ215: 4.2900000000000001e-002 | AK215: =I215+100*T215 -> 133.75999999999999 | AL215: 132.5 | AM215: 139 | AN215: 32.6 | AO215: 56 | AP215: -1.8000000000000002e-002 | AQ215: 19 | AR215: 济川转债!
A216: 174 | B216: 合兴转债! | C216: 128071 | D216: 43724. | E216: 合兴包装 | F216: 2228 | G216: 造纸包装 | H216: 包装材料 | I216: 127.5 | J216: 3.9000000000000003e-003 | K216: 2.6600000000000002e-002 | L216: 5.2 | M216: 4.0000000000000001e-002 | N216: 9.9 | O216: 2.5000000000000001e-002 | P216: 114.8 | Q216: 4.28 | R216: 2.05 | S216: 121.5 | T216: 4.9000000000000002e-002 | U216: 转股中 | V216: 4.85年 | W216: 2.85年 | X216: 4.9000000000000002e-002 | Y216: 5.9999999999999998e-002 | Z216: 3 | AA216: 61 | AB216: -2.18e-002 | AC216: -2.7000000000000003e-002 | AD216: -6.8000000000000005e-002 | AE216: -6.9900000000000004e-002 | AF216: 90.8 | AG216: 93.48 | AH216: 0.76 | AI216: AA | AJ216: 4.41e-002 | AK216: =I216+100*T216 -> 132.40000000000001 | AL216: 133.5 | AM216: 152 | AN216: 40 | AO216: 135 | AP216: -6.4000000000000001e-002 | AQ216: 26 | AR216: 合兴转债!
A217: 76 | B217: 健友转债 | C217: 113579 | D217: 43973. | E217: 健友股份 | F217: 603707 | G217: 医药 | H217: 原料药 | I217: 128.85 | J217: -4.0000000000000002e-004 | K217: -1.55e-002 | L217: 43.76 | M217: -2.3399999999999997e-002 | N217: 2 | O217: 3.0000000000000001e-003 | P217: 114.2 | Q217: 42.05 | R217: 9.75 | S217: 104.07 | T217: 0.23800000000000002 | U217: 19天 | V217: 5.53年 | W217: 3.53年 | X217: 1.2e-002 | Y217: 1.3000000000000001e-002 | Z217: 5 | AA217: 409 | AB217: -2.2000000000000002e-002 | AC217: -2.64e-002 | AD217: -5.7500000000000002e-002 | AE217: -5.9200000000000003e-002 | AF217: 88.07 | AG217: 89.66 | AH217: 0.68 | AI217: AA | AJ217: 4.5599999999999995e-002 | AK217: =I217+100*T217 -> 152.65000000000001 | AL217: 153.6 | AM217: 259 | AN217: 64 | AO217: 259 | AP217: -1.3000000000000001e-002 | AQ217: 6 | AR217: 健友转债
A218: 113 | B218: 康弘转债! | C218: 128098 | D218: 43921. | E218: 康弘药业 | F218: 2773 | G218: 医药 | H218: 化学制药 | I218: 130.89 | J218: 1.8799999999999997e-002 | K218: -2.0999999999999999e-003 | L218: 46.48 | M218: 1.9699999999999999e-002 | N218: 101 | O218: 5.0999999999999997e-002 | P218: 116.3 | Q218: 35.3 | R218: 8.62 | S218: 131.67 | T218: -6.0000000000000001e-003 | U218: 转股中 | V218: 5.40年 | W218: 3.40年 | X218: 3.7000000000000005e-002 | Y218: 4.9000000000000002e-002 | Z218: 15 | AA218: 407 | AB218: -2.2099999999999998e-002 | AC218: -2.7200000000000002e-002 | AD218: -6.3600000000000004e-002 | AE218: -6.54e-002 | AF218: 88.69 | AG218: 91.87 | AH218: 0.85 | AI218: AA | AJ218: 4.5599999999999995e-002 | AK218: =I218+100*T218 -> 130.28999999999999 | AL218: 130.1 | AM218: 113 | AN218: 38.2 | AO218: 112 | AP218: -1.3000000000000001e-002 | AQ218: 23 | AR218: 康弘转债!
A219: 237 | B219: 利尔转债! | C219: 128046 | D219: 43413. | E219: 利尔化学 | F219: 2258 | G219: 化工 | H219: 农化 | I219: 123.3 | J219: 4.0999999999999995e-003 | K219: 1.6399999999999998e-002 | L219: 19.97 | M219: 3.04e-002 | N219: 16 | O219: 1.4999999999999999e-002 | P219: 112.9 | Q219: 18.62 | R219: 3.07 | S219: 107.25 | T219: 0.14999999999999999 | U219: 转股中 | V219: 4年6.1天 | W219: 2年6.1天 | X219: 8.1000000000000003e-002 | Y219: 8.6999999999999994e-002 | Z219: 8.5 | AA219: 105 | AB219: -2.2200000000000001e-002 | AC219: -2.7799999999999998e-002 | AD219: -7.8299999999999995e-002 | AE219: -8.09e-002 | AF219: 94.21 | AG219: 95.31 | AH219: 0.67 | AI219: AA | AJ219: 4.41e-002 | AK219: =I219+100*T219 -> 138.30000000000001 | AL219: 139.3 | AM219: 194 | AN219: 44 | AO219: 170 | AP219: -6.8000000000000005e-002 | AQ219: 10 | AR219: 利尔转债!
A220: 63 | B220: 寿仙转债 | C220: 113585 | D220: 44019. | E220: 寿仙谷 | F220: 603896 | G220: 医药 | H220: 中药 | I220: 134.01 | J220: 1.4499999999999999e-002 | K220: -2.6099999999999998e-002 | L220: 40.68 | M220: -1.26e-002 | N220: 21 | O220: 4.2999999999999997e-002 | P220: 117.8 | Q220: 28.68 | R220: 4.98 | S220: 141.84 | T220: -5.5e-002 | U220: 2月5天 | V220: 5.66年 | W220: 3.66年 | X220: 6.2e-002 | Y220: 8.6999999999999994e-002 | Z220: 3.6 | AA220: 58 | AB220: -2.3e-002 | AC220: -2.8199999999999999e-002 | AD220: -6.4399999999999999e-002 | AE220: -6.6299999999999998e-002 | AF220: 81.6 | AG220: 82.44 | AH220: 0.92 | AI220: AA- | AJ220: 6.6600000000000006e-002 | AK220: =I220+100*T220 -> 128.50999999999999 | AL220: 126.2 | AM220: 79 | AN220: 43.7 | AO220: 167 | AP220: 1.4999999999999999e-002 | AQ220: 9 | AR220: 寿仙转债
A221: 89 | B221: 长集转债 | C221: 128105 | D221: 43964. | E221: 长青集团 | F221: 2616 | G221: 城市公用 | H221: 三废处理 | I221: 131.03 | J221: 0. | K221: -8.0000000000000004e-004 | L221: 10.39 | M221: -1.e-003 | N221: 3.1 | O221: 3.0000000000000001e-003 | P221: 115.3 | Q221: 8.11 | R221: 3.2 | S221: 128.11 | T221: 2.3e-002 | U221: 4.1天 | V221: 5.49年 | W221: 3.49年 | X221: 0.10400000000000001 | Y221: 0.13300000000000001 | Z221: 8 | AA221: 77 | AB221: -2.3399999999999997e-002 | AC221: -2.8199999999999999e-002 | AD221: -6.2199999999999998e-002 | AE221: -6.4000000000000001e-002 | AF221: 88.32 | AG221: 90.69 | AH221: 0.83 | AI221: AA | AJ221: 4.5599999999999995e-002 | AK221: =I221+100*T221 -> 133.33000000000001 | AL221: 133.9 | AM221: 156 | AN221: 43.3 | AO221: 160 | AP221: -2.9999999999999999e-002 | AQ221: 5 | AR221: 长集转债
A222: 168 | B222: 远东转债! | C222: 128075 | D222: 43769. | E222: 远东传动 | F222: 2406 | G222: 汽车 | H222: 零部件制 | I222: 129.5 | J222: 0. | K222: 1.0500000000000001e-002 | L222: 6.99 | M222: 1.3000000000000001e-002 | N222: 14 | O222: 1.4999999999999999e-002 | P222: 114.9 | Q222: 5.54 | R222: 1.45 | S222: 126.17 | T222: 2.6000000000000002e-002 | U222: 转股中 | V222: 4.95年 | W222: 2.95年 | X222: 0.17600000000000002 | Y222: 0.222 | Z222: 7.3 | AA222: 41 | AB222: -2.4300000000000002e-002 | AC222: -2.9399999999999999e-002 | AD222: -7.0199999999999999e-002 | AE222: -7.2099999999999997e-002 | AF222: 90.49 | AG222: 93.16 | AH222: 0.81 | AI222: AA | AJ222: 4.41e-002 | AK222: =I222+100*T222 -> 132.09999999999999 | AL222: 132.8 | AM222: 143 | AN222: 39.7 | AO222: 129 | AP222: 2.e-002 | AQ222: 15 | AR222: 远东转债!
A223: 106 | B223: 红相转债 | C223: 123044 | D223: 43934. | E223: 红相股份 | F223: 300427 | G223: 能源电力 | H223: 电力设备 | I223: 143.618 | J223: 1.34e-002 | K223: -1.04e-002 | L223: 26.64 | M223: 3.4000000000000002e-003 | N223: 77 | O223: 9.3000000000000013e-002 | P223: 125.5 | Q223: 18.8 | R223: 4.33 | S223: 141.7 | T223: 1.3999999999999999e-002 | U223: 转股中 | V223: 5.42年 | W223: 3.42年 | X223: 6.0999999999999999e-002 | Y223: 8.5999999999999993e-002 | Z223: 5.8 | AA223: 96 | AB223: -2.52e-002 | AC223: -3.2599999999999997e-002 | AD223: -8.4700000000000011e-002 | AE223: -8.6899999999999991e-002 | AF223: 83.61 | AG223: 89.31 | AH223: 0.88 | AI223: AA- | AJ223: 6.6600000000000006e-002 | AK223: =I223+100*T223 -> 145.018 | AL223: 145.5 | AM223: 231 | AN223: 56.2 | AO223: 233 | AP223: -1.e-002 | AQ223: 15 | AR223: 红相转债
A224: 163 | B224: 太极转债! | C224: 128078 | D224: 43777. | E224: 太极股份 | F224: 2368 | G224: 计算机及 | H224: 软件开发 | I224: 133.2 | J224: 2.46e-002 | K224: 1.0700000000000001e-002 | L224: 29.34 | M224: 3.5299999999999998e-002 | N224: 3.4 | O224: 3.0000000000000001e-003 | P224: 117.3 | Q224: 22.4 | R224: 3.93 | S224: 130.98 | T224: 1.7000000000000001e-002 | U224: 转股中 | V224: 5年10天 | W224: 3年10天 | X224: 5.5999999999999994e-002 | Y224: 7.400000000000001e-002 | Z224: 9.6 | AA224: 170 | AB224: -2.5499999999999998e-002 | AC224: -3.1200000000000002e-002 | AD224: -7.5899999999999995e-002 | AE224: -7.7899999999999997e-002 | AF224: 90.18 | AG224: 94.2 | AH224: 1 | AI224: AA | AJ224: 4.5599999999999995e-002 | AK224: =I224+100*T224 -> 134.89999999999998 | AL224: 135.4 | AM224: 169 | AN224: 41.2 | AO224: 146 | AP224: 2.7000000000000003e-002 | AQ224: 12 | AR224: 太极转债!
A225: 52 | B225: 雪榕转债 | C225: 123056 | D225: 44036. | E225: 雪榕生物 | F225: 300511 | G225: 农业 | H225: 种植业 | I225: 140.2 | J225: 5.0300000000000004e-002 | K225: 1.41e-002 | L225: 17.26 | M225: 7.0099999999999996e-002 | N225: 69 | O225: 8.4000000000000005e-002 | P225: 121.1 | Q225: 11.89 | R225: 4.12 | S225: 145.16 | T225: -3.4000000000000002e-002 | U225: 2月25天 | V225: 5.70年 | W225: 3.70年 | X225: 7.6999999999999999e-002 | Y225: 0.111 | Z225: 5.9 | AA225: 76 | AB225: -2.58e-002 | AC225: -3.1899999999999998e-002 | AD225: -7.4900000000000008e-002 | AE225: -7.6600000000000001e-002 | AF225: 81.27 | AG225: 84.49 | AH225: 0.92 | AI225: AA- | AJ225: 6.6600000000000006e-002 | AK225: =I225+100*T225 -> 136.79999999999998 | AL225: 135.2 | AM225: 167 | AN225: 50.8 | AO225: 202 | AP225: 7.0999999999999994e-002 | AQ225: 9 | AR225: 雪榕转债
A226: 90 | B226: 东时转债 | C226: 113575 | D226: 43951. | E226: 东方时尚 | F226: 603377 | G226: 其他 | H226: 其他 | I226: 132.31 | J226: -6.3e-003 | K226: -8.6e-003 | L226: 20.63 | M226: -1.67e-002 | N226: 39 | O226: 6.8000000000000005e-002 | P226: 113.5 | Q226: 14.56 | R226: 6.69 | S226: 141.69 | T226: -6.6000000000000003e-002 | U226: 4.1天 | V226: 5.49年 | W226: 3.49年 | X226: 3.5000000000000003e-002 | Y226: 5.0000000000000003e-002 | Z226: 4.3 | AA226: 121 | AB226: -2.7999999999999997e-002 | AC226: -3.2300000000000002e-002 | AD226: -6.4600000000000005e-002 | AE226: -6.6400000000000001e-002 | AF226: 88.34 | AG226: 89.29 | AH226: 0.9 | AI226: AA | AJ226: 4.5599999999999995e-002 | AK226: =I226+100*T226 -> 125.71000000000001 | AL226: 122.9 | AM226: 48 | AN226: 33.6 | AO226: 62 | AP226: -7.5999999999999998e-002 | AQ226: 16 | AR226: 东时转债
A227: 299 | B227: 航信转债!! | C227: 110031 | D227: 42185. | E227: 航天信息 | F227: 600271 | G227: 计算机及 | H227: 软件开发 | I227: 109.16 | J227: 4.0000000000000001e-003 | K227: -3.9000000000000003e-003 | L227: 16.04 | M227: 1.7100000000000001e-002 | N227: 1.3 | O227: 0. | P227: 107 | Q227: 21.56 | R227: 2.67 | S227: 74.4 | T227: 0.46700000000000003 | U227: 转股中 | V227: 0.67年 | W227: 回售中 | X227: 8.1000000000000003e-002 | Y227: 5.9999999999999998e-002 | Z227: 24 | AA227: 298 | AB227: -2.9399999999999999e-002 | AC227: -4.8399999999999999e-002 | AD227: 回售中 | AE227: 回售中 | AF227: 100.27 | AG227: 104.57 | AH227: 0.01 | AI227: AAA | AJ227: 3.5000000000000003e-002 | AK227: =I227+100*T227 -> 155.86000000000001 | AL227: 143.9 | AM227: 225 | AN227: 39.4 | AO227: 125 | AP227: -2.7000000000000003e-002 | AQ227: 14 | AR227: 航信转债!!
A228: 81 | B228: 春秋转债 | C228: 113577 | D228: 43964. | E228: 春秋电子 | F228: 603890 | G228: 电子 | H228: 电子产品 | I228: 139.02 | J228: 3.7499999999999999e-002 | K228: -9.7000000000000003e-003 | L228: 15.63 | M228: 3.1e-002 | N228: 14 | O228: 4.2000000000000003e-002 | P228: 118.2 | Q228: 11.06 | R228: 3.7 | S228: 141.32 | T228: -1.6e-002 | U228: 9天 | V228: 5.51年 | W228: 3.51年 | X228: 4.0000000000000001e-002 | Y228: 5.5999999999999994e-002 | Z228: 2.4 | AA228: 60 | AB228: -2.9600000000000001e-002 | AC228: -3.5099999999999999e-002 | AD228: -7.6399999999999996e-002 | AE228: -7.8299999999999995e-002 | AF228: 82.39 | AG228: 83.55 | AH228: 0.9 | AI228: AA- | AJ228: 6.6600000000000006e-002 | AK228: =I228+100*T228 -> 137.42000000000002 | AL228: 136.7 | AM228: 175 | AN228: 53.2 | AO228: 222 | AP228: 4.7e-002 | AQ228: 8 | AR228: 春秋转债
A229: 130 | B229: 新天转债 | C229: 128091 | D229: 43847. | E229: 新天药业 | F229: 2873 | G229: 医药 | H229: 中药 | I229: 140.3 | J229: 1.6899999999999998e-002 | K229: 1.24e-002 | L229: 18.05 | M229: 3.6200000000000003e-002 | N229: 43 | O229: 0.17399999999999999 | P229: 120 | Q229: 16.39 | R229: 2.9 | S229: 110.13 | T229: 0.27399999999999997 | U229: 转股中 | V229: 5.22年 | W229: 3.22年 | X229: 8.3000000000000004e-002 | Y229: 9.1999999999999998e-002 | Z229: 1.8 | AA229: 21 | AB229: -3.0200000000000001e-002 | AC229: -3.6499999999999998e-002 | AD229: -8.3000000000000004e-002 | AE229: -8.539999999999999e-002 | AF229: 81.94 | AG229: 82.16 | AH229: 0.81 | AI229: A+ | AJ229: 7.7600000000000002e-002 | AK229: =I229+100*T229 -> 167.70000000000002 | AL229: 170.5 | AM229: 275 | AN229: 88.3 | AO229: 279 | AP229: -1.e-002 | AQ229: 16 | AR229: 新天转债
A230: 96 | B230: 同德转债 | C230: 128103 | D230: 43942. | E230: 同德化工 | F230: 2360 | G230: 化工 | H230: 化工 | I230: 143.46 | J230: 2.4799999999999999e-002 | K230: 2.7300000000000001e-002 | L230: 6.26 | M230: 6.0999999999999999e-002 | N230: 376 | O230: 1.8100000000000001 | P230: 121.8 | Q230: 5.18 | R230: 2.13 | S230: 120.85 | T230: 0.187 | U230: 转股中 | V230: 5.46年 | W230: 3.46年 | X230: 5.9000000000000004e-002 | Y230: 7.0999999999999994e-002 | Z230: 1.4 | AA230: 25 | AB230: -3.0200000000000001e-002 | AC230: -3.6600000000000001e-002 | AD230: -8.4100000000000008e-002 | AE230: -8.6199999999999999e-002 | AF230: 80.15 | AG230: 81.84 | AH230: 0.85 | AI230: A+ | AJ230: 7.7600000000000002e-002 | AK230: =I230+100*T230 -> 162.16 | AL230: 166.1 | AM230: 273 | AN230: 84.2 | AO230: 277 | AP230: -5.0999999999999997e-002 | AQ230: 10 | AR230: 同德转债
A231: 231 | B231: 桐昆转债! | C231: 113020 | D231: 43446. | E231: 桐昆股份 | F231: 601233 | G231: 服装纺织 | H231: 纺织行业 | I231: 127.8 | J231: -2.9999999999999997e-004 | K231: 2.2000000000000002e-002 | L231: 14.23 | M231: 2.8900000000000002e-002 | N231: 19 | O231: 4.0000000000000001e-003 | P231: 112.8 | Q231: 12.28 | R231: 1.36 | S231: 115.88 | T231: 0.10300000000000001 | U231: 转股中 | V231: 4年39天 | W231: 2年39天 | X231: 0.13100000000000001 | Y231: 0.152 | Z231: 34 | AA231: 263 | AB231: -3.0499999999999999e-002 | AC231: -3.5900000000000001e-002 | AD231: -9.0200000000000002e-002 | AE231: -9.2600000000000002e-002 | AF231: 94.15 | AG231: 95.57 | AH231: 0.75 | AI231: AA+ | AJ231: 4.2099999999999999e-002 | AK231: =I231+100*T231 -> 138.09999999999999 | AL231: 139.7 | AM231: 196 | AN231: 44.1 | AO231: 171 | AP231: -4.9000000000000002e-002 | AQ231: 15 | AR231: 桐昆转债!
A232: 108 | B232: 永高转债 | C232: 128099 | D232: 43931. | E232: 永高股份 | F232: 2641 | G232: 建筑 | H232: 建筑行业 | I232: 134 | J232: 3.78e-002 | K232: 7.6e-003 | L232: 8.02 | M232: 5.3899999999999997e-002 | N232: 9.7 | O232: 1.1000000000000001e-002 | P232: 113.2 | Q232: 6.16 | R232: 2.55 | S232: 130.19 | T232: 2.8999999999999998e-002 | U232: 转股中 | V232: 5.41年 | W232: 3.41年 | X232: 7.6999999999999999e-002 | Y232: 0.10099999999999999 | Z232: 7 | AA232: 90 | AB232: -3.1200000000000002e-002 | AC232: -3.5400000000000001e-002 | AD232: -6.9699999999999998e-002 | AE232: -7.1399999999999991e-002 | AF232: 88.53 | AG232: 89.35 | AH232: 0.84 | AI232: AA | AJ232: 4.5599999999999995e-002 | AK232: =I232+100*T232 -> 136.90000000000001 | AL232: 137.8 | AM232: 181 | AN232: 48.5 | AO232: 194 | AP232: -5.0000000000000001e-003 | AQ232: 9 | AR232: 永高转债
A233: 190 | B233: 雅化转债! | C233: 128065 | D233: 43595. | E233: 雅化集团 | F233: 2497 | G233: 化工 | H233: 化工 | I233: 127.701 | J233: 4.4600000000000001e-002 | K233: 2.64e-002 | L233: 10.34 | M233: 9.1899999999999996e-002 | N233: 58 | O233: 5.7000000000000002e-002 | P233: 110.9 | Q233: 8.95 | R233: 3.5 | S233: 115.53 | T233: 0.105 | U233: 转股中 | V233: 4.51年 | W233: 2.51年 | X233: 8.1000000000000003e-002 | Y233: 9.3000000000000013e-002 | Z233: 8 | AA233: 99 | AB233: -3.1400000000000004e-002 | AC233: -3.56e-002 | AD233: -7.6399999999999996e-002 | AE233: -7.8600000000000003e-002 | AF233: 92.22 | AG233: 91.65 | AH233: 0.77 | AI233: AA | AJ233: 4.41e-002 | AK233: =I233+100*T233 -> 138.20099999999999 | AL233: 139.9 | AM233: 198 | AN233: 47.7 | AO233: 190 | AP233: 9.1999999999999998e-002 | AQ233: 21 | AR233: 雅化转债!
A234: 151 | B234: 常汽转债! | C234: 113550 | D234: 43811. | E234: 常熟汽饰 | F234: 603035 | G234: 汽车 | H234: 零部件制 | I234: 144.37 | J234: 4.2500000000000003e-002 | K234: -7.4000000000000003e-003 | L234: 13.74 | M234: 3.9300000000000002e-002 | N234: 38 | O234: 5.7999999999999996e-002 | P234: 121.8 | Q234: 9.65 | R234: 1.42 | S234: 142.38 | T234: 1.3999999999999999e-002 | U234: 转股中 | V234: 5年38天 | W234: 3年38天 | X234: 0.106 | Y234: 0.151 | Z234: 4.6 | AA234: 43 | AB234: -3.3500000000000002e-002 | AC234: -4.0399999999999998e-002 | AD234: -9.4700000000000006e-002 | AE234: -9.6999999999999989e-002 | AF234: 85.08 | AG234: 88.42 | AH234: 0.89 | AI234: AA- | AJ234: 6.6600000000000006e-002 | AK234: =I234+100*T234 -> 145.77000000000001 | AL234: 146.4 | AM234: 235 | AN234: 57.9 | AO234: 243 | AP234: -4.4000000000000004e-002 | AQ234: 16 | AR234: 常汽转债!
A235: 72 | B235: 蓝帆转债 | C235: 128108 | D235: 44001. | E235: 蓝帆医疗 | F235: 2382 | G235: 医药 | H235: 医疗器械 | I235: 137.1 | J235: 3.0899999999999997e-002 | K235: 4.6999999999999993e-003 | L235: 25.05 | M235: 4.0300000000000002e-002 | N235: 437 | O235: 0.10199999999999999 | P235: 113.3 | Q235: 17.79 | R235: 2.69 | S235: 140.81 | T235: -2.6000000000000002e-002 | U235: 53天 | V235: 5.63年 | W235: 4.63年 | X235: 0.13 | Y235: 0.183 | Z235: 31 | AA235: 241 | AB235: -3.39e-002 | AC235: -3.7900000000000003e-002 | AD235: -5.3699999999999998e-002 | AE235: -5.5599999999999997e-002 | AF235: 85.59 | AG235: 88.6 | AH235: 0.88 | AI235: AA | AJ235: 4.5599999999999995e-002 | AK235: =I235+100*T235 -> 134.5 | AL235: 133.4 | AM235: 149 | AN235: 44.8 | AO235: 180 | AP235: 3.6000000000000004e-002 | AQ235: 18 | AR235: 蓝帆转债
A236: 157 | B236: 石英转债! | C236: 113548 | D236: 43791. | E236: 石英股份 | F236: 603688 | G236: 电子 | H236: 电子产品 | I236: 148 | J236: 5.2900000000000003e-002 | K236: 7.6e-003 | L236: 22.18 | M236: 6.7400000000000002e-002 | N236: 32 | O236: 0.17300000000000001 | P236: 124.8 | Q236: 15.1 | R236: 4.54 | S236: 146.89 | T236: 8.0000000000000002e-003 | U236: 转股中 | V236: 5年17天 | W236: 3年17天 | X236: 1.6e-002 | Y236: 2.3e-002 | Z236: 1.2 | AA236: 77 | AB236: -3.4000000000000002e-002 | AC236: -4.1700000000000001e-002 | AD236: -0.10099999999999999 | AE236: -0.10400000000000001 | AF236: 85.37 | AG236: 90.88 | AH236: 0.9 | AI236: AA- | AJ236: 6.6600000000000006e-002 | AK236: =I236+100*T236 -> 148.80000000000001 | AL236: 149.1 | AM236: 247 | AN236: 58.2 | AO236: 244 | AP236: 2.e-003 | AQ236: 11 | AR236: 石英转债!
A237: 77 | B237: 康隆转债 | C237: 113580 | D237: 43971. | E237: 康隆达 | F237: 603665 | G237: 服装纺织 | H237: 服装行业 | I237: 146.22 | J237: 7.7000000000000002e-003 | K237: 1.04e-002 | L237: 25.28 | M237: 1.9400000000000001e-002 | N237: 74 | O237: 0.252 | P237: 121.2 | Q237: 15.51 | R237: 4.05 | S237: 162.99 | T237: -0.10300000000000001 | U237: 18天 | V237: 5.53年 | W237: 3.53年 | X237: 5.2999999999999999e-002 | Y237: 8.6999999999999994e-002 | Z237: 2 | AA237: 37 | AB237: -3.4000000000000002e-002 | AC237: -4.0199999999999993e-002 | AD237: -8.8599999999999998e-002 | AE237: -9.0299999999999991e-002 | AF237: 82.25 | AG237: 85.51 | AH237: 0.94 | AI237: AA- | AJ237: 6.6600000000000006e-002 | AK237: =I237+100*T237 -> 135.91999999999999 | AL237: 129.4 | AM237: 106 | AN237: 43.9 | AO237: 169 | AP237: 1.3999999999999999e-002 | AQ237: 9 | AR237: 康隆转债
A238: 278 | B238: 兄弟转债!! | C238: 128021 | D238: 43096. | E238: 兄弟科技 | F238: 2562 | G238: 医药 | H238: 原料药 | I238: 122.6 | J238: 2.1700000000000001e-002 | K238: 9.7999999999999997e-003 | L238: 6.22 | M238: 3.15e-002 | N238: 8.8 | O238: 2.7000000000000003e-002 | P238: 109.8 | Q238: 5.25 | R238: 2.61 | S238: 118.48 | T238: 3.5000000000000003e-002 | U238: 转股中 | V238: 3年48天 | W238: 1年48天 | X238: 4.7e-002 | Y238: 5.5999999999999994e-002 | Z238: 2.7 | AA238: 56 | AB238: -3.5299999999999998e-002 | AC238: -4.0800000000000003e-002 | AD238: -0.122 | AE238: -0.125 | AF238: 97.02 | AG238: 96.2 | AH238: 1 | AI238: AA | AJ238: 4.41e-002 | AK238: =I238+100*T238 -> 126.09999999999999 | AL238: 126.7 | AM238: 85 | AN238: 29.7 | AO238: 31 | AP238: 2.2000000000000002e-002 | AQ238: 13 | AR238: 兄弟转债!!
A239: 230 | B239: 寒锐转债!! | C239: 123017 | D239: 43458. | E239: 寒锐钴业 | F239: 300618 | G239: 有色金属 | H239: 小金属 | I239: 128.67 | J239: 2.2400000000000003e-002 | K239: 4.3e-003 | L239: 63.32 | M239: 3.3799999999999997e-002 | N239: 12 | O239: 2.4e-002 | P239: 110.8 | Q239: 57.4 | R239: 9.62 | S239: 110.31 | T239: 0.16600000000000001 | U239: 转股中 | V239: 4年40天 | W239: 2年40天 | X239: 2.1000000000000001e-002 | Y239: 2.3e-002 | Z239: 4 | AA239: 192 | AB239: -3.6400000000000002e-002 | AC239: -4.0999999999999995e-002 | AD239: -9.2799999999999994e-002 | AE239: -9.5199999999999993e-002 | AF239: 89.63 | AG239: 86 | AH239: 0.79 | AI239: AA- | AJ239: 6.5099999999999991e-002 | AK239: =I239+100*T239 -> 145.26999999999998 | AL239: 147 | AM239: 237 | AN239: 57.4 | AO239: 239 | AP239: -5.0999999999999997e-002 | AQ239: 13 | AR239: 寒锐转债!!
A240: 71 | B240: 益丰转债 | C240: 113583 | D240: 44004. | E240: 益丰药房 | F240: 603939 | G240: 医药 | H240: 医药商业 | I240: 142.52 | J240: -1.03e-002 | K240: -9.7000000000000003e-003 | L240: 97.01 | M240: -2.3099999999999999e-002 | N240: 5.2 | O240: 2.e-003 | P240: 115.3 | Q240: 71.82 | R240: 10.63 | S240: 135.07 | T240: 5.5e-002 | U240: 57天 | V240: 5.64年 | W240: 3.64年 | X240: 3.1e-002 | Y240: 4.0999999999999995e-002 | Z240: 16 | AA240: 515 | AB240: -3.7499999999999999e-002 | AC240: -4.2099999999999999e-002 | AD240: -8.0600000000000005e-002 | AE240: -8.2200000000000009e-002 | AF240: 87.75 | AG240: 90.11 | AH240: 0.87 | AI240: AA | AJ240: 4.5599999999999995e-002 | AK240: =I240+100*T240 -> 148.02000000000001 | AL240: 150 | AM240: 249 | AN240: 59.9 | AO240: 250 | AP240: -2.6000000000000002e-002 | AQ240: 8 | AR240: 益丰转债
A241: 104 | B241: 博特转债 | C241: 113571 | D241: 43922. | E241: 苏博特 | F241: 603916 | G241: 建筑 | H241: 水泥 | I241: 149.4 | J241: 2.53e-002 | K241: -5.3e-003 | L241: 28.28 | M241: 2.1700000000000001e-002 | N241: 29 | O241: 4.0000000000000001e-002 | P241: 120.8 | Q241: 18.88 | R241: 3.55 | S241: 149.79 | T241: -3.0000000000000001e-003 | U241: 转股中 | V241: 5.42年 | W241: 3.42年 | X241: 5.5999999999999994e-002 | Y241: 8.4000000000000005e-002 | Z241: 4.9 | AA241: 88 | AB241: -3.9199999999999999e-002 | AC241: -4.5400000000000003e-002 | AD241: -9.6799999999999997e-002 | AE241: -9.8599999999999993e-002 | AF241: 82.9 | AG241: 85.86 | AH241: 0.92 | AI241: AA- | AJ241: 6.6600000000000006e-002 | AK241: =I241+100*T241 -> 149.09999999999999 | AL241: 149 | AM241: 246 | AN241: 63.1 | AO241: 258 | AP241: -9.5000000000000001e-002 | AQ241: 14 | AR241: 博特转债
A242: 86 | B242: 应急转债 | C242: 123048 | D242: 43962. | E242: 中船应急 | F242: 300527 | G242: 机械装备 | H242: 专用设备 | I242: 141 | J242: 7.4800000000000005e-002 | K242: -2.2000000000000002e-002 | L242: 14.3 | M242: 5.6900000000000006e-002 | N242: 1795. | O242: 1.5900000000000001 | P242: 113.1 | Q242: 8.9 | R242: 5.62 | S242: 160.67 | T242: -0.122 | U242: 5.1天 | V242: 5.50年 | W242: 3.50年 | X242: 6.3e-002 | Y242: 0.10099999999999999 | Z242: 8.2 | AA242: 131 | AB242: -4.0000000000000001e-002 | AC242: -4.4000000000000004e-002 | AD242: -8.1300000000000011e-002 | AE242: -8.2899999999999988e-002 | AF242: 88.73 | AG242: 89.85 | AH242: 0.93 | AI242: AA+ | AJ242: 4.36e-002 | AK242: =I242+100*T242 -> 128.80000000000001 | AL242: 121.3 | AM242: 36 | AN242: 31.5 | AO242: 47 | AP242: 0.30099999999999999 | AQ242: 14 | AR242: 应急转债
A243: 297 | B243: 九州转债! | C243: 110034 | D243: 42398. | E243: 九州通 | F243: 600998 | G243: 医药 | H243: 医药商业 | I243: 115.36 | J243: -1.e-003 | K243: 1.3100000000000001e-002 | L243: 17.54 | M243: 3.7900000000000003e-002 | N243: 7.9 | O243: 5.0000000000000001e-003 | P243: 109.6 | Q243: 18.32 | R243: 1.83 | S243: 95.74 | T243: 0.20499999999999999 | U243: 转股中 | V243: 1.26年 | W243: 回售中 | X243: 4.5999999999999999e-002 | Y243: 4.4000000000000004e-002 | Z243: 15 | AA243: 329 | AB243: -4.0199999999999993e-002 | AC243: -5.3499999999999999e-002 | AD243: 回售中 | AE243: 回售中 | AF243: 103 | AG243: 104.25 | AH243: 0.32 | AI243: AA+ | AJ243: 4.0899999999999999e-002 | AK243: =I243+100*T243 -> 135.86000000000001 | AL243: 135 | AM243: 164 | AN243: 30.7 | AO243: 42 | AP243: 2.7000000000000003e-002 | AQ243: 25 | AR243: 九州转债!
A244: 292 | B244: 光大转债 | C244: 113011 | D244: 42934. | E244: 光大银行 | F244: 601818 | G244: 金融 | H244: 银行行业 | I244: 119.45 | J244: 8.3000000000000001e-003 | K244: -6.8999999999999999e-003 | L244: 3.66 | M244: 2.7000000000000001e-003 | N244: 98 | O244: 3.0000000000000001e-003 | P244: 108.3 | Q244: 3.76 | R244: 0.6 | S244: 97.34 | T244: 0.22699999999999998 | U244: 转股中 | V244: 2.43年 | W244: 无权 | X244: 0.156 | Y244: 0.152 | Z244: 300 | AA244: 1921. | AB244: -4.0199999999999993e-002 | AC244: -4.6199999999999998e-002 | AD244: 无权 | AE244: 无权 | AF244: 无权 | AG244: 99.11 | AH244: 0.5 | AI244: AAA | AJ244: 3.7900000000000003e-002 | AK244: =I244+100*T244 -> 142.15000000000001 | AL244: 141.6 | AM244: 212 | AN244: 42.5 | AO244: 156 | AP244: -1.3000000000000001e-002 | AQ244: 14 | AR244: 光大转债
A245: 147 | B245: 先导转债 | C245: 123036 | D245: 43840. | E245: 先导智能 | F245: 300450 | G245: 机械装备 | H245: 专用设备 | I245: 142 | J245: 2.6800000000000001e-002 | K245: 4.3899999999999995e-002 | L245: 52.36 | M245: 8.199999999999999e-002 | N245: 54 | O245: 3.7999999999999999e-002 | P245: 115.1 | Q245: 38.99 | R245: 10.99 | S245: 134.29 | T245: 5.7000000000000002e-002 | U245: 转股中 | V245: 5.17年 | W245: 3.17年 | X245: 2.2000000000000002e-002 | Y245: 2.8999999999999998e-002 | Z245: 10 | AA245: 461 | AB245: -4.0500000000000001e-002 | AC245: -4.5400000000000003e-002 | AD245: -9.0999999999999998e-002 | AE245: -9.2799999999999994e-002 | AF245: 89.43 | AG245: 91.83 | AH245: 0.86 | AI245: AA | AJ245: 4.5599999999999995e-002 | AK245: =I245+100*T245 -> 147.69999999999999 | AL245: 149.7 | AM245: 248 | AN245: 57.9 | AO245: 242 | AP245: 0.157 | AQ245: 17 | AR245: 先导转债
A246: 245 | B246: 万顺转债 | C246: 123012 | D246: 43341. | E246: 万顺新材 | F246: 300057 | G246: 造纸包装 | H246: 包装材料 | I246: 128.84 | J246: 1.8100000000000002e-002 | K246: 1.4499999999999999e-002 | L246: 6.15 | M246: 4.0599999999999997e-002 | N246: 55 | O246: 0.33299999999999996 | P246: 110.3 | Q246: 5.31 | R246: 1.22 | S246: 115.82 | T246: 0.11199999999999999 | U246: 转股中 | V246: 3.77年 | W246: 1.77年 | X246: 3.1e-002 | Y246: 3.6000000000000004e-002 | Z246: 1.3 | AA246: 41 | AB246: -4.0999999999999995e-002 | AC246: -4.5700000000000005e-002 | AD246: -0.11 | AE246: -0.113 | AF246: 91.04 | AG246: 87.34 | AH246: 0.8 | AI246: AA- | AJ246: 6.5099999999999991e-002 | AK246: =I246+100*T246 -> 140.03999999999999 | AL246: 141.9 | AM246: 215 | AN246: 50.8 | AO246: 203 | AP246: -3.7000000000000005e-002 | AQ246: 16 | AR246: 万顺转债
A247: 93 | B247: 瀚蓝转债 | C247: 110069 | D247: 43958. | E247: 瀚蓝环境 | F247: 600323 | G247: 城市公用 | H247: 三废处理 | I247: 143.3 | J247: -1.7000000000000001e-003 | K247: -1.23e-002 | L247: 27.55 | M247: -1.61e-002 | N247: 8.7 | O247: 6.0000000000000001e-003 | P247: 113.5 | Q247: 20.2 | R247: 3.08 | S247: 136.39 | T247: 5.0999999999999997e-002 | U247: 2.1天 | V247: 5.49年 | W247: 3.49年 | X247: 4.7e-002 | Y247: 6.4000000000000001e-002 | Z247: 9.9 | AA247: 211 | AB247: -4.2000000000000003e-002 | AC247: -4.6199999999999998e-002 | AD247: -8.8599999999999998e-002 | AE247: -8.9600000000000013e-002 | AF247: 87.56 | AG247: 90.06 | AH247: 0.88 | AI247: AA+ | AJ247: 4.36e-002 | AK247: =I247+100*T247 -> 148.40000000000001 | AL247: 150.2 | AM247: 251 | AN247: 60.2 | AO247: 252 | AP247: -4.4999999999999998e-002 | AQ247: 7 | AR247: 瀚蓝转债
A248: 92 | B248: 裕同转债 | C248: 128104 | D248: 43949. | E248: 裕同科技 | F248: 2831 | G248: 造纸包装 | H248: 包装材料 | I248: 145.6 | J248: 2.8999999999999998e-002 | K248: 1.5100000000000001e-002 | L248: 33.34 | M248: 5.0099999999999999e-002 | N248: 48 | O248: 2.4e-002 | P248: 115.3 | Q248: 23.24 | R248: 4.56 | S248: 143.46 | T248: 1.4999999999999999e-002 | U248: 2.1天 | V248: 5.49年 | W248: 3.49年 | X248: 4.8000000000000001e-002 | Y248: 6.9000000000000006e-002 | Z248: 14 | AA248: 292 | AB248: -4.24e-002 | AC248: -4.7e-002 | AD248: -8.9200000000000002e-002 | AE248: -9.0899999999999995e-002 | AF248: 88.95 | AG248: 91.65 | AH248: 0.88 | AI248: AA+ | AJ248: 4.36e-002 | AK248: =I248+100*T248 -> 147.09999999999999 | AL248: 147.7 | AM248: 239 | AN248: 56.1 | AO248: 232 | AP248: -5.7000000000000002e-002 | AQ248: 7 | AR248: 裕同转债
A249: 50 | B249: 海容转债 | C249: 113590 | D249: 44039. | E249: 海容冷链 | F249: 603187 | G249: 机械装备 | H249: 通用设备 | I249: 147.49 | J249: 1.8600000000000002e-002 | K249: -2.2099999999999998e-002 | L249: 50.8 | M249: -3.7000000000000002e-003 | N249: 4.7 | O249: 6.0000000000000001e-003 | P249: 115.6 | Q249: 36.39 | R249: 5.16 | S249: 139.6 | T249: 5.7000000000000002e-002 | U249: 2月25天 | V249: 5.72年 | W249: 3.72年 | X249: 6.2e-002 | Y249: 8.6999999999999994e-002 | Z249: 5 | AA249: 81 | AB249: -4.2500000000000003e-002 | AC249: -4.7e-002 | AD249: -8.6899999999999991e-002 | AE249: -8.8599999999999998e-002 | AF249: 81.13 | AG249: 80.58 | AH249: 0.92 | AI249: AA- | AJ249: 6.6600000000000006e-002 | AK249: =I249+100*T249 -> 153.19 | AL249: 155.4 | AM249: 263 | AN249: 74.3 | AO249: 272 | AP249: -1.1000000000000001e-002 | AQ249: 4 | AR249: 海容转债
A250: 42 | B250: 安20转债 | C250: 113592 | D250: 44043. | E250: 安井食品 | F250: 603345 | G250: 食品饮料 | H250: 食品饮料 | I250: 145.2 | J250: -8.9999999999999998e-004 | K250: 1.3899999999999999e-002 | L250: 174.6 | M250: 1.41e-002 | N250: 47 | O250: 3.6000000000000004e-002 | P250: 113.1 | Q250: 115.9 | R250: 13.48 | S250: 150.65 | T250: -3.6000000000000004e-002 | U250: 3月5天 | V250: 5.74年 | W250: 3.74年 | X250: 2.2000000000000002e-002 | Y250: 3.3000000000000002e-002 | Z250: 9 | AA250: 413 | AB250: -4.3299999999999998e-002 | AC250: -4.7100000000000003e-002 | AD250: -8.3400000000000002e-002 | AE250: -8.4900000000000003e-002 | AF250: 87.16 | AG250: 87.96 | AH250: 0.92 | AI250: AA | AJ250: 4.5599999999999995e-002 | AK250: =I250+100*T250 -> 141.59999999999999 | AL250: 139.8 | AM250: 197 | AN250: 51.8 | AO250: 210 | AP250: 4.0000000000000001e-003 | AQ250: 5 | AR250: 安20转债
A251: 282 | B251: 久立转2! | C251: 128019 | D251: 43070. | E251: 久立特材 | F251: 2318 | G251: 石油天然 | H251: 石油天然 | I251: 125.5 | J251: 6.9999999999999993e-003 | K251: 2.1299999999999999e-002 | L251: 8.85 | M251: 3.7499999999999999e-002 | N251: 7.3 | O251: 6.0000000000000001e-003 | P251: 109.8 | Q251: 7.62 | R251: 2.31 | S251: 116.14 | T251: 8.1000000000000003e-002 | U251: 转股中 | V251: 3年28天 | W251: 1年28天 | X251: 0.14000000000000001 | Y251: 0.16200000000000001 | Z251: 10 | AA251: 74 | AB251: -4.3400000000000001e-002 | AC251: -4.8899999999999999e-002 | AD251: -0.14400000000000002 | AE251: -0.14699999999999999 | AF251: 97.25 | AG251: 96.43 | AH251: 0.75 | AI251: AA | AJ251: 4.41e-002 | AK251: =I251+100*T251 -> 133.59999999999999 | AL251: 134.9 | AM251: 162 | AN251: 37.6 | AO251: 103 | AP251: 6.0000000000000001e-003 | AQ251: 12 | AR251: 久立转2!
A252: 279 | B252: 国祯转债!! | C252: 123002 | D252: 43094. | E252: 国祯环保 | F252: 300388 | G252: 城市公用 | H252: 三废处理 | I252: 125.978 | J252: 2.0799999999999999e-002 | K252: 4.7999999999999996e-003 | L252: 10 | M252: 2.5600000000000001e-002 | N252: 5.8 | O252: 1.8000000000000002e-002 | P252: 109.8 | Q252: 8.48 | R252: 1.94 | S252: 117.92 | T252: 6.8000000000000005e-002 | U252: 转股中 | V252: 3年44天 | W252: 1年44天 | X252: 3.7000000000000005e-002 | Y252: 4.4000000000000004e-002 | Z252: 2.5 | AA252: 68 | AB252: -4.3899999999999995e-002 | AC252: -4.9400000000000006e-002 | AD252: -0.14000000000000001 | AE252: -0.14300000000000002 | AF252: 97.06 | AG252: 96.25 | AH252: 1 | AI252: AA | AJ252: 4.41e-002 | AK252: =I252+100*T252 -> 132.77799999999999 | AL252: 134 | AM252: 158 | AN252: 37 | AO252: 98 | AP252: -6.5000000000000002e-002 | AQ252: 11 | AR252: 国祯转债!!
A253: 143 | B253: 明阳转债! | C253: 113029 | D253: 43837. | E253: 明阳智能 | F253: 601615 | G253: 能源电力 | H253: 风能 | I253: 142.82 | J253: 6.0100000000000001e-002 | K253: 1.04e-002 | L253: 18.25 | M253: 7.8600000000000003e-002 | N253: 434 | O253: 0.17999999999999999 | P253: 113.3 | Q253: 12.46 | R253: 3.53 | S253: 146.47 | T253: -2.5000000000000001e-002 | U253: 转股中 | V253: 5.18年 | W253: 3.18年 | X253: 6.6000000000000003e-002 | Y253: 9.6000000000000002e-002 | Z253: 17 | AA253: 256 | AB253: -4.4500000000000005e-002 | AC253: -4.8799999999999996e-002 | AD253: -9.1799999999999993e-002 | AE253: -9.3699999999999992e-002 | AF253: 89.57 | AG253: 90.38 | AH253: 0.9 | AI253: AA | AJ253: 4.5599999999999995e-002 | AK253: =I253+100*T253 -> 140.31999999999999 | AL253: 139.2 | AM253: 192 | AN253: 48.8 | AO253: 197 | AP253: 0.20800000000000002 | AQ253: 23 | AR253: 明阳转债!
A254: 39 | B254: 欣旺转债 | C254: 123058 | D254: 44050. | E254: 欣旺达 | F254: 300207 | G254: 电子 | H254: 电子产品 | I254: 151.018 | J254: 3.9399999999999998e-002 | K254: 4.6600000000000003e-002 | L254: 29.77 | M254: 9.8900000000000002e-002 | N254: 105 | O254: 6.2e-002 | P254: 116.3 | Q254: 21.24 | R254: 8.05 | S254: 140.16 | T254: 7.6999999999999999e-002 | U254: 3月11天 | V254: 5.76年 | W254: 3.76年 | X254: 2.4e-002 | Y254: 3.3000000000000002e-002 | Z254: 11 | AA254: 469 | AB254: -4.5100000000000001e-002 | AC254: -4.9699999999999994e-002 | AD254: -9.1899999999999996e-002 | AE254: -9.3399999999999997e-002 | AF254: 87.29 | AG254: 90.41 | AH254: 0.87 | AI254: AA | AJ254: 4.5599999999999995e-002 | AK254: =I254+100*T254 -> 158.71799999999999 | AL254: 161.9 | AM254: 269 | AN254: 71.5 | AO254: 269 | AP254: 9.4e-002 | AQ254: 5 | AR254: 欣旺转债
A255: 287 | B255: 国君转债! | C255: 113013 | D255: 42940. | E255: 国泰君安 | F255: 601211 | G255: 金融 | H255: 证券行业 | I255: 122.89 | J255: 2.e-003 | K255: 6.5000000000000006e-003 | L255: 18.54 | M255: 1.6399999999999998e-002 | N255: 33 | O255: 4.0000000000000001e-003 | P255: 108.3 | Q255: 19.01 | R255: 1.36 | S255: 97.53 | T255: 0.26000000000000001 | U255: 转股中 | V255: 2.74年 | W255: 无权 | X255: 4.2000000000000003e-002 | Y255: 4.0999999999999995e-002 | Z255: 70 | AA255: 1652. | AB255: -4.58e-002 | AC255: -5.1100000000000007e-002 | AD255: 无权 | AE255: 无权 | AF255: 无权 | AG255: 97.98 | AH255: 0.51 | AI255: AAA | AJ255: 3.7900000000000003e-002 | AK255: =I255+100*T255 -> 148.88999999999999 | AL255: 148.3 | AM255: 243 | AN255: 50.3 | AO255: 201 | AP255: 2.e-003 | AQ255: 13 | AR255: 国君转债!
A256: 121 | B256: 恩捷转债!! | C256: 128095 | D256: 43889. | E256: 恩捷股份 | F256: 2812 | G256: 电子 | H256: 元器件制 | I256: 150 | J256: 5.8400000000000001e-002 | K256: 1.2e-002 | L256: 98.6 | M256: 7.7899999999999997e-002 | N256: 216 | O256: 9.9000000000000005e-002 | P256: 115.3 | Q256: 65.09 | R256: 17.02 | S256: 151.48 | T256: -1.e-002 | U256: 转股中 | V256: 5.34年 | W256: 3.34年 | X256: 1.7000000000000001e-002 | Y256: 2.5000000000000001e-002 | Z256: 14 | AA256: 863 | AB256: -4.9000000000000002e-002 | AC256: -5.3600000000000002e-002 | AD256: -0.10099999999999999 | AE256: -0.10000000000000001 | AF256: 88.94 | AG256: 91.33 | AH256: 0.9 | AI256: AA | AJ256: 4.5599999999999995e-002 | AK256: =I256+100*T256 -> 149. | AL256: 148.5 | AM256: 244 | AN256: 57.2 | AO256: 238 | AP256: 0.14400000000000002 | AQ256: 17 | AR256: 恩捷转债!!
A257: 99 | B257: 天铁转债 | C257: 123046 | D257: 43938. | E257: 天铁股份 | F257: 300587 | G257: 铁路 | H257: 铁路设备 | I257: 154.88 | J257: 5.6999999999999993e-003 | K257: -4.5000000000000005e-003 | L257: 15.8 | M257: 1.2999999999999999e-003 | N257: 26 | O257: 8.199999999999999e-002 | P257: 118.2 | Q257: 10.12 | R257: 2.65 | S257: 156.13 | T257: -8.0000000000000002e-003 | U257: 转股中 | V257: 5.44年 | W257: 3.44年 | X257: 4.2000000000000003e-002 | Y257: 6.6000000000000003e-002 | Z257: 2.1 | AA257: 49 | AB257: -4.9400000000000006e-002 | AC257: -5.4800000000000001e-002 | AD257: -0.10300000000000001 | AE257: -0.10400000000000001 | AF257: 82.77 | AG257: 83.93 | AH257: 0.93 | AI257: AA- | AJ257: 6.6600000000000006e-002 | AK257: =I257+100*T257 -> 154.07999999999998 | AL257: 153.6 | AM257: 260 | AN257: 69.7 | AO257: 266 | AP257: 0. | AQ257: 9 | AR257: 天铁转债
A258: 259 | B258: 长证转债! | C258: 127005 | D258: 43201. | E258: 长江证券 | F258: 783 | G258: 金融 | H258: 证券行业 | I258: 129.99 | J258: 1.5e-003 | K258: 9.0000000000000011e-003 | L258: 8.14 | M258: 1.4999999999999999e-002 | N258: 17 | O258: 3.0000000000000001e-003 | P258: 109.3 | Q258: 7.28 | R258: 1.66 | S258: 111.81 | T258: 0.16300000000000001 | U258: 转股中 | V258: 3.42年 | W258: 无权 | X258: 0.111 | Y258: 0.124 | Z258: 50 | AA258: 450 | AB258: -5.04e-002 | AC258: -5.5e-002 | AD258: 无权 | AE258: 无权 | AF258: 无权 | AG258: 96.14 | AH258: 0.7 | AI258: AAA | AJ258: 3.9100000000000003e-002 | AK258: =I258+100*T258 -> 146.29000000000002 | AL258: 148.2 | AM258: 242 | AN258: 52 | AO258: 212 | AP258: 3.0000000000000001e-003 | AQ258: 15 | AR258: 长证转债!
A259: 171 | B259: 九洲转债! | C259: 123030 | D259: 43720. | E259: 九洲集团 | F259: 300040 | G259: 能源电力 | H259: 电力设备 | I259: 154.3 | J259: 6.1900000000000004e-002 | K259: -1.9799999999999998e-002 | L259: 8.66 | M259: 4.2099999999999999e-002 | N259: 735 | O259: 3.6400000000000001 | P259: 120 | Q259: 5.65 | R259: 1.51 | S259: 153.27 | T259: 6.9999999999999993e-003 | U259: 转股中 | V259: 4.86年 | W259: 2.86年 | X259: 4.0000000000000001e-002 | Y259: 6.0999999999999999e-002 | Z259: 1.3 | AA259: 31 | AB259: -5.1299999999999998e-002 | AC259: -5.7800000000000004e-002 | AD259: -0.12300000000000001 | AE259: -0.124 | AF259: 85.69 | AG259: 88.85 | AH259: 1 | AI259: AA- | AJ259: 6.5099999999999991e-002 | AK259: =I259+100*T259 -> 155. | AL259: 155.3 | AM259: 262 | AN259: 66.5 | AO259: 261 | AP259: 7.8e-002 | AQ259: 28 | AR259: 九洲转债!
A260: 126 | B260: 希望转债! | C260: 127015 | D260: 43865. | E260: 新 希 望 | F260: 876 | G260: 农业 | H260: 畜牧业 | I260: 144.63 | J260: -2.5999999999999999e-003 | K260: 5.1000000000000004e-003 | L260: 27.77 | M260: 2.5000000000000001e-003 | N260: 71 | O260: 2.7000000000000003e-002 | P260: 110.2 | Q260: 19.63 | R260: 4.04 | S260: 141.47 | T260: 2.2000000000000002e-002 | U260: 转股中 | V260: 5.23年 | W260: 3.23年 | X260: 1.4999999999999999e-002 | Y260: 2.2000000000000002e-002 | Z260: 18 | AA260: 1196. | AB260: -5.1399999999999994e-002 | AC260: -5.4600000000000003e-002 | AD260: -9.6099999999999991e-002 | AE260: -9.74e-002 | AF260: 89.95 | AG260: 89.79 | AH260: 1 | AI260: AAA | AJ260: 4.0599999999999997e-002 | AK260: =I260+100*T260 -> 146.82999999999998 | AL260: 147.8 | AM260: 240 | AN260: 57.8 | AO260: 241 | AP260: -0.11199999999999999 | AQ260: 29 | AR260: 希望转债!
A261: 184 | B261: 中环转债! | C261: 123026 | D261: 43647. | E261: 中环环保 | F261: 300692 | G261: 城市公用 | H261: 三废处理 | I261: 134.4 | J261: 3.8199999999999998e-002 | K261: -9.5999999999999992e-003 | L261: 16.51 | M261: 3.1899999999999998e-002 | N261: 43 | O261: 0.20199999999999999 | P261: 110.6 | Q261: 12.25 | R261: 2.91 | S261: 134.78 | T261: -3.0000000000000001e-003 | U261: 转股中 | V261: 3.66年 | W261: 1.66年 | X261: 5.7999999999999996e-002 | Y261: 7.8e-002 | Z261: 1.6 | AA261: 27 | AB261: -5.2699999999999997e-002 | AC261: -5.7599999999999998e-002 | AD261: -0.11599999999999999 | AE261: -0.11800000000000001 | AF261: 91.63 | AG261: 88.18 | AH261: 0.89 | AI261: AA- | AJ261: 6.5099999999999991e-002 | AK261: =I261+100*T261 -> 134.09999999999999 | AL261: 134 | AM261: 157 | AN261: 42.4 | AO261: 154 | AP261: -1.6e-002 | AQ261: 28 | AR261: 中环转债!
A262: 261 | B262: 艾华转债!! | C262: 113504 | D262: 43182. | E262: 艾华集团 | F262: 603989 | G262: 电子 | H262: 元器件制 | I262: 132.37 | J262: 9.7999999999999997e-003 | K262: -7.9000000000000008e-003 | L262: 27.23 | M262: 2.2000000000000001e-003 | N262: 5.8 | O262: 8.0000000000000002e-003 | P262: 110.3 | Q262: 21.13 | R262: 4.84 | S262: 128.87 | T262: 2.7000000000000003e-002 | U262: 转股中 | V262: 3.39年 | W262: 1.39年 | X262: 5.2999999999999999e-002 | Y262: 6.8000000000000005e-002 | Z262: 5.6 | AA262: 106 | AB262: -5.3399999999999996e-002 | AC262: -5.8499999999999996e-002 | AD262: -0.13400000000000001 | AE262: -0.13699999999999998 | AF262: 96.18 | AG262: 95.58 | AH262: 0.85 | AI262: AA | AJ262: 4.41e-002 | AK262: =I262+100*T262 -> 135.06999999999999 | AL262: 135.9 | AM262: 171 | AN262: 39.7 | AO262: 130 | AP262: -1.3000000000000001e-002 | AQ262: 9 | AR262: 艾华转债!!
A263: 175 | B263: 欧派转债! | C263: 113543 | D263: 43712. | E263: 欧派家居 | F263: 603833 | G263: 其他 | H263: 家居用品 | I263: 150.9 | J263: 6.8000000000000005e-003 | K263: -1.e-003 | L263: 108.45 | M263: 6.3e-003 | N263: 33 | O263: 2.4e-002 | P263: 114.9 | Q263: 71.69 | R263: 4.91 | S263: 151.28 | T263: -2.e-003 | U263: 转股中 | V263: 4.85年 | W263: 3.85年 | X263: 1.3999999999999999e-002 | Y263: 2.1000000000000001e-002 | Z263: 9.1 | AA263: 646 | AB263: -5.5599999999999997e-002 | AC263: -6.0599999999999994e-002 | AD263: -8.6899999999999991e-002 | AE263: -8.900000000000001e-002 | AF263: 88.72 | AG263: 93.58 | AH263: 0.91 | AI263: AA | AJ263: 4.41e-002 | AK263: =I263+100*T263 -> 150.70000000000002 | AL263: 150.5 | AM263: 253 | AN263: 56.9 | AO263: 237 | AP263: -2.e-003 | AQ263: 15 | AR263: 欧派转债!
A264: 128 | B264: 璞泰转债! | C264: 113562 | D264: 43865. | E264: 璞泰来 | F264: 603659 | G264: 电子 | H264: 元器件制 | I264: 143.88 | J264: 4.2500000000000003e-002 | K264: 1.7899999999999999e-002 | L264: 115.94 | M264: 6.7699999999999996e-002 | N264: 92 | O264: 7.400000000000001e-002 | P264: 113.3 | Q264: 82.73 | R264: 14.75 | S264: 140.14 | T264: 2.7000000000000003e-002 | U264: 转股中 | V264: 4.23年 | W264: 2.23年 | X264: 1.7000000000000001e-002 | Y264: 2.4e-002 | Z264: 8.7 | AA264: 505 | AB264: -5.5599999999999997e-002 | AC264: -6.08e-002 | AD264: -0.10000000000000001 | AE264: -0.10099999999999999 | AF264: 92.09 | AG264: 94.63 | AH264: 0.89 | AI264: AA | AJ264: 4.41e-002 | AK264: =I264+100*T264 -> 146.57999999999998 | AL264: 147.6 | AM264: 238 | AN264: 53 | AO264: 221 | AP264: 9.8000000000000004e-002 | AQ264: 16 | AR264: 璞泰转债!
A265: 187 | B265: 一心转债! | C265: 128067 | D265: 43602. | E265: 一心堂 | F265: 2727 | G265: 医药 | H265: 医药商业 | I265: 146.159 | J265: -3.0000000000000001e-003 | K265: 7.3000000000000001e-003 | L265: 39.33 | M265: 4.3e-003 | N265: 21 | O265: 8.3000000000000004e-002 | P265: 112.9 | Q265: 26.83 | R265: 4.7 | S265: 146.59 | T265: -3.0000000000000001e-003 | U265: 转股中 | V265: 4.52年 | W265: 2.52年 | X265: 6.9999999999999993e-003 | Y265: 1.1000000000000001e-002 | Z265: 1.7 | AA265: 231 | AB265: -5.6500000000000002e-002 | AC265: -6.1200000000000004e-002 | AD265: -0.121 | AE265: -0.12300000000000001 | AF265: 92.18 | AG265: 93.26 | AH265: 1 | AI265: AA | AJ265: 4.41e-002 | AK265: =I265+100*T265 -> 145.85899999999998 | AL265: 145.7 | AM265: 232 | AN265: 52.5 | AO265: 216 | AP265: -1.4999999999999999e-002 | AQ265: 17 | AR265: 一心转债!
A266: 17 | B266: 隆20转债 | C266: 113038 | D266: 44082. | E266: 隆基股份 | F266: 601012 | G266: 能源电力 | H266: 太阳能 | I266: 158.98 | J266: 3.5200000000000002e-002 | K266: 5.0099999999999999e-002 | L266: 82 | M266: 9.3200000000000005e-002 | N266: 892 | O266: 0.11 | P266: 111.8 | Q266: 52.77 | R266: 9.97 | S266: 155.39 | T266: 2.3e-002 | U266: 3月28天 | V266: 5.80年 | W266: 3.80年 | X266: 1.6e-002 | Y266: 2.5000000000000001e-002 | Z266: 50 | AA266: 3093. | AB266: -5.9699999999999996e-002 | AC266: -6.3e-002 | AD266: -0.10300000000000001 | AE266: -0.10099999999999999 | AF266: 88.3 | AG266: 89.08 | AH266: 0.92 | AI266: AAA | AJ266: 4.0599999999999997e-002 | AK266: =I266+100*T266 -> 161.28 | AL266: 162.6 | AM266: 271 | AN266: 73.5 | AO266: 271 | AP266: 0.16899999999999998 | AQ266: 10 | AR266: 隆20转债
A267: 155 | B267: 通光转债! | C267: 123034 | D267: 43797. | E267: 通光线缆 | F267: 300265 | G267: 通信互联 | H267: 通信设备 | I267: 161.3 | J267: 2.87e-002 | K267: -7.000000000000001e-004 | L267: 12.95 | M267: 2.9399999999999999e-002 | N267: 381 | O267: 2.2799999999999998 | P267: 118.5 | Q267: 7.97 | R267: 3.91 | S267: 162.48 | T267: -6.9999999999999993e-003 | U267: 转股中 | V267: 5年24天 | W267: 3年24天 | X267: 2.2000000000000002e-002 | Y267: 3.6000000000000004e-002 | Z267: 1 | AA267: 47 | AB267: -6.0199999999999997e-002 | AC267: -6.59e-002 | AD267: -0.126 | AE267: -0.127 | AF267: 81.97 | AG267: 81.89 | AH267: 0.95 | AI267: A+ | AJ267: 7.7600000000000002e-002 | AK267: =I267+100*T267 -> 160.60000000000002 | AL267: 160.1 | AM267: 266 | AN267: 78.2 | AO267: 274 | AP267: 6.9000000000000006e-002 | AQ267: 25 | AR267: 通光转债!
A268: 53 | B268: 巨星转债 | C268: 128115 | D268: 44028. | E268: 巨星科技 | F268: 2444 | G268: 机械装备 | H268: 通用设备 | I268: 163.828 | J268: 3.6900000000000002e-002 | K268: 2.0000000000000001e-004 | L268: 20.56 | M268: 3.9399999999999998e-002 | N268: 50 | O268: 3.2000000000000001e-002 | P268: 115.3 | Q268: 12.28 | R268: 2.72 | S268: 167.43 | T268: -2.1000000000000001e-002 | U268: 2月25天 | V268: 5.70年 | W268: 3.70年 | X268: 4.4000000000000004e-002 | Y268: 7.400000000000001e-002 | Z268: 9.7 | AA268: 221 | AB268: -6.0700000000000004e-002 | AC268: -6.5000000000000002e-002 | AD268: -0.10300000000000001 | AE268: -0.105 | AF268: 89.77 | AG268: 89.86 | AH268: 0.94 | AI268: AA | AJ268: 4.5599999999999995e-002 | AK268: =I268+100*T268 -> 161.72800000000001 | AL268: 160.2 | AM268: 267 | AN268: 70.4 | AO268: 267 | AP268: 2.8999999999999998e-002 | AQ268: 4 | AR268: 巨星转债
A269: 120 | B269: 奥佳转债! | C269: 128097 | D269: 43908. | E269: 奥佳华 | F269: 2614 | G269: 机械装备 | H269: 专用设备 | I269: 161 | J269: 0.106 | K269: -1.4199999999999999e-002 | L269: 16.96 | M269: 9.9900000000000003e-002 | N269: 327 | O269: 0.33299999999999996 | P269: 115.3 | Q269: 10.69 | R269: 2.78 | S269: 158.65 | T269: 1.4999999999999999e-002 | U269: 转股中 | V269: 5.38年 | W269: 3.38年 | X269: 5.9000000000000004e-002 | Y269: 9.4e-002 | Z269: 6.2 | AA269: 104 | AB269: -6.13e-002 | AC269: -6.5799999999999997e-002 | AD269: -0.114 | AE269: -0.11599999999999999 | AF269: 88.79 | AG269: 91.17 | AH269: 0.92 | AI269: AA | AJ269: 4.5599999999999995e-002 | AK269: =I269+100*T269 -> 162.5 | AL269: 163.3 | AM269: 272 | AN269: 72.2 | AO269: 270 | AP269: 8.3000000000000004e-002 | AQ269: 27 | AR269: 奥佳转债!
A270: 242 | B270: 凯发转债! | C270: 123014 | D270: 43333. | E270: 凯发电气 | F270: 300407 | G270: 能源电力 | H270: 电力设备 | I270: 131.605 | J270: 1.32e-002 | K270: 2.2499999999999999e-002 | L270: 8.82 | M270: 4.7500000000000001e-002 | N270: 40 | O270: 0.26500000000000001 | P270: 108.5 | Q270: 8.12 | R270: 2.05 | S270: 108.62 | T270: 0.21199999999999999 | U270: 转股中 | V270: 2.79年 | W270: 0.79年 | X270: 4.2999999999999997e-002 | Y270: 4.7e-002 | Z270: 1.2 | AA270: 27 | AB270: -6.7500000000000004e-002 | AC270: -7.2700000000000001e-002 | AD270: -0.24199999999999999 | AE270: -0.24399999999999999 | AF270: 94.49 | AG270: 88.9 | AH270: 0.75 | AI270: A+ | AJ270: 7.4900000000000008e-002 | AK270: =I270+100*T270 -> 152.80499999999998 | AL270: 154.6 | AM270: 261 | AN270: 60.1 | AO270: 251 | AP270: -4.2000000000000003e-002 | AQ270: 14 | AR270: 凯发转债!
A271: 256 | B271: 金农转债!! | C271: 128036 | D271: 43192. | E271: 金新农 | F271: 2548 | G271: 农业 | H271: 畜牧业 | I271: 139.9 | J271: 1.55e-002 | K271: 1.7399999999999999e-002 | L271: 8.78 | M271: 3.2899999999999999e-002 | N271: 112 | O271: 0.54899999999999993 | P271: 110.3 | Q271: 7.39 | R271: 2.5 | S271: 118.81 | T271: 0.17800000000000002 | U271: 转股中 | V271: 3.41年 | W271: 1.41年 | X271: 2.9999999999999999e-002 | Y271: 3.5000000000000003e-002 | Z271: 1.5 | AA271: 49 | AB271: -6.8600000000000008e-002 | AC271: -7.3599999999999999e-002 | AD271: -0.158 | AE271: -0.16 | AF271: 93.16 | AG271: 89.37 | AH271: 1 | AI271: AA- | AJ271: 6.5099999999999991e-002 | AK271: =I271+100*T271 -> 157.70000000000002 | AL271: 161 | AM271: 268 | AN271: 67.8 | AO271: 262 | AP271: -2.7000000000000003e-002 | AQ271: 15 | AR271: 金农转债!!
A272: 220 | B272: 联泰转债! | C272: 113526 | D272: 43514. | E272: 联泰环保 | F272: 603797 | G272: 城市公用 | H272: 三废处理 | I272: 151.64 | J272: 1.1200000000000002e-002 | K272: 2.0000000000000001e-004 | L272: 8.62 | M272: 1.29e-002 | N272: 11 | O272: 3.7000000000000005e-002 | P272: 110.8 | Q272: 6.11 | R272: 1.82 | S272: 141.08 | T272: 7.4999999999999997e-002 | U272: 转股中 | V272: 4.29年 | W272: 2.29年 | X272: 5.0000000000000003e-002 | Y272: 7.0999999999999994e-002 | Z272: 1.9 | AA272: 39 | AB272: -7.1900000000000006e-002 | AC272: -7.5899999999999995e-002 | AD272: -0.107 | AE272: -0.109 | AF272: 93.03 | AG272: 92.45 | AH272: 0.88 | AI272: AA | AJ272: 4.41e-002 | AK272: =I272+100*T272 -> 159.13999999999999 | AL272: 162.2 | AM272: 270 | AN272: 69.2 | AO272: 264 | AP272: -3.2000000000000001e-002 | AQ272: 7 | AR272: 联泰转债!
A273: 100 | B273: 海大转债 | C273: 128102 | D273: 43937. | E273: 海大集团 | F273: 2311 | G273: 农业 | H273: 畜牧业 | I273: 171.02 | J273: -3.5400000000000001e-002 | K273: 8.6e-003 | L273: 59.6 | M273: -2.8199999999999999e-002 | N273: 132 | O273: 3.7000000000000005e-002 | P273: 114.1 | Q273: 34.74 | R273: 9.59 | S273: 171.56 | T273: -3.0000000000000001e-003 | U273: 转股中 | V273: 5.44年 | W273: 4.44年 | X273: 2.2000000000000002e-002 | Y273: 3.7999999999999999e-002 | Z273: 21 | AA273: 953 | AB273: -7.2599999999999998e-002 | AC273: -7.6799999999999993e-002 | AD273: -0.10199999999999999 | AE273: -0.10400000000000001 | AF273: 86 | AG273: 90.79 | AH273: 0.95 | AI273: AA+ | AJ273: 4.36e-002 | AK273: =I273+100*T273 -> 170.72 | AL273: 170.5 | AM273: 276 | AN273: 79.7 | AO273: 276 | AP273: -4.4000000000000004e-002 | AQ273: 12 | AR273: 海大转债
A274: 300 | B274: 电气转债! | C274: 113008 | D274: 42051. | E274: 上海电气 | F274: 601727 | G274: 能源电力 | H274: 电力设备 | I274: 109.29 | J274: 5.1999999999999998e-003 | K274: 2.8999999999999998e-003 | L274: 5.16 | M274: 2.7900000000000001e-002 | N274: 24 | O274: 5.0000000000000001e-003 | P274: 106.6 | Q274: 5.13 | R274: 1.2 | S274: 100.58 | T274: 8.6999999999999994e-002 | U274: 转股中 | V274: 0.31年 | W274: 回售中 | X274: 5.5999999999999994e-002 | Y274: 5.7000000000000002e-002 | Z274: 44 | AA274: 782 | AB274: -7.6600000000000001e-002 | AC274: -0.113 | AD274: 回售中 | AE274: 回售中 | AF274: 103 | AG274: 105.49 | AH274: 0.29 | AI274: AAA | AJ274: 3.4000000000000002e-002 | AK274: =I274+100*T274 -> 117.99000000000001 | AL274: 118 | AM274: 14 | AN274: 12.5 | AO274: 1 | AP274: -2.8999999999999998e-002 | AQ274: 28 | AR274: 电气转债!
A275: 74 | B275: 火炬转债 | C275: 113582 | D275: 44005. | E275: 火炬电子 | F275: 603678 | G275: 电子 | H275: 元器件制 | I275: 179.9 | J275: 8.1000000000000013e-003 | K275: 8.1000000000000013e-003 | L275: 46.9 | M275: 1.6899999999999998e-002 | N275: 40 | O275: 3.7000000000000005e-002 | P275: 115.3 | Q275: 25.33 | R275: 6.4 | S275: 185.16 | T275: -2.7999999999999997e-002 | U275: 52天 | V275: 5.63年 | W275: 3.63年 | X275: 2.7999999999999997e-002 | Y275: 5.2000000000000005e-002 | Z275: 6 | AA275: 212 | AB275: -7.7300000000000008e-002 | AC275: -8.1500000000000003e-002 | AD275: -0.13 | AE275: -0.13200000000000001 | AF275: 87.8 | AG275: 90.16 | AH275: 0.96 | AI275: AA | AJ275: 4.5599999999999995e-002 | AK275: =I275+100*T275 -> 177.09999999999999 | AL275: 174.6 | AM275: 279 | AN275: 84.5 | AO275: 278 | AP275: 0.127 | AQ275: 4 | AR275: 火炬转债
A276: 59 | B276: 歌尔转2 | C276: 128112 | D276: 44025. | E276: 歌尔股份 | F276: 2241 | G276: 电子 | H276: 电子产品 | I276: 183.5 | J276: 4.0500000000000001e-002 | K276: 1.9e-002 | L276: 42.95 | M276: 6.2300000000000001e-002 | N276: 427 | O276: 5.7999999999999996e-002 | P276: 114.5 | Q276: 23.27 | R276: 8.62 | S276: 184.57 | T276: -6.0000000000000001e-003 | U276: 2月8天 | V276: 5.67年 | W276: 3.67年 | X276: 2.8999999999999998e-002 | Y276: 5.2999999999999999e-002 | Z276: 40 | AA276: 1394. | AB276: -8.0799999999999997e-002 | AC276: -8.48e-002 | AD276: -0.13400000000000001 | AE276: -0.13500000000000001 | AF276: 87.53 | AG276: 90.21 | AH276: 0.96 | AI276: AA+ | AJ276: 4.36e-002 | AK276: =I276+100*T276 -> 182.90000000000001 | AL276: 182.4 | AM276: 280 | AN276: 92.2 | AO276: 280 | AP276: 5.9000000000000004e-002 | AQ276: 16 | AR276: 歌尔转2
A277: 218 | B277: 尚荣转债! | C277: 128053 | D277: 43531. | E277: 尚荣医疗 | F277: 2551 | G277: 医药 | H277: 医疗器械 | I277: 166.5 | J277: 2.1499999999999998e-002 | K277: 8.9999999999999998e-004 | L277: 7.76 | M277: 2.2400000000000003e-002 | N277: 95 | O277: 0.29999999999999999 | P277: 114.9 | Q277: 4.89 | R277: 2.17 | S277: 158.69 | T277: 4.9000000000000002e-002 | U277: 转股中 | V277: 4.35年 | W277: 2.35年 | X277: 2.9999999999999999e-002 | Y277: 4.8000000000000001e-002 | Z277: 1.9 | AA277: 64 | AB277: -8.3199999999999996e-002 | AC277: -8.8599999999999998e-002 | AD277: -0.125 | AE277: -0.126 | AF277: 92.88 | AG277: 95.63 | AH277: 1 | AI277: AA | AJ277: 4.41e-002 | AK277: =I277+100*T277 -> 171.40000000000001 | AL277: 174.3 | AM277: 278 | AN277: 78.7 | AO277: 275 | AP277: 4.8000000000000001e-002 | AQ277: 26 | AR277: 尚荣转债!
A278: 207 | B278: 长信转债!! | C278: 123022 | D278: 43565. | E278: 长信科技 | F278: 300088 | G278: 通信互联 | H278: 通信设备 | I278: 170.2 | J278: 4.9299999999999997e-002 | K278: -3.8e-003 | L278: 10.5 | M278: 4.7899999999999998e-002 | N278: 40 | O278: 7.9000000000000001e-002 | P278: 114.9 | Q278: 6.15 | R278: 3.91 | S278: 170.73 | T278: -3.0000000000000001e-003 | U278: 转股中 | V278: 4.43年 | W278: 2.43年 | X278: 1.2e-002 | Y278: 2.e-002 | Z278: 3 | AA278: 256 | AB278: -8.6199999999999999e-002 | AC278: -9.1400000000000009e-002 | AD278: -0.12300000000000001 | AE278: -0.124 | AF278: 92.53 | AG278: 95.27 | AH278: 0.95 | AI278: AA | AJ278: 4.41e-002 | AK278: =I278+100*T278 -> 169.89999999999998 | AL278: 169.7 | AM278: 274 | AN278: 74.4 | AO278: 273 | AP278: -4.2000000000000003e-002 | AQ278: 11 | AR278: 长信转债!!
A279: 272 | B279: 赣锋转债!! | C279: 128028 | D279: 43119. | E279: 赣锋锂业 | F279: 2460 | G279: 有色金属 | H279: 小金属 | I279: 146.23 | J279: 3.2799999999999996e-002 | K279: 1.2699999999999999e-002 | L279: 56.66 | M279: 4.5599999999999995e-002 | N279: 73 | O279: 5.2999999999999999e-002 | P279: 109.3 | Q279: 41.98 | R279: 9.11 | S279: 134.97 | T279: 8.3000000000000004e-002 | U279: 转股中 | V279: 3.19年 | W279: 1.19年 | X279: 1.2e-002 | Y279: 1.6e-002 | Z279: 9.2 | AA279: 755 | AB279: -8.8399999999999992e-002 | AC279: -9.3100000000000002e-002 | AD279: -0.214 | AE279: -0.21600000000000003 | AF279: 96.27 | AG279: 95.46 | AH279: 1 | AI279: AA | AJ279: 4.41e-002 | AK279: =I279+100*T279 -> 154.53 | AL279: 157.5 | AM279: 265 | AN279: 61.2 | AO279: 254 | AP279: 9.6999999999999989e-002 | AQ279: 13 | AR279: 赣锋转债!!
A280: 182 | B280: 蓝晓转债! | C280: 123027 | D280: 43650. | E280: 蓝晓科技 | F280: 300487 | G280: 化工 | H280: 化工 | I280: 185.097 | J280: 1.15e-002 | K280: -5.6000000000000008e-003 | L280: 54.1 | M280: 6.0999999999999995e-003 | N280: 37 | O280: 0.182 | P280: 119.5 | Q280: 29.33 | R280: 8.17 | S280: 184.45 | T280: 3.0000000000000001e-003 | U280: 转股中 | V280: 4.67年 | W280: 2.67年 | X280: 1.e-002 | Y280: 1.8000000000000002e-002 | Z280: 1.1 | AA280: 113 | AB280: -9.1300000000000006e-002 | AC280: -9.7500000000000003e-002 | AD280: -0.122 | AE280: -0.12300000000000001 | AF280: 85.04 | AG280: 85.61 | AH280: 0.96 | AI280: A+ | AJ280: 7.6100000000000001e-002 | AK280: =I280+100*T280 -> 185.39700000000002 | AL280: 185.7 | AM280: 281 | AN280: 100.1 | AO280: 282 | AP280: 1.7000000000000001e-002 | AQ280: 20 | AR280: 蓝晓转债!
A281: 239 | B281: 蓝盾转债!! | C281: 123015 | D281: 43356. | E281: 蓝盾股份 | F281: 300297 | G281: 计算机及 | H281: 软件开发 | I281: 161.6 | J281: 7.4999999999999997e-003 | K281: 3.4000000000000002e-003 | L281: 4.95 | M281: 2.7000000000000003e-002 | N281: 161 | O281: 0.996 | P281: 112.3 | Q281: 5.79 | R281: 1.64 | S281: 85.49 | T281: 0.89000000000000001 | U281: 转股中 | V281: 3.84年 | W281: 1.84年 | X281: 1.6e-002 | Y281: 1.3999999999999999e-002 | Z281: 1 | AA281: 62 | AB281: -9.1799999999999993e-002 | AC281: -9.6799999999999997e-002 | AD281: -0.161 | AE281: -0.16200000000000001 | AF281: 94.33 | AG281: 95.44 | AH281: 0.4 | AI281: AA | AJ281: 4.41e-002 | AK281: =I281+100*T281 -> 250.59999999999999 | AL281: 237.7 | AM281: 290 | AN281: 142.3 | AO281: 290 | AP281: -8.5000000000000006e-002 | AQ281: 18 | AR281: 蓝盾转债!!
A282: 285 | B282: 金禾转债!! | C282: 128017 | D282: 43066. | E282: 金禾实业 | F282: 2597 | G282: 化工 | H282: 化工 | I282: 150.9 | J282: 4.0800000000000003e-002 | K282: 1.84e-002 | L282: 33.72 | M282: 6.3700000000000007e-002 | N282: 37 | O282: 4.4000000000000004e-002 | P282: 109.8 | Q282: 22.42 | R282: 4.3 | S282: 150.4 | T282: 3.0000000000000001e-003 | U282: 转股中 | V282: 3年21天 | W282: 1年21天 | X282: 2.8999999999999998e-002 | Y282: 4.4000000000000004e-002 | Z282: 5.5 | AA282: 188 | AB282: -0.10099999999999999 | AC282: -0.106 | AD282: -0.25700000000000001 | AE282: -0.25900000000000001 | AF282: 97.33 | AG282: 96.51 | AH282: 0.93 | AI282: AA | AJ282: 4.41e-002 | AK282: =I282+100*T282 -> 151.20000000000002 | AL282: 151.4 | AM282: 255 | AN282: 54.1 | AO282: 223 | AP282: 9.0000000000000011e-003 | AQ282: 10 | AR282: 金禾转债!!
A283: 64 | B283: 上机转债 | C283: 113586 | D283: 44019. | E283: 上机数控 | F283: 603185 | G283: 机械装备 | H283: 专用设备 | I283: 225.9 | J283: 0.13 | K283: -3.2300000000000002e-002 | L283: 79.75 | M283: 0.10000000000000001 | N283: 607 | O283: 0.40600000000000003 | P283: 120.8 | Q283: 33.3 | R283: 10.21 | S283: 239.49 | T283: -5.7000000000000002e-002 | U283: 2月5天 | V283: 5.66年 | W283: 3.66年 | X283: 3.6000000000000004e-002 | Y283: 8.5999999999999993e-002 | Z283: 6.7 | AA283: 185 | AB283: -0.106 | AC283: -0.11199999999999999 | AD283: -0.17300000000000001 | AE283: -0.17399999999999999 | AF283: 81.6 | AG283: 84.53 | AH283: 0.98 | AI283: AA- | AJ283: 6.6600000000000006e-002 | AK283: =I283+100*T283 -> 220.20000000000002 | AL283: 212.3 | AM283: 285 | AN283: 127.8 | AO283: 287 | AP283: 0.13800000000000001 | AQ283: 8 | AR283: 上机转债
A284: 75 | B284: 龙蟠转债 | C284: 113581 | D284: 43970. | E284: 龙蟠科技 | F284: 603906 | G284: 化工 | H284: 化工 | I284: 251.39 | J284: 3.7100000000000001e-002 | K284: -1.34e-002 | L284: 27.35 | M284: 2.4300000000000002e-002 | N284: 225 | O284: 0.22500000000000001 | P284: 129.6 | Q284: 9.48 | R284: 5.87 | S284: 288.5 | T284: -0.129 | U284: 18天 | V284: 5.53年 | W284: 3.53年 | X284: 4.8000000000000001e-002 | Y284: 0.13900000000000001 | Z284: 4 | AA284: 83 | AB284: -0.11599999999999999 | AC284: -0.12300000000000001 | AD284: -0.109 | AE284: -0.11 | AF284: 81.26 | AG284: 86.83 | AH284: 0.97 | AI284: A+ | AJ284: 7.7600000000000002e-002 | AK284: =I284+100*T284 -> 238.48999999999998 | AL284: 214.3 | AM284: 286 | AN284: 127.4 | AO284: 286 | AP284: 2.6000000000000002e-002 | AQ284: 14 | AR284: 龙蟠转债
A285: 73 | B285: 福莱转债 | C285: 113035 | D285: 43999. | E285: 福莱特 | F285: 601865 | G285: 能源电力 | H285: 太阳能 | I285: 240.59 | J285: 0.26600000000000001 | K285: -0.16800000000000001 | L285: 32.91 | M285: 9.9900000000000003e-002 | N285: 275 | O285: 7.8e-002 | P285: 120.3 | Q285: 13.56 | R285: 12.88 | S285: 242.7 | T285: -9.0000000000000011e-003 | U285: 53天 | V285: 5.63年 | W285: 3.63年 | X285: 2.3e-002 | Y285: 5.5e-002 | Z285: 15 | AA285: 643 | AB285: -0.11800000000000001 | AC285: -0.12300000000000001 | AD285: -0.10300000000000001 | AE285: -0.10400000000000001 | AF285: 87.8 | AG285: 94.05 | AH285: 0.98 | AI285: AA | AJ285: 4.5599999999999995e-002 | AK285: =I285+100*T285 -> 239.69 | AL285: 238.5 | AM285: 291 | AN285: 144.4 | AO285: 291 | AP285: 0.35200000000000004 | AQ285: 5 | AR285: 福莱转债
A286: 222 | B286: 溢利转债! | C286: 123018 | D286: 43488. | E286: 溢多利 | F286: 300381 | G286: 医药 | H286: 原料药 | I286: 195.8 | J286: 2.7000000000000001e-003 | K286: 2.63e-002 | L286: 13.91 | M286: 3.04e-002 | N286: 18 | O286: 0.16699999999999998 | P286: 114.9 | Q286: 8.29 | R286: 2.41 | S286: 167.79 | T286: 0.16699999999999998 | U286: 转股中 | V286: 4.19年 | W286: 2.19年 | X286: 8.0000000000000002e-003 | Y286: 1.3999999999999999e-002 | Z286: 0.5 | AA286: 67 | AB286: -0.121 | AC286: -0.127 | AD286: -0.17100000000000001 | AE286: -0.17199999999999999 | AF286: 89.26 | AG286: 88.73 | AH286: 0.95 | AI286: AA- | AJ286: 6.5099999999999991e-002 | AK286: =I286+100*T286 -> 212.5 | AL286: 223.8 | AM286: 288 | AN286: 134.5 | AO286: 288 | AP286: -1.3999999999999999e-002 | AQ286: 12 | AR286: 溢利转债!
A287: 233 | B287: 科森转债!! | C287: 113521 | D287: 43441. | E287: 科森科技 | F287: 603626 | G287: 通信互联 | H287: 通信设备 | I287: 198.02 | J287: 7.0599999999999996e-002 | K287: 2.4e-002 | L287: 16.42 | M287: 9.9100000000000008e-002 | N287: 158 | O287: 1.24 | P287: 115.2 | Q287: 8.7 | R287: 3.81 | S287: 188.74 | T287: 4.9000000000000002e-002 | U287: 转股中 | V287: 4年36天 | W287: 2年36天 | X287: 8.0000000000000002e-003 | Y287: 1.4999999999999999e-002 | Z287: 0.6 | AA287: 80 | AB287: -0.126 | AC287: -0.13100000000000001 | AD287: -0.182 | AE287: -0.183 | AF287: 94.01 | AG287: 96.92 | AH287: 0.95 | AI287: AA | AJ287: 4.41e-002 | AK287: =I287+100*T287 -> 202.92000000000002 | AL287: 207.3 | AM287: 284 | AN287: 110.4 | AO287: 283 | AP287: 2.9999999999999999e-002 | AQ287: 25 | AR287: 科森转债!!
A288: 235 | B288: 百合转债! | C288: 113520 | D288: 43430. | E288: 梦百合 | F288: 603313 | G288: 其他 | H288: 家居用品 | I288: 201.15 | J288: 6.1399999999999996e-002 | K288: -4.5000000000000005e-003 | L288: 28.78 | M288: 5.8499999999999996e-002 | N288: 75 | O288: 0.58099999999999996 | P288: 115.2 | Q288: 14.28 | R288: 3.82 | S288: 201.54 | T288: -2.e-003 | U288: 转股中 | V288: 4年28天 | W288: 2年28天 | X288: 6.9999999999999993e-003 | Y288: 1.3000000000000001e-002 | Z288: 0.7 | AA288: 99 | AB288: -0.13 | AC288: -0.13500000000000001 | AD288: -0.188 | AE288: -0.18899999999999997 | AF288: 90.04 | AG288: 89.64 | AH288: 0.97 | AI288: AA- | AJ288: 6.5099999999999991e-002 | AK288: =I288+100*T288 -> 200.95000000000002 | AL288: 200.8 | AM288: 283 | AN288: 110.7 | AO288: 284 | AP288: -1.3000000000000001e-002 | AQ288: 11 | AR288: 百合转债!
A289: 289 | B289: 模塑转债!! | C289: 127004 | D289: 42963. | E289: 模塑科技 | F289: 700 | G289: 汽车 | H289: 零部件制 | I289: 167.45 | J289: 2.0400000000000001e-002 | K289: -1.11e-002 | L289: 6.26 | M289: 3.1300000000000001e-002 | N289: 158 | O289: 0.70400000000000007 | P289: 113.3 | Q289: 7.46 | R289: 2.15 | S289: 83.91 | T289: 0.995 | U289: 转股中 | V289: 2.64年 | W289: 0.64年 | X289: 2.3e-002 | Y289: 1.9e-002 | Z289: 1.3 | AA289: 57 | AB289: -0.13900000000000001 | AC289: -0.14699999999999999 | AD289: -0.496 | AE289: -0.498 | AF289: 98.41 | AG289: 101.59 | AH289: 0.3 | AI289: AA | AJ289: 4.2900000000000001e-002 | AK289: =I289+100*T289 -> 266.94999999999999 | AL289: 251 | AM289: 292 | AN289: 149.4 | AO289: 292 | AP289: -6.8000000000000005e-002 | AQ289: 37 | AR289: 模塑转债!!
A290: 247 | B290: 盛路转债!! | C290: 128041 | D290: 43326. | E290: 盛路通信 | F290: 2446 | G290: 通信互联 | H290: 通信设备 | I290: 199.3 | J290: 2.4399999999999998e-002 | K290: -6.1999999999999998e-003 | L290: 7.56 | M290: 1.89e-002 | N290: 287 | O290: 2.7200000000000002 | P290: 114.3 | Q290: 6.85 | R290: 2.39 | S290: 110.36 | T290: 0.80599999999999994 | U290: 转股中 | V290: 3.76年 | W290: 1.76年 | X290: 8.0000000000000002e-003 | Y290: 9.0000000000000011e-003 | Z290: 0.5 | AA290: 68 | AB290: -0.13900000000000001 | AC290: -0.14499999999999999 | AD290: -0.22600000000000001 | AE290: -0.22699999999999998 | AF290: 94.64 | AG290: 97.45 | AH290: 0.96 | AI290: AA | AJ290: 4.41e-002 | AK290: =I290+100*T290 -> 279.89999999999998 | AL290: 288.2 | AM290: 294 | AN290: 190.8 | AO290: 294 | AP290: -4.4000000000000004e-002 | AQ290: 12 | AR290: 盛路转债!!
A291: 169 | B291: 晶瑞转债! | C291: 123031 | D291: 43734. | E291: 晶瑞股份 | F291: 300655 | G291: 化工 | H291: 化工 | I291: 245.281 | J291: 3.2799999999999996e-002 | K291: 1.3600000000000001e-002 | L291: 42.55 | M291: 4.7300000000000002e-002 | N291: 661 | O291: 4.2599999999999998 | P291: 115.8 | Q291: 18.53 | R291: 6.42 | S291: 229.63 | T291: 6.8000000000000005e-002 | U291: 转股中 | V291: 4.88年 | W291: 2.88年 | X291: 8.0000000000000002e-003 | Y291: 1.8000000000000002e-002 | Z291: 0.6 | AA291: 80 | AB291: -0.14400000000000002 | AC291: -0.14899999999999999 | AD291: -0.14800000000000002 | AE291: -0.14800000000000002 | AF291: 82.75 | AG291: 81.48 | AH291: 0.98 | AI291: A+ | AJ291: 7.6100000000000001e-002 | AK291: =I291+100*T291 -> 252.08100000000002 | AL291: 260.9 | AM291: 293 | AN291: 178.2 | AO291: 293 | AP291: 0.14300000000000002 | AQ291: 14 | AR291: 晶瑞转债!
A292: 270 | B292: 天康转债!! | C292: 128030 | D292: 43129. | E292: 天康生物 | F292: 2100 | G292: 农业 | H292: 畜牧业 | I292: 191.8 | J292: 9.7000000000000003e-003 | K292: 1.04e-002 | L292: 14.7 | M292: 2.0099999999999996e-002 | N292: 21 | O292: 0.111 | P292: 112.3 | Q292: 7.85 | R292: 2.99 | S292: 187.26 | T292: 2.4e-002 | U292: 转股中 | V292: 3.20年 | W292: 1.20年 | X292: 6.0000000000000001e-003 | Y292: 1.2e-002 | Z292: 1 | AA292: 158 | AB292: -0.157 | AC292: -0.16200000000000001 | AD292: -0.32899999999999996 | AE292: -0.33000000000000002 | AF292: 96.98 | AG292: 98.13 | AH292: 1 | AI292: AA | AJ292: 4.41e-002 | AK292: =I292+100*T292 -> 194.20000000000002 | AL292: 196.3 | AM292: 282 | AN292: 98.2 | AO292: 281 | AP292: -2.6000000000000002e-002 | AQ292: 10 | AR292: 天康转债!!
A293: 240 | B293: 东音转债!! | C293: 128043 | D293: 43339. | E293: 罗欣药业 | F293: 2793 | G293: 医药 | H293: 化学制药 | I293: 218.71 | J293: 2.2000000000000002e-002 | K293: 4.1999999999999997e-003 | L293: 13.69 | M293: 2.6200000000000001e-002 | N293: 45 | O293: 0.627 | P293: 114.5 | Q293: 6.22 | R293: 5.11 | S293: 220.1 | T293: -6.0000000000000001e-003 | U293: 转股中 | V293: 3.81年 | W293: 1.81年 | X293: 2.e-003 | Y293: 4.0000000000000001e-003 | Z293: 0.3 | AA293: 199 | AB293: -0.158 | AC293: -0.16399999999999998 | AD293: -0.24100000000000002 | AE293: -0.24199999999999999 | AF293: 94.49 | AG293: 97.44 | AH293: 1 | AI293: AA | AJ293: 4.41e-002 | AK293: =I293+100*T293 -> 218.11000000000001 | AL293: 217.3 | AM293: 287 | AN293: 119.9 | AO293: 285 | AP293: -9.3000000000000013e-002 | AQ293: 10 | AR293: 东音转债!!
A294: 271 | B294: 太阳转债!! | C294: 128029 | D294: 43116. | E294: 太阳纸业 | F294: 2078 | G294: 造纸包装 | H294: 造纸行业 | I294: 168 | J294: -1.1999999999999999e-003 | K294: 1.9e-003 | L294: 14.11 | M294: 7.000000000000001e-004 | N294: 16 | O294: 9.0000000000000011e-003 | P294: 107.8 | Q294: 8.55 | R294: 2.38 | S294: 165.03 | T294: 1.8000000000000002e-002 | U294: 转股中 | V294: 2.20年 | W294: 0.20年 | X294: 2.9999999999999999e-002 | Y294: 5.0000000000000003e-002 | Z294: 11 | AA294: 366 | AB294: -0.184 | AC294: -0.19 | AD294: -1.169 | AE294: -1.1719999999999999 | AF294: 99.51 | AG294: 98.81 | AH294: 1 | AI294: AA+ | AJ294: 4.0899999999999999e-002 | AK294: =I294+100*T294 -> 169.80000000000001 | AL294: 171 | AM294: 277 | AN294: 71.5 | AO294: 268 | AP294: 1.6e-002 | AQ294: 7 | AR294: 太阳转债!!
A295: 254 | B295: 新泉转债!! | C295: 113509 | D295: 43273. | E295: 新泉股份 | F295: 603179 | G295: 汽车 | H295: 零部件制 | I295: 231.52 | J295: 5.6600000000000004e-002 | K295: -1.46e-002 | L295: 32.61 | M295: 4.2900000000000001e-002 | N295: 116 | O295: 0.38299999999999995 | P295: 110.3 | Q295: 14.22 | R295: 5.25 | S295: 229.32 | T295: 1.e-002 | U295: 转股中 | V295: 3.65年 | W295: 1.65年 | X295: 1.3000000000000001e-002 | Y295: 2.9999999999999999e-002 | Z295: 1.3 | AA295: 101 | AB295: -0.187 | AC295: -0.19 | AD295: -0.28100000000000003 | AE295: -0.28199999999999997 | AF295: 95.12 | AG295: 94.53 | AH295: 0.98 | AI295: AA | AJ295: 4.41e-002 | AK295: =I295+100*T295 -> 232.52000000000001 | AL295: 233.7 | AM295: 289 | AN295: 138.6 | AO295: 289 | AP295: 2.1000000000000001e-002 | AQ295: 10 | AR295: 新泉转债!!
A296: 221 | B296: 凯龙转债! | C296: 128052 | D296: 43486. | E296: 凯龙股份 | F296: 2783 | G296: 化工 | H296: 化工 | I296: 278.497 | J296: 1.2699999999999999e-002 | K296: 4.6600000000000003e-002 | L296: 12.69 | M296: 5.9299999999999999e-002 | N296: 242 | O296: 2.7000000000000002 | P296: 115 | Q296: 6.67 | R296: 2.79 | S296: 190.25 | T296: 0.46399999999999997 | U296: 转股中 | V296: 4.19年 | W296: 2.19年 | X296: 6.9999999999999993e-003 | Y296: 1.3000000000000001e-002 | Z296: 0.3 | AA296: 48 | AB296: -0.193 | AC296: -0.19800000000000001 | AD296: -0.22899999999999998 | AE296: -0.22899999999999998 | AF296: 93.59 | AG296: 96.35 | AH296: 1 | AI296: AA | AJ296: 4.41e-002 | AK296: =I296+100*T296 -> 324.89699999999999 | AL296: 366.7 | AM296: 296 | AN296: 270.4 | AO296: 296 | AP296: -2.7000000000000003e-002 | AQ296: 12 | AR296: 凯龙转债!
A297: 251 | B297: 广电转债!! | C297: 110044 | D297: 43305. | E297: 广电网络 | F297: 600831 | G297: 传媒娱乐 | H297: 影视娱乐 | I297: 274.89 | J297: 2.8300000000000002e-002 | K297: -7.9000000000000008e-003 | L297: 7.57 | M297: 2.9900000000000003e-002 | N297: 650 | O297: 3.3199999999999998 | P297: 112.3 | Q297: 6.9 | R297: 1.46 | S297: 109.71 | T297: 1.51 | U297: 转股中 | V297: 3.71年 | W297: 1.71年 | X297: 1.3000000000000001e-002 | Y297: 1.3999999999999999e-002 | Z297: 0.7 | AA297: 54 | AB297: -0.217 | AC297: -0.221 | AD297: -0.30399999999999999 | AE297: -0.30399999999999999 | AF297: 94.86 | AG297: 95.97 | AH297: 0.68 | AI297: AA | AJ297: 4.41e-002 | AK297: =I297+100*T297 -> 425.88999999999999 | AL297: 440.1 | AM297: 297 | AN297: 344.1 | AO297: 297 | AP297: -3.5000000000000003e-002 | AQ297: 11 | AR297: 广电转债!!
A298: 139 | B298: 振德转债! | C298: 113555 | D298: 43844. | E298: 振德医疗 | F298: 603301 | G298: 医药 | H298: 医疗器械 | I298: 505.65 | J298: 4.4699999999999997e-002 | K298: -2.9999999999999997e-004 | L298: 71.57 | M298: 4.4999999999999998e-002 | N298: 936 | O298: 0.84599999999999997 | P298: 124.8 | Q298: 14.01 | R298: 6.43 | S298: 510.85 | T298: -1.e-002 | U298: 转股中 | V298: 5.19年 | W298: 3.19年 | X298: 1.4999999999999999e-002 | Y298: 7.6999999999999999e-002 | Z298: 2.1 | AA298: 142 | AB298: -0.23999999999999999 | AC298: -0.245 | AD298: -0.17899999999999999 | AE298: -0.17899999999999999 | AF298: 84.62 | AG298: 90.08 | AH298: 0.99 | AI298: AA- | AJ298: 6.6600000000000006e-002 | AK298: =I298+100*T298 -> 504.64999999999998 | AL298: 500.5 | AM298: 298 | AN298: 410.4 | AO298: 298 | AP298: 8.5999999999999993e-002 | AQ298: 16 | AR298: 振德转债!
A299: 244 | B299: 横河转债! | C299: 123013 | D299: 43332. | E299: 横河模具 | F299: 300539 | G299: 机械装备 | H299: 专用设备 | I299: 323.99 | J299: -9.1999999999999998e-003 | K299: 3.5499999999999997e-002 | L299: 8.79 | M299: 4.1500000000000002e-002 | N299: 474 | O299: 3.8100000000000001 | P299: 115.2 | Q299: 9.13 | R299: 3.99 | S299: 96.28 | T299: 2.3700000000000001 | U299: 转股中 | V299: 3.79年 | W299: 1.79年 | X299: 1.9e-002 | Y299: 1.9e-002 | Z299: 0.4 | AA299: 20 | AB299: -0.24199999999999999 | AC299: -0.247 | AD299: -0.314 | AE299: -0.315 | AF299: 89.66 | AG299: 87.79 | AH299: 0.63 | AI299: A+ | AJ299: 7.6100000000000001e-002 | AK299: =I299+100*T299 -> 560.99000000000001 | AL299: 551.7 | AM299: 299 | AN299: 462 | AO299: 299 | AP299: -1.2e-002 | AQ299: 14 | AR299: 横河转债!
A300: 232 | B300: 特发转债! | C300: 127008 | D300: 43459. | E300: 特发信息 | F300: 70 | G300: 通信互联 | H300: 通信设备 | I300: 263.5 | J300: 2.0499999999999997e-002 | K300: 4.1999999999999997e-003 | L300: 9.94 | M300: 2.4700000000000003e-002 | N300: 75 | O300: 0.47399999999999998 | P300: 111.1 | Q300: 5.54 | R300: 2.89 | S300: 179.42 | T300: 0.46899999999999997 | U300: 转股中 | V300: 3年36天 | W300: 1年36天 | X300: 6.9999999999999993e-003 | Y300: 1.3000000000000001e-002 | Z300: 0.6 | AA300: 81 | AB300: -0.24600000000000002 | AC300: -0.25 | AD300: -0.47299999999999998 | AE300: -0.47299999999999998 | AF300: 96.47 | AG300: 97.4 | AH300: 1 | AI300: AA | AJ300: 4.41e-002 | AK300: =I300+100*T300 -> 310.39999999999998 | AL300: 347.6 | AM300: 295 | AN300: 250.2 | AO300: 295 | AP300: -3.7000000000000005e-002 | AQ300: 15 | AR300: 特发转债!
A301: 173 | B301: 英科转债! | C301: 123029 | D301: 43718. | E301: 英科医疗 | F301: 300677 | G301: 医药 | H301: 医疗器械 | I301: 1000 | J301: 4.2999999999999997e-002 | K301: -1.6399999999999998e-002 | L301: 154.84 | M301: 2.6800000000000001e-002 | N301: 739 | O301: 0.53500000000000003 | P301: 138.2 | Q301: 16.11 | R301: 9.36 | S301: 961.14 | T301: 4.0000000000000001e-002 | U301: 转股中 | V301: 4.85年 | W301: 2.85年 | X301: 4.0000000000000001e-003 | Y301: 3.7999999999999999e-002 | Z301: 1.4 | AA301: 344 | AB301: -0.34100000000000003 | AC301: -0.34799999999999998 | AD301: -0.23600000000000002 | AE301: -0.23600000000000002 | AF301: 89 | AG301: 102.84 | AH301: 0.99 | AI301: AA- | AJ301: 6.5099999999999991e-002 | AK301: =I301+100*T301 -> 1004. | AL301: 1038.9000000000001 | AM301: 300 | AN301: 936 | AO301: 300 | AP301: 0.13 | AQ301: 15 | AR301: 英科转债!