A1: 序号 | B1: 转债代码 | C1: 转债名称 | D1: 股票代码 | E1: 股票名称 | F1: 行业 | G1: 子行业 | H1: 转债价格 | I1: 涨跌 | J1: 日内套利 | K1: 股价 | L1: 涨跌 | M1: 剩余本息 | N1: 转股价格 | O1: 转股溢价率 | P1: 转股价值 | Q1: 距离转股日 | R1: 剩余年限 | S1: 回售年限 | T1: 转债余额 | U1: 转债成交额 | V1: 转债换手率 | W1: 余额/市值 | X1: 余额/股本 | Y1: 股票市值 | Z1: P/B | AA1: 税前收益率 | AB1: 税后收益率 | AC1: 税前回售收益 | AD1: 税后回售收益 | AE1: 回售价值 | AF1: 纯债价值 | AG1: 弹性 | AH1: 信用 | AI1: 折现率 | AJ1: 双低 | AK1: 老式双低 | AL1: 老式排名 | AM1: 新式双低 | AN1: 新式排名 | AO1: MA20乖离 | AP1: 热门度 | AQ1: 转债名称
A2: 209 | B2: 128062 | C2: 亚药转债! | D2: 2370 | E2: 亚太药业 | F2: 医药 | G2: 化学制药 | H2: 75.251 | I2: -1.38e-002 | J2: 1.38e-002 | K2: 4.45 | L2: 0. | M2: 119.8 | N2: 16.25 | O2: 1.75 | P2: 27.38 | Q2: 转股中 | R2: 4.38年 | S2: 2.38年 | T2: 9.64 | U2: 26 | V2: 3.5000000000000003e-002 | W2: 0.40399999999999997 | X2: 0.111 | Y2: 24 | Z2: 7.42 | AA2: 0.114 | AB2: 0.105 | AC2: 0.13400000000000001 | AD2: 0.13100000000000001 | AE2: 81.96 | AF2: 80.81 | AG2: 0 | AH2: A- | AI2: 9.6000000000000002e-002 | AJ2: =H2+100*O2 -> 250.251 | AK2: 123.1 | AL2: 21 | AM2: 41.2 | AN2: 121 | AO2: -5.0999999999999997e-002 | AP2: 85 | AQ2: 亚药转债!
A3: 61 | B3: 127018 | C3: 本钢转债! | D3: 761 | E3: 本钢板材 | F3: 钢铁 | G3: 炼钢 | H3: 85.825 | I3: -5.1200000000000002e-002 | J3: 5.0199999999999995e-002 | K3: 3.27 | L3: -6.0999999999999995e-003 | M3: 128.6 | N3: 5.03 | O3: 0.32000000000000001 | P3: 65.01 | Q3: 52天 | R3: 5.62年 | S3: 3.62年 | T3: 68 | U3: 405 | V3: 6.8000000000000005e-002 | W3: 0.53700000000000003 | X3: 0.34899999999999998 | Y3: 127 | Z3: 0.64 | AA3: 7.6999999999999999e-002 | AB3: 6.7599999999999993e-002 | AC3: 5.9299999999999999e-002 | AD3: 5.57e-002 | AE3: 88.41 | AF3: 98.07 | AG3: 0.18 | AH3: AAA | AI3: 5.0900000000000001e-002 | AJ3: =H3+100*O3 -> 117.825 | AK3: 106.6 | AL3: 1 | AM3: 8.6 | AN3: 1 | AO3: -1.9e-002 | AP3: 34 | AQ3: 本钢转债!
A4: 229 | B4: 113527 | C4: 维格转债! | D4: 603518 | E4: 锦泓集团 | F4: 服装纺织 | G4: 服装行业 | H4: 91.47 | I4: -7.4999999999999997e-003 | J4: 7.0999999999999995e-003 | K4: 5.8 | L4: -5.1000000000000004e-003 | M4: 120.2 | N4: 9.85 | O4: 0.55299999999999994 | P4: 58.88 | Q4: 转股中 | R4: 4.20年 | S4: 2.20年 | T4: 7.46 | U4: 4.4 | V4: 6.0000000000000001e-003 | W4: 0.51000000000000001 | X4: 0.29999999999999999 | Y4: 15 | Z4: 0.93 | AA4: 6.8900000000000003e-002 | AB4: 5.9699999999999996e-002 | AC4: 5.45e-002 | AD4: 5.1299999999999998e-002 | AE4: 91.57 | AF4: 96.87 | AG4: 0.08 | AH4: AA | AI4: 5.4000000000000006e-002 | AJ4: =H4+100*O4 -> 146.76999999999998 | AK4: 124.1 | AL4: 22 | AM4: 27.2 | AN4: 15 | AO4: -0.10199999999999999 | AP4: 100 | AQ4: 维格转债!
A5: 285 | B5: 128023 | C5: 亚太转债! | D5: 2284 | E5: 亚太股份 | F5: 汽车 | G5: 零部件制 | H5: 95.872 | I5: -2.e-003 | J5: 2.e-003 | K5: 5.24 | L5: -1.9e-003 | M5: 112.3 | N5: 10.34 | O5: 0.89200000000000002 | P5: 50.68 | Q5: 转股中 | R5: 3年21天 | S5: 1年21天 | T5: 9.99 | U5: 5.1 | V5: 5.0000000000000001e-003 | W5: 0.25800000000000001 | X5: 0.13100000000000001 | Y5: 39 | Z5: 1.59 | AA5: 5.4400000000000004e-002 | AB5: 4.6399999999999997e-002 | AC5: 5.9400000000000001e-002 | AD5: 5.45e-002 | AE5: 97.58 | AF5: 98.76 | AG5: 0.01 | AH5: AA | AI5: 4.4000000000000004e-002 | AJ5: =H5+100*O5 -> 185.072 | AK5: 141.1 | AL5: 185 | AM5: 42.3 | AN5: 133 | AO5: -1.8000000000000002e-002 | AP5: 64 | AQ5: 亚太转债!
A6: 50 | B6: 127019 | C6: 国城转债! | D6: 688 | E6: 国城矿业 | F6: 有色金属 | G6: 锌铅镍锡 | H6: 90.891 | I6: -1.21e-002 | J6: 1.11e-002 | K6: 10.62 | L6: -1.3899999999999999e-002 | M6: 115.1 | N6: 21.07 | O6: 0.80299999999999994 | P6: 50.4 | Q6: 2月9天 | R6: 5.67年 | S6: 3.67年 | T6: 8.5 | U6: 19 | V6: 2.5000000000000001e-002 | W6: 7.0000000000000007e-002 | X6: 3.5000000000000003e-002 | Y6: 121 | Z6: 5.46 | AA6: 4.3299999999999998e-002 | AB6: 3.8199999999999998e-002 | AC6: 3.5000000000000003e-002 | AD6: 3.3099999999999997e-002 | AE6: 87.34 | AF6: 89.66 | AG6: 0.07 | AH6: AA | AI6: 4.5899999999999996e-002 | AJ6: =H6+100*O6 -> 171.191 | AK6: 131.4 | AL6: 102 | AM6: 41.7 | AN6: 124 | AO6: -3.7999999999999999e-002 | AP6: 25 | AQ6: 国城转债!
A7: 207 | B7: 128063 | C7: 未来转债 | D7: 2631 | E7: 德尔未来 | F7: 其他 | G7: 家居用品 | H7: 107.1 | I7: -2.9999999999999997e-004 | J7: -2.0000000000000001e-004 | K7: 7.07 | L7: -1.4000000000000002e-003 | M7: 128.2 | N7: 8.61 | O7: 0.30399999999999999 | P7: 82.11 | Q7: 转股中 | R7: 4.39年 | S7: 3.39年 | T7: 6.3 | U7: 5.9 | V7: 9.0000000000000011e-003 | W7: 0.13300000000000001 | X7: 0.109 | Y7: 47 | Z7: 2.68 | AA7: 4.3099999999999999e-002 | AB7: 3.2000000000000001e-002 | AC7: 4.6999999999999993e-003 | AD7: 0. | AE7: 87.51 | AF7: 98.06 | AG7: 0.33 | AH7: AA- | AI7: 6.5000000000000002e-002 | AJ7: =H7+100*O7 -> 137.5 | AK7: 132.1 | AL7: 108 | AM7: 34 | AN7: 49 | AO7: 1.7000000000000001e-002 | AP7: 34 | AQ7: 未来转债
A8: 266 | B8: 128037 | C8: 岩土转债! | D8: 2542 | E8: 中化岩土 | F8: 建筑 | G8: 建筑工程 | H8: 97.99 | I8: -6.6e-003 | J8: 6.6e-003 | K8: 3.42 | L8: -2.8999999999999998e-003 | M8: 112.3 | N8: 7.99 | O8: 1.29 | P8: 42.8 | Q8: 转股中 | R8: 3.33年 | S8: 1.33年 | T8: 5.99 | U8: 4.8 | V8: 8.0000000000000002e-003 | W8: 9.6999999999999989e-002 | X8: 4.2000000000000003e-002 | Y8: 62 | Z8: 1.52 | AA8: 4.2599999999999999e-002 | AB8: 3.5400000000000001e-002 | AC8: 3.2799999999999996e-002 | AD8: 2.8900000000000002e-002 | AE8: 96.42 | AF8: 97.57 | AG8: 0 | AH8: AA | AI8: 4.4000000000000004e-002 | AJ8: =H8+100*O8 -> 226.99000000000001 | AK8: 153.2 | AL8: 245 | AM8: 55.6 | AN8: 210 | AO8: 0. | AP8: 47 | AQ8: 岩土转债!
A9: 297 | B9: 128015 | C9: 久其转债! | D9: 2279 | E9: 久其软件 | F9: 计算机及 | G9: 软件开发 | H9: 99.945 | I9: -6.0999999999999995e-003 | J9: 6.0999999999999995e-003 | K9: 5.28 | L9: 5.6999999999999993e-003 | M9: 110.8 | N9: 9.48 | O9: 0.79400000000000004 | P9: 55.7 | Q9: 转股中 | R9: 2.57年 | S9: 0.57年 | T9: 7.8 | U9: 16 | V9: 2.1000000000000001e-002 | W9: 0.20800000000000002 | X9: 0.11599999999999999 | Y9: 38 | Z9: 5.32 | AA9: 4.1599999999999998e-002 | AB9: 3.3399999999999999e-002 | AC9: 2.2000000000000002e-002 | AD9: 1.77e-002 | AE9: 96.31 | AF9: 92.27 | AG9: 0 | AH9: A+ | AI9: 7.51e-002 | AJ9: =H9+100*O9 -> 179.345 | AK9: 144.2 | AL9: 205 | AM9: 47.9 | AN9: 170 | AO9: -6.5000000000000002e-002 | AP9: 54 | AQ9: 久其转债!
A10: 276 | B10: 113017 | C10: 吉视转债! | D10: 601929 | E10: 吉视传媒 | F10: 传媒娱乐 | G10: 影视娱乐 | H10: 97.67 | I10: -2.2000000000000002e-002 | J10: 2.1400000000000002e-002 | K10: 2.09 | L10: -4.7999999999999996e-003 | M10: 109.8 | N10: 2.95 | O10: 0.379 | P10: 70.85 | Q10: 转股中 | R10: 3年44天 | S10: 1年44天 | T10: 15.6 | U10: 28 | V10: 1.8000000000000002e-002 | W10: 0.23999999999999999 | X10: 0.17000000000000001 | Y10: 65 | Z10: 0.98 | AA10: 3.9100000000000003e-002 | AB10: 3.2799999999999996e-002 | AC10: 3.9e-002 | AD10: 3.49e-002 | AE10: 97.32 | AF10: 96.84 | AG10: 0.13 | AH10: AA+ | AI10: 4.2000000000000003e-002 | AJ10: =H10+100*O10 -> 135.56999999999999 | AK10: 124.5 | AL10: 26 | AM10: 27.2 | AN10: 14 | AO10: -1.7000000000000001e-002 | AP10: 52 | AQ10: 吉视转债!
A11: 212 | B11: 113530 | C11: 大丰转债! | D11: 603081 | E11: 大丰实业 | F11: 建筑 | G11: 装饰工程 | H11: 104.45 | I11: 2.0000000000000001e-004 | J11: -5.0000000000000001e-004 | K11: 11.39 | L11: -2.5999999999999999e-003 | M11: 121.6 | N11: 16.64 | O11: 0.52600000000000002 | P11: 68.45 | Q11: 转股中 | R11: 4.37年 | S11: 2.37年 | T11: 6.3 | U11: 2.6 | V11: 4.0000000000000001e-003 | W11: 0.13800000000000001 | X11: 9.4e-002 | Y11: 46 | Z11: 2.23 | AA11: 3.6200000000000003e-002 | AB11: 2.7400000000000001e-002 | AC11: -3.5999999999999999e-003 | AD11: -6.3e-003 | AE11: 92.93 | AF11: 101.15 | AG11: 0.12 | AH11: AA | AI11: 4.4000000000000004e-002 | AJ11: =H11+100*O11 -> 157.05000000000001 | AK11: 140.5 | AL11: 179 | AM11: 39.3 | AN11: 97 | AO11: -1.1000000000000001e-002 | AP11: 34 | AQ11: 大丰转债!
A12: 138 | B12: 128093 | C12: 百川转债! | D12: 2455 | E12: 百川股份 | F12: 化工 | G12: 化工 | H12: 109.769 | I12: -1.e-003 | J12: 6.7000000000000002e-003 | K12: 5.28 | L12: 1.15e-002 | M12: 130.3 | N12: 5.87 | O12: 0.22 | P12: 89.95 | Q12: 转股中 | R12: 5年51天 | S12: 3年51天 | T12: 5.2 | U12: 3.2 | V12: 6.0000000000000001e-003 | W12: 0.19 | X12: 0.17100000000000001 | Y12: 27 | Z12: 2.11 | AA12: 3.5200000000000002e-002 | AB12: 2.5099999999999997e-002 | AC12: -6.8000000000000005e-003 | AD12: -1.09e-002 | AE12: 87.06 | AF12: 94.55 | AG12: 0.5 | AH12: AA- | AI12: 6.6900000000000001e-002 | AJ12: =H12+100*O12 -> 131.76900000000001 | AK12: 129.6 | AL12: 73 | AM12: 35 | AN12: 57 | AO12: 3.4000000000000002e-002 | AP12: 45 | AQ12: 百川转债!
A13: 257 | B13: 110045 | C13: 海澜转债! | D13: 600398 | E13: 海澜之家 | F13: 服装纺织 | G13: 服装行业 | H13: 98.11 | I13: -4.0000000000000001e-003 | J13: 3.4000000000000002e-003 | K13: 6.89 | L13: -1.15e-002 | M13: 111.1 | N13: 11.75 | O13: 0.67299999999999993 | P13: 58.64 | Q13: 转股中 | R13: 3.66年 | S13: 1.66年 | T13: 29.5 | U13: 4.8 | V13: 2.e-003 | W13: 9.9000000000000005e-002 | X13: 5.7999999999999996e-002 | Y13: 298 | Z13: 2.34 | AA13: 3.5000000000000003e-002 | AB13: 2.92e-002 | AC13: 2.1700000000000001e-002 | AD13: 1.95e-002 | AE13: 94.66 | AF13: 95.76 | AG13: 0.05 | AH13: AA+ | AI13: 4.2000000000000003e-002 | AJ13: =H13+100*O13 -> 165.41 | AK13: 137.6 | AL13: 157 | AM13: 41.8 | AN13: 126 | AO13: -2.1000000000000001e-002 | AP13: 59 | AQ13: 海澜转债!
A14: 92 | B14: 113573 | C14: 纵横转债! | D14: 603602 | E14: 纵横通信 | F14: 通信互联 | G14: 通信设备 | H14: 104.11 | I14: 1.1599999999999999e-002 | J14: -1.3500000000000002e-002 | K14: 11.76 | L14: -8.3999999999999995e-003 | M14: 124.7 | N14: 18.81 | O14: 0.66500000000000004 | P14: 62.52 | Q14: 转股中 | R14: 5.42年 | S14: 3.42年 | T14: 2.7 | U14: 41 | V14: 0.14599999999999999 | W14: 0.113 | X14: 7.0000000000000007e-002 | Y14: 24 | Z14: 3.56 | AA14: 3.4599999999999999e-002 | AB14: 2.6699999999999998e-002 | AC14: 1.4000000000000002e-003 | AD14: -1.1000000000000001e-003 | AE14: 80.19 | AF14: 83.83 | AG14: 0.23 | AH14: A+ | AI14: 7.7899999999999997e-002 | AJ14: =H14+100*O14 -> 170.61000000000001 | AK14: 145.7 | AL14: 214 | AM14: 61.9 | AN14: 236 | AO14: -4.0999999999999995e-002 | AP14: 17 | AQ14: 纵横转债!
A15: 197 | B15: 113535 | C15: 大业转债! | D15: 603278 | E15: 大业股份 | F15: 汽车 | G15: 零部件制 | H15: 100.92 | I15: -2.3e-003 | J15: 5.6999999999999993e-003 | K15: 8.53 | L15: 2.4e-002 | M15: 113.1 | N15: 12.4 | O15: 0.46700000000000003 | P15: 68.79 | Q15: 转股中 | R15: 3.49年 | S15: 1.49年 | T15: 5 | U15: 3.6 | V15: 6.9999999999999993e-003 | W15: 0.20199999999999999 | X15: 0.13900000000000001 | Y15: 25 | Z15: 1.51 | AA15: 3.3700000000000001e-002 | AB15: 2.6600000000000002e-002 | AC15: 5.6000000000000008e-003 | AD15: 3.4000000000000002e-003 | AE15: 94.89 | AF15: 97.53 | AG15: 0.14 | AH15: AA | AI15: 4.4000000000000004e-002 | AJ15: =H15+100*O15 -> 147.62 | AK15: 133 | AL15: 120 | AM15: 35.5 | AN15: 63 | AO15: 2.7000000000000003e-002 | AP15: 48 | AQ15: 大业转债!
A16: 122 | B16: 113569 | C16: 科达转债! | D16: 603660 | E16: 苏州科达 | F16: 通信互联 | G16: 物联网 | H16: 101.67 | I16: 1.8e-003 | J16: 1.e-004 | K16: 8.47 | L16: 1.32e-002 | M16: 120.7 | N16: 14.84 | O16: 0.78099999999999992 | P16: 57.08 | Q16: 转股中 | R16: 5.32年 | S16: 3.32年 | T16: 5.16 | U16: 1.7 | V16: 3.0000000000000001e-003 | W16: 0.122 | X16: 7.0000000000000007e-002 | Y16: 42 | Z16: 2.48 | AA16: 3.3500000000000002e-002 | AB16: 2.6499999999999999e-002 | AC16: 6.7000000000000002e-003 | AD16: 4.4000000000000003e-003 | AE16: 83.25 | AF16: 86.19 | AG16: 0.14 | AH16: AA- | AI16: 6.6900000000000001e-002 | AJ16: =H16+100*O16 -> 179.76999999999998 | AK16: 146.3 | AL16: 218 | AM16: 60.1 | AN16: 229 | AO16: -3.7999999999999999e-002 | AP16: 22 | AQ16: 科达转债!
A17: 59 | B17: 113591 | C17: 胜达转债! | D17: 603687 | E17: 大胜达 | F17: 造纸包装 | G17: 包装用纸 | H17: 102.84 | I17: -2.5000000000000001e-003 | J17: -5.0000000000000001e-004 | K17: 10.62 | L17: -8.3999999999999995e-003 | M17: 122.2 | N17: 14.73 | O17: 0.42599999999999999 | P17: 72.1 | Q17: 56天 | R17: 5.63年 | S17: 3.63年 | T17: 5.5 | U17: 9.9 | V17: 1.8000000000000002e-002 | W17: 0.126 | X17: 9.0999999999999998e-002 | Y17: 44 | Z17: 2.81 | AA17: 3.1800000000000002e-002 | AB17: 2.4799999999999999e-002 | AC17: 3.3e-003 | AD17: 1.1999999999999999e-003 | AE17: 81.65 | AF17: 85.54 | AG17: 0.36 | AH17: AA- | AI17: 6.6900000000000001e-002 | AJ17: =H17+100*O17 -> 145.44 | AK17: 133.6 | AL17: 127 | AM17: 48 | AN17: 173 | AO17: -4.7e-002 | AP17: 18 | AQ17: 胜达转债!
A18: 12 | B18: 128132 | C18: 交建转债! | D18: 2941 | E18: 新疆交建 | F18: 建筑 | G18: 建筑工程 | H18: 98.529 | I18: -5.8999999999999999e-003 | J18: 1.6000000000000001e-003 | K18: 13.36 | L18: -1.55e-002 | M18: 117.3 | N18: 18.57 | O18: 0.37 | P18: 71.94 | Q18: 4月9天 | R18: 5.84年 | S18: 3.84年 | T18: 8.5 | U18: 11 | V18: 1.3000000000000001e-002 | W18: 9.9000000000000005e-002 | X18: 7.0999999999999994e-002 | Y18: 86 | Z18: 3.56 | AA18: 3.0899999999999997e-002 | AB18: 2.5399999999999999e-002 | AC18: 1.32e-002 | AD18: 1.1299999999999999e-002 | AE18: 86.87 | AF18: 90.7 | AG18: 0.28 | AH18: AA | AI18: 4.5899999999999996e-002 | AJ18: =H18+100*O18 -> 135.529 | AK18: 125.1 | AL18: 32 | AM18: 34.4 | AN18: 53 | AO18: -1.3999999999999999e-002 | AP18: 7 | AQ18: 交建转债!
A19: 293 | B19: 113016 | C19: 小康转债! | D19: 601127 | E19: 小康股份 | F19: 汽车 | G19: 零部件制 | H19: 99.98 | I19: -4.0000000000000002e-004 | J19: 2.e-003 | K19: 9.82 | L19: 3.8100000000000002e-002 | M19: 109.3 | N19: 15.7 | O19: 0.59799999999999998 | P19: 62.55 | Q19: 转股中 | R19: 2.98年 | S19: 0.98年 | T19: 8.81 | U19: 6.7 | V19: 8.0000000000000002e-003 | W19: 7.0999999999999994e-002 | X19: 4.4999999999999998e-002 | Y19: 124 | Z19: 2.14 | AA19: 3.0800000000000001e-002 | AB19: 2.4700000000000003e-002 | AC19: 1.5900000000000001e-002 | AD19: 1.2699999999999999e-002 | AE19: 97 | AF19: 96.57 | AG19: 0.04 | AH19: AA | AI19: 4.3099999999999999e-002 | AJ19: =H19+100*O19 -> 159.78 | AK19: 137.4 | AL19: 153 | AM19: 40.4 | AN19: 116 | AO19: 4.9000000000000002e-002 | AP19: 45 | AQ19: 小康转债!
A20: 170 | B20: 110059 | C20: 浦发转债! | D20: 600000 | E20: 浦发银行 | F20: 金融 | G20: 银行行业 | H20: 101.6 | I20: -4.5999999999999999e-003 | J20: 3.4999999999999996e-003 | K20: 9.36 | L20: -7.4000000000000003e-003 | M20: 117.6 | N20: 14.45 | O20: 0.56899999999999995 | P20: 64.78 | Q20: 转股中 | R20: 4.96年 | S20: 无权 | T20: 500 | U20: 288 | V20: 6.0000000000000001e-003 | W20: 0.182 | X20: 0.11800000000000001 | Y20: 2747. | Z20: 0.54 | AA20: 3.0800000000000001e-002 | AB20: 2.4199999999999999e-002 | AC20: 无权 | AD20: 无权 | AE20: 无权 | AF20: 97.78 | AG20: 0.15 | AH20: AAA | AI20: 3.9e-002 | AJ20: =H20+100*O20 -> 158.5 | AK20: 138.4 | AL20: 162 | AM20: 40.6 | AN20: 119 | AO20: -1.3000000000000001e-002 | AP20: 76 | AQ20: 浦发转债!
A21: 63 | B21: 113589 | C21: 天创转债! | D21: 603608 | E21: 天创时尚 | F21: 服装纺织 | G21: 鞋服行业 | H21: 97.64 | I21: -3.0999999999999999e-003 | J21: 2.5999999999999999e-003 | K21: 7.85 | L21: -2.5000000000000001e-003 | M21: 115.3 | N21: 12.44 | O21: 0.54700000000000004 | P21: 63.1 | Q21: 50天 | R21: 5.61年 | S21: 3.61年 | T21: 6 | U21: 4.4 | V21: 8.0000000000000002e-003 | W21: 0.17800000000000002 | X21: 0.11199999999999999 | Y21: 34 | Z21: 1.58 | AA21: 3.0699999999999998e-002 | AB21: 2.5600000000000001e-002 | AC21: 1.6500000000000001e-002 | AD21: 1.4499999999999999e-002 | AE21: 87.76 | AF21: 90.08 | AG21: 0.19 | AH21: AA | AI21: 4.5899999999999996e-002 | AJ21: =H21+100*O21 -> 152.34 | AK21: 132.2 | AL21: 109 | AM21: 42.1 | AN21: 129 | AO21: -3.7999999999999999e-002 | AP21: 10 | AQ21: 天创转债!
A22: 25 | B22: 113600 | C22: 新星转债! | D22: 603978 | E22: 深圳新星 | F22: 有色金属 | G22: 有色行业 | H22: 106.5 | I22: -5.9999999999999995e-004 | J22: 1.7000000000000001e-003 | K22: 19.48 | L22: 2.5999999999999999e-003 | M22: 126 | N22: 23.85 | O22: 0.30399999999999999 | P22: 81.68 | Q22: 3月8天 | R22: 5.75年 | S22: 3.75年 | T22: 5.95 | U22: 7.9 | V22: 1.2e-002 | W22: 0.191 | X22: 0.156 | Y22: 31 | Z22: 2.04 | AA22: 3.0200000000000001e-002 | AB22: 2.2499999999999999e-002 | AC22: -6.3e-003 | AD22: -8.199999999999999e-003 | AE22: 80.85 | AF22: 87.46 | AG22: 0.45 | AH22: AA- | AI22: 6.6900000000000001e-002 | AJ22: =H22+100*O22 -> 136.90000000000001 | AK22: 131.3 | AL22: 99 | AM22: 43.9 | AN22: 143 | AO22: -1.e-003 | AP22: 10 | AQ22: 新星转债!
A23: 148 | B23: 110064 | C23: 建工转债! | D23: 600939 | E23: 重庆建工 | F23: 建筑 | G23: 建筑工程 | H23: 104.05 | I23: -2.8999999999999998e-003 | J23: 1.e-003 | K23: 3.82 | L23: -5.1999999999999998e-003 | M23: 120.2 | N23: 4.57 | O23: 0.245 | P23: 83.59 | Q23: 转股中 | R23: 5年37天 | S23: 3年37天 | T23: 16.6 | U23: 1.6 | V23: 1.e-003 | W23: 0.23899999999999999 | X23: 0.20000000000000001 | Y23: 69 | Z23: 1.01 | AA23: 2.9399999999999999e-002 | AB23: 2.23e-002 | AC23: 1.4000000000000002e-003 | AD23: -1.2999999999999999e-003 | AE23: 91 | AF23: 97.07 | AG23: 0.37 | AH23: AA+ | AI23: 4.3899999999999995e-002 | AJ23: =H23+100*O23 -> 128.55000000000001 | AK23: 124.5 | AL23: 27 | AM23: 27.4 | AN23: 16 | AO23: -8.0000000000000002e-003 | AP23: 48 | AQ23: 建工转债!
A24: 223 | B24: 110052 | C24: 贵广转债! | D24: 600996 | E24: 贵广网络 | F24: 传媒娱乐 | G24: 影视娱乐 | H24: 105.21 | I24: -7.0999999999999995e-003 | J24: 5.5000000000000005e-003 | K24: 6.28 | L24: -6.3e-003 | M24: 118.5 | N24: 7.94 | O24: 0.33000000000000002 | P24: 79.09 | Q24: 转股中 | R24: 4.31年 | S24: 2.31年 | T24: 15.3 | U24: 8 | V24: 5.0000000000000001e-003 | W24: 0.23100000000000001 | X24: 0.183 | Y24: 66 | Z24: 1.46 | AA24: 2.87e-002 | AB24: 2.0899999999999998e-002 | AC24: -5.4000000000000003e-003 | AD24: -8.3999999999999995e-003 | AE24: 93.91 | AF24: 99.67 | AG24: 0.26 | AH24: AA+ | AI24: 4.2000000000000003e-002 | AJ24: =H24+100*O24 -> 138.20999999999998 | AK24: 131.3 | AL24: 100 | AM24: 31.7 | AN24: 28 | AO24: -6.2e-002 | AP24: 19 | AQ24: 贵广转债!
A25: 96 | B25: 110070 | C25: 凌钢转债! | D25: 600231 | E25: 凌钢股份 | F25: 钢铁 | G25: 炼钢 | H25: 101.65 | I25: -1.0800000000000001e-002 | J25: 7.1999999999999998e-003 | K25: 2.28 | L25: -8.6999999999999994e-003 | M25: 117.8 | N25: 2.75 | O25: 0.22600000000000001 | P25: 82.91 | Q25: 转股中 | R25: 5.41年 | S25: 3.41年 | T25: 4.4 | U25: 3.6 | V25: 8.0000000000000002e-003 | W25: 7.0000000000000007e-002 | X25: 5.7999999999999996e-002 | Y25: 63 | Z25: 0.79 | AA25: 2.8199999999999999e-002 | AB25: 2.2200000000000001e-002 | AC25: 6.8000000000000005e-003 | AD25: 4.5999999999999999e-003 | AE25: 88.84 | AF25: 92.88 | AG25: 0.41 | AH25: AA | AI25: 4.5899999999999996e-002 | AJ25: =H25+100*O25 -> 124.25 | AK25: 120.4 | AL25: 9 | AM25: 27.5 | AN25: 17 | AO25: 3.3000000000000002e-002 | AP25: 15 | AQ25: 凌钢转债!
A26: 299 | B26: 128014 | C26: 永东转债! | D26: 2753 | E26: 永东股份 | F26: 化工 | G26: 化工 | H26: 104.21 | I26: 1.e-004 | J26: -1.e-004 | K26: 8.38 | L26: 1.1999999999999999e-003 | M26: 111.3 | N26: 12.6 | O26: 0.56700000000000006 | P26: 66.51 | Q26: 转股中 | R26: 2.42年 | S26: 0.42年 | T26: 3.37 | U26: 2.3 | V26: 6.9999999999999993e-003 | W26: 0.107 | X26: 7.0999999999999994e-002 | Y26: 31 | Z26: 1.79 | AA26: 2.7999999999999997e-002 | AB26: 1.9099999999999999e-002 | AC26: -3.9e-002 | AD26: -4.4699999999999997e-002 | AE26: 98.14 | AF26: 96.01 | AG26: 0.02 | AH26: AA- | AI26: 6.4100000000000004e-002 | AJ26: =H26+100*O26 -> 160.91 | AK26: 141.9 | AL26: 194 | AM26: 43.8 | AN26: 142 | AO26: 1.8000000000000002e-002 | AP26: 39 | AQ26: 永东转债!
A27: 248 | B27: 128044 | C27: 岭南转债! | D27: 2717 | E27: 岭南股份 | F27: 城市公用 | G27: 生态环境 | H27: 100.666 | I27: -1.1999999999999999e-003 | J27: 2.8000000000000004e-003 | K27: 4.11 | L27: 9.7999999999999997e-003 | M27: 111.3 | N27: 5.91 | O27: 0.44799999999999995 | P27: 69.54 | Q27: 转股中 | R27: 3.75年 | S27: 1.75年 | T27: 6.59 | U27: 2 | V27: 3.0000000000000001e-003 | W27: 0.105 | X27: 7.2999999999999995e-002 | Y27: 63 | Z27: 1.28 | AA27: 2.7699999999999999e-002 | AB27: 2.1899999999999999e-002 | AC27: 1.11e-002 | AD27: 8.199999999999999e-003 | AE27: 94.71 | AF27: 94.99 | AG27: 0.16 | AH27: AA | AI27: 4.4000000000000004e-002 | AJ27: =H27+100*O27 -> 145.46600000000001 | AK27: 131.8 | AL27: 107 | AM27: 36.8 | AN27: 72 | AO27: 2.7000000000000003e-002 | AP27: 31 | AQ27: 岭南转债!
A28: 224 | B28: 113021 | C28: 中信转债! | D28: 601998 | E28: 中信银行 | F28: 金融 | G28: 银行行业 | H28: 106.01 | I28: -5.5000000000000005e-003 | J28: 3.7000000000000002e-003 | K28: 5.06 | L28: -9.7999999999999997e-003 | M28: 118.8 | N28: 6.98 | O28: 0.46200000000000002 | P28: 72.49 | Q28: 转股中 | R28: 4.30年 | S28: 无权 | T28: 400 | U28: 40 | V28: 1.e-003 | W28: 0.16200000000000001 | X28: 0.11699999999999999 | Y28: 2476. | Z28: 0.54 | AA28: 2.7699999999999999e-002 | AB28: 1.9699999999999999e-002 | AC28: 无权 | AD28: 无权 | AE28: 无权 | AF28: 101.28 | AG28: 0.19 | AH28: AAA | AI28: 3.9e-002 | AJ28: =H28+100*O28 -> 152.21000000000001 | AK28: 139.5 | AL28: 170 | AM28: 38.2 | AN28: 85 | AO28: -1.9e-002 | AP28: 53 | AQ28: 中信转债!
A29: 123 | B29: 113568 | C29: 新春转债 | D29: 603667 | E29: 五洲新春 | F29: 机械装备 | G29: 通用设备 | H29: 108.59 | I29: -2.8999999999999998e-003 | J29: 3.5999999999999999e-003 | K29: 8.39 | L29: 1.1999999999999999e-003 | M29: 124.8 | N29: 8.91 | O29: 0.153 | P29: 94.16 | Q29: 转股中 | R29: 5.31年 | S29: 3.31年 | T29: 3.3 | U29: 9.1 | V29: 2.5000000000000001e-002 | W29: 0.13500000000000001 | X29: 0.127 | Y29: 25 | Z29: 1.42 | AA29: 2.7200000000000002e-002 | AB29: 1.9099999999999999e-002 | AC29: -1.0500000000000001e-002 | AD29: -1.3100000000000001e-002 | AE29: 83.87 | AF29: 89.25 | AG29: 0.58 | AH29: AA- | AI29: 6.6900000000000001e-002 | AJ29: =H29+100*O29 -> 123.89 | AK29: 123 | AL29: 16 | AM29: 33.8 | AN29: 45 | AO29: -6.4000000000000001e-002 | AP29: 45 | AQ29: 新春转债
A30: 246 | B30: 113519 | C30: 长久转债! | D30: 603569 | E30: 长久物流 | F30: 交通运输 | G30: 物流业 | H30: 107.59 | I30: -1.1200000000000002e-002 | J30: 1.52e-002 | K30: 8.68 | L30: 1.7600000000000001e-002 | M30: 119.3 | N30: 11.15 | O30: 0.38200000000000001 | P30: 77.85 | Q30: 转股中 | R30: 3.98年 | S30: 1.98年 | T30: 6.97 | U30: 3.7 | V30: 5.0000000000000001e-003 | W30: 0.14300000000000002 | X30: 0.11199999999999999 | Y30: 49 | Z30: 2.28 | AA30: 2.6699999999999998e-002 | AB30: 1.8100000000000002e-002 | AC30: -2.1099999999999997e-002 | AD30: -2.3599999999999999e-002 | AE30: 93.77 | AF30: 100.78 | AG30: 0.23 | AH30: AA | AI30: 4.4000000000000004e-002 | AJ30: =H30+100*O30 -> 145.79000000000002 | AK30: 137.3 | AL30: 152 | AM30: 36.6 | AN30: 69 | AO30: -0.111 | AP30: 16 | AQ30: 长久转债!
A31: 115 | B31: 128100 | C31: 搜特转债! | D31: 2503 | E31: 搜于特 | F31: 服装纺织 | G31: 服装行业 | H31: 102.24 | I31: -5.0000000000000001e-003 | J31: 3.4000000000000002e-003 | K31: 2.29 | L31: -4.3e-003 | M31: 117.3 | N31: 2.9 | O31: 0.29499999999999998 | P31: 78.97 | Q31: 转股中 | R31: 5.33年 | S31: 3.33年 | T31: 8 | U31: 5.2 | V31: 6.0000000000000001e-003 | W31: 0.113 | X31: 8.900000000000001e-002 | Y31: 71 | Z31: 1.29 | AA31: 2.6699999999999998e-002 | AB31: 2.07e-002 | AC31: 4.4000000000000003e-003 | AD31: 2.3e-003 | AE31: 88.89 | AF31: 92.81 | AG31: 0.35 | AH31: AA | AI31: 4.5899999999999996e-002 | AJ31: =H31+100*O31 -> 131.74000000000001 | AK31: 125.5 | AL31: 33 | AM31: 32.7 | AN31: 34 | AO31: -5.2999999999999999e-002 | AP31: 42 | AQ31: 搜特转债!
A32: 275 | B32: 128033 | C32: 迪龙转债! | D32: 2658 | E32: 雪迪龙 | F32: 城市公用 | G32: 三废处理 | H32: 101.6 | I32: -6.7000000000000002e-003 | J32: 7.0999999999999995e-003 | K32: 6.32 | L32: 3.2000000000000002e-003 | M32: 109.8 | N32: 8.83 | O32: 0.41999999999999998 | P32: 71.57 | Q32: 转股中 | R32: 3年44天 | S32: 1年44天 | T32: 5.2 | U32: 4.5 | V32: 8.0000000000000002e-003 | W32: 0.13600000000000001 | X32: 9.6999999999999989e-002 | Y32: 38 | Z32: 1.89 | AA32: 2.5699999999999997e-002 | AB32: 1.9599999999999999e-002 | AC32: 7.3000000000000001e-003 | AD32: 3.4000000000000002e-003 | AE32: 97.08 | AF32: 96.28 | AG32: 0.14 | AH32: AA | AI32: 4.4000000000000004e-002 | AJ32: =H32+100*O32 -> 143.59999999999999 | AK32: 131.6 | AL32: 105 | AM32: 34.5 | AN32: 54 | AO32: 3.1e-002 | AP32: 37 | AQ32: 迪龙转债!
A33: 153 | B33: 128085 | C33: 鸿达转债 | D33: 2002 | E33: 鸿达兴业 | F33: 化工 | G33: 化工 | H33: 110.019 | I33: -2.2000000000000001e-003 | J33: 2.2000000000000001e-003 | K33: 3.8 | L33: 0. | M33: 124.8 | N33: 3.92 | O33: 0.13500000000000001 | P33: 96.94 | Q33: 转股中 | R33: 5年33天 | S33: 3年33天 | T33: 24.3 | U33: 13 | V33: 5.0000000000000001e-003 | W33: 0.247 | X33: 0.23899999999999999 | Y33: 98 | Z33: 1.38 | AA33: 2.5699999999999997e-002 | AB33: 1.7299999999999999e-002 | AC33: -1.6399999999999998e-002 | AD33: -1.89e-002 | AE33: 90.28 | AF33: 99.83 | AG33: 0.5 | AH33: AA | AI33: 4.5899999999999996e-002 | AJ33: =H33+100*O33 -> 123.51900000000001 | AK33: 123.1 | AL33: 19 | AM33: 23.3 | AN33: 6 | AO33: 1.4999999999999999e-002 | AP33: 85 | AQ33: 鸿达转债
A34: 43 | B34: 113595 | C34: 花王转债 | D34: 603007 | E34: 花王股份 | F34: 城市公用 | G34: 生态环境 | H34: 109.17 | I34: -1.5100000000000001e-002 | J34: -1.3999999999999999e-002 | K34: 6.61 | L34: -4.7599999999999996e-002 | M34: 125.3 | N34: 6.94 | O34: 0.14599999999999999 | P34: 95.24 | Q34: 2月15天 | R34: 5.69年 | S34: 3.69年 | T34: 3.3 | U34: 80 | V34: 0.222 | W34: 0.14899999999999999 | X34: 0.14199999999999999 | Y34: 22 | Z34: 1.99 | AA34: 2.5000000000000001e-002 | AB34: 1.7399999999999999e-002 | AC34: -1.21e-002 | AD34: -1.4199999999999999e-002 | AE34: 81.45 | AF34: 87.4 | AG34: 0.61 | AH34: AA- | AI34: 6.6900000000000001e-002 | AJ34: =H34+100*O34 -> 123.77 | AK34: 123.1 | AL34: 18 | AM34: 35.7 | AN34: 64 | AO34: -7.8e-002 | AP34: 26 | AQ34: 花王转债
A35: 32 | B35: 113597 | C35: 佳力转债! | D35: 603912 | E35: 佳力图 | F35: 机械装备 | G35: 专用设备 | H35: 108.86 | I35: 2.9999999999999997e-004 | J35: -1.e-003 | K35: 18.16 | L35: -1.6000000000000001e-003 | M35: 124.5 | N35: 23.4 | O35: 0.40299999999999997 | P35: 77.61 | Q35: 2月24天 | R35: 5.71年 | S35: 3.71年 | T35: 3 | U35: 2.2 | V35: 6.9999999999999993e-003 | W35: 7.5999999999999998e-002 | X35: 5.9000000000000004e-002 | Y35: 39 | Z35: 4.54 | AA35: 2.4300000000000002e-002 | AB35: 1.6899999999999998e-002 | AC35: -1.0800000000000001e-002 | AD35: -1.3000000000000001e-002 | AE35: 81.47 | AF35: 86.71 | AG35: 0.42 | AH35: AA- | AI35: 6.6900000000000001e-002 | AJ35: =H35+100*O35 -> 149.16 | AK35: 140.1 | AL35: 174 | AM35: 53.4 | AN35: 196 | AO35: 2.e-003 | AP35: 7 | AQ35: 佳力转债!
A36: 278 | B36: 128032 | C36: 双环转债! | D36: 2472 | E36: 双环传动 | F36: 机械装备 | G36: 通用设备 | H36: 102.61 | I36: -8.5000000000000006e-003 | J36: 1.1399999999999999e-002 | K36: 7.2 | L36: 1.9799999999999998e-002 | M36: 110.3 | N36: 9.89 | O36: 0.40899999999999997 | P36: 72.8 | Q36: 转股中 | R36: 3年42天 | S36: 1年42天 | T36: 10 | U36: 22 | V36: 2.2000000000000002e-002 | W36: 0.20199999999999999 | X36: 0.14699999999999999 | Y36: 49 | Z36: 1.48 | AA36: 2.4e-002 | AB36: 1.7600000000000001e-002 | AC36: 1.5e-003 | AD36: -2.8000000000000004e-003 | AE36: 97.34 | AF36: 96.76 | AG36: 0.15 | AH36: AA | AI36: 4.4000000000000004e-002 | AJ36: =H36+100*O36 -> 143.50999999999999 | AK36: 132.4 | AL36: 112 | AM36: 35.1 | AN36: 58 | AO36: 0.11699999999999999 | AP36: 45 | AQ36: 双环转债!
A37: 225 | B37: 113528 | C37: 长城转债! | D37: 603897 | E37: 长城科技 | F37: 机械装备 | G37: 专用设备 | H37: 106.95 | I37: -1.1200000000000002e-002 | J37: 1.1399999999999999e-002 | K37: 20.5 | L37: 5.0000000000000001e-004 | M37: 117.6 | N37: 23.45 | O37: 0.223 | P37: 87.42 | Q37: 转股中 | R37: 4.30年 | S37: 2.30年 | T37: 6.34 | U37: 6.7 | V37: 1.e-002 | W37: 0.17300000000000001 | X37: 0.152 | Y37: 37 | Z37: 2 | AA37: 2.29e-002 | AB37: 1.54e-002 | AC37: -1.1699999999999999e-002 | AD37: -1.4800000000000001e-002 | AE37: 89.2 | AF37: 90.34 | AG37: 0.49 | AH37: AA- | AI37: 6.5000000000000002e-002 | AJ37: =H37+100*O37 -> 129.25 | AK37: 126.5 | AL37: 42 | AM37: 36.1 | AN37: 67 | AO37: 1.8000000000000002e-002 | AP37: 45 | AQ37: 长城转债!
A38: 201 | B38: 127013 | C38: 创维转债! | D38: 810 | E38: 创维数字 | F38: 电子 | G38: 电子产品 | H38: 107 | I38: -3.2000000000000002e-003 | J38: 5.6000000000000008e-003 | K38: 8.99 | L38: 9.0000000000000011e-003 | M38: 117.9 | N38: 11.39 | O38: 0.35600000000000004 | P38: 78.93 | Q38: 转股中 | R38: 4.42年 | S38: 2.42年 | T38: 9.78 | U38: 1.2 | V38: 1.e-003 | W38: 0.10199999999999999 | X38: 8.1000000000000003e-002 | Y38: 96 | Z38: 2.46 | AA38: 2.2599999999999999e-002 | AB38: 1.5300000000000001e-002 | AC38: -1.3300000000000001e-002 | AD38: -1.5800000000000002e-002 | AE38: 92.61 | AF38: 97.84 | AG38: 0.27 | AH38: AA | AI38: 4.4000000000000004e-002 | AJ38: =H38+100*O38 -> 142.59999999999999 | AK38: 135.1 | AL38: 139 | AM38: 37.2 | AN38: 77 | AO38: -4.2000000000000003e-002 | AP38: 24 | AQ38: 创维转债!
A39: 269 | B39: 113505 | C39: 杭电转债! | D39: 603618 | E39: 杭电股份 | F39: 能源电力 | G39: 电力设备 | H39: 104.5 | I39: -7.000000000000001e-004 | J39: 9.7000000000000003e-003 | K39: 5.81 | L39: 3.2000000000000001e-002 | M39: 112.3 | N39: 7.14 | O39: 0.28399999999999997 | P39: 81.37 | Q39: 转股中 | R39: 3.31年 | S39: 1.31年 | T39: 7.5 | U39: 7.1 | V39: 9.0000000000000011e-003 | W39: 0.187 | X39: 0.152 | Y39: 40 | Z39: 1.58 | AA39: 2.2499999999999999e-002 | AB39: 1.54e-002 | AC39: -1.1200000000000002e-002 | AD39: -1.4800000000000001e-002 | AE39: 96.53 | AF39: 97.68 | AG39: 0.28 | AH39: AA | AI39: 4.4000000000000004e-002 | AJ39: =H39+100*O39 -> 132.90000000000001 | AK39: 127.6 | AL39: 53 | AM39: 29.9 | AN39: 22 | AO39: 3.2000000000000001e-002 | AP39: 39 | AQ39: 杭电转债!
A40: 264 | B40: 113508 | C40: 新凤转债! | D40: 603225 | E40: 新凤鸣 | F40: 服装纺织 | G40: 纺织行业 | H40: 104.18 | I40: 1.e-003 | J40: 3.9000000000000003e-003 | K40: 11.16 | L40: 3.2400000000000005e-002 | M40: 112.3 | N40: 15.78 | O40: 0.47299999999999998 | P40: 70.72 | Q40: 转股中 | R40: 3.45年 | S40: 1.45年 | T40: 21.5 | U40: 15 | V40: 6.9999999999999993e-003 | W40: 0.13800000000000001 | X40: 9.8000000000000004e-002 | Y40: 156 | Z40: 1.38 | AA40: 2.2400000000000003e-002 | AB40: 1.5700000000000002e-002 | AC40: -8.3000000000000001e-003 | AD40: -1.1599999999999999e-002 | AE40: 95.95 | AF40: 97.09 | AG40: 0.15 | AH40: AA | AI40: 4.4000000000000004e-002 | AJ40: =H40+100*O40 -> 151.48000000000002 | AK40: 137.6 | AL40: 158 | AM40: 40.5 | AN40: 118 | AO40: 5.4000000000000006e-002 | AP40: 26 | AQ40: 新凤转债!
A41: 20 | B41: 113601 | C41: 塞力转债 | D41: 603716 | E41: 塞力斯 | F41: 医药 | G41: 医药商业 | H41: 107.29 | I41: -5.8999999999999999e-003 | J41: 2.0400000000000001e-002 | K41: 16.2 | L41: 2.2099999999999998e-002 | M41: 121.3 | N41: 16.98 | O41: 0.125 | P41: 95.41 | Q41: 3月16天 | R41: 5.77年 | S41: 3.77年 | T41: 5.43 | U41: 7.2 | V41: 1.2e-002 | W41: 0.16399999999999998 | X41: 0.156 | Y41: 33 | Z41: 2.18 | AA41: 2.2000000000000002e-002 | AB41: 1.54e-002 | AC41: -7.4000000000000003e-003 | AD41: -9.4999999999999998e-003 | AE41: 81.01 | AF41: 84.17 | AG41: 0.65 | AH41: AA- | AI41: 6.6900000000000001e-002 | AJ41: =H41+100*O41 -> 119.79000000000001 | AK41: 119.2 | AL41: 8 | AM41: 35 | AN41: 56 | AO41: 3.9e-002 | AP41: 16 | AQ41: 塞力转债
A42: 152 | B42: 128087 | C42: 孚日转债! | D42: 2083 | E42: 孚日股份 | F42: 服装纺织 | G42: 家纺 | H42: 101.7 | I42: 1.e-004 | J42: -1.e-004 | K42: 4.98 | L42: 0. | M42: 113.3 | N42: 6.3 | O42: 0.28699999999999998 | P42: 79.05 | Q42: 转股中 | R42: 5年34天 | S42: 3年34天 | T42: 6.5 | U42: 6 | V42: 9.0000000000000011e-003 | W42: 0.14400000000000002 | X42: 0.114 | Y42: 45 | Z42: 1.2 | AA42: 2.1899999999999999e-002 | AB42: 1.7000000000000001e-002 | AC42: 6.4000000000000003e-003 | AD42: 4.0999999999999995e-003 | AE42: 89.84 | AF42: 90.6 | AG42: 0.37 | AH42: AA | AI42: 4.5899999999999996e-002 | AJ42: =H42+100*O42 -> 130.40000000000001 | AK42: 124.4 | AL42: 24 | AM42: 33.7 | AN42: 44 | AO42: -5.0000000000000001e-003 | AP42: 51 | AQ42: 孚日转债!
A43: 183 | B43: 128072 | C43: 翔鹭转债! | D43: 2842 | E43: 翔鹭钨业 | F43: 有色金属 | G43: 小金属 | H43: 104.39 | I43: 5.1999999999999998e-003 | J43: 1.5e-003 | K43: 10.46 | L43: 2.4500000000000001e-002 | M43: 115.1 | N43: 15.34 | O43: 0.53100000000000003 | P43: 68.19 | Q43: 转股中 | R43: 4.77年 | S43: 2.77年 | T43: 3.02 | U43: 11 | V43: 3.5000000000000003e-002 | W43: 0.106 | X43: 7.2000000000000008e-002 | Y43: 29 | Z43: 3.15 | AA43: 2.1099999999999997e-002 | AB43: 1.5300000000000001e-002 | AC43: -3.2000000000000002e-003 | AD43: -5.4000000000000003e-003 | AE43: 86.13 | AF43: 85.76 | AG43: 0.28 | AH43: AA- | AI43: 6.5000000000000002e-002 | AJ43: =H43+100*O43 -> 157.49000000000001 | AK43: 140.6 | AL43: 181 | AM43: 54.5 | AN43: 205 | AO43: 5.5e-002 | AP43: 26 | AQ43: 翔鹭转债!
A44: 103 | B44: 127016 | C44: 鲁泰转债 | D44: 726 | E44: 鲁 泰Ａ | F44: 服装纺织 | G44: 纺织行业 | H44: 104.001 | I44: -1.1299999999999999e-002 | J44: 8.199999999999999e-003 | K44: 6.74 | L44: -1.03e-002 | M44: 116.2 | N44: 8.91 | O44: 0.375 | P44: 75.65 | Q44: 转股中 | R44: 5.40年 | S44: 3.40年 | T44: 14 | U44: 13 | V44: 9.0000000000000011e-003 | W44: 0.24199999999999999 | X44: 0.183 | Y44: 58 | Z44: 0.75 | AA44: 2.1099999999999997e-002 | AB44: 1.5700000000000002e-002 | AC44: -8.0000000000000004e-004 | AD44: -2.8000000000000004e-003 | AE44: 89.09 | AF44: 92.54 | AG44: 0.3 | AH44: AA+ | AI44: 4.3899999999999995e-002 | AJ44: =H44+100*O44 -> 141.501 | AK44: 132.4 | AL44: 111 | AM44: 39.8 | AN44: 107 | AO44: -6.0999999999999999e-002 | AP44: 22 | AQ44: 鲁泰转债
A45: 57 | B45: 128117 | C45: 道恩转债 | D45: 2838 | E45: 道恩股份 | F45: 化工 | G45: 橡胶塑料 | H45: 110.1 | I45: 5.8999999999999999e-003 | J45: -2.6000000000000002e-002 | K45: 26.3 | L45: -3.56e-002 | M45: 123.5 | N45: 29.07 | O45: 0.217 | P45: 90.47 | Q45: 56天 | R45: 5.63年 | S45: 3.63年 | T45: 3.6 | U45: 46 | V45: 0.11599999999999999 | W45: 3.4000000000000002e-002 | X45: 2.9999999999999999e-002 | Y45: 107 | Z45: 6.22 | AA45: 2.1000000000000001e-002 | AB45: 1.38e-002 | AC45: -1.54e-002 | AD45: -1.7299999999999999e-002 | AE45: 81.39 | AF45: 86.35 | AG45: 0.56 | AH45: AA- | AI45: 6.6900000000000001e-002 | AJ45: =H45+100*O45 -> 131.79999999999998 | AK45: 129.7 | AL45: 76 | AM45: 43.4 | AN45: 139 | AO45: -6.7000000000000004e-002 | AP45: 14 | AQ45: 道恩转债
A46: 172 | B46: 113546 | C46: 迪贝转债! | D46: 603320 | E46: 迪贝电气 | F46: 家电 | G46: 零部件制 | H46: 109.09 | I46: 1.0500000000000001e-002 | J46: -9.1000000000000004e-003 | K46: 12.66 | L46: 2.3999999999999998e-003 | M46: 120.6 | N46: 14.1 | O46: 0.215 | P46: 89.79 | Q46: 转股中 | R46: 4.94年 | S46: 2.94年 | T46: 2.3 | U46: 20 | V46: 8.1000000000000003e-002 | W46: 0.14000000000000001 | X46: 0.125 | Y46: 16 | Z46: 2.47 | AA46: 2.0899999999999998e-002 | AB46: 1.3600000000000001e-002 | AC46: -1.5600000000000001e-002 | AD46: -1.8000000000000002e-002 | AE46: 82.98 | AF46: 84.63 | AG46: 0.58 | AH46: A+ | AI46: 7.5999999999999998e-002 | AJ46: =H46+100*O46 -> 130.59 | AK46: 128.4 | AL46: 59 | AM46: 43.8 | AN46: 141 | AO46: -9.0000000000000011e-003 | AP46: 43 | AQ46: 迪贝转债!
A47: 283 | B47: 128026 | C47: 众兴转债! | D47: 2772 | E47: 众兴菌业 | F47: 农业 | G47: 种植业 | H47: 103.688 | I47: -6.7000000000000002e-003 | J47: 2.5000000000000001e-003 | K47: 8.97 | L47: -1.8600000000000002e-002 | M47: 110.3 | N47: 11.45 | O47: 0.32400000000000001 | P47: 78.34 | Q47: 转股中 | R47: 3年30天 | S47: 1年30天 | T47: 9.19 | U47: 7.9 | V47: 8.0000000000000002e-003 | W47: 0.27899999999999997 | X47: 0.218 | Y47: 33 | Z47: 1.34 | AA47: 2.0799999999999999e-002 | AB47: 1.43e-002 | AC47: -6.8999999999999999e-003 | AD47: -1.1299999999999999e-002 | AE47: 95.11 | AF47: 91.27 | AG47: 0.22 | AH47: AA- | AI47: 6.5000000000000002e-002 | AJ47: =H47+100*O47 -> 136.08799999999999 | AK47: 129 | AL47: 66 | AM47: 33.9 | AN47: 47 | AO47: -3.3000000000000002e-002 | AP47: 57 | AQ47: 众兴转债!
A48: 234 | B48: 113524 | C48: 奇精转债! | D48: 603677 | E48: 奇精机械 | F48: 家电 | G48: 零部件制 | H48: 108.8 | I48: 5.5000000000000005e-003 | J48: -9.0000000000000011e-003 | K48: 11.96 | L48: -9.8999999999999991e-003 | M48: 117.9 | N48: 14.08 | O48: 0.28100000000000003 | P48: 84.94 | Q48: 转股中 | R48: 4年31天 | S48: 2年31天 | T48: 3.3 | U48: 4.7 | V48: 1.3000000000000001e-002 | W48: 0.14400000000000002 | X48: 0.122 | Y48: 23 | Z48: 2.4 | AA48: 2.0299999999999999e-002 | AB48: 1.24e-002 | AC48: -2.2599999999999999e-002 | AD48: -2.5399999999999999e-002 | AE48: 93.96 | AF48: 99.26 | AG48: 0.35 | AH48: AA | AI48: 4.4000000000000004e-002 | AJ48: =H48+100*O48 -> 136.90000000000001 | AK48: 132.7 | AL48: 116 | AM48: 33.4 | AN48: 41 | AO48: -7.400000000000001e-002 | AP48: 45 | AQ48: 奇精转债!
A49: 56 | B49: 128118 | C49: 瀛通转债 | D49: 2861 | E49: 瀛通通讯 | F49: 电子 | G49: 电子产品 | H49: 109.499 | I49: 4.5999999999999999e-003 | J49: -6.8000000000000005e-003 | K49: 23.18 | L49: -4.3e-003 | M49: 122.1 | N49: 27.53 | O49: 0.29999999999999999 | P49: 84.2 | Q49: 56天 | R49: 5.63年 | S49: 3.63年 | T49: 3 | U49: 4.7 | V49: 1.3999999999999999e-002 | W49: 0.106 | X49: 8.900000000000001e-002 | Y49: 28 | Z49: 2.65 | AA49: 2.e-002 | AB49: 1.3100000000000001e-002 | AC49: -1.21e-002 | AD49: -1.44e-002 | AE49: 82.01 | AF49: 85.51 | AG49: 0.52 | AH49: AA- | AI49: 6.6900000000000001e-002 | AJ49: =H49+100*O49 -> 139.499 | AK49: 134.8 | AL49: 138 | AM49: 49.3 | AN49: 178 | AO49: -2.7999999999999997e-002 | AP49: 7 | AQ49: 瀛通转债
A50: 151 | B50: 113557 | C50: 森特转债 | D50: 603098 | E50: 森特股份 | F50: 建筑 | G50: 建筑工程 | H50: 109.68 | I50: -3.0000000000000001e-003 | J50: 3.5999999999999999e-003 | K50: 9.58 | L50: 1.e-003 | M50: 120.7 | N50: 10.11 | O50: 0.157 | P50: 94.76 | Q50: 转股中 | R50: 5年36天 | S50: 3年36天 | T50: 6 | U50: 4.2 | V50: 6.0000000000000001e-003 | W50: 0.13 | X50: 0.124 | Y50: 46 | Z50: 2.22 | AA50: 1.9400000000000001e-002 | AB50: 1.2199999999999999e-002 | AC50: -1.6299999999999999e-002 | AD50: -1.8600000000000002e-002 | AE50: 84.45 | AF50: 87.42 | AG50: 0.61 | AH50: AA- | AI50: 6.6900000000000001e-002 | AJ50: =H50+100*O50 -> 125.38000000000001 | AK50: 124.6 | AL50: 28 | AM50: 37.2 | AN50: 76 | AO50: 1.2e-002 | AP50: 35 | AQ50: 森特转债
A51: 255 | B51: 123011 | C51: 德尔转债! | D51: 300473 | E51: 德尔股份 | F51: 汽车 | G51: 零部件制 | H51: 108.555 | I51: 3.7599999999999995e-002 | J51: -3.6400000000000002e-002 | K51: 26.56 | L51: 3.8e-003 | M51: 116.3 | N51: 34.54 | O51: 0.41200000000000003 | P51: 76.9 | Q51: 转股中 | R51: 3.68年 | S51: 1.68年 | T51: 2.51 | U51: 115 | V51: 0.42799999999999999 | W51: 8.3000000000000004e-002 | X51: 6.4000000000000001e-002 | Y51: 30 | Z51: 1.35 | AA51: 1.9299999999999998e-002 | AB51: 1.1200000000000002e-002 | AC51: -2.9300000000000003e-002 | AD51: -3.2199999999999999e-002 | AE51: 91.61 | AF51: 92.66 | AG51: 0.29 | AH51: AA- | AI51: 6.5000000000000002e-002 | AJ51: =H51+100*O51 -> 149.755 | AK51: 140.2 | AL51: 176 | AM51: 47.6 | AN51: 167 | AO51: -5.2000000000000005e-002 | AP51: 38 | AQ51: 德尔转债!
A52: 161 | B52: 128081 | C52: 海亮转债! | D52: 2203 | E52: 海亮股份 | F52: 有色金属 | G52: 铜金属 | H52: 105 | I52: -1.2199999999999999e-002 | J52: 1.1299999999999999e-002 | K52: 7.85 | L52: -2.5000000000000001e-003 | M52: 115.2 | N52: 9.76 | O52: 0.30499999999999999 | P52: 80.43 | Q52: 转股中 | R52: 5年8天 | S52: 3年8天 | T52: 31.5 | U52: 29 | V52: 9.0000000000000011e-003 | W52: 0.20600000000000002 | X52: 0.16500000000000001 | Y52: 153 | Z52: 1.7 | AA52: 1.9e-002 | AB52: 1.34e-002 | AC52: -3.9000000000000003e-003 | AD52: -6.1999999999999998e-003 | AE52: 90.02 | AF52: 92.39 | AG52: 0.37 | AH52: AA | AI52: 4.5899999999999996e-002 | AJ52: =H52+100*O52 -> 135.5 | AK52: 129.6 | AL52: 71 | AM52: 37.2 | AN52: 75 | AO52: -2.e-002 | AP52: 50 | AQ52: 海亮转债!
A53: 28 | B53: 113599 | C53: 嘉友转债 | D53: 603871 | E53: 嘉友国际 | F53: 交通运输 | G53: 物流业 | H53: 113.38 | I53: -8.8000000000000005e-003 | J53: 1.0200000000000001e-002 | K53: 25.08 | L53: 2.e-003 | M53: 126 | N53: 24.82 | O53: 0.122 | P53: 101.05 | Q53: 3月7天 | R53: 5.73年 | S53: 3.73年 | T53: 7.2 | U53: 16 | V53: 1.9e-002 | W53: 0.13100000000000001 | X53: 0.13200000000000001 | Y53: 55 | Z53: 2.77 | AA53: 1.89e-002 | AB53: 1.1299999999999999e-002 | AC53: -2.23e-002 | AD53: -2.4199999999999999e-002 | AE53: 80.96 | AF53: 87.58 | AG53: 0.66 | AH53: AA- | AI53: 6.6900000000000001e-002 | AJ53: =H53+100*O53 -> 125.58 | AK53: 125.7 | AL53: 35 | AM53: 38.1 | AN53: 83 | AO53: 1.4999999999999999e-002 | AP53: 13 | AQ53: 嘉友转债
A54: 22 | B54: 128127 | C54: 文科转债 | D54: 2775 | E54: 文科园林 | F54: 城市公用 | G54: 生态环境 | H54: 109.11 | I54: -1.1200000000000002e-002 | J54: 2.5000000000000001e-003 | K54: 5.37 | L54: -1.29e-002 | M54: 121.3 | N54: 5.37 | O54: 9.0999999999999998e-002 | P54: 100 | Q54: 3月18天 | R54: 5.77年 | S54: 3.77年 | T54: 9.5 | U54: 7.8 | V54: 8.0000000000000002e-003 | W54: 0.34499999999999997 | X54: 0.34499999999999997 | Y54: 28 | Z54: 1.04 | AA54: 1.89e-002 | AB54: 1.24e-002 | AC54: -1.1699999999999999e-002 | AD54: -1.38e-002 | AE54: 81.02 | AF54: 84.18 | AG54: 0.68 | AH54: AA- | AI54: 6.6900000000000001e-002 | AJ54: =H54+100*O54 -> 118.20999999999999 | AK54: 118.2 | AL54: 5 | AM54: 34 | AN54: 50 | AO54: -2.9999999999999999e-002 | AP54: 20 | AQ54: 文科转债
A55: 128 | B55: 113566 | C55: 翔港转债 | D55: 603499 | E55: 翔港科技 | F55: 造纸包装 | G55: 包装材料 | H55: 113.53 | I55: 7.0999999999999995e-003 | J55: -2.e-002 | K55: 9.43 | L55: -2.2799999999999997e-002 | M55: 124.5 | N55: 10.77 | O55: 0.29699999999999999 | P55: 87.56 | Q55: 转股中 | R55: 5.29年 | S55: 3.29年 | T55: 1.61 | U55: 34 | V55: 0.185 | W55: 8.4000000000000005e-002 | X55: 7.400000000000001e-002 | Y55: 19 | Z55: 3.32 | AA55: 1.8000000000000002e-002 | AB55: 1.01e-002 | AC55: -2.35e-002 | AD55: -2.6000000000000002e-002 | AE55: 81.06 | AF55: 84.54 | AG55: 0.57 | AH55: A+ | AI55: 7.7899999999999997e-002 | AJ55: =H55+100*O55 -> 143.22999999999999 | AK55: 139.5 | AL55: 168 | AM55: 55 | AN55: 206 | AO55: -4.8000000000000001e-002 | AP55: 27 | AQ55: 翔港转债
A56: 252 | B56: 128042 | C56: 凯中转债! | D56: 2823 | E56: 凯中精密 | F56: 能源电力 | G56: 电力设备 | H56: 109.099 | I56: -2.7000000000000001e-003 | J56: 1.18e-002 | K56: 11.94 | L56: 2.1400000000000002e-002 | M56: 116.3 | N56: 12.96 | O56: 0.184 | P56: 92.13 | Q56: 转股中 | R56: 3.71年 | S56: 1.71年 | T56: 4.16 | U56: 64 | V56: 0.14099999999999999 | W56: 0.121 | X56: 0.11199999999999999 | Y56: 34 | Z56: 2.54 | AA56: 1.77e-002 | AB56: 9.7999999999999997e-003 | AC56: -3.1400000000000004e-002 | AD56: -3.4200000000000001e-002 | AE56: 94.88 | AF56: 99.42 | AG56: 0.42 | AH56: AA | AI56: 4.4000000000000004e-002 | AJ56: =H56+100*O56 -> 127.499 | AK56: 126.1 | AL56: 38 | AM56: 26.6 | AN56: 12 | AO56: 1.1000000000000001e-002 | AP56: 27 | AQ56: 凯中转债!
A57: 4 | B57: 123069 | C57: 金诺转债 | D57: 300505 | E57: 川金诺 | F57: 化工 | G57: 农化 | H57: 113.75 | I57: 1.03e-002 | J57: -1.8600000000000002e-002 | K57: 18.04 | L57: -1.37e-002 | M57: 126 | N57: 19.15 | O57: 0.20699999999999999 | P57: 94.2 | Q57: 5月10天 | R57: 5.92年 | S57: 3.92年 | T57: 3.68 | U57: 176 | V57: 0.41899999999999998 | W57: 0.156 | X57: 0.14699999999999999 | Y57: 24 | Z57: 2.45 | AA57: 1.77e-002 | AB57: 1.04e-002 | AC57: -2.2000000000000002e-002 | AD57: -2.3799999999999998e-002 | AE57: 79.93 | AF57: 86.47 | AG57: 0.61 | AH57: AA- | AI57: 6.6900000000000001e-002 | AJ57: =H57+100*O57 -> 134.44999999999999 | AK57: 133.3 | AL57: 124 | AM57: 46.8 | AN57: 163 | AO57: -9.6000000000000002e-002 | AP57: 5 | AQ57: 金诺转债
A58: 107 | B58: 113574 | C58: 华体转债! | D58: 603679 | E58: 华体科技 | F58: 城市公用 | G58: 城市公用 | H58: 106.27 | I58: 1.6399999999999998e-002 | J58: -1.8700000000000001e-002 | K58: 22 | L58: -8.1000000000000013e-003 | M58: 116.4 | N58: 33.99 | O58: 0.64200000000000002 | P58: 64.72 | Q58: 转股中 | R58: 5.38年 | S58: 3.38年 | T58: 2.09 | U58: 22 | V58: 0.10000000000000001 | W58: 6.6000000000000003e-002 | X58: 4.2999999999999997e-002 | Y58: 31 | Z58: 4.29 | AA58: 1.7500000000000002e-002 | AB58: 1.1899999999999999e-002 | AC58: -4.5999999999999999e-003 | AD58: -7.0999999999999995e-003 | AE58: 80.43 | AF58: 78.57 | AG58: 0.29 | AH58: A+ | AI58: 7.7899999999999997e-002 | AJ58: =H58+100*O58 -> 170.47 | AK58: 147.8 | AL58: 228 | AM58: 67.4 | AN58: 248 | AO58: -2.2000000000000002e-002 | AP58: 13 | AQ58: 华体转债!
A59: 190 | B59: 128069 | C59: 华森转债! | D59: 2907 | E59: 华森制药 | F59: 医药 | G59: 化学制药 | H59: 111 | I59: 2.76e-002 | J59: -2.6699999999999998e-002 | K59: 15.97 | L59: 1.9e-003 | M59: 120 | N59: 18.04 | O59: 0.254 | P59: 88.53 | Q59: 转股中 | R59: 4.61年 | S59: 2.61年 | T59: 3 | U59: 63 | V59: 0.192 | W59: 4.7e-002 | X59: 4.0999999999999995e-002 | Y59: 64 | Z59: 5.97 | AA59: 1.7399999999999999e-002 | AB59: 9.7999999999999997e-003 | AC59: -2.5099999999999997e-002 | AD59: -2.75e-002 | AE59: 87.05 | AF59: 90.29 | AG59: 0.5 | AH59: AA- | AI59: 6.5000000000000002e-002 | AJ59: =H59+100*O59 -> 136.40000000000001 | AK59: 133.5 | AL59: 126 | AM59: 43.2 | AN59: 138 | AO59: -1.9e-002 | AP59: 42 | AQ59: 华森转债!
A60: 55 | B60: 113036 | C60: 宁建转债! | D60: 601789 | E60: 宁波建工 | F60: 建筑 | G60: 建筑工程 | H60: 106.63 | I60: -5.3e-003 | J60: 5.3e-003 | K60: 4.25 | L60: 0. | M60: 117.3 | N60: 4.86 | O60: 0.21899999999999997 | P60: 87.45 | Q60: 59天 | R60: 5.64年 | S60: 3.64年 | T60: 5.4 | U60: 1.6 | V60: 3.0000000000000001e-003 | W60: 0.13 | X60: 0.114 | Y60: 41 | Z60: 1.39 | AA60: 1.7399999999999999e-002 | AB60: 1.18e-002 | AC60: -7.0999999999999995e-003 | AD60: -9.0000000000000011e-003 | AE60: 87.63 | AF60: 91.5 | AG60: 0.47 | AH60: AA | AI60: 4.5899999999999996e-002 | AJ60: =H60+100*O60 -> 128.53 | AK60: 125.8 | AL60: 36 | AM60: 34.3 | AN60: 52 | AO60: -1.6e-002 | AP60: 6 | AQ60: 宁建转债!
A61: 219 | B61: 110053 | C61: 苏银转债! | D61: 600919 | E61: 江苏银行 | F61: 金融 | G61: 银行行业 | H61: 110.95 | I61: -1.3300000000000001e-002 | J61: 9.5999999999999992e-003 | K61: 5.98 | L61: -1.1599999999999999e-002 | M61: 119.1 | N61: 7.28 | O61: 0.35100000000000003 | P61: 82.14 | Q61: 转股中 | R61: 4.33年 | S61: 无权 | T61: 200 | U61: 137 | V61: 6.0000000000000001e-003 | W61: 0.28999999999999998 | X61: 0.23800000000000002 | Y61: 690 | Z61: 0.58 | AA61: 1.7000000000000001e-002 | AB61: 9.1000000000000004e-003 | AC61: 无权 | AD61: 无权 | AE61: 无权 | AF61: 101.44 | AG61: 0.31 | AH61: AAA | AI61: 3.9e-002 | AJ61: =H61+100*O61 -> 146.05000000000001 | AK61: 139.8 | AL61: 172 | AM61: 38.3 | AN61: 86 | AO61: -2.7000000000000003e-002 | AP61: 46 | AQ61: 苏银转债!
A62: 204 | B62: 113534 | C62: 鼎胜转债! | D62: 603876 | E62: 鼎胜新材 | F62: 有色金属 | G62: 小金属 | H62: 106.88 | I62: -3.9000000000000003e-003 | J62: 1.06e-002 | K62: 13.01 | L62: 1.72e-002 | M62: 114.9 | N62: 15.18 | O62: 0.247 | P62: 85.7 | Q62: 转股中 | R62: 4.40年 | S62: 2.40年 | T62: 12 | U62: 8.1 | V62: 6.0000000000000001e-003 | W62: 0.21299999999999999 | X62: 0.182 | Y62: 56 | Z62: 1.57 | AA62: 1.6899999999999998e-002 | AB62: 1.0700000000000001e-002 | AC62: -1.29e-002 | AD62: -1.55e-002 | AE62: 92.68 | AF62: 95.43 | AG62: 0.39 | AH62: AA | AI62: 4.4000000000000004e-002 | AJ62: =H62+100*O62 -> 131.57999999999998 | AK62: 128.1 | AL62: 56 | AM62: 32.6 | AN62: 33 | AO62: -6.0000000000000001e-003 | AP62: 30 | AQ62: 鼎胜转债!
A63: 202 | B63: 113026 | C63: 核能转债! | D63: 601985 | E63: 中国核电 | F63: 能源电力 | G63: 核电 | H63: 102.15 | I63: -3.4999999999999996e-003 | J63: 8.0000000000000004e-004 | K63: 4.57 | L63: -1.0800000000000001e-002 | M63: 109.8 | N63: 6.08 | O63: 0.35899999999999999 | P63: 75.16 | Q63: 转股中 | R63: 4.42年 | S63: 2.42年 | T63: 78 | U63: 18 | V63: 2.e-003 | W63: 0.11 | X63: 8.199999999999999e-002 | Y63: 711 | Z63: 1.36 | AA63: 1.6799999999999999e-002 | AB63: 1.2500000000000001e-002 | AC63: 4.4000000000000003e-003 | AD63: 1.9e-003 | AE63: 93.66 | AF63: 93.04 | AG63: 0.25 | AH63: AAA | AI63: 3.9e-002 | AJ63: =H63+100*O63 -> 138.05000000000001 | AK63: 129.1 | AL63: 67 | AM63: 35.5 | AN63: 62 | AO63: 2.e-003 | AP63: 51 | AQ63: 核能转债!
A64: 208 | B64: 113532 | C64: 海环转债! | D64: 603817 | E64: 海峡环保 | F64: 城市公用 | G64: 三废处理 | H64: 105.2 | I64: -9.1000000000000004e-003 | J64: 1.15e-002 | K64: 6.37 | L64: 6.3e-003 | M64: 112.9 | N64: 7.69 | O64: 0.27000000000000002 | P64: 82.83 | Q64: 转股中 | R64: 4.38年 | S64: 2.38年 | T64: 4.6 | U64: 3.1 | V64: 6.0000000000000001e-003 | W64: 0.16 | X64: 0.13300000000000001 | Y64: 29 | Z64: 1.68 | AA64: 1.66e-002 | AB64: 1.11e-002 | AC64: -6.8000000000000005e-003 | AD64: -9.3999999999999986e-003 | AE64: 92.76 | AF64: 93.85 | AG64: 0.38 | AH64: AA | AI64: 4.4000000000000004e-002 | AJ64: =H64+100*O64 -> 132.19999999999999 | AK64: 127.6 | AL64: 52 | AM64: 33.7 | AN64: 43 | AO64: 0. | AP64: 26 | AQ64: 海环转债!
A65: 303 | B65: 127003 | C65: 海印转债! | D65: 861 | E65: 海印股份 | F65: 商业零售 | G65: 商场 | H65: 109 | I65: -6.4000000000000003e-003 | J65: 2.8999999999999998e-003 | K65: 2.62 | L65: -1.8700000000000001e-002 | M65: 111.8 | N65: 3 | O65: 0.248 | P65: 87.33 | Q65: 转股中 | R65: 1.57年 | S65: 回售中 | T65: 6.74 | U65: 3.8 | V65: 5.0000000000000001e-003 | W65: 0.111 | X65: 9.6999999999999989e-002 | Y65: 61 | Z65: 1.55 | AA65: 1.6500000000000001e-002 | AB65: 2.5999999999999999e-003 | AC65: 回售中 | AD65: 回售中 | AE65: 100.3 | AF65: 104.72 | AG65: 0.19 | AH65: AA | AI65: 4.3099999999999999e-002 | AJ65: =H65+100*O65 -> 133.80000000000001 | AK65: 130.7 | AL65: 87 | AM65: 25.9 | AN65: 10 | AO65: 2.8999999999999998e-002 | AP65: 74 | AQ65: 海印转债!
A66: 302 | B66: 128013 | C66: 洪涛转债! | D66: 2325 | E66: 洪涛股份 | F66: 建筑 | G66: 装饰工程 | H66: 106.802 | I66: -7.4000000000000003e-003 | J66: 5.8999999999999999e-003 | K66: 2.93 | L66: -3.4000000000000002e-003 | M66: 109.8 | N66: 3.1 | O66: 0.13 | P66: 94.52 | Q66: 转股中 | R66: 1.71年 | S66: 回售中 | T66: 12 | U66: 23 | V66: 1.8000000000000002e-002 | W66: 0.32700000000000001 | X66: 0.309 | Y66: 37 | Z66: 1.23 | AA66: 1.6500000000000001e-002 | AB66: 5.6999999999999993e-003 | AC66: 回售中 | AD66: 回售中 | AE66: 100.3 | AF66: 98.86 | AG66: 0.43 | AH66: AA- | AI66: 6.4100000000000004e-002 | AJ66: =H66+100*O66 -> 119.80200000000001 | AK66: 119.1 | AL66: 7 | AM66: 18.8 | AN66: 3 | AO66: -2.3e-002 | AP66: 90 | AQ66: 洪涛转债!
A67: 19 | B67: 113039 | C67: 嘉泽转债! | D67: 601619 | E67: 嘉泽新能 | F67: 能源电力 | G67: 风能 | H67: 103.68 | I67: -1.1299999999999999e-002 | J67: 4.7999999999999996e-003 | K67: 3.08 | L67: -1.2800000000000001e-002 | M67: 113.1 | N67: 3.57 | O67: 0.20199999999999999 | P67: 86.27 | Q67: 3月18天 | R67: 5.78年 | S67: 3.78年 | T67: 13 | U67: 5.9 | V67: 4.0000000000000001e-003 | W67: 0.20300000000000001 | X67: 0.17600000000000002 | Y67: 64 | Z67: 1.86 | AA67: 1.54e-002 | AB67: 1.1200000000000002e-002 | AC67: -2.0000000000000001e-004 | AD67: -2.e-003 | AE67: 86.92 | AF67: 87.67 | AG67: 0.5 | AH67: AA | AI67: 4.5899999999999996e-002 | AJ67: =H67+100*O67 -> 123.88000000000001 | AK67: 121.1 | AL67: 10 | AM67: 33.4 | AN67: 42 | AO67: -2.9999999999999999e-002 | AP67: 11 | AQ67: 嘉泽转债!
A68: 250 | B68: 113516 | C68: 苏农转债! | D68: 603323 | E68: 苏农银行 | F68: 金融 | G68: 银行行业 | H68: 108.3 | I68: -1.1000000000000001e-002 | J68: 4.4000000000000003e-003 | K68: 4.72 | L68: -1.8700000000000001e-002 | M68: 114.3 | N68: 5.52 | O68: 0.26700000000000002 | P68: 85.51 | Q68: 转股中 | R68: 3.72年 | S68: 无权 | T68: 12.9 | U68: 3.6 | V68: 3.0000000000000001e-003 | W68: 0.151 | X68: 0.13 | Y68: 85 | Z68: 0.72 | AA68: 1.49e-002 | AB68: 7.8000000000000005e-003 | AC68: 无权 | AD68: 无权 | AE68: 无权 | AF68: 98.37 | AG68: 0.35 | AH68: AA+ | AI68: 4.2000000000000003e-002 | AJ68: =H68+100*O68 -> 135. | AK68: 131.1 | AL68: 96 | AM68: 32.7 | AN68: 35 | AO68: -1.1000000000000001e-002 | AP68: 36 | AQ68: 苏农转债!
A69: 205 | B69: 113024 | C69: 核建转债! | D69: 601611 | E69: 中国核建 | F69: 建筑 | G69: 建筑工程 | H69: 102.95 | I69: -5.6000000000000008e-003 | J69: -5.0000000000000001e-004 | K69: 7.27 | L69: -2.4199999999999999e-002 | M69: 109.7 | N69: 9.76 | O69: 0.38200000000000001 | P69: 74.49 | Q69: 转股中 | R69: 4.40年 | S69: 2.40年 | T69: 30 | U69: 9.1 | V69: 3.0000000000000001e-003 | W69: 0.155 | X69: 0.11599999999999999 | Y69: 193 | Z69: 1.79 | AA69: 1.4800000000000001e-002 | AB69: 1.06e-002 | AC69: 1.e-003 | AD69: -1.5e-003 | AE69: 93.63 | AF69: 93.01 | AG69: 0.25 | AH69: AAA | AI69: 3.9e-002 | AJ69: =H69+100*O69 -> 141.15000000000001 | AK69: 131.4 | AL69: 103 | AM69: 37.8 | AN69: 81 | AO69: -3.5000000000000003e-002 | AP69: 44 | AQ69: 核建转债!
A70: 159 | B70: 128082 | C70: 华锋转债! | D70: 2806 | E70: 华锋股份 | F70: 电子 | G70: 元器件制 | H70: 113.5 | I70: 2.5000000000000001e-003 | J70: 7.8000000000000005e-003 | K70: 12.17 | L70: 1.4199999999999999e-002 | M70: 122 | N70: 11.71 | O70: 9.1999999999999998e-002 | P70: 103.93 | Q70: 转股中 | R70: 5年21天 | S70: 3年21天 | T70: 3.52 | U70: 15 | V70: 3.9e-002 | W70: 0.16399999999999998 | X70: 0.17100000000000001 | Y70: 21 | Z70: 1.72 | AA70: 1.4800000000000001e-002 | AB70: 7.1999999999999998e-003 | AC70: -2.4e-002 | AD70: -2.69e-002 | AE70: 82.86 | AF70: 84.42 | AG70: 0.73 | AH70: A+ | AI70: 7.7899999999999997e-002 | AJ70: =H70+100*O70 -> 122.7 | AK70: 123.1 | AL70: 17 | AM70: 38.7 | AN70: 91 | AO70: 2.5000000000000001e-002 | AP70: 56 | AQ70: 华锋转债!
A71: 40 | B71: 113037 | C71: 紫银转债 | D71: 601860 | E71: 紫金银行 | F71: 金融 | G71: 银行行业 | H71: 107.2 | I71: -8.3999999999999995e-003 | J71: 5.1999999999999998e-003 | K71: 3.96 | L71: -7.4999999999999997e-003 | M71: 115.8 | N71: 4.75 | O71: 0.28600000000000003 | P71: 83.37 | Q71: 2月17天 | R71: 5.69年 | S71: 无权 | T71: 45 | U71: 70 | V71: 1.4999999999999999e-002 | W71: 0.31 | X71: 0.25900000000000001 | Y71: 145 | Z71: 1.02 | AA71: 1.3899999999999999e-002 | AB71: 8.8999999999999999e-003 | AC71: 无权 | AD71: 无权 | AE71: 无权 | AF71: 91.12 | AG71: 0.43 | AH71: AA+ | AI71: 4.3899999999999995e-002 | AJ71: =H71+100*O71 -> 135.80000000000001 | AK71: 131 | AL71: 94 | AM71: 39.9 | AN71: 108 | AO71: -2.4e-002 | AP71: 16 | AQ71: 紫银转债
A72: 157 | B72: 128083 | C72: 新北转债! | D72: 2376 | E72: 新北洋 | F72: 电子 | G72: 电子产品 | H72: 107.9 | I72: -1.5e-003 | J72: 8.3000000000000001e-003 | K72: 9.32 | L72: 1.8600000000000002e-002 | M72: 115.2 | N72: 11.7 | O72: 0.35499999999999998 | P72: 79.66 | Q72: 转股中 | R72: 5年29天 | S72: 3年29天 | T72: 8.77 | U72: 3.8 | V72: 4.0000000000000001e-003 | W72: 0.14099999999999999 | X72: 0.113 | Y72: 62 | Z72: 1.84 | AA72: 1.32e-002 | AB72: 7.8000000000000005e-003 | AC72: -1.23e-002 | AD72: -1.4499999999999999e-002 | AE72: 89.79 | AF72: 92.15 | AG72: 0.36 | AH72: AA | AI72: 4.5899999999999996e-002 | AJ72: =H72+100*O72 -> 143.40000000000001 | AK72: 136.1 | AL72: 147 | AM72: 44 | AN72: 145 | AO72: -2.8999999999999998e-002 | AP72: 17 | AQ72: 新北转债!
A73: 106 | B73: 113033 | C73: 利群转债! | D73: 601366 | E73: 利群股份 | F73: 商业零售 | G73: 商场 | H73: 107.59 | I73: -1.32e-002 | J73: 1.3999999999999999e-002 | K73: 6.53 | L73: 1.5e-003 | M73: 115.3 | N73: 7.01 | O73: 0.155 | P73: 93.15 | Q73: 转股中 | R73: 5.38年 | S73: 3.38年 | T73: 18 | U73: 9.7 | V73: 5.0000000000000001e-003 | W73: 0.32000000000000001 | X73: 0.29799999999999999 | Y73: 56 | Z73: 1.26 | AA73: 1.32e-002 | AB73: 8.0000000000000002e-003 | AC73: -1.0200000000000001e-002 | AD73: -1.2199999999999999e-002 | AE73: 88.67 | AF73: 91.01 | AG73: 0.55 | AH73: AA | AI73: 4.5899999999999996e-002 | AJ73: =H73+100*O73 -> 123.09 | AK73: 122 | AL73: 12 | AM73: 31 | AN73: 27 | AO73: -1.1000000000000001e-002 | AP73: 35 | AQ73: 利群转债!
A74: 259 | B74: 127007 | C74: 湖广转债! | D74: 665 | E74: 湖北广电 | F74: 传媒娱乐 | G74: 影视娱乐 | H74: 107.223 | I74: -5.6999999999999993e-003 | J74: 8.3000000000000001e-003 | K74: 4.99 | L74: 6.0000000000000001e-003 | M74: 112.3 | N74: 5.58 | O74: 0.19899999999999998 | P74: 89.43 | Q74: 转股中 | R74: 3.62年 | S74: 1.62年 | T74: 12.2 | U74: 2.2 | V74: 2.e-003 | W74: 0.248 | X74: 0.222 | Y74: 49 | Z74: 0.75 | AA74: 1.3100000000000001e-002 | AB74: 6.8000000000000005e-003 | AC74: -2.35e-002 | AD74: -2.64e-002 | AE74: 95.56 | AF74: 97.03 | AG74: 0.42 | AH74: AA+ | AI74: 4.2000000000000003e-002 | AJ74: =H74+100*O74 -> 127.12299999999999 | AK74: 125 | AL74: 31 | AM74: 28 | AN74: 19 | AO74: -2.4e-002 | AP74: 18 | AQ74: 湖广转债!
A75: 23 | B75: 110074 | C75: 精达转债 | D75: 600577 | E75: 精达股份 | F75: 电子 | G75: 电子产品 | H75: 109.24 | I75: -1.e-004 | J75: -4.1999999999999997e-003 | K75: 3.27 | L75: -9.1000000000000004e-003 | M75: 117.3 | N75: 3.75 | O75: 0.253 | P75: 87.2 | Q75: 3月14天 | R75: 5.76年 | S75: 3.76年 | T75: 7.87 | U75: 3.8 | V75: 4.0000000000000001e-003 | W75: 0.125 | X75: 0.109 | Y75: 63 | Z75: 1.78 | AA75: 1.2699999999999999e-002 | AB75: 7.3000000000000001e-003 | AC75: -1.3000000000000001e-002 | AD75: -1.49e-002 | AE75: 87.16 | AF75: 91 | AG75: 0.47 | AH75: AA | AI75: 4.5899999999999996e-002 | AJ75: =H75+100*O75 -> 134.53999999999999 | AK75: 131.3 | AL75: 97 | AM75: 40.3 | AN75: 115 | AO75: -1.2e-002 | AP75: 7 | AQ75: 精达转债
A76: 239 | B76: 110047 | C76: 山鹰转债 | D76: 600567 | E76: 山鹰国际 | F76: 造纸包装 | G76: 包装用纸 | H76: 112.45 | I76: -2.06e-002 | J76: 1.9099999999999999e-002 | K76: 3.26 | L76: -3.0999999999999999e-003 | M76: 118.1 | N76: 3.34 | O76: 0.152 | P76: 97.6 | Q76: 转股中 | R76: 4年8天 | S76: 2年8天 | T76: 23 | U76: 24 | V76: 9.0000000000000011e-003 | W76: 0.153 | X76: 0.14999999999999999 | Y76: 150 | Z76: 1.02 | AA76: 1.2500000000000001e-002 | AB76: 4.5000000000000005e-003 | AC76: -3.7900000000000003e-002 | AD76: -4.0800000000000003e-002 | AE76: 94.63 | AF76: 100.46 | AG76: 0.49 | AH76: AA+ | AI76: 4.2000000000000003e-002 | AJ76: =H76+100*O76 -> 127.65000000000001 | AK76: 127.3 | AL76: 48 | AM76: 26.8 | AN76: 13 | AO76: 3.3000000000000002e-002 | AP76: 34 | AQ76: 山鹰转债
A77: 24 | B77: 110072 | C77: 广汇转债! | D77: 600297 | E77: 广汇汽车 | F77: 汽车 | G77: 分销、售 | H77: 107.42 | I77: -1.8100000000000002e-002 | J77: 5.0000000000000001e-003 | K77: 3.46 | L77: -2.81e-002 | M77: 114.5 | N77: 4.03 | O77: 0.251 | P77: 85.86 | Q77: 3月13天 | R77: 5.76年 | S77: 3.76年 | T77: 33.7 | U77: 72 | V77: 2.e-002 | W77: 0.12 | X77: 0.10300000000000001 | Y77: 281 | Z77: 0.71 | AA77: 1.1299999999999999e-002 | AB77: 6.7000000000000002e-003 | AC77: -1.0700000000000001e-002 | AD77: -1.2199999999999999e-002 | AE77: 87.09 | AF77: 89.71 | AG77: 0.47 | AH77: AA+ | AI77: 4.3899999999999995e-002 | AJ77: =H77+100*O77 -> 132.52000000000001 | AK77: 129 | AL77: 65 | AM77: 39.3 | AN77: 96 | AO77: -5.4000000000000006e-002 | AP77: 17 | AQ77: 广汇转债!
A78: 33 | B78: 123063 | C78: 大禹转债 | D78: 300021 | E78: 大禹节水 | F78: 化工 | G78: 橡胶塑料 | H78: 118.93 | I78: -1.47e-002 | J78: 1.6e-002 | K78: 5.41 | L78: 1.9e-003 | M78: 126.5 | N78: 4.94 | O78: 8.5999999999999993e-002 | P78: 109.51 | Q78: 2月22天 | R78: 5.70年 | S78: 4.70年 | T78: 6.38 | U78: 33 | V78: 4.2999999999999997e-002 | W78: 0.14800000000000002 | X78: 0.16200000000000001 | Y78: 43 | Z78: 2.99 | AA78: 1.11e-002 | AB78: 3.4000000000000002e-003 | AC78: -2.18e-002 | AD78: -2.4399999999999998e-002 | AE78: 78.49 | AF78: 88.11 | AG78: 0.74 | AH78: AA- | AI78: 6.6900000000000001e-002 | AJ78: =H78+100*O78 -> 127.53 | AK78: 128.3 | AL78: 58 | AM78: 40.2 | AN78: 114 | AO78: -6.4000000000000001e-002 | AP78: 15 | AQ78: 大禹转债
A79: 35 | B79: 113596 | C79: 城地转债! | D79: 603887 | E79: 城地香江 | F79: 通信互联 | G79: 通信设备 | H79: 107.21 | I79: -6.0999999999999995e-003 | J79: 2.3999999999999998e-003 | K79: 20.78 | L79: -9.4999999999999998e-003 | M79: 113.5 | N79: 29.21 | O79: 0.50700000000000001 | P79: 71.14 | Q79: 2月23天 | R79: 5.70年 | S79: 3.70年 | T79: 12 | U79: 0.8 | V79: 1.e-003 | W79: 0.154 | X79: 0.109 | Y79: 78 | Z79: 2.16 | AA79: 1.0200000000000001e-002 | AB79: 5.8999999999999999e-003 | AC79: -8.3000000000000001e-003 | AD79: -1.0200000000000001e-002 | AE79: 81.01 | AF79: 79.05 | AG79: 0.39 | AH79: AA- | AI79: 6.6900000000000001e-002 | AJ79: =H79+100*O79 -> 157.91 | AK79: 143.3 | AL79: 203 | AM79: 62.3 | AN79: 238 | AO79: -0.105 | AP79: 9 | AQ79: 城地转债!
A80: 47 | B80: 128120 | C80: 联诚转债 | D80: 2921 | E80: 联诚精密 | F80: 汽车 | G80: 零部件制 | H80: 111.95 | I80: 4.5999999999999999e-003 | J80: 6.0000000000000001e-003 | K80: 23.38 | L80: 1.43e-002 | M80: 118.4 | N80: 24.37 | O80: 0.16699999999999998 | P80: 95.94 | Q80: 2月13天 | R80: 5.67年 | S80: 3.67年 | T80: 2.6 | U80: 35 | V80: 0.121 | W80: 0.13600000000000001 | X80: 0.13100000000000001 | Y80: 19 | Z80: 2.55 | AA80: 1.01e-002 | AB80: 4.4000000000000003e-003 | AC80: -1.78e-002 | AD80: -2.e-002 | AE80: 75.96 | AF80: 74.27 | AG80: 0.74 | AH80: A | AI80: 8.7899999999999992e-002 | AJ80: =H80+100*O80 -> 128.65000000000001 | AK80: 128 | AL80: 55 | AM80: 52 | AN80: 192 | AO80: -1.e-003 | AP80: 13 | AQ80: 联诚转债
A81: 5 | B81: 123068 | C81: 弘信转债 | D81: 300657 | E81: 弘信电子 | F81: 电子 | G81: 元器件制 | H81: 114.51 | I81: 3.5999999999999999e-003 | J81: 8.9999999999999998e-004 | K81: 17.46 | L81: 6.8999999999999999e-003 | M81: 121.2 | N81: 18.45 | O81: 0.20999999999999999 | P81: 94.63 | Q81: 5月9天 | R81: 5.92年 | S81: 3.92年 | T81: 5.7 | U81: 38 | V81: 5.9000000000000004e-002 | W81: 9.6000000000000002e-002 | X81: 8.9999999999999997e-002 | Y81: 60 | Z81: 4.08 | AA81: 9.7999999999999997e-003 | AB81: 3.5999999999999999e-003 | AC81: -2.3199999999999998e-002 | AD81: -2.5099999999999997e-002 | AE81: 80.13 | AF81: 83.25 | AG81: 0.65 | AH81: AA- | AI81: 6.6900000000000001e-002 | AJ81: =H81+100*O81 -> 135.50999999999999 | AK81: 134.4 | AL81: 134 | AM81: 51.1 | AN81: 186 | AO81: 1.3000000000000001e-002 | AP81: 3 | AQ81: 弘信转债
A82: 95 | B82: 123049 | C82: 维尔转债 | D82: 300190 | E82: 维尔利 | F82: 城市公用 | G82: 三废处理 | H82: 118.6 | I82: -1.2500000000000001e-002 | J82: -2.3999999999999998e-003 | K82: 8.12 | L82: -2.0499999999999997e-002 | M82: 124.8 | N82: 7.48 | O82: 9.3000000000000013e-002 | P82: 108.56 | Q82: 转股中 | R82: 5.41年 | S82: 3.41年 | T82: 9.17 | U82: 5.6 | V82: 5.0000000000000001e-003 | W82: 0.14400000000000002 | X82: 0.157 | Y82: 63 | Z82: 1.51 | AA82: 9.7000000000000003e-003 | AB82: 2.e-003 | AC82: -3.4599999999999999e-002 | AD82: -3.7000000000000005e-002 | AE82: 83.31 | AF82: 88.65 | AG82: 0.73 | AH82: AA- | AI82: 6.6900000000000001e-002 | AJ82: =H82+100*O82 -> 127.89999999999999 | AK82: 128.6 | AL82: 61 | AM82: 40 | AN82: 110 | AO82: -4.5999999999999999e-002 | AP82: 12 | AQ82: 维尔转债
A83: 10 | B83: 123067 | C83: 斯莱转债 | D83: 300382 | E83: 斯莱克 | F83: 机械装备 | G83: 专用设备 | H83: 115 | I83: 2.4900000000000002e-002 | J83: -1.52e-002 | K83: 9.35 | L83: 1.41e-002 | M83: 121.2 | N83: 9.38 | O83: 0.154 | P83: 99.68 | Q83: 4月10天 | R83: 5.84年 | S83: 3.84年 | T83: 3.88 | U83: 74 | V83: 0.16699999999999998 | W83: 7.400000000000001e-002 | X83: 7.2999999999999995e-002 | Y83: 53 | Z83: 5.17 | AA83: 9.1999999999999998e-003 | AB83: 2.8999999999999998e-003 | AC83: -2.4700000000000003e-002 | AD83: -2.6600000000000002e-002 | AE83: 80.52 | AF83: 83.67 | AG83: 0.69 | AH83: AA- | AI83: 6.6900000000000001e-002 | AJ83: =H83+100*O83 -> 130.40000000000001 | AK83: 130.3 | AL83: 82 | AM83: 46.7 | AN83: 160 | AO83: -5.5e-002 | AP83: 10 | AQ83: 斯莱转债
A84: 145 | B84: 113030 | C84: 东风转债 | D84: 601515 | E84: 东风股份 | F84: 造纸包装 | G84: 包装材料 | H84: 112.07 | I84: 4.0000000000000002e-004 | J84: -2.8000000000000004e-003 | K84: 6.07 | L84: -4.8999999999999998e-003 | M84: 117.3 | N84: 6.75 | O84: 0.24600000000000002 | P84: 89.93 | Q84: 转股中 | R84: 5年41天 | S84: 3年41天 | T84: 2.95 | U84: 1.5 | V84: 4.0000000000000001e-003 | W84: 3.6000000000000004e-002 | X84: 3.3000000000000002e-002 | Y84: 81 | Z84: 1.94 | AA84: 9.1000000000000004e-003 | AB84: 3.0999999999999999e-003 | AC84: -2.3399999999999997e-002 | AD84: -2.5499999999999998e-002 | AE84: 89.76 | AF84: 93.71 | AG84: 0.48 | AH84: AA | AI84: 4.5899999999999996e-002 | AJ84: =H84+100*O84 -> 136.66999999999999 | AK84: 134.2 | AL84: 132 | AM84: 40.5 | AN84: 117 | AO84: -5.0000000000000001e-003 | AP84: 15 | AQ84: 东风转债
A85: 60 | B85: 128116 | C85: 瑞达转债 | D85: 2961 | E85: 瑞达期货 | F85: 金融 | G85: 期货行业 | H85: 109.955 | I85: -4.8999999999999998e-003 | J85: -2.6099999999999998e-002 | K85: 27.81 | L85: -5.7000000000000002e-002 | M85: 115.3 | N85: 29.82 | O85: 0.17899999999999999 | P85: 93.26 | Q85: 52天 | R85: 5.62年 | S85: 3.62年 | T85: 6.5 | U85: 9.3 | V85: 1.3000000000000001e-002 | W85: 5.2999999999999999e-002 | X85: 4.9000000000000002e-002 | Y85: 124 | Z85: 7.04 | AA85: 8.6e-003 | AB85: 3.7000000000000002e-003 | AC85: -1.54e-002 | AD85: -1.7299999999999999e-002 | AE85: 87.63 | AF85: 90.01 | AG85: 0.54 | AH85: AA | AI85: 4.5899999999999996e-002 | AJ85: =H85+100*O85 -> 127.85499999999999 | AK85: 126.7 | AL85: 43 | AM85: 36.6 | AN85: 71 | AO85: 0. | AP85: 10 | AQ85: 瑞达转债
A86: 9 | B86: 128133 | C86: 奇正转债! | D86: 2287 | E86: 奇正藏药 | F86: 医药 | G86: 中药 | H86: 111.75 | I86: 2.1899999999999999e-002 | J86: -2.6000000000000002e-002 | K86: 24.7 | L86: -9.5999999999999992e-003 | M86: 117.3 | N86: 30.12 | O86: 0.36299999999999999 | P86: 82.01 | Q86: 4月15天 | R86: 5.86年 | S86: 3.86年 | T86: 8 | U86: 429 | V86: 0.47600000000000003 | W86: 6.0999999999999999e-002 | X86: 5.0000000000000003e-002 | Y86: 131 | Z86: 5.45 | AA86: 8.5000000000000006e-003 | AB86: 3.2000000000000002e-003 | AC86: -1.83e-002 | AD86: -2.0099999999999996e-002 | AE86: 86.8 | AF86: 90.62 | AG86: 0.42 | AH86: AA | AI86: 4.5899999999999996e-002 | AJ86: =H86+100*O86 -> 148.05000000000001 | AK86: 141.5 | AL86: 191 | AM86: 50.9 | AN86: 184 | AO86: -5.4000000000000006e-002 | AP86: 6 | AQ86: 奇正转债!
A87: 171 | B87: 127014 | C87: 北方转债 | D87: 65 | E87: 北方国际 | F87: 建筑 | G87: 建筑工程 | H87: 110.5 | I87: -8.1000000000000013e-003 | J87: 6.4000000000000003e-003 | K87: 7.62 | L87: -3.9000000000000003e-003 | M87: 115.1 | N87: 8.75 | O87: 0.26899999999999996 | P87: 87.09 | Q87: 转股中 | R87: 4.95年 | S87: 2.95年 | T87: 5.78 | U87: 6.6 | V87: 1.e-002 | W87: 9.9000000000000005e-002 | X87: 8.5999999999999993e-002 | Y87: 59 | Z87: 1.1 | AA87: 8.3999999999999995e-003 | AB87: 2.8999999999999998e-003 | AC87: -2.07e-002 | AD87: -2.29e-002 | AE87: 91.27 | AF87: 94.29 | AG87: 0.43 | AH87: AA+ | AI87: 4.2000000000000003e-002 | AJ87: =H87+100*O87 -> 137.40000000000001 | AK87: 133.9 | AL87: 128 | AM87: 39.6 | AN87: 102 | AO87: 6.9999999999999993e-003 | AP87: 17 | AQ87: 北方转债
A88: 53 | B88: 110071 | C88: 湖盐转债 | D88: 600929 | E88: 雪天盐业 | F88: 食品饮料 | G88: 食品饮料 | H88: 109.99 | I88: -1.e-003 | J88: -8.0000000000000002e-003 | K88: 6.14 | L88: -1.6e-002 | M88: 115.2 | N88: 6.6 | O88: 0.182 | P88: 93.03 | Q88: 2月6天 | R88: 5.66年 | S88: 3.66年 | T88: 7.2 | U88: 1.5 | V88: 2.e-003 | W88: 0.128 | X88: 0.11900000000000001 | Y88: 56 | Z88: 2.22 | AA88: 8.3999999999999995e-003 | AB88: 3.4999999999999996e-003 | AC88: -1.54e-002 | AD88: -1.72e-002 | AE88: 87.49 | AF88: 89.8 | AG88: 0.56 | AH88: AA | AI88: 4.5899999999999996e-002 | AJ88: =H88+100*O88 -> 128.19 | AK88: 126.9 | AL88: 46 | AM88: 37.1 | AN88: 74 | AO88: -4.2999999999999997e-002 | AP88: 12 | AQ88: 湖盐转债
A89: 21 | B89: 128128 | C89: 齐翔转2 | D89: 2408 | E89: 齐翔腾达 | F89: 化工 | G89: 化工 | H89: 110.185 | I89: -1.66e-002 | J89: 3.4999999999999996e-003 | K89: 8.78 | L89: -1.9e-002 | M89: 115.3 | N89: 8.22 | O89: 3.2000000000000001e-002 | P89: 106.81 | Q89: 3月15天 | R89: 5.77年 | S89: 3.77年 | T89: 29.9 | U89: 100 | V89: 2.9999999999999999e-002 | W89: 0.192 | X89: 0.20499999999999999 | Y89: 156 | Z89: 1.9 | AA89: 8.0000000000000002e-003 | AB89: 3.3e-003 | AC89: -1.54e-002 | AD89: -1.72e-002 | AE89: 87.07 | AF89: 89.43 | AG89: 0.69 | AH89: AA | AI89: 4.5899999999999996e-002 | AJ89: =H89+100*O89 -> 113.38500000000001 | AK89: 113.6 | AL89: 2 | AM89: 24.1 | AN89: 8 | AO89: 7.6999999999999999e-002 | AP89: 27 | AQ89: 齐翔转2
A90: 213 | B90: 127012 | C90: 招路转债! | D90: 1965 | E90: 招商公路 | F90: 机场高速 | G90: 高速 | H90: 104.8 | I90: -9.5999999999999992e-003 | J90: 5.6000000000000008e-003 | K90: 7.05 | L90: -1.26e-002 | M90: 108.2 | N90: 8.81 | O90: 0.31 | P90: 80.02 | Q90: 转股中 | R90: 4.35年 | S90: 2.35年 | T90: 50 | U90: 18 | V90: 3.0000000000000001e-003 | W90: 0.115 | X90: 9.1999999999999998e-002 | Y90: 436 | Z90: 0.9 | AA90: 7.4999999999999997e-003 | AB90: 3.9000000000000003e-003 | AC90: -1.09e-002 | AD90: -1.24e-002 | AE90: 92.63 | AF90: 91.8 | AG90: 0.32 | AH90: AAA | AI90: 3.9e-002 | AJ90: =H90+100*O90 -> 135.80000000000001 | AK90: 129.6 | AL90: 72 | AM90: 36.9 | AN90: 73 | AO90: 1.4999999999999999e-002 | AP90: 37 | AQ90: 招路转债!
A91: 206 | B91: 128064 | C91: 司尔转债! | D91: 2538 | E91: 司尔特 | F91: 化工 | G91: 农化 | H91: 111.458 | I91: -1.7000000000000001e-003 | J91: 8.3999999999999995e-003 | K91: 5.96 | L91: 1.1899999999999999e-002 | M91: 114.9 | N91: 6.07 | O91: 0.13500000000000001 | P91: 98.19 | Q91: 转股中 | R91: 4.40年 | S91: 2.40年 | T91: 8 | U91: 3.4 | V91: 4.0000000000000001e-003 | W91: 0.187 | X91: 0.184 | Y91: 43 | Z91: 1.12 | AA91: 7.0999999999999995e-003 | AB91: 1.e-003 | AC91: -2.9100000000000001e-002 | AD91: -3.1600000000000003e-002 | AE91: 92.69 | AF91: 95.44 | AG91: 0.56 | AH91: AA | AI91: 4.4000000000000004e-002 | AJ91: =H91+100*O91 -> 124.958 | AK91: 124.7 | AL91: 29 | AM91: 29.3 | AN91: 21 | AO91: 4.0000000000000001e-002 | AP91: 56 | AQ91: 司尔转债!
A92: 156 | B92: 110063 | C92: 鹰19转债 | D92: 600567 | E92: 山鹰国际 | F92: 造纸包装 | G92: 包装用纸 | H92: 112.51 | I92: -1.8799999999999997e-002 | J92: 1.7000000000000001e-002 | K92: 3.26 | L92: -3.0999999999999999e-003 | M92: 116.2 | N92: 3.3 | O92: 0.13900000000000001 | P92: 98.79 | Q92: 转股中 | R92: 5年30天 | S92: 3年30天 | T92: 18.6 | U92: 9.6 | V92: 5.0000000000000001e-003 | W92: 0.124 | X92: 0.12300000000000001 | Y92: 150 | Z92: 1.02 | AA92: 6.5000000000000006e-003 | AB92: 8.0000000000000004e-004 | AC92: -2.5499999999999998e-002 | AD92: -2.75e-002 | AE92: 90.18 | AF92: 93.81 | AG92: 0.57 | AH92: AA+ | AI92: 4.3899999999999995e-002 | AJ92: =H92+100*O92 -> 126.41000000000001 | AK92: 126.2 | AL92: 40 | AM92: 32.4 | AN92: 32 | AO92: 3.3000000000000002e-002 | AP92: 39 | AQ92: 鹰19转债
A93: 15 | B93: 123064 | C93: 万孚转债 | D93: 300482 | E93: 万孚生物 | F93: 医药 | G93: 医疗器械 | H93: 110.95 | I93: 1.4000000000000002e-003 | J93: -9.1000000000000004e-003 | K93: 68.9 | L93: -2.41e-002 | M93: 115.1 | N93: 93.55 | O93: 0.50600000000000001 | P93: 73.65 | Q93: 3月25天 | R93: 5.80年 | S93: 3.80年 | T93: 6 | U93: 10 | V93: 1.6e-002 | W93: 2.5000000000000001e-002 | X93: 1.9e-002 | Y93: 236 | Z93: 8.72 | AA93: 6.5000000000000006e-003 | AB93: 1.8e-003 | AC93: -1.7299999999999999e-002 | AD93: -1.9e-002 | AE93: 86.83 | AF93: 89.13 | AG93: 0.32 | AH93: AA | AI93: 4.5899999999999996e-002 | AJ93: =H93+100*O93 -> 161.55000000000001 | AK93: 148.2 | AL93: 231 | AM93: 59.1 | AN93: 221 | AO93: -0.122 | AP93: 6 | AQ93: 万孚转债
A94: 79 | B94: 113584 | C94: 家悦转债! | D94: 603708 | E94: 家家悦 | F94: 商业零售 | G94: 超市 | H94: 111.38 | I94: -1.1000000000000001e-003 | J94: 3.0000000000000001e-003 | K94: 25.88 | L94: 8.199999999999999e-003 | M94: 115.3 | N94: 37.97 | O94: 0.63400000000000001 | P94: 68.16 | Q94: 29天 | R94: 5.56年 | S94: 3.56年 | T94: 6.45 | U94: 2.6 | V94: 4.0000000000000001e-003 | W94: 4.0999999999999995e-002 | X94: 2.7999999999999997e-002 | Y94: 157 | Z94: 5.25 | AA94: 6.4000000000000003e-003 | AB94: 1.4000000000000002e-003 | AC94: -1.89e-002 | AD94: -2.0799999999999999e-002 | AE94: 87.97 | AF94: 90.29 | AG94: 0.23 | AH94: AA | AI94: 4.5899999999999996e-002 | AJ94: =H94+100*O94 -> 174.78 | AK94: 154.6 | AL94: 246 | AM94: 64.3 | AN94: 244 | AO94: -0.107 | AP94: 4 | AQ94: 家悦转债!
A95: 17 | B95: 128129 | C95: 青农转债 | D95: 2958 | E95: 青农商行 | F95: 金融 | G95: 银行行业 | H95: 108.222 | I95: -1.8799999999999997e-002 | J95: 1.6200000000000003e-002 | K95: 4.71 | L95: -6.3e-003 | M95: 112.2 | N95: 5.74 | O95: 0.31900000000000001 | P95: 82.06 | Q95: 3月18天 | R95: 5.78年 | S95: 无权 | T95: 50 | U95: 96 | V95: 1.8000000000000002e-002 | W95: 0.191 | X95: 0.157 | Y95: 262 | Z95: 1.01 | AA95: 6.4000000000000003e-003 | AB95: 2.5000000000000001e-003 | AC95: 无权 | AD95: 无权 | AE95: 无权 | AF95: 89.29 | AG95: 0.42 | AH95: AAA | AI95: 4.0899999999999999e-002 | AJ95: =H95+100*O95 -> 140.12199999999999 | AK95: 134.4 | AL95: 135 | AM95: 45.1 | AN95: 149 | AO95: -5.0000000000000003e-002 | AP95: 11 | AQ95: 青农转债
A96: 282 | B96: 123004 | C96: 铁汉转债! | D96: 300197 | E96: 铁汉生态 | F96: 城市公用 | G96: 生态环境 | H96: 107.77 | I96: -2.3999999999999998e-003 | J96: 3.4999999999999996e-003 | K96: 3.51 | L96: 2.8999999999999998e-003 | M96: 109.8 | N96: 3.98 | O96: 0.222 | P96: 88.19 | Q96: 转股中 | R96: 3年35天 | S96: 1年35天 | T96: 8.03 | U96: 5.6 | V96: 6.0000000000000001e-003 | W96: 9.6999999999999989e-002 | X96: 8.5999999999999993e-002 | Y96: 83 | Z96: 1.6 | AA96: 6.1999999999999998e-003 | AB96: 2.0000000000000001e-004 | AC96: -3.9e-002 | AD96: -4.2699999999999995e-002 | AE96: 97.18 | AF96: 96.38 | AG96: 0.38 | AH96: AA | AI96: 4.4000000000000004e-002 | AJ96: =H96+100*O96 -> 129.97 | AK96: 127.3 | AL96: 49 | AM96: 30.2 | AN96: 24 | AO96: -6.5000000000000002e-002 | AP96: 39 | AQ96: 铁汉转债!
A97: 292 | B97: 128018 | C97: 时达转债! | D97: 2527 | E97: 新时达 | F97: 机械装备 | G97: 机器人及 | H97: 107.38 | I97: -2.5099999999999997e-002 | J97: 4.1100000000000005e-002 | K97: 6.8 | L97: 3.6600000000000001e-002 | M97: 109.3 | N97: 7.42 | O97: 0.17199999999999999 | P97: 91.64 | Q97: 转股中 | R97: 2.98年 | S97: 0.98年 | T97: 8.8 | U97: 198 | V97: 0.20600000000000002 | W97: 0.20899999999999999 | X97: 0.191 | Y97: 42 | Z97: 1.66 | AA97: 6.0999999999999995e-003 | AB97: 2.0000000000000001e-004 | AC97: -4.5499999999999999e-002 | AD97: -4.8499999999999995e-002 | AE97: 97 | AF97: 96.57 | AG97: 0.44 | AH97: AA | AI97: 4.3099999999999999e-002 | AJ97: =H97+100*O97 -> 124.58 | AK97: 123.1 | AL97: 20 | AM97: 26.1 | AN97: 11 | AO97: 0.158 | AP97: 40 | AQ97: 时达转债!
A98: 238 | B98: 128049 | C98: 华源转债! | D98: 2787 | E98: 华源控股 | F98: 造纸包装 | G98: 包装材料 | H98: 112.489 | I98: 6.6e-003 | J98: 3.4999999999999996e-003 | K98: 7.07 | L98: 1.7299999999999999e-002 | M98: 115.2 | N98: 7.42 | O98: 0.18100000000000002 | P98: 95.28 | Q98: 转股中 | R98: 4年14天 | S98: 2年14天 | T98: 3.63 | U98: 6.3 | V98: 1.4999999999999999e-002 | W98: 0.16200000000000001 | X98: 0.155 | Y98: 22 | Z98: 1.49 | AA98: 6.0999999999999995e-003 | AB98: -7.000000000000001e-004 | AC98: -3.7400000000000003e-002 | AD98: -4.0300000000000002e-002 | AE98: 90.28 | AF98: 89.89 | AG98: 0.59 | AH98: AA- | AI98: 6.5000000000000002e-002 | AJ98: =H98+100*O98 -> 130.589 | AK98: 129.7 | AL98: 74 | AM98: 39.4 | AN98: 99 | AO98: -5.7999999999999996e-002 | AP98: 52 | AQ98: 华源转债!
A99: 290 | B99: 113502 | C99: 嘉澳转债! | D99: 603822 | E99: 嘉澳环保 | F99: 化工 | G99: 化工 | H99: 109.37 | I99: 6.0599999999999994e-002 | J99: -6.0599999999999994e-002 | K99: 23.62 | L99: 1.6799999999999999e-002 | M99: 111.3 | N99: 44.79 | O99: 1.0700000000000001 | P99: 52.73 | Q99: 转股中 | R99: 2.99年 | S99: 0.99年 | T99: 1.85 | U99: 95 | V99: 0.47999999999999998 | W99: 0.107 | X99: 5.5999999999999994e-002 | Y99: 17 | Z99: 2.3 | AA99: 6.0000000000000001e-003 | AB99: -1.e-003 | AC99: -6.0199999999999997e-002 | AD99: -6.3e-002 | AE99: 94.75 | AF99: 92.68 | AG99: 0 | AH99: AA- | AI99: 6.4100000000000004e-002 | AJ99: =H99+100*O99 -> 216.37 | AK99: 166 | AL99: 256 | AM99: 71.3 | AN99: 253 | AO99: -2.e-002 | AP99: 29 | AQ99: 嘉澳转债!
A100: 44 | B100: 113594 | C100: 淳中转债 | D100: 603516 | E100: 淳中科技 | F100: 电子 | G100: 电子产品 | H100: 117.4 | I100: -8.3999999999999995e-003 | J100: 1.21e-002 | K100: 36.48 | L100: 5.5000000000000005e-003 | M100: 121.4 | N100: 39.37 | O100: 0.26700000000000002 | P100: 92.66 | Q100: 2月15天 | R100: 5.69年 | S100: 3.69年 | T100: 3 | U100: 3.9 | V100: 1.1000000000000001e-002 | W100: 6.2e-002 | X100: 5.7000000000000002e-002 | Y100: 49 | Z100: 5.41 | AA100: 6.0000000000000001e-003 | AB100: -4.0000000000000002e-004 | AC100: -2.9900000000000003e-002 | AD100: -3.2099999999999997e-002 | AE100: 78.6 | AF100: 80.04 | AG100: 0.67 | AH100: A+ | AI100: 7.7899999999999997e-002 | AJ100: =H100+100*O100 -> 144.10000000000002 | AK100: 142.1 | AL100: 197 | AM100: 62.1 | AN100: 237 | AO100: 5.0000000000000001e-003 | AP100: 5 | AQ100: 淳中转债
A101: 178 | B101: 128074 | C101: 游族转债!! | D101: 2174 | E101: 游族网络 | F101: 通信互联 | G101: 互联网 | H101: 116.69 | I101: 2.9999999999999997e-004 | J101: -2.9999999999999997e-004 | K101: 16.52 | L101: 6.0999999999999995e-003 | M101: 119.9 | N101: 16.97 | O101: 0.19899999999999998 | P101: 97.35 | Q101: 转股中 | R101: 4.86年 | S101: 2.86年 | T101: 6.83 | U101: 8.6 | V101: 1.1000000000000001e-002 | W101: 4.4999999999999998e-002 | X101: 4.4000000000000004e-002 | Y101: 151 | Z101: 2.67 | AA101: 5.6999999999999993e-003 | AB101: -1.4000000000000002e-003 | AC101: -3.95e-002 | AD101: -4.1500000000000002e-002 | AE101: 90.87 | AF101: 97.62 | AG101: 0 | AH101: AA | AI101: 4.4000000000000004e-002 | AJ101: =H101+100*O101 -> 136.59 | AK101: 136 | AL101: 146 | AM101: 38.4 | AN101: 89 | AO101: 2.7000000000000003e-002 | AP101: 21 | AQ101: 游族转债!!
A102: 73 | B102: 123054 | C102: 思特转债 | D102: 300608 | E102: 思特奇 | F102: 通信互联 | G102: 通信设备 | H102: 117.96 | I102: 2.5600000000000001e-002 | J102: -2.64e-002 | K102: 17.18 | L102: -1.1999999999999999e-003 | M102: 121.7 | N102: 16.49 | O102: 0.13200000000000001 | P102: 104.18 | Q102: 33天 | R102: 5.57年 | S102: 3.57年 | T102: 2.71 | U102: 55 | V102: 0.17399999999999999 | W102: 0.10000000000000001 | X102: 0.10400000000000001 | Y102: 27 | Z102: 3.57 | AA102: 5.6999999999999993e-003 | AB102: -8.9999999999999998e-004 | AC102: -3.1899999999999998e-002 | AD102: -3.4200000000000001e-002 | AE102: 82.36 | AF102: 85.57 | AG102: 0.72 | AH102: AA- | AI102: 6.6900000000000001e-002 | AJ102: =H102+100*O102 -> 131.16 | AK102: 131.7 | AL102: 106 | AM102: 46.2 | AN102: 156 | AO102: -7.0000000000000007e-002 | AP102: 14 | AQ102: 思特转债
A103: 215 | B103: 123023 | C103: 迪森转债! | D103: 300335 | E103: 迪森股份 | F103: 能源电力 | G103: 电力供应 | H103: 112.2 | I103: 7.1999999999999998e-003 | J103: -2.0400000000000001e-002 | K103: 6.59 | L103: -2.6600000000000002e-002 | M103: 114.9 | N103: 7.04 | O103: 0.19899999999999998 | P103: 93.61 | Q103: 转股中 | R103: 4.35年 | S103: 3.35年 | T103: 5.3 | U103: 46 | V103: 7.6999999999999999e-002 | W103: 0.222 | X103: 0.20699999999999999 | Y103: 24 | Z103: 1.77 | AA103: 5.6000000000000008e-003 | AB103: -5.9999999999999995e-004 | AC103: -1.84e-002 | AD103: -2.1099999999999997e-002 | AE103: 90.68 | AF103: 95.66 | AG103: 0.5 | AH103: AA | AI103: 4.4000000000000004e-002 | AJ103: =H103+100*O103 -> 132.09999999999999 | AK103: 130.8 | AL103: 91 | AM103: 35.1 | AN103: 59 | AO103: -0.10800000000000001 | AP103: 56 | AQ103: 迪森转债!
A104: 163 | B104: 113549 | C104: 白电转债 | D104: 603861 | E104: 白云电器 | F104: 能源电力 | G104: 电力设备 | H104: 111.99 | I104: -8.0000000000000002e-003 | J104: -5.5000000000000005e-003 | K104: 8.84 | L104: -2.2099999999999998e-002 | M104: 115.1 | N104: 8.88 | O104: 0.125 | P104: 99.55 | Q104: 转股中 | R104: 5年2.1天 | S104: 3年2.1天 | T104: 8.8 | U104: 15 | V104: 1.4999999999999999e-002 | W104: 0.22500000000000001 | X104: 0.22399999999999998 | Y104: 39 | Z104: 1.67 | AA104: 5.6000000000000008e-003 | AB104: 2.0000000000000001e-004 | AC104: -2.4500000000000001e-002 | AD104: -2.6600000000000002e-002 | AE104: 89.99 | AF104: 92.36 | AG104: 0.61 | AH104: AA | AI104: 4.5899999999999996e-002 | AJ104: =H104+100*O104 -> 124.48999999999999 | AK104: 124.4 | AL104: 25 | AM104: 32.1 | AN104: 31 | AO104: 6.7000000000000004e-002 | AP104: 31 | AQ104: 白电转债
A105: 91 | B105: 113578 | C105: 全筑转债 | D105: 603030 | E105: 全筑股份 | F105: 建筑 | G105: 装饰工程 | H105: 114.8 | I105: 6.8999999999999999e-003 | J105: -4.6999999999999993e-003 | K105: 5.49 | L105: 3.7000000000000002e-003 | M105: 118.3 | N105: 5.43 | O105: 0.13500000000000001 | P105: 101.1 | Q105: 转股中 | R105: 5.43年 | S105: 3.43年 | T105: 3.84 | U105: 8.8 | V105: 2.e-002 | W105: 0.13 | X105: 0.13100000000000001 | Y105: 30 | Z105: 1.33 | AA105: 5.6000000000000008e-003 | AB105: -2.9999999999999997e-004 | AC105: -2.7900000000000001e-002 | AD105: -2.98e-002 | AE105: 88.47 | AF105: 93.15 | AG105: 0.6 | AH105: AA | AI105: 4.5899999999999996e-002 | AJ105: =H105+100*O105 -> 128.30000000000001 | AK105: 128.5 | AL105: 60 | AM105: 35.3 | AN105: 61 | AO105: -1.1000000000000001e-002 | AP105: 11 | AQ105: 全筑转债
A106: 191 | B106: 123028 | C106: 清水转债 | D106: 300437 | E106: 清水源 | F106: 城市公用 | G106: 三废处理 | H106: 119 | I106: -2.8000000000000004e-003 | J106: 3.4000000000000002e-003 | K106: 13.7 | L106: 7.000000000000001e-004 | M106: 121.8 | N106: 11.84 | O106: 2.7999999999999997e-002 | P106: 115.71 | Q106: 转股中 | R106: 4.60年 | S106: 2.60年 | T106: 4.56 | U106: 44 | V106: 8.0000000000000002e-002 | W106: 0.152 | X106: 0.17600000000000002 | Y106: 30 | Z106: 1.94 | AA106: 5.1999999999999998e-003 | AB106: -2.8999999999999998e-003 | AC106: -4.58e-002 | AD106: -4.8799999999999996e-002 | AE106: 88.2 | AF106: 91.89 | AG106: 0.75 | AH106: AA- | AI106: 6.5000000000000002e-002 | AJ106: =H106+100*O106 -> 121.8 | AK106: 122.3 | AL106: 13 | AM106: 30.4 | AN106: 25 | AO106: 3.5000000000000003e-002 | AP106: 50 | AQ106: 清水转债
A107: 233 | B107: 113525 | C107: 台华转债! | D107: 603055 | E107: 台华新材 | F107: 服装纺织 | G107: 纺织行业 | H107: 112.62 | I107: -1.04e-002 | J107: 5.1999999999999998e-003 | K107: 7.59 | L107: -1.04e-002 | M107: 114.9 | N107: 8.03 | O107: 0.191 | P107: 94.52 | Q107: 转股中 | R107: 4年34天 | S107: 2年34天 | T107: 4.69 | U107: 1.3 | V107: 2.e-003 | W107: 8.0000000000000002e-002 | X107: 7.4999999999999997e-002 | Y107: 59 | Z107: 2.22 | AA107: 5.0000000000000001e-003 | AB107: -1.5e-003 | AC107: -3.7499999999999999e-002 | AD107: -4.0300000000000002e-002 | AE107: 93.92 | AF107: 96.71 | AG107: 0.49 | AH107: AA | AI107: 4.4000000000000004e-002 | AJ107: =H107+100*O107 -> 131.72 | AK107: 130.7 | AL107: 90 | AM107: 34 | AN107: 48 | AO107: -6.7000000000000004e-002 | AP107: 22 | AQ107: 台华转债!
A108: 135 | B108: 128094 | C108: 星帅转债 | D108: 2860 | E108: 星帅尔 | F108: 家电 | G108: 零部件制 | H108: 118.68 | I108: 5.28e-002 | J108: -4.0899999999999999e-002 | K108: 13.5 | L108: 1.7299999999999999e-002 | M108: 121.5 | N108: 13.95 | O108: 0.22600000000000001 | P108: 96.77 | Q108: 转股中 | R108: 5.18年 | S108: 3.18年 | T108: 2.8 | U108: 529 | V108: 1.6100000000000001 | W108: 0.10400000000000001 | X108: 0.10099999999999999 | Y108: 27 | Z108: 2.88 | AA108: 4.6999999999999993e-003 | AB108: -2.5000000000000001e-003 | AC108: -3.7599999999999995e-002 | AD108: -4.0099999999999997e-002 | AE108: 81.7 | AF108: 83.24 | AG108: 0.69 | AH108: A+ | AI108: 7.7899999999999997e-002 | AJ108: =H108+100*O108 -> 141.28 | AK108: 140.6 | AL108: 180 | AM108: 57.3 | AN108: 216 | AO108: -1.1000000000000001e-002 | AP108: 31 | AQ108: 星帅转债
A109: 198 | B109: 128066 | C109: 亚泰转债! | D109: 2811 | E109: 郑中设计 | F109: 建筑 | G109: 装饰工程 | H109: 115.2 | I109: 8.0000000000000004e-004 | J109: -4.4000000000000003e-003 | K109: 10.41 | L109: -4.7999999999999996e-003 | M109: 117.5 | N109: 9.67 | O109: 7.0000000000000007e-002 | P109: 107.65 | Q109: 转股中 | R109: 4.42年 | S109: 2.42年 | T109: 4.8 | U109: 2.8 | V109: 5.0000000000000001e-003 | W109: 0.17100000000000001 | X109: 0.184 | Y109: 28 | Z109: 1.91 | AA109: 4.5999999999999999e-003 | AB109: -2.3999999999999998e-003 | AC109: -3.9800000000000002e-002 | AD109: -4.24e-002 | AE109: 88.39 | AF109: 89.52 | AG109: 0.74 | AH109: AA- | AI109: 6.5000000000000002e-002 | AJ109: =H109+100*O109 -> 122.2 | AK109: 122.7 | AL109: 15 | AM109: 33.2 | AN109: 39 | AO109: -1.e-002 | AP109: 58 | AQ109: 亚泰转债!
A110: 49 | B110: 123059 | C110: 银信转债 | D110: 300231 | E110: 银信科技 | F110: 计算机及 | G110: 软件开发 | H110: 120.985 | I110: 2.0499999999999997e-002 | J110: -1.7100000000000001e-002 | K110: 10.4 | L110: 4.7999999999999996e-003 | M110: 124.1 | N110: 9.91 | O110: 0.153 | P110: 104.94 | Q110: 2月9天 | R110: 5.67年 | S110: 3.67年 | T110: 3.91 | U110: 44 | V110: 9.3000000000000013e-002 | W110: 8.5000000000000006e-002 | X110: 8.900000000000001e-002 | Y110: 46 | Z110: 3.5 | AA110: 4.5999999999999999e-003 | AB110: -2.5000000000000001e-003 | AC110: -3.9e-002 | AD110: -4.0899999999999999e-002 | AE110: 81.35 | AF110: 86.61 | AG110: 0.7 | AH110: AA- | AI110: 6.6900000000000001e-002 | AJ110: =H110+100*O110 -> 136.285 | AK110: 137 | AL110: 151 | AM110: 50.4 | AN110: 183 | AO110: -6.4000000000000001e-002 | AP110: 11 | AQ110: 银信转债
A111: 46 | B111: 113593 | C111: 沪工转债 | D111: 603131 | E111: 上海沪工 | F111: 机械装备 | G111: 通用设备 | H111: 118.65 | I111: 7.4999999999999997e-003 | J111: -6.4000000000000003e-003 | K111: 22.01 | L111: 1.4000000000000002e-003 | M111: 121.6 | N111: 21.32 | O111: 0.14899999999999999 | P111: 103.24 | Q111: 2月13天 | R111: 5.68年 | S111: 3.68年 | T111: 4 | U111: 11 | V111: 2.4e-002 | W111: 5.7000000000000002e-002 | X111: 5.9000000000000004e-002 | Y111: 70 | Z111: 5.68 | AA111: 4.4000000000000003e-003 | AB111: -2.0999999999999999e-003 | AC111: -3.2500000000000001e-002 | AD111: -3.4700000000000002e-002 | AE111: 78.61 | AF111: 80.17 | AG111: 0.76 | AH111: A+ | AI111: 7.7899999999999997e-002 | AJ111: =H111+100*O111 -> 133.55000000000001 | AK111: 134.1 | AL111: 130 | AM111: 53.9 | AN111: 202 | AO111: 0. | AP111: 7 | AQ111: 沪工转债
A112: 284 | B112: 128025 | C112: 特一转债! | D112: 2728 | E112: 特一药业 | F112: 医药 | G112: 化学制药 | H112: 108.4 | I112: 1.3999999999999999e-002 | J112: 4.6199999999999998e-002 | K112: 14.45 | L112: 9.9700000000000011e-002 | M112: 109.8 | N112: 14.7 | O112: 0.10300000000000001 | P112: 98.3 | Q112: 转股中 | R112: 3年23天 | S112: 1年23天 | T112: 2.99 | U112: 20 | V112: 6.2e-002 | W112: 0.10199999999999999 | X112: 0.10000000000000001 | Y112: 29 | Z112: 2.91 | AA112: 4.3e-003 | AB112: -1.7000000000000001e-003 | AC112: -4.4600000000000001e-002 | AD112: -4.8399999999999999e-002 | AE112: 94.99 | AF112: 90.93 | AG112: 0.6 | AH112: AA- | AI112: 6.5000000000000002e-002 | AJ112: =H112+100*O112 -> 118.7 | AK112: 118.5 | AL112: 6 | AM112: 23.5 | AN112: 7 | AO112: 0.10000000000000001 | AP112: 45 | AQ112: 特一转债!
A113: 142 | B113: 128090 | C113: 汽模转2 | D113: 2510 | E113: 天汽模 | F113: 汽车 | G113: 零部件制 | H113: 112.8 | I113: 5.7999999999999996e-003 | J113: -1.6000000000000001e-003 | K113: 4.01 | L113: 7.4999999999999997e-003 | M113: 115.2 | N113: 4.21 | O113: 0.184 | P113: 95.25 | Q113: 转股中 | R113: 5年44天 | S113: 3年44天 | T113: 4.67 | U113: 21 | V113: 4.0999999999999995e-002 | W113: 0.127 | X113: 0.121 | Y113: 37 | Z113: 1.38 | AA113: 4.1999999999999997e-003 | AB113: -1.1000000000000001e-003 | AC113: -2.5499999999999998e-002 | AD113: -2.76e-002 | AE113: 89.63 | AF113: 91.98 | AG113: 0.55 | AH113: AA | AI113: 4.5899999999999996e-002 | AJ113: =H113+100*O113 -> 131.19999999999999 | AK113: 130.4 | AL113: 84 | AM113: 38.4 | AN113: 87 | AO113: -3.7999999999999999e-002 | AP113: 26 | AQ113: 汽模转2
A114: 130 | B114: 113565 | C114: 宏辉转债 | D114: 603336 | E114: 宏辉果蔬 | F114: 农业 | G114: 农产品加 | H114: 115.67 | I114: 1.1000000000000001e-003 | J114: -1.1599999999999999e-002 | K114: 10.1 | L114: -1.46e-002 | M114: 118.2 | N114: 10 | O114: 0.14499999999999999 | P114: 101 | Q114: 转股中 | R114: 5.29年 | S114: 3.29年 | T114: 3.09 | U114: 7.2 | V114: 2.e-002 | W114: 9.3000000000000013e-002 | X114: 9.4e-002 | Y114: 33 | Z114: 3.59 | AA114: 4.1999999999999997e-003 | AB114: -1.9e-003 | AC114: -3.04e-002 | AD114: -3.2500000000000001e-002 | AE114: 83.49 | AF114: 84.61 | AG114: 0.71 | AH114: AA- | AI114: 6.6900000000000001e-002 | AJ114: =H114+100*O114 -> 130.16999999999999 | AK114: 130.3 | AL114: 83 | AM114: 45.7 | AN114: 153 | AO114: -4.9000000000000002e-002 | AP114: 19 | AQ114: 宏辉转债
A115: 216 | B115: 110056 | C115: 亨通转债! | D115: 600487 | E115: 亨通光电 | F115: 通信互联 | G115: 通信设备 | H115: 112.8 | I115: -1.2699999999999999e-002 | J115: 1.1599999999999999e-002 | K115: 15 | L115: -2.e-003 | M115: 114.8 | N115: 15.58 | O115: 0.17199999999999999 | P115: 96.28 | Q115: 转股中 | R115: 4.35年 | S115: 2.35年 | T115: 17.1 | U115: 9.9 | V115: 5.0000000000000001e-003 | W115: 5.7999999999999996e-002 | X115: 5.5999999999999994e-002 | Y115: 293 | Z115: 1.94 | AA115: 4.0999999999999995e-003 | AB115: -2.e-003 | AC115: -3.4700000000000002e-002 | AD115: -3.7200000000000004e-002 | AE115: 93.25 | AF115: 96.35 | AG115: 0.52 | AH115: AA+ | AI115: 4.2000000000000003e-002 | AJ115: =H115+100*O115 -> 130. | AK115: 129.3 | AL115: 69 | AM115: 33 | AN115: 38 | AO115: -1.e-002 | AP115: 29 | AQ115: 亨通转债!
A116: 121 | B116: 113570 | C116: 百达转债 | D116: 603331 | E116: 百达精工 | F116: 机械装备 | G116: 机械装备 | H116: 112.84 | I116: 1.9e-003 | J116: -8.3000000000000001e-003 | K116: 11.45 | L116: -8.6999999999999994e-003 | M116: 115.3 | N116: 11.54 | O116: 0.13699999999999998 | P116: 99.22 | Q116: 转股中 | R116: 5.32年 | S116: 3.32年 | T116: 2.8 | U116: 10 | V116: 3.2000000000000001e-002 | W116: 0.13699999999999998 | X116: 0.13600000000000001 | Y116: 20 | Z116: 2.65 | AA116: 4.0999999999999995e-003 | AB116: -1.e-003 | AC116: -2.3900000000000001e-002 | AD116: -2.5899999999999999e-002 | AE116: 80.12 | AF116: 78.01 | AG116: 0.75 | AH116: A+ | AI116: 7.7899999999999997e-002 | AJ116: =H116+100*O116 -> 126.54000000000001 | AK116: 126.5 | AL116: 41 | AM116: 46.3 | AN116: 159 | AO116: 6.8000000000000005e-002 | AP116: 33 | AQ116: 百达转债
A117: 304 | B117: 128010 | C117: 顺昌转债!! | D117: 2245 | E117: 澳洋顺昌 | F117: 交通运输 | G117: 物流业 | H117: 109.1 | I117: -1.e-004 | J117: 3.4000000000000002e-003 | K117: 7.95 | L117: 2.1899999999999999e-002 | M117: 109.6 | N117: 9.25 | O117: 0.26899999999999996 | P117: 85.95 | Q117: 转股中 | R117: 1.19年 | S117: 回售中 | T117: 5.09 | U117: 12 | V117: 2.2000000000000002e-002 | W117: 6.5000000000000002e-002 | X117: 5.5999999999999994e-002 | Y117: 78 | Z117: 3.43 | AA117: 3.9000000000000003e-003 | AB117: -1.1000000000000001e-002 | AC117: 回售中 | AD117: 回售中 | AE117: 100.27 | AF117: 104.29 | AG117: 0.15 | AH117: AA | AI117: 4.3099999999999999e-002 | AJ117: =H117+100*O117 -> 136. | AK117: 132.3 | AL117: 110 | AM117: 28 | AN117: 18 | AO117: 0.17999999999999999 | AP117: 40 | AQ117: 顺昌转债!!
A118: 167 | B118: 123033 | C118: 金力转债! | D118: 300748 | E118: 金力永磁 | F118: 电子 | G118: 元器件制 | H118: 119.36 | I118: 1.9e-003 | J118: -8.6e-003 | K118: 41.46 | L118: -1.e-002 | M118: 121.5 | N118: 40.97 | O118: 0.17899999999999999 | P118: 101.2 | Q118: 转股中 | R118: 4.97年 | S118: 2.97年 | T118: 4.35 | U118: 181 | V118: 0.34399999999999997 | W118: 2.5000000000000001e-002 | X118: 2.6000000000000002e-002 | Y118: 172 | Z118: 12.83 | AA118: 3.7000000000000002e-003 | AB118: -3.7000000000000002e-003 | AC118: -4.0599999999999997e-002 | AD118: -4.3400000000000001e-002 | AE118: 86.43 | AF118: 89.63 | AG118: 0.67 | AH118: AA- | AI118: 6.5000000000000002e-002 | AJ118: =H118+100*O118 -> 137.25999999999999 | AK118: 137.5 | AL118: 154 | AM118: 47.9 | AN118: 171 | AO118: 3.7000000000000005e-002 | AP118: 27 | AQ118: 金力转债!
A119: 13 | B119: 128131 | C119: 崇达转2 | D119: 2815 | E119: 崇达技术 | F119: 电子 | G119: 元器件制 | H119: 113.2 | I119: -6.7000000000000002e-003 | J119: 1.01e-002 | K119: 16.37 | L119: 7.4000000000000003e-003 | M119: 115.2 | N119: 19.54 | O119: 0.35100000000000003 | P119: 83.78 | Q119: 3月28天 | R119: 5.82年 | S119: 3.82年 | T119: 14 | U119: 14 | V119: 9.0000000000000011e-003 | W119: 9.6999999999999989e-002 | X119: 8.1000000000000003e-002 | Y119: 144 | Z119: 3.61 | AA119: 3.0999999999999999e-003 | AB119: -1.6000000000000001e-003 | AC119: -2.1899999999999999e-002 | AD119: -2.3700000000000002e-002 | AE119: 86.86 | AF119: 89.16 | AG119: 0.45 | AH119: AA | AI119: 4.5899999999999996e-002 | AJ119: =H119+100*O119 -> 148.30000000000001 | AK119: 142.6 | AL119: 201 | AM119: 53.5 | AN119: 197 | AO119: -3.7999999999999999e-002 | AP119: 4 | AQ119: 崇达转2
A120: 258 | B120: 123010 | C120: 博世转债! | D120: 300422 | E120: 博世科 | F120: 城市公用 | G120: 三废处理 | H120: 111.1 | I120: -4.4000000000000003e-003 | J120: 6.4000000000000003e-003 | K120: 11.78 | L120: 3.4000000000000002e-003 | M120: 112.3 | N120: 12.2 | O120: 0.151 | P120: 96.56 | Q120: 转股中 | R120: 3.64年 | S120: 1.64年 | T120: 4.3 | U120: 7.2 | V120: 1.4999999999999999e-002 | W120: 8.9999999999999997e-002 | X120: 8.6999999999999994e-002 | Y120: 48 | Z120: 2.02 | AA120: 3.0000000000000001e-003 | AB120: -3.2000000000000002e-003 | AC120: -4.24e-002 | AD120: -4.5199999999999997e-002 | AE120: 91.82 | AF120: 89.69 | AG120: 0.6 | AH120: AA- | AI120: 6.5000000000000002e-002 | AJ120: =H120+100*O120 -> 126.19999999999999 | AK120: 125.6 | AL120: 34 | AM120: 33.8 | AN120: 46 | AO120: 2.8999999999999998e-002 | AP120: 26 | AQ120: 博世转债!
A121: 109 | B121: 110068 | C121: 龙净转债! | D121: 600388 | E121: 龙净环保 | F121: 城市公用 | G121: 三废处理 | H121: 113.19 | I121: 0. | J121: 3.9000000000000003e-003 | K121: 10.33 | L121: 6.8000000000000005e-003 | M121: 115 | N121: 10.73 | O121: 0.17600000000000002 | P121: 96.27 | Q121: 转股中 | R121: 5.36年 | S121: 3.36年 | T121: 20 | U121: 5.7 | V121: 3.0000000000000001e-003 | W121: 0.18100000000000002 | X121: 0.17399999999999999 | Y121: 110 | Z121: 1.91 | AA121: 3.0000000000000001e-003 | AB121: -2.e-003 | AC121: -2.53e-002 | AD121: -2.7099999999999999e-002 | AE121: 89.06 | AF121: 91.73 | AG121: 0.57 | AH121: AA+ | AI121: 4.3899999999999995e-002 | AJ121: =H121+100*O121 -> 130.78999999999999 | AK121: 130.1 | AL121: 81 | AM121: 38.4 | AN121: 88 | AO121: 3.7000000000000005e-002 | AP121: 29 | AQ121: 龙净转债!
A122: 45 | B122: 127020 | C122: 中金转债 | D122: 60 | E122: 中金岭南 | F122: 有色金属 | G122: 有色行业 | H122: 111.801 | I122: -8.0000000000000002e-003 | J122: 1.0500000000000001e-002 | K122: 4.46 | L122: 4.5000000000000005e-003 | M122: 113.7 | N122: 4.71 | O122: 0.18100000000000002 | P122: 94.69 | Q122: 2月13天 | R122: 5.68年 | S122: 3.68年 | T122: 38 | U122: 31 | V122: 6.9999999999999993e-003 | W122: 0.23899999999999999 | X122: 0.22600000000000001 | Y122: 159 | Z122: 1.41 | AA122: 3.0000000000000001e-003 | AB122: -1.2999999999999999e-003 | AC122: -2.2599999999999999e-002 | AD122: -2.3700000000000002e-002 | AE122: 86.92 | AF122: 89.34 | AG122: 0.56 | AH122: AA+ | AI122: 4.3899999999999995e-002 | AJ122: =H122+100*O122 -> 129.90100000000001 | AK122: 128.9 | AL122: 64 | AM122: 39.6 | AN122: 101 | AO122: 4.7e-002 | AP122: 12 | AQ122: 中金转债
A123: 39 | B123: 128122 | C123: 兴森转债 | D123: 2436 | E123: 兴森科技 | F123: 电子 | G123: 元器件制 | H123: 111.78 | I123: 1.9599999999999999e-002 | J123: -2.07e-002 | K123: 10.96 | L123: -3.5999999999999999e-003 | M123: 113.3 | N123: 14.18 | O123: 0.44600000000000001 | P123: 77.29 | Q123: 2月17天 | R123: 4.69年 | S123: 3.69年 | T123: 2.69 | U123: 31 | V123: 0.10400000000000001 | W123: 1.6e-002 | X123: 1.3000000000000001e-002 | Y123: 163 | Z123: 5.16 | AA123: 2.8999999999999998e-003 | AB123: -2.2000000000000001e-003 | AC123: -1.9599999999999999e-002 | AD123: -2.1299999999999999e-002 | AE123: 87.9 | AF123: 92.8 | AG123: 0.31 | AH123: AA | AI123: 4.4000000000000004e-002 | AJ123: =H123+100*O123 -> 156.38 | AK123: 146.3 | AL123: 219 | AM123: 53.5 | AN123: 198 | AO123: 0. | AP123: 7 | AQ123: 兴森转债
A124: 77 | B124: 123053 | C124: 宝通转债 | D124: 300031 | E124: 宝通科技 | F124: 通信互联 | G124: 互联网 | H124: 119.66 | I124: -2.8999999999999998e-003 | J124: -5.8999999999999999e-003 | K124: 21.45 | L124: -1.24e-002 | M124: 121.3 | N124: 20.8 | O124: 0.16 | P124: 103.12 | Q124: 28天 | R124: 5.56年 | S124: 3.56年 | T124: 5 | U124: 5.1 | V124: 9.0000000000000011e-003 | W124: 5.9000000000000004e-002 | X124: 6.0999999999999999e-002 | Y124: 85 | Z124: 2.96 | AA124: 2.5000000000000001e-003 | AB124: -4.0000000000000001e-003 | AC124: -3.6799999999999999e-002 | AD124: -3.8800000000000001e-002 | AE124: 82.12 | AF124: 85.32 | AG124: 0.71 | AH124: AA- | AI124: 6.6900000000000001e-002 | AJ124: =H124+100*O124 -> 135.66 | AK124: 136.2 | AL124: 148 | AM124: 50.9 | AN124: 185 | AO124: -5.0000000000000001e-003 | AP124: 6 | AQ124: 宝通转债
A125: 125 | B125: 113567 | C125: 君禾转债 | D125: 603617 | E125: 君禾股份 | F125: 机械装备 | G125: 通用设备 | H125: 117.89 | I125: -3.2099999999999997e-002 | J125: -2.5899999999999999e-002 | K125: 12.57 | L125: -7.3700000000000002e-002 | M125: 119.3 | N125: 11.46 | O125: 7.4999999999999997e-002 | P125: 109.69 | Q125: 转股中 | R125: 5.30年 | S125: 3.30年 | T125: 2.1 | U125: 38 | V125: 0.151 | W125: 8.4000000000000005e-002 | X125: 9.1999999999999998e-002 | Y125: 25 | Z125: 3.89 | AA125: 2.3e-003 | AB125: -4.0000000000000001e-003 | AC125: -3.4700000000000002e-002 | AD125: -3.7000000000000005e-002 | AE125: 80.82 | AF125: 80.96 | AG125: 0.79 | AH125: A+ | AI125: 7.7899999999999997e-002 | AJ125: =H125+100*O125 -> 125.39 | AK125: 126.1 | AL125: 39 | AM125: 45.1 | AN125: 151 | AO125: 4.0000000000000001e-003 | AP125: 32 | AQ125: 君禾转债
A126: 31 | B126: 128125 | C126: 华阳转债 | D126: 2949 | E126: 华阳国际 | F126: 建筑 | G126: 建筑工程 | H126: 117.01 | I126: -4.1999999999999997e-003 | J126: -7.1999999999999998e-003 | K126: 23.97 | L126: -1.7600000000000001e-002 | M126: 118.5 | N126: 25.79 | O126: 0.25900000000000001 | P126: 92.94 | Q126: 2月24天 | R126: 5.71年 | S126: 3.71年 | T126: 4.5 | U126: 4.1 | V126: 8.0000000000000002e-003 | W126: 9.6000000000000002e-002 | X126: 8.900000000000001e-002 | Y126: 47 | Z126: 3.86 | AA126: 2.3e-003 | AB126: -3.4000000000000002e-003 | AC126: -3.0600000000000002e-002 | AD126: -3.2400000000000005e-002 | AE126: 80.98 | AF126: 82.47 | AG126: 0.64 | AH126: AA- | AI126: 6.6900000000000001e-002 | AJ126: =H126+100*O126 -> 142.91 | AK126: 141.1 | AL126: 186 | AM126: 58.6 | AN126: 219 | AO126: -8.5000000000000006e-002 | AP126: 3 | AQ126: 华阳转债
A127: 175 | B127: 128076 | C127: 金轮转债! | D127: 2722 | E127: 金轮股份 | F127: 机械装备 | G127: 专用设备 | H127: 113.69 | I127: 5.7599999999999998e-002 | J127: -5.5500000000000001e-002 | K127: 12.57 | L127: 4.0000000000000001e-003 | M127: 114.9 | N127: 14.76 | O127: 0.33500000000000002 | P127: 85.16 | Q127: 转股中 | R127: 4.92年 | S127: 2.92年 | T127: 2.14 | U127: 235 | V127: 0.98299999999999998 | W127: 9.6999999999999989e-002 | X127: 8.3000000000000004e-002 | Y127: 22 | Z127: 1.2 | AA127: 2.2000000000000001e-003 | AB127: -3.2000000000000002e-003 | AC127: -3.0499999999999999e-002 | AD127: -3.2599999999999997e-002 | AE127: 85.29 | AF127: 84.8 | AG127: 0.52 | AH127: AA- | AI127: 6.5000000000000002e-002 | AJ127: =H127+100*O127 -> 147.19 | AK127: 142.2 | AL127: 198 | AM127: 56.9 | AN127: 214 | AO127: -2.e-003 | AP127: 42 | AQ127: 金轮转债!
A128: 90 | B128: 128107 | C128: 交科转债 | D128: 2061 | E128: 浙江交科 | F128: 建筑 | G128: 建筑工程 | H128: 114 | I128: -5.1999999999999998e-003 | J128: -2.7000000000000001e-003 | K128: 5.39 | L128: -1.2800000000000001e-002 | M128: 115.3 | N128: 5.36 | O128: 0.13400000000000001 | P128: 100.56 | Q128: 转股中 | R128: 5.44年 | S128: 3.44年 | T128: 25 | U128: 33 | V128: 1.2e-002 | W128: 0.33700000000000002 | X128: 0.33899999999999997 | Y128: 74 | Z128: 0.93 | AA128: 2.0999999999999999e-003 | AB128: -2.8999999999999998e-003 | AC128: -2.5899999999999999e-002 | AD128: -2.7900000000000001e-002 | AE128: 89.05 | AF128: 91.71 | AG128: 0.62 | AH128: AA+ | AI128: 4.3899999999999995e-002 | AJ128: =H128+100*O128 -> 127.40000000000001 | AK128: 127.4 | AL128: 51 | AM128: 35.7 | AN128: 65 | AO128: -2.5000000000000001e-002 | AP128: 14 | AQ128: 交科转债
A129: 16 | B129: 128130 | C129: 景兴转债 | D129: 2067 | E129: 景兴纸业 | F129: 造纸包装 | G129: 包装用纸 | H129: 113.73 | I129: -1.2800000000000001e-002 | J129: 1.09e-002 | K129: 3.41 | L129: -2.8999999999999998e-003 | M129: 115.1 | N129: 3.4 | O129: 0.13400000000000001 | P129: 100.29 | Q129: 3月21天 | R129: 5.80年 | S129: 3.80年 | T129: 12.8 | U129: 18 | V129: 1.2e-002 | W129: 0.33799999999999997 | X129: 0.33899999999999997 | Y129: 38 | Z129: 0.84 | AA129: 2.0999999999999999e-003 | AB129: -2.5999999999999999e-003 | AC129: -2.3399999999999997e-002 | AD129: -2.5099999999999997e-002 | AE129: 86.84 | AF129: 89.14 | AG129: 0.63 | AH129: AA | AI129: 4.5899999999999996e-002 | AJ129: =H129+100*O129 -> 127.13000000000001 | AK129: 127.2 | AL129: 47 | AM129: 38 | AN129: 82 | AO129: 1.4999999999999999e-002 | AP129: 10 | AQ129: 景兴转债
A130: 267 | B130: 127006 | C130: 敖东转债! | D130: 623 | E130: 吉林敖东 | F130: 金融 | G130: 证券行业 | H130: 107.501 | I130: -1.2e-002 | J130: 8.0000000000000002e-003 | K130: 17.39 | L130: -1.1399999999999999e-002 | M130: 108 | N130: 20.42 | O130: 0.26200000000000001 | P130: 85.16 | Q130: 转股中 | R130: 3.33年 | S130: 1.33年 | T130: 24.1 | U130: 9 | V130: 3.0000000000000001e-003 | W130: 0.11900000000000001 | X130: 0.10099999999999999 | Y130: 202 | Z130: 0.89 | AA130: 1.4000000000000002e-003 | AB130: -3.0999999999999999e-003 | AC130: -3.6799999999999999e-002 | AD130: -3.8900000000000004e-002 | AE130: 95.63 | AF130: 94.35 | AG130: 0.35 | AH130: AA+ | AI130: 4.2000000000000003e-002 | AJ130: =H130+100*O130 -> 133.70100000000002 | AK130: 129.8 | AL130: 77 | AM130: 34.2 | AN130: 51 | AO130: 1.e-002 | AP130: 26 | AQ130: 敖东转债!
A131: 26 | B131: 127021 | C131: 特发转2! | D131: 70 | E131: 特发信息 | F131: 通信互联 | G131: 通信设备 | H131: 112.547 | I131: -4.0999999999999995e-003 | J131: -2.2000000000000001e-003 | K131: 10.25 | L131: -1.6299999999999999e-002 | M131: 113.3 | N131: 12.33 | O131: 0.35399999999999998 | P131: 83.13 | Q131: 3月2天 | R131: 4.73年 | S131: 2.73年 | T131: 5.5 | U131: 15 | V131: 2.5000000000000001e-002 | W131: 6.6000000000000003e-002 | X131: 5.5e-002 | Y131: 84 | Z131: 2.95 | AA131: 1.4000000000000002e-003 | AB131: -3.5999999999999999e-003 | AC131: -3.3399999999999999e-002 | AD131: -3.4700000000000002e-002 | AE131: 90.13 | AF131: 92.63 | AG131: 0.39 | AH131: AA | AI131: 4.4000000000000004e-002 | AJ131: =H131+100*O131 -> 147.947 | AK131: 142 | AL131: 195 | AM131: 49.3 | AN131: 179 | AO131: 1.3000000000000001e-002 | AP131: 6 | AQ131: 特发转2!
A132: 286 | B132: 128022 | C132: 众信转债! | D132: 2707 | E132: 众信旅游 | F132: 旅游餐饮 | G132: 旅游 | H132: 109.402 | I132: -2.3199999999999998e-002 | J132: 1.6299999999999999e-002 | K132: 6.28 | L132: -2.7900000000000001e-002 | M132: 109.8 | N132: 7.92 | O132: 0.38 | P132: 79.29 | Q132: 转股中 | R132: 3年18天 | S132: 1年18天 | T132: 4.56 | U132: 100 | V132: 0.19800000000000001 | W132: 8.0000000000000002e-002 | X132: 6.4000000000000001e-002 | Y132: 57 | Z132: 2.68 | AA132: 1.1999999999999999e-003 | AB132: -4.7999999999999996e-003 | AC132: -5.2400000000000002e-002 | AD132: -5.62e-002 | AE132: 97.38 | AF132: 96.57 | AG132: 0.25 | AH132: AA | AI132: 4.4000000000000004e-002 | AJ132: =H132+100*O132 -> 147.40199999999999 | AK132: 139.5 | AL132: 169 | AM132: 42.1 | AN132: 130 | AO132: -1.3999999999999999e-002 | AP132: 23 | AQ132: 众信转债!
A133: 237 | B133: 110048 | C133: 福能转债! | D133: 600483 | E133: 福能股份 | F133: 能源电力 | G133: 电力供应 | H133: 113.42 | I133: -5.1999999999999998e-003 | J133: 3.3e-003 | K133: 7.64 | L133: -3.9000000000000003e-003 | M133: 113.9 | N133: 8.12 | O133: 0.20499999999999999 | P133: 94.09 | Q133: 转股中 | R133: 4年24天 | S133: 2年24天 | T133: 28.3 | U133: 18 | V133: 6.0000000000000001e-003 | W133: 0.20999999999999999 | X133: 0.19800000000000001 | Y133: 134 | Z133: 0.95 | AA133: 1.1000000000000001e-003 | AB133: -5.1000000000000004e-003 | AC133: -4.0999999999999995e-002 | AD133: -4.3799999999999999e-002 | AE133: 94.43 | AF133: 96.72 | AG133: 0.49 | AH133: AA+ | AI133: 4.2000000000000003e-002 | AJ133: =H133+100*O133 -> 133.92000000000002 | AK133: 132.8 | AL133: 118 | AM133: 36 | AN133: 66 | AO133: -2.1000000000000001e-002 | AP133: 9 | AQ133: 福能转债!
A134: 8 | B134: 113603 | C134: 东缆转债 | D134: 603606 | E134: 东方电缆 | F134: 能源电力 | G134: 电力设备 | H134: 114.81 | I134: -6.9999999999999993e-003 | J134: -1.9e-003 | K134: 21.25 | L134: -1.7100000000000001e-002 | M134: 115.1 | N134: 23.88 | O134: 0.28999999999999998 | P134: 88.99 | Q134: 4月17天 | R134: 5.86年 | S134: 3.86年 | T134: 8 | U134: 60 | V134: 6.5000000000000002e-002 | W134: 5.7999999999999996e-002 | X134: 5.0999999999999997e-002 | Y134: 139 | Z134: 5.13 | AA134: 4.0000000000000002e-004 | AB134: -4.1999999999999997e-003 | AC134: -2.5399999999999999e-002 | AD134: -2.7000000000000003e-002 | AE134: 86.59 | AF134: 88.88 | AG134: 0.52 | AH134: AA | AI134: 4.5899999999999996e-002 | AJ134: =H134+100*O134 -> 143.81 | AK134: 140.6 | AL134: 182 | AM134: 51.8 | AN134: 191 | AO134: -5.2999999999999999e-002 | AP134: 4 | AQ134: 东缆转债
A135: 34 | B135: 128124 | C135: 科华转债! | D135: 2022 | E135: 科华生物 | F135: 医药 | G135: 生物制药 | H135: 110.19 | I135: -4.4000000000000003e-003 | J135: 4.4000000000000003e-003 | K135: 18.41 | L135: 0. | M135: 110.3 | N135: 21.5 | O135: 0.28699999999999998 | P135: 85.63 | Q135: 2月22天 | R135: 5.70年 | S135: 3.70年 | T135: 7.38 | U135: 5.1 | V135: 6.0000000000000001e-003 | W135: 7.8e-002 | X135: 6.7000000000000004e-002 | Y135: 95 | Z135: 3.29 | AA135: 2.0000000000000001e-004 | AB135: -3.2000000000000002e-003 | AC135: -1.7299999999999999e-002 | AD135: -1.8799999999999997e-002 | AE135: 86.73 | AF135: 85.74 | AG135: 0.5 | AH135: AA | AI135: 4.5899999999999996e-002 | AJ135: =H135+100*O135 -> 138.88999999999999 | AK135: 134.8 | AL135: 137 | AM135: 48 | AN135: 172 | AO135: -6.0999999999999999e-002 | AP135: 11 | AQ135: 科华转债!
A136: 129 | B136: 113564 | C136: 天目转债 | D136: 603136 | E136: 天目湖 | F136: 旅游餐饮 | G136: 旅游 | H136: 126.69 | I136: -2.0000000000000001e-004 | J136: 6.6e-003 | K136: 28.39 | L136: 8.199999999999999e-003 | M136: 126.7 | N136: 23.8 | O136: 6.2e-002 | P136: 119.29 | Q136: 转股中 | R136: 5.29年 | S136: 3.29年 | T136: 3 | U136: 7.5 | V136: 2.e-002 | W136: 9.0999999999999998e-002 | X136: 0.109 | Y136: 33 | Z136: 3.54 | AA136: 0. | AB136: -8.199999999999999e-003 | AC136: -5.45e-002 | AD136: -5.6799999999999996e-002 | AE136: 83.88 | AF136: 90.68 | AG136: 0.79 | AH136: AA- | AI136: 6.6900000000000001e-002 | AJ136: =H136+100*O136 -> 132.88999999999999 | AK136: 134.1 | AL136: 131 | AM136: 43.4 | AN136: 140 | AO136: 3.4000000000000002e-002 | AP136: 13 | AQ136: 天目转债
A137: 143 | B137: 123039 | C137: 开润转债! | D137: 300577 | E137: 开润股份 | F137: 服装纺织 | G137: 纺织行业 | H137: 121.579 | I137: 2.0799999999999999e-002 | J137: -3.9300000000000002e-002 | K137: 33.65 | L137: -2.52e-002 | M137: 121.5 | N137: 33.22 | O137: 0.20000000000000001 | P137: 101.29 | Q137: 转股中 | R137: 5年43天 | S137: 3年43天 | T137: 2.22 | U137: 32 | V137: 0.11900000000000001 | W137: 2.9999999999999999e-002 | X137: 3.1e-002 | Y137: 73 | Z137: 8.77 | AA137: -1.e-004 | AB137: -7.3000000000000001e-003 | AC137: -4.5400000000000003e-002 | AD137: -4.7899999999999998e-002 | AE137: 82.05 | AF137: 83.6 | AG137: 0.73 | AH137: A+ | AI137: 7.7899999999999997e-002 | AJ137: =H137+100*O137 -> 141.57900000000001 | AK137: 141.9 | AL137: 193 | AM137: 58.3 | AN137: 218 | AO137: 2.e-003 | AP137: 25 | AQ137: 开润转债!
A138: 113 | B138: 128101 | C138: 联创转债! | D138: 2036 | E138: 联创电子 | F138: 电子 | G138: 液晶显示 | H138: 115.4 | I138: 1.23e-002 | J138: -4.4000000000000003e-003 | K138: 12.18 | L138: 1.84e-002 | M138: 115.1 | N138: 14.48 | O138: 0.37200000000000005 | P138: 84.12 | Q138: 转股中 | R138: 5.34年 | S138: 3.34年 | T138: 3 | U138: 23 | V138: 6.7000000000000004e-002 | W138: 2.7000000000000003e-002 | X138: 2.2000000000000002e-002 | Y138: 113 | Z138: 4.33 | AA138: -5.0000000000000001e-004 | AB138: -5.5000000000000005e-003 | AC138: -3.0600000000000002e-002 | AD138: -3.2500000000000001e-002 | AE138: 88.65 | AF138: 91 | AG138: 0.43 | AH138: AA | AI138: 4.5899999999999996e-002 | AJ138: =H138+100*O138 -> 152.60000000000002 | AK138: 146.7 | AL138: 220 | AM138: 55.7 | AN138: 211 | AO138: 9.6000000000000002e-002 | AP138: 15 | AQ138: 联创转债!
A139: 37 | B139: 128123 | C139: 国光转债 | D139: 2749 | E139: 国光股份 | F139: 化工 | G139: 农化 | H139: 116.989 | I139: -7.6e-003 | J139: -2.5600000000000001e-002 | K139: 12.27 | L139: -5.2499999999999998e-002 | M139: 116.2 | N139: 13.7 | O139: 0.30599999999999999 | P139: 89.56 | Q139: 2月20天 | R139: 5.70年 | S139: 3.70年 | T139: 3.2 | U139: 4.8 | V139: 1.3000000000000001e-002 | W139: 6.0999999999999999e-002 | X139: 5.4000000000000006e-002 | Y139: 53 | Z139: 4.3 | AA139: -1.1999999999999999e-003 | AB139: -6.1999999999999998e-003 | AC139: -2.9999999999999999e-002 | AD139: -3.1899999999999998e-002 | AE139: 81.28 | AF139: 81 | AG139: 0.63 | AH139: AA- | AI139: 6.6900000000000001e-002 | AJ139: =H139+100*O139 -> 147.589 | AK139: 144.4 | AL139: 208 | AM139: 63.1 | AN139: 240 | AO139: -5.2000000000000005e-002 | AP139: 7 | AQ139: 国光转债
A140: 7 | B140: 128134 | C140: 鸿路转债 | D140: 2541 | E140: 鸿路钢构 | F140: 建筑 | G140: 其他 | H140: 116 | I140: -1.8600000000000002e-002 | J140: -5.5000000000000005e-003 | K140: 39.1 | L140: -4.5599999999999995e-002 | M140: 115.1 | N140: 43.74 | O140: 0.29799999999999999 | P140: 89.39 | Q140: 5月3天 | R140: 5.90年 | S140: 3.90年 | T140: 18.8 | U140: 33 | V140: 1.4999999999999999e-002 | W140: 9.1999999999999998e-002 | X140: 8.199999999999999e-002 | Y140: 205 | Z140: 3.82 | AA140: -1.2999999999999999e-003 | AB140: -5.8999999999999999e-003 | AC140: -2.76e-002 | AD140: -2.92e-002 | AE140: 86.43 | AF140: 88.71 | AG140: 0.53 | AH140: AA | AI140: 4.5899999999999996e-002 | AJ140: =H140+100*O140 -> 145.80000000000001 | AK140: 142.6 | AL140: 200 | AM140: 53.9 | AN140: 203 | AO140: -1.8000000000000002e-002 | AP140: 2 | AQ140: 鸿路转债
A141: 273 | B141: 128034 | C141: 江银转债! | D141: 2807 | E141: 江阴银行 | F141: 金融 | G141: 银行行业 | H141: 109.57 | I141: -9.1999999999999998e-003 | J141: 8.199999999999999e-003 | K141: 4.07 | L141: -2.5000000000000001e-003 | M141: 109.1 | N141: 4.5 | O141: 0.21100000000000002 | P141: 90.44 | Q141: 转股中 | R141: 3.20年 | S141: 无权 | T141: 17.6 | U141: 5.5 | V141: 3.0000000000000001e-003 | W141: 0.19899999999999998 | X141: 0.17999999999999999 | Y141: 88 | Z141: 0.78 | AA141: -1.4000000000000002e-003 | AB141: -6.7000000000000002e-003 | AC141: 无权 | AD141: 无权 | AE141: 无权 | AF141: 95.85 | AG141: 0.44 | AH141: AA+ | AI141: 4.2000000000000003e-002 | AJ141: =H141+100*O141 -> 130.66999999999999 | AK141: 128.7 | AL141: 63 | AM141: 32.8 | AN141: 37 | AO141: -1.4999999999999999e-002 | AP141: 27 | AQ141: 江银转债!
A142: 68 | B142: 128114 | C142: 正邦转债 | D142: 2157 | E142: 正邦科技 | F142: 农业 | G142: 畜牧业 | H142: 116.199 | I142: -3.4000000000000002e-003 | J142: 1.21e-002 | K142: 16.89 | L142: 1.32e-002 | M142: 115.3 | N142: 16.09 | O142: 0.107 | P142: 104.97 | Q142: 40天 | R142: 5.59年 | S142: 3.59年 | T142: 16 | U142: 31 | V142: 1.7000000000000001e-002 | W142: 3.7999999999999999e-002 | X142: 3.9e-002 | Y142: 426 | Z142: 2.83 | AA142: -1.4000000000000002e-003 | AB142: -6.3e-003 | AC142: -2.98e-002 | AD142: -3.1699999999999999e-002 | AE142: 88.46 | AF142: 91.11 | AG142: 0.66 | AH142: AA+ | AI142: 4.3899999999999995e-002 | AJ142: =H142+100*O142 -> 126.899 | AK142: 127.4 | AL142: 50 | AM142: 36.3 | AN142: 68 | AO142: -2.9999999999999999e-002 | AP142: 9 | AQ142: 正邦转债
A143: 185 | B143: 128071 | C143: 合兴转债! | D143: 2228 | E143: 合兴包装 | F143: 造纸包装 | G143: 包装材料 | H143: 115.991 | I143: -5.1000000000000004e-003 | J143: -3.0000000000000001e-003 | K143: 4.26 | L143: -1.3899999999999999e-002 | M143: 114.8 | N143: 4.28 | O143: 0.16500000000000001 | P143: 99.53 | Q143: 转股中 | R143: 4.76年 | S143: 2.76年 | T143: 3 | U143: 5.7 | V143: 1.6e-002 | W143: 5.7000000000000002e-002 | X143: 5.7000000000000002e-002 | Y143: 53 | Z143: 1.58 | AA143: -2.2000000000000001e-003 | AB143: -7.7000000000000002e-003 | AC143: -3.9199999999999999e-002 | AD143: -4.1200000000000001e-002 | AE143: 91.18 | AF143: 93.89 | AG143: 0.58 | AH143: AA | AI143: 4.4000000000000004e-002 | AJ143: =H143+100*O143 -> 132.49099999999999 | AK143: 132.4 | AL143: 115 | AM143: 38.6 | AN143: 90 | AO143: -9.3000000000000013e-002 | AP143: 25 | AQ143: 合兴转债!
A144: 140 | B144: 113561 | C144: 正裕转债! | D144: 603089 | E144: 正裕工业 | F144: 汽车 | G144: 零部件制 | H144: 119.9 | I144: 1.4999999999999999e-002 | J144: -1.2199999999999999e-002 | K144: 11.32 | L144: 3.4999999999999996e-003 | M144: 118.5 | N144: 10.23 | O144: 8.4000000000000005e-002 | P144: 110.65 | Q144: 转股中 | R144: 5年48天 | S144: 3年48天 | T144: 1.59 | U144: 16 | V144: 8.6999999999999994e-002 | W144: 6.4000000000000001e-002 | X144: 7.0000000000000007e-002 | Y144: 25 | Z144: 2.71 | AA144: -2.3e-003 | AB144: -8.6e-003 | AC144: -4.0899999999999999e-002 | AD144: -4.3400000000000001e-002 | AE144: 82.04 | AF144: 81.49 | AG144: 0.79 | AH144: A+ | AI144: 7.7899999999999997e-002 | AJ144: =H144+100*O144 -> 128.30000000000001 | AK144: 129.1 | AL144: 68 | AM144: 47.1 | AN144: 165 | AO144: -6.8000000000000005e-002 | AP144: 33 | AQ144: 正裕转债!
A145: 120 | B145: 128099 | C145: 永高转债! | D145: 2641 | E145: 永高股份 | F145: 建筑 | G145: 建筑行业 | H145: 115.16 | I145: 8.3999999999999995e-003 | J145: 5.6999999999999993e-003 | K145: 7.15 | L145: 1.4199999999999999e-002 | M145: 113.2 | N145: 6.16 | O145: -8.0000000000000002e-003 | P145: 116.07 | Q145: 转股中 | R145: 5.32年 | S145: 3.32年 | T145: 2.32 | U145: 22 | V145: 8.199999999999999e-002 | W145: 2.7000000000000003e-002 | X145: 3.2000000000000001e-002 | Y145: 85 | Z145: 2.1 | AA145: -3.3e-003 | AB145: -7.7000000000000002e-003 | AC145: -2.9900000000000003e-002 | AD145: -3.1800000000000002e-002 | AE145: 88.8 | AF145: 89.58 | AG145: 1 | AH145: AA | AI145: 4.5899999999999996e-002 | AJ145: =H145+100*O145 -> 114.36 | AK145: 114.2 | AL145: 3 | AM145: 24.7 | AN145: 9 | AO145: -6.7000000000000004e-002 | AP145: 9 | AQ145: 永高转债!
A146: 307 | B146: 110033 | C146: 国贸转债! | D146: 600755 | E146: 厦门国贸 | F146: 交通运输 | G146: 交通运输 | H146: 110.24 | I146: -4.5000000000000005e-003 | J146: 3.0999999999999999e-003 | K146: 6.73 | L146: -5.8999999999999999e-003 | M146: 109.7 | N146: 7.19 | O146: 0.17800000000000002 | P146: 93.6 | Q146: 转股中 | R146: 1年53天 | S146: 回售中 | T146: 12.1 | U146: 6.6 | V146: 5.0000000000000001e-003 | W146: 9.6000000000000002e-002 | X146: 8.9999999999999997e-002 | Y146: 126 | Z146: 0.87 | AA146: -4.3e-003 | AB146: -1.9900000000000001e-002 | AC146: 回售中 | AD146: 回售中 | AE146: 100.28 | AF146: 105.16 | AG146: 0.24 | AH146: AAA | AI146: 3.8100000000000002e-002 | AJ146: =H146+100*O146 -> 128.03999999999999 | AK146: 126.9 | AL146: 45 | AM146: 21.7 | AN146: 4 | AO146: -1.8000000000000002e-002 | AP146: 18 | AQ146: 国贸转债!
A147: 94 | B147: 123050 | C147: 聚飞转债 | D147: 300303 | E147: 聚飞光电 | F147: 电子 | G147: LED制 | H147: 127.15 | I147: -1.6000000000000001e-003 | J147: -8.9999999999999998e-004 | K147: 6.13 | L147: -3.3e-003 | M147: 124.2 | N147: 5.18 | O147: 7.400000000000001e-002 | P147: 118.34 | Q147: 转股中 | R147: 5.42年 | S147: 3.42年 | T147: 7.05 | U147: 4.1 | V147: 5.0000000000000001e-003 | W147: 8.9999999999999997e-002 | X147: 0.106 | Y147: 78 | Z147: 3.38 | AA147: -4.4000000000000003e-003 | AB147: -1.18e-002 | AC147: -5.4800000000000001e-002 | AD147: -5.6799999999999996e-002 | AE147: 82.78 | AF147: 88.13 | AG147: 0.79 | AH147: AA- | AI147: 6.6900000000000001e-002 | AJ147: =H147+100*O147 -> 134.55000000000001 | AK147: 136 | AL147: 145 | AM147: 47.8 | AN147: 169 | AO147: -1.2e-002 | AP147: 11 | AQ147: 聚飞转债
A148: 147 | B148: 113559 | C148: 永创转债! | D148: 603901 | E148: 永创智能 | F148: 机械装备 | G148: 专用设备 | H148: 121.57 | I148: -1.2699999999999999e-002 | J148: -1.1000000000000001e-003 | K148: 11.07 | L148: -1.8600000000000002e-002 | M148: 118.9 | N148: 10.32 | O148: 0.13300000000000001 | P148: 107.27 | Q148: 转股中 | R148: 5年40天 | S148: 3年40天 | T148: 5.1 | U148: 24 | V148: 3.7999999999999999e-002 | W148: 0.105 | X148: 0.11199999999999999 | Y148: 49 | Z148: 3.52 | AA148: -4.5000000000000005e-003 | AB148: -1.0800000000000001e-002 | AC148: -4.4500000000000005e-002 | AD148: -4.7100000000000003e-002 | AE148: 85.23 | AF148: 86.23 | AG148: 0.74 | AH148: AA- | AI148: 6.6900000000000001e-002 | AJ148: =H148+100*O148 -> 134.87 | AK148: 135.9 | AL148: 142 | AM148: 49.6 | AN148: 181 | AO148: 0.11 | AP148: 22 | AQ148: 永创转债!
A149: 187 | B149: 113542 | C149: 好客转债 | D149: 603898 | E149: 好莱客 | F149: 其他 | G149: 家居用品 | H149: 117.81 | I149: -1.2999999999999999e-003 | J149: -2.e-003 | K149: 16.35 | L149: -5.5000000000000005e-003 | M149: 114.9 | N149: 16.27 | O149: 0.17199999999999999 | P149: 100.49 | Q149: 转股中 | R149: 4.72年 | S149: 2.72年 | T149: 6.03 | U149: 0.4 | V149: 1.e-003 | W149: 0.11800000000000001 | X149: 0.11900000000000001 | Y149: 51 | Z149: 2.08 | AA149: -5.4000000000000003e-003 | AB149: -1.1000000000000001e-002 | AC149: -4.4600000000000001e-002 | AD149: -4.6799999999999994e-002 | AE149: 91.44 | AF149: 94.16 | AG149: 0.59 | AH149: AA | AI149: 4.4000000000000004e-002 | AJ149: =H149+100*O149 -> 135.00999999999999 | AK149: 135.1 | AL149: 140 | AM149: 41 | AN149: 120 | AO149: -3.0000000000000001e-003 | AP149: 18 | AQ149: 好客转债
A150: 11 | B150: 123066 | C150: 赛意转债 | D150: 300687 | E150: 赛意信息 | F150: 计算机及 | G150: 软件开发 | H150: 125.3 | I150: 8.8000000000000005e-003 | J150: -3.8599999999999995e-002 | K150: 25.11 | L150: -3.7200000000000004e-002 | M150: 121.4 | N150: 22.58 | O150: 0.127 | P150: 111.2 | Q150: 4月9天 | R150: 5.84年 | S150: 3.84年 | T150: 3.2 | U150: 86 | V150: 0.214 | W150: 5.9000000000000004e-002 | X150: 6.5000000000000002e-002 | Y150: 55 | Z150: 5.76 | AA150: -5.5000000000000005e-003 | AB150: -1.1699999999999999e-002 | AC150: -4.5100000000000001e-002 | AD150: -4.7e-002 | AE150: 77.47 | AF150: 79.07 | AG150: 0.8 | AH150: A+ | AI150: 7.7899999999999997e-002 | AJ150: =H150+100*O150 -> 138. | AK150: 139.4 | AL150: 167 | AM150: 60.3 | AN150: 230 | AO150: -7.8e-002 | AP150: 4 | AQ150: 赛意转债
A151: 30 | B151: 113598 | C151: 法兰转债 | D151: 603966 | E151: 法兰泰克 | F151: 机械装备 | G151: 工程机械 | H151: 125.12 | I151: 0. | J151: 2.3799999999999998e-002 | K151: 14.46 | L151: 3.2899999999999999e-002 | M151: 121.2 | N151: 13.88 | O151: 0.20100000000000001 | P151: 104.18 | Q151: 2月25天 | R151: 5.71年 | S151: 3.71年 | T151: 3.3 | U151: 5.2 | V151: 1.2e-002 | W151: 0.10800000000000001 | X151: 0.113 | Y151: 31 | Z151: 2.74 | AA151: -5.6999999999999993e-003 | AB151: -1.1899999999999999e-002 | AC151: -4.6699999999999998e-002 | AD151: -4.8600000000000004e-002 | AE151: 81.21 | AF151: 84.39 | AG151: 0.72 | AH151: AA- | AI151: 6.6900000000000001e-002 | AJ151: =H151+100*O151 -> 145.22 | AK151: 146.1 | AL151: 216 | AM151: 61.7 | AN151: 235 | AO151: -1.7000000000000001e-002 | AP151: 5 | AQ151: 法兰转债
A152: 101 | B152: 128105 | C152: 长集转债 | D152: 2616 | E152: 长青集团 | F152: 城市公用 | G152: 三废处理 | H152: 118.988 | I152: -7.6e-003 | J152: -6.3e-003 | K152: 8.78 | L152: -2.0099999999999996e-002 | M152: 115.3 | N152: 8.11 | O152: 9.9000000000000005e-002 | P152: 108.26 | Q152: 转股中 | R152: 5.40年 | S152: 3.40年 | T152: 8 | U152: 12 | V152: 1.3000000000000001e-002 | W152: 0.12300000000000001 | X152: 0.13300000000000001 | Y152: 65 | Z152: 2.59 | AA152: -5.8999999999999999e-003 | AB152: -1.09e-002 | AC152: -3.7900000000000003e-002 | AD152: -3.9800000000000002e-002 | AE152: 88.58 | AF152: 90.92 | AG152: 0.69 | AH152: AA | AI152: 4.5899999999999996e-002 | AJ152: =H152+100*O152 -> 128.88800000000001 | AK152: 129.7 | AL152: 75 | AM152: 38.8 | AN152: 94 | AO152: -3.7999999999999999e-002 | AP152: 7 | AQ152: 长集转债
A153: 210 | B153: 110057 | C153: 现代转债 | D153: 600420 | E153: 现代制药 | F153: 医药 | G153: 化学制药 | H153: 113.73 | I153: -7.4000000000000003e-003 | J153: 1.2999999999999999e-003 | K153: 10.15 | L153: -9.7999999999999997e-003 | M153: 110.8 | N153: 9.89 | O153: 0.10800000000000001 | P153: 102.63 | Q153: 转股中 | R153: 4.38年 | S153: 2.38年 | T153: 16.2 | U153: 5.1 | V153: 3.0000000000000001e-003 | W153: 0.155 | X153: 0.159 | Y153: 104 | Z153: 1.33 | AA153: -6.0999999999999995e-003 | AB153: -1.06e-002 | AC153: -3.7400000000000003e-002 | AD153: -3.9800000000000002e-002 | AE153: 93.8 | AF153: 94.03 | AG153: 0.63 | AH153: AAA | AI153: 3.9e-002 | AJ153: =H153+100*O153 -> 124.53 | AK153: 124.8 | AL153: 30 | AM153: 30.8 | AN153: 26 | AO153: 6.0000000000000001e-003 | AP153: 21 | AQ153: 现代转债
A154: 277 | B154: 110041 | C154: 蒙电转债! | D154: 600863 | E154: 内蒙华电 | F154: 能源电力 | G154: 电力供应 | H154: 112.45 | I154: -4.4000000000000003e-003 | J154: -3.3e-003 | K154: 2.6 | L154: -1.52e-002 | M154: 110.3 | N154: 2.69 | O154: 0.16300000000000001 | P154: 96.65 | Q154: 转股中 | R154: 3年39天 | S154: 1年39天 | T154: 18.7 | U154: 5.1 | V154: 2.e-003 | W154: 0.124 | X154: 0.12 | Y154: 151 | Z154: 1.28 | AA154: -6.3e-003 | AB154: -1.24e-002 | AC154: -6.8699999999999997e-002 | AD154: -7.2599999999999998e-002 | AE154: 97.96 | AF154: 98.21 | AG154: 0.51 | AH154: AAA | AI154: 3.9e-002 | AJ154: =H154+100*O154 -> 128.75 | AK154: 128.2 | AL154: 57 | AM154: 30 | AN154: 23 | AO154: -6.9999999999999993e-003 | AP154: 9 | AQ154: 蒙电转债!
A155: 226 | B155: 128056 | C155: 今飞转债! | D155: 2863 | E155: 今飞凯达 | F155: 汽车 | G155: 零部件制 | H155: 124.45 | I155: 3.2799999999999996e-002 | J155: -2.9700000000000001e-002 | K155: 7.95 | L155: 3.8e-003 | M155: 121 | N155: 6.76 | O155: 5.7999999999999996e-002 | P155: 117.6 | Q155: 转股中 | R155: 4.29年 | S155: 2.29年 | T155: 2.37 | U155: 122 | V155: 0.41799999999999998 | W155: 7.5999999999999998e-002 | X155: 8.900000000000001e-002 | Y155: 31 | Z155: 2.69 | AA155: -6.7000000000000002e-003 | AB155: -1.4999999999999999e-002 | AC155: -7.0599999999999996e-002 | AD155: -7.3499999999999996e-002 | AE155: 87.21 | AF155: 89.08 | AG155: 0.8 | AH155: A+ | AI155: 7.5999999999999998e-002 | AJ155: =H155+100*O155 -> 130.25 | AK155: 131.3 | AL155: 98 | AM155: 42.2 | AN155: 132 | AO155: -1.2e-002 | AP155: 59 | AQ155: 今飞转债!
A156: 3 | B156: 123070 | C156: 鹏辉转债 | D156: 300438 | E156: 鹏辉能源 | F156: 汽车 | G156: 零部件制 | H156: 119.8 | I156: -8.9999999999999998e-004 | J156: 2.7000000000000003e-002 | K156: 20.28 | L156: 4.0000000000000001e-002 | M156: 115.1 | N156: 20.16 | O156: 0.191 | P156: 100.6 | Q156: 5月14天 | R156: 5.93年 | S156: 3.93年 | T156: 8.9 | U156: 100 | V156: 9.3000000000000013e-002 | W156: 0.105 | X156: 0.105 | Y156: 85 | Z156: 3.44 | AA156: -6.8000000000000005e-003 | AB156: -1.1299999999999999e-002 | AC156: -3.5099999999999999e-002 | AD156: -3.6699999999999997e-002 | AE156: 86.31 | AF156: 88.59 | AG156: 0.65 | AH156: AA | AI156: 4.5899999999999996e-002 | AJ156: =H156+100*O156 -> 138.90000000000001 | AK156: 139 | AL156: 164 | AM156: 50.4 | AN156: 182 | AO156: -5.0000000000000001e-003 | AP156: 2 | AQ156: 鹏辉转债
A157: 300 | B157: 113012 | C157: 骆驼转债! | D157: 601311 | E157: 骆驼股份 | F157: 汽车 | G157: 零部件制 | H157: 109.54 | I157: -1.04e-002 | J157: 1.09e-002 | K157: 8.2 | L157: 2.3999999999999998e-003 | M157: 107.8 | N157: 10.06 | O157: 0.34399999999999997 | P157: 81.51 | Q157: 转股中 | R157: 2.36年 | S157: 0.36年 | T157: 5.1 | U157: 6.8 | V157: 1.2e-002 | W157: 5.5e-002 | X157: 4.4999999999999998e-002 | Y157: 92 | Z157: 1.37 | AA157: -6.8999999999999999e-003 | AB157: -1.3100000000000001e-002 | AC157: -0.14800000000000002 | AD157: -0.154 | AE157: 99.33 | AF157: 97.75 | AG157: 0.2 | AH157: AA | AI157: 4.3099999999999999e-002 | AJ157: =H157+100*O157 -> 143.94 | AK157: 137.6 | AL157: 156 | AM157: 38.2 | AN157: 84 | AO157: -3.2000000000000001e-002 | AP157: 17 | AQ157: 骆驼转债!
A158: 192 | B158: 113027 | C158: 华钰转债!! | D158: 601020 | E158: 华钰矿业 | F158: 有色金属 | G158: 锌铅镍锡 | H158: 119.02 | I158: 5.3e-003 | J158: -4.5999999999999999e-003 | K158: 11.31 | L158: 8.9999999999999998e-004 | M158: 114.9 | N158: 10.17 | O158: 7.0000000000000007e-002 | P158: 111.21 | Q158: 转股中 | R158: 4.58年 | S158: 2.58年 | T158: 3.26 | U158: 51 | V158: 0.13200000000000001 | W158: 5.2000000000000005e-002 | X158: 5.7999999999999996e-002 | Y158: 63 | Z158: 2.58 | AA158: -7.8000000000000005e-003 | AB158: -1.3500000000000002e-002 | AC158: -5.0300000000000004e-002 | AD158: -5.2499999999999998e-002 | AE158: 87.11 | AF158: 86.6 | AG158: 0.77 | AH158: AA- | AI158: 6.5000000000000002e-002 | AJ158: =H158+100*O158 -> 126.02 | AK158: 126.8 | AL158: 44 | AM158: 39.7 | AN158: 104 | AO158: 7.9000000000000001e-002 | AP158: 46 | AQ158: 华钰转债!!
A159: 88 | B159: 113579 | C159: 健友转债 | D159: 603707 | E159: 健友股份 | F159: 医药 | G159: 原料药 | H159: 119.1 | I159: -6.8999999999999999e-003 | J159: -5.3e-003 | K159: 38.17 | L159: -2.2799999999999997e-002 | M159: 114.2 | N159: 42.05 | O159: 0.312 | P159: 90.77 | Q159: 转股中 | R159: 5.44年 | S159: 3.44年 | T159: 5.03 | U159: 1.6 | V159: 3.0000000000000001e-003 | W159: 1.3999999999999999e-002 | X159: 1.3000000000000001e-002 | Y159: 357 | Z159: 10.4 | AA159: -7.8000000000000005e-003 | AB159: -1.2500000000000001e-002 | AC159: -3.7999999999999999e-002 | AD159: -3.9800000000000002e-002 | AE159: 88.33 | AF159: 89.89 | AG159: 0.53 | AH159: AA | AI159: 4.5899999999999996e-002 | AJ159: =H159+100*O159 -> 150.29999999999998 | AK159: 147.4 | AL159: 225 | AM159: 57.5 | AN159: 217 | AO159: -2.5000000000000001e-002 | AP159: 7 | AQ159: 健友转债
A160: 308 | B160: 110031 | C160: 航信转债!! | D160: 600271 | E160: 航天信息 | F160: 计算机及 | G160: 软件开发 | H160: 107.49 | I160: -1.4000000000000002e-003 | J160: 1.4000000000000002e-003 | K160: 13.89 | L160: -7.000000000000001e-004 | M160: 107 | N160: 21.56 | O160: 0.66799999999999993 | P160: 64.42 | Q160: 转股中 | R160: 0.58年 | S160: 回售中 | T160: 24 | U160: 18 | V160: 6.9999999999999993e-003 | W160: 9.3000000000000013e-002 | X160: 5.9999999999999998e-002 | Y160: 258 | Z160: 2.24 | AA160: -7.9000000000000008e-003 | AB160: -3.0200000000000001e-002 | AC160: 回售中 | AD160: 回售中 | AE160: 100.27 | AF160: 104.81 | AG160: 0 | AH160: AAA | AI160: 3.6499999999999998e-002 | AJ160: =H160+100*O160 -> 174.28999999999999 | AK160: 150.6 | AL160: 237 | AM160: 45.7 | AN160: 154 | AO160: -7.2000000000000008e-002 | AP160: 14 | AQ160: 航信转债!!
A161: 64 | B161: 123056 | C161: 雪榕转债 | D161: 300511 | E161: 雪榕生物 | F161: 农业 | G161: 种植业 | H161: 126.51 | I161: -1.2699999999999999e-002 | J161: -8.8000000000000005e-003 | K161: 14.69 | L161: -2.52e-002 | M161: 121.1 | N161: 11.89 | O161: 2.4e-002 | P161: 123.55 | Q161: 52天 | R161: 5.61年 | S161: 3.61年 | T161: 5.85 | U161: 21 | V161: 2.7999999999999997e-002 | W161: 8.9999999999999997e-002 | X161: 0.111 | Y161: 65 | Z161: 3.39 | AA161: -7.9000000000000008e-003 | AB161: -1.4199999999999999e-002 | AC161: -5.0999999999999997e-002 | AD161: -5.28e-002 | AE161: 81.66 | AF161: 84.85 | AG161: 0.85 | AH161: AA- | AI161: 6.6900000000000001e-002 | AJ161: =H161+100*O161 -> 128.91 | AK161: 129.5 | AL161: 70 | AM161: 44.6 | AN161: 147 | AO161: -4.0999999999999995e-002 | AP161: 10 | AQ161: 雪榕转债
A162: 18 | B162: 113602 | C162: 景20转债 | D162: 603228 | E162: 景旺电子 | F162: 电子 | G162: 元器件制 | H162: 119 | I162: 2.3999999999999998e-003 | J162: 8.3000000000000001e-003 | K162: 32.11 | L162: 1.9e-002 | M162: 113.3 | N162: 35.28 | O162: 0.307 | P162: 91.01 | Q162: 3月18天 | R162: 5.78年 | S162: 3.78年 | T162: 17.8 | U162: 6.2 | V162: 3.0000000000000001e-003 | W162: 6.5000000000000002e-002 | X162: 5.9000000000000004e-002 | Y162: 273 | Z162: 4.57 | AA162: -8.6e-003 | AB162: -1.2699999999999999e-002 | AC162: -3.4300000000000004e-002 | AD162: -3.61e-002 | AE162: 87.11 | AF162: 87.86 | AG162: 0.56 | AH162: AA | AI162: 4.5899999999999996e-002 | AJ162: =H162+100*O162 -> 149.69999999999999 | AK162: 147 | AL162: 221 | AM162: 59.1 | AN162: 222 | AO162: -2.5000000000000001e-002 | AP162: 6 | AQ162: 景20转债
A163: 222 | B163: 128057 | C163: 博彦转债 | D163: 2649 | E163: 博彦科技 | F163: 计算机及 | G163: 软件开发 | H163: 121.474 | I163: 5.9999999999999995e-004 | J163: 2.0000000000000001e-004 | K163: 9.86 | L163: 1.e-003 | M163: 117.1 | N163: 8.72 | O163: 7.400000000000001e-002 | P163: 113.07 | Q163: 转股中 | R163: 4.31年 | S163: 2.31年 | T163: 5.29 | U163: 1.9 | V163: 3.0000000000000001e-003 | W163: 0.10099999999999999 | X163: 0.114 | Y163: 52 | Z163: 1.85 | AA163: -8.6999999999999994e-003 | AB163: -1.55e-002 | AC163: -6.3e-002 | AD163: -6.5599999999999992e-002 | AE163: 88.84 | AF163: 89.84 | AG163: 0.78 | AH163: AA- | AI163: 6.5000000000000002e-002 | AJ163: =H163+100*O163 -> 128.874 | AK163: 129.9 | AL163: 78 | AM163: 40 | AN163: 111 | AO163: -4.4000000000000004e-002 | AP163: 28 | AQ163: 博彦转债
A164: 188 | B164: 113541 | C164: 荣晟转债! | D164: 603165 | E164: 荣晟环保 | F164: 造纸包装 | G164: 包装用纸 | H164: 119.7 | I164: 2.9999999999999997e-004 | J164: -5.1000000000000004e-003 | K164: 13.1 | L164: -6.0999999999999995e-003 | M164: 115 | N164: 11.54 | O164: 5.4000000000000006e-002 | P164: 113.52 | Q164: 转股中 | R164: 4.69年 | S164: 2.69年 | T164: 2.75 | U164: 4.1 | V164: 1.2e-002 | W164: 8.4000000000000005e-002 | X164: 9.5000000000000001e-002 | Y164: 33 | Z164: 2.16 | AA164: -8.6999999999999994e-003 | AB164: -1.43e-002 | AC164: -5.0099999999999999e-002 | AD164: -5.2300000000000006e-002 | AE164: 86.62 | AF164: 86.11 | AG164: 0.78 | AH164: AA- | AI164: 6.5000000000000002e-002 | AJ164: =H164+100*O164 -> 125.10000000000001 | AK164: 125.9 | AL164: 37 | AM164: 39.3 | AN164: 95 | AO164: -4.0999999999999995e-002 | AP164: 49 | AQ164: 荣晟转债!
A165: 235 | B165: 128051 | C165: 光华转债! | D165: 2741 | E165: 光华科技 | F165: 电子 | G165: 元器件制 | H165: 120.111 | I165: 2.2599999999999999e-002 | J165: -2.63e-002 | K165: 14.01 | L165: -5.0000000000000001e-003 | M165: 115.5 | N165: 12.72 | O165: 9.0999999999999998e-002 | P165: 110.14 | Q165: 转股中 | R165: 4年31天 | S165: 2年31天 | T165: 2.5 | U165: 66 | V165: 0.21899999999999997 | W165: 4.8000000000000001e-002 | X165: 5.2999999999999999e-002 | Y165: 52 | Z165: 4.33 | AA165: -9.7999999999999997e-003 | AB165: -1.6399999999999998e-002 | AC165: -6.3399999999999998e-002 | AD165: -6.6299999999999998e-002 | AE165: 90.28 | AF165: 89.89 | AG165: 0.75 | AH165: AA- | AI165: 6.5000000000000002e-002 | AJ165: =H165+100*O165 -> 129.21100000000001 | AK165: 130.1 | AL165: 80 | AM165: 39.8 | AN165: 106 | AO165: 8.0000000000000002e-003 | AP165: 23 | AQ165: 光华转债!
A166: 97 | B166: 128106 | C166: 华统转债 | D166: 2840 | E166: 华统股份 | F166: 农业 | G166: 农产品加 | H166: 119.3 | I166: -2.e-003 | J166: -4.3e-003 | K166: 9.9 | L166: -9.0000000000000011e-003 | M166: 113.2 | N166: 9.39 | O166: 0.13200000000000001 | P166: 105.43 | Q166: 转股中 | R166: 5.41年 | S166: 3.41年 | T166: 5.5 | U166: 1.9 | V166: 3.0000000000000001e-003 | W166: 0.124 | X166: 0.13100000000000001 | Y166: 44 | Z166: 2.64 | AA166: -9.7999999999999997e-003 | AB166: -1.4199999999999999e-002 | AC166: -3.8800000000000001e-002 | AD166: -4.07e-002 | AE166: 88.48 | AF166: 89.25 | AG166: 0.7 | AH166: AA | AI166: 4.5899999999999996e-002 | AJ166: =H166+100*O166 -> 132.5 | AK166: 133.2 | AL166: 122 | AM166: 43.9 | AN166: 144 | AO166: -2.6000000000000002e-002 | AP166: 7 | AQ166: 华统转债
A167: 48 | B167: 128121 | C167: 宏川转债 | D167: 2930 | E167: 宏川智慧 | F167: 交通运输 | G167: 物流业 | H167: 119.699 | I167: 8.9999999999999998e-004 | J167: 2.e-003 | K167: 19.91 | L167: 4.0000000000000001e-003 | M167: 113.3 | N167: 20.25 | O167: 0.217 | P167: 98.32 | Q167: 2月13天 | R167: 5.67年 | S167: 3.67年 | T167: 6.7 | U167: 6.2 | V167: 8.0000000000000002e-003 | W167: 7.5999999999999998e-002 | X167: 7.4999999999999997e-002 | Y167: 88 | Z167: 4.6 | AA167: -9.7999999999999997e-003 | AB167: -1.3999999999999999e-002 | AC167: -3.6699999999999997e-002 | AD167: -3.85e-002 | AE167: 81.14 | AF167: 79.05 | AG167: 0.73 | AH167: AA- | AI167: 6.6900000000000001e-002 | AJ167: =H167+100*O167 -> 141.399 | AK167: 141.1 | AL167: 187 | AM167: 59.9 | AN167: 227 | AO167: -3.7000000000000005e-002 | AP167: 4 | AQ167: 宏川转债
A168: 155 | B168: 113553 | C168: 金牌转债! | D168: 603180 | E168: 金牌厨柜 | F168: 其他 | G168: 家居用品 | H168: 131.02 | I168: -3.7100000000000001e-002 | J168: 3.7000000000000002e-003 | K168: 58.11 | L168: -3.3399999999999999e-002 | M168: 124.6 | N168: 44.14 | O168: -5.0000000000000001e-003 | P168: 131.65 | Q168: 转股中 | R168: 5年30天 | S168: 3年30天 | T168: 2.18 | U168: 64 | V168: 0.222 | W168: 3.9e-002 | X168: 5.0999999999999997e-002 | Y168: 56 | Z168: 4.14 | AA168: -1.e-002 | AB168: -1.8000000000000002e-002 | AC168: -6.9099999999999995e-002 | AD168: -7.1199999999999999e-002 | AE168: 84.59 | AF168: 90.35 | AG168: 1 | AH168: AA- | AI168: 6.6900000000000001e-002 | AJ168: =H168+100*O168 -> 130.52000000000001 | AK168: 130.4 | AL168: 85 | AM168: 40 | AN168: 112 | AO168: -6.9999999999999993e-003 | AP168: 15 | AQ168: 金牌转债!
A169: 118 | B169: 123044 | C169: 红相转债! | D169: 300427 | E169: 红相股份 | F169: 能源电力 | G169: 电力设备 | H169: 132.399 | I169: -1.4199999999999999e-002 | J169: 2.12e-002 | K169: 23.3 | L169: 8.6999999999999994e-003 | M169: 125.5 | N169: 18.8 | O169: 6.8000000000000005e-002 | P169: 123.94 | Q169: 转股中 | R169: 5.33年 | S169: 3.33年 | T169: 5.5 | U169: 65 | V169: 8.8000000000000009e-002 | W169: 6.6000000000000003e-002 | X169: 8.1000000000000003e-002 | Y169: 84 | Z169: 3.68 | AA169: -1.0200000000000001e-002 | AB169: -1.8000000000000002e-002 | AC169: -6.5000000000000002e-002 | AD169: -6.7400000000000002e-002 | AE169: 84.02 | AF169: 89.71 | AG169: 0.82 | AH169: AA- | AI169: 6.6900000000000001e-002 | AJ169: =H169+100*O169 -> 139.19900000000001 | AK169: 140.9 | AL169: 184 | AM169: 51.2 | AN169: 187 | AO169: -8.199999999999999e-002 | AP169: 15 | AQ169: 红相转债!
A170: 84 | B170: 128108 | C170: 蓝帆转债 | D170: 2382 | E170: 蓝帆医疗 | F170: 医药 | G170: 医疗器械 | H170: 119.802 | I170: 1.8e-003 | J170: 8.0000000000000004e-004 | K170: 20.99 | L170: 3.3e-003 | M170: 113.3 | N170: 17.79 | O170: 1.4999999999999999e-002 | P170: 117.99 | Q170: 20天 | R170: 5.54年 | S170: 4.54年 | T170: 31.4 | U170: 201 | V170: 5.2999999999999999e-002 | W170: 0.155 | X170: 0.183 | Y170: 202 | Z170: 2.12 | AA170: -1.0200000000000001e-002 | AB170: -1.4499999999999999e-002 | AC170: -2.6800000000000001e-002 | AD170: -2.8999999999999998e-002 | AE170: 85.82 | AF170: 88.82 | AG170: 0.78 | AH170: AA | AI170: 4.5899999999999996e-002 | AJ170: =H170+100*O170 -> 121.30200000000001 | AK170: 121.6 | AL170: 11 | AM170: 32.8 | AN170: 36 | AO170: -0.106 | AP170: 22 | AQ170: 蓝帆转债
A171: 117 | B171: 113572 | C171: 三祥转债! | D171: 603663 | E171: 三祥新材 | F171: 其他 | G171: 其他 | H171: 119.47 | I171: 1.6799999999999999e-002 | J171: -1.41e-002 | K171: 15.25 | L171: 3.3e-003 | M171: 113.2 | N171: 14.19 | O171: 0.11199999999999999 | P171: 107.47 | Q171: 转股中 | R171: 5.33年 | S171: 3.33年 | T171: 1.7 | U171: 32 | V171: 0.158 | W171: 5.7999999999999996e-002 | X171: 6.2e-002 | Y171: 29 | Z171: 4.93 | AA171: -1.03e-002 | AB171: -1.47e-002 | AC171: -4.0099999999999997e-002 | AD171: -4.2000000000000003e-002 | AE171: 80.02 | AF171: 76.57 | AG171: 0.81 | AH171: A+ | AI171: 7.7899999999999997e-002 | AJ171: =H171+100*O171 -> 130.66999999999999 | AK171: 131.5 | AL171: 104 | AM171: 51.5 | AN171: 189 | AO171: 8.0000000000000002e-003 | AP171: 18 | AQ171: 三祥转债!
A172: 42 | B172: 123060 | C172: 苏试转债 | D172: 300416 | E172: 苏试试验 | F172: 机械装备 | G172: 专用设备 | H172: 124.74 | I172: 6.1999999999999998e-003 | J172: -4.6999999999999993e-003 | K172: 23.23 | L172: 2.2000000000000001e-003 | M172: 117.6 | N172: 23.86 | O172: 0.28100000000000003 | P172: 97.36 | Q172: 2月15天 | R172: 5.69年 | S172: 3.69年 | T172: 3.1 | U172: 11 | V172: 2.8999999999999998e-002 | W172: 6.6000000000000003e-002 | X172: 6.4000000000000001e-002 | Y172: 47 | Z172: 4.76 | AA172: -1.0500000000000001e-002 | AB172: -1.5800000000000002e-002 | AC172: -4.6699999999999998e-002 | AD172: -4.8499999999999995e-002 | AE172: 81.2 | AF172: 82 | AG172: 0.69 | AH172: AA- | AI172: 6.6900000000000001e-002 | AJ172: =H172+100*O172 -> 152.84 | AK172: 152.1 | AL172: 243 | AM172: 70.1 | AN172: 250 | AO172: -7.400000000000001e-002 | AP172: 7 | AQ172: 苏试转债
A173: 134 | B173: 113563 | C173: 柳药转债 | D173: 603368 | E173: 柳药股份 | F173: 医药 | G173: 医药商业 | H173: 119.5 | I173: 1.8e-003 | J173: 1.2199999999999999e-002 | K173: 25.23 | L173: 2.1000000000000001e-002 | M173: 113.2 | N173: 24.47 | O173: 0.159 | P173: 103.11 | Q173: 转股中 | R173: 5.18年 | S173: 3.18年 | T173: 8.02 | U173: 2.5 | V173: 3.0000000000000001e-003 | W173: 8.8000000000000009e-002 | X173: 8.9999999999999997e-002 | Y173: 91 | Z173: 1.9 | AA173: -1.06e-002 | AB173: -1.5100000000000001e-002 | AC173: -4.2000000000000003e-002 | AD173: -4.3899999999999995e-002 | AE173: 89.41 | AF173: 90.17 | AG173: 0.67 | AH173: AA | AI173: 4.5899999999999996e-002 | AJ173: =H173+100*O173 -> 135.40000000000001 | AK173: 135.9 | AL173: 144 | AM173: 45.7 | AN173: 152 | AO173: 6.8000000000000005e-002 | AP173: 15 | AQ173: 柳药转债
A174: 52 | B174: 128119 | C174: 龙大转债 | D174: 2726 | E174: 龙大肉食 | F174: 食品饮料 | G174: 肉制品 | H174: 128.15 | I174: 7.4999999999999997e-003 | J174: 1.5800000000000002e-002 | K174: 11.75 | L174: 2.98e-002 | M174: 120.2 | N174: 9.56 | O174: 4.2999999999999997e-002 | P174: 122.91 | Q174: 2月5天 | R174: 5.66年 | S174: 3.66年 | T174: 9.5 | U174: 47 | V174: 3.7999999999999999e-002 | W174: 8.1000000000000003e-002 | X174: 0.10000000000000001 | Y174: 117 | Z174: 3.8 | AA174: -1.1399999999999999e-002 | AB174: -1.7399999999999999e-002 | AC174: -5.4199999999999998e-002 | AD174: -5.5899999999999998e-002 | AE174: 87.46 | AF174: 93.65 | AG174: 0.78 | AH174: AA | AI174: 4.5899999999999996e-002 | AJ174: =H174+100*O174 -> 132.45000000000002 | AK174: 133.4 | AL174: 125 | AM174: 39.7 | AN174: 105 | AO174: 5.2000000000000005e-002 | AP174: 6 | AQ174: 龙大转债
A175: 82 | B175: 127017 | C175: 万青转债 | D175: 789 | E175: 万年青 | F175: 建筑 | G175: 水泥 | H175: 126.1 | I175: -7.0999999999999995e-003 | J175: -8.5000000000000006e-003 | K175: 15.15 | L175: -2.3799999999999998e-002 | M175: 118.4 | N175: 14.16 | O175: 0.17899999999999999 | P175: 106.99 | Q175: 26天 | R175: 5.55年 | S175: 3.55年 | T175: 10 | U175: 45 | V175: 3.6000000000000004e-002 | W175: 8.3000000000000004e-002 | X175: 8.900000000000001e-002 | Y175: 121 | Z175: 2.18 | AA175: -1.15e-002 | AB175: -1.7100000000000001e-002 | AC175: -5.16e-002 | AD175: -5.33e-002 | AE175: 88.55 | AF175: 93.69 | AG175: 0.65 | AH175: AA+ | AI175: 4.3899999999999995e-002 | AJ175: =H175+100*O175 -> 144. | AK175: 145.2 | AL175: 212 | AM175: 51.5 | AN175: 190 | AO175: 2.6000000000000002e-002 | AP175: 7 | AQ175: 万青转债
A176: 38 | B176: 110073 | C176: 国投转债 | D176: 600061 | E176: 国投资本 | F176: 金融 | G176: 证券行业 | H176: 118 | I176: -1.0200000000000001e-002 | J176: 1.6000000000000001e-003 | K176: 14.34 | L176: -1.5100000000000001e-002 | M176: 110.5 | N176: 15.25 | O176: 0.255 | P176: 94.03 | Q176: 2月20天 | R176: 5.69年 | S176: 无权 | T176: 80 | U176: 82 | V176: 9.0000000000000011e-003 | W176: 0.13200000000000001 | X176: 0.124 | Y176: 606 | Z176: 1.45 | AA176: -1.1599999999999999e-002 | AB176: -1.49e-002 | AC176: 无权 | AD176: 无权 | AE176: 无权 | AF176: 88.2 | AG176: 0.57 | AH176: AAA | AI176: 4.0899999999999999e-002 | AJ176: =H176+100*O176 -> 143.5 | AK176: 142 | AL176: 196 | AM176: 53.8 | AN176: 200 | AO176: -1.2e-002 | AP176: 21 | AQ176: 国投转债
A177: 69 | B177: 128113 | C177: 比音转债 | D177: 2832 | E177: 比音勒芬 | F177: 服装纺织 | G177: 服装行业 | H177: 125.492 | I177: -4.7999999999999996e-003 | J177: 1.1399999999999999e-002 | K177: 17.59 | L177: 8.6e-003 | M177: 117.3 | N177: 14.9 | O177: 6.3e-002 | P177: 118.05 | Q177: 38天 | R177: 5.59年 | S177: 3.59年 | T177: 6.89 | U177: 6.1 | V177: 6.9999999999999993e-003 | W177: 7.4999999999999997e-002 | X177: 8.8000000000000009e-002 | Y177: 92 | Z177: 4.28 | AA177: -1.2199999999999999e-002 | AB177: -1.7500000000000002e-002 | AC177: -4.9699999999999994e-002 | AD177: -5.1500000000000004e-002 | AE177: 87.86 | AF177: 91.73 | AG177: 0.77 | AH177: AA | AI177: 4.5899999999999996e-002 | AJ177: =H177+100*O177 -> 131.792 | AK177: 132.9 | AL177: 119 | AM177: 41.2 | AN177: 122 | AO177: -1.7000000000000001e-002 | AP177: 5 | AQ177: 比音转债
A178: 149 | B178: 113556 | C178: 至纯转债! | D178: 603690 | E178: 至纯科技 | F178: 机械装备 | G178: 专用设备 | H178: 134.88 | I178: 9.1000000000000004e-003 | J178: -7.000000000000001e-004 | K178: 34.95 | L178: 1.01e-002 | M178: 126.8 | N178: 29.37 | O178: 0.13300000000000001 | P178: 119 | Q178: 转股中 | R178: 5年37天 | S178: 3年37天 | T178: 2.96 | U178: 65 | V178: 0.16399999999999998 | W178: 3.3000000000000002e-002 | X178: 3.9e-002 | Y178: 91 | Z178: 5.93 | AA178: -1.23e-002 | AB178: -2.07e-002 | AC178: -7.5399999999999995e-002 | AD178: -7.7800000000000008e-002 | AE178: 82.24 | AF178: 87.32 | AG178: 0.82 | AH178: A+ | AI178: 7.7899999999999997e-002 | AJ178: =H178+100*O178 -> 148.18000000000001 | AK178: 150.8 | AL178: 239 | AM178: 63.4 | AN178: 242 | AO178: 1.3000000000000001e-002 | AP178: 13 | AQ178: 至纯转债!
A179: 66 | B179: 113588 | C179: 润达转债 | D179: 603108 | E179: 润达医疗 | F179: 医药 | G179: 医疗器械 | H179: 122.36 | I179: 2.0000000000000001e-004 | J179: -2.0000000000000001e-004 | K179: 13.9 | L179: 0. | M179: 114.2 | N179: 13.36 | O179: 0.17600000000000002 | P179: 104.04 | Q179: 40天 | R179: 5.59年 | S179: 3.59年 | T179: 5.5 | U179: 2.5 | V179: 4.0000000000000001e-003 | W179: 6.8000000000000005e-002 | X179: 7.0999999999999994e-002 | Y179: 81 | Z179: 2.69 | AA179: -1.2500000000000001e-002 | AB179: -1.6899999999999998e-002 | AC179: -4.3400000000000001e-002 | AD179: -4.5199999999999997e-002 | AE179: 87.74 | AF179: 89.28 | AG179: 0.67 | AH179: AA | AI179: 4.5899999999999996e-002 | AJ179: =H179+100*O179 -> 139.96000000000001 | AK179: 140.7 | AL179: 183 | AM179: 51.4 | AN179: 188 | AO179: 9.0000000000000011e-003 | AP179: 7 | AQ179: 润达转债
A180: 164 | B180: 123035 | C180: 利德转债! | D180: 300296 | E180: 利亚德 | F180: 电子 | G180: LED制 | H180: 123.15 | I180: -5.3e-003 | J180: -1.0200000000000001e-002 | K180: 7.43 | L180: -2.3700000000000002e-002 | M180: 115.6 | N180: 6.98 | O180: 0.157 | P180: 106.45 | Q180: 转股中 | R180: 5年1.1天 | S180: 3年1.1天 | T180: 8 | U180: 12 | V180: 1.3000000000000001e-002 | W180: 4.2000000000000003e-002 | X180: 4.4999999999999998e-002 | Y180: 189 | Z180: 2.21 | AA180: -1.29e-002 | AB180: -1.83e-002 | AC180: -5.2300000000000006e-002 | AD180: -5.4600000000000003e-002 | AE180: 91.03 | AF180: 93.73 | AG180: 0.66 | AH180: AA+ | AI180: 4.3899999999999995e-002 | AJ180: =H180+100*O180 -> 138.84999999999999 | AK180: 139.9 | AL180: 173 | AM180: 46.1 | AN180: 155 | AO180: -1.e-002 | AP180: 16 | AQ180: 利德转债!
A181: 274 | B181: 123007 | C181: 道氏转债!! | D181: 300409 | E181: 道氏技术 | F181: 建筑 | G181: 建筑行业 | H181: 115.88 | I181: 2.6099999999999998e-002 | J181: -8.6999999999999994e-003 | K181: 14.56 | L181: 2.8999999999999998e-002 | M181: 111.3 | N181: 14.95 | O181: 0.19 | P181: 97.39 | Q181: 转股中 | R181: 3年45天 | S181: 1年45天 | T181: 3.04 | U181: 282 | V181: 0.80099999999999993 | W181: 4.4999999999999998e-002 | X181: 4.4000000000000004e-002 | Y181: 67 | Z181: 2.77 | AA181: -1.3100000000000001e-002 | AB181: -1.9599999999999999e-002 | AC181: -8.929999999999999e-002 | AD181: -9.3000000000000013e-002 | AE181: 94.9 | AF181: 91.86 | AG181: 0.6 | AH181: AA- | AI181: 6.5000000000000002e-002 | AJ181: =H181+100*O181 -> 134.88 | AK181: 134.4 | AL181: 133 | AM181: 39.5 | AN181: 100 | AO181: 4.0000000000000001e-003 | AP181: 19 | AQ181: 道氏转债!!
A182: 100 | B182: 113034 | C182: 滨化转债 | D182: 601678 | E182: 滨化股份 | F182: 化工 | G182: 化工 | H182: 123.51 | I182: -1.1000000000000001e-002 | J182: 1.e-004 | K182: 5.82 | L182: -1.3600000000000001e-002 | M182: 115.1 | N182: 4.68 | O182: -6.9999999999999993e-003 | P182: 124.36 | Q182: 转股中 | R182: 5.41年 | S182: 3.41年 | T182: 24 | U182: 105 | V182: 3.5000000000000003e-002 | W182: 0.26700000000000002 | X182: 0.33200000000000002 | Y182: 90 | Z182: 1.44 | AA182: -1.32e-002 | AB182: -1.8100000000000002e-002 | AC182: -4.8399999999999999e-002 | AD182: -5.0199999999999995e-002 | AE182: 88.38 | AF182: 90.72 | AG182: 0.8 | AH182: AA | AI182: 4.5899999999999996e-002 | AJ182: =H182+100*O182 -> 122.81 | AK182: 122.7 | AL182: 14 | AM182: 31.9 | AN182: 30 | AO182: 5.7999999999999996e-002 | AP182: 28 | AQ182: 滨化转债
A183: 72 | B183: 128111 | C183: 中矿转债 | D183: 2738 | E183: 中矿资源 | F183: 有色金属 | G183: 有色行业 | H183: 134.3 | I183: 2.0499999999999997e-002 | J183: 1.8600000000000002e-002 | K183: 21.45 | L183: 4.3799999999999999e-002 | M183: 124.7 | N183: 15.53 | O183: -2.7999999999999997e-002 | P183: 138.12 | Q183: 34天 | R183: 5.58年 | S183: 3.58年 | T183: 8 | U183: 85 | V183: 7.9000000000000001e-002 | W183: 0.13400000000000001 | X183: 0.185 | Y183: 60 | Z183: 2.22 | AA183: -1.3500000000000002e-002 | AB183: -2.07e-002 | AC183: -6.5199999999999994e-002 | AD183: -6.7299999999999999e-002 | AE183: 82.35 | AF183: 87.64 | AG183: 0.89 | AH183: AA- | AI183: 6.6900000000000001e-002 | AJ183: =H183+100*O183 -> 131.5 | AK183: 130.5 | AL183: 86 | AM183: 42.8 | AN183: 137 | AO183: 7.6999999999999999e-002 | AP183: 7 | AQ183: 中矿转债
A184: 119 | B184: 110067 | C184: 华安转债! | D184: 600909 | E184: 华安证券 | F184: 金融 | G184: 证券行业 | H184: 118.84 | I184: -1.2500000000000001e-002 | J184: 1.11e-002 | K184: 8.04 | L184: -2.5000000000000001e-003 | M184: 110.5 | N184: 8.67 | O184: 0.28199999999999997 | P184: 92.73 | Q184: 转股中 | R184: 5.33年 | S184: 无权 | T184: 28 | U184: 100 | V184: 2.9999999999999999e-002 | W184: 9.6000000000000002e-002 | X184: 8.900000000000001e-002 | Y184: 291 | Z184: 2.1 | AA184: -1.37e-002 | AB184: -1.7299999999999999e-002 | AC184: 无权 | AD184: 无权 | AE184: 无权 | AF184: 89.5 | AG184: 0.54 | AH184: AAA | AI184: 4.0899999999999999e-002 | AJ184: =H184+100*O184 -> 147.03999999999999 | AK184: 144.9 | AL184: 211 | AM184: 55.4 | AN184: 209 | AO184: -3.2000000000000001e-002 | AP184: 26 | AQ184: 华安转债!
A185: 244 | B185: 128048 | C185: 张行转债 | D185: 2839 | E185: 张家港行 | F185: 金融 | G185: 银行行业 | H185: 119.829 | I185: -1.11e-002 | J185: 6.1999999999999998e-003 | K185: 5.87 | L185: -8.3999999999999995e-003 | M185: 113.3 | N185: 5.76 | O185: 0.17600000000000002 | P185: 101.91 | Q185: 转股中 | R185: 3.998年 | S185: 无权 | T185: 25 | U185: 68 | V185: 2.3e-002 | W185: 0.23499999999999999 | X185: 0.23999999999999999 | Y185: 106 | Z185: 1.01 | AA185: -1.41e-002 | AB185: -2.e-002 | AC185: 无权 | AD185: 无权 | AE185: 无权 | AF185: 96.39 | AG185: 0.58 | AH185: AA+ | AI185: 4.2000000000000003e-002 | AJ185: =H185+100*O185 -> 137.429 | AK185: 137.7 | AL185: 159 | AM185: 41.4 | AN185: 123 | AO185: -2.5000000000000001e-002 | AP185: 14 | AQ185: 张行转债
A186: 169 | B186: 110060 | C186: 天路转债! | D186: 600326 | E186: 西藏天路 | F186: 建筑 | G186: 水泥 | H186: 123.11 | I186: 5.0000000000000001e-004 | J186: -6.7000000000000002e-003 | K186: 7.95 | L186: -8.6999999999999994e-003 | M186: 114.9 | N186: 7.16 | O186: 0.109 | P186: 111.03 | Q186: 转股中 | R186: 4.96年 | S186: 2.96年 | T186: 7.06 | U186: 12 | V186: 1.3999999999999999e-002 | W186: 9.6999999999999989e-002 | X186: 0.107 | Y186: 73 | Z186: 1.96 | AA186: -1.41e-002 | AB186: -1.9299999999999998e-002 | AC186: -5.4800000000000001e-002 | AD186: -5.67e-002 | AE186: 90.5 | AF186: 93.18 | AG186: 0.71 | AH186: AA | AI186: 4.4000000000000004e-002 | AJ186: =H186+100*O186 -> 134.00999999999999 | AK186: 135.2 | AL186: 141 | AM186: 42 | AN186: 127 | AO186: 2.4e-002 | AP186: 12 | AQ186: 天路转债!
A187: 220 | B187: 127011 | C187: 中鼎转2! | D187: 887 | E187: 中鼎股份 | F187: 汽车 | G187: 零部件制 | H187: 122.8 | I187: -5.1000000000000004e-003 | J187: 2.7000000000000003e-002 | K187: 12.11 | L187: 3.5900000000000001e-002 | M187: 115.2 | N187: 11.59 | O187: 0.17499999999999999 | P187: 104.49 | Q187: 转股中 | R187: 4.32年 | S187: 2.32年 | T187: 12 | U187: 35 | V187: 2.3e-002 | W187: 8.1000000000000003e-002 | X187: 8.5000000000000006e-002 | Y187: 148 | Z187: 1.69 | AA187: -1.4999999999999999e-002 | AB187: -2.1099999999999997e-002 | AC187: -6.7199999999999996e-002 | AD187: -6.9599999999999995e-002 | AE187: 93.6 | AF187: 96.84 | AG187: 0.61 | AH187: AA+ | AI187: 4.2000000000000003e-002 | AJ187: =H187+100*O187 -> 140.30000000000001 | AK187: 141.1 | AL187: 188 | AM187: 44.3 | AN187: 146 | AO187: 7.9000000000000001e-002 | AP187: 26 | AQ187: 中鼎转2!
A188: 211 | B188: 123025 | C188: 精测转债!! | D188: 300567 | E188: 精测电子 | F188: 电子 | G188: 液晶显示 | H188: 125.35 | I188: 2.e-003 | J188: 7.6e-003 | K188: 52.5 | L188: 1.37e-002 | M188: 117.3 | N188: 49.95 | O188: 0.193 | P188: 105.11 | Q188: 转股中 | R188: 4.37年 | S188: 2.37年 | T188: 3.09 | U188: 36 | V188: 9.1999999999999998e-002 | W188: 2.4e-002 | X188: 2.5000000000000001e-002 | Y188: 130 | Z188: 8.34 | AA188: -1.54e-002 | AB188: -2.2200000000000001e-002 | AC188: -7.2999999999999995e-002 | AD188: -7.5399999999999995e-002 | AE188: 88.5 | AF188: 89.63 | AG188: 0.7 | AH188: AA- | AI188: 6.5000000000000002e-002 | AJ188: =H188+100*O188 -> 144.65000000000001 | AK188: 145.6 | AL188: 213 | AM188: 56 | AN188: 212 | AO188: 1.e-002 | AP188: 18 | AQ188: 精测转债!!
A189: 203 | B189: 113025 | C189: 明泰转债! | D189: 601677 | E189: 明泰铝业 | F189: 有色金属 | G189: 铝金属 | H189: 123.1 | I189: 4.0000000000000002e-004 | J189: -6.0999999999999995e-003 | K189: 13.65 | L189: -7.3000000000000001e-003 | M189: 115.1 | N189: 11.2 | O189: 1.e-002 | P189: 121.88 | Q189: 转股中 | R189: 4.41年 | S189: 2.41年 | T189: 15.8 | U189: 53 | V189: 2.7000000000000003e-002 | W189: 0.187 | X189: 0.22800000000000001 | Y189: 84 | Z189: 1.12 | AA189: -1.54e-002 | AB189: -2.1400000000000002e-002 | AC189: -6.6100000000000006e-002 | AD189: -6.8400000000000002e-002 | AE189: 92.7 | AF189: 95.59 | AG189: 0.78 | AH189: AA | AI189: 4.4000000000000004e-002 | AJ189: =H189+100*O189 -> 124.09999999999999 | AK189: 124.3 | AL189: 23 | AM189: 28.7 | AN189: 20 | AO189: -1.e-002 | AP189: 32 | AQ189: 明泰转债!
A190: 80 | B190: 128109 | C190: 楚江转债 | D190: 2171 | E190: 楚江新材 | F190: 有色金属 | G190: 铜金属 | H190: 125.8 | I190: 3.2000000000000002e-003 | J190: -1.e-003 | K190: 9.54 | L190: 3.2000000000000002e-003 | M190: 115.3 | N190: 8.73 | O190: 0.151 | P190: 109.28 | Q190: 27天 | R190: 5.56年 | S190: 3.56年 | T190: 18.3 | U190: 7.2 | V190: 3.0000000000000001e-003 | W190: 0.14400000000000002 | X190: 0.157 | Y190: 127 | Z190: 2.31 | AA190: -1.5800000000000002e-002 | AB190: -2.06e-002 | AC190: -5.0799999999999998e-002 | AD190: -5.2600000000000001e-002 | AE190: 87.98 | AF190: 90.3 | AG190: 0.7 | AH190: AA | AI190: 4.5899999999999996e-002 | AJ190: =H190+100*O190 -> 140.90000000000001 | AK190: 142.3 | AL190: 199 | AM190: 52 | AN190: 193 | AO190: -2.e-002 | AP190: 5 | AQ190: 楚江转债
A191: 271 | B191: 128035 | C191: 大族转债! | D191: 2008 | E191: 大族激光 | F191: 机械装备 | G191: 专用设备 | H191: 113.81 | I191: 4.5000000000000005e-003 | J191: 3.3e-003 | K191: 43.13 | L191: 3.0600000000000002e-002 | M191: 108 | N191: 52.1 | O191: 0.375 | P191: 82.78 | Q191: 转股中 | R191: 3.23年 | S191: 1.23年 | T191: 23 | U191: 26 | V191: 1.e-002 | W191: 5.0000000000000003e-002 | X191: 4.0999999999999995e-002 | Y191: 460 | Z191: 5.01 | AA191: -1.6299999999999999e-002 | AB191: -2.0799999999999999e-002 | AC191: -6.0100000000000001e-002 | AD191: -6.5799999999999997e-002 | AE191: 98.59 | AF191: 94.74 | AG191: 0.25 | AH191: AA+ | AI191: 4.2000000000000003e-002 | AJ191: =H191+100*O191 -> 151.31 | AK191: 144.8 | AL191: 210 | AM191: 46.2 | AN191: 157 | AO191: 9.6000000000000002e-002 | AP191: 20 | AQ191: 大族转债!
A192: 93 | B192: 113577 | C192: 春秋转债 | D192: 603890 | E192: 春秋电子 | F192: 电子 | G192: 电子产品 | H192: 129 | I192: 5.6999999999999993e-003 | J192: -5.6999999999999993e-003 | K192: 14.05 | L192: 0. | M192: 118.2 | N192: 11.06 | O192: 1.4999999999999999e-002 | P192: 127.03 | Q192: 转股中 | R192: 5.42年 | S192: 3.42年 | T192: 2.32 | U192: 11 | V192: 3.5000000000000003e-002 | W192: 4.2999999999999997e-002 | X192: 5.5e-002 | Y192: 54 | Z192: 3.21 | AA192: -1.6299999999999999e-002 | AB192: -2.2000000000000002e-002 | AC192: -5.8700000000000002e-002 | AD192: -6.0599999999999994e-002 | AE192: 82.79 | AF192: 83.91 | AG192: 0.85 | AH192: AA- | AI192: 6.6900000000000001e-002 | AJ192: =H192+100*O192 -> 130.5 | AK192: 131 | AL192: 93 | AM192: 47.1 | AN192: 164 | AO192: -6.9999999999999993e-003 | AP192: 10 | AQ192: 春秋转债
A193: 160 | B193: 110062 | C193: 烽火转债 | D193: 600498 | E193: 烽火通信 | F193: 通信互联 | G193: 通信设备 | H193: 120.49 | I193: -6.4000000000000003e-003 | J193: -1.6000000000000001e-003 | K193: 24.82 | L193: -1.3500000000000002e-002 | M193: 111 | N193: 25.65 | O193: 0.245 | P193: 96.76 | Q193: 转股中 | R193: 5年19天 | S193: 3年19天 | T193: 30.9 | U193: 9.2 | V193: 2.e-003 | W193: 0.106 | X193: 0.10300000000000001 | Y193: 290 | Z193: 2.73 | AA193: -1.6399999999999998e-002 | AB193: -2.0299999999999999e-002 | AC193: -4.6500000000000007e-002 | AD193: -4.8499999999999995e-002 | AE193: 91.09 | AF193: 91.01 | AG193: 0.59 | AH193: AAA | AI193: 4.0899999999999999e-002 | AJ193: =H193+100*O193 -> 144.99000000000001 | AK193: 144.2 | AL193: 206 | AM193: 53.1 | AN193: 195 | AO193: 1.e-002 | AP193: 19 | AQ193: 烽火转债
A194: 227 | B194: 110051 | C194: 中天转债! | D194: 600522 | E194: 中天科技 | F194: 通信互联 | G194: 通信设备 | H194: 122.33 | I194: -7.8000000000000005e-003 | J194: 1.15e-002 | K194: 10.76 | L194: 5.6000000000000008e-003 | M194: 113.9 | N194: 10.09 | O194: 0.14699999999999999 | P194: 106.64 | Q194: 转股中 | R194: 4.29年 | S194: 2.29年 | T194: 39.6 | U194: 25 | V194: 5.0000000000000001e-003 | W194: 0.12 | X194: 0.128 | Y194: 330 | Z194: 1.51 | AA194: -1.6799999999999999e-002 | AB194: -2.2499999999999999e-002 | AC194: -6.6699999999999995e-002 | AD194: -6.9099999999999995e-002 | AE194: 93.55 | AF194: 95.82 | AG194: 0.65 | AH194: AA+ | AI194: 4.2000000000000003e-002 | AJ194: =H194+100*O194 -> 137.03 | AK194: 138 | AL194: 160 | AM194: 42.2 | AN194: 131 | AO194: -2.3e-002 | AP194: 27 | AQ194: 中天转债!
A195: 6 | B195: 110075 | C195: 南航转债 | D195: 600029 | E195: 南方航空 | F195: 交通运输 | G195: 航空运输 | H195: 121.48 | I195: -6.9999999999999993e-003 | J195: 3.0999999999999999e-003 | K195: 5.93 | L195: -6.7000000000000002e-003 | M195: 110 | N195: 6.24 | O195: 0.27800000000000002 | P195: 95.03 | Q195: 5月9天 | R195: 5.92年 | S195: 3.92年 | T195: 160 | U195: 253 | V195: 1.3000000000000001e-002 | W195: 0.17600000000000002 | X195: 0.16699999999999998 | Y195: 909 | Z195: 1.26 | AA195: -1.6799999999999999e-002 | AB195: -1.9799999999999998e-002 | AC195: -4.1500000000000002e-002 | AD195: -4.2500000000000003e-002 | AE195: 86.87 | AF195: 87 | AG195: 0.59 | AH195: AAA | AI195: 4.0899999999999999e-002 | AJ195: =H195+100*O195 -> 149.28 | AK195: 147.9 | AL195: 229 | AM195: 60.9 | AN195: 233 | AO195: 2.7000000000000003e-002 | AP195: 6 | AQ195: 南航转债
A196: 236 | B196: 128050 | C196: 钧达转债! | D196: 2865 | E196: 钧达股份 | F196: 汽车 | G196: 零部件制 | H196: 132.5 | I196: 8.1600000000000006e-002 | J196: -7.4800000000000005e-002 | K196: 17.88 | L196: 9.0000000000000011e-003 | M196: 123.5 | N196: 14.85 | O196: 0.10000000000000001 | P196: 120.4 | Q196: 转股中 | R196: 4年27天 | S196: 2年27天 | T196: 2.51 | U196: 896 | V196: 2.77 | W196: 0.11699999999999999 | X196: 0.14000000000000001 | Y196: 22 | Z196: 2.5 | AA196: -1.7500000000000002e-002 | AB196: -2.69e-002 | AC196: -0.10400000000000001 | AD196: -0.107 | AE196: 90.36 | AF196: 96.16 | AG196: 0.75 | AH196: AA- | AI196: 6.5000000000000002e-002 | AJ196: =H196+100*O196 -> 142.5 | AK196: 144.6 | AL196: 209 | AM196: 48.4 | AN196: 175 | AO196: 3.4000000000000002e-002 | AP196: 62 | AQ196: 钧达转债!
A197: 272 | B197: 110043 | C197: 无锡转债! | D197: 600908 | E197: 无锡银行 | F197: 金融 | G197: 银行行业 | H197: 115.45 | I197: -1.0700000000000001e-002 | J197: 7.9000000000000008e-003 | K197: 5.58 | L197: -5.3e-003 | M197: 109.1 | N197: 5.79 | O197: 0.19800000000000001 | P197: 96.37 | Q197: 转股中 | R197: 3.21年 | S197: 无权 | T197: 30 | U197: 40 | V197: 1.1000000000000001e-002 | W197: 0.29100000000000004 | X197: 0.28000000000000003 | Y197: 103 | Z197: 0.9 | AA197: -1.77e-002 | AB197: -2.29e-002 | AC197: 无权 | AD197: 无权 | AE197: 无权 | AF197: 95.8 | AG197: 0.52 | AH197: AA+ | AI197: 4.2000000000000003e-002 | AJ197: =H197+100*O197 -> 135.25 | AK197: 134.5 | AL197: 136 | AM197: 38.7 | AN197: 92 | AO197: -3.4000000000000002e-002 | AP197: 31 | AQ197: 无锡转债!
A198: 176 | B198: 113545 | C198: 金能转债 | D198: 603113 | E198: 金能科技 | F198: 煤炭 | G198: 炼焦 | H198: 126.1 | I198: -1.3000000000000001e-002 | J198: 2.4300000000000002e-002 | K198: 13.56 | L198: 1.4999999999999999e-002 | M198: 114.9 | N198: 11.4 | O198: 5.9999999999999998e-002 | P198: 118.95 | Q198: 转股中 | R198: 4.92年 | S198: 2.92年 | T198: 15 | U198: 44 | V198: 2.3e-002 | W198: 0.16399999999999998 | X198: 0.19500000000000001 | Y198: 92 | Z198: 1.5 | AA198: -1.9099999999999999e-002 | AB198: -2.4300000000000002e-002 | AC198: -6.2800000000000009e-002 | AD198: -6.4699999999999994e-002 | AE198: 90.65 | AF198: 93.34 | AG198: 0.76 | AH198: AA | AI198: 4.4000000000000004e-002 | AJ198: =H198+100*O198 -> 132.09999999999999 | AK198: 133.3 | AL198: 123 | AM198: 39.9 | AN198: 109 | AO198: 6.5000000000000002e-002 | AP198: 20 | AQ198: 金能转债
A199: 146 | B199: 110065 | C199: 淮矿转债! | D199: 600985 | E199: 淮北矿业 | F199: 煤炭 | G199: 煤炭开采 | H199: 123.03 | I199: -2.1600000000000001e-002 | J199: -4.5999999999999999e-003 | K199: 10.74 | L199: -3.4200000000000001e-002 | M199: 111 | N199: 9.33 | O199: 6.9000000000000006e-002 | P199: 115.11 | Q199: 转股中 | R199: 5年40天 | S199: 3年40天 | T199: 27.6 | U199: 93 | V199: 2.7000000000000003e-002 | W199: 0.11800000000000001 | X199: 0.13600000000000001 | Y199: 233 | Z199: 1.13 | AA199: -2.0299999999999999e-002 | AB199: -2.41e-002 | AC199: -5.1799999999999999e-002 | AD199: -5.3699999999999998e-002 | AE199: 90.88 | AF199: 90.81 | AG199: 0.76 | AH199: AAA | AI199: 4.0899999999999999e-002 | AJ199: =H199+100*O199 -> 129.93000000000001 | AK199: 130.9 | AL199: 92 | AM199: 40.1 | AN199: 113 | AO199: 2.3e-002 | AP199: 21 | AQ199: 淮矿转债!
A200: 261 | B200: 128040 | C200: 华通转债! | D200: 2758 | E200: 华通医药 | F200: 医药 | G200: 医药商业 | H200: 120.79 | I200: 2.2799999999999997e-002 | J200: -1.9900000000000001e-002 | K200: 11.44 | L200: 4.4000000000000003e-003 | M200: 112.3 | N200: 11.29 | O200: 0.192 | P200: 101.33 | Q200: 转股中 | R200: 3.58年 | S200: 1.58年 | T200: 2.22 | U200: 43 | V200: 0.161 | W200: 9.1999999999999998e-002 | X200: 9.4e-002 | Y200: 24 | Z200: 3.79 | AA200: -2.0499999999999997e-002 | AB200: -2.6600000000000002e-002 | AC200: -8.8699999999999987e-002 | AD200: -9.1400000000000009e-002 | AE200: 92.15 | AF200: 90.02 | AG200: 0.65 | AH200: AA- | AI200: 6.5000000000000002e-002 | AJ200: =H200+100*O200 -> 139.99000000000001 | AK200: 140.3 | AL200: 177 | AM200: 48.1 | AN200: 174 | AO200: -1.e-003 | AP200: 30 | AQ200: 华通转债!
A201: 165 | B201: 110061 | C201: 川投转债 | D201: 600674 | E201: 川投能源 | F201: 能源电力 | G201: 水电 | H201: 122.75 | I201: -5.7999999999999996e-003 | J201: 1.1999999999999999e-003 | K201: 10.25 | L201: -6.8000000000000005e-003 | M201: 110.8 | N201: 9.58 | O201: 0.14699999999999999 | P201: 106.99 | Q201: 转股中 | R201: 4.99年 | S201: 2.99年 | T201: 40 | U201: 18 | V201: 4.0000000000000001e-003 | W201: 8.900000000000001e-002 | X201: 9.5000000000000001e-002 | Y201: 451 | Z201: 1.63 | AA201: -2.06e-002 | AB201: -2.4500000000000001e-002 | AC201: -5.3499999999999999e-002 | AD201: -5.5300000000000002e-002 | AE201: 91.62 | AF201: 91.84 | AG201: 0.69 | AH201: AAA | AI201: 3.9e-002 | AJ201: =H201+100*O201 -> 137.44999999999999 | AK201: 138.5 | AL201: 163 | AM201: 46.7 | AN201: 161 | AO201: 2.5000000000000001e-002 | AP201: 15 | AQ201: 川投转债
A202: 67 | B202: 123055 | C202: 晨光转债 | D202: 300138 | E202: 晨光生物 | F202: 食品饮料 | G202: 食品加工 | H202: 139.701 | I202: -2.2000000000000001e-003 | J202: 1.0500000000000001e-002 | K202: 17.58 | L202: 9.1999999999999998e-003 | M202: 124.3 | N202: 12.25 | O202: -2.7000000000000003e-002 | P202: 143.51 | Q202: 40天 | R202: 5.59年 | S202: 3.59年 | T202: 6.3 | U202: 50 | V202: 5.7000000000000002e-002 | W202: 7.0000000000000007e-002 | X202: 0.10000000000000001 | Y202: 90 | Z202: 4.68 | AA202: -2.1099999999999997e-002 | AB202: -2.81e-002 | AC202: -7.5800000000000006e-002 | AD202: -7.7600000000000002e-002 | AE202: 81.95 | AF202: 87.23 | AG202: 0.91 | AH202: AA- | AI202: 6.6900000000000001e-002 | AJ202: =H202+100*O202 -> 137.001 | AK202: 135.9 | AL202: 143 | AM202: 48.7 | AN202: 176 | AO202: 2.8999999999999998e-002 | AP202: 7 | AQ202: 晨光转债
A203: 289 | B203: 110038 | C203: XD济川转! | D203: 600566 | E203: 济川药业 | F203: 医药 | G203: 中药 | H203: 112.21 | I203: 2.5000000000000001e-003 | J203: -1.6000000000000001e-003 | K203: 22.2 | L203: 2.3e-003 | M203: 108.3 | N203: 23.85 | O203: 0.20499999999999999 | P203: 93.08 | Q203: 转股中 | R203: 2年0.1天 | S203: 0.1天 | T203: 6.28 | U203: 0.9 | V203: 1.e-003 | W203: 3.2000000000000001e-002 | X203: 2.9999999999999999e-002 | Y203: 197 | Z203: 2.68 | AA203: -2.1400000000000002e-002 | AB203: -2.8199999999999999e-002 | AC203: -0.69599999999999995 | AD203: -0.69900000000000007 | AE203: 99.55 | AF203: 98.86 | AG203: 0.4 | AH203: AA | AI203: 4.3099999999999999e-002 | AJ203: =H203+100*O203 -> 132.70999999999998 | AK203: 131.3 | AL203: 101 | AM203: 31.8 | AN203: 29 | AO203: -1.3000000000000001e-002 | AP203: 20 | AQ203: XD济川转!
A204: 295 | B204: 113014 | C204: 林洋转债! | D204: 601222 | E204: 林洋能源 | F204: 能源电力 | G204: 电力设备 | H204: 116.54 | I204: 2.9999999999999997e-004 | J204: 7.000000000000001e-004 | K204: 7.62 | L204: 2.5999999999999999e-003 | M204: 109.3 | N204: 8.54 | O204: 0.30599999999999999 | P204: 89.23 | Q204: 转股中 | R204: 2.95年 | S204: 0.95年 | T204: 30 | U204: 6.1 | V204: 2.e-003 | W204: 0.22500000000000001 | X204: 0.20100000000000001 | Y204: 133 | Z204: 1.28 | AA204: -2.18e-002 | AB204: -2.75e-002 | AC204: -0.111 | AD204: -0.114 | AE204: 97.11 | AF204: 96.68 | AG204: 0.4 | AH204: AA | AI204: 4.3099999999999999e-002 | AJ204: =H204+100*O204 -> 147.14000000000001 | AK204: 143.9 | AL204: 204 | AM204: 46.7 | AN204: 162 | AO204: -3.9e-002 | AP204: 22 | AQ204: 林洋转债!
A205: 58 | B205: 123057 | C205: 美联转债 | D205: 300586 | E205: 美联新材 | F205: 化工 | G205: 橡胶塑料 | H205: 133.6 | I205: 0.10400000000000001 | J205: -9.3299999999999994e-002 | K205: 11.35 | L205: 1.34e-002 | M205: 118.2 | N205: 9.91 | O205: 0.16600000000000001 | P205: 114.53 | Q205: 55天 | R205: 5.63年 | S205: 3.63年 | T205: 2.07 | U205: 3729. | V205: 12.91 | W205: 4.0000000000000001e-002 | X205: 4.5999999999999999e-002 | Y205: 52 | Z205: 6.96 | AA205: -2.1899999999999999e-002 | AB205: -2.7400000000000001e-002 | AC205: -6.4199999999999993e-002 | AD205: -6.6000000000000003e-002 | AE205: 81.65 | AF205: 82.75 | AG205: 0.81 | AH205: AA- | AI205: 6.6900000000000001e-002 | AJ205: =H205+100*O205 -> 150.19999999999999 | AK205: 152.7 | AL205: 244 | AM205: 69.9 | AN205: 249 | AO205: 9.0000000000000011e-003 | AP205: 10 | AQ205: 美联转债
A206: 168 | B206: 113548 | C206: 石英转债! | D206: 603688 | E206: 石英股份 | F206: 电子 | G206: 电子产品 | H206: 138.59 | I206: 1.32e-002 | J206: -1.44e-002 | K206: 19.05 | L206: -1.6000000000000001e-003 | M206: 124.4 | N206: 15.1 | O206: 9.9000000000000005e-002 | P206: 126.16 | Q206: 转股中 | R206: 4.96年 | S206: 2.96年 | T206: 1.23 | U206: 21 | V206: 0.125 | W206: 1.8000000000000002e-002 | X206: 2.3e-002 | Y206: 67 | Z206: 3.57 | AA206: -2.2000000000000002e-002 | AB206: -2.9900000000000003e-002 | AC206: -8.77e-002 | AD206: -8.9999999999999997e-002 | AE206: 85.87 | AF206: 91.68 | AG206: 0.82 | AH206: AA- | AI206: 6.5000000000000002e-002 | AJ206: =H206+100*O206 -> 148.49000000000001 | AK206: 151 | AL206: 240 | AM206: 59.3 | AN206: 225 | AO206: -5.5e-002 | AP206: 11 | AQ206: 石英转债!
A207: 196 | B207: 113536 | C207: 三星转债 | D207: 603578 | E207: 三星新材 | F207: 家电 | G207: 零部件制 | H207: 127.25 | I207: 2.2000000000000002e-002 | J207: -2.1400000000000002e-002 | K207: 23.85 | L207: 8.0000000000000004e-004 | M207: 114.8 | N207: 19.54 | O207: 4.2999999999999997e-002 | P207: 122.06 | Q207: 转股中 | R207: 4.55年 | S207: 2.55年 | T207: 1.49 | U207: 38 | V207: 0.19899999999999998 | W207: 6.8000000000000005e-002 | X207: 8.3000000000000004e-002 | Y207: 22 | Z207: 3.14 | AA207: -2.2799999999999997e-002 | AB207: -2.8399999999999998e-002 | AC207: -7.46e-002 | AD207: -7.6700000000000004e-002 | AE207: 92.01 | AF207: 94.75 | AG207: 0.76 | AH207: AA | AI207: 4.4000000000000004e-002 | AJ207: =H207+100*O207 -> 131.55000000000001 | AK207: 132.4 | AL207: 114 | AM207: 37.7 | AN207: 80 | AO207: -1.e-003 | AP207: 39 | AQ207: 三星转债
A208: 214 | B208: 123024 | C208: 岱勒转债! | D208: 300700 | E208: 岱勒新材 | F208: 机械装备 | G208: 专用设备 | H208: 122.23 | I208: 6.2899999999999998e-002 | J208: -6.59e-002 | K208: 24.15 | L208: -4.8999999999999998e-003 | M208: 113 | N208: 24.9 | O208: 0.26000000000000001 | P208: 96.99 | Q208: 转股中 | R208: 3.35年 | S208: 1.35年 | T208: 2.1 | U208: 378 | V208: 1.5 | W208: 0.106 | X208: 0.10199999999999999 | Y208: 20 | Z208: 4.03 | AA208: -2.3399999999999997e-002 | AB208: -3.0200000000000001e-002 | AC208: -0.10300000000000001 | AD208: -0.105 | AE208: 91.1 | AF208: 88.7 | AG208: 0.61 | AH208: A+ | AI208: 7.5999999999999998e-002 | AJ208: =H208+100*O208 -> 148.23000000000002 | AK208: 147.5 | AL208: 226 | AM208: 56.4 | AN208: 213 | AO208: -2.8999999999999998e-002 | AP208: 35 | AQ208: 岱勒转债!
A209: 174 | B209: 128078 | C209: 太极转债! | D209: 2368 | E209: 太极股份 | F209: 计算机及 | G209: 软件开发 | H209: 131.287 | I209: 2.3e-003 | J209: -8.0000000000000004e-004 | K209: 27.19 | L209: 1.5e-003 | M209: 116.9 | N209: 22.4 | O209: 8.199999999999999e-002 | P209: 121.38 | Q209: 转股中 | R209: 4.94年 | S209: 2.94年 | T209: 9.6 | U209: 2.3 | V209: 2.e-003 | W209: 6.0999999999999999e-002 | X209: 7.400000000000001e-002 | Y209: 158 | Z209: 5.13 | AA209: -2.3599999999999999e-002 | AB209: -2.9399999999999999e-002 | AC209: -7.46e-002 | AD209: -7.6499999999999999e-002 | AE209: 90.57 | AF209: 94.88 | AG209: 1 | AH209: AA | AI209: 4.4000000000000004e-002 | AJ209: =H209+100*O209 -> 139.48699999999999 | AK209: 141.2 | AL209: 189 | AM209: 46.3 | AN209: 158 | AO209: -6.0000000000000001e-003 | AP209: 12 | AQ209: 太极转债!
A210: 99 | B210: 113576 | C210: 起步转债!! | D210: 603557 | E210: 起步股份 | F210: 服装纺织 | G210: 鞋服行业 | H210: 138.53 | I210: 2.9700000000000001e-002 | J210: -1.7299999999999999e-002 | K210: 14.43 | L210: 1.41e-002 | M210: 121.8 | N210: 10.55 | O210: 1.3000000000000001e-002 | P210: 136.78 | Q210: 转股中 | R210: 5.41年 | S210: 3.41年 | T210: 2.76 | U210: 237 | V210: 0.61899999999999999 | W210: 3.9e-002 | X210: 5.2999999999999999e-002 | Y210: 71 | Z210: 4.25 | AA210: -2.41e-002 | AB210: -3.0600000000000002e-002 | AC210: -7.6200000000000004e-002 | AD210: -7.8399999999999997e-002 | AE210: 83.35 | AF210: 86.59 | AG210: 0.88 | AH210: AA- | AI210: 6.6900000000000001e-002 | AJ210: =H210+100*O210 -> 139.83000000000001 | AK210: 140.3 | AL210: 178 | AM210: 53.7 | AN210: 199 | AO210: -5.2999999999999999e-002 | AP210: 28 | AQ210: 起步转债!!
A211: 110 | B211: 123047 | C211: 久吾转债 | D211: 300631 | E211: 久吾高科 | F211: 机械装备 | G211: 专用设备 | H211: 148 | I211: 0.122 | J211: -0.115 | K211: 22.43 | L211: 8.1000000000000013e-003 | M211: 130.1 | N211: 17.61 | O211: 0.16200000000000001 | P211: 127.37 | Q211: 转股中 | R211: 5.35年 | S211: 3.35年 | T211: 1.99 | U211: 1761. | V211: 6.0999999999999996 | W211: 8.4000000000000005e-002 | X211: 0.107 | Y211: 24 | Z211: 3.35 | AA211: -2.4399999999999998e-002 | AB211: -3.3099999999999997e-002 | AC211: -9.1400000000000009e-002 | AD211: -9.4200000000000006e-002 | AE211: 81.82 | AF211: 88.14 | AG211: 0.83 | AH211: A+ | AI211: 7.7899999999999997e-002 | AJ211: =H211+100*O211 -> 164.19999999999999 | AK211: 168.6 | AL211: 259 | AM211: 80.5 | AN211: 260 | AO211: -3.9e-002 | AP211: 22 | AQ211: 久吾转债
A212: 81 | B212: 123051 | C212: 今天转债 | D212: 300532 | E212: 今天国际 | F212: 计算机及 | G212: 软件开发 | H212: 140.53 | I212: 3.8599999999999995e-002 | J212: -1.1399999999999999e-002 | K212: 12.26 | L212: 3.0299999999999997e-002 | M212: 122.8 | N212: 8.8 | O212: 9.0000000000000011e-003 | P212: 139.32 | Q212: 27天 | R212: 5.56年 | S212: 3.56年 | T212: 2.8 | U212: 571 | V212: 1.46 | W212: 8.4000000000000005e-002 | X212: 0.11599999999999999 | Y212: 33 | Z212: 4.21 | AA212: -2.4500000000000001e-002 | AB212: -3.1099999999999999e-002 | AC212: -7.6799999999999993e-002 | AD212: -7.8899999999999998e-002 | AE212: 79.49 | AF212: 81.78 | AG212: 0.9 | AH212: A+ | AI212: 7.7899999999999997e-002 | AJ212: =H212+100*O212 -> 141.43000000000001 | AK212: 141.7 | AL212: 192 | AM212: 60 | AN212: 228 | AO212: -1.7000000000000001e-002 | AP212: 11 | AQ212: 今天转债
A213: 104 | B213: 128104 | C213: 裕同转债! | D213: 2831 | E213: 裕同科技 | F213: 造纸包装 | G213: 包装材料 | H213: 131.95 | I213: -7.0999999999999995e-003 | J213: -5.6000000000000008e-003 | K213: 29.49 | L213: -1.2699999999999999e-002 | M213: 115.3 | N213: 23.24 | O213: 4.0000000000000001e-002 | P213: 126.89 | Q213: 转股中 | R213: 5.40年 | S213: 3.40年 | T213: 13.7 | U213: 92 | V213: 5.0999999999999997e-002 | W213: 5.2999999999999999e-002 | X213: 6.7000000000000004e-002 | Y213: 259 | Z213: 3.86 | AA213: -2.5099999999999997e-002 | AB213: -2.9999999999999999e-002 | AC213: -6.5700000000000008e-002 | AD213: -6.7500000000000004e-002 | AE213: 89.21 | AF213: 91.87 | AG213: 1 | AH213: AA+ | AI213: 4.3899999999999995e-002 | AJ213: =H213+100*O213 -> 135.94999999999999 | AK213: 137 | AL213: 150 | AM213: 45.1 | AN213: 150 | AO213: -4.9000000000000002e-002 | AP213: 7 | AQ213: 裕同转债!
A214: 179 | B214: 128075 | C214: 远东转债! | D214: 2406 | E214: 远东传动 | F214: 汽车 | G214: 零部件制 | H214: 130.6 | I214: 4.0000000000000002e-004 | J214: 8.8000000000000005e-003 | K214: 7.21 | L214: 1.1200000000000002e-002 | M214: 114.9 | N214: 5.54 | O214: 4.0000000000000001e-003 | P214: 130.14 | Q214: 转股中 | R214: 4.86年 | S214: 2.86年 | T214: 6.26 | U214: 9.6 | V214: 1.2e-002 | W214: 0.14699999999999999 | X214: 0.191 | Y214: 43 | Z214: 1.44 | AA214: -2.6499999999999999e-002 | AB214: -3.1699999999999999e-002 | AC214: -7.4800000000000005e-002 | AD214: -7.6799999999999993e-002 | AE214: 90.87 | AF214: 93.57 | AG214: 0.83 | AH214: AA | AI214: 4.4000000000000004e-002 | AJ214: =H214+100*O214 -> 131. | AK214: 131.1 | AL214: 95 | AM214: 37.5 | AN214: 79 | AO214: -3.7999999999999999e-002 | AP214: 15 | AQ214: 远东转债!
A215: 133 | B215: 128096 | C215: 奥瑞转债! | D215: 2701 | E215: 奥瑞金 | F215: 造纸包装 | G215: 包装材料 | H215: 133.14 | I215: -2.0000000000000001e-004 | J215: 1.7000000000000001e-003 | K215: 6.05 | L215: 1.7000000000000001e-003 | M215: 116 | N215: 4.52 | O215: -5.0000000000000001e-003 | P215: 133.85 | Q215: 转股中 | R215: 5.25年 | S215: 3.25年 | T215: 8.77 | U215: 45 | V215: 3.7999999999999999e-002 | W215: 6.0999999999999999e-002 | X215: 8.1000000000000003e-002 | Y215: 145 | Z215: 2.45 | AA215: -2.6499999999999999e-002 | AB215: -3.1699999999999999e-002 | AC215: -6.9800000000000001e-002 | AD215: -7.1900000000000006e-002 | AE215: 90.29 | AF215: 93.1 | AG215: 0.85 | AH215: AA+ | AI215: 4.3899999999999995e-002 | AJ215: =H215+100*O215 -> 132.63999999999999 | AK215: 132.4 | AL215: 113 | AM215: 39.3 | AN215: 98 | AO215: 2.7999999999999997e-002 | AP215: 21 | AQ215: 奥瑞转债!
A216: 181 | B216: 128073 | C216: 哈尔转债! | D216: 2615 | E216: 哈尔斯 | F216: 其他 | G216: 家居用品 | H216: 127.5 | I216: 8.0500000000000002e-002 | J216: -9.6000000000000002e-002 | K216: 5.55 | L216: -2.63e-002 | M216: 115.3 | N216: 5.72 | O216: 0.314 | P216: 97.03 | Q216: 转股中 | R216: 3.77年 | S216: 1.77年 | T216: 2.99 | U216: 1092. | V216: 2.9300000000000002 | W216: 0.13100000000000001 | X216: 0.127 | Y216: 23 | Z216: 2.86 | AA216: -2.6600000000000002e-002 | AB216: -3.3599999999999998e-002 | AC216: -0.109 | AD216: -0.111 | AE216: 90.38 | AF216: 91.22 | AG216: 0.59 | AH216: AA- | AI216: 6.5000000000000002e-002 | AJ216: =H216+100*O216 -> 158.90000000000001 | AK216: 158 | AL216: 250 | AM216: 66.8 | AN216: 246 | AO216: -1.1000000000000001e-002 | AP216: 39 | AQ216: 哈尔转债!
A217: 199 | B217: 110058 | C217: 永鼎转债! | D217: 600105 | E217: 永鼎股份 | F217: 通信互联 | G217: 通信设备 | H217: 129.62 | I217: 3.4000000000000002e-003 | J217: -8.9999999999999998e-004 | K217: 6.58 | L217: 3.0000000000000001e-003 | M217: 114.9 | N217: 5.04 | O217: -6.9999999999999993e-003 | P217: 130.56 | Q217: 转股中 | R217: 4.42年 | S217: 2.42年 | T217: 4.33 | U217: 47 | V217: 8.4000000000000005e-002 | W217: 5.0999999999999997e-002 | X217: 6.6000000000000003e-002 | Y217: 86 | Z217: 3.23 | AA217: -2.7400000000000001e-002 | AB217: -3.32e-002 | AC217: -8.4399999999999989e-002 | AD217: -8.6599999999999996e-002 | AE217: 92.6 | AF217: 95.35 | AG217: 0.83 | AH217: AA | AI217: 4.4000000000000004e-002 | AJ217: =H217+100*O217 -> 128.92000000000002 | AK217: 128.7 | AL217: 62 | AM217: 33.3 | AN217: 40 | AO217: 2.5000000000000001e-002 | AP217: 51 | AQ217: 永鼎转债!
A218: 126 | B218: 110066 | C218: 盛屯转债! | D218: 600711 | E218: 盛屯矿业 | F218: 有色金属 | G218: 有色行业 | H218: 134 | I218: 7.1999999999999998e-003 | J218: 3.3e-003 | K218: 6.58 | L218: 1.23e-002 | M218: 115.3 | N218: 4.88 | O218: -6.0000000000000001e-003 | P218: 134.84 | Q218: 转股中 | R218: 5.30年 | S218: 3.30年 | T218: 22.8 | U218: 151 | V218: 4.9000000000000002e-002 | W218: 0.14999999999999999 | X218: 0.20199999999999999 | Y218: 152 | Z218: 1.65 | AA218: -2.8500000000000001e-002 | AB218: -3.3399999999999999e-002 | AC218: -7.17e-002 | AD218: -7.3499999999999996e-002 | AE218: 89 | AF218: 91.35 | AG218: 0.85 | AH218: AA | AI218: 4.5899999999999996e-002 | AJ218: =H218+100*O218 -> 133.40000000000001 | AK218: 133.2 | AL218: 121 | AM218: 41.8 | AN218: 125 | AO218: 9.6000000000000002e-002 | AP218: 43 | AQ218: 盛屯转债!
A219: 74 | B219: 128110 | C219: 永兴转债 | D219: 2756 | E219: 永兴材料 | F219: 钢铁 | G219: 炼钢 | H219: 132.6 | I219: 2.98e-002 | J219: 3.4799999999999998e-002 | K219: 22.95 | L219: 7.4900000000000008e-002 | M219: 113.2 | N219: 17.06 | O219: -1.3999999999999999e-002 | P219: 134.53 | Q219: 32天 | R219: 5.57年 | S219: 3.57年 | T219: 7 | U219: 133 | V219: 0.14199999999999999 | W219: 8.4000000000000005e-002 | X219: 0.11199999999999999 | Y219: 84 | Z219: 2.4 | AA219: -2.8500000000000001e-002 | AB219: -3.2599999999999997e-002 | AC219: -6.4199999999999993e-002 | AD219: -6.59e-002 | AE219: 87.83 | AF219: 88.59 | AG219: 0.86 | AH219: AA | AI219: 4.5899999999999996e-002 | AJ219: =H219+100*O219 -> 131.19999999999999 | AK219: 130.7 | AL219: 88 | AM219: 42.1 | AN219: 128 | AO219: 0.19600000000000001 | AP219: 4 | AQ219: 永兴转债
A220: 98 | B220: 123048 | C220: 应急转债! | D220: 300527 | E220: 中船应急 | F220: 机械装备 | G220: 专用设备 | H220: 132.98 | I220: 2.6099999999999998e-002 | J220: -1.5700000000000002e-002 | K220: 11.24 | L220: 1.26e-002 | M220: 113.1 | N220: 8.9 | O220: 5.2999999999999999e-002 | P220: 126.29 | Q220: 转股中 | R220: 5.41年 | S220: 3.41年 | T220: 3.8 | U220: 775 | V220: 1.53 | W220: 3.7000000000000005e-002 | X220: 4.7e-002 | Y220: 103 | Z220: 4.35 | AA220: -2.9999999999999999e-002 | AB220: -3.4200000000000001e-002 | AC220: -6.8000000000000005e-002 | AD220: -6.9699999999999998e-002 | AE220: 88.98 | AF220: 90.06 | AG220: 0.82 | AH220: AA+ | AI220: 4.3899999999999995e-002 | AJ220: =H220+100*O220 -> 138.28 | AK220: 139.7 | AL220: 171 | AM220: 49.6 | AN220: 180 | AO220: -8.4000000000000005e-002 | AP220: 15 | AQ220: 应急转债!
A221: 41 | B221: 123061 | C221: 航新转债 | D221: 300424 | E221: 航新科技 | F221: 航空航天 | G221: 航空航天 | H221: 148.3 | I221: 7.0400000000000004e-002 | J221: -6.0999999999999999e-002 | K221: 18.92 | L221: 1.1200000000000002e-002 | M221: 124.8 | N221: 14.86 | O221: 0.16500000000000001 | P221: 127.32 | Q221: 2月16天 | R221: 5.69年 | S221: 3.69年 | T221: 2.5 | U221: 2154. | V221: 5.8600000000000003 | W221: 5.5e-002 | X221: 7.0000000000000007e-002 | Y221: 45 | Z221: 4.16 | AA221: -3.0499999999999999e-002 | AB221: -3.7400000000000003e-002 | AC221: -8.72e-002 | AD221: -8.9200000000000002e-002 | AE221: 81.84 | AF221: 87.1 | AG221: 0.84 | AH221: AA- | AI221: 6.6900000000000001e-002 | AJ221: =H221+100*O221 -> 164.80000000000001 | AK221: 169.3 | AL221: 262 | AM221: 82.2 | AN221: 262 | AO221: -0.124 | AP221: 8 | AQ221: 航新转债
A222: 105 | B222: 110069 | C222: 瀚蓝转债 | D222: 600323 | E222: 瀚蓝环境 | F222: 城市公用 | G222: 三废处理 | H222: 135.25 | I222: -7.3000000000000001e-003 | J222: 5.1000000000000004e-003 | K222: 24.83 | L222: -2.8000000000000004e-003 | M222: 113.5 | N222: 20.2 | O222: 0.10000000000000001 | P222: 122.92 | Q222: 转股中 | R222: 5.40年 | S222: 3.40年 | T222: 9.83 | U222: 38 | V222: 2.7999999999999997e-002 | W222: 5.2000000000000005e-002 | X222: 6.4000000000000001e-002 | Y222: 190 | Z222: 2.66 | AA222: -3.2300000000000002e-002 | AB222: -3.6600000000000001e-002 | AC222: -7.5899999999999995e-002 | AD222: -7.690000000000001e-002 | AE222: 87.81 | AF222: 90.27 | AG222: 0.81 | AH222: AA+ | AI222: 4.3899999999999995e-002 | AJ222: =H222+100*O222 -> 145.25 | AK222: 147.6 | AL222: 227 | AM222: 57.3 | AN222: 215 | AO222: -2.3e-002 | AP222: 7 | AQ222: 瀚蓝转债
A223: 137 | B223: 127015 | C223: 希望转债! | D223: 876 | E223: 新 希 望 | F223: 农业 | G223: 畜牧业 | H223: 130.4 | I223: 6.1999999999999998e-003 | J223: 1.e-004 | K223: 25.85 | L223: 6.1999999999999998e-003 | M223: 110.2 | N223: 19.75 | O223: -4.0000000000000001e-003 | P223: 130.89 | Q223: 转股中 | R223: 5年51天 | S223: 3年51天 | T223: 17.6 | U223: 96 | V223: 4.2000000000000003e-002 | W223: 1.4999999999999999e-002 | X223: 2.e-002 | Y223: 1165. | Z223: 3.22 | AA223: -3.27e-002 | AB223: -3.61e-002 | AC223: -6.9699999999999998e-002 | AD223: -7.1199999999999999e-002 | AE223: 90.19 | AF223: 89.98 | AG223: 1 | AH223: AAA | AI223: 4.0899999999999999e-002 | AJ223: =H223+100*O223 -> 130. | AK223: 129.9 | AL223: 79 | AM223: 39.7 | AN223: 103 | AO223: -5.7000000000000002e-002 | AP223: 28 | AQ223: 希望转债!
A224: 14 | B224: 123065 | C224: 宝莱转债! | D224: 300246 | E224: 宝莱特 | F224: 医药 | G224: 医疗器械 | H224: 146.862 | I224: 1.8e-003 | J224: -8.1000000000000013e-003 | K224: 29.19 | L224: -1.6799999999999999e-002 | M224: 121.4 | N224: 40.54 | O224: 1.04 | P224: 72 | Q224: 3月28天 | R224: 5.81年 | S224: 3.81年 | T224: 2.19 | U224: 3807. | V224: 11. | W224: 5.0999999999999997e-002 | X224: 3.7000000000000005e-002 | Y224: 43 | Z224: 5.12 | AA224: -3.2799999999999996e-002 | AB224: -3.8800000000000001e-002 | AC224: -8.3199999999999996e-002 | AD224: -8.4900000000000003e-002 | AE224: 80.86 | AF224: 84.01 | AG224: 0.38 | AH224: AA- | AI224: 6.6900000000000001e-002 | AJ224: =H224+100*O224 -> 250.86199999999999 | AK224: 221.7 | AL224: 290 | AM224: 137.7 | AN224: 292 | AO224: -0.111 | AP224: 8 | AQ224: 宝莱转债!
A225: 1 | B225: 113605 | C225: N大参转 | D225: 603233 | E225: 大参林 | F225: 医药 | G225: 医药商业 | H225: 140.64 | I225: 0.40600000000000003 | J225: 0. | K225: 99.2 | L225: 5.0700000000000002e-002 | M225: 115.2 | N225: 83.85 | O225: 0.18899999999999997 | P225: 118.31 | Q225: 5月16天 | R225: 5.94年 | S225: 3.94年 | T225: 14.1 | U225: 163 | V225: 8.199999999999999e-002 | W225: 2.2000000000000002e-002 | X225: 2.6000000000000002e-002 | Y225: 651 | Z225: 13.04 | AA225: -3.3599999999999998e-002 | AB225: -3.7900000000000003e-002 | AC225: -7.2000000000000008e-002 | AD225: -7.3499999999999996e-002 | AE225: 86.38 | AF225: 88.66 | AG225: 0.79 | AH225: AA | AI225: 4.5899999999999996e-002 | AJ225: =H225+100*O225 -> 159.53999999999999 | AK225: 163 | AL225: 253 | AM225: 74.3 | AN225: 257 | AO225: 9.6000000000000002e-002 | AP225: 2 | AQ225: N大参转
A226: 70 | B226: 113587 | C226: 泛微转债 | D226: 603039 | E226: 泛微网络 | F226: 计算机及 | G226: 软件开发 | H226: 150.26 | I226: 0. | J226: 5.0000000000000001e-004 | K226: 98.06 | L226: 5.0000000000000001e-004 | M226: 124.3 | N226: 64.33 | O226: -1.3999999999999999e-002 | P226: 152.43 | Q226: 38天 | R226: 5.59年 | S226: 3.59年 | T226: 3.16 | U226: 6.5 | V226: 1.3999999999999999e-002 | W226: 1.4999999999999999e-002 | X226: 2.3e-002 | Y226: 208 | Z226: 21.59 | AA226: -3.4000000000000002e-002 | AB226: -4.0899999999999999e-002 | AC226: -9.3800000000000008e-002 | AD226: -9.5600000000000004e-002 | AE226: 81.98 | AF226: 87.26 | AG226: 0.92 | AH226: AA- | AI226: 6.6900000000000001e-002 | AJ226: =H226+100*O226 -> 148.85999999999999 | AK226: 148.1 | AL226: 230 | AM226: 60.8 | AN226: 231 | AO226: 4.0000000000000001e-002 | AP226: 4 | AQ226: 泛微转债
A227: 306 | B227: 110034 | C227: 九州转债! | D227: 600998 | E227: 九州通 | F227: 医药 | G227: 医药商业 | H227: 114.15 | I227: -2.3999999999999998e-003 | J227: 1.1299999999999999e-002 | K227: 18.43 | L227: 2.1099999999999997e-002 | M227: 109.6 | N227: 18.32 | O227: 0.13500000000000001 | P227: 100.6 | Q227: 转股中 | R227: 1.17年 | S227: 回售中 | T227: 15 | U227: 28 | V227: 1.6e-002 | W227: 4.2999999999999997e-002 | X227: 4.4000000000000004e-002 | Y227: 345 | Z227: 1.84 | AA227: -3.4500000000000003e-002 | AB227: -4.9000000000000002e-002 | AC227: 回售中 | AD227: 回售中 | AE227: 103 | AF227: 104.61 | AG227: 0.42 | AH227: AA+ | AI227: 4.1100000000000005e-002 | AJ227: =H227+100*O227 -> 127.65000000000001 | AK227: 127.7 | AL227: 54 | AM227: 23.1 | AN227: 5 | AO227: 2.2000000000000002e-002 | AP227: 25 | AQ227: 九州转债!
A228: 102 | B228: 113575 | C228: 东时转债! | D228: 603377 | E228: 东方时尚 | F228: 其他 | G228: 其他 | H228: 137.33 | I228: -4.8999999999999998e-003 | J228: -3.0000000000000001e-003 | K228: 20.07 | L228: -8.8999999999999999e-003 | M228: 113.5 | N228: 14.56 | O228: -4.0000000000000001e-003 | P228: 137.84 | Q228: 转股中 | R228: 5.40年 | S228: 3.40年 | T228: 2.16 | U228: 15 | V228: 5.0000000000000003e-002 | W228: 1.8000000000000002e-002 | X228: 2.5000000000000001e-002 | Y228: 118 | Z228: 6.28 | AA228: -3.5299999999999998e-002 | AB228: -3.95e-002 | AC228: -7.5999999999999998e-002 | AD228: -7.7800000000000008e-002 | AE228: 88.61 | AF228: 89.52 | AG228: 0.88 | AH228: AA | AI228: 4.5899999999999996e-002 | AJ228: =H228+100*O228 -> 136.93000000000001 | AK228: 136.8 | AL228: 149 | AM228: 47.3 | AN228: 166 | AO228: 1.3000000000000001e-002 | AP228: 15 | AQ228: 东时转债!
A229: 287 | B229: 128021 | C229: 兄弟转债!! | D229: 2562 | E229: 兄弟科技 | F229: 医药 | G229: 原料药 | H229: 122.274 | I229: 4.0999999999999995e-003 | J229: 1.1000000000000001e-002 | K229: 5.87 | L229: 1.5600000000000001e-002 | M229: 109.8 | N229: 5.25 | O229: 9.4e-002 | P229: 111.81 | Q229: 转股中 | R229: 3年15天 | S229: 1年15天 | T229: 2.66 | U229: 8.7 | V229: 2.7000000000000003e-002 | W229: 4.8000000000000001e-002 | X229: 5.2999999999999999e-002 | Y229: 56 | Z229: 2.28 | AA229: -3.5499999999999997e-002 | AB229: -4.1100000000000005e-002 | AC229: -0.13100000000000001 | AD229: -0.13400000000000001 | AE229: 97.41 | AF229: 96.6 | AG229: 0.97 | AH229: AA | AI229: 4.4000000000000004e-002 | AJ229: =H229+100*O229 -> 131.67400000000001 | AK229: 132.7 | AL229: 117 | AM229: 35.3 | AN229: 60 | AO229: -2.1000000000000001e-002 | AP229: 13 | AQ229: 兄弟转债!!
A230: 154 | B230: 113029 | C230: 明阳转债!! | D230: 601615 | E230: 明阳智能 | F230: 能源电力 | G230: 风能 | H230: 136.28 | I230: -2.5999999999999999e-003 | J230: 1.6000000000000001e-003 | K230: 15.79 | L230: -1.2999999999999999e-003 | M230: 113.3 | N230: 12.46 | O230: 7.4999999999999997e-002 | P230: 126.73 | Q230: 转股中 | R230: 5年33天 | S230: 3年33天 | T230: 9.81 | U230: 9.3 | V230: 6.9999999999999993e-003 | W230: 4.4000000000000004e-002 | X230: 5.5999999999999994e-002 | Y230: 222 | Z230: 2.93 | AA230: -3.6299999999999999e-002 | AB230: -4.07e-002 | AC230: -8.1000000000000003e-002 | AD230: -8.3000000000000004e-002 | AE230: 89.85 | AF230: 90.62 | AG230: 0.83 | AH230: AA | AI230: 4.5899999999999996e-002 | AJ230: =H230+100*O230 -> 143.78 | AK230: 145.8 | AL230: 215 | AM230: 55.2 | AN230: 207 | AO230: -7.0000000000000007e-002 | AP230: 22 | AQ230: 明阳转债!!
A231: 27 | B231: 128126 | C231: 赣锋转2 | D231: 2460 | E231: 赣锋锂业 | F231: 有色金属 | G231: 小金属 | H231: 137.23 | I231: 6.9999999999999993e-003 | J231: 4.5000000000000005e-003 | K231: 74.01 | L231: 1.41e-002 | M231: 111.1 | N231: 60.27 | O231: 0.11800000000000001 | P231: 122.8 | Q231: 3月1天 | R231: 5.73年 | S231: 3.73年 | T231: 21.1 | U231: 20 | V231: 6.9999999999999993e-003 | W231: 2.1000000000000001e-002 | X231: 2.6000000000000002e-002 | Y231: 986 | Z231: 10.63 | AA231: -3.6699999999999997e-002 | AB231: -4.0000000000000001e-002 | AC231: -7.1800000000000003e-002 | AD231: -7.2999999999999995e-002 | AE231: 86.47 | AF231: 86.25 | AG231: 0.81 | AH231: AA | AI231: 4.5899999999999996e-002 | AJ231: =H231+100*O231 -> 149.03 | AK231: 151.7 | AL231: 241 | AM231: 65.2 | AN231: 245 | AO231: 0.14199999999999999 | AP231: 7 | AQ231: 赣锋转2
A232: 127 | B232: 113032 | C232: 桐20转债! | D232: 601233 | E232: 桐昆股份 | F232: 服装纺织 | G232: 纺织行业 | H232: 137.54 | I232: 2.2499999999999999e-002 | J232: -5.7999999999999996e-003 | K232: 18.76 | L232: 1.9599999999999999e-002 | M232: 113.1 | N232: 14.35 | O232: 5.2000000000000005e-002 | P232: 130.73 | Q232: 转股中 | R232: 5.30年 | S232: 3.30年 | T232: 23 | U232: 145 | V232: 4.5999999999999999e-002 | W232: 6.6000000000000003e-002 | X232: 8.6999999999999994e-002 | Y232: 347 | Z232: 1.76 | AA232: -3.6900000000000002e-002 | AB232: -4.1100000000000005e-002 | AC232: -7.9100000000000004e-002 | AD232: -8.09e-002 | AE232: 89.39 | AF232: 90.47 | AG232: 0.85 | AH232: AA+ | AI232: 4.3899999999999995e-002 | AJ232: =H232+100*O232 -> 142.73999999999998 | AK232: 144.3 | AL232: 207 | AM232: 53.9 | AN232: 201 | AO232: 0.14800000000000002 | AP232: 20 | AQ232: 桐20转债!
A233: 218 | B233: 110055 | C233: 伊力转债! | D233: 600197 | E233: 伊力特 | F233: 食品饮料 | G233: 白酒 | H233: 135.13 | I233: -0.113 | J233: 2.4700000000000003e-002 | K233: 23.46 | L233: -0.10000000000000001 | M233: 115 | N233: 16.81 | O233: -3.2000000000000001e-002 | P233: 139.56 | Q233: 转股中 | R233: 4.33年 | S233: 2.33年 | T233: 8.19 | U233: 387 | V233: 0.33799999999999997 | W233: 8.0000000000000002e-002 | X233: 0.11199999999999999 | Y233: 102 | Z233: 3.81 | AA233: -3.73e-002 | AB233: -4.3099999999999999e-002 | AC233: -0.10199999999999999 | AD233: -0.10400000000000001 | AE233: 93.05 | AF233: 95.81 | AG233: 0.88 | AH233: AA | AI233: 4.4000000000000004e-002 | AJ233: =H233+100*O233 -> 131.93000000000001 | AK233: 130.7 | AL233: 89 | AM233: 34.9 | AN233: 55 | AO233: 0.14000000000000001 | AP233: 25 | AQ233: 伊力转债!
A234: 116 | B234: 113571 | C234: 博特转债! | D234: 603916 | E234: 苏博特 | F234: 建筑 | G234: 水泥 | H234: 148.63 | I234: 5.5000000000000005e-003 | J234: -2.e-003 | K234: 28.35 | L234: 3.4999999999999996e-003 | M234: 120.8 | N234: 18.88 | O234: -1.e-002 | P234: 150.16 | Q234: 转股中 | R234: 5.33年 | S234: 3.33年 | T234: 1.81 | U234: 63 | V234: 0.23600000000000002 | W234: 1.9e-002 | X234: 2.8999999999999998e-002 | Y234: 94 | Z234: 3.22 | AA234: -3.8900000000000004e-002 | AB234: -4.5199999999999997e-002 | AC234: -9.7899999999999987e-002 | AD234: -9.9700000000000011e-002 | AE234: 83.3 | AF234: 86.24 | AG234: 1 | AH234: AA- | AI234: 6.6900000000000001e-002 | AJ234: =H234+100*O234 -> 147.63 | AK234: 147.1 | AL234: 222 | AM234: 60.9 | AN234: 232 | AO234: 5.2999999999999999e-002 | AP234: 13 | AQ234: 博特转债!
A235: 247 | B235: 128046 | C235: 利尔转债! | D235: 2258 | E235: 利尔化学 | F235: 化工 | G235: 农化 | H235: 131.6 | I235: -2.0799999999999999e-002 | J235: 8.6999999999999994e-003 | K235: 22.42 | L235: -1.54e-002 | M235: 112.3 | N235: 18.62 | O235: 9.3000000000000013e-002 | P235: 120.41 | Q235: 转股中 | R235: 3.93年 | S235: 1.93年 | T235: 8.52 | U235: 14 | V235: 1.2e-002 | W235: 7.2000000000000008e-002 | X235: 8.6999999999999994e-002 | Y235: 118 | Z235: 3.29 | AA235: -4.0199999999999993e-002 | AB235: -4.5599999999999995e-002 | AC235: -0.11199999999999999 | AD235: -0.114 | AE235: 94 | AF235: 95.12 | AG235: 0.79 | AH235: AA | AI235: 4.4000000000000004e-002 | AJ235: =H235+100*O235 -> 140.90000000000001 | AK235: 142.8 | AL235: 202 | AM235: 47.7 | AN235: 168 | AO235: 8.1000000000000003e-002 | AP235: 10 | AQ235: 利尔转债!
A236: 114 | B236: 123045 | C236: 雷迪转债 | D236: 300652 | E236: 雷迪克 | F236: 汽车 | G236: 零部件制 | H236: 148 | I236: 0.13 | J236: -0.11199999999999999 | K236: 25.39 | L236: 2.0499999999999997e-002 | M236: 119.4 | N236: 20.13 | O236: 0.17300000000000001 | P236: 126.13 | Q236: 转股中 | R236: 5.33年 | S236: 3.33年 | T236: 1.66 | U236: 2618. | V236: 10.970000000000001 | W236: 7.0000000000000007e-002 | X236: 8.8000000000000009e-002 | Y236: 24 | Z236: 2.8 | AA236: -4.0399999999999998e-002 | AB236: -4.6199999999999998e-002 | AC236: -9.5700000000000007e-002 | AD236: -9.7799999999999998e-002 | AE236: 80.75 | AF236: 80.89 | AG236: 0.87 | AH236: A+ | AI236: 7.7899999999999997e-002 | AJ236: =H236+100*O236 -> 165.30000000000001 | AK236: 169.9 | AL236: 263 | AM236: 89 | AN236: 270 | AO236: -1.7000000000000001e-002 | AP236: 36 | AQ236: 雷迪转债
A237: 288 | B237: 123002 | C237: 国祯转债!! | D237: 300388 | E237: 国祯环保 | F237: 城市公用 | G237: 三废处理 | H237: 124.5 | I237: 3.4500000000000003e-002 | J237: -6.1999999999999998e-003 | K237: 9.75 | L237: 2.8500000000000001e-002 | M237: 109.8 | N237: 8.48 | O237: 8.3000000000000004e-002 | P237: 114.98 | Q237: 转股中 | R237: 3年11天 | S237: 1年11天 | T237: 2.52 | U237: 53 | V237: 0.17199999999999999 | W237: 3.7000000000000005e-002 | X237: 4.2999999999999997e-002 | Y237: 68 | Z237: 1.8 | AA237: -4.1399999999999999e-002 | AB237: -4.7100000000000003e-002 | AC237: -0.14499999999999999 | AD237: -0.14800000000000002 | AE237: 97.46 | AF237: 96.65 | AG237: 0.99 | AH237: AA | AI237: 4.4000000000000004e-002 | AJ237: =H237+100*O237 -> 132.80000000000001 | AK237: 134 | AL237: 129 | AM237: 36.6 | AN237: 70 | AO237: 1.7000000000000001e-002 | AP237: 12 | AQ237: 国祯转债!!
A238: 131 | B238: 128097 | C238: 奥佳转债! | D238: 2614 | E238: 奥佳华 | F238: 机械装备 | G238: 专用设备 | H238: 143.85 | I238: 0. | J238: -1.04e-002 | K238: 14.64 | L238: -1.21e-002 | M238: 115.3 | N238: 10.69 | O238: 5.0000000000000003e-002 | P238: 136.95 | Q238: 转股中 | R238: 5.29年 | S238: 3.29年 | T238: 5.85 | U238: 14 | V238: 1.6e-002 | W238: 6.5000000000000002e-002 | X238: 8.900000000000001e-002 | Y238: 90 | Z238: 2.14 | AA238: -4.1700000000000001e-002 | AB238: -4.6500000000000007e-002 | AC238: -9.11e-002 | AD238: -9.2899999999999996e-002 | AE238: 89.07 | AF238: 91.41 | AG238: 0.86 | AH238: AA | AI238: 4.5899999999999996e-002 | AJ238: =H238+100*O238 -> 148.84999999999999 | AK238: 150.7 | AL238: 238 | AM238: 59.3 | AN238: 224 | AO238: 2.e-002 | AP238: 25 | AQ238: 奥佳转债!
A239: 262 | B239: 128039 | C239: 三力转债! | D239: 2224 | E239: 三 力 士 | F239: 机械装备 | G239: 专用设备 | H239: 127.6 | I239: 6.7799999999999999e-002 | J239: -6.1799999999999994e-002 | K239: 6.27 | L239: 8.0000000000000002e-003 | M239: 109.8 | N239: 5.81 | O239: 0.182 | P239: 107.92 | Q239: 转股中 | R239: 3.57年 | S239: 1.57年 | T239: 2.03 | U239: 443 | V239: 1.75 | W239: 4.4000000000000004e-002 | X239: 4.8000000000000001e-002 | Y239: 46 | Z239: 1.96 | AA239: -4.1900000000000007e-002 | AB239: -4.6699999999999998e-002 | AC239: -0.10300000000000001 | AD239: -0.105 | AE239: 92.02 | AF239: 88.08 | AG239: 0.75 | AH239: AA- | AI239: 6.5000000000000002e-002 | AJ239: =H239+100*O239 -> 145.79999999999998 | AK239: 147.3 | AL239: 223 | AM239: 55.3 | AN239: 208 | AO239: -2.7999999999999997e-002 | AP239: 21 | AQ239: 三力转债!
A240: 296 | B240: 113013 | C240: 国君转债! | D240: 601211 | E240: 国泰君安 | F240: 金融 | G240: 证券行业 | H240: 121.15 | I240: -2.2000000000000002e-002 | J240: 1.34e-002 | K240: 18.05 | L240: -1.8000000000000002e-002 | M240: 108.3 | N240: 19.01 | O240: 0.27600000000000002 | P240: 94.95 | Q240: 转股中 | R240: 2.65年 | S240: 无权 | T240: 69.9 | U240: 173 | V240: 2.e-002 | W240: 4.2999999999999997e-002 | X240: 4.0999999999999995e-002 | Y240: 1608. | Z240: 1.3 | AA240: -4.2099999999999999e-002 | AB240: -4.7699999999999992e-002 | AC240: 无权 | AD240: 无权 | AE240: 无权 | AF240: 98.26 | AG240: 0.48 | AH240: AAA | AI240: 3.8100000000000002e-002 | AJ240: =H240+100*O240 -> 148.75 | AK240: 147.3 | AL240: 224 | AM240: 49.1 | AN240: 177 | AO240: -2.2000000000000002e-002 | AP240: 14 | AQ240: 国君转债!
A241: 144 | B241: 123038 | C241: 联得转债! | D241: 300545 | E241: 联得装备 | F241: 机械装备 | G241: 专用设备 | H241: 148 | I241: 0.152 | J241: -0.161 | K241: 29.21 | L241: -1.1200000000000002e-002 | M241: 119.1 | N241: 25.29 | O241: 0.28100000000000003 | P241: 115.5 | Q241: 转股中 | R241: 5年42天 | S241: 3年42天 | T241: 1.47 | U241: 900 | V241: 4.3700000000000001 | W241: 3.4000000000000002e-002 | X241: 4.0000000000000001e-002 | Y241: 43 | Z241: 5.57 | AA241: -4.2500000000000003e-002 | AB241: -4.8499999999999995e-002 | AC241: -0.10000000000000001 | AD241: -0.10199999999999999 | AE241: 81.88 | AF241: 81.94 | AG241: 0.83 | AH241: A+ | AI241: 7.7899999999999997e-002 | AJ241: =H241+100*O241 -> 176.09999999999999 | AK241: 180.5 | AL241: 270 | AM241: 98.6 | AN241: 279 | AO241: -2.8999999999999998e-002 | AP241: 16 | AQ241: 联得转债!
A242: 141 | B242: 128091 | C242: 新天转债 | D242: 2873 | E242: 新天药业 | F242: 医药 | G242: 中药 | H242: 149.99 | I242: 0.10400000000000001 | J242: -0.10199999999999999 | K242: 18.29 | L242: 2.7000000000000001e-003 | M242: 120 | N242: 16.39 | O242: 0.34399999999999997 | P242: 111.59 | Q242: 转股中 | R242: 5年47天 | S242: 3年47天 | T242: 1.76 | U242: 686 | V242: 2.7200000000000002 | W242: 8.199999999999999e-002 | X242: 9.1999999999999998e-002 | Y242: 21 | Z242: 2.84 | AA242: -4.36e-002 | AB242: -4.9800000000000004e-002 | AC242: -0.10199999999999999 | AD242: -0.10400000000000001 | AE242: 82.42 | AF242: 82.61 | AG242: 0.82 | AH242: A+ | AI242: 7.7899999999999997e-002 | AJ242: =H242+100*O242 -> 184.39000000000001 | AK242: 188.4 | AL242: 279 | AM242: 105.8 | AN242: 280 | AO242: -5.0000000000000001e-003 | AP242: 16 | AQ242: 新天转债
A243: 78 | B243: 123052 | C243: 飞鹿转债 | D243: 300665 | E243: 飞鹿股份 | F243: 化工 | G243: 化工 | H243: 162.2 | I243: 9.2699999999999991e-002 | J243: -9.7699999999999995e-002 | K243: 14.21 | L243: -5.6000000000000008e-003 | M243: 127.3 | N243: 9.9 | O243: 0.13 | P243: 143.54 | Q243: 28天 | R243: 5.56年 | S243: 3.56年 | T243: 1.77 | U243: 1732. | V243: 6.2000000000000002 | W243: 0.10199999999999999 | X243: 0.14699999999999999 | Y243: 17 | Z243: 3.66 | AA243: -4.36e-002 | AB243: -5.1100000000000007e-002 | AC243: -0.107 | AD243: -0.109 | AE243: 79.88 | AF243: 84.8 | AG243: 0.9 | AH243: A+ | AI243: 7.7899999999999997e-002 | AJ243: =H243+100*O243 -> 175.19999999999999 | AK243: 180.9 | AL243: 271 | AM243: 96.1 | AN243: 276 | AO243: 8.0000000000000002e-003 | AP243: 12 | AQ243: 飞鹿转债
A244: 62 | B244: 113590 | C244: 海容转债 | D244: 603187 | E244: 海容冷链 | F244: 机械装备 | G244: 通用设备 | H244: 148.27 | I244: -1.5600000000000001e-002 | J244: -1.8e-003 | K244: 53.77 | L244: -1.8600000000000002e-002 | M244: 115.6 | N244: 36.39 | O244: 3.0000000000000001e-003 | P244: 147.76 | Q244: 52天 | R244: 5.62年 | S244: 3.62年 | T244: 5 | U244: 55 | V244: 7.2999999999999995e-002 | W244: 5.9000000000000004e-002 | X244: 8.6999999999999994e-002 | Y244: 85 | Z244: 5.24 | AA244: -4.41e-002 | AB244: -4.8600000000000004e-002 | AC244: -9.0200000000000002e-002 | AD244: -9.1899999999999996e-002 | AE244: 81.52 | AF244: 80.93 | AG244: 0.94 | AH244: AA- | AI244: 6.6900000000000001e-002 | AJ244: =H244+100*O244 -> 148.57000000000002 | AK244: 148.8 | AL244: 232 | AM244: 67.3 | AN244: 247 | AO244: 5.5999999999999994e-002 | AP244: 5 | AQ244: 海容转债
A245: 51 | B245: 123058 | C245: 欣旺转债 | D245: 300207 | E245: 欣旺达 | F245: 电子 | G245: 电子产品 | H245: 150.6 | I245: -1.2500000000000001e-002 | J245: 7.4999999999999997e-003 | K245: 29.64 | L245: -5.6999999999999993e-003 | M245: 116.3 | N245: 21.24 | O245: 7.9000000000000001e-002 | P245: 139.55 | Q245: 2月8天 | R245: 5.67年 | S245: 3.67年 | T245: 11.2 | U245: 19 | V245: 1.1000000000000001e-002 | W245: 2.4e-002 | X245: 3.3000000000000002e-002 | Y245: 467 | Z245: 7.37 | AA245: -4.53e-002 | AB245: -5.0000000000000003e-002 | AC245: -9.3299999999999994e-002 | AD245: -9.4899999999999998e-002 | AE245: 87.55 | AF245: 90.63 | AG245: 0.87 | AH245: AA | AI245: 4.5899999999999996e-002 | AJ245: =H245+100*O245 -> 158.5 | AK245: 161.7 | AL245: 251 | AM245: 71 | AN245: 252 | AO245: 3.4000000000000002e-002 | AP245: 6 | AQ245: 欣旺转债
A246: 83 | B246: 113583 | C246: 益丰转债 | D246: 603939 | E246: 益丰药房 | F246: 医药 | G246: 医药商业 | H246: 149.96 | I246: 1.24e-002 | J246: 3.4999999999999996e-003 | K246: 108.36 | L246: 1.7399999999999999e-002 | M246: 115.3 | N246: 71.82 | O246: -6.0000000000000001e-003 | P246: 150.88 | Q246: 24天 | R246: 5.55年 | S246: 3.55年 | T246: 15.8 | U246: 44 | V246: 1.9e-002 | W246: 2.7000000000000003e-002 | X246: 4.0999999999999995e-002 | Y246: 575 | Z246: 11.44 | AA246: -4.7100000000000003e-002 | AB246: -5.16e-002 | AC246: -9.5100000000000004e-002 | AD246: -9.6699999999999994e-002 | AE246: 88.01 | AF246: 90.33 | AG246: 0.91 | AH246: AA | AI246: 4.5899999999999996e-002 | AJ246: =H246+100*O246 -> 149.36000000000001 | AK246: 149 | AL246: 233 | AM246: 58.7 | AN246: 220 | AO246: 9.6000000000000002e-002 | AP246: 8 | AQ246: 益丰转债
A247: 75 | B247: 113585 | C247: 寿仙转债 | D247: 603896 | E247: 寿仙谷 | F247: 医药 | G247: 中药 | H247: 153.3 | I247: -6.5000000000000006e-003 | J247: -1.9099999999999999e-002 | K247: 46.01 | L247: -2.7099999999999999e-002 | M247: 117.8 | N247: 28.68 | O247: -4.4000000000000004e-002 | P247: 160.43 | Q247: 32天 | R247: 5.57年 | S247: 3.57年 | T247: 3.6 | U247: 37 | V247: 6.7000000000000004e-002 | W247: 5.5e-002 | X247: 8.6999999999999994e-002 | Y247: 66 | Z247: 5.36 | AA247: -4.7100000000000003e-002 | AB247: -5.2199999999999996e-002 | AC247: -9.9299999999999999e-002 | AD247: -0.10099999999999999 | AE247: 82 | AF247: 82.8 | AG247: 0.95 | AH247: AA- | AI247: 6.6900000000000001e-002 | AJ247: =H247+100*O247 -> 148.90000000000001 | AK247: 146.2 | AL247: 217 | AM247: 63.4 | AN247: 241 | AO247: 6.5000000000000002e-002 | AP247: 9 | AQ247: 寿仙转债
A248: 36 | B248: 123062 | C248: 三超转债 | D248: 300554 | E248: 三超新材 | F248: 机械装备 | G248: 通用设备 | H248: 157 | I248: 6.480000000000001e-002 | J248: -0.12 | K248: 25.06 | L248: -5.9000000000000004e-002 | M248: 119.7 | N248: 17.17 | O248: 7.5999999999999998e-002 | P248: 145.95 | Q248: 2月20天 | R248: 5.70年 | S248: 3.70年 | T248: 1.95 | U248: 1362. | V248: 4.5599999999999996 | W248: 8.3000000000000004e-002 | X248: 0.121 | Y248: 23 | Z248: 4.49 | AA248: -4.7400000000000005e-002 | AB248: -5.2900000000000003e-002 | AC248: -0.10099999999999999 | AD248: -0.10199999999999999 | AE248: 75.81 | AF248: 74.9 | AG248: 0.94 | AH248: A | AI248: 8.7899999999999992e-002 | AJ248: =H248+100*O248 -> 164.59999999999999 | AK248: 168 | AL248: 258 | AM248: 92.2 | AN248: 275 | AO248: -2.e-003 | AP248: 12 | AQ248: 三超转债
A249: 139 | B249: 113562 | C249: 璞泰转债!! | D249: 603659 | E249: 璞泰来 | F249: 电子 | G249: 元器件制 | H249: 138.22 | I249: 3.2300000000000002e-002 | J249: 0. | K249: 114.9 | L249: 3.2300000000000002e-002 | M249: 113.3 | N249: 82.73 | O249: -5.0000000000000001e-003 | P249: 138.89 | Q249: 转股中 | R249: 4年50天 | S249: 2年50天 | T249: 6.04 | U249: 155 | V249: 0.185 | W249: 1.2e-002 | X249: 1.7000000000000001e-002 | Y249: 503 | Z249: 13.72 | AA249: -4.7500000000000001e-002 | AB249: -5.2900000000000003e-002 | AC249: -0.12300000000000001 | AD249: -0.125 | AE249: 92.47 | AF249: 95.04 | AG249: 1 | AH249: AA | AI249: 4.4000000000000004e-002 | AJ249: =H249+100*O249 -> 137.72 | AK249: 137.6 | AL249: 155 | AM249: 42.5 | AN249: 134 | AO249: 6.0999999999999999e-002 | AP249: 16 | AQ249: 璞泰转债!!
A250: 268 | B250: 127005 | C250: 长证转债! | D250: 783 | E250: 长江证券 | F250: 金融 | G250: 证券行业 | H250: 128.2 | I250: -1.3000000000000001e-002 | J250: -4.6999999999999993e-003 | K250: 8.37 | L250: -2.4500000000000001e-002 | M250: 109.3 | N250: 7.28 | O250: 0.115 | P250: 114.97 | Q250: 转股中 | R250: 3.33年 | S250: 无权 | T250: 50 | U250: 60 | V250: 9.0000000000000011e-003 | W250: 0.10800000000000001 | X250: 0.124 | Y250: 463 | Z250: 1.65 | AA250: -4.7699999999999992e-002 | AB250: -5.2499999999999998e-002 | AC250: 无权 | AD250: 无权 | AE250: 无权 | AF250: 96.5 | AG250: 0.72 | AH250: AAA | AI250: 3.9e-002 | AJ250: =H250+100*O250 -> 139.69999999999999 | AK250: 141.4 | AL250: 190 | AM250: 44.9 | AN250: 148 | AO250: 3.2000000000000001e-002 | AP250: 15 | AQ250: 长证转债!
A251: 54 | B251: 113592 | C251: 安20转债 | D251: 603345 | E251: 安井食品 | F251: 食品饮料 | G251: 食品饮料 | H251: 149.53 | I251: 6.1999999999999998e-003 | J251: -7.4000000000000003e-003 | K251: 172.17 | L251: -1.2999999999999999e-003 | M251: 113.1 | N251: 115.9 | O251: 6.9999999999999993e-003 | P251: 148.55 | Q251: 2月2天 | R251: 5.65年 | S251: 3.65年 | T251: 9 | U251: 32 | V251: 2.4e-002 | W251: 2.2000000000000002e-002 | X251: 3.3000000000000002e-002 | Y251: 407 | Z251: 12.69 | AA251: -4.9000000000000002e-002 | AB251: -5.28e-002 | AC251: -9.2300000000000007e-002 | AD251: -9.3900000000000011e-002 | AE251: 87.42 | AF251: 88.18 | AG251: 0.91 | AH251: AA | AI251: 4.5899999999999996e-002 | AJ251: =H251+100*O251 -> 150.22999999999999 | AK251: 150.5 | AL251: 236 | AM251: 62.3 | AN251: 239 | AO251: -1.4999999999999999e-002 | AP251: 6 | AQ251: 安20转债
A252: 189 | B252: 128070 | C252: 智能转债! | D252: 2877 | E252: 智能自控 | F252: 机械装备 | G252: 通用设备 | H252: 148.191 | I252: 9.1899999999999996e-002 | J252: -9.1300000000000006e-002 | K252: 7.73 | L252: 1.2999999999999999e-003 | M252: 117.6 | N252: 9.51 | O252: 0.82299999999999995 | P252: 81.28 | Q252: 转股中 | R252: 4.63年 | S252: 无权 | T252: 2.3 | U252: 4103. | V252: 11.91 | W252: 8.900000000000001e-002 | X252: 7.2999999999999995e-002 | Y252: 26 | Z252: 3.6 | AA252: -4.9699999999999994e-002 | AB252: -5.5800000000000002e-002 | AC252: 无权 | AD252: 无权 | AE252: 无权 | AF252: 84.43 | AG252: 0.48 | AH252: A+ | AI252: 7.5999999999999998e-002 | AJ252: =H252+100*O252 -> 230.49099999999999 | AK252: 215.1 | AL252: 288 | AM252: 130.7 | AN252: 289 | AO252: -1.3999999999999999e-002 | AP252: 32 | AQ252: 智能转债!
A253: 305 | B253: 113009 | C253: 广汽转债!! | D253: 601238 | E253: 广汽集团 | F253: 汽车 | G253: 乘用车 | H253: 114.2 | I253: 2.3999999999999998e-003 | J253: -1.6000000000000001e-003 | K253: 12.55 | L253: 4.0000000000000001e-003 | M253: 107.5 | N253: 14.23 | O253: 0.29499999999999998 | P253: 88.19 | Q253: 转股中 | R253: 1.19年 | S253: 回售中 | T253: 25.5 | U253: 20 | V253: 6.9999999999999993e-003 | W253: 2.e-002 | X253: 1.7000000000000001e-002 | Y253: 1285. | Z253: 1.55 | AA253: -5.0000000000000003e-002 | AB253: -6.1200000000000004e-002 | AC253: 回售中 | AD253: 回售中 | AE253: 100.25 | AF253: 102.87 | AG253: 0.18 | AH253: AAA | AI253: 3.8100000000000002e-002 | AJ253: =H253+100*O253 -> 143.69999999999999 | AK253: 140.2 | AL253: 175 | AM253: 37.3 | AN253: 78 | AO253: 1.4999999999999999e-002 | AP253: 15 | AQ253: 广汽转债!!
A254: 309 | B254: 113008 | C254: 电气转债! | D254: 601727 | E254: 上海电气 | F254: 能源电力 | G254: 电力设备 | H254: 107.85 | I254: -4.6999999999999993e-003 | J254: 4.1999999999999997e-003 | K254: 5.14 | L254: -1.9e-003 | M254: 106.6 | N254: 5.13 | O254: 7.5999999999999998e-002 | P254: 100.19 | Q254: 转股中 | R254: 0.22年 | S254: 回售中 | T254: 44.1 | U254: 44 | V254: 9.0000000000000011e-003 | W254: 5.7000000000000002e-002 | X254: 5.7000000000000002e-002 | Y254: 779 | Z254: 1.2 | AA254: -5.1200000000000002e-002 | AB254: -0.10300000000000001 | AC254: 回售中 | AD254: 回售中 | AE254: 103 | AF254: 105.77 | AG254: 0.24 | AH254: AAA | AI254: 3.5900000000000001e-002 | AJ254: =H254+100*O254 -> 115.44999999999999 | AK254: 115.5 | AL254: 4 | AM254: 9.7 | AN254: 2 | AO254: 5.0000000000000001e-003 | AP254: 30 | AQ254: 电气转债!
A255: 301 | B255: 113011 | C255: 光大转债 | D255: 601818 | E255: 光大银行 | F255: 金融 | G255: 银行行业 | H255: 122.28 | I255: -2.3900000000000001e-002 | J255: 1.1999999999999999e-003 | K255: 4 | L255: -3.61e-002 | M255: 108.3 | N255: 3.76 | O255: 0.14899999999999999 | P255: 106.38 | Q255: 转股中 | R255: 2.34年 | S255: 无权 | T255: 242 | U255: 537 | V255: 1.8000000000000002e-002 | W255: 0.115 | X255: 0.12300000000000001 | Y255: 2100. | Z255: 0.64 | AA255: -5.1500000000000004e-002 | AB255: -5.7599999999999998e-002 | AC255: 无权 | AD255: 无权 | AE255: 无权 | AF255: 99.4 | AG255: 0.63 | AH255: AAA | AI255: 3.8100000000000002e-002 | AJ255: =H255+100*O255 -> 137.18000000000001 | AK255: 138.2 | AL255: 161 | AM255: 38.8 | AN255: 93 | AO255: -1.e-002 | AP255: 15 | AQ255: 光大转债
A256: 29 | B256: 113038 | C256: 隆20转债 | D256: 601012 | E256: 隆基股份 | F256: 能源电力 | G256: 太阳能 | H256: 150.52 | I256: -2.7200000000000002e-002 | J256: -1.3899999999999999e-002 | K256: 66.56 | L256: -4.9800000000000004e-002 | M256: 111.8 | N256: 52.59 | O256: 0.18899999999999997 | P256: 126.56 | Q256: 2月25天 | R256: 5.71年 | S256: 3.71年 | T256: 50 | U256: 199 | V256: 2.6000000000000002e-002 | W256: 2.e-002 | X256: 2.5000000000000001e-002 | Y256: 2511. | Z256: 7.74 | AA256: -5.1500000000000004e-002 | AB256: -5.4900000000000004e-002 | AC256: -9.3000000000000013e-002 | AD256: -9.4399999999999998e-002 | AE256: 88.52 | AF256: 89.26 | AG256: 0.82 | AH256: AAA | AI256: 4.0899999999999999e-002 | AJ256: =H256+100*O256 -> 169.42000000000002 | AK256: 174.5 | AL256: 266 | AM256: 85.2 | AN256: 266 | AO256: -7.9000000000000001e-002 | AP256: 11 | AQ256: 隆20转债
A257: 111 | B257: 123046 | C257: 天铁转债! | D257: 300587 | E257: 天铁股份 | F257: 铁路 | G257: 铁路设备 | H257: 157.22 | I257: 4.1900000000000007e-002 | J257: -6.2400000000000004e-002 | K257: 14.95 | L257: -2.2200000000000001e-002 | M257: 118.2 | N257: 10.12 | O257: 6.4000000000000001e-002 | P257: 147.73 | Q257: 转股中 | R257: 5.35年 | S257: 3.35年 | T257: 1.17 | U257: 108 | V257: 0.59399999999999997 | W257: 2.4e-002 | X257: 3.5000000000000003e-002 | Y257: 49 | Z257: 3.67 | AA257: -5.2999999999999999e-002 | AB257: -5.8400000000000001e-002 | AC257: -0.109 | AD257: -0.111 | AE257: 83.17 | AF257: 84.3 | AG257: 0.92 | AH257: AA- | AI257: 6.6900000000000001e-002 | AJ257: =H257+100*O257 -> 163.62 | AK257: 166.7 | AL257: 257 | AM257: 82.4 | AN257: 263 | AO257: -6.0999999999999999e-002 | AP257: 10 | AQ257: 天铁转债!
A258: 173 | B258: 128079 | C258: 英联转债! | D258: 2846 | E258: 英联股份 | F258: 造纸包装 | G258: 包装材料 | H258: 155 | I258: 0.183 | J258: -0.17899999999999999 | K258: 15.2 | L258: 4.5999999999999999e-003 | M258: 117.5 | N258: 13.41 | O258: 0.36700000000000005 | P258: 113.35 | Q258: 转股中 | R258: 4.94年 | S258: 2.94年 | T258: 1.53 | U258: 1300. | V258: 5.8899999999999997 | W258: 5.0999999999999997e-002 | X258: 5.7000000000000002e-002 | Y258: 30 | Z258: 3.95 | AA258: -5.5500000000000001e-002 | AB258: -6.1200000000000004e-002 | AC258: -0.12 | AD258: -0.122 | AE258: 82.76 | AF258: 82.44 | AG258: 0.99 | AH258: A+ | AI258: 7.5999999999999998e-002 | AJ258: =H258+100*O258 -> 191.69999999999999 | AK258: 196.7 | AL258: 281 | AM258: 113.9 | AN258: 283 | AO258: 2.9999999999999999e-002 | AP258: 18 | AQ258: 英联转债!
A259: 221 | B259: 128058 | C259: 拓邦转债! | D259: 2139 | E259: 拓邦股份 | F259: 电子 | G259: 电子产品 | H259: 156.3 | I259: 3.1e-002 | J259: 5.1000000000000004e-003 | K259: 8.61 | L259: 3.61e-002 | M259: 122.6 | N259: 5.47 | O259: -6.9999999999999993e-003 | P259: 157.4 | Q259: 转股中 | R259: 4.31年 | S259: 2.31年 | T259: 0.76 | U259: 68 | V259: 0.57600000000000007 | W259: 8.0000000000000002e-003 | X259: 1.2e-002 | Y259: 96 | Z259: 3.3 | AA259: -5.5999999999999994e-002 | AB259: -6.4100000000000004e-002 | AC259: -0.11 | AD259: -0.11199999999999999 | AE259: 94.07 | AF259: 102.32 | AG259: 1 | AH259: AA | AI259: 4.4000000000000004e-002 | AJ259: =H259+100*O259 -> 155.60000000000002 | AK259: 155.2 | AL259: 247 | AM259: 52.9 | AN259: 194 | AO259: -1.e-003 | AP259: 20 | AQ259: 拓邦转债!
A260: 240 | B260: 123017 | C260: 寒锐转债!! | D260: 300618 | E260: 寒锐钴业 | F260: 有色金属 | G260: 小金属 | H260: 139.4 | I260: 5.7999999999999996e-003 | J260: 3.7200000000000004e-002 | K260: 74.12 | L260: 4.8099999999999997e-002 | M260: 110.8 | N260: 57.4 | O260: 8.0000000000000002e-002 | P260: 129.13 | Q260: 转股中 | R260: 4年7天 | S260: 2年7天 | T260: 4.03 | U260: 702 | V260: 1.1899999999999999 | W260: 1.8000000000000002e-002 | X260: 2.3e-002 | Y260: 225 | Z260: 6.12 | AA260: -5.6600000000000004e-002 | AB260: -6.1100000000000002e-002 | AC260: -0.10099999999999999 | AD260: -0.10300000000000001 | AE260: 90.16 | AF260: 86.53 | AG260: 0.9 | AH260: AA- | AI260: 6.5000000000000002e-002 | AJ260: =H260+100*O260 -> 147.40000000000001 | AK260: 149.7 | AL260: 234 | AM260: 59.5 | AN260: 226 | AO260: 8.5999999999999993e-002 | AP260: 14 | AQ260: 寒锐转债!!
A261: 162 | B261: 113550 | C261: 常汽转债! | D261: 603035 | E261: 常熟汽饰 | F261: 汽车 | G261: 零部件制 | H261: 164.99 | I261: 2.0000000000000001e-004 | J261: -3.8e-003 | K261: 15.93 | L261: -3.8e-003 | M261: 121.8 | N261: 9.65 | O261: -1.e-003 | P261: 165.08 | Q261: 转股中 | R261: 5年5.1天 | S261: 3年5.1天 | T261: 4.32 | U261: 106 | V261: 0.14599999999999999 | W261: 8.0000000000000002e-002 | X261: 0.13200000000000001 | Y261: 54 | Z261: 1.6 | AA261: -6.0100000000000001e-002 | AB261: -6.6699999999999995e-002 | AC261: -0.13200000000000001 | AD261: -0.13400000000000001 | AE261: 85.51 | AF261: 88.81 | AG261: 0.94 | AH261: AA- | AI261: 6.6900000000000001e-002 | AJ261: =H261+100*O261 -> 164.89000000000001 | AK261: 164.9 | AL261: 254 | AM261: 76.1 | AN261: 258 | AO261: 2.4e-002 | AP261: 15 | AQ261: 常汽转债!
A262: 270 | B262: 113504 | C262: 艾华转债!! | D262: 603989 | E262: 艾华集团 | F262: 电子 | G262: 元器件制 | H262: 135 | I262: 1.46e-002 | J262: -1.1999999999999999e-003 | K262: 27.63 | L262: 1.54e-002 | M262: 110.3 | N262: 21.13 | O262: 3.2000000000000001e-002 | P262: 130.76 | Q262: 转股中 | R262: 3.30年 | S262: 1.30年 | T262: 5.61 | U262: 3.6 | V262: 5.0000000000000001e-003 | W262: 5.0999999999999997e-002 | X262: 6.7000000000000004e-002 | Y262: 109 | Z262: 4.54 | AA262: -6.0599999999999994e-002 | AB262: -6.5799999999999997e-002 | AC262: -0.155 | AD262: -0.157 | AE262: 96.57 | AF262: 95.99 | AG262: 0.87 | AH262: AA | AI262: 4.4000000000000004e-002 | AJ262: =H262+100*O262 -> 138.19999999999999 | AK262: 139.2 | AL262: 165 | AM262: 42.7 | AN262: 136 | AO262: 4.2999999999999997e-002 | AP262: 9 | AQ262: 艾华转债!!
A263: 108 | B263: 128103 | C263: 同德转债 | D263: 2360 | E263: 同德化工 | F263: 化工 | G263: 化工 | H263: 169.94 | I263: 0.13400000000000001 | J263: -6.3399999999999998e-002 | K263: 6.56 | L263: 8.0700000000000008e-002 | M263: 121.8 | N263: 5.18 | O263: 0.34200000000000003 | P263: 126.64 | Q263: 转股中 | R263: 5.36年 | S263: 3.36年 | T263: 1.44 | U263: 4768. | V263: 18.920000000000002 | W263: 5.5999999999999994e-002 | X263: 7.0999999999999994e-002 | Y263: 26 | Z263: 2.14 | AA263: -6.1399999999999996e-002 | AB263: -6.7699999999999996e-002 | AC263: -0.125 | AD263: -0.127 | AE263: 80.62 | AF263: 82.27 | AG263: 0.87 | AH263: A+ | AI263: 7.7899999999999997e-002 | AJ263: =H263+100*O263 -> 204.13999999999999 | AK263: 213.2 | AL263: 287 | AM263: 131 | AN263: 290 | AO263: 7.4999999999999997e-002 | AP263: 11 | AQ263: 同德转债
A264: 177 | B264: 123032 | C264: 万里转债!! | D264: 300591 | E264: 万里马 | F264: 服装纺织 | G264: 服装纺织 | H264: 178.99 | I264: 0.252 | J264: -0.26300000000000001 | K264: 9 | L264: -1.1000000000000001e-002 | M264: 132 | N264: 6.89 | O264: 0.37 | P264: 130.62 | Q264: 转股中 | R264: 4.91年 | S264: 2.91年 | T264: 0.62 | U264: 2505. | V264: 23.190000000000001 | W264: 2.1000000000000001e-002 | X264: 2.7000000000000003e-002 | Y264: 30 | Z264: 5.93 | AA264: -6.2e-002 | AB264: -7.1300000000000002e-002 | AC264: -0.152 | AD264: -0.10099999999999999 | AE264: 85.86 | AF264: 93.32 | AG264: 1 | AH264: A+ | AI264: 7.5999999999999998e-002 | AJ264: =H264+100*O264 -> 215.99000000000001 | AK264: 227.4 | AL264: 292 | AM264: 134 | AN264: 291 | AO264: -0.18899999999999997 | AP264: 41 | AQ264: 万里转债!!
A265: 132 | B265: 128095 | C265: 恩捷转债!! | D265: 2812 | E265: 恩捷股份 | F265: 电子 | G265: 元器件制 | H265: 163.4 | I265: 1.32e-002 | J265: -3.5999999999999999e-003 | K265: 107.1 | L265: 1.04e-002 | M265: 115.3 | N265: 65.09 | O265: -6.9999999999999993e-003 | P265: 164.54 | Q265: 转股中 | R265: 5.25年 | S265: 3.25年 | T265: 12.9 | U265: 139 | V265: 6.6000000000000003e-002 | W265: 1.3999999999999999e-002 | X265: 2.3e-002 | Y265: 941 | Z265: 9.53 | AA265: -6.54e-002 | AB265: -7.0099999999999996e-002 | AC265: -0.122 | AD265: -0.124 | AE265: 89.22 | AF265: 91.56 | AG265: 0.93 | AH265: AA | AI265: 4.5899999999999996e-002 | AJ265: =H265+100*O265 -> 162.70000000000002 | AK265: 162.3 | AL265: 252 | AM265: 70.7 | AN265: 251 | AO265: 7.2000000000000008e-002 | AP265: 17 | AQ265: 恩捷转债!!
A266: 195 | B266: 123026 | C266: 中环转债! | D266: 300692 | E266: 中环环保 | F266: 城市公用 | G266: 三废处理 | H266: 141.11 | I266: 0.13800000000000001 | J266: -0.125 | K266: 15.44 | L266: 1.3100000000000001e-002 | M266: 110.6 | N266: 12.25 | O266: 0.12 | P266: 126.04 | Q266: 转股中 | R266: 3.57年 | S266: 1.57年 | T266: 0.59 | U266: 669 | V266: 8.0600000000000005 | W266: 1.7000000000000001e-002 | X266: 2.2000000000000002e-002 | Y266: 34 | Z266: 2.5 | AA266: -6.7099999999999993e-002 | AB266: -7.2000000000000008e-002 | AC266: -0.14300000000000002 | AD266: -0.14499999999999999 | AE266: 92.17 | AF266: 88.72 | AG266: 1 | AH266: AA- | AI266: 6.5000000000000002e-002 | AJ266: =H266+100*O266 -> 153.11000000000001 | AK266: 156.2 | AL266: 248 | AM266: 64 | AN266: 243 | AO266: -6.9000000000000006e-002 | AP266: 28 | AQ266: 中环转债!
A267: 89 | B267: 113580 | C267: 康隆转债 | D267: 603665 | E267: 康隆达 | F267: 服装纺织 | G267: 服装行业 | H267: 180.07 | I267: 2.5899999999999999e-002 | J267: -7.1999999999999998e-003 | K267: 27.53 | L267: 1.9599999999999999e-002 | M267: 121.2 | N267: 15.51 | O267: 1.3999999999999999e-002 | P267: 177.5 | Q267: 转股中 | R267: 5.44年 | S267: 3.44年 | T267: 0.96 | U267: 337 | V267: 1.96 | W267: 2.4e-002 | X267: 4.2000000000000003e-002 | Y267: 41 | Z267: 4.27 | AA267: -7.1399999999999991e-002 | AB267: -7.7399999999999997e-002 | AC267: -0.13699999999999998 | AD267: -0.13800000000000001 | AE267: 82.65 | AF267: 85.88 | AG267: 0.95 | AH267: AA- | AI267: 6.6900000000000001e-002 | AJ267: =H267+100*O267 -> 181.47 | AK267: 182.6 | AL267: 275 | AM267: 96.8 | AN267: 278 | AO267: 3.7000000000000005e-002 | AP267: 9 | AQ267: 康隆转债
A268: 200 | B268: 128065 | C268: 雅化转债!! | D268: 2497 | E268: 雅化集团 | F268: 化工 | G268: 化工 | H268: 153.28 | I268: 3.0800000000000001e-002 | J268: -1.6000000000000001e-003 | K268: 13.84 | L268: 3.1300000000000001e-002 | M268: 110.9 | N268: 8.95 | O268: -9.0000000000000011e-003 | P268: 154.64 | Q268: 转股中 | R268: 4.42年 | S268: 2.42年 | T268: 4.14 | U268: 510 | V268: 0.80900000000000005 | W268: 3.1e-002 | X268: 4.8000000000000001e-002 | Y268: 132 | Z268: 4.57 | AA268: -7.1800000000000003e-002 | AB268: -7.5800000000000006e-002 | AC268: -0.10199999999999999 | AD268: -0.10300000000000001 | AE268: 92.6 | AF268: 92.05 | AG268: 0.93 | AH268: AA | AI268: 4.4000000000000004e-002 | AJ268: =H268+100*O268 -> 152.38 | AK268: 151.9 | AL268: 242 | AM268: 59.3 | AN268: 223 | AO268: 8.900000000000001e-002 | AP268: 22 | AQ268: 雅化转债!!
A269: 230 | B269: 113526 | C269: 联泰转债! | D269: 603797 | E269: 联泰环保 | F269: 城市公用 | G269: 三废处理 | H269: 150.67 | I269: 5.5599999999999997e-002 | J269: -6.1799999999999994e-002 | K269: 8.28 | L269: -7.1999999999999998e-003 | M269: 110.8 | N269: 6.11 | O269: 0.11199999999999999 | P269: 135.52 | Q269: 转股中 | R269: 4.19年 | S269: 2.19年 | T269: 1.93 | U269: 148 | V269: 0.51000000000000001 | W269: 5.2000000000000005e-002 | X269: 7.0000000000000007e-002 | Y269: 37 | Z269: 2.41 | AA269: -7.1900000000000006e-002 | AB269: -7.6100000000000001e-002 | AC269: -0.11199999999999999 | AD269: -0.113 | AE269: 93.83 | AF269: 93.59 | AG269: 0.85 | AH269: AA+ | AI269: 4.2000000000000003e-002 | AJ269: =H269+100*O269 -> 161.86999999999998 | AK269: 165.8 | AL269: 255 | AM269: 72 | AN269: 254 | AO269: -2.6000000000000002e-002 | AP269: 8 | AQ269: 联泰转债!
A270: 241 | B270: 113020 | C270: 桐昆转债!! | D270: 601233 | E270: 桐昆股份 | F270: 服装纺织 | G270: 纺织行业 | H270: 151.57 | I270: 2.9300000000000003e-002 | J270: -9.7999999999999997e-003 | K270: 18.76 | L270: 1.9599999999999999e-002 | M270: 112.8 | N270: 12.28 | O270: -8.0000000000000002e-003 | P270: 152.77 | Q270: 转股中 | R270: 4年6.1天 | S270: 2年6.1天 | T270: 23.3 | U270: 1076. | V270: 0.307 | W270: 6.7000000000000004e-002 | X270: 0.10300000000000001 | Y270: 347 | Z270: 1.76 | AA270: -7.22e-002 | AB270: -7.7399999999999997e-002 | AC270: -0.126 | AD270: -0.127 | AE270: 94.52 | AF270: 95.97 | AG270: 1 | AH270: AA+ | AI270: 4.2000000000000003e-002 | AJ270: =H270+100*O270 -> 150.76999999999998 | AK270: 150.4 | AL270: 235 | AM270: 54.4 | AN270: 204 | AO270: 0.14800000000000002 | AP270: 15 | AQ270: 桐昆转债!!
A271: 112 | B271: 128102 | C271: 海大转债! | D271: 2311 | E271: 海大集团 | F271: 农业 | G271: 畜牧业 | H271: 169.5 | I271: 1.67e-002 | J271: 2.2000000000000001e-003 | K271: 59.1 | L271: 1.9e-002 | M271: 114.1 | N271: 34.74 | O271: -4.0000000000000001e-003 | P271: 170.12 | Q271: 转股中 | R271: 5.35年 | S271: 4.35年 | T271: 12.4 | U271: 245 | V271: 0.11599999999999999 | W271: 1.3000000000000001e-002 | X271: 2.2000000000000002e-002 | Y271: 952 | Z271: 8.21 | AA271: -7.2300000000000003e-002 | AB271: -7.6499999999999999e-002 | AC271: -0.10300000000000001 | AD271: -0.10400000000000001 | AE271: 86.22 | AF271: 91 | AG271: 1 | AH271: AA+ | AI271: 4.3899999999999995e-002 | AJ271: =H271+100*O271 -> 169.09999999999999 | AK271: 168.9 | AL271: 260 | AM271: 77.9 | AN271: 259 | AO271: -2.1000000000000001e-002 | AP271: 12 | AQ271: 海大转债!
A272: 124 | B272: 123043 | C272: 正元转债 | D272: 300645 | E272: 正元智慧 | F272: 计算机及 | G272: 软件开发 | H272: 180.595 | I272: 5.6100000000000004e-002 | J272: -6.54e-002 | K272: 16.73 | L272: -1.18e-002 | M272: 121.4 | N272: 15.41 | O272: 0.66299999999999992 | P272: 108.57 | Q272: 转股中 | R272: 5.31年 | S272: 3.31年 | T272: 1.66 | U272: 3999. | V272: 13.08 | W272: 7.8e-002 | X272: 8.5000000000000006e-002 | Y272: 21 | Z272: 3.45 | AA272: -7.3499999999999996e-002 | AB272: -7.9600000000000004e-002 | AC272: -0.14199999999999999 | AD272: -0.14400000000000002 | AE272: 80.86 | AF272: 82.35 | AG272: 0.79 | AH272: A+ | AI272: 7.7899999999999997e-002 | AJ272: =H272+100*O272 -> 246.89499999999998 | AK272: 252.6 | AL272: 295 | AM272: 170.3 | AN272: 296 | AO272: -8.0000000000000002e-002 | AP272: 17 | AQ272: 正元转债
A273: 194 | B273: 113537 | C273: 文灿转债!! | D273: 603348 | E273: 文灿股份 | F273: 汽车 | G273: 零部件制 | H273: 172.94 | I273: 2.7300000000000001e-002 | J273: 2.3e-003 | K273: 33.52 | L273: 3.1400000000000004e-002 | M273: 121.5 | N273: 19.43 | O273: 2.e-003 | P273: 172.52 | Q273: 转股中 | R273: 4.57年 | S273: 2.57年 | T273: 2.71 | U273: 379 | V273: 0.80000000000000004 | W273: 3.2000000000000001e-002 | X273: 5.5e-002 | Y273: 84 | Z273: 3.44 | AA273: -7.5800000000000006e-002 | AB273: -8.2899999999999988e-002 | AC273: -0.11599999999999999 | AD273: -0.11699999999999999 | AE273: 88.07 | AF273: 91.77 | AG273: 0.94 | AH273: AA- | AI273: 6.5000000000000002e-002 | AJ273: =H273+100*O273 -> 173.13999999999999 | AK273: 173.4 | AL273: 264 | AM273: 81.6 | AN273: 261 | AO273: 0.222 | AP273: 26 | AQ273: 文灿转债!!
A274: 71 | B274: 128112 | C274: 歌尔转2 | D274: 2241 | E274: 歌尔股份 | F274: 电子 | G274: 电子产品 | H274: 177.719 | I274: -4.3899999999999995e-002 | J274: -4.5999999999999999e-003 | K274: 41.47 | L274: -5.0999999999999997e-002 | M274: 114.5 | N274: 23.27 | O274: -3.0000000000000001e-003 | P274: 178.21 | Q274: 35天 | R274: 5.58年 | S274: 3.58年 | T274: 40 | U274: 677 | V274: 9.4e-002 | W274: 2.9999999999999999e-002 | X274: 5.2999999999999999e-002 | Y274: 1346. | Z274: 7.7 | AA274: -7.6700000000000004e-002 | AB274: -8.0799999999999997e-002 | AC274: -0.13100000000000001 | AD274: -0.13200000000000001 | AE274: 87.78 | AF274: 90.42 | AG274: 0.95 | AH274: AA+ | AI274: 4.3899999999999995e-002 | AJ274: =H274+100*O274 -> 177.41899999999998 | AK274: 177.2 | AL274: 268 | AM274: 86.8 | AN274: 268 | AO274: -7.6999999999999999e-002 | AP274: 16 | AQ274: 歌尔转2
A275: 265 | B275: 128036 | C275: 金农转债!! | D275: 2548 | E275: 金新农 | F275: 农业 | G275: 畜牧业 | H275: 143.5 | I275: 4.2099999999999999e-002 | J275: -4.4400000000000002e-002 | K275: 7.82 | L275: -1.26e-002 | M275: 110.3 | N275: 7.39 | O275: 0.35600000000000004 | P275: 105.82 | Q275: 转股中 | R275: 3.32年 | S275: 1.32年 | T275: 1.46 | U275: 370 | V275: 1.79 | W275: 3.3000000000000002e-002 | X275: 3.5000000000000003e-002 | Y275: 44 | Z275: 2.06 | AA275: -7.7600000000000002e-002 | AB275: -8.2699999999999996e-002 | AC275: -0.18100000000000002 | AD275: -0.184 | AE275: 93.71 | AF275: 89.91 | AG275: 0.18 | AH275: AA- | AI275: 6.5000000000000002e-002 | AJ275: =H275+100*O275 -> 179.09999999999999 | AK275: 181.2 | AL275: 273 | AM275: 87.5 | AN275: 269 | AO275: -7.5999999999999998e-002 | AP275: 15 | AQ275: 金农转债!!
A276: 228 | B276: 128053 | C276: 尚荣转债! | D276: 2551 | E276: 尚荣医疗 | F276: 医药 | G276: 医疗器械 | H276: 161.438 | I276: 3.6200000000000003e-002 | J276: -3.1800000000000002e-002 | K276: 6.94 | L276: 4.3e-003 | M276: 114.9 | N276: 4.89 | O276: 0.13800000000000001 | P276: 141.92 | Q276: 转股中 | R276: 4.26年 | S276: 2.26年 | T276: 1.91 | U276: 242 | V276: 0.79299999999999993 | W276: 3.4000000000000002e-002 | X276: 4.8000000000000001e-002 | Y276: 57 | Z276: 1.92 | AA276: -7.8200000000000006e-002 | AB276: -8.3699999999999997e-002 | AC276: -0.124 | AD276: -0.125 | AE276: 93.27 | AF276: 96.04 | AG276: 1 | AH276: AA | AI276: 4.4000000000000004e-002 | AJ276: =H276+100*O276 -> 175.238 | AK276: 181 | AL276: 272 | AM276: 84.9 | AN276: 265 | AO276: -4.2000000000000003e-002 | AP276: 27 | AQ276: 尚荣转债!
A277: 291 | B277: 128019 | C277: 久立转2! | D277: 2318 | E277: 久立特材 | F277: 石油天然 | G277: 石油天然 | H277: 139.11 | I277: -6.3e-003 | J277: -1.1999999999999999e-003 | K277: 10.58 | L277: -8.3999999999999995e-003 | M277: 108.8 | N277: 7.62 | O277: 2.e-003 | P277: 138.85 | Q277: 转股中 | R277: 2.99年 | S277: 0.99年 | T277: 7.42 | U277: 56 | V277: 5.4000000000000006e-002 | W277: 8.3000000000000004e-002 | X277: 0.11599999999999999 | Y277: 89 | Z277: 2.53 | AA277: -7.9899999999999999e-002 | AB277: -8.48e-002 | AC277: -0.23000000000000001 | AD277: -0.23199999999999998 | AE277: 96.74 | AF277: 96.08 | AG277: 0.9 | AH277: AA | AI277: 4.3099999999999999e-002 | AJ277: =H277+100*O277 -> 139.31 | AK277: 139.4 | AL277: 166 | AM277: 42.6 | AN277: 135 | AO277: 5.5e-002 | AP277: 13 | AQ277: 久立转2!
A278: 158 | B278: 123036 | C278: 先导转债! | D278: 300450 | E278: 先导智能 | F278: 机械装备 | G278: 专用设备 | H278: 175.001 | I278: -1.6799999999999999e-002 | J278: -1.e-004 | K278: 68.4 | L278: -1.7000000000000001e-002 | M278: 115.1 | N278: 38.99 | O278: -2.e-003 | P278: 175.43 | Q278: 转股中 | R278: 5年28天 | S278: 3年28天 | T278: 4.76 | U278: 116 | V278: 0.13699999999999998 | W278: 8.0000000000000002e-003 | X278: 1.3999999999999999e-002 | Y278: 603 | Z278: 13.5 | AA278: -8.0500000000000002e-002 | AB278: -8.5099999999999995e-002 | AC278: -0.14599999999999999 | AD278: -0.14800000000000002 | AE278: 89.71 | AF278: 92.07 | AG278: 1 | AH278: AA | AI278: 4.5899999999999996e-002 | AJ278: =H278+100*O278 -> 174.80100000000002 | AK278: 174.6 | AL278: 267 | AM278: 82.5 | AN278: 264 | AO278: 0.11900000000000001 | AP278: 18 | AQ278: 先导转债!
A279: 2 | B279: 123072 | C279: 乐歌转债 | D279: 300729 | E279: 乐歌股份 | F279: 其他 | G279: 家居用品 | H279: 213.333 | I279: -7.2499999999999995e-002 | J279: 5.8600000000000006e-002 | K279: 52.83 | L279: -3.56e-002 | M279: 129.6 | N279: 73.13 | O279: 1.95 | P279: 72.24 | Q279: 5月15天 | R279: 5.94年 | S279: 3.94年 | T279: 1.42 | U279: 6989. | V279: 20.690000000000001 | W279: 1.9e-002 | X279: 1.3999999999999999e-002 | Y279: 73 | Z279: 7.7 | AA279: -8.2400000000000001e-002 | AB279: -8.9399999999999993e-002 | AC279: -0.14699999999999999 | AD279: -0.14899999999999999 | AE279: 78.75 | AF279: 84.11 | AG279: 0.39 | AH279: A+ | AI279: 7.7899999999999997e-002 | AJ279: =H279+100*O279 -> 408.33299999999997 | AK279: 354.4 | AL279: 302 | AM279: 270.3 | AN279: 302 | AO279: -0.20000000000000001 | AP279: 2 | AQ279: 乐歌转债
A280: 217 | B280: 123022 | C280: 长信转债!! | D280: 300088 | E280: 长信科技 | F280: 通信互联 | G280: 通信设备 | H280: 166.013 | I280: 1.04e-002 | J280: -1.1399999999999999e-002 | K280: 10.01 | L280: -1.e-003 | M280: 114.9 | N280: 6.15 | O280: 2.e-002 | P280: 162.76 | Q280: 转股中 | R280: 4.34年 | S280: 2.34年 | T280: 2.98 | U280: 38 | V280: 7.6999999999999999e-002 | W280: 1.2e-002 | X280: 2.e-002 | Y280: 245 | Z280: 3.55 | AA280: -8.2699999999999996e-002 | AB280: -8.8000000000000009e-002 | AC280: -0.124 | AD280: -0.125 | AE280: 92.92 | AF280: 95.68 | AG280: 0.94 | AH280: AA | AI280: 4.4000000000000004e-002 | AJ280: =H280+100*O280 -> 168.01300000000001 | AK280: 169.3 | AL280: 261 | AM280: 73.6 | AN280: 255 | AO280: -1.8000000000000002e-002 | AP280: 12 | AQ280: 长信转债!!
A281: 136 | B281: 123042 | C281: 银河转债! | D281: 300619 | E281: 金银河 | F281: 机械装备 | G281: 专用设备 | H281: 180 | I281: 0.20000000000000001 | J281: -0.11599999999999999 | K281: 29.9 | L281: 9.7699999999999995e-002 | M281: 115.9 | N281: 24.4 | O281: 0.46899999999999997 | P281: 122.54 | Q281: 转股中 | R281: 5.17年 | S281: 3.17年 | T281: 1.67 | U281: 5034. | V281: 16.629999999999999 | W281: 7.4999999999999997e-002 | X281: 9.1999999999999998e-002 | Y281: 22 | Z281: 4.57 | AA281: -8.3199999999999996e-002 | AB281: -8.7899999999999992e-002 | AC281: -0.14800000000000002 | AD281: -0.14999999999999999 | AE281: 81.46 | AF281: 79.43 | AG281: 0.86 | AH281: A+ | AI281: 7.7899999999999997e-002 | AJ281: =H281+100*O281 -> 226.90000000000001 | AK281: 237.5 | AL281: 293 | AM281: 156 | AN281: 293 | AO281: 9.8000000000000004e-002 | AP281: 25 | AQ281: 银河转债!
A282: 86 | B282: 113582 | C282: 火炬转债 | D282: 603678 | E282: 火炬电子 | F282: 电子 | G282: 元器件制 | H282: 185.16 | I282: 3.0200000000000001e-002 | J282: 1.04e-002 | K282: 48.36 | L282: 4.2199999999999994e-002 | M282: 115.3 | N282: 25.33 | O282: -2.9999999999999999e-002 | P282: 190.92 | Q282: 19天 | R282: 5.53年 | S282: 3.53年 | T282: 6 | U282: 97 | V282: 8.8000000000000009e-002 | W282: 2.7000000000000003e-002 | X282: 5.2000000000000005e-002 | Y282: 219 | Z282: 6.31 | AA282: -8.3299999999999999e-002 | AB282: -8.7599999999999997e-002 | AC282: -0.14000000000000001 | AD282: -0.14099999999999999 | AE282: 88.06 | AF282: 90.39 | AG282: 0.96 | AH282: AA | AI282: 4.5899999999999996e-002 | AJ282: =H282+100*O282 -> 182.16 | AK282: 179.4 | AL282: 269 | AM282: 89 | AN282: 271 | AO282: 2.1000000000000001e-002 | AP282: 5 | AQ282: 火炬转债
A283: 254 | B283: 123012 | C283: 万顺转债! | D283: 300057 | E283: 万顺新材 | F283: 造纸包装 | G283: 包装材料 | H283: 153.51 | I283: 8.1099999999999992e-002 | J283: -9.2499999999999999e-002 | K283: 6.67 | L283: -1.3300000000000001e-002 | M283: 110.3 | N283: 5.31 | O283: 0.222 | P283: 125.61 | Q283: 转股中 | R283: 3.68年 | S283: 1.68年 | T283: 1.29 | U283: 839 | V283: 4.3700000000000001 | W283: 2.8999999999999998e-002 | X283: 3.6000000000000004e-002 | Y283: 45 | Z283: 1.32 | AA283: -8.7300000000000003e-002 | AB283: -9.1700000000000004e-002 | AC283: -0.16200000000000001 | AD283: -0.16300000000000001 | AE283: 91.58 | AF283: 87.87 | AG283: 0.86 | AH283: AA- | AI283: 6.5000000000000002e-002 | AJ283: =H283+100*O283 -> 175.70999999999998 | AK283: 181.4 | AL283: 274 | AM283: 89.8 | AN283: 273 | AO283: -5.0999999999999997e-002 | AP283: 18 | AQ283: 万顺转债!
A284: 193 | B284: 123027 | C284: 蓝晓转债! | D284: 300487 | E284: 蓝晓科技 | F284: 化工 | G284: 化工 | H284: 182.5 | I284: 0.11599999999999999 | J284: -8.199999999999999e-002 | K284: 47.35 | L284: 3.5400000000000001e-002 | M284: 119.5 | N284: 29.33 | O284: 0.13 | P284: 161.44 | Q284: 转股中 | R284: 4.58年 | S284: 2.58年 | T284: 1.08 | U284: 1743. | V284: 8.7599999999999998 | W284: 1.1000000000000001e-002 | X284: 1.7000000000000001e-002 | Y284: 102 | Z284: 6.39 | AA284: -9.0200000000000002e-002 | AB284: -9.6600000000000005e-002 | AC284: -0.125 | AD284: -0.127 | AE284: 85.63 | AF284: 86.21 | AG284: 0.94 | AH284: A+ | AI284: 7.5999999999999998e-002 | AJ284: =H284+100*O284 -> 195.5 | AK284: 203.6 | AL284: 284 | AM284: 117.3 | AN284: 286 | AO284: 1.3000000000000001e-002 | AP284: 21 | AQ284: 蓝晓转债!
A285: 182 | B285: 123030 | C285: 九洲转债! | D285: 300040 | E285: 九洲集团 | F285: 能源电力 | G285: 电力设备 | H285: 190 | I285: 0.10300000000000001 | J285: -0.11 | K285: 9.06 | L285: -7.7000000000000002e-003 | M285: 120 | N285: 5.65 | O285: 0.185 | P285: 160.35 | Q285: 转股中 | R285: 4.77年 | S285: 2.77年 | T285: 0.97 | U285: 1574. | V285: 8.6500000000000004 | W285: 2.8999999999999998e-002 | X285: 4.5999999999999999e-002 | Y285: 34 | Z285: 1.58 | AA285: -9.3299999999999994e-002 | AB285: -9.9499999999999991e-002 | AC285: -0.121 | AD285: -0.122 | AE285: 86.2 | AF285: 89.4 | AG285: 1 | AH285: AA- | AI285: 6.5000000000000002e-002 | AJ285: =H285+100*O285 -> 208.5 | AK285: 219.6 | AL285: 289 | AM285: 130.2 | AN285: 288 | AO285: -4.9000000000000002e-002 | AP285: 28 | AQ285: 九洲转债!
A286: 186 | B286: 113543 | C286: 欧派转债! | D286: 603833 | E286: 欧派家居 | F286: 其他 | G286: 家居用品 | H286: 183.85 | I286: 3.4000000000000002e-003 | J286: -5.9999999999999995e-004 | K286: 132.4 | L286: 3.0000000000000001e-003 | M286: 114.9 | N286: 71.69 | O286: -5.0000000000000001e-003 | P286: 184.68 | Q286: 转股中 | R286: 4.76年 | S286: 3.76年 | T286: 7.01 | U286: 53 | V286: 4.0999999999999995e-002 | W286: 9.0000000000000011e-003 | X286: 1.6e-002 | Y286: 790 | Z286: 7.3 | AA286: -9.5600000000000004e-002 | AB286: -0.10000000000000001 | AC286: -0.128 | AD286: -0.13 | AE286: 89.1 | AF286: 93.99 | AG286: 0.96 | AH286: AA | AI286: 4.4000000000000004e-002 | AJ286: =H286+100*O286 -> 183.34999999999999 | AK286: 183 | AL286: 277 | AM286: 89 | AN286: 272 | AO286: 6.9000000000000006e-002 | AP286: 14 | AQ286: 欧派转债!
A287: 76 | B287: 113586 | C287: 上机转债 | D287: 603185 | E287: 上机数控 | F287: 机械装备 | G287: 专用设备 | H287: 211.9 | I287: -3.2199999999999999e-002 | J287: 1.8e-003 | K287: 73.79 | L287: -3.1200000000000002e-002 | M287: 120.8 | N287: 33.3 | O287: -4.4000000000000004e-002 | P287: 221.59 | Q287: 32天 | R287: 5.57年 | S287: 3.57年 | T287: 6.65 | U287: 114 | V287: 8.0000000000000002e-002 | W287: 3.9e-002 | X287: 8.5999999999999993e-002 | Y287: 172 | Z287: 8.53 | AA287: -9.7599999999999992e-002 | AB287: -0.10300000000000001 | AC287: -0.16500000000000001 | AD287: -0.16600000000000001 | AE287: 82 | AF287: 84.89 | AG287: 0.97 | AH287: AA- | AI287: 6.6900000000000001e-002 | AJ287: =H287+100*O287 -> 207.5 | AK287: 202.2 | AL287: 283 | AM287: 117.3 | AN287: 285 | AO287: -9.3000000000000013e-002 | AP287: 7 | AQ287: 上机转债
A288: 65 | B288: 128115 | C288: 巨星转债 | D288: 2444 | E288: 巨星科技 | F288: 机械装备 | G288: 通用设备 | H288: 212 | I288: -1.32e-002 | J288: 7.9000000000000008e-003 | K288: 27.43 | L288: -5.4000000000000003e-003 | M288: 115.3 | N288: 12.28 | O288: -5.0999999999999997e-002 | P288: 223.37 | Q288: 52天 | R288: 5.61年 | S288: 3.61年 | T288: 9.73 | U288: 255 | V288: 0.122 | W288: 3.3000000000000002e-002 | X288: 7.400000000000001e-002 | Y288: 295 | Z288: 3.48 | AA288: -0.10400000000000001 | AB288: -0.10800000000000001 | AC288: -0.159 | AD288: -0.161 | AE288: 90.04 | AF288: 90.08 | AG288: 0.98 | AH288: AA | AI288: 4.5899999999999996e-002 | AJ288: =H288+100*O288 -> 206.90000000000001 | AK288: 200.6 | AL288: 282 | AM288: 110.6 | AN288: 281 | AO288: 8.5999999999999993e-002 | AP288: 4 | AQ288: 巨星转债
A289: 166 | B289: 123034 | C289: 通光转债! | D289: 300265 | E289: 通光线缆 | F289: 通信互联 | G289: 通信设备 | H289: 205.98 | I289: 4.0300000000000002e-002 | J289: -5.9800000000000006e-002 | K289: 12.95 | L289: -2.0400000000000001e-002 | M289: 118 | N289: 7.97 | O289: 0.26800000000000002 | P289: 162.48 | Q289: 转股中 | R289: 4.98年 | S289: 2.98年 | T289: 0.78 | U289: 1053. | V289: 6.5199999999999996 | W289: 1.7000000000000001e-002 | X289: 2.7000000000000003e-002 | Y289: 47 | Z289: 3.76 | AA289: -0.107 | AB289: -0.113 | AC289: -0.12 | AD289: -0.121 | AE289: 82.4 | AF289: 82.54 | AG289: 0.95 | AH289: A+ | AI289: 7.5999999999999998e-002 | AJ289: =H289+100*O289 -> 232.78 | AK289: 249.5 | AL289: 294 | AM289: 166.9 | AN289: 294 | AO289: 2.2000000000000002e-002 | AP289: 25 | AQ289: 通光转债!
A290: 294 | B290: 128017 | C290: 金禾转债!! | D290: 2597 | E290: 金禾实业 | F290: 化工 | G290: 化工 | H290: 155.7 | I290: -2.0799999999999999e-002 | J290: 1.6399999999999998e-002 | K290: 34.44 | L290: -4.5999999999999999e-003 | M290: 108.8 | N290: 22.42 | O290: 1.3999999999999999e-002 | P290: 153.61 | Q290: 转股中 | R290: 2.97年 | S290: 0.97年 | T290: 5.54 | U290: 80 | V290: 9.3000000000000013e-002 | W290: 2.8999999999999998e-002 | X290: 4.4000000000000004e-002 | Y290: 193 | Z290: 4.19 | AA290: -0.115 | AB290: -0.12 | AC290: -0.30299999999999999 | AD290: -0.30399999999999999 | AE290: 96.81 | AF290: 96.15 | AG290: 0.94 | AH290: AA | AI290: 4.3099999999999999e-002 | AJ290: =H290+100*O290 -> 157.09999999999999 | AK290: 157.8 | AL290: 249 | AM290: 61 | AN290: 234 | AO290: 0.10099999999999999 | AP290: 11 | AQ290: 金禾转债!!
A291: 251 | B291: 123014 | C291: 凯发转债! | D291: 300407 | E291: 凯发电气 | F291: 能源电力 | G291: 电力设备 | H291: 150.168 | I291: 6.8099999999999994e-002 | J291: -7.3200000000000001e-002 | K291: 9.2 | L291: -6.5000000000000006e-003 | M291: 108.5 | N291: 8.12 | O291: 0.32500000000000001 | P291: 113.3 | Q291: 转股中 | R291: 2.70年 | S291: 0.70年 | T291: 1.16 | U291: 631 | V291: 3.6699999999999999 | W291: 4.0999999999999995e-002 | X291: 4.7e-002 | Y291: 28 | Z291: 2.08 | AA291: -0.115 | AB291: -0.12 | AC291: -0.38100000000000001 | AD291: -0.38299999999999995 | AE291: 95.09 | AF291: 89.44 | AG291: 0.8 | AH291: A+ | AI291: 7.51e-002 | AJ291: =H291+100*O291 -> 182.66800000000001 | AK291: 187 | AL291: 278 | AM291: 91.9 | AN291: 274 | AO291: -8.199999999999999e-002 | AP291: 16 | AQ291: 凯发转债!
A292: 243 | B292: 113521 | C292: 科森转债!! | D292: 603626 | E292: 科森科技 | F292: 通信互联 | G292: 通信设备 | H292: 192.98 | I292: 3.3599999999999998e-002 | J292: -3.3599999999999998e-002 | K292: 15.3 | L292: 0. | M292: 115.2 | N292: 8.7 | O292: 9.6999999999999989e-002 | P292: 175.86 | Q292: 转股中 | R292: 4年3.1天 | S292: 2年3.1天 | T292: 0.49 | U292: 67 | V292: 0.71700000000000008 | W292: 6.9999999999999993e-003 | X292: 1.2e-002 | Y292: 74 | Z292: 3.4 | AA292: -0.12300000000000001 | AB292: -0.128 | AC292: -0.18600000000000003 | AD292: -0.188 | AE292: 94.4 | AF292: 97.34 | AG292: 1 | AH292: AA | AI292: 4.4000000000000004e-002 | AJ292: =H292+100*O292 -> 202.67999999999998 | AK292: 210.1 | AL292: 286 | AM292: 112.8 | AN292: 282 | AO292: -5.7999999999999996e-002 | AP292: 24 | AQ292: 科森转债!!
A293: 85 | B293: 113035 | C293: 福莱转债 | D293: 601865 | E293: 福莱特 | F293: 能源电力 | G293: 太阳能 | H293: 247.89 | I293: -1.e-004 | J293: 1.83e-002 | K293: 38.58 | L293: 1.8500000000000003e-002 | M293: 120.3 | N293: 13.48 | O293: -0.13400000000000001 | P293: 286.2 | Q293: 20天 | R293: 5.53年 | S293: 3.53年 | T293: 14.5 | U293: 436 | V293: 0.122 | W293: 1.9e-002 | X293: 5.5e-002 | Y293: 754 | Z293: 14.17 | AA293: -0.124 | AB293: -0.129 | AC293: -0.11 | AD293: -0.111 | AE293: 88.06 | AF293: 94.29 | AG293: 0.98 | AH293: AA | AI293: 4.5899999999999996e-002 | AJ293: =H293+100*O293 -> 234.48999999999998 | AK293: 209.6 | AL293: 285 | AM293: 115.3 | AN293: 284 | AO293: 2.5000000000000001e-002 | AP293: 7 | AQ293: 福莱转债
A294: 87 | B294: 113581 | C294: 龙蟠转债 | D294: 603906 | E294: 龙蟠科技 | F294: 化工 | G294: 化工 | H294: 272.32 | I294: 4.0999999999999995e-003 | J294: 4.5999999999999999e-003 | K294: 25.97 | L294: 8.8999999999999999e-003 | M294: 129.6 | N294: 9.48 | O294: -6.0000000000000001e-003 | P294: 273.95 | Q294: 转股中 | R294: 5.44年 | S294: 3.44年 | T294: 0.93 | U294: 184 | V294: 0.72599999999999998 | W294: 1.1000000000000001e-002 | X294: 2.9999999999999999e-002 | Y294: 86 | Z294: 5.36 | AA294: -0.13 | AB294: -0.13800000000000001 | AC294: -0.121 | AD294: -0.122 | AE294: 81.74 | AF294: 87.29 | AG294: 0.97 | AH294: A+ | AI294: 7.7899999999999997e-002 | AJ294: =H294+100*O294 -> 271.71999999999997 | AK294: 270.7 | AL294: 296 | AM294: 183.4 | AN294: 297 | AO294: 6.6000000000000003e-002 | AP294: 14 | AQ294: 龙蟠转债
A295: 279 | B295: 128030 | C295: 天康转债!! | D295: 2100 | E295: 天康生物 | F295: 农业 | G295: 畜牧业 | H295: 178.9 | I295: 1.7100000000000001e-002 | J295: -1.6299999999999999e-002 | K295: 12.77 | L295: 8.0000000000000004e-004 | M295: 112.3 | N295: 7.85 | O295: 0.10000000000000001 | P295: 162.68 | Q295: 转股中 | R295: 3年39天 | S295: 1年39天 | T295: 0.98 | U295: 84 | V295: 0.47999999999999998 | W295: 6.9999999999999993e-003 | X295: 1.2e-002 | Y295: 137 | Z295: 2.3 | AA295: -0.14199999999999999 | AB295: -0.14699999999999999 | AC295: -0.32600000000000001 | AD295: -0.32799999999999996 | AE295: 97.37 | AF295: 98.55 | AG295: 1 | AH295: AA | AI295: 4.4000000000000004e-002 | AJ295: =H295+100*O295 -> 188.90000000000001 | AK295: 195.1 | AL295: 280 | AM295: 96.6 | AN295: 277 | AO295: -9.0999999999999998e-002 | AP295: 11 | AQ295: 天康转债!!
A296: 281 | B296: 128028 | C296: 赣锋转债!! | D296: 2460 | E296: 赣锋锂业 | F296: 有色金属 | G296: 小金属 | H296: 180.18 | I296: 6.8000000000000005e-003 | J296: 7.3000000000000001e-003 | K296: 74.01 | L296: 1.41e-002 | M296: 109.3 | N296: 41.68 | O296: 1.4999999999999999e-002 | P296: 177.57 | Q296: 转股中 | R296: 3年38天 | S296: 1年38天 | T296: 9.06 | U296: 283 | V296: 0.17300000000000001 | W296: 9.0000000000000011e-003 | X296: 1.6e-002 | Y296: 986 | Z296: 10.63 | AA296: -0.151 | AB296: -0.155 | AC296: -0.33299999999999996 | AD296: -0.33399999999999996 | AE296: 96.66 | AF296: 95.86 | AG296: 1 | AH296: AA | AI296: 4.4000000000000004e-002 | AJ296: =H296+100*O296 -> 181.68000000000001 | AK296: 182.8 | AL296: 276 | AM296: 86.1 | AN296: 267 | AO296: 0.14199999999999999 | AP296: 13 | AQ296: 赣锋转债!!
A297: 232 | B297: 123018 | C297: 溢利转债! | D297: 300381 | E297: 溢多利 | F297: 医药 | G297: 原料药 | H297: 223.5 | I297: 2.6200000000000001e-002 | J297: -2.3199999999999998e-002 | K297: 12.52 | L297: 3.2000000000000002e-003 | M297: 114.9 | N297: 8.29 | O297: 0.47999999999999998 | P297: 151.03 | Q297: 转股中 | R297: 4年37天 | S297: 2年37天 | T297: 0.54 | U297: 171 | V297: 1.4099999999999999 | W297: 9.0000000000000011e-003 | X297: 1.3000000000000001e-002 | Y297: 61 | Z297: 2.12 | AA297: -0.152 | AB297: -0.157 | AC297: -0.20499999999999999 | AD297: -0.20600000000000002 | AE297: 89.79 | AF297: 89.27 | AG297: 0.93 | AH297: AA- | AI297: 6.5000000000000002e-002 | AJ297: =H297+100*O297 -> 271.5 | AK297: 296 | AL297: 299 | AM297: 206.2 | AN297: 299 | AO297: -7.0999999999999994e-002 | AP297: 13 | AQ297: 溢利转债!
A298: 180 | B298: 123031 | C298: 晶瑞转债! | D298: 300655 | E298: 晶瑞股份 | F298: 化工 | G298: 化工 | H298: 260.89 | I298: 3.2199999999999999e-002 | J298: -2.29e-002 | K298: 39.2 | L298: 9.4999999999999998e-003 | M298: 115.8 | N298: 18.43 | O298: 0.22699999999999998 | P298: 212.7 | Q298: 转股中 | R298: 4.79年 | S298: 2.79年 | T298: 0.63 | U298: 626 | V298: 3.8500000000000001 | W298: 9.0000000000000011e-003 | X298: 1.8000000000000002e-002 | Y298: 74 | Z298: 5.76 | AA298: -0.158 | AB298: -0.16200000000000001 | AC298: -0.161 | AD298: -0.16200000000000001 | AE298: 83.33 | AF298: 82.06 | AG298: 0.98 | AH298: A+ | AI298: 7.5999999999999998e-002 | AJ298: =H298+100*O298 -> 283.58999999999997 | AK298: 309.1 | AL298: 300 | AM298: 225.8 | AN298: 300 | AO298: 1.e-002 | AP298: 15 | AQ298: 晶瑞转债!
A299: 298 | B299: 127004 | C299: 模塑转债!! | D299: 700 | E299: 模塑科技 | F299: 汽车 | G299: 零部件制 | H299: 176.01 | I299: 4.7699999999999992e-002 | J299: -4.8300000000000003e-002 | K299: 6.05 | L299: -3.3e-003 | M299: 113.3 | N299: 7.46 | O299: 1.1699999999999999 | P299: 81.1 | Q299: 转股中 | R299: 2.55年 | S299: 0.55年 | T299: 1.33 | U299: 611 | V299: 2.6099999999999999 | W299: 2.4e-002 | X299: 1.9e-002 | Y299: 55 | Z299: 2.13 | AA299: -0.161 | AB299: -0.16800000000000001 | AC299: -0.60599999999999998 | AD299: -0.60899999999999999 | AE299: 98.77 | AF299: 101 | AG299: 0.19 | AH299: AA | AI299: 4.3099999999999999e-002 | AJ299: =H299+100*O299 -> 293.00999999999999 | AK299: 270.9 | AL299: 297 | AM299: 169.9 | AN299: 295 | AO299: -1.8000000000000002e-002 | AP299: 37 | AQ299: 模塑转债!!
A300: 263 | B300: 113509 | C300: 新泉转债!! | D300: 603179 | E300: 新泉股份 | F300: 汽车 | G300: 零部件制 | H300: 223.54 | I300: 3.4999999999999996e-003 | J300: 4.3e-003 | K300: 31.7 | L300: 7.9000000000000008e-003 | M300: 110.3 | N300: 14.22 | O300: 3.0000000000000001e-003 | P300: 222.93 | Q300: 转股中 | R300: 3.56年 | S300: 1.56年 | T300: 1.22 | U300: 30 | V300: 0.11 | W300: 1.2e-002 | X300: 2.7000000000000003e-002 | Y300: 100 | Z300: 4.75 | AA300: -0.183 | AB300: -0.187 | AC300: -0.28999999999999998 | AD300: -0.29100000000000004 | AE300: 95.51 | AF300: 94.93 | AG300: 0.98 | AH300: AA | AI300: 4.4000000000000004e-002 | AJ300: =H300+100*O300 -> 223.84 | AK300: 224.2 | AL300: 291 | AM300: 128.6 | AN300: 287 | AO300: -1.1000000000000001e-002 | AP300: 10 | AQ300: 新泉转债!!
A301: 256 | B301: 128041 | C301: 盛路转债!! | D301: 2446 | E301: 盛路通信 | F301: 通信互联 | G301: 通信设备 | H301: 243 | I301: 6.8099999999999994e-002 | J301: -6.5599999999999992e-002 | K301: 7.53 | L301: 2.7000000000000001e-003 | M301: 114.3 | N301: 6.85 | O301: 1.21 | P301: 109.93 | Q301: 转股中 | R301: 3.67年 | S301: 1.67年 | T301: 0.53 | U301: 1296. | V301: 10.109999999999999 | W301: 8.0000000000000002e-003 | X301: 9.0000000000000011e-003 | Y301: 68 | Z301: 2.27 | AA301: -0.188 | AB301: -0.193 | AC301: -0.28600000000000003 | AD301: -0.28699999999999998 | AE301: 95.02 | AF301: 97.86 | AG301: 0.96 | AH301: AA | AI301: 4.4000000000000004e-002 | AJ301: =H301+100*O301 -> 364. | AK301: 376.1 | AL301: 304 | AM301: 278.2 | AN301: 304 | AO301: 1.2e-002 | AP301: 12 | AQ301: 盛路转债!!
A302: 231 | B302: 128052 | C302: 凯龙转债! | D302: 2783 | E302: 凯龙股份 | F302: 化工 | G302: 化工 | H302: 283 | I302: 3.6699999999999997e-002 | J302: -4.1399999999999999e-002 | K302: 12.78 | L302: -4.6999999999999993e-003 | M302: 115 | N302: 6.67 | O302: 0.47700000000000004 | P302: 191.6 | Q302: 转股中 | R302: 4年38天 | S302: 2年38天 | T302: 0.32 | U302: 381 | V302: 4.2300000000000004 | W302: 6.9999999999999993e-003 | X302: 1.3000000000000001e-002 | Y302: 48 | Z302: 2.8 | AA302: -0.20000000000000001 | AB302: -0.20499999999999999 | AC302: -0.24299999999999999 | AD302: -0.24399999999999999 | AE302: 93.98 | AF302: 96.77 | AG302: 1 | AH302: AA | AI302: 4.4000000000000004e-002 | AJ302: =H302+100*O302 -> 330.69999999999999 | AK302: 374.4 | AL302: 303 | AM302: 277.6 | AN302: 303 | AO302: -4.9000000000000002e-002 | AP302: 12 | AQ302: 凯龙转债!
A303: 245 | B303: 113520 | C303: 百合转债! | D303: 603313 | E303: 梦百合 | F303: 其他 | G303: 家居用品 | H303: 279.12 | I303: 2.6099999999999998e-002 | J303: -1.83e-002 | K303: 38.5 | L303: 7.9000000000000008e-003 | M303: 114.5 | N303: 14.28 | O303: 3.5000000000000003e-002 | P303: 269.61 | Q303: 转股中 | R303: 3.99年 | S303: 1.99年 | T303: 0.55 | U303: 351 | V303: 2.2999999999999998 | W303: 4.0000000000000001e-003 | X303: 1.1000000000000001e-002 | Y303: 133 | Z303: 4.77 | AA303: -0.20300000000000001 | AB303: -0.20699999999999999 | AC303: -0.25800000000000001 | AD303: -0.25900000000000001 | AE303: 89.88 | AF303: 89.48 | AG303: 0.98 | AH303: AA- | AI303: 6.5000000000000002e-002 | AJ303: =H303+100*O303 -> 282.62 | AK303: 288.6 | AL303: 298 | AM303: 198.8 | AN303: 298 | AO303: 0.161 | AP303: 12 | AQ303: 百合转债!
A304: 260 | B304: 110044 | C304: 广电转债!! | D304: 600831 | E304: 广电网络 | F304: 传媒娱乐 | G304: 影视娱乐 | H304: 253.65 | I304: 4.2999999999999997e-002 | J304: -3.7000000000000005e-002 | K304: 7.1 | L304: 1.e-002 | M304: 112.3 | N304: 6.9 | O304: 1.47 | P304: 102.9 | Q304: 转股中 | R304: 3.62年 | S304: 1.62年 | T304: 0.71 | U304: 401 | V304: 2.23 | W304: 1.3999999999999999e-002 | X304: 1.3999999999999999e-002 | Y304: 50 | Z304: 1.36 | AA304: -0.20399999999999999 | AB304: -0.20899999999999999 | AC304: -0.30599999999999999 | AD304: -0.307 | AE304: 95.25 | AF304: 96.38 | AG304: 0.6 | AH304: AA | AI304: 4.4000000000000004e-002 | AJ304: =H304+100*O304 -> 400.64999999999998 | AK304: 404.4 | AL304: 305 | AM304: 308 | AN304: 305 | AO304: -2.4e-002 | AP304: 10 | AQ304: 广电转债!!
A305: 280 | B305: 128029 | C305: 太阳转债!! | D305: 2078 | E305: 太阳纸业 | F305: 造纸包装 | G305: 造纸行业 | H305: 174.34 | I305: 3.0999999999999999e-003 | J305: -5.1000000000000004e-003 | K305: 14.95 | L305: -2.e-003 | M305: 107.8 | N305: 8.55 | O305: -3.0000000000000001e-003 | P305: 174.85 | Q305: 转股中 | R305: 2年39天 | S305: 39天 | T305: 10.2 | U305: 107 | V305: 6.0999999999999999e-002 | W305: 2.6000000000000002e-002 | X305: 4.5999999999999999e-002 | Y305: 389 | Z305: 2.53 | AA305: -0.20600000000000002 | AB305: -0.21100000000000002 | AC305: -1.6569999999999998 | AD305: -1.661 | AE305: 99.87 | AF305: 99.13 | AG305: 1 | AH305: AA+ | AI305: 4.1100000000000005e-002 | AJ305: =H305+100*O305 -> 174.03999999999999 | AK305: 173.8 | AL305: 265 | AM305: 74 | AN305: 256 | AO305: 0.10400000000000001 | AP305: 8 | AQ305: 太阳转债!!
A306: 249 | B306: 123015 | C306: 蓝盾转债!! | D306: 300297 | E306: 蓝盾股份 | F306: 计算机及 | G306: 软件开发 | H306: 281.99 | I306: 3.8399999999999997e-002 | J306: -5.3099999999999994e-002 | K306: 6.29 | L306: -1.5600000000000001e-002 | M306: 112.3 | N306: 5.79 | O306: 1.6000000000000001 | P306: 108.64 | Q306: 转股中 | R306: 3.75年 | S306: 1.75年 | T306: 1 | U306: 2214. | V306: 7.7800000000000002 | W306: 1.3000000000000001e-002 | X306: 1.3999999999999999e-002 | Y306: 79 | Z306: 2.04 | AA306: -0.22 | AB306: -0.22500000000000001 | AC306: -0.30099999999999999 | AD306: -0.30199999999999999 | AE306: 91.2 | AF306: 89.09 | AG306: 0.94 | AH306: AA- | AI306: 6.5000000000000002e-002 | AJ306: =H306+100*O306 -> 441.99000000000001 | AK306: 455.3 | AL306: 307 | AM306: 364.1 | AN306: 307 | AO306: -0.124 | AP306: 18 | AQ306: 蓝盾转债!!
A307: 150 | B307: 113555 | C307: 振德转债! | D307: 603301 | E307: 振德医疗 | F307: 医药 | G307: 医疗器械 | H307: 439.1 | I307: -6.4000000000000003e-003 | J307: -2.0000000000000001e-004 | K307: 61.76 | L307: -6.6e-003 | M307: 124.8 | N307: 14.01 | O307: -4.0000000000000001e-003 | P307: 440.83 | Q307: 转股中 | R307: 5年36天 | S307: 3年36天 | T307: 0.95 | U307: 132 | V307: 0.316 | W307: 6.9999999999999993e-003 | X307: 3.1e-002 | Y307: 133 | Z307: 3.73 | AA307: -0.222 | AB307: -0.22800000000000001 | AC307: -0.17899999999999999 | AD307: -0.17899999999999999 | AE307: 85.04 | AF307: 90.48 | AG307: 1 | AH307: AA- | AI307: 6.6900000000000001e-002 | AJ307: =H307+100*O307 -> 438.70000000000005 | AK307: 437.4 | AL307: 306 | AM307: 346.9 | AN307: 306 | AO307: -0.13100000000000001 | AP307: 15 | AQ307: 振德转债!
A308: 242 | B308: 127008 | C308: 特发转债! | D308: 70 | E308: 特发信息 | F308: 通信互联 | G308: 通信设备 | H308: 261 | I308: 5.5000000000000005e-003 | J308: -2.18e-002 | K308: 10.25 | L308: -1.6299999999999999e-002 | M308: 111.1 | N308: 5.54 | O308: 0.41100000000000003 | P308: 185.02 | Q308: 转股中 | R308: 3年3.1天 | S308: 1年3.1天 | T308: 0.59 | U308: 386 | V308: 2.4900000000000002 | W308: 6.9999999999999993e-003 | X308: 1.3000000000000001e-002 | Y308: 84 | Z308: 2.95 | AA308: -0.25 | AB308: -0.254 | AC308: -0.51100000000000001 | AD308: -0.51200000000000001 | AE308: 96.86 | AF308: 97.81 | AG308: 1 | AH308: AA | AI308: 4.4000000000000004e-002 | AJ308: =H308+100*O308 -> 302.10000000000002 | AK308: 337 | AL308: 301 | AM308: 239.2 | AN308: 301 | AO308: 1.3000000000000001e-002 | AP308: 15 | AQ308: 特发转债!
A309: 253 | B309: 123013 | C309: 横河转债! | D309: 300539 | E309: 横河模具 | F309: 机械装备 | G309: 专用设备 | H309: 356 | I309: 2.7400000000000001e-002 | J309: -2.3599999999999999e-002 | K309: 9.52 | L309: 5.3e-003 | M309: 115.2 | N309: 9.13 | O309: 2.4100000000000001 | P309: 104.27 | Q309: 转股中 | R309: 3.70年 | S309: 1.70年 | T309: 0.38 | U309: 933 | V309: 6.8300000000000001 | W309: 1.8000000000000002e-002 | X309: 1.9e-002 | Y309: 21 | Z309: 4.36 | AA309: -0.26600000000000001 | AB309: -0.27100000000000002 | AC309: -0.34700000000000003 | AD309: -0.34799999999999998 | AE309: 90.28 | AF309: 88.41 | AG309: 0.71 | AH309: A+ | AI309: 7.5999999999999998e-002 | AJ309: =H309+100*O309 -> 597. | AK309: 607.7 | AL309: 308 | AM309: 517.5 | AN309: 308 | AO309: -9.3000000000000013e-002 | AP309: 15 | AQ309: 横河转债!
A310: 184 | B310: 123029 | C310: 英科转债! | D310: 300677 | E310: 英科医疗 | F310: 医药 | G310: 医疗器械 | H310: 1124 | I310: -3.4999999999999996e-003 | J310: -1.26e-002 | K310: 114.5 | L310: -1.6299999999999999e-002 | M310: 138.2 | N310: 10.41 | O310: 2.2000000000000002e-002 | P310: 1099.9 | Q310: 转股中 | R310: 4.76年 | S310: 2.76年 | T310: 1.28 | U310: 892 | V310: 0.61099999999999999 | W310: 3.0000000000000001e-003 | X310: 3.7000000000000005e-002 | Y310: 382 | Z310: 4.22 | AA310: -0.36200000000000004 | AB310: -0.36899999999999999 | AC310: -0.25 | AD310: -0.25 | AE310: 89.54 | AF310: 103.48 | AG310: 0.99 | AH310: AA- | AI310: 6.5000000000000002e-002 | AJ310: =H310+100*O310 -> 1126.2 | AK310: 1148.0999999999999 | AL310: 309 | AM310: 1044.5999999999999 | AN310: 309 | AO310: 2.e-003 | AP310: 16 | AQ310: 英科转债!