A1: 序号 | B1: 转债名称 | C1: 转债代码 | D1: 进展/上市日期 | E1: 股票名称 | F1: 股票代码 | G1: 行业 | H1: 子行业 | I1: 转债价格 | J1: 涨跌 | K1: 日内套利 | L1: 股价 | M1: 涨跌 | N1: 转债成交额 | O1: 转债换手率 | P1: 剩余本息 | Q1: 转股价格 | R1: P/B | S1: 转股价值 | T1: 转股溢价率 | U1: 距离转股日 | V1: 剩余年限 | W1: 回售年限 | X1: 余额/市值 | Y1: 余额/股本 | Z1: 转债余额 | AA1: 股票市值 | AB1: 税前收益率 | AC1: 税后收益率 | AD1: 税前回售收益 | AE1: 税后回售收益 | AF1: 回售价值 | AG1: 纯债价值 | AH1: 弹性 | AI1: 信用 | AJ1: 折现率 | AK1: 双低 | AL1: 老式双低 | AM1: 老式排名 | AN1: 新式双低 | AO1: 新式排名 | AP1: MA20乖离 | AQ1: 热门度 | AR1: 转债名称
A2: 201 | B2: 亚药转债! | C2: 128062 | D2: 43579. | E2: 亚太药业 | F2: 2370 | G2: 医药 | H2: 化学制药 | I2: 82.434 | J2: 2.9500000000000002e-002 | K2: -2.9500000000000002e-002 | L2: 4.78 | M2: 1.06e-002 | N2: 1650. | O2: 1.98 | P2: 119.8 | Q2: 16.25 | R2: 6.85 | S2: 29.42 | T2: 1.8 | U2: 转股中 | V2: 4.44年 | W2: 2.44年 | X2: 0.376 | Y2: 0.111 | Z2: 9.64 | AA2: 26 | AB2: 8.9700000000000002e-002 | AC2: 8.1000000000000003e-002 | AD2: 9.1400000000000009e-002 | AE2: 8.8499999999999995e-002 | AF2: 81.74 | AG2: 80.73 | AH2: 0 | AI2: A- | AJ2: 9.5000000000000001e-002 | AK2: =I2+100*T2 -> 262.43399999999997 | AL2: 135.5 | AM2: 141 | AN2: 53.7 | AO2: 206 | AP2: -8.8000000000000009e-002 | AQ2: 85 | AR2: 亚药转债!
A3: 221 | B3: 维格转债! | C3: 113527 | D3: 43515. | E3: 锦泓集团 | F3: 603518 | G3: 服装纺织 | H3: 服装行业 | I3: 93.94 | J3: -1.23e-002 | K3: 6.4000000000000003e-003 | L3: 6.96 | M3: -2.9300000000000003e-002 | N3: 66 | O3: 9.1999999999999998e-002 | P3: 120.2 | Q3: 9.85 | R3: 0.7 | S3: 70.66 | T3: 0.32899999999999996 | U3: 转股中 | V3: 4.25年 | W3: 2.25年 | X3: 0.42499999999999999 | Y3: 0.29999999999999999 | Z3: 7.46 | AA3: 18 | AB3: 6.1100000000000002e-002 | AC3: 5.2199999999999996e-002 | AD3: 4.1500000000000002e-002 | AE3: 3.85e-002 | AF3: 91.51 | AG3: 96.97 | AH3: 0.2 | AI3: AA | AJ3: 5.2999999999999999e-002 | AK3: =I3+100*T3 -> 126.84 | AL3: 117.2 | AM3: 3 | AN3: 20.3 | AO3: 3 | AP3: 2.7999999999999997e-002 | AQ3: 100 | AR3: 维格转债!
A4: 52 | B4: 本钢转债! | C4: 127018 | D4: 44047. | E4: 本钢板材 | F4: 761 | G4: 钢铁 | H4: 炼钢 | I4: 96.37 | J4: -8.9999999999999998e-004 | K4: 4.0000000000000002e-004 | L4: 3.4 | M4: -2.8999999999999998e-003 | N4: 86 | O4: 1.3000000000000001e-002 | P4: 128.6 | Q4: 5.03 | R4: 0.67 | S4: 67.59 | T4: 0.42599999999999999 | U4: 2月12天 | V4: 5.68年 | W4: 3.68年 | X4: 0.51600000000000001 | Y4: 0.34899999999999998 | Z4: 68 | AA4: 132 | AB4: 5.3699999999999998e-002 | AC4: 4.4800000000000006e-002 | AD4: 2.6499999999999999e-002 | AE4: 2.3199999999999998e-002 | AF4: 91.59 | AG4: 103.36 | AH4: 0.17 | AI4: AAA | AJ4: 4.0399999999999998e-002 | AK4: =I4+100*T4 -> 138.97 | AL4: 125.1 | AM4: 27 | AN4: 21.8 | AO4: 6 | AP4: -1.3999999999999999e-002 | AQ4: 29 | AR4: 本钢转债!
A5: 277 | B5: 亚太转债! | C5: 128023 | D5: 43095. | E5: 亚太股份 | F5: 2284 | G5: 汽车 | H5: 零部件制 | I5: 96.89 | J5: -6.8000000000000005e-003 | K5: 6.7000000000000002e-003 | L5: 5.29 | M5: -1.9e-003 | N5: 42 | O5: 4.2999999999999997e-002 | P5: 112.3 | Q5: 10.34 | R5: 1.61 | S5: 51.16 | T5: 0.89400000000000002 | U5: 转股中 | V5: 3年41天 | W5: 1年41天 | X5: 0.25600000000000001 | Y5: 0.13100000000000001 | Z5: 9.99 | AA5: 39 | AB5: 4.9800000000000004e-002 | AC5: 4.1900000000000007e-002 | AD5: 4.7899999999999998e-002 | AE5: 4.3299999999999998e-002 | AF5: 97.47 | AG5: 98.81 | AH5: 0.01 | AI5: AA | AJ5: 4.2999999999999997e-002 | AK5: =I5+100*T5 -> 186.29000000000002 | AL5: 142.6 | AM5: 202 | AN5: 43.8 | AO5: 135 | AP5: 3.1e-002 | AQ5: 64 | AR5: 亚太转债!
A6: 258 | B6: 岩土转债! | C6: 128037 | D6: 43215. | E6: 中化岩土 | F6: 2542 | G6: 建筑 | H6: 建筑工程 | I6: 98.806 | J6: -2.5000000000000001e-003 | K6: 2.3999999999999998e-003 | L6: 3.44 | M6: -2.8999999999999998e-003 | N6: 18 | O6: 2.9999999999999999e-002 | P6: 112.3 | Q6: 7.99 | R6: 1.55 | S6: 43.05 | T6: 1.29 | U6: 转股中 | V6: 3.39年 | W6: 1.39年 | X6: 9.6000000000000002e-002 | Y6: 4.2000000000000003e-002 | Z6: 5.99 | AA6: 62 | AB6: 3.9300000000000002e-002 | AC6: 3.2300000000000002e-002 | AD6: 2.6000000000000002e-002 | AE6: 2.2400000000000003e-002 | AF6: 96.34 | AG6: 97.65 | AH6: 0 | AI6: AA | AJ6: 4.2999999999999997e-002 | AK6: =I6+100*T6 -> 227.80599999999998 | AL6: 154.6 | AM6: 247 | AN6: 56.9 | AO6: 226 | AP6: -2.e-002 | AQ6: 47 | AR6: 岩土转债!
A7: 41 | B7: 国城转债 | C7: 127019 | D7: 44053. | E7: 国城矿业 | F7: 688 | G7: 有色金属 | H7: 锌铅镍锡 | I7: 93.499 | J7: 2.9999999999999997e-004 | K7: -1.1000000000000001e-003 | L7: 11.04 | M7: -9.8999999999999991e-003 | N7: 180 | O7: 0.223 | P7: 115.1 | Q7: 21.07 | R7: 5.74 | S7: 52.4 | T7: 0.78400000000000003 | U7: 2月29天 | V7: 5.72年 | W7: 3.72年 | X7: 6.8000000000000005e-002 | Y7: 3.5000000000000003e-002 | Z7: 8.5 | AA7: 126 | AB7: 3.7699999999999997e-002 | AC7: 3.2599999999999997e-002 | AD7: 2.69e-002 | AE7: 2.5000000000000001e-002 | AF7: 87.29 | AG7: 89.68 | AH7: 0.08 | AI7: AA | AJ7: 4.5400000000000003e-002 | AK7: =I7+100*T7 -> 171.899 | AL7: 134.6 | AM7: 131 | AN7: 44.9 | AO7: 145 | AP7: -0.35899999999999999 | AQ7: 23 | AR7: 国城转债
A8: 204 | B8: 大丰转债! | C8: 113530 | D8: 43573. | E8: 大丰实业 | F8: 603081 | G8: 建筑 | H8: 装饰工程 | I8: 103.96 | J8: -8.6999999999999994e-003 | K8: 8.8999999999999999e-003 | L8: 11.5 | M8: 1.7000000000000001e-003 | N8: 13 | O8: 2.e-002 | P8: 121.6 | Q8: 16.64 | R8: 2.35 | S8: 69.11 | T8: 0.504 | U8: 转股中 | V8: 4.42年 | W8: 2.42年 | X8: 0.13600000000000001 | Y8: 9.4e-002 | Z8: 6.3 | AA8: 46 | AB8: 3.6799999999999999e-002 | AC8: 2.81e-002 | AD8: -1.7000000000000001e-003 | AE8: -4.3e-003 | AF8: 92.93 | AG8: 101.33 | AH8: 0.13 | AI8: AA | AJ8: 4.2999999999999997e-002 | AK8: =I8+100*T8 -> 154.35999999999999 | AL8: 138.8 | AM8: 168 | AN8: 37.5 | AO8: 76 | AP8: -2.7999999999999997e-002 | AQ8: 34 | AR8: 大丰转债!
A9: 199 | B9: 未来转债 | C9: 128063 | D9: 43579. | E9: 德尔未来 | F9: 2631 | G9: 其他 | H9: 家居用品 | I9: 109.795 | J9: -3.7000000000000002e-003 | K9: 3.7000000000000002e-003 | L9: 6.97 | M9: 0. | N9: 19 | O9: 2.7000000000000003e-002 | P9: 128.2 | Q9: 8.61 | R9: 2.65 | S9: 80.95 | T9: 0.35600000000000004 | U9: 转股中 | V9: 4.44年 | W9: 3.44年 | X9: 0.13500000000000001 | Y9: 0.109 | Z9: 6.3 | AA9: 47 | AB9: 3.6600000000000001e-002 | AC9: 2.5699999999999997e-002 | AD9: -2.3999999999999998e-003 | AE9: -6.9999999999999993e-003 | AF9: 87.49 | AG9: 98.11 | AH9: 0.32 | AI9: AA- | AJ9: 6.4000000000000001e-002 | AK9: =I9+100*T9 -> 145.39500000000001 | AL9: 138.6 | AM9: 164 | AN9: 40.5 | AO9: 115 | AP9: -3.6000000000000004e-002 | AQ9: 34 | AR9: 未来转债
A10: 130 | B10: 百川转债! | C10: 128093 | D10: 43851. | E10: 百川股份 | F10: 2455 | G10: 化工 | H10: 化工 | I10: 108.991 | J10: -2.8000000000000004e-003 | K10: -4.0000000000000001e-003 | L10: 4.97 | M10: -1.5800000000000002e-002 | N10: 14 | O10: 2.5000000000000001e-002 | P10: 130.3 | Q10: 5.87 | R10: 2.02 | S10: 84.67 | T10: 0.28699999999999998 | U10: 转股中 | V10: 5.19年 | W10: 3.19年 | X10: 0.20199999999999999 | Y10: 0.17100000000000001 | Z10: 5.2 | AA10: 26 | AB10: 3.6299999999999999e-002 | AC10: 2.63e-002 | AD10: -4.5000000000000005e-003 | AE10: -8.6e-003 | AF10: 86.88 | AG10: 94.43 | AH10: 0.43 | AI10: AA- | AJ10: 6.6400000000000001e-002 | AK10: =I10+100*T10 -> 137.691 | AL10: 133.3 | AM10: 114 | AN10: 38.9 | AO10: 95 | AP10: -2.4e-002 | AQ10: 45 | AR10: 百川转债!
A11: 285 | B11: 小康转债! | C11: 113016 | D11: 43060. | E11: 小康股份 | F11: 601127 | G11: 汽车 | H11: 零部件制 | I11: 99.53 | J11: -4.1999999999999997e-003 | K11: 3.8e-003 | L11: 9.3 | M11: -1.38e-002 | N11: 15 | O11: 1.7000000000000001e-002 | P11: 110.3 | Q11: 15.7 | R11: 1.89 | S11: 59.24 | T11: 0.68000000000000005 | U11: 转股中 | V11: 3年13天 | W11: 1年13天 | X11: 7.4999999999999997e-002 | Y11: 4.4999999999999998e-002 | Z11: 8.81 | AA11: 117 | AB11: 3.5299999999999998e-002 | AC11: 2.86e-002 | AD11: 2.76e-002 | AE11: 2.2799999999999997e-002 | AF11: 97.78 | AG11: 97.37 | AH11: 0.03 | AI11: AA | AJ11: 4.2999999999999997e-002 | AK11: =I11+100*T11 -> 167.53 | AL11: 139.8 | AM11: 177 | AN11: 42 | AO11: 122 | AP11: 3.5000000000000003e-002 | AQ11: 45 | AR11: 小康转债!
A12: 83 | B12: 纵横转债! | C12: 113573 | D12: 43973. | E12: 纵横通信 | F12: 603602 | G12: 通信互联 | H12: 通信设备 | I12: 103.88 | J12: 3.4000000000000002e-003 | K12: -8.199999999999999e-003 | L12: 12.64 | M12: -1.6299999999999999e-002 | N12: 122 | O12: 0.42999999999999999 | P12: 124.7 | Q12: 18.81 | R12: 3.82 | S12: 67.2 | T12: 0.54600000000000004 | U12: 转股中 | V12: 5.48年 | W12: 3.48年 | X12: 0.105 | Y12: 7.0000000000000007e-002 | Z12: 2.7 | AA12: 26 | AB12: 3.4700000000000002e-002 | AC12: 2.6800000000000001e-002 | AD12: 2.e-003 | AE12: -5.0000000000000001e-004 | AF12: 79.99 | AG12: 83.7 | AH12: 0.3 | AI12: A+ | AJ12: 7.7399999999999997e-002 | AK12: =I12+100*T12 -> 158.47999999999999 | AL12: 140.6 | AM12: 185 | AN12: 56.9 | AO12: 225 | AP12: -2.e-002 | AQ12: 14 | AR12: 纵横转债!
A13: 289 | B13: 久其转债! | C13: 128015 | D13: 42934. | E13: 久其软件 | F13: 2279 | G13: 计算机及 | H13: 软件开发 | I13: 101.701 | J13: -2.8999999999999998e-003 | K13: 2.8999999999999998e-003 | L13: 5.95 | M13: -1.49e-002 | N13: 35 | O13: 4.4000000000000004e-002 | P13: 110.8 | Q13: 9.48 | R13: 5.82 | S13: 62.76 | T13: 0.62 | U13: 转股中 | V13: 2.62年 | W13: 0.62年 | X13: 0.184 | Y13: 0.11599999999999999 | Z13: 7.8 | AA13: 42 | AB13: 3.3700000000000001e-002 | AC13: 2.58e-002 | AD13: -1.9e-003 | AE13: -5.7999999999999996e-003 | AF13: 95.96 | AG13: 92.01 | AH13: 0 | AI13: A+ | AJ13: 7.46e-002 | AK13: =I13+100*T13 -> 163.70099999999999 | AL13: 140.6 | AM13: 186 | AN13: 44.7 | AO13: 144 | AP13: -4.2000000000000003e-002 | AQ13: 53 | AR13: 久其转债!
A14: 249 | B14: 海澜转债! | C14: 110045 | D14: 43312. | E14: 海澜之家 | F14: 600398 | G14: 服装纺织 | H14: 服装行业 | I14: 98.77 | J14: -6.8000000000000005e-003 | K14: 5.1999999999999998e-003 | L14: 7.28 | M14: -2.1499999999999998e-002 | N14: 22 | O14: 6.9999999999999993e-003 | P14: 111.1 | Q14: 11.75 | R14: 2.58 | S14: 61.96 | T14: 0.59399999999999997 | U14: 转股中 | V14: 3.72年 | W14: 1.72年 | X14: 9.4e-002 | Y14: 5.7999999999999996e-002 | Z14: 29.5 | AA14: 314 | AB14: 3.2599999999999997e-002 | AC14: 2.69e-002 | AD14: 1.7399999999999999e-002 | AE14: 1.52e-002 | AF14: 94.62 | AG14: 95.88 | AH14: 0.08 | AI14: AA+ | AJ14: 4.0999999999999995e-002 | AK14: =I14+100*T14 -> 158.16999999999999 | AL14: 135.6 | AM14: 144 | AN14: 39.7 | AO14: 109 | AP14: 6.2e-002 | AQ14: 59 | AR14: 海澜转债!
A15: 113 | B15: 科达转债! | C15: 113569 | D15: 43929. | E15: 苏州科达 | F15: 603660 | G15: 通信互联 | H15: 物联网 | I15: 103.34 | J15: -1.5e-003 | K15: -1.9e-003 | L15: 8.95 | M15: -1.8600000000000002e-002 | N15: 18 | O15: 3.3000000000000002e-002 | P15: 120.7 | Q15: 14.84 | R15: 2.64 | S15: 60.31 | T15: 0.71299999999999997 | U15: 转股中 | V15: 5.37年 | W15: 3.37年 | X15: 0.115 | Y15: 7.0000000000000007e-002 | Z15: 5.16 | AA15: 45 | AB15: 2.9999999999999999e-002 | AC15: 2.3099999999999999e-002 | AD15: 1.9e-003 | AE15: -2.9999999999999997e-004 | AF15: 83.09 | AG15: 86.1 | AH15: 0.19 | AI15: AA- | AJ15: 6.6400000000000001e-002 | AK15: =I15+100*T15 -> 174.63999999999999 | AL15: 146.4 | AM15: 220 | AN15: 60.3 | AO15: 236 | AP15: -2.2000000000000002e-002 | AQ15: 22 | AR15: 科达转债!
A16: 16 | B16: 新星转债 | C16: 113600 | D16: 44085. | E16: 深圳新星 | F16: 603978 | G16: 有色金属 | H16: 有色行业 | I16: 106.63 | J16: -1.09e-002 | K16: 8.6999999999999994e-003 | L16: 20.04 | M16: -4.5000000000000005e-003 | N16: 22 | O16: 3.4000000000000002e-002 | P16: 126 | Q16: 23.85 | R16: 2.11 | S16: 84.03 | T16: 0.26899999999999996 | U16: 3月28天 | V16: 5.80年 | W16: 3.80年 | X16: 0.18600000000000003 | Y16: 0.156 | Z16: 5.95 | AA16: 32 | AB16: 2.9700000000000001e-002 | AC16: 2.2099999999999998e-002 | AD16: -6.5000000000000006e-003 | AE16: -8.3999999999999995e-003 | AF16: 80.71 | AG16: 87.38 | AH16: 0.48 | AI16: AA- | AJ16: 6.6400000000000001e-002 | AK16: =I16+100*T16 -> 133.53 | AL16: 129.2 | AM16: 62 | AN16: 41.9 | AO16: 121 | AP16: -3.7999999999999999e-002 | AQ16: 9 | AR16: 新星转债
A17: 50 | B17: 胜达转债! | C17: 113591 | D17: 44035. | E17: 大胜达 | F17: 603687 | G17: 造纸包装 | H17: 包装用纸 | I17: 104.09 | J17: -6.0999999999999995e-003 | K17: 4.1999999999999997e-003 | L17: 11.64 | M17: -4.3e-003 | N17: 14 | O17: 2.5000000000000001e-002 | P17: 122.2 | Q17: 14.73 | R17: 3.11 | S17: 79.02 | T17: 0.317 | U17: 2月16天 | V17: 5.69年 | W17: 3.69年 | X17: 0.115 | Y17: 9.0999999999999998e-002 | Z17: 5.5 | AA17: 48 | AB17: 2.92e-002 | AC17: 2.23e-002 | AD17: 1.e-004 | AE17: -2.e-003 | AF17: 81.51 | AG17: 85.45 | AH17: 0.44 | AI17: AA- | AJ17: 6.6400000000000001e-002 | AK17: =I17+100*T17 -> 135.78999999999999 | AL17: 129.2 | AM17: 61 | AN17: 43.7 | AO17: 133 | AP17: -4.7e-002 | AQ17: 19 | AR17: 胜达转债!
A18: 145 | B18: 鸿达转债 | C18: 128085 | D18: 43838. | E18: 鸿达兴业 | F18: 2002 | G18: 化工 | H18: 化工 | I18: 108.651 | J18: -1.0500000000000001e-002 | K18: 4.0999999999999995e-003 | L18: 3.76 | M18: -1.3100000000000001e-002 | N18: 22 | O18: 8.0000000000000002e-003 | P18: 124.8 | Q18: 3.92 | R18: 1.38 | S18: 95.92 | T18: 0.13300000000000001 | U18: 转股中 | V18: 5年53天 | W18: 3年53天 | X18: 0.249 | Y18: 0.23899999999999999 | Z18: 24.3 | AA18: 97 | AB18: 2.7900000000000001e-002 | AC18: 1.9599999999999999e-002 | AD18: -1.24e-002 | AE18: -1.49e-002 | AF18: 90.2 | AG18: 99.83 | AH18: 0.49 | AI18: AA | AJ18: 4.5400000000000003e-002 | AK18: =I18+100*T18 -> 121.95099999999999 | AL18: 121.4 | AM18: 12 | AN18: 21.6 | AO18: 5 | AP18: -4.9000000000000002e-002 | AQ18: 85 | AR18: 鸿达转债
A19: 3 | B19: 交建转债! | C19: 128132 | D19: 44120. | E19: 新疆交建 | F19: 2941 | G19: 建筑 | H19: 建筑工程 | I19: 100.352 | J19: 1.5e-003 | K19: -1.1000000000000001e-003 | L19: 13.9 | M19: 1.4000000000000002e-003 | N19: 110 | O19: 0.127 | P19: 117.3 | Q19: 18.57 | R19: 3.69 | S19: 74.85 | T19: 0.34100000000000003 | U19: 4月29天 | V19: 5.89年 | W19: 3.89年 | X19: 9.5000000000000001e-002 | Y19: 7.0999999999999994e-002 | Z19: 8.5 | AA19: 90 | AB19: 2.7300000000000001e-002 | AC19: 2.2000000000000002e-002 | AD19: 8.3999999999999995e-003 | AE19: 6.6e-003 | AF19: 86.82 | AG19: 90.73 | AH19: 0.32 | AI19: AA | AJ19: 4.5400000000000003e-002 | AK19: =I19+100*T19 -> 134.452 | AL19: 125.9 | AM19: 36 | AN19: 35.1 | AO19: 53 | AP19: -0.13100000000000001 | AQ19: 4 | AR19: 交建转债!
A20: 87 | B20: 凌钢转债! | C20: 110070 | D20: 43964. | E20: 凌钢股份 | F20: 600231 | G20: 钢铁 | H20: 炼钢 | I20: 102.05 | J20: -2.0999999999999999e-003 | K20: 4.0000000000000002e-004 | L20: 2.18 | M20: -4.5999999999999999e-003 | N20: 7.3 | O20: 1.6e-002 | P20: 117.8 | Q20: 2.75 | R20: 0.78 | S20: 79.27 | T20: 0.28699999999999998 | U20: 转股中 | V20: 5.47年 | W20: 3.47年 | X20: 7.2999999999999995e-002 | Y20: 5.7999999999999996e-002 | Z20: 4.4 | AA20: 60 | AB20: 2.7200000000000002e-002 | AC20: 2.12e-002 | AD20: 5.6000000000000008e-003 | AE20: 3.4000000000000002e-003 | AF20: 88.77 | AG20: 92.89 | AH20: 0.37 | AI20: AA | AJ20: 4.5400000000000003e-002 | AK20: =I20+100*T20 -> 130.75 | AL20: 124.8 | AM20: 24 | AN20: 31.9 | AO20: 30 | AP20: -2.5000000000000001e-002 | AQ20: 14 | AR20: 凌钢转债!
A21: 162 | B21: 浦发转债! | C21: 110059 | D21: 43784. | E21: 浦发银行 | F21: 600000 | G21: 金融 | H21: 银行行业 | I21: 103.43 | J21: 2.8999999999999998e-003 | K21: -2.e-003 | L21: 9.7 | M21: 5.1999999999999998e-003 | N21: 240 | O21: 5.0000000000000001e-003 | P21: 117.8 | Q21: 14.45 | R21: 0.57 | S21: 67.13 | T21: 0.54100000000000004 | U21: 转股中 | V21: 5年4.1天 | W21: 无权 | X21: 0.17600000000000002 | Y21: 0.11800000000000001 | Z21: 500 | AA21: 2847. | AB21: 2.7099999999999999e-002 | AC21: 2.0499999999999997e-002 | AD21: 无权 | AE21: 无权 | AF21: 无权 | AG21: 97.14 | AH21: 0.18 | AI21: AAA | AJ21: 4.0399999999999998e-002 | AK21: =I21+100*T21 -> 157.53 | AL21: 139.7 | AM21: 175 | AN21: 42.6 | AO21: 124 | AP21: 9.0000000000000011e-003 | AQ21: 75 | AR21: 浦发转债!
A22: 189 | B22: 大业转债! | C22: 113535 | D22: 43619. | E22: 大业股份 | F22: 603278 | G22: 汽车 | H22: 零部件制 | I22: 103.07 | J22: -9.7999999999999997e-003 | K22: 9.7999999999999997e-003 | L22: 8.57 | M22: 0. | N22: 18 | O22: 3.5000000000000003e-002 | P22: 113.1 | Q22: 12.4 | R22: 1.52 | S22: 69.11 | T22: 0.49099999999999999 | U22: 转股中 | V22: 3.54年 | W22: 1.54年 | X22: 0.20100000000000001 | Y22: 0.13900000000000001 | Z22: 5 | AA22: 25 | AB22: 2.69e-002 | AC22: 2.e-002 | AD22: -6.9999999999999993e-003 | AE22: -9.1000000000000004e-003 | AF22: 94.82 | AG22: 97.63 | AH22: 0.15 | AI22: AA | AJ22: 4.2999999999999997e-002 | AK22: =I22+100*T22 -> 152.16999999999999 | AL22: 137 | AM22: 151 | AN22: 39.4 | AO22: 102 | AP22: -2.e-003 | AQ22: 49 | AR22: 大业转债!
A23: 140 | B23: 建工转债! | C23: 110064 | D23: 43846. | E23: 重庆建工 | F23: 600939 | G23: 建筑 | H23: 建筑工程 | I23: 105.2 | J23: -5.9999999999999995e-004 | K23: 5.9999999999999995e-004 | L23: 3.89 | M23: 0. | N23: 8.7 | O23: 5.0000000000000001e-003 | P23: 120.2 | Q23: 4.57 | R23: 1.02 | S23: 85.12 | T23: 0.23600000000000002 | U23: 转股中 | V23: 5年57天 | W23: 3年57天 | X23: 0.23499999999999999 | Y23: 0.20000000000000001 | Z23: 16.6 | AA23: 71 | AB23: 2.6800000000000001e-002 | AC23: 1.9799999999999998e-002 | AD23: -1.9e-003 | AE23: -4.5999999999999999e-003 | AF23: 90.93 | AG23: 97.07 | AH23: 0.39 | AI23: AA+ | AJ23: 4.3400000000000001e-002 | AK23: =I23+100*T23 -> 128.80000000000001 | AL23: 125.3 | AM23: 30 | AN23: 28.2 | AO23: 15 | AP23: -2.4e-002 | AQ23: 47 | AR23: 建工转债!
A24: 54 | B24: 天创转债! | C24: 113589 | D24: 44028. | E24: 天创时尚 | F24: 603608 | G24: 服装纺织 | H24: 鞋服行业 | I24: 99.61 | J24: -6.6e-003 | K24: 0. | L24: 8.28 | M24: -2.9300000000000003e-002 | N24: 74 | O24: 0.122 | P24: 115.3 | Q24: 12.44 | R24: 1.63 | S24: 66.56 | T24: 0.49700000000000005 | U24: 2月10天 | V24: 5.67年 | W24: 3.67年 | X24: 0.16800000000000001 | Y24: 0.11199999999999999 | Z24: 6 | AA24: 36 | AB24: 2.6699999999999998e-002 | AC24: 2.1600000000000001e-002 | AD24: 1.09e-002 | AE24: 8.8999999999999999e-003 | AF24: 87.7 | AG24: 90.09 | AH24: 0.22 | AI24: AA | AJ24: 4.5400000000000003e-002 | AK24: =I24+100*T24 -> 149.31 | AL24: 132.7 | AM24: 108 | AN24: 42.6 | AO24: 123 | AP24: -2.1000000000000001e-002 | AQ24: 8 | AR24: 天创转债!
A25: 268 | B25: 吉视转债! | C25: 113017 | D25: 43115. | E25: 吉视传媒 | F25: 601929 | G25: 传媒娱乐 | H25: 影视娱乐 | I25: 101.18 | J25: -2.3e-003 | K25: 1.5e-003 | L25: 2.18 | M25: -4.5999999999999999e-003 | N25: 6.3 | O25: 4.0000000000000001e-003 | P25: 109.8 | Q25: 2.95 | R25: 1.02 | S25: 73.9 | T25: 0.36899999999999999 | U25: 转股中 | V25: 3.18年 | W25: 1.18年 | X25: 0.23000000000000001 | Y25: 0.17000000000000001 | Z25: 15.6 | AA25: 68 | AB25: 2.6600000000000002e-002 | AC25: 2.06e-002 | AD25: 1.0200000000000001e-002 | AE25: 6.4000000000000003e-003 | AF25: 97.22 | AG25: 96.91 | AH25: 0.17 | AI25: AA+ | AJ25: 4.0999999999999995e-002 | AK25: =I25+100*T25 -> 138.08000000000001 | AL25: 128.5 | AM25: 58 | AN25: 31.2 | AO25: 24 | AP25: -1.9e-002 | AQ25: 51 | AR25: 吉视转债!
A26: 23 | B26: 佳力转债! | C26: 113597 | D26: 44064. | E26: 佳力图 | F26: 603912 | G26: 机械装备 | H26: 专用设备 | I26: 107.68 | J26: -1.67e-002 | K26: 2.5999999999999999e-003 | L26: 17.28 | M26: -3.8900000000000004e-002 | N26: 22 | O26: 6.8000000000000005e-002 | P26: 124.5 | Q26: 23.4 | R26: 4.58 | S26: 73.85 | T26: 0.45799999999999996 | U26: 3月14天 | V26: 5.76年 | W26: 3.76年 | X26: 8.0000000000000002e-002 | Y26: 5.9000000000000004e-002 | Z26: 3 | AA26: 37 | AB26: 2.6000000000000002e-002 | AC26: 1.8700000000000001e-002 | AD26: -7.9000000000000008e-003 | AE26: -1.e-002 | AF26: 81.33 | AG26: 86.63 | AH26: 0.36 | AI26: AA- | AJ26: 6.6400000000000001e-002 | AK26: =I26+100*T26 -> 153.48000000000002 | AL26: 141.5 | AM26: 197 | AN26: 54.9 | AO26: 212 | AP26: -1.9e-002 | AQ26: 5 | AR26: 佳力转债!
A27: 240 | B27: 岭南转债! | C27: 128044 | D27: 43347. | E27: 岭南股份 | F27: 2717 | G27: 城市公用 | H27: 生态环境 | I27: 101.43 | J27: -1.7000000000000001e-003 | K27: 2.0999999999999999e-003 | L27: 4.06 | M27: 2.5000000000000001e-003 | N27: 10 | O27: 1.4999999999999999e-002 | P27: 111.3 | Q27: 5.91 | R27: 1.31 | S27: 68.7 | T27: 0.47600000000000003 | U27: 转股中 | V27: 3.81年 | W27: 1.81年 | X27: 0.106 | Y27: 7.2999999999999995e-002 | Z27: 6.59 | AA27: 62 | AB27: 2.52e-002 | AC27: 1.95e-002 | AD27: 6.8999999999999999e-003 | AE27: 4.0999999999999995e-003 | AF27: 94.66 | AG27: 95.1 | AH27: 0.15 | AI27: AA | AJ27: 4.2999999999999997e-002 | AK27: =I27+100*T27 -> 149.03 | AL27: 134.2 | AM27: 126 | AN27: 39.1 | AO27: 96 | AP27: -6.9999999999999993e-003 | AQ27: 30 | AR27: 岭南转债!
A28: 217 | B28: 长城转债! | C28: 113528 | D28: 43544. | E28: 长城科技 | F28: 603897 | G28: 机械装备 | H28: 专用设备 | I28: 105.78 | J28: -1.6000000000000001e-003 | K28: -8.6e-003 | L28: 19.56 | M28: -2.35e-002 | N28: 13 | O28: 1.9e-002 | P28: 117.6 | Q28: 23.45 | R28: 1.9 | S28: 83.41 | T28: 0.26800000000000002 | U28: 转股中 | V28: 4.35年 | W28: 2.35年 | X28: 0.182 | Y28: 0.152 | Z28: 6.34 | AA28: 35 | AB28: 2.52e-002 | AC28: 1.7899999999999999e-002 | AD28: -7.0999999999999995e-003 | AE28: -1.01e-002 | AF28: 89.09 | AG28: 90.38 | AH28: 0.44 | AI28: AA- | AJ28: 6.4000000000000001e-002 | AK28: =I28+100*T28 -> 132.58000000000001 | AL28: 128.1 | AM28: 57 | AN28: 37.8 | AO28: 78 | AP28: 1.2e-002 | AQ28: 44 | AR28: 长城转债!
A29: 216 | B29: 中信转债! | C29: 113021 | D29: 43543. | E29: 中信银行 | F29: 601998 | G29: 金融 | H29: 银行行业 | I29: 107.3 | J29: -2.3999999999999998e-003 | K29: 3.3e-003 | L29: 5.28 | M29: 3.8e-003 | N29: 96 | O29: 2.e-003 | P29: 118.8 | Q29: 6.98 | R29: 0.57 | S29: 75.64 | T29: 0.41799999999999998 | U29: 转股中 | V29: 4.36年 | W29: 无权 | X29: 0.155 | Y29: 0.11699999999999999 | Z29: 400 | AA29: 2584. | AB29: 2.4399999999999998e-002 | AC29: 1.6500000000000001e-002 | AD29: 无权 | AE29: 无权 | AF29: 无权 | AG29: 101.48 | AH29: 0.23 | AI29: AAA | AJ29: 3.7999999999999999e-002 | AK29: =I29+100*T29 -> 149.09999999999999 | AL29: 139 | AM29: 169 | AN29: 37.5 | AO29: 75 | AP29: 2.7000000000000003e-002 | AQ29: 52 | AR29: 中信转债!
A30: 261 | B30: 杭电转债! | C30: 113505 | D30: 43186. | E30: 杭电股份 | F30: 603618 | G30: 能源电力 | H30: 电力设备 | I30: 103.91 | J30: -4.6999999999999993e-003 | K30: 3.9000000000000003e-003 | L30: 5.51 | M30: -3.5999999999999999e-003 | N30: 20 | O30: 2.5000000000000001e-002 | P30: 112.3 | Q30: 7.14 | R30: 1.52 | S30: 77.17 | T30: 0.34600000000000003 | U30: 转股中 | V30: 3.36年 | W30: 1.36年 | X30: 0.19699999999999998 | Y30: 0.152 | Z30: 7.5 | AA30: 38 | AB30: 2.3799999999999998e-002 | AC30: 1.6899999999999998e-002 | AD30: -7.0999999999999995e-003 | AE30: -1.06e-002 | AF30: 96.44 | AG30: 97.75 | AH30: 0.22 | AI30: AA | AJ30: 4.2999999999999997e-002 | AK30: =I30+100*T30 -> 138.50999999999999 | AL30: 130.6 | AM30: 83 | AN30: 32.9 | AO30: 36 | AP30: -2.e-002 | AQ30: 38 | AR30: 杭电转债!
A31: 19 | B31: 嘉友转债 | C31: 113599 | D31: 44081. | E31: 嘉友国际 | F31: 603871 | G31: 交通运输 | H31: 物流业 | I31: 111.19 | J31: -7.6e-003 | K31: -2.18e-002 | L31: 22.75 | M31: -5.21e-002 | N31: 15 | O31: 1.9e-002 | P31: 126 | Q31: 24.82 | R31: 2.68 | S31: 91.66 | T31: 0.21299999999999999 | U31: 3月27天 | V31: 5.78年 | W31: 3.78年 | X31: 0.14400000000000002 | Y31: 0.13200000000000001 | Z31: 7.2 | AA31: 50 | AB31: 2.23e-002 | AC31: 1.47e-002 | AD31: -1.7100000000000001e-002 | AE31: -1.9e-002 | AF31: 80.82 | AG31: 87.5 | AH31: 0.56 | AI31: AA- | AJ31: 6.6400000000000001e-002 | AK31: =I31+100*T31 -> 132.49000000000001 | AL31: 130.7 | AM31: 86 | AN31: 43.2 | AO31: 131 | AP31: -0.20899999999999999 | AQ31: 11 | AR31: 嘉友转债
A32: 256 | B32: 新凤转债! | C32: 113508 | D32: 43236. | E32: 新凤鸣 | F32: 603225 | G32: 服装纺织 | H32: 纺织行业 | I32: 104.2 | J32: -4.7999999999999996e-003 | K32: 4.5999999999999999e-003 | L32: 10.62 | M32: -1.9e-003 | N32: 24 | O32: 1.1000000000000001e-002 | P32: 112.3 | Q32: 15.78 | R32: 1.32 | S32: 67.3 | T32: 0.54799999999999993 | U32: 转股中 | V32: 3.50年 | W32: 1.50年 | X32: 0.14499999999999999 | Y32: 9.8000000000000004e-002 | Z32: 21.5 | AA32: 148 | AB32: 2.2000000000000002e-002 | AC32: 1.54e-002 | AD32: -8.1000000000000013e-003 | AE32: -1.1399999999999999e-002 | AF32: 95.87 | AG32: 97.18 | AH32: 0.11 | AI32: AA | AJ32: 4.2999999999999997e-002 | AK32: =I32+100*T32 -> 159. | AL32: 141.1 | AM32: 194 | AN32: 43.9 | AO32: 136 | AP32: 0. | AQ32: 26 | AR32: 新凤转债!
A33: 11 | B33: 塞力转债 | C33: 113601 | D33: 44089. | E33: 塞力斯 | F33: 603716 | G33: 医药 | H33: 医药商业 | I33: 107.2 | J33: -1.01e-002 | K33: 8.8999999999999999e-003 | L33: 15.84 | M33: -1.9e-003 | N33: 40 | O33: 6.8000000000000005e-002 | P33: 121.3 | Q33: 16.98 | R33: 2.18 | S33: 93.29 | T33: 0.14899999999999999 | U33: 4月6天 | V33: 5.82年 | W33: 3.82年 | X33: 0.16699999999999998 | Y33: 0.156 | Z33: 5.43 | AA33: 32 | AB33: 2.1899999999999999e-002 | AC33: 1.54e-002 | AD33: -7.0999999999999995e-003 | AE33: -9.1000000000000004e-003 | AF33: 80.87 | AG33: 84.09 | AH33: 0.63 | AI33: AA- | AJ33: 6.6400000000000001e-002 | AK33: =I33+100*T33 -> 122.09999999999999 | AL33: 121.1 | AM33: 10 | AN33: 37 | AO33: 73 | AP33: 6.0000000000000001e-003 | AQ33: 12 | AR33: 塞力转债
A34: 291 | B34: 永东转债! | C34: 128014 | D34: 42934. | E34: 永东股份 | F34: 2753 | G34: 化工 | H34: 化工 | I34: 105.7 | J34: 2.0000000000000001e-004 | K34: -2.9999999999999997e-004 | L34: 8.1 | M34: -3.7000000000000002e-003 | N34: 40 | O34: 0.109 | P34: 111.3 | Q34: 12.6 | R34: 1.76 | S34: 64.29 | T34: 0.64400000000000002 | U34: 转股中 | V34: 2.48年 | W34: 0.48年 | X34: 0.111 | Y34: 7.0999999999999994e-002 | Z34: 3.37 | AA34: 30 | AB34: 2.1400000000000002e-002 | AC34: 1.2800000000000001e-002 | AD34: -5.67e-002 | AE34: -6.1799999999999994e-002 | AF34: 97.84 | AG34: 95.79 | AH34: 0 | AI34: AA- | AJ34: 6.3600000000000004e-002 | AK34: =I34+100*T34 -> 170.10000000000002 | AL34: 147.1 | AM34: 224 | AN34: 49.3 | AO34: 178 | AP34: -9.1999999999999998e-002 | AQ34: 38 | AR34: 永东转债!
A35: 13 | B35: 文科转债 | C35: 128127 | D35: 44085. | E35: 文科园林 | F35: 2775 | G35: 城市公用 | H35: 生态环境 | I35: 107.99 | J35: -1.11e-002 | K35: -4.0000000000000002e-004 | L35: 5.68 | M35: -1.7299999999999999e-002 | N35: 44 | O35: 4.2999999999999997e-002 | P35: 121.3 | Q35: 5.76 | R35: 1.17 | S35: 98.61 | T35: 9.5000000000000001e-002 | U35: 4月8天 | V35: 5.82年 | W35: 3.82年 | X35: 0.32600000000000001 | Y35: 0.32200000000000001 | Z35: 9.5 | AA35: 29 | AB35: 2.06e-002 | AC35: 1.4199999999999999e-002 | AD35: -9.0000000000000011e-003 | AE35: -1.1000000000000001e-002 | AF35: 80.88 | AG35: 84.11 | AH35: 0.66 | AI35: AA- | AJ35: 6.6400000000000001e-002 | AK35: =I35+100*T35 -> 117.48999999999999 | AL35: 117.4 | AM35: 4 | AN35: 33.3 | AO35: 39 | AP35: 4.5999999999999999e-002 | AQ35: 15 | AR35: 文科转债
A36: 106 | B36: 搜特转债! | C36: 128100 | D36: 43930. | E36: 搜于特 | F36: 2503 | G36: 服装纺织 | H36: 服装行业 | I36: 105.61 | J36: -8.3000000000000001e-003 | K36: 3.0000000000000001e-003 | L36: 2.52 | M36: -1.18e-002 | N36: 27 | O36: 3.2000000000000001e-002 | P36: 117.3 | Q36: 2.9 | R36: 1.42 | S36: 86.9 | T36: 0.215 | U36: 转股中 | V36: 5.38年 | W36: 3.38年 | X36: 0.10300000000000001 | Y36: 8.900000000000001e-002 | Z36: 8 | AA36: 78 | AB36: 2.0099999999999996e-002 | AC36: 1.43e-002 | AD36: -4.8999999999999998e-003 | AE36: -6.9999999999999993e-003 | AF36: 88.82 | AG36: 92.82 | AH36: 0.45 | AI36: AA | AJ36: 4.5400000000000003e-002 | AK36: =I36+100*T36 -> 127.11 | AL36: 124.3 | AM36: 20 | AN36: 31.5 | AO36: 26 | AP36: -4.5999999999999999e-002 | AQ36: 43 | AR36: 搜特转债!
A37: 267 | B37: 迪龙转债! | C37: 128033 | D37: 43129. | E37: 雪迪龙 | F37: 2658 | G37: 城市公用 | H37: 三废处理 | I37: 103.261 | J37: 2.0999999999999999e-003 | K37: -4.0000000000000001e-003 | L37: 6.19 | M37: -1.43e-002 | N37: 14 | O37: 2.6000000000000002e-002 | P37: 109.8 | Q37: 8.83 | R37: 1.9 | S37: 70.1 | T37: 0.47299999999999998 | U37: 转股中 | V37: 3.18年 | W37: 1.18年 | X37: 0.13900000000000001 | Y37: 9.6999999999999989e-002 | Z37: 5.2 | AA37: 37 | AB37: 1.9900000000000001e-002 | AC37: 1.3999999999999999e-002 | AD37: -5.1999999999999998e-003 | AE37: -8.8999999999999999e-003 | AF37: 96.97 | AG37: 96.33 | AH37: 0.13 | AI37: AA | AJ37: 4.2999999999999997e-002 | AK37: =I37+100*T37 -> 150.56099999999998 | AL37: 136.4 | AM37: 147 | AN37: 39.4 | AO37: 105 | AP37: -3.7000000000000005e-002 | AQ37: 37 | AR37: 迪龙转债!
A38: 270 | B38: 双环转债! | C38: 128032 | D38: 43125. | E38: 双环传动 | F38: 2472 | G38: 机械装备 | H38: 通用设备 | I38: 103.8 | J38: -1.15e-002 | K38: 1.1200000000000002e-002 | L38: 6.42 | M38: -4.6999999999999993e-003 | N38: 37 | O38: 3.5000000000000003e-002 | P38: 110.3 | Q38: 9.89 | R38: 1.34 | S38: 64.91 | T38: 0.59899999999999998 | U38: 转股中 | V38: 3.17年 | W38: 1.17年 | X38: 0.22699999999999998 | Y38: 0.14699999999999999 | Z38: 10 | AA38: 44 | AB38: 1.9799999999999998e-002 | AC38: 1.3600000000000001e-002 | AD38: -7.3000000000000001e-003 | AE38: -1.1399999999999999e-002 | AF38: 97.23 | AG38: 96.82 | AH38: 0.07 | AI38: AA | AJ38: 4.2999999999999997e-002 | AK38: =I38+100*T38 -> 163.69999999999999 | AL38: 142.7 | AM38: 203 | AN38: 45.5 | AO38: 150 | AP38: -4.4999999999999998e-002 | AQ38: 45 | AR38: 双环转债!
A39: 143 | B39: 森特转债 | C39: 113557 | D39: 43840. | E39: 森特股份 | F39: 603098 | G39: 建筑 | H39: 建筑工程 | I39: 109.48 | J39: -5.7999999999999996e-003 | K39: 1.5e-003 | L39: 9.35 | M39: -7.4000000000000003e-003 | N39: 3.6 | O39: 5.0000000000000001e-003 | P39: 120.7 | Q39: 10.11 | R39: 2.23 | S39: 92.48 | T39: 0.184 | U39: 转股中 | V39: 5年56天 | W39: 3年56天 | X39: 0.13400000000000001 | Y39: 0.124 | Z39: 6 | AA39: 45 | AB39: 1.95e-002 | AC39: 1.2500000000000001e-002 | AD39: -1.54e-002 | AE39: -1.77e-002 | AF39: 84.28 | AG39: 87.32 | AH39: 0.59 | AI39: AA- | AJ39: 6.6400000000000001e-002 | AK39: =I39+100*T39 -> 127.88 | AL39: 126.5 | AM39: 38 | AN39: 39.2 | AO39: 98 | AP39: -2.8999999999999998e-002 | AQ39: 35 | AR39: 森特转债
A40: 215 | B40: 贵广转债! | C40: 110052 | D40: 43553. | E40: 贵广网络 | F40: 600996 | G40: 传媒娱乐 | H40: 影视娱乐 | I40: 109.43 | J40: -1.1000000000000001e-003 | K40: -6.4000000000000003e-003 | L40: 7.05 | M40: -1.95e-002 | N40: 20 | O40: 1.2e-002 | P40: 118.5 | Q40: 7.94 | R40: 1.6 | S40: 88.79 | T40: 0.23199999999999998 | U40: 转股中 | V40: 4.36年 | W40: 2.36年 | X40: 0.20600000000000002 | Y40: 0.183 | Z40: 15.3 | AA40: 74 | AB40: 1.8799999999999997e-002 | AC40: 1.1200000000000002e-002 | AD40: -2.0799999999999999e-002 | AE40: -2.3599999999999999e-002 | AF40: 93.92 | AG40: 99.85 | AH40: 0.38 | AI40: AA+ | AJ40: 4.0999999999999995e-002 | AK40: =I40+100*T40 -> 132.63 | AL40: 130.1 | AM40: 76 | AN40: 30.2 | AO40: 21 | AP40: -1.8000000000000002e-002 | AQ40: 19 | AR40: 贵广转债!
A41: 284 | B41: 时达转债! | C41: 128018 | D41: 43073. | E41: 新时达 | F41: 2527 | G41: 机械装备 | H41: 机器人及 | I41: 104.53 | J41: -4.5000000000000005e-003 | K41: 1.6000000000000001e-003 | L41: 5.7 | M41: -1.38e-002 | N41: 8.6 | O41: 9.0000000000000011e-003 | P41: 110.3 | Q41: 7.42 | R41: 1.4 | S41: 76.82 | T41: 0.36099999999999999 | U41: 转股中 | V41: 3年13天 | W41: 1年13天 | X41: 0.249 | Y41: 0.191 | Z41: 8.8 | AA41: 35 | AB41: 1.83e-002 | AC41: 1.18e-002 | AD41: -1.3899999999999999e-002 | AE41: -1.84e-002 | AF41: 97.78 | AG41: 97.37 | AH41: 0.2 | AI41: AA | AJ41: 4.2999999999999997e-002 | AK41: =I41+100*T41 -> 140.63 | AL41: 132.2 | AM41: 106 | AN41: 34.5 | AO41: 48 | AP41: -8.0000000000000002e-003 | AQ41: 40 | AR41: 时达转债!
A42: 153 | B42: 海亮转债! | C42: 128081 | D42: 43815. | E42: 海亮股份 | F42: 2203 | G42: 有色金属 | H42: 铜金属 | I42: 105.66 | J42: 1.01e-002 | K42: 5.7999999999999996e-003 | L42: 8.2 | M42: 3.7999999999999999e-002 | N42: 42 | O42: 1.3000000000000001e-002 | P42: 115.2 | Q42: 9.76 | R42: 1.78 | S42: 84.02 | T42: 0.25800000000000001 | U42: 转股中 | V42: 5年28天 | W42: 3年28天 | X42: 0.19699999999999998 | Y42: 0.16500000000000001 | Z42: 31.5 | AA42: 160 | AB42: 1.7500000000000002e-002 | AC42: 1.2e-002 | AD42: -5.7999999999999996e-003 | AE42: -8.0000000000000002e-003 | AF42: 89.94 | AG42: 92.38 | AH42: 0.42 | AI42: AA | AJ42: 4.5400000000000003e-002 | AK42: =I42+100*T42 -> 131.46000000000001 | AL42: 127.3 | AM42: 46 | AN42: 34.9 | AO42: 51 | AP42: 2.6000000000000002e-002 | AQ42: 51 | AR42: 海亮转债!
A43: 144 | B43: 孚日转债! | C43: 128087 | D43: 43846. | E43: 孚日股份 | F43: 2083 | G43: 服装纺织 | H43: 家纺 | I43: 103.821 | J43: -1.1200000000000002e-002 | K43: 5.8999999999999999e-003 | L43: 5.05 | M43: -1.37e-002 | N43: 15 | O43: 2.1000000000000001e-002 | P43: 113.3 | Q43: 6.3 | R43: 1.2 | S43: 80.16 | T43: 0.29499999999999998 | U43: 转股中 | V43: 5年54天 | W43: 3年54天 | X43: 0.14199999999999999 | Y43: 0.114 | Z43: 6.5 | AA43: 46 | AB43: 1.7500000000000002e-002 | AC43: 1.26e-002 | AD43: -1.e-004 | AE43: -2.3e-003 | AF43: 89.75 | AG43: 90.6 | AH43: 0.39 | AI43: AA | AJ43: 4.5400000000000003e-002 | AK43: =I43+100*T43 -> 133.321 | AL43: 127.5 | AM43: 48 | AN43: 36.9 | AO43: 71 | AP43: -6.0000000000000001e-003 | AQ43: 51 | AR43: 孚日转债!
A44: 34 | B44: 花王转债 | C44: 113595 | D44: 44061. | E44: 花王股份 | F44: 603007 | G44: 城市公用 | H44: 生态环境 | I44: 113.71 | J44: 2.e-003 | K44: 1.8e-003 | L44: 7.27 | M44: 5.5000000000000005e-003 | N44: 55 | O44: 0.14599999999999999 | P44: 125.3 | Q44: 6.94 | R44: 2.21 | S44: 104.76 | T44: 8.5000000000000006e-002 | U44: 3月5天 | V44: 5.74年 | W44: 3.74年 | X44: 0.13500000000000001 | Y44: 0.14199999999999999 | Z44: 3.3 | AA44: 24 | AB44: 1.7399999999999999e-002 | AC44: 9.8999999999999991e-003 | AD44: -2.23e-002 | AE44: -2.4300000000000002e-002 | AF44: 81.31 | AG44: 87.32 | AH44: 0.7 | AI44: AA- | AJ44: 6.6400000000000001e-002 | AK44: =I44+100*T44 -> 122.20999999999999 | AL44: 122.7 | AM44: 15 | AN44: 35.3 | AO44: 54 | AP44: -2.e-003 | AQ44: 24 | AR44: 花王转债
A45: 296 | B45: 顺昌转债!! | C45: 128010 | D45: 42423. | E45: 澳洋顺昌 | F45: 2245 | G45: 交通运输 | H45: 物流业 | I45: 107.451 | J45: -3.2000000000000002e-003 | K45: 4.0000000000000001e-003 | L45: 6.6 | M45: 3.1300000000000001e-002 | N45: 23 | O45: 4.2000000000000003e-002 | P45: 109.6 | Q45: 9.25 | R45: 3.02 | S45: 71.35 | T45: 0.50600000000000001 | U45: 转股中 | V45: 1.25年 | W45: 回售中 | X45: 7.9000000000000001e-002 | Y45: 5.5999999999999994e-002 | Z45: 5.09 | AA45: 65 | AB45: 1.6200000000000003e-002 | AC45: 1.7000000000000001e-003 | AD45: 回售中 | AE45: 回售中 | AF45: 100.27 | AG45: 104.11 | AH45: 0.02 | AI45: AA | AJ45: 4.2599999999999999e-002 | AK45: =I45+100*T45 -> 158.05099999999999 | AL45: 143.6 | AM45: 207 | AN45: 39.4 | AO45: 104 | AP45: 9.3000000000000013e-002 | AQ45: 41 | AR45: 顺昌转债!!
A46: 114 | B46: 新春转债 | C46: 113568 | D46: 43923. | E46: 五洲新春 | F46: 603667 | G46: 机械装备 | H46: 通用设备 | I46: 114.75 | J46: 6.8999999999999999e-003 | K46: 1.9299999999999998e-002 | L46: 9.65 | M46: 3.6499999999999998e-002 | N46: 123 | O46: 0.32200000000000001 | P46: 124.8 | Q46: 8.91 | R46: 1.65 | S46: 108.31 | T46: 5.9999999999999998e-002 | U46: 转股中 | V46: 5.36年 | W46: 3.36年 | X46: 0.11699999999999999 | Y46: 0.127 | Z46: 3.3 | AA46: 28 | AB46: 1.61e-002 | AC46: 8.3000000000000001e-003 | AD46: -2.5899999999999999e-002 | AE46: -2.8300000000000002e-002 | AF46: 83.71 | AG46: 89.15 | AH46: 0.72 | AI46: AA- | AJ46: 6.6400000000000001e-002 | AK46: =I46+100*T46 -> 120.75 | AL46: 121.2 | AM46: 11 | AN46: 32 | AO46: 31 | AP46: 0.13 | AQ46: 42 | AR46: 新春转债
A47: 175 | B47: 翔鹭转债! | C47: 128072 | D47: 43724. | E47: 翔鹭钨业 | F47: 2842 | G47: 有色金属 | H47: 小金属 | I47: 107.053 | J47: 2.5699999999999997e-002 | K47: -2.87e-002 | L47: 9.63 | M47: -1.43e-002 | N47: 89 | O47: 0.27600000000000002 | P47: 115.1 | Q47: 15.34 | R47: 2.94 | S47: 62.78 | T47: 0.70499999999999996 | U47: 转股中 | V47: 4.82年 | W47: 2.82年 | X47: 0.115 | Y47: 7.2000000000000008e-002 | Z47: 3.02 | AA47: 26 | AB47: 1.54e-002 | AC47: 9.7000000000000003e-003 | AD47: -1.15e-002 | AE47: -1.37e-002 | AF47: 86.08 | AG47: 85.85 | AH47: 0.21 | AI47: AA- | AJ47: 6.4000000000000001e-002 | AK47: =I47+100*T47 -> 177.553 | AL47: 151.3 | AM47: 238 | AN47: 65.3 | AO47: 248 | AP47: -3.5000000000000003e-002 | AQ47: 26 | AR47: 翔鹭转债!
A48: 194 | B48: 核能转债! | C48: 113026 | D48: 43593. | E48: 中国核电 | F48: 601985 | G48: 能源电力 | H48: 核电 | I48: 102.8 | J48: -1.2999999999999999e-003 | K48: 2.0000000000000001e-004 | L48: 4.47 | M48: -4.5000000000000005e-003 | N48: 13 | O48: 2.e-003 | P48: 109.8 | Q48: 6.08 | R48: 1.39 | S48: 73.52 | T48: 0.39799999999999996 | U48: 转股中 | V48: 4.47年 | W48: 2.47年 | X48: 0.11199999999999999 | Y48: 8.199999999999999e-002 | Z48: 78 | AA48: 696 | AB48: 1.5100000000000001e-002 | AC48: 1.09e-002 | AD48: 1.9e-003 | AE48: -5.9999999999999995e-004 | AF48: 93.7 | AG48: 93.24 | AH48: 0.23 | AI48: AAA | AJ48: 3.7999999999999999e-002 | AK48: =I48+100*T48 -> 142.59999999999999 | AL48: 132.1 | AM48: 101 | AN48: 38.4 | AO48: 91 | AP48: -6.9999999999999993e-003 | AQ48: 49 | AR48: 核能转债!
A49: 94 | B49: 鲁泰转债 | C49: 127016 | D49: 43964. | E49: 鲁 泰Ａ | F49: 726 | G49: 服装纺织 | H49: 纺织行业 | I49: 107.456 | J49: 2.3999999999999998e-003 | K49: -9.300000000000001e-003 | L49: 7.37 | M49: -1.7299999999999999e-002 | N49: 9.3 | O49: 6.0000000000000001e-003 | P49: 116.2 | Q49: 8.91 | R49: 0.81 | S49: 82.72 | T49: 0.29899999999999999 | U49: 转股中 | V49: 5.46年 | W49: 3.46年 | X49: 0.221 | Y49: 0.183 | Z49: 14 | AA49: 63 | AB49: 1.47e-002 | AC49: 9.300000000000001e-003 | AD49: -9.8999999999999991e-003 | AE49: -1.18e-002 | AF49: 89.03 | AG49: 92.56 | AH49: 0.4 | AI49: AA+ | AJ49: 4.3400000000000001e-002 | AK49: =I49+100*T49 -> 137.35599999999999 | AL49: 132.2 | AM49: 104 | AN49: 39.6 | AO49: 106 | AP49: -1.9e-002 | AQ49: 22 | AR49: 鲁泰转债
A50: 151 | B50: 华锋转债! | C50: 128082 | D50: 43836. | E50: 华锋股份 | F50: 2806 | G50: 电子 | H50: 元器件制 | I50: 113.52 | J50: -2.2000000000000001e-003 | K50: -2.5000000000000001e-003 | L50: 11.86 | M50: -6.7000000000000002e-003 | N50: 71 | O50: 0.17600000000000002 | P50: 122 | Q50: 11.71 | R50: 1.66 | S50: 101.28 | T50: 0.121 | U50: 转股中 | V50: 5年41天 | W50: 3年41天 | X50: 0.16899999999999998 | Y50: 0.17100000000000001 | Z50: 3.52 | AA50: 21 | AB50: 1.46e-002 | AC50: 7.0999999999999995e-003 | AD50: -2.3599999999999999e-002 | AE50: -2.6499999999999999e-002 | AF50: 82.65 | AG50: 84.26 | AH50: 0.7 | AI50: A+ | AJ50: 7.7399999999999997e-002 | AK50: =I50+100*T50 -> 125.61999999999999 | AL50: 125.8 | AM50: 35 | AN50: 41.5 | AO50: 118 | AP50: -3.1e-002 | AQ50: 54 | AR50: 华锋转债!
A51: 48 | B51: 道恩转债 | C51: 128117 | D51: 44032. | E51: 道恩股份 | F51: 2838 | G51: 化工 | H51: 橡胶塑料 | I51: 114.034 | J51: -7.6e-003 | K51: 1.4000000000000002e-003 | L51: 28.36 | M51: -9.3999999999999986e-003 | N51: 41 | O51: 9.6999999999999989e-002 | P51: 123.5 | Q51: 29.07 | R51: 7.11 | S51: 97.56 | T51: 0.16899999999999998 | U51: 2月16天 | V51: 5.69年 | W51: 3.69年 | X51: 3.1e-002 | Y51: 2.9999999999999999e-002 | Z51: 3.6 | AA51: 115 | AB51: 1.44e-002 | AC51: 7.3000000000000001e-003 | AD51: -2.4199999999999999e-002 | AE51: -2.6099999999999998e-002 | AF51: 81.24 | AG51: 86.27 | AH51: 0.65 | AI51: AA- | AJ51: 6.6400000000000001e-002 | AK51: =I51+100*T51 -> 130.934 | AL51: 130.5 | AM51: 80 | AN51: 44.2 | AO51: 139 | AP51: -3.4000000000000002e-002 | AQ51: 10 | AR51: 道恩转债
A52: 164 | B52: XD迪贝转! | C52: 113546 | D52: 43790. | E52: 迪贝电气 | F52: 603320 | G52: 家电 | H52: 零部件制 | I52: 113.16 | J52: -2.e-003 | K52: -3.2000000000000002e-003 | L52: 13.01 | M52: -8.3999999999999995e-003 | N52: 289 | O52: 1.0600000000000001 | P52: 121.1 | Q52: 14.1 | R52: 2.54 | S52: 92.27 | T52: 0.22600000000000001 | U52: 转股中 | V52: 4.998年 | W52: 2.998年 | X52: 0.13600000000000001 | Y52: 0.125 | Z52: 2.3 | AA52: 17 | AB52: 1.3999999999999999e-002 | AC52: 6.6e-003 | AD52: -2.5399999999999999e-002 | AE52: -2.7999999999999997e-002 | AF52: 82.31 | AG52: 84.25 | AH52: 0.62 | AI52: A+ | AJ52: 7.7399999999999997e-002 | AK52: =I52+100*T52 -> 135.75999999999999 | AL52: 134.1 | AM52: 125 | AN52: 49.8 | AO52: 181 | AP52: 1.e-002 | AQ52: 42 | AR52: XD迪贝转!
A53: 244 | B53: 凯中转债! | C53: 128042 | D53: 43346. | E53: 凯中精密 | F53: 2823 | G53: 能源电力 | H53: 电力设备 | I53: 110.5 | J53: -1.34e-002 | K53: 1.89e-002 | L53: 11.65 | M53: 1.3899999999999999e-002 | N53: 2281. | O53: 4.54 | P53: 116.3 | Q53: 12.96 | R53: 2.65 | S53: 89.89 | T53: 0.22899999999999998 | U53: 转股中 | V53: 3.76年 | W53: 1.76年 | X53: 0.124 | Y53: 0.11199999999999999 | Z53: 4.16 | AA53: 33 | AB53: 1.3899999999999999e-002 | AC53: 6.0999999999999995e-003 | AD53: -3.7000000000000005e-002 | AE53: -3.9599999999999996e-002 | AF53: 94.83 | AG53: 99.54 | AH53: 0.4 | AI53: AA | AJ53: 4.2999999999999997e-002 | AK53: =I53+100*T53 -> 133.40000000000001 | AL53: 131.1 | AM53: 95 | AN53: 31.6 | AO53: 27 | AP53: 4.2999999999999997e-002 | AQ53: 23 | AR53: 凯中转债!
A54: 226 | B54: 奇精转债! | C54: 113524 | D54: 43472. | E54: 奇精机械 | F54: 603677 | G54: 家电 | H54: 零部件制 | I54: 111.51 | J54: -5.0700000000000002e-002 | K54: 5.5e-002 | L54: 13.58 | M54: 8.8999999999999999e-003 | N54: 389 | O54: 0.95999999999999996 | P54: 117.9 | Q54: 14.08 | R54: 2.68 | S54: 96.45 | T54: 0.156 | U54: 转股中 | V54: 4年51天 | W54: 2年51天 | X54: 0.126 | Y54: 0.122 | Z54: 3.3 | AA54: 26 | AB54: 1.38e-002 | AC54: 6.0999999999999995e-003 | AD54: -3.2599999999999997e-002 | AE54: -3.5299999999999998e-002 | AF54: 93.94 | AG54: 99.41 | AH54: 0.49 | AI54: AA | AJ54: 4.2999999999999997e-002 | AK54: =I54+100*T54 -> 127.11 | AL54: 126.6 | AM54: 40 | AN54: 27.2 | AO54: 12 | AP54: 9.5000000000000001e-002 | AQ54: 42 | AR54: 奇精转债!
A55: 193 | B55: 创维转债! | C55: 127013 | D55: 43601. | E55: 创维数字 | F55: 810 | G55: 电子 | H55: 电子产品 | I55: 111.047 | J55: -1.2e-002 | K55: 8.1000000000000013e-003 | L55: 10.09 | M55: -9.7999999999999997e-003 | N55: 9.9 | O55: 9.0000000000000011e-003 | P55: 117.9 | Q55: 11.39 | R55: 2.85 | S55: 88.59 | T55: 0.254 | U55: 转股中 | V55: 4.47年 | W55: 2.47年 | X55: 9.0999999999999998e-002 | Y55: 8.1000000000000003e-002 | Z55: 9.78 | AA55: 107 | AB55: 1.37e-002 | AC55: 6.6e-003 | AD55: -2.69e-002 | AE55: -2.9300000000000003e-002 | AF55: 92.63 | AG55: 98.02 | AH55: 0.4 | AI55: AA | AJ55: 4.2999999999999997e-002 | AK55: =I55+100*T55 -> 136.447 | AL55: 133.5 | AM55: 117 | AN55: 35.5 | AO55: 56 | AP55: 9.0000000000000011e-003 | AQ55: 24 | AR55: 创维转债!
A56: 12 | B56: 齐翔转2 | C56: 128128 | D56: 44089. | E56: 齐翔腾达 | F56: 2408 | G56: 化工 | H56: 化工 | I56: 106.811 | J56: -1.8e-003 | K56: 7.9000000000000008e-003 | L56: 8.03 | M56: 1.01e-002 | N56: 105 | O56: 3.3000000000000002e-002 | P56: 115.3 | Q56: 8.22 | R56: 1.78 | S56: 97.69 | T56: 9.3000000000000013e-002 | U56: 4月5天 | V56: 5.82年 | W56: 3.82年 | X56: 0.20999999999999999 | Y56: 0.20499999999999999 | Z56: 29.9 | AA56: 143 | AB56: 1.3500000000000002e-002 | AC56: 8.6999999999999994e-003 | AD56: -7.4000000000000003e-003 | AE56: -9.1999999999999998e-003 | AF56: 87.01 | AG56: 89.46 | AH56: 0.61 | AI56: AA | AJ56: 4.5400000000000003e-002 | AK56: =I56+100*T56 -> 116.111 | AL56: 115.9 | AM56: 2 | AN56: 26.5 | AO56: 11 | AP56: 5.7000000000000002e-002 | AQ56: 21 | AR56: 齐翔转2
A57: 14 | B57: 精达转债 | C57: 110074 | D57: 44095. | E57: 精达股份 | F57: 600577 | G57: 电子 | H57: 电子产品 | I57: 108.75 | J57: -9.5999999999999992e-003 | K57: 1.e-003 | L57: 3.29 | M57: -1.7899999999999999e-002 | N57: 22 | O57: 2.5000000000000001e-002 | P57: 117.3 | Q57: 3.75 | R57: 1.79 | S57: 87.73 | T57: 0.23999999999999999 | U57: 4月4天 | V57: 5.82年 | W57: 3.82年 | X57: 0.124 | Y57: 0.109 | Z57: 7.87 | AA57: 63 | AB57: 1.3300000000000001e-002 | AC57: 8.0000000000000002e-003 | AD57: -1.1699999999999999e-002 | AE57: -1.3500000000000002e-002 | AF57: 87.11 | AG57: 91.03 | AH57: 0.48 | AI57: AA | AJ57: 4.5400000000000003e-002 | AK57: =I57+100*T57 -> 132.75 | AL57: 129.8 | AM57: 71 | AN57: 38.7 | AO57: 94 | AP57: -5.5e-002 | AQ57: 6 | AR57: 精达转债
A58: 47 | B58: 瀛通转债 | C58: 128118 | D58: 44048. | E58: 瀛通通讯 | F58: 2861 | G58: 电子 | H58: 电子产品 | I58: 113.5 | J58: 0. | K58: -4.8999999999999998e-003 | L58: 23.74 | M58: -9.1999999999999998e-003 | N58: 26 | O58: 7.4999999999999997e-002 | P58: 122.1 | Q58: 27.53 | R58: 2.72 | S58: 86.23 | T58: 0.316 | U58: 2月16天 | V58: 5.69年 | W58: 3.69年 | X58: 0.10400000000000001 | Y58: 8.900000000000001e-002 | Z58: 3 | AA58: 29 | AB58: 1.32e-002 | AC58: 6.5000000000000006e-003 | AD58: -2.12e-002 | AE58: -2.3399999999999997e-002 | AF58: 81.87 | AG58: 85.42 | AH58: 0.54 | AI58: AA- | AJ58: 6.6400000000000001e-002 | AK58: =I58+100*T58 -> 145.09999999999999 | AL58: 140.8 | AM58: 189 | AN58: 55.3 | AO58: 216 | AP58: -3.4000000000000002e-002 | AQ58: 5 | AR58: 瀛通转债
A59: 275 | B59: 众兴转债! | C59: 128026 | D59: 43103. | E59: 众兴菌业 | F59: 2772 | G59: 农业 | H59: 种植业 | I59: 106 | J59: -9.300000000000001e-003 | K59: 3.2000000000000002e-003 | L59: 9.64 | M59: -1.6299999999999999e-002 | N59: 34 | O59: 3.4000000000000002e-002 | P59: 110.3 | Q59: 11.45 | R59: 1.44 | S59: 84.19 | T59: 0.25900000000000001 | U59: 转股中 | V59: 3年50天 | W59: 1年50天 | X59: 0.25900000000000001 | Y59: 0.218 | Z59: 9.19 | AA59: 35 | AB59: 1.3100000000000001e-002 | AC59: 6.8000000000000005e-003 | AD59: -2.35e-002 | AE59: -2.75e-002 | AF59: 94.9 | AG59: 91.22 | AH59: 0.37 | AI59: AA- | AJ59: 6.4000000000000001e-002 | AK59: =I59+100*T59 -> 131.90000000000001 | AL59: 127.8 | AM59: 54 | AN59: 32.9 | AO59: 37 | AP59: 4.0000000000000001e-002 | AQ59: 57 | AR59: 众兴转债!
A60: 295 | B60: 海印转债! | C60: 127003 | D60: 42552. | E60: 海印股份 | F60: 861 | G60: 商业零售 | H60: 商场 | I60: 109.5 | J60: -9.7999999999999997e-003 | K60: 4.6999999999999993e-003 | L60: 2.53 | M60: -3.44e-002 | N60: 8.4 | O60: 1.1000000000000001e-002 | P60: 111.8 | Q60: 3 | R60: 1.58 | S60: 84.33 | T60: 0.29799999999999999 | U60: 转股中 | V60: 1.62年 | W60: 回售中 | X60: 0.115 | Y60: 9.6999999999999989e-002 | Z60: 6.74 | AA60: 59 | AB60: 1.3000000000000001e-002 | AC60: -2.9999999999999997e-004 | AD60: 回售中 | AE60: 回售中 | AF60: 100.3 | AG60: 104.56 | AH60: 0.15 | AI60: AA | AJ60: 4.2599999999999999e-002 | AK60: =I60+100*T60 -> 139.30000000000001 | AL60: 134.7 | AM60: 133 | AN60: 30.1 | AO60: 18 | AP60: -0.14999999999999999 | AQ60: 74 | AR60: 海印转债!
A61: 120 | B61: 翔港转债 | C61: 113566 | D61: 43921. | E61: 翔港科技 | F61: 603499 | G61: 造纸包装 | H61: 包装材料 | I61: 116.6 | J61: -3.8599999999999995e-002 | K61: 2.46e-002 | L61: 10.11 | M61: -2.2200000000000001e-002 | N61: 465 | O61: 2.2799999999999998 | P61: 124.5 | Q61: 10.77 | R61: 2.71 | S61: 93.87 | T61: 0.24199999999999999 | U61: 转股中 | V61: 5.35年 | W61: 3.35年 | X61: 7.9000000000000001e-002 | Y61: 7.400000000000001e-002 | Z61: 1.61 | AA61: 20 | AB61: 1.26e-002 | AC61: 4.8999999999999998e-003 | AD61: -3.0600000000000002e-002 | AE61: -3.3099999999999997e-002 | AF61: 80.85 | AG61: 84.39 | AH61: 0.63 | AI61: A+ | AJ61: 7.7399999999999997e-002 | AK61: =I61+100*T61 -> 140.79999999999998 | AL61: 139.3 | AM61: 171 | AN61: 54.9 | AO61: 213 | AP61: -6.8000000000000005e-002 | AQ61: 26 | AR61: 翔港转债
A62: 231 | B62: 山鹰转债 | C62: 110047 | D62: 43444. | E62: 山鹰纸业 | F62: 600567 | G62: 造纸包装 | H62: 包装用纸 | I62: 112.57 | J62: -2.3e-003 | K62: -1.9e-003 | L62: 3.15 | M62: -9.3999999999999986e-003 | N62: 24 | O62: 9.0000000000000011e-003 | P62: 118.1 | Q62: 3.34 | R62: 1.02 | S62: 94.31 | T62: 0.19399999999999998 | U62: 转股中 | V62: 4年28天 | W62: 2年28天 | X62: 0.159 | Y62: 0.14999999999999999 | Z62: 23 | AA62: 145 | AB62: 1.21e-002 | AC62: 4.1999999999999997e-003 | AD62: -3.7400000000000003e-002 | AE62: -4.0199999999999993e-002 | AF62: 94.62 | AG62: 100.62 | AH62: 0.45 | AI62: AA+ | AJ62: 4.0999999999999995e-002 | AK62: =I62+100*T62 -> 131.97 | AL62: 130.8 | AM62: 89 | AN62: 30.2 | AO62: 20 | AP62: -3.0000000000000001e-003 | AQ62: 35 | AR62: 山鹰转债
A63: 46 | B63: 宁建转债 | C63: 113036 | D63: 44049. | E63: 宁波建工 | F63: 601789 | G63: 建筑 | H63: 建筑工程 | I63: 109.9 | J63: -9.0000000000000011e-003 | K63: 2.2000000000000001e-003 | L63: 4.38 | M63: -1.3500000000000002e-002 | N63: 3.1 | O63: 5.0000000000000001e-003 | P63: 117.3 | Q63: 4.86 | R63: 1.47 | S63: 90.12 | T63: 0.21899999999999997 | U63: 2月19天 | V63: 5.70年 | W63: 3.70年 | X63: 0.126 | Y63: 0.114 | Z63: 5.4 | AA63: 43 | AB63: 1.1699999999999999e-002 | AC63: 6.3e-003 | AD63: -1.4800000000000001e-002 | AE63: -1.67e-002 | AF63: 87.58 | AG63: 91.52 | AH63: 0.5 | AI63: AA | AJ63: 4.5400000000000003e-002 | AK63: =I63+100*T63 -> 131.80000000000001 | AL63: 129.7 | AM63: 69 | AN63: 38.2 | AO63: 87 | AP63: -1.6e-002 | AQ63: 5 | AR63: 宁建转债
A64: 200 | B64: 海环转债! | C64: 113532 | D64: 43579. | E64: 海峡环保 | F64: 603817 | G64: 城市公用 | H64: 三废处理 | I64: 107.43 | J64: 6.6e-003 | K64: -7.1999999999999998e-003 | L64: 6.48 | M64: -1.5e-003 | N64: 5.6 | O64: 1.1000000000000001e-002 | P64: 112.9 | Q64: 7.69 | R64: 1.74 | S64: 84.27 | T64: 0.27500000000000002 | U64: 转股中 | V64: 4.44年 | W64: 2.44年 | X64: 0.158 | Y64: 0.13300000000000001 | Z64: 4.6 | AA64: 29 | AB64: 1.15e-002 | AC64: 6.0999999999999995e-003 | AD64: -1.47e-002 | AE64: -1.72e-002 | AF64: 92.76 | AG64: 94.02 | AH64: 0.4 | AI64: AA | AJ64: 4.2999999999999997e-002 | AK64: =I64+100*T64 -> 134.93000000000001 | AL64: 130.6 | AM64: 81 | AN64: 36.6 | AO64: 69 | AP64: 1.e-002 | AQ64: 25 | AR64: 海环转债!
A65: 198 | B65: 司尔转债! | C65: 128064 | D65: 43592. | E65: 司尔特 | F65: 2538 | G65: 化工 | H65: 农化 | I65: 109.338 | J65: -6.8999999999999999e-003 | K65: -5.9999999999999995e-004 | L65: 5.55 | M65: -1.6e-002 | N65: 8.4 | O65: 9.0000000000000011e-003 | P65: 114.9 | Q65: 6.07 | R65: 1.06 | S65: 91.43 | T65: 0.19600000000000001 | U65: 转股中 | V65: 4.46年 | W65: 2.46年 | X65: 0.20100000000000001 | Y65: 0.184 | Z65: 8 | AA65: 40 | AB65: 1.1399999999999999e-002 | AC65: 5.3e-003 | AD65: -2.1299999999999999e-002 | AE65: -2.3700000000000002e-002 | AF65: 92.7 | AG65: 95.61 | AH65: 0.47 | AI65: AA | AJ65: 4.2999999999999997e-002 | AK65: =I65+100*T65 -> 128.93799999999999 | AL65: 127.2 | AM65: 45 | AN65: 31.6 | AO65: 28 | AP65: -6.0999999999999999e-002 | AQ65: 56 | AR65: 司尔转债!
A66: 127 | B66: 星帅转债 | C66: 128094 | D66: 43880. | E66: 星帅尔 | F66: 2860 | G66: 家电 | H66: 零部件制 | I66: 114.81 | J66: -2.29e-002 | K66: 2.1400000000000002e-002 | L66: 13.88 | M66: -2.2000000000000001e-003 | N66: 251 | O66: 0.74199999999999999 | P66: 121.5 | Q66: 13.95 | R66: 3.09 | S66: 99.5 | T66: 0.154 | U66: 转股中 | V66: 5.23年 | W66: 3.23年 | X66: 0.10099999999999999 | Y66: 0.10099999999999999 | Z66: 2.8 | AA66: 28 | AB66: 1.11e-002 | AC66: 4.0000000000000001e-003 | AD66: -2.7400000000000001e-002 | AE66: -2.9900000000000003e-002 | AF66: 81.49 | AG66: 83.09 | AH66: 0.71 | AI66: A+ | AJ66: 7.7399999999999997e-002 | AK66: =I66+100*T66 -> 130.21000000000001 | AL66: 130.1 | AM66: 77 | AN66: 47 | AO66: 160 | AP66: -2.8999999999999998e-002 | AQ66: 29 | AR66: 星帅转债
A67: 155 | B67: 白电转债 | C67: 113549 | D67: 43810. | E67: 白云电器 | F67: 603861 | G67: 能源电力 | H67: 电力设备 | I67: 109.31 | J67: -9.8999999999999991e-003 | K67: 6.7000000000000002e-003 | L67: 8.25 | M67: -6.0000000000000001e-003 | N67: 16 | O67: 1.6e-002 | P67: 115.1 | Q67: 8.88 | R67: 1.61 | S67: 92.91 | T67: 0.17699999999999999 | U67: 转股中 | V67: 5年22天 | W67: 3年22天 | X67: 0.24100000000000002 | Y67: 0.22399999999999998 | Z67: 8.8 | AA67: 36 | AB67: 1.0500000000000001e-002 | AC67: 5.0000000000000001e-003 | AD67: -1.67e-002 | AE67: -1.8799999999999997e-002 | AF67: 89.91 | AG67: 92.35 | AH67: 0.53 | AI67: AA | AJ67: 4.5400000000000003e-002 | AK67: =I67+100*T67 -> 127.01000000000001 | AL67: 125.7 | AM67: 34 | AN67: 33.4 | AO67: 40 | AP67: -2.2000000000000002e-002 | AQ67: 31 | AR67: 白电转债
A68: 10 | B68: 嘉泽转债! | C68: 113039 | D68: 44091. | E68: 嘉泽新能 | F68: 601619 | G68: 能源电力 | H68: 风能 | I68: 106.62 | J68: -3.9000000000000003e-003 | K68: 2.2000000000000001e-003 | L68: 3.23 | M68: -3.0999999999999999e-003 | N68: 28 | O68: 2.e-002 | P68: 113.1 | Q68: 3.57 | R68: 2 | S68: 90.48 | T68: 0.17800000000000002 | U68: 4月8天 | V68: 5.83年 | W68: 3.83年 | X68: 0.19399999999999998 | Y68: 0.17600000000000002 | Z68: 13 | AA68: 67 | AB68: 1.03e-002 | AC68: 6.1999999999999998e-003 | AD68: -7.1999999999999998e-003 | AE68: -8.8999999999999999e-003 | AF68: 86.87 | AG68: 87.7 | AH68: 0.55 | AI68: AA | AJ68: 4.5400000000000003e-002 | AK68: =I68+100*T68 -> 124.42 | AL68: 122.8 | AM68: 16 | AN68: 35.1 | AO68: 52 | AP68: 1.e-003 | AQ68: 10 | AR68: 嘉泽转债!
A69: 159 | B69: 金力转债! | C69: 123033 | D69: 43794. | E69: 金力永磁 | F69: 300748 | G69: 电子 | H69: 元器件制 | I69: 116.1 | J69: -4.07e-002 | K69: 1.9799999999999998e-002 | L69: 38.41 | M69: -3.49e-002 | N69: 168 | O69: 0.318 | P69: 121.9 | Q69: 40.97 | R69: 12.52 | S69: 93.75 | T69: 0.23800000000000002 | U69: 转股中 | V69: 5年8天 | W69: 3年8天 | X69: 2.7000000000000003e-002 | Y69: 2.6000000000000002e-002 | Z69: 4.35 | AA69: 160 | AB69: 1.e-002 | AC69: 2.5000000000000001e-003 | AD69: -3.0299999999999997e-002 | AE69: -3.3399999999999999e-002 | AF69: 86.17 | AG69: 89.14 | AH69: 0.6 | AI69: AA- | AJ69: 6.6400000000000001e-002 | AK69: =I69+100*T69 -> 139.90000000000001 | AL69: 138.4 | AM69: 160 | AN69: 49.3 | AO69: 179 | AP69: -5.2000000000000005e-002 | AQ69: 25 | AR69: 金力转债!
A70: 197 | B70: 核建转债! | C70: 113024 | D70: 43581. | E70: 中国核建 | F70: 601611 | G70: 建筑 | H70: 建筑工程 | I70: 105.08 | J70: -2.9999999999999997e-004 | K70: 1.2e-002 | L70: 7.87 | M70: 3.4200000000000001e-002 | N70: 31 | O70: 1.e-002 | P70: 109.7 | Q70: 9.76 | R70: 2.02 | S70: 80.64 | T70: 0.30299999999999999 | U70: 转股中 | V70: 4.46年 | W70: 2.46年 | X70: 0.14400000000000002 | Y70: 0.11599999999999999 | Z70: 30 | AA70: 209 | AB70: 9.8999999999999991e-003 | AC70: 5.7999999999999996e-003 | AD70: -6.8999999999999999e-003 | AE70: -9.300000000000001e-003 | AF70: 93.67 | AG70: 93.21 | AH70: 0.34 | AI70: AAA | AJ70: 3.7999999999999999e-002 | AK70: =I70+100*T70 -> 135.38 | AL70: 129.5 | AM70: 67 | AN70: 35.9 | AO70: 59 | AP70: 4.4000000000000004e-002 | AQ70: 43 | AR70: 核建转债!
A71: 211 | B71: 苏银转债! | C71: 110053 | D71: 43558. | E71: 江苏银行 | F71: 600919 | G71: 金融 | H71: 银行行业 | I71: 114.43 | J71: 8.9999999999999998e-004 | K71: 2.7000000000000001e-003 | L71: 6.4 | M71: 9.4999999999999998e-003 | N71: 268 | O71: 1.2e-002 | P71: 119.1 | Q71: 7.28 | R71: 0.64 | S71: 87.91 | T71: 0.30199999999999999 | U71: 转股中 | V71: 4.39年 | W71: 无权 | X71: 0.27100000000000002 | Y71: 0.23800000000000002 | Z71: 200 | AA71: 739 | AB71: 9.3999999999999986e-003 | AC71: 1.7000000000000001e-003 | AD71: 无权 | AE71: 无权 | AF71: 无权 | AG71: 101.64 | AH71: 0.38 | AI71: AAA | AJ71: 3.7999999999999999e-002 | AK71: =I71+100*T71 -> 144.63 | AL71: 140.9 | AM71: 192 | AN71: 39.3 | AO71: 100 | AP71: 1.4999999999999999e-002 | AQ71: 46 | AR71: 苏银转债!
A72: 15 | B72: 广汇转债 | C72: 110072 | D72: 44089. | E72: 广汇汽车 | F72: 600297 | G72: 汽车 | H72: 分销、售 | I72: 108.49 | J72: -5.1000000000000004e-003 | K72: 3.5999999999999999e-003 | L72: 3.87 | M72: -2.5999999999999999e-003 | N72: 278 | O72: 7.4999999999999997e-002 | P72: 114.5 | Q72: 4.03 | R72: 0.81 | S72: 96.03 | T72: 0.13 | U72: 4月3天 | V72: 5.82年 | W72: 3.82年 | X72: 0.107 | Y72: 0.10300000000000001 | Z72: 33.7 | AA72: 314 | AB72: 9.3999999999999986e-003 | AC72: 4.8999999999999998e-003 | AD72: -1.3000000000000001e-002 | AE72: -1.4499999999999999e-002 | AF72: 87.05 | AG72: 89.74 | AH72: 0.58 | AI72: AA+ | AJ72: 4.3400000000000001e-002 | AK72: =I72+100*T72 -> 121.48999999999999 | AL72: 121 | AM72: 9 | AN72: 31.2 | AO72: 23 | AP72: 9.6000000000000002e-002 | AQ72: 15 | AR72: 广汇转债
A73: 97 | B73: 利群转债! | C73: 113033 | D73: 43942. | E73: 利群股份 | F73: 601366 | G73: 商业零售 | H73: 商场 | I73: 109.72 | J73: 4.0000000000000002e-004 | K73: 4.6999999999999993e-003 | L73: 6.62 | M73: 9.1000000000000004e-003 | N73: 10 | O73: 5.0000000000000001e-003 | P73: 115.3 | Q73: 7.01 | R73: 1.29 | S73: 94.44 | T73: 0.16200000000000001 | U73: 转股中 | V73: 5.44年 | W73: 3.44年 | X73: 0.316 | Y73: 0.29799999999999999 | Z73: 18 | AA73: 57 | AB73: 9.300000000000001e-003 | AC73: 4.3e-003 | AD73: -1.54e-002 | AE73: -1.7399999999999999e-002 | AF73: 88.6 | AG73: 91.02 | AH73: 0.56 | AI73: AA | AJ73: 4.5400000000000003e-002 | AK73: =I73+100*T73 -> 125.92 | AL73: 125 | AM73: 26 | AN73: 34 | AO73: 44 | AP73: -3.6000000000000004e-002 | AQ73: 36 | AR73: 利群转债!
A74: 112 | B74: 百达转债 | C74: 113570 | D74: 43929. | E74: 百达精工 | F74: 603331 | G74: 机械装备 | H74: 机械装备 | I74: 109.85 | J74: -9.7999999999999997e-003 | K74: 9.1999999999999998e-003 | L74: 10.71 | M74: -8.9999999999999998e-004 | N74: 34 | O74: 0.109 | P74: 115.3 | Q74: 11.54 | R74: 1.75 | S74: 92.81 | T74: 0.184 | U74: 转股中 | V74: 5.38年 | W74: 3.38年 | X74: 0.14599999999999999 | Y74: 0.13600000000000001 | Z74: 2.8 | AA74: 19 | AB74: 9.1999999999999998e-003 | AC74: 4.0999999999999995e-003 | AD74: -1.6e-002 | AE74: -1.8000000000000002e-002 | AF74: 79.92 | AG74: 77.88 | AH74: 0.7 | AI74: A+ | AJ74: 7.7399999999999997e-002 | AK74: =I74+100*T74 -> 128.25 | AL74: 126.9 | AM74: 42 | AN74: 47 | AO74: 159 | AP74: -1.1000000000000001e-002 | AQ74: 33 | AR74: 百达转债
A75: 251 | B75: 湖广转债! | C75: 127007 | D75: 43313. | E75: 湖北广电 | F75: 665 | G75: 传媒娱乐 | H75: 影视娱乐 | I75: 108.9 | J75: -2.2499999999999999e-002 | K75: 2.3399999999999997e-002 | L75: 5.17 | M75: 1.9e-003 | N75: 36 | O75: 2.7000000000000003e-002 | P75: 112.3 | Q75: 5.58 | R75: 0.78 | S75: 92.65 | T75: 0.17499999999999999 | U75: 转股中 | V75: 3.68年 | W75: 1.68年 | X75: 0.23999999999999999 | Y75: 0.222 | Z75: 12.2 | AA75: 51 | AB75: 8.6e-003 | AC75: 2.3999999999999998e-003 | AD75: -3.1e-002 | AE75: -3.3799999999999997e-002 | AF75: 95.51 | AG75: 97.15 | AH75: 0.46 | AI75: AA+ | AJ75: 4.0999999999999995e-002 | AK75: =I75+100*T75 -> 126.40000000000001 | AL75: 125.1 | AM75: 28 | AN75: 28 | AO75: 14 | AP75: 2.e-002 | AQ75: 17 | AR75: 湖广转债!
A76: 196 | B76: 鼎胜转债! | C76: 113534 | D76: 43585. | E76: 鼎胜新材 | F76: 603876 | G76: 有色金属 | H76: 小金属 | I76: 110.71 | J76: -2.3e-003 | K76: -1.5e-003 | L76: 13.31 | M76: -8.8999999999999999e-003 | N76: 3.7 | O76: 3.0000000000000001e-003 | P76: 114.9 | Q76: 15.18 | R76: 1.6 | S76: 87.68 | T76: 0.26300000000000001 | U76: 转股中 | V76: 4.46年 | W76: 2.46年 | X76: 0.20800000000000002 | Y76: 0.182 | Z76: 12 | AA76: 58 | AB76: 8.5000000000000006e-003 | AC76: 2.5000000000000001e-003 | AD76: -2.5899999999999999e-002 | AE76: -2.8399999999999998e-002 | AF76: 92.69 | AG76: 95.6 | AH76: 0.42 | AI76: AA | AJ76: 4.2999999999999997e-002 | AK76: =I76+100*T76 -> 137.00999999999999 | AL76: 133.7 | AM76: 120 | AN76: 38.1 | AO76: 86 | AP76: -2.6000000000000002e-002 | AQ76: 30 | AR76: 鼎胜转债!
A77: 242 | B77: 苏农转债! | C77: 113516 | D77: 43332. | E77: 苏农银行 | F77: 603323 | G77: 金融 | H77: 银行行业 | I77: 110.8 | J77: 1.4000000000000002e-003 | K77: -2.0999999999999999e-003 | L77: 4.8 | M77: -2.0999999999999999e-003 | N77: 49 | O77: 3.4000000000000002e-002 | P77: 114.3 | Q77: 5.52 | R77: 0.75 | S77: 86.96 | T77: 0.27399999999999997 | U77: 转股中 | V77: 3.77年 | W77: 无权 | X77: 0.14899999999999999 | Y77: 0.13 | Z77: 12.9 | AA77: 87 | AB77: 8.3999999999999995e-003 | AC77: 1.5e-003 | AD77: 无权 | AE77: 无权 | AF77: 无权 | AG77: 98.49 | AH77: 0.37 | AI77: AA+ | AJ77: 4.0999999999999995e-002 | AK77: =I77+100*T77 -> 138.19999999999999 | AL77: 134.6 | AM77: 132 | AN77: 36.2 | AO77: 63 | AP77: 2.1000000000000001e-002 | AQ77: 36 | AR77: 苏农转债!
A78: 31 | B78: 紫银转债 | C78: 113037 | D78: 44060. | E78: 紫金银行 | F78: 601860 | G78: 金融 | H78: 银行行业 | I78: 110.46 | J78: 5.0000000000000001e-004 | K78: -5.0000000000000001e-004 | L78: 4.14 | M78: 0. | N78: 114 | O78: 2.3e-002 | P78: 115.8 | Q78: 4.75 | R78: 1.1 | S78: 87.16 | T78: 0.26700000000000002 | U78: 3月7天 | V78: 5.75年 | W78: 无权 | X78: 0.29699999999999999 | Y78: 0.25900000000000001 | Z78: 45 | AA78: 152 | AB78: 8.3999999999999995e-003 | AC78: 3.4999999999999996e-003 | AD78: 无权 | AE78: 无权 | AF78: 无权 | AG78: 91.15 | AH78: 0.48 | AI78: AA+ | AJ78: 4.3400000000000001e-002 | AK78: =I78+100*T78 -> 137.16 | AL78: 133.8 | AM78: 121 | AN78: 42.6 | AO78: 126 | AP78: -8.0000000000000002e-003 | AQ78: 15 | AR78: 紫银转债
A79: 37 | B79: 沪工转债 | C79: 113593 | D79: 44053. | E79: 上海沪工 | F79: 603131 | G79: 机械装备 | H79: 通用设备 | I79: 116.11 | J79: -3.2000000000000002e-003 | K79: 6.9999999999999993e-003 | L79: 22.39 | M79: 4.8999999999999998e-003 | N79: 61 | O79: 0.129 | P79: 121.6 | Q79: 21.32 | R79: 5.77 | S79: 105.02 | T79: 0.106 | U79: 3月3天 | V79: 5.74年 | W79: 3.74年 | X79: 5.5999999999999994e-002 | Y79: 5.9000000000000004e-002 | Z79: 4 | AA79: 71 | AB79: 8.3000000000000001e-003 | AC79: 1.8e-003 | AD79: -2.6600000000000002e-002 | AE79: -2.8799999999999999e-002 | AF79: 78.43 | AG79: 80.05 | AH79: 0.77 | AI79: A+ | AJ79: 7.7399999999999997e-002 | AK79: =I79+100*T79 -> 126.70999999999999 | AL79: 127.2 | AM79: 43 | AN79: 47.2 | AO79: 162 | AP79: 0.10099999999999999 | AQ79: 5 | AR79: 沪工转债
A80: 35 | B80: 淳中转债 | C80: 113594 | D80: 44071. | E80: 淳中科技 | F80: 603516 | G80: 电子 | H80: 电子产品 | I80: 115.86 | J80: -1.9799999999999998e-002 | K80: 8.0000000000000004e-004 | L80: 35.46 | M80: -2.9600000000000001e-002 | N80: 16 | O80: 4.5999999999999999e-002 | P80: 121.4 | Q80: 39.37 | R80: 5.57 | S80: 90.07 | T80: 0.28600000000000003 | U80: 3月5天 | V80: 5.74年 | W80: 3.74年 | X80: 6.3e-002 | Y80: 5.7000000000000002e-002 | Z80: 3 | AA80: 47 | AB80: 8.3000000000000001e-003 | AC80: 1.9e-003 | AD80: -2.6200000000000001e-002 | AE80: -2.8300000000000002e-002 | AF80: 78.42 | AG80: 79.92 | AH80: 0.64 | AI80: A+ | AJ80: 7.7399999999999997e-002 | AK80: =I80+100*T80 -> 144.46000000000001 | AL80: 141.7 | AM80: 198 | AN80: 61.7 | AO80: 239 | AP80: 2.5000000000000001e-002 | AQ80: 4 | AR80: 淳中转债
A81: 205 | B81: 招路转债! | C81: 127012 | D81: 43585. | E81: 招商公路 | F81: 1965 | G81: 机场高速 | H81: 高速 | I81: 104.417 | J81: -2.8000000000000004e-003 | K81: 3.2000000000000002e-003 | L81: 6.87 | M81: 1.5e-003 | N81: 6.6 | O81: 1.e-003 | P81: 108.2 | Q81: 8.81 | R81: 0.9 | S81: 77.98 | T81: 0.33899999999999997 | U81: 转股中 | V81: 4.41年 | W81: 2.41年 | X81: 0.11800000000000001 | Y81: 9.1999999999999998e-002 | Z81: 50 | AA81: 424 | AB81: 8.199999999999999e-003 | AC81: 4.6999999999999993e-003 | AD81: -9.300000000000001e-003 | AE81: -1.0800000000000001e-002 | AF81: 92.67 | AG81: 91.99 | AH81: 0.3 | AI81: AAA | AJ81: 3.7999999999999999e-002 | AK81: =I81+100*T81 -> 138.31700000000001 | AL81: 130.9 | AM81: 90 | AN81: 38.2 | AO81: 88 | AP81: 6.0000000000000001e-003 | AQ81: 36 | AR81: 招路转债!
A82: 51 | B82: 瑞达转债 | C82: 128116 | D82: 44036. | E82: 瑞达期货 | F82: 2961 | G82: 金融 | H82: 期货行业 | I82: 110.3 | J82: -2.0999999999999999e-003 | K82: -9.8999999999999991e-003 | L82: 27.1 | M82: -2.2400000000000003e-002 | N82: 13 | O82: 1.8000000000000002e-002 | P82: 115.3 | Q82: 29.82 | R82: 7.09 | S82: 90.88 | T82: 0.214 | U82: 2月12天 | V82: 5.68年 | W82: 3.68年 | X82: 5.4000000000000006e-002 | Y82: 4.9000000000000002e-002 | Z82: 6.5 | AA82: 121 | AB82: 8.0000000000000002e-003 | AC82: 3.0999999999999999e-003 | AD82: -1.6e-002 | AE82: -1.78e-002 | AF82: 87.57 | AG82: 90.03 | AH82: 0.53 | AI82: AA | AJ82: 4.5400000000000003e-002 | AK82: =I82+100*T82 -> 131.69999999999999 | AL82: 129.7 | AM82: 70 | AN82: 39.7 | AO82: 108 | AP82: -5.7999999999999996e-002 | AQ82: 8 | AR82: 瑞达转债
A83: 40 | B83: 银信转债 | C83: 123059 | D83: 44055. | E83: 银信科技 | F83: 300231 | G83: 计算机及 | H83: 软件开发 | I83: 119 | J83: -3.0899999999999997e-002 | K83: 2.0299999999999999e-002 | L83: 11.03 | M83: -1.43e-002 | N83: 186 | O83: 0.37799999999999995 | P83: 124.1 | Q83: 9.91 | R83: 3.85 | S83: 111.3 | T83: 6.9000000000000006e-002 | U83: 2月29天 | V83: 5.72年 | W83: 3.72年 | X83: 8.0000000000000002e-002 | Y83: 8.900000000000001e-002 | Z83: 3.91 | AA83: 49 | AB83: 7.4999999999999997e-003 | AC83: 4.0000000000000002e-004 | AD83: -3.4300000000000004e-002 | AE83: -3.6200000000000003e-002 | AF83: 81.21 | AG83: 86.53 | AH83: 0.74 | AI83: AA- | AJ83: 6.6400000000000001e-002 | AK83: =I83+100*T83 -> 125.90000000000001 | AL83: 126.7 | AM83: 41 | AN83: 40.2 | AO83: 113 | AP83: 2.7000000000000003e-002 | AQ83: 9 | AR83: 银信转债
A84: 24 | B84: 大禹转债 | C84: 123063 | D84: 44063. | E84: 大禹节水 | F84: 300021 | G84: 化工 | H84: 橡胶塑料 | I84: 121.309 | J84: -3.1099999999999999e-002 | K84: 1.37e-002 | L84: 5.83 | M84: -2.18e-002 | N84: 244 | O84: 0.30299999999999999 | P84: 126.5 | Q84: 4.94 | R84: 3.27 | S84: 118.02 | T84: 2.7999999999999997e-002 | U84: 3月12天 | V84: 5.76年 | W84: 4.76年 | X84: 0.13699999999999998 | Y84: 0.16200000000000001 | Z84: 6.38 | AA84: 46 | AB84: 7.4000000000000003e-003 | AC84: -2.0000000000000001e-004 | AD84: -2.5499999999999998e-002 | AE84: -2.81e-002 | AF84: 78.38 | AG84: 88.03 | AH84: 0.8 | AI84: AA- | AJ84: 6.6400000000000001e-002 | AK84: =I84+100*T84 -> 124.10899999999999 | AL84: 124.6 | AM84: 22 | AN84: 36.6 | AO84: 70 | AP84: 2.1000000000000001e-002 | AQ84: 13 | AR84: 大禹转债
A85: 163 | B85: 北方转债 | C85: 127014 | D85: 43790. | E85: 北方国际 | F85: 65 | G85: 建筑 | H85: 建筑工程 | I85: 111.614 | J85: -2.2000000000000001e-003 | K85: 2.2000000000000001e-003 | L85: 7.56 | M85: 0. | N85: 13 | O85: 2.e-002 | P85: 115.6 | Q85: 8.75 | R85: 1.17 | S85: 86.4 | T85: 0.29199999999999998 | U85: 转股中 | V85: 5年0.1天 | W85: 3年0.1天 | X85: 9.9000000000000005e-002 | Y85: 8.5999999999999993e-002 | Z85: 5.78 | AA85: 58 | AB85: 7.1999999999999998e-003 | AC85: 1.6000000000000001e-003 | AD85: -2.2099999999999998e-002 | AE85: -2.4500000000000001e-002 | AF85: 91.18 | AG85: 93.96 | AH85: 0.43 | AI85: AA+ | AJ85: 4.3400000000000001e-002 | AK85: =I85+100*T85 -> 140.81399999999999 | AL85: 136.8 | AM85: 149 | AN85: 42.9 | AO85: 128 | AP85: -1.1000000000000001e-002 | AQ85: 17 | AR85: 北方转债
A86: 38 | B86: 联诚转债 | C86: 128120 | D86: 44060. | E86: 联诚精密 | F86: 2921 | G86: 汽车 | H86: 零部件制 | I86: 114.1 | J86: -2.8999999999999998e-003 | K86: -1.5e-003 | L86: 23.2 | M86: -6.0000000000000001e-003 | N86: 166 | O86: 0.54500000000000004 | P86: 118.4 | Q86: 24.37 | R86: 2.68 | S86: 95.2 | T86: 0.19899999999999998 | U86: 3月3天 | V86: 5.73年 | W86: 3.73年 | X86: 0.13699999999999998 | Y86: 0.13100000000000001 | Z86: 2.6 | AA86: 19 | AB86: 6.6e-003 | AC86: 1.e-003 | AD86: -2.2400000000000003e-002 | AE86: -2.46e-002 | AF86: 75.75 | AG86: 74.11 | AH86: 0.73 | AI86: A | AJ86: 8.7400000000000005e-002 | AK86: =I86+100*T86 -> 134. | AL86: 133 | AM86: 110 | AN86: 57.3 | AO86: 227 | AP86: 7.400000000000001e-002 | AQ86: 9 | AR86: 联诚转债
A87: 148 | B87: 鹰19转债 | C87: 110063 | D87: 43833. | E87: 山鹰纸业 | F87: 600567 | G87: 造纸包装 | H87: 包装用纸 | I87: 112.49 | J87: -4.5000000000000005e-003 | K87: -5.0000000000000001e-004 | L87: 3.15 | M87: -9.3999999999999986e-003 | N87: 4.1 | O87: 2.e-003 | P87: 116.2 | Q87: 3.3 | R87: 1.02 | S87: 95.45 | T87: 0.17800000000000002 | U87: 转股中 | V87: 5年50天 | W87: 3年50天 | X87: 0.128 | Y87: 0.12300000000000001 | Z87: 18.6 | AA87: 145 | AB87: 6.5000000000000006e-003 | AC87: 8.0000000000000004e-004 | AD87: -2.5000000000000001e-002 | AE87: -2.7000000000000003e-002 | AF87: 90.1 | AG87: 93.81 | AH87: 0.54 | AI87: AA+ | AJ87: 4.3400000000000001e-002 | AK87: =I87+100*T87 -> 130.28999999999999 | AL87: 129.5 | AM87: 68 | AN87: 35.7 | AO87: 58 | AP87: -3.0000000000000001e-003 | AQ87: 40 | AR87: 鹰19转债
A88: 149 | B88: 新北转债! | C88: 128083 | D88: 43830. | E88: 新北洋 | F88: 2376 | G88: 电子 | H88: 电子产品 | I88: 111.8 | J88: -6.9999999999999993e-003 | K88: 1.8e-003 | L88: 10 | M88: -1.1899999999999999e-002 | N88: 7 | O88: 6.9999999999999993e-003 | P88: 115.2 | Q88: 11.7 | R88: 2.01 | S88: 85.47 | T88: 0.308 | U88: 转股中 | V88: 5年49天 | W88: 3年49天 | X88: 0.13200000000000001 | Y88: 0.113 | Z88: 8.77 | AA88: 67 | AB88: 6.0000000000000001e-003 | AC88: 5.9999999999999995e-004 | AD88: -2.2799999999999997e-002 | AE88: -2.4799999999999999e-002 | AF88: 89.71 | AG88: 92.15 | AH88: 0.44 | AI88: AA | AJ88: 4.5400000000000003e-002 | AK88: =I88+100*T88 -> 142.59999999999999 | AL88: 138.1 | AM88: 159 | AN88: 46 | AO88: 152 | AP88: -1.2e-002 | AQ88: 16 | AR88: 新北转债!
A89: 238 | B89: 长久转债! | C89: 113519 | D89: 43434. | E89: 长久物流 | F89: 603569 | G89: 交通运输 | H89: 物流业 | I89: 117.37 | J89: 8.6999999999999994e-003 | K89: 3.0999999999999999e-003 | L89: 10.99 | M89: 2.4199999999999999e-002 | N89: 15 | O89: 1.8000000000000002e-002 | P89: 120.1 | Q89: 11.15 | R89: 2.94 | S89: 98.57 | T89: 0.191 | U89: 转股中 | V89: 4年14天 | W89: 2年14天 | X89: 0.113 | Y89: 0.11199999999999999 | Z89: 6.97 | AA89: 62 | AB89: 5.7999999999999996e-003 | AC89: -2.8000000000000004e-003 | AD89: -5.57e-002 | AE89: -5.8600000000000006e-002 | AF89: 94.54 | AG89: 101.72 | AH89: 0.48 | AI89: AA | AJ89: 4.2999999999999997e-002 | AK89: =I89+100*T89 -> 136.47 | AL89: 136.2 | AM89: 146 | AN89: 34.5 | AO89: 47 | AP89: 7.2999999999999995e-002 | AQ89: 17 | AR89: 长久转债!
A90: 36 | B90: 中金转债 | C90: 127020 | D90: 44057. | E90: 中金岭南 | F90: 60 | G90: 有色金属 | H90: 有色行业 | I90: 110.01 | J90: -4.4000000000000003e-003 | K90: 4.4000000000000003e-003 | L90: 4.22 | M90: 0. | N90: 29 | O90: 6.9999999999999993e-003 | P90: 113.7 | Q90: 4.71 | R90: 1.36 | S90: 89.6 | T90: 0.22800000000000001 | U90: 3月3天 | V90: 5.74年 | W90: 3.74年 | X90: 0.252 | Y90: 0.22600000000000001 | Z90: 38 | AA90: 151 | AB90: 5.7999999999999996e-003 | AC90: 1.5e-003 | AD90: -1.8200000000000001e-002 | AE90: -1.9400000000000001e-002 | AF90: 86.87 | AG90: 89.37 | AH90: 0.52 | AI90: AA+ | AJ90: 4.3400000000000001e-002 | AK90: =I90+100*T90 -> 132.81 | AL90: 130.4 | AM90: 78 | AN90: 41 | AO90: 116 | AP90: -1.8000000000000002e-002 | AQ90: 11 | AR90: 中金转债
A91: 170 | B91: 游族转债!! | C91: 128074 | D91: 43759. | E91: 游族网络 | F91: 2174 | G91: 通信互联 | H91: 互联网 | I91: 116.7 | J91: 3.0000000000000001e-003 | K91: -1.0700000000000001e-002 | L91: 15.77 | M91: -1.38e-002 | N91: 27 | O91: 3.3000000000000002e-002 | P91: 119.9 | Q91: 16.97 | R91: 2.56 | S91: 92.93 | T91: 0.25600000000000001 | U91: 转股中 | V91: 4.92年 | W91: 2.92年 | X91: 4.7e-002 | Y91: 4.4000000000000004e-002 | Z91: 6.83 | AA91: 144 | AB91: 5.6000000000000008e-003 | AC91: -1.4000000000000002e-003 | AD91: -3.8800000000000001e-002 | AE91: -4.0800000000000003e-002 | AF91: 90.92 | AG91: 97.84 | AH91: 0.56 | AI91: AA | AJ91: 4.2999999999999997e-002 | AK91: =I91+100*T91 -> 142.30000000000001 | AL91: 140.5 | AM91: 183 | AN91: 42.6 | AO91: 127 | AP91: -0.11 | AQ91: 21 | AR91: 游族转债!!
A92: 100 | B92: 龙净转债! | C92: 110068 | D92: 43936. | E92: 龙净环保 | F92: 600388 | G92: 城市公用 | H92: 三废处理 | I92: 111.65 | J92: -2.5000000000000001e-003 | K92: -3.9000000000000003e-003 | L92: 9.42 | M92: -1.3600000000000001e-002 | N92: 2.3 | O92: 1.e-003 | P92: 115 | Q92: 10.73 | R92: 1.87 | S92: 87.79 | T92: 0.27200000000000002 | U92: 转股中 | V92: 5.41年 | W92: 3.41年 | X92: 0.19899999999999998 | Y92: 0.17399999999999999 | Z92: 20 | AA92: 101 | AB92: 5.6000000000000008e-003 | AC92: 5.9999999999999995e-004 | AD92: -2.1099999999999997e-002 | AE92: -2.29e-002 | AF92: 89 | AG92: 91.75 | AH92: 0.47 | AI92: AA+ | AJ92: 4.3400000000000001e-002 | AK92: =I92+100*T92 -> 138.85000000000002 | AL92: 135.5 | AM92: 142 | AN92: 43.8 | AO92: 134 | AP92: -4.0000000000000001e-002 | AQ92: 29 | AR92: 龙净转债!
A93: 294 | B93: 洪涛转债! | C93: 128013 | D93: 42605. | E93: 洪涛股份 | F93: 2325 | G93: 建筑 | H93: 装饰工程 | I93: 108.76 | J93: -1.1299999999999999e-002 | K93: -1.7000000000000001e-003 | L93: 3.05 | M93: -2.5600000000000001e-002 | N93: 38 | O93: 2.8999999999999998e-002 | P93: 109.8 | Q93: 3.1 | R93: 1.24 | S93: 98.39 | T93: 0.105 | U93: 转股中 | V93: 1.76年 | W93: 回售中 | X93: 0.315 | Y93: 0.309 | Z93: 12 | AA93: 38 | AB93: 5.5000000000000005e-003 | AC93: -4.7999999999999996e-003 | AD93: 回售中 | AE93: 回售中 | AF93: 100.3 | AG93: 98.6 | AH93: 0.51 | AI93: AA- | AJ93: 6.3600000000000004e-002 | AK93: =I93+100*T93 -> 119.26000000000001 | AL93: 119.1 | AM93: 7 | AN93: 18.8 | AO93: 2 | AP93: -3.9e-002 | AQ93: 90 | AR93: 洪涛转债!
A94: 121 | B94: 天目转债 | C94: 113564 | D94: 43906. | E94: 天目湖 | F94: 603136 | G94: 旅游餐饮 | H94: 旅游 | I94: 123.17 | J94: -3.2500000000000001e-002 | K94: 2.4300000000000002e-002 | L94: 25.77 | M94: -1.15e-002 | N94: 12 | O94: 3.2000000000000001e-002 | P94: 126.7 | Q94: 23.8 | R94: 3.35 | S94: 108.28 | T94: 0.13800000000000001 | U94: 转股中 | V94: 5.35年 | W94: 3.35年 | X94: 0.10000000000000001 | Y94: 0.109 | Z94: 3 | AA94: 30 | AB94: 5.4000000000000003e-003 | AC94: -2.8000000000000004e-003 | AD94: -4.5899999999999996e-002 | AE94: -4.8300000000000003e-002 | AF94: 83.72 | AG94: 90.57 | AH94: 0.71 | AI94: AA- | AJ94: 6.6400000000000001e-002 | AK94: =I94+100*T94 -> 136.97 | AL94: 138.1 | AM94: 157 | AN94: 47.5 | AO94: 166 | AP94: -4.5999999999999999e-002 | AQ94: 12 | AR94: 天目转债
A95: 7 | B95: 景兴转债 | C95: 128130 | D95: 44092. | E95: 景兴纸业 | F95: 2067 | G95: 造纸包装 | H95: 包装用纸 | I95: 111.77 | J95: -3.2000000000000002e-003 | K95: -7.4999999999999997e-003 | L95: 3.33 | M95: -1.77e-002 | N95: 21 | O95: 1.4999999999999999e-002 | P95: 115.1 | Q95: 3.4 | R95: 0.84 | S95: 97.94 | T95: 0.14099999999999999 | U95: 4月11天 | V95: 5.85年 | W95: 3.85年 | X95: 0.34600000000000003 | Y95: 0.33899999999999997 | Z95: 12.8 | AA95: 37 | AB95: 5.1000000000000004e-003 | AC95: 5.0000000000000001e-004 | AD95: -1.8799999999999997e-002 | AE95: -2.0499999999999997e-002 | AF95: 86.79 | AG95: 89.16 | AH95: 0.61 | AI95: AA | AJ95: 4.5400000000000003e-002 | AK95: =I95+100*T95 -> 125.86999999999999 | AL95: 125.6 | AM95: 33 | AN95: 36.4 | AO95: 66 | AP95: -4.0999999999999995e-002 | AQ95: 8 | AR95: 景兴转债
A96: 98 | B96: 华体转债! | C96: 113574 | D96: 43948. | E96: 华体科技 | F96: 603679 | G96: 城市公用 | H96: 城市公用 | I96: 113.39 | J96: 3.39e-002 | K96: -4.6500000000000007e-002 | L96: 23.16 | M96: -3.6200000000000003e-002 | N96: 143 | O96: 0.56000000000000005 | P96: 116.4 | Q96: 33.99 | R96: 3.32 | S96: 68.14 | T96: 0.66400000000000003 | U96: 转股中 | V96: 5.43年 | W96: 3.43年 | X96: 6.3e-002 | Y96: 4.2999999999999997e-002 | Z96: 2.09 | AA96: 33 | AB96: 4.8999999999999998e-003 | AC96: -4.0000000000000002e-004 | AD96: -2.2499999999999999e-002 | AE96: -2.4900000000000002e-002 | AF96: 80.23 | AG96: 78.44 | AH96: 0.35 | AI96: A+ | AJ96: 7.7399999999999997e-002 | AK96: =I96+100*T96 -> 179.79000000000002 | AL96: 158.6 | AM96: 255 | AN96: 78.4 | AO96: 262 | AP96: -3.9e-002 | AQ96: 12 | AR96: 华体转债!
A97: 190 | B97: 亚泰转债! | C97: 128066 | D97: 43599. | E97: 郑中设计 | F97: 2811 | G97: 建筑 | H97: 装饰工程 | I97: 115.1 | J97: -2.5000000000000001e-003 | K97: -1.e-003 | L97: 10.45 | M97: -4.7999999999999996e-003 | N97: 33 | O97: 5.9000000000000004e-002 | P97: 117.5 | Q97: 9.67 | R97: 1.93 | S97: 108.07 | T97: 6.5000000000000002e-002 | U97: 转股中 | V97: 4.48年 | W97: 2.48年 | X97: 0.17000000000000001 | Y97: 0.184 | Z97: 4.8 | AA97: 28 | AB97: 4.6999999999999993e-003 | AC97: -2.2000000000000001e-003 | AD97: -3.8599999999999995e-002 | AE97: -4.1299999999999996e-002 | AF97: 88.3 | AG97: 89.58 | AH97: 0.74 | AI97: AA- | AJ97: 6.4000000000000001e-002 | AK97: =I97+100*T97 -> 121.59999999999999 | AL97: 122.1 | AM97: 14 | AN97: 32.6 | AO97: 34 | AP97: 4.0000000000000001e-003 | AQ97: 58 | AR97: 亚泰转债!
A98: 208 | B98: 亨通转债! | C98: 110056 | D98: 43571. | E98: 亨通光电 | F98: 600487 | G98: 通信互联 | H98: 通信设备 | I98: 112.71 | J98: -1.1599999999999999e-002 | K98: 4.5999999999999999e-003 | L98: 15.21 | M98: -1.3000000000000001e-002 | N98: 14 | O98: 6.9999999999999993e-003 | P98: 114.8 | Q98: 15.58 | R98: 2.04 | S98: 97.63 | T98: 0.155 | U98: 转股中 | V98: 4.40年 | W98: 2.40年 | X98: 5.7999999999999996e-002 | Y98: 5.5999999999999994e-002 | Z98: 17.1 | AA98: 297 | AB98: 4.3e-003 | AC98: -1.8e-003 | AD98: -3.3700000000000001e-002 | AE98: -3.61e-002 | AF98: 93.27 | AG98: 96.53 | AH98: 0.54 | AI98: AA+ | AJ98: 4.0999999999999995e-002 | AK98: =I98+100*T98 -> 128.20999999999998 | AL98: 127.8 | AM98: 53 | AN98: 31.3 | AO98: 25 | AP98: 9.0000000000000011e-003 | AQ98: 29 | AR98: 亨通转债!
A99: 86 | B99: 维尔转债 | C99: 123049 | D99: 43963. | E99: 维尔利 | F99: 300190 | G99: 城市公用 | H99: 三废处理 | I99: 122 | J99: -1.61e-002 | K99: 1.61e-002 | L99: 8.7 | M99: 0. | N99: 38 | O99: 3.3000000000000002e-002 | P99: 124.8 | Q99: 7.48 | R99: 1.66 | S99: 116.31 | T99: 4.9000000000000002e-002 | U99: 转股中 | V99: 5.47年 | W99: 3.47年 | X99: 0.13500000000000001 | Y99: 0.157 | Z99: 9.17 | AA99: 68 | AB99: 4.3e-003 | AC99: -3.3e-003 | AD99: -4.1599999999999998e-002 | AE99: -4.3899999999999995e-002 | AF99: 83.15 | AG99: 88.56 | AH99: 0.78 | AI99: AA- | AJ99: 6.6400000000000001e-002 | AK99: =I99+100*T99 -> 126.90000000000001 | AL99: 127.7 | AM99: 51 | AN99: 39.1 | AO99: 97 | AP99: -1.8000000000000002e-002 | AQ99: 12 | AR99: 维尔转债
A100: 17 | B100: 特发转2! | C100: 127021 | D100: 44078. | E100: 特发信息 | F100: 70 | G100: 通信互联 | H100: 通信设备 | I100: 111.002 | J100: -5.4000000000000003e-003 | K100: 1.5e-003 | L100: 10.03 | M100: -1.0800000000000001e-002 | N100: 23 | O100: 3.7999999999999999e-002 | P100: 113.3 | Q100: 12.33 | R100: 2.91 | S100: 81.35 | T100: 0.36499999999999999 | U100: 3月22天 | V100: 4.79年 | W100: 2.79年 | X100: 6.7000000000000004e-002 | Y100: 5.5e-002 | Z100: 5.5 | AA100: 82 | AB100: 4.3e-003 | AC100: -7.000000000000001e-004 | AD100: -2.8199999999999999e-002 | AE100: -2.9500000000000002e-002 | AF100: 90.17 | AG100: 92.84 | AH100: 0.36 | AI100: AA | AJ100: 4.2999999999999997e-002 | AK100: =I100+100*T100 -> 147.50200000000001 | AL100: 140.7 | AM100: 187 | AN100: 47.8 | AO100: 167 | AP100: -1.4999999999999999e-002 | AQ100: 4 | AR100: 特发转2!
A101: 183 | B101: 清水转债 | C101: 123028 | D101: 43661. | E101: 清水源 | F101: 300437 | G101: 城市公用 | H101: 三废处理 | I101: 119.5 | J101: -3.3e-003 | K101: 1.2699999999999999e-002 | L101: 13.44 | M101: 1.2800000000000001e-002 | N101: 124 | O101: 0.22399999999999998 | P101: 121.8 | Q101: 11.84 | R101: 1.95 | S101: 113.51 | T101: 5.2999999999999999e-002 | U101: 转股中 | V101: 4.65年 | W101: 2.65年 | X101: 0.155 | Y101: 0.17600000000000002 | Z101: 4.56 | AA101: 29 | AB101: 4.1999999999999997e-003 | AC101: -3.8e-003 | AD101: -4.6300000000000001e-002 | AE101: -4.9299999999999997e-002 | AF101: 88.12 | AG101: 91.97 | AH101: 0.73 | AI101: AA- | AJ101: 6.4000000000000001e-002 | AK101: =I101+100*T101 -> 124.8 | AL101: 125.5 | AM101: 31 | AN101: 33.5 | AO101: 42 | AP101: 2.7999999999999997e-002 | AQ101: 50 | AR101: 清水转债
A102: 82 | B102: 全筑转债 | C102: 113578 | D102: 43970. | E102: 全筑股份 | F102: 603030 | G102: 建筑 | H102: 装饰工程 | I102: 115.7 | J102: -1.9900000000000001e-002 | K102: 1.2e-002 | L102: 5.75 | M102: -1.2e-002 | N102: 107 | O102: 0.23499999999999999 | P102: 118.3 | Q102: 5.43 | R102: 1.4 | S102: 105.89 | T102: 9.3000000000000013e-002 | U102: 2.1天 | V102: 5.49年 | W102: 3.49年 | X102: 0.124 | Y102: 0.13100000000000001 | Z102: 3.84 | AA102: 31 | AB102: 4.0999999999999995e-003 | AC102: -1.7000000000000001e-003 | AD102: -2.9500000000000002e-002 | AE102: -3.1400000000000004e-002 | AF102: 88.4 | AG102: 93.16 | AH102: 0.65 | AI102: AA | AJ102: 4.5400000000000003e-002 | AK102: =I102+100*T102 -> 125. | AL102: 125.5 | AM102: 32 | AN102: 32.3 | AO102: 33 | AP102: -4.5999999999999999e-002 | AQ102: 10 | AR102: 全筑转债
A103: 26 | B103: 城地转债! | C103: 113596 | D103: 44063. | E103: 城地香江 | F103: 603887 | G103: 通信互联 | H103: 通信设备 | I103: 110.92 | J103: -1.6899999999999998e-002 | K103: 3.4999999999999996e-003 | L103: 23.83 | M103: -2.5399999999999999e-002 | N103: 6.2 | O103: 5.0000000000000001e-003 | P103: 113.5 | Q103: 29.21 | R103: 2.47 | S103: 81.58 | T103: 0.35999999999999999 | U103: 3月13天 | V103: 5.76年 | W103: 3.76年 | X103: 0.13400000000000001 | Y103: 0.109 | Z103: 12 | AA103: 90 | AB103: 4.0999999999999995e-003 | AC103: -2.0000000000000001e-004 | AD103: -1.6799999999999999e-002 | AE103: -1.8700000000000001e-002 | AF103: 80.87 | AG103: 78.97 | AH103: 0.53 | AI103: AA- | AJ103: 6.6400000000000001e-002 | AK103: =I103+100*T103 -> 146.92000000000002 | AL103: 140.3 | AM103: 180 | AN103: 59.4 | AO103: 233 | AP103: -3.3000000000000002e-002 | AQ103: 8 | AR103: 城地转债!
A104: 247 | B104: 德尔转债! | C104: 123011 | D104: 43326. | E104: 德尔股份 | F104: 300473 | G104: 汽车 | H104: 零部件制 | I104: 114.66 | J104: 1.0200000000000001e-002 | K104: -1.37e-002 | L104: 27.98 | M104: -9.8999999999999991e-003 | N104: 1471. | O104: 4.7699999999999996 | P104: 116.3 | Q104: 34.54 | R104: 1.43 | S104: 81.01 | T104: 0.41499999999999998 | U104: 转股中 | V104: 3.73年 | W104: 1.73年 | X104: 7.9000000000000001e-002 | Y104: 6.4000000000000001e-002 | Z104: 2.51 | AA104: 32 | AB104: 3.9000000000000003e-003 | AC104: -3.9000000000000003e-003 | AD104: -5.6299999999999996e-002 | AE104: -5.8899999999999994e-002 | AF104: 91.46 | AG104: 92.66 | AH104: 0.35 | AI104: AA- | AJ104: 6.4000000000000001e-002 | AK104: =I104+100*T104 -> 156.16 | AL104: 148.3 | AM104: 232 | AN104: 55.7 | AO104: 219 | AP104: -4.7e-002 | AQ104: 35 | AR104: 德尔转债!
A105: 116 | B105: 康弘转债! | C105: 128098 | D105: 43921. | E105: 康弘药业 | F105: 2773 | G105: 医药 | H105: 化学制药 | I105: 114 | J105: -2.1600000000000001e-002 | K105: -2.e-003 | L105: 40.26 | M105: -2.3799999999999998e-002 | N105: 29 | O105: 2.7999999999999997e-002 | P105: 116.3 | Q105: 35.3 | R105: 7.47 | S105: 114.05 | T105: 0. | U105: 转股中 | V105: 5.36年 | W105: 3.36年 | X105: 2.6000000000000002e-002 | Y105: 2.8999999999999998e-002 | Z105: 9.06 | AA105: 353 | AB105: 3.8e-003 | AC105: -1.6000000000000001e-003 | AD105: -2.6499999999999999e-002 | AE105: -2.8500000000000001e-002 | AF105: 88.9 | AG105: 92.11 | AH105: 0.99 | AI105: AA | AJ105: 4.5400000000000003e-002 | AK105: =I105+100*T105 -> 114. | AL105: 113.9 | AM105: 1 | AN105: 21.8 | AO105: 7 | AP105: -0.10300000000000001 | AQ105: 23 | AR105: 康弘转债!
A106: 139 | B106: 永创转债! | C106: 113559 | D106: 43840. | E106: 永创智能 | F106: 603901 | G106: 机械装备 | H106: 专用设备 | I106: 116.76 | J106: -1.32e-002 | K106: 5.6000000000000008e-003 | L106: 9.6 | M106: -1.23e-002 | N106: 13 | O106: 2.2000000000000002e-002 | P106: 118.9 | Q106: 10.32 | R106: 3.08 | S106: 93.02 | T106: 0.255 | U106: 转股中 | V106: 5.16年 | W106: 3.16年 | X106: 0.121 | Y106: 0.11199999999999999 | Z106: 5.1 | AA106: 42 | AB106: 3.5999999999999999e-003 | AC106: -2.8000000000000004e-003 | AD106: -3.1899999999999998e-002 | AE106: -3.4599999999999999e-002 | AF106: 85.05 | AG106: 86.12 | AH106: 0.62 | AI106: AA- | AJ106: 6.6400000000000001e-002 | AK106: =I106+100*T106 -> 142.25999999999999 | AL106: 140.5 | AM106: 184 | AN106: 54.4 | AO106: 209 | AP106: -1.1000000000000001e-002 | AQ106: 23 | AR106: 永创转债!
A107: 135 | B107: 开润转债! | C107: 123039 | D107: 43853. | E107: 开润股份 | F107: 300577 | G107: 服装纺织 | H107: 纺织行业 | I107: 119.3 | J107: -4.5599999999999995e-002 | K107: 1.15e-002 | L107: 33.23 | M107: -4.7300000000000002e-002 | N107: 303 | O107: 1.0800000000000001 | P107: 121.5 | Q107: 33.22 | R107: 8.22 | S107: 100.03 | T107: 0.193 | U107: 转股中 | V107: 5.17年 | W107: 3.17年 | X107: 3.1e-002 | Y107: 3.1e-002 | Z107: 2.22 | AA107: 72 | AB107: 3.5999999999999999e-003 | AC107: -3.4999999999999996e-003 | AD107: -3.9199999999999999e-002 | AE107: -4.1599999999999998e-002 | AF107: 81.84 | AG107: 83.45 | AH107: 0.72 | AI107: A+ | AJ107: 7.7399999999999997e-002 | AK107: =I107+100*T107 -> 138.59999999999999 | AL107: 138.6 | AM107: 163 | AN107: 55.1 | AO107: 215 | AP107: -4.0000000000000001e-003 | AQ107: 23 | AR107: 开润转债!
A108: 44 | B108: 湖盐转债 | C108: 110071 | D108: 44043. | E108: 雪天盐业 | F108: 600929 | G108: 食品饮料 | H108: 食品饮料 | I108: 112.9 | J108: -4.8999999999999998e-003 | K108: 7.9000000000000008e-003 | L108: 6.78 | M108: 4.4000000000000003e-003 | N108: 9.1 | O108: 1.1000000000000001e-002 | P108: 115.2 | Q108: 6.6 | R108: 2.46 | S108: 102.73 | T108: 9.9000000000000005e-002 | U108: 2月26天 | V108: 5.71年 | W108: 3.71年 | X108: 0.11599999999999999 | Y108: 0.11900000000000001 | Z108: 7.2 | AA108: 62 | AB108: 3.5999999999999999e-003 | AC108: -1.1999999999999999e-003 | AD108: -2.1899999999999999e-002 | AE108: -2.3599999999999999e-002 | AF108: 87.44 | AG108: 89.82 | AH108: 0.66 | AI108: AA | AJ108: 4.5400000000000003e-002 | AK108: =I108+100*T108 -> 122.80000000000001 | AL108: 123.1 | AM108: 17 | AN108: 33.3 | AO108: 38 | AP108: -6.0000000000000001e-003 | AQ108: 11 | AR108: 湖盐转债
A109: 104 | B109: 联创转债! | C109: 128101 | D109: 43934. | E109: 联创电子 | F109: 2036 | G109: 电子 | H109: 液晶显示 | I109: 112.999 | J109: 1.5300000000000001e-002 | K109: -1.1899999999999999e-002 | L109: 11.06 | M109: 1.e-002 | N109: 696 | O109: 2. | P109: 115.1 | Q109: 14.48 | R109: 4.12 | S109: 76.38 | T109: 0.47899999999999998 | U109: 转股中 | V109: 5.39年 | W109: 3.39年 | X109: 2.8999999999999998e-002 | Y109: 2.2000000000000002e-002 | Z109: 3 | AA109: 103 | AB109: 3.4999999999999996e-003 | AC109: -1.5e-003 | AD109: -2.4300000000000002e-002 | AE109: -2.6200000000000001e-002 | AF109: 88.58 | AG109: 91 | AH109: 0.33 | AI109: AA | AJ109: 4.5400000000000003e-002 | AK109: =I109+100*T109 -> 160.899 | AL109: 149.6 | AM109: 234 | AN109: 58.6 | AO109: 231 | AP109: -6.0000000000000001e-003 | AQ109: 14 | AR109: 联创转债!
A110: 207 | B110: 迪森转债! | C110: 123023 | D110: 43571. | E110: 迪森股份 | F110: 300335 | G110: 能源电力 | H110: 电力供应 | I110: 113.3 | J110: -4.9100000000000005e-002 | K110: 3.2599999999999997e-002 | L110: 7.59 | M110: -2.5699999999999997e-002 | N110: 969 | O110: 1.54 | P110: 114.9 | Q110: 7.04 | R110: 2.12 | S110: 107.81 | T110: 5.0999999999999997e-002 | U110: 转股中 | V110: 4.40年 | W110: 3.40年 | X110: 0.192 | Y110: 0.20699999999999999 | Z110: 5.3 | AA110: 28 | AB110: 3.3e-003 | AC110: -2.8000000000000004e-003 | AD110: -2.0799999999999999e-002 | AE110: -2.35e-002 | AF110: 90.77 | AG110: 95.82 | AH110: 0.64 | AI110: AA | AJ110: 4.2999999999999997e-002 | AK110: =I110+100*T110 -> 118.39999999999999 | AL110: 118.8 | AM110: 6 | AN110: 23 | AO110: 8 | AP110: 0.14199999999999999 | AQ110: 52 | AR110: 迪森转债!
A111: 117 | B111: 君禾转债 | C111: 113567 | D111: 43924. | E111: 君禾股份 | F111: 603617 | G111: 机械装备 | H111: 通用设备 | I111: 117.33 | J111: -4.1999999999999997e-003 | K111: 1.1000000000000001e-003 | L111: 12.1 | M111: -4.0999999999999995e-003 | N111: 62 | O111: 0.247 | P111: 119.3 | Q111: 11.46 | R111: 3.86 | S111: 105.58 | T111: 0.111 | U111: 转股中 | V111: 5.36年 | W111: 3.36年 | X111: 8.6999999999999994e-002 | Y111: 9.1999999999999998e-002 | Z111: 2.1 | AA111: 24 | AB111: 3.2000000000000002e-003 | AC111: -3.0999999999999999e-003 | AD111: -3.2799999999999996e-002 | AE111: -3.5099999999999999e-002 | AF111: 80.61 | AG111: 80.82 | AH111: 0.77 | AI111: A+ | AJ111: 7.7399999999999997e-002 | AK111: =I111+100*T111 -> 128.43000000000001 | AL111: 129.1 | AM111: 60 | AN111: 48.3 | AO111: 170 | AP111: -8.0000000000000002e-003 | AQ111: 31 | AR111: 君禾转债
A112: 1 | B112: 斯莱转债 | C112: 123067 | D112: 44119. | E112: 斯莱克 | F112: 300382 | G112: 机械装备 | H112: 专用设备 | I112: 119.001 | J112: -3.49e-002 | K112: 5.4000000000000003e-003 | L112: 10.14 | M112: -3.8900000000000004e-002 | N112: 1659. | O112: 3.3500000000000001 | P112: 121.2 | Q112: 9.38 | R112: 5.75 | S112: 108.1 | T112: 0.10099999999999999 | U112: 5月0天 | V112: 5.90年 | W112: 3.90年 | X112: 6.8000000000000005e-002 | Y112: 7.2999999999999995e-002 | Z112: 3.88 | AA112: 57 | AB112: 3.2000000000000002e-003 | AC112: -3.0000000000000001e-003 | AD112: -3.2599999999999997e-002 | AE112: -3.4500000000000003e-002 | AF112: 80.39 | AG112: 83.6 | AH112: 0.76 | AI112: AA- | AJ112: 6.6400000000000001e-002 | AK112: =I112+100*T112 -> 129.101 | AL112: 129.9 | AM112: 72 | AN112: 46.3 | AO112: 154 | AP112: 7.400000000000001e-002 | AQ112: 6 | AR112: 斯莱转债
A113: 274 | B113: 铁汉转债! | C113: 123004 | D113: 43126. | E113: 铁汉生态 | F113: 300197 | G113: 城市公用 | H113: 生态环境 | I113: 109 | J113: -2.58e-002 | K113: 1.1699999999999999e-002 | L113: 3.77 | M113: -2.8399999999999998e-002 | N113: 96 | O113: 0.106 | P113: 109.8 | Q113: 3.98 | R113: 1.69 | S113: 94.72 | T113: 0.151 | U113: 转股中 | V113: 3年55天 | W113: 1年55天 | X113: 8.9999999999999997e-002 | Y113: 8.5999999999999993e-002 | Z113: 8.03 | AA113: 89 | AB113: 2.3999999999999998e-003 | AC113: -3.4000000000000002e-003 | AD113: -4.5700000000000005e-002 | AE113: -4.9200000000000001e-002 | AF113: 97.07 | AG113: 96.43 | AH113: 0.5 | AI113: AA | AJ113: 4.2999999999999997e-002 | AK113: =I113+100*T113 -> 124.09999999999999 | AL113: 123.3 | AM113: 18 | AN113: 26.2 | AO113: 9 | AP113: -6.9000000000000006e-002 | AQ113: 37 | AR113: 铁汉转债!
A114: 250 | B114: 博世转债! | C114: 123010 | D114: 43326. | E114: 博世科 | F114: 300422 | G114: 城市公用 | H114: 三废处理 | I114: 111.791 | J114: -2.3700000000000002e-002 | K114: 2.1600000000000001e-002 | L114: 11.67 | M114: -3.4000000000000002e-003 | N114: 46 | O114: 9.3000000000000013e-002 | P114: 112.3 | Q114: 12.2 | R114: 2.38 | S114: 95.66 | T114: 0.16899999999999998 | U114: 转股中 | V114: 3.70年 | W114: 1.70年 | X114: 9.0999999999999998e-002 | Y114: 8.6999999999999994e-002 | Z114: 4.3 | AA114: 47 | AB114: 1.2999999999999999e-003 | AC114: -4.7999999999999996e-003 | AD114: -4.4299999999999999e-002 | AE114: -4.7100000000000003e-002 | AF114: 91.66 | AG114: 89.69 | AH114: 0.59 | AI114: AA- | AJ114: 6.4000000000000001e-002 | AK114: =I114+100*T114 -> 128.691 | AL114: 127.9 | AM114: 56 | AN114: 36.3 | AO114: 65 | AP114: -2.9999999999999999e-002 | AQ114: 25 | AR114: 博世转债!
A115: 30 | B115: 兴森转债 | C115: 128122 | D115: 44060. | E115: 兴森科技 | F115: 2436 | G115: 电子 | H115: 元器件制 | I115: 112.656 | J115: 5.0000000000000001e-003 | K115: -9.5999999999999992e-003 | L115: 10.96 | M115: -1.5300000000000001e-002 | N115: 380 | O115: 1.2 | P115: 113.3 | Q115: 14.18 | R115: 5.27 | S115: 77.29 | T115: 0.45799999999999996 | U115: 3月7天 | V115: 4.75年 | W115: 3.75年 | X115: 1.6e-002 | Y115: 1.3000000000000001e-002 | Z115: 2.69 | AA115: 163 | AB115: 1.1999999999999999e-003 | AC115: -3.8e-003 | AD115: -2.1299999999999999e-002 | AE115: -2.3e-002 | AF115: 88.01 | AG115: 93 | AH115: 0.3 | AI115: AA | AJ115: 4.2999999999999997e-002 | AK115: =I115+100*T115 -> 158.45600000000002 | AL115: 148 | AM115: 231 | AN115: 55 | AO115: 214 | AP115: -2.7999999999999997e-002 | AQ115: 5 | AR115: 兴森转债
A116: 28 | B116: 国光转债 | C116: 128123 | D116: 44062. | E116: 国光股份 | F116: 2749 | G116: 化工 | H116: 农化 | I116: 115.5 | J116: -1.8700000000000001e-002 | K116: 2.2400000000000003e-002 | L116: 13.18 | M116: 5.3e-003 | N116: 49 | O116: 0.129 | P116: 116.2 | Q116: 13.7 | R116: 4.86 | S116: 96.2 | T116: 0.20100000000000001 | U116: 3月10天 | V116: 5.76年 | W116: 3.76年 | X116: 5.5999999999999994e-002 | Y116: 5.4000000000000006e-002 | Z116: 3.2 | AA116: 57 | AB116: 1.1000000000000001e-003 | AC116: -3.9000000000000003e-003 | AD116: -2.64e-002 | AE116: -2.8300000000000002e-002 | AF116: 81.13 | AG116: 80.92 | AH116: 0.7 | AI116: AA- | AJ116: 6.6400000000000001e-002 | AK116: =I116+100*T116 -> 135.59999999999999 | AL116: 134.8 | AM116: 134 | AN116: 53.7 | AO116: 204 | AP116: -1.e-003 | AQ116: 6 | AR116: 国光转债
A117: 4 | B117: 崇达转2 | C117: 128131 | D117: 44102. | E117: 崇达技术 | F117: 2815 | G117: 电子 | H117: 元器件制 | I117: 114.499 | J117: -8.6999999999999994e-003 | K117: 3.9000000000000003e-003 | L117: 17.51 | M117: -9.1000000000000004e-003 | N117: 13 | O117: 8.0000000000000002e-003 | P117: 115.2 | Q117: 19.54 | R117: 3.99 | S117: 89.61 | T117: 0.27800000000000002 | U117: 4月18天 | V117: 5.87年 | W117: 3.87年 | X117: 9.0999999999999998e-002 | Y117: 8.1000000000000003e-002 | Z117: 14 | AA117: 155 | AB117: 1.1000000000000001e-003 | AC117: -3.5999999999999999e-003 | AD117: -2.4399999999999998e-002 | AE117: -2.6099999999999998e-002 | AF117: 86.81 | AG117: 89.18 | AH117: 0.53 | AI117: AA | AJ117: 4.5400000000000003e-002 | AK117: =I117+100*T117 -> 142.29900000000001 | AL117: 139.4 | AM117: 173 | AN117: 50.2 | AO117: 182 | AP117: -9.0000000000000011e-003 | AQ117: 3 | AR117: 崇达转2
A118: 137 | B118: 东风转债 | C118: 113030 | D118: 43850. | E118: 东风股份 | F118: 601515 | G118: 造纸包装 | H118: 包装材料 | I118: 117 | J118: 6.8999999999999999e-003 | K118: -1.0700000000000001e-002 | L118: 6.02 | M118: -8.199999999999999e-003 | N118: 8.5 | O118: 2.4e-002 | P118: 117.3 | Q118: 6.75 | R118: 1.98 | S118: 89.19 | T118: 0.312 | U118: 转股中 | V118: 5.17年 | W118: 3.17年 | X118: 3.7000000000000005e-002 | Y118: 3.3000000000000002e-002 | Z118: 2.95 | AA118: 80 | AB118: 5.0000000000000001e-004 | AC118: -5.4000000000000003e-003 | AD118: -3.5699999999999996e-002 | AE118: -3.7699999999999997e-002 | AF118: 89.68 | AG118: 93.7 | AH118: 0.47 | AI118: AA | AJ118: 4.5400000000000003e-002 | AK118: =I118+100*T118 -> 148.19999999999999 | AL118: 144.8 | AM118: 215 | AN118: 51.1 | AO118: 188 | AP118: -2.3e-002 | AQ118: 15 | AR118: 东风转债
A119: 182 | B119: 华森转债! | C119: 128069 | D119: 43657. | E119: 华森制药 | F119: 2907 | G119: 医药 | H119: 化学制药 | I119: 119.999 | J119: 7.7199999999999991e-002 | K119: -6.8000000000000005e-002 | L119: 16.8 | M119: 1.6299999999999999e-002 | N119: 706 | O119: 1.9399999999999999 | P119: 120 | Q119: 18.04 | R119: 6.51 | S119: 93.13 | T119: 0.28899999999999998 | U119: 转股中 | V119: 4.67年 | W119: 2.67年 | X119: 4.4000000000000004e-002 | Y119: 4.0999999999999995e-002 | Z119: 3 | AA119: 67 | AB119: 0. | AC119: -7.3000000000000001e-003 | AD119: -5.1399999999999994e-002 | AE119: -5.3499999999999999e-002 | AF119: 86.98 | AG119: 90.36 | AH119: 0.56 | AI119: AA- | AJ119: 6.4000000000000001e-002 | AK119: =I119+100*T119 -> 148.899 | AL119: 146.9 | AM119: 222 | AN119: 56.5 | AO119: 222 | AP119: 2.e-003 | AQ119: 41 | AR119: 华森转债!
A120: 259 | B120: 敖东转债! | C120: 127006 | D120: 43231. | E120: 吉林敖东 | F120: 623 | G120: 金融 | H120: 证券行业 | I120: 108.101 | J120: -1.1899999999999999e-002 | K120: 9.300000000000001e-003 | L120: 17.17 | M120: -7.4999999999999997e-003 | N120: 13 | O120: 5.0000000000000001e-003 | P120: 108 | Q120: 20.42 | R120: 0.89 | S120: 84.08 | T120: 0.28600000000000003 | U120: 转股中 | V120: 3.38年 | W120: 1.38年 | X120: 0.121 | Y120: 0.10099999999999999 | Z120: 24.1 | AA120: 200 | AB120: -2.9999999999999997e-004 | AC120: -4.6999999999999993e-003 | AD120: -3.9e-002 | AE120: -4.0999999999999995e-002 | AF120: 95.56 | AG120: 94.44 | AH120: 0.34 | AI120: AA+ | AJ120: 4.0999999999999995e-002 | AK120: =I120+100*T120 -> 136.70099999999999 | AL120: 132.1 | AM120: 103 | AN120: 36.6 | AO120: 68 | AP120: -6.0000000000000001e-003 | AQ120: 26 | AR120: 敖东转债!
A121: 122 | B121: 宏辉转债 | C121: 113565 | D121: 43906. | E121: 宏辉果蔬 | F121: 603336 | G121: 农业 | H121: 农产品加 | I121: 118.42 | J121: -3.2400000000000005e-002 | K121: 1.49e-002 | L121: 10.94 | M121: -2.23e-002 | N121: 157 | O121: 0.41100000000000003 | P121: 118.2 | Q121: 10 | R121: 4.02 | S121: 109.4 | T121: 8.199999999999999e-002 | U121: 转股中 | V121: 5.34年 | W121: 3.34年 | X121: 8.5999999999999993e-002 | Y121: 9.4e-002 | Z121: 3.09 | AA121: 36 | AB121: -4.0000000000000002e-004 | AC121: -6.3e-003 | AD121: -3.6400000000000002e-002 | AE121: -3.85e-002 | AF121: 83.33 | AG121: 84.51 | AH121: 0.78 | AI121: AA- | AJ121: 6.6400000000000001e-002 | AK121: =I121+100*T121 -> 126.62 | AL121: 127.4 | AM121: 47 | AN121: 42.9 | AO121: 129 | AP121: -5.9000000000000004e-002 | AQ121: 18 | AR121: 宏辉转债
A122: 276 | B122: 特一转债! | C122: 128025 | D122: 43097. | E122: 特一药业 | F122: 2728 | G122: 医药 | H122: 化学制药 | I122: 110 | J122: 4.5999999999999999e-003 | K122: -1.4199999999999999e-002 | L122: 13.09 | M122: -2.0899999999999998e-002 | N122: 56 | O122: 0.17000000000000001 | P122: 109.8 | Q122: 14.7 | R122: 2.64 | S122: 89.05 | T122: 0.23499999999999999 | U122: 转股中 | V122: 3年43天 | W122: 1年43天 | X122: 0.11199999999999999 | Y122: 0.10000000000000001 | Z122: 2.99 | AA122: 27 | AB122: -5.9999999999999995e-004 | AC122: -6.4000000000000003e-003 | AD122: -5.3699999999999998e-002 | AE122: -5.7200000000000001e-002 | AF122: 94.78 | AG122: 90.88 | AH122: 0.46 | AI122: AA- | AJ122: 6.4000000000000001e-002 | AK122: =I122+100*T122 -> 133.5 | AL122: 131 | AM122: 93 | AN122: 36.2 | AO122: 64 | AP122: -4.0000000000000001e-002 | AQ122: 43 | AR122: 特一转债!
A123: 292 | B123: 骆驼转债! | C123: 113012 | D123: 42934. | E123: 骆驼股份 | F123: 601311 | G123: 汽车 | H123: 零部件制 | I123: 107.99 | J123: -1.89e-002 | K123: 1.0800000000000001e-002 | L123: 8.32 | M123: -3.3700000000000001e-002 | N123: 70 | O123: 0.12300000000000001 | P123: 107.8 | Q123: 10.06 | R123: 1.08 | S123: 82.7 | T123: 0.30599999999999999 | U123: 转股中 | V123: 2.41年 | W123: 0.41年 | X123: 5.5e-002 | Y123: 4.4999999999999998e-002 | Z123: 5.1 | AA123: 93 | AB123: -7.000000000000001e-004 | AC123: -6.8000000000000005e-003 | AD123: -0.109 | AE123: -0.114 | AF123: 99.13 | AG123: 97.63 | AH123: 0.24 | AI123: AA | AJ123: 4.2599999999999999e-002 | AK123: =I123+100*T123 -> 138.59 | AL123: 133.3 | AM123: 113 | AN123: 34.1 | AO123: 45 | AP123: 3.9e-002 | AQ123: 17 | AR123: 骆驼转债!
A124: 63 | B124: 中矿转债 | C124: 128111 | D124: 44019. | E124: 中矿资源 | F124: 2738 | G124: 有色金属 | H124: 有色行业 | I124: 125.2 | J124: 6.7000000000000002e-003 | K124: 2.9999999999999997e-004 | L124: 19.07 | M124: 8.5000000000000006e-003 | N124: 81 | O124: 8.0000000000000002e-002 | P124: 124.7 | Q124: 15.53 | R124: 1.95 | S124: 122.79 | T124: 2.e-002 | U124: 54天 | V124: 5.63年 | W124: 3.63年 | X124: 0.151 | Y124: 0.185 | Z124: 8 | AA124: 53 | AB124: -7.000000000000001e-004 | AC124: -8.0000000000000002e-003 | AD124: -4.6699999999999998e-002 | AE124: -4.8799999999999996e-002 | AF124: 82.2 | AG124: 87.55 | AH124: 0.83 | AI124: AA- | AJ124: 6.6400000000000001e-002 | AK124: =I124+100*T124 -> 127.2 | AL124: 127.6 | AM124: 49 | AN124: 40.1 | AO124: 111 | AP124: 2.1000000000000001e-002 | AQ124: 6 | AR124: 中矿转债
A125: 22 | B125: 华阳转债 | C125: 128125 | D125: 44064. | E125: 华阳国际 | F125: 2949 | G125: 建筑 | H125: 建筑工程 | I125: 119 | J125: -3.8800000000000001e-002 | K125: 9.8999999999999991e-003 | L125: 27.13 | M125: -3.8300000000000001e-002 | N125: 83 | O125: 0.14499999999999999 | P125: 118.5 | Q125: 25.79 | R125: 4.63 | S125: 105.2 | T125: 0.13100000000000001 | U125: 3月14天 | V125: 5.76年 | W125: 3.76年 | X125: 8.5000000000000006e-002 | Y125: 8.900000000000001e-002 | Z125: 4.5 | AA125: 53 | AB125: -7.000000000000001e-004 | AC125: -6.3e-003 | AD125: -3.44e-002 | AE125: -3.61e-002 | AF125: 80.84 | AG125: 82.39 | AH125: 0.75 | AI125: AA- | AJ125: 6.6400000000000001e-002 | AK125: =I125+100*T125 -> 132.09999999999999 | AL125: 132.8 | AM125: 109 | AN125: 50.4 | AO125: 184 | AP125: -2.5000000000000001e-002 | AQ125: 2 | AR125: 华阳转债
A126: 25 | B126: 科华转债! | C126: 128124 | D126: 44063. | E126: 科华生物 | F126: 2022 | G126: 医药 | H126: 生物制药 | I126: 110.902 | J126: -5.1999999999999998e-003 | K126: -6.1999999999999998e-003 | L126: 19.32 | M126: -2.0799999999999999e-002 | N126: 17 | O126: 2.e-002 | P126: 110.3 | Q126: 21.5 | R126: 3.89 | S126: 89.86 | T126: 0.23399999999999999 | U126: 3月12天 | V126: 5.76年 | W126: 3.76年 | X126: 7.400000000000001e-002 | Y126: 6.7000000000000004e-002 | Z126: 7.38 | AA126: 99 | AB126: -1.e-003 | AC126: -4.3e-003 | AD126: -1.8700000000000001e-002 | AE126: -2.0099999999999996e-002 | AF126: 86.68 | AG126: 85.76 | AH126: 0.55 | AI126: AA | AJ126: 4.5400000000000003e-002 | AK126: =I126+100*T126 -> 134.30199999999999 | AL126: 131.9 | AM126: 99 | AN126: 45.3 | AO126: 148 | AP126: 1.9e-002 | AQ126: 9 | AR126: 科华转债!
A127: 6 | B127: 万孚转债 | C127: 123064 | D127: 44097. | E127: 万孚生物 | F127: 300482 | G127: 医药 | H127: 医疗器械 | I127: 116.108 | J127: -1.1399999999999999e-002 | K127: 1.e-004 | L127: 80.03 | M127: -2.3900000000000001e-002 | N127: 48 | O127: 6.8000000000000005e-002 | P127: 115.1 | Q127: 93.55 | R127: 10.58 | S127: 85.55 | T127: 0.35700000000000004 | U127: 4月15天 | V127: 5.86年 | W127: 3.86年 | X127: 2.2000000000000002e-002 | Y127: 1.9e-002 | Z127: 6 | AA127: 274 | AB127: -1.5e-003 | AC127: -6.0999999999999995e-003 | AD127: -2.81e-002 | AE127: -2.98e-002 | AF127: 86.78 | AG127: 89.15 | AH127: 0.47 | AI127: AA | AJ127: 4.5400000000000003e-002 | AK127: =I127+100*T127 -> 151.80799999999999 | AL127: 146.7 | AM127: 221 | AN127: 57.5 | AO127: 229 | AP127: -6.4000000000000001e-002 | AQ127: 5 | AR127: 万孚转债
A128: 179 | B128: 好客转债 | C128: 113542 | D128: 43700. | E128: 好莱客 | F128: 603898 | G128: 其他 | H128: 家居用品 | I128: 115.83 | J128: -1.9e-002 | K128: 9.1000000000000004e-003 | L128: 16.17 | M128: -1.7000000000000001e-002 | N128: 4.3 | O128: 6.0000000000000001e-003 | P128: 114.9 | Q128: 16.27 | R128: 2.05 | S128: 99.39 | T128: 0.16500000000000001 | U128: 转股中 | V128: 4.77年 | W128: 2.77年 | X128: 0.12 | Y128: 0.11900000000000001 | Z128: 6.03 | AA128: 50 | AB128: -1.7000000000000001e-003 | AC128: -7.3000000000000001e-003 | AD128: -3.8199999999999998e-002 | AE128: -4.0399999999999998e-002 | AF128: 91.48 | AG128: 94.35 | AH128: 0.58 | AI128: AA | AJ128: 4.2999999999999997e-002 | AK128: =I128+100*T128 -> 132.32999999999998 | AL128: 132.3 | AM128: 107 | AN128: 37.9 | AO128: 82 | AP128: -4.8000000000000001e-002 | AQ128: 19 | AR128: 好客转债
A129: 263 | B129: 大族转债! | C129: 128035 | D129: 43164. | E129: 大族激光 | F129: 2008 | G129: 机械装备 | H129: 专用设备 | I129: 108.68 | J129: -4.5000000000000005e-003 | K129: 4.1999999999999997e-003 | L129: 35.2 | M129: -1.1000000000000001e-002 | N129: 19 | O129: 6.9999999999999993e-003 | P129: 108 | Q129: 52.1 | R129: 4.19 | S129: 67.56 | T129: 0.60899999999999999 | U129: 转股中 | V129: 3.29年 | W129: 1.29年 | X129: 6.0999999999999999e-002 | Y129: 4.0999999999999995e-002 | Z129: 23 | AA129: 376 | AB129: -1.9e-003 | AC129: -6.5000000000000006e-003 | AD129: -2.7400000000000001e-002 | AE129: -3.3000000000000002e-002 | AF129: 98.51 | AG129: 94.82 | AH129: 0.02 | AI129: AA+ | AJ129: 4.0999999999999995e-002 | AK129: =I129+100*T129 -> 169.58000000000001 | AL129: 149.8 | AM129: 235 | AN129: 51.3 | AO129: 189 | AP129: 2.5000000000000001e-002 | AQ129: 19 | AR129: 大族转债!
A130: 229 | B130: 福能转债! | C130: 110048 | D130: 43462. | E130: 福能股份 | F130: 600483 | G130: 能源电力 | H130: 电力供应 | I130: 114.9 | J130: 1.9e-003 | K130: -2.5999999999999999e-003 | L130: 7.76 | M130: -1.2999999999999999e-003 | N130: 8.4 | O130: 3.0000000000000001e-003 | P130: 113.9 | Q130: 8.12 | R130: 1 | S130: 95.57 | T130: 0.20199999999999999 | U130: 转股中 | V130: 4年44天 | W130: 2年44天 | X130: 0.20699999999999999 | Y130: 0.19800000000000001 | Z130: 28.3 | AA130: 137 | AB130: -2.2000000000000001e-003 | AC130: -8.199999999999999e-003 | AD130: -4.5499999999999999e-002 | AE130: -4.82e-002 | AF130: 94.42 | AG130: 96.87 | AH130: 0.51 | AI130: AA+ | AJ130: 4.0999999999999995e-002 | AK130: =I130+100*T130 -> 135.09999999999999 | AL130: 134.2 | AM130: 128 | AN130: 37.4 | AO130: 74 | AP130: -3.7999999999999999e-002 | AQ130: 9 | AR130: 福能转债!
A131: 81 | B131: 交科转债 | C131: 128107 | D131: 43973. | E131: 浙江交科 | F131: 2061 | G131: 建筑 | H131: 建筑工程 | I131: 116.877 | J131: -4.5000000000000005e-003 | K131: 2.2000000000000001e-003 | L131: 5.68 | M131: -3.4999999999999996e-003 | N131: 7.3 | O131: 2.e-003 | P131: 115.3 | Q131: 5.36 | R131: 1 | S131: 105.97 | T131: 0.10300000000000001 | U131: 4.1天 | V131: 5.49年 | W131: 3.49年 | X131: 0.32000000000000001 | Y131: 0.33899999999999997 | Z131: 25 | AA131: 78 | AB131: -2.5000000000000001e-003 | AC131: -7.4999999999999997e-003 | AD131: -3.2199999999999999e-002 | AE131: -3.4099999999999998e-002 | AF131: 88.99 | AG131: 91.73 | AH131: 0.66 | AI131: AA+ | AJ131: 4.3400000000000001e-002 | AK131: =I131+100*T131 -> 127.17699999999999 | AL131: 127.8 | AM131: 52 | AN131: 36.1 | AO131: 62 | AP131: -2.7000000000000003e-002 | AQ131: 14 | AR131: 交科转债
A132: 266 | B132: 道氏转债!! | C132: 123007 | D132: 43126. | E132: 道氏技术 | F132: 300409 | G132: 建筑 | H132: 建筑行业 | I132: 112.35 | J132: -5.1900000000000002e-002 | K132: 4.1799999999999997e-002 | L132: 14.15 | M132: -1.8000000000000002e-002 | N132: 431 | O132: 1.1899999999999999 | P132: 111.3 | Q132: 14.95 | R132: 2.72 | S132: 94.65 | T132: 0.187 | U132: 转股中 | V132: 3.18年 | W132: 1.18年 | X132: 4.7e-002 | Y132: 4.4000000000000004e-002 | Z132: 3.04 | AA132: 65 | AB132: -3.0000000000000001e-003 | AC132: -9.4999999999999998e-003 | AD132: -6.4299999999999996e-002 | AE132: -6.8000000000000005e-002 | AF132: 94.69 | AG132: 91.81 | AH132: 0.56 | AI132: AA- | AJ132: 6.4000000000000001e-002 | AK132: =I132+100*T132 -> 131.04999999999998 | AL132: 130.1 | AM132: 75 | AN132: 35.4 | AO132: 55 | AP132: 4.0999999999999995e-002 | AQ132: 16 | AR132: 道氏转债!!
A133: 134 | B133: 汽模转2 | C133: 128090 | D133: 43853. | E133: 天汽模 | F133: 2510 | G133: 汽车 | H133: 零部件制 | I133: 117 | J133: -2.6600000000000002e-002 | K133: 2.0799999999999999e-002 | L133: 4.29 | M133: -9.1999999999999998e-003 | N133: 154 | O133: 0.27200000000000002 | P133: 115.2 | Q133: 4.21 | R133: 1.47 | S133: 101.9 | T133: 0.14800000000000002 | U133: 转股中 | V133: 5.18年 | W133: 3.18年 | X133: 0.11900000000000001 | Y133: 0.121 | Z133: 4.67 | AA133: 39 | AB133: -3.0000000000000001e-003 | AC133: -8.3000000000000001e-003 | AD133: -3.5799999999999998e-002 | AE133: -3.78e-002 | AF133: 89.55 | AG133: 91.98 | AH133: 0.63 | AI133: AA | AJ133: 4.5400000000000003e-002 | AK133: =I133+100*T133 -> 131.80000000000001 | AL133: 132.1 | AM133: 102 | AN133: 40.1 | AO133: 112 | AP133: -2.8999999999999998e-002 | AQ133: 26 | AR133: 汽模转2
A134: 68 | B134: 宝通转债 | C134: 123053 | D134: 44013. | E134: 宝通科技 | F134: 300031 | G134: 通信互联 | H134: 互联网 | I134: 123.31 | J134: -1.2999999999999999e-003 | K134: -2.0299999999999999e-002 | L134: 21.11 | M134: -3.1200000000000002e-002 | N134: 52 | O134: 8.3000000000000004e-002 | P134: 121.3 | Q134: 20.8 | R134: 2.99 | S134: 101.49 | T134: 0.215 | U134: 48天 | V134: 5.61年 | W134: 3.61年 | X134: 5.9999999999999998e-002 | Y134: 6.0999999999999999e-002 | Z134: 5 | AA134: 84 | AB134: -3.0000000000000001e-003 | AC134: -9.3999999999999986e-003 | AD134: -4.4000000000000004e-002 | AE134: -4.5999999999999999e-002 | AF134: 81.97 | AG134: 85.24 | AH134: 0.69 | AI134: AA- | AJ134: 6.6400000000000001e-002 | AK134: =I134+100*T134 -> 144.81 | AL134: 145.1 | AM134: 216 | AN134: 59.9 | AO134: 234 | AP134: -4.5999999999999999e-002 | AQ134: 5 | AR134: 宝通转债
A135: 184 | B135: 华钰转债!! | C135: 113027 | D135: 43656. | E135: 华钰矿业 | F135: 601020 | G135: 有色金属 | H135: 锌铅镍锡 | I135: 116.61 | J135: -3.9800000000000002e-002 | K135: 3.2000000000000001e-002 | L135: 10.05 | M135: -1.18e-002 | N135: 163 | O135: 0.41700000000000004 | P135: 114.9 | Q135: 10.17 | R135: 2.53 | S135: 98.82 | T135: 0.17999999999999999 | U135: 转股中 | V135: 4.64年 | W135: 2.64年 | X135: 5.7999999999999996e-002 | Y135: 5.7999999999999996e-002 | Z135: 3.26 | AA135: 56 | AB135: -3.2000000000000002e-003 | AC135: -8.8999999999999999e-003 | AD135: -4.2300000000000004e-002 | AE135: -4.4500000000000005e-002 | AF135: 87.03 | AG135: 86.67 | AH135: 0.66 | AI135: AA- | AJ135: 6.4000000000000001e-002 | AK135: =I135+100*T135 -> 134.61000000000001 | AL135: 134.4 | AM135: 130 | AN135: 47.4 | AO135: 164 | AP135: -9.4e-002 | AQ135: 47 | AR135: 华钰转债!!
A136: 85 | B136: 聚飞转债 | C136: 123050 | D136: 43966. | E136: 聚飞光电 | F136: 300303 | G136: 电子 | H136: LED制 | I136: 126.9 | J136: -2.7200000000000002e-002 | K136: 1.2e-002 | L136: 6.38 | M136: -1.8500000000000003e-002 | N136: 62 | O136: 6.8000000000000005e-002 | P136: 124.2 | Q136: 5.18 | R136: 3.47 | S136: 123.17 | T136: 2.9999999999999999e-002 | U136: 转股中 | V136: 5.47年 | W136: 3.47年 | X136: 8.5999999999999993e-002 | Y136: 0.106 | Z136: 7.05 | AA136: 82 | AB136: -4.0000000000000001e-003 | AC136: -1.1299999999999999e-002 | AD136: -5.3499999999999999e-002 | AE136: -5.5399999999999998e-002 | AF136: 82.63 | AG136: 88.04 | AH136: 0.82 | AI136: AA- | AJ136: 6.6400000000000001e-002 | AK136: =I136+100*T136 -> 129.90000000000001 | AL136: 130.6 | AM136: 82 | AN136: 42.6 | AO136: 125 | AP136: -3.7000000000000005e-002 | AQ136: 11 | AR136: 聚飞转债
A137: 92 | B137: 长集转债 | C137: 128105 | D137: 43964. | E137: 长青集团 | F137: 2616 | G137: 城市公用 | H137: 三废处理 | I137: 117.997 | J137: 1.e-003 | K137: 1.4000000000000002e-003 | L137: 9.05 | M137: 3.3e-003 | N137: 51 | O137: 5.4000000000000006e-002 | P137: 115.3 | Q137: 8.11 | R137: 2.79 | S137: 111.59 | T137: 5.7000000000000002e-002 | U137: 转股中 | V137: 5.46年 | W137: 3.46年 | X137: 0.11900000000000001 | Y137: 0.13300000000000001 | Z137: 8 | AA137: 67 | AB137: -4.3e-003 | AC137: -9.300000000000001e-003 | AD137: -3.5099999999999999e-002 | AE137: -3.7000000000000005e-002 | AF137: 88.52 | AG137: 90.93 | AH137: 0.72 | AI137: AA | AJ137: 4.5400000000000003e-002 | AK137: =I137+100*T137 -> 123.697 | AL137: 124.4 | AM137: 21 | AN137: 33.5 | AO137: 41 | AP137: -0.125 | AQ137: 6 | AR137: 长集转债
A138: 8 | B138: 青农转债 | C138: 128129 | D138: 44092. | E138: 青农商行 | F138: 2958 | G138: 金融 | H138: 银行行业 | I138: 115 | J138: 7.1999999999999998e-003 | K138: -8.199999999999999e-003 | L138: 5.18 | M138: -1.9e-003 | N138: 106 | O138: 1.8000000000000002e-002 | P138: 112.2 | Q138: 5.74 | R138: 1.15 | S138: 90.24 | T138: 0.27399999999999997 | U138: 4月8天 | V138: 5.84年 | W138: 无权 | X138: 0.17399999999999999 | Y138: 0.157 | Z138: 50 | AA138: 288 | AB138: -4.3e-003 | AC138: -8.0000000000000002e-003 | AD138: 无权 | AE138: 无权 | AF138: 无权 | AG138: 89.34 | AH138: 0.52 | AI138: AAA | AJ138: 4.0399999999999998e-002 | AK138: =I138+100*T138 -> 142.40000000000001 | AL138: 139.8 | AM138: 176 | AN138: 50.4 | AO138: 185 | AP138: -1.e-002 | AQ138: 10 | AR138: 青农转债
A139: 64 | B139: 思特转债 | C139: 123054 | D139: 44018. | E139: 思特奇 | F139: 300608 | G139: 通信互联 | H139: 通信设备 | I139: 124.99 | J139: 8.0000000000000002e-003 | K139: -6.7000000000000002e-003 | L139: 19.21 | M139: 1.6000000000000001e-003 | N139: 1344. | O139: 3.7599999999999998 | P139: 121.7 | Q139: 16.49 | R139: 3.91 | S139: 116.49 | T139: 7.2999999999999995e-002 | U139: 53天 | V139: 5.63年 | W139: 3.63年 | X139: 8.900000000000001e-002 | Y139: 0.10400000000000001 | Z139: 2.71 | AA139: 30 | AB139: -4.7999999999999996e-003 | AC139: -1.1299999999999999e-002 | AD139: -4.6300000000000001e-002 | AE139: -4.8399999999999999e-002 | AF139: 82.22 | AG139: 85.48 | AH139: 0.8 | AI139: AA- | AJ139: 6.6400000000000001e-002 | AK139: =I139+100*T139 -> 132.28999999999999 | AL139: 133.5 | AM139: 116 | AN139: 48 | AO139: 169 | AP139: 7.0999999999999994e-002 | AQ139: 11 | AR139: 思特转债
A140: 70 | B140: 家悦转债 | C140: 113584 | D140: 44006. | E140: 家家悦 | F140: 603708 | G140: 商业零售 | H140: 超市 | I140: 118.44 | J140: -1.04e-002 | K140: 3.8e-003 | L140: 30.8 | M140: -1.6299999999999999e-002 | N140: 5.3 | O140: 6.9999999999999993e-003 | P140: 115.3 | Q140: 37.97 | R140: 6.46 | S140: 81.12 | T140: 0.46000000000000002 | U140: 49天 | V140: 5.61年 | W140: 3.61年 | X140: 3.4000000000000002e-002 | Y140: 2.7999999999999997e-002 | Z140: 6.45 | AA140: 187 | AB140: -4.8999999999999998e-003 | AC140: -9.7000000000000003e-003 | AD140: -3.4599999999999999e-002 | AE140: -3.6400000000000002e-002 | AF140: 87.91 | AG140: 90.3 | AH140: 0.41 | AI140: AA | AJ140: 4.5400000000000003e-002 | AK140: =I140+100*T140 -> 164.44 | AL140: 155.8 | AM140: 253 | AN140: 65.5 | AO140: 249 | AP140: -0.12300000000000001 | AQ140: 4 | AR140: 家悦转债
A141: 2 | B141: 赛意转债 | C141: 123066 | D141: 44119. | E141: 赛意信息 | F141: 300687 | G141: 计算机及 | H141: 软件开发 | I141: 125 | J141: -1.9199999999999998e-002 | K141: -7.000000000000001e-004 | L141: 27 | M141: -2.35e-002 | N141: 967 | O141: 2.2400000000000002 | P141: 121.4 | Q141: 22.58 | R141: 7.03 | S141: 119.57 | T141: 4.4999999999999998e-002 | U141: 4月29天 | V141: 5.90年 | W141: 3.90年 | X141: 5.5e-002 | Y141: 6.5000000000000002e-002 | Z141: 3.2 | AA141: 59 | AB141: -5.0000000000000001e-003 | AC141: -1.1200000000000002e-002 | AD141: -4.3899999999999995e-002 | AE141: -4.58e-002 | AF141: 77.29 | AG141: 78.95 | AH141: 0.85 | AI141: A+ | AJ141: 7.7399999999999997e-002 | AK141: =I141+100*T141 -> 129.5 | AL141: 130.4 | AM141: 79 | AN141: 51.5 | AO141: 192 | AP141: 8.4000000000000005e-002 | AQ141: 2 | AR141: 赛意转债
A142: 202 | B142: 现代转债 | C142: 110057 | D142: 43585. | E142: 现代制药 | F142: 600420 | G142: 医药 | H142: 化学制药 | I142: 113.57 | J142: -6.8999999999999999e-003 | K142: -2.0000000000000001e-004 | L142: 9.82 | M142: -1.21e-002 | N142: 20 | O142: 1.1000000000000001e-002 | P142: 110.8 | Q142: 9.89 | R142: 1.34 | S142: 99.29 | T142: 0.14400000000000002 | U142: 转股中 | V142: 4.44年 | W142: 2.44年 | X142: 0.16 | Y142: 0.159 | Z142: 16.2 | AA142: 101 | AB142: -5.6999999999999993e-003 | AC142: -1.01e-002 | AD142: -3.61e-002 | AE142: -3.8399999999999997e-002 | AF142: 93.83 | AG142: 94.22 | AH142: 0.59 | AI142: AAA | AJ142: 3.7999999999999999e-002 | AK142: =I142+100*T142 -> 127.97 | AL142: 127.8 | AM142: 55 | AN142: 33.6 | AO142: 43 | AP142: -1.e-003 | AQ142: 21 | AR142: 现代转债
A143: 101 | B143: 久吾转债 | C143: 123047 | D143: 43938. | E143: 久吾高科 | F143: 300631 | G143: 机械装备 | H143: 专用设备 | I143: 134.07 | J143: -0.19699999999999998 | K143: 0.158 | L143: 21.72 | M143: -4.7800000000000002e-002 | N143: 3725. | O143: 8.5299999999999994 | P143: 130.1 | Q143: 17.61 | R143: 3.31 | S143: 123.34 | T143: 8.6999999999999994e-002 | U143: 转股中 | V143: 5.40年 | W143: 3.40年 | X143: 0.10800000000000001 | Y143: 0.13300000000000001 | Z143: 2.47 | AA143: 23 | AB143: -5.6999999999999993e-003 | AC143: -1.4499999999999999e-002 | AD143: -6.4199999999999993e-002 | AE143: -6.7099999999999993e-002 | AF143: 81.61 | AG143: 87.99 | AH143: 0.81 | AI143: A+ | AJ143: 7.7399999999999997e-002 | AK143: =I143+100*T143 -> 142.76999999999998 | AL143: 144.8 | AM143: 214 | AN143: 56.8 | AO143: 224 | AP143: 2.4e-002 | AQ143: 20 | AR143: 久吾转债
A144: 21 | B144: 法兰转债 | C144: 113598 | D144: 44068. | E144: 法兰泰克 | F144: 603966 | G144: 机械装备 | H144: 工程机械 | I144: 125.26 | J144: -7.000000000000001e-004 | K144: -7.1999999999999998e-003 | L144: 14.53 | M144: -1.09e-002 | N144: 9.6 | O144: 2.3e-002 | P144: 121.2 | Q144: 13.88 | R144: 2.87 | S144: 104.68 | T144: 0.19699999999999998 | U144: 3月15天 | V144: 5.77年 | W144: 3.77年 | X144: 0.10800000000000001 | Y144: 0.113 | Z144: 3.3 | AA144: 31 | AB144: -5.7999999999999996e-003 | AC144: -1.2e-002 | AD144: -4.6300000000000001e-002 | AE144: -4.82e-002 | AF144: 81.07 | AG144: 84.31 | AH144: 0.73 | AI144: AA- | AJ144: 6.6400000000000001e-002 | AK144: =I144+100*T144 -> 144.96000000000001 | AL144: 145.8 | AM144: 218 | AN144: 61.5 | AO144: 238 | AP144: -8.8000000000000009e-002 | AQ144: 5 | AR144: 法兰转债
A145: 91 | B145: 滨化转债 | C145: 113034 | D145: 43951. | E145: 滨化股份 | F145: 601678 | G145: 化工 | H145: 化工 | I145: 119.23 | J145: -1.55e-002 | K145: 7.3000000000000001e-003 | L145: 5.5 | M145: -1.0800000000000001e-002 | N145: 63 | O145: 2.2000000000000002e-002 | P145: 115.1 | Q145: 4.68 | R145: 1.41 | S145: 117.52 | T145: 1.4999999999999999e-002 | U145: 转股中 | V145: 5.46年 | W145: 3.46年 | X145: 0.28300000000000003 | Y145: 0.33200000000000002 | Z145: 24 | AA145: 85 | AB145: -6.5000000000000006e-003 | AC145: -1.1399999999999999e-002 | AD145: -3.8300000000000001e-002 | AE145: -4.0099999999999997e-002 | AF145: 88.32 | AG145: 90.73 | AH145: 0.76 | AI145: AA | AJ145: 4.5400000000000003e-002 | AK145: =I145+100*T145 -> 120.73 | AL145: 120.9 | AM145: 8 | AN145: 30.2 | AO145: 19 | AP145: 2.1000000000000001e-002 | AQ145: 27 | AR145: 滨化转债
A146: 212 | B146: 中鼎转2! | C146: 127011 | D146: 43559. | E146: 中鼎股份 | F146: 887 | G146: 汽车 | H146: 零部件制 | I146: 118.501 | J146: -1.9900000000000001e-002 | K146: 3.0999999999999999e-003 | L146: 10.26 | M146: -4.0199999999999993e-002 | N146: 11 | O146: 8.0000000000000002e-003 | P146: 115.2 | Q146: 11.59 | R146: 1.42 | S146: 88.52 | T146: 0.33899999999999997 | U146: 转股中 | V146: 4.37年 | W146: 2.37年 | X146: 9.6000000000000002e-002 | Y146: 8.5000000000000006e-002 | Z146: 12 | AA146: 125 | AB146: -6.6e-003 | AC146: -1.2699999999999999e-002 | AD146: -5.2400000000000002e-002 | AE146: -5.4900000000000004e-002 | AF146: 93.61 | AG146: 97.02 | AH146: 0.42 | AI146: AA+ | AJ146: 4.0999999999999995e-002 | AK146: =I146+100*T146 -> 152.40100000000001 | AL146: 148.5 | AM146: 233 | AN146: 51.5 | AO146: 191 | AP146: -5.9999999999999998e-002 | AQ146: 27 | AR146: 中鼎转2!
A147: 161 | B147: 天路转债! | C147: 110060 | D147: 43797. | E147: 西藏天路 | F147: 600326 | G147: 建筑 | H147: 水泥 | I147: 119.24 | J147: -3.2500000000000001e-002 | K147: 3.9699999999999999e-002 | L147: 7.72 | M147: 1.0500000000000001e-002 | N147: 184 | O147: 0.20300000000000001 | P147: 115.3 | Q147: 7.16 | R147: 1.86 | S147: 107.82 | T147: 0.106 | U147: 转股中 | V147: 5年4.1天 | W147: 3年4.1天 | X147: 0.10000000000000001 | Y147: 0.107 | Z147: 7.06 | AA147: 71 | AB147: -6.8000000000000005e-003 | AC147: -1.2199999999999999e-002 | AD147: -4.3200000000000002e-002 | AE147: -4.53e-002 | AF147: 90.3 | AG147: 92.75 | AH147: 0.69 | AI147: AA | AJ147: 4.5400000000000003e-002 | AK147: =I147+100*T147 -> 129.84 | AL147: 130.7 | AM147: 84 | AN147: 37.9 | AO147: 80 | AP147: -4.5999999999999999e-002 | AQ147: 12 | AR147: 天路转债!
A148: 73 | B148: 万青转债 | C148: 127017 | D148: 44014. | E148: 万年青 | F148: 789 | G148: 建筑 | H148: 水泥 | I148: 123 | J148: -2.3799999999999998e-002 | K148: -1.6000000000000001e-003 | L148: 14.01 | M148: -4.4299999999999999e-002 | N148: 48 | O148: 3.9e-002 | P148: 118.4 | Q148: 14.16 | R148: 2.15 | S148: 98.94 | T148: 0.24299999999999999 | U148: 46天 | V148: 5.61年 | W148: 3.61年 | X148: 8.9999999999999997e-002 | Y148: 8.900000000000001e-002 | Z148: 10 | AA148: 112 | AB148: -6.8999999999999999e-003 | AC148: -1.2500000000000001e-002 | AD148: -4.4500000000000005e-002 | AE148: -4.6300000000000001e-002 | AF148: 88.5 | AG148: 93.72 | AH148: 0.57 | AI148: AA+ | AJ148: 4.3400000000000001e-002 | AK148: =I148+100*T148 -> 147.30000000000001 | AL148: 147.1 | AM148: 223 | AN148: 53.3 | AO148: 200 | AP148: -9.6000000000000002e-002 | AQ148: 7 | AR148: 万青转债
A149: 230 | B149: 华源转债! | C149: 128049 | D149: 43454. | E149: 华源控股 | F149: 2787 | G149: 造纸包装 | H149: 包装材料 | I149: 118.751 | J149: -6.5000000000000006e-003 | K149: -4.8999999999999998e-003 | L149: 8.08 | M149: -1.5800000000000002e-002 | N149: 17 | O149: 3.9e-002 | P149: 115.2 | Q149: 7.42 | R149: 1.75 | S149: 108.89 | T149: 9.0999999999999998e-002 | U149: 转股中 | V149: 4年34天 | W149: 2年34天 | X149: 0.14199999999999999 | Y149: 0.155 | Z149: 3.63 | AA149: 26 | AB149: -7.6e-003 | AC149: -1.41e-002 | AD149: -5.96e-002 | AE149: -6.2300000000000001e-002 | AF149: 90.16 | AG149: 89.91 | AH149: 0.72 | AI149: AA- | AJ149: 6.4000000000000001e-002 | AK149: =I149+100*T149 -> 127.851 | AL149: 128.6 | AM149: 59 | AN149: 38.5 | AO149: 93 | AP149: 9.0000000000000011e-003 | AQ149: 53 | AR149: 华源转债!
A150: 218 | B150: 今飞转债! | C150: 128056 | D150: 43546. | E150: 今飞凯达 | F150: 2863 | G150: 汽车 | H150: 零部件制 | I150: 125 | J150: -1.95e-002 | K150: 3.7100000000000001e-002 | L150: 8.05 | M150: 2.1600000000000001e-002 | N150: 1047. | O150: 3.3100000000000001 | P150: 121 | Q150: 6.76 | R150: 2.95 | S150: 119.08 | T150: 5.0000000000000003e-002 | U150: 转股中 | V150: 4.35年 | W150: 2.35年 | X150: 7.4999999999999997e-002 | Y150: 8.900000000000001e-002 | Z150: 2.38 | AA150: 32 | AB150: -7.6e-003 | AC150: -1.5800000000000002e-002 | AD150: -7.0800000000000002e-002 | AE150: -7.3599999999999999e-002 | AF150: 87.06 | AG150: 89.07 | AH150: 0.81 | AI150: A+ | AJ150: 7.4999999999999997e-002 | AK150: =I150+100*T150 -> 130. | AL150: 130.9 | AM150: 91 | AN150: 41.8 | AO150: 120 | AP150: 4.0000000000000001e-003 | AQ150: 59 | AR150: 今飞转债!
A151: 278 | B151: 众信转债! | C151: 128022 | D151: 43097. | E151: 众信旅游 | F151: 2707 | G151: 旅游餐饮 | H151: 旅游 | I151: 112.468 | J151: -1.0200000000000001e-002 | K151: -7.000000000000001e-004 | L151: 6.58 | M151: -3.5200000000000002e-002 | N151: 30 | O151: 5.7999999999999996e-002 | P151: 109.8 | Q151: 7.91 | R151: 2.91 | S151: 83.19 | T151: 0.35200000000000004 | U151: 转股中 | V151: 3年38天 | W151: 1年38天 | X151: 7.5999999999999998e-002 | Y151: 6.3e-002 | Z151: 4.56 | AA151: 60 | AB151: -7.9000000000000008e-003 | AC151: -1.37e-002 | AD151: -7.0800000000000002e-002 | AE151: -7.4299999999999991e-002 | AF151: 97.26 | AG151: 96.62 | AH151: 0.31 | AI151: AA | AJ151: 4.2999999999999997e-002 | AK151: =I151+100*T151 -> 147.66800000000001 | AL151: 141.8 | AM151: 200 | AN151: 44.5 | AO151: 142 | AP151: -0.22500000000000001 | AQ151: 24 | AR151: 众信转债!
A152: 126 | B152: 柳药转债 | C152: 113563 | D152: 43885. | E152: 柳药股份 | F152: 603368 | G152: 医药 | H152: 医药商业 | I152: 117.91 | J152: -8.0000000000000004e-004 | K152: -4.6999999999999993e-003 | L152: 22.51 | M152: -1.01e-002 | N152: 3.2 | O152: 3.0000000000000001e-003 | P152: 113.2 | Q152: 24.47 | R152: 1.78 | S152: 91.99 | T152: 0.28199999999999997 | U152: 转股中 | V152: 5.23年 | W152: 3.23年 | X152: 9.8000000000000004e-002 | Y152: 8.9999999999999997e-002 | Z152: 8.02 | AA152: 82 | AB152: -7.9000000000000008e-003 | AC152: -1.24e-002 | AD152: -3.7499999999999999e-002 | AE152: -3.9399999999999998e-002 | AF152: 89.33 | AG152: 90.17 | AH152: 0.55 | AI152: AA | AJ152: 4.5400000000000003e-002 | AK152: =I152+100*T152 -> 146.10999999999999 | AL152: 143.8 | AM152: 210 | AN152: 53.7 | AO152: 203 | AP152: -4.2999999999999997e-002 | AQ152: 16 | AR152: 柳药转债
A153: 225 | B153: 台华转债! | C153: 113525 | D153: 43476. | E153: 台华新材 | F153: 603055 | G153: 服装纺织 | H153: 纺织行业 | I153: 118.72 | J153: -2.69e-002 | K153: 3.0699999999999998e-002 | L153: 9.05 | M153: 5.6000000000000008e-003 | N153: 7.5 | O153: 1.3000000000000001e-002 | P153: 114.9 | Q153: 8.03 | R153: 2.69 | S153: 112.7 | T153: 5.2999999999999999e-002 | U153: 转股中 | V153: 4年54天 | W153: 2年54天 | X153: 6.7000000000000004e-002 | Y153: 7.4999999999999997e-002 | Z153: 4.69 | AA153: 70 | AB153: -8.0000000000000002e-003 | AC153: -1.44e-002 | AD153: -5.8600000000000006e-002 | AE153: -6.1100000000000002e-002 | AF153: 93.91 | AG153: 96.86 | AH153: 0.69 | AI153: AA | AJ153: 4.2999999999999997e-002 | AK153: =I153+100*T153 -> 124.02 | AL153: 124.7 | AM153: 23 | AN153: 27.9 | AO153: 13 | AP153: -1.e-003 | AQ153: 22 | AR153: 台华转债!
A154: 59 | B154: 正邦转债 | C154: 128114 | D154: 44027. | E154: 正邦科技 | F154: 2157 | G154: 农业 | H154: 畜牧业 | I154: 120.56 | J154: -1.3300000000000001e-002 | K154: -7.6e-003 | L154: 16.64 | M154: -3.2000000000000001e-002 | N154: 48 | O154: 2.5000000000000001e-002 | P154: 115.3 | Q154: 16.09 | R154: 3.54 | S154: 103.42 | T154: 0.16600000000000001 | U154: 2月0天 | V154: 5.65年 | W154: 3.65年 | X154: 3.7999999999999999e-002 | Y154: 3.9e-002 | Z154: 16 | AA154: 419 | AB154: -8.0000000000000002e-003 | AC154: -1.2800000000000001e-002 | AD154: -3.8800000000000001e-002 | AE154: -4.0599999999999997e-002 | AF154: 88.41 | AG154: 91.13 | AH154: 0.65 | AI154: AA+ | AJ154: 4.3400000000000001e-002 | AK154: =I154+100*T154 -> 137.16 | AL154: 137.7 | AM154: 155 | AN154: 46.6 | AO154: 156 | AP154: -9.8000000000000004e-002 | AQ154: 8 | AR154: 正邦转债
A155: 287 | B155: 林洋转债! | C155: 113014 | D155: 43052. | E155: 林洋能源 | F155: 601222 | G155: 能源电力 | H155: 电力设备 | I155: 113.01 | J155: -9.0000000000000011e-003 | K155: -4.5000000000000005e-003 | L155: 7.68 | M155: -3.27e-002 | N155: 15 | O155: 4.0000000000000001e-003 | P155: 110.3 | Q155: 8.54 | R155: 1.33 | S155: 89.93 | T155: 0.25700000000000001 | U155: 转股中 | V155: 3年3.1天 | W155: 1年3.1天 | X155: 0.223 | Y155: 0.20100000000000001 | Z155: 30 | AA155: 134 | AB155: -8.199999999999999e-003 | AC155: -1.4499999999999999e-002 | AD155: -7.8299999999999995e-002 | AE155: -8.2400000000000001e-002 | AF155: 97.9 | AG155: 97.48 | AH155: 0.41 | AI155: AA | AJ155: 4.2999999999999997e-002 | AK155: =I155+100*T155 -> 138.71000000000001 | AL155: 136.1 | AM155: 145 | AN155: 38.2 | AO155: 89 | AP155: 2.2000000000000002e-002 | AQ155: 22 | AR155: 林洋转债!
A156: 39 | B156: 宏川转债 | C156: 128121 | D156: 44050. | E156: 宏川智慧 | F156: 2930 | G156: 交通运输 | H156: 物流业 | I156: 118.7 | J156: -2.2599999999999999e-002 | K156: 3.2799999999999996e-002 | L156: 20.35 | M156: 1.34e-002 | N156: 128 | O156: 0.154 | P156: 113.3 | Q156: 20.25 | R156: 4.91 | S156: 100.49 | T156: 0.18100000000000002 | U156: 3月3天 | V156: 5.73年 | W156: 3.73年 | X156: 7.400000000000001e-002 | Y156: 7.4999999999999997e-002 | Z156: 6.7 | AA156: 90 | AB156: -8.199999999999999e-003 | AC156: -1.24e-002 | AD156: -3.4099999999999998e-002 | AE156: -3.5900000000000001e-002 | AF156: 81 | AG156: 78.98 | AH156: 0.75 | AI156: AA- | AJ156: 6.6400000000000001e-002 | AK156: =I156+100*T156 -> 136.80000000000001 | AL156: 136.9 | AM156: 150 | AN156: 55.9 | AO156: 221 | AP156: 2.5000000000000001e-002 | AQ156: 4 | AR156: 宏川转债
A157: 43 | B157: 龙大转债 | C157: 128119 | D157: 44050. | E157: 龙大肉食 | F157: 2726 | G157: 食品饮料 | H157: 肉制品 | I157: 126.13 | J157: -1.21e-002 | K157: 1.2800000000000001e-002 | L157: 11 | M157: 8.9999999999999998e-004 | N157: 42 | O157: 3.4000000000000002e-002 | P157: 120.2 | Q157: 9.56 | R157: 4.23 | S157: 115.06 | T157: 9.6000000000000002e-002 | U157: 2月25天 | V157: 5.72年 | W157: 3.72年 | X157: 8.6999999999999994e-002 | Y157: 0.10000000000000001 | Z157: 9.5 | AA157: 110 | AB157: -8.5000000000000006e-003 | AC157: -1.4499999999999999e-002 | AD157: -4.9500000000000002e-002 | AE157: -5.1200000000000002e-002 | AF157: 87.4 | AG157: 93.67 | AH157: 0.73 | AI157: AA | AJ157: 4.5400000000000003e-002 | AK157: =I157+100*T157 -> 135.72999999999999 | AL157: 137.2 | AM157: 153 | AN157: 43.5 | AO157: 132 | AP157: 3.9e-002 | AQ157: 5 | AR157: 龙大转债
A158: 214 | B158: 博彦转债 | C158: 128057 | D158: 43557. | E158: 博彦科技 | F158: 2649 | G158: 计算机及 | H158: 软件开发 | I158: 121.604 | J158: -2.3199999999999998e-002 | K158: 9.1999999999999998e-003 | L158: 10.19 | M158: -1.7399999999999999e-002 | N158: 34 | O158: 5.2000000000000005e-002 | P158: 117.1 | Q158: 8.72 | R158: 1.91 | S158: 116.86 | T158: 4.0999999999999995e-002 | U158: 转股中 | V158: 4.36年 | W158: 2.36年 | X158: 9.8000000000000004e-002 | Y158: 0.114 | Z158: 5.29 | AA158: 54 | AB158: -8.8000000000000005e-003 | AC158: -1.5600000000000001e-002 | AD158: -6.2100000000000002e-002 | AE158: -6.4600000000000005e-002 | AF158: 88.74 | AG158: 89.89 | AH158: 0.8 | AI158: AA- | AJ158: 6.4000000000000001e-002 | AK158: =I158+100*T158 -> 125.70399999999999 | AL158: 126.4 | AM158: 37 | AN158: 36.5 | AO158: 67 | AP158: 4.0000000000000001e-002 | AQ158: 29 | AR158: 博彦转债
A159: 299 | B159: 国贸转债! | C159: 110033 | D159: 42388. | E159: 厦门国贸 | F159: 600755 | G159: 交通运输 | H159: 交通运输 | I159: 110.91 | J159: -2.8999999999999998e-003 | K159: 1.1999999999999999e-003 | L159: 6.85 | M159: -5.7999999999999996e-003 | N159: 13 | O159: 9.0000000000000011e-003 | P159: 109.7 | Q159: 7.19 | R159: 0.9 | S159: 95.27 | T159: 0.16399999999999998 | U159: 转股中 | V159: 1.20年 | W159: 回售中 | X159: 9.5000000000000001e-002 | Y159: 8.9999999999999997e-002 | Z159: 12.1 | AA159: 128 | AB159: -9.1999999999999998e-003 | AC159: -2.4e-002 | AD159: 回售中 | AE159: 回售中 | AF159: 100.28 | AG159: 105.01 | AH159: 0.29 | AI159: AAA | AJ159: 3.7599999999999995e-002 | AK159: =I159+100*T159 -> 127.31 | AL159: 126.5 | AM159: 39 | AN159: 21.5 | AO159: 4 | AP159: -6.9999999999999993e-003 | AQ159: 18 | AR159: 国贸转债!
A160: 49 | B160: 美联转债 | C160: 123057 | D160: 44039. | E160: 美联新材 | F160: 300586 | G160: 化工 | H160: 橡胶塑料 | I160: 124.489 | J160: -4.24e-002 | K160: 5.5500000000000001e-002 | L160: 11.12 | M160: 1.6500000000000001e-002 | N160: 1769. | O160: 6.0999999999999996 | P160: 118.2 | Q160: 9.91 | R160: 6.95 | S160: 112.21 | T160: 0.109 | U160: 2月15天 | V160: 5.69年 | W160: 3.69年 | X160: 4.0999999999999995e-002 | Y160: 4.5999999999999999e-002 | Z160: 2.07 | AA160: 51 | AB160: -9.300000000000001e-003 | AC160: -1.47e-002 | AD160: -4.58e-002 | AE160: -4.7699999999999992e-002 | AF160: 81.5 | AG160: 82.67 | AH160: 0.79 | AI160: AA- | AJ160: 6.6400000000000001e-002 | AK160: =I160+100*T160 -> 135.38900000000001 | AL160: 136.8 | AM160: 148 | AN160: 54.1 | AO160: 208 | AP160: 5.0999999999999997e-002 | AQ160: 7 | AR160: 美联转债
A161: 141 | B161: 至纯转债! | C161: 113556 | D161: 43839. | E161: 至纯科技 | F161: 603690 | G161: 机械装备 | H161: 专用设备 | I161: 133.2 | J161: -6.1900000000000004e-002 | K161: 1.55e-002 | L161: 32.82 | M161: -5.96e-002 | N161: 208 | O161: 0.49700000000000005 | P161: 126.8 | Q161: 29.37 | R161: 6.02 | S161: 111.75 | T161: 0.192 | U161: 转股中 | V161: 5年57天 | W161: 3年57天 | X161: 3.5000000000000003e-002 | Y161: 3.9e-002 | Z161: 2.96 | AA161: 85 | AB161: -9.7000000000000003e-003 | AC161: -1.8100000000000002e-002 | AD161: -7.0699999999999999e-002 | AE161: -7.3099999999999998e-002 | AF161: 82.03 | AG161: 87.16 | AH161: 0.78 | AI161: A+ | AJ161: 7.7399999999999997e-002 | AK161: =I161+100*T161 -> 152.39999999999998 | AL161: 154.7 | AM161: 248 | AN161: 67.5 | AO161: 250 | AP161: -0.11199999999999999 | AQ161: 13 | AR161: 至纯转债!
A162: 186 | B162: 文灿转债! | C162: 113537 | D162: 43651. | E162: 文灿股份 | F162: 603348 | G162: 汽车 | H162: 零部件制 | I162: 127.1 | J162: -1.72e-002 | K162: -1.e-003 | L162: 23.89 | M162: -2.2499999999999999e-002 | N162: 25 | O162: 3.9e-002 | P162: 121.5 | Q162: 19.43 | R162: 2.42 | S162: 122.95 | T162: 3.4000000000000002e-002 | U162: 转股中 | V162: 4.63年 | W162: 2.63年 | X162: 8.6999999999999994e-002 | Y162: 0.107 | Z162: 5.04 | AA162: 58 | AB162: -9.8999999999999991e-003 | AC162: -1.77e-002 | AD162: -6.8699999999999997e-002 | AE162: -7.1399999999999991e-002 | AF162: 87.99 | AG162: 91.84 | AH162: 0.81 | AI162: AA- | AJ162: 6.4000000000000001e-002 | AK162: =I162+100*T162 -> 130.5 | AL162: 131.2 | AM162: 96 | AN162: 39.4 | AO162: 103 | AP162: -1.8000000000000002e-002 | AQ162: 26 | AR162: 文灿转债!
A163: 269 | B163: 蒙电转债! | C163: 110041 | D163: 43109. | E163: 内蒙华电 | F163: 600863 | G163: 能源电力 | H163: 电力供应 | I163: 113.79 | J163: 1.7000000000000001e-003 | K163: 2.3e-003 | L163: 2.64 | M163: 7.6e-003 | N163: 3.8 | O163: 2.e-003 | P163: 110.3 | Q163: 2.69 | R163: 1.34 | S163: 98.14 | T163: 0.159 | U163: 转股中 | V163: 3年59天 | W163: 1年59天 | X163: 0.122 | Y163: 0.12 | Z163: 18.7 | AA163: 153 | AB163: -1.e-002 | AC163: -1.6e-002 | AD163: -7.4299999999999991e-002 | AE163: -7.8e-002 | AF163: 97.88 | AG163: 98.3 | AH163: 0.53 | AI163: AAA | AJ163: 3.7999999999999999e-002 | AK163: =I163+100*T163 -> 129.69 | AL163: 129.4 | AM163: 65 | AN163: 31.1 | AO163: 22 | AP163: 4.0000000000000001e-003 | AQ163: 8 | AR163: 蒙电转债!
A164: 108 | B164: 三祥转债! | C164: 113572 | D164: 43930. | E164: 三祥新材 | F164: 603663 | G164: 其他 | H164: 其他 | I164: 119.36 | J164: -2.8199999999999999e-002 | K164: 1.61e-002 | L164: 15.14 | M164: -1.4999999999999999e-002 | N164: 128 | O164: 0.59899999999999998 | P164: 113.2 | Q164: 14.19 | R164: 5.21 | S164: 106.69 | T164: 0.11900000000000001 | U164: 转股中 | V164: 5.38年 | W164: 3.38年 | X164: 5.7999999999999996e-002 | Y164: 6.2e-002 | Z164: 1.7 | AA164: 29 | AB164: -1.e-002 | AC164: -1.43e-002 | AD164: -3.9199999999999999e-002 | AE164: -4.1100000000000005e-002 | AF164: 79.82 | AG164: 76.44 | AH164: 0.81 | AI164: A+ | AJ164: 7.7399999999999997e-002 | AK164: =I164+100*T164 -> 131.25999999999999 | AL164: 132 | AM164: 100 | AN164: 52.2 | AO164: 194 | AP164: -6.3e-002 | AQ164: 15 | AR164: 三祥转债!
A165: 203 | B165: 精测转债!! | C165: 123025 | D165: 43574. | E165: 精测电子 | F165: 300567 | G165: 电子 | H165: 液晶显示 | I165: 122.601 | J165: -3.0099999999999998e-002 | K165: 9.7999999999999997e-003 | L165: 51.63 | M165: -2.9700000000000001e-002 | N165: 122 | O165: 0.311 | P165: 117.3 | Q165: 49.95 | R165: 8.93 | S165: 103.36 | T165: 0.18600000000000003 | U165: 转股中 | V165: 4.43年 | W165: 2.43年 | X165: 2.4e-002 | Y165: 2.5000000000000001e-002 | Z165: 3.09 | AA165: 127 | AB165: -1.01e-002 | AC165: -1.6899999999999998e-002 | AD165: -6.3399999999999998e-002 | AE165: -6.5799999999999997e-002 | AF165: 88.4 | AG165: 89.69 | AH165: 0.68 | AI165: AA- | AJ165: 6.4000000000000001e-002 | AK165: =I165+100*T165 -> 141.20099999999999 | AL165: 141.8 | AM165: 201 | AN165: 52.2 | AO165: 193 | AP165: -4.0999999999999995e-002 | AQ165: 17 | AR165: 精测转债!!
A166: 60 | B166: 比音转债 | C166: 128113 | D166: 44027. | E166: 比音勒芬 | F166: 2832 | G166: 服装纺织 | H166: 服装行业 | I166: 124.11 | J166: -1.55e-002 | K166: -4.5000000000000005e-003 | L166: 17.72 | M166: -2.58e-002 | N166: 36 | O166: 4.0999999999999995e-002 | P166: 117.3 | Q166: 14.9 | R166: 4.32 | S166: 118.93 | T166: 4.4000000000000004e-002 | U166: 58天 | V166: 5.64年 | W166: 3.64年 | X166: 7.400000000000001e-002 | Y166: 8.8000000000000009e-002 | Z166: 6.89 | AA166: 93 | AB166: -1.01e-002 | AC166: -1.54e-002 | AD166: -4.6199999999999998e-002 | AE166: -4.8000000000000001e-002 | AF166: 87.8 | AG166: 91.75 | AH166: 0.77 | AI166: AA | AJ166: 4.5400000000000003e-002 | AK166: =I166+100*T166 -> 128.50999999999999 | AL166: 129.3 | AM166: 63 | AN166: 37.5 | AO166: 77 | AP166: 2.1000000000000001e-002 | AQ166: 4 | AR166: 比音转债
A167: 79 | B167: 健友转债 | C167: 113579 | D167: 43973. | E167: 健友股份 | F167: 603707 | G167: 医药 | H167: 原料药 | I167: 120.76 | J167: -1.7000000000000001e-003 | K167: -7.6e-003 | L167: 37.24 | M167: -1.8500000000000003e-002 | N167: 12 | O167: 1.9e-002 | P167: 114.2 | Q167: 42.05 | R167: 10.15 | S167: 88.56 | T167: 0.36399999999999999 | U167: 6.1天 | V167: 5.50年 | W167: 3.50年 | X167: 1.3999999999999999e-002 | Y167: 1.3000000000000001e-002 | Z167: 5.03 | AA167: 348 | AB167: -1.03e-002 | AC167: -1.4800000000000001e-002 | AD167: -4.1100000000000005e-002 | AE167: -4.2900000000000001e-002 | AF167: 88.27 | AG167: 89.9 | AH167: 0.51 | AI167: AA | AJ167: 4.5400000000000003e-002 | AK167: =I167+100*T167 -> 157.16 | AL167: 153 | AM167: 243 | AN167: 63.1 | AO167: 241 | AP167: -0.11199999999999999 | AQ167: 7 | AR167: 健友转债
A168: 57 | B168: 润达转债 | C168: 113588 | D168: 44025. | E168: 润达医疗 | F168: 603108 | G168: 医药 | H168: 医疗器械 | I168: 121.2 | J168: -7.4000000000000003e-003 | K168: 4.0999999999999995e-003 | L168: 13.28 | M168: -5.1999999999999998e-003 | N168: 6.3 | O168: 9.0000000000000011e-003 | P168: 114.2 | Q168: 13.36 | R168: 2.68 | S168: 99.4 | T168: 0.21899999999999997 | U168: 2月0天 | V168: 5.65年 | W168: 3.65年 | X168: 7.0999999999999994e-002 | Y168: 7.0999999999999994e-002 | Z168: 5.5 | AA168: 77 | AB168: -1.0700000000000001e-002 | AC168: -1.5100000000000001e-002 | AD168: -4.0399999999999998e-002 | AE168: -4.2099999999999999e-002 | AF168: 87.68 | AG168: 89.3 | AH168: 0.63 | AI168: AA | AJ168: 4.5400000000000003e-002 | AK168: =I168+100*T168 -> 143.09999999999999 | AL168: 143 | AM168: 205 | AN168: 53.7 | AO168: 205 | AP168: -1.6e-002 | AQ168: 7 | AR168: 润达转债
A169: 168 | B169: 金能转债 | C169: 113545 | D169: 43776. | E169: 金能科技 | F169: 603113 | G169: 煤炭 | H169: 炼焦 | I169: 121.21 | J169: 4.0000000000000002e-004 | K169: -9.3999999999999986e-003 | L169: 11.92 | M169: -1.41e-002 | N169: 24 | O169: 1.3000000000000001e-002 | P169: 114.9 | Q169: 11.4 | R169: 1.36 | S169: 104.56 | T169: 0.159 | U169: 转股中 | V169: 4.97年 | W169: 2.97年 | X169: 0.18600000000000003 | Y169: 0.19500000000000001 | Z169: 15 | AA169: 81 | AB169: -1.09e-002 | AC169: -1.61e-002 | AD169: -4.9699999999999994e-002 | AE169: -5.1699999999999996e-002 | AF169: 90.7 | AG169: 93.55 | AH169: 0.64 | AI169: AA | AJ169: 4.2999999999999997e-002 | AK169: =I169+100*T169 -> 137.10999999999999 | AL169: 137.9 | AM169: 156 | AN169: 44.3 | AO169: 140 | AP169: -2.8999999999999998e-002 | AQ169: 21 | AR169: 金能转债
A170: 180 | B170: 荣晟转债! | C170: 113541 | D170: 43690. | E170: 荣晟环保 | F170: 603165 | G170: 造纸包装 | H170: 包装用纸 | I170: 121.21 | J170: -2.7999999999999997e-002 | K170: 1.52e-002 | L170: 13.89 | M170: -1.5600000000000001e-002 | N170: 12 | O170: 3.5000000000000003e-002 | P170: 115 | Q170: 11.54 | R170: 2.4 | S170: 120.36 | T170: 6.9999999999999993e-003 | U170: 转股中 | V170: 4.75年 | W170: 2.75年 | X170: 7.9000000000000001e-002 | Y170: 9.5000000000000001e-002 | Z170: 2.75 | AA170: 35 | AB170: -1.1200000000000002e-002 | AC170: -1.6799999999999999e-002 | AD170: -5.33e-002 | AE170: -5.5399999999999998e-002 | AF170: 86.55 | AG170: 86.19 | AH170: 0.82 | AI170: AA- | AJ170: 6.4000000000000001e-002 | AK170: =I170+100*T170 -> 121.91 | AL170: 122.1 | AM170: 13 | AN170: 35.5 | AO170: 57 | AP170: -2.3e-002 | AQ170: 49 | AR170: 荣晟转债!
A171: 9 | B171: 景20转债 | C171: 113602 | D171: 44096. | E171: 景旺电子 | F171: 603228 | G171: 电子 | H171: 元器件制 | I171: 121.01 | J171: -1.0500000000000001e-002 | K171: -5.5000000000000005e-003 | L171: 34.1 | M171: -2.5699999999999997e-002 | N171: 46 | O171: 2.1000000000000001e-002 | P171: 113.3 | Q171: 35.28 | R171: 5.04 | S171: 96.66 | T171: 0.252 | U171: 4月8天 | V171: 5.83年 | W171: 3.83年 | X171: 6.0999999999999999e-002 | Y171: 5.9000000000000004e-002 | Z171: 17.8 | AA171: 290 | AB171: -1.1399999999999999e-002 | AC171: -1.55e-002 | AD171: -3.7900000000000003e-002 | AE171: -3.9699999999999999e-002 | AF171: 87.05 | AG171: 87.89 | AH171: 0.62 | AI171: AA | AJ171: 4.5400000000000003e-002 | AK171: =I171+100*T171 -> 146.21000000000001 | AL171: 145.4 | AM171: 217 | AN171: 57.5 | AO171: 228 | AP171: -1.e-003 | AQ171: 5 | AR171: 景20转债
A172: 58 | B172: 晨光转债 | C172: 123055 | D172: 44025. | E172: 晨光生物 | F172: 300138 | G172: 食品饮料 | H172: 食品加工 | I172: 132.5 | J172: -2.8199999999999999e-002 | K172: 8.199999999999999e-003 | L172: 16.13 | M172: -2.3e-002 | N172: 28 | O172: 3.3000000000000002e-002 | P172: 124.3 | Q172: 12.25 | R172: 4.39 | S172: 131.67 | T172: 6.0000000000000001e-003 | U172: 2月0天 | V172: 5.65年 | W172: 3.65年 | X172: 7.5999999999999998e-002 | Y172: 0.10000000000000001 | Z172: 6.3 | AA172: 83 | AB172: -1.15e-002 | AC172: -1.8500000000000003e-002 | AD172: -6.1600000000000002e-002 | AE172: -6.3500000000000001e-002 | AF172: 81.8 | AG172: 87.15 | AH172: 0.87 | AI172: AA- | AJ172: 6.6400000000000001e-002 | AK172: =I172+100*T172 -> 133.09999999999999 | AL172: 133.3 | AM172: 115 | AN172: 46.2 | AO172: 153 | AP172: 2.1000000000000001e-002 | AQ172: 6 | AR172: 晨光转债
A173: 65 | B173: 永兴转债 | C173: 128110 | D173: 44020. | E173: 永兴材料 | F173: 2756 | G173: 钢铁 | H173: 炼钢 | I173: 121 | J173: -2.18e-002 | K173: 2.3e-002 | L173: 18.5 | M173: 1.6000000000000001e-003 | N173: 7.6 | O173: 9.0000000000000011e-003 | P173: 113.2 | Q173: 17.06 | R173: 1.96 | S173: 108.44 | T173: 0.11599999999999999 | U173: 52天 | V173: 5.62年 | W173: 3.62年 | X173: 0.10400000000000001 | Y173: 0.11199999999999999 | Z173: 7 | AA173: 68 | AB173: -1.2e-002 | AC173: -1.61e-002 | AD173: -4.0199999999999993e-002 | AE173: -4.2000000000000003e-002 | AF173: 87.77 | AG173: 88.6 | AH173: 0.71 | AI173: AA | AJ173: 4.5400000000000003e-002 | AK173: =I173+100*T173 -> 132.59999999999999 | AL173: 133.6 | AM173: 118 | AN173: 45 | AO173: 146 | AP173: 6.4000000000000001e-002 | AQ173: 4 | AR173: 永兴转债
A174: 147 | B174: 金牌转债! | C174: 113553 | D174: 43837. | E174: 金牌厨柜 | F174: 603180 | G174: 其他 | H174: 家居用品 | I174: 132.69 | J174: -1.1899999999999999e-002 | K174: -3.3e-003 | L174: 55.89 | M174: -1.8100000000000002e-002 | N174: 21 | O174: 5.7000000000000002e-002 | P174: 124.6 | Q174: 44.14 | R174: 4.56 | S174: 126.62 | T174: 4.8000000000000001e-002 | U174: 转股中 | V174: 5年50天 | W174: 3年50天 | X174: 5.0999999999999997e-002 | Y174: 6.4000000000000001e-002 | Z174: 2.75 | AA174: 54 | AB174: -1.24e-002 | AC174: -2.0199999999999999e-002 | AD174: -7.1599999999999997e-002 | AE174: -7.3700000000000002e-002 | AF174: 84.41 | AG174: 90.24 | AH174: 0.84 | AI174: AA- | AJ174: 6.6400000000000001e-002 | AK174: =I174+100*T174 -> 137.49000000000001 | AL174: 138.8 | AM174: 167 | AN174: 48.5 | AO174: 175 | AP174: -4.4999999999999998e-002 | AQ174: 15 | AR174: 金牌转债!
A175: 265 | B175: 江银转债! | C175: 128034 | D175: 43145. | E175: 江阴银行 | F175: 2807 | G175: 金融 | H175: 银行行业 | I175: 113.89 | J175: 6.5000000000000006e-003 | K175: -1.9e-003 | L175: 4.23 | M175: 9.4999999999999998e-003 | N175: 36 | O175: 1.8000000000000002e-002 | P175: 109.1 | Q175: 4.5 | R175: 0.81 | S175: 94 | T175: 0.21199999999999999 | U175: 转股中 | V175: 3.26年 | W175: 无权 | X175: 0.191 | Y175: 0.17999999999999999 | Z175: 17.6 | AA175: 92 | AB175: -1.3300000000000001e-002 | AC175: -1.84e-002 | AD175: 无权 | AE175: 无权 | AF175: 无权 | AG175: 95.92 | AH175: 0.49 | AI175: AA+ | AJ175: 4.0999999999999995e-002 | AK175: =I175+100*T175 -> 135.09 | AL175: 133.8 | AM175: 122 | AN175: 37.9 | AO175: 79 | AP175: 1.1000000000000001e-002 | AQ175: 27 | AR175: 江银转债!
A176: 33 | B176: 苏试转债 | C176: 123060 | D176: 44060. | E176: 苏试试验 | F176: 300416 | G176: 机械装备 | H176: 专用设备 | I176: 126.81 | J176: -4.07e-002 | K176: 1.0500000000000001e-002 | L176: 25.4 | M176: -3.9699999999999999e-002 | N176: 319 | O176: 0.75599999999999989 | P176: 117.6 | Q176: 23.86 | R176: 5.85 | S176: 106.45 | T176: 0.191 | U176: 3月5天 | V176: 5.74年 | W176: 3.74年 | X176: 5.9999999999999998e-002 | Y176: 6.4000000000000001e-002 | Z176: 3.1 | AA176: 52 | AB176: -1.3300000000000001e-002 | AC176: -1.8500000000000003e-002 | AD176: -5.0099999999999999e-002 | AE176: -5.1900000000000002e-002 | AF176: 81.06 | AG176: 81.92 | AH176: 0.76 | AI176: AA- | AJ176: 6.6400000000000001e-002 | AK176: =I176+100*T176 -> 145.91 | AL176: 147.2 | AM176: 225 | AN176: 65.2 | AO176: 247 | AP176: -3.4000000000000002e-002 | AQ176: 5 | AR176: 苏试转债
A177: 156 | B177: 利德转债! | C177: 123035 | D177: 43808. | E177: 利亚德 | F177: 300296 | G177: 电子 | H177: LED制 | I177: 123.7 | J177: -1.04e-002 | K177: 1.04e-002 | L177: 7.63 | M177: 0. | N177: 108 | O177: 0.107 | P177: 115.6 | Q177: 6.98 | R177: 2.29 | S177: 109.31 | T177: 0.13200000000000001 | U177: 转股中 | V177: 5年21天 | W177: 3年21天 | X177: 4.0999999999999995e-002 | Y177: 4.4999999999999998e-002 | Z177: 8 | AA177: 194 | AB177: -1.3600000000000001e-002 | AC177: -1.9e-002 | AD177: -5.28e-002 | AE177: -5.5e-002 | AF177: 90.96 | AG177: 93.73 | AH177: 0.68 | AI177: AA+ | AJ177: 4.3400000000000001e-002 | AK177: =I177+100*T177 -> 136.90000000000001 | AL177: 138.1 | AM177: 158 | AN177: 44.4 | AO177: 141 | AP177: -4.2000000000000003e-002 | AQ177: 16 | AR177: 利德转债!
A178: 88 | B178: 华统转债 | C178: 128106 | D178: 43959. | E178: 华统股份 | F178: 2840 | G178: 农业 | H178: 农产品加 | I178: 122 | J178: -9.5999999999999992e-003 | K178: 1.1999999999999999e-003 | L178: 10.25 | M178: -1.1599999999999999e-002 | N178: 7.8 | O178: 1.2e-002 | P178: 113.2 | Q178: 9.39 | R178: 1.73 | S178: 109.16 | T178: 0.11800000000000001 | U178: 转股中 | V178: 5.46年 | W178: 3.46年 | X178: 0.12 | Y178: 0.13100000000000001 | Z178: 5.5 | AA178: 46 | AB178: -1.3899999999999999e-002 | AC178: -1.8100000000000002e-002 | AD178: -4.4199999999999996e-002 | AE178: -4.5999999999999999e-002 | AF178: 88.41 | AG178: 89.25 | AH178: 0.73 | AI178: AA | AJ178: 4.5400000000000003e-002 | AK178: =I178+100*T178 -> 133.80000000000001 | AL178: 134.8 | AM178: 136 | AN178: 45.6 | AO178: 151 | AP178: -2.1000000000000001e-002 | AQ178: 7 | AR178: 华统转债
A179: 55 | B179: 雪榕转债 | C179: 123056 | D179: 44036. | E179: 雪榕生物 | F179: 300511 | G179: 农业 | H179: 种植业 | I179: 130.88 | J179: -1.84e-002 | K179: -7.4999999999999997e-003 | L179: 15.4 | M179: -2.9600000000000001e-002 | N179: 39 | O179: 4.9000000000000002e-002 | P179: 121.1 | Q179: 11.89 | R179: 3.55 | S179: 129.52 | T179: 1.e-002 | U179: 2月12天 | V179: 5.67年 | W179: 3.67年 | X179: 8.5999999999999993e-002 | Y179: 0.111 | Z179: 5.85 | AA179: 68 | AB179: -1.3899999999999999e-002 | AC179: -2.0099999999999996e-002 | AD179: -5.8700000000000002e-002 | AE179: -6.0499999999999998e-002 | AF179: 81.51 | AG179: 84.77 | AH179: 0.88 | AI179: AA- | AJ179: 6.6400000000000001e-002 | AK179: =I179+100*T179 -> 131.88 | AL179: 132.2 | AM179: 105 | AN179: 47.5 | AO179: 165 | AP179: -5.7000000000000002e-002 | AQ179: 10 | AR179: 雪榕转债
A180: 219 | B180: 中天转债! | C180: 110051 | D180: 43546. | E180: 中天科技 | F180: 600522 | G180: 通信互联 | H180: 通信设备 | I180: 121 | J180: -8.8000000000000005e-003 | K180: 3.3e-003 | L180: 10.9 | M180: -8.199999999999999e-003 | N180: 17 | O180: 3.0000000000000001e-003 | P180: 113.9 | Q180: 10.09 | R180: 1.56 | S180: 108.03 | T180: 0.12 | U180: 转股中 | V180: 4.35年 | W180: 2.35年 | X180: 0.11900000000000001 | Y180: 0.128 | Z180: 39.6 | AA180: 334 | AB180: -1.41e-002 | AC180: -1.9699999999999999e-002 | AD180: -6.1200000000000004e-002 | AE180: -6.3500000000000001e-002 | AF180: 93.56 | AG180: 95.99 | AH180: 0.66 | AI180: AA+ | AJ180: 4.0999999999999995e-002 | AK180: =I180+100*T180 -> 133. | AL180: 134 | AM180: 124 | AN180: 38 | AO180: 83 | AP180: -1.e-003 | AQ180: 28 | AR180: 中天转债!
A181: 29 | B181: 国投转债 | C181: 110073 | D181: 44063. | E181: 国投资本 | F181: 600061 | G181: 金融 | H181: 证券行业 | I181: 119.9 | J181: -6.0000000000000001e-003 | K181: -5.5000000000000005e-003 | L181: 14.66 | M181: -1.9400000000000001e-002 | N181: 61 | O181: 6.0000000000000001e-003 | P181: 110.5 | Q181: 15.25 | R181: 1.53 | S181: 96.13 | T181: 0.247 | U181: 3月10天 | V181: 5.75年 | W181: 无权 | X181: 0.129 | Y181: 0.124 | Z181: 80 | AA181: 620 | AB181: -1.43e-002 | AC181: -1.7500000000000002e-002 | AD181: 无权 | AE181: 无权 | AF181: 无权 | AG181: 88.24 | AH181: 0.59 | AI181: AAA | AJ181: 4.0399999999999998e-002 | AK181: =I181+100*T181 -> 144.59999999999999 | AL181: 143.7 | AM181: 208 | AN181: 55.4 | AO181: 217 | AP181: -3.2000000000000001e-002 | AQ181: 20 | AR181: 国投转债
A182: 152 | B182: 烽火转债 | C182: 110062 | D182: 43824. | E182: 烽火通信 | F182: 600498 | G182: 通信互联 | H182: 通信设备 | I182: 119.47 | J182: -4.6999999999999993e-003 | K182: 5.9999999999999995e-004 | L182: 24.42 | M182: -7.3000000000000001e-003 | N182: 11 | O182: 3.0000000000000001e-003 | P182: 111 | Q182: 25.65 | R182: 2.74 | S182: 95.2 | T182: 0.255 | U182: 转股中 | V182: 5年39天 | W182: 3年39天 | X182: 0.10800000000000001 | Y182: 0.10300000000000001 | Z182: 30.9 | AA182: 286 | AB182: -1.46e-002 | AC182: -1.84e-002 | AD182: -4.3299999999999998e-002 | AE182: -4.5199999999999997e-002 | AF182: 91.03 | AG182: 91.03 | AH182: 0.57 | AI182: AAA | AJ182: 4.0399999999999998e-002 | AK182: =I182+100*T182 -> 144.97 | AL182: 143.7 | AM182: 209 | AN182: 52.7 | AO182: 198 | AP182: 0. | AQ182: 19 | AR182: 烽火转债
A183: 71 | B183: 楚江转债 | C183: 128109 | D183: 44005. | E183: 楚江新材 | F183: 2171 | G183: 有色金属 | H183: 铜金属 | I183: 125 | J183: -2.7200000000000002e-002 | K183: 7.7000000000000002e-003 | L183: 9.72 | M183: -2.7000000000000003e-002 | N183: 20 | O183: 9.0000000000000011e-003 | P183: 115.3 | Q183: 8.73 | R183: 2.42 | S183: 111.34 | T183: 0.12300000000000001 | U183: 47天 | V183: 5.61年 | W183: 3.61年 | X183: 0.14099999999999999 | Y183: 0.157 | Z183: 18.3 | AA183: 130 | AB183: -1.46e-002 | AC183: -1.9299999999999998e-002 | AD183: -4.8399999999999999e-002 | AE183: -5.0199999999999995e-002 | AF183: 87.92 | AG183: 90.31 | AH183: 0.72 | AI183: AA | AJ183: 4.5400000000000003e-002 | AK183: =I183+100*T183 -> 137.30000000000001 | AL183: 138.7 | AM183: 166 | AN183: 48.3 | AO183: 172 | AP183: -2.7999999999999997e-002 | AQ183: 5 | AR183: 楚江转债
A184: 118 | B184: 盛屯转债! | C184: 110066 | D184: 43921. | E184: 盛屯矿业 | F184: 600711 | G184: 有色金属 | H184: 有色行业 | I184: 124.64 | J184: -5.3e-003 | K184: 5.3e-003 | L184: 5.77 | M184: 0. | N184: 28 | O184: 9.0000000000000011e-003 | P184: 115.3 | Q184: 4.88 | R184: 1.47 | S184: 118.24 | T184: 5.4000000000000006e-002 | U184: 转股中 | V184: 5.35年 | W184: 3.35年 | X184: 0.17600000000000002 | Y184: 0.20899999999999999 | Z184: 23.6 | AA184: 134 | AB184: -1.47e-002 | AC184: -1.9699999999999999e-002 | AD184: -5.1100000000000007e-002 | AE184: -5.2999999999999999e-002 | AF184: 88.93 | AG184: 91.35 | AH184: 0.76 | AI184: AA | AJ184: 4.5400000000000003e-002 | AK184: =I184+100*T184 -> 130.03999999999999 | AL184: 131 | AM184: 94 | AN184: 39.7 | AO184: 107 | AP184: 1.2e-002 | AQ184: 44 | AR184: 盛屯转债!
A185: 132 | B185: 正裕转债! | C185: 113561 | D185: 43871. | E185: 正裕工业 | F185: 603089 | G185: 汽车 | H185: 零部件制 | I185: 128.27 | J185: -2.3199999999999998e-002 | K185: 1.47e-002 | L185: 13.23 | M185: -9.7000000000000003e-003 | N185: 158 | O185: 0.74199999999999999 | P185: 118.5 | Q185: 10.23 | R185: 3.53 | S185: 129.33 | T185: -8.0000000000000002e-003 | U185: 转股中 | V185: 5.19年 | W185: 3.19年 | X185: 5.4000000000000006e-002 | Y185: 7.0000000000000007e-002 | Z185: 1.59 | AA185: 29 | AB185: -1.55e-002 | AC185: -2.1600000000000001e-002 | AD185: -5.96e-002 | AE185: -6.2e-002 | AF185: 81.83 | AG185: 81.34 | AH185: 0.88 | AI185: A+ | AJ185: 7.7399999999999997e-002 | AK185: =I185+100*T185 -> 127.47000000000001 | AL185: 127.2 | AM185: 44 | AN185: 45.4 | AO185: 149 | AP185: 6.0999999999999999e-002 | AQ185: 31 | AR185: 正裕转债!
A186: 282 | B186: 嘉澳转债! | C186: 113502 | D186: 43066. | E186: 嘉澳环保 | F186: 603822 | G186: 化工 | H186: 化工 | I186: 117.67 | J186: 7.5600000000000001e-002 | K186: -7.5700000000000003e-002 | L186: 24.6 | M186: -1.01e-002 | N186: 1391. | O186: 5.9699999999999998 | P186: 112.3 | Q186: 44.79 | R186: 2.43 | S186: 54.92 | T186: 1.1399999999999999 | U186: 转股中 | V186: 3年17天 | W186: 1年17天 | X186: 0.10300000000000001 | Y186: 5.5999999999999994e-002 | Z186: 1.85 | AA186: 18 | AB186: -1.5600000000000001e-002 | AC186: -2.2799999999999997e-002 | AD186: -0.10199999999999999 | AE186: -0.106 | AF186: 95.43 | AG186: 93.39 | AH186: 0.01 | AI186: AA- | AJ186: 6.4000000000000001e-002 | AK186: =I186+100*T186 -> 231.66999999999999 | AL186: 180.4 | AM186: 273 | AN186: 85 | AO186: 269 | AP186: -1.6e-002 | AQ186: 29 | AR186: 嘉澳转债!
A187: 18 | B187: 赣锋转2 | C187: 128126 | D187: 44082. | E187: 赣锋锂业 | F187: 2460 | G187: 有色金属 | H187: 小金属 | I187: 122.001 | J187: -1.4499999999999999e-002 | K187: 1.49e-002 | L187: 58.24 | M187: 5.0000000000000001e-004 | N187: 75 | O187: 2.7999999999999997e-002 | P187: 111.1 | Q187: 60.27 | R187: 9.36 | S187: 96.63 | T187: 0.26300000000000001 | U187: 3月21天 | V187: 5.78年 | W187: 3.78年 | X187: 2.7000000000000003e-002 | Y187: 2.6000000000000002e-002 | Z187: 21.1 | AA187: 776 | AB187: -1.6299999999999999e-002 | AC187: -1.9699999999999999e-002 | AD187: -4.2599999999999999e-002 | AE187: -4.3899999999999995e-002 | AF187: 86.42 | AG187: 86.27 | AH187: 0.62 | AI187: AA | AJ187: 4.5400000000000003e-002 | AK187: =I187+100*T187 -> 148.30100000000002 | AL187: 147.4 | AM187: 227 | AN187: 61 | AO187: 237 | AP187: 4.4000000000000004e-002 | AQ187: 6 | AR187: 赣锋转2
A188: 157 | B188: 川投转债 | C188: 110061 | D188: 43801. | E188: 川投能源 | F188: 600674 | G188: 能源电力 | H188: 水电 | I188: 120.55 | J188: 7.000000000000001e-004 | K188: -4.0000000000000001e-003 | L188: 9.72 | M188: -5.1000000000000004e-003 | N188: 4.6 | O188: 1.e-003 | P188: 111 | Q188: 9.58 | R188: 1.63 | S188: 101.46 | T188: 0.188 | U188: 转股中 | V188: 5年18天 | W188: 3年18天 | X188: 9.3000000000000013e-002 | Y188: 9.5000000000000001e-002 | Z188: 40 | AA188: 428 | AB188: -1.6500000000000001e-002 | AC188: -2.0400000000000001e-002 | AD188: -4.6699999999999998e-002 | AE188: -4.87e-002 | AF188: 91.23 | AG188: 91.24 | AH188: 0.64 | AI188: AAA | AJ188: 4.0399999999999998e-002 | AK188: =I188+100*T188 -> 139.34999999999999 | AL188: 139.6 | AM188: 174 | AN188: 48.4 | AO188: 173 | AP188: -1.7000000000000001e-002 | AQ188: 15 | AR188: 川投转债
A189: 297 | B189: 广汽转债!! | C189: 113009 | D189: 42404. | E189: 广汽集团 | F189: 601238 | G189: 汽车 | H189: 乘用车 | I189: 109.76 | J189: 1.7000000000000001e-003 | K189: 3.7000000000000002e-003 | L189: 11.98 | M189: 4.4500000000000005e-002 | N189: 167 | O189: 5.9000000000000004e-002 | P189: 107.5 | Q189: 14.23 | R189: 1.52 | S189: 84.19 | T189: 0.30399999999999999 | U189: 转股中 | V189: 1.25年 | W189: 回售中 | X189: 2.1000000000000001e-002 | Y189: 1.7000000000000001e-002 | Z189: 25.5 | AA189: 1227. | AB189: -1.67e-002 | AC189: -2.7799999999999998e-002 | AD189: 回售中 | AE189: 回售中 | AF189: 100.25 | AG189: 102.72 | AH189: 0.12 | AI189: AAA | AJ189: 3.7599999999999995e-002 | AK189: =I189+100*T189 -> 140.16 | AL189: 135.3 | AM189: 138 | AN189: 32.6 | AO189: 35 | AP189: 0.17100000000000001 | AQ189: 14 | AR189: 广汽转债!!
A190: 166 | B190: 太极转债! | C190: 128078 | D190: 43777. | E190: 太极股份 | F190: 2368 | G190: 计算机及 | H190: 软件开发 | I190: 127 | J190: -2.8300000000000002e-002 | K190: 2.06e-002 | L190: 27.1 | M190: -7.7000000000000002e-003 | N190: 18 | O190: 1.3999999999999999e-002 | P190: 116.9 | Q190: 22.4 | R190: 3.63 | S190: 120.98 | T190: 5.0000000000000003e-002 | U190: 转股中 | V190: 4.99年 | W190: 2.99年 | X190: 6.0999999999999999e-002 | Y190: 7.400000000000001e-002 | Z190: 9.6 | AA190: 157 | AB190: -1.67e-002 | AC190: -2.2499999999999999e-002 | AD190: -6.3500000000000001e-002 | AE190: -6.54e-002 | AF190: 90.63 | AG190: 95.1 | AH190: 1 | AI190: AA | AJ190: 4.2999999999999997e-002 | AK190: =I190+100*T190 -> 132. | AL190: 133 | AM190: 111 | AN190: 37.9 | AO190: 81 | AP190: -4.9000000000000002e-002 | AQ190: 12 | AR190: 太极转债!
A191: 167 | B191: 金轮转债! | C191: 128076 | D191: 43777. | E191: 金轮股份 | F191: 2722 | G191: 机械装备 | H191: 专用设备 | I191: 125 | J191: 7.0099999999999996e-002 | K191: -7.4200000000000002e-002 | L191: 12.59 | M191: -7.9000000000000008e-003 | N191: 2678. | O191: 9.5299999999999994 | P191: 114.9 | Q191: 14.76 | R191: 1.19 | S191: 85.3 | T191: 0.46500000000000002 | U191: 转股中 | V191: 4.97年 | W191: 2.97年 | X191: 9.6999999999999989e-002 | Y191: 8.3000000000000004e-002 | Z191: 2.14 | AA191: 22 | AB191: -1.7100000000000001e-002 | AC191: -2.23e-002 | AD191: -5.91e-002 | AE191: -6.0999999999999999e-002 | AF191: 85.25 | AG191: 84.89 | AH191: 0.52 | AI191: AA- | AJ191: 6.4000000000000001e-002 | AK191: =I191+100*T191 -> 171.5 | AL191: 164.7 | AM191: 261 | AN191: 79.5 | AO191: 264 | AP191: -4.0999999999999995e-002 | AQ191: 41 | AR191: 金轮转债!
A192: 119 | B192: 桐20转债! | C192: 113032 | D192: 43910. | E192: 桐昆股份 | F192: 601233 | G192: 服装纺织 | H192: 纺织行业 | I192: 124.5 | J192: -5.1000000000000004e-003 | K192: 1.9e-003 | L192: 16.05 | M192: -4.3e-003 | N192: 9.1 | O192: 3.0000000000000001e-003 | P192: 113.1 | Q192: 14.35 | R192: 1.53 | S192: 111.85 | T192: 0.113 | U192: 转股中 | V192: 5.35年 | W192: 3.35年 | X192: 7.4999999999999997e-002 | Y192: 8.4000000000000005e-002 | Z192: 22.4 | AA192: 297 | AB192: -1.8100000000000002e-002 | AC192: -2.2400000000000003e-002 | AD192: -5.1299999999999998e-002 | AE192: -5.3099999999999994e-002 | AF192: 89.33 | AG192: 90.49 | AH192: 0.74 | AI192: AA+ | AJ192: 4.3400000000000001e-002 | AK192: =I192+100*T192 -> 135.80000000000001 | AL192: 137.2 | AM192: 152 | AN192: 46.7 | AO192: 157 | AP192: 4.8000000000000001e-002 | AQ192: 20 | AR192: 桐20转债!
A193: 253 | B193: 华通转债! | C193: 128040 | D193: 43294. | E193: 华通医药 | F193: 2758 | G193: 医药 | H193: 医药商业 | I193: 120.12 | J193: -8.1000000000000013e-003 | K193: -4.0999999999999995e-003 | L193: 11.28 | M193: -1.9099999999999999e-002 | N193: 160 | O193: 0.58399999999999996 | P193: 112.3 | Q193: 11.29 | R193: 3.81 | S193: 99.91 | T193: 0.20199999999999999 | U193: 转股中 | V193: 3.64年 | W193: 1.64年 | X193: 9.4e-002 | Y193: 9.4e-002 | Z193: 2.22 | AA193: 24 | AB193: -1.8700000000000001e-002 | AC193: -2.46e-002 | AD193: -8.3199999999999996e-002 | AE193: -8.5900000000000004e-002 | AF193: 91.99 | AG193: 90.01 | AH193: 0.63 | AI193: AA- | AJ193: 6.4000000000000001e-002 | AK193: =I193+100*T193 -> 140.31999999999999 | AL193: 140.3 | AM193: 181 | AN193: 48.3 | AO193: 171 | AP193: 1.6e-002 | AQ193: 30 | AR193: 华通转债!
A194: 84 | B194: 春秋转债 | C194: 113577 | D194: 43964. | E194: 春秋电子 | F194: 603890 | G194: 电子 | H194: 电子产品 | I194: 130.84 | J194: -2.6800000000000001e-002 | K194: 1.9599999999999999e-002 | L194: 14.38 | M194: -8.3000000000000001e-003 | N194: 69 | O194: 0.217 | P194: 118.2 | Q194: 11.06 | R194: 3.41 | S194: 130.02 | T194: 6.0000000000000001e-003 | U194: 转股中 | V194: 5.47年 | W194: 3.47年 | X194: 4.2000000000000003e-002 | Y194: 5.5e-002 | Z194: 2.33 | AA194: 55 | AB194: -1.8799999999999997e-002 | AC194: -2.4399999999999998e-002 | AD194: -6.1500000000000006e-002 | AE194: -6.3399999999999998e-002 | AF194: 82.63 | AG194: 83.82 | AH194: 0.86 | AI194: AA- | AJ194: 6.6400000000000001e-002 | AK194: =I194+100*T194 -> 131.44 | AL194: 131.7 | AM194: 97 | AN194: 47.8 | AO194: 168 | AP194: -5.0999999999999997e-002 | AQ194: 8 | AR194: 春秋转债
A195: 227 | B195: 光华转债! | C195: 128051 | D195: 43474. | E195: 光华科技 | F195: 2741 | G195: 电子 | H195: 元器件制 | I195: 124.897 | J195: -8.9999999999999998e-004 | K195: -3.85e-002 | L195: 14.07 | M195: -5.2499999999999998e-002 | N195: 744 | O195: 2.29 | P195: 115.5 | Q195: 12.72 | R195: 4.39 | S195: 110.61 | T195: 0.129 | U195: 转股中 | V195: 4年51天 | W195: 2年51天 | X195: 4.7e-002 | Y195: 5.2999999999999999e-002 | Z195: 2.5 | AA195: 53 | AB195: -1.9099999999999999e-002 | AC195: -2.5600000000000001e-002 | AD195: -7.7800000000000008e-002 | AE195: -8.0600000000000005e-002 | AF195: 90.16 | AG195: 89.92 | AH195: 0.75 | AI195: AA- | AJ195: 6.4000000000000001e-002 | AK195: =I195+100*T195 -> 137.797 | AL195: 139.2 | AM195: 170 | AN195: 49 | AO195: 177 | AP195: -4.0000000000000001e-002 | AQ195: 22 | AR195: 光华转债!
A196: 138 | B196: 淮矿转债! | C196: 110065 | D196: 43843. | E196: 淮北矿业 | F196: 600985 | G196: 煤炭 | H196: 煤炭开采 | I196: 122.91 | J196: -8.5000000000000006e-003 | K196: -2.7000000000000001e-003 | L196: 10.44 | M196: -1.5100000000000001e-002 | N196: 24 | O196: 6.9999999999999993e-003 | P196: 111 | Q196: 9.33 | R196: 1.1 | S196: 111.9 | T196: 9.8000000000000004e-002 | U196: 转股中 | V196: 5.16年 | W196: 3.16年 | X196: 0.122 | Y196: 0.13600000000000001 | Z196: 27.6 | AA196: 227 | AB196: -1.9900000000000001e-002 | AC196: -2.3700000000000002e-002 | AD196: -5.0700000000000002e-002 | AE196: -5.2600000000000001e-002 | AF196: 90.82 | AG196: 90.83 | AH196: 0.74 | AI196: AAA | AJ196: 4.0399999999999998e-002 | AK196: =I196+100*T196 -> 132.71000000000001 | AL196: 133.9 | AM196: 123 | AN196: 43.1 | AO196: 130 | AP196: 2.4e-002 | AQ196: 22 | AR196: 淮矿转债!
A197: 125 | B197: 奥瑞转债! | C197: 128096 | D197: 43906. | E197: 奥瑞金 | F197: 2701 | G197: 造纸包装 | H197: 包装材料 | I197: 128.723 | J197: 7.0999999999999995e-003 | K197: -1.e-002 | L197: 5.76 | M197: -3.4999999999999996e-003 | N197: 15 | O197: 1.2e-002 | P197: 116 | Q197: 4.52 | R197: 2.35 | S197: 127.43 | T197: 1.e-002 | U197: 转股中 | V197: 5.30年 | W197: 3.30年 | X197: 6.8000000000000005e-002 | Y197: 8.6999999999999994e-002 | Z197: 9.26 | AA197: 136 | AB197: -1.9900000000000001e-002 | AC197: -2.5000000000000001e-002 | AD197: -5.9500000000000004e-002 | AE197: -6.1600000000000002e-002 | AF197: 90.22 | AG197: 93.11 | AH197: 0.82 | AI197: AA+ | AJ197: 4.3400000000000001e-002 | AK197: =I197+100*T197 -> 129.72300000000001 | AL197: 130 | AM197: 74 | AN197: 36.9 | AO197: 72 | AP197: -5.0000000000000001e-003 | AQ197: 21 | AR197: 奥瑞转债!
A198: 131 | B198: 璞泰转债!! | C198: 113562 | D198: 43865. | E198: 璞泰来 | F198: 603659 | G198: 电子 | H198: 元器件制 | I198: 123.54 | J198: -2.5000000000000001e-002 | K198: 3.9000000000000003e-003 | L198: 102.29 | M198: -2.1099999999999997e-002 | N198: 53 | O198: 5.4000000000000006e-002 | P198: 113.3 | Q198: 82.73 | R198: 13.02 | S198: 123.64 | T198: -1.e-003 | U198: 转股中 | V198: 4.19年 | W198: 2.19年 | X198: 1.7000000000000001e-002 | Y198: 2.1000000000000001e-002 | Z198: 7.65 | AA198: 445 | AB198: -2.07e-002 | AC198: -2.6200000000000001e-002 | AD198: -7.8200000000000006e-002 | AE198: -7.9699999999999993e-002 | AF198: 92.46 | AG198: 95.19 | AH198: 1 | AI198: AA | AJ198: 4.2999999999999997e-002 | AK198: =I198+100*T198 -> 123.44000000000001 | AL198: 123.4 | AM198: 19 | AN198: 28.2 | AO198: 16 | AP198: -6.5000000000000002e-002 | AQ198: 16 | AR198: 璞泰转债!!
A199: 210 | B199: 伊力转债! | C199: 110055 | D199: 43559. | E199: 伊力特 | F199: 600197 | G199: 食品饮料 | H199: 白酒 | I199: 126.01 | J199: -2.1899999999999999e-002 | K199: 1.7000000000000001e-002 | L199: 20.19 | M199: -6.4000000000000003e-003 | N199: 47 | O199: 4.2000000000000003e-002 | P199: 115 | Q199: 16.81 | R199: 3.36 | S199: 120.11 | T199: 4.9000000000000002e-002 | U199: 转股中 | V199: 4.39年 | W199: 2.39年 | X199: 9.9000000000000005e-002 | Y199: 0.11900000000000001 | Z199: 8.71 | AA199: 88 | AB199: -2.1000000000000001e-002 | AC199: -2.69e-002 | AD199: -7.4900000000000008e-002 | AE199: -7.7199999999999991e-002 | AF199: 93.06 | AG199: 95.98 | AH199: 0.77 | AI199: AA | AJ199: 4.2999999999999997e-002 | AK199: =I199+100*T199 -> 130.91 | AL199: 131.9 | AM199: 98 | AN199: 35.9 | AO199: 60 | AP199: 7.0000000000000007e-002 | AQ199: 24 | AR199: 伊力转债!
A200: 195 | B200: 明泰转债! | C200: 113025 | D200: 43592. | E200: 明泰铝业 | F200: 601677 | G200: 有色金属 | H200: 铝金属 | I200: 126.3 | J200: 1.3000000000000001e-002 | K200: 4.0000000000000002e-004 | L200: 14.26 | M200: 1.6399999999999998e-002 | N200: 239 | O200: 0.10800000000000001 | P200: 115.1 | Q200: 11.2 | R200: 1.24 | S200: 127.32 | T200: -8.0000000000000002e-003 | U200: 转股中 | V200: 4.46年 | W200: 2.46年 | X200: 0.19899999999999998 | Y200: 0.253 | Z200: 17.5 | AA200: 88 | AB200: -2.1000000000000001e-002 | AC200: -2.6800000000000001e-002 | AD200: -7.3899999999999993e-002 | AE200: -7.6100000000000001e-002 | AF200: 92.71 | AG200: 95.77 | AH200: 0.82 | AI200: AA | AJ200: 4.2999999999999997e-002 | AK200: =I200+100*T200 -> 125.5 | AL200: 125.3 | AM200: 29 | AN200: 29.5 | AO200: 17 | AP200: 0.20600000000000002 | AQ200: 32 | AR200: 明泰转债!
A201: 188 | B201: 三星转债 | C201: 113536 | D201: 43640. | E201: 三星新材 | F201: 603578 | G201: 家电 | H201: 零部件制 | I201: 126.44 | J201: -2.4799999999999999e-002 | K201: 2.2499999999999999e-002 | L201: 23.18 | M201: -3.0000000000000001e-003 | N201: 291 | O201: 1.49 | P201: 114.8 | Q201: 19.54 | R201: 3.3 | S201: 118.63 | T201: 6.6000000000000003e-002 | U201: 转股中 | V201: 4.60年 | W201: 2.60年 | X201: 7.0000000000000007e-002 | Y201: 8.3000000000000004e-002 | Z201: 1.49 | AA201: 21 | AB201: -2.1099999999999997e-002 | AC201: -2.6699999999999998e-002 | AD201: -7.0999999999999994e-002 | AE201: -7.3099999999999998e-002 | AF201: 92.04 | AG201: 94.93 | AH201: 0.74 | AI201: AA | AJ201: 4.2999999999999997e-002 | AK201: =I201+100*T201 -> 133.03999999999999 | AL201: 134.3 | AM201: 129 | AN201: 39.3 | AO201: 101 | AP201: 3.7000000000000005e-002 | AQ201: 38 | AR201: 三星转债
A202: 177 | B202: 合兴转债! | C202: 128071 | D202: 43724. | E202: 合兴包装 | F202: 2228 | G202: 造纸包装 | H202: 包装材料 | I202: 127 | J202: -1.8200000000000001e-002 | K202: -6.9999999999999993e-003 | L202: 4.83 | M202: -3.5900000000000001e-002 | N202: 14 | O202: 3.7000000000000005e-002 | P202: 114.8 | Q202: 4.28 | R202: 1.9 | S202: 112.85 | T202: 0.125 | U202: 转股中 | V202: 4.81年 | W202: 2.81年 | X202: 5.0000000000000003e-002 | Y202: 5.7000000000000002e-002 | Z202: 3 | AA202: 60 | AB202: -2.1099999999999997e-002 | AC202: -2.64e-002 | AD202: -6.7500000000000004e-002 | AE202: -6.9400000000000003e-002 | AF202: 91.22 | AG202: 94.09 | AH202: 0.7 | AI202: AA | AJ202: 4.2999999999999997e-002 | AK202: =I202+100*T202 -> 139.5 | AL202: 141.1 | AM202: 195 | AN202: 47.1 | AO202: 161 | AP202: -8.900000000000001e-002 | AQ202: 26 | AR202: 合兴转债!
A203: 66 | B203: 寿仙转债 | C203: 113585 | D203: 44019. | E203: 寿仙谷 | F203: 603896 | G203: 医药 | H203: 中药 | I203: 132.97 | J203: 8.3999999999999995e-003 | K203: -1.3000000000000001e-002 | L203: 39 | M203: -5.1000000000000004e-003 | N203: 22 | O203: 4.7e-002 | P203: 117.8 | Q203: 28.68 | R203: 4.78 | S203: 135.98 | T203: -2.2000000000000002e-002 | U203: 52天 | V203: 5.62年 | W203: 3.62年 | X203: 6.4000000000000001e-002 | Y203: 8.6999999999999994e-002 | Z203: 3.6 | AA203: 56 | AB203: -2.1700000000000001e-002 | AC203: -2.7099999999999999e-002 | AD203: -6.3099999999999989e-002 | AE203: -6.4899999999999999e-002 | AF203: 81.85 | AG203: 82.72 | AH203: 0.91 | AI203: AA- | AJ203: 6.6400000000000001e-002 | AK203: =I203+100*T203 -> 130.77000000000001 | AL203: 130 | AM203: 73 | AN203: 47.2 | AO203: 163 | AP203: -2.7999999999999997e-002 | AQ203: 9 | AR203: 寿仙转债
A204: 109 | B204: 红相转债! | C204: 123044 | D204: 43934. | E204: 红相股份 | F204: 300427 | G204: 能源电力 | H204: 电力设备 | I204: 141.25 | J204: -1.4800000000000001e-002 | K204: 1.7500000000000002e-002 | L204: 25.61 | M204: 3.0999999999999999e-003 | N204: 216 | O204: 0.26800000000000002 | P204: 125.5 | Q204: 18.8 | R204: 4.17 | S204: 136.22 | T204: 3.7000000000000005e-002 | U204: 转股中 | V204: 5.38年 | W204: 3.38年 | X204: 5.9999999999999998e-002 | Y204: 8.199999999999999e-002 | Z204: 5.5 | AA204: 92 | AB204: -2.2200000000000001e-002 | AC204: -2.98e-002 | AD204: -8.1099999999999992e-002 | AE204: -8.3400000000000002e-002 | AF204: 83.86 | AG204: 89.61 | AH204: 0.87 | AI204: AA- | AJ204: 6.6400000000000001e-002 | AK204: =I204+100*T204 -> 144.94999999999999 | AL204: 146.3 | AM204: 219 | AN204: 56.7 | AO204: 223 | AP204: -4.8000000000000001e-002 | AQ204: 16 | AR204: 红相转债!
A205: 300 | B205: 航信转债!! | C205: 110031 | D205: 42185. | E205: 航天信息 | F205: 600271 | G205: 计算机及 | H205: 软件开发 | I205: 108.55 | J205: 1.e-004 | K205: -1.e-004 | L205: 15.95 | M205: 1.2999999999999999e-003 | N205: 13 | O205: 5.0000000000000001e-003 | P205: 107 | Q205: 21.56 | R205: 2.66 | S205: 73.98 | T205: 0.46700000000000003 | U205: 转股中 | V205: 0.63年 | W205: 回售中 | X205: 8.1000000000000003e-002 | Y205: 5.9999999999999998e-002 | Z205: 24 | AA205: 296 | AB205: -2.2499999999999999e-002 | AC205: -4.2599999999999999e-002 | AD205: 回售中 | AE205: 回售中 | AF205: 100.27 | AG205: 104.71 | AH205: 0 | AI205: AAA | AJ205: 3.4799999999999998e-002 | AK205: =I205+100*T205 -> 155.25 | AL205: 143.1 | AM205: 206 | AN205: 38.4 | AO205: 92 | AP205: -6.0000000000000001e-003 | AQ205: 14 | AR205: 航信转债!!
A206: 236 | B206: 张行转债 | C206: 128048 | D206: 43433. | E206: 张家港行 | F206: 2839 | G206: 金融 | H206: 银行行业 | I206: 124.68 | J206: -1.5e-003 | K206: 6.7000000000000002e-003 | L206: 6.22 | M206: 8.1000000000000013e-003 | N206: 21 | O206: 6.9999999999999993e-003 | P206: 113.9 | Q206: 5.76 | R206: 1.08 | S206: 107.99 | T206: 0.155 | U206: 转股中 | V206: 4年19天 | W206: 无权 | X206: 0.222 | Y206: 0.23999999999999999 | Z206: 25 | AA206: 112 | AB206: -2.2499999999999999e-002 | AC206: -2.8500000000000001e-002 | AD206: 无权 | AE206: 无权 | AF206: 无权 | AG206: 97.14 | AH206: 0.64 | AI206: AA+ | AJ206: 4.0999999999999995e-002 | AK206: =I206+100*T206 -> 140.18000000000001 | AL206: 141.4 | AM206: 196 | AN206: 44.2 | AO206: 138 | AP206: 2.7000000000000003e-002 | AQ206: 14 | AR206: 张行转债
A207: 110 | B207: 华安转债! | C207: 110067 | D207: 43930. | E207: 华安证券 | F207: 600909 | G207: 金融 | H207: 证券行业 | I207: 124.8 | J207: -4.8999999999999998e-003 | K207: -1.3000000000000001e-002 | L207: 8.5 | M207: -2.9700000000000001e-002 | N207: 31 | O207: 9.0000000000000011e-003 | P207: 110.5 | Q207: 8.67 | R207: 2.27 | S207: 98.04 | T207: 0.27300000000000002 | U207: 转股中 | V207: 5.38年 | W207: 无权 | X207: 9.0999999999999998e-002 | Y207: 8.900000000000001e-002 | Z207: 28 | AA207: 308 | AB207: -2.2599999999999999e-002 | AC207: -2.6099999999999998e-002 | AD207: 无权 | AE207: 无权 | AF207: 无权 | AG207: 89.54 | AH207: 0.6 | AI207: AAA | AJ207: 4.0399999999999998e-002 | AK207: =I207+100*T207 -> 152.09999999999999 | AL207: 151.6 | AM207: 239 | AN207: 62 | AO207: 240 | AP207: -2.9999999999999999e-002 | AQ207: 26 | AR207: 华安转债!
A208: 173 | B208: 哈尔转债! | C208: 128073 | D208: 43719. | E208: 哈尔斯 | F208: 2615 | G208: 其他 | H208: 家居用品 | I208: 126 | J208: -0.20199999999999999 | K208: 0.19399999999999998 | L208: 5.52 | M208: -1.43e-002 | N208: 3440. | O208: 7.5599999999999996 | P208: 115.3 | Q208: 5.72 | R208: 2.93 | S208: 96.5 | T208: 0.30599999999999999 | U208: 转股中 | V208: 3.83年 | W208: 1.83年 | X208: 0.13200000000000001 | Y208: 0.127 | Z208: 2.99 | AA208: 23 | AB208: -2.3199999999999998e-002 | AC208: -3.0099999999999998e-002 | AD208: -0.10099999999999999 | AE208: -0.10199999999999999 | AF208: 90.24 | AG208: 91.22 | AH208: 0.58 | AI208: AA- | AJ208: 6.4000000000000001e-002 | AK208: =I208+100*T208 -> 156.59999999999999 | AL208: 155.5 | AM208: 252 | AN208: 64.3 | AO208: 244 | AP208: -2.9999999999999999e-002 | AQ208: 38 | AR208: 哈尔转债!
A209: 165 | B209: 英联转债! | C209: 128079 | D209: 43790. | E209: 英联股份 | F209: 2846 | G209: 造纸包装 | H209: 包装材料 | I209: 132 | J209: -0.14800000000000002 | K209: 0.12300000000000001 | L209: 15.06 | M209: -2.5899999999999999e-002 | N209: 1941. | O209: 7.9699999999999998 | P209: 117.5 | Q209: 13.41 | R209: 4.26 | S209: 112.3 | T209: 0.17499999999999999 | U209: 转股中 | V209: 4.99年 | W209: 2.99年 | X209: 5.0999999999999997e-002 | Y209: 5.7000000000000002e-002 | Z209: 1.53 | AA209: 30 | AB209: -2.3399999999999997e-002 | AC209: -2.9399999999999999e-002 | AD209: -7.4200000000000002e-002 | AE209: -7.6200000000000004e-002 | AF209: 82.66 | AG209: 82.48 | AH209: 0.98 | AI209: A+ | AJ209: 7.4999999999999997e-002 | AK209: =I209+100*T209 -> 149.5 | AL209: 151.7 | AM209: 240 | AN209: 69 | AO209: 253 | AP209: -2.3e-002 | AQ209: 18 | AR209: 英联转债!
A210: 75 | B210: 蓝帆转债 | C210: 128108 | D210: 44001. | E210: 蓝帆医疗 | F210: 2382 | G210: 医药 | H210: 医疗器械 | I210: 129.3 | J210: -1.7399999999999999e-002 | K210: -2.3e-003 | L210: 23.79 | M210: -2.3e-002 | N210: 409 | O210: 9.8000000000000004e-002 | P210: 113.3 | Q210: 17.79 | R210: 2.55 | S210: 133.73 | T210: -3.3000000000000002e-002 | U210: 40天 | V210: 5.59年 | W210: 4.59年 | X210: 0.13699999999999998 | Y210: 0.183 | Z210: 31.4 | AA210: 229 | AB210: -2.3799999999999998e-002 | AC210: -2.7900000000000001e-002 | AD210: -4.2199999999999994e-002 | AE210: -4.4199999999999996e-002 | AF210: 85.8 | AG210: 88.83 | AH210: 0.86 | AI210: AA | AJ210: 4.5400000000000003e-002 | AK210: =I210+100*T210 -> 126.00000000000001 | AL210: 124.9 | AM210: 25 | AN210: 36 | AO210: 61 | AP210: -3.4000000000000002e-002 | AQ210: 19 | AR210: 蓝帆转债
A211: 27 | B211: 三超转债 | C211: 123062 | D211: 44060. | E211: 三超新材 | F211: 300554 | G211: 机械装备 | H211: 通用设备 | I211: 138.001 | J211: -5.3499999999999999e-002 | K211: 3.7499999999999999e-002 | L211: 23.22 | M211: -1.7399999999999999e-002 | N211: 4796. | O211: 14.82 | P211: 119.7 | Q211: 17.17 | R211: 4.25 | S211: 135.24 | T211: 2.e-002 | U211: 3月10天 | V211: 5.76年 | W211: 3.76年 | X211: 8.9999999999999997e-002 | Y211: 0.121 | Z211: 1.95 | AA211: 22 | AB211: -2.4900000000000002e-002 | AC211: -3.0600000000000002e-002 | AD211: -6.88e-002 | AE211: -7.0800000000000002e-002 | AF211: 75.59 | AG211: 74.75 | AH211: 0.92 | AI211: A | AJ211: 8.7400000000000005e-002 | AK211: =I211+100*T211 -> 140.001 | AL211: 140.8 | AM211: 188 | AN211: 65.2 | AO211: 246 | AP211: 4.0999999999999995e-002 | AQ211: 10 | AR211: 三超转债
A212: 281 | B212: 济川转债! | C212: 110038 | D212: 43068. | E212: 济川药业 | F212: 600566 | G212: 医药 | H212: 中药 | I212: 114.02 | J212: -1.1999999999999999e-003 | K212: -7.000000000000001e-004 | L212: 22.62 | M212: -4.7999999999999996e-003 | N212: 4.9 | O212: 6.9999999999999993e-003 | P212: 108.3 | Q212: 24.27 | R212: 3.24 | S212: 93.2 | T212: 0.223 | U212: 转股中 | V212: 2年20天 | W212: 20天 | X212: 3.4000000000000002e-002 | Y212: 3.2000000000000001e-002 | Z212: 6.28 | AA212: 184 | AB212: -2.5099999999999997e-002 | AC212: -3.2400000000000005e-002 | AD212: -0.55899999999999994 | AE212: -0.56799999999999995 | AF212: 100.13 | AG212: 99.52 | AH212: 0.4 | AI212: AA | AJ212: 4.2599999999999999e-002 | AK212: =I212+100*T212 -> 136.31999999999999 | AL212: 134.8 | AM212: 135 | AN212: 34.7 | AO212: 50 | AP212: -6.9999999999999993e-003 | AQ212: 19 | AR212: 济川转债!
A213: 191 | B213: 永鼎转债! | C213: 110058 | D213: 43593. | E213: 永鼎股份 | F213: 600105 | G213: 通信互联 | H213: 通信设备 | I213: 128.5 | J213: -3.56e-002 | K213: 1.01e-002 | L213: 6.52 | M213: -3.1200000000000002e-002 | N213: 35 | O213: 5.5999999999999994e-002 | P213: 114.9 | Q213: 5.04 | R213: 3.49 | S213: 129.37 | T213: -6.9999999999999993e-003 | U213: 转股中 | V213: 4.48年 | W213: 2.48年 | X213: 5.7000000000000002e-002 | Y213: 7.2999999999999995e-002 | Z213: 4.81 | AA213: 85 | AB213: -2.5099999999999997e-002 | AC213: -3.0800000000000001e-002 | AD213: -7.9600000000000004e-002 | AE213: -8.1799999999999998e-002 | AF213: 92.61 | AG213: 95.53 | AH213: 0.82 | AI213: AA | AJ213: 4.2999999999999997e-002 | AK213: =I213+100*T213 -> 127.8 | AL213: 127.6 | AM213: 50 | AN213: 32.1 | AO213: 32 | AP213: 5.5e-002 | AQ213: 53 | AR213: 永鼎转债!
A214: 95 | B214: 裕同转债 | C214: 128104 | D214: 43949. | E214: 裕同科技 | F214: 2831 | G214: 造纸包装 | H214: 包装材料 | I214: 132.15 | J214: -2.52e-002 | K214: -2.7000000000000001e-003 | L214: 30.5 | M214: -3.3599999999999998e-002 | N214: 55 | O214: 2.9999999999999999e-002 | P214: 115.3 | Q214: 23.24 | R214: 4.17 | S214: 131.24 | T214: 6.9999999999999993e-003 | U214: 转股中 | V214: 5.45年 | W214: 3.45年 | X214: 5.0999999999999997e-002 | Y214: 6.7000000000000004e-002 | Z214: 13.7 | AA214: 268 | AB214: -2.52e-002 | AC214: -2.9900000000000003e-002 | AD214: -6.5099999999999991e-002 | AE214: -6.6900000000000001e-002 | AF214: 89.15 | AG214: 91.89 | AH214: 0.83 | AI214: AA+ | AJ214: 4.3400000000000001e-002 | AK214: =I214+100*T214 -> 132.84999999999999 | AL214: 133.1 | AM214: 112 | AN214: 41.2 | AO214: 117 | AP214: -0.10199999999999999 | AQ214: 7 | AR214: 裕同转债
A215: 61 | B215: 泛微转债 | C215: 113587 | D215: 44026. | E215: 泛微网络 | F215: 603039 | G215: 计算机及 | H215: 软件开发 | I215: 143.17 | J215: 1.44e-002 | K215: 9.1999999999999998e-003 | L215: 92.4 | M215: 2.63e-002 | N215: 28 | O215: 5.9999999999999998e-002 | P215: 124.3 | Q215: 64.33 | R215: 20.97 | S215: 143.63 | T215: -3.0000000000000001e-003 | U215: 58天 | V215: 5.64年 | W215: 3.64年 | X215: 1.6e-002 | Y215: 2.3e-002 | Z215: 3.16 | AA215: 196 | AB215: -2.52e-002 | AC215: -3.2099999999999997e-002 | AD215: -8.0799999999999997e-002 | AE215: -8.2599999999999993e-002 | AF215: 81.83 | AG215: 87.18 | AH215: 0.9 | AI215: AA- | AJ215: 6.6400000000000001e-002 | AK215: =I215+100*T215 -> 142.86999999999998 | AL215: 142.7 | AM215: 204 | AN215: 55.5 | AO215: 218 | AP215: -1.e-003 | AQ215: 4 | AR215: 泛微转债
A216: 160 | B216: 石英转债! | C216: 113548 | D216: 43791. | E216: 石英股份 | F216: 603688 | G216: 电子 | H216: 电子产品 | I216: 141.95 | J216: -5.7999999999999996e-002 | K216: 3.61e-002 | L216: 21.03 | M216: -2.5000000000000001e-002 | N216: 259 | O216: 1.3899999999999999 | P216: 124.8 | Q216: 15.1 | R216: 4.3 | S216: 139.27 | T216: 1.9e-002 | U216: 转股中 | V216: 5年4.1天 | W216: 3年4.1天 | X216: 1.7000000000000001e-002 | Y216: 2.3e-002 | Z216: 1.23 | AA216: 74 | AB216: -2.5899999999999999e-002 | AC216: -3.3799999999999997e-002 | AD216: -9.2399999999999996e-002 | AE216: -9.4800000000000009e-002 | AF216: 85.62 | AG216: 91.17 | AH216: 0.88 | AI216: AA- | AJ216: 6.6400000000000001e-002 | AK216: =I216+100*T216 -> 143.84999999999999 | AL216: 144.6 | AM216: 213 | AN216: 53.5 | AO216: 201 | AP216: -3.7000000000000005e-002 | AQ216: 11 | AR216: 石英转债!
A217: 111 | B217: 永高转债 | C217: 128099 | D217: 43931. | E217: 永高股份 | F217: 2641 | G217: 建筑 | H217: 建筑行业 | I217: 130.098 | J217: -3.1300000000000001e-002 | K217: 1.09e-002 | L217: 8.05 | M217: -2.4199999999999999e-002 | N217: 48 | O217: 6.2e-002 | P217: 113.2 | Q217: 6.16 | R217: 2.37 | S217: 130.68 | T217: -4.0000000000000001e-003 | U217: 转股中 | V217: 5.38年 | W217: 3.38年 | X217: 6.4000000000000001e-002 | Y217: 8.3000000000000004e-002 | Z217: 5.83 | AA217: 91 | AB217: -2.6000000000000002e-002 | AC217: -3.0200000000000001e-002 | AD217: -6.25e-002 | AE217: -6.4299999999999996e-002 | AF217: 88.73 | AG217: 89.58 | AH217: 0.84 | AI217: AA | AJ217: 4.5400000000000003e-002 | AK217: =I217+100*T217 -> 129.69800000000001 | AL217: 129.5 | AM217: 66 | AN217: 39.9 | AO217: 110 | AP217: -4.0000000000000001e-003 | AQ217: 9 | AR217: 永高转债
A218: 72 | B218: 今天转债 | C218: 123051 | D218: 44012. | E218: 今天国际 | F218: 300532 | G218: 计算机及 | H218: 软件开发 | I218: 142.4 | J218: -7.000000000000001e-004 | K218: -3.4999999999999996e-003 | L218: 12.8 | M218: -4.6999999999999993e-003 | N218: 2056. | O218: 4.79 | P218: 122.8 | Q218: 8.8 | R218: 4.37 | S218: 145.45 | T218: -2.1000000000000001e-002 | U218: 47天 | V218: 5.61年 | W218: 3.61年 | X218: 8.0000000000000002e-002 | Y218: 0.11599999999999999 | Z218: 2.8 | AA218: 35 | AB218: -2.6600000000000002e-002 | AC218: -3.32e-002 | AD218: -7.9000000000000001e-002 | AE218: -8.1000000000000003e-002 | AF218: 79.3 | AG218: 81.65 | AH218: 0.91 | AI218: A+ | AJ218: 7.7399999999999997e-002 | AK218: =I218+100*T218 -> 140.30000000000001 | AL218: 139.3 | AM218: 172 | AN218: 57.7 | AO218: 230 | AP218: 4.0000000000000001e-002 | AQ218: 11 | AR218: 今天转债
A219: 74 | B219: 益丰转债 | C219: 113583 | D219: 44004. | E219: 益丰药房 | F219: 603939 | G219: 医药 | H219: 医药商业 | I219: 134 | J219: -4.0500000000000001e-002 | K219: -1.5e-003 | L219: 88.97 | M219: -5.1500000000000004e-002 | N219: 44 | O219: 2.1000000000000001e-002 | P219: 115.3 | Q219: 71.82 | R219: 9.75 | S219: 123.88 | T219: 8.199999999999999e-002 | U219: 44天 | V219: 5.60年 | W219: 3.60年 | X219: 3.3000000000000002e-002 | Y219: 4.0999999999999995e-002 | Z219: 15.8 | AA219: 472 | AB219: -2.69e-002 | AC219: -3.1600000000000003e-002 | AD219: -6.6100000000000006e-002 | AE219: -6.7799999999999999e-002 | AF219: 87.95 | AG219: 90.35 | AH219: 0.81 | AI219: AA | AJ219: 4.5400000000000003e-002 | AK219: =I219+100*T219 -> 142.19999999999999 | AL219: 144.1 | AM219: 211 | AN219: 53.8 | AO219: 207 | AP219: -8.900000000000001e-002 | AQ219: 8 | AR219: 益丰转债
A220: 239 | B220: 利尔转债! | C220: 128046 | D220: 43413. | E220: 利尔化学 | F220: 2258 | G220: 化工 | H220: 农化 | I220: 125.011 | J220: -2.7200000000000002e-002 | K220: -5.9999999999999995e-004 | L220: 20.5 | M220: -3.9800000000000002e-002 | N220: 7.9 | O220: 6.9999999999999993e-003 | P220: 112.3 | Q220: 18.62 | R220: 3.15 | S220: 110.1 | T220: 0.13500000000000001 | U220: 转股中 | V220: 3.98年 | W220: 1.98年 | X220: 7.9000000000000001e-002 | Y220: 8.6999999999999994e-002 | Z220: 8.52 | AA220: 107 | AB220: -2.7000000000000003e-002 | AC220: -3.2400000000000005e-002 | AD220: -8.7599999999999997e-002 | AE220: -8.9800000000000005e-002 | AF220: 93.97 | AG220: 95.25 | AH220: 0.7 | AI220: AA | AJ220: 4.2999999999999997e-002 | AK220: =I220+100*T220 -> 138.511 | AL220: 139.9 | AM220: 178 | AN220: 44.7 | AO220: 143 | AP220: -1.9e-002 | AQ220: 10 | AR220: 利尔转债!
A221: 96 | B221: 瀚蓝转债 | C221: 110069 | D221: 43958. | E221: 瀚蓝环境 | F221: 600323 | G221: 城市公用 | H221: 三废处理 | I221: 132.53 | J221: 2.5000000000000001e-003 | K221: -1.41e-002 | L221: 25.05 | M221: -1.4199999999999999e-002 | N221: 29 | O221: 2.2000000000000002e-002 | P221: 113.5 | Q221: 20.2 | R221: 2.8 | S221: 124.01 | T221: 6.9000000000000006e-002 | U221: 转股中 | V221: 5.45年 | W221: 3.45年 | X221: 5.2000000000000005e-002 | Y221: 6.4000000000000001e-002 | Z221: 9.92 | AA221: 192 | AB221: -2.8300000000000002e-002 | AC221: -3.2599999999999997e-002 | AD221: -6.9500000000000006e-002 | AE221: -7.0599999999999996e-002 | AF221: 87.76 | AG221: 90.29 | AH221: 0.82 | AI221: AA+ | AJ221: 4.3400000000000001e-002 | AK221: =I221+100*T221 -> 139.43000000000001 | AL221: 141.1 | AM221: 193 | AN221: 50.8 | AO221: 186 | AP221: -0.10300000000000001 | AQ221: 7 | AR221: 瀚蓝转债
A222: 107 | B222: 博特转债! | C222: 113571 | D222: 43922. | E222: 苏博特 | F222: 603916 | G222: 建筑 | H222: 水泥 | I222: 140.65 | J222: -3.6400000000000002e-002 | K222: 6.8000000000000005e-003 | L222: 26.52 | M222: -2.9600000000000001e-002 | N222: 6 | O222: 1.2e-002 | P222: 120.8 | Q222: 18.88 | R222: 3.33 | S222: 140.47 | T222: 1.e-003 | U222: 转股中 | V222: 5.38年 | W222: 3.38年 | X222: 4.2999999999999997e-002 | Y222: 5.9999999999999998e-002 | Z222: 3.51 | AA222: 82 | AB222: -2.8399999999999998e-002 | AC222: -3.4700000000000002e-002 | AD222: -8.2100000000000006e-002 | AE222: -8.4000000000000005e-002 | AF222: 83.14 | AG222: 86.15 | AH222: 1 | AI222: AA- | AJ222: 6.6400000000000001e-002 | AK222: =I222+100*T222 -> 140.75 | AL222: 140.8 | AM222: 190 | AN222: 54.7 | AO222: 211 | AP222: -8.4000000000000005e-002 | AQ222: 13 | AR222: 博特转债!
A223: 228 | B223: 钧达转债! | C223: 128050 | D223: 43461. | E223: 钧达股份 | F223: 2865 | G223: 汽车 | H223: 零部件制 | I223: 139 | J223: 0.13 | K223: -0.12 | L223: 18.05 | M223: 1.3500000000000002e-002 | N223: 5229. | O223: 10.67 | P223: 123.5 | Q223: 14.85 | R223: 2.55 | S223: 121.55 | T223: 0.14400000000000002 | U223: 转股中 | V223: 4年47天 | W223: 2年47天 | X223: 0.13800000000000001 | Y223: 0.16699999999999998 | Z223: 2.99 | AA223: 22 | AB223: -2.8799999999999999e-002 | AC223: -3.7999999999999999e-002 | AD223: -0.12 | AE223: -0.12300000000000001 | AF223: 90.24 | AG223: 96.19 | AH223: 0.76 | AI223: AA- | AJ223: 6.4000000000000001e-002 | AK223: =I223+100*T223 -> 153.40000000000001 | AL223: 156.5 | AM223: 254 | AN223: 60.3 | AO223: 235 | AP223: 0.105 | AQ223: 63 | AR223: 钧达转债!
A224: 206 | B224: 岱勒转债! | C224: 123024 | D224: 43572. | E224: 岱勒新材 | F224: 300700 | G224: 机械装备 | H224: 专用设备 | I224: 125 | J224: -4.2099999999999999e-002 | K224: 1.47e-002 | L224: 23.56 | M224: -4.7300000000000002e-002 | N224: 2280. | O224: 7.7300000000000004 | P224: 113 | Q224: 24.9 | R224: 3.95 | S224: 94.62 | T224: 0.32100000000000001 | U224: 转股中 | V224: 3.41年 | W224: 1.41年 | X224: 0.10800000000000001 | Y224: 0.10199999999999999 | Z224: 2.1 | AA224: 19 | AB224: -2.9500000000000002e-002 | AC224: -3.61e-002 | AD224: -0.11 | AE224: -0.111 | AF224: 90.86 | AG224: 88.62 | AH224: 0.58 | AI224: A+ | AJ224: 7.4999999999999997e-002 | AK224: =I224+100*T224 -> 157.09999999999999 | AL224: 155.4 | AM224: 251 | AN224: 64.5 | AO224: 245 | AP224: 3.1e-002 | AQ224: 33 | AR224: 岱勒转债!
A225: 264 | B225: 无锡转债! | C225: 110043 | D225: 43173. | E225: 无锡银行 | F225: 600908 | G225: 金融 | H225: 银行行业 | I225: 120.47 | J225: 6.0999999999999995e-003 | K225: 1.7600000000000001e-002 | L225: 6.13 | M225: 3.7200000000000004e-002 | N225: 85 | O225: 2.3e-002 | P225: 109.1 | Q225: 5.79 | R225: 1 | S225: 105.87 | T225: 0.13800000000000001 | U225: 转股中 | V225: 3.27年 | W225: 无权 | X225: 0.26500000000000001 | Y225: 0.28000000000000003 | Z225: 30 | AA225: 113 | AB225: -3.0299999999999997e-002 | AC225: -3.5299999999999998e-002 | AD225: 无权 | AE225: 无权 | AF225: 无权 | AG225: 95.88 | AH225: 0.64 | AI225: AA+ | AJ225: 4.0999999999999995e-002 | AK225: =I225+100*T225 -> 134.27000000000001 | AL225: 135.1 | AM225: 137 | AN225: 39.2 | AO225: 99 | AP225: 6.3e-002 | AQ225: 31 | AR225: 无锡转债!
A226: 123 | B226: 奥佳转债! | C226: 128097 | D226: 43908. | E226: 奥佳华 | F226: 2614 | G226: 机械装备 | H226: 专用设备 | I226: 135.505 | J226: -3.5999999999999999e-003 | K226: 6.0999999999999995e-003 | L226: 13.82 | M226: 2.8999999999999998e-003 | N226: 157 | O226: 0.185 | P226: 115.3 | Q226: 10.69 | R226: 2.27 | S226: 129.28 | T226: 4.8000000000000001e-002 | U226: 转股中 | V226: 5.34年 | W226: 3.34年 | X226: 7.0999999999999994e-002 | Y226: 9.0999999999999998e-002 | Z226: 6.02 | AA226: 85 | AB226: -3.0299999999999997e-002 | AC226: -3.5200000000000002e-002 | AD226: -7.3899999999999993e-002 | AE226: -7.5700000000000003e-002 | AF226: 88.99 | AG226: 91.41 | AH226: 0.83 | AI226: AA | AJ226: 4.5400000000000003e-002 | AK226: =I226+100*T226 -> 140.30500000000001 | AL226: 141.7 | AM226: 199 | AN226: 50.3 | AO226: 183 | AP226: -0.10199999999999999 | AQ226: 26 | AR226: 奥佳转债!
A227: 69 | B227: 飞鹿转债 | C227: 123052 | D227: 44015. | E227: 飞鹿股份 | F227: 300665 | G227: 化工 | H227: 化工 | I227: 151 | J227: -2.58e-002 | K227: 1.9400000000000001e-002 | L227: 13.65 | M227: -7.3000000000000001e-003 | N227: 6054. | O227: 15.82 | P227: 127.3 | Q227: 9.9 | R227: 3.63 | S227: 137.88 | T227: 9.5000000000000001e-002 | U227: 48天 | V227: 5.61年 | W227: 3.61年 | X227: 0.107 | Y227: 0.14699999999999999 | Z227: 1.77 | AA227: 17 | AB227: -3.0600000000000002e-002 | AC227: -3.8199999999999998e-002 | AD227: -9.2200000000000004e-002 | AE227: -9.4399999999999998e-002 | AF227: 79.69 | AG227: 84.67 | AH227: 0.88 | AI227: A+ | AJ227: 7.7399999999999997e-002 | AK227: =I227+100*T227 -> 160.5 | AL227: 164.1 | AM227: 259 | AN227: 79.5 | AO227: 265 | AP227: 7.2000000000000008e-002 | AQ227: 11 | AR227: 飞鹿转债
A228: 90 | B228: 起步转债! | C228: 113576 | D228: 43958. | E228: 起步股份 | F228: 603557 | G228: 服装纺织 | H228: 鞋服行业 | I228: 143.88 | J228: -0.13300000000000001 | K228: 4.2000000000000003e-002 | L228: 15.59 | M228: -9.9900000000000003e-002 | N228: 1713. | O228: 2.96 | P228: 121.8 | Q228: 10.55 | R228: 4.76 | S228: 147.77 | T228: -2.6000000000000002e-002 | U228: 转股中 | V228: 5.46年 | W228: 3.46年 | X228: 5.0000000000000003e-002 | Y228: 7.2999999999999995e-002 | Z228: 3.65 | AA228: 74 | AB228: -3.0699999999999998e-002 | AC228: -3.7100000000000001e-002 | AD228: -8.48e-002 | AE228: -8.6899999999999991e-002 | AF228: 83.19 | AG228: 86.49 | AH228: 0.91 | AI228: AA- | AJ228: 6.6400000000000001e-002 | AK228: =I228+100*T228 -> 141.28 | AL228: 140 | AM228: 179 | AN228: 53.5 | AO228: 202 | AP228: 4.7e-002 | AQ228: 29 | AR228: 起步转债!
A229: 105 | B229: 雷迪转债 | C229: 123045 | D229: 43934. | E229: 雷迪克 | F229: 300652 | G229: 汽车 | H229: 零部件制 | I229: 141 | J229: -3.0899999999999997e-002 | K229: 3.6000000000000004e-002 | L229: 25.58 | M229: 5.8999999999999999e-003 | N229: 7933. | O229: 24. | P229: 119.4 | Q229: 20.13 | R229: 2.81 | S229: 127.07 | T229: 0.11 | U229: 转股中 | V229: 5.38年 | W229: 3.38年 | X229: 7.5999999999999998e-002 | Y229: 9.6000000000000002e-002 | Z229: 1.71 | AA229: 23 | AB229: -3.1099999999999999e-002 | AC229: -3.7000000000000005e-002 | AD229: -8.1699999999999995e-002 | AE229: -8.3800000000000013e-002 | AF229: 80.55 | AG229: 80.75 | AH229: 0.87 | AI229: A+ | AJ229: 7.7399999999999997e-002 | AK229: =I229+100*T229 -> 152. | AL229: 154.9 | AM229: 250 | AN229: 74.2 | AO229: 257 | AP229: 4.0999999999999995e-002 | AQ229: 36 | AR229: 雷迪转债
A230: 171 | B230: 远东转债! | C230: 128075 | D230: 43769. | E230: 远东传动 | F230: 2406 | G230: 汽车 | H230: 零部件制 | I230: 134.79 | J230: -1.9e-002 | K230: -8.9999999999999998e-004 | L230: 7.5 | M230: -2.3399999999999997e-002 | N230: 129 | O230: 0.13300000000000001 | P230: 114.9 | Q230: 5.54 | R230: 1.55 | S230: 135.38 | T230: -4.0000000000000001e-003 | U230: 转股中 | V230: 4.92年 | W230: 2.92年 | X230: 0.161 | Y230: 0.217 | Z230: 7.12 | AA230: 44 | AB230: -3.2500000000000001e-002 | AC230: -3.7599999999999995e-002 | AD230: -8.3100000000000007e-002 | AE230: -8.4900000000000003e-002 | AF230: 90.92 | AG230: 93.78 | AH230: 0.85 | AI230: AA | AJ230: 4.2999999999999997e-002 | AK230: =I230+100*T230 -> 134.38999999999999 | AL230: 134.2 | AM230: 127 | AN230: 40.4 | AO230: 114 | AP230: 6.6000000000000003e-002 | AQ230: 16 | AR230: 远东转债!
A231: 32 | B231: 航新转债 | C231: 123061 | D231: 44061. | E231: 航新科技 | F231: 300424 | G231: 航空航天 | H231: 航空航天 | I231: 151.1 | J231: 3.2799999999999996e-002 | K231: -4.4800000000000006e-002 | L231: 22.45 | M231: -1.32e-002 | N231: 5194. | O231: 11.65 | P231: 124.8 | Q231: 14.86 | R231: 5.01 | S231: 151.08 | T231: 0. | U231: 3月6天 | V231: 5.74年 | W231: 3.74年 | X231: 4.5999999999999999e-002 | Y231: 7.0000000000000007e-002 | Z231: 2.5 | AA231: 54 | AB231: -3.3399999999999999e-002 | AC231: -4.0199999999999993e-002 | AD231: -9.0399999999999994e-002 | AE231: -9.2399999999999996e-002 | AF231: 81.7 | AG231: 87.01 | AH231: 0.91 | AI231: AA- | AJ231: 6.6400000000000001e-002 | AK231: =I231+100*T231 -> 151.09999999999999 | AL231: 151.1 | AM231: 237 | AN231: 64.1 | AO231: 243 | AP231: 5.0000000000000003e-002 | AQ231: 7 | AR231: 航新转债
A232: 93 | B232: 东时转债 | C232: 113575 | D232: 43951. | E232: 东方时尚 | F232: 603377 | G232: 其他 | H232: 其他 | I232: 136.2 | J232: -4.0899999999999999e-002 | K232: -4.5000000000000005e-003 | L232: 20.19 | M232: -5.1200000000000002e-002 | N232: 97 | O232: 0.222 | P232: 113.5 | Q232: 14.56 | R232: 6.54 | S232: 138.67 | T232: -1.8000000000000002e-002 | U232: 转股中 | V232: 5.46年 | W232: 3.46年 | X232: 2.6000000000000002e-002 | Y232: 3.7000000000000005e-002 | Z232: 3.14 | AA232: 119 | AB232: -3.3500000000000002e-002 | AC232: -3.7699999999999997e-002 | AD232: -7.2800000000000004e-002 | AE232: -7.4499999999999997e-002 | AF232: 88.55 | AG232: 89.53 | AH232: 0.89 | AI232: AA | AJ232: 4.5400000000000003e-002 | AK232: =I232+100*T232 -> 134.39999999999998 | AL232: 133.7 | AM232: 119 | AN232: 44.2 | AO232: 137 | AP232: -4.4000000000000004e-002 | AQ232: 16 | AR232: 东时转债
A233: 192 | B233: 雅化转债! | C233: 128065 | D233: 43595. | E233: 雅化集团 | F233: 2497 | G233: 化工 | H233: 化工 | I233: 129 | J233: -2.12e-002 | K233: 2.2000000000000002e-002 | L233: 11.39 | M233: 8.9999999999999998e-004 | N233: 152 | O233: 0.14099999999999999 | P233: 110.9 | Q233: 8.95 | R233: 3.85 | S233: 127.26 | T233: 1.3999999999999999e-002 | U233: 转股中 | V233: 4.48年 | W233: 2.48年 | X233: 7.2999999999999995e-002 | Y233: 9.3000000000000013e-002 | Z233: 7.99 | AA233: 109 | AB233: -3.3799999999999997e-002 | AC233: -3.8100000000000002e-002 | AD233: -8.1000000000000003e-002 | AE233: -8.3199999999999996e-002 | AF233: 92.61 | AG233: 92.21 | AH233: 0.84 | AI233: AA | AJ233: 4.2999999999999997e-002 | AK233: =I233+100*T233 -> 130.40000000000001 | AL233: 130.7 | AM233: 87 | AN233: 38.1 | AO233: 85 | AP233: 0.10400000000000001 | AQ233: 21 | AR233: 雅化转债!
A234: 298 | B234: 九州转债! | C234: 110034 | D234: 42398. | E234: 九州通 | F234: 600998 | G234: 医药 | H234: 医药商业 | I234: 114.4 | J234: -9.3999999999999986e-003 | K234: 1.09e-002 | L234: 17.97 | M234: 3.9000000000000003e-003 | N234: 17 | O234: 1.e-002 | P234: 109.6 | Q234: 18.32 | R234: 1.88 | S234: 98.09 | T234: 0.16600000000000001 | U234: 转股中 | V234: 1.23年 | W234: 回售中 | X234: 4.4999999999999998e-002 | Y234: 4.4000000000000004e-002 | Z234: 15 | AA234: 337 | AB234: -3.4700000000000002e-002 | AC234: -4.8600000000000004e-002 | AD234: 回售中 | AE234: 回售中 | AF234: 103 | AG234: 104.44 | AH234: 0.36 | AI234: AA+ | AJ234: 4.0599999999999997e-002 | AK234: =I234+100*T234 -> 131. | AL234: 130.7 | AM234: 85 | AN234: 26.3 | AO234: 10 | AP234: 2.e-002 | AQ234: 25 | AR234: 九州转债!
A235: 150 | B235: 先导转债 | C235: 123036 | D235: 43840. | E235: 先导智能 | F235: 300450 | G235: 机械装备 | H235: 专用设备 | I235: 138 | J235: -3.1600000000000003e-002 | K235: 1.7000000000000001e-003 | L235: 53.6 | M235: -3.4200000000000001e-002 | N235: 154 | O235: 0.10800000000000001 | P235: 115.1 | Q235: 38.99 | R235: 11.25 | S235: 137.47 | T235: 4.0000000000000001e-003 | U235: 转股中 | V235: 5年48天 | W235: 3年48天 | X235: 2.1000000000000001e-002 | Y235: 2.8999999999999998e-002 | Z235: 9.92 | AA235: 472 | AB235: -3.5400000000000001e-002 | AC235: -4.0300000000000002e-002 | AD235: -8.4000000000000005e-002 | AE235: -8.5800000000000001e-002 | AF235: 89.62 | AG235: 92.06 | AH235: 0.87 | AI235: AA | AJ235: 4.5400000000000003e-002 | AK235: =I235+100*T235 -> 138.40000000000001 | AL235: 138.5 | AM235: 162 | AN235: 46.5 | AO235: 155 | AP235: 6.3e-002 | AQ235: 17 | AR235: 先导转债
A236: 232 | B236: 寒锐转债!! | C236: 123017 | D236: 43458. | E236: 寒锐钴业 | F236: 300618 | G236: 有色金属 | H236: 小金属 | I236: 128.02 | J236: -2.7900000000000001e-002 | K236: 2.7799999999999998e-002 | L236: 67.48 | M236: -1.e-004 | N236: 296 | O236: 0.54400000000000004 | P236: 110.8 | Q236: 57.4 | R236: 10.25 | S236: 117.56 | T236: 8.900000000000001e-002 | U236: 转股中 | V236: 4年27天 | W236: 2年27天 | X236: 2.e-002 | Y236: 2.3e-002 | Z236: 4.03 | AA236: 204 | AB236: -3.5499999999999997e-002 | AC236: -4.0099999999999997e-002 | AD236: -9.2200000000000004e-002 | AE236: -9.4600000000000004e-002 | AF236: 90.03 | AG236: 86.55 | AH236: 0.84 | AI236: AA- | AJ236: 6.4000000000000001e-002 | AK236: =I236+100*T236 -> 136.92000000000002 | AL236: 138.5 | AM236: 161 | AN236: 48.4 | AO236: 174 | AP236: 3.1e-002 | AQ236: 14 | AR236: 寒锐转债!!
A237: 53 | B237: 海容转债 | C237: 113590 | D237: 44039. | E237: 海容冷链 | F237: 603187 | G237: 机械装备 | H237: 通用设备 | I237: 141.6 | J237: -2.5600000000000001e-002 | K237: -4.5999999999999999e-003 | L237: 47.5 | M237: -3.3599999999999998e-002 | N237: 15 | O237: 2.e-002 | P237: 115.6 | Q237: 36.39 | R237: 4.82 | S237: 130.53 | T237: 8.5000000000000006e-002 | U237: 2月12天 | V237: 5.68年 | W237: 3.68年 | X237: 6.6000000000000003e-002 | Y237: 8.6999999999999994e-002 | Z237: 5 | AA237: 75 | AB237: -3.5699999999999996e-002 | AC237: -4.0300000000000002e-002 | AD237: -7.7899999999999997e-002 | AE237: -7.9600000000000004e-002 | AF237: 81.38 | AG237: 80.85 | AH237: 0.9 | AI237: AA- | AJ237: 6.6400000000000001e-002 | AK237: =I237+100*T237 -> 150.09999999999999 | AL237: 152.7 | AM237: 241 | AN237: 71.3 | AO237: 254 | AP237: -8.5999999999999993e-002 | AQ237: 5 | AR237: 海容转债
A238: 233 | B238: 桐昆转债! | C238: 113020 | D238: 43446. | E238: 桐昆股份 | F238: 601233 | G238: 服装纺织 | H238: 纺织行业 | I238: 130.75 | J238: -6.5000000000000006e-003 | K238: 2.8999999999999998e-003 | L238: 16.05 | M238: -4.3e-003 | N238: 35 | O238: 8.0000000000000002e-003 | P238: 112.8 | Q238: 12.28 | R238: 1.53 | S238: 130.7 | T238: 0. | U238: 转股中 | V238: 4年26天 | W238: 2年26天 | X238: 0.107 | Y238: 0.14000000000000001 | Z238: 31.7 | AA238: 297 | AB238: -3.6299999999999999e-002 | AC238: -4.1700000000000001e-002 | AD238: -0.10099999999999999 | AE238: -0.10300000000000001 | AF238: 94.51 | AG238: 96.12 | AH238: 0.84 | AI238: AA+ | AJ238: 4.0999999999999995e-002 | AK238: =I238+100*T238 -> 130.75 | AL238: 130.8 | AM238: 88 | AN238: 34.7 | AO238: 49 | AP238: 4.8000000000000001e-002 | AQ238: 15 | AR238: 桐昆转债!
A239: 146 | B239: 明阳转债! | C239: 113029 | D239: 43837. | E239: 明阳智能 | F239: 601615 | G239: 能源电力 | H239: 风能 | I239: 137 | J239: -1.1899999999999999e-002 | K239: 1.1899999999999999e-002 | L239: 17.02 | M239: 0. | N239: 105 | O239: 7.5999999999999998e-002 | P239: 113.3 | Q239: 12.46 | R239: 3.29 | S239: 136.6 | T239: 3.0000000000000001e-003 | U239: 转股中 | V239: 5年53天 | W239: 3年53天 | X239: 4.0999999999999995e-002 | Y239: 5.5999999999999994e-002 | Z239: 9.83 | AA239: 239 | AB239: -3.6900000000000002e-002 | AC239: -4.1299999999999996e-002 | AD239: -8.1199999999999994e-002 | AE239: -8.3100000000000007e-002 | AF239: 89.76 | AG239: 90.61 | AH239: 0.87 | AI239: AA | AJ239: 4.5400000000000003e-002 | AK239: =I239+100*T239 -> 137.30000000000001 | AL239: 137.4 | AM239: 154 | AN239: 46.8 | AO239: 158 | AP239: -6.9999999999999993e-003 | AQ239: 23 | AR239: 明阳转债!
A240: 89 | B240: 应急转债 | C240: 123048 | D240: 43962. | E240: 中船应急 | F240: 300527 | G240: 机械装备 | H240: 专用设备 | I240: 139.49 | J240: -4.2599999999999999e-002 | K240: 1.6e-002 | L240: 12.49 | M240: -3.0299999999999997e-002 | N240: 2685. | O240: 4.2400000000000002 | P240: 113.1 | Q240: 8.9 | R240: 4.91 | S240: 140.34 | T240: -6.0000000000000001e-003 | U240: 转股中 | V240: 5.46年 | W240: 3.46年 | X240: 3.6000000000000004e-002 | Y240: 5.0999999999999997e-002 | Z240: 4.16 | AA240: 114 | AB240: -3.8300000000000001e-002 | AC240: -4.24e-002 | AD240: -7.9299999999999995e-002 | AE240: -8.1000000000000003e-002 | AF240: 88.93 | AG240: 90.08 | AH240: 0.88 | AI240: AA+ | AJ240: 4.3400000000000001e-002 | AK240: =I240+100*T240 -> 138.89000000000001 | AL240: 138.6 | AM240: 165 | AN240: 48.6 | AO240: 176 | AP240: -1.2e-002 | AQ240: 15 | AR240: 应急转债
A241: 42 | B241: 欣旺转债 | C241: 123058 | D241: 44050. | E241: 欣旺达 | F241: 300207 | G241: 电子 | H241: 电子产品 | I241: 145.655 | J241: -1.04e-002 | K241: -6.5000000000000006e-003 | L241: 26.4 | M241: -2.1099999999999997e-002 | N241: 20 | O241: 1.2e-002 | P241: 116.3 | Q241: 21.24 | R241: 7.14 | S241: 124.29 | T241: 0.17199999999999999 | U241: 2月28天 | V241: 5.72年 | W241: 3.72年 | X241: 2.7000000000000003e-002 | Y241: 3.3000000000000002e-002 | Z241: 11.2 | AA241: 416 | AB241: -3.9199999999999999e-002 | AC241: -4.3899999999999995e-002 | AD241: -8.4100000000000008e-002 | AE241: -8.5699999999999998e-002 | AF241: 87.49 | AG241: 90.65 | AH241: 0.8 | AI241: AA | AJ241: 4.5400000000000003e-002 | AK241: =I241+100*T241 -> 162.85499999999999 | AL241: 167 | AM241: 262 | AN241: 76.4 | AO241: 260 | AP241: -7.6999999999999999e-002 | AQ241: 6 | AR241: 欣旺转债
A242: 136 | B242: 联得转债! | C242: 123038 | D242: 43852. | E242: 联得装备 | F242: 300545 | G242: 机械装备 | H242: 专用设备 | I242: 146 | J242: -1.3500000000000002e-002 | K242: 1.55e-002 | L242: 31.4 | M242: 2.2000000000000001e-003 | N242: 4884. | O242: 16.640000000000001 | P242: 119.1 | Q242: 25.29 | R242: 6.44 | S242: 124.16 | T242: 0.17600000000000002 | U242: 转股中 | V242: 5.17年 | W242: 3.17年 | X242: 3.2000000000000001e-002 | Y242: 4.0000000000000001e-002 | Z242: 1.48 | AA242: 46 | AB242: -3.9399999999999998e-002 | AC242: -4.5400000000000003e-002 | AD242: -9.69e-002 | AE242: -9.8900000000000002e-002 | AF242: 81.66 | AG242: 81.79 | AH242: 0.87 | AI242: A+ | AJ242: 7.7399999999999997e-002 | AK242: =I242+100*T242 -> 163.59999999999999 | AL242: 167.8 | AM242: 263 | AN242: 86 | AO242: 271 | AP242: -1.2e-002 | AQ242: 14 | AR242: 联得转债!
A243: 283 | B243: 久立转2! | C243: 128019 | D243: 43070. | E243: 久立特材 | F243: 2318 | G243: 石油天然 | H243: 石油天然 | I243: 123.9 | J243: -2.29e-002 | K243: 1.2800000000000001e-002 | L243: 9.02 | M243: -1.3100000000000001e-002 | N243: 24 | O243: 1.8000000000000002e-002 | P243: 109.8 | Q243: 7.62 | R243: 2.36 | S243: 118.37 | T243: 4.7e-002 | U243: 转股中 | V243: 3年15天 | W243: 1年15天 | X243: 0.13699999999999998 | Y243: 0.16200000000000001 | Z243: 10.4 | AA243: 76 | AB243: -3.9699999999999999e-002 | AC243: -4.5400000000000003e-002 | AD243: -0.14000000000000001 | AE243: -0.14300000000000002 | AF243: 97.52 | AG243: 96.88 | AH243: 0.77 | AI243: AA | AJ243: 4.2999999999999997e-002 | AK243: =I243+100*T243 -> 128.59999999999999 | AL243: 129.4 | AM243: 64 | AN243: 31.9 | AO243: 29 | AP243: 1.7000000000000001e-002 | AQ243: 13 | AR243: 久立转2!
A244: 129 | B244: 希望转债! | C244: 127015 | D244: 43865. | E244: 新 希 望 | F244: 876 | G244: 农业 | H244: 畜牧业 | I244: 135.7 | J244: -3.9e-002 | K244: 6.9999999999999993e-003 | L244: 26.7 | M244: -3.1899999999999998e-002 | N244: 142 | O244: 5.5999999999999994e-002 | P244: 110.2 | Q244: 19.63 | R244: 3.88 | S244: 136.02 | T244: -2.e-003 | U244: 转股中 | V244: 5.19年 | W244: 3.19年 | X244: 1.6e-002 | Y244: 2.1000000000000001e-002 | Z244: 18.2 | AA244: 1156. | AB244: -3.9800000000000002e-002 | AC244: -4.3200000000000002e-002 | AD244: -7.9600000000000004e-002 | AE244: -8.1099999999999992e-002 | AF244: 90.14 | AG244: 90 | AH244: 1 | AI244: AAA | AJ244: 4.0399999999999998e-002 | AK244: =I244+100*T244 -> 135.5 | AL244: 135.4 | AM244: 139 | AN244: 45.2 | AO244: 147 | AP244: -6.8000000000000005e-002 | AQ244: 28 | AR244: 希望转债!
A245: 133 | B245: 新天转债 | C245: 128091 | D245: 43847. | E245: 新天药业 | F245: 2873 | G245: 医药 | H245: 中药 | I245: 147.51 | J245: -0.10800000000000001 | K245: 9.1700000000000004e-002 | L245: 18.2 | M245: -2.0499999999999997e-002 | N245: 903 | O245: 3.1800000000000002 | P245: 120 | Q245: 16.39 | R245: 2.92 | S245: 111.04 | T245: 0.32799999999999996 | U245: 转股中 | V245: 5.18年 | W245: 3.18年 | X245: 8.3000000000000004e-002 | Y245: 9.1999999999999998e-002 | Z245: 1.76 | AA245: 21 | AB245: -4.0000000000000001e-002 | AC245: -4.6199999999999998e-002 | AD245: -9.7599999999999992e-002 | AE245: -0.10000000000000001 | AF245: 82.21 | AG245: 82.46 | AH245: 0.81 | AI245: A+ | AJ245: 7.7399999999999997e-002 | AK245: =I245+100*T245 -> 180.31 | AL245: 184 | AM245: 275 | AN245: 101.5 | AO245: 276 | AP245: 4.0000000000000001e-003 | AQ245: 15 | AR245: 新天转债
A246: 5 | B246: 宝莱转债! | C246: 123065 | D246: 44098. | E246: 宝莱特 | F246: 300246 | G246: 医药 | H246: 医疗器械 | I246: 154 | J246: 0.316 | K246: -0.32600000000000001 | L246: 34.28 | M246: -1.78e-002 | N246: 7971. | O246: 19.510000000000002 | P246: 121.4 | Q246: 40.54 | R246: 6.6 | S246: 84.56 | T246: 0.82099999999999995 | U246: 4月18天 | V246: 5.86年 | W246: 3.86年 | X246: 4.4000000000000004e-002 | Y246: 3.7000000000000005e-002 | Z246: 2.19 | AA246: 50 | AB246: -4.0500000000000001e-002 | AC246: -4.6300000000000001e-002 | AD246: -9.2899999999999996e-002 | AE246: -9.4600000000000004e-002 | AF246: 80.72 | AG246: 83.93 | AH246: 0.53 | AI246: AA- | AJ246: 6.6400000000000001e-002 | AK246: =I246+100*T246 -> 236.09999999999999 | AL246: 223.4 | AM246: 283 | AN246: 139.5 | AO246: 283 | AP246: -5.5999999999999994e-002 | AQ246: 7 | AR246: 宝莱转债!
A247: 45 | B247: 安20转债 | C247: 113592 | D247: 44043. | E247: 安井食品 | F247: 603345 | G247: 食品饮料 | H247: 食品饮料 | I247: 143.01 | J247: -4.7699999999999992e-002 | K247: 2.3999999999999998e-003 | L247: 168.73 | M247: -5.0000000000000003e-002 | N247: 100 | O247: 7.5999999999999998e-002 | P247: 113.1 | Q247: 115.9 | R247: 13.03 | S247: 145.58 | T247: -1.8000000000000002e-002 | U247: 2月22天 | V247: 5.70年 | W247: 3.70年 | X247: 2.3e-002 | Y247: 3.3000000000000002e-002 | Z247: 9 | AA247: 399 | AB247: -4.0899999999999999e-002 | AC247: -4.4800000000000006e-002 | AD247: -8.0500000000000002e-002 | AE247: -8.199999999999999e-002 | AF247: 87.36 | AG247: 88.2 | AH247: 0.91 | AI247: AA | AJ247: 4.5400000000000003e-002 | AK247: =I247+100*T247 -> 141.20999999999998 | AL247: 140.4 | AM247: 182 | AN247: 52.2 | AO247: 195 | AP247: -4.2999999999999997e-002 | AQ247: 6 | AR247: 安20转债
A248: 262 | B248: 艾华转债!! | C248: 113504 | D248: 43182. | E248: 艾华集团 | F248: 603989 | G248: 电子 | H248: 元器件制 | I248: 127.18 | J248: -1.8500000000000003e-002 | K248: 2.4900000000000002e-002 | L248: 26.08 | M248: 7.7000000000000002e-003 | N248: 115 | O248: 0.152 | P248: 110.3 | Q248: 21.13 | R248: 4.63 | S248: 123.43 | T248: 2.9999999999999999e-002 | U248: 转股中 | V248: 3.35年 | W248: 1.35年 | X248: 5.4000000000000006e-002 | Y248: 6.7000000000000004e-002 | Z248: 5.61 | AA248: 103 | AB248: -4.24e-002 | AC248: -4.7699999999999992e-002 | AD248: -0.11800000000000001 | AE248: -0.121 | AF248: 96.48 | AG248: 96.06 | AH248: 0.82 | AI248: AA | AJ248: 4.2999999999999997e-002 | AK248: =I248+100*T248 -> 130.18000000000001 | AL248: 130.9 | AM248: 92 | AN248: 34.5 | AO248: 46 | AP248: -2.8999999999999998e-002 | AQ248: 9 | AR248: 艾华转债!!
A249: 280 | B249: 国祯转债!! | C249: 123002 | D249: 43094. | E249: 国祯环保 | F249: 300388 | G249: 城市公用 | H249: 三废处理 | I249: 125.2 | J249: -1.4199999999999999e-002 | K249: 1.e-004 | L249: 9.74 | M249: -1.4199999999999999e-002 | N249: 35 | O249: 0.10800000000000001 | P249: 109.8 | Q249: 8.48 | R249: 1.89 | S249: 114.86 | T249: 8.9999999999999997e-002 | U249: 转股中 | V249: 3年31天 | W249: 1年31天 | X249: 3.7000000000000005e-002 | Y249: 4.2999999999999997e-002 | Z249: 2.52 | AA249: 68 | AB249: -4.2500000000000003e-002 | AC249: -4.8000000000000001e-002 | AD249: -0.14099999999999999 | AE249: -0.14400000000000002 | AF249: 97.34 | AG249: 96.7 | AH249: 0.99 | AI249: AA | AJ249: 4.2999999999999997e-002 | AK249: =I249+100*T249 -> 134.19999999999999 | AL249: 135.5 | AM249: 143 | AN249: 38.2 | AO249: 90 | AP249: -4.7e-002 | AQ249: 12 | AR249: 国祯转债!!
A250: 124 | B250: 恩捷转债!! | C250: 128095 | D250: 43889. | E250: 恩捷股份 | F250: 2812 | G250: 电子 | H250: 元器件制 | I250: 144.73 | J250: -2.2799999999999997e-002 | K250: 1.1999999999999999e-003 | L250: 94.5 | M250: -2.4399999999999998e-002 | N250: 65 | O250: 3.2000000000000001e-002 | P250: 115.3 | Q250: 65.09 | R250: 16.31 | S250: 145.18 | T250: -3.0000000000000001e-003 | U250: 转股中 | V250: 5.30年 | W250: 3.30年 | X250: 1.6e-002 | Y250: 2.4e-002 | Z250: 13.5 | AA250: 829 | AB250: -4.2699999999999995e-002 | AC250: -4.7500000000000001e-002 | AD250: -9.2300000000000007e-002 | AE250: -9.4e-002 | AF250: 89.14 | AG250: 91.56 | AH250: 0.89 | AI250: AA | AJ250: 4.5400000000000003e-002 | AK250: =I250+100*T250 -> 144.42999999999998 | AL250: 144.3 | AM250: 212 | AN250: 52.7 | AO250: 199 | AP250: 8.0000000000000002e-003 | AQ250: 17 | AR250: 恩捷转债!!
A251: 279 | B251: 兄弟转债!! | C251: 128021 | D251: 43096. | E251: 兄弟科技 | F251: 2562 | G251: 医药 | H251: 原料药 | I251: 125.7 | J251: -2.41e-002 | K251: 2.0000000000000001e-004 | L251: 6.09 | M251: -2.4e-002 | N251: 97 | O251: 0.28000000000000003 | P251: 109.8 | Q251: 5.25 | R251: 2.56 | S251: 116 | T251: 8.4000000000000005e-002 | U251: 转股中 | V251: 3年35天 | W251: 1年35天 | X251: 4.5999999999999999e-002 | Y251: 5.2999999999999999e-002 | Z251: 2.66 | AA251: 58 | AB251: -4.36e-002 | AC251: -4.9100000000000005e-002 | AD251: -0.14199999999999999 | AE251: -0.14499999999999999 | AF251: 97.3 | AG251: 96.66 | AH251: 1 | AI251: AA | AJ251: 4.2999999999999997e-002 | AK251: =I251+100*T251 -> 134.09999999999999 | AL251: 135.4 | AM251: 140 | AN251: 38.1 | AO251: 84 | AP251: -9.0000000000000011e-003 | AQ251: 13 | AR251: 兄弟转债!!
A252: 154 | B252: 常汽转债! | C252: 113550 | D252: 43811. | E252: 常熟汽饰 | F252: 603035 | G252: 汽车 | H252: 零部件制 | I252: 151.98 | J252: -1.9e-003 | K252: 1.3999999999999999e-002 | L252: 14.59 | M252: 1.32e-002 | N252: 77 | O252: 0.109 | P252: 121.8 | Q252: 9.65 | R252: 1.51 | S252: 151.19 | T252: 5.0000000000000001e-003 | U252: 转股中 | V252: 5年25天 | W252: 3年25天 | X252: 9.3000000000000013e-002 | Y252: 0.14099999999999999 | Z252: 4.55 | AA252: 49 | AB252: -4.3700000000000003e-002 | AC252: -5.0499999999999996e-002 | AD252: -0.10800000000000001 | AE252: -0.11 | AF252: 85.33 | AG252: 88.7 | AH252: 0.92 | AI252: AA- | AJ252: 6.6400000000000001e-002 | AK252: =I252+100*T252 -> 152.47999999999999 | AL252: 152.8 | AM252: 242 | AN252: 64.1 | AO252: 242 | AP252: 2.5000000000000001e-002 | AQ252: 15 | AR252: 常汽转债!
A253: 102 | B253: 天铁转债! | C253: 123046 | D253: 43938. | E253: 天铁股份 | F253: 300587 | G253: 铁路 | H253: 铁路设备 | I253: 153 | J253: -4.3799999999999999e-002 | K253: 1.1299999999999999e-002 | L253: 15.46 | M253: -3.5000000000000003e-002 | N253: 173 | O253: 0.69099999999999995 | P253: 118.2 | Q253: 10.12 | R253: 3.8 | S253: 152.77 | T253: 2.e-003 | U253: 转股中 | V253: 5.40年 | W253: 3.40年 | X253: 3.1e-002 | Y253: 4.7e-002 | Z253: 1.55 | AA253: 51 | AB253: -4.7599999999999996e-002 | AC253: -5.2999999999999999e-002 | AD253: -0.10099999999999999 | AE253: -0.10199999999999999 | AF253: 83.01 | AG253: 84.21 | AH253: 0.93 | AI253: AA- | AJ253: 6.6400000000000001e-002 | AK253: =I253+100*T253 -> 153.19999999999999 | AL253: 153.2 | AM253: 244 | AN253: 69 | AO253: 252 | AP253: -5.7999999999999996e-002 | AQ253: 9 | AR253: 天铁转债!
A254: 288 | B254: 国君转债! | C254: 113013 | D254: 42940. | E254: 国泰君安 | F254: 601211 | G254: 金融 | H254: 证券行业 | I254: 123.6 | J254: -5.9999999999999995e-004 | K254: 0. | L254: 18.33 | M254: -1.1000000000000001e-003 | N254: 9.6 | O254: 1.e-003 | P254: 108.3 | Q254: 19.01 | R254: 1.35 | S254: 96.42 | T254: 0.28199999999999997 | U254: 转股中 | V254: 2.70年 | W254: 无权 | X254: 4.2999999999999997e-002 | Y254: 4.0999999999999995e-002 | Z254: 69.9 | AA254: 1633. | AB254: -4.8499999999999995e-002 | AC254: -5.3800000000000001e-002 | AD254: 无权 | AE254: 无权 | AF254: 无权 | AG254: 98.19 | AH254: 0.5 | AI254: AAA | AJ254: 3.7599999999999995e-002 | AK254: =I254+100*T254 -> 151.79999999999998 | AL254: 150.8 | AM254: 236 | AN254: 52.6 | AO254: 197 | AP254: -9.0000000000000011e-003 | AQ254: 14 | AR254: 国君转债!
A255: 260 | B255: 长证转债! | C255: 127005 | D255: 43201. | E255: 长江证券 | F255: 783 | G255: 金融 | H255: 证券行业 | I255: 128.88 | J255: -4.8999999999999998e-003 | K255: -2.5999999999999999e-003 | L255: 8.02 | M255: -1.11e-002 | N255: 17 | O255: 3.0000000000000001e-003 | P255: 109.3 | Q255: 7.28 | R255: 1.64 | S255: 110.16 | T255: 0.17000000000000001 | U255: 转股中 | V255: 3.38年 | W255: 无权 | X255: 0.113 | Y255: 0.124 | Z255: 50 | AA255: 443 | AB255: -4.8499999999999995e-002 | AC255: -5.3200000000000004e-002 | AD255: 无权 | AE255: 无权 | AF255: 无权 | AG255: 96.61 | AH255: 0.68 | AI255: AAA | AJ255: 3.7999999999999999e-002 | AK255: =I255+100*T255 -> 145.88 | AL255: 147.6 | AM255: 228 | AN255: 51 | AO255: 187 | AP255: -1.6e-002 | AQ255: 15 | AR255: 长证转债!
A256: 20 | B256: 隆20转债 | C256: 113038 | D256: 44082. | E256: 隆基股份 | F256: 601012 | G256: 能源电力 | H256: 太阳能 | I256: 151.73 | J256: -2.07e-002 | K256: -9.300000000000001e-003 | L256: 67.95 | M256: -3.6200000000000003e-002 | N256: 260 | O256: 3.4000000000000002e-002 | P256: 111.8 | Q256: 52.77 | R256: 8.26 | S256: 128.77 | T256: 0.17800000000000002 | U256: 3月15天 | V256: 5.77年 | W256: 3.77年 | X256: 2.e-002 | Y256: 2.5000000000000001e-002 | Z256: 50 | AA256: 2563. | AB256: -5.2300000000000006e-002 | AC256: -5.57e-002 | AD256: -9.3599999999999989e-002 | AE256: -9.5000000000000001e-002 | AF256: 88.49 | AG256: 89.3 | AH256: 0.83 | AI256: AAA | AJ256: 4.0399999999999998e-002 | AK256: =I256+100*T256 -> 169.53 | AL256: 174.7 | AM256: 268 | AN256: 85.4 | AO256: 270 | AP256: -9.3000000000000013e-002 | AQ256: 11 | AR256: 隆20转债
A257: 213 | B257: 拓邦转债 | C257: 128058 | D257: 43563. | E257: 拓邦股份 | F257: 2139 | G257: 电子 | H257: 电子产品 | I257: 156.51 | J257: 6.3e-003 | K257: 5.3e-003 | L257: 8.65 | M257: 1.29e-002 | N257: 265 | O257: 0.51100000000000001 | P257: 122.6 | Q257: 5.47 | R257: 3.32 | S257: 158.14 | T257: -1.e-002 | U257: 转股中 | V257: 4.37年 | W257: 2.37年 | X257: 3.7000000000000005e-002 | Y257: 5.7999999999999996e-002 | Z257: 3.27 | AA257: 89 | AB257: -5.5599999999999997e-002 | AC257: -6.3600000000000004e-002 | AD257: -0.107 | AE257: -0.109 | AF257: 94.07 | AG257: 102.49 | AH257: 0.9 | AI257: AA | AJ257: 4.2999999999999997e-002 | AK257: =I257+100*T257 -> 155.50999999999999 | AL257: 154.9 | AM257: 249 | AN257: 52.4 | AO257: 196 | AP257: 0.20699999999999999 | AQ257: 21 | AR257: 拓邦转债
A258: 80 | B258: 康隆转债 | C258: 113580 | D258: 43971. | E258: 康隆达 | F258: 603665 | G258: 服装纺织 | H258: 服装行业 | I258: 169.87 | J258: 3.3799999999999997e-002 | K258: -2.23e-002 | L258: 27.68 | M258: 1.21e-002 | N258: 292 | O258: 0.85499999999999998 | P258: 121.2 | Q258: 15.51 | R258: 4.44 | S258: 178.47 | T258: -4.8000000000000001e-002 | U258: 5.1天 | V258: 5.50年 | W258: 3.50年 | X258: 4.9000000000000002e-002 | Y258: 8.6999999999999994e-002 | Z258: 2 | AA258: 41 | AB258: -6.0700000000000004e-002 | AC258: -6.6600000000000006e-002 | AD258: -0.122 | AE258: -0.12300000000000001 | AF258: 82.5 | AG258: 85.79 | AH258: 0.95 | AI258: AA- | AJ258: 6.6400000000000001e-002 | AK258: =I258+100*T258 -> 165.06999999999999 | AL258: 161.3 | AM258: 257 | AN258: 75.5 | AO258: 258 | AP258: 4.8000000000000001e-002 | AQ258: 10 | AR258: 康隆转债
A259: 293 | B259: 光大转债 | C259: 113011 | D259: 42934. | E259: 光大银行 | F259: 601818 | G259: 金融 | H259: 银行行业 | I259: 125.76 | J259: -4.3e-003 | K259: 1.11e-002 | L259: 4.16 | M259: 9.7000000000000003e-003 | N259: 329 | O259: 1.1000000000000001e-002 | P259: 108.3 | Q259: 3.76 | R259: 0.68 | S259: 110.64 | T259: 0.13699999999999998 | U259: 转股中 | V259: 2.39年 | W259: 无权 | X259: 0.111 | Y259: 0.12300000000000001 | Z259: 242 | AA259: 2184. | AB259: -6.1600000000000002e-002 | AC259: -6.7500000000000004e-002 | AD259: 无权 | AE259: 无权 | AF259: 无权 | AG259: 99.31 | AH259: 0.7 | AI259: AAA | AJ259: 3.7599999999999995e-002 | AK259: =I259+100*T259 -> 139.46000000000001 | AL259: 140.9 | AM259: 191 | AN259: 41.6 | AO259: 119 | AP259: 8.6999999999999994e-002 | AQ259: 15 | AR259: 光大转债
A260: 103 | B260: 海大转债! | C260: 128102 | D260: 43937. | E260: 海大集团 | F260: 2311 | G260: 农业 | H260: 畜牧业 | I260: 160.511 | J260: -5.6399999999999999e-002 | K260: 5.7999999999999996e-003 | L260: 56.05 | M260: -5.4000000000000006e-002 | N260: 222 | O260: 7.0999999999999994e-002 | P260: 114.1 | Q260: 34.74 | R260: 9.01 | S260: 161.34 | T260: -5.0000000000000001e-003 | U260: 转股中 | V260: 5.40年 | W260: 4.40年 | X260: 2.1000000000000001e-002 | Y260: 3.4000000000000002e-002 | Z260: 18.8 | AA260: 898 | AB260: -6.2e-002 | AC260: -6.6199999999999995e-002 | AD260: -9.0700000000000003e-002 | AE260: -9.2200000000000004e-002 | AF260: 86.21 | AG260: 91.02 | AH260: 0.94 | AI260: AA+ | AJ260: 4.3400000000000001e-002 | AK260: =I260+100*T260 -> 160.011 | AL260: 159.7 | AM260: 256 | AN260: 68.7 | AO260: 251 | AP260: -7.2000000000000008e-002 | AQ260: 12 | AR260: 海大转债!
A261: 178 | B261: 欧派转债! | C261: 113543 | D261: 43712. | E261: 欧派家居 | F261: 603833 | G261: 其他 | H261: 家居用品 | I261: 156.1 | J261: -4.6100000000000002e-002 | K261: 1.8100000000000002e-002 | L261: 113.72 | M261: -3.0099999999999998e-002 | N261: 24 | O261: 1.8000000000000002e-002 | P261: 114.9 | Q261: 71.69 | R261: 5.15 | S261: 158.63 | T261: -1.6e-002 | U261: 转股中 | V261: 4.81年 | W261: 3.81年 | X261: 1.2e-002 | Y261: 1.9e-002 | Z261: 8.16 | AA261: 678 | AB261: -6.2699999999999992e-002 | AC261: -6.7699999999999996e-002 | AD261: -9.5500000000000002e-002 | AE261: -9.7599999999999992e-002 | AF261: 89.22 | AG261: 94.19 | AH261: 0.93 | AI261: AA | AJ261: 4.2999999999999997e-002 | AK261: =I261+100*T261 -> 154.5 | AL261: 153.6 | AM261: 245 | AN261: 59.4 | AO261: 232 | AP261: 4.0000000000000001e-003 | AQ261: 15 | AR261: 欧派转债!
A262: 77 | B262: 火炬转债 | C262: 113582 | D262: 44005. | E262: 火炬电子 | F262: 603678 | G262: 电子 | H262: 元器件制 | I262: 165.59 | J262: -4.0500000000000001e-002 | K262: -2.3999999999999998e-003 | L262: 42.46 | M262: -4.5599999999999995e-002 | N262: 53 | O262: 5.2000000000000005e-002 | P262: 115.3 | Q262: 25.33 | R262: 5.79 | S262: 167.63 | T262: -1.2e-002 | U262: 39天 | V262: 5.59年 | W262: 3.59年 | X262: 3.1e-002 | Y262: 5.2000000000000005e-002 | Z262: 6 | AA262: 192 | AB262: -6.3700000000000007e-002 | AC262: -6.8099999999999994e-002 | AD262: -0.114 | AE262: -0.115 | AF262: 88 | AG262: 90.4 | AH262: 0.94 | AI262: AA | AJ262: 4.5400000000000003e-002 | AK262: =I262+100*T262 -> 164.39000000000001 | AL262: 163.6 | AM262: 258 | AN262: 73.2 | AO262: 255 | AP262: -7.400000000000001e-002 | AQ262: 4 | AR262: 火炬转债
A263: 99 | B263: 同德转债 | C263: 128103 | D263: 43942. | E263: 同德化工 | F263: 2360 | G263: 化工 | H263: 化工 | I263: 176 | J263: -0.16200000000000001 | K263: 0.151 | L263: 6.02 | M263: -1.3100000000000001e-002 | N263: 7981. | O263: 21.539999999999999 | P263: 121.8 | Q263: 5.18 | R263: 2.04 | S263: 116.22 | T263: 0.51400000000000001 | U263: 转股中 | V263: 5.42年 | W263: 3.42年 | X263: 6.0999999999999999e-002 | Y263: 7.0999999999999994e-002 | Z263: 1.44 | AA263: 24 | AB263: -6.7000000000000004e-002 | AC263: -7.3099999999999998e-002 | AD263: -0.13100000000000001 | AE263: -0.13300000000000001 | AF263: 80.42 | AG263: 82.13 | AH263: 0.83 | AI263: A+ | AJ263: 7.7399999999999997e-002 | AK263: =I263+100*T263 -> 227.40000000000001 | AL263: 235.8 | AM263: 285 | AN263: 153.6 | AO263: 286 | AP263: -3.7000000000000005e-002 | AQ263: 10 | AR263: 同德转债
A264: 301 | B264: 电气转债! | C264: 113008 | D264: 42051. | E264: 上海电气 | F264: 601727 | G264: 能源电力 | H264: 电力设备 | I264: 108.68 | J264: 8.9999999999999998e-004 | K264: -1.4000000000000002e-003 | L264: 5.11 | M264: -2.e-003 | N264: 36 | O264: 6.9999999999999993e-003 | P264: 106.6 | Q264: 5.13 | R264: 1.19 | S264: 99.61 | T264: 9.0999999999999998e-002 | U264: 转股中 | V264: 0.28年 | W264: 回售中 | X264: 5.7000000000000002e-002 | Y264: 5.7000000000000002e-002 | Z264: 44.1 | AA264: 774 | AB264: -6.7400000000000002e-002 | AC264: -0.10800000000000001 | AD264: 回售中 | AE264: 回售中 | AF264: 103 | AG264: 105.59 | AH264: 0.24 | AI264: AAA | AJ264: 3.49e-002 | AK264: =I264+100*T264 -> 117.78 | AL264: 117.7 | AM264: 5 | AN264: 12.2 | AO264: 1 | AP264: -2.e-002 | AQ264: 29 | AR264: 电气转债!
A265: 254 | B265: 三力转债! | C265: 128039 | D265: 43280. | E265: 三 力 士 | F265: 2224 | G265: 机械装备 | H265: 专用设备 | I265: 141 | J265: 0.11599999999999999 | K265: -0.125 | L265: 6.52 | M265: -1.06e-002 | N265: 1381. | O265: 5.0599999999999996 | P265: 109.8 | Q265: 5.81 | R265: 2.07 | S265: 112.22 | T265: 0.25600000000000001 | U265: 转股中 | V265: 3.62年 | W265: 1.62年 | X265: 4.2999999999999997e-002 | Y265: 4.8000000000000001e-002 | Z265: 2.03 | AA265: 48 | AB265: -6.7799999999999999e-002 | AC265: -7.22e-002 | AD265: -0.13800000000000001 | AE265: -0.14000000000000001 | AF265: 91.86 | AG265: 88.07 | AH265: 0.79 | AI265: AA- | AJ265: 6.4000000000000001e-002 | AK265: =I265+100*T265 -> 166.59999999999999 | AL265: 169.8 | AM265: 266 | AN265: 77.9 | AO265: 261 | AP265: 2.3e-002 | AQ265: 19 | AR265: 三力转债!
A266: 187 | B266: 中环转债! | C266: 123026 | D266: 43647. | E266: 中环环保 | F266: 300692 | G266: 城市公用 | H266: 三废处理 | I266: 144.5 | J266: -7.7199999999999991e-002 | K266: 6.0599999999999994e-002 | L266: 17.31 | M266: -1.8200000000000001e-002 | N266: 921 | O266: 3.96 | P266: 110.6 | Q266: 12.25 | R266: 2.8 | S266: 141.31 | T266: 2.3e-002 | U266: 转股中 | V266: 3.63年 | W266: 1.63年 | X266: 4.9000000000000002e-002 | Y266: 6.9000000000000006e-002 | Z266: 1.44 | AA266: 30 | AB266: -7.2300000000000003e-002 | AC266: -7.6999999999999999e-002 | AD266: -0.14599999999999999 | AE266: -0.14800000000000002 | AF266: 92.01 | AG266: 88.71 | AH266: 0.91 | AI266: AA- | AJ266: 6.4000000000000001e-002 | AK266: =I266+100*T266 -> 146.80000000000001 | AL266: 147.7 | AM266: 229 | AN266: 55.7 | AO266: 220 | AP266: 2.7999999999999997e-002 | AQ266: 28 | AR266: 中环转债!
A267: 185 | B267: 蓝晓转债! | C267: 123027 | D267: 43650. | E267: 蓝晓科技 | F267: 300487 | G267: 化工 | H267: 化工 | I267: 167.99 | J267: -8.6899999999999991e-002 | K267: 8.4499999999999992e-002 | L267: 47.58 | M267: -2.5000000000000001e-003 | N267: 969 | O267: 4.5999999999999996 | P267: 119.5 | Q267: 29.33 | R267: 7.19 | S267: 162.22 | T267: 3.6000000000000004e-002 | U267: 转股中 | V267: 4.63年 | W267: 2.63年 | X267: 1.1000000000000001e-002 | Y267: 1.7000000000000001e-002 | Z267: 1.08 | AA267: 102 | AB267: -7.2400000000000006e-002 | AC267: -7.8899999999999998e-002 | AD267: -0.107 | AE267: -0.10800000000000001 | AF267: 85.5 | AG267: 86.23 | AH267: 0.95 | AI267: A+ | AJ267: 7.4999999999999997e-002 | AK267: =I267+100*T267 -> 171.59 | AL267: 173.8 | AM267: 267 | AN267: 87.5 | AO267: 272 | AP267: -8.900000000000001e-002 | AQ267: 21 | AR267: 蓝晓转债!
A268: 56 | B268: 巨星转债 | C268: 128115 | D268: 44028. | E268: 巨星科技 | F268: 2444 | G268: 机械装备 | H268: 通用设备 | I268: 176.9 | J268: 1.e-004 | K268: 1.1999999999999999e-003 | L268: 22.72 | M268: 1.2999999999999999e-003 | N268: 313 | O268: 0.17600000000000002 | P268: 115.3 | Q268: 12.28 | R268: 2.88 | S268: 185.02 | T268: -4.4000000000000004e-002 | U268: 2月12天 | V268: 5.67年 | W268: 3.67年 | X268: 4.0000000000000001e-002 | Y268: 7.400000000000001e-002 | Z268: 9.73 | AA268: 244 | AB268: -7.3899999999999993e-002 | AC268: -7.8100000000000003e-002 | AD268: -0.12 | AE268: -0.122 | AF268: 89.98 | AG268: 90.09 | AH268: 0.96 | AI268: AA | AJ268: 4.5400000000000003e-002 | AK268: =I268+100*T268 -> 172.5 | AL268: 168.8 | AM268: 264 | AN268: 78.7 | AO268: 263 | AP268: 0.10099999999999999 | AQ268: 4 | AR268: 巨星转债
A269: 222 | B269: 联泰转债! | C269: 113526 | D269: 43514. | E269: 联泰环保 | F269: 603797 | G269: 城市公用 | H269: 三废处理 | I269: 154.34 | J269: -7.6999999999999999e-002 | K269: 6.9900000000000004e-002 | L269: 8.5 | M269: -8.199999999999999e-003 | N269: 83 | O269: 0.25900000000000001 | P269: 110.8 | Q269: 6.11 | R269: 1.79 | S269: 139.12 | T269: 0.109 | U269: 转股中 | V269: 4.25年 | W269: 2.25年 | X269: 5.0000000000000003e-002 | Y269: 7.0000000000000007e-002 | Z269: 1.93 | AA269: 38 | AB269: -7.6399999999999996e-002 | AC269: -8.0399999999999985e-002 | AD269: -0.114 | AE269: -0.115 | AF269: 93.41 | AG269: 93 | AH269: 0.87 | AI269: AA | AJ269: 4.2999999999999997e-002 | AK269: =I269+100*T269 -> 165.24000000000001 | AL269: 169.6 | AM269: 265 | AN269: 76.2 | AO269: 259 | AP269: -2.7000000000000003e-002 | AQ269: 8 | AR269: 联泰转债!
A270: 62 | B270: 歌尔转2 | C270: 128112 | D270: 44025. | E270: 歌尔股份 | F270: 2241 | G270: 电子 | H270: 电子产品 | I270: 180 | J270: -1.0700000000000001e-002 | K270: 5.7999999999999996e-003 | L270: 42.34 | M270: -5.1999999999999998e-003 | N270: 685 | O270: 9.3000000000000013e-002 | P270: 114.5 | Q270: 23.27 | R270: 8.5 | S270: 181.95 | T270: -1.1000000000000001e-002 | U270: 55天 | V270: 5.63年 | W270: 3.63年 | X270: 2.8999999999999998e-002 | Y270: 5.2999999999999999e-002 | Z270: 40 | AA270: 1374. | AB270: -7.8100000000000003e-002 | AC270: -8.2100000000000006e-002 | AD270: -0.13100000000000001 | AE270: -0.13300000000000001 | AF270: 87.73 | AG270: 90.45 | AH270: 0.95 | AI270: AA+ | AJ270: 4.3400000000000001e-002 | AK270: =I270+100*T270 -> 178.90000000000001 | AL270: 178 | AM270: 271 | AN270: 87.6 | AO270: 273 | AP270: 2.8999999999999998e-002 | AQ270: 16 | AR270: 歌尔转2
A271: 246 | B271: 万顺转债 | C271: 123012 | D271: 43341. | E271: 万顺新材 | F271: 300057 | G271: 造纸包装 | H271: 包装材料 | I271: 148.8 | J271: -0.14199999999999999 | K271: 0.17199999999999999 | L271: 7.06 | M271: 3.3700000000000001e-002 | N271: 2338. | O271: 10. | P271: 110.3 | Q271: 5.31 | R271: 1.4 | S271: 132.96 | T271: 0.11900000000000001 | U271: 转股中 | V271: 3.74年 | W271: 1.74年 | X271: 2.7000000000000003e-002 | Y271: 3.6000000000000004e-002 | Z271: 1.29 | AA271: 48 | AB271: -7.8200000000000006e-002 | AC271: -8.2699999999999996e-002 | AD271: -0.14599999999999999 | AE271: -0.14699999999999999 | AF271: 91.43 | AG271: 87.87 | AH271: 0.89 | AI271: AA- | AJ271: 6.4000000000000001e-002 | AK271: =I271+100*T271 -> 160.70000000000002 | AL271: 164.6 | AM271: 260 | AN271: 73.2 | AO271: 256 | AP271: 7.8e-002 | AQ271: 17 | AR271: 万顺转债
A272: 174 | B272: 九洲转债! | C272: 123030 | D272: 43720. | E272: 九洲集团 | F272: 300040 | G272: 能源电力 | H272: 电力设备 | I272: 180 | J272: -0.20300000000000001 | K272: 0.18100000000000002 | L272: 8.92 | M272: -2.3e-002 | N272: 1298. | O272: 5.1799999999999997 | P272: 120 | Q272: 5.65 | R272: 1.56 | S272: 157.88 | T272: 0.14000000000000001 | U272: 转股中 | V272: 4.82年 | W272: 2.82年 | X272: 3.4000000000000002e-002 | Y272: 5.4000000000000006e-002 | Z272: 1.15 | AA272: 33 | AB272: -8.1900000000000001e-002 | AC272: -8.8200000000000001e-002 | AD272: -0.109 | AE272: -0.11 | AF272: 86.14 | AG272: 89.49 | AH272: 1 | AI272: AA- | AJ272: 6.4000000000000001e-002 | AK272: =I272+100*T272 -> 194. | AL272: 202.1 | AM272: 278 | AN272: 112.6 | AO272: 279 | AP272: 2.6000000000000002e-002 | AQ272: 29 | AR272: 九洲转债!
A273: 273 | B273: 赣锋转债!! | C273: 128028 | D273: 43119. | E273: 赣锋锂业 | F273: 2460 | G273: 有色金属 | H273: 小金属 | I273: 143.8 | J273: -9.7999999999999997e-003 | K273: 1.03e-002 | L273: 58.24 | M273: 5.0000000000000001e-004 | N273: 226 | O273: 0.16500000000000001 | P273: 109.3 | Q273: 41.68 | R273: 9.36 | S273: 139.73 | T273: 2.8999999999999998e-002 | U273: 转股中 | V273: 3年58天 | W273: 1年58天 | X273: 1.2e-002 | Y273: 1.7000000000000001e-002 | Z273: 9.17 | AA273: 776 | AB273: -8.4399999999999989e-002 | AC273: -8.9200000000000002e-002 | AD273: -0.21199999999999999 | AE273: -0.214 | AF273: 96.55 | AG273: 95.92 | AH273: 1 | AI273: AA | AJ273: 4.2999999999999997e-002 | AK273: =I273+100*T273 -> 146.70000000000002 | AL273: 147.9 | AM273: 230 | AN273: 51.3 | AO273: 190 | AP273: 4.4000000000000004e-002 | AQ273: 13 | AR273: 赣锋转债!!
A274: 158 | B274: 通光转债! | C274: 123034 | D274: 43797. | E274: 通光线缆 | F274: 300265 | G274: 通信互联 | H274: 通信设备 | I274: 184 | J274: -0.13500000000000001 | K274: 0.16 | L274: 13.09 | M274: 2.6699999999999998e-002 | N274: 1693. | O274: 9.9000000000000004 | P274: 118.5 | Q274: 7.97 | R274: 3.95 | S274: 164.24 | T274: 0.12 | U274: 转股中 | V274: 5年11天 | W274: 3年11天 | X274: 1.6e-002 | Y274: 2.7000000000000003e-002 | Z274: 0.78 | AA274: 48 | AB274: -8.5299999999999987e-002 | AC274: -9.0800000000000006e-002 | AD274: -0.10099999999999999 | AE274: -0.10199999999999999 | AF274: 82.23 | AG274: 82.18 | AH274: 0.95 | AI274: A+ | AJ274: 7.7399999999999997e-002 | AK274: =I274+100*T274 -> 196. | AL274: 203.8 | AM274: 281 | AN274: 121.5 | AO274: 281 | AP274: 3.4000000000000002e-002 | AQ274: 25 | AR274: 通光转债!
A275: 286 | B275: 金禾转债!! | C275: 128017 | D275: 43066. | E275: 金禾实业 | F275: 2597 | G275: 化工 | H275: 化工 | I275: 143.201 | J275: -1.66e-002 | K275: 6.4000000000000003e-003 | L275: 31.19 | M275: -1.1399999999999999e-002 | N275: 36 | O275: 4.4000000000000004e-002 | P275: 109.8 | Q275: 22.42 | R275: 3.97 | S275: 139.12 | T275: 2.8999999999999998e-002 | U275: 转股中 | V275: 3年8天 | W275: 1年8天 | X275: 3.2000000000000001e-002 | Y275: 4.4000000000000004e-002 | Z275: 5.54 | AA275: 175 | AB275: -8.5699999999999998e-002 | AC275: -9.0899999999999995e-002 | AD275: -0.23600000000000002 | AE275: -0.23800000000000002 | AF275: 97.6 | AG275: 96.96 | AH275: 0.89 | AI275: AA | AJ275: 4.2999999999999997e-002 | AK275: =I275+100*T275 -> 146.101 | AL275: 147.3 | AM275: 226 | AN275: 49.7 | AO275: 180 | AP275: -6.4000000000000001e-002 | AQ275: 11 | AR275: 金禾转债!!
A276: 220 | B276: 尚荣转债! | C276: 128053 | D276: 43531. | E276: 尚荣医疗 | F276: 2551 | G276: 医药 | H276: 医疗器械 | I276: 168.8 | J276: -0.11900000000000001 | K276: 8.3900000000000002e-002 | L276: 7.3 | M276: -3.5699999999999996e-002 | N276: 799 | O276: 2.25 | P276: 114.9 | Q276: 4.89 | R276: 2.04 | S276: 149.28 | T276: 0.13100000000000001 | U276: 转股中 | V276: 4.31年 | W276: 2.31年 | X276: 3.2000000000000001e-002 | Y276: 4.8000000000000001e-002 | Z276: 1.91 | AA276: 60 | AB276: -8.6899999999999991e-002 | AC276: -9.2200000000000004e-002 | AD276: -0.13 | AE276: -0.13100000000000001 | AF276: 93.27 | AG276: 96.2 | AH276: 1 | AI276: AA | AJ276: 4.2999999999999997e-002 | AK276: =I276+100*T276 -> 181.90000000000001 | AL276: 188.3 | AM276: 276 | AN276: 92.1 | AO276: 275 | AP276: -4.0999999999999995e-002 | AQ276: 27 | AR276: 尚荣转债!
A277: 209 | B277: 长信转债!! | C277: 123022 | D277: 43565. | E277: 长信科技 | F277: 300088 | G277: 通信互联 | H277: 通信设备 | I277: 172.998 | J277: -3.8300000000000001e-002 | K277: 2.3900000000000001e-002 | L277: 10.27 | M277: -1.5300000000000001e-002 | N277: 56 | O277: 0.106 | P277: 114.9 | Q277: 6.15 | R277: 3.64 | S277: 166.99 | T277: 3.6000000000000004e-002 | U277: 转股中 | V277: 4.40年 | W277: 2.40年 | X277: 1.2e-002 | Y277: 2.e-002 | Z277: 2.98 | AA277: 251 | AB277: -9.0399999999999994e-002 | AC277: -9.5600000000000004e-002 | AD277: -0.129 | AE277: -0.13 | AF277: 92.92 | AG277: 95.85 | AH277: 0.94 | AI277: AA | AJ277: 4.2999999999999997e-002 | AK277: =I277+100*T277 -> 176.59799999999998 | AL277: 179 | AM277: 272 | AN277: 83.2 | AO277: 268 | AP277: -1.9e-002 | AQ277: 12 | AR277: 长信转债!!
A278: 257 | B278: 金农转债!! | C278: 128036 | D278: 43192. | E278: 金新农 | F278: 2548 | G278: 农业 | H278: 畜牧业 | I278: 151.009 | J278: -0.115 | K278: 0.10000000000000001 | L278: 8.74 | M278: -1.47e-002 | N278: 941 | O278: 3.7799999999999998 | P278: 110.3 | Q278: 7.39 | R278: 2.49 | S278: 118.27 | T278: 0.27699999999999997 | U278: 转股中 | V278: 3.37年 | W278: 1.37年 | X278: 2.9999999999999999e-002 | Y278: 3.5000000000000003e-002 | Z278: 1.46 | AA278: 49 | AB278: -9.0500000000000011e-002 | AC278: -9.5299999999999996e-002 | AD278: -0.19600000000000001 | AE278: -0.19800000000000001 | AF278: 93.52 | AG278: 89.88 | AH278: 1 | AI278: AA- | AJ278: 6.4000000000000001e-002 | AK278: =I278+100*T278 -> 178.70899999999997 | AL278: 183.8 | AM278: 274 | AN278: 90.2 | AO278: 274 | AP278: -1.2e-002 | AQ278: 15 | AR278: 金农转债!!
A279: 76 | B279: 福莱转债 | C279: 113035 | D279: 43999. | E279: 福莱特 | F279: 601865 | G279: 能源电力 | H279: 太阳能 | I279: 209.92 | J279: -2.87e-002 | K279: 1.9e-002 | L279: 33 | M279: -9.8999999999999991e-003 | N279: 368 | O279: 0.11800000000000001 | P279: 120.3 | Q279: 13.56 | R279: 12.91 | S279: 243.36 | T279: -0.13699999999999998 | U279: 40天 | V279: 5.59年 | W279: 3.59年 | X279: 2.2000000000000002e-002 | Y279: 5.5e-002 | Z279: 14.5 | AA279: 645 | AB279: -9.6199999999999994e-002 | AC279: -0.10199999999999999 | AD279: -0.16300000000000001 | AE279: -0.16399999999999998 | AF279: 88 | AG279: 94.3 | AH279: 0.98 | AI279: AA | AJ279: 4.5400000000000003e-002 | AK279: =I279+100*T279 -> 196.22 | AL279: 176.5 | AM279: 269 | AN279: 82.2 | AO279: 266 | AP279: 7.0000000000000007e-002 | AQ279: 6 | AR279: 福莱转债
A280: 128 | B280: 银河转债! | C280: 123042 | D280: 43875. | E280: 金银河 | F280: 300619 | G280: 机械装备 | H280: 专用设备 | I280: 199 | J280: -3.8599999999999995e-002 | K280: 3.8e-003 | L280: 25.71 | M280: -4.53e-002 | N280: 20079. | O280: 37.689999999999998 | P280: 115.9 | Q280: 24.4 | R280: 4.05 | S280: 105.37 | T280: 0.88900000000000001 | U280: 转股中 | V280: 5.22年 | W280: 3.22年 | X280: 8.6999999999999994e-002 | Y280: 9.1999999999999998e-002 | Z280: 1.67 | AA280: 19 | AB280: -0.10000000000000001 | AC280: -0.105 | AD280: -0.10199999999999999 | AE280: -0.10300000000000001 | AF280: 81.25 | AG280: 79.29 | AH280: 0.77 | AI280: A+ | AJ280: 7.7399999999999997e-002 | AK280: =I280+100*T280 -> 287.89999999999998 | AL280: 292.6 | AM280: 287 | AN280: 211.4 | AO280: 289 | AP280: 7.0999999999999994e-002 | AQ280: 24 | AR280: 银河转债!
A281: 67 | B281: 上机转债 | C281: 113586 | D281: 44019. | E281: 上机数控 | F281: 603185 | G281: 机械装备 | H281: 专用设备 | I281: 220.35 | J281: -3.3500000000000002e-002 | K281: -7.6e-003 | L281: 79.66 | M281: -4.2099999999999999e-002 | N281: 157 | O281: 0.10199999999999999 | P281: 120.8 | Q281: 33.3 | R281: 10.2 | S281: 239.22 | T281: -7.9000000000000001e-002 | U281: 52天 | V281: 5.62年 | W281: 3.62年 | X281: 3.6000000000000004e-002 | Y281: 8.5999999999999993e-002 | Z281: 6.65 | AA281: 185 | AB281: -0.10300000000000001 | AC281: -0.10800000000000001 | AD281: -0.17000000000000001 | AE281: -0.17100000000000001 | AF281: 81.85 | AG281: 84.81 | AH281: 0.98 | AI281: AA- | AJ281: 6.6400000000000001e-002 | AK281: =I281+100*T281 -> 212.44999999999999 | AL281: 201.5 | AM281: 277 | AN281: 116.7 | AO281: 280 | AP281: 0. | AQ281: 8 | AR281: 上机转债
A282: 243 | B282: 凯发转债! | C282: 123014 | D282: 43333. | E282: 凯发电气 | F282: 300407 | G282: 能源电力 | H282: 电力设备 | I282: 150.199 | J282: -0.14699999999999999 | K282: 0.17600000000000002 | L282: 9.97 | M282: 3.4200000000000001e-002 | N282: 2003. | O282: 9.4299999999999997 | P282: 108.5 | Q282: 8.12 | R282: 2.31 | S282: 122.78 | T282: 0.223 | U282: 转股中 | V282: 2.76年 | W282: 0.76年 | X282: 3.7999999999999999e-002 | Y282: 4.7e-002 | Z282: 1.16 | AA282: 30 | AB282: -0.11199999999999999 | AC282: -0.11699999999999999 | AD282: -0.35600000000000004 | AE282: -0.35799999999999998 | AF282: 94.76 | AG282: 89.2 | AH282: 0.87 | AI282: A+ | AJ282: 7.46e-002 | AK282: =I282+100*T282 -> 172.49900000000002 | AL282: 177.6 | AM282: 270 | AN282: 82.9 | AO282: 267 | AP282: 9.8000000000000004e-002 | AQ282: 15 | AR282: 凯发转债!
A283: 78 | B283: 龙蟠转债 | C283: 113581 | D283: 43970. | E283: 龙蟠科技 | F283: 603906 | G283: 化工 | H283: 化工 | I283: 246.69 | J283: 5.0000000000000001e-004 | K283: -2.6000000000000002e-002 | L283: 24.36 | M283: -2.64e-002 | N283: 241 | O283: 0.23899999999999999 | P283: 129.6 | Q283: 9.48 | R283: 5.23 | S283: 256.96 | T283: -4.0000000000000001e-002 | U283: 5.1天 | V283: 5.50年 | W283: 3.50年 | X283: 5.4000000000000006e-002 | Y283: 0.13900000000000001 | Z283: 4 | AA283: 74 | AB283: -0.113 | AC283: -0.12 | AD283: -0.109 | AE283: -0.11 | AF283: 81.53 | AG283: 87.15 | AH283: 0.97 | AI283: A+ | AJ283: 7.7399999999999997e-002 | AK283: =I283+100*T283 -> 242.69 | AL283: 236.4 | AM283: 286 | AN283: 149.3 | AO283: 285 | AP283: -7.2000000000000008e-002 | AQ283: 15 | AR283: 龙蟠转债
A284: 235 | B284: 科森转债!! | C284: 113521 | D284: 43441. | E284: 科森科技 | F284: 603626 | G284: 通信互联 | H284: 通信设备 | I284: 194.31 | J284: -0.151 | K284: 0.14800000000000002 | L284: 16.18 | M284: -2.5000000000000001e-003 | N284: 453 | O284: 3.25 | P284: 115.2 | Q284: 8.7 | R284: 3.59 | S284: 185.98 | T284: 4.4999999999999998e-002 | U284: 转股中 | V284: 4年23天 | W284: 2年23天 | X284: 8.0000000000000002e-003 | Y284: 1.4999999999999999e-002 | Z284: 0.63 | AA284: 78 | AB284: -0.12300000000000001 | AC284: -0.128 | AD284: -0.182 | AE284: -0.183 | AF284: 94.37 | AG284: 97.48 | AH284: 0.95 | AI284: AA | AJ284: 4.2999999999999997e-002 | AK284: =I284+100*T284 -> 198.81 | AL284: 202.6 | AM284: 279 | AN284: 105.2 | AO284: 278 | AP284: -1.4999999999999999e-002 | AQ284: 25 | AR284: 科森转债!!
A285: 181 | B285: 智能转债! | C285: 128070 | D285: 43669. | E285: 智能自控 | F285: 2877 | G285: 机械装备 | H285: 通用设备 | I285: 215 | J285: 0.48299999999999998 | K285: -0.496 | L285: 7.82 | M285: -2.6200000000000001e-002 | N285: 29735. | O285: 44.640000000000001 | P285: 117.6 | Q285: 9.51 | R285: 3.71 | S285: 82.23 | T285: 1.6100000000000001 | U285: 转股中 | V285: 4.69年 | W285: 无权 | X285: 8.8000000000000009e-002 | Y285: 7.2999999999999995e-002 | Z285: 2.3 | AA285: 26 | AB285: -0.12300000000000001 | AC285: -0.128 | AD285: 无权 | AE285: 无权 | AF285: 无权 | AG285: 84.45 | AH285: 0.5 | AI285: A+ | AJ285: 7.4999999999999997e-002 | AK285: =I285+100*T285 -> 376. | AL285: 347.8 | AM285: 292 | AN285: 263.3 | AO285: 293 | AP285: -3.3000000000000002e-002 | AQ285: 33 | AR285: 智能转债!
A286: 169 | B286: 万里转债! | C286: 123032 | D286: 43769. | E286: 万里马 | F286: 300591 | G286: 服装纺织 | H286: 服装纺织 | I286: 279.18 | J286: -0.26700000000000002 | K286: 0.14899999999999999 | L286: 11.36 | M286: -0.13 | N286: 5482. | O286: 21.059999999999999 | P286: 132 | Q286: 6.89 | R286: 7.83 | S286: 164.88 | T286: 0.69299999999999995 | U286: 转股中 | V286: 4.96年 | W286: 2.96年 | X286: 1.7000000000000001e-002 | Y286: 2.7999999999999997e-002 | Z286: 0.63 | AA286: 37 | AB286: -0.14400000000000002 | AC286: -0.152 | AD286: -0.152 | AE286: -0.153 | AF286: 85.76 | AG286: 93.36 | AH286: 0.91 | AI286: A+ | AJ286: 7.4999999999999997e-002 | AK286: =I286+100*T286 -> 348.48000000000002 | AL286: 393.5 | AM286: 294 | AN286: 300.1 | AO286: 295 | AP286: 0.152 | AQ286: 42 | AR286: 万里转债!
A287: 172 | B287: 晶瑞转债! | C287: 123031 | D287: 43734. | E287: 晶瑞股份 | F287: 300655 | G287: 化工 | H287: 化工 | I287: 246 | J287: -0.156 | K287: 0.10400000000000001 | L287: 36.84 | M287: -5.3899999999999997e-002 | N287: 815 | O287: 4.5999999999999996 | P287: 115.8 | Q287: 18.53 | R287: 5.56 | S287: 198.81 | T287: 0.23699999999999999 | U287: 转股中 | V287: 4.85年 | W287: 2.85年 | X287: 9.0000000000000011e-003 | Y287: 1.8000000000000002e-002 | Z287: 0.63 | AA287: 70 | AB287: -0.14599999999999999 | AC287: -0.14999999999999999 | AD287: -0.14999999999999999 | AE287: -0.151 | AF287: 83.22 | AG287: 82.09 | AH287: 0.97 | AI287: A+ | AJ287: 7.4999999999999997e-002 | AK287: =I287+100*T287 -> 269.69999999999999 | AL287: 293.2 | AM287: 288 | AN287: 210 | AO287: 288 | AP287: -7.6999999999999999e-002 | AQ287: 15 | AR287: 晶瑞转债!
A288: 272 | B288: 太阳转债!! | C288: 128029 | D288: 43116. | E288: 太阳纸业 | F288: 2078 | G288: 造纸包装 | H288: 造纸行业 | I288: 153 | J288: -4.3799999999999999e-002 | K288: 1.7500000000000002e-002 | L288: 12.98 | M288: -2.63e-002 | N288: 12 | O288: 6.9999999999999993e-003 | P288: 107.8 | Q288: 8.55 | R288: 2.19 | S288: 151.81 | T288: 8.0000000000000002e-003 | U288: 转股中 | V288: 2年59天 | W288: 59天 | X288: 3.3000000000000002e-002 | Y288: 5.0000000000000003e-002 | Z288: 11 | AA288: 338 | AB288: -0.151 | AC288: -0.156 | AD288: -1.109 | AE288: -1.113 | AF288: 99.66 | AG288: 99.01 | AH288: 1 | AI288: AA+ | AJ288: 4.0599999999999997e-002 | AK288: =I288+100*T288 -> 153.80000000000001 | AL288: 154.2 | AM288: 246 | AN288: 54.5 | AO288: 210 | AP288: -4.8000000000000001e-002 | AQ288: 8 | AR288: 太阳转债!!
A289: 271 | B289: 天康转债!! | C289: 128030 | D289: 43129. | E289: 天康生物 | F289: 2100 | G289: 农业 | H289: 畜牧业 | I289: 190 | J289: -7.1399999999999991e-002 | K289: 4.3400000000000001e-002 | L289: 13.92 | M289: -2.7900000000000001e-002 | N289: 451 | O289: 2.1400000000000001 | P289: 112.3 | Q289: 7.85 | R289: 2.83 | S289: 177.32 | T289: 7.0999999999999994e-002 | U289: 转股中 | V289: 3年59天 | W289: 1年59天 | X289: 6.9999999999999993e-003 | Y289: 1.2e-002 | Z289: 0.98 | AA289: 150 | AB289: -0.156 | AC289: -0.161 | AD289: -0.33500000000000002 | AE289: -0.33700000000000002 | AF289: 97.27 | AG289: 98.6 | AH289: 1 | AI289: AA | AJ289: 4.2999999999999997e-002 | AK289: =I289+100*T289 -> 197.09999999999999 | AL289: 202.7 | AM289: 280 | AN289: 104.1 | AO289: 277 | AP289: -5.2000000000000005e-002 | AQ289: 10 | AR289: 天康转债!!
A290: 237 | B290: 百合转债! | C290: 113520 | D290: 43430. | E290: 梦百合 | F290: 603313 | G290: 其他 | H290: 家居用品 | I290: 225.94 | J290: -0.10300000000000001 | K290: 8.4499999999999992e-002 | L290: 31.31 | M290: -1.8500000000000003e-002 | N290: 307 | O290: 2.1000000000000001 | P290: 115.2 | Q290: 14.28 | R290: 4.15 | S290: 219.26 | T290: 2.9999999999999999e-002 | U290: 转股中 | V290: 4年15天 | W290: 2年15天 | X290: 6.0000000000000001e-003 | Y290: 1.2e-002 | Z290: 0.61 | AA290: 108 | AB290: -0.156 | AC290: -0.161 | AD290: -0.214 | AE290: -0.215 | AF290: 90.45 | AG290: 90.21 | AH290: 0.98 | AI290: AA- | AJ290: 6.4000000000000001e-002 | AK290: =I290+100*T290 -> 228.94 | AL290: 232.6 | AM290: 284 | AN290: 142.2 | AO290: 284 | AP290: 7.0000000000000007e-002 | AQ290: 12 | AR290: 百合转债!
A291: 224 | B291: 溢利转债! | C291: 123018 | D291: 43488. | E291: 溢多利 | F291: 300381 | G291: 医药 | H291: 原料药 | I291: 235 | J291: -0.11800000000000001 | K291: 0.10099999999999999 | L291: 13.79 | M291: -1.8500000000000003e-002 | N291: 276 | O291: 1.95 | P291: 114.9 | Q291: 8.29 | R291: 2.39 | S291: 166.34 | T291: 0.41299999999999998 | U291: 转股中 | V291: 4年57天 | W291: 2年57天 | X291: 8.0000000000000002e-003 | Y291: 1.3999999999999999e-002 | Z291: 0.54 | AA291: 66 | AB291: -0.161 | AC291: -0.16500000000000001 | AD291: -0.20800000000000002 | AE291: -0.20800000000000002 | AF291: 89.68 | AG291: 89.3 | AH291: 0.95 | AI291: AA- | AJ291: 6.4000000000000001e-002 | AK291: =I291+100*T291 -> 276.30000000000001 | AL291: 303.7 | AM291: 290 | AN291: 214 | AO291: 290 | AP291: -1.7000000000000001e-002 | AQ291: 13 | AR291: 溢利转债!
A292: 255 | B292: 新泉转债!! | C292: 113509 | D292: 43273. | E292: 新泉股份 | F292: 603179 | G292: 汽车 | H292: 零部件制 | I292: 224.14 | J292: -3.6799999999999999e-002 | K292: 3.8599999999999995e-002 | L292: 32.24 | M292: 1.9e-003 | N292: 123 | O292: 0.41100000000000003 | P292: 110.3 | Q292: 14.22 | R292: 5.19 | S292: 226.72 | T292: -1.1000000000000001e-002 | U292: 转股中 | V292: 3.61年 | W292: 1.61年 | X292: 1.3000000000000001e-002 | Y292: 2.8999999999999998e-002 | Z292: 1.29 | AA292: 102 | AB292: -0.18100000000000002 | AC292: -0.185 | AD292: -0.28000000000000003 | AE292: -0.28100000000000003 | AF292: 95.44 | AG292: 95.03 | AH292: 0.98 | AI292: AA | AJ292: 4.2999999999999997e-002 | AK292: =I292+100*T292 -> 223.03999999999999 | AL292: 221.6 | AM292: 282 | AN292: 126.1 | AO292: 282 | AP292: -6.0000000000000001e-003 | AQ292: 11 | AR292: 新泉转债!!
A293: 290 | B293: 模塑转债!! | C293: 127004 | D293: 42963. | E293: 模塑科技 | F293: 700 | G293: 汽车 | H293: 零部件制 | I293: 190.3 | J293: -0.14300000000000002 | K293: 0.14400000000000002 | L293: 6.23 | M293: 4.7999999999999996e-003 | N293: 1442. | O293: 4.9900000000000002 | P293: 113.3 | Q293: 7.46 | R293: 2.14 | S293: 83.51 | T293: 1.28 | U293: 转股中 | V293: 2.61年 | W293: 0.61年 | X293: 2.3e-002 | Y293: 1.9e-002 | Z293: 1.33 | AA293: 57 | AB293: -0.183 | AC293: -0.19 | AD293: -0.61699999999999999 | AE293: -0.62 | AF293: 98.58 | AG293: 101.78 | AH293: 0.28 | AI293: AA | AJ293: 4.2599999999999999e-002 | AK293: =I293+100*T293 -> 318.30000000000001 | AL293: 297.1 | AM293: 289 | AN293: 195.3 | AO293: 287 | AP293: -2.1000000000000001e-002 | AQ293: 37 | AR293: 模塑转债!!
A294: 115 | B294: 正元转债 | C294: 123043 | D294: 43921. | E294: 正元智慧 | F294: 300645 | G294: 计算机及 | H294: 软件开发 | I294: 353.805 | J294: 0. | K294: 0. | L294: 20.15 | M294: 0. | N294: 0 | O294: 0. | P294: 121.4 | Q294: 15.41 | R294: 4.2 | S294: 130.76 | T294: 1.71 | U294: 转股中 | V294: 5.36年 | W294: 3.36年 | X294: 6.5000000000000002e-002 | Y294: 8.5000000000000006e-002 | Z294: 1.66 | AA294: 26 | AB294: -0.184 | AC294: -0.18899999999999997 | AD294: -0.14599999999999999 | AE294: -0.14699999999999999 | AF294: 80.66 | AG294: 82.21 | AH294: 0.89 | AI294: A+ | AJ294: 7.7399999999999997e-002 | AK294: =I294+100*T294 -> 524.80500000000006 | AL294: 576.9 | AM294: 299 | AN294: 494.6 | AO294: 299 | AP294: 0.106 | AQ294: 17 | AR294: 正元转债
A295: 248 | B295: 盛路转债!! | C295: 128041 | D295: 43326. | E295: 盛路通信 | F295: 2446 | G295: 通信互联 | H295: 通信设备 | I295: 248.9 | J295: -0.161 | K295: 0.161 | L295: 7.14 | M295: -1.9199999999999998e-002 | N295: 1037. | O295: 7.0599999999999996 | P295: 114.3 | Q295: 6.85 | R295: 2.26 | S295: 104.23 | T295: 1.3899999999999999 | U295: 转股中 | V295: 3.73年 | W295: 1.73年 | X295: 8.0000000000000002e-003 | Y295: 9.0000000000000011e-003 | Z295: 0.53 | AA295: 64 | AB295: -0.191 | AC295: -0.19600000000000001 | AD295: -0.28100000000000003 | AE295: -0.28199999999999997 | AF295: 94.97 | AG295: 97.98 | AH295: 0 | AI295: AA | AJ295: 4.2999999999999997e-002 | AK295: =I295+100*T295 -> 387.89999999999998 | AL295: 393.6 | AM295: 295 | AN295: 295.6 | AO295: 294 | AP295: -6.5000000000000002e-002 | AQ295: 12 | AR295: 盛路转债!!
A296: 223 | B296: 凯龙转债! | C296: 128052 | D296: 43486. | E296: 凯龙股份 | F296: 2783 | G296: 化工 | H296: 化工 | I296: 277 | J296: -0.14800000000000002 | K296: 0.152 | L296: 13.53 | M296: 4.5000000000000005e-003 | N296: 549 | O296: 5.5999999999999996 | P296: 115 | Q296: 6.67 | R296: 2.98 | S296: 202.85 | T296: 0.36599999999999999 | U296: 转股中 | V296: 4年58天 | W296: 2年58天 | X296: 6.0000000000000001e-003 | Y296: 1.3000000000000001e-002 | Z296: 0.32 | AA296: 51 | AB296: -0.193 | AC296: -0.19800000000000001 | AD296: -0.23199999999999998 | AE296: -0.23300000000000001 | AF296: 93.96 | AG296: 96.91 | AH296: 1 | AI296: AA | AJ296: 4.2999999999999997e-002 | AK296: =I296+100*T296 -> 313.60000000000002 | AL296: 351.2 | AM296: 293 | AN296: 254.2 | AO296: 292 | AP296: 4.0999999999999995e-002 | AQ296: 12 | AR296: 凯龙转债!
A297: 252 | B297: 广电转债!! | C297: 110044 | D297: 43305. | E297: 广电网络 | F297: 600831 | G297: 传媒娱乐 | H297: 影视娱乐 | I297: 266.48 | J297: -0.158 | K297: 0.14599999999999999 | L297: 7.42 | M297: -1.8500000000000003e-002 | N297: 697 | O297: 3.25 | P297: 112.3 | Q297: 6.9 | R297: 1.43 | S297: 107.54 | T297: 1.48 | U297: 转股中 | V297: 3.67年 | W297: 1.67年 | X297: 1.3000000000000001e-002 | Y297: 1.3999999999999999e-002 | Z297: 0.71 | AA297: 53 | AB297: -0.21199999999999999 | AC297: -0.217 | AD297: -0.30499999999999999 | AE297: -0.30599999999999999 | AF297: 95.19 | AG297: 96.49 | AH297: 0.65 | AI297: AA | AJ297: 4.2999999999999997e-002 | AK297: =I297+100*T297 -> 414.48000000000002 | AL297: 425.4 | AM297: 296 | AN297: 328.9 | AO297: 296 | AP297: -2.6000000000000002e-002 | AQ297: 11 | AR297: 广电转债!!
A298: 241 | B298: 蓝盾转债!! | C298: 123015 | D298: 43356. | E298: 蓝盾股份 | F298: 300297 | G298: 计算机及 | H298: 软件开发 | I298: 306 | J298: -0.151 | K298: 0.161 | L298: 7.88 | M298: 1.03e-002 | N298: 8879. | O298: 22.829999999999998 | P298: 112.3 | Q298: 5.79 | R298: 2.62 | S298: 136.1 | T298: 1.25 | U298: 转股中 | V298: 3.80年 | W298: 1.80年 | X298: 1.e-002 | Y298: 1.3999999999999999e-002 | Z298: 1 | AA298: 98 | AB298: -0.23399999999999999 | AC298: -0.23800000000000002 | AD298: -0.30399999999999999 | AE298: -0.30399999999999999 | AF298: 94.68 | AG298: 95.97 | AH298: 1 | AI298: AA | AJ298: 4.2999999999999997e-002 | AK298: =I298+100*T298 -> 431. | AL298: 475.9 | AM298: 297 | AN298: 379.9 | AO298: 297 | AP298: 0.39500000000000002 | AQ298: 19 | AR298: 蓝盾转债!!
A299: 142 | B299: 振德转债! | C299: 113555 | D299: 43844. | E299: 振德医疗 | F299: 603301 | G299: 医药 | H299: 医疗器械 | I299: 495.2 | J299: -2.8300000000000002e-002 | K299: 5.6000000000000008e-003 | L299: 69.43 | M299: -2.29e-002 | N299: 264 | O299: 0.307 | P299: 124.8 | Q299: 14.01 | R299: 6.24 | S299: 495.57 | T299: -1.e-003 | U299: 转股中 | V299: 5年56天 | W299: 3年56天 | X299: 1.1000000000000001e-002 | Y299: 5.7000000000000002e-002 | Z299: 1.69 | AA299: 147 | AB299: -0.23800000000000002 | AC299: -0.24299999999999999 | AD299: -0.18100000000000002 | AE299: -0.18100000000000002 | AF299: 84.87 | AG299: 90.37 | AH299: 0.99 | AI299: AA- | AJ299: 6.6400000000000001e-002 | AK299: =I299+100*T299 -> 495.09999999999997 | AL299: 494.8 | AM299: 298 | AN299: 404.5 | AO299: 298 | AP299: -1.1000000000000001e-002 | AQ299: 15 | AR299: 振德转债!
A300: 234 | B300: 特发转债! | C300: 127008 | D300: 43459. | E300: 特发信息 | F300: 70 | G300: 通信互联 | H300: 通信设备 | I300: 263.99 | J300: -0.126 | K300: 0.115 | L300: 10.03 | M300: -1.0800000000000001e-002 | N300: 465 | O300: 2.71 | P300: 111.1 | Q300: 5.54 | R300: 2.91 | S300: 181.05 | T300: 0.45799999999999996 | U300: 转股中 | V300: 3年23天 | W300: 1年23天 | X300: 6.9999999999999993e-003 | Y300: 1.3000000000000001e-002 | Z300: 0.59 | AA300: 82 | AB300: -0.249 | AC300: -0.253 | AD300: -0.48899999999999999 | AE300: -0.48999999999999999 | AF300: 96.75 | AG300: 97.86 | AH300: 1 | AI300: AA | AJ300: 4.2999999999999997e-002 | AK300: =I300+100*T300 -> 309.79000000000002 | AL300: 346.9 | AM300: 291 | AN300: 249.1 | AO300: 291 | AP300: -1.4999999999999999e-002 | AQ300: 15 | AR300: 特发转债!
A301: 245 | B301: 横河转债! | C301: 123013 | D301: 43332. | E301: 横河模具 | F301: 300539 | G301: 机械装备 | H301: 专用设备 | I301: 370 | J301: -0.156 | K301: 0.127 | L301: 10.03 | M301: -3.8399999999999997e-002 | N301: 1418. | O301: 8.7799999999999994 | P301: 115.2 | Q301: 9.13 | R301: 4.55 | S301: 109.86 | T301: 2.3700000000000001 | U301: 转股中 | V301: 3.75年 | W301: 1.75年 | X301: 1.7000000000000001e-002 | Y301: 1.9e-002 | Z301: 0.38 | AA301: 22 | AB301: -0.27100000000000002 | AC301: -0.27500000000000002 | AD301: -0.34000000000000002 | AE301: -0.34100000000000003 | AF301: 90.07 | AG301: 88.36 | AH301: 0.77 | AI301: A+ | AJ301: 7.4999999999999997e-002 | AK301: =I301+100*T301 -> 607. | AL301: 630.1 | AM301: 300 | AN301: 540.1 | AO301: 300 | AP301: 6.0999999999999999e-002 | AQ301: 15 | AR301: 横河转债!
A302: 176 | B302: 英科转债! | C302: 123029 | D302: 43718. | E302: 英科医疗 | F302: 300677 | G302: 医药 | H302: 医疗器械 | I302: 990.02 | J302: -6.6e-003 | K302: 3.0999999999999999e-003 | L302: 101.98 | M302: -3.4999999999999996e-003 | N302: 399 | O302: 0.28999999999999998 | P302: 138.2 | Q302: 10.41 | R302: 6.16 | S302: 979.63 | T302: 1.1000000000000001e-002 | U302: 转股中 | V302: 4.81年 | W302: 2.81年 | X302: 4.0000000000000001e-003 | Y302: 3.9e-002 | Z302: 1.37 | AA302: 340 | AB302: -0.34100000000000003 | AC302: -0.34799999999999998 | AD302: -0.23999999999999999 | AE302: -0.23999999999999999 | AF302: 89.47 | AG302: 103.57 | AH302: 0.99 | AI302: AA- | AJ302: 6.4000000000000001e-002 | AK302: =I302+100*T302 -> 991.12 | AL302: 1000.4 | AM302: 301 | AN302: 896.8 | AO302: 301 | AP302: -0.20999999999999999 | AQ302: 15 | AR302: 英科转债!