A1: 序号 | B1: 转债名称 | C1: 转债代码 | D1: 进展/上市日期 | E1: 股票名称 | F1: 股票代码 | G1: 行业 | H1: 子行业 | I1: 转债价格 | J1: 涨跌 | K1: 日内套利 | L1: 股价 | M1: 涨跌 | N1: 转债成交额 | O1: 转债换手率 | P1: 剩余本息 | Q1: 转股价格 | R1: P/B | S1: 转股价值 | T1: 转股溢价率 | U1: 距离转股日 | V1: 剩余年限 | W1: 回售年限 | X1: 余额/市值 | Y1: 余额/股本 | Z1: 转债余额 | AA1: 股票市值 | AB1: 税前收益率 | AC1: 税后收益率 | AD1: 税前回售收益 | AE1: 税后回售收益 | AF1: 回售价值 | AG1: 纯债价值 | AH1: 弹性 | AI1: 信用 | AJ1: 折现率 | AK1: 双低 | AL1: 老式双低 | AM1: 老式排名 | AN1: 新式双低 | AO1: 新式排名 | AP1: MA20乖离 | AQ1: 热门度 | AR1: 转债名称
A2: 202 | B2: 亚药转债! | C2: 128062 | D2: 43579. | E2: 亚太药业 | F2: 2370 | G2: 医药 | H2: 化学制药 | I2: 78.998 | J2: 1.2999999999999999e-003 | K2: -1.2999999999999999e-003 | L2: 4.95 | M2: -1.7899999999999999e-002 | N2: 2.7 | O2: 3.0000000000000001e-003 | P2: 119.8 | Q2: 16.25 | R2: 7.09 | S2: 30.46 | T2: 1.5900000000000001 | U2: 转股中 | V2: 4.45年 | W2: 2.45年 | X2: 0.36299999999999999 | Y2: 0.111 | Z2: 9.6 | AA2: 27 | AB2: 0.10000000000000001 | AC2: 9.1300000000000006e-002 | AD2: 0.109 | AE2: 0.106 | AF2: 81.33 | AG2: 80.12 | AH2: 0 | AI2: A- | AJ2: 9.6600000000000005e-002 | AK2: =I2+100*T2 -> 237.99799999999999 | AL2: 127.5 | AM2: 74 | AN2: 46.2 | AO2: 177 | AP2: -9.8000000000000004e-002 | AQ2: 85 | AR2: 亚药转债!
A3: 222 | B3: 维格转债! | C3: 113527 | D3: 43515. | E3: 锦泓集团 | F3: 603518 | G3: 服装纺织 | H3: 服装行业 | I3: 93.44 | J3: 9.1000000000000004e-003 | K3: -6.8000000000000005e-003 | L3: 6.8 | M3: 1.1899999999999999e-002 | N3: 6.5 | O3: 9.0000000000000011e-003 | P3: 120.2 | Q3: 9.85 | R3: 0.69 | S3: 69.04 | T3: 0.35399999999999998 | U3: 转股中 | V3: 4.27年 | W3: 2.27年 | X3: 0.435 | Y3: 0.29999999999999999 | Z3: 7.5 | AA3: 17 | AB3: 6.2199999999999998e-002 | AC3: 5.33e-002 | AD3: 4.36e-002 | AE3: 4.0500000000000001e-002 | AF3: 91.12 | AG3: 96.29 | AH3: 0.19 | AI3: AA | AJ3: 5.4600000000000003e-002 | AK3: =I3+100*T3 -> 128.84 | AL3: 117.8 | AM3: 4 | AN3: 21.6 | AO3: 4 | AP3: 9.0000000000000011e-003 | AQ3: 100 | AR3: 维格转债!
A4: 52 | B4: 本钢转债! | C4: 127018 | D4: 44047. | E4: 本钢板材 | F4: 761 | G4: 钢铁 | H4: 炼钢 | I4: 96.5 | J4: 1.7000000000000001e-003 | K4: 8.9999999999999998e-004 | L4: 3.48 | M4: 1.46e-002 | N4: 23 | O4: 4.0000000000000001e-003 | P4: 128.6 | Q4: 5.03 | R4: 0.68 | S4: 69.18 | T4: 0.39500000000000002 | U4: 2月17天 | V4: 5.69年 | W4: 3.69年 | X4: 0.504 | Y4: 0.34899999999999998 | Z4: 68 | AA4: 135 | AB4: 5.33e-002 | AC4: 4.4500000000000005e-002 | AD4: 2.6099999999999998e-002 | AE4: 2.2700000000000001e-002 | AF4: 91.41 | AG4: 103.09 | AH4: 0.18 | AI4: AAA | AJ4: 4.0800000000000003e-002 | AK4: =I4+100*T4 -> 136. | AL4: 123.8 | AM4: 40 | AN4: 20.7 | AO4: 3 | AP4: 1.1000000000000001e-002 | AQ4: 29 | AR4: 本钢转债!
A5: 279 | B5: 亚太转债! | C5: 128023 | D5: 43095. | E5: 亚太股份 | F5: 2284 | G5: 汽车 | H5: 零部件制 | I5: 97.016 | J5: 1.e-004 | K5: -2.9999999999999997e-004 | L5: 5.19 | M5: -2.0799999999999999e-002 | N5: 1 | O5: 1.e-003 | P5: 112.3 | Q5: 10.34 | R5: 1.58 | S5: 50.19 | T5: 0.93299999999999994 | U5: 转股中 | V5: 3年46天 | W5: 1年46天 | X5: 0.26100000000000001 | Y5: 0.13100000000000001 | Z5: 10 | AA5: 38 | AB5: 4.9100000000000005e-002 | AC5: 4.1299999999999996e-002 | AD5: 4.6300000000000001e-002 | AE5: 4.1799999999999997e-002 | AF5: 97.22 | AG5: 98.29 | AH5: 0.01 | AI5: AA | AJ5: 4.4600000000000001e-002 | AK5: =I5+100*T5 -> 190.316 | AL5: 143.8 | AM5: 220 | AN5: 45.5 | AO5: 171 | AP5: 1.7000000000000001e-002 | AQ5: 63 | AR5: 亚太转债!
A6: 260 | B6: 岩土转债! | C6: 128037 | D6: 43215. | E6: 中化岩土 | F6: 2542 | G6: 建筑 | H6: 建筑工程 | I6: 98.433 | J6: 7.000000000000001e-004 | K6: -7.000000000000001e-004 | L6: 3.5 | M6: 5.6999999999999993e-003 | N6: 1.7 | O6: 3.0000000000000001e-003 | P6: 112.3 | Q6: 7.99 | R6: 1.58 | S6: 43.8 | T6: 1.25 | U6: 转股中 | V6: 3.40年 | W6: 1.40年 | X6: 9.5000000000000001e-002 | Y6: 4.2000000000000003e-002 | Z6: 6 | AA6: 63 | AB6: 4.0300000000000002e-002 | AC6: 3.3300000000000003e-002 | AD6: 2.8300000000000002e-002 | AE6: 2.46e-002 | AF6: 96.05 | AG6: 97.1 | AH6: 0 | AI6: AA | AJ6: 4.4600000000000001e-002 | AK6: =I6+100*T6 -> 223.43299999999999 | AL6: 153.1 | AM6: 255 | AN6: 56 | AO6: 228 | AP6: -1.7000000000000001e-002 | AQ6: 46 | AR6: 岩土转债!
A7: 83 | B7: 纵横转债! | C7: 113573 | D7: 43973. | E7: 纵横通信 | F7: 603602 | G7: 通信互联 | H7: 通信设备 | I7: 100.88 | J7: 1.7000000000000001e-003 | K7: -7.000000000000001e-004 | L7: 12.87 | M7: 3.0999999999999999e-003 | N7: 5.1 | O7: 1.9e-002 | P7: 124.7 | Q7: 18.81 | R7: 3.89 | S7: 68.42 | T7: 0.47399999999999998 | U7: 4.0天 | V7: 5.49年 | W7: 3.49年 | X7: 0.10300000000000001 | Y7: 7.0000000000000007e-002 | Z7: 2.7 | AA7: 26 | AB7: 4.0300000000000002e-002 | AC7: 3.2300000000000002e-002 | AD7: 1.01e-002 | AE7: 7.6e-003 | AF7: 79.81 | AG7: 83.44 | AH7: 0.32 | AI7: A+ | AJ7: 7.7800000000000008e-002 | AK7: =I7+100*T7 -> 148.28 | AL7: 133.3 | AM7: 132 | AN7: 49.9 | AO7: 197 | AP7: -1.e-002 | AQ7: 14 | AR7: 纵横转债!
A8: 200 | B8: 未来转债 | C8: 128063 | D8: 43579. | E8: 德尔未来 | F8: 2631 | G8: 其他 | H8: 家居用品 | I8: 109.399 | J8: -2.8000000000000004e-003 | K8: 1.8e-003 | L8: 7.13 | M8: -2.8000000000000004e-003 | N8: 0.6 | O8: 1.e-003 | P8: 128.2 | Q8: 8.61 | R8: 2.71 | S8: 82.81 | T8: 0.32100000000000001 | U8: 转股中 | V8: 4.45年 | W8: 3.45年 | X8: 0.13200000000000001 | Y8: 0.109 | Z8: 6.3 | AA8: 48 | AB8: 3.73e-002 | AC8: 2.64e-002 | AD8: -1.4000000000000002e-003 | AE8: -6.0000000000000001e-003 | AF8: 86.96 | AG8: 97.4 | AH8: 0.35 | AI8: AA- | AJ8: 6.5599999999999992e-002 | AK8: =I8+100*T8 -> 141.499 | AL8: 136 | AM8: 165 | AN8: 38.6 | AO8: 104 | AP8: -2.7000000000000003e-002 | AQ8: 34 | AR8: 未来转债
A9: 41 | B9: 国城转债 | C9: 127019 | D9: 44053. | E9: 国城矿业 | F9: 688 | G9: 有色金属 | H9: 锌铅镍锡 | I9: 93.853 | J9: -4.8999999999999998e-003 | K9: 1.8e-003 | L9: 11.87 | M9: -2.5499999999999998e-002 | N9: 27 | O9: 3.4000000000000002e-002 | P9: 115.1 | Q9: 21.07 | R9: 6.17 | S9: 56.34 | T9: 0.66599999999999993 | U9: 3月4天 | V9: 5.74年 | W9: 3.74年 | X9: 6.3e-002 | Y9: 3.5000000000000003e-002 | Z9: 8.5 | AA9: 135 | AB9: 3.6900000000000002e-002 | AC9: 3.1899999999999998e-002 | AD9: 2.58e-002 | AE9: 2.4e-002 | AF9: 87.11 | AG9: 89.43 | AH9: 0.12 | AI9: AA | AJ9: 4.58e-002 | AK9: =I9+100*T9 -> 160.45299999999997 | AL9: 131.4 | AM9: 118 | AN9: 41.9 | AO9: 136 | AP9: -0.40700000000000003 | AQ9: 22 | AR9: 国城转债
A10: 205 | B10: 大丰转债! | C10: 113530 | D10: 43573. | E10: 大丰实业 | F10: 603081 | G10: 建筑 | H10: 装饰工程 | I10: 104.16 | J10: 1.4000000000000002e-003 | K10: -1.9e-003 | L10: 11.94 | M10: -2.5000000000000001e-003 | N10: 1.4 | O10: 2.e-003 | P10: 121.6 | Q10: 16.64 | R10: 2.44 | S10: 71.75 | T10: 0.45200000000000001 | U10: 转股中 | V10: 4.44年 | W10: 2.44年 | X10: 0.13100000000000001 | Y10: 9.4e-002 | Z10: 6.3 | AA10: 48 | AB10: 3.6299999999999999e-002 | AC10: 2.76e-002 | AD10: -2.3999999999999998e-003 | AE10: -5.0000000000000001e-003 | AF10: 92.51 | AG10: 100.6 | AH10: 0.17 | AI10: AA | AJ10: 4.4600000000000001e-002 | AK10: =I10+100*T10 -> 149.36000000000001 | AL10: 136.6 | AM10: 173 | AN10: 36 | AO10: 68 | AP10: -1.e-003 | AQ10: 33 | AR10: 大丰转债!
A11: 130 | B11: 百川转债! | C11: 128093 | D11: 43851. | E11: 百川股份 | F11: 2455 | G11: 化工 | H11: 化工 | I11: 109.08 | J11: 1.1999999999999999e-003 | K11: 2.5000000000000001e-003 | L11: 5.16 | M11: 7.8000000000000005e-003 | N11: 1.2 | O11: 2.e-003 | P11: 130.3 | Q11: 5.87 | R11: 2.1 | S11: 87.9 | T11: 0.24100000000000002 | U11: 转股中 | V11: 5.21年 | W11: 3.21年 | X11: 0.19500000000000001 | Y11: 0.17100000000000001 | Z11: 5.2 | AA11: 27 | AB11: 3.6000000000000004e-002 | AC11: 2.6099999999999998e-002 | AD11: -4.6999999999999993e-003 | AE11: -8.8000000000000005e-003 | AF11: 86.7 | AG11: 94.17 | AH11: 0.48 | AI11: AA- | AJ11: 6.6799999999999998e-002 | AK11: =I11+100*T11 -> 133.18000000000001 | AL11: 130.3 | AM11: 106 | AN11: 36.1 | AO11: 69 | AP11: 1.e-002 | AQ11: 45 | AR11: 百川转债!
A12: 287 | B12: 小康转债! | C12: 113016 | D12: 43060. | E12: 小康股份 | F12: 601127 | G12: 汽车 | H12: 零部件制 | I12: 99.46 | J12: 1.6000000000000001e-003 | K12: -1.9e-003 | L12: 9.42 | M12: -9.4999999999999998e-003 | N12: 4.2 | O12: 5.0000000000000001e-003 | P12: 110.3 | Q12: 15.7 | R12: 1.91 | S12: 60 | T12: 0.65799999999999992 | U12: 转股中 | V12: 3年18天 | W12: 1年18天 | X12: 7.400000000000001e-002 | Y12: 4.4999999999999998e-002 | Z12: 8.8 | AA12: 119 | AB12: 3.5400000000000001e-002 | AC12: 2.87e-002 | AD12: 2.7900000000000001e-002 | AE12: 2.3099999999999999e-002 | AF12: 97.55 | AG12: 96.87 | AH12: 0.03 | AI12: AA | AJ12: 4.4600000000000001e-002 | AK12: =I12+100*T12 -> 165.25999999999999 | AL12: 138.9 | AM12: 188 | AN12: 41.4 | AO12: 127 | AP12: 7.5999999999999998e-002 | AQ12: 45 | AR12: 小康转债!
A13: 291 | B13: 久其转债! | C13: 128015 | D13: 42934. | E13: 久其软件 | F13: 2279 | G13: 计算机及 | H13: 软件开发 | I13: 101.4 | J13: -8.9999999999999998e-004 | K13: 8.9999999999999998e-004 | L13: 5.95 | M13: -1.8200000000000001e-002 | N13: 2.3 | O13: 3.0000000000000001e-003 | P13: 110.8 | Q13: 9.48 | R13: 5.82 | S13: 62.76 | T13: 0.61599999999999999 | U13: 转股中 | V13: 2.64年 | W13: 0.64年 | X13: 0.184 | Y13: 0.11599999999999999 | Z13: 7.8 | AA13: 42 | AB13: 3.4700000000000002e-002 | AC13: 2.6800000000000001e-002 | AD13: 1.8e-003 | AE13: -2.e-003 | AF13: 95.82 | AG13: 91.79 | AH13: 0 | AI13: A+ | AJ13: 7.5199999999999989e-002 | AK13: =I13+100*T13 -> 163. | AL13: 140 | AM13: 198 | AN13: 44.2 | AO13: 158 | AP13: -5.9999999999999998e-002 | AQ13: 53 | AR13: 久其转债!
A14: 251 | B14: 海澜转债! | C14: 110045 | D14: 43312. | E14: 海澜之家 | F14: 600398 | G14: 服装纺织 | H14: 服装行业 | I14: 99.45 | J14: -4.5000000000000005e-003 | K14: 3.4999999999999996e-003 | L14: 7.48 | M14: -1.06e-002 | N14: 9.4 | O14: 3.0000000000000001e-003 | P14: 111.1 | Q14: 11.75 | R14: 2.65 | S14: 63.66 | T14: 0.56200000000000006 | U14: 转股中 | V14: 3.73年 | W14: 1.73年 | X14: 9.0999999999999998e-002 | Y14: 5.7999999999999996e-002 | Z14: 29 | AA14: 323 | AB14: 3.0499999999999999e-002 | AC14: 2.4799999999999999e-002 | AD14: 1.3600000000000001e-002 | AE14: 1.15e-002 | AF14: 94.29 | AG14: 95.29 | AH14: 0.09 | AI14: AA+ | AJ14: 4.2599999999999999e-002 | AK14: =I14+100*T14 -> 155.65000000000001 | AL14: 135.2 | AM14: 156 | AN14: 40 | AO14: 119 | AP14: 0.121 | AQ14: 58 | AR14: 海澜转债!
A15: 16 | B15: 新星转债 | C15: 113600 | D15: 44085. | E15: 深圳新星 | F15: 603978 | G15: 有色金属 | H15: 有色行业 | I15: 106.11 | J15: 4.0000000000000002e-004 | K15: 5.9999999999999995e-004 | L15: 20.59 | M15: 1.9e-003 | N15: 2.9 | O15: 5.0000000000000001e-003 | P15: 126 | Q15: 23.85 | R15: 2.17 | S15: 86.33 | T15: 0.22899999999999998 | U15: 4月3天 | V15: 5.82年 | W15: 3.82年 | X15: 0.18100000000000002 | Y15: 0.156 | Z15: 6 | AA15: 33 | AB15: 3.0499999999999999e-002 | AC15: 2.29e-002 | AD15: -5.3e-003 | AE15: -7.1999999999999998e-003 | AF15: 80.52 | AG15: 87.12 | AH15: 0.51 | AI15: AA- | AJ15: 6.6799999999999998e-002 | AK15: =I15+100*T15 -> 129.00999999999999 | AL15: 125.9 | AM15: 62 | AN15: 38.8 | AO15: 107 | AP15: -2.8999999999999998e-002 | AQ15: 9 | AR15: 新星转债
A16: 189 | B16: 大业转债! | C16: 113535 | D16: 43619. | E16: 大业股份 | F16: 603278 | G16: 汽车 | H16: 零部件制 | I16: 101.87 | J16: 3.5999999999999999e-003 | K16: -2.3e-003 | L16: 8.48 | M16: 9.4999999999999998e-003 | N16: 0.7 | O16: 1.e-003 | P16: 113.1 | Q16: 12.4 | R16: 1.54 | S16: 68.39 | T16: 0.48999999999999999 | U16: 转股中 | V16: 3.55年 | W16: 1.55年 | X16: 0.20300000000000001 | Y16: 0.13900000000000001 | Z16: 5 | AA16: 25 | AB16: 3.0299999999999997e-002 | AC16: 2.3300000000000001e-002 | AD16: -1.e-004 | AE16: -2.2000000000000001e-003 | AF16: 94.52 | AG16: 97.05 | AH16: 0.15 | AI16: AA | AJ16: 4.4600000000000001e-002 | AK16: =I16+100*T16 -> 150.87 | AL16: 135.4 | AM16: 159 | AN16: 38.3 | AO16: 96 | AP16: -2.6000000000000002e-002 | AQ16: 48 | AR16: 大业转债!
A17: 284 | B17: 嘉澳转债! | C17: 113502 | D17: 43066. | E17: 嘉澳环保 | F17: 603822 | G17: 化工 | H17: 化工 | I17: 102.77 | J17: 2.9999999999999997e-004 | K17: -2.9999999999999997e-004 | L17: 24.99 | M17: 4.0000000000000001e-003 | N17: 0.9 | O17: 5.0000000000000001e-003 | P17: 112.3 | Q17: 44.79 | R17: 2.47 | S17: 55.79 | T17: 0.84200000000000008 | U17: 转股中 | V17: 3年22天 | W17: 1年22天 | X17: 0.10099999999999999 | Y17: 5.5999999999999994e-002 | Z17: 1.9 | AA17: 18 | AB17: 3.0099999999999998e-002 | AC17: 2.2400000000000003e-002 | AD17: 2.0000000000000001e-004 | AE17: -4.1999999999999997e-003 | AF17: 95.18 | AG17: 92.89 | AH17: 0.01 | AI17: AA- | AJ17: 6.5599999999999992e-002 | AK17: =I17+100*T17 -> 186.97 | AL17: 149.7 | AM17: 242 | AN17: 54.6 | AO17: 224 | AP17: -1.e-002 | AQ17: 28 | AR17: 嘉澳转债!
A18: 293 | B18: 永东转债! | C18: 128014 | D18: 42934. | E18: 永东股份 | F18: 2753 | G18: 化工 | H18: 化工 | I18: 103.56 | J18: 2.8999999999999998e-003 | K18: -3.4999999999999996e-003 | L18: 8.54 | M18: -1.61e-002 | N18: 0.9 | O18: 3.0000000000000001e-003 | P18: 111.3 | Q18: 12.6 | R18: 1.86 | S18: 67.78 | T18: 0.52800000000000002 | U18: 转股中 | V18: 2.49年 | W18: 0.49年 | X18: 0.105 | Y18: 7.0999999999999994e-002 | Z18: 3.4 | AA18: 32 | AB18: 2.9900000000000003e-002 | AC18: 2.12e-002 | AD18: -2.5699999999999997e-002 | AE18: -3.0899999999999997e-002 | AF18: 97.72 | AG18: 95.57 | AH18: 0.04 | AI18: AA- | AJ18: 6.4199999999999993e-002 | AK18: =I18+100*T18 -> 156.36000000000001 | AL18: 139.3 | AM18: 192 | AN18: 41.6 | AO18: 129 | AP18: -6.0999999999999999e-002 | AQ18: 38 | AR18: 永东转债!
A19: 113 | B19: 科达转债! | C19: 113569 | D19: 43929. | E19: 苏州科达 | F19: 603660 | G19: 通信互联 | H19: 物联网 | I19: 103.75 | J19: 9.1000000000000004e-003 | K19: -4.1999999999999997e-003 | L19: 9.5 | M19: 2.1499999999999998e-002 | N19: 4.9 | O19: 9.0000000000000011e-003 | P19: 120.7 | Q19: 14.84 | R19: 2.81 | S19: 64.02 | T19: 0.621 | U19: 转股中 | V19: 5.39年 | W19: 3.39年 | X19: 0.109 | Y19: 7.0000000000000007e-002 | Z19: 5.2 | AA19: 47 | AB19: 2.9100000000000001e-002 | AC19: 2.2200000000000001e-002 | AD19: 8.0000000000000004e-004 | AE19: -1.4000000000000002e-003 | AF19: 82.91 | AG19: 85.85 | AH19: 0.23 | AI19: AA- | AJ19: 6.6799999999999998e-002 | AK19: =I19+100*T19 -> 165.84999999999999 | AL19: 143.5 | AM19: 217 | AN19: 57.6 | AO19: 239 | AP19: 4.9000000000000002e-002 | AQ19: 22 | AR19: 科达转债!
A20: 50 | B20: 胜达转债! | C20: 113591 | D20: 44035. | E20: 大胜达 | F20: 603687 | G20: 造纸包装 | H20: 包装用纸 | I20: 104.44 | J20: -2.5000000000000001e-003 | K20: -2.5999999999999999e-003 | L20: 11.95 | M20: -1.0800000000000001e-002 | N20: 2.4 | O20: 4.0000000000000001e-003 | P20: 122.2 | Q20: 14.73 | R20: 3.19 | S20: 81.13 | T20: 0.28699999999999998 | U20: 2月21天 | V20: 5.70年 | W20: 3.70年 | X20: 0.11199999999999999 | Y20: 9.0999999999999998e-002 | Z20: 5.5 | AA20: 49 | AB20: 2.8500000000000001e-002 | AC20: 2.1600000000000001e-002 | AD20: -8.0000000000000004e-004 | AE20: -2.8999999999999998e-003 | AF20: 81.32 | AG20: 85.2 | AH20: 0.47 | AI20: AA- | AJ20: 6.6799999999999998e-002 | AK20: =I20+100*T20 -> 133.13999999999999 | AL20: 127.8 | AM20: 76 | AN20: 42.6 | AO20: 143 | AP20: -4.0000000000000001e-002 | AQ20: 19 | AR20: 胜达转债!
A21: 162 | B21: 浦发转债! | C21: 110059 | D21: 43784. | E21: 浦发银行 | F21: 600000 | G21: 金融 | H21: 银行行业 | I21: 102.93 | J21: 2.e-003 | K21: -1.e-004 | L21: 9.72 | M21: 1.04e-002 | N21: 113 | O21: 2.e-003 | P21: 117.8 | Q21: 14.45 | R21: 0.57 | S21: 67.27 | T21: 0.53000000000000003 | U21: 转股中 | V21: 5年9天 | W21: 无权 | X21: 0.17499999999999999 | Y21: 0.11800000000000001 | Z21: 500 | AA21: 2853. | AB21: 2.7999999999999997e-002 | AC21: 2.1499999999999998e-002 | AD21: 无权 | AE21: 无权 | AF21: 无权 | AG21: 96.9 | AH21: 0.18 | AI21: AAA | AJ21: 4.0800000000000003e-002 | AK21: =I21+100*T21 -> 155.93000000000001 | AL21: 138.6 | AM21: 184 | AN21: 41.7 | AO21: 131 | AP21: 5.0000000000000001e-003 | AQ21: 75 | AR21: 浦发转债!
A22: 218 | B22: 长城转债! | C22: 113528 | D22: 43544. | E22: 长城科技 | F22: 603897 | G22: 机械装备 | H22: 专用设备 | I22: 104.62 | J22: -2.8000000000000004e-003 | K22: -8.9999999999999998e-004 | L22: 19.92 | M22: -8.0000000000000002e-003 | N22: 3.4 | O22: 5.0000000000000001e-003 | P22: 117.6 | Q22: 23.45 | R22: 1.94 | S22: 84.95 | T22: 0.23199999999999998 | U22: 转股中 | V22: 4.36年 | W22: 2.36年 | X22: 0.17800000000000002 | Y22: 0.152 | Z22: 6.3 | AA22: 36 | AB22: 2.7799999999999998e-002 | AC22: 2.0400000000000001e-002 | AD22: -2.5999999999999999e-003 | AE22: -5.6000000000000008e-003 | AF22: 88.69 | AG22: 89.73 | AH22: 0.47 | AI22: AA- | AJ22: 6.5599999999999992e-002 | AK22: =I22+100*T22 -> 127.82000000000001 | AL22: 124.3 | AM22: 45 | AN22: 34.6 | AO22: 52 | AP22: 4.7e-002 | AQ22: 44 | AR22: 长城转债!
A23: 23 | B23: 佳力转债! | C23: 113597 | D23: 44064. | E23: 佳力图 | F23: 603912 | G23: 机械装备 | H23: 专用设备 | I23: 107 | J23: -2.3999999999999998e-003 | K23: -4.0000000000000002e-004 | L23: 17.5 | M23: -7.4000000000000003e-003 | N23: 0.7 | O23: 2.e-003 | P23: 124.5 | Q23: 23.4 | R23: 4.64 | S23: 74.79 | T23: 0.43099999999999999 | U23: 3月19天 | V23: 5.78年 | W23: 3.78年 | X23: 7.9000000000000001e-002 | Y23: 5.9000000000000004e-002 | Z23: 3 | AA23: 38 | AB23: 2.7099999999999999e-002 | AC23: 1.9799999999999998e-002 | AD23: -6.1999999999999998e-003 | AE23: -8.3999999999999995e-003 | AF23: 81.14 | AG23: 86.38 | AH23: 0.38 | AI23: AA- | AJ23: 6.6799999999999998e-002 | AK23: =I23+100*T23 -> 150.09999999999999 | AL23: 139.2 | AM23: 190 | AN23: 52.8 | AO23: 216 | AP23: -1.1000000000000001e-002 | AQ23: 5 | AR23: 佳力转债!
A24: 3 | B24: N交建转 | C24: 128132 | D24: 44120. | E24: 新疆交建 | F24: 2941 | G24: 建筑 | H24: 建筑工程 | I24: 100.65 | J24: 6.5000000000000006e-003 | K24: 0. | L24: 14.53 | M24: 6.8999999999999999e-003 | N24: 777 | O24: 0.90000000000000002 | P24: 117.3 | Q24: 18.57 | R24: 3.86 | S24: 78.24 | T24: 0.28600000000000003 | U24: 5月4天 | V24: 5.91年 | W24: 3.91年 | X24: 9.0999999999999998e-002 | Y24: 7.0999999999999994e-002 | Z24: 8.5 | AA24: 94 | AB24: 2.6699999999999998e-002 | AC24: 2.1400000000000002e-002 | AD24: 7.7000000000000002e-003 | AE24: 5.7999999999999996e-003 | AF24: 86.64 | AG24: 90.47 | AH24: 0.36 | AI24: AA | AJ24: 4.58e-002 | AK24: =I24+100*T24 -> 129.25 | AL24: 123.1 | AM24: 32 | AN24: 32.6 | AO24: 38 | AP24: -0.13600000000000001 | AQ24: 2 | AR24: N交建转
A25: 270 | B25: 吉视转债! | C25: 113017 | D25: 43115. | E25: 吉视传媒 | F25: 601929 | G25: 传媒娱乐 | H25: 影视娱乐 | I25: 101.25 | J25: 5.0000000000000001e-004 | K25: -5.0000000000000001e-004 | L25: 2.21 | M25: 0. | N25: 2.3 | O25: 1.e-003 | P25: 109.8 | Q25: 2.95 | R25: 1.04 | S25: 74.92 | T25: 0.35200000000000004 | U25: 转股中 | V25: 3.19年 | W25: 1.19年 | X25: 0.22699999999999998 | Y25: 0.17000000000000001 | Z25: 16 | AA25: 69 | AB25: 2.63e-002 | AC25: 2.0299999999999999e-002 | AD25: 9.4999999999999998e-003 | AE25: 5.7999999999999996e-003 | AF25: 96.97 | AG25: 96.39 | AH25: 0.19 | AI25: AA+ | AJ25: 4.2599999999999999e-002 | AK25: =I25+100*T25 -> 136.44999999999999 | AL25: 127.6 | AM25: 75 | AN25: 30.6 | AO25: 24 | AP25: -1.9e-002 | AQ25: 50 | AR25: 吉视转债!
A26: 54 | B26: 天创转债! | C26: 113589 | D26: 44028. | E26: 天创时尚 | F26: 603608 | G26: 服装纺织 | H26: 鞋服行业 | I26: 99.87 | J26: 1.9e-003 | K26: -2.2000000000000001e-003 | L26: 8.24 | M26: -1.1999999999999999e-003 | N26: 1.5 | O26: 3.0000000000000001e-003 | P26: 115.3 | Q26: 12.44 | R26: 1.62 | S26: 66.24 | T26: 0.50800000000000001 | U26: 2月15天 | V26: 5.68年 | W26: 3.68年 | X26: 0.16899999999999998 | Y26: 0.11199999999999999 | Z26: 6 | AA26: 35 | AB26: 2.6099999999999998e-002 | AC26: 2.1099999999999997e-002 | AD26: 1.0200000000000001e-002 | AE26: 8.199999999999999e-003 | AF26: 87.52 | AG26: 89.85 | AH26: 0.22 | AI26: AA | AJ26: 4.58e-002 | AK26: =I26+100*T26 -> 150.67000000000002 | AL26: 133.5 | AM26: 133 | AN26: 43.7 | AO26: 153 | AP26: -3.6000000000000004e-002 | AQ26: 7 | AR26: 天创转债!
A27: 140 | B27: 建工转债! | C27: 110064 | D27: 43846. | E27: 重庆建工 | F27: 600939 | G27: 建筑 | H27: 建筑工程 | I27: 105.6 | J27: -2.5000000000000001e-003 | K27: -1.6000000000000001e-003 | L27: 3.95 | M27: -1.e-002 | N27: 5.1 | O27: 3.0000000000000001e-003 | P27: 120.2 | Q27: 4.57 | R27: 1.03 | S27: 86.43 | T27: 0.222 | U27: 转股中 | V27: 5.17年 | W27: 3.17年 | X27: 0.23199999999999998 | Y27: 0.20000000000000001 | Z27: 17 | AA27: 72 | AB27: 2.6000000000000002e-002 | AC27: 1.9e-002 | AD27: -3.0999999999999999e-003 | AE27: -5.6999999999999993e-003 | AF27: 90.76 | AG27: 96.83 | AH27: 0.41 | AI27: AA+ | AJ27: 4.3799999999999999e-002 | AK27: =I27+100*T27 -> 127.8 | AL27: 124.8 | AM27: 50 | AN27: 27.9 | AO27: 12 | AP27: -2.6000000000000002e-002 | AQ27: 47 | AR27: 建工转债!
A28: 87 | B28: 凌钢转债! | C28: 110070 | D28: 43964. | E28: 凌钢股份 | F28: 600231 | G28: 钢铁 | H28: 炼钢 | I28: 102.9 | J28: 2.7000000000000001e-003 | K28: -8.9999999999999998e-004 | L28: 2.24 | M28: 4.5000000000000005e-003 | N28: 1.7 | O28: 4.0000000000000001e-003 | P28: 117.8 | Q28: 2.75 | R28: 0.8 | S28: 81.45 | T28: 0.26300000000000001 | U28: 转股中 | V28: 5.48年 | W28: 3.48年 | X28: 7.0999999999999994e-002 | Y28: 5.7999999999999996e-002 | Z28: 4.4 | AA28: 62 | AB28: 2.5499999999999998e-002 | AC28: 1.9599999999999999e-002 | AD28: 3.3e-003 | AE28: 1.1000000000000001e-003 | AF28: 88.6 | AG28: 92.64 | AH28: 0.4 | AI28: AA | AJ28: 4.58e-002 | AK28: =I28+100*T28 -> 129.20000000000002 | AL28: 124.3 | AM28: 46 | AN28: 31.7 | AO28: 30 | AP28: -8.0000000000000002e-003 | AQ28: 13 | AR28: 凌钢转债!
A29: 241 | B29: 岭南转债! | C29: 128044 | D29: 43347. | E29: 岭南股份 | F29: 2717 | G29: 城市公用 | H29: 生态环境 | I29: 101.306 | J29: 1.1999999999999999e-003 | K29: 8.9999999999999998e-004 | L29: 4.12 | M29: 1.23e-002 | N29: 2.3 | O29: 4.0000000000000001e-003 | P29: 111.3 | Q29: 5.91 | R29: 1.32 | S29: 69.71 | T29: 0.45299999999999996 | U29: 转股中 | V29: 3.82年 | W29: 1.82年 | X29: 0.105 | Y29: 7.2999999999999995e-002 | Z29: 6.6 | AA29: 63 | AB29: 2.5399999999999999e-002 | AC29: 1.9699999999999999e-002 | AD29: 7.4999999999999997e-003 | AE29: 4.6999999999999993e-003 | AF29: 94.32 | AG29: 94.51 | AH29: 0.17 | AI29: AA | AJ29: 4.4600000000000001e-002 | AK29: =I29+100*T29 -> 146.60599999999999 | AL29: 132.9 | AM29: 127 | AN29: 38.4 | AO29: 99 | AP29: 5.0000000000000001e-003 | AQ29: 30 | AR29: 岭南转债!
A30: 145 | B30: 鸿达转债 | C30: 128085 | D30: 43838. | E30: 鸿达兴业 | F30: 2002. | G30: 化工 | H30: 化工 | I30: 110.133 | J30: 6.7000000000000002e-003 | K30: -2.5999999999999999e-003 | L30: 3.88 | M30: 7.8000000000000005e-003 | N30: 11 | O30: 4.0000000000000001e-003 | P30: 124.8 | Q30: 3.92 | R30: 1.43 | S30: 98.98 | T30: 0.113 | U30: 转股中 | V30: 5年58天 | W30: 3年58天 | X30: 0.24199999999999999 | Y30: 0.23899999999999999 | Z30: 24 | AA30: 100 | AB30: 2.5099999999999997e-002 | AC30: 1.6799999999999999e-002 | AD30: -1.6399999999999998e-002 | AE30: -1.8799999999999997e-002 | AF30: 90.03 | AG30: 99.57 | AH30: 0.52 | AI30: AA | AJ30: 4.58e-002 | AK30: =I30+100*T30 -> 121.43299999999999 | AL30: 121.3 | AM30: 18 | AN30: 21.7 | AO30: 5 | AP30: -3.4000000000000002e-002 | AQ30: 84 | AR30: 鸿达转债
A31: 217 | B31: 中信转债! | C31: 113021 | D31: 43543. | E31: 中信银行 | F31: 601998 | G31: 金融 | H31: 银行行业 | I31: 107.39 | J31: 5.6000000000000008e-003 | K31: -2.5000000000000001e-003 | L31: 5.28 | M31: 1.34e-002 | N31: 54 | O31: 1.e-003 | P31: 118.8 | Q31: 6.98 | R31: 0.57 | S31: 75.64 | T31: 0.41999999999999998 | U31: 转股中 | V31: 4.37年 | W31: 无权 | X31: 0.155 | Y31: 0.11699999999999999 | Z31: 400 | AA31: 2584. | AB31: 2.41e-002 | AC31: 1.6299999999999999e-002 | AD31: 无权 | AE31: 无权 | AF31: 无权 | AG31: 100.77 | AH31: 0.23 | AI31: AAA | AJ31: 3.9599999999999996e-002 | AK31: =I31+100*T31 -> 149.38999999999999 | AL31: 139.1 | AM31: 189 | AN31: 38.4 | AO31: 97 | AP31: 3.4000000000000002e-002 | AQ31: 53 | AR31: 中信转债!
A32: 164 | B32: 迪贝转债! | C32: 113546 | D32: 43790. | E32: 迪贝电气 | F32: 603320 | G32: 家电 | H32: 零部件制 | I32: 108.05 | J32: 3.0999999999999999e-003 | K32: -3.4999999999999996e-003 | L32: 12.93 | M32: -8.0000000000000004e-004 | N32: 2.4 | O32: 1.e-002 | P32: 121.1 | Q32: 14.1 | R32: 2.56 | S32: 91.7 | T32: 0.17800000000000002 | U32: 转股中 | V32: 5年4.0天 | W32: 3年4.0天 | X32: 0.13699999999999998 | Y32: 0.125 | Z32: 2.3 | AA32: 17 | AB32: 2.3599999999999999e-002 | AC32: 1.61e-002 | AD32: -1.0800000000000001e-002 | AE32: -1.3500000000000002e-002 | AF32: 82.63 | AG32: 84.02 | AH32: 0.61 | AI32: A+ | AJ32: 7.7800000000000008e-002 | AK32: =I32+100*T32 -> 125.84999999999999 | AL32: 124.4 | AM32: 47 | AN32: 40.4 | AO32: 122 | AP32: -4.0000000000000001e-003 | AQ32: 42 | AR32: 迪贝转债!
A33: 269 | B33: 迪龙转债! | C33: 128033 | D33: 43129. | E33: 雪迪龙 | F33: 2658 | G33: 城市公用 | H33: 三废处理 | I33: 102.279 | J33: 4.6999999999999993e-003 | K33: -4.1999999999999997e-003 | L33: 6.36 | M33: 3.2000000000000002e-003 | N33: 4.7 | O33: 9.0000000000000011e-003 | P33: 109.8 | Q33: 8.83 | R33: 1.95 | S33: 72.03 | T33: 0.41999999999999998 | U33: 转股中 | V33: 3.19年 | W33: 1.19年 | X33: 0.13500000000000001 | Y33: 9.6999999999999989e-002 | Z33: 5.2 | AA33: 38 | AB33: 2.3e-002 | AC33: 1.7000000000000001e-002 | AD33: 2.e-003 | AE33: -1.7000000000000001e-003 | AF33: 96.72 | AG33: 95.82 | AH33: 0.16 | AI33: AA | AJ33: 4.4600000000000001e-002 | AK33: =I33+100*T33 -> 144.279 | AL33: 132.5 | AM33: 125 | AN33: 35.8 | AO33: 67 | AP33: -1.2e-002 | AQ33: 37 | AR33: 迪龙转债!
A34: 11 | B34: 塞力转债 | C34: 113601 | D34: 44089. | E34: 塞力斯 | F34: 603716 | G34: 医药 | H34: 医药商业 | I34: 106.92 | J34: 8.6e-003 | K34: -1.8e-003 | L34: 15.71 | M34: 1.09e-002 | N34: 8.3 | O34: 1.3999999999999999e-002 | P34: 121.3 | Q34: 16.98 | R34: 2.16 | S34: 92.52 | T34: 0.156 | U34: 4月11天 | V34: 5.84年 | W34: 3.84年 | X34: 0.16899999999999998 | Y34: 0.156 | Z34: 5.4 | AA34: 32 | AB34: 2.23e-002 | AC34: 1.5900000000000001e-002 | AD34: -6.4000000000000003e-003 | AE34: -8.5000000000000006e-003 | AF34: 80.68 | AG34: 83.84 | AH34: 0.62 | AI34: AA- | AJ34: 6.6799999999999998e-002 | AK34: =I34+100*T34 -> 122.52 | AL34: 121.3 | AM34: 19 | AN34: 37.5 | AO34: 84 | AP34: -2.7000000000000003e-002 | AQ34: 10 | AR34: 塞力转债
A35: 175 | B35: 翔鹭转债! | C35: 128072 | D35: 43724. | E35: 翔鹭钨业 | F35: 2842 | G35: 有色金属 | H35: 小金属 | I35: 103.7 | J35: 8.9999999999999998e-004 | K35: -2.0999999999999999e-003 | L35: 9.94 | M35: -5.0000000000000001e-003 | N35: 0.7 | O35: 2.e-003 | P35: 115.1 | Q35: 15.34 | R35: 3.04 | S35: 64.8 | T35: 0.59999999999999998 | U35: 转股中 | V35: 4.84年 | W35: 2.84年 | X35: 0.111 | Y35: 7.2000000000000008e-002 | Z35: 3 | AA35: 27 | AB35: 2.2200000000000001e-002 | AC35: 1.6500000000000001e-002 | AD35: -8.9999999999999998e-004 | AE35: -3.0999999999999999e-003 | AF35: 85.62 | AG35: 85.16 | AH35: 0.24 | AI35: AA- | AJ35: 6.5599999999999992e-002 | AK35: =I35+100*T35 -> 163.69999999999999 | AL35: 142.6 | AM35: 212 | AN35: 57 | AO35: 230 | AP35: -2.8999999999999998e-002 | AQ35: 26 | AR35: 翔鹭转债!
A36: 258 | B36: 新凤转债! | C36: 113508 | D36: 43236. | E36: 新凤鸣 | F36: 603225 | G36: 服装纺织 | H36: 纺织行业 | I36: 104.19 | J36: -2.5000000000000001e-003 | K36: 1.7000000000000001e-003 | L36: 11.05 | M36: -5.4000000000000003e-003 | N36: 12 | O36: 5.0000000000000001e-003 | P36: 112.3 | Q36: 15.78 | R36: 1.37 | S36: 70.03 | T36: 0.48799999999999999 | U36: 转股中 | V36: 3.52年 | W36: 1.52年 | X36: 0.13900000000000001 | Y36: 9.8000000000000004e-002 | Z36: 21 | AA36: 154 | AB36: 2.2000000000000002e-002 | AC36: 1.54e-002 | AD36: -8.0000000000000002e-003 | AE36: -1.1200000000000002e-002 | AF36: 95.57 | AG36: 96.61 | AH36: 0.15 | AI36: AA | AJ36: 4.4600000000000001e-002 | AK36: =I36+100*T36 -> 152.99000000000001 | AL36: 138.4 | AM36: 183 | AN36: 41.7 | AO36: 133 | AP36: 5.0000000000000003e-002 | AQ36: 26 | AR36: 新凤转债!
A37: 13 | B37: 文科转债 | C37: 128127 | D37: 44085. | E37: 文科园林 | F37: 2775 | G37: 城市公用 | H37: 生态环境 | I37: 107.308 | J37: 1.23e-002 | K37: 8.199999999999999e-003 | L37: 5.66 | M37: 3.1e-002 | N37: 17 | O37: 1.7000000000000001e-002 | P37: 121.3 | Q37: 5.76 | R37: 1.16 | S37: 98.26 | T37: 9.1999999999999998e-002 | U37: 4月13天 | V37: 5.84年 | W37: 3.84年 | X37: 0.32700000000000001 | Y37: 0.32200000000000001 | Z37: 9.5 | AA37: 29 | AB37: 2.1700000000000001e-002 | AC37: 1.52e-002 | AD37: -7.4000000000000003e-003 | AE37: -9.3999999999999986e-003 | AF37: 80.69 | AG37: 83.85 | AH37: 0.66 | AI37: AA- | AJ37: 6.6799999999999998e-002 | AK37: =I37+100*T37 -> 116.50800000000001 | AL37: 116.4 | AM37: 2 | AN37: 32.5 | AO37: 36 | AP37: 6.0999999999999999e-002 | AQ37: 13 | AR37: 文科转债
A38: 263 | B38: 杭电转债! | C38: 113505 | D38: 43186. | E38: 杭电股份 | F38: 603618 | G38: 能源电力 | H38: 电力设备 | I38: 104.66 | J38: 5.9999999999999995e-004 | K38: -1.e-003 | L38: 5.68 | M38: -1.8e-003 | N38: 1.2 | O38: 2.e-003 | P38: 112.3 | Q38: 7.14 | R38: 1.57 | S38: 79.55 | T38: 0.316 | U38: 转股中 | V38: 3.38年 | W38: 1.38年 | X38: 0.191 | Y38: 0.152 | Z38: 7.5 | AA38: 39 | AB38: 2.1499999999999998e-002 | AC38: 1.46e-002 | AD38: -1.1599999999999999e-002 | AE38: -1.5100000000000001e-002 | AF38: 96.16 | AG38: 97.2 | AH38: 0.26 | AI38: AA | AJ38: 4.4600000000000001e-002 | AK38: =I38+100*T38 -> 136.25999999999999 | AL38: 129.8 | AM38: 98 | AN38: 32.6 | AO38: 37 | AP38: 4.0000000000000001e-003 | AQ38: 38 | AR38: 杭电转债!
A39: 114 | B39: 新春转债 | C39: 113568 | D39: 43923. | E39: 五洲新春 | F39: 603667 | G39: 机械装备 | H39: 通用设备 | I39: 111.75 | J39: 1.6e-002 | K39: 1.32e-002 | L39: 9.25 | M39: 4.2800000000000005e-002 | N39: 15 | O39: 4.0000000000000001e-002 | P39: 124.8 | Q39: 8.91 | R39: 1.58 | S39: 103.82 | T39: 7.5999999999999998e-002 | U39: 转股中 | V39: 5.38年 | W39: 3.38年 | X39: 0.122 | Y39: 0.127 | Z39: 3.3 | AA39: 27 | AB39: 2.12e-002 | AC39: 1.3300000000000001e-002 | AD39: -1.84e-002 | AE39: -2.0899999999999998e-002 | AF39: 83.53 | AG39: 88.9 | AH39: 0.68 | AI39: AA- | AJ39: 6.6799999999999998e-002 | AK39: =I39+100*T39 -> 119.34999999999999 | AL39: 119.7 | AM39: 8 | AN39: 30.8 | AO39: 25 | AP39: 0.105 | AQ39: 41 | AR39: 新春转债
A40: 34 | B40: 花王转债 | C40: 113595 | D40: 44061. | E40: 花王股份 | F40: 603007 | G40: 城市公用 | H40: 生态环境 | I40: 111.31 | J40: 1.1999999999999999e-003 | K40: -5.0000000000000001e-003 | L40: 7.12 | M40: -5.6000000000000008e-003 | N40: 3.3 | O40: 9.0000000000000011e-003 | P40: 125.3 | Q40: 6.94 | R40: 2.17 | S40: 102.59 | T40: 8.5000000000000006e-002 | U40: 3月10天 | V40: 5.75年 | W40: 3.75年 | X40: 0.13800000000000001 | Y40: 0.14199999999999999 | Z40: 3.3 | AA40: 24 | AB40: 2.12e-002 | AC40: 1.37e-002 | AD40: -1.6799999999999999e-002 | AE40: -1.8799999999999997e-002 | AF40: 81.12 | AG40: 87.06 | AH40: 0.68 | AI40: AA- | AJ40: 6.6799999999999998e-002 | AK40: =I40+100*T40 -> 119.81 | AL40: 120 | AM40: 10 | AN40: 33 | AO40: 43 | AP40: -3.2000000000000001e-002 | AQ40: 22 | AR40: 花王转债
A41: 106 | B41: 搜特转债! | C41: 128100 | D41: 43930. | E41: 搜于特 | F41: 2503 | G41: 服装纺织 | H41: 服装行业 | I41: 105.606 | J41: 8.0000000000000004e-004 | K41: -8.3000000000000001e-003 | L41: 2.62 | M41: -1.4999999999999999e-002 | N41: 9.4 | O41: 1.1000000000000001e-002 | P41: 117.3 | Q41: 2.9 | R41: 1.48 | S41: 90.34 | T41: 0.16899999999999998 | U41: 转股中 | V41: 5.39年 | W41: 3.39年 | X41: 9.9000000000000005e-002 | Y41: 8.900000000000001e-002 | Z41: 8 | AA41: 81 | AB41: 2.e-002 | AC41: 1.4199999999999999e-002 | AD41: -4.8999999999999998e-003 | AE41: -6.8999999999999999e-003 | AF41: 88.65 | AG41: 92.57 | AH41: 0.49 | AI41: AA | AJ41: 4.58e-002 | AK41: =I41+100*T41 -> 122.506 | AL41: 120.9 | AM41: 15 | AN41: 28.3 | AO41: 14 | AP41: -2.1000000000000001e-002 | AQ41: 42 | AR41: 搜特转债!
A42: 181 | B42: 智能转债! | C42: 128070 | D42: 43669. | E42: 智能自控 | F42: 2877 | G42: 机械装备 | H42: 通用设备 | I42: 107.451 | J42: 1.e-004 | K42: 4.6999999999999993e-003 | L42: 8.22 | M42: 8.6e-003 | N42: 3.9 | O42: 1.6e-002 | P42: 117.6 | Q42: 9.51 | R42: 3.9 | S42: 86.44 | T42: 0.24299999999999999 | U42: 转股中 | V42: 4.70年 | W42: 无权 | X42: 8.4000000000000005e-002 | Y42: 7.2999999999999995e-002 | Z42: 2.3 | AA42: 27 | AB42: 1.9799999999999998e-002 | AC42: 1.3000000000000001e-002 | AD42: 无权 | AE42: 无权 | AF42: 无权 | AG42: 83.79 | AH42: 0.55 | AI42: A+ | AJ42: 7.6600000000000001e-002 | AK42: =I42+100*T42 -> 131.751 | AL42: 128.5 | AM42: 85 | AN42: 44.7 | AO42: 164 | AP42: 1.3999999999999999e-002 | AQ42: 33 | AR42: 智能转债!
A43: 216 | B43: 贵广转债! | C43: 110052 | D43: 43553. | E43: 贵广网络 | F43: 600996 | G43: 传媒娱乐 | H43: 影视娱乐 | I43: 109 | J43: -3.7000000000000002e-003 | K43: 1.9e-003 | L43: 7.21 | M43: -4.0999999999999995e-003 | N43: 8.1 | O43: 5.0000000000000001e-003 | P43: 118.5 | Q43: 7.94 | R43: 1.64 | S43: 90.81 | T43: 0.20000000000000001 | U43: 转股中 | V43: 4.38年 | W43: 2.38年 | X43: 0.20100000000000001 | Y43: 0.183 | Z43: 15 | AA43: 76 | AB43: 1.9699999999999999e-002 | AC43: 1.21e-002 | AD43: -1.9099999999999999e-002 | AE43: -2.2000000000000002e-002 | AF43: 93.51 | AG43: 99.14 | AH43: 0.42 | AI43: AA+ | AJ43: 4.2599999999999999e-002 | AK43: =I43+100*T43 -> 129. | AL43: 127.2 | AM43: 70 | AN43: 28.1 | AO43: 13 | AP43: 3.0000000000000001e-003 | AQ43: 18 | AR43: 贵广转债!
A44: 182 | B44: 华森转债! | C44: 128069 | D44: 43657. | E44: 华森制药 | F44: 2907 | G44: 医药 | H44: 化学制药 | I44: 110 | J44: 9.5999999999999992e-003 | K44: -3.9000000000000003e-003 | L44: 16.64 | M44: 1.03e-002 | N44: 2.5 | O44: 8.0000000000000002e-003 | P44: 120 | Q44: 18.04 | R44: 6.44 | S44: 92.24 | T44: 0.193 | U44: 转股中 | V44: 4.68年 | W44: 2.68年 | X44: 4.4999999999999998e-002 | Y44: 4.0999999999999995e-002 | Z44: 3 | AA44: 67 | AB44: 1.9099999999999999e-002 | AC44: 1.1599999999999999e-002 | AD44: -2.1400000000000002e-002 | AE44: -2.3700000000000002e-002 | AF44: 86.54 | AG44: 89.66 | AH44: 0.56 | AI44: AA- | AJ44: 6.5599999999999992e-002 | AK44: =I44+100*T44 -> 129.30000000000001 | AL44: 127.8 | AM44: 77 | AN44: 38.1 | AO44: 93 | AP44: -9.0000000000000011e-003 | AQ44: 40 | AR44: 华森转债!
A45: 249 | B45: 德尔转债! | C45: 123011 | D45: 43326. | E45: 德尔股份 | F45: 300473 | G45: 汽车 | H45: 零部件制 | I45: 108.513 | J45: 5.5000000000000005e-003 | K45: -4.1999999999999997e-003 | L45: 30.03 | M45: 3.0000000000000001e-003 | N45: 2.7 | O45: 1.e-002 | P45: 116.3 | Q45: 34.54 | R45: 1.54 | S45: 86.94 | T45: 0.248 | U45: 转股中 | V45: 3.75年 | W45: 1.75年 | X45: 7.2999999999999995e-002 | Y45: 6.4000000000000001e-002 | Z45: 2.5 | AA45: 34 | AB45: 1.9e-002 | AC45: 1.11e-002 | AD45: -2.81e-002 | AE45: -3.0800000000000001e-002 | AF45: 91.12 | AG45: 92.07 | AH45: 0.45 | AI45: AA- | AJ45: 6.5599999999999992e-002 | AK45: =I45+100*T45 -> 133.31300000000002 | AL45: 130.1 | AM45: 104 | AN45: 38 | AO45: 92 | AP45: 2.6000000000000002e-002 | AQ45: 34 | AR45: 德尔转债!
A46: 19 | B46: 嘉友转债 | C46: 113599 | D46: 44081. | E46: 嘉友国际 | F46: 603871 | G46: 交通运输 | H46: 物流业 | I46: 113.2 | J46: 7.6e-003 | K46: -1.9599999999999999e-002 | L46: 25.82 | M46: -1.7500000000000002e-002 | N46: 39 | O46: 4.8000000000000001e-002 | P46: 126 | Q46: 24.82 | R46: 3.04 | S46: 104.03 | T46: 8.8000000000000009e-002 | U46: 4月2天 | V46: 5.79年 | W46: 3.79年 | X46: 0.127 | Y46: 0.13200000000000001 | Z46: 7.2 | AA46: 57 | AB46: 1.9e-002 | AC46: 1.1399999999999999e-002 | AD46: -2.1600000000000001e-002 | AE46: -2.3399999999999997e-002 | AF46: 80.63 | AG46: 87.24 | AH46: 0.69 | AI46: AA- | AJ46: 6.6799999999999998e-002 | AK46: =I46+100*T46 -> 122. | AL46: 122.4 | AM46: 24 | AN46: 35.1 | AO46: 58 | AP46: -0.14899999999999999 | AQ46: 10 | AR46: 嘉友转债
A47: 277 | B47: 众兴转债! | C47: 128026 | D47: 43103. | E47: 众兴菌业 | F47: 2772 | G47: 农业 | H47: 种植业 | I47: 104.161 | J47: 5.9999999999999995e-004 | K47: -2.0000000000000001e-004 | L47: 9.42 | M47: 1.1000000000000001e-003 | N47: 3.6 | O47: 4.0000000000000001e-003 | P47: 110.3 | Q47: 11.45 | R47: 1.45 | S47: 82.27 | T47: 0.26600000000000001 | U47: 转股中 | V47: 3年55天 | W47: 1年55天 | X47: 0.26500000000000001 | Y47: 0.218 | Z47: 9.2 | AA47: 35 | AB47: 1.8799999999999997e-002 | AC47: 1.2500000000000001e-002 | AD47: -1.e-002 | AE47: -1.41e-002 | AF47: 94.63 | AG47: 90.72 | AH47: 0.32 | AI47: AA- | AJ47: 6.5599999999999992e-002 | AK47: =I47+100*T47 -> 130.761 | AL47: 126.1 | AM47: 64 | AN47: 31.4 | AO47: 29 | AP47: 3.4000000000000002e-002 | AQ47: 56 | AR47: 众兴转债!
A48: 153 | B48: 海亮转债! | C48: 128081 | D48: 43815. | E48: 海亮股份 | F48: 2203 | G48: 有色金属 | H48: 铜金属 | I48: 105.1 | J48: 8.9999999999999998e-004 | K48: -3.8e-003 | L48: 7.84 | M48: -7.6e-003 | N48: 0.9 | O48: 0. | P48: 115.2 | Q48: 9.76 | R48: 1.7 | S48: 80.33 | T48: 0.308 | U48: 转股中 | V48: 5年33天 | W48: 3年33天 | X48: 0.20600000000000002 | Y48: 0.16500000000000001 | Z48: 32 | AA48: 153 | AB48: 1.8600000000000002e-002 | AC48: 1.3100000000000001e-002 | AD48: -4.1999999999999997e-003 | AE48: -6.4000000000000003e-003 | AF48: 89.77 | AG48: 92.15 | AH48: 0.37 | AI48: AA | AJ48: 4.58e-002 | AK48: =I48+100*T48 -> 135.90000000000001 | AL48: 129.9 | AM48: 100 | AN48: 37.7 | AO48: 87 | AP48: -3.1e-002 | AQ48: 50 | AR48: 海亮转债!
A49: 227 | B49: 奇精转债! | C49: 113524 | D49: 43472. | E49: 奇精机械 | F49: 603677 | G49: 家电 | H49: 零部件制 | I49: 109.58 | J49: 1.3100000000000001e-002 | K49: 1.0800000000000001e-002 | L49: 12.92 | M49: 5.4699999999999999e-002 | N49: 1.3 | O49: 3.0000000000000001e-003 | P49: 117.9 | Q49: 14.08 | R49: 2.55 | S49: 91.76 | T49: 0.19399999999999998 | U49: 转股中 | V49: 4年56天 | W49: 2年56天 | X49: 0.13300000000000001 | Y49: 0.122 | Z49: 3.3 | AA49: 25 | AB49: 1.8200000000000001e-002 | AC49: 1.04e-002 | AD49: -2.5000000000000001e-002 | AE49: -2.7699999999999999e-002 | AF49: 93.55 | AG49: 98.74 | AH49: 0.44 | AI49: AA | AJ49: 4.4600000000000001e-002 | AK49: =I49+100*T49 -> 128.97999999999999 | AL49: 127.4 | AM49: 72 | AN49: 28.7 | AO49: 15 | AP49: 6.5000000000000002e-002 | AQ49: 43 | AR49: 奇精转债!
A50: 120 | B50: 翔港转债 | C50: 113566 | D50: 43921. | E50: 翔港科技 | F50: 603499 | G50: 造纸包装 | H50: 包装材料 | I50: 113.33 | J50: 1.5300000000000001e-002 | K50: 5.1000000000000004e-003 | L50: 10.43 | M50: 3.0600000000000002e-002 | N50: 32 | O50: 0.17499999999999999 | P50: 124.5 | Q50: 10.77 | R50: 2.79 | S50: 96.84 | T50: 0.17000000000000001 | U50: 转股中 | V50: 5.36年 | W50: 3.36年 | X50: 7.5999999999999998e-002 | Y50: 7.400000000000001e-002 | Z50: 1.6 | AA50: 21 | AB50: 1.8100000000000002e-002 | AC50: 1.03e-002 | AD50: -2.2599999999999999e-002 | AE50: -2.5000000000000001e-002 | AF50: 80.66 | AG50: 84.14 | AH50: 0.67 | AI50: A+ | AJ50: 7.7800000000000008e-002 | AK50: =I50+100*T50 -> 130.32999999999998 | AL50: 129.8 | AM50: 99 | AN50: 45.7 | AO50: 173 | AP50: -8.3000000000000004e-002 | AQ50: 26 | AR50: 翔港转债
A51: 286 | B51: 时达转债! | C51: 128018 | D51: 43073. | E51: 新时达 | F51: 2527 | G51: 机械装备 | H51: 机器人及 | I51: 104.701 | J51: -1.5e-003 | K51: 4.0000000000000002e-004 | L51: 5.74 | M51: -5.1999999999999998e-003 | N51: 0.9 | O51: 1.e-003 | P51: 110.3 | Q51: 7.42 | R51: 1.41 | S51: 77.36 | T51: 0.35299999999999998 | U51: 转股中 | V51: 3年18天 | W51: 1年18天 | X51: 0.247 | Y51: 0.191 | Z51: 8.8 | AA51: 36 | AB51: 1.77e-002 | AC51: 1.1200000000000002e-002 | AD51: -1.5100000000000001e-002 | AE51: -1.95e-002 | AF51: 97.55 | AG51: 96.87 | AH51: 0.21 | AI51: AA | AJ51: 4.4600000000000001e-002 | AK51: =I51+100*T51 -> 140.00099999999998 | AL51: 132 | AM51: 124 | AN51: 34.5 | AO51: 51 | AP51: -3.0000000000000001e-003 | AQ51: 40 | AR51: 时达转债!
A52: 38 | B52: 联诚转债 | C52: 128120 | D52: 44060. | E52: 联诚精密 | F52: 2921 | G52: 汽车 | H52: 零部件制 | I52: 107.772 | J52: 1.e-002 | K52: 1.3100000000000001e-002 | L52: 22.58 | M52: 3.2000000000000001e-002 | N52: 6.2 | O52: 2.2000000000000002e-002 | P52: 118.4 | Q52: 24.37 | R52: 2.61 | S52: 92.65 | T52: 0.16300000000000001 | U52: 3月8天 | V52: 5.74年 | W52: 3.74年 | X52: 0.14099999999999999 | Y52: 0.13100000000000001 | Z52: 2.6 | AA52: 18 | AB52: 1.6899999999999998e-002 | AC52: 1.11e-002 | AD52: -7.8000000000000005e-003 | AE52: -1.e-002 | AF52: 75.55 | AG52: 73.88 | AH52: 0.72 | AI52: A | AJ52: 8.7799999999999989e-002 | AK52: =I52+100*T52 -> 124.072 | AL52: 122.9 | AM52: 29 | AN52: 47.3 | AO52: 186 | AP52: 6.4000000000000001e-002 | AQ52: 8 | AR52: 联诚转债
A53: 151 | B53: 华锋转债! | C53: 128082 | D53: 43836. | E53: 华锋股份 | F53: 2806 | G53: 电子 | H53: 元器件制 | I53: 112.311 | J53: -3.4999999999999996e-003 | K53: -2.5000000000000001e-003 | L53: 12.04 | M53: -8.199999999999999e-003 | N53: 1.9 | O53: 5.0000000000000001e-003 | P53: 122 | Q53: 11.71 | R53: 1.69 | S53: 102.82 | T53: 9.1999999999999998e-002 | U53: 转股中 | V53: 5年46天 | W53: 3年46天 | X53: 0.16600000000000001 | Y53: 0.17100000000000001 | Z53: 3.5 | AA53: 21 | AB53: 1.67e-002 | AC53: 9.1999999999999998e-003 | AD53: -2.0299999999999999e-002 | AE53: -2.3199999999999998e-002 | AF53: 82.46 | AG53: 84.02 | AH53: 0.72 | AI53: A+ | AJ53: 7.7800000000000008e-002 | AK53: =I53+100*T53 -> 121.51100000000001 | AL53: 121.8 | AM53: 23 | AN53: 37.8 | AO53: 89 | AP53: -1.6e-002 | AQ53: 53 | AR53: 华锋转债!
A54: 143 | B54: 森特转债 | C54: 113557 | D54: 43840. | E54: 森特股份 | F54: 603098 | G54: 建筑 | H54: 建筑工程 | I54: 111.01 | J54: 8.6e-003 | K54: 5.4000000000000003e-003 | L54: 9.79 | M54: 2.1899999999999999e-002 | N54: 2 | O54: 3.0000000000000001e-003 | P54: 120.7 | Q54: 10.11 | R54: 2.33 | S54: 96.83 | T54: 0.14599999999999999 | U54: 转股中 | V54: 5.17年 | W54: 3.17年 | X54: 0.128 | Y54: 0.124 | Z54: 6 | AA54: 47 | AB54: 1.67e-002 | AC54: 9.7000000000000003e-003 | AD54: -1.95e-002 | AE54: -2.18e-002 | AF54: 84.1 | AG54: 87.08 | AH54: 0.64 | AI54: AA- | AJ54: 6.6799999999999998e-002 | AK54: =I54+100*T54 -> 125.61 | AL54: 125.2 | AM54: 58 | AN54: 38.1 | AO54: 94 | AP54: 1.6e-002 | AQ54: 34 | AR54: 森特转债
A55: 1 | B55: 斯莱转债 | C55: 123067 | D55: 44119. | E55: 斯莱克 | F55: 300382 | G55: 机械装备 | H55: 专用设备 | I55: 110.2 | J55: 1.8e-003 | K55: -6.3e-003 | L55: 9.54 | M55: -6.3e-003 | N55: 102 | O55: 0.23899999999999999 | P55: 121.2 | Q55: 9.38 | R55: 5.41 | S55: 101.71 | T55: 8.4000000000000005e-002 | U55: 5月5天 | V55: 5.91年 | W55: 3.91年 | X55: 7.2000000000000008e-002 | Y55: 7.2999999999999995e-002 | Z55: 3.9 | AA55: 54 | AB55: 1.6500000000000001e-002 | AC55: 1.03e-002 | AD55: -1.3999999999999999e-002 | AE55: -1.5900000000000001e-002 | AF55: 80.2 | AG55: 83.34 | AH55: 0.71 | AI55: AA- | AJ55: 6.6799999999999998e-002 | AK55: =I55+100*T55 -> 118.60000000000001 | AL55: 118.7 | AM55: 6 | AN55: 35.4 | AO55: 63 | AP55: 2.7000000000000003e-002 | AQ55: 3 | AR55: 斯莱转债
A56: 167 | B56: 金轮转债! | C56: 128076 | D56: 43777. | E56: 金轮股份 | F56: 2722 | G56: 机械装备 | H56: 专用设备 | I56: 106.1 | J56: -8.0000000000000004e-004 | K56: 3.8e-003 | L56: 12.93 | M56: 5.4000000000000003e-003 | N56: 2.7 | O56: 1.2e-002 | P56: 114.9 | Q56: 14.76 | R56: 1.22 | S56: 87.6 | T56: 0.21100000000000002 | U56: 转股中 | V56: 4.99年 | W56: 2.99年 | X56: 9.4e-002 | Y56: 8.3000000000000004e-002 | Z56: 2.1 | AA56: 23 | AB56: 1.6399999999999998e-002 | AC56: 1.09e-002 | AD56: -8.199999999999999e-003 | AE56: -1.03e-002 | AF56: 84.78 | AG56: 84.2 | AH56: 0.56 | AI56: AA- | AJ56: 6.5599999999999992e-002 | AK56: =I56+100*T56 -> 127.19999999999999 | AL56: 124.6 | AM56: 48 | AN56: 39.8 | AO56: 117 | AP56: -1.9e-002 | AQ56: 41 | AR56: 金轮转债!
A57: 144 | B57: 孚日转债! | C57: 128087 | D57: 43846. | E57: 孚日股份 | F57: 2083 | G57: 服装纺织 | H57: 家纺 | I57: 104.651 | J57: -1.4000000000000002e-003 | K57: -1.3100000000000001e-002 | L57: 5.3 | M57: -3.2799999999999996e-002 | N57: 24 | O57: 3.6000000000000004e-002 | P57: 113.3 | Q57: 6.3 | R57: 1.26 | S57: 84.13 | T57: 0.24399999999999999 | U57: 转股中 | V57: 5年59天 | W57: 3年59天 | X57: 0.13500000000000001 | Y57: 0.114 | Z57: 6.5 | AA57: 48 | AB57: 1.5800000000000002e-002 | AC57: 1.1000000000000001e-002 | AD57: -2.5000000000000001e-003 | AE57: -4.6999999999999993e-003 | AF57: 89.59 | AG57: 90.37 | AH57: 0.44 | AI57: AA | AJ57: 4.58e-002 | AK57: =I57+100*T57 -> 129.05099999999999 | AL57: 125.2 | AM57: 57 | AN57: 34.8 | AO57: 56 | AP57: 5.2999999999999999e-002 | AQ57: 50 | AR57: 孚日转债!
A58: 5 | B58: 宝莱转债 | C58: 123065 | D58: 44098. | E58: 宝莱特 | F58: 300246 | G58: 医药 | H58: 医疗器械 | I58: 110.9 | J58: 1.38e-002 | K58: 1.4999999999999999e-002 | L58: 37.62 | M58: 4.6199999999999998e-002 | N58: 28 | O58: 0.11800000000000001 | P58: 121.4 | Q58: 40.54 | R58: 7.24 | S58: 92.8 | T58: 0.19500000000000001 | U58: 4月23天 | V58: 5.88年 | W58: 3.88年 | X58: 4.0000000000000001e-002 | Y58: 3.7000000000000005e-002 | Z58: 2.2 | AA58: 55 | AB58: 1.5800000000000002e-002 | AC58: 9.4999999999999998e-003 | AD58: -1.52e-002 | AE58: -1.72e-002 | AF58: 80.53 | AG58: 83.68 | AH58: 0.62 | AI58: AA- | AJ58: 6.6799999999999998e-002 | AK58: =I58+100*T58 -> 130.40000000000001 | AL58: 129 | AM58: 90 | AN58: 45.3 | AO58: 169 | AP58: 3.1e-002 | AQ58: 6 | AR58: 宝莱转债
A59: 272 | B59: 双环转债! | C59: 128032 | D59: 43125. | E59: 双环传动 | F59: 2472 | G59: 机械装备 | H59: 通用设备 | I59: 105.1 | J59: 7.7000000000000002e-003 | K59: -8.0000000000000002e-003 | L59: 6.51 | M59: -4.5999999999999999e-003 | N59: 2.2 | O59: 2.e-003 | P59: 110.3 | Q59: 9.89 | R59: 1.36 | S59: 65.82 | T59: 0.59699999999999998 | U59: 转股中 | V59: 3.18年 | W59: 1.18年 | X59: 0.22399999999999998 | Y59: 0.14699999999999999 | Z59: 10 | AA59: 45 | AB59: 1.5600000000000001e-002 | AC59: 9.4999999999999998e-003 | AD59: -1.6399999999999998e-002 | AE59: -2.0400000000000001e-002 | AF59: 96.98 | AG59: 96.3 | AH59: 0.08 | AI59: AA | AJ59: 4.4600000000000001e-002 | AK59: =I59+100*T59 -> 164.79999999999998 | AL59: 144.4 | AM59: 222 | AN59: 47.4 | AO59: 187 | AP59: -4.9000000000000002e-002 | AQ59: 46 | AR59: 双环转债!
A60: 12 | B60: 齐翔转2 | C60: 128128 | D60: 44089. | E60: 齐翔腾达 | F60: 2408 | G60: 化工 | H60: 化工 | I60: 105.7 | J60: -9.4999999999999998e-003 | K60: -1.5e-003 | L60: 7.82 | M60: -1.8799999999999997e-002 | N60: 54 | O60: 1.7000000000000001e-002 | P60: 115.3 | Q60: 8.22 | R60: 1.73 | S60: 95.13 | T60: 0.111 | U60: 4月10天 | V60: 5.84年 | W60: 3.84年 | X60: 0.215 | Y60: 0.20499999999999999 | Z60: 30 | AA60: 139 | AB60: 1.5300000000000001e-002 | AC60: 1.0500000000000001e-002 | AD60: -4.7999999999999996e-003 | AE60: -6.6e-003 | AF60: 86.83 | AG60: 89.21 | AH60: 0.58 | AI60: AA | AJ60: 4.58e-002 | AK60: =I60+100*T60 -> 116.8 | AL60: 116.3 | AM60: 1 | AN60: 27.1 | AO60: 11 | AP60: -1.e-002 | AQ60: 18 | AR60: 齐翔转2
A61: 98 | B61: 华体转债! | C61: 113574 | D61: 43948. | E61: 华体科技 | F61: 603679 | G61: 城市公用 | H61: 城市公用 | I61: 107.47 | J61: 2.8999999999999998e-003 | K61: -4.3e-003 | L61: 23.57 | M61: -3.8e-003 | N61: 0.9 | O61: 4.0000000000000001e-003 | P61: 116.4 | Q61: 33.99 | R61: 3.38 | S61: 69.34 | T61: 0.55000000000000004 | U61: 转股中 | V61: 5.45年 | W61: 3.45年 | X61: 6.2e-002 | Y61: 4.2999999999999997e-002 | Z61: 2.1 | AA61: 34 | AB61: 1.5100000000000001e-002 | AC61: 9.5999999999999992e-003 | AD61: -7.6e-003 | AE61: -1.01e-002 | AF61: 80.05 | AG61: 78.2 | AH61: 0.37 | AI61: A+ | AJ61: 7.7800000000000008e-002 | AK61: =I61+100*T61 -> 162.47 | AL61: 145.6 | AM61: 228 | AN61: 65.5 | AO61: 259 | AP61: -2.6000000000000002e-002 | AQ61: 11 | AR61: 华体转债!
A62: 246 | B62: 凯中转债! | C62: 128042 | D62: 43346. | E62: 凯中精密 | F62: 2823 | G62: 能源电力 | H62: 电力设备 | I62: 110.051 | J62: 5.5000000000000005e-003 | K62: 4.3e-003 | L62: 11.57 | M62: 2.4799999999999999e-002 | N62: 0.6 | O62: 1.e-003 | P62: 116.3 | Q62: 12.96 | R62: 2.63 | S62: 89.27 | T62: 0.23300000000000001 | U62: 转股中 | V62: 3.78年 | W62: 1.78年 | X62: 0.125 | Y62: 0.11199999999999999 | Z62: 4.2 | AA62: 33 | AB62: 1.4999999999999999e-002 | AC62: 7.1999999999999998e-003 | AD62: -3.4700000000000002e-002 | AE62: -3.73e-002 | AF62: 94.49 | AG62: 98.91 | AH62: 0.4 | AI62: AA | AJ62: 4.4600000000000001e-002 | AK62: =I62+100*T62 -> 133.351 | AL62: 130.8 | AM62: 113 | AN62: 31.9 | AO62: 34 | AP62: 5.9000000000000004e-002 | AQ62: 23 | AR62: 凯中转债!
A63: 194 | B63: 创维转债! | C63: 127013 | D63: 43601. | E63: 创维数字 | F63: 810 | G63: 电子 | H63: 电子产品 | I63: 110.4 | J63: 0. | K63: -5.6999999999999993e-003 | L63: 9.84 | M63: -1.4999999999999999e-002 | N63: 6 | O63: 6.0000000000000001e-003 | P63: 117.9 | Q63: 11.39 | R63: 2.78 | S63: 86.39 | T63: 0.27800000000000002 | U63: 转股中 | V63: 4.49年 | W63: 2.49年 | X63: 9.3000000000000013e-002 | Y63: 8.1000000000000003e-002 | Z63: 9.8 | AA63: 105 | AB63: 1.4999999999999999e-002 | AC63: 7.9000000000000008e-003 | AD63: -2.46e-002 | AE63: -2.7000000000000003e-002 | AF63: 92.2 | AG63: 97.31 | AH63: 0.38 | AI63: AA | AJ63: 4.4600000000000001e-002 | AK63: =I63+100*T63 -> 138.20000000000002 | AL63: 134.4 | AM63: 145 | AN63: 37.1 | AO63: 79 | AP63: -1.8000000000000002e-002 | AQ63: 23 | AR63: 创维转债!
A64: 195 | B64: 核能转债! | C64: 113026 | D64: 43593. | E64: 中国核电 | F64: 601985 | G64: 能源电力 | H64: 核电 | I64: 103.07 | J64: -2.9999999999999997e-004 | K64: 2.e-003 | L64: 4.59 | M64: 6.6e-003 | N64: 9.2 | O64: 1.e-003 | P64: 109.8 | Q64: 6.08 | R64: 1.42 | S64: 75.49 | T64: 0.36499999999999999 | U64: 转股中 | V64: 4.49年 | W64: 2.49年 | X64: 0.109 | Y64: 8.199999999999999e-002 | Z64: 78 | AA64: 714 | AB64: 1.4499999999999999e-002 | AC64: 1.03e-002 | AD64: 8.0000000000000004e-004 | AE64: -1.6000000000000001e-003 | AF64: 93.27 | AG64: 92.56 | AH64: 0.26 | AI64: AAA | AJ64: 3.9599999999999996e-002 | AK64: =I64+100*T64 -> 139.56999999999999 | AL64: 130.6 | AM64: 109 | AN64: 37.4 | AO64: 83 | AP64: 1.8000000000000002e-002 | AQ64: 49 | AR64: 核能转债!
A65: 47 | B65: 瀛通转债 | C65: 128118 | D65: 44048. | E65: 瀛通通讯 | F65: 2861 | G65: 电子 | H65: 电子产品 | I65: 112.901 | J65: -1.3899999999999999e-002 | K65: 1.34e-002 | L65: 24.82 | M65: -8.0000000000000004e-004 | N65: 1.6 | O65: 5.0000000000000001e-003 | P65: 122.1 | Q65: 27.53 | R65: 2.87 | S65: 90.16 | T65: 0.252 | U65: 2月21天 | V65: 5.70年 | W65: 3.70年 | X65: 9.9000000000000005e-002 | Y65: 8.900000000000001e-002 | Z65: 3 | AA65: 30 | AB65: 1.41e-002 | AC65: 7.4000000000000003e-003 | AD65: -1.9699999999999999e-002 | AE65: -2.2000000000000002e-002 | AF65: 81.68 | AG65: 85.17 | AH65: 0.58 | AI65: AA- | AJ65: 6.6799999999999998e-002 | AK65: =I65+100*T65 -> 138.101 | AL65: 135.6 | AM65: 163 | AN65: 50.5 | AO65: 199 | AP65: 4.0000000000000001e-003 | AQ65: 5 | AR65: 瀛通转债
A66: 298 | B66: 顺昌转债!! | C66: 128010 | D66: 42423. | E66: 澳洋顺昌 | F66: 2245 | G66: 交通运输 | H66: 物流业 | I66: 107.752 | J66: 2.8000000000000004e-003 | K66: -2.8000000000000004e-003 | L66: 6.4 | M66: -1.6000000000000001e-003 | N66: 3.7 | O66: 6.9999999999999993e-003 | P66: 109.6 | Q66: 9.25 | R66: 2.93 | S66: 69.19 | T66: 0.55700000000000005 | U66: 转股中 | V66: 1.26年 | W66: 回售中 | X66: 8.1000000000000003e-002 | Y66: 5.5999999999999994e-002 | Z66: 5.1 | AA66: 63 | AB66: 1.37e-002 | AC66: -5.0000000000000001e-004 | AD66: 回售中 | AE66: 回售中 | AF66: 100.27 | AG66: 103.98 | AH66: 0.02 | AI66: AA | AJ66: 4.3200000000000002e-002 | AK66: =I66+100*T66 -> 163.452 | AL66: 146.3 | AM66: 230 | AN66: 42.3 | AO66: 141 | AP66: 0.122 | AQ66: 40 | AR66: 顺昌转债!!
A67: 201 | B67: 海环转债! | C67: 113532 | D67: 43579. | E67: 海峡环保 | F67: 603817 | G67: 城市公用 | H67: 三废处理 | I67: 106.4 | J67: 4.7999999999999996e-003 | K67: -1.e-003 | L67: 6.48 | M67: 9.300000000000001e-003 | N67: 0.9 | O67: 2.e-003 | P67: 112.9 | Q67: 7.69 | R67: 1.74 | S67: 84.27 | T67: 0.26300000000000001 | U67: 转股中 | V67: 4.45年 | W67: 2.45年 | X67: 0.158 | Y67: 0.13300000000000001 | Z67: 4.6 | AA67: 29 | AB67: 1.37e-002 | AC67: 8.3000000000000001e-003 | AD67: -1.1000000000000001e-002 | AE67: -1.3500000000000002e-002 | AF67: 92.34 | AG67: 93.34 | AH67: 0.4 | AI67: AA | AJ67: 4.4600000000000001e-002 | AK67: =I67+100*T67 -> 132.70000000000002 | AL67: 128.5 | AM67: 86 | AN67: 35.2 | AO67: 60 | AP67: 1.1000000000000001e-002 | AQ67: 25 | AR67: 海环转债!
A68: 37 | B68: 沪工转债 | C68: 113593 | D68: 44053. | E68: 上海沪工 | F68: 603131 | G68: 机械装备 | H68: 通用设备 | I68: 112.8 | J68: -9.0000000000000011e-003 | K68: 1.43e-002 | L68: 21.46 | M68: 6.9999999999999993e-003 | N68: 7.2 | O68: 1.6e-002 | P68: 121.6 | Q68: 21.32 | R68: 5.63 | S68: 100.66 | T68: 0.121 | U68: 3月8天 | V68: 5.75年 | W68: 3.75年 | X68: 5.9000000000000004e-002 | Y68: 5.9000000000000004e-002 | Z68: 4 | AA68: 68 | AB68: 1.34e-002 | AC68: 6.8999999999999999e-003 | AD68: -1.9299999999999998e-002 | AE68: -2.1499999999999998e-002 | AF68: 78.24 | AG68: 79.8 | AH68: 0.74 | AI68: A+ | AJ68: 7.7800000000000008e-002 | AK68: =I68+100*T68 -> 124.89999999999999 | AL68: 124.9 | AM68: 53 | AN68: 45.1 | AO68: 168 | AP68: 0.111 | AQ68: 5 | AR68: 沪工转债
A69: 15 | B69: 广汇转债 | C69: 110072 | D69: 44089. | E69: 广汇汽车 | F69: 600297 | G69: 汽车 | H69: 分销、售 | I69: 106.06 | J69: -8.8000000000000005e-003 | K69: 2.3e-003 | L69: 3.39 | M69: -1.4499999999999999e-002 | N69: 45 | O69: 1.3000000000000001e-002 | P69: 114.5 | Q69: 4.03 | R69: 0.71 | S69: 84.12 | T69: 0.26100000000000001 | U69: 4月8天 | V69: 5.83年 | W69: 3.83年 | X69: 0.12300000000000001 | Y69: 0.10300000000000001 | Z69: 34 | AA69: 275 | AB69: 1.34e-002 | AC69: 8.8999999999999999e-003 | AD69: -7.3000000000000001e-003 | AE69: -8.8000000000000005e-003 | AF69: 86.86 | AG69: 89.49 | AH69: 0.45 | AI69: AA+ | AJ69: 4.3799999999999999e-002 | AK69: =I69+100*T69 -> 132.16 | AL69: 128 | AM69: 81 | AN69: 38.5 | AO69: 102 | AP69: -5.4000000000000006e-002 | AQ69: 13 | AR69: 广汇转债
A70: 94 | B70: 鲁泰转债 | C70: 127016 | D70: 43964. | E70: 鲁 泰Ａ | F70: 726 | G70: 服装纺织 | H70: 纺织行业 | I70: 108.295 | J70: -4.7999999999999996e-003 | K70: -8.9999999999999998e-004 | L70: 7.72 | M70: -1.2800000000000001e-002 | N70: 5.4 | O70: 4.0000000000000001e-003 | P70: 116.2 | Q70: 8.91 | R70: 0.85 | S70: 86.64 | T70: 0.25 | U70: 转股中 | V70: 5.47年 | W70: 3.47年 | X70: 0.21100000000000002 | Y70: 0.183 | Z70: 14 | AA70: 66 | AB70: 1.32e-002 | AC70: 7.9000000000000008e-003 | AD70: -1.2e-002 | AE70: -1.3899999999999999e-002 | AF70: 88.86 | AG70: 92.32 | AH70: 0.45 | AI70: AA+ | AJ70: 4.3799999999999999e-002 | AK70: =I70+100*T70 -> 133.29500000000002 | AL70: 129.9 | AM70: 101 | AN70: 37.6 | AO70: 86 | AP70: 2.9999999999999999e-002 | AQ70: 22 | AR70: 鲁泰转债
A71: 112 | B71: 百达转债 | C71: 113570 | D71: 43929. | E71: 百达精工 | F71: 603331 | G71: 机械装备 | H71: 机械装备 | I71: 107.8 | J71: -7.4000000000000003e-003 | K71: 1.e-002 | L71: 10.74 | M71: 3.7000000000000002e-003 | N71: 3.6 | O71: 1.2e-002 | P71: 115.3 | Q71: 11.54 | R71: 1.75 | S71: 93.07 | T71: 0.158 | U71: 转股中 | V71: 5.39年 | W71: 3.39年 | X71: 0.14599999999999999 | Y71: 0.13600000000000001 | Z71: 2.8 | AA71: 19 | AB71: 1.2800000000000001e-002 | AC71: 7.6e-003 | AD71: -1.0700000000000001e-002 | AE71: -1.2699999999999999e-002 | AF71: 79.74 | AG71: 77.65 | AH71: 0.7 | AI71: A+ | AJ71: 7.7800000000000008e-002 | AK71: =I71+100*T71 -> 123.59999999999999 | AL71: 122.5 | AM71: 26 | AN71: 42.8 | AO71: 147 | AP71: -1.8000000000000002e-002 | AQ71: 32 | AR71: 百达转债
A72: 244 | B72: 苏农转债! | C72: 113516 | D72: 43332. | E72: 苏农银行 | F72: 603323 | G72: 金融 | H72: 银行行业 | I72: 109.1 | J72: 8.199999999999999e-003 | K72: -2.7000000000000001e-003 | L72: 4.78 | M72: 1.49e-002 | N72: 24 | O72: 1.7000000000000001e-002 | P72: 114.3 | Q72: 5.52 | R72: 0.75 | S72: 86.59 | T72: 0.26000000000000001 | U72: 转股中 | V72: 3.79年 | W72: 无权 | X72: 0.14999999999999999 | Y72: 0.13 | Z72: 13 | AA72: 86 | AB72: 1.26e-002 | AC72: 5.6999999999999993e-003 | AD72: 无权 | AE72: 无权 | AF72: 无权 | AG72: 97.88 | AH72: 0.37 | AI72: AA+ | AJ72: 4.2599999999999999e-002 | AK72: =I72+100*T72 -> 135.09999999999999 | AL72: 131.6 | AM72: 119 | AN72: 33.7 | AO72: 48 | AP72: 1.9e-002 | AQ72: 36 | AR72: 苏农转债!
A73: 14 | B73: 精达转债 | C73: 110074 | D73: 44095. | E73: 精达股份 | F73: 600577 | G73: 电子 | H73: 电子产品 | I73: 109.38 | J73: -5.6000000000000008e-003 | K73: 2.5999999999999999e-003 | L73: 3.43 | M73: -5.7999999999999996e-003 | N73: 12 | O73: 1.3999999999999999e-002 | P73: 117.3 | Q73: 3.75 | R73: 1.87 | S73: 91.47 | T73: 0.19600000000000001 | U73: 4月9天 | V73: 5.83年 | W73: 3.83年 | X73: 0.11900000000000001 | Y73: 0.109 | Z73: 7.9 | AA73: 66 | AB73: 1.23e-002 | AC73: 6.9999999999999993e-003 | AD73: -1.3100000000000001e-002 | AE73: -1.49e-002 | AF73: 86.92 | AG73: 90.77 | AH73: 0.53 | AI73: AA | AJ73: 4.58e-002 | AK73: =I73+100*T73 -> 128.97999999999999 | AL73: 127.3 | AM73: 71 | AN73: 36.5 | AO73: 73 | AP73: -4.0999999999999995e-002 | AQ73: 6 | AR73: 精达转债
A74: 232 | B74: 山鹰转债 | C74: 110047 | D74: 43444. | E74: 山鹰纸业 | F74: 600567 | G74: 造纸包装 | H74: 包装用纸 | I74: 112.51 | J74: 1.8e-003 | K74: 1.1000000000000001e-003 | L74: 3.14 | M74: 6.4000000000000003e-003 | N74: 12 | O74: 5.0000000000000001e-003 | P74: 118.1 | Q74: 3.34 | R74: 1.02 | S74: 94.01 | T74: 0.19699999999999998 | U74: 转股中 | V74: 4年33天 | W74: 2年33天 | X74: 0.159 | Y74: 0.14999999999999999 | Z74: 23 | AA74: 144 | AB74: 1.2199999999999999e-002 | AC74: 4.3e-003 | AD74: -3.7000000000000005e-002 | AE74: -3.9800000000000002e-002 | AF74: 94.24 | AG74: 99.95 | AH74: 0.45 | AI74: AA+ | AJ74: 4.2599999999999999e-002 | AK74: =I74+100*T74 -> 132.21000000000001 | AL74: 131 | AM74: 115 | AN74: 31.1 | AO74: 26 | AP74: -6.0000000000000001e-003 | AQ74: 34 | AR74: 山鹰转债
A75: 46 | B75: 宁建转债 | C75: 113036 | D75: 44049. | E75: 宁波建工 | F75: 601789 | G75: 建筑 | H75: 建筑工程 | I75: 109.75 | J75: -1.1299999999999999e-002 | K75: 1.83e-002 | L75: 4.39 | M75: 1.3899999999999999e-002 | N75: 2.1 | O75: 3.0000000000000001e-003 | P75: 117.3 | Q75: 4.86 | R75: 1.47 | S75: 90.33 | T75: 0.215 | U75: 2月24天 | V75: 5.71年 | W75: 3.71年 | X75: 0.126 | Y75: 0.114 | Z75: 5.4 | AA75: 43 | AB75: 1.1899999999999999e-002 | AC75: 6.5000000000000006e-003 | AD75: -1.44e-002 | AE75: -1.6200000000000003e-002 | AF75: 87.39 | AG75: 91.26 | AH75: 0.51 | AI75: AA | AJ75: 4.58e-002 | AK75: =I75+100*T75 -> 131.25 | AL75: 129.2 | AM75: 92 | AN75: 37.9 | AO75: 91 | AP75: -2.1000000000000001e-002 | AQ75: 5 | AR75: 宁建转债
A76: 199 | B76: 司尔转债! | C76: 128064 | D76: 43592. | E76: 司尔特 | F76: 2538 | G76: 化工 | H76: 农化 | I76: 109.31 | J76: -1.52e-002 | K76: 1.0700000000000001e-002 | L76: 5.76 | M76: -8.6e-003 | N76: 6.7 | O76: 8.0000000000000002e-003 | P76: 114.9 | Q76: 6.07 | R76: 1.1 | S76: 94.89 | T76: 0.152 | U76: 转股中 | V76: 4.47年 | W76: 2.47年 | X76: 0.193 | Y76: 0.184 | Z76: 8 | AA76: 41 | AB76: 1.1399999999999999e-002 | AC76: 5.4000000000000003e-003 | AD76: -2.1099999999999997e-002 | AE76: -2.35e-002 | AF76: 92.28 | AG76: 94.92 | AH76: 0.52 | AI76: AA | AJ76: 4.4600000000000001e-002 | AK76: =I76+100*T76 -> 124.51000000000001 | AL76: 123.7 | AM76: 38 | AN76: 28.8 | AO76: 16 | AP76: -5.4000000000000006e-002 | AQ76: 56 | AR76: 司尔转债!
A77: 97 | B77: 利群转债! | C77: 113033 | D77: 43942. | E77: 利群股份 | F77: 601366 | G77: 商业零售 | H77: 商场 | I77: 108.68 | J77: -1.21e-002 | K77: 5.0000000000000001e-004 | L77: 6.64 | M77: -2.06e-002 | N77: 5.4 | O77: 3.0000000000000001e-003 | P77: 115.3 | Q77: 7.01 | R77: 1.29 | S77: 94.72 | T77: 0.14699999999999999 | U77: 转股中 | V77: 5.45年 | W77: 3.45年 | X77: 0.315 | Y77: 0.29799999999999999 | Z77: 18 | AA77: 57 | AB77: 1.11e-002 | AC77: 6.0000000000000001e-003 | AD77: -1.2699999999999999e-002 | AE77: -1.47e-002 | AF77: 88.43 | AG77: 90.78 | AH77: 0.56 | AI77: AA | AJ77: 4.58e-002 | AK77: =I77+100*T77 -> 123.38000000000001 | AL77: 122.6 | AM77: 28 | AN77: 31.9 | AO77: 32 | AP77: -3.9e-002 | AQ77: 35 | AR77: 利群转债!
A78: 127 | B78: 星帅转债 | C78: 128094 | D78: 43880. | E78: 星帅尔 | F78: 2860 | G78: 家电 | H78: 零部件制 | I78: 114.935 | J78: -4.0000000000000002e-004 | K78: -3.2000000000000002e-003 | L78: 14.38 | M78: -4.7999999999999996e-003 | N78: 0.4 | O78: 1.e-003 | P78: 121.5 | Q78: 13.95 | R78: 3.2 | S78: 103.08 | T78: 0.115 | U78: 转股中 | V78: 5.24年 | W78: 3.24年 | X78: 9.8000000000000004e-002 | Y78: 0.10099999999999999 | Z78: 2.8 | AA78: 29 | AB78: 1.09e-002 | AC78: 3.8e-003 | AD78: -2.76e-002 | AE78: -3.0099999999999998e-002 | AF78: 81.3 | AG78: 82.85 | AH78: 0.74 | AI78: A+ | AJ78: 7.7800000000000008e-002 | AK78: =I78+100*T78 -> 126.435 | AL78: 126.8 | AM78: 69 | AN78: 43.9 | AO78: 155 | AP78: -3.0000000000000001e-003 | AQ78: 28 | AR78: 星帅转债
A79: 48 | B79: 道恩转债 | C79: 128117 | D79: 44032. | E79: 道恩股份 | F79: 2838 | G79: 化工 | H79: 橡胶塑料 | I79: 116.38 | J79: 1.32e-002 | K79: 2.5999999999999999e-003 | L79: 31.08 | M79: 2.1700000000000001e-002 | N79: 22 | O79: 5.0999999999999997e-002 | P79: 123.5 | Q79: 29.07 | R79: 7.79 | S79: 106.91 | T79: 8.900000000000001e-002 | U79: 2月21天 | V79: 5.70年 | W79: 3.70年 | X79: 2.7999999999999997e-002 | Y79: 2.9999999999999999e-002 | Z79: 3.6 | AA79: 127 | AB79: 1.0700000000000001e-002 | AC79: 3.7000000000000002e-003 | AD79: -2.9300000000000003e-002 | AE79: -3.1099999999999999e-002 | AF79: 81.06 | AG79: 86.01 | AH79: 0.73 | AI79: AA- | AJ79: 6.6799999999999998e-002 | AK79: =I79+100*T79 -> 125.28 | AL79: 125.8 | AM79: 61 | AN79: 39.8 | AO79: 118 | AP79: 7.0000000000000007e-002 | AQ79: 9 | AR79: 道恩转债
A80: 212 | B80: 苏银转债! | C80: 110053 | D80: 43558. | E80: 江苏银行 | F80: 600919 | G80: 金融 | H80: 银行行业 | I80: 113.9 | J80: 7.8000000000000005e-003 | K80: -2.3999999999999998e-003 | L80: 6.3 | M80: 1.4499999999999999e-002 | N80: 149 | O80: 6.9999999999999993e-003 | P80: 119.1 | Q80: 7.28 | R80: 0.63 | S80: 86.54 | T80: 0.316 | U80: 转股中 | V80: 4.40年 | W80: 无权 | X80: 0.27500000000000002 | Y80: 0.23800000000000002 | Z80: 200 | AA80: 727 | AB80: 1.0500000000000001e-002 | AC80: 2.8000000000000004e-003 | AD80: 无权 | AE80: 无权 | AF80: 无权 | AG80: 100.92 | AH80: 0.37 | AI80: AAA | AJ80: 3.9599999999999996e-002 | AK80: =I80+100*T80 -> 145.5 | AL80: 141.3 | AM80: 203 | AN80: 40.3 | AO80: 121 | AP80: -4.0000000000000001e-003 | AQ80: 46 | AR80: 苏银转债!
A81: 10 | B81: 嘉泽转债! | C81: 113039 | D81: 44091. | E81: 嘉泽新能 | F81: 601619 | G81: 能源电力 | H81: 风能 | I81: 106.58 | J81: 2.0000000000000001e-004 | K81: -3.7000000000000002e-003 | L81: 3.35 | M81: -5.8999999999999999e-003 | N81: 18 | O81: 1.3000000000000001e-002 | P81: 113.1 | Q81: 3.57 | R81: 2.07 | S81: 93.84 | T81: 0.13600000000000001 | U81: 4月13天 | V81: 5.85年 | W81: 3.85年 | X81: 0.187 | Y81: 0.17600000000000002 | Z81: 13 | AA81: 69 | AB81: 1.04e-002 | AC81: 6.3e-003 | AD81: -7.0999999999999995e-003 | AE81: -8.8000000000000005e-003 | AF81: 86.68 | AG81: 87.45 | AH81: 0.59 | AI81: AA | AJ81: 4.58e-002 | AK81: =I81+100*T81 -> 120.18000000000001 | AL81: 119.3 | AM81: 7 | AN81: 31.9 | AO81: 33 | AP81: 4.4000000000000004e-002 | AQ81: 8 | AR81: 嘉泽转债!
A82: 297 | B82: 海印转债! | C82: 127003 | D82: 42552. | E82: 海印股份 | F82: 861 | G82: 商业零售 | H82: 商场 | I82: 110.03 | J82: -1.4000000000000002e-003 | K82: -1.1000000000000001e-003 | L82: 2.68 | M82: -1.11e-002 | N82: 2.1 | O82: 3.0000000000000001e-003 | P82: 111.8 | Q82: 3 | R82: 1.68 | S82: 89.33 | T82: 0.23199999999999998 | U82: 转股中 | V82: 1.64年 | W82: 回售中 | X82: 0.10800000000000001 | Y82: 9.6999999999999989e-002 | Z82: 6.7 | AA82: 62 | AB82: 9.8999999999999991e-003 | AC82: -3.3e-003 | AD82: 回售中 | AE82: 回售中 | AF82: 100.3 | AG82: 104.4 | AH82: 0.23 | AI82: AA | AJ82: 4.3200000000000002e-002 | AK82: =I82+100*T82 -> 133.22999999999999 | AL82: 130.7 | AM82: 111 | AN82: 26.3 | AO82: 9 | AP82: -0.159 | AQ82: 74 | AR82: 海印转债!
A83: 198 | B83: 核建转债! | C83: 113024 | D83: 43581. | E83: 中国核建 | F83: 601611 | G83: 建筑 | H83: 建筑工程 | I83: 105.35 | J83: -1.4000000000000002e-003 | K83: 1.e-004 | L83: 7.78 | M83: -3.8e-003 | N83: 12 | O83: 4.0000000000000001e-003 | P83: 109.7 | Q83: 9.76 | R83: 1.99 | S83: 79.71 | T83: 0.32200000000000001 | U83: 转股中 | V83: 4.47年 | W83: 2.47年 | X83: 0.14499999999999999 | Y83: 0.11599999999999999 | Z83: 30 | AA83: 206 | AB83: 9.300000000000001e-003 | AC83: 5.1999999999999998e-003 | AD83: -7.9000000000000008e-003 | AE83: -1.0200000000000001e-002 | AF83: 93.24 | AG83: 92.53 | AH83: 0.33 | AI83: AAA | AJ83: 3.9599999999999996e-002 | AK83: =I83+100*T83 -> 137.55000000000001 | AL83: 131 | AM83: 114 | AN83: 37.7 | AO83: 88 | AP83: 4.4999999999999998e-002 | AQ83: 43 | AR83: 核建转债!
A84: 155 | B84: 白电转债 | C84: 113549 | D84: 43810. | E84: 白云电器 | F84: 603861 | G84: 能源电力 | H84: 电力设备 | I84: 109.93 | J84: 1.1999999999999999e-003 | K84: -5.0000000000000001e-004 | L84: 8.42 | M84: 1.1999999999999999e-003 | N84: 0.5 | O84: 0. | P84: 115.1 | Q84: 8.88 | R84: 1.65 | S84: 94.82 | T84: 0.159 | U84: 转股中 | V84: 5年27天 | W84: 3年27天 | X84: 0.23699999999999999 | Y84: 0.22399999999999998 | Z84: 8.8 | AA84: 37 | AB84: 9.300000000000001e-003 | AC84: 3.9000000000000003e-003 | AD84: -1.83e-002 | AE84: -2.0400000000000001e-002 | AF84: 89.74 | AG84: 92.12 | AH84: 0.56 | AI84: AA | AJ84: 4.58e-002 | AK84: =I84+100*T84 -> 125.83000000000001 | AL84: 125 | AM84: 54 | AN84: 32.9 | AO84: 42 | AP84: -9.0000000000000011e-003 | AQ84: 31 | AR84: 白电转债
A85: 35 | B85: 淳中转债 | C85: 113594 | D85: 44071. | E85: 淳中科技 | F85: 603516 | G85: 电子 | H85: 电子产品 | I85: 115.3 | J85: -1.3999999999999999e-002 | K85: 2.7000000000000001e-003 | L85: 35.02 | M85: -1.7899999999999999e-002 | N85: 1.7 | O85: 5.0000000000000001e-003 | P85: 121.4 | Q85: 39.37 | R85: 5.5 | S85: 88.95 | T85: 0.29600000000000004 | U85: 3月10天 | V85: 5.75年 | W85: 3.75年 | X85: 6.4000000000000001e-002 | Y85: 5.7000000000000002e-002 | Z85: 3 | AA85: 47 | AB85: 9.1999999999999998e-003 | AC85: 2.8000000000000004e-003 | AD85: -2.4900000000000002e-002 | AE85: -2.7000000000000003e-002 | AF85: 78.23 | AG85: 79.67 | AH85: 0.63 | AI85: A+ | AJ85: 7.7800000000000008e-002 | AK85: =I85+100*T85 -> 144.90000000000001 | AL85: 141.6 | AM85: 204 | AN85: 62 | AO85: 253 | AP85: 2.5000000000000001e-002 | AQ85: 4 | AR85: 淳中转债
A86: 253 | B86: 湖广转债! | C86: 127007 | D86: 43313. | E86: 湖北广电 | F86: 665 | G86: 传媒娱乐 | H86: 影视娱乐 | I86: 108.735 | J86: -7.000000000000001e-004 | K86: 3.3e-003 | L86: 5 | M86: 6.0000000000000001e-003 | N86: 2.2 | O86: 2.e-003 | P86: 112.3 | Q86: 5.58 | R86: 0.75 | S86: 89.61 | T86: 0.21299999999999999 | U86: 转股中 | V86: 3.69年 | W86: 1.69年 | X86: 0.248 | Y86: 0.222 | Z86: 12 | AA86: 49 | AB86: 8.8999999999999999e-003 | AC86: 2.8000000000000004e-003 | AD86: -2.9999999999999999e-002 | AE86: -3.2799999999999996e-002 | AF86: 95.19 | AG86: 96.56 | AH86: 0.43 | AI86: AA+ | AJ86: 4.2599999999999999e-002 | AK86: =I86+100*T86 -> 130.035 | AL86: 127.9 | AM86: 78 | AN86: 31.3 | AO86: 27 | AP86: -2.3e-002 | AQ86: 17 | AR86: 湖广转债!
A87: 163 | B87: 北方转债 | C87: 127014 | D87: 43790. | E87: 北方国际 | F87: 65 | G87: 建筑 | H87: 建筑工程 | I87: 110.683 | J87: -7.4000000000000003e-003 | K87: 6.1999999999999998e-003 | L87: 7.72 | M87: -2.5999999999999999e-003 | N87: 0.8 | O87: 1.e-003 | P87: 115.6 | Q87: 8.75 | R87: 1.19 | S87: 88.23 | T87: 0.255 | U87: 转股中 | V87: 5年5.0天 | W87: 3年5.0天 | X87: 9.6999999999999989e-002 | Y87: 8.5999999999999993e-002 | Z87: 5.8 | AA87: 59 | AB87: 8.8999999999999999e-003 | AC87: 3.3e-003 | AD87: -1.9400000000000001e-002 | AE87: -2.18e-002 | AF87: 91.02 | AG87: 93.73 | AH87: 0.46 | AI87: AA+ | AJ87: 4.3799999999999999e-002 | AK87: =I87+100*T87 -> 136.18299999999999 | AL87: 133.1 | AM87: 130 | AN87: 39.4 | AO87: 113 | AP87: 1.1000000000000001e-002 | AQ87: 17 | AR87: 北方转债
A88: 159 | B88: 金力转债! | C88: 123033 | D88: 43794. | E88: 金力永磁 | F88: 300748 | G88: 电子 | H88: 元器件制 | I88: 116.947 | J88: -6.7000000000000002e-003 | K88: -1.9599999999999999e-002 | L88: 40.73 | M88: -3.9599999999999996e-002 | N88: 23 | O88: 4.4999999999999998e-002 | P88: 121.9 | Q88: 40.97 | R88: 13.27 | S88: 99.41 | T88: 0.17600000000000002 | U88: 转股中 | V88: 5年13天 | W88: 3年13天 | X88: 2.6000000000000002e-002 | Y88: 2.6000000000000002e-002 | Z88: 4.4 | AA88: 169 | AB88: 8.5000000000000006e-003 | AC88: 1.e-003 | AD88: -3.2400000000000005e-002 | AE88: -3.5499999999999997e-002 | AF88: 85.99 | AG88: 88.9 | AH88: 0.66 | AI88: AA- | AJ88: 6.6799999999999998e-002 | AK88: =I88+100*T88 -> 134.547 | AL88: 134.5 | AM88: 147 | AN88: 45.6 | AO88: 172 | AP88: 2.3e-002 | AQ88: 25 | AR88: 金力转债!
A89: 229 | B89: 钧达转债! | C89: 128050 | D89: 43461. | E89: 钧达股份 | F89: 2865 | G89: 汽车 | H89: 零部件制 | I89: 119.37 | J89: 2.0299999999999999e-002 | K89: 7.8000000000000005e-003 | L89: 17.45 | M89: 3.8100000000000002e-002 | N89: 34 | O89: 8.900000000000001e-002 | P89: 123.5 | Q89: 14.85 | R89: 2.46 | S89: 117.51 | T89: 1.6e-002 | U89: 转股中 | V89: 4年52天 | W89: 2年52天 | X89: 0.152 | Y89: 0.17899999999999999 | Z89: 3.2 | AA89: 21 | AB89: 8.3999999999999995e-003 | AC89: -1.1999999999999999e-003 | AD89: -5.9400000000000001e-002 | AE89: -6.2300000000000001e-002 | AF89: 89.86 | AG89: 95.53 | AH89: 0.74 | AI89: AA- | AJ89: 6.5599999999999992e-002 | AK89: =I89+100*T89 -> 120.97 | AL89: 121.2 | AM89: 17 | AN89: 25.7 | AO89: 8 | AP89: 9.6999999999999989e-002 | AQ89: 63 | AR89: 钧达转债!
A90: 31 | B90: 紫银转债 | C90: 113037 | D90: 44060. | E90: 紫金银行 | F90: 601860 | G90: 金融 | H90: 银行行业 | I90: 110.48 | J90: 8.1000000000000013e-003 | K90: -2.0999999999999999e-003 | L90: 4.23 | M90: 1.2e-002 | N90: 80 | O90: 1.6e-002 | P90: 115.8 | Q90: 4.75 | R90: 1.12 | S90: 89.05 | T90: 0.24100000000000002 | U90: 3月12天 | V90: 5.76年 | W90: 无权 | X90: 0.29100000000000004 | Y90: 0.25900000000000001 | Z90: 45 | AA90: 155 | AB90: 8.3999999999999995e-003 | AC90: 3.4000000000000002e-003 | AD90: 无权 | AE90: 无权 | AF90: 无权 | AG90: 90.9 | AH90: 0.5 | AI90: AA+ | AJ90: 4.3799999999999999e-002 | AK90: =I90+100*T90 -> 134.58000000000001 | AL90: 131.9 | AM90: 123 | AN90: 41 | AO90: 126 | AP90: 1.3000000000000001e-002 | AQ90: 15 | AR90: 紫银转债
A91: 170 | B91: 游族转债!! | C91: 128074 | D91: 43759. | E91: 游族网络 | F91: 2174 | G91: 通信互联 | H91: 互联网 | I91: 115.199 | J91: -3.7000000000000002e-003 | K91: -1.24e-002 | L91: 16.1 | M91: -2.7200000000000002e-002 | N91: 12 | O91: 1.4999999999999999e-002 | P91: 119.9 | Q91: 16.97 | R91: 2.62 | S91: 94.87 | T91: 0.214 | U91: 转股中 | V91: 4.93年 | W91: 2.93年 | X91: 4.5999999999999999e-002 | Y91: 4.4000000000000004e-002 | Z91: 6.8 | AA91: 147 | AB91: 8.3000000000000001e-003 | AC91: 1.2999999999999999e-003 | AD91: -3.4599999999999999e-002 | AE91: -3.6600000000000001e-002 | AF91: 90.44 | AG91: 97.07 | AH91: 0.59 | AI91: AA | AJ91: 4.4600000000000001e-002 | AK91: =I91+100*T91 -> 136.59899999999999 | AL91: 135.5 | AM91: 160 | AN91: 38.5 | AO91: 100 | AP91: -0.124 | AQ91: 21 | AR91: 游族转债!!
A92: 239 | B92: 长久转债! | C92: 113519 | D92: 43434. | E92: 长久物流 | F92: 603569 | G92: 交通运输 | H92: 物流业 | I92: 116.67 | J92: 3.8e-003 | K92: -9.1999999999999998e-003 | L92: 10.6 | M92: -1.21e-002 | N92: 5.7 | O92: 6.9999999999999993e-003 | P92: 120.1 | Q92: 11.15 | R92: 2.84 | S92: 95.07 | T92: 0.22699999999999998 | U92: 转股中 | V92: 4年19天 | W92: 2年19天 | X92: 0.11699999999999999 | Y92: 0.11199999999999999 | Z92: 7 | AA92: 59 | AB92: 7.3000000000000001e-003 | AC92: -1.2999999999999999e-003 | AD92: -5.28e-002 | AE92: -5.57e-002 | AF92: 94.17 | AG92: 101.05 | AH92: 0.45 | AI92: AA | AJ92: 4.4600000000000001e-002 | AK92: =I92+100*T92 -> 139.37 | AL92: 138.3 | AM92: 182 | AN92: 37.2 | AO92: 81 | AP92: 5.2000000000000005e-002 | AQ92: 17 | AR92: 长久转债!
A93: 206 | B93: 招路转债! | C93: 127012 | D93: 43585. | E93: 招商公路 | F93: 1965 | G93: 机场高速 | H93: 高速 | I93: 104.801 | J93: 1.7000000000000001e-003 | K93: -1.2999999999999999e-003 | L93: 6.87 | M93: 1.5e-003 | N93: 2.4 | O93: 0. | P93: 108.2 | Q93: 8.81 | R93: 0.9 | S93: 77.98 | T93: 0.34399999999999997 | U93: 转股中 | V93: 4.42年 | W93: 2.42年 | X93: 0.11800000000000001 | Y93: 9.1999999999999998e-002 | Z93: 50 | AA93: 424 | AB93: 7.3000000000000001e-003 | AC93: 3.8e-003 | AD93: -1.0700000000000001e-002 | AE93: -1.21e-002 | AF93: 92.25 | AG93: 91.33 | AH93: 0.3 | AI93: AAA | AJ93: 3.9599999999999996e-002 | AK93: =I93+100*T93 -> 139.20099999999999 | AL93: 131.6 | AM93: 120 | AN93: 39.4 | AO93: 112 | AP93: 1.e-003 | AQ93: 35 | AR93: 招路转债!
A94: 173 | B94: 哈尔转债! | C94: 128073 | D94: 43719. | E94: 哈尔斯 | F94: 2615 | G94: 其他 | H94: 家居用品 | I94: 112.358 | J94: 5.0000000000000001e-003 | K94: -7.1999999999999998e-003 | L94: 5.76 | M94: -3.4999999999999996e-003 | N94: 27 | O94: 8.1000000000000003e-002 | P94: 115.3 | Q94: 5.72 | R94: 3.05 | S94: 100.7 | T94: 0.11599999999999999 | U94: 转股中 | V94: 3.84年 | W94: 1.84年 | X94: 0.126 | Y94: 0.127 | Z94: 3 | AA94: 24 | AB94: 6.8000000000000005e-003 | AC94: -2.9999999999999997e-004 | AD94: -4.7e-002 | AE94: -4.8899999999999999e-002 | AF94: 89.89 | AG94: 90.63 | AH94: 0.64 | AI94: AA- | AJ94: 6.5599999999999992e-002 | AK94: =I94+100*T94 -> 123.958 | AL94: 124 | AM94: 42 | AN94: 33.4 | AO94: 46 | AP94: -1.3000000000000001e-002 | AQ94: 38 | AR94: 哈尔转债!
A95: 64 | B95: 思特转债 | C95: 123054 | D95: 44018. | E95: 思特奇 | F95: 300608 | G95: 通信互联 | H95: 通信设备 | I95: 117.215 | J95: 5.4000000000000003e-003 | K95: -3.3e-003 | L95: 18.23 | M95: 2.8000000000000004e-003 | N95: 3.7 | O95: 1.2e-002 | P95: 121.7 | Q95: 16.49 | R95: 3.72 | S95: 110.55 | T95: 5.9999999999999998e-002 | U95: 58天 | V95: 5.64年 | W95: 3.64年 | X95: 9.4e-002 | Y95: 0.10400000000000001 | Z95: 2.7 | AA95: 29 | AB95: 6.8000000000000005e-003 | AC95: 2.0000000000000001e-004 | AD95: -2.9700000000000001e-002 | AE95: -3.1899999999999998e-002 | AF95: 82.03 | AG95: 85.23 | AH95: 0.76 | AI95: AA- | AJ95: 6.6799999999999998e-002 | AK95: =I95+100*T95 -> 123.215 | AL95: 123.9 | AM95: 41 | AN95: 38.6 | AO95: 106 | AP95: 1.9e-002 | AQ95: 11 | AR95: 思特转债
A96: 121 | B96: 天目转债 | C96: 113564 | D96: 43906. | E96: 天目湖 | F96: 603136 | G96: 旅游餐饮 | H96: 旅游 | I96: 122.48 | J96: 9.0000000000000011e-003 | K96: 3.8e-003 | L96: 26.3 | M96: 1.7399999999999999e-002 | N96: 6.4 | O96: 1.7000000000000001e-002 | P96: 126.7 | Q96: 23.8 | R96: 3.42 | S96: 110.5 | T96: 0.10800000000000001 | U96: 转股中 | V96: 5.36年 | W96: 3.36年 | X96: 9.8000000000000004e-002 | Y96: 0.109 | Z96: 3 | AA96: 31 | AB96: 6.5000000000000006e-003 | AC96: -1.7000000000000001e-003 | AD96: -4.4199999999999996e-002 | AE96: -4.6500000000000007e-002 | AF96: 83.54 | AG96: 90.32 | AH96: 0.74 | AI96: AA- | AJ96: 6.6799999999999998e-002 | AK96: =I96+100*T96 -> 133.28 | AL96: 134.5 | AM96: 146 | AN96: 44.1 | AO96: 157 | AP96: -5.2999999999999999e-002 | AQ96: 12 | AR96: 天目转债
A97: 24 | B97: 大禹转债 | C97: 123063 | D97: 44063. | E97: 大禹节水 | F97: 300021 | G97: 化工 | H97: 橡胶塑料 | I97: 122 | J97: -7.3000000000000001e-003 | K97: -1.7899999999999999e-002 | L97: 5.89 | M97: -3.1300000000000001e-002 | N97: 49 | O97: 6.3e-002 | P97: 126.5 | Q97: 4.94 | R97: 3.3 | S97: 119.23 | T97: 2.3e-002 | U97: 3月17天 | V97: 5.77年 | W97: 4.77年 | X97: 0.13600000000000001 | Y97: 0.16200000000000001 | Z97: 6.4 | AA97: 47 | AB97: 6.4000000000000003e-003 | AC97: -1.1999999999999999e-003 | AD97: -2.6600000000000002e-002 | AE97: -2.92e-002 | AF97: 78.17 | AG97: 87.77 | AH97: 0.81 | AI97: AA- | AJ97: 6.6799999999999998e-002 | AK97: =I97+100*T97 -> 124.3 | AL97: 124.8 | AM97: 51 | AN97: 37 | AO97: 78 | AP97: 2.2000000000000002e-002 | AQ97: 13 | AR97: 大禹转债
A98: 40 | B98: 银信转债 | C98: 123059 | D98: 44055. | E98: 银信科技 | F98: 300231 | G98: 计算机及 | H98: 软件开发 | I98: 119.781 | J98: -1.8e-003 | K98: -8.3000000000000001e-003 | L98: 10.93 | M98: -1.3500000000000002e-002 | N98: 4.7 | O98: 1.e-002 | P98: 124.1 | Q98: 9.91 | R98: 3.82 | S98: 110.29 | T98: 8.5999999999999993e-002 | U98: 3月4天 | V98: 5.74年 | W98: 3.74年 | X98: 8.1000000000000003e-002 | Y98: 8.900000000000001e-002 | Z98: 3.9 | AA98: 48 | AB98: 6.3e-003 | AC98: -7.000000000000001e-004 | AD98: -3.5799999999999998e-002 | AE98: -3.7699999999999997e-002 | AF98: 81.02 | AG98: 86.27 | AH98: 0.74 | AI98: AA- | AJ98: 6.6799999999999998e-002 | AK98: =I98+100*T98 -> 128.381 | AL98: 129.3 | AM98: 95 | AN98: 43 | AO98: 148 | AP98: 2.4e-002 | AQ98: 8 | AR98: 银信转债
A99: 148 | B99: 鹰19转债 | C99: 110063 | D99: 43833. | E99: 山鹰纸业 | F99: 600567 | G99: 造纸包装 | H99: 包装用纸 | I99: 112.61 | J99: 8.0000000000000004e-004 | K99: 2.5999999999999999e-003 | L99: 3.14 | M99: 6.4000000000000003e-003 | N99: 2.7 | O99: 1.e-003 | P99: 116.2 | Q99: 3.3 | R99: 1.02 | S99: 95.15 | T99: 0.183 | U99: 转股中 | V99: 5年55天 | W99: 3年55天 | X99: 0.129 | Y99: 0.12300000000000001 | Z99: 19 | AA99: 144 | AB99: 6.1999999999999998e-003 | AC99: 5.9999999999999995e-004 | AD99: -2.52e-002 | AE99: -2.7200000000000002e-002 | AF99: 89.94 | AG99: 93.58 | AH99: 0.54 | AI99: AA+ | AJ99: 4.3799999999999999e-002 | AK99: =I99+100*T99 -> 130.91 | AL99: 130.1 | AM99: 103 | AN99: 36.5 | AO99: 72 | AP99: -6.0000000000000001e-003 | AQ99: 40 | AR99: 鹰19转债
A100: 137 | B100: 东风转债 | C100: 113030 | D100: 43850. | E100: 东风股份 | F100: 601515 | G100: 造纸包装 | H100: 包装材料 | I100: 113.81 | J100: -3.0000000000000001e-003 | K100: 5.9999999999999995e-004 | L100: 6.11 | M100: -4.8999999999999998e-003 | N100: 0.3 | O100: 1.e-003 | P100: 117.3 | Q100: 6.75 | R100: 2.01 | S100: 90.52 | T100: 0.25700000000000001 | U100: 转股中 | V100: 5.18年 | W100: 3.18年 | X100: 3.6000000000000004e-002 | Y100: 3.3000000000000002e-002 | Z100: 3 | AA100: 82 | AB100: 6.0000000000000001e-003 | AC100: 1.e-004 | AD100: -2.7400000000000001e-002 | AE100: -2.9500000000000002e-002 | AF100: 89.51 | AG100: 93.46 | AH100: 0.49 | AI100: AA | AJ100: 4.58e-002 | AK100: =I100+100*T100 -> 139.50999999999999 | AL100: 137.1 | AM100: 177 | AN100: 43.6 | AO100: 152 | AP100: -1.8000000000000002e-002 | AQ100: 14 | AR100: 东风转债
A101: 36 | B101: 中金转债 | C101: 127020 | D101: 44057. | E101: 中金岭南 | F101: 60 | G101: 有色金属 | H101: 有色行业 | I101: 110 | J101: 0. | K101: -2.5000000000000001e-003 | L101: 4.3 | M101: -4.5999999999999999e-003 | N101: 12 | O101: 3.0000000000000001e-003 | P101: 113.7 | Q101: 4.71 | R101: 1.39 | S101: 91.3 | T101: 0.20499999999999999 | U101: 3月8天 | V101: 5.75年 | W101: 3.75年 | X101: 0.248 | Y101: 0.22600000000000001 | Z101: 38 | AA101: 153 | AB101: 5.7999999999999996e-003 | AC101: 1.5e-003 | AD101: -1.8100000000000002e-002 | AE101: -1.9299999999999998e-002 | AF101: 86.69 | AG101: 89.13 | AH101: 0.54 | AI101: AA+ | AJ101: 4.3799999999999999e-002 | AK101: =I101+100*T101 -> 130.5 | AL101: 128.7 | AM101: 87 | AN101: 39.6 | AO101: 116 | AP101: -6.9999999999999993e-003 | AQ101: 11 | AR101: 中金转债
A102: 197 | B102: 鼎胜转债! | C102: 113534 | D102: 43585. | E102: 鼎胜新材 | F102: 603876 | G102: 有色金属 | H102: 小金属 | I102: 112.05 | J102: 4.0000000000000002e-004 | K102: -2.7000000000000001e-003 | L102: 13.43 | M102: -5.1999999999999998e-003 | N102: 0.4 | O102: 0. | P102: 114.9 | Q102: 15.18 | R102: 1.62 | S102: 88.47 | T102: 0.26700000000000002 | U102: 转股中 | V102: 4.47年 | W102: 2.47年 | X102: 0.20600000000000002 | Y102: 0.182 | Z102: 12 | AA102: 58 | AB102: 5.6999999999999993e-003 | AC102: -2.9999999999999997e-004 | AD102: -3.0299999999999997e-002 | AE102: -3.27e-002 | AF102: 92.27 | AG102: 94.91 | AH102: 0.44 | AI102: AA | AJ102: 4.4600000000000001e-002 | AK102: =I102+100*T102 -> 138.75 | AL102: 135.6 | AM102: 162 | AN102: 40.7 | AO102: 125 | AP102: -2.e-002 | AQ102: 30 | AR102: 鼎胜转债!
A103: 101 | B103: 久吾转债 | C103: 123047 | D103: 43938. | E103: 久吾高科 | F103: 300631 | G103: 机械装备 | H103: 专用设备 | I103: 126.238 | J103: 2.e-003 | K103: -2.3e-003 | L103: 22.22 | M103: -4.0000000000000002e-004 | N103: 36 | O103: 0.115 | P103: 130.1 | Q103: 17.61 | R103: 3.38 | S103: 126.18 | T103: 0. | U103: 转股中 | V103: 5.42年 | W103: 3.42年 | X103: 0.105 | Y103: 0.13300000000000001 | Z103: 2.5 | AA103: 23 | AB103: 5.6999999999999993e-003 | AC103: -3.2000000000000002e-003 | AD103: -4.7899999999999998e-002 | AE103: -5.0900000000000001e-002 | AF103: 81.42 | AG103: 87.73 | AH103: 0.83 | AI103: A+ | AJ103: 7.7800000000000008e-002 | AK103: =I103+100*T103 -> 126.238 | AL103: 126.3 | AM103: 67 | AN103: 38.6 | AO103: 103 | AP103: 7.4999999999999997e-002 | AQ103: 21 | AR103: 久吾转债
A104: 51 | B104: 瑞达转债 | C104: 128116 | D104: 44036. | E104: 瑞达期货 | F104: 2961 | G104: 金融 | H104: 期货行业 | I104: 111.697 | J104: 1.6000000000000001e-003 | K104: -1.1999999999999999e-003 | L104: 28.89 | M104: 7.000000000000001e-004 | N104: 0.8 | O104: 1.e-003 | P104: 115.3 | Q104: 29.82 | R104: 7.56 | S104: 96.88 | T104: 0.153 | U104: 2月17天 | V104: 5.69年 | W104: 3.69年 | X104: 5.0999999999999997e-002 | Y104: 4.9000000000000002e-002 | Z104: 6.5 | AA104: 129 | AB104: 5.6999999999999993e-003 | AC104: 8.9999999999999998e-004 | AD104: -1.9199999999999998e-002 | AE104: -2.1000000000000001e-002 | AF104: 87.39 | AG104: 89.78 | AH104: 0.59 | AI104: AA | AJ104: 4.58e-002 | AK104: =I104+100*T104 -> 126.997 | AL104: 126.5 | AM104: 68 | AN104: 36.7 | AO104: 74 | AP104: -1.e-003 | AQ104: 7 | AR104: 瑞达转债
A105: 149 | B105: 新北转债! | C105: 128083 | D105: 43830. | E105: 新北洋 | F105: 2376 | G105: 电子 | H105: 电子产品 | I105: 112.081 | J105: 1.06e-002 | K105: -8.3000000000000001e-003 | L105: 10.28 | M105: 4.8999999999999998e-003 | N105: 1.4 | O105: 1.e-003 | P105: 115.2 | Q105: 11.7 | R105: 2.06 | S105: 87.86 | T105: 0.27600000000000002 | U105: 转股中 | V105: 5年54天 | W105: 3年54天 | X105: 0.128 | Y105: 0.113 | Z105: 8.8 | AA105: 68 | AB105: 5.5000000000000005e-003 | AC105: 1.e-004 | AD105: -2.3399999999999997e-002 | AE105: -2.5499999999999998e-002 | AF105: 89.54 | AG105: 91.91 | AH105: 0.47 | AI105: AA | AJ105: 4.58e-002 | AK105: =I105+100*T105 -> 139.68100000000001 | AL105: 136.3 | AM105: 169 | AN105: 44.4 | AO105: 161 | AP105: 2.1000000000000001e-002 | AQ105: 16 | AR105: 新北转债!
A106: 117 | B106: 君禾转债 | C106: 113567 | D106: 43924. | E106: 君禾股份 | F106: 603617 | G106: 机械装备 | H106: 通用设备 | I106: 116.29 | J106: -5.0000000000000001e-004 | K106: -1.1200000000000002e-002 | L106: 12.53 | M106: -1.49e-002 | N106: 7.2 | O106: 2.9999999999999999e-002 | P106: 119.3 | Q106: 11.46 | R106: 4 | S106: 109.34 | T106: 6.4000000000000001e-002 | U106: 转股中 | V106: 5.37年 | W106: 3.37年 | X106: 8.4000000000000005e-002 | Y106: 9.1999999999999998e-002 | Z106: 2.1 | AA106: 25 | AB106: 4.8999999999999998e-003 | AC106: -1.4000000000000002e-003 | AD106: -3.0200000000000001e-002 | AE106: -3.2500000000000001e-002 | AF106: 80.43 | AG106: 80.58 | AH106: 0.79 | AI106: A+ | AJ106: 7.7800000000000008e-002 | AK106: =I106+100*T106 -> 122.69000000000001 | AL106: 123.2 | AM106: 35 | AN106: 42.7 | AO106: 144 | AP106: 3.7000000000000005e-002 | AQ106: 30 | AR106: 君禾转债
A107: 26 | B107: 城地转债! | C107: 113596 | D107: 44063. | E107: 城地香江 | F107: 603887 | G107: 通信互联 | H107: 通信设备 | I107: 110.39 | J107: 7.6e-003 | K107: 1.1000000000000001e-003 | L107: 25.2 | M107: 1.4499999999999999e-002 | N107: 6.2 | O107: 5.0000000000000001e-003 | P107: 113.5 | Q107: 29.21 | R107: 2.61 | S107: 86.27 | T107: 0.28000000000000003 | U107: 3月18天 | V107: 5.77年 | W107: 3.77年 | X107: 0.127 | Y107: 0.109 | Z107: 12 | AA107: 95 | AB107: 4.8999999999999998e-003 | AC107: 7.000000000000001e-004 | AD107: -1.5600000000000001e-002 | AE107: -1.7399999999999999e-002 | AF107: 80.68 | AG107: 78.74 | AH107: 0.6 | AI107: AA- | AJ107: 6.6799999999999998e-002 | AK107: =I107+100*T107 -> 138.39000000000001 | AL107: 134.5 | AM107: 148 | AN107: 53.8 | AO107: 221 | AP107: 3.3000000000000002e-002 | AQ107: 8 | AR107: 城地转债!
A108: 278 | B108: 特一转债! | C108: 128025 | D108: 43097. | E108: 特一药业 | F108: 2728 | G108: 医药 | H108: 化学制药 | I108: 108.27 | J108: 2.5000000000000001e-003 | K108: -2.5000000000000001e-003 | L108: 13.45 | M108: 0. | N108: 1.6 | O108: 5.0000000000000001e-003 | P108: 109.8 | Q108: 14.7 | R108: 2.71 | S108: 91.5 | T108: 0.183 | U108: 转股中 | V108: 3年48天 | W108: 1年48天 | X108: 0.109 | Y108: 0.10000000000000001 | Z108: 3 | AA108: 27 | AB108: 4.5999999999999999e-003 | AC108: -1.2999999999999999e-003 | AD108: -4.1399999999999999e-002 | AE108: -4.4999999999999998e-002 | AF108: 94.51 | AG108: 90.39 | AH108: 0.51 | AI108: AA- | AJ108: 6.5599999999999992e-002 | AK108: =I108+100*T108 -> 126.56999999999999 | AL108: 125 | AM108: 55 | AN108: 30.5 | AO108: 23 | AP108: -2.e-002 | AQ108: 42 | AR108: 特一转债!
A109: 7 | B109: 景兴转债 | C109: 128130 | D109: 44092. | E109: 景兴纸业 | F109: 2067 | G109: 造纸包装 | H109: 包装用纸 | I109: 112.201 | J109: 1.8e-003 | K109: 3.9000000000000003e-003 | L109: 3.43 | M109: 8.8000000000000005e-003 | N109: 21 | O109: 1.3999999999999999e-002 | P109: 115.1 | Q109: 3.4 | R109: 0.86 | S109: 100.88 | T109: 0.11199999999999999 | U109: 4月16天 | V109: 5.87年 | W109: 3.87年 | X109: 0.33600000000000002 | Y109: 0.33899999999999997 | Z109: 13 | AA109: 38 | AB109: 4.4000000000000003e-003 | AC109: -2.0000000000000001e-004 | AD109: -1.9699999999999999e-002 | AE109: -2.1400000000000002e-002 | AF109: 86.61 | AG109: 88.91 | AH109: 0.64 | AI109: AA | AJ109: 4.58e-002 | AK109: =I109+100*T109 -> 123.401 | AL109: 123.5 | AM109: 36 | AN109: 34.6 | AO109: 53 | AP109: -3.3000000000000002e-002 | AQ109: 7 | AR109: 景兴转债
A110: 104 | B110: 联创转债! | C110: 128101 | D110: 43934. | E110: 联创电子 | F110: 2036 | G110: 电子 | H110: 液晶显示 | I110: 112.5 | J110: -4.4000000000000003e-003 | K110: 2.e-003 | L110: 11.04 | M110: -7.1999999999999998e-003 | N110: 0.3 | O110: 1.e-003 | P110: 115.1 | Q110: 14.48 | R110: 4.11 | S110: 76.24 | T110: 0.47600000000000003 | U110: 转股中 | V110: 5.41年 | W110: 3.41年 | X110: 2.8999999999999998e-002 | Y110: 2.2000000000000002e-002 | Z110: 3 | AA110: 103 | AB110: 4.3e-003 | AC110: -7.000000000000001e-004 | AD110: -2.3e-002 | AE110: -2.4900000000000002e-002 | AF110: 88.41 | AG110: 90.77 | AH110: 0.33 | AI110: AA | AJ110: 4.58e-002 | AK110: =I110+100*T110 -> 160.09999999999999 | AL110: 148.8 | AM110: 239 | AN110: 58 | AO110: 241 | AP110: -1.4999999999999999e-002 | AQ110: 14 | AR110: 联创转债!
A111: 82 | B111: 全筑转债 | C111: 113578 | D111: 43970. | E111: 全筑股份 | F111: 603030 | G111: 建筑 | H111: 装饰工程 | I111: 115.63 | J111: -2.2000000000000001e-003 | K111: 2.2000000000000001e-003 | L111: 5.9 | M111: 0. | N111: 4.9 | O111: 1.1000000000000001e-002 | P111: 118.3 | Q111: 5.43 | R111: 1.43 | S111: 108.66 | T111: 6.4000000000000001e-002 | U111: 7天 | V111: 5.50年 | W111: 3.50年 | X111: 0.121 | Y111: 0.13100000000000001 | Z111: 3.8 | AA111: 32 | AB111: 4.1999999999999997e-003 | AC111: -1.6000000000000001e-003 | AD111: -2.9300000000000003e-002 | AE111: -3.1200000000000002e-002 | AF111: 88.22 | AG111: 92.91 | AH111: 0.67 | AI111: AA | AJ111: 4.58e-002 | AK111: =I111+100*T111 -> 122.03 | AL111: 122.6 | AM111: 27 | AN111: 29.7 | AO111: 19 | AP111: -3.9e-002 | AQ111: 9 | AR111: 全筑转债
A112: 191 | B112: 亚泰转债! | C112: 128066 | D112: 43599. | E112: 郑中设计 | F112: 2811 | G112: 建筑 | H112: 装饰工程 | I112: 115.43 | J112: 5.1000000000000004e-003 | K112: 0. | L112: 10.65 | M112: 6.6e-003 | N112: 2.8 | O112: 5.0000000000000001e-003 | P112: 117.5 | Q112: 9.67 | R112: 1.96 | S112: 110.13 | T112: 4.8000000000000001e-002 | U112: 转股中 | V112: 4.49年 | W112: 2.49年 | X112: 0.16699999999999998 | Y112: 0.184 | Z112: 4.8 | AA112: 29 | AB112: 4.0999999999999995e-003 | AC112: -2.8000000000000004e-003 | AD112: -3.95e-002 | AE112: -4.2099999999999999e-002 | AF112: 87.88 | AG112: 88.92 | AH112: 0.76 | AI112: AA- | AJ112: 6.5599999999999992e-002 | AK112: =I112+100*T112 -> 120.23 | AL112: 120.7 | AM112: 14 | AN112: 31.8 | AO112: 31 | AP112: 2.7999999999999997e-002 | AQ112: 57 | AR112: 亚泰转债!
A113: 44 | B113: 湖盐转债 | C113: 110071 | D113: 44043. | E113: 雪天盐业 | F113: 600929 | G113: 食品饮料 | H113: 食品饮料 | I113: 112.66 | J113: -1.8e-003 | K113: -3.0999999999999999e-003 | L113: 6.79 | M113: -7.3000000000000001e-003 | N113: 0.9 | O113: 1.e-003 | P113: 115.2 | Q113: 6.6 | R113: 2.47 | S113: 102.88 | T113: 9.5000000000000001e-002 | U113: 3月1天 | V113: 5.72年 | W113: 3.72年 | X113: 0.11599999999999999 | Y113: 0.11900000000000001 | Z113: 7.2 | AA113: 62 | AB113: 4.0000000000000001e-003 | AC113: -8.0000000000000004e-004 | AD113: -2.1299999999999999e-002 | AE113: -2.3e-002 | AF113: 87.25 | AG113: 89.58 | AH113: 0.67 | AI113: AA | AJ113: 4.58e-002 | AK113: =I113+100*T113 -> 122.16 | AL113: 122.4 | AM113: 25 | AN113: 32.9 | AO113: 41 | AP113: 1.e-003 | AQ113: 11 | AR113: 湖盐转债
A114: 183 | B114: 清水转债 | C114: 123028 | D114: 43661. | E114: 清水源 | F114: 300437 | G114: 城市公用 | H114: 三废处理 | I114: 119.85 | J114: 5.0000000000000001e-003 | K114: 1.1000000000000001e-003 | L114: 14.1 | M114: 7.9000000000000008e-003 | N114: 47 | O114: 8.5999999999999993e-002 | P114: 121.8 | Q114: 11.84 | R114: 2.05 | S114: 119.09 | T114: 6.0000000000000001e-003 | U114: 转股中 | V114: 4.67年 | W114: 2.67年 | X114: 0.14800000000000002 | Y114: 0.17600000000000002 | Z114: 4.6 | AA114: 31 | AB114: 3.5999999999999999e-003 | AC114: -4.4000000000000003e-003 | AD114: -4.7100000000000003e-002 | AE114: -5.0099999999999999e-002 | AF114: 87.68 | AG114: 91.26 | AH114: 0.78 | AI114: AA- | AJ114: 6.5599999999999992e-002 | AK114: =I114+100*T114 -> 120.44999999999999 | AL114: 120.6 | AM114: 12 | AN114: 29.3 | AO114: 18 | AP114: 0.12 | AQ114: 49 | AR114: 清水转债
A115: 49 | B115: 美联转债 | C115: 123057 | D115: 44039. | E115: 美联新材 | F115: 300586 | G115: 化工 | H115: 橡胶塑料 | I115: 116.05 | J115: 8.9999999999999998e-004 | K115: -1.9099999999999999e-002 | L115: 10.64 | M115: -2.3900000000000001e-002 | N115: 6.2 | O115: 2.6000000000000002e-002 | P115: 118.2 | Q115: 9.91 | R115: 6.65 | S115: 107.37 | T115: 8.1000000000000003e-002 | U115: 2月20天 | V115: 5.70年 | W115: 3.70年 | X115: 4.2999999999999997e-002 | Y115: 4.5999999999999999e-002 | Z115: 2.1 | AA115: 49 | AB115: 3.3e-003 | AC115: -2.3e-003 | AD115: -2.7999999999999997e-002 | AE115: -2.9900000000000003e-002 | AF115: 81.31 | AG115: 82.43 | AH115: 0.76 | AI115: AA- | AJ115: 6.6799999999999998e-002 | AK115: =I115+100*T115 -> 124.14999999999999 | AL115: 124.7 | AM115: 49 | AN115: 42.3 | AO115: 139 | AP115: 1.9e-002 | AQ115: 6 | AR115: 美联转债
A116: 296 | B116: 洪涛转债! | C116: 128013 | D116: 42605. | E116: 洪涛股份 | F116: 2325 | G116: 建筑 | H116: 装饰工程 | I116: 109.27 | J116: 1.2999999999999999e-003 | K116: -4.8999999999999998e-003 | L116: 3.12 | M116: -6.4000000000000003e-003 | N116: 5.9 | O116: 4.0000000000000001e-003 | P116: 109.8 | Q116: 3.1 | R116: 1.26 | S116: 100.65 | T116: 8.5999999999999993e-002 | U116: 转股中 | V116: 1.78年 | W116: 回售中 | X116: 0.307 | Y116: 0.309 | Z116: 12 | AA116: 39 | AB116: 2.8000000000000004e-003 | AC116: -7.4000000000000003e-003 | AD116: 回售中 | AE116: 回售中 | AF116: 100.3 | AG116: 98.42 | AH116: 0.56 | AI116: AA- | AJ116: 6.4199999999999993e-002 | AK116: =I116+100*T116 -> 117.86999999999999 | AL116: 117.9 | AM116: 5 | AN116: 17.6 | AO116: 2 | AP116: -2.5000000000000001e-002 | AQ116: 88 | AR116: 洪涛转债!
A117: 100 | B117: 龙净转债! | C117: 110068 | D117: 43936. | E117: 龙净环保 | F117: 600388 | G117: 城市公用 | H117: 三废处理 | I117: 113.4 | J117: 5.9999999999999995e-004 | K117: -5.6999999999999993e-003 | L117: 9.58 | M117: -1.03e-002 | N117: 0.6 | O117: 0. | P117: 115 | Q117: 10.73 | R117: 1.9 | S117: 89.28 | T117: 0.27000000000000002 | U117: 转股中 | V117: 5.43年 | W117: 3.43年 | X117: 0.19500000000000001 | Y117: 0.17399999999999999 | Z117: 20 | AA117: 102 | AB117: 2.5999999999999999e-003 | AC117: -2.3e-003 | AD117: -2.53e-002 | AE117: -2.7099999999999999e-002 | AF117: 88.83 | AG117: 91.51 | AH117: 0.49 | AI117: AA+ | AJ117: 4.3799999999999999e-002 | AK117: =I117+100*T117 -> 140.40000000000001 | AL117: 137.5 | AM117: 180 | AN117: 46 | AO117: 176 | AP117: -3.3000000000000002e-002 | AQ117: 28 | AR117: 龙净转债!
A118: 17 | B118: 特发转2! | C118: 127021 | D118: 44078. | E118: 特发信息 | F118: 70 | G118: 通信互联 | H118: 通信设备 | I118: 112.017 | J118: -4.4000000000000003e-003 | K118: 2.2000000000000001e-003 | L118: 9.94 | M118: -6.0000000000000001e-003 | N118: 2.1 | O118: 3.0000000000000001e-003 | P118: 113.3 | Q118: 12.33 | R118: 2.89 | S118: 80.62 | T118: 0.39000000000000001 | U118: 3月27天 | V118: 4.80年 | W118: 2.80年 | X118: 6.8000000000000005e-002 | Y118: 5.5e-002 | Z118: 5.5 | AA118: 81 | AB118: 2.3999999999999998e-003 | AC118: -2.5999999999999999e-003 | AD118: -3.1099999999999999e-002 | AE118: -3.2400000000000005e-002 | AF118: 89.71 | AG118: 92.11 | AH118: 0.36 | AI118: AA | AJ118: 4.4600000000000001e-002 | AK118: =I118+100*T118 -> 151.017 | AL118: 143.4 | AM118: 216 | AN118: 51.3 | AO118: 209 | AP118: -2.5000000000000001e-002 | AQ118: 4 | AR118: 特发转2!
A119: 209 | B119: 亨通转债! | C119: 110056 | D119: 43571. | E119: 亨通光电 | F119: 600487 | G119: 通信互联 | H119: 通信设备 | I119: 114 | J119: -2.0000000000000001e-004 | K119: 5.6999999999999993e-003 | L119: 15.26 | M119: 9.8999999999999991e-003 | N119: 2.3 | O119: 1.e-003 | P119: 114.8 | Q119: 15.58 | R119: 2.05 | S119: 97.95 | T119: 0.16399999999999998 | U119: 转股中 | V119: 4.41年 | W119: 2.41年 | X119: 5.7000000000000002e-002 | Y119: 5.5999999999999994e-002 | Z119: 17 | AA119: 298 | AB119: 1.6000000000000001e-003 | AC119: -4.4000000000000003e-003 | AD119: -3.78e-002 | AE119: -4.0099999999999997e-002 | AF119: 92.85 | AG119: 95.84 | AH119: 0.55 | AI119: AA+ | AJ119: 4.2599999999999999e-002 | AK119: =I119+100*T119 -> 130.40000000000001 | AL119: 130.1 | AM119: 102 | AN119: 34.2 | AO119: 49 | AP119: 2.2000000000000002e-002 | AQ119: 28 | AR119: 亨通转债!
A120: 139 | B120: 永创转债! | C120: 113559 | D120: 43840. | E120: 永创智能 | F120: 603901 | G120: 机械装备 | H120: 专用设备 | I120: 118.14 | J120: 1.1999999999999999e-003 | K120: 2.4199999999999999e-002 | L120: 10.26 | M120: 3.7400000000000003e-002 | N120: 2.2 | O120: 4.0000000000000001e-003 | P120: 118.9 | Q120: 10.32 | R120: 3.29 | S120: 99.42 | T120: 0.188 | U120: 转股中 | V120: 5.18年 | W120: 3.18年 | X120: 0.113 | Y120: 0.11199999999999999 | Z120: 5.1 | AA120: 45 | AB120: 1.2999999999999999e-003 | AC120: -5.1000000000000004e-003 | AD120: -3.5200000000000002e-002 | AE120: -3.7900000000000003e-002 | AF120: 84.87 | AG120: 85.89 | AH120: 0.68 | AI120: AA- | AJ120: 6.6799999999999998e-002 | AK120: =I120+100*T120 -> 136.94 | AL120: 136.9 | AM120: 175 | AN120: 51 | AO120: 205 | AP120: 5.0000000000000003e-002 | AQ120: 23 | AR120: 永创转债!
A121: 184 | B121: 华钰转债!! | C121: 113027 | D121: 43656. | E121: 华钰矿业 | F121: 601020 | G121: 有色金属 | H121: 锌铅镍锡 | I121: 114.54 | J121: -4.0999999999999995e-003 | K121: -6.6e-003 | L121: 10.5 | M121: -1.4999999999999999e-002 | N121: 12 | O121: 3.3000000000000002e-002 | P121: 114.9 | Q121: 10.17 | R121: 2.65 | S121: 103.24 | T121: 0.109 | U121: 转股中 | V121: 4.65年 | W121: 2.65年 | X121: 5.5999999999999994e-002 | Y121: 5.7999999999999996e-002 | Z121: 3.3 | AA121: 58 | AB121: 7.000000000000001e-004 | AC121: -5.0000000000000001e-003 | AD121: -3.6000000000000004e-002 | AE121: -3.8199999999999998e-002 | AF121: 86.6 | AG121: 86.01 | AH121: 0.71 | AI121: AA- | AJ121: 6.5599999999999992e-002 | AK121: =I121+100*T121 -> 125.44000000000001 | AL121: 125.8 | AM121: 60 | AN121: 39.2 | AO121: 109 | AP121: -8.0000000000000002e-002 | AQ121: 46 | AR121: 华钰转债!!
A122: 2 | B122: 赛意转债 | C122: 123066 | D122: 44119. | E122: 赛意信息 | F122: 300687 | G122: 计算机及 | H122: 软件开发 | I122: 120.9 | J122: -8.0000000000000004e-004 | K122: 2.3999999999999998e-003 | L122: 26.83 | M122: 1.9e-003 | N122: 68 | O122: 0.17399999999999999 | P122: 121.4 | Q122: 22.58 | R122: 6.99 | S122: 118.82 | T122: 1.7000000000000001e-002 | U122: 5月4天 | V122: 5.91年 | W122: 3.91年 | X122: 5.5e-002 | Y122: 6.5000000000000002e-002 | Z122: 3.2 | AA122: 58 | AB122: 7.000000000000001e-004 | AC122: -5.4000000000000003e-003 | AD122: -3.5900000000000001e-002 | AE122: -3.78e-002 | AF122: 77.1 | AG122: 78.7 | AH122: 0.85 | AI122: A+ | AJ122: 7.7800000000000008e-002 | AK122: =I122+100*T122 -> 122.60000000000001 | AL122: 123 | AM122: 31 | AN122: 44.3 | AO122: 160 | AP122: 0.122 | AQ122: 1 | AR122: 赛意转债
A123: 261 | B123: 敖东转债! | C123: 127006 | D123: 43231. | E123: 吉林敖东 | F123: 623 | G123: 金融 | H123: 证券行业 | I123: 108 | J123: -1.e-004 | K123: 1.6000000000000001e-003 | L123: 17.47 | M123: 4.0000000000000001e-003 | N123: 1.2 | O123: 0. | P123: 108 | Q123: 20.42 | R123: 0.91 | S123: 85.55 | T123: 0.26200000000000001 | U123: 转股中 | V123: 3.40年 | W123: 1.40年 | X123: 0.11800000000000001 | Y123: 0.10099999999999999 | Z123: 24 | AA123: 203 | AB123: 0. | AC123: -4.4000000000000003e-003 | AD123: -3.8100000000000002e-002 | AE123: -4.0099999999999997e-002 | AF123: 95.28 | AG123: 93.91 | AH123: 0.37 | AI123: AA+ | AJ123: 4.2599999999999999e-002 | AK123: =I123+100*T123 -> 134.19999999999999 | AL123: 130.4 | AM123: 107 | AN123: 35.2 | AO123: 59 | AP123: 1.3000000000000001e-002 | AQ123: 26 | AR123: 敖东转债!
A124: 30 | B124: 兴森转债 | C124: 128122 | D124: 44060. | E124: 兴森科技 | F124: 2436 | G124: 电子 | H124: 元器件制 | I124: 113.5 | J124: 0. | K124: -6.1999999999999998e-003 | L124: 11.17 | M124: -1.8500000000000003e-002 | N124: 1.7 | O124: 6.0000000000000001e-003 | P124: 113.3 | Q124: 14.18 | R124: 5.37 | S124: 78.77 | T124: 0.441 | U124: 3月12天 | V124: 4.76年 | W124: 3.76年 | X124: 1.6e-002 | Y124: 1.3000000000000001e-002 | Z124: 2.7 | AA124: 166 | AB124: -4.0000000000000002e-004 | AC124: -5.4000000000000003e-003 | AD124: -2.3099999999999999e-002 | AE124: -2.4799999999999999e-002 | AF124: 87.44 | AG124: 92.28 | AH124: 0.33 | AI124: AA | AJ124: 4.4600000000000001e-002 | AK124: =I124+100*T124 -> 157.59999999999999 | AL124: 148.2 | AM124: 236 | AN124: 56 | AO124: 227 | AP124: -9.0000000000000011e-003 | AQ124: 4 | AR124: 兴森转债
A125: 276 | B125: 铁汉转债! | C125: 123004 | D125: 43126. | E125: 铁汉生态 | F125: 300197 | G125: 城市公用 | H125: 生态环境 | I125: 110 | J125: 0. | K125: 1.4000000000000002e-003 | L125: 3.94 | M125: 2.5000000000000001e-003 | N125: 9.8 | O125: 1.1000000000000001e-002 | P125: 109.8 | Q125: 3.98 | R125: 1.77 | S125: 98.99 | T125: 0.111 | U125: 转股中 | V125: 3.16年 | W125: 1.16年 | X125: 8.6999999999999994e-002 | Y125: 8.5999999999999993e-002 | Z125: 8 | AA125: 93 | AB125: -5.9999999999999995e-004 | AC125: -6.4000000000000003e-003 | AD125: -5.1799999999999999e-002 | AE125: -5.5300000000000002e-002 | AF125: 96.82 | AG125: 95.92 | AH125: 0.57 | AI125: AA | AJ125: 4.4600000000000001e-002 | AK125: =I125+100*T125 -> 121.09999999999999 | AL125: 121 | AM125: 16 | AN125: 24.2 | AO125: 7 | AP125: -1.6e-002 | AQ125: 36 | AR125: 铁汉转债!
A126: 69 | B126: 飞鹿转债 | C126: 123052 | D126: 44015. | E126: 飞鹿股份 | F126: 300665 | G126: 化工 | H126: 化工 | I126: 127.73 | J126: -6.0000000000000001e-003 | K126: 8.6e-003 | L126: 13.44 | M126: 3.0000000000000001e-003 | N126: 16 | O126: 7.2000000000000008e-002 | P126: 127.3 | Q126: 9.9 | R126: 3.57 | S126: 135.76 | T126: -5.9000000000000004e-002 | U126: 53天 | V126: 5.63年 | W126: 3.63年 | X126: 0.10800000000000001 | Y126: 0.14699999999999999 | Z126: 1.8 | AA126: 16 | AB126: -5.9999999999999995e-004 | AC126: -8.5000000000000006e-003 | AD126: -5.04e-002 | AE126: -5.28e-002 | AF126: 79.49 | AG126: 84.41 | AH126: 0.87 | AI126: A+ | AJ126: 7.7800000000000008e-002 | AK126: =I126+100*T126 -> 121.83 | AL126: 119.7 | AM126: 9 | AN126: 35.3 | AO126: 61 | AP126: 7.2000000000000008e-002 | AQ126: 11 | AR126: 飞鹿转债
A127: 4 | B127: 崇达转2 | C127: 128131 | D127: 44102. | E127: 崇达技术 | F127: 2815 | G127: 电子 | H127: 元器件制 | I127: 115.681 | J127: -5.3e-003 | K127: 1.03e-002 | L127: 17.88 | M127: 9.0000000000000011e-003 | N127: 8.2 | O127: 5.0000000000000001e-003 | P127: 115.2 | Q127: 19.54 | R127: 4.07 | S127: 91.5 | T127: 0.26400000000000001 | U127: 4月23天 | V127: 5.89年 | W127: 3.89年 | X127: 8.900000000000001e-002 | Y127: 8.1000000000000003e-002 | Z127: 14 | AA127: 158 | AB127: -7.000000000000001e-004 | AC127: -5.3e-003 | AD127: -2.6800000000000001e-002 | AE127: -2.8500000000000001e-002 | AF127: 86.62 | AG127: 88.93 | AH127: 0.55 | AI127: AA | AJ127: 4.58e-002 | AK127: =I127+100*T127 -> 142.08099999999999 | AL127: 139.9 | AM127: 197 | AN127: 50.9 | AO127: 204 | AP127: 2.1000000000000001e-002 | AQ127: 2 | AR127: 崇达转2
A128: 219 | B128: 今飞转债! | C128: 128056 | D128: 43546. | E128: 今飞凯达 | F128: 2863 | G128: 汽车 | H128: 零部件制 | I128: 121.4 | J128: 0. | K128: 1.03e-002 | L128: 8.09 | M128: 1.2500000000000001e-002 | N128: 19 | O128: 6.5000000000000002e-002 | P128: 121 | Q128: 6.76 | R128: 2.97 | S128: 119.67 | T128: 1.3999999999999999e-002 | U128: 转股中 | V128: 4.36年 | W128: 2.36年 | X128: 7.4999999999999997e-002 | Y128: 8.900000000000001e-002 | Z128: 2.4 | AA128: 32 | AB128: -8.0000000000000004e-004 | AC128: -9.0000000000000011e-003 | AD128: -5.9500000000000004e-002 | AE128: -6.2300000000000001e-002 | AF128: 86.66 | AG128: 88.42 | AH128: 0.82 | AI128: A+ | AJ128: 7.6600000000000001e-002 | AK128: =I128+100*T128 -> 122.80000000000001 | AL128: 123.1 | AM128: 34 | AN128: 34.7 | AO128: 54 | AP128: 2.9999999999999999e-002 | AQ128: 59 | AR128: 今飞转债!
A129: 122 | B129: 宏辉转债 | C129: 113565 | D129: 43906. | E129: 宏辉果蔬 | F129: 603336 | G129: 农业 | H129: 农产品加 | I129: 118.7 | J129: 2.9999999999999997e-004 | K129: 1.1999999999999999e-003 | L129: 11.38 | M129: 1.8e-003 | N129: 6.9 | O129: 1.9e-002 | P129: 118.2 | Q129: 10 | R129: 4.18 | S129: 113.8 | T129: 4.2999999999999997e-002 | U129: 转股中 | V129: 5.36年 | W129: 3.36年 | X129: 8.3000000000000004e-002 | Y129: 9.4e-002 | Z129: 3.1 | AA129: 37 | AB129: -8.0000000000000004e-004 | AC129: -6.7000000000000002e-003 | AD129: -3.6900000000000002e-002 | AE129: -3.9100000000000003e-002 | AF129: 83.15 | AG129: 84.27 | AH129: 0.81 | AI129: AA- | AJ129: 6.6799999999999998e-002 | AK129: =I129+100*T129 -> 123. | AL129: 123.6 | AM129: 37 | AN129: 39.3 | AO129: 110 | AP129: -4.0999999999999995e-002 | AQ129: 18 | AR129: 宏辉转债
A130: 294 | B130: 骆驼转债! | C130: 113012 | D130: 42934. | E130: 骆驼股份 | F130: 601311 | G130: 汽车 | H130: 零部件制 | I130: 108.04 | J130: -1.2999999999999999e-003 | K130: 1.e-003 | L130: 8.19 | M130: -1.1999999999999999e-003 | N130: 1.5 | O130: 3.0000000000000001e-003 | P130: 107.8 | Q130: 10.06 | R130: 1.06 | S130: 81.41 | T130: 0.32700000000000001 | U130: 转股中 | V130: 2.43年 | W130: 0.43年 | X130: 5.5999999999999994e-002 | Y130: 4.4999999999999998e-002 | Z130: 5.1 | AA130: 92 | AB130: -8.9999999999999998e-004 | AC130: -6.9999999999999993e-003 | AD130: -0.107 | AE130: -0.11199999999999999 | AF130: 99.04 | AG130: 97.44 | AH130: 0.2 | AI130: AA | AJ130: 4.3200000000000002e-002 | AK130: =I130+100*T130 -> 140.74000000000001 | AL130: 134.7 | AM130: 150 | AN130: 35.6 | AO130: 66 | AP130: 3.7999999999999999e-002 | AQ130: 17 | AR130: 骆驼转债!
A131: 86 | B131: 维尔转债 | C131: 123049 | D131: 43963. | E131: 维尔利 | F131: 300190 | G131: 城市公用 | H131: 三废处理 | I131: 125.888 | J131: 8.0000000000000004e-004 | K131: -8.0000000000000004e-004 | L131: 8.83 | M131: 0. | N131: 1.1 | O131: 1.e-003 | P131: 124.8 | Q131: 7.48 | R131: 1.69 | S131: 118.05 | T131: 6.6000000000000003e-002 | U131: 0.0天 | V131: 5.48年 | W131: 3.48年 | X131: 0.13300000000000001 | Y131: 0.157 | Z131: 9.2 | AA131: 69 | AB131: -1.6000000000000001e-003 | AC131: -9.1000000000000004e-003 | AD131: -4.9800000000000004e-002 | AE131: -5.2000000000000005e-002 | AF131: 82.97 | AG131: 88.3 | AH131: 0.79 | AI131: AA- | AJ131: 6.6799999999999998e-002 | AK131: =I131+100*T131 -> 132.488 | AL131: 133.7 | AM131: 136 | AN131: 45.4 | AO131: 170 | AP131: -1.7000000000000001e-002 | AQ131: 11 | AR131: 维尔转债
A132: 207 | B132: 岱勒转债! | C132: 123024 | D132: 43572. | E132: 岱勒新材 | F132: 300700 | G132: 机械装备 | H132: 专用设备 | I132: 113.68 | J132: 1.09e-002 | K132: -9.7000000000000003e-003 | L132: 23.99 | M132: 2.0999999999999999e-003 | N132: 6.7 | O132: 2.7999999999999997e-002 | P132: 113 | Q132: 24.9 | R132: 4.03 | S132: 96.35 | T132: 0.17999999999999999 | U132: 转股中 | V132: 3.42年 | W132: 1.42年 | X132: 0.106 | Y132: 0.10199999999999999 | Z132: 2.1 | AA132: 20 | AB132: -1.8e-003 | AC132: -8.6e-003 | AD132: -6.7799999999999999e-002 | AE132: -6.9800000000000001e-002 | AF132: 90.56 | AG132: 88.09 | AH132: 0.61 | AI132: A+ | AJ132: 7.6600000000000001e-002 | AK132: =I132+100*T132 -> 131.68000000000001 | AL132: 131 | AM132: 116 | AN132: 40.5 | AO132: 123 | AP132: 8.900000000000001e-002 | AQ132: 33 | AR132: 岱勒转债!
A133: 265 | B133: 大族转债! | C133: 128035 | D133: 43164. | E133: 大族激光 | F133: 2008 | G133: 机械装备 | H133: 专用设备 | I133: 108.702 | J133: -1.e-004 | K133: -2.0000000000000001e-004 | L133: 34.83 | M133: -2.1899999999999999e-002 | N133: 2.3 | O133: 1.e-003 | P133: 108 | Q133: 52.1 | R133: 4.14 | S133: 66.85 | T133: 0.626 | U133: 转股中 | V133: 3.30年 | W133: 1.30年 | X133: 6.2e-002 | Y133: 4.0999999999999995e-002 | Z133: 23 | AA133: 372 | AB133: -2.e-003 | AC133: -6.5000000000000006e-003 | AD133: -2.7300000000000001e-002 | AE133: -3.2899999999999999e-002 | AF133: 98.23 | AG133: 94.29 | AH133: 0.01 | AI133: AA+ | AJ133: 4.2599999999999999e-002 | AK133: =I133+100*T133 -> 171.30199999999999 | AL133: 150.6 | AM133: 245 | AN133: 52.3 | AO133: 214 | AP133: 1.7000000000000001e-002 | AQ133: 19 | AR133: 大族转债!
A134: 134 | B134: 汽模转2 | C134: 128090 | D134: 43853. | E134: 天汽模 | F134: 2510 | G134: 汽车 | H134: 零部件制 | I134: 116.438 | J134: -8.6e-003 | K134: -5.7999999999999996e-003 | L134: 4.35 | M134: -2.2499999999999999e-002 | N134: 4.5 | O134: 8.0000000000000002e-003 | P134: 115.2 | Q134: 4.21 | R134: 1.49 | S134: 103.33 | T134: 0.127 | U134: 转股中 | V134: 5.19年 | W134: 3.19年 | X134: 0.11699999999999999 | Y134: 0.121 | Z134: 4.7 | AA134: 40 | AB134: -2.0999999999999999e-003 | AC134: -7.3000000000000001e-003 | AD134: -3.4300000000000004e-002 | AE134: -3.6299999999999999e-002 | AF134: 89.38 | AG134: 91.74 | AH134: 0.64 | AI134: AA | AJ134: 4.58e-002 | AK134: =I134+100*T134 -> 129.13800000000001 | AL134: 129.6 | AM134: 97 | AN134: 37.8 | AO134: 90 | AP134: -2.8999999999999998e-002 | AQ134: 26 | AR134: 汽模转2
A135: 28 | B135: 国光转债 | C135: 128123 | D135: 44062. | E135: 国光股份 | F135: 2749 | G135: 化工 | H135: 农化 | I135: 117.6 | J135: -4.1999999999999997e-003 | K135: -8.8999999999999999e-003 | L135: 13.42 | M135: -1.83e-002 | N135: 0.6 | O135: 2.e-003 | P135: 116.2 | Q135: 13.7 | R135: 4.95 | S135: 97.96 | T135: 0.20100000000000001 | U135: 3月15天 | V135: 5.77年 | W135: 3.77年 | X135: 5.5e-002 | Y135: 5.4000000000000006e-002 | Z135: 3.2 | AA135: 58 | AB135: -2.0999999999999999e-003 | AC135: -7.0999999999999995e-003 | AD135: -3.0800000000000001e-002 | AE135: -3.27e-002 | AF135: 80.95 | AG135: 80.68 | AH135: 0.72 | AI135: AA- | AJ135: 6.6799999999999998e-002 | AK135: =I135+100*T135 -> 137.69999999999999 | AL135: 137.2 | AM135: 179 | AN135: 56.3 | AO135: 229 | AP135: 2.5000000000000001e-002 | AQ135: 6 | AR135: 国光转债
A136: 63 | B136: 中矿转债 | C136: 128111 | D136: 44019. | E136: 中矿资源 | F136: 2738 | G136: 有色金属 | H136: 有色行业 | I136: 126.453 | J136: -5.1000000000000004e-003 | K136: 6.4000000000000003e-003 | L136: 20.06 | M136: 1.5e-003 | N136: 50 | O136: 5.0000000000000003e-002 | P136: 124.7 | Q136: 15.53 | R136: 2.06 | S136: 129.17 | T136: -2.1000000000000001e-002 | U136: 59天 | V136: 5.64年 | W136: 3.64年 | X136: 0.14300000000000002 | Y136: 0.185 | Z136: 8 | AA136: 56 | AB136: -2.5000000000000001e-003 | AC136: -9.7999999999999997e-003 | AD136: -4.9000000000000002e-002 | AE136: -5.1200000000000002e-002 | AF136: 82.01 | AG136: 87.3 | AH136: 0.86 | AI136: AA- | AJ136: 6.6799999999999998e-002 | AK136: =I136+100*T136 -> 124.35300000000001 | AL136: 123.7 | AM136: 39 | AN136: 36.4 | AO136: 71 | AP136: 0.13500000000000001 | AQ136: 6 | AR136: 中矿转债
A137: 128 | B137: 银河转债! | C137: 123042 | D137: 43875. | E137: 金银河 | F137: 300619 | G137: 机械装备 | H137: 专用设备 | I137: 117.5 | J137: 3.7000000000000005e-002 | K137: 8.3000000000000001e-003 | L137: 26.24 | M137: 5.7599999999999998e-002 | N137: 65 | O137: 0.33399999999999996 | P137: 115.9 | Q137: 24.4 | R137: 4.13 | S137: 107.54 | T137: 9.3000000000000013e-002 | U137: 转股中 | V137: 5.24年 | W137: 3.24年 | X137: 8.5000000000000006e-002 | Y137: 9.1999999999999998e-002 | Z137: 1.7 | AA137: 20 | AB137: -2.7000000000000001e-003 | AC137: -8.0000000000000002e-003 | AD137: -3.5000000000000003e-002 | AE137: -3.73e-002 | AF137: 81.07 | AG137: 79.06 | AH137: 0.79 | AI137: A+ | AJ137: 7.7800000000000008e-002 | AK137: =I137+100*T137 -> 126.8 | AL137: 127.5 | AM137: 73 | AN137: 46.4 | AO137: 178 | AP137: 0.13200000000000001 | AQ137: 24 | AR137: 银河转债!
A138: 25 | B138: 科华转债! | C138: 128124 | D138: 44063. | E138: 科华生物 | F138: 2022 | G138: 医药 | H138: 生物制药 | I138: 112.122 | J138: 2.e-003 | K138: 1.7000000000000001e-003 | L138: 20.65 | M138: 5.7999999999999996e-003 | N138: 23 | O138: 2.7999999999999997e-002 | P138: 110.3 | Q138: 21.5 | R138: 4.15 | S138: 96.05 | T138: 0.16699999999999998 | U138: 3月17天 | V138: 5.77年 | W138: 3.77年 | X138: 6.9000000000000006e-002 | Y138: 6.7000000000000004e-002 | Z138: 7.4 | AA138: 106 | AB138: -2.8999999999999998e-003 | AC138: -6.1999999999999998e-003 | AD138: -2.1299999999999999e-002 | AE138: -2.2799999999999997e-002 | AF138: 86.5 | AG138: 85.53 | AH138: 0.63 | AI138: AA | AJ138: 4.58e-002 | AK138: =I138+100*T138 -> 128.822 | AL138: 128.2 | AM138: 83 | AN138: 41.7 | AO138: 132 | AP138: 0.121 | AQ138: 9 | AR138: 科华转债!
A139: 231 | B139: 华源转债! | C139: 128049 | D139: 43454. | E139: 华源控股 | F139: 2787 | G139: 造纸包装 | H139: 包装材料 | I139: 116.58 | J139: 9.3999999999999986e-003 | K139: -4.7999999999999996e-003 | L139: 8.02 | M139: 6.3e-003 | N139: 6.3 | O139: 1.4999999999999999e-002 | P139: 115.2 | Q139: 7.42 | R139: 1.74 | S139: 108.09 | T139: 7.9000000000000001e-002 | U139: 转股中 | V139: 4年39天 | W139: 2年39天 | X139: 0.14300000000000002 | Y139: 0.155 | Z139: 3.6 | AA139: 25 | AB139: -3.0000000000000001e-003 | AC139: -9.4999999999999998e-003 | AD139: -5.1500000000000004e-002 | AE139: -5.4199999999999998e-002 | AF139: 89.78 | AG139: 89.3 | AH139: 0.72 | AI139: AA- | AJ139: 6.5599999999999992e-002 | AK139: =I139+100*T139 -> 124.48 | AL139: 125.1 | AM139: 56 | AN139: 35.3 | AO139: 62 | AP139: -4.0000000000000001e-003 | AQ139: 53 | AR139: 华源转债!
A140: 8 | B140: 青农转债 | C140: 128129 | D140: 44092. | E140: 青农商行 | F140: 2958 | G140: 金融 | H140: 银行行业 | I140: 114.2 | J140: 1.23e-002 | K140: -9.300000000000001e-003 | L140: 5.28 | M140: 5.6999999999999993e-003 | N140: 103 | O140: 1.8000000000000002e-002 | P140: 112.2 | Q140: 5.74 | R140: 1.17 | S140: 91.99 | T140: 0.24100000000000002 | U140: 4月13天 | V140: 5.85年 | W140: 无权 | X140: 0.17000000000000001 | Y140: 0.157 | Z140: 50 | AA140: 293 | AB140: -3.0999999999999999e-003 | AC140: -6.8000000000000005e-003 | AD140: 无权 | AE140: 无权 | AF140: 无权 | AG140: 89.09 | AH140: 0.54 | AI140: AAA | AJ140: 4.0800000000000003e-002 | AK140: =I140+100*T140 -> 138.30000000000001 | AL140: 136.4 | AM140: 172 | AN140: 47.3 | AO140: 185 | AP140: 8.0000000000000002e-003 | AQ140: 10 | AR140: 青农转债
A141: 299 | B141: 广汽转债!! | C141: 113009 | D141: 42404. | E141: 广汽集团 | F141: 601238 | G141: 汽车 | H141: 乘用车 | I141: 107.94 | J141: -2.3999999999999998e-003 | K141: 2.3e-003 | L141: 10.13 | M141: -6.8999999999999999e-003 | N141: 4.4 | O141: 2.e-003 | P141: 107.5 | Q141: 14.23 | R141: 1.29 | S141: 71.19 | T141: 0.51600000000000001 | U141: 转股中 | V141: 1.26年 | W141: 回售中 | X141: 2.5000000000000001e-002 | Y141: 1.7000000000000001e-002 | Z141: 25 | AA141: 1037. | AB141: -3.3e-003 | AC141: -1.44e-002 | AD141: 回售中 | AE141: 回售中 | AF141: 100.25 | AG141: 102.59 | AH141: 0.02 | AI141: AAA | AJ141: 3.8199999999999998e-002 | AK141: =I141+100*T141 -> 159.53999999999999 | AL141: 144.7 | AM141: 223 | AN141: 42.1 | AO141: 138 | AP141: 4.0000000000000001e-003 | AQ141: 14 | AR141: 广汽转债!!
A142: 68 | B142: 宝通转债 | C142: 123053 | D142: 44013. | E142: 宝通科技 | F142: 300031 | G142: 通信互联 | H142: 互联网 | I142: 123.801 | J142: -2.3999999999999998e-003 | K142: -7.1999999999999998e-003 | L142: 22.61 | M142: -1.2699999999999999e-002 | N142: 3.4 | O142: 5.0000000000000001e-003 | P142: 121.3 | Q142: 20.8 | R142: 3.2 | S142: 108.7 | T142: 0.13900000000000001 | U142: 53天 | V142: 5.63年 | W142: 3.63年 | X142: 5.5999999999999994e-002 | Y142: 6.0999999999999999e-002 | Z142: 5 | AA142: 90 | AB142: -3.7000000000000002e-003 | AC142: -1.01e-002 | AD142: -4.4800000000000006e-002 | AE142: -4.6799999999999994e-002 | AF142: 81.78 | AG142: 84.99 | AH142: 0.76 | AI142: AA- | AJ142: 6.6799999999999998e-002 | AK142: =I142+100*T142 -> 137.70099999999999 | AL142: 138.9 | AM142: 187 | AN142: 53.9 | AO142: 222 | AP142: 1.8000000000000002e-002 | AQ142: 4 | AR142: 宝通转债
A143: 252 | B143: 博世转债! | C143: 123010 | D143: 43326. | E143: 博世科 | F143: 300422 | G143: 城市公用 | H143: 三废处理 | I143: 113.94 | J143: 5.3e-003 | K143: -1.e-004 | L143: 11.86 | M143: 8.5000000000000006e-003 | N143: 1.6 | O143: 3.0000000000000001e-003 | P143: 112.3 | Q143: 12.2 | R143: 2.42 | S143: 97.21 | T143: 0.17199999999999999 | U143: 转股中 | V143: 3.71年 | W143: 1.71年 | X143: 8.900000000000001e-002 | Y143: 8.6999999999999994e-002 | Z143: 4.3 | AA143: 48 | AB143: -4.0000000000000001e-003 | AC143: -1.e-002 | AD143: -5.3699999999999998e-002 | AE143: -5.6399999999999999e-002 | AF143: 91.33 | AG143: 89.12 | AH143: 0.62 | AI143: AA- | AJ143: 6.5599999999999992e-002 | AK143: =I143+100*T143 -> 131.13999999999999 | AL143: 130.7 | AM143: 110 | AN143: 39.3 | AO143: 111 | AP143: -3.6000000000000004e-002 | AQ143: 24 | AR143: 博世转债!
A144: 132 | B144: 正裕转债! | C144: 113561 | D144: 43871. | E144: 正裕工业 | F144: 603089 | G144: 汽车 | H144: 零部件制 | I144: 121.2 | J144: 5.0000000000000001e-004 | K144: 8.5000000000000006e-003 | L144: 12.45 | M144: 1.06e-002 | N144: 8.8 | O144: 4.4999999999999998e-002 | P144: 118.5 | Q144: 10.23 | R144: 3.32 | S144: 121.7 | T144: -4.0000000000000001e-003 | U144: 转股中 | V144: 5.20年 | W144: 3.20年 | X144: 5.9000000000000004e-002 | Y144: 7.2000000000000008e-002 | Z144: 1.6 | AA144: 28 | AB144: -4.4000000000000003e-003 | AC144: -1.06e-002 | AD144: -4.3200000000000002e-002 | AE144: -4.5700000000000005e-002 | AF144: 81.65 | AG144: 81.11 | AH144: 0.85 | AI144: A+ | AJ144: 7.7800000000000008e-002 | AK144: =I144+100*T144 -> 120.8 | AL144: 120.7 | AM144: 13 | AN144: 39.1 | AO144: 108 | AP144: -9.0000000000000011e-003 | AQ144: 30 | AR144: 正裕转债!
A145: 81 | B145: 交科转债 | C145: 128107 | D145: 43973. | E145: 浙江交科 | F145: 2061 | G145: 建筑 | H145: 建筑工程 | I145: 118.09 | J145: -1.8e-003 | K145: -2.8999999999999998e-003 | L145: 5.76 | M145: -6.8999999999999999e-003 | N145: 6.8 | O145: 2.e-003 | P145: 115.3 | Q145: 5.36 | R145: 1.01 | S145: 107.46 | T145: 9.9000000000000005e-002 | U145: 9天 | V145: 5.51年 | W145: 3.51年 | X145: 0.316 | Y145: 0.33899999999999997 | Z145: 25 | AA145: 79 | AB145: -4.4000000000000003e-003 | AC145: -9.300000000000001e-003 | AD145: -3.4799999999999998e-002 | AE145: -3.6699999999999997e-002 | AF145: 88.82 | AG145: 91.48 | AH145: 0.68 | AI145: AA+ | AJ145: 4.3799999999999999e-002 | AK145: =I145+100*T145 -> 127.99000000000001 | AL145: 128.7 | AM145: 88 | AN145: 37.2 | AO145: 82 | AP145: -1.6e-002 | AQ145: 14 | AR145: 交科转债
A146: 268 | B146: 道氏转债!! | C146: 123007 | D146: 43126. | E146: 道氏技术 | F146: 300409 | G146: 建筑 | H146: 建筑行业 | I146: 113.117 | J146: 6.8000000000000005e-003 | K146: -1.1399999999999999e-002 | L146: 13.95 | M146: -8.5000000000000006e-003 | N146: 7.6 | O146: 2.2000000000000002e-002 | P146: 111.3 | Q146: 14.95 | R146: 2.69 | S146: 93.31 | T146: 0.21199999999999999 | U146: 转股中 | V146: 3.19年 | W146: 1.19年 | X146: 4.7e-002 | Y146: 4.4000000000000004e-002 | Z146: 3 | AA146: 64 | AB146: -5.1999999999999998e-003 | AC146: -1.1599999999999999e-002 | AD146: -6.8400000000000002e-002 | AE146: -7.2000000000000008e-002 | AF146: 94.42 | AG146: 91.3 | AH146: 0.53 | AI146: AA- | AJ146: 6.5599999999999992e-002 | AK146: =I146+100*T146 -> 134.31700000000001 | AL146: 132.9 | AM146: 128 | AN146: 38.5 | AO146: 101 | AP146: 3.7999999999999999e-002 | AQ146: 15 | AR146: 道氏转债!!
A147: 215 | B147: 博彦转债 | C147: 128057 | D147: 43557. | E147: 博彦科技 | F147: 2649 | G147: 计算机及 | H147: 软件开发 | I147: 119.888 | J147: 1.7000000000000001e-003 | K147: 6.4000000000000003e-003 | L147: 9.91 | M147: 1.0200000000000001e-002 | N147: 1.8 | O147: 3.0000000000000001e-003 | P147: 117.1 | Q147: 8.72 | R147: 1.9 | S147: 113.65 | T147: 5.5e-002 | U147: 转股中 | V147: 4.38年 | W147: 2.38年 | X147: 0.10099999999999999 | Y147: 0.114 | Z147: 5.3 | AA147: 53 | AB147: -5.5000000000000005e-003 | AC147: -1.23e-002 | AD147: -5.6399999999999999e-002 | AE147: -5.8899999999999994e-002 | AF147: 88.33 | AG147: 89.24 | AH147: 0.79 | AI147: AA- | AJ147: 6.5599999999999992e-002 | AK147: =I147+100*T147 -> 125.38800000000001 | AL147: 126.1 | AM147: 65 | AN147: 36.9 | AO147: 76 | AP147: 2.1000000000000001e-002 | AQ147: 29 | AR147: 博彦转债
A148: 135 | B148: 开润转债! | C148: 123039 | D148: 43853. | E148: 开润股份 | F148: 300577 | G148: 服装纺织 | H148: 纺织行业 | I148: 125.021 | J148: 1.8799999999999997e-002 | K148: 6.5000000000000002e-002 | L148: 39 | M148: 9.9499999999999991e-002 | N148: 221 | O148: 0.78200000000000003 | P148: 121.5 | Q148: 33.22 | R148: 9.65 | S148: 117.4 | T148: 6.5000000000000002e-002 | U148: 转股中 | V148: 5.19年 | W148: 3.19年 | X148: 2.6000000000000002e-002 | Y148: 3.1e-002 | Z148: 2.2 | AA148: 85 | AB148: -5.6000000000000008e-003 | AC148: -1.26e-002 | AD148: -5.2499999999999998e-002 | AE148: -5.4900000000000004e-002 | AF148: 81.65 | AG148: 83.21 | AH148: 0.84 | AI148: A+ | AJ148: 7.7800000000000008e-002 | AK148: =I148+100*T148 -> 131.52100000000002 | AL148: 132.6 | AM148: 126 | AN148: 49.4 | AO148: 196 | AP148: 0.23600000000000002 | AQ148: 22 | AR148: 开润转债!
A149: 108 | B149: 三祥转债! | C149: 113572 | D149: 43930. | E149: 三祥新材 | F149: 603663 | G149: 其他 | H149: 其他 | I149: 116.94 | J149: 4.0000000000000002e-004 | K149: -2.5999999999999999e-003 | L149: 15.56 | M149: -2.5999999999999999e-003 | N149: 1.9 | O149: 1.e-002 | P149: 113.2 | Q149: 14.19 | R149: 5.36 | S149: 109.65 | T149: 6.6000000000000003e-002 | U149: 转股中 | V149: 5.39年 | W149: 3.39年 | X149: 5.7000000000000002e-002 | Y149: 6.2e-002 | Z149: 1.7 | AA149: 30 | AB149: -6.0999999999999995e-003 | AC149: -1.0500000000000001e-002 | AD149: -3.3500000000000002e-002 | AE149: -3.5400000000000001e-002 | AF149: 79.63 | AG149: 76.21 | AH149: 0.83 | AI149: A+ | AJ149: 7.7800000000000008e-002 | AK149: =I149+100*T149 -> 123.53999999999999 | AL149: 124.2 | AM149: 44 | AN149: 44.6 | AO149: 163 | AP149: -9.5000000000000001e-002 | AQ149: 14 | AR149: 三祥转债!
A150: 115 | B150: 正元转债 | C150: 123043 | D150: 43921. | E150: 正元智慧 | F150: 300645 | G150: 计算机及 | H150: 软件开发 | I150: 125.499 | J150: 1.7899999999999999e-002 | K150: 8.0000000000000004e-004 | L150: 18.61 | M150: 2.2000000000000002e-002 | N150: 30 | O150: 0.14300000000000002 | P150: 121.4 | Q150: 15.41 | R150: 3.88 | S150: 120.77 | T150: 3.9e-002 | U150: 转股中 | V150: 5.38年 | W150: 3.38年 | X150: 7.0000000000000007e-002 | Y150: 8.5000000000000006e-002 | Z150: 1.7 | AA150: 24 | AB150: -6.3e-003 | AC150: -1.3000000000000001e-002 | AD150: -5.0799999999999998e-002 | AE150: -5.2999999999999999e-002 | AF150: 80.48 | AG150: 81.96 | AH150: 0.85 | AI150: A+ | AJ150: 7.7800000000000008e-002 | AK150: =I150+100*T150 -> 129.399 | AL150: 130.2 | AM150: 105 | AN150: 48.3 | AO150: 190 | AP150: 5.9000000000000004e-002 | AQ150: 18 | AR150: 正元转债
A151: 228 | B151: 光华转债! | C151: 128051 | D151: 43474. | E151: 光华科技 | F151: 2741 | G151: 电子 | H151: 元器件制 | I151: 118.6 | J151: -2.3999999999999998e-003 | K151: 7.000000000000001e-004 | L151: 14.53 | M151: -2.0999999999999999e-003 | N151: 5.6 | O151: 1.9e-002 | P151: 115.5 | Q151: 12.72 | R151: 4.53 | S151: 114.23 | T151: 3.7999999999999999e-002 | U151: 转股中 | V151: 4年56天 | W151: 2年56天 | X151: 4.5999999999999999e-002 | Y151: 5.2999999999999999e-002 | Z151: 2.5 | AA151: 54 | AB151: -6.5000000000000006e-003 | AC151: -1.3100000000000001e-002 | AD151: -5.6299999999999996e-002 | AE151: -5.9299999999999999e-002 | AF151: 89.77 | AG151: 89.3 | AH151: 0.78 | AI151: AA- | AJ151: 6.5599999999999992e-002 | AK151: =I151+100*T151 -> 122.39999999999999 | AL151: 123 | AM151: 30 | AN151: 33.2 | AO151: 45 | AP151: -1.e-003 | AQ151: 21 | AR151: 光华转债!
A152: 6 | B152: 万孚转债 | C152: 123064 | D152: 44097. | E152: 万孚生物 | F152: 300482 | G152: 医药 | H152: 医疗器械 | I152: 119.81 | J152: 1.2999999999999999e-003 | K152: -6.8999999999999999e-003 | L152: 87.11 | M152: -1.01e-002 | N152: 14 | O152: 2.e-002 | P152: 115.1 | Q152: 93.55 | R152: 11.52 | S152: 93.12 | T152: 0.28699999999999998 | U152: 4月20天 | V152: 5.87年 | W152: 3.87年 | X152: 2.e-002 | Y152: 1.9e-002 | Z152: 6 | AA152: 299 | AB152: -6.8999999999999999e-003 | AC152: -1.1399999999999999e-002 | AD152: -3.56e-002 | AE152: -3.73e-002 | AF152: 86.6 | AG152: 88.9 | AH152: 0.56 | AI152: AA | AJ152: 4.58e-002 | AK152: =I152+100*T152 -> 148.50999999999999 | AL152: 146.5 | AM152: 231 | AN152: 57.6 | AO152: 238 | AP152: 1.7000000000000001e-002 | AQ152: 4 | AR152: 万孚转债
A153: 91 | B153: 滨化转债 | C153: 113034 | D153: 43951. | E153: 滨化股份 | F153: 601678 | G153: 化工 | H153: 化工 | I153: 119.58 | J153: -1.67e-002 | K153: -1.2699999999999999e-002 | L153: 5.3 | M153: -3.9900000000000005e-002 | N153: 26 | O153: 9.0000000000000011e-003 | P153: 115.1 | Q153: 4.68 | R153: 1.36 | S153: 113.25 | T153: 5.5999999999999994e-002 | U153: 转股中 | V153: 5.47年 | W153: 3.47年 | X153: 0.29299999999999998 | Y153: 0.33200000000000002 | Z153: 24 | AA153: 82 | AB153: -7.0999999999999995e-003 | AC153: -1.1899999999999999e-002 | AD153: -3.8900000000000004e-002 | AE153: -4.07e-002 | AF153: 88.14 | AG153: 90.49 | AH153: 0.74 | AI153: AA | AJ153: 4.58e-002 | AK153: =I153+100*T153 -> 125.17999999999999 | AL153: 125.9 | AM153: 63 | AN153: 35.4 | AO153: 65 | AP153: -1.e-002 | AQ153: 27 | AR153: 滨化转债
A154: 186 | B154: 文灿转债! | C154: 113537 | D154: 43651. | E154: 文灿股份 | F154: 603348 | G154: 汽车 | H154: 零部件制 | I154: 125.78 | J154: -2.23e-002 | K154: 3.4000000000000002e-003 | L154: 24.03 | M154: -2.3199999999999998e-002 | N154: 12 | O154: 1.9e-002 | P154: 121.5 | Q154: 19.43 | R154: 2.44 | S154: 123.67 | T154: 1.7000000000000001e-002 | U154: 转股中 | V154: 4.64年 | W154: 2.64年 | X154: 8.6999999999999994e-002 | Y154: 0.10800000000000001 | Z154: 5.1 | AA154: 58 | AB154: -7.6e-003 | AC154: -1.54e-002 | AD154: -6.480000000000001e-002 | AE154: -6.7599999999999993e-002 | AF154: 87.55 | AG154: 91.14 | AH154: 0.82 | AI154: AA- | AJ154: 6.5599999999999992e-002 | AK154: =I154+100*T154 -> 127.48 | AL154: 127.9 | AM154: 79 | AN154: 36.7 | AO154: 75 | AP154: -1.1000000000000001e-002 | AQ154: 26 | AR154: 文灿转债!
A155: 196 | B155: 明泰转债! | C155: 113025 | D155: 43592. | E155: 明泰铝业 | F155: 601677 | G155: 有色金属 | H155: 铝金属 | I155: 119.34 | J155: 3.0499999999999999e-002 | K155: 2.5899999999999999e-002 | L155: 13.11 | M155: 7.46e-002 | N155: 154 | O155: 7.0000000000000007e-002 | P155: 115.1 | Q155: 11.2 | R155: 1.14 | S155: 117.05 | T155: 2.e-002 | U155: 转股中 | V155: 4.47年 | W155: 2.47年 | X155: 0.22800000000000001 | Y155: 0.26700000000000002 | Z155: 18 | AA155: 81 | AB155: -8.199999999999999e-003 | AC155: -1.4199999999999999e-002 | AD155: -5.3200000000000004e-002 | AE155: -5.5500000000000001e-002 | AF155: 92.29 | AG155: 95.07 | AH155: 0.76 | AI155: AA | AJ155: 4.4600000000000001e-002 | AK155: =I155+100*T155 -> 121.34 | AL155: 121.6 | AM155: 22 | AN155: 26.6 | AO155: 10 | AP155: 0.19399999999999998 | AQ155: 32 | AR155: 明泰转债!
A156: 116 | B156: 康弘转债! | C156: 128098 | D156: 43921. | E156: 康弘药业 | F156: 2773 | G156: 医药 | H156: 化学制药 | I156: 121.59 | J156: -3.1200000000000002e-002 | K156: -2.5000000000000001e-003 | L156: 42.93 | M156: -3.3799999999999997e-002 | N156: 141 | O156: 0.11900000000000001 | P156: 116.3 | Q156: 35.3 | R156: 7.96 | S156: 121.61 | T156: 0. | U156: 转股中 | V156: 5.38年 | W156: 3.38年 | X156: 2.6000000000000002e-002 | Y156: 3.1e-002 | Z156: 9.7 | AA156: 376 | AB156: -8.3999999999999995e-003 | AC156: -1.37e-002 | AD156: -4.41e-002 | AE156: -4.5999999999999999e-002 | AF156: 88.72 | AG156: 91.87 | AH156: 1 | AI156: AA | AJ156: 4.58e-002 | AK156: =I156+100*T156 -> 121.59 | AL156: 121.6 | AM156: 21 | AN156: 29.7 | AO156: 20 | AP156: -6.9000000000000006e-002 | AQ156: 23 | AR156: 康弘转债!
A157: 85 | B157: 聚飞转债 | C157: 123050 | D157: 43966. | E157: 聚飞光电 | F157: 300303 | G157: 电子 | H157: LED制 | I157: 130.002 | J157: 3.8e-003 | K157: 3.9000000000000003e-003 | L157: 6.48 | M157: 9.300000000000001e-003 | N157: 6.6 | O157: 6.9999999999999993e-003 | P157: 124.2 | Q157: 5.18 | R157: 3.52 | S157: 125.1 | T157: 3.9e-002 | U157: 1.0天 | V157: 5.49年 | W157: 3.49年 | X157: 8.5000000000000006e-002 | Y157: 0.106 | Z157: 7.1 | AA157: 83 | AB157: -8.5000000000000006e-003 | AC157: -1.5700000000000002e-002 | AD157: -5.96e-002 | AE157: -6.1500000000000006e-002 | AF157: 82.44 | AG157: 87.78 | AH157: 0.83 | AI157: AA- | AJ157: 6.6799999999999998e-002 | AK157: =I157+100*T157 -> 133.90200000000002 | AL157: 134.9 | AM157: 153 | AN157: 47.1 | AO157: 182 | AP157: -4.4000000000000004e-002 | AQ157: 11 | AR157: 聚飞转债
A158: 280 | B158: 众信转债! | C158: 128022 | D158: 43097. | E158: 众信旅游 | F158: 2707 | G158: 旅游餐饮 | H158: 旅游 | I158: 112.8 | J158: -3.9000000000000003e-003 | K158: -2.5600000000000001e-002 | L158: 7.2 | M158: -6.7400000000000002e-002 | N158: 9.8 | O158: 1.9e-002 | P158: 109.8 | Q158: 7.91 | R158: 3.18 | S158: 91.02 | T158: 0.23899999999999999 | U158: 转股中 | V158: 3年43天 | W158: 1年43天 | X158: 7.0000000000000007e-002 | Y158: 6.3e-002 | Z158: 4.6 | AA158: 66 | AB158: -8.8000000000000005e-003 | AC158: -1.46e-002 | AD158: -7.22e-002 | AE158: -7.5700000000000003e-002 | AF158: 97.02 | AG158: 96.12 | AH158: 0.44 | AI158: AA | AJ158: 4.4600000000000001e-002 | AK158: =I158+100*T158 -> 136.69999999999999 | AL158: 134.6 | AM158: 149 | AN158: 37.6 | AO158: 85 | AP158: -0.20600000000000002 | AQ158: 24 | AR158: 众信转债!
A159: 203 | B159: 现代转债 | C159: 110057 | D159: 43585. | E159: 现代制药 | F159: 600420 | G159: 医药 | H159: 化学制药 | I159: 115.25 | J159: 4.6999999999999993e-003 | K159: 1.3300000000000001e-002 | L159: 10.1 | M159: 2.8500000000000001e-002 | N159: 8.4 | O159: 5.0000000000000001e-003 | P159: 110.8 | Q159: 9.89 | R159: 1.37 | S159: 102.12 | T159: 0.129 | U159: 转股中 | V159: 4.45年 | W159: 2.45年 | X159: 0.156 | Y159: 0.159 | Z159: 16 | AA159: 104 | AB159: -9.0000000000000011e-003 | AC159: -1.34e-002 | AD159: -4.1299999999999996e-002 | AE159: -4.36e-002 | AF159: 93.41 | AG159: 93.54 | AH159: 0.63 | AI159: AAA | AJ159: 3.9599999999999996e-002 | AK159: =I159+100*T159 -> 128.15000000000001 | AL159: 128.4 | AM159: 84 | AN159: 34.8 | AO159: 57 | AP159: 3.4000000000000002e-002 | AQ159: 21 | AR159: 现代转债
A160: 22 | B160: 华阳转债 | C160: 128125 | D160: 44064. | E160: 华阳国际 | F160: 2949 | G160: 建筑 | H160: 建筑工程 | I160: 124.768 | J160: 3.5999999999999999e-003 | K160: 6.9999999999999993e-003 | L160: 28.38 | M160: 1.3600000000000001e-002 | N160: 3.5 | O160: 6.0000000000000001e-003 | P160: 118.5 | Q160: 25.79 | R160: 4.84 | S160: 110.04 | T160: 0.13400000000000001 | U160: 3月19天 | V160: 5.78年 | W160: 3.78年 | X160: 8.1000000000000003e-002 | Y160: 8.900000000000001e-002 | Z160: 4.5 | AA160: 56 | AB160: -9.0000000000000011e-003 | AC160: -1.4499999999999999e-002 | AD160: -4.5899999999999996e-002 | AE160: -4.7599999999999996e-002 | AF160: 80.65 | AG160: 82.15 | AH160: 0.78 | AI160: AA- | AJ160: 6.6799999999999998e-002 | AK160: =I160+100*T160 -> 138.16800000000001 | AL160: 139.5 | AM160: 195 | AN160: 57.3 | AO160: 234 | AP160: 2.4e-002 | AQ160: 2 | AR160: 华阳转债
A161: 267 | B161: 江银转债! | C161: 128034 | D161: 43145. | E161: 江阴银行 | F161: 2807 | G161: 金融 | H161: 银行行业 | I161: 112.4 | J161: 9.8999999999999991e-003 | K161: -7.4999999999999997e-003 | L161: 4.23 | M161: 4.7999999999999996e-003 | N161: 6.1 | O161: 3.0000000000000001e-003 | P161: 109.1 | Q161: 4.5 | R161: 0.81 | S161: 94 | T161: 0.19600000000000001 | U161: 转股中 | V161: 3.27年 | W161: 无权 | X161: 0.191 | Y161: 0.17999999999999999 | Z161: 18 | AA161: 92 | AB161: -9.1999999999999998e-003 | AC161: -1.43e-002 | AD161: 无权 | AE161: 无权 | AF161: 无权 | AG161: 95.4 | AH161: 0.5 | AI161: AA+ | AJ161: 4.2599999999999999e-002 | AK161: =I161+100*T161 -> 132. | AL161: 130.8 | AM161: 112 | AN161: 35.4 | AO161: 64 | AP161: 1.3000000000000001e-002 | AQ161: 27 | AR161: 江银转债!
A162: 165 | B162: 英联转债! | C162: 128079 | D162: 43790. | E162: 英联股份 | F162: 2846 | G162: 造纸包装 | H162: 包装材料 | I162: 123.398 | J162: 8.199999999999999e-003 | K162: -4.3e-003 | L162: 15.24 | M162: 4.0000000000000001e-003 | N162: 16 | O162: 8.6999999999999994e-002 | P162: 117.9 | Q162: 13.41 | R162: 4.31 | S162: 113.65 | T162: 8.5999999999999993e-002 | U162: 转股中 | V162: 5年2.0天 | W162: 3年2.0天 | X162: 5.0000000000000003e-002 | Y162: 5.7000000000000002e-002 | Z162: 1.5 | AA162: 30 | AB162: -9.300000000000001e-003 | AC162: -1.54e-002 | AD162: -5.2900000000000003e-002 | AE162: -5.5099999999999996e-002 | AF162: 82.31 | AG162: 81.76 | AH162: 0.99 | AI162: A+ | AJ162: 7.7800000000000008e-002 | AK162: =I162+100*T162 -> 131.99799999999999 | AL162: 133.1 | AM162: 131 | AN162: 50.8 | AO162: 203 | AP162: -2.6000000000000002e-002 | AQ162: 18 | AR162: 英联转债!
A163: 126 | B163: 柳药转债 | C163: 113563 | D163: 43885. | E163: 柳药股份 | F163: 603368 | G163: 医药 | H163: 医药商业 | I163: 118.79 | J163: 2.3999999999999998e-003 | K163: -2.0000000000000001e-004 | L163: 23.31 | M163: 3.9000000000000003e-003 | N163: 2.5 | O163: 3.0000000000000001e-003 | P163: 113.2 | Q163: 24.47 | R163: 1.84 | S163: 95.26 | T163: 0.247 | U163: 转股中 | V163: 5.24年 | W163: 3.24年 | X163: 9.5000000000000001e-002 | Y163: 8.9999999999999997e-002 | Z163: 8 | AA163: 85 | AB163: -9.300000000000001e-003 | AC163: -1.38e-002 | AD163: -3.9399999999999998e-002 | AE163: -4.1399999999999999e-002 | AF163: 89.16 | AG163: 89.94 | AH163: 0.59 | AI163: AA | AJ163: 4.58e-002 | AK163: =I163+100*T163 -> 143.49000000000001 | AL163: 142.3 | AM163: 210 | AN163: 52.4 | AO163: 215 | AP163: -2.2000000000000002e-002 | AQ163: 16 | AR163: 柳药转债
A164: 21 | B164: 法兰转债 | C164: 113598 | D164: 44068. | E164: 法兰泰克 | F164: 603966 | G164: 机械装备 | H164: 工程机械 | I164: 127.95 | J164: -1.5800000000000002e-002 | K164: 5.9999999999999995e-004 | L164: 15.38 | M164: -1.9799999999999998e-002 | N164: 2.9 | O164: 6.9999999999999993e-003 | P164: 121.2 | Q164: 13.88 | R164: 3.04 | S164: 110.81 | T164: 0.155 | U164: 3月20天 | V164: 5.78年 | W164: 3.78年 | X164: 0.10199999999999999 | Y164: 0.113 | Z164: 3.3 | AA164: 32 | AB164: -9.4999999999999998e-003 | AC164: -1.5700000000000002e-002 | AD164: -5.1299999999999998e-002 | AE164: -5.3200000000000004e-002 | AF164: 80.88 | AG164: 84.06 | AH164: 0.77 | AI164: AA- | AJ164: 6.6799999999999998e-002 | AK164: =I164+100*T164 -> 143.44999999999999 | AL164: 145.1 | AM164: 226 | AN164: 61 | AO164: 250 | AP164: -5.7999999999999996e-002 | AQ164: 5 | AR164: 法兰转债
A165: 179 | B165: 好客转债 | C165: 113542 | D165: 43700. | E165: 好莱客 | F165: 603898 | G165: 其他 | H165: 家居用品 | I165: 120.64 | J165: 9.4999999999999998e-003 | K165: -4.5999999999999999e-003 | L165: 17.43 | M165: 7.4999999999999997e-003 | N165: 3.9 | O165: 5.0000000000000001e-003 | P165: 114.9 | Q165: 16.27 | R165: 2.31 | S165: 107.13 | T165: 0.126 | U165: 转股中 | V165: 4.78年 | W165: 2.78年 | X165: 0.111 | Y165: 0.11900000000000001 | Z165: 6 | AA165: 54 | AB165: -1.03e-002 | AC165: -1.5800000000000002e-002 | AD165: -5.1399999999999994e-002 | AE165: -5.3399999999999996e-002 | AF165: 91.02 | AG165: 93.63 | AH165: 0.66 | AI165: AA | AJ165: 4.4600000000000001e-002 | AK165: =I165+100*T165 -> 133.24000000000001 | AL165: 134.2 | AM165: 142 | AN165: 40.5 | AO165: 124 | AP165: 2.3e-002 | AQ165: 19 | AR165: 好客转债
A166: 70 | B166: 家悦转债 | C166: 113584 | D166: 44006. | E166: 家家悦 | F166: 603708 | G166: 商业零售 | H166: 超市 | I166: 122.36 | J166: -2.2000000000000001e-003 | K166: 1.4000000000000002e-003 | L166: 33.82 | M166: -1.5e-003 | N166: 0.2 | O166: 0. | P166: 115.3 | Q166: 37.97 | R166: 7.09 | S166: 89.07 | T166: 0.374 | U166: 54天 | V166: 5.63年 | W166: 3.63年 | X166: 3.1e-002 | Y166: 2.7999999999999997e-002 | Z166: 6.5 | AA166: 206 | AB166: -1.0700000000000001e-002 | AC166: -1.54e-002 | AD166: -4.2800000000000005e-002 | AE166: -4.4600000000000001e-002 | AF166: 87.73 | AG166: 90.06 | AH166: 0.51 | AI166: AA | AJ166: 4.58e-002 | AK166: =I166+100*T166 -> 159.75999999999999 | AL166: 155.6 | AM166: 263 | AN166: 65.6 | AO166: 260 | AP166: -6.5000000000000002e-002 | AQ166: 4 | AR166: 家悦转债
A167: 9 | B167: 景20转债 | C167: 113602 | D167: 44096. | E167: 景旺电子 | F167: 603228 | G167: 电子 | H167: 元器件制 | I167: 120.5 | J167: -4.5000000000000005e-003 | K167: 2.5999999999999999e-003 | L167: 34.51 | M167: -2.8999999999999998e-003 | N167: 53 | O167: 2.5000000000000001e-002 | P167: 113.3 | Q167: 35.28 | R167: 5.1 | S167: 97.82 | T167: 0.23199999999999998 | U167: 4月13天 | V167: 5.85年 | W167: 3.85年 | X167: 6.0999999999999999e-002 | Y167: 5.9000000000000004e-002 | Z167: 18 | AA167: 294 | AB167: -1.0700000000000001e-002 | AC167: -1.47e-002 | AD167: -3.6799999999999999e-002 | AE167: -3.85e-002 | AF167: 86.87 | AG167: 87.64 | AH167: 0.64 | AI167: AA | AJ167: 4.58e-002 | AK167: =I167+100*T167 -> 143.69999999999999 | AL167: 143.2 | AM167: 214 | AN167: 55.5 | AO167: 225 | AP167: 2.1000000000000001e-002 | AQ167: 4 | AR167: 景20转债
A168: 226 | B168: 台华转债! | C168: 113525 | D168: 43476. | E168: 台华新材 | F168: 603055 | G168: 服装纺织 | H168: 纺织行业 | I168: 120.3 | J168: 1.5300000000000001e-002 | K168: -1.5300000000000001e-002 | L168: 8.93 | M168: 0. | N168: 17 | O168: 2.8999999999999998e-002 | P168: 114.9 | Q168: 8.03 | R168: 2.66 | S168: 111.21 | T168: 8.199999999999999e-002 | U168: 转股中 | V168: 4年59天 | W168: 2年59天 | X168: 6.8000000000000005e-002 | Y168: 7.4999999999999997e-002 | Z168: 4.7 | AA168: 69 | AB168: -1.1200000000000002e-002 | AC168: -1.7500000000000002e-002 | AD168: -6.3600000000000004e-002 | AE168: -6.6100000000000006e-002 | AF168: 93.52 | AG168: 96.2 | AH168: 0.69 | AI168: AA | AJ168: 4.4600000000000001e-002 | AK168: =I168+100*T168 -> 128.5 | AL168: 129.4 | AM168: 96 | AN168: 33.2 | AO168: 44 | AP168: -3.1e-002 | AQ168: 23 | AR168: 台华转债!
A169: 188 | B169: 三星转债 | C169: 113536 | D169: 43640. | E169: 三星新材 | F169: 603578 | G169: 家电 | H169: 零部件制 | I169: 120.87 | J169: 2.0999999999999999e-003 | K169: -1.8e-003 | L169: 23.18 | M169: 4.0000000000000002e-004 | N169: 11 | O169: 5.9000000000000004e-002 | P169: 114.8 | Q169: 19.54 | R169: 3.3 | S169: 118.63 | T169: 1.9e-002 | U169: 转股中 | V169: 4.61年 | W169: 2.61年 | X169: 7.0000000000000007e-002 | Y169: 8.3000000000000004e-002 | Z169: 1.5 | AA169: 21 | AB169: -1.1299999999999999e-002 | AC169: -1.6899999999999998e-002 | AD169: -5.5399999999999998e-002 | AE169: -5.7500000000000002e-002 | AF169: 91.6 | AG169: 94.22 | AH169: 0.74 | AI169: AA | AJ169: 4.4600000000000001e-002 | AK169: =I169+100*T169 -> 122.77000000000001 | AL169: 123.1 | AM169: 33 | AN169: 28.9 | AO169: 17 | AP169: 5.0999999999999997e-002 | AQ169: 38 | AR169: 三星转债
A170: 255 | B170: 华通转债! | C170: 128040 | D170: 43294. | E170: 华通医药 | F170: 2758 | G170: 医药 | H170: 医药商业 | I170: 116.998 | J170: 6.7000000000000002e-003 | K170: 8.3000000000000001e-003 | L170: 11.2 | M170: 2.3799999999999998e-002 | N170: 3.9 | O170: 1.4999999999999999e-002 | P170: 112.3 | Q170: 11.29 | R170: 3.79 | S170: 99.2 | T170: 0.17899999999999999 | U170: 转股中 | V170: 3.65年 | W170: 1.65年 | X170: 9.4e-002 | Y170: 9.4e-002 | Z170: 2.2 | AA170: 24 | AB170: -1.1399999999999999e-002 | AC170: -1.7399999999999999e-002 | AD170: -6.9099999999999995e-002 | AE170: -7.1900000000000006e-002 | AF170: 91.66 | AG170: 89.45 | AH170: 0.63 | AI170: AA- | AJ170: 6.5599999999999992e-002 | AK170: =I170+100*T170 -> 134.898 | AL170: 134.8 | AM170: 151 | AN170: 43.1 | AO170: 149 | AP170: 1.e-002 | AQ170: 30 | AR170: 华通转债!
A171: 230 | B171: 福能转债! | C171: 110048 | D171: 43462. | E171: 福能股份 | F171: 600483 | G171: 能源电力 | H171: 电力供应 | I171: 119.4 | J171: -3.3e-003 | K171: -7.3000000000000001e-003 | L171: 8.32 | M171: -1.77e-002 | N171: 12 | O171: 4.0000000000000001e-003 | P171: 113.9 | Q171: 8.12 | R171: 1.07 | S171: 102.46 | T171: 0.16500000000000001 | U171: 转股中 | V171: 4年49天 | W171: 2年49天 | X171: 0.193 | Y171: 0.19800000000000001 | Z171: 28 | AA171: 146 | AB171: -1.1599999999999999e-002 | AC171: -1.7500000000000002e-002 | AD171: -6.13e-002 | AE171: -6.3799999999999996e-002 | AF171: 94.04 | AG171: 96.22 | AH171: 0.6 | AI171: AA+ | AJ171: 4.2599999999999999e-002 | AK171: =I171+100*T171 -> 135.90000000000001 | AL171: 136.3 | AM171: 170 | AN171: 40.1 | AO171: 120 | AP171: 3.7000000000000005e-002 | AQ171: 9 | AR171: 福能转债!
A172: 213 | B172: 中鼎转2! | C172: 127011 | D172: 43559. | E172: 中鼎股份 | F172: 887 | G172: 汽车 | H172: 零部件制 | I172: 121.9 | J172: -1.1399999999999999e-002 | K172: -8.0000000000000004e-004 | L172: 11.03 | M172: -2.3900000000000001e-002 | N172: 9.7 | O172: 6.9999999999999993e-003 | P172: 115.2 | Q172: 11.59 | R172: 1.52 | S172: 95.17 | T172: 0.28100000000000003 | U172: 转股中 | V172: 4.38年 | W172: 2.38年 | X172: 8.900000000000001e-002 | Y172: 8.5000000000000006e-002 | Z172: 12 | AA172: 135 | AB172: -1.3100000000000001e-002 | AC172: -1.9099999999999999e-002 | AD172: -6.2699999999999992e-002 | AE172: -6.5099999999999991e-002 | AF172: 93.2 | AG172: 96.33 | AH172: 0.51 | AI172: AA+ | AJ172: 4.2599999999999999e-002 | AK172: =I172+100*T172 -> 150. | AL172: 148.6 | AM172: 238 | AN172: 52.3 | AO172: 213 | AP172: 2.7000000000000003e-002 | AQ172: 27 | AR172: 中鼎转2!
A173: 27 | B173: 三超转债 | C173: 123062 | D173: 44060. | E173: 三超新材 | F173: 300554 | G173: 机械装备 | H173: 通用设备 | I173: 129.5 | J173: 2.6200000000000001e-002 | K173: 1.9599999999999999e-002 | L173: 23.78 | M173: 4.9400000000000006e-002 | N173: 96 | O173: 0.379 | P173: 119.7 | Q173: 17.17 | R173: 4.35 | S173: 138.5 | T173: -6.5000000000000002e-002 | U173: 3月15天 | V173: 5.77年 | W173: 3.77年 | X173: 8.8000000000000009e-002 | Y173: 0.121 | Z173: 2 | AA173: 22 | AB173: -1.38e-002 | AC173: -1.9599999999999999e-002 | AD173: -5.33e-002 | AE173: -5.5300000000000002e-002 | AF173: 75.4 | AG173: 74.51 | AH173: 0.93 | AI173: A | AJ173: 8.7799999999999989e-002 | AK173: =I173+100*T173 -> 123. | AL173: 120.5 | AM173: 11 | AN173: 45.1 | AO173: 167 | AP173: 0.10300000000000001 | AQ173: 10 | AR173: 三超转债
A174: 271 | B174: 蒙电转债! | C174: 110041 | D174: 43109. | E174: 内蒙华电 | F174: 600863 | G174: 能源电力 | H174: 电力供应 | I174: 115.3 | J174: 6.8999999999999999e-003 | K174: 5.7999999999999996e-003 | L174: 2.69 | M174: 2.2799999999999997e-002 | N174: 1.2 | O174: 1.e-003 | P174: 110.3 | Q174: 2.69 | R174: 1.36 | S174: 100 | T174: 0.153 | U174: 转股中 | V174: 3.18年 | W174: 1.18年 | X174: 0.12 | Y174: 0.12 | Z174: 19 | AA174: 156 | AB174: -1.4199999999999999e-002 | AC174: -2.0099999999999996e-002 | AD174: -8.2699999999999996e-002 | AE174: -8.6300000000000002e-002 | AF174: 97.63 | AG174: 97.78 | AH174: 0.56 | AI174: AAA | AJ174: 3.9599999999999996e-002 | AK174: =I174+100*T174 -> 130.59999999999999 | AL174: 130.6 | AM174: 108 | AN174: 32.8 | AO174: 40 | AP174: 2.6000000000000002e-002 | AQ174: 8 | AR174: 蒙电转债!
A175: 161 | B175: 天路转债! | C175: 110060 | D175: 43797. | E175: 西藏天路 | F175: 600326 | G175: 建筑 | H175: 水泥 | I175: 123.69 | J175: -5.0000000000000001e-004 | K175: -4.8999999999999998e-003 | L175: 7.95 | M175: -7.4999999999999997e-003 | N175: 3.6 | O175: 4.0000000000000001e-003 | P175: 115.3 | Q175: 7.16 | R175: 1.92 | S175: 111.03 | T175: 0.114 | U175: 转股中 | V175: 5年9天 | W175: 3年9天 | X175: 9.6999999999999989e-002 | Y175: 0.107 | Z175: 7.1 | AA175: 73 | AB175: -1.4199999999999999e-002 | AC175: -1.95e-002 | AD175: -5.4000000000000006e-002 | AE175: -5.6100000000000004e-002 | AF175: 90.14 | AG175: 92.52 | AH175: 0.72 | AI175: AA | AJ175: 4.58e-002 | AK175: =I175+100*T175 -> 135.09 | AL175: 136.3 | AM175: 171 | AN175: 43.8 | AO175: 154 | AP175: -2.9999999999999999e-002 | AQ175: 12 | AR175: 天路转债!
A176: 168 | B176: 金能转债 | C176: 113545 | D176: 43776. | E176: 金能科技 | F176: 603113 | G176: 煤炭 | H176: 炼焦 | I176: 123.3 | J176: -9.5999999999999992e-003 | K176: 1.24e-002 | L176: 12.71 | M176: 3.9000000000000003e-003 | N176: 3 | O176: 2.e-003 | P176: 114.9 | Q176: 11.4 | R176: 1.46 | S176: 111.49 | T176: 0.106 | U176: 转股中 | V176: 4.99年 | W176: 2.99年 | X176: 0.17499999999999999 | Y176: 0.19500000000000001 | Z176: 15 | AA176: 86 | AB176: -1.43e-002 | AC176: -1.95e-002 | AD176: -5.4699999999999999e-002 | AE176: -5.6600000000000004e-002 | AF176: 90.22 | AG176: 92.8 | AH176: 0.71 | AI176: AA | AJ176: 4.4600000000000001e-002 | AK176: =I176+100*T176 -> 133.90000000000001 | AL176: 135.1 | AM176: 155 | AN176: 42.3 | AO176: 140 | AP176: 4.2999999999999997e-002 | AQ176: 20 | AR176: 金能转债
A177: 60 | B177: 比音转债 | C177: 128113 | D177: 44027. | E177: 比音勒芬 | F177: 2832 | G177: 服装纺织 | H177: 服装行业 | I177: 127.2 | J177: 5.0000000000000001e-004 | K177: -6.9999999999999993e-003 | L177: 17.78 | M177: -8.3999999999999995e-003 | N177: 14 | O177: 1.6e-002 | P177: 117.3 | Q177: 14.9 | R177: 4.74 | S177: 119.33 | T177: 6.6000000000000003e-002 | U177: 2月3天 | V177: 5.65年 | W177: 3.65年 | X177: 7.400000000000001e-002 | Y177: 8.8000000000000009e-002 | Z177: 6.9 | AA177: 93 | AB177: -1.4499999999999999e-002 | AC177: -1.9699999999999999e-002 | AD177: -5.2300000000000006e-002 | AE177: -5.4000000000000006e-002 | AF177: 87.62 | AG177: 91.5 | AH177: 0.78 | AI177: AA | AJ177: 4.58e-002 | AK177: =I177+100*T177 -> 133.80000000000001 | AL177: 135.1 | AM177: 154 | AN177: 43.6 | AO177: 151 | AP177: 6.9000000000000006e-002 | AQ177: 5 | AR177: 比音转债
A178: 79 | B178: 健友转债 | C178: 113579 | D178: 43973. | E178: 健友股份 | F178: 603707 | G178: 医药 | H178: 原料药 | I178: 123.68 | J178: -7.8000000000000005e-003 | K178: -4.5000000000000005e-003 | L178: 39.02 | M178: -2.18e-002 | N178: 2.5 | O178: 4.0000000000000001e-003 | P178: 114.2 | Q178: 42.05 | R178: 10.64 | S178: 92.79 | T178: 0.33299999999999996 | U178: 11天 | V178: 5.51年 | W178: 3.51年 | X178: 1.3999999999999999e-002 | Y178: 1.3000000000000001e-002 | Z178: 5 | AA178: 365 | AB178: -1.46e-002 | AC178: -1.9099999999999999e-002 | AD178: -4.7199999999999999e-002 | AE178: -4.9000000000000002e-002 | AF178: 88.09 | AG178: 89.66 | AH178: 0.56 | AI178: AA | AJ178: 4.58e-002 | AK178: =I178+100*T178 -> 156.98000000000002 | AL178: 154.6 | AM178: 260 | AN178: 64.9 | AO178: 256 | AP178: -9.6999999999999989e-002 | AQ178: 7 | AR178: 健友转债
A179: 57 | B179: 润达转债 | C179: 113588 | D179: 44025. | E179: 润达医疗 | F179: 603108 | G179: 医药 | H179: 医疗器械 | I179: 124.01 | J179: 1.e-004 | K179: -5.4000000000000003e-003 | L179: 13.61 | M179: -8.0000000000000002e-003 | N179: 1.5 | O179: 2.e-003 | P179: 114.2 | Q179: 13.36 | R179: 2.75 | S179: 101.87 | T179: 0.217 | U179: 2月5天 | V179: 5.66年 | W179: 3.66年 | X179: 7.0000000000000007e-002 | Y179: 7.0999999999999994e-002 | Z179: 5.5 | AA179: 79 | AB179: -1.47e-002 | AC179: -1.9099999999999999e-002 | AD179: -4.5999999999999999e-002 | AE179: -4.7699999999999992e-002 | AF179: 87.5 | AG179: 89.05 | AH179: 0.66 | AI179: AA | AJ179: 4.58e-002 | AK179: =I179+100*T179 -> 145.71000000000001 | AL179: 146.1 | AM179: 229 | AN179: 57.1 | AO179: 232 | AP179: 3.0000000000000001e-003 | AQ179: 7 | AR179: 润达转债
A180: 39 | B180: 宏川转债 | C180: 128121 | D180: 44050. | E180: 宏川智慧 | F180: 2930 | G180: 交通运输 | H180: 物流业 | I180: 123.2 | J180: -1.4199999999999999e-002 | K180: -1.7000000000000001e-002 | L180: 21.2 | M180: -3.9900000000000005e-002 | N180: 4.8 | O180: 6.0000000000000001e-003 | P180: 113.3 | Q180: 20.25 | R180: 5.11 | S180: 104.69 | T180: 0.17699999999999999 | U180: 3月8天 | V180: 5.74年 | W180: 3.74年 | X180: 7.0999999999999994e-002 | Y180: 7.4999999999999997e-002 | Z180: 6.7 | AA180: 94 | AB180: -1.47e-002 | AC180: -1.8799999999999997e-002 | AD180: -4.3299999999999998e-002 | AE180: -4.4999999999999998e-002 | AF180: 80.81 | AG180: 78.74 | AH180: 0.78 | AI180: AA- | AJ180: 6.6799999999999998e-002 | AK180: =I180+100*T180 -> 140.90000000000001 | AL180: 141.7 | AM180: 205 | AN180: 60.9 | AO180: 248 | AP180: 0.10099999999999999 | AQ180: 4 | AR180: 宏川转债
A181: 118 | B181: 盛屯转债! | C181: 110066 | D181: 43921. | E181: 盛屯矿业 | F181: 600711 | G181: 有色金属 | H181: 有色行业 | I181: 124.75 | J181: -5.0000000000000001e-004 | K181: -2.2000000000000001e-003 | L181: 5.68 | M181: -3.4999999999999996e-003 | N181: 7.8 | O181: 3.0000000000000001e-003 | P181: 115.3 | Q181: 4.88 | R181: 1.45 | S181: 116.39 | T181: 7.2000000000000008e-002 | U181: 转股中 | V181: 5.37年 | W181: 3.37年 | X181: 0.17899999999999999 | Y181: 0.20899999999999999 | Z181: 24 | AA181: 131 | AB181: -1.4800000000000001e-002 | AC181: -1.9799999999999998e-002 | AD181: -5.1200000000000002e-002 | AE181: -5.3099999999999994e-002 | AF181: 88.76 | AG181: 91.11 | AH181: 0.76 | AI181: AA | AJ181: 4.58e-002 | AK181: =I181+100*T181 -> 131.94999999999999 | AL181: 133.1 | AM181: 129 | AN181: 42 | AO181: 137 | AP181: -1.9e-002 | AQ181: 44 | AR181: 盛屯转债!
A182: 152 | B182: 烽火转债 | C182: 110062 | D182: 43824. | E182: 烽火通信 | F182: 600498 | G182: 通信互联 | H182: 通信设备 | I182: 119.8 | J182: -7.000000000000001e-004 | K182: -2.0999999999999999e-003 | L182: 24.32 | M182: -4.8999999999999998e-003 | N182: 1.7 | O182: 0. | P182: 111 | Q182: 25.65 | R182: 2.73 | S182: 94.81 | T182: 0.26400000000000001 | U182: 转股中 | V182: 5年44天 | W182: 3年44天 | X182: 0.10800000000000001 | Y182: 0.10300000000000001 | Z182: 31 | AA182: 285 | AB182: -1.5100000000000001e-002 | AC182: -1.89e-002 | AD182: -4.3899999999999995e-002 | AE182: -4.58e-002 | AF182: 90.86 | AG182: 90.81 | AH182: 0.57 | AI182: AAA | AJ182: 4.0800000000000003e-002 | AK182: =I182+100*T182 -> 146.19999999999999 | AL182: 144.8 | AM182: 224 | AN182: 53.9 | AO182: 223 | AP182: 2.e-003 | AQ182: 19 | AR182: 烽火转债
A183: 65 | B183: 永兴转债 | C183: 128110 | D183: 44020. | E183: 永兴材料 | F183: 2756 | G183: 钢铁 | H183: 炼钢 | I183: 123.39 | J183: 9.7999999999999997e-003 | K183: 2.3799999999999998e-002 | L183: 18.28 | M183: 4.7599999999999996e-002 | N183: 9.7 | O183: 1.1000000000000001e-002 | P183: 113.2 | Q183: 17.06 | R183: 1.94 | S183: 107.15 | T183: 0.152 | U183: 57天 | V183: 5.64年 | W183: 3.64年 | X183: 0.105 | Y183: 0.11199999999999999 | Z183: 7 | AA183: 67 | AB183: -1.54e-002 | AC183: -1.9599999999999999e-002 | AD183: -4.4999999999999998e-002 | AE183: -4.6699999999999998e-002 | AF183: 87.59 | AG183: 88.36 | AH183: 0.71 | AI183: AA | AJ183: 4.58e-002 | AK183: =I183+100*T183 -> 138.59 | AL183: 139.6 | AM183: 196 | AN183: 51.3 | AO183: 208 | AP183: 6.5000000000000002e-002 | AQ183: 4 | AR183: 永兴转债
A184: 136 | B184: 联得转债! | C184: 123038 | D184: 43852. | E184: 联得装备 | F184: 300545 | G184: 机械装备 | H184: 专用设备 | I184: 128.888 | J184: 7.000000000000001e-004 | K184: -5.6000000000000008e-003 | L184: 31.39 | M184: -5.6999999999999993e-003 | N184: 3 | O184: 1.6e-002 | P184: 119.1 | Q184: 25.29 | R184: 6.44 | S184: 124.12 | T184: 3.7999999999999999e-002 | U184: 转股中 | V184: 5.18年 | W184: 3.18年 | X184: 3.2000000000000001e-002 | Y184: 4.0000000000000001e-002 | Z184: 1.5 | AA184: 46 | AB184: -1.55e-002 | AC184: -2.1700000000000001e-002 | AD184: -6.1799999999999994e-002 | AE184: -6.4100000000000004e-002 | AF184: 81.48 | AG184: 81.56 | AH184: 0.87 | AI184: A+ | AJ184: 7.7800000000000008e-002 | AK184: =I184+100*T184 -> 132.68800000000002 | AL184: 133.7 | AM184: 134 | AN184: 52.1 | AO184: 211 | AP184: -1.1000000000000001e-002 | AQ184: 14 | AR184: 联得转债!
A185: 29 | B185: 国投转债 | C185: 110073 | D185: 44063. | E185: 国投资本 | F185: 600061 | G185: 金融 | H185: 证券行业 | I185: 120.9 | J185: 4.6999999999999993e-003 | K185: -5.8999999999999999e-003 | L185: 15.25 | M185: -2.e-003 | N185: 91 | O185: 9.0000000000000011e-003 | P185: 110.5 | Q185: 15.25 | R185: 1.59 | S185: 100 | T185: 0.20899999999999999 | U185: 3月15天 | V185: 5.76年 | W185: 无权 | X185: 0.124 | Y185: 0.124 | Z185: 80 | AA185: 645 | AB185: -1.5700000000000002e-002 | AC185: -1.89e-002 | AD185: 无权 | AE185: 无权 | AF185: 无权 | AG185: 88 | AH185: 0.64 | AI185: AAA | AJ185: 4.0800000000000003e-002 | AK185: =I185+100*T185 -> 141.80000000000001 | AL185: 141.8 | AM185: 207 | AN185: 53.8 | AO185: 219 | AP185: 1.3000000000000001e-002 | AQ185: 20 | AR185: 国投转债
A186: 58 | B186: 晨光转债 | C186: 123055 | D186: 44025. | E186: 晨光生物 | F186: 300138 | G186: 食品饮料 | H186: 食品加工 | I186: 135.8 | J186: 1.34e-002 | K186: -1.5600000000000001e-002 | L186: 16.09 | M186: -2.5000000000000001e-003 | N186: 7.2 | O186: 8.0000000000000002e-003 | P186: 124.3 | Q186: 12.25 | R186: 4.38 | S186: 131.35 | T186: 3.4000000000000002e-002 | U186: 2月5天 | V186: 5.66年 | W186: 3.66年 | X186: 7.5999999999999998e-002 | Y186: 0.10000000000000001 | Z186: 6.3 | AA186: 82 | AB186: -1.5800000000000002e-002 | AC186: -2.2799999999999997e-002 | AD186: -6.7500000000000004e-002 | AE186: -6.9400000000000003e-002 | AF186: 81.61 | AG186: 86.89 | AH186: 0.87 | AI186: AA- | AJ186: 6.6799999999999998e-002 | AK186: =I186+100*T186 -> 139.20000000000002 | AL186: 140.3 | AM186: 201 | AN186: 53.4 | AO186: 217 | AP186: 4.9000000000000002e-002 | AQ186: 6 | AR186: 晨光转债
A187: 71 | B187: 楚江转债 | C187: 128109 | D187: 44005. | E187: 楚江新材 | F187: 2171 | G187: 有色金属 | H187: 铜金属 | I187: 126.177 | J187: -1.6500000000000001e-002 | K187: 9.7999999999999997e-003 | L187: 10.05 | M187: -8.8999999999999999e-003 | N187: 7.7 | O187: 3.0000000000000001e-003 | P187: 115.3 | Q187: 8.73 | R187: 2.5 | S187: 115.12 | T187: 9.6000000000000002e-002 | U187: 52天 | V187: 5.62年 | W187: 3.62年 | X187: 0.13699999999999998 | Y187: 0.157 | Z187: 18 | AA187: 134 | AB187: -1.6200000000000003e-002 | AC187: -2.0899999999999998e-002 | AD187: -5.0599999999999999e-002 | AE187: -5.2400000000000002e-002 | AF187: 87.74 | AG187: 90.07 | AH187: 0.75 | AI187: AA | AJ187: 4.58e-002 | AK187: =I187+100*T187 -> 135.77700000000002 | AL187: 137.2 | AM187: 178 | AN187: 47.2 | AO187: 184 | AP187: 2.5000000000000001e-002 | AQ187: 5 | AR187: 楚江转债
A188: 88 | B188: 华统转债 | C188: 128106 | D188: 43959. | E188: 华统股份 | F188: 2840 | G188: 农业 | H188: 农产品加 | I188: 123.65 | J188: 5.3e-003 | K188: -1.3100000000000001e-002 | L188: 10.45 | M188: -1.04e-002 | N188: 3.9 | O188: 6.0000000000000001e-003 | P188: 113.2 | Q188: 9.39 | R188: 1.77 | S188: 111.29 | T188: 0.111 | U188: 转股中 | V188: 5.47年 | W188: 3.47年 | X188: 0.11800000000000001 | Y188: 0.13100000000000001 | Z188: 5.5 | AA188: 47 | AB188: -1.6299999999999999e-002 | AC188: -2.0499999999999997e-002 | AD188: -4.7599999999999996e-002 | AE188: -4.9400000000000006e-002 | AF188: 88.23 | AG188: 89.02 | AH188: 0.75 | AI188: AA | AJ188: 4.58e-002 | AK188: =I188+100*T188 -> 134.75 | AL188: 136 | AM188: 166 | AN188: 47 | AO188: 181 | AP188: -6.9999999999999993e-003 | AQ188: 7 | AR188: 华统转债
A189: 73 | B189: 万青转债 | C189: 127017 | D189: 44014. | E189: 万年青 | F189: 789 | G189: 建筑 | H189: 水泥 | I189: 129.7 | J189: -1.37e-002 | K189: 6.8000000000000005e-003 | L189: 15.35 | M189: -1.03e-002 | N189: 3.5 | O189: 3.0000000000000001e-003 | P189: 118.4 | Q189: 14.16 | R189: 2.35 | S189: 108.4 | T189: 0.19600000000000001 | U189: 51天 | V189: 5.62年 | W189: 3.62年 | X189: 8.199999999999999e-002 | Y189: 8.900000000000001e-002 | Z189: 10 | AA189: 122 | AB189: -1.6399999999999998e-002 | AC189: -2.1899999999999999e-002 | AD189: -5.7699999999999994e-002 | AE189: -5.9400000000000001e-002 | AF189: 88.32 | AG189: 93.47 | AH189: 0.66 | AI189: AA+ | AJ189: 4.3799999999999999e-002 | AK189: =I189+100*T189 -> 149.29999999999998 | AL189: 151 | AM189: 249 | AN189: 57.5 | AO189: 235 | AP189: -2.6000000000000002e-002 | AQ189: 7 | AR189: 万青转债
A190: 211 | B190: 伊力转债! | C190: 110055 | D190: 43559. | E190: 伊力特 | F190: 600197 | G190: 食品饮料 | H190: 白酒 | I190: 123.99 | J190: -1.2800000000000001e-002 | K190: 5.9999999999999995e-004 | L190: 18.7 | M190: -1.7299999999999999e-002 | N190: 11 | O190: 1.e-002 | P190: 115 | Q190: 16.81 | R190: 3.11 | S190: 111.24 | T190: 0.115 | U190: 转股中 | V190: 4.40年 | W190: 2.40年 | X190: 0.107 | Y190: 0.11900000000000001 | Z190: 8.7 | AA190: 81 | AB190: -1.7299999999999999e-002 | AC190: -2.3199999999999998e-002 | AD190: -6.8600000000000008e-002 | AE190: -7.0900000000000005e-002 | AF190: 92.64 | AG190: 95.29 | AH190: 0.7 | AI190: AA | AJ190: 4.4600000000000001e-002 | AK190: =I190+100*T190 -> 135.49000000000001 | AL190: 136.7 | AM190: 174 | AN190: 41.4 | AO190: 128 | AP190: -1.e-002 | AQ190: 24 | AR190: 伊力转债!
A191: 43 | B191: 龙大转债 | C191: 128119 | D191: 44050. | E191: 龙大肉食 | F191: 2726 | G191: 食品饮料 | H191: 肉制品 | I191: 132.602 | J191: -3.0000000000000001e-003 | K191: 6.9999999999999993e-003 | L191: 10.92 | M191: 5.5000000000000005e-003 | N191: 9.4 | O191: 6.9999999999999993e-003 | P191: 120.2 | Q191: 9.56 | R191: 4.2 | S191: 114.23 | T191: 0.161 | U191: 3月0天 | V191: 5.73年 | W191: 3.73年 | X191: 8.6999999999999994e-002 | Y191: 0.10000000000000001 | Z191: 9.5 | AA191: 109 | AB191: -1.7299999999999999e-002 | AC191: -2.3099999999999999e-002 | AD191: -6.1600000000000002e-002 | AE191: -6.3200000000000006e-002 | AF191: 87.22 | AG191: 93.41 | AH191: 0.72 | AI191: AA | AJ191: 4.58e-002 | AK191: =I191+100*T191 -> 148.702 | AL191: 151 | AM191: 248 | AN191: 57.6 | AO191: 237 | AP191: 3.5000000000000003e-002 | AQ191: 5 | AR191: 龙大转债
A192: 204 | B192: 精测转债!! | C192: 123025 | D192: 43574. | E192: 精测电子 | F192: 300567 | G192: 电子 | H192: 液晶显示 | I192: 126.8 | J192: -8.6e-003 | K192: 1.1999999999999999e-003 | L192: 55.45 | M192: -9.7999999999999997e-003 | N192: 5.2 | O192: 1.3000000000000001e-002 | P192: 117.3 | Q192: 49.95 | R192: 9.59 | S192: 111.01 | T192: 0.14199999999999999 | U192: 转股中 | V192: 4.44年 | W192: 2.44年 | X192: 2.3e-002 | Y192: 2.5000000000000001e-002 | Z192: 3.1 | AA192: 137 | AB192: -1.77e-002 | AC192: -2.4399999999999998e-002 | AD192: -7.5199999999999989e-002 | AE192: -7.7600000000000002e-002 | AF192: 87.99 | AG192: 89.03 | AH192: 0.75 | AI192: AA- | AJ192: 6.5599999999999992e-002 | AK192: =I192+100*T192 -> 141. | AL192: 142.6 | AM192: 211 | AN192: 53.6 | AO192: 218 | AP192: 3.2000000000000001e-002 | AQ192: 17 | AR192: 精测转债!!
A193: 180 | B193: 荣晟转债! | C193: 113541 | D193: 43690. | E193: 荣晟环保 | F193: 603165 | G193: 造纸包装 | H193: 包装用纸 | I193: 125.07 | J193: -3.61e-002 | K193: -2.e-003 | L193: 14.38 | M193: -4.5199999999999997e-002 | N193: 22 | O193: 6.3e-002 | P193: 115 | Q193: 11.54 | R193: 2.48 | S193: 124.61 | T193: 4.0000000000000001e-003 | U193: 转股中 | V193: 4.76年 | W193: 2.76年 | X193: 7.6999999999999999e-002 | Y193: 9.6000000000000002e-002 | Z193: 2.8 | AA193: 36 | AB193: -1.78e-002 | AC193: -2.3300000000000001e-002 | AD193: -6.3200000000000006e-002 | AE193: -6.5299999999999997e-002 | AF193: 86.11 | AG193: 85.52 | AH193: 0.84 | AI193: AA- | AJ193: 6.5599999999999992e-002 | AK193: =I193+100*T193 -> 125.47 | AL193: 125.5 | AM193: 59 | AN193: 39.4 | AO193: 114 | AP193: 2.7999999999999997e-002 | AQ193: 48 | AR193: 荣晟转债!
A194: 141 | B194: 至纯转债! | C194: 113556 | D194: 43839. | E194: 至纯科技 | F194: 603690 | G194: 机械装备 | H194: 专用设备 | I194: 138.83 | J194: -1.06e-002 | K194: 4.5999999999999999e-003 | L194: 36.75 | M194: -6.9999999999999993e-003 | N194: 114 | O194: 0.26700000000000002 | P194: 126.8 | Q194: 29.37 | R194: 6.74 | S194: 125.13 | T194: 0.11 | U194: 转股中 | V194: 5.17年 | W194: 3.17年 | X194: 3.1e-002 | Y194: 3.9e-002 | Z194: 3 | AA194: 96 | AB194: -1.78e-002 | AC194: -2.6000000000000002e-002 | AD194: -8.199999999999999e-002 | AE194: -8.43e-002 | AF194: 81.84 | AG194: 86.91 | AH194: 0.86 | AI194: A+ | AJ194: 7.7800000000000008e-002 | AK194: =I194+100*T194 -> 149.83000000000001 | AL194: 152.5 | AM194: 254 | AN194: 65.6 | AO194: 261 | AP194: -1.4999999999999999e-002 | AQ194: 12 | AR194: 至纯转债!
A195: 289 | B195: 林洋转债! | C195: 113014 | D195: 43052. | E195: 林洋能源 | F195: 601222 | G195: 能源电力 | H195: 电力设备 | I195: 116.35 | J195: 2.0999999999999999e-003 | K195: -4.4000000000000003e-003 | L195: 7.96 | M195: -5.0000000000000001e-003 | N195: 27 | O195: 8.0000000000000002e-003 | P195: 110.3 | Q195: 8.54 | R195: 1.38 | S195: 93.21 | T195: 0.248 | U195: 转股中 | V195: 3年8天 | W195: 1年8天 | X195: 0.21600000000000003 | Y195: 0.20100000000000001 | Z195: 30 | AA195: 139 | AB195: -1.7899999999999999e-002 | AC195: -2.41e-002 | AD195: -0.10000000000000001 | AE195: -0.10000000000000001 | AF195: 97.66 | AG195: 96.99 | AH195: 0.46 | AI195: AA | AJ195: 4.4600000000000001e-002 | AK195: =I195+100*T195 -> 141.15000000000001 | AL195: 139.5 | AM195: 194 | AN195: 41.8 | AO195: 134 | AP195: 8.9999999999999997e-002 | AQ195: 22 | AR195: 林洋转债!
A196: 156 | B196: 利德转债! | C196: 123035 | D196: 43808. | E196: 利亚德 | F196: 300296 | G196: 电子 | H196: LED制 | I196: 126.59 | J196: -5.0000000000000001e-003 | K196: 9.5999999999999992e-003 | L196: 7.74 | M196: 6.5000000000000006e-003 | N196: 9.5 | O196: 9.0000000000000011e-003 | P196: 115.6 | Q196: 6.98 | R196: 2.32 | S196: 110.89 | T196: 0.14199999999999999 | U196: 转股中 | V196: 5年26天 | W196: 3年26天 | X196: 4.0999999999999995e-002 | Y196: 4.4999999999999998e-002 | Z196: 8 | AA196: 197 | AB196: -1.8100000000000002e-002 | AC196: -2.3399999999999997e-002 | AD196: -5.9400000000000001e-002 | AE196: -6.1500000000000006e-002 | AF196: 90.79 | AG196: 93.5 | AH196: 0.7 | AI196: AA+ | AJ196: 4.3799999999999999e-002 | AK196: =I196+100*T196 -> 140.78999999999999 | AL196: 142.3 | AM196: 209 | AN196: 48.8 | AO196: 192 | AP196: -5.5e-002 | AQ196: 16 | AR196: 利德转债!
A197: 72 | B197: 今天转债 | C197: 123051 | D197: 44012. | E197: 今天国际 | F197: 300532 | G197: 计算机及 | H197: 软件开发 | I197: 136.3 | J197: -1.5900000000000001e-002 | K197: 7.000000000000001e-004 | L197: 13.06 | M197: -1.66e-002 | N197: 21 | O197: 5.5e-002 | P197: 122.8 | Q197: 8.8 | R197: 4.45 | S197: 148.41 | T197: -8.199999999999999e-002 | U197: 52天 | V197: 5.62年 | W197: 3.62年 | X197: 7.8e-002 | Y197: 0.11599999999999999 | Z197: 2.8 | AA197: 36 | AB197: -1.8799999999999997e-002 | AC197: -2.5399999999999999e-002 | AD197: -6.7900000000000002e-002 | AE197: -7.0000000000000007e-002 | AF197: 79.11 | AG197: 81.4 | AH197: 0.92 | AI197: A+ | AJ197: 7.7800000000000008e-002 | AK197: =I197+100*T197 -> 128.10000000000002 | AL197: 124.2 | AM197: 43 | AN197: 42.8 | AO197: 146 | AP197: 7.0999999999999994e-002 | AQ197: 11 | AR197: 今天转债
A198: 59 | B198: 正邦转债 | C198: 128114 | D198: 44027. | E198: 正邦科技 | F198: 2157 | G198: 农业 | H198: 畜牧业 | I198: 128.1 | J198: -5.4000000000000003e-003 | K198: 8.6e-003 | L198: 18.68 | M198: 4.3e-003 | N198: 34 | O198: 1.6e-002 | P198: 115.3 | Q198: 16.09 | R198: 3.97 | S198: 116.1 | T198: 0.10300000000000001 | U198: 2月5天 | V198: 5.66年 | W198: 3.66年 | X198: 3.4000000000000002e-002 | Y198: 3.9e-002 | Z198: 16 | AA198: 471 | AB198: -1.8799999999999997e-002 | AC198: -2.3399999999999997e-002 | AD198: -5.3899999999999997e-002 | AE198: -5.57e-002 | AF198: 88.24 | AG198: 90.89 | AH198: 0.75 | AI198: AA+ | AJ198: 4.3799999999999999e-002 | AK198: =I198+100*T198 -> 138.40000000000001 | AL198: 140.1 | AM198: 199 | AN198: 49.2 | AO198: 194 | AP198: 0. | AQ198: 8 | AR198: 正邦转债
A199: 157 | B199: 川投转债 | C199: 110061 | D199: 43801. | E199: 川投能源 | F199: 600674 | G199: 能源电力 | H199: 水电 | I199: 122.09 | J199: -6.8000000000000005e-003 | K199: 2.8999999999999998e-003 | L199: 9.81 | M199: -6.0999999999999995e-003 | N199: 3.4 | O199: 1.e-003 | P199: 111 | Q199: 9.58 | R199: 1.65 | S199: 102.4 | T199: 0.192 | U199: 转股中 | V199: 5年23天 | W199: 3年23天 | X199: 9.3000000000000013e-002 | Y199: 9.5000000000000001e-002 | Z199: 40 | AA199: 432 | AB199: -1.9e-002 | AC199: -2.2799999999999997e-002 | AD199: -5.0300000000000004e-002 | AE199: -5.2199999999999996e-002 | AF199: 91.07 | AG199: 91.02 | AH199: 0.65 | AI199: AAA | AJ199: 4.0800000000000003e-002 | AK199: =I199+100*T199 -> 141.28999999999999 | AL199: 141.8 | AM199: 206 | AN199: 50.7 | AO199: 201 | AP199: -1.3999999999999999e-002 | AQ199: 15 | AR199: 川投转债
A200: 119 | B200: 桐20转债! | C200: 113032 | D200: 43910. | E200: 桐昆股份 | F200: 601233 | G200: 服装纺织 | H200: 纺织行业 | I200: 125.75 | J200: -1.7000000000000001e-002 | K200: 1.61e-002 | L200: 16.54 | M200: -1.1999999999999999e-003 | N200: 14 | O200: 5.0000000000000001e-003 | P200: 113.1 | Q200: 14.35 | R200: 1.58 | S200: 115.26 | T200: 9.0999999999999998e-002 | U200: 转股中 | V200: 5.37年 | W200: 3.37年 | X200: 7.4999999999999997e-002 | Y200: 8.6999999999999994e-002 | Z200: 23 | AA200: 306 | AB200: -1.9900000000000001e-002 | AC200: -2.4199999999999999e-002 | AD200: -5.3800000000000001e-002 | AE200: -5.5599999999999997e-002 | AF200: 89.16 | AG200: 90.25 | AH200: 0.77 | AI200: AA+ | AJ200: 4.3799999999999999e-002 | AK200: =I200+100*T200 -> 134.84999999999999 | AL200: 136.2 | AM200: 168 | AN200: 46 | AO200: 175 | AP200: 0.111 | AQ200: 20 | AR200: 桐20转债!
A201: 105 | B201: 雷迪转债 | C201: 123045 | D201: 43934. | E201: 雷迪克 | F201: 300652 | G201: 汽车 | H201: 零部件制 | I201: 133 | J201: -2.5600000000000001e-002 | K201: -1.4999999999999999e-002 | L201: 27.75 | M201: -4.5100000000000001e-002 | N201: 340 | O201: 1.23 | P201: 119.4 | Q201: 20.13 | R201: 3.05 | S201: 137.85 | T201: -3.5000000000000003e-002 | U201: 转股中 | V201: 5.39年 | W201: 3.39年 | X201: 8.4000000000000005e-002 | Y201: 0.115 | Z201: 2.1 | AA201: 25 | AB201: -2.0199999999999999e-002 | AC201: -2.6200000000000001e-002 | AD201: -6.6000000000000003e-002 | AE201: -6.8199999999999997e-002 | AF201: 80.36 | AG201: 80.51 | AH201: 0.9 | AI201: A+ | AJ201: 7.7800000000000008e-002 | AK201: =I201+100*T201 -> 129.5 | AL201: 128.1 | AM201: 82 | AN201: 47.6 | AO201: 189 | AP201: 0.17199999999999999 | AQ201: 38 | AR201: 雷迪转债
A202: 33 | B202: 苏试转债 | C202: 123060 | D202: 44060. | E202: 苏试试验 | F202: 300416 | G202: 机械装备 | H202: 专用设备 | I202: 131.99 | J202: -7.6e-003 | K202: 4.5999999999999999e-003 | L202: 27.01 | M202: -3.7000000000000002e-003 | N202: 7.8 | O202: 1.9e-002 | P202: 117.6 | Q202: 23.86 | R202: 6.22 | S202: 113.2 | T202: 0.16600000000000001 | U202: 3月10天 | V202: 5.75年 | W202: 3.75年 | X202: 5.5999999999999994e-002 | Y202: 6.4000000000000001e-002 | Z202: 3.1 | AA202: 55 | AB202: -2.0199999999999999e-002 | AC202: -2.5399999999999999e-002 | AD202: -5.9699999999999996e-002 | AE202: -6.1399999999999996e-002 | AF202: 80.87 | AG202: 81.68 | AH202: 0.81 | AI202: AA- | AJ202: 6.6799999999999998e-002 | AK202: =I202+100*T202 -> 148.59 | AL202: 150.8 | AM202: 246 | AN202: 69.1 | AO202: 266 | AP202: 2.8999999999999998e-002 | AQ202: 5 | AR202: 苏试转债
A203: 18 | B203: 赣锋转2 | C203: 128126 | D203: 44082. | E203: 赣锋锂业 | F203: 2460 | G203: 有色金属 | H203: 小金属 | I203: 124.85 | J203: -1.54e-002 | K203: -7.000000000000001e-004 | L203: 57.13 | M203: -2.6699999999999998e-002 | N203: 30 | O203: 1.1000000000000001e-002 | P203: 111.1 | Q203: 60.27 | R203: 9.18 | S203: 94.79 | T203: 0.317 | U203: 3月26天 | V203: 5.80年 | W203: 3.80年 | X203: 2.7999999999999997e-002 | Y203: 2.6000000000000002e-002 | Z203: 21 | AA203: 761 | AB203: -2.0199999999999999e-002 | AC203: -2.3599999999999999e-002 | AD203: -4.8000000000000001e-002 | AE203: -4.9299999999999997e-002 | AF203: 86.23 | AG203: 86.03 | AH203: 0.6 | AI203: AA | AJ203: 4.58e-002 | AK203: =I203+100*T203 -> 156.54999999999998 | AL203: 154.9 | AM203: 261 | AN203: 68.7 | AO203: 263 | AP203: 6.3e-002 | AQ203: 6 | AR203: 赣锋转2
A204: 66 | B204: 寿仙转债 | C204: 113585 | D204: 44019. | E204: 寿仙谷 | F204: 603896 | G204: 医药 | H204: 中药 | I204: 132 | J204: -1.0700000000000001e-002 | K204: -8.0000000000000004e-004 | L204: 39.89 | M204: -1.26e-002 | N204: 7.4 | O204: 1.4999999999999999e-002 | P204: 117.8 | Q204: 28.68 | R204: 4.89 | S204: 139.09 | T204: -5.0999999999999997e-002 | U204: 57天 | V204: 5.64年 | W204: 3.64年 | X204: 6.3e-002 | Y204: 8.6999999999999994e-002 | Z204: 3.6 | AA204: 57 | AB204: -2.0400000000000001e-002 | AC204: -2.5699999999999997e-002 | AD204: -6.0999999999999999e-002 | AE204: -6.2899999999999998e-002 | AF204: 81.66 | AG204: 82.48 | AH204: 0.91 | AI204: AA- | AJ204: 6.6799999999999998e-002 | AK204: =I204+100*T204 -> 126.90000000000001 | AL204: 124.9 | AM204: 52 | AN204: 42.4 | AO204: 142 | AP204: -1.2e-002 | AQ204: 9 | AR204: 寿仙转债
A205: 147 | B205: 金牌转债! | C205: 113553 | D205: 43837. | E205: 金牌厨柜 | F205: 603180 | G205: 其他 | H205: 家居用品 | I205: 138.78 | J205: -8.8000000000000005e-003 | K205: 2.9999999999999997e-004 | L205: 61.04 | M205: -9.5999999999999992e-003 | N205: 4.9 | O205: 1.3000000000000001e-002 | P205: 124.6 | Q205: 44.14 | R205: 4.98 | S205: 138.29 | T205: 4.0000000000000001e-003 | U205: 转股中 | V205: 5年55天 | W205: 3年55天 | X205: 4.7e-002 | Y205: 6.5000000000000002e-002 | Z205: 2.8 | AA205: 59 | AB205: -2.1099999999999997e-002 | AC205: -2.8799999999999999e-002 | AD205: -8.3900000000000002e-002 | AE205: -8.5900000000000004e-002 | AF205: 84.24 | AG205: 89.99 | AH205: 0.89 | AI205: AA- | AJ205: 6.6799999999999998e-002 | AK205: =I205+100*T205 -> 139.18000000000001 | AL205: 139.3 | AM205: 191 | AN205: 49.3 | AO205: 195 | AP205: 4.7e-002 | AQ205: 14 | AR205: 金牌转债!
A206: 110 | B206: 华安转债! | C206: 110067 | D206: 43930. | E206: 华安证券 | F206: 600909 | G206: 金融 | H206: 证券行业 | I206: 123.87 | J206: -6.8999999999999999e-003 | K206: 9.0000000000000011e-003 | L206: 8.53 | M206: 3.4999999999999996e-003 | N206: 15 | O206: 4.0000000000000001e-003 | P206: 110.5 | Q206: 8.67 | R206: 2.28 | S206: 98.39 | T206: 0.25900000000000001 | U206: 转股中 | V206: 5.39年 | W206: 无权 | X206: 9.0999999999999998e-002 | Y206: 8.900000000000001e-002 | Z206: 28 | AA206: 309 | AB206: -2.12e-002 | AC206: -2.4700000000000003e-002 | AD206: 无权 | AE206: 无权 | AF206: 无权 | AG206: 89.3 | AH206: 0.61 | AI206: AAA | AJ206: 4.0800000000000003e-002 | AK206: =I206+100*T206 -> 149.77000000000001 | AL206: 149.4 | AM206: 241 | AN206: 60.1 | AO206: 243 | AP206: -1.e-002 | AQ206: 26 | AR206: 华安转债!
A207: 125 | B207: 奥瑞转债! | C207: 128096 | D207: 43906. | E207: 奥瑞金 | F207: 2701 | G207: 造纸包装 | H207: 包装材料 | I207: 129.72 | J207: -1.7299999999999999e-002 | K207: 3.7000000000000002e-003 | L207: 6.04 | M207: -1.6299999999999999e-002 | N207: 65 | O207: 5.0000000000000003e-002 | P207: 116 | Q207: 4.64 | R207: 2.46 | S207: 130.17 | T207: -3.0000000000000001e-003 | U207: 转股中 | V207: 5.32年 | W207: 3.32年 | X207: 7.0000000000000007e-002 | Y207: 9.0999999999999998e-002 | Z207: 9.9 | AA207: 142 | AB207: -2.1299999999999999e-002 | AC207: -2.64e-002 | AD207: -6.1399999999999996e-002 | AE207: -6.3500000000000001e-002 | AF207: 90.05 | AG207: 92.87 | AH207: 0.83 | AI207: AA+ | AJ207: 4.3799999999999999e-002 | AK207: =I207+100*T207 -> 129.41999999999999 | AL207: 129.3 | AM207: 94 | AN207: 36.4 | AO207: 70 | AP207: 4.5999999999999999e-002 | AQ207: 22 | AR207: 奥瑞转债!
A208: 301 | B208: 国贸转债! | C208: 110033 | D208: 42388. | E208: 厦门国贸 | F208: 600755 | G208: 交通运输 | H208: 交通运输 | I208: 112.58 | J208: 1.2999999999999999e-003 | K208: -8.9999999999999998e-004 | L208: 6.91 | M208: 1.4000000000000002e-003 | N208: 6.2 | O208: 5.0000000000000001e-003 | P208: 109.7 | Q208: 7.19 | R208: 0.9 | S208: 96.11 | T208: 0.17100000000000001 | U208: 转股中 | V208: 1.21年 | W208: 回售中 | X208: 9.4e-002 | Y208: 8.9999999999999997e-002 | Z208: 12 | AA208: 129 | AB208: -2.1400000000000002e-002 | AC208: -3.5799999999999998e-002 | AD208: 回售中 | AE208: 回售中 | AF208: 100.28 | AG208: 104.88 | AH208: 0.31 | AI208: AAA | AJ208: 3.8199999999999998e-002 | AK208: =I208+100*T208 -> 129.68000000000001 | AL208: 129.1 | AM208: 91 | AN208: 24.2 | AO208: 6 | AP208: -1.e-003 | AQ208: 18 | AR208: 国贸转债!
A209: 192 | B209: 永鼎转债! | C209: 110058 | D209: 43593. | E209: 永鼎股份 | F209: 600105 | G209: 通信互联 | H209: 通信设备 | I209: 126.41 | J209: 2.5999999999999999e-003 | K209: -1.4000000000000002e-003 | L209: 6.38 | M209: 1.6000000000000001e-003 | N209: 31 | O209: 4.2999999999999997e-002 | P209: 114.9 | Q209: 5.04 | R209: 3.41 | S209: 126.59 | T209: -1.e-003 | U209: 转股中 | V209: 4.49年 | W209: 2.49年 | X209: 7.0000000000000007e-002 | Y209: 8.8000000000000009e-002 | Z209: 5.8 | AA209: 83 | AB209: -2.1400000000000002e-002 | AC209: -2.7200000000000002e-002 | AD209: -7.3499999999999996e-002 | AE209: -7.5700000000000003e-002 | AF209: 92.19 | AG209: 94.83 | AH209: 0.81 | AI209: AA | AJ209: 4.4600000000000001e-002 | AK209: =I209+100*T209 -> 126.31 | AL209: 126.2 | AM209: 66 | AN209: 31.4 | AO209: 28 | AP209: 5.2000000000000005e-002 | AQ209: 54 | AR209: 永鼎转债!
A210: 237 | B210: 张行转债 | C210: 128048 | D210: 43433. | E210: 张家港行 | F210: 2839 | G210: 金融 | H210: 银行行业 | I210: 124.419 | J210: 2.0999999999999999e-003 | K210: 2.e-003 | L210: 6.14 | M210: 6.6e-003 | N210: 62 | O210: 2.e-002 | P210: 113.9 | Q210: 5.76 | R210: 1.07 | S210: 106.6 | T210: 0.16699999999999998 | U210: 转股中 | V210: 4年24天 | W210: 无权 | X210: 0.22500000000000001 | Y210: 0.23999999999999999 | Z210: 25 | AA210: 111 | AB210: -2.1899999999999999e-002 | AC210: -2.7900000000000001e-002 | AD210: 无权 | AE210: 无权 | AF210: 无权 | AG210: 96.5 | AH210: 0.63 | AI210: AA+ | AJ210: 4.2599999999999999e-002 | AK210: =I210+100*T210 -> 141.119 | AL210: 142.2 | AM210: 208 | AN210: 45.7 | AO210: 174 | AP210: 1.7000000000000001e-002 | AQ210: 14 | AR210: 张行转债
A211: 220 | B211: 中天转债! | C211: 110051 | D211: 43546. | E211: 中天科技 | F211: 600522 | G211: 通信互联 | H211: 通信设备 | I211: 125.23 | J211: -2.2000000000000001e-003 | K211: 6.0000000000000001e-003 | L211: 11.45 | M211: 5.3e-003 | N211: 12 | O211: 2.e-003 | P211: 113.9 | Q211: 10.09 | R211: 1.64 | S211: 113.48 | T211: 0.10400000000000001 | U211: 转股中 | V211: 4.36年 | W211: 2.36年 | X211: 0.113 | Y211: 0.128 | Z211: 40 | AA211: 351 | AB211: -2.1899999999999999e-002 | AC211: -2.75e-002 | AD211: -7.3700000000000002e-002 | AE211: -7.5899999999999995e-002 | AF211: 93.15 | AG211: 95.31 | AH211: 0.72 | AI211: AA+ | AJ211: 4.2599999999999999e-002 | AK211: =I211+100*T211 -> 135.63 | AL211: 137 | AM211: 176 | AN211: 41.7 | AO211: 130 | AP211: 6.2e-002 | AQ211: 28 | AR211: 中天转债!
A212: 138 | B212: 淮矿转债! | C212: 110065 | D212: 43843. | E212: 淮北矿业 | F212: 600985 | G212: 煤炭 | H212: 煤炭开采 | I212: 124.64 | J212: 4.5999999999999999e-003 | K212: -4.5999999999999999e-003 | L212: 10.4 | M212: 0. | N212: 103 | O212: 2.9999999999999999e-002 | P212: 111 | Q212: 9.33 | R212: 1.16 | S212: 111.47 | T212: 0.11800000000000001 | U212: 转股中 | V212: 5.18年 | W212: 3.18年 | X212: 0.122 | Y212: 0.13600000000000001 | Z212: 28 | AA212: 226 | AB212: -2.2499999999999999e-002 | AC212: -2.63e-002 | AD212: -5.45e-002 | AE212: -5.6299999999999996e-002 | AF212: 90.66 | AG212: 90.6 | AH212: 0.74 | AI212: AAA | AJ212: 4.0800000000000003e-002 | AK212: =I212+100*T212 -> 136.44 | AL212: 137.8 | AM212: 181 | AN212: 47.2 | AO212: 183 | AP212: 2.7999999999999997e-002 | AQ212: 22 | AR212: 淮矿转债!
A213: 166 | B213: 太极转债! | C213: 128078 | D213: 43777. | E213: 太极股份 | F213: 2368 | G213: 计算机及 | H213: 软件开发 | I213: 131.632 | J213: -1.9199999999999998e-002 | K213: -1.6399999999999998e-002 | L213: 27.91 | M213: -3.56e-002 | N213: 20 | O213: 1.4999999999999999e-002 | P213: 117.3 | Q213: 22.4 | R213: 3.74 | S213: 124.6 | T213: 5.5999999999999994e-002 | U213: 转股中 | V213: 5年2.0天 | W213: 3年2.0天 | X213: 5.9000000000000004e-002 | Y213: 7.400000000000001e-002 | Z213: 9.6 | AA213: 162 | AB213: -2.3199999999999998e-002 | AC213: -2.8999999999999998e-002 | AD213: -7.2900000000000006e-002 | AE213: -7.4900000000000008e-002 | AF213: 90.22 | AG213: 94.2 | AH213: 1 | AI213: AA | AJ213: 4.58e-002 | AK213: =I213+100*T213 -> 137.232 | AL213: 138.7 | AM213: 185 | AN213: 44.5 | AO213: 162 | AP213: -2.3e-002 | AQ213: 11 | AR213: 太极转债!
A214: 92 | B214: 长集转债 | C214: 128105 | D214: 43964. | E214: 长青集团 | F214: 2616 | G214: 城市公用 | H214: 三废处理 | I214: 131.2 | J214: 5.4000000000000003e-003 | K214: -1.2500000000000001e-002 | L214: 10.34 | M214: -8.6e-003 | N214: 6.4 | O214: 6.0000000000000001e-003 | P214: 115.3 | Q214: 8.11 | R214: 3.19 | S214: 127.5 | T214: 2.8999999999999998e-002 | U214: 转股中 | V214: 5.47年 | W214: 3.47年 | X214: 0.10400000000000001 | Y214: 0.13300000000000001 | Z214: 8 | AA214: 77 | AB214: -2.3799999999999998e-002 | AC214: -2.8500000000000001e-002 | AD214: -6.2899999999999998e-002 | AE214: -6.4699999999999994e-002 | AF214: 88.34 | AG214: 90.69 | AH214: 0.82 | AI214: AA | AJ214: 4.58e-002 | AK214: =I214+100*T214 -> 134.09999999999999 | AL214: 134.9 | AM214: 152 | AN214: 44.2 | AO214: 159 | AP214: -1.8000000000000002e-002 | AQ214: 5 | AR214: 长集转债
A215: 208 | B215: 迪森转债! | C215: 123023 | D215: 43571. | E215: 迪森股份 | F215: 300335 | G215: 能源电力 | H215: 电力供应 | I215: 127.59 | J215: 0.14899999999999999 | K215: 9.8999999999999991e-003 | L215: 8.96 | M215: 0.20000000000000001 | N215: 2010. | O215: 2.6499999999999999 | P215: 114.9 | Q215: 7.04 | R215: 2.51 | S215: 127.27 | T215: 2.e-003 | U215: 转股中 | V215: 4.42年 | W215: 3.42年 | X215: 0.184 | Y215: 0.23499999999999999 | Z215: 6 | AA215: 33 | AB215: -2.3900000000000001e-002 | AC215: -2.9700000000000001e-002 | AD215: -5.3099999999999994e-002 | AE215: -5.5599999999999997e-002 | AF215: 90.23 | AG215: 95.14 | AH215: 0.8 | AI215: AA | AJ215: 4.4600000000000001e-002 | AK215: =I215+100*T215 -> 127.79000000000001 | AL215: 127.9 | AM215: 80 | AN215: 32.8 | AO215: 39 | AP215: 0.47100000000000003 | AQ215: 51 | AR215: 迪森转债!
A216: 256 | B216: 三力转债! | C216: 128039 | D216: 43280. | E216: 三 力 士 | F216: 2224 | G216: 机械装备 | H216: 专用设备 | I216: 119.96 | J216: 1.66e-002 | K216: 1.61e-002 | L216: 6.88 | M216: 3.9300000000000002e-002 | N216: 48 | O216: 0.19500000000000001 | P216: 109.8 | Q216: 5.81 | R216: 2.18 | S216: 118.42 | T216: 1.3000000000000001e-002 | U216: 转股中 | V216: 3.64年 | W216: 1.64年 | X216: 4.0000000000000001e-002 | Y216: 4.8000000000000001e-002 | Z216: 2 | AA216: 50 | AB216: -2.4399999999999998e-002 | AC216: -2.9300000000000003e-002 | AD216: -8.3900000000000002e-002 | AE216: -8.6300000000000002e-002 | AF216: 91.53 | AG216: 87.52 | AH216: 0.83 | AI216: AA- | AJ216: 6.5599999999999992e-002 | AK216: =I216+100*T216 -> 121.25999999999999 | AL216: 121.5 | AM216: 20 | AN216: 30 | AO216: 22 | AP216: 0.10400000000000001 | AQ216: 19 | AR216: 三力转债!
A217: 90 | B217: 起步转债! | C217: 113576 | D217: 43958. | E217: 起步股份 | F217: 603557 | G217: 服装纺织 | H217: 鞋服行业 | I217: 139.67 | J217: -3.7200000000000004e-002 | K217: -8.6999999999999994e-003 | L217: 15.36 | M217: -5.0700000000000002e-002 | N217: 715 | O217: 0.95900000000000007 | P217: 121.8 | Q217: 10.55 | R217: 4.69 | S217: 145.59 | T217: -4.0999999999999995e-002 | U217: 转股中 | V217: 5.47年 | W217: 3.47年 | X217: 7.2000000000000008e-002 | Y217: 0.10400000000000001 | Z217: 5.2 | AA217: 72 | AB217: -2.52e-002 | AC217: -3.1699999999999999e-002 | AD217: -7.690000000000001e-002 | AE217: -7.9000000000000001e-002 | AF217: 83.01 | AG217: 86.25 | AH217: 0.91 | AI217: AA- | AJ217: 6.6799999999999998e-002 | AK217: =I217+100*T217 -> 135.56999999999999 | AL217: 133.7 | AM217: 138 | AN217: 47.5 | AO217: 188 | AP217: 0.13600000000000001 | AQ217: 30 | AR217: 起步转债!
A218: 55 | B218: 雪榕转债 | C218: 123056 | D218: 44036. | E218: 雪榕生物 | F218: 300511 | G218: 农业 | H218: 种植业 | I218: 140.1 | J218: 7.0999999999999995e-003 | K218: 4.0000000000000002e-004 | L218: 17.23 | M218: 8.199999999999999e-003 | N218: 29 | O218: 3.5000000000000003e-002 | P218: 121.1 | Q218: 11.89 | R218: 3.97 | S218: 144.91 | T218: -3.3000000000000002e-002 | U218: 2月17天 | V218: 5.68年 | W218: 3.68年 | X218: 7.6999999999999999e-002 | Y218: 0.111 | Z218: 5.9 | AA218: 76 | AB218: -2.58e-002 | AC218: -3.1899999999999998e-002 | AD218: -7.5199999999999989e-002 | AE218: -7.690000000000001e-002 | AF218: 81.32 | AG218: 84.52 | AH218: 0.92 | AI218: AA- | AJ218: 6.6799999999999998e-002 | AK218: =I218+100*T218 -> 136.79999999999998 | AL218: 135.3 | AM218: 158 | AN218: 50.8 | AO218: 202 | AP218: 5.9999999999999998e-002 | AQ218: 10 | AR218: 雪榕转债
A219: 84 | B219: 春秋转债 | C219: 113577 | D219: 43964. | E219: 春秋电子 | F219: 603890 | G219: 电子 | H219: 电子产品 | I219: 136.14 | J219: -5.6000000000000008e-003 | K219: 5.6000000000000008e-003 | L219: 15.33 | M219: 0. | N219: 14 | O219: 4.2999999999999997e-002 | P219: 118.2 | Q219: 11.06 | R219: 3.63 | S219: 138.61 | T219: -1.8000000000000002e-002 | U219: 1.0天 | V219: 5.49年 | W219: 3.49年 | X219: 4.0999999999999995e-002 | Y219: 5.5999999999999994e-002 | Z219: 2.4 | AA219: 59 | AB219: -2.5899999999999999e-002 | AC219: -3.15e-002 | AD219: -7.1500000000000008e-002 | AE219: -7.3399999999999993e-002 | AF219: 82.45 | AG219: 83.58 | AH219: 0.89 | AI219: AA- | AJ219: 6.6799999999999998e-002 | AK219: =I219+100*T219 -> 134.33999999999997 | AL219: 133.7 | AM219: 135 | AN219: 50.1 | AO219: 198 | AP219: 2.3e-002 | AQ219: 8 | AR219: 春秋转债
A220: 266 | B220: 无锡转债! | C220: 110043 | D220: 43173. | E220: 无锡银行 | F220: 600908 | G220: 金融 | H220: 银行行业 | I220: 118.81 | J220: 8.6e-003 | K220: 7.3000000000000001e-003 | L220: 6 | M220: 2.5600000000000001e-002 | N220: 46 | O220: 1.3000000000000001e-002 | P220: 109.1 | Q220: 5.79 | R220: 0.98 | S220: 103.63 | T220: 0.14699999999999999 | U220: 转股中 | V220: 3.28年 | W220: 无权 | X220: 0.27000000000000002 | Y220: 0.28000000000000003 | Z220: 30 | AA220: 111 | AB220: -2.6000000000000002e-002 | AC220: -3.1e-002 | AD220: 无权 | AE220: 无权 | AF220: 无权 | AG220: 95.36 | AH220: 0.62 | AI220: AA+ | AJ220: 4.2599999999999999e-002 | AK220: =I220+100*T220 -> 133.50999999999999 | AL220: 134 | AM220: 140 | AN220: 38.6 | AO220: 105 | AP220: 5.2999999999999999e-002 | AQ220: 31 | AR220: 无锡转债!
A221: 177 | B221: 合兴转债! | C221: 128071 | D221: 43724. | E221: 合兴包装 | F221: 2228 | G221: 造纸包装 | H221: 包装材料 | I221: 130.1 | J221: 1.8000000000000002e-002 | K221: 1.6000000000000001e-003 | L221: 5.31 | M221: 2.5099999999999997e-002 | N221: 23 | O221: 5.9000000000000004e-002 | P221: 114.8 | Q221: 4.28 | R221: 2.09 | S221: 124.07 | T221: 4.9000000000000002e-002 | U221: 转股中 | V221: 4.82年 | W221: 2.82年 | X221: 4.5999999999999999e-002 | Y221: 5.7000000000000002e-002 | Z221: 3 | AA221: 66 | AB221: -2.6000000000000002e-002 | AC221: -3.1300000000000001e-002 | AD221: -7.4800000000000005e-002 | AE221: -7.6600000000000001e-002 | AF221: 90.76 | AG221: 93.36 | AH221: 0.78 | AI221: AA | AJ221: 4.4600000000000001e-002 | AK221: =I221+100*T221 -> 135. | AL221: 136.1 | AM221: 167 | AN221: 42.8 | AO221: 145 | AP221: -2.8999999999999998e-002 | AQ221: 25 | AR221: 合兴转债!
A222: 171 | B222: 远东转债! | C222: 128075 | D222: 43769. | E222: 远东传动 | F222: 2406 | G222: 汽车 | H222: 零部件制 | I222: 131 | J222: -2.5999999999999999e-003 | K222: 1.4000000000000002e-003 | L222: 7.24 | M222: -1.4000000000000002e-003 | N222: 4 | O222: 4.0000000000000001e-003 | P222: 114.9 | Q222: 5.54 | R222: 1.5 | S222: 130.69 | T222: 2.e-003 | U222: 转股中 | V222: 4.93年 | W222: 2.93年 | X222: 0.17000000000000001 | Y222: 0.222 | Z222: 7.3 | AA222: 43 | AB222: -2.6699999999999998e-002 | AC222: -3.1899999999999998e-002 | AD222: -7.4200000000000002e-002 | AE222: -7.5999999999999998e-002 | AF222: 90.44 | AG222: 93.03 | AH222: 0.83 | AI222: AA | AJ222: 4.4600000000000001e-002 | AK222: =I222+100*T222 -> 131.19999999999999 | AL222: 131.3 | AM222: 117 | AN222: 38.3 | AO222: 95 | AP222: 5.2000000000000005e-002 | AQ222: 16 | AR222: 远东转债!
A223: 302 | B223: 航信转债!! | C223: 110031 | D223: 42185. | E223: 航天信息 | F223: 600271 | G223: 计算机及 | H223: 软件开发 | I223: 108.94 | J223: 2.9999999999999997e-004 | K223: -2.9999999999999997e-004 | L223: 15.91 | M223: -4.4000000000000003e-003 | N223: 4.5 | O223: 2.e-003 | P223: 107 | Q223: 21.56 | R223: 2.65 | S223: 73.79 | T223: 0.47600000000000003 | U223: 转股中 | V223: 0.65年 | W223: 回售中 | X223: 8.1000000000000003e-002 | Y223: 5.9999999999999998e-002 | Z223: 24 | AA223: 296 | AB223: -2.7400000000000001e-002 | AC223: -4.7e-002 | AD223: 回售中 | AE223: 回售中 | AF223: 100.27 | AG223: 104.65 | AH223: 0 | AI223: AAA | AJ223: 3.5000000000000003e-002 | AK223: =I223+100*T223 -> 156.53999999999999 | AL223: 144.1 | AM223: 221 | AN223: 39.4 | AO223: 115 | AP223: -1.7000000000000001e-002 | AQ223: 14 | AR223: 航信转债!!
A224: 32 | B224: 航新转债 | C224: 123061 | D224: 44061. | E224: 航新科技 | F224: 300424 | G224: 航空航天 | H224: 航空航天 | I224: 146.546 | J224: -1.7000000000000001e-003 | K224: -9.1000000000000004e-003 | L224: 23.96 | M224: -1.1599999999999999e-002 | N224: 285 | O224: 0.77099999999999991 | P224: 124.8 | Q224: 14.86 | R224: 5.35 | S224: 161.24 | T224: -9.0999999999999998e-002 | U224: 3月11天 | V224: 5.76年 | W224: 3.76年 | X224: 4.2999999999999997e-002 | Y224: 7.0000000000000007e-002 | Z224: 2.5 | AA224: 57 | AB224: -2.81e-002 | AC224: -3.49e-002 | AD224: -8.2899999999999988e-002 | AE224: -8.4900000000000003e-002 | AF224: 81.51 | AG224: 86.75 | AH224: 0.93 | AI224: AA- | AJ224: 6.6799999999999998e-002 | AK224: =I224+100*T224 -> 137.446 | AL224: 131.9 | AM224: 121 | AN224: 45.1 | AO224: 166 | AP224: 0.221 | AQ224: 7 | AR224: 航新转债
A225: 283 | B225: 济川转债! | C225: 110038 | D225: 43068. | E225: 济川药业 | F225: 600566 | G225: 医药 | H225: 中药 | I225: 114.83 | J225: 7.3000000000000001e-003 | K225: -5.6999999999999993e-003 | L225: 23.28 | M225: 3.4000000000000002e-003 | N225: 4 | O225: 6.0000000000000001e-003 | P225: 108.3 | Q225: 24.27 | R225: 3.34 | S225: 95.92 | T225: 0.19699999999999998 | U225: 转股中 | V225: 2年25天 | W225: 25天 | X225: 3.3000000000000002e-002 | Y225: 3.2000000000000001e-002 | Z225: 6.3 | AA225: 190 | AB225: -2.8300000000000002e-002 | AC225: -3.5499999999999997e-002 | AD225: -0.55500000000000005 | AE225: -0.56299999999999994 | AF225: 100.06 | AG225: 99.35 | AH225: 0.45 | AI225: AA | AJ225: 4.3200000000000002e-002 | AK225: =I225+100*T225 -> 134.53 | AL225: 133.7 | AM225: 137 | AN225: 33.7 | AO225: 47 | AP225: 1.6e-002 | AQ225: 19 | AR225: 济川转债!
A226: 240 | B226: 利尔转债! | C226: 128046 | D226: 43413. | E226: 利尔化学 | F226: 2258 | G226: 化工 | H226: 农化 | I226: 125.982 | J226: -1.7399999999999999e-002 | K226: -2.0999999999999999e-003 | L226: 20.18 | M226: -2.8399999999999998e-002 | N226: 1.1 | O226: 1.e-003 | P226: 112.9 | Q226: 18.62 | R226: 3.1 | S226: 108.38 | T226: 0.16200000000000001 | U226: 转股中 | V226: 3.99年 | W226: 1.99年 | X226: 8.1000000000000003e-002 | Y226: 8.6999999999999994e-002 | Z226: 8.5 | AA226: 106 | AB226: -2.8799999999999999e-002 | AC226: -3.4200000000000001e-002 | AD226: -9.0299999999999991e-002 | AE226: -9.2499999999999999e-002 | AF226: 93.61 | AG226: 94.62 | AH226: 0.69 | AI226: AA | AJ226: 4.4600000000000001e-002 | AK226: =I226+100*T226 -> 142.18199999999999 | AL226: 143.6 | AM226: 218 | AN226: 49 | AO226: 193 | AP226: -4.4000000000000004e-002 | AQ226: 10 | AR226: 利尔转债!
A227: 214 | B227: 拓邦转债 | C227: 128058 | D227: 43563. | E227: 拓邦股份 | F227: 2139 | G227: 电子 | H227: 电子产品 | I227: 140.011 | J227: -4.8999999999999998e-003 | K227: -4.8999999999999998e-003 | L227: 7.72 | M227: -1.15e-002 | N227: 42 | O227: 6.2e-002 | P227: 122.6 | Q227: 5.47 | R227: 3.07 | S227: 141.13 | T227: -8.0000000000000002e-003 | U227: 转股中 | V227: 4.38年 | W227: 2.38年 | X227: 6.0999999999999999e-002 | Y227: 8.5999999999999993e-002 | Z227: 4.8 | AA227: 80 | AB227: -3.0600000000000002e-002 | AC227: -3.8900000000000004e-002 | AD227: -0.109 | AE227: -0.11199999999999999 | AF227: 93.66 | AG227: 101.77 | AH227: 0.85 | AI227: AA | AJ227: 4.4600000000000001e-002 | AK227: =I227+100*T227 -> 139.21099999999998 | AL227: 138.9 | AM227: 186 | AN227: 37.1 | AO227: 80 | AP227: 0.125 | AQ227: 20 | AR227: 拓邦转债
A228: 160 | B228: 石英转债! | C228: 113548 | D228: 43791. | E228: 石英股份 | F228: 603688 | G228: 电子 | H228: 电子产品 | I228: 145.86 | J228: -1.43e-002 | K228: 3.8e-003 | L228: 21.9 | M228: -1.1699999999999999e-002 | N228: 5.5 | O228: 2.9999999999999999e-002 | P228: 124.8 | Q228: 15.1 | R228: 4.48 | S228: 145.03 | T228: 6.0000000000000001e-003 | U228: 转股中 | V228: 5年9天 | W228: 3年9天 | X228: 1.6e-002 | Y228: 2.3e-002 | Z228: 1.2 | AA228: 77 | AB228: -3.1200000000000002e-002 | AC228: -3.9e-002 | AD228: -9.98e-002 | AE228: -0.10000000000000001 | AF228: 85.44 | AG228: 90.93 | AH228: 0.89 | AI228: AA- | AJ228: 6.6799999999999998e-002 | AK228: =I228+100*T228 -> 146.46000000000001 | AL228: 146.7 | AM228: 233 | AN228: 55.8 | AO228: 226 | AP228: 5.0000000000000001e-003 | AQ228: 10 | AR228: 石英转债!
A229: 131 | B229: 璞泰转债!! | C229: 113562 | D229: 43865. | E229: 璞泰来 | F229: 603659 | G229: 电子 | H229: 元器件制 | I229: 129.38 | J229: -8.5900000000000004e-002 | K229: 2.86e-002 | L229: 107.51 | M229: -5.7300000000000004e-002 | N229: 187 | O229: 0.16300000000000001 | P229: 113.3 | Q229: 82.73 | R229: 13.68 | S229: 129.95 | T229: -4.0000000000000001e-003 | U229: 转股中 | V229: 4.21年 | W229: 2.21年 | X229: 1.9e-002 | Y229: 2.4e-002 | Z229: 8.7 | AA229: 468 | AB229: -3.1400000000000004e-002 | AC229: -3.6900000000000002e-002 | AD229: -9.5700000000000007e-002 | AE229: -9.7100000000000006e-002 | AF229: 92.07 | AG229: 94.53 | AH229: 1 | AI229: AA | AJ229: 4.4600000000000001e-002 | AK229: =I229+100*T229 -> 128.97999999999999 | AL229: 128.8 | AM229: 89 | AN229: 34.3 | AO229: 50 | AP229: -1.9e-002 | AQ229: 16 | AR229: 璞泰转债!!
A230: 109 | B230: 红相转债! | C230: 123044 | D230: 43934. | E230: 红相股份 | F230: 300427 | G230: 能源电力 | H230: 电力设备 | I230: 148.5 | J230: -3.7999999999999999e-002 | K230: 3.9000000000000003e-003 | L230: 26.98 | M230: -3.85e-002 | N230: 47 | O230: 5.7000000000000002e-002 | P230: 125.5 | Q230: 18.8 | R230: 4.39 | S230: 143.51 | T230: 3.5000000000000003e-002 | U230: 转股中 | V230: 5.39年 | W230: 3.39年 | X230: 5.7000000000000002e-002 | Y230: 8.199999999999999e-002 | Z230: 5.5 | AA230: 97 | AB230: -3.1400000000000004e-002 | AC230: -3.8900000000000004e-002 | AD230: -9.3800000000000008e-002 | AE230: -9.6000000000000002e-002 | AF230: 83.68 | AG230: 89.35 | AH230: 0.89 | AI230: AA- | AJ230: 6.6799999999999998e-002 | AK230: =I230+100*T230 -> 152. | AL230: 153.5 | AM230: 256 | AN230: 64.1 | AO230: 254 | AP230: 2.e-003 | AQ230: 15 | AR230: 红相转债!
A231: 93 | B231: 东时转债 | C231: 113575 | D231: 43951. | E231: 东方时尚 | F231: 603377 | G231: 其他 | H231: 其他 | I231: 135.62 | J231: 1.3500000000000002e-002 | K231: -1.44e-002 | L231: 19.98 | M231: -1.e-003 | N231: 50 | O231: 0.105 | P231: 113.5 | Q231: 14.56 | R231: 6.48 | S231: 137.23 | T231: -1.2e-002 | U231: 转股中 | V231: 5.47年 | W231: 3.47年 | X231: 2.9999999999999999e-002 | Y231: 4.0999999999999995e-002 | Z231: 3.5 | AA231: 117 | AB231: -3.2599999999999997e-002 | AC231: -3.6799999999999999e-002 | AD231: -7.1399999999999991e-002 | AE231: -7.3200000000000001e-002 | AF231: 88.37 | AG231: 89.29 | AH231: 0.88 | AI231: AA | AJ231: 4.58e-002 | AK231: =I231+100*T231 -> 134.42000000000002 | AL231: 134 | AM231: 141 | AN231: 44.7 | AO231: 165 | AP231: -7.6999999999999999e-002 | AQ231: 17 | AR231: 东时转债
A232: 193 | B232: 雅化转债! | C232: 128065 | D232: 43595. | E232: 雅化集团 | F232: 2497 | G232: 化工 | H232: 化工 | I232: 128.59 | J232: -1.46e-002 | K232: -5.1000000000000004e-003 | L232: 10.88 | M232: -2.4199999999999999e-002 | N232: 6.9 | O232: 6.9999999999999993e-003 | P232: 110.9 | Q232: 8.95 | R232: 3.68 | S232: 121.56 | T232: 5.7999999999999996e-002 | U232: 转股中 | V232: 4.49年 | W232: 2.49年 | X232: 7.6999999999999999e-002 | Y232: 9.3000000000000013e-002 | Z232: 8 | AA232: 104 | AB232: -3.3000000000000002e-002 | AC232: -3.7200000000000004e-002 | AD232: -7.9500000000000001e-002 | AE232: -8.1600000000000006e-002 | AF232: 92.19 | AG232: 91.54 | AH232: 0.81 | AI232: AA | AJ232: 4.4600000000000001e-002 | AK232: =I232+100*T232 -> 134.39000000000001 | AL232: 135.6 | AM232: 161 | AN232: 43.4 | AO232: 150 | AP232: 0.107 | AQ232: 21 | AR232: 雅化转债!
A233: 61 | B233: 泛微转债 | C233: 113587 | D233: 44026. | E233: 泛微网络 | F233: 603039 | G233: 计算机及 | H233: 软件开发 | I233: 149.86 | J233: -2.2099999999999998e-002 | K233: 7.3000000000000001e-003 | L233: 95.42 | M233: -1.6299999999999999e-002 | N233: 18 | O233: 3.7999999999999999e-002 | P233: 124.3 | Q233: 64.33 | R233: 21.66 | S233: 148.33 | T233: 1.e-002 | U233: 2月3天 | V233: 5.65年 | W233: 3.65年 | X233: 1.6e-002 | Y233: 2.3e-002 | Z233: 3.2 | AA233: 203 | AB233: -3.3099999999999997e-002 | AC233: -3.9900000000000005e-002 | AD233: -9.1499999999999998e-002 | AE233: -9.3299999999999994e-002 | AF233: 81.64 | AG233: 86.92 | AH233: 0.91 | AI233: AA- | AJ233: 6.6799999999999998e-002 | AK233: =I233+100*T233 -> 150.86000000000001 | AL233: 151.4 | AM233: 251 | AN233: 64.5 | AO233: 255 | AP233: 2.5000000000000001e-002 | AQ233: 4 | AR233: 泛微转债
A234: 99 | B234: 同德转债 | C234: 128103 | D234: 43942. | E234: 同德化工 | F234: 2360 | G234: 化工 | H234: 化工 | I234: 146 | J234: 1.e-004 | K234: -4.1999999999999997e-003 | L234: 6.2 | M234: -4.7999999999999996e-003 | N234: 186 | O234: 0.878 | P234: 121.8 | Q234: 5.18 | R234: 2.11 | S234: 119.69 | T234: 0.22 | U234: 转股中 | V234: 5.43年 | W234: 3.43年 | X234: 5.9000000000000004e-002 | Y234: 7.0999999999999994e-002 | Z234: 1.4 | AA234: 24 | AB234: -3.3500000000000002e-002 | AC234: -4.0000000000000001e-002 | AD234: -8.9099999999999999e-002 | AE234: -9.1199999999999989e-002 | AF234: 80.23 | AG234: 81.89 | AH234: 0.85 | AI234: A+ | AJ234: 7.7800000000000008e-002 | AK234: =I234+100*T234 -> 168. | AL234: 172.3 | AM234: 277 | AN234: 90.4 | AO234: 281 | AP234: -2.7000000000000003e-002 | AQ234: 10 | AR234: 同德转债
A235: 123 | B235: 奥佳转债! | C235: 128097 | D235: 43908. | E235: 奥佳华 | F235: 2614 | G235: 机械装备 | H235: 专用设备 | I235: 138.03 | J235: -2.52e-002 | K235: 1.0200000000000001e-002 | L235: 14.6 | M235: -1.7500000000000002e-002 | N235: 51 | O235: 6.0999999999999999e-002 | P235: 115.3 | Q235: 10.69 | R235: 2.39 | S235: 136.58 | T235: 1.1000000000000001e-002 | U235: 转股中 | V235: 5.35年 | W235: 3.35年 | X235: 6.7000000000000004e-002 | Y235: 9.0999999999999998e-002 | Z235: 6 | AA235: 90 | AB235: -3.3700000000000001e-002 | AC235: -3.85e-002 | AD235: -7.85e-002 | AE235: -8.0299999999999996e-002 | AF235: 88.82 | AG235: 91.17 | AH235: 0.86 | AI235: AA | AJ235: 4.58e-002 | AK235: =I235+100*T235 -> 139.13 | AL235: 139.5 | AM235: 193 | AN235: 48.3 | AO235: 191 | AP235: -6.5000000000000002e-002 | AQ235: 26 | AR235: 奥佳转债!
A236: 111 | B236: 永高转债 | C236: 128099 | D236: 43931. | E236: 永高股份 | F236: 2641 | G236: 建筑 | H236: 建筑行业 | I236: 135.898 | J236: 7.0999999999999995e-003 | K236: 1.2999999999999999e-003 | L236: 8.38 | M236: 9.5999999999999992e-003 | N236: 61 | O236: 7.0000000000000007e-002 | P236: 113.2 | Q236: 6.16 | R236: 2.66 | S236: 136.04 | T236: -1.e-003 | U236: 转股中 | V236: 5.39年 | W236: 3.39年 | X236: 6.8000000000000005e-002 | Y236: 9.3000000000000013e-002 | Z236: 6.4 | AA236: 94 | AB236: -3.39e-002 | AC236: -3.8100000000000002e-002 | AD236: -7.3800000000000004e-002 | AE236: -7.5499999999999998e-002 | AF236: 88.56 | AG236: 89.34 | AH236: 0.87 | AI236: AA | AJ236: 4.58e-002 | AK236: =I236+100*T236 -> 135.798 | AL236: 135.8 | AM236: 164 | AN236: 46.4 | AO236: 179 | AP236: 4.4000000000000004e-002 | AQ236: 9 | AR236: 永高转债
A237: 133 | B237: 新天转债 | C237: 128091 | D237: 43847. | E237: 新天药业 | F237: 2873 | G237: 医药 | H237: 中药 | I237: 143.87 | J237: 3.0200000000000001e-002 | K237: -1.37e-002 | L237: 18.35 | M237: 2.e-002 | N237: 360 | O237: 1.4199999999999999 | P237: 120 | Q237: 16.39 | R237: 2.95 | S237: 111.96 | T237: 0.28499999999999998 | U237: 转股中 | V237: 5.20年 | W237: 3.20年 | X237: 8.199999999999999e-002 | Y237: 9.1999999999999998e-002 | Z237: 1.8 | AA237: 21 | AB237: -3.5200000000000002e-002 | AC237: -4.1399999999999999e-002 | AD237: -9.0399999999999994e-002 | AE237: -9.2799999999999994e-002 | AF237: 82.02 | AG237: 82.22 | AH237: 0.82 | AI237: A+ | AJ237: 7.7800000000000008e-002 | AK237: =I237+100*T237 -> 172.37 | AL237: 175.8 | AM237: 280 | AN237: 93.6 | AO237: 283 | AP237: 1.9e-002 | AQ237: 15 | AR237: 新天转债
A238: 74 | B238: 益丰转债 | C238: 113583 | D238: 44004. | E238: 益丰药房 | F238: 603939 | G238: 医药 | H238: 医药商业 | I238: 143.05 | J238: -1.6799999999999999e-002 | K238: 8.0000000000000002e-003 | L238: 96.51 | M238: -1.03e-002 | N238: 13 | O238: 6.0000000000000001e-003 | P238: 115.3 | Q238: 71.82 | R238: 10.58 | S238: 134.38 | T238: 6.5000000000000002e-002 | U238: 49天 | V238: 5.62年 | W238: 3.62年 | X238: 3.1e-002 | Y238: 4.0999999999999995e-002 | Z238: 16 | AA238: 513 | AB238: -3.8300000000000001e-002 | AC238: -4.2900000000000001e-002 | AD238: -8.199999999999999e-002 | AE238: -8.3599999999999994e-002 | AF238: 87.77 | AG238: 90.1 | AH238: 0.86 | AI238: AA | AJ238: 4.58e-002 | AK238: =I238+100*T238 -> 149.55000000000001 | AL238: 151.7 | AM238: 253 | AN238: 61.6 | AO238: 252 | AP238: -2.4e-002 | AQ238: 8 | AR238: 益丰转债
A239: 75 | B239: 蓝帆转债 | C239: 128108 | D239: 44001. | E239: 蓝帆医疗 | F239: 2382 | G239: 医药 | H239: 医疗器械 | I239: 140.7 | J239: 5.0000000000000001e-003 | K239: -1.9e-003 | L239: 26 | M239: 3.4999999999999996e-003 | N239: 214 | O239: 4.8000000000000001e-002 | P239: 113.3 | Q239: 17.79 | R239: 2.79 | S239: 146.15 | T239: -3.7000000000000005e-002 | U239: 45天 | V239: 5.61年 | W239: 4.61年 | X239: 0.125 | Y239: 0.183 | Z239: 31 | AA239: 251 | AB239: -3.8599999999999995e-002 | AC239: -4.2599999999999999e-002 | AD239: -5.91e-002 | AE239: -6.1100000000000002e-002 | AF239: 85.59 | AG239: 88.59 | AH239: 0.9 | AI239: AA | AJ239: 4.58e-002 | AK239: =I239+100*T239 -> 137. | AL239: 135.3 | AM239: 157 | AN239: 46.7 | AO239: 180 | AP239: 7.0000000000000007e-002 | AQ239: 18 | AR239: 蓝帆转债
A240: 233 | B240: 寒锐转债!! | C240: 123017 | D240: 43458. | E240: 寒锐钴业 | F240: 300618 | G240: 有色金属 | H240: 小金属 | I240: 129.885 | J240: -7.4999999999999997e-003 | K240: -6.1999999999999998e-003 | L240: 64.52 | M240: -1.6899999999999998e-002 | N240: 2.1 | O240: 4.0000000000000001e-003 | P240: 110.8 | Q240: 57.4 | R240: 9.8 | S240: 112.4 | T240: 0.156 | U240: 转股中 | V240: 4年32天 | W240: 2年32天 | X240: 2.1000000000000001e-002 | Y240: 2.3e-002 | Z240: 4 | AA240: 195 | AB240: -3.8900000000000004e-002 | AC240: -4.3400000000000001e-002 | AD240: -9.7500000000000003e-002 | AE240: -9.9900000000000003e-002 | AF240: 89.66 | AG240: 85.96 | AH240: 0.81 | AI240: AA- | AJ240: 6.5599999999999992e-002 | AK240: =I240+100*T240 -> 145.48499999999999 | AL240: 147.4 | AM240: 235 | AN240: 57.7 | AO240: 240 | AP240: -2.5000000000000001e-002 | AQ240: 13 | AR240: 寒锐转债!!
A241: 95 | B241: 裕同转债 | C241: 128104 | D241: 43949. | E241: 裕同科技 | F241: 2831 | G241: 造纸包装 | H241: 包装材料 | I241: 143 | J241: -1.4499999999999999e-002 | K241: 8.9999999999999998e-004 | L241: 33.31 | M241: -1.54e-002 | N241: 20 | O241: 1.e-002 | P241: 115.3 | Q241: 23.24 | R241: 4.56 | S241: 143.33 | T241: -2.e-003 | U241: 转股中 | V241: 5.47年 | W241: 3.47年 | X241: 4.8000000000000001e-002 | Y241: 6.9000000000000006e-002 | Z241: 14 | AA241: 292 | AB241: -3.9300000000000002e-002 | AC241: -4.4000000000000004e-002 | AD241: -8.5099999999999995e-002 | AE241: -8.6899999999999991e-002 | AF241: 88.97 | AG241: 91.65 | AH241: 0.88 | AI241: AA+ | AJ241: 4.3799999999999999e-002 | AK241: =I241+100*T241 -> 142.80000000000001 | AL241: 142.7 | AM241: 213 | AN241: 51 | AO241: 207 | AP241: -3.6000000000000004e-002 | AQ241: 7 | AR241: 裕同转债
A242: 281 | B242: 兄弟转债!! | C242: 128021 | D242: 43096. | E242: 兄弟科技 | F242: 2562 | G242: 医药 | H242: 原料药 | I242: 124.708 | J242: 4.8999999999999998e-003 | K242: -3.3e-003 | L242: 6.31 | M242: 1.6000000000000001e-003 | N242: 4.9 | O242: 1.4999999999999999e-002 | P242: 109.8 | Q242: 5.25 | R242: 2.65 | S242: 120.19 | T242: 3.7999999999999999e-002 | U242: 转股中 | V242: 3年40天 | W242: 1年40天 | X242: 4.4000000000000004e-002 | Y242: 5.2999999999999999e-002 | Z242: 2.7 | AA242: 60 | AB242: -4.0899999999999999e-002 | AC242: -4.6399999999999997e-002 | AD242: -0.13500000000000001 | AE242: -0.13800000000000001 | AF242: 97.05 | AG242: 96.15 | AH242: 1 | AI242: AA | AJ242: 4.4600000000000001e-002 | AK242: =I242+100*T242 -> 128.50800000000001 | AL242: 129.2 | AM242: 93 | AN242: 32.2 | AO242: 35 | AP242: 3.9e-002 | AQ242: 13 | AR242: 兄弟转债!!
A243: 96 | B243: 瀚蓝转债 | C243: 110069 | D243: 43958. | E243: 瀚蓝环境 | F243: 600323 | G243: 城市公用 | H243: 三废处理 | I243: 142.52 | J243: -1.7600000000000001e-002 | K243: -1.03e-002 | L243: 27.1 | M243: -3.2099999999999997e-002 | N243: 17 | O243: 1.2e-002 | P243: 113.5 | Q243: 20.2 | R243: 3.03 | S243: 134.16 | T243: 6.2e-002 | U243: 转股中 | V243: 5.47年 | W243: 3.47年 | X243: 4.8000000000000001e-002 | Y243: 6.4000000000000001e-002 | Z243: 9.9 | AA243: 208 | AB243: -4.1200000000000001e-002 | AC243: -4.5400000000000003e-002 | AD243: -8.7799999999999989e-002 | AE243: -8.8800000000000004e-002 | AF243: 87.58 | AG243: 90.05 | AH243: 0.87 | AI243: AA+ | AJ243: 4.3799999999999999e-002 | AK243: =I243+100*T243 -> 148.72 | AL243: 150.9 | AM243: 247 | AN243: 60.8 | AO243: 247 | AP243: -4.8000000000000001e-002 | AQ243: 7 | AR243: 瀚蓝转债
A244: 154 | B244: 常汽转债! | C244: 113550 | D244: 43811. | E244: 常熟汽饰 | F244: 603035 | G244: 汽车 | H244: 零部件制 | I244: 150.52 | J244: -3.27e-002 | K244: 2.8300000000000002e-002 | L244: 14.19 | M244: -4.8999999999999998e-003 | N244: 26 | O244: 3.7000000000000005e-002 | P244: 121.8 | Q244: 9.65 | R244: 1.47 | S244: 147.05 | T244: 2.4e-002 | U244: 转股中 | V244: 5年30天 | W244: 3年30天 | X244: 9.6000000000000002e-002 | Y244: 0.14099999999999999 | Z244: 4.6 | AA244: 48 | AB244: -4.1700000000000001e-002 | AC244: -4.8499999999999995e-002 | AD244: -0.105 | AE244: -0.107 | AF244: 85.16 | AG244: 88.46 | AH244: 0.91 | AI244: AA- | AJ244: 6.6799999999999998e-002 | AK244: =I244+100*T244 -> 152.92000000000002 | AL244: 154 | AM244: 259 | AN244: 65.5 | AO244: 258 | AP244: -1.e-003 | AQ244: 15 | AR244: 常汽转债!
A245: 150 | B245: 先导转债 | C245: 123036 | D245: 43840. | E245: 先导智能 | F245: 300450 | G245: 机械装备 | H245: 专用设备 | I245: 143.099 | J245: -3.0299999999999997e-002 | K245: 2.41e-002 | L245: 52.99 | M245: -7.0999999999999995e-003 | N245: 14 | O245: 9.0000000000000011e-003 | P245: 115.1 | Q245: 38.99 | R245: 11.12 | S245: 135.91 | T245: 5.2999999999999999e-002 | U245: 转股中 | V245: 5年53天 | W245: 3年53天 | X245: 2.1000000000000001e-002 | Y245: 2.8999999999999998e-002 | Z245: 10 | AA245: 467 | AB245: -4.2199999999999994e-002 | AC245: -4.7e-002 | AD245: -9.3699999999999992e-002 | AE245: -9.5500000000000002e-002 | AF245: 89.46 | AG245: 91.83 | AH245: 0.87 | AI245: AA | AJ245: 4.58e-002 | AK245: =I245+100*T245 -> 148.399 | AL245: 150.3 | AM245: 244 | AN245: 58.5 | AO245: 242 | AP245: 0.106 | AQ245: 17 | AR245: 先导转债
A246: 234 | B246: 桐昆转债! | C246: 113020 | D246: 43446. | E246: 桐昆股份 | F246: 601233 | G246: 服装纺织 | H246: 纺织行业 | I246: 134.27 | J246: -1.29e-002 | K246: 1.18e-002 | L246: 16.54 | M246: -1.1999999999999999e-003 | N246: 124 | O246: 2.7000000000000003e-002 | P246: 112.8 | Q246: 12.28 | R246: 1.58 | S246: 134.69 | T246: -3.0000000000000001e-003 | U246: 转股中 | V246: 4年31天 | W246: 2年31天 | X246: 0.113 | Y246: 0.152 | Z246: 34 | AA246: 306 | AB246: -4.2599999999999999e-002 | AC246: -4.7899999999999998e-002 | AD246: -0.111 | AE246: -0.113 | AF246: 94.14 | AG246: 95.48 | AH246: 0.87 | AI246: AA+ | AJ246: 4.2599999999999999e-002 | AK246: =I246+100*T246 -> 133.97 | AL246: 133.8 | AM246: 139 | AN246: 38.4 | AO246: 98 | AP246: 0.111 | AQ246: 15 | AR246: 桐昆转债!
A247: 282 | B247: 国祯转债!! | C247: 123002 | D247: 43094. | E247: 国祯环保 | F247: 300388 | G247: 城市公用 | H247: 三废处理 | I247: 125.6 | J247: 3.0999999999999999e-003 | K247: 1.9e-003 | L247: 10.12 | M247: 5.0000000000000001e-003 | N247: 5.1 | O247: 1.6e-002 | P247: 109.8 | Q247: 8.48 | R247: 1.96 | S247: 119.34 | T247: 5.2000000000000005e-002 | U247: 转股中 | V247: 3年36天 | W247: 1年36天 | X247: 3.6000000000000004e-002 | Y247: 4.2999999999999997e-002 | Z247: 2.5 | AA247: 71 | AB247: -4.3299999999999998e-002 | AC247: -4.8799999999999996e-002 | AD247: -0.14099999999999999 | AE247: -0.14400000000000002 | AF247: 97.1 | AG247: 96.2 | AH247: 1 | AI247: AA | AJ247: 4.4600000000000001e-002 | AK247: =I247+100*T247 -> 130.79999999999998 | AL247: 131.9 | AM247: 122 | AN247: 34.8 | AO247: 55 | AP247: -3.3000000000000002e-002 | AQ247: 11 | AR247: 国祯转债!!
A248: 107 | B248: 博特转债! | C248: 113571 | D248: 43922. | E248: 苏博特 | F248: 603916 | G248: 建筑 | H248: 水泥 | I248: 155.16 | J248: -1.8500000000000003e-002 | K248: 1.3500000000000002e-002 | L248: 29.52 | M248: -5.4000000000000003e-003 | N248: 18 | O248: 2.7000000000000003e-002 | P248: 120.8 | Q248: 18.88 | R248: 3.71 | S248: 156.36 | T248: -8.0000000000000002e-003 | U248: 转股中 | V248: 5.39年 | W248: 3.39年 | X248: 4.5999999999999999e-002 | Y248: 7.2000000000000008e-002 | Z248: 4.2 | AA248: 92 | AB248: -4.6199999999999998e-002 | AC248: -5.2300000000000006e-002 | AD248: -0.10400000000000001 | AE248: -0.106 | AF248: 82.96 | AG248: 85.9 | AH248: 0.93 | AI248: AA- | AJ248: 6.6799999999999998e-002 | AK248: =I248+100*T248 -> 154.35999999999999 | AL248: 154 | AM248: 258 | AN248: 68.1 | AO248: 262 | AP248: -1.1000000000000001e-002 | AQ248: 14 | AR248: 博特转债!
A249: 300 | B249: 九州转债! | C249: 110034 | D249: 42398. | E249: 九州通 | F249: 600998 | G249: 医药 | H249: 医药商业 | I249: 116.2 | J249: 1.7000000000000001e-003 | K249: 3.7000000000000002e-003 | L249: 17.98 | M249: 1.47e-002 | N249: 13 | O249: 6.9999999999999993e-003 | P249: 109.6 | Q249: 18.32 | R249: 1.88 | S249: 98.14 | T249: 0.184 | U249: 转股中 | V249: 1.24年 | W249: 回售中 | X249: 4.4000000000000004e-002 | Y249: 4.4000000000000004e-002 | Z249: 15 | AA249: 337 | AB249: -4.6500000000000007e-002 | AC249: -5.9999999999999998e-002 | AD249: 回售中 | AE249: 回售中 | AF249: 103 | AG249: 104.31 | AH249: 0.37 | AI249: AA+ | AJ249: 4.1200000000000001e-002 | AK249: =I249+100*T249 -> 134.59999999999999 | AL249: 134.3 | AM249: 144 | AN249: 30 | AO249: 21 | AP249: 4.2000000000000003e-002 | AQ249: 25 | AR249: 九州转债!
A250: 53 | B250: 海容转债 | C250: 113590 | D250: 44039. | E250: 海容冷链 | F250: 603187 | G250: 机械装备 | H250: 通用设备 | I250: 150.93 | J250: -7.4999999999999997e-003 | K250: 7.3000000000000001e-003 | L250: 54.84 | M250: -2.0000000000000001e-004 | N250: 3.4 | O250: 4.0000000000000001e-003 | P250: 115.6 | Q250: 36.39 | R250: 5.57 | S250: 150.7 | T250: 2.e-003 | U250: 2月17天 | V250: 5.69年 | W250: 3.69年 | X250: 5.7999999999999996e-002 | Y250: 8.6999999999999994e-002 | Z250: 5 | AA250: 87 | AB250: -4.6600000000000003e-002 | AC250: -5.0999999999999997e-002 | AD250: -9.2899999999999996e-002 | AE250: -9.4499999999999987e-002 | AF250: 81.19 | AG250: 80.61 | AH250: 0.94 | AI250: AA- | AJ250: 6.6799999999999998e-002 | AK250: =I250+100*T250 -> 151.13 | AL250: 151.2 | AM250: 250 | AN250: 70 | AO250: 267 | AP250: 6.2e-002 | AQ250: 5 | AR250: 海容转债
A251: 285 | B251: 久立转2! | C251: 128019 | D251: 43070. | E251: 久立特材 | F251: 2318 | G251: 石油天然 | H251: 石油天然 | I251: 126.7 | J251: -1.7000000000000001e-003 | K251: 4.3e-003 | L251: 9.08 | M251: 3.3e-003 | N251: 1.3 | O251: 1.e-003 | P251: 109.8 | Q251: 7.62 | R251: 2.37 | S251: 119.16 | T251: 6.3e-002 | U251: 转股中 | V251: 3年20天 | W251: 1年20天 | X251: 0.13600000000000001 | Y251: 0.16200000000000001 | Z251: 10 | AA251: 76 | AB251: -4.6699999999999998e-002 | AC251: -5.2199999999999996e-002 | AD251: -0.153 | AE251: -0.156 | AF251: 97.29 | AG251: 96.38 | AH251: 0.78 | AI251: AA | AJ251: 4.4600000000000001e-002 | AK251: =I251+100*T251 -> 133. | AL251: 134.2 | AM251: 143 | AN251: 37 | AO251: 77 | AP251: 3.7999999999999999e-002 | AQ251: 12 | AR251: 久立转2!
A252: 290 | B252: 国君转债! | C252: 113013 | D252: 42940. | E252: 国泰君安 | F252: 601211 | G252: 金融 | H252: 证券行业 | I252: 123.42 | J252: -2.0000000000000001e-004 | K252: 1.9e-003 | L252: 18.67 | M252: 3.2000000000000002e-003 | N252: 53 | O252: 6.0000000000000001e-003 | P252: 108.3 | Q252: 19.01 | R252: 1.37 | S252: 98.21 | T252: 0.25700000000000001 | U252: 转股中 | V252: 2.72年 | W252: 无权 | X252: 4.2000000000000003e-002 | Y252: 4.0999999999999995e-002 | Z252: 70 | AA252: 1663. | AB252: -4.7699999999999992e-002 | AC252: -5.3099999999999994e-002 | AD252: 无权 | AE252: 无权 | AF252: 无权 | AG252: 97.99 | AH252: 0.52 | AI252: AAA | AJ252: 3.8199999999999998e-002 | AK252: =I252+100*T252 -> 149.12 | AL252: 148.6 | AM252: 237 | AN252: 50.6 | AO252: 200 | AP252: 1.1000000000000001e-002 | AQ252: 13 | AR252: 国君转债!
A253: 42 | B253: 欣旺转债 | C253: 123058 | D253: 44050. | E253: 欣旺达 | F253: 300207 | G253: 电子 | H253: 电子产品 | I253: 153.4 | J253: -1.9799999999999998e-002 | K253: -3.7000000000000005e-002 | L253: 28.74 | M253: -6.6900000000000001e-002 | N253: 32 | O253: 1.8000000000000002e-002 | P253: 116.3 | Q253: 21.24 | R253: 7.77 | S253: 135.31 | T253: 0.13400000000000001 | U253: 3月3天 | V253: 5.73年 | W253: 3.73年 | X253: 2.5000000000000001e-002 | Y253: 3.3000000000000002e-002 | Z253: 11 | AA253: 453 | AB253: -4.7899999999999998e-002 | AC253: -5.2499999999999998e-002 | AD253: -9.6000000000000002e-002 | AE253: -9.7599999999999992e-002 | AF253: 87.31 | AG253: 90.4 | AH253: 0.85 | AI253: AA | AJ253: 4.58e-002 | AK253: =I253+100*T253 -> 166.80000000000001 | AL253: 171.5 | AM253: 275 | AN253: 81.1 | AO253: 275 | AP253: 1.7000000000000001e-002 | AQ253: 6 | AR253: 欣旺转债
A254: 124 | B254: 恩捷转债!! | C254: 128095 | D254: 43889. | E254: 恩捷股份 | F254: 2812 | G254: 电子 | H254: 元器件制 | I254: 149.801 | J254: -2.1400000000000002e-002 | K254: 6.0999999999999995e-003 | L254: 98.1 | M254: -1.7000000000000001e-002 | N254: 43 | O254: 2.e-002 | P254: 115.3 | Q254: 65.09 | R254: 16.93 | S254: 150.71 | T254: -6.0000000000000001e-003 | U254: 转股中 | V254: 5.32年 | W254: 3.32年 | X254: 1.6e-002 | Y254: 2.4e-002 | Z254: 14 | AA254: 861 | AB254: -4.8899999999999999e-002 | AC254: -5.3600000000000002e-002 | AD254: -0.10099999999999999 | AE254: -0.10000000000000001 | AF254: 88.97 | AG254: 91.33 | AH254: 0.9 | AI254: AA | AJ254: 4.58e-002 | AK254: =I254+100*T254 -> 149.20099999999999 | AL254: 148.9 | AM254: 240 | AN254: 57.6 | AO254: 236 | AP254: 8.5000000000000006e-002 | AQ254: 17 | AR254: 恩捷转债!!
A255: 264 | B255: 艾华转债!! | C255: 113504 | D255: 43182. | E255: 艾华集团 | F255: 603989 | G255: 电子 | H255: 元器件制 | I255: 130.51 | J255: -2.8199999999999999e-002 | K255: -2.0899999999999998e-002 | L255: 25.53 | M255: -6.0700000000000004e-002 | N255: 12 | O255: 1.6e-002 | P255: 110.3 | Q255: 21.13 | R255: 4.54 | S255: 120.82 | T255: 8.0000000000000002e-002 | U255: 转股中 | V255: 3.37年 | W255: 1.37年 | X255: 5.5e-002 | Y255: 6.7000000000000004e-002 | Z255: 5.6 | AA255: 101 | AB255: -4.9699999999999994e-002 | AC255: -5.4900000000000004e-002 | AD255: -0.13 | AE255: -0.13200000000000001 | AF255: 96.2 | AG255: 95.52 | AH255: 0.81 | AI255: AA | AJ255: 4.4600000000000001e-002 | AK255: =I255+100*T255 -> 138.50999999999999 | AL255: 140.2 | AM255: 200 | AN255: 44 | AO255: 156 | AP255: -6.0999999999999999e-002 | AQ255: 9 | AR255: 艾华转债!!
A256: 80 | B256: 康隆转债 | C256: 113580 | D256: 43971. | E256: 康隆达 | F256: 603665 | G256: 服装纺织 | H256: 服装行业 | I256: 159.88 | J256: 0. | K256: -4.5999999999999999e-003 | L256: 26.87 | M256: -4.7999999999999996e-003 | N256: 67 | O256: 0.21100000000000002 | P256: 121.2 | Q256: 15.51 | R256: 4.31 | S256: 173.24 | T256: -7.6999999999999999e-002 | U256: 10天 | V256: 5.51年 | W256: 3.51年 | X256: 5.0000000000000003e-002 | Y256: 8.6999999999999994e-002 | Z256: 2 | AA256: 40 | AB256: -4.99e-002 | AC256: -5.5999999999999994e-002 | AD256: -0.10800000000000001 | AE256: -0.109 | AF256: 82.31 | AG256: 85.54 | AH256: 0.95 | AI256: AA- | AJ256: 6.6799999999999998e-002 | AK256: =I256+100*T256 -> 152.18000000000001 | AL256: 146.5 | AM256: 232 | AN256: 61 | AO256: 249 | AP256: 5.2999999999999999e-002 | AQ256: 10 | AR256: 康隆转债
A257: 262 | B257: 长证转债! | C257: 127005 | D257: 43201. | E257: 长江证券 | F257: 783 | G257: 金融 | H257: 证券行业 | I257: 130 | J257: -2.5000000000000001e-003 | K257: 3.3e-003 | L257: 8.22 | M257: 1.1999999999999999e-003 | N257: 24 | O257: 4.0000000000000001e-003 | P257: 109.3 | Q257: 7.28 | R257: 1.68 | S257: 112.91 | T257: 0.151 | U257: 转股中 | V257: 3.39年 | W257: 无权 | X257: 0.11 | Y257: 0.124 | Z257: 50 | AA257: 455 | AB257: -5.0799999999999998e-002 | AC257: -5.5399999999999998e-002 | AD257: 无权 | AE257: 无权 | AF257: 无权 | AG257: 96.07 | AH257: 0.71 | AI257: AAA | AJ257: 3.9599999999999996e-002 | AK257: =I257+100*T257 -> 145.09999999999999 | AL257: 147.1 | AM257: 234 | AN257: 51 | AO257: 206 | AP257: 1.3999999999999999e-002 | AQ257: 15 | AR257: 长证转债!
A258: 45 | B258: 安20转债 | C258: 113592 | D258: 44043. | E258: 安井食品 | F258: 603345 | G258: 食品饮料 | H258: 食品饮料 | I258: 151.88 | J258: 1.5900000000000001e-002 | K258: 1.29e-002 | L258: 184 | M258: 3.0800000000000001e-002 | N258: 124 | O258: 8.9999999999999997e-002 | P258: 113.1 | Q258: 115.9 | R258: 14.21 | S258: 158.76 | T258: -4.2999999999999997e-002 | U258: 2月27天 | V258: 5.72年 | W258: 3.72年 | X258: 2.1000000000000001e-002 | Y258: 3.3000000000000002e-002 | Z258: 9 | AA258: 435 | AB258: -5.0999999999999997e-002 | AC258: -5.4800000000000001e-002 | AD258: -9.4399999999999998e-002 | AE258: -9.5899999999999999e-002 | AF258: 87.18 | AG258: 87.96 | AH258: 0.93 | AI258: AA | AJ258: 4.58e-002 | AK258: =I258+100*T258 -> 147.57999999999998 | AL258: 145 | AM258: 225 | AN258: 57 | AO258: 231 | AP258: 6.0999999999999999e-002 | AQ258: 5 | AR258: 安20转债
A259: 89 | B259: 应急转债 | C259: 123048 | D259: 43962. | E259: 中船应急 | F259: 300527 | G259: 机械装备 | H259: 专用设备 | I259: 150.199 | J259: -1.9599999999999999e-002 | K259: -6.7000000000000002e-003 | L259: 13.95 | M259: -2.86e-002 | N259: 579 | O259: 0.46500000000000002 | P259: 113.1 | Q259: 8.9 | R259: 5.48 | S259: 156.74 | T259: -4.2000000000000003e-002 | U259: 转股中 | V259: 5.47年 | W259: 3.47年 | X259: 6.4000000000000001e-002 | Y259: 0.10099999999999999 | Z259: 8.2 | AA259: 127 | AB259: -5.1299999999999998e-002 | AC259: -5.5300000000000002e-002 | AD259: -9.7699999999999995e-002 | AE259: -9.9299999999999999e-002 | AF259: 88.75 | AG259: 89.84 | AH259: 0.92 | AI259: AA+ | AJ259: 4.3799999999999999e-002 | AK259: =I259+100*T259 -> 145.99900000000002 | AL259: 143.7 | AM259: 219 | AN259: 53.8 | AO259: 220 | AP259: 0.17600000000000002 | AQ259: 15 | AR259: 应急转债
A260: 295 | B260: 光大转债 | C260: 113011 | D260: 42934. | E260: 光大银行 | F260: 601818 | G260: 金融 | H260: 银行行业 | I260: 124.5 | J260: 7.1999999999999998e-003 | K260: 6.0000000000000001e-003 | L260: 4.06 | M260: 2.0099999999999996e-002 | N260: 438 | O260: 1.4999999999999999e-002 | P260: 108.3 | Q260: 3.76 | R260: 0.67 | S260: 107.98 | T260: 0.153 | U260: 转股中 | V260: 2.41年 | W260: 无权 | X260: 0.114 | Y260: 0.12300000000000001 | Z260: 242 | AA260: 2131. | AB260: -5.7200000000000001e-002 | AC260: -6.3099999999999989e-002 | AD260: 无权 | AE260: 无权 | AF260: 无权 | AG260: 99.12 | AH260: 0.66 | AI260: AAA | AJ260: 3.8199999999999998e-002 | AK260: =I260+100*T260 -> 139.80000000000001 | AL260: 141 | AM260: 202 | AN260: 41.9 | AO260: 135 | AP260: 8.6999999999999994e-002 | AQ260: 14 | AR260: 光大转债
A261: 129 | B261: 希望转债! | C261: 127015 | D261: 43865. | E261: 新 希 望 | F261: 876 | G261: 农业 | H261: 畜牧业 | I261: 149.3 | J261: 1.0700000000000001e-002 | K261: 1.5e-003 | L261: 29.13 | M261: 1.2199999999999999e-002 | N261: 57 | O261: 2.1000000000000001e-002 | P261: 110.2 | Q261: 19.63 | R261: 4.23 | S261: 148.4 | T261: 6.0000000000000001e-003 | U261: 转股中 | V261: 5.21年 | W261: 3.21年 | X261: 1.3999999999999999e-002 | Y261: 2.1000000000000001e-002 | Z261: 18 | AA261: 1261. | AB261: -5.74e-002 | AC261: -6.0700000000000004e-002 | AD261: -0.10300000000000001 | AE261: -0.10400000000000001 | AF261: 89.97 | AG261: 89.78 | AH261: 1 | AI261: AAA | AJ261: 4.0800000000000003e-002 | AK261: =I261+100*T261 -> 149.90000000000001 | AL261: 150.2 | AM261: 243 | AN261: 60.2 | AO261: 244 | AP261: -6.9999999999999993e-003 | AQ261: 28 | AR261: 希望转债!
A262: 20 | B262: 隆20转债 | C262: 113038 | D262: 44082. | E262: 隆基股份 | F262: 601012 | G262: 能源电力 | H262: 太阳能 | I262: 156.56 | J262: 5.1000000000000004e-003 | K262: -2.3099999999999999e-002 | L262: 76.32 | M262: -2.0299999999999999e-002 | N262: 166 | O262: 2.1000000000000001e-002 | P262: 111.8 | Q262: 52.77 | R262: 9.28 | S262: 144.63 | T262: 8.3000000000000004e-002 | U262: 3月20天 | V262: 5.78年 | W262: 3.78年 | X262: 1.7000000000000001e-002 | Y262: 2.5000000000000001e-002 | Z262: 50 | AA262: 2879. | AB262: -5.74e-002 | AC262: -6.0700000000000004e-002 | AD262: -0.10099999999999999 | AE262: -0.10199999999999999 | AF262: 88.31 | AG262: 89.06 | AH262: 0.89 | AI262: AAA | AJ262: 4.0800000000000003e-002 | AK262: =I262+100*T262 -> 164.86000000000001 | AL262: 168.5 | AM262: 273 | AN262: 79.4 | AO262: 273 | AP262: 2.7000000000000003e-002 | AQ262: 11 | AR262: 隆20转债
A263: 190 | B263: 一心转债! | C263: 128067 | D263: 43602. | E263: 一心堂 | F263: 2727 | G263: 医药 | H263: 医药商业 | I263: 147.03 | J263: -3.9e-002 | K263: 7.9000000000000008e-003 | L263: 39.9 | M263: -3.1099999999999999e-002 | N263: 42 | O263: 0.28699999999999998 | P263: 112.9 | Q263: 26.83 | R263: 4.77 | S263: 148.71 | T263: -1.1000000000000001e-002 | U263: 转股中 | V263: 4.50年 | W263: 2.50年 | X263: 4.0000000000000001e-003 | Y263: 6.0000000000000001e-003 | Z263: 1 | AA263: 235 | AB263: -5.7999999999999996e-002 | AC263: -6.2699999999999992e-002 | AD263: -0.124 | AE263: -0.125 | AF263: 92.16 | AG263: 93.15 | AH263: 1 | AI263: AA | AJ263: 4.4600000000000001e-002 | AK263: =I263+100*T263 -> 145.93000000000001 | AL263: 145.3 | AM263: 227 | AN263: 52.2 | AO263: 212 | AP263: 1.e-003 | AQ263: 17 | AR263: 一心转债!
A264: 146 | B264: 明阳转债! | C264: 113029 | D264: 43837. | E264: 明阳智能 | F264: 601615 | G264: 能源电力 | H264: 风能 | I264: 155.61 | J264: -8.0000000000000004e-004 | K264: -4.4000000000000003e-003 | L264: 19.39 | M264: -5.6000000000000008e-003 | N264: 366 | O264: 0.20999999999999999 | P264: 113.3 | Q264: 12.46 | R264: 3.75 | S264: 155.62 | T264: 0. | U264: 转股中 | V264: 5年58天 | W264: 3年58天 | X264: 4.0999999999999995e-002 | Y264: 6.4000000000000001e-002 | Z264: 11 | AA264: 272 | AB264: -6.0700000000000004e-002 | AC264: -6.4899999999999999e-002 | AD264: -0.113 | AE264: -0.115 | AF264: 89.6 | AG264: 90.38 | AH264: 0.92 | AI264: AA | AJ264: 4.58e-002 | AK264: =I264+100*T264 -> 155.61000000000001 | AL264: 155.6 | AM264: 262 | AN264: 65.2 | AO264: 257 | AP264: 0.19899999999999998 | AQ264: 23 | AR264: 明阳转债!
A265: 56 | B265: 巨星转债 | C265: 128115 | D265: 44028. | E265: 巨星科技 | F265: 2444 | G265: 机械装备 | H265: 通用设备 | I265: 164.3 | J265: -1.9199999999999998e-002 | K265: 5.3e-003 | L265: 20.67 | M265: -1.4800000000000001e-002 | N265: 30 | O265: 1.9e-002 | P265: 115.3 | Q265: 12.28 | R265: 2.74 | S265: 168.32 | T265: -2.4e-002 | U265: 2月17天 | V265: 5.68年 | W265: 3.68年 | X265: 4.4000000000000004e-002 | Y265: 7.400000000000001e-002 | Z265: 9.7 | AA265: 222 | AB265: -6.1399999999999996e-002 | AC265: -6.5700000000000008e-002 | AD265: -0.10400000000000001 | AE265: -0.106 | AF265: 89.8 | AG265: 89.85 | AH265: 0.94 | AI265: AA | AJ265: 4.58e-002 | AK265: =I265+100*T265 -> 161.90000000000001 | AL265: 160.3 | AM265: 265 | AN265: 70.4 | AO265: 268 | AP265: 2.7999999999999997e-002 | AQ265: 4 | AR265: 巨星转债
A266: 248 | B266: 万顺转债 | C266: 123012 | D266: 43341. | E266: 万顺新材 | F266: 300057 | G266: 造纸包装 | H266: 包装材料 | I266: 141.049 | J266: 3.7100000000000001e-002 | K266: -2.9399999999999999e-002 | L266: 6.94 | M266: 8.6999999999999994e-003 | N266: 532 | O266: 2.9100000000000001 | P266: 110.3 | Q266: 5.31 | R266: 1.38 | S266: 130.7 | T266: 7.9000000000000001e-002 | U266: 转股中 | V266: 3.75年 | W266: 1.75年 | X266: 2.7999999999999997e-002 | Y266: 3.6000000000000004e-002 | Z266: 1.3 | AA266: 47 | AB266: -6.4500000000000002e-002 | AC266: -6.9099999999999995e-002 | AD266: -0.126 | AE266: -0.128 | AF266: 91.09 | AG266: 87.31 | AH266: 0.88 | AI266: AA- | AJ266: 6.5599999999999992e-002 | AK266: =I266+100*T266 -> 148.94900000000001 | AL266: 151.4 | AM266: 252 | AN266: 60.3 | AO266: 245 | AP266: 8.4000000000000005e-002 | AQ266: 17 | AR266: 万顺转债
A267: 169 | B267: 万里转债! | C267: 123032 | D267: 43769. | E267: 万里马 | F267: 300591 | G267: 服装纺织 | H267: 服装纺织 | I267: 184 | J267: 6.3600000000000004e-002 | K267: 1.09e-002 | L267: 13.39 | M267: 7.9000000000000001e-002 | N267: 5191. | O267: 34.219999999999999 | P267: 132 | Q267: 6.89 | R267: 9.23 | S267: 194.34 | T267: -5.2999999999999999e-002 | U267: 转股中 | V267: 4.98年 | W267: 2.98年 | X267: 1.8000000000000002e-002 | Y267: 3.5000000000000003e-002 | Z267: 0.8 | AA267: 43 | AB267: -6.6400000000000001e-002 | AC267: -7.5600000000000001e-002 | AD267: -0.156 | AE267: -0.10199999999999999 | AF267: 85.28 | AG267: 92.61 | AH267: 0.94 | AI267: A+ | AJ267: 7.6600000000000001e-002 | AK267: =I267+100*T267 -> 178.69999999999999 | AL267: 173.7 | AM267: 278 | AN267: 81.1 | AO267: 274 | AP267: 0.55200000000000005 | AQ267: 43 | AR267: 万里转债!
A268: 102 | B268: 天铁转债 | C268: 123046 | D268: 43938. | E268: 天铁股份 | F268: 300587 | G268: 铁路 | H268: 铁路设备 | I268: 172.5 | J268: -1.9900000000000001e-002 | K268: -1.9e-003 | L268: 17.52 | M268: -2.29e-002 | N268: 21 | O268: 7.6999999999999999e-002 | P268: 118.2 | Q268: 10.12 | R268: 2.94 | S268: 173.12 | T268: -4.0000000000000001e-003 | U268: 转股中 | V268: 5.41年 | W268: 3.41年 | X268: 2.7999999999999997e-002 | Y268: 4.9000000000000002e-002 | Z268: 1.6 | AA268: 57 | AB268: -6.8699999999999997e-002 | AC268: -7.3899999999999993e-002 | AD268: -0.128 | AE268: -0.13 | AF268: 82.83 | AG268: 83.97 | AH268: 0.95 | AI268: AA- | AJ268: 6.6799999999999998e-002 | AK268: =I268+100*T268 -> 172.09999999999999 | AL268: 171.9 | AM268: 276 | AN268: 87.9 | AO268: 280 | AP268: 8.900000000000001e-002 | AQ268: 9 | AR268: 天铁转债
A269: 185 | B269: 蓝晓转债! | C269: 123027 | D269: 43650. | E269: 蓝晓科技 | F269: 300487 | G269: 化工 | H269: 化工 | I269: 166.48 | J269: 2.3e-003 | K269: 6.4000000000000003e-003 | L269: 48.77 | M269: 9.1000000000000004e-003 | N269: 31 | O269: 0.17399999999999999 | P269: 119.5 | Q269: 29.33 | R269: 7.37 | S269: 166.28 | T269: 1.e-003 | U269: 转股中 | V269: 4.64年 | W269: 2.64年 | X269: 1.e-002 | Y269: 1.7000000000000001e-002 | Z269: 1.1 | AA269: 105 | AB269: -7.0300000000000001e-002 | AC269: -7.6799999999999993e-002 | AD269: -0.10400000000000001 | AE269: -0.106 | AF269: 85.07 | AG269: 85.57 | AH269: 0.95 | AI269: A+ | AJ269: 7.6600000000000001e-002 | AK269: =I269+100*T269 -> 166.57999999999998 | AL269: 166.7 | AM269: 272 | AN269: 81.1 | AO269: 276 | AP269: -8.4000000000000005e-002 | AQ269: 20 | AR269: 蓝晓转债!
A270: 187 | B270: 中环转债! | C270: 123026 | D270: 43647. | E270: 中环环保 | F270: 300692 | G270: 城市公用 | H270: 三废处理 | I270: 144.084 | J270: -3.4000000000000002e-003 | K270: 8.6999999999999994e-003 | L270: 17.74 | M270: 5.6999999999999993e-003 | N270: 81 | O270: 0.371 | P270: 110.6 | Q270: 12.25 | R270: 2.87 | S270: 144.82 | T270: -5.0000000000000001e-003 | U270: 转股中 | V270: 3.64年 | W270: 1.64年 | X270: 4.9000000000000002e-002 | Y270: 7.0999999999999994e-002 | Z270: 1.5 | AA270: 30 | AB270: -7.1199999999999999e-002 | AC270: -7.5999999999999998e-002 | AD270: -0.14400000000000002 | AE270: -0.14599999999999999 | AF270: 91.68 | AG270: 88.16 | AH270: 0.92 | AI270: AA- | AJ270: 6.5599999999999992e-002 | AK270: =I270+100*T270 -> 143.584 | AL270: 143.4 | AM270: 215 | AN270: 51.7 | AO270: 210 | AP270: 6.6000000000000003e-002 | AQ270: 28 | AR270: 中环转债!
A271: 77 | B271: 火炬转债 | C271: 113582 | D271: 44005. | E271: 火炬电子 | F271: 603678 | G271: 电子 | H271: 元器件制 | I271: 174 | J271: -2.7900000000000001e-002 | K271: 1.78e-002 | L271: 47 | M271: -1.0500000000000001e-002 | N271: 25 | O271: 2.4e-002 | P271: 115.3 | Q271: 25.33 | R271: 6.41 | S271: 185.55 | T271: -6.2e-002 | U271: 44天 | V271: 5.60年 | W271: 3.60年 | X271: 2.7999999999999997e-002 | Y271: 5.2000000000000005e-002 | Z271: 6 | AA271: 213 | AB271: -7.2000000000000008e-002 | AC271: -7.6200000000000004e-002 | AD271: -0.124 | AE271: -0.125 | AF271: 87.82 | AG271: 90.16 | AH271: 0.96 | AI271: AA | AJ271: 4.58e-002 | AK271: =I271+100*T271 -> 167.80000000000001 | AL271: 162.4 | AM271: 268 | AN271: 72.3 | AO271: 271 | AP271: 7.4999999999999997e-002 | AQ271: 5 | AR271: 火炬转债
A272: 223 | B272: 联泰转债! | C272: 113526 | D272: 43514. | E272: 联泰环保 | F272: 603797 | G272: 城市公用 | H272: 三废处理 | I272: 151.74 | J272: -2.5000000000000001e-003 | K272: 7.6e-003 | L272: 8.66 | M272: 5.7999999999999996e-003 | N272: 7.4 | O272: 2.5000000000000001e-002 | P272: 110.8 | Q272: 6.11 | R272: 1.82 | S272: 141.73 | T272: 7.0999999999999994e-002 | U272: 转股中 | V272: 4.26年 | W272: 2.26年 | X272: 5.0000000000000003e-002 | Y272: 7.0000000000000007e-002 | Z272: 1.9 | AA272: 39 | AB272: -7.2400000000000006e-002 | AC272: -7.6499999999999999e-002 | AD272: -0.109 | AE272: -0.11 | AF272: 93.01 | AG272: 92.36 | AH272: 0.88 | AI272: AA | AJ272: 4.4600000000000001e-002 | AK272: =I272+100*T272 -> 158.84 | AL272: 161.7 | AM272: 267 | AN272: 68.7 | AO272: 264 | AP272: -1.3000000000000001e-002 | AQ272: 8 | AR272: 联泰转债!
A273: 158 | B273: 通光转债! | C273: 123034 | D273: 43797. | E273: 通光线缆 | F273: 300265 | G273: 通信互联 | H273: 通信设备 | I273: 172.6 | J273: 1.24e-002 | K273: 3.5999999999999999e-003 | L273: 13.38 | M273: 1.67e-002 | N273: 448 | O273: 3.3100000000000001 | P273: 118.5 | Q273: 7.97 | R273: 4.04 | S273: 167.88 | T273: 2.7999999999999997e-002 | U273: 转股中 | V273: 5年16天 | W273: 3年16天 | X273: 1.6e-002 | Y273: 2.7000000000000003e-002 | Z273: 0.8 | AA273: 49 | AB273: -7.3200000000000001e-002 | AC273: -7.8799999999999995e-002 | AD273: -0.14400000000000002 | AE273: -0.14499999999999999 | AF273: 82.05 | AG273: 81.95 | AH273: 0.96 | AI273: A+ | AJ273: 7.7800000000000008e-002 | AK273: =I273+100*T273 -> 175.40000000000001 | AL273: 177.3 | AM273: 281 | AN273: 95.3 | AO273: 284 | AP273: 9.5000000000000001e-002 | AQ273: 25 | AR273: 通光转债!
A274: 178 | B274: 欧派转债! | C274: 113543 | D274: 43712. | E274: 欧派家居 | F274: 603833 | G274: 其他 | H274: 家居用品 | I274: 165.41 | J274: 5.8999999999999999e-003 | K274: 3.8e-003 | L274: 118.96 | M274: 1.03e-002 | N274: 57 | O274: 4.0999999999999995e-002 | P274: 114.9 | Q274: 71.69 | R274: 5.39 | S274: 165.94 | T274: -3.0000000000000001e-003 | U274: 转股中 | V274: 4.82年 | W274: 3.82年 | X274: 1.2e-002 | Y274: 2.e-002 | Z274: 8.6 | AA274: 709 | AB274: -7.3899999999999993e-002 | AC274: -7.8799999999999995e-002 | AD274: -0.10400000000000001 | AE274: -0.106 | AF274: 88.64 | AG274: 93.46 | AH274: 0.94 | AI274: AA | AJ274: 4.4600000000000001e-002 | AK274: =I274+100*T274 -> 165.10999999999999 | AL274: 164.9 | AM274: 271 | AN274: 71.4 | AO274: 269 | AP274: 7.0999999999999994e-002 | AQ274: 15 | AR274: 欧派转债!
A275: 62 | B275: 歌尔转2 | C275: 128112 | D275: 44025. | E275: 歌尔股份 | F275: 2241 | G275: 电子 | H275: 电子产品 | I275: 177.6 | J275: -5.8999999999999999e-003 | K275: -6.3e-003 | L275: 40.38 | M275: -1.3000000000000001e-002 | N275: 142 | O275: 2.e-002 | P275: 114.5 | Q275: 23.27 | R275: 8.11 | S275: 173.53 | T275: 2.3e-002 | U275: 2月0天 | V275: 5.65年 | W275: 3.65年 | X275: 3.1e-002 | Y275: 5.2999999999999999e-002 | Z275: 40 | AA275: 1310. | AB275: -7.5700000000000003e-002 | AC275: -7.980000000000001e-002 | AD275: -0.128 | AE275: -0.129 | AF275: 87.55 | AG275: 90.2 | AH275: 0.94 | AI275: AA+ | AJ275: 4.3799999999999999e-002 | AK275: =I275+100*T275 -> 179.90000000000001 | AL275: 181.7 | AM275: 284 | AN275: 91.5 | AO275: 282 | AP275: -1.3000000000000001e-002 | AQ275: 16 | AR275: 歌尔转2
A276: 103 | B276: 海大转债 | C276: 128102 | D276: 43937. | E276: 海大集团 | F276: 2311 | G276: 农业 | H276: 畜牧业 | I276: 174.612 | J276: -4.3e-003 | K276: 1.5e-003 | L276: 60.72 | M276: -3.0000000000000001e-003 | N276: 59 | O276: 1.7000000000000001e-002 | P276: 114.1 | Q276: 34.74 | R276: 9.77 | S276: 174.78 | T276: -1.e-003 | U276: 转股中 | V276: 5.41年 | W276: 4.41年 | X276: 2.1000000000000001e-002 | Y276: 3.7000000000000005e-002 | Z276: 20 | AA276: 972 | AB276: -7.6499999999999999e-002 | AC276: -8.0600000000000005e-002 | AD276: -0.10099999999999999 | AE276: -0.10199999999999999 | AF276: 86.01 | AG276: 90.78 | AH276: 0.96 | AI276: AA+ | AJ276: 4.3799999999999999e-002 | AK276: =I276+100*T276 -> 174.512 | AL276: 174.4 | AM276: 279 | AN276: 83.7 | AO276: 278 | AP276: -6.0000000000000001e-003 | AQ276: 12 | AR276: 海大转债
A277: 259 | B277: 金农转债!! | C277: 128036 | D277: 43192. | E277: 金新农 | F277: 2548 | G277: 农业 | H277: 畜牧业 | I277: 143.795 | J277: -3.4999999999999996e-003 | K277: -8.9999999999999998e-004 | L277: 9.07 | M277: -4.4000000000000003e-003 | N277: 44 | O277: 0.20999999999999999 | P277: 110.3 | Q277: 7.39 | R277: 2.58 | S277: 122.73 | T277: 0.17199999999999999 | U277: 转股中 | V277: 3.39年 | W277: 1.39年 | X277: 2.8999999999999998e-002 | Y277: 3.5000000000000003e-002 | Z277: 1.5 | AA277: 51 | AB277: -7.6700000000000004e-002 | AC277: -8.1600000000000006e-002 | AD277: -0.17300000000000001 | AE277: -0.17499999999999999 | AF277: 93.22 | AG277: 89.36 | AH277: 1 | AI277: AA- | AJ277: 6.5599999999999992e-002 | AK277: =I277+100*T277 -> 160.99499999999998 | AL277: 164.9 | AM277: 270 | AN277: 71.6 | AO277: 270 | AP277: 2.5000000000000001e-002 | AQ277: 15 | AR277: 金农转债!!
A278: 245 | B278: 凯发转债! | C278: 123014 | D278: 43333. | E278: 凯发电气 | F278: 300407 | G278: 能源电力 | H278: 电力设备 | I278: 137.84 | J278: 1.9299999999999998e-002 | K278: -1.41e-002 | L278: 9.1 | M278: 6.6e-003 | N278: 171 | O278: 1.0700000000000001 | P278: 108.5 | Q278: 8.12 | R278: 2.11 | S278: 112.07 | T278: 0.23000000000000001 | U278: 转股中 | V278: 2.77年 | W278: 0.77年 | X278: 4.2000000000000003e-002 | Y278: 4.7e-002 | Z278: 1.2 | AA278: 28 | AB278: -8.3599999999999994e-002 | AC278: -8.8699999999999987e-002 | AD278: -0.28600000000000003 | AE278: -0.28800000000000003 | AF278: 94.61 | AG278: 88.98 | AH278: 0.79 | AI278: A+ | AJ278: 7.5199999999999989e-002 | AK278: =I278+100*T278 -> 160.84 | AL278: 163.6 | AM278: 269 | AN278: 69 | AO278: 265 | AP278: 1.2e-002 | AQ278: 15 | AR278: 凯发转债!
A279: 174 | B279: 九洲转债! | C279: 123030 | D279: 43720. | E279: 九洲集团 | F279: 300040 | G279: 能源电力 | H279: 电力设备 | I279: 182 | J279: 4.9000000000000002e-002 | K279: -2.3e-003 | L279: 10.08 | M279: 4.6699999999999998e-002 | N279: 1198. | O279: 5.5300000000000002 | P279: 120 | Q279: 5.65 | R279: 1.76 | S279: 178.41 | T279: 2.e-002 | U279: 转股中 | V279: 4.84年 | W279: 2.84年 | X279: 2.9999999999999999e-002 | Y279: 5.4000000000000006e-002 | Z279: 1.2 | AA279: 38 | AB279: -8.3800000000000013e-002 | AC279: -8.9999999999999997e-002 | AD279: -0.11 | AE279: -0.111 | AF279: 85.69 | AG279: 88.78 | AH279: 1 | AI279: AA- | AJ279: 6.5599999999999992e-002 | AK279: =I279+100*T279 -> 184. | AL279: 185.6 | AM279: 285 | AN279: 96.8 | AO279: 285 | AP279: 0.21600000000000003 | AQ279: 28 | AR279: 九洲转债!
A280: 210 | B280: 长信转债!! | C280: 123022 | D280: 43565. | E280: 长信科技 | F280: 300088 | G280: 通信互联 | H280: 通信设备 | I280: 170.199 | J280: -1.0500000000000001e-002 | K280: 4.0999999999999995e-003 | L280: 10.41 | M280: -6.7000000000000002e-003 | N280: 7.7 | O280: 1.4999999999999999e-002 | P280: 114.9 | Q280: 6.15 | R280: 3.88 | S280: 169.27 | T280: 5.0000000000000001e-003 | U280: 转股中 | V280: 4.41年 | W280: 2.41年 | X280: 1.2e-002 | Y280: 2.e-002 | Z280: 3 | AA280: 255 | AB280: -8.6699999999999999e-002 | AC280: -9.1899999999999996e-002 | AD280: -0.125 | AE280: -0.126 | AF280: 92.51 | AG280: 95.16 | AH280: 0.95 | AI280: AA | AJ280: 4.4600000000000001e-002 | AK280: =I280+100*T280 -> 170.69900000000001 | AL280: 171.1 | AM280: 274 | AN280: 76 | AO280: 272 | AP280: -1.7000000000000001e-002 | AQ280: 11 | AR280: 长信转债!!
A281: 303 | B281: 电气转债! | C281: 113008 | D281: 42051. | E281: 上海电气 | F281: 601727 | G281: 能源电力 | H281: 电力设备 | I281: 109.45 | J281: 1.e-003 | K281: -1.e-003 | L281: 5.26 | M281: 0. | N281: 35 | O281: 6.9999999999999993e-003 | P281: 106.6 | Q281: 5.13 | R281: 1.23 | S281: 102.53 | T281: 6.7000000000000004e-002 | U281: 转股中 | V281: 0.29年 | W281: 回售中 | X281: 5.5e-002 | Y281: 5.7000000000000002e-002 | Z281: 44 | AA281: 797 | AB281: -8.6800000000000002e-002 | AC281: -0.125 | AD281: 回售中 | AE281: 回售中 | AF281: 103 | AG281: 105.54 | AH281: 0.36 | AI281: AAA | AJ281: 3.49e-002 | AK281: =I281+100*T281 -> 116.15000000000001 | AL281: 116.4 | AM281: 3 | AN281: 10.8 | AO281: 1 | AP281: 2.e-003 | AQ281: 29 | AR281: 电气转债!
A282: 221 | B282: 尚荣转债! | C282: 128053 | D282: 43531. | E282: 尚荣医疗 | F282: 2551 | G282: 医药 | H282: 医疗器械 | I282: 168.999 | J282: 1.7000000000000001e-002 | K282: 1.1899999999999999e-002 | L282: 7.85 | M282: 2.8799999999999999e-002 | N282: 141 | O282: 0.43799999999999994 | P282: 114.9 | Q282: 4.89 | R282: 2.2 | S282: 160.53 | T282: 5.2999999999999999e-002 | U282: 转股中 | V282: 4.32年 | W282: 2.32年 | X282: 2.9999999999999999e-002 | Y282: 4.8000000000000001e-002 | Z282: 1.9 | AA282: 64 | AB282: -8.6800000000000002e-002 | AC282: -9.2200000000000004e-002 | AD282: -0.129 | AE282: -0.13100000000000001 | AF282: 92.86 | AG282: 95.52 | AH282: 1 | AI282: AA | AJ282: 4.4600000000000001e-002 | AK282: =I282+100*T282 -> 174.29900000000001 | AL282: 177.5 | AM282: 282 | AN282: 81.9 | AO282: 277 | AP282: 5.2000000000000005e-002 | AQ282: 26 | AR282: 尚荣转债!
A283: 275 | B283: 赣锋转债!! | C283: 128028 | D283: 43119. | E283: 赣锋锂业 | F283: 2460 | G283: 有色金属 | H283: 小金属 | I283: 145.3 | J283: -4.4800000000000006e-002 | K283: 1.8000000000000002e-002 | L283: 57.13 | M283: -2.6699999999999998e-002 | N283: 25 | O283: 1.9e-002 | P283: 109.3 | Q283: 41.68 | R283: 9.18 | S283: 137.07 | T283: 5.9999999999999998e-002 | U283: 转股中 | V283: 3.17年 | W283: 1.17年 | X283: 1.2e-002 | Y283: 1.7000000000000001e-002 | Z283: 9.2 | AA283: 761 | AB283: -8.7100000000000011e-002 | AC283: -9.1899999999999996e-002 | AD283: -0.215 | AE283: -0.217 | AF283: 96.3 | AG283: 95.4 | AH283: 1 | AI283: AA | AJ283: 4.4600000000000001e-002 | AK283: =I283+100*T283 -> 151.30000000000001 | AL283: 153.5 | AM283: 257 | AN283: 57.2 | AO283: 233 | AP283: 6.3e-002 | AQ283: 13 | AR283: 赣锋转债!!
A284: 242 | B284: 蓝盾转债!! | C284: 123015 | D284: 43356. | E284: 蓝盾股份 | F284: 300297 | G284: 计算机及 | H284: 软件开发 | I284: 172.46 | J284: 6.9900000000000004e-002 | K284: -6.9900000000000004e-002 | L284: 5.81 | M284: 0.13699999999999998 | N284: 1912. | O284: 10.93 | P284: 112.3 | Q284: 5.79 | R284: 1.93 | S284: 100.35 | T284: 0.71900000000000008 | U284: 转股中 | V284: 3.82年 | W284: 1.82年 | X284: 1.3999999999999999e-002 | Y284: 1.3999999999999999e-002 | Z284: 1 | AA284: 73 | AB284: -0.10800000000000001 | AC284: -0.113 | AD284: -0.182 | AE284: -0.183 | AF284: 94.34 | AG284: 95.36 | AH284: 0 | AI284: AA | AJ284: 4.4600000000000001e-002 | AK284: =I284+100*T284 -> 244.36000000000001 | AL284: 244.6 | AM284: 293 | AN284: 149.2 | AO284: 293 | AP284: 0.122 | AQ284: 18 | AR284: 蓝盾转债!!
A285: 78 | B285: 龙蟠转债 | C285: 113581 | D285: 43970. | E285: 龙蟠科技 | F285: 603906 | G285: 化工 | H285: 化工 | I285: 242.94 | J285: -4.9000000000000002e-002 | K285: 3.7000000000000002e-003 | L285: 24.69 | M285: -4.6699999999999998e-002 | N285: 168 | O285: 0.17100000000000001 | P285: 129.6 | Q285: 9.48 | R285: 5.3 | S285: 260.44 | T285: -6.7000000000000004e-002 | U285: 10天 | V285: 5.51年 | W285: 3.51年 | X285: 5.4000000000000006e-002 | Y285: 0.13900000000000001 | Z285: 4 | AA285: 75 | AB285: -0.11 | AC285: -0.11800000000000001 | AD285: -0.107 | AE285: -0.10800000000000001 | AF285: 81.34 | AG285: 86.89 | AH285: 0.97 | AI285: A+ | AJ285: 7.7800000000000008e-002 | AK285: =I285+100*T285 -> 236.24000000000001 | AL285: 225.4 | AM285: 292 | AN285: 138.5 | AO285: 292 | AP285: -6.4000000000000001e-002 | AQ285: 15 | AR285: 龙蟠转债
A286: 76 | B286: 福莱转债 | C286: 113035 | D286: 43999. | E286: 福莱特 | F286: 601865 | G286: 能源电力 | H286: 太阳能 | I286: 231.88 | J286: 5.6000000000000008e-003 | K286: 3.8699999999999998e-002 | L286: 38.7 | M286: 4.5100000000000001e-002 | N286: 686 | O286: 0.20300000000000001 | P286: 120.3 | Q286: 13.56 | R286: 15.14 | S286: 285.4 | T286: -0.188 | U286: 45天 | V286: 5.60年 | W286: 3.60年 | X286: 1.9e-002 | Y286: 5.5e-002 | Z286: 15 | AA286: 756 | AB286: -0.11199999999999999 | AC286: -0.11699999999999999 | AD286: -0.10099999999999999 | AE286: -0.10099999999999999 | AF286: 87.82 | AG286: 94.05 | AH286: 0.98 | AI286: AA | AJ286: 4.58e-002 | AK286: =I286+100*T286 -> 213.07999999999998 | AL286: 178.4 | AM286: 283 | AN286: 84.3 | AO286: 279 | AP286: 0.39299999999999996 | AQ286: 5 | AR286: 福莱转债
A287: 67 | B287: 上机转债 | C287: 113586 | D287: 44019. | E287: 上机数控 | F287: 603185 | G287: 机械装备 | H287: 专用设备 | I287: 232.76 | J287: 2.8000000000000004e-003 | K287: 2.1499999999999998e-002 | L287: 91.9 | M287: 2.4799999999999999e-002 | N287: 99 | O287: 6.4000000000000001e-002 | P287: 120.8 | Q287: 33.3 | R287: 11.76 | S287: 275.98 | T287: -0.157 | U287: 57天 | V287: 5.64年 | W287: 3.64年 | X287: 3.1e-002 | Y287: 8.5999999999999993e-002 | Z287: 6.7 | AA287: 214 | AB287: -0.11199999999999999 | AC287: -0.11699999999999999 | AD287: -0.17899999999999999 | AE287: -0.10000000000000001 | AF287: 81.66 | AG287: 84.56 | AH287: 0.98 | AI287: AA- | AJ287: 6.6799999999999998e-002 | AK287: =I287+100*T287 -> 217.06 | AL287: 189.5 | AM287: 286 | AN287: 105 | AO287: 287 | AP287: 0.223 | AQ287: 8 | AR287: 上机转债
A288: 288 | B288: 金禾转债!! | C288: 128017 | D288: 43066. | E288: 金禾实业 | F288: 2597 | G288: 化工 | H288: 化工 | I288: 157.4 | J288: -1.2999999999999999e-003 | K288: 2.5999999999999999e-003 | L288: 35.2 | M288: 1.4000000000000002e-003 | N288: 54 | O288: 6.0999999999999999e-002 | P288: 109.8 | Q288: 22.42 | R288: 4.49 | S288: 157 | T288: 3.0000000000000001e-003 | U288: 转股中 | V288: 3年13天 | W288: 1年13天 | X288: 2.7999999999999997e-002 | Y288: 4.4000000000000004e-002 | Z288: 5.5 | AA288: 197 | AB288: -0.114 | AC288: -0.11900000000000001 | AD288: -0.28499999999999998 | AE288: -0.28800000000000003 | AF288: 97.37 | AG288: 96.46 | AH288: 0.95 | AI288: AA | AJ288: 4.4600000000000001e-002 | AK288: =I288+100*T288 -> 157.70000000000002 | AL288: 157.8 | AM288: 264 | AN288: 60.4 | AO288: 246 | AP288: 5.7999999999999996e-002 | AQ288: 11 | AR288: 金禾转债!!
A289: 236 | B289: 科森转债!! | C289: 113521 | D289: 43441. | E289: 科森科技 | F289: 603626 | G289: 通信互联 | H289: 通信设备 | I289: 203.88 | J289: -2.7999999999999997e-002 | K289: 2.69e-002 | L289: 17.28 | M289: -1.1999999999999999e-003 | N289: 102 | O289: 0.79500000000000004 | P289: 115.2 | Q289: 8.7 | R289: 4.01 | S289: 198.62 | T289: 2.6000000000000002e-002 | U289: 转股中 | V289: 4年28天 | W289: 2年28天 | X289: 8.0000000000000002e-003 | Y289: 1.4999999999999999e-002 | Z289: 0.6 | AA289: 84 | AB289: -0.13300000000000001 | AC289: -0.13800000000000001 | AD289: -0.19 | AE289: -0.192 | AF289: 94 | AG289: 96.83 | AH289: 0.96 | AI289: AA | AJ289: 4.4600000000000001e-002 | AK289: =I289+100*T289 -> 206.47999999999999 | AL289: 209.1 | AM289: 289 | AN289: 112.3 | AO289: 289 | AP289: 5.5999999999999994e-002 | AQ289: 25 | AR289: 科森转债!!
A290: 238 | B290: 百合转债! | C290: 113520 | D290: 43430. | E290: 梦百合 | F290: 603313 | G290: 其他 | H290: 家居用品 | I290: 210.35 | J290: 2.7000000000000003e-002 | K290: -1.1699999999999999e-002 | L290: 28.92 | M290: 1.5800000000000002e-002 | N290: 150 | O290: 1.1699999999999999 | P290: 115.2 | Q290: 14.28 | R290: 3.84 | S290: 202.52 | T290: 3.9e-002 | U290: 转股中 | V290: 4年20天 | W290: 2年20天 | X290: 6.0000000000000001e-003 | Y290: 1.2e-002 | Z290: 0.6 | AA290: 100 | AB290: -0.14000000000000001 | AC290: -0.14599999999999999 | AD290: -0.19899999999999998 | AE290: -0.20000000000000001 | AF290: 90.07 | AG290: 89.6 | AH290: 0.97 | AI290: AA- | AJ290: 6.5599999999999992e-002 | AK290: =I290+100*T290 -> 214.25 | AL290: 218.2 | AM290: 290 | AN290: 128.1 | AO290: 290 | AP290: 3.0000000000000001e-003 | AQ290: 11 | AR290: 百合转债!
A291: 225 | B291: 溢利转债! | C291: 123018 | D291: 43488. | E291: 溢多利 | F291: 300381 | G291: 医药 | H291: 原料药 | I291: 213 | J291: 2.8000000000000004e-003 | K291: 4.7999999999999996e-003 | L291: 14.04 | M291: 7.9000000000000008e-003 | N291: 11 | O291: 9.6000000000000002e-002 | P291: 114.9 | Q291: 8.29 | R291: 2.43 | S291: 169.36 | T291: 0.25800000000000001 | U291: 转股中 | V291: 4.17年 | W291: 2.17年 | X291: 8.0000000000000002e-003 | Y291: 1.3999999999999999e-002 | Z291: 0.5 | AA291: 67 | AB291: -0.14000000000000001 | AC291: -0.14499999999999999 | AD291: -0.18899999999999997 | AE291: -0.19 | AF291: 89.29 | AG291: 88.68 | AH291: 0.96 | AI291: AA- | AJ291: 6.5599999999999992e-002 | AK291: =I291+100*T291 -> 238.80000000000001 | AL291: 256.6 | AM291: 294 | AN291: 167.3 | AO291: 295 | AP291: 5.0000000000000001e-003 | AQ291: 13 | AR291: 溢利转债!
A292: 250 | B292: 盛路转债!! | C292: 128041 | D292: 43326. | E292: 盛路通信 | F292: 2446 | G292: 通信互联 | H292: 通信设备 | I292: 201.21 | J292: -2.2400000000000003e-002 | K292: 1.7299999999999999e-002 | L292: 7.48 | M292: -5.3e-003 | N292: 118 | O292: 1.1000000000000001 | P292: 114.3 | Q292: 6.85 | R292: 2.36 | S292: 109.2 | T292: 0.84299999999999997 | U292: 转股中 | V292: 3.74年 | W292: 1.74年 | X292: 8.0000000000000002e-003 | Y292: 9.0000000000000011e-003 | Z292: 0.5 | AA292: 67 | AB292: -0.14199999999999999 | AC292: -0.14800000000000002 | AD292: -0.23199999999999998 | AE292: -0.23300000000000001 | AF292: 94.64 | AG292: 97.37 | AH292: 0.94 | AI292: AA | AJ292: 4.4600000000000001e-002 | AK292: =I292+100*T292 -> 285.50999999999999 | AL292: 293.2 | AM292: 297 | AN292: 195.9 | AO292: 297 | AP292: -4.2999999999999997e-002 | AQ292: 12 | AR292: 盛路转债!!
A293: 292 | B293: 模塑转债!! | C293: 127004 | D293: 42963. | E293: 模塑科技 | F293: 700 | G293: 汽车 | H293: 零部件制 | I293: 170.73 | J293: -3.2099999999999997e-002 | K293: 2.81e-002 | L293: 6.23 | M293: -1.4199999999999999e-002 | N293: 138 | O293: 0.60099999999999998 | P293: 113.3 | Q293: 7.46 | R293: 2.14 | S293: 83.51 | T293: 1.04 | U293: 转股中 | V293: 2.62年 | W293: 0.62年 | X293: 2.3e-002 | Y293: 1.9e-002 | Z293: 1.3 | AA293: 57 | AB293: -0.14699999999999999 | AC293: -0.154 | AD293: -0.52600000000000002 | AE293: -0.52900000000000003 | AF293: 98.48 | AG293: 101.61 | AH293: 0.28 | AI293: AA | AJ293: 4.3200000000000002e-002 | AK293: =I293+100*T293 -> 274.73000000000002 | AL293: 257.9 | AM293: 295 | AN293: 156.3 | AO293: 294 | AP293: -4.5999999999999999e-002 | AQ293: 37 | AR293: 模塑转债!!
A294: 172 | B294: 晶瑞转债! | C294: 123031 | D294: 43734. | E294: 晶瑞股份 | F294: 300655 | G294: 化工 | H294: 化工 | I294: 248.46 | J294: -8.1000000000000013e-003 | K294: -2.41e-002 | L294: 40.82 | M294: -3.2899999999999999e-002 | N294: 228 | O294: 1.4399999999999999 | P294: 115.8 | Q294: 18.53 | R294: 6.16 | S294: 220.29 | T294: 0.128 | U294: 转股中 | V294: 4.86年 | W294: 2.86年 | X294: 8.0000000000000002e-003 | Y294: 1.8000000000000002e-002 | Z294: 0.6 | AA294: 77 | AB294: -0.14699999999999999 | AC294: -0.152 | AD294: -0.151 | AE294: -0.151 | AF294: 82.77 | AG294: 81.43 | AH294: 0.98 | AI294: A+ | AJ294: 7.6600000000000001e-002 | AK294: =I294+100*T294 -> 261.25999999999999 | AL294: 276.6 | AM294: 296 | AN294: 193.9 | AO294: 296 | AP294: 5.9000000000000004e-002 | AQ294: 14 | AR294: 晶瑞转债!
A295: 243 | B295: 东音转债!! | C295: 128043 | D295: 43339. | E295: 罗欣药业 | F295: 2793 | G295: 医药 | H295: 化学制药 | I295: 212.56 | J295: -3.1600000000000003e-002 | K295: 1.2699999999999999e-002 | L295: 13.46 | M295: -1.9e-002 | N295: 53 | O295: 0.90799999999999992 | P295: 114.5 | Q295: 6.22 | R295: 5.03 | S295: 216.4 | T295: -1.8000000000000002e-002 | U295: 转股中 | V295: 3.79年 | W295: 1.79年 | X295: 1.e-003 | Y295: 3.0000000000000001e-003 | Z295: 0.3 | AA295: 196 | AB295: -0.153 | AC295: -0.158 | AD295: -0.23800000000000002 | AE295: -0.23899999999999999 | AF295: 94.49 | AG295: 97.36 | AH295: 1 | AI295: AA | AJ295: 4.4600000000000001e-002 | AK295: =I295+100*T295 -> 210.75999999999999 | AL295: 208.7 | AM295: 288 | AN295: 111.4 | AO295: 288 | AP295: -6.7000000000000004e-002 | AQ295: 10 | AR295: 东音转债!!
A296: 274 | B296: 太阳转债!! | C296: 128029 | D296: 43116. | E296: 太阳纸业 | F296: 2078 | G296: 造纸包装 | H296: 造纸行业 | I296: 156.2 | J296: -1.3300000000000001e-002 | K296: 2.8199999999999999e-002 | L296: 12.94 | M296: 1.49e-002 | N296: 14 | O296: 8.0000000000000002e-003 | P296: 107.8 | Q296: 8.55 | R296: 2.18 | S296: 151.35 | T296: 3.2000000000000001e-002 | U296: 转股中 | V296: 2.18年 | W296: 0.18年 | X296: 3.3000000000000002e-002 | Y296: 5.0000000000000003e-002 | Z296: 11 | AA296: 337 | AB296: -0.158 | AC296: -0.16399999999999998 | AD296: -1.1059999999999999 | AE296: -1.109 | AF296: 99.59 | AG296: 98.83 | AH296: 1 | AI296: AA+ | AJ296: 4.1200000000000001e-002 | AK296: =I296+100*T296 -> 159.39999999999998 | AL296: 161.1 | AM296: 266 | AN296: 61.5 | AO296: 251 | AP296: -6.2e-002 | AQ296: 8 | AR296: 太阳转债!!
A297: 273 | B297: 天康转债!! | C297: 128030 | D297: 43129. | E297: 天康生物 | F297: 2100 | G297: 农业 | H297: 畜牧业 | I297: 195.2 | J297: -7.0999999999999995e-003 | K297: 9.7999999999999997e-003 | L297: 15.1 | M297: 2.7000000000000001e-003 | N297: 12 | O297: 6.0999999999999999e-002 | P297: 112.3 | Q297: 7.85 | R297: 3.07 | S297: 192.36 | T297: 1.4999999999999999e-002 | U297: 转股中 | V297: 3.18年 | W297: 1.18年 | X297: 6.0000000000000001e-003 | Y297: 1.2e-002 | Z297: 1 | AA297: 162 | AB297: -0.16300000000000001 | AC297: -0.16800000000000001 | AD297: -0.34200000000000003 | AE297: -0.34299999999999997 | AF297: 97.01 | AG297: 98.08 | AH297: 1 | AI297: AA | AJ297: 4.4600000000000001e-002 | AK297: =I297+100*T297 -> 196.69999999999999 | AL297: 198 | AM297: 287 | AN297: 100 | AO297: 286 | AP297: 2.6000000000000002e-002 | AQ297: 10 | AR297: 天康转债!!
A298: 257 | B298: 新泉转债!! | C298: 113509 | D298: 43273. | E298: 新泉股份 | F298: 603179 | G298: 汽车 | H298: 零部件制 | I298: 223.32 | J298: -2.6499999999999999e-002 | K298: -3.7000000000000002e-003 | L298: 31.75 | M298: -3.0800000000000001e-002 | N298: 56 | O298: 0.192 | P298: 110.3 | Q298: 14.22 | R298: 5.11 | S298: 223.28 | T298: 0. | U298: 转股中 | V298: 3.62年 | W298: 1.62年 | X298: 1.3000000000000001e-002 | Y298: 2.8999999999999998e-002 | Z298: 1.3 | AA298: 100 | AB298: -0.17899999999999999 | AC298: -0.183 | AD298: -0.27699999999999997 | AE298: -0.27800000000000002 | AF298: 95.13 | AG298: 94.46 | AH298: 0.98 | AI298: AA | AJ298: 4.4600000000000001e-002 | AK298: =I298+100*T298 -> 223.31999999999999 | AL298: 223.4 | AM298: 291 | AN298: 128.2 | AO298: 291 | AP298: -2.3e-002 | AQ298: 11 | AR298: 新泉转债!!
A299: 224 | B299: 凯龙转债! | C299: 128052 | D299: 43486. | E299: 凯龙股份 | F299: 2783 | G299: 化工 | H299: 化工 | I299: 270.478 | J299: -1.5700000000000002e-002 | K299: 7.8000000000000005e-003 | L299: 12.48 | M299: -7.9000000000000008e-003 | N299: 186 | O299: 2.1000000000000001 | P299: 115 | Q299: 6.67 | R299: 2.75 | S299: 187.11 | T299: 0.44600000000000001 | U299: 转股中 | V299: 4.17年 | W299: 2.17年 | X299: 6.9999999999999993e-003 | Y299: 1.3000000000000001e-002 | Z299: 0.3 | AA299: 47 | AB299: -0.188 | AC299: -0.193 | AD299: -0.22699999999999998 | AE299: -0.22800000000000001 | AF299: 93.58 | AG299: 96.25 | AH299: 1 | AI299: AA | AJ299: 4.4600000000000001e-002 | AK299: =I299+100*T299 -> 315.07800000000003 | AL299: 353.8 | AM299: 298 | AN299: 257.6 | AO299: 298 | AP299: -4.4000000000000004e-002 | AQ299: 12 | AR299: 凯龙转债!
A300: 254 | B300: 广电转债!! | C300: 110044 | D300: 43305. | E300: 广电网络 | F300: 600831 | G300: 传媒娱乐 | H300: 影视娱乐 | I300: 276.68 | J300: -2.8900000000000002e-002 | K300: 2.5399999999999999e-002 | L300: 7.5 | M300: -5.3e-003 | N300: 371 | O300: 1.8400000000000001 | P300: 112.3 | Q300: 6.9 | R300: 1.45 | S300: 108.7 | T300: 1.55 | U300: 转股中 | V300: 3.69年 | W300: 1.69年 | X300: 1.3000000000000001e-002 | Y300: 1.3999999999999999e-002 | Z300: 0.7 | AA300: 53 | AB300: -0.22 | AC300: -0.22399999999999998 | AD300: -0.309 | AE300: -0.31 | AF300: 94.87 | AG300: 95.9 | AH300: 0.67 | AI300: AA | AJ300: 4.4600000000000001e-002 | AK300: =I300+100*T300 -> 431.68000000000001 | AL300: 444.7 | AM300: 300 | AN300: 348.8 | AO300: 300 | AP300: -2.6000000000000002e-002 | AQ300: 11 | AR300: 广电转债!!
A301: 247 | B301: 横河转债! | C301: 123013 | D301: 43332. | E301: 横河模具 | F301: 300539 | G301: 机械装备 | H301: 专用设备 | I301: 330.2 | J301: -3.8300000000000001e-002 | K301: 8.9999999999999998e-004 | L301: 10.07 | M301: -4.82e-002 | N301: 533 | O301: 4.0899999999999999 | P301: 115.2 | Q301: 9.13 | R301: 4.57 | S301: 110.3 | T301: 1.99 | U301: 转股中 | V301: 3.77年 | W301: 1.77年 | X301: 1.7000000000000001e-002 | Y301: 1.9e-002 | Z301: 0.4 | AA301: 22 | AB301: -0.247 | AC301: -0.252 | AD301: -0.32100000000000001 | AE301: -0.32200000000000001 | AF301: 89.73 | AG301: 87.79 | AH301: 0.78 | AI301: A+ | AJ301: 7.6600000000000001e-002 | AK301: =I301+100*T301 -> 529.20000000000005 | AL301: 550.1 | AM301: 301 | AN301: 460.4 | AO301: 301 | AP301: 0.115 | AQ301: 15 | AR301: 横河转债!
A302: 235 | B302: 特发转债! | C302: 127008 | D302: 43459. | E302: 特发信息 | F302: 70 | G302: 通信互联 | H302: 通信设备 | I302: 269.5 | J302: -1.15e-002 | K302: 5.5000000000000005e-003 | L302: 9.94 | M302: -6.0000000000000001e-003 | N302: 35 | O302: 0.21899999999999997 | P302: 111.1 | Q302: 5.54 | R302: 2.89 | S302: 179.42 | T302: 0.502 | U302: 转股中 | V302: 3年28天 | W302: 1年28天 | X302: 6.9999999999999993e-003 | Y302: 1.3000000000000001e-002 | Z302: 0.6 | AA302: 81 | AB302: -0.253 | AC302: -0.25700000000000001 | AD302: -0.48899999999999999 | AE302: -0.48999999999999999 | AF302: 96.51 | AG302: 97.35 | AH302: 1 | AI302: AA | AJ302: 4.4600000000000001e-002 | AK302: =I302+100*T302 -> 319.69999999999999 | AL302: 359.6 | AM302: 299 | AN302: 262.2 | AO302: 299 | AP302: -2.5000000000000001e-002 | AQ302: 15 | AR302: 特发转债!
A303: 142 | B303: 振德转债! | C303: 113555 | D303: 43844. | E303: 振德医疗 | F303: 603301 | G303: 医药 | H303: 医疗器械 | I303: 552.3 | J303: 4.5199999999999997e-002 | K303: -1.1000000000000001e-003 | L303: 77.5 | M303: 4.4600000000000001e-002 | N303: 1202. | O303: 1.22 | P303: 124.8 | Q303: 14.01 | R303: 6.97 | S303: 553.18 | T303: -2.e-003 | U303: 转股中 | V303: 5.17年 | W303: 3.17年 | X303: 1.1000000000000001e-002 | Y303: 6.0999999999999999e-002 | Z303: 1.8 | AA303: 164 | AB303: -0.254 | AC303: -0.25900000000000001 | AD303: -0.185 | AE303: -0.185 | AF303: 84.69 | AG303: 90.12 | AH303: 0.99 | AI303: AA- | AJ303: 6.6799999999999998e-002 | AK303: =I303+100*T303 -> 552.09999999999991 | AL303: 551.4 | AM303: 302 | AN303: 461.3 | AO303: 302 | AP303: 0.14599999999999999 | AQ303: 16 | AR303: 振德转债!
A304: 176 | B304: 英科转债! | C304: 123029 | D304: 43718. | E304: 英科医疗 | F304: 300677 | G304: 医药 | H304: 医疗器械 | I304: 1115.2 | J304: 2.5899999999999999e-002 | K304: 6.8999999999999999e-003 | L304: 115.18 | M304: 3.3099999999999997e-002 | N304: 705 | O304: 0.46299999999999997 | P304: 138.2 | Q304: 10.41 | R304: 6.96 | S304: 1106.44 | T304: 8.0000000000000002e-003 | U304: 转股中 | V304: 4.82年 | W304: 2.82年 | X304: 4.0000000000000001e-003 | Y304: 3.9e-002 | Z304: 1.4 | AA304: 384 | AB304: -0.35700000000000004 | AC304: -0.36399999999999999 | AD304: -0.24100000000000002 | AE304: -0.24199999999999999 | AF304: 89 | AG304: 102.76 | AH304: 0.99 | AI304: AA- | AJ304: 6.5599999999999992e-002 | AK304: =I304+100*T304 -> 1116. | AL304: 1124. | AM304: 303 | AN304: 1021.2 | AO304: 303 | AP304: -0.14400000000000002 | AQ304: 15 | AR304: 英科转债!