A1: 序号 | B1: 转债代码 | C1: 转债名称 | D1: 进展/上市日期 | E1: 股票代码 | F1: 股票名称 | G1: 行业 | H1: 子行业 | I1: 转债价格 | J1: 涨跌 | K1: 日内套利 | L1: 股价 | M1: 涨跌 | N1: 剩余本息 | O1: 转股价格 | P1: 转股溢价率 | Q1: 转股价值 | R1: 距离转股日 | S1: 剩余年限 | T1: 回售年限 | U1: 转债余额 | V1: 转债成交额 | W1: 转债换手率 | X1: 余额/市值 | Y1: 余额/股本 | Z1: 股票市值 | AA1: P/B | AB1: 税前收益率 | AC1: 税后收益率 | AD1: 税前回售收益 | AE1: 税后回售收益 | AF1: 回售价值 | AG1: 纯债价值 | AH1: 弹性 | AI1: 信用 | AJ1: 折现率 | AK1: 双低 | AL1: 老式双低 | AM1: 老式排名 | AN1: 新式双低 | AO1: 新式排名 | AP1: MA20乖离 | AQ1: 热门度 | AR1: 转债名称
A2: 203 | B2: 128062 | C2: 亚药转债! | D2: 43579. | E2: 2370. | F2: 亚太药业 | G2: 医药 | H2: 化学制药 | I2: 77.95 | J2: -1.38e-002 | K2: 1.38e-002 | L2: 4.66 | M2: -5.28e-002 | N2: 119.8 | O2: 16.25 | P2: 1.72 | Q2: 28.68 | R2: 转股中 | S2: 4.42年 | T2: 2.42年 | U2: 9.64 | V2: 68 | W2: 8.9999999999999997e-002 | X2: 0.38600000000000001 | Y2: 0.111 | Z2: 25 | AA2: 7.77 | AB2: 0.10400000000000001 | AC2: 9.5399999999999985e-002 | AD2: 0.11599999999999999 | AE2: 0.113 | AF2: 81.9 | AG2: 80.9 | AH2: 0 | AI2: A- | AJ2: 9.4899999999999998e-002 | AK2: =I2+100*P2 -> 249.94999999999999 | AL2: 127.2 | AM2: 46 | AN2: 45.3 | AO2: 147 | AP2: -7.2000000000000008e-002 | AQ2: 85 | AR2: 亚药转债!
A3: 223 | B3: 113527 | C3: 维格转债! | D3: 43515. | E3: 603518 | F3: 锦泓集团 | G3: 服装纺织 | H3: 服装行业 | I3: 91.23 | J3: -1.61e-002 | K3: 1.0200000000000001e-002 | L3: 6.49 | M3: -3.9900000000000005e-002 | N3: 120.2 | O3: 9.85 | P3: 0.38500000000000001 | Q3: 65.89 | R3: 转股中 | S3: 4.23年 | T3: 2.23年 | U3: 7.46 | V3: 8.6 | W3: 1.2e-002 | X3: 0.45500000000000002 | Y3: 0.29999999999999999 | Z3: 16 | AA3: 0.66 | AB3: 6.8900000000000003e-002 | AC3: 5.9900000000000002e-002 | AD3: 5.4800000000000001e-002 | AE3: 5.1699999999999996e-002 | AF3: 91.63 | AG3: 97.1 | AH3: 0.15 | AI3: AA | AJ3: 5.2900000000000003e-002 | AK3: =I3+100*P3 -> 129.73000000000002 | AL3: 116.6 | AM3: 3 | AN3: 19.5 | AO3: 3 | AP3: -4.2000000000000003e-002 | AQ3: 100 | AR3: 维格转债!
A4: 54 | B4: 127018 | C4: 本钢转债! | D4: 44047. | E4: 761. | F4: 本钢板材 | G4: 钢铁 | H4: 炼钢 | I4: 90.6 | J4: -1.8100000000000002e-002 | K4: 1.11e-002 | L4: 3.22 | M4: -4.1700000000000001e-002 | N4: 128.6 | O4: 5.03 | P4: 0.41499999999999998 | Q4: 64.02 | R4: 2月5天 | S4: 5.66年 | T4: 3.66年 | U4: 68 | V4: 160 | W4: 2.6000000000000002e-002 | X4: 0.54500000000000004 | Y4: 0.34899999999999998 | Z4: 125 | AA4: 0.63 | AB4: 6.59e-002 | AC4: 5.6799999999999996e-002 | AD4: 4.36e-002 | AE4: 4.0099999999999997e-002 | AF4: 88.35 | AG4: 98.05 | AH4: 0.17 | AI4: AAA | AJ4: 5.0599999999999999e-002 | AK4: =I4+100*P4 -> 132.09999999999999 | AL4: 117.2 | AM4: 4 | AN4: 19.1 | AO4: 2 | AP4: -6.2e-002 | AQ4: 32 | AR4: 本钢转债!
A5: 279 | B5: 128023 | C5: 亚太转债! | D5: 43095. | E5: 2284. | F5: 亚太股份 | G5: 汽车 | H5: 零部件制 | I5: 96.67 | J5: 2.0000000000000001e-004 | K5: -2.9999999999999997e-004 | L5: 5.32 | M5: -1.1200000000000002e-002 | N5: 112.3 | O5: 10.34 | P5: 0.879 | Q5: 51.45 | R5: 转股中 | S5: 3年34天 | T5: 1年34天 | U5: 9.99 | V5: 6.5 | W5: 6.9999999999999993e-003 | X5: 0.255 | Y5: 0.13100000000000001 | Z5: 39 | AA5: 1.62 | AB5: 5.0900000000000001e-002 | AC5: 4.2999999999999997e-002 | AD5: 5.0599999999999999e-002 | AE5: 4.5899999999999996e-002 | AF5: 97.56 | AG5: 98.92 | AH5: 0.01 | AI5: AA | AJ5: 4.2900000000000001e-002 | AK5: =I5+100*P5 -> 184.56999999999999 | AL5: 141.9 | AM5: 185 | AN5: 43 | AO5: 125 | AP5: 3.4000000000000002e-002 | AQ5: 64 | AR5: 亚太转债!
A6: 201 | B6: 128063 | C6: 未来转债 | D6: 43579. | E6: 2631. | F6: 德尔未来 | G6: 其他 | H6: 家居用品 | I6: 107.502 | J6: -2.4500000000000001e-002 | K6: 1.5100000000000001e-002 | L6: 6.76 | M6: -3.2899999999999999e-002 | N6: 128.2 | O6: 8.61 | P6: 0.36899999999999999 | Q6: 78.51 | R6: 转股中 | S6: 4.42年 | T6: 3.42年 | U6: 6.3 | V6: 53 | W6: 7.8e-002 | X6: 0.13900000000000001 | Y6: 0.109 | Z6: 45 | AA6: 2.57 | AB6: 4.1799999999999997e-002 | AC6: 3.0800000000000001e-002 | AD6: 3.5999999999999999e-003 | AE6: -1.1000000000000001e-003 | AF6: 87.63 | AG6: 98.27 | AH6: 0.28 | AI6: AA- | AJ6: 6.3899999999999998e-002 | AK6: =I6+100*P6 -> 144.40199999999999 | AL6: 136.5 | AM6: 138 | AN6: 38.2 | AO6: 81 | AP6: -4.9000000000000002e-002 | AQ6: 34 | AR6: 未来转债
A7: 260 | B7: 128037 | C7: 岩土转债! | D7: 43215. | E7: 2542. | F7: 中化岩土 | G7: 建筑 | H7: 建筑工程 | I7: 98.229 | J7: -1.1999999999999999e-003 | K7: 1.1999999999999999e-003 | L7: 3.34 | M7: -1.18e-002 | N7: 112.3 | O7: 7.99 | P7: 1.3500000000000001 | Q7: 41.8 | R7: 转股中 | S7: 3.37年 | T7: 1.37年 | U7: 5.99 | V7: 2.9 | W7: 5.0000000000000001e-003 | X7: 9.9000000000000005e-002 | Y7: 4.2000000000000003e-002 | Z7: 60 | AA7: 1.48 | AB7: 4.1399999999999999e-002 | AC7: 3.4300000000000004e-002 | AD7: 3.0299999999999997e-002 | AE7: 2.6600000000000002e-002 | AF7: 96.43 | AG7: 97.76 | AH7: 0 | AI7: AA | AJ7: 4.2900000000000001e-002 | AK7: =I7+100*P7 -> 233.22899999999998 | AL7: 154.7 | AM7: 243 | AN7: 56.9 | AO7: 213 | AP7: -3.7000000000000005e-002 | AQ7: 47 | AR7: 岩土转债!
A8: 43 | B8: 127019 | C8: 国城转债! | D8: 44053. | E8: 688. | F8: 国城矿业 | G8: 有色金属 | H8: 锌铅镍锡 | I8: 91.7 | J8: -1.29e-002 | K8: 1.06e-002 | L8: 10.55 | M8: -3.3000000000000002e-002 | N8: 115.1 | O8: 21.07 | P8: 0.83099999999999996 | Q8: 50.07 | R8: 2月22天 | S8: 5.70年 | T8: 3.70年 | U8: 8.5 | V8: 27 | W8: 3.4000000000000002e-002 | X8: 7.0999999999999994e-002 | Y8: 3.5000000000000003e-002 | Z8: 120 | AA8: 5.42 | AB8: 4.1399999999999999e-002 | AC8: 3.6299999999999999e-002 | AD8: 3.2300000000000002e-002 | AE8: 3.04e-002 | AF8: 87.3 | AG8: 89.66 | AH8: 0.07 | AI8: AA | AJ8: 4.5599999999999995e-002 | AK8: =I8+100*P8 -> 174.80000000000001 | AL8: 133.3 | AM8: 103 | AN8: 43.7 | AO8: 129 | AP8: -0.251 | AQ8: 23 | AR8: 国城转债!
A9: 85 | B9: 113573 | C9: 纵横转债! | D9: 43973. | E9: 603602 | F9: 纵横通信 | G9: 通信互联 | H9: 通信设备 | I9: 102.06 | J9: -1.9299999999999998e-002 | K9: 5.3e-003 | L9: 11.33 | M9: -7.1300000000000002e-002 | N9: 124.7 | O9: 18.81 | P9: 0.69400000000000006 | Q9: 60.23 | R9: 转股中 | S9: 5.46年 | T9: 3.46年 | U9: 2.7 | V9: 86 | W9: 0.31 | X9: 0.11699999999999999 | Y9: 7.0000000000000007e-002 | Z9: 23 | AA9: 3.43 | AB9: 3.8300000000000001e-002 | AC9: 3.0299999999999997e-002 | AD9: 6.8999999999999999e-003 | AE9: 4.4000000000000003e-003 | AF9: 80.06 | AG9: 83.73 | AH9: 0.2 | AI9: A+ | AJ9: 7.7600000000000002e-002 | AK9: =I9+100*P9 -> 171.46000000000001 | AL9: 143.9 | AM9: 201 | AN9: 60.2 | AO9: 229 | AP9: -0.111 | AQ9: 15 | AR9: 纵横转债!
A10: 206 | B10: 113530 | C10: 大丰转债! | D10: 43573. | E10: 603081 | F10: 大丰实业 | G10: 建筑 | H10: 装饰工程 | I10: 103.84 | J10: -5.1000000000000004e-003 | K10: 5.1000000000000004e-003 | L10: 11.42 | M10: 0. | N10: 121.6 | O10: 16.64 | P10: 0.51300000000000001 | Q10: 68.63 | R10: 转股中 | S10: 4.40年 | T10: 2.40年 | U10: 6.3 | V10: 3 | W10: 5.0000000000000001e-003 | X10: 0.13699999999999998 | Y10: 9.4e-002 | Z10: 46 | AA10: 2.23 | AB10: 3.73e-002 | AC10: 2.8500000000000001e-002 | AD10: -1.1999999999999999e-003 | AE10: -3.9000000000000003e-003 | AF10: 93.03 | AG10: 101.46 | AH10: 0.12 | AI10: AA | AJ10: 4.2900000000000001e-002 | AK10: =I10+100*P10 -> 155.14000000000001 | AL10: 139.1 | AM10: 159 | AN10: 37.6 | AO10: 73 | AP10: -2.5000000000000001e-002 | AQ10: 34 | AR10: 大丰转债!
A11: 287 | B11: 113016 | C11: 小康转债! | D11: 43060. | E11: 601127 | F11: 小康股份 | G11: 汽车 | H11: 零部件制 | I11: 99.1 | J11: -2.2000000000000001e-003 | K11: 1.9e-003 | L11: 8.76 | M11: -2.4500000000000001e-002 | N11: 110.3 | O11: 15.7 | P11: 0.77599999999999991 | Q11: 55.8 | R11: 转股中 | S11: 3年6.1天 | T11: 1年6.1天 | U11: 8.81 | V11: 4.1 | W11: 5.0000000000000001e-003 | X11: 8.0000000000000002e-002 | Y11: 4.4999999999999998e-002 | Z11: 110 | AA11: 1.78 | AB11: 3.7000000000000005e-002 | AC11: 3.0299999999999997e-002 | AD11: 3.1800000000000002e-002 | AE11: 2.7000000000000003e-002 | AF11: 97.87 | AG11: 97.47 | AH11: 0.01 | AI11: AA | AJ11: 4.2900000000000001e-002 | AK11: =I11+100*P11 -> 176.69999999999999 | AL11: 142.4 | AM11: 190 | AN11: 44.5 | AO11: 136 | AP11: -2.8999999999999998e-002 | AQ11: 45 | AR11: 小康转债!
A12: 291 | B12: 128015 | C12: 久其转债! | D12: 42934. | E12: 2279. | F12: 久其软件 | G12: 计算机及 | H12: 软件开发 | I12: 101.053 | J12: -3.0999999999999999e-003 | K12: 3.0999999999999999e-003 | L12: 5.4 | M12: -4.2599999999999999e-002 | N12: 110.8 | O12: 9.48 | P12: 0.77400000000000002 | Q12: 56.96 | R12: 转股中 | S12: 2.60年 | T12: 0.60年 | U12: 7.8 | V12: 9.4 | W12: 1.2e-002 | X12: 0.20300000000000001 | Y12: 0.11599999999999999 | Z12: 38 | AA12: 5.28 | AB12: 3.6600000000000001e-002 | AC12: 2.8500000000000001e-002 | AD12: 6.4000000000000003e-003 | AE12: 2.3999999999999998e-003 | AF12: 96.1 | AG12: 92.16 | AH12: 0 | AI12: A+ | AJ12: 7.4499999999999997e-002 | AK12: =I12+100*P12 -> 178.453 | AL12: 145.1 | AM12: 208 | AN12: 49 | AO12: 171 | AP12: -0.107 | AQ12: 54 | AR12: 久其转债!
A13: 132 | B13: 128093 | C13: 百川转债! | D13: 43851. | E13: 2455. | F13: 百川股份 | G13: 化工 | H13: 化工 | I13: 109.499 | J13: -4.5999999999999999e-003 | K13: 9.0000000000000011e-003 | L13: 5.04 | M13: 1.e-002 | N13: 130.3 | O13: 5.87 | P13: 0.27500000000000002 | Q13: 85.86 | R13: 转股中 | S13: 5.18年 | T13: 3.18年 | U13: 5.2 | V13: 5 | W13: 9.0000000000000011e-003 | X13: 0.20000000000000001 | Y13: 0.17100000000000001 | Z13: 26 | AA13: 2.05 | AB13: 3.5400000000000001e-002 | AC13: 2.5399999999999999e-002 | AD13: -5.8999999999999999e-003 | AE13: -1.01e-002 | AF13: 86.94 | AG13: 94.46 | AH13: 0.45 | AI13: AA- | AJ13: 6.6600000000000006e-002 | AK13: =I13+100*P13 -> 136.999 | AL13: 133.1 | AM13: 100 | AN13: 38.7 | AO13: 85 | AP13: -4.0000000000000001e-003 | AQ13: 45 | AR13: 百川转债!
A14: 251 | B14: 110045 | C14: 海澜转债! | D14: 43312. | E14: 600398 | F14: 海澜之家 | G14: 服装纺织 | H14: 服装行业 | I14: 98.09 | J14: -3.4000000000000002e-003 | K14: 1.2999999999999999e-003 | L14: 6.73 | M14: -4.5400000000000003e-002 | N14: 111.1 | O14: 11.75 | P14: 0.71299999999999997 | Q14: 57.28 | R14: 转股中 | S14: 3.70年 | T14: 1.70年 | U14: 29.5 | V14: 15 | W14: 5.0000000000000001e-003 | X14: 0.10099999999999999 | Y14: 5.7999999999999996e-002 | Z14: 291 | AA14: 2.29 | AB14: 3.4700000000000002e-002 | AC14: 2.8900000000000002e-002 | AD14: 2.1400000000000002e-002 | AE14: 1.9199999999999998e-002 | AF14: 94.71 | AG14: 95.99 | AH14: 0.04 | AI14: AA+ | AJ14: 4.0899999999999999e-002 | AK14: =I14+100*P14 -> 169.38999999999999 | AL14: 138.9 | AM14: 158 | AN14: 42.9 | AO14: 123 | AP14: -3.7000000000000005e-002 | AQ14: 59 | AR14: 海澜转债!
A15: 18 | B15: 113600 | C15: 新星转债 | D15: 44085. | E15: 603978 | F15: 深圳新星 | G15: 有色金属 | H15: 有色行业 | I15: 105.23 | J15: -1.37e-002 | K15: 4.8999999999999998e-003 | L15: 18.59 | M15: -2.1600000000000001e-002 | N15: 126 | O15: 23.85 | P15: 0.34999999999999998 | Q15: 77.95 | R15: 3月21天 | S15: 5.78年 | T15: 3.78年 | U15: 5.95 | V15: 3.5 | W15: 6.0000000000000001e-003 | X15: 0.20000000000000001 | Y15: 0.156 | Z15: 30 | AA15: 1.95 | AB15: 3.2199999999999999e-002 | AC15: 2.4500000000000001e-002 | AD15: -3.2000000000000002e-003 | AE15: -5.1000000000000004e-003 | AF15: 80.75 | AG15: 87.39 | AH15: 0.41 | AI15: AA- | AJ15: 6.6600000000000006e-002 | AK15: =I15+100*P15 -> 140.23000000000002 | AL15: 132.5 | AM15: 96 | AN15: 45.1 | AO15: 142 | AP15: -8.4000000000000005e-002 | AQ15: 10 | AR15: 新星转债
A16: 115 | B16: 113569 | C16: 科达转债! | D16: 43929. | E16: 603660 | F16: 苏州科达 | G16: 通信互联 | H16: 物联网 | I16: 103 | J16: -6.0999999999999995e-003 | K16: 4.4000000000000003e-003 | L16: 8.74 | M16: -1.0200000000000001e-002 | N16: 120.7 | O16: 14.84 | P16: 0.74900000000000011 | Q16: 58.89 | R16: 转股中 | S16: 5.35年 | T16: 3.35年 | U16: 5.16 | V16: 5.3 | W16: 1.e-002 | X16: 0.11800000000000001 | Y16: 7.0000000000000007e-002 | Z16: 44 | AA16: 2.56 | AB16: 3.0699999999999998e-002 | AC16: 2.3799999999999998e-002 | AD16: 2.8999999999999998e-003 | AE16: 5.9999999999999995e-004 | AF16: 83.14 | AG16: 86.12 | AH16: 0.17 | AI16: AA- | AJ16: 6.6600000000000006e-002 | AK16: =I16+100*P16 -> 177.90000000000001 | AL16: 147.1 | AM16: 217 | AN16: 61 | AO16: 234 | AP16: -4.0999999999999995e-002 | AQ16: 23 | AR16: 科达转债!
A17: 270 | B17: 113017 | C17: 吉视转债! | D17: 43115. | E17: 601929 | F17: 吉视传媒 | G17: 传媒娱乐 | H17: 影视娱乐 | I17: 100.16 | J17: -1.5e-003 | K17: -2.3e-003 | L17: 2.05 | M17: -3.3000000000000002e-002 | N17: 109.8 | O17: 2.95 | P17: 0.441 | Q17: 69.49 | R17: 转股中 | S17: 3年57天 | T17: 1年57天 | U17: 15.6 | V17: 4 | W17: 3.0000000000000001e-003 | X17: 0.24399999999999999 | Y17: 0.17000000000000001 | Z17: 64 | AA17: 0.96 | AB17: 3.0200000000000001e-002 | AC17: 2.41e-002 | AD17: 1.8200000000000001e-002 | AE17: 1.43e-002 | AF17: 97.31 | AG17: 97.01 | AH17: 0.12 | AI17: AA+ | AJ17: 4.0899999999999999e-002 | AK17: =I17+100*P17 -> 144.25999999999999 | AL17: 130.8 | AM17: 72 | AN17: 33.5 | AO17: 39 | AP17: -6.6000000000000003e-002 | AQ17: 52 | AR17: 吉视转债!
A18: 191 | B18: 113535 | C18: 大业转债! | D18: 43619. | E18: 603278 | F18: 大业股份 | G18: 汽车 | H18: 零部件制 | I18: 102.06 | J18: -8.3999999999999995e-003 | K18: 6.6e-003 | L18: 8.02 | M18: -1.72e-002 | N18: 113.1 | O18: 12.4 | P18: 0.57799999999999996 | Q18: 64.68 | R18: 转股中 | S18: 3.52年 | T18: 1.52年 | U18: 5 | V18: 2.6 | W18: 5.0000000000000001e-003 | X18: 0.215 | Y18: 0.13900000000000001 | Z18: 23 | AA18: 1.42 | AB18: 2.9999999999999999e-002 | AC18: 2.3e-002 | AD18: -1.1999999999999999e-003 | AE18: -3.4000000000000002e-003 | AF18: 94.92 | AG18: 97.74 | AH18: 0.1 | AI18: AA | AJ18: 4.2900000000000001e-002 | AK18: =I18+100*P18 -> 159.86000000000001 | AL18: 139.4 | AM18: 162 | AN18: 41.7 | AO18: 112 | AP18: -5.0000000000000003e-002 | AQ18: 49 | AR18: 大业转债!
A19: 89 | B19: 110070 | C19: 凌钢转债! | D19: 43964. | E19: 600231 | F19: 凌钢股份 | G19: 钢铁 | H19: 炼钢 | I19: 100.7 | J19: -5.6000000000000008e-003 | K19: 4.0000000000000001e-003 | L19: 2.13 | M19: -4.6999999999999993e-003 | N19: 117.8 | O19: 2.75 | P19: 0.29999999999999999 | Q19: 77.45 | R19: 转股中 | S19: 5.45年 | T19: 3.45年 | U19: 4.4 | V19: 1.5 | W19: 3.0000000000000001e-003 | X19: 7.4999999999999997e-002 | Y19: 5.7999999999999996e-002 | Z19: 59 | AA19: 0.76 | AB19: 2.98e-002 | AC19: 2.3799999999999998e-002 | AD19: 9.3999999999999986e-003 | AE19: 7.1999999999999998e-003 | AF19: 88.79 | AG19: 92.87 | AH19: 0.34 | AI19: AA | AJ19: 4.5599999999999995e-002 | AK19: =I19+100*P19 -> 130.69999999999999 | AL19: 123.9 | AM19: 18 | AN19: 31.1 | AO19: 21 | AP19: -3.5000000000000003e-002 | AQ19: 14 | AR19: 凌钢转债!
A20: 52 | B20: 113591 | C20: 胜达转债! | D20: 44035. | E20: 603687 | F20: 大胜达 | G20: 造纸包装 | H20: 包装用纸 | I20: 103.96 | J20: 5.9999999999999995e-004 | K20: -2.1899999999999999e-002 | L20: 10.5 | M20: -6.1699999999999998e-002 | N20: 122.2 | O20: 14.73 | P20: 0.45799999999999996 | Q20: 71.28 | R20: 2月9天 | S20: 5.67年 | T20: 3.67年 | U20: 5.5 | V20: 10 | W20: 1.8000000000000002e-002 | X20: 0.127 | Y20: 9.0999999999999998e-002 | Z20: 43 | AA20: 2.8 | AB20: 2.9500000000000002e-002 | AC20: 2.2599999999999999e-002 | AD20: 4.0000000000000002e-004 | AE20: -1.7000000000000001e-003 | AF20: 81.55 | AG20: 85.47 | AH20: 0.35 | AI20: AA- | AJ20: 6.6600000000000006e-002 | AK20: =I20+100*P20 -> 149.75999999999999 | AL20: 136.6 | AM20: 141 | AN20: 51.2 | AO20: 182 | AP20: -0.11199999999999999 | AQ20: 19 | AR20: 胜达转债!
A21: 147 | B21: 128085 | C21: 鸿达转债 | D21: 43838. | E21: 2002. | F21: 鸿达兴业 | G21: 化工 | H21: 化工 | I21: 107.99 | J21: -9.4999999999999998e-003 | K21: -7.9000000000000008e-003 | L21: 3.6 | M21: -4.0000000000000001e-002 | N21: 124.8 | O21: 3.92 | P21: 0.17600000000000002 | Q21: 91.84 | R21: 转股中 | S21: 5年46天 | T21: 3年46天 | U21: 24.3 | V21: 15 | W21: 6.0000000000000001e-003 | X21: 0.26000000000000001 | Y21: 0.23899999999999999 | Z21: 93 | AA21: 1.31 | AB21: 2.9300000000000003e-002 | AC21: 2.0899999999999998e-002 | AD21: -1.06e-002 | AE21: -1.3100000000000001e-002 | AF21: 90.22 | AG21: 99.81 | AH21: 0.44 | AI21: AA | AJ21: 4.5599999999999995e-002 | AK21: =I21+100*P21 -> 125.59 | AL21: 124.1 | AM21: 20 | AN21: 24.3 | AO21: 8 | AP21: -6.3e-002 | AQ21: 85 | AR21: 鸿达转债
A22: 164 | B22: 110059 | C22: 浦发转债! | D22: 43784. | E22: 600000 | F22: 浦发银行 | G22: 金融 | H22: 银行行业 | I22: 102.26 | J22: -2.5999999999999999e-003 | K22: 1.e-003 | L22: 9.26 | M22: -1.1699999999999999e-002 | N22: 117.6 | O22: 14.45 | P22: 0.59599999999999997 | Q22: 64.08 | R22: 转股中 | S22: 4.99年 | T22: 无权 | U22: 500 | V22: 226 | W22: 4.0000000000000001e-003 | X22: 0.184 | Y22: 0.11800000000000001 | Z22: 2718. | AA22: 0.54 | AB22: 2.92e-002 | AC22: 2.2599999999999999e-002 | AD22: 无权 | AE22: 无权 | AF22: 无权 | AG22: 98.15 | AH22: 0.14 | AI22: AAA | AJ22: 3.7900000000000003e-002 | AK22: =I22+100*P22 -> 161.86000000000001 | AL22: 140.4 | AM22: 173 | AN22: 42.3 | AO22: 117 | AP22: -2.8999999999999998e-002 | AQ22: 75 | AR22: 浦发转债!
A23: 293 | B23: 128014 | C23: 永东转债! | D23: 42934. | E23: 2753. | F23: 永东股份 | G23: 化工 | H23: 化工 | I23: 103.842 | J23: -1.2500000000000001e-002 | K23: 1.2500000000000001e-002 | L23: 7.88 | M23: -3.0800000000000001e-002 | N23: 111.3 | O23: 12.6 | P23: 0.66000000000000003 | Q23: 62.54 | R23: 转股中 | S23: 2.46年 | T23: 0.46年 | U23: 3.37 | V23: 8.3 | W23: 2.4e-002 | X23: 0.114 | Y23: 7.0999999999999994e-002 | Z23: 30 | AA23: 1.68 | AB23: 2.9100000000000001e-002 | AC23: 2.0299999999999999e-002 | AD23: -3.1300000000000001e-002 | AE23: -3.6699999999999997e-002 | AF23: 97.96 | AG23: 95.92 | AH23: 0 | AI23: AA- | AJ23: 6.3500000000000001e-002 | AK23: =I23+100*P23 -> 169.84199999999998 | AL23: 145.1 | AM23: 209 | AN23: 47.2 | AO23: 158 | AP23: -8.900000000000001e-002 | AQ23: 39 | AR23: 永东转债!
A24: 142 | B24: 110064 | C24: 建工转债! | D24: 43846. | E24: 600939 | F24: 重庆建工 | G24: 建筑 | H24: 建筑工程 | I24: 104.11 | J24: -6.1999999999999998e-003 | K24: -2.8999999999999998e-003 | L24: 3.76 | M24: -2.5899999999999999e-002 | N24: 120.2 | O24: 4.57 | P24: 0.26500000000000001 | Q24: 82.28 | R24: 转股中 | S24: 5年50天 | T24: 3年50天 | U24: 16.6 | V24: 3.3 | W24: 2.e-003 | X24: 0.24299999999999999 | Y24: 0.20000000000000001 | Z24: 68 | AA24: 0.99 | AB24: 2.9100000000000001e-002 | AC24: 2.2000000000000002e-002 | AD24: 1.1999999999999999e-003 | AE24: -1.4000000000000002e-003 | AF24: 90.94 | AG24: 97.06 | AH24: 0.35 | AI24: AA+ | AJ24: 4.36e-002 | AK24: =I24+100*P24 -> 130.61000000000001 | AL24: 125.9 | AM24: 30 | AN24: 28.9 | AO24: 17 | AP24: -4.2000000000000003e-002 | AQ24: 47 | AR24: 建工转债!
A25: 5 | B25: 128132 | C25: 交建转债! | D25: 44120. | E25: 2941. | F25: 新疆交建 | G25: 建筑 | H25: 建筑工程 | I25: 99.647 | J25: -3.0999999999999999e-003 | K25: -6.4000000000000003e-003 | L25: 12.75 | M25: -3.9900000000000005e-002 | N25: 117.3 | O25: 18.57 | P25: 0.45100000000000001 | Q25: 68.66 | R25: 4月22天 | S25: 5.87年 | T25: 3.87年 | U25: 8.5 | V25: 22 | W25: 2.6000000000000002e-002 | X25: 0.10300000000000001 | Y25: 7.0999999999999994e-002 | Z25: 82 | AA25: 3.39 | AB25: 2.87e-002 | AC25: 2.3300000000000001e-002 | AD25: 1.0200000000000001e-002 | AE25: 8.3999999999999995e-003 | AF25: 86.83 | AG25: 90.71 | AH25: 0.24 | AI25: AA | AJ25: 4.5599999999999995e-002 | AK25: =I25+100*P25 -> 144.74700000000001 | AL25: 130.6 | AM25: 71 | AN25: 39.9 | AO25: 95 | AP25: -0.13200000000000001 | AQ25: 6 | AR25: 交建转债!
A26: 56 | B26: 113589 | C26: 天创转债! | D26: 44028. | E26: 603608 | F26: 天创时尚 | G26: 服装纺织 | H26: 鞋服行业 | I26: 98.9 | J26: -3.2000000000000002e-003 | K26: -1.e-003 | L26: 8.01 | M26: -2.0799999999999999e-002 | N26: 115.3 | O26: 12.44 | P26: 0.53600000000000003 | Q26: 64.39 | R26: 2月3天 | S26: 5.65年 | T26: 3.65年 | U26: 6 | V26: 6.2 | W26: 1.e-002 | X26: 0.17399999999999999 | Y26: 0.11199999999999999 | Z26: 34 | AA26: 1.57 | AB26: 2.81e-002 | AC26: 2.3e-002 | AD26: 1.29e-002 | AE26: 1.09e-002 | AF26: 87.71 | AG26: 90.08 | AH26: 0.21 | AI26: AA | AJ26: 4.5599999999999995e-002 | AK26: =I26+100*P26 -> 152.5 | AL26: 133.4 | AM26: 105 | AN26: 43.3 | AO26: 126 | AP26: -3.7999999999999999e-002 | AQ26: 8 | AR26: 天创转债!
A27: 242 | B27: 128044 | C27: 岭南转债! | D27: 43347. | E27: 2717. | F27: 岭南股份 | G27: 城市公用 | H27: 生态环境 | I27: 100.8 | J27: -6.3e-003 | K27: 6.0000000000000001e-003 | L27: 3.94 | M27: -2.5000000000000001e-003 | N27: 111.3 | O27: 5.91 | P27: 0.51200000000000001 | Q27: 66.67 | R27: 转股中 | S27: 3.79年 | T27: 1.79年 | U27: 6.59 | V27: 4.2 | W27: 6.0000000000000001e-003 | X27: 0.109 | Y27: 7.2999999999999995e-002 | Z27: 60 | AA27: 1.27 | AB27: 2.7000000000000003e-002 | AC27: 2.1299999999999999e-002 | AD27: 1.0200000000000001e-002 | AE27: 7.3000000000000001e-003 | AF27: 94.76 | AG27: 95.21 | AH27: 0.13 | AI27: AA | AJ27: 4.2900000000000001e-002 | AK27: =I27+100*P27 -> 152. | AL27: 134.9 | AM27: 120 | AN27: 39.7 | AO27: 94 | AP27: -2.8999999999999998e-002 | AQ27: 30 | AR27: 岭南转债!
A28: 218 | B28: 113021 | C28: 中信转债! | D28: 43543. | E28: 601998 | F28: 中信银行 | G28: 金融 | H28: 银行行业 | I28: 106.2 | J28: -3.4999999999999996e-003 | K28: 2.e-003 | L28: 5.05 | M28: -7.9000000000000008e-003 | N28: 118.8 | O28: 6.98 | P28: 0.46799999999999997 | Q28: 72.35 | R28: 转股中 | S28: 4.34年 | T28: 无权 | U28: 400 | V28: 59 | W28: 1.e-003 | X28: 0.16200000000000001 | Y28: 0.11699999999999999 | Z28: 2471. | AA28: 0.55 | AB28: 2.7000000000000003e-002 | AC28: 1.9099999999999999e-002 | AD28: 无权 | AE28: 无权 | AF28: 无权 | AG28: 101.59 | AH28: 0.19 | AI28: AAA | AJ28: 3.7900000000000003e-002 | AK28: =I28+100*P28 -> 153. | AL28: 140.1 | AM28: 168 | AN28: 38.5 | AO28: 84 | AP28: -2.e-002 | AQ28: 52 | AR28: 中信转债!
A29: 116 | B29: 113568 | C29: 新春转债 | D29: 43923. | E29: 603667 | F29: 五洲新春 | G29: 机械装备 | H29: 通用设备 | I29: 108.61 | J29: -3.3500000000000002e-002 | K29: -8.9999999999999998e-004 | L29: 8.46 | M29: -5.79e-002 | N29: 124.8 | O29: 8.91 | P29: 0.14400000000000002 | Q29: 94.95 | R29: 转股中 | S29: 5.35年 | T29: 3.35年 | U29: 3.3 | V29: 10 | W29: 2.8999999999999998e-002 | X29: 0.13300000000000001 | Y29: 0.127 | Z29: 25 | AA29: 1.43 | AB29: 2.7000000000000003e-002 | AC29: 1.89e-002 | AD29: -1.0500000000000001e-002 | AE29: -1.3000000000000001e-002 | AF29: 83.76 | AG29: 89.18 | AH29: 0.59 | AI29: AA- | AJ29: 6.6600000000000006e-002 | AK29: =I29+100*P29 -> 123.01000000000001 | AL29: 122.3 | AM29: 11 | AN29: 33.1 | AO29: 35 | AP29: -3.7000000000000005e-002 | AQ29: 43 | AR29: 新春转债
A30: 297 | B30: 127003 | C30: 海印转债! | D30: 42552. | E30: 861. | F30: 海印股份 | G30: 商业零售 | H30: 商场 | I30: 107.31 | J30: -5.6999999999999993e-003 | K30: 2.8999999999999998e-003 | L30: 2.32 | M30: -4.1299999999999996e-002 | N30: 111.8 | O30: 3 | P30: 0.38799999999999996 | Q30: 77.33 | R30: 转股中 | S30: 1.60年 | T30: 回售中 | U30: 6.74 | V30: 5.6 | W30: 8.0000000000000002e-003 | X30: 0.125 | Y30: 9.6999999999999989e-002 | Z30: 54 | AA30: 1.45 | AB30: 2.6200000000000001e-002 | AC30: 1.24e-002 | AD30: 回售中 | AE30: 回售中 | AF30: 100.3 | AG30: 104.66 | AH30: 0.07 | AI30: AA | AJ30: 4.2500000000000003e-002 | AK30: =I30+100*P30 -> 146.11000000000001 | AL30: 137.3 | AM30: 147 | AN30: 32.6 | AO30: 30 | AP30: -0.14999999999999999 | AQ30: 74 | AR30: 海印转债!
A31: 25 | B31: 113597 | C31: 佳力转债! | D31: 44064. | E31: 603912 | F31: 佳力图 | G31: 机械装备 | H31: 专用设备 | I31: 107.72 | J31: -1.66e-002 | K31: 6.5000000000000006e-003 | L31: 17.98 | M31: -2.4900000000000002e-002 | N31: 124.5 | O31: 23.4 | P31: 0.40200000000000002 | Q31: 76.84 | R31: 3月7天 | S31: 5.75年 | T31: 3.75年 | U31: 3 | V31: 11 | W31: 3.3000000000000002e-002 | X31: 7.6999999999999999e-002 | Y31: 5.9000000000000004e-002 | Z31: 39 | AA31: 4.49 | AB31: 2.6099999999999998e-002 | AC31: 1.8700000000000001e-002 | AD31: -8.0000000000000002e-003 | AE31: -1.0200000000000001e-002 | AF31: 81.37 | AG31: 86.65 | AH31: 0.41 | AI31: AA- | AJ31: 6.6600000000000006e-002 | AK31: =I31+100*P31 -> 147.92000000000002 | AL31: 138.6 | AM31: 155 | AN31: 52 | AO31: 189 | AP31: 2.5000000000000001e-002 | AQ31: 6 | AR31: 佳力转债!
A32: 284 | B32: 113502 | C32: 嘉澳转债! | D32: 43066. | E32: 603822 | F32: 嘉澳环保 | G32: 化工 | H32: 化工 | I32: 104.09 | J32: -2.1499999999999998e-002 | K32: 2.1400000000000002e-002 | L32: 23.17 | M32: -3.78e-002 | N32: 112.3 | O32: 44.79 | P32: 1.01 | Q32: 51.73 | R32: 转股中 | S32: 3年10天 | T32: 1年10天 | U32: 1.85 | V32: 50 | W32: 0.25900000000000001 | X32: 0.109 | Y32: 5.5999999999999994e-002 | Z32: 17 | AA32: 2.26 | AB32: 2.6000000000000002e-002 | AC32: 1.83e-002 | AD32: -1.0500000000000001e-002 | AE32: -1.4999999999999999e-002 | AF32: 95.55 | AG32: 93.53 | AH32: 0 | AI32: AA- | AJ32: 6.3899999999999998e-002 | AK32: =I32+100*P32 -> 205.09 | AL32: 156.4 | AM32: 246 | AN32: 60.9 | AO32: 233 | AP32: -6.2e-002 | AQ32: 28 | AR32: 嘉澳转债!
A33: 166 | B33: 113546 | C33: 迪贝转债! | D33: 43790. | E33: 603320 | F33: 迪贝电气 | G33: 家电 | H33: 零部件制 | I33: 106.6 | J33: -3.7699999999999997e-002 | K33: 1.67e-002 | L33: 12.35 | M33: -3.8199999999999998e-002 | N33: 120.6 | O33: 14.1 | P33: 0.217 | Q33: 87.59 | R33: 转股中 | S33: 4.98年 | T33: 2.98年 | U33: 2.3 | V33: 26 | W33: 0.10300000000000001 | X33: 0.14300000000000002 | Y33: 0.125 | Z33: 16 | AA33: 2.41 | AB33: 2.5600000000000001e-002 | AC33: 1.83e-002 | AD33: -8.1000000000000013e-003 | AE33: -1.0500000000000001e-002 | AF33: 83.02 | AG33: 84.83 | AH33: 0.55 | AI33: A+ | AJ33: 7.4900000000000008e-002 | AK33: =I33+100*P33 -> 128.29999999999998 | AL33: 125.6 | AM33: 28 | AN33: 40.8 | AO33: 102 | AP33: -3.7000000000000005e-002 | AQ33: 42 | AR33: 迪贝转债!
A34: 298 | B34: 128010 | C34: 顺昌转债!! | D34: 42423. | E34: 2245. | F34: 澳洋顺昌 | G34: 交通运输 | H34: 物流业 | I34: 106.35 | J34: -5.4000000000000003e-003 | K34: 5.0000000000000001e-003 | L34: 6.57 | M34: -2.0899999999999998e-002 | N34: 109.6 | O34: 9.25 | P34: 0.49700000000000005 | Q34: 71.03 | R34: 转股中 | S34: 1.23年 | T34: 回售中 | U34: 5.09 | V34: 8.1 | W34: 1.4999999999999999e-002 | X34: 7.9000000000000001e-002 | Y34: 5.5999999999999994e-002 | Z34: 64 | AA34: 2.83 | AB34: 2.5099999999999997e-002 | AC34: 1.03e-002 | AD34: 回售中 | AE34: 回售中 | AF34: 100.27 | AG34: 104.2 | AH34: 0.02 | AI34: AA | AJ34: 4.2500000000000003e-002 | AK34: =I34+100*P34 -> 156.05000000000001 | AL34: 141.7 | AM34: 182 | AN34: 37.5 | AO34: 69 | AP34: 3.2000000000000001e-002 | AQ34: 41 | AR34: 顺昌转债!!
A35: 269 | B35: 128033 | C35: 迪龙转债! | D35: 43129. | E35: 2658. | F35: 雪迪龙 | G35: 城市公用 | H35: 三废处理 | I35: 101.7 | J35: -4.8999999999999998e-003 | K35: 3.2000000000000002e-003 | L35: 5.9 | M35: -1.67e-002 | N35: 109.8 | O35: 8.83 | P35: 0.52200000000000002 | Q35: 66.82 | R35: 转股中 | S35: 3年57天 | T35: 1年57天 | U35: 5.2 | V35: 5.4 | W35: 1.e-002 | X35: 0.14599999999999999 | Y35: 9.6999999999999989e-002 | Z35: 36 | AA35: 1.81 | AB35: 2.5099999999999997e-002 | AC35: 1.9099999999999999e-002 | AD35: 6.4000000000000003e-003 | AE35: 2.5000000000000001e-003 | AF35: 97.06 | AG35: 96.44 | AH35: 0.1 | AI35: AA | AJ35: 4.2900000000000001e-002 | AK35: =I35+100*P35 -> 153.90000000000001 | AL35: 136.6 | AM35: 140 | AN35: 39.5 | AO35: 90 | AP35: -7.0999999999999994e-002 | AQ35: 37 | AR35: 迪龙转债!
A36: 263 | B36: 113505 | C36: 杭电转债! | D36: 43186. | E36: 603618 | F36: 杭电股份 | G36: 能源电力 | H36: 电力设备 | I36: 103.56 | J36: -5.1000000000000004e-003 | K36: -1.6000000000000001e-003 | L36: 5.52 | M36: -2.9900000000000003e-002 | N36: 112.3 | O36: 7.14 | P36: 0.34000000000000002 | Q36: 77.31 | R36: 转股中 | S36: 3.35年 | T36: 1.35年 | U36: 7.5 | V36: 12 | W36: 1.4999999999999999e-002 | X36: 0.19699999999999998 | Y36: 0.152 | Z36: 38 | AA36: 1.5 | AB36: 2.5000000000000001e-002 | AC36: 1.8100000000000002e-002 | AD36: -4.8999999999999998e-003 | AE36: -8.5000000000000006e-003 | AF36: 96.53 | AG36: 97.86 | AH36: 0.22 | AI36: AA | AJ36: 4.2900000000000001e-002 | AK36: =I36+100*P36 -> 137.56 | AL36: 129.8 | AM36: 64 | AN36: 31.9 | AO36: 27 | AP36: -1.4999999999999999e-002 | AQ36: 39 | AR36: 杭电转债!
A37: 108 | B37: 128100 | C37: 搜特转债! | D37: 43930. | E37: 2503. | F37: 搜于特 | G37: 服装纺织 | H37: 服装行业 | I37: 103.051 | J37: -1.46e-002 | K37: 4.0000000000000002e-004 | L37: 2.26 | M37: -4.24e-002 | N37: 117.3 | O37: 2.9 | P37: 0.32200000000000001 | Q37: 77.93 | R37: 转股中 | S37: 5.36年 | T37: 3.36年 | U37: 8 | V37: 4.3 | W37: 5.0000000000000001e-003 | X37: 0.114 | Y37: 8.900000000000001e-002 | Z37: 70 | AA37: 1.27 | AB37: 2.4900000000000002e-002 | AC37: 1.9e-002 | AD37: 2.0999999999999999e-003 | AE37: 0. | AF37: 88.84 | AG37: 92.8 | AH37: 0.34 | AI37: AA | AJ37: 4.5599999999999995e-002 | AK37: =I37+100*P37 -> 135.251 | AL37: 128.2 | AM37: 54 | AN37: 35.4 | AO37: 50 | AP37: -0.121 | AQ37: 42 | AR37: 搜特转债!
A38: 258 | B38: 113508 | C38: 新凤转债! | D38: 43236. | E38: 603225 | F38: 新凤鸣 | G38: 服装纺织 | H38: 纺织行业 | I38: 103.51 | J38: -3.8e-003 | K38: 3.0000000000000001e-003 | L38: 10.17 | M38: -9.7000000000000003e-003 | N38: 112.3 | O38: 15.78 | P38: 0.60599999999999998 | Q38: 64.45 | R38: 转股中 | S38: 3.49年 | T38: 1.49年 | U38: 21.5 | V38: 1.8 | W38: 1.e-003 | X38: 0.151 | Y38: 9.8000000000000004e-002 | Z38: 142 | AA38: 1.26 | AB38: 2.41e-002 | AC38: 1.7500000000000002e-002 | AD38: -4.1999999999999997e-003 | AE38: -7.4999999999999997e-003 | AF38: 95.97 | AG38: 97.29 | AH38: 0.09 | AI38: AA | AJ38: 4.2900000000000001e-002 | AK38: =I38+100*P38 -> 164.11000000000001 | AL38: 142.6 | AM38: 191 | AN38: 45.3 | AO38: 145 | AP38: -3.9e-002 | AQ38: 26 | AR38: 新凤转债!
A39: 146 | B39: 128087 | C39: 孚日转债! | D39: 43846. | E39: 2083. | F39: 孚日股份 | G39: 服装纺织 | H39: 家纺 | I39: 101.21 | J39: -1.1599999999999999e-002 | K39: 4.1999999999999997e-003 | L39: 4.8 | M39: -2.2400000000000003e-002 | N39: 113.3 | O39: 6.3 | P39: 0.32799999999999996 | Q39: 76.19 | R39: 转股中 | S39: 5年47天 | T39: 3年47天 | U39: 6.5 | V39: 5.6 | W39: 8.0000000000000002e-003 | X39: 0.14899999999999999 | Y39: 0.114 | Z39: 44 | AA39: 1.16 | AB39: 2.2700000000000001e-002 | AC39: 1.78e-002 | AD39: 7.8000000000000005e-003 | AE39: 5.5000000000000005e-003 | AF39: 89.77 | AG39: 90.59 | AH39: 0.33 | AI39: AA | AJ39: 4.5599999999999995e-002 | AK39: =I39+100*P39 -> 134.00999999999999 | AL39: 126.2 | AM39: 33 | AN39: 35.6 | AO39: 53 | AP39: -5.2000000000000005e-002 | AQ39: 51 | AR39: 孚日转债!
A40: 219 | B40: 113528 | C40: 长城转债! | D40: 43544. | E40: 603897 | F40: 长城科技 | G40: 机械装备 | H40: 专用设备 | I40: 106.98 | J40: 1.1000000000000001e-003 | K40: -1.8e-003 | L40: 19.96 | M40: -1.5e-003 | N40: 117.6 | O40: 23.45 | P40: 0.25700000000000001 | Q40: 85.12 | R40: 转股中 | S40: 4.33年 | T40: 2.33年 | U40: 6.34 | V40: 22 | W40: 3.2000000000000001e-002 | X40: 0.17800000000000002 | Y40: 0.152 | Z40: 36 | AA40: 1.94 | AB40: 2.2599999999999999e-002 | AC40: 1.52e-002 | AD40: -1.1599999999999999e-002 | AE40: -1.47e-002 | AF40: 89.22 | AG40: 90.53 | AH40: 0.46 | AI40: AA- | AJ40: 6.3899999999999998e-002 | AK40: =I40+100*P40 -> 132.68000000000001 | AL40: 128.8 | AM40: 57 | AN40: 38.3 | AO40: 82 | AP40: 2.8999999999999998e-002 | AQ40: 44 | AR40: 长城转债!
A41: 13 | B41: 113601 | C41: 塞力转债 | D41: 44089. | E41: 603716 | F41: 塞力斯 | G41: 医药 | H41: 医药商业 | I41: 107.06 | J41: -6.9999999999999993e-003 | K41: -1.8e-003 | L41: 15.27 | M41: -1.4800000000000001e-002 | N41: 121.3 | O41: 16.98 | P41: 0.19 | Q41: 89.93 | R41: 3月29天 | S41: 5.81年 | T41: 3.81年 | U41: 5.43 | V41: 10 | W41: 1.8000000000000002e-002 | X41: 0.17300000000000001 | Y41: 0.156 | Z41: 31 | AA41: 2.1 | AB41: 2.2200000000000001e-002 | AC41: 1.5700000000000002e-002 | AD41: -6.8000000000000005e-003 | AE41: -8.8999999999999999e-003 | AF41: 80.91 | AG41: 84.11 | AH41: 0.59 | AI41: AA- | AJ41: 6.6600000000000006e-002 | AK41: =I41+100*P41 -> 126.06 | AL41: 124.2 | AM41: 21 | AN41: 40.1 | AO41: 97 | AP41: -2.1000000000000001e-002 | AQ41: 14 | AR41: 塞力转债
A42: 217 | B42: 110052 | C42: 贵广转债! | D42: 43553. | E42: 600996 | F42: 贵广网络 | G42: 传媒娱乐 | H42: 影视娱乐 | I42: 108.1 | J42: -5.0000000000000001e-003 | K42: -6.9999999999999993e-003 | L42: 6.57 | M42: -3.95e-002 | N42: 118.5 | O42: 7.94 | P42: 0.30599999999999999 | Q42: 82.75 | R42: 转股中 | S42: 4.34年 | T42: 2.34年 | U42: 15.3 | V42: 2.6 | W42: 2.e-003 | X42: 0.221 | Y42: 0.183 | Z42: 69 | AA42: 1.49 | AB42: 2.1899999999999999e-002 | AC42: 1.4199999999999999e-002 | AD42: -1.61e-002 | AE42: -1.9e-002 | AF42: 94.02 | AG42: 99.97 | AH42: 0.3 | AI42: AA+ | AJ42: 4.0899999999999999e-002 | AK42: =I42+100*P42 -> 138.69999999999999 | AL42: 133.5 | AM42: 106 | AN42: 33.5 | AO42: 38 | AP42: -7.6999999999999999e-002 | AQ42: 19 | AR42: 贵广转债!
A43: 15 | B43: 128127 | C43: 文科转债 | D43: 44085. | E43: 2775. | F43: 文科园林 | G43: 城市公用 | H43: 生态环境 | I43: 107.5 | J43: -2.86e-002 | K43: -3.8e-003 | L43: 5.35 | M43: -4.8000000000000001e-002 | N43: 121.3 | O43: 5.37 | P43: 7.9000000000000001e-002 | Q43: 99.63 | R43: 4月1天 | S43: 5.80年 | T43: 3.80年 | U43: 9.5 | V43: 25 | W43: 2.5000000000000001e-002 | X43: 0.34600000000000003 | Y43: 0.34499999999999997 | Z43: 27 | AA43: 1.1 | AB43: 2.1499999999999998e-002 | AC43: 1.4999999999999999e-002 | AD43: -7.9000000000000008e-003 | AE43: -9.8999999999999991e-003 | AF43: 80.92 | AG43: 84.12 | AH43: 0.67 | AI43: AA- | AJ43: 6.6600000000000006e-002 | AK43: =I43+100*P43 -> 115.40000000000001 | AL43: 115.4 | AM43: 2 | AN43: 31.3 | AO43: 22 | AP43: -2.2000000000000002e-002 | AQ43: 17 | AR43: 文科转债
A44: 195 | B44: 127013 | C44: 创维转债! | D44: 43601. | E44: 810. | F44: 创维数字 | G44: 电子 | H44: 电子产品 | I44: 107.46 | J44: -1.1399999999999999e-002 | K44: 3.0000000000000001e-003 | L44: 8.7 | M44: -3.5499999999999997e-002 | N44: 117.9 | O44: 11.39 | P44: 0.40700000000000003 | Q44: 76.38 | R44: 转股中 | S44: 4.46年 | T44: 2.46年 | U44: 9.78 | V44: 3 | W44: 3.0000000000000001e-003 | X44: 0.106 | Y44: 8.1000000000000003e-002 | Z44: 93 | AA44: 2.38 | AB44: 2.1400000000000002e-002 | AC44: 1.4199999999999999e-002 | AD44: -1.47e-002 | AE44: -1.72e-002 | AF44: 92.72 | AG44: 98.14 | AH44: 0.24 | AI44: AA | AJ44: 4.2900000000000001e-002 | AK44: =I44+100*P44 -> 148.16 | AL44: 138.5 | AM44: 154 | AN44: 40.4 | AO44: 99 | AP44: -0.11599999999999999 | AQ44: 24 | AR44: 创维转债!
A45: 177 | B45: 128072 | C45: 翔鹭转债! | D45: 43724. | E45: 2842. | F45: 翔鹭钨业 | G45: 有色金属 | H45: 小金属 | I45: 104.2 | J45: -1.23e-002 | K45: 5.3e-003 | L45: 9.62 | M45: -3.4099999999999998e-002 | N45: 115.1 | O45: 15.34 | P45: 0.66200000000000003 | Q45: 62.71 | R45: 转股中 | S45: 4.80年 | T45: 2.80年 | U45: 3.02 | V45: 22 | W45: 7.0000000000000007e-002 | X45: 0.115 | Y45: 7.2000000000000008e-002 | Z45: 26 | AA45: 2.9 | AB45: 2.1299999999999999e-002 | AC45: 1.55e-002 | AD45: -2.5000000000000001e-003 | AE45: -4.7999999999999996e-003 | AF45: 86.2 | AG45: 85.99 | AH45: 0.21 | AI45: AA- | AJ45: 6.3899999999999998e-002 | AK45: =I45+100*P45 -> 170.40000000000001 | AL45: 145.7 | AM45: 211 | AN45: 59.5 | AO45: 226 | AP45: -1.9e-002 | AQ45: 27 | AR45: 翔鹭转债!
A46: 36 | B46: 113595 | C46: 花王转债 | D46: 44061. | E46: 603007 | F46: 花王股份 | G46: 城市公用 | H46: 生态环境 | I46: 111.33 | J46: -9.3999999999999986e-003 | K46: 5.6999999999999993e-003 | L46: 7.09 | M46: -5.6000000000000008e-003 | N46: 125.3 | O46: 6.94 | P46: 8.9999999999999997e-002 | Q46: 102.16 | R46: 2月28天 | S46: 5.72年 | T46: 3.72年 | U46: 3.3 | V46: 8.3 | W46: 2.3e-002 | X46: 0.13900000000000001 | Y46: 0.14199999999999999 | Z46: 24 | AA46: 2.14 | AB46: 2.1299999999999999e-002 | AC46: 1.38e-002 | AD46: -1.7000000000000001e-002 | AE46: -1.9099999999999999e-002 | AF46: 81.35 | AG46: 87.33 | AH46: 0.67 | AI46: AA- | AJ46: 6.6600000000000006e-002 | AK46: =I46+100*P46 -> 120.33 | AL46: 120.5 | AM46: 9 | AN46: 33.2 | AO46: 36 | AP46: -2.1000000000000001e-002 | AQ46: 25 | AR46: 花王转债
A47: 272 | B47: 128032 | C47: 双环转债! | D47: 43125. | E47: 2472. | F47: 双环传动 | G47: 机械装备 | H47: 通用设备 | I47: 103.591 | J47: -1.34e-002 | K47: 1.2500000000000001e-002 | L47: 6.12 | M47: -1.9199999999999998e-002 | N47: 110.3 | O47: 9.89 | P47: 0.67400000000000004 | Q47: 61.88 | R47: 转股中 | S47: 3年55天 | T47: 1年55天 | U47: 10 | V47: 2.4 | W47: 2.e-003 | X47: 0.23800000000000002 | Y47: 0.14699999999999999 | Z47: 42 | AA47: 1.26 | AB47: 2.06e-002 | AC47: 1.43e-002 | AD47: -5.8999999999999999e-003 | AE47: -1.e-002 | AF47: 97.32 | AG47: 96.93 | AH47: 0.05 | AI47: AA | AJ47: 4.2900000000000001e-002 | AK47: =I47+100*P47 -> 170.99099999999999 | AL47: 145.3 | AM47: 210 | AN47: 48 | AO47: 162 | AP47: -6.7000000000000004e-002 | AQ47: 46 | AR47: 双环转债!
A48: 277 | B48: 128026 | C48: 众兴转债! | D48: 43103. | E48: 2772. | F48: 众兴菌业 | G48: 农业 | H48: 种植业 | I48: 104.005 | J48: -1.32e-002 | K48: 7.4000000000000003e-003 | L48: 8.96 | M48: -2.6099999999999998e-002 | N48: 110.3 | O48: 11.45 | P48: 0.32899999999999996 | Q48: 78.25 | R48: 转股中 | S48: 3年43天 | T48: 1年43天 | U48: 9.19 | V48: 8.5 | W48: 9.0000000000000011e-003 | X48: 0.27899999999999997 | Y48: 0.218 | Z48: 33 | AA48: 1.34 | AB48: 1.95e-002 | AC48: 1.3100000000000001e-002 | AD48: -9.1000000000000004e-003 | AE48: -1.3300000000000001e-002 | AF48: 95.02 | AG48: 91.35 | AH48: 0.22 | AI48: AA- | AJ48: 6.3899999999999998e-002 | AK48: =I48+100*P48 -> 136.905 | AL48: 129.8 | AM48: 62 | AN48: 34.7 | AO48: 44 | AP48: -4.8000000000000001e-002 | AQ48: 57 | AR48: 众兴转债!
A49: 122 | B49: 113566 | C49: 翔港转债 | D49: 43921. | E49: 603499 | F49: 翔港科技 | G49: 造纸包装 | H49: 包装材料 | I49: 112.78 | J49: -3.8699999999999998e-002 | K49: 7.4999999999999997e-003 | L49: 9.48 | M49: -5.4800000000000001e-002 | N49: 124.5 | O49: 10.77 | P49: 0.28100000000000003 | Q49: 88.02 | R49: 转股中 | S49: 5.33年 | T49: 3.33年 | U49: 1.61 | V49: 52 | W49: 0.28199999999999997 | X49: 8.4000000000000005e-002 | Y49: 7.400000000000001e-002 | Z49: 19 | AA49: 2.54 | AB49: 1.9199999999999998e-002 | AC49: 1.1299999999999999e-002 | AD49: -2.1400000000000002e-002 | AE49: -2.3900000000000001e-002 | AF49: 80.91 | AG49: 84.43 | AH49: 0.57 | AI49: A+ | AJ49: 7.7600000000000002e-002 | AK49: =I49+100*P49 -> 140.88 | AL49: 137.5 | AM49: 148 | AN49: 53.1 | AO49: 200 | AP49: -8.6999999999999994e-002 | AQ49: 26 | AR49: 翔港转债
A50: 100 | B50: 113574 | C50: 华体转债! | D50: 43948. | E50: 603679 | F50: 华体科技 | G50: 城市公用 | H50: 城市公用 | I50: 105.25 | J50: -2.0899999999999998e-002 | K50: 8.0000000000000002e-003 | L50: 20.32 | M50: -5.62e-002 | N50: 116.4 | O50: 33.99 | P50: 0.7609999999999999 | Q50: 59.78 | R50: 转股中 | S50: 5.41年 | T50: 3.41年 | U50: 2.09 | V50: 39 | W50: 0.17399999999999999 | X50: 7.2000000000000008e-002 | Y50: 4.2999999999999997e-002 | Z50: 29 | AA50: 3.97 | AB50: 1.9199999999999998e-002 | AC50: 1.37e-002 | AD50: -1.8e-003 | AE50: -4.3e-003 | AF50: 80.3 | AG50: 78.47 | AH50: 0.23 | AI50: A+ | AJ50: 7.7600000000000002e-002 | AK50: =I50+100*P50 -> 181.34999999999999 | AL50: 150.7 | AM50: 233 | AN50: 70.4 | AO50: 248 | AP50: -0.13900000000000001 | AQ50: 12 | AR50: 华体转债!
A51: 286 | B51: 128018 | C51: 时达转债! | D51: 43073. | E51: 2527. | F51: 新时达 | G51: 机械装备 | H51: 机器人及 | I51: 104.347 | J51: -3.0999999999999999e-003 | K51: -1.1999999999999999e-003 | L51: 5.65 | M51: -2.2499999999999999e-002 | N51: 110.3 | O51: 7.42 | P51: 0.37 | Q51: 76.15 | R51: 转股中 | S51: 3年6.1天 | T51: 1年6.1天 | U51: 8.8 | V51: 4.7 | W51: 5.0000000000000001e-003 | X51: 0.251 | Y51: 0.191 | Z51: 35 | AA51: 1.38 | AB51: 1.9e-002 | AC51: 1.2500000000000001e-002 | AD51: -1.2699999999999999e-002 | AE51: -1.72e-002 | AF51: 97.87 | AG51: 97.47 | AH51: 0.19 | AI51: AA | AJ51: 4.2900000000000001e-002 | AK51: =I51+100*P51 -> 141.34699999999998 | AL51: 132.5 | AM51: 97 | AN51: 34.7 | AO51: 43 | AP51: -6.9999999999999993e-003 | AQ51: 40 | AR51: 时达转债!
A52: 49 | B52: 128118 | C52: 瀛通转债 | D52: 44048. | E52: 2861. | F52: 瀛通通讯 | G52: 电子 | H52: 电子产品 | I52: 110 | J52: -2.9100000000000001e-002 | K52: 1.7600000000000001e-002 | L52: 23.38 | M52: -2.18e-002 | N52: 122.1 | O52: 27.53 | P52: 0.29499999999999998 | Q52: 84.93 | R52: 2月9天 | S52: 5.67年 | T52: 3.67年 | U52: 3 | V52: 45 | W52: 0.13500000000000001 | X52: 0.105 | Y52: 8.900000000000001e-002 | Z52: 28 | AA52: 2.68 | AB52: 1.9e-002 | AC52: 1.2199999999999999e-002 | AD52: -1.32e-002 | AE52: -1.54e-002 | AF52: 81.91 | AG52: 85.44 | AH52: 0.53 | AI52: AA- | AJ52: 6.6600000000000006e-002 | AK52: =I52+100*P52 -> 139.5 | AL52: 135.1 | AM52: 122 | AN52: 49.6 | AO52: 174 | AP52: -4.2000000000000003e-002 | AQ52: 5 | AR52: 瀛通转债
A53: 155 | B53: 128081 | C53: 海亮转债! | D53: 43815. | E53: 2203. | F53: 海亮股份 | G53: 有色金属 | H53: 铜金属 | I53: 105.15 | J53: -1.3600000000000001e-002 | K53: 2.5000000000000001e-003 | L53: 7.85 | M53: -2.9700000000000001e-002 | N53: 115.2 | O53: 9.76 | P53: 0.307 | Q53: 80.43 | R53: 转股中 | S53: 5年21天 | T53: 3年21天 | U53: 31.5 | V53: 2.9 | W53: 1.e-003 | X53: 0.20600000000000002 | Y53: 0.16500000000000001 | Z53: 153 | AA53: 1.7 | AB53: 1.8600000000000002e-002 | AC53: 1.3100000000000001e-002 | AD53: -4.3e-003 | AE53: -6.6e-003 | AF53: 89.96 | AG53: 92.37 | AH53: 0.37 | AI53: AA | AJ53: 4.5599999999999995e-002 | AK53: =I53+100*P53 -> 135.84999999999999 | AL53: 129.9 | AM53: 65 | AN53: 37.5 | AO53: 70 | AP53: -1.6e-002 | AQ53: 51 | AR53: 海亮转债!
A54: 153 | B54: 128082 | C54: 华锋转债! | D54: 43836. | E54: 2806. | F54: 华锋股份 | G54: 电子 | H54: 元器件制 | I54: 111.532 | J54: -2.1600000000000001e-002 | K54: 3.2000000000000002e-003 | L54: 11.29 | M54: -2.76e-002 | N54: 122 | O54: 11.71 | P54: 0.157 | Q54: 96.41 | R54: 转股中 | S54: 5年34天 | T54: 3年34天 | U54: 3.52 | V54: 33 | W54: 8.3000000000000004e-002 | X54: 0.17699999999999999 | Y54: 0.17100000000000001 | Z54: 20 | AA54: 1.59 | AB54: 1.83e-002 | AC54: 1.0700000000000001e-002 | AD54: -1.84e-002 | AE54: -2.1299999999999999e-002 | AF54: 82.72 | AG54: 84.31 | AH54: 0.67 | AI54: A+ | AJ54: 7.7600000000000002e-002 | AK54: =I54+100*P54 -> 127.232 | AL54: 126.7 | AM54: 39 | AN54: 42.3 | AO54: 118 | AP54: -6.4000000000000001e-002 | AQ54: 54 | AR54: 华锋转债!
A55: 145 | B55: 113557 | C55: 森特转债 | D55: 43840. | E55: 603098 | F55: 森特股份 | G55: 建筑 | H55: 建筑工程 | I55: 110.21 | J55: -1.1399999999999999e-002 | K55: -8.0000000000000004e-004 | L55: 9.3 | M55: -2.1099999999999997e-002 | N55: 120.7 | O55: 10.11 | P55: 0.19800000000000001 | Q55: 91.99 | R55: 转股中 | S55: 5年49天 | T55: 3年49天 | U55: 6 | V55: 3.3 | W55: 5.0000000000000001e-003 | X55: 0.13400000000000001 | Y55: 0.124 | Z55: 45 | AA55: 2.21 | AB55: 1.83e-002 | AC55: 1.1200000000000002e-002 | AD55: -1.7500000000000002e-002 | AE55: -1.9799999999999998e-002 | AF55: 84.33 | AG55: 87.34 | AH55: 0.58 | AI55: AA- | AJ55: 6.6600000000000006e-002 | AK55: =I55+100*P55 -> 130.00999999999999 | AL55: 128.4 | AM55: 55 | AN55: 41.1 | AO55: 104 | AP55: -2.6000000000000002e-002 | AQ55: 34 | AR55: 森特转债
A56: 21 | B56: 113599 | C56: 嘉友转债 | D56: 44081. | E56: 603871 | F56: 嘉友国际 | G56: 交通运输 | H56: 物流业 | I56: 114.02 | J56: -9.1000000000000004e-003 | K56: 1.0500000000000001e-002 | L56: 25.02 | M56: 2.e-003 | N56: 126 | O56: 24.82 | P56: 0.13100000000000001 | Q56: 100.81 | R56: 3月20天 | S56: 5.76年 | T56: 3.76年 | U56: 7.2 | V56: 27 | W56: 3.2000000000000001e-002 | X56: 0.13100000000000001 | Y56: 0.13200000000000001 | Z56: 55 | AA56: 2.76 | AB56: 1.78e-002 | AC56: 1.0200000000000001e-002 | AD56: -2.35e-002 | AE56: -2.5399999999999999e-002 | AF56: 80.86 | AG56: 87.52 | AH56: 0.66 | AI56: AA- | AJ56: 6.6600000000000006e-002 | AK56: =I56+100*P56 -> 127.12 | AL56: 127.2 | AM56: 47 | AN56: 39.7 | AO56: 93 | AP56: -7.4999999999999997e-002 | AQ56: 11 | AR56: 嘉友转债
A57: 228 | B57: 113524 | C57: 奇精转债! | D57: 43472. | E57: 603677 | F57: 奇精机械 | G57: 家电 | H57: 零部件制 | I57: 110.08 | J57: -3.1899999999999998e-002 | K57: 2.0799999999999999e-002 | L57: 13.23 | M57: -2.4300000000000002e-002 | N57: 117.9 | O57: 14.08 | P57: 0.17199999999999999 | Q57: 93.96 | R57: 转股中 | S57: 4年44天 | T57: 2年44天 | U57: 3.3 | V57: 44 | W57: 0.11699999999999999 | X57: 0.13 | Y57: 0.122 | Z57: 25 | AA57: 2.66 | AB57: 1.72e-002 | AC57: 9.3999999999999986e-003 | AD57: -2.7300000000000001e-002 | AE57: -3.0099999999999998e-002 | AF57: 94.03 | AG57: 99.53 | AH57: 0.46 | AI57: AA | AJ57: 4.2900000000000001e-002 | AK57: =I57+100*P57 -> 127.28 | AL57: 126.2 | AM57: 32 | AN57: 26.7 | AO57: 10 | AP57: 3.7999999999999999e-002 | AQ57: 43 | AR57: 奇精转债!
A58: 196 | B58: 113026 | C58: 核能转债! | D58: 43593. | E58: 601985 | F58: 中国核电 | G58: 能源电力 | H58: 核电 | I58: 102.02 | J58: -2.5999999999999999e-003 | K58: -8.0000000000000004e-004 | L58: 4.43 | M58: -1.5600000000000001e-002 | N58: 109.8 | O58: 6.08 | P58: 0.40000000000000002 | Q58: 72.86 | R58: 转股中 | S58: 4.46年 | T58: 2.46年 | U58: 78 | V58: 39 | W58: 5.0000000000000001e-003 | X58: 0.113 | Y58: 8.199999999999999e-002 | Z58: 690 | AA58: 1.32 | AB58: 1.7000000000000001e-002 | AC58: 1.2699999999999999e-002 | AD58: 4.7999999999999996e-003 | AE58: 2.3e-003 | AF58: 93.79 | AG58: 93.35 | AH58: 0.22 | AI58: AAA | AJ58: 3.7900000000000003e-002 | AK58: =I58+100*P58 -> 142.01999999999998 | AL58: 131.2 | AM58: 76 | AN58: 37.4 | AO58: 67 | AP58: -1.2e-002 | AQ58: 50 | AR58: 核能转债!
A59: 249 | B59: 123011 | C59: 德尔转债! | D59: 43326. | E59: 300473 | F59: 德尔股份 | G59: 汽车 | H59: 零部件制 | I59: 109.63 | J59: -3.0699999999999998e-002 | K59: 2.4900000000000002e-002 | L59: 27.8 | M59: -1.7000000000000001e-002 | N59: 116.3 | O59: 34.54 | P59: 0.36200000000000004 | Q59: 80.49 | R59: 转股中 | S59: 3.71年 | T59: 1.71年 | U59: 2.51 | V59: 139 | W59: 0.5 | X59: 7.9000000000000001e-002 | Y59: 6.4000000000000001e-002 | Z59: 32 | AA59: 1.41 | AB59: 1.6299999999999999e-002 | AC59: 8.3999999999999995e-003 | AD59: -3.39e-002 | AE59: -3.6699999999999997e-002 | AF59: 91.58 | AG59: 92.8 | AH59: 0.34 | AI59: AA- | AJ59: 6.3899999999999998e-002 | AK59: =I59+100*P59 -> 145.82999999999998 | AL59: 138.8 | AM59: 156 | AN59: 46 | AO59: 149 | AP59: -3.7000000000000005e-002 | AQ59: 36 | AR59: 德尔转债!
A60: 213 | B60: 110053 | C60: 苏银转债! | D60: 43558. | E60: 600919 | F60: 江苏银行 | G60: 金融 | H60: 银行行业 | I60: 111.5 | J60: -1.1899999999999999e-002 | K60: 7.7000000000000002e-003 | L60: 6.01 | M60: -1.3100000000000001e-002 | N60: 119.1 | O60: 7.28 | P60: 0.35100000000000003 | Q60: 82.55 | R60: 转股中 | S60: 4.37年 | T60: 无权 | U60: 200 | V60: 35 | W60: 2.e-003 | X60: 0.28800000000000003 | Y60: 0.23800000000000002 | Z60: 694 | AA60: 0.6 | AB60: 1.5700000000000002e-002 | AC60: 7.9000000000000008e-003 | AD60: 无权 | AE60: 无权 | AF60: 无权 | AG60: 101.75 | AH60: 0.32 | AI60: AAA | AJ60: 3.7900000000000003e-002 | AK60: =I60+100*P60 -> 146.59999999999999 | AL60: 140.4 | AM60: 174 | AN60: 38.7 | AO60: 86 | AP60: -3.7000000000000005e-002 | AQ60: 47 | AR60: 苏银转债!
A61: 198 | B61: 113534 | C61: 鼎胜转债! | D61: 43585. | E61: 603876 | F61: 鼎胜新材 | G61: 有色金属 | H61: 小金属 | I61: 107.39 | J61: -1.1000000000000001e-002 | K61: -1.15e-002 | L61: 12.1 | M61: -7.2800000000000004e-002 | N61: 114.9 | O61: 15.18 | P61: 0.34700000000000003 | Q61: 79.71 | R61: 转股中 | S61: 4.44年 | T61: 2.44年 | U61: 12 | V61: 12 | W61: 9.0000000000000011e-003 | X61: 0.22899999999999998 | Y61: 0.182 | Z61: 52 | AA61: 1.46 | AB61: 1.5700000000000002e-002 | AC61: 9.4999999999999998e-003 | AD61: -1.46e-002 | AE61: -1.7100000000000001e-002 | AF61: 92.79 | AG61: 95.72 | AH61: 0.31 | AI61: AA | AJ61: 4.2900000000000001e-002 | AK61: =I61+100*P61 -> 142.09 | AL61: 135.1 | AM61: 121 | AN61: 39.3 | AO61: 89 | AP61: -9.6999999999999989e-002 | AQ61: 30 | AR61: 鼎胜转债!
A62: 240 | B62: 113519 | C62: 长久转债! | D62: 43434. | E62: 603569 | F62: 长久物流 | G62: 交通运输 | H62: 物流业 | I62: 113 | J62: -3.5699999999999996e-002 | K62: -1.1999999999999999e-003 | L62: 9.98 | M62: -0.10000000000000001 | N62: 120.1 | O62: 11.15 | P62: 0.26200000000000001 | Q62: 89.51 | R62: 转股中 | S62: 4年7天 | T62: 2年7天 | U62: 6.97 | V62: 21 | W62: 2.7000000000000003e-002 | X62: 0.125 | Y62: 0.11199999999999999 | Z62: 56 | AA62: 2.67 | AB62: 1.5600000000000001e-002 | AC62: 6.8000000000000005e-003 | AD62: -3.95e-002 | AE62: -4.2500000000000003e-002 | AF62: 94.64 | AG62: 101.84 | AH62: 0.37 | AI62: AA | AJ62: 4.2900000000000001e-002 | AK62: =I62+100*P62 -> 139.19999999999999 | AL62: 136.5 | AM62: 139 | AN62: 34.6 | AO62: 42 | AP62: -4.0000000000000001e-002 | AQ62: 17 | AR62: 长久转债!
A63: 96 | B63: 127016 | C63: 鲁泰转债 | D63: 43964. | E63: 726. | F63: 鲁 泰Ａ | G63: 服装纺织 | H63: 纺织行业 | I63: 107.011 | J63: -1.34e-002 | K63: 6.8000000000000005e-003 | L63: 7.19 | M63: -1.78e-002 | N63: 116.2 | O63: 8.91 | P63: 0.32600000000000001 | Q63: 80.7 | R63: 转股中 | S63: 5.44年 | T63: 3.44年 | U63: 14 | V63: 1.5 | W63: 1.e-003 | X63: 0.22699999999999998 | Y63: 0.183 | Z63: 62 | AA63: 0.79 | AB63: 1.5600000000000001e-002 | AC63: 1.01e-002 | AD63: -8.8000000000000005e-003 | AE63: -1.0700000000000001e-002 | AF63: 89.04 | AG63: 92.54 | AH63: 0.37 | AI63: AA+ | AJ63: 4.36e-002 | AK63: =I63+100*P63 -> 139.61099999999999 | AL63: 133.3 | AM63: 102 | AN63: 40.8 | AO63: 101 | AP63: -3.7000000000000005e-002 | AQ63: 22 | AR63: 鲁泰转债
A64: 244 | B64: 113516 | C64: 苏农转债! | D64: 43332. | E64: 603323 | F64: 苏农银行 | G64: 金融 | H64: 银行行业 | I64: 107.99 | J64: -5.9999999999999995e-004 | K64: 1.4000000000000002e-003 | L64: 4.69 | M64: 2.0999999999999999e-003 | N64: 114.3 | O64: 5.52 | P64: 0.27100000000000002 | Q64: 84.96 | R64: 转股中 | S64: 3.75年 | T64: 无权 | U64: 12.9 | V64: 8.9 | W64: 6.0000000000000001e-003 | X64: 0.152 | Y64: 0.13 | Z64: 85 | AA64: 0.71 | AB64: 1.55e-002 | AC64: 8.5000000000000006e-003 | AD64: 无权 | AE64: 无权 | AF64: 无权 | AG64: 98.6 | AH64: 0.34 | AI64: AA+ | AJ64: 4.0899999999999999e-002 | AK64: =I64+100*P64 -> 135.09 | AL64: 131 | AM64: 73 | AN64: 32.4 | AO64: 29 | AP64: 0. | AQ64: 36 | AR64: 苏农转债!
A65: 48 | B65: 113036 | C65: 宁建转债 | D65: 44049. | E65: 601789 | F65: 宁波建工 | G65: 建筑 | H65: 建筑工程 | I65: 107.85 | J65: -1.e-002 | K65: -3.7000000000000002e-003 | L65: 4.2 | M65: -2.9999999999999999e-002 | N65: 117.3 | O65: 4.86 | P65: 0.248 | Q65: 86.42 | R65: 2月12天 | S65: 5.68年 | T65: 3.68年 | U65: 5.4 | V65: 1.9 | W65: 3.0000000000000001e-003 | X65: 0.13200000000000001 | Y65: 0.114 | Z65: 41 | AA65: 1.38 | AB65: 1.52e-002 | AC65: 9.7000000000000003e-003 | AD65: -1.e-002 | AE65: -1.1899999999999999e-002 | AF65: 87.59 | AG65: 91.5 | AH65: 0.46 | AI65: AA | AJ65: 4.5599999999999995e-002 | AK65: =I65+100*P65 -> 132.65000000000001 | AL65: 129.3 | AM65: 59 | AN65: 37.8 | AO65: 75 | AP65: -4.4000000000000004e-002 | AQ65: 5 | AR65: 宁建转债
A66: 233 | B66: 110047 | C66: 山鹰转债 | D66: 43444. | E66: 600567 | F66: 山鹰纸业 | G66: 造纸包装 | H66: 包装用纸 | I66: 111.4 | J66: -8.8000000000000005e-003 | K66: 2.2000000000000001e-003 | L66: 3.06 | M66: -1.61e-002 | N66: 118.1 | O66: 3.34 | P66: 0.21600000000000003 | Q66: 91.62 | R66: 转股中 | S66: 4年21天 | T66: 2年21天 | U66: 23 | V66: 0.8 | W66: 0. | X66: 0.16300000000000001 | Y66: 0.14999999999999999 | Z66: 141 | AA66: 0.99 | AB66: 1.4800000000000001e-002 | AC66: 6.8999999999999999e-003 | AD66: -3.32e-002 | AE66: -3.6000000000000004e-002 | AF66: 94.71 | AG66: 100.73 | AH66: 0.41 | AI66: AA+ | AJ66: 4.0899999999999999e-002 | AK66: =I66+100*P66 -> 133. | AL66: 131.2 | AM66: 77 | AN66: 30.5 | AO66: 20 | AP66: -2.6000000000000002e-002 | AQ66: 34 | AR66: 山鹰转债
A67: 246 | B67: 128042 | C67: 凯中转债! | D67: 43346. | E67: 2823. | F67: 凯中精密 | G67: 能源电力 | H67: 电力设备 | I67: 110.21 | J67: -3.7499999999999999e-002 | K67: 2.18e-002 | L67: 11.56 | M67: -4.07e-002 | N67: 116.3 | O67: 12.96 | P67: 0.23600000000000002 | Q67: 89.2 | R67: 转股中 | S67: 3.75年 | T67: 1.75年 | U67: 4.16 | V67: 182 | W67: 0.39000000000000001 | X67: 0.125 | Y67: 0.11199999999999999 | Z67: 33 | AA67: 2.46 | AB67: 1.47e-002 | AC67: 6.8999999999999999e-003 | AD67: -3.6000000000000004e-002 | AE67: -3.8699999999999998e-002 | AF67: 94.92 | AG67: 99.65 | AH67: 0.38 | AI67: AA | AJ67: 4.2900000000000001e-002 | AK67: =I67+100*P67 -> 133.81 | AL67: 131.2 | AM67: 79 | AN67: 31.6 | AO67: 23 | AP67: 2.5000000000000001e-002 | AQ67: 24 | AR67: 凯中转债!
A68: 296 | B68: 128013 | C68: 洪涛转债! | D68: 42605. | E68: 2325. | F68: 洪涛股份 | G68: 建筑 | H68: 装饰工程 | I68: 107.11 | J68: -8.6e-003 | K68: -3.7000000000000002e-003 | L68: 2.9 | M68: -3.0099999999999998e-002 | N68: 109.8 | O68: 3.1 | P68: 0.14499999999999999 | Q68: 93.55 | R68: 转股中 | S68: 1.74年 | T68: 回售中 | U68: 12 | V68: 16 | W68: 1.2e-002 | X68: 0.33100000000000002 | Y68: 0.309 | Z68: 36 | AA68: 1.21 | AB68: 1.4499999999999999e-002 | AC68: 3.9000000000000003e-003 | AD68: 回售中 | AE68: 回售中 | AF68: 100.3 | AG68: 98.73 | AH68: 0.41 | AI68: AA- | AJ68: 6.3500000000000001e-002 | AK68: =I68+100*P68 -> 121.61 | AL68: 120.7 | AM68: 10 | AN68: 20.4 | AO68: 4 | AP68: -7.0000000000000007e-002 | AQ68: 89 | AR68: 洪涛转债!
A69: 39 | B69: 113593 | C69: 沪工转债 | D69: 44053. | E69: 603131 | F69: 上海沪工 | G69: 机械装备 | H69: 通用设备 | I69: 112.23 | J69: -2.4199999999999999e-002 | K69: 2.4199999999999999e-002 | L69: 21.28 | M69: 0. | N69: 121.6 | O69: 21.32 | P69: 0.124 | Q69: 99.81 | R69: 2月26天 | S69: 5.72年 | T69: 3.72年 | U69: 4 | V69: 122 | W69: 0.25600000000000001 | X69: 5.9000000000000004e-002 | Y69: 5.9000000000000004e-002 | Z69: 68 | AA69: 5.49 | AB69: 1.44e-002 | AC69: 7.9000000000000008e-003 | AD69: -1.8100000000000002e-002 | AE69: -2.0299999999999999e-002 | AF69: 78.49 | AG69: 80.08 | AH69: 0.73 | AI69: A+ | AJ69: 7.7600000000000002e-002 | AK69: =I69+100*P69 -> 124.63000000000001 | AL69: 124.6 | AM69: 25 | AN69: 44.6 | AO69: 137 | AP69: 1.4999999999999999e-002 | AQ69: 6 | AR69: 沪工转债
A70: 37 | B70: 113594 | C70: 淳中转债 | D70: 44071. | E70: 603516 | F70: 淳中科技 | G70: 电子 | H70: 电子产品 | I70: 112.18 | J70: -4.3299999999999998e-002 | K70: 3.6299999999999999e-002 | L70: 36.09 | M70: -1.0700000000000001e-002 | N70: 121.4 | O70: 39.37 | P70: 0.22399999999999998 | Q70: 91.67 | R70: 2月28天 | S70: 5.72年 | T70: 3.72年 | U70: 3 | V70: 539 | W70: 1.46 | X70: 6.2e-002 | Y70: 5.7000000000000002e-002 | Z70: 48 | AA70: 5.67 | AB70: 1.4199999999999999e-002 | AC70: 7.7000000000000002e-003 | AD70: -1.8100000000000002e-002 | AE70: -2.0299999999999999e-002 | AF70: 78.48 | AG70: 79.95 | AH70: 0.66 | AI70: A+ | AJ70: 7.7600000000000002e-002 | AK70: =I70+100*P70 -> 134.58000000000001 | AL70: 132.7 | AM70: 99 | AN70: 52.7 | AO70: 196 | AP70: 2.6000000000000002e-002 | AQ70: 4 | AR70: 淳中转债
A71: 16 | B71: 110074 | C71: 精达转债 | D71: 44095. | E71: 600577 | F71: 精达股份 | G71: 电子 | H71: 电子产品 | I71: 108.38 | J71: -1.8600000000000002e-002 | K71: 7.8000000000000005e-003 | L71: 3.17 | M71: -2.46e-002 | N71: 117.3 | O71: 3.75 | P71: 0.28199999999999997 | Q71: 84.53 | R71: 3月27天 | S71: 5.80年 | T71: 3.80年 | U71: 7.87 | V71: 6.4 | W71: 6.9999999999999993e-003 | X71: 0.129 | Y71: 0.109 | Z71: 61 | AA71: 1.72 | AB71: 1.3999999999999999e-002 | AC71: 8.6e-003 | AD71: -1.09e-002 | AE71: -1.2699999999999999e-002 | AF71: 87.12 | AG71: 91.01 | AH71: 0.44 | AI71: AA | AJ71: 4.5599999999999995e-002 | AK71: =I71+100*P71 -> 136.57999999999998 | AL71: 132.2 | AM71: 93 | AN71: 41.2 | AO71: 108 | AP71: -6.0999999999999999e-002 | AQ71: 6 | AR71: 精达转债
A72: 165 | B72: 127014 | C72: 北方转债 | D72: 43790. | E72: 65. | F72: 北方国际 | G72: 建筑 | H72: 建筑工程 | I72: 107.599 | J72: -1.4199999999999999e-002 | K72: 7.6e-003 | L72: 7.25 | M72: -1.7600000000000001e-002 | N72: 115.1 | O72: 8.75 | P72: 0.29899999999999999 | Q72: 82.86 | R72: 转股中 | S72: 4.98年 | T72: 2.98年 | U72: 5.78 | V72: 4.9 | W72: 8.0000000000000002e-003 | X72: 0.10400000000000001 | Y72: 8.5999999999999993e-002 | Z72: 56 | AA72: 1.12 | AB72: 1.3899999999999999e-002 | AC72: 8.3999999999999995e-003 | AD72: -1.21e-002 | AE72: -1.43e-002 | AF72: 91.43 | AG72: 94.64 | AH72: 0.38 | AI72: AA+ | AJ72: 4.0899999999999999e-002 | AK72: =I72+100*P72 -> 137.499 | AL72: 132.3 | AM72: 94 | AN72: 37.7 | AO72: 74 | AP72: -4.4000000000000004e-002 | AQ72: 17 | AR72: 北方转债
A73: 33 | B73: 113037 | C73: 紫银转债 | D73: 44060. | E73: 601860 | F73: 紫金银行 | G73: 金融 | H73: 银行行业 | I73: 107.17 | J73: -6.4000000000000003e-003 | K73: 1.e-004 | L73: 3.94 | M73: -1.4999999999999999e-002 | N73: 115.8 | O73: 4.75 | P73: 0.29199999999999998 | Q73: 82.95 | R73: 3月0天 | S73: 5.73年 | T73: 无权 | U73: 45 | V73: 17 | W73: 4.0000000000000001e-003 | X73: 0.312 | Y73: 0.25900000000000001 | Z73: 144 | AA73: 1.05 | AB73: 1.3899999999999999e-002 | AC73: 8.8999999999999999e-003 | AD73: 无权 | AE73: 无权 | AF73: 无权 | AG73: 91.13 | AH73: 0.42 | AI73: AA+ | AJ73: 4.36e-002 | AK73: =I73+100*P73 -> 136.37 | AL73: 131.4 | AM73: 82 | AN73: 40.3 | AO73: 98 | AP73: -4.8000000000000001e-002 | AQ73: 16 | AR73: 紫银转债
A74: 184 | B74: 128069 | C74: 华森转债! | D74: 43657. | E74: 2907. | F74: 华森制药 | G74: 医药 | H74: 化学制药 | I74: 112.803 | J74: -3.3099999999999997e-002 | K74: 2.63e-002 | L74: 16 | M74: -1.3600000000000001e-002 | N74: 120 | O74: 18.04 | P74: 0.27200000000000002 | Q74: 88.69 | R74: 转股中 | S74: 4.65年 | T74: 2.65年 | U74: 3 | V74: 200 | W74: 0.58700000000000008 | X74: 4.7e-002 | Y74: 4.0999999999999995e-002 | Z74: 64 | AA74: 5.98 | AB74: 1.37e-002 | AC74: 6.0999999999999995e-003 | AD74: -3.04e-002 | AE74: -3.27e-002 | AF74: 87.11 | AG74: 90.51 | AH74: 0.5 | AI74: AA- | AJ74: 6.3899999999999998e-002 | AK74: =I74+100*P74 -> 140.00299999999999 | AL74: 136.9 | AM74: 143 | AN74: 46.4 | AO74: 153 | AP74: -3.7000000000000005e-002 | AQ74: 40 | AR74: 华森转债!
A75: 12 | B75: 113039 | C75: 嘉泽转债! | D75: 44091. | E75: 601619 | F75: 嘉泽新能 | G75: 能源电力 | H75: 风能 | I75: 105 | J75: -8.1000000000000013e-003 | K75: 1.e-004 | L75: 3.07 | M75: -1.6e-002 | N75: 113.1 | O75: 3.57 | P75: 0.221 | Q75: 85.99 | R75: 4月1天 | S75: 5.81年 | T75: 3.81年 | U75: 13 | V75: 3.9 | W75: 3.0000000000000001e-003 | X75: 0.20399999999999999 | Y75: 0.17600000000000002 | Z75: 64 | AA75: 1.9 | AB75: 1.3100000000000001e-002 | AC75: 8.8999999999999999e-003 | AD75: -3.4000000000000002e-003 | AE75: -5.1000000000000004e-003 | AF75: 86.87 | AG75: 87.68 | AH75: 0.5 | AI75: AA | AJ75: 4.5599999999999995e-002 | AK75: =I75+100*P75 -> 127.09999999999999 | AL75: 124 | AM75: 19 | AN75: 36.3 | AO75: 58 | AP75: -4.8000000000000001e-002 | AQ75: 11 | AR75: 嘉泽转债!
A76: 202 | B76: 113532 | C76: 海环转债! | D76: 43579. | E76: 603817 | F76: 海峡环保 | G76: 城市公用 | H76: 三废处理 | I76: 106.8 | J76: -1.04e-002 | K76: 1.e-003 | L76: 6.24 | M76: -2.6499999999999999e-002 | N76: 112.9 | O76: 7.69 | P76: 0.316 | Q76: 81.14 | R76: 转股中 | S76: 4.42年 | T76: 2.42年 | U76: 4.6 | V76: 2 | W76: 4.0000000000000001e-003 | X76: 0.16399999999999998 | Y76: 0.13300000000000001 | Z76: 28 | AA76: 1.64 | AB76: 1.29e-002 | AC76: 7.4999999999999997e-003 | AD76: -1.26e-002 | AE76: -1.5100000000000001e-002 | AF76: 92.86 | AG76: 94.14 | AH76: 0.35 | AI76: AA | AJ76: 4.2900000000000001e-002 | AK76: =I76+100*P76 -> 138.40000000000001 | AL76: 132.5 | AM76: 95 | AN76: 38.3 | AO76: 83 | AP76: -2.6000000000000002e-002 | AQ76: 25 | AR76: 海环转债!
A77: 200 | B77: 128064 | C77: 司尔转债! | D77: 43592. | E77: 2538. | F77: 司尔特 | G77: 化工 | H77: 农化 | I77: 108.812 | J77: -2.3700000000000002e-002 | K77: 7.7000000000000002e-003 | L77: 5.67 | M77: -3.2400000000000005e-002 | N77: 114.9 | O77: 6.07 | P77: 0.16500000000000001 | Q77: 93.41 | R77: 转股中 | S77: 4.44年 | T77: 2.44年 | U77: 8 | V77: 11 | W77: 1.3000000000000001e-002 | X77: 0.19600000000000001 | Y77: 0.184 | Z77: 41 | AA77: 1.08 | AB77: 1.26e-002 | AC77: 6.5000000000000006e-003 | AD77: -1.9599999999999999e-002 | AE77: -2.2099999999999998e-002 | AF77: 92.8 | AG77: 95.73 | AH77: 0.49 | AI77: AA | AJ77: 4.2900000000000001e-002 | AK77: =I77+100*P77 -> 125.312 | AL77: 124.2 | AM77: 23 | AN77: 28.5 | AO77: 15 | AP77: -1.8000000000000002e-002 | AQ77: 56 | AR77: 司尔转债!
A78: 209 | B78: 123023 | C78: 迪森转债! | D78: 43571. | E78: 300335 | F78: 迪森股份 | G78: 能源电力 | H78: 电力供应 | I78: 109 | J78: -6.2800000000000009e-002 | K78: 1.5900000000000001e-002 | L78: 6.7 | M78: -9.2100000000000015e-002 | N78: 114.9 | O78: 7.04 | P78: 0.14499999999999999 | Q78: 95.17 | R78: 转股中 | S78: 4.38年 | T78: 3.38年 | U78: 5.3 | V78: 244 | W78: 0.40700000000000003 | X78: 0.218 | Y78: 0.20699999999999999 | Z78: 24 | AA78: 1.8 | AB78: 1.23e-002 | AC78: 6.0999999999999995e-003 | AD78: -1.e-002 | AE78: -1.2800000000000001e-002 | AF78: 90.87 | AG78: 95.94 | AH78: 0.51 | AI78: AA | AJ78: 4.2900000000000001e-002 | AK78: =I78+100*P78 -> 123.5 | AL78: 122.8 | AM78: 14 | AN78: 26.9 | AO78: 11 | AP78: -4.4000000000000004e-002 | AQ78: 54 | AR78: 迪森转债!
A79: 114 | B79: 113570 | C79: 百达转债 | D79: 43929. | E79: 603331 | F79: 百达精工 | G79: 机械装备 | H79: 机械装备 | I79: 108.3 | J79: -2.87e-002 | K79: 1.7500000000000002e-002 | L79: 10.46 | M79: -1.6899999999999998e-002 | N79: 115.3 | O79: 11.54 | P79: 0.19500000000000001 | Q79: 90.64 | R79: 转股中 | S79: 5.36年 | T79: 3.36年 | U79: 2.8 | V79: 4.6 | W79: 1.4999999999999999e-002 | X79: 0.14999999999999999 | Y79: 0.13600000000000001 | Z79: 19 | AA79: 2.42 | AB79: 1.2e-002 | AC79: 6.8000000000000005e-003 | AD79: -1.21e-002 | AE79: -1.41e-002 | AF79: 79.99 | AG79: 77.92 | AH79: 0.66 | AI79: A+ | AJ79: 7.7600000000000002e-002 | AK79: =I79+100*P79 -> 127.8 | AL79: 126 | AM79: 31 | AN79: 46 | AO79: 150 | AP79: -1.9e-002 | AQ79: 33 | AR79: 百达转债
A80: 17 | B80: 110072 | C80: 广汇转债! | D80: 44089. | E80: 600297 | F80: 广汇汽车 | G80: 汽车 | H80: 分销、售 | I80: 106.92 | J80: -1.3300000000000001e-002 | K80: 1.3300000000000001e-002 | L80: 3.5 | M80: 0. | N80: 114.5 | O80: 4.03 | P80: 0.23100000000000001 | Q80: 86.85 | R80: 3月26天 | S80: 5.80年 | T80: 3.80年 | U80: 33.7 | V80: 150 | W80: 4.0999999999999995e-002 | X80: 0.11900000000000001 | Y80: 0.10300000000000001 | Z80: 284 | AA80: 0.72 | AB80: 1.2e-002 | AC80: 7.4999999999999997e-003 | AD80: -9.3999999999999986e-003 | AE80: -1.09e-002 | AF80: 87.05 | AG80: 89.72 | AH80: 0.48 | AI80: AA+ | AJ80: 4.36e-002 | AK80: =I80+100*P80 -> 130.02000000000001 | AL80: 127 | AM80: 44 | AN80: 37.3 | AO80: 64 | AP80: -6.9999999999999993e-003 | AQ80: 17 | AR80: 广汇转债!
A81: 14 | B81: 128128 | C81: 齐翔转2 | D81: 44089. | E81: 2408. | F81: 齐翔腾达 | G81: 化工 | H81: 化工 | I81: 107.744 | J81: 4.0000000000000001e-003 | K81: 9.3999999999999986e-003 | L81: 8.23 | M81: 2.1099999999999997e-002 | N81: 115.3 | O81: 8.22 | P81: 7.5999999999999998e-002 | Q81: 100.12 | R81: 3月28天 | S81: 5.80年 | T81: 3.80年 | U81: 29.9 | V81: 66 | W81: 2.1000000000000001e-002 | X81: 0.20499999999999999 | Y81: 0.20499999999999999 | Z81: 146 | AA81: 1.78 | AB81: 1.2e-002 | AC81: 7.1999999999999998e-003 | AD81: -9.5999999999999992e-003 | AE81: -1.1399999999999999e-002 | AF81: 87.02 | AG81: 89.44 | AH81: 0.63 | AI81: AA | AJ81: 4.5599999999999995e-002 | AK81: =I81+100*P81 -> 115.34399999999999 | AL81: 115.4 | AM81: 1 | AN81: 25.9 | AO81: 9 | AP81: 7.0000000000000007e-002 | AQ81: 23 | AR81: 齐翔转2
A82: 199 | B82: 113024 | C82: 核建转债! | D82: 43581. | E82: 601611 | F82: 中国核建 | G82: 建筑 | H82: 建筑工程 | I82: 104.31 | J82: -1.9e-003 | K82: -5.3e-003 | L82: 7.2 | M82: -2.9600000000000001e-002 | N82: 109.7 | O82: 9.76 | P82: 0.41399999999999998 | Q82: 73.77 | R82: 转股中 | S82: 4.44年 | T82: 2.44年 | U82: 30 | V82: 3.8 | W82: 1.e-003 | X82: 0.157 | Y82: 0.11599999999999999 | Z82: 191 | AA82: 1.84 | AB82: 1.1599999999999999e-002 | AC82: 7.4999999999999997e-003 | AD82: -4.0999999999999995e-003 | AE82: -6.5000000000000006e-003 | AF82: 93.76 | AG82: 93.31 | AH82: 0.24 | AI82: AAA | AJ82: 3.7900000000000003e-002 | AK82: =I82+100*P82 -> 145.71000000000001 | AL82: 134.8 | AM82: 119 | AN82: 41.1 | AO82: 105 | AP82: -5.0999999999999997e-002 | AQ82: 44 | AR82: 核建转债!
A83: 40 | B83: 128120 | C83: 联诚转债 | D83: 44060. | E83: 2921. | F83: 联诚精密 | G83: 汽车 | H83: 零部件制 | I83: 111.2 | J83: -3.27e-002 | K83: 2.3e-002 | L83: 23.37 | M83: -1.3100000000000001e-002 | N83: 118.4 | O83: 24.37 | P83: 0.16 | Q83: 95.9 | R83: 2月26天 | S83: 5.71年 | T83: 3.71年 | U83: 2.6 | V83: 109 | W83: 0.36799999999999999 | X83: 0.13600000000000001 | Y83: 0.13100000000000001 | Z83: 19 | AA83: 2.55 | AB83: 1.1299999999999999e-002 | AC83: 5.6000000000000008e-003 | AD83: -1.5900000000000001e-002 | AE83: -1.8100000000000002e-002 | AF83: 75.81 | AG83: 74.16 | AH83: 0.74 | AI83: A | AJ83: 8.7599999999999997e-002 | AK83: =I83+100*P83 -> 127.2 | AL83: 126.5 | AM83: 35 | AN83: 50.7 | AO83: 179 | AP83: 5.7999999999999996e-002 | AQ83: 10 | AR83: 联诚转债
A84: 50 | B84: 128117 | C84: 道恩转债 | D84: 44032. | E84: 2838. | F84: 道恩股份 | G84: 化工 | H84: 橡胶塑料 | I84: 116.2 | J84: -3.9699999999999999e-002 | K84: 1.9599999999999999e-002 | L84: 27.2 | M84: -3.3399999999999999e-002 | N84: 123.5 | O84: 29.07 | P84: 0.24199999999999999 | Q84: 93.57 | R84: 2月9天 | S84: 5.67年 | T84: 3.67年 | U84: 3.6 | V84: 377 | W84: 0.90400000000000003 | X84: 3.3000000000000002e-002 | Y84: 2.9999999999999999e-002 | Z84: 111 | AA84: 6.43 | AB84: 1.1000000000000001e-002 | AC84: 4.0000000000000001e-003 | AD84: -2.92e-002 | AE84: -3.1e-002 | AF84: 81.29 | AG84: 86.29 | AH84: 0.6 | AI84: AA- | AJ84: 6.6600000000000006e-002 | AK84: =I84+100*P84 -> 140.40000000000001 | AL84: 138.8 | AM84: 157 | AN84: 52.5 | AO84: 195 | AP84: -6.4000000000000001e-002 | AQ84: 10 | AR84: 道恩转债
A85: 157 | B85: 113549 | C85: 白电转债 | D85: 43810. | E85: 603861 | F85: 白云电器 | G85: 能源电力 | H85: 电力设备 | I85: 109.22 | J85: -8.5000000000000006e-003 | K85: 6.0000000000000001e-003 | L85: 8.11 | M85: -4.8999999999999998e-003 | N85: 115.1 | O85: 8.88 | P85: 0.19600000000000001 | Q85: 91.33 | R85: 转股中 | S85: 5年15天 | T85: 3年15天 | U85: 8.8 | V85: 3.3 | W85: 3.0000000000000001e-003 | X85: 0.24600000000000002 | Y85: 0.22399999999999998 | Z85: 36 | AA85: 1.58 | AB85: 1.0700000000000001e-002 | AC85: 5.1999999999999998e-003 | AD85: -1.6500000000000001e-002 | AE85: -1.8600000000000002e-002 | AF85: 89.93 | AG85: 92.35 | AH85: 0.51 | AI85: AA | AJ85: 4.5599999999999995e-002 | AK85: =I85+100*P85 -> 128.81999999999999 | AL85: 127.1 | AM85: 45 | AN85: 34.8 | AO85: 46 | AP85: -2.5000000000000001e-002 | AQ85: 31 | AR85: 白电转债
A86: 99 | B86: 113033 | C86: 利群转债! | D86: 43942. | E86: 601366 | F86: 利群股份 | G86: 商业零售 | H86: 商场 | I86: 109.01 | J86: -9.4999999999999998e-003 | K86: 1.37e-002 | L86: 6.68 | M86: 7.4999999999999997e-003 | N86: 115.3 | O86: 7.01 | P86: 0.14400000000000002 | Q86: 95.29 | R86: 转股中 | S86: 5.42年 | T86: 3.42年 | U86: 18 | V86: 7.1 | W86: 4.0000000000000001e-003 | X86: 0.313 | Y86: 0.29799999999999999 | Z86: 57 | AA86: 1.3 | AB86: 1.06e-002 | AC86: 5.5000000000000005e-003 | AD86: -1.37e-002 | AE86: -1.5700000000000002e-002 | AF86: 88.62 | AG86: 91.01 | AH86: 0.57 | AI86: AA | AJ86: 4.5599999999999995e-002 | AK86: =I86+100*P86 -> 123.41000000000001 | AL86: 122.7 | AM86: 13 | AN86: 31.7 | AO86: 25 | AP86: -1.3000000000000001e-002 | AQ86: 36 | AR86: 利群转债!
A87: 185 | B87: 123028 | C87: 清水转债 | D87: 43661. | E87: 300437 | F87: 清水源 | G87: 城市公用 | H87: 三废处理 | I87: 116.33 | J87: -3.32e-002 | K87: -2.8999999999999998e-003 | L87: 12.59 | M87: -5.3399999999999996e-002 | N87: 121.8 | O87: 11.84 | P87: 9.4e-002 | Q87: 106.33 | R87: 转股中 | S87: 4.63年 | T87: 2.63年 | U87: 4.56 | V87: 29 | W87: 5.4000000000000006e-002 | X87: 0.16600000000000001 | Y87: 0.17600000000000002 | Z87: 27 | AA87: 1.78 | AB87: 1.0200000000000001e-002 | AC87: 2.0999999999999999e-003 | AD87: -3.73e-002 | AE87: -4.0399999999999998e-002 | AF87: 88.25 | AG87: 92.11 | AH87: 0.68 | AI87: AA- | AJ87: 6.3899999999999998e-002 | AK87: =I87+100*P87 -> 125.73 | AL87: 126.3 | AM87: 34 | AN87: 34.2 | AO87: 40 | AP87: -5.7999999999999996e-002 | AQ87: 49 | AR87: 清水转债
A88: 53 | B88: 128116 | C88: 瑞达转债 | D88: 44036. | E88: 2961. | F88: 瑞达期货 | G88: 金融 | H88: 期货行业 | I88: 109.002 | J88: -1.18e-002 | K88: -5.0000000000000001e-004 | L88: 27.28 | M88: -2.29e-002 | N88: 115.3 | O88: 29.82 | P88: 0.192 | Q88: 91.48 | R88: 2月5天 | S88: 5.66年 | T88: 3.66年 | U88: 6.5 | V88: 8.6 | W88: 1.2e-002 | X88: 5.4000000000000006e-002 | Y88: 4.9000000000000002e-002 | Z88: 121 | AA88: 6.9 | AB88: 1.0200000000000001e-002 | AC88: 5.3e-003 | AD88: -1.3000000000000001e-002 | AE88: -1.49e-002 | AF88: 87.58 | AG88: 90.01 | AH88: 0.54 | AI88: AA | AJ88: 4.5599999999999995e-002 | AK88: =I88+100*P88 -> 128.202 | AL88: 126.5 | AM88: 37 | AN88: 36.5 | AO88: 59 | AP88: -3.4000000000000002e-002 | AQ88: 8 | AR88: 瑞达转债
A89: 151 | B89: 128083 | C89: 新北转债! | D89: 43830. | E89: 2376. | F89: 新北洋 | G89: 电子 | H89: 电子产品 | I89: 109.699 | J89: -6.8000000000000005e-003 | K89: -3.4999999999999996e-003 | L89: 9.35 | M89: -2.81e-002 | N89: 115.2 | O89: 11.7 | P89: 0.373 | Q89: 79.91 | R89: 转股中 | S89: 5年42天 | T89: 3年42天 | U89: 8.77 | V89: 5.9 | W89: 6.0000000000000001e-003 | X89: 0.14099999999999999 | Y89: 0.113 | Z89: 62 | AA89: 1.84 | AB89: 9.7999999999999997e-003 | AC89: 4.4000000000000003e-003 | AD89: -1.72e-002 | AE89: -1.9299999999999998e-002 | AF89: 89.73 | AG89: 92.14 | AH89: 0.37 | AI89: AA | AJ89: 4.5599999999999995e-002 | AK89: =I89+100*P89 -> 146.999 | AL89: 139.5 | AM89: 163 | AN89: 47.3 | AO89: 160 | AP89: -7.2000000000000008e-002 | AQ89: 17 | AR89: 新北转债!
A90: 46 | B90: 110071 | C90: 湖盐转债 | D90: 44043. | E90: 600929 | F90: 雪天盐业 | G90: 食品饮料 | H90: 食品饮料 | I90: 109.2 | J90: -8.1000000000000013e-003 | K90: -2.3e-002 | L90: 5.98 | M90: -5.8299999999999998e-002 | N90: 115.2 | O90: 6.6 | P90: 0.20499999999999999 | Q90: 90.61 | R90: 2月19天 | S90: 5.69年 | T90: 3.69年 | U90: 7.2 | V90: 5.9 | W90: 6.9999999999999993e-003 | X90: 0.13100000000000001 | Y90: 0.11900000000000001 | Z90: 55 | AA90: 2.17 | AB90: 9.5999999999999992e-003 | AC90: 4.7999999999999996e-003 | AD90: -1.34e-002 | AE90: -1.52e-002 | AF90: 87.45 | AG90: 89.8 | AH90: 0.53 | AI90: AA | AJ90: 4.5599999999999995e-002 | AK90: =I90+100*P90 -> 129.69999999999999 | AL90: 127.8 | AM90: 50 | AN90: 38 | AO90: 77 | AP90: -0.11699999999999999 | AQ90: 11 | AR90: 湖盐转债
A91: 207 | B91: 127012 | C91: 招路转债! | D91: 43585. | E91: 1965. | F91: 招商公路 | G91: 机场高速 | H91: 高速 | I91: 103.978 | J91: -2.5999999999999999e-003 | K91: 1.2999999999999999e-003 | L91: 6.85 | M91: -4.4000000000000003e-003 | N91: 108.2 | O91: 8.81 | P91: 0.33700000000000002 | Q91: 77.75 | R91: 转股中 | S91: 4.39年 | T91: 2.39年 | U91: 50 | V91: 6.3 | W91: 1.e-003 | X91: 0.11800000000000001 | Y91: 9.1999999999999998e-002 | Z91: 423 | AA91: 0.89 | AB91: 9.1999999999999998e-003 | AC91: 5.6999999999999993e-003 | AD91: -7.7000000000000002e-003 | AE91: -9.1999999999999998e-003 | AF91: 92.75 | AG91: 92.09 | AH91: 0.29 | AI91: AAA | AJ91: 3.7900000000000003e-002 | AK91: =I91+100*P91 -> 137.678 | AL91: 130.2 | AM91: 67 | AN91: 37.4 | AO91: 68 | AP91: 5.0000000000000001e-003 | AQ91: 37 | AR91: 招路转债!
A92: 137 | B92: 123039 | C92: 开润转债! | D92: 43853. | E92: 300577 | F92: 开润股份 | G92: 服装纺织 | H92: 纺织行业 | I92: 116.5 | J92: -3.4000000000000002e-002 | K92: 3.0999999999999999e-003 | L92: 30.55 | M92: -4.8300000000000003e-002 | N92: 121.5 | O92: 33.22 | P92: 0.26700000000000002 | Q92: 91.96 | R92: 转股中 | S92: 5年56天 | T92: 3年56天 | U92: 2.22 | V92: 118 | W92: 0.45299999999999996 | X92: 3.3000000000000002e-002 | Y92: 3.1e-002 | Z92: 66 | AA92: 7.56 | AB92: 8.3999999999999995e-003 | AC92: 1.1999999999999999e-003 | AD92: -3.2400000000000005e-002 | AE92: -3.49e-002 | AF92: 81.9 | AG92: 83.49 | AH92: 0.64 | AI92: A+ | AJ92: 7.7600000000000002e-002 | AK92: =I92+100*P92 -> 143.19999999999999 | AL92: 141 | AM92: 179 | AN92: 57.5 | AO92: 217 | AP92: -9.6999999999999989e-002 | AQ92: 24 | AR92: 开润转债!
A93: 253 | B93: 127007 | C93: 湖广转债! | D93: 43313. | E93: 665. | F93: 湖北广电 | G93: 传媒娱乐 | H93: 影视娱乐 | I93: 108.999 | J93: -1.2699999999999999e-002 | K93: 1.2999999999999999e-003 | L93: 5.21 | M93: -2.4300000000000002e-002 | N93: 112.3 | O93: 5.58 | P93: 0.16699999999999998 | Q93: 93.37 | R93: 转股中 | S93: 3.66年 | T93: 1.66年 | U93: 12.2 | V93: 4.8 | W93: 4.0000000000000001e-003 | X93: 0.23800000000000002 | Y93: 0.222 | Z93: 51 | AA93: 0.79 | AB93: 8.3000000000000001e-003 | AC93: 2.0999999999999999e-003 | AD93: -3.1800000000000002e-002 | AE93: -3.4700000000000002e-002 | AF93: 95.6 | AG93: 97.26 | AH93: 0.47 | AI93: AA+ | AJ93: 4.0899999999999999e-002 | AK93: =I93+100*P93 -> 125.699 | AL93: 124.6 | AM93: 24 | AN93: 27.4 | AO93: 12 | AP93: 2.4e-002 | AQ93: 17 | AR93: 湖广转债!
A94: 28 | B94: 113596 | C94: 城地转债! | D94: 44063. | E94: 603887 | F94: 城地香江 | G94: 通信互联 | H94: 通信设备 | I94: 108.31 | J94: -1.e-002 | K94: -6.8000000000000005e-003 | L94: 22.36 | M94: -3.6200000000000003e-002 | N94: 113.5 | O94: 29.21 | P94: 0.41499999999999998 | Q94: 76.55 | R94: 3月6天 | S94: 5.74年 | T94: 3.74年 | U94: 12 | V94: 1.4 | W94: 1.e-003 | X94: 0.14300000000000002 | Y94: 0.109 | Z94: 84 | AA94: 2.32 | AB94: 8.3000000000000001e-003 | AC94: 4.0000000000000001e-003 | AD94: -1.0800000000000001e-002 | AE94: -1.2699999999999999e-002 | AF94: 80.91 | AG94: 78.99 | AH94: 0.46 | AI94: AA- | AJ94: 6.6600000000000006e-002 | AK94: =I94+100*P94 -> 149.81 | AL94: 140.1 | AM94: 169 | AN94: 59.2 | AO94: 224 | AP94: -8.199999999999999e-002 | AQ94: 9 | AR94: 城地转债!
A95: 26 | B95: 123063 | C95: 大禹转债 | D95: 44063. | E95: 300021 | F95: 大禹节水 | G95: 化工 | H95: 橡胶塑料 | I95: 120.785 | J95: -3.95e-002 | K95: -1.5600000000000001e-002 | L95: 5.61 | M95: -7.1199999999999999e-002 | N95: 126.5 | O95: 4.94 | P95: 6.4000000000000001e-002 | Q95: 113.56 | R95: 3月5天 | S95: 5.74年 | T95: 4.74年 | U95: 6.38 | V95: 126 | W95: 0.159 | X95: 0.14300000000000002 | Y95: 0.16200000000000001 | Z95: 45 | AA95: 3.1 | AB95: 8.199999999999999e-003 | AC95: 5.9999999999999995e-004 | AD95: -2.4799999999999999e-002 | AE95: -2.7300000000000001e-002 | AF95: 78.41 | AG95: 88.04 | AH95: 0.77 | AI95: AA- | AJ95: 6.6600000000000006e-002 | AK95: =I95+100*P95 -> 127.185 | AL95: 128 | AM95: 53 | AN95: 40 | AO95: 96 | AP95: -2.e-002 | AQ95: 14 | AR95: 大禹转债
A96: 150 | B96: 110063 | C96: 鹰19转债 | D96: 43833. | E96: 600567 | F96: 山鹰纸业 | G96: 造纸包装 | H96: 包装用纸 | I96: 111.58 | J96: -6.9999999999999993e-003 | K96: -1.1999999999999999e-003 | L96: 3.06 | M96: -1.61e-002 | N96: 116.2 | O96: 3.3 | P96: 0.20300000000000001 | Q96: 92.73 | R96: 转股中 | S96: 5年43天 | T96: 3年43天 | U96: 18.6 | V96: 2.7 | W96: 1.e-003 | X96: 0.13200000000000001 | Y96: 0.12300000000000001 | Z96: 141 | AA96: 0.99 | AB96: 8.1000000000000013e-003 | AC96: 2.3999999999999998e-003 | AD96: -2.2700000000000001e-002 | AE96: -2.4799999999999999e-002 | AF96: 90.12 | AG96: 93.8 | AH96: 0.51 | AI96: AA+ | AJ96: 4.36e-002 | AK96: =I96+100*P96 -> 131.88 | AL96: 130.4 | AM96: 70 | AN96: 36.6 | AO96: 61 | AP96: -2.6000000000000002e-002 | AQ96: 39 | AR96: 鹰19转债
A97: 9 | B97: 128130 | C97: 景兴转债 | D97: 44092. | E97: 2067. | F97: 景兴纸业 | G97: 造纸包装 | H97: 包装用纸 | I97: 110.1 | J97: -1.1699999999999999e-002 | K97: -3.5999999999999999e-003 | L97: 3.18 | M97: -2.75e-002 | N97: 115.1 | O97: 3.4 | P97: 0.17699999999999999 | Q97: 93.53 | R97: 4月4天 | S97: 5.83年 | T97: 3.83年 | U97: 12.8 | V97: 6.4 | W97: 5.0000000000000001e-003 | X97: 0.36200000000000004 | Y97: 0.33899999999999997 | Z97: 35 | AA97: 0.8 | AB97: 7.8000000000000005e-003 | AC97: 3.0999999999999999e-003 | AD97: -1.52e-002 | AE97: -1.6899999999999998e-002 | AF97: 86.8 | AG97: 89.14 | AH97: 0.56 | AI97: AA | AJ97: 4.5599999999999995e-002 | AK97: =I97+100*P97 -> 127.8 | AL97: 126.7 | AM97: 40 | AN97: 37.5 | AO97: 71 | AP97: -6.0999999999999999e-002 | AQ97: 8 | AR97: 景兴转债
A98: 161 | B98: 123033 | C98: 金力转债! | D98: 43794. | E98: 300748 | F98: 金力永磁 | G98: 电子 | H98: 元器件制 | I98: 117.51 | J98: -1.0700000000000001e-002 | K98: 4.0000000000000001e-003 | L98: 38.63 | M98: -1.1000000000000001e-002 | N98: 121.9 | O98: 40.97 | P98: 0.24600000000000002 | Q98: 94.29 | R98: 转股中 | S98: 5年1.1天 | T98: 3年1.1天 | U98: 4.35 | V98: 541 | W98: 1.01 | X98: 2.7000000000000003e-002 | Y98: 2.6000000000000002e-002 | Z98: 161 | AA98: 12.59 | AB98: 7.6e-003 | AC98: 0. | AD98: -3.4300000000000004e-002 | AE98: -3.73e-002 | AF98: 86.23 | AG98: 89.17 | AH98: 0.6 | AI98: AA- | AJ98: 6.6600000000000006e-002 | AK98: =I98+100*P98 -> 142.11000000000001 | AL98: 140.7 | AM98: 175 | AN98: 51.6 | AO98: 188 | AP98: -4.5999999999999999e-002 | AQ98: 26 | AR98: 金力转债!
A99: 38 | B99: 127020 | C99: 中金转债 | D99: 44057. | E99: 60. | F99: 中金岭南 | G99: 有色金属 | H99: 有色行业 | I99: 109.051 | J99: -9.4999999999999998e-003 | K99: -4.0000000000000001e-003 | L99: 4.06 | M99: -2.87e-002 | N99: 113.7 | O99: 4.71 | P99: 0.26500000000000001 | Q99: 86.2 | R99: 2月26天 | S99: 5.72年 | T99: 3.72年 | U99: 38 | V99: 9.2 | W99: 2.e-003 | X99: 0.26200000000000001 | Y99: 0.22600000000000001 | Z99: 145 | AA99: 1.29 | AB99: 7.4000000000000003e-003 | AC99: 3.0999999999999999e-003 | AD99: -1.6e-002 | AE99: -1.72e-002 | AF99: 86.88 | AG99: 89.35 | AH99: 0.47 | AI99: AA+ | AJ99: 4.36e-002 | AK99: =I99+100*P99 -> 135.55099999999999 | AL99: 131.9 | AM99: 90 | AN99: 42.6 | AO99: 120 | AP99: -4.2999999999999997e-002 | AQ99: 11 | AR99: 中金转债
A100: 119 | B100: 113567 | C100: 君禾转债 | D100: 43924. | E100: 603617 | F100: 君禾股份 | G100: 机械装备 | H100: 通用设备 | I100: 114.86 | J100: -2.2000000000000002e-002 | K100: 5.7999999999999996e-003 | L100: 12.16 | M100: -2.0899999999999998e-002 | N100: 119.3 | O100: 11.46 | P100: 8.199999999999999e-002 | Q100: 106.11 | R100: 转股中 | S100: 5.34年 | T100: 3.34年 | U100: 2.1 | V100: 9.2 | W100: 3.7999999999999999e-002 | X100: 8.6999999999999994e-002 | Y100: 9.1999999999999998e-002 | Z100: 24 | AA100: 3.76 | AB100: 7.3000000000000001e-003 | AC100: 1.e-003 | AD100: -2.7000000000000003e-002 | AE100: -2.9399999999999999e-002 | AF100: 80.68 | AG100: 80.85 | AH100: 0.77 | AI100: A+ | AJ100: 7.7600000000000002e-002 | AK100: =I100+100*P100 -> 123.06 | AL100: 123.6 | AM100: 16 | AN100: 42.8 | AO100: 121 | AP100: -1.1000000000000001e-002 | AQ100: 32 | AR100: 君禾转债
A101: 2 | B101: 128133 | C101: 奇正转债! | D101: 44131. | E101: 2287. | F101: 奇正藏药 | G101: 医药 | H101: 中药 | I101: 112.55 | J101: -3.6799999999999999e-002 | K101: 2.2400000000000003e-002 | L101: 25.88 | M101: -3.1400000000000004e-002 | N101: 117.3 | O101: 30.12 | P101: 0.31 | Q101: 85.92 | R101: 4月28天 | S101: 5.89年 | T101: 3.89年 | U101: 8 | V101: 719 | W101: 0.79400000000000004 | X101: 5.7999999999999996e-002 | Y101: 5.0000000000000003e-002 | Z101: 137 | AA101: 5.71 | AB101: 7.1999999999999998e-003 | AC101: 2.e-003 | AD101: -1.9900000000000001e-002 | AE101: -2.1700000000000001e-002 | AF101: 86.76 | AG101: 90.63 | AH101: 0.46 | AI101: AA | AJ101: 4.5599999999999995e-002 | AK101: =I101+100*P101 -> 143.55000000000001 | AL101: 139.2 | AM101: 160 | AN101: 48.5 | AO101: 164 | AP101: -4.4999999999999998e-002 | AQ101: 4 | AR101: 奇正转债!
A102: 172 | B102: 128074 | C102: 游族转债!! | D102: 43759. | E102: 2174. | F102: 游族网络 | G102: 通信互联 | H102: 互联网 | I102: 115.9 | J102: -8.9999999999999998e-004 | K102: -1.1899999999999999e-002 | L102: 15.66 | M102: -2.3099999999999999e-002 | N102: 119.9 | O102: 16.97 | P102: 0.25600000000000001 | Q102: 92.28 | R102: 转股中 | S102: 4.90年 | T102: 2.90年 | U102: 6.83 | V102: 29 | W102: 3.6000000000000004e-002 | X102: 4.8000000000000001e-002 | Y102: 4.4000000000000004e-002 | Z102: 143 | AA102: 2.54 | AB102: 7.0999999999999995e-003 | AC102: 0. | AD102: -3.6900000000000002e-002 | AE102: -3.8900000000000004e-002 | AF102: 91.02 | AG102: 97.97 | AH102: 0.55 | AI102: AA | AJ102: 4.2900000000000001e-002 | AK102: =I102+100*P102 -> 141.5 | AL102: 139.5 | AM102: 164 | AN102: 41.6 | AO102: 111 | AP102: -7.5999999999999998e-002 | AQ102: 21 | AR102: 游族转债!!
A103: 106 | B103: 128101 | C103: 联创转债! | D103: 43934. | E103: 2036. | F103: 联创电子 | G103: 电子 | H103: 液晶显示 | I103: 111.02 | J103: -1.0700000000000001e-002 | K103: 4.4000000000000003e-003 | L103: 10.07 | M103: -2.52e-002 | N103: 115.1 | O103: 14.48 | P103: 0.59599999999999997 | Q103: 69.54 | R103: 转股中 | S103: 5.37年 | T103: 3.37年 | U103: 3 | V103: 76 | W103: 0.22899999999999998 | X103: 3.2000000000000001e-002 | Y103: 2.2000000000000002e-002 | Z103: 94 | AA103: 3.75 | AB103: 6.8999999999999999e-003 | AC103: 1.8e-003 | AD103: -1.95e-002 | AE103: -2.1400000000000002e-002 | AF103: 88.6 | AG103: 90.99 | AH103: 0.25 | AI103: AA | AJ103: 4.5599999999999995e-002 | AK103: =I103+100*P103 -> 170.62 | AL103: 152.5 | AM103: 238 | AN103: 61.5 | AO103: 237 | AP103: -8.199999999999999e-002 | AQ103: 15 | AR103: 联创转债!
A104: 276 | B104: 123004 | C104: 铁汉转债! | D104: 43126. | E104: 300197 | F104: 铁汉生态 | G104: 城市公用 | H104: 生态环境 | I104: 107.612 | J104: -1.6299999999999999e-002 | K104: -5.7999999999999996e-003 | L104: 3.57 | M104: -5.3099999999999994e-002 | N104: 109.8 | O104: 3.98 | P104: 0.20000000000000001 | Q104: 89.7 | R104: 转股中 | S104: 3年48天 | T104: 1年48天 | U104: 8.03 | V104: 22 | W104: 2.6000000000000002e-002 | X104: 9.6000000000000002e-002 | Y104: 8.5999999999999993e-002 | Z104: 84 | AA104: 1.6 | AB104: 6.6e-003 | AC104: 7.000000000000001e-004 | AD104: -3.6799999999999999e-002 | AE104: -4.0399999999999998e-002 | AF104: 97.16 | AG104: 96.54 | AH104: 0.42 | AI104: AA | AJ104: 4.2900000000000001e-002 | AK104: =I104+100*P104 -> 127.61199999999999 | AL104: 125.5 | AM104: 27 | AN104: 28.4 | AO104: 14 | AP104: -8.6999999999999994e-002 | AQ104: 38 | AR104: 铁汉转债!
A105: 169 | B105: 128076 | C105: 金轮转债! | D105: 43777. | E105: 2722. | F105: 金轮股份 | G105: 机械装备 | H105: 专用设备 | I105: 111.3 | J105: -4.7899999999999998e-002 | K105: 5.3399999999999996e-002 | L105: 12.67 | M105: 1.04e-002 | N105: 114.9 | O105: 14.76 | P105: 0.29699999999999999 | Q105: 85.84 | R105: 转股中 | S105: 4.95年 | T105: 2.95年 | U105: 2.14 | V105: 192 | W105: 0.79200000000000004 | X105: 9.6000000000000002e-002 | Y105: 8.3000000000000004e-002 | Z105: 22 | AA105: 1.2 | AB105: 6.6e-003 | AC105: 1.1000000000000001e-003 | AD105: -2.35e-002 | AE105: -2.5499999999999998e-002 | AF105: 85.37 | AG105: 85.03 | AH105: 0.52 | AI105: AA- | AJ105: 6.3899999999999998e-002 | AK105: =I105+100*P105 -> 141. | AL105: 136.8 | AM105: 142 | AN105: 51.4 | AO105: 186 | AP105: -1.6e-002 | AQ105: 41 | AR105: 金轮转债!
A106: 84 | B106: 113578 | C106: 全筑转债 | D106: 43970. | E106: 603030 | F106: 全筑股份 | G106: 建筑 | H106: 装饰工程 | I106: 114.26 | J106: -2.3099999999999999e-002 | K106: -2.3e-003 | L106: 5.28 | M106: -4.5199999999999997e-002 | N106: 118.3 | O106: 5.43 | P106: 0.17499999999999999 | Q106: 97.24 | R106: 转股中 | S106: 5.47年 | T106: 3.47年 | U106: 3.84 | V106: 6.9 | W106: 1.6e-002 | X106: 0.13500000000000001 | Y106: 0.13100000000000001 | Z106: 28 | AA106: 1.28 | AB106: 6.5000000000000006e-003 | AC106: 5.9999999999999995e-004 | AD106: -2.63e-002 | AE106: -2.8199999999999999e-002 | AF106: 88.41 | AG106: 93.14 | AH106: 0.56 | AI106: AA | AJ106: 4.5599999999999995e-002 | AK106: =I106+100*P106 -> 131.75999999999999 | AL106: 131.3 | AM106: 81 | AN106: 38.1 | AO106: 80 | AP106: -9.6000000000000002e-002 | AQ106: 10 | AR106: 全筑转债
A107: 3 | B107: 123067 | C107: 斯莱转债 | D107: 44119. | E107: 300382 | F107: 斯莱克 | G107: 机械装备 | H107: 专用设备 | I107: 116.78 | J107: -4.2800000000000005e-002 | K107: 2.4500000000000001e-002 | L107: 9.97 | M107: -2.4500000000000001e-002 | N107: 121.2 | O107: 9.38 | P107: 9.9000000000000005e-002 | Q107: 106.29 | R107: 4月23天 | S107: 5.88年 | T107: 3.88年 | U107: 3.88 | V107: 156 | W107: 0.33899999999999997 | X107: 6.9000000000000006e-002 | Y107: 7.2999999999999995e-002 | Z107: 56 | AA107: 5.66 | AB107: 6.5000000000000006e-003 | AC107: 2.9999999999999997e-004 | AD107: -2.8199999999999999e-002 | AE107: -3.0099999999999998e-002 | AF107: 80.43 | AG107: 83.61 | AH107: 0.75 | AI107: AA- | AJ107: 6.6600000000000006e-002 | AK107: =I107+100*P107 -> 126.68000000000001 | AL107: 127.3 | AM107: 48 | AN107: 43.7 | AO107: 127 | AP107: 3.7000000000000005e-002 | AQ107: 6 | AR107: 斯莱转债
A108: 139 | B108: 113030 | C108: 东风转债 | D108: 43850. | E108: 601515 | F108: 东风股份 | G108: 造纸包装 | H108: 包装材料 | I108: 113.65 | J108: -9.7999999999999997e-003 | K108: 3.5999999999999999e-003 | L108: 6.04 | M108: -1.3100000000000001e-002 | N108: 117.3 | O108: 6.75 | P108: 0.27000000000000002 | Q108: 89.48 | R108: 转股中 | S108: 5年54天 | T108: 3年54天 | U108: 2.95 | V108: 4.7 | W108: 1.3999999999999999e-002 | X108: 3.7000000000000005e-002 | Y108: 3.3000000000000002e-002 | Z108: 81 | AA108: 1.98 | AB108: 6.3e-003 | AC108: 2.9999999999999997e-004 | AD108: -2.7300000000000001e-002 | AE108: -2.9399999999999999e-002 | AF108: 89.7 | AG108: 93.69 | AH108: 0.47 | AI108: AA | AJ108: 4.5599999999999995e-002 | AK108: =I108+100*P108 -> 140.65000000000001 | AL108: 137.8 | AM108: 151 | AN108: 44.1 | AO108: 132 | AP108: -1.1000000000000001e-002 | AQ108: 15 | AR108: 东风转债
A109: 102 | B109: 110068 | C109: 龙净转债! | D109: 43936. | E109: 600388 | F109: 龙净环保 | G109: 城市公用 | H109: 三废处理 | I109: 111.4 | J109: -9.3999999999999986e-003 | K109: 1.1000000000000001e-002 | L109: 10.1 | M109: 3.0000000000000001e-003 | N109: 115 | O109: 10.73 | P109: 0.183 | Q109: 94.13 | R109: 转股中 | S109: 5.39年 | T109: 3.39年 | U109: 20 | V109: 4.4 | W109: 2.e-003 | X109: 0.185 | Y109: 0.17399999999999999 | Z109: 108 | AA109: 2 | AB109: 6.0000000000000001e-003 | AC109: 1.e-003 | AD109: -2.06e-002 | AE109: -2.2400000000000003e-002 | AF109: 89.02 | AG109: 91.73 | AH109: 0.54 | AI109: AA+ | AJ109: 4.36e-002 | AK109: =I109+100*P109 -> 129.70000000000002 | AL109: 128.7 | AM109: 56 | AN109: 36.9 | AO109: 62 | AP109: 4.0999999999999995e-002 | AQ109: 29 | AR109: 龙净转债!
A110: 124 | B110: 113565 | C110: 宏辉转债 | D110: 43906. | E110: 603336 | F110: 宏辉果蔬 | G110: 农业 | H110: 农产品加 | I110: 114.86 | J110: -2.41e-002 | K110: -1.3300000000000001e-002 | L110: 10.07 | M110: -5.2699999999999997e-002 | N110: 118.2 | O110: 10 | P110: 0.14099999999999999 | Q110: 100.7 | R110: 转股中 | S110: 5.32年 | T110: 3.32年 | U110: 3.09 | V110: 17 | W110: 4.9000000000000002e-002 | X110: 9.3000000000000013e-002 | Y110: 9.4e-002 | Z110: 33 | AA110: 3.7 | AB110: 5.5000000000000005e-003 | AC110: -5.0000000000000001e-004 | AD110: -2.81e-002 | AE110: -3.0200000000000001e-002 | AF110: 83.38 | AG110: 84.53 | AH110: 0.71 | AI110: AA- | AJ110: 6.6600000000000006e-002 | AK110: =I110+100*P110 -> 128.96000000000001 | AL110: 129 | AM110: 58 | AN110: 44.5 | AO110: 135 | AP110: -0.106 | AQ110: 19 | AR110: 宏辉转债
A111: 123 | B111: 113564 | C111: 天目转债 | D111: 43906. | E111: 603136 | F111: 天目湖 | G111: 旅游餐饮 | H111: 旅游 | I111: 123.16 | J111: -6.3e-003 | K111: 1.83e-002 | L111: 26.84 | M111: 1.5900000000000001e-002 | N111: 126.7 | O111: 23.8 | P111: 9.1999999999999998e-002 | Q111: 112.77 | R111: 转股中 | S111: 5.33年 | T111: 3.33年 | U111: 3 | V111: 38 | W111: 0.10099999999999999 | X111: 9.6000000000000002e-002 | Y111: 0.109 | Z111: 31 | AA111: 3.34 | AB111: 5.5000000000000005e-003 | AC111: -2.8000000000000004e-003 | AD111: -4.6199999999999998e-002 | AE111: -4.8499999999999995e-002 | AF111: 83.77 | AG111: 90.6 | AH111: 0.75 | AI111: AA- | AJ111: 6.6600000000000006e-002 | AK111: =I111+100*P111 -> 132.35999999999999 | AL111: 133.5 | AM111: 109 | AN111: 42.9 | AO111: 124 | AP111: 1.2e-002 | AQ111: 13 | AR111: 天目转债
A112: 278 | B112: 128025 | C112: 特一转债! | D112: 43097. | E112: 2728. | F112: 特一药业 | G112: 医药 | H112: 化学制药 | I112: 108.024 | J112: -3.8399999999999997e-002 | K112: 4.0500000000000001e-002 | L112: 12.95 | M112: 4.6999999999999993e-003 | N112: 109.8 | O112: 14.7 | P112: 0.22600000000000001 | Q112: 88.1 | R112: 转股中 | S112: 3年36天 | T112: 1年36天 | U112: 2.99 | V112: 84 | W112: 0.25700000000000001 | X112: 0.113 | Y112: 0.10000000000000001 | Z112: 26 | AA112: 2.61 | AB112: 5.4000000000000003e-003 | AC112: -5.9999999999999995e-004 | AD112: -4.07e-002 | AE112: -4.4400000000000002e-002 | AF112: 94.9 | AG112: 91.01 | AH112: 0.45 | AI112: AA- | AJ112: 6.3899999999999998e-002 | AK112: =I112+100*P112 -> 130.624 | AL112: 128 | AM112: 52 | AN112: 33.1 | AO112: 34 | AP112: -3.4000000000000002e-002 | AQ112: 42 | AR112: 特一转债!
A113: 230 | B113: 128050 | C113: 钧达转债! | D113: 43461. | E113: 2865. | F113: 钧达股份 | G113: 汽车 | H113: 零部件制 | I113: 121 | J113: -4.7199999999999999e-002 | K113: 3.1099999999999999e-002 | L113: 15.48 | M113: -2.64e-002 | N113: 123.5 | O113: 14.85 | P113: 0.161 | Q113: 104.24 | R113: 转股中 | S113: 4年40天 | T113: 2年40天 | U113: 2.99 | V113: 411 | W113: 1.1200000000000001 | X113: 0.16 | Y113: 0.16699999999999998 | Z113: 19 | AA113: 2.17 | AB113: 5.1000000000000004e-003 | AC113: -4.5000000000000005e-003 | AD113: -6.59e-002 | AE113: -6.88e-002 | AF113: 90.37 | AG113: 96.34 | AH113: 0.61 | AI113: AA- | AJ113: 6.3899999999999998e-002 | AK113: =I113+100*P113 -> 137.09999999999999 | AL113: 137.8 | AM113: 150 | AN113: 41.4 | AO113: 110 | AP113: -5.9999999999999998e-002 | AQ113: 61 | AR113: 钧达转债!
A114: 10 | B114: 128129 | C114: 青农转债 | D114: 44092. | E114: 2958. | F114: 青农商行 | G114: 金融 | H114: 银行行业 | I114: 109.08 | J114: -8.8000000000000005e-003 | K114: -2.5000000000000001e-003 | L114: 4.71 | M114: -2.69e-002 | N114: 112.2 | O114: 5.74 | P114: 0.32899999999999996 | Q114: 82.06 | R114: 4月1天 | S114: 5.82年 | T114: 无权 | U114: 50 | V114: 26 | W114: 5.0000000000000001e-003 | X114: 0.191 | Y114: 0.157 | Z114: 262 | AA114: 1.01 | AB114: 4.8999999999999998e-003 | AC114: 1.1000000000000001e-003 | AD114: 无权 | AE114: 无权 | AF114: 无权 | AG114: 89.3 | AH114: 0.42 | AI114: AAA | AJ114: 4.0599999999999997e-002 | AK114: =I114+100*P114 -> 141.97999999999999 | AL114: 136.1 | AM114: 136 | AN114: 46.8 | AO114: 155 | AP114: -8.5999999999999993e-002 | AQ114: 10 | AR114: 青农转债
A115: 66 | B115: 123054 | C115: 思特转债 | D115: 44018. | E115: 300608 | F115: 思特奇 | G115: 通信互联 | H115: 通信设备 | I115: 118.562 | J115: -7.7300000000000008e-002 | K115: -2.e-003 | L115: 17.7 | M115: -0.107 | N115: 121.7 | O115: 16.49 | P115: 0.105 | Q115: 107.34 | R115: 46天 | S115: 5.61年 | T115: 3.61年 | U115: 2.71 | V115: 219 | W115: 0.66799999999999993 | X115: 9.6999999999999989e-002 | Y115: 0.10400000000000001 | Z115: 28 | AA115: 3.61 | AB115: 4.7999999999999996e-003 | AC115: -1.8e-003 | AD115: -3.3000000000000002e-002 | AE115: -3.5200000000000002e-002 | AF115: 82.26 | AG115: 85.5 | AH115: 0.75 | AI115: AA- | AJ115: 6.6600000000000006e-002 | AK115: =I115+100*P115 -> 129.06200000000001 | AL115: 129.8 | AM115: 63 | AN115: 44.3 | AO115: 133 | AP115: -3.1e-002 | AQ115: 12 | AR115: 思特转债
A116: 210 | B116: 110056 | C116: 亨通转债! | D116: 43571. | E116: 600487 | F116: 亨通光电 | G116: 通信互联 | H116: 通信设备 | I116: 112.6 | J116: -3.4999999999999996e-003 | K116: 1.5e-003 | L116: 14.66 | M116: -4.0999999999999995e-003 | N116: 114.8 | O116: 15.58 | P116: 0.19699999999999998 | Q116: 94.09 | R116: 转股中 | S116: 4.38年 | T116: 2.38年 | U116: 17.1 | V116: 6.6 | W116: 3.0000000000000001e-003 | X116: 5.9999999999999998e-002 | Y116: 5.5999999999999994e-002 | Z116: 286 | AA116: 1.97 | AB116: 4.5000000000000005e-003 | AC116: -1.6000000000000001e-003 | AD116: -3.3599999999999998e-002 | AE116: -3.6000000000000004e-002 | AF116: 93.36 | AG116: 96.65 | AH116: 0.49 | AI116: AA+ | AJ116: 4.0899999999999999e-002 | AK116: =I116+100*P116 -> 132.29999999999998 | AL116: 131.1 | AM116: 74 | AN116: 34.5 | AO116: 41 | AP116: -2.4e-002 | AQ116: 29 | AR116: 亨通转债!
A117: 227 | B117: 113525 | C117: 台华转债! | D117: 43476. | E117: 603055 | F117: 台华新材 | G117: 服装纺织 | H117: 纺织行业 | I117: 112.87 | J117: -1.52e-002 | K117: -8.1000000000000013e-003 | L117: 7.55 | M117: -4.7899999999999998e-002 | N117: 114.9 | O117: 8.03 | P117: 0.20000000000000001 | Q117: 94.02 | R117: 转股中 | S117: 4年47天 | T117: 2年47天 | U117: 4.69 | V117: 4.9 | W117: 9.0000000000000011e-003 | X117: 8.0000000000000002e-002 | Y117: 7.4999999999999997e-002 | Z117: 58 | AA117: 2.21 | AB117: 4.4000000000000003e-003 | AC117: -2.0999999999999999e-003 | AD117: -3.7900000000000003e-002 | AE117: -4.0599999999999997e-002 | AF117: 94 | AG117: 96.97 | AH117: 0.49 | AI117: AA | AJ117: 4.2900000000000001e-002 | AK117: =I117+100*P117 -> 132.87 | AL117: 131.7 | AM117: 87 | AN117: 34.7 | AO117: 45 | AP117: -0.153 | AQ117: 22 | AR117: 台华转债!
A118: 19 | B118: 127021 | C118: 特发转2! | D118: 44078. | E118: 70. | F118: 特发信息 | G118: 通信互联 | H118: 通信设备 | I118: 111.003 | J118: -1.15e-002 | K118: 1.6000000000000001e-003 | L118: 9.9 | M118: -2.8500000000000001e-002 | N118: 113.3 | O118: 12.33 | P118: 0.38200000000000001 | Q118: 80.29 | R118: 3月15天 | S118: 4.77年 | T118: 2.77年 | U118: 5.5 | V118: 23 | W118: 3.6000000000000004e-002 | X118: 6.8000000000000005e-002 | Y118: 5.5e-002 | Z118: 81 | AA118: 2.85 | AB118: 4.4000000000000003e-003 | AC118: -7.000000000000001e-004 | AD118: -2.8399999999999998e-002 | AE118: -2.9700000000000001e-002 | AF118: 90.27 | AG118: 92.95 | AH118: 0.35 | AI118: AA | AJ118: 4.2900000000000001e-002 | AK118: =I118+100*P118 -> 149.203 | AL118: 141.7 | AM118: 183 | AN118: 48.8 | AO118: 167 | AP118: -1.8000000000000002e-002 | AQ118: 5 | AR118: 特发转2!
A119: 32 | B119: 128122 | C119: 兴森转债 | D119: 44060. | E119: 2436. | F119: 兴森科技 | G119: 电子 | H119: 元器件制 | I119: 111.1 | J119: -3.4000000000000002e-002 | K119: 3.4000000000000002e-002 | L119: 10.59 | M119: 0. | N119: 113.3 | O119: 14.18 | P119: 0.48799999999999999 | Q119: 74.68 | R119: 3月0天 | S119: 4.73年 | T119: 3.73年 | U119: 2.69 | V119: 100 | W119: 0.32799999999999996 | X119: 1.7000000000000001e-002 | Y119: 1.3000000000000001e-002 | Z119: 158 | AA119: 4.99 | AB119: 4.1999999999999997e-003 | AC119: -8.9999999999999998e-004 | AD119: -1.78e-002 | AE119: -1.9599999999999999e-002 | AF119: 88.12 | AG119: 93.11 | AH119: 0.27 | AI119: AA | AJ119: 4.2900000000000001e-002 | AK119: =I119+100*P119 -> 159.89999999999998 | AL119: 147.5 | AM119: 219 | AN119: 54.4 | AO119: 205 | AP119: -4.9000000000000002e-002 | AQ119: 6 | AR119: 兴森转债
A120: 141 | B120: 113559 | C120: 永创转债! | D120: 43840. | E120: 603901 | F120: 永创智能 | G120: 机械装备 | H120: 专用设备 | I120: 116.55 | J120: -1.9199999999999998e-002 | K120: 1.9e-003 | L120: 9.51 | M120: -2.86e-002 | N120: 118.9 | O120: 10.32 | P120: 0.26500000000000001 | Q120: 92.15 | R120: 转股中 | S120: 5年53天 | T120: 3年53天 | U120: 5.1 | V120: 3.6 | W120: 6.0000000000000001e-003 | X120: 0.122 | Y120: 0.11199999999999999 | Z120: 42 | AA120: 3.02 | AB120: 4.0000000000000001e-003 | AC120: -2.3999999999999998e-003 | AD120: -3.15e-002 | AE120: -3.4300000000000004e-002 | AF120: 85.11 | AG120: 86.15 | AH120: 0.6 | AI120: AA- | AJ120: 6.6600000000000006e-002 | AK120: =I120+100*P120 -> 143.05000000000001 | AL120: 140.9 | AM120: 177 | AN120: 54.8 | AO120: 207 | AP120: -1.6e-002 | AQ120: 23 | AR120: 永创转债!
A121: 192 | B121: 128066 | C121: 亚泰转债! | D121: 43599. | E121: 2811. | F121: 郑中设计 | G121: 建筑 | H121: 装饰工程 | I121: 115.6 | J121: -7.9000000000000008e-003 | K121: -9.3999999999999986e-003 | L121: 10.5 | M121: -2.3300000000000001e-002 | N121: 117.5 | O121: 9.67 | P121: 6.5000000000000002e-002 | Q121: 108.58 | R121: 转股中 | S121: 4.46年 | T121: 2.46年 | U121: 4.8 | V121: 11 | W121: 1.9e-002 | X121: 0.16899999999999998 | Y121: 0.184 | Z121: 28 | AA121: 1.92 | AB121: 3.7000000000000002e-003 | AC121: -3.2000000000000002e-003 | AD121: -4.0500000000000001e-002 | AE121: -4.3099999999999999e-002 | AF121: 88.43 | AG121: 89.72 | AH121: 0.74 | AI121: AA- | AJ121: 6.3899999999999998e-002 | AK121: =I121+100*P121 -> 122.09999999999999 | AL121: 122.6 | AM121: 12 | AN121: 32.9 | AO121: 31 | AP121: 2.e-003 | AQ121: 57 | AR121: 亚泰转债!
A122: 252 | B122: 123010 | C122: 博世转债! | D122: 43326. | E122: 300422 | F122: 博世科 | G122: 城市公用 | H122: 三废处理 | I122: 111 | J122: -1.6e-002 | K122: 2.0799999999999999e-002 | L122: 11.3 | M122: 8.8999999999999999e-003 | N122: 112.3 | O122: 12.2 | P122: 0.19800000000000001 | Q122: 92.62 | R122: 转股中 | S122: 3.68年 | T122: 1.68年 | U122: 4.3 | V122: 19 | W122: 3.9e-002 | X122: 9.4e-002 | Y122: 8.6999999999999994e-002 | Z122: 46 | AA122: 1.94 | AB122: 3.2000000000000002e-003 | AC122: -2.8999999999999998e-003 | AD122: -4.1100000000000005e-002 | AE122: -4.3899999999999995e-002 | AF122: 91.79 | AG122: 89.82 | AH122: 0.54 | AI122: AA- | AJ122: 6.3899999999999998e-002 | AK122: =I122+100*P122 -> 130.80000000000001 | AL122: 129.4 | AM122: 60 | AN122: 37.6 | AO122: 72 | AP122: -3.4000000000000002e-002 | AQ122: 25 | AR122: 博世转债!
A123: 88 | B123: 123049 | C123: 维尔转债 | D123: 43963. | E123: 300190 | F123: 维尔利 | G123: 城市公用 | H123: 三废处理 | I123: 122.9 | J123: -1.6e-002 | K123: -2.23e-002 | L123: 8.24 | M123: -5.1799999999999999e-002 | N123: 124.8 | O123: 7.48 | P123: 0.11599999999999999 | Q123: 110.16 | R123: 转股中 | S123: 5.45年 | T123: 3.45年 | U123: 9.17 | V123: 8.9 | W123: 8.0000000000000002e-003 | X123: 0.14199999999999999 | Y123: 0.157 | Z123: 64 | AA123: 1.53 | AB123: 2.8999999999999998e-003 | AC123: -4.6999999999999993e-003 | AD123: -4.3799999999999999e-002 | AE123: -4.6100000000000002e-002 | AF123: 83.2 | AG123: 88.58 | AH123: 0.74 | AI123: AA- | AJ123: 6.6600000000000006e-002 | AK123: =I123+100*P123 -> 134.5 | AL123: 135.6 | AM123: 132 | AN123: 47.1 | AO123: 157 | AP123: -5.9999999999999998e-002 | AQ123: 12 | AR123: 维尔转债
A124: 261 | B124: 127006 | C124: 敖东转债! | D124: 43231. | E124: 623. | F124: 吉林敖东 | G124: 金融 | H124: 证券行业 | I124: 107.1 | J124: -7.7000000000000002e-003 | K124: 3.5999999999999999e-003 | L124: 16.81 | M124: -1.3500000000000002e-002 | N124: 108 | O124: 20.42 | P124: 0.30099999999999999 | Q124: 82.32 | R124: 转股中 | S124: 3.36年 | T124: 1.36年 | U124: 24.1 | V124: 2 | W124: 1.e-003 | X124: 0.12300000000000001 | Y124: 0.10099999999999999 | Z124: 196 | AA124: 0.87 | AB124: 2.5000000000000001e-003 | AC124: -2.e-003 | AD124: -3.3599999999999998e-002 | AE124: -3.56e-002 | AF124: 95.65 | AG124: 94.55 | AH124: 0.31 | AI124: AA+ | AJ124: 4.0899999999999999e-002 | AK124: =I124+100*P124 -> 137.19999999999999 | AL124: 131.9 | AM124: 89 | AN124: 36.2 | AO124: 57 | AP124: -2.1000000000000001e-002 | AQ124: 26 | AR124: 敖东转债!
A125: 186 | B125: 113027 | C125: 华钰转债!! | D125: 43656. | E125: 601020 | F125: 华钰矿业 | G125: 有色金属 | H125: 锌铅镍锡 | I125: 113.74 | J125: -6.0000000000000001e-003 | K125: -2.6000000000000002e-002 | L125: 9.38 | M125: -5.4400000000000004e-002 | N125: 114.9 | O125: 10.17 | P125: 0.23300000000000001 | Q125: 92.23 | R125: 转股中 | S125: 4.62年 | T125: 2.62年 | U125: 3.26 | V125: 20 | W125: 5.5e-002 | X125: 6.3e-002 | Y125: 5.7999999999999996e-002 | Z125: 52 | AA125: 2.37 | AB125: 2.2000000000000001e-003 | AC125: -3.4999999999999996e-003 | AD125: -3.39e-002 | AE125: -3.6200000000000003e-002 | AF125: 87.16 | AG125: 86.81 | AH125: 0.59 | AI125: AA- | AJ125: 6.3899999999999998e-002 | AK125: =I125+100*P125 -> 137.03999999999999 | AL125: 135.2 | AM125: 126 | AN125: 48.1 | AO125: 163 | AP125: -0.12 | AQ125: 46 | AR125: 华钰转债!!
A126: 83 | B126: 128107 | C126: 交科转债 | D126: 43973. | E126: 2061. | F126: 浙江交科 | G126: 建筑 | H126: 建筑工程 | I126: 114.5 | J126: -9.8999999999999991e-003 | K126: -1.2e-002 | L126: 5.32 | M126: -3.6200000000000003e-002 | N126: 115.3 | O126: 5.36 | P126: 0.154 | Q126: 99.25 | R126: 转股中 | S126: 5.47年 | T126: 3.47年 | U126: 25 | V126: 5.2 | W126: 2.e-003 | X126: 0.34200000000000003 | Y126: 0.33899999999999997 | Z126: 73 | AA126: 0.91 | AB126: 1.2999999999999999e-003 | AC126: -3.7000000000000002e-003 | AD126: -2.6800000000000001e-002 | AE126: -2.8799999999999999e-002 | AF126: 89 | AG126: 91.71 | AH126: 0.6 | AI126: AA+ | AJ126: 4.36e-002 | AK126: =I126+100*P126 -> 129.90000000000001 | AL126: 129.7 | AM126: 61 | AN126: 38 | AO126: 78 | AP126: -7.400000000000001e-002 | AQ126: 14 | AR126: 交科转债
A127: 72 | B127: 113584 | C127: 家悦转债 | D127: 44006. | E127: 603708 | F127: 家家悦 | G127: 商业零售 | H127: 超市 | I127: 114.54 | J127: -1.5300000000000001e-002 | K127: 5.8999999999999999e-003 | L127: 28.68 | M127: -2.8500000000000001e-002 | N127: 115.3 | O127: 37.97 | P127: 0.51600000000000001 | Q127: 75.53 | R127: 42天 | S127: 5.59年 | T127: 3.59年 | U127: 6.45 | V127: 4.3 | W127: 6.0000000000000001e-003 | X127: 3.7000000000000005e-002 | Y127: 2.7999999999999997e-002 | Z127: 174 | AA127: 6.02 | AB127: 1.1999999999999999e-003 | AC127: -3.7000000000000002e-003 | AD127: -2.6099999999999998e-002 | AE127: -2.7900000000000001e-002 | AF127: 87.92 | AG127: 90.29 | AH127: 0.33 | AI127: AA | AJ127: 4.5599999999999995e-002 | AK127: =I127+100*P127 -> 166.14000000000001 | AL127: 153.5 | AM127: 240 | AN127: 63.3 | AO127: 241 | AP127: -0.14199999999999999 | AQ127: 4 | AR127: 家悦转债
A128: 65 | B128: 128111 | C128: 中矿转债 | D128: 44019. | E128: 2738. | F128: 中矿资源 | G128: 有色金属 | H128: 有色行业 | I128: 123.973 | J128: -1.8600000000000002e-002 | K128: -1.1000000000000001e-003 | L128: 18.25 | M128: -2.46e-002 | N128: 124.7 | O128: 15.53 | P128: 5.5e-002 | Q128: 117.51 | R128: 47天 | S128: 5.61年 | T128: 3.61年 | U128: 8 | V128: 8.1 | W128: 8.0000000000000002e-003 | X128: 0.158 | Y128: 0.185 | Z128: 51 | AA128: 1.89 | AB128: 1.1000000000000001e-003 | AC128: -6.1999999999999998e-003 | AD128: -4.4400000000000002e-002 | AE128: -4.6600000000000003e-002 | AF128: 82.25 | AG128: 87.57 | AH128: 0.8 | AI128: AA- | AJ128: 6.6600000000000006e-002 | AK128: =I128+100*P128 -> 129.47300000000001 | AL128: 130.4 | AM128: 69 | AN128: 42.9 | AO128: 122 | AP128: -4.4999999999999998e-002 | AQ128: 6 | AR128: 中矿转债
A129: 231 | B129: 110048 | C129: 福能转债! | D129: 43462. | E129: 600483 | F129: 福能股份 | G129: 能源电力 | H129: 电力供应 | I129: 113.62 | J129: -5.5000000000000005e-003 | K129: 4.1999999999999997e-003 | L129: 7.64 | M129: -2.5999999999999999e-003 | N129: 113.9 | O129: 8.12 | P129: 0.20800000000000002 | Q129: 94.09 | R129: 转股中 | S129: 4年37天 | T129: 2年37天 | U129: 28.3 | V129: 12 | W129: 4.0000000000000001e-003 | X129: 0.20999999999999999 | Y129: 0.19800000000000001 | Z129: 134 | AA129: 0.95 | AB129: 5.9999999999999995e-004 | AC129: -5.5000000000000005e-003 | AD129: -4.1200000000000001e-002 | AE129: -4.3899999999999995e-002 | AF129: 94.52 | AG129: 96.99 | AH129: 0.49 | AI129: AA+ | AJ129: 4.0899999999999999e-002 | AK129: =I129+100*P129 -> 134.42000000000002 | AL129: 133.2 | AM129: 101 | AN129: 36.2 | AO129: 56 | AP129: -4.2000000000000003e-002 | AQ129: 9 | AR129: 福能转债!
A130: 6 | B130: 128131 | C130: 崇达转2 | D130: 44102. | E130: 2815. | F130: 崇达技术 | G130: 电子 | H130: 元器件制 | I130: 114.92 | J130: -1.6000000000000001e-003 | K130: -1.6e-002 | L130: 16.75 | M130: -3.6799999999999999e-002 | N130: 115.2 | O130: 19.54 | P130: 0.34100000000000003 | Q130: 85.72 | R130: 4月11天 | S130: 5.85年 | T130: 3.85年 | U130: 14 | V130: 9.1 | W130: 6.0000000000000001e-003 | X130: 9.5000000000000001e-002 | Y130: 8.1000000000000003e-002 | Z130: 148 | AA130: 3.82 | AB130: 4.0000000000000002e-004 | AC130: -4.1999999999999997e-003 | AD130: -2.5399999999999999e-002 | AE130: -2.7099999999999999e-002 | AF130: 86.82 | AG130: 89.16 | AH130: 0.48 | AI130: AA | AJ130: 4.5599999999999995e-002 | AK130: =I130+100*P130 -> 149.02000000000001 | AL130: 144.1 | AM130: 203 | AN130: 55 | AO130: 208 | AP130: -4.8000000000000001e-002 | AQ130: 3 | AR130: 崇达转2
A131: 87 | B131: 123050 | C131: 聚飞转债 | D131: 43966. | E131: 300303 | F131: 聚飞光电 | G131: 电子 | H131: LED制 | I131: 124.6 | J131: -1.0200000000000001e-002 | K131: -2.6800000000000001e-002 | L131: 5.65 | M131: -5.04e-002 | N131: 124.2 | O131: 5.18 | P131: 0.14199999999999999 | Q131: 109.07 | R131: 转股中 | S131: 5.45年 | T131: 3.45年 | U131: 7.05 | V131: 24 | W131: 2.7000000000000003e-002 | X131: 9.8000000000000004e-002 | Y131: 0.106 | Z131: 72 | AA131: 3.11 | AB131: -5.9999999999999995e-004 | AC131: -8.0000000000000002e-003 | AD131: -4.8899999999999999e-002 | AE131: -5.0900000000000001e-002 | AF131: 82.68 | AG131: 88.06 | AH131: 0.73 | AI131: AA- | AJ131: 6.6600000000000006e-002 | AK131: =I131+100*P131 -> 138.79999999999998 | AL131: 140.1 | AM131: 170 | AN131: 52.1 | AO131: 190 | AP131: -0.121 | AQ131: 11 | AR131: 聚飞转债
A132: 232 | B132: 128049 | C132: 华源转债! | D132: 43454. | E132: 2787. | F132: 华源控股 | G132: 造纸包装 | H132: 包装材料 | I132: 115.5 | J132: -2.6800000000000001e-002 | K132: -1.43e-002 | L132: 6.97 | M132: -7.1900000000000006e-002 | N132: 115.2 | O132: 7.42 | P132: 0.23000000000000001 | Q132: 93.94 | R132: 转股中 | S132: 4年27天 | T132: 2年27天 | U132: 3.63 | V132: 7.3 | W132: 1.7000000000000001e-002 | X132: 0.16500000000000001 | Y132: 0.155 | Z132: 22 | AA132: 1.47 | AB132: -7.000000000000001e-004 | AC132: -7.3000000000000001e-003 | AD132: -4.82e-002 | AE132: -5.0999999999999997e-002 | AF132: 90.28 | AG132: 90.06 | AH132: 0.57 | AI132: AA- | AJ132: 6.3899999999999998e-002 | AK132: =I132+100*P132 -> 138.5 | AL132: 137.1 | AM132: 144 | AN132: 46.8 | AO132: 154 | AP132: -0.11800000000000001 | AQ132: 53 | AR132: 华源转债!
A133: 70 | B133: 123053 | C133: 宝通转债 | D133: 44013. | E133: 300031 | F133: 宝通科技 | G133: 通信互联 | H133: 互联网 | I133: 121.838 | J133: -3.6900000000000002e-002 | K133: 1.44e-002 | L133: 21.49 | M133: -3.15e-002 | N133: 121.3 | O133: 20.8 | P133: 0.17899999999999999 | Q133: 103.32 | R133: 41天 | S133: 5.59年 | T133: 3.59年 | U133: 5 | V133: 42 | W133: 6.8000000000000005e-002 | X133: 5.9000000000000004e-002 | Y133: 6.0999999999999999e-002 | Z133: 85 | AA133: 3.04 | AB133: -8.0000000000000004e-004 | AC133: -7.3000000000000001e-003 | AD133: -4.1100000000000005e-002 | AE133: -4.3099999999999999e-002 | AF133: 82.02 | AG133: 85.26 | AH133: 0.71 | AI133: AA- | AJ133: 6.6600000000000006e-002 | AK133: =I133+100*P133 -> 139.738 | AL133: 140.4 | AM133: 171 | AN133: 55.1 | AO133: 209 | AP133: -2.4e-002 | AQ133: 5 | AR133: 宝通转债
A134: 220 | B134: 128056 | C134: 今飞转债! | D134: 43546. | E134: 2863. | F134: 今飞凯达 | G134: 汽车 | H134: 零部件制 | I134: 121.5 | J134: -2.8900000000000002e-002 | K134: 3.2000000000000001e-002 | L134: 7.87 | M134: 3.8e-003 | N134: 121 | O134: 6.76 | P134: 4.4000000000000004e-002 | Q134: 116.42 | R134: 转股中 | S134: 4.33年 | T134: 2.33年 | U134: 2.38 | V134: 136 | W134: 0.46600000000000003 | X134: 7.6999999999999999e-002 | Y134: 8.900000000000001e-002 | Z134: 31 | AA134: 2.66 | AB134: -1.e-003 | AC134: -9.1999999999999998e-003 | AD134: -6.0599999999999994e-002 | AE134: -6.3500000000000001e-002 | AF134: 87.2 | AG134: 89.23 | AH134: 0.8 | AI134: A+ | AJ134: 7.4900000000000008e-002 | AK134: =I134+100*P134 -> 125.90000000000001 | AL134: 126.6 | AM134: 38 | AN134: 37.4 | AO134: 65 | AP134: -2.4e-002 | AQ134: 57 | AR134: 今飞转债!
A135: 136 | B135: 128090 | C135: 汽模转2 | D135: 43853. | E135: 2510. | F135: 天汽模 | G135: 汽车 | H135: 零部件制 | I135: 115.8 | J135: -1.46e-002 | K135: -2.8000000000000004e-003 | L135: 4.04 | M135: -3.1200000000000002e-002 | N135: 115.2 | O135: 4.21 | P135: 0.20699999999999999 | Q135: 95.96 | R135: 转股中 | S135: 5年57天 | T135: 3年57天 | U135: 4.67 | V135: 20 | W135: 3.7000000000000005e-002 | X135: 0.126 | Y135: 0.121 | Z135: 37 | AA135: 1.39 | AB135: -1.e-003 | AC135: -6.3e-003 | AD135: -3.3000000000000002e-002 | AE135: -3.5000000000000003e-002 | AF135: 89.57 | AG135: 91.97 | AH135: 0.56 | AI135: AA | AJ135: 4.5599999999999995e-002 | AK135: =I135+100*P135 -> 136.5 | AL135: 135.6 | AM135: 131 | AN135: 43.7 | AO135: 128 | AP135: -6.8000000000000005e-002 | AQ135: 25 | AR135: 汽模转2
A136: 42 | B136: 123059 | C136: 银信转债 | D136: 44055. | E136: 300231 | F136: 银信科技 | G136: 计算机及 | H136: 软件开发 | I136: 124.85 | J136: -3.2199999999999999e-002 | K136: 8.1000000000000013e-003 | L136: 11.33 | M136: -3.1600000000000003e-002 | N136: 124.1 | O136: 9.91 | P136: 9.1999999999999998e-002 | Q136: 114.33 | R136: 2月22天 | S136: 5.70年 | T136: 3.70年 | U136: 3.91 | V136: 630 | W136: 1.24 | X136: 7.8e-002 | Y136: 8.900000000000001e-002 | Z136: 50 | AA136: 3.81 | AB136: -1.1000000000000001e-003 | AC136: -8.1000000000000013e-003 | AD136: -4.6500000000000007e-002 | AE136: -4.8300000000000003e-002 | AF136: 81.25 | AG136: 86.55 | AH136: 0.76 | AI136: AA- | AJ136: 6.6600000000000006e-002 | AK136: =I136+100*P136 -> 134.04999999999998 | AL136: 135.4 | AM136: 127 | AN136: 48.8 | AO136: 168 | AP136: 4.2000000000000003e-002 | AQ136: 10 | AR136: 银信转债
A137: 181 | B137: 113542 | C137: 好客转债 | D137: 43700. | E137: 603898 | F137: 好莱客 | G137: 其他 | H137: 家居用品 | I137: 115.76 | J137: -1.67e-002 | K137: 3.0999999999999999e-003 | L137: 15.85 | M137: -2.46e-002 | N137: 114.9 | O137: 16.27 | P137: 0.188 | Q137: 97.42 | R137: 转股中 | S137: 4.75年 | T137: 2.75年 | U137: 6.03 | V137: 3 | W137: 4.0000000000000001e-003 | X137: 0.122 | Y137: 0.11900000000000001 | Z137: 49 | AA137: 2.01 | AB137: -1.6000000000000001e-003 | AC137: -7.1999999999999998e-003 | AD137: -3.8300000000000001e-002 | AE137: -4.0399999999999998e-002 | AF137: 91.58 | AG137: 94.47 | AH137: 0.55 | AI137: AA | AJ137: 4.2900000000000001e-002 | AK137: =I137+100*P137 -> 134.56 | AL137: 134.1 | AM137: 112 | AN137: 39.6 | AO137: 91 | AP137: -5.2000000000000005e-002 | AQ137: 19 | AR137: 好客转债
A138: 27 | B138: 128124 | C138: 科华转债! | D138: 44063. | E138: 2022. | F138: 科华生物 | G138: 医药 | H138: 生物制药 | I138: 111.586 | J138: -1.0800000000000001e-002 | K138: -4.3e-003 | L138: 19.94 | M138: -2.5899999999999999e-002 | N138: 110.3 | O138: 21.5 | P138: 0.20300000000000001 | Q138: 92.74 | R138: 3月5天 | S138: 5.74年 | T138: 3.74年 | U138: 7.38 | V138: 19 | W138: 2.3e-002 | X138: 7.2000000000000008e-002 | Y138: 6.7000000000000004e-002 | Z138: 103 | AA138: 3.57 | AB138: -2.e-003 | AC138: -5.4000000000000003e-003 | AD138: -2.0299999999999999e-002 | AE138: -2.18e-002 | AF138: 86.69 | AG138: 85.74 | AH138: 0.58 | AI138: AA | AJ138: 4.5599999999999995e-002 | AK138: =I138+100*P138 -> 131.886 | AL138: 130.4 | AM138: 68 | AN138: 43.7 | AO138: 130 | AP138: 2.9999999999999999e-002 | AQ138: 10 | AR138: 科华转债!
A139: 301 | B139: 110033 | C139: 国贸转债! | D139: 42388. | E139: 600755 | F139: 厦门国贸 | G139: 交通运输 | H139: 交通运输 | I139: 110.01 | J139: -1.11e-002 | K139: 4.8999999999999998e-003 | L139: 6.69 | M139: -2.6200000000000001e-002 | N139: 109.7 | O139: 7.19 | P139: 0.182 | Q139: 93.05 | R139: 转股中 | S139: 1.18年 | T139: 回售中 | U139: 12.1 | V139: 6.2 | W139: 5.0000000000000001e-003 | X139: 9.6999999999999989e-002 | Y139: 8.9999999999999997e-002 | Z139: 125 | AA139: 0.86 | AB139: -2.3999999999999998e-003 | AC139: -1.7500000000000002e-002 | AD139: 回售中 | AE139: 回售中 | AF139: 100.28 | AG139: 105.09 | AH139: 0.24 | AI139: AAA | AJ139: 3.7499999999999999e-002 | AK139: =I139+100*P139 -> 128.21000000000001 | AL139: 127 | AM139: 43 | AN139: 21.9 | AO139: 5 | AP139: -2.7000000000000003e-002 | AQ139: 17 | AR139: 国贸转债!
A140: 129 | B140: 128094 | C140: 星帅转债 | D140: 43880. | E140: 2860. | F140: 星帅尔 | G140: 家电 | H140: 零部件制 | I140: 122.99 | J140: -6.6500000000000004e-002 | K140: 3.9199999999999999e-002 | L140: 13.06 | M140: -4.1799999999999997e-002 | N140: 121.5 | O140: 13.95 | P140: 0.314 | Q140: 93.62 | R140: 转股中 | S140: 5.21年 | T140: 3.21年 | U140: 2.8 | V140: 575 | W140: 1.6499999999999999 | X140: 0.10800000000000001 | Y140: 0.10099999999999999 | Z140: 26 | AA140: 2.79 | AB140: -2.3999999999999998e-003 | AC140: -9.3999999999999986e-003 | AD140: -4.7500000000000001e-002 | AE140: -4.9800000000000004e-002 | AF140: 81.55 | AG140: 83.13 | AH140: 0.65 | AI140: A+ | AJ140: 7.7600000000000002e-002 | AK140: =I140+100*P140 -> 154.38999999999999 | AL140: 152.4 | AM140: 237 | AN140: 69.2 | AO140: 247 | AP140: -7.2999999999999995e-002 | AQ140: 29 | AR140: 星帅转债
A141: 294 | B141: 113012 | C141: 骆驼转债! | D141: 42934. | E141: 601311 | F141: 骆驼股份 | G141: 汽车 | H141: 零部件制 | I141: 108.48 | J141: -1.77e-002 | K141: 1.15e-002 | L141: 8.27 | M141: -2.7099999999999999e-002 | N141: 107.8 | O141: 10.06 | P141: 0.32000000000000001 | Q141: 82.21 | R141: 转股中 | S141: 2.39年 | T141: 0.39年 | U141: 5.1 | V141: 13 | W141: 2.3e-002 | X141: 5.5e-002 | Y141: 4.4999999999999998e-002 | Z141: 93 | AA141: 1.38 | AB141: -2.7000000000000001e-003 | AC141: -8.8000000000000005e-003 | AD141: -0.121 | AE141: -0.126 | AF141: 99.21 | AG141: 97.73 | AH141: 0.23 | AI141: AA | AJ141: 4.2500000000000003e-002 | AK141: =I141+100*P141 -> 140.48000000000002 | AL141: 134.8 | AM141: 118 | AN141: 35.5 | AO141: 51 | AP141: 1.8000000000000002e-002 | AQ141: 17 | AR141: 骆驼转债!
A142: 30 | B142: 128123 | C142: 国光转债 | D142: 44062. | E142: 2749. | F142: 国光股份 | G142: 化工 | H142: 农化 | I142: 118 | J142: -1.7000000000000001e-003 | K142: -1.6799999999999999e-002 | L142: 12.78 | M142: -2.7400000000000001e-002 | N142: 116.2 | O142: 13.7 | P142: 0.26500000000000001 | Q142: 93.28 | R142: 3月3天 | S142: 5.74年 | T142: 3.74年 | U142: 3.2 | V142: 9.2 | W142: 2.4e-002 | X142: 5.7999999999999996e-002 | Y142: 5.4000000000000006e-002 | Z142: 55 | AA142: 4.48 | AB142: -2.7000000000000001e-003 | AC142: -7.7000000000000002e-003 | AD142: -3.1899999999999998e-002 | AE142: -3.3799999999999997e-002 | AF142: 81.18 | AG142: 80.93 | AH142: 0.68 | AI142: AA- | AJ142: 6.6600000000000006e-002 | AK142: =I142+100*P142 -> 144.5 | AL142: 142.7 | AM142: 195 | AN142: 61.5 | AO142: 238 | AP142: -3.2000000000000001e-002 | AQ142: 7 | AR142: 国光转债
A143: 267 | B143: 128034 | C143: 江银转债! | D143: 43145. | E143: 2807. | F143: 江阴银行 | G143: 金融 | H143: 银行行业 | I143: 110.291 | J143: -6.4000000000000003e-003 | K143: -1.8e-003 | L143: 4.02 | M143: -1.95e-002 | N143: 109.1 | O143: 4.5 | P143: 0.23499999999999999 | Q143: 89.33 | R143: 转股中 | S143: 3.24年 | T143: 无权 | U143: 17.6 | V143: 2.9 | W143: 1.e-003 | X143: 0.20100000000000001 | Y143: 0.17999999999999999 | Z143: 87 | AA143: 0.77 | AB143: -3.4000000000000002e-003 | AC143: -8.6e-003 | AD143: 无权 | AE143: 无权 | AF143: 无权 | AG143: 96.03 | AH143: 0.42 | AI143: AA+ | AJ143: 4.0899999999999999e-002 | AK143: =I143+100*P143 -> 133.791 | AL143: 131.2 | AM143: 80 | AN143: 35.2 | AO143: 48 | AP143: -3.6000000000000004e-002 | AQ143: 27 | AR143: 江银转债!
A144: 134 | B144: 113561 | C144: 正裕转债! | D144: 43871. | E144: 603089 | F144: 正裕工业 | G144: 汽车 | H144: 零部件制 | I144: 120.6 | J144: -4.0000000000000001e-002 | K144: 4.0000000000000002e-004 | L144: 12.06 | M144: -4.7400000000000005e-002 | N144: 118.5 | O144: 10.23 | P144: 2.3e-002 | Q144: 117.89 | R144: 转股中 | S144: 5.17年 | T144: 3.17年 | U144: 1.59 | V144: 15 | W144: 7.9000000000000001e-002 | X144: 5.9999999999999998e-002 | Y144: 7.0000000000000007e-002 | Z144: 27 | AA144: 3.21 | AB144: -3.4999999999999996e-003 | AC144: -9.7000000000000003e-003 | AD144: -4.2199999999999994e-002 | AE144: -4.4699999999999997e-002 | AF144: 81.9 | AG144: 81.38 | AH144: 0.84 | AI144: A+ | AJ144: 7.7600000000000002e-002 | AK144: =I144+100*P144 -> 122.89999999999999 | AL144: 123.3 | AM144: 15 | AN144: 41.4 | AO144: 109 | AP144: -2.2000000000000002e-002 | AQ144: 32 | AR144: 正裕转债!
A145: 8 | B145: 123064 | C145: 万孚转债 | D145: 44097. | E145: 300482 | F145: 万孚生物 | G145: 医药 | H145: 医疗器械 | I145: 117.931 | J145: -1.43e-002 | K145: -1.5300000000000001e-002 | L145: 76.2 | M145: -6.8699999999999997e-002 | N145: 115.1 | O145: 93.55 | P145: 0.44799999999999995 | Q145: 81.45 | R145: 4月8天 | S145: 5.84年 | T145: 3.84年 | U145: 6 | V145: 23 | W145: 3.3000000000000002e-002 | X145: 2.3e-002 | Y145: 1.9e-002 | Z145: 261 | AA145: 10.08 | AB145: -4.1999999999999997e-003 | AC145: -8.8000000000000005e-003 | AD145: -3.2099999999999997e-002 | AE145: -3.3700000000000001e-002 | AF145: 86.79 | AG145: 89.13 | AH145: 0.43 | AI145: AA | AJ145: 4.5599999999999995e-002 | AK145: =I145+100*P145 -> 162.73099999999999 | AL145: 154.4 | AM145: 242 | AN145: 65.3 | AO145: 244 | AP145: -9.6999999999999989e-002 | AQ145: 5 | AR145: 万孚转债
A146: 94 | B146: 128105 | C146: 长集转债 | D146: 43964. | E146: 2616. | F146: 长青集团 | G146: 城市公用 | H146: 三废处理 | I146: 118 | J146: -2.5600000000000001e-002 | K146: 1.9e-003 | L146: 8.88 | M146: -3.3700000000000001e-002 | N146: 115.3 | O146: 8.11 | P146: 7.8e-002 | Q146: 109.49 | R146: 转股中 | S146: 5.44年 | T146: 3.44年 | U146: 8 | V146: 25 | W146: 2.6000000000000002e-002 | X146: 0.121 | Y146: 0.13300000000000001 | Z146: 66 | AA146: 2.62 | AB146: -4.3e-003 | AC146: -9.300000000000001e-003 | AD146: -3.5299999999999998e-002 | AE146: -3.7200000000000004e-002 | AF146: 88.53 | AG146: 90.92 | AH146: 0.7 | AI146: AA | AJ146: 4.5599999999999995e-002 | AK146: =I146+100*P146 -> 125.8 | AL146: 126.5 | AM146: 36 | AN146: 35.6 | AO146: 52 | AP146: -0.105 | AQ146: 7 | AR146: 长集转债
A147: 93 | B147: 113034 | C147: 滨化转债 | D147: 43951. | E147: 601678 | F147: 滨化股份 | G147: 化工 | H147: 化工 | I147: 118.38 | J147: -1.3500000000000002e-002 | K147: 2.6200000000000001e-002 | L147: 5.29 | M147: 1.7299999999999999e-002 | N147: 115.1 | O147: 4.68 | P147: 4.7e-002 | Q147: 113.03 | R147: 转股中 | S147: 5.44年 | T147: 3.44年 | U147: 24 | V147: 72 | W147: 2.5000000000000001e-002 | X147: 0.29399999999999998 | Y147: 0.33200000000000002 | Z147: 82 | AA147: 1.36 | AB147: -5.1999999999999998e-003 | AC147: -1.01e-002 | AD147: -3.6600000000000001e-002 | AE147: -3.8399999999999997e-002 | AF147: 88.33 | AG147: 90.71 | AH147: 0.73 | AI147: AA | AJ147: 4.5599999999999995e-002 | AK147: =I147+100*P147 -> 123.08 | AL147: 123.7 | AM147: 17 | AN147: 33 | AO147: 33 | AP147: -8.0000000000000002e-003 | AQ147: 27 | AR147: 滨化转债
A148: 110 | B148: 113572 | C148: 三祥转债! | D148: 43930. | E148: 603663 | F148: 三祥新材 | G148: 其他 | H148: 其他 | I148: 116.44 | J148: -2.9300000000000003e-002 | K148: -7.1999999999999998e-003 | L148: 14.43 | M148: -4.6900000000000004e-002 | N148: 113.2 | O148: 14.19 | P148: 0.14499999999999999 | Q148: 101.69 | R148: 转股中 | S148: 5.36年 | T148: 3.36年 | U148: 1.7 | V148: 16 | W148: 7.9000000000000001e-002 | X148: 6.0999999999999999e-002 | Y148: 6.2e-002 | Z148: 28 | AA148: 4.97 | AB148: -5.3e-003 | AC148: -9.7999999999999997e-003 | AD148: -3.2599999999999997e-002 | AE148: -3.4500000000000003e-002 | AF148: 79.88 | AG148: 76.47 | AH148: 0.78 | AI148: A+ | AJ148: 7.7600000000000002e-002 | AK148: =I148+100*P148 -> 130.94 | AL148: 131.2 | AM148: 78 | AN148: 51.3 | AO148: 184 | AP148: -6.2e-002 | AQ148: 16 | AR148: 三祥转债!
A149: 4 | B149: 123066 | C149: 赛意转债 | D149: 44119. | E149: 300687 | F149: 赛意信息 | G149: 计算机及 | H149: 软件开发 | I149: 125.56 | J149: -1.6799999999999999e-002 | K149: 8.6999999999999994e-003 | L149: 27.09 | M149: -9.4999999999999998e-003 | N149: 121.4 | O149: 22.58 | P149: 4.7e-002 | Q149: 119.97 | R149: 4月22天 | S149: 5.88年 | T149: 3.88年 | U149: 3.2 | V149: 477 | W149: 1.1599999999999999 | X149: 5.4000000000000006e-002 | Y149: 6.5000000000000002e-002 | Z149: 59 | AA149: 7.06 | AB149: -5.7999999999999996e-003 | AC149: -1.2e-002 | AD149: -4.5199999999999997e-002 | AE149: -4.7100000000000003e-002 | AF149: 77.35 | AG149: 78.98 | AH149: 0.85 | AI149: A+ | AJ149: 7.7600000000000002e-002 | AK149: =I149+100*P149 -> 130.25999999999999 | AL149: 131.1 | AM149: 75 | AN149: 52.2 | AO149: 193 | AP149: 5.5999999999999994e-002 | AQ149: 3 | AR149: 赛意转债
A150: 118 | B150: 128098 | C150: 康弘转债! | D150: 43921. | E150: 2773. | F150: 康弘药业 | G150: 医药 | H150: 化学制药 | I150: 120.001 | J150: -3.1300000000000001e-002 | K150: 1.4000000000000002e-003 | L150: 42.5 | M150: -2.9900000000000003e-002 | N150: 116.3 | O150: 35.3 | P150: -3.0000000000000001e-003 | Q150: 120.4 | R150: 转股中 | S150: 5.34年 | T150: 3.34年 | U150: 6.87 | V150: 41 | W150: 4.9000000000000002e-002 | X150: 1.8000000000000002e-002 | Y150: 2.2000000000000002e-002 | Z150: 372 | AA150: 7.36 | AB150: -6.0000000000000001e-003 | AC150: -1.1299999999999999e-002 | AD150: -4.0899999999999999e-002 | AE150: -4.2800000000000005e-002 | AF150: 88.91 | AG150: 92.09 | AH150: 1 | AI150: AA | AJ150: 4.5599999999999995e-002 | AK150: =I150+100*P150 -> 119.70100000000001 | AL150: 119.6 | AM150: 8 | AN150: 27.5 | AO150: 13 | AP150: -3.6000000000000004e-002 | AQ150: 23 | AR150: 康弘转债!
A151: 23 | B151: 113598 | C151: 法兰转债 | D151: 44068. | E151: 603966 | F151: 法兰泰克 | G151: 机械装备 | H151: 工程机械 | I151: 125.51 | J151: -2.7999999999999997e-002 | K151: 1.1699999999999999e-002 | L151: 14.55 | M151: -2.2200000000000001e-002 | N151: 121.2 | O151: 13.88 | P151: 0.19699999999999998 | Q151: 104.83 | R151: 3月8天 | S151: 5.75年 | T151: 3.75年 | U151: 3.3 | V151: 7.3 | W151: 1.7000000000000001e-002 | X151: 0.10800000000000001 | Y151: 0.113 | Z151: 31 | AA151: 2.75 | AB151: -6.1999999999999998e-003 | AC151: -1.24e-002 | AD151: -4.7100000000000003e-002 | AE151: -4.8899999999999999e-002 | AF151: 81.11 | AG151: 84.32 | AH151: 0.73 | AI151: AA- | AJ151: 6.6600000000000006e-002 | AK151: =I151+100*P151 -> 145.21000000000001 | AL151: 146.2 | AM151: 212 | AN151: 61.9 | AO151: 240 | AP151: -5.9000000000000004e-002 | AQ151: 5 | AR151: 法兰转债
A152: 24 | B152: 128125 | C152: 华阳转债 | D152: 44064. | E152: 2949. | F152: 华阳国际 | G152: 建筑 | H152: 建筑工程 | I152: 122.8 | J152: -9.300000000000001e-003 | K152: -1.7299999999999999e-002 | L152: 26.3 | M152: -3.6600000000000001e-002 | N152: 118.5 | O152: 25.79 | P152: 0.20399999999999999 | Q152: 101.98 | R152: 3月7天 | S152: 5.75年 | T152: 3.75年 | U152: 4.5 | V152: 110 | W152: 0.19399999999999998 | X152: 8.6999999999999994e-002 | Y152: 8.900000000000001e-002 | Z152: 52 | AA152: 4.23 | AB152: -6.3e-003 | AC152: -1.18e-002 | AD152: -4.2300000000000004e-002 | AE152: -4.41e-002 | AF152: 80.88 | AG152: 82.41 | AH152: 0.72 | AI152: AA- | AJ152: 6.6600000000000006e-002 | AK152: =I152+100*P152 -> 143.19999999999999 | AL152: 143.6 | AM152: 198 | AN152: 61.2 | AO152: 236 | AP152: -4.4000000000000004e-002 | AQ152: 2 | AR152: 华阳转债
A153: 143 | B153: 113556 | C153: 至纯转债! | D153: 43839. | E153: 603690 | F153: 至纯科技 | G153: 机械装备 | H153: 专用设备 | I153: 131.24 | J153: 7.1999999999999998e-003 | K153: 1.7000000000000001e-003 | L153: 32.57 | M153: 1.15e-002 | N153: 126.8 | O153: 29.37 | P153: 0.183 | Q153: 110.9 | R153: 转股中 | S153: 5年50天 | T153: 3年50天 | U153: 2.96 | V153: 499 | W153: 1.24 | X153: 3.5000000000000003e-002 | Y153: 3.9e-002 | Z153: 85 | AA153: 5.97 | AB153: -6.8000000000000005e-003 | AC153: -1.5300000000000001e-002 | AD153: -6.6900000000000001e-002 | AE153: -6.93e-002 | AF153: 82.1 | AG153: 87.21 | AH153: 0.77 | AI153: A+ | AJ153: 7.7600000000000002e-002 | AK153: =I153+100*P153 -> 149.54000000000002 | AL153: 151.6 | AM153: 236 | AN153: 64.4 | AO153: 242 | AP153: -8.5000000000000006e-002 | AQ153: 13 | AR153: 至纯转债!
A154: 265 | B154: 128035 | C154: 大族转债! | D154: 43164. | E154: 2008. | F154: 大族激光 | G154: 机械装备 | H154: 专用设备 | I154: 110.478 | J154: -5.6000000000000008e-003 | K154: 1.5e-003 | L154: 40.2 | M154: -2.3300000000000001e-002 | N154: 108 | O154: 52.1 | P154: 0.43200000000000005 | Q154: 77.16 | R154: 转股中 | S154: 3.27年 | T154: 1.27年 | U154: 23 | V154: 26 | W154: 1.e-002 | X154: 5.4000000000000006e-002 | Y154: 4.0999999999999995e-002 | Z154: 429 | AA154: 4.67 | AB154: -6.9999999999999993e-003 | AC154: -1.1599999999999999e-002 | AD154: -3.8900000000000004e-002 | AE154: -4.4500000000000005e-002 | AF154: 98.59 | AG154: 94.92 | AH154: 0.17 | AI154: AA+ | AJ154: 4.0899999999999999e-002 | AK154: =I154+100*P154 -> 153.678 | AL154: 143.8 | AM154: 200 | AN154: 45.2 | AO154: 144 | AP154: 0.13699999999999998 | AQ154: 19 | AR154: 大族转债!
A155: 271 | B155: 110041 | C155: 蒙电转债! | D155: 43109. | E155: 600863 | F155: 内蒙华电 | G155: 能源电力 | H155: 电力供应 | I155: 112.82 | J155: -1.1200000000000002e-002 | K155: 7.4000000000000003e-003 | L155: 2.57 | M155: -7.7000000000000002e-003 | N155: 110.3 | O155: 2.69 | P155: 0.18100000000000002 | Q155: 95.54 | R155: 转股中 | S155: 3年52天 | T155: 1年52天 | U155: 18.7 | V155: 1.4 | W155: 1.e-003 | X155: 0.125 | Y155: 0.12 | Z155: 149 | AA155: 1.26 | AB155: -7.3000000000000001e-003 | AC155: -1.3300000000000001e-002 | AD155: -6.9199999999999998e-002 | AE155: -7.2999999999999995e-002 | AF155: 97.96 | AG155: 98.4 | AH155: 0.49 | AI155: AAA | AJ155: 3.7900000000000003e-002 | AK155: =I155+100*P155 -> 130.91999999999999 | AL155: 130.1 | AM155: 66 | AN155: 31.7 | AO155: 24 | AP155: -1.9e-002 | AQ155: 9 | AR155: 蒙电转债!
A156: 163 | B156: 110060 | C156: 天路转债! | D156: 43797. | E156: 600326 | F156: 西藏天路 | G156: 建筑 | H156: 水泥 | I156: 119.09 | J156: -1.3899999999999999e-002 | K156: -8.3999999999999995e-003 | L156: 7.36 | M156: -3.5400000000000001e-002 | N156: 114.9 | O156: 7.16 | P156: 0.159 | Q156: 102.79 | R156: 转股中 | S156: 4.99年 | T156: 2.99年 | U156: 7.06 | V156: 9.8 | W156: 1.2e-002 | X156: 0.10400000000000001 | Y156: 0.107 | Z156: 68 | AA156: 1.78 | AB156: -7.3000000000000001e-003 | AC156: -1.2500000000000001e-002 | AD156: -4.41e-002 | AE156: -4.5999999999999999e-002 | AF156: 90.66 | AG156: 93.52 | AH156: 0.63 | AI156: AA | AJ156: 4.2900000000000001e-002 | AK156: =I156+100*P156 -> 134.99000000000001 | AL156: 135.4 | AM156: 128 | AN156: 41.9 | AO156: 113 | AP156: -6.5000000000000002e-002 | AQ156: 12 | AR156: 天路转债!
A157: 1 | B157: 113603 | C157: 东缆转债 | D157: 44133. | E157: 603606 | F157: 东方电缆 | G157: 能源电力 | H157: 电力设备 | I157: 120.09 | J157: 2.4500000000000001e-002 | K157: -4.3299999999999998e-002 | L157: 21.87 | M157: -3.4000000000000002e-002 | N157: 115.1 | O157: 23.88 | P157: 0.311 | Q157: 91.58 | R157: 5月0天 | S157: 5.90年 | T157: 3.90年 | U157: 8 | V157: 1317. | W157: 1.3500000000000001 | X157: 5.5999999999999994e-002 | Y157: 5.0999999999999997e-002 | Z157: 143 | AA157: 5.28 | AB157: -7.3000000000000001e-003 | AC157: -1.18e-002 | AD157: -3.5900000000000001e-002 | AE157: -3.7499999999999999e-002 | AF157: 86.55 | AG157: 88.88 | AH157: 0.55 | AI157: AA | AJ157: 4.5599999999999995e-002 | AK157: =I157+100*P157 -> 151.19 | AL157: 148.6 | AM157: 228 | AN157: 59.7 | AO157: 227 | AP157: -9.5000000000000001e-002 | AQ157: 2 | AR157: 东缆转债
A158: 280 | B158: 128022 | C158: 众信转债! | D158: 43097. | E158: 2707. | F158: 众信旅游 | G158: 旅游餐饮 | H158: 旅游 | I158: 112.37 | J158: 8.0000000000000004e-004 | K158: -7.4000000000000003e-003 | L158: 5.9 | M158: -3.5900000000000001e-002 | N158: 109.8 | O158: 7.92 | P158: 0.50800000000000001 | Q158: 74.49 | R158: 转股中 | S158: 3年31天 | T158: 1年31天 | U158: 4.56 | V158: 12 | W158: 2.3e-002 | X158: 8.5000000000000006e-002 | Y158: 6.3e-002 | Z158: 54 | AA158: 2.61 | AB158: -7.6e-003 | AC158: -1.3500000000000002e-002 | AD158: -7.1199999999999999e-002 | AE158: -7.4700000000000003e-002 | AF158: 97.35 | AG158: 96.73 | AH158: 0.18 | AI158: AA | AJ158: 4.2900000000000001e-002 | AK158: =I158+100*P158 -> 163.17000000000002 | AL158: 150.2 | AM158: 232 | AN158: 52.9 | AO158: 198 | AP158: -0.23600000000000002 | AQ158: 23 | AR158: 众信转债!
A159: 229 | B159: 128051 | C159: 光华转债! | D159: 43474. | E159: 2741. | F159: 光华科技 | G159: 电子 | H159: 元器件制 | I159: 119.25 | J159: -3.0499999999999999e-002 | K159: 2.07e-002 | L159: 13.21 | M159: -1.4199999999999999e-002 | N159: 115.5 | O159: 12.72 | P159: 0.14800000000000002 | Q159: 103.85 | R159: 转股中 | S159: 4年44天 | T159: 2年44天 | U159: 2.5 | V159: 456 | W159: 1.48 | X159: 5.0999999999999997e-002 | Y159: 5.2999999999999999e-002 | Z159: 49 | AA159: 4.09 | AB159: -7.9000000000000008e-003 | AC159: -1.4499999999999999e-002 | AD159: -5.9400000000000001e-002 | AE159: -6.2400000000000004e-002 | AF159: 90.28 | AG159: 90.06 | AH159: 0.69 | AI159: AA- | AJ159: 6.3899999999999998e-002 | AK159: =I159+100*P159 -> 134.05000000000001 | AL159: 134.6 | AM159: 116 | AN159: 44.4 | AO159: 134 | AP159: -8.199999999999999e-002 | AQ159: 22 | AR159: 光华转债!
A160: 45 | B160: 128119 | C160: 龙大转债 | D160: 44050. | E160: 2726. | F160: 龙大肉食 | G160: 食品饮料 | H160: 肉制品 | I160: 125.669 | J160: -2.e-002 | K160: 1.4800000000000001e-002 | L160: 10.43 | M160: -7.6e-003 | N160: 120.2 | O160: 9.56 | P160: 0.152 | Q160: 109.1 | R160: 2月18天 | S160: 5.70年 | T160: 3.70年 | U160: 9.5 | V160: 39 | W160: 3.2000000000000001e-002 | X160: 9.0999999999999998e-002 | Y160: 0.10000000000000001 | Z160: 104 | AA160: 4.01 | AB160: -7.9000000000000008e-003 | AC160: -1.3899999999999999e-002 | AD160: -4.8899999999999999e-002 | AE160: -5.0599999999999999e-002 | AF160: 87.41 | AG160: 93.65 | AH160: 0.68 | AI160: AA | AJ160: 4.5599999999999995e-002 | AK160: =I160+100*P160 -> 140.869 | AL160: 142.2 | AM160: 187 | AN160: 48.6 | AO160: 165 | AP160: -2.8999999999999998e-002 | AQ160: 6 | AR160: 龙大转债
A161: 204 | B161: 110057 | C161: 现代转债 | D161: 43585. | E161: 600420 | F161: 现代制药 | G161: 医药 | H161: 化学制药 | I161: 114.72 | J161: -9.1999999999999998e-003 | K161: -1.6000000000000001e-003 | L161: 10.1 | M161: -1.7500000000000002e-002 | N161: 110.8 | O161: 9.89 | P161: 0.12300000000000001 | Q161: 102.12 | R161: 转股中 | S161: 4.42年 | T161: 2.42年 | U161: 16.2 | V161: 5.9 | W161: 3.0000000000000001e-003 | X161: 0.156 | Y161: 0.159 | Z161: 104 | AA161: 1.32 | AB161: -8.0000000000000002e-003 | AC161: -1.24e-002 | AD161: -4.0099999999999997e-002 | AE161: -4.2500000000000003e-002 | AF161: 93.92 | AG161: 94.33 | AH161: 0.62 | AI161: AAA | AJ161: 3.7900000000000003e-002 | AK161: =I161+100*P161 -> 127.02 | AL161: 127.3 | AM161: 49 | AN161: 33 | AO161: 32 | AP161: 2.5000000000000001e-002 | AQ161: 21 | AR161: 现代转债
A162: 216 | B162: 128057 | C162: 博彦转债 | D162: 43557. | E162: 2649. | F162: 博彦科技 | G162: 计算机及 | H162: 软件开发 | I162: 121.299 | J162: -1.4999999999999999e-002 | K162: 1.11e-002 | L162: 10.18 | M162: -4.8999999999999998e-003 | N162: 117.1 | O162: 8.72 | P162: 3.9e-002 | Q162: 116.74 | R162: 转股中 | S162: 4.34年 | T162: 2.34年 | U162: 5.29 | V162: 27 | W162: 4.0999999999999995e-002 | X162: 9.8000000000000004e-002 | Y162: 0.114 | Z162: 54 | AA162: 1.91 | AB162: -8.3000000000000001e-003 | AC162: -1.5100000000000001e-002 | AD162: -6.1600000000000002e-002 | AE162: -6.4100000000000004e-002 | AF162: 88.86 | AG162: 90.03 | AH162: 0.8 | AI162: AA- | AJ162: 6.3899999999999998e-002 | AK162: =I162+100*P162 -> 125.19900000000001 | AL162: 125.9 | AM162: 29 | AN162: 35.8 | AO162: 55 | AP162: 2.5000000000000001e-002 | AQ162: 29 | AR162: 博彦转债
A163: 197 | B163: 113025 | C163: 明泰转债! | D163: 43592. | E163: 601677 | F163: 明泰铝业 | G163: 有色金属 | H163: 铝金属 | I163: 119.41 | J163: -1.49e-002 | K163: 4.1999999999999997e-003 | L163: 13.41 | M163: -1.3999999999999999e-002 | N163: 115.1 | O163: 11.2 | P163: -3.0000000000000001e-003 | Q163: 119.73 | R163: 转股中 | S163: 4.44年 | T163: 2.44年 | U163: 16.4 | V163: 30 | W163: 1.4999999999999999e-002 | X163: 0.19800000000000001 | Y163: 0.23699999999999999 | Z163: 83 | AA163: 1.17 | AB163: -8.3999999999999995e-003 | AC163: -1.44e-002 | AD163: -5.4100000000000002e-002 | AE163: -5.6399999999999999e-002 | AF163: 92.81 | AG163: 95.88 | AH163: 0.77 | AI163: AA | AJ163: 4.2900000000000001e-002 | AK163: =I163+100*P163 -> 119.11 | AL163: 119.1 | AM163: 6 | AN163: 23.2 | AO163: 6 | AP163: 6.5000000000000002e-002 | AQ163: 32 | AR163: 明泰转债!
A164: 113 | B164: 128099 | C164: 永高转债! | D164: 43931. | E164: 2641. | F164: 永高股份 | G164: 建筑 | H164: 建筑行业 | I164: 118.396 | J164: -9.1999999999999998e-003 | K164: -8.3000000000000001e-003 | L164: 7.25 | M164: -1.7600000000000001e-002 | N164: 113.2 | O164: 6.16 | P164: 6.0000000000000001e-003 | Q164: 117.69 | R164: 转股中 | S164: 5.36年 | T164: 3.36年 | U164: 3.66 | V164: 56 | W164: 0.127 | X164: 4.4000000000000004e-002 | Y164: 5.2000000000000005e-002 | Z164: 82 | AA164: 2.13 | AB164: -8.5000000000000006e-003 | AC164: -1.29e-002 | AD164: -3.7200000000000004e-002 | AE164: -3.9100000000000003e-002 | AF164: 88.75 | AG164: 89.57 | AH164: 1 | AI164: AA | AJ164: 4.5599999999999995e-002 | AK164: =I164+100*P164 -> 118.996 | AL164: 119.1 | AM164: 7 | AN164: 29.5 | AO164: 19 | AP164: -9.6999999999999989e-002 | AQ164: 9 | AR164: 永高转债!
A165: 61 | B165: 128114 | C165: 正邦转债 | D165: 44027. | E165: 2157. | F165: 正邦科技 | G165: 农业 | H165: 畜牧业 | I165: 121.1 | J165: -1.7000000000000001e-002 | K165: 5.9999999999999995e-004 | L165: 17.1 | M165: -2.4500000000000001e-002 | N165: 115.3 | O165: 16.09 | P165: 0.13900000000000001 | Q165: 106.28 | R165: 53天 | S165: 5.63年 | T165: 3.63年 | U165: 16 | V165: 62 | W165: 3.2000000000000001e-002 | X165: 3.7000000000000005e-002 | Y165: 3.9e-002 | Z165: 431 | AA165: 2.87 | AB165: -8.8000000000000005e-003 | AC165: -1.3600000000000001e-002 | AD165: -4.0199999999999993e-002 | AE165: -4.2000000000000003e-002 | AF165: 88.42 | AG165: 91.11 | AH165: 0.67 | AI165: AA+ | AJ165: 4.36e-002 | AK165: =I165+100*P165 -> 135. | AL165: 135.9 | AM165: 135 | AN165: 44.8 | AO165: 140 | AP165: -5.5e-002 | AQ165: 8 | AR165: 正邦转债
A166: 205 | B166: 123025 | C166: 精测转债!! | D166: 43574. | E166: 300567 | F166: 精测电子 | G166: 电子 | H166: 液晶显示 | I166: 122 | J166: -1.1699999999999999e-002 | K166: 5.1999999999999998e-003 | L166: 49.69 | M166: -1.0200000000000001e-002 | N166: 117.3 | O166: 49.95 | P166: 0.22600000000000001 | Q166: 99.48 | R166: 转股中 | S166: 4.41年 | T166: 2.41年 | U166: 3.09 | V166: 258 | W166: 0.65799999999999992 | X166: 2.5000000000000001e-002 | Y166: 2.5000000000000001e-002 | Z166: 123 | AA166: 7.89 | AB166: -9.1000000000000004e-003 | AC166: -1.5800000000000002e-002 | AD166: -6.2100000000000002e-002 | AE166: -6.4500000000000002e-002 | AF166: 88.53 | AG166: 89.83 | AH166: 0.64 | AI166: AA- | AJ166: 6.3899999999999998e-002 | AK166: =I166+100*P166 -> 144.59999999999999 | AL166: 144.5 | AM166: 205 | AN166: 54.7 | AO166: 206 | AP166: -6.3e-002 | AQ166: 18 | AR166: 精测转债!!
A167: 81 | B167: 113579 | C167: 健友转债 | D167: 43973. | E167: 603707 | F167: 健友股份 | G167: 医药 | H167: 原料药 | I167: 120 | J167: -1.7000000000000001e-003 | K167: -4.7999999999999996e-003 | L167: 39.18 | M167: -1.1599999999999999e-002 | N167: 114.2 | O167: 42.05 | P167: 0.28800000000000003 | Q167: 93.17 | R167: 转股中 | S167: 5.48年 | T167: 3.48年 | U167: 5.03 | V167: 19 | W167: 3.2000000000000001e-002 | X167: 1.3999999999999999e-002 | Y167: 1.3000000000000001e-002 | Z167: 366 | AA167: 10.68 | AB167: -9.1999999999999998e-003 | AC167: -1.37e-002 | AD167: -3.9599999999999996e-002 | AE167: -4.1399999999999999e-002 | AF167: 88.28 | AG167: 89.88 | AH167: 0.56 | AI167: AA | AJ167: 4.5599999999999995e-002 | AK167: =I167+100*P167 -> 148.80000000000001 | AL167: 146.8 | AM167: 214 | AN167: 56.9 | AO167: 214 | AP167: -3.7999999999999999e-002 | AQ167: 7 | AR167: 健友转债
A168: 128 | B168: 113563 | C168: 柳药转债 | D168: 43885. | E168: 603368 | F168: 柳药股份 | G168: 医药 | H168: 医药商业 | I168: 119.01 | J168: -4.0999999999999995e-003 | K168: 7.0999999999999995e-003 | L168: 23.42 | M168: 5.1999999999999998e-003 | N168: 113.2 | O168: 24.47 | P168: 0.24299999999999999 | Q168: 95.71 | R168: 转股中 | S168: 5.21年 | T168: 3.21年 | U168: 8.02 | V168: 5.6 | W168: 6.0000000000000001e-003 | X168: 9.4e-002 | Y168: 8.9999999999999997e-002 | Z168: 85 | AA168: 1.77 | AB168: -9.7000000000000003e-003 | AC168: -1.43e-002 | AD168: -4.0300000000000002e-002 | AE168: -4.2300000000000004e-002 | AF168: 89.35 | AG168: 90.16 | AH168: 0.59 | AI168: AA | AJ168: 4.5599999999999995e-002 | AK168: =I168+100*P168 -> 143.31 | AL168: 142.3 | AM168: 188 | AN168: 52.2 | AO168: 192 | AP168: 1.1000000000000001e-002 | AQ168: 16 | AR168: 柳药转债
A169: 75 | B169: 127017 | C169: 万青转债 | D169: 44014. | E169: 789. | F169: 万年青 | G169: 建筑 | H169: 水泥 | I169: 125.18 | J169: -1.43e-002 | K169: 1.1000000000000001e-003 | L169: 14.1 | M169: -2.29e-002 | N169: 118.4 | O169: 14.16 | P169: 0.25700000000000001 | Q169: 99.58 | R169: 39天 | S169: 5.59年 | T169: 3.59年 | U169: 10 | V169: 5.7 | W169: 5.0000000000000001e-003 | X169: 8.900000000000001e-002 | Y169: 8.900000000000001e-002 | Z169: 112 | AA169: 2.03 | AB169: -1.01e-002 | AC169: -1.5700000000000002e-002 | AD169: -4.9200000000000001e-002 | AE169: -5.0999999999999997e-002 | AF169: 88.51 | AG169: 93.7 | AH169: 0.58 | AI169: AA+ | AJ169: 4.36e-002 | AK169: =I169+100*P169 -> 150.88 | AL169: 150.8 | AM169: 234 | AN169: 57.1 | AO169: 215 | AP169: -6.3e-002 | AQ169: 7 | AR169: 万青转债
A170: 179 | B170: 128071 | C170: 合兴转债! | D170: 43724. | E170: 2228. | F170: 合兴包装 | G170: 造纸包装 | H170: 包装材料 | I170: 120.501 | J170: -2.4900000000000002e-002 | K170: -5.6999999999999993e-003 | L170: 4.52 | M170: -4.8399999999999999e-002 | N170: 114.8 | O170: 4.28 | P170: 0.14099999999999999 | Q170: 105.61 | R170: 转股中 | S170: 4.79年 | T170: 2.79年 | U170: 3 | V170: 28 | W170: 7.6999999999999999e-002 | X170: 5.4000000000000006e-002 | Y170: 5.7000000000000002e-002 | Z170: 56 | AA170: 1.78 | AB170: -1.0200000000000001e-002 | AC170: -1.5700000000000002e-002 | AD170: -5.1100000000000007e-002 | AE170: -5.3099999999999994e-002 | AF170: 91.32 | AG170: 94.21 | AH170: 0.63 | AI170: AA | AJ170: 4.2900000000000001e-002 | AK170: =I170+100*P170 -> 134.601 | AL170: 135.4 | AM170: 129 | AN170: 41.2 | AO170: 107 | AP170: -0.10300000000000001 | AQ170: 25 | AR170: 合兴转债!
A171: 11 | B171: 113602 | C171: 景20转债 | D171: 44096. | E171: 603228 | F171: 景旺电子 | G171: 电子 | H171: 元器件制 | I171: 120.1 | J171: -2.e-003 | K171: -1.3000000000000001e-002 | L171: 32.02 | M171: -2.6699999999999998e-002 | N171: 113.3 | O171: 35.28 | P171: 0.32299999999999995 | Q171: 90.76 | R171: 4月1天 | S171: 5.81年 | T171: 3.81年 | U171: 17.8 | V171: 8.8 | W171: 4.0000000000000001e-003 | X171: 6.5000000000000002e-002 | Y171: 5.9000000000000004e-002 | Z171: 273 | AA171: 4.73 | AB171: -1.0200000000000001e-002 | AC171: -1.4199999999999999e-002 | AD171: -3.6299999999999999e-002 | AE171: -3.7999999999999999e-002 | AF171: 87.06 | AG171: 87.86 | AH171: 0.56 | AI171: AA | AJ171: 4.5599999999999995e-002 | AK171: =I171+100*P171 -> 152.39999999999998 | AL171: 149.4 | AM171: 229 | AN171: 61.6 | AO171: 239 | AP171: -5.7000000000000002e-002 | AQ171: 5 | AR171: 景20转债
A172: 41 | B172: 128121 | C172: 宏川转债 | D172: 44050. | E172: 2930. | F172: 宏川智慧 | G172: 交通运输 | H172: 物流业 | I172: 120.303 | J172: -7.4000000000000003e-003 | K172: 2.8199999999999999e-002 | L172: 21.5 | M172: 2.63e-002 | N172: 113.3 | O172: 20.25 | P172: 0.13300000000000001 | Q172: 106.17 | R172: 2月26天 | S172: 5.71年 | T172: 3.71年 | U172: 6.7 | V172: 257 | W172: 0.309 | X172: 7.0000000000000007e-002 | Y172: 7.4999999999999997e-002 | Z172: 95 | AA172: 4.97 | AB172: -1.06e-002 | AC172: -1.4800000000000001e-002 | AD172: -3.7699999999999997e-002 | AE172: -3.9399999999999998e-002 | AF172: 81.04 | AG172: 78.99 | AH172: 0.79 | AI172: AA- | AJ172: 6.6600000000000006e-002 | AK172: =I172+100*P172 -> 133.60300000000001 | AL172: 134.4 | AM172: 115 | AN172: 53.4 | AO172: 201 | AP172: 5.9000000000000004e-002 | AQ172: 4 | AR172: 宏川转债
A173: 162 | B173: 113548 | C173: 石英转债! | D173: 43791. | E173: 603688 | F173: 石英股份 | G173: 电子 | H173: 电子产品 | I173: 131.26 | J173: -3.2899999999999999e-002 | K173: 1.78e-002 | L173: 18.92 | M173: -1.8700000000000001e-002 | N173: 124.4 | O173: 15.1 | P173: 4.8000000000000001e-002 | Q173: 125.3 | R173: 转股中 | S173: 4.99年 | T173: 2.99年 | U173: 1.23 | V173: 85 | W173: 0.51800000000000002 | X173: 1.8000000000000002e-002 | Y173: 2.3e-002 | Z173: 67 | AA173: 3.54 | AB173: -1.09e-002 | AC173: -1.89e-002 | AD173: -7.0800000000000002e-002 | AE173: -7.3099999999999998e-002 | AF173: 85.95 | AG173: 91.93 | AH173: 0.81 | AI173: AA- | AJ173: 6.3899999999999998e-002 | AK173: =I173+100*P173 -> 136.06 | AL173: 137.2 | AM173: 146 | AN173: 45.3 | AO173: 146 | AP173: -0.122 | AQ173: 11 | AR173: 石英转债!
A174: 158 | B174: 123035 | C174: 利德转债! | D174: 43808. | E174: 300296 | F174: 利亚德 | G174: 电子 | H174: LED制 | I174: 122.4 | J174: -1.0200000000000001e-002 | K174: -1.3899999999999999e-002 | L174: 7.13 | M174: -3.9100000000000003e-002 | N174: 115.6 | O174: 6.98 | P174: 0.19800000000000001 | Q174: 102.15 | R174: 转股中 | S174: 5年14天 | T174: 3年14天 | U174: 8 | V174: 24 | W174: 2.4e-002 | X174: 4.4000000000000004e-002 | Y174: 4.4999999999999998e-002 | Z174: 181 | AA174: 2.12 | AB174: -1.15e-002 | AC174: -1.6899999999999998e-002 | AD174: -4.99e-002 | AE174: -5.2199999999999996e-002 | AF174: 90.98 | AG174: 93.72 | AH174: 0.62 | AI174: AA+ | AJ174: 4.36e-002 | AK174: =I174+100*P174 -> 142.20000000000002 | AL174: 142.7 | AM174: 193 | AN174: 48.9 | AO174: 169 | AP174: -8.0000000000000002e-002 | AQ174: 16 | AR174: 利德转债!
A175: 60 | B175: 123055 | C175: 晨光转债 | D175: 44025. | E175: 300138 | F175: 晨光生物 | G175: 食品饮料 | H175: 食品加工 | I175: 132.5 | J175: -2.07e-002 | K175: -4.6999999999999993e-003 | L175: 15.78 | M175: -2.9500000000000002e-002 | N175: 124.3 | O175: 12.25 | P175: 2.8999999999999998e-002 | Q175: 128.82 | R175: 53天 | S175: 5.63年 | T175: 3.63年 | U175: 6.3 | V175: 25 | W175: 2.9999999999999999e-002 | X175: 7.8e-002 | Y175: 0.10000000000000001 | Z175: 81 | AA175: 4.2 | AB175: -1.15e-002 | AC175: -1.8600000000000002e-002 | AD175: -6.1900000000000004e-002 | AE175: -6.3799999999999996e-002 | AF175: 81.84 | AG175: 87.16 | AH175: 0.86 | AI175: AA- | AJ175: 6.6600000000000006e-002 | AK175: =I175+100*P175 -> 135.40000000000001 | AL175: 136.2 | AM175: 137 | AN175: 49 | AO175: 170 | AP175: -2.4e-002 | AQ175: 6 | AR175: 晨光转债
A176: 31 | B176: 110073 | C176: 国投转债 | D176: 44063. | E176: 600061 | F176: 国投资本 | G176: 金融 | H176: 证券行业 | I176: 118.13 | J176: -1.06e-002 | K176: -6.5000000000000006e-003 | L176: 13.97 | M176: -3.1899999999999998e-002 | N176: 110.5 | O176: 15.25 | P176: 0.28999999999999998 | Q176: 91.61 | R176: 3月3天 | S176: 5.73年 | T176: 无权 | U176: 80 | V176: 19 | W176: 2.e-003 | X176: 0.13500000000000001 | Y176: 0.124 | Z176: 591 | AA176: 1.45 | AB176: -1.1699999999999999e-002 | AC176: -1.4999999999999999e-002 | AD176: 无权 | AE176: 无权 | AF176: 无权 | AG176: 88.21 | AH176: 0.54 | AI176: AAA | AJ176: 4.0599999999999997e-002 | AK176: =I176+100*P176 -> 147.13 | AL176: 144.7 | AM176: 206 | AN176: 56.4 | AO176: 212 | AP176: -6.9000000000000006e-002 | AQ176: 20 | AR176: 国投转债
A177: 57 | B177: 123056 | C177: 雪榕转债 | D177: 44036. | E177: 300511 | F177: 雪榕生物 | G177: 农业 | H177: 种植业 | I177: 129.299 | J177: -2.6800000000000001e-002 | K177: -2.3399999999999997e-002 | L177: 14.39 | M177: -5.9500000000000004e-002 | N177: 121.1 | O177: 11.89 | P177: 6.8000000000000005e-002 | Q177: 121.03 | R177: 2月5天 | S177: 5.65年 | T177: 3.65年 | U177: 5.85 | V177: 12 | W177: 1.6e-002 | X177: 9.1999999999999998e-002 | Y177: 0.111 | Z177: 64 | AA177: 3.32 | AB177: -1.18e-002 | AC177: -1.8000000000000002e-002 | AD177: -5.5999999999999994e-002 | AE177: -5.7800000000000004e-002 | AF177: 81.56 | AG177: 84.79 | AH177: 0.84 | AI177: AA- | AJ177: 6.6600000000000006e-002 | AK177: =I177+100*P177 -> 136.09900000000002 | AL177: 137.6 | AM177: 149 | AN177: 52.8 | AO177: 197 | AP177: -0.11699999999999999 | AQ177: 10 | AR177: 雪榕转债
A178: 170 | B178: 113545 | C178: 金能转债 | D178: 43776. | E178: 603113 | F178: 金能科技 | G178: 煤炭 | H178: 炼焦 | I178: 121.98 | J178: 3.0000000000000001e-003 | K178: 1.89e-002 | L178: 12.36 | M178: 3.2599999999999997e-002 | N178: 114.9 | O178: 11.4 | P178: 0.125 | Q178: 108.42 | R178: 转股中 | S178: 4.95年 | T178: 2.95年 | U178: 15 | V178: 27 | W178: 1.4999999999999999e-002 | X178: 0.17999999999999999 | Y178: 0.19500000000000001 | Z178: 84 | AA178: 1.42 | AB178: -1.2199999999999999e-002 | AC178: -1.7500000000000002e-002 | AD178: -5.2000000000000005e-002 | AE178: -5.3899999999999997e-002 | AF178: 90.8 | AG178: 93.67 | AH178: 0.67 | AI178: AA | AJ178: 4.2900000000000001e-002 | AK178: =I178+100*P178 -> 134.48000000000002 | AL178: 135.5 | AM178: 130 | AN178: 41.9 | AO178: 114 | AP178: 1.e-002 | AQ178: 21 | AR178: 金能转债
A179: 90 | B179: 128106 | C179: 华统转债 | D179: 43959. | E179: 2840. | F179: 华统股份 | G179: 农业 | H179: 农产品加 | I179: 121.122 | J179: -1.6899999999999998e-002 | K179: 1.41e-002 | L179: 10.13 | M179: -3.9000000000000003e-003 | N179: 113.2 | O179: 9.39 | P179: 0.12300000000000001 | Q179: 107.88 | R179: 转股中 | S179: 5.44年 | T179: 3.44年 | U179: 5.5 | V179: 3.4 | W179: 5.0000000000000001e-003 | X179: 0.122 | Y179: 0.13100000000000001 | Z179: 45 | AA179: 2.7 | AB179: -1.26e-002 | AC179: -1.6899999999999998e-002 | AD179: -4.2500000000000003e-002 | AE179: -4.4299999999999999e-002 | AF179: 88.42 | AG179: 89.24 | AH179: 0.72 | AI179: AA | AJ179: 4.5599999999999995e-002 | AK179: =I179+100*P179 -> 133.422 | AL179: 134.4 | AM179: 114 | AN179: 45.1 | AO179: 143 | AP179: -2.6000000000000002e-002 | AQ179: 7 | AR179: 华统转债
A180: 212 | B180: 110055 | C180: 伊力转债! | D180: 43559. | E180: 600197 | F180: 伊力特 | G180: 食品饮料 | H180: 白酒 | I180: 121.5 | J180: -3.0800000000000001e-002 | K180: -1.6799999999999999e-002 | L180: 18.41 | M180: -7.0199999999999999e-002 | N180: 115 | O180: 16.81 | P180: 0.109 | Q180: 109.52 | R180: 转股中 | S180: 4.37年 | T180: 2.37年 | U180: 8.71 | V180: 38 | W180: 3.5000000000000003e-002 | X180: 0.109 | Y180: 0.11900000000000001 | Z180: 80 | AA180: 2.99 | AB180: -1.2800000000000001e-002 | AC180: -1.8799999999999997e-002 | AD180: -6.1900000000000004e-002 | AE180: -6.4299999999999996e-002 | AF180: 93.15 | AG180: 96.09 | AH180: 0.68 | AI180: AA | AJ180: 4.2900000000000001e-002 | AK180: =I180+100*P180 -> 132.40000000000001 | AL180: 133.5 | AM180: 107 | AN180: 37.4 | AO180: 66 | AP180: -2.8999999999999998e-002 | AQ180: 25 | AR180: 伊力转债!
A181: 59 | B181: 113588 | C181: 润达转债 | D181: 44025. | E181: 603108 | F181: 润达医疗 | G181: 医药 | H181: 医疗器械 | I181: 122.62 | J181: -9.8999999999999991e-003 | K181: 6.0999999999999995e-003 | L181: 14.01 | M181: -5.6999999999999993e-003 | N181: 114.2 | O181: 13.36 | P181: 0.16899999999999998 | Q181: 104.87 | R181: 53天 | S181: 5.63年 | T181: 3.63年 | U181: 5.5 | V181: 14 | W181: 2.e-002 | X181: 6.8000000000000005e-002 | Y181: 7.0999999999999994e-002 | Z181: 81 | AA181: 2.71 | AB181: -1.2800000000000001e-002 | AC181: -1.72e-002 | AD181: -4.36e-002 | AE181: -4.53e-002 | AF181: 87.69 | AG181: 89.28 | AH181: 0.68 | AI181: AA | AJ181: 4.5599999999999995e-002 | AK181: =I181+100*P181 -> 139.52000000000001 | AL181: 140.4 | AM181: 172 | AN181: 51.1 | AO181: 181 | AP181: 3.7999999999999999e-002 | AQ181: 7 | AR181: 润达转债
A182: 154 | B182: 110062 | C182: 烽火转债 | D182: 43824. | E182: 600498 | F182: 烽火通信 | G182: 通信互联 | H182: 通信设备 | I182: 118.5 | J182: -1.9e-003 | K182: -3.4999999999999996e-003 | L182: 23.61 | M182: -1.01e-002 | N182: 111 | O182: 25.65 | P182: 0.28699999999999998 | Q182: 92.05 | R182: 转股中 | S182: 5年32天 | T182: 3年32天 | U182: 30.9 | V182: 2.1 | W182: 1.e-003 | X182: 0.11199999999999999 | Y182: 0.10300000000000001 | Z182: 276 | AA182: 2.65 | AB182: -1.3000000000000001e-002 | AC182: -1.6899999999999998e-002 | AD182: -4.1100000000000005e-002 | AE182: -4.2999999999999997e-002 | AF182: 91.04 | AG182: 91.01 | AH182: 0.54 | AI182: AAA | AJ182: 4.0599999999999997e-002 | AK182: =I182+100*P182 -> 147.19999999999999 | AL182: 145 | AM182: 207 | AN182: 53.9 | AO182: 203 | AP182: -2.7999999999999997e-002 | AQ182: 19 | AR182: 烽火转债
A183: 86 | B183: 113577 | C183: 春秋转债 | D183: 43964. | E183: 603890 | F183: 春秋电子 | G183: 电子 | H183: 电子产品 | I183: 126.81 | J183: -5.3899999999999997e-002 | K183: -1.3100000000000001e-002 | L183: 13.1 | M183: -8.199999999999999e-002 | N183: 118.2 | O183: 11.06 | P183: 7.0999999999999994e-002 | Q183: 118.44 | R183: 转股中 | S183: 5.45年 | T183: 3.45年 | U183: 2.33 | V183: 24 | W183: 8.0000000000000002e-002 | X183: 4.5999999999999999e-002 | Y183: 5.5e-002 | Z183: 50 | AA183: 3.11 | AB183: -1.3100000000000001e-002 | AC183: -1.8799999999999997e-002 | AD183: -5.3600000000000002e-002 | AE183: -5.5599999999999997e-002 | AF183: 82.68 | AG183: 83.84 | AH183: 0.82 | AI183: AA- | AJ183: 6.6600000000000006e-002 | AK183: =I183+100*P183 -> 133.91 | AL183: 135.2 | AM183: 124 | AN183: 51.3 | AO183: 185 | AP183: -0.127 | AQ183: 8 | AR183: 春秋转债
A184: 238 | B184: 128048 | C184: 张行转债 | D184: 43433. | E184: 2839. | F184: 张家港行 | G184: 金融 | H184: 银行行业 | I184: 120.201 | J184: -9.1999999999999998e-003 | K184: -5.7999999999999996e-003 | L184: 5.8 | M184: -2.6800000000000001e-002 | N184: 113.9 | O184: 5.76 | P184: 0.19399999999999998 | Q184: 100.69 | R184: 转股中 | S184: 4年12天 | T184: 无权 | U184: 25 | V184: 17 | W184: 6.0000000000000001e-003 | X184: 0.23800000000000002 | Y184: 0.23999999999999999 | Z184: 105 | AA184: 1 | AB184: -1.3500000000000002e-002 | AC184: -1.9599999999999999e-002 | AD184: 无权 | AE184: 无权 | AF184: 无权 | AG184: 97.25 | AH184: 0.56 | AI184: AA+ | AJ184: 4.0899999999999999e-002 | AK184: =I184+100*P184 -> 139.601 | AL184: 139.7 | AM184: 165 | AN184: 42.5 | AO184: 119 | AP184: -4.2000000000000003e-002 | AQ184: 14 | AR184: 张行转债
A185: 182 | B185: 113541 | C185: 荣晟转债! | D185: 43690. | E185: 603165 | F185: 荣晟环保 | G185: 造纸包装 | H185: 包装用纸 | I185: 122.59 | J185: -1.1899999999999999e-002 | K185: -9.4999999999999998e-003 | L185: 13.12 | M185: -2.7400000000000001e-002 | N185: 115 | O185: 11.54 | P185: 7.8e-002 | Q185: 113.69 | R185: 转股中 | S185: 4.73年 | T185: 2.73年 | U185: 2.75 | V185: 7.1 | W185: 2.1000000000000001e-002 | X185: 8.4000000000000005e-002 | Y185: 9.5000000000000001e-002 | Z185: 33 | AA185: 2.27 | AB185: -1.37e-002 | AC185: -1.9199999999999998e-002 | AD185: -5.74e-002 | AE185: -5.9500000000000004e-002 | AF185: 86.68 | AG185: 86.33 | AH185: 0.78 | AI185: AA- | AJ185: 6.3899999999999998e-002 | AK185: =I185+100*P185 -> 130.39000000000001 | AL185: 131.5 | AM185: 84 | AN185: 44.8 | AO185: 139 | AP185: -7.2000000000000008e-002 | AQ185: 49 | AR185: 荣晟转债!
A186: 73 | B186: 128109 | C186: 楚江转债 | D186: 44005. | E186: 2171. | F186: 楚江新材 | G186: 有色金属 | H186: 铜金属 | I186: 124.535 | J186: -1.4800000000000001e-002 | K186: -1.47e-002 | L186: 9.37 | M186: -4.2900000000000001e-002 | N186: 115.3 | O186: 8.73 | P186: 0.16 | Q186: 107.33 | R186: 40天 | S186: 5.59年 | T186: 3.59年 | U186: 18.3 | V186: 15 | W186: 6.0000000000000001e-003 | X186: 0.14599999999999999 | Y186: 0.157 | Z186: 125 | AA186: 2.27 | AB186: -1.3899999999999999e-002 | AC186: -1.8700000000000001e-002 | AD186: -4.7699999999999992e-002 | AE186: -4.9500000000000002e-002 | AF186: 87.93 | AG186: 90.3 | AH186: 0.69 | AI186: AA | AJ186: 4.5599999999999995e-002 | AK186: =I186+100*P186 -> 140.535 | AL186: 141.7 | AM186: 184 | AN186: 51.4 | AO186: 187 | AP186: -5.9000000000000004e-002 | AQ186: 5 | AR186: 楚江转债
A187: 214 | B187: 127011 | C187: 中鼎转2! | D187: 43559. | E187: 887. | F187: 中鼎股份 | G187: 汽车 | H187: 零部件制 | I187: 122.34 | J187: -5.4000000000000003e-003 | K187: -5.6999999999999993e-003 | L187: 11.03 | M187: -2.2200000000000001e-002 | N187: 115.2 | O187: 11.59 | P187: 0.28600000000000003 | Q187: 95.17 | R187: 转股中 | S187: 4.35年 | T187: 2.35年 | U187: 12 | V187: 17 | W187: 1.2e-002 | X187: 8.900000000000001e-002 | Y187: 8.5000000000000006e-002 | Z187: 135 | AA187: 1.54 | AB187: -1.3999999999999999e-002 | AC187: -2.0099999999999996e-002 | AD187: -6.480000000000001e-002 | AE187: -6.7199999999999996e-002 | AF187: 93.7 | AG187: 97.14 | AH187: 0.5 | AI187: AA+ | AJ187: 4.0899999999999999e-002 | AK187: =I187+100*P187 -> 150.94 | AL187: 149.5 | AM187: 230 | AN187: 52.4 | AO187: 194 | AP187: 2.3e-002 | AQ187: 27 | AR187: 中鼎转2!
A188: 35 | B188: 123060 | C188: 苏试转债 | D188: 44060. | E188: 300416 | F188: 苏试试验 | G188: 机械装备 | H188: 专用设备 | I188: 127.35 | J188: -1.8100000000000002e-002 | K188: -8.3999999999999995e-003 | L188: 23.98 | M188: -3.6900000000000002e-002 | N188: 117.6 | O188: 23.86 | P188: 0.26700000000000002 | Q188: 100.5 | R188: 2月28天 | S188: 5.72年 | T188: 3.72年 | U188: 3.1 | V188: 84 | W188: 0.20999999999999999 | X188: 6.4000000000000001e-002 | Y188: 6.4000000000000001e-002 | Z188: 49 | AA188: 4.91 | AB188: -1.41e-002 | AC188: -1.9299999999999998e-002 | AD188: -5.1399999999999994e-002 | AE188: -5.3200000000000004e-002 | AF188: 81.1 | AG188: 81.94 | AH188: 0.72 | AI188: AA- | AJ188: 6.6600000000000006e-002 | AK188: =I188+100*P188 -> 154.05000000000001 | AL188: 154.2 | AM188: 241 | AN188: 72.3 | AO188: 252 | AP188: -8.3000000000000004e-002 | AQ188: 5 | AR188: 苏试转债
A189: 302 | B189: 110031 | C189: 航信转债!! | D189: 42185. | E189: 600271 | F189: 航天信息 | G189: 计算机及 | H189: 软件开发 | I189: 107.95 | J189: -4.3e-003 | K189: 4.3e-003 | L189: 15.52 | M189: 2.5999999999999999e-003 | N189: 107 | O189: 21.56 | P189: 0.5 | Q189: 71.99 | R189: 转股中 | S189: 0.61年 | T189: 回售中 | U189: 24 | V189: 13 | W189: 5.0000000000000001e-003 | X189: 8.3000000000000004e-002 | Y189: 5.9999999999999998e-002 | Z189: 288 | AA189: 2.59 | AB189: -1.43e-002 | AC189: -3.5200000000000002e-002 | AD189: 回售中 | AE189: 回售中 | AF189: 100.27 | AG189: 104.75 | AH189: 0 | AI189: AAA | AJ189: 3.5200000000000002e-002 | AK189: =I189+100*P189 -> 157.94999999999999 | AL189: 143.9 | AM189: 202 | AN189: 39.2 | AO189: 87 | AP189: -2.3e-002 | AQ189: 14 | AR189: 航信转债!!
A190: 62 | B190: 128113 | C190: 比音转债 | D190: 44027. | E190: 2832. | F190: 比音勒芬 | G190: 服装纺织 | H190: 服装行业 | I190: 127 | J190: -7.8000000000000005e-003 | K190: -1.1000000000000001e-002 | L190: 17.31 | M190: -2.4799999999999999e-002 | N190: 117.3 | O190: 14.9 | P190: 9.3000000000000013e-002 | Q190: 116.17 | R190: 51天 | S190: 5.62年 | T190: 3.62年 | U190: 6.89 | V190: 9.4 | W190: 1.1000000000000001e-002 | X190: 7.5999999999999998e-002 | Y190: 8.8000000000000009e-002 | Z190: 91 | AA190: 4.22 | AB190: -1.43e-002 | AC190: -1.95e-002 | AD190: -5.2300000000000006e-002 | AE190: -5.4100000000000002e-002 | AF190: 87.81 | AG190: 91.73 | AH190: 0.76 | AI190: AA | AJ190: 4.5599999999999995e-002 | AK190: =I190+100*P190 -> 136.30000000000001 | AL190: 137.8 | AM190: 152 | AN190: 46.1 | AO190: 152 | AP190: -2.5000000000000001e-002 | AQ190: 5 | AR190: 比音转债
A191: 140 | B191: 110065 | C191: 淮矿转债! | D191: 43843. | E191: 600985 | F191: 淮北矿业 | G191: 煤炭 | H191: 煤炭开采 | I191: 120 | J191: -1.7600000000000001e-002 | K191: 1.34e-002 | L191: 10.08 | M191: -5.8999999999999999e-003 | N191: 111 | O191: 9.33 | P191: 0.111 | Q191: 108.04 | R191: 转股中 | S191: 5年53天 | T191: 3年53天 | U191: 27.6 | V191: 7.8 | W191: 2.e-003 | X191: 0.126 | Y191: 0.13600000000000001 | Z191: 219 | AA191: 1.06 | AB191: -1.5300000000000001e-002 | AC191: -1.9099999999999999e-002 | AD191: -4.41e-002 | AE191: -4.5999999999999999e-002 | AF191: 90.83 | AG191: 90.81 | AH191: 0.71 | AI191: AAA | AJ191: 4.0599999999999997e-002 | AK191: =I191+100*P191 -> 131.09999999999999 | AL191: 132 | AM191: 91 | AN191: 41.1 | AO191: 106 | AP191: -6.9999999999999993e-003 | AQ191: 22 | AR191: 淮矿转债!
A192: 121 | B192: 113032 | C192: 桐20转债! | D192: 43910. | E192: 601233 | F192: 桐昆股份 | G192: 服装纺织 | H192: 纺织行业 | I192: 123.1 | J192: -2.29e-002 | K192: -1.9e-003 | L192: 15.13 | M192: -3.6299999999999999e-002 | N192: 113.1 | O192: 14.35 | P192: 0.16800000000000001 | Q192: 105.44 | R192: 转股中 | S192: 5.33年 | T192: 3.33年 | U192: 23 | V192: 6.3 | W192: 2.e-003 | X192: 8.199999999999999e-002 | Y192: 8.6999999999999994e-002 | Z192: 280 | AA192: 1.45 | AB192: -1.6e-002 | AC192: -2.0400000000000001e-002 | AD192: -4.8499999999999995e-002 | AE192: -5.0300000000000004e-002 | AF192: 89.34 | AG192: 90.47 | AH192: 0.68 | AI192: AA+ | AJ192: 4.36e-002 | AK192: =I192+100*P192 -> 139.90000000000001 | AL192: 140.8 | AM192: 176 | AN192: 50.3 | AO192: 178 | AP192: -2.5000000000000001e-002 | AQ192: 20 | AR192: 桐20转债!
A193: 190 | B193: 113536 | C193: 三星转债 | D193: 43640. | E193: 603578 | F193: 三星新材 | G193: 家电 | H193: 零部件制 | I193: 123.7 | J193: -2.81e-002 | K193: 6.7000000000000002e-003 | L193: 23.56 | M193: -2.8500000000000001e-002 | N193: 114.8 | O193: 19.54 | P193: 2.6000000000000002e-002 | Q193: 120.57 | R193: 转股中 | S193: 4.58年 | T193: 2.58年 | U193: 1.49 | V193: 58 | W193: 0.311 | X193: 6.9000000000000006e-002 | Y193: 8.3000000000000004e-002 | Z193: 22 | AA193: 3.1 | AB193: -1.6500000000000001e-002 | AC193: -2.2099999999999998e-002 | AD193: -6.4000000000000001e-002 | AE193: -6.6100000000000006e-002 | AF193: 92.14 | AG193: 95.05 | AH193: 0.75 | AI193: AA | AJ193: 4.2900000000000001e-002 | AK193: =I193+100*P193 -> 126.3 | AL193: 126.8 | AM193: 41 | AN193: 31.8 | AO193: 26 | AP193: 3.4000000000000002e-002 | AQ193: 37 | AR193: 三星转债
A194: 149 | B194: 113553 | C194: 金牌转债! | D194: 43837. | E194: 603180 | F194: 金牌厨柜 | G194: 其他 | H194: 家居用品 | I194: 135.6 | J194: -1.9900000000000001e-002 | K194: -3.2300000000000002e-002 | L194: 56.28 | M194: -6.1799999999999994e-002 | N194: 124.6 | O194: 44.14 | P194: 6.4000000000000001e-002 | Q194: 127.5 | R194: 转股中 | S194: 5年43天 | T194: 3年43天 | U194: 2.75 | V194: 36 | W194: 9.5000000000000001e-002 | X194: 5.0000000000000003e-002 | Y194: 6.4000000000000001e-002 | Z194: 55 | AA194: 4.59 | AB194: -1.67e-002 | AC194: -2.4500000000000001e-002 | AD194: -7.8200000000000006e-002 | AE194: -8.0199999999999994e-002 | AF194: 84.47 | AG194: 90.27 | AH194: 0.84 | AI194: AA- | AJ194: 6.6600000000000006e-002 | AK194: =I194+100*P194 -> 142. | AL194: 143.7 | AM194: 199 | AN194: 53.4 | AO194: 202 | AP194: -2.5000000000000001e-002 | AQ194: 14 | AR194: 金牌转债!
A195: 112 | B195: 110067 | C195: 华安转债! | D195: 43930. | E195: 600909 | F195: 华安证券 | G195: 金融 | H195: 证券行业 | I195: 120.82 | J195: -9.7000000000000003e-003 | K195: -1.0200000000000001e-002 | L195: 7.96 | M195: -3.7499999999999999e-002 | N195: 110.5 | O195: 8.67 | P195: 0.316 | Q195: 91.81 | R195: 转股中 | S195: 5.36年 | T195: 无权 | U195: 28 | V195: 27 | W195: 8.0000000000000002e-003 | X195: 9.6999999999999989e-002 | Y195: 8.900000000000001e-002 | Z195: 288 | AA195: 2.08 | AB195: -1.67e-002 | AC195: -2.0199999999999999e-002 | AD195: 无权 | AE195: 无权 | AF195: 无权 | AG195: 89.51 | AH195: 0.53 | AI195: AAA | AJ195: 4.0599999999999997e-002 | AK195: =I195+100*P195 -> 152.41999999999999 | AL195: 149.8 | AM195: 231 | AN195: 60.3 | AO195: 230 | AP195: -8.1000000000000003e-002 | AQ195: 26 | AR195: 华安转债!
A196: 268 | B196: 123007 | C196: 道氏转债!! | D196: 43126. | E196: 300409 | F196: 道氏技术 | G196: 建筑 | H196: 建筑行业 | I196: 117.33 | J196: 3.7000000000000002e-003 | K196: 1.8100000000000002e-002 | L196: 14.79 | M196: 3.5000000000000003e-002 | N196: 111.3 | O196: 14.95 | P196: 0.18600000000000003 | Q196: 98.93 | R196: 转股中 | S196: 3年58天 | T196: 1年58天 | U196: 3.04 | V196: 1958. | W196: 5.3600000000000003 | X196: 4.4999999999999998e-002 | Y196: 4.4000000000000004e-002 | Z196: 68 | AA196: 2.85 | AB196: -1.6899999999999998e-002 | AC196: -2.3300000000000001e-002 | AD196: -9.5500000000000002e-002 | AE196: -9.9199999999999997e-002 | AF196: 94.81 | AG196: 91.94 | AH196: 0.62 | AI196: AA- | AJ196: 6.3899999999999998e-002 | AK196: =I196+100*P196 -> 135.93000000000001 | AL196: 135.7 | AM196: 133 | AN196: 40.9 | AO196: 103 | AP196: 8.199999999999999e-002 | AQ196: 17 | AR196: 道氏转债!!
A197: 109 | B197: 113571 | C197: 博特转债! | D197: 43922. | E197: 603916 | F197: 苏博特 | G197: 建筑 | H197: 水泥 | I197: 132.61 | J197: -4.9500000000000002e-002 | K197: 2.0999999999999999e-003 | L197: 25.12 | M197: -4.7400000000000005e-002 | N197: 120.8 | O197: 18.88 | P197: -3.0000000000000001e-003 | Q197: 133.05 | R197: 转股中 | S197: 5.36年 | T197: 3.36年 | U197: 3.27 | V197: 16 | W197: 3.7000000000000005e-002 | X197: 4.0000000000000001e-002 | Y197: 5.4000000000000006e-002 | Z197: 81 | AA197: 2.86 | AB197: -1.7600000000000001e-002 | AC197: -2.4e-002 | AD197: -6.6900000000000001e-002 | AE197: -6.8900000000000003e-002 | AF197: 83.19 | AG197: 86.17 | AH197: 1 | AI197: AA- | AJ197: 6.6600000000000006e-002 | AK197: =I197+100*P197 -> 132.31 | AL197: 132.2 | AM197: 92 | AN197: 46 | AO197: 151 | AP197: -0.10099999999999999 | AQ197: 13 | AR197: 博特转债!
A198: 266 | B198: 110043 | C198: 无锡转债! | D198: 43173. | E198: 600908 | F198: 无锡银行 | G198: 金融 | H198: 银行行业 | I198: 115.51 | J198: -1.1899999999999999e-002 | K198: -7.000000000000001e-004 | L198: 5.55 | M198: -2.46e-002 | N198: 109.1 | O198: 5.79 | P198: 0.20499999999999999 | Q198: 95.85 | R198: 转股中 | S198: 3.25年 | T198: 无权 | U198: 30 | V198: 19 | W198: 6.0000000000000001e-003 | X198: 0.29199999999999998 | Y198: 0.28000000000000003 | Z198: 103 | AA198: 0.9 | AB198: -1.77e-002 | AC198: -2.2799999999999997e-002 | AD198: 无权 | AE198: 无权 | AF198: 无权 | AG198: 95.98 | AH198: 0.51 | AI198: AA+ | AJ198: 4.0899999999999999e-002 | AK198: =I198+100*P198 -> 136.00999999999999 | AL198: 135.2 | AM198: 123 | AN198: 39.2 | AO198: 88 | AP198: -4.2000000000000003e-002 | AQ198: 31 | AR198: 无锡转债!
A199: 67 | B199: 128110 | C199: 永兴转债 | D199: 44020. | E199: 2756. | F199: 永兴材料 | G199: 钢铁 | H199: 炼钢 | I199: 124.982 | J199: -2.3599999999999999e-002 | K199: -1.29e-002 | L199: 18.32 | M199: -5.1799999999999999e-002 | N199: 113.2 | O199: 17.06 | P199: 0.16399999999999998 | Q199: 107.39 | R199: 45天 | S199: 5.61年 | T199: 3.61年 | U199: 7 | V199: 9.4 | W199: 1.1000000000000001e-002 | X199: 0.105 | Y199: 0.11199999999999999 | Z199: 67 | AA199: 1.94 | AB199: -1.78e-002 | AC199: -2.1899999999999999e-002 | AD199: -4.87e-002 | AE199: -5.04e-002 | AF199: 87.78 | AG199: 88.59 | AH199: 0.71 | AI199: AA | AJ199: 4.5599999999999995e-002 | AK199: =I199+100*P199 -> 141.38200000000001 | AL199: 142.6 | AM199: 192 | AN199: 54 | AO199: 204 | AP199: 3.7000000000000005e-002 | AQ199: 4 | AR199: 永兴转债
A200: 188 | B200: 113537 | C200: 文灿转债! | D200: 43651. | E200: 603348 | F200: 文灿股份 | G200: 汽车 | H200: 零部件制 | I200: 131.94 | J200: -5.6999999999999993e-003 | K200: -1.1000000000000001e-002 | L200: 25.69 | M200: -1.95e-002 | N200: 121.5 | O200: 19.43 | P200: -2.e-003 | Q200: 132.22 | R200: 转股中 | S200: 4.61年 | T200: 2.61年 | U200: 5.02 | V200: 261 | W200: 0.38600000000000001 | X200: 8.1000000000000003e-002 | Y200: 0.107 | Z200: 62 | AA200: 2.61 | AB200: -1.8100000000000002e-002 | AC200: -2.5899999999999999e-002 | AD200: -8.1699999999999995e-002 | AE200: -8.4399999999999989e-002 | AF200: 88.12 | AG200: 91.98 | AH200: 0.85 | AI200: AA- | AJ200: 6.3899999999999998e-002 | AK200: =I200+100*P200 -> 131.74000000000001 | AL200: 131.7 | AM200: 86 | AN200: 39.7 | AO200: 92 | AP200: 5.7999999999999996e-002 | AQ200: 26 | AR200: 文灿转债!
A201: 283 | B201: 110038 | C201: 济川转债! | D201: 43068. | E201: 600566 | F201: 济川药业 | G201: 医药 | H201: 中药 | I201: 112.36 | J201: -1.3300000000000001e-002 | K201: 8.8999999999999999e-003 | L201: 22.1 | M201: -1.2500000000000001e-002 | N201: 108.3 | O201: 24.27 | P201: 0.23399999999999999 | Q201: 91.06 | R201: 转股中 | S201: 2年13天 | T201: 13天 | U201: 6.28 | V201: 2.4 | W201: 3.0000000000000001e-003 | X201: 3.2000000000000001e-002 | Y201: 2.8999999999999998e-002 | Z201: 196 | AA201: 2.67 | AB201: -1.8200000000000001e-002 | AC201: -2.5600000000000001e-002 | AD201: -0.54299999999999993 | AE201: -0.55299999999999994 | AF201: 100.21 | AG201: 99.62 | AH201: 0.35 | AI201: AA | AJ201: 4.2500000000000003e-002 | AK201: =I201+100*P201 -> 135.75999999999999 | AL201: 133.7 | AM201: 110 | AN201: 33.5 | AO201: 37 | AP201: -2.3e-002 | AQ201: 20 | AR201: 济川转债!
A202: 193 | B202: 110058 | C202: 永鼎转债! | D202: 43593. | E202: 600105 | F202: 永鼎股份 | G202: 通信互联 | H202: 通信设备 | I202: 124.82 | J202: -9.3999999999999986e-003 | K202: 9.3999999999999986e-003 | L202: 6.29 | M202: 0. | N202: 114.9 | O202: 5.04 | P202: 0. | Q202: 124.8 | R202: 转股中 | S202: 4.46年 | T202: 2.46年 | U202: 4.5 | V202: 5.5 | W202: 1.e-002 | X202: 5.5e-002 | Y202: 6.9000000000000006e-002 | Z202: 82 | AA202: 3.09 | AB202: -1.8799999999999997e-002 | AC202: -2.4500000000000001e-002 | AD202: -6.9900000000000004e-002 | AE202: -7.2099999999999997e-002 | AF202: 92.71 | AG202: 95.64 | AH202: 0.79 | AI202: AA | AJ202: 4.2900000000000001e-002 | AK202: =I202+100*P202 -> 124.81999999999999 | AL202: 124.8 | AM202: 26 | AN202: 29.2 | AO202: 18 | AP202: 1.e-003 | AQ202: 53 | AR202: 永鼎转债!
A203: 221 | B203: 110051 | C203: 中天转债! | D203: 43546. | E203: 600522 | F203: 中天科技 | G203: 通信互联 | H203: 通信设备 | I203: 123.74 | J203: -1.09e-002 | K203: 4.7999999999999996e-003 | L203: 11.03 | M203: -9.0000000000000011e-003 | N203: 113.9 | O203: 10.09 | P203: 0.13200000000000001 | Q203: 109.32 | R203: 转股中 | S203: 4.33年 | T203: 2.33年 | U203: 39.6 | V203: 14 | W203: 3.0000000000000001e-003 | X203: 0.11699999999999999 | Y203: 0.128 | Z203: 338 | AA203: 1.58 | AB203: -1.9299999999999998e-002 | AC203: -2.4900000000000002e-002 | AD203: -7.0099999999999996e-002 | AE203: -7.2400000000000006e-002 | AF203: 93.66 | AG203: 96.11 | AH203: 0.68 | AI203: AA+ | AJ203: 4.0899999999999999e-002 | AK203: =I203+100*P203 -> 136.94 | AL203: 138.2 | AM203: 153 | AN203: 42.1 | AO203: 116 | AP203: 5.0000000000000001e-003 | AQ203: 27 | AR203: 中天转债!
A204: 74 | B204: 123051 | C204: 今天转债 | D204: 44012. | E204: 300532 | F204: 今天国际 | G204: 计算机及 | H204: 软件开发 | I204: 136.8 | J204: -5.2300000000000006e-002 | K204: 1.7500000000000002e-002 | L204: 11.67 | M204: -3.95e-002 | N204: 122.8 | O204: 8.8 | P204: 3.2000000000000001e-002 | Q204: 132.61 | R204: 40天 | S204: 5.59年 | T204: 3.59年 | U204: 2.8 | V204: 273 | W204: 0.69999999999999996 | X204: 8.8000000000000009e-002 | Y204: 0.11599999999999999 | Z204: 32 | AA204: 4 | AB204: -1.95e-002 | AC204: -2.6200000000000001e-002 | AD204: -6.9400000000000003e-002 | AE204: -7.1500000000000008e-002 | AF204: 79.36 | AG204: 81.69 | AH204: 0.88 | AI204: A+ | AJ204: 7.7600000000000002e-002 | AK204: =I204+100*P204 -> 140. | AL204: 141 | AM204: 178 | AN204: 59.3 | AO204: 225 | AP204: -6.3e-002 | AQ204: 10 | AR204: 今天转债
A205: 159 | B205: 110061 | C205: 川投转债 | D205: 43801. | E205: 600674 | F205: 川投能源 | G205: 能源电力 | H205: 水电 | I205: 122.54 | J205: 1.26e-002 | K205: -4.4000000000000003e-003 | L205: 10.07 | M205: 1.21e-002 | N205: 111 | O205: 9.58 | P205: 0.16600000000000001 | Q205: 105.11 | R205: 转股中 | S205: 5年11天 | T205: 3年11天 | U205: 40 | V205: 32 | W205: 6.0000000000000001e-003 | X205: 8.9999999999999997e-002 | Y205: 9.5000000000000001e-002 | Z205: 443 | AA205: 1.6 | AB205: -1.9799999999999998e-002 | AC205: -2.3700000000000002e-002 | AD205: -5.1900000000000002e-002 | AE205: -5.3800000000000001e-002 | AF205: 91.25 | AG205: 91.22 | AH205: 0.68 | AI205: AAA | AJ205: 4.0599999999999997e-002 | AK205: =I205+100*P205 -> 139.14000000000001 | AL205: 140 | AM205: 167 | AN205: 48.7 | AO205: 166 | AP205: 2.4e-002 | AQ205: 15 | AR205: 川投转债
A206: 127 | B206: 128096 | C206: 奥瑞转债! | D206: 43906. | E206: 2701. | F206: 奥瑞金 | G206: 造纸包装 | H206: 包装材料 | I206: 129.034 | J206: -3.2000000000000001e-002 | K206: -1.89e-002 | L206: 5.63 | M206: -6.3200000000000006e-002 | N206: 116 | O206: 4.52 | P206: 3.6000000000000004e-002 | Q206: 124.56 | R206: 转股中 | S206: 5.28年 | T206: 3.28年 | U206: 8.97 | V206: 47 | W206: 4.0000000000000001e-002 | X206: 6.7000000000000004e-002 | Y206: 8.3000000000000004e-002 | Z206: 135 | AA206: 2.29 | AB206: -2.0400000000000001e-002 | AC206: -2.5600000000000001e-002 | AD206: -6.0499999999999998e-002 | AE206: -6.2600000000000003e-002 | AF206: 90.24 | AG206: 93.09 | AH206: 0.81 | AI206: AA+ | AJ206: 4.36e-002 | AK206: =I206+100*P206 -> 132.63399999999999 | AL206: 133.5 | AM206: 108 | AN206: 40.4 | AO206: 100 | AP206: -3.7000000000000005e-002 | AQ206: 21 | AR206: 奥瑞转债!
A207: 120 | B207: 110066 | C207: 盛屯转债! | D207: 43921. | E207: 600711 | F207: 盛屯矿业 | G207: 有色金属 | H207: 有色行业 | I207: 128.5 | J207: -1.04e-002 | K207: -3.2300000000000002e-002 | L207: 5.63 | M207: -5.7000000000000002e-002 | N207: 115.3 | O207: 4.88 | P207: 0.114 | Q207: 115.37 | R207: 转股中 | S207: 5.33年 | T207: 3.33年 | U207: 23.6 | V207: 8.1 | W207: 3.0000000000000001e-003 | X207: 0.18100000000000002 | Y207: 0.20899999999999999 | Z207: 130 | AA207: 1.41 | AB207: -2.0499999999999997e-002 | AC207: -2.5399999999999999e-002 | AD207: -5.9699999999999996e-002 | AE207: -6.1600000000000002e-002 | AF207: 88.94 | AG207: 91.34 | AH207: 0.75 | AI207: AA | AJ207: 4.5599999999999995e-002 | AK207: =I207+100*P207 -> 139.90000000000001 | AL207: 141.6 | AM207: 181 | AN207: 50.3 | AO207: 177 | AP207: 2.e-003 | AQ207: 44 | AR207: 盛屯转债!
A208: 255 | B208: 128040 | C208: 华通转债! | D208: 43294. | E208: 2758. | F208: 华通医药 | G208: 医药 | H208: 医药商业 | I208: 121 | J208: -4.7199999999999999e-002 | K208: 4.2699999999999995e-002 | L208: 11.59 | M208: -6.8999999999999999e-003 | N208: 112.3 | O208: 11.29 | P208: 0.17899999999999999 | Q208: 102.66 | R208: 转股中 | S208: 3.62年 | T208: 1.62年 | U208: 2.22 | V208: 160 | W208: 0.58499999999999996 | X208: 9.0999999999999998e-002 | Y208: 9.4e-002 | Z208: 24 | AA208: 3.92 | AB208: -2.0799999999999999e-002 | AC208: -2.6800000000000001e-002 | AD208: -8.7799999999999989e-002 | AE208: -9.0500000000000011e-002 | AF208: 92.11 | AG208: 90.14 | AH208: 0.66 | AI208: AA- | AJ208: 6.3899999999999998e-002 | AK208: =I208+100*P208 -> 138.90000000000001 | AL208: 139.3 | AM208: 161 | AN208: 47.2 | AO208: 159 | AP208: 3.4000000000000002e-002 | AQ208: 30 | AR208: 华通转债!
A209: 111 | B209: 123044 | C209: 红相转债! | D209: 43934. | E209: 300427 | F209: 红相股份 | G209: 能源电力 | H209: 电力设备 | I209: 140.3 | J209: -1.9699999999999999e-002 | K209: -2.2499999999999999e-002 | L209: 24.93 | M209: -4.9599999999999998e-002 | N209: 125.5 | O209: 18.8 | P209: 5.7999999999999996e-002 | Q209: 132.61 | R209: 转股中 | S209: 5.36年 | T209: 3.36年 | U209: 5.5 | V209: 166 | W209: 0.20800000000000002 | X209: 6.2e-002 | Y209: 8.199999999999999e-002 | Z209: 89 | AA209: 3.93 | AB209: -2.1099999999999997e-002 | AC209: -2.87e-002 | AD209: -7.980000000000001e-002 | AE209: -8.2100000000000006e-002 | AF209: 83.91 | AG209: 89.63 | AH209: 0.85 | AI209: AA- | AJ209: 6.6600000000000006e-002 | AK209: =I209+100*P209 -> 146.10000000000002 | AL209: 148 | AM209: 224 | AN209: 58.4 | AO209: 221 | AP209: -6.3e-002 | AQ209: 15 | AR209: 红相转债!
A210: 168 | B210: 128078 | C210: 太极转债! | D210: 43777. | E210: 2368. | F210: 太极股份 | G210: 计算机及 | H210: 软件开发 | I210: 129.8 | J210: 6.1999999999999998e-003 | K210: -2.0999999999999999e-003 | L210: 26.8 | M210: 4.0999999999999995e-003 | N210: 116.9 | O210: 22.4 | P210: 8.5000000000000006e-002 | Q210: 119.64 | R210: 转股中 | S210: 4.97年 | T210: 2.97年 | U210: 9.6 | V210: 35 | W210: 2.7999999999999997e-002 | X210: 6.2e-002 | Y210: 7.400000000000001e-002 | Z210: 155 | AA210: 5.05 | AB210: -2.12e-002 | AC210: -2.69e-002 | AD210: -7.0400000000000004e-002 | AE210: -7.2300000000000003e-002 | AF210: 90.73 | AG210: 95.22 | AH210: 1 | AI210: AA | AJ210: 4.2900000000000001e-002 | AK210: =I210+100*P210 -> 138.30000000000001 | AL210: 140 | AM210: 166 | AN210: 44.7 | AO210: 138 | AP210: -4.2999999999999997e-002 | AQ210: 11 | AR210: 太极转债!
A211: 289 | B211: 113014 | C211: 林洋转债! | D211: 43052. | E211: 601222 | F211: 林洋能源 | G211: 能源电力 | H211: 电力设备 | I211: 117 | J211: 1.2999999999999999e-003 | K211: -1.2199999999999999e-002 | L211: 7.86 | M211: -2.4799999999999999e-002 | N211: 109.3 | O211: 8.54 | P211: 0.27100000000000002 | Q211: 92.04 | R211: 转股中 | S211: 2.99年 | T211: 0.99年 | U211: 30 | V211: 16 | W211: 5.0000000000000001e-003 | X211: 0.218 | Y211: 0.20100000000000001 | Z211: 137 | AA211: 1.32 | AB211: -2.2799999999999997e-002 | AC211: -2.8399999999999998e-002 | AD211: -0.11 | AE211: -0.113 | AF211: 97.03 | AG211: 96.7 | AH211: 0.44 | AI211: AA | AJ211: 4.2500000000000003e-002 | AK211: =I211+100*P211 -> 144.09999999999999 | AL211: 142 | AM211: 186 | AN211: 44.9 | AO211: 141 | AP211: 2.8999999999999998e-002 | AQ211: 22 | AR211: 林洋转债!
A212: 51 | B212: 123057 | C212: 美联转债 | D212: 44039. | E212: 300586 | F212: 美联新材 | G212: 化工 | H212: 橡胶塑料 | I212: 135.45 | J212: -5.9400000000000001e-002 | K212: 3.9199999999999999e-002 | L212: 10.9 | M212: -2.5899999999999999e-002 | N212: 118.2 | O212: 9.91 | P212: 0.23100000000000001 | Q212: 109.99 | R212: 2月8天 | S212: 5.67年 | T212: 3.67年 | U212: 2.07 | V212: 2174. | W212: 7.2999999999999998 | X212: 4.2000000000000003e-002 | Y212: 4.5999999999999999e-002 | Z212: 50 | AA212: 6.68 | AB212: -2.4199999999999999e-002 | AC212: -2.9600000000000001e-002 | AD212: -6.7000000000000004e-002 | AE212: -6.88e-002 | AF212: 81.54 | AG212: 82.69 | AH212: 0.78 | AI212: AA- | AJ212: 6.6600000000000006e-002 | AK212: =I212+100*P212 -> 158.54999999999998 | AL212: 160.9 | AM212: 253 | AN212: 78.2 | AO212: 257 | AP212: 2.4e-002 | AQ212: 8 | AR212: 美联转债
A213: 77 | B213: 128108 | C213: 蓝帆转债 | D213: 44001. | E213: 2382. | F213: 蓝帆医疗 | G213: 医药 | H213: 医疗器械 | I213: 130.2 | J213: -4.5499999999999999e-002 | K213: -1.3000000000000001e-002 | L213: 23.75 | M213: -6.83e-002 | N213: 113.3 | O213: 17.79 | P213: -2.5000000000000001e-002 | Q213: 133.5 | R213: 33天 | S213: 5.57年 | T213: 4.57年 | U213: 31.4 | V213: 569 | W213: 0.13800000000000001 | X213: 0.13699999999999998 | Y213: 0.183 | Z213: 229 | AA213: 2.39 | AB213: -2.5099999999999997e-002 | AC213: -2.92e-002 | AD213: -4.3799999999999999e-002 | AE213: -4.58e-002 | AF213: 85.8 | AG213: 88.81 | AH213: 0.86 | AI213: AA | AJ213: 4.5599999999999995e-002 | AK213: =I213+100*P213 -> 127.69999999999999 | AL213: 126.9 | AM213: 42 | AN213: 38.1 | AO213: 79 | AP213: -4.8000000000000001e-002 | AQ213: 20 | AR213: 蓝帆转债
A214: 103 | B214: 123047 | C214: 久吾转债 | D214: 43938. | E214: 300631 | F214: 久吾高科 | G214: 机械装备 | H214: 专用设备 | I214: 149 | J214: -7.4499999999999997e-002 | K214: 2.7099999999999999e-002 | L214: 23.07 | M214: -5.6399999999999999e-002 | N214: 130.1 | O214: 17.61 | P214: 0.13699999999999998 | Q214: 131.01 | R214: 转股中 | S214: 5.38年 | T214: 3.38年 | U214: 2.47 | V214: 704 | W214: 1.8600000000000001 | X214: 0.10099999999999999 | Y214: 0.13300000000000001 | Z214: 24 | AA214: 3.45 | AB214: -2.5499999999999998e-002 | AC214: -3.4099999999999998e-002 | AD214: -9.2300000000000007e-002 | AE214: -9.5000000000000001e-002 | AF214: 81.68 | AG214: 88.03 | AH214: 0.84 | AI214: A+ | AJ214: 7.7600000000000002e-002 | AK214: =I214+100*P214 -> 162.69999999999999 | AL214: 167 | AM214: 258 | AN214: 79 | AO214: 259 | AP214: 6.0999999999999999e-002 | AQ214: 21 | AR214: 久吾转债
A215: 20 | B215: 128126 | C215: 赣锋转2 | D215: 44082. | E215: 2460. | F215: 赣锋锂业 | G215: 有色金属 | H215: 小金属 | I215: 129.15 | J215: -3.2000000000000002e-003 | K215: -2.4500000000000001e-002 | L215: 60.82 | M215: -4.2199999999999994e-002 | N215: 111.1 | O215: 60.27 | P215: 0.28000000000000003 | Q215: 100.91 | R215: 3月14天 | S215: 5.76年 | T215: 3.76年 | U215: 21.1 | V215: 22 | W215: 8.0000000000000002e-003 | X215: 2.6000000000000002e-002 | Y215: 2.6000000000000002e-002 | Z215: 811 | AA215: 9.78 | AB215: -2.6099999999999998e-002 | AC215: -2.9500000000000002e-002 | AD215: -5.6600000000000004e-002 | AE215: -5.79e-002 | AF215: 86.42 | AG215: 86.25 | AH215: 0.66 | AI215: AA | AJ215: 4.5599999999999995e-002 | AK215: =I215+100*P215 -> 157.15000000000001 | AL215: 157.4 | AM215: 248 | AN215: 71 | AO215: 250 | AP215: 5.7999999999999996e-002 | AQ215: 7 | AR215: 赣锋转2
A216: 63 | B216: 113587 | C216: 泛微转债 | D216: 44026. | E216: 603039 | F216: 泛微网络 | G216: 计算机及 | H216: 软件开发 | I216: 143.91 | J216: 1.0500000000000001e-002 | K216: 5.9999999999999995e-004 | L216: 92.23 | M216: 1.24e-002 | N216: 124.3 | O216: 64.33 | P216: 4.0000000000000001e-003 | Q216: 143.37 | R216: 51天 | S216: 5.62年 | T216: 3.62年 | U216: 3.16 | V216: 117 | W216: 0.25 | X216: 1.6e-002 | Y216: 2.3e-002 | Z216: 196 | AA216: 20.31 | AB216: -2.6200000000000001e-002 | AC216: -3.3099999999999997e-002 | AD216: -8.2500000000000004e-002 | AE216: -8.43e-002 | AF216: 81.87 | AG216: 87.19 | AH216: 0.89 | AI216: AA- | AJ216: 6.6600000000000006e-002 | AK216: =I216+100*P216 -> 144.31 | AL216: 144.4 | AM216: 204 | AN216: 57.3 | AO216: 216 | AP216: 1.e-003 | AQ216: 4 | AR216: 泛微转债
A217: 208 | B217: 123024 | C217: 岱勒转债! | D217: 43572. | E217: 300700 | F217: 岱勒新材 | G217: 机械装备 | H217: 专用设备 | I217: 123.7 | J217: -8.4199999999999997e-002 | K217: 2.9999999999999999e-002 | L217: 22.75 | M217: -0.10199999999999999 | N217: 113 | O217: 24.9 | P217: 0.35399999999999998 | Q217: 91.37 | R217: 转股中 | S217: 3.39年 | T217: 1.39年 | U217: 2.1 | V217: 408 | W217: 1.52 | X217: 0.11199999999999999 | Y217: 0.10199999999999999 | Z217: 19 | AA217: 3.82 | AB217: -2.6699999999999998e-002 | AC217: -3.3300000000000003e-002 | AD217: -0.106 | AE217: -0.10800000000000001 | AF217: 91 | AG217: 88.77 | AH217: 0.53 | AI217: A+ | AJ217: 7.4900000000000008e-002 | AK217: =I217+100*P217 -> 159.09999999999999 | AL217: 156 | AM217: 245 | AN217: 65 | AO217: 243 | AP217: -2.3e-002 | AQ217: 33 | AR217: 岱勒转债!
A218: 241 | B218: 128046 | C218: 利尔转债! | D218: 43413. | E218: 2258. | F218: 利尔化学 | G218: 化工 | H218: 农化 | I218: 124.852 | J218: -1.3000000000000001e-002 | K218: -2.2400000000000003e-002 | L218: 19.9 | M218: -5.33e-002 | N218: 112.3 | O218: 18.62 | P218: 0.16800000000000001 | Q218: 106.87 | R218: 转股中 | S218: 3.96年 | T218: 1.96年 | U218: 8.52 | V218: 11 | W218: 1.e-002 | X218: 8.199999999999999e-002 | Y218: 8.6999999999999994e-002 | Z218: 104 | AA218: 2.92 | AB218: -2.6800000000000001e-002 | AC218: -3.2199999999999999e-002 | AD218: -8.7799999999999989e-002 | AE218: -8.9999999999999997e-002 | AF218: 94.06 | AG218: 95.36 | AH218: 0.67 | AI218: AA | AJ218: 4.2900000000000001e-002 | AK218: =I218+100*P218 -> 141.65200000000002 | AL218: 142.8 | AM218: 196 | AN218: 47.5 | AO218: 161 | AP218: -3.5000000000000003e-002 | AQ218: 10 | AR218: 利尔转债!
A219: 97 | B219: 128104 | C219: 裕同转债 | D219: 43949. | E219: 2831. | F219: 裕同科技 | G219: 造纸包装 | H219: 包装材料 | I219: 134.238 | J219: -3.0800000000000001e-002 | K219: -2.0799999999999999e-002 | L219: 29.57 | M219: -6.3399999999999998e-002 | N219: 115.3 | O219: 23.24 | P219: 5.5e-002 | Q219: 127.24 | R219: 转股中 | S219: 5.43年 | T219: 3.43年 | U219: 13.7 | V219: 31 | W219: 1.7000000000000001e-002 | X219: 5.2999999999999999e-002 | Y219: 6.7000000000000004e-002 | Z219: 259 | AA219: 4.05 | AB219: -2.81e-002 | AC219: -3.2899999999999999e-002 | AD219: -6.9599999999999995e-002 | AE219: -7.1300000000000002e-002 | AF219: 89.16 | AG219: 91.87 | AH219: 0.81 | AI219: AA+ | AJ219: 4.36e-002 | AK219: =I219+100*P219 -> 139.738 | AL219: 141.2 | AM219: 180 | AN219: 49.4 | AO219: 172 | AP219: -9.3000000000000013e-002 | AQ219: 7 | AR219: 裕同转债
A220: 300 | B220: 110034 | C220: 九州转债! | D220: 42398. | E220: 600998 | F220: 九州通 | G220: 医药 | H220: 医药商业 | I220: 113.51 | J220: -6.4000000000000003e-003 | K220: 6.9999999999999993e-003 | L220: 18.16 | M220: 1.7000000000000001e-003 | N220: 109.6 | O220: 18.32 | P220: 0.14499999999999999 | Q220: 99.13 | R220: 转股中 | S220: 1.21年 | T220: 回售中 | U220: 15 | V220: 70 | W220: 4.0999999999999995e-002 | X220: 4.4000000000000004e-002 | Y220: 4.4000000000000004e-002 | Z220: 340 | AA220: 1.81 | AB220: -2.8900000000000002e-002 | AC220: -4.3099999999999999e-002 | AD220: 回售中 | AE220: 回售中 | AF220: 103 | AG220: 104.53 | AH220: 0.39 | AI220: AA+ | AJ220: 4.0500000000000001e-002 | AK220: =I220+100*P220 -> 128.00999999999999 | AL220: 127.9 | AM220: 51 | AN220: 23.4 | AO220: 7 | AP220: 2.2000000000000002e-002 | AQ220: 25 | AR220: 九州转债!
A221: 282 | B221: 123002 | C221: 国祯转债!! | D221: 43094. | E221: 300388 | F221: 国祯环保 | G221: 城市公用 | H221: 三废处理 | I221: 121 | J221: -2.8900000000000002e-002 | K221: -7.8000000000000005e-003 | L221: 9.1 | M221: -4.2099999999999999e-002 | N221: 109.8 | O221: 8.48 | P221: 0.128 | Q221: 107.31 | R221: 转股中 | S221: 3年24天 | T221: 1年24天 | U221: 2.52 | V221: 59 | W221: 0.193 | X221: 4.0000000000000001e-002 | Y221: 4.2999999999999997e-002 | Z221: 64 | AA221: 1.68 | AB221: -3.1800000000000002e-002 | AC221: -3.7499999999999999e-002 | AD221: -0.121 | AE221: -0.124 | AF221: 97.43 | AG221: 96.81 | AH221: 0.87 | AI221: AA | AJ221: 4.2900000000000001e-002 | AK221: =I221+100*P221 -> 133.80000000000001 | AL221: 134.7 | AM221: 117 | AN221: 37.3 | AO221: 63 | AP221: -8.199999999999999e-002 | AQ221: 12 | AR221: 国祯转债!!
A222: 303 | B222: 113008 | C222: 电气转债! | D222: 42051. | E222: 601727 | F222: 上海电气 | G222: 能源电力 | H222: 电力设备 | I222: 107.5 | J222: -2.8000000000000004e-003 | K222: -5.0000000000000001e-004 | L222: 4.94 | M222: -2.5600000000000001e-002 | N222: 106.6 | O222: 5.13 | P222: 0.11599999999999999 | Q222: 96.3 | R222: 转股中 | S222: 0.26年 | T222: 回售中 | U222: 44.1 | V222: 144 | W222: 2.9999999999999999e-002 | X222: 5.9000000000000004e-002 | Y222: 5.7000000000000002e-002 | Z222: 749 | AA222: 1.15 | AB222: -3.2099999999999997e-002 | AC222: -7.7800000000000008e-002 | AD222: 回售中 | AE222: 回售中 | AF222: 103 | AG222: 105.64 | AH222: 0.13 | AI222: AAA | AJ222: 3.5699999999999996e-002 | AK222: =I222+100*P222 -> 119.09999999999999 | AL222: 118.7 | AM222: 5 | AN222: 13.1 | AO222: 1 | AP222: -4.2000000000000003e-002 | AQ222: 30 | AR222: 电气转债!
A223: 235 | B223: 113020 | C223: 桐昆转债! | D223: 43446. | E223: 601233 | F223: 桐昆股份 | G223: 服装纺织 | H223: 纺织行业 | I223: 128.68 | J223: -1.8100000000000002e-002 | K223: -1.0800000000000001e-002 | L223: 15.13 | M223: -3.6299999999999999e-002 | N223: 112.8 | O223: 12.28 | P223: 4.4000000000000004e-002 | Q223: 123.21 | R223: 转股中 | S223: 4年19天 | T223: 2年19天 | U223: 31.5 | V223: 90 | W223: 2.2000000000000002e-002 | X223: 0.113 | Y223: 0.13900000000000001 | Z223: 280 | AA223: 1.45 | AB223: -3.2599999999999997e-002 | AC223: -3.7999999999999999e-002 | AD223: -9.5199999999999993e-002 | AE223: -9.7599999999999992e-002 | AF223: 94.6 | AG223: 96.23 | AH223: 0.8 | AI223: AA+ | AJ223: 4.0899999999999999e-002 | AK223: =I223+100*P223 -> 133.08000000000001 | AL223: 134.2 | AM223: 113 | AN223: 37.9 | AO223: 76 | AP223: -2.5000000000000001e-002 | AQ223: 15 | AR223: 桐昆转债!
A224: 95 | B224: 113575 | C224: 东时转债 | D224: 43951. | E224: 603377 | F224: 东方时尚 | G224: 其他 | H224: 其他 | I224: 135.43 | J224: 2.0999999999999999e-003 | K224: -8.0000000000000004e-004 | L224: 19.75 | M224: 1.5e-003 | N224: 113.5 | O224: 14.56 | P224: -2.e-003 | Q224: 135.65 | R224: 转股中 | S224: 5.44年 | T224: 3.44年 | U224: 2.37 | V224: 22 | W224: 6.9000000000000006e-002 | X224: 2.e-002 | Y224: 2.7999999999999997e-002 | Z224: 116 | AA224: 6.18 | AB224: -3.2599999999999997e-002 | AC224: -3.6799999999999999e-002 | AD224: -7.17e-002 | AE224: -7.3499999999999996e-002 | AF224: 88.56 | AG224: 89.51 | AH224: 0.88 | AI224: AA | AJ224: 4.5599999999999995e-002 | AK224: =I224+100*P224 -> 135.23000000000002 | AL224: 135.2 | AM224: 125 | AN224: 45.7 | AO224: 148 | AP224: -3.4000000000000002e-002 | AQ224: 16 | AR224: 东时转债
A225: 98 | B225: 110069 | C225: 瀚蓝转债 | D225: 43958. | E225: 600323 | F225: 瀚蓝环境 | G225: 城市公用 | H225: 三废处理 | I225: 135.76 | J225: 1.15e-002 | K225: -2.2200000000000001e-002 | L225: 24.98 | M225: -1.3000000000000001e-002 | N225: 113.5 | O225: 20.2 | P225: 9.8000000000000004e-002 | Q225: 123.66 | R225: 转股中 | S225: 5.43年 | T225: 3.43年 | U225: 9.83 | V225: 3.7 | W225: 3.0000000000000001e-003 | X225: 5.0999999999999997e-002 | Y225: 6.4000000000000001e-002 | Z225: 191 | AA225: 2.67 | AB225: -3.2799999999999996e-002 | AC225: -3.7000000000000005e-002 | AD225: -7.6100000000000001e-002 | AE225: -7.7100000000000002e-002 | AF225: 87.77 | AG225: 90.27 | AH225: 0.82 | AI225: AA+ | AJ225: 4.36e-002 | AK225: =I225+100*P225 -> 145.56 | AL225: 147.9 | AM225: 223 | AN225: 57.6 | AO225: 218 | AP225: -7.5999999999999998e-002 | AQ225: 7 | AR225: 瀚蓝转债
A226: 55 | B226: 113590 | C226: 海容转债 | D226: 44039. | E226: 603187 | F226: 海容冷链 | G226: 机械装备 | H226: 通用设备 | I226: 139.28 | J226: 2.3e-003 | K226: 3.7200000000000004e-002 | L226: 47.5 | M226: 4.4000000000000004e-002 | N226: 115.6 | O226: 36.39 | P226: 6.7000000000000004e-002 | Q226: 130.53 | R226: 2月5天 | S226: 5.66年 | T226: 3.66年 | U226: 5 | V226: 1217. | W226: 1.6399999999999999 | X226: 6.6000000000000003e-002 | Y226: 8.6999999999999994e-002 | Z226: 75 | AA226: 4.82 | AB226: -3.3000000000000002e-002 | AC226: -3.7599999999999995e-002 | AD226: -7.4299999999999991e-002 | AE226: -7.5999999999999998e-002 | AF226: 81.42 | AG226: 80.87 | AH226: 0.9 | AI226: AA- | AJ226: 6.6600000000000006e-002 | AK226: =I226+100*P226 -> 145.97999999999999 | AL226: 148 | AM226: 225 | AN226: 66.6 | AO226: 246 | AP226: -6.4000000000000001e-002 | AQ226: 4 | AR226: 海容转债
A227: 281 | B227: 128021 | C227: 兄弟转债!! | D227: 43096. | E227: 2562. | F227: 兄弟科技 | G227: 医药 | H227: 原料药 | I227: 121.55 | J227: -4.0599999999999997e-002 | K227: 8.8000000000000005e-003 | L227: 5.8 | M227: -3.3300000000000003e-002 | N227: 109.8 | O227: 5.25 | P227: 0.10000000000000001 | Q227: 110.48 | R227: 转股中 | S227: 3年28天 | T227: 1年28天 | U227: 2.66 | V227: 81 | W227: 0.248 | X227: 4.8000000000000001e-002 | Y227: 5.2999999999999999e-002 | Z227: 55 | AA227: 2.26 | AB227: -3.32e-002 | AC227: -3.8800000000000001e-002 | AD227: -0.12300000000000001 | AE227: -0.126 | AF227: 97.39 | AG227: 96.76 | AH227: 0.96 | AI227: AA | AJ227: 4.2900000000000001e-002 | AK227: =I227+100*P227 -> 131.55000000000001 | AL227: 132.6 | AM227: 98 | AN227: 35.2 | AO227: 49 | AP227: -5.9000000000000004e-002 | AQ227: 13 | AR227: 兄弟转债!!
A228: 173 | B228: 128075 | C228: 远东转债! | D228: 43769. | E228: 2406. | F228: 远东传动 | G228: 汽车 | H228: 零部件制 | I228: 135.7 | J228: -2.9999999999999999e-002 | K228: -1.5e-003 | L228: 7.51 | M228: -3.7200000000000004e-002 | N228: 114.9 | O228: 5.54 | P228: 1.e-003 | Q228: 135.56 | R228: 转股中 | S228: 4.90年 | T228: 2.90年 | U228: 6.8 | V228: 71 | W228: 7.5999999999999998e-002 | X228: 0.153 | Y228: 0.20800000000000002 | Z228: 44 | AA228: 1.5 | AB228: -3.4000000000000002e-002 | AC228: -3.9100000000000003e-002 | AD228: -8.5600000000000009e-002 | AE228: -8.7400000000000005e-002 | AF228: 91.02 | AG228: 93.9 | AH228: 0.85 | AI228: AA | AJ228: 4.2900000000000001e-002 | AK228: =I228+100*P228 -> 135.79999999999998 | AL228: 135.8 | AM228: 134 | AN228: 41.9 | AO228: 115 | AP228: 4.2000000000000003e-002 | AQ228: 15 | AR228: 远东转债!
A229: 92 | B229: 113576 | C229: 起步转债! | D229: 43958. | E229: 603557 | F229: 起步股份 | G229: 服装纺织 | H229: 鞋服行业 | I229: 146.56 | J229: 1.0800000000000001e-002 | K229: -7.000000000000001e-004 | L229: 15.42 | M229: 1.11e-002 | N229: 121.8 | O229: 10.55 | P229: 3.0000000000000001e-003 | Q229: 146.16 | R229: 转股中 | S229: 5.44年 | T229: 3.44年 | U229: 3.31 | V229: 826 | W229: 1.6799999999999999 | X229: 4.4000000000000004e-002 | Y229: 6.4000000000000001e-002 | Z229: 75 | AA229: 4.54 | AB229: -3.4200000000000001e-002 | AC229: -4.0599999999999997e-002 | AD229: -8.9900000000000008e-002 | AE229: -9.1999999999999998e-002 | AF229: 83.24 | AG229: 86.52 | AH229: 0.91 | AI229: AA- | AJ229: 6.6600000000000006e-002 | AK229: =I229+100*P229 -> 146.86000000000001 | AL229: 147 | AM229: 215 | AN229: 60.4 | AO229: 232 | AP229: 1.3000000000000001e-002 | AQ229: 29 | AR229: 起步转债!
A230: 189 | B230: 123026 | C230: 中环转债! | D230: 43647. | E230: 300692 | F230: 中环环保 | G230: 城市公用 | H230: 三废处理 | I230: 125.9 | J230: -5.6600000000000004e-002 | K230: 5.6000000000000008e-003 | L230: 15.63 | M230: -5.0999999999999997e-002 | N230: 110.6 | O230: 12.25 | P230: -1.3000000000000001e-002 | Q230: 127.59 | R230: 转股中 | S230: 3.61年 | T230: 1.61年 | U230: 1.34 | V230: 125 | W230: 0.72199999999999998 | X230: 5.0000000000000003e-002 | Y230: 6.4000000000000001e-002 | Z230: 27 | AA230: 2.53 | AB230: -3.5900000000000001e-002 | AC230: -4.0999999999999995e-002 | AD230: -0.109 | AE230: -0.111 | AF230: 92.13 | AG230: 88.84 | AH230: 1 | AI230: AA- | AJ230: 6.3899999999999998e-002 | AK230: =I230+100*P230 -> 124.60000000000001 | AL230: 124.2 | AM230: 22 | AN230: 32.1 | AO230: 28 | AP230: -8.0000000000000002e-002 | AQ230: 28 | AR230: 中环转债!
A231: 148 | B231: 113029 | C231: 明阳转债!! | D231: 43837. | E231: 601615 | F231: 明阳智能 | G231: 能源电力 | H231: 风能 | I231: 136.31 | J231: -1.95e-002 | K231: 2.58e-002 | L231: 16.19 | M231: 7.4999999999999997e-003 | N231: 113.3 | O231: 12.46 | P231: 4.9000000000000002e-002 | Q231: 129.94 | R231: 转股中 | S231: 5年46天 | T231: 3年46天 | U231: 9.81 | V231: 187 | W231: 0.13500000000000001 | X231: 4.2999999999999997e-002 | Y231: 5.5999999999999994e-002 | Z231: 227 | AA231: 3.13 | AB231: -3.61e-002 | AC231: -4.0500000000000001e-002 | AD231: -8.0199999999999994e-002 | AE231: -8.2100000000000006e-002 | AF231: 89.79 | AG231: 90.6 | AH231: 0.84 | AI231: AA | AJ231: 4.5599999999999995e-002 | AK231: =I231+100*P231 -> 141.21000000000001 | AL231: 142.7 | AM231: 194 | AN231: 52.1 | AO231: 191 | AP231: -6.8000000000000005e-002 | AQ231: 23 | AR231: 明阳转债!!
A232: 29 | B232: 123062 | C232: 三超转债 | D232: 44060. | E232: 300554 | F232: 三超新材 | G232: 机械装备 | H232: 通用设备 | I232: 147.2 | J232: -6.7199999999999996e-002 | K232: 3.4000000000000002e-002 | L232: 23.3 | M232: -3.6000000000000004e-002 | N232: 119.7 | O232: 17.17 | P232: 8.5000000000000006e-002 | Q232: 135.7 | R232: 3月3天 | S232: 5.74年 | T232: 3.74年 | U232: 1.95 | V232: 520 | W232: 1.78 | X232: 8.900000000000001e-002 | Y232: 0.121 | Z232: 22 | AA232: 4.18 | AB232: -3.61e-002 | AC232: -4.1700000000000001e-002 | AD232: -8.4499999999999992e-002 | AE232: -8.6500000000000007e-002 | AF232: 75.66 | AG232: 74.79 | AH232: 0.92 | AI232: A | AJ232: 8.7599999999999997e-002 | AK232: =I232+100*P232 -> 155.69999999999999 | AL232: 158.7 | AM232: 251 | AN232: 83 | AO232: 260 | AP232: 2.e-002 | AQ232: 10 | AR232: 三超转债
A233: 91 | B233: 123048 | C233: 应急转债 | D233: 43962. | E233: 300527 | F233: 中船应急 | G233: 机械装备 | H233: 专用设备 | I233: 137.8 | J233: -3.6400000000000002e-002 | K233: -1.3500000000000002e-002 | L233: 11.38 | M233: -6.0299999999999999e-002 | N233: 113.1 | O233: 8.9 | P233: 7.8e-002 | Q233: 127.87 | R233: 转股中 | S233: 5.44年 | T233: 3.44年 | U233: 4.06 | V233: 2370. | W233: 3.9300000000000002 | X233: 3.9e-002 | Y233: 5.0000000000000003e-002 | Z233: 104 | AA233: 4.47 | AB233: -3.6299999999999999e-002 | AC233: -4.0300000000000002e-002 | AD233: -7.6600000000000001e-002 | AE233: -7.8299999999999995e-002 | AF233: 88.94 | AG233: 90.06 | AH233: 0.83 | AI233: AA+ | AJ233: 4.36e-002 | AK233: =I233+100*P233 -> 145.60000000000002 | AL233: 147.7 | AM233: 220 | AN233: 57.7 | AO233: 220 | AP233: -0.13 | AQ233: 15 | AR233: 应急转债
A234: 138 | B234: 123038 | C234: 联得转债! | D234: 43852. | E234: 300545 | F234: 联得装备 | G234: 机械装备 | H234: 专用设备 | I234: 144.1 | J234: -6.5099999999999991e-002 | K234: 1.06e-002 | L234: 28.04 | M234: -6.7799999999999999e-002 | N234: 119.1 | O234: 25.29 | P234: 0.29999999999999999 | Q234: 110.87 | R234: 转股中 | S234: 5年55天 | T234: 3年55天 | U234: 1.48 | V234: 419 | W234: 1.9399999999999999 | X234: 3.6000000000000004e-002 | Y234: 4.0000000000000001e-002 | Z234: 41 | AA234: 5.35 | AB234: -3.7100000000000001e-002 | AC234: -4.3099999999999999e-002 | AD234: -9.3800000000000008e-002 | AE234: -9.5899999999999999e-002 | AF234: 81.73 | AG234: 81.83 | AH234: 0.8 | AI234: A+ | AJ234: 7.7600000000000002e-002 | AK234: =I234+100*P234 -> 174.09999999999999 | AL234: 177.3 | AM234: 263 | AN234: 95.5 | AO234: 265 | AP234: -0.10400000000000001 | AQ234: 15 | AR234: 联得转债!
A235: 68 | B235: 113585 | C235: 寿仙转债 | D235: 44019. | E235: 603896 | F235: 寿仙谷 | G235: 医药 | H235: 中药 | I235: 145.24 | J235: 4.0000000000000002e-004 | K235: 2.3300000000000001e-002 | L235: 44.9 | M235: 2.5099999999999997e-002 | N235: 117.8 | O235: 28.68 | P235: -7.2000000000000008e-002 | Q235: 156.56 | R235: 45天 | S235: 5.61年 | T235: 3.61年 | U235: 3.6 | V235: 209 | W235: 0.39600000000000002 | X235: 5.5999999999999994e-002 | Y235: 8.6999999999999994e-002 | Z235: 64 | AA235: 5.23 | AB235: -3.7400000000000003e-002 | AC235: -4.2599999999999999e-002 | AD235: -8.5299999999999987e-002 | AE235: -8.6999999999999994e-002 | AF235: 81.89 | AG235: 82.74 | AH235: 0.94 | AI235: AA- | AJ235: 6.6600000000000006e-002 | AK235: =I235+100*P235 -> 138.04000000000002 | AL235: 133.9 | AM235: 111 | AN235: 51.2 | AO235: 183 | AP235: 0.114 | AQ235: 9 | AR235: 寿仙转债
A236: 234 | B236: 123017 | C236: 寒锐转债!! | D236: 43458. | E236: 300618 | F236: 寒锐钴业 | G236: 有色金属 | H236: 小金属 | I236: 129.3 | J236: -5.74e-002 | K236: -2.4e-002 | L236: 63.61 | M236: -0.10300000000000001 | N236: 110.8 | O236: 57.4 | P236: 0.16699999999999998 | Q236: 110.82 | R236: 转股中 | S236: 4年20天 | T236: 2年20天 | U236: 4.03 | V236: 166 | W236: 0.312 | X236: 2.1000000000000001e-002 | Y236: 2.3e-002 | Z236: 193 | AA236: 5.25 | AB236: -3.8100000000000002e-002 | AC236: -4.2699999999999995e-002 | AD236: -9.6999999999999989e-002 | AE236: -9.9499999999999991e-002 | AF236: 90.16 | AG236: 86.69 | AH236: 0.79 | AI236: AA- | AJ236: 6.3899999999999998e-002 | AK236: =I236+100*P236 -> 146. | AL236: 147.8 | AM236: 222 | AN236: 57.6 | AO236: 219 | AP236: -3.5000000000000003e-002 | AQ236: 14 | AR236: 寒锐转债!!
A237: 264 | B237: 113504 | C237: 艾华转债!! | D237: 43182. | E237: 603989 | F237: 艾华集团 | G237: 电子 | H237: 元器件制 | I237: 125.4 | J237: -4.9000000000000002e-002 | K237: 2.9500000000000002e-002 | L237: 25.22 | M237: -2.4700000000000003e-002 | N237: 110.3 | O237: 21.13 | P237: 5.0999999999999997e-002 | Q237: 119.36 | R237: 转股中 | S237: 3.33年 | T237: 1.33年 | U237: 5.61 | V237: 48 | W237: 6.7000000000000004e-002 | X237: 5.5999999999999994e-002 | Y237: 6.7000000000000004e-002 | Z237: 100 | AA237: 4.48 | AB237: -3.85e-002 | AC237: -4.3799999999999999e-002 | AD237: -0.113 | AE237: -0.11599999999999999 | AF237: 96.57 | AG237: 96.17 | AH237: 0.79 | AI237: AA | AJ237: 4.2900000000000001e-002 | AK237: =I237+100*P237 -> 130.5 | AL237: 131.4 | AM237: 83 | AN237: 34.9 | AO237: 47 | AP237: -4.9000000000000002e-002 | AQ237: 9 | AR237: 艾华转债!!
A238: 133 | B238: 113562 | C238: 璞泰转债!! | D238: 43865. | E238: 603659 | F238: 璞泰来 | G238: 电子 | H238: 元器件制 | I238: 133.28 | J238: 3.2500000000000001e-002 | K238: 1.9900000000000001e-002 | L238: 111.45 | M238: 5.2400000000000002e-002 | N238: 113.3 | O238: 82.73 | P238: -1.1000000000000001e-002 | Q238: 134.72 | R238: 转股中 | S238: 4.17年 | T238: 2.17年 | U238: 7.53 | V238: 343 | W238: 0.34000000000000002 | X238: 1.6e-002 | Y238: 2.1000000000000001e-002 | Z238: 485 | AA238: 13.31 | AB238: -3.8599999999999995e-002 | AC238: -4.4000000000000004e-002 | AD238: -0.10800000000000001 | AE238: -0.109 | AF238: 92.55 | AG238: 95.3 | AH238: 1 | AI238: AA | AJ238: 4.2900000000000001e-002 | AK238: =I238+100*P238 -> 132.18000000000001 | AL238: 131.8 | AM238: 88 | AN238: 36.5 | AO238: 60 | AP238: 3.2000000000000001e-002 | AQ238: 16 | AR238: 璞泰转债!!
A239: 125 | B239: 128097 | C239: 奥佳转债! | D239: 43908. | E239: 2614. | F239: 奥佳华 | G239: 机械装备 | H239: 专用设备 | I239: 141.86 | J239: 1.26e-002 | K239: -1.37e-002 | L239: 14.13 | M239: -1.4000000000000002e-003 | N239: 115.3 | O239: 10.69 | P239: 7.2999999999999995e-002 | Q239: 132.18 | R239: 转股中 | S239: 5.32年 | T239: 3.32年 | U239: 6.02 | V239: 172 | W239: 0.19800000000000001 | X239: 6.9000000000000006e-002 | Y239: 9.0999999999999998e-002 | Z239: 87 | AA239: 2.06 | AB239: -3.8900000000000004e-002 | AC239: -4.3700000000000003e-002 | AD239: -8.6500000000000007e-002 | AE239: -8.8300000000000003e-002 | AF239: 89.01 | AG239: 91.4 | AH239: 0.84 | AI239: AA | AJ239: 4.5599999999999995e-002 | AK239: =I239+100*P239 -> 149.16000000000003 | AL239: 151.5 | AM239: 235 | AN239: 60.1 | AO239: 228 | AP239: -5.7000000000000002e-002 | AQ239: 26 | AR239: 奥佳转债!
A240: 76 | B240: 113583 | C240: 益丰转债 | D240: 44004. | E240: 603939 | F240: 益丰药房 | G240: 医药 | H240: 医药商业 | I240: 144.27 | J240: 5.6000000000000008e-003 | K240: 2.7400000000000001e-002 | L240: 101.91 | M240: 3.7000000000000005e-002 | N240: 115.3 | O240: 71.82 | P240: 1.7000000000000001e-002 | Q240: 141.9 | R240: 37天 | S240: 5.58年 | T240: 3.58年 | U240: 15.8 | V240: 90 | W240: 3.9e-002 | X240: 2.8999999999999998e-002 | Y240: 4.0999999999999995e-002 | Z240: 541 | AA240: 11.17 | AB240: -4.0000000000000001e-002 | AC240: -4.4600000000000001e-002 | AD240: -8.4700000000000011e-002 | AE240: -8.6400000000000005e-002 | AF240: 87.96 | AG240: 90.33 | AH240: 0.89 | AI240: AA | AJ240: 4.5599999999999995e-002 | AK240: =I240+100*P240 -> 145.97 | AL240: 146.6 | AM240: 213 | AN240: 56.3 | AO240: 211 | AP240: 6.0999999999999999e-002 | AQ240: 8 | AR240: 益丰转债
A241: 299 | B241: 113009 | C241: 广汽转债!! | D241: 42404. | E241: 601238 | F241: 广汽集团 | G241: 汽车 | H241: 乘用车 | I241: 113 | J241: 8.3999999999999995e-003 | K241: 8.0000000000000004e-004 | L241: 13.43 | M241: 2.9100000000000001e-002 | N241: 107.5 | O241: 14.23 | P241: 0.19699999999999998 | Q241: 94.38 | R241: 转股中 | S241: 1.23年 | T241: 回售中 | U241: 25.5 | V241: 387 | W241: 0.13300000000000001 | X241: 1.9e-002 | Y241: 1.7000000000000001e-002 | Z241: 1375. | AA241: 1.71 | AB241: -4.0300000000000002e-002 | AC241: -5.1200000000000002e-002 | AD241: 回售中 | AE241: 回售中 | AF241: 100.25 | AG241: 102.8 | AH241: 0.31 | AI241: AAA | AJ241: 3.7499999999999999e-002 | AK241: =I241+100*P241 -> 132.69999999999999 | AL241: 131.6 | AM241: 85 | AN241: 28.8 | AO241: 16 | AP241: 0.26200000000000001 | AQ241: 15 | AR241: 广汽转债!!
A242: 71 | B242: 123052 | C242: 飞鹿转债 | D242: 44015. | E242: 300665 | F242: 飞鹿股份 | G242: 化工 | H242: 化工 | I242: 160 | J242: -8.72e-002 | K242: 2.3e-002 | L242: 13.58 | M242: -7.2999999999999995e-002 | N242: 127.3 | O242: 9.9 | P242: 0.16600000000000001 | Q242: 137.17 | R242: 41天 | S242: 5.59年 | T242: 3.59年 | U242: 1.77 | V242: 1868. | W242: 6.1600000000000001 | X242: 0.107 | Y242: 0.14699999999999999 | Z242: 17 | AA242: 3.5 | AB242: -4.0899999999999999e-002 | AC242: -4.8399999999999999e-002 | AD242: -0.10300000000000001 | AE242: -0.105 | AF242: 79.75 | AG242: 84.7 | AH242: 0.88 | AI242: A+ | AJ242: 7.7600000000000002e-002 | AK242: =I242+100*P242 -> 176.59999999999999 | AL242: 182.8 | AM242: 266 | AN242: 98.1 | AO242: 269 | AP242: 4.0999999999999995e-002 | AQ242: 11 | AR242: 飞鹿转债
A243: 167 | B243: 128079 | C243: 英联转债! | D243: 43790. | E243: 2846. | F243: 英联股份 | G243: 造纸包装 | H243: 包装材料 | I243: 144.3 | J243: -8.09e-002 | K243: 7.5700000000000003e-002 | L243: 13.68 | M243: -5.2000000000000005e-002 | N243: 117.5 | O243: 13.41 | P243: 0.41499999999999998 | Q243: 102.01 | R243: 转股中 | S243: 4.97年 | T243: 2.97年 | U243: 1.53 | V243: 388 | W243: 1.72 | X243: 5.5999999999999994e-002 | Y243: 5.7000000000000002e-002 | Z243: 27 | AA243: 3.55 | AB243: -4.1200000000000001e-002 | AC243: -4.6900000000000004e-002 | AD243: -0.10099999999999999 | AE243: -0.10099999999999999 | AF243: 82.8 | AG243: 82.64 | AH243: 0.1 | AI243: A+ | AJ243: 7.4900000000000008e-002 | AK243: =I243+100*P243 -> 185.80000000000001 | AL243: 186.6 | AM243: 269 | AN243: 103.8 | AO243: 272 | AP243: -9.5000000000000001e-002 | AQ243: 18 | AR243: 英联转债!
A244: 131 | B244: 127015 | C244: 希望转债! | D244: 43865. | E244: 876. | F244: 新 希 望 | G244: 农业 | H244: 畜牧业 | I244: 136.607 | J244: -3.3799999999999997e-002 | K244: -1.4000000000000002e-003 | L244: 26.88 | M244: -3.5200000000000002e-002 | N244: 110.2 | O244: 19.75 | P244: 4.0000000000000001e-003 | Q244: 136.1 | R244: 转股中 | S244: 5.18年 | T244: 3.18年 | U244: 18 | V244: 35 | W244: 1.3999999999999999e-002 | X244: 1.4999999999999999e-002 | Y244: 2.e-002 | Z244: 1211. | AA244: 3.91 | AB244: -4.1200000000000001e-002 | AC244: -4.4600000000000001e-002 | AD244: -8.1900000000000001e-002 | AE244: -8.3400000000000002e-002 | AF244: 90.15 | AG244: 89.99 | AH244: 1 | AI244: AAA | AJ244: 4.0599999999999997e-002 | AK244: =I244+100*P244 -> 137.00700000000001 | AL244: 137.1 | AM244: 145 | AN244: 47 | AO244: 156 | AP244: -4.7e-002 | AQ244: 28 | AR244: 希望转债!
A245: 262 | B245: 127005 | C245: 长证转债! | D245: 43201. | E245: 783. | F245: 长江证券 | G245: 金融 | H245: 证券行业 | I245: 125.6 | J245: -1.06e-002 | K245: -1.7000000000000001e-002 | L245: 7.53 | M245: -4.5599999999999995e-002 | N245: 109.3 | O245: 7.28 | P245: 0.214 | Q245: 103.43 | R245: 转股中 | S245: 3.36年 | T245: 无权 | U245: 50 | V245: 27 | W245: 4.0000000000000001e-003 | X245: 0.12 | Y245: 0.124 | Z245: 416 | AA245: 1.54 | AB245: -4.1299999999999996e-002 | AC245: -4.6100000000000002e-002 | AD245: 无权 | AE245: 无权 | AF245: 无权 | AG245: 96.71 | AH245: 0.61 | AI245: AAA | AJ245: 3.7900000000000003e-002 | AK245: =I245+100*P245 -> 147. | AL245: 147.8 | AM245: 221 | AN245: 51.1 | AO245: 180 | AP245: -7.0999999999999994e-002 | AQ245: 15 | AR245: 长证转债!
A246: 175 | B246: 128073 | C246: 哈尔转债! | D246: 43719. | E246: 2615. | F246: 哈尔斯 | G246: 其他 | H246: 家居用品 | I246: 136.66 | J246: -2.3900000000000001e-002 | K246: 1.0200000000000001e-002 | L246: 5.29 | M246: -2.58e-002 | N246: 115.3 | O246: 5.72 | P246: 0.47799999999999998 | Q246: 92.48 | R246: 转股中 | S246: 3.81年 | T246: 1.81年 | U246: 2.99 | V246: 2142. | W246: 5.21 | X246: 0.13800000000000001 | Y246: 0.127 | Z246: 22 | AA246: 2.8 | AB246: -4.4199999999999996e-002 | AC246: -5.0900000000000001e-002 | AD246: -0.113 | AE246: -0.114 | AF246: 90.36 | AG246: 91.36 | AH246: 0.53 | AI246: AA- | AJ246: 6.3899999999999998e-002 | AK246: =I246+100*P246 -> 184.45999999999998 | AL246: 180.8 | AM246: 265 | AN246: 89.5 | AO246: 264 | AP246: -5.5999999999999994e-002 | AQ246: 38 | AR246: 哈尔转债!
A247: 44 | B247: 123058 | C247: 欣旺转债 | D247: 44050. | E247: 300207 | F247: 欣旺达 | G247: 电子 | H247: 电子产品 | I247: 150.41 | J247: -1.24e-002 | K247: -6.4000000000000003e-003 | L247: 27.88 | M247: -2.2400000000000003e-002 | N247: 116.3 | O247: 21.24 | P247: 0.14599999999999999 | Q247: 131.26 | R247: 2月21天 | S247: 5.70年 | T247: 3.70年 | U247: 11.2 | V247: 14 | W247: 8.0000000000000002e-003 | X247: 2.6000000000000002e-002 | Y247: 3.3000000000000002e-002 | Z247: 439 | AA247: 6.94 | AB247: -4.4800000000000006e-002 | AC247: -4.9500000000000002e-002 | AD247: -9.2200000000000004e-002 | AE247: -9.3699999999999992e-002 | AF247: 87.5 | AG247: 90.63 | AH247: 0.84 | AI247: AA | AJ247: 4.5599999999999995e-002 | AK247: =I247+100*P247 -> 165.00999999999999 | AL247: 169.6 | AM247: 259 | AN247: 78.9 | AO247: 258 | AP247: -1.8000000000000002e-002 | AQ247: 6 | AR247: 欣旺转债
A248: 34 | B248: 123061 | C248: 航新转债 | D248: 44061. | E248: 300424 | F248: 航新科技 | G248: 航空航天 | H248: 航空航天 | I248: 161.89 | J248: -1.9400000000000001e-002 | K248: -2.0299999999999999e-002 | L248: 20.64 | M248: -4.4900000000000002e-002 | N248: 124.8 | O248: 14.86 | P248: 0.16600000000000001 | Q248: 138.9 | R248: 2月29天 | S248: 5.72年 | T248: 3.72年 | U248: 2.5 | V248: 2258. | W248: 5.4100000000000001 | X248: 5.0000000000000003e-002 | Y248: 7.0000000000000007e-002 | Z248: 50 | AA248: 4.61 | AB248: -4.53e-002 | AC248: -5.2000000000000005e-002 | AD248: -0.10300000000000001 | AE248: -0.105 | AF248: 81.74 | AG248: 87.03 | AH248: 0.88 | AI248: AA- | AJ248: 6.6600000000000006e-002 | AK248: =I248+100*P248 -> 178.48999999999998 | AL248: 184.9 | AM248: 267 | AN248: 97.9 | AO248: 268 | AP248: -8.4000000000000005e-002 | AQ248: 8 | AR248: 航新转债
A249: 290 | B249: 113013 | C249: 国君转债! | D249: 42940. | E249: 601211 | F249: 国泰君安 | G249: 金融 | H249: 证券行业 | I249: 122.45 | J249: -2.3999999999999998e-003 | K249: -7.0999999999999995e-003 | L249: 18.4 | M249: -1.9199999999999998e-002 | N249: 108.3 | O249: 19.01 | P249: 0.26500000000000001 | Q249: 96.79 | R249: 转股中 | S249: 2.68年 | T249: 无权 | U249: 69.9 | V249: 21 | W249: 2.e-003 | X249: 4.2999999999999997e-002 | Y249: 4.0999999999999995e-002 | Z249: 1639. | AA249: 1.32 | AB249: -4.5499999999999999e-002 | AC249: -5.0900000000000001e-002 | AD249: 无权 | AE249: 无权 | AF249: 无权 | AG249: 98.28 | AH249: 0.5 | AI249: AAA | AJ249: 3.7499999999999999e-002 | AK249: =I249+100*P249 -> 148.94999999999999 | AL249: 148.1 | AM249: 226 | AN249: 49.8 | AO249: 176 | AP249: -3.0000000000000001e-003 | AQ249: 14 | AR249: 国君转债!
A250: 47 | B250: 113592 | C250: 安20转债 | D250: 44043. | E250: 603345 | F250: 安井食品 | G250: 食品饮料 | H250: 食品饮料 | I250: 149.61 | J250: -9.4999999999999998e-003 | K250: -2.0999999999999999e-003 | L250: 176.14 | M250: -1.2699999999999999e-002 | N250: 113.1 | O250: 115.9 | P250: -1.6e-002 | Q250: 151.98 | R250: 2月15天 | S250: 5.69年 | T250: 3.69年 | U250: 9 | V250: 45 | W250: 3.4000000000000002e-002 | X250: 2.2000000000000002e-002 | Y250: 3.3000000000000002e-002 | Z250: 417 | AA250: 12.98 | AB250: -4.8799999999999996e-002 | AC250: -5.2600000000000001e-002 | AD250: -9.1600000000000001e-002 | AE250: -9.3100000000000002e-002 | AF250: 87.37 | AG250: 88.18 | AH250: 0.92 | AI250: AA | AJ250: 4.5599999999999995e-002 | AK250: =I250+100*P250 -> 148.01000000000002 | AL250: 147.2 | AM250: 218 | AN250: 59.1 | AO250: 223 | AP250: 3.0000000000000001e-003 | AQ250: 6 | AR250: 安20转债
A251: 104 | B251: 123046 | C251: 天铁转债! | D251: 43938. | E251: 300587 | F251: 天铁股份 | G251: 铁路 | H251: 铁路设备 | I251: 154.088 | J251: -4.5400000000000003e-002 | K251: 1.1200000000000002e-002 | L251: 15.05 | M251: -3.7100000000000001e-002 | N251: 118.2 | O251: 10.12 | P251: 3.6000000000000004e-002 | Q251: 148.72 | R251: 转股中 | S251: 5.38年 | T251: 3.38年 | U251: 1.55 | V251: 189 | W251: 0.77800000000000002 | X251: 3.1e-002 | Y251: 4.7e-002 | Z251: 49 | AA251: 3.7 | AB251: -4.9000000000000002e-002 | AC251: -5.4400000000000004e-002 | AD251: -0.10300000000000001 | AE251: -0.105 | AF251: 83.06 | AG251: 84.23 | AH251: 0.92 | AI251: AA- | AJ251: 6.6600000000000006e-002 | AK251: =I251+100*P251 -> 157.68799999999999 | AL251: 159.5 | AM251: 252 | AN251: 75.2 | AO251: 254 | AP251: -7.400000000000001e-002 | AQ251: 10 | AR251: 天铁转债!
A252: 183 | B252: 128070 | C252: 智能转债! | D252: 43669. | E252: 2877. | F252: 智能自控 | G252: 机械装备 | H252: 通用设备 | I252: 149 | J252: -8.8699999999999987e-002 | K252: 7.0599999999999996e-002 | L252: 7.58 | M252: -3.9300000000000002e-002 | N252: 117.6 | O252: 9.51 | P252: 0.86900000000000011 | Q252: 79.71 | R252: 转股中 | S252: 4.67年 | T252: 无权 | U252: 2.3 | V252: 696 | W252: 1.97 | X252: 9.0999999999999998e-002 | Y252: 7.2999999999999995e-002 | Z252: 25 | AA252: 3.6 | AB252: -5.04e-002 | AC252: -5.6500000000000002e-002 | AD252: 无权 | AE252: 无权 | AF252: 无权 | AG252: 84.6 | AH252: 0.46 | AI252: A+ | AJ252: 7.4900000000000008e-002 | AK252: =I252+100*P252 -> 235.90000000000001 | AL252: 218.3 | AM252: 278 | AN252: 133.7 | AO252: 281 | AP252: -5.2000000000000005e-002 | AQ252: 32 | AR252: 智能转债!
A253: 101 | B253: 128103 | C253: 同德转债 | D253: 43942. | E253: 2360. | F253: 同德化工 | G253: 化工 | H253: 化工 | I253: 161.2 | J253: -4.0999999999999995e-002 | K253: 2.0899999999999998e-002 | L253: 6.01 | M253: -2.4399999999999998e-002 | N253: 121.8 | O253: 5.18 | P253: 0.38900000000000001 | Q253: 116.02 | R253: 转股中 | S253: 5.40年 | T253: 3.40年 | U253: 1.44 | V253: 332 | W253: 1.4099999999999999 | X253: 6.0999999999999999e-002 | Y253: 7.0999999999999994e-002 | Z253: 24 | AA253: 1.96 | AB253: -5.16e-002 | AC253: -5.79e-002 | AD253: -0.11199999999999999 | AE253: -0.114 | AF253: 80.48 | AG253: 82.17 | AH253: 0.83 | AI253: A+ | AJ253: 7.7600000000000002e-002 | AK253: =I253+100*P253 -> 200.09999999999999 | AL253: 206.4 | AM253: 276 | AN253: 124.2 | AO253: 279 | AP253: -2.7999999999999997e-002 | AQ253: 10 | AR253: 同德转债
A254: 152 | B254: 123036 | C254: 先导转债! | D254: 43840. | E254: 300450 | F254: 先导智能 | G254: 机械装备 | H254: 专用设备 | I254: 151.003 | J254: 9.300000000000001e-003 | K254: 1.5600000000000001e-002 | L254: 59.97 | M254: 2.5000000000000001e-002 | N254: 115.1 | O254: 38.99 | P254: -1.8000000000000002e-002 | Q254: 153.81 | R254: 转股中 | S254: 5年41天 | T254: 3年41天 | U254: 9.24 | V254: 1292. | W254: 0.88700000000000001 | X254: 1.7000000000000001e-002 | Y254: 2.7000000000000003e-002 | Z254: 528 | AA254: 12.58 | AB254: -5.2600000000000001e-002 | AC254: -5.74e-002 | AD254: -0.107 | AE254: -0.109 | AF254: 89.65 | AG254: 92.05 | AH254: 1 | AI254: AA | AJ254: 4.5599999999999995e-002 | AK254: =I254+100*P254 -> 149.20299999999997 | AL254: 148.2 | AM254: 227 | AN254: 56.1 | AO254: 210 | AP254: 0.13100000000000001 | AQ254: 17 | AR254: 先导转债!
A255: 256 | B255: 128039 | C255: 三力转债! | D255: 43280. | E255: 2224. | F255: 三 力 士 | G255: 机械装备 | H255: 专用设备 | I255: 133.238 | J255: -4.1299999999999996e-002 | K255: 1.38e-002 | L255: 6.31 | M255: -3.6600000000000001e-002 | N255: 109.8 | O255: 5.81 | P255: 0.22699999999999998 | Q255: 108.61 | R255: 转股中 | S255: 3.60年 | T255: 1.60年 | U255: 2.03 | V255: 749 | W255: 2.6899999999999999 | X255: 4.4000000000000004e-002 | Y255: 4.8000000000000001e-002 | Z255: 46 | AA255: 2 | AB255: -5.3099999999999994e-002 | AC255: -5.7699999999999994e-002 | AD255: -0.11800000000000001 | AE255: -0.12 | AF255: 91.98 | AG255: 88.2 | AH255: 0.75 | AI255: AA- | AJ255: 6.3899999999999998e-002 | AK255: =I255+100*P255 -> 155.93799999999999 | AL255: 157.9 | AM255: 249 | AN255: 65.9 | AO255: 245 | AP255: -2.1000000000000001e-002 | AQ255: 19 | AR255: 三力转债!
A256: 126 | B256: 128095 | C256: 恩捷转债!! | D256: 43889. | E256: 2812. | F256: 恩捷股份 | G256: 电子 | H256: 元器件制 | I256: 152.99 | J256: 1.32e-002 | K256: -1.1999999999999999e-003 | L256: 99.8 | M256: 1.3300000000000001e-002 | N256: 115.3 | O256: 65.09 | P256: -2.e-003 | Q256: 153.33 | R256: 转股中 | S256: 5.28年 | T256: 3.28年 | U256: 13.1 | V256: 204 | W256: 0.10099999999999999 | X256: 1.4999999999999999e-002 | Y256: 2.3e-002 | Z256: 877 | AA256: 8.88 | AB256: -5.3099999999999994e-002 | AC256: -5.7800000000000004e-002 | AD256: -0.105 | AE256: -0.107 | AF256: 89.16 | AG256: 91.55 | AH256: 0.91 | AI256: AA | AJ256: 4.5599999999999995e-002 | AK256: =I256+100*P256 -> 152.79000000000002 | AL256: 152.7 | AM256: 239 | AN256: 61.1 | AO256: 235 | AP256: 4.2999999999999997e-002 | AQ256: 17 | AR256: 恩捷转债!!
A257: 107 | B257: 123045 | C257: 雷迪转债 | D257: 43934. | E257: 300652 | F257: 雷迪克 | G257: 汽车 | H257: 零部件制 | I257: 159.32 | J257: 6.8199999999999997e-002 | K257: -5.8400000000000001e-002 | L257: 24.67 | M257: 1.15e-002 | N257: 119.4 | O257: 20.13 | P257: 0.29999999999999999 | Q257: 122.55 | R257: 转股中 | S257: 5.36年 | T257: 3.36年 | U257: 1.71 | V257: 5691. | W257: 20.77 | X257: 7.400000000000001e-002 | Y257: 9.0999999999999998e-002 | Z257: 23 | AA257: 2.71 | AB257: -5.3499999999999999e-002 | AC257: -5.9200000000000003e-002 | AD257: -0.111 | AE257: -0.113 | AF257: 80.61 | AG257: 80.79 | AH257: 0.85 | AI257: A+ | AJ257: 7.7600000000000002e-002 | AK257: =I257+100*P257 -> 189.31999999999999 | AL257: 196.1 | AM257: 273 | AN257: 115.3 | AO257: 275 | AP257: -6.9999999999999993e-003 | AQ257: 36 | AR257: 雷迪转债
A258: 135 | B258: 128091 | C258: 新天转债 | D258: 43847. | E258: 2873. | F258: 新天药业 | G258: 医药 | H258: 中药 | I258: 159 | J258: -2.6000000000000002e-002 | K258: 1.5800000000000002e-002 | L258: 18.29 | M258: -1.24e-002 | N258: 120 | O258: 16.39 | P258: 0.42499999999999999 | Q258: 111.59 | R258: 转股中 | S258: 5.16年 | T258: 3.16年 | U258: 1.76 | V258: 738 | W258: 2.6600000000000001 | X258: 8.199999999999999e-002 | Y258: 9.1999999999999998e-002 | Z258: 21 | AA258: 2.84 | AB258: -5.4299999999999994e-002 | AC258: -6.0400000000000002e-002 | AD258: -0.11599999999999999 | AE258: -0.11800000000000001 | AF258: 82.28 | AG258: 82.5 | AH258: 0.82 | AI258: A+ | AJ258: 7.7600000000000002e-002 | AK258: =I258+100*P258 -> 201.5 | AL258: 206.4 | AM258: 277 | AN258: 123.9 | AO258: 278 | AP258: 8.0000000000000002e-003 | AQ258: 16 | AR258: 新天转债
A259: 215 | B259: 128058 | C259: 拓邦转债 | D259: 43563. | E259: 2139. | F259: 拓邦股份 | G259: 电子 | H259: 电子产品 | I259: 156 | J259: -3.2899999999999999e-002 | K259: -3.4000000000000002e-003 | L259: 8.55 | M259: -4.0399999999999998e-002 | N259: 122.6 | O259: 5.47 | P259: -2.e-003 | Q259: 156.31 | R259: 转股中 | S259: 4.35年 | T259: 2.35年 | U259: 2.55 | V259: 76 | W259: 0.184 | X259: 2.8999999999999998e-002 | Y259: 4.4999999999999998e-002 | Z259: 88 | AA259: 3.28 | AB259: -5.5099999999999996e-002 | AC259: -6.3200000000000006e-002 | AD259: -0.10800000000000001 | AE259: -0.109 | AF259: 94.17 | AG259: 102.62 | AH259: 0.9 | AI259: AA | AJ259: 4.2900000000000001e-002 | AK259: =I259+100*P259 -> 155.80000000000001 | AL259: 155.7 | AM259: 244 | AN259: 53.1 | AO259: 199 | AP259: 0.11800000000000001 | AQ259: 20 | AR259: 拓邦转债
A260: 295 | B260: 113011 | C260: 光大转债 | D260: 42934. | E260: 601818 | F260: 光大银行 | G260: 金融 | H260: 银行行业 | I260: 123.8 | J260: -4.4000000000000003e-003 | K260: 7.4999999999999997e-003 | L260: 3.92 | M260: 5.1000000000000004e-003 | N260: 108.3 | O260: 3.76 | P260: 0.187 | Q260: 104.26 | R260: 转股中 | S260: 2.38年 | T260: 无权 | U260: 242 | V260: 179 | W260: 6.0000000000000001e-003 | X260: 0.11800000000000001 | Y260: 0.12300000000000001 | Z260: 2058. | AA260: 0.64 | AB260: -5.57e-002 | AC260: -6.1699999999999998e-002 | AD260: 无权 | AE260: 无权 | AF260: 无权 | AG260: 99.4 | AH260: 0.61 | AI260: AAA | AJ260: 3.7499999999999999e-002 | AK260: =I260+100*P260 -> 142.5 | AL260: 143.3 | AM260: 197 | AN260: 43.9 | AO260: 131 | AP260: 6.0000000000000001e-003 | AQ260: 14 | AR260: 光大转债
A261: 7 | B261: 123065 | C261: 宝莱转债! | D261: 44098. | E261: 300246 | F261: 宝莱特 | G261: 医药 | H261: 医疗器械 | I261: 169 | J261: 2.3700000000000002e-002 | K261: -6.1100000000000002e-002 | L261: 31.4 | M261: -8.5099999999999995e-002 | N261: 121.4 | O261: 40.54 | P261: 1.1799999999999999 | Q261: 77.45 | R261: 4月11天 | S261: 5.84年 | T261: 3.84年 | U261: 2.19 | V261: 2521. | W261: 7.25 | X261: 4.8000000000000001e-002 | Y261: 3.7000000000000005e-002 | Z261: 46 | AA261: 5.51 | AB261: -5.5999999999999994e-002 | AC261: -6.1699999999999998e-002 | AD261: -0.11 | AE261: -0.111 | AF261: 80.76 | AG261: 83.95 | AH261: 0.44 | AI261: AA- | AJ261: 6.6600000000000006e-002 | AK261: =I261+100*P261 -> 287. | AL261: 260.5 | AM261: 288 | AN261: 176.6 | AO261: 288 | AP261: -0.121 | AQ261: 8 | AR261: 宝莱转债!
A262: 156 | B262: 113550 | C262: 常汽转债! | D262: 43811. | E262: 603035 | F262: 常熟汽饰 | G262: 汽车 | H262: 零部件制 | I262: 162.29 | J262: -3.6600000000000001e-002 | K262: 1.3500000000000002e-002 | L262: 15.76 | M262: -2.4799999999999999e-002 | N262: 121.8 | O262: 9.65 | P262: -6.0000000000000001e-003 | Q262: 163.32 | R262: 转股中 | S262: 5年18天 | T262: 3年18天 | U262: 4.51 | V262: 180 | W262: 0.23600000000000002 | X262: 8.5000000000000006e-002 | Y262: 0.13900000000000001 | Z262: 53 | AA262: 1.58 | AB262: -5.6500000000000002e-002 | AC262: -6.3200000000000006e-002 | AD262: -0.126 | AE262: -0.128 | AF262: 85.39 | AG262: 88.73 | AH262: 0.94 | AI262: AA- | AJ262: 6.6600000000000006e-002 | AK262: =I262+100*P262 -> 161.69 | AL262: 161.3 | AM262: 254 | AN262: 72.5 | AO262: 253 | AP262: 9.5000000000000001e-002 | AQ262: 15 | AR262: 常汽转债!
A263: 194 | B263: 128065 | C263: 雅化转债! | D263: 43595. | E263: 2497. | F263: 雅化集团 | G263: 化工 | H263: 化工 | I263: 143.25 | J263: -1.6500000000000001e-002 | K263: -7.4999999999999997e-003 | L263: 12.9 | M263: -2.64e-002 | N263: 110.9 | O263: 8.95 | P263: -6.0000000000000001e-003 | Q263: 144.13 | R263: 转股中 | S263: 4.46年 | T263: 2.46年 | U263: 6.26 | V263: 312 | W263: 0.34100000000000003 | X263: 5.0999999999999997e-002 | Y263: 7.2999999999999995e-002 | Z263: 123 | AA263: 4.36 | AB263: -5.6799999999999996e-002 | AC263: -6.0899999999999996e-002 | AD263: -0.11699999999999999 | AE263: -0.11900000000000001 | AF263: 92.71 | AG263: 92.33 | AH263: 0.91 | AI263: AA | AJ263: 4.2900000000000001e-002 | AK263: =I263+100*P263 -> 142.65000000000001 | AL263: 142.4 | AM263: 189 | AN263: 49.7 | AO263: 175 | AP263: 0.16699999999999998 | AQ263: 21 | AR263: 雅化转债!
A264: 82 | B264: 113580 | C264: 康隆转债 | D264: 43971. | E264: 603665 | F264: 康隆达 | G264: 服装纺织 | H264: 服装行业 | I264: 166.25 | J264: 1.3300000000000001e-002 | K264: -1.26e-002 | L264: 26.21 | M264: 8.0000000000000004e-004 | N264: 121.2 | O264: 15.51 | P264: -1.6e-002 | Q264: 168.99 | R264: 转股中 | S264: 5.48年 | T264: 3.48年 | U264: 2 | V264: 169 | W264: 0.51100000000000001 | X264: 5.2000000000000005e-002 | Y264: 8.6999999999999994e-002 | Z264: 39 | AA264: 4.2 | AB264: -5.7099999999999998e-002 | AC264: -6.3099999999999989e-002 | AD264: -0.11800000000000001 | AE264: -0.11900000000000001 | AF264: 82.54 | AG264: 85.81 | AH264: 0.95 | AI264: AA- | AJ264: 6.6600000000000006e-002 | AK264: =I264+100*P264 -> 164.65000000000001 | AL264: 163.5 | AM264: 255 | AN264: 77.7 | AO264: 256 | AP264: -1.7000000000000001e-002 | AQ264: 10 | AR264: 康隆转债
A265: 22 | B265: 113038 | C265: 隆20转债 | D265: 44082. | E265: 601012 | F265: 隆基股份 | G265: 能源电力 | H265: 太阳能 | I265: 158.75 | J265: 1.3100000000000001e-002 | K265: 8.3000000000000001e-003 | L265: 75.99 | M265: 2.41e-002 | N265: 111.8 | O265: 52.59 | P265: 9.9000000000000005e-002 | Q265: 144.5 | R265: 3月8天 | S265: 5.75年 | T265: 3.75年 | U265: 50 | V265: 207 | W265: 2.6000000000000002e-002 | X265: 1.7000000000000001e-002 | Y265: 2.5000000000000001e-002 | Z265: 2866. | AA265: 9.24 | AB265: -5.9999999999999998e-002 | AC265: -6.3399999999999998e-002 | AD265: -0.10099999999999999 | AE265: -0.10199999999999999 | AF265: 88.49 | AG265: 89.27 | AH265: 0.89 | AI265: AAA | AJ265: 4.0599999999999997e-002 | AK265: =I265+100*P265 -> 168.65000000000001 | AL265: 173 | AM265: 261 | AN265: 83.7 | AO265: 261 | AP265: 2.e-002 | AQ265: 11 | AR265: 隆20转债
A266: 285 | B266: 128019 | C266: 久立转2! | D266: 43070. | E266: 2318. | F266: 久立特材 | G266: 石油天然 | H266: 石油天然 | I266: 133.7 | J266: -2.1099999999999997e-002 | K266: 1.e-003 | L266: 10.21 | M266: -2.3e-002 | N266: 109.8 | O266: 7.62 | P266: -2.e-003 | Q266: 133.99 | R266: 转股中 | S266: 3年8天 | T266: 1年8天 | U266: 9.98 | V266: 82 | W266: 6.0999999999999999e-002 | X266: 0.11599999999999999 | Y266: 0.156 | Z266: 86 | AA266: 2.44 | AB266: -6.4299999999999996e-002 | AC266: -6.9699999999999998e-002 | AD266: -0.193 | AE266: -0.19600000000000001 | AF266: 97.61 | AG266: 96.98 | AH266: 0.87 | AI266: AA | AJ266: 4.2900000000000001e-002 | AK266: =I266+100*P266 -> 133.5 | AL266: 133.4 | AM266: 104 | AN266: 35.8 | AO266: 54 | AP266: 0.11900000000000001 | AQ266: 13 | AR266: 久立转2!
A267: 288 | B267: 128017 | C267: 金禾转债!! | D267: 43066. | E267: 2597. | F267: 金禾实业 | G267: 化工 | H267: 化工 | I267: 136.999 | J267: -4.87e-002 | K267: 1.9e-003 | L267: 28.45 | M267: -5.6399999999999999e-002 | N267: 109.8 | O267: 22.42 | P267: 8.0000000000000002e-002 | Q267: 126.9 | R267: 转股中 | S267: 3年1.1天 | T267: 1年1.1天 | U267: 5.54 | V267: 44 | W267: 5.5e-002 | X267: 3.5000000000000003e-002 | Y267: 4.4000000000000004e-002 | Z267: 160 | AA267: 3.63 | AB267: -7.2400000000000006e-002 | AC267: -7.7800000000000008e-002 | AD267: -0.21299999999999999 | AE267: -0.215 | AF267: 97.69 | AG267: 97.06 | AH267: 0.83 | AI267: AA | AJ267: 4.2900000000000001e-002 | AK267: =I267+100*P267 -> 144.999 | AL267: 147.1 | AM267: 216 | AN267: 49.4 | AO267: 173 | AP267: -0.127 | AQ267: 11 | AR267: 金禾转债!!
A268: 224 | B268: 113526 | C268: 联泰转债! | D268: 43514. | E268: 603797 | F268: 联泰环保 | G268: 城市公用 | H268: 三废处理 | I268: 152.18 | J268: -5.6600000000000004e-002 | K268: 5.2499999999999998e-002 | L268: 8.48 | M268: -4.6999999999999993e-003 | N268: 110.8 | O268: 6.11 | P268: 9.6000000000000002e-002 | Q268: 138.79 | R268: 转股中 | S268: 4.23年 | T268: 2.23年 | U268: 1.93 | V268: 35 | W268: 0.11599999999999999 | X268: 5.0999999999999997e-002 | Y268: 7.0000000000000007e-002 | Z268: 38 | AA268: 1.79 | AB268: -7.3599999999999999e-002 | AC268: -7.7699999999999991e-002 | AD268: -0.11199999999999999 | AE268: -0.113 | AF268: 93.5 | AG268: 93.11 | AH268: 0.87 | AI268: AA | AJ268: 4.2900000000000001e-002 | AK268: =I268+100*P268 -> 161.78 | AL268: 165.6 | AM268: 256 | AN268: 72.1 | AO268: 251 | AP268: -1.7000000000000001e-002 | AQ268: 8 | AR268: 联泰转债!
A269: 211 | B269: 123022 | C269: 长信转债!! | D269: 43565. | E269: 300088 | F269: 长信科技 | G269: 通信互联 | H269: 通信设备 | I269: 164.3 | J269: -5.1500000000000004e-002 | K269: 1.7100000000000001e-002 | L269: 9.96 | M269: -3.6799999999999999e-002 | N269: 114.9 | O269: 6.15 | P269: 1.4999999999999999e-002 | Q269: 161.95 | R269: 转股中 | S269: 4.38年 | T269: 2.38年 | U269: 2.98 | V269: 101 | W269: 0.20100000000000001 | X269: 1.2e-002 | Y269: 2.e-002 | Z269: 244 | AA269: 3.53 | AB269: -7.980000000000001e-002 | AC269: -8.5099999999999995e-002 | AD269: -0.12 | AE269: -0.121 | AF269: 93.02 | AG269: 95.96 | AH269: 0.93 | AI269: AA | AJ269: 4.2900000000000001e-002 | AK269: =I269+100*P269 -> 165.80000000000001 | AL269: 166.6 | AM269: 257 | AN269: 70.7 | AO269: 249 | AP269: -4.0000000000000001e-002 | AQ269: 12 | AR269: 长信转债!!
A270: 105 | B270: 128102 | C270: 海大转债! | D270: 43937. | E270: 2311. | F270: 海大集团 | G270: 农业 | H270: 畜牧业 | I270: 177.8 | J270: -1.11e-002 | K270: -5.1999999999999998e-003 | L270: 61.59 | M270: -1.6299999999999999e-002 | N270: 114.1 | O270: 34.74 | P270: 3.0000000000000001e-003 | Q270: 177.29 | R270: 转股中 | S270: 5.38年 | T270: 4.38年 | U270: 15.3 | V270: 181 | W270: 6.6000000000000003e-002 | X270: 1.4999999999999999e-002 | Y270: 2.7000000000000003e-002 | Z270: 992 | AA270: 8.55 | AB270: -8.0100000000000005e-002 | AC270: -8.4199999999999997e-002 | AD270: -0.105 | AE270: -0.106 | AF270: 86.2 | AG270: 91 | AH270: 1 | AI270: AA+ | AJ270: 4.36e-002 | AK270: =I270+100*P270 -> 178.10000000000002 | AL270: 178.3 | AM270: 264 | AN270: 87.3 | AO270: 263 | AP270: 1.9e-002 | AQ270: 12 | AR270: 海大转债!
A271: 79 | B271: 113582 | C271: 火炬转债 | D271: 44005. | E271: 603678 | F271: 火炬电子 | G271: 电子 | H271: 元器件制 | I271: 182.27 | J271: -1.9e-002 | K271: 2.2599999999999999e-002 | L271: 48.19 | M271: 3.7000000000000002e-003 | N271: 115.3 | O271: 25.33 | P271: -4.2000000000000003e-002 | Q271: 190.25 | R271: 32天 | S271: 5.57年 | T271: 3.57年 | U271: 6 | V271: 156 | W271: 0.13800000000000001 | X271: 2.7999999999999997e-002 | Y271: 5.2000000000000005e-002 | Z271: 218 | AA271: 6.28 | AB271: -8.0199999999999994e-002 | AC271: -8.4399999999999989e-002 | AD271: -0.13500000000000001 | AE271: -0.13600000000000001 | AF271: 88.02 | AG271: 90.38 | AH271: 0.96 | AI271: AA | AJ271: 4.5599999999999995e-002 | AK271: =I271+100*P271 -> 178.07000000000002 | AL271: 174.3 | AM271: 262 | AN271: 83.9 | AO271: 262 | AP271: 3.9e-002 | AQ271: 4 | AR271: 火炬转债
A272: 180 | B272: 113543 | C272: 欧派转债! | D272: 43712. | E272: 603833 | F272: 欧派家居 | G272: 其他 | H272: 家居用品 | I272: 171.5 | J272: -2.75e-002 | K272: -1.7000000000000001e-003 | L272: 122.89 | M272: -3.0800000000000001e-002 | N272: 114.9 | O272: 71.69 | P272: 0. | Q272: 171.42 | R272: 转股中 | S272: 4.79年 | T272: 3.79年 | U272: 7.5 | V272: 31 | W272: 2.4e-002 | X272: 1.e-002 | Y272: 1.8000000000000002e-002 | Z272: 733 | AA272: 5.56 | AB272: -8.14e-002 | AC272: -8.6300000000000002e-002 | AD272: -0.113 | AE272: -0.114 | AF272: 89.33 | AG272: 94.31 | AH272: 0.95 | AI272: AA | AJ272: 4.2900000000000001e-002 | AK272: =I272+100*P272 -> 171.5 | AL272: 171.6 | AM272: 260 | AN272: 77.3 | AO272: 255 | AP272: 7.2000000000000008e-002 | AQ272: 15 | AR272: 欧派转债!
A273: 64 | B273: 128112 | C273: 歌尔转2 | D273: 44025. | E273: 2241. | F273: 歌尔股份 | G273: 电子 | H273: 电子产品 | I273: 190.55 | J273: -3.1800000000000002e-002 | K273: -2.8500000000000001e-002 | L273: 45.36 | M273: -6.2600000000000003e-002 | N273: 114.5 | O273: 23.27 | P273: -2.2000000000000002e-002 | Q273: 194.93 | R273: 48天 | S273: 5.61年 | T273: 3.61年 | U273: 40 | V273: 472 | W273: 6.0999999999999999e-002 | X273: 2.7000000000000003e-002 | Y273: 5.2999999999999999e-002 | Z273: 1472. | AA273: 8.42 | AB273: -8.7799999999999989e-002 | AC273: -9.1799999999999993e-002 | AD273: -0.14400000000000002 | AE273: -0.14499999999999999 | AF273: 87.74 | AG273: 90.42 | AH273: 0.96 | AI273: AA+ | AJ273: 4.36e-002 | AK273: =I273+100*P273 -> 188.35000000000002 | AL273: 186.2 | AM273: 268 | AN273: 95.7 | AO273: 266 | AP273: 6.9000000000000006e-002 | AQ273: 16 | AR273: 歌尔转2
A274: 130 | B274: 123042 | C274: 银河转债! | D274: 43875. | E274: 300619 | F274: 金银河 | G274: 机械装备 | H274: 专用设备 | I274: 185.7 | J274: -4.7699999999999992e-002 | K274: -3.3599999999999998e-002 | L274: 24.8 | M274: -0.109 | N274: 115.9 | O274: 24.4 | P274: 0.82700000000000007 | Q274: 101.64 | R274: 转股中 | S274: 5.21年 | T274: 3.21年 | U274: 1.67 | V274: 1956. | W274: 5.9900000000000002 | X274: 8.9999999999999997e-002 | Y274: 9.1999999999999998e-002 | Z274: 19 | AA274: 3.91 | AB274: -8.8200000000000001e-002 | AC274: -9.2899999999999996e-002 | AD274: -0.154 | AE274: -0.155 | AF274: 81.32 | AG274: 79.33 | AH274: 0.75 | AI274: A+ | AJ274: 7.7600000000000002e-002 | AK274: =I274+100*P274 -> 268.39999999999998 | AL274: 269.8 | AM274: 289 | AN274: 188.4 | AO274: 289 | AP274: 9.0000000000000011e-003 | AQ274: 24 | AR274: 银河转债!
A275: 259 | B275: 128036 | C275: 金农转债!! | D275: 43192. | E275: 2548. | F275: 金新农 | G275: 农业 | H275: 畜牧业 | I275: 150.49 | J275: -5.2400000000000002e-002 | K275: 4.6999999999999993e-003 | L275: 8.14 | M275: -5.0199999999999995e-002 | N275: 110.3 | O275: 7.39 | P275: 0.36599999999999999 | Q275: 110.15 | R275: 转股中 | S275: 3.35年 | T275: 1.35年 | U275: 1.46 | V275: 270 | W275: 1.2 | X275: 3.2000000000000001e-002 | Y275: 3.5000000000000003e-002 | Z275: 46 | AA275: 2.15 | AB275: -9.01e-002 | AC275: -9.4899999999999998e-002 | AD275: -0.19699999999999998 | AE275: -0.19899999999999998 | AF275: 93.64 | AG275: 90.02 | AH275: 0.95 | AI275: AA- | AJ275: 6.3899999999999998e-002 | AK275: =I275+100*P275 -> 187.09 | AL275: 190.8 | AM275: 270 | AN275: 97.2 | AO275: 267 | AP275: -7.6999999999999999e-002 | AQ275: 15 | AR275: 金农转债!!
A276: 248 | B276: 123012 | C276: 万顺转债 | D276: 43341. | E276: 300057 | F276: 万顺新材 | G276: 造纸包装 | H276: 包装材料 | I276: 156.6 | J276: -4.5100000000000001e-002 | K276: -2.6800000000000001e-002 | L276: 6.39 | M276: -8.7100000000000011e-002 | N276: 110.3 | O276: 5.31 | P276: 0.30099999999999999 | Q276: 120.34 | R276: 转股中 | S276: 3.72年 | T276: 1.72年 | U276: 1.29 | V276: 366 | W276: 1.79 | X276: 2.9999999999999999e-002 | Y276: 3.6000000000000004e-002 | Z276: 43 | AA276: 1.27 | AB276: -9.1400000000000009e-002 | AC276: -9.5799999999999996e-002 | AD276: -0.16399999999999998 | AE276: -0.16600000000000001 | AF276: 91.55 | AG276: 88.01 | AH276: 0.83 | AI276: AA- | AJ276: 6.3899999999999998e-002 | AK276: =I276+100*P276 -> 186.69999999999999 | AL276: 192.9 | AM276: 272 | AN276: 101.3 | AO276: 270 | AP276: -4.4000000000000004e-002 | AQ276: 17 | AR276: 万顺转债
A277: 58 | B277: 128115 | C277: 巨星转债 | D277: 44028. | E277: 2444. | F277: 巨星科技 | G277: 机械装备 | H277: 通用设备 | I277: 201.5 | J277: -3.2599999999999997e-002 | K277: -1.e-003 | L277: 25.9 | M277: -3.4700000000000002e-002 | N277: 115.3 | O277: 12.28 | P277: -4.4999999999999998e-002 | Q277: 210.91 | R277: 2月5天 | S277: 5.65年 | T277: 3.65年 | U277: 9.73 | V277: 169 | W277: 8.5999999999999993e-002 | X277: 3.5000000000000003e-002 | Y277: 7.400000000000001e-002 | Z277: 278 | AA277: 3.28 | AB277: -9.5600000000000004e-002 | AC277: -9.9600000000000008e-002 | AD277: -0.14699999999999999 | AE277: -0.14999999999999999 | AF277: 89.99 | AG277: 90.08 | AH277: 0.97 | AI277: AA | AJ277: 4.5599999999999995e-002 | AK277: =I277+100*P277 -> 197. | AL277: 192.1 | AM277: 271 | AN277: 102 | AO277: 271 | AP277: 0.184 | AQ277: 4 | AR277: 巨星转债
A278: 176 | B278: 123030 | C278: 九洲转债! | D278: 43720. | E278: 300040 | F278: 九洲集团 | G278: 能源电力 | H278: 电力设备 | I278: 193.4 | J278: -6.1200000000000004e-002 | K278: -7.3000000000000001e-003 | L278: 8.85 | M278: -6.8400000000000002e-002 | N278: 120 | O278: 5.65 | P278: 0.23499999999999999 | Q278: 156.64 | R278: 转股中 | S278: 4.80年 | T278: 2.80年 | U278: 1.15 | V278: 869 | W278: 3.8300000000000001 | X278: 3.5000000000000003e-002 | Y278: 5.4000000000000006e-002 | Z278: 33 | AA278: 1.54 | AB278: -9.6000000000000002e-002 | AC278: -0.10199999999999999 | AD278: -0.122 | AE278: -0.12300000000000001 | AF278: 86.27 | AG278: 89.64 | AH278: 1 | AI278: AA- | AJ278: 6.3899999999999998e-002 | AK278: =I278+100*P278 -> 216.90000000000001 | AL278: 230.2 | AM278: 285 | AN278: 140.5 | AO278: 285 | AP278: -1.9e-002 | AQ278: 29 | AR278: 九洲转债!
A279: 117 | B279: 123043 | C279: 正元转债 | D279: 43921. | E279: 300645 | F279: 正元智慧 | G279: 计算机及 | H279: 软件开发 | I279: 207 | J279: -9.2100000000000015e-002 | K279: 2.12e-002 | L279: 17.27 | M279: -8.8200000000000001e-002 | N279: 121.4 | O279: 15.41 | P279: 0.84699999999999998 | Q279: 112.07 | R279: 转股中 | S279: 5.34年 | T279: 3.34年 | U279: 1.66 | V279: 2477. | W279: 6.9100000000000001 | X279: 7.5999999999999998e-002 | Y279: 8.5000000000000006e-002 | Z279: 22 | AA279: 3.57 | AB279: -9.6799999999999997e-002 | AC279: -0.10300000000000001 | AD279: -0.10099999999999999 | AE279: -0.10099999999999999 | AF279: 80.73 | AG279: 82.24 | AH279: 0.8 | AI279: A+ | AJ279: 7.7600000000000002e-002 | AK279: =I279+100*P279 -> 291.69999999999999 | AL279: 301.9 | AM279: 290 | AN279: 219.7 | AO279: 291 | AP279: -5.5e-002 | AQ279: 17 | AR279: 正元转债
A280: 80 | B280: 113581 | C280: 龙蟠转债 | D280: 43970. | E280: 603906 | F280: 龙蟠科技 | G280: 化工 | H280: 化工 | I280: 226.61 | J280: -2.4700000000000003e-002 | K280: -8.6e-003 | L280: 21.82 | M280: -3.4500000000000003e-002 | N280: 129.6 | O280: 9.48 | P280: -1.4999999999999999e-002 | Q280: 230.17 | R280: 转股中 | S280: 5.48年 | T280: 3.48年 | U280: 4 | V280: 198 | W280: 0.218 | X280: 6.0999999999999999e-002 | Y280: 0.13900000000000001 | Z280: 66 | AA280: 4.51 | AB280: -9.9299999999999999e-002 | AC280: -0.107 | AD280: -0.10199999999999999 | AE280: -0.10300000000000001 | AF280: 81.6 | AG280: 87.19 | AH280: 0.96 | AI280: A+ | AJ280: 7.7600000000000002e-002 | AK280: =I280+100*P280 -> 225.11000000000001 | AL280: 223.1 | AM280: 282 | AN280: 135.9 | AO280: 284 | AP280: -0.14300000000000002 | AQ280: 15 | AR280: 龙蟠转债
A281: 275 | B281: 128028 | C281: 赣锋转债!! | D281: 43119. | E281: 2460. | F281: 赣锋锂业 | G281: 有色金属 | H281: 小金属 | I281: 151.5 | J281: -8.5000000000000006e-003 | K281: -3.3700000000000001e-002 | L281: 60.82 | M281: -4.2199999999999994e-002 | N281: 109.3 | O281: 41.68 | P281: 3.7999999999999999e-002 | Q281: 145.92 | R281: 转股中 | S281: 3年51天 | T281: 1年51天 | U281: 9.17 | V281: 82 | W281: 5.9000000000000004e-002 | X281: 1.1000000000000001e-002 | Y281: 1.7000000000000001e-002 | Z281: 811 | AA281: 9.78 | AB281: -0.10000000000000001 | AC281: -0.105 | AD281: -0.24199999999999999 | AE281: -0.24399999999999999 | AF281: 96.64 | AG281: 96.02 | AH281: 1 | AI281: AA | AJ281: 4.2900000000000001e-002 | AK281: =I281+100*P281 -> 155.30000000000001 | AL281: 157.1 | AM281: 247 | AN281: 60.4 | AO281: 231 | AP281: 5.7999999999999996e-002 | AQ281: 13 | AR281: 赣锋转债!!
A282: 187 | B282: 123027 | C282: 蓝晓转债! | D282: 43650. | E282: 300487 | F282: 蓝晓科技 | G282: 化工 | H282: 化工 | I282: 193 | J282: -1.1699999999999999e-002 | K282: 1.6000000000000001e-003 | L282: 46 | M282: -1.0800000000000001e-002 | N282: 119.5 | O282: 29.33 | P282: 0.23100000000000001 | Q282: 156.84 | R282: 转股中 | S282: 4.61年 | T282: 2.61年 | U282: 1.08 | V282: 1845. | W282: 8.3599999999999994 | X282: 1.1000000000000001e-002 | Y282: 1.7000000000000001e-002 | Z282: 99 | AA282: 6.21 | AB282: -0.10099999999999999 | AC282: -0.107 | AD282: -0.13200000000000001 | AE282: -0.13400000000000001 | AF282: 85.64 | AG282: 86.38 | AH282: 0.94 | AI282: A+ | AJ282: 7.4900000000000008e-002 | AK282: =I282+100*P282 -> 216.09999999999999 | AL282: 229.2 | AM282: 284 | AN282: 142.8 | AO282: 286 | AP282: -7.9000000000000001e-002 | AQ282: 21 | AR282: 蓝晓转债!
A283: 222 | B283: 128053 | C283: 尚荣转债! | D283: 43531. | E283: 2551. | F283: 尚荣医疗 | G283: 医药 | H283: 医疗器械 | I283: 182 | J283: -3.1899999999999998e-002 | K283: -6.0000000000000001e-003 | L283: 7.1 | M283: -3.7900000000000003e-002 | N283: 114.9 | O283: 4.89 | P283: 0.253 | Q283: 145.19 | R283: 转股中 | S283: 4.29年 | T283: 2.29年 | U283: 1.91 | V283: 562 | W283: 1.6499999999999999 | X283: 3.3000000000000002e-002 | Y283: 4.8000000000000001e-002 | Z283: 58 | AA283: 1.99 | AB283: -0.10300000000000001 | AC283: -0.109 | AD283: -0.14699999999999999 | AE283: -0.14800000000000002 | AF283: 93.37 | AG283: 96.32 | AH283: 1 | AI283: AA | AJ283: 4.2900000000000001e-002 | AK283: =I283+100*P283 -> 207.30000000000001 | AL283: 218.8 | AM283: 280 | AN283: 122.5 | AO283: 276 | AP283: -6.5000000000000002e-002 | AQ283: 27 | AR283: 尚荣转债!
A284: 69 | B284: 113586 | C284: 上机转债 | D284: 44019. | E284: 603185 | F284: 上机数控 | G284: 机械装备 | H284: 专用设备 | I284: 232.8 | J284: -9.300000000000001e-003 | K284: 5.7999999999999996e-003 | L284: 82.21 | M284: -3.4999999999999996e-003 | N284: 120.8 | O284: 33.3 | P284: -5.7000000000000002e-002 | Q284: 246.88 | R284: 45天 | S284: 5.61年 | T284: 3.61年 | U284: 6.65 | V284: 73 | W284: 4.7e-002 | X284: 3.5000000000000003e-002 | Y284: 8.5999999999999993e-002 | Z284: 191 | AA284: 9.5 | AB284: -0.11199999999999999 | AC284: -0.11699999999999999 | AD284: -0.10099999999999999 | AE284: -0.10199999999999999 | AF284: 81.89 | AG284: 84.83 | AH284: 0.98 | AI284: AA- | AJ284: 6.6600000000000006e-002 | AK284: =I284+100*P284 -> 227.10000000000002 | AL284: 218.7 | AM284: 279 | AN284: 133.9 | AO284: 282 | AP284: 4.0000000000000001e-003 | AQ284: 8 | AR284: 上机转债
A285: 78 | B285: 113035 | C285: 福莱转债 | D285: 43999. | E285: 601865 | F285: 福莱特 | G285: 能源电力 | H285: 太阳能 | I285: 249.82 | J285: -3.9300000000000002e-002 | K285: 5.7999999999999996e-002 | L285: 40.8 | M285: 1.9e-002 | N285: 120.3 | O285: 13.56 | P285: -0.17000000000000001 | Q285: 300.88 | R285: 33天 | S285: 5.57年 | T285: 3.57年 | U285: 14.5 | V285: 3682. | W285: 0.9840000000000001 | X285: 1.8000000000000002e-002 | Y285: 5.5e-002 | Z285: 797 | AA285: 14.98 | AB285: -0.125 | AC285: -0.13 | AD285: -0.109 | AE285: -0.11 | AF285: 88.02 | AG285: 94.28 | AH285: 0.98 | AI285: AA | AJ285: 4.5599999999999995e-002 | AK285: =I285+100*P285 -> 232.81999999999999 | AL285: 198.8 | AM285: 274 | AN285: 104.5 | AO285: 274 | AP285: 0.21299999999999999 | AQ285: 6 | AR285: 福莱转债
A286: 237 | B286: 113521 | C286: 科森转债!! | D286: 43441. | E286: 603626 | F286: 科森科技 | G286: 通信互联 | H286: 通信设备 | I286: 202.06 | J286: -3.9e-002 | K286: -2.1000000000000001e-002 | L286: 16 | M286: -6.3200000000000006e-002 | N286: 115.2 | O286: 8.7 | P286: 9.9000000000000005e-002 | Q286: 183.91 | R286: 转股中 | S286: 4年16天 | T286: 2年16天 | U286: 0.63 | V286: 102 | W286: 0.80200000000000005 | X286: 8.0000000000000002e-003 | Y286: 1.4999999999999999e-002 | Z286: 78 | AA286: 3.55 | AB286: -0.13200000000000001 | AC286: -0.13699999999999998 | AD286: -0.192 | AE286: -0.193 | AF286: 94.47 | AG286: 97.6 | AH286: 0.95 | AI286: AA | AJ286: 4.2900000000000001e-002 | AK286: =I286+100*P286 -> 211.96000000000001 | AL286: 220.2 | AM286: 281 | AN286: 122.6 | AO286: 277 | AP286: -2.8999999999999998e-002 | AQ286: 24 | AR286: 科森转债!!
A287: 160 | B287: 123034 | C287: 通光转债! | D287: 43797. | E287: 300265 | F287: 通光线缆 | G287: 通信互联 | H287: 通信设备 | I287: 244.55 | J287: -5.5000000000000005e-003 | K287: -3.6499999999999998e-002 | L287: 11.66 | M287: -4.4999999999999998e-002 | N287: 118.5 | O287: 7.97 | P287: 0.67200000000000004 | Q287: 146.3 | R287: 转股中 | S287: 5年4.1天 | T287: 3年4.1天 | U287: 0.78 | V287: 1856. | W287: 9.4499999999999993 | X287: 1.8000000000000002e-002 | Y287: 2.7000000000000003e-002 | Z287: 43 | AA287: 3.39 | AB287: -0.13699999999999998 | AC287: -0.14199999999999999 | AD287: -0.13800000000000001 | AE287: -0.13900000000000001 | AF287: 82.3 | AG287: 82.22 | AH287: 0.93 | AI287: A+ | AJ287: 7.7600000000000002e-002 | AK287: =I287+100*P287 -> 311.75 | AL287: 342.8 | AM287: 293 | AN287: 260.5 | AO287: 293 | AP287: -0.106 | AQ287: 25 | AR287: 通光转债!
A288: 245 | B288: 123014 | C288: 凯发转债! | D288: 43333. | E288: 300407 | F288: 凯发电气 | G288: 能源电力 | H288: 电力设备 | I288: 163.8 | J288: -1.46e-002 | K288: 2.5000000000000001e-002 | L288: 10.42 | M288: 1.1699999999999999e-002 | N288: 108.5 | O288: 8.12 | P288: 0.27600000000000002 | Q288: 128.33 | R288: 转股中 | S288: 2.74年 | T288: 0.74年 | U288: 1.16 | V288: 3338. | W288: 16.309999999999999 | X288: 3.6000000000000004e-002 | Y288: 4.7e-002 | Z288: 32 | AA288: 2.35 | AB288: -0.14099999999999999 | AC288: -0.14599999999999999 | AD288: -0.42700000000000005 | AE288: -0.42899999999999999 | AF288: 94.89 | AG288: 89.35 | AH288: 0.89 | AI288: A+ | AJ288: 7.4499999999999997e-002 | AK288: =I288+100*P288 -> 191.40000000000001 | AL288: 199.3 | AM288: 275 | AN288: 104.4 | AO288: 273 | AP288: 0.11800000000000001 | AQ288: 15 | AR288: 凯发转债!
A289: 171 | B289: 123032 | C289: 万里转债!! | D289: 43769. | E289: 300591 | F289: 万里马 | G289: 服装纺织 | H289: 服装纺织 | I289: 285 | J289: -4.0399999999999998e-002 | K289: -4.2800000000000005e-002 | L289: 10.19 | M289: -9.5000000000000001e-002 | N289: 132 | O289: 6.89 | P289: 0.92700000000000005 | Q289: 147.9 | R289: 转股中 | S289: 4.95年 | T289: 2.95年 | U289: 0.63 | V289: 1951. | W289: 10.470000000000001 | X289: 1.9e-002 | Y289: 2.7999999999999997e-002 | Z289: 34 | AA289: 7.03 | AB289: -0.14800000000000002 | AC289: -0.156 | AD289: -0.156 | AE289: -0.157 | AF289: 85.9 | AG289: 93.53 | AH289: 0.88 | AI289: A+ | AJ289: 7.4900000000000008e-002 | AK289: =I289+100*P289 -> 377.69999999999999 | AL289: 422.1 | AM289: 297 | AN289: 328.6 | AO289: 297 | AP289: -3.9e-002 | AQ289: 42 | AR289: 万里转债!!
A290: 239 | B290: 113520 | C290: 百合转债! | D290: 43430. | E290: 603313 | F290: 梦百合 | G290: 其他 | H290: 家居用品 | I290: 232.8 | J290: 1.54e-002 | K290: 8.3000000000000001e-003 | L290: 32.6 | M290: 2.4199999999999999e-002 | N290: 115.2 | O290: 14.28 | P290: 2.e-002 | Q290: 228.29 | R290: 转股中 | S290: 4年8天 | T290: 2年8天 | U290: 0.61 | V290: 1104. | W290: 7.5099999999999998 | X290: 5.0000000000000001e-003 | Y290: 1.2e-002 | Z290: 113 | AA290: 4.04 | AB290: -0.16300000000000001 | AC290: -0.16800000000000001 | AD290: -0.222 | AE290: -0.223 | AF290: 90.57 | AG290: 90.35 | AH290: 0.98 | AI290: AA- | AJ290: 6.3899999999999998e-002 | AK290: =I290+100*P290 -> 234.80000000000001 | AL290: 237.3 | AM290: 287 | AN290: 146.7 | AO290: 287 | AP290: 0.10400000000000001 | AQ290: 12 | AR290: 百合转债!
A291: 226 | B291: 123018 | C291: 溢利转债! | D291: 43488. | E291: 300381 | F291: 溢多利 | G291: 医药 | H291: 原料药 | I291: 241.8 | J291: -6.0299999999999999e-002 | K291: 2.4700000000000003e-002 | L291: 13.3 | M291: -3.7599999999999995e-002 | N291: 114.9 | O291: 8.29 | P291: 0.50700000000000001 | Q291: 160.43 | R291: 转股中 | S291: 4年50天 | T291: 2年50天 | U291: 0.54 | V291: 476 | W291: 3.4700000000000002 | X291: 8.0000000000000002e-003 | Y291: 1.3999999999999999e-002 | Z291: 64 | AA291: 2.25 | AB291: -0.16699999999999998 | AC291: -0.17199999999999999 | AD291: -0.215 | AE291: -0.215 | AF291: 89.8 | AG291: 89.44 | AH291: 0.95 | AI291: AA- | AJ291: 6.3899999999999998e-002 | AK291: =I291+100*P291 -> 292.5 | AL291: 323.2 | AM291: 292 | AN291: 233.4 | AO291: 292 | AP291: -4.9000000000000002e-002 | AQ291: 13 | AR291: 溢利转债!
A292: 274 | B292: 128029 | C292: 太阳转债!! | D292: 43116. | E292: 2078. | F292: 太阳纸业 | G292: 造纸包装 | H292: 造纸行业 | I292: 160.45 | J292: 2.2000000000000001e-003 | K292: -1.5e-003 | L292: 13.91 | M292: 7.000000000000001e-004 | N292: 107.8 | O292: 8.55 | P292: -1.3999999999999999e-002 | Q292: 162.69 | R292: 转股中 | S292: 2年52天 | T292: 52天 | U292: 10.9 | V292: 553 | W292: 0.311 | X292: 2.9999999999999999e-002 | Y292: 4.9000000000000002e-002 | Z292: 362 | AA292: 2.35 | AB292: -0.17100000000000001 | AC292: -0.17600000000000002 | AD292: -1.286 | AE292: -1.29 | AF292: 99.74 | AG292: 99.11 | AH292: 1 | AI292: AA+ | AJ292: 4.0500000000000001e-002 | AK292: =I292+100*P292 -> 159.04999999999998 | AL292: 158.2 | AM292: 250 | AN292: 58.5 | AO292: 222 | AP292: 4.2999999999999997e-002 | AQ292: 8 | AR292: 太阳转债!!
A293: 273 | B293: 128030 | C293: 天康转债!! | D293: 43129. | E293: 2100. | F293: 天康生物 | G293: 农业 | H293: 畜牧业 | I293: 200 | J293: -5.6600000000000004e-002 | K293: 2.63e-002 | L293: 13.75 | M293: -3.0299999999999997e-002 | N293: 112.3 | O293: 7.85 | P293: 0.14199999999999999 | Q293: 175.16 | R293: 转股中 | S293: 3年52天 | T293: 1年52天 | U293: 0.98 | V293: 195 | W293: 0.96999999999999997 | X293: 6.9999999999999993e-003 | Y293: 1.2e-002 | Z293: 148 | AA293: 2.47 | AB293: -0.17100000000000001 | AC293: -0.17600000000000002 | AD293: -0.36099999999999999 | AE293: -0.36299999999999999 | AF293: 97.36 | AG293: 98.71 | AH293: 1 | AI293: AA | AJ293: 4.2900000000000001e-002 | AK293: =I293+100*P293 -> 214.19999999999999 | AL293: 224.8 | AM293: 283 | AN293: 126.1 | AO293: 280 | AP293: -5.7000000000000002e-002 | AQ293: 11 | AR293: 天康转债!!
A294: 174 | B294: 123031 | C294: 晶瑞转债! | D294: 43734. | E294: 300655 | F294: 晶瑞股份 | G294: 化工 | H294: 化工 | I294: 288.512 | J294: 6.4199999999999993e-002 | K294: -3.3599999999999998e-002 | L294: 38.09 | M294: 3.1400000000000004e-002 | N294: 115.8 | O294: 18.43 | P294: 0.39600000000000002 | Q294: 206.67 | R294: 转股中 | S294: 4.83年 | T294: 2.83年 | U294: 0.63 | V294: 5242. | W294: 27.550000000000001 | X294: 9.0000000000000011e-003 | Y294: 1.8000000000000002e-002 | Z294: 72 | AA294: 5.6 | AB294: -0.17399999999999999 | AC294: -0.17899999999999999 | AD294: -0.16899999999999998 | AE294: -0.16899999999999998 | AF294: 83.36 | AG294: 82.24 | AH294: 0.98 | AI294: A+ | AJ294: 7.4900000000000008e-002 | AK294: =I294+100*P294 -> 328.11200000000002 | AL294: 370.4 | AM294: 294 | AN294: 287 | AO294: 294 | AP294: -4.0000000000000001e-002 | AQ294: 15 | AR294: 晶瑞转债!
A295: 257 | B295: 113509 | C295: 新泉转债!! | D295: 43273. | E295: 603179 | F295: 新泉股份 | G295: 汽车 | H295: 零部件制 | I295: 220.03 | J295: -3.5499999999999997e-002 | K295: -2.4500000000000001e-002 | L295: 29.82 | M295: -6.1399999999999996e-002 | N295: 110.3 | O295: 14.22 | P295: 4.9000000000000002e-002 | Q295: 209.7 | R295: 转股中 | S295: 3.59年 | T295: 1.59年 | U295: 1.29 | V295: 29 | W295: 0.10099999999999999 | X295: 1.3999999999999999e-002 | Y295: 2.8999999999999998e-002 | Z295: 94 | AA295: 4.8 | AB295: -0.17699999999999999 | AC295: -0.18100000000000002 | AD295: -0.27899999999999997 | AE295: -0.28000000000000003 | AF295: 95.54 | AG295: 95.14 | AH295: 0.98 | AI295: AA | AJ295: 4.2900000000000001e-002 | AK295: =I295+100*P295 -> 224.93000000000001 | AL295: 230.4 | AM295: 286 | AN295: 134.8 | AO295: 283 | AP295: -7.0000000000000007e-002 | AQ295: 10 | AR295: 新泉转债!!
A296: 292 | B296: 127004 | C296: 模塑转债!! | D296: 42963. | E296: 700. | F296: 模塑科技 | G296: 汽车 | H296: 零部件制 | I296: 198 | J296: 0. | K296: -7.7000000000000002e-003 | L296: 5.8 | M296: -4.6100000000000002e-002 | N296: 113.3 | O296: 7.46 | P296: 1.55 | Q296: 77.75 | R296: 转股中 | S296: 2.59年 | T296: 0.59年 | U296: 1.33 | V296: 1056. | W296: 4.0199999999999996 | X296: 2.5000000000000001e-002 | Y296: 1.9e-002 | Z296: 53 | AA296: 2.05 | AB296: -0.19699999999999998 | AC296: -0.20399999999999999 | AD296: -0.66299999999999992 | AE296: -0.66500000000000004 | AF296: 98.67 | AG296: 100.13 | AH296: 0.17 | AI296: AA | AJ296: 4.2500000000000003e-002 | AK296: =I296+100*P296 -> 353. | AL296: 318.3 | AM296: 291 | AN296: 218.1 | AO296: 290 | AP296: -6.9000000000000006e-002 | AQ296: 37 | AR296: 模塑转债!!
A297: 250 | B297: 128041 | C297: 盛路转债!! | D297: 43326. | E297: 2446. | F297: 盛路通信 | G297: 通信互联 | H297: 通信设备 | I297: 269 | J297: 3.4599999999999999e-002 | K297: -3.4599999999999999e-002 | L297: 7.34 | M297: 0. | N297: 114.3 | O297: 6.85 | P297: 1.51 | Q297: 107.15 | R297: 转股中 | S297: 3.71年 | T297: 1.71年 | U297: 0.53 | V297: 1728. | W297: 12.1 | X297: 8.0000000000000002e-003 | Y297: 9.0000000000000011e-003 | Z297: 66 | AA297: 2.21 | AB297: -0.20899999999999999 | AC297: -0.214 | AD297: -0.29999999999999999 | AE297: -0.30099999999999999 | AF297: 95.06 | AG297: 98.09 | AH297: 0.89 | AI297: AA | AJ297: 4.2900000000000001e-002 | AK297: =I297+100*P297 -> 420. | AL297: 430.8 | AM297: 299 | AN297: 332.8 | AO297: 298 | AP297: -1.3000000000000001e-002 | AQ297: 12 | AR297: 盛路转债!!
A298: 254 | B298: 110044 | C298: 广电转债!! | D298: 43305. | E298: 600831 | F298: 广电网络 | G298: 传媒娱乐 | H298: 影视娱乐 | I298: 265.09 | J298: -1.8700000000000001e-002 | K298: -2.0000000000000001e-004 | L298: 6.9 | M298: -3.3599999999999998e-002 | N298: 112.3 | O298: 6.9 | P298: 1.6499999999999999 | Q298: 100 | R298: 转股中 | S298: 3.66年 | T298: 1.66年 | U298: 0.71 | V298: 462 | W298: 2.4100000000000001 | X298: 1.3999999999999999e-002 | Y298: 1.3999999999999999e-002 | Z298: 49 | AA298: 1.33 | AB298: -0.21199999999999999 | AC298: -0.21600000000000003 | AD298: -0.308 | AE298: -0.309 | AF298: 95.28 | AG298: 96.6 | AH298: 0.56 | AI298: AA | AJ298: 4.2900000000000001e-002 | AK298: =I298+100*P298 -> 430.08999999999997 | AL298: 430.2 | AM298: 298 | AN298: 333.6 | AO298: 299 | AP298: -8.1000000000000003e-002 | AQ298: 11 | AR298: 广电转债!!
A299: 225 | B299: 128052 | C299: 凯龙转债! | D299: 43486. | E299: 2783. | F299: 凯龙股份 | G299: 化工 | H299: 化工 | I299: 303 | J299: 2.7799999999999998e-002 | K299: -3.8399999999999997e-002 | L299: 13.13 | M299: -1.06e-002 | N299: 115 | O299: 6.67 | P299: 0.53900000000000003 | Q299: 196.85 | R299: 转股中 | S299: 4年51天 | T299: 2年51天 | U299: 0.32 | V299: 958 | W299: 9.9399999999999995 | X299: 6.0000000000000001e-003 | Y299: 1.3000000000000001e-002 | Z299: 50 | AA299: 2.89 | AB299: -0.21199999999999999 | AC299: -0.21600000000000003 | AD299: -0.247 | AE299: -0.248 | AF299: 94.06 | AG299: 97.03 | AH299: 1 | AI299: AA | AJ299: 4.2900000000000001e-002 | AK299: =I299+100*P299 -> 356.89999999999998 | AL299: 409.1 | AM299: 296 | AN299: 312.1 | AO299: 296 | AP299: 6.9999999999999993e-003 | AQ299: 12 | AR299: 凯龙转债!
A300: 144 | B300: 113555 | C300: 振德转债! | D300: 43844. | E300: 603301 | F300: 振德医疗 | G300: 医药 | H300: 医疗器械 | I300: 524.74 | J300: -2.75e-002 | K300: 2.0000000000000001e-004 | L300: 73.7 | M300: -2.76e-002 | N300: 124.8 | O300: 14.01 | P300: -2.e-003 | Q300: 526.05 | R300: 转股中 | S300: 5年49天 | T300: 3年49天 | U300: 1.52 | V300: 222 | W300: 0.27699999999999997 | X300: 1.e-002 | Y300: 5.0000000000000003e-002 | Z300: 159 | AA300: 4.45 | AB300: -0.247 | AC300: -0.253 | AD300: -0.185 | AE300: -0.18600000000000003 | AF300: 84.92 | AG300: 90.4 | AH300: 0.99 | AI300: AA- | AJ300: 6.6600000000000006e-002 | AK300: =I300+100*P300 -> 524.53999999999996 | AL300: 523.4 | AM300: 300 | AN300: 433 | AO300: 300 | AP300: 2.6000000000000002e-002 | AQ300: 16 | AR300: 振德转债!
A301: 236 | B301: 127008 | C301: 特发转债! | D301: 43459. | E301: 70. | F301: 特发信息 | G301: 通信互联 | H301: 通信设备 | I301: 283 | J301: 3.8e-003 | K301: -3.2300000000000002e-002 | L301: 9.9 | M301: -2.8500000000000001e-002 | N301: 111.1 | O301: 5.54 | P301: 0.58399999999999996 | Q301: 178.7 | R301: 转股中 | S301: 3年16天 | T301: 1年16天 | U301: 0.59 | V301: 1811. | W301: 10.140000000000001 | X301: 6.9999999999999993e-003 | Y301: 1.3000000000000001e-002 | Z301: 81 | AA301: 2.85 | AB301: -0.26700000000000002 | AC301: -0.27200000000000002 | AD301: -0.51800000000000002 | AE301: -0.51900000000000002 | AF301: 96.83 | AG301: 97.97 | AH301: 1 | AI301: AA | AJ301: 4.2900000000000001e-002 | AK301: =I301+100*P301 -> 341.39999999999998 | AL301: 387.3 | AM301: 295 | AN301: 289.3 | AO301: 295 | AP301: -1.8000000000000002e-002 | AQ301: 15 | AR301: 特发转债!
A302: 247 | B302: 123013 | C302: 横河转债! | D302: 43332. | E302: 300539 | F302: 横河模具 | G302: 机械装备 | H302: 专用设备 | I302: 393.01 | J302: -4.5599999999999995e-002 | K302: 9.300000000000001e-003 | L302: 11.22 | M302: -4.2699999999999995e-002 | N302: 115.2 | O302: 9.13 | P302: 2.2000000000000002 | Q302: 122.89 | R302: 转股中 | S302: 3.73年 | T302: 1.73年 | U302: 0.38 | V302: 948 | W302: 6.3700000000000001 | X302: 1.4999999999999999e-002 | Y302: 1.9e-002 | Z302: 25 | AA302: 5.14 | AB302: -0.28399999999999997 | AC302: -0.28800000000000003 | AD302: -0.35200000000000004 | AE302: -0.35299999999999998 | AF302: 90.22 | AG302: 88.51 | AH302: 0.85 | AI302: A+ | AJ302: 7.4900000000000008e-002 | AK302: =I302+100*P302 -> 613.00999999999999 | AL302: 663.1 | AM302: 301 | AN302: 572.9 | AO302: 302 | AP302: 0.14400000000000002 | AQ302: 15 | AR302: 横河转债!
A303: 243 | B303: 123015 | C303: 蓝盾转债!! | D303: 43356. | E303: 300297 | F303: 蓝盾股份 | G303: 计算机及 | H303: 软件开发 | I303: 404.297 | J303: 8.3900000000000002e-002 | K303: 1.04e-002 | L303: 8.12 | M303: 9.4299999999999995e-002 | N303: 112.3 | O303: 5.79 | P303: 1.8799999999999999 | Q303: 140.24 | R303: 转股中 | S303: 3.78年 | T303: 1.78年 | U303: 1 | V303: 10838. | W303: 25.91 | X303: 1.e-002 | Y303: 1.3999999999999999e-002 | Z303: 101 | AA303: 2.7 | AB303: -0.28999999999999998 | AC303: -0.29399999999999998 | AD303: -0.34499999999999997 | AE303: -0.34600000000000003 | AF303: 94.77 | AG303: 96.08 | AH303: 1 | AI303: AA | AJ303: 4.2900000000000001e-002 | AK303: =I303+100*P303 -> 592.29700000000003 | AL303: 668.4 | AM303: 302 | AN303: 572.3 | AO303: 301 | AP303: 0.309 | AQ303: 19 | AR303: 蓝盾转债!!
A304: 178 | B304: 123029 | C304: 英科转债! | D304: 43718. | E304: 300677 | F304: 英科医疗 | G304: 医药 | H304: 医疗器械 | I304: 1109.99 | J304: -1.5100000000000001e-002 | K304: 0. | L304: 116.21 | M304: -1.52e-002 | N304: 138.2 | O304: 10.41 | P304: -6.0000000000000001e-003 | Q304: 1116.33 | R304: 转股中 | S304: 4.79年 | T304: 2.79年 | U304: 1.36 | V304: 591 | W304: 0.39299999999999996 | X304: 4.0000000000000001e-003 | Y304: 3.9e-002 | Z304: 388 | AA304: 4.28 | AB304: -0.35799999999999998 | AC304: -0.36499999999999999 | AD304: -0.245 | AE304: -0.245 | AF304: 89.6 | AG304: 103.74 | AH304: 0.99 | AI304: AA- | AJ304: 6.3899999999999998e-002 | AK304: =I304+100*P304 -> 1109.3900000000001 | AL304: 1103.5999999999999 | AM304: 303 | AN304: 999.9 | AO304: 303 | AP304: -4.5999999999999999e-002 | AQ304: 16 | AR304: 英科转债!