A1: 序号 | B1: 转债代码 | C1: 转债名称 | D1: 股票代码 | E1: 股票名称 | F1: 行业 | G1: 子行业 | H1: 转债价格 | I1: 涨跌 | J1: 日内套利 | K1: 股价 | L1: 涨跌 | M1: 剩余本息 | N1: 转股价格 | O1: 转股溢价率 | P1: 转股价值 | Q1: 距离转股日 | R1: 剩余年限 | S1: 回售年限 | T1: 转债余额 | U1: 转债成交额 | V1: 转债换手率 | W1: 余额/市值 | X1: 余额/股本 | Y1: 股票市值 | Z1: P/B | AA1: 税前收益率 | AB1: 税后收益率 | AC1: 税前回售收益 | AD1: 税后回售收益 | AE1: 回售价值 | AF1: 纯债价值 | AG1: 弹性 | AH1: 信用 | AI1: 折现率 | AJ1: 双低 | AK1: 老式双低 | AL1: 老式排名 | AM1: 新式双低 | AN1: 新式排名 | AO1: MA20乖离 | AP1: 热门度 | AQ1: 转债名称
A2: 208 | B2: 128062 | C2: 亚药转债! | D2: 2370 | E2: 亚太药业 | F2: 医药 | G2: 化学制药 | H2: 76.362 | I2: -2.2000000000000001e-003 | J2: 2.2000000000000001e-003 | K2: 4.49 | L2: -2.3900000000000001e-002 | M2: 119.8 | N2: 16.25 | O2: 1.76 | P2: 27.63 | Q2: 转股中 | R2: 4.40年 | S2: 2.40年 | T2: 9.64 | U2: 12 | V2: 1.6e-002 | W2: 0.40000000000000002 | X2: 0.111 | Y2: 24 | Z2: 7.48 | AA2: 0.11 | AB2: 0.10099999999999999 | AC2: 0.126 | AD2: 0.12300000000000001 | AE2: 81.97 | AF2: 80.91 | AG2: 0 | AH2: A- | AI2: 9.5299999999999996e-002 | AJ2: =H2+100*O2 -> 252.36199999999999 | AK2: 125.1 | AL2: 26 | AM2: 43.1 | AN2: 143 | AO2: -7.4999999999999997e-002 | AP2: 84 | AQ2: 亚药转债!
A3: 228 | B3: 113527 | C3: 维格转债! | D3: 603518 | E3: 锦泓集团 | F3: 服装纺织 | G3: 服装行业 | H3: 92.35 | I3: -8.0000000000000004e-004 | J3: -7.000000000000001e-004 | K3: 5.86 | L3: -1.6799999999999999e-002 | M3: 120.2 | N3: 9.85 | O3: 0.55200000000000005 | P3: 59.49 | Q3: 转股中 | R3: 4.21年 | S3: 2.21年 | T3: 7.46 | U3: 3.6 | V3: 5.0000000000000001e-003 | W3: 0.504 | X3: 0.29999999999999999 | Y3: 15 | Z3: 0.94 | AA3: 6.6100000000000006e-002 | AB3: 5.7000000000000002e-002 | AC3: 4.9800000000000004e-002 | AD3: 4.6600000000000003e-002 | AE3: 91.63 | AF3: 97.05 | AG3: 0.09 | AH3: AA | AI3: 5.33e-002 | AJ3: =H3+100*O3 -> 147.55000000000001 | AK3: 125.2 | AL3: 27 | AM3: 28.2 | AN3: 12 | AO3: -0.121 | AP3: 100 | AQ3: 维格转债!
A4: 59 | B4: 127018 | C4: 本钢转债! | D4: 761 | E4: 本钢板材 | F4: 钢铁 | G4: 炼钢 | H4: 90.97 | I4: 4.8999999999999998e-003 | J4: -5.8999999999999999e-003 | K4: 3.24 | L4: -6.0999999999999995e-003 | M4: 128.6 | N4: 5.03 | O4: 0.41200000000000003 | P4: 64.41 | Q4: 58天 | R4: 5.64年 | S4: 3.64年 | T4: 68 | U4: 48 | V4: 8.0000000000000002e-003 | W4: 0.54200000000000004 | X4: 0.34899999999999998 | Y4: 126 | Z4: 0.63 | AA4: 6.5299999999999997e-002 | AB4: 5.62e-002 | AC4: 4.2699999999999995e-002 | AD4: 3.9199999999999999e-002 | AE4: 88.5 | AF4: 98.25 | AG4: 0.17 | AH4: AAA | AI4: 5.04e-002 | AJ4: =H4+100*O4 -> 132.17000000000002 | AK4: 117.5 | AL4: 2 | AM4: 19.3 | AN4: 2 | AO4: -4.2000000000000003e-002 | AP4: 33 | AQ4: 本钢转债!
A5: 284 | B5: 128023 | C5: 亚太转债! | D5: 2284 | E5: 亚太股份 | F5: 汽车 | G5: 零部件制 | H5: 96.137 | I5: 1.6000000000000001e-003 | J5: -1.7000000000000001e-003 | K5: 5.51 | L5: -7.1999999999999998e-003 | M5: 112.3 | N5: 10.34 | O5: 0.80400000000000005 | P5: 53.29 | Q5: 转股中 | R5: 3年27天 | S5: 1年27天 | T5: 9.99 | U5: 7.9 | V5: 8.0000000000000002e-003 | W5: 0.24600000000000002 | X5: 0.13100000000000001 | Y5: 41 | Z5: 1.67 | AA5: 5.3099999999999994e-002 | AB5: 4.5199999999999997e-002 | AC5: 5.6100000000000004e-002 | AD5: 5.1299999999999998e-002 | AE5: 97.59 | AF5: 98.88 | AG5: 0.02 | AH5: AA | AI5: 4.3299999999999998e-002 | AJ5: =H5+100*O5 -> 176.53700000000001 | AK5: 139 | AL5: 179 | AM5: 40.1 | AN5: 110 | AO5: 4.2999999999999997e-002 | AP5: 63 | AQ5: 亚太转债!
A6: 206 | B6: 128063 | C6: 未来转债 | D6: 2631 | E6: 德尔未来 | F6: 其他 | G6: 家居用品 | H6: 107.4 | I6: -5.9999999999999995e-004 | J6: -1.6000000000000001e-003 | K6: 6.87 | L6: -7.1999999999999998e-003 | M6: 128.2 | N6: 8.61 | O6: 0.34600000000000003 | P6: 79.79 | Q6: 转股中 | R6: 4.40年 | S6: 3.40年 | T6: 6.3 | U6: 2.5 | V6: 4.0000000000000001e-003 | W6: 0.13699999999999998 | X6: 0.109 | Y6: 46 | Z6: 2.61 | AA6: 4.2300000000000004e-002 | AB6: 3.1200000000000002e-002 | AC6: 3.9000000000000003e-003 | AD6: -8.0000000000000004e-004 | AE6: 87.61 | AF6: 98.23 | AG6: 0.3 | AH6: AA- | AI6: 6.4299999999999996e-002 | AJ6: =H6+100*O6 -> 142. | AK6: 135 | AL6: 149 | AM6: 36.8 | AN6: 78 | AO6: -2.1000000000000001e-002 | AP6: 34 | AQ6: 未来转债
A7: 48 | B7: 127019 | C7: 国城转债! | D7: 688 | E7: 国城矿业 | F7: 有色金属 | G7: 锌铅镍锡 | H7: 91.668 | I7: 4.0000000000000002e-004 | J7: -8.9999999999999998e-004 | K7: 10.67 | L7: -6.5000000000000006e-003 | M7: 115.1 | N7: 21.07 | O7: 0.81000000000000005 | P7: 50.64 | Q7: 2月15天 | R7: 5.69年 | S7: 3.69年 | T7: 8.5 | U7: 9.7 | V7: 1.2e-002 | W7: 7.0000000000000007e-002 | X7: 3.5000000000000003e-002 | Y7: 121 | Z7: 5.49 | AA7: 4.1599999999999998e-002 | AB7: 3.6499999999999998e-002 | AC7: 3.2500000000000001e-002 | AD7: 3.0600000000000002e-002 | AE7: 87.44 | AF7: 89.83 | AG7: 0.07 | AH7: AA | AI7: 4.5400000000000003e-002 | AJ7: =H7+100*O7 -> 172.66800000000001 | AK7: 132.7 | AL7: 124 | AM7: 42.9 | AN7: 140 | AO7: -8.199999999999999e-002 | AP7: 24 | AQ7: 国城转债!
A8: 265 | B8: 128037 | C8: 岩土转债! | D8: 2542 | E8: 中化岩土 | F8: 建筑 | G8: 建筑工程 | H8: 98.47 | I8: 1.1999999999999999e-003 | J8: -1.1999999999999999e-003 | K8: 3.39 | L8: -5.8999999999999999e-003 | M8: 112.3 | N8: 7.99 | O8: 1.3200000000000001 | P8: 42.43 | Q8: 转股中 | R8: 3.35年 | S8: 1.35年 | T8: 5.99 | U8: 1 | V8: 2.e-003 | W8: 9.8000000000000004e-002 | X8: 4.2000000000000003e-002 | Y8: 61 | Z8: 1.51 | AA8: 4.0899999999999999e-002 | AB8: 3.3700000000000001e-002 | AC8: 2.8999999999999998e-002 | AD8: 2.53e-002 | AE8: 96.45 | AF8: 97.72 | AG8: 0 | AH8: AA | AI8: 4.3299999999999998e-002 | AJ8: =H8+100*O8 -> 230.47 | AK8: 154.5 | AL8: 262 | AM8: 56.8 | AN8: 233 | AO8: -1.8000000000000002e-002 | AP8: 47 | AQ8: 岩土转债!
A9: 90 | B9: 113573 | C9: 纵横转债! | D9: 603602 | E9: 纵横通信 | F9: 通信互联 | G9: 通信设备 | H9: 101.89 | I9: -2.0000000000000001e-004 | J9: 5.9999999999999995e-004 | K9: 12.1 | L9: 1.7000000000000001e-003 | M9: 124.7 | N9: 18.81 | O9: 0.58399999999999996 | P9: 64.33 | Q9: 转股中 | R9: 5.44年 | S9: 3.44年 | T9: 2.7 | U9: 19 | V9: 7.0000000000000007e-002 | W9: 0.109 | X9: 7.0000000000000007e-002 | Y9: 25 | Z9: 3.66 | AA9: 3.8699999999999998e-002 | AB9: 3.0699999999999998e-002 | AC9: 7.4000000000000003e-003 | AD9: 4.8999999999999998e-003 | AE9: 80.22 | AF9: 83.94 | AG9: 0.25 | AH9: A+ | AI9: 7.7399999999999997e-002 | AJ9: =H9+100*O9 -> 160.28999999999999 | AK9: 139.5 | AL9: 183 | AM9: 55.5 | AN9: 231 | AO9: -3.1e-002 | AP9: 16 | AQ9: 纵横转债!
A10: 296 | B10: 128015 | C10: 久其转债! | D10: 2279 | E10: 久其软件 | F10: 计算机及 | G10: 软件开发 | H10: 100.81 | I10: -1.e-004 | J10: 1.e-004 | K10: 5.4 | L10: -9.1999999999999998e-003 | M10: 110.8 | N10: 9.48 | O10: 0.77000000000000002 | P10: 56.96 | Q10: 转股中 | R10: 2.58年 | S10: 0.58年 | T10: 7.8 | U10: 3.8 | V10: 5.0000000000000001e-003 | W10: 0.20300000000000001 | X10: 0.11599999999999999 | Y10: 38 | Z10: 5.44 | AA10: 3.78e-002 | AB10: 2.9700000000000001e-002 | AC10: 9.7999999999999997e-003 | AD10: 5.6999999999999993e-003 | AE10: 96.22 | AF10: 92.24 | AG10: 0 | AH10: A+ | AI10: 7.4700000000000003e-002 | AJ10: =H10+100*O10 -> 177.81 | AK10: 144.7 | AL10: 228 | AM10: 48.4 | AN10: 185 | AO10: -7.8e-002 | AP10: 54 | AQ10: 久其转债!
A11: 137 | B11: 128093 | C11: 百川转债! | D11: 2455 | E11: 百川股份 | F11: 化工 | G11: 化工 | H11: 109.297 | I11: 8.9999999999999998e-004 | J11: -8.9999999999999998e-004 | K11: 5.17 | L11: 0. | M11: 130.3 | N11: 5.87 | O11: 0.24100000000000002 | P11: 88.07 | Q11: 转股中 | R11: 5年57天 | S11: 3年57天 | T11: 5.2 | U11: 1.1 | V11: 2.e-003 | W11: 0.19500000000000001 | X11: 0.17100000000000001 | Y11: 27 | Z11: 2.07 | AA11: 3.6000000000000004e-002 | AB11: 2.5899999999999999e-002 | AC11: -5.4000000000000003e-003 | AD11: -9.5999999999999992e-003 | AE11: 87.1 | AF11: 94.67 | AG11: 0.47 | AH11: AA- | AI11: 6.6400000000000001e-002 | AJ11: =H11+100*O11 -> 133.39699999999999 | AK11: 130.5 | AL11: 98 | AM11: 35.9 | AN11: 64 | AO11: 1.6e-002 | AP11: 45 | AQ11: 百川转债!
A12: 211 | B12: 113530 | C12: 大丰转债! | D12: 603081 | E12: 大丰实业 | F12: 建筑 | G12: 装饰工程 | H12: 104.66 | I12: -1.4000000000000002e-003 | J12: 7.000000000000001e-004 | K12: 11.47 | L12: -6.0999999999999995e-003 | M12: 121.6 | N12: 16.64 | O12: 0.51800000000000002 | P12: 68.93 | Q12: 转股中 | R12: 4.38年 | S12: 2.38年 | T12: 6.3 | U12: 1 | V12: 2.e-003 | W12: 0.13699999999999998 | X12: 9.4e-002 | Y12: 46 | Z12: 2.24 | AA12: 3.56e-002 | AB12: 2.6800000000000001e-002 | AC12: -4.3e-003 | AD12: -6.9999999999999993e-003 | AE12: 93.02 | AF12: 101.37 | AG12: 0.13 | AH12: AA | AI12: 4.3299999999999998e-002 | AJ12: =H12+100*O12 -> 156.46000000000001 | AK12: 140.4 | AL12: 195 | AM12: 39 | AN12: 104 | AO12: -1.3999999999999999e-002 | AP12: 34 | AQ12: 大丰转债!
A13: 256 | B13: 110045 | C13: 海澜转债! | D13: 600398 | E13: 海澜之家 | F13: 服装纺织 | G13: 服装行业 | H13: 98.02 | I13: -2.0000000000000001e-004 | J13: 4.0000000000000002e-004 | K13: 6.82 | L13: 4.4000000000000003e-003 | M13: 111.1 | N13: 11.75 | O13: 0.68900000000000006 | P13: 58.04 | Q13: 转股中 | R13: 3.68年 | S13: 1.68年 | T13: 29.5 | U13: 3.5 | V13: 1.e-003 | W13: 0.10000000000000001 | X13: 5.7999999999999996e-002 | Y13: 295 | Z13: 2.32 | AA13: 3.5099999999999999e-002 | AB13: 2.9300000000000003e-002 | AC13: 2.2000000000000002e-002 | AD13: 1.9799999999999998e-002 | AE13: 94.71 | AF13: 95.93 | AG13: 0.05 | AH13: AA+ | AI13: 4.1299999999999996e-002 | AJ13: =H13+100*O13 -> 166.92000000000002 | AK13: 138 | AL13: 171 | AM13: 42.1 | AN13: 134 | AO13: -3.9e-002 | AP13: 58 | AQ13: 海澜转债!
A14: 120 | B14: 113569 | C14: 科达转债! | D14: 603660 | E14: 苏州科达 | F14: 通信互联 | G14: 物联网 | H14: 102.1 | I14: -5.9999999999999995e-004 | J14: -4.0000000000000002e-004 | K14: 8.4 | L14: -7.0999999999999995e-003 | M14: 120.7 | N14: 14.84 | O14: 0.80400000000000005 | P14: 56.6 | Q14: 转股中 | R14: 5.33年 | S14: 3.33年 | T14: 5.16 | U14: 2.1 | V14: 4.0000000000000001e-003 | W14: 0.12300000000000001 | X14: 7.0000000000000007e-002 | Y14: 42 | Z14: 2.46 | AA14: 3.2599999999999997e-002 | AB14: 2.5600000000000001e-002 | AC14: 5.4000000000000003e-003 | AD14: 3.2000000000000002e-003 | AE14: 83.29 | AF14: 86.31 | AG14: 0.14 | AH14: AA- | AI14: 6.6400000000000001e-002 | AJ14: =H14+100*O14 -> 182.5 | AK14: 147.6 | AL14: 243 | AM14: 61.3 | AN14: 252 | AO14: -6.6000000000000003e-002 | AP14: 22 | AQ14: 科达转债!
A15: 23 | B15: 113600 | C15: 新星转债 | D15: 603978 | E15: 深圳新星 | F15: 有色金属 | G15: 有色行业 | H15: 105.55 | I15: -1.1999999999999999e-003 | J15: 6.0000000000000001e-003 | K15: 19.09 | L15: 1.11e-002 | M15: 126 | N15: 23.85 | O15: 0.31900000000000001 | P15: 80.04 | Q15: 3月14天 | R15: 5.76年 | S15: 3.76年 | T15: 5.95 | U15: 2.8 | V15: 5.0000000000000001e-003 | W15: 0.19500000000000001 | X15: 0.156 | Y15: 31 | Z15: 2 | AA15: 3.1800000000000002e-002 | AB15: 2.4e-002 | AC15: -4.0000000000000001e-003 | AD15: -5.8999999999999999e-003 | AE15: 80.91 | AF15: 87.59 | AG15: 0.43 | AH15: AA- | AI15: 6.6400000000000001e-002 | AJ15: =H15+100*O15 -> 137.44999999999999 | AK15: 131.1 | AL15: 109 | AM15: 43.5 | AN15: 146 | AO15: -3.7999999999999999e-002 | AP15: 10 | AQ15: 新星转债
A16: 41 | B16: 113595 | C16: 花王转债 | D16: 603007 | E16: 花王股份 | F16: 城市公用 | G16: 生态环境 | H16: 105.35 | I16: 0. | J16: 0. | K16: 6.38 | L16: 0. | M16: 125.3 | N16: 6.94 | O16: 0.14599999999999999 | P16: 91.93 | Q16: 2月21天 | R16: 5.70年 | S16: 3.70年 | T16: 3.3 | U16: 0 | V16: 0. | W16: 0.154 | X16: 0.14199999999999999 | Y16: 21 | Z16: 1.93 | AA16: 3.15e-002 | AB16: 2.3900000000000001e-002 | AC16: -2.8000000000000004e-003 | AD16: -4.8999999999999998e-003 | AE16: 81.51 | AF16: 87.53 | AG16: 0.57 | AH16: AA- | AI16: 6.6400000000000001e-002 | AJ16: =H16+100*O16 -> 119.94999999999999 | AK16: 118.8 | AL16: 6 | AM16: 31.2 | AN16: 28 | AO16: -0.106 | AP16: 27 | AQ16: 花王转债
A17: 10 | B17: 128132 | C17: 交建转债! | D17: 2941 | E17: 新疆交建 | F17: 建筑 | G17: 建筑工程 | H17: 98.448 | I17: -2.e-003 | J17: -1.6000000000000001e-003 | K17: 12.98 | L17: -1.44e-002 | M17: 117.3 | N17: 18.57 | O17: 0.40799999999999997 | P17: 69.9 | Q17: 4月15天 | R17: 5.85年 | S17: 3.85年 | T17: 8.5 | U17: 8.9 | V17: 1.1000000000000001e-002 | W17: 0.10199999999999999 | X17: 7.0999999999999994e-002 | Y17: 84 | Z17: 3.46 | AA17: 3.0899999999999997e-002 | AB17: 2.5499999999999998e-002 | AC17: 1.34e-002 | AD17: 1.15e-002 | AE17: 86.97 | AF17: 90.88 | AG17: 0.25 | AH17: AA | AI17: 4.5400000000000003e-002 | AJ17: =H17+100*O17 -> 139.24799999999999 | AK17: 127 | AL17: 57 | AM17: 36.1 | AN17: 68 | AO17: -6.4000000000000001e-002 | AP17: 7 | AQ17: 交建转债!
A18: 57 | B18: 113591 | C18: 胜达转债! | D18: 603687 | E18: 大胜达 | F18: 造纸包装 | G18: 包装用纸 | H18: 103.33 | I18: -1.2999999999999999e-003 | J18: -2.7000000000000001e-003 | K18: 10.64 | L18: -1.1200000000000002e-002 | M18: 122.2 | N18: 14.73 | O18: 0.42999999999999999 | P18: 72.23 | Q18: 2月2天 | R18: 5.65年 | S18: 3.65年 | T18: 5.5 | U18: 1 | V18: 2.e-003 | W18: 0.126 | X18: 9.0999999999999998e-002 | Y18: 44 | Z18: 2.81 | AA18: 3.0800000000000001e-002 | AB18: 2.3799999999999998e-002 | AC18: 2.e-003 | AD18: -1.e-004 | AE18: 81.71 | AF18: 85.66 | AG18: 0.36 | AH18: AA- | AI18: 6.6400000000000001e-002 | AJ18: =H18+100*O18 -> 146.32999999999998 | AK18: 134.4 | AL18: 143 | AM18: 48.8 | AN18: 188 | AO18: -7.4999999999999997e-002 | AP18: 19 | AQ18: 胜达转债!
A19: 292 | B19: 113016 | C19: XD小康转! | D19: 601127 | E19: 小康股份 | F19: 汽车 | G19: 零部件制 | H19: 99.99 | I19: 2.3999999999999998e-003 | J19: -1.7000000000000001e-003 | K19: 10.18 | L19: 1.09e-002 | M19: 110.3 | N19: 15.7 | O19: 0.54200000000000004 | P19: 64.84 | Q19: 转股中 | R19: 2.997年 | S19: 0.997年 | T19: 8.81 | U19: 28 | V19: 3.1e-002 | W19: 6.9000000000000006e-002 | X19: 4.4999999999999998e-002 | Y19: 128 | Z19: 2.22 | AA19: 3.0600000000000002e-002 | AB19: 2.46e-002 | AC19: 1.5600000000000001e-002 | AD19: 1.2500000000000001e-002 | AE19: 96.97 | AF19: 96.61 | AG19: 0.06 | AH19: AA | AI19: 4.2699999999999995e-002 | AJ19: =H19+100*O19 -> 154.19 | AK19: 135.1 | AL19: 150 | AM19: 38.2 | AN19: 94 | AO19: 0.105 | AP19: 45 | AQ19: XD小康转!
A20: 298 | B20: 128014 | C20: 永东转债! | D20: 2753 | E20: 永东股份 | F20: 化工 | G20: 化工 | H20: 103.611 | I20: -1.6000000000000001e-003 | J20: 1.6000000000000001e-003 | K20: 8.32 | L20: 1.1999999999999999e-003 | M20: 111.3 | N20: 12.6 | O20: 0.56899999999999995 | P20: 66.03 | Q20: 转股中 | R20: 2.44年 | S20: 0.44年 | T20: 3.37 | U20: 2.1 | V20: 6.0000000000000001e-003 | W20: 0.10800000000000001 | X20: 7.0999999999999994e-002 | Y20: 31 | Z20: 1.77 | AA20: 3.0299999999999997e-002 | AB20: 2.1499999999999998e-002 | AC20: -2.87e-002 | AD20: -3.4300000000000004e-002 | AE20: 98.06 | AF20: 95.99 | AG20: 0.02 | AH20: AA- | AI20: 6.3700000000000007e-002 | AJ20: =H20+100*O20 -> 160.511 | AK20: 141.2 | AL20: 202 | AM20: 43.1 | AN20: 144 | AO20: -9.0000000000000011e-003 | AP20: 39 | AQ20: 永东转债!
A21: 275 | B21: 113017 | C21: 吉视转债! | D21: 601929 | E21: 吉视传媒 | F21: 传媒娱乐 | G21: 影视娱乐 | H21: 100.17 | I21: 1.1000000000000001e-003 | J21: -1.7000000000000001e-003 | K21: 2.07 | L21: -4.7999999999999996e-003 | M21: 109.8 | N21: 2.95 | O21: 0.42799999999999999 | P21: 70.17 | Q21: 转股中 | R21: 3年50天 | S21: 1年50天 | T21: 15.6 | U21: 2.7 | V21: 2.e-003 | W21: 0.24199999999999999 | X21: 0.17000000000000001 | Y21: 64 | Z21: 0.97 | AA21: 3.0299999999999997e-002 | AB21: 2.4199999999999999e-002 | AC21: 1.84e-002 | AD21: 1.44e-002 | AE21: 97.33 | AF21: 96.97 | AG21: 0.12 | AH21: AA+ | AI21: 4.1299999999999996e-002 | AJ21: =H21+100*O21 -> 142.97 | AK21: 130.2 | AL21: 96 | AM21: 32.8 | AN21: 36 | AO21: -4.2000000000000003e-002 | AP21: 52 | AQ21: 吉视转债!
A22: 196 | B22: 113535 | C22: 大业转债! | D22: 603278 | E22: 大业股份 | F22: 汽车 | G22: 零部件制 | H22: 102.26 | I22: 1.6000000000000001e-003 | J22: -2.7000000000000001e-003 | K22: 8.16 | L22: -9.7000000000000003e-003 | M22: 113.1 | N22: 12.4 | O22: 0.55399999999999994 | P22: 65.81 | Q22: 转股中 | R22: 3.50年 | S22: 1.50年 | T22: 5 | U22: 1.8 | V22: 4.0000000000000001e-003 | W22: 0.21100000000000002 | X22: 0.13900000000000001 | Y22: 24 | Z22: 1.44 | AA22: 2.9600000000000001e-002 | AB22: 2.2599999999999999e-002 | AC22: -2.3999999999999998e-003 | AD22: -4.5999999999999999e-003 | AE22: 94.93 | AF22: 97.69 | AG22: 0.11 | AH22: AA | AI22: 4.3299999999999998e-002 | AJ22: =H22+100*O22 -> 157.66 | AK22: 138.7 | AL22: 176 | AM22: 41 | AN22: 120 | AO22: -2.7000000000000003e-002 | AP22: 48 | AQ22: 大业转债!
A23: 169 | B23: 110059 | C23: 浦发转债! | D23: 600000 | E23: 浦发银行 | F23: 金融 | G23: 银行行业 | H23: 102.28 | I23: -2.0000000000000001e-004 | J23: 7.000000000000001e-004 | K23: 9.39 | L23: 3.2000000000000002e-003 | M23: 117.6 | N23: 14.45 | O23: 0.57399999999999995 | P23: 64.98 | Q23: 转股中 | R23: 4.97年 | S23: 无权 | T23: 500 | U23: 101 | V23: 2.e-003 | W23: 0.18100000000000002 | X23: 0.11800000000000001 | Y23: 2756. | Z23: 0.54 | AA23: 2.92e-002 | AB23: 2.2700000000000001e-002 | AC23: 无权 | AD23: 无权 | AE23: 无权 | AF23: 98.04 | AG23: 0.15 | AH23: AAA | AI23: 3.8300000000000001e-002 | AJ23: =H23+100*O23 -> 159.68000000000001 | AK23: 139.6 | AL23: 186 | AM23: 41.5 | AN23: 126 | AO23: -1.2e-002 | AP23: 75 | AQ23: 浦发转债!
A24: 147 | B24: 110064 | C24: 建工转债! | D24: 600939 | E24: 重庆建工 | F24: 建筑 | G24: 建筑工程 | H24: 104.25 | I24: 8.0000000000000004e-004 | J24: -1.7000000000000001e-003 | K24: 3.8 | L24: -2.5999999999999999e-003 | M24: 120.2 | N24: 4.57 | O24: 0.254 | P24: 83.15 | Q24: 转股中 | R24: 5年43天 | S24: 3年43天 | T24: 16.6 | U24: 2.4 | V24: 1.e-003 | W24: 0.24100000000000002 | X24: 0.20000000000000001 | Y24: 69 | Z24: 1 | AA24: 2.8900000000000002e-002 | AB24: 2.18e-002 | AC24: 8.0000000000000004e-004 | AD24: -1.8e-003 | AE24: 91.07 | AF24: 97.23 | AG24: 0.36 | AH24: AA+ | AI24: 4.3400000000000001e-002 | AJ24: =H24+100*O24 -> 129.65000000000001 | AK24: 125.3 | AL24: 28 | AM24: 28.1 | AN24: 11 | AO24: -2.3e-002 | AP24: 47 | AQ24: 建工转债!
A25: 61 | B25: 113589 | C25: 天创转债! | D25: 603608 | E25: 天创时尚 | F25: 服装纺织 | G25: 鞋服行业 | H25: 98.59 | I25: -8.0000000000000004e-004 | J25: 4.0000000000000001e-003 | K25: 8.07 | L25: 1.5100000000000001e-002 | M25: 115.3 | N25: 12.44 | O25: 0.52000000000000002 | P25: 64.87 | Q25: 56天 | R25: 5.63年 | S25: 3.63年 | T25: 6 | U25: 1.9 | V25: 3.0000000000000001e-003 | W25: 0.17300000000000001 | X25: 0.11199999999999999 | Y25: 35 | Z25: 1.63 | AA25: 2.8799999999999999e-002 | AB25: 2.3700000000000002e-002 | AC25: 1.38e-002 | AD25: 1.18e-002 | AE25: 87.85 | AF25: 90.25 | AG25: 0.21 | AH25: AA | AI25: 4.5400000000000003e-002 | AJ25: =H25+100*O25 -> 150.59 | AK25: 132.3 | AL25: 119 | AM25: 42.1 | AN25: 133 | AO25: -1.9e-002 | AP25: 9 | AQ25: 天创转债!
A26: 254 | B26: 123011 | C26: 德尔转债! | D26: 300473 | E26: 德尔股份 | F26: 汽车 | G26: 零部件制 | H26: 105.001 | I26: 0. | J26: -6.5000000000000006e-003 | K26: 27.65 | L26: -1.9199999999999998e-002 | M26: 116.3 | N26: 34.54 | O26: 0.312 | P26: 80.05 | Q26: 转股中 | R26: 3.69年 | S26: 1.69年 | T26: 2.51 | U26: 27 | V26: 0.10099999999999999 | W26: 8.0000000000000002e-002 | X26: 6.4000000000000001e-002 | Y26: 31 | Z26: 1.41 | AA26: 2.86e-002 | AB26: 2.0499999999999997e-002 | AC26: -1.1399999999999999e-002 | AD26: -1.43e-002 | AE26: 91.63 | AF26: 92.79 | AG26: 0.34 | AH26: AA- | AI26: 6.4299999999999996e-002 | AJ26: =H26+100*O26 -> 136.20099999999999 | AK26: 129.9 | AL26: 89 | AM26: 37.2 | AN26: 82 | AO26: -3.4000000000000002e-002 | AP26: 37 | AQ26: 德尔转债!
A27: 94 | B27: 110070 | C27: 凌钢转债! | D27: 600231 | E27: 凌钢股份 | F27: 钢铁 | G27: 炼钢 | H27: 101.45 | I27: -1.e-004 | J27: -3.3e-003 | K27: 2.22 | L27: -8.8999999999999999e-003 | M27: 117.8 | N27: 2.75 | O27: 0.25700000000000001 | P27: 80.73 | Q27: 转股中 | R27: 5.43年 | S27: 3.43年 | T27: 4.4 | U27: 1.9 | V27: 4.0000000000000001e-003 | W27: 7.2000000000000008e-002 | X27: 5.7999999999999996e-002 | Y27: 62 | Z27: 0.76 | AA27: 2.8500000000000001e-002 | AB27: 2.2499999999999999e-002 | AC27: 7.4000000000000003e-003 | AD27: 5.1000000000000004e-003 | AE27: 88.92 | AF27: 93.05 | AG27: 0.38 | AH27: AA | AI27: 4.5400000000000003e-002 | AJ27: =H27+100*O27 -> 127.15000000000001 | AK27: 122.2 | AL27: 11 | AM27: 29.1 | AN27: 21 | AO27: 9.0000000000000011e-003 | AP27: 15 | AQ27: 凌钢转债!
A28: 289 | B28: 113502 | C28: 嘉澳转债! | D28: 603822 | E28: 嘉澳环保 | F28: 化工 | G28: 化工 | H28: 103.69 | I28: -2.0999999999999999e-003 | J28: 2.0999999999999999e-003 | K28: 23.54 | L28: -2.0400000000000001e-002 | M28: 112.3 | N28: 44.79 | O28: 0.97299999999999998 | P28: 52.56 | Q28: 转股中 | R28: 3年3.1天 | S28: 1年3.1天 | T28: 1.85 | U28: 13 | V28: 6.7000000000000004e-002 | W28: 0.107 | X28: 5.5999999999999994e-002 | Y28: 17 | Z28: 2.29 | AA28: 2.75e-002 | AB28: 1.9699999999999999e-002 | AC28: -7.4000000000000003e-003 | AD28: -1.2e-002 | AE28: 95.63 | AF28: 93.53 | AG28: 0 | AH28: AA- | AI28: 6.4299999999999996e-002 | AJ28: =H28+100*O28 -> 200.99000000000001 | AK28: 154.8 | AL28: 263 | AM28: 59.2 | AN28: 244 | AO28: -3.7999999999999999e-002 | AP28: 29 | AQ28: 嘉澳转债!
A29: 247 | B29: 128044 | C29: 岭南转债! | D29: 2717 | E29: 岭南股份 | F29: 城市公用 | G29: 生态环境 | H29: 100.701 | I29: -5.9999999999999995e-004 | J29: -1.e-004 | K29: 3.98 | L29: -5.0000000000000001e-003 | M29: 111.3 | N29: 5.91 | O29: 0.495 | P29: 67.34 | Q29: 转股中 | R29: 3.77年 | S29: 1.77年 | T29: 6.59 | U29: 1.7 | V29: 3.0000000000000001e-003 | W29: 0.10800000000000001 | X29: 7.2999999999999995e-002 | Y29: 61 | Z29: 1.24 | AA29: 2.7400000000000001e-002 | AB29: 2.1700000000000001e-002 | AC29: 1.0800000000000001e-002 | AD29: 7.9000000000000008e-003 | AE29: 94.77 | AF29: 95.16 | AG29: 0.14 | AH29: AA | AI29: 4.3299999999999998e-002 | AJ29: =H29+100*O29 -> 150.20099999999999 | AK29: 134.1 | AL29: 139 | AM29: 38.9 | AN29: 101 | AO29: -1.e-002 | AP29: 31 | AQ29: 岭南转债!
A30: 263 | B30: 113508 | C30: 新凤转债! | D30: 603225 | E30: 新凤鸣 | F30: 服装纺织 | G30: 纺织行业 | H30: 102.54 | I30: -2.2000000000000001e-003 | J30: 2.3e-003 | K30: 10.25 | L30: 1.e-003 | M30: 112.3 | N30: 15.78 | O30: 0.57899999999999996 | P30: 64.96 | Q30: 转股中 | R30: 3.47年 | S30: 1.47年 | T30: 21.5 | U30: 1.6 | V30: 1.e-003 | W30: 0.14999999999999999 | X30: 9.8000000000000004e-002 | Y30: 143 | Z30: 1.27 | AA30: 2.7099999999999999e-002 | AB30: 2.0400000000000001e-002 | AC30: 1.6000000000000001e-003 | AD30: -1.8e-003 | AE30: 95.98 | AF30: 97.24 | AG30: 0.09 | AH30: AA | AI30: 4.3299999999999998e-002 | AJ30: =H30+100*O30 -> 160.44 | AK30: 140.1 | AL30: 193 | AM30: 42.9 | AN30: 141 | AO30: -3.6000000000000004e-002 | AP30: 26 | AQ30: 新凤转债!
A31: 152 | B31: 128085 | C31: 鸿达转债 | D31: 2002 | E31: 鸿达兴业 | F31: 化工 | G31: 化工 | H31: 109.181 | I31: -8.0000000000000004e-004 | J31: -2.8999999999999998e-003 | K31: 3.7 | L31: -8.0000000000000002e-003 | M31: 124.8 | N31: 3.92 | O31: 0.157 | P31: 94.39 | Q31: 转股中 | R31: 5年39天 | S31: 3年39天 | T31: 24.3 | U31: 5.7 | V31: 2.e-003 | W31: 0.253 | X31: 0.23899999999999999 | Y31: 96 | Z31: 1.34 | AA31: 2.7099999999999999e-002 | AB31: 1.8799999999999997e-002 | AC31: -1.3999999999999999e-002 | AD31: -1.6500000000000001e-002 | AE31: 90.35 | AF31: 100 | AG31: 0.46 | AH31: AA | AI31: 4.5400000000000003e-002 | AJ31: =H31+100*O31 -> 124.881 | AK31: 124 | AL31: 20 | AM31: 24 | AN31: 6 | AO31: -2.5000000000000001e-002 | AP31: 85 | AQ31: 鸿达转债
A32: 223 | B32: 113021 | C32: 中信转债! | D32: 601998 | E32: 中信银行 | F32: 金融 | G32: 银行行业 | H32: 106.35 | I32: 2.9999999999999997e-004 | J32: -2.9999999999999997e-004 | K32: 5.11 | L32: 0. | M32: 118.8 | N32: 6.98 | O32: 0.45299999999999996 | P32: 73.21 | Q32: 转股中 | R32: 4.32年 | S32: 无权 | T32: 400 | U32: 8.4 | V32: 0. | W32: 0.16 | X32: 0.11699999999999999 | Y32: 2501. | Z32: 0.55 | AA32: 2.6800000000000001e-002 | AB32: 1.8799999999999997e-002 | AC32: 无权 | AD32: 无权 | AE32: 无权 | AF32: 101.5 | AG32: 0.2 | AH32: AAA | AI32: 3.8300000000000001e-002 | AJ32: =H32+100*O32 -> 151.64999999999998 | AK32: 139.5 | AL32: 185 | AM32: 38 | AN32: 92 | AO32: -1.e-002 | AP32: 53 | AQ32: 中信转债!
A33: 189 | B33: 128069 | C33: 华森转债! | D33: 2907 | E33: 华森制药 | F33: 医药 | G33: 化学制药 | H33: 106.785 | I33: -3.9000000000000003e-003 | J33: -1.6000000000000001e-003 | K33: 15.8 | L33: -1.1299999999999999e-002 | M33: 120 | N33: 18.04 | O33: 0.21899999999999997 | P33: 87.58 | Q33: 转股中 | R33: 4.63年 | S33: 2.63年 | T33: 3 | U33: 22 | V33: 6.9000000000000006e-002 | W33: 4.7e-002 | X33: 4.0999999999999995e-002 | Y33: 63 | Z33: 5.91 | AA33: 2.6000000000000002e-002 | AB33: 1.83e-002 | AC33: -1.1200000000000002e-002 | AD33: -1.3600000000000001e-002 | AE33: 87.12 | AF33: 90.46 | AG33: 0.49 | AH33: AA- | AI33: 6.4299999999999996e-002 | AJ33: =H33+100*O33 -> 128.685 | AK33: 126 | AL33: 43 | AM33: 35.5 | AN33: 60 | AO33: -4.0999999999999995e-002 | AP33: 41 | AQ33: 华森转债!
A34: 113 | B34: 128100 | C34: 搜特转债! | D34: 2503 | E34: 搜于特 | F34: 服装纺织 | G34: 服装行业 | H34: 103.091 | I34: 2.3999999999999998e-003 | J34: -5.4000000000000003e-003 | K34: 2.29 | L34: -8.6999999999999994e-003 | M34: 117.3 | N34: 2.9 | O34: 0.30599999999999999 | P34: 78.97 | Q34: 转股中 | R34: 5.34年 | S34: 3.34年 | T34: 8 | U34: 3.1 | V34: 4.0000000000000001e-003 | W34: 0.113 | X34: 8.900000000000001e-002 | Y34: 71 | Z34: 1.29 | AA34: 2.5000000000000001e-002 | AB34: 1.9e-002 | AC34: 2.e-003 | AD34: -1.e-004 | AE34: 88.97 | AF34: 92.97 | AG34: 0.35 | AH34: AA | AI34: 4.5400000000000003e-002 | AJ34: =H34+100*O34 -> 133.691 | AK34: 127.2 | AL34: 59 | AM34: 34.2 | AN34: 50 | AO34: -8.3000000000000004e-002 | AP34: 42 | AQ34: 搜特转债!
A35: 222 | B35: 110052 | C35: 贵广转债! | D35: 600996 | E35: 贵广网络 | F35: 传媒娱乐 | G35: 影视娱乐 | H35: 106.8 | I35: -1.1999999999999999e-003 | J35: -4.0000000000000002e-004 | K35: 6.28 | L35: -6.3e-003 | M35: 118.5 | N35: 7.94 | O35: 0.34999999999999998 | P35: 79.09 | Q35: 转股中 | R35: 4.32年 | S35: 2.32年 | T35: 15.3 | U35: 2.9 | V35: 2.e-003 | W35: 0.23100000000000001 | X35: 0.183 | Y35: 66 | Z35: 1.46 | AA35: 2.4900000000000002e-002 | AB35: 1.72e-002 | AC35: -1.1399999999999999e-002 | AD35: -1.43e-002 | AE35: 94 | AF35: 99.88 | AG35: 0.26 | AH35: AA+ | AI35: 4.1299999999999996e-002 | AJ35: =H35+100*O35 -> 141.80000000000001 | AK35: 134.5 | AL35: 145 | AM35: 34.6 | AN35: 51 | AO35: -9.5000000000000001e-002 | AP35: 19 | AQ35: 贵广转债!
A36: 30 | B36: 113597 | C36: 佳力转债! | D36: 603912 | E36: 佳力图 | F36: 机械装备 | G36: 专用设备 | H36: 108.7 | I36: -5.8999999999999999e-003 | J36: 1.5e-003 | K36: 18.64 | L36: -1.01e-002 | M36: 124.5 | N36: 23.4 | O36: 0.36499999999999999 | P36: 79.66 | Q36: 3月0天 | R36: 5.73年 | S36: 3.73年 | T36: 3 | U36: 1.5 | V36: 5.0000000000000001e-003 | W36: 7.400000000000001e-002 | X36: 5.9000000000000004e-002 | Y36: 40 | Z36: 4.66 | AA36: 2.4500000000000001e-002 | AB36: 1.7100000000000001e-002 | AC36: -1.04e-002 | AD36: -1.2500000000000001e-002 | AE36: 81.53 | AF36: 86.85 | AG36: 0.43 | AH36: AA- | AI36: 6.6400000000000001e-002 | AJ36: =H36+100*O36 -> 145.19999999999999 | AK36: 137.7 | AL36: 167 | AM36: 50.9 | AN36: 211 | AO36: 4.0999999999999995e-002 | AP36: 7 | AQ36: 佳力转债!
A37: 274 | B37: 128033 | C37: 迪龙转债! | D37: 2658 | E37: 雪迪龙 | F37: 城市公用 | G37: 三废处理 | H37: 102.015 | I37: 2.5999999999999999e-003 | J37: -3.4999999999999996e-003 | K37: 6.02 | L37: -8.199999999999999e-003 | M37: 109.8 | N37: 8.83 | O37: 0.496 | P37: 68.18 | Q37: 转股中 | R37: 3年50天 | S37: 1年50天 | T37: 5.2 | U37: 0.9 | V37: 2.e-003 | W37: 0.14300000000000002 | X37: 9.6999999999999989e-002 | Y37: 36 | Z37: 1.8 | AA37: 2.4199999999999999e-002 | AB37: 1.8200000000000001e-002 | AC37: 4.0999999999999995e-003 | AD37: 2.0000000000000001e-004 | AE37: 97.09 | AF37: 96.4 | AG37: 0.11 | AH37: AA | AI37: 4.3299999999999998e-002 | AJ37: =H37+100*O37 -> 151.61500000000001 | AK37: 135.9 | AL37: 155 | AM37: 38.8 | AN37: 99 | AO37: -2.7999999999999997e-002 | AP37: 37 | AQ37: 迪龙转债!
A38: 55 | B38: 128117 | C38: 道恩转债 | D38: 2838 | E38: 道恩股份 | F38: 化工 | G38: 橡胶塑料 | H38: 108.4 | I38: -1.01e-002 | J38: -4.3e-003 | K38: 27.13 | L38: -2.41e-002 | M38: 123.5 | N38: 29.07 | O38: 0.16200000000000001 | P38: 93.33 | Q38: 2月2天 | R38: 5.65年 | S38: 3.65年 | T38: 3.6 | U38: 30 | V38: 7.5999999999999998e-002 | W38: 3.3000000000000002e-002 | X38: 2.9999999999999999e-002 | Y38: 110 | Z38: 6.42 | AA38: 2.3799999999999998e-002 | AB38: 1.66e-002 | AC38: -1.1299999999999999e-002 | AD38: -1.32e-002 | AE38: 81.44 | AF38: 86.48 | AG38: 0.6 | AH38: AA- | AI38: 6.6400000000000001e-002 | AJ38: =H38+100*O38 -> 124.60000000000001 | AK38: 123.5 | AL38: 17 | AM38: 37 | AN38: 80 | AO38: -5.9999999999999998e-002 | AP38: 13 | AQ38: 道恩转债
A39: 182 | B39: 128072 | C39: 翔鹭转债! | D39: 2842 | E39: 翔鹭钨业 | F39: 有色金属 | G39: 小金属 | H39: 103.16 | I39: 3.4999999999999996e-003 | J39: -4.6999999999999993e-003 | K39: 9.97 | L39: -5.0000000000000001e-003 | M39: 115.1 | N39: 15.34 | O39: 0.58700000000000008 | P39: 64.99 | Q39: 转股中 | R39: 4.78年 | S39: 2.78年 | T39: 3.02 | U39: 4.5 | V39: 1.3999999999999999e-002 | W39: 0.111 | X39: 7.2000000000000008e-002 | Y39: 27 | Z39: 3 | AA39: 2.3599999999999999e-002 | AB39: 1.78e-002 | AC39: 8.9999999999999998e-004 | AD39: -1.4000000000000002e-003 | AE39: 86.21 | AF39: 85.94 | AG39: 0.24 | AH39: AA- | AI39: 6.4299999999999996e-002 | AJ39: =H39+100*O39 -> 161.86000000000001 | AK39: 141.3 | AL39: 204 | AM39: 55.1 | AN39: 229 | AO39: 1.e-002 | AP39: 27 | AQ39: 翔鹭转债!
A40: 171 | B40: 113546 | C40: 迪贝转债! | D40: 603320 | E40: 迪贝电气 | F40: 家电 | G40: 零部件制 | H40: 107.8 | I40: -4.0000000000000002e-004 | J40: -5.5000000000000005e-003 | K40: 12.64 | L40: -1.0200000000000001e-002 | M40: 120.6 | N40: 14.1 | O40: 0.20300000000000001 | P40: 89.65 | Q40: 转股中 | R40: 4.96年 | S40: 2.96年 | T40: 2.3 | U40: 3.8 | V40: 1.4999999999999999e-002 | W40: 0.14000000000000001 | X40: 0.125 | Y40: 16 | Z40: 2.47 | AA40: 2.3399999999999997e-002 | AB40: 1.6e-002 | AC40: -1.1699999999999999e-002 | AD40: -1.41e-002 | AE40: 83.04 | AF40: 84.79 | AG40: 0.58 | AH40: A+ | AI40: 7.5300000000000006e-002 | AJ40: =H40+100*O40 -> 128.09999999999999 | AK40: 126 | AL40: 41 | AM40: 41.2 | AN40: 122 | AO40: -1.6e-002 | AP40: 43 | AQ40: 迪贝转债!
A41: 277 | B41: 128032 | C41: 双环转债! | D41: 2472 | E41: 双环传动 | F41: 机械装备 | G41: 通用设备 | H41: 102.9 | I41: -1.1000000000000001e-003 | J41: 1.1999999999999999e-003 | K41: 6.38 | L41: 1.6000000000000001e-003 | M41: 110.3 | N41: 9.89 | O41: 0.59499999999999997 | P41: 64.51 | Q41: 转股中 | R41: 3年48天 | S41: 1年48天 | T41: 10 | U41: 1.5 | V41: 2.e-003 | W41: 0.22800000000000001 | X41: 0.14699999999999999 | Y41: 44 | Z41: 1.31 | AA41: 2.3e-002 | AB41: 1.66e-002 | AC41: -8.0000000000000004e-004 | AD41: -5.0000000000000001e-003 | AE41: 97.35 | AF41: 96.89 | AG41: 0.07 | AH41: AA | AI41: 4.3299999999999998e-002 | AJ41: =H41+100*O41 -> 162.40000000000001 | AK41: 141.3 | AL41: 203 | AM41: 43.9 | AN41: 150 | AO41: -1.2e-002 | AP41: 45 | AQ41: 双环转债!
A42: 233 | B42: 113524 | C42: 奇精转债! | D42: 603677 | E42: 奇精机械 | F42: 家电 | G42: 零部件制 | H42: 107.85 | I42: -8.8000000000000005e-003 | J42: -4.5999999999999999e-003 | K42: 12.29 | L42: -3.61e-002 | M42: 117.9 | N42: 14.08 | O42: 0.23600000000000002 | P42: 87.29 | Q42: 转股中 | R42: 4年37天 | S42: 2年37天 | T42: 3.3 | U42: 5 | V42: 1.3999999999999999e-002 | W42: 0.14000000000000001 | X42: 0.122 | Y42: 24 | Z42: 2.47 | AA42: 2.2400000000000003e-002 | AB42: 1.46e-002 | AC42: -1.8600000000000002e-002 | AD42: -2.1499999999999998e-002 | AE42: 94.03 | AF42: 99.46 | AG42: 0.37 | AH42: AA | AI42: 4.3299999999999998e-002 | AJ42: =H42+100*O42 -> 131.44999999999999 | AK42: 128.4 | AL42: 75 | AM42: 29 | AN42: 20 | AO42: -5.2000000000000005e-002 | AP42: 44 | AQ42: 奇精转债!
A43: 200 | B43: 127013 | C43: 创维转债! | D43: 810 | E43: 创维数字 | F43: 电子 | G43: 电子产品 | H43: 107.1 | I43: -2.8000000000000004e-003 | J43: 1.e-003 | K43: 9.02 | L43: -6.6e-003 | M43: 117.9 | N43: 11.39 | O43: 0.35200000000000004 | P43: 79.19 | Q43: 转股中 | R43: 4.44年 | S43: 2.44年 | T43: 9.78 | U43: 4.9 | V43: 5.0000000000000001e-003 | W43: 0.10199999999999999 | X43: 8.1000000000000003e-002 | Y43: 96 | Z43: 2.47 | AA43: 2.23e-002 | AB43: 1.5100000000000001e-002 | AC43: -1.3600000000000001e-002 | AD43: -1.6e-002 | AE43: 92.71 | AF43: 98.06 | AG43: 0.27 | AH43: AA | AI43: 4.3299999999999998e-002 | AJ43: =H43+100*O43 -> 142.30000000000001 | AK43: 135 | AL43: 148 | AM43: 36.9 | AN43: 79 | AO43: -6.5000000000000002e-002 | AP43: 23 | AQ43: 创维转债!
A44: 151 | B44: 128087 | C44: 孚日转债! | D44: 2083 | E44: 孚日股份 | F44: 服装纺织 | G44: 家纺 | H44: 101.449 | I44: 2.3e-003 | J44: -5.7999999999999996e-003 | K44: 4.86 | L44: -1.0200000000000001e-002 | M44: 113.3 | N44: 6.3 | O44: 0.315 | P44: 77.14 | Q44: 转股中 | R44: 5年40天 | S44: 3年40天 | T44: 6.5 | U44: 2.3 | V44: 4.0000000000000001e-003 | W44: 0.14699999999999999 | X44: 0.114 | Y44: 44 | Z44: 1.17 | AA44: 2.23e-002 | AB44: 1.7399999999999999e-002 | AC44: 7.0999999999999995e-003 | AD44: 4.7999999999999996e-003 | AE44: 89.91 | AF44: 90.75 | AG44: 0.34 | AH44: AA | AI44: 4.5400000000000003e-002 | AJ44: =H44+100*O44 -> 132.94900000000001 | AK44: 125.8 | AL44: 39 | AM44: 35 | AN44: 56 | AO44: -4.0000000000000001e-002 | AP44: 51 | AQ44: 孚日转债!
A45: 121 | B45: 113568 | C45: 新春转债 | D45: 603667 | E45: 五洲新春 | F45: 机械装备 | G45: 通用设备 | H45: 111.31 | I45: -5.7999999999999996e-003 | J45: -5.4000000000000003e-003 | K45: 8.66 | L45: -1.8100000000000002e-002 | M45: 124.8 | N45: 8.91 | O45: 0.14499999999999999 | P45: 97.19 | Q45: 转股中 | R45: 5.33年 | S45: 3.33年 | T45: 3.3 | U45: 6.9 | V45: 1.9e-002 | W45: 0.13 | X45: 0.127 | Y45: 25 | Z45: 1.46 | AA45: 2.2200000000000001e-002 | AB45: 1.4199999999999999e-002 | AC45: -1.7600000000000001e-002 | AD45: -2.0099999999999996e-002 | AE45: 83.92 | AF45: 89.37 | AG45: 0.62 | AH45: AA- | AI45: 6.6400000000000001e-002 | AJ45: =H45+100*O45 -> 125.81 | AK45: 125.4 | AL45: 29 | AM45: 36.1 | AN45: 65 | AO45: -3.3000000000000002e-002 | AP45: 45 | AQ45: 新春转债
A46: 127 | B46: 113566 | C46: 翔港转债 | D46: 603499 | E46: 翔港科技 | F46: 造纸包装 | G46: 包装材料 | H46: 111.35 | I46: 6.8000000000000005e-003 | J46: -8.0000000000000002e-003 | K46: 9.76 | L46: -2.e-003 | M46: 124.5 | N46: 10.77 | O46: 0.22899999999999998 | P46: 90.62 | Q46: 转股中 | R46: 5.31年 | S46: 3.31年 | T46: 1.61 | U46: 14 | V46: 7.9000000000000001e-002 | W46: 8.199999999999999e-002 | X46: 7.400000000000001e-002 | Y46: 20 | Z46: 3.44 | AA46: 2.18e-002 | AB46: 1.38e-002 | AC46: -1.7899999999999999e-002 | AD46: -2.0400000000000001e-002 | AE46: 81.08 | AF46: 84.64 | AG46: 0.59 | AH46: A+ | AI46: 7.7399999999999997e-002 | AJ46: =H46+100*O46 -> 134.25 | AK46: 132.1 | AL46: 116 | AM46: 47.4 | AN46: 178 | AO46: -3.3000000000000002e-002 | AP46: 27 | AQ46: 翔港转债
A47: 18 | B47: 113601 | C47: 塞力转债 | D47: 603716 | E47: 塞力斯 | F47: 医药 | G47: 医药商业 | H47: 107.36 | I47: 1.6000000000000001e-003 | J47: -8.0000000000000004e-004 | K47: 15.7 | L47: 1.2999999999999999e-003 | M47: 121.3 | N47: 16.98 | O47: 0.161 | P47: 92.46 | Q47: 3月22天 | R47: 5.79年 | S47: 3.79年 | T47: 5.43 | U47: 9.8 | V47: 1.7000000000000001e-002 | W47: 0.16899999999999998 | X47: 0.156 | Y47: 32 | Z47: 2.12 | AA47: 2.18e-002 | AB47: 1.5300000000000001e-002 | AC47: -7.6e-003 | AD47: -9.5999999999999992e-003 | AE47: 81.07 | AF47: 84.3 | AG47: 0.62 | AH47: AA- | AI47: 6.6400000000000001e-002 | AJ47: =H47+100*O47 -> 123.46000000000001 | AK47: 122.3 | AL47: 12 | AM47: 38 | AN47: 91 | AO47: 9.0000000000000011e-003 | AP47: 16 | AQ47: 塞力转债
A48: 268 | B48: 113505 | C48: 杭电转债! | D48: 603618 | E48: 杭电股份 | F48: 能源电力 | G48: 电力设备 | H48: 104.75 | I48: 2.5999999999999999e-003 | J48: -8.0000000000000004e-004 | K48: 5.7 | L48: 7.0999999999999995e-003 | M48: 112.3 | N48: 7.14 | O48: 0.312 | P48: 79.83 | Q48: 转股中 | R48: 3.33年 | S48: 1.33年 | T48: 7.5 | U48: 2.3 | V48: 3.0000000000000001e-003 | W48: 0.19 | X48: 0.152 | Y48: 39 | Z48: 1.55 | AA48: 2.1600000000000001e-002 | AB48: 1.46e-002 | AC48: -1.26e-002 | AD48: -1.6200000000000003e-002 | AE48: 96.55 | AF48: 97.82 | AG48: 0.25 | AH48: AA | AI48: 4.3299999999999998e-002 | AJ48: =H48+100*O48 -> 135.94999999999999 | AK48: 129.7 | AL48: 88 | AM48: 31.8 | AN48: 30 | AO48: 1.3000000000000001e-002 | AP48: 39 | AQ48: 杭电转债!
A49: 105 | B49: 113574 | C49: 华体转债! | D49: 603679 | E49: 华体科技 | F49: 城市公用 | G49: 城市公用 | H49: 104.25 | I49: 2.2000000000000001e-003 | J49: 1.1999999999999999e-003 | K49: 22.3 | L49: 1.1299999999999999e-002 | M49: 116.4 | N49: 33.99 | O49: 0.58899999999999997 | P49: 65.61 | Q49: 转股中 | R49: 5.39年 | S49: 3.39年 | T49: 2.09 | U49: 13 | V49: 5.7999999999999996e-002 | W49: 6.6000000000000003e-002 | X49: 4.2999999999999997e-002 | Y49: 32 | Z49: 4.35 | AA49: 2.1099999999999997e-002 | AB49: 1.5600000000000001e-002 | AC49: 8.9999999999999998e-004 | AD49: -1.6000000000000001e-003 | AE49: 80.46 | AF49: 78.66 | AG49: 0.3 | AH49: A+ | AI49: 7.7399999999999997e-002 | AJ49: =H49+100*O49 -> 163.15000000000001 | AK49: 142.9 | AL49: 213 | AM49: 62.4 | AN49: 256 | AO49: -2.8999999999999998e-002 | AP49: 13 | AQ49: 华体转债!
A50: 54 | B50: 128118 | C50: 瀛通转债 | D50: 2861 | E50: 瀛通通讯 | F50: 电子 | G50: 电子产品 | H50: 108.91 | I50: -4.4000000000000003e-003 | J50: 2.8000000000000004e-003 | K50: 23.67 | L50: -2.8999999999999998e-003 | M50: 122.1 | N50: 27.53 | O50: 0.26700000000000002 | P50: 85.98 | Q50: 2月2天 | R50: 5.65年 | S50: 3.65年 | T50: 3 | U50: 3.6 | V50: 1.1000000000000001e-002 | W50: 0.10400000000000001 | X50: 8.900000000000001e-002 | Y50: 29 | Z50: 2.71 | AA50: 2.0899999999999998e-002 | AB50: 1.41e-002 | AC50: -1.06e-002 | AD50: -1.29e-002 | AE50: 82.07 | AF50: 85.63 | AG50: 0.54 | AH50: AA- | AI50: 6.6400000000000001e-002 | AJ50: =H50+100*O50 -> 135.61000000000001 | AK50: 131.8 | AL50: 115 | AM50: 46.2 | AN50: 168 | AO50: -2.1000000000000001e-002 | AP50: 6 | AQ50: 瀛通转债
A51: 150 | B51: 113557 | C51: 森特转债 | D51: 603098 | E51: 森特股份 | F51: 建筑 | G51: 建筑工程 | H51: 109.3 | I51: 1.6000000000000001e-003 | J51: -4.6999999999999993e-003 | K51: 9.31 | L51: -5.3e-003 | M51: 120.7 | N51: 10.11 | O51: 0.187 | P51: 92.09 | Q51: 转股中 | R51: 5年42天 | S51: 3年42天 | T51: 6 | U51: 1.1 | V51: 2.e-003 | W51: 0.13400000000000001 | X51: 0.124 | Y51: 45 | Z51: 2.16 | AA51: 2.e-002 | AB51: 1.29e-002 | AC51: -1.5100000000000001e-002 | AD51: -1.7399999999999999e-002 | AE51: 84.49 | AF51: 87.53 | AG51: 0.58 | AH51: AA- | AI51: 6.6400000000000001e-002 | AJ51: =H51+100*O51 -> 128. | AK51: 126.5 | AL51: 52 | AM51: 39 | AN51: 102 | AO51: -2.3e-002 | AP51: 35 | AQ51: 森特转债
A52: 224 | B52: 113528 | C52: 长城转债! | D52: 603897 | E52: 长城科技 | F52: 机械装备 | G52: 专用设备 | H52: 108.46 | I52: 5.5000000000000005e-003 | J52: -1.e-002 | K52: 20.8 | L52: -9.1000000000000004e-003 | M52: 117.6 | N52: 23.45 | O52: 0.223 | P52: 88.7 | Q52: 转股中 | R52: 4.31年 | S52: 2.31年 | T52: 6.34 | U52: 6.9 | V52: 1.e-002 | W52: 0.17100000000000001 | X52: 0.152 | Y52: 37 | Z52: 2.03 | AA52: 1.9400000000000001e-002 | AB52: 1.2e-002 | AC52: -1.7299999999999999e-002 | AD52: -2.0299999999999999e-002 | AE52: 89.25 | AF52: 90.49 | AG52: 0.51 | AH52: AA- | AI52: 6.4299999999999996e-002 | AJ52: =H52+100*O52 -> 130.75999999999999 | AK52: 128.2 | AL52: 72 | AM52: 37.7 | AN52: 89 | AO52: 4.5999999999999999e-002 | AP52: 44 | AQ52: 长城转债!
A53: 101 | B53: 127016 | C53: 鲁泰转债 | D53: 726 | E53: 鲁 泰Ａ | F53: 服装纺织 | G53: 纺织行业 | H53: 105.5 | I53: 2.9999999999999997e-004 | J53: -1.6000000000000001e-003 | K53: 6.74 | L53: -4.4000000000000003e-003 | M53: 116.2 | N53: 8.91 | O53: 0.39500000000000002 | P53: 75.65 | Q53: 转股中 | R53: 5.42年 | S53: 3.42年 | T53: 14 | U53: 1.6 | V53: 1.e-003 | W53: 0.24199999999999999 | X53: 0.183 | Y53: 58 | Z53: 0.75 | AA53: 1.83e-002 | AB53: 1.29e-002 | AC53: -4.7999999999999996e-003 | AD53: -6.8000000000000005e-003 | AE53: 89.17 | AF53: 92.71 | AG53: 0.3 | AH53: AA+ | AI53: 4.3400000000000001e-002 | AJ53: =H53+100*O53 -> 145. | AK53: 135.4 | AL53: 152 | AM53: 42.6 | AN53: 139 | AO53: -8.4000000000000005e-002 | AP53: 22 | AQ53: 鲁泰转债
A54: 282 | B54: 128026 | C54: 众兴转债! | D54: 2772 | E54: 众兴菌业 | F54: 农业 | G54: 种植业 | H54: 104.483 | I54: -3.3e-003 | J54: 2.e-003 | K54: 9.12 | L54: -5.5000000000000005e-003 | M54: 110.3 | N54: 11.45 | O54: 0.312 | P54: 79.65 | Q54: 转股中 | R54: 3年36天 | S54: 1年36天 | T54: 9.19 | U54: 3.7 | V54: 4.0000000000000001e-003 | W54: 0.27399999999999997 | X54: 0.218 | Y54: 34 | Z54: 1.37 | AA54: 1.8100000000000002e-002 | AB54: 1.1699999999999999e-002 | AC54: -1.29e-002 | AD54: -1.7100000000000001e-002 | AE54: 95.09 | AF54: 91.36 | AG54: 0.25 | AH54: AA- | AI54: 6.4299999999999996e-002 | AJ54: =H54+100*O54 -> 135.68299999999999 | AK54: 129.3 | AL54: 84 | AM54: 34.2 | AN54: 49 | AO54: -2.6000000000000002e-002 | AP54: 57 | AQ54: 众兴转债!
A55: 20 | B55: 128127 | C55: 文科转债 | D55: 2775 | E55: 文科园林 | F55: 城市公用 | G55: 生态环境 | H55: 109.681 | I55: 1.7000000000000001e-003 | J55: 8.9999999999999998e-004 | K55: 5.5 | L55: 3.5999999999999999e-003 | M55: 121.3 | N55: 5.37 | O55: 7.0999999999999994e-002 | P55: 102.42 | Q55: 3月24天 | R55: 5.78年 | S55: 3.78年 | T55: 9.5 | U55: 7.1 | V55: 6.9999999999999993e-003 | W55: 0.33700000000000002 | X55: 0.34499999999999997 | Y55: 28 | Z55: 1.06 | AA55: 1.7899999999999999e-002 | AB55: 1.15e-002 | AC55: -1.3000000000000001e-002 | AD55: -1.4999999999999999e-002 | AE55: 81.08 | AF55: 84.31 | AG55: 0.7 | AH55: AA- | AI55: 6.6400000000000001e-002 | AJ55: =H55+100*O55 -> 116.78099999999999 | AK55: 116.9 | AL55: 1 | AM55: 32.6 | AN55: 34 | AO55: -6.9999999999999993e-003 | AP55: 19 | AQ55: 文科转债
A56: 174 | B56: 128076 | C56: 金轮转债! | D56: 2722 | E56: 金轮股份 | F56: 机械装备 | G56: 专用设备 | H56: 105.59 | I56: -3.9000000000000003e-003 | J56: 4.6999999999999993e-003 | K56: 12.5 | L56: 1.6000000000000001e-003 | M56: 114.9 | N56: 14.76 | O56: 0.247 | P56: 84.69 | Q56: 转股中 | R56: 4.93年 | S56: 2.93年 | T56: 2.14 | U56: 27 | V56: 0.12 | W56: 9.8000000000000004e-002 | X56: 8.3000000000000004e-002 | Y56: 22 | Z56: 1.19 | AA56: 1.7600000000000001e-002 | AB56: 1.2e-002 | AC56: -6.8000000000000005e-003 | AD56: -8.8999999999999999e-003 | AE56: 85.38 | AF56: 84.98 | AG56: 0.51 | AH56: AA- | AI56: 6.4299999999999996e-002 | AJ56: =H56+100*O56 -> 130.28999999999999 | AK56: 126.5 | AL56: 51 | AM56: 41.1 | AN56: 121 | AO56: -2.1000000000000001e-002 | AP56: 41 | AQ56: 金轮转债!
A57: 245 | B57: 113519 | C57: 长久转债! | D57: 603569 | E57: 长久物流 | F57: 交通运输 | G57: 物流业 | H57: 112.44 | I57: -4.0000000000000002e-004 | J57: -4.1999999999999997e-003 | K57: 8.71 | L57: -2.0199999999999999e-002 | M57: 120.1 | N57: 11.15 | O57: 0.439 | P57: 78.12 | Q57: 转股中 | R57: 4年0.1天 | S57: 2年0.1天 | T57: 6.97 | U57: 0.5 | V57: 1.e-003 | W57: 0.14300000000000002 | X57: 0.11199999999999999 | Y57: 49 | Z57: 2.29 | AA57: 1.7000000000000001e-002 | AB57: 8.1000000000000013e-003 | AC57: -3.7599999999999995e-002 | AD57: -4.0599999999999997e-002 | AE57: 94.63 | AF57: 101.77 | AG57: 0.23 | AH57: AA | AI57: 4.3299999999999998e-002 | AJ57: =H57+100*O57 -> 156.34 | AK57: 146.8 | AL57: 238 | AM57: 45 | AN57: 161 | AO57: -0.14800000000000002 | AP57: 16 | AQ57: 长久转债!
A58: 160 | B58: 128081 | C58: 海亮转债! | D58: 2203 | E58: 海亮股份 | F58: 有色金属 | G58: 铜金属 | H58: 106 | I58: 1.9e-003 | J58: -5.3e-003 | K58: 7.99 | L58: -8.6999999999999994e-003 | M58: 115.2 | N58: 9.76 | O58: 0.29499999999999998 | P58: 81.86 | Q58: 转股中 | R58: 5年14天 | S58: 3年14天 | T58: 31.5 | U58: 8.5 | V58: 3.0000000000000001e-003 | W58: 0.20199999999999999 | X58: 0.16500000000000001 | Y58: 156 | Z58: 1.73 | AA58: 1.7000000000000001e-002 | AB58: 1.15e-002 | AC58: -6.8999999999999999e-003 | AD58: -9.1000000000000004e-003 | AE58: 90.09 | AF58: 92.54 | AG58: 0.39 | AH58: AA | AI58: 4.5400000000000003e-002 | AJ58: =H58+100*O58 -> 135.5 | AK58: 130.1 | AL58: 95 | AM58: 37.6 | AN58: 86 | AO58: -3.0000000000000001e-003 | AP58: 51 | AQ58: 海亮转债!
A59: 2 | B59: 123069 | C59: 金诺转债 | D59: 300505 | E59: 川金诺 | F59: 化工 | G59: 农化 | H59: 114.201 | I59: -1.0500000000000001e-002 | J59: -2.7999999999999997e-002 | K59: 20 | L59: -5.5300000000000002e-002 | M59: 126 | N59: 19.15 | O59: 9.3000000000000013e-002 | P59: 104.44 | Q59: 5月16天 | R59: 5.94年 | S59: 3.94年 | T59: 3.68 | U59: 185 | V59: 0.43799999999999994 | W59: 0.14099999999999999 | X59: 0.14699999999999999 | Y59: 26 | Z59: 2.72 | AA59: 1.7000000000000001e-002 | AB59: 9.5999999999999992e-003 | AC59: -2.29e-002 | AD59: -2.4700000000000003e-002 | AE59: 80 | AF59: 86.61 | AG59: 0.7 | AH59: AA- | AI59: 6.6400000000000001e-002 | AJ59: =H59+100*O59 -> 123.50099999999999 | AK59: 124 | AL59: 19 | AM59: 37.4 | AN59: 83 | AO59: 1.e-003 | AP59: 2 | AQ59: 金诺转债
A60: 134 | B60: 128094 | C60: 星帅转债 | D60: 2860 | E60: 星帅尔 | F60: 家电 | G60: 零部件制 | H60: 111.59 | I60: -1.3500000000000002e-002 | J60: 2.0999999999999999e-003 | K60: 13.33 | L60: -1.7000000000000001e-002 | M60: 121.5 | N60: 13.95 | O60: 0.16800000000000001 | P60: 95.56 | Q60: 转股中 | R60: 5.19年 | S60: 3.19年 | T60: 2.8 | U60: 72 | V60: 0.22899999999999998 | W60: 0.105 | X60: 0.10099999999999999 | Y60: 27 | Z60: 2.85 | AA60: 1.6899999999999998e-002 | AB60: 9.7000000000000003e-003 | AC60: -1.9400000000000001e-002 | AD60: -2.1899999999999999e-002 | AE60: 81.72 | AF60: 83.33 | AG60: 0.67 | AH60: A+ | AI60: 7.7399999999999997e-002 | AJ60: =H60+100*O60 -> 128.39000000000001 | AK60: 127.6 | AL60: 64 | AM60: 44.3 | AN60: 155 | AO60: -4.0999999999999995e-002 | AP60: 30 | AQ60: 星帅转债
A61: 53 | B61: 113036 | C61: 宁建转债! | D61: 601789 | E61: 宁波建工 | F61: 建筑 | G61: 建筑工程 | H61: 106.91 | I61: -7.3000000000000001e-003 | J61: 1.6399999999999998e-002 | K61: 4.29 | L61: 1.9e-002 | M61: 117.3 | N61: 4.86 | O61: 0.21100000000000002 | P61: 88.27 | Q61: 2月5天 | R61: 5.66年 | S61: 3.66年 | T61: 5.4 | U61: 7.6 | V61: 1.3000000000000001e-002 | W61: 0.129 | X61: 0.114 | Y61: 42 | Z61: 1.41 | AA61: 1.6799999999999999e-002 | AB61: 1.1299999999999999e-002 | AC61: -7.8000000000000005e-003 | AD61: -9.7000000000000003e-003 | AE61: 87.72 | AF61: 91.67 | AG61: 0.48 | AH61: AA | AI61: 4.5400000000000003e-002 | AJ61: =H61+100*O61 -> 128.00999999999999 | AK61: 125.5 | AL61: 33 | AM61: 33.9 | AN61: 45 | AO61: -1.3999999999999999e-002 | AP61: 6 | AQ61: 宁建转债!
A62: 158 | B62: 128082 | C62: 华锋转债! | D62: 2806 | E62: 华锋股份 | F62: 电子 | G62: 元器件制 | H62: 112.52 | I62: -2.9999999999999997e-004 | J62: 7.4999999999999997e-003 | K62: 12.15 | L62: 1.e-002 | M62: 122 | N62: 11.71 | O62: 8.4000000000000005e-002 | P62: 103.76 | Q62: 转股中 | R62: 5年27天 | S62: 3年27天 | T62: 3.52 | U62: 21 | V62: 5.2999999999999999e-002 | W62: 0.16500000000000001 | X62: 0.17100000000000001 | Y62: 21 | Z62: 1.71 | AA62: 1.6500000000000001e-002 | AB62: 8.8999999999999999e-003 | AC62: -2.12e-002 | AD62: -2.41e-002 | AE62: 82.88 | AF62: 84.5 | AG62: 0.72 | AH62: A+ | AI62: 7.7399999999999997e-002 | AJ62: =H62+100*O62 -> 120.92 | AK62: 121.3 | AL62: 9 | AM62: 36.8 | AN62: 77 | AO62: 1.8000000000000002e-002 | AP62: 55 | AQ62: 华锋转债!
A63: 201 | B63: 113026 | C63: 核能转债! | D63: 601985 | E63: 中国核电 | F63: 能源电力 | G63: 核电 | H63: 102.29 | I63: 2.3e-003 | J63: -1.1000000000000001e-003 | K63: 4.66 | L63: 4.3e-003 | M63: 109.8 | N63: 6.08 | O63: 0.33500000000000002 | P63: 76.64 | Q63: 转股中 | R63: 4.44年 | S63: 2.44年 | T63: 78 | U63: 8.7 | V63: 1.e-003 | W63: 0.10800000000000001 | X63: 8.199999999999999e-002 | Y63: 725 | Z63: 1.39 | AA63: 1.6399999999999998e-002 | AB63: 1.2199999999999999e-002 | AC63: 3.8e-003 | AD63: 1.2999999999999999e-003 | AE63: 93.76 | AF63: 93.26 | AG63: 0.27 | AH63: AAA | AI63: 3.8300000000000001e-002 | AJ63: =H63+100*O63 -> 135.79000000000002 | AK63: 127.9 | AL63: 66 | AM63: 34.2 | AN63: 48 | AO63: 2.8999999999999998e-002 | AP63: 51 | AQ63: 核能转债!
A64: 302 | B64: 127003 | C64: 海印转债! | D64: 861 | E64: 海印股份 | F64: 商业零售 | G64: 商场 | H64: 109 | I64: -7.000000000000001e-004 | J64: -4.0000000000000002e-004 | K64: 2.54 | L64: -7.8000000000000005e-003 | M64: 111.8 | N64: 3 | O64: 0.28699999999999998 | P64: 84.67 | Q64: 转股中 | R64: 1.58年 | S64: 回售中 | T64: 6.74 | U64: 2.3 | V64: 3.0000000000000001e-003 | W64: 0.114 | X64: 9.6999999999999989e-002 | Y64: 59 | Z64: 1.5 | AA64: 1.6299999999999999e-002 | AB64: 2.5999999999999999e-003 | AC64: 回售中 | AD64: 回售中 | AE64: 100.3 | AF64: 104.71 | AG64: 0.15 | AH64: AA | AI64: 4.2699999999999995e-002 | AJ64: =H64+100*O64 -> 137.69999999999999 | AK64: 133.3 | AL64: 130 | AM64: 28.6 | AN64: 18 | AO64: -2.2000000000000002e-002 | AP64: 74 | AQ64: 海印转债!
A65: 26 | B65: 113599 | C65: 嘉友转债 | D65: 603871 | E65: 嘉友国际 | F65: 交通运输 | G65: 物流业 | H65: 115.12 | I65: -1.8e-003 | J65: 2.0000000000000001e-004 | K65: 25.36 | L65: -2.3999999999999998e-003 | M65: 126 | N65: 24.82 | O65: 0.127 | P65: 102.18 | Q65: 3月13天 | R65: 5.74年 | S65: 3.74年 | T65: 7.2 | U65: 3.4 | V65: 4.0000000000000001e-003 | W65: 0.129 | X65: 0.13200000000000001 | Y65: 56 | Z65: 2.8 | AA65: 1.61e-002 | AB65: 8.5000000000000006e-003 | AC65: -2.6099999999999998e-002 | AD65: -2.7900000000000001e-002 | AE65: 81.02 | AF65: 87.72 | AG65: 0.67 | AH65: AA- | AI65: 6.6400000000000001e-002 | AJ65: =H65+100*O65 -> 127.82000000000001 | AK65: 128.1 | AL65: 69 | AM65: 40.3 | AN65: 114 | AO65: -1.9e-002 | AP65: 12 | AQ65: 嘉友转债
A66: 207 | B66: 113532 | C66: 海环转债! | D66: 603817 | E66: 海峡环保 | F66: 城市公用 | G66: 三废处理 | H66: 105.84 | I66: -1.5e-003 | J66: -1.2999999999999999e-003 | K66: 6.24 | L66: -7.9000000000000008e-003 | M66: 112.9 | N66: 7.69 | O66: 0.30399999999999999 | P66: 81.14 | Q66: 转股中 | R66: 4.40年 | S66: 2.40年 | T66: 4.6 | U66: 0.4 | V66: 1.e-003 | W66: 0.16399999999999998 | X66: 0.13300000000000001 | Y66: 28 | Z66: 1.64 | AA66: 1.5100000000000001e-002 | AB66: 9.5999999999999992e-003 | AC66: -9.1000000000000004e-003 | AD66: -1.1699999999999999e-002 | AE66: 92.85 | AF66: 94.06 | AG66: 0.35 | AH66: AA | AI66: 4.3299999999999998e-002 | AJ66: =H66+100*O66 -> 136.24000000000001 | AK66: 130.5 | AL66: 100 | AM66: 36.5 | AN66: 71 | AO66: -2.5000000000000001e-002 | AP66: 26 | AQ66: 海环转债!
A67: 218 | B67: 110053 | C67: 苏银转债! | D67: 600919 | E67: 江苏银行 | F67: 金融 | G67: 银行行业 | H67: 112.09 | I67: -5.0000000000000001e-003 | J67: 4.4000000000000003e-003 | K67: 6.01 | L67: -1.7000000000000001e-003 | M67: 119.1 | N67: 7.28 | O67: 0.35799999999999998 | P67: 82.55 | Q67: 转股中 | R67: 4.35年 | S67: 无权 | T67: 200 | U67: 44 | V67: 2.e-003 | W67: 0.28800000000000003 | X67: 0.23800000000000002 | Y67: 694 | Z67: 0.59 | AA67: 1.4499999999999999e-002 | AB67: 6.6e-003 | AC67: 无权 | AD67: 无权 | AE67: 无权 | AF67: 101.66 | AG67: 0.32 | AH67: AAA | AI67: 3.8300000000000001e-002 | AJ67: =H67+100*O67 -> 147.88999999999999 | AK67: 141.6 | AL67: 205 | AM67: 40 | AN67: 108 | AO67: -2.7999999999999997e-002 | AP67: 47 | AQ67: 苏银转债!
A68: 38 | B68: 113037 | C68: 紫银转债 | D68: 601860 | E68: 紫金银行 | F68: 金融 | G68: 银行行业 | H68: 107.15 | I68: -3.0999999999999999e-003 | J68: 2.e-003 | K68: 4 | L68: -2.5000000000000001e-003 | M68: 115.8 | N68: 4.75 | O68: 0.27200000000000002 | P68: 84.21 | Q68: 2月23天 | R68: 5.71年 | S68: 无权 | T68: 45 | U68: 21 | V68: 4.0000000000000001e-003 | W68: 0.307 | X68: 0.25900000000000001 | Y68: 146 | Z68: 1.03 | AA68: 1.3999999999999999e-002 | AB68: 8.8999999999999999e-003 | AC68: 无权 | AD68: 无权 | AE68: 无权 | AF68: 91.3 | AG68: 0.44 | AH68: AA+ | AI68: 4.3400000000000001e-002 | AJ68: =H68+100*O68 -> 134.35000000000002 | AK68: 130.1 | AL68: 92 | AM68: 38.8 | AN68: 100 | AO68: -2.4e-002 | AP68: 16 | AQ68: 紫银转债
A69: 251 | B69: 128042 | C69: 凯中转债! | D69: 2823 | E69: 凯中精密 | F69: 能源电力 | G69: 电力设备 | H69: 110.6 | I69: 0. | J69: 1.9e-003 | K69: 12.31 | L69: 4.0999999999999995e-003 | M69: 116.3 | N69: 12.96 | O69: 0.16399999999999998 | P69: 94.98 | Q69: 转股中 | R69: 3.73年 | S69: 1.73年 | T69: 4.16 | U69: 31 | V69: 6.8000000000000005e-002 | W69: 0.11800000000000001 | X69: 0.11199999999999999 | Y69: 35 | Z69: 2.62 | AA69: 1.38e-002 | AB69: 6.0000000000000001e-003 | AC69: -3.8199999999999998e-002 | AD69: -4.0899999999999999e-002 | AE69: 94.93 | AF69: 99.59 | AG69: 0.46 | AH69: AA | AI69: 4.3299999999999998e-002 | AJ69: =H69+100*O69 -> 127. | AK69: 126.2 | AL69: 48 | AM69: 26.6 | AN69: 7 | AO69: 6.2e-002 | AP69: 26 | AQ69: 凯中转债!
A70: 301 | B70: 128013 | C70: 洪涛转债! | D70: 2325 | E70: 洪涛股份 | F70: 建筑 | G70: 装饰工程 | H70: 107.34 | I70: -2.7000000000000001e-003 | J70: -2.8000000000000004e-003 | K70: 2.9 | L70: -1.3600000000000001e-002 | M70: 109.8 | N70: 3.1 | O70: 0.14699999999999999 | P70: 93.55 | Q70: 转股中 | R70: 1.72年 | S70: 回售中 | T70: 12 | U70: 5.5 | V70: 4.0000000000000001e-003 | W70: 0.33100000000000002 | X70: 0.309 | Y70: 36 | Z70: 1.21 | AA70: 1.34e-002 | AB70: 2.7000000000000001e-003 | AC70: 回售中 | AD70: 回售中 | AE70: 100.3 | AF70: 98.82 | AG70: 0.41 | AH70: AA- | AI70: 6.3700000000000007e-002 | AJ70: =H70+100*O70 -> 122.04000000000001 | AK70: 121.1 | AL70: 7 | AM70: 20.8 | AN70: 4 | AO70: -5.5e-002 | AP70: 90 | AQ70: 洪涛转债!
A71: 303 | B71: 128010 | C71: 顺昌转债!! | D71: 2245 | E71: 澳洋顺昌 | F71: 交通运输 | G71: 物流业 | H71: 107.9 | I71: 3.5999999999999999e-003 | J71: -2.2000000000000001e-003 | K71: 7.21 | L71: 2.2700000000000001e-002 | M71: 109.6 | N71: 9.25 | O71: 0.38400000000000001 | P71: 77.95 | Q71: 转股中 | R71: 1.21年 | S71: 回售中 | T71: 5.09 | U71: 14 | V71: 2.6000000000000002e-002 | W71: 7.2000000000000008e-002 | X71: 5.5999999999999994e-002 | Y71: 71 | Z71: 3.11 | AA71: 1.32e-002 | AB71: -1.7000000000000001e-003 | AC71: 回售中 | AD71: 回售中 | AE71: 100.27 | AF71: 104.26 | AG71: 0.06 | AH71: AA | AI71: 4.2699999999999995e-002 | AJ71: =H71+100*O71 -> 146.30000000000001 | AK71: 137.9 | AL71: 169 | AM71: 33.6 | AN71: 41 | AO71: 0.107 | AP71: 41 | AQ71: 顺昌转债!!
A72: 249 | B72: 113516 | C72: 苏农转债! | D72: 603323 | E72: 苏农银行 | F72: 金融 | G72: 银行行业 | H72: 108.95 | I72: -2.3999999999999998e-003 | J72: -1.4000000000000002e-003 | K72: 4.8 | L72: -1.03e-002 | M72: 114.3 | N72: 5.52 | O72: 0.253 | P72: 86.96 | Q72: 转股中 | R72: 3.73年 | S72: 无权 | T72: 12.9 | U72: 1.5 | V72: 1.e-003 | W72: 0.14899999999999999 | X72: 0.13 | Y72: 87 | Z72: 0.73 | AA72: 1.32e-002 | AB72: 6.1999999999999998e-003 | AC72: 无权 | AD72: 无权 | AE72: 无权 | AF72: 98.54 | AG72: 0.37 | AH72: AA+ | AI72: 4.1299999999999996e-002 | AJ72: =H72+100*O72 -> 134.25 | AK72: 130.9 | AL72: 106 | AM72: 32.4 | AN72: 33 | AO72: 1.3999999999999999e-002 | AP72: 36 | AQ72: 苏农转债!
A73: 203 | B73: 113534 | C73: 鼎胜转债! | D73: 603876 | E73: 鼎胜新材 | F73: 有色金属 | G73: 小金属 | H73: 108.61 | I73: -2.e-003 | J73: -3.0000000000000001e-003 | K73: 13.02 | L73: -1.29e-002 | M73: 114.9 | N73: 15.18 | O73: 0.26600000000000001 | P73: 85.77 | Q73: 转股中 | R73: 4.42年 | S73: 2.42年 | T73: 12 | U73: 1.9 | V73: 1.e-003 | W73: 0.21199999999999999 | X73: 0.182 | Y73: 56 | Z73: 1.57 | AA73: 1.3100000000000001e-002 | AB73: 6.8999999999999999e-003 | AC73: -1.9e-002 | AD73: -2.1499999999999998e-002 | AE73: 92.77 | AF73: 95.64 | AG73: 0.39 | AH73: AA | AI73: 4.3299999999999998e-002 | AJ73: =H73+100*O73 -> 135.21000000000001 | AK73: 131.4 | AL73: 112 | AM73: 35.8 | AN73: 63 | AO73: -1.7000000000000001e-002 | AP73: 30 | AQ73: 鼎胜转债!
A74: 17 | B74: 113039 | C74: 嘉泽转债! | D74: 601619 | E74: 嘉泽新能 | F74: 能源电力 | G74: 风能 | H74: 105.11 | I74: -2.5000000000000001e-003 | J74: 8.0000000000000004e-004 | K74: 3.13 | L74: -3.2000000000000002e-003 | M74: 113.1 | N74: 3.57 | O74: 0.19899999999999998 | P74: 87.68 | Q74: 3月24天 | R74: 5.79年 | S74: 3.79年 | T74: 13 | U74: 10 | V74: 6.9999999999999993e-003 | W74: 0.20000000000000001 | X74: 0.17600000000000002 | Y74: 65 | Z74: 1.89 | AA74: 1.29e-002 | AB74: 8.8000000000000005e-003 | AC74: -3.7000000000000002e-003 | AD74: -5.4000000000000003e-003 | AE74: 87.01 | AF74: 87.85 | AG74: 0.52 | AH74: AA | AI74: 4.5400000000000003e-002 | AJ74: =H74+100*O74 -> 125.00999999999999 | AK74: 122.5 | AL74: 13 | AM74: 34.7 | AN74: 52 | AO74: -3.2000000000000001e-002 | AP74: 12 | AQ74: 嘉泽转债!
A75: 45 | B75: 128120 | C75: 联诚转债 | D75: 2921 | E75: 联诚精密 | F75: 汽车 | G75: 零部件制 | H75: 110.466 | I75: -7.000000000000001e-004 | J75: -1.26e-002 | K75: 23.27 | L75: -1.8100000000000002e-002 | M75: 118.4 | N75: 24.37 | O75: 0.157 | P75: 95.49 | Q75: 2月19天 | R75: 5.69年 | S75: 3.69年 | T75: 2.6 | U75: 9.9 | V75: 3.4000000000000002e-002 | W75: 0.13699999999999998 | X75: 0.13100000000000001 | Y75: 19 | Z75: 2.54 | AA75: 1.2500000000000001e-002 | AB75: 6.8000000000000005e-003 | AC75: -1.43e-002 | AD75: -1.6500000000000001e-002 | AE75: 75.99 | AF75: 74.35 | AG75: 0.74 | AH75: A | AI75: 8.7400000000000005e-002 | AJ75: =H75+100*O75 -> 126.166 | AK75: 125.4 | AL75: 30 | AM75: 49.5 | AN75: 199 | AO75: 1.7000000000000001e-002 | AP75: 12 | AQ75: 联诚转债
A76: 291 | B76: 128018 | C76: 时达转债! | D76: 2527 | E76: 新时达 | F76: 机械装备 | G76: 机器人及 | H76: 105.498 | I76: 5.6000000000000008e-003 | J76: -6.5000000000000006e-003 | K76: 6 | L76: -3.3e-003 | M76: 110.3 | N76: 7.42 | O76: 0.30499999999999999 | P76: 80.86 | Q76: 转股中 | R76: 2.997年 | S76: 0.997年 | T76: 8.8 | U76: 3.4 | V76: 4.0000000000000001e-003 | W76: 0.23600000000000002 | X76: 0.191 | Y76: 37 | Z76: 1.46 | AA76: 1.21e-002 | AB76: 6.1999999999999998e-003 | AC76: -3.0200000000000001e-002 | AD76: -3.32e-002 | AE76: 96.97 | AF76: 96.61 | AG76: 0.26 | AH76: AA | AI76: 4.2699999999999995e-002 | AJ76: =H76+100*O76 -> 135.99799999999999 | AK76: 130.1 | AL76: 94 | AM76: 33.2 | AN76: 39 | AO76: 3.6000000000000004e-002 | AP76: 40 | AQ76: 时达转债!
A77: 238 | B77: 110047 | C77: 山鹰转债 | D77: 600567 | E77: 山鹰纸业 | F77: 造纸包装 | G77: 包装用纸 | H77: 112.64 | I77: -5.9999999999999995e-004 | J77: 5.9999999999999995e-004 | K77: 3.14 | L77: 0. | M77: 118.1 | N77: 3.34 | O77: 0.19800000000000001 | P77: 94.01 | Q77: 转股中 | R77: 4年14天 | S77: 2年14天 | T77: 23 | U77: 2.1 | V77: 1.e-003 | W77: 0.159 | X77: 0.14999999999999999 | Y77: 144 | Z77: 0.98 | AA77: 1.2e-002 | AB77: 4.0999999999999995e-003 | AC77: -3.8399999999999997e-002 | AD77: -4.1200000000000001e-002 | AE77: 94.71 | AF77: 100.66 | AG77: 0.44 | AH77: AA+ | AI77: 4.1299999999999996e-002 | AJ77: =H77+100*O77 -> 132.44 | AK77: 131.3 | AL77: 111 | AM77: 30.6 | AN77: 23 | AO77: 1.e-003 | AP77: 34 | AQ77: 山鹰转债
A78: 204 | B78: 113024 | C78: 核建转债! | D78: 601611 | E78: 中国核建 | F78: 建筑 | G78: 建筑工程 | H78: 104.17 | I78: 7.000000000000001e-004 | J78: -2.3999999999999998e-003 | K78: 7.34 | L78: -6.8000000000000005e-003 | M78: 109.7 | N78: 9.76 | O78: 0.38500000000000001 | P78: 75.2 | Q78: 转股中 | R78: 4.42年 | S78: 2.42年 | T78: 30 | U78: 4.7 | V78: 1.e-003 | W78: 0.154 | X78: 0.11599999999999999 | Y78: 195 | Z78: 1.8 | AA78: 1.2e-002 | AB78: 7.8000000000000005e-003 | AC78: -3.5999999999999999e-003 | AD78: -6.0999999999999995e-003 | AE78: 93.73 | AF78: 93.22 | AG78: 0.26 | AH78: AAA | AI78: 3.8300000000000001e-002 | AJ78: =H78+100*O78 -> 142.67000000000002 | AK78: 133.1 | AL78: 127 | AM78: 39.4 | AN78: 106 | AO78: -3.3000000000000002e-002 | AP78: 44 | AQ78: 核建转债!
A79: 142 | B79: 123039 | C79: 开润转债! | D79: 300577 | E79: 开润股份 | F79: 服装纺织 | G79: 纺织行业 | H79: 114.75 | I79: -9.4999999999999998e-003 | J79: -3.4000000000000002e-003 | K79: 32.09 | L79: -1.8700000000000001e-002 | M79: 121.5 | N79: 33.22 | O79: 0.188 | P79: 96.6 | Q79: 转股中 | R79: 5年49天 | S79: 3年49天 | T79: 2.22 | U79: 16 | V79: 6.4000000000000001e-002 | W79: 3.2000000000000001e-002 | X79: 3.1e-002 | Y79: 70 | Z79: 8.36 | AA79: 1.15e-002 | AB79: 4.1999999999999997e-003 | AC79: -2.81e-002 | AD79: -3.0600000000000002e-002 | AE79: 82.07 | AF79: 83.69 | AG79: 0.69 | AH79: A+ | AI79: 7.7399999999999997e-002 | AJ79: =H79+100*O79 -> 133.55000000000001 | AK79: 132.9 | AL79: 126 | AM79: 49.2 | AN79: 195 | AO79: -5.0000000000000003e-002 | AP79: 24 | AQ79: 开润转债!
A80: 44 | B80: 113593 | C80: 沪工转债 | D80: 603131 | E80: 上海沪工 | F80: 机械装备 | G80: 通用设备 | H80: 114.06 | I80: -1.2199999999999999e-002 | J80: 3.4000000000000002e-003 | K80: 21.01 | L80: -1.2199999999999999e-002 | M80: 121.6 | N80: 21.32 | O80: 0.157 | P80: 98.55 | Q80: 2月19天 | R80: 5.70年 | S80: 3.70年 | T80: 4 | U80: 5.5 | V80: 1.2e-002 | W80: 5.9999999999999998e-002 | X80: 5.9000000000000004e-002 | Y80: 67 | Z80: 5.42 | AA80: 1.15e-002 | AB80: 5.0000000000000001e-003 | AC80: -2.2400000000000003e-002 | AD80: -2.46e-002 | AE80: 78.65 | AF80: 80.28 | AG80: 0.72 | AH80: A+ | AI80: 7.7399999999999997e-002 | AJ80: =H80+100*O80 -> 129.75999999999999 | AK80: 129.6 | AL80: 86 | AM80: 49.3 | AN80: 197 | AO80: -2.7999999999999997e-002 | AP80: 7 | AQ80: 沪工转债
A81: 190 | B81: 123028 | C81: 清水转债 | D81: 300437 | E81: 清水源 | F81: 城市公用 | G81: 三废处理 | H81: 115.72 | I81: -1.6399999999999998e-002 | J81: -1.2800000000000001e-002 | K81: 12.48 | L81: -4.3700000000000003e-002 | M81: 121.8 | N81: 11.84 | O81: 9.8000000000000004e-002 | P81: 105.41 | Q81: 转股中 | R81: 4.61年 | S81: 2.61年 | T81: 4.56 | U81: 10 | V81: 1.9e-002 | W81: 0.16699999999999998 | X81: 0.17600000000000002 | Y81: 27 | Z81: 1.77 | AA81: 1.1399999999999999e-002 | AB81: 3.3e-003 | AC81: -3.5699999999999996e-002 | AD81: -3.8800000000000001e-002 | AE81: 88.27 | AF81: 92.07 | AG81: 0.67 | AH81: AA- | AI81: 6.4299999999999996e-002 | AJ81: =H81+100*O81 -> 125.52 | AK81: 126 | AL81: 44 | AM81: 34 | AN81: 46 | AO81: -7.2999999999999995e-002 | AP81: 50 | AQ81: 清水转债
A82: 258 | B82: 127007 | C82: 湖广转债! | D82: 665 | E82: 湖北广电 | F82: 传媒娱乐 | G82: 影视娱乐 | H82: 107.879 | I82: -7.6e-003 | J82: 2.5999999999999999e-003 | K82: 5.03 | L82: -1.18e-002 | M82: 112.3 | N82: 5.58 | O82: 0.19699999999999998 | P82: 90.14 | Q82: 转股中 | R82: 3.64年 | S82: 1.64年 | T82: 12.2 | U82: 2.9 | V82: 2.e-003 | W82: 0.24600000000000002 | X82: 0.222 | Y82: 49 | Z82: 0.76 | AA82: 1.1299999999999999e-002 | AB82: 5.0000000000000001e-003 | AC82: -2.6600000000000002e-002 | AD82: -2.9500000000000002e-002 | AE82: 95.61 | AF82: 97.2 | AG82: 0.43 | AH82: AA+ | AI82: 4.1299999999999996e-002 | AJ82: =H82+100*O82 -> 127.57900000000001 | AK82: 125.6 | AL82: 35 | AM82: 28.4 | AN82: 13 | AO82: -1.7000000000000001e-002 | AP82: 18 | AQ82: 湖广转债!
A83: 162 | B83: 113549 | C83: 白电转债 | D83: 603861 | E83: 白云电器 | F83: 能源电力 | G83: 电力设备 | H83: 109 | I83: -4.5999999999999999e-003 | J83: 3.3e-003 | K83: 8.03 | L83: -2.5000000000000001e-003 | M83: 115.1 | N83: 8.88 | O83: 0.20499999999999999 | P83: 90.43 | Q83: 转股中 | R83: 5年8天 | S83: 3年8天 | T83: 8.8 | U83: 0.9 | V83: 1.e-003 | W83: 0.248 | X83: 0.22399999999999998 | Y83: 35 | Z83: 1.51 | AA83: 1.11e-002 | AB83: 5.6999999999999993e-003 | AC83: -1.6e-002 | AD83: -1.8100000000000002e-002 | AE83: 90.06 | AF83: 92.51 | AG83: 0.5 | AH83: AA | AI83: 4.5400000000000003e-002 | AJ83: =H83+100*O83 -> 129.5 | AK83: 127.6 | AL83: 62 | AM83: 35.1 | AN83: 57 | AO83: -2.7999999999999997e-002 | AP83: 31 | AQ83: 白电转债
A84: 119 | B84: 113570 | C84: 百达转债 | D84: 603331 | E84: 百达精工 | F84: 机械装备 | G84: 机械装备 | H84: 109 | I84: -8.8999999999999999e-003 | J84: 3.9000000000000003e-003 | K84: 10.42 | L84: -7.6e-003 | M84: 115.3 | N84: 11.54 | O84: 0.20699999999999999 | P84: 90.29 | Q84: 转股中 | R84: 5.34年 | S84: 3.34年 | T84: 2.8 | U84: 2.1 | V84: 6.9999999999999993e-003 | W84: 0.14999999999999999 | X84: 0.13600000000000001 | Y84: 19 | Z84: 2.41 | AA84: 1.0800000000000001e-002 | AB84: 5.6000000000000008e-003 | AC84: -1.3999999999999999e-002 | AD84: -1.6e-002 | AE84: 80.15 | AF84: 78.1 | AG84: 0.66 | AH84: A+ | AI84: 7.7399999999999997e-002 | AJ84: =H84+100*O84 -> 129.69999999999999 | AK84: 127.7 | AL84: 65 | AM84: 47.6 | AN84: 180 | AO84: -2.1000000000000001e-002 | AP84: 33 | AQ84: 百达转债
A85: 285 | B85: 128022 | C85: 众信转债! | D85: 2707 | E85: 众信旅游 | F85: 旅游餐饮 | G85: 旅游 | H85: 106.394 | I85: -1.6e-002 | J85: 1.1699999999999999e-002 | K85: 5.78 | L85: -2.69e-002 | M85: 109.8 | N85: 7.92 | O85: 0.45799999999999996 | P85: 72.98 | Q85: 转股中 | R85: 3年24天 | S85: 1年24天 | T85: 4.56 | U85: 9.3 | V85: 1.9e-002 | W85: 8.6999999999999994e-002 | X85: 6.4000000000000001e-002 | Y85: 52 | Z85: 2.46 | AA85: 1.06e-002 | AB85: 4.5000000000000005e-003 | AC85: -2.9700000000000001e-002 | AD85: -3.3599999999999998e-002 | AE85: 97.39 | AF85: 96.7 | AG85: 0.16 | AH85: AA | AI85: 4.3299999999999998e-002 | AJ85: =H85+100*O85 -> 152.19400000000002 | AK85: 139.8 | AL85: 190 | AM85: 42.4 | AN85: 136 | AO85: -0.155 | AP85: 23 | AQ85: 众信转债!
A86: 37 | B86: 128122 | C86: 兴森转债 | D86: 2436 | E86: 兴森科技 | F86: 电子 | G86: 元器件制 | H86: 107.902 | I86: -4.6999999999999993e-003 | J86: 3.9000000000000003e-003 | K86: 10.96 | L86: -2.7000000000000001e-003 | M86: 113.3 | N86: 14.18 | O86: 0.39600000000000002 | P86: 77.29 | Q86: 2月23天 | R86: 4.71年 | S86: 3.71年 | T86: 2.69 | U86: 15 | V86: 5.0000000000000003e-002 | W86: 1.6e-002 | X86: 1.3000000000000001e-002 | Y86: 163 | Z86: 5.16 | AA86: 1.0500000000000001e-002 | AB86: 5.4000000000000003e-003 | AC86: -1.04e-002 | AD86: -1.2199999999999999e-002 | AE86: 88.06 | AF86: 93.02 | AG86: 0.3 | AH86: AA | AI86: 4.3299999999999998e-002 | AJ86: =H86+100*O86 -> 147.50200000000001 | AK86: 138.5 | AL86: 175 | AM86: 45.5 | AN86: 164 | AO86: -1.e-002 | AP86: 7 | AQ86: 兴森转债
A87: 283 | B87: 128025 | C87: 特一转债! | D87: 2728 | E87: 特一药业 | F87: 医药 | G87: 化学制药 | H87: 106.432 | I87: -1.6000000000000001e-003 | J87: 8.9999999999999998e-004 | K87: 13.08 | L87: -1.5e-003 | M87: 109.8 | N87: 14.7 | O87: 0.19600000000000001 | P87: 88.98 | Q87: 转股中 | R87: 3年29天 | S87: 1年29天 | T87: 2.99 | U87: 7.9 | V87: 2.5000000000000001e-002 | W87: 0.11199999999999999 | X87: 0.10000000000000001 | Y87: 27 | Z87: 2.63 | AA87: 1.04e-002 | AB87: 4.4000000000000003e-003 | AC87: -2.9700000000000001e-002 | AD87: -3.3500000000000002e-002 | AE87: 94.97 | AF87: 91.02 | AG87: 0.46 | AH87: AA- | AI87: 6.4299999999999996e-002 | AJ87: =H87+100*O87 -> 126.03200000000001 | AK87: 123.9 | AL87: 18 | AM87: 28.9 | AN87: 19 | AO87: -1.7000000000000001e-002 | AP87: 44 | AQ87: 特一转债!
A88: 3 | B88: 123068 | C88: 弘信转债 | D88: 300657 | E88: 弘信电子 | F88: 电子 | G88: 元器件制 | H88: 114.2 | I88: -1.54e-002 | J88: 9.4999999999999998e-003 | K88: 17.56 | L88: -9.0000000000000011e-003 | M88: 121.2 | N88: 18.45 | O88: 0.20000000000000001 | P88: 95.18 | Q88: 5月15天 | R88: 5.94年 | S88: 3.94年 | T88: 5.7 | U88: 79 | V88: 0.12 | W88: 9.5000000000000001e-002 | X88: 8.9999999999999997e-002 | Y88: 60 | Z88: 4.1 | AA88: 1.03e-002 | AB88: 4.0999999999999995e-003 | AC88: -2.2499999999999999e-002 | AD88: -2.4300000000000002e-002 | AE88: 80.19 | AF88: 83.39 | AG88: 0.66 | AH88: AA- | AI88: 6.6400000000000001e-002 | AJ88: =H88+100*O88 -> 134.19999999999999 | AK88: 133.2 | AL88: 128 | AM88: 49.8 | AN88: 204 | AO88: 1.4999999999999999e-002 | AP88: 2 | AQ88: 弘信转债
A89: 19 | B89: 128128 | C89: 齐翔转2 | D89: 2408 | E89: 齐翔腾达 | F89: 化工 | G89: 化工 | H89: 108.961 | I89: -2.0000000000000001e-004 | J89: -5.1000000000000004e-003 | K89: 8.21 | L89: -8.5000000000000006e-003 | M89: 115.3 | N89: 8.22 | O89: 9.0999999999999998e-002 | P89: 99.88 | Q89: 3月21天 | R89: 5.78年 | S89: 3.78年 | T89: 29.9 | U89: 35 | V89: 1.1000000000000001e-002 | W89: 0.20499999999999999 | X89: 0.20499999999999999 | Y89: 146 | Z89: 1.78 | AA89: 1.e-002 | AB89: 5.1999999999999998e-003 | AC89: -1.2500000000000001e-002 | AD89: -1.43e-002 | AE89: 87.16 | AF89: 89.61 | AG89: 0.63 | AH89: AA | AI89: 4.5400000000000003e-002 | AJ89: =H89+100*O89 -> 118.06099999999999 | AK89: 118 | AL89: 5 | AM89: 28.4 | AN89: 15 | AO89: 2.8999999999999998e-002 | AP89: 25 | AQ89: 齐翔转2
A90: 7 | B90: 128133 | C90: 奇正转债! | D90: 2287 | E90: 奇正藏药 | F90: 医药 | G90: 中药 | H90: 110.83 | I90: -1.2699999999999999e-002 | J90: 1.e-003 | K90: 24.9 | L90: -2.7300000000000001e-002 | M90: 117.3 | N90: 30.12 | O90: 0.34100000000000003 | P90: 82.67 | Q90: 4月21天 | R90: 5.87年 | S90: 3.87年 | T90: 8 | U90: 143 | V90: 0.161 | W90: 6.0999999999999999e-002 | X90: 5.0000000000000003e-002 | Y90: 132 | Z90: 5.5 | AA90: 9.8999999999999991e-003 | AB90: 4.5999999999999999e-003 | AC90: -1.6200000000000003e-002 | AD90: -1.8000000000000002e-002 | AE90: 86.9 | AF90: 90.81 | AG90: 0.43 | AH90: AA | AI90: 4.5400000000000003e-002 | AJ90: =H90+100*O90 -> 144.93000000000001 | AK90: 139 | AL90: 180 | AM90: 48.2 | AN90: 184 | AO90: -7.0000000000000007e-002 | AP90: 6 | AQ90: 奇正转债!
A91: 104 | B91: 113033 | C91: 利群转债! | D91: 601366 | E91: 利群股份 | F91: 商业零售 | G91: 商场 | H91: 109.61 | I91: 2.3999999999999998e-003 | J91: -8.1000000000000013e-003 | K91: 6.53 | L91: -1.06e-002 | M91: 115.3 | N91: 7.01 | O91: 0.17699999999999999 | P91: 93.15 | Q91: 转股中 | R91: 5.40年 | S91: 3.40年 | T91: 18 | U91: 5.8 | V91: 3.0000000000000001e-003 | W91: 0.32000000000000001 | X91: 0.29799999999999999 | Y91: 56 | Z91: 1.26 | AA91: 9.5999999999999992e-003 | AB91: 4.5000000000000005e-003 | AC91: -1.5300000000000001e-002 | AD91: -1.7299999999999999e-002 | AE91: 88.76 | AF91: 91.18 | AG91: 0.54 | AH91: AA | AI91: 4.5400000000000003e-002 | AJ91: =H91+100*O91 -> 127.31 | AK91: 126.1 | AL91: 46 | AM91: 34.9 | AN91: 53 | AO91: -2.5000000000000001e-002 | AP91: 36 | AQ91: 利群转债!
A92: 21 | B92: 110074 | C92: 精达转债 | D92: 600577 | E92: 精达股份 | F92: 电子 | G92: 电子产品 | H92: 111.08 | I92: 1.6000000000000001e-003 | J92: -4.5999999999999999e-003 | K92: 3.35 | L92: -5.8999999999999999e-003 | M92: 117.3 | N92: 3.75 | O92: 0.24299999999999999 | P92: 89.33 | Q92: 3月20天 | R92: 5.78年 | S92: 3.78年 | T92: 7.87 | U92: 13 | V92: 1.4999999999999999e-002 | W92: 0.122 | X92: 0.109 | Y92: 64 | Z92: 1.82 | AA92: 9.5999999999999992e-003 | AB92: 4.3e-003 | AC92: -1.72e-002 | AD92: -1.9e-002 | AE92: 87.26 | AF92: 91.18 | AG92: 0.5 | AH92: AA | AI92: 4.5400000000000003e-002 | AJ92: =H92+100*O92 -> 135.38 | AK92: 132.8 | AL92: 125 | AM92: 41.6 | AN92: 128 | AO92: -1.e-003 | AP92: 7 | AQ92: 精达转债
A93: 33 | B93: 113596 | C93: 城地转债! | D93: 603887 | E93: 城地香江 | F93: 通信互联 | G93: 通信设备 | H93: 107.66 | I93: -7.8000000000000005e-003 | J93: -4.5999999999999999e-003 | K93: 21.79 | L93: -2.8500000000000001e-002 | M93: 113.5 | N93: 29.21 | O93: 0.44299999999999995 | P93: 74.6 | Q93: 2月29天 | R93: 5.72年 | S93: 3.72年 | T93: 12 | U93: 0.6 | V93: 0. | W93: 0.14699999999999999 | X93: 0.109 | Y93: 82 | Z93: 2.26 | AA93: 9.4999999999999998e-003 | AB93: 5.1000000000000004e-003 | AC93: -9.3999999999999986e-003 | AD93: -1.1200000000000002e-002 | AE93: 81.07 | AF93: 79.17 | AG93: 0.44 | AH93: AA- | AI93: 6.6400000000000001e-002 | AJ93: =H93+100*O93 -> 151.95999999999998 | AK93: 140.7 | AL93: 198 | AM93: 59.7 | AN93: 245 | AO93: -9.0999999999999998e-002 | AP93: 9 | AQ93: 城地转债!
A94: 8 | B94: 123067 | C94: 斯莱转债 | D94: 300382 | E94: 斯莱克 | F94: 机械装备 | G94: 专用设备 | H94: 114.79 | I94: -6.9999999999999993e-003 | J94: -1.8e-003 | K94: 9.76 | L94: -1.21e-002 | M94: 121.2 | N94: 9.38 | O94: 0.10300000000000001 | P94: 104.05 | Q94: 4月16天 | R94: 5.86年 | S94: 3.86年 | T94: 3.88 | U94: 46 | V94: 0.10400000000000001 | W94: 7.0000000000000007e-002 | X94: 7.2999999999999995e-002 | Y94: 55 | Z94: 5.4 | AA94: 9.4999999999999998e-003 | AB94: 3.3e-003 | AC94: -2.4199999999999999e-002 | AD94: -2.6099999999999998e-002 | AE94: 80.59 | AF94: 83.8 | AG94: 0.73 | AH94: AA- | AI94: 6.6400000000000001e-002 | AJ94: =H94+100*O94 -> 125.09 | AK94: 125.5 | AL94: 32 | AM94: 41.7 | AN94: 129 | AO94: -2.e-002 | AP94: 9 | AQ94: 斯莱转债
A95: 156 | B95: 128083 | C95: 新北转债! | D95: 2376 | E95: 新北洋 | F95: 电子 | G95: 电子产品 | H95: 110 | I95: -2.3e-003 | J95: 4.0000000000000002e-004 | K95: 9.15 | L95: -5.4000000000000003e-003 | M95: 115.2 | N95: 11.7 | O95: 0.40700000000000003 | P95: 78.21 | Q95: 转股中 | R95: 5年35天 | S95: 3年35天 | T95: 8.77 | U95: 0.9 | V95: 1.e-003 | W95: 0.14400000000000002 | X95: 0.113 | Y95: 61 | Z95: 1.8 | AA95: 9.300000000000001e-003 | AB95: 3.9000000000000003e-003 | AC95: -1.8100000000000002e-002 | AD95: -2.0199999999999999e-002 | AE95: 89.86 | AF95: 92.3 | AG95: 0.34 | AH95: AA | AI95: 4.5400000000000003e-002 | AJ95: =H95+100*O95 -> 150.69999999999999 | AK95: 141.8 | AL95: 206 | AM95: 49.5 | AN95: 201 | AO95: -7.400000000000001e-002 | AP95: 17 | AQ95: 新北转债!
A96: 58 | B96: 128116 | C96: 瑞达转债 | D96: 2961 | E96: 瑞达期货 | F96: 金融 | G96: 期货行业 | H96: 109.6 | I96: 8.9999999999999998e-004 | J96: -5.4000000000000003e-003 | K96: 27.33 | L96: -8.3000000000000001e-003 | M96: 115.3 | N96: 29.82 | O96: 0.19600000000000001 | P96: 91.65 | Q96: 58天 | R96: 5.64年 | S96: 3.64年 | T96: 6.5 | U96: 2.6 | V96: 4.0000000000000001e-003 | W96: 5.2999999999999999e-002 | X96: 4.9000000000000002e-002 | Y96: 122 | Z96: 6.92 | AA96: 9.1999999999999998e-003 | AB96: 4.3e-003 | AC96: -1.4499999999999999e-002 | AD96: -1.6399999999999998e-002 | AE96: 87.72 | AF96: 90.18 | AG96: 0.54 | AH96: AA | AI96: 4.5400000000000003e-002 | AJ96: =H96+100*O96 -> 129.19999999999999 | AK96: 127.6 | AL96: 60 | AM96: 37.4 | AN96: 84 | AO96: -2.4e-002 | AP96: 10 | AQ96: 瑞达转债
A97: 144 | B97: 113030 | C97: 东风转债 | D97: 601515 | E97: 东风股份 | F97: 造纸包装 | G97: 包装材料 | H97: 112.09 | I97: 1.7000000000000001e-003 | J97: 4.7999999999999996e-003 | K97: 6.2 | L97: 1.3100000000000001e-002 | M97: 117.3 | N97: 6.75 | O97: 0.22 | P97: 91.85 | Q97: 转股中 | R97: 5年47天 | S97: 3年47天 | T97: 2.95 | U97: 1.3 | V97: 4.0000000000000001e-003 | W97: 3.6000000000000004e-002 | X97: 3.3000000000000002e-002 | Y97: 83 | Z97: 1.99 | AA97: 9.1000000000000004e-003 | AB97: 3.0999999999999999e-003 | AC97: -2.3300000000000001e-002 | AD97: -2.5499999999999998e-002 | AE97: 89.83 | AF97: 93.86 | AG97: 0.5 | AH97: AA | AI97: 4.5400000000000003e-002 | AJ97: =H97+100*O97 -> 134.09 | AK97: 132.3 | AL97: 120 | AM97: 38.5 | AN97: 96 | AO97: 1.4999999999999999e-002 | AP97: 15 | AQ97: 东风转债
A98: 71 | B98: 123054 | C98: 思特转债 | D98: 300608 | E98: 思特奇 | F98: 通信互联 | G98: 通信设备 | H98: 115.8 | I98: -1.7000000000000001e-002 | J98: -1.52e-002 | K98: 17.68 | L98: -4.3299999999999998e-002 | M98: 121.7 | N98: 16.49 | O98: 8.0000000000000002e-002 | P98: 107.22 | Q98: 39天 | R98: 5.59年 | S98: 3.59年 | T98: 2.71 | U98: 26 | V98: 8.1000000000000003e-002 | W98: 9.6999999999999989e-002 | X98: 0.10400000000000001 | Y98: 28 | Z98: 3.68 | AA98: 9.1000000000000004e-003 | AB98: 2.3999999999999998e-003 | AC98: -2.7000000000000003e-002 | AD98: -2.92e-002 | AE98: 82.42 | AF98: 85.69 | AG98: 0.74 | AH98: AA- | AI98: 6.6400000000000001e-002 | AJ98: =H98+100*O98 -> 123.8 | AK98: 124.4 | AL98: 24 | AM98: 38.7 | AN98: 97 | AO98: -4.7e-002 | AP98: 14 | AQ98: 思特转债
A99: 170 | B99: 127014 | C99: 北方转债 | D99: 65 | E99: 北方国际 | F99: 建筑 | G99: 建筑工程 | H99: 110.185 | I99: 8.0000000000000004e-004 | J99: -5.6999999999999993e-003 | K99: 7.54 | L99: -1.18e-002 | M99: 115.1 | N99: 8.75 | O99: 0.27899999999999997 | P99: 86.17 | Q99: 转股中 | R99: 4.96年 | S99: 2.96年 | T99: 5.78 | U99: 0.9 | V99: 1.e-003 | W99: 0.10000000000000001 | X99: 8.5999999999999993e-002 | Y99: 58 | Z99: 1.09 | AA99: 9.0000000000000011e-003 | AB99: 3.4999999999999996e-003 | AC99: -1.9699999999999999e-002 | AD99: -2.1899999999999999e-002 | AE99: 91.4 | AF99: 94.53 | AG99: 0.42 | AH99: AA+ | AI99: 4.1299999999999996e-002 | AJ99: =H99+100*O99 -> 138.08500000000001 | AK99: 134.2 | AL99: 140 | AM99: 39.7 | AN99: 107 | AO99: -6.0000000000000001e-003 | AP99: 17 | AQ99: 北方转债
A100: 42 | B100: 113594 | C100: 淳中转债 | D100: 603516 | E100: 淳中科技 | F100: 电子 | G100: 电子产品 | H100: 115.59 | I100: 5.0000000000000001e-004 | J100: 2.3e-003 | K100: 36.64 | L100: 4.0999999999999995e-003 | M100: 121.4 | N100: 39.37 | O100: 0.24199999999999999 | P100: 93.07 | Q100: 2月21天 | R100: 5.70年 | S100: 3.70年 | T100: 3 | U100: 19 | V100: 5.4000000000000006e-002 | W100: 6.0999999999999999e-002 | X100: 5.7000000000000002e-002 | Y100: 49 | Z100: 5.43 | AA100: 8.8000000000000005e-003 | AB100: 2.3e-003 | AC100: -2.5899999999999999e-002 | AD100: -2.7999999999999997e-002 | AE100: 78.64 | AF100: 80.15 | AG100: 0.67 | AH100: A+ | AI100: 7.7399999999999997e-002 | AJ100: =H100+100*O100 -> 139.78999999999999 | AK100: 138.1 | AL100: 172 | AM100: 58 | AN100: 239 | AO100: 2.2000000000000002e-002 | AP100: 5 | AQ100: 淳中转债
A101: 51 | B101: 110071 | C101: 湖盐转债 | D101: 600929 | E101: 雪天盐业 | F101: 食品饮料 | G101: 食品饮料 | H101: 109.8 | I101: 3.7000000000000002e-003 | J101: 3.8e-003 | K101: 6.25 | L101: 1.3000000000000001e-002 | M101: 115.2 | N101: 6.6 | O101: 0.159 | P101: 94.7 | Q101: 2月12天 | R101: 5.67年 | S101: 3.67年 | T101: 7.2 | U101: 5.7 | V101: 6.9999999999999993e-003 | W101: 0.126 | X101: 0.11900000000000001 | Y101: 57 | Z101: 2.25 | AA101: 8.6999999999999994e-003 | AB101: 3.8e-003 | AC101: -1.49e-002 | AD101: -1.67e-002 | AE101: 87.58 | AF101: 89.98 | AG101: 0.57 | AH101: AA | AI101: 4.5400000000000003e-002 | AJ101: =H101+100*O101 -> 125.7 | AK101: 124.9 | AL101: 25 | AM101: 34.9 | AN101: 54 | AO101: -5.2000000000000005e-002 | AP101: 11 | AQ101: 湖盐转债
A102: 31 | B102: 123063 | C102: 大禹转债 | D102: 300021 | E102: 大禹节水 | F102: 化工 | G102: 橡胶塑料 | H102: 120.47 | I102: -2.0499999999999997e-002 | J102: -1.23e-002 | K102: 5.66 | L102: -4.2300000000000004e-002 | M102: 126.5 | N102: 4.94 | O102: 5.0999999999999997e-002 | P102: 114.57 | Q102: 2月28天 | R102: 5.72年 | S102: 4.72年 | T102: 6.38 | U102: 29 | V102: 3.7999999999999999e-002 | W102: 0.14099999999999999 | X102: 0.16200000000000001 | Y102: 45 | Z102: 3.13 | AA102: 8.6999999999999994e-003 | AB102: 1.1000000000000001e-003 | AC102: -2.4300000000000002e-002 | AD102: -2.69e-002 | AE102: 78.58 | AF102: 88.25 | AG102: 0.78 | AH102: AA- | AI102: 6.6400000000000001e-002 | AJ102: =H102+100*O102 -> 125.56999999999999 | AK102: 126.4 | AL102: 50 | AM102: 38.1 | AN102: 93 | AO102: -2.7000000000000003e-002 | AP102: 15 | AQ102: 大禹转债
A103: 89 | B103: 113578 | C103: 全筑转债 | D103: 603030 | E103: 全筑股份 | F103: 建筑 | G103: 装饰工程 | H103: 113.35 | I103: -1.09e-002 | J103: 4.5999999999999999e-003 | K103: 5.31 | L103: -1.1200000000000002e-002 | M103: 118.3 | N103: 5.43 | O103: 0.159 | P103: 97.79 | Q103: 转股中 | R103: 5.45年 | S103: 3.45年 | T103: 3.84 | U103: 3.9 | V103: 9.0000000000000011e-003 | W103: 0.13400000000000001 | X103: 0.13100000000000001 | Y103: 29 | Z103: 1.29 | AA103: 8.0000000000000002e-003 | AB103: 2.0999999999999999e-003 | AC103: -2.4300000000000002e-002 | AD103: -2.6200000000000001e-002 | AE103: 88.55 | AF103: 93.32 | AG103: 0.57 | AH103: AA | AI103: 4.5400000000000003e-002 | AJ103: =H103+100*O103 -> 129.25 | AK103: 128.9 | AL103: 80 | AM103: 35.6 | AN103: 62 | AO103: -6.8000000000000005e-002 | AP103: 11 | AQ103: 全筑转债
A104: 12 | B104: 123065 | C104: 宝莱转债! | D104: 300246 | E104: 宝莱特 | F104: 医药 | G104: 医疗器械 | H104: 116.021 | I104: -4.9000000000000002e-002 | J104: 3.9599999999999996e-002 | K104: 29.57 | L104: -2.41e-002 | M104: 121.4 | N104: 40.54 | O104: 0.59099999999999997 | P104: 72.94 | Q104: 4月4天 | R104: 5.82年 | S104: 3.82年 | T104: 2.19 | U104: 420 | V104: 1.6100000000000001 | W104: 5.0999999999999997e-002 | X104: 3.7000000000000005e-002 | Y104: 43 | Z104: 5.18 | AA104: 8.0000000000000002e-003 | AB104: 1.6000000000000001e-003 | AC104: -2.6499999999999999e-002 | AD104: -2.8500000000000001e-002 | AE104: 80.92 | AF104: 84.14 | AG104: 0.39 | AH104: AA- | AI104: 6.6400000000000001e-002 | AJ104: =H104+100*O104 -> 175.12099999999998 | AK104: 159.1 | AL104: 267 | AM104: 75 | AN104: 274 | AO104: -0.14400000000000002 | AP104: 8 | AQ104: 宝莱转债!
A105: 232 | B105: 113525 | C105: 台华转债! | D105: 603055 | E105: 台华新材 | F105: 服装纺织 | G105: 纺织行业 | H105: 111.62 | I105: -5.5000000000000005e-003 | J105: 6.0999999999999995e-003 | K105: 7.3 | L105: 1.4000000000000002e-003 | M105: 114.9 | N105: 8.03 | O105: 0.22800000000000001 | P105: 90.91 | Q105: 转股中 | R105: 4年40天 | S105: 2年40天 | T105: 4.69 | U105: 1.8 | V105: 4.0000000000000001e-003 | W105: 8.3000000000000004e-002 | X105: 7.4999999999999997e-002 | Y105: 57 | Z105: 2.13 | AA105: 7.1999999999999998e-003 | AB105: 7.000000000000001e-004 | AC105: -3.3399999999999999e-002 | AD105: -3.6200000000000003e-002 | AE105: 94 | AF105: 96.9 | AG105: 0.45 | AH105: AA | AI105: 4.3299999999999998e-002 | AJ105: =H105+100*O105 -> 134.42000000000002 | AK105: 132.3 | AL105: 121 | AM105: 35.4 | AN105: 59 | AO105: -0.13800000000000001 | AP105: 22 | AQ105: 台华转债!
A106: 77 | B106: 113584 | C106: 家悦转债! | D106: 603708 | E106: 家家悦 | F106: 商业零售 | G106: 超市 | H106: 110.87 | I106: -4.0000000000000001e-003 | J106: -5.0000000000000001e-003 | K106: 26.11 | L106: -3.8300000000000001e-002 | M106: 115.3 | N106: 37.97 | O106: 0.61199999999999999 | P106: 68.76 | Q106: 35天 | R106: 5.58年 | S106: 3.58年 | T106: 6.45 | U106: 5.2 | V106: 6.9999999999999993e-003 | W106: 4.0999999999999995e-002 | X106: 2.7999999999999997e-002 | Y106: 159 | Z106: 5.29 | AA106: 7.1999999999999998e-003 | AB106: 2.2000000000000001e-003 | AC106: -1.7600000000000001e-002 | AD106: -1.95e-002 | AE106: 88.06 | AF106: 90.46 | AG106: 0.24 | AH106: AA | AI106: 4.5400000000000003e-002 | AJ106: =H106+100*O106 -> 172.06999999999999 | AK106: 153 | AL106: 259 | AM106: 62.5 | AN106: 257 | AO106: -0.16399999999999998 | AP106: 4 | AQ106: 家悦转债!
A107: 214 | B107: 123023 | C107: 迪森转债! | D107: 300335 | E107: 迪森股份 | F107: 能源电力 | G107: 电力供应 | H107: 111.475 | I107: -9.5999999999999992e-003 | J107: -1.11e-002 | K107: 6.78 | L107: -3.9699999999999999e-002 | M107: 114.9 | N107: 7.04 | O107: 0.157 | P107: 96.31 | Q107: 转股中 | R107: 4.36年 | S107: 3.36年 | T107: 5.3 | U107: 47 | V107: 7.9000000000000001e-002 | W107: 0.215 | X107: 0.20699999999999999 | Y107: 25 | Z107: 1.82 | AA107: 7.0999999999999995e-003 | AB107: 8.9999999999999998e-004 | AC107: -1.6399999999999998e-002 | AD107: -1.9199999999999998e-002 | AE107: 90.83 | AF107: 95.86 | AG107: 0.52 | AH107: AA | AI107: 4.3299999999999998e-002 | AJ107: =H107+100*O107 -> 127.175 | AK107: 126.6 | AL107: 54 | AM107: 30.8 | AN107: 24 | AO107: -7.400000000000001e-002 | AP107: 55 | AQ107: 迪森转债!
A108: 93 | B108: 123049 | C108: 维尔转债 | D108: 300190 | E108: 维尔利 | F108: 城市公用 | G108: 三废处理 | H108: 120.2 | I108: -1.43e-002 | J108: -8.199999999999999e-003 | K108: 8.2 | L108: -3.0699999999999998e-002 | M108: 124.8 | N108: 7.48 | O108: 9.6000000000000002e-002 | P108: 109.63 | Q108: 转股中 | R108: 5.43年 | S108: 3.43年 | T108: 9.17 | U108: 6.7 | V108: 6.0000000000000001e-003 | W108: 0.14300000000000002 | X108: 0.157 | Y108: 64 | Z108: 1.52 | AA108: 7.0999999999999995e-003 | AB108: -5.9999999999999995e-004 | AC108: -3.8100000000000002e-002 | AD108: -4.0399999999999998e-002 | AE108: 83.36 | AF108: 88.78 | AG108: 0.73 | AH108: AA- | AI108: 6.6400000000000001e-002 | AJ108: =H108+100*O108 -> 129.80000000000001 | AK108: 130.8 | AL108: 102 | AM108: 42 | AN108: 132 | AO108: -5.5e-002 | AP108: 12 | AQ108: 维尔转债
A109: 212 | B109: 127012 | C109: 招路转债! | D109: 1965 | E109: 招商公路 | F109: 机场高速 | G109: 高速 | H109: 105.09 | I109: 2.2000000000000001e-003 | J109: -4.0000000000000002e-004 | K109: 7.03 | L109: 5.6999999999999993e-003 | M109: 108.2 | N109: 8.81 | O109: 0.317 | P109: 79.8 | Q109: 转股中 | R109: 4.37年 | S109: 2.37年 | T109: 50 | U109: 34 | V109: 6.0000000000000001e-003 | W109: 0.115 | X109: 9.1999999999999998e-002 | Y109: 434 | Z109: 0.89 | AA109: 6.8000000000000005e-003 | AB109: 3.2000000000000002e-003 | AC109: -1.2e-002 | AD109: -1.34e-002 | AE109: 92.73 | AF109: 92.01 | AG109: 0.32 | AH109: AAA | AI109: 3.8300000000000001e-002 | AJ109: =H109+100*O109 -> 136.78999999999999 | AK109: 130.4 | AL109: 97 | AM109: 37.7 | AN109: 87 | AO109: 2.3e-002 | AP109: 37 | AQ109: 招路转债!
A110: 257 | B110: 123010 | C110: 博世转债! | D110: 300422 | E110: 博世科 | F110: 城市公用 | G110: 三废处理 | H110: 109.65 | I110: -1.4000000000000002e-003 | J110: -8.1000000000000013e-003 | K110: 10.94 | L110: -1.8799999999999997e-002 | M110: 112.3 | N110: 12.2 | O110: 0.223 | P110: 89.67 | Q110: 转股中 | R110: 3.66年 | S110: 1.66年 | T110: 4.3 | U110: 2.8 | V110: 6.0000000000000001e-003 | W110: 9.6999999999999989e-002 | X110: 8.6999999999999994e-002 | Y110: 44 | Z110: 1.87 | AA110: 6.7000000000000002e-003 | AB110: 5.0000000000000001e-004 | AC110: -3.5000000000000003e-002 | AD110: -3.78e-002 | AE110: 91.83 | AF110: 89.81 | AG110: 0.5 | AH110: AA- | AI110: 6.4299999999999996e-002 | AJ110: =H110+100*O110 -> 131.95000000000002 | AK110: 129.6 | AL110: 87 | AM110: 37.8 | AN110: 90 | AO110: -5.5e-002 | AP110: 26 | AQ110: 博世转债!
A111: 166 | B111: 123033 | C111: 金力转债! | D111: 300748 | E111: 金力永磁 | F111: 电子 | G111: 元器件制 | H111: 117.65 | I111: 3.4000000000000002e-003 | J111: -5.6000000000000008e-003 | K111: 40.16 | L111: -3.4999999999999996e-003 | M111: 121.5 | N111: 40.97 | O111: 0.20000000000000001 | P111: 98.02 | Q111: 转股中 | R111: 4.98年 | S111: 2.98年 | T111: 4.35 | U111: 132 | V111: 0.255 | W111: 2.6000000000000002e-002 | X111: 2.6000000000000002e-002 | Y111: 167 | Z111: 12.43 | AA111: 6.7000000000000002e-003 | AB111: -8.0000000000000004e-004 | AC111: -3.5900000000000001e-002 | AD111: -3.8800000000000001e-002 | AE111: 86.51 | AF111: 89.82 | AG111: 0.64 | AH111: AA- | AI111: 6.4299999999999996e-002 | AJ111: =H111+100*O111 -> 137.65000000000001 | AK111: 137.3 | AL111: 165 | AM111: 47.5 | AN111: 179 | AO111: -3.0000000000000001e-003 | AP111: 27 | AQ111: 金力转债!
A112: 47 | B112: 123059 | C112: 银信转债 | D112: 300231 | E112: 银信科技 | F112: 计算机及 | G112: 软件开发 | H112: 119.67 | I112: -2.23e-002 | J112: -1.6899999999999998e-002 | K112: 10.93 | L112: -5.2900000000000003e-002 | M112: 124.1 | N112: 9.91 | O112: 8.5000000000000006e-002 | P112: 110.29 | Q112: 2月15天 | R112: 5.69年 | S112: 3.69年 | T112: 3.91 | U112: 34 | V112: 7.2000000000000008e-002 | W112: 8.1000000000000003e-002 | X112: 8.900000000000001e-002 | Y112: 48 | Z112: 3.67 | AA112: 6.5000000000000006e-003 | AB112: -5.9999999999999995e-004 | AC112: -3.61e-002 | AD112: -3.7999999999999999e-002 | AE112: 81.41 | AF112: 86.75 | AG112: 0.74 | AH112: AA- | AI112: 6.6400000000000001e-002 | AJ112: =H112+100*O112 -> 128.17000000000002 | AK112: 129 | AL112: 82 | AM112: 42.3 | AN112: 135 | AO112: -2.2000000000000002e-002 | AP112: 11 | AQ112: 银信转债
A113: 205 | B113: 128064 | C113: 司尔转债! | D113: 2538 | E113: 司尔特 | F113: 化工 | G113: 农化 | H113: 111.806 | I113: 1.03e-002 | J113: -5.6999999999999993e-003 | K113: 5.89 | L113: 8.6e-003 | M113: 114.9 | N113: 6.07 | O113: 0.152 | P113: 97.03 | Q113: 转股中 | R113: 4.42年 | S113: 2.42年 | T113: 8 | U113: 4.3 | V113: 5.0000000000000001e-003 | W113: 0.18899999999999997 | X113: 0.184 | Y113: 42 | Z113: 1.11 | AA113: 6.3e-003 | AB113: 2.0000000000000001e-004 | AC113: -3.0099999999999998e-002 | AD113: -3.2500000000000001e-002 | AE113: 92.78 | AF113: 95.65 | AG113: 0.54 | AH113: AA | AI113: 4.3299999999999998e-002 | AJ113: =H113+100*O113 -> 127.006 | AK113: 126.6 | AL113: 53 | AM113: 30.9 | AN113: 27 | AO113: 2.6000000000000002e-002 | AP113: 56 | AQ113: 司尔转债!
A114: 155 | B114: 110063 | C114: 鹰19转债 | D114: 600567 | E114: 山鹰纸业 | F114: 造纸包装 | G114: 包装用纸 | H114: 112.89 | I114: -5.9999999999999995e-004 | J114: 5.9999999999999995e-004 | K114: 3.14 | L114: 0. | M114: 116.2 | N114: 3.3 | O114: 0.18600000000000003 | P114: 95.15 | Q114: 转股中 | R114: 5年36天 | S114: 3年36天 | T114: 18.6 | U114: 2 | V114: 1.e-003 | W114: 0.129 | X114: 0.12300000000000001 | Y114: 144 | Z114: 0.98 | AA114: 5.7999999999999996e-003 | AB114: 1.e-004 | AC114: -2.64e-002 | AD114: -2.8399999999999998e-002 | AE114: 90.25 | AF114: 93.96 | AG114: 0.53 | AH114: AA+ | AI114: 4.3400000000000001e-002 | AJ114: =H114+100*O114 -> 131.49000000000001 | AK114: 130.6 | AL114: 101 | AM114: 36.7 | AN114: 74 | AO114: 1.e-003 | AP114: 39 | AQ114: 鹰19转债
A115: 22 | B115: 110072 | C115: 广汇转债! | D115: 600297 | E115: 广汇汽车 | F115: 汽车 | G115: 分销、售 | H115: 111.01 | I115: -5.8999999999999999e-003 | J115: -1.2500000000000001e-002 | K115: 3.71 | L115: -3.39e-002 | M115: 114.5 | N115: 4.03 | O115: 0.20600000000000002 | P115: 92.06 | Q115: 3月19天 | R115: 5.78年 | S115: 3.78年 | T115: 33.7 | U115: 47 | V115: 1.3000000000000001e-002 | W115: 0.11199999999999999 | X115: 0.10300000000000001 | Y115: 301 | Z115: 0.76 | AA115: 5.4000000000000003e-003 | AB115: 8.9999999999999998e-004 | AC115: -1.89e-002 | AD115: -2.0299999999999999e-002 | AE115: 87.19 | AF115: 89.89 | AG115: 0.54 | AH115: AA+ | AI115: 4.3400000000000001e-002 | AJ115: =H115+100*O115 -> 131.61000000000001 | AK115: 130 | AL115: 90 | AM115: 40.1 | AN115: 109 | AO115: 3.2000000000000001e-002 | AP115: 17 | AQ115: 广汇转债!
A116: 177 | B116: 128074 | C116: 游族转债!! | D116: 2174 | E116: 游族网络 | F116: 通信互联 | G116: 互联网 | H116: 116.9 | I116: 0. | J116: 0. | K116: 16.23 | L116: -5.9999999999999995e-004 | M116: 119.9 | N116: 16.97 | O116: 0.222 | P116: 95.64 | Q116: 转股中 | R116: 4.88年 | S116: 2.88年 | T116: 6.83 | U116: 4.1 | V116: 5.0000000000000001e-003 | W116: 4.5999999999999999e-002 | X116: 4.4000000000000004e-002 | Y116: 149 | Z116: 2.63 | AA116: 5.3e-003 | AB116: -1.7000000000000001e-003 | AC116: -3.9800000000000002e-002 | AD116: -4.1900000000000007e-002 | AE116: 90.99 | AF116: 97.87 | AG116: 0 | AH116: AA | AI116: 4.3299999999999998e-002 | AJ116: =H116+100*O116 -> 139.09999999999999 | AK116: 138.2 | AL116: 173 | AM116: 40.3 | AN116: 113 | AO116: -1.2e-002 | AP116: 22 | AQ116: 游族转债!!
A117: 129 | B117: 113565 | C117: 宏辉转债 | D117: 603336 | E117: 宏辉果蔬 | F117: 农业 | G117: 农产品加 | H117: 114.98 | I117: -3.9000000000000003e-003 | J117: -3.8e-003 | K117: 10.17 | L117: -1.0700000000000001e-002 | M117: 118.2 | N117: 10 | O117: 0.13100000000000001 | P117: 101.7 | Q117: 转股中 | R117: 5.30年 | S117: 3.30年 | T117: 3.09 | U117: 6.6 | V117: 1.9e-002 | W117: 9.1999999999999998e-002 | X117: 9.4e-002 | Y117: 33 | Z117: 3.61 | AA117: 5.3e-003 | AB117: -7.000000000000001e-004 | AC117: -2.8500000000000001e-002 | AD117: -3.0699999999999998e-002 | AE117: 83.54 | AF117: 84.72 | AG117: 0.72 | AH117: AA- | AI117: 6.6400000000000001e-002 | AJ117: =H117+100*O117 -> 128.08000000000001 | AK117: 128.3 | AL117: 73 | AM117: 43.5 | AN117: 147 | AO117: -7.0999999999999994e-002 | AP117: 19 | AQ117: 宏辉转债
A118: 237 | B118: 128049 | C118: 华源转债! | D118: 2787 | E118: 华源控股 | F118: 造纸包装 | G118: 包装材料 | H118: 112.883 | I118: 8.0000000000000004e-004 | J118: -9.7000000000000003e-003 | K118: 7.03 | L118: -1.54e-002 | M118: 115.2 | N118: 7.42 | O118: 0.191 | P118: 94.74 | Q118: 转股中 | R118: 4年20天 | S118: 2年20天 | T118: 3.63 | U118: 1.1 | V118: 3.0000000000000001e-003 | W118: 0.16300000000000001 | X118: 0.155 | Y118: 22 | Z118: 1.48 | AA118: 5.1000000000000004e-003 | AB118: -1.6000000000000001e-003 | AC118: -3.8599999999999995e-002 | AD118: -4.1500000000000002e-002 | AE118: 90.31 | AF118: 90.03 | AG118: 0.58 | AH118: AA- | AI118: 6.4299999999999996e-002 | AJ118: =H118+100*O118 -> 131.983 | AK118: 131 | AL118: 108 | AM118: 40.7 | AN118: 118 | AO118: -9.0999999999999998e-002 | AP118: 52 | AQ118: 华源转债!
A119: 43 | B119: 127020 | C119: 中金转债 | D119: 60 | E119: 中金岭南 | F119: 有色金属 | G119: 有色行业 | H119: 111.012 | I119: 7.8000000000000005e-003 | J119: -2.8000000000000004e-003 | K119: 4.29 | L119: 9.3999999999999986e-003 | M119: 113.7 | N119: 4.71 | O119: 0.21899999999999997 | P119: 91.08 | Q119: 2月19天 | R119: 5.70年 | S119: 3.70年 | T119: 38 | U119: 20 | V119: 5.0000000000000001e-003 | W119: 0.248 | X119: 0.22600000000000001 | Y119: 153 | Z119: 1.36 | AA119: 4.3e-003 | AB119: -1.e-004 | AC119: -2.07e-002 | AD119: -2.1899999999999999e-002 | AE119: 87.01 | AF119: 89.52 | AG119: 0.53 | AH119: AA+ | AI119: 4.3400000000000001e-002 | AJ119: =H119+100*O119 -> 132.91200000000001 | AK119: 130.9 | AL119: 105 | AM119: 41.4 | AN119: 124 | AO119: 1.e-002 | AP119: 11 | AQ119: 中金转债
A120: 75 | B120: 123053 | C120: 宝通转债 | D120: 300031 | E120: 宝通科技 | F120: 通信互联 | G120: 互联网 | H120: 118.71 | I120: 2.0000000000000001e-004 | J120: -1.38e-002 | K120: 20.28 | L120: -2.0799999999999999e-002 | M120: 121.3 | N120: 20.8 | O120: 0.218 | P120: 97.5 | Q120: 34天 | R120: 5.58年 | S120: 3.58年 | T120: 5 | U120: 7.6 | V120: 1.3000000000000001e-002 | W120: 6.2e-002 | X120: 6.0999999999999999e-002 | Y120: 80 | Z120: 2.8 | AA120: 4.0000000000000001e-003 | AB120: -2.5999999999999999e-003 | AC120: -3.4599999999999999e-002 | AD120: -3.6600000000000001e-002 | AE120: 82.17 | AF120: 85.45 | AG120: 0.66 | AH120: AA- | AI120: 6.6400000000000001e-002 | AJ120: =H120+100*O120 -> 140.50999999999999 | AK120: 139.9 | AL120: 191 | AM120: 54.5 | AN120: 223 | AO120: -7.4999999999999997e-002 | AP120: 5 | AQ120: 宝通转债
A121: 197 | B121: 128066 | C121: 亚泰转债! | D121: 2811 | E121: 郑中设计 | F121: 建筑 | G121: 装饰工程 | H121: 115.549 | I121: 4.0000000000000002e-004 | J121: -6.0000000000000001e-003 | K121: 10.41 | L121: -7.6e-003 | M121: 117.5 | N121: 9.67 | O121: 7.2999999999999995e-002 | P121: 107.65 | Q121: 转股中 | R121: 4.44年 | S121: 2.44年 | T121: 4.8 | U121: 3.5 | V121: 6.0000000000000001e-003 | W121: 0.17100000000000001 | X121: 0.184 | Y121: 28 | Z121: 1.91 | AA121: 3.9000000000000003e-003 | AB121: -3.0999999999999999e-003 | AC121: -4.0599999999999997e-002 | AD121: -4.3299999999999998e-002 | AE121: 88.45 | AF121: 89.68 | AG121: 0.74 | AH121: AA- | AI121: 6.4299999999999996e-002 | AJ121: =H121+100*O121 -> 122.849 | AK121: 123.4 | AL121: 16 | AM121: 33.8 | AN121: 44 | AO121: -1.e-002 | AP121: 58 | AQ121: 亚泰转债!
A122: 111 | B122: 128101 | C122: 联创转债! | D122: 2036 | E122: 联创电子 | F122: 电子 | G122: 液晶显示 | H122: 112.776 | I122: 6.8999999999999999e-003 | J122: -2.0000000000000001e-004 | K122: 11.57 | L122: 1.7600000000000001e-002 | M122: 115.1 | N122: 14.48 | O122: 0.41100000000000003 | P122: 79.9 | Q122: 转股中 | R122: 5.35年 | S122: 3.35年 | T122: 3 | U122: 20 | V122: 5.9999999999999998e-002 | W122: 2.7999999999999997e-002 | X122: 2.2000000000000002e-002 | Y122: 107 | Z122: 4.11 | AA122: 3.9000000000000003e-003 | AB122: -1.1999999999999999e-003 | AC122: -2.4e-002 | AD122: -2.5899999999999999e-002 | AE122: 88.74 | AF122: 91.16 | AG122: 0.38 | AH122: AA | AI122: 4.5400000000000003e-002 | AJ122: =H122+100*O122 -> 153.876 | AK122: 145.6 | AL122: 234 | AM122: 54.5 | AN122: 224 | AO122: 5.2000000000000005e-002 | AP122: 16 | AQ122: 联创转债!
A123: 146 | B123: 113559 | C123: 永创转债! | D123: 603901 | E123: 永创智能 | F123: 机械装备 | G123: 专用设备 | H123: 116.7 | I123: -5.5000000000000005e-003 | J123: 6.0999999999999995e-003 | K123: 9.96 | L123: 1.e-003 | M123: 118.9 | N123: 10.32 | O123: 0.20899999999999999 | P123: 96.51 | Q123: 转股中 | R123: 5年46天 | S123: 3年46天 | T123: 5.1 | U123: 0.5 | V123: 1.e-003 | W123: 0.11699999999999999 | X123: 0.11199999999999999 | Y123: 44 | Z123: 3.16 | AA123: 3.7000000000000002e-003 | AB123: -2.7000000000000001e-003 | AC123: -3.2099999999999997e-002 | AD123: -3.49e-002 | AE123: 85.26 | AF123: 86.34 | AG123: 0.65 | AH123: AA- | AI123: 6.6400000000000001e-002 | AJ123: =H123+100*O123 -> 137.59999999999999 | AK123: 136.9 | AL123: 161 | AM123: 50.6 | AN123: 207 | AO123: 1.6e-002 | AP123: 22 | AQ123: 永创转债!
A124: 141 | B124: 128090 | C124: 汽模转2 | D124: 2510 | E124: 天汽模 | F124: 汽车 | G124: 零部件制 | H124: 113.049 | I124: -6.7000000000000002e-003 | J124: -2.0000000000000001e-004 | K124: 4.11 | L124: -1.2e-002 | M124: 115.2 | N124: 4.21 | O124: 0.158 | P124: 97.62 | Q124: 转股中 | R124: 5年50天 | S124: 3年50天 | T124: 4.67 | U124: 11 | V124: 2.e-002 | W124: 0.124 | X124: 0.121 | Y124: 38 | Z124: 1.42 | AA124: 3.7000000000000002e-003 | AB124: -1.6000000000000001e-003 | AC124: -2.6099999999999998e-002 | AD124: -2.81e-002 | AE124: 89.7 | AF124: 92.14 | AG124: 0.58 | AH124: AA | AI124: 4.5400000000000003e-002 | AJ124: =H124+100*O124 -> 128.84900000000002 | AK124: 128.5 | AL124: 77 | AM124: 36.3 | AN124: 70 | AO124: -3.7000000000000005e-002 | AP124: 25 | AQ124: 汽模转2
A125: 14 | B125: 128130 | C125: 景兴转债 | D125: 2067 | E125: 景兴纸业 | F125: 造纸包装 | G125: 包装用纸 | H125: 112.69 | I125: 1.6000000000000001e-003 | J125: -3.4000000000000002e-003 | K125: 3.38 | L125: -2.8999999999999998e-003 | M125: 115.1 | N125: 3.4 | O125: 0.13400000000000001 | P125: 99.41 | Q125: 3月27天 | R125: 5.81年 | S125: 3.81年 | T125: 12.8 | U125: 12 | V125: 8.0000000000000002e-003 | W125: 0.34100000000000003 | X125: 0.33899999999999997 | Y125: 38 | Z125: 0.83 | AA125: 3.7000000000000002e-003 | AB125: -8.9999999999999998e-004 | AC125: -2.1099999999999997e-002 | AD125: -2.2799999999999997e-002 | AE125: 86.94 | AF125: 89.32 | AG125: 0.62 | AH125: AA | AI125: 4.5400000000000003e-002 | AJ125: =H125+100*O125 -> 126.09 | AK125: 126 | AL125: 42 | AM125: 36.7 | AN125: 73 | AO125: 4.0000000000000001e-003 | AP125: 9 | AQ125: 景兴转债
A126: 180 | B126: 128073 | C126: 哈尔转债! | D126: 2615 | E126: 哈尔斯 | F126: 其他 | G126: 家居用品 | H126: 114.122 | I126: -2.3999999999999998e-003 | J126: 1.1299999999999999e-002 | K126: 5.73 | L126: 1.4199999999999999e-002 | M126: 115.3 | N126: 5.72 | O126: 0.13900000000000001 | P126: 100.17 | Q126: 转股中 | R126: 3.79年 | S126: 1.79年 | T126: 2.99 | U126: 192 | V126: 0.55700000000000005 | W126: 0.127 | X126: 0.127 | Y126: 24 | Z126: 2.95 | AA126: 2.7000000000000001e-003 | AB126: -4.4000000000000003e-003 | AC126: -5.5800000000000002e-002 | AD126: -5.7699999999999994e-002 | AE126: 90.4 | AF126: 91.34 | AG126: 0.63 | AH126: AA- | AI126: 6.4299999999999996e-002 | AJ126: =H126+100*O126 -> 128.02199999999999 | AK126: 128.1 | AL126: 70 | AM126: 36.7 | AN126: 76 | AO126: 1.9e-002 | AP126: 38 | AQ126: 哈尔转债!
A127: 266 | B127: 127006 | C127: 敖东转债! | D127: 623 | E127: 吉林敖东 | F127: 金融 | G127: 证券行业 | H127: 107.1 | I127: 5.0000000000000001e-004 | J127: -1.8e-003 | K127: 17.02 | L127: -4.0999999999999995e-003 | M127: 108 | N127: 20.42 | O127: 0.28499999999999998 | P127: 83.35 | Q127: 转股中 | R127: 3.35年 | S127: 1.35年 | T127: 24.1 | U127: 9.6 | V127: 4.0000000000000001e-003 | W127: 0.122 | X127: 0.10099999999999999 | Y127: 198 | Z127: 0.87 | AA127: 2.5000000000000001e-003 | AB127: -2.e-003 | AC127: -3.4000000000000002e-002 | AD127: -3.61e-002 | AE127: 95.66 | AF127: 94.5 | AG127: 0.32 | AH127: AA+ | AI127: 4.1299999999999996e-002 | AJ127: =H127+100*O127 -> 135.59999999999999 | AK127: 130.9 | AL127: 103 | AM127: 35.2 | AN127: 58 | AO127: -6.9999999999999993e-003 | AP127: 26 | AQ127: 敖东转债!
A128: 124 | B128: 113567 | C128: 君禾转债 | D128: 603617 | E128: 君禾股份 | F128: 机械装备 | G128: 通用设备 | H128: 118.17 | I128: 7.8000000000000005e-003 | J128: -7.0999999999999995e-003 | K128: 12.7 | L128: 8.0000000000000004e-004 | M128: 119.3 | N128: 11.46 | O128: 6.6000000000000003e-002 | P128: 110.82 | Q128: 转股中 | R128: 5.32年 | S128: 3.32年 | T128: 2.1 | U128: 7.2 | V128: 2.8999999999999998e-002 | W128: 8.3000000000000004e-002 | X128: 9.1999999999999998e-002 | Y128: 25 | Z128: 3.93 | AA128: 1.8e-003 | AB128: -4.5000000000000005e-003 | AC128: -3.5200000000000002e-002 | AD128: -3.7499999999999999e-002 | AE128: 80.84 | AF128: 81.05 | AG128: 0.79 | AH128: A+ | AI128: 7.7399999999999997e-002 | AJ128: =H128+100*O128 -> 124.77 | AK128: 125.5 | AL128: 31 | AM128: 44.5 | AN128: 156 | AO128: 2.4e-002 | AP128: 32 | AQ128: 君禾转债
A129: 88 | B129: 128107 | C129: 交科转债 | D129: 2061 | E129: 浙江交科 | F129: 建筑 | G129: 建筑工程 | H129: 114.2 | I129: -1.6000000000000001e-003 | J129: 5.0000000000000001e-004 | K129: 5.37 | L129: -1.9e-003 | M129: 115.3 | N129: 5.36 | O129: 0.14000000000000001 | P129: 100.19 | Q129: 转股中 | R129: 5.45年 | S129: 3.45年 | T129: 25 | U129: 3.5 | V129: 1.e-003 | W129: 0.33799999999999997 | X129: 0.33899999999999997 | Y129: 74 | Z129: 0.92 | AA129: 1.8e-003 | AB129: -3.2000000000000002e-003 | AC129: -2.63e-002 | AD129: -2.8199999999999999e-002 | AE129: 89.14 | AF129: 91.88 | AG129: 0.61 | AH129: AA+ | AI129: 4.3400000000000001e-002 | AJ129: =H129+100*O129 -> 128.20000000000002 | AK129: 128.2 | AL129: 71 | AM129: 36.3 | AN129: 69 | AO129: -4.8000000000000001e-002 | AP129: 13 | AQ129: 交科转债
A130: 15 | B130: 128129 | C130: 青农转债 | D130: 2958 | E130: 青农商行 | F130: 金融 | G130: 银行行业 | H130: 111.05 | I130: 1.4000000000000002e-003 | J130: -2.3e-003 | K130: 4.81 | L130: -2.0999999999999999e-003 | M130: 112.2 | N130: 5.74 | O130: 0.32500000000000001 | P130: 83.8 | Q130: 3月24天 | R130: 5.80年 | S130: 无权 | T130: 50 | U130: 22 | V130: 4.0000000000000001e-003 | W130: 0.187 | X130: 0.157 | Y130: 267 | Z130: 1.04 | AA130: 1.8e-003 | AB130: -2.e-003 | AC130: 无权 | AD130: 无权 | AE130: 无权 | AF130: 89.47 | AG130: 0.44 | AH130: AAA | AI130: 4.0399999999999998e-002 | AJ130: =H130+100*O130 -> 143.55000000000001 | AK130: 138.3 | AL130: 174 | AM130: 48.8 | AN130: 190 | AO130: -4.9000000000000002e-002 | AP130: 10 | AQ130: 青农转债
A131: 107 | B131: 110068 | C131: 龙净转债! | D131: 600388 | E131: 龙净环保 | F131: 城市公用 | G131: 三废处理 | H131: 114 | I131: -1.8e-003 | J131: 1.1999999999999999e-003 | K131: 10.41 | L131: -1.e-003 | M131: 115 | N131: 10.73 | O131: 0.17499999999999999 | P131: 97.02 | Q131: 转股中 | R131: 5.38年 | S131: 3.38年 | T131: 20 | U131: 4.1 | V131: 2.e-003 | W131: 0.17999999999999999 | X131: 0.17399999999999999 | Y131: 111 | Z131: 1.93 | AA131: 1.7000000000000001e-003 | AB131: -3.3e-003 | AC131: -2.7099999999999999e-002 | AD131: -2.8900000000000002e-002 | AE131: 89.15 | AF131: 91.9 | AG131: 0.57 | AH131: AA+ | AI131: 4.3400000000000001e-002 | AJ131: =H131+100*O131 -> 131.5 | AK131: 131 | AL131: 107 | AM131: 39.1 | AN131: 105 | AO131: 6.0999999999999999e-002 | AP131: 29 | AQ131: 龙净转债!
A132: 139 | B132: 113561 | C132: 正裕转债! | D132: 603089 | E132: 正裕工业 | F132: 汽车 | G132: 零部件制 | H132: 117.59 | I132: 8.0000000000000002e-003 | J132: -5.8999999999999999e-003 | K132: 11.15 | L132: 2.7000000000000001e-003 | M132: 118.5 | N132: 10.23 | O132: 7.9000000000000001e-002 | P132: 108.99 | Q132: 转股中 | R132: 5年54天 | S132: 3年54天 | T132: 1.59 | U132: 6 | V132: 3.2000000000000001e-002 | W132: 6.4000000000000001e-002 | X132: 7.0000000000000007e-002 | Y132: 25 | Z132: 2.67 | AA132: 1.5e-003 | AB132: -4.6999999999999993e-003 | AC132: -3.5000000000000003e-002 | AD132: -3.7499999999999999e-002 | AE132: 82.07 | AF132: 81.57 | AG132: 0.78 | AH132: A+ | AI132: 7.7399999999999997e-002 | AJ132: =H132+100*O132 -> 125.49000000000001 | AK132: 126.2 | AL132: 47 | AM132: 44.1 | AN132: 154 | AO132: -9.8000000000000004e-002 | AP132: 33 | AQ132: 正裕转债!
A133: 29 | B133: 128125 | C133: 华阳转债 | D133: 2949 | E133: 华阳国际 | F133: 建筑 | G133: 建筑工程 | H133: 117.7 | I133: -1.3500000000000002e-002 | J133: 1.9e-003 | K133: 23.25 | L133: -1.9e-002 | M133: 118.5 | N133: 25.79 | O133: 0.30599999999999999 | P133: 90.15 | Q133: 3月0天 | R133: 5.73年 | S133: 3.73年 | T133: 4.5 | U133: 9.2 | V133: 1.7000000000000001e-002 | W133: 9.9000000000000005e-002 | X133: 8.900000000000001e-002 | Y133: 46 | Z133: 3.74 | AA133: 1.1999999999999999e-003 | AB133: -4.4000000000000003e-003 | AC133: -3.2000000000000001e-002 | AD133: -3.3799999999999997e-002 | AE133: 81.04 | AF133: 82.6 | AG133: 0.61 | AH133: AA- | AI133: 6.6400000000000001e-002 | AJ133: =H133+100*O133 -> 148.30000000000001 | AK133: 145.2 | AL133: 232 | AM133: 62.7 | AN133: 258 | AO133: -0.14400000000000002 | AP133: 3 | AQ133: 华阳转债
A134: 13 | B134: 123064 | C134: 万孚转债 | D134: 300482 | E134: 万孚生物 | F134: 医药 | G134: 医疗器械 | H134: 114.281 | I134: -7.6e-003 | J134: -5.1999999999999998e-003 | K134: 74.05 | L134: -3.2000000000000001e-002 | M134: 115.1 | N134: 93.55 | O134: 0.44400000000000001 | P134: 79.16 | Q134: 4月1天 | R134: 5.82年 | S134: 3.82年 | T134: 6 | U134: 11 | V134: 1.6e-002 | W134: 2.4e-002 | X134: 1.9e-002 | Y134: 254 | Z134: 9.37 | AA134: 1.1999999999999999e-003 | AB134: -3.4000000000000002e-003 | AC134: -2.4500000000000001e-002 | AD134: -2.6200000000000001e-002 | AE134: 86.93 | AF134: 89.31 | AG134: 0.4 | AH134: AA | AI134: 4.5400000000000003e-002 | AJ134: =H134+100*O134 -> 158.68100000000001 | AK134: 149.4 | AL134: 253 | AM134: 60.1 | AN134: 248 | AO134: -0.10000000000000001 | AP134: 6 | AQ134: 万孚转债
A135: 11 | B135: 128131 | C135: 崇达转2 | D135: 2815 | E135: 崇达技术 | F135: 电子 | G135: 元器件制 | H135: 114.405 | I135: 2.3e-003 | J135: -1.1999999999999999e-003 | K135: 16.67 | L135: 2.3999999999999998e-003 | M135: 115.2 | N135: 19.54 | O135: 0.34100000000000003 | P135: 85.31 | Q135: 4月4天 | R135: 5.83年 | S135: 3.83年 | T135: 14 | U135: 4.3 | V135: 3.0000000000000001e-003 | W135: 9.5000000000000001e-002 | X135: 8.1000000000000003e-002 | Y135: 147 | Z135: 3.68 | AA135: 1.1999999999999999e-003 | AB135: -3.4000000000000002e-003 | AC135: -2.4500000000000001e-002 | AD135: -2.6200000000000001e-002 | AE135: 86.96 | AF135: 89.33 | AG135: 0.47 | AH135: AA | AI135: 4.5400000000000003e-002 | AJ135: =H135+100*O135 -> 148.505 | AK135: 143.5 | AL135: 221 | AM135: 54.2 | AN135: 220 | AO135: -3.9e-002 | AP135: 4 | AQ135: 崇达转2
A136: 281 | B136: 123004 | C136: 铁汉转债! | D136: 300197 | E136: 铁汉生态 | F136: 城市公用 | G136: 生态环境 | H136: 109.6 | I136: -3.5999999999999999e-003 | J136: -9.7999999999999997e-003 | K136: 3.72 | L136: -2.87e-002 | M136: 109.8 | N136: 3.98 | O136: 0.17300000000000001 | P136: 93.47 | Q136: 转股中 | R136: 3年41天 | S136: 1年41天 | T136: 8.03 | U136: 40 | V136: 4.4999999999999998e-002 | W136: 9.1999999999999998e-002 | X136: 8.5999999999999993e-002 | Y136: 88 | Z136: 1.69 | AA136: 5.9999999999999995e-004 | AB136: -5.3e-003 | AC136: -5.1200000000000002e-002 | AD136: -5.4800000000000001e-002 | AE136: 97.19 | AF136: 96.5 | AG136: 0.47 | AH136: AA | AI136: 4.3299999999999998e-002 | AJ136: =H136+100*O136 -> 126.89999999999999 | AK136: 125.7 | AL136: 38 | AM136: 28.5 | AN136: 17 | AO136: -3.5000000000000003e-002 | AP136: 38 | AQ136: 铁汉转债!
A137: 24 | B137: 127021 | C137: 特发转2! | D137: 70 | E137: 特发信息 | F137: 通信互联 | G137: 通信设备 | H137: 113 | I137: -2.0400000000000001e-002 | J137: 3.0200000000000001e-002 | K137: 10.65 | L137: 2.3099999999999999e-002 | M137: 113.3 | N137: 12.33 | O137: 0.308 | P137: 86.37 | Q137: 3月8天 | R137: 4.75年 | S137: 2.75年 | T137: 5.5 | U137: 395 | V137: 0.63100000000000001 | W137: 6.3e-002 | X137: 5.5e-002 | Y137: 87 | Z137: 3.07 | AA137: 5.9999999999999995e-004 | AB137: -4.5000000000000005e-003 | AC137: -3.4500000000000003e-002 | AD137: -3.5799999999999998e-002 | AE137: 90.24 | AF137: 92.86 | AG137: 0.43 | AH137: AA | AI137: 4.3299999999999998e-002 | AJ137: =H137+100*O137 -> 143.80000000000001 | AK137: 139.6 | AL137: 187 | AM137: 46.8 | AN137: 174 | AO137: 5.7999999999999996e-002 | AP137: 5 | AQ137: 特发转2!
A138: 128 | B138: 113564 | C138: 天目转债 | D138: 603136 | E138: 天目湖 | F138: 旅游餐饮 | G138: 旅游 | H138: 127.12 | I138: -9.1999999999999998e-003 | J138: -3.0999999999999999e-003 | K138: 29 | L138: -1.5300000000000001e-002 | M138: 126.7 | N138: 23.8 | O138: 4.2999999999999997e-002 | P138: 121.85 | Q138: 转股中 | R138: 5.31年 | S138: 3.31年 | T138: 3 | U138: 2 | V138: 5.0000000000000001e-003 | W138: 8.900000000000001e-002 | X138: 0.109 | Y138: 34 | Z138: 3.61 | AA138: -5.9999999999999995e-004 | AB138: -8.8999999999999999e-003 | AC138: -5.5199999999999999e-002 | AD138: -5.7500000000000002e-002 | AE138: 83.93 | AF138: 90.8 | AG138: 0.81 | AH138: AA- | AI138: 6.6400000000000001e-002 | AJ138: =H138+100*O138 -> 131.42000000000002 | AK138: 132.4 | AL138: 122 | AM138: 41.6 | AN138: 127 | AO138: 8.199999999999999e-002 | AP138: 13 | AQ138: 天目转债
A139: 35 | B139: 128123 | C139: 国光转债 | D139: 2749 | E139: 国光股份 | F139: 化工 | G139: 农化 | H139: 116.58 | I139: -6.9999999999999993e-003 | J139: -9.5999999999999992e-003 | K139: 12.31 | L139: -2.6099999999999998e-002 | M139: 116.2 | N139: 13.7 | O139: 0.29699999999999999 | P139: 89.85 | Q139: 2月26天 | R139: 5.72年 | S139: 3.72年 | T139: 3.2 | U139: 1.3 | V139: 3.0000000000000001e-003 | W139: 5.9999999999999998e-002 | X139: 5.4000000000000006e-002 | Y139: 53 | Z139: 4.31 | AA139: -5.9999999999999995e-004 | AB139: -5.6000000000000008e-003 | AC139: -2.8999999999999998e-002 | AD139: -3.0899999999999997e-002 | AE139: 81.34 | AF139: 81.12 | AG139: 0.64 | AH139: AA- | AI139: 6.6400000000000001e-002 | AJ139: =H139+100*O139 -> 146.28 | AK139: 143.3 | AL139: 218 | AM139: 62 | AN139: 254 | AO139: -6.8000000000000005e-002 | AP139: 7 | AQ139: 国光转债
A140: 32 | B140: 128124 | C140: 科华转债! | D140: 2022 | E140: 科华生物 | F140: 医药 | G140: 生物制药 | H140: 110.74 | I140: -7.1999999999999998e-003 | J140: -2.18e-002 | K140: 18.71 | L140: -5.5500000000000001e-002 | M140: 110.3 | N140: 21.5 | O140: 0.27300000000000002 | P140: 87.02 | Q140: 2月28天 | R140: 5.72年 | S140: 3.72年 | T140: 7.38 | U140: 8.4 | V140: 1.e-002 | W140: 7.6999999999999999e-002 | X140: 6.7000000000000004e-002 | Y140: 96 | Z140: 3.35 | AA140: -7.000000000000001e-004 | AB140: -4.0000000000000001e-003 | AC140: -1.8500000000000003e-002 | AD140: -2.e-002 | AE140: 86.83 | AF140: 85.91 | AG140: 0.52 | AH140: AA | AI140: 4.5400000000000003e-002 | AJ140: =H140+100*O140 -> 138.03999999999999 | AK140: 134.5 | AL140: 144 | AM140: 47.6 | AN140: 181 | AO140: -5.7999999999999996e-002 | AP140: 11 | AQ140: 科华转债!
A141: 215 | B141: 110056 | C141: 亨通转债! | D141: 600487 | E141: 亨通光电 | F141: 通信互联 | G141: 通信设备 | H141: 115.2 | I141: -4.0999999999999995e-003 | J141: -2.5999999999999999e-003 | K141: 15.23 | L141: -1.23e-002 | M141: 114.8 | N141: 15.58 | O141: 0.17800000000000002 | P141: 97.75 | Q141: 转股中 | R141: 4.36年 | S141: 2.36年 | T141: 17.1 | U141: 9.2 | V141: 5.0000000000000001e-003 | W141: 5.7000000000000002e-002 | X141: 5.5999999999999994e-002 | Y141: 297 | Z141: 1.97 | AA141: -8.0000000000000004e-004 | AB141: -6.8999999999999999e-003 | AC141: -4.2599999999999999e-002 | AD141: -4.4999999999999998e-002 | AE141: 93.35 | AF141: 96.56 | AG141: 0.54 | AH141: AA+ | AI141: 4.1299999999999996e-002 | AJ141: =H141+100*O141 -> 133. | AK141: 132.6 | AL141: 123 | AM141: 36.1 | AN141: 67 | AO141: 8.0000000000000002e-003 | AP141: 29 | AQ141: 亨通转债!
A142: 5 | B142: 128134 | C142: 鸿路转债 | D142: 2541 | E142: 鸿路钢构 | F142: 建筑 | G142: 其他 | H142: 115.7 | I142: -4.0000000000000002e-004 | J142: -4.0999999999999995e-003 | K142: 38.25 | L142: -9.1000000000000004e-003 | M142: 115.1 | N142: 43.74 | O142: 0.32299999999999995 | P142: 87.45 | Q142: 5月9天 | R142: 5.92年 | S142: 3.92年 | T142: 18.8 | U142: 68 | V142: 3.1e-002 | W142: 9.4e-002 | X142: 8.199999999999999e-002 | Y142: 200 | Z142: 3.74 | AA142: -8.9999999999999998e-004 | AB142: -5.4000000000000003e-003 | AC142: -2.69e-002 | AD142: -2.8500000000000001e-002 | AE142: 86.53 | AF142: 88.89 | AG142: 0.5 | AH142: AA | AI142: 4.5400000000000003e-002 | AJ142: =H142+100*O142 -> 148. | AK142: 144 | AL142: 225 | AM142: 55.1 | AN142: 228 | AO142: -8.1000000000000003e-002 | AP142: 1 | AQ142: 鸿路转债
A143: 236 | B143: 110048 | C143: 福能转债! | D143: 600483 | E143: 福能股份 | F143: 能源电力 | G143: 电力供应 | H143: 114.71 | I143: -2.9999999999999997e-004 | J143: 6.9999999999999993e-003 | K143: 7.78 | L143: 1.3000000000000001e-002 | M143: 113.9 | N143: 8.12 | O143: 0.19699999999999998 | P143: 95.81 | Q143: 转股中 | R143: 4年30天 | S143: 2年30天 | T143: 28.3 | U143: 1.3 | V143: 0. | W143: 0.20699999999999999 | X143: 0.19800000000000001 | Y143: 137 | Z143: 0.97 | AA143: -1.8e-003 | AB143: -7.9000000000000008e-003 | AC143: -4.5599999999999995e-002 | AD143: -4.8300000000000003e-002 | AE143: 94.51 | AF143: 96.91 | AG143: 0.52 | AH143: AA+ | AI143: 4.1299999999999996e-002 | AJ143: =H143+100*O143 -> 134.41 | AK143: 133.6 | AL143: 134 | AM143: 36.7 | AN143: 75 | AO143: -2.e-002 | AP143: 9 | AQ143: 福能转债!
A144: 234 | B144: 128051 | C144: 光华转债! | D144: 2741 | E144: 光华科技 | F144: 电子 | G144: 元器件制 | H144: 116.521 | I144: -9.5999999999999992e-003 | J144: -1.8e-003 | K144: 13.36 | L144: -1.6200000000000003e-002 | M144: 115.5 | N144: 12.72 | O144: 0.109 | P144: 105.03 | Q144: 转股中 | R144: 4年37天 | S144: 2年37天 | T144: 2.5 | U144: 20 | V144: 6.7000000000000004e-002 | W144: 5.0000000000000003e-002 | X144: 5.2999999999999999e-002 | Y144: 50 | Z144: 4.13 | AA144: -2.2000000000000001e-003 | AB144: -8.8999999999999999e-003 | AC144: -5.0099999999999999e-002 | AD144: -5.3200000000000004e-002 | AE144: 90.32 | AF144: 90.03 | AG144: 0.7 | AH144: AA- | AI144: 6.4299999999999996e-002 | AJ144: =H144+100*O144 -> 127.42100000000001 | AK144: 128 | AL144: 68 | AM144: 37.7 | AN144: 88 | AO144: -5.5999999999999994e-002 | AP144: 22 | AQ144: 光华转债!
A145: 56 | B145: 123057 | C145: 美联转债 | D145: 300586 | E145: 美联新材 | F145: 化工 | G145: 橡胶塑料 | H145: 119.781 | I145: -2.5399999999999999e-002 | J145: 1.2999999999999999e-003 | K145: 11.72 | L145: -2.8999999999999998e-002 | M145: 118.2 | N145: 9.91 | O145: 1.3000000000000001e-002 | P145: 118.26 | Q145: 2月1天 | R145: 5.65年 | S145: 3.65年 | T145: 2.07 | U145: 220 | V145: 0.873 | W145: 3.9e-002 | X145: 4.5999999999999999e-002 | Y145: 53 | Z145: 7.19 | AA145: -2.3999999999999998e-003 | AB145: -8.0000000000000002e-003 | AC145: -3.6400000000000002e-002 | AD145: -3.8399999999999997e-002 | AE145: 81.7 | AF145: 82.88 | AG145: 0.83 | AH145: AA- | AI145: 6.6400000000000001e-002 | AJ145: =H145+100*O145 -> 121.081 | AK145: 121.3 | AL145: 10 | AM145: 38.4 | AN145: 95 | AO145: 6.2e-002 | AP145: 8 | AQ145: 美联转债
A146: 272 | B146: 128034 | C146: 江银转债! | D146: 2807 | E146: 江阴银行 | F146: 金融 | G146: 银行行业 | H146: 110.012 | I146: -2.5999999999999999e-003 | J146: 5.0000000000000001e-004 | K146: 4.08 | L146: -4.8999999999999998e-003 | M146: 109.1 | N146: 4.5 | O146: 0.21299999999999999 | P146: 90.67 | Q146: 转股中 | R146: 3.22年 | S146: 无权 | T146: 17.6 | U146: 4 | V146: 2.e-003 | W146: 0.19800000000000001 | X146: 0.17999999999999999 | Y146: 89 | Z146: 0.78 | AA146: -2.5999999999999999e-003 | AB146: -7.9000000000000008e-003 | AC146: 无权 | AD146: 无权 | AE146: 无权 | AF146: 95.98 | AG146: 0.44 | AH146: AA+ | AI146: 4.1299999999999996e-002 | AJ146: =H146+100*O146 -> 131.31200000000001 | AK146: 129.4 | AL146: 85 | AM146: 33.4 | AN146: 40 | AO146: -1.8000000000000002e-002 | AP146: 27 | AQ146: 江银转债!
A147: 6 | B147: 113603 | C147: 东缆转债 | D147: 603606 | E147: 东方电缆 | F147: 能源电力 | G147: 电力设备 | H147: 117 | I147: -2.8000000000000004e-003 | J147: -6.3e-003 | K147: 21.32 | L147: -1.7500000000000002e-002 | M147: 115.1 | N147: 23.88 | O147: 0.31 | P147: 89.28 | Q147: 4月23天 | R147: 5.88年 | S147: 3.88年 | T147: 8 | U147: 38 | V147: 4.0000000000000001e-002 | W147: 5.7000000000000002e-002 | X147: 5.0999999999999997e-002 | Y147: 139 | Z147: 5.15 | AA147: -2.8000000000000004e-003 | AB147: -7.4000000000000003e-003 | AC147: -2.98e-002 | AD147: -3.15e-002 | AE147: 86.69 | AF147: 89.06 | AG147: 0.52 | AH147: AA | AI147: 4.5400000000000003e-002 | AJ147: =H147+100*O147 -> 148. | AK147: 144.7 | AL147: 229 | AM147: 55.7 | AN147: 232 | AO147: -0.10400000000000001 | AP147: 3 | AQ147: 东缆转债
A148: 99 | B148: 128105 | C148: 长集转债 | D148: 2616 | E148: 长青集团 | F148: 城市公用 | G148: 三废处理 | H148: 117.525 | I148: -2.8000000000000004e-003 | J148: -7.9000000000000008e-003 | K148: 8.63 | L148: -1.6e-002 | M148: 115.3 | N148: 8.11 | O148: 0.10400000000000001 | P148: 106.41 | Q148: 转股中 | R148: 5.42年 | S148: 3.42年 | T148: 8 | U148: 2 | V148: 2.e-003 | W148: 0.125 | X148: 0.13300000000000001 | Y148: 64 | Z148: 2.54 | AA148: -3.5999999999999999e-003 | AB148: -8.6e-003 | AC148: -3.44e-002 | AD148: -3.6299999999999999e-002 | AE148: 88.67 | AF148: 91.09 | AG148: 0.67 | AH148: AA | AI148: 4.5400000000000003e-002 | AJ148: =H148+100*O148 -> 127.92500000000001 | AK148: 128.6 | AL148: 79 | AM148: 37.6 | AN148: 85 | AO148: -9.3000000000000013e-002 | AP148: 7 | AQ148: 长集转债
A149: 108 | B149: 123047 | C149: 久吾转债 | D149: 300631 | E149: 久吾高科 | F149: 机械装备 | G149: 专用设备 | H149: 133.16 | I149: -3.5000000000000003e-002 | J149: 4.0999999999999995e-003 | K149: 23.61 | L149: -3.6299999999999999e-002 | M149: 130.1 | N149: 17.61 | O149: -6.9999999999999993e-003 | P149: 134.07 | Q149: 转股中 | R149: 5.36年 | S149: 3.36年 | T149: 2.45 | U149: 242 | V149: 0.72900000000000009 | W149: 9.8000000000000004e-002 | X149: 0.13200000000000001 | Y149: 25 | Z149: 3.53 | AA149: -4.4000000000000003e-003 | AB149: -1.34e-002 | AC149: -6.3099999999999989e-002 | AD149: -6.6000000000000003e-002 | AE149: 81.85 | AF149: 88.25 | AG149: 0.85 | AH149: A+ | AI149: 7.7399999999999997e-002 | AJ149: =H149+100*O149 -> 132.46000000000001 | AK149: 132.2 | AL149: 117 | AM149: 44 | AN149: 151 | AO149: 3.4000000000000002e-002 | AP149: 21 | AQ149: 久吾转债
A150: 92 | B150: 123050 | C150: 聚飞转债 | D150: 300303 | E150: 聚飞光电 | F150: 电子 | G150: LED制 | H150: 127.12 | I150: -2.3e-003 | J150: 1.1000000000000001e-003 | K150: 6.15 | L150: -1.6000000000000001e-003 | M150: 124.2 | N150: 5.18 | O150: 7.0999999999999994e-002 | P150: 118.73 | Q150: 转股中 | R150: 5.43年 | S150: 3.43年 | T150: 7.05 | U150: 7.4 | V150: 8.0000000000000002e-003 | W150: 8.9999999999999997e-002 | X150: 0.106 | Y150: 79 | Z150: 3.39 | AA150: -4.4000000000000003e-003 | AB150: -1.1699999999999999e-002 | AC150: -5.45e-002 | AD150: -5.6500000000000002e-002 | AE150: 82.83 | AF150: 88.25 | AG150: 0.79 | AH150: AA- | AI150: 6.6400000000000001e-002 | AJ150: =H150+100*O150 -> 134.22 | AK150: 135.5 | AL150: 153 | AM150: 47.3 | AN150: 177 | AO150: -2.6000000000000002e-002 | AP150: 11 | AQ150: 聚飞转债
A151: 273 | B151: 123007 | C151: 道氏转债!! | D151: 300409 | E151: 道氏技术 | F151: 建筑 | G151: 建筑行业 | H151: 112.871 | I151: -2.53e-002 | J151: -1.6e-002 | K151: 14.74 | L151: -6.6500000000000004e-002 | M151: 111.3 | N151: 14.95 | O151: 0.14499999999999999 | P151: 98.6 | Q151: 转股中 | R151: 3年51天 | S151: 1年51天 | T151: 3.04 | U151: 83 | V151: 0.23800000000000002 | W151: 4.4999999999999998e-002 | X151: 4.4000000000000004e-002 | Y151: 68 | Z151: 2.8 | AA151: -4.5999999999999999e-003 | AB151: -1.11e-002 | AC151: -6.9400000000000003e-002 | AD151: -7.3300000000000004e-002 | AE151: 94.88 | AF151: 91.95 | AG151: 0.62 | AH151: AA- | AI151: 6.4299999999999996e-002 | AJ151: =H151+100*O151 -> 127.371 | AK151: 127.1 | AL151: 58 | AM151: 32.3 | AN151: 32 | AO151: 2.7999999999999997e-002 | AP151: 18 | AQ151: 道氏转债!!
A152: 188 | B152: 128070 | C152: 智能转债! | D152: 2877 | E152: 智能自控 | F152: 机械装备 | G152: 通用设备 | H152: 120.211 | I152: -4.6600000000000003e-002 | J152: 4.2900000000000001e-002 | K152: 7.73 | L152: -7.7000000000000002e-003 | M152: 117.6 | N152: 9.51 | O152: 0.47899999999999998 | P152: 81.28 | Q152: 转股中 | R152: 4.65年 | S152: 无权 | T152: 2.3 | U152: 363 | V152: 1.28 | W152: 8.900000000000001e-002 | X152: 7.2999999999999995e-002 | Y152: 26 | Z152: 3.6 | AA152: -4.7999999999999996e-003 | AB152: -1.1399999999999999e-002 | AC152: 无权 | AD152: 无权 | AE152: 无权 | AF152: 84.58 | AG152: 0.48 | AH152: A+ | AI152: 7.5300000000000006e-002 | AJ152: =H152+100*O152 -> 168.11099999999999 | AK152: 159.1 | AL152: 268 | AM152: 74.6 | AN152: 273 | AO152: -2.8999999999999998e-002 | AP152: 32 | AQ152: 智能转债!
A153: 186 | B153: 113542 | C153: 好客转债 | D153: 603898 | E153: 好莱客 | F153: 其他 | G153: 家居用品 | H153: 117.72 | I153: 1.e-003 | J153: 3.0000000000000001e-003 | K153: 16.31 | L153: 6.8000000000000005e-003 | M153: 114.9 | N153: 16.27 | O153: 0.17399999999999999 | P153: 100.25 | Q153: 转股中 | R153: 4.73年 | S153: 2.73年 | T153: 6.03 | U153: 2.4 | V153: 3.0000000000000001e-003 | W153: 0.11900000000000001 | X153: 0.11900000000000001 | Y153: 51 | Z153: 2.07 | AA153: -5.1999999999999998e-003 | AB153: -1.0800000000000001e-002 | AC153: -4.41e-002 | AD153: -4.6300000000000001e-002 | AE153: 91.55 | AF153: 94.38 | AG153: 0.59 | AH153: AA | AI153: 4.3299999999999998e-002 | AJ153: =H153+100*O153 -> 135.12 | AK153: 135.2 | AL153: 151 | AM153: 40.8 | AN153: 119 | AO153: -1.6e-002 | AP153: 18 | AQ153: 好客转债
A154: 66 | B154: 128114 | C154: 正邦转债 | D154: 2157 | E154: 正邦科技 | F154: 农业 | G154: 畜牧业 | H154: 118.9 | I154: -1.26e-002 | J154: -8.0000000000000004e-004 | K154: 17.1 | L154: -2.0099999999999996e-002 | M154: 115.3 | N154: 16.09 | O154: 0.11900000000000001 | P154: 106.28 | Q154: 46天 | R154: 5.61年 | S154: 3.61年 | T154: 16 | U154: 30 | V154: 1.6e-002 | W154: 3.7000000000000005e-002 | X154: 3.9e-002 | Y154: 431 | Z154: 2.87 | AA154: -5.6000000000000008e-003 | AB154: -1.04e-002 | AC154: -3.5699999999999996e-002 | AD154: -3.7499999999999999e-002 | AE154: 88.56 | AF154: 91.28 | AG154: 0.67 | AH154: AA+ | AI154: 4.3400000000000001e-002 | AJ154: =H154+100*O154 -> 130.80000000000001 | AK154: 131.5 | AL154: 113 | AM154: 40.2 | AN154: 112 | AO154: -4.2999999999999997e-002 | AP154: 9 | AQ154: 正邦转债
A155: 235 | B155: 128050 | C155: 钧达转债! | D155: 2865 | E155: 钧达股份 | F155: 汽车 | G155: 零部件制 | H155: 126.7 | I155: 2.3399999999999997e-002 | J155: 5.16e-002 | K155: 19.18 | L155: 9.2899999999999996e-002 | M155: 123.5 | N155: 14.85 | O155: -1.9e-002 | P155: 129.16 | Q155: 转股中 | R155: 4年33天 | S155: 2年33天 | T155: 2.99 | U155: 1958. | V155: 5.0700000000000003 | W155: 0.129 | X155: 0.16699999999999998 | Y155: 23 | Z155: 2.68 | AA155: -6.4000000000000003e-003 | AB155: -1.5900000000000001e-002 | AC155: -8.5500000000000007e-002 | AD155: -8.8300000000000003e-002 | AE155: 90.4 | AF155: 96.31 | AG155: 0.81 | AH155: AA- | AI155: 6.4299999999999996e-002 | AJ155: =H155+100*O155 -> 124.8 | AK155: 124.2 | AL155: 22 | AM155: 27.9 | AN155: 8 | AO155: 0.14199999999999999 | AP155: 62 | AQ155: 钧达转债!
A156: 213 | B156: 123024 | C156: 岱勒转债! | D156: 300700 | E156: 岱勒新材 | F156: 机械装备 | G156: 专用设备 | H156: 115.448 | I156: -2.5099999999999997e-002 | J156: -5.1000000000000004e-003 | K156: 25.73 | L156: -4.3799999999999999e-002 | M156: 113 | N156: 24.9 | O156: 0.11699999999999999 | P156: 103.33 | Q156: 转股中 | R156: 3.37年 | S156: 1.37年 | T156: 2.1 | U156: 159 | V156: 0.65000000000000002 | W156: 9.9000000000000005e-002 | X156: 0.10199999999999999 | Y156: 21 | Z156: 4.3 | AA156: -6.4000000000000003e-003 | AB156: -1.3300000000000001e-002 | AC156: -7.9399999999999998e-002 | AD156: -8.14e-002 | AE156: 91.08 | AF156: 88.78 | AG156: 0.69 | AH156: A+ | AI156: 7.5300000000000006e-002 | AJ156: =H156+100*O156 -> 127.148 | AK156: 127.6 | AL156: 61 | AM156: 36.5 | AN156: 72 | AO156: 5.2999999999999999e-002 | AP156: 33 | AQ156: 岱勒转债!
A157: 9 | B157: 123066 | C157: 赛意转债 | D157: 300687 | E157: 赛意信息 | F157: 计算机及 | G157: 软件开发 | H157: 126.11 | I157: -2.2099999999999998e-002 | J157: 9.1999999999999998e-003 | K157: 28.05 | L157: -1.5100000000000001e-002 | M157: 121.4 | N157: 22.58 | O157: 1.4999999999999999e-002 | P157: 124.22 | Q157: 4月15天 | R157: 5.86年 | S157: 3.86年 | T157: 3.2 | U157: 60 | V157: 0.14699999999999999 | W157: 5.2999999999999999e-002 | X157: 6.5000000000000002e-002 | Y157: 61 | Z157: 6.43 | AA157: -6.6e-003 | AB157: -1.2699999999999999e-002 | AC157: -4.6500000000000007e-002 | AD157: -4.8399999999999999e-002 | AE157: 77.52 | AF157: 79.18 | AG157: 0.86 | AH157: A+ | AI157: 7.7399999999999997e-002 | AJ157: =H157+100*O157 -> 127.61 | AK157: 128 | AL157: 67 | AM157: 48.8 | AN157: 189 | AO157: 3.7999999999999999e-002 | AP157: 4 | AQ157: 赛意转债
A158: 225 | B158: 128056 | C158: 今飞转债! | D158: 2863 | E158: 今飞凯达 | F158: 汽车 | G158: 零部件制 | H158: 124.99 | I158: 4.3e-003 | J158: -3.3e-003 | K158: 8.36 | L158: 1.1999999999999999e-003 | M158: 121 | N158: 6.76 | O158: 1.1000000000000001e-002 | P158: 123.67 | Q158: 转股中 | R158: 4.31年 | S158: 2.31年 | T158: 2.37 | U158: 50 | V158: 0.17100000000000001 | W158: 7.2000000000000008e-002 | X158: 8.900000000000001e-002 | Y158: 33 | Z158: 2.83 | AA158: -7.7000000000000002e-003 | AB158: -1.5900000000000001e-002 | AC158: -7.1800000000000003e-002 | AD158: -7.4700000000000003e-002 | AE158: 87.25 | AF158: 89.21 | AG158: 0.84 | AH158: A+ | AI158: 7.5300000000000006e-002 | AJ158: =H158+100*O158 -> 126.08999999999999 | AK158: 126.3 | AL158: 49 | AM158: 37.1 | AN158: 81 | AO158: 4.2999999999999997e-002 | AP158: 58 | AQ158: 今飞转债!
A159: 115 | B159: 113572 | C159: 三祥转债! | D159: 603663 | E159: 三祥新材 | F159: 其他 | G159: 其他 | H159: 117.89 | I159: 8.0000000000000002e-003 | J159: 8.8999999999999999e-003 | K159: 15.16 | L159: 2.0899999999999998e-002 | M159: 113.2 | N159: 14.19 | O159: 0.10300000000000001 | P159: 106.84 | Q159: 转股中 | R159: 5.34年 | S159: 3.34年 | T159: 1.7 | U159: 182 | V159: 0.88300000000000001 | W159: 5.7999999999999996e-002 | X159: 6.2e-002 | Y159: 29 | Z159: 4.9 | AA159: -7.7000000000000002e-003 | AB159: -1.21e-002 | AC159: -3.6200000000000003e-002 | AD159: -3.8100000000000002e-002 | AE159: 80.05 | AF159: 76.66 | AG159: 0.81 | AH159: A+ | AI159: 7.7399999999999997e-002 | AJ159: =H159+100*O159 -> 128.19 | AK159: 128.9 | AL159: 81 | AM159: 48.9 | AN159: 191 | AO159: -6.9999999999999993e-003 | AP159: 16 | AQ159: 三祥转债!
A160: 1 | B160: 123070 | C160: N鹏辉转 | D160: 300438 | E160: 鹏辉能源 | F160: 汽车 | G160: 零部件制 | H160: 120.4 | I160: 0.20399999999999999 | J160: 0. | K160: 21.68 | L160: -3.6400000000000002e-002 | M160: 115.1 | N160: 20.16 | O160: 0.12 | P160: 107.54 | Q160: 5月20天 | R160: 5.95年 | S160: 3.95年 | T160: 8.9 | U160: 1089. | V160: 0.99199999999999999 | W160: 9.8000000000000004e-002 | X160: 0.105 | Y160: 91 | Z160: 3.68 | AA160: -7.7000000000000002e-003 | AB160: -1.21e-002 | AC160: -3.61e-002 | AD160: -3.7699999999999997e-002 | AE160: 86.41 | AF160: 88.77 | AG160: 0.71 | AH160: AA | AI160: 4.5400000000000003e-002 | AJ160: =H160+100*O160 -> 132.40000000000001 | AK160: 133.3 | AL160: 129 | AM160: 44.5 | AN160: 157 | AO160: 8.3000000000000004e-002 | AP160: 1 | AQ160: N鹏辉转
A161: 276 | B161: 110041 | C161: 蒙电转债! | D161: 600863 | E161: 内蒙华电 | F161: 能源电力 | G161: 电力供应 | H161: 112.96 | I161: 1.e-003 | J161: -1.e-003 | K161: 2.6 | L161: 0. | M161: 110.3 | N161: 2.69 | O161: 0.16899999999999998 | P161: 96.65 | Q161: 转股中 | R161: 3年45天 | S161: 1年45天 | T161: 18.7 | U161: 1.5 | V161: 1.e-003 | W161: 0.124 | X161: 0.12 | Y161: 151 | Z161: 1.28 | AA161: -7.8000000000000005e-003 | AB161: -1.38e-002 | AC161: -7.1199999999999999e-002 | AD161: -7.4999999999999997e-002 | AE161: 97.99 | AF161: 98.35 | AG161: 0.51 | AH161: AAA | AI161: 3.8300000000000001e-002 | AJ161: =H161+100*O161 -> 129.85999999999999 | AK161: 129.3 | AL161: 83 | AM161: 30.9 | AN161: 26 | AO161: -9.0000000000000011e-003 | AP161: 9 | AQ161: 蒙电转债!
A162: 209 | B162: 110057 | C162: 现代转债 | D162: 600420 | E162: 现代制药 | F162: 医药 | G162: 化学制药 | H162: 114.66 | I162: -6.7000000000000002e-003 | J162: -7.000000000000001e-004 | K162: 10.12 | L162: -1.1699999999999999e-002 | M162: 110.8 | N162: 9.89 | O162: 0.121 | P162: 102.33 | Q162: 转股中 | R162: 4.40年 | S162: 2.40年 | T162: 16.2 | U162: 6.6 | V162: 4.0000000000000001e-003 | W162: 0.155 | X162: 0.159 | Y162: 104 | Z162: 1.32 | AA162: -7.9000000000000008e-003 | AB162: -1.24e-002 | AC162: -4.0199999999999993e-002 | AD162: -4.2599999999999999e-002 | AE162: 93.9 | AF162: 94.24 | AG162: 0.63 | AH162: AAA | AI162: 3.8300000000000001e-002 | AJ162: =H162+100*O162 -> 126.75999999999999 | AK162: 127 | AL162: 56 | AM162: 32.8 | AN162: 35 | AO162: 1.3000000000000001e-002 | AP162: 21 | AQ162: 现代转债
A163: 118 | B163: 128099 | C163: 永高转债! | D163: 2641 | E163: 永高股份 | F163: 建筑 | G163: 建筑行业 | H163: 117.998 | I163: -1.34e-002 | J163: 3.9000000000000003e-003 | K163: 7.28 | L163: -9.4999999999999998e-003 | M163: 113.2 | N163: 6.16 | O163: -2.e-003 | P163: 118.18 | Q163: 转股中 | R163: 5.34年 | S163: 3.34年 | T163: 3.13 | U163: 9.4 | V163: 2.6000000000000002e-002 | W163: 3.7000000000000005e-002 | X163: 4.2999999999999997e-002 | Y163: 86 | Z163: 2.14 | AA163: -7.9000000000000008e-003 | AB163: -1.23e-002 | AC163: -3.6499999999999998e-002 | AD163: -3.8399999999999997e-002 | AE163: 88.88 | AF163: 89.73 | AG163: 1 | AH163: AA | AI163: 4.5400000000000003e-002 | AJ163: =H163+100*O163 -> 117.798 | AK163: 117.8 | AL163: 4 | AM163: 28.1 | AN163: 9 | AO163: -8.5999999999999993e-002 | AP163: 9 | AQ163: 永高转债!
A164: 98 | B164: 113034 | C164: 滨化转债 | D164: 601678 | E164: 滨化股份 | F164: 化工 | G164: 化工 | H164: 120.33 | I164: -8.3000000000000001e-003 | J164: 5.6000000000000008e-003 | K164: 5.59 | L164: -3.5999999999999999e-003 | M164: 115.1 | N164: 4.68 | O164: 6.9999999999999993e-003 | P164: 119.44 | Q164: 转股中 | R164: 5.42年 | S164: 3.42年 | T164: 24 | U164: 7.6 | V164: 3.0000000000000001e-003 | W164: 0.27800000000000002 | X164: 0.33200000000000002 | Y164: 86 | Z164: 1.38 | AA164: -8.3000000000000001e-003 | AB164: -1.32e-002 | AC164: -4.1200000000000001e-002 | AD164: -4.2999999999999997e-002 | AE164: 88.47 | AF164: 90.88 | AG164: 0.77 | AH164: AA | AI164: 4.5400000000000003e-002 | AJ164: =H164+100*O164 -> 121.03 | AK164: 121.2 | AL164: 8 | AM164: 30.3 | AN164: 22 | AO164: 3.3000000000000002e-002 | AP164: 27 | AQ164: 滨化转债
A165: 306 | B165: 110033 | C165: 国贸转债! | D165: 600755 | E165: 厦门国贸 | F165: 交通运输 | G165: 交通运输 | H165: 110.8 | I165: 5.0000000000000001e-004 | J165: -1.e-004 | K165: 6.9 | L165: 1.5e-003 | M165: 109.7 | N165: 7.19 | O165: 0.155 | P165: 95.97 | Q165: 转股中 | R165: 1年59天 | S165: 回售中 | T165: 12.1 | U165: 1.6 | V165: 1.e-003 | W165: 9.4e-002 | X165: 8.9999999999999997e-002 | Y165: 129 | Z165: 0.89 | AA165: -8.6999999999999994e-003 | AB165: -2.3900000000000001e-002 | AC165: 回售中 | AD165: 回售中 | AE165: 100.28 | AF165: 105.14 | AG165: 0.3 | AH165: AAA | AI165: 3.7699999999999997e-002 | AJ165: =H165+100*O165 -> 126.3 | AK165: 125.6 | AL165: 36 | AM165: 20.5 | AN165: 3 | AO165: 5.0000000000000001e-003 | AP165: 18 | AQ165: 国贸转债!
A166: 187 | B166: 113541 | C166: 荣晟转债! | D166: 603165 | E166: 荣晟环保 | F166: 造纸包装 | G166: 包装用纸 | H166: 119.74 | I166: -1.06e-002 | J166: -6.3e-003 | K166: 13.13 | L166: -2.1600000000000001e-002 | M166: 115 | N166: 11.54 | O166: 5.2000000000000005e-002 | P166: 113.78 | Q166: 转股中 | R166: 4.71年 | S166: 2.71年 | T166: 2.75 | U166: 3.8 | V166: 1.1000000000000001e-002 | W166: 8.4000000000000005e-002 | X166: 9.5000000000000001e-002 | Y166: 33 | Z166: 2.16 | AA166: -8.6999999999999994e-003 | AB166: -1.43e-002 | AC166: -4.99e-002 | AD166: -5.21e-002 | AE166: 86.69 | AF166: 86.29 | AG166: 0.78 | AH166: AA- | AI166: 6.4299999999999996e-002 | AJ166: =H166+100*O166 -> 124.94 | AK166: 125.7 | AL166: 37 | AM166: 39 | AN166: 103 | AO166: -6.2e-002 | AP166: 49 | AQ166: 荣晟转债!
A167: 4 | B167: 110075 | C167: 南航转债 | D167: 600029 | E167: 南方航空 | F167: 交通运输 | G167: 航空运输 | H167: 116.12 | I167: -1.47e-002 | J167: 1.95e-002 | K167: 5.7 | L167: 8.8000000000000005e-003 | M167: 110 | N167: 6.24 | O167: 0.27100000000000002 | P167: 91.35 | Q167: 5月15天 | R167: 5.94年 | S167: 3.94年 | T167: 160 | U167: 581 | V167: 3.1e-002 | W167: 0.183 | X167: 0.16699999999999998 | Y167: 874 | Z167: 1.21 | AA167: -9.1999999999999998e-003 | AB167: -1.2199999999999999e-002 | AC167: -3.0699999999999998e-002 | AD167: -3.1699999999999999e-002 | AE167: 86.98 | AF167: 87.19 | AG167: 0.55 | AH167: AAA | AI167: 4.0399999999999998e-002 | AJ167: =H167+100*O167 -> 143.22 | AK167: 140.9 | AL167: 200 | AM167: 53.7 | AN167: 217 | AO167: -1.3999999999999999e-002 | AP167: 6 | AQ167: 南航转债
A168: 307 | B168: 110031 | C168: 航信转债!! | D168: 600271 | E168: 航天信息 | F168: 计算机及 | G168: 软件开发 | H168: 107.6 | I168: 0. | J168: 0. | K168: 13.91 | L168: 0. | M168: 107 | N168: 21.56 | O168: 0.66799999999999993 | P168: 64.52 | Q168: 转股中 | R168: 0.59年 | S168: 回售中 | T168: 24 | U168: 11 | V168: 4.0000000000000001e-003 | W168: 9.3000000000000013e-002 | X168: 5.9999999999999998e-002 | Y168: 258 | Z168: 2.24 | AA168: -9.3999999999999986e-003 | AB168: -3.1099999999999999e-002 | AC168: 回售中 | AD168: 回售中 | AE168: 100.27 | AF168: 104.78 | AG168: 0 | AH168: AAA | AI168: 3.5799999999999998e-002 | AJ168: =H168+100*O168 -> 174.39999999999998 | AK168: 150.7 | AL168: 254 | AM168: 45.9 | AN168: 166 | AO168: -0.10199999999999999 | AP168: 14 | AQ168: 航信转债!!
A169: 184 | B169: 128071 | C169: 合兴转债! | D169: 2228 | E169: 合兴包装 | F169: 造纸包装 | G169: 包装材料 | H169: 120 | I169: -4.0999999999999995e-003 | J169: -9.4999999999999998e-003 | K169: 4.45 | L169: -2.2000000000000002e-002 | M169: 114.8 | N169: 4.28 | O169: 0.154 | P169: 103.97 | Q169: 转股中 | R169: 4.77年 | S169: 2.77年 | T169: 3 | U169: 4.9 | V169: 1.3999999999999999e-002 | W169: 5.4000000000000006e-002 | X169: 5.7000000000000002e-002 | Y169: 55 | Z169: 1.65 | AA169: -9.3999999999999986e-003 | AB169: -1.49e-002 | AC169: -5.0099999999999999e-002 | AD169: -5.21e-002 | AE169: 91.29 | AF169: 94.12 | AG169: 0.62 | AH169: AA | AI169: 4.3299999999999998e-002 | AJ169: =H169+100*O169 -> 135.40000000000001 | AK169: 136 | AL169: 157 | AM169: 41.9 | AN169: 130 | AO169: -9.0999999999999998e-002 | AP169: 25 | AQ169: 合兴转债!
A170: 46 | B170: 128121 | C170: 宏川转债 | D170: 2930 | E170: 宏川智慧 | F170: 交通运输 | G170: 物流业 | H170: 119.5 | I170: -1.32e-002 | J170: -8.3000000000000001e-003 | K170: 20.28 | L170: -2.87e-002 | M170: 113.3 | N170: 20.25 | O170: 0.193 | P170: 100.15 | Q170: 2月19天 | R170: 5.69年 | S170: 3.69年 | T170: 6.7 | U170: 6.9 | V170: 9.0000000000000011e-003 | W170: 7.400000000000001e-002 | X170: 7.4999999999999997e-002 | Y170: 90 | Z170: 4.68 | AA170: -9.4999999999999998e-003 | AB170: -1.3600000000000001e-002 | AC170: -3.6200000000000003e-002 | AD170: -3.7999999999999999e-002 | AE170: 81.2 | AF170: 79.17 | AG170: 0.75 | AH170: AA- | AI170: 6.6400000000000001e-002 | AJ170: =H170+100*O170 -> 138.80000000000001 | AK170: 138.9 | AL170: 178 | AM170: 57.6 | AN170: 238 | AO170: -2.6000000000000002e-002 | AP170: 4 | AQ170: 宏川转债
A171: 28 | B171: 113598 | C171: 法兰转债 | D171: 603966 | E171: 法兰泰克 | F171: 机械装备 | G171: 工程机械 | H171: 128.04 | I171: 1.6200000000000003e-002 | J171: -1.21e-002 | K171: 14.94 | L171: 5.4000000000000003e-003 | M171: 121.2 | N171: 13.88 | O171: 0.19 | P171: 107.64 | Q171: 3月1天 | R171: 5.73年 | S171: 3.73年 | T171: 3.3 | U171: 2.5 | V171: 6.0000000000000001e-003 | W171: 0.105 | X171: 0.113 | Y171: 32 | Z171: 2.83 | AA171: -9.7000000000000003e-003 | AB171: -1.5900000000000001e-002 | AC171: -5.2199999999999996e-002 | AD171: -5.4000000000000006e-002 | AE171: 81.27 | AF171: 84.52 | AG171: 0.75 | AH171: AA- | AI171: 6.6400000000000001e-002 | AJ171: =H171+100*O171 -> 147.03999999999999 | AK171: 148.4 | AL171: 249 | AM171: 63.9 | AN171: 261 | AO171: -1.2e-002 | AP171: 6 | AQ171: 法兰转债
A172: 167 | B172: 113548 | C172: 石英转债! | D172: 603688 | E172: 石英股份 | F172: 电子 | G172: 电子产品 | H172: 130.52 | I172: -8.6e-003 | J172: 3.0000000000000001e-003 | K172: 18.82 | L172: -6.8999999999999999e-003 | M172: 124.4 | N172: 15.1 | O172: 4.7e-002 | P172: 124.64 | Q172: 转股中 | R172: 4.97年 | S172: 2.97年 | T172: 1.23 | U172: 18 | V172: 0.109 | W172: 1.9e-002 | X172: 2.3e-002 | Y172: 66 | Z172: 3.52 | AA172: -9.7999999999999997e-003 | AB172: -1.78e-002 | AC172: -6.9500000000000006e-002 | AD172: -7.1900000000000006e-002 | AE172: 85.95 | AF172: 91.87 | AG172: 0.81 | AH172: AA- | AI172: 6.4299999999999996e-002 | AJ172: =H172+100*O172 -> 135.22 | AK172: 136.4 | AL172: 159 | AM172: 44.5 | AN172: 159 | AO172: -0.10199999999999999 | AP172: 11 | AQ172: 石英转债!
A173: 172 | B173: 128079 | C173: 英联转债! | D173: 2846 | E173: 英联股份 | F173: 造纸包装 | G173: 包装材料 | H173: 123.395 | I173: -3.0699999999999998e-002 | J173: 2.3e-002 | K173: 14.72 | L173: -8.1000000000000013e-003 | M173: 117.5 | N173: 13.41 | O173: 0.124 | P173: 109.77 | Q173: 转股中 | R173: 4.95年 | S173: 2.95年 | T173: 1.53 | U173: 73 | V173: 0.38500000000000001 | W173: 5.2000000000000005e-002 | X173: 5.7000000000000002e-002 | Y173: 29 | Z173: 3.82 | AA173: -1.e-002 | AB173: -1.61e-002 | AC173: -5.4699999999999999e-002 | AD173: -5.6799999999999996e-002 | AE173: 82.82 | AF173: 82.6 | AG173: 0.95 | AH173: A+ | AI173: 7.5300000000000006e-002 | AJ173: =H173+100*O173 -> 135.79499999999999 | AK173: 137 | AL173: 164 | AM173: 54.2 | AN173: 221 | AO173: -1.e-002 | AP173: 18 | AQ173: 英联转债!
A174: 40 | B174: 123060 | C174: 苏试转债 | D174: 300416 | E174: 苏试试验 | F174: 机械装备 | G174: 专用设备 | H174: 124.4 | I174: -2.0499999999999997e-002 | J174: -7.0999999999999995e-003 | K174: 23.35 | L174: -3.9900000000000005e-002 | M174: 117.6 | N174: 23.86 | O174: 0.27100000000000002 | P174: 97.86 | Q174: 2月21天 | R174: 5.70年 | S174: 3.70年 | T174: 3.1 | U174: 24 | V174: 6.3e-002 | W174: 6.5000000000000002e-002 | X174: 6.4000000000000001e-002 | Y174: 47 | Z174: 4.78 | AA174: -1.e-002 | AB174: -1.5300000000000001e-002 | AC174: -4.58e-002 | AD174: -4.7599999999999996e-002 | AE174: 81.26 | AF174: 82.13 | AG174: 0.69 | AH174: AA- | AI174: 6.6400000000000001e-002 | AJ174: =H174+100*O174 -> 151.5 | AK174: 150.9 | AL174: 256 | AM174: 68.8 | AN174: 266 | AO174: -9.9000000000000005e-002 | AP174: 6 | AQ174: 苏试转债
A175: 16 | B175: 113602 | C175: 景20转债 | D175: 603228 | E175: 景旺电子 | F175: 电子 | G175: 元器件制 | H175: 120.01 | I175: -5.0000000000000001e-004 | J175: -1.7000000000000001e-003 | K175: 31.48 | L175: -4.0999999999999995e-003 | M175: 113.3 | N175: 35.28 | O175: 0.34499999999999997 | P175: 89.23 | Q175: 3月24天 | R175: 5.79年 | S175: 3.79年 | T175: 17.8 | U175: 4.6 | V175: 2.e-003 | W175: 6.6000000000000003e-002 | X175: 5.9000000000000004e-002 | Y175: 268 | Z175: 4.48 | AA175: -1.01e-002 | AB175: -1.41e-002 | AC175: -3.6299999999999999e-002 | AD175: -3.7999999999999999e-002 | AE175: 87.2 | AF175: 88.03 | AG175: 0.54 | AH175: AA | AI175: 4.5400000000000003e-002 | AJ175: =H175+100*O175 -> 154.50999999999999 | AK175: 150.8 | AL175: 255 | AM175: 62.8 | AN175: 259 | AO175: -6.3e-002 | AP175: 5 | AQ175: 景20转债
A176: 70 | B176: 128111 | C176: 中矿转债 | D176: 2738 | E176: 中矿资源 | F176: 有色金属 | G176: 有色行业 | H176: 131.9 | I176: 4.6999999999999993e-003 | J176: 5.0000000000000001e-003 | K176: 21.02 | L176: 1.11e-002 | M176: 124.7 | N176: 15.53 | O176: -2.5000000000000001e-002 | P176: 135.35 | Q176: 40天 | R176: 5.59年 | S176: 3.59年 | T176: 8 | U176: 177 | V176: 0.16399999999999998 | W176: 0.13699999999999998 | X176: 0.185 | Y176: 58 | Z176: 2.17 | AA176: -1.0200000000000001e-002 | AB176: -1.7399999999999999e-002 | AC176: -6.0400000000000002e-002 | AD176: -6.25e-002 | AE176: 82.4 | AF176: 87.77 | AG176: 0.88 | AH176: AA- | AI176: 6.6400000000000001e-002 | AJ176: =H176+100*O176 -> 129.40000000000001 | AK176: 128.4 | AL176: 76 | AM176: 40.7 | AN176: 117 | AO176: 7.0000000000000007e-002 | AP176: 6 | AQ176: 中矿转债
A177: 86 | B177: 113579 | C177: 健友转债 | D177: 603707 | E177: 健友股份 | F177: 医药 | G177: 原料药 | H177: 120.86 | I177: 5.7999999999999996e-003 | J177: -1.01e-002 | K177: 39.58 | L177: -7.4999999999999997e-003 | M177: 114.2 | N177: 42.05 | O177: 0.28399999999999997 | P177: 94.13 | Q177: 转股中 | R177: 5.46年 | S177: 3.46年 | T177: 5.03 | U177: 6.8 | V177: 1.1000000000000001e-002 | W177: 1.3999999999999999e-002 | X177: 1.3000000000000001e-002 | Y177: 370 | Z177: 10.79 | AA177: -1.0500000000000001e-002 | AB177: -1.5100000000000001e-002 | AC177: -4.1700000000000001e-002 | AD177: -4.36e-002 | AE177: 88.42 | AF177: 90.05 | AG177: 0.57 | AH177: AA | AI177: 4.5400000000000003e-002 | AJ177: =H177+100*O177 -> 149.25999999999999 | AK177: 147.6 | AL177: 242 | AM177: 57.5 | AN177: 237 | AO177: -3.0000000000000001e-003 | AP177: 7 | AQ177: 健友转债
A178: 62 | B178: 123056 | C178: 雪榕转债 | D178: 300511 | E178: 雪榕生物 | F178: 农业 | G178: 种植业 | H178: 128.352 | I178: -5.4000000000000003e-003 | J178: -1.1699999999999999e-002 | K178: 14.56 | L178: -2.0199999999999999e-002 | M178: 121.1 | N178: 11.89 | O178: 4.8000000000000001e-002 | P178: 122.46 | Q178: 58天 | R178: 5.63年 | S178: 3.63年 | T178: 5.85 | U178: 6 | V178: 8.0000000000000002e-003 | W178: 9.0999999999999998e-002 | X178: 0.111 | Y178: 64 | Z178: 3.36 | AA178: -1.0500000000000001e-002 | AB178: -1.6799999999999999e-002 | AC178: -5.4400000000000004e-002 | AD178: -5.62e-002 | AE178: 81.71 | AF178: 84.98 | AG178: 0.85 | AH178: AA- | AI178: 6.6400000000000001e-002 | AJ178: =H178+100*O178 -> 133.15200000000002 | AK178: 134.2 | AL178: 141 | AM178: 49.3 | AN178: 196 | AO178: -8.900000000000001e-002 | AP178: 10 | AQ178: 雪榕转债
A179: 95 | B179: 128106 | C179: 华统转债 | D179: 2840 | E179: 华统股份 | F179: 农业 | G179: 农产品加 | H179: 119.944 | I179: -6.0000000000000001e-003 | J179: -5.6999999999999993e-003 | K179: 9.95 | L179: -1.6799999999999999e-002 | M179: 113.2 | N179: 9.39 | O179: 0.13200000000000001 | P179: 105.96 | Q179: 转股中 | R179: 5.42年 | S179: 3.42年 | T179: 5.5 | U179: 1.5 | V179: 2.e-003 | W179: 0.124 | X179: 0.13100000000000001 | Y179: 44 | Z179: 2.66 | AA179: -1.0800000000000001e-002 | AB179: -1.5100000000000001e-002 | AC179: -4.0099999999999997e-002 | AD179: -4.1900000000000007e-002 | AE179: 88.56 | AF179: 89.41 | AG179: 0.7 | AH179: AA | AI179: 4.5400000000000003e-002 | AJ179: =H179+100*O179 -> 133.14400000000001 | AK179: 133.9 | AL179: 138 | AM179: 44.5 | AN179: 158 | AO179: -3.7999999999999999e-002 | AP179: 7 | AQ179: 华统转债
A180: 82 | B180: 128108 | C180: 蓝帆转债 | D180: 2382 | E180: 蓝帆医疗 | F180: 医药 | G180: 医疗器械 | H180: 120.22 | I180: -2.7799999999999998e-002 | J180: -5.6000000000000008e-003 | K180: 20.96 | L180: -4.2900000000000001e-002 | M180: 113.3 | N180: 17.79 | O180: 2.e-002 | P180: 117.82 | Q180: 26天 | R180: 5.55年 | S180: 4.55年 | T180: 31.4 | U180: 505 | V180: 0.13400000000000001 | W180: 0.156 | X180: 0.183 | Y180: 202 | Z180: 2.11 | AA180: -1.0800000000000001e-002 | AB180: -1.5100000000000001e-002 | AC180: -2.7400000000000001e-002 | AD180: -2.9600000000000001e-002 | AE180: 85.95 | AF180: 88.98 | AG180: 0.78 | AH180: AA | AI180: 4.5400000000000003e-002 | AJ180: =H180+100*O180 -> 122.22 | AK180: 122.6 | AL180: 14 | AM180: 33.6 | AN180: 43 | AO180: -0.14699999999999999 | AP180: 20 | AQ180: 蓝帆转债
A181: 148 | B181: 113556 | C181: 至纯转债! | D181: 603690 | E181: 至纯科技 | F181: 机械装备 | G181: 专用设备 | H181: 134.15 | I181: 1.84e-002 | J181: 5.4000000000000003e-003 | K181: 35.99 | L181: 2.8300000000000002e-002 | M181: 126.8 | N181: 29.37 | O181: 9.5000000000000001e-002 | P181: 122.54 | Q181: 转股中 | R181: 5年43天 | S181: 3年43天 | T181: 2.96 | U181: 324 | V181: 0.81400000000000006 | W181: 3.2000000000000001e-002 | X181: 3.9e-002 | Y181: 94 | Z181: 6.1 | AA181: -1.1200000000000002e-002 | AB181: -1.9599999999999999e-002 | AC181: -7.3499999999999996e-002 | AD181: -7.5899999999999995e-002 | AE181: 82.26 | AF181: 87.41 | AG181: 0.84 | AH181: A+ | AI181: 7.7399999999999997e-002 | AJ181: =H181+100*O181 -> 143.65000000000001 | AK181: 145.8 | AL181: 235 | AM181: 58.3 | AN181: 242 | AO181: 2.9999999999999999e-002 | AP181: 13 | AQ181: 至纯转债!
A182: 133 | B182: 113563 | C182: 柳药转债 | D182: 603368 | E182: 柳药股份 | F182: 医药 | G182: 医药商业 | H182: 119.99 | I182: -1.1999999999999999e-003 | J182: 1.1999999999999999e-003 | K182: 24.75 | L182: 0. | M182: 113.2 | N182: 24.47 | O182: 0.18600000000000003 | P182: 101.14 | Q182: 转股中 | R182: 5.19年 | S182: 3.19年 | T182: 8.02 | U182: 4.4 | V182: 5.0000000000000001e-003 | W182: 8.900000000000001e-002 | X182: 8.9999999999999997e-002 | Y182: 90 | Z182: 1.87 | AA182: -1.1399999999999999e-002 | AB182: -1.5900000000000001e-002 | AC182: -4.2900000000000001e-002 | AD182: -4.4900000000000002e-002 | AE182: 89.48 | AF182: 90.32 | AG182: 0.65 | AH182: AA | AI182: 4.5400000000000003e-002 | AJ182: =H182+100*O182 -> 138.59 | AK182: 138.8 | AL182: 177 | AM182: 48.5 | AN182: 186 | AO182: 6.2e-002 | AP182: 15 | AQ182: 柳药转债
A183: 123 | B183: 128098 | C183: 康弘转债! | D183: 2773 | E183: 康弘药业 | F183: 医药 | G183: 化学制药 | H183: 123.45 | I183: -1.e-002 | J183: 1.e-003 | K183: 43.69 | L183: -9.1000000000000004e-003 | M183: 116.3 | N183: 35.3 | O183: -3.0000000000000001e-003 | P183: 123.77 | Q183: 转股中 | R183: 5.32年 | S183: 3.32年 | T183: 4.89 | U183: 35 | V183: 5.9000000000000004e-002 | W183: 1.3000000000000001e-002 | X183: 1.6e-002 | Y183: 384 | Z183: 7.56 | AA183: -1.1399999999999999e-002 | AB183: -1.67e-002 | AC183: -4.8899999999999999e-002 | AD183: -5.0799999999999998e-002 | AE183: 89.05 | AF183: 92.26 | AG183: 1 | AH183: AA | AI183: 4.5400000000000003e-002 | AJ183: =H183+100*O183 -> 123.15000000000001 | AK183: 123.1 | AL183: 15 | AM183: 30.9 | AN183: 25 | AO183: 1.e-003 | AP183: 22 | AQ183: 康弘转债!
A184: 143 | B184: 123038 | C184: 联得转债! | D184: 300545 | E184: 联得装备 | F184: 机械装备 | G184: 专用设备 | H184: 126.3 | I184: -1.15e-002 | J184: 1.26e-002 | K184: 29.26 | L184: 1.4000000000000002e-003 | M184: 119.1 | N184: 25.29 | O184: 9.1999999999999998e-002 | P184: 115.7 | Q184: 转股中 | R184: 5年48天 | S184: 3年48天 | T184: 1.47 | U184: 50 | V184: 0.26800000000000002 | W184: 3.4000000000000002e-002 | X184: 4.0000000000000001e-002 | Y184: 43 | Z184: 5.58 | AA184: -1.1599999999999999e-002 | AB184: -1.8000000000000002e-002 | AC184: -5.6900000000000006e-002 | AD184: -5.9200000000000003e-002 | AE184: 81.9 | AF184: 82.03 | AG184: 0.83 | AH184: A+ | AI184: 7.7399999999999997e-002 | AJ184: =H184+100*O184 -> 135.5 | AK184: 136.9 | AL184: 163 | AM184: 54.9 | AN184: 226 | AO184: -4.7e-002 | AP184: 15 | AQ184: 联得转债!
A185: 163 | B185: 123035 | C185: 利德转债! | D185: 300296 | E185: 利亚德 | F185: 电子 | G185: LED制 | H185: 122.701 | I185: -1.e-003 | J185: -1.26e-002 | K185: 7.15 | L185: -2.1899999999999999e-002 | M185: 115.6 | N185: 6.98 | O185: 0.19800000000000001 | P185: 102.44 | Q185: 转股中 | R185: 5年7天 | S185: 3年7天 | T185: 8 | U185: 8.3 | V185: 8.0000000000000002e-003 | W185: 4.4000000000000004e-002 | X185: 4.4999999999999998e-002 | Y185: 182 | Z185: 2.13 | AA185: -1.21e-002 | AB185: -1.7500000000000002e-002 | AC185: -5.0999999999999997e-002 | AD185: -5.3200000000000004e-002 | AE185: 91.11 | AF185: 93.88 | AG185: 0.62 | AH185: AA+ | AI185: 4.3400000000000001e-002 | AJ185: =H185+100*O185 -> 142.501 | AK185: 143 | AL185: 214 | AM185: 49.1 | AN185: 194 | AO185: -6.2e-002 | AP185: 16 | AQ185: 利德转债!
A186: 80 | B186: 127017 | C186: 万青转债 | D186: 789 | E186: 万年青 | F186: 建筑 | G186: 水泥 | H186: 126.6 | I186: -1.8600000000000002e-002 | J186: 1.8600000000000002e-002 | K186: 14.92 | L186: 0. | M186: 118.4 | N186: 14.16 | O186: 0.20199999999999999 | P186: 105.37 | Q186: 32天 | R186: 5.57年 | S186: 3.57年 | T186: 10 | U186: 16 | V186: 1.2e-002 | W186: 8.4000000000000005e-002 | X186: 8.900000000000001e-002 | Y186: 119 | Z186: 2.15 | AA186: -1.2199999999999999e-002 | AB186: -1.78e-002 | AC186: -5.2400000000000002e-002 | AD186: -5.4100000000000002e-002 | AE186: 88.64 | AF186: 93.87 | AG186: 0.64 | AH186: AA+ | AI186: 4.3400000000000001e-002 | AJ186: =H186+100*O186 -> 146.79999999999998 | AK186: 147.8 | AL186: 247 | AM186: 54 | AN186: 218 | AO186: 4.0000000000000001e-003 | AP186: 7 | AQ186: 万青转债
A187: 36 | B187: 110073 | C187: 国投转债 | D187: 600061 | E187: 国投资本 | F187: 金融 | G187: 证券行业 | H187: 118.5 | I187: 8.0000000000000004e-004 | J187: -5.8999999999999999e-003 | K187: 14.2 | L187: -9.1000000000000004e-003 | M187: 110.5 | N187: 15.25 | O187: 0.27300000000000002 | P187: 93.11 | Q187: 2月26天 | R187: 5.71年 | S187: 无权 | T187: 80 | U187: 96 | V187: 1.e-002 | W187: 0.13300000000000001 | X187: 0.124 | Y187: 600 | Z187: 1.44 | AA187: -1.23e-002 | AB187: -1.5600000000000001e-002 | AC187: 无权 | AD187: 无权 | AE187: 无权 | AF187: 88.38 | AG187: 0.56 | AH187: AAA | AI187: 4.0399999999999998e-002 | AJ187: =H187+100*O187 -> 145.80000000000001 | AK187: 143.9 | AL187: 224 | AM187: 55.5 | AN187: 230 | AO187: -3.7000000000000005e-002 | AP187: 20 | AQ187: 国投转债
A188: 260 | B188: 128040 | C188: 华通转债! | D188: 2758 | E188: 华通医药 | F188: 医药 | G188: 医药商业 | H188: 117.606 | I188: 2.3999999999999998e-003 | J188: -1.0800000000000001e-002 | K188: 11.48 | L188: -1.29e-002 | M188: 112.3 | N188: 11.29 | O188: 0.157 | P188: 101.68 | Q188: 转股中 | R188: 3.60年 | S188: 1.60年 | T188: 2.22 | U188: 9.6 | V188: 3.7000000000000005e-002 | W188: 9.1999999999999998e-002 | X188: 9.4e-002 | Y188: 24 | Z188: 3.8 | AA188: -1.3000000000000001e-002 | AB188: -1.9099999999999999e-002 | AC188: -7.3899999999999993e-002 | AD188: -7.6600000000000001e-002 | AE188: 92.16 | AF188: 90.13 | AG188: 0.65 | AH188: AA- | AI188: 6.4299999999999996e-002 | AJ188: =H188+100*O188 -> 133.30599999999998 | AK188: 133.5 | AL188: 133 | AM188: 41.4 | AN188: 123 | AO188: 1.2e-002 | AP188: 29 | AQ188: 华通转债!
A189: 112 | B189: 123045 | C189: 雷迪转债 | D189: 300652 | E189: 雷迪克 | F189: 汽车 | G189: 零部件制 | H189: 127.9 | I189: -5.2600000000000001e-002 | J189: -1.54e-002 | K189: 25.32 | L189: -7.8600000000000003e-002 | M189: 119.4 | N189: 20.13 | O189: 1.7000000000000001e-002 | P189: 125.78 | Q189: 转股中 | R189: 5.34年 | S189: 3.34年 | T189: 1.71 | U189: 231 | V189: 1.04 | W189: 7.2000000000000008e-002 | X189: 9.0999999999999998e-002 | Y189: 24 | Z189: 2.79 | AA189: -1.3100000000000001e-002 | AB189: -1.9199999999999998e-002 | AC189: -5.6399999999999999e-002 | AD189: -5.8700000000000002e-002 | AE189: 80.78 | AF189: 80.98 | AG189: 0.86 | AH189: A+ | AI189: 7.7399999999999997e-002 | AJ189: =H189+100*O189 -> 129.59999999999999 | AK189: 130 | AL189: 91 | AM189: 49 | AN189: 193 | AO189: -1.7000000000000001e-002 | AP189: 36 | AQ189: 雷迪转债
A190: 91 | B190: 113577 | C190: 春秋转债 | D190: 603890 | E190: 春秋电子 | F190: 电子 | G190: 电子产品 | H190: 127.32 | I190: 1.0800000000000001e-002 | J190: -1.6000000000000001e-003 | K190: 13.94 | L190: 1.09e-002 | M190: 118.2 | N190: 11.06 | O190: 1.e-002 | P190: 126.04 | Q190: 转股中 | R190: 5.43年 | S190: 3.43年 | T190: 2.33 | U190: 97 | V190: 0.32500000000000001 | W190: 4.2999999999999997e-002 | X190: 5.5e-002 | Y190: 54 | Z190: 3.18 | AA190: -1.3899999999999999e-002 | AB190: -1.9599999999999999e-002 | AC190: -5.4900000000000004e-002 | AD190: -5.6900000000000006e-002 | AE190: 82.84 | AF190: 84.03 | AG190: 0.85 | AH190: AA- | AI190: 6.6400000000000001e-002 | AJ190: =H190+100*O190 -> 128.31999999999999 | AK190: 128.6 | AL190: 78 | AM190: 44.6 | AN190: 160 | AO190: -4.0999999999999995e-002 | AP190: 9 | AQ190: 春秋转债
A191: 117 | B191: 110067 | C191: 华安转债! | D191: 600909 | E191: 华安证券 | F191: 金融 | G191: 证券行业 | H191: 119.24 | I191: -1.9e-003 | J191: -2.8000000000000004e-003 | K191: 8.22 | L191: -8.3999999999999995e-003 | M191: 110.5 | N191: 8.67 | O191: 0.25800000000000001 | P191: 94.81 | Q191: 转股中 | R191: 5.34年 | S191: 无权 | T191: 28 | U191: 21 | V191: 6.0000000000000001e-003 | W191: 9.4e-002 | X191: 8.900000000000001e-002 | Y191: 298 | Z191: 2.15 | AA191: -1.43e-002 | AB191: -1.7899999999999999e-002 | AC191: 无权 | AD191: 无权 | AE191: 无权 | AF191: 89.67 | AG191: 0.56 | AH191: AAA | AI191: 4.0399999999999998e-002 | AJ191: =H191+100*O191 -> 145.03999999999999 | AK191: 143.7 | AL191: 223 | AM191: 54 | AN191: 219 | AO191: -2.9999999999999999e-002 | AP191: 26 | AQ191: 华安转债!
A192: 191 | B192: 113027 | C192: 华钰转债!! | D192: 601020 | E192: 华钰矿业 | F192: 有色金属 | G192: 锌铅镍锡 | H192: 122.73 | I192: 5.2199999999999996e-002 | J192: -2.e-003 | K192: 11.51 | L192: 6.3799999999999996e-002 | M192: 114.9 | N192: 10.17 | O192: 8.4000000000000005e-002 | P192: 113.18 | Q192: 转股中 | R192: 4.60年 | S192: 2.60年 | T192: 3.26 | U192: 545 | V192: 1.3500000000000001 | W192: 5.0999999999999997e-002 | X192: 5.7999999999999996e-002 | Y192: 64 | Z192: 2.63 | AA192: -1.4499999999999999e-002 | AB192: -2.0099999999999996e-002 | AC192: -6.0599999999999994e-002 | AD192: -6.2699999999999992e-002 | AE192: 87.17 | AF192: 86.77 | AG192: 0.79 | AH192: AA- | AI192: 6.4299999999999996e-002 | AJ192: =H192+100*O192 -> 131.13 | AK192: 132.3 | AL192: 118 | AM192: 45.1 | AN192: 163 | AO192: 0.107 | AP192: 46 | AQ192: 华钰转债!!
A193: 221 | B193: 128057 | C193: 博彦转债 | D193: 2649 | E193: 博彦科技 | F193: 计算机及 | G193: 软件开发 | H193: 124.788 | I193: -1.e-004 | J193: 4.0000000000000001e-003 | K193: 10.77 | L193: 4.6999999999999993e-003 | M193: 117.1 | N193: 8.72 | O193: 1.e-002 | P193: 123.51 | Q193: 转股中 | R193: 4.32年 | S193: 2.32年 | T193: 5.29 | U193: 5.8 | V193: 9.0000000000000011e-003 | W193: 9.3000000000000013e-002 | X193: 0.114 | Y193: 57 | Z193: 2.02 | AA193: -1.49e-002 | AB193: -2.1700000000000001e-002 | AC193: -7.2800000000000004e-002 | AD193: -7.5300000000000006e-002 | AE193: 88.89 | AF193: 90 | AG193: 0.84 | AH193: AA- | AI193: 6.4299999999999996e-002 | AJ193: =H193+100*O193 -> 125.788 | AK193: 126.1 | AL193: 45 | AM193: 36.1 | AN193: 66 | AO193: 5.5e-002 | AP193: 28 | AQ193: 博彦转债
A194: 39 | B194: 123061 | C194: 航新转债 | D194: 300424 | E194: 航新科技 | F194: 航空航天 | G194: 航空航天 | H194: 135.926 | I194: -4.9500000000000002e-002 | J194: 2.7900000000000001e-002 | K194: 19.92 | L194: -2.5000000000000001e-002 | M194: 124.8 | N194: 14.86 | O194: 1.3999999999999999e-002 | P194: 134.05 | Q194: 2月22天 | R194: 5.70年 | S194: 3.70年 | T194: 2.5 | U194: 437 | V194: 1.26 | W194: 5.2000000000000005e-002 | X194: 7.0000000000000007e-002 | Y194: 48 | Z194: 4.38 | AA194: -1.52e-002 | AB194: -2.2200000000000001e-002 | AC194: -6.59e-002 | AD194: -6.7900000000000002e-002 | AE194: 81.9 | AF194: 87.23 | AG194: 0.87 | AH194: AA- | AI194: 6.6400000000000001e-002 | AJ194: =H194+100*O194 -> 137.32599999999999 | AK194: 137.8 | AL194: 168 | AM194: 50.6 | AN194: 208 | AO194: -0.13100000000000001 | AP194: 8 | AQ194: 航新转债
A195: 243 | B195: 128048 | C195: 张行转债 | D195: 2839 | E195: 张家港行 | F195: 金融 | G195: 银行行业 | H195: 121 | I195: -2.3999999999999998e-003 | J195: -1.5e-003 | K195: 5.89 | L195: -6.7000000000000002e-003 | M195: 113.9 | N195: 5.76 | O195: 0.183 | P195: 102.26 | Q195: 转股中 | R195: 4年5.1天 | S195: 无权 | T195: 25 | U195: 7.5 | V195: 2.e-003 | W195: 0.23499999999999999 | X195: 0.23999999999999999 | Y195: 106 | Z195: 1.01 | AA195: -1.5300000000000001e-002 | AB195: -2.1400000000000002e-002 | AC195: 无权 | AD195: 无权 | AE195: 无权 | AF195: 97.18 | AG195: 0.58 | AH195: AA+ | AI195: 4.1299999999999996e-002 | AJ195: =H195+100*O195 -> 139.30000000000001 | AK195: 139.7 | AL195: 189 | AM195: 42.6 | AN195: 138 | AO195: -2.4e-002 | AP195: 14 | AQ195: 张行转债
A196: 67 | B196: 128113 | C196: 比音转债 | D196: 2832 | E196: 比音勒芬 | F196: 服装纺织 | G196: 服装行业 | H196: 127.715 | I196: -8.3999999999999995e-003 | J196: 1.5e-003 | K196: 18.03 | L196: -8.8000000000000005e-003 | M196: 117.3 | N196: 14.9 | O196: 5.5e-002 | P196: 121.01 | Q196: 44天 | R196: 5.60年 | S196: 3.60年 | T196: 6.89 | U196: 7.7 | V196: 9.0000000000000011e-003 | W196: 7.2999999999999995e-002 | X196: 8.8000000000000009e-002 | Y196: 94 | Z196: 4.39 | AA196: -1.5300000000000001e-002 | AB196: -2.06e-002 | AC196: -5.4000000000000006e-002 | AD196: -5.57e-002 | AE196: 87.95 | AF196: 91.91 | AG196: 0.78 | AH196: AA | AI196: 4.5400000000000003e-002 | AJ196: =H196+100*O196 -> 133.215 | AK196: 134.4 | AL196: 142 | AM196: 42.5 | AN196: 137 | AO196: 1.e-003 | AP196: 5 | AQ196: 比音转债
A197: 154 | B197: 113553 | C197: 金牌转债! | D197: 603180 | E197: 金牌厨柜 | F197: 其他 | G197: 家居用品 | H197: 134.84 | I197: -4.2300000000000004e-002 | J197: 4.7199999999999999e-002 | K197: 59.99 | L197: 4.8999999999999998e-003 | M197: 124.6 | N197: 44.14 | O197: -8.0000000000000002e-003 | P197: 135.91 | Q197: 转股中 | R197: 5年36天 | S197: 3年36天 | T197: 2.75 | U197: 64 | V197: 0.17199999999999999 | W197: 4.7e-002 | X197: 6.4000000000000001e-002 | Y197: 58 | Z197: 4.28 | AA197: -1.5700000000000002e-002 | AB197: -2.35e-002 | AC197: -7.6999999999999999e-002 | AD197: -7.9100000000000004e-002 | AE197: 84.62 | AF197: 90.46 | AG197: 1 | AH197: AA- | AI197: 6.6400000000000001e-002 | AJ197: =H197+100*O197 -> 134.03999999999999 | AK197: 133.8 | AL197: 135 | AM197: 43.3 | AN197: 145 | AO197: 2.5000000000000001e-002 | AP197: 15 | AQ197: 金牌转债!
A198: 270 | B198: 128035 | C198: 大族转债! | D198: 2008 | E198: 大族激光 | F198: 机械装备 | G198: 专用设备 | H198: 113.68 | I198: 7.000000000000001e-004 | J198: 6.0999999999999995e-003 | K198: 42.99 | L198: 2.7000000000000003e-002 | M198: 108 | N198: 52.1 | O198: 0.37799999999999995 | P198: 82.51 | Q198: 转股中 | R198: 3.25年 | S198: 1.25年 | T198: 23 | U198: 10 | V198: 4.0000000000000001e-003 | W198: 5.0000000000000003e-002 | X198: 4.0999999999999995e-002 | Y198: 459 | Z198: 5 | AA198: -1.5900000000000001e-002 | AB198: -2.0400000000000001e-002 | AC198: -5.8700000000000002e-002 | AD198: -6.4199999999999993e-002 | AE198: 98.62 | AF198: 94.88 | AG198: 0.25 | AH198: AA+ | AI198: 4.1299999999999996e-002 | AJ198: =H198+100*O198 -> 151.48000000000002 | AK198: 144.8 | AL198: 231 | AM198: 46.2 | AN198: 169 | AO198: 0.14800000000000002 | AP198: 19 | AQ198: 大族转债!
A199: 64 | B199: 113588 | C199: 润达转债 | D199: 603108 | E199: 润达医疗 | F199: 医药 | G199: 医疗器械 | H199: 124.9 | I199: 2.0000000000000001e-004 | J199: -2.0000000000000001e-004 | K199: 14.4 | L199: 0. | M199: 114.2 | N199: 13.36 | O199: 0.159 | P199: 107.78 | Q199: 46天 | R199: 5.61年 | S199: 3.61年 | T199: 5.5 | U199: 3.4 | V199: 5.0000000000000001e-003 | W199: 6.6000000000000003e-002 | X199: 7.0999999999999994e-002 | Y199: 83 | Z199: 2.78 | AA199: -1.61e-002 | AB199: -2.0499999999999997e-002 | AC199: -4.8499999999999995e-002 | AD199: -5.0199999999999995e-002 | AE199: 87.83 | AF199: 89.45 | AG199: 0.7 | AH199: AA | AI199: 4.5400000000000003e-002 | AJ199: =H199+100*O199 -> 140.80000000000001 | AK199: 142 | AL199: 207 | AM199: 52.6 | AN199: 213 | AO199: 5.4000000000000006e-002 | AP199: 7 | AQ199: 润达转债
A200: 219 | B200: 127011 | C200: 中鼎转2! | D200: 887 | E200: 中鼎股份 | F200: 汽车 | G200: 零部件制 | H200: 123.51 | I200: -1.3500000000000002e-002 | J200: 8.1000000000000013e-003 | K200: 11.98 | L200: -9.1000000000000004e-003 | M200: 115.2 | N200: 11.59 | O200: 0.19500000000000001 | P200: 103.36 | Q200: 转股中 | R200: 4.33年 | S200: 2.33年 | T200: 12 | U200: 8.6 | V200: 6.0000000000000001e-003 | W200: 8.199999999999999e-002 | X200: 8.5000000000000006e-002 | Y200: 146 | Z200: 1.67 | AA200: -1.6299999999999999e-002 | AB200: -2.2400000000000003e-002 | AC200: -6.8900000000000003e-002 | AD200: -7.1300000000000002e-002 | AE200: 93.69 | AF200: 97.05 | AG200: 0.6 | AH200: AA+ | AI200: 4.1299999999999996e-002 | AJ200: =H200+100*O200 -> 143.00999999999999 | AK200: 143.7 | AL200: 222 | AM200: 46.6 | AN200: 173 | AO200: 8.1000000000000003e-002 | AP200: 27 | AQ200: 中鼎转2!
A201: 50 | B201: 128119 | C201: 龙大转债 | D201: 2726 | E201: 龙大肉食 | F201: 食品饮料 | G201: 肉制品 | H201: 132.051 | I201: -1.1599999999999999e-002 | J201: -1.49e-002 | K201: 11.55 | L201: -3.4300000000000004e-002 | M201: 120.2 | N201: 9.56 | O201: 9.3000000000000013e-002 | P201: 120.82 | Q201: 2月11天 | R201: 5.68年 | S201: 3.68年 | T201: 9.5 | U201: 22 | V201: 1.7000000000000001e-002 | W201: 8.199999999999999e-002 | X201: 0.10000000000000001 | Y201: 115 | Z201: 3.73 | AA201: -1.67e-002 | AB201: -2.2599999999999999e-002 | AC201: -6.1399999999999996e-002 | AD201: -6.3e-002 | AE201: 87.55 | AF201: 93.83 | AG201: 0.77 | AH201: AA | AI201: 4.5400000000000003e-002 | AJ201: =H201+100*O201 -> 141.351 | AK201: 143.3 | AL201: 217 | AM201: 49.5 | AN201: 200 | AO201: 5.0000000000000003e-002 | AP201: 6 | AQ201: 龙大转债
A202: 78 | B202: 128109 | C202: 楚江转债 | D202: 2171 | E202: 楚江新材 | F202: 有色金属 | G202: 铜金属 | H202: 127.21 | I202: -2.3e-003 | J202: 4.5000000000000005e-003 | K202: 9.63 | L202: 3.0999999999999999e-003 | M202: 115.3 | N202: 8.73 | O202: 0.153 | P202: 110.31 | Q202: 33天 | R202: 5.57年 | S202: 3.57年 | T202: 18.3 | U202: 8.4 | V202: 4.0000000000000001e-003 | W202: 0.14199999999999999 | X202: 0.157 | Y202: 128 | Z202: 2.34 | AA202: -1.78e-002 | AB202: -2.2499999999999999e-002 | AC202: -5.3399999999999996e-002 | AD202: -5.5199999999999999e-002 | AE202: 88.07 | AF202: 90.47 | AG202: 0.71 | AH202: AA | AI202: 4.5400000000000003e-002 | AJ202: =H202+100*O202 -> 142.50999999999999 | AK202: 144.1 | AL202: 226 | AM202: 53.6 | AN202: 215 | AO202: -2.6000000000000002e-002 | AP202: 5 | AQ202: 楚江转债
A203: 79 | B203: 123051 | C203: 今天转债 | D203: 300532 | E203: 今天国际 | F203: 计算机及 | G203: 软件开发 | H203: 135.503 | I203: -1.8100000000000002e-002 | J203: 8.0000000000000002e-003 | K203: 12.33 | L203: -1.1200000000000002e-002 | M203: 122.8 | N203: 8.8 | O203: -3.3000000000000002e-002 | P203: 140.11 | Q203: 33天 | R203: 5.57年 | S203: 3.57年 | T203: 2.8 | U203: 197 | V203: 0.51100000000000001 | W203: 8.3000000000000004e-002 | X203: 0.11599999999999999 | Y203: 34 | Z203: 4.23 | AA203: -1.7899999999999999e-002 | AB203: -2.46e-002 | AC203: -6.7299999999999999e-002 | AD203: -6.9500000000000006e-002 | AE203: 79.53 | AF203: 81.89 | AG203: 0.9 | AH203: A+ | AI203: 7.7399999999999997e-002 | AJ203: =H203+100*O203 -> 132.20299999999997 | AK203: 130.9 | AL203: 104 | AM203: 49 | AN203: 192 | AO203: -2.1000000000000001e-002 | AP203: 11 | AQ203: 今天转债
A204: 202 | B204: 113025 | C204: 明泰转债! | D204: 601677 | E204: 明泰铝业 | F204: 有色金属 | G204: 铝金属 | H204: 124.68 | I204: 4.5000000000000005e-003 | J204: -5.0000000000000001e-004 | K204: 14.01 | L204: 5.0000000000000001e-003 | M204: 115.1 | N204: 11.2 | O204: -3.0000000000000001e-003 | P204: 125.09 | Q204: 转股中 | R204: 4.42年 | S204: 2.42年 | T204: 16 | U204: 70 | V204: 3.5000000000000003e-002 | W204: 0.185 | X204: 0.23199999999999998 | Y204: 86 | Z204: 1.14 | AA204: -1.83e-002 | AB204: -2.4199999999999999e-002 | AC204: -7.0300000000000001e-002 | AD204: -7.2599999999999998e-002 | AE204: 92.79 | AF204: 95.8 | AG204: 0.8 | AH204: AA | AI204: 4.3299999999999998e-002 | AJ204: =H204+100*O204 -> 124.38000000000001 | AK204: 124.3 | AL204: 23 | AM204: 28.5 | AN204: 16 | AO204: 5.5999999999999994e-002 | AP204: 33 | AQ204: 明泰转债!
A205: 210 | B205: 123025 | C205: 精测转债!! | D205: 300567 | E205: 精测电子 | F205: 电子 | G205: 液晶显示 | H205: 127.04 | I205: 7.3000000000000001e-003 | J205: -7.3000000000000001e-003 | K205: 51.37 | L205: 0. | M205: 117.3 | N205: 49.95 | O205: 0.23499999999999999 | P205: 102.84 | Q205: 转股中 | R205: 4.39年 | S205: 2.39年 | T205: 3.09 | U205: 33 | V205: 8.5000000000000006e-002 | W205: 2.4e-002 | X205: 2.5000000000000001e-002 | Y205: 127 | Z205: 8.16 | AA205: -1.84e-002 | AB205: -2.5099999999999997e-002 | AC205: -7.7399999999999997e-002 | AD205: -7.980000000000001e-002 | AE205: 88.55 | AF205: 89.79 | AG205: 0.68 | AH205: AA- | AI205: 6.4299999999999996e-002 | AJ205: =H205+100*O205 -> 150.54000000000002 | AK205: 151.2 | AL205: 257 | AM205: 61.4 | AN205: 253 | AO205: -2.4e-002 | AP205: 18 | AQ205: 精测转债!!
A206: 271 | B206: 110043 | C206: 无锡转债! | D206: 600908 | E206: 无锡银行 | F206: 金融 | G206: 银行行业 | H206: 115.79 | I206: -3.2000000000000002e-003 | J206: 4.0000000000000002e-004 | K206: 5.61 | L206: -5.3e-003 | M206: 109.1 | N206: 5.79 | O206: 0.19500000000000001 | P206: 96.89 | Q206: 转股中 | R206: 3.23年 | S206: 无权 | T206: 30 | U206: 2.5 | V206: 1.e-003 | W206: 0.28899999999999998 | X206: 0.28000000000000003 | Y206: 104 | Z206: 0.91 | AA206: -1.8500000000000003e-002 | AB206: -2.3700000000000002e-002 | AC206: 无权 | AD206: 无权 | AE206: 无权 | AF206: 95.94 | AG206: 0.53 | AH206: AA+ | AI206: 4.1299999999999996e-002 | AJ206: =H206+100*O206 -> 135.29000000000002 | AK206: 134.7 | AL206: 147 | AM206: 38.7 | AN206: 98 | AO206: -3.2000000000000001e-002 | AP206: 31 | AQ206: 无锡转债!
A207: 261 | B207: 128039 | C207: 三力转债! | D207: 2224 | E207: 三 力 士 | F207: 机械装备 | G207: 专用设备 | H207: 117.41 | I207: -2.2499999999999999e-002 | J207: 1.2e-002 | K207: 6.23 | L207: -1.4199999999999999e-002 | M207: 109.8 | N207: 5.81 | O207: 9.5000000000000001e-002 | P207: 107.23 | Q207: 转股中 | R207: 3.58年 | S207: 1.58年 | T207: 2.03 | U207: 64 | V207: 0.26700000000000002 | W207: 4.4999999999999998e-002 | X207: 4.8000000000000001e-002 | Y207: 45 | Z207: 1.94 | AA207: -1.8799999999999997e-002 | AB207: -2.3799999999999998e-002 | AC207: -7.4900000000000008e-002 | AD207: -7.7499999999999999e-002 | AE207: 92.03 | AF207: 88.19 | AG207: 0.74 | AH207: AA- | AI207: 6.4299999999999996e-002 | AJ207: =H207+100*O207 -> 126.91 | AK207: 127.6 | AL207: 63 | AM207: 35.6 | AN207: 61 | AO207: -4.2000000000000003e-002 | AP207: 19 | AQ207: 三力转债!
A208: 198 | B208: 110058 | C208: 永鼎转债! | D208: 600105 | E208: 永鼎股份 | F208: 通信互联 | G208: 通信设备 | H208: 124.89 | I208: -8.9999999999999998e-004 | J208: 2.0999999999999999e-003 | K208: 6.34 | L208: 1.6000000000000001e-003 | M208: 114.9 | N208: 5.04 | O208: -6.9999999999999993e-003 | P208: 125.79 | Q208: 转股中 | R208: 4.44年 | S208: 2.44年 | T208: 4.5 | U208: 7.8 | V208: 1.3999999999999999e-002 | W208: 5.5e-002 | X208: 6.9000000000000006e-002 | Y208: 83 | Z208: 3.11 | AA208: -1.9e-002 | AB208: -2.4799999999999999e-002 | AC208: -7.0599999999999996e-002 | AD208: -7.2800000000000004e-002 | AE208: 92.7 | AF208: 95.56 | AG208: 0.8 | AH208: AA | AI208: 4.3299999999999998e-002 | AJ208: =H208+100*O208 -> 124.19 | AK208: 124 | AL208: 21 | AM208: 28.4 | AN208: 14 | AO208: -5.0000000000000001e-003 | AP208: 52 | AQ208: 永鼎转债!
A209: 299 | B209: 113012 | C209: 骆驼转债! | D209: 601311 | E209: 骆驼股份 | F209: 汽车 | G209: 零部件制 | H209: 112.76 | I209: 9.5999999999999992e-003 | J209: -1.29e-002 | K209: 8.63 | L209: -1.15e-002 | M209: 107.8 | N209: 10.06 | O209: 0.314 | P209: 85.79 | Q209: 转股中 | R209: 2.38年 | S209: 0.38年 | T209: 5.1 | U209: 14 | V209: 2.4e-002 | W209: 5.2999999999999999e-002 | X209: 4.4999999999999998e-002 | Y209: 97 | Z209: 1.44 | AA209: -1.9099999999999999e-002 | AB209: -2.5099999999999997e-002 | AC209: -0.19399999999999998 | AD209: -0.20000000000000001 | AE209: 99.28 | AF209: 97.77 | AG209: 0.29 | AH209: AA | AI209: 4.2699999999999995e-002 | AJ209: =H209+100*O209 -> 144.16 | AK209: 139.7 | AL209: 188 | AM209: 40.5 | AN209: 115 | AO209: 3.1e-002 | AP209: 17 | AQ209: 骆驼转债!
A210: 116 | B210: 123044 | C210: 红相转债! | D210: 300427 | E210: 红相股份 | F210: 能源电力 | G210: 电力设备 | H210: 139.02 | I210: -2.4399999999999998e-002 | J210: 1.e-003 | K210: 24.4 | L210: -2.7900000000000001e-002 | M210: 125.5 | N210: 18.8 | O210: 7.0999999999999994e-002 | P210: 129.79 | Q210: 转股中 | R210: 5.34年 | S210: 3.34年 | T210: 5.5 | U210: 9.5 | V210: 1.2e-002 | W210: 6.3e-002 | X210: 8.199999999999999e-002 | Y210: 88 | Z210: 3.85 | AA210: -1.9400000000000001e-002 | AB210: -2.7099999999999999e-002 | AC210: -7.7800000000000008e-002 | AD210: -8.0100000000000005e-002 | AE210: 84.07 | AF210: 89.83 | AG210: 0.84 | AH210: AA- | AI210: 6.6400000000000001e-002 | AJ210: =H210+100*O210 -> 146.12 | AK210: 148.3 | AL210: 248 | AM210: 58.4 | AN210: 243 | AO210: -7.400000000000001e-002 | AP210: 15 | AQ210: 红相转债!
A211: 159 | B211: 110062 | C211: 烽火转债 | D211: 600498 | E211: 烽火通信 | F211: 通信互联 | G211: 通信设备 | H211: 122.5 | I211: -2.e-002 | J211: 1.7500000000000002e-002 | K211: 25.85 | L211: -3.9000000000000003e-003 | M211: 111 | N211: 25.65 | O211: 0.21600000000000003 | P211: 100.78 | Q211: 转股中 | R211: 5年25天 | S211: 3年25天 | T211: 30.9 | U211: 83 | V211: 2.2000000000000002e-002 | W211: 0.10199999999999999 | X211: 0.10300000000000001 | Y211: 302 | Z211: 2.85 | AA211: -1.9599999999999999e-002 | AB211: -2.35e-002 | AC211: -5.1200000000000002e-002 | AD211: -5.3099999999999994e-002 | AE211: 91.17 | AF211: 91.17 | AG211: 0.64 | AH211: AAA | AI211: 4.0399999999999998e-002 | AJ211: =H211+100*O211 -> 144.09999999999999 | AK211: 144.2 | AL211: 227 | AM211: 53 | AN211: 214 | AO211: 6.2e-002 | AP211: 19 | AQ211: 烽火转债
A212: 226 | B212: 110051 | C212: 中天转债! | D212: 600522 | E212: 中天科技 | F212: 通信互联 | G212: 通信设备 | H212: 124 | I212: -2.5999999999999999e-003 | J212: -3.4999999999999996e-003 | K212: 11.15 | L212: -8.8999999999999999e-003 | M212: 113.9 | N212: 10.09 | O212: 0.122 | P212: 110.51 | Q212: 转股中 | R212: 4.31年 | S212: 2.31年 | T212: 39.6 | U212: 21 | V212: 4.0000000000000001e-003 | W212: 0.11599999999999999 | X212: 0.128 | Y212: 342 | Z212: 1.56 | AA212: -1.9900000000000001e-002 | AB212: -2.5499999999999998e-002 | AC212: -7.1399999999999991e-002 | AD212: -7.3800000000000004e-002 | AE212: 93.64 | AF212: 96.02 | AG212: 0.69 | AH212: AA+ | AI212: 4.1299999999999996e-002 | AJ212: =H212+100*O212 -> 136.19999999999999 | AK212: 137.5 | AL212: 166 | AM212: 41.5 | AN212: 125 | AO212: 8.0000000000000002e-003 | AP212: 27 | AQ212: 中天转债!
A213: 132 | B213: 128096 | C213: 奥瑞转债! | D213: 2701 | E213: 奥瑞金 | F213: 造纸包装 | G213: 包装材料 | H213: 129 | I213: -8.5000000000000006e-003 | J213: -6.9999999999999993e-003 | K213: 5.63 | L213: -1.9199999999999998e-002 | M213: 116 | N213: 4.52 | O213: 3.6000000000000004e-002 | P213: 124.56 | Q213: 转股中 | R213: 5.26年 | S213: 3.26年 | T213: 8.94 | U213: 11 | V213: 9.0000000000000011e-003 | W213: 6.6000000000000003e-002 | X213: 8.3000000000000004e-002 | Y213: 135 | Z213: 2.28 | AA213: -2.0400000000000001e-002 | AB213: -2.5600000000000001e-002 | AC213: -6.0700000000000004e-002 | AD213: -6.2899999999999998e-002 | AE213: 90.37 | AF213: 93.26 | AG213: 0.8 | AH213: AA+ | AI213: 4.3400000000000001e-002 | AJ213: =H213+100*O213 -> 132.59999999999999 | AK213: 133.4 | AL213: 131 | AM213: 40.2 | AN213: 111 | AO213: -4.5999999999999999e-002 | AP213: 21 | AQ213: 奥瑞转债!
A214: 168 | B214: 110060 | C214: 天路转债! | D214: 600326 | E214: 西藏天路 | F214: 建筑 | G214: 水泥 | H214: 127.14 | I214: 1.1299999999999999e-002 | J214: 6.9999999999999993e-003 | K214: 7.97 | L214: 2.5699999999999997e-002 | M214: 114.9 | N214: 7.16 | O214: 0.14199999999999999 | P214: 111.31 | Q214: 转股中 | R214: 4.97年 | S214: 2.97年 | T214: 7.06 | U214: 59 | V214: 6.5000000000000002e-002 | W214: 9.6000000000000002e-002 | X214: 0.107 | Y214: 73 | Z214: 1.97 | AA214: -2.0499999999999997e-002 | AB214: -2.5699999999999997e-002 | AC214: -6.4199999999999993e-002 | AD214: -6.6100000000000006e-002 | AE214: 90.62 | AF214: 93.42 | AG214: 0.71 | AH214: AA | AI214: 4.3299999999999998e-002 | AJ214: =H214+100*O214 -> 141.34 | AK214: 143 | AL214: 215 | AM214: 49.5 | AN214: 203 | AO214: 2.3e-002 | AP214: 12 | AQ214: 天路转债!
A215: 72 | B215: 128110 | C215: 永兴转债 | D215: 2756 | E215: 永兴材料 | F215: 钢铁 | G215: 炼钢 | H215: 126.8 | I215: -9.3999999999999986e-003 | J215: 9.0000000000000011e-003 | K215: 19.91 | L215: -5.0000000000000001e-004 | M215: 113.2 | N215: 17.06 | O215: 8.5999999999999993e-002 | P215: 116.71 | Q215: 38天 | R215: 5.59年 | S215: 3.59年 | T215: 7 | U215: 125 | V215: 0.13600000000000001 | W215: 9.6000000000000002e-002 | X215: 0.11199999999999999 | Y215: 73 | Z215: 2.08 | AA215: -2.0499999999999997e-002 | AB215: -2.46e-002 | AC215: -5.2600000000000001e-002 | AD215: -5.4299999999999994e-002 | AE215: 87.92 | AF215: 88.76 | AG215: 0.77 | AH215: AA | AI215: 4.5400000000000003e-002 | AJ215: =H215+100*O215 -> 135.40000000000001 | AK215: 136.9 | AL215: 162 | AM215: 48.1 | AN215: 183 | AO215: 8.8000000000000009e-002 | AP215: 4 | AQ215: 永兴转债
A216: 195 | B216: 113536 | C216: 三星转债 | D216: 603578 | E216: 三星新材 | F216: 家电 | G216: 零部件制 | H216: 126.07 | I216: -2.3e-003 | J216: 3.3e-003 | K216: 24.48 | L216: 1.1999999999999999e-003 | M216: 114.8 | N216: 19.54 | O216: 6.0000000000000001e-003 | P216: 125.28 | Q216: 转股中 | R216: 4.56年 | S216: 2.56年 | T216: 1.49 | U216: 52 | V216: 0.27399999999999997 | W216: 6.6000000000000003e-002 | X216: 8.3000000000000004e-002 | Y216: 22 | Z216: 3.22 | AA216: -2.07e-002 | AB216: -2.63e-002 | AC216: -7.0999999999999994e-002 | AD216: -7.3099999999999998e-002 | AE216: 92.11 | AF216: 94.97 | AG216: 0.78 | AH216: AA | AI216: 4.3299999999999998e-002 | AJ216: =H216+100*O216 -> 126.66999999999999 | AK216: 126.9 | AL216: 55 | AM216: 31.9 | AN216: 31 | AO216: 4.4000000000000004e-002 | AP216: 38 | AQ216: 三星转债
A217: 140 | B217: 128091 | C217: 新天转债 | D217: 2873 | E217: 新天药业 | F217: 医药 | G217: 中药 | H217: 133.269 | I217: -2.2700000000000001e-002 | J217: 1.44e-002 | K217: 18.4 | L217: -1.0200000000000001e-002 | M217: 120 | N217: 16.39 | O217: 0.187 | P217: 112.26 | Q217: 转股中 | R217: 5年53天 | S217: 3年53天 | T217: 1.76 | U217: 80 | V217: 0.33700000000000002 | W217: 8.199999999999999e-002 | X217: 9.1999999999999998e-002 | Y217: 22 | Z217: 2.86 | AA217: -2.07e-002 | AB217: -2.7200000000000002e-002 | AC217: -7.0199999999999999e-002 | AD217: -7.2800000000000004e-002 | AE217: 82.44 | AF217: 82.69 | AG217: 0.82 | AH217: A+ | AI217: 7.7399999999999997e-002 | AJ217: =H217+100*O217 -> 151.96899999999999 | AK217: 154.3 | AL217: 261 | AM217: 71.6 | AN217: 269 | AO217: 4.0000000000000001e-003 | AP217: 16 | AQ217: 新天转债
A218: 76 | B218: 123052 | C218: 飞鹿转债 | D218: 300665 | E218: 飞鹿股份 | F218: 化工 | G218: 化工 | H218: 143 | I218: -1.72e-002 | J218: 8.0000000000000002e-003 | K218: 14.51 | L218: -1.0200000000000001e-002 | M218: 127.3 | N218: 9.9 | O218: -2.4e-002 | P218: 146.57 | Q218: 34天 | R218: 5.58年 | S218: 3.58年 | T218: 1.77 | U218: 203 | V218: 0.80599999999999994 | W218: 0.10000000000000001 | X218: 0.14699999999999999 | Y218: 18 | Z218: 3.74 | AA218: -2.1099999999999997e-002 | AB218: -2.8799999999999999e-002 | AC218: -7.9600000000000004e-002 | AD218: -8.1900000000000001e-002 | AE218: 79.91 | AF218: 84.91 | AG218: 0.9 | AH218: A+ | AI218: 7.7399999999999997e-002 | AJ218: =H218+100*O218 -> 140.59999999999999 | AK218: 139.4 | AL218: 182 | AM218: 54.5 | AN218: 225 | AO218: 5.9000000000000004e-002 | AP218: 12 | AQ218: 飞鹿转债
A219: 164 | B219: 110061 | C219: 川投转债 | D219: 600674 | E219: 川投能源 | F219: 能源电力 | G219: 水电 | H219: 123.48 | I219: 5.4000000000000003e-003 | J219: -3.3e-003 | K219: 10.17 | L219: 3.0000000000000001e-003 | M219: 111 | N219: 9.58 | O219: 0.16300000000000001 | P219: 106.16 | Q219: 转股中 | R219: 5年4.1天 | S219: 3年4.1天 | T219: 40 | U219: 9.7 | V219: 2.e-003 | W219: 8.900000000000001e-002 | X219: 9.5000000000000001e-002 | Y219: 448 | Z219: 1.62 | AA219: -2.1400000000000002e-002 | AB219: -2.53e-002 | AC219: -5.45e-002 | AD219: -5.6399999999999999e-002 | AE219: 91.37 | AF219: 91.38 | AG219: 0.69 | AH219: AAA | AI219: 4.0399999999999998e-002 | AJ219: =H219+100*O219 -> 139.78 | AK219: 140.8 | AL219: 199 | AM219: 49.4 | AN219: 198 | AO219: 2.8999999999999998e-002 | AP219: 15 | AQ219: 川投转债
A220: 288 | B220: 110038 | C220: 济川转债! | D220: 600566 | E220: 济川药业 | F220: 医药 | G220: 中药 | H220: 113.16 | I220: -1.e-004 | J220: -1.1999999999999999e-003 | K220: 22.6 | L220: -3.0999999999999999e-003 | M220: 108.3 | N220: 23.85 | O220: 0.19399999999999998 | P220: 94.76 | Q220: 转股中 | R220: 2年6.1天 | S220: 6.1天 | T220: 6.28 | U220: 3.7 | V220: 5.0000000000000001e-003 | W220: 3.1e-002 | X220: 2.9999999999999999e-002 | Y220: 201 | Z220: 2.73 | AA220: -2.18e-002 | AB220: -2.9300000000000003e-002 | AC220: -0.63900000000000001 | AD220: -0.64900000000000002 | AE220: 100.28 | AF220: 99.67 | AG220: 0.42 | AH220: AA | AI220: 4.2699999999999995e-002 | AJ220: =H220+100*O220 -> 132.56 | AK220: 131.6 | AL220: 114 | AM220: 31.3 | AN220: 29 | AO220: -4.0000000000000001e-003 | AP220: 19 | AQ220: 济川转债!
A221: 145 | B221: 110065 | C221: 淮矿转债! | D221: 600985 | E221: 淮北矿业 | F221: 煤炭 | G221: 煤炭开采 | H221: 124 | I221: -3.2000000000000002e-003 | J221: 7.4999999999999997e-003 | K221: 10.58 | L221: 5.6999999999999993e-003 | M221: 111 | N221: 9.33 | O221: 9.3000000000000013e-002 | P221: 113.4 | Q221: 转股中 | R221: 5年46天 | S221: 3年46天 | T221: 27.6 | U221: 11 | V221: 3.0000000000000001e-003 | W221: 0.12 | X221: 0.13600000000000001 | Y221: 230 | Z221: 1.11 | AA221: -2.18e-002 | AB221: -2.5600000000000001e-002 | AC221: -5.3899999999999997e-002 | AD221: -5.57e-002 | AE221: 90.96 | AF221: 90.96 | AG221: 0.75 | AH221: AAA | AI221: 4.0399999999999998e-002 | AJ221: =H221+100*O221 -> 133.30000000000001 | AK221: 134.6 | AL221: 146 | AM221: 43.6 | AN221: 149 | AO221: 2.7000000000000003e-002 | AP221: 21 | AQ221: 淮矿转债!
A222: 126 | B222: 113032 | C222: 桐20转债! | D222: 601233 | E222: 桐昆股份 | F222: 服装纺织 | G222: 纺织行业 | H222: 126.97 | I222: -9.0000000000000011e-003 | J222: 8.0000000000000004e-004 | K222: 15.95 | L222: -1.1200000000000002e-002 | M222: 113.1 | N222: 14.35 | O222: 0.14199999999999999 | P222: 111.15 | Q222: 转股中 | R222: 5.32年 | S222: 3.32年 | T222: 23 | U222: 11 | V222: 4.0000000000000001e-003 | W222: 7.8e-002 | X222: 8.6999999999999994e-002 | Y222: 295 | Z222: 1.5 | AA222: -2.1899999999999999e-002 | AB222: -2.6200000000000001e-002 | AC222: -5.7200000000000001e-002 | AD222: -5.9000000000000004e-002 | AE222: 89.48 | AF222: 90.64 | AG222: 0.73 | AH222: AA+ | AI222: 4.3400000000000001e-002 | AJ222: =H222+100*O222 -> 141.16999999999999 | AK222: 142.8 | AL222: 212 | AM222: 52.2 | AN222: 212 | AO222: -3.0000000000000001e-003 | AP222: 20 | AQ222: 桐20转债!
A223: 65 | B223: 123055 | C223: 晨光转债 | D223: 300138 | E223: 晨光生物 | F223: 食品饮料 | G223: 食品加工 | H223: 141.08 | I223: 4.7999999999999996e-003 | J223: 5.4000000000000003e-003 | K223: 18.16 | L223: 1.11e-002 | M223: 124.3 | N223: 12.25 | O223: -4.8000000000000001e-002 | P223: 148.24 | Q223: 46天 | R223: 5.61年 | S223: 3.61年 | T223: 6.3 | U223: 233 | V223: 0.25900000000000001 | W223: 6.8000000000000005e-002 | X223: 0.10000000000000001 | Y223: 93 | Z223: 4.83 | AA223: -2.2799999999999997e-002 | AB223: -2.9700000000000001e-002 | AC223: -7.7899999999999997e-002 | AD223: -7.9699999999999993e-002 | AE223: 82 | AF223: 87.36 | AG223: 0.92 | AH223: AA- | AI223: 6.6400000000000001e-002 | AJ223: =H223+100*O223 -> 136.28 | AK223: 133.9 | AL223: 137 | AM223: 46.6 | AN223: 172 | AO223: 9.0999999999999998e-002 | AP223: 7 | AQ223: 晨光转债
A224: 175 | B224: 113545 | C224: 金能转债 | D224: 603113 | E224: 金能科技 | F224: 煤炭 | G224: 炼焦 | H224: 128.78 | I224: 3.7000000000000002e-003 | J224: -3.7000000000000002e-003 | K224: 13.46 | L224: 0. | M224: 114.9 | N224: 11.4 | O224: 9.0999999999999998e-002 | P224: 118.07 | Q224: 转股中 | R224: 4.93年 | S224: 2.93年 | T224: 15 | U224: 11 | V224: 6.0000000000000001e-003 | W224: 0.16500000000000001 | X224: 0.19500000000000001 | Y224: 91 | Z224: 1.49 | AA224: -2.3199999999999998e-002 | AB224: -2.8399999999999998e-002 | AC224: -6.8900000000000003e-002 | AD224: -7.0800000000000002e-002 | AE224: 90.77 | AF224: 93.57 | AG224: 0.75 | AH224: AA | AI224: 4.3299999999999998e-002 | AJ224: =H224+100*O224 -> 137.88 | AK224: 139.5 | AL224: 184 | AM224: 45.9 | AN224: 167 | AO224: 8.1000000000000003e-002 | AP224: 20 | AQ224: 金能转债
A225: 287 | B225: 123002 | C225: 国祯转债!! | D225: 300388 | E225: 国祯环保 | F225: 城市公用 | G225: 三废处理 | H225: 118.331 | I225: 1.1000000000000001e-003 | J225: 5.0000000000000001e-003 | K225: 9.42 | L225: 6.4000000000000003e-003 | M225: 109.8 | N225: 8.48 | O225: 6.5000000000000002e-002 | P225: 111.08 | Q225: 转股中 | R225: 3年17天 | S225: 1年17天 | T225: 2.52 | U225: 7.3 | V225: 2.4e-002 | W225: 3.7999999999999999e-002 | X225: 4.2999999999999997e-002 | Y225: 66 | Z225: 1.74 | AA225: -2.4799999999999999e-002 | AB225: -3.0499999999999999e-002 | AC225: -0.10800000000000001 | AD225: -0.111 | AE225: 97.47 | AF225: 96.77 | AG225: 0.96 | AH225: AA | AI225: 4.3299999999999998e-002 | AJ225: =H225+100*O225 -> 124.831 | AK225: 125.6 | AL225: 34 | AM225: 28.1 | AN225: 10 | AO225: -3.3000000000000002e-002 | AP225: 12 | AQ225: 国祯转债!!
A226: 173 | B226: 128078 | C226: 太极转债! | D226: 2368 | E226: 太极股份 | F226: 计算机及 | G226: 软件开发 | H226: 132.579 | I226: 1.e-003 | J226: -1.3500000000000002e-002 | K226: 27.51 | L226: -1.26e-002 | M226: 116.9 | N226: 22.4 | O226: 8.0000000000000002e-002 | P226: 122.81 | Q226: 转股中 | R226: 4.95年 | S226: 2.95年 | T226: 9.6 | U226: 2.3 | V226: 2.e-003 | W226: 5.9999999999999998e-002 | X226: 7.400000000000001e-002 | Y226: 159 | Z226: 5.19 | AA226: -2.5499999999999998e-002 | AB226: -3.1300000000000001e-002 | AC226: -7.7199999999999991e-002 | AD226: -7.9000000000000001e-002 | AE226: 90.69 | AF226: 95.12 | AG226: 1 | AH226: AA | AI226: 4.3299999999999998e-002 | AJ226: =H226+100*O226 -> 140.57900000000001 | AK226: 142.3 | AL226: 209 | AM226: 47.2 | AN226: 176 | AO226: -8.0000000000000002e-003 | AP226: 12 | AQ226: 太极转债!
A227: 246 | B227: 128046 | C227: 利尔转债! | D227: 2258 | E227: 利尔化学 | F227: 化工 | G227: 农化 | H227: 124.799 | I227: -4.0000000000000001e-003 | J227: -1.55e-002 | K227: 19.51 | L227: -3.0299999999999997e-002 | M227: 112.3 | N227: 18.62 | O227: 0.191 | P227: 104.78 | Q227: 转股中 | R227: 3.94年 | S227: 1.94年 | T227: 8.52 | U227: 15 | V227: 1.3999999999999999e-002 | W227: 8.3000000000000004e-002 | X227: 8.6999999999999994e-002 | Y227: 102 | Z227: 2.86 | AA227: -2.6800000000000001e-002 | AB227: -3.2300000000000002e-002 | AC227: -8.8399999999999992e-002 | AD227: -9.06e-002 | AE227: 94.06 | AF227: 95.3 | AG227: 0.65 | AH227: AA | AI227: 4.3299999999999998e-002 | AJ227: =H227+100*O227 -> 143.899 | AK227: 144.8 | AL227: 230 | AM227: 49.5 | AN227: 202 | AO227: -5.2000000000000005e-002 | AP227: 10 | AQ227: 利尔转债!
A228: 125 | B228: 110066 | C228: 盛屯转债! | D228: 600711 | E228: 盛屯矿业 | F228: 有色金属 | G228: 有色行业 | H228: 133.35 | I228: 6.8000000000000005e-003 | J228: 7.7000000000000002e-003 | K228: 6.5 | L228: 1.72e-002 | M228: 115.3 | N228: 4.88 | O228: 1.e-003 | P228: 133.2 | Q228: 转股中 | R228: 5.32年 | S228: 3.32年 | T228: 23.6 | U228: 160 | V228: 5.0999999999999997e-002 | W228: 0.157 | X228: 0.20899999999999999 | Y228: 150 | Z228: 1.63 | AA228: -2.75e-002 | AB228: -3.2400000000000005e-002 | AC228: -7.0099999999999996e-002 | AD228: -7.1900000000000006e-002 | AE228: 89.08 | AF228: 91.51 | AG228: 0.84 | AH228: AA | AI228: 4.5400000000000003e-002 | AJ228: =H228+100*O228 -> 133.44999999999999 | AK228: 133.5 | AL228: 132 | AM228: 42 | AN228: 131 | AO228: 0.127 | AP228: 43 | AQ228: 盛屯转债!
A229: 97 | B229: 113576 | C229: 起步转债!! | D229: 603557 | E229: 起步股份 | F229: 服装纺织 | G229: 鞋服行业 | H229: 141.28 | I229: -1.95e-002 | J229: 3.0999999999999999e-003 | K229: 15 | L229: -1.83e-002 | M229: 121.8 | N229: 10.55 | O229: -6.0000000000000001e-003 | P229: 142.18 | Q229: 转股中 | R229: 5.42年 | S229: 3.42年 | T229: 3.02 | U229: 237 | V229: 0.55100000000000005 | W229: 4.0999999999999995e-002 | X229: 5.7999999999999996e-002 | Y229: 73 | Z229: 4.42 | AA229: -2.76e-002 | AB229: -3.4099999999999998e-002 | AC229: -8.1000000000000003e-002 | AD229: -8.3100000000000007e-002 | AE229: 83.4 | AF229: 86.71 | AG229: 0.9 | AH229: AA- | AI229: 6.6400000000000001e-002 | AJ229: =H229+100*O229 -> 140.68000000000001 | AK229: 140.4 | AL229: 194 | AM229: 53.7 | AN229: 216 | AO229: -3.2000000000000001e-002 | AP229: 28 | AQ229: 起步转债!!
A230: 103 | B230: 110069 | C230: 瀚蓝转债 | D230: 600323 | E230: 瀚蓝环境 | F230: 城市公用 | G230: 三废处理 | H230: 132 | I230: 4.0000000000000001e-003 | J230: -1.0200000000000001e-002 | K230: 24.81 | L230: -7.6e-003 | M230: 113.5 | N230: 20.2 | O230: 7.4999999999999997e-002 | P230: 122.82 | Q230: 转股中 | R230: 5.41年 | S230: 3.41年 | T230: 9.83 | U230: 4.4 | V230: 3.0000000000000001e-003 | W230: 5.2000000000000005e-002 | X230: 6.4000000000000001e-002 | Y230: 190 | Z230: 2.65 | AA230: -2.7799999999999998e-002 | AB230: -3.2099999999999997e-002 | AC230: -6.9199999999999998e-002 | AD230: -7.0300000000000001e-002 | AE230: 87.9 | AF230: 90.44 | AG230: 0.81 | AH230: AA+ | AI230: 4.3400000000000001e-002 | AJ230: =H230+100*O230 -> 139.5 | AK230: 141.2 | AL230: 201 | AM230: 50.7 | AN230: 209 | AO230: -5.2000000000000005e-002 | AP230: 7 | AQ230: 瀚蓝转债
A231: 135 | B231: 123042 | C231: 银河转债! | D231: 300619 | E231: 金银河 | F231: 机械装备 | G231: 专用设备 | H231: 134 | I231: -5.3099999999999994e-002 | J231: -7.000000000000001e-004 | K231: 28.25 | L231: -6.4299999999999996e-002 | M231: 115.9 | N231: 24.4 | O231: 0.157 | P231: 115.78 | Q231: 转股中 | R231: 5.19年 | S231: 3.19年 | T231: 1.67 | U231: 494 | V231: 2.1600000000000001 | W231: 7.9000000000000001e-002 | X231: 9.1999999999999998e-002 | Y231: 21 | Z231: 4.32 | AA231: -2.8199999999999999e-002 | AB231: -3.3399999999999999e-002 | AC231: -7.3099999999999998e-002 | AD231: -7.5199999999999989e-002 | AE231: 81.48 | AF231: 79.52 | AG231: 0.84 | AH231: A+ | AI231: 7.7399999999999997e-002 | AJ231: =H231+100*O231 -> 149.69999999999999 | AK231: 152.2 | AL231: 258 | AM231: 70.7 | AN231: 267 | AO231: 7.8e-002 | AP231: 25 | AQ231: 银河转债!
A232: 96 | B232: 123048 | C232: 应急转债 | D232: 300527 | E232: 中船应急 | F232: 机械装备 | G232: 专用设备 | H232: 132.1 | I232: -2.87e-002 | J232: -8.5000000000000006e-003 | K232: 11.6 | L232: -4.4500000000000005e-002 | M232: 113.1 | N232: 8.9 | O232: 1.3999999999999999e-002 | P232: 130.34 | Q232: 转股中 | R232: 5.42年 | S232: 3.42年 | T232: 3.9 | U232: 418 | V232: 0.79700000000000004 | W232: 3.7000000000000005e-002 | X232: 4.8000000000000001e-002 | Y232: 106 | Z232: 4.49 | AA232: -2.87e-002 | AB232: -3.2899999999999999e-002 | AC232: -6.6000000000000003e-002 | AD232: -6.7699999999999996e-002 | AE232: 89.07 | AF232: 90.22 | AG232: 0.84 | AH232: AA+ | AI232: 4.3400000000000001e-002 | AJ232: =H232+100*O232 -> 133.5 | AK232: 133.9 | AL232: 136 | AM232: 43.6 | AN232: 148 | AO232: -0.113 | AP232: 15 | AQ232: 应急转债
A233: 176 | B233: 123032 | C233: 万里转债!! | D233: 300591 | E233: 万里马 | F233: 服装纺织 | G233: 服装纺织 | H233: 151.998 | I233: -9.5299999999999996e-002 | J233: 5.0300000000000004e-002 | K233: 9.98 | L233: -4.4999999999999998e-002 | M233: 132 | N233: 6.89 | O233: 4.9000000000000002e-002 | P233: 144.85 | Q233: 转股中 | R233: 4.93年 | S233: 2.93年 | T233: 0.63 | U233: 339 | V233: 3.3799999999999999 | W233: 1.9e-002 | X233: 2.7999999999999997e-002 | Y233: 33 | Z233: 6.57 | AA233: -2.9100000000000001e-002 | AB233: -3.9e-002 | AC233: -0.107 | AD233: -0.111 | AE233: 85.92 | AF233: 93.5 | AG233: 1 | AH233: A+ | AI233: 7.5300000000000006e-002 | AJ233: =H233+100*O233 -> 156.898 | AK233: 159.1 | AL233: 269 | AM233: 65.7 | AN233: 262 | AO233: -0.107 | AP233: 41 | AQ233: 万里转债!!
A234: 217 | B234: 110055 | C234: 伊力转债! | D234: 600197 | E234: 伊力特 | F234: 食品饮料 | G234: 白酒 | H234: 130.52 | I234: -9.5999999999999992e-003 | J234: 5.9999999999999995e-004 | K234: 22.01 | L234: -1.0800000000000001e-002 | M234: 115 | N234: 16.81 | O234: -3.0000000000000001e-003 | P234: 130.93 | Q234: 转股中 | R234: 4.35年 | S234: 2.35年 | T234: 8.71 | U234: 59 | V234: 5.0999999999999997e-002 | W234: 9.0999999999999998e-002 | X234: 0.11900000000000001 | Y234: 96 | Z234: 3.58 | AA234: -2.92e-002 | AB234: -3.5099999999999999e-002 | AC234: -8.8900000000000007e-002 | AD234: -9.1199999999999989e-002 | AE234: 93.14 | AF234: 96.02 | AG234: 0.84 | AH234: AA | AI234: 4.3299999999999998e-002 | AJ234: =H234+100*O234 -> 130.22 | AK234: 130.1 | AL234: 93 | AM234: 34.1 | AN234: 47 | AO234: 0.13 | AP234: 25 | AQ234: 伊力转债!
A235: 294 | B235: 113014 | C235: 林洋转债! | D235: 601222 | E235: 林洋能源 | F235: 能源电力 | G235: 电力设备 | H235: 119.5 | I235: 5.6000000000000008e-003 | J235: 9.4999999999999998e-003 | K235: 8.27 | L235: 2.86e-002 | M235: 109.3 | N235: 8.54 | O235: 0.23399999999999999 | P235: 96.84 | Q235: 转股中 | R235: 2.97年 | S235: 0.97年 | T235: 30 | U235: 22 | V235: 6.0000000000000001e-003 | W235: 0.20699999999999999 | X235: 0.20100000000000001 | Y235: 145 | Z235: 1.39 | AA235: -2.9999999999999999e-002 | AB235: -3.56e-002 | AC235: -0.128 | AD235: -0.13100000000000001 | AE235: 97.08 | AF235: 96.72 | AG235: 0.53 | AH235: AA | AI235: 4.2699999999999995e-002 | AJ235: =H235+100*O235 -> 142.90000000000001 | AK235: 142.2 | AL235: 208 | AM235: 45.1 | AN235: 162 | AO235: 4.8000000000000001e-002 | AP235: 22 | AQ235: 林洋转债!
A236: 286 | B236: 128021 | C236: 兄弟转债!! | D236: 2562 | E236: 兄弟科技 | F236: 医药 | G236: 原料药 | H236: 120.5 | I236: -4.7999999999999996e-003 | J236: -3.4000000000000002e-003 | K236: 5.8 | L236: -8.5000000000000006e-003 | M236: 109.8 | N236: 5.25 | O236: 9.0999999999999998e-002 | P236: 110.48 | Q236: 转股中 | R236: 3年21天 | S236: 1年21天 | T236: 2.66 | U236: 8.6 | V236: 2.7000000000000003e-002 | W236: 4.8000000000000001e-002 | X236: 5.2999999999999999e-002 | Y236: 55 | Z236: 2.26 | AA236: -3.0600000000000002e-002 | AB236: -3.6200000000000003e-002 | AC236: -0.11900000000000001 | AD236: -0.122 | AE236: 97.42 | AF236: 96.73 | AG236: 0.96 | AH236: AA | AI236: 4.3299999999999998e-002 | AJ236: =H236+100*O236 -> 129.59999999999999 | AK236: 130.5 | AL236: 99 | AM236: 33.1 | AN236: 38 | AO236: -5.0999999999999997e-002 | AP236: 13 | AQ236: 兄弟转债!!
A237: 68 | B237: 113587 | C237: 泛微转债 | D237: 603039 | E237: 泛微网络 | F237: 计算机及 | G237: 软件开发 | H237: 147.86 | I237: -2.9700000000000001e-002 | J237: 2.69e-002 | K237: 96.7 | L237: -3.0999999999999999e-003 | M237: 124.3 | N237: 64.33 | O237: -1.6e-002 | P237: 150.32 | Q237: 44天 | R237: 5.60年 | S237: 3.60年 | T237: 3.16 | U237: 5.3 | V237: 1.1000000000000001e-002 | W237: 1.4999999999999999e-002 | X237: 2.3e-002 | Y237: 205 | Z237: 21.29 | AA237: -3.1099999999999999e-002 | AB237: -3.7999999999999999e-002 | AC237: -8.9499999999999996e-002 | AD237: -9.1300000000000006e-002 | AE237: 82.03 | AF237: 87.39 | AG237: 0.91 | AH237: AA- | AI237: 6.6400000000000001e-002 | AJ237: =H237+100*O237 -> 146.26000000000002 | AK237: 145.4 | AL237: 233 | AM237: 58 | AN237: 240 | AO237: 3.5000000000000003e-002 | AP237: 4 | AQ237: 泛微转债
A238: 34 | B238: 123062 | C238: 三超转债 | D238: 300554 | E238: 三超新材 | F238: 机械装备 | G238: 通用设备 | H238: 142.99 | I238: -7.6299999999999993e-002 | J238: -1.7600000000000001e-002 | K238: 25.6 | L238: -9.9499999999999991e-002 | M238: 119.7 | N238: 17.17 | O238: -4.0999999999999995e-002 | P238: 149.1 | Q238: 2月26天 | R238: 5.72年 | S238: 3.72年 | T238: 1.95 | U238: 417 | V238: 1.46 | W238: 8.1000000000000003e-002 | X238: 0.121 | Y238: 24 | Z238: 4.59 | AA238: -3.1200000000000002e-002 | AB238: -3.6900000000000002e-002 | AC238: -7.8e-002 | AD238: -8.0000000000000002e-002 | AE238: 75.84 | AF238: 74.99 | AG238: 0.94 | AH238: A | AI238: 8.7400000000000005e-002 | AJ238: =H238+100*O238 -> 138.89000000000001 | AK238: 136.9 | AL238: 160 | AM238: 61 | AN238: 251 | AO238: 5.9000000000000004e-002 | AP238: 11 | AQ238: 三超转债
A239: 106 | B239: 128103 | C239: 同德转债 | D239: 2360 | E239: 同德化工 | F239: 化工 | G239: 化工 | H239: 144 | I239: -6.8999999999999999e-003 | J239: -1.06e-002 | K239: 5.96 | L239: -2.1299999999999999e-002 | M239: 121.8 | N239: 5.18 | O239: 0.252 | P239: 115.06 | Q239: 转股中 | R239: 5.38年 | S239: 3.38年 | T239: 1.44 | U239: 401 | V239: 1.8899999999999999 | W239: 6.2e-002 | X239: 7.0999999999999994e-002 | Y239: 23 | Z239: 1.94 | AA239: -3.1300000000000001e-002 | AB239: -3.78e-002 | AC239: -8.6800000000000002e-002 | AD239: -8.8900000000000007e-002 | AE239: 80.65 | AF239: 82.37 | AG239: 0.82 | AH239: A+ | AI239: 7.7399999999999997e-002 | AJ239: =H239+100*O239 -> 169.19999999999999 | AK239: 172.9 | AL239: 281 | AM239: 90.6 | AN239: 287 | AO239: -3.6000000000000004e-002 | AP239: 10 | AQ239: 同德转债
A240: 100 | B240: 113575 | C240: 东时转债! | D240: 603377 | E240: 东方时尚 | F240: 其他 | G240: 其他 | H240: 134.41 | I240: 5.5000000000000005e-003 | J240: -9.4999999999999998e-003 | K240: 19.31 | L240: -4.5999999999999999e-003 | M240: 113.5 | N240: 14.56 | O240: 1.3000000000000001e-002 | P240: 132.62 | Q240: 转股中 | R240: 5.42年 | S240: 3.42年 | T240: 2.27 | U240: 3.9 | V240: 1.3000000000000001e-002 | W240: 2.e-002 | X240: 2.7000000000000003e-002 | Y240: 114 | Z240: 6.05 | AA240: -3.1300000000000001e-002 | AB240: -3.5499999999999997e-002 | AC240: -7.0099999999999996e-002 | AD240: -7.1900000000000006e-002 | AE240: 88.7 | AF240: 89.68 | AG240: 0.86 | AH240: AA | AI240: 4.5400000000000003e-002 | AJ240: =H240+100*O240 -> 135.71000000000001 | AK240: 136.2 | AL240: 158 | AM240: 46.5 | AN240: 171 | AO240: -3.3000000000000002e-002 | AP240: 15 | AQ240: 东时转债!
A241: 102 | B241: 128104 | C241: 裕同转债! | D241: 2831 | E241: 裕同科技 | F241: 造纸包装 | G241: 包装材料 | H241: 137 | I241: -9.3999999999999986e-003 | J241: 1.8500000000000003e-002 | K241: 30.98 | L241: 9.1000000000000004e-003 | M241: 115.3 | N241: 23.24 | O241: 2.7999999999999997e-002 | P241: 133.3 | Q241: 转股中 | R241: 5.41年 | S241: 3.41年 | T241: 13.7 | U241: 28 | V241: 1.4999999999999999e-002 | W241: 5.0000000000000003e-002 | X241: 6.7000000000000004e-002 | Y241: 272 | Z241: 4.05 | AA241: -3.1899999999999998e-002 | AB241: -3.6699999999999997e-002 | AC241: -7.5199999999999989e-002 | AD241: -7.6999999999999999e-002 | AE241: 89.29 | AF241: 92.04 | AG241: 1 | AH241: AA+ | AI241: 4.3400000000000001e-002 | AJ241: =H241+100*O241 -> 139.80000000000001 | AK241: 140.7 | AL241: 196 | AM241: 48.7 | AN241: 187 | AO241: -2.5000000000000001e-002 | AP241: 7 | AQ241: 裕同转债!
A242: 305 | B242: 110034 | C242: 九州转债! | D242: 600998 | E242: 九州通 | F242: 医药 | G242: 医药商业 | H242: 113.97 | I242: -2.9999999999999997e-004 | J242: 1.1299999999999999e-002 | K242: 18.24 | L242: 2.76e-002 | M242: 109.6 | N242: 18.32 | O242: 0.14499999999999999 | P242: 99.56 | Q242: 转股中 | R242: 1.19年 | S242: 回售中 | T242: 15 | U242: 72 | V242: 4.2000000000000003e-002 | W242: 4.4000000000000004e-002 | X242: 4.4000000000000004e-002 | Y242: 342 | Z242: 1.82 | AA242: -3.27e-002 | AB242: -4.7100000000000003e-002 | AC242: 回售中 | AD242: 回售中 | AE242: 103 | AF242: 104.58 | AG242: 0.4 | AH242: AA+ | AI242: 4.07e-002 | AJ242: =H242+100*O242 -> 128.47 | AK242: 128.4 | AL242: 74 | AM242: 23.8 | AN242: 5 | AO242: 1.7000000000000001e-002 | AP242: 25 | AQ242: 九州转债!
A243: 114 | B243: 113571 | C243: 博特转债! | D243: 603916 | E243: 苏博特 | F243: 建筑 | G243: 水泥 | H243: 145.01 | I243: -5.6000000000000008e-003 | J243: -1.18e-002 | K243: 27.16 | L243: -1.7399999999999999e-002 | M243: 120.8 | N243: 18.88 | O243: 8.0000000000000002e-003 | P243: 143.86 | Q243: 转股中 | R243: 5.34年 | S243: 3.34年 | T243: 2.71 | U243: 22 | V243: 5.5e-002 | W243: 2.9999999999999999e-002 | X243: 4.2999999999999997e-002 | Y243: 90 | Z243: 3.09 | AA243: -3.4300000000000004e-002 | AB243: -4.0599999999999997e-002 | AC243: -9.0999999999999998e-002 | AD243: -9.2899999999999996e-002 | AE243: 83.35 | AF243: 86.36 | AG243: 1 | AH243: AA- | AI243: 6.6400000000000001e-002 | AJ243: =H243+100*O243 -> 145.81 | AK243: 146.2 | AL243: 236 | AM243: 59.8 | AN243: 247 | AO243: -3.0000000000000001e-003 | AP243: 13 | AQ243: 博特转债!
A244: 25 | B244: 128126 | C244: 赣锋转2 | D244: 2460 | E244: 赣锋锂业 | F244: 有色金属 | G244: 小金属 | H244: 136 | I244: -1.4499999999999999e-002 | J244: 4.7500000000000001e-002 | K244: 75.1 | L244: 4.0199999999999993e-002 | M244: 111.1 | N244: 60.27 | O244: 9.0999999999999998e-002 | P244: 124.61 | Q244: 3月7天 | R244: 5.75年 | S244: 3.75年 | T244: 21.1 | U244: 114 | V244: 3.9e-002 | W244: 2.1000000000000001e-002 | X244: 2.6000000000000002e-002 | Y244: 1001. | Z244: 10.78 | AA244: -3.5099999999999999e-002 | AB244: -3.8399999999999997e-002 | AC244: -6.9400000000000003e-002 | AD244: -7.0599999999999996e-002 | AE244: 86.56 | AF244: 86.42 | AG244: 0.82 | AH244: AA | AI244: 4.5400000000000003e-002 | AJ244: =H244+100*O244 -> 145.09999999999999 | AK244: 147.4 | AL244: 241 | AM244: 60.8 | AN244: 250 | AO244: 0.23300000000000001 | AP244: 7 | AQ244: 赣锋转2
A245: 240 | B245: 113020 | C245: 桐昆转债! | D245: 601233 | E245: 桐昆股份 | F245: 服装纺织 | G245: 纺织行业 | H245: 130.49 | I245: -2.06e-002 | J245: 1.1200000000000002e-002 | K245: 15.95 | L245: -1.1200000000000002e-002 | M245: 112.8 | N245: 12.28 | O245: 5.0000000000000001e-003 | P245: 129.89 | Q245: 转股中 | R245: 4年12天 | S245: 2年12天 | T245: 31.5 | U245: 125 | V245: 2.9999999999999999e-002 | W245: 0.107 | X245: 0.13900000000000001 | Y245: 295 | Z245: 1.5 | AA245: -3.6200000000000003e-002 | AB245: -4.1599999999999998e-002 | AC245: -0.10099999999999999 | AD245: -0.10400000000000001 | AE245: 94.6 | AF245: 96.16 | AG245: 0.84 | AH245: AA+ | AI245: 4.1299999999999996e-002 | AJ245: =H245+100*O245 -> 130.99000000000001 | AK245: 131.1 | AL245: 110 | AM245: 34.9 | AN245: 55 | AO245: -3.0000000000000001e-003 | AP245: 14 | AQ245: 桐昆转债!
A246: 194 | B246: 123026 | C246: 中环转债! | D246: 300692 | E246: 中环环保 | F246: 城市公用 | G246: 三废处理 | H246: 126 | I246: -2.0199999999999999e-002 | J246: -1.e-004 | K246: 15.46 | L246: -2.0299999999999999e-002 | M246: 110.6 | N246: 12.25 | O246: -2.e-003 | P246: 126.2 | Q246: 转股中 | R246: 3.59年 | S246: 1.59年 | T246: 0.81 | U246: 20 | V246: 0.19800000000000001 | W246: 2.9999999999999999e-002 | X246: 3.7999999999999999e-002 | Y246: 27 | Z246: 2.5 | AA246: -3.6299999999999999e-002 | AB246: -4.1399999999999999e-002 | AC246: -0.11 | AD246: -0.113 | AE246: 92.18 | AF246: 88.83 | AG246: 1 | AH246: AA- | AI246: 6.4299999999999996e-002 | AJ246: =H246+100*O246 -> 125.8 | AK246: 125.8 | AL246: 40 | AM246: 33.6 | AN246: 42 | AO246: -9.0999999999999998e-002 | AP246: 28 | AQ246: 中环转债!
A247: 178 | B247: 128075 | C247: 远东转债! | D247: 2406 | E247: 远东传动 | F247: 汽车 | G247: 零部件制 | H247: 138.08 | I247: -4.5000000000000005e-003 | J247: -2.2000000000000001e-003 | K247: 7.66 | L247: -7.8000000000000005e-003 | M247: 114.9 | N247: 5.54 | O247: -1.e-003 | P247: 138.27 | Q247: 转股中 | R247: 4.88年 | S247: 2.88年 | T247: 6.38 | U247: 37 | V247: 4.2000000000000003e-002 | W247: 0.14099999999999999 | X247: 0.19500000000000001 | Y247: 45 | Z247: 1.53 | AA247: -3.7599999999999995e-002 | AB247: -4.2699999999999995e-002 | AC247: -9.1400000000000009e-002 | AD247: -9.3200000000000005e-002 | AE247: 90.99 | AF247: 93.8 | AG247: 0.86 | AH247: AA | AI247: 4.3299999999999998e-002 | AJ247: =H247+100*O247 -> 137.98000000000002 | AK247: 137.9 | AL247: 170 | AM247: 44.1 | AN247: 153 | AO247: 3.4000000000000002e-002 | AP247: 15 | AQ247: 远东转债!
A248: 136 | B248: 127015 | C248: 希望转债! | D248: 876 | E248: 新 希 望 | F248: 农业 | G248: 畜牧业 | H248: 136.505 | I248: -2.5000000000000001e-002 | J248: 2.5999999999999999e-003 | K248: 27.09 | L248: -2.2400000000000003e-002 | M248: 110.2 | N248: 19.75 | O248: -5.0000000000000001e-003 | P248: 137.16 | Q248: 转股中 | R248: 5年57天 | S248: 3年57天 | T248: 17.8 | U248: 78 | V248: 3.2000000000000001e-002 | W248: 1.4999999999999999e-002 | X248: 2.e-002 | Y248: 1220. | Z248: 3.37 | AA248: -4.1200000000000001e-002 | AB248: -4.4600000000000001e-002 | AC248: -8.2200000000000009e-002 | AD248: -8.3599999999999994e-002 | AE248: 90.28 | AF248: 90.14 | AG248: 1 | AH248: AAA | AI248: 4.0399999999999998e-002 | AJ248: =H248+100*O248 -> 136.005 | AK248: 135.8 | AL248: 154 | AM248: 45.6 | AN248: 165 | AO248: -3.4000000000000002e-002 | AP248: 28 | AQ248: 希望转债!
A249: 60 | B249: 113590 | C249: 海容转债 | D249: 603187 | E249: 海容冷链 | F249: 机械装备 | G249: 通用设备 | H249: 147.28 | I249: -1.5900000000000001e-002 | J249: 5.8999999999999999e-003 | K249: 53.4 | L249: -1.0700000000000001e-002 | M249: 115.6 | N249: 36.39 | O249: 4.0000000000000001e-003 | P249: 146.74 | Q249: 58天 | R249: 5.64年 | S249: 3.64年 | T249: 5 | U249: 48 | V249: 6.4000000000000001e-002 | W249: 5.9000000000000004e-002 | X249: 8.6999999999999994e-002 | Y249: 85 | Z249: 5.2 | AA249: -4.2800000000000005e-002 | AB249: -4.7300000000000002e-002 | AC249: -8.8200000000000001e-002 | AD249: -8.9900000000000008e-002 | AE249: 81.58 | AF249: 81.05 | AG249: 0.93 | AH249: AA- | AI249: 6.6400000000000001e-002 | AJ249: =H249+100*O249 -> 147.68000000000001 | AK249: 147.8 | AL249: 246 | AM249: 66.2 | AN249: 263 | AO249: 5.0999999999999997e-002 | AP249: 5 | AQ249: 海容转债
A250: 81 | B250: 113583 | C250: 益丰转债 | D250: 603939 | E250: 益丰药房 | F250: 医药 | G250: 医药商业 | H250: 146.55 | I250: 3.0000000000000001e-003 | J250: -3.4000000000000002e-003 | K250: 104.66 | L250: -4.0000000000000002e-004 | M250: 115.3 | N250: 71.82 | O250: 6.0000000000000001e-003 | P250: 145.73 | Q250: 30天 | R250: 5.56年 | S250: 3.56年 | T250: 15.8 | U250: 23 | V250: 1.e-002 | W250: 2.7999999999999997e-002 | X250: 4.0999999999999995e-002 | Y250: 556 | Z250: 11.04 | AA250: -4.2900000000000001e-002 | AB250: -4.7500000000000001e-002 | AC250: -8.900000000000001e-002 | AD250: -9.0700000000000003e-002 | AE250: 88.1 | AF250: 90.5 | AG250: 0.9 | AH250: AA | AI250: 4.5400000000000003e-002 | AJ250: =H250+100*O250 -> 147.15000000000001 | AK250: 147.4 | AL250: 240 | AM250: 56.9 | AN250: 234 | AO250: 7.6999999999999999e-002 | AP250: 8 | AQ250: 益丰转债
A251: 153 | B251: 113029 | C251: 明阳转债!! | D251: 601615 | E251: 明阳智能 | F251: 能源电力 | G251: 风能 | H251: 142.16 | I251: -7.4999999999999997e-003 | J251: -3.5999999999999999e-003 | K251: 16.87 | L251: -1.29e-002 | M251: 113.3 | N251: 12.46 | O251: 5.0000000000000003e-002 | P251: 135.39 | Q251: 转股中 | R251: 5年39天 | S251: 3年39天 | T251: 9.81 | U251: 39 | V251: 2.7999999999999997e-002 | W251: 4.0999999999999995e-002 | X251: 5.5999999999999994e-002 | Y251: 237 | Z251: 3.13 | AA251: -4.4299999999999999e-002 | AB251: -4.8600000000000004e-002 | AC251: -9.2499999999999999e-002 | AD251: -9.4399999999999998e-002 | AE251: 89.92 | AF251: 90.76 | AG251: 0.86 | AH251: AA | AI251: 4.5400000000000003e-002 | AJ251: =H251+100*O251 -> 147.16 | AK251: 148.9 | AL251: 251 | AM251: 58.2 | AN251: 241 | AO251: -4.0999999999999995e-002 | AP251: 22 | AQ251: 明阳转债!!
A252: 130 | B252: 128097 | C252: 奥佳转债! | D252: 2614 | E252: 奥佳华 | F252: 机械装备 | G252: 专用设备 | H252: 146.3 | I252: -7.000000000000001e-004 | J252: -1.8200000000000001e-002 | K252: 14.85 | L252: -2.1700000000000001e-002 | M252: 115.3 | N252: 10.69 | O252: 5.2999999999999999e-002 | P252: 138.91 | Q252: 转股中 | R252: 5.30年 | S252: 3.30年 | T252: 5.85 | U252: 12 | V252: 1.4999999999999999e-002 | W252: 6.4000000000000001e-002 | X252: 8.900000000000001e-002 | Y252: 91 | Z252: 2.17 | AA252: -4.4699999999999997e-002 | AB252: -4.9500000000000002e-002 | AC252: -9.5100000000000004e-002 | AD252: -9.69e-002 | AE252: 89.14 | AF252: 91.56 | AG252: 0.87 | AH252: AA | AI252: 4.5400000000000003e-002 | AJ252: =H252+100*O252 -> 151.60000000000002 | AK252: 153.7 | AL252: 260 | AM252: 62.1 | AN252: 255 | AO252: 6.9999999999999993e-003 | AP252: 26 | AQ252: 奥佳转债!
A253: 52 | B253: 113592 | C253: 安20转债 | D253: 603345 | E253: 安井食品 | F253: 食品饮料 | G253: 食品饮料 | H253: 146.06 | I253: -3.5299999999999998e-002 | J253: -1.89e-002 | K253: 166.37 | L253: -6.0100000000000001e-002 | M253: 113.1 | N253: 115.9 | O253: 1.8000000000000002e-002 | P253: 143.55 | Q253: 2月8天 | R253: 5.67年 | S253: 3.67年 | T253: 9 | U253: 69 | V253: 5.2000000000000005e-002 | W253: 2.3e-002 | X253: 3.3000000000000002e-002 | Y253: 394 | Z253: 12.26 | AA253: -4.4800000000000006e-002 | AB253: -4.87e-002 | AC253: -8.6300000000000002e-002 | AD253: -8.7899999999999992e-002 | AE253: 87.51 | AF253: 88.35 | AG253: 0.9 | AH253: AA | AI253: 4.5400000000000003e-002 | AJ253: =H253+100*O253 -> 147.86000000000001 | AK253: 148.6 | AL253: 250 | AM253: 60.2 | AN253: 249 | AO253: -5.9000000000000004e-002 | AP253: 6 | AQ253: 安20转债
A254: 295 | B254: 113013 | C254: 国君转债! | D254: 601211 | E254: 国泰君安 | F254: 金融 | G254: 证券行业 | H254: 122.28 | I254: -8.1000000000000013e-003 | J254: 1.1200000000000002e-002 | K254: 18.68 | L254: 5.8999999999999999e-003 | M254: 108.3 | N254: 19.01 | O254: 0.24399999999999999 | P254: 98.26 | Q254: 转股中 | R254: 2.66年 | S254: 无权 | T254: 69.9 | U254: 47 | V254: 5.0000000000000001e-003 | W254: 4.2000000000000003e-002 | X254: 4.0999999999999995e-002 | Y254: 1664. | Z254: 1.34 | AA254: -4.53e-002 | AB254: -5.0700000000000002e-002 | AC254: 无权 | AD254: 无权 | AE254: 无权 | AF254: 98.3 | AG254: 0.52 | AH254: AAA | AI254: 3.7699999999999997e-002 | AJ254: =H254+100*O254 -> 146.68000000000001 | AK254: 146.3 | AL254: 237 | AM254: 48 | AN254: 182 | AO254: 1.3000000000000001e-002 | AP254: 14 | AQ254: 国君转债!
A255: 73 | B255: 113585 | C255: 寿仙转债 | D255: 603896 | E255: 寿仙谷 | F255: 医药 | G255: 中药 | H255: 153 | I255: -7.7000000000000002e-003 | J255: -7.4999999999999997e-003 | K255: 46.84 | L255: -1.6e-002 | M255: 117.8 | N255: 28.68 | O255: -6.3e-002 | P255: 163.32 | Q255: 38天 | R255: 5.59年 | S255: 3.59年 | T255: 3.6 | U255: 28 | V255: 5.0999999999999997e-002 | W255: 5.4000000000000006e-002 | X255: 8.6999999999999994e-002 | Y255: 67 | Z255: 5.46 | AA255: -4.6600000000000003e-002 | AB255: -5.1699999999999996e-002 | AC255: -9.8400000000000001e-002 | AD255: -0.10000000000000001 | AE255: 82.05 | AF255: 82.92 | AG255: 0.95 | AH255: AA- | AI255: 6.6400000000000001e-002 | AJ255: =H255+100*O255 -> 146.69999999999999 | AK255: 142.7 | AL255: 211 | AM255: 59.8 | AN255: 246 | AO255: 0.11900000000000001 | AP255: 9 | AQ255: 寿仙转债
A256: 239 | B256: 123017 | C256: 寒锐转债!! | D256: 300618 | E256: 寒锐钴业 | F256: 有色金属 | G256: 小金属 | H256: 134.003 | I256: 1.e-004 | J256: -7.3000000000000001e-003 | K256: 69.06 | L256: -8.5000000000000006e-003 | M256: 110.8 | N256: 57.4 | O256: 0.114 | P256: 120.31 | Q256: 转股中 | R256: 4年13天 | S256: 2年13天 | T256: 4.03 | U256: 175 | V256: 0.316 | W256: 1.9e-002 | X256: 2.3e-002 | Y256: 209 | Z256: 5.7 | AA256: -4.6900000000000004e-002 | AB256: -5.1500000000000004e-002 | AC256: -0.11199999999999999 | AD256: -0.114 | AE256: 90.19 | AF256: 86.66 | AG256: 0.85 | AH256: AA- | AI256: 6.4299999999999996e-002 | AJ256: =H256+100*O256 -> 145.40299999999999 | AK256: 147.7 | AL256: 245 | AM256: 57.5 | AN256: 236 | AO256: 2.8999999999999998e-002 | AP256: 14 | AQ256: 寒锐转债!!
A257: 267 | B257: 127005 | C257: 长证转债! | D257: 783 | E257: 长江证券 | F257: 金融 | G257: 证券行业 | H257: 128.4 | I257: -8.5000000000000006e-003 | J257: 1.37e-002 | K257: 8.25 | L257: 7.3000000000000001e-003 | M257: 109.3 | N257: 7.28 | O257: 0.13300000000000001 | P257: 113.32 | Q257: 转股中 | R257: 3.34年 | S257: 无权 | T257: 50 | U257: 29 | V257: 4.0000000000000001e-003 | W257: 0.11 | X257: 0.124 | Y257: 456 | Z257: 1.63 | AA257: -4.7899999999999998e-002 | AB257: -5.2699999999999997e-002 | AC257: 无权 | AD257: 无权 | AE257: 无权 | AF257: 96.66 | AG257: 0.71 | AH257: AAA | AI257: 3.8300000000000001e-002 | AJ257: =H257+100*O257 -> 141.70000000000002 | AK257: 143.5 | AL257: 220 | AM257: 46.8 | AN257: 175 | AO257: 2.2000000000000002e-002 | AP257: 15 | AQ257: 长证转债!
A258: 138 | B258: 113562 | C258: 璞泰转债!! | D258: 603659 | E258: 璞泰来 | F258: 电子 | G258: 元器件制 | H258: 139.99 | I258: -4.7999999999999996e-003 | J258: -9.4999999999999998e-003 | K258: 116.4 | L258: -1.43e-002 | M258: 113.3 | N258: 82.73 | O258: -5.0000000000000001e-003 | P258: 140.7 | Q258: 转股中 | R258: 4年56天 | S258: 2年56天 | T258: 6.75 | U258: 136 | V258: 0.14199999999999999 | W258: 1.3000000000000001e-002 | X258: 1.9e-002 | Y258: 507 | Z258: 13.9 | AA258: -5.0199999999999995e-002 | AB258: -5.5599999999999997e-002 | AC258: -0.127 | AD258: -0.129 | AE258: 92.55 | AF258: 95.23 | AG258: 1 | AH258: AA | AI258: 4.3299999999999998e-002 | AJ258: =H258+100*O258 -> 139.49000000000001 | AK258: 139.3 | AL258: 181 | AM258: 44.1 | AN258: 152 | AO258: 6.3e-002 | AP258: 16 | AQ258: 璞泰转债!!
A259: 49 | B259: 123058 | C259: 欣旺转债 | D259: 300207 | E259: 欣旺达 | F259: 电子 | G259: 电子产品 | H259: 155.5 | I259: -3.2000000000000002e-003 | J259: -5.6999999999999993e-003 | K259: 30.19 | L259: -1.0200000000000001e-002 | M259: 116.3 | N259: 21.24 | O259: 9.4e-002 | P259: 142.14 | Q259: 2月14天 | R259: 5.68年 | S259: 3.68年 | T259: 11.2 | U259: 69 | V259: 3.9e-002 | W259: 2.4e-002 | X259: 3.3000000000000002e-002 | Y259: 475 | Z259: 7.51 | AA259: -5.0700000000000002e-002 | AB259: -5.5300000000000002e-002 | AC259: -0.10000000000000001 | AD259: -0.10199999999999999 | AE259: 87.64 | AF259: 90.81 | AG259: 0.88 | AH259: AA | AI259: 4.5400000000000003e-002 | AJ259: =H259+100*O259 -> 164.90000000000001 | AK259: 168.9 | AL259: 274 | AM259: 78.1 | AN259: 277 | AO259: 5.0999999999999997e-002 | AP259: 6 | AQ259: 欣旺转债
A260: 109 | B260: 123046 | C260: 天铁转债! | D260: 300587 | E260: 天铁股份 | F260: 铁路 | G260: 铁路设备 | H260: 156 | I260: -2.7000000000000001e-003 | J260: -1.37e-002 | K260: 15.66 | L260: -1.7600000000000001e-002 | M260: 118.2 | N260: 10.12 | O260: 8.0000000000000002e-003 | P260: 154.74 | Q260: 转股中 | R260: 5.36年 | S260: 3.36年 | T260: 1.26 | U260: 33 | V260: 0.16899999999999998 | W260: 2.5000000000000001e-002 | X260: 3.7999999999999999e-002 | Y260: 51 | Z260: 3.84 | AA260: -5.1399999999999994e-002 | AB260: -5.6799999999999996e-002 | AC260: -0.107 | AD260: -0.10800000000000001 | AE260: 83.22 | AF260: 84.42 | AG260: 0.93 | AH260: AA- | AI260: 6.6400000000000001e-002 | AJ260: =H260+100*O260 -> 156.80000000000001 | AK260: 157.3 | AL260: 265 | AM260: 72.8 | AN260: 271 | AO260: -3.6000000000000004e-002 | AP260: 10 | AQ260: 天铁转债!
A261: 304 | B261: 113009 | C261: 广汽转债!! | D261: 601238 | E261: 广汽集团 | F261: 汽车 | G261: 乘用车 | H261: 114.8 | I261: -2.2200000000000001e-002 | J261: 7.4000000000000003e-003 | K261: 13.33 | L261: -4.99e-002 | M261: 107.5 | N261: 14.23 | O261: 0.22600000000000001 | P261: 93.68 | Q261: 转股中 | R261: 1.21年 | S261: 回售中 | T261: 25.5 | U261: 82 | V261: 2.7999999999999997e-002 | W261: 1.9e-002 | X261: 1.7000000000000001e-002 | Y261: 1365. | Z261: 1.65 | AA261: -5.3499999999999999e-002 | AB261: -6.4399999999999999e-002 | AC261: 回售中 | AD261: 回售中 | AE261: 100.25 | AF261: 102.85 | AG261: 0.3 | AH261: AAA | AI261: 3.7699999999999997e-002 | AJ261: =H261+100*O261 -> 137.40000000000001 | AK261: 135.9 | AL261: 156 | AM261: 33.1 | AN261: 37 | AO261: 0.14499999999999999 | AP261: 15 | AQ261: 广汽转债!!
A262: 122 | B262: 123043 | C262: 正元转债 | D262: 300645 | E262: 正元智慧 | F262: 计算机及 | G262: 软件开发 | H262: 162.12 | I262: -3.5000000000000003e-002 | J262: -3.0999999999999999e-003 | K262: 16.98 | L262: -4.82e-002 | M262: 121.4 | N262: 15.41 | O262: 0.47100000000000003 | P262: 110.19 | Q262: 转股中 | R262: 5.32年 | S262: 3.32年 | T262: 1.66 | U262: 2242. | V262: 8.0500000000000007 | W262: 7.6999999999999999e-002 | X262: 8.5000000000000006e-002 | Y262: 22 | Z262: 3.51 | AA262: -5.4000000000000006e-002 | AB262: -6.0199999999999997e-002 | AC262: -0.11599999999999999 | AD262: -0.11800000000000001 | AE262: 80.89 | AF262: 82.44 | AG262: 0.79 | AH262: A+ | AI262: 7.7399999999999997e-002 | AJ262: =H262+100*O262 -> 209.22 | AK262: 214.1 | AL262: 292 | AM262: 131.6 | AN262: 292 | AO262: -7.0000000000000007e-002 | AP262: 17 | AQ262: 正元转债
A263: 229 | B263: 113526 | C263: 联泰转债! | D263: 603797 | E263: 联泰环保 | F263: 城市公用 | G263: 三废处理 | H263: 140.3 | I263: -1.5900000000000001e-002 | J263: 1.0800000000000001e-002 | K263: 8.38 | L263: -5.8999999999999999e-003 | M263: 110.8 | N263: 6.11 | O263: 2.3e-002 | P263: 137.15 | Q263: 转股中 | R263: 4.21年 | S263: 2.21年 | T263: 1.93 | U263: 6.6 | V263: 2.4e-002 | W263: 5.0999999999999997e-002 | X263: 7.0000000000000007e-002 | Y263: 38 | Z263: 2.44 | AA263: -5.5500000000000001e-002 | AB263: -5.9800000000000006e-002 | AC263: -0.121 | AD263: -0.12300000000000001 | AE263: 93.49 | AF263: 93.04 | AG263: 0.87 | AH263: AA | AI263: 4.3299999999999998e-002 | AJ263: =H263+100*O263 -> 142.60000000000002 | AK263: 143.4 | AL263: 219 | AM263: 50 | AN263: 205 | AO263: -2.2000000000000002e-002 | AP263: 8 | AQ263: 联泰转债!
A264: 27 | B264: 113038 | C264: 隆20转债 | D264: 601012 | E264: 隆基股份 | F264: 能源电力 | G264: 太阳能 | H264: 154.36 | I264: -1.7299999999999999e-002 | J264: -1.3600000000000001e-002 | K264: 71.33 | L264: -3.6000000000000004e-002 | M264: 111.8 | N264: 52.59 | O264: 0.13800000000000001 | P264: 135.63 | Q264: 3月1天 | R264: 5.73年 | S264: 3.73年 | T264: 50 | U264: 228 | V264: 2.8999999999999998e-002 | W264: 1.9e-002 | X264: 2.5000000000000001e-002 | Y264: 2690. | Z264: 8.29 | AA264: -5.5500000000000001e-002 | AB264: -5.8899999999999994e-002 | AC264: -9.849999999999999e-002 | AD264: -9.9900000000000003e-002 | AE264: 88.63 | AF264: 89.44 | AG264: 0.86 | AH264: AAA | AI264: 4.0399999999999998e-002 | AJ264: =H264+100*O264 -> 168.16000000000003 | AK264: 173.1 | AL264: 282 | AM264: 83.6 | AN264: 282 | AO264: -4.2000000000000003e-002 | AP264: 11 | AQ264: 隆20转债
A265: 264 | B265: 128036 | C265: 金农转债!! | D265: 2548 | E265: 金新农 | F265: 农业 | G265: 畜牧业 | H265: 133.357 | I265: -1.89e-002 | J265: 9.7000000000000003e-003 | K265: 8.12 | L265: -9.7999999999999997e-003 | M265: 110.3 | N265: 7.39 | O265: 0.214 | P265: 109.88 | Q265: 转股中 | R265: 3.33年 | S265: 1.33年 | T265: 1.46 | U265: 49 | V265: 0.248 | W265: 3.2000000000000001e-002 | X265: 3.5000000000000003e-002 | Y265: 46 | Z265: 2.14 | AA265: -5.6399999999999999e-002 | AB265: -6.1600000000000002e-002 | AC265: -0.14400000000000002 | AD265: -0.14699999999999999 | AE265: 93.7 | AF265: 90.01 | AG265: 0.94 | AH265: AA- | AI265: 6.4299999999999996e-002 | AJ265: =H265+100*O265 -> 154.75700000000001 | AK265: 156.8 | AL265: 264 | AM265: 63.1 | AN265: 260 | AO265: -6.9000000000000006e-002 | AP265: 15 | AQ265: 金农转债!!
A266: 300 | B266: 113011 | C266: 光大转债 | D266: 601818 | E266: 光大银行 | F266: 金融 | G266: 银行行业 | H266: 124.02 | I266: -8.0000000000000002e-003 | J266: 9.5999999999999992e-003 | K266: 4.06 | L266: 2.5000000000000001e-003 | M266: 108.3 | N266: 3.76 | O266: 0.14899999999999999 | P266: 107.98 | Q266: 转股中 | R266: 2.36年 | S266: 无权 | T266: 242 | U266: 93 | V266: 3.0000000000000001e-003 | W266: 0.114 | X266: 0.12300000000000001 | Y266: 2131. | Z266: 0.65 | AA266: -5.6900000000000006e-002 | AB266: -6.2899999999999998e-002 | AC266: 无权 | AD266: 无权 | AE266: 无权 | AF266: 99.42 | AG266: 0.65 | AH266: AAA | AI266: 3.7699999999999997e-002 | AJ266: =H266+100*O266 -> 138.91999999999999 | AK266: 140.1 | AL266: 192 | AM266: 40.6 | AN266: 116 | AO266: 1.9e-002 | AP266: 15 | AQ266: 光大转债
A267: 193 | B267: 113537 | C267: 文灿转债! | D267: 603348 | E267: 文灿股份 | F267: 汽车 | G267: 零部件制 | H267: 158.68 | I267: 1.1000000000000001e-003 | J267: -3.2000000000000002e-003 | K267: 30.92 | L267: -2.3e-003 | M267: 121.5 | N267: 19.43 | O267: -3.0000000000000001e-003 | P267: 159.14 | Q267: 转股中 | R267: 4.59年 | S267: 2.59年 | T267: 3.35 | U267: 638 | V267: 1.1699999999999999 | W267: 4.4999999999999998e-002 | X267: 7.0999999999999994e-002 | Y267: 75 | Z267: 3.18 | AA267: -5.7699999999999994e-002 | AB267: -6.5000000000000002e-002 | AC267: -0.14000000000000001 | AD267: -0.14300000000000002 | AE267: 88.13 | AF267: 91.94 | AG267: 0.93 | AH267: AA- | AI267: 6.4299999999999996e-002 | AJ267: =H267+100*O267 -> 158.38 | AK267: 158.2 | AL267: 266 | AM267: 66.3 | AN267: 264 | AO267: 0.20800000000000002 | AP267: 26 | AQ267: 文灿转债!
A268: 131 | B268: 128095 | C268: 恩捷转债!! | D268: 2812 | E268: 恩捷股份 | F268: 电子 | G268: 元器件制 | H268: 160.057 | I268: -5.8999999999999999e-003 | J268: 2.8999999999999998e-003 | K268: 104.66 | L268: -3.2000000000000002e-003 | M268: 115.3 | N268: 65.09 | O268: -5.0000000000000001e-003 | P268: 160.79 | Q268: 转股中 | R268: 5.26年 | S268: 3.26年 | T268: 13.1 | U268: 187 | V268: 8.8000000000000009e-002 | W268: 1.3999999999999999e-002 | X268: 2.3e-002 | Y268: 920 | Z268: 9.32 | AA268: -6.1500000000000006e-002 | AB268: -6.6100000000000006e-002 | AC268: -0.11699999999999999 | AD268: -0.11800000000000001 | AE268: 89.3 | AF268: 91.72 | AG268: 0.93 | AH268: AA | AI268: 4.5400000000000003e-002 | AJ268: =H268+100*O268 -> 159.55699999999999 | AK268: 159.3 | AL268: 270 | AM268: 67.6 | AN268: 265 | AO268: 5.9999999999999998e-002 | AP268: 17 | AQ268: 恩捷转债!!
A269: 87 | B269: 113580 | C269: 康隆转债 | D269: 603665 | E269: 康隆达 | F269: 服装纺织 | G269: 服装行业 | H269: 171.23 | I269: 3.2500000000000001e-002 | J269: -1.84e-002 | K269: 25.88 | L269: 1.49e-002 | M269: 121.2 | N269: 15.51 | O269: 2.6000000000000002e-002 | P269: 166.86 | Q269: 转股中 | R269: 5.46年 | S269: 3.46年 | T269: 0.98 | U269: 267 | V269: 1.6299999999999999 | W269: 2.6000000000000002e-002 | X269: 4.2999999999999997e-002 | Y269: 38 | Z269: 4.02 | AA269: -6.25e-002 | AB269: -6.8499999999999991e-002 | AC269: -0.125 | AD269: -0.127 | AE269: 82.7 | AF269: 86 | AG269: 0.94 | AH269: AA- | AI269: 6.6400000000000001e-002 | AJ269: =H269+100*O269 -> 173.82999999999998 | AK269: 175.6 | AL269: 283 | AM269: 89.6 | AN269: 285 | AO269: -2.3e-002 | AP269: 10 | AQ269: 康隆转债
A270: 220 | B270: 128058 | C270: 拓邦转债! | D270: 2139 | E270: 拓邦股份 | F270: 电子 | G270: 电子产品 | H270: 161.2 | I270: -1.41e-002 | J270: 2.8999999999999998e-003 | K270: 8.89 | L270: -1.11e-002 | M270: 122.6 | N270: 5.47 | O270: -8.0000000000000002e-003 | P270: 162.52 | Q270: 转股中 | R270: 4.33年 | S270: 2.33年 | T270: 1.43 | U270: 82 | V270: 0.35200000000000004 | W270: 1.6e-002 | X270: 2.5000000000000001e-002 | Y270: 92 | Z270: 3.41 | AA270: -6.2699999999999992e-002 | AB270: -7.0599999999999996e-002 | AC270: -0.11599999999999999 | AD270: -0.11800000000000001 | AE270: 94.16 | AF270: 102.53 | AG270: 1 | AH270: AA | AI270: 4.3299999999999998e-002 | AJ270: =H270+100*O270 -> 160.39999999999998 | AK270: 159.9 | AL270: 271 | AM270: 57.3 | AN270: 235 | AO270: 8.1000000000000003e-002 | AP270: 20 | AQ270: 拓邦转债!
A271: 199 | B271: 128065 | C271: 雅化转债! | D271: 2497 | E271: 雅化集团 | F271: 化工 | G271: 化工 | H271: 147.465 | I271: -4.9400000000000006e-002 | J271: 1.e-004 | K271: 13.18 | L271: -5.3800000000000001e-002 | M271: 110.9 | N271: 8.95 | O271: 1.e-003 | P271: 147.26 | Q271: 转股中 | R271: 4.44年 | S271: 2.44年 | T271: 4.79 | U271: 350 | V271: 0.48299999999999998 | W271: 3.7999999999999999e-002 | X271: 5.5999999999999994e-002 | Y271: 126 | Z271: 4.35 | AA271: -6.3299999999999995e-002 | AB271: -6.7299999999999999e-002 | AC271: -0.127 | AD271: -0.129 | AE271: 92.7 | AF271: 92.25 | AG271: 0.92 | AH271: AA | AI271: 4.3299999999999998e-002 | AJ271: =H271+100*O271 -> 147.565 | AK271: 147.7 | AL271: 244 | AM271: 55 | AN271: 227 | AO271: 9.6000000000000002e-002 | AP271: 21 | AQ271: 雅化转债!
A272: 269 | B272: 113504 | C272: 艾华转债!! | D272: 603989 | E272: 艾华集团 | F272: 电子 | G272: 元器件制 | H272: 136.55 | I272: -1.1000000000000001e-003 | J272: 5.0000000000000001e-004 | K272: 27.48 | L272: -7.000000000000001e-004 | M272: 110.3 | N272: 21.13 | O272: 5.0000000000000003e-002 | P272: 130.05 | Q272: 转股中 | R272: 3.32年 | S272: 1.32年 | T272: 5.61 | U272: 7.6 | V272: 1.e-002 | W272: 5.2000000000000005e-002 | X272: 6.7000000000000004e-002 | Y272: 109 | Z272: 4.51 | AA272: -6.3500000000000001e-002 | AB272: -6.8699999999999997e-002 | AC272: -0.158 | AD272: -0.161 | AE272: 96.6 | AF272: 96.13 | AG272: 0.86 | AH272: AA | AI272: 4.3299999999999998e-002 | AJ272: =H272+100*O272 -> 141.55000000000001 | AK272: 143 | AL272: 216 | AM272: 46.4 | AN272: 170 | AO272: 4.2000000000000003e-002 | AP272: 9 | AQ272: 艾华转债!!
A273: 253 | B273: 123012 | C273: 万顺转债 | D273: 300057 | E273: 万顺新材 | F273: 造纸包装 | G273: 包装材料 | H273: 140.29 | I273: -1.9599999999999999e-002 | J273: 1.23e-002 | K273: 7.34 | L273: -8.1000000000000013e-003 | M273: 110.3 | N273: 5.31 | O273: 1.4999999999999999e-002 | P273: 138.23 | Q273: 转股中 | R273: 3.70年 | S273: 1.70年 | T273: 1.29 | U273: 193 | V273: 1.0600000000000001 | W273: 2.6000000000000002e-002 | X273: 3.6000000000000004e-002 | Y273: 50 | Z273: 1.45 | AA273: -6.4000000000000001e-002 | AB273: -6.8600000000000008e-002 | AC273: -0.129 | AD273: -0.13 | AE273: 91.6 | AF273: 87.99 | AG273: 0.91 | AH273: AA- | AI273: 6.4299999999999996e-002 | AJ273: =H273+100*O273 -> 141.78999999999999 | AK273: 142.4 | AL273: 210 | AM273: 50.8 | AN273: 210 | AO273: 5.7000000000000002e-002 | AP273: 18 | AQ273: 万顺转债
A274: 308 | B274: 113008 | C274: 电气转债! | D274: 601727 | E274: 上海电气 | F274: 能源电力 | G274: 电力设备 | H274: 108.3 | I274: -2.e-003 | J274: 1.6000000000000001e-003 | K274: 5.08 | L274: -2.e-003 | M274: 106.6 | N274: 5.13 | O274: 9.4e-002 | P274: 99.03 | Q274: 转股中 | R274: 0.24年 | S274: 回售中 | T274: 44.1 | U274: 23 | V274: 5.0000000000000001e-003 | W274: 5.7000000000000002e-002 | X274: 5.7000000000000002e-002 | Y274: 770 | Z274: 1.19 | AA274: -6.4199999999999993e-002 | AB274: -0.11199999999999999 | AC274: 回售中 | AD274: 回售中 | AE274: 103 | AF274: 105.74 | AG274: 0.2 | AH274: AAA | AI274: 3.4500000000000003e-002 | AJ274: =H274+100*O274 -> 117.7 | AK274: 117.6 | AL274: 3 | AM274: 11.8 | AN274: 1 | AO274: -1.3000000000000001e-002 | AP274: 30 | AQ274: 电气转债!
A275: 161 | B275: 113550 | C275: 常汽转债! | D275: 603035 | E275: 常熟汽饰 | F275: 汽车 | G275: 零部件制 | H275: 169.4 | I275: -1.7299999999999999e-002 | J275: 4.8999999999999998e-003 | K275: 16.53 | L275: -1.3100000000000001e-002 | M275: 121.8 | N275: 9.65 | O275: -1.1000000000000001e-002 | P275: 171.3 | Q275: 转股中 | R275: 5年11天 | S275: 3年11天 | T275: 4.47 | U275: 158 | V275: 0.20600000000000002 | W275: 8.1000000000000003e-002 | X275: 0.13800000000000001 | Y275: 55 | Z275: 1.66 | AA275: -6.4899999999999999e-002 | AB275: -7.1500000000000008e-002 | AC275: -0.13800000000000001 | AD275: -0.14000000000000001 | AE275: 85.54 | AF275: 88.92 | AG275: 0.94 | AH275: AA- | AI275: 6.6400000000000001e-002 | AJ275: =H275+100*O275 -> 168.30000000000001 | AK275: 167.5 | AL275: 272 | AM275: 78.6 | AN275: 278 | AO275: 9.6999999999999989e-002 | AP275: 15 | AQ275: 常汽转债!
A276: 181 | B276: 123030 | C276: 九洲转债! | D276: 300040 | E276: 九洲集团 | F276: 能源电力 | G276: 电力设备 | H276: 166 | I276: -8.1900000000000001e-002 | J276: -1.1699999999999999e-002 | K276: 9.2 | L276: -9.3599999999999989e-002 | M276: 120 | N276: 5.65 | O276: 1.9e-002 | P276: 162.83 | Q276: 转股中 | R276: 4.78年 | S276: 2.78年 | T276: 1.14 | U276: 427 | V276: 2.1899999999999999 | W276: 3.3000000000000002e-002 | X276: 5.4000000000000006e-002 | Y276: 35 | Z276: 1.6 | AA276: -6.6600000000000006e-002 | AB276: -7.3099999999999998e-002 | AC276: -0.14599999999999999 | AD276: -0.14800000000000002 | AE276: 86.28 | AF276: 89.58 | AG276: 1 | AH276: AA- | AI276: 6.4299999999999996e-002 | AJ276: =H276+100*O276 -> 167.90000000000001 | AK276: 169.2 | AL276: 276 | AM276: 79.6 | AN276: 281 | AO276: -2.5000000000000001e-002 | AP276: 29 | AQ276: 九洲转债!
A277: 227 | B277: 128053 | C277: 尚荣转债! | D277: 2551 | E277: 尚荣医疗 | F277: 医药 | G277: 医疗器械 | H277: 155.6 | I277: -1.7100000000000001e-002 | J277: 1.e-004 | K277: 6.94 | L277: -1.7000000000000001e-002 | M277: 114.9 | N277: 4.89 | O277: 9.6000000000000002e-002 | P277: 141.92 | Q277: 转股中 | R277: 4.27年 | S277: 2.27年 | T277: 1.91 | U277: 136 | V277: 0.45799999999999996 | W277: 3.4000000000000002e-002 | X277: 4.8000000000000001e-002 | Y277: 57 | Z277: 1.92 | AA277: -6.9800000000000001e-002 | AB277: -7.5300000000000006e-002 | AC277: -0.114 | AD277: -0.11599999999999999 | AE277: 93.35 | AF277: 96.24 | AG277: 1 | AH277: AA | AI277: 4.3299999999999998e-002 | AJ277: =H277+100*O277 -> 165.19999999999999 | AK277: 169.3 | AL277: 277 | AM277: 73 | AN277: 272 | AO277: -6.8000000000000005e-002 | AP277: 27 | AQ277: 尚荣转债!
A278: 192 | B278: 123027 | C278: 蓝晓转债! | D278: 300487 | E278: 蓝晓科技 | F278: 化工 | G278: 化工 | H278: 165.5 | I278: -6.5000000000000002e-002 | J278: 3.0800000000000001e-002 | K278: 46.4 | L278: -3.6299999999999999e-002 | M278: 119.5 | N278: 29.33 | O278: 4.5999999999999999e-002 | P278: 158.2 | Q278: 转股中 | R278: 4.59年 | S278: 2.59年 | T278: 1.08 | U278: 657 | V278: 3.4399999999999999 | W278: 1.1000000000000001e-002 | X278: 1.7000000000000001e-002 | Y278: 100 | Z278: 6.27 | AA278: -6.9900000000000004e-002 | AB278: -7.6499999999999999e-002 | AC278: -0.106 | AD278: -0.10800000000000001 | AE278: 85.68 | AF278: 86.36 | AG278: 0.94 | AH278: A+ | AI278: 7.5300000000000006e-002 | AJ278: =H278+100*O278 -> 170.09999999999999 | AK278: 172.8 | AL278: 280 | AM278: 86.4 | AN278: 283 | AO278: -3.5000000000000003e-002 | AP278: 21 | AQ278: 蓝晓转债!
A279: 110 | B279: 128102 | C279: 海大转债! | D279: 2311 | E279: 海大集团 | F279: 农业 | G279: 畜牧业 | H279: 170.5 | I279: -3.9399999999999998e-002 | J279: 5.0000000000000001e-003 | K279: 59.7 | L279: -3.44e-002 | M279: 114.1 | N279: 34.74 | O279: -8.0000000000000002e-003 | P279: 171.85 | Q279: 转股中 | R279: 5.36年 | S279: 4.36年 | T279: 14.2 | U279: 281 | V279: 0.11599999999999999 | W279: 1.4999999999999999e-002 | X279: 2.5000000000000001e-002 | Y279: 961 | Z279: 8.29 | AA279: -7.3099999999999998e-002 | AB279: -7.7300000000000008e-002 | AC279: -0.10300000000000001 | AD279: -0.105 | AE279: 86.35 | AF279: 91.17 | AG279: 1 | AH279: AA+ | AI279: 4.3400000000000001e-002 | AJ279: =H279+100*O279 -> 169.69999999999999 | AK279: 169.2 | AL279: 275 | AM279: 78 | AN279: 276 | AO279: -2.1000000000000001e-002 | AP279: 12 | AQ279: 海大转债!
A280: 157 | B280: 123036 | C280: 先导转债! | D280: 300450 | E280: 先导智能 | F280: 机械装备 | G280: 专用设备 | H280: 170.31 | I280: -1.2699999999999999e-002 | J280: 2.8000000000000004e-003 | K280: 66.8 | L280: -9.8999999999999991e-003 | M280: 115.1 | N280: 38.99 | O280: -6.0000000000000001e-003 | P280: 171.33 | Q280: 转股中 | R280: 5年34天 | S280: 3年34天 | T280: 5.81 | U280: 260 | V280: 0.26400000000000001 | W280: 1.e-002 | X280: 1.7000000000000001e-002 | Y280: 588 | Z280: 13.19 | AA280: -7.5300000000000006e-002 | AB280: -7.9899999999999999e-002 | AC280: -0.13900000000000001 | AD280: -0.14000000000000001 | AE280: 89.78 | AF280: 92.22 | AG280: 1 | AH280: AA | AI280: 4.5400000000000003e-002 | AJ280: =H280+100*O280 -> 169.71000000000001 | AK280: 169.3 | AL280: 278 | AM280: 77.1 | AN280: 275 | AO280: 0.161 | AP280: 17 | AQ280: 先导转债!
A281: 290 | B281: 128019 | C281: 久立转2! | D281: 2318 | E281: 久立特材 | F281: 石油天然 | G281: 石油天然 | H281: 140.701 | I281: 1.3000000000000001e-002 | J281: -7.9000000000000008e-003 | K281: 10.72 | L281: 5.6000000000000008e-003 | M281: 109.8 | N281: 7.62 | O281: 0. | P281: 140.68 | Q281: 转股中 | R281: 3年1.1天 | S281: 1年1.1天 | T281: 8.3 | U281: 156 | V281: 0.13300000000000001 | W281: 9.1999999999999998e-002 | X281: 0.129 | Y281: 90 | Z281: 2.57 | AA281: -8.0799999999999997e-002 | AB281: -8.6099999999999996e-002 | AC281: -0.22899999999999998 | AD281: -0.23199999999999998 | AE281: 97.65 | AF281: 96.95 | AG281: 0.9 | AH281: AA | AI281: 4.3299999999999998e-002 | AJ281: =H281+100*O281 -> 140.70099999999999 | AK281: 140.7 | AL281: 197 | AM281: 43.1 | AN281: 142 | AO281: 0.11900000000000001 | AP281: 13 | AQ281: 久立转2!
A282: 250 | B282: 123014 | C282: 凯发转债! | D282: 300407 | E282: 凯发电气 | F282: 能源电力 | G282: 电力设备 | H282: 136.211 | I282: -4.5999999999999999e-002 | J282: -1.7600000000000001e-002 | K282: 10 | L282: -7.3200000000000001e-002 | M282: 108.5 | N282: 8.12 | O282: 0.106 | P282: 123.15 | Q282: 转股中 | R282: 2.72年 | S282: 0.72年 | T282: 1.16 | U282: 164 | V282: 1.03 | W282: 3.7999999999999999e-002 | X282: 4.7e-002 | Y282: 31 | Z282: 2.26 | AA282: -8.1099999999999992e-002 | AB282: -8.6300000000000002e-002 | AC282: -0.29399999999999998 | AD282: -0.29600000000000004 | AE282: 95.01 | AF282: 89.42 | AG282: 0.87 | AH282: A+ | AI282: 7.4700000000000003e-002 | AJ282: =H282+100*O282 -> 146.81100000000001 | AK282: 149.3 | AL282: 252 | AM282: 54.3 | AN282: 222 | AO282: 1.2e-002 | AP282: 15 | AQ282: 凯发转债!
A283: 216 | B283: 123022 | C283: 长信转债!! | D283: 300088 | E283: 长信科技 | F283: 通信互联 | G283: 通信设备 | H283: 165.6 | I283: -5.9999999999999995e-004 | J283: 4.4000000000000003e-003 | K283: 10.04 | L283: 4.0000000000000001e-003 | M283: 114.9 | N283: 6.15 | O283: 1.3999999999999999e-002 | P283: 163.25 | Q283: 转股中 | R283: 4.36年 | S283: 2.36年 | T283: 2.98 | U283: 32 | V283: 6.5000000000000002e-002 | W283: 1.2e-002 | X283: 2.e-002 | Y283: 246 | Z283: 3.56 | AA283: -8.1799999999999998e-002 | AB283: -8.72e-002 | AC283: -0.122 | AD283: -0.124 | AE283: 93.01 | AF283: 95.88 | AG283: 0.94 | AH283: AA | AI283: 4.3299999999999998e-002 | AJ283: =H283+100*O283 -> 167. | AK283: 167.9 | AL283: 273 | AM283: 72.1 | AN283: 270 | AO283: -2.5000000000000001e-002 | AP283: 12 | AQ283: 长信转债!!
A284: 293 | B284: 128017 | C284: 金禾转债!! | D284: 2597 | E284: 金禾实业 | F284: 化工 | G284: 化工 | H284: 140.724 | I284: -2.e-003 | J284: 3.6600000000000001e-002 | K284: 30.15 | L284: 3.9300000000000002e-002 | M284: 108.8 | N284: 22.42 | O284: 4.5999999999999999e-002 | P284: 134.48 | Q284: 转股中 | R284: 2.98年 | S284: 0.98年 | T284: 5.54 | U284: 174 | V284: 0.214 | W284: 3.3000000000000002e-002 | X284: 4.4000000000000004e-002 | Y284: 169 | Z284: 3.67 | AA284: -8.3599999999999994e-002 | AB284: -8.8399999999999992e-002 | AC284: -0.23800000000000002 | AD284: -0.23999999999999999 | AE284: 96.79 | AF284: 96.19 | AG284: 0.88 | AH284: AA | AI284: 4.2699999999999995e-002 | AJ284: =H284+100*O284 -> 145.32399999999998 | AK284: 147 | AL284: 239 | AM284: 50.2 | AN284: 206 | AO284: -5.4000000000000006e-002 | AP284: 10 | AQ284: 金禾转债!!
A285: 84 | B285: 113582 | C285: 火炬转债 | D285: 603678 | E285: 火炬电子 | F285: 电子 | G285: 元器件制 | H285: 192.96 | I285: -1.8799999999999997e-002 | J285: -1.5e-003 | K285: 49.84 | L285: -2.1000000000000001e-002 | M285: 115.3 | N285: 25.33 | O285: -1.9e-002 | P285: 196.76 | Q285: 25天 | R285: 5.55年 | S285: 3.55年 | T285: 6 | U285: 51 | V285: 4.4000000000000004e-002 | W285: 2.7000000000000003e-002 | X285: 5.2000000000000005e-002 | Y285: 226 | Z285: 6.5 | AA285: -8.9999999999999997e-002 | AB285: -9.4200000000000006e-002 | AC285: -0.14800000000000002 | AD285: -0.14899999999999999 | AE285: 88.15 | AF285: 90.56 | AG285: 0.97 | AH285: AA | AI285: 4.5400000000000003e-002 | AJ285: =H285+100*O285 -> 191.06 | AK285: 189.2 | AL285: 288 | AM285: 98.6 | AN285: 288 | AO285: 5.5999999999999994e-002 | AP285: 5 | AQ285: 火炬转债
A286: 185 | B286: 113543 | C286: 欧派转债! | D286: 603833 | E286: 欧派家居 | F286: 其他 | G286: 家居用品 | H286: 183.45 | I286: 1.3000000000000001e-002 | J286: 4.0999999999999995e-003 | K286: 132.37 | L286: 1.78e-002 | M286: 114.9 | N286: 71.69 | O286: -6.0000000000000001e-003 | P286: 184.64 | Q286: 转股中 | R286: 4.77年 | S286: 3.77年 | T286: 7.3 | U286: 76 | V286: 5.7000000000000002e-002 | W286: 9.0000000000000011e-003 | X286: 1.7000000000000001e-002 | Y286: 789 | Z286: 7.3 | AA286: -9.4800000000000009e-002 | AB286: -9.9600000000000008e-002 | AC286: -0.127 | AD286: -0.129 | AE286: 89.27 | AF286: 94.22 | AG286: 0.96 | AH286: AA | AI286: 4.3299999999999998e-002 | AJ286: =H286+100*O286 -> 182.84999999999999 | AK286: 182.3 | AL286: 286 | AM286: 88 | AN286: 284 | AO286: 0.109 | AP286: 15 | AQ286: 欧派转债!
A287: 69 | B287: 128112 | C287: 歌尔转2 | D287: 2241 | E287: 歌尔股份 | F287: 电子 | G287: 电子产品 | H287: 199.1 | I287: -4.5000000000000005e-003 | J287: 4.5000000000000005e-003 | K287: 48 | L287: 0. | M287: 114.5 | N287: 23.27 | O287: -3.5000000000000003e-002 | P287: 206.27 | Q287: 41天 | R287: 5.59年 | S287: 3.59年 | T287: 40 | U287: 435 | V287: 5.4000000000000006e-002 | W287: 2.6000000000000002e-002 | X287: 5.2999999999999999e-002 | Y287: 1558. | Z287: 8.91 | AA287: -9.5299999999999996e-002 | AB287: -9.9199999999999997e-002 | AC287: -0.153 | AD287: -0.154 | AE287: 87.87 | AF287: 90.59 | AG287: 0.97 | AH287: AA+ | AI287: 4.3400000000000001e-002 | AJ287: =H287+100*O287 -> 195.59999999999999 | AK287: 191.9 | AL287: 289 | AM287: 101.3 | AN287: 289 | AO287: 8.8000000000000009e-002 | AP287: 16 | AQ287: 歌尔转2
A288: 165 | B288: 123034 | C288: 通光转债! | D288: 300265 | E288: 通光线缆 | F288: 通信互联 | G288: 通信设备 | H288: 200.5 | I288: 4.4299999999999999e-002 | J288: -8.5000000000000006e-003 | K288: 12.66 | L288: 3.7699999999999997e-002 | M288: 118 | N288: 7.97 | O288: 0.26200000000000001 | P288: 158.85 | Q288: 转股中 | R288: 4.99年 | S288: 2.99年 | T288: 0.78 | U288: 2941. | V288: 17.93 | W288: 1.7000000000000001e-002 | X288: 2.7000000000000003e-002 | Y288: 46 | Z288: 3.68 | AA288: -0.10199999999999999 | AB288: -0.10800000000000001 | AC288: -0.11599999999999999 | AD288: -0.11599999999999999 | AE288: 82.47 | AF288: 82.7 | AG288: 0.95 | AH288: A+ | AI288: 7.5300000000000006e-002 | AJ288: =H288+100*O288 -> 226.69999999999999 | AK288: 242.2 | AL288: 295 | AM288: 159.5 | AN288: 297 | AO288: -1.9e-002 | AP288: 25 | AQ288: 通光转债!
A289: 63 | B289: 128115 | C289: 巨星转债 | D289: 2444 | E289: 巨星科技 | F289: 机械装备 | G289: 通用设备 | H289: 216.5 | I289: 2.3e-003 | J289: 1.6799999999999999e-002 | K289: 28.66 | L289: 1.9599999999999999e-002 | M289: 115.3 | N289: 12.28 | O289: -7.2000000000000008e-002 | P289: 233.39 | Q289: 58天 | R289: 5.63年 | S289: 3.63年 | T289: 9.73 | U289: 311 | V289: 0.14599999999999999 | W289: 3.2000000000000001e-002 | X289: 7.400000000000001e-002 | Y289: 308 | Z289: 3.63 | AA289: -0.10800000000000001 | AB289: -0.11199999999999999 | AC289: -0.16200000000000001 | AD289: -0.16399999999999998 | AE289: 90.13 | AF289: 90.25 | AG289: 0.98 | AH289: AA | AI289: 4.5400000000000003e-002 | AJ289: =H289+100*O289 -> 209.30000000000001 | AK289: 199.6 | AL289: 290 | AM289: 109.4 | AN289: 290 | AO289: 0.21600000000000003 | AP289: 4 | AQ289: 巨星转债
A290: 242 | B290: 113521 | C290: 科森转债!! | D290: 603626 | E290: 科森科技 | F290: 通信互联 | G290: 通信设备 | H290: 182.06 | I290: -1.5e-003 | J290: -3.56e-002 | K290: 15.33 | L290: -3.7100000000000001e-002 | M290: 115.2 | N290: 8.7 | O290: 3.3000000000000002e-002 | P290: 176.21 | Q290: 转股中 | R290: 4年9天 | S290: 2年9天 | T290: 0.63 | U290: 67 | V290: 0.58099999999999996 | W290: 8.0000000000000002e-003 | X290: 1.4999999999999999e-002 | Y290: 74 | Z290: 3.4 | AA290: -0.11 | AB290: -0.115 | AC290: -0.17199999999999999 | AD290: -0.17300000000000001 | AE290: 94.47 | AF290: 97.53 | AG290: 1 | AH290: AA | AI290: 4.3299999999999998e-002 | AJ290: =H290+100*O290 -> 185.36000000000001 | AK290: 187.9 | AL290: 287 | AM290: 90.4 | AN290: 286 | AO290: -7.2999999999999995e-002 | AP290: 24 | AQ290: 科森转债!!
A291: 74 | B291: 113586 | C291: 上机转债 | D291: 603185 | E291: 上机数控 | F291: 机械装备 | G291: 专用设备 | H291: 230.92 | I291: -4.7999999999999996e-003 | J291: -6.8999999999999999e-003 | K291: 80.18 | L291: -1.2e-002 | M291: 120.8 | N291: 33.3 | O291: -4.0999999999999995e-002 | P291: 240.78 | Q291: 38天 | R291: 5.59年 | S291: 3.59年 | T291: 6.65 | U291: 76 | V291: 4.9000000000000002e-002 | W291: 3.6000000000000004e-002 | X291: 8.5999999999999993e-002 | Y291: 186 | Z291: 9.27 | AA291: -0.111 | AB291: -0.11699999999999999 | AC291: -0.10099999999999999 | AD291: -0.10199999999999999 | AE291: 82.05 | AF291: 85.02 | AG291: 0.98 | AH291: AA- | AI291: 6.6400000000000001e-002 | AJ291: =H291+100*O291 -> 226.81999999999999 | AK291: 221.1 | AL291: 293 | AM291: 136 | AN291: 294 | AO291: -4.9000000000000002e-002 | AP291: 8 | AQ291: 上机转债
A292: 85 | B292: 113581 | C292: 龙蟠转债 | D292: 603906 | E292: 龙蟠科技 | F292: 化工 | G292: 化工 | H292: 250.77 | I292: -3.0699999999999998e-002 | J292: 1.4999999999999999e-002 | K292: 24.3 | L292: -1.6200000000000003e-002 | M292: 129.6 | N292: 9.48 | O292: -2.2000000000000002e-002 | P292: 256.33 | Q292: 转股中 | R292: 5.46年 | S292: 3.46年 | T292: 1.56 | U292: 182 | V292: 0.46500000000000002 | W292: 2.e-002 | X292: 5.0999999999999997e-002 | Y292: 78 | Z292: 5.02 | AA292: -0.11699999999999999 | AB292: -0.124 | AC292: -0.113 | AD292: -0.114 | AE292: 81.77 | AF292: 87.4 | AG292: 0.97 | AH292: A+ | AI292: 7.7399999999999997e-002 | AJ292: =H292+100*O292 -> 248.57000000000002 | AK292: 245.2 | AL292: 296 | AM292: 157.8 | AN292: 296 | AO292: -2.2000000000000002e-002 | AP292: 15 | AQ292: 龙蟠转债
A293: 83 | B293: 113035 | C293: 福莱转债 | D293: 601865 | E293: 福莱特 | F293: 能源电力 | G293: 太阳能 | H293: 251.33 | I293: -8.3000000000000001e-003 | J293: -3.3099999999999997e-002 | K293: 39.34 | L293: -4.2099999999999999e-002 | M293: 120.3 | N293: 13.56 | O293: -0.13400000000000001 | P293: 290.12 | Q293: 26天 | R293: 5.55年 | S293: 3.55年 | T293: 14.5 | U293: 876 | V293: 0.23800000000000002 | W293: 1.9e-002 | X293: 5.5e-002 | Y293: 769 | Z293: 14.45 | AA293: -0.126 | AB293: -0.13100000000000001 | AC293: -0.11 | AD293: -0.111 | AE293: 88.15 | AF293: 94.46 | AG293: 0.98 | AH293: AA | AI293: 4.5400000000000003e-002 | AJ293: =H293+100*O293 -> 237.93000000000001 | AK293: 212.5 | AL293: 291 | AM293: 118.1 | AN293: 291 | AO293: 5.4000000000000006e-002 | AP293: 7 | AQ293: 福莱转债
A294: 278 | B294: 128030 | C294: 天康转债!! | D294: 2100 | E294: 天康生物 | F294: 农业 | G294: 畜牧业 | H294: 176 | I294: -3.4700000000000002e-002 | J294: 1.32e-002 | K294: 13.69 | L294: -2.1400000000000002e-002 | M294: 112.3 | N294: 7.85 | O294: 9.0000000000000011e-003 | P294: 174.39 | Q294: 转股中 | R294: 3年45天 | S294: 1年45天 | T294: 0.98 | U294: 50 | V294: 0.28300000000000003 | W294: 6.9999999999999993e-003 | X294: 1.2e-002 | Y294: 147 | Z294: 2.46 | AA294: -0.13600000000000001 | AB294: -0.14199999999999999 | AC294: -0.314 | AD294: -0.316 | AE294: 97.39 | AF294: 98.68 | AG294: 1 | AH294: AA | AI294: 4.3299999999999998e-002 | AJ294: =H294+100*O294 -> 176.90000000000001 | AK294: 177.6 | AL294: 285 | AM294: 78.9 | AN294: 279 | AO294: -5.2999999999999999e-002 | AP294: 11 | AQ294: 天康转债!!
A295: 297 | B295: 127004 | C295: 模塑转债!! | D295: 700 | E295: 模塑科技 | F295: 汽车 | G295: 零部件制 | H295: 166 | I295: -4.2099999999999999e-002 | J295: 3.5400000000000001e-002 | K295: 6.27 | L295: -2.4900000000000002e-002 | M295: 113.3 | N295: 7.46 | O295: 0.97499999999999998 | P295: 84.05 | Q295: 转股中 | R295: 2.57年 | S295: 0.57年 | T295: 1.33 | U295: 209 | V295: 0.92900000000000005 | W295: 2.3e-002 | X295: 1.9e-002 | Y295: 57 | Z295: 2.21 | AA295: -0.14000000000000001 | AB295: -0.14800000000000002 | AC295: -0.54299999999999993 | AD295: -0.54600000000000004 | AE295: 98.73 | AF295: 101.95 | AG295: 0.27 | AH295: AA | AI295: 4.2699999999999995e-002 | AJ295: =H295+100*O295 -> 263.5 | AK295: 248 | AL295: 297 | AM295: 146 | AN295: 295 | AO295: 1.e-002 | AP295: 37 | AQ295: 模塑转债!!
A296: 280 | B296: 128028 | C296: 赣锋转债!! | D296: 2460 | E296: 赣锋锂业 | F296: 有色金属 | G296: 小金属 | H296: 178.091 | I296: 2.6499999999999999e-002 | J296: 1.37e-002 | K296: 75.1 | L296: 4.0199999999999993e-002 | M296: 109.3 | N296: 41.68 | O296: -1.2e-002 | P296: 180.18 | Q296: 转股中 | R296: 3年44天 | S296: 1年44天 | T296: 9.16 | U296: 1143. | V296: 0.69499999999999995 | W296: 9.0000000000000011e-003 | X296: 1.6e-002 | Y296: 1001. | Z296: 10.78 | AA296: -0.14699999999999999 | AB296: -0.151 | AC296: -0.32299999999999995 | AD296: -0.32400000000000001 | AE296: 96.68 | AF296: 95.99 | AG296: 1 | AH296: AA | AI296: 4.3299999999999998e-002 | AJ296: =H296+100*O296 -> 176.89100000000002 | AK296: 176 | AL296: 284 | AM296: 79.3 | AN296: 280 | AO296: 0.23300000000000001 | AP296: 14 | AQ296: 赣锋转债!!
A297: 231 | B297: 123018 | C297: 溢利转债! | D297: 300381 | E297: 溢多利 | F297: 医药 | G297: 原料药 | H297: 221 | I297: -5.91e-002 | J297: 4.9100000000000005e-002 | K297: 13.04 | L297: -1.06e-002 | M297: 114.9 | N297: 8.29 | O297: 0.40500000000000003 | P297: 157.3 | Q297: 转股中 | R297: 4年43天 | S297: 2年43天 | T297: 0.54 | U297: 30 | V297: 0.245 | W297: 9.0000000000000011e-003 | X297: 1.3999999999999999e-002 | Y297: 63 | Z297: 2.2 | AA297: -0.14899999999999999 | AB297: -0.154 | AC297: -0.20100000000000001 | AD297: -0.20199999999999999 | AE297: 89.83 | AF297: 89.41 | AG297: 0.94 | AH297: AA- | AI297: 6.4299999999999996e-002 | AJ297: =H297+100*O297 -> 261.5 | AK297: 284.7 | AL297: 299 | AM297: 194.9 | AN297: 299 | AO297: -5.5999999999999994e-002 | AP297: 13 | AQ297: 溢利转债!
A298: 179 | B298: 123031 | C298: 晶瑞转债! | D298: 300655 | E298: 晶瑞股份 | F298: 化工 | G298: 化工 | H298: 250 | I298: 2.9700000000000001e-002 | J298: -1.26e-002 | K298: 39.37 | L298: 1.7600000000000001e-002 | M298: 115.8 | N298: 18.43 | O298: 0.17000000000000001 | P298: 213.62 | Q298: 转股中 | R298: 4.81年 | S298: 2.81年 | T298: 0.63 | U298: 1323. | V298: 8.3699999999999992 | W298: 8.0000000000000002e-003 | X298: 1.8000000000000002e-002 | Y298: 74 | Z298: 5.79 | AA298: -0.14999999999999999 | AB298: -0.154 | AC298: -0.155 | AD298: -0.156 | AE298: 83.39 | AF298: 82.21 | AG298: 0.98 | AH298: A+ | AI298: 7.5300000000000006e-002 | AJ298: =H298+100*O298 -> 267. | AK298: 286.4 | AL298: 300 | AM298: 203 | AN298: 300 | AO298: -5.0000000000000001e-003 | AP298: 15 | AQ298: 晶瑞转债!
A299: 255 | B299: 128041 | C299: 盛路转债!! | D299: 2446 | E299: 盛路通信 | F299: 通信互联 | G299: 通信设备 | H299: 215.82 | I299: -4.9299999999999997e-002 | J299: 4.4199999999999996e-002 | K299: 7.66 | L299: -5.1999999999999998e-003 | M299: 114.3 | N299: 6.85 | O299: 0.93000000000000005 | P299: 111.82 | Q299: 转股中 | R299: 3.69年 | S299: 1.69年 | T299: 0.53 | U299: 665 | V299: 5.54 | W299: 8.0000000000000002e-003 | X299: 9.0000000000000011e-003 | Y299: 69 | Z299: 2.31 | AA299: -0.16 | AB299: -0.16600000000000001 | AC299: -0.25700000000000001 | AD299: -0.25800000000000001 | AE299: 95.07 | AF299: 98.03 | AG299: 0.98 | AH299: AA | AI299: 4.3299999999999998e-002 | AJ299: =H299+100*O299 -> 308.81999999999999 | AK299: 319.8 | AL299: 301 | AM299: 221.8 | AN299: 301 | AO299: 2.8999999999999998e-002 | AP299: 12 | AQ299: 盛路转债!!
A300: 244 | B300: 113520 | C300: 百合转债! | D300: 603313 | E300: 梦百合 | F300: 其他 | G300: 家居用品 | H300: 252.97 | I300: -2.2499999999999999e-002 | J300: 6.0000000000000001e-003 | K300: 36.25 | L300: -1.6799999999999999e-002 | M300: 115.2 | N300: 14.28 | O300: -3.0000000000000001e-003 | P300: 253.85 | Q300: 转股中 | R300: 4年1.1天 | S300: 2年1.1天 | T300: 0.6 | U300: 234 | V300: 1.54 | W300: 5.0000000000000001e-003 | X300: 1.2e-002 | Y300: 125 | Z300: 4.49 | AA300: -0.18100000000000002 | AB300: -0.18600000000000003 | AC300: -0.23899999999999999 | AD300: -0.23999999999999999 | AE300: 90.61 | AF300: 90.32 | AG300: 0.98 | AH300: AA- | AI300: 6.4299999999999996e-002 | AJ300: =H300+100*O300 -> 252.66999999999999 | AK300: 252.1 | AL300: 298 | AM300: 161.5 | AN300: 298 | AO300: 0.16600000000000001 | AP300: 12 | AQ300: 百合转债!
A301: 279 | B301: 128029 | C301: 太阳转债!! | D301: 2078 | E301: 太阳纸业 | F301: 造纸包装 | G301: 造纸行业 | H301: 165.3 | I301: -1.15e-002 | J301: -1.e-004 | K301: 13.67 | L301: -1.1599999999999999e-002 | M301: 107.8 | N301: 8.55 | O301: 3.4000000000000002e-002 | P301: 159.88 | Q301: 转股中 | R301: 2年45天 | S301: 45天 | T301: 10.6 | U301: 26 | V301: 1.4999999999999999e-002 | W301: 2.9999999999999999e-002 | X301: 4.8000000000000001e-002 | Y301: 356 | Z301: 2.31 | AA301: -0.184 | AB301: -0.18899999999999997 | AC301: -1.4419999999999999 | AD301: -1.446 | AE301: 99.81 | AF301: 99.14 | AG301: 1 | AH301: AA+ | AI301: 4.07e-002 | AJ301: =H301+100*O301 -> 168.70000000000002 | AK301: 170.7 | AL301: 279 | AM301: 70.9 | AN301: 268 | AO301: 3.4000000000000002e-002 | AP301: 8 | AQ301: 太阳转债!!
A302: 248 | B302: 123015 | C302: 蓝盾转债!! | D302: 300297 | E302: 蓝盾股份 | F302: 计算机及 | G302: 软件开发 | H302: 245.509 | I302: -7.0000000000000007e-002 | J302: -2.5000000000000001e-003 | K302: 6.38 | L302: -7.5399999999999995e-002 | M302: 112.3 | N302: 5.79 | O302: 1.23 | P302: 110.19 | Q302: 转股中 | R302: 3.76年 | S302: 1.76年 | T302: 1 | U302: 957 | V302: 3.7799999999999998 | W302: 1.3000000000000001e-002 | X302: 1.3999999999999999e-002 | Y302: 80 | Z302: 2.07 | AA302: -0.19 | AB302: -0.19399999999999998 | AC302: -0.27200000000000002 | AD302: -0.27300000000000002 | AE302: 94.78 | AF302: 96.02 | AG302: 0.96 | AH302: AA | AI302: 4.3299999999999998e-002 | AJ302: =H302+100*O302 -> 368.50900000000001 | AK302: 380.8 | AL302: 304 | AM302: 284.8 | AN302: 304 | AO302: -6.7000000000000004e-002 | AP302: 19 | AQ302: 蓝盾转债!!
A303: 262 | B303: 113509 | C303: 新泉转债!! | D303: 603179 | E303: 新泉股份 | F303: 汽车 | G303: 零部件制 | H303: 232.64 | I303: -1.29e-002 | J303: 8.8000000000000005e-003 | K303: 33.44 | L303: -4.1999999999999997e-003 | M303: 110.3 | N303: 14.22 | O303: -1.1000000000000001e-002 | P303: 235.16 | Q303: 转股中 | R303: 3.57年 | S303: 1.57年 | T303: 1.26 | U303: 59 | V303: 0.20100000000000001 | W303: 1.2e-002 | X303: 2.7999999999999997e-002 | Y303: 106 | Z303: 5.01 | AA303: -0.191 | AB303: -0.19500000000000001 | AC303: -0.29699999999999999 | AD303: -0.29799999999999999 | AE303: 95.55 | AF303: 95.09 | AG303: 0.98 | AH303: AA | AI303: 4.3299999999999998e-002 | AJ303: =H303+100*O303 -> 231.53999999999999 | AK303: 230.1 | AL303: 294 | AM303: 134.6 | AN303: 293 | AO303: 3.7999999999999999e-002 | AP303: 10 | AQ303: 新泉转债!!
A304: 230 | B304: 128052 | C304: 凯龙转债! | D304: 2783 | E304: 凯龙股份 | F304: 化工 | G304: 化工 | H304: 273 | I304: -2.5399999999999999e-002 | J304: 3.2500000000000001e-002 | K304: 14.03 | L304: 7.1999999999999998e-003 | M304: 115 | N304: 6.67 | O304: 0.29799999999999999 | P304: 210.34 | Q304: 转股中 | R304: 4年44天 | S304: 2年44天 | T304: 0.32 | U304: 325 | V304: 3.6200000000000001 | W304: 6.0000000000000001e-003 | X304: 1.3000000000000001e-002 | Y304: 53 | Z304: 3.07 | AA304: -0.192 | AB304: -0.19699999999999998 | AC304: -0.23499999999999999 | AD304: -0.23600000000000002 | AE304: 94.05 | AF304: 96.96 | AG304: 1 | AH304: AA | AI304: 4.3299999999999998e-002 | AJ304: =H304+100*O304 -> 302.80000000000001 | AK304: 335.7 | AL304: 303 | AM304: 238.7 | AN304: 303 | AO304: 5.9000000000000004e-002 | AP304: 12 | AQ304: 凯龙转债!
A305: 259 | B305: 110044 | C305: 广电转债!! | D305: 600831 | E305: 广电网络 | F305: 传媒娱乐 | G305: 影视娱乐 | H305: 244.96 | I305: -6.4000000000000003e-003 | J305: -5.0000000000000001e-004 | K305: 7.25 | L305: -1.09e-002 | M305: 112.3 | N305: 6.9 | O305: 1.3300000000000001 | P305: 105.07 | Q305: 转股中 | R305: 3.64年 | S305: 1.64年 | T305: 0.71 | U305: 554 | V305: 3.1099999999999999 | W305: 1.3999999999999999e-002 | X305: 1.3999999999999999e-002 | Y305: 52 | Z305: 1.39 | AA305: -0.19600000000000001 | AB305: -0.20000000000000001 | AC305: -0.29499999999999998 | AD305: -0.29600000000000004 | AE305: 95.29 | AF305: 96.55 | AG305: 0.63 | AH305: AA | AI305: 4.3299999999999998e-002 | AJ305: =H305+100*O305 -> 377.96000000000004 | AK305: 384.8 | AL305: 305 | AM305: 288.3 | AN305: 305 | AO305: -2.3e-002 | AP305: 11 | AQ305: 广电转债!!
A306: 149 | B306: 113555 | C306: 振德转债! | D306: 603301 | E306: 振德医疗 | F306: 医药 | G306: 医疗器械 | H306: 485.42 | I306: -2.86e-002 | J306: -1.1000000000000001e-003 | K306: 68.04 | L306: -3.0099999999999998e-002 | M306: 124.8 | N306: 14.01 | O306: 0. | P306: 485.65 | Q306: 转股中 | R306: 5年42天 | S306: 3年42天 | T306: 1.39 | U306: 486 | V306: 0.71999999999999997 | W306: 9.0000000000000011e-003 | X306: 4.5999999999999999e-002 | Y306: 147 | Z306: 4.11 | AA306: -0.23699999999999999 | AB306: -0.24199999999999999 | AC306: -0.183 | AD306: -0.183 | AE306: 85.08 | AF306: 90.59 | AG306: 0.99 | AH306: AA- | AI306: 6.6400000000000001e-002 | AJ306: =H306+100*O306 -> 485.42000000000002 | AK306: 485.2 | AL306: 306 | AM306: 394.6 | AN306: 306 | AO306: -6.8000000000000005e-002 | AP306: 15 | AQ306: 振德转债!
A307: 252 | B307: 123013 | C307: 横河转债! | D307: 300539 | E307: 横河模具 | F307: 机械装备 | G307: 专用设备 | H307: 322.21 | I307: -3.8199999999999998e-002 | J307: -3.2599999999999997e-002 | K307: 10.02 | L307: -9.2399999999999996e-002 | M307: 115.2 | N307: 9.13 | O307: 1.9399999999999999 | P307: 109.75 | Q307: 转股中 | R307: 3.72年 | S307: 1.72年 | T307: 0.38 | U307: 368 | V307: 2.96 | W307: 1.7000000000000001e-002 | X307: 1.9e-002 | Y307: 22 | Z307: 4.59 | AA307: -0.245 | AB307: -0.25 | AC307: -0.32899999999999996 | AD307: -0.32899999999999996 | AE307: 90.28 | AF307: 88.51 | AG307: 0.77 | AH307: A+ | AI307: 7.5300000000000006e-002 | AJ307: =H307+100*O307 -> 516.21000000000004 | AK307: 534.7 | AL307: 307 | AM307: 444.4 | AN307: 307 | AO307: -4.4999999999999998e-002 | AP307: 15 | AQ307: 横河转债!
A308: 241 | B308: 127008 | C308: 特发转债! | D308: 70 | E308: 特发信息 | F308: 通信互联 | G308: 通信设备 | H308: 256.99 | I308: -8.539999999999999e-002 | J308: 0.10800000000000001 | K308: 10.65 | L308: 2.3099999999999999e-002 | M308: 111.1 | N308: 5.54 | O308: 0.33700000000000002 | P308: 192.24 | Q308: 转股中 | R308: 3年9天 | S308: 1年9天 | T308: 0.59 | U308: 2447. | V308: 14.51 | W308: 6.9999999999999993e-003 | X308: 1.3000000000000001e-002 | Y308: 87 | Z308: 3.07 | AA308: -0.245 | AB308: -0.249 | AC308: -0.498 | AD308: -0.499 | AE308: 96.87 | AF308: 97.94 | AG308: 1 | AH308: AA | AI308: 4.3299999999999998e-002 | AJ308: =H308+100*O308 -> 290.69 | AK308: 321.7 | AL308: 302 | AM308: 223.8 | AN308: 302 | AO308: 5.7999999999999996e-002 | AP308: 15 | AQ308: 特发转债!
A309: 183 | B309: 123029 | C309: 英科转债! | D309: 300677 | E309: 英科医疗 | F309: 医药 | G309: 医疗器械 | H309: 1158.86 | I309: 6.2199999999999998e-002 | J309: 3.2000000000000002e-003 | K309: 120.5 | L309: 6.59e-002 | M309: 138.2 | N309: 10.41 | O309: 1.e-003 | P309: 1157.54 | Q309: 转股中 | R309: 4.77年 | S309: 2.77年 | T309: 1.28 | U309: 1828. | V309: 1.26 | W309: 3.0000000000000001e-003 | X309: 3.7000000000000005e-002 | Y309: 402 | Z309: 4.44 | AA309: -0.36499999999999999 | AB309: -0.37200000000000005 | AC309: -0.248 | AD309: -0.249 | AE309: 89.61 | AF309: 103.68 | AG309: 0.99 | AH309: AA- | AI309: 6.4299999999999996e-002 | AJ309: =H309+100*O309 -> 1158.9599999999998 | AK309: 1160.2 | AL309: 308 | AM309: 1056.5 | AN309: 308 | AO309: 6.0999999999999999e-002 | AP309: 16 | AQ309: 英科转债!